No.,Time,Source,Destination,Protocol,Length,The RTT to ACK the segment was,XXX,Time delta from previous captured frame,Arrival Time,Data,Info
1,0,192.168.11.24,192.168.11.41,TCP,74,,,0,"Jan  6, 2024 19:36:14.789394000 JST",,55836  >  6000 [SYN] Seq=0 Win=64240 Len=0 MSS=1460 SACK_PERM TSval=1999318975 TSecr=0 WS=128
2,0.008507,192.168.11.41,192.168.11.24,TCP,74,0.008507,,0.008507,"Jan  6, 2024 19:36:14.797901000 JST",,"6000  >  55836 [SYN, ACK] Seq=0 Ack=1 Win=65160 Len=0 MSS=1460 SACK_PERM TSval=1627690616 TSecr=1999318975 WS=128"
3,0.008634,192.168.11.24,192.168.11.41,TCP,66,0.000127,,0.000127,"Jan  6, 2024 19:36:14.798028000 JST",,55836  >  6000 [ACK] Seq=1 Ack=1 Win=64256 Len=0 TSval=1999318988 TSecr=1627690616
4,0.00896,192.168.11.24,192.168.11.41,TCP,93,,,0.000326,"Jan  6, 2024 19:36:14.798354000 JST",,"55836  >  6000 [PSH, ACK] Seq=1 Ack=1 Win=64256 Len=27 TSval=1999318989 TSecr=1627690616 [TCP segment of a reassembled PDU]"
5,0.009125,192.168.11.24,192.168.11.41,TCP,66,,,0.000165,"Jan  6, 2024 19:36:14.798519000 JST",,"55836  >  6000 [FIN, ACK] Seq=28 Ack=1 Win=64256 Len=0 TSval=1999318989 TSecr=1627690616"
6,0.016845,192.168.11.41,192.168.11.24,TCP,66,0.007885,,0.00772,"Jan  6, 2024 19:36:14.806239000 JST",,6000  >  55836 [ACK] Seq=1 Ack=28 Win=65152 Len=0 TSval=1627690625 TSecr=1999318989
7,0.019469,192.168.11.41,192.168.11.24,TCP,66,0.010344,,0.002624,"Jan  6, 2024 19:36:14.808863000 JST",,"6000  >  55836 [FIN, ACK] Seq=1 Ack=29 Win=65152 Len=0 TSval=1627690627 TSecr=1999318989"
8,0.019518,192.168.11.24,192.168.11.41,TCP,66,0.000049,,0.000049,"Jan  6, 2024 19:36:14.808912000 JST",,55836  >  6000 [ACK] Seq=29 Ack=2 Win=64256 Len=0 TSval=1999318999 TSecr=1627690627
9,0.052309,192.168.11.24,255.255.255.255,UDP,209,,Ÿ,0.032791,"Jan  6, 2024 19:36:14.841703000 JST",7b2273656d616e74696373223a207b22656e74697479223a2022504944222c202262617365656e74697479223a2022616e79222c2022726f6c65223a2022303032222c20227370617469616c223a2022616e79222c202274656d706f72616c223a2022616e79227d2c20226461746170726f7065727479223a207b22666f726d6174223a2022696e616f6b615f70726f6772616d5f73616d706c655f73656d616e746963227d7d,59508  >  7000 Len=167
10,0.074647,192.168.11.43,192.168.11.24,TCP,74,,œ,0.022338,"Jan  6, 2024 19:36:14.864041000 JST",,56292  >  6000 [SYN] Seq=0 Win=64240 Len=0 MSS=1460 SACK_PERM TSval=4068833132 TSecr=0 WS=128
11,0.074943,192.168.11.24,192.168.11.43,TCP,74,0.000296,,0.000296,"Jan  6, 2024 19:36:14.864337000 JST",,"6000  >  56292 [SYN, ACK] Seq=0 Ack=1 Win=65160 Len=0 MSS=1460 SACK_PERM TSval=2637573205 TSecr=4068833132 WS=128"
12,0.086085,192.168.11.43,192.168.11.24,TCP,66,0.011142,,0.011142,"Jan  6, 2024 19:36:14.875479000 JST",,56292  >  6000 [ACK] Seq=1 Ack=1 Win=64256 Len=0 TSval=4068833153 TSecr=2637573205
13,0.086667,192.168.11.43,192.168.11.24,TCP,93,,,0.000582,"Jan  6, 2024 19:36:14.876061000 JST",,"56292  >  6000 [PSH, ACK] Seq=1 Ack=1 Win=64256 Len=27 TSval=4068833153 TSecr=2637573205 [TCP segment of a reassembled PDU]"
14,0.086742,192.168.11.24,192.168.11.43,TCP,66,0.000075,,0.000075,"Jan  6, 2024 19:36:14.876136000 JST",,6000  >  56292 [ACK] Seq=1 Ack=28 Win=65152 Len=0 TSval=2637573217 TSecr=4068833153
15,0.086816,192.168.11.43,192.168.11.24,TCP,66,,,0.000074,"Jan  6, 2024 19:36:14.876210000 JST",,"56292  >  6000 [FIN, ACK] Seq=28 Ack=1 Win=64256 Len=0 TSval=4068833153 TSecr=2637573205"
16,0.088098,192.168.11.24,192.168.11.43,TCP,66,0.001282,,0.001282,"Jan  6, 2024 19:36:14.877492000 JST",,"6000  >  56292 [FIN, ACK] Seq=1 Ack=29 Win=65152 Len=0 TSval=2637573218 TSecr=4068833153"
17,0.094324,192.168.11.43,192.168.11.24,TCP,66,0.006226,,0.006226,"Jan  6, 2024 19:36:14.883718000 JST",,56292  >  6000 [ACK] Seq=29 Ack=2 Win=64256 Len=0 TSval=4068833165 TSecr=2637573218
18,8.240855,192.168.11.24,192.168.11.41,TCP,74,,,8.146531,"Jan  6, 2024 19:36:23.030249000 JST",,55850  >  6000 [SYN] Seq=0 Win=64240 Len=0 MSS=1460 SACK_PERM TSval=1999327221 TSecr=0 WS=128
19,8.24977,192.168.11.41,192.168.11.24,TCP,74,0.008915,,0.008915,"Jan  6, 2024 19:36:23.039164000 JST",,"6000  >  55850 [SYN, ACK] Seq=0 Ack=1 Win=65160 Len=0 MSS=1460 SACK_PERM TSval=1627698857 TSecr=1999327221 WS=128"
20,8.249873,192.168.11.24,192.168.11.41,TCP,66,0.000103,,0.000103,"Jan  6, 2024 19:36:23.039267000 JST",,55850  >  6000 [ACK] Seq=1 Ack=1 Win=64256 Len=0 TSval=1999327230 TSecr=1627698857
21,8.250071,192.168.11.24,192.168.11.41,TCP,93,,,0.000198,"Jan  6, 2024 19:36:23.039465000 JST",,"55850  >  6000 [PSH, ACK] Seq=1 Ack=1 Win=64256 Len=27 TSval=1999327230 TSecr=1627698857 [TCP segment of a reassembled PDU]"
22,8.250197,192.168.11.24,192.168.11.41,TCP,66,,,0.000126,"Jan  6, 2024 19:36:23.039591000 JST",,"55850  >  6000 [FIN, ACK] Seq=28 Ack=1 Win=64256 Len=0 TSval=1999327230 TSecr=1627698857"
23,8.257585,192.168.11.41,192.168.11.24,TCP,66,0.007514,,0.007388,"Jan  6, 2024 19:36:23.046979000 JST",,6000  >  55850 [ACK] Seq=1 Ack=28 Win=65152 Len=0 TSval=1627698866 TSecr=1999327230
24,8.25796,192.168.11.41,192.168.11.24,TCP,66,0.007763,,0.000375,"Jan  6, 2024 19:36:23.047354000 JST",,"6000  >  55850 [FIN, ACK] Seq=1 Ack=29 Win=65152 Len=0 TSval=1627698867 TSecr=1999327230"
25,8.258007,192.168.11.24,192.168.11.41,TCP,66,0.000047,,0.000047,"Jan  6, 2024 19:36:23.047401000 JST",,55850  >  6000 [ACK] Seq=29 Ack=2 Win=64256 Len=0 TSval=1999327238 TSecr=1627698867
26,8.290027,192.168.11.24,255.255.255.255,UDP,209,,Ÿ,0.03202,"Jan  6, 2024 19:36:23.079421000 JST",7b2273656d616e74696373223a207b22656e74697479223a2022504944222c202262617365656e74697479223a2022616e79222c2022726f6c65223a2022303032222c20227370617469616c223a2022616e79222c202274656d706f72616c223a2022616e79227d2c20226461746170726f7065727479223a207b22666f726d6174223a2022696e616f6b615f70726f6772616d5f73616d706c655f73656d616e746963227d7d,46593  >  7000 Len=167
27,8.299148,192.168.11.43,192.168.11.24,TCP,74,,œ,0.009121,"Jan  6, 2024 19:36:23.088542000 JST",,49606  >  6000 [SYN] Seq=0 Win=64240 Len=0 MSS=1460 SACK_PERM TSval=4068841369 TSecr=0 WS=128
28,8.299297,192.168.11.24,192.168.11.43,TCP,74,0.000149,,0.000149,"Jan  6, 2024 19:36:23.088691000 JST",,"6000  >  49606 [SYN, ACK] Seq=0 Ack=1 Win=65160 Len=0 MSS=1460 SACK_PERM TSval=2637581429 TSecr=4068841369 WS=128"
29,8.311238,192.168.11.43,192.168.11.24,TCP,66,0.011941,,0.011941,"Jan  6, 2024 19:36:23.100632000 JST",,"[TCP Previous segment not captured] 49606  >  6000 [FIN, ACK] Seq=28 Ack=1 Win=64256 Len=0 TSval=4068841378 TSecr=2637581429"
30,8.311537,192.168.11.24,192.168.11.43,TCP,78,,,0.000299,"Jan  6, 2024 19:36:23.100931000 JST",,[TCP Window Update] 6000  >  49606 [ACK] Seq=1 Ack=1 Win=65280 Len=0 TSval=2637581441 TSecr=4068841369 SLE=28 SRE=29
31,8.325026,192.168.11.43,192.168.11.24,TCP,93,,,0.013489,"Jan  6, 2024 19:36:23.114420000 JST",,"[TCP Retransmission] 49606  >  6000 [PSH, ACK] Seq=1 Ack=1 Win=64256 Len=27 TSval=4068841396 TSecr=2637581441"
32,8.32516,192.168.11.24,192.168.11.43,TCP,66,0.013922,,0.000134,"Jan  6, 2024 19:36:23.114554000 JST",,6000  >  49606 [ACK] Seq=1 Ack=29 Win=65280 Len=0 TSval=2637581455 TSecr=4068841396
33,8.32639,192.168.11.24,192.168.11.43,TCP,66,,,0.00123,"Jan  6, 2024 19:36:23.115784000 JST",,"6000  >  49606 [FIN, ACK] Seq=1 Ack=29 Win=65280 Len=0 TSval=2637581456 TSecr=4068841396"
34,8.332832,192.168.11.43,192.168.11.24,TCP,66,0.006442,,0.006442,"Jan  6, 2024 19:36:23.122226000 JST",,49606  >  6000 [ACK] Seq=29 Ack=2 Win=64256 Len=0 TSval=4068841403 TSecr=2637581456
35,19.106546,192.168.11.24,192.168.11.41,TCP,74,,,10.773714,"Jan  6, 2024 19:36:33.895940000 JST",,45822  >  6000 [SYN] Seq=0 Win=64240 Len=0 MSS=1460 SACK_PERM TSval=1999338086 TSecr=0 WS=128
36,19.115023,192.168.11.41,192.168.11.24,TCP,74,0.008477,,0.008477,"Jan  6, 2024 19:36:33.904417000 JST",,"6000  >  45822 [SYN, ACK] Seq=0 Ack=1 Win=65160 Len=0 MSS=1460 SACK_PERM TSval=1627709722 TSecr=1999338086 WS=128"
37,19.115133,192.168.11.24,192.168.11.41,TCP,66,0.00011,,0.00011,"Jan  6, 2024 19:36:33.904527000 JST",,45822  >  6000 [ACK] Seq=1 Ack=1 Win=64256 Len=0 TSval=1999338095 TSecr=1627709722
38,19.115409,192.168.11.24,192.168.11.41,TCP,93,,,0.000276,"Jan  6, 2024 19:36:33.904803000 JST",,"45822  >  6000 [PSH, ACK] Seq=1 Ack=1 Win=64256 Len=27 TSval=1999338095 TSecr=1627709722 [TCP segment of a reassembled PDU]"
39,19.115516,192.168.11.24,192.168.11.41,TCP,66,,,0.000107,"Jan  6, 2024 19:36:33.904910000 JST",,"45822  >  6000 [FIN, ACK] Seq=28 Ack=1 Win=64256 Len=0 TSval=1999338095 TSecr=1627709722"
40,19.123327,192.168.11.41,192.168.11.24,TCP,66,0.007918,,0.007811,"Jan  6, 2024 19:36:33.912721000 JST",,6000  >  45822 [ACK] Seq=1 Ack=28 Win=65152 Len=0 TSval=1627709732 TSecr=1999338095
41,19.125666,192.168.11.41,192.168.11.24,TCP,66,0.01015,,0.002339,"Jan  6, 2024 19:36:33.915060000 JST",,"6000  >  45822 [FIN, ACK] Seq=1 Ack=29 Win=65152 Len=0 TSval=1627709734 TSecr=1999338095"
42,19.125745,192.168.11.24,192.168.11.41,TCP,66,0.000079,,0.000079,"Jan  6, 2024 19:36:33.915139000 JST",,45822  >  6000 [ACK] Seq=29 Ack=2 Win=64256 Len=0 TSval=1999338106 TSecr=1627709734
43,19.156447,192.168.11.24,255.255.255.255,UDP,209,,Ÿ,0.030702,"Jan  6, 2024 19:36:33.945841000 JST",7b2273656d616e74696373223a207b22656e74697479223a2022504944222c202262617365656e74697479223a2022616e79222c2022726f6c65223a2022303032222c20227370617469616c223a2022616e79222c202274656d706f72616c223a2022616e79227d2c20226461746170726f7065727479223a207b22666f726d6174223a2022696e616f6b615f70726f6772616d5f73616d706c655f73656d616e746963227d7d,58479  >  7000 Len=167
44,19.166715,192.168.11.43,192.168.11.24,TCP,74,,œ,0.010268,"Jan  6, 2024 19:36:33.956109000 JST",,43274  >  6000 [SYN] Seq=0 Win=64240 Len=0 MSS=1460 SACK_PERM TSval=4068852237 TSecr=0 WS=128
45,19.166878,192.168.11.24,192.168.11.43,TCP,74,0.000163,,0.000163,"Jan  6, 2024 19:36:33.956272000 JST",,"6000  >  43274 [SYN, ACK] Seq=0 Ack=1 Win=65160 Len=0 MSS=1460 SACK_PERM TSval=2637592297 TSecr=4068852237 WS=128"
46,19.186924,192.168.11.43,192.168.11.24,TCP,66,0.020046,,0.020046,"Jan  6, 2024 19:36:33.976318000 JST",,43274  >  6000 [ACK] Seq=1 Ack=1 Win=64256 Len=0 TSval=4068852248 TSecr=2637592297
47,19.187459,192.168.11.43,192.168.11.24,TCP,93,,,0.000535,"Jan  6, 2024 19:36:33.976853000 JST",,"43274  >  6000 [PSH, ACK] Seq=1 Ack=1 Win=64256 Len=27 TSval=4068852248 TSecr=2637592297 [TCP segment of a reassembled PDU]"
48,19.187539,192.168.11.24,192.168.11.43,TCP,66,0.00008,,0.00008,"Jan  6, 2024 19:36:33.976933000 JST",,6000  >  43274 [ACK] Seq=1 Ack=28 Win=65152 Len=0 TSval=2637592317 TSecr=4068852248
49,19.187619,192.168.11.43,192.168.11.24,TCP,66,,,0.00008,"Jan  6, 2024 19:36:33.977013000 JST",,"43274  >  6000 [FIN, ACK] Seq=28 Ack=1 Win=64256 Len=0 TSval=4068852248 TSecr=2637592297"
50,19.188636,192.168.11.24,192.168.11.43,TCP,66,0.001017,,0.001017,"Jan  6, 2024 19:36:33.978030000 JST",,"6000  >  43274 [FIN, ACK] Seq=1 Ack=29 Win=65152 Len=0 TSval=2637592318 TSecr=4068852248"
51,19.195351,192.168.11.43,192.168.11.24,TCP,66,0.006715,,0.006715,"Jan  6, 2024 19:36:33.984745000 JST",,43274  >  6000 [ACK] Seq=29 Ack=2 Win=64256 Len=0 TSval=4068852266 TSecr=2637592318
52,28.013567,192.168.11.24,192.168.11.41,TCP,74,,,8.818216,"Jan  6, 2024 19:36:42.802961000 JST",,46996  >  6000 [SYN] Seq=0 Win=64240 Len=0 MSS=1460 SACK_PERM TSval=1999346993 TSecr=0 WS=128
53,28.021972,192.168.11.41,192.168.11.24,TCP,74,0.008405,,0.008405,"Jan  6, 2024 19:36:42.811366000 JST",,"6000  >  46996 [SYN, ACK] Seq=0 Ack=1 Win=65160 Len=0 MSS=1460 SACK_PERM TSval=1627718629 TSecr=1999346993 WS=128"
54,28.022089,192.168.11.24,192.168.11.41,TCP,66,0.000117,,0.000117,"Jan  6, 2024 19:36:42.811483000 JST",,46996  >  6000 [ACK] Seq=1 Ack=1 Win=64256 Len=0 TSval=1999347002 TSecr=1627718629
55,28.022291,192.168.11.24,192.168.11.41,TCP,93,,,0.000202,"Jan  6, 2024 19:36:42.811685000 JST",,"46996  >  6000 [PSH, ACK] Seq=1 Ack=1 Win=64256 Len=27 TSval=1999347002 TSecr=1627718629 [TCP segment of a reassembled PDU]"
56,28.022401,192.168.11.24,192.168.11.41,TCP,66,,,0.00011,"Jan  6, 2024 19:36:42.811795000 JST",,"46996  >  6000 [FIN, ACK] Seq=28 Ack=1 Win=64256 Len=0 TSval=1999347002 TSecr=1627718629"
57,28.029745,192.168.11.41,192.168.11.24,TCP,66,0.007454,,0.007344,"Jan  6, 2024 19:36:42.819139000 JST",,6000  >  46996 [ACK] Seq=1 Ack=28 Win=65152 Len=0 TSval=1627718638 TSecr=1999347002
58,28.030118,192.168.11.41,192.168.11.24,TCP,66,0.007717,,0.000373,"Jan  6, 2024 19:36:42.819512000 JST",,"6000  >  46996 [FIN, ACK] Seq=1 Ack=29 Win=65152 Len=0 TSval=1627718639 TSecr=1999347002"
59,28.030162,192.168.11.24,192.168.11.41,TCP,66,0.000044,,0.000044,"Jan  6, 2024 19:36:42.819556000 JST",,46996  >  6000 [ACK] Seq=29 Ack=2 Win=64256 Len=0 TSval=1999347010 TSecr=1627718639
60,28.062569,192.168.11.24,255.255.255.255,UDP,209,,Ÿ,0.032407,"Jan  6, 2024 19:36:42.851963000 JST",7b2273656d616e74696373223a207b22656e74697479223a2022504944222c202262617365656e74697479223a2022616e79222c2022726f6c65223a2022303032222c20227370617469616c223a2022616e79222c202274656d706f72616c223a2022616e79227d2c20226461746170726f7065727479223a207b22666f726d6174223a2022696e616f6b615f70726f6772616d5f73616d706c655f73656d616e746963227d7d,39885  >  7000 Len=167
61,28.071135,192.168.11.43,192.168.11.24,TCP,74,,œ,0.008566,"Jan  6, 2024 19:36:42.860529000 JST",,48822  >  6000 [SYN] Seq=0 Win=64240 Len=0 MSS=1460 SACK_PERM TSval=4068861141 TSecr=0 WS=128
62,28.071268,192.168.11.24,192.168.11.43,TCP,74,0.000133,,0.000133,"Jan  6, 2024 19:36:42.860662000 JST",,"6000  >  48822 [SYN, ACK] Seq=0 Ack=1 Win=65160 Len=0 MSS=1460 SACK_PERM TSval=2637601201 TSecr=4068861141 WS=128"
63,28.079193,192.168.11.43,192.168.11.24,TCP,93,0.007925,,0.007925,"Jan  6, 2024 19:36:42.868587000 JST",,"48822  >  6000 [PSH, ACK] Seq=1 Ack=1 Win=64256 Len=27 TSval=4068861150 TSecr=2637601201 [TCP segment of a reassembled PDU]"
64,28.079461,192.168.11.24,192.168.11.43,TCP,66,0.000268,,0.000268,"Jan  6, 2024 19:36:42.868855000 JST",,6000  >  48822 [ACK] Seq=1 Ack=28 Win=65152 Len=0 TSval=2637601209 TSecr=4068861150
65,28.07983,192.168.11.43,192.168.11.24,TCP,66,,,0.000369,"Jan  6, 2024 19:36:42.869224000 JST",,48822  >  6000 [ACK] Seq=1 Ack=1 Win=64256 Len=0 TSval=4068861150 TSecr=2637601201
66,28.079875,192.168.11.24,192.168.11.43,TCP,66,,,0.000045,"Jan  6, 2024 19:36:42.869269000 JST",,[TCP Dup ACK 64#1] 6000  >  48822 [ACK] Seq=1 Ack=28 Win=65152 Len=0 TSval=2637601210 TSecr=4068861150
67,28.079927,192.168.11.43,192.168.11.24,TCP,66,,,0.000052,"Jan  6, 2024 19:36:42.869321000 JST",,"48822  >  6000 [FIN, ACK] Seq=28 Ack=1 Win=64256 Len=0 TSval=4068861150 TSecr=2637601201"
68,28.08109,192.168.11.24,192.168.11.43,TCP,66,0.001163,,0.001163,"Jan  6, 2024 19:36:42.870484000 JST",,"6000  >  48822 [FIN, ACK] Seq=1 Ack=29 Win=65152 Len=0 TSval=2637601211 TSecr=4068861150"
69,28.088616,192.168.11.43,192.168.11.24,TCP,66,0.007526,,0.007526,"Jan  6, 2024 19:36:42.878010000 JST",,48822  >  6000 [ACK] Seq=29 Ack=2 Win=64256 Len=0 TSval=4068861158 TSecr=2637601211
70,35.829019,192.168.11.24,192.168.11.41,TCP,74,,,7.740403,"Jan  6, 2024 19:36:50.618413000 JST",,48476  >  6000 [SYN] Seq=0 Win=64240 Len=0 MSS=1460 SACK_PERM TSval=1999354809 TSecr=0 WS=128
71,35.837906,192.168.11.41,192.168.11.24,TCP,74,0.008887,,0.008887,"Jan  6, 2024 19:36:50.627300000 JST",,"6000  >  48476 [SYN, ACK] Seq=0 Ack=1 Win=65160 Len=0 MSS=1460 SACK_PERM TSval=1627726445 TSecr=1999354809 WS=128"
72,35.838018,192.168.11.24,192.168.11.41,TCP,66,0.000112,,0.000112,"Jan  6, 2024 19:36:50.627412000 JST",,48476  >  6000 [ACK] Seq=1 Ack=1 Win=64256 Len=0 TSval=1999354818 TSecr=1627726445
73,35.838204,192.168.11.24,192.168.11.41,TCP,93,,,0.000186,"Jan  6, 2024 19:36:50.627598000 JST",,"48476  >  6000 [PSH, ACK] Seq=1 Ack=1 Win=64256 Len=27 TSval=1999354818 TSecr=1627726445 [TCP segment of a reassembled PDU]"
74,35.838298,192.168.11.24,192.168.11.41,TCP,66,,,0.000094,"Jan  6, 2024 19:36:50.627692000 JST",,"48476  >  6000 [FIN, ACK] Seq=28 Ack=1 Win=64256 Len=0 TSval=1999354818 TSecr=1627726445"
75,35.845726,192.168.11.41,192.168.11.24,TCP,66,0.007522,,0.007428,"Jan  6, 2024 19:36:50.635120000 JST",,6000  >  48476 [ACK] Seq=1 Ack=28 Win=65152 Len=0 TSval=1627726454 TSecr=1999354818
76,35.845948,192.168.11.41,192.168.11.24,TCP,66,0.00765,,0.000222,"Jan  6, 2024 19:36:50.635342000 JST",,"6000  >  48476 [FIN, ACK] Seq=1 Ack=29 Win=65152 Len=0 TSval=1627726455 TSecr=1999354818"
77,35.845991,192.168.11.24,192.168.11.41,TCP,66,0.000043,,0.000043,"Jan  6, 2024 19:36:50.635385000 JST",,48476  >  6000 [ACK] Seq=29 Ack=2 Win=64256 Len=0 TSval=1999354826 TSecr=1627726455
78,35.876913,192.168.11.24,255.255.255.255,UDP,209,,Ÿ,0.030922,"Jan  6, 2024 19:36:50.666307000 JST",7b2273656d616e74696373223a207b22656e74697479223a2022504944222c202262617365656e74697479223a2022616e79222c2022726f6c65223a2022303032222c20227370617469616c223a2022616e79222c202274656d706f72616c223a2022616e79227d2c20226461746170726f7065727479223a207b22666f726d6174223a2022696e616f6b615f70726f6772616d5f73616d706c655f73656d616e746963227d7d,57422  >  7000 Len=167
79,35.886445,192.168.11.43,192.168.11.24,TCP,74,,œ,0.009532,"Jan  6, 2024 19:36:50.675839000 JST",,56938  >  6000 [SYN] Seq=0 Win=64240 Len=0 MSS=1460 SACK_PERM TSval=4068868956 TSecr=0 WS=128
80,35.886593,192.168.11.24,192.168.11.43,TCP,74,0.000148,,0.000148,"Jan  6, 2024 19:36:50.675987000 JST",,"6000  >  56938 [SYN, ACK] Seq=0 Ack=1 Win=65160 Len=0 MSS=1460 SACK_PERM TSval=2637609016 TSecr=4068868956 WS=128"
81,35.893772,192.168.11.43,192.168.11.24,TCP,66,0.007179,,0.007179,"Jan  6, 2024 19:36:50.683166000 JST",,56938  >  6000 [ACK] Seq=1 Ack=1 Win=64256 Len=0 TSval=4068868964 TSecr=2637609016
82,35.894315,192.168.11.43,192.168.11.24,TCP,66,,,0.000543,"Jan  6, 2024 19:36:50.683709000 JST",,"[TCP Previous segment not captured] 56938  >  6000 [FIN, ACK] Seq=28 Ack=1 Win=64256 Len=0 TSval=4068868965 TSecr=2637609016"
83,35.894402,192.168.11.24,192.168.11.43,TCP,78,,,0.000087,"Jan  6, 2024 19:36:50.683796000 JST",,[TCP Window Update] 6000  >  56938 [ACK] Seq=1 Ack=1 Win=65280 Len=0 TSval=2637609024 TSecr=4068868964 SLE=28 SRE=29
84,35.894471,192.168.11.43,192.168.11.24,TCP,93,,,0.000069,"Jan  6, 2024 19:36:50.683865000 JST",,"[TCP Out-Of-Order] 56938  >  6000 [PSH, ACK] Seq=1 Ack=1 Win=64256 Len=27 TSval=4068868965 TSecr=2637609016"
85,35.894579,192.168.11.24,192.168.11.43,TCP,66,0.000264,,0.000108,"Jan  6, 2024 19:36:50.683973000 JST",,6000  >  56938 [ACK] Seq=1 Ack=29 Win=65280 Len=0 TSval=2637609024 TSecr=4068868965
86,35.895714,192.168.11.24,192.168.11.43,TCP,66,,,0.001135,"Jan  6, 2024 19:36:50.685108000 JST",,"6000  >  56938 [FIN, ACK] Seq=1 Ack=29 Win=65280 Len=0 TSval=2637609025 TSecr=4068868965"
87,35.902928,192.168.11.43,192.168.11.24,TCP,66,0.007214,,0.007214,"Jan  6, 2024 19:36:50.692322000 JST",,56938  >  6000 [ACK] Seq=29 Ack=2 Win=64256 Len=0 TSval=4068868973 TSecr=2637609025
88,43.65638,192.168.11.24,192.168.11.41,TCP,74,,,7.753452,"Jan  6, 2024 19:36:58.445774000 JST",,51082  >  6000 [SYN] Seq=0 Win=64240 Len=0 MSS=1460 SACK_PERM TSval=1999362636 TSecr=0 WS=128
89,43.668122,192.168.11.41,192.168.11.24,TCP,74,0.011742,,0.011742,"Jan  6, 2024 19:36:58.457516000 JST",,"6000  >  51082 [SYN, ACK] Seq=0 Ack=1 Win=65160 Len=0 MSS=1460 SACK_PERM TSval=1627734273 TSecr=1999362636 WS=128"
90,43.668228,192.168.11.24,192.168.11.41,TCP,66,0.000106,,0.000106,"Jan  6, 2024 19:36:58.457622000 JST",,51082  >  6000 [ACK] Seq=1 Ack=1 Win=64256 Len=0 TSval=1999362648 TSecr=1627734273
91,43.668411,192.168.11.24,192.168.11.41,TCP,93,,,0.000183,"Jan  6, 2024 19:36:58.457805000 JST",,"51082  >  6000 [PSH, ACK] Seq=1 Ack=1 Win=64256 Len=27 TSval=1999362648 TSecr=1627734273 [TCP segment of a reassembled PDU]"
92,43.668503,192.168.11.24,192.168.11.41,TCP,66,,,0.000092,"Jan  6, 2024 19:36:58.457897000 JST",,"51082  >  6000 [FIN, ACK] Seq=28 Ack=1 Win=64256 Len=0 TSval=1999362648 TSecr=1627734273"
93,43.676337,192.168.11.41,192.168.11.24,TCP,66,0.007926,,0.007834,"Jan  6, 2024 19:36:58.465731000 JST",,6000  >  51082 [ACK] Seq=1 Ack=28 Win=65152 Len=0 TSval=1627734285 TSecr=1999362648
94,43.679012,192.168.11.41,192.168.11.24,TCP,66,0.010509,,0.002675,"Jan  6, 2024 19:36:58.468406000 JST",,"6000  >  51082 [FIN, ACK] Seq=1 Ack=29 Win=65152 Len=0 TSval=1627734287 TSecr=1999362648"
95,43.679059,192.168.11.24,192.168.11.41,TCP,66,0.000047,,0.000047,"Jan  6, 2024 19:36:58.468453000 JST",,51082  >  6000 [ACK] Seq=29 Ack=2 Win=64256 Len=0 TSval=1999362659 TSecr=1627734287
96,43.708997,192.168.11.24,255.255.255.255,UDP,209,,Ÿ,0.029938,"Jan  6, 2024 19:36:58.498391000 JST",7b2273656d616e74696373223a207b22656e74697479223a2022504944222c202262617365656e74697479223a2022616e79222c2022726f6c65223a2022303032222c20227370617469616c223a2022616e79222c202274656d706f72616c223a2022616e79227d2c20226461746170726f7065727479223a207b22666f726d6174223a2022696e616f6b615f70726f6772616d5f73616d706c655f73656d616e746963227d7d,42305  >  7000 Len=167
97,43.718197,192.168.11.43,192.168.11.24,TCP,74,,œ,0.0092,"Jan  6, 2024 19:36:58.507591000 JST",,54774  >  6000 [SYN] Seq=0 Win=64240 Len=0 MSS=1460 SACK_PERM TSval=4068876788 TSecr=0 WS=128
98,43.718338,192.168.11.24,192.168.11.43,TCP,74,0.000141,,0.000141,"Jan  6, 2024 19:36:58.507732000 JST",,"6000  >  54774 [SYN, ACK] Seq=0 Ack=1 Win=65160 Len=0 MSS=1460 SACK_PERM TSval=2637616848 TSecr=4068876788 WS=128"
99,43.725768,192.168.11.43,192.168.11.24,TCP,66,0.00743,,0.00743,"Jan  6, 2024 19:36:58.515162000 JST",,54774  >  6000 [ACK] Seq=1 Ack=1 Win=64256 Len=0 TSval=4068876797 TSecr=2637616848
100,43.72628,192.168.11.43,192.168.11.24,TCP,93,,,0.000512,"Jan  6, 2024 19:36:58.515674000 JST",,"54774  >  6000 [PSH, ACK] Seq=1 Ack=1 Win=64256 Len=27 TSval=4068876797 TSecr=2637616848 [TCP segment of a reassembled PDU]"
101,43.726361,192.168.11.24,192.168.11.43,TCP,66,0.000081,,0.000081,"Jan  6, 2024 19:36:58.515755000 JST",,6000  >  54774 [ACK] Seq=1 Ack=28 Win=65152 Len=0 TSval=2637616856 TSecr=4068876797
102,43.726424,192.168.11.43,192.168.11.24,TCP,66,,,0.000063,"Jan  6, 2024 19:36:58.515818000 JST",,"54774  >  6000 [FIN, ACK] Seq=28 Ack=1 Win=64256 Len=0 TSval=4068876797 TSecr=2637616848"
103,43.727439,192.168.11.24,192.168.11.43,TCP,66,0.001015,,0.001015,"Jan  6, 2024 19:36:58.516833000 JST",,"6000  >  54774 [FIN, ACK] Seq=1 Ack=29 Win=65152 Len=0 TSval=2637616857 TSecr=4068876797"
104,43.742033,192.168.11.43,192.168.11.24,TCP,66,0.014594,,0.014594,"Jan  6, 2024 19:36:58.531427000 JST",,54774  >  6000 [ACK] Seq=29 Ack=2 Win=64256 Len=0 TSval=4068876805 TSecr=2637616857
105,51.714927,192.168.11.24,192.168.11.41,TCP,74,,,7.972894,"Jan  6, 2024 19:37:06.504321000 JST",,34694  >  6000 [SYN] Seq=0 Win=64240 Len=0 MSS=1460 SACK_PERM TSval=1999370695 TSecr=0 WS=128
106,51.725643,192.168.11.41,192.168.11.24,TCP,74,0.010716,,0.010716,"Jan  6, 2024 19:37:06.515037000 JST",,"6000  >  34694 [SYN, ACK] Seq=0 Ack=1 Win=65160 Len=0 MSS=1460 SACK_PERM TSval=1627742332 TSecr=1999370695 WS=128"
107,51.725785,192.168.11.24,192.168.11.41,TCP,66,0.000142,,0.000142,"Jan  6, 2024 19:37:06.515179000 JST",,34694  >  6000 [ACK] Seq=1 Ack=1 Win=64256 Len=0 TSval=1999370706 TSecr=1627742332
108,51.725992,192.168.11.24,192.168.11.41,TCP,93,,,0.000207,"Jan  6, 2024 19:37:06.515386000 JST",,"34694  >  6000 [PSH, ACK] Seq=1 Ack=1 Win=64256 Len=27 TSval=1999370706 TSecr=1627742332 [TCP segment of a reassembled PDU]"
109,51.726095,192.168.11.24,192.168.11.41,TCP,66,,,0.000103,"Jan  6, 2024 19:37:06.515489000 JST",,"34694  >  6000 [FIN, ACK] Seq=28 Ack=1 Win=64256 Len=0 TSval=1999370706 TSecr=1627742332"
110,51.737232,192.168.11.41,192.168.11.24,TCP,66,0.01124,,0.011137,"Jan  6, 2024 19:37:06.526626000 JST",,6000  >  34694 [ACK] Seq=1 Ack=28 Win=65152 Len=0 TSval=1627742343 TSecr=1999370706
111,51.737617,192.168.11.41,192.168.11.24,TCP,66,,,0.000385,"Jan  6, 2024 19:37:06.527011000 JST",,[TCP Dup ACK 110#1] 6000  >  34694 [ACK] Seq=1 Ack=28 Win=65152 Len=0 TSval=1627742343 TSecr=1999370706
112,51.737666,192.168.11.41,192.168.11.24,TCP,66,0.011571,,0.000049,"Jan  6, 2024 19:37:06.527060000 JST",,"6000  >  34694 [FIN, ACK] Seq=1 Ack=29 Win=65152 Len=0 TSval=1627742345 TSecr=1999370706"
113,51.737734,192.168.11.24,192.168.11.41,TCP,66,0.000068,,0.000068,"Jan  6, 2024 19:37:06.527128000 JST",,34694  >  6000 [ACK] Seq=29 Ack=2 Win=64256 Len=0 TSval=1999370718 TSecr=1627742345
114,51.772279,192.168.11.24,255.255.255.255,UDP,209,,Ÿ,0.034545,"Jan  6, 2024 19:37:06.561673000 JST",7b2273656d616e74696373223a207b22656e74697479223a2022504944222c202262617365656e74697479223a2022616e79222c2022726f6c65223a2022303032222c20227370617469616c223a2022616e79222c202274656d706f72616c223a2022616e79227d2c20226461746170726f7065727479223a207b22666f726d6174223a2022696e616f6b615f70726f6772616d5f73616d706c655f73656d616e746963227d7d,60311  >  7000 Len=167
115,51.790489,192.168.11.43,192.168.11.24,TCP,74,,œ,0.01821,"Jan  6, 2024 19:37:06.579883000 JST",,46454  >  6000 [SYN] Seq=0 Win=64240 Len=0 MSS=1460 SACK_PERM TSval=4068884852 TSecr=0 WS=128
116,51.79072,192.168.11.24,192.168.11.43,TCP,74,0.000231,,0.000231,"Jan  6, 2024 19:37:06.580114000 JST",,"6000  >  46454 [SYN, ACK] Seq=0 Ack=1 Win=65160 Len=0 MSS=1460 SACK_PERM TSval=2637624920 TSecr=4068884852 WS=128"
117,51.800512,192.168.11.43,192.168.11.24,TCP,66,0.009792,,0.009792,"Jan  6, 2024 19:37:06.589906000 JST",,46454  >  6000 [ACK] Seq=1 Ack=1 Win=64256 Len=0 TSval=4068884869 TSecr=2637624920
118,51.800994,192.168.11.43,192.168.11.24,TCP,93,,,0.000482,"Jan  6, 2024 19:37:06.590388000 JST",,"46454  >  6000 [PSH, ACK] Seq=1 Ack=1 Win=64256 Len=27 TSval=4068884870 TSecr=2637624920 [TCP segment of a reassembled PDU]"
119,51.801053,192.168.11.24,192.168.11.43,TCP,66,0.000059,,0.000059,"Jan  6, 2024 19:37:06.590447000 JST",,6000  >  46454 [ACK] Seq=1 Ack=28 Win=65152 Len=0 TSval=2637624931 TSecr=4068884870
120,51.801247,192.168.11.43,192.168.11.24,TCP,66,,,0.000194,"Jan  6, 2024 19:37:06.590641000 JST",,"46454  >  6000 [FIN, ACK] Seq=28 Ack=1 Win=64256 Len=0 TSval=4068884870 TSecr=2637624920"
121,51.802184,192.168.11.24,192.168.11.43,TCP,66,0.000937,,0.000937,"Jan  6, 2024 19:37:06.591578000 JST",,"6000  >  46454 [FIN, ACK] Seq=1 Ack=29 Win=65152 Len=0 TSval=2637624932 TSecr=4068884870"
122,51.810042,192.168.11.43,192.168.11.24,TCP,66,0.007858,,0.007858,"Jan  6, 2024 19:37:06.599436000 JST",,46454  >  6000 [ACK] Seq=29 Ack=2 Win=64256 Len=0 TSval=4068884880 TSecr=2637624932
123,60.816201,192.168.11.24,192.168.11.41,TCP,74,,,9.006159,"Jan  6, 2024 19:37:15.605595000 JST",,54494  >  6000 [SYN] Seq=0 Win=64240 Len=0 MSS=1460 SACK_PERM TSval=1999379796 TSecr=0 WS=128
124,60.826387,192.168.11.41,192.168.11.24,TCP,74,0.010186,,0.010186,"Jan  6, 2024 19:37:15.615781000 JST",,"6000  >  54494 [SYN, ACK] Seq=0 Ack=1 Win=65160 Len=0 MSS=1460 SACK_PERM TSval=1627751433 TSecr=1999379796 WS=128"
125,60.826508,192.168.11.24,192.168.11.41,TCP,66,0.000121,,0.000121,"Jan  6, 2024 19:37:15.615902000 JST",,54494  >  6000 [ACK] Seq=1 Ack=1 Win=64256 Len=0 TSval=1999379806 TSecr=1627751433
126,60.826752,192.168.11.24,192.168.11.41,TCP,93,,,0.000244,"Jan  6, 2024 19:37:15.616146000 JST",,"54494  >  6000 [PSH, ACK] Seq=1 Ack=1 Win=64256 Len=27 TSval=1999379807 TSecr=1627751433 [TCP segment of a reassembled PDU]"
127,60.826864,192.168.11.24,192.168.11.41,TCP,66,,,0.000112,"Jan  6, 2024 19:37:15.616258000 JST",,"54494  >  6000 [FIN, ACK] Seq=28 Ack=1 Win=64256 Len=0 TSval=1999379807 TSecr=1627751433"
128,60.834758,192.168.11.41,192.168.11.24,TCP,66,0.008006,,0.007894,"Jan  6, 2024 19:37:15.624152000 JST",,6000  >  54494 [ACK] Seq=1 Ack=28 Win=65152 Len=0 TSval=1627751443 TSecr=1999379807
129,60.840896,192.168.11.41,192.168.11.24,TCP,66,0.014032,,0.006138,"Jan  6, 2024 19:37:15.630290000 JST",,"6000  >  54494 [FIN, ACK] Seq=1 Ack=29 Win=65152 Len=0 TSval=1627751445 TSecr=1999379807"
130,60.840958,192.168.11.24,192.168.11.41,TCP,66,0.000062,,0.000062,"Jan  6, 2024 19:37:15.630352000 JST",,54494  >  6000 [ACK] Seq=29 Ack=2 Win=64256 Len=0 TSval=1999379821 TSecr=1627751445
131,60.880932,192.168.11.24,255.255.255.255,UDP,209,,Ÿ,0.039974,"Jan  6, 2024 19:37:15.670326000 JST",7b2273656d616e74696373223a207b22656e74697479223a2022504944222c202262617365656e74697479223a2022616e79222c2022726f6c65223a2022303032222c20227370617469616c223a2022616e79222c202274656d706f72616c223a2022616e79227d2c20226461746170726f7065727479223a207b22666f726d6174223a2022696e616f6b615f70726f6772616d5f73616d706c655f73656d616e746963227d7d,46011  >  7000 Len=167
132,60.890161,192.168.11.43,192.168.11.24,TCP,74,,œ,0.009229,"Jan  6, 2024 19:37:15.679555000 JST",,46466  >  6000 [SYN] Seq=0 Win=64240 Len=0 MSS=1460 SACK_PERM TSval=4068893960 TSecr=0 WS=128
133,60.890314,192.168.11.24,192.168.11.43,TCP,74,0.000153,,0.000153,"Jan  6, 2024 19:37:15.679708000 JST",,"6000  >  46466 [SYN, ACK] Seq=0 Ack=1 Win=65160 Len=0 MSS=1460 SACK_PERM TSval=2637634020 TSecr=4068893960 WS=128"
134,60.906508,192.168.11.43,192.168.11.24,TCP,66,0.016194,,0.016194,"Jan  6, 2024 19:37:15.695902000 JST",,46466  >  6000 [ACK] Seq=1 Ack=1 Win=64256 Len=0 TSval=4068893969 TSecr=2637634020
135,60.907085,192.168.11.43,192.168.11.24,TCP,93,,,0.000577,"Jan  6, 2024 19:37:15.696479000 JST",,"46466  >  6000 [PSH, ACK] Seq=1 Ack=1 Win=64256 Len=27 TSval=4068893969 TSecr=2637634020 [TCP segment of a reassembled PDU]"
136,60.907233,192.168.11.24,192.168.11.43,TCP,66,0.000148,,0.000148,"Jan  6, 2024 19:37:15.696627000 JST",,6000  >  46466 [ACK] Seq=1 Ack=28 Win=65152 Len=0 TSval=2637634037 TSecr=4068893969
137,60.907529,192.168.11.43,192.168.11.24,TCP,66,,,0.000296,"Jan  6, 2024 19:37:15.696923000 JST",,"46466  >  6000 [FIN, ACK] Seq=28 Ack=1 Win=64256 Len=0 TSval=4068893969 TSecr=2637634020"
138,60.909013,192.168.11.24,192.168.11.43,TCP,66,0.001484,,0.001484,"Jan  6, 2024 19:37:15.698407000 JST",,"6000  >  46466 [FIN, ACK] Seq=1 Ack=29 Win=65152 Len=0 TSval=2637634039 TSecr=4068893969"
139,60.918576,192.168.11.43,192.168.11.24,TCP,66,0.009563,,0.009563,"Jan  6, 2024 19:37:15.707970000 JST",,46466  >  6000 [ACK] Seq=29 Ack=2 Win=64256 Len=0 TSval=4068893988 TSecr=2637634039
140,72.734294,192.168.11.24,192.168.11.41,TCP,74,,,11.815718,"Jan  6, 2024 19:37:27.523688000 JST",,40098  >  6000 [SYN] Seq=0 Win=64240 Len=0 MSS=1460 SACK_PERM TSval=1999391714 TSecr=0 WS=128
141,72.747167,192.168.11.41,192.168.11.24,TCP,74,0.012873,,0.012873,"Jan  6, 2024 19:37:27.536561000 JST",,"6000  >  40098 [SYN, ACK] Seq=0 Ack=1 Win=65160 Len=0 MSS=1460 SACK_PERM TSval=1627763351 TSecr=1999391714 WS=128"
142,72.74727,192.168.11.24,192.168.11.41,TCP,66,0.000103,,0.000103,"Jan  6, 2024 19:37:27.536664000 JST",,40098  >  6000 [ACK] Seq=1 Ack=1 Win=64256 Len=0 TSval=1999391727 TSecr=1627763351
143,72.747517,192.168.11.24,192.168.11.41,TCP,93,,,0.000247,"Jan  6, 2024 19:37:27.536911000 JST",,"40098  >  6000 [PSH, ACK] Seq=1 Ack=1 Win=64256 Len=27 TSval=1999391727 TSecr=1627763351 [TCP segment of a reassembled PDU]"
144,72.747627,192.168.11.24,192.168.11.41,TCP,66,,,0.00011,"Jan  6, 2024 19:37:27.537021000 JST",,"40098  >  6000 [FIN, ACK] Seq=28 Ack=1 Win=64256 Len=0 TSval=1999391727 TSecr=1627763351"
145,72.756349,192.168.11.41,192.168.11.24,TCP,66,0.008832,,0.008722,"Jan  6, 2024 19:37:27.545743000 JST",,6000  >  40098 [ACK] Seq=1 Ack=28 Win=65152 Len=0 TSval=1627763364 TSecr=1999391727
146,72.756739,192.168.11.41,192.168.11.24,TCP,66,0.009112,,0.00039,"Jan  6, 2024 19:37:27.546133000 JST",,"6000  >  40098 [FIN, ACK] Seq=1 Ack=29 Win=65152 Len=0 TSval=1627763366 TSecr=1999391727"
147,72.756782,192.168.11.24,192.168.11.41,TCP,66,0.000043,,0.000043,"Jan  6, 2024 19:37:27.546176000 JST",,40098  >  6000 [ACK] Seq=29 Ack=2 Win=64256 Len=0 TSval=1999391737 TSecr=1627763366
148,72.789092,192.168.11.24,255.255.255.255,UDP,209,,Ÿ,0.03231,"Jan  6, 2024 19:37:27.578486000 JST",7b2273656d616e74696373223a207b22656e74697479223a2022504944222c202262617365656e74697479223a2022616e79222c2022726f6c65223a2022303032222c20227370617469616c223a2022616e79222c202274656d706f72616c223a2022616e79227d2c20226461746170726f7065727479223a207b22666f726d6174223a2022696e616f6b615f70726f6772616d5f73616d706c655f73656d616e746963227d7d,54341  >  7000 Len=167
149,72.800846,192.168.11.43,192.168.11.24,TCP,74,,œ,0.011754,"Jan  6, 2024 19:37:27.590240000 JST",,59064  >  6000 [SYN] Seq=0 Win=64240 Len=0 MSS=1460 SACK_PERM TSval=4068905870 TSecr=0 WS=128
150,72.801042,192.168.11.24,192.168.11.43,TCP,74,0.000196,,0.000196,"Jan  6, 2024 19:37:27.590436000 JST",,"6000  >  59064 [SYN, ACK] Seq=0 Ack=1 Win=65160 Len=0 MSS=1460 SACK_PERM TSval=2637645931 TSecr=4068905870 WS=128"
151,72.815973,192.168.11.43,192.168.11.24,TCP,93,0.014931,,0.014931,"Jan  6, 2024 19:37:27.605367000 JST",,"59064  >  6000 [PSH, ACK] Seq=1 Ack=1 Win=64256 Len=27 TSval=4068905884 TSecr=2637645931 [TCP segment of a reassembled PDU]"
152,72.816166,192.168.11.24,192.168.11.43,TCP,66,0.000193,,0.000193,"Jan  6, 2024 19:37:27.605560000 JST",,6000  >  59064 [ACK] Seq=1 Ack=28 Win=65152 Len=0 TSval=2637645946 TSecr=4068905884
153,72.816585,192.168.11.43,192.168.11.24,TCP,66,,,0.000419,"Jan  6, 2024 19:37:27.605979000 JST",,59064  >  6000 [ACK] Seq=1 Ack=1 Win=64256 Len=0 TSval=4068905883 TSecr=2637645931
154,72.816618,192.168.11.24,192.168.11.43,TCP,66,,,0.000033,"Jan  6, 2024 19:37:27.606012000 JST",,[TCP Dup ACK 152#1] 6000  >  59064 [ACK] Seq=1 Ack=28 Win=65152 Len=0 TSval=2637645946 TSecr=4068905884
155,72.81667,192.168.11.43,192.168.11.24,TCP,66,,,0.000052,"Jan  6, 2024 19:37:27.606064000 JST",,"59064  >  6000 [FIN, ACK] Seq=28 Ack=1 Win=64256 Len=0 TSval=4068905884 TSecr=2637645931"
156,72.817608,192.168.11.24,192.168.11.43,TCP,66,0.000938,,0.000938,"Jan  6, 2024 19:37:27.607002000 JST",,"6000  >  59064 [FIN, ACK] Seq=1 Ack=29 Win=65152 Len=0 TSval=2637645947 TSecr=4068905884"
157,72.827837,192.168.11.43,192.168.11.24,TCP,66,0.010229,,0.010229,"Jan  6, 2024 19:37:27.617231000 JST",,59064  >  6000 [ACK] Seq=29 Ack=2 Win=64256 Len=0 TSval=4068905896 TSecr=2637645947
158,81.601725,192.168.11.24,192.168.11.41,TCP,74,,,8.773888,"Jan  6, 2024 19:37:36.391119000 JST",,51052  >  6000 [SYN] Seq=0 Win=64240 Len=0 MSS=1460 SACK_PERM TSval=1999400581 TSecr=0 WS=128
159,81.611954,192.168.11.41,192.168.11.24,TCP,74,0.010229,,0.010229,"Jan  6, 2024 19:37:36.401348000 JST",,"6000  >  51052 [SYN, ACK] Seq=0 Ack=1 Win=65160 Len=0 MSS=1460 SACK_PERM TSval=1627772219 TSecr=1999400581 WS=128"
160,81.612058,192.168.11.24,192.168.11.41,TCP,66,0.000104,,0.000104,"Jan  6, 2024 19:37:36.401452000 JST",,51052  >  6000 [ACK] Seq=1 Ack=1 Win=64256 Len=0 TSval=1999400592 TSecr=1627772219
161,81.612227,192.168.11.24,192.168.11.41,TCP,93,,,0.000169,"Jan  6, 2024 19:37:36.401621000 JST",,"51052  >  6000 [PSH, ACK] Seq=1 Ack=1 Win=64256 Len=27 TSval=1999400592 TSecr=1627772219 [TCP segment of a reassembled PDU]"
162,81.612353,192.168.11.24,192.168.11.41,TCP,66,,,0.000126,"Jan  6, 2024 19:37:36.401747000 JST",,"51052  >  6000 [FIN, ACK] Seq=28 Ack=1 Win=64256 Len=0 TSval=1999400592 TSecr=1627772219"
163,81.621517,192.168.11.41,192.168.11.24,TCP,66,0.00929,,0.009164,"Jan  6, 2024 19:37:36.410911000 JST",,6000  >  51052 [ACK] Seq=1 Ack=28 Win=65152 Len=0 TSval=1627772229 TSecr=1999400592
164,81.623996,192.168.11.41,192.168.11.24,TCP,66,0.011643,,0.002479,"Jan  6, 2024 19:37:36.413390000 JST",,"6000  >  51052 [FIN, ACK] Seq=1 Ack=29 Win=65152 Len=0 TSval=1627772232 TSecr=1999400592"
165,81.624043,192.168.11.24,192.168.11.41,TCP,66,0.000047,,0.000047,"Jan  6, 2024 19:37:36.413437000 JST",,51052  >  6000 [ACK] Seq=29 Ack=2 Win=64256 Len=0 TSval=1999400604 TSecr=1627772232
166,81.66502,192.168.11.24,255.255.255.255,UDP,209,,Ÿ,0.040977,"Jan  6, 2024 19:37:36.454414000 JST",7b2273656d616e74696373223a207b22656e74697479223a2022504944222c202262617365656e74697479223a2022616e79222c2022726f6c65223a2022303032222c20227370617469616c223a2022616e79222c202274656d706f72616c223a2022616e79227d2c20226461746170726f7065727479223a207b22666f726d6174223a2022696e616f6b615f70726f6772616d5f73616d706c655f73656d616e746963227d7d,53956  >  7000 Len=167
167,81.678028,192.168.11.43,192.168.11.24,TCP,74,,œ,0.013008,"Jan  6, 2024 19:37:36.467422000 JST",,43932  >  6000 [SYN] Seq=0 Win=64240 Len=0 MSS=1460 SACK_PERM TSval=4068914748 TSecr=0 WS=128
168,81.678193,192.168.11.24,192.168.11.43,TCP,74,0.000165,,0.000165,"Jan  6, 2024 19:37:36.467587000 JST",,"6000  >  43932 [SYN, ACK] Seq=0 Ack=1 Win=65160 Len=0 MSS=1460 SACK_PERM TSval=2637654808 TSecr=4068914748 WS=128"
169,81.686201,192.168.11.43,192.168.11.24,TCP,66,0.008008,,0.008008,"Jan  6, 2024 19:37:36.475595000 JST",,43932  >  6000 [ACK] Seq=1 Ack=1 Win=64256 Len=0 TSval=4068914757 TSecr=2637654808
170,81.686772,192.168.11.43,192.168.11.24,TCP,93,,,0.000571,"Jan  6, 2024 19:37:36.476166000 JST",,"43932  >  6000 [PSH, ACK] Seq=1 Ack=1 Win=64256 Len=27 TSval=4068914757 TSecr=2637654808 [TCP segment of a reassembled PDU]"
171,81.686873,192.168.11.24,192.168.11.43,TCP,66,0.000101,,0.000101,"Jan  6, 2024 19:37:36.476267000 JST",,6000  >  43932 [ACK] Seq=1 Ack=28 Win=65152 Len=0 TSval=2637654817 TSecr=4068914757
172,81.686948,192.168.11.43,192.168.11.24,TCP,66,,,0.000075,"Jan  6, 2024 19:37:36.476342000 JST",,"43932  >  6000 [FIN, ACK] Seq=28 Ack=1 Win=64256 Len=0 TSval=4068914757 TSecr=2637654808"
173,81.688532,192.168.11.24,192.168.11.43,TCP,66,0.001584,,0.001584,"Jan  6, 2024 19:37:36.477926000 JST",,"6000  >  43932 [FIN, ACK] Seq=1 Ack=29 Win=65152 Len=0 TSval=2637654818 TSecr=4068914757"
174,81.700479,192.168.11.43,192.168.11.24,TCP,66,0.011947,,0.011947,"Jan  6, 2024 19:37:36.489873000 JST",,43932  >  6000 [ACK] Seq=29 Ack=2 Win=64256 Len=0 TSval=4068914771 TSecr=2637654818
175,112.820498,192.168.11.24,192.168.11.41,TCP,74,,,31.120019,"Jan  6, 2024 19:38:07.609892000 JST",,42850  >  6000 [SYN] Seq=0 Win=64240 Len=0 MSS=1460 SACK_PERM TSval=1999431800 TSecr=0 WS=128
176,112.830573,192.168.11.41,192.168.11.24,TCP,74,0.010075,,0.010075,"Jan  6, 2024 19:38:07.619967000 JST",,"6000  >  42850 [SYN, ACK] Seq=0 Ack=1 Win=65160 Len=0 MSS=1460 SACK_PERM TSval=1627803438 TSecr=1999431800 WS=128"
177,112.830745,192.168.11.24,192.168.11.41,TCP,66,0.000172,,0.000172,"Jan  6, 2024 19:38:07.620139000 JST",,42850  >  6000 [ACK] Seq=1 Ack=1 Win=64256 Len=0 TSval=1999431811 TSecr=1627803438
178,112.830973,192.168.11.24,192.168.11.41,TCP,93,,,0.000228,"Jan  6, 2024 19:38:07.620367000 JST",,"42850  >  6000 [PSH, ACK] Seq=1 Ack=1 Win=64256 Len=27 TSval=1999431811 TSecr=1627803438 [TCP segment of a reassembled PDU]"
179,112.8311,192.168.11.24,192.168.11.41,TCP,66,,,0.000127,"Jan  6, 2024 19:38:07.620494000 JST",,"42850  >  6000 [FIN, ACK] Seq=28 Ack=1 Win=64256 Len=0 TSval=1999431811 TSecr=1627803438"
180,112.840389,192.168.11.41,192.168.11.24,TCP,66,0.009416,,0.009289,"Jan  6, 2024 19:38:07.629783000 JST",,6000  >  42850 [ACK] Seq=1 Ack=28 Win=65152 Len=0 TSval=1627803449 TSecr=1999431811
181,112.842923,192.168.11.41,192.168.11.24,TCP,66,0.011823,,0.002534,"Jan  6, 2024 19:38:07.632317000 JST",,"6000  >  42850 [FIN, ACK] Seq=1 Ack=29 Win=65152 Len=0 TSval=1627803451 TSecr=1999431811"
182,112.842987,192.168.11.24,192.168.11.41,TCP,66,0.000064,,0.000064,"Jan  6, 2024 19:38:07.632381000 JST",,42850  >  6000 [ACK] Seq=29 Ack=2 Win=64256 Len=0 TSval=1999431823 TSecr=1627803451
183,112.874326,192.168.11.24,255.255.255.255,UDP,209,,Ÿ,0.031339,"Jan  6, 2024 19:38:07.663720000 JST",7b2273656d616e74696373223a207b22656e74697479223a2022504944222c202262617365656e74697479223a2022616e79222c2022726f6c65223a2022303032222c20227370617469616c223a2022616e79222c202274656d706f72616c223a2022616e79227d2c20226461746170726f7065727479223a207b22666f726d6174223a2022696e616f6b615f70726f6772616d5f73616d706c655f73656d616e746963227d7d,49139  >  7000 Len=167
184,112.883646,192.168.11.43,192.168.11.24,TCP,74,,œ,0.00932,"Jan  6, 2024 19:38:07.673040000 JST",,50260  >  6000 [SYN] Seq=0 Win=64240 Len=0 MSS=1460 SACK_PERM TSval=4068945954 TSecr=0 WS=128
