No.,Time,Source,Destination,Protocol,Length,The RTT to ACK the segment was,XXX,Time delta from previous captured frame,Arrival Time,Data,Info
1,0,192.168.11.46,192.168.11.45,TCP,74,,,0,"Jan  6, 2024 19:36:15.043646000 JST",,51534  >  6000 [SYN] Seq=0 Win=64240 Len=0 MSS=1460 SACK_PERM TSval=1148705268 TSecr=0 WS=128
2,0.007155,192.168.11.45,192.168.11.46,TCP,74,0.007155,,0.007155,"Jan  6, 2024 19:36:15.050801000 JST",,"6000  >  51534 [SYN, ACK] Seq=0 Ack=1 Win=65160 Len=0 MSS=1460 SACK_PERM TSval=962148175 TSecr=1148705268 WS=128"
3,0.007266,192.168.11.46,192.168.11.45,TCP,66,0.000111,,0.000111,"Jan  6, 2024 19:36:15.050912000 JST",,51534  >  6000 [ACK] Seq=1 Ack=1 Win=64256 Len=0 TSval=1148705279 TSecr=962148175
4,0.007502,192.168.11.46,192.168.11.45,TCP,93,,,0.000236,"Jan  6, 2024 19:36:15.051148000 JST",,"51534  >  6000 [PSH, ACK] Seq=1 Ack=1 Win=64256 Len=27 TSval=1148705279 TSecr=962148175 [TCP segment of a reassembled PDU]"
5,0.007657,192.168.11.46,192.168.11.45,TCP,66,,,0.000155,"Jan  6, 2024 19:36:15.051303000 JST",,"51534  >  6000 [FIN, ACK] Seq=28 Ack=1 Win=64256 Len=0 TSval=1148705279 TSecr=962148175"
6,0.015272,192.168.11.45,192.168.11.46,TCP,66,0.00777,,0.007615,"Jan  6, 2024 19:36:15.058918000 JST",,6000  >  51534 [ACK] Seq=1 Ack=28 Win=65152 Len=0 TSval=962148182 TSecr=1148705279
7,0.015499,192.168.11.45,192.168.11.46,TCP,66,0.007842,,0.000227,"Jan  6, 2024 19:36:15.059145000 JST",,"6000  >  51534 [FIN, ACK] Seq=1 Ack=29 Win=65152 Len=0 TSval=962148185 TSecr=1148705279"
8,0.015549,192.168.11.46,192.168.11.45,TCP,66,0.00005,,0.00005,"Jan  6, 2024 19:36:15.059195000 JST",,51534  >  6000 [ACK] Seq=29 Ack=2 Win=64256 Len=0 TSval=1148705287 TSecr=962148185
9,0.047771,192.168.11.46,255.255.255.255,UDP,209,,Åü,0.032222,"Jan  6, 2024 19:36:15.091417000 JST",7b2273656d616e74696373223a207b22656e74697479223a2022504944222c202262617365656e74697479223a2022616e79222c2022726f6c65223a2022303036222c20227370617469616c223a2022616e79222c202274656d706f72616c223a2022616e79227d2c20226461746170726f7065727479223a207b22666f726d6174223a2022696e616f6b615f70726f6772616d5f73616d706c655f73656d616e746963227d7d,58726  >  7000 Len=167
10,0.059189,192.168.11.47,192.168.11.46,TCP,74,,Åú,0.011418,"Jan  6, 2024 19:36:15.102835000 JST",,51990  >  6000 [SYN] Seq=0 Win=64240 Len=0 MSS=1460 SACK_PERM TSval=3941356515 TSecr=0 WS=128
11,0.059372,192.168.11.46,192.168.11.47,TCP,74,0.000183,,0.000183,"Jan  6, 2024 19:36:15.103018000 JST",,"6000  >  51990 [SYN, ACK] Seq=0 Ack=1 Win=65160 Len=0 MSS=1460 SACK_PERM TSval=1538890628 TSecr=3941356515 WS=128"
12,0.066137,192.168.11.47,192.168.11.46,TCP,66,0.006765,,0.006765,"Jan  6, 2024 19:36:15.109783000 JST",,51990  >  6000 [ACK] Seq=1 Ack=1 Win=64256 Len=0 TSval=3941356526 TSecr=1538890628
13,0.066912,192.168.11.47,192.168.11.46,TCP,93,,,0.000775,"Jan  6, 2024 19:36:15.110558000 JST",,"51990  >  6000 [PSH, ACK] Seq=1 Ack=1 Win=64256 Len=27 TSval=3941356526 TSecr=1538890628 [TCP segment of a reassembled PDU]"
14,0.067047,192.168.11.46,192.168.11.47,TCP,66,0.000135,,0.000135,"Jan  6, 2024 19:36:15.110693000 JST",,6000  >  51990 [ACK] Seq=1 Ack=28 Win=65152 Len=0 TSval=1538890635 TSecr=3941356526
15,0.067144,192.168.11.47,192.168.11.46,TCP,66,,,0.000097,"Jan  6, 2024 19:36:15.110790000 JST",,"51990  >  6000 [FIN, ACK] Seq=28 Ack=1 Win=64256 Len=0 TSval=3941356526 TSecr=1538890628"
16,0.069199,192.168.11.46,192.168.11.47,TCP,66,0.002055,,0.002055,"Jan  6, 2024 19:36:15.112845000 JST",,"6000  >  51990 [FIN, ACK] Seq=1 Ack=29 Win=65152 Len=0 TSval=1538890637 TSecr=3941356526"
17,0.076224,192.168.11.47,192.168.11.46,TCP,66,0.007025,,0.007025,"Jan  6, 2024 19:36:15.119870000 JST",,51990  >  6000 [ACK] Seq=29 Ack=2 Win=64256 Len=0 TSval=3941356534 TSecr=1538890637
18,8.22157,192.168.11.46,192.168.11.45,TCP,74,,,8.145346,"Jan  6, 2024 19:36:23.265216000 JST",,32900  >  6000 [SYN] Seq=0 Win=64240 Len=0 MSS=1460 SACK_PERM TSval=1148713493 TSecr=0 WS=128
19,8.229231,192.168.11.45,192.168.11.46,TCP,74,0.007661,,0.007661,"Jan  6, 2024 19:36:23.272877000 JST",,"6000  >  32900 [SYN, ACK] Seq=0 Ack=1 Win=65160 Len=0 MSS=1460 SACK_PERM TSval=962156397 TSecr=1148713493 WS=128"
20,8.229348,192.168.11.46,192.168.11.45,TCP,66,0.000117,,0.000117,"Jan  6, 2024 19:36:23.272994000 JST",,32900  >  6000 [ACK] Seq=1 Ack=1 Win=64256 Len=0 TSval=1148713501 TSecr=962156397
21,8.229556,192.168.11.46,192.168.11.45,TCP,93,,,0.000208,"Jan  6, 2024 19:36:23.273202000 JST",,"32900  >  6000 [PSH, ACK] Seq=1 Ack=1 Win=64256 Len=27 TSval=1148713501 TSecr=962156397 [TCP segment of a reassembled PDU]"
22,8.229683,192.168.11.46,192.168.11.45,TCP,66,,,0.000127,"Jan  6, 2024 19:36:23.273329000 JST",,"32900  >  6000 [FIN, ACK] Seq=28 Ack=1 Win=64256 Len=0 TSval=1148713501 TSecr=962156397"
23,8.236413,192.168.11.45,192.168.11.46,TCP,66,0.006857,,0.00673,"Jan  6, 2024 19:36:23.280059000 JST",,6000  >  32900 [ACK] Seq=1 Ack=28 Win=65152 Len=0 TSval=962156404 TSecr=1148713501
24,8.236773,192.168.11.45,192.168.11.46,TCP,66,0.00709,,0.00036,"Jan  6, 2024 19:36:23.280419000 JST",,"6000  >  32900 [FIN, ACK] Seq=1 Ack=29 Win=65152 Len=0 TSval=962156405 TSecr=1148713501"
25,8.236821,192.168.11.46,192.168.11.45,TCP,66,0.000048,,0.000048,"Jan  6, 2024 19:36:23.280467000 JST",,32900  >  6000 [ACK] Seq=29 Ack=2 Win=64256 Len=0 TSval=1148713508 TSecr=962156405
26,8.274417,192.168.11.46,255.255.255.255,UDP,209,,Åü,0.037596,"Jan  6, 2024 19:36:23.318063000 JST",7b2273656d616e74696373223a207b22656e74697479223a2022504944222c202262617365656e74697479223a2022616e79222c2022726f6c65223a2022303036222c20227370617469616c223a2022616e79222c202274656d706f72616c223a2022616e79227d2c20226461746170726f7065727479223a207b22666f726d6174223a2022696e616f6b615f70726f6772616d5f73616d706c655f73656d616e746963227d7d,35999  >  7000 Len=167
27,8.283193,192.168.11.47,192.168.11.46,TCP,74,,Åú,0.008776,"Jan  6, 2024 19:36:23.326839000 JST",,52002  >  6000 [SYN] Seq=0 Win=64240 Len=0 MSS=1460 SACK_PERM TSval=3941364743 TSecr=0 WS=128
28,8.283331,192.168.11.46,192.168.11.47,TCP,74,0.000138,,0.000138,"Jan  6, 2024 19:36:23.326977000 JST",,"6000  >  52002 [SYN, ACK] Seq=0 Ack=1 Win=65160 Len=0 MSS=1460 SACK_PERM TSval=1538898852 TSecr=3941364743 WS=128"
29,8.291015,192.168.11.47,192.168.11.46,TCP,66,0.007684,,0.007684,"Jan  6, 2024 19:36:23.334661000 JST",,52002  >  6000 [ACK] Seq=1 Ack=1 Win=64256 Len=0 TSval=3941364750 TSecr=1538898852
30,8.291527,192.168.11.47,192.168.11.46,TCP,93,,,0.000512,"Jan  6, 2024 19:36:23.335173000 JST",,"52002  >  6000 [PSH, ACK] Seq=1 Ack=1 Win=64256 Len=27 TSval=3941364750 TSecr=1538898852 [TCP segment of a reassembled PDU]"
31,8.291597,192.168.11.46,192.168.11.47,TCP,66,0.00007,,0.00007,"Jan  6, 2024 19:36:23.335243000 JST",,6000  >  52002 [ACK] Seq=1 Ack=28 Win=65152 Len=0 TSval=1538898860 TSecr=3941364750
32,8.291663,192.168.11.47,192.168.11.46,TCP,66,,,0.000066,"Jan  6, 2024 19:36:23.335309000 JST",,"52002  >  6000 [FIN, ACK] Seq=28 Ack=1 Win=64256 Len=0 TSval=3941364750 TSecr=1538898852"
33,8.292679,192.168.11.46,192.168.11.47,TCP,66,0.001016,,0.001016,"Jan  6, 2024 19:36:23.336325000 JST",,"6000  >  52002 [FIN, ACK] Seq=1 Ack=29 Win=65152 Len=0 TSval=1538898861 TSecr=3941364750"
34,8.299124,192.168.11.47,192.168.11.46,TCP,66,0.006445,,0.006445,"Jan  6, 2024 19:36:23.342770000 JST",,52002  >  6000 [ACK] Seq=29 Ack=2 Win=64256 Len=0 TSval=3941364758 TSecr=1538898861
35,19.090571,192.168.11.46,192.168.11.45,TCP,74,,,10.791447,"Jan  6, 2024 19:36:34.134217000 JST",,43370  >  6000 [SYN] Seq=0 Win=64240 Len=0 MSS=1460 SACK_PERM TSval=1148724362 TSecr=0 WS=128
36,19.097103,192.168.11.45,192.168.11.46,TCP,74,0.006532,,0.006532,"Jan  6, 2024 19:36:34.140749000 JST",,"6000  >  43370 [SYN, ACK] Seq=0 Ack=1 Win=65160 Len=0 MSS=1460 SACK_PERM TSval=962167265 TSecr=1148724362 WS=128"
37,19.097224,192.168.11.46,192.168.11.45,TCP,66,0.000121,,0.000121,"Jan  6, 2024 19:36:34.140870000 JST",,43370  >  6000 [ACK] Seq=1 Ack=1 Win=64256 Len=0 TSval=1148724368 TSecr=962167265
38,19.097611,192.168.11.46,192.168.11.45,TCP,93,,,0.000387,"Jan  6, 2024 19:36:34.141257000 JST",,"43370  >  6000 [PSH, ACK] Seq=1 Ack=1 Win=64256 Len=27 TSval=1148724369 TSecr=962167265 [TCP segment of a reassembled PDU]"
39,19.09788,192.168.11.46,192.168.11.45,TCP,66,,,0.000269,"Jan  6, 2024 19:36:34.141526000 JST",,"43370  >  6000 [FIN, ACK] Seq=28 Ack=1 Win=64256 Len=0 TSval=1148724369 TSecr=962167265"
40,19.105185,192.168.11.45,192.168.11.46,TCP,66,0.007574,,0.007305,"Jan  6, 2024 19:36:34.148831000 JST",,6000  >  43370 [ACK] Seq=1 Ack=28 Win=65152 Len=0 TSval=962167272 TSecr=1148724369
41,19.10556,192.168.11.45,192.168.11.46,TCP,66,0.00768,,0.000375,"Jan  6, 2024 19:36:34.149206000 JST",,"6000  >  43370 [FIN, ACK] Seq=1 Ack=29 Win=65152 Len=0 TSval=962167273 TSecr=1148724369"
42,19.105618,192.168.11.46,192.168.11.45,TCP,66,0.000058,,0.000058,"Jan  6, 2024 19:36:34.149264000 JST",,43370  >  6000 [ACK] Seq=29 Ack=2 Win=64256 Len=0 TSval=1148724377 TSecr=962167273
43,19.142019,192.168.11.46,255.255.255.255,UDP,209,,Åü,0.036401,"Jan  6, 2024 19:36:34.185665000 JST",7b2273656d616e74696373223a207b22656e74697479223a2022504944222c202262617365656e74697479223a2022616e79222c2022726f6c65223a2022303036222c20227370617469616c223a2022616e79222c202274656d706f72616c223a2022616e79227d2c20226461746170726f7065727479223a207b22666f726d6174223a2022696e616f6b615f70726f6772616d5f73616d706c655f73656d616e746963227d7d,54178  >  7000 Len=167
44,19.149767,192.168.11.47,192.168.11.46,TCP,74,,Åú,0.007748,"Jan  6, 2024 19:36:34.193413000 JST",,50674  >  6000 [SYN] Seq=0 Win=64240 Len=0 MSS=1460 SACK_PERM TSval=3941375609 TSecr=0 WS=128
45,19.150006,192.168.11.46,192.168.11.47,TCP,74,0.000239,,0.000239,"Jan  6, 2024 19:36:34.193652000 JST",,"6000  >  50674 [SYN, ACK] Seq=0 Ack=1 Win=65160 Len=0 MSS=1460 SACK_PERM TSval=1538909718 TSecr=3941375609 WS=128"
46,19.156972,192.168.11.47,192.168.11.46,TCP,66,0.006966,,0.006966,"Jan  6, 2024 19:36:34.200618000 JST",,50674  >  6000 [ACK] Seq=1 Ack=1 Win=64256 Len=0 TSval=3941375617 TSecr=1538909718
47,19.157962,192.168.11.47,192.168.11.46,TCP,93,,,0.00099,"Jan  6, 2024 19:36:34.201608000 JST",,"50674  >  6000 [PSH, ACK] Seq=1 Ack=1 Win=64256 Len=27 TSval=3941375617 TSecr=1538909718 [TCP segment of a reassembled PDU]"
48,19.158164,192.168.11.46,192.168.11.47,TCP,66,0.000202,,0.000202,"Jan  6, 2024 19:36:34.201810000 JST",,6000  >  50674 [ACK] Seq=1 Ack=28 Win=65152 Len=0 TSval=1538909726 TSecr=3941375617
49,19.158518,192.168.11.47,192.168.11.46,TCP,66,,,0.000354,"Jan  6, 2024 19:36:34.202164000 JST",,"50674  >  6000 [FIN, ACK] Seq=28 Ack=1 Win=64256 Len=0 TSval=3941375617 TSecr=1538909718"
50,19.16073,192.168.11.46,192.168.11.47,TCP,66,0.002212,,0.002212,"Jan  6, 2024 19:36:34.204376000 JST",,"6000  >  50674 [FIN, ACK] Seq=1 Ack=29 Win=65152 Len=0 TSval=1538909729 TSecr=3941375617"
51,19.165372,192.168.11.47,192.168.11.46,TCP,66,0.004642,,0.004642,"Jan  6, 2024 19:36:34.209018000 JST",,50674  >  6000 [ACK] Seq=29 Ack=2 Win=64256 Len=0 TSval=3941375625 TSecr=1538909729
52,27.9764,192.168.11.46,192.168.11.45,TCP,74,,,8.811028,"Jan  6, 2024 19:36:43.020046000 JST",,33276  >  6000 [SYN] Seq=0 Win=64240 Len=0 MSS=1460 SACK_PERM TSval=1148733248 TSecr=0 WS=128
53,27.983332,192.168.11.45,192.168.11.46,TCP,74,0.006932,,0.006932,"Jan  6, 2024 19:36:43.026978000 JST",,"6000  >  33276 [SYN, ACK] Seq=0 Ack=1 Win=65160 Len=0 MSS=1460 SACK_PERM TSval=962176151 TSecr=1148733248 WS=128"
54,27.983451,192.168.11.46,192.168.11.45,TCP,66,0.000119,,0.000119,"Jan  6, 2024 19:36:43.027097000 JST",,33276  >  6000 [ACK] Seq=1 Ack=1 Win=64256 Len=0 TSval=1148733255 TSecr=962176151
55,27.983599,192.168.11.46,192.168.11.45,TCP,93,,,0.000148,"Jan  6, 2024 19:36:43.027245000 JST",,"33276  >  6000 [PSH, ACK] Seq=1 Ack=1 Win=64256 Len=27 TSval=1148733255 TSecr=962176151 [TCP segment of a reassembled PDU]"
56,27.983721,192.168.11.46,192.168.11.45,TCP,66,,,0.000122,"Jan  6, 2024 19:36:43.027367000 JST",,"33276  >  6000 [FIN, ACK] Seq=28 Ack=1 Win=64256 Len=0 TSval=1148733255 TSecr=962176151"
57,27.993221,192.168.11.45,192.168.11.46,TCP,66,0.009622,,0.0095,"Jan  6, 2024 19:36:43.036867000 JST",,6000  >  33276 [ACK] Seq=1 Ack=28 Win=65152 Len=0 TSval=962176161 TSecr=1148733255
58,27.993594,192.168.11.45,192.168.11.46,TCP,66,0.009873,,0.000373,"Jan  6, 2024 19:36:43.037240000 JST",,"6000  >  33276 [FIN, ACK] Seq=1 Ack=29 Win=65152 Len=0 TSval=962176162 TSecr=1148733255"
59,27.993666,192.168.11.46,192.168.11.45,TCP,66,0.000072,,0.000072,"Jan  6, 2024 19:36:43.037312000 JST",,33276  >  6000 [ACK] Seq=29 Ack=2 Win=64256 Len=0 TSval=1148733265 TSecr=962176162
60,28.023575,192.168.11.46,255.255.255.255,UDP,209,,Åü,0.029909,"Jan  6, 2024 19:36:43.067221000 JST",7b2273656d616e74696373223a207b22656e74697479223a2022504944222c202262617365656e74697479223a2022616e79222c2022726f6c65223a2022303036222c20227370617469616c223a2022616e79222c202274656d706f72616c223a2022616e79227d2c20226461746170726f7065727479223a207b22666f726d6174223a2022696e616f6b615f70726f6772616d5f73616d706c655f73656d616e746963227d7d,45796  >  7000 Len=167
61,28.034545,192.168.11.47,192.168.11.46,TCP,74,,Åú,0.01097,"Jan  6, 2024 19:36:43.078191000 JST",,50680  >  6000 [SYN] Seq=0 Win=64240 Len=0 MSS=1460 SACK_PERM TSval=3941384491 TSecr=0 WS=128
62,28.034689,192.168.11.46,192.168.11.47,TCP,74,0.000144,,0.000144,"Jan  6, 2024 19:36:43.078335000 JST",,"6000  >  50680 [SYN, ACK] Seq=0 Ack=1 Win=65160 Len=0 MSS=1460 SACK_PERM TSval=1538918603 TSecr=3941384491 WS=128"
63,28.042332,192.168.11.47,192.168.11.46,TCP,66,0.007643,,0.007643,"Jan  6, 2024 19:36:43.085978000 JST",,50680  >  6000 [ACK] Seq=1 Ack=1 Win=64256 Len=0 TSval=3941384501 TSecr=1538918603
64,28.04289,192.168.11.47,192.168.11.46,TCP,93,,,0.000558,"Jan  6, 2024 19:36:43.086536000 JST",,"50680  >  6000 [PSH, ACK] Seq=1 Ack=1 Win=64256 Len=27 TSval=3941384501 TSecr=1538918603 [TCP segment of a reassembled PDU]"
65,28.042968,192.168.11.46,192.168.11.47,TCP,66,0.000078,,0.000078,"Jan  6, 2024 19:36:43.086614000 JST",,6000  >  50680 [ACK] Seq=1 Ack=28 Win=65152 Len=0 TSval=1538918611 TSecr=3941384501
66,28.043035,192.168.11.47,192.168.11.46,TCP,66,,,0.000067,"Jan  6, 2024 19:36:43.086681000 JST",,"50680  >  6000 [FIN, ACK] Seq=28 Ack=1 Win=64256 Len=0 TSval=3941384501 TSecr=1538918603"
67,28.044121,192.168.11.46,192.168.11.47,TCP,66,0.001086,,0.001086,"Jan  6, 2024 19:36:43.087767000 JST",,"6000  >  50680 [FIN, ACK] Seq=1 Ack=29 Win=65152 Len=0 TSval=1538918612 TSecr=3941384501"
68,28.05031,192.168.11.47,192.168.11.46,TCP,66,0.006189,,0.006189,"Jan  6, 2024 19:36:43.093956000 JST",,50680  >  6000 [ACK] Seq=29 Ack=2 Win=64256 Len=0 TSval=3941384510 TSecr=1538918612
69,35.789035,192.168.11.46,192.168.11.45,TCP,74,,,7.738725,"Jan  6, 2024 19:36:50.832681000 JST",,51344  >  6000 [SYN] Seq=0 Win=64240 Len=0 MSS=1460 SACK_PERM TSval=1148741060 TSecr=0 WS=128
70,35.795799,192.168.11.45,192.168.11.46,TCP,74,0.006764,,0.006764,"Jan  6, 2024 19:36:50.839445000 JST",,"6000  >  51344 [SYN, ACK] Seq=0 Ack=1 Win=65160 Len=0 MSS=1460 SACK_PERM TSval=962183964 TSecr=1148741060 WS=128"
71,35.795932,192.168.11.46,192.168.11.45,TCP,66,0.000133,,0.000133,"Jan  6, 2024 19:36:50.839578000 JST",,51344  >  6000 [ACK] Seq=1 Ack=1 Win=64256 Len=0 TSval=1148741067 TSecr=962183964
72,35.79612,192.168.11.46,192.168.11.45,TCP,93,,,0.000188,"Jan  6, 2024 19:36:50.839766000 JST",,"51344  >  6000 [PSH, ACK] Seq=1 Ack=1 Win=64256 Len=27 TSval=1148741067 TSecr=962183964 [TCP segment of a reassembled PDU]"
73,35.796245,192.168.11.46,192.168.11.45,TCP,66,,,0.000125,"Jan  6, 2024 19:36:50.839891000 JST",,"51344  >  6000 [FIN, ACK] Seq=28 Ack=1 Win=64256 Len=0 TSval=1148741068 TSecr=962183964"
74,35.803124,192.168.11.45,192.168.11.46,TCP,66,0.007004,,0.006879,"Jan  6, 2024 19:36:50.846770000 JST",,6000  >  51344 [ACK] Seq=1 Ack=28 Win=65152 Len=0 TSval=962183970 TSecr=1148741067
75,35.80351,192.168.11.45,192.168.11.46,TCP,66,0.007265,,0.000386,"Jan  6, 2024 19:36:50.847156000 JST",,"6000  >  51344 [FIN, ACK] Seq=1 Ack=29 Win=65152 Len=0 TSval=962183972 TSecr=1148741068"
76,35.803565,192.168.11.46,192.168.11.45,TCP,66,0.000055,,0.000055,"Jan  6, 2024 19:36:50.847211000 JST",,51344  >  6000 [ACK] Seq=29 Ack=2 Win=64256 Len=0 TSval=1148741075 TSecr=962183972
77,35.83339,192.168.11.46,255.255.255.255,UDP,209,,Åü,0.029825,"Jan  6, 2024 19:36:50.877036000 JST",7b2273656d616e74696373223a207b22656e74697479223a2022504944222c202262617365656e74697479223a2022616e79222c2022726f6c65223a2022303036222c20227370617469616c223a2022616e79222c202274656d706f72616c223a2022616e79227d2c20226461746170726f7065727479223a207b22666f726d6174223a2022696e616f6b615f70726f6772616d5f73616d706c655f73656d616e746963227d7d,54346  >  7000 Len=167
78,35.841563,192.168.11.47,192.168.11.46,TCP,74,,Åú,0.008173,"Jan  6, 2024 19:36:50.885209000 JST",,58284  >  6000 [SYN] Seq=0 Win=64240 Len=0 MSS=1460 SACK_PERM TSval=3941392301 TSecr=0 WS=128
79,35.841701,192.168.11.46,192.168.11.47,TCP,74,0.000138,,0.000138,"Jan  6, 2024 19:36:50.885347000 JST",,"6000  >  58284 [SYN, ACK] Seq=0 Ack=1 Win=65160 Len=0 MSS=1460 SACK_PERM TSval=1538926410 TSecr=3941392301 WS=128"
80,35.84826,192.168.11.47,192.168.11.46,TCP,66,0.006559,,0.006559,"Jan  6, 2024 19:36:50.891906000 JST",,58284  >  6000 [ACK] Seq=1 Ack=1 Win=64256 Len=0 TSval=3941392308 TSecr=1538926410
81,35.849111,192.168.11.47,192.168.11.46,TCP,93,,,0.000851,"Jan  6, 2024 19:36:50.892757000 JST",,"58284  >  6000 [PSH, ACK] Seq=1 Ack=1 Win=64256 Len=27 TSval=3941392308 TSecr=1538926410 [TCP segment of a reassembled PDU]"
82,35.849333,192.168.11.46,192.168.11.47,TCP,66,0.000222,,0.000222,"Jan  6, 2024 19:36:50.892979000 JST",,6000  >  58284 [ACK] Seq=1 Ack=28 Win=65152 Len=0 TSval=1538926417 TSecr=3941392308
83,35.849532,192.168.11.47,192.168.11.46,TCP,66,,,0.000199,"Jan  6, 2024 19:36:50.893178000 JST",,"58284  >  6000 [FIN, ACK] Seq=28 Ack=1 Win=64256 Len=0 TSval=3941392308 TSecr=1538926410"
84,35.851023,192.168.11.46,192.168.11.47,TCP,66,0.001491,,0.001491,"Jan  6, 2024 19:36:50.894669000 JST",,"6000  >  58284 [FIN, ACK] Seq=1 Ack=29 Win=65152 Len=0 TSval=1538926419 TSecr=3941392308"
85,35.856742,192.168.11.47,192.168.11.46,TCP,66,0.005719,,0.005719,"Jan  6, 2024 19:36:50.900388000 JST",,58284  >  6000 [ACK] Seq=29 Ack=2 Win=64256 Len=0 TSval=3941392316 TSecr=1538926419
86,43.625036,192.168.11.46,192.168.11.45,TCP,74,,,7.768294,"Jan  6, 2024 19:36:58.668682000 JST",,51120  >  6000 [SYN] Seq=0 Win=64240 Len=0 MSS=1460 SACK_PERM TSval=1148748896 TSecr=0 WS=128
87,43.631737,192.168.11.45,192.168.11.46,TCP,74,0.006701,,0.006701,"Jan  6, 2024 19:36:58.675383000 JST",,"6000  >  51120 [SYN, ACK] Seq=0 Ack=1 Win=65160 Len=0 MSS=1460 SACK_PERM TSval=962191799 TSecr=1148748896 WS=128"
88,43.63187,192.168.11.46,192.168.11.45,TCP,66,0.000133,,0.000133,"Jan  6, 2024 19:36:58.675516000 JST",,51120  >  6000 [ACK] Seq=1 Ack=1 Win=64256 Len=0 TSval=1148748903 TSecr=962191799
89,43.632018,192.168.11.46,192.168.11.45,TCP,93,,,0.000148,"Jan  6, 2024 19:36:58.675664000 JST",,"51120  >  6000 [PSH, ACK] Seq=1 Ack=1 Win=64256 Len=27 TSval=1148748903 TSecr=962191799 [TCP segment of a reassembled PDU]"
90,43.632142,192.168.11.46,192.168.11.45,TCP,66,,,0.000124,"Jan  6, 2024 19:36:58.675788000 JST",,"51120  >  6000 [FIN, ACK] Seq=28 Ack=1 Win=64256 Len=0 TSval=1148748903 TSecr=962191799"
91,43.639305,192.168.11.45,192.168.11.46,TCP,66,0.007287,,0.007163,"Jan  6, 2024 19:36:58.682951000 JST",,6000  >  51120 [ACK] Seq=1 Ack=28 Win=65152 Len=0 TSval=962191807 TSecr=1148748903
92,43.639699,192.168.11.45,192.168.11.46,TCP,66,0.007557,,0.000394,"Jan  6, 2024 19:36:58.683345000 JST",,"6000  >  51120 [FIN, ACK] Seq=1 Ack=29 Win=65152 Len=0 TSval=962191808 TSecr=1148748903"
93,43.639778,192.168.11.46,192.168.11.45,TCP,66,0.000079,,0.000079,"Jan  6, 2024 19:36:58.683424000 JST",,51120  >  6000 [ACK] Seq=29 Ack=2 Win=64256 Len=0 TSval=1148748911 TSecr=962191808
94,43.669544,192.168.11.46,255.255.255.255,UDP,209,,Åü,0.029766,"Jan  6, 2024 19:36:58.713190000 JST",7b2273656d616e74696373223a207b22656e74697479223a2022504944222c202262617365656e74697479223a2022616e79222c2022726f6c65223a2022303036222c20227370617469616c223a2022616e79222c202274656d706f72616c223a2022616e79227d2c20226461746170726f7065727479223a207b22666f726d6174223a2022696e616f6b615f70726f6772616d5f73616d706c655f73656d616e746963227d7d,59613  >  7000 Len=167
95,43.677288,192.168.11.47,192.168.11.46,TCP,74,,Åú,0.007744,"Jan  6, 2024 19:36:58.720934000 JST",,36358  >  6000 [SYN] Seq=0 Win=64240 Len=0 MSS=1460 SACK_PERM TSval=3941400137 TSecr=0 WS=128
96,43.677428,192.168.11.46,192.168.11.47,TCP,74,0.00014,,0.00014,"Jan  6, 2024 19:36:58.721074000 JST",,"6000  >  36358 [SYN, ACK] Seq=0 Ack=1 Win=65160 Len=0 MSS=1460 SACK_PERM TSval=1538934246 TSecr=3941400137 WS=128"
97,43.684024,192.168.11.47,192.168.11.46,TCP,66,0.006596,,0.006596,"Jan  6, 2024 19:36:58.727670000 JST",,36358  >  6000 [ACK] Seq=1 Ack=1 Win=64256 Len=0 TSval=3941400144 TSecr=1538934246
98,43.684635,192.168.11.47,192.168.11.46,TCP,93,,,0.000611,"Jan  6, 2024 19:36:58.728281000 JST",,"36358  >  6000 [PSH, ACK] Seq=1 Ack=1 Win=64256 Len=27 TSval=3941400144 TSecr=1538934246 [TCP segment of a reassembled PDU]"
99,43.684738,192.168.11.46,192.168.11.47,TCP,66,0.000103,,0.000103,"Jan  6, 2024 19:36:58.728384000 JST",,6000  >  36358 [ACK] Seq=1 Ack=28 Win=65152 Len=0 TSval=1538934253 TSecr=3941400144
100,43.684818,192.168.11.47,192.168.11.46,TCP,66,,,0.00008,"Jan  6, 2024 19:36:58.728464000 JST",,"36358  >  6000 [FIN, ACK] Seq=28 Ack=1 Win=64256 Len=0 TSval=3941400144 TSecr=1538934246"
101,43.686318,192.168.11.46,192.168.11.47,TCP,66,0.0015,,0.0015,"Jan  6, 2024 19:36:58.729964000 JST",,"6000  >  36358 [FIN, ACK] Seq=1 Ack=29 Win=65152 Len=0 TSval=1538934254 TSecr=3941400144"
102,43.694198,192.168.11.47,192.168.11.46,TCP,66,0.00788,,0.00788,"Jan  6, 2024 19:36:58.737844000 JST",,36358  >  6000 [ACK] Seq=29 Ack=2 Win=64256 Len=0 TSval=3941400153 TSecr=1538934254
103,51.712348,192.168.11.46,192.168.11.45,TCP,74,,,8.01815,"Jan  6, 2024 19:37:06.755994000 JST",,34070  >  6000 [SYN] Seq=0 Win=64240 Len=0 MSS=1460 SACK_PERM TSval=1148756984 TSecr=0 WS=128
104,51.719791,192.168.11.45,192.168.11.46,TCP,74,0.007443,,0.007443,"Jan  6, 2024 19:37:06.763437000 JST",,"6000  >  34070 [SYN, ACK] Seq=0 Ack=1 Win=65160 Len=0 MSS=1460 SACK_PERM TSval=962199887 TSecr=1148756984 WS=128"
105,51.719911,192.168.11.46,192.168.11.45,TCP,66,0.00012,,0.00012,"Jan  6, 2024 19:37:06.763557000 JST",,34070  >  6000 [ACK] Seq=1 Ack=1 Win=64256 Len=0 TSval=1148756991 TSecr=962199887
106,51.720051,192.168.11.46,192.168.11.45,TCP,93,,,0.00014,"Jan  6, 2024 19:37:06.763697000 JST",,"34070  >  6000 [PSH, ACK] Seq=1 Ack=1 Win=64256 Len=27 TSval=1148756991 TSecr=962199887 [TCP segment of a reassembled PDU]"
107,51.720151,192.168.11.46,192.168.11.45,TCP,66,,,0.0001,"Jan  6, 2024 19:37:06.763797000 JST",,"34070  >  6000 [FIN, ACK] Seq=28 Ack=1 Win=64256 Len=0 TSval=1148756991 TSecr=962199887"
108,51.727046,192.168.11.45,192.168.11.46,TCP,66,0.006995,,0.006895,"Jan  6, 2024 19:37:06.770692000 JST",,6000  >  34070 [ACK] Seq=1 Ack=28 Win=65152 Len=0 TSval=962199895 TSecr=1148756991
109,51.727429,192.168.11.45,192.168.11.46,TCP,66,0.007278,,0.000383,"Jan  6, 2024 19:37:06.771075000 JST",,"6000  >  34070 [FIN, ACK] Seq=1 Ack=29 Win=65152 Len=0 TSval=962199896 TSecr=1148756991"
110,51.727489,192.168.11.46,192.168.11.45,TCP,66,0.00006,,0.00006,"Jan  6, 2024 19:37:06.771135000 JST",,34070  >  6000 [ACK] Seq=29 Ack=2 Win=64256 Len=0 TSval=1148756999 TSecr=962199896
111,51.7559,192.168.11.46,255.255.255.255,UDP,209,,Åü,0.028411,"Jan  6, 2024 19:37:06.799546000 JST",7b2273656d616e74696373223a207b22656e74697479223a2022504944222c202262617365656e74697479223a2022616e79222c2022726f6c65223a2022303036222c20227370617469616c223a2022616e79222c202274656d706f72616c223a2022616e79227d2c20226461746170726f7065727479223a207b22666f726d6174223a2022696e616f6b615f70726f6772616d5f73616d706c655f73656d616e746963227d7d,58528  >  7000 Len=167
112,51.764098,192.168.11.47,192.168.11.46,TCP,74,,Åú,0.008198,"Jan  6, 2024 19:37:06.807744000 JST",,58388  >  6000 [SYN] Seq=0 Win=64240 Len=0 MSS=1460 SACK_PERM TSval=3941408224 TSecr=0 WS=128
113,51.764239,192.168.11.46,192.168.11.47,TCP,74,0.000141,,0.000141,"Jan  6, 2024 19:37:06.807885000 JST",,"6000  >  58388 [SYN, ACK] Seq=0 Ack=1 Win=65160 Len=0 MSS=1460 SACK_PERM TSval=1538942332 TSecr=3941408224 WS=128"
114,51.770714,192.168.11.47,192.168.11.46,TCP,66,0.006475,,0.006475,"Jan  6, 2024 19:37:06.814360000 JST",,58388  >  6000 [ACK] Seq=1 Ack=1 Win=64256 Len=0 TSval=3941408231 TSecr=1538942332
115,51.771156,192.168.11.47,192.168.11.46,TCP,93,,,0.000442,"Jan  6, 2024 19:37:06.814802000 JST",,"58388  >  6000 [PSH, ACK] Seq=1 Ack=1 Win=64256 Len=27 TSval=3941408231 TSecr=1538942332 [TCP segment of a reassembled PDU]"
116,51.771219,192.168.11.46,192.168.11.47,TCP,66,0.000063,,0.000063,"Jan  6, 2024 19:37:06.814865000 JST",,6000  >  58388 [ACK] Seq=1 Ack=28 Win=65152 Len=0 TSval=1538942339 TSecr=3941408231
117,51.771271,192.168.11.47,192.168.11.46,TCP,66,,,0.000052,"Jan  6, 2024 19:37:06.814917000 JST",,"58388  >  6000 [FIN, ACK] Seq=28 Ack=1 Win=64256 Len=0 TSval=3941408231 TSecr=1538942332"
118,51.772203,192.168.11.46,192.168.11.47,TCP,66,0.000932,,0.000932,"Jan  6, 2024 19:37:06.815849000 JST",,"6000  >  58388 [FIN, ACK] Seq=1 Ack=29 Win=65152 Len=0 TSval=1538942340 TSecr=3941408231"
119,51.782888,192.168.11.47,192.168.11.46,TCP,66,0.010685,,0.010685,"Jan  6, 2024 19:37:06.826534000 JST",,58388  >  6000 [ACK] Seq=29 Ack=2 Win=64256 Len=0 TSval=3941408238 TSecr=1538942340
120,60.811078,192.168.11.46,192.168.11.45,TCP,74,,,9.02819,"Jan  6, 2024 19:37:15.854724000 JST",,59036  >  6000 [SYN] Seq=0 Win=64240 Len=0 MSS=1460 SACK_PERM TSval=1148766082 TSecr=0 WS=128
121,60.818898,192.168.11.45,192.168.11.46,TCP,74,0.00782,,0.00782,"Jan  6, 2024 19:37:15.862544000 JST",,"6000  >  59036 [SYN, ACK] Seq=0 Ack=1 Win=65160 Len=0 MSS=1460 SACK_PERM TSval=962208986 TSecr=1148766082 WS=128"
122,60.819024,192.168.11.46,192.168.11.45,TCP,66,0.000126,,0.000126,"Jan  6, 2024 19:37:15.862670000 JST",,59036  >  6000 [ACK] Seq=1 Ack=1 Win=64256 Len=0 TSval=1148766090 TSecr=962208986
123,60.819205,192.168.11.46,192.168.11.45,TCP,93,,,0.000181,"Jan  6, 2024 19:37:15.862851000 JST",,"59036  >  6000 [PSH, ACK] Seq=1 Ack=1 Win=64256 Len=27 TSval=1148766090 TSecr=962208986 [TCP segment of a reassembled PDU]"
124,60.819314,192.168.11.46,192.168.11.45,TCP,66,,,0.000109,"Jan  6, 2024 19:37:15.862960000 JST",,"59036  >  6000 [FIN, ACK] Seq=28 Ack=1 Win=64256 Len=0 TSval=1148766091 TSecr=962208986"
125,60.826761,192.168.11.45,192.168.11.46,TCP,66,0.007556,,0.007447,"Jan  6, 2024 19:37:15.870407000 JST",,6000  >  59036 [ACK] Seq=1 Ack=28 Win=65152 Len=0 TSval=962208994 TSecr=1148766090
126,60.826994,192.168.11.45,192.168.11.46,TCP,66,0.00768,,0.000233,"Jan  6, 2024 19:37:15.870640000 JST",,"6000  >  59036 [FIN, ACK] Seq=1 Ack=29 Win=65152 Len=0 TSval=962208995 TSecr=1148766091"
127,60.827055,192.168.11.46,192.168.11.45,TCP,66,0.000061,,0.000061,"Jan  6, 2024 19:37:15.870701000 JST",,59036  >  6000 [ACK] Seq=29 Ack=2 Win=64256 Len=0 TSval=1148766098 TSecr=962208995
128,60.860444,192.168.11.46,255.255.255.255,UDP,209,,Åü,0.033389,"Jan  6, 2024 19:37:15.904090000 JST",7b2273656d616e74696373223a207b22656e74697479223a2022504944222c202262617365656e74697479223a2022616e79222c2022726f6c65223a2022303036222c20227370617469616c223a2022616e79222c202274656d706f72616c223a2022616e79227d2c20226461746170726f7065727479223a207b22666f726d6174223a2022696e616f6b615f70726f6772616d5f73616d706c655f73656d616e746963227d7d,57481  >  7000 Len=167
129,60.868693,192.168.11.47,192.168.11.46,TCP,74,,Åú,0.008249,"Jan  6, 2024 19:37:15.912339000 JST",,44618  >  6000 [SYN] Seq=0 Win=64240 Len=0 MSS=1460 SACK_PERM TSval=3941417328 TSecr=0 WS=128
130,60.868854,192.168.11.46,192.168.11.47,TCP,74,0.000161,,0.000161,"Jan  6, 2024 19:37:15.912500000 JST",,"6000  >  44618 [SYN, ACK] Seq=0 Ack=1 Win=65160 Len=0 MSS=1460 SACK_PERM TSval=1538951437 TSecr=3941417328 WS=128"
131,60.876311,192.168.11.47,192.168.11.46,TCP,66,0.007457,,0.007457,"Jan  6, 2024 19:37:15.919957000 JST",,44618  >  6000 [ACK] Seq=1 Ack=1 Win=64256 Len=0 TSval=3941417335 TSecr=1538951437
132,60.876842,192.168.11.47,192.168.11.46,TCP,93,,,0.000531,"Jan  6, 2024 19:37:15.920488000 JST",,"44618  >  6000 [PSH, ACK] Seq=1 Ack=1 Win=64256 Len=27 TSval=3941417335 TSecr=1538951437 [TCP segment of a reassembled PDU]"
133,60.876946,192.168.11.46,192.168.11.47,TCP,66,0.000104,,0.000104,"Jan  6, 2024 19:37:15.920592000 JST",,6000  >  44618 [ACK] Seq=1 Ack=28 Win=65152 Len=0 TSval=1538951445 TSecr=3941417335
134,60.877021,192.168.11.47,192.168.11.46,TCP,66,,,0.000075,"Jan  6, 2024 19:37:15.920667000 JST",,"44618  >  6000 [FIN, ACK] Seq=28 Ack=1 Win=64256 Len=0 TSval=3941417336 TSecr=1538951437"
135,60.878084,192.168.11.46,192.168.11.47,TCP,66,0.001063,,0.001063,"Jan  6, 2024 19:37:15.921730000 JST",,"6000  >  44618 [FIN, ACK] Seq=1 Ack=29 Win=65152 Len=0 TSval=1538951446 TSecr=3941417336"
136,60.884591,192.168.11.47,192.168.11.46,TCP,66,0.006507,,0.006507,"Jan  6, 2024 19:37:15.928237000 JST",,44618  >  6000 [ACK] Seq=29 Ack=2 Win=64256 Len=0 TSval=3941417344 TSecr=1538951446
137,72.719978,192.168.11.46,192.168.11.45,TCP,74,,,11.835387,"Jan  6, 2024 19:37:27.763624000 JST",,60752  >  6000 [SYN] Seq=0 Win=64240 Len=0 MSS=1460 SACK_PERM TSval=1148777991 TSecr=0 WS=128
138,72.726763,192.168.11.45,192.168.11.46,TCP,74,0.006785,,0.006785,"Jan  6, 2024 19:37:27.770409000 JST",,"6000  >  60752 [SYN, ACK] Seq=0 Ack=1 Win=65160 Len=0 MSS=1460 SACK_PERM TSval=962220894 TSecr=1148777991 WS=128"
139,72.726874,192.168.11.46,192.168.11.45,TCP,66,0.000111,,0.000111,"Jan  6, 2024 19:37:27.770520000 JST",,60752  >  6000 [ACK] Seq=1 Ack=1 Win=64256 Len=0 TSval=1148777998 TSecr=962220894
140,72.727023,192.168.11.46,192.168.11.45,TCP,93,,,0.000149,"Jan  6, 2024 19:37:27.770669000 JST",,"60752  >  6000 [PSH, ACK] Seq=1 Ack=1 Win=64256 Len=27 TSval=1148777998 TSecr=962220894 [TCP segment of a reassembled PDU]"
141,72.727122,192.168.11.46,192.168.11.45,TCP,66,,,0.000099,"Jan  6, 2024 19:37:27.770768000 JST",,"60752  >  6000 [FIN, ACK] Seq=28 Ack=1 Win=64256 Len=0 TSval=1148777998 TSecr=962220894"
142,72.734538,192.168.11.45,192.168.11.46,TCP,66,0.007515,,0.007416,"Jan  6, 2024 19:37:27.778184000 JST",,6000  >  60752 [ACK] Seq=1 Ack=28 Win=65152 Len=0 TSval=962220902 TSecr=1148777998
143,72.737895,192.168.11.45,192.168.11.46,TCP,66,0.010773,,0.003357,"Jan  6, 2024 19:37:27.781541000 JST",,"6000  >  60752 [FIN, ACK] Seq=1 Ack=29 Win=65152 Len=0 TSval=962220904 TSecr=1148777998"
144,72.737942,192.168.11.46,192.168.11.45,TCP,66,0.000047,,0.000047,"Jan  6, 2024 19:37:27.781588000 JST",,60752  >  6000 [ACK] Seq=29 Ack=2 Win=64256 Len=0 TSval=1148778009 TSecr=962220904
145,72.769292,192.168.11.46,255.255.255.255,UDP,209,,Åü,0.03135,"Jan  6, 2024 19:37:27.812938000 JST",7b2273656d616e74696373223a207b22656e74697479223a2022504944222c202262617365656e74697479223a2022616e79222c2022726f6c65223a2022303036222c20227370617469616c223a2022616e79222c202274656d706f72616c223a2022616e79227d2c20226461746170726f7065727479223a207b22666f726d6174223a2022696e616f6b615f70726f6772616d5f73616d706c655f73656d616e746963227d7d,51718  >  7000 Len=167
146,72.778174,192.168.11.47,192.168.11.46,TCP,74,,Åú,0.008882,"Jan  6, 2024 19:37:27.821820000 JST",,33492  >  6000 [SYN] Seq=0 Win=64240 Len=0 MSS=1460 SACK_PERM TSval=3941429237 TSecr=0 WS=128
147,72.778375,192.168.11.46,192.168.11.47,TCP,74,0.000201,,0.000201,"Jan  6, 2024 19:37:27.822021000 JST",,"6000  >  33492 [SYN, ACK] Seq=0 Ack=1 Win=65160 Len=0 MSS=1460 SACK_PERM TSval=1538963347 TSecr=3941429237 WS=128"
148,72.786475,192.168.11.47,192.168.11.46,TCP,66,0.0081,,0.0081,"Jan  6, 2024 19:37:27.830121000 JST",,33492  >  6000 [ACK] Seq=1 Ack=1 Win=64256 Len=0 TSval=3941429246 TSecr=1538963347
149,72.787318,192.168.11.47,192.168.11.46,TCP,93,,,0.000843,"Jan  6, 2024 19:37:27.830964000 JST",,"33492  >  6000 [PSH, ACK] Seq=1 Ack=1 Win=64256 Len=27 TSval=3941429246 TSecr=1538963347 [TCP segment of a reassembled PDU]"
150,72.787532,192.168.11.46,192.168.11.47,TCP,66,0.000214,,0.000214,"Jan  6, 2024 19:37:27.831178000 JST",,6000  >  33492 [ACK] Seq=1 Ack=28 Win=65152 Len=0 TSval=1538963356 TSecr=3941429246
151,72.787677,192.168.11.47,192.168.11.46,TCP,66,,,0.000145,"Jan  6, 2024 19:37:27.831323000 JST",,"33492  >  6000 [FIN, ACK] Seq=28 Ack=1 Win=64256 Len=0 TSval=3941429246 TSecr=1538963347"
152,72.790056,192.168.11.46,192.168.11.47,TCP,66,0.002379,,0.002379,"Jan  6, 2024 19:37:27.833702000 JST",,"6000  >  33492 [FIN, ACK] Seq=1 Ack=29 Win=65152 Len=0 TSval=1538963358 TSecr=3941429246"
153,72.797805,192.168.11.47,192.168.11.46,TCP,66,0.007749,,0.007749,"Jan  6, 2024 19:37:27.841451000 JST",,33492  >  6000 [ACK] Seq=29 Ack=2 Win=64256 Len=0 TSval=3941429257 TSecr=1538963358
154,81.586425,192.168.11.46,192.168.11.45,TCP,74,,,8.78862,"Jan  6, 2024 19:37:36.630071000 JST",,43190  >  6000 [SYN] Seq=0 Win=64240 Len=0 MSS=1460 SACK_PERM TSval=1148786858 TSecr=0 WS=128
155,81.602824,192.168.11.45,192.168.11.46,TCP,74,0.016399,,0.016399,"Jan  6, 2024 19:37:36.646470000 JST",,"6000  >  43190 [SYN, ACK] Seq=0 Ack=1 Win=65160 Len=0 MSS=1460 SACK_PERM TSval=962229769 TSecr=1148786858 WS=128"
156,81.602926,192.168.11.46,192.168.11.45,TCP,66,0.000102,,0.000102,"Jan  6, 2024 19:37:36.646572000 JST",,43190  >  6000 [ACK] Seq=1 Ack=1 Win=64256 Len=0 TSval=1148786874 TSecr=962229769
157,81.603107,192.168.11.46,192.168.11.45,TCP,93,,,0.000181,"Jan  6, 2024 19:37:36.646753000 JST",,"43190  >  6000 [PSH, ACK] Seq=1 Ack=1 Win=64256 Len=27 TSval=1148786874 TSecr=962229769 [TCP segment of a reassembled PDU]"
158,81.603215,192.168.11.46,192.168.11.45,TCP,66,,,0.000108,"Jan  6, 2024 19:37:36.646861000 JST",,"43190  >  6000 [FIN, ACK] Seq=28 Ack=1 Win=64256 Len=0 TSval=1148786874 TSecr=962229769"
159,81.611085,192.168.11.45,192.168.11.46,TCP,66,0.007978,,0.00787,"Jan  6, 2024 19:37:36.654731000 JST",,6000  >  43190 [ACK] Seq=1 Ack=28 Win=65152 Len=0 TSval=962229779 TSecr=1148786874
160,81.611306,192.168.11.45,192.168.11.46,TCP,66,0.008091,,0.000221,"Jan  6, 2024 19:37:36.654952000 JST",,"6000  >  43190 [FIN, ACK] Seq=1 Ack=29 Win=65152 Len=0 TSval=962229780 TSecr=1148786874"
161,81.611349,192.168.11.46,192.168.11.45,TCP,66,0.000043,,0.000043,"Jan  6, 2024 19:37:36.654995000 JST",,43190  >  6000 [ACK] Seq=29 Ack=2 Win=64256 Len=0 TSval=1148786883 TSecr=962229780
162,81.645791,192.168.11.46,255.255.255.255,UDP,209,,Åü,0.034442,"Jan  6, 2024 19:37:36.689437000 JST",7b2273656d616e74696373223a207b22656e74697479223a2022504944222c202262617365656e74697479223a2022616e79222c2022726f6c65223a2022303036222c20227370617469616c223a2022616e79222c202274656d706f72616c223a2022616e79227d2c20226461746170726f7065727479223a207b22666f726d6174223a2022696e616f6b615f70726f6772616d5f73616d706c655f73656d616e746963227d7d,56621  >  7000 Len=167
163,81.654089,192.168.11.47,192.168.11.46,TCP,74,,Åú,0.008298,"Jan  6, 2024 19:37:36.697735000 JST",,48098  >  6000 [SYN] Seq=0 Win=64240 Len=0 MSS=1460 SACK_PERM TSval=3941438114 TSecr=0 WS=128
164,81.65427,192.168.11.46,192.168.11.47,TCP,74,0.000181,,0.000181,"Jan  6, 2024 19:37:36.697916000 JST",,"6000  >  48098 [SYN, ACK] Seq=0 Ack=1 Win=65160 Len=0 MSS=1460 SACK_PERM TSval=1538972222 TSecr=3941438114 WS=128"
165,81.668815,192.168.11.47,192.168.11.46,TCP,66,0.014545,,0.014545,"Jan  6, 2024 19:37:36.712461000 JST",,48098  >  6000 [ACK] Seq=1 Ack=1 Win=64256 Len=0 TSval=3941438121 TSecr=1538972222
166,81.669389,192.168.11.47,192.168.11.46,TCP,93,,,0.000574,"Jan  6, 2024 19:37:36.713035000 JST",,"48098  >  6000 [PSH, ACK] Seq=1 Ack=1 Win=64256 Len=27 TSval=3941438121 TSecr=1538972222 [TCP segment of a reassembled PDU]"
167,81.669474,192.168.11.46,192.168.11.47,TCP,66,0.000085,,0.000085,"Jan  6, 2024 19:37:36.713120000 JST",,6000  >  48098 [ACK] Seq=1 Ack=28 Win=65152 Len=0 TSval=1538972238 TSecr=3941438121
168,81.669551,192.168.11.47,192.168.11.46,TCP,66,,,0.000077,"Jan  6, 2024 19:37:36.713197000 JST",,"48098  >  6000 [FIN, ACK] Seq=28 Ack=1 Win=64256 Len=0 TSval=3941438121 TSecr=1538972222"
169,81.670808,192.168.11.46,192.168.11.47,TCP,66,0.001257,,0.001257,"Jan  6, 2024 19:37:36.714454000 JST",,"6000  >  48098 [FIN, ACK] Seq=1 Ack=29 Win=65152 Len=0 TSval=1538972239 TSecr=3941438121"
170,81.682905,192.168.11.47,192.168.11.46,TCP,66,0.012097,,0.012097,"Jan  6, 2024 19:37:36.726551000 JST",,48098  >  6000 [ACK] Seq=29 Ack=2 Win=64256 Len=0 TSval=3941438137 TSecr=1538972239
171,112.804559,192.168.11.46,192.168.11.45,TCP,74,,,31.121654,"Jan  6, 2024 19:38:07.848205000 JST",,55196  >  6000 [SYN] Seq=0 Win=64240 Len=0 MSS=1460 SACK_PERM TSval=1148818076 TSecr=0 WS=128
172,112.811885,192.168.11.45,192.168.11.46,TCP,74,0.007326,,0.007326,"Jan  6, 2024 19:38:07.855531000 JST",,"6000  >  55196 [SYN, ACK] Seq=0 Ack=1 Win=65160 Len=0 MSS=1460 SACK_PERM TSval=962260979 TSecr=1148818076 WS=128"
173,112.811984,192.168.11.46,192.168.11.45,TCP,66,0.000099,,0.000099,"Jan  6, 2024 19:38:07.855630000 JST",,55196  >  6000 [ACK] Seq=1 Ack=1 Win=64256 Len=0 TSval=1148818083 TSecr=962260979
174,112.812201,192.168.11.46,192.168.11.45,TCP,93,,,0.000217,"Jan  6, 2024 19:38:07.855847000 JST",,"55196  >  6000 [PSH, ACK] Seq=1 Ack=1 Win=64256 Len=27 TSval=1148818083 TSecr=962260979 [TCP segment of a reassembled PDU]"
175,112.81232,192.168.11.46,192.168.11.45,TCP,66,,,0.000119,"Jan  6, 2024 19:38:07.855966000 JST",,"55196  >  6000 [FIN, ACK] Seq=28 Ack=1 Win=64256 Len=0 TSval=1148818084 TSecr=962260979"
176,112.824286,192.168.11.45,192.168.11.46,TCP,66,0.012085,,0.011966,"Jan  6, 2024 19:38:07.867932000 JST",,6000  >  55196 [ACK] Seq=1 Ack=28 Win=65152 Len=0 TSval=962260987 TSecr=1148818083
177,112.824664,192.168.11.45,192.168.11.46,TCP,66,0.012344,,0.000378,"Jan  6, 2024 19:38:07.868310000 JST",,"6000  >  55196 [FIN, ACK] Seq=1 Ack=29 Win=65152 Len=0 TSval=962260988 TSecr=1148818084"
178,112.82472,192.168.11.46,192.168.11.45,TCP,66,0.000056,,0.000056,"Jan  6, 2024 19:38:07.868366000 JST",,55196  >  6000 [ACK] Seq=29 Ack=2 Win=64256 Len=0 TSval=1148818096 TSecr=962260988
179,112.851155,192.168.11.46,255.255.255.255,UDP,209,,Åü,0.026435,"Jan  6, 2024 19:38:07.894801000 JST",7b2273656d616e74696373223a207b22656e74697479223a2022504944222c202262617365656e74697479223a2022616e79222c2022726f6c65223a2022303036222c20227370617469616c223a2022616e79222c202274656d706f72616c223a2022616e79227d2c20226461746170726f7065727479223a207b22666f726d6174223a2022696e616f6b615f70726f6772616d5f73616d706c655f73656d616e746963227d7d,49936  >  7000 Len=167
180,112.85853,192.168.11.47,192.168.11.46,TCP,74,,Åú,0.007375,"Jan  6, 2024 19:38:07.902176000 JST",,44666  >  6000 [SYN] Seq=0 Win=64240 Len=0 MSS=1460 SACK_PERM TSval=3941469318 TSecr=0 WS=128
181,112.858629,192.168.11.46,192.168.11.47,TCP,74,0.000099,,0.000099,"Jan  6, 2024 19:38:07.902275000 JST",,"6000  >  44666 [SYN, ACK] Seq=0 Ack=1 Win=65160 Len=0 MSS=1460 SACK_PERM TSval=1539003427 TSecr=3941469318 WS=128"
182,112.865433,192.168.11.47,192.168.11.46,TCP,66,0.006804,,0.006804,"Jan  6, 2024 19:38:07.909079000 JST",,44666  >  6000 [ACK] Seq=1 Ack=1 Win=64256 Len=0 TSval=3941469325 TSecr=1539003427
183,112.865874,192.168.11.47,192.168.11.46,TCP,93,,,0.000441,"Jan  6, 2024 19:38:07.909520000 JST",,"44666  >  6000 [PSH, ACK] Seq=1 Ack=1 Win=64256 Len=27 TSval=3941469326 TSecr=1539003427 [TCP segment of a reassembled PDU]"
184,112.865931,192.168.11.46,192.168.11.47,TCP,66,0.000057,,0.000057,"Jan  6, 2024 19:38:07.909577000 JST",,6000  >  44666 [ACK] Seq=1 Ack=28 Win=65152 Len=0 TSval=1539003434 TSecr=3941469326
185,112.865987,192.168.11.47,192.168.11.46,TCP,66,,,0.000056,"Jan  6, 2024 19:38:07.909633000 JST",,"44666  >  6000 [FIN, ACK] Seq=28 Ack=1 Win=64256 Len=0 TSval=3941469326 TSecr=1539003427"
