No.,Time,Source,Destination,Protocol,Length,The RTT to ACK the segment was,XXX,Time delta from previous captured frame,Arrival Time,Data,Info
1,0,192.168.11.47,192.168.11.46,TCP,74,,,0,"Jan  6, 2024 19:36:15.099929000 JST",,51990  >  6000 [SYN] Seq=0 Win=64240 Len=0 MSS=1460 SACK_PERM TSval=3941356515 TSecr=0 WS=128
2,0.006806,192.168.11.46,192.168.11.47,TCP,74,0.006806,,0.006806,"Jan  6, 2024 19:36:15.106735000 JST",,"6000  >  51990 [SYN, ACK] Seq=0 Ack=1 Win=65160 Len=0 MSS=1460 SACK_PERM TSval=1538890628 TSecr=3941356515 WS=128"
3,0.006926,192.168.11.47,192.168.11.46,TCP,66,0.00012,,0.00012,"Jan  6, 2024 19:36:15.106855000 JST",,51990  >  6000 [ACK] Seq=1 Ack=1 Win=64256 Len=0 TSval=3941356526 TSecr=1538890628
4,0.007222,192.168.11.47,192.168.11.46,TCP,93,,,0.000296,"Jan  6, 2024 19:36:15.107151000 JST",,"51990  >  6000 [PSH, ACK] Seq=1 Ack=1 Win=64256 Len=27 TSval=3941356526 TSecr=1538890628 [TCP segment of a reassembled PDU]"
5,0.007375,192.168.11.47,192.168.11.46,TCP,66,,,0.000153,"Jan  6, 2024 19:36:15.107304000 JST",,"51990  >  6000 [FIN, ACK] Seq=28 Ack=1 Win=64256 Len=0 TSval=3941356526 TSecr=1538890628"
6,0.015124,192.168.11.46,192.168.11.47,TCP,66,0.007902,,0.007749,"Jan  6, 2024 19:36:15.115053000 JST",,6000  >  51990 [ACK] Seq=1 Ack=28 Win=65152 Len=0 TSval=1538890635 TSecr=3941356526
7,0.015339,192.168.11.46,192.168.11.47,TCP,66,0.007964,,0.000215,"Jan  6, 2024 19:36:15.115268000 JST",,"6000  >  51990 [FIN, ACK] Seq=1 Ack=29 Win=65152 Len=0 TSval=1538890637 TSecr=3941356526"
8,0.015386,192.168.11.47,192.168.11.46,TCP,66,0.000047,,0.000047,"Jan  6, 2024 19:36:15.115315000 JST",,51990  >  6000 [ACK] Seq=29 Ack=2 Win=64256 Len=0 TSval=3941356534 TSecr=1538890637
9,0.048807,192.168.11.47,255.255.255.255,UDP,209,,Åü,0.033421,"Jan  6, 2024 19:36:15.148736000 JST",7b2273656d616e74696373223a207b22656e74697479223a2022504944222c202262617365656e74697479223a2022616e79222c2022726f6c65223a2022303037222c20227370617469616c223a2022616e79222c202274656d706f72616c223a2022616e79227d2c20226461746170726f7065727479223a207b22666f726d6174223a2022696e616f6b615f70726f6772616d5f73616d706c655f73656d616e746963227d7d,43658  >  7000 Len=167
10,0.060091,192.168.11.48,192.168.11.47,TCP,74,,Åú,0.011284,"Jan  6, 2024 19:36:15.160020000 JST",,42626  >  6000 [SYN] Seq=0 Win=64240 Len=0 MSS=1460 SACK_PERM TSval=1071832152 TSecr=0 WS=128
11,0.060269,192.168.11.47,192.168.11.48,TCP,74,0.000178,,0.000178,"Jan  6, 2024 19:36:15.160198000 JST",,"6000  >  42626 [SYN, ACK] Seq=0 Ack=1 Win=65160 Len=0 MSS=1460 SACK_PERM TSval=3616039608 TSecr=1071832152 WS=128"
12,0.068176,192.168.11.48,192.168.11.47,TCP,66,0.007907,,0.007907,"Jan  6, 2024 19:36:15.168105000 JST",,42626  >  6000 [ACK] Seq=1 Ack=1 Win=64256 Len=0 TSval=1071832162 TSecr=3616039608
13,0.068865,192.168.11.48,192.168.11.47,TCP,93,,,0.000689,"Jan  6, 2024 19:36:15.168794000 JST",,"42626  >  6000 [PSH, ACK] Seq=1 Ack=1 Win=64256 Len=27 TSval=1071832163 TSecr=3616039608 [TCP segment of a reassembled PDU]"
14,0.068981,192.168.11.47,192.168.11.48,TCP,66,0.000116,,0.000116,"Jan  6, 2024 19:36:15.168910000 JST",,6000  >  42626 [ACK] Seq=1 Ack=28 Win=65152 Len=0 TSval=3616039617 TSecr=1071832163
15,0.069083,192.168.11.48,192.168.11.47,TCP,66,,,0.000102,"Jan  6, 2024 19:36:15.169012000 JST",,"42626  >  6000 [FIN, ACK] Seq=28 Ack=1 Win=64256 Len=0 TSval=1071832163 TSecr=3616039608"
16,0.070891,192.168.11.47,192.168.11.48,TCP,66,0.001808,,0.001808,"Jan  6, 2024 19:36:15.170820000 JST",,"6000  >  42626 [FIN, ACK] Seq=1 Ack=29 Win=65152 Len=0 TSval=3616039619 TSecr=1071832163"
17,0.077945,192.168.11.48,192.168.11.47,TCP,66,0.007054,,0.007054,"Jan  6, 2024 19:36:15.177874000 JST",,42626  >  6000 [ACK] Seq=29 Ack=2 Win=64256 Len=0 TSval=1071832173 TSecr=3616039619
18,8.224112,192.168.11.47,192.168.11.46,TCP,74,,,8.146167,"Jan  6, 2024 19:36:23.324041000 JST",,52002  >  6000 [SYN] Seq=0 Win=64240 Len=0 MSS=1460 SACK_PERM TSval=3941364743 TSecr=0 WS=128
19,8.230797,192.168.11.46,192.168.11.47,TCP,74,0.006685,,0.006685,"Jan  6, 2024 19:36:23.330726000 JST",,"6000  >  52002 [SYN, ACK] Seq=0 Ack=1 Win=65160 Len=0 MSS=1460 SACK_PERM TSval=1538898852 TSecr=3941364743 WS=128"
20,8.230923,192.168.11.47,192.168.11.46,TCP,66,0.000126,,0.000126,"Jan  6, 2024 19:36:23.330852000 JST",,52002  >  6000 [ACK] Seq=1 Ack=1 Win=64256 Len=0 TSval=3941364750 TSecr=1538898852
21,8.231155,192.168.11.47,192.168.11.46,TCP,93,,,0.000232,"Jan  6, 2024 19:36:23.331084000 JST",,"52002  >  6000 [PSH, ACK] Seq=1 Ack=1 Win=64256 Len=27 TSval=3941364750 TSecr=1538898852 [TCP segment of a reassembled PDU]"
22,8.231292,192.168.11.47,192.168.11.46,TCP,66,,,0.000137,"Jan  6, 2024 19:36:23.331221000 JST",,"52002  >  6000 [FIN, ACK] Seq=28 Ack=1 Win=64256 Len=0 TSval=3941364750 TSecr=1538898852"
23,8.239114,192.168.11.46,192.168.11.47,TCP,66,0.007959,,0.007822,"Jan  6, 2024 19:36:23.339043000 JST",,6000  >  52002 [ACK] Seq=1 Ack=28 Win=65152 Len=0 TSval=1538898860 TSecr=3941364750
24,8.239501,192.168.11.46,192.168.11.47,TCP,66,0.008209,,0.000387,"Jan  6, 2024 19:36:23.339430000 JST",,"6000  >  52002 [FIN, ACK] Seq=1 Ack=29 Win=65152 Len=0 TSval=1538898861 TSecr=3941364750"
25,8.239545,192.168.11.47,192.168.11.46,TCP,66,0.000044,,0.000044,"Jan  6, 2024 19:36:23.339474000 JST",,52002  >  6000 [ACK] Seq=29 Ack=2 Win=64256 Len=0 TSval=3941364758 TSecr=1538898861
26,8.27014,192.168.11.47,255.255.255.255,UDP,209,,Åü,0.030595,"Jan  6, 2024 19:36:23.370069000 JST",7b2273656d616e74696373223a207b22656e74697479223a2022504944222c202262617365656e74697479223a2022616e79222c2022726f6c65223a2022303037222c20227370617469616c223a2022616e79222c202274656d706f72616c223a2022616e79227d2c20226461746170726f7065727479223a207b22666f726d6174223a2022696e616f6b615f70726f6772616d5f73616d706c655f73656d616e746963227d7d,41772  >  7000 Len=167
27,8.279749,192.168.11.48,192.168.11.47,TCP,74,,Åú,0.009609,"Jan  6, 2024 19:36:23.379678000 JST",,42638  >  6000 [SYN] Seq=0 Win=64240 Len=0 MSS=1460 SACK_PERM TSval=1071840375 TSecr=0 WS=128
28,8.279889,192.168.11.47,192.168.11.48,TCP,74,0.00014,,0.00014,"Jan  6, 2024 19:36:23.379818000 JST",,"6000  >  42638 [SYN, ACK] Seq=0 Ack=1 Win=65160 Len=0 MSS=1460 SACK_PERM TSval=3616047828 TSecr=1071840375 WS=128"
29,8.286889,192.168.11.48,192.168.11.47,TCP,66,0.007,,0.007,"Jan  6, 2024 19:36:23.386818000 JST",,42638  >  6000 [ACK] Seq=1 Ack=1 Win=64256 Len=0 TSval=1071840382 TSecr=3616047828
30,8.287555,192.168.11.48,192.168.11.47,TCP,93,,,0.000666,"Jan  6, 2024 19:36:23.387484000 JST",,"42638  >  6000 [PSH, ACK] Seq=1 Ack=1 Win=64256 Len=27 TSval=1071840382 TSecr=3616047828 [TCP segment of a reassembled PDU]"
31,8.287669,192.168.11.47,192.168.11.48,TCP,66,0.000114,,0.000114,"Jan  6, 2024 19:36:23.387598000 JST",,6000  >  42638 [ACK] Seq=1 Ack=28 Win=65152 Len=0 TSval=3616047835 TSecr=1071840382
32,8.287761,192.168.11.48,192.168.11.47,TCP,66,,,0.000092,"Jan  6, 2024 19:36:23.387690000 JST",,"42638  >  6000 [FIN, ACK] Seq=28 Ack=1 Win=64256 Len=0 TSval=1071840382 TSecr=3616047828"
33,8.289557,192.168.11.47,192.168.11.48,TCP,66,0.001796,,0.001796,"Jan  6, 2024 19:36:23.389486000 JST",,"6000  >  42638 [FIN, ACK] Seq=1 Ack=29 Win=65152 Len=0 TSval=3616047837 TSecr=1071840382"
34,8.294683,192.168.11.48,192.168.11.47,TCP,66,0.005126,,0.005126,"Jan  6, 2024 19:36:23.394612000 JST",,42638  >  6000 [ACK] Seq=29 Ack=2 Win=64256 Len=0 TSval=1071840390 TSecr=3616047837
35,19.090529,192.168.11.47,192.168.11.46,TCP,74,,,10.795846,"Jan  6, 2024 19:36:34.190458000 JST",,50674  >  6000 [SYN] Seq=0 Win=64240 Len=0 MSS=1460 SACK_PERM TSval=3941375609 TSecr=0 WS=128
36,19.097663,192.168.11.46,192.168.11.47,TCP,74,0.007134,,0.007134,"Jan  6, 2024 19:36:34.197592000 JST",,"6000  >  50674 [SYN, ACK] Seq=0 Ack=1 Win=65160 Len=0 MSS=1460 SACK_PERM TSval=1538909718 TSecr=3941375609 WS=128"
37,19.097778,192.168.11.47,192.168.11.46,TCP,66,0.000115,,0.000115,"Jan  6, 2024 19:36:34.197707000 JST",,50674  >  6000 [ACK] Seq=1 Ack=1 Win=64256 Len=0 TSval=3941375617 TSecr=1538909718
38,19.098014,192.168.11.47,192.168.11.46,TCP,93,,,0.000236,"Jan  6, 2024 19:36:34.197943000 JST",,"50674  >  6000 [PSH, ACK] Seq=1 Ack=1 Win=64256 Len=27 TSval=3941375617 TSecr=1538909718 [TCP segment of a reassembled PDU]"
39,19.098145,192.168.11.47,192.168.11.46,TCP,66,,,0.000131,"Jan  6, 2024 19:36:34.198074000 JST",,"50674  >  6000 [FIN, ACK] Seq=28 Ack=1 Win=64256 Len=0 TSval=3941375617 TSecr=1538909718"
40,19.106287,192.168.11.46,192.168.11.47,TCP,66,0.008273,,0.008142,"Jan  6, 2024 19:36:34.206216000 JST",,6000  >  50674 [ACK] Seq=1 Ack=28 Win=65152 Len=0 TSval=1538909726 TSecr=3941375617
41,19.106519,192.168.11.46,192.168.11.47,TCP,66,0.008374,,0.000232,"Jan  6, 2024 19:36:34.206448000 JST",,"6000  >  50674 [FIN, ACK] Seq=1 Ack=29 Win=65152 Len=0 TSval=1538909729 TSecr=3941375617"
42,19.10657,192.168.11.47,192.168.11.46,TCP,66,0.000051,,0.000051,"Jan  6, 2024 19:36:34.206499000 JST",,50674  >  6000 [ACK] Seq=29 Ack=2 Win=64256 Len=0 TSval=3941375625 TSecr=1538909729
43,19.141326,192.168.11.47,255.255.255.255,UDP,209,,Åü,0.034756,"Jan  6, 2024 19:36:34.241255000 JST",7b2273656d616e74696373223a207b22656e74697479223a2022504944222c202262617365656e74697479223a2022616e79222c2022726f6c65223a2022303037222c20227370617469616c223a2022616e79222c202274656d706f72616c223a2022616e79227d2c20226461746170726f7065727479223a207b22666f726d6174223a2022696e616f6b615f70726f6772616d5f73616d706c655f73656d616e746963227d7d,48124  >  7000 Len=167
44,19.14929,192.168.11.48,192.168.11.47,TCP,74,,Åú,0.007964,"Jan  6, 2024 19:36:34.249219000 JST",,43136  >  6000 [SYN] Seq=0 Win=64240 Len=0 MSS=1460 SACK_PERM TSval=1071851244 TSecr=0 WS=128
45,19.14944,192.168.11.47,192.168.11.48,TCP,74,0.00015,,0.00015,"Jan  6, 2024 19:36:34.249369000 JST",,"6000  >  43136 [SYN, ACK] Seq=0 Ack=1 Win=65160 Len=0 MSS=1460 SACK_PERM TSval=3616058697 TSecr=1071851244 WS=128"
46,19.157191,192.168.11.48,192.168.11.47,TCP,66,0.007751,,0.007751,"Jan  6, 2024 19:36:34.257120000 JST",,43136  >  6000 [ACK] Seq=1 Ack=1 Win=64256 Len=0 TSval=1071851252 TSecr=3616058697
47,19.15777,192.168.11.48,192.168.11.47,TCP,93,,,0.000579,"Jan  6, 2024 19:36:34.257699000 JST",,"43136  >  6000 [PSH, ACK] Seq=1 Ack=1 Win=64256 Len=27 TSval=1071851252 TSecr=3616058697 [TCP segment of a reassembled PDU]"
48,19.157848,192.168.11.47,192.168.11.48,TCP,66,0.000078,,0.000078,"Jan  6, 2024 19:36:34.257777000 JST",,6000  >  43136 [ACK] Seq=1 Ack=28 Win=65152 Len=0 TSval=3616058706 TSecr=1071851252
49,19.157913,192.168.11.48,192.168.11.47,TCP,66,,,0.000065,"Jan  6, 2024 19:36:34.257842000 JST",,"43136  >  6000 [FIN, ACK] Seq=28 Ack=1 Win=64256 Len=0 TSval=1071851252 TSecr=3616058697"
50,19.159413,192.168.11.47,192.168.11.48,TCP,66,0.0015,,0.0015,"Jan  6, 2024 19:36:34.259342000 JST",,"6000  >  43136 [FIN, ACK] Seq=1 Ack=29 Win=65152 Len=0 TSval=3616058707 TSecr=1071851252"
51,19.177089,192.168.11.48,192.168.11.47,TCP,66,0.017676,,0.017676,"Jan  6, 2024 19:36:34.277018000 JST",,43136  >  6000 [ACK] Seq=29 Ack=2 Win=64256 Len=0 TSval=1071851261 TSecr=3616058707
52,27.972003,192.168.11.47,192.168.11.46,TCP,74,,,8.794914,"Jan  6, 2024 19:36:43.071932000 JST",,50680  >  6000 [SYN] Seq=0 Win=64240 Len=0 MSS=1460 SACK_PERM TSval=3941384491 TSecr=0 WS=128
53,27.982164,192.168.11.46,192.168.11.47,TCP,74,0.010161,,0.010161,"Jan  6, 2024 19:36:43.082093000 JST",,"6000  >  50680 [SYN, ACK] Seq=0 Ack=1 Win=65160 Len=0 MSS=1460 SACK_PERM TSval=1538918603 TSecr=3941384491 WS=128"
54,27.982279,192.168.11.47,192.168.11.46,TCP,66,0.000115,,0.000115,"Jan  6, 2024 19:36:43.082208000 JST",,50680  >  6000 [ACK] Seq=1 Ack=1 Win=64256 Len=0 TSval=3941384501 TSecr=1538918603
55,27.982454,192.168.11.47,192.168.11.46,TCP,93,,,0.000175,"Jan  6, 2024 19:36:43.082383000 JST",,"50680  >  6000 [PSH, ACK] Seq=1 Ack=1 Win=64256 Len=27 TSval=3941384501 TSecr=1538918603 [TCP segment of a reassembled PDU]"
56,27.982564,192.168.11.47,192.168.11.46,TCP,66,,,0.00011,"Jan  6, 2024 19:36:43.082493000 JST",,"50680  >  6000 [FIN, ACK] Seq=28 Ack=1 Win=64256 Len=0 TSval=3941384501 TSecr=1538918603"
57,27.990557,192.168.11.46,192.168.11.47,TCP,66,0.008103,,0.007993,"Jan  6, 2024 19:36:43.090486000 JST",,6000  >  50680 [ACK] Seq=1 Ack=28 Win=65152 Len=0 TSval=1538918611 TSecr=3941384501
58,27.990932,192.168.11.46,192.168.11.47,TCP,66,0.008368,,0.000375,"Jan  6, 2024 19:36:43.090861000 JST",,"6000  >  50680 [FIN, ACK] Seq=1 Ack=29 Win=65152 Len=0 TSval=1538918612 TSecr=3941384501"
59,27.990976,192.168.11.47,192.168.11.46,TCP,66,0.000044,,0.000044,"Jan  6, 2024 19:36:43.090905000 JST",,50680  >  6000 [ACK] Seq=29 Ack=2 Win=64256 Len=0 TSval=3941384510 TSecr=1538918612
60,28.021622,192.168.11.47,255.255.255.255,UDP,209,,Åü,0.030646,"Jan  6, 2024 19:36:43.121551000 JST",7b2273656d616e74696373223a207b22656e74697479223a2022504944222c202262617365656e74697479223a2022616e79222c2022726f6c65223a2022303037222c20227370617469616c223a2022616e79222c202274656d706f72616c223a2022616e79227d2c20226461746170726f7065727479223a207b22666f726d6174223a2022696e616f6b615f70726f6772616d5f73616d706c655f73656d616e746963227d7d,50860  >  7000 Len=167
61,28.029549,192.168.11.48,192.168.11.47,TCP,74,,Åú,0.007927,"Jan  6, 2024 19:36:43.129478000 JST",,42646  >  6000 [SYN] Seq=0 Win=64240 Len=0 MSS=1460 SACK_PERM TSval=1071860125 TSecr=0 WS=128
62,28.029729,192.168.11.47,192.168.11.48,TCP,74,0.00018,,0.00018,"Jan  6, 2024 19:36:43.129658000 JST",,"6000  >  42646 [SYN, ACK] Seq=0 Ack=1 Win=65160 Len=0 MSS=1460 SACK_PERM TSval=3616067578 TSecr=1071860125 WS=128"
63,28.038379,192.168.11.48,192.168.11.47,TCP,66,0.00865,,0.00865,"Jan  6, 2024 19:36:43.138308000 JST",,42646  >  6000 [ACK] Seq=1 Ack=1 Win=64256 Len=0 TSval=1071860132 TSecr=3616067578
64,28.039041,192.168.11.48,192.168.11.47,TCP,93,,,0.000662,"Jan  6, 2024 19:36:43.138970000 JST",,"42646  >  6000 [PSH, ACK] Seq=1 Ack=1 Win=64256 Len=27 TSval=1071860132 TSecr=3616067578 [TCP segment of a reassembled PDU]"
65,28.039251,192.168.11.47,192.168.11.48,TCP,66,0.00021,,0.00021,"Jan  6, 2024 19:36:43.139180000 JST",,6000  >  42646 [ACK] Seq=1 Ack=28 Win=65152 Len=0 TSval=3616067587 TSecr=1071860132
66,28.039449,192.168.11.48,192.168.11.47,TCP,66,,,0.000198,"Jan  6, 2024 19:36:43.139378000 JST",,"42646  >  6000 [FIN, ACK] Seq=28 Ack=1 Win=64256 Len=0 TSval=1071860132 TSecr=3616067578"
67,28.041008,192.168.11.47,192.168.11.48,TCP,66,0.001559,,0.001559,"Jan  6, 2024 19:36:43.140937000 JST",,"6000  >  42646 [FIN, ACK] Seq=1 Ack=29 Win=65152 Len=0 TSval=3616067589 TSecr=1071860132"
68,28.047586,192.168.11.48,192.168.11.47,TCP,66,0.006578,,0.006578,"Jan  6, 2024 19:36:43.147515000 JST",,42646  >  6000 [ACK] Seq=29 Ack=2 Win=64256 Len=0 TSval=1071860142 TSecr=3616067589
69,35.782557,192.168.11.47,192.168.11.46,TCP,74,,,7.734971,"Jan  6, 2024 19:36:50.882486000 JST",,58284  >  6000 [SYN] Seq=0 Win=64240 Len=0 MSS=1460 SACK_PERM TSval=3941392301 TSecr=0 WS=128
70,35.789133,192.168.11.46,192.168.11.47,TCP,74,0.006576,,0.006576,"Jan  6, 2024 19:36:50.889062000 JST",,"6000  >  58284 [SYN, ACK] Seq=0 Ack=1 Win=65160 Len=0 MSS=1460 SACK_PERM TSval=1538926410 TSecr=3941392301 WS=128"
71,35.789235,192.168.11.47,192.168.11.46,TCP,66,0.000102,,0.000102,"Jan  6, 2024 19:36:50.889164000 JST",,58284  >  6000 [ACK] Seq=1 Ack=1 Win=64256 Len=0 TSval=3941392308 TSecr=1538926410
72,35.789361,192.168.11.47,192.168.11.46,TCP,93,,,0.000126,"Jan  6, 2024 19:36:50.889290000 JST",,"58284  >  6000 [PSH, ACK] Seq=1 Ack=1 Win=64256 Len=27 TSval=3941392308 TSecr=1538926410 [TCP segment of a reassembled PDU]"
73,35.78946,192.168.11.47,192.168.11.46,TCP,66,,,0.000099,"Jan  6, 2024 19:36:50.889389000 JST",,"58284  >  6000 [FIN, ACK] Seq=28 Ack=1 Win=64256 Len=0 TSval=3941392308 TSecr=1538926410"
74,35.797133,192.168.11.46,192.168.11.47,TCP,66,0.007772,,0.007673,"Jan  6, 2024 19:36:50.897062000 JST",,6000  >  58284 [ACK] Seq=1 Ack=28 Win=65152 Len=0 TSval=1538926417 TSecr=3941392308
75,35.797497,192.168.11.46,192.168.11.47,TCP,66,0.008037,,0.000364,"Jan  6, 2024 19:36:50.897426000 JST",,"6000  >  58284 [FIN, ACK] Seq=1 Ack=29 Win=65152 Len=0 TSval=1538926419 TSecr=3941392308"
76,35.797547,192.168.11.47,192.168.11.46,TCP,66,0.00005,,0.00005,"Jan  6, 2024 19:36:50.897476000 JST",,58284  >  6000 [ACK] Seq=29 Ack=2 Win=64256 Len=0 TSval=3941392316 TSecr=1538926419
77,35.828273,192.168.11.47,255.255.255.255,UDP,209,,Åü,0.030726,"Jan  6, 2024 19:36:50.928202000 JST",7b2273656d616e74696373223a207b22656e74697479223a2022504944222c202262617365656e74697479223a2022616e79222c2022726f6c65223a2022303037222c20227370617469616c223a2022616e79222c202274656d706f72616c223a2022616e79227d2c20226461746170726f7065727479223a207b22666f726d6174223a2022696e616f6b615f70726f6772616d5f73616d706c655f73656d616e746963227d7d,43869  >  7000 Len=167
78,35.836315,192.168.11.48,192.168.11.47,TCP,74,,Åú,0.008042,"Jan  6, 2024 19:36:50.936244000 JST",,52328  >  6000 [SYN] Seq=0 Win=64240 Len=0 MSS=1460 SACK_PERM TSval=1071867932 TSecr=0 WS=128
79,35.836454,192.168.11.47,192.168.11.48,TCP,74,0.000139,,0.000139,"Jan  6, 2024 19:36:50.936383000 JST",,"6000  >  52328 [SYN, ACK] Seq=0 Ack=1 Win=65160 Len=0 MSS=1460 SACK_PERM TSval=3616075384 TSecr=1071867932 WS=128"
80,35.843755,192.168.11.48,192.168.11.47,TCP,66,0.007301,,0.007301,"Jan  6, 2024 19:36:50.943684000 JST",,52328  >  6000 [ACK] Seq=1 Ack=1 Win=64256 Len=0 TSval=1071867939 TSecr=3616075384
81,35.844179,192.168.11.48,192.168.11.47,TCP,93,,,0.000424,"Jan  6, 2024 19:36:50.944108000 JST",,"52328  >  6000 [PSH, ACK] Seq=1 Ack=1 Win=64256 Len=27 TSval=1071867939 TSecr=3616075384 [TCP segment of a reassembled PDU]"
82,35.844241,192.168.11.47,192.168.11.48,TCP,66,0.000062,,0.000062,"Jan  6, 2024 19:36:50.944170000 JST",,6000  >  52328 [ACK] Seq=1 Ack=28 Win=65152 Len=0 TSval=3616075392 TSecr=1071867939
83,35.844294,192.168.11.48,192.168.11.47,TCP,66,,,0.000053,"Jan  6, 2024 19:36:50.944223000 JST",,"52328  >  6000 [FIN, ACK] Seq=28 Ack=1 Win=64256 Len=0 TSval=1071867939 TSecr=3616075384"
84,35.845178,192.168.11.47,192.168.11.48,TCP,66,0.000884,,0.000884,"Jan  6, 2024 19:36:50.945107000 JST",,"6000  >  52328 [FIN, ACK] Seq=1 Ack=29 Win=65152 Len=0 TSval=3616075393 TSecr=1071867939"
85,35.854493,192.168.11.48,192.168.11.47,TCP,66,0.009315,,0.009315,"Jan  6, 2024 19:36:50.954422000 JST",,52328  >  6000 [ACK] Seq=29 Ack=2 Win=64256 Len=0 TSval=1071867950 TSecr=3616075393
86,43.618184,192.168.11.47,192.168.11.46,TCP,74,,,7.763691,"Jan  6, 2024 19:36:58.718113000 JST",,36358  >  6000 [SYN] Seq=0 Win=64240 Len=0 MSS=1460 SACK_PERM TSval=3941400137 TSecr=0 WS=128
87,43.624851,192.168.11.46,192.168.11.47,TCP,74,0.006667,,0.006667,"Jan  6, 2024 19:36:58.724780000 JST",,"6000  >  36358 [SYN, ACK] Seq=0 Ack=1 Win=65160 Len=0 MSS=1460 SACK_PERM TSval=1538934246 TSecr=3941400137 WS=128"
88,43.624956,192.168.11.47,192.168.11.46,TCP,66,0.000105,,0.000105,"Jan  6, 2024 19:36:58.724885000 JST",,36358  >  6000 [ACK] Seq=1 Ack=1 Win=64256 Len=0 TSval=3941400144 TSecr=1538934246
89,43.625124,192.168.11.47,192.168.11.46,TCP,93,,,0.000168,"Jan  6, 2024 19:36:58.725053000 JST",,"36358  >  6000 [PSH, ACK] Seq=1 Ack=1 Win=64256 Len=27 TSval=3941400144 TSecr=1538934246 [TCP segment of a reassembled PDU]"
90,43.625215,192.168.11.47,192.168.11.46,TCP,66,,,0.000091,"Jan  6, 2024 19:36:58.725144000 JST",,"36358  >  6000 [FIN, ACK] Seq=28 Ack=1 Win=64256 Len=0 TSval=3941400144 TSecr=1538934246"
91,43.634195,192.168.11.46,192.168.11.47,TCP,66,0.009071,,0.00898,"Jan  6, 2024 19:36:58.734124000 JST",,6000  >  36358 [ACK] Seq=1 Ack=28 Win=65152 Len=0 TSval=1538934253 TSecr=3941400144
92,43.634421,192.168.11.46,192.168.11.47,TCP,66,0.009206,,0.000226,"Jan  6, 2024 19:36:58.734350000 JST",,"6000  >  36358 [FIN, ACK] Seq=1 Ack=29 Win=65152 Len=0 TSval=1538934254 TSecr=3941400144"
93,43.634473,192.168.11.47,192.168.11.46,TCP,66,0.000052,,0.000052,"Jan  6, 2024 19:36:58.734402000 JST",,36358  >  6000 [ACK] Seq=29 Ack=2 Win=64256 Len=0 TSval=3941400153 TSecr=1538934254
94,43.667962,192.168.11.47,255.255.255.255,UDP,209,,Åü,0.033489,"Jan  6, 2024 19:36:58.767891000 JST",7b2273656d616e74696373223a207b22656e74697479223a2022504944222c202262617365656e74697479223a2022616e79222c2022726f6c65223a2022303037222c20227370617469616c223a2022616e79222c202274656d706f72616c223a2022616e79227d2c20226461746170726f7065727479223a207b22666f726d6174223a2022696e616f6b615f70726f6772616d5f73616d706c655f73656d616e746963227d7d,52506  >  7000 Len=167
95,43.676562,192.168.11.48,192.168.11.47,TCP,74,,Åú,0.0086,"Jan  6, 2024 19:36:58.776491000 JST",,36184  >  6000 [SYN] Seq=0 Win=64240 Len=0 MSS=1460 SACK_PERM TSval=1071875772 TSecr=0 WS=128
96,43.676707,192.168.11.47,192.168.11.48,TCP,74,0.000145,,0.000145,"Jan  6, 2024 19:36:58.776636000 JST",,"6000  >  36184 [SYN, ACK] Seq=0 Ack=1 Win=65160 Len=0 MSS=1460 SACK_PERM TSval=3616083225 TSecr=1071875772 WS=128"
97,43.683564,192.168.11.48,192.168.11.47,TCP,66,0.006857,,0.006857,"Jan  6, 2024 19:36:58.783493000 JST",,36184  >  6000 [ACK] Seq=1 Ack=1 Win=64256 Len=0 TSval=1071875779 TSecr=3616083225
98,43.684244,192.168.11.48,192.168.11.47,TCP,93,,,0.00068,"Jan  6, 2024 19:36:58.784173000 JST",,"36184  >  6000 [PSH, ACK] Seq=1 Ack=1 Win=64256 Len=27 TSval=1071875779 TSecr=3616083225 [TCP segment of a reassembled PDU]"
99,43.684367,192.168.11.47,192.168.11.48,TCP,66,0.000123,,0.000123,"Jan  6, 2024 19:36:58.784296000 JST",,6000  >  36184 [ACK] Seq=1 Ack=28 Win=65152 Len=0 TSval=3616083232 TSecr=1071875779
100,43.684448,192.168.11.48,192.168.11.47,TCP,66,,,0.000081,"Jan  6, 2024 19:36:58.784377000 JST",,"36184  >  6000 [FIN, ACK] Seq=28 Ack=1 Win=64256 Len=0 TSval=1071875779 TSecr=3616083225"
101,43.685898,192.168.11.47,192.168.11.48,TCP,66,0.00145,,0.00145,"Jan  6, 2024 19:36:58.785827000 JST",,"6000  >  36184 [FIN, ACK] Seq=1 Ack=29 Win=65152 Len=0 TSval=3616083234 TSecr=1071875779"
102,43.692169,192.168.11.48,192.168.11.47,TCP,66,0.006271,,0.006271,"Jan  6, 2024 19:36:58.792098000 JST",,36184  >  6000 [ACK] Seq=29 Ack=2 Win=64256 Len=0 TSval=1071875787 TSecr=3616083234
103,51.70511,192.168.11.47,192.168.11.46,TCP,74,,,8.012941,"Jan  6, 2024 19:37:06.805039000 JST",,58388  >  6000 [SYN] Seq=0 Win=64240 Len=0 MSS=1460 SACK_PERM TSval=3941408224 TSecr=0 WS=128
104,51.7117,192.168.11.46,192.168.11.47,TCP,74,0.00659,,0.00659,"Jan  6, 2024 19:37:06.811629000 JST",,"6000  >  58388 [SYN, ACK] Seq=0 Ack=1 Win=65160 Len=0 MSS=1460 SACK_PERM TSval=1538942332 TSecr=3941408224 WS=128"
105,51.711821,192.168.11.47,192.168.11.46,TCP,66,0.000121,,0.000121,"Jan  6, 2024 19:37:06.811750000 JST",,58388  >  6000 [ACK] Seq=1 Ack=1 Win=64256 Len=0 TSval=3941408231 TSecr=1538942332
106,51.712197,192.168.11.47,192.168.11.46,TCP,93,,,0.000376,"Jan  6, 2024 19:37:06.812126000 JST",,"58388  >  6000 [PSH, ACK] Seq=1 Ack=1 Win=64256 Len=27 TSval=3941408231 TSecr=1538942332 [TCP segment of a reassembled PDU]"
107,51.71247,192.168.11.47,192.168.11.46,TCP,66,,,0.000273,"Jan  6, 2024 19:37:06.812399000 JST",,"58388  >  6000 [FIN, ACK] Seq=28 Ack=1 Win=64256 Len=0 TSval=3941408231 TSecr=1538942332"
108,51.718733,192.168.11.46,192.168.11.47,TCP,66,0.006536,,0.006263,"Jan  6, 2024 19:37:06.818662000 JST",,6000  >  58388 [ACK] Seq=1 Ack=28 Win=65152 Len=0 TSval=1538942339 TSecr=3941408231
109,51.719115,192.168.11.46,192.168.11.47,TCP,66,0.006645,,0.000382,"Jan  6, 2024 19:37:06.819044000 JST",,"6000  >  58388 [FIN, ACK] Seq=1 Ack=29 Win=65152 Len=0 TSval=1538942340 TSecr=3941408231"
110,51.719161,192.168.11.47,192.168.11.46,TCP,66,0.000046,,0.000046,"Jan  6, 2024 19:37:06.819090000 JST",,58388  >  6000 [ACK] Seq=29 Ack=2 Win=64256 Len=0 TSval=3941408238 TSecr=1538942340
111,51.756725,192.168.11.47,255.255.255.255,UDP,209,,Åü,0.037564,"Jan  6, 2024 19:37:06.856654000 JST",7b2273656d616e74696373223a207b22656e74697479223a2022504944222c202262617365656e74697479223a2022616e79222c2022726f6c65223a2022303037222c20227370617469616c223a2022616e79222c202274656d706f72616c223a2022616e79227d2c20226461746170726f7065727479223a207b22666f726d6174223a2022696e616f6b615f70726f6772616d5f73616d706c655f73656d616e746963227d7d,49372  >  7000 Len=167
112,51.764619,192.168.11.48,192.168.11.47,TCP,74,,Åú,0.007894,"Jan  6, 2024 19:37:06.864548000 JST",,52032  >  6000 [SYN] Seq=0 Win=64240 Len=0 MSS=1460 SACK_PERM TSval=1071883860 TSecr=0 WS=128
113,51.764777,192.168.11.47,192.168.11.48,TCP,74,0.000158,,0.000158,"Jan  6, 2024 19:37:06.864706000 JST",,"6000  >  52032 [SYN, ACK] Seq=0 Ack=1 Win=65160 Len=0 MSS=1460 SACK_PERM TSval=3616091313 TSecr=1071883860 WS=128"
114,51.771775,192.168.11.48,192.168.11.47,TCP,66,0.006998,,0.006998,"Jan  6, 2024 19:37:06.871704000 JST",,52032  >  6000 [ACK] Seq=1 Ack=1 Win=64256 Len=0 TSval=1071883867 TSecr=3616091313
115,51.772312,192.168.11.48,192.168.11.47,TCP,93,,,0.000537,"Jan  6, 2024 19:37:06.872241000 JST",,"52032  >  6000 [PSH, ACK] Seq=1 Ack=1 Win=64256 Len=27 TSval=1071883867 TSecr=3616091313 [TCP segment of a reassembled PDU]"
116,51.772397,192.168.11.47,192.168.11.48,TCP,66,0.000085,,0.000085,"Jan  6, 2024 19:37:06.872326000 JST",,6000  >  52032 [ACK] Seq=1 Ack=28 Win=65152 Len=0 TSval=3616091320 TSecr=1071883867
117,51.772458,192.168.11.48,192.168.11.47,TCP,66,,,0.000061,"Jan  6, 2024 19:37:06.872387000 JST",,"52032  >  6000 [FIN, ACK] Seq=28 Ack=1 Win=64256 Len=0 TSval=1071883867 TSecr=3616091313"
118,51.774279,192.168.11.47,192.168.11.48,TCP,66,0.001821,,0.001821,"Jan  6, 2024 19:37:06.874208000 JST",,"6000  >  52032 [FIN, ACK] Seq=1 Ack=29 Win=65152 Len=0 TSval=3616091322 TSecr=1071883867"
119,51.77952,192.168.11.48,192.168.11.47,TCP,66,0.005241,,0.005241,"Jan  6, 2024 19:37:06.879449000 JST",,52032  >  6000 [ACK] Seq=29 Ack=2 Win=64256 Len=0 TSval=1071883875 TSecr=3616091322
120,60.809598,192.168.11.47,192.168.11.46,TCP,74,,,9.030078,"Jan  6, 2024 19:37:15.909527000 JST",,44618  >  6000 [SYN] Seq=0 Win=64240 Len=0 MSS=1460 SACK_PERM TSval=3941417328 TSecr=0 WS=128
121,60.816279,192.168.11.46,192.168.11.47,TCP,74,0.006681,,0.006681,"Jan  6, 2024 19:37:15.916208000 JST",,"6000  >  44618 [SYN, ACK] Seq=0 Ack=1 Win=65160 Len=0 MSS=1460 SACK_PERM TSval=1538951437 TSecr=3941417328 WS=128"
122,60.816396,192.168.11.47,192.168.11.46,TCP,66,0.000117,,0.000117,"Jan  6, 2024 19:37:15.916325000 JST",,44618  >  6000 [ACK] Seq=1 Ack=1 Win=64256 Len=0 TSval=3941417335 TSecr=1538951437
123,60.816616,192.168.11.47,192.168.11.46,TCP,93,,,0.00022,"Jan  6, 2024 19:37:15.916545000 JST",,"44618  >  6000 [PSH, ACK] Seq=1 Ack=1 Win=64256 Len=27 TSval=3941417335 TSecr=1538951437 [TCP segment of a reassembled PDU]"
124,60.816723,192.168.11.47,192.168.11.46,TCP,66,,,0.000107,"Jan  6, 2024 19:37:15.916652000 JST",,"44618  >  6000 [FIN, ACK] Seq=28 Ack=1 Win=64256 Len=0 TSval=3941417336 TSecr=1538951437"
125,60.824688,192.168.11.46,192.168.11.47,TCP,66,0.008072,,0.007965,"Jan  6, 2024 19:37:15.924617000 JST",,6000  >  44618 [ACK] Seq=1 Ack=28 Win=65152 Len=0 TSval=1538951445 TSecr=3941417335
126,60.825043,192.168.11.46,192.168.11.47,TCP,66,0.00832,,0.000355,"Jan  6, 2024 19:37:15.924972000 JST",,"6000  >  44618 [FIN, ACK] Seq=1 Ack=29 Win=65152 Len=0 TSval=1538951446 TSecr=3941417336"
127,60.82509,192.168.11.47,192.168.11.46,TCP,66,0.000047,,0.000047,"Jan  6, 2024 19:37:15.925019000 JST",,44618  >  6000 [ACK] Seq=29 Ack=2 Win=64256 Len=0 TSval=3941417344 TSecr=1538951446
128,60.854801,192.168.11.47,255.255.255.255,UDP,209,,Åü,0.029711,"Jan  6, 2024 19:37:15.954730000 JST",7b2273656d616e74696373223a207b22656e74697479223a2022504944222c202262617365656e74697479223a2022616e79222c2022726f6c65223a2022303037222c20227370617469616c223a2022616e79222c202274656d706f72616c223a2022616e79227d2c20226461746170726f7065727479223a207b22666f726d6174223a2022696e616f6b615f70726f6772616d5f73616d706c655f73656d616e746963227d7d,41030  >  7000 Len=167
129,60.878386,192.168.11.48,192.168.11.47,TCP,74,,Åú,0.023585,"Jan  6, 2024 19:37:15.978315000 JST",,56272  >  6000 [SYN] Seq=0 Win=64240 Len=0 MSS=1460 SACK_PERM TSval=1071892973 TSecr=0 WS=128
130,60.878639,192.168.11.47,192.168.11.48,TCP,74,0.000253,,0.000253,"Jan  6, 2024 19:37:15.978568000 JST",,"6000  >  56272 [SYN, ACK] Seq=0 Ack=1 Win=65160 Len=0 MSS=1460 SACK_PERM TSval=3616100426 TSecr=1071892973 WS=128"
131,60.885282,192.168.11.48,192.168.11.47,TCP,66,0.006643,,0.006643,"Jan  6, 2024 19:37:15.985211000 JST",,56272  >  6000 [ACK] Seq=1 Ack=1 Win=64256 Len=0 TSval=1071892981 TSecr=3616100426
132,60.885776,192.168.11.48,192.168.11.47,TCP,93,,,0.000494,"Jan  6, 2024 19:37:15.985705000 JST",,"56272  >  6000 [PSH, ACK] Seq=1 Ack=1 Win=64256 Len=27 TSval=1071892981 TSecr=3616100426 [TCP segment of a reassembled PDU]"
133,60.885845,192.168.11.47,192.168.11.48,TCP,66,0.000069,,0.000069,"Jan  6, 2024 19:37:15.985774000 JST",,6000  >  56272 [ACK] Seq=1 Ack=28 Win=65152 Len=0 TSval=3616100434 TSecr=1071892981
134,60.885911,192.168.11.48,192.168.11.47,TCP,66,,,0.000066,"Jan  6, 2024 19:37:15.985840000 JST",,"56272  >  6000 [FIN, ACK] Seq=28 Ack=1 Win=64256 Len=0 TSval=1071892981 TSecr=3616100426"
135,60.886938,192.168.11.47,192.168.11.48,TCP,66,0.001027,,0.001027,"Jan  6, 2024 19:37:15.986867000 JST",,"6000  >  56272 [FIN, ACK] Seq=1 Ack=29 Win=65152 Len=0 TSval=3616100435 TSecr=1071892981"
136,60.893025,192.168.11.48,192.168.11.47,TCP,66,0.006087,,0.006087,"Jan  6, 2024 19:37:15.992954000 JST",,56272  >  6000 [ACK] Seq=29 Ack=2 Win=64256 Len=0 TSval=1071892988 TSecr=3616100435
137,72.718313,192.168.11.47,192.168.11.46,TCP,74,,,11.825288,"Jan  6, 2024 19:37:27.818242000 JST",,33492  >  6000 [SYN] Seq=0 Win=64240 Len=0 MSS=1460 SACK_PERM TSval=3941429237 TSecr=0 WS=128
138,72.726765,192.168.11.46,192.168.11.47,TCP,74,0.008452,,0.008452,"Jan  6, 2024 19:37:27.826694000 JST",,"6000  >  33492 [SYN, ACK] Seq=0 Ack=1 Win=65160 Len=0 MSS=1460 SACK_PERM TSval=1538963347 TSecr=3941429237 WS=128"
139,72.726877,192.168.11.47,192.168.11.46,TCP,66,0.000112,,0.000112,"Jan  6, 2024 19:37:27.826806000 JST",,33492  >  6000 [ACK] Seq=1 Ack=1 Win=64256 Len=0 TSval=3941429246 TSecr=1538963347
140,72.727123,192.168.11.47,192.168.11.46,TCP,93,,,0.000246,"Jan  6, 2024 19:37:27.827052000 JST",,"33492  >  6000 [PSH, ACK] Seq=1 Ack=1 Win=64256 Len=27 TSval=3941429246 TSecr=1538963347 [TCP segment of a reassembled PDU]"
141,72.727244,192.168.11.47,192.168.11.46,TCP,66,,,0.000121,"Jan  6, 2024 19:37:27.827173000 JST",,"33492  >  6000 [FIN, ACK] Seq=28 Ack=1 Win=64256 Len=0 TSval=3941429246 TSecr=1538963347"
142,72.735328,192.168.11.46,192.168.11.47,TCP,66,0.008205,,0.008084,"Jan  6, 2024 19:37:27.835257000 JST",,6000  >  33492 [ACK] Seq=1 Ack=28 Win=65152 Len=0 TSval=1538963356 TSecr=3941429246
143,72.738488,192.168.11.46,192.168.11.47,TCP,66,0.011244,,0.00316,"Jan  6, 2024 19:37:27.838417000 JST",,"6000  >  33492 [FIN, ACK] Seq=1 Ack=29 Win=65152 Len=0 TSval=1538963358 TSecr=3941429246"
144,72.738535,192.168.11.47,192.168.11.46,TCP,66,0.000047,,0.000047,"Jan  6, 2024 19:37:27.838464000 JST",,33492  >  6000 [ACK] Seq=29 Ack=2 Win=64256 Len=0 TSval=3941429257 TSecr=1538963358
145,72.767594,192.168.11.47,255.255.255.255,UDP,209,,Åü,0.029059,"Jan  6, 2024 19:37:27.867523000 JST",7b2273656d616e74696373223a207b22656e74697479223a2022504944222c202262617365656e74697479223a2022616e79222c2022726f6c65223a2022303037222c20227370617469616c223a2022616e79222c202274656d706f72616c223a2022616e79227d2c20226461746170726f7065727479223a207b22666f726d6174223a2022696e616f6b615f70726f6772616d5f73616d706c655f73656d616e746963227d7d,39742  >  7000 Len=167
146,72.778247,192.168.11.48,192.168.11.47,TCP,74,,Åú,0.010653,"Jan  6, 2024 19:37:27.878176000 JST",,50832  >  6000 [SYN] Seq=0 Win=64240 Len=0 MSS=1460 SACK_PERM TSval=1071904873 TSecr=0 WS=128
147,72.778396,192.168.11.47,192.168.11.48,TCP,74,0.000149,,0.000149,"Jan  6, 2024 19:37:27.878325000 JST",,"6000  >  50832 [SYN, ACK] Seq=0 Ack=1 Win=65160 Len=0 MSS=1460 SACK_PERM TSval=3616112326 TSecr=1071904873 WS=128"
148,72.794388,192.168.11.48,192.168.11.47,TCP,66,0.015992,,0.015992,"Jan  6, 2024 19:37:27.894317000 JST",,50832  >  6000 [ACK] Seq=1 Ack=1 Win=64256 Len=0 TSval=1071904886 TSecr=3616112326
149,72.794861,192.168.11.48,192.168.11.47,TCP,93,,,0.000473,"Jan  6, 2024 19:37:27.894790000 JST",,"50832  >  6000 [PSH, ACK] Seq=1 Ack=1 Win=64256 Len=27 TSval=1071904886 TSecr=3616112326 [TCP segment of a reassembled PDU]"
150,72.79494,192.168.11.47,192.168.11.48,TCP,66,0.000079,,0.000079,"Jan  6, 2024 19:37:27.894869000 JST",,6000  >  50832 [ACK] Seq=1 Ack=28 Win=65152 Len=0 TSval=3616112343 TSecr=1071904886
151,72.795002,192.168.11.48,192.168.11.47,TCP,66,,,0.000062,"Jan  6, 2024 19:37:27.894931000 JST",,"50832  >  6000 [FIN, ACK] Seq=28 Ack=1 Win=64256 Len=0 TSval=1071904886 TSecr=3616112326"
152,72.795859,192.168.11.47,192.168.11.48,TCP,66,0.000857,,0.000857,"Jan  6, 2024 19:37:27.895788000 JST",,"6000  >  50832 [FIN, ACK] Seq=1 Ack=29 Win=65152 Len=0 TSval=3616112344 TSecr=1071904886"
153,72.802402,192.168.11.48,192.168.11.47,TCP,66,0.006543,,0.006543,"Jan  6, 2024 19:37:27.902331000 JST",,50832  >  6000 [ACK] Seq=29 Ack=2 Win=64256 Len=0 TSval=1071904898 TSecr=3616112344
154,81.594721,192.168.11.47,192.168.11.46,TCP,74,,,8.792319,"Jan  6, 2024 19:37:36.694650000 JST",,48098  >  6000 [SYN] Seq=0 Win=64240 Len=0 MSS=1460 SACK_PERM TSval=3941438114 TSecr=0 WS=128
155,81.601775,192.168.11.46,192.168.11.47,TCP,74,0.007054,,0.007054,"Jan  6, 2024 19:37:36.701704000 JST",,"6000  >  48098 [SYN, ACK] Seq=0 Ack=1 Win=65160 Len=0 MSS=1460 SACK_PERM TSval=1538972222 TSecr=3941438114 WS=128"
156,81.60188,192.168.11.47,192.168.11.46,TCP,66,0.000105,,0.000105,"Jan  6, 2024 19:37:36.701809000 JST",,48098  >  6000 [ACK] Seq=1 Ack=1 Win=64256 Len=0 TSval=3941438121 TSecr=1538972222
157,81.602048,192.168.11.47,192.168.11.46,TCP,93,,,0.000168,"Jan  6, 2024 19:37:36.701977000 JST",,"48098  >  6000 [PSH, ACK] Seq=1 Ack=1 Win=64256 Len=27 TSval=3941438121 TSecr=1538972222 [TCP segment of a reassembled PDU]"
158,81.602145,192.168.11.47,192.168.11.46,TCP,66,,,0.000097,"Jan  6, 2024 19:37:36.702074000 JST",,"48098  >  6000 [FIN, ACK] Seq=28 Ack=1 Win=64256 Len=0 TSval=3941438121 TSecr=1538972222"
159,81.617288,192.168.11.46,192.168.11.47,TCP,66,0.01524,,0.015143,"Jan  6, 2024 19:37:36.717217000 JST",,6000  >  48098 [ACK] Seq=1 Ack=28 Win=65152 Len=0 TSval=1538972238 TSecr=3941438121
160,81.617668,192.168.11.46,192.168.11.47,TCP,66,0.015523,,0.00038,"Jan  6, 2024 19:37:36.717597000 JST",,"6000  >  48098 [FIN, ACK] Seq=1 Ack=29 Win=65152 Len=0 TSval=1538972239 TSecr=3941438121"
161,81.617718,192.168.11.47,192.168.11.46,TCP,66,0.00005,,0.00005,"Jan  6, 2024 19:37:36.717647000 JST",,48098  >  6000 [ACK] Seq=29 Ack=2 Win=64256 Len=0 TSval=3941438137 TSecr=1538972239
162,81.654652,192.168.11.47,255.255.255.255,UDP,209,,Åü,0.036934,"Jan  6, 2024 19:37:36.754581000 JST",7b2273656d616e74696373223a207b22656e74697479223a2022504944222c202262617365656e74697479223a2022616e79222c2022726f6c65223a2022303037222c20227370617469616c223a2022616e79222c202274656d706f72616c223a2022616e79227d2c20226461746170726f7065727479223a207b22666f726d6174223a2022696e616f6b615f70726f6772616d5f73616d706c655f73656d616e746963227d7d,43849  >  7000 Len=167
163,81.662628,192.168.11.48,192.168.11.47,TCP,74,,Åú,0.007976,"Jan  6, 2024 19:37:36.762557000 JST",,33126  >  6000 [SYN] Seq=0 Win=64240 Len=0 MSS=1460 SACK_PERM TSval=1071913758 TSecr=0 WS=128
164,81.662774,192.168.11.47,192.168.11.48,TCP,74,0.000146,,0.000146,"Jan  6, 2024 19:37:36.762703000 JST",,"6000  >  33126 [SYN, ACK] Seq=0 Ack=1 Win=65160 Len=0 MSS=1460 SACK_PERM TSval=3616121211 TSecr=1071913758 WS=128"
165,81.669512,192.168.11.48,192.168.11.47,TCP,66,0.006738,,0.006738,"Jan  6, 2024 19:37:36.769441000 JST",,33126  >  6000 [ACK] Seq=1 Ack=1 Win=64256 Len=0 TSval=1071913765 TSecr=3616121211
166,81.670236,192.168.11.48,192.168.11.47,TCP,93,,,0.000724,"Jan  6, 2024 19:37:36.770165000 JST",,"33126  >  6000 [PSH, ACK] Seq=1 Ack=1 Win=64256 Len=27 TSval=1071913765 TSecr=3616121211 [TCP segment of a reassembled PDU]"
167,81.670359,192.168.11.47,192.168.11.48,TCP,66,0.000123,,0.000123,"Jan  6, 2024 19:37:36.770288000 JST",,6000  >  33126 [ACK] Seq=1 Ack=28 Win=65152 Len=0 TSval=3616121218 TSecr=1071913765
168,81.670448,192.168.11.48,192.168.11.47,TCP,66,,,0.000089,"Jan  6, 2024 19:37:36.770377000 JST",,"33126  >  6000 [FIN, ACK] Seq=28 Ack=1 Win=64256 Len=0 TSval=1071913765 TSecr=3616121211"
169,81.671861,192.168.11.47,192.168.11.48,TCP,66,0.001413,,0.001413,"Jan  6, 2024 19:37:36.771790000 JST",,"6000  >  33126 [FIN, ACK] Seq=1 Ack=29 Win=65152 Len=0 TSval=3616121220 TSecr=1071913765"
170,81.688226,192.168.11.48,192.168.11.47,TCP,66,,,0.016365,"Jan  6, 2024 19:37:36.788155000 JST",,"[TCP Retransmission] 33126  >  6000 [FIN, ACK] Seq=28 Ack=1 Win=64256 Len=0 TSval=1071913785 TSecr=3616121211"
171,81.688316,192.168.11.47,192.168.11.48,TCP,78,0.00009,,0.00009,"Jan  6, 2024 19:37:36.788245000 JST",,[TCP Dup ACK 169#1] 6000  >  33126 [ACK] Seq=2 Ack=29 Win=65152 Len=0 TSval=3616121236 TSecr=1071913785 SLE=28 SRE=29
172,81.693907,192.168.11.48,192.168.11.47,TCP,66,0.022046,,0.005591,"Jan  6, 2024 19:37:36.793836000 JST",,33126  >  6000 [ACK] Seq=29 Ack=2 Win=64256 Len=0 TSval=1071913787 TSecr=3616121220
173,112.799622,192.168.11.47,192.168.11.46,TCP,74,,,31.105715,"Jan  6, 2024 19:38:07.899551000 JST",,44666  >  6000 [SYN] Seq=0 Win=64240 Len=0 MSS=1460 SACK_PERM TSval=3941469318 TSecr=0 WS=128
174,112.806357,192.168.11.46,192.168.11.47,TCP,74,0.006735,,0.006735,"Jan  6, 2024 19:38:07.906286000 JST",,"6000  >  44666 [SYN, ACK] Seq=0 Ack=1 Win=65160 Len=0 MSS=1460 SACK_PERM TSval=1539003427 TSecr=3941469318 WS=128"
175,112.806455,192.168.11.47,192.168.11.46,TCP,66,0.000098,,0.000098,"Jan  6, 2024 19:38:07.906384000 JST",,44666  >  6000 [ACK] Seq=1 Ack=1 Win=64256 Len=0 TSval=3941469325 TSecr=1539003427
176,112.806688,192.168.11.47,192.168.11.46,TCP,93,,,0.000233,"Jan  6, 2024 19:38:07.906617000 JST",,"44666  >  6000 [PSH, ACK] Seq=1 Ack=1 Win=64256 Len=27 TSval=3941469326 TSecr=1539003427 [TCP segment of a reassembled PDU]"
177,112.806809,192.168.11.47,192.168.11.46,TCP,66,,,0.000121,"Jan  6, 2024 19:38:07.906738000 JST",,"44666  >  6000 [FIN, ACK] Seq=28 Ack=1 Win=64256 Len=0 TSval=3941469326 TSecr=1539003427"
178,112.813563,192.168.11.46,192.168.11.47,TCP,66,0.006875,,0.006754,"Jan  6, 2024 19:38:07.913492000 JST",,6000  >  44666 [ACK] Seq=1 Ack=28 Win=65152 Len=0 TSval=1539003434 TSecr=3941469326
179,112.813912,192.168.11.46,192.168.11.47,TCP,66,0.007103,,0.000349,"Jan  6, 2024 19:38:07.913841000 JST",,"6000  >  44666 [FIN, ACK] Seq=1 Ack=29 Win=65152 Len=0 TSval=1539003435 TSecr=3941469326"
180,112.813957,192.168.11.47,192.168.11.46,TCP,66,0.000045,,0.000045,"Jan  6, 2024 19:38:07.913886000 JST",,44666  >  6000 [ACK] Seq=29 Ack=2 Win=64256 Len=0 TSval=3941469333 TSecr=1539003435
181,112.842528,192.168.11.47,255.255.255.255,UDP,209,,Åü,0.028571,"Jan  6, 2024 19:38:07.942457000 JST",7b2273656d616e74696373223a207b22656e74697479223a2022504944222c202262617365656e74697479223a2022616e79222c2022726f6c65223a2022303037222c20227370617469616c223a2022616e79222c202274656d706f72616c223a2022616e79227d2c20226461746170726f7065727479223a207b22666f726d6174223a2022696e616f6b615f70726f6772616d5f73616d706c655f73656d616e746963227d7d,40422  >  7000 Len=167
182,112.85046,192.168.11.48,192.168.11.47,TCP,74,,Åú,0.007932,"Jan  6, 2024 19:38:07.950389000 JST",,50788  >  6000 [SYN] Seq=0 Win=64240 Len=0 MSS=1460 SACK_PERM TSval=1071944946 TSecr=0 WS=128
183,112.850578,192.168.11.47,192.168.11.48,TCP,74,0.000118,,0.000118,"Jan  6, 2024 19:38:07.950507000 JST",,"6000  >  50788 [SYN, ACK] Seq=0 Ack=1 Win=65160 Len=0 MSS=1460 SACK_PERM TSval=3616152398 TSecr=1071944946 WS=128"
184,112.86425,192.168.11.48,192.168.11.47,TCP,66,0.013672,,0.013672,"Jan  6, 2024 19:38:07.964179000 JST",,50788  >  6000 [ACK] Seq=1 Ack=1 Win=64256 Len=0 TSval=1071944953 TSecr=3616152398
