No.,Time,Source,Destination,Protocol,Length,The RTT to ACK the segment was,XXX,Time delta from previous captured frame,Arrival Time,Data,Info
1,0,192.168.11.48,192.168.11.47,TCP,74,,,0,"Jan  6, 2024 19:36:15.154843000 JST",,42626  >  6000 [SYN] Seq=0 Win=64240 Len=0 MSS=1460 SACK_PERM TSval=1071832152 TSecr=0 WS=128
2,0.006836,192.168.11.47,192.168.11.48,TCP,74,0.006836,,0.006836,"Jan  6, 2024 19:36:15.161679000 JST",,"6000  >  42626 [SYN, ACK] Seq=0 Ack=1 Win=65160 Len=0 MSS=1460 SACK_PERM TSval=3616039608 TSecr=1071832152 WS=128"
3,0.006944,192.168.11.48,192.168.11.47,TCP,66,0.000108,,0.000108,"Jan  6, 2024 19:36:15.161787000 JST",,42626  >  6000 [ACK] Seq=1 Ack=1 Win=64256 Len=0 TSval=1071832162 TSecr=3616039608
4,0.00715,192.168.11.48,192.168.11.47,TCP,93,,,0.000206,"Jan  6, 2024 19:36:15.161993000 JST",,"42626  >  6000 [PSH, ACK] Seq=1 Ack=1 Win=64256 Len=27 TSval=1071832163 TSecr=3616039608 [TCP segment of a reassembled PDU]"
5,0.0073,192.168.11.48,192.168.11.47,TCP,66,,,0.00015,"Jan  6, 2024 19:36:15.162143000 JST",,"42626  >  6000 [FIN, ACK] Seq=28 Ack=1 Win=64256 Len=0 TSval=1071832163 TSecr=3616039608"
6,0.016797,192.168.11.47,192.168.11.48,TCP,66,0.009647,,0.009497,"Jan  6, 2024 19:36:15.171640000 JST",,6000  >  42626 [ACK] Seq=1 Ack=28 Win=65152 Len=0 TSval=3616039617 TSecr=1071832163
7,0.017251,192.168.11.47,192.168.11.48,TCP,66,0.009951,,0.000454,"Jan  6, 2024 19:36:15.172094000 JST",,"6000  >  42626 [FIN, ACK] Seq=1 Ack=29 Win=65152 Len=0 TSval=3616039619 TSecr=1071832163"
8,0.017308,192.168.11.48,192.168.11.47,TCP,66,0.000057,,0.000057,"Jan  6, 2024 19:36:15.172151000 JST",,42626  >  6000 [ACK] Seq=29 Ack=2 Win=64256 Len=0 TSval=1071832173 TSecr=3616039619
9,0.04973,192.168.11.48,255.255.255.255,UDP,209,,Åü,0.032422,"Jan  6, 2024 19:36:15.204573000 JST",7b2273656d616e74696373223a207b22656e74697479223a2022504944222c202262617365656e74697479223a2022616e79222c2022726f6c65223a2022303038222c20227370617469616c223a2022616e79222c202274656d706f72616c223a2022616e79227d2c20226461746170726f7065727479223a207b22666f726d6174223a2022696e616f6b615f70726f6772616d5f73616d706c655f73656d616e746963227d7d,56944  >  7000 Len=167
10,0.068072,192.168.11.14,192.168.11.48,TCP,74,,Åú,0.018342,"Jan  6, 2024 19:36:15.222915000 JST",,32990  >  6000 [SYN] Seq=0 Win=64240 Len=0 MSS=1460 SACK_PERM TSval=3840488356 TSecr=0 WS=128
11,0.068403,192.168.11.48,192.168.11.14,TCP,74,0.000331,,0.000331,"Jan  6, 2024 19:36:15.223246000 JST",,"6000  >  32990 [SYN, ACK] Seq=0 Ack=1 Win=65160 Len=0 MSS=1460 SACK_PERM TSval=853700056 TSecr=3840488356 WS=128"
12,0.076643,192.168.11.14,192.168.11.48,TCP,66,0.00824,,0.00824,"Jan  6, 2024 19:36:15.231486000 JST",,32990  >  6000 [ACK] Seq=1 Ack=1 Win=64256 Len=0 TSval=3840488375 TSecr=853700056
13,0.077216,192.168.11.14,192.168.11.48,TCP,93,,,0.000573,"Jan  6, 2024 19:36:15.232059000 JST",,"32990  >  6000 [PSH, ACK] Seq=1 Ack=1 Win=64256 Len=27 TSval=3840488375 TSecr=853700056 [TCP segment of a reassembled PDU]"
14,0.077293,192.168.11.48,192.168.11.14,TCP,66,0.000077,,0.000077,"Jan  6, 2024 19:36:15.232136000 JST",,6000  >  32990 [ACK] Seq=1 Ack=28 Win=65152 Len=0 TSval=853700065 TSecr=3840488375
15,0.077361,192.168.11.14,192.168.11.48,TCP,66,,,0.000068,"Jan  6, 2024 19:36:15.232204000 JST",,"32990  >  6000 [FIN, ACK] Seq=28 Ack=1 Win=64256 Len=0 TSval=3840488375 TSecr=853700056"
16,0.078643,192.168.11.48,192.168.11.14,TCP,66,0.001282,,0.001282,"Jan  6, 2024 19:36:15.233486000 JST",,"6000  >  32990 [FIN, ACK] Seq=1 Ack=29 Win=65152 Len=0 TSval=853700066 TSecr=3840488375"
17,0.085019,192.168.11.14,192.168.11.48,TCP,66,0.006376,,0.006376,"Jan  6, 2024 19:36:15.239862000 JST",,32990  >  6000 [ACK] Seq=29 Ack=2 Win=64256 Len=0 TSval=3840488383 TSecr=853700066
18,8.219719,192.168.11.48,192.168.11.47,TCP,74,,,8.1347,"Jan  6, 2024 19:36:23.374562000 JST",,42638  >  6000 [SYN] Seq=0 Win=64240 Len=0 MSS=1460 SACK_PERM TSval=1071840375 TSecr=0 WS=128
19,8.22658,192.168.11.47,192.168.11.48,TCP,74,0.006861,,0.006861,"Jan  6, 2024 19:36:23.381423000 JST",,"6000  >  42638 [SYN, ACK] Seq=0 Ack=1 Win=65160 Len=0 MSS=1460 SACK_PERM TSval=3616047828 TSecr=1071840375 WS=128"
20,8.226685,192.168.11.48,192.168.11.47,TCP,66,0.000105,,0.000105,"Jan  6, 2024 19:36:23.381528000 JST",,42638  >  6000 [ACK] Seq=1 Ack=1 Win=64256 Len=0 TSval=1071840382 TSecr=3616047828
21,8.226825,192.168.11.48,192.168.11.47,TCP,93,,,0.00014,"Jan  6, 2024 19:36:23.381668000 JST",,"42638  >  6000 [PSH, ACK] Seq=1 Ack=1 Win=64256 Len=27 TSval=1071840382 TSecr=3616047828 [TCP segment of a reassembled PDU]"
22,8.226952,192.168.11.48,192.168.11.47,TCP,66,,,0.000127,"Jan  6, 2024 19:36:23.381795000 JST",,"42638  >  6000 [FIN, ACK] Seq=28 Ack=1 Win=64256 Len=0 TSval=1071840382 TSecr=3616047828"
23,8.234336,192.168.11.47,192.168.11.48,TCP,66,0.007511,,0.007384,"Jan  6, 2024 19:36:23.389179000 JST",,6000  >  42638 [ACK] Seq=1 Ack=28 Win=65152 Len=0 TSval=3616047835 TSecr=1071840382
24,8.234569,192.168.11.47,192.168.11.48,TCP,66,0.007617,,0.000233,"Jan  6, 2024 19:36:23.389412000 JST",,"6000  >  42638 [FIN, ACK] Seq=1 Ack=29 Win=65152 Len=0 TSval=3616047837 TSecr=1071840382"
25,8.234615,192.168.11.48,192.168.11.47,TCP,66,0.000046,,0.000046,"Jan  6, 2024 19:36:23.389458000 JST",,42638  >  6000 [ACK] Seq=29 Ack=2 Win=64256 Len=0 TSval=1071840390 TSecr=3616047837
26,8.265641,192.168.11.48,255.255.255.255,UDP,209,,Åü,0.031026,"Jan  6, 2024 19:36:23.420484000 JST",7b2273656d616e74696373223a207b22656e74697479223a2022504944222c202262617365656e74697479223a2022616e79222c2022726f6c65223a2022303038222c20227370617469616c223a2022616e79222c202274656d706f72616c223a2022616e79227d2c20226461746170726f7065727479223a207b22666f726d6174223a2022696e616f6b615f70726f6772616d5f73616d706c655f73656d616e746963227d7d,33033  >  7000 Len=167
27,8.274688,192.168.11.14,192.168.11.48,TCP,74,,Åú,0.009047,"Jan  6, 2024 19:36:23.429531000 JST",,34900  >  6000 [SYN] Seq=0 Win=64240 Len=0 MSS=1460 SACK_PERM TSval=3840496572 TSecr=0 WS=128
28,8.274845,192.168.11.48,192.168.11.14,TCP,74,0.000157,,0.000157,"Jan  6, 2024 19:36:23.429688000 JST",,"6000  >  34900 [SYN, ACK] Seq=0 Ack=1 Win=65160 Len=0 MSS=1460 SACK_PERM TSval=853708262 TSecr=3840496572 WS=128"
29,8.28629,192.168.11.14,192.168.11.48,TCP,66,0.011445,,0.011445,"Jan  6, 2024 19:36:23.441133000 JST",,34900  >  6000 [ACK] Seq=1 Ack=1 Win=64256 Len=0 TSval=3840496585 TSecr=853708262
30,8.287001,192.168.11.14,192.168.11.48,TCP,93,,,0.000711,"Jan  6, 2024 19:36:23.441844000 JST",,"34900  >  6000 [PSH, ACK] Seq=1 Ack=1 Win=64256 Len=27 TSval=3840496585 TSecr=853708262 [TCP segment of a reassembled PDU]"
31,8.287106,192.168.11.48,192.168.11.14,TCP,66,0.000105,,0.000105,"Jan  6, 2024 19:36:23.441949000 JST",,6000  >  34900 [ACK] Seq=1 Ack=28 Win=65152 Len=0 TSval=853708274 TSecr=3840496585
32,8.287194,192.168.11.14,192.168.11.48,TCP,66,,,0.000088,"Jan  6, 2024 19:36:23.442037000 JST",,"34900  >  6000 [FIN, ACK] Seq=28 Ack=1 Win=64256 Len=0 TSval=3840496585 TSecr=853708262"
33,8.288329,192.168.11.48,192.168.11.14,TCP,66,0.001135,,0.001135,"Jan  6, 2024 19:36:23.443172000 JST",,"6000  >  34900 [FIN, ACK] Seq=1 Ack=29 Win=65152 Len=0 TSval=853708276 TSecr=3840496585"
34,8.295743,192.168.11.14,192.168.11.48,TCP,66,0.007414,,0.007414,"Jan  6, 2024 19:36:23.450586000 JST",,34900  >  6000 [ACK] Seq=29 Ack=2 Win=64256 Len=0 TSval=3840496593 TSecr=853708276
35,19.088974,192.168.11.48,192.168.11.47,TCP,74,,,10.793231,"Jan  6, 2024 19:36:34.243817000 JST",,43136  >  6000 [SYN] Seq=0 Win=64240 Len=0 MSS=1460 SACK_PERM TSval=1071851244 TSecr=0 WS=128
36,19.096047,192.168.11.47,192.168.11.48,TCP,74,0.007073,,0.007073,"Jan  6, 2024 19:36:34.250890000 JST",,"6000  >  43136 [SYN, ACK] Seq=0 Ack=1 Win=65160 Len=0 MSS=1460 SACK_PERM TSval=3616058697 TSecr=1071851244 WS=128"
37,19.096156,192.168.11.48,192.168.11.47,TCP,66,0.000109,,0.000109,"Jan  6, 2024 19:36:34.250999000 JST",,43136  >  6000 [ACK] Seq=1 Ack=1 Win=64256 Len=0 TSval=1071851252 TSecr=3616058697
38,19.096391,192.168.11.48,192.168.11.47,TCP,93,,,0.000235,"Jan  6, 2024 19:36:34.251234000 JST",,"43136  >  6000 [PSH, ACK] Seq=1 Ack=1 Win=64256 Len=27 TSval=1071851252 TSecr=3616058697 [TCP segment of a reassembled PDU]"
39,19.096524,192.168.11.48,192.168.11.47,TCP,66,,,0.000133,"Jan  6, 2024 19:36:34.251367000 JST",,"43136  >  6000 [FIN, ACK] Seq=28 Ack=1 Win=64256 Len=0 TSval=1071851252 TSecr=3616058697"
40,19.105632,192.168.11.47,192.168.11.48,TCP,66,0.009241,,0.009108,"Jan  6, 2024 19:36:34.260475000 JST",,6000  >  43136 [ACK] Seq=1 Ack=28 Win=65152 Len=0 TSval=3616058706 TSecr=1071851252
41,19.105994,192.168.11.47,192.168.11.48,TCP,66,0.00947,,0.000362,"Jan  6, 2024 19:36:34.260837000 JST",,"6000  >  43136 [FIN, ACK] Seq=1 Ack=29 Win=65152 Len=0 TSval=3616058707 TSecr=1071851252"
42,19.106047,192.168.11.48,192.168.11.47,TCP,66,0.000053,,0.000053,"Jan  6, 2024 19:36:34.260890000 JST",,43136  >  6000 [ACK] Seq=29 Ack=2 Win=64256 Len=0 TSval=1071851261 TSecr=3616058707
43,19.144872,192.168.11.48,255.255.255.255,UDP,209,,Åü,0.038825,"Jan  6, 2024 19:36:34.299715000 JST",7b2273656d616e74696373223a207b22656e74697479223a2022504944222c202262617365656e74697479223a2022616e79222c2022726f6c65223a2022303038222c20227370617469616c223a2022616e79222c202274656d706f72616c223a2022616e79227d2c20226461746170726f7065727479223a207b22666f726d6174223a2022696e616f6b615f70726f6772616d5f73616d706c655f73656d616e746963227d7d,47941  >  7000 Len=167
44,19.152786,192.168.11.14,192.168.11.48,TCP,74,,Åú,0.007914,"Jan  6, 2024 19:36:34.307629000 JST",,57008  >  6000 [SYN] Seq=0 Win=64240 Len=0 MSS=1460 SACK_PERM TSval=3840507451 TSecr=0 WS=128
45,19.152924,192.168.11.48,192.168.11.14,TCP,74,0.000138,,0.000138,"Jan  6, 2024 19:36:34.307767000 JST",,"6000  >  57008 [SYN, ACK] Seq=0 Ack=1 Win=65160 Len=0 MSS=1460 SACK_PERM TSval=853719140 TSecr=3840507451 WS=128"
46,19.160201,192.168.11.14,192.168.11.48,TCP,66,0.007277,,0.007277,"Jan  6, 2024 19:36:34.315044000 JST",,57008  >  6000 [ACK] Seq=1 Ack=1 Win=64256 Len=0 TSval=3840507458 TSecr=853719140
47,19.160804,192.168.11.14,192.168.11.48,TCP,93,,,0.000603,"Jan  6, 2024 19:36:34.315647000 JST",,"57008  >  6000 [PSH, ACK] Seq=1 Ack=1 Win=64256 Len=27 TSval=3840507459 TSecr=853719140 [TCP segment of a reassembled PDU]"
48,19.160905,192.168.11.48,192.168.11.14,TCP,66,0.000101,,0.000101,"Jan  6, 2024 19:36:34.315748000 JST",,6000  >  57008 [ACK] Seq=1 Ack=28 Win=65152 Len=0 TSval=853719148 TSecr=3840507459
49,19.160974,192.168.11.14,192.168.11.48,TCP,66,,,0.000069,"Jan  6, 2024 19:36:34.315817000 JST",,"57008  >  6000 [FIN, ACK] Seq=28 Ack=1 Win=64256 Len=0 TSval=3840507459 TSecr=853719140"
50,19.162913,192.168.11.48,192.168.11.14,TCP,66,0.001939,,0.001939,"Jan  6, 2024 19:36:34.317756000 JST",,"6000  >  57008 [FIN, ACK] Seq=1 Ack=29 Win=65152 Len=0 TSval=853719150 TSecr=3840507459"
51,19.168011,192.168.11.14,192.168.11.48,TCP,66,0.005098,,0.005098,"Jan  6, 2024 19:36:34.322854000 JST",,57008  >  6000 [ACK] Seq=29 Ack=2 Win=64256 Len=0 TSval=3840507467 TSecr=853719150
52,27.969401,192.168.11.48,192.168.11.47,TCP,74,,,8.80139,"Jan  6, 2024 19:36:43.124244000 JST",,42646  >  6000 [SYN] Seq=0 Win=64240 Len=0 MSS=1460 SACK_PERM TSval=1071860125 TSecr=0 WS=128
53,27.976296,192.168.11.47,192.168.11.48,TCP,74,0.006895,,0.006895,"Jan  6, 2024 19:36:43.131139000 JST",,"6000  >  42646 [SYN, ACK] Seq=0 Ack=1 Win=65160 Len=0 MSS=1460 SACK_PERM TSval=3616067578 TSecr=1071860125 WS=128"
54,27.976403,192.168.11.48,192.168.11.47,TCP,66,0.000107,,0.000107,"Jan  6, 2024 19:36:43.131246000 JST",,42646  >  6000 [ACK] Seq=1 Ack=1 Win=64256 Len=0 TSval=1071860132 TSecr=3616067578
55,27.976573,192.168.11.48,192.168.11.47,TCP,93,,,0.00017,"Jan  6, 2024 19:36:43.131416000 JST",,"42646  >  6000 [PSH, ACK] Seq=1 Ack=1 Win=64256 Len=27 TSval=1071860132 TSecr=3616067578 [TCP segment of a reassembled PDU]"
56,27.976699,192.168.11.48,192.168.11.47,TCP,66,,,0.000126,"Jan  6, 2024 19:36:43.131542000 JST",,"42646  >  6000 [FIN, ACK] Seq=28 Ack=1 Win=64256 Len=0 TSval=1071860132 TSecr=3616067578"
57,27.986559,192.168.11.47,192.168.11.48,TCP,66,0.009986,,0.00986,"Jan  6, 2024 19:36:43.141402000 JST",,6000  >  42646 [ACK] Seq=1 Ack=28 Win=65152 Len=0 TSval=3616067587 TSecr=1071860132
58,27.986934,192.168.11.47,192.168.11.48,TCP,66,0.010235,,0.000375,"Jan  6, 2024 19:36:43.141777000 JST",,"6000  >  42646 [FIN, ACK] Seq=1 Ack=29 Win=65152 Len=0 TSval=3616067589 TSecr=1071860132"
59,27.986979,192.168.11.48,192.168.11.47,TCP,66,0.000045,,0.000045,"Jan  6, 2024 19:36:43.141822000 JST",,42646  >  6000 [ACK] Seq=29 Ack=2 Win=64256 Len=0 TSval=1071860142 TSecr=3616067589
60,28.019074,192.168.11.48,255.255.255.255,UDP,209,,Åü,0.032095,"Jan  6, 2024 19:36:43.173917000 JST",7b2273656d616e74696373223a207b22656e74697479223a2022504944222c202262617365656e74697479223a2022616e79222c2022726f6c65223a2022303038222c20227370617469616c223a2022616e79222c202274656d706f72616c223a2022616e79227d2c20226461746170726f7065727479223a207b22666f726d6174223a2022696e616f6b615f70726f6772616d5f73616d706c655f73656d616e746963227d7d,46684  >  7000 Len=167
61,28.028248,192.168.11.14,192.168.11.48,TCP,74,,Åú,0.009174,"Jan  6, 2024 19:36:43.183091000 JST",,41658  >  6000 [SYN] Seq=0 Win=64240 Len=0 MSS=1460 SACK_PERM TSval=3840516327 TSecr=0 WS=128
62,28.028424,192.168.11.48,192.168.11.14,TCP,74,0.000176,,0.000176,"Jan  6, 2024 19:36:43.183267000 JST",,"6000  >  41658 [SYN, ACK] Seq=0 Ack=1 Win=65160 Len=0 MSS=1460 SACK_PERM TSval=853728016 TSecr=3840516327 WS=128"
63,28.035226,192.168.11.14,192.168.11.48,TCP,66,0.006802,,0.006802,"Jan  6, 2024 19:36:43.190069000 JST",,41658  >  6000 [ACK] Seq=1 Ack=1 Win=64256 Len=0 TSval=3840516334 TSecr=853728016
64,28.036276,192.168.11.14,192.168.11.48,TCP,93,,,0.00105,"Jan  6, 2024 19:36:43.191119000 JST",,"41658  >  6000 [PSH, ACK] Seq=1 Ack=1 Win=64256 Len=27 TSval=3840516334 TSecr=853728016 [TCP segment of a reassembled PDU]"
65,28.03641,192.168.11.48,192.168.11.14,TCP,66,0.000134,,0.000134,"Jan  6, 2024 19:36:43.191253000 JST",,6000  >  41658 [ACK] Seq=1 Ack=28 Win=65152 Len=0 TSval=853728024 TSecr=3840516334
66,28.036511,192.168.11.14,192.168.11.48,TCP,66,,,0.000101,"Jan  6, 2024 19:36:43.191354000 JST",,"41658  >  6000 [FIN, ACK] Seq=28 Ack=1 Win=64256 Len=0 TSval=3840516334 TSecr=853728016"
67,28.038476,192.168.11.48,192.168.11.14,TCP,66,0.001965,,0.001965,"Jan  6, 2024 19:36:43.193319000 JST",,"6000  >  41658 [FIN, ACK] Seq=1 Ack=29 Win=65152 Len=0 TSval=853728026 TSecr=3840516334"
68,28.043552,192.168.11.14,192.168.11.48,TCP,66,0.005076,,0.005076,"Jan  6, 2024 19:36:43.198395000 JST",,41658  >  6000 [ACK] Seq=29 Ack=2 Win=64256 Len=0 TSval=3840516342 TSecr=853728026
69,35.776441,192.168.11.48,192.168.11.47,TCP,74,,,7.732889,"Jan  6, 2024 19:36:50.931284000 JST",,52328  >  6000 [SYN] Seq=0 Win=64240 Len=0 MSS=1460 SACK_PERM TSval=1071867932 TSecr=0 WS=128
70,35.782951,192.168.11.47,192.168.11.48,TCP,74,0.00651,,0.00651,"Jan  6, 2024 19:36:50.937794000 JST",,"6000  >  52328 [SYN, ACK] Seq=0 Ack=1 Win=65160 Len=0 MSS=1460 SACK_PERM TSval=3616075384 TSecr=1071867932 WS=128"
71,35.78307,192.168.11.48,192.168.11.47,TCP,66,0.000119,,0.000119,"Jan  6, 2024 19:36:50.937913000 JST",,52328  >  6000 [ACK] Seq=1 Ack=1 Win=64256 Len=0 TSval=1071867939 TSecr=3616075384
72,35.78328,192.168.11.48,192.168.11.47,TCP,93,,,0.00021,"Jan  6, 2024 19:36:50.938123000 JST",,"52328  >  6000 [PSH, ACK] Seq=1 Ack=1 Win=64256 Len=27 TSval=1071867939 TSecr=3616075384 [TCP segment of a reassembled PDU]"
73,35.783379,192.168.11.48,192.168.11.47,TCP,66,,,0.000099,"Jan  6, 2024 19:36:50.938222000 JST",,"52328  >  6000 [FIN, ACK] Seq=28 Ack=1 Win=64256 Len=0 TSval=1071867939 TSecr=3616075384"
74,35.793676,192.168.11.47,192.168.11.48,TCP,66,0.010396,,0.010297,"Jan  6, 2024 19:36:50.948519000 JST",,6000  >  52328 [ACK] Seq=1 Ack=28 Win=65152 Len=0 TSval=3616075392 TSecr=1071867939
75,35.794062,192.168.11.47,192.168.11.48,TCP,66,0.010683,,0.000386,"Jan  6, 2024 19:36:50.948905000 JST",,"6000  >  52328 [FIN, ACK] Seq=1 Ack=29 Win=65152 Len=0 TSval=3616075393 TSecr=1071867939"
76,35.794108,192.168.11.48,192.168.11.47,TCP,66,0.000046,,0.000046,"Jan  6, 2024 19:36:50.948951000 JST",,52328  >  6000 [ACK] Seq=29 Ack=2 Win=64256 Len=0 TSval=1071867950 TSecr=3616075393
77,35.824367,192.168.11.48,255.255.255.255,UDP,209,,Åü,0.030259,"Jan  6, 2024 19:36:50.979210000 JST",7b2273656d616e74696373223a207b22656e74697479223a2022504944222c202262617365656e74697479223a2022616e79222c2022726f6c65223a2022303038222c20227370617469616c223a2022616e79222c202274656d706f72616c223a2022616e79227d2c20226461746170726f7065727479223a207b22666f726d6174223a2022696e616f6b615f70726f6772616d5f73616d706c655f73656d616e746963227d7d,51672  >  7000 Len=167
78,35.83243,192.168.11.14,192.168.11.48,TCP,74,,Åú,0.008063,"Jan  6, 2024 19:36:50.987273000 JST",,47882  >  6000 [SYN] Seq=0 Win=64240 Len=0 MSS=1460 SACK_PERM TSval=3840524131 TSecr=0 WS=128
79,35.832535,192.168.11.48,192.168.11.14,TCP,74,0.000105,,0.000105,"Jan  6, 2024 19:36:50.987378000 JST",,"6000  >  47882 [SYN, ACK] Seq=0 Ack=1 Win=65160 Len=0 MSS=1460 SACK_PERM TSval=853735820 TSecr=3840524131 WS=128"
80,35.839165,192.168.11.14,192.168.11.48,TCP,66,0.00663,,0.00663,"Jan  6, 2024 19:36:50.994008000 JST",,47882  >  6000 [ACK] Seq=1 Ack=1 Win=64256 Len=0 TSval=3840524138 TSecr=853735820
81,35.839621,192.168.11.14,192.168.11.48,TCP,93,,,0.000456,"Jan  6, 2024 19:36:50.994464000 JST",,"47882  >  6000 [PSH, ACK] Seq=1 Ack=1 Win=64256 Len=27 TSval=3840524138 TSecr=853735820 [TCP segment of a reassembled PDU]"
82,35.839688,192.168.11.48,192.168.11.14,TCP,66,0.000067,,0.000067,"Jan  6, 2024 19:36:50.994531000 JST",,6000  >  47882 [ACK] Seq=1 Ack=28 Win=65152 Len=0 TSval=853735827 TSecr=3840524138
83,35.839747,192.168.11.14,192.168.11.48,TCP,66,,,0.000059,"Jan  6, 2024 19:36:50.994590000 JST",,"47882  >  6000 [FIN, ACK] Seq=28 Ack=1 Win=64256 Len=0 TSval=3840524138 TSecr=853735820"
84,35.840587,192.168.11.48,192.168.11.14,TCP,66,0.00084,,0.00084,"Jan  6, 2024 19:36:50.995430000 JST",,"6000  >  47882 [FIN, ACK] Seq=1 Ack=29 Win=65152 Len=0 TSval=853735828 TSecr=3840524138"
85,35.846999,192.168.11.14,192.168.11.48,TCP,66,0.006412,,0.006412,"Jan  6, 2024 19:36:51.001842000 JST",,47882  >  6000 [ACK] Seq=29 Ack=2 Win=64256 Len=0 TSval=3840524145 TSecr=853735828
86,43.616564,192.168.11.48,192.168.11.47,TCP,74,,,7.769565,"Jan  6, 2024 19:36:58.771407000 JST",,36184  >  6000 [SYN] Seq=0 Win=64240 Len=0 MSS=1460 SACK_PERM TSval=1071875772 TSecr=0 WS=128
87,43.62328,192.168.11.47,192.168.11.48,TCP,74,0.006716,,0.006716,"Jan  6, 2024 19:36:58.778123000 JST",,"6000  >  36184 [SYN, ACK] Seq=0 Ack=1 Win=65160 Len=0 MSS=1460 SACK_PERM TSval=3616083225 TSecr=1071875772 WS=128"
88,43.623389,192.168.11.48,192.168.11.47,TCP,66,0.000109,,0.000109,"Jan  6, 2024 19:36:58.778232000 JST",,36184  >  6000 [ACK] Seq=1 Ack=1 Win=64256 Len=0 TSval=1071875779 TSecr=3616083225
89,43.623527,192.168.11.48,192.168.11.47,TCP,93,,,0.000138,"Jan  6, 2024 19:36:58.778370000 JST",,"36184  >  6000 [PSH, ACK] Seq=1 Ack=1 Win=64256 Len=27 TSval=1071875779 TSecr=3616083225 [TCP segment of a reassembled PDU]"
90,43.623643,192.168.11.48,192.168.11.47,TCP,66,,,0.000116,"Jan  6, 2024 19:36:58.778486000 JST",,"36184  >  6000 [FIN, ACK] Seq=28 Ack=1 Win=64256 Len=0 TSval=1071875779 TSecr=3616083225"
91,43.631295,192.168.11.47,192.168.11.48,TCP,66,0.007768,,0.007652,"Jan  6, 2024 19:36:58.786138000 JST",,6000  >  36184 [ACK] Seq=1 Ack=28 Win=65152 Len=0 TSval=3616083232 TSecr=1071875779
92,43.631733,192.168.11.47,192.168.11.48,TCP,66,0.00809,,0.000438,"Jan  6, 2024 19:36:58.786576000 JST",,"6000  >  36184 [FIN, ACK] Seq=1 Ack=29 Win=65152 Len=0 TSval=3616083234 TSecr=1071875779"
93,43.631779,192.168.11.48,192.168.11.47,TCP,66,0.000046,,0.000046,"Jan  6, 2024 19:36:58.786622000 JST",,36184  >  6000 [ACK] Seq=29 Ack=2 Win=64256 Len=0 TSval=1071875787 TSecr=3616083234
94,43.662218,192.168.11.48,255.255.255.255,UDP,209,,Åü,0.030439,"Jan  6, 2024 19:36:58.817061000 JST",7b2273656d616e74696373223a207b22656e74697479223a2022504944222c202262617365656e74697479223a2022616e79222c2022726f6c65223a2022303038222c20227370617469616c223a2022616e79222c202274656d706f72616c223a2022616e79227d2c20226461746170726f7065727479223a207b22666f726d6174223a2022696e616f6b615f70726f6772616d5f73616d706c655f73656d616e746963227d7d,44327  >  7000 Len=167
95,43.670465,192.168.11.14,192.168.11.48,TCP,74,,Åú,0.008247,"Jan  6, 2024 19:36:58.825308000 JST",,39118  >  6000 [SYN] Seq=0 Win=64240 Len=0 MSS=1460 SACK_PERM TSval=3840531969 TSecr=0 WS=128
96,43.670614,192.168.11.48,192.168.11.14,TCP,74,0.000149,,0.000149,"Jan  6, 2024 19:36:58.825457000 JST",,"6000  >  39118 [SYN, ACK] Seq=0 Ack=1 Win=65160 Len=0 MSS=1460 SACK_PERM TSval=853743658 TSecr=3840531969 WS=128"
97,43.677676,192.168.11.14,192.168.11.48,TCP,66,0.007062,,0.007062,"Jan  6, 2024 19:36:58.832519000 JST",,39118  >  6000 [ACK] Seq=1 Ack=1 Win=64256 Len=0 TSval=3840531976 TSecr=853743658
98,43.678325,192.168.11.14,192.168.11.48,TCP,93,,,0.000649,"Jan  6, 2024 19:36:58.833168000 JST",,"39118  >  6000 [PSH, ACK] Seq=1 Ack=1 Win=64256 Len=27 TSval=3840531976 TSecr=853743658 [TCP segment of a reassembled PDU]"
99,43.678428,192.168.11.48,192.168.11.14,TCP,66,0.000103,,0.000103,"Jan  6, 2024 19:36:58.833271000 JST",,6000  >  39118 [ACK] Seq=1 Ack=28 Win=65152 Len=0 TSval=853743666 TSecr=3840531976
100,43.678518,192.168.11.14,192.168.11.48,TCP,66,,,0.00009,"Jan  6, 2024 19:36:58.833361000 JST",,"39118  >  6000 [FIN, ACK] Seq=28 Ack=1 Win=64256 Len=0 TSval=3840531976 TSecr=853743658"
101,43.679779,192.168.11.48,192.168.11.14,TCP,66,0.001261,,0.001261,"Jan  6, 2024 19:36:58.834622000 JST",,"6000  >  39118 [FIN, ACK] Seq=1 Ack=29 Win=65152 Len=0 TSval=853743667 TSecr=3840531976"
102,43.688453,192.168.11.14,192.168.11.48,TCP,66,0.008674,,0.008674,"Jan  6, 2024 19:36:58.843296000 JST",,39118  >  6000 [ACK] Seq=29 Ack=2 Win=64256 Len=0 TSval=3840531984 TSecr=853743667
103,51.704493,192.168.11.48,192.168.11.47,TCP,74,,,8.01604,"Jan  6, 2024 19:37:06.859336000 JST",,52032  >  6000 [SYN] Seq=0 Win=64240 Len=0 MSS=1460 SACK_PERM TSval=1071883860 TSecr=0 WS=128
104,51.711342,192.168.11.47,192.168.11.48,TCP,74,0.006849,,0.006849,"Jan  6, 2024 19:37:06.866185000 JST",,"6000  >  52032 [SYN, ACK] Seq=0 Ack=1 Win=65160 Len=0 MSS=1460 SACK_PERM TSval=3616091313 TSecr=1071883860 WS=128"
105,51.711462,192.168.11.48,192.168.11.47,TCP,66,0.00012,,0.00012,"Jan  6, 2024 19:37:06.866305000 JST",,52032  >  6000 [ACK] Seq=1 Ack=1 Win=64256 Len=0 TSval=1071883867 TSecr=3616091313
106,51.711602,192.168.11.48,192.168.11.47,TCP,93,,,0.00014,"Jan  6, 2024 19:37:06.866445000 JST",,"52032  >  6000 [PSH, ACK] Seq=1 Ack=1 Win=64256 Len=27 TSval=1071883867 TSecr=3616091313 [TCP segment of a reassembled PDU]"
107,51.711706,192.168.11.48,192.168.11.47,TCP,66,,,0.000104,"Jan  6, 2024 19:37:06.866549000 JST",,"52032  >  6000 [FIN, ACK] Seq=28 Ack=1 Win=64256 Len=0 TSval=1071883867 TSecr=3616091313"
108,51.718958,192.168.11.47,192.168.11.48,TCP,66,0.007356,,0.007252,"Jan  6, 2024 19:37:06.873801000 JST",,6000  >  52032 [ACK] Seq=1 Ack=28 Win=65152 Len=0 TSval=3616091320 TSecr=1071883867
109,51.719194,192.168.11.47,192.168.11.48,TCP,66,0.007488,,0.000236,"Jan  6, 2024 19:37:06.874037000 JST",,"6000  >  52032 [FIN, ACK] Seq=1 Ack=29 Win=65152 Len=0 TSval=3616091322 TSecr=1071883867"
110,51.719237,192.168.11.48,192.168.11.47,TCP,66,0.000043,,0.000043,"Jan  6, 2024 19:37:06.874080000 JST",,52032  >  6000 [ACK] Seq=29 Ack=2 Win=64256 Len=0 TSval=1071883875 TSecr=3616091322
111,51.752233,192.168.11.48,255.255.255.255,UDP,209,,Åü,0.032996,"Jan  6, 2024 19:37:06.907076000 JST",7b2273656d616e74696373223a207b22656e74697479223a2022504944222c202262617365656e74697479223a2022616e79222c2022726f6c65223a2022303038222c20227370617469616c223a2022616e79222c202274656d706f72616c223a2022616e79227d2c20226461746170726f7065727479223a207b22666f726d6174223a2022696e616f6b615f70726f6772616d5f73616d706c655f73656d616e746963227d7d,41213  >  7000 Len=167
112,51.760507,192.168.11.14,192.168.11.48,TCP,74,,Åú,0.008274,"Jan  6, 2024 19:37:06.915350000 JST",,36886  >  6000 [SYN] Seq=0 Win=64240 Len=0 MSS=1460 SACK_PERM TSval=3840540059 TSecr=0 WS=128
113,51.760662,192.168.11.48,192.168.11.14,TCP,74,0.000155,,0.000155,"Jan  6, 2024 19:37:06.915505000 JST",,"6000  >  36886 [SYN, ACK] Seq=0 Ack=1 Win=65160 Len=0 MSS=1460 SACK_PERM TSval=853751748 TSecr=3840540059 WS=128"
114,51.769024,192.168.11.14,192.168.11.48,TCP,66,0.008362,,0.008362,"Jan  6, 2024 19:37:06.923867000 JST",,36886  >  6000 [ACK] Seq=1 Ack=1 Win=64256 Len=0 TSval=3840540066 TSecr=853751748
115,51.770063,192.168.11.14,192.168.11.48,TCP,93,,,0.001039,"Jan  6, 2024 19:37:06.924906000 JST",,"36886  >  6000 [PSH, ACK] Seq=1 Ack=1 Win=64256 Len=27 TSval=3840540066 TSecr=853751748 [TCP segment of a reassembled PDU]"
116,51.770307,192.168.11.48,192.168.11.14,TCP,66,0.000244,,0.000244,"Jan  6, 2024 19:37:06.925150000 JST",,6000  >  36886 [ACK] Seq=1 Ack=28 Win=65152 Len=0 TSval=853751758 TSecr=3840540066
117,51.770477,192.168.11.14,192.168.11.48,TCP,66,,,0.00017,"Jan  6, 2024 19:37:06.925320000 JST",,"36886  >  6000 [FIN, ACK] Seq=28 Ack=1 Win=64256 Len=0 TSval=3840540067 TSecr=853751748"
118,51.771681,192.168.11.48,192.168.11.14,TCP,66,0.001204,,0.001204,"Jan  6, 2024 19:37:06.926524000 JST",,"6000  >  36886 [FIN, ACK] Seq=1 Ack=29 Win=65152 Len=0 TSval=853751759 TSecr=3840540067"
119,51.985112,192.168.11.48,192.168.11.14,TCP,66,,,0.213431,"Jan  6, 2024 19:37:07.139955000 JST",,"[TCP Retransmission] 6000  >  36886 [FIN, ACK] Seq=1 Ack=29 Win=65152 Len=0 TSval=853751973 TSecr=3840540067"
120,51.99522,192.168.11.14,192.168.11.48,TCP,66,0.223539,,0.010108,"Jan  6, 2024 19:37:07.150063000 JST",,36886  >  6000 [ACK] Seq=29 Ack=2 Win=64256 Len=0 TSval=3840540293 TSecr=853751759
121,60.817586,192.168.11.48,192.168.11.47,TCP,74,,,8.822366,"Jan  6, 2024 19:37:15.972429000 JST",,56272  >  6000 [SYN] Seq=0 Win=64240 Len=0 MSS=1460 SACK_PERM TSval=1071892973 TSecr=0 WS=128
122,60.825289,192.168.11.47,192.168.11.48,TCP,74,0.007703,,0.007703,"Jan  6, 2024 19:37:15.980132000 JST",,"6000  >  56272 [SYN, ACK] Seq=0 Ack=1 Win=65160 Len=0 MSS=1460 SACK_PERM TSval=3616100426 TSecr=1071892973 WS=128"
123,60.825382,192.168.11.48,192.168.11.47,TCP,66,0.000093,,0.000093,"Jan  6, 2024 19:37:15.980225000 JST",,56272  >  6000 [ACK] Seq=1 Ack=1 Win=64256 Len=0 TSval=1071892981 TSecr=3616100426
124,60.825505,192.168.11.48,192.168.11.47,TCP,93,,,0.000123,"Jan  6, 2024 19:37:15.980348000 JST",,"56272  >  6000 [PSH, ACK] Seq=1 Ack=1 Win=64256 Len=27 TSval=1071892981 TSecr=3616100426 [TCP segment of a reassembled PDU]"
125,60.825629,192.168.11.48,192.168.11.47,TCP,66,,,0.000124,"Jan  6, 2024 19:37:15.980472000 JST",,"56272  >  6000 [FIN, ACK] Seq=28 Ack=1 Win=64256 Len=0 TSval=1071892981 TSecr=3616100426"
126,60.832478,192.168.11.47,192.168.11.48,TCP,66,0.006973,,0.006849,"Jan  6, 2024 19:37:15.987321000 JST",,6000  >  56272 [ACK] Seq=1 Ack=28 Win=65152 Len=0 TSval=3616100434 TSecr=1071892981
127,60.83284,192.168.11.47,192.168.11.48,TCP,66,0.007211,,0.000362,"Jan  6, 2024 19:37:15.987683000 JST",,"6000  >  56272 [FIN, ACK] Seq=1 Ack=29 Win=65152 Len=0 TSval=3616100435 TSecr=1071892981"
128,60.83289,192.168.11.48,192.168.11.47,TCP,66,0.00005,,0.00005,"Jan  6, 2024 19:37:15.987733000 JST",,56272  >  6000 [ACK] Seq=29 Ack=2 Win=64256 Len=0 TSval=1071892988 TSecr=3616100435
129,60.862203,192.168.11.48,255.255.255.255,UDP,209,,Åü,0.029313,"Jan  6, 2024 19:37:16.017046000 JST",7b2273656d616e74696373223a207b22656e74697479223a2022504944222c202262617365656e74697479223a2022616e79222c2022726f6c65223a2022303038222c20227370617469616c223a2022616e79222c202274656d706f72616c223a2022616e79227d2c20226461746170726f7065727479223a207b22666f726d6174223a2022696e616f6b615f70726f6772616d5f73616d706c655f73656d616e746963227d7d,57299  >  7000 Len=167
130,60.870327,192.168.11.14,192.168.11.48,TCP,74,,Åú,0.008124,"Jan  6, 2024 19:37:16.025170000 JST",,36896  >  6000 [SYN] Seq=0 Win=64240 Len=0 MSS=1460 SACK_PERM TSval=3840549169 TSecr=0 WS=128
131,60.870464,192.168.11.48,192.168.11.14,TCP,74,0.000137,,0.000137,"Jan  6, 2024 19:37:16.025307000 JST",,"6000  >  36896 [SYN, ACK] Seq=0 Ack=1 Win=65160 Len=0 MSS=1460 SACK_PERM TSval=853760858 TSecr=3840549169 WS=128"
132,60.877358,192.168.11.14,192.168.11.48,TCP,66,0.006894,,0.006894,"Jan  6, 2024 19:37:16.032201000 JST",,36896  >  6000 [ACK] Seq=1 Ack=1 Win=64256 Len=0 TSval=3840549176 TSecr=853760858
133,60.877856,192.168.11.14,192.168.11.48,TCP,93,,,0.000498,"Jan  6, 2024 19:37:16.032699000 JST",,"36896  >  6000 [PSH, ACK] Seq=1 Ack=1 Win=64256 Len=27 TSval=3840549176 TSecr=853760858 [TCP segment of a reassembled PDU]"
134,60.877927,192.168.11.48,192.168.11.14,TCP,66,0.000071,,0.000071,"Jan  6, 2024 19:37:16.032770000 JST",,6000  >  36896 [ACK] Seq=1 Ack=28 Win=65152 Len=0 TSval=853760865 TSecr=3840549176
135,60.877993,192.168.11.14,192.168.11.48,TCP,66,,,0.000066,"Jan  6, 2024 19:37:16.032836000 JST",,"36896  >  6000 [FIN, ACK] Seq=28 Ack=1 Win=64256 Len=0 TSval=3840549176 TSecr=853760858"
136,60.879858,192.168.11.48,192.168.11.14,TCP,66,0.001865,,0.001865,"Jan  6, 2024 19:37:16.034701000 JST",,"6000  >  36896 [FIN, ACK] Seq=1 Ack=29 Win=65152 Len=0 TSval=853760867 TSecr=3840549176"
137,60.893839,192.168.11.14,192.168.11.48,TCP,66,0.013981,,0.013981,"Jan  6, 2024 19:37:16.048682000 JST",,36896  >  6000 [ACK] Seq=29 Ack=2 Win=64256 Len=0 TSval=3840549187 TSecr=853760867
138,72.717934,192.168.11.48,192.168.11.47,TCP,74,,,11.824095,"Jan  6, 2024 19:37:27.872777000 JST",,50832  >  6000 [SYN] Seq=0 Win=64240 Len=0 MSS=1460 SACK_PERM TSval=1071904873 TSecr=0 WS=128
139,72.730516,192.168.11.47,192.168.11.48,TCP,74,0.012582,,0.012582,"Jan  6, 2024 19:37:27.885359000 JST",,"6000  >  50832 [SYN, ACK] Seq=0 Ack=1 Win=65160 Len=0 MSS=1460 SACK_PERM TSval=3616112326 TSecr=1071904873 WS=128"
140,72.730618,192.168.11.48,192.168.11.47,TCP,66,0.000102,,0.000102,"Jan  6, 2024 19:37:27.885461000 JST",,50832  >  6000 [ACK] Seq=1 Ack=1 Win=64256 Len=0 TSval=1071904886 TSecr=3616112326
141,72.730848,192.168.11.48,192.168.11.47,TCP,93,,,0.00023,"Jan  6, 2024 19:37:27.885691000 JST",,"50832  >  6000 [PSH, ACK] Seq=1 Ack=1 Win=64256 Len=27 TSval=1071904886 TSecr=3616112326 [TCP segment of a reassembled PDU]"
142,72.730979,192.168.11.48,192.168.11.47,TCP,66,,,0.000131,"Jan  6, 2024 19:37:27.885822000 JST",,"50832  >  6000 [FIN, ACK] Seq=28 Ack=1 Win=64256 Len=0 TSval=1071904886 TSecr=3616112326"
143,72.741894,192.168.11.47,192.168.11.48,TCP,66,0.011046,,0.010915,"Jan  6, 2024 19:37:27.896737000 JST",,6000  >  50832 [ACK] Seq=1 Ack=28 Win=65152 Len=0 TSval=3616112343 TSecr=1071904886
144,72.742252,192.168.11.47,192.168.11.48,TCP,66,0.011273,,0.000358,"Jan  6, 2024 19:37:27.897095000 JST",,"6000  >  50832 [FIN, ACK] Seq=1 Ack=29 Win=65152 Len=0 TSval=3616112344 TSecr=1071904886"
145,72.742293,192.168.11.48,192.168.11.47,TCP,66,0.000041,,0.000041,"Jan  6, 2024 19:37:27.897136000 JST",,50832  >  6000 [ACK] Seq=29 Ack=2 Win=64256 Len=0 TSval=1071904898 TSecr=3616112344
146,72.770093,192.168.11.48,255.255.255.255,UDP,209,,Åü,0.0278,"Jan  6, 2024 19:37:27.924936000 JST",7b2273656d616e74696373223a207b22656e74697479223a2022504944222c202262617365656e74697479223a2022616e79222c2022726f6c65223a2022303038222c20227370617469616c223a2022616e79222c202274656d706f72616c223a2022616e79227d2c20226461746170726f7065727479223a207b22666f726d6174223a2022696e616f6b615f70726f6772616d5f73616d706c655f73656d616e746963227d7d,60849  >  7000 Len=167
147,72.778556,192.168.11.14,192.168.11.48,TCP,74,,Åú,0.008463,"Jan  6, 2024 19:37:27.933399000 JST",,39032  >  6000 [SYN] Seq=0 Win=64240 Len=0 MSS=1460 SACK_PERM TSval=3840561077 TSecr=0 WS=128
148,72.778688,192.168.11.48,192.168.11.14,TCP,74,0.000132,,0.000132,"Jan  6, 2024 19:37:27.933531000 JST",,"6000  >  39032 [SYN, ACK] Seq=0 Ack=1 Win=65160 Len=0 MSS=1460 SACK_PERM TSval=853772766 TSecr=3840561077 WS=128"
149,72.785567,192.168.11.14,192.168.11.48,TCP,66,0.006879,,0.006879,"Jan  6, 2024 19:37:27.940410000 JST",,39032  >  6000 [ACK] Seq=1 Ack=1 Win=64256 Len=0 TSval=3840561084 TSecr=853772766
150,72.78616,192.168.11.14,192.168.11.48,TCP,93,,,0.000593,"Jan  6, 2024 19:37:27.941003000 JST",,"39032  >  6000 [PSH, ACK] Seq=1 Ack=1 Win=64256 Len=27 TSval=3840561084 TSecr=853772766 [TCP segment of a reassembled PDU]"
151,72.786261,192.168.11.48,192.168.11.14,TCP,66,0.000101,,0.000101,"Jan  6, 2024 19:37:27.941104000 JST",,6000  >  39032 [ACK] Seq=1 Ack=28 Win=65152 Len=0 TSval=853772774 TSecr=3840561084
152,72.786331,192.168.11.14,192.168.11.48,TCP,66,,,0.00007,"Jan  6, 2024 19:37:27.941174000 JST",,"39032  >  6000 [FIN, ACK] Seq=28 Ack=1 Win=64256 Len=0 TSval=3840561085 TSecr=853772766"
153,72.787823,192.168.11.48,192.168.11.14,TCP,66,0.001492,,0.001492,"Jan  6, 2024 19:37:27.942666000 JST",,"6000  >  39032 [FIN, ACK] Seq=1 Ack=29 Win=65152 Len=0 TSval=853772775 TSecr=3840561085"
154,72.79291,192.168.11.14,192.168.11.48,TCP,66,0.005087,,0.005087,"Jan  6, 2024 19:37:27.947753000 JST",,39032  >  6000 [ACK] Seq=29 Ack=2 Win=64256 Len=0 TSval=3840561092 TSecr=853772775
155,81.602585,192.168.11.48,192.168.11.47,TCP,74,,,8.809675,"Jan  6, 2024 19:37:36.757428000 JST",,33126  >  6000 [SYN] Seq=0 Win=64240 Len=0 MSS=1460 SACK_PERM TSval=1071913758 TSecr=0 WS=128
156,81.609305,192.168.11.47,192.168.11.48,TCP,74,0.00672,,0.00672,"Jan  6, 2024 19:37:36.764148000 JST",,"6000  >  33126 [SYN, ACK] Seq=0 Ack=1 Win=65160 Len=0 MSS=1460 SACK_PERM TSval=3616121211 TSecr=1071913758 WS=128"
157,81.609411,192.168.11.48,192.168.11.47,TCP,66,0.000106,,0.000106,"Jan  6, 2024 19:37:36.764254000 JST",,33126  >  6000 [ACK] Seq=1 Ack=1 Win=64256 Len=0 TSval=1071913765 TSecr=3616121211
158,81.609571,192.168.11.48,192.168.11.47,TCP,93,,,0.00016,"Jan  6, 2024 19:37:36.764414000 JST",,"33126  >  6000 [PSH, ACK] Seq=1 Ack=1 Win=64256 Len=27 TSval=1071913765 TSecr=3616121211 [TCP segment of a reassembled PDU]"
159,81.60966,192.168.11.48,192.168.11.47,TCP,66,,,0.000089,"Jan  6, 2024 19:37:36.764503000 JST",,"33126  >  6000 [FIN, ACK] Seq=28 Ack=1 Win=64256 Len=0 TSval=1071913765 TSecr=3616121211"
160,81.629077,192.168.11.48,192.168.11.47,TCP,66,,,0.019417,"Jan  6, 2024 19:37:36.783920000 JST",,"[TCP Retransmission] 33126  >  6000 [FIN, ACK] Seq=28 Ack=1 Win=64256 Len=0 TSval=1071913785 TSecr=3616121211"
161,81.631298,192.168.11.47,192.168.11.48,TCP,66,0.021727,,0.002221,"Jan  6, 2024 19:37:36.786141000 JST",,6000  >  33126 [ACK] Seq=1 Ack=28 Win=65152 Len=0 TSval=3616121218 TSecr=1071913765
162,81.631665,192.168.11.47,192.168.11.48,TCP,66,0.022005,,0.000367,"Jan  6, 2024 19:37:36.786508000 JST",,"6000  >  33126 [FIN, ACK] Seq=1 Ack=29 Win=65152 Len=0 TSval=3616121220 TSecr=1071913765"
163,81.631717,192.168.11.48,192.168.11.47,TCP,66,0.000052,,0.000052,"Jan  6, 2024 19:37:36.786560000 JST",,33126  >  6000 [ACK] Seq=29 Ack=2 Win=64256 Len=0 TSval=1071913787 TSecr=3616121220
164,81.637102,192.168.11.47,192.168.11.48,TCP,78,,,0.005385,"Jan  6, 2024 19:37:36.791945000 JST",,[TCP Dup ACK 162#1] 6000  >  33126 [ACK] Seq=2 Ack=29 Win=65152 Len=0 TSval=3616121236 TSecr=1071913785 SLE=28 SRE=29
165,81.659779,192.168.11.48,255.255.255.255,UDP,209,,Åü,0.022677,"Jan  6, 2024 19:37:36.814622000 JST",7b2273656d616e74696373223a207b22656e74697479223a2022504944222c202262617365656e74697479223a2022616e79222c2022726f6c65223a2022303038222c20227370617469616c223a2022616e79222c202274656d706f72616c223a2022616e79227d2c20226461746170726f7065727479223a207b22666f726d6174223a2022696e616f6b615f70726f6772616d5f73616d706c655f73656d616e746963227d7d,51640  >  7000 Len=167
166,81.668726,192.168.11.14,192.168.11.48,TCP,74,,Åú,0.008947,"Jan  6, 2024 19:37:36.823569000 JST",,46678  >  6000 [SYN] Seq=0 Win=64240 Len=0 MSS=1460 SACK_PERM TSval=3840569967 TSecr=0 WS=128
167,81.668845,192.168.11.48,192.168.11.14,TCP,74,0.000119,,0.000119,"Jan  6, 2024 19:37:36.823688000 JST",,"6000  >  46678 [SYN, ACK] Seq=0 Ack=1 Win=65160 Len=0 MSS=1460 SACK_PERM TSval=853781656 TSecr=3840569967 WS=128"
168,81.67969,192.168.11.14,192.168.11.48,TCP,66,0.010845,,0.010845,"Jan  6, 2024 19:37:36.834533000 JST",,46678  >  6000 [ACK] Seq=1 Ack=1 Win=64256 Len=0 TSval=3840569975 TSecr=853781656
169,81.680421,192.168.11.14,192.168.11.48,TCP,93,,,0.000731,"Jan  6, 2024 19:37:36.835264000 JST",,"46678  >  6000 [PSH, ACK] Seq=1 Ack=1 Win=64256 Len=27 TSval=3840569976 TSecr=853781656 [TCP segment of a reassembled PDU]"
170,81.680525,192.168.11.48,192.168.11.14,TCP,66,0.000104,,0.000104,"Jan  6, 2024 19:37:36.835368000 JST",,6000  >  46678 [ACK] Seq=1 Ack=28 Win=65152 Len=0 TSval=853781668 TSecr=3840569976
171,81.680588,192.168.11.14,192.168.11.48,TCP,66,,,0.000063,"Jan  6, 2024 19:37:36.835431000 JST",,"46678  >  6000 [FIN, ACK] Seq=28 Ack=1 Win=64256 Len=0 TSval=3840569976 TSecr=853781656"
172,81.681736,192.168.11.48,192.168.11.14,TCP,66,0.001148,,0.001148,"Jan  6, 2024 19:37:36.836579000 JST",,"6000  >  46678 [FIN, ACK] Seq=1 Ack=29 Win=65152 Len=0 TSval=853781669 TSecr=3840569976"
173,81.694758,192.168.11.14,192.168.11.48,TCP,66,0.013022,,0.013022,"Jan  6, 2024 19:37:36.849601000 JST",,46678  >  6000 [ACK] Seq=29 Ack=2 Win=64256 Len=0 TSval=3840569993 TSecr=853781669
174,112.790545,192.168.11.48,192.168.11.47,TCP,74,,,31.095787,"Jan  6, 2024 19:38:07.945388000 JST",,50788  >  6000 [SYN] Seq=0 Win=64240 Len=0 MSS=1460 SACK_PERM TSval=1071944946 TSecr=0 WS=128
175,112.79731,192.168.11.47,192.168.11.48,TCP,74,0.006765,,0.006765,"Jan  6, 2024 19:38:07.952153000 JST",,"6000  >  50788 [SYN, ACK] Seq=0 Ack=1 Win=65160 Len=0 MSS=1460 SACK_PERM TSval=3616152398 TSecr=1071944946 WS=128"
176,112.797407,192.168.11.48,192.168.11.47,TCP,66,0.000097,,0.000097,"Jan  6, 2024 19:38:07.952250000 JST",,50788  >  6000 [ACK] Seq=1 Ack=1 Win=64256 Len=0 TSval=1071944953 TSecr=3616152398
177,112.797547,192.168.11.48,192.168.11.47,TCP,93,,,0.00014,"Jan  6, 2024 19:38:07.952390000 JST",,"50788  >  6000 [PSH, ACK] Seq=1 Ack=1 Win=64256 Len=27 TSval=1071944953 TSecr=3616152398 [TCP segment of a reassembled PDU]"
178,112.797668,192.168.11.48,192.168.11.47,TCP,66,,,0.000121,"Jan  6, 2024 19:38:07.952511000 JST",,"50788  >  6000 [FIN, ACK] Seq=28 Ack=1 Win=64256 Len=0 TSval=1071944953 TSecr=3616152398"
179,112.811437,192.168.11.47,192.168.11.48,TCP,66,0.01389,,0.013769,"Jan  6, 2024 19:38:07.966280000 JST",,6000  >  50788 [ACK] Seq=1 Ack=28 Win=65152 Len=0 TSval=3616152413 TSecr=1071944953
180,112.811893,192.168.11.47,192.168.11.48,TCP,66,0.014225,,0.000456,"Jan  6, 2024 19:38:07.966736000 JST",,"6000  >  50788 [FIN, ACK] Seq=1 Ack=29 Win=65152 Len=0 TSval=3616152413 TSecr=1071944953"
181,112.811976,192.168.11.48,192.168.11.47,TCP,66,0.000083,,0.000083,"Jan  6, 2024 19:38:07.966819000 JST",,50788  >  6000 [ACK] Seq=29 Ack=2 Win=64256 Len=0 TSval=1071944967 TSecr=3616152413
182,112.84256,192.168.11.48,255.255.255.255,UDP,209,,Åü,0.030584,"Jan  6, 2024 19:38:07.997403000 JST",7b2273656d616e74696373223a207b22656e74697479223a2022504944222c202262617365656e74697479223a2022616e79222c2022726f6c65223a2022303038222c20227370617469616c223a2022616e79222c202274656d706f72616c223a2022616e79227d2c20226461746170726f7065727479223a207b22666f726d6174223a2022696e616f6b615f70726f6772616d5f73616d706c655f73656d616e746963227d7d,53472  >  7000 Len=167
183,112.850872,192.168.11.14,192.168.11.48,TCP,74,,Åú,0.008312,"Jan  6, 2024 19:38:08.005715000 JST",,51912  >  6000 [SYN] Seq=0 Win=64240 Len=0 MSS=1460 SACK_PERM TSval=3840601150 TSecr=0 WS=128
184,112.851005,192.168.11.48,192.168.11.14,TCP,74,0.000133,,0.000133,"Jan  6, 2024 19:38:08.005848000 JST",,"6000  >  51912 [SYN, ACK] Seq=0 Ack=1 Win=65160 Len=0 MSS=1460 SACK_PERM TSval=853812838 TSecr=3840601150 WS=128"
