No.,Time,Source,Destination,Protocol,Length,The RTT to ACK the segment was,XXX,Time delta from previous captured frame,Arrival Time,Data,Info
1,0,192.168.11.14,192.168.11.48,TCP,74,,,0,"Jan  6, 2024 19:36:15.216965000 JST",,32990  >  6000 [SYN] Seq=0 Win=64240 Len=0 MSS=1460 SACK_PERM TSval=3840488356 TSecr=0 WS=128
2,0.013928,192.168.11.48,192.168.11.14,TCP,74,0.013928,,0.013928,"Jan  6, 2024 19:36:15.230893000 JST",,"6000  >  32990 [SYN, ACK] Seq=0 Ack=1 Win=65160 Len=0 MSS=1460 SACK_PERM TSval=853700056 TSecr=3840488356 WS=128"
3,0.014075,192.168.11.14,192.168.11.48,TCP,66,0.000147,,0.000147,"Jan  6, 2024 19:36:15.231040000 JST",,32990  >  6000 [ACK] Seq=1 Ack=1 Win=64256 Len=0 TSval=3840488375 TSecr=853700056
4,0.014385,192.168.11.14,192.168.11.48,TCP,93,,,0.00031,"Jan  6, 2024 19:36:15.231350000 JST",,"32990  >  6000 [PSH, ACK] Seq=1 Ack=1 Win=64256 Len=27 TSval=3840488375 TSecr=853700056 [TCP segment of a reassembled PDU]"
5,0.014575,192.168.11.14,192.168.11.48,TCP,66,,,0.00019,"Jan  6, 2024 19:36:15.231540000 JST",,"32990  >  6000 [FIN, ACK] Seq=28 Ack=1 Win=64256 Len=0 TSval=3840488375 TSecr=853700056"
6,0.021992,192.168.11.48,192.168.11.14,TCP,66,0.007607,,0.007417,"Jan  6, 2024 19:36:15.238957000 JST",,6000  >  32990 [ACK] Seq=1 Ack=28 Win=65152 Len=0 TSval=853700065 TSecr=3840488375
7,0.02245,192.168.11.48,192.168.11.14,TCP,66,0.007875,,0.000458,"Jan  6, 2024 19:36:15.239415000 JST",,"6000  >  32990 [FIN, ACK] Seq=1 Ack=29 Win=65152 Len=0 TSval=853700066 TSecr=3840488375"
8,0.022502,192.168.11.14,192.168.11.48,TCP,66,0.000052,,0.000052,"Jan  6, 2024 19:36:15.239467000 JST",,32990  >  6000 [ACK] Seq=29 Ack=2 Win=64256 Len=0 TSval=3840488383 TSecr=853700066
9,0.053161,192.168.11.14,255.255.255.255,UDP,209,,Ÿ,0.030659,"Jan  6, 2024 19:36:15.270126000 JST",7b2273656d616e74696373223a207b22656e74697479223a2022504944222c202262617365656e74697479223a2022616e79222c2022726f6c65223a2022303039222c20227370617469616c223a2022616e79222c202274656d706f72616c223a2022616e79227d2c20226461746170726f7065727479223a207b22666f726d6174223a2022696e616f6b615f70726f6772616d5f73616d706c655f73656d616e746963227d7d,37825  >  7000 Len=167
10,0.067402,192.168.11.49,192.168.11.14,TCP,74,,œ,0.014241,"Jan  6, 2024 19:36:15.284367000 JST",,60338  >  6000 [SYN] Seq=0 Win=64240 Len=0 MSS=1460 SACK_PERM TSval=1691440745 TSecr=0 WS=128
11,0.067561,192.168.11.14,192.168.11.49,TCP,74,0.000159,,0.000159,"Jan  6, 2024 19:36:15.284526000 JST",,"6000  >  60338 [SYN, ACK] Seq=0 Ack=1 Win=65160 Len=0 MSS=1460 SACK_PERM TSval=1954175839 TSecr=1691440745 WS=128"
12,0.074437,192.168.11.49,192.168.11.14,TCP,66,0.006876,,0.006876,"Jan  6, 2024 19:36:15.291402000 JST",,60338  >  6000 [ACK] Seq=1 Ack=1 Win=64256 Len=0 TSval=1691440758 TSecr=1954175839
13,0.075066,192.168.11.49,192.168.11.14,TCP,93,,,0.000629,"Jan  6, 2024 19:36:15.292031000 JST",,"60338  >  6000 [PSH, ACK] Seq=1 Ack=1 Win=64256 Len=27 TSval=1691440758 TSecr=1954175839 [TCP segment of a reassembled PDU]"
14,0.075179,192.168.11.14,192.168.11.49,TCP,66,0.000113,,0.000113,"Jan  6, 2024 19:36:15.292144000 JST",,6000  >  60338 [ACK] Seq=1 Ack=28 Win=65152 Len=0 TSval=1954175847 TSecr=1691440758
15,0.075244,192.168.11.49,192.168.11.14,TCP,66,,,0.000065,"Jan  6, 2024 19:36:15.292209000 JST",,"60338  >  6000 [FIN, ACK] Seq=28 Ack=1 Win=64256 Len=0 TSval=1691440758 TSecr=1954175839"
16,0.076667,192.168.11.14,192.168.11.49,TCP,66,0.001423,,0.001423,"Jan  6, 2024 19:36:15.293632000 JST",,"6000  >  60338 [FIN, ACK] Seq=1 Ack=29 Win=65152 Len=0 TSval=1954175848 TSecr=1691440758"
17,0.081714,192.168.11.49,192.168.11.14,TCP,66,0.005047,,0.005047,"Jan  6, 2024 19:36:15.298679000 JST",,60338  >  6000 [ACK] Seq=29 Ack=2 Win=64256 Len=0 TSval=1691440766 TSecr=1954175848
18,8.211165,192.168.11.14,192.168.11.48,TCP,74,,,8.129451,"Jan  6, 2024 19:36:23.428130000 JST",,34900  >  6000 [SYN] Seq=0 Win=64240 Len=0 MSS=1460 SACK_PERM TSval=3840496572 TSecr=0 WS=128
19,8.223485,192.168.11.48,192.168.11.14,TCP,74,0.01232,,0.01232,"Jan  6, 2024 19:36:23.440450000 JST",,"6000  >  34900 [SYN, ACK] Seq=0 Ack=1 Win=65160 Len=0 MSS=1460 SACK_PERM TSval=853708262 TSecr=3840496572 WS=128"
20,8.223596,192.168.11.14,192.168.11.48,TCP,66,0.000111,,0.000111,"Jan  6, 2024 19:36:23.440561000 JST",,34900  >  6000 [ACK] Seq=1 Ack=1 Win=64256 Len=0 TSval=3840496585 TSecr=853708262
21,8.223789,192.168.11.14,192.168.11.48,TCP,93,,,0.000193,"Jan  6, 2024 19:36:23.440754000 JST",,"34900  >  6000 [PSH, ACK] Seq=1 Ack=1 Win=64256 Len=27 TSval=3840496585 TSecr=853708262 [TCP segment of a reassembled PDU]"
22,8.223922,192.168.11.14,192.168.11.48,TCP,66,,,0.000133,"Jan  6, 2024 19:36:23.440887000 JST",,"34900  >  6000 [FIN, ACK] Seq=28 Ack=1 Win=64256 Len=0 TSval=3840496585 TSecr=853708262"
23,8.231589,192.168.11.48,192.168.11.14,TCP,66,0.0078,,0.007667,"Jan  6, 2024 19:36:23.448554000 JST",,6000  >  34900 [ACK] Seq=1 Ack=28 Win=65152 Len=0 TSval=853708274 TSecr=3840496585
24,8.232016,192.168.11.48,192.168.11.14,TCP,66,0.008094,,0.000427,"Jan  6, 2024 19:36:23.448981000 JST",,"6000  >  34900 [FIN, ACK] Seq=1 Ack=29 Win=65152 Len=0 TSval=853708276 TSecr=3840496585"
25,8.232063,192.168.11.14,192.168.11.48,TCP,66,0.000047,,0.000047,"Jan  6, 2024 19:36:23.449028000 JST",,34900  >  6000 [ACK] Seq=29 Ack=2 Win=64256 Len=0 TSval=3840496593 TSecr=853708276
26,8.263832,192.168.11.14,255.255.255.255,UDP,209,,Ÿ,0.031769,"Jan  6, 2024 19:36:23.480797000 JST",7b2273656d616e74696373223a207b22656e74697479223a2022504944222c202262617365656e74697479223a2022616e79222c2022726f6c65223a2022303039222c20227370617469616c223a2022616e79222c202274656d706f72616c223a2022616e79227d2c20226461746170726f7065727479223a207b22666f726d6174223a2022696e616f6b615f70726f6772616d5f73616d706c655f73656d616e746963227d7d,36279  >  7000 Len=167
27,8.272505,192.168.11.49,192.168.11.14,TCP,74,,œ,0.008673,"Jan  6, 2024 19:36:23.489470000 JST",,40876  >  6000 [SYN] Seq=0 Win=64240 Len=0 MSS=1460 SACK_PERM TSval=1691448955 TSecr=0 WS=128
28,8.272643,192.168.11.14,192.168.11.49,TCP,74,0.000138,,0.000138,"Jan  6, 2024 19:36:23.489608000 JST",,"6000  >  40876 [SYN, ACK] Seq=0 Ack=1 Win=65160 Len=0 MSS=1460 SACK_PERM TSval=1954184045 TSecr=1691448955 WS=128"
29,8.280205,192.168.11.49,192.168.11.14,TCP,66,0.007562,,0.007562,"Jan  6, 2024 19:36:23.497170000 JST",,40876  >  6000 [ACK] Seq=1 Ack=1 Win=64256 Len=0 TSval=1691448963 TSecr=1954184045
30,8.280704,192.168.11.49,192.168.11.14,TCP,93,,,0.000499,"Jan  6, 2024 19:36:23.497669000 JST",,"40876  >  6000 [PSH, ACK] Seq=1 Ack=1 Win=64256 Len=27 TSval=1691448963 TSecr=1954184045 [TCP segment of a reassembled PDU]"
31,8.280773,192.168.11.14,192.168.11.49,TCP,66,0.000069,,0.000069,"Jan  6, 2024 19:36:23.497738000 JST",,6000  >  40876 [ACK] Seq=1 Ack=28 Win=65152 Len=0 TSval=1954184053 TSecr=1691448963
32,8.280841,192.168.11.49,192.168.11.14,TCP,66,,,0.000068,"Jan  6, 2024 19:36:23.497806000 JST",,"40876  >  6000 [FIN, ACK] Seq=28 Ack=1 Win=64256 Len=0 TSval=1691448964 TSecr=1954184045"
33,8.281932,192.168.11.14,192.168.11.49,TCP,66,0.001091,,0.001091,"Jan  6, 2024 19:36:23.498897000 JST",,"6000  >  40876 [FIN, ACK] Seq=1 Ack=29 Win=65152 Len=0 TSval=1954184054 TSecr=1691448964"
34,8.291382,192.168.11.49,192.168.11.14,TCP,66,0.00945,,0.00945,"Jan  6, 2024 19:36:23.508347000 JST",,40876  >  6000 [ACK] Seq=29 Ack=2 Win=64256 Len=0 TSval=1691448971 TSecr=1954184054
35,19.090368,192.168.11.14,192.168.11.48,TCP,74,,,10.798986,"Jan  6, 2024 19:36:34.307333000 JST",,57008  >  6000 [SYN] Seq=0 Win=64240 Len=0 MSS=1460 SACK_PERM TSval=3840507451 TSecr=0 WS=128
36,19.097309,192.168.11.48,192.168.11.14,TCP,74,0.006941,,0.006941,"Jan  6, 2024 19:36:34.314274000 JST",,"6000  >  57008 [SYN, ACK] Seq=0 Ack=1 Win=65160 Len=0 MSS=1460 SACK_PERM TSval=853719140 TSecr=3840507451 WS=128"
37,19.097432,192.168.11.14,192.168.11.48,TCP,66,0.000123,,0.000123,"Jan  6, 2024 19:36:34.314397000 JST",,57008  >  6000 [ACK] Seq=1 Ack=1 Win=64256 Len=0 TSval=3840507458 TSecr=853719140
38,19.09772,192.168.11.14,192.168.11.48,TCP,93,,,0.000288,"Jan  6, 2024 19:36:34.314685000 JST",,"57008  >  6000 [PSH, ACK] Seq=1 Ack=1 Win=64256 Len=27 TSval=3840507459 TSecr=853719140 [TCP segment of a reassembled PDU]"
39,19.097867,192.168.11.14,192.168.11.48,TCP,66,,,0.000147,"Jan  6, 2024 19:36:34.314832000 JST",,"57008  >  6000 [FIN, ACK] Seq=28 Ack=1 Win=64256 Len=0 TSval=3840507459 TSecr=853719140"
40,19.105334,192.168.11.48,192.168.11.14,TCP,66,0.007614,,0.007467,"Jan  6, 2024 19:36:34.322299000 JST",,6000  >  57008 [ACK] Seq=1 Ack=28 Win=65152 Len=0 TSval=853719148 TSecr=3840507459
41,19.105601,192.168.11.48,192.168.11.14,TCP,66,0.007734,,0.000267,"Jan  6, 2024 19:36:34.322566000 JST",,"6000  >  57008 [FIN, ACK] Seq=1 Ack=29 Win=65152 Len=0 TSval=853719150 TSecr=3840507459"
42,19.105646,192.168.11.14,192.168.11.48,TCP,66,0.000045,,0.000045,"Jan  6, 2024 19:36:34.322611000 JST",,57008  >  6000 [ACK] Seq=29 Ack=2 Win=64256 Len=0 TSval=3840507467 TSecr=853719150
43,19.139922,192.168.11.14,255.255.255.255,UDP,209,,Ÿ,0.034276,"Jan  6, 2024 19:36:34.356887000 JST",7b2273656d616e74696373223a207b22656e74697479223a2022504944222c202262617365656e74697479223a2022616e79222c2022726f6c65223a2022303039222c20227370617469616c223a2022616e79222c202274656d706f72616c223a2022616e79227d2c20226461746170726f7065727479223a207b22666f726d6174223a2022696e616f6b615f70726f6772616d5f73616d706c655f73656d616e746963227d7d,41281  >  7000 Len=167
44,19.148425,192.168.11.49,192.168.11.14,TCP,74,,œ,0.008503,"Jan  6, 2024 19:36:34.365390000 JST",,44824  >  6000 [SYN] Seq=0 Win=64240 Len=0 MSS=1460 SACK_PERM TSval=1691459831 TSecr=0 WS=128
45,19.148572,192.168.11.14,192.168.11.49,TCP,74,0.000147,,0.000147,"Jan  6, 2024 19:36:34.365537000 JST",,"6000  >  44824 [SYN, ACK] Seq=0 Ack=1 Win=65160 Len=0 MSS=1460 SACK_PERM TSval=1954194920 TSecr=1691459831 WS=128"
46,19.157568,192.168.11.49,192.168.11.14,TCP,66,0.008996,,0.008996,"Jan  6, 2024 19:36:34.374533000 JST",,44824  >  6000 [ACK] Seq=1 Ack=1 Win=64256 Len=0 TSval=1691459838 TSecr=1954194920
47,19.15809,192.168.11.49,192.168.11.14,TCP,93,,,0.000522,"Jan  6, 2024 19:36:34.375055000 JST",,"44824  >  6000 [PSH, ACK] Seq=1 Ack=1 Win=64256 Len=27 TSval=1691459839 TSecr=1954194920 [TCP segment of a reassembled PDU]"
48,19.158159,192.168.11.14,192.168.11.49,TCP,66,0.000069,,0.000069,"Jan  6, 2024 19:36:34.375124000 JST",,6000  >  44824 [ACK] Seq=1 Ack=28 Win=65152 Len=0 TSval=1954194930 TSecr=1691459839
49,19.158225,192.168.11.49,192.168.11.14,TCP,66,,,0.000066,"Jan  6, 2024 19:36:34.375190000 JST",,"44824  >  6000 [FIN, ACK] Seq=28 Ack=1 Win=64256 Len=0 TSval=1691459839 TSecr=1954194920"
50,19.159606,192.168.11.14,192.168.11.49,TCP,66,0.001381,,0.001381,"Jan  6, 2024 19:36:34.376571000 JST",,"6000  >  44824 [FIN, ACK] Seq=1 Ack=29 Win=65152 Len=0 TSval=1954194932 TSecr=1691459839"
51,19.165743,192.168.11.49,192.168.11.14,TCP,66,0.006137,,0.006137,"Jan  6, 2024 19:36:34.382708000 JST",,44824  >  6000 [ACK] Seq=29 Ack=2 Win=64256 Len=0 TSval=1691459848 TSecr=1954194932
52,27.965818,192.168.11.14,192.168.11.48,TCP,74,,,8.800075,"Jan  6, 2024 19:36:43.182783000 JST",,41658  >  6000 [SYN] Seq=0 Win=64240 Len=0 MSS=1460 SACK_PERM TSval=3840516327 TSecr=0 WS=128
53,27.972761,192.168.11.48,192.168.11.14,TCP,74,0.006943,,0.006943,"Jan  6, 2024 19:36:43.189726000 JST",,"6000  >  41658 [SYN, ACK] Seq=0 Ack=1 Win=65160 Len=0 MSS=1460 SACK_PERM TSval=853728016 TSecr=3840516327 WS=128"
54,27.972881,192.168.11.14,192.168.11.48,TCP,66,0.00012,,0.00012,"Jan  6, 2024 19:36:43.189846000 JST",,41658  >  6000 [ACK] Seq=1 Ack=1 Win=64256 Len=0 TSval=3840516334 TSecr=853728016
55,27.973058,192.168.11.14,192.168.11.48,TCP,93,,,0.000177,"Jan  6, 2024 19:36:43.190023000 JST",,"41658  >  6000 [PSH, ACK] Seq=1 Ack=1 Win=64256 Len=27 TSval=3840516334 TSecr=853728016 [TCP segment of a reassembled PDU]"
56,27.973167,192.168.11.14,192.168.11.48,TCP,66,,,0.000109,"Jan  6, 2024 19:36:43.190132000 JST",,"41658  >  6000 [FIN, ACK] Seq=28 Ack=1 Win=64256 Len=0 TSval=3840516334 TSecr=853728016"
57,27.981069,192.168.11.48,192.168.11.14,TCP,66,0.008011,,0.007902,"Jan  6, 2024 19:36:43.198034000 JST",,6000  >  41658 [ACK] Seq=1 Ack=28 Win=65152 Len=0 TSval=853728024 TSecr=3840516334
58,27.981344,192.168.11.48,192.168.11.14,TCP,66,0.008177,,0.000275,"Jan  6, 2024 19:36:43.198309000 JST",,"6000  >  41658 [FIN, ACK] Seq=1 Ack=29 Win=65152 Len=0 TSval=853728026 TSecr=3840516334"
59,27.98139,192.168.11.14,192.168.11.48,TCP,66,0.000046,,0.000046,"Jan  6, 2024 19:36:43.198355000 JST",,41658  >  6000 [ACK] Seq=29 Ack=2 Win=64256 Len=0 TSval=3840516342 TSecr=853728026
60,28.01391,192.168.11.14,255.255.255.255,UDP,209,,Ÿ,0.03252,"Jan  6, 2024 19:36:43.230875000 JST",7b2273656d616e74696373223a207b22656e74697479223a2022504944222c202262617365656e74697479223a2022616e79222c2022726f6c65223a2022303039222c20227370617469616c223a2022616e79222c202274656d706f72616c223a2022616e79227d2c20226461746170726f7065727479223a207b22666f726d6174223a2022696e616f6b615f70726f6772616d5f73616d706c655f73656d616e746963227d7d,57645  >  7000 Len=167
61,28.022888,192.168.11.49,192.168.11.14,TCP,74,,œ,0.008978,"Jan  6, 2024 19:36:43.239853000 JST",,48962  >  6000 [SYN] Seq=0 Win=64240 Len=0 MSS=1460 SACK_PERM TSval=1691468705 TSecr=0 WS=128
62,28.023045,192.168.11.14,192.168.11.49,TCP,74,0.000157,,0.000157,"Jan  6, 2024 19:36:43.240010000 JST",,"6000  >  48962 [SYN, ACK] Seq=0 Ack=1 Win=65160 Len=0 MSS=1460 SACK_PERM TSval=1954203795 TSecr=1691468705 WS=128"
63,28.039388,192.168.11.49,192.168.11.14,TCP,66,0.016343,,0.016343,"Jan  6, 2024 19:36:43.256353000 JST",,48962  >  6000 [ACK] Seq=1 Ack=1 Win=64256 Len=0 TSval=1691468713 TSecr=1954203795
64,28.040142,192.168.11.49,192.168.11.14,TCP,93,,,0.000754,"Jan  6, 2024 19:36:43.257107000 JST",,"48962  >  6000 [PSH, ACK] Seq=1 Ack=1 Win=64256 Len=27 TSval=1691468713 TSecr=1954203795 [TCP segment of a reassembled PDU]"
65,28.040292,192.168.11.14,192.168.11.49,TCP,66,0.00015,,0.00015,"Jan  6, 2024 19:36:43.257257000 JST",,6000  >  48962 [ACK] Seq=1 Ack=28 Win=65152 Len=0 TSval=1954203812 TSecr=1691468713
66,28.040373,192.168.11.49,192.168.11.14,TCP,66,,,0.000081,"Jan  6, 2024 19:36:43.257338000 JST",,"48962  >  6000 [FIN, ACK] Seq=28 Ack=1 Win=64256 Len=0 TSval=1691468714 TSecr=1954203795"
67,28.041608,192.168.11.14,192.168.11.49,TCP,66,0.001235,,0.001235,"Jan  6, 2024 19:36:43.258573000 JST",,"6000  >  48962 [FIN, ACK] Seq=1 Ack=29 Win=65152 Len=0 TSval=1954203814 TSecr=1691468714"
68,28.047521,192.168.11.49,192.168.11.14,TCP,66,0.005913,,0.005913,"Jan  6, 2024 19:36:43.264486000 JST",,48962  >  6000 [ACK] Seq=29 Ack=2 Win=64256 Len=0 TSval=1691468731 TSecr=1954203814
69,35.770263,192.168.11.14,192.168.11.48,TCP,74,,,7.722742,"Jan  6, 2024 19:36:50.987228000 JST",,47882  >  6000 [SYN] Seq=0 Win=64240 Len=0 MSS=1460 SACK_PERM TSval=3840524131 TSecr=0 WS=128
70,35.776794,192.168.11.48,192.168.11.14,TCP,74,0.006531,,0.006531,"Jan  6, 2024 19:36:50.993759000 JST",,"6000  >  47882 [SYN, ACK] Seq=0 Ack=1 Win=65160 Len=0 MSS=1460 SACK_PERM TSval=853735820 TSecr=3840524131 WS=128"
71,35.776917,192.168.11.14,192.168.11.48,TCP,66,0.000123,,0.000123,"Jan  6, 2024 19:36:50.993882000 JST",,47882  >  6000 [ACK] Seq=1 Ack=1 Win=64256 Len=0 TSval=3840524138 TSecr=853735820
72,35.777063,192.168.11.14,192.168.11.48,TCP,93,,,0.000146,"Jan  6, 2024 19:36:50.994028000 JST",,"47882  >  6000 [PSH, ACK] Seq=1 Ack=1 Win=64256 Len=27 TSval=3840524138 TSecr=853735820 [TCP segment of a reassembled PDU]"
73,35.777175,192.168.11.14,192.168.11.48,TCP,66,,,0.000112,"Jan  6, 2024 19:36:50.994140000 JST",,"47882  >  6000 [FIN, ACK] Seq=28 Ack=1 Win=64256 Len=0 TSval=3840524138 TSecr=853735820"
74,35.784049,192.168.11.48,192.168.11.14,TCP,66,0.006986,,0.006874,"Jan  6, 2024 19:36:51.001014000 JST",,6000  >  47882 [ACK] Seq=1 Ack=28 Win=65152 Len=0 TSval=853735827 TSecr=3840524138
75,35.784466,192.168.11.48,192.168.11.14,TCP,66,0.007291,,0.000417,"Jan  6, 2024 19:36:51.001431000 JST",,"6000  >  47882 [FIN, ACK] Seq=1 Ack=29 Win=65152 Len=0 TSval=853735828 TSecr=3840524138"
76,35.784521,192.168.11.14,192.168.11.48,TCP,66,0.000055,,0.000055,"Jan  6, 2024 19:36:51.001486000 JST",,47882  >  6000 [ACK] Seq=29 Ack=2 Win=64256 Len=0 TSval=3840524145 TSecr=853735828
77,35.818875,192.168.11.14,255.255.255.255,UDP,209,,Ÿ,0.034354,"Jan  6, 2024 19:36:51.035840000 JST",7b2273656d616e74696373223a207b22656e74697479223a2022504944222c202262617365656e74697479223a2022616e79222c2022726f6c65223a2022303039222c20227370617469616c223a2022616e79222c202274656d706f72616c223a2022616e79227d2c20226461746170726f7065727479223a207b22666f726d6174223a2022696e616f6b615f70726f6772616d5f73616d706c655f73656d616e746963227d7d,57067  >  7000 Len=167
78,35.835326,192.168.11.49,192.168.11.14,TCP,74,,œ,0.016451,"Jan  6, 2024 19:36:51.052291000 JST",,41806  >  6000 [SYN] Seq=0 Win=64240 Len=0 MSS=1460 SACK_PERM TSval=1691476510 TSecr=0 WS=128
79,35.835593,192.168.11.14,192.168.11.49,TCP,74,0.000267,,0.000267,"Jan  6, 2024 19:36:51.052558000 JST",,"6000  >  41806 [SYN, ACK] Seq=0 Ack=1 Win=65160 Len=0 MSS=1460 SACK_PERM TSval=1954211607 TSecr=1691476510 WS=128"
80,35.844632,192.168.11.49,192.168.11.14,TCP,66,0.009039,,0.009039,"Jan  6, 2024 19:36:51.061597000 JST",,41806  >  6000 [ACK] Seq=1 Ack=1 Win=64256 Len=0 TSval=1691476528 TSecr=1954211607
81,35.84511,192.168.11.49,192.168.11.14,TCP,93,,,0.000478,"Jan  6, 2024 19:36:51.062075000 JST",,"41806  >  6000 [PSH, ACK] Seq=1 Ack=1 Win=64256 Len=27 TSval=1691476528 TSecr=1954211607 [TCP segment of a reassembled PDU]"
82,35.845175,192.168.11.14,192.168.11.49,TCP,66,0.000065,,0.000065,"Jan  6, 2024 19:36:51.062140000 JST",,6000  >  41806 [ACK] Seq=1 Ack=28 Win=65152 Len=0 TSval=1954211617 TSecr=1691476528
83,35.845229,192.168.11.49,192.168.11.14,TCP,66,,,0.000054,"Jan  6, 2024 19:36:51.062194000 JST",,"41806  >  6000 [FIN, ACK] Seq=28 Ack=1 Win=64256 Len=0 TSval=1691476528 TSecr=1954211607"
84,35.846636,192.168.11.14,192.168.11.49,TCP,66,0.001407,,0.001407,"Jan  6, 2024 19:36:51.063601000 JST",,"6000  >  41806 [FIN, ACK] Seq=1 Ack=29 Win=65152 Len=0 TSval=1954211619 TSecr=1691476528"
85,35.852848,192.168.11.49,192.168.11.14,TCP,66,0.006212,,0.006212,"Jan  6, 2024 19:36:51.069813000 JST",,41806  >  6000 [ACK] Seq=29 Ack=2 Win=64256 Len=0 TSval=1691476536 TSecr=1954211619
86,43.608148,192.168.11.14,192.168.11.48,TCP,74,,,7.7553,"Jan  6, 2024 19:36:58.825113000 JST",,39118  >  6000 [SYN] Seq=0 Win=64240 Len=0 MSS=1460 SACK_PERM TSval=3840531969 TSecr=0 WS=128
87,43.615036,192.168.11.48,192.168.11.14,TCP,74,0.006888,,0.006888,"Jan  6, 2024 19:36:58.832001000 JST",,"6000  >  39118 [SYN, ACK] Seq=0 Ack=1 Win=65160 Len=0 MSS=1460 SACK_PERM TSval=853743658 TSecr=3840531969 WS=128"
88,43.615145,192.168.11.14,192.168.11.48,TCP,66,0.000109,,0.000109,"Jan  6, 2024 19:36:58.832110000 JST",,39118  >  6000 [ACK] Seq=1 Ack=1 Win=64256 Len=0 TSval=3840531976 TSecr=853743658
89,43.615403,192.168.11.14,192.168.11.48,TCP,93,,,0.000258,"Jan  6, 2024 19:36:58.832368000 JST",,"39118  >  6000 [PSH, ACK] Seq=1 Ack=1 Win=64256 Len=27 TSval=3840531976 TSecr=853743658 [TCP segment of a reassembled PDU]"
90,43.615519,192.168.11.14,192.168.11.48,TCP,66,,,0.000116,"Jan  6, 2024 19:36:58.832484000 JST",,"39118  >  6000 [FIN, ACK] Seq=28 Ack=1 Win=64256 Len=0 TSval=3840531976 TSecr=853743658"
91,43.622918,192.168.11.48,192.168.11.14,TCP,66,0.007515,,0.007399,"Jan  6, 2024 19:36:58.839883000 JST",,6000  >  39118 [ACK] Seq=1 Ack=28 Win=65152 Len=0 TSval=853743666 TSecr=3840531976
92,43.623346,192.168.11.48,192.168.11.14,TCP,66,0.007827,,0.000428,"Jan  6, 2024 19:36:58.840311000 JST",,"6000  >  39118 [FIN, ACK] Seq=1 Ack=29 Win=65152 Len=0 TSval=853743667 TSecr=3840531976"
93,43.623406,192.168.11.14,192.168.11.48,TCP,66,0.00006,,0.00006,"Jan  6, 2024 19:36:58.840371000 JST",,39118  >  6000 [ACK] Seq=29 Ack=2 Win=64256 Len=0 TSval=3840531984 TSecr=853743667
94,43.655854,192.168.11.14,255.255.255.255,UDP,209,,Ÿ,0.032448,"Jan  6, 2024 19:36:58.872819000 JST",7b2273656d616e74696373223a207b22656e74697479223a2022504944222c202262617365656e74697479223a2022616e79222c2022726f6c65223a2022303039222c20227370617469616c223a2022616e79222c202274656d706f72616c223a2022616e79227d2c20226461746170726f7065727479223a207b22666f726d6174223a2022696e616f6b615f70726f6772616d5f73616d706c655f73656d616e746963227d7d,48530  >  7000 Len=167
95,43.664239,192.168.11.49,192.168.11.14,TCP,74,,œ,0.008385,"Jan  6, 2024 19:36:58.881204000 JST",,51280  >  6000 [SYN] Seq=0 Win=64240 Len=0 MSS=1460 SACK_PERM TSval=1691484347 TSecr=0 WS=128
96,43.664376,192.168.11.14,192.168.11.49,TCP,74,0.000137,,0.000137,"Jan  6, 2024 19:36:58.881341000 JST",,"6000  >  51280 [SYN, ACK] Seq=0 Ack=1 Win=65160 Len=0 MSS=1460 SACK_PERM TSval=1954219436 TSecr=1691484347 WS=128"
97,43.671124,192.168.11.49,192.168.11.14,TCP,66,0.006748,,0.006748,"Jan  6, 2024 19:36:58.888089000 JST",,51280  >  6000 [ACK] Seq=1 Ack=1 Win=64256 Len=0 TSval=1691484354 TSecr=1954219436
98,43.671617,192.168.11.49,192.168.11.14,TCP,93,,,0.000493,"Jan  6, 2024 19:36:58.888582000 JST",,"51280  >  6000 [PSH, ACK] Seq=1 Ack=1 Win=64256 Len=27 TSval=1691484355 TSecr=1954219436 [TCP segment of a reassembled PDU]"
99,43.671681,192.168.11.14,192.168.11.49,TCP,66,0.000064,,0.000064,"Jan  6, 2024 19:36:58.888646000 JST",,6000  >  51280 [ACK] Seq=1 Ack=28 Win=65152 Len=0 TSval=1954219444 TSecr=1691484355
100,43.671745,192.168.11.49,192.168.11.14,TCP,66,,,0.000064,"Jan  6, 2024 19:36:58.888710000 JST",,"51280  >  6000 [FIN, ACK] Seq=28 Ack=1 Win=64256 Len=0 TSval=1691484355 TSecr=1954219436"
101,43.672875,192.168.11.14,192.168.11.49,TCP,66,0.00113,,0.00113,"Jan  6, 2024 19:36:58.889840000 JST",,"6000  >  51280 [FIN, ACK] Seq=1 Ack=29 Win=65152 Len=0 TSval=1954219445 TSecr=1691484355"
102,43.691474,192.168.11.49,192.168.11.14,TCP,66,0.018599,,0.018599,"Jan  6, 2024 19:36:58.908439000 JST",,51280  >  6000 [ACK] Seq=29 Ack=2 Win=64256 Len=0 TSval=1691484362 TSecr=1954219445
103,51.698149,192.168.11.14,192.168.11.48,TCP,74,,,8.006675,"Jan  6, 2024 19:37:06.915114000 JST",,36886  >  6000 [SYN] Seq=0 Win=64240 Len=0 MSS=1460 SACK_PERM TSval=3840540059 TSecr=0 WS=128
104,51.70519,192.168.11.48,192.168.11.14,TCP,74,0.007041,,0.007041,"Jan  6, 2024 19:37:06.922155000 JST",,"6000  >  36886 [SYN, ACK] Seq=0 Ack=1 Win=65160 Len=0 MSS=1460 SACK_PERM TSval=853751748 TSecr=3840540059 WS=128"
105,51.705296,192.168.11.14,192.168.11.48,TCP,66,0.000106,,0.000106,"Jan  6, 2024 19:37:06.922261000 JST",,36886  >  6000 [ACK] Seq=1 Ack=1 Win=64256 Len=0 TSval=3840540066 TSecr=853751748
106,51.705509,192.168.11.14,192.168.11.48,TCP,93,,,0.000213,"Jan  6, 2024 19:37:06.922474000 JST",,"36886  >  6000 [PSH, ACK] Seq=1 Ack=1 Win=64256 Len=27 TSval=3840540066 TSecr=853751748 [TCP segment of a reassembled PDU]"
107,51.705604,192.168.11.14,192.168.11.48,TCP,66,,,0.000095,"Jan  6, 2024 19:37:06.922569000 JST",,"36886  >  6000 [FIN, ACK] Seq=28 Ack=1 Win=64256 Len=0 TSval=3840540067 TSecr=853751748"
108,51.714983,192.168.11.48,192.168.11.14,TCP,66,0.009474,,0.009379,"Jan  6, 2024 19:37:06.931948000 JST",,6000  >  36886 [ACK] Seq=1 Ack=28 Win=65152 Len=0 TSval=853751758 TSecr=3840540066
109,51.715409,192.168.11.48,192.168.11.14,TCP,66,0.009805,,0.000426,"Jan  6, 2024 19:37:06.932374000 JST",,"6000  >  36886 [FIN, ACK] Seq=1 Ack=29 Win=65152 Len=0 TSval=853751759 TSecr=3840540067"
110,51.715455,192.168.11.14,192.168.11.48,TCP,66,0.000046,,0.000046,"Jan  6, 2024 19:37:06.932420000 JST",,36886  >  6000 [ACK] Seq=29 Ack=2 Win=64256 Len=0 TSval=3840540076 TSecr=853751759
111,51.932061,192.168.11.48,192.168.11.14,TCP,66,,,0.216606,"Jan  6, 2024 19:37:07.149026000 JST",,"[TCP Retransmission] 6000  >  36886 [FIN, ACK] Seq=1 Ack=29 Win=65152 Len=0 TSval=853751973 TSecr=3840540067"
112,51.932117,192.168.11.14,192.168.11.48,TCP,66,0.000056,,0.000056,"Jan  6, 2024 19:37:07.149082000 JST",,[TCP Dup ACK 110#1] 36886  >  6000 [ACK] Seq=29 Ack=2 Win=64256 Len=0 TSval=3840540293 TSecr=853751759
113,51.961491,192.168.11.14,255.255.255.255,UDP,209,,Ÿ,0.029374,"Jan  6, 2024 19:37:07.178456000 JST",7b2273656d616e74696373223a207b22656e74697479223a2022504944222c202262617365656e74697479223a2022616e79222c2022726f6c65223a2022303039222c20227370617469616c223a2022616e79222c202274656d706f72616c223a2022616e79227d2c20226461746170726f7065727479223a207b22666f726d6174223a2022696e616f6b615f70726f6772616d5f73616d706c655f73656d616e746963227d7d,39355  >  7000 Len=167
114,51.969604,192.168.11.49,192.168.11.14,TCP,74,,œ,0.008113,"Jan  6, 2024 19:37:07.186569000 JST",,57182  >  6000 [SYN] Seq=0 Win=64240 Len=0 MSS=1460 SACK_PERM TSval=1691492653 TSecr=0 WS=128
115,51.969746,192.168.11.14,192.168.11.49,TCP,74,0.000142,,0.000142,"Jan  6, 2024 19:37:07.186711000 JST",,"6000  >  57182 [SYN, ACK] Seq=0 Ack=1 Win=65160 Len=0 MSS=1460 SACK_PERM TSval=1954227742 TSecr=1691492653 WS=128"
116,51.976391,192.168.11.49,192.168.11.14,TCP,66,0.006645,,0.006645,"Jan  6, 2024 19:37:07.193356000 JST",,57182  >  6000 [ACK] Seq=1 Ack=1 Win=64256 Len=0 TSval=1691492660 TSecr=1954227742
117,51.976933,192.168.11.49,192.168.11.14,TCP,93,,,0.000542,"Jan  6, 2024 19:37:07.193898000 JST",,"57182  >  6000 [PSH, ACK] Seq=1 Ack=1 Win=64256 Len=27 TSval=1691492660 TSecr=1954227742 [TCP segment of a reassembled PDU]"
118,51.977026,192.168.11.14,192.168.11.49,TCP,66,0.000093,,0.000093,"Jan  6, 2024 19:37:07.193991000 JST",,6000  >  57182 [ACK] Seq=1 Ack=28 Win=65152 Len=0 TSval=1954227749 TSecr=1691492660
119,51.977095,192.168.11.49,192.168.11.14,TCP,66,,,0.000069,"Jan  6, 2024 19:37:07.194060000 JST",,"57182  >  6000 [FIN, ACK] Seq=28 Ack=1 Win=64256 Len=0 TSval=1691492660 TSecr=1954227742"
120,51.978986,192.168.11.14,192.168.11.49,TCP,66,0.001891,,0.001891,"Jan  6, 2024 19:37:07.195951000 JST",,"6000  >  57182 [FIN, ACK] Seq=1 Ack=29 Win=65152 Len=0 TSval=1954227751 TSecr=1691492660"
121,51.984867,192.168.11.49,192.168.11.14,TCP,66,0.005881,,0.005881,"Jan  6, 2024 19:37:07.201832000 JST",,57182  >  6000 [ACK] Seq=29 Ack=2 Win=64256 Len=0 TSval=1691492667 TSecr=1954227751
122,60.807915,192.168.11.14,192.168.11.48,TCP,74,,,8.823048,"Jan  6, 2024 19:37:16.024880000 JST",,36896  >  6000 [SYN] Seq=0 Win=64240 Len=0 MSS=1460 SACK_PERM TSval=3840549169 TSecr=0 WS=128
123,60.814784,192.168.11.48,192.168.11.14,TCP,74,0.006869,,0.006869,"Jan  6, 2024 19:37:16.031749000 JST",,"6000  >  36896 [SYN, ACK] Seq=0 Ack=1 Win=65160 Len=0 MSS=1460 SACK_PERM TSval=853760858 TSecr=3840549169 WS=128"
124,60.814885,192.168.11.14,192.168.11.48,TCP,66,0.000101,,0.000101,"Jan  6, 2024 19:37:16.031850000 JST",,36896  >  6000 [ACK] Seq=1 Ack=1 Win=64256 Len=0 TSval=3840549176 TSecr=853760858
125,60.815068,192.168.11.14,192.168.11.48,TCP,93,,,0.000183,"Jan  6, 2024 19:37:16.032033000 JST",,"36896  >  6000 [PSH, ACK] Seq=1 Ack=1 Win=64256 Len=27 TSval=3840549176 TSecr=853760858 [TCP segment of a reassembled PDU]"
126,60.815204,192.168.11.14,192.168.11.48,TCP,66,,,0.000136,"Jan  6, 2024 19:37:16.032169000 JST",,"36896  >  6000 [FIN, ACK] Seq=28 Ack=1 Win=64256 Len=0 TSval=3840549176 TSecr=853760858"
127,60.825698,192.168.11.48,192.168.11.14,TCP,66,0.01063,,0.010494,"Jan  6, 2024 19:37:16.042663000 JST",,6000  >  36896 [ACK] Seq=1 Ack=28 Win=65152 Len=0 TSval=853760865 TSecr=3840549176
128,60.826145,192.168.11.48,192.168.11.14,TCP,66,0.010941,,0.000447,"Jan  6, 2024 19:37:16.043110000 JST",,"6000  >  36896 [FIN, ACK] Seq=1 Ack=29 Win=65152 Len=0 TSval=853760867 TSecr=3840549176"
129,60.826191,192.168.11.14,192.168.11.48,TCP,66,0.000046,,0.000046,"Jan  6, 2024 19:37:16.043156000 JST",,36896  >  6000 [ACK] Seq=29 Ack=2 Win=64256 Len=0 TSval=3840549187 TSecr=853760867
130,60.862764,192.168.11.14,255.255.255.255,UDP,209,,Ÿ,0.036573,"Jan  6, 2024 19:37:16.079729000 JST",7b2273656d616e74696373223a207b22656e74697479223a2022504944222c202262617365656e74697479223a2022616e79222c2022726f6c65223a2022303039222c20227370617469616c223a2022616e79222c202274656d706f72616c223a2022616e79227d2c20226461746170726f7065727479223a207b22666f726d6174223a2022696e616f6b615f70726f6772616d5f73616d706c655f73656d616e746963227d7d,39671  >  7000 Len=167
131,60.870911,192.168.11.49,192.168.11.14,TCP,74,,œ,0.008147,"Jan  6, 2024 19:37:16.087876000 JST",,43910  >  6000 [SYN] Seq=0 Win=64240 Len=0 MSS=1460 SACK_PERM TSval=1691501554 TSecr=0 WS=128
132,60.87105,192.168.11.14,192.168.11.49,TCP,74,0.000139,,0.000139,"Jan  6, 2024 19:37:16.088015000 JST",,"6000  >  43910 [SYN, ACK] Seq=0 Ack=1 Win=65160 Len=0 MSS=1460 SACK_PERM TSval=1954236643 TSecr=1691501554 WS=128"
133,60.877666,192.168.11.49,192.168.11.14,TCP,66,0.006616,,0.006616,"Jan  6, 2024 19:37:16.094631000 JST",,43910  >  6000 [ACK] Seq=1 Ack=1 Win=64256 Len=0 TSval=1691501561 TSecr=1954236643
134,60.878368,192.168.11.49,192.168.11.14,TCP,93,,,0.000702,"Jan  6, 2024 19:37:16.095333000 JST",,"43910  >  6000 [PSH, ACK] Seq=1 Ack=1 Win=64256 Len=27 TSval=1691501561 TSecr=1954236643 [TCP segment of a reassembled PDU]"
135,60.878459,192.168.11.14,192.168.11.49,TCP,66,0.000091,,0.000091,"Jan  6, 2024 19:37:16.095424000 JST",,6000  >  43910 [ACK] Seq=1 Ack=28 Win=65152 Len=0 TSval=1954236650 TSecr=1691501561
136,60.878578,192.168.11.49,192.168.11.14,TCP,66,,,0.000119,"Jan  6, 2024 19:37:16.095543000 JST",,"43910  >  6000 [FIN, ACK] Seq=28 Ack=1 Win=64256 Len=0 TSval=1691501561 TSecr=1954236643"
137,60.88073,192.168.11.14,192.168.11.49,TCP,66,0.002152,,0.002152,"Jan  6, 2024 19:37:16.097695000 JST",,"6000  >  43910 [FIN, ACK] Seq=1 Ack=29 Win=65152 Len=0 TSval=1954236653 TSecr=1691501561"
138,60.885433,192.168.11.49,192.168.11.14,TCP,66,0.004703,,0.004703,"Jan  6, 2024 19:37:16.102398000 JST",,43910  >  6000 [ACK] Seq=29 Ack=2 Win=64256 Len=0 TSval=1691501569 TSecr=1954236653
139,72.715805,192.168.11.14,192.168.11.48,TCP,74,,,11.830372,"Jan  6, 2024 19:37:27.932770000 JST",,39032  >  6000 [SYN] Seq=0 Win=64240 Len=0 MSS=1460 SACK_PERM TSval=3840561077 TSecr=0 WS=128
140,72.723147,192.168.11.48,192.168.11.14,TCP,74,0.007342,,0.007342,"Jan  6, 2024 19:37:27.940112000 JST",,"6000  >  39032 [SYN, ACK] Seq=0 Ack=1 Win=65160 Len=0 MSS=1460 SACK_PERM TSval=853772766 TSecr=3840561077 WS=128"
141,72.723257,192.168.11.14,192.168.11.48,TCP,66,0.00011,,0.00011,"Jan  6, 2024 19:37:27.940222000 JST",,39032  >  6000 [ACK] Seq=1 Ack=1 Win=64256 Len=0 TSval=3840561084 TSecr=853772766
142,72.723523,192.168.11.14,192.168.11.48,TCP,93,,,0.000266,"Jan  6, 2024 19:37:27.940488000 JST",,"39032  >  6000 [PSH, ACK] Seq=1 Ack=1 Win=64256 Len=27 TSval=3840561084 TSecr=853772766 [TCP segment of a reassembled PDU]"
143,72.723656,192.168.11.14,192.168.11.48,TCP,66,,,0.000133,"Jan  6, 2024 19:37:27.940621000 JST",,"39032  >  6000 [FIN, ACK] Seq=28 Ack=1 Win=64256 Len=0 TSval=3840561085 TSecr=853772766"
144,72.730618,192.168.11.48,192.168.11.14,TCP,66,0.007095,,0.006962,"Jan  6, 2024 19:37:27.947583000 JST",,6000  >  39032 [ACK] Seq=1 Ack=28 Win=65152 Len=0 TSval=853772774 TSecr=3840561084
145,72.730875,192.168.11.48,192.168.11.14,TCP,66,0.007219,,0.000257,"Jan  6, 2024 19:37:27.947840000 JST",,"6000  >  39032 [FIN, ACK] Seq=1 Ack=29 Win=65152 Len=0 TSval=853772775 TSecr=3840561085"
146,72.730919,192.168.11.14,192.168.11.48,TCP,66,0.000044,,0.000044,"Jan  6, 2024 19:37:27.947884000 JST",,39032  >  6000 [ACK] Seq=29 Ack=2 Win=64256 Len=0 TSval=3840561092 TSecr=853772775
147,72.762798,192.168.11.14,255.255.255.255,UDP,209,,Ÿ,0.031879,"Jan  6, 2024 19:37:27.979763000 JST",7b2273656d616e74696373223a207b22656e74697479223a2022504944222c202262617365656e74697479223a2022616e79222c2022726f6c65223a2022303039222c20227370617469616c223a2022616e79222c202274656d706f72616c223a2022616e79227d2c20226461746170726f7065727479223a207b22666f726d6174223a2022696e616f6b615f70726f6772616d5f73616d706c655f73656d616e746963227d7d,53744  >  7000 Len=167
148,72.771459,192.168.11.49,192.168.11.14,TCP,74,,œ,0.008661,"Jan  6, 2024 19:37:27.988424000 JST",,36194  >  6000 [SYN] Seq=0 Win=64240 Len=0 MSS=1460 SACK_PERM TSval=1691513454 TSecr=0 WS=128
149,72.771598,192.168.11.14,192.168.11.49,TCP,74,0.000139,,0.000139,"Jan  6, 2024 19:37:27.988563000 JST",,"6000  >  36194 [SYN, ACK] Seq=0 Ack=1 Win=65160 Len=0 MSS=1460 SACK_PERM TSval=1954248544 TSecr=1691513454 WS=128"
150,72.778428,192.168.11.49,192.168.11.14,TCP,66,0.00683,,0.00683,"Jan  6, 2024 19:37:27.995393000 JST",,36194  >  6000 [ACK] Seq=1 Ack=1 Win=64256 Len=0 TSval=1691513462 TSecr=1954248544
151,72.779199,192.168.11.49,192.168.11.14,TCP,93,,,0.000771,"Jan  6, 2024 19:37:27.996164000 JST",,"36194  >  6000 [PSH, ACK] Seq=1 Ack=1 Win=64256 Len=27 TSval=1691513462 TSecr=1954248544 [TCP segment of a reassembled PDU]"
152,72.779334,192.168.11.14,192.168.11.49,TCP,66,0.000135,,0.000135,"Jan  6, 2024 19:37:27.996299000 JST",,6000  >  36194 [ACK] Seq=1 Ack=28 Win=65152 Len=0 TSval=1954248551 TSecr=1691513462
153,72.779414,192.168.11.49,192.168.11.14,TCP,66,,,0.00008,"Jan  6, 2024 19:37:27.996379000 JST",,"36194  >  6000 [FIN, ACK] Seq=28 Ack=1 Win=64256 Len=0 TSval=1691513462 TSecr=1954248544"
154,72.780764,192.168.11.14,192.168.11.49,TCP,66,0.00135,,0.00135,"Jan  6, 2024 19:37:27.997729000 JST",,"6000  >  36194 [FIN, ACK] Seq=1 Ack=29 Win=65152 Len=0 TSval=1954248553 TSecr=1691513462"
155,72.787805,192.168.11.49,192.168.11.14,TCP,66,0.007041,,0.007041,"Jan  6, 2024 19:37:28.004770000 JST",,36194  >  6000 [ACK] Seq=29 Ack=2 Win=64256 Len=0 TSval=1691513471 TSecr=1954248553
156,81.606463,192.168.11.14,192.168.11.48,TCP,74,,,8.818658,"Jan  6, 2024 19:37:36.823428000 JST",,46678  >  6000 [SYN] Seq=0 Win=64240 Len=0 MSS=1460 SACK_PERM TSval=3840569967 TSecr=0 WS=128
157,81.614459,192.168.11.48,192.168.11.14,TCP,74,0.007996,,0.007996,"Jan  6, 2024 19:37:36.831424000 JST",,"6000  >  46678 [SYN, ACK] Seq=0 Ack=1 Win=65160 Len=0 MSS=1460 SACK_PERM TSval=853781656 TSecr=3840569967 WS=128"
158,81.614606,192.168.11.14,192.168.11.48,TCP,66,0.000147,,0.000147,"Jan  6, 2024 19:37:36.831571000 JST",,46678  >  6000 [ACK] Seq=1 Ack=1 Win=64256 Len=0 TSval=3840569975 TSecr=853781656
159,81.614813,192.168.11.14,192.168.11.48,TCP,93,,,0.000207,"Jan  6, 2024 19:37:36.831778000 JST",,"46678  >  6000 [PSH, ACK] Seq=1 Ack=1 Win=64256 Len=27 TSval=3840569976 TSecr=853781656 [TCP segment of a reassembled PDU]"
160,81.614944,192.168.11.14,192.168.11.48,TCP,66,,,0.000131,"Jan  6, 2024 19:37:36.831909000 JST",,"46678  >  6000 [FIN, ACK] Seq=28 Ack=1 Win=64256 Len=0 TSval=3840569976 TSecr=853781656"
161,81.631632,192.168.11.48,192.168.11.14,TCP,66,0.016819,,0.016688,"Jan  6, 2024 19:37:36.848597000 JST",,6000  >  46678 [ACK] Seq=1 Ack=28 Win=65152 Len=0 TSval=853781668 TSecr=3840569976
162,81.632047,192.168.11.48,192.168.11.14,TCP,66,0.017103,,0.000415,"Jan  6, 2024 19:37:36.849012000 JST",,"6000  >  46678 [FIN, ACK] Seq=1 Ack=29 Win=65152 Len=0 TSval=853781669 TSecr=3840569976"
163,81.632094,192.168.11.14,192.168.11.48,TCP,66,0.000047,,0.000047,"Jan  6, 2024 19:37:36.849059000 JST",,46678  >  6000 [ACK] Seq=29 Ack=2 Win=64256 Len=0 TSval=3840569993 TSecr=853781669
164,81.663129,192.168.11.14,255.255.255.255,UDP,209,,Ÿ,0.031035,"Jan  6, 2024 19:37:36.880094000 JST",7b2273656d616e74696373223a207b22656e74697479223a2022504944222c202262617365656e74697479223a2022616e79222c2022726f6c65223a2022303039222c20227370617469616c223a2022616e79222c202274656d706f72616c223a2022616e79227d2c20226461746170726f7065727479223a207b22666f726d6174223a2022696e616f6b615f70726f6772616d5f73616d706c655f73656d616e746963227d7d,47052  >  7000 Len=167
165,81.671527,192.168.11.49,192.168.11.14,TCP,74,,œ,0.008398,"Jan  6, 2024 19:37:36.888492000 JST",,34652  >  6000 [SYN] Seq=0 Win=64240 Len=0 MSS=1460 SACK_PERM TSval=1691522355 TSecr=0 WS=128
166,81.671666,192.168.11.14,192.168.11.49,TCP,74,0.000139,,0.000139,"Jan  6, 2024 19:37:36.888631000 JST",,"6000  >  34652 [SYN, ACK] Seq=0 Ack=1 Win=65160 Len=0 MSS=1460 SACK_PERM TSval=1954257444 TSecr=1691522355 WS=128"
167,81.690139,192.168.11.49,192.168.11.14,TCP,66,0.018473,,0.018473,"Jan  6, 2024 19:37:36.907104000 JST",,34652  >  6000 [ACK] Seq=1 Ack=1 Win=64256 Len=0 TSval=1691522362 TSecr=1954257444
168,81.690774,192.168.11.49,192.168.11.14,TCP,93,,,0.000635,"Jan  6, 2024 19:37:36.907739000 JST",,"34652  >  6000 [PSH, ACK] Seq=1 Ack=1 Win=64256 Len=27 TSval=1691522362 TSecr=1954257444 [TCP segment of a reassembled PDU]"
169,81.69085,192.168.11.14,192.168.11.49,TCP,66,0.000076,,0.000076,"Jan  6, 2024 19:37:36.907815000 JST",,6000  >  34652 [ACK] Seq=1 Ack=28 Win=65152 Len=0 TSval=1954257463 TSecr=1691522362
170,81.690922,192.168.11.49,192.168.11.14,TCP,66,,,0.000072,"Jan  6, 2024 19:37:36.907887000 JST",,"34652  >  6000 [FIN, ACK] Seq=28 Ack=1 Win=64256 Len=0 TSval=1691522362 TSecr=1954257444"
171,81.692023,192.168.11.14,192.168.11.49,TCP,66,0.001101,,0.001101,"Jan  6, 2024 19:37:36.908988000 JST",,"6000  >  34652 [FIN, ACK] Seq=1 Ack=29 Win=65152 Len=0 TSval=1954257464 TSecr=1691522362"
172,81.695435,192.168.11.49,192.168.11.14,TCP,66,,,0.003412,"Jan  6, 2024 19:37:36.912400000 JST",,"[TCP Retransmission] 34652  >  6000 [FIN, ACK] Seq=28 Ack=1 Win=64256 Len=0 TSval=1691522380 TSecr=1954257444"
173,81.695496,192.168.11.14,192.168.11.49,TCP,78,0.000061,,0.000061,"Jan  6, 2024 19:37:36.912461000 JST",,[TCP Dup ACK 171#1] 6000  >  34652 [ACK] Seq=2 Ack=29 Win=65152 Len=0 TSval=1954257467 TSecr=1691522380 SLE=28 SRE=29
174,81.697924,192.168.11.49,192.168.11.14,TCP,66,0.005901,,0.002428,"Jan  6, 2024 19:37:36.914889000 JST",,34652  >  6000 [ACK] Seq=29 Ack=2 Win=64256 Len=0 TSval=1691522381 TSecr=1954257464
175,112.788657,192.168.11.14,192.168.11.48,TCP,74,,,31.090733,"Jan  6, 2024 19:38:08.005622000 JST",,51912  >  6000 [SYN] Seq=0 Win=64240 Len=0 MSS=1460 SACK_PERM TSval=3840601150 TSecr=0 WS=128
176,112.795393,192.168.11.48,192.168.11.14,TCP,74,0.006736,,0.006736,"Jan  6, 2024 19:38:08.012358000 JST",,"6000  >  51912 [SYN, ACK] Seq=0 Ack=1 Win=65160 Len=0 MSS=1460 SACK_PERM TSval=853812838 TSecr=3840601150 WS=128"
177,112.795527,192.168.11.14,192.168.11.48,TCP,66,0.000134,,0.000134,"Jan  6, 2024 19:38:08.012492000 JST",,51912  >  6000 [ACK] Seq=1 Ack=1 Win=64256 Len=0 TSval=3840601156 TSecr=853812838
178,112.795713,192.168.11.14,192.168.11.48,TCP,93,,,0.000186,"Jan  6, 2024 19:38:08.012678000 JST",,"51912  >  6000 [PSH, ACK] Seq=1 Ack=1 Win=64256 Len=27 TSval=3840601157 TSecr=853812838 [TCP segment of a reassembled PDU]"
179,112.795815,192.168.11.14,192.168.11.48,TCP,66,,,0.000102,"Jan  6, 2024 19:38:08.012780000 JST",,"51912  >  6000 [FIN, ACK] Seq=28 Ack=1 Win=64256 Len=0 TSval=3840601157 TSecr=853812838"
180,112.80304,192.168.11.48,192.168.11.14,TCP,66,0.007327,,0.007225,"Jan  6, 2024 19:38:08.020005000 JST",,6000  >  51912 [ACK] Seq=1 Ack=28 Win=65152 Len=0 TSval=853812846 TSecr=3840601157
181,112.803461,192.168.11.48,192.168.11.14,TCP,66,0.007646,,0.000421,"Jan  6, 2024 19:38:08.020426000 JST",,"6000  >  51912 [FIN, ACK] Seq=1 Ack=29 Win=65152 Len=0 TSval=853812847 TSecr=3840601157"
182,112.803529,192.168.11.14,192.168.11.48,TCP,66,0.000068,,0.000068,"Jan  6, 2024 19:38:08.020494000 JST",,51912  >  6000 [ACK] Seq=29 Ack=2 Win=64256 Len=0 TSval=3840601164 TSecr=853812847
183,112.839377,192.168.11.14,255.255.255.255,UDP,209,,Ÿ,0.035848,"Jan  6, 2024 19:38:08.056342000 JST",7b2273656d616e74696373223a207b22656e74697479223a2022504944222c202262617365656e74697479223a2022616e79222c2022726f6c65223a2022303039222c20227370617469616c223a2022616e79222c202274656d706f72616c223a2022616e79227d2c20226461746170726f7065727479223a207b22666f726d6174223a2022696e616f6b615f70726f6772616d5f73616d706c655f73656d616e746963227d7d,46627  >  7000 Len=167
184,112.848222,192.168.11.49,192.168.11.14,TCP,74,,œ,0.008845,"Jan  6, 2024 19:38:08.065187000 JST",,54094  >  6000 [SYN] Seq=0 Win=64240 Len=0 MSS=1460 SACK_PERM TSval=1691553531 TSecr=0 WS=128
