No.,Time,Source,Destination,Protocol,Length,The RTT to ACK the segment was,XXX,Time delta from previous captured frame,Arrival Time,Data,Info
1,0,192.168.11.50,192.168.11.49,TCP,74,,,0,"Jan  6, 2024 19:36:15.330398000 JST",,40980  >  6000 [SYN] Seq=0 Win=64240 Len=0 MSS=1460 SACK_PERM TSval=1300271049 TSecr=0 WS=128
2,0.008128,192.168.11.49,192.168.11.50,TCP,74,0.008128,,0.008128,"Jan  6, 2024 19:36:15.338526000 JST",,"6000  >  40980 [SYN, ACK] Seq=0 Ack=1 Win=65160 Len=0 MSS=1460 SACK_PERM TSval=3018201611 TSecr=1300271049 WS=128"
3,0.008239,192.168.11.50,192.168.11.49,TCP,66,0.000111,,0.000111,"Jan  6, 2024 19:36:15.338637000 JST",,40980  >  6000 [ACK] Seq=1 Ack=1 Win=64256 Len=0 TSval=1300271061 TSecr=3018201611
4,0.008442,192.168.11.50,192.168.11.49,TCP,93,,,0.000203,"Jan  6, 2024 19:36:15.338840000 JST",,"40980  >  6000 [PSH, ACK] Seq=1 Ack=1 Win=64256 Len=27 TSval=1300271061 TSecr=3018201611 [TCP segment of a reassembled PDU]"
5,0.008593,192.168.11.50,192.168.11.49,TCP,66,,,0.000151,"Jan  6, 2024 19:36:15.338991000 JST",,"40980  >  6000 [FIN, ACK] Seq=28 Ack=1 Win=64256 Len=0 TSval=1300271061 TSecr=3018201611"
6,0.015332,192.168.11.49,192.168.11.50,TCP,66,0.00689,,0.006739,"Jan  6, 2024 19:36:15.345730000 JST",,6000  >  40980 [ACK] Seq=1 Ack=28 Win=65152 Len=0 TSval=3018201619 TSecr=1300271061
7,0.015725,192.168.11.49,192.168.11.50,TCP,66,0.007132,,0.000393,"Jan  6, 2024 19:36:15.346123000 JST",,"6000  >  40980 [FIN, ACK] Seq=1 Ack=29 Win=65152 Len=0 TSval=3018201620 TSecr=1300271061"
8,0.015777,192.168.11.50,192.168.11.49,TCP,66,0.000052,,0.000052,"Jan  6, 2024 19:36:15.346175000 JST",,40980  >  6000 [ACK] Seq=29 Ack=2 Win=64256 Len=0 TSval=1300271068 TSecr=3018201620
9,0.046764,192.168.11.50,255.255.255.255,UDP,209,,Ÿ,0.030987,"Jan  6, 2024 19:36:15.377162000 JST",7b2273656d616e74696373223a207b22656e74697479223a2022504944222c202262617365656e74697479223a2022616e79222c2022726f6c65223a2022303131222c20227370617469616c223a2022616e79222c202274656d706f72616c223a2022616e79227d2c20226461746170726f7065727479223a207b22666f726d6174223a2022696e616f6b615f70726f6772616d5f73616d706c655f73656d616e746963227d7d,41587  >  7000 Len=167
10,0.070469,192.168.11.51,192.168.11.50,TCP,74,,œ,0.023705,"Jan  6, 2024 19:36:15.400867000 JST",,39344  >  6000 [SYN] Seq=0 Win=64240 Len=0 MSS=1460 SACK_PERM TSval=935966027 TSecr=0 WS=128
11,0.070636,192.168.11.50,192.168.11.51,TCP,74,0.000167,,0.000167,"Jan  6, 2024 19:36:15.401034000 JST",,"6000  >  39344 [SYN, ACK] Seq=0 Ack=1 Win=65160 Len=0 MSS=1460 SACK_PERM TSval=914226556 TSecr=935966027 WS=128"
12,0.078213,192.168.11.51,192.168.11.50,TCP,66,0.007577,,0.007577,"Jan  6, 2024 19:36:15.408611000 JST",,39344  >  6000 [ACK] Seq=1 Ack=1 Win=64256 Len=0 TSval=935966050 TSecr=914226556
13,0.078698,192.168.11.51,192.168.11.50,TCP,93,,,0.000485,"Jan  6, 2024 19:36:15.409096000 JST",,"39344  >  6000 [PSH, ACK] Seq=1 Ack=1 Win=64256 Len=27 TSval=935966050 TSecr=914226556 [TCP segment of a reassembled PDU]"
14,0.078768,192.168.11.50,192.168.11.51,TCP,66,0.00007,,0.00007,"Jan  6, 2024 19:36:15.409166000 JST",,6000  >  39344 [ACK] Seq=1 Ack=28 Win=65152 Len=0 TSval=914226564 TSecr=935966050
15,0.078829,192.168.11.51,192.168.11.50,TCP,66,,,0.000061,"Jan  6, 2024 19:36:15.409227000 JST",,"39344  >  6000 [FIN, ACK] Seq=28 Ack=1 Win=64256 Len=0 TSval=935966050 TSecr=914226556"
16,0.079838,192.168.11.50,192.168.11.51,TCP,66,0.001009,,0.001009,"Jan  6, 2024 19:36:15.410236000 JST",,"6000  >  39344 [FIN, ACK] Seq=1 Ack=29 Win=65152 Len=0 TSval=914226565 TSecr=935966050"
17,0.087668,192.168.11.51,192.168.11.50,TCP,66,0.00783,,0.00783,"Jan  6, 2024 19:36:15.418066000 JST",,39344  >  6000 [ACK] Seq=29 Ack=2 Win=64256 Len=0 TSval=935966057 TSecr=914226565
18,8.197954,192.168.11.50,192.168.11.49,TCP,74,,,8.110286,"Jan  6, 2024 19:36:23.528352000 JST",,49964  >  6000 [SYN] Seq=0 Win=64240 Len=0 MSS=1460 SACK_PERM TSval=1300279250 TSecr=0 WS=128
19,8.20569,192.168.11.49,192.168.11.50,TCP,74,0.007736,,0.007736,"Jan  6, 2024 19:36:23.536088000 JST",,"6000  >  49964 [SYN, ACK] Seq=0 Ack=1 Win=65160 Len=0 MSS=1460 SACK_PERM TSval=3018209809 TSecr=1300279250 WS=128"
20,8.205804,192.168.11.50,192.168.11.49,TCP,66,0.000114,,0.000114,"Jan  6, 2024 19:36:23.536202000 JST",,49964  >  6000 [ACK] Seq=1 Ack=1 Win=64256 Len=0 TSval=1300279258 TSecr=3018209809
21,8.206116,192.168.11.50,192.168.11.49,TCP,93,,,0.000312,"Jan  6, 2024 19:36:23.536514000 JST",,"49964  >  6000 [PSH, ACK] Seq=1 Ack=1 Win=64256 Len=27 TSval=1300279259 TSecr=3018209809 [TCP segment of a reassembled PDU]"
22,8.206243,192.168.11.50,192.168.11.49,TCP,66,,,0.000127,"Jan  6, 2024 19:36:23.536641000 JST",,"49964  >  6000 [FIN, ACK] Seq=28 Ack=1 Win=64256 Len=0 TSval=1300279259 TSecr=3018209809"
23,8.214413,192.168.11.49,192.168.11.50,TCP,66,0.008297,,0.00817,"Jan  6, 2024 19:36:23.544811000 JST",,6000  >  49964 [ACK] Seq=1 Ack=28 Win=65152 Len=0 TSval=3018209818 TSecr=1300279259
24,8.214769,192.168.11.49,192.168.11.50,TCP,66,0.008526,,0.000356,"Jan  6, 2024 19:36:23.545167000 JST",,"6000  >  49964 [FIN, ACK] Seq=1 Ack=29 Win=65152 Len=0 TSval=3018209820 TSecr=1300279259"
25,8.214815,192.168.11.50,192.168.11.49,TCP,66,0.000046,,0.000046,"Jan  6, 2024 19:36:23.545213000 JST",,49964  >  6000 [ACK] Seq=29 Ack=2 Win=64256 Len=0 TSval=1300279267 TSecr=3018209820
26,8.245176,192.168.11.50,255.255.255.255,UDP,209,,Ÿ,0.030361,"Jan  6, 2024 19:36:23.575574000 JST",7b2273656d616e74696373223a207b22656e74697479223a2022504944222c202262617365656e74697479223a2022616e79222c2022726f6c65223a2022303131222c20227370617469616c223a2022616e79222c202274656d706f72616c223a2022616e79227d2c20226461746170726f7065727479223a207b22666f726d6174223a2022696e616f6b615f70726f6772616d5f73616d706c655f73656d616e746963227d7d,41238  >  7000 Len=167
27,8.253366,192.168.11.51,192.168.11.50,TCP,74,,œ,0.00819,"Jan  6, 2024 19:36:23.583764000 JST",,42886  >  6000 [SYN] Seq=0 Win=64240 Len=0 MSS=1460 SACK_PERM TSval=935974225 TSecr=0 WS=128
28,8.25352,192.168.11.50,192.168.11.51,TCP,74,0.000154,,0.000154,"Jan  6, 2024 19:36:23.583918000 JST",,"6000  >  42886 [SYN, ACK] Seq=0 Ack=1 Win=65160 Len=0 MSS=1460 SACK_PERM TSval=914234739 TSecr=935974225 WS=128"
29,8.260793,192.168.11.51,192.168.11.50,TCP,66,0.007273,,0.007273,"Jan  6, 2024 19:36:23.591191000 JST",,42886  >  6000 [ACK] Seq=1 Ack=1 Win=64256 Len=0 TSval=935974232 TSecr=914234739
30,8.261462,192.168.11.51,192.168.11.50,TCP,93,,,0.000669,"Jan  6, 2024 19:36:23.591860000 JST",,"42886  >  6000 [PSH, ACK] Seq=1 Ack=1 Win=64256 Len=27 TSval=935974232 TSecr=914234739 [TCP segment of a reassembled PDU]"
31,8.26159,192.168.11.50,192.168.11.51,TCP,66,0.000128,,0.000128,"Jan  6, 2024 19:36:23.591988000 JST",,6000  >  42886 [ACK] Seq=1 Ack=28 Win=65152 Len=0 TSval=914234747 TSecr=935974232
32,8.261671,192.168.11.51,192.168.11.50,TCP,66,,,0.000081,"Jan  6, 2024 19:36:23.592069000 JST",,"42886  >  6000 [FIN, ACK] Seq=28 Ack=1 Win=64256 Len=0 TSval=935974232 TSecr=914234739"
33,8.26321,192.168.11.50,192.168.11.51,TCP,66,0.001539,,0.001539,"Jan  6, 2024 19:36:23.593608000 JST",,"6000  >  42886 [FIN, ACK] Seq=1 Ack=29 Win=65152 Len=0 TSval=914234749 TSecr=935974232"
34,8.269434,192.168.11.51,192.168.11.50,TCP,66,0.006224,,0.006224,"Jan  6, 2024 19:36:23.599832000 JST",,42886  >  6000 [ACK] Seq=29 Ack=2 Win=64256 Len=0 TSval=935974240 TSecr=914234749
35,19.074795,192.168.11.50,192.168.11.49,TCP,74,,,10.805361,"Jan  6, 2024 19:36:34.405193000 JST",,36060  >  6000 [SYN] Seq=0 Win=64240 Len=0 MSS=1460 SACK_PERM TSval=1300290127 TSecr=0 WS=128
36,19.081815,192.168.11.49,192.168.11.50,TCP,74,0.00702,,0.00702,"Jan  6, 2024 19:36:34.412213000 JST",,"6000  >  36060 [SYN, ACK] Seq=0 Ack=1 Win=65160 Len=0 MSS=1460 SACK_PERM TSval=3018220686 TSecr=1300290127 WS=128"
37,19.081937,192.168.11.50,192.168.11.49,TCP,66,0.000122,,0.000122,"Jan  6, 2024 19:36:34.412335000 JST",,36060  >  6000 [ACK] Seq=1 Ack=1 Win=64256 Len=0 TSval=1300290134 TSecr=3018220686
38,19.082108,192.168.11.50,192.168.11.49,TCP,93,,,0.000171,"Jan  6, 2024 19:36:34.412506000 JST",,"36060  >  6000 [PSH, ACK] Seq=1 Ack=1 Win=64256 Len=27 TSval=1300290135 TSecr=3018220686 [TCP segment of a reassembled PDU]"
39,19.082236,192.168.11.50,192.168.11.49,TCP,66,,,0.000128,"Jan  6, 2024 19:36:34.412634000 JST",,"36060  >  6000 [FIN, ACK] Seq=28 Ack=1 Win=64256 Len=0 TSval=1300290135 TSecr=3018220686"
40,19.089482,192.168.11.49,192.168.11.50,TCP,66,0.007374,,0.007246,"Jan  6, 2024 19:36:34.419880000 JST",,6000  >  36060 [ACK] Seq=1 Ack=28 Win=65152 Len=0 TSval=3018220693 TSecr=1300290135
41,19.089714,192.168.11.49,192.168.11.50,TCP,66,0.007478,,0.000232,"Jan  6, 2024 19:36:34.420112000 JST",,"6000  >  36060 [FIN, ACK] Seq=1 Ack=29 Win=65152 Len=0 TSval=3018220696 TSecr=1300290135"
42,19.08976,192.168.11.50,192.168.11.49,TCP,66,0.000046,,0.000046,"Jan  6, 2024 19:36:34.420158000 JST",,36060  >  6000 [ACK] Seq=29 Ack=2 Win=64256 Len=0 TSval=1300290142 TSecr=3018220696
43,19.122137,192.168.11.50,255.255.255.255,UDP,209,,Ÿ,0.032377,"Jan  6, 2024 19:36:34.452535000 JST",7b2273656d616e74696373223a207b22656e74697479223a2022504944222c202262617365656e74697479223a2022616e79222c2022726f6c65223a2022303131222c20227370617469616c223a2022616e79222c202274656d706f72616c223a2022616e79227d2c20226461746170726f7065727479223a207b22666f726d6174223a2022696e616f6b615f70726f6772616d5f73616d706c655f73656d616e746963227d7d,37325  >  7000 Len=167
44,20.123696,192.168.11.50,255.255.255.255,UDP,209,,œ,1.001559,"Jan  6, 2024 19:36:35.454094000 JST",7b2273656d616e74696373223a207b22656e74697479223a2022504944222c202262617365656e74697479223a2022616e79222c2022726f6c65223a2022303131222c20227370617469616c223a2022616e79222c202274656d706f72616c223a2022616e79227d2c20226461746170726f7065727479223a207b22666f726d6174223a2022696e616f6b615f70726f6772616d5f73616d706c655f73656d616e746963227d7d,37325  >  7000 Len=167
45,20.135968,192.168.11.51,192.168.11.50,TCP,74,,œ,0.012272,"Jan  6, 2024 19:36:35.466366000 JST",,43726  >  6000 [SYN] Seq=0 Win=64240 Len=0 MSS=1460 SACK_PERM TSval=935986104 TSecr=0 WS=128
46,20.136118,192.168.11.50,192.168.11.51,TCP,74,0.00015,,0.00015,"Jan  6, 2024 19:36:35.466516000 JST",,"6000  >  43726 [SYN, ACK] Seq=0 Ack=1 Win=65160 Len=0 MSS=1460 SACK_PERM TSval=914246622 TSecr=935986104 WS=128"
47,20.144825,192.168.11.51,192.168.11.50,TCP,66,0.008707,,0.008707,"Jan  6, 2024 19:36:35.475223000 JST",,43726  >  6000 [ACK] Seq=1 Ack=1 Win=64256 Len=0 TSval=935986114 TSecr=914246622
48,20.14536,192.168.11.51,192.168.11.50,TCP,93,,,0.000535,"Jan  6, 2024 19:36:35.475758000 JST",,"43726  >  6000 [PSH, ACK] Seq=1 Ack=1 Win=64256 Len=27 TSval=935986115 TSecr=914246622 [TCP segment of a reassembled PDU]"
49,20.145429,192.168.11.50,192.168.11.51,TCP,66,0.000069,,0.000069,"Jan  6, 2024 19:36:35.475827000 JST",,6000  >  43726 [ACK] Seq=1 Ack=28 Win=65152 Len=0 TSval=914246631 TSecr=935986115
50,20.145495,192.168.11.51,192.168.11.50,TCP,66,,,0.000066,"Jan  6, 2024 19:36:35.475893000 JST",,"43726  >  6000 [FIN, ACK] Seq=28 Ack=1 Win=64256 Len=0 TSval=935986115 TSecr=914246622"
51,20.147126,192.168.11.50,192.168.11.51,TCP,66,0.001631,,0.001631,"Jan  6, 2024 19:36:35.477524000 JST",,"6000  >  43726 [FIN, ACK] Seq=1 Ack=29 Win=65152 Len=0 TSval=914246633 TSecr=935986115"
52,20.158147,192.168.11.51,192.168.11.50,TCP,66,0.011021,,0.011021,"Jan  6, 2024 19:36:35.488545000 JST",,43726  >  6000 [ACK] Seq=29 Ack=2 Win=64256 Len=0 TSval=935986127 TSecr=914246633
53,27.959143,192.168.11.50,192.168.11.49,TCP,74,,,7.800996,"Jan  6, 2024 19:36:43.289541000 JST",,34168  >  6000 [SYN] Seq=0 Win=64240 Len=0 MSS=1460 SACK_PERM TSval=1300299012 TSecr=0 WS=128
54,27.965981,192.168.11.49,192.168.11.50,TCP,74,0.006838,,0.006838,"Jan  6, 2024 19:36:43.296379000 JST",,"6000  >  34168 [SYN, ACK] Seq=0 Ack=1 Win=65160 Len=0 MSS=1460 SACK_PERM TSval=3018229570 TSecr=1300299012 WS=128"
55,27.966086,192.168.11.50,192.168.11.49,TCP,66,0.000105,,0.000105,"Jan  6, 2024 19:36:43.296484000 JST",,34168  >  6000 [ACK] Seq=1 Ack=1 Win=64256 Len=0 TSval=1300299019 TSecr=3018229570
56,27.966269,192.168.11.50,192.168.11.49,TCP,93,,,0.000183,"Jan  6, 2024 19:36:43.296667000 JST",,"34168  >  6000 [PSH, ACK] Seq=1 Ack=1 Win=64256 Len=27 TSval=1300299019 TSecr=3018229570 [TCP segment of a reassembled PDU]"
57,27.966393,192.168.11.50,192.168.11.49,TCP,66,,,0.000124,"Jan  6, 2024 19:36:43.296791000 JST",,"34168  >  6000 [FIN, ACK] Seq=28 Ack=1 Win=64256 Len=0 TSval=1300299019 TSecr=3018229570"
58,27.974215,192.168.11.49,192.168.11.50,TCP,66,0.007946,,0.007822,"Jan  6, 2024 19:36:43.304613000 JST",,6000  >  34168 [ACK] Seq=1 Ack=28 Win=65152 Len=0 TSval=3018229578 TSecr=1300299019
59,27.974452,192.168.11.49,192.168.11.50,TCP,66,0.008059,,0.000237,"Jan  6, 2024 19:36:43.304850000 JST",,"6000  >  34168 [FIN, ACK] Seq=1 Ack=29 Win=65152 Len=0 TSval=3018229580 TSecr=1300299019"
60,27.974499,192.168.11.50,192.168.11.49,TCP,66,0.000047,,0.000047,"Jan  6, 2024 19:36:43.304897000 JST",,34168  >  6000 [ACK] Seq=29 Ack=2 Win=64256 Len=0 TSval=1300299027 TSecr=3018229580
61,28.008248,192.168.11.50,255.255.255.255,UDP,209,,Ÿ,0.033749,"Jan  6, 2024 19:36:43.338646000 JST",7b2273656d616e74696373223a207b22656e74697479223a2022504944222c202262617365656e74697479223a2022616e79222c2022726f6c65223a2022303131222c20227370617469616c223a2022616e79222c202274656d706f72616c223a2022616e79227d2c20226461746170726f7065727479223a207b22666f726d6174223a2022696e616f6b615f70726f6772616d5f73616d706c655f73656d616e746963227d7d,37077  >  7000 Len=167
62,28.016701,192.168.11.51,192.168.11.50,TCP,74,,œ,0.008453,"Jan  6, 2024 19:36:43.347099000 JST",,47614  >  6000 [SYN] Seq=0 Win=64240 Len=0 MSS=1460 SACK_PERM TSval=935993988 TSecr=0 WS=128
63,28.01685,192.168.11.50,192.168.11.51,TCP,74,0.000149,,0.000149,"Jan  6, 2024 19:36:43.347248000 JST",,"6000  >  47614 [SYN, ACK] Seq=0 Ack=1 Win=65160 Len=0 MSS=1460 SACK_PERM TSval=914254502 TSecr=935993988 WS=128"
64,28.023757,192.168.11.51,192.168.11.50,TCP,66,0.006907,,0.006907,"Jan  6, 2024 19:36:43.354155000 JST",,47614  >  6000 [ACK] Seq=1 Ack=1 Win=64256 Len=0 TSval=935993995 TSecr=914254502
65,28.024394,192.168.11.51,192.168.11.50,TCP,93,,,0.000637,"Jan  6, 2024 19:36:43.354792000 JST",,"47614  >  6000 [PSH, ACK] Seq=1 Ack=1 Win=64256 Len=27 TSval=935993995 TSecr=914254502 [TCP segment of a reassembled PDU]"
66,28.02449,192.168.11.50,192.168.11.51,TCP,66,0.000096,,0.000096,"Jan  6, 2024 19:36:43.354888000 JST",,6000  >  47614 [ACK] Seq=1 Ack=28 Win=65152 Len=0 TSval=914254510 TSecr=935993995
67,28.024568,192.168.11.51,192.168.11.50,TCP,66,,,0.000078,"Jan  6, 2024 19:36:43.354966000 JST",,"47614  >  6000 [FIN, ACK] Seq=28 Ack=1 Win=64256 Len=0 TSval=935993995 TSecr=914254502"
68,28.026733,192.168.11.50,192.168.11.51,TCP,66,0.002165,,0.002165,"Jan  6, 2024 19:36:43.357131000 JST",,"6000  >  47614 [FIN, ACK] Seq=1 Ack=29 Win=65152 Len=0 TSval=914254512 TSecr=935993995"
69,28.034718,192.168.11.51,192.168.11.50,TCP,66,0.007985,,0.007985,"Jan  6, 2024 19:36:43.365116000 JST",,47614  >  6000 [ACK] Seq=29 Ack=2 Win=64256 Len=0 TSval=935994003 TSecr=914254512
70,35.759219,192.168.11.50,192.168.11.49,TCP,74,,,7.724501,"Jan  6, 2024 19:36:51.089617000 JST",,34172  >  6000 [SYN] Seq=0 Win=64240 Len=0 MSS=1460 SACK_PERM TSval=1300306812 TSecr=0 WS=128
71,35.766111,192.168.11.49,192.168.11.50,TCP,74,0.006892,,0.006892,"Jan  6, 2024 19:36:51.096509000 JST",,"6000  >  34172 [SYN, ACK] Seq=0 Ack=1 Win=65160 Len=0 MSS=1460 SACK_PERM TSval=3018237370 TSecr=1300306812 WS=128"
72,35.766215,192.168.11.50,192.168.11.49,TCP,66,0.000104,,0.000104,"Jan  6, 2024 19:36:51.096613000 JST",,34172  >  6000 [ACK] Seq=1 Ack=1 Win=64256 Len=0 TSval=1300306819 TSecr=3018237370
73,35.766397,192.168.11.50,192.168.11.49,TCP,93,,,0.000182,"Jan  6, 2024 19:36:51.096795000 JST",,"34172  >  6000 [PSH, ACK] Seq=1 Ack=1 Win=64256 Len=27 TSval=1300306819 TSecr=3018237370 [TCP segment of a reassembled PDU]"
74,35.766519,192.168.11.50,192.168.11.49,TCP,66,,,0.000122,"Jan  6, 2024 19:36:51.096917000 JST",,"34172  >  6000 [FIN, ACK] Seq=28 Ack=1 Win=64256 Len=0 TSval=1300306819 TSecr=3018237370"
75,35.774262,192.168.11.49,192.168.11.50,TCP,66,0.007865,,0.007743,"Jan  6, 2024 19:36:51.104660000 JST",,6000  >  34172 [ACK] Seq=1 Ack=28 Win=65152 Len=0 TSval=3018237378 TSecr=1300306819
76,35.778335,192.168.11.49,192.168.11.50,TCP,66,0.011816,,0.004073,"Jan  6, 2024 19:36:51.108733000 JST",,"6000  >  34172 [FIN, ACK] Seq=1 Ack=29 Win=65152 Len=0 TSval=3018237382 TSecr=1300306819"
77,35.77838,192.168.11.50,192.168.11.49,TCP,66,0.000045,,0.000045,"Jan  6, 2024 19:36:51.108778000 JST",,34172  >  6000 [ACK] Seq=29 Ack=2 Win=64256 Len=0 TSval=1300306831 TSecr=3018237382
78,35.809962,192.168.11.50,255.255.255.255,UDP,209,,Ÿ,0.031582,"Jan  6, 2024 19:36:51.140360000 JST",7b2273656d616e74696373223a207b22656e74697479223a2022504944222c202262617365656e74697479223a2022616e79222c2022726f6c65223a2022303131222c20227370617469616c223a2022616e79222c202274656d706f72616c223a2022616e79227d2c20226461746170726f7065727479223a207b22666f726d6174223a2022696e616f6b615f70726f6772616d5f73616d706c655f73656d616e746963227d7d,52468  >  7000 Len=167
79,35.818225,192.168.11.51,192.168.11.50,TCP,74,,œ,0.008263,"Jan  6, 2024 19:36:51.148623000 JST",,47622  >  6000 [SYN] Seq=0 Win=64240 Len=0 MSS=1460 SACK_PERM TSval=936001789 TSecr=0 WS=128
80,35.818346,192.168.11.50,192.168.11.51,TCP,74,0.000121,,0.000121,"Jan  6, 2024 19:36:51.148744000 JST",,"6000  >  47622 [SYN, ACK] Seq=0 Ack=1 Win=65160 Len=0 MSS=1460 SACK_PERM TSval=914262304 TSecr=936001789 WS=128"
81,35.827558,192.168.11.51,192.168.11.50,TCP,66,0.009212,,0.009212,"Jan  6, 2024 19:36:51.157956000 JST",,47622  >  6000 [ACK] Seq=1 Ack=1 Win=64256 Len=0 TSval=936001797 TSecr=914262304
82,35.828117,192.168.11.51,192.168.11.50,TCP,93,,,0.000559,"Jan  6, 2024 19:36:51.158515000 JST",,"47622  >  6000 [PSH, ACK] Seq=1 Ack=1 Win=64256 Len=27 TSval=936001797 TSecr=914262304 [TCP segment of a reassembled PDU]"
83,35.828199,192.168.11.50,192.168.11.51,TCP,66,0.000082,,0.000082,"Jan  6, 2024 19:36:51.158597000 JST",,6000  >  47622 [ACK] Seq=1 Ack=28 Win=65152 Len=0 TSval=914262314 TSecr=936001797
84,35.828267,192.168.11.51,192.168.11.50,TCP,66,,,0.000068,"Jan  6, 2024 19:36:51.158665000 JST",,"47622  >  6000 [FIN, ACK] Seq=28 Ack=1 Win=64256 Len=0 TSval=936001797 TSecr=914262304"
85,35.83003,192.168.11.50,192.168.11.51,TCP,66,0.001763,,0.001763,"Jan  6, 2024 19:36:51.160428000 JST",,"6000  >  47622 [FIN, ACK] Seq=1 Ack=29 Win=65152 Len=0 TSval=914262315 TSecr=936001797"
86,35.835078,192.168.11.51,192.168.11.50,TCP,66,0.005048,,0.005048,"Jan  6, 2024 19:36:51.165476000 JST",,47622  >  6000 [ACK] Seq=29 Ack=2 Win=64256 Len=0 TSval=936001807 TSecr=914262315
87,43.600761,192.168.11.50,192.168.11.49,TCP,74,,,7.765683,"Jan  6, 2024 19:36:58.931159000 JST",,47940  >  6000 [SYN] Seq=0 Win=64240 Len=0 MSS=1460 SACK_PERM TSval=1300314653 TSecr=0 WS=128
88,43.611215,192.168.11.49,192.168.11.50,TCP,74,0.010454,,0.010454,"Jan  6, 2024 19:36:58.941613000 JST",,"6000  >  47940 [SYN, ACK] Seq=0 Ack=1 Win=65160 Len=0 MSS=1460 SACK_PERM TSval=3018245213 TSecr=1300314653 WS=128"
89,43.611323,192.168.11.50,192.168.11.49,TCP,66,0.000108,,0.000108,"Jan  6, 2024 19:36:58.941721000 JST",,47940  >  6000 [ACK] Seq=1 Ack=1 Win=64256 Len=0 TSval=1300314664 TSecr=3018245213
90,43.61153,192.168.11.50,192.168.11.49,TCP,93,,,0.000207,"Jan  6, 2024 19:36:58.941928000 JST",,"47940  >  6000 [PSH, ACK] Seq=1 Ack=1 Win=64256 Len=27 TSval=1300314664 TSecr=3018245213 [TCP segment of a reassembled PDU]"
91,43.611633,192.168.11.50,192.168.11.49,TCP,66,,,0.000103,"Jan  6, 2024 19:36:58.942031000 JST",,"47940  >  6000 [FIN, ACK] Seq=28 Ack=1 Win=64256 Len=0 TSval=1300314664 TSecr=3018245213"
92,43.619858,192.168.11.49,192.168.11.50,TCP,66,0.008328,,0.008225,"Jan  6, 2024 19:36:58.950256000 JST",,6000  >  47940 [ACK] Seq=1 Ack=28 Win=65152 Len=0 TSval=3018245223 TSecr=1300314664
93,43.620268,192.168.11.49,192.168.11.50,TCP,66,0.008635,,0.00041,"Jan  6, 2024 19:36:58.950666000 JST",,"6000  >  47940 [FIN, ACK] Seq=1 Ack=29 Win=65152 Len=0 TSval=3018245225 TSecr=1300314664"
94,43.62031,192.168.11.50,192.168.11.49,TCP,66,0.000042,,0.000042,"Jan  6, 2024 19:36:58.950708000 JST",,47940  >  6000 [ACK] Seq=29 Ack=2 Win=64256 Len=0 TSval=1300314673 TSecr=3018245225
95,43.650501,192.168.11.50,255.255.255.255,UDP,209,,Ÿ,0.030191,"Jan  6, 2024 19:36:58.980899000 JST",7b2273656d616e74696373223a207b22656e74697479223a2022504944222c202262617365656e74697479223a2022616e79222c2022726f6c65223a2022303131222c20227370617469616c223a2022616e79222c202274656d706f72616c223a2022616e79227d2c20226461746170726f7065727479223a207b22666f726d6174223a2022696e616f6b615f70726f6772616d5f73616d706c655f73656d616e746963227d7d,59516  >  7000 Len=167
96,43.658062,192.168.11.51,192.168.11.50,TCP,74,,œ,0.007561,"Jan  6, 2024 19:36:58.988460000 JST",,42482  >  6000 [SYN] Seq=0 Win=64240 Len=0 MSS=1460 SACK_PERM TSval=936009630 TSecr=0 WS=128
97,43.658212,192.168.11.50,192.168.11.51,TCP,74,0.00015,,0.00015,"Jan  6, 2024 19:36:58.988610000 JST",,"6000  >  42482 [SYN, ACK] Seq=0 Ack=1 Win=65160 Len=0 MSS=1460 SACK_PERM TSval=914270144 TSecr=936009630 WS=128"
98,43.66514,192.168.11.51,192.168.11.50,TCP,66,0.006928,,0.006928,"Jan  6, 2024 19:36:58.995538000 JST",,42482  >  6000 [ACK] Seq=1 Ack=1 Win=64256 Len=0 TSval=936009636 TSecr=914270144
99,43.665602,192.168.11.51,192.168.11.50,TCP,93,,,0.000462,"Jan  6, 2024 19:36:58.996000000 JST",,"42482  >  6000 [PSH, ACK] Seq=1 Ack=1 Win=64256 Len=27 TSval=936009637 TSecr=914270144 [TCP segment of a reassembled PDU]"
100,43.665648,192.168.11.50,192.168.11.51,TCP,66,0.000046,,0.000046,"Jan  6, 2024 19:36:58.996046000 JST",,6000  >  42482 [ACK] Seq=1 Ack=28 Win=65152 Len=0 TSval=914270151 TSecr=936009637
101,43.665703,192.168.11.51,192.168.11.50,TCP,66,,,0.000055,"Jan  6, 2024 19:36:58.996101000 JST",,"42482  >  6000 [FIN, ACK] Seq=28 Ack=1 Win=64256 Len=0 TSval=936009637 TSecr=914270144"
102,43.667413,192.168.11.50,192.168.11.51,TCP,66,0.00171,,0.00171,"Jan  6, 2024 19:36:58.997811000 JST",,"6000  >  42482 [FIN, ACK] Seq=1 Ack=29 Win=65152 Len=0 TSval=914270153 TSecr=936009637"
103,43.676443,192.168.11.51,192.168.11.50,TCP,66,0.00903,,0.00903,"Jan  6, 2024 19:36:59.006841000 JST",,42482  >  6000 [ACK] Seq=29 Ack=2 Win=64256 Len=0 TSval=936009648 TSecr=914270153
104,51.894868,192.168.11.50,192.168.11.49,TCP,74,,,8.218425,"Jan  6, 2024 19:37:07.225266000 JST",,58460  >  6000 [SYN] Seq=0 Win=64240 Len=0 MSS=1460 SACK_PERM TSval=1300322947 TSecr=0 WS=128
105,51.90227,192.168.11.49,192.168.11.50,TCP,74,0.007402,,0.007402,"Jan  6, 2024 19:37:07.232668000 JST",,"6000  >  58460 [SYN, ACK] Seq=0 Ack=1 Win=65160 Len=0 MSS=1460 SACK_PERM TSval=3018253506 TSecr=1300322947 WS=128"
106,51.90238,192.168.11.50,192.168.11.49,TCP,66,0.00011,,0.00011,"Jan  6, 2024 19:37:07.232778000 JST",,58460  >  6000 [ACK] Seq=1 Ack=1 Win=64256 Len=0 TSval=1300322955 TSecr=3018253506
107,51.902564,192.168.11.50,192.168.11.49,TCP,93,,,0.000184,"Jan  6, 2024 19:37:07.232962000 JST",,"58460  >  6000 [PSH, ACK] Seq=1 Ack=1 Win=64256 Len=27 TSval=1300322955 TSecr=3018253506 [TCP segment of a reassembled PDU]"
108,51.902656,192.168.11.50,192.168.11.49,TCP,66,,,0.000092,"Jan  6, 2024 19:37:07.233054000 JST",,"58460  >  6000 [FIN, ACK] Seq=28 Ack=1 Win=64256 Len=0 TSval=1300322955 TSecr=3018253506"
109,51.913622,192.168.11.49,192.168.11.50,TCP,66,0.011058,,0.010966,"Jan  6, 2024 19:37:07.244020000 JST",,6000  >  58460 [ACK] Seq=1 Ack=28 Win=65152 Len=0 TSval=3018253517 TSecr=1300322955
110,51.914008,192.168.11.49,192.168.11.50,TCP,66,0.011352,,0.000386,"Jan  6, 2024 19:37:07.244406000 JST",,"6000  >  58460 [FIN, ACK] Seq=1 Ack=29 Win=65152 Len=0 TSval=3018253519 TSecr=1300322955"
111,51.914059,192.168.11.50,192.168.11.49,TCP,66,0.000051,,0.000051,"Jan  6, 2024 19:37:07.244457000 JST",,58460  >  6000 [ACK] Seq=29 Ack=2 Win=64256 Len=0 TSval=1300322967 TSecr=3018253519
112,51.944252,192.168.11.50,255.255.255.255,UDP,209,,Ÿ,0.030193,"Jan  6, 2024 19:37:07.274650000 JST",7b2273656d616e74696373223a207b22656e74697479223a2022504944222c202262617365656e74697479223a2022616e79222c2022726f6c65223a2022303131222c20227370617469616c223a2022616e79222c202274656d706f72616c223a2022616e79227d2c20226461746170726f7065727479223a207b22666f726d6174223a2022696e616f6b615f70726f6772616d5f73616d706c655f73656d616e746963227d7d,43223  >  7000 Len=167
113,51.952382,192.168.11.51,192.168.11.50,TCP,74,,œ,0.00813,"Jan  6, 2024 19:37:07.282780000 JST",,45420  >  6000 [SYN] Seq=0 Win=64240 Len=0 MSS=1460 SACK_PERM TSval=936017924 TSecr=0 WS=128
114,51.95253,192.168.11.50,192.168.11.51,TCP,74,0.000148,,0.000148,"Jan  6, 2024 19:37:07.282928000 JST",,"6000  >  45420 [SYN, ACK] Seq=0 Ack=1 Win=65160 Len=0 MSS=1460 SACK_PERM TSval=914278438 TSecr=936017924 WS=128"
115,51.959513,192.168.11.51,192.168.11.50,TCP,66,0.006983,,0.006983,"Jan  6, 2024 19:37:07.289911000 JST",,45420  >  6000 [ACK] Seq=1 Ack=1 Win=64256 Len=0 TSval=936017931 TSecr=914278438
116,51.960194,192.168.11.51,192.168.11.50,TCP,93,,,0.000681,"Jan  6, 2024 19:37:07.290592000 JST",,"45420  >  6000 [PSH, ACK] Seq=1 Ack=1 Win=64256 Len=27 TSval=936017931 TSecr=914278438 [TCP segment of a reassembled PDU]"
117,51.960304,192.168.11.50,192.168.11.51,TCP,66,0.00011,,0.00011,"Jan  6, 2024 19:37:07.290702000 JST",,6000  >  45420 [ACK] Seq=1 Ack=28 Win=65152 Len=0 TSval=914278446 TSecr=936017931
118,51.960373,192.168.11.51,192.168.11.50,TCP,66,,,0.000069,"Jan  6, 2024 19:37:07.290771000 JST",,"45420  >  6000 [FIN, ACK] Seq=28 Ack=1 Win=64256 Len=0 TSval=936017931 TSecr=914278438"
119,51.962595,192.168.11.50,192.168.11.51,TCP,66,0.002222,,0.002222,"Jan  6, 2024 19:37:07.292993000 JST",,"6000  >  45420 [FIN, ACK] Seq=1 Ack=29 Win=65152 Len=0 TSval=914278448 TSecr=936017931"
120,51.983185,192.168.11.51,192.168.11.50,TCP,66,0.02059,,0.02059,"Jan  6, 2024 19:37:07.313583000 JST",,45420  >  6000 [ACK] Seq=29 Ack=2 Win=64256 Len=0 TSval=936017951 TSecr=914278448
121,60.796402,192.168.11.50,192.168.11.49,TCP,74,,,8.813217,"Jan  6, 2024 19:37:16.126800000 JST",,55238  >  6000 [SYN] Seq=0 Win=64240 Len=0 MSS=1460 SACK_PERM TSval=1300331849 TSecr=0 WS=128
122,60.805859,192.168.11.49,192.168.11.50,TCP,74,0.009457,,0.009457,"Jan  6, 2024 19:37:16.136257000 JST",,"6000  >  55238 [SYN, ACK] Seq=0 Ack=1 Win=65160 Len=0 MSS=1460 SACK_PERM TSval=3018262410 TSecr=1300331849 WS=128"
123,60.805999,192.168.11.50,192.168.11.49,TCP,66,0.00014,,0.00014,"Jan  6, 2024 19:37:16.136397000 JST",,55238  >  6000 [ACK] Seq=1 Ack=1 Win=64256 Len=0 TSval=1300331859 TSecr=3018262410
124,60.806147,192.168.11.50,192.168.11.49,TCP,93,,,0.000148,"Jan  6, 2024 19:37:16.136545000 JST",,"55238  >  6000 [PSH, ACK] Seq=1 Ack=1 Win=64256 Len=27 TSval=1300331859 TSecr=3018262410 [TCP segment of a reassembled PDU]"
125,60.806261,192.168.11.50,192.168.11.49,TCP,66,,,0.000114,"Jan  6, 2024 19:37:16.136659000 JST",,"55238  >  6000 [FIN, ACK] Seq=28 Ack=1 Win=64256 Len=0 TSval=1300331859 TSecr=3018262410"
126,60.813641,192.168.11.49,192.168.11.50,TCP,66,0.007494,,0.00738,"Jan  6, 2024 19:37:16.144039000 JST",,6000  >  55238 [ACK] Seq=1 Ack=28 Win=65152 Len=0 TSval=3018262417 TSecr=1300331859
127,60.81655,192.168.11.49,192.168.11.50,TCP,66,0.010289,,0.002909,"Jan  6, 2024 19:37:16.146948000 JST",,"6000  >  55238 [FIN, ACK] Seq=1 Ack=29 Win=65152 Len=0 TSval=3018262420 TSecr=1300331859"
128,60.816603,192.168.11.50,192.168.11.49,TCP,66,0.000053,,0.000053,"Jan  6, 2024 19:37:16.147001000 JST",,55238  >  6000 [ACK] Seq=29 Ack=2 Win=64256 Len=0 TSval=1300331869 TSecr=3018262420
129,60.849752,192.168.11.50,255.255.255.255,UDP,209,,Ÿ,0.033149,"Jan  6, 2024 19:37:16.180150000 JST",7b2273656d616e74696373223a207b22656e74697479223a2022504944222c202262617365656e74697479223a2022616e79222c2022726f6c65223a2022303131222c20227370617469616c223a2022616e79222c202274656d706f72616c223a2022616e79227d2c20226461746170726f7065727479223a207b22666f726d6174223a2022696e616f6b615f70726f6772616d5f73616d706c655f73656d616e746963227d7d,46962  >  7000 Len=167
130,61.851677,192.168.11.50,255.255.255.255,UDP,209,,œ,1.001925,"Jan  6, 2024 19:37:17.182075000 JST",7b2273656d616e74696373223a207b22656e74697479223a2022504944222c202262617365656e74697479223a2022616e79222c2022726f6c65223a2022303131222c20227370617469616c223a2022616e79222c202274656d706f72616c223a2022616e79227d2c20226461746170726f7065727479223a207b22666f726d6174223a2022696e616f6b615f70726f6772616d5f73616d706c655f73656d616e746963227d7d,46962  >  7000 Len=167
131,61.860052,192.168.11.51,192.168.11.50,TCP,74,,œ,0.008375,"Jan  6, 2024 19:37:17.190450000 JST",,38486  >  6000 [SYN] Seq=0 Win=64240 Len=0 MSS=1460 SACK_PERM TSval=936027832 TSecr=0 WS=128
132,61.860193,192.168.11.50,192.168.11.51,TCP,74,0.000141,,0.000141,"Jan  6, 2024 19:37:17.190591000 JST",,"6000  >  38486 [SYN, ACK] Seq=0 Ack=1 Win=65160 Len=0 MSS=1460 SACK_PERM TSval=914288346 TSecr=936027832 WS=128"
133,61.867161,192.168.11.51,192.168.11.50,TCP,66,0.006968,,0.006968,"Jan  6, 2024 19:37:17.197559000 JST",,38486  >  6000 [ACK] Seq=1 Ack=1 Win=64256 Len=0 TSval=936027838 TSecr=914288346
134,61.867711,192.168.11.51,192.168.11.50,TCP,93,,,0.00055,"Jan  6, 2024 19:37:17.198109000 JST",,"38486  >  6000 [PSH, ACK] Seq=1 Ack=1 Win=64256 Len=27 TSval=936027839 TSecr=914288346 [TCP segment of a reassembled PDU]"
135,61.86779,192.168.11.50,192.168.11.51,TCP,66,0.000079,,0.000079,"Jan  6, 2024 19:37:17.198188000 JST",,6000  >  38486 [ACK] Seq=1 Ack=28 Win=65152 Len=0 TSval=914288353 TSecr=936027839
136,61.86787,192.168.11.51,192.168.11.50,TCP,66,,,0.00008,"Jan  6, 2024 19:37:17.198268000 JST",,"38486  >  6000 [FIN, ACK] Seq=28 Ack=1 Win=64256 Len=0 TSval=936027839 TSecr=914288346"
137,61.868793,192.168.11.50,192.168.11.51,TCP,66,0.000923,,0.000923,"Jan  6, 2024 19:37:17.199191000 JST",,"6000  >  38486 [FIN, ACK] Seq=1 Ack=29 Win=65152 Len=0 TSval=914288354 TSecr=936027839"
138,61.876583,192.168.11.51,192.168.11.50,TCP,66,0.00779,,0.00779,"Jan  6, 2024 19:37:17.206981000 JST",,38486  >  6000 [ACK] Seq=29 Ack=2 Win=64256 Len=0 TSval=936027846 TSecr=914288354
139,72.698524,192.168.11.50,192.168.11.49,TCP,74,,,10.821941,"Jan  6, 2024 19:37:28.028922000 JST",,38282  >  6000 [SYN] Seq=0 Win=64240 Len=0 MSS=1460 SACK_PERM TSval=1300343751 TSecr=0 WS=128
140,72.705851,192.168.11.49,192.168.11.50,TCP,74,0.007327,,0.007327,"Jan  6, 2024 19:37:28.036249000 JST",,"6000  >  38282 [SYN, ACK] Seq=0 Ack=1 Win=65160 Len=0 MSS=1460 SACK_PERM TSval=3018274310 TSecr=1300343751 WS=128"
141,72.705994,192.168.11.50,192.168.11.49,TCP,66,0.000143,,0.000143,"Jan  6, 2024 19:37:28.036392000 JST",,38282  >  6000 [ACK] Seq=1 Ack=1 Win=64256 Len=0 TSval=1300343759 TSecr=3018274310
142,72.70623,192.168.11.50,192.168.11.49,TCP,93,,,0.000236,"Jan  6, 2024 19:37:28.036628000 JST",,"38282  >  6000 [PSH, ACK] Seq=1 Ack=1 Win=64256 Len=27 TSval=1300343759 TSecr=3018274310 [TCP segment of a reassembled PDU]"
143,72.706343,192.168.11.50,192.168.11.49,TCP,66,,,0.000113,"Jan  6, 2024 19:37:28.036741000 JST",,"38282  >  6000 [FIN, ACK] Seq=28 Ack=1 Win=64256 Len=0 TSval=1300343759 TSecr=3018274310"
144,72.714063,192.168.11.49,192.168.11.50,TCP,66,0.007833,,0.00772,"Jan  6, 2024 19:37:28.044461000 JST",,6000  >  38282 [ACK] Seq=1 Ack=28 Win=65152 Len=0 TSval=3018274318 TSecr=1300343759
145,72.716557,192.168.11.49,192.168.11.50,TCP,66,0.010214,,0.002494,"Jan  6, 2024 19:37:28.046955000 JST",,"6000  >  38282 [FIN, ACK] Seq=1 Ack=29 Win=65152 Len=0 TSval=3018274320 TSecr=1300343759"
146,72.716612,192.168.11.50,192.168.11.49,TCP,66,0.000055,,0.000055,"Jan  6, 2024 19:37:28.047010000 JST",,38282  >  6000 [ACK] Seq=29 Ack=2 Win=64256 Len=0 TSval=1300343769 TSecr=3018274320
147,72.746687,192.168.11.50,255.255.255.255,UDP,209,,Ÿ,0.030075,"Jan  6, 2024 19:37:28.077085000 JST",7b2273656d616e74696373223a207b22656e74697479223a2022504944222c202262617365656e74697479223a2022616e79222c2022726f6c65223a2022303131222c20227370617469616c223a2022616e79222c202274656d706f72616c223a2022616e79227d2c20226461746170726f7065727479223a207b22666f726d6174223a2022696e616f6b615f70726f6772616d5f73616d706c655f73656d616e746963227d7d,58701  >  7000 Len=167
148,72.757496,192.168.11.51,192.168.11.50,TCP,74,,œ,0.010809,"Jan  6, 2024 19:37:28.087894000 JST",,37536  >  6000 [SYN] Seq=0 Win=64240 Len=0 MSS=1460 SACK_PERM TSval=936038729 TSecr=0 WS=128
149,72.757682,192.168.11.50,192.168.11.51,TCP,74,0.000186,,0.000186,"Jan  6, 2024 19:37:28.088080000 JST",,"6000  >  37536 [SYN, ACK] Seq=0 Ack=1 Win=65160 Len=0 MSS=1460 SACK_PERM TSval=914299243 TSecr=936038729 WS=128"
150,72.764656,192.168.11.51,192.168.11.50,TCP,66,0.006974,,0.006974,"Jan  6, 2024 19:37:28.095054000 JST",,37536  >  6000 [ACK] Seq=1 Ack=1 Win=64256 Len=0 TSval=936038736 TSecr=914299243
151,72.76537,192.168.11.51,192.168.11.50,TCP,93,,,0.000714,"Jan  6, 2024 19:37:28.095768000 JST",,"37536  >  6000 [PSH, ACK] Seq=1 Ack=1 Win=64256 Len=27 TSval=936038736 TSecr=914299243 [TCP segment of a reassembled PDU]"
152,72.765522,192.168.11.50,192.168.11.51,TCP,66,0.000152,,0.000152,"Jan  6, 2024 19:37:28.095920000 JST",,6000  >  37536 [ACK] Seq=1 Ack=28 Win=65152 Len=0 TSval=914299251 TSecr=936038736
153,72.765604,192.168.11.51,192.168.11.50,TCP,66,,,0.000082,"Jan  6, 2024 19:37:28.096002000 JST",,"37536  >  6000 [FIN, ACK] Seq=28 Ack=1 Win=64256 Len=0 TSval=936038736 TSecr=914299243"
154,72.767471,192.168.11.50,192.168.11.51,TCP,66,0.001867,,0.001867,"Jan  6, 2024 19:37:28.097869000 JST",,"6000  >  37536 [FIN, ACK] Seq=1 Ack=29 Win=65152 Len=0 TSval=914299253 TSecr=936038736"
155,72.772302,192.168.11.51,192.168.11.50,TCP,66,0.004831,,0.004831,"Jan  6, 2024 19:37:28.102700000 JST",,37536  >  6000 [ACK] Seq=29 Ack=2 Win=64256 Len=0 TSval=936038744 TSecr=914299253
156,81.60974,192.168.11.50,192.168.11.49,TCP,74,,,8.837438,"Jan  6, 2024 19:37:36.940138000 JST",,40880  >  6000 [SYN] Seq=0 Win=64240 Len=0 MSS=1460 SACK_PERM TSval=1300352662 TSecr=0 WS=128
157,81.61642,192.168.11.49,192.168.11.50,TCP,74,0.00668,,0.00668,"Jan  6, 2024 19:37:36.946818000 JST",,"6000  >  40880 [SYN, ACK] Seq=0 Ack=1 Win=65160 Len=0 MSS=1460 SACK_PERM TSval=3018283220 TSecr=1300352662 WS=128"
158,81.61654,192.168.11.50,192.168.11.49,TCP,66,0.00012,,0.00012,"Jan  6, 2024 19:37:36.946938000 JST",,40880  >  6000 [ACK] Seq=1 Ack=1 Win=64256 Len=0 TSval=1300352669 TSecr=3018283220
159,81.616697,192.168.11.50,192.168.11.49,TCP,93,,,0.000157,"Jan  6, 2024 19:37:36.947095000 JST",,"40880  >  6000 [PSH, ACK] Seq=1 Ack=1 Win=64256 Len=27 TSval=1300352669 TSecr=3018283220 [TCP segment of a reassembled PDU]"
160,81.616796,192.168.11.50,192.168.11.49,TCP,66,,,0.000099,"Jan  6, 2024 19:37:36.947194000 JST",,"40880  >  6000 [FIN, ACK] Seq=28 Ack=1 Win=64256 Len=0 TSval=1300352669 TSecr=3018283220"
161,81.625164,192.168.11.49,192.168.11.50,TCP,66,0.008467,,0.008368,"Jan  6, 2024 19:37:36.955562000 JST",,6000  >  40880 [ACK] Seq=1 Ack=28 Win=65152 Len=0 TSval=3018283229 TSecr=1300352669
162,81.62724,192.168.11.49,192.168.11.50,TCP,66,0.010444,,0.002076,"Jan  6, 2024 19:37:36.957638000 JST",,"6000  >  40880 [FIN, ACK] Seq=1 Ack=29 Win=65152 Len=0 TSval=3018283231 TSecr=1300352669"
163,81.627295,192.168.11.50,192.168.11.49,TCP,66,0.000055,,0.000055,"Jan  6, 2024 19:37:36.957693000 JST",,40880  >  6000 [ACK] Seq=29 Ack=2 Win=64256 Len=0 TSval=1300352680 TSecr=3018283231
164,81.656394,192.168.11.50,255.255.255.255,UDP,209,,Ÿ,0.029099,"Jan  6, 2024 19:37:36.986792000 JST",7b2273656d616e74696373223a207b22656e74697479223a2022504944222c202262617365656e74697479223a2022616e79222c2022726f6c65223a2022303131222c20227370617469616c223a2022616e79222c202274656d706f72616c223a2022616e79227d2c20226461746170726f7065727479223a207b22666f726d6174223a2022696e616f6b615f70726f6772616d5f73616d706c655f73656d616e746963227d7d,54277  >  7000 Len=167
165,81.666503,192.168.11.51,192.168.11.50,TCP,74,,œ,0.010109,"Jan  6, 2024 19:37:36.996901000 JST",,55910  >  6000 [SYN] Seq=0 Win=64240 Len=0 MSS=1460 SACK_PERM TSval=936047638 TSecr=0 WS=128
166,81.666661,192.168.11.50,192.168.11.51,TCP,74,0.000158,,0.000158,"Jan  6, 2024 19:37:36.997059000 JST",,"6000  >  55910 [SYN, ACK] Seq=0 Ack=1 Win=65160 Len=0 MSS=1460 SACK_PERM TSval=914308152 TSecr=936047638 WS=128"
167,81.673367,192.168.11.51,192.168.11.50,TCP,66,0.006706,,0.006706,"Jan  6, 2024 19:37:37.003765000 JST",,55910  >  6000 [ACK] Seq=1 Ack=1 Win=64256 Len=0 TSval=936047645 TSecr=914308152
168,81.674247,192.168.11.51,192.168.11.50,TCP,93,,,0.00088,"Jan  6, 2024 19:37:37.004645000 JST",,"55910  >  6000 [PSH, ACK] Seq=1 Ack=1 Win=64256 Len=27 TSval=936047645 TSecr=914308152 [TCP segment of a reassembled PDU]"
169,81.674393,192.168.11.50,192.168.11.51,TCP,66,0.000146,,0.000146,"Jan  6, 2024 19:37:37.004791000 JST",,6000  >  55910 [ACK] Seq=1 Ack=28 Win=65152 Len=0 TSval=914308160 TSecr=936047645
170,81.674483,192.168.11.51,192.168.11.50,TCP,66,,,0.00009,"Jan  6, 2024 19:37:37.004881000 JST",,"55910  >  6000 [FIN, ACK] Seq=28 Ack=1 Win=64256 Len=0 TSval=936047645 TSecr=914308152"
171,81.675679,192.168.11.50,192.168.11.51,TCP,66,0.001196,,0.001196,"Jan  6, 2024 19:37:37.006077000 JST",,"6000  >  55910 [FIN, ACK] Seq=1 Ack=29 Win=65152 Len=0 TSval=914308161 TSecr=936047645"
172,81.682283,192.168.11.51,192.168.11.50,TCP,66,0.006604,,0.006604,"Jan  6, 2024 19:37:37.012681000 JST",,55910  >  6000 [ACK] Seq=29 Ack=2 Win=64256 Len=0 TSval=936047653 TSecr=914308161
173,112.771925,192.168.11.50,192.168.11.49,TCP,74,,,31.089642,"Jan  6, 2024 19:38:08.102323000 JST",,60800  >  6000 [SYN] Seq=0 Win=64240 Len=0 MSS=1460 SACK_PERM TSval=1300383824 TSecr=0 WS=128
174,112.778551,192.168.11.49,192.168.11.50,TCP,74,0.006626,,0.006626,"Jan  6, 2024 19:38:08.108949000 JST",,"6000  >  60800 [SYN, ACK] Seq=0 Ack=1 Win=65160 Len=0 MSS=1460 SACK_PERM TSval=3018314383 TSecr=1300383824 WS=128"
175,112.778683,192.168.11.50,192.168.11.49,TCP,66,0.000132,,0.000132,"Jan  6, 2024 19:38:08.109081000 JST",,60800  >  6000 [ACK] Seq=1 Ack=1 Win=64256 Len=0 TSval=1300383831 TSecr=3018314383
176,112.778829,192.168.11.50,192.168.11.49,TCP,93,,,0.000146,"Jan  6, 2024 19:38:08.109227000 JST",,"60800  >  6000 [PSH, ACK] Seq=1 Ack=1 Win=64256 Len=27 TSval=1300383831 TSecr=3018314383 [TCP segment of a reassembled PDU]"
177,112.77894,192.168.11.50,192.168.11.49,TCP,66,,,0.000111,"Jan  6, 2024 19:38:08.109338000 JST",,"60800  >  6000 [FIN, ACK] Seq=28 Ack=1 Win=64256 Len=0 TSval=1300383832 TSecr=3018314383"
178,112.78604,192.168.11.49,192.168.11.50,TCP,66,0.007211,,0.0071,"Jan  6, 2024 19:38:08.116438000 JST",,6000  >  60800 [ACK] Seq=1 Ack=28 Win=65152 Len=0 TSval=3018314390 TSecr=1300383831
179,112.786433,192.168.11.49,192.168.11.50,TCP,66,0.007493,,0.000393,"Jan  6, 2024 19:38:08.116831000 JST",,"6000  >  60800 [FIN, ACK] Seq=1 Ack=29 Win=65152 Len=0 TSval=3018314391 TSecr=1300383832"
180,112.786494,192.168.11.50,192.168.11.49,TCP,66,0.000061,,0.000061,"Jan  6, 2024 19:38:08.116892000 JST",,60800  >  6000 [ACK] Seq=29 Ack=2 Win=64256 Len=0 TSval=1300383839 TSecr=3018314391
181,112.81886,192.168.11.50,255.255.255.255,UDP,209,,Ÿ,0.032366,"Jan  6, 2024 19:38:08.149258000 JST",7b2273656d616e74696373223a207b22656e74697479223a2022504944222c202262617365656e74697479223a2022616e79222c2022726f6c65223a2022303131222c20227370617469616c223a2022616e79222c202274656d706f72616c223a2022616e79227d2c20226461746170726f7065727479223a207b22666f726d6174223a2022696e616f6b615f70726f6772616d5f73616d706c655f73656d616e746963227d7d,55765  >  7000 Len=167
182,112.831613,192.168.11.51,192.168.11.50,TCP,74,,œ,0.012753,"Jan  6, 2024 19:38:08.162011000 JST",,48836  >  6000 [SYN] Seq=0 Win=64240 Len=0 MSS=1460 SACK_PERM TSval=936078801 TSecr=0 WS=128
183,112.831792,192.168.11.50,192.168.11.51,TCP,74,0.000179,,0.000179,"Jan  6, 2024 19:38:08.162190000 JST",,"6000  >  48836 [SYN, ACK] Seq=0 Ack=1 Win=65160 Len=0 MSS=1460 SACK_PERM TSval=914339317 TSecr=936078801 WS=128"
