No.,Time,Source,Destination,Protocol,Length,The RTT to ACK the segment was,XXX,Time delta from previous captured frame,Arrival Time,Data,Info
1,0,192.168.11.6,192.168.11.34,TCP,74,,,0,"Jan  6, 2024 19:36:13.258440000 JST",,33512  >  6000 [SYN] Seq=0 Win=64240 Len=0 MSS=1460 SACK_PERM TSval=926601118 TSecr=0 WS=128
2,0.008027,192.168.11.34,192.168.11.6,TCP,74,0.008027,,0.008027,"Jan  6, 2024 19:36:13.266467000 JST",,"6000  >  33512 [SYN, ACK] Seq=0 Ack=1 Win=65160 Len=0 MSS=1460 SACK_PERM TSval=3541683555 TSecr=926601118 WS=128"
3,0.008138,192.168.11.6,192.168.11.34,TCP,66,0.000111,,0.000111,"Jan  6, 2024 19:36:13.266578000 JST",,33512  >  6000 [ACK] Seq=1 Ack=1 Win=64256 Len=0 TSval=926601132 TSecr=3541683555
4,0.008311,192.168.11.6,192.168.11.34,TCP,93,,,0.000173,"Jan  6, 2024 19:36:13.266751000 JST",,"33512  >  6000 [PSH, ACK] Seq=1 Ack=1 Win=64256 Len=27 TSval=926601132 TSecr=3541683555 [TCP segment of a reassembled PDU]"
5,0.008459,192.168.11.6,192.168.11.34,TCP,66,,,0.000148,"Jan  6, 2024 19:36:13.266899000 JST",,"33512  >  6000 [FIN, ACK] Seq=28 Ack=1 Win=64256 Len=0 TSval=926601132 TSecr=3541683555"
6,0.018971,192.168.11.34,192.168.11.6,TCP,66,0.01066,,0.010512,"Jan  6, 2024 19:36:13.277411000 JST",,6000  >  33512 [ACK] Seq=1 Ack=28 Win=65152 Len=0 TSval=3541683566 TSecr=926601132
7,0.01919,192.168.11.34,192.168.11.6,TCP,66,0.010731,,0.000219,"Jan  6, 2024 19:36:13.277630000 JST",,"6000  >  33512 [FIN, ACK] Seq=1 Ack=29 Win=65152 Len=0 TSval=3541683568 TSecr=926601132"
8,0.019237,192.168.11.6,192.168.11.34,TCP,66,0.000047,,0.000047,"Jan  6, 2024 19:36:13.277677000 JST",,33512  >  6000 [ACK] Seq=29 Ack=2 Win=64256 Len=0 TSval=926601143 TSecr=3541683568
9,0.053656,192.168.11.6,255.255.255.255,UDP,209,,Ÿ,0.034419,"Jan  6, 2024 19:36:13.312096000 JST",7b2273656d616e74696373223a207b22656e74697479223a2022504944222c202262617365656e74697479223a2022616e79222c2022726f6c65223a2022323232222c20227370617469616c223a2022616e79222c202274656d706f72616c223a2022616e79227d2c20226461746170726f7065727479223a207b22666f726d6174223a2022696e616f6b615f70726f6772616d5f73616d706c655f73656d616e746963227d7d,58373  >  7000 Len=167
10,0.065937,192.168.11.29,192.168.11.6,TCP,74,,œ,0.012281,"Jan  6, 2024 19:36:13.324377000 JST",,60928  >  6000 [SYN] Seq=0 Win=64240 Len=0 MSS=1460 SACK_PERM TSval=667311304 TSecr=0 WS=128
11,0.066131,192.168.11.6,192.168.11.29,TCP,74,0.000194,,0.000194,"Jan  6, 2024 19:36:13.324571000 JST",,"6000  >  60928 [SYN, ACK] Seq=0 Ack=1 Win=65160 Len=0 MSS=1460 SACK_PERM TSval=526245519 TSecr=667311304 WS=128"
12,0.073327,192.168.11.29,192.168.11.6,TCP,66,0.007196,,0.007196,"Jan  6, 2024 19:36:13.331767000 JST",,60928  >  6000 [ACK] Seq=1 Ack=1 Win=64256 Len=0 TSval=667311316 TSecr=526245519
13,0.073951,192.168.11.29,192.168.11.6,TCP,93,,,0.000624,"Jan  6, 2024 19:36:13.332391000 JST",,"60928  >  6000 [PSH, ACK] Seq=1 Ack=1 Win=64256 Len=27 TSval=667311316 TSecr=526245519 [TCP segment of a reassembled PDU]"
14,0.074027,192.168.11.6,192.168.11.29,TCP,66,0.000076,,0.000076,"Jan  6, 2024 19:36:13.332467000 JST",,6000  >  60928 [ACK] Seq=1 Ack=28 Win=65152 Len=0 TSval=526245527 TSecr=667311316
15,0.074232,192.168.11.29,192.168.11.6,TCP,66,,,0.000205,"Jan  6, 2024 19:36:13.332672000 JST",,"60928  >  6000 [FIN, ACK] Seq=28 Ack=1 Win=64256 Len=0 TSval=667311316 TSecr=526245519"
16,0.07601,192.168.11.6,192.168.11.29,TCP,66,0.001778,,0.001778,"Jan  6, 2024 19:36:13.334450000 JST",,"6000  >  60928 [FIN, ACK] Seq=1 Ack=29 Win=65152 Len=0 TSval=526245529 TSecr=667311316"
17,0.082452,192.168.11.29,192.168.11.6,TCP,66,0.006442,,0.006442,"Jan  6, 2024 19:36:13.340892000 JST",,60928  >  6000 [ACK] Seq=29 Ack=2 Win=64256 Len=0 TSval=667311324 TSecr=526245529
18,9.292457,192.168.11.6,192.168.11.34,TCP,74,,,9.210005,"Jan  6, 2024 19:36:22.550897000 JST",,46562  >  6000 [SYN] Seq=0 Win=64240 Len=0 MSS=1460 SACK_PERM TSval=926610416 TSecr=0 WS=128
19,9.301551,192.168.11.34,192.168.11.6,TCP,74,0.009094,,0.009094,"Jan  6, 2024 19:36:22.559991000 JST",,"6000  >  46562 [SYN, ACK] Seq=0 Ack=1 Win=65160 Len=0 MSS=1460 SACK_PERM TSval=3541692849 TSecr=926610416 WS=128"
20,9.301658,192.168.11.6,192.168.11.34,TCP,66,0.000107,,0.000107,"Jan  6, 2024 19:36:22.560098000 JST",,46562  >  6000 [ACK] Seq=1 Ack=1 Win=64256 Len=0 TSval=926610425 TSecr=3541692849
21,9.301837,192.168.11.6,192.168.11.34,TCP,93,,,0.000179,"Jan  6, 2024 19:36:22.560277000 JST",,"46562  >  6000 [PSH, ACK] Seq=1 Ack=1 Win=64256 Len=27 TSval=926610425 TSecr=3541692849 [TCP segment of a reassembled PDU]"
22,9.301985,192.168.11.6,192.168.11.34,TCP,66,,,0.000148,"Jan  6, 2024 19:36:22.560425000 JST",,"46562  >  6000 [FIN, ACK] Seq=28 Ack=1 Win=64256 Len=0 TSval=926610425 TSecr=3541692849"
23,9.309314,192.168.11.34,192.168.11.6,TCP,66,0.007477,,0.007329,"Jan  6, 2024 19:36:22.567754000 JST",,6000  >  46562 [ACK] Seq=1 Ack=28 Win=65152 Len=0 TSval=3541692857 TSecr=926610425
24,9.309526,192.168.11.34,192.168.11.6,TCP,66,0.007541,,0.000212,"Jan  6, 2024 19:36:22.567966000 JST",,"6000  >  46562 [FIN, ACK] Seq=1 Ack=29 Win=65152 Len=0 TSval=3541692858 TSecr=926610425"
25,9.309571,192.168.11.6,192.168.11.34,TCP,66,0.000045,,0.000045,"Jan  6, 2024 19:36:22.568011000 JST",,46562  >  6000 [ACK] Seq=29 Ack=2 Win=64256 Len=0 TSval=926610433 TSecr=3541692858
26,9.342232,192.168.11.6,255.255.255.255,UDP,209,,Ÿ,0.032661,"Jan  6, 2024 19:36:22.600672000 JST",7b2273656d616e74696373223a207b22656e74697479223a2022504944222c202262617365656e74697479223a2022616e79222c2022726f6c65223a2022323232222c20227370617469616c223a2022616e79222c202274656d706f72616c223a2022616e79227d2c20226461746170726f7065727479223a207b22666f726d6174223a2022696e616f6b615f70726f6772616d5f73616d706c655f73656d616e746963227d7d,52934  >  7000 Len=167
27,9.349921,192.168.11.29,192.168.11.6,TCP,74,,œ,0.007689,"Jan  6, 2024 19:36:22.608361000 JST",,52640  >  6000 [SYN] Seq=0 Win=64240 Len=0 MSS=1460 SACK_PERM TSval=667320593 TSecr=0 WS=128
28,9.350126,192.168.11.6,192.168.11.29,TCP,74,0.000205,,0.000205,"Jan  6, 2024 19:36:22.608566000 JST",,"6000  >  52640 [SYN, ACK] Seq=0 Ack=1 Win=65160 Len=0 MSS=1460 SACK_PERM TSval=526254803 TSecr=667320593 WS=128"
29,9.356875,192.168.11.29,192.168.11.6,TCP,66,0.006749,,0.006749,"Jan  6, 2024 19:36:22.615315000 JST",,52640  >  6000 [ACK] Seq=1 Ack=1 Win=64256 Len=0 TSval=667320600 TSecr=526254803
30,9.357405,192.168.11.29,192.168.11.6,TCP,93,,,0.00053,"Jan  6, 2024 19:36:22.615845000 JST",,"52640  >  6000 [PSH, ACK] Seq=1 Ack=1 Win=64256 Len=27 TSval=667320600 TSecr=526254803 [TCP segment of a reassembled PDU]"
31,9.357479,192.168.11.6,192.168.11.29,TCP,66,0.000074,,0.000074,"Jan  6, 2024 19:36:22.615919000 JST",,6000  >  52640 [ACK] Seq=1 Ack=28 Win=65152 Len=0 TSval=526254811 TSecr=667320600
32,9.357545,192.168.11.29,192.168.11.6,TCP,66,,,0.000066,"Jan  6, 2024 19:36:22.615985000 JST",,"52640  >  6000 [FIN, ACK] Seq=28 Ack=1 Win=64256 Len=0 TSval=667320600 TSecr=526254803"
33,9.358912,192.168.11.6,192.168.11.29,TCP,66,0.001367,,0.001367,"Jan  6, 2024 19:36:22.617352000 JST",,"6000  >  52640 [FIN, ACK] Seq=1 Ack=29 Win=65152 Len=0 TSval=526254812 TSecr=667320600"
34,9.374952,192.168.11.29,192.168.11.6,TCP,66,0.01604,,0.01604,"Jan  6, 2024 19:36:22.633392000 JST",,52640  >  6000 [ACK] Seq=29 Ack=2 Win=64256 Len=0 TSval=667320612 TSecr=526254812
35,19.136576,192.168.11.6,192.168.11.34,TCP,74,,,9.761624,"Jan  6, 2024 19:36:32.395016000 JST",,38844  >  6000 [SYN] Seq=0 Win=64240 Len=0 MSS=1460 SACK_PERM TSval=926620260 TSecr=0 WS=128
36,19.144778,192.168.11.34,192.168.11.6,TCP,74,0.008202,,0.008202,"Jan  6, 2024 19:36:32.403218000 JST",,"6000  >  38844 [SYN, ACK] Seq=0 Ack=1 Win=65160 Len=0 MSS=1460 SACK_PERM TSval=3541702692 TSecr=926620260 WS=128"
37,19.144886,192.168.11.6,192.168.11.34,TCP,66,0.000108,,0.000108,"Jan  6, 2024 19:36:32.403326000 JST",,38844  >  6000 [ACK] Seq=1 Ack=1 Win=64256 Len=0 TSval=926620268 TSecr=3541702692
38,19.145152,192.168.11.6,192.168.11.34,TCP,93,,,0.000266,"Jan  6, 2024 19:36:32.403592000 JST",,"38844  >  6000 [PSH, ACK] Seq=1 Ack=1 Win=64256 Len=27 TSval=926620269 TSecr=3541702692 [TCP segment of a reassembled PDU]"
39,19.145261,192.168.11.6,192.168.11.34,TCP,66,,,0.000109,"Jan  6, 2024 19:36:32.403701000 JST",,"38844  >  6000 [FIN, ACK] Seq=28 Ack=1 Win=64256 Len=0 TSval=926620269 TSecr=3541702692"
40,19.152237,192.168.11.34,192.168.11.6,TCP,66,0.007085,,0.006976,"Jan  6, 2024 19:36:32.410677000 JST",,6000  >  38844 [ACK] Seq=1 Ack=28 Win=65152 Len=0 TSval=3541702699 TSecr=926620269
41,19.152595,192.168.11.34,192.168.11.6,TCP,66,0.007334,,0.000358,"Jan  6, 2024 19:36:32.411035000 JST",,"6000  >  38844 [FIN, ACK] Seq=1 Ack=29 Win=65152 Len=0 TSval=3541702701 TSecr=926620269"
42,19.152641,192.168.11.6,192.168.11.34,TCP,66,0.000046,,0.000046,"Jan  6, 2024 19:36:32.411081000 JST",,38844  >  6000 [ACK] Seq=29 Ack=2 Win=64256 Len=0 TSval=926620276 TSecr=3541702701
43,19.185306,192.168.11.6,255.255.255.255,UDP,209,,Ÿ,0.032665,"Jan  6, 2024 19:36:32.443746000 JST",7b2273656d616e74696373223a207b22656e74697479223a2022504944222c202262617365656e74697479223a2022616e79222c2022726f6c65223a2022323232222c20227370617469616c223a2022616e79222c202274656d706f72616c223a2022616e79227d2c20226461746170726f7065727479223a207b22666f726d6174223a2022696e616f6b615f70726f6772616d5f73616d706c655f73656d616e746963227d7d,60676  >  7000 Len=167
44,19.193644,192.168.11.29,192.168.11.6,TCP,74,,œ,0.008338,"Jan  6, 2024 19:36:32.452084000 JST",,45170  >  6000 [SYN] Seq=0 Win=64240 Len=0 MSS=1460 SACK_PERM TSval=667330436 TSecr=0 WS=128
45,19.193806,192.168.11.6,192.168.11.29,TCP,74,0.000162,,0.000162,"Jan  6, 2024 19:36:32.452246000 JST",,"6000  >  45170 [SYN, ACK] Seq=0 Ack=1 Win=65160 Len=0 MSS=1460 SACK_PERM TSval=526264647 TSecr=667330436 WS=128"
46,19.200847,192.168.11.29,192.168.11.6,TCP,66,0.007041,,0.007041,"Jan  6, 2024 19:36:32.459287000 JST",,45170  >  6000 [ACK] Seq=1 Ack=1 Win=64256 Len=0 TSval=667330443 TSecr=526264647
47,19.201281,192.168.11.29,192.168.11.6,TCP,93,,,0.000434,"Jan  6, 2024 19:36:32.459721000 JST",,"45170  >  6000 [PSH, ACK] Seq=1 Ack=1 Win=64256 Len=27 TSval=667330444 TSecr=526264647 [TCP segment of a reassembled PDU]"
48,19.201338,192.168.11.6,192.168.11.29,TCP,66,0.000057,,0.000057,"Jan  6, 2024 19:36:32.459778000 JST",,6000  >  45170 [ACK] Seq=1 Ack=28 Win=65152 Len=0 TSval=526264655 TSecr=667330444
49,19.201391,192.168.11.29,192.168.11.6,TCP,66,,,0.000053,"Jan  6, 2024 19:36:32.459831000 JST",,"45170  >  6000 [FIN, ACK] Seq=28 Ack=1 Win=64256 Len=0 TSval=667330444 TSecr=526264647"
50,19.203343,192.168.11.6,192.168.11.29,TCP,66,0.001952,,0.001952,"Jan  6, 2024 19:36:32.461783000 JST",,"6000  >  45170 [FIN, ACK] Seq=1 Ack=29 Win=65152 Len=0 TSval=526264657 TSecr=667330444"
51,19.207913,192.168.11.29,192.168.11.6,TCP,66,0.00457,,0.00457,"Jan  6, 2024 19:36:32.466353000 JST",,45170  >  6000 [ACK] Seq=29 Ack=2 Win=64256 Len=0 TSval=667330451 TSecr=526264657
52,29.07348,192.168.11.6,192.168.11.34,TCP,74,,,9.865567,"Jan  6, 2024 19:36:42.331920000 JST",,53156  >  6000 [SYN] Seq=0 Win=64240 Len=0 MSS=1460 SACK_PERM TSval=926630197 TSecr=0 WS=128
53,29.080272,192.168.11.34,192.168.11.6,TCP,74,0.006792,,0.006792,"Jan  6, 2024 19:36:42.338712000 JST",,"6000  >  53156 [SYN, ACK] Seq=0 Ack=1 Win=65160 Len=0 MSS=1460 SACK_PERM TSval=3541712628 TSecr=926630197 WS=128"
54,29.080373,192.168.11.6,192.168.11.34,TCP,66,0.000101,,0.000101,"Jan  6, 2024 19:36:42.338813000 JST",,53156  >  6000 [ACK] Seq=1 Ack=1 Win=64256 Len=0 TSval=926630204 TSecr=3541712628
55,29.080496,192.168.11.6,192.168.11.34,TCP,93,,,0.000123,"Jan  6, 2024 19:36:42.338936000 JST",,"53156  >  6000 [PSH, ACK] Seq=1 Ack=1 Win=64256 Len=27 TSval=926630204 TSecr=3541712628 [TCP segment of a reassembled PDU]"
56,29.080606,192.168.11.6,192.168.11.34,TCP,66,,,0.00011,"Jan  6, 2024 19:36:42.339046000 JST",,"53156  >  6000 [FIN, ACK] Seq=28 Ack=1 Win=64256 Len=0 TSval=926630204 TSecr=3541712628"
57,29.087767,192.168.11.34,192.168.11.6,TCP,66,0.007271,,0.007161,"Jan  6, 2024 19:36:42.346207000 JST",,6000  >  53156 [ACK] Seq=1 Ack=28 Win=65152 Len=0 TSval=3541712635 TSecr=926630204
58,29.088135,192.168.11.34,192.168.11.6,TCP,66,0.007529,,0.000368,"Jan  6, 2024 19:36:42.346575000 JST",,"6000  >  53156 [FIN, ACK] Seq=1 Ack=29 Win=65152 Len=0 TSval=3541712636 TSecr=926630204"
59,29.088185,192.168.11.6,192.168.11.34,TCP,66,0.00005,,0.00005,"Jan  6, 2024 19:36:42.346625000 JST",,53156  >  6000 [ACK] Seq=29 Ack=2 Win=64256 Len=0 TSval=926630212 TSecr=3541712636
60,29.12027,192.168.11.6,255.255.255.255,UDP,209,,Ÿ,0.032085,"Jan  6, 2024 19:36:42.378710000 JST",7b2273656d616e74696373223a207b22656e74697479223a2022504944222c202262617365656e74697479223a2022616e79222c2022726f6c65223a2022323232222c20227370617469616c223a2022616e79222c202274656d706f72616c223a2022616e79227d2c20226461746170726f7065727479223a207b22666f726d6174223a2022696e616f6b615f70726f6772616d5f73616d706c655f73656d616e746963227d7d,42814  >  7000 Len=167
61,29.128292,192.168.11.29,192.168.11.6,TCP,74,,œ,0.008022,"Jan  6, 2024 19:36:42.386732000 JST",,54044  >  6000 [SYN] Seq=0 Win=64240 Len=0 MSS=1460 SACK_PERM TSval=667340371 TSecr=0 WS=128
62,29.128442,192.168.11.6,192.168.11.29,TCP,74,0.00015,,0.00015,"Jan  6, 2024 19:36:42.386882000 JST",,"6000  >  54044 [SYN, ACK] Seq=0 Ack=1 Win=65160 Len=0 MSS=1460 SACK_PERM TSval=526274582 TSecr=667340371 WS=128"
63,29.135141,192.168.11.29,192.168.11.6,TCP,66,0.006699,,0.006699,"Jan  6, 2024 19:36:42.393581000 JST",,54044  >  6000 [ACK] Seq=1 Ack=1 Win=64256 Len=0 TSval=667340378 TSecr=526274582
64,29.135782,192.168.11.29,192.168.11.6,TCP,93,,,0.000641,"Jan  6, 2024 19:36:42.394222000 JST",,"54044  >  6000 [PSH, ACK] Seq=1 Ack=1 Win=64256 Len=27 TSval=667340378 TSecr=526274582 [TCP segment of a reassembled PDU]"
65,29.135893,192.168.11.6,192.168.11.29,TCP,66,0.000111,,0.000111,"Jan  6, 2024 19:36:42.394333000 JST",,6000  >  54044 [ACK] Seq=1 Ack=28 Win=65152 Len=0 TSval=526274589 TSecr=667340378
66,29.135976,192.168.11.29,192.168.11.6,TCP,66,,,0.000083,"Jan  6, 2024 19:36:42.394416000 JST",,"54044  >  6000 [FIN, ACK] Seq=28 Ack=1 Win=64256 Len=0 TSval=667340378 TSecr=526274582"
67,29.137319,192.168.11.6,192.168.11.29,TCP,66,0.001343,,0.001343,"Jan  6, 2024 19:36:42.395759000 JST",,"6000  >  54044 [FIN, ACK] Seq=1 Ack=29 Win=65152 Len=0 TSval=526274591 TSecr=667340378"
68,29.142997,192.168.11.29,192.168.11.6,TCP,66,0.005678,,0.005678,"Jan  6, 2024 19:36:42.401437000 JST",,54044  >  6000 [ACK] Seq=29 Ack=2 Win=64256 Len=0 TSval=667340386 TSecr=526274591
69,36.88917,192.168.11.6,192.168.11.34,TCP,74,,,7.746173,"Jan  6, 2024 19:36:50.147610000 JST",,53166  >  6000 [SYN] Seq=0 Win=64240 Len=0 MSS=1460 SACK_PERM TSval=926638013 TSecr=0 WS=128
70,36.896573,192.168.11.34,192.168.11.6,TCP,74,0.007403,,0.007403,"Jan  6, 2024 19:36:50.155013000 JST",,"6000  >  53166 [SYN, ACK] Seq=0 Ack=1 Win=65160 Len=0 MSS=1460 SACK_PERM TSval=3541720443 TSecr=926638013 WS=128"
71,36.896684,192.168.11.6,192.168.11.34,TCP,66,0.000111,,0.000111,"Jan  6, 2024 19:36:50.155124000 JST",,53166  >  6000 [ACK] Seq=1 Ack=1 Win=64256 Len=0 TSval=926638020 TSecr=3541720443
72,36.896814,192.168.11.6,192.168.11.34,TCP,93,,,0.00013,"Jan  6, 2024 19:36:50.155254000 JST",,"53166  >  6000 [PSH, ACK] Seq=1 Ack=1 Win=64256 Len=27 TSval=926638020 TSecr=3541720443 [TCP segment of a reassembled PDU]"
73,36.896905,192.168.11.6,192.168.11.34,TCP,66,,,0.000091,"Jan  6, 2024 19:36:50.155345000 JST",,"53166  >  6000 [FIN, ACK] Seq=28 Ack=1 Win=64256 Len=0 TSval=926638020 TSecr=3541720443"
74,36.904083,192.168.11.34,192.168.11.6,TCP,66,0.007269,,0.007178,"Jan  6, 2024 19:36:50.162523000 JST",,6000  >  53166 [ACK] Seq=1 Ack=28 Win=65152 Len=0 TSval=3541720451 TSecr=926638020
75,36.904308,192.168.11.34,192.168.11.6,TCP,66,0.007403,,0.000225,"Jan  6, 2024 19:36:50.162748000 JST",,"6000  >  53166 [FIN, ACK] Seq=1 Ack=29 Win=65152 Len=0 TSval=3541720453 TSecr=926638020"
76,36.904361,192.168.11.6,192.168.11.34,TCP,66,0.000053,,0.000053,"Jan  6, 2024 19:36:50.162801000 JST",,53166  >  6000 [ACK] Seq=29 Ack=2 Win=64256 Len=0 TSval=926638028 TSecr=3541720453
77,36.948056,192.168.11.6,255.255.255.255,UDP,209,,Ÿ,0.043695,"Jan  6, 2024 19:36:50.206496000 JST",7b2273656d616e74696373223a207b22656e74697479223a2022504944222c202262617365656e74697479223a2022616e79222c2022726f6c65223a2022323232222c20227370617469616c223a2022616e79222c202274656d706f72616c223a2022616e79227d2c20226461746170726f7065727479223a207b22666f726d6174223a2022696e616f6b615f70726f6772616d5f73616d706c655f73656d616e746963227d7d,35036  >  7000 Len=167
78,36.956416,192.168.11.29,192.168.11.6,TCP,74,,œ,0.00836,"Jan  6, 2024 19:36:50.214856000 JST",,53006  >  6000 [SYN] Seq=0 Win=64240 Len=0 MSS=1460 SACK_PERM TSval=667348199 TSecr=0 WS=128
79,36.956544,192.168.11.6,192.168.11.29,TCP,74,0.000128,,0.000128,"Jan  6, 2024 19:36:50.214984000 JST",,"6000  >  53006 [SYN, ACK] Seq=0 Ack=1 Win=65160 Len=0 MSS=1460 SACK_PERM TSval=526282410 TSecr=667348199 WS=128"
80,36.963185,192.168.11.29,192.168.11.6,TCP,66,0.006641,,0.006641,"Jan  6, 2024 19:36:50.221625000 JST",,53006  >  6000 [ACK] Seq=1 Ack=1 Win=64256 Len=0 TSval=667348206 TSecr=526282410
81,36.96369,192.168.11.29,192.168.11.6,TCP,93,,,0.000505,"Jan  6, 2024 19:36:50.222130000 JST",,"53006  >  6000 [PSH, ACK] Seq=1 Ack=1 Win=64256 Len=27 TSval=667348206 TSecr=526282410 [TCP segment of a reassembled PDU]"
82,36.963783,192.168.11.6,192.168.11.29,TCP,66,0.000093,,0.000093,"Jan  6, 2024 19:36:50.222223000 JST",,6000  >  53006 [ACK] Seq=1 Ack=28 Win=65152 Len=0 TSval=526282417 TSecr=667348206
83,36.963844,192.168.11.29,192.168.11.6,TCP,66,,,0.000061,"Jan  6, 2024 19:36:50.222284000 JST",,"53006  >  6000 [FIN, ACK] Seq=28 Ack=1 Win=64256 Len=0 TSval=667348206 TSecr=526282410"
84,36.964774,192.168.11.6,192.168.11.29,TCP,66,0.00093,,0.00093,"Jan  6, 2024 19:36:50.223214000 JST",,"6000  >  53006 [FIN, ACK] Seq=1 Ack=29 Win=65152 Len=0 TSval=526282418 TSecr=667348206"
85,36.971233,192.168.11.29,192.168.11.6,TCP,66,0.006459,,0.006459,"Jan  6, 2024 19:36:50.229673000 JST",,53006  >  6000 [ACK] Seq=29 Ack=2 Win=64256 Len=0 TSval=667348214 TSecr=526282418
86,44.695404,192.168.11.6,192.168.11.34,TCP,74,,,7.724171,"Jan  6, 2024 19:36:57.953844000 JST",,38878  >  6000 [SYN] Seq=0 Win=64240 Len=0 MSS=1460 SACK_PERM TSval=926645819 TSecr=0 WS=128
87,44.702137,192.168.11.34,192.168.11.6,TCP,74,0.006733,,0.006733,"Jan  6, 2024 19:36:57.960577000 JST",,"6000  >  38878 [SYN, ACK] Seq=0 Ack=1 Win=65160 Len=0 MSS=1460 SACK_PERM TSval=3541728250 TSecr=926645819 WS=128"
88,44.702232,192.168.11.6,192.168.11.34,TCP,66,0.000095,,0.000095,"Jan  6, 2024 19:36:57.960672000 JST",,38878  >  6000 [ACK] Seq=1 Ack=1 Win=64256 Len=0 TSval=926645826 TSecr=3541728250
89,44.702362,192.168.11.6,192.168.11.34,TCP,93,,,0.00013,"Jan  6, 2024 19:36:57.960802000 JST",,"38878  >  6000 [PSH, ACK] Seq=1 Ack=1 Win=64256 Len=27 TSval=926645826 TSecr=3541728250 [TCP segment of a reassembled PDU]"
90,44.702448,192.168.11.6,192.168.11.34,TCP,66,,,0.000086,"Jan  6, 2024 19:36:57.960888000 JST",,"38878  >  6000 [FIN, ACK] Seq=28 Ack=1 Win=64256 Len=0 TSval=926645826 TSecr=3541728250"
91,44.709872,192.168.11.34,192.168.11.6,TCP,66,0.00751,,0.007424,"Jan  6, 2024 19:36:57.968312000 JST",,6000  >  38878 [ACK] Seq=1 Ack=28 Win=65152 Len=0 TSval=3541728257 TSecr=926645826
92,44.710142,192.168.11.34,192.168.11.6,TCP,66,0.007694,,0.00027,"Jan  6, 2024 19:36:57.968582000 JST",,"6000  >  38878 [FIN, ACK] Seq=1 Ack=29 Win=65152 Len=0 TSval=3541728259 TSecr=926645826"
93,44.710185,192.168.11.6,192.168.11.34,TCP,66,0.000043,,0.000043,"Jan  6, 2024 19:36:57.968625000 JST",,38878  >  6000 [ACK] Seq=29 Ack=2 Win=64256 Len=0 TSval=926645834 TSecr=3541728259
94,44.741747,192.168.11.6,255.255.255.255,UDP,209,,Ÿ,0.031562,"Jan  6, 2024 19:36:58.000187000 JST",7b2273656d616e74696373223a207b22656e74697479223a2022504944222c202262617365656e74697479223a2022616e79222c2022726f6c65223a2022323232222c20227370617469616c223a2022616e79222c202274656d706f72616c223a2022616e79227d2c20226461746170726f7065727479223a207b22666f726d6174223a2022696e616f6b615f70726f6772616d5f73616d706c655f73656d616e746963227d7d,58357  >  7000 Len=167
95,44.749995,192.168.11.29,192.168.11.6,TCP,74,,œ,0.008248,"Jan  6, 2024 19:36:58.008435000 JST",,53020  >  6000 [SYN] Seq=0 Win=64240 Len=0 MSS=1460 SACK_PERM TSval=667355993 TSecr=0 WS=128
96,44.750141,192.168.11.6,192.168.11.29,TCP,74,0.000146,,0.000146,"Jan  6, 2024 19:36:58.008581000 JST",,"6000  >  53020 [SYN, ACK] Seq=0 Ack=1 Win=65160 Len=0 MSS=1460 SACK_PERM TSval=526290204 TSecr=667355993 WS=128"
97,44.756895,192.168.11.29,192.168.11.6,TCP,66,0.006754,,0.006754,"Jan  6, 2024 19:36:58.015335000 JST",,53020  >  6000 [ACK] Seq=1 Ack=1 Win=64256 Len=0 TSval=667356000 TSecr=526290204
98,44.757488,192.168.11.29,192.168.11.6,TCP,93,,,0.000593,"Jan  6, 2024 19:36:58.015928000 JST",,"53020  >  6000 [PSH, ACK] Seq=1 Ack=1 Win=64256 Len=27 TSval=667356000 TSecr=526290204 [TCP segment of a reassembled PDU]"
99,44.757586,192.168.11.6,192.168.11.29,TCP,66,0.000098,,0.000098,"Jan  6, 2024 19:36:58.016026000 JST",,6000  >  53020 [ACK] Seq=1 Ack=28 Win=65152 Len=0 TSval=526290211 TSecr=667356000
100,44.757675,192.168.11.29,192.168.11.6,TCP,66,,,0.000089,"Jan  6, 2024 19:36:58.016115000 JST",,"53020  >  6000 [FIN, ACK] Seq=28 Ack=1 Win=64256 Len=0 TSval=667356000 TSecr=526290204"
101,44.758612,192.168.11.6,192.168.11.29,TCP,66,0.000937,,0.000937,"Jan  6, 2024 19:36:58.017052000 JST",,"6000  >  53020 [FIN, ACK] Seq=1 Ack=29 Win=65152 Len=0 TSval=526290212 TSecr=667356000"
102,44.770253,192.168.11.29,192.168.11.6,TCP,66,0.011641,,0.011641,"Jan  6, 2024 19:36:58.028693000 JST",,53020  >  6000 [ACK] Seq=29 Ack=2 Win=64256 Len=0 TSval=667356011 TSecr=526290212
103,52.559802,192.168.11.6,192.168.11.34,TCP,74,,,7.789549,"Jan  6, 2024 19:37:05.818242000 JST",,33896  >  6000 [SYN] Seq=0 Win=64240 Len=0 MSS=1460 SACK_PERM TSval=926653683 TSecr=0 WS=128
104,52.566498,192.168.11.34,192.168.11.6,TCP,74,0.006696,,0.006696,"Jan  6, 2024 19:37:05.824938000 JST",,"6000  >  33896 [SYN, ACK] Seq=0 Ack=1 Win=65160 Len=0 MSS=1460 SACK_PERM TSval=3541736114 TSecr=926653683 WS=128"
105,52.566594,192.168.11.6,192.168.11.34,TCP,66,0.000096,,0.000096,"Jan  6, 2024 19:37:05.825034000 JST",,33896  >  6000 [ACK] Seq=1 Ack=1 Win=64256 Len=0 TSval=926653690 TSecr=3541736114
106,52.566724,192.168.11.6,192.168.11.34,TCP,93,,,0.00013,"Jan  6, 2024 19:37:05.825164000 JST",,"33896  >  6000 [PSH, ACK] Seq=1 Ack=1 Win=64256 Len=27 TSval=926653690 TSecr=3541736114 [TCP segment of a reassembled PDU]"
107,52.566833,192.168.11.6,192.168.11.34,TCP,66,,,0.000109,"Jan  6, 2024 19:37:05.825273000 JST",,"33896  >  6000 [FIN, ACK] Seq=28 Ack=1 Win=64256 Len=0 TSval=926653690 TSecr=3541736114"
108,52.574347,192.168.11.34,192.168.11.6,TCP,66,0.007623,,0.007514,"Jan  6, 2024 19:37:05.832787000 JST",,6000  >  33896 [ACK] Seq=1 Ack=28 Win=65152 Len=0 TSval=3541736121 TSecr=926653690
109,52.574558,192.168.11.34,192.168.11.6,TCP,66,0.007725,,0.000211,"Jan  6, 2024 19:37:05.832998000 JST",,"6000  >  33896 [FIN, ACK] Seq=1 Ack=29 Win=65152 Len=0 TSval=3541736123 TSecr=926653690"
110,52.574602,192.168.11.6,192.168.11.34,TCP,66,0.000044,,0.000044,"Jan  6, 2024 19:37:05.833042000 JST",,33896  >  6000 [ACK] Seq=29 Ack=2 Win=64256 Len=0 TSval=926653698 TSecr=3541736123
111,52.605075,192.168.11.6,255.255.255.255,UDP,209,,Ÿ,0.030473,"Jan  6, 2024 19:37:05.863515000 JST",7b2273656d616e74696373223a207b22656e74697479223a2022504944222c202262617365656e74697479223a2022616e79222c2022726f6c65223a2022323232222c20227370617469616c223a2022616e79222c202274656d706f72616c223a2022616e79227d2c20226461746170726f7065727479223a207b22666f726d6174223a2022696e616f6b615f70726f6772616d5f73616d706c655f73656d616e746963227d7d,39954  >  7000 Len=167
112,52.615737,192.168.11.29,192.168.11.6,TCP,74,,œ,0.010662,"Jan  6, 2024 19:37:05.874177000 JST",,35268  >  6000 [SYN] Seq=0 Win=64240 Len=0 MSS=1460 SACK_PERM TSval=667363856 TSecr=0 WS=128
113,52.615866,192.168.11.6,192.168.11.29,TCP,74,0.000129,,0.000129,"Jan  6, 2024 19:37:05.874306000 JST",,"6000  >  35268 [SYN, ACK] Seq=0 Ack=1 Win=65160 Len=0 MSS=1460 SACK_PERM TSval=526298069 TSecr=667363856 WS=128"
114,52.622914,192.168.11.29,192.168.11.6,TCP,66,0.007048,,0.007048,"Jan  6, 2024 19:37:05.881354000 JST",,35268  >  6000 [ACK] Seq=1 Ack=1 Win=64256 Len=0 TSval=667363865 TSecr=526298069
115,52.623848,192.168.11.29,192.168.11.6,TCP,93,,,0.000934,"Jan  6, 2024 19:37:05.882288000 JST",,"35268  >  6000 [PSH, ACK] Seq=1 Ack=1 Win=64256 Len=27 TSval=667363865 TSecr=526298069 [TCP segment of a reassembled PDU]"
116,52.624041,192.168.11.6,192.168.11.29,TCP,66,0.000193,,0.000193,"Jan  6, 2024 19:37:05.882481000 JST",,6000  >  35268 [ACK] Seq=1 Ack=28 Win=65152 Len=0 TSval=526298077 TSecr=667363865
117,52.624165,192.168.11.29,192.168.11.6,TCP,66,,,0.000124,"Jan  6, 2024 19:37:05.882605000 JST",,"35268  >  6000 [FIN, ACK] Seq=28 Ack=1 Win=64256 Len=0 TSval=667363866 TSecr=526298069"
118,52.625559,192.168.11.6,192.168.11.29,TCP,66,0.001394,,0.001394,"Jan  6, 2024 19:37:05.883999000 JST",,"6000  >  35268 [FIN, ACK] Seq=1 Ack=29 Win=65152 Len=0 TSval=526298079 TSecr=667363866"
119,52.631757,192.168.11.29,192.168.11.6,TCP,66,0.006198,,0.006198,"Jan  6, 2024 19:37:05.890197000 JST",,35268  >  6000 [ACK] Seq=29 Ack=2 Win=64256 Len=0 TSval=667363874 TSecr=526298079
120,60.852915,192.168.11.6,192.168.11.34,TCP,74,,,8.221158,"Jan  6, 2024 19:37:14.111355000 JST",,60374  >  6000 [SYN] Seq=0 Win=64240 Len=0 MSS=1460 SACK_PERM TSval=926661976 TSecr=0 WS=128
121,60.859697,192.168.11.34,192.168.11.6,TCP,74,0.006782,,0.006782,"Jan  6, 2024 19:37:14.118137000 JST",,"6000  >  60374 [SYN, ACK] Seq=0 Ack=1 Win=65160 Len=0 MSS=1460 SACK_PERM TSval=3541744407 TSecr=926661976 WS=128"
122,60.8598,192.168.11.6,192.168.11.34,TCP,66,0.000103,,0.000103,"Jan  6, 2024 19:37:14.118240000 JST",,60374  >  6000 [ACK] Seq=1 Ack=1 Win=64256 Len=0 TSval=926661983 TSecr=3541744407
123,60.859935,192.168.11.6,192.168.11.34,TCP,93,,,0.000135,"Jan  6, 2024 19:37:14.118375000 JST",,"60374  >  6000 [PSH, ACK] Seq=1 Ack=1 Win=64256 Len=27 TSval=926661983 TSecr=3541744407 [TCP segment of a reassembled PDU]"
124,60.860042,192.168.11.6,192.168.11.34,TCP,66,,,0.000107,"Jan  6, 2024 19:37:14.118482000 JST",,"60374  >  6000 [FIN, ACK] Seq=28 Ack=1 Win=64256 Len=0 TSval=926661983 TSecr=3541744407"
125,60.867022,192.168.11.34,192.168.11.6,TCP,66,0.007087,,0.00698,"Jan  6, 2024 19:37:14.125462000 JST",,6000  >  60374 [ACK] Seq=1 Ack=28 Win=65152 Len=0 TSval=3541744414 TSecr=926661983
126,60.867252,192.168.11.34,192.168.11.6,TCP,66,0.00721,,0.00023,"Jan  6, 2024 19:37:14.125692000 JST",,"6000  >  60374 [FIN, ACK] Seq=1 Ack=29 Win=65152 Len=0 TSval=3541744416 TSecr=926661983"
127,60.867295,192.168.11.6,192.168.11.34,TCP,66,0.000043,,0.000043,"Jan  6, 2024 19:37:14.125735000 JST",,60374  >  6000 [ACK] Seq=29 Ack=2 Win=64256 Len=0 TSval=926661991 TSecr=3541744416
128,60.89685,192.168.11.6,255.255.255.255,UDP,209,,Ÿ,0.029555,"Jan  6, 2024 19:37:14.155290000 JST",7b2273656d616e74696373223a207b22656e74697479223a2022504944222c202262617365656e74697479223a2022616e79222c2022726f6c65223a2022323232222c20227370617469616c223a2022616e79222c202274656d706f72616c223a2022616e79227d2c20226461746170726f7065727479223a207b22666f726d6174223a2022696e616f6b615f70726f6772616d5f73616d706c655f73656d616e746963227d7d,58691  >  7000 Len=167
129,60.911093,192.168.11.29,192.168.11.6,TCP,74,,œ,0.014243,"Jan  6, 2024 19:37:14.169533000 JST",,34132  >  6000 [SYN] Seq=0 Win=64240 Len=0 MSS=1460 SACK_PERM TSval=667372149 TSecr=0 WS=128
130,60.911223,192.168.11.6,192.168.11.29,TCP,74,0.00013,,0.00013,"Jan  6, 2024 19:37:14.169663000 JST",,"6000  >  34132 [SYN, ACK] Seq=0 Ack=1 Win=65160 Len=0 MSS=1460 SACK_PERM TSval=526306365 TSecr=667372149 WS=128"
131,60.921039,192.168.11.29,192.168.11.6,TCP,66,0.009816,,0.009816,"Jan  6, 2024 19:37:14.179479000 JST",,34132  >  6000 [ACK] Seq=1 Ack=1 Win=64256 Len=0 TSval=667372163 TSecr=526306365
132,60.921772,192.168.11.29,192.168.11.6,TCP,93,,,0.000733,"Jan  6, 2024 19:37:14.180212000 JST",,"34132  >  6000 [PSH, ACK] Seq=1 Ack=1 Win=64256 Len=27 TSval=667372163 TSecr=526306365 [TCP segment of a reassembled PDU]"
133,60.921883,192.168.11.6,192.168.11.29,TCP,66,0.000111,,0.000111,"Jan  6, 2024 19:37:14.180323000 JST",,6000  >  34132 [ACK] Seq=1 Ack=28 Win=65152 Len=0 TSval=526306375 TSecr=667372163
134,60.921968,192.168.11.29,192.168.11.6,TCP,66,,,0.000085,"Jan  6, 2024 19:37:14.180408000 JST",,"34132  >  6000 [FIN, ACK] Seq=28 Ack=1 Win=64256 Len=0 TSval=667372164 TSecr=526306365"
135,60.923167,192.168.11.6,192.168.11.29,TCP,66,0.001199,,0.001199,"Jan  6, 2024 19:37:14.181607000 JST",,"6000  >  34132 [FIN, ACK] Seq=1 Ack=29 Win=65152 Len=0 TSval=526306377 TSecr=667372164"
136,60.934805,192.168.11.29,192.168.11.6,TCP,66,0.011638,,0.011638,"Jan  6, 2024 19:37:14.193245000 JST",,34132  >  6000 [ACK] Seq=29 Ack=2 Win=64256 Len=0 TSval=667372177 TSecr=526306377
137,71.774724,192.168.11.6,192.168.11.34,TCP,74,,,10.839919,"Jan  6, 2024 19:37:25.033164000 JST",,57222  >  6000 [SYN] Seq=0 Win=64240 Len=0 MSS=1460 SACK_PERM TSval=926672898 TSecr=0 WS=128
138,71.781607,192.168.11.34,192.168.11.6,TCP,74,0.006883,,0.006883,"Jan  6, 2024 19:37:25.040047000 JST",,"6000  >  57222 [SYN, ACK] Seq=0 Ack=1 Win=65160 Len=0 MSS=1460 SACK_PERM TSval=3541755329 TSecr=926672898 WS=128"
139,71.7817,192.168.11.6,192.168.11.34,TCP,66,0.000093,,0.000093,"Jan  6, 2024 19:37:25.040140000 JST",,57222  >  6000 [ACK] Seq=1 Ack=1 Win=64256 Len=0 TSval=926672905 TSecr=3541755329
140,71.781825,192.168.11.6,192.168.11.34,TCP,93,,,0.000125,"Jan  6, 2024 19:37:25.040265000 JST",,"57222  >  6000 [PSH, ACK] Seq=1 Ack=1 Win=64256 Len=27 TSval=926672905 TSecr=3541755329 [TCP segment of a reassembled PDU]"
141,71.781935,192.168.11.6,192.168.11.34,TCP,66,,,0.00011,"Jan  6, 2024 19:37:25.040375000 JST",,"57222  >  6000 [FIN, ACK] Seq=28 Ack=1 Win=64256 Len=0 TSval=926672905 TSecr=3541755329"
142,71.789187,192.168.11.34,192.168.11.6,TCP,66,0.007362,,0.007252,"Jan  6, 2024 19:37:25.047627000 JST",,6000  >  57222 [ACK] Seq=1 Ack=28 Win=65152 Len=0 TSval=3541755336 TSecr=926672905
143,71.789551,192.168.11.34,192.168.11.6,TCP,66,0.007616,,0.000364,"Jan  6, 2024 19:37:25.047991000 JST",,"6000  >  57222 [FIN, ACK] Seq=1 Ack=29 Win=65152 Len=0 TSval=3541755337 TSecr=926672905"
144,71.789599,192.168.11.6,192.168.11.34,TCP,66,0.000048,,0.000048,"Jan  6, 2024 19:37:25.048039000 JST",,57222  >  6000 [ACK] Seq=29 Ack=2 Win=64256 Len=0 TSval=926672913 TSecr=3541755337
145,72.819906,192.168.11.6,255.255.255.255,UDP,209,,Ÿ,1.030307,"Jan  6, 2024 19:37:26.078346000 JST",7b2273656d616e74696373223a207b22656e74697479223a2022504944222c202262617365656e74697479223a2022616e79222c2022726f6c65223a2022323232222c20227370617469616c223a2022616e79222c202274656d706f72616c223a2022616e79227d2c20226461746170726f7065727479223a207b22666f726d6174223a2022696e616f6b615f70726f6772616d5f73616d706c655f73656d616e746963227d7d,51914  >  7000 Len=167
146,72.830967,192.168.11.29,192.168.11.6,TCP,74,,œ,0.011061,"Jan  6, 2024 19:37:26.089407000 JST",,45184  >  6000 [SYN] Seq=0 Win=64240 Len=0 MSS=1460 SACK_PERM TSval=667384071 TSecr=0 WS=128
147,72.831098,192.168.11.6,192.168.11.29,TCP,74,0.000131,,0.000131,"Jan  6, 2024 19:37:26.089538000 JST",,"6000  >  45184 [SYN, ACK] Seq=0 Ack=1 Win=65160 Len=0 MSS=1460 SACK_PERM TSval=526318285 TSecr=667384071 WS=128"
148,72.838138,192.168.11.29,192.168.11.6,TCP,66,0.00704,,0.00704,"Jan  6, 2024 19:37:26.096578000 JST",,45184  >  6000 [ACK] Seq=1 Ack=1 Win=64256 Len=0 TSval=667384080 TSecr=526318285
149,72.838828,192.168.11.29,192.168.11.6,TCP,93,,,0.00069,"Jan  6, 2024 19:37:26.097268000 JST",,"45184  >  6000 [PSH, ACK] Seq=1 Ack=1 Win=64256 Len=27 TSval=667384081 TSecr=526318285 [TCP segment of a reassembled PDU]"
150,72.838913,192.168.11.6,192.168.11.29,TCP,66,0.000085,,0.000085,"Jan  6, 2024 19:37:26.097353000 JST",,6000  >  45184 [ACK] Seq=1 Ack=28 Win=65152 Len=0 TSval=526318292 TSecr=667384081
151,72.83899,192.168.11.29,192.168.11.6,TCP,66,,,0.000077,"Jan  6, 2024 19:37:26.097430000 JST",,"45184  >  6000 [FIN, ACK] Seq=28 Ack=1 Win=64256 Len=0 TSval=667384081 TSecr=526318285"
152,72.839911,192.168.11.6,192.168.11.29,TCP,66,0.000921,,0.000921,"Jan  6, 2024 19:37:26.098351000 JST",,"6000  >  45184 [FIN, ACK] Seq=1 Ack=29 Win=65152 Len=0 TSval=526318293 TSecr=667384081"
153,72.845892,192.168.11.29,192.168.11.6,TCP,66,0.005981,,0.005981,"Jan  6, 2024 19:37:26.104332000 JST",,45184  >  6000 [ACK] Seq=29 Ack=2 Win=64256 Len=0 TSval=667384088 TSecr=526318293
154,81.662258,192.168.11.6,192.168.11.34,TCP,74,,,8.816366,"Jan  6, 2024 19:37:34.920698000 JST",,33502  >  6000 [SYN] Seq=0 Win=64240 Len=0 MSS=1460 SACK_PERM TSval=926682786 TSecr=0 WS=128
155,81.669698,192.168.11.34,192.168.11.6,TCP,74,0.00744,,0.00744,"Jan  6, 2024 19:37:34.928138000 JST",,"6000  >  33502 [SYN, ACK] Seq=0 Ack=1 Win=65160 Len=0 MSS=1460 SACK_PERM TSval=3541765217 TSecr=926682786 WS=128"
156,81.669797,192.168.11.6,192.168.11.34,TCP,66,0.000099,,0.000099,"Jan  6, 2024 19:37:34.928237000 JST",,33502  >  6000 [ACK] Seq=1 Ack=1 Win=64256 Len=0 TSval=926682793 TSecr=3541765217
157,81.669922,192.168.11.6,192.168.11.34,TCP,93,,,0.000125,"Jan  6, 2024 19:37:34.928362000 JST",,"33502  >  6000 [PSH, ACK] Seq=1 Ack=1 Win=64256 Len=27 TSval=926682793 TSecr=3541765217 [TCP segment of a reassembled PDU]"
158,81.670031,192.168.11.6,192.168.11.34,TCP,66,,,0.000109,"Jan  6, 2024 19:37:34.928471000 JST",,"33502  >  6000 [FIN, ACK] Seq=28 Ack=1 Win=64256 Len=0 TSval=926682793 TSecr=3541765217"
159,81.677403,192.168.11.34,192.168.11.6,TCP,66,0.007481,,0.007372,"Jan  6, 2024 19:37:34.935843000 JST",,6000  >  33502 [ACK] Seq=1 Ack=28 Win=65152 Len=0 TSval=3541765225 TSecr=926682793
160,81.677763,192.168.11.34,192.168.11.6,TCP,66,0.007732,,0.00036,"Jan  6, 2024 19:37:34.936203000 JST",,"6000  >  33502 [FIN, ACK] Seq=1 Ack=29 Win=65152 Len=0 TSval=3541765226 TSecr=926682793"
161,81.677807,192.168.11.6,192.168.11.34,TCP,66,0.000044,,0.000044,"Jan  6, 2024 19:37:34.936247000 JST",,33502  >  6000 [ACK] Seq=29 Ack=2 Win=64256 Len=0 TSval=926682801 TSecr=3541765226
162,81.705083,192.168.11.6,255.255.255.255,UDP,209,,Ÿ,0.027276,"Jan  6, 2024 19:37:34.963523000 JST",7b2273656d616e74696373223a207b22656e74697479223a2022504944222c202262617365656e74697479223a2022616e79222c2022726f6c65223a2022323232222c20227370617469616c223a2022616e79222c202274656d706f72616c223a2022616e79227d2c20226461746170726f7065727479223a207b22666f726d6174223a2022696e616f6b615f70726f6772616d5f73616d706c655f73656d616e746963227d7d,40667  >  7000 Len=167
163,81.712802,192.168.11.29,192.168.11.6,TCP,74,,œ,0.007719,"Jan  6, 2024 19:37:34.971242000 JST",,36892  >  6000 [SYN] Seq=0 Win=64240 Len=0 MSS=1460 SACK_PERM TSval=667392956 TSecr=0 WS=128
164,81.712924,192.168.11.6,192.168.11.29,TCP,74,0.000122,,0.000122,"Jan  6, 2024 19:37:34.971364000 JST",,"6000  >  36892 [SYN, ACK] Seq=0 Ack=1 Win=65160 Len=0 MSS=1460 SACK_PERM TSval=526327166 TSecr=667392956 WS=128"
165,81.719593,192.168.11.29,192.168.11.6,TCP,66,0.006669,,0.006669,"Jan  6, 2024 19:37:34.978033000 JST",,36892  >  6000 [ACK] Seq=1 Ack=1 Win=64256 Len=0 TSval=667392962 TSecr=526327166
166,81.720169,192.168.11.29,192.168.11.6,TCP,93,,,0.000576,"Jan  6, 2024 19:37:34.978609000 JST",,"36892  >  6000 [PSH, ACK] Seq=1 Ack=1 Win=64256 Len=27 TSval=667392962 TSecr=526327166 [TCP segment of a reassembled PDU]"
167,81.720258,192.168.11.6,192.168.11.29,TCP,66,0.000089,,0.000089,"Jan  6, 2024 19:37:34.978698000 JST",,6000  >  36892 [ACK] Seq=1 Ack=28 Win=65152 Len=0 TSval=526327174 TSecr=667392962
168,81.720329,192.168.11.29,192.168.11.6,TCP,66,,,0.000071,"Jan  6, 2024 19:37:34.978769000 JST",,"36892  >  6000 [FIN, ACK] Seq=28 Ack=1 Win=64256 Len=0 TSval=667392963 TSecr=526327166"
169,81.721386,192.168.11.6,192.168.11.29,TCP,66,0.001057,,0.001057,"Jan  6, 2024 19:37:34.979826000 JST",,"6000  >  36892 [FIN, ACK] Seq=1 Ack=29 Win=65152 Len=0 TSval=526327175 TSecr=667392963"
170,81.729856,192.168.11.29,192.168.11.6,TCP,66,0.00847,,0.00847,"Jan  6, 2024 19:37:34.988296000 JST",,36892  >  6000 [ACK] Seq=29 Ack=2 Win=64256 Len=0 TSval=667392970 TSecr=526327175
171,113.85416,192.168.11.6,192.168.11.34,TCP,74,,,32.124304,"Jan  6, 2024 19:38:07.112600000 JST",,50410  >  6000 [SYN] Seq=0 Win=64240 Len=0 MSS=1460 SACK_PERM TSval=926714977 TSecr=0 WS=128
172,113.861659,192.168.11.34,192.168.11.6,TCP,74,0.007499,,0.007499,"Jan  6, 2024 19:38:07.120099000 JST",,"6000  >  50410 [SYN, ACK] Seq=0 Ack=1 Win=65160 Len=0 MSS=1460 SACK_PERM TSval=3541797409 TSecr=926714977 WS=128"
173,113.861773,192.168.11.6,192.168.11.34,TCP,66,0.000114,,0.000114,"Jan  6, 2024 19:38:07.120213000 JST",,50410  >  6000 [ACK] Seq=1 Ack=1 Win=64256 Len=0 TSval=926714985 TSecr=3541797409
174,113.861944,192.168.11.6,192.168.11.34,TCP,93,,,0.000171,"Jan  6, 2024 19:38:07.120384000 JST",,"50410  >  6000 [PSH, ACK] Seq=1 Ack=1 Win=64256 Len=27 TSval=926714985 TSecr=3541797409 [TCP segment of a reassembled PDU]"
175,113.862047,192.168.11.6,192.168.11.34,TCP,66,,,0.000103,"Jan  6, 2024 19:38:07.120487000 JST",,"50410  >  6000 [FIN, ACK] Seq=28 Ack=1 Win=64256 Len=0 TSval=926714985 TSecr=3541797409"
176,113.870486,192.168.11.34,192.168.11.6,TCP,66,0.008542,,0.008439,"Jan  6, 2024 19:38:07.128926000 JST",,6000  >  50410 [ACK] Seq=1 Ack=28 Win=65152 Len=0 TSval=3541797417 TSecr=926714985
177,113.870869,192.168.11.34,192.168.11.6,TCP,66,0.008822,,0.000383,"Jan  6, 2024 19:38:07.129309000 JST",,"6000  >  50410 [FIN, ACK] Seq=1 Ack=29 Win=65152 Len=0 TSval=3541797418 TSecr=926714985"
178,113.870918,192.168.11.6,192.168.11.34,TCP,66,0.000049,,0.000049,"Jan  6, 2024 19:38:07.129358000 JST",,50410  >  6000 [ACK] Seq=29 Ack=2 Win=64256 Len=0 TSval=926714994 TSecr=3541797418
179,113.899032,192.168.11.6,255.255.255.255,UDP,209,,Ÿ,0.028114,"Jan  6, 2024 19:38:07.157472000 JST",7b2273656d616e74696373223a207b22656e74697479223a2022504944222c202262617365656e74697479223a2022616e79222c2022726f6c65223a2022323232222c20227370617469616c223a2022616e79222c202274656d706f72616c223a2022616e79227d2c20226461746170726f7065727479223a207b22666f726d6174223a2022696e616f6b615f70726f6772616d5f73616d706c655f73656d616e746963227d7d,52547  >  7000 Len=167
180,113.906666,192.168.11.29,192.168.11.6,TCP,74,,œ,0.007634,"Jan  6, 2024 19:38:07.165106000 JST",,57538  >  6000 [SYN] Seq=0 Win=64240 Len=0 MSS=1460 SACK_PERM TSval=667425149 TSecr=0 WS=128
181,113.906783,192.168.11.6,192.168.11.29,TCP,74,0.000117,,0.000117,"Jan  6, 2024 19:38:07.165223000 JST",,"6000  >  57538 [SYN, ACK] Seq=0 Ack=1 Win=65160 Len=0 MSS=1460 SACK_PERM TSval=526359360 TSecr=667425149 WS=128"
182,113.913397,192.168.11.29,192.168.11.6,TCP,66,0.006614,,0.006614,"Jan  6, 2024 19:38:07.171837000 JST",,57538  >  6000 [ACK] Seq=1 Ack=1 Win=64256 Len=0 TSval=667425156 TSecr=526359360
183,113.913878,192.168.11.29,192.168.11.6,TCP,93,,,0.000481,"Jan  6, 2024 19:38:07.172318000 JST",,"57538  >  6000 [PSH, ACK] Seq=1 Ack=1 Win=64256 Len=27 TSval=667425156 TSecr=526359360 [TCP segment of a reassembled PDU]"
184,113.913947,192.168.11.6,192.168.11.29,TCP,66,0.000069,,0.000069,"Jan  6, 2024 19:38:07.172387000 JST",,6000  >  57538 [ACK] Seq=1 Ack=28 Win=65152 Len=0 TSval=526359367 TSecr=667425156
185,113.914011,192.168.11.29,192.168.11.6,TCP,66,,,0.000064,"Jan  6, 2024 19:38:07.172451000 JST",,"57538  >  6000 [FIN, ACK] Seq=28 Ack=1 Win=64256 Len=0 TSval=667425156 TSecr=526359360"
186,113.915092,192.168.11.6,192.168.11.29,TCP,66,0.001081,,0.001081,"Jan  6, 2024 19:38:07.173532000 JST",,"6000  >  57538 [FIN, ACK] Seq=1 Ack=29 Win=65152 Len=0 TSval=526359368 TSecr=667425156"
187,113.921368,192.168.11.29,192.168.11.6,TCP,66,0.006276,,0.006276,"Jan  6, 2024 19:38:07.179808000 JST",,57538  >  6000 [ACK] Seq=29 Ack=2 Win=64256 Len=0 TSval=667425164 TSecr=526359368
