No.,Time,Source,Destination,Protocol,Length,The RTT to ACK the segment was,XXX,Time delta from previous captured frame,Arrival Time,Data,Info
1,0,192.168.11.29,192.168.11.6,TCP,74,,,0,"Jan  6, 2024 19:36:13.313561000 JST",,60928  >  6000 [SYN] Seq=0 Win=64240 Len=0 MSS=1460 SACK_PERM TSval=667311304 TSecr=0 WS=128
2,0.007729,192.168.11.6,192.168.11.29,TCP,74,0.007729,,0.007729,"Jan  6, 2024 19:36:13.321290000 JST",,"6000  >  60928 [SYN, ACK] Seq=0 Ack=1 Win=65160 Len=0 MSS=1460 SACK_PERM TSval=526245519 TSecr=667311304 WS=128"
3,0.007852,192.168.11.29,192.168.11.6,TCP,66,0.000123,,0.000123,"Jan  6, 2024 19:36:13.321413000 JST",,60928  >  6000 [ACK] Seq=1 Ack=1 Win=64256 Len=0 TSval=667311316 TSecr=526245519
4,0.00807,192.168.11.29,192.168.11.6,TCP,93,,,0.000218,"Jan  6, 2024 19:36:13.321631000 JST",,"60928  >  6000 [PSH, ACK] Seq=1 Ack=1 Win=64256 Len=27 TSval=667311316 TSecr=526245519 [TCP segment of a reassembled PDU]"
5,0.008211,192.168.11.29,192.168.11.6,TCP,66,,,0.000141,"Jan  6, 2024 19:36:13.321772000 JST",,"60928  >  6000 [FIN, ACK] Seq=28 Ack=1 Win=64256 Len=0 TSval=667311316 TSecr=526245519"
6,0.015751,192.168.11.6,192.168.11.29,TCP,66,0.007681,,0.00754,"Jan  6, 2024 19:36:13.329312000 JST",,6000  >  60928 [ACK] Seq=1 Ack=28 Win=65152 Len=0 TSval=526245527 TSecr=667311316
7,0.015994,192.168.11.6,192.168.11.29,TCP,66,0.007783,,0.000243,"Jan  6, 2024 19:36:13.329555000 JST",,"6000  >  60928 [FIN, ACK] Seq=1 Ack=29 Win=65152 Len=0 TSval=526245529 TSecr=667311316"
8,0.01604,192.168.11.29,192.168.11.6,TCP,66,0.000046,,0.000046,"Jan  6, 2024 19:36:13.329601000 JST",,60928  >  6000 [ACK] Seq=29 Ack=2 Win=64256 Len=0 TSval=667311324 TSecr=526245529
9,0.04893,192.168.11.29,255.255.255.255,UDP,209,,Ÿ,0.03289,"Jan  6, 2024 19:36:13.362491000 JST",7b2273656d616e74696373223a207b22656e74697479223a2022504944222c202262617365656e74697479223a2022616e79222c2022726f6c65223a2022333333222c20227370617469616c223a2022616e79222c202274656d706f72616c223a2022616e79227d2c20226461746170726f7065727479223a207b22666f726d6174223a2022696e616f6b615f70726f6772616d5f73616d706c655f73656d616e746963227d7d,34110  >  7000 Len=167
10,1.05033,192.168.11.29,255.255.255.255,UDP,209,,œ,1.0014,"Jan  6, 2024 19:36:14.363891000 JST",7b2273656d616e74696373223a207b22656e74697479223a2022504944222c202262617365656e74697479223a2022616e79222c2022726f6c65223a2022333333222c20227370617469616c223a2022616e79222c202274656d706f72616c223a2022616e79227d2c20226461746170726f7065727479223a207b22666f726d6174223a2022696e616f6b615f70726f6772616d5f73616d706c655f73656d616e746963227d7d,34110  >  7000 Len=167
11,1.064239,192.168.11.31,192.168.11.29,TCP,74,,œ,0.013909,"Jan  6, 2024 19:36:14.377800000 JST",,45824  >  6000 [SYN] Seq=0 Win=64240 Len=0 MSS=1460 SACK_PERM TSval=2222174459 TSecr=0 WS=128
12,1.064407,192.168.11.29,192.168.11.31,TCP,74,0.000168,,0.000168,"Jan  6, 2024 19:36:14.377968000 JST",,"6000  >  45824 [SYN, ACK] Seq=0 Ack=1 Win=65160 Len=0 MSS=1460 SACK_PERM TSval=3583825916 TSecr=2222174459 WS=128"
13,1.071028,192.168.11.31,192.168.11.29,TCP,66,0.006621,,0.006621,"Jan  6, 2024 19:36:14.384589000 JST",,45824  >  6000 [ACK] Seq=1 Ack=1 Win=64256 Len=0 TSval=2222174471 TSecr=3583825916
14,1.07157,192.168.11.31,192.168.11.29,TCP,93,,,0.000542,"Jan  6, 2024 19:36:14.385131000 JST",,"45824  >  6000 [PSH, ACK] Seq=1 Ack=1 Win=64256 Len=27 TSval=2222174471 TSecr=3583825916 [TCP segment of a reassembled PDU]"
15,1.071641,192.168.11.29,192.168.11.31,TCP,66,0.000071,,0.000071,"Jan  6, 2024 19:36:14.385202000 JST",,6000  >  45824 [ACK] Seq=1 Ack=28 Win=65152 Len=0 TSval=3583825923 TSecr=2222174471
16,1.071707,192.168.11.31,192.168.11.29,TCP,66,,,0.000066,"Jan  6, 2024 19:36:14.385268000 JST",,"45824  >  6000 [FIN, ACK] Seq=28 Ack=1 Win=64256 Len=0 TSval=2222174471 TSecr=3583825916"
17,1.072933,192.168.11.29,192.168.11.31,TCP,66,0.001226,,0.001226,"Jan  6, 2024 19:36:14.386494000 JST",,"6000  >  45824 [FIN, ACK] Seq=1 Ack=29 Win=65152 Len=0 TSval=3583825925 TSecr=2222174471"
18,1.08083,192.168.11.31,192.168.11.29,TCP,66,0.007897,,0.007897,"Jan  6, 2024 19:36:14.394391000 JST",,45824  >  6000 [ACK] Seq=29 Ack=2 Win=64256 Len=0 TSval=2222174480 TSecr=3583825925
19,9.28486,192.168.11.29,192.168.11.6,TCP,74,,,8.20403,"Jan  6, 2024 19:36:22.598421000 JST",,52640  >  6000 [SYN] Seq=0 Win=64240 Len=0 MSS=1460 SACK_PERM TSval=667320593 TSecr=0 WS=128
20,9.291663,192.168.11.6,192.168.11.29,TCP,74,0.006803,,0.006803,"Jan  6, 2024 19:36:22.605224000 JST",,"6000  >  52640 [SYN, ACK] Seq=0 Ack=1 Win=65160 Len=0 MSS=1460 SACK_PERM TSval=526254803 TSecr=667320593 WS=128"
21,9.291782,192.168.11.29,192.168.11.6,TCP,66,0.000119,,0.000119,"Jan  6, 2024 19:36:22.605343000 JST",,52640  >  6000 [ACK] Seq=1 Ack=1 Win=64256 Len=0 TSval=667320600 TSecr=526254803
22,9.291933,192.168.11.29,192.168.11.6,TCP,93,,,0.000151,"Jan  6, 2024 19:36:22.605494000 JST",,"52640  >  6000 [PSH, ACK] Seq=1 Ack=1 Win=64256 Len=27 TSval=667320600 TSecr=526254803 [TCP segment of a reassembled PDU]"
23,9.292048,192.168.11.29,192.168.11.6,TCP,66,,,0.000115,"Jan  6, 2024 19:36:22.605609000 JST",,"52640  >  6000 [FIN, ACK] Seq=28 Ack=1 Win=64256 Len=0 TSval=667320600 TSecr=526254803"
24,9.302769,192.168.11.6,192.168.11.29,TCP,66,0.010836,,0.010721,"Jan  6, 2024 19:36:22.616330000 JST",,6000  >  52640 [ACK] Seq=1 Ack=28 Win=65152 Len=0 TSval=526254811 TSecr=667320600
25,9.304176,192.168.11.6,192.168.11.29,TCP,66,0.012128,,0.001407,"Jan  6, 2024 19:36:22.617737000 JST",,"6000  >  52640 [FIN, ACK] Seq=1 Ack=29 Win=65152 Len=0 TSval=526254812 TSecr=667320600"
26,9.304226,192.168.11.29,192.168.11.6,TCP,66,0.00005,,0.00005,"Jan  6, 2024 19:36:22.617787000 JST",,52640  >  6000 [ACK] Seq=29 Ack=2 Win=64256 Len=0 TSval=667320612 TSecr=526254812
27,9.33745,192.168.11.29,255.255.255.255,UDP,209,,Ÿ,0.033224,"Jan  6, 2024 19:36:22.651011000 JST",7b2273656d616e74696373223a207b22656e74697479223a2022504944222c202262617365656e74697479223a2022616e79222c2022726f6c65223a2022333333222c20227370617469616c223a2022616e79222c202274656d706f72616c223a2022616e79227d2c20226461746170726f7065727479223a207b22666f726d6174223a2022696e616f6b615f70726f6772616d5f73616d706c655f73656d616e746963227d7d,32780  >  7000 Len=167
28,9.346083,192.168.11.31,192.168.11.29,TCP,74,,œ,0.008633,"Jan  6, 2024 19:36:22.659644000 JST",,50706  >  6000 [SYN] Seq=0 Win=64240 Len=0 MSS=1460 SACK_PERM TSval=2222182746 TSecr=0 WS=128
29,9.346218,192.168.11.29,192.168.11.31,TCP,74,0.000135,,0.000135,"Jan  6, 2024 19:36:22.659779000 JST",,"6000  >  50706 [SYN, ACK] Seq=0 Ack=1 Win=65160 Len=0 MSS=1460 SACK_PERM TSval=3583834198 TSecr=2222182746 WS=128"
30,9.353811,192.168.11.31,192.168.11.29,TCP,66,0.007593,,0.007593,"Jan  6, 2024 19:36:22.667372000 JST",,50706  >  6000 [ACK] Seq=1 Ack=1 Win=64256 Len=0 TSval=2222182753 TSecr=3583834198
31,9.354429,192.168.11.31,192.168.11.29,TCP,93,,,0.000618,"Jan  6, 2024 19:36:22.667990000 JST",,"50706  >  6000 [PSH, ACK] Seq=1 Ack=1 Win=64256 Len=27 TSval=2222182753 TSecr=3583834198 [TCP segment of a reassembled PDU]"
32,9.354554,192.168.11.29,192.168.11.31,TCP,66,0.000125,,0.000125,"Jan  6, 2024 19:36:22.668115000 JST",,6000  >  50706 [ACK] Seq=1 Ack=28 Win=65152 Len=0 TSval=3583834206 TSecr=2222182753
33,9.354628,192.168.11.31,192.168.11.29,TCP,66,,,0.000074,"Jan  6, 2024 19:36:22.668189000 JST",,"50706  >  6000 [FIN, ACK] Seq=28 Ack=1 Win=64256 Len=0 TSval=2222182753 TSecr=3583834198"
34,9.355942,192.168.11.29,192.168.11.31,TCP,66,0.001314,,0.001314,"Jan  6, 2024 19:36:22.669503000 JST",,"6000  >  50706 [FIN, ACK] Seq=1 Ack=29 Win=65152 Len=0 TSval=3583834208 TSecr=2222182753"
35,9.363223,192.168.11.31,192.168.11.29,TCP,66,0.007281,,0.007281,"Jan  6, 2024 19:36:22.676784000 JST",,50706  >  6000 [ACK] Seq=29 Ack=2 Win=64256 Len=0 TSval=2222182761 TSecr=3583834208
36,19.128513,192.168.11.29,192.168.11.6,TCP,74,,,9.76529,"Jan  6, 2024 19:36:32.442074000 JST",,45170  >  6000 [SYN] Seq=0 Win=64240 Len=0 MSS=1460 SACK_PERM TSval=667330436 TSecr=0 WS=128
37,19.135536,192.168.11.6,192.168.11.29,TCP,74,0.007023,,0.007023,"Jan  6, 2024 19:36:32.449097000 JST",,"6000  >  45170 [SYN, ACK] Seq=0 Ack=1 Win=65160 Len=0 MSS=1460 SACK_PERM TSval=526264647 TSecr=667330436 WS=128"
38,19.135654,192.168.11.29,192.168.11.6,TCP,66,0.000118,,0.000118,"Jan  6, 2024 19:36:32.449215000 JST",,45170  >  6000 [ACK] Seq=1 Ack=1 Win=64256 Len=0 TSval=667330443 TSecr=526264647
39,19.135925,192.168.11.29,192.168.11.6,TCP,93,,,0.000271,"Jan  6, 2024 19:36:32.449486000 JST",,"45170  >  6000 [PSH, ACK] Seq=1 Ack=1 Win=64256 Len=27 TSval=667330444 TSecr=526264647 [TCP segment of a reassembled PDU]"
40,19.136039,192.168.11.29,192.168.11.6,TCP,66,,,0.000114,"Jan  6, 2024 19:36:32.449600000 JST",,"45170  >  6000 [FIN, ACK] Seq=28 Ack=1 Win=64256 Len=0 TSval=667330444 TSecr=526264647"
41,19.142904,192.168.11.6,192.168.11.29,TCP,66,0.006979,,0.006865,"Jan  6, 2024 19:36:32.456465000 JST",,6000  >  45170 [ACK] Seq=1 Ack=28 Win=65152 Len=0 TSval=526264655 TSecr=667330444
42,19.143131,192.168.11.6,192.168.11.29,TCP,66,0.007092,,0.000227,"Jan  6, 2024 19:36:32.456692000 JST",,"6000  >  45170 [FIN, ACK] Seq=1 Ack=29 Win=65152 Len=0 TSval=526264657 TSecr=667330444"
43,19.143178,192.168.11.29,192.168.11.6,TCP,66,0.000047,,0.000047,"Jan  6, 2024 19:36:32.456739000 JST",,45170  >  6000 [ACK] Seq=29 Ack=2 Win=64256 Len=0 TSval=667330451 TSecr=526264657
44,19.175061,192.168.11.29,255.255.255.255,UDP,209,,Ÿ,0.031883,"Jan  6, 2024 19:36:32.488622000 JST",7b2273656d616e74696373223a207b22656e74697479223a2022504944222c202262617365656e74697479223a2022616e79222c2022726f6c65223a2022333333222c20227370617469616c223a2022616e79222c202274656d706f72616c223a2022616e79227d2c20226461746170726f7065727479223a207b22666f726d6174223a2022696e616f6b615f70726f6772616d5f73616d706c655f73656d616e746963227d7d,43445  >  7000 Len=167
45,19.183595,192.168.11.31,192.168.11.29,TCP,74,,œ,0.008534,"Jan  6, 2024 19:36:32.497156000 JST",,59296  >  6000 [SYN] Seq=0 Win=64240 Len=0 MSS=1460 SACK_PERM TSval=2222192583 TSecr=0 WS=128
46,19.183748,192.168.11.29,192.168.11.31,TCP,74,0.000153,,0.000153,"Jan  6, 2024 19:36:32.497309000 JST",,"6000  >  59296 [SYN, ACK] Seq=0 Ack=1 Win=65160 Len=0 MSS=1460 SACK_PERM TSval=3583844036 TSecr=2222192583 WS=128"
47,19.190706,192.168.11.31,192.168.11.29,TCP,66,0.006958,,0.006958,"Jan  6, 2024 19:36:32.504267000 JST",,59296  >  6000 [ACK] Seq=1 Ack=1 Win=64256 Len=0 TSval=2222192590 TSecr=3583844036
48,19.191415,192.168.11.31,192.168.11.29,TCP,93,,,0.000709,"Jan  6, 2024 19:36:32.504976000 JST",,"59296  >  6000 [PSH, ACK] Seq=1 Ack=1 Win=64256 Len=27 TSval=2222192590 TSecr=3583844036 [TCP segment of a reassembled PDU]"
49,19.191519,192.168.11.29,192.168.11.31,TCP,66,0.000104,,0.000104,"Jan  6, 2024 19:36:32.505080000 JST",,6000  >  59296 [ACK] Seq=1 Ack=28 Win=65152 Len=0 TSval=3583844043 TSecr=2222192590
50,19.191606,192.168.11.31,192.168.11.29,TCP,66,,,0.000087,"Jan  6, 2024 19:36:32.505167000 JST",,"59296  >  6000 [FIN, ACK] Seq=28 Ack=1 Win=64256 Len=0 TSval=2222192590 TSecr=3583844036"
51,19.193783,192.168.11.29,192.168.11.31,TCP,66,0.002177,,0.002177,"Jan  6, 2024 19:36:32.507344000 JST",,"6000  >  59296 [FIN, ACK] Seq=1 Ack=29 Win=65152 Len=0 TSval=3583844046 TSecr=2222192590"
52,19.202306,192.168.11.31,192.168.11.29,TCP,66,0.008523,,0.008523,"Jan  6, 2024 19:36:32.515867000 JST",,59296  >  6000 [ACK] Seq=29 Ack=2 Win=64256 Len=0 TSval=2222192598 TSecr=3583844046
53,29.063099,192.168.11.29,192.168.11.6,TCP,74,,,9.860793,"Jan  6, 2024 19:36:42.376660000 JST",,54044  >  6000 [SYN] Seq=0 Win=64240 Len=0 MSS=1460 SACK_PERM TSval=667340371 TSecr=0 WS=128
54,29.069969,192.168.11.6,192.168.11.29,TCP,74,0.00687,,0.00687,"Jan  6, 2024 19:36:42.383530000 JST",,"6000  >  54044 [SYN, ACK] Seq=0 Ack=1 Win=65160 Len=0 MSS=1460 SACK_PERM TSval=526274582 TSecr=667340371 WS=128"
55,29.07009,192.168.11.29,192.168.11.6,TCP,66,0.000121,,0.000121,"Jan  6, 2024 19:36:42.383651000 JST",,54044  >  6000 [ACK] Seq=1 Ack=1 Win=64256 Len=0 TSval=667340378 TSecr=526274582
56,29.070383,192.168.11.29,192.168.11.6,TCP,93,,,0.000293,"Jan  6, 2024 19:36:42.383944000 JST",,"54044  >  6000 [PSH, ACK] Seq=1 Ack=1 Win=64256 Len=27 TSval=667340378 TSecr=526274582 [TCP segment of a reassembled PDU]"
57,29.070503,192.168.11.29,192.168.11.6,TCP,66,,,0.00012,"Jan  6, 2024 19:36:42.384064000 JST",,"54044  >  6000 [FIN, ACK] Seq=28 Ack=1 Win=64256 Len=0 TSval=667340378 TSecr=526274582"
58,29.077444,192.168.11.6,192.168.11.29,TCP,66,0.007061,,0.006941,"Jan  6, 2024 19:36:42.391005000 JST",,6000  >  54044 [ACK] Seq=1 Ack=28 Win=65152 Len=0 TSval=526274589 TSecr=667340378
59,29.077662,192.168.11.6,192.168.11.29,TCP,66,0.007159,,0.000218,"Jan  6, 2024 19:36:42.391223000 JST",,"6000  >  54044 [FIN, ACK] Seq=1 Ack=29 Win=65152 Len=0 TSval=526274591 TSecr=667340378"
60,29.077708,192.168.11.29,192.168.11.6,TCP,66,0.000046,,0.000046,"Jan  6, 2024 19:36:42.391269000 JST",,54044  >  6000 [ACK] Seq=29 Ack=2 Win=64256 Len=0 TSval=667340386 TSecr=526274591
61,29.109336,192.168.11.29,255.255.255.255,UDP,209,,Ÿ,0.031628,"Jan  6, 2024 19:36:42.422897000 JST",7b2273656d616e74696373223a207b22656e74697479223a2022504944222c202262617365656e74697479223a2022616e79222c2022726f6c65223a2022333333222c20227370617469616c223a2022616e79222c202274656d706f72616c223a2022616e79227d2c20226461746170726f7065727479223a207b22666f726d6174223a2022696e616f6b615f70726f6772616d5f73616d706c655f73656d616e746963227d7d,59235  >  7000 Len=167
62,29.117422,192.168.11.31,192.168.11.29,TCP,74,,œ,0.008086,"Jan  6, 2024 19:36:42.430983000 JST",,57090  >  6000 [SYN] Seq=0 Win=64240 Len=0 MSS=1460 SACK_PERM TSval=2222202517 TSecr=0 WS=128
63,29.117583,192.168.11.29,192.168.11.31,TCP,74,0.000161,,0.000161,"Jan  6, 2024 19:36:42.431144000 JST",,"6000  >  57090 [SYN, ACK] Seq=0 Ack=1 Win=65160 Len=0 MSS=1460 SACK_PERM TSval=3583853969 TSecr=2222202517 WS=128"
64,29.124246,192.168.11.31,192.168.11.29,TCP,66,0.006663,,0.006663,"Jan  6, 2024 19:36:42.437807000 JST",,57090  >  6000 [ACK] Seq=1 Ack=1 Win=64256 Len=0 TSval=2222202524 TSecr=3583853969
65,29.125011,192.168.11.31,192.168.11.29,TCP,93,,,0.000765,"Jan  6, 2024 19:36:42.438572000 JST",,"57090  >  6000 [PSH, ACK] Seq=1 Ack=1 Win=64256 Len=27 TSval=2222202524 TSecr=3583853969 [TCP segment of a reassembled PDU]"
66,29.125056,192.168.11.31,192.168.11.29,TCP,66,,,0.000045,"Jan  6, 2024 19:36:42.438617000 JST",,"57090  >  6000 [FIN, ACK] Seq=28 Ack=1 Win=64256 Len=0 TSval=2222202524 TSecr=3583853969"
67,29.126667,192.168.11.29,192.168.11.31,TCP,66,0.001611,,0.001611,"Jan  6, 2024 19:36:42.440228000 JST",,"6000  >  57090 [FIN, ACK] Seq=1 Ack=29 Win=65152 Len=0 TSval=3583853978 TSecr=2222202524"
68,29.134713,192.168.11.31,192.168.11.29,TCP,66,0.008046,,0.008046,"Jan  6, 2024 19:36:42.448274000 JST",,57090  >  6000 [ACK] Seq=29 Ack=2 Win=64256 Len=0 TSval=2222202533 TSecr=3583853978
69,36.891211,192.168.11.29,192.168.11.6,TCP,74,,,7.756498,"Jan  6, 2024 19:36:50.204772000 JST",,53006  >  6000 [SYN] Seq=0 Win=64240 Len=0 MSS=1460 SACK_PERM TSval=667348199 TSecr=0 WS=128
70,36.897945,192.168.11.6,192.168.11.29,TCP,74,0.006734,,0.006734,"Jan  6, 2024 19:36:50.211506000 JST",,"6000  >  53006 [SYN, ACK] Seq=0 Ack=1 Win=65160 Len=0 MSS=1460 SACK_PERM TSval=526282410 TSecr=667348199 WS=128"
71,36.898079,192.168.11.29,192.168.11.6,TCP,66,0.000134,,0.000134,"Jan  6, 2024 19:36:50.211640000 JST",,53006  >  6000 [ACK] Seq=1 Ack=1 Win=64256 Len=0 TSval=667348206 TSecr=526282410
72,36.898288,192.168.11.29,192.168.11.6,TCP,93,,,0.000209,"Jan  6, 2024 19:36:50.211849000 JST",,"53006  >  6000 [PSH, ACK] Seq=1 Ack=1 Win=64256 Len=27 TSval=667348206 TSecr=526282410 [TCP segment of a reassembled PDU]"
73,36.898406,192.168.11.29,192.168.11.6,TCP,66,,,0.000118,"Jan  6, 2024 19:36:50.211967000 JST",,"53006  >  6000 [FIN, ACK] Seq=28 Ack=1 Win=64256 Len=0 TSval=667348206 TSecr=526282410"
74,36.905322,192.168.11.6,192.168.11.29,TCP,66,0.007034,,0.006916,"Jan  6, 2024 19:36:50.218883000 JST",,6000  >  53006 [ACK] Seq=1 Ack=28 Win=65152 Len=0 TSval=526282417 TSecr=667348206
75,36.9057,192.168.11.6,192.168.11.29,TCP,66,0.007294,,0.000378,"Jan  6, 2024 19:36:50.219261000 JST",,"6000  >  53006 [FIN, ACK] Seq=1 Ack=29 Win=65152 Len=0 TSval=526282418 TSecr=667348206"
76,36.90576,192.168.11.29,192.168.11.6,TCP,66,0.00006,,0.00006,"Jan  6, 2024 19:36:50.219321000 JST",,53006  >  6000 [ACK] Seq=29 Ack=2 Win=64256 Len=0 TSval=667348214 TSecr=526282418
77,36.934857,192.168.11.29,255.255.255.255,UDP,209,,Ÿ,0.029097,"Jan  6, 2024 19:36:50.248418000 JST",7b2273656d616e74696373223a207b22656e74697479223a2022504944222c202262617365656e74697479223a2022616e79222c2022726f6c65223a2022333333222c20227370617469616c223a2022616e79222c202274656d706f72616c223a2022616e79227d2c20226461746170726f7065727479223a207b22666f726d6174223a2022696e616f6b615f70726f6772616d5f73616d706c655f73656d616e746963227d7d,38229  >  7000 Len=167
78,36.942859,192.168.11.31,192.168.11.29,TCP,74,,œ,0.008002,"Jan  6, 2024 19:36:50.256420000 JST",,54992  >  6000 [SYN] Seq=0 Win=64240 Len=0 MSS=1460 SACK_PERM TSval=2222210342 TSecr=0 WS=128
79,36.94302,192.168.11.29,192.168.11.31,TCP,74,0.000161,,0.000161,"Jan  6, 2024 19:36:50.256581000 JST",,"6000  >  54992 [SYN, ACK] Seq=0 Ack=1 Win=65160 Len=0 MSS=1460 SACK_PERM TSval=3583861795 TSecr=2222210342 WS=128"
80,36.950189,192.168.11.31,192.168.11.29,TCP,66,0.007169,,0.007169,"Jan  6, 2024 19:36:50.263750000 JST",,54992  >  6000 [ACK] Seq=1 Ack=1 Win=64256 Len=0 TSval=2222210350 TSecr=3583861795
81,36.950654,192.168.11.31,192.168.11.29,TCP,93,,,0.000465,"Jan  6, 2024 19:36:50.264215000 JST",,"54992  >  6000 [PSH, ACK] Seq=1 Ack=1 Win=64256 Len=27 TSval=2222210350 TSecr=3583861795 [TCP segment of a reassembled PDU]"
82,36.950781,192.168.11.29,192.168.11.31,TCP,66,0.000127,,0.000127,"Jan  6, 2024 19:36:50.264342000 JST",,6000  >  54992 [ACK] Seq=1 Ack=28 Win=65152 Len=0 TSval=3583861803 TSecr=2222210350
83,36.951042,192.168.11.31,192.168.11.29,TCP,66,,,0.000261,"Jan  6, 2024 19:36:50.264603000 JST",,"54992  >  6000 [FIN, ACK] Seq=28 Ack=1 Win=64256 Len=0 TSval=2222210350 TSecr=3583861795"
84,36.953524,192.168.11.29,192.168.11.31,TCP,66,0.002482,,0.002482,"Jan  6, 2024 19:36:50.267085000 JST",,"6000  >  54992 [FIN, ACK] Seq=1 Ack=29 Win=65152 Len=0 TSval=3583861805 TSecr=2222210350"
85,36.962123,192.168.11.31,192.168.11.29,TCP,66,0.008599,,0.008599,"Jan  6, 2024 19:36:50.275684000 JST",,54992  >  6000 [ACK] Seq=29 Ack=2 Win=64256 Len=0 TSval=2222210361 TSecr=3583861805
86,44.684953,192.168.11.29,192.168.11.6,TCP,74,,,7.72283,"Jan  6, 2024 19:36:57.998514000 JST",,53020  >  6000 [SYN] Seq=0 Win=64240 Len=0 MSS=1460 SACK_PERM TSval=667355993 TSecr=0 WS=128
87,44.691604,192.168.11.6,192.168.11.29,TCP,74,0.006651,,0.006651,"Jan  6, 2024 19:36:58.005165000 JST",,"6000  >  53020 [SYN, ACK] Seq=0 Ack=1 Win=65160 Len=0 MSS=1460 SACK_PERM TSval=526290204 TSecr=667355993 WS=128"
88,44.691737,192.168.11.29,192.168.11.6,TCP,66,0.000133,,0.000133,"Jan  6, 2024 19:36:58.005298000 JST",,53020  >  6000 [ACK] Seq=1 Ack=1 Win=64256 Len=0 TSval=667356000 TSecr=526290204
89,44.691887,192.168.11.29,192.168.11.6,TCP,93,,,0.00015,"Jan  6, 2024 19:36:58.005448000 JST",,"53020  >  6000 [PSH, ACK] Seq=1 Ack=1 Win=64256 Len=27 TSval=667356000 TSecr=526290204 [TCP segment of a reassembled PDU]"
90,44.691994,192.168.11.29,192.168.11.6,TCP,66,,,0.000107,"Jan  6, 2024 19:36:58.005555000 JST",,"53020  >  6000 [FIN, ACK] Seq=28 Ack=1 Win=64256 Len=0 TSval=667356000 TSecr=526290204"
91,44.70272,192.168.11.6,192.168.11.29,TCP,66,0.010726,,0.010726,"Jan  6, 2024 19:36:58.016281000 JST",,"6000  >  53020 [FIN, ACK] Seq=1 Ack=29 Win=65152 Len=0 TSval=526290212 TSecr=667356000"
92,44.702811,192.168.11.29,192.168.11.6,TCP,66,0.000091,,0.000091,"Jan  6, 2024 19:36:58.016372000 JST",,53020  >  6000 [ACK] Seq=29 Ack=2 Win=64256 Len=0 TSval=667356011 TSecr=526290212
93,44.733682,192.168.11.29,255.255.255.255,UDP,209,,Ÿ,0.030871,"Jan  6, 2024 19:36:58.047243000 JST",7b2273656d616e74696373223a207b22656e74697479223a2022504944222c202262617365656e74697479223a2022616e79222c2022726f6c65223a2022333333222c20227370617469616c223a2022616e79222c202274656d706f72616c223a2022616e79227d2c20226461746170726f7065727479223a207b22666f726d6174223a2022696e616f6b615f70726f6772616d5f73616d706c655f73656d616e746963227d7d,50420  >  7000 Len=167
94,44.742383,192.168.11.31,192.168.11.29,TCP,74,,œ,0.008701,"Jan  6, 2024 19:36:58.055944000 JST",,57712  >  6000 [SYN] Seq=0 Win=64240 Len=0 MSS=1460 SACK_PERM TSval=2222218141 TSecr=0 WS=128
95,44.742551,192.168.11.29,192.168.11.31,TCP,74,0.000168,,0.000168,"Jan  6, 2024 19:36:58.056112000 JST",,"6000  >  57712 [SYN, ACK] Seq=0 Ack=1 Win=65160 Len=0 MSS=1460 SACK_PERM TSval=3583869594 TSecr=2222218141 WS=128"
96,44.749492,192.168.11.31,192.168.11.29,TCP,66,0.006941,,0.006941,"Jan  6, 2024 19:36:58.063053000 JST",,57712  >  6000 [ACK] Seq=1 Ack=1 Win=64256 Len=0 TSval=2222218149 TSecr=3583869594
97,44.750203,192.168.11.31,192.168.11.29,TCP,93,,,0.000711,"Jan  6, 2024 19:36:58.063764000 JST",,"57712  >  6000 [PSH, ACK] Seq=1 Ack=1 Win=64256 Len=27 TSval=2222218149 TSecr=3583869594 [TCP segment of a reassembled PDU]"
98,44.75034,192.168.11.29,192.168.11.31,TCP,66,0.000137,,0.000137,"Jan  6, 2024 19:36:58.063901000 JST",,6000  >  57712 [ACK] Seq=1 Ack=28 Win=65152 Len=0 TSval=3583869602 TSecr=2222218149
99,44.750447,192.168.11.31,192.168.11.29,TCP,66,,,0.000107,"Jan  6, 2024 19:36:58.064008000 JST",,"57712  >  6000 [FIN, ACK] Seq=28 Ack=1 Win=64256 Len=0 TSval=2222218149 TSecr=3583869594"
100,44.752575,192.168.11.29,192.168.11.31,TCP,66,0.002128,,0.002128,"Jan  6, 2024 19:36:58.066136000 JST",,"6000  >  57712 [FIN, ACK] Seq=1 Ack=29 Win=65152 Len=0 TSval=3583869604 TSecr=2222218149"
101,44.761181,192.168.11.31,192.168.11.29,TCP,66,0.008606,,0.008606,"Jan  6, 2024 19:36:58.074742000 JST",,57712  >  6000 [ACK] Seq=29 Ack=2 Win=64256 Len=0 TSval=2222218159 TSecr=3583869604
102,52.548362,192.168.11.29,192.168.11.6,TCP,74,,,7.787181,"Jan  6, 2024 19:37:05.861923000 JST",,35268  >  6000 [SYN] Seq=0 Win=64240 Len=0 MSS=1460 SACK_PERM TSval=667363856 TSecr=0 WS=128
103,52.557351,192.168.11.6,192.168.11.29,TCP,74,0.008989,,0.008989,"Jan  6, 2024 19:37:05.870912000 JST",,"6000  >  35268 [SYN, ACK] Seq=0 Ack=1 Win=65160 Len=0 MSS=1460 SACK_PERM TSval=526298069 TSecr=667363856 WS=128"
104,52.557484,192.168.11.29,192.168.11.6,TCP,66,0.000133,,0.000133,"Jan  6, 2024 19:37:05.871045000 JST",,35268  >  6000 [ACK] Seq=1 Ack=1 Win=64256 Len=0 TSval=667363865 TSecr=526298069
105,52.557674,192.168.11.29,192.168.11.6,TCP,93,,,0.00019,"Jan  6, 2024 19:37:05.871235000 JST",,"35268  >  6000 [PSH, ACK] Seq=1 Ack=1 Win=64256 Len=27 TSval=667363865 TSecr=526298069 [TCP segment of a reassembled PDU]"
106,52.557789,192.168.11.29,192.168.11.6,TCP,66,,,0.000115,"Jan  6, 2024 19:37:05.871350000 JST",,"35268  >  6000 [FIN, ACK] Seq=28 Ack=1 Win=64256 Len=0 TSval=667363866 TSecr=526298069"
107,52.565837,192.168.11.6,192.168.11.29,TCP,66,0.008163,,0.008048,"Jan  6, 2024 19:37:05.879398000 JST",,6000  >  35268 [ACK] Seq=1 Ack=28 Win=65152 Len=0 TSval=526298077 TSecr=667363865
108,52.566344,192.168.11.6,192.168.11.29,TCP,66,0.008555,,0.000507,"Jan  6, 2024 19:37:05.879905000 JST",,"6000  >  35268 [FIN, ACK] Seq=1 Ack=29 Win=65152 Len=0 TSval=526298079 TSecr=667363866"
109,52.566413,192.168.11.29,192.168.11.6,TCP,66,0.000069,,0.000069,"Jan  6, 2024 19:37:05.879974000 JST",,35268  >  6000 [ACK] Seq=29 Ack=2 Win=64256 Len=0 TSval=667363874 TSecr=526298079
110,52.594945,192.168.11.29,255.255.255.255,UDP,209,,Ÿ,0.028532,"Jan  6, 2024 19:37:05.908506000 JST",7b2273656d616e74696373223a207b22656e74697479223a2022504944222c202262617365656e74697479223a2022616e79222c2022726f6c65223a2022333333222c20227370617469616c223a2022616e79222c202274656d706f72616c223a2022616e79227d2c20226461746170726f7065727479223a207b22666f726d6174223a2022696e616f6b615f70726f6772616d5f73616d706c655f73656d616e746963227d7d,45414  >  7000 Len=167
111,52.60348,192.168.11.31,192.168.11.29,TCP,74,,œ,0.008535,"Jan  6, 2024 19:37:05.917041000 JST",,57716  >  6000 [SYN] Seq=0 Win=64240 Len=0 MSS=1460 SACK_PERM TSval=2222226003 TSecr=0 WS=128
112,52.603638,192.168.11.29,192.168.11.31,TCP,74,0.000158,,0.000158,"Jan  6, 2024 19:37:05.917199000 JST",,"6000  >  57716 [SYN, ACK] Seq=0 Ack=1 Win=65160 Len=0 MSS=1460 SACK_PERM TSval=3583877455 TSecr=2222226003 WS=128"
113,52.61035,192.168.11.31,192.168.11.29,TCP,66,0.006712,,0.006712,"Jan  6, 2024 19:37:05.923911000 JST",,57716  >  6000 [ACK] Seq=1 Ack=1 Win=64256 Len=0 TSval=2222226010 TSecr=3583877455
114,52.610948,192.168.11.31,192.168.11.29,TCP,93,,,0.000598,"Jan  6, 2024 19:37:05.924509000 JST",,"57716  >  6000 [PSH, ACK] Seq=1 Ack=1 Win=64256 Len=27 TSval=2222226010 TSecr=3583877455 [TCP segment of a reassembled PDU]"
115,52.611078,192.168.11.29,192.168.11.31,TCP,66,0.00013,,0.00013,"Jan  6, 2024 19:37:05.924639000 JST",,6000  >  57716 [ACK] Seq=1 Ack=28 Win=65152 Len=0 TSval=3583877463 TSecr=2222226010
116,52.611147,192.168.11.31,192.168.11.29,TCP,66,,,0.000069,"Jan  6, 2024 19:37:05.924708000 JST",,"57716  >  6000 [FIN, ACK] Seq=28 Ack=1 Win=64256 Len=0 TSval=2222226010 TSecr=3583877455"
117,52.612296,192.168.11.29,192.168.11.31,TCP,66,0.001149,,0.001149,"Jan  6, 2024 19:37:05.925857000 JST",,"6000  >  57716 [FIN, ACK] Seq=1 Ack=29 Win=65152 Len=0 TSval=3583877464 TSecr=2222226010"
118,52.618477,192.168.11.31,192.168.11.29,TCP,66,0.006181,,0.006181,"Jan  6, 2024 19:37:05.932038000 JST",,57716  >  6000 [ACK] Seq=29 Ack=2 Win=64256 Len=0 TSval=2222226018 TSecr=3583877464
119,60.841287,192.168.11.29,192.168.11.6,TCP,74,,,8.22281,"Jan  6, 2024 19:37:14.154848000 JST",,34132  >  6000 [SYN] Seq=0 Win=64240 Len=0 MSS=1460 SACK_PERM TSval=667372149 TSecr=0 WS=128
120,60.855317,192.168.11.6,192.168.11.29,TCP,74,0.01403,,0.01403,"Jan  6, 2024 19:37:14.168878000 JST",,"6000  >  34132 [SYN, ACK] Seq=0 Ack=1 Win=65160 Len=0 MSS=1460 SACK_PERM TSval=526306365 TSecr=667372149 WS=128"
121,60.855428,192.168.11.29,192.168.11.6,TCP,66,0.000111,,0.000111,"Jan  6, 2024 19:37:14.168989000 JST",,34132  >  6000 [ACK] Seq=1 Ack=1 Win=64256 Len=0 TSval=667372163 TSecr=526306365
122,60.855649,192.168.11.29,192.168.11.6,TCP,93,,,0.000221,"Jan  6, 2024 19:37:14.169210000 JST",,"34132  >  6000 [PSH, ACK] Seq=1 Ack=1 Win=64256 Len=27 TSval=667372163 TSecr=526306365 [TCP segment of a reassembled PDU]"
123,60.855758,192.168.11.29,192.168.11.6,TCP,66,,,0.000109,"Jan  6, 2024 19:37:14.169319000 JST",,"34132  >  6000 [FIN, ACK] Seq=28 Ack=1 Win=64256 Len=0 TSval=667372164 TSecr=526306365"
124,60.869061,192.168.11.6,192.168.11.29,TCP,66,0.013412,,0.013303,"Jan  6, 2024 19:37:14.182622000 JST",,6000  >  34132 [ACK] Seq=1 Ack=28 Win=65152 Len=0 TSval=526306375 TSecr=667372163
125,60.869457,192.168.11.6,192.168.11.29,TCP,66,0.013699,,0.000396,"Jan  6, 2024 19:37:14.183018000 JST",,"6000  >  34132 [FIN, ACK] Seq=1 Ack=29 Win=65152 Len=0 TSval=526306377 TSecr=667372164"
126,60.869513,192.168.11.29,192.168.11.6,TCP,66,0.000056,,0.000056,"Jan  6, 2024 19:37:14.183074000 JST",,34132  >  6000 [ACK] Seq=29 Ack=2 Win=64256 Len=0 TSval=667372177 TSecr=526306377
127,60.899673,192.168.11.29,255.255.255.255,UDP,209,,Ÿ,0.03016,"Jan  6, 2024 19:37:14.213234000 JST",7b2273656d616e74696373223a207b22656e74697479223a2022504944222c202262617365656e74697479223a2022616e79222c2022726f6c65223a2022333333222c20227370617469616c223a2022616e79222c202274656d706f72616c223a2022616e79227d2c20226461746170726f7065727479223a207b22666f726d6174223a2022696e616f6b615f70726f6772616d5f73616d706c655f73656d616e746963227d7d,58306  >  7000 Len=167
128,60.908524,192.168.11.31,192.168.11.29,TCP,74,,œ,0.008851,"Jan  6, 2024 19:37:14.222085000 JST",,52058  >  6000 [SYN] Seq=0 Win=64240 Len=0 MSS=1460 SACK_PERM TSval=2222234308 TSecr=0 WS=128
129,60.90874,192.168.11.29,192.168.11.31,TCP,74,0.000216,,0.000216,"Jan  6, 2024 19:37:14.222301000 JST",,"6000  >  52058 [SYN, ACK] Seq=0 Ack=1 Win=65160 Len=0 MSS=1460 SACK_PERM TSval=3583885760 TSecr=2222234308 WS=128"
130,60.91563,192.168.11.31,192.168.11.29,TCP,66,0.00689,,0.00689,"Jan  6, 2024 19:37:14.229191000 JST",,52058  >  6000 [ACK] Seq=1 Ack=1 Win=64256 Len=0 TSval=2222234315 TSecr=3583885760
131,60.916219,192.168.11.31,192.168.11.29,TCP,93,,,0.000589,"Jan  6, 2024 19:37:14.229780000 JST",,"52058  >  6000 [PSH, ACK] Seq=1 Ack=1 Win=64256 Len=27 TSval=2222234315 TSecr=3583885760 [TCP segment of a reassembled PDU]"
132,60.916305,192.168.11.29,192.168.11.31,TCP,66,0.000086,,0.000086,"Jan  6, 2024 19:37:14.229866000 JST",,6000  >  52058 [ACK] Seq=1 Ack=28 Win=65152 Len=0 TSval=3583885768 TSecr=2222234315
133,60.916509,192.168.11.31,192.168.11.29,TCP,66,,,0.000204,"Jan  6, 2024 19:37:14.230070000 JST",,"52058  >  6000 [FIN, ACK] Seq=28 Ack=1 Win=64256 Len=0 TSval=2222234316 TSecr=3583885760"
134,60.917902,192.168.11.29,192.168.11.31,TCP,66,0.001393,,0.001393,"Jan  6, 2024 19:37:14.231463000 JST",,"6000  >  52058 [FIN, ACK] Seq=1 Ack=29 Win=65152 Len=0 TSval=3583885770 TSecr=2222234316"
135,60.923987,192.168.11.31,192.168.11.29,TCP,66,0.006085,,0.006085,"Jan  6, 2024 19:37:14.237548000 JST",,52058  >  6000 [ACK] Seq=29 Ack=2 Win=64256 Len=0 TSval=2222234323 TSecr=3583885770
136,72.763489,192.168.11.29,192.168.11.6,TCP,74,,,11.839502,"Jan  6, 2024 19:37:26.077050000 JST",,45184  >  6000 [SYN] Seq=0 Win=64240 Len=0 MSS=1460 SACK_PERM TSval=667384071 TSecr=0 WS=128
137,72.772495,192.168.11.6,192.168.11.29,TCP,74,0.009006,,0.009006,"Jan  6, 2024 19:37:26.086056000 JST",,"6000  >  45184 [SYN, ACK] Seq=0 Ack=1 Win=65160 Len=0 MSS=1460 SACK_PERM TSval=526318285 TSecr=667384071 WS=128"
138,72.772621,192.168.11.29,192.168.11.6,TCP,66,0.000126,,0.000126,"Jan  6, 2024 19:37:26.086182000 JST",,45184  >  6000 [ACK] Seq=1 Ack=1 Win=64256 Len=0 TSval=667384080 TSecr=526318285
139,72.772933,192.168.11.29,192.168.11.6,TCP,93,,,0.000312,"Jan  6, 2024 19:37:26.086494000 JST",,"45184  >  6000 [PSH, ACK] Seq=1 Ack=1 Win=64256 Len=27 TSval=667384081 TSecr=526318285 [TCP segment of a reassembled PDU]"
140,72.773058,192.168.11.29,192.168.11.6,TCP,66,,,0.000125,"Jan  6, 2024 19:37:26.086619000 JST",,"45184  >  6000 [FIN, ACK] Seq=28 Ack=1 Win=64256 Len=0 TSval=667384081 TSecr=526318285"
141,72.780377,192.168.11.6,192.168.11.29,TCP,66,0.007444,,0.007319,"Jan  6, 2024 19:37:26.093938000 JST",,6000  >  45184 [ACK] Seq=1 Ack=28 Win=65152 Len=0 TSval=526318292 TSecr=667384081
142,72.780599,192.168.11.6,192.168.11.29,TCP,66,0.007541,,0.000222,"Jan  6, 2024 19:37:26.094160000 JST",,"6000  >  45184 [FIN, ACK] Seq=1 Ack=29 Win=65152 Len=0 TSval=526318293 TSecr=667384081"
143,72.780646,192.168.11.29,192.168.11.6,TCP,66,0.000047,,0.000047,"Jan  6, 2024 19:37:26.094207000 JST",,45184  >  6000 [ACK] Seq=29 Ack=2 Win=64256 Len=0 TSval=667384088 TSecr=526318293
144,72.813489,192.168.11.29,255.255.255.255,UDP,209,,Ÿ,0.032843,"Jan  6, 2024 19:37:26.127050000 JST",7b2273656d616e74696373223a207b22656e74697479223a2022504944222c202262617365656e74697479223a2022616e79222c2022726f6c65223a2022333333222c20227370617469616c223a2022616e79222c202274656d706f72616c223a2022616e79227d2c20226461746170726f7065727479223a207b22666f726d6174223a2022696e616f6b615f70726f6772616d5f73616d706c655f73656d616e746963227d7d,57017  >  7000 Len=167
145,72.821666,192.168.11.31,192.168.11.29,TCP,74,,œ,0.008177,"Jan  6, 2024 19:37:26.135227000 JST",,52846  >  6000 [SYN] Seq=0 Win=64240 Len=0 MSS=1460 SACK_PERM TSval=2222246221 TSecr=0 WS=128
146,72.821815,192.168.11.29,192.168.11.31,TCP,74,0.000149,,0.000149,"Jan  6, 2024 19:37:26.135376000 JST",,"6000  >  52846 [SYN, ACK] Seq=0 Ack=1 Win=65160 Len=0 MSS=1460 SACK_PERM TSval=3583897674 TSecr=2222246221 WS=128"
147,72.831588,192.168.11.31,192.168.11.29,TCP,66,0.009773,,0.009773,"Jan  6, 2024 19:37:26.145149000 JST",,52846  >  6000 [ACK] Seq=1 Ack=1 Win=64256 Len=0 TSval=2222246231 TSecr=3583897674
148,72.832131,192.168.11.31,192.168.11.29,TCP,93,,,0.000543,"Jan  6, 2024 19:37:26.145692000 JST",,"52846  >  6000 [PSH, ACK] Seq=1 Ack=1 Win=64256 Len=27 TSval=2222246231 TSecr=3583897674 [TCP segment of a reassembled PDU]"
149,72.832205,192.168.11.29,192.168.11.31,TCP,66,0.000074,,0.000074,"Jan  6, 2024 19:37:26.145766000 JST",,6000  >  52846 [ACK] Seq=1 Ack=28 Win=65152 Len=0 TSval=3583897684 TSecr=2222246231
150,72.832275,192.168.11.31,192.168.11.29,TCP,66,,,0.00007,"Jan  6, 2024 19:37:26.145836000 JST",,"52846  >  6000 [FIN, ACK] Seq=28 Ack=1 Win=64256 Len=0 TSval=2222246231 TSecr=3583897674"
151,72.834699,192.168.11.29,192.168.11.31,TCP,66,0.002424,,0.002424,"Jan  6, 2024 19:37:26.148260000 JST",,"6000  >  52846 [FIN, ACK] Seq=1 Ack=29 Win=65152 Len=0 TSval=3583897686 TSecr=2222246231"
152,72.841676,192.168.11.31,192.168.11.29,TCP,66,0.006977,,0.006977,"Jan  6, 2024 19:37:26.155237000 JST",,52846  >  6000 [ACK] Seq=29 Ack=2 Win=64256 Len=0 TSval=2222246241 TSecr=3583897686
153,81.647755,192.168.11.29,192.168.11.6,TCP,74,,,8.806079,"Jan  6, 2024 19:37:34.961316000 JST",,36892  >  6000 [SYN] Seq=0 Win=64240 Len=0 MSS=1460 SACK_PERM TSval=667392956 TSecr=0 WS=128
154,81.654271,192.168.11.6,192.168.11.29,TCP,74,0.006516,,0.006516,"Jan  6, 2024 19:37:34.967832000 JST",,"6000  >  36892 [SYN, ACK] Seq=0 Ack=1 Win=65160 Len=0 MSS=1460 SACK_PERM TSval=526327166 TSecr=667392956 WS=128"
155,81.654378,192.168.11.29,192.168.11.6,TCP,66,0.000107,,0.000107,"Jan  6, 2024 19:37:34.967939000 JST",,36892  >  6000 [ACK] Seq=1 Ack=1 Win=64256 Len=0 TSval=667392962 TSecr=526327166
156,81.654561,192.168.11.29,192.168.11.6,TCP,93,,,0.000183,"Jan  6, 2024 19:37:34.968122000 JST",,"36892  >  6000 [PSH, ACK] Seq=1 Ack=1 Win=64256 Len=27 TSval=667392962 TSecr=526327166 [TCP segment of a reassembled PDU]"
157,81.654689,192.168.11.29,192.168.11.6,TCP,66,,,0.000128,"Jan  6, 2024 19:37:34.968250000 JST",,"36892  >  6000 [FIN, ACK] Seq=28 Ack=1 Win=64256 Len=0 TSval=667392963 TSecr=526327166"
158,81.661712,192.168.11.6,192.168.11.29,TCP,66,0.007151,,0.007023,"Jan  6, 2024 19:37:34.975273000 JST",,6000  >  36892 [ACK] Seq=1 Ack=28 Win=65152 Len=0 TSval=526327174 TSecr=667392962
159,81.661952,192.168.11.6,192.168.11.29,TCP,66,0.007263,,0.00024,"Jan  6, 2024 19:37:34.975513000 JST",,"6000  >  36892 [FIN, ACK] Seq=1 Ack=29 Win=65152 Len=0 TSval=526327175 TSecr=667392963"
160,81.662007,192.168.11.29,192.168.11.6,TCP,66,0.000055,,0.000055,"Jan  6, 2024 19:37:34.975568000 JST",,36892  >  6000 [ACK] Seq=29 Ack=2 Win=64256 Len=0 TSval=667392970 TSecr=526327175
161,81.695385,192.168.11.29,255.255.255.255,UDP,209,,Ÿ,0.033378,"Jan  6, 2024 19:37:35.008946000 JST",7b2273656d616e74696373223a207b22656e74697479223a2022504944222c202262617365656e74697479223a2022616e79222c2022726f6c65223a2022333333222c20227370617469616c223a2022616e79222c202274656d706f72616c223a2022616e79227d2c20226461746170726f7065727479223a207b22666f726d6174223a2022696e616f6b615f70726f6772616d5f73616d706c655f73656d616e746963227d7d,45691  >  7000 Len=167
162,81.703353,192.168.11.31,192.168.11.29,TCP,74,,œ,0.007968,"Jan  6, 2024 19:37:35.016914000 JST",,48706  >  6000 [SYN] Seq=0 Win=64240 Len=0 MSS=1460 SACK_PERM TSval=2222255103 TSecr=0 WS=128
163,81.703506,192.168.11.29,192.168.11.31,TCP,74,0.000153,,0.000153,"Jan  6, 2024 19:37:35.017067000 JST",,"6000  >  48706 [SYN, ACK] Seq=0 Ack=1 Win=65160 Len=0 MSS=1460 SACK_PERM TSval=3583906555 TSecr=2222255103 WS=128"
164,81.711118,192.168.11.31,192.168.11.29,TCP,66,0.007612,,0.007612,"Jan  6, 2024 19:37:35.024679000 JST",,48706  >  6000 [ACK] Seq=1 Ack=1 Win=64256 Len=0 TSval=2222255111 TSecr=3583906555
165,81.711627,192.168.11.31,192.168.11.29,TCP,93,,,0.000509,"Jan  6, 2024 19:37:35.025188000 JST",,"48706  >  6000 [PSH, ACK] Seq=1 Ack=1 Win=64256 Len=27 TSval=2222255111 TSecr=3583906555 [TCP segment of a reassembled PDU]"
166,81.711716,192.168.11.29,192.168.11.31,TCP,66,0.000089,,0.000089,"Jan  6, 2024 19:37:35.025277000 JST",,6000  >  48706 [ACK] Seq=1 Ack=28 Win=65152 Len=0 TSval=3583906563 TSecr=2222255111
167,81.711785,192.168.11.31,192.168.11.29,TCP,66,,,0.000069,"Jan  6, 2024 19:37:35.025346000 JST",,"48706  >  6000 [FIN, ACK] Seq=28 Ack=1 Win=64256 Len=0 TSval=2222255111 TSecr=3583906555"
168,81.713114,192.168.11.29,192.168.11.31,TCP,66,0.001329,,0.001329,"Jan  6, 2024 19:37:35.026675000 JST",,"6000  >  48706 [FIN, ACK] Seq=1 Ack=29 Win=65152 Len=0 TSval=3583906565 TSecr=2222255111"
169,81.724948,192.168.11.31,192.168.11.29,TCP,66,0.011834,,0.011834,"Jan  6, 2024 19:37:35.038509000 JST",,48706  >  6000 [ACK] Seq=29 Ack=2 Win=64256 Len=0 TSval=2222255124 TSecr=3583906565
170,113.841368,192.168.11.29,192.168.11.6,TCP,74,,,32.11642,"Jan  6, 2024 19:38:07.154929000 JST",,57538  >  6000 [SYN] Seq=0 Win=64240 Len=0 MSS=1460 SACK_PERM TSval=667425149 TSecr=0 WS=128
171,113.848057,192.168.11.6,192.168.11.29,TCP,74,0.006689,,0.006689,"Jan  6, 2024 19:38:07.161618000 JST",,"6000  >  57538 [SYN, ACK] Seq=0 Ack=1 Win=65160 Len=0 MSS=1460 SACK_PERM TSval=526359360 TSecr=667425149 WS=128"
172,113.84817,192.168.11.29,192.168.11.6,TCP,66,0.000113,,0.000113,"Jan  6, 2024 19:38:07.161731000 JST",,57538  >  6000 [ACK] Seq=1 Ack=1 Win=64256 Len=0 TSval=667425156 TSecr=526359360
173,113.848353,192.168.11.29,192.168.11.6,TCP,93,,,0.000183,"Jan  6, 2024 19:38:07.161914000 JST",,"57538  >  6000 [PSH, ACK] Seq=1 Ack=1 Win=64256 Len=27 TSval=667425156 TSecr=526359360 [TCP segment of a reassembled PDU]"
174,113.84845,192.168.11.29,192.168.11.6,TCP,66,,,0.000097,"Jan  6, 2024 19:38:07.162011000 JST",,"57538  >  6000 [FIN, ACK] Seq=28 Ack=1 Win=64256 Len=0 TSval=667425156 TSecr=526359360"
175,113.8554,192.168.11.6,192.168.11.29,TCP,66,0.007047,,0.00695,"Jan  6, 2024 19:38:07.168961000 JST",,6000  >  57538 [ACK] Seq=1 Ack=28 Win=65152 Len=0 TSval=526359367 TSecr=667425156
176,113.85577,192.168.11.6,192.168.11.29,TCP,66,0.00732,,0.00037,"Jan  6, 2024 19:38:07.169331000 JST",,"6000  >  57538 [FIN, ACK] Seq=1 Ack=29 Win=65152 Len=0 TSval=526359368 TSecr=667425156"
177,113.855832,192.168.11.29,192.168.11.6,TCP,66,0.000062,,0.000062,"Jan  6, 2024 19:38:07.169393000 JST",,57538  >  6000 [ACK] Seq=29 Ack=2 Win=64256 Len=0 TSval=667425164 TSecr=526359368
178,113.886741,192.168.11.29,255.255.255.255,UDP,209,,Ÿ,0.030909,"Jan  6, 2024 19:38:07.200302000 JST",7b2273656d616e74696373223a207b22656e74697479223a2022504944222c202262617365656e74697479223a2022616e79222c2022726f6c65223a2022333333222c20227370617469616c223a2022616e79222c202274656d706f72616c223a2022616e79227d2c20226461746170726f7065727479223a207b22666f726d6174223a2022696e616f6b615f70726f6772616d5f73616d706c655f73656d616e746963227d7d,56982  >  7000 Len=167
179,113.898253,192.168.11.31,192.168.11.29,TCP,74,,œ,0.011512,"Jan  6, 2024 19:38:07.211814000 JST",,45034  >  6000 [SYN] Seq=0 Win=64240 Len=0 MSS=1460 SACK_PERM TSval=2222287296 TSecr=0 WS=128
180,113.898425,192.168.11.29,192.168.11.31,TCP,74,0.000172,,0.000172,"Jan  6, 2024 19:38:07.211986000 JST",,"6000  >  45034 [SYN, ACK] Seq=0 Ack=1 Win=65160 Len=0 MSS=1460 SACK_PERM TSval=3583938750 TSecr=2222287296 WS=128"
181,113.909357,192.168.11.31,192.168.11.29,TCP,66,0.010932,,0.010932,"Jan  6, 2024 19:38:07.222918000 JST",,45034  >  6000 [ACK] Seq=1 Ack=1 Win=64256 Len=0 TSval=2222287305 TSecr=3583938750
182,113.909926,192.168.11.31,192.168.11.29,TCP,93,,,0.000569,"Jan  6, 2024 19:38:07.223487000 JST",,"45034  >  6000 [PSH, ACK] Seq=1 Ack=1 Win=64256 Len=27 TSval=2222287305 TSecr=3583938750 [TCP segment of a reassembled PDU]"
183,113.910017,192.168.11.29,192.168.11.31,TCP,66,0.000091,,0.000091,"Jan  6, 2024 19:38:07.223578000 JST",,6000  >  45034 [ACK] Seq=1 Ack=28 Win=65152 Len=0 TSval=3583938762 TSecr=2222287305
184,113.910093,192.168.11.31,192.168.11.29,TCP,66,,,0.000076,"Jan  6, 2024 19:38:07.223654000 JST",,"45034  >  6000 [FIN, ACK] Seq=28 Ack=1 Win=64256 Len=0 TSval=2222287305 TSecr=3583938750"
