No.,Time,Source,Destination,Protocol,Length,The RTT to ACK the segment was,XXX,Time delta from previous captured frame,Arrival Time,Data,Info
1,0,192.168.11.31,192.168.11.29,TCP,74,,,0,"Jan  6, 2024 19:36:14.389602000 JST",,45824  >  6000 [SYN] Seq=0 Win=64240 Len=0 MSS=1460 SACK_PERM TSval=2222174459 TSecr=0 WS=128
2,0.00683,192.168.11.29,192.168.11.31,TCP,74,0.00683,,0.00683,"Jan  6, 2024 19:36:14.396432000 JST",,"6000  >  45824 [SYN, ACK] Seq=0 Ack=1 Win=65160 Len=0 MSS=1460 SACK_PERM TSval=3583825916 TSecr=2222174459 WS=128"
3,0.006955,192.168.11.31,192.168.11.29,TCP,66,0.000125,,0.000125,"Jan  6, 2024 19:36:14.396557000 JST",,45824  >  6000 [ACK] Seq=1 Ack=1 Win=64256 Len=0 TSval=2222174471 TSecr=3583825916
4,0.007213,192.168.11.31,192.168.11.29,TCP,93,,,0.000258,"Jan  6, 2024 19:36:14.396815000 JST",,"45824  >  6000 [PSH, ACK] Seq=1 Ack=1 Win=64256 Len=27 TSval=2222174471 TSecr=3583825916 [TCP segment of a reassembled PDU]"
5,0.007343,192.168.11.31,192.168.11.29,TCP,66,,,0.00013,"Jan  6, 2024 19:36:14.396945000 JST",,"45824  >  6000 [FIN, ACK] Seq=28 Ack=1 Win=64256 Len=0 TSval=2222174471 TSecr=3583825916"
6,0.015364,192.168.11.29,192.168.11.31,TCP,66,0.008151,,0.008021,"Jan  6, 2024 19:36:14.404966000 JST",,6000  >  45824 [ACK] Seq=1 Ack=28 Win=65152 Len=0 TSval=3583825923 TSecr=2222174471
7,0.015956,192.168.11.29,192.168.11.31,TCP,66,0.008613,,0.000592,"Jan  6, 2024 19:36:14.405558000 JST",,"6000  >  45824 [FIN, ACK] Seq=1 Ack=29 Win=65152 Len=0 TSval=3583825925 TSecr=2222174471"
8,0.016014,192.168.11.31,192.168.11.29,TCP,66,0.000058,,0.000058,"Jan  6, 2024 19:36:14.405616000 JST",,45824  >  6000 [ACK] Seq=29 Ack=2 Win=64256 Len=0 TSval=2222174480 TSecr=3583825925
9,0.048578,192.168.11.31,255.255.255.255,UDP,209,,Ÿ,0.032564,"Jan  6, 2024 19:36:14.438180000 JST",7b2273656d616e74696373223a207b22656e74697479223a2022504944222c202262617365656e74697479223a2022616e79222c2022726f6c65223a2022343434222c20227370617469616c223a2022616e79222c202274656d706f72616c223a2022616e79227d2c20226461746170726f7065727479223a207b22666f726d6174223a2022696e616f6b615f70726f6772616d5f73616d706c655f73656d616e746963227d7d,56210  >  7000 Len=167
10,0.061138,192.168.11.15,192.168.11.31,TCP,74,,œ,0.01256,"Jan  6, 2024 19:36:14.450740000 JST",,33572  >  6000 [SYN] Seq=0 Win=64240 Len=0 MSS=1460 SACK_PERM TSval=2684536580 TSecr=0 WS=128
11,0.06129,192.168.11.31,192.168.11.15,TCP,74,0.000152,,0.000152,"Jan  6, 2024 19:36:14.450892000 JST",,"6000  >  33572 [SYN, ACK] Seq=0 Ack=1 Win=65160 Len=0 MSS=1460 SACK_PERM TSval=558701676 TSecr=2684536580 WS=128"
12,0.076676,192.168.11.15,192.168.11.31,TCP,66,0.015386,,0.015386,"Jan  6, 2024 19:36:14.466278000 JST",,33572  >  6000 [ACK] Seq=1 Ack=1 Win=64256 Len=0 TSval=2684536590 TSecr=558701676
13,0.077327,192.168.11.15,192.168.11.31,TCP,93,,,0.000651,"Jan  6, 2024 19:36:14.466929000 JST",,"33572  >  6000 [PSH, ACK] Seq=1 Ack=1 Win=64256 Len=27 TSval=2684536590 TSecr=558701676 [TCP segment of a reassembled PDU]"
14,0.077459,192.168.11.31,192.168.11.15,TCP,66,0.000132,,0.000132,"Jan  6, 2024 19:36:14.467061000 JST",,6000  >  33572 [ACK] Seq=1 Ack=28 Win=65152 Len=0 TSval=558701692 TSecr=2684536590
15,0.077548,192.168.11.15,192.168.11.31,TCP,66,,,0.000089,"Jan  6, 2024 19:36:14.467150000 JST",,"33572  >  6000 [FIN, ACK] Seq=28 Ack=1 Win=64256 Len=0 TSval=2684536590 TSecr=558701676"
16,0.078786,192.168.11.31,192.168.11.15,TCP,66,0.001238,,0.001238,"Jan  6, 2024 19:36:14.468388000 JST",,"6000  >  33572 [FIN, ACK] Seq=1 Ack=29 Win=65152 Len=0 TSval=558701693 TSecr=2684536590"
17,0.085808,192.168.11.15,192.168.11.31,TCP,66,0.007022,,0.007022,"Jan  6, 2024 19:36:14.475410000 JST",,33572  >  6000 [ACK] Seq=29 Ack=2 Win=64256 Len=0 TSval=2684536607 TSecr=558701693
18,8.282002,192.168.11.31,192.168.11.29,TCP,74,,,8.196194,"Jan  6, 2024 19:36:22.671604000 JST",,50706  >  6000 [SYN] Seq=0 Win=64240 Len=0 MSS=1460 SACK_PERM TSval=2222182746 TSecr=0 WS=128
19,8.289166,192.168.11.29,192.168.11.31,TCP,74,0.007164,,0.007164,"Jan  6, 2024 19:36:22.678768000 JST",,"6000  >  50706 [SYN, ACK] Seq=0 Ack=1 Win=65160 Len=0 MSS=1460 SACK_PERM TSval=3583834198 TSecr=2222182746 WS=128"
20,8.289277,192.168.11.31,192.168.11.29,TCP,66,0.000111,,0.000111,"Jan  6, 2024 19:36:22.678879000 JST",,50706  >  6000 [ACK] Seq=1 Ack=1 Win=64256 Len=0 TSval=2222182753 TSecr=3583834198
21,8.28945,192.168.11.31,192.168.11.29,TCP,93,,,0.000173,"Jan  6, 2024 19:36:22.679052000 JST",,"50706  >  6000 [PSH, ACK] Seq=1 Ack=1 Win=64256 Len=27 TSval=2222182753 TSecr=3583834198 [TCP segment of a reassembled PDU]"
22,8.289578,192.168.11.31,192.168.11.29,TCP,66,,,0.000128,"Jan  6, 2024 19:36:22.679180000 JST",,"50706  >  6000 [FIN, ACK] Seq=28 Ack=1 Win=64256 Len=0 TSval=2222182753 TSecr=3583834198"
23,8.297083,192.168.11.29,192.168.11.31,TCP,66,0.007633,,0.007505,"Jan  6, 2024 19:36:22.686685000 JST",,6000  >  50706 [ACK] Seq=1 Ack=28 Win=65152 Len=0 TSval=3583834206 TSecr=2222182753
24,8.2975,192.168.11.29,192.168.11.31,TCP,66,0.007922,,0.000417,"Jan  6, 2024 19:36:22.687102000 JST",,"6000  >  50706 [FIN, ACK] Seq=1 Ack=29 Win=65152 Len=0 TSval=3583834208 TSecr=2222182753"
25,8.297545,192.168.11.31,192.168.11.29,TCP,66,0.000045,,0.000045,"Jan  6, 2024 19:36:22.687147000 JST",,50706  >  6000 [ACK] Seq=29 Ack=2 Win=64256 Len=0 TSval=2222182761 TSecr=3583834208
26,8.328221,192.168.11.31,255.255.255.255,UDP,209,,Ÿ,0.030676,"Jan  6, 2024 19:36:22.717823000 JST",7b2273656d616e74696373223a207b22656e74697479223a2022504944222c202262617365656e74697479223a2022616e79222c2022726f6c65223a2022343434222c20227370617469616c223a2022616e79222c202274656d706f72616c223a2022616e79227d2c20226461746170726f7065727479223a207b22666f726d6174223a2022696e616f6b615f70726f6772616d5f73616d706c655f73656d616e746963227d7d,60817  >  7000 Len=167
27,8.337263,192.168.11.15,192.168.11.31,TCP,74,,œ,0.009042,"Jan  6, 2024 19:36:22.726865000 JST",,38772  >  6000 [SYN] Seq=0 Win=64240 Len=0 MSS=1460 SACK_PERM TSval=2684544859 TSecr=0 WS=128
28,8.337415,192.168.11.31,192.168.11.15,TCP,74,0.000152,,0.000152,"Jan  6, 2024 19:36:22.727017000 JST",,"6000  >  38772 [SYN, ACK] Seq=0 Ack=1 Win=65160 Len=0 MSS=1460 SACK_PERM TSval=558709952 TSecr=2684544859 WS=128"
29,8.34449,192.168.11.15,192.168.11.31,TCP,66,0.007075,,0.007075,"Jan  6, 2024 19:36:22.734092000 JST",,38772  >  6000 [ACK] Seq=1 Ack=1 Win=64256 Len=0 TSval=2684544866 TSecr=558709952
30,8.345071,192.168.11.15,192.168.11.31,TCP,93,,,0.000581,"Jan  6, 2024 19:36:22.734673000 JST",,"38772  >  6000 [PSH, ACK] Seq=1 Ack=1 Win=64256 Len=27 TSval=2684544867 TSecr=558709952 [TCP segment of a reassembled PDU]"
31,8.345146,192.168.11.31,192.168.11.15,TCP,66,0.000075,,0.000075,"Jan  6, 2024 19:36:22.734748000 JST",,6000  >  38772 [ACK] Seq=1 Ack=28 Win=65152 Len=0 TSval=558709960 TSecr=2684544867
32,8.345213,192.168.11.15,192.168.11.31,TCP,66,,,0.000067,"Jan  6, 2024 19:36:22.734815000 JST",,"38772  >  6000 [FIN, ACK] Seq=28 Ack=1 Win=64256 Len=0 TSval=2684544867 TSecr=558709952"
33,8.346156,192.168.11.31,192.168.11.15,TCP,66,0.000943,,0.000943,"Jan  6, 2024 19:36:22.735758000 JST",,"6000  >  38772 [FIN, ACK] Seq=1 Ack=29 Win=65152 Len=0 TSval=558709961 TSecr=2684544867"
34,8.352606,192.168.11.15,192.168.11.31,TCP,66,0.00645,,0.00645,"Jan  6, 2024 19:36:22.742208000 JST",,38772  >  6000 [ACK] Seq=29 Ack=2 Win=64256 Len=0 TSval=2684544874 TSecr=558709961
35,18.119452,192.168.11.31,192.168.11.29,TCP,74,,,9.766846,"Jan  6, 2024 19:36:32.509054000 JST",,59296  >  6000 [SYN] Seq=0 Win=64240 Len=0 MSS=1460 SACK_PERM TSval=2222192583 TSecr=0 WS=128
36,18.126184,192.168.11.29,192.168.11.31,TCP,74,0.006732,,0.006732,"Jan  6, 2024 19:36:32.515786000 JST",,"6000  >  59296 [SYN, ACK] Seq=0 Ack=1 Win=65160 Len=0 MSS=1460 SACK_PERM TSval=3583844036 TSecr=2222192583 WS=128"
37,18.126306,192.168.11.31,192.168.11.29,TCP,66,0.000122,,0.000122,"Jan  6, 2024 19:36:32.515908000 JST",,59296  >  6000 [ACK] Seq=1 Ack=1 Win=64256 Len=0 TSval=2222192590 TSecr=3583844036
38,18.126488,192.168.11.31,192.168.11.29,TCP,93,,,0.000182,"Jan  6, 2024 19:36:32.516090000 JST",,"59296  >  6000 [PSH, ACK] Seq=1 Ack=1 Win=64256 Len=27 TSval=2222192590 TSecr=3583844036 [TCP segment of a reassembled PDU]"
39,18.126597,192.168.11.31,192.168.11.29,TCP,66,,,0.000109,"Jan  6, 2024 19:36:32.516199000 JST",,"59296  >  6000 [FIN, ACK] Seq=28 Ack=1 Win=64256 Len=0 TSval=2222192590 TSecr=3583844036"
40,18.134581,192.168.11.29,192.168.11.31,TCP,66,0.008093,,0.007984,"Jan  6, 2024 19:36:32.524183000 JST",,6000  >  59296 [ACK] Seq=1 Ack=28 Win=65152 Len=0 TSval=3583844043 TSecr=2222192590
41,18.134826,192.168.11.29,192.168.11.31,TCP,66,0.008229,,0.000245,"Jan  6, 2024 19:36:32.524428000 JST",,"6000  >  59296 [FIN, ACK] Seq=1 Ack=29 Win=65152 Len=0 TSval=3583844046 TSecr=2222192590"
42,18.134878,192.168.11.31,192.168.11.29,TCP,66,0.000052,,0.000052,"Jan  6, 2024 19:36:32.524480000 JST",,59296  >  6000 [ACK] Seq=29 Ack=2 Win=64256 Len=0 TSval=2222192598 TSecr=3583844046
43,18.166479,192.168.11.31,255.255.255.255,UDP,209,,Ÿ,0.031601,"Jan  6, 2024 19:36:32.556081000 JST",7b2273656d616e74696373223a207b22656e74697479223a2022504944222c202262617365656e74697479223a2022616e79222c2022726f6c65223a2022343434222c20227370617469616c223a2022616e79222c202274656d706f72616c223a2022616e79227d2c20226461746170726f7065727479223a207b22666f726d6174223a2022696e616f6b615f70726f6772616d5f73616d706c655f73656d616e746963227d7d,42169  >  7000 Len=167
44,18.174707,192.168.11.15,192.168.11.31,TCP,74,,œ,0.008228,"Jan  6, 2024 19:36:32.564309000 JST",,51044  >  6000 [SYN] Seq=0 Win=64240 Len=0 MSS=1460 SACK_PERM TSval=2684554696 TSecr=0 WS=128
45,18.174891,192.168.11.31,192.168.11.15,TCP,74,0.000184,,0.000184,"Jan  6, 2024 19:36:32.564493000 JST",,"6000  >  51044 [SYN, ACK] Seq=0 Ack=1 Win=65160 Len=0 MSS=1460 SACK_PERM TSval=558719789 TSecr=2684554696 WS=128"
46,18.18178,192.168.11.15,192.168.11.31,TCP,66,0.006889,,0.006889,"Jan  6, 2024 19:36:32.571382000 JST",,51044  >  6000 [ACK] Seq=1 Ack=1 Win=64256 Len=0 TSval=2684554703 TSecr=558719789
47,18.182361,192.168.11.15,192.168.11.31,TCP,93,,,0.000581,"Jan  6, 2024 19:36:32.571963000 JST",,"51044  >  6000 [PSH, ACK] Seq=1 Ack=1 Win=64256 Len=27 TSval=2684554704 TSecr=558719789 [TCP segment of a reassembled PDU]"
48,18.182484,192.168.11.31,192.168.11.15,TCP,66,0.000123,,0.000123,"Jan  6, 2024 19:36:32.572086000 JST",,6000  >  51044 [ACK] Seq=1 Ack=28 Win=65152 Len=0 TSval=558719797 TSecr=2684554704
49,18.182568,192.168.11.15,192.168.11.31,TCP,66,,,0.000084,"Jan  6, 2024 19:36:32.572170000 JST",,"51044  >  6000 [FIN, ACK] Seq=28 Ack=1 Win=64256 Len=0 TSval=2684554704 TSecr=558719789"
50,18.183855,192.168.11.31,192.168.11.15,TCP,66,0.001287,,0.001287,"Jan  6, 2024 19:36:32.573457000 JST",,"6000  >  51044 [FIN, ACK] Seq=1 Ack=29 Win=65152 Len=0 TSval=558719798 TSecr=2684554704"
51,18.189051,192.168.11.15,192.168.11.31,TCP,66,0.005196,,0.005196,"Jan  6, 2024 19:36:32.578653000 JST",,51044  >  6000 [ACK] Seq=29 Ack=2 Win=64256 Len=0 TSval=2684554711 TSecr=558719798
52,28.053333,192.168.11.31,192.168.11.29,TCP,74,,,9.864282,"Jan  6, 2024 19:36:42.442935000 JST",,57090  >  6000 [SYN] Seq=0 Win=64240 Len=0 MSS=1460 SACK_PERM TSval=2222202517 TSecr=0 WS=128
53,28.060079,192.168.11.29,192.168.11.31,TCP,74,0.006746,,0.006746,"Jan  6, 2024 19:36:42.449681000 JST",,"6000  >  57090 [SYN, ACK] Seq=0 Ack=1 Win=65160 Len=0 MSS=1460 SACK_PERM TSval=3583853969 TSecr=2222202517 WS=128"
54,28.060187,192.168.11.31,192.168.11.29,TCP,66,0.000108,,0.000108,"Jan  6, 2024 19:36:42.449789000 JST",,57090  >  6000 [ACK] Seq=1 Ack=1 Win=64256 Len=0 TSval=2222202524 TSecr=3583853969
55,28.060364,192.168.11.31,192.168.11.29,TCP,93,,,0.000177,"Jan  6, 2024 19:36:42.449966000 JST",,"57090  >  6000 [PSH, ACK] Seq=1 Ack=1 Win=64256 Len=27 TSval=2222202524 TSecr=3583853969 [TCP segment of a reassembled PDU]"
56,28.060472,192.168.11.31,192.168.11.29,TCP,66,,,0.000108,"Jan  6, 2024 19:36:42.450074000 JST",,"57090  >  6000 [FIN, ACK] Seq=28 Ack=1 Win=64256 Len=0 TSval=2222202524 TSecr=3583853969"
57,28.069216,192.168.11.29,192.168.11.31,TCP,66,0.008744,,0.008744,"Jan  6, 2024 19:36:42.458818000 JST",,"6000  >  57090 [FIN, ACK] Seq=1 Ack=29 Win=65152 Len=0 TSval=3583853978 TSecr=2222202524"
58,28.06928,192.168.11.31,192.168.11.29,TCP,66,0.000064,,0.000064,"Jan  6, 2024 19:36:42.458882000 JST",,57090  >  6000 [ACK] Seq=29 Ack=2 Win=64256 Len=0 TSval=2222202533 TSecr=3583853978
59,28.102456,192.168.11.31,255.255.255.255,UDP,209,,Ÿ,0.033176,"Jan  6, 2024 19:36:42.492058000 JST",7b2273656d616e74696373223a207b22656e74697479223a2022504944222c202262617365656e74697479223a2022616e79222c2022726f6c65223a2022343434222c20227370617469616c223a2022616e79222c202274656d706f72616c223a2022616e79227d2c20226461746170726f7065727479223a207b22666f726d6174223a2022696e616f6b615f70726f6772616d5f73616d706c655f73656d616e746963227d7d,49576  >  7000 Len=167
60,28.111194,192.168.11.15,192.168.11.31,TCP,74,,œ,0.008738,"Jan  6, 2024 19:36:42.500796000 JST",,38192  >  6000 [SYN] Seq=0 Win=64240 Len=0 MSS=1460 SACK_PERM TSval=2684564632 TSecr=0 WS=128
61,28.11136,192.168.11.31,192.168.11.15,TCP,74,0.000166,,0.000166,"Jan  6, 2024 19:36:42.500962000 JST",,"6000  >  38192 [SYN, ACK] Seq=0 Ack=1 Win=65160 Len=0 MSS=1460 SACK_PERM TSval=558729726 TSecr=2684564632 WS=128"
62,28.118095,192.168.11.15,192.168.11.31,TCP,66,0.006735,,0.006735,"Jan  6, 2024 19:36:42.507697000 JST",,38192  >  6000 [ACK] Seq=1 Ack=1 Win=64256 Len=0 TSval=2684564640 TSecr=558729726
63,28.118638,192.168.11.15,192.168.11.31,TCP,93,,,0.000543,"Jan  6, 2024 19:36:42.508240000 JST",,"38192  >  6000 [PSH, ACK] Seq=1 Ack=1 Win=64256 Len=27 TSval=2684564640 TSecr=558729726 [TCP segment of a reassembled PDU]"
64,28.118731,192.168.11.31,192.168.11.15,TCP,66,0.000093,,0.000093,"Jan  6, 2024 19:36:42.508333000 JST",,6000  >  38192 [ACK] Seq=1 Ack=28 Win=65152 Len=0 TSval=558729733 TSecr=2684564640
65,28.118802,192.168.11.15,192.168.11.31,TCP,66,,,0.000071,"Jan  6, 2024 19:36:42.508404000 JST",,"38192  >  6000 [FIN, ACK] Seq=28 Ack=1 Win=64256 Len=0 TSval=2684564640 TSecr=558729726"
66,28.120177,192.168.11.31,192.168.11.15,TCP,66,0.001375,,0.001375,"Jan  6, 2024 19:36:42.509779000 JST",,"6000  >  38192 [FIN, ACK] Seq=1 Ack=29 Win=65152 Len=0 TSval=558729735 TSecr=2684564640"
67,28.125141,192.168.11.15,192.168.11.31,TCP,66,0.004964,,0.004964,"Jan  6, 2024 19:36:42.514743000 JST",,38192  >  6000 [ACK] Seq=29 Ack=2 Win=64256 Len=0 TSval=2684564647 TSecr=558729735
68,35.878909,192.168.11.31,192.168.11.29,TCP,74,,,7.753768,"Jan  6, 2024 19:36:50.268511000 JST",,54992  >  6000 [SYN] Seq=0 Win=64240 Len=0 MSS=1460 SACK_PERM TSval=2222210342 TSecr=0 WS=128
69,35.885917,192.168.11.29,192.168.11.31,TCP,74,0.007008,,0.007008,"Jan  6, 2024 19:36:50.275519000 JST",,"6000  >  54992 [SYN, ACK] Seq=0 Ack=1 Win=65160 Len=0 MSS=1460 SACK_PERM TSval=3583861795 TSecr=2222210342 WS=128"
70,35.88606,192.168.11.31,192.168.11.29,TCP,66,0.000143,,0.000143,"Jan  6, 2024 19:36:50.275662000 JST",,54992  >  6000 [ACK] Seq=1 Ack=1 Win=64256 Len=0 TSval=2222210350 TSecr=3583861795
71,35.886244,192.168.11.31,192.168.11.29,TCP,93,,,0.000184,"Jan  6, 2024 19:36:50.275846000 JST",,"54992  >  6000 [PSH, ACK] Seq=1 Ack=1 Win=64256 Len=27 TSval=2222210350 TSecr=3583861795 [TCP segment of a reassembled PDU]"
72,35.886371,192.168.11.31,192.168.11.29,TCP,66,,,0.000127,"Jan  6, 2024 19:36:50.275973000 JST",,"54992  >  6000 [FIN, ACK] Seq=28 Ack=1 Win=64256 Len=0 TSval=2222210350 TSecr=3583861795"
73,35.893969,192.168.11.29,192.168.11.31,TCP,66,0.007725,,0.007598,"Jan  6, 2024 19:36:50.283571000 JST",,6000  >  54992 [ACK] Seq=1 Ack=28 Win=65152 Len=0 TSval=3583861803 TSecr=2222210350
74,35.897789,192.168.11.29,192.168.11.31,TCP,66,0.011418,,0.00382,"Jan  6, 2024 19:36:50.287391000 JST",,"6000  >  54992 [FIN, ACK] Seq=1 Ack=29 Win=65152 Len=0 TSval=3583861805 TSecr=2222210350"
75,35.897837,192.168.11.31,192.168.11.29,TCP,66,0.000048,,0.000048,"Jan  6, 2024 19:36:50.287439000 JST",,54992  >  6000 [ACK] Seq=29 Ack=2 Win=64256 Len=0 TSval=2222210361 TSecr=3583861805
76,35.931827,192.168.11.31,255.255.255.255,UDP,209,,Ÿ,0.03399,"Jan  6, 2024 19:36:50.321429000 JST",7b2273656d616e74696373223a207b22656e74697479223a2022504944222c202262617365656e74697479223a2022616e79222c2022726f6c65223a2022343434222c20227370617469616c223a2022616e79222c202274656d706f72616c223a2022616e79227d2c20226461746170726f7065727479223a207b22666f726d6174223a2022696e616f6b615f70726f6772616d5f73616d706c655f73656d616e746963227d7d,33074  >  7000 Len=167
77,35.939411,192.168.11.15,192.168.11.31,TCP,74,,œ,0.007584,"Jan  6, 2024 19:36:50.329013000 JST",,35728  >  6000 [SYN] Seq=0 Win=64240 Len=0 MSS=1460 SACK_PERM TSval=2684572461 TSecr=0 WS=128
78,35.939565,192.168.11.31,192.168.11.15,TCP,74,0.000154,,0.000154,"Jan  6, 2024 19:36:50.329167000 JST",,"6000  >  35728 [SYN, ACK] Seq=0 Ack=1 Win=65160 Len=0 MSS=1460 SACK_PERM TSval=558737554 TSecr=2684572461 WS=128"
79,35.946487,192.168.11.15,192.168.11.31,TCP,66,0.006922,,0.006922,"Jan  6, 2024 19:36:50.336089000 JST",,35728  >  6000 [ACK] Seq=1 Ack=1 Win=64256 Len=0 TSval=2684572468 TSecr=558737554
80,35.947117,192.168.11.15,192.168.11.31,TCP,93,,,0.00063,"Jan  6, 2024 19:36:50.336719000 JST",,"35728  >  6000 [PSH, ACK] Seq=1 Ack=1 Win=64256 Len=27 TSval=2684572468 TSecr=558737554 [TCP segment of a reassembled PDU]"
81,35.947204,192.168.11.31,192.168.11.15,TCP,66,0.000087,,0.000087,"Jan  6, 2024 19:36:50.336806000 JST",,6000  >  35728 [ACK] Seq=1 Ack=28 Win=65152 Len=0 TSval=558737562 TSecr=2684572468
82,35.947276,192.168.11.15,192.168.11.31,TCP,66,,,0.000072,"Jan  6, 2024 19:36:50.336878000 JST",,"35728  >  6000 [FIN, ACK] Seq=28 Ack=1 Win=64256 Len=0 TSval=2684572468 TSecr=558737554"
83,35.948614,192.168.11.31,192.168.11.15,TCP,66,0.001338,,0.001338,"Jan  6, 2024 19:36:50.338216000 JST",,"6000  >  35728 [FIN, ACK] Seq=1 Ack=29 Win=65152 Len=0 TSval=558737563 TSecr=2684572468"
84,35.954408,192.168.11.15,192.168.11.31,TCP,66,0.005794,,0.005794,"Jan  6, 2024 19:36:50.344010000 JST",,35728  >  6000 [ACK] Seq=29 Ack=2 Win=64256 Len=0 TSval=2684572476 TSecr=558737563
85,43.677801,192.168.11.31,192.168.11.29,TCP,74,,,7.723393,"Jan  6, 2024 19:36:58.067403000 JST",,57712  >  6000 [SYN] Seq=0 Win=64240 Len=0 MSS=1460 SACK_PERM TSval=2222218141 TSecr=0 WS=128
86,43.685126,192.168.11.29,192.168.11.31,TCP,74,0.007325,,0.007325,"Jan  6, 2024 19:36:58.074728000 JST",,"6000  >  57712 [SYN, ACK] Seq=0 Ack=1 Win=65160 Len=0 MSS=1460 SACK_PERM TSval=3583869594 TSecr=2222218141 WS=128"
87,43.685253,192.168.11.31,192.168.11.29,TCP,66,0.000127,,0.000127,"Jan  6, 2024 19:36:58.074855000 JST",,57712  >  6000 [ACK] Seq=1 Ack=1 Win=64256 Len=0 TSval=2222218149 TSecr=3583869594
88,43.685437,192.168.11.31,192.168.11.29,TCP,93,,,0.000184,"Jan  6, 2024 19:36:58.075039000 JST",,"57712  >  6000 [PSH, ACK] Seq=1 Ack=1 Win=64256 Len=27 TSval=2222218149 TSecr=3583869594 [TCP segment of a reassembled PDU]"
89,43.685561,192.168.11.31,192.168.11.29,TCP,66,,,0.000124,"Jan  6, 2024 19:36:58.075163000 JST",,"57712  >  6000 [FIN, ACK] Seq=28 Ack=1 Win=64256 Len=0 TSval=2222218149 TSecr=3583869594"
90,43.693,192.168.11.29,192.168.11.31,TCP,66,0.007563,,0.007439,"Jan  6, 2024 19:36:58.082602000 JST",,6000  >  57712 [ACK] Seq=1 Ack=28 Win=65152 Len=0 TSval=3583869602 TSecr=2222218149
91,43.695645,192.168.11.29,192.168.11.31,TCP,66,0.010084,,0.002645,"Jan  6, 2024 19:36:58.085247000 JST",,"6000  >  57712 [FIN, ACK] Seq=1 Ack=29 Win=65152 Len=0 TSval=3583869604 TSecr=2222218149"
92,43.695698,192.168.11.31,192.168.11.29,TCP,66,0.000053,,0.000053,"Jan  6, 2024 19:36:58.085300000 JST",,57712  >  6000 [ACK] Seq=29 Ack=2 Win=64256 Len=0 TSval=2222218159 TSecr=3583869604
93,43.730203,192.168.11.31,255.255.255.255,UDP,209,,Ÿ,0.034505,"Jan  6, 2024 19:36:58.119805000 JST",7b2273656d616e74696373223a207b22656e74697479223a2022504944222c202262617365656e74697479223a2022616e79222c2022726f6c65223a2022343434222c20227370617469616c223a2022616e79222c202274656d706f72616c223a2022616e79227d2c20226461746170726f7065727479223a207b22666f726d6174223a2022696e616f6b615f70726f6772616d5f73616d706c655f73656d616e746963227d7d,47972  >  7000 Len=167
94,43.746603,192.168.11.15,192.168.11.31,TCP,74,,œ,0.0164,"Jan  6, 2024 19:36:58.136205000 JST",,47610  >  6000 [SYN] Seq=0 Win=64240 Len=0 MSS=1460 SACK_PERM TSval=2684580268 TSecr=0 WS=128
95,43.74682,192.168.11.31,192.168.11.15,TCP,74,0.000217,,0.000217,"Jan  6, 2024 19:36:58.136422000 JST",,"6000  >  47610 [SYN, ACK] Seq=0 Ack=1 Win=65160 Len=0 MSS=1460 SACK_PERM TSval=558745361 TSecr=2684580268 WS=128"
96,43.757863,192.168.11.15,192.168.11.31,TCP,66,0.011043,,0.011043,"Jan  6, 2024 19:36:58.147465000 JST",,47610  >  6000 [ACK] Seq=1 Ack=1 Win=64256 Len=0 TSval=2684580278 TSecr=558745361
97,43.758314,192.168.11.15,192.168.11.31,TCP,93,,,0.000451,"Jan  6, 2024 19:36:58.147916000 JST",,"47610  >  6000 [PSH, ACK] Seq=1 Ack=1 Win=64256 Len=27 TSval=2684580278 TSecr=558745361 [TCP segment of a reassembled PDU]"
98,43.758387,192.168.11.31,192.168.11.15,TCP,66,0.000073,,0.000073,"Jan  6, 2024 19:36:58.147989000 JST",,6000  >  47610 [ACK] Seq=1 Ack=28 Win=65152 Len=0 TSval=558745373 TSecr=2684580278
99,43.758443,192.168.11.15,192.168.11.31,TCP,66,,,0.000056,"Jan  6, 2024 19:36:58.148045000 JST",,"47610  >  6000 [FIN, ACK] Seq=28 Ack=1 Win=64256 Len=0 TSval=2684580278 TSecr=558745361"
100,43.75972,192.168.11.31,192.168.11.15,TCP,66,0.001277,,0.001277,"Jan  6, 2024 19:36:58.149322000 JST",,"6000  >  47610 [FIN, ACK] Seq=1 Ack=29 Win=65152 Len=0 TSval=558745374 TSecr=2684580278"
101,43.769518,192.168.11.15,192.168.11.31,TCP,66,0.009798,,0.009798,"Jan  6, 2024 19:36:58.159120000 JST",,47610  >  6000 [ACK] Seq=29 Ack=2 Win=64256 Len=0 TSval=2684580291 TSecr=558745374
102,51.53934,192.168.11.31,192.168.11.29,TCP,74,,,7.769822,"Jan  6, 2024 19:37:05.928942000 JST",,57716  >  6000 [SYN] Seq=0 Win=64240 Len=0 MSS=1460 SACK_PERM TSval=2222226003 TSecr=0 WS=128
103,51.546171,192.168.11.29,192.168.11.31,TCP,74,0.006831,,0.006831,"Jan  6, 2024 19:37:05.935773000 JST",,"6000  >  57716 [SYN, ACK] Seq=0 Ack=1 Win=65160 Len=0 MSS=1460 SACK_PERM TSval=3583877455 TSecr=2222226003 WS=128"
104,51.546279,192.168.11.31,192.168.11.29,TCP,66,0.000108,,0.000108,"Jan  6, 2024 19:37:05.935881000 JST",,57716  >  6000 [ACK] Seq=1 Ack=1 Win=64256 Len=0 TSval=2222226010 TSecr=3583877455
105,51.54642,192.168.11.31,192.168.11.29,TCP,93,,,0.000141,"Jan  6, 2024 19:37:05.936022000 JST",,"57716  >  6000 [PSH, ACK] Seq=1 Ack=1 Win=64256 Len=27 TSval=2222226010 TSecr=3583877455 [TCP segment of a reassembled PDU]"
106,51.546533,192.168.11.31,192.168.11.29,TCP,66,,,0.000113,"Jan  6, 2024 19:37:05.936135000 JST",,"57716  >  6000 [FIN, ACK] Seq=28 Ack=1 Win=64256 Len=0 TSval=2222226010 TSecr=3583877455"
107,51.553782,192.168.11.29,192.168.11.31,TCP,66,0.007362,,0.007249,"Jan  6, 2024 19:37:05.943384000 JST",,6000  >  57716 [ACK] Seq=1 Ack=28 Win=65152 Len=0 TSval=3583877463 TSecr=2222226010
108,51.554165,192.168.11.29,192.168.11.31,TCP,66,0.007632,,0.000383,"Jan  6, 2024 19:37:05.943767000 JST",,"6000  >  57716 [FIN, ACK] Seq=1 Ack=29 Win=65152 Len=0 TSval=3583877464 TSecr=2222226010"
109,51.554218,192.168.11.31,192.168.11.29,TCP,66,0.000053,,0.000053,"Jan  6, 2024 19:37:05.943820000 JST",,57716  >  6000 [ACK] Seq=29 Ack=2 Win=64256 Len=0 TSval=2222226018 TSecr=3583877464
110,51.587335,192.168.11.31,255.255.255.255,UDP,209,,Ÿ,0.033117,"Jan  6, 2024 19:37:05.976937000 JST",7b2273656d616e74696373223a207b22656e74697479223a2022504944222c202262617365656e74697479223a2022616e79222c2022726f6c65223a2022343434222c20227370617469616c223a2022616e79222c202274656d706f72616c223a2022616e79227d2c20226461746170726f7065727479223a207b22666f726d6174223a2022696e616f6b615f70726f6772616d5f73616d706c655f73656d616e746963227d7d,47794  >  7000 Len=167
111,51.608662,192.168.11.15,192.168.11.31,TCP,74,,œ,0.021327,"Jan  6, 2024 19:37:05.998264000 JST",,47624  >  6000 [SYN] Seq=0 Win=64240 Len=0 MSS=1460 SACK_PERM TSval=2684588121 TSecr=0 WS=128
112,51.608881,192.168.11.31,192.168.11.15,TCP,74,0.000219,,0.000219,"Jan  6, 2024 19:37:05.998483000 JST",,"6000  >  47624 [SYN, ACK] Seq=0 Ack=1 Win=65160 Len=0 MSS=1460 SACK_PERM TSval=558753223 TSecr=2684588121 WS=128"
113,51.615698,192.168.11.15,192.168.11.31,TCP,66,0.006817,,0.006817,"Jan  6, 2024 19:37:06.005300000 JST",,47624  >  6000 [ACK] Seq=1 Ack=1 Win=64256 Len=0 TSval=2684588137 TSecr=558753223
114,51.616238,192.168.11.15,192.168.11.31,TCP,93,,,0.00054,"Jan  6, 2024 19:37:06.005840000 JST",,"47624  >  6000 [PSH, ACK] Seq=1 Ack=1 Win=64256 Len=27 TSval=2684588137 TSecr=558753223 [TCP segment of a reassembled PDU]"
115,51.61632,192.168.11.31,192.168.11.15,TCP,66,0.000082,,0.000082,"Jan  6, 2024 19:37:06.005922000 JST",,6000  >  47624 [ACK] Seq=1 Ack=28 Win=65152 Len=0 TSval=558753231 TSecr=2684588137
116,51.616388,192.168.11.15,192.168.11.31,TCP,66,,,0.000068,"Jan  6, 2024 19:37:06.005990000 JST",,"47624  >  6000 [FIN, ACK] Seq=28 Ack=1 Win=64256 Len=0 TSval=2684588138 TSecr=558753223"
117,51.617469,192.168.11.31,192.168.11.15,TCP,66,0.001081,,0.001081,"Jan  6, 2024 19:37:06.007071000 JST",,"6000  >  47624 [FIN, ACK] Seq=1 Ack=29 Win=65152 Len=0 TSval=558753232 TSecr=2684588138"
118,51.625014,192.168.11.15,192.168.11.31,TCP,66,0.007545,,0.007545,"Jan  6, 2024 19:37:06.014616000 JST",,47624  >  6000 [ACK] Seq=29 Ack=2 Win=64256 Len=0 TSval=2684588145 TSecr=558753232
119,59.84456,192.168.11.31,192.168.11.29,TCP,74,,,8.219546,"Jan  6, 2024 19:37:14.234162000 JST",,52058  >  6000 [SYN] Seq=0 Win=64240 Len=0 MSS=1460 SACK_PERM TSval=2222234308 TSecr=0 WS=128
120,59.851539,192.168.11.29,192.168.11.31,TCP,74,0.006979,,0.006979,"Jan  6, 2024 19:37:14.241141000 JST",,"6000  >  52058 [SYN, ACK] Seq=0 Ack=1 Win=65160 Len=0 MSS=1460 SACK_PERM TSval=3583885760 TSecr=2222234308 WS=128"
121,59.85166,192.168.11.31,192.168.11.29,TCP,66,0.000121,,0.000121,"Jan  6, 2024 19:37:14.241262000 JST",,52058  >  6000 [ACK] Seq=1 Ack=1 Win=64256 Len=0 TSval=2222234315 TSecr=3583885760
122,59.85181,192.168.11.31,192.168.11.29,TCP,93,,,0.00015,"Jan  6, 2024 19:37:14.241412000 JST",,"52058  >  6000 [PSH, ACK] Seq=1 Ack=1 Win=64256 Len=27 TSval=2222234315 TSecr=3583885760 [TCP segment of a reassembled PDU]"
123,59.851954,192.168.11.31,192.168.11.29,TCP,66,,,0.000144,"Jan  6, 2024 19:37:14.241556000 JST",,"52058  >  6000 [FIN, ACK] Seq=28 Ack=1 Win=64256 Len=0 TSval=2222234316 TSecr=3583885760"
124,59.859218,192.168.11.29,192.168.11.31,TCP,66,0.007408,,0.007264,"Jan  6, 2024 19:37:14.248820000 JST",,6000  >  52058 [ACK] Seq=1 Ack=28 Win=65152 Len=0 TSval=3583885768 TSecr=2222234315
125,59.859573,192.168.11.29,192.168.11.31,TCP,66,0.007619,,0.000355,"Jan  6, 2024 19:37:14.249175000 JST",,"6000  >  52058 [FIN, ACK] Seq=1 Ack=29 Win=65152 Len=0 TSval=3583885770 TSecr=2222234316"
126,59.859618,192.168.11.31,192.168.11.29,TCP,66,0.000045,,0.000045,"Jan  6, 2024 19:37:14.249220000 JST",,52058  >  6000 [ACK] Seq=29 Ack=2 Win=64256 Len=0 TSval=2222234323 TSecr=3583885770
127,59.887093,192.168.11.31,255.255.255.255,UDP,209,,Ÿ,0.027475,"Jan  6, 2024 19:37:14.276695000 JST",7b2273656d616e74696373223a207b22656e74697479223a2022504944222c202262617365656e74697479223a2022616e79222c2022726f6c65223a2022343434222c20227370617469616c223a2022616e79222c202274656d706f72616c223a2022616e79227d2c20226461746170726f7065727479223a207b22666f726d6174223a2022696e616f6b615f70726f6772616d5f73616d706c655f73656d616e746963227d7d,40652  >  7000 Len=167
128,59.89458,192.168.11.15,192.168.11.31,TCP,74,,œ,0.007487,"Jan  6, 2024 19:37:14.284182000 JST",,44572  >  6000 [SYN] Seq=0 Win=64240 Len=0 MSS=1460 SACK_PERM TSval=2684596416 TSecr=0 WS=128
129,59.894726,192.168.11.31,192.168.11.15,TCP,74,0.000146,,0.000146,"Jan  6, 2024 19:37:14.284328000 JST",,"6000  >  44572 [SYN, ACK] Seq=0 Ack=1 Win=65160 Len=0 MSS=1460 SACK_PERM TSval=558761509 TSecr=2684596416 WS=128"
130,59.908733,192.168.11.15,192.168.11.31,TCP,66,0.014007,,0.014007,"Jan  6, 2024 19:37:14.298335000 JST",,44572  >  6000 [ACK] Seq=1 Ack=1 Win=64256 Len=0 TSval=2684596423 TSecr=558761509
131,59.909762,192.168.11.15,192.168.11.31,TCP,93,,,0.001029,"Jan  6, 2024 19:37:14.299364000 JST",,"44572  >  6000 [PSH, ACK] Seq=1 Ack=1 Win=64256 Len=27 TSval=2684596423 TSecr=558761509 [TCP segment of a reassembled PDU]"
132,59.909981,192.168.11.31,192.168.11.15,TCP,66,0.000219,,0.000219,"Jan  6, 2024 19:37:14.299583000 JST",,6000  >  44572 [ACK] Seq=1 Ack=28 Win=65152 Len=0 TSval=558761524 TSecr=2684596423
133,59.910104,192.168.11.15,192.168.11.31,TCP,66,,,0.000123,"Jan  6, 2024 19:37:14.299706000 JST",,"44572  >  6000 [FIN, ACK] Seq=28 Ack=1 Win=64256 Len=0 TSval=2684596423 TSecr=558761509"
134,59.911791,192.168.11.31,192.168.11.15,TCP,66,0.001687,,0.001687,"Jan  6, 2024 19:37:14.301393000 JST",,"6000  >  44572 [FIN, ACK] Seq=1 Ack=29 Win=65152 Len=0 TSval=558761526 TSecr=2684596423"
135,59.916436,192.168.11.15,192.168.11.31,TCP,66,0.004645,,0.004645,"Jan  6, 2024 19:37:14.306038000 JST",,44572  >  6000 [ACK] Seq=29 Ack=2 Win=64256 Len=0 TSval=2684596439 TSecr=558761526
136,71.757801,192.168.11.31,192.168.11.29,TCP,74,,,11.841365,"Jan  6, 2024 19:37:26.147403000 JST",,52846  >  6000 [SYN] Seq=0 Win=64240 Len=0 MSS=1460 SACK_PERM TSval=2222246221 TSecr=0 WS=128
137,71.767326,192.168.11.29,192.168.11.31,TCP,74,0.009525,,0.009525,"Jan  6, 2024 19:37:26.156928000 JST",,"6000  >  52846 [SYN, ACK] Seq=0 Ack=1 Win=65160 Len=0 MSS=1460 SACK_PERM TSval=3583897674 TSecr=2222246221 WS=128"
138,71.767447,192.168.11.31,192.168.11.29,TCP,66,0.000121,,0.000121,"Jan  6, 2024 19:37:26.157049000 JST",,52846  >  6000 [ACK] Seq=1 Ack=1 Win=64256 Len=0 TSval=2222246231 TSecr=3583897674
139,71.767606,192.168.11.31,192.168.11.29,TCP,93,,,0.000159,"Jan  6, 2024 19:37:26.157208000 JST",,"52846  >  6000 [PSH, ACK] Seq=1 Ack=1 Win=64256 Len=27 TSval=2222246231 TSecr=3583897674 [TCP segment of a reassembled PDU]"
140,71.767702,192.168.11.31,192.168.11.29,TCP,66,,,0.000096,"Jan  6, 2024 19:37:26.157304000 JST",,"52846  >  6000 [FIN, ACK] Seq=28 Ack=1 Win=64256 Len=0 TSval=2222246231 TSecr=3583897674"
141,71.775036,192.168.11.29,192.168.11.31,TCP,66,0.00743,,0.007334,"Jan  6, 2024 19:37:26.164638000 JST",,6000  >  52846 [ACK] Seq=1 Ack=28 Win=65152 Len=0 TSval=3583897684 TSecr=2222246231
142,71.777463,192.168.11.29,192.168.11.31,TCP,66,0.009761,,0.002427,"Jan  6, 2024 19:37:26.167065000 JST",,"6000  >  52846 [FIN, ACK] Seq=1 Ack=29 Win=65152 Len=0 TSval=3583897686 TSecr=2222246231"
143,71.77752,192.168.11.31,192.168.11.29,TCP,66,0.000057,,0.000057,"Jan  6, 2024 19:37:26.167122000 JST",,52846  >  6000 [ACK] Seq=29 Ack=2 Win=64256 Len=0 TSval=2222246241 TSecr=3583897686
144,71.805298,192.168.11.31,255.255.255.255,UDP,209,,Ÿ,0.027778,"Jan  6, 2024 19:37:26.194900000 JST",7b2273656d616e74696373223a207b22656e74697479223a2022504944222c202262617365656e74697479223a2022616e79222c2022726f6c65223a2022343434222c20227370617469616c223a2022616e79222c202274656d706f72616c223a2022616e79227d2c20226461746170726f7065727479223a207b22666f726d6174223a2022696e616f6b615f70726f6772616d5f73616d706c655f73656d616e746963227d7d,44114  >  7000 Len=167
145,71.815581,192.168.11.15,192.168.11.31,TCP,74,,œ,0.010283,"Jan  6, 2024 19:37:26.205183000 JST",,45870  >  6000 [SYN] Seq=0 Win=64240 Len=0 MSS=1460 SACK_PERM TSval=2684608335 TSecr=0 WS=128
146,71.81572,192.168.11.31,192.168.11.15,TCP,74,0.000139,,0.000139,"Jan  6, 2024 19:37:26.205322000 JST",,"6000  >  45870 [SYN, ACK] Seq=0 Ack=1 Win=65160 Len=0 MSS=1460 SACK_PERM TSval=558773430 TSecr=2684608335 WS=128"
147,71.823802,192.168.11.15,192.168.11.31,TCP,66,0.008082,,0.008082,"Jan  6, 2024 19:37:26.213404000 JST",,45870  >  6000 [ACK] Seq=1 Ack=1 Win=64256 Len=0 TSval=2684608345 TSecr=558773430
148,71.824763,192.168.11.15,192.168.11.31,TCP,93,,,0.000961,"Jan  6, 2024 19:37:26.214365000 JST",,"45870  >  6000 [PSH, ACK] Seq=1 Ack=1 Win=64256 Len=27 TSval=2684608345 TSecr=558773430 [TCP segment of a reassembled PDU]"
149,71.82484,192.168.11.15,192.168.11.31,TCP,66,,,0.000077,"Jan  6, 2024 19:37:26.214442000 JST",,"45870  >  6000 [FIN, ACK] Seq=28 Ack=1 Win=64256 Len=0 TSval=2684608345 TSecr=558773430"
150,71.824928,192.168.11.31,192.168.11.15,TCP,66,0.000165,,0.000088,"Jan  6, 2024 19:37:26.214530000 JST",,6000  >  45870 [ACK] Seq=1 Ack=28 Win=65152 Len=0 TSval=558773439 TSecr=2684608345
151,71.826088,192.168.11.31,192.168.11.15,TCP,66,0.001248,,0.00116,"Jan  6, 2024 19:37:26.215690000 JST",,"6000  >  45870 [FIN, ACK] Seq=1 Ack=29 Win=65152 Len=0 TSval=558773441 TSecr=2684608345"
152,71.831422,192.168.11.15,192.168.11.31,TCP,66,0.005334,,0.005334,"Jan  6, 2024 19:37:26.221024000 JST",,45870  >  6000 [ACK] Seq=29 Ack=2 Win=64256 Len=0 TSval=2684608353 TSecr=558773441
153,80.639495,192.168.11.31,192.168.11.29,TCP,74,,,8.808073,"Jan  6, 2024 19:37:35.029097000 JST",,48706  >  6000 [SYN] Seq=0 Win=64240 Len=0 MSS=1460 SACK_PERM TSval=2222255103 TSecr=0 WS=128
154,80.647171,192.168.11.29,192.168.11.31,TCP,74,0.007676,,0.007676,"Jan  6, 2024 19:37:35.036773000 JST",,"6000  >  48706 [SYN, ACK] Seq=0 Ack=1 Win=65160 Len=0 MSS=1460 SACK_PERM TSval=3583906555 TSecr=2222255103 WS=128"
155,80.647281,192.168.11.31,192.168.11.29,TCP,66,0.00011,,0.00011,"Jan  6, 2024 19:37:35.036883000 JST",,48706  >  6000 [ACK] Seq=1 Ack=1 Win=64256 Len=0 TSval=2222255111 TSecr=3583906555
156,80.647454,192.168.11.31,192.168.11.29,TCP,93,,,0.000173,"Jan  6, 2024 19:37:35.037056000 JST",,"48706  >  6000 [PSH, ACK] Seq=1 Ack=1 Win=64256 Len=27 TSval=2222255111 TSecr=3583906555 [TCP segment of a reassembled PDU]"
157,80.64755,192.168.11.31,192.168.11.29,TCP,66,,,0.000096,"Jan  6, 2024 19:37:35.037152000 JST",,"48706  >  6000 [FIN, ACK] Seq=28 Ack=1 Win=64256 Len=0 TSval=2222255111 TSecr=3583906555"
158,80.660675,192.168.11.29,192.168.11.31,TCP,66,0.013125,,0.013125,"Jan  6, 2024 19:37:35.050277000 JST",,"6000  >  48706 [FIN, ACK] Seq=1 Ack=29 Win=65152 Len=0 TSval=3583906565 TSecr=2222255111"
159,80.660748,192.168.11.31,192.168.11.29,TCP,66,0.000073,,0.000073,"Jan  6, 2024 19:37:35.050350000 JST",,48706  >  6000 [ACK] Seq=29 Ack=2 Win=64256 Len=0 TSval=2222255124 TSecr=3583906565
160,80.690897,192.168.11.31,255.255.255.255,UDP,209,,Ÿ,0.030149,"Jan  6, 2024 19:37:35.080499000 JST",7b2273656d616e74696373223a207b22656e74697479223a2022504944222c202262617365656e74697479223a2022616e79222c2022726f6c65223a2022343434222c20227370617469616c223a2022616e79222c202274656d706f72616c223a2022616e79227d2c20226461746170726f7065727479223a207b22666f726d6174223a2022696e616f6b615f70726f6772616d5f73616d706c655f73656d616e746963227d7d,45450  >  7000 Len=167
161,80.699574,192.168.11.15,192.168.11.31,TCP,74,,œ,0.008677,"Jan  6, 2024 19:37:35.089176000 JST",,43832  >  6000 [SYN] Seq=0 Win=64240 Len=0 MSS=1460 SACK_PERM TSval=2684617221 TSecr=0 WS=128
162,80.699754,192.168.11.31,192.168.11.15,TCP,74,0.00018,,0.00018,"Jan  6, 2024 19:37:35.089356000 JST",,"6000  >  43832 [SYN, ACK] Seq=0 Ack=1 Win=65160 Len=0 MSS=1460 SACK_PERM TSval=558782314 TSecr=2684617221 WS=128"
163,80.708955,192.168.11.15,192.168.11.31,TCP,66,0.009201,,0.009201,"Jan  6, 2024 19:37:35.098557000 JST",,43832  >  6000 [ACK] Seq=1 Ack=1 Win=64256 Len=0 TSval=2684617228 TSecr=558782314
164,80.709577,192.168.11.15,192.168.11.31,TCP,93,,,0.000622,"Jan  6, 2024 19:37:35.099179000 JST",,"43832  >  6000 [PSH, ACK] Seq=1 Ack=1 Win=64256 Len=27 TSval=2684617228 TSecr=558782314 [TCP segment of a reassembled PDU]"
165,80.709693,192.168.11.31,192.168.11.15,TCP,66,0.000116,,0.000116,"Jan  6, 2024 19:37:35.099295000 JST",,6000  >  43832 [ACK] Seq=1 Ack=28 Win=65152 Len=0 TSval=558782324 TSecr=2684617228
166,80.709773,192.168.11.15,192.168.11.31,TCP,66,,,0.00008,"Jan  6, 2024 19:37:35.099375000 JST",,"43832  >  6000 [FIN, ACK] Seq=28 Ack=1 Win=64256 Len=0 TSval=2684617228 TSecr=558782314"
167,80.711515,192.168.11.31,192.168.11.15,TCP,66,0.001742,,0.001742,"Jan  6, 2024 19:37:35.101117000 JST",,"6000  >  43832 [FIN, ACK] Seq=1 Ack=29 Win=65152 Len=0 TSval=558782326 TSecr=2684617228"
168,80.719626,192.168.11.15,192.168.11.31,TCP,66,0.008111,,0.008111,"Jan  6, 2024 19:37:35.109228000 JST",,43832  >  6000 [ACK] Seq=29 Ack=2 Win=64256 Len=0 TSval=2684617238 TSecr=558782326
169,112.832854,192.168.11.31,192.168.11.29,TCP,74,,,32.113228,"Jan  6, 2024 19:38:07.222456000 JST",,45034  >  6000 [SYN] Seq=0 Win=64240 Len=0 MSS=1460 SACK_PERM TSval=2222287296 TSecr=0 WS=128
170,112.841302,192.168.11.29,192.168.11.31,TCP,74,0.008448,,0.008448,"Jan  6, 2024 19:38:07.230904000 JST",,"6000  >  45034 [SYN, ACK] Seq=0 Ack=1 Win=65160 Len=0 MSS=1460 SACK_PERM TSval=3583938750 TSecr=2222287296 WS=128"
171,112.841412,192.168.11.31,192.168.11.29,TCP,66,0.00011,,0.00011,"Jan  6, 2024 19:38:07.231014000 JST",,45034  >  6000 [ACK] Seq=1 Ack=1 Win=64256 Len=0 TSval=2222287305 TSecr=3583938750
172,112.841548,192.168.11.31,192.168.11.29,TCP,93,,,0.000136,"Jan  6, 2024 19:38:07.231150000 JST",,"45034  >  6000 [PSH, ACK] Seq=1 Ack=1 Win=64256 Len=27 TSval=2222287305 TSecr=3583938750 [TCP segment of a reassembled PDU]"
173,112.841655,192.168.11.31,192.168.11.29,TCP,66,,,0.000107,"Jan  6, 2024 19:38:07.231257000 JST",,"45034  >  6000 [FIN, ACK] Seq=28 Ack=1 Win=64256 Len=0 TSval=2222287305 TSecr=3583938750"
174,112.852972,192.168.11.29,192.168.11.31,TCP,66,0.011424,,0.011317,"Jan  6, 2024 19:38:07.242574000 JST",,6000  >  45034 [ACK] Seq=1 Ack=28 Win=65152 Len=0 TSval=3583938762 TSecr=2222287305
175,112.853349,192.168.11.29,192.168.11.31,TCP,66,0.011694,,0.000377,"Jan  6, 2024 19:38:07.242951000 JST",,"6000  >  45034 [FIN, ACK] Seq=1 Ack=29 Win=65152 Len=0 TSval=3583938763 TSecr=2222287305"
176,112.853397,192.168.11.31,192.168.11.29,TCP,66,0.000048,,0.000048,"Jan  6, 2024 19:38:07.242999000 JST",,45034  >  6000 [ACK] Seq=29 Ack=2 Win=64256 Len=0 TSval=2222287317 TSecr=3583938763
177,112.889027,192.168.11.31,255.255.255.255,UDP,209,,Ÿ,0.03563,"Jan  6, 2024 19:38:07.278629000 JST",7b2273656d616e74696373223a207b22656e74697479223a2022504944222c202262617365656e74697479223a2022616e79222c2022726f6c65223a2022343434222c20227370617469616c223a2022616e79222c202274656d706f72616c223a2022616e79227d2c20226461746170726f7065727479223a207b22666f726d6174223a2022696e616f6b615f70726f6772616d5f73616d706c655f73656d616e746963227d7d,58649  >  7000 Len=167
178,112.896637,192.168.11.15,192.168.11.31,TCP,74,,œ,0.00761,"Jan  6, 2024 19:38:07.286239000 JST",,45316  >  6000 [SYN] Seq=0 Win=64240 Len=0 MSS=1460 SACK_PERM TSval=2684649418 TSecr=0 WS=128
179,112.896798,192.168.11.31,192.168.11.15,TCP,74,0.000161,,0.000161,"Jan  6, 2024 19:38:07.286400000 JST",,"6000  >  45316 [SYN, ACK] Seq=0 Ack=1 Win=65160 Len=0 MSS=1460 SACK_PERM TSval=558814511 TSecr=2684649418 WS=128"
180,112.90588,192.168.11.15,192.168.11.31,TCP,66,0.009082,,0.009082,"Jan  6, 2024 19:38:07.295482000 JST",,45316  >  6000 [ACK] Seq=1 Ack=1 Win=64256 Len=0 TSval=2684649427 TSecr=558814511
181,112.906824,192.168.11.15,192.168.11.31,TCP,93,,,0.000944,"Jan  6, 2024 19:38:07.296426000 JST",,"45316  >  6000 [PSH, ACK] Seq=1 Ack=1 Win=64256 Len=27 TSval=2684649427 TSecr=558814511 [TCP segment of a reassembled PDU]"
182,112.907028,192.168.11.31,192.168.11.15,TCP,66,0.000204,,0.000204,"Jan  6, 2024 19:38:07.296630000 JST",,6000  >  45316 [ACK] Seq=1 Ack=28 Win=65152 Len=0 TSval=558814522 TSecr=2684649427
183,112.907154,192.168.11.15,192.168.11.31,TCP,66,,,0.000126,"Jan  6, 2024 19:38:07.296756000 JST",,"45316  >  6000 [FIN, ACK] Seq=28 Ack=1 Win=64256 Len=0 TSval=2684649427 TSecr=558814511"
184,112.908812,192.168.11.31,192.168.11.15,TCP,66,0.001658,,0.001658,"Jan  6, 2024 19:38:07.298414000 JST",,"6000  >  45316 [FIN, ACK] Seq=1 Ack=29 Win=65152 Len=0 TSval=558814523 TSecr=2684649427"
185,112.920758,192.168.11.15,192.168.11.31,TCP,66,0.011946,,0.011946,"Jan  6, 2024 19:38:07.310360000 JST",,45316  >  6000 [ACK] Seq=29 Ack=2 Win=64256 Len=0 TSval=2684649441 TSecr=558814523
