No.,Time,Source,Destination,Protocol,Length,The RTT to ACK the segment was,XXX,Time delta from previous captured frame,Arrival Time,Data,Info
1,0,192.168.11.38,192.168.11.37,TCP,74,,,0,"Jan  6, 2024 19:36:14.568941000 JST",,45748  >  6000 [SYN] Seq=0 Win=64240 Len=0 MSS=1460 SACK_PERM TSval=1839400271 TSecr=0 WS=128
2,0.007026,192.168.11.37,192.168.11.38,TCP,74,0.007026,,0.007026,"Jan  6, 2024 19:36:14.575967000 JST",,"6000  >  45748 [SYN, ACK] Seq=0 Ack=1 Win=65160 Len=0 MSS=1460 SACK_PERM TSval=1928248511 TSecr=1839400271 WS=128"
3,0.007144,192.168.11.38,192.168.11.37,TCP,66,0.000118,,0.000118,"Jan  6, 2024 19:36:14.576085000 JST",,45748  >  6000 [ACK] Seq=1 Ack=1 Win=64256 Len=0 TSval=1839400284 TSecr=1928248511
4,0.007352,192.168.11.38,192.168.11.37,TCP,93,,,0.000208,"Jan  6, 2024 19:36:14.576293000 JST",,"45748  >  6000 [PSH, ACK] Seq=1 Ack=1 Win=64256 Len=27 TSval=1839400284 TSecr=1928248511 [TCP segment of a reassembled PDU]"
5,0.007588,192.168.11.38,192.168.11.37,TCP,66,,,0.000236,"Jan  6, 2024 19:36:14.576529000 JST",,"45748  >  6000 [FIN, ACK] Seq=28 Ack=1 Win=64256 Len=0 TSval=1839400284 TSecr=1928248511"
6,0.015437,192.168.11.37,192.168.11.38,TCP,66,0.008085,,0.007849,"Jan  6, 2024 19:36:14.584378000 JST",,6000  >  45748 [ACK] Seq=1 Ack=28 Win=65152 Len=0 TSval=1928248518 TSecr=1839400284
7,0.015883,192.168.11.37,192.168.11.38,TCP,66,0.008295,,0.000446,"Jan  6, 2024 19:36:14.584824000 JST",,"6000  >  45748 [FIN, ACK] Seq=1 Ack=29 Win=65152 Len=0 TSval=1928248520 TSecr=1839400284"
8,0.015929,192.168.11.38,192.168.11.37,TCP,66,0.000046,,0.000046,"Jan  6, 2024 19:36:14.584870000 JST",,45748  >  6000 [ACK] Seq=29 Ack=2 Win=64256 Len=0 TSval=1839400293 TSecr=1928248520
9,0.049697,192.168.11.38,255.255.255.255,UDP,209,,Ÿ,0.033768,"Jan  6, 2024 19:36:14.618638000 JST",7b2273656d616e74696373223a207b22656e74697479223a2022504944222c202262617365656e74697479223a2022616e79222c2022726f6c65223a2022373737222c20227370617469616c223a2022616e79222c202274656d706f72616c223a2022616e79227d2c20226461746170726f7065727479223a207b22666f726d6174223a2022696e616f6b615f70726f6772616d5f73616d706c655f73656d616e746963227d7d,42568  >  7000 Len=167
10,0.061721,192.168.11.39,192.168.11.38,TCP,74,,œ,0.012024,"Jan  6, 2024 19:36:14.630662000 JST",,44510  >  6000 [SYN] Seq=0 Win=64240 Len=0 MSS=1460 SACK_PERM TSval=962090008 TSecr=0 WS=128
11,0.061866,192.168.11.38,192.168.11.39,TCP,74,0.000145,,0.000145,"Jan  6, 2024 19:36:14.630807000 JST",,"6000  >  44510 [SYN, ACK] Seq=0 Ack=1 Win=65160 Len=0 MSS=1460 SACK_PERM TSval=3421067016 TSecr=962090008 WS=128"
12,0.067993,192.168.11.39,192.168.11.38,TCP,66,0.006127,,0.006127,"Jan  6, 2024 19:36:14.636934000 JST",,44510  >  6000 [ACK] Seq=1 Ack=1 Win=64256 Len=0 TSval=962090019 TSecr=3421067016
13,0.068528,192.168.11.39,192.168.11.38,TCP,93,,,0.000535,"Jan  6, 2024 19:36:14.637469000 JST",,"44510  >  6000 [PSH, ACK] Seq=1 Ack=1 Win=64256 Len=27 TSval=962090019 TSecr=3421067016 [TCP segment of a reassembled PDU]"
14,0.068605,192.168.11.38,192.168.11.39,TCP,66,0.000077,,0.000077,"Jan  6, 2024 19:36:14.637546000 JST",,6000  >  44510 [ACK] Seq=1 Ack=28 Win=65152 Len=0 TSval=3421067023 TSecr=962090019
15,0.06868,192.168.11.39,192.168.11.38,TCP,66,,,0.000075,"Jan  6, 2024 19:36:14.637621000 JST",,"44510  >  6000 [FIN, ACK] Seq=28 Ack=1 Win=64256 Len=0 TSval=962090019 TSecr=3421067016"
16,0.070099,192.168.11.38,192.168.11.39,TCP,66,0.001419,,0.001419,"Jan  6, 2024 19:36:14.639040000 JST",,"6000  >  44510 [FIN, ACK] Seq=1 Ack=29 Win=65152 Len=0 TSval=3421067024 TSecr=962090019"
17,0.076499,192.168.11.39,192.168.11.38,TCP,66,0.0064,,0.0064,"Jan  6, 2024 19:36:14.645440000 JST",,44510  >  6000 [ACK] Seq=29 Ack=2 Win=64256 Len=0 TSval=962090026 TSecr=3421067024
18,8.254472,192.168.11.38,192.168.11.37,TCP,74,,,8.177973,"Jan  6, 2024 19:36:22.823413000 JST",,45250  >  6000 [SYN] Seq=0 Win=64240 Len=0 MSS=1460 SACK_PERM TSval=1839408531 TSecr=0 WS=128
19,8.261272,192.168.11.37,192.168.11.38,TCP,74,0.0068,,0.0068,"Jan  6, 2024 19:36:22.830213000 JST",,"6000  >  45250 [SYN, ACK] Seq=0 Ack=1 Win=65160 Len=0 MSS=1460 SACK_PERM TSval=1928256765 TSecr=1839408531 WS=128"
20,8.26138,192.168.11.38,192.168.11.37,TCP,66,0.000108,,0.000108,"Jan  6, 2024 19:36:22.830321000 JST",,45250  >  6000 [ACK] Seq=1 Ack=1 Win=64256 Len=0 TSval=1839408538 TSecr=1928256765
21,8.261519,192.168.11.38,192.168.11.37,TCP,93,,,0.000139,"Jan  6, 2024 19:36:22.830460000 JST",,"45250  >  6000 [PSH, ACK] Seq=1 Ack=1 Win=64256 Len=27 TSval=1839408539 TSecr=1928256765 [TCP segment of a reassembled PDU]"
22,8.261638,192.168.11.38,192.168.11.37,TCP,66,,,0.000119,"Jan  6, 2024 19:36:22.830579000 JST",,"45250  >  6000 [FIN, ACK] Seq=28 Ack=1 Win=64256 Len=0 TSval=1839408539 TSecr=1928256765"
23,8.268511,192.168.11.37,192.168.11.38,TCP,66,0.006992,,0.006873,"Jan  6, 2024 19:36:22.837452000 JST",,6000  >  45250 [ACK] Seq=1 Ack=28 Win=65152 Len=0 TSval=1928256772 TSecr=1839408539
24,8.268908,192.168.11.37,192.168.11.38,TCP,66,0.00727,,0.000397,"Jan  6, 2024 19:36:22.837849000 JST",,"6000  >  45250 [FIN, ACK] Seq=1 Ack=29 Win=65152 Len=0 TSval=1928256773 TSecr=1839408539"
25,8.268956,192.168.11.38,192.168.11.37,TCP,66,0.000048,,0.000048,"Jan  6, 2024 19:36:22.837897000 JST",,45250  >  6000 [ACK] Seq=29 Ack=2 Win=64256 Len=0 TSval=1839408546 TSecr=1928256773
26,8.30115,192.168.11.38,255.255.255.255,UDP,209,,Ÿ,0.032194,"Jan  6, 2024 19:36:22.870091000 JST",7b2273656d616e74696373223a207b22656e74697479223a2022504944222c202262617365656e74697479223a2022616e79222c2022726f6c65223a2022373737222c20227370617469616c223a2022616e79222c202274656d706f72616c223a2022616e79227d2c20226461746170726f7065727479223a207b22666f726d6174223a2022696e616f6b615f70726f6772616d5f73616d706c655f73656d616e746963227d7d,58768  >  7000 Len=167
27,8.309138,192.168.11.39,192.168.11.38,TCP,74,,œ,0.007988,"Jan  6, 2024 19:36:22.878079000 JST",,51810  >  6000 [SYN] Seq=0 Win=64240 Len=0 MSS=1460 SACK_PERM TSval=962098259 TSecr=0 WS=128
28,8.309274,192.168.11.38,192.168.11.39,TCP,74,0.000136,,0.000136,"Jan  6, 2024 19:36:22.878215000 JST",,"6000  >  51810 [SYN, ACK] Seq=0 Ack=1 Win=65160 Len=0 MSS=1460 SACK_PERM TSval=3421075263 TSecr=962098259 WS=128"
29,8.316132,192.168.11.39,192.168.11.38,TCP,66,0.006858,,0.006858,"Jan  6, 2024 19:36:22.885073000 JST",,51810  >  6000 [ACK] Seq=1 Ack=1 Win=64256 Len=0 TSval=962098266 TSecr=3421075263
30,8.316734,192.168.11.39,192.168.11.38,TCP,93,,,0.000602,"Jan  6, 2024 19:36:22.885675000 JST",,"51810  >  6000 [PSH, ACK] Seq=1 Ack=1 Win=64256 Len=27 TSval=962098266 TSecr=3421075263 [TCP segment of a reassembled PDU]"
31,8.316847,192.168.11.38,192.168.11.39,TCP,66,0.000113,,0.000113,"Jan  6, 2024 19:36:22.885788000 JST",,6000  >  51810 [ACK] Seq=1 Ack=28 Win=65152 Len=0 TSval=3421075271 TSecr=962098266
32,8.316944,192.168.11.39,192.168.11.38,TCP,66,,,0.000097,"Jan  6, 2024 19:36:22.885885000 JST",,"51810  >  6000 [FIN, ACK] Seq=28 Ack=1 Win=64256 Len=0 TSval=962098266 TSecr=3421075263"
33,8.318108,192.168.11.38,192.168.11.39,TCP,66,0.001164,,0.001164,"Jan  6, 2024 19:36:22.887049000 JST",,"6000  >  51810 [FIN, ACK] Seq=1 Ack=29 Win=65152 Len=0 TSval=3421075272 TSecr=962098266"
34,8.32509,192.168.11.39,192.168.11.38,TCP,66,0.006982,,0.006982,"Jan  6, 2024 19:36:22.894031000 JST",,51810  >  6000 [ACK] Seq=29 Ack=2 Win=64256 Len=0 TSval=962098274 TSecr=3421075272
35,18.097084,192.168.11.38,192.168.11.37,TCP,74,,,9.771994,"Jan  6, 2024 19:36:32.666025000 JST",,48340  >  6000 [SYN] Seq=0 Win=64240 Len=0 MSS=1460 SACK_PERM TSval=1839418374 TSecr=0 WS=128
36,18.104648,192.168.11.37,192.168.11.38,TCP,74,0.007564,,0.007564,"Jan  6, 2024 19:36:32.673589000 JST",,"6000  >  48340 [SYN, ACK] Seq=0 Ack=1 Win=65160 Len=0 MSS=1460 SACK_PERM TSval=1928266608 TSecr=1839418374 WS=128"
37,18.104753,192.168.11.38,192.168.11.37,TCP,66,0.000105,,0.000105,"Jan  6, 2024 19:36:32.673694000 JST",,48340  >  6000 [ACK] Seq=1 Ack=1 Win=64256 Len=0 TSval=1839418382 TSecr=1928266608
38,18.104882,192.168.11.38,192.168.11.37,TCP,93,,,0.000129,"Jan  6, 2024 19:36:32.673823000 JST",,"48340  >  6000 [PSH, ACK] Seq=1 Ack=1 Win=64256 Len=27 TSval=1839418382 TSecr=1928266608 [TCP segment of a reassembled PDU]"
39,18.104983,192.168.11.38,192.168.11.37,TCP,66,,,0.000101,"Jan  6, 2024 19:36:32.673924000 JST",,"48340  >  6000 [FIN, ACK] Seq=28 Ack=1 Win=64256 Len=0 TSval=1839418382 TSecr=1928266608"
40,18.114867,192.168.11.37,192.168.11.38,TCP,66,0.009985,,0.009884,"Jan  6, 2024 19:36:32.683808000 JST",,6000  >  48340 [ACK] Seq=1 Ack=28 Win=65152 Len=0 TSval=1928266617 TSecr=1839418382
41,18.117358,192.168.11.37,192.168.11.38,TCP,66,0.012375,,0.002491,"Jan  6, 2024 19:36:32.686299000 JST",,"6000  >  48340 [FIN, ACK] Seq=1 Ack=29 Win=65152 Len=0 TSval=1928266619 TSecr=1839418382"
42,18.117413,192.168.11.38,192.168.11.37,TCP,66,0.000055,,0.000055,"Jan  6, 2024 19:36:32.686354000 JST",,48340  >  6000 [ACK] Seq=29 Ack=2 Win=64256 Len=0 TSval=1839418394 TSecr=1928266619
43,18.145969,192.168.11.38,255.255.255.255,UDP,209,,Ÿ,0.028556,"Jan  6, 2024 19:36:32.714910000 JST",7b2273656d616e74696373223a207b22656e74697479223a2022504944222c202262617365656e74697479223a2022616e79222c2022726f6c65223a2022373737222c20227370617469616c223a2022616e79222c202274656d706f72616c223a2022616e79227d2c20226461746170726f7065727479223a207b22666f726d6174223a2022696e616f6b615f70726f6772616d5f73616d706c655f73656d616e746963227d7d,60307  >  7000 Len=167
44,19.147378,192.168.11.38,255.255.255.255,UDP,209,,œ,1.001409,"Jan  6, 2024 19:36:33.716319000 JST",7b2273656d616e74696373223a207b22656e74697479223a2022504944222c202262617365656e74697479223a2022616e79222c2022726f6c65223a2022373737222c20227370617469616c223a2022616e79222c202274656d706f72616c223a2022616e79227d2c20226461746170726f7065727479223a207b22666f726d6174223a2022696e616f6b615f70726f6772616d5f73616d706c655f73656d616e746963227d7d,60307  >  7000 Len=167
45,19.174053,192.168.11.39,192.168.11.38,TCP,74,,œ,0.026675,"Jan  6, 2024 19:36:33.742994000 JST",,48016  >  6000 [SYN] Seq=0 Win=64240 Len=0 MSS=1460 SACK_PERM TSval=962109124 TSecr=0 WS=128
46,19.174233,192.168.11.38,192.168.11.39,TCP,74,0.00018,,0.00018,"Jan  6, 2024 19:36:33.743174000 JST",,"6000  >  48016 [SYN, ACK] Seq=0 Ack=1 Win=65160 Len=0 MSS=1460 SACK_PERM TSval=3421086128 TSecr=962109124 WS=128"
47,19.181306,192.168.11.39,192.168.11.38,TCP,66,0.007073,,0.007073,"Jan  6, 2024 19:36:33.750247000 JST",,48016  >  6000 [ACK] Seq=1 Ack=1 Win=64256 Len=0 TSval=962109131 TSecr=3421086128
48,19.18184,192.168.11.39,192.168.11.38,TCP,93,,,0.000534,"Jan  6, 2024 19:36:33.750781000 JST",,"48016  >  6000 [PSH, ACK] Seq=1 Ack=1 Win=64256 Len=27 TSval=962109131 TSecr=3421086128 [TCP segment of a reassembled PDU]"
49,19.181924,192.168.11.38,192.168.11.39,TCP,66,0.000084,,0.000084,"Jan  6, 2024 19:36:33.750865000 JST",,6000  >  48016 [ACK] Seq=1 Ack=28 Win=65152 Len=0 TSval=3421086136 TSecr=962109131
50,19.181992,192.168.11.39,192.168.11.38,TCP,66,,,0.000068,"Jan  6, 2024 19:36:33.750933000 JST",,"48016  >  6000 [FIN, ACK] Seq=28 Ack=1 Win=64256 Len=0 TSval=962109131 TSecr=3421086128"
51,19.183312,192.168.11.38,192.168.11.39,TCP,66,0.00132,,0.00132,"Jan  6, 2024 19:36:33.752253000 JST",,"6000  >  48016 [FIN, ACK] Seq=1 Ack=29 Win=65152 Len=0 TSval=3421086137 TSecr=962109131"
52,19.194704,192.168.11.39,192.168.11.38,TCP,66,0.011392,,0.011392,"Jan  6, 2024 19:36:33.763645000 JST",,48016  >  6000 [ACK] Seq=29 Ack=2 Win=64256 Len=0 TSval=962109144 TSecr=3421086137
53,28.028303,192.168.11.38,192.168.11.37,TCP,74,,,8.833599,"Jan  6, 2024 19:36:42.597244000 JST",,47844  >  6000 [SYN] Seq=0 Win=64240 Len=0 MSS=1460 SACK_PERM TSval=1839428305 TSecr=0 WS=128
54,28.034943,192.168.11.37,192.168.11.38,TCP,74,0.00664,,0.00664,"Jan  6, 2024 19:36:42.603884000 JST",,"6000  >  47844 [SYN, ACK] Seq=0 Ack=1 Win=65160 Len=0 MSS=1460 SACK_PERM TSval=1928276539 TSecr=1839428305 WS=128"
55,28.035066,192.168.11.38,192.168.11.37,TCP,66,0.000123,,0.000123,"Jan  6, 2024 19:36:42.604007000 JST",,47844  >  6000 [ACK] Seq=1 Ack=1 Win=64256 Len=0 TSval=1839428312 TSecr=1928276539
56,28.035235,192.168.11.38,192.168.11.37,TCP,93,,,0.000169,"Jan  6, 2024 19:36:42.604176000 JST",,"47844  >  6000 [PSH, ACK] Seq=1 Ack=1 Win=64256 Len=27 TSval=1839428312 TSecr=1928276539 [TCP segment of a reassembled PDU]"
57,28.03534,192.168.11.38,192.168.11.37,TCP,66,,,0.000105,"Jan  6, 2024 19:36:42.604281000 JST",,"47844  >  6000 [FIN, ACK] Seq=28 Ack=1 Win=64256 Len=0 TSval=1839428312 TSecr=1928276539"
58,28.042962,192.168.11.37,192.168.11.38,TCP,66,0.007727,,0.007622,"Jan  6, 2024 19:36:42.611903000 JST",,6000  >  47844 [ACK] Seq=1 Ack=28 Win=65152 Len=0 TSval=1928276546 TSecr=1839428312
59,28.043322,192.168.11.37,192.168.11.38,TCP,66,0.007982,,0.00036,"Jan  6, 2024 19:36:42.612263000 JST",,"6000  >  47844 [FIN, ACK] Seq=1 Ack=29 Win=65152 Len=0 TSval=1928276547 TSecr=1839428312"
60,28.043368,192.168.11.38,192.168.11.37,TCP,66,0.000046,,0.000046,"Jan  6, 2024 19:36:42.612309000 JST",,47844  >  6000 [ACK] Seq=29 Ack=2 Win=64256 Len=0 TSval=1839428320 TSecr=1928276547
61,28.073722,192.168.11.38,255.255.255.255,UDP,209,,Ÿ,0.030354,"Jan  6, 2024 19:36:42.642663000 JST",7b2273656d616e74696373223a207b22656e74697479223a2022504944222c202262617365656e74697479223a2022616e79222c2022726f6c65223a2022373737222c20227370617469616c223a2022616e79222c202274656d706f72616c223a2022616e79227d2c20226461746170726f7065727479223a207b22666f726d6174223a2022696e616f6b615f70726f6772616d5f73616d706c655f73656d616e746963227d7d,42195  >  7000 Len=167
62,28.081235,192.168.11.39,192.168.11.38,TCP,74,,œ,0.007513,"Jan  6, 2024 19:36:42.650176000 JST",,46166  >  6000 [SYN] Seq=0 Win=64240 Len=0 MSS=1460 SACK_PERM TSval=962118031 TSecr=0 WS=128
63,28.081369,192.168.11.38,192.168.11.39,TCP,74,0.000134,,0.000134,"Jan  6, 2024 19:36:42.650310000 JST",,"6000  >  46166 [SYN, ACK] Seq=0 Ack=1 Win=65160 Len=0 MSS=1460 SACK_PERM TSval=3421095035 TSecr=962118031 WS=128"
64,28.091227,192.168.11.39,192.168.11.38,TCP,66,0.009858,,0.009858,"Jan  6, 2024 19:36:42.660168000 JST",,46166  >  6000 [ACK] Seq=1 Ack=1 Win=64256 Len=0 TSval=962118040 TSecr=3421095035
65,28.091821,192.168.11.39,192.168.11.38,TCP,93,,,0.000594,"Jan  6, 2024 19:36:42.660762000 JST",,"46166  >  6000 [PSH, ACK] Seq=1 Ack=1 Win=64256 Len=27 TSval=962118040 TSecr=3421095035 [TCP segment of a reassembled PDU]"
66,28.091932,192.168.11.38,192.168.11.39,TCP,66,0.000111,,0.000111,"Jan  6, 2024 19:36:42.660873000 JST",,6000  >  46166 [ACK] Seq=1 Ack=28 Win=65152 Len=0 TSval=3421095046 TSecr=962118040
67,28.09204,192.168.11.39,192.168.11.38,TCP,66,,,0.000108,"Jan  6, 2024 19:36:42.660981000 JST",,"46166  >  6000 [FIN, ACK] Seq=28 Ack=1 Win=64256 Len=0 TSval=962118040 TSecr=3421095035"
68,28.093894,192.168.11.38,192.168.11.39,TCP,66,0.001854,,0.001854,"Jan  6, 2024 19:36:42.662835000 JST",,"6000  >  46166 [FIN, ACK] Seq=1 Ack=29 Win=65152 Len=0 TSval=3421095048 TSecr=962118040"
69,28.10543,192.168.11.39,192.168.11.38,TCP,66,0.011536,,0.011536,"Jan  6, 2024 19:36:42.674371000 JST",,46166  >  6000 [ACK] Seq=29 Ack=2 Win=64256 Len=0 TSval=962118055 TSecr=3421095048
70,35.845017,192.168.11.38,192.168.11.37,TCP,74,,,7.739587,"Jan  6, 2024 19:36:50.413958000 JST",,43350  >  6000 [SYN] Seq=0 Win=64240 Len=0 MSS=1460 SACK_PERM TSval=1839436122 TSecr=0 WS=128
71,35.851921,192.168.11.37,192.168.11.38,TCP,74,0.006904,,0.006904,"Jan  6, 2024 19:36:50.420862000 JST",,"6000  >  43350 [SYN, ACK] Seq=0 Ack=1 Win=65160 Len=0 MSS=1460 SACK_PERM TSval=1928284355 TSecr=1839436122 WS=128"
72,35.852038,192.168.11.38,192.168.11.37,TCP,66,0.000117,,0.000117,"Jan  6, 2024 19:36:50.420979000 JST",,43350  >  6000 [ACK] Seq=1 Ack=1 Win=64256 Len=0 TSval=1839436129 TSecr=1928284355
73,35.852209,192.168.11.38,192.168.11.37,TCP,93,,,0.000171,"Jan  6, 2024 19:36:50.421150000 JST",,"43350  >  6000 [PSH, ACK] Seq=1 Ack=1 Win=64256 Len=27 TSval=1839436129 TSecr=1928284355 [TCP segment of a reassembled PDU]"
74,35.852307,192.168.11.38,192.168.11.37,TCP,66,,,0.000098,"Jan  6, 2024 19:36:50.421248000 JST",,"43350  >  6000 [FIN, ACK] Seq=28 Ack=1 Win=64256 Len=0 TSval=1839436129 TSecr=1928284355"
75,35.859875,192.168.11.37,192.168.11.38,TCP,66,0.007666,,0.007568,"Jan  6, 2024 19:36:50.428816000 JST",,6000  >  43350 [ACK] Seq=1 Ack=28 Win=65152 Len=0 TSval=1928284363 TSecr=1839436129
76,35.86011,192.168.11.37,192.168.11.38,TCP,66,0.007803,,0.000235,"Jan  6, 2024 19:36:50.429051000 JST",,"6000  >  43350 [FIN, ACK] Seq=1 Ack=29 Win=65152 Len=0 TSval=1928284365 TSecr=1839436129"
77,35.860154,192.168.11.38,192.168.11.37,TCP,66,0.000044,,0.000044,"Jan  6, 2024 19:36:50.429095000 JST",,43350  >  6000 [ACK] Seq=29 Ack=2 Win=64256 Len=0 TSval=1839436137 TSecr=1928284365
78,35.893238,192.168.11.38,255.255.255.255,UDP,209,,Ÿ,0.033084,"Jan  6, 2024 19:36:50.462179000 JST",7b2273656d616e74696373223a207b22656e74697479223a2022504944222c202262617365656e74697479223a2022616e79222c2022726f6c65223a2022373737222c20227370617469616c223a2022616e79222c202274656d706f72616c223a2022616e79227d2c20226461746170726f7065727479223a207b22666f726d6174223a2022696e616f6b615f70726f6772616d5f73616d706c655f73656d616e746963227d7d,47445  >  7000 Len=167
79,35.900853,192.168.11.39,192.168.11.38,TCP,74,,œ,0.007615,"Jan  6, 2024 19:36:50.469794000 JST",,42680  >  6000 [SYN] Seq=0 Win=64240 Len=0 MSS=1460 SACK_PERM TSval=962125850 TSecr=0 WS=128
80,35.901011,192.168.11.38,192.168.11.39,TCP,74,0.000158,,0.000158,"Jan  6, 2024 19:36:50.469952000 JST",,"6000  >  42680 [SYN, ACK] Seq=0 Ack=1 Win=65160 Len=0 MSS=1460 SACK_PERM TSval=3421102855 TSecr=962125850 WS=128"
81,35.907671,192.168.11.39,192.168.11.38,TCP,66,0.00666,,0.00666,"Jan  6, 2024 19:36:50.476612000 JST",,42680  >  6000 [ACK] Seq=1 Ack=1 Win=64256 Len=0 TSval=962125857 TSecr=3421102855
82,35.908203,192.168.11.39,192.168.11.38,TCP,93,,,0.000532,"Jan  6, 2024 19:36:50.477144000 JST",,"42680  >  6000 [PSH, ACK] Seq=1 Ack=1 Win=64256 Len=27 TSval=962125858 TSecr=3421102855 [TCP segment of a reassembled PDU]"
83,35.908273,192.168.11.38,192.168.11.39,TCP,66,0.00007,,0.00007,"Jan  6, 2024 19:36:50.477214000 JST",,6000  >  42680 [ACK] Seq=1 Ack=28 Win=65152 Len=0 TSval=3421102862 TSecr=962125858
84,35.908345,192.168.11.39,192.168.11.38,TCP,66,,,0.000072,"Jan  6, 2024 19:36:50.477286000 JST",,"42680  >  6000 [FIN, ACK] Seq=28 Ack=1 Win=64256 Len=0 TSval=962125858 TSecr=3421102855"
85,35.909216,192.168.11.38,192.168.11.39,TCP,66,0.000871,,0.000871,"Jan  6, 2024 19:36:50.478157000 JST",,"6000  >  42680 [FIN, ACK] Seq=1 Ack=29 Win=65152 Len=0 TSval=3421102863 TSecr=962125858"
86,35.915631,192.168.11.39,192.168.11.38,TCP,66,0.006415,,0.006415,"Jan  6, 2024 19:36:50.484572000 JST",,42680  >  6000 [ACK] Seq=29 Ack=2 Win=64256 Len=0 TSval=962125865 TSecr=3421102863
87,43.658826,192.168.11.38,192.168.11.37,TCP,74,,,7.743195,"Jan  6, 2024 19:36:58.227767000 JST",,49212  >  6000 [SYN] Seq=0 Win=64240 Len=0 MSS=1460 SACK_PERM TSval=1839443936 TSecr=0 WS=128
88,43.670752,192.168.11.37,192.168.11.38,TCP,74,0.011926,,0.011926,"Jan  6, 2024 19:36:58.239693000 JST",,"6000  >  49212 [SYN, ACK] Seq=0 Ack=1 Win=65160 Len=0 MSS=1460 SACK_PERM TSval=1928292174 TSecr=1839443936 WS=128"
89,43.670864,192.168.11.38,192.168.11.37,TCP,66,0.000112,,0.000112,"Jan  6, 2024 19:36:58.239805000 JST",,49212  >  6000 [ACK] Seq=1 Ack=1 Win=64256 Len=0 TSval=1839443948 TSecr=1928292174
90,43.671007,192.168.11.38,192.168.11.37,TCP,93,,,0.000143,"Jan  6, 2024 19:36:58.239948000 JST",,"49212  >  6000 [PSH, ACK] Seq=1 Ack=1 Win=64256 Len=27 TSval=1839443948 TSecr=1928292174 [TCP segment of a reassembled PDU]"
91,43.671117,192.168.11.38,192.168.11.37,TCP,66,,,0.00011,"Jan  6, 2024 19:36:58.240058000 JST",,"49212  >  6000 [FIN, ACK] Seq=28 Ack=1 Win=64256 Len=0 TSval=1839443948 TSecr=1928292174"
92,43.678615,192.168.11.37,192.168.11.38,TCP,66,0.007608,,0.007498,"Jan  6, 2024 19:36:58.247556000 JST",,6000  >  49212 [ACK] Seq=1 Ack=28 Win=65152 Len=0 TSval=1928292182 TSecr=1839443948
93,43.679055,192.168.11.37,192.168.11.38,TCP,66,0.007938,,0.00044,"Jan  6, 2024 19:36:58.247996000 JST",,"6000  >  49212 [FIN, ACK] Seq=1 Ack=29 Win=65152 Len=0 TSval=1928292183 TSecr=1839443948"
94,43.6791,192.168.11.38,192.168.11.37,TCP,66,0.000045,,0.000045,"Jan  6, 2024 19:36:58.248041000 JST",,49212  >  6000 [ACK] Seq=29 Ack=2 Win=64256 Len=0 TSval=1839443956 TSecr=1928292183
95,43.710621,192.168.11.38,255.255.255.255,UDP,209,,Ÿ,0.031521,"Jan  6, 2024 19:36:58.279562000 JST",7b2273656d616e74696373223a207b22656e74697479223a2022504944222c202262617365656e74697479223a2022616e79222c2022726f6c65223a2022373737222c20227370617469616c223a2022616e79222c202274656d706f72616c223a2022616e79227d2c20226461746170726f7065727479223a207b22666f726d6174223a2022696e616f6b615f70726f6772616d5f73616d706c655f73656d616e746963227d7d,36283  >  7000 Len=167
96,43.718872,192.168.11.39,192.168.11.38,TCP,74,,œ,0.008251,"Jan  6, 2024 19:36:58.287813000 JST",,60030  >  6000 [SYN] Seq=0 Win=64240 Len=0 MSS=1460 SACK_PERM TSval=962133669 TSecr=0 WS=128
97,43.719016,192.168.11.38,192.168.11.39,TCP,74,0.000144,,0.000144,"Jan  6, 2024 19:36:58.287957000 JST",,"6000  >  60030 [SYN, ACK] Seq=0 Ack=1 Win=65160 Len=0 MSS=1460 SACK_PERM TSval=3421110673 TSecr=962133669 WS=128"
98,43.728344,192.168.11.39,192.168.11.38,TCP,66,0.009328,,0.009328,"Jan  6, 2024 19:36:58.297285000 JST",,60030  >  6000 [ACK] Seq=1 Ack=1 Win=64256 Len=0 TSval=962133678 TSecr=3421110673
99,43.729163,192.168.11.39,192.168.11.38,TCP,93,,,0.000819,"Jan  6, 2024 19:36:58.298104000 JST",,"60030  >  6000 [PSH, ACK] Seq=1 Ack=1 Win=64256 Len=27 TSval=962133678 TSecr=3421110673 [TCP segment of a reassembled PDU]"
100,43.729293,192.168.11.38,192.168.11.39,TCP,66,0.00013,,0.00013,"Jan  6, 2024 19:36:58.298234000 JST",,6000  >  60030 [ACK] Seq=1 Ack=28 Win=65152 Len=0 TSval=3421110683 TSecr=962133678
101,43.729369,192.168.11.39,192.168.11.38,TCP,66,,,0.000076,"Jan  6, 2024 19:36:58.298310000 JST",,"60030  >  6000 [FIN, ACK] Seq=28 Ack=1 Win=64256 Len=0 TSval=962133678 TSecr=3421110673"
102,43.730692,192.168.11.38,192.168.11.39,TCP,66,0.001323,,0.001323,"Jan  6, 2024 19:36:58.299633000 JST",,"6000  >  60030 [FIN, ACK] Seq=1 Ack=29 Win=65152 Len=0 TSval=3421110685 TSecr=962133678"
103,43.736709,192.168.11.39,192.168.11.38,TCP,66,0.006017,,0.006017,"Jan  6, 2024 19:36:58.305650000 JST",,60030  >  6000 [ACK] Seq=29 Ack=2 Win=64256 Len=0 TSval=962133686 TSecr=3421110685
104,51.516165,192.168.11.38,192.168.11.37,TCP,74,,,7.779456,"Jan  6, 2024 19:37:06.085106000 JST",,49220  >  6000 [SYN] Seq=0 Win=64240 Len=0 MSS=1460 SACK_PERM TSval=1839451793 TSecr=0 WS=128
105,51.523006,192.168.11.37,192.168.11.38,TCP,74,0.006841,,0.006841,"Jan  6, 2024 19:37:06.091947000 JST",,"6000  >  49220 [SYN, ACK] Seq=0 Ack=1 Win=65160 Len=0 MSS=1460 SACK_PERM TSval=1928300026 TSecr=1839451793 WS=128"
106,51.523109,192.168.11.38,192.168.11.37,TCP,66,0.000103,,0.000103,"Jan  6, 2024 19:37:06.092050000 JST",,49220  >  6000 [ACK] Seq=1 Ack=1 Win=64256 Len=0 TSval=1839451800 TSecr=1928300026
107,51.523246,192.168.11.38,192.168.11.37,TCP,93,,,0.000137,"Jan  6, 2024 19:37:06.092187000 JST",,"49220  >  6000 [PSH, ACK] Seq=1 Ack=1 Win=64256 Len=27 TSval=1839451800 TSecr=1928300026 [TCP segment of a reassembled PDU]"
108,51.52335,192.168.11.38,192.168.11.37,TCP,66,,,0.000104,"Jan  6, 2024 19:37:06.092291000 JST",,"49220  >  6000 [FIN, ACK] Seq=28 Ack=1 Win=64256 Len=0 TSval=1839451800 TSecr=1928300026"
109,51.530741,192.168.11.37,192.168.11.38,TCP,66,0.007495,,0.007391,"Jan  6, 2024 19:37:06.099682000 JST",,6000  >  49220 [ACK] Seq=1 Ack=28 Win=65152 Len=0 TSval=1928300034 TSecr=1839451800
110,51.530975,192.168.11.37,192.168.11.38,TCP,66,0.007625,,0.000234,"Jan  6, 2024 19:37:06.099916000 JST",,"6000  >  49220 [FIN, ACK] Seq=1 Ack=29 Win=65152 Len=0 TSval=1928300036 TSecr=1839451800"
111,51.531021,192.168.11.38,192.168.11.37,TCP,66,0.000046,,0.000046,"Jan  6, 2024 19:37:06.099962000 JST",,49220  >  6000 [ACK] Seq=29 Ack=2 Win=64256 Len=0 TSval=1839451808 TSecr=1928300036
112,51.565891,192.168.11.38,255.255.255.255,UDP,209,,Ÿ,0.03487,"Jan  6, 2024 19:37:06.134832000 JST",7b2273656d616e74696373223a207b22656e74697479223a2022504944222c202262617365656e74697479223a2022616e79222c2022726f6c65223a2022373737222c20227370617469616c223a2022616e79222c202274656d706f72616c223a2022616e79227d2c20226461746170726f7065727479223a207b22666f726d6174223a2022696e616f6b615f70726f6772616d5f73616d706c655f73656d616e746963227d7d,55907  >  7000 Len=167
113,51.574466,192.168.11.39,192.168.11.38,TCP,74,,œ,0.008575,"Jan  6, 2024 19:37:06.143407000 JST",,60036  >  6000 [SYN] Seq=0 Win=64240 Len=0 MSS=1460 SACK_PERM TSval=962141524 TSecr=0 WS=128
114,51.574596,192.168.11.38,192.168.11.39,TCP,74,0.00013,,0.00013,"Jan  6, 2024 19:37:06.143537000 JST",,"6000  >  60036 [SYN, ACK] Seq=0 Ack=1 Win=65160 Len=0 MSS=1460 SACK_PERM TSval=3421118529 TSecr=962141524 WS=128"
115,51.581474,192.168.11.39,192.168.11.38,TCP,66,0.006878,,0.006878,"Jan  6, 2024 19:37:06.150415000 JST",,60036  >  6000 [ACK] Seq=1 Ack=1 Win=64256 Len=0 TSval=962141531 TSecr=3421118529
116,51.582019,192.168.11.39,192.168.11.38,TCP,93,,,0.000545,"Jan  6, 2024 19:37:06.150960000 JST",,"60036  >  6000 [PSH, ACK] Seq=1 Ack=1 Win=64256 Len=27 TSval=962141531 TSecr=3421118529 [TCP segment of a reassembled PDU]"
117,51.582125,192.168.11.38,192.168.11.39,TCP,66,0.000106,,0.000106,"Jan  6, 2024 19:37:06.151066000 JST",,6000  >  60036 [ACK] Seq=1 Ack=28 Win=65152 Len=0 TSval=3421118536 TSecr=962141531
118,51.582194,192.168.11.39,192.168.11.38,TCP,66,,,0.000069,"Jan  6, 2024 19:37:06.151135000 JST",,"60036  >  6000 [FIN, ACK] Seq=28 Ack=1 Win=64256 Len=0 TSval=962141532 TSecr=3421118529"
119,51.583438,192.168.11.38,192.168.11.39,TCP,66,0.001244,,0.001244,"Jan  6, 2024 19:37:06.152379000 JST",,"6000  >  60036 [FIN, ACK] Seq=1 Ack=29 Win=65152 Len=0 TSval=3421118537 TSecr=962141532"
120,51.589296,192.168.11.39,192.168.11.38,TCP,66,0.005858,,0.005858,"Jan  6, 2024 19:37:06.158237000 JST",,60036  >  6000 [ACK] Seq=29 Ack=2 Win=64256 Len=0 TSval=962141539 TSecr=3421118537
121,60.826023,192.168.11.38,192.168.11.37,TCP,74,,,9.236727,"Jan  6, 2024 19:37:15.394964000 JST",,34354  >  6000 [SYN] Seq=0 Win=64240 Len=0 MSS=1460 SACK_PERM TSval=1839461103 TSecr=0 WS=128
122,60.832982,192.168.11.37,192.168.11.38,TCP,74,0.006959,,0.006959,"Jan  6, 2024 19:37:15.401923000 JST",,"6000  >  34354 [SYN, ACK] Seq=0 Ack=1 Win=65160 Len=0 MSS=1460 SACK_PERM TSval=1928309336 TSecr=1839461103 WS=128"
123,60.83309,192.168.11.38,192.168.11.37,TCP,66,0.000108,,0.000108,"Jan  6, 2024 19:37:15.402031000 JST",,34354  >  6000 [ACK] Seq=1 Ack=1 Win=64256 Len=0 TSval=1839461110 TSecr=1928309336
124,60.833224,192.168.11.38,192.168.11.37,TCP,93,,,0.000134,"Jan  6, 2024 19:37:15.402165000 JST",,"34354  >  6000 [PSH, ACK] Seq=1 Ack=1 Win=64256 Len=27 TSval=1839461110 TSecr=1928309336 [TCP segment of a reassembled PDU]"
125,60.833321,192.168.11.38,192.168.11.37,TCP,66,,,0.000097,"Jan  6, 2024 19:37:15.402262000 JST",,"34354  >  6000 [FIN, ACK] Seq=28 Ack=1 Win=64256 Len=0 TSval=1839461110 TSecr=1928309336"
126,60.84046,192.168.11.37,192.168.11.38,TCP,66,0.007236,,0.007139,"Jan  6, 2024 19:37:15.409401000 JST",,6000  >  34354 [ACK] Seq=1 Ack=28 Win=65152 Len=0 TSval=1928309344 TSecr=1839461110
127,60.840677,192.168.11.37,192.168.11.38,TCP,66,0.007356,,0.000217,"Jan  6, 2024 19:37:15.409618000 JST",,"6000  >  34354 [FIN, ACK] Seq=1 Ack=29 Win=65152 Len=0 TSval=1928309346 TSecr=1839461110"
128,60.840721,192.168.11.38,192.168.11.37,TCP,66,0.000044,,0.000044,"Jan  6, 2024 19:37:15.409662000 JST",,34354  >  6000 [ACK] Seq=29 Ack=2 Win=64256 Len=0 TSval=1839461118 TSecr=1928309346
129,60.873311,192.168.11.38,255.255.255.255,UDP,209,,Ÿ,0.03259,"Jan  6, 2024 19:37:15.442252000 JST",7b2273656d616e74696373223a207b22656e74697479223a2022504944222c202262617365656e74697479223a2022616e79222c2022726f6c65223a2022373737222c20227370617469616c223a2022616e79222c202274656d706f72616c223a2022616e79227d2c20226461746170726f7065727479223a207b22666f726d6174223a2022696e616f6b615f70726f6772616d5f73616d706c655f73656d616e746963227d7d,37800  >  7000 Len=167
130,60.881469,192.168.11.39,192.168.11.38,TCP,74,,œ,0.008158,"Jan  6, 2024 19:37:15.450410000 JST",,51086  >  6000 [SYN] Seq=0 Win=64240 Len=0 MSS=1460 SACK_PERM TSval=962150831 TSecr=0 WS=128
131,60.881609,192.168.11.38,192.168.11.39,TCP,74,0.00014,,0.00014,"Jan  6, 2024 19:37:15.450550000 JST",,"6000  >  51086 [SYN, ACK] Seq=0 Ack=1 Win=65160 Len=0 MSS=1460 SACK_PERM TSval=3421127836 TSecr=962150831 WS=128"
132,60.888308,192.168.11.39,192.168.11.38,TCP,66,0.006699,,0.006699,"Jan  6, 2024 19:37:15.457249000 JST",,51086  >  6000 [ACK] Seq=1 Ack=1 Win=64256 Len=0 TSval=962150838 TSecr=3421127836
133,60.889344,192.168.11.39,192.168.11.38,TCP,93,,,0.001036,"Jan  6, 2024 19:37:15.458285000 JST",,"51086  >  6000 [PSH, ACK] Seq=1 Ack=1 Win=64256 Len=27 TSval=962150838 TSecr=3421127836 [TCP segment of a reassembled PDU]"
134,60.88945,192.168.11.38,192.168.11.39,TCP,66,0.000106,,0.000106,"Jan  6, 2024 19:37:15.458391000 JST",,6000  >  51086 [ACK] Seq=1 Ack=28 Win=65152 Len=0 TSval=3421127843 TSecr=962150838
135,60.889532,192.168.11.39,192.168.11.38,TCP,66,,,0.000082,"Jan  6, 2024 19:37:15.458473000 JST",,"51086  >  6000 [FIN, ACK] Seq=28 Ack=1 Win=64256 Len=0 TSval=962150838 TSecr=3421127836"
136,60.891583,192.168.11.38,192.168.11.39,TCP,66,0.002051,,0.002051,"Jan  6, 2024 19:37:15.460524000 JST",,"6000  >  51086 [FIN, ACK] Seq=1 Ack=29 Win=65152 Len=0 TSval=3421127845 TSecr=962150838"
137,60.896554,192.168.11.39,192.168.11.38,TCP,66,0.004971,,0.004971,"Jan  6, 2024 19:37:15.465495000 JST",,51086  >  6000 [ACK] Seq=29 Ack=2 Win=64256 Len=0 TSval=962150846 TSecr=3421127845
138,71.732829,192.168.11.38,192.168.11.37,TCP,74,,,10.836275,"Jan  6, 2024 19:37:26.301770000 JST",,34670  >  6000 [SYN] Seq=0 Win=64240 Len=0 MSS=1460 SACK_PERM TSval=1839472010 TSecr=0 WS=128
139,71.741154,192.168.11.37,192.168.11.38,TCP,74,0.008325,,0.008325,"Jan  6, 2024 19:37:26.310095000 JST",,"6000  >  34670 [SYN, ACK] Seq=0 Ack=1 Win=65160 Len=0 MSS=1460 SACK_PERM TSval=1928320245 TSecr=1839472010 WS=128"
140,71.741257,192.168.11.38,192.168.11.37,TCP,66,0.000103,,0.000103,"Jan  6, 2024 19:37:26.310198000 JST",,34670  >  6000 [ACK] Seq=1 Ack=1 Win=64256 Len=0 TSval=1839472018 TSecr=1928320245
141,71.741393,192.168.11.38,192.168.11.37,TCP,93,,,0.000136,"Jan  6, 2024 19:37:26.310334000 JST",,"34670  >  6000 [PSH, ACK] Seq=1 Ack=1 Win=64256 Len=27 TSval=1839472018 TSecr=1928320245 [TCP segment of a reassembled PDU]"
142,71.741501,192.168.11.38,192.168.11.37,TCP,66,,,0.000108,"Jan  6, 2024 19:37:26.310442000 JST",,"34670  >  6000 [FIN, ACK] Seq=28 Ack=1 Win=64256 Len=0 TSval=1839472018 TSecr=1928320245"
143,71.751245,192.168.11.37,192.168.11.38,TCP,66,0.009852,,0.009744,"Jan  6, 2024 19:37:26.320186000 JST",,6000  >  34670 [ACK] Seq=1 Ack=28 Win=65152 Len=0 TSval=1928320254 TSecr=1839472018
144,71.751691,192.168.11.37,192.168.11.38,TCP,66,0.01019,,0.000446,"Jan  6, 2024 19:37:26.320632000 JST",,"6000  >  34670 [FIN, ACK] Seq=1 Ack=29 Win=65152 Len=0 TSval=1928320256 TSecr=1839472018"
145,71.751746,192.168.11.38,192.168.11.37,TCP,66,0.000055,,0.000055,"Jan  6, 2024 19:37:26.320687000 JST",,34670  >  6000 [ACK] Seq=29 Ack=2 Win=64256 Len=0 TSval=1839472029 TSecr=1928320256
146,71.967383,192.168.11.37,192.168.11.38,TCP,66,,,0.215637,"Jan  6, 2024 19:37:26.536324000 JST",,"[TCP Retransmission] 6000  >  34670 [FIN, ACK] Seq=1 Ack=29 Win=65152 Len=0 TSval=1928320469 TSecr=1839472018"
147,71.967461,192.168.11.38,192.168.11.37,TCP,66,0.000078,,0.000078,"Jan  6, 2024 19:37:26.536402000 JST",,[TCP Dup ACK 145#1] 34670  >  6000 [ACK] Seq=29 Ack=2 Win=64256 Len=0 TSval=1839472244 TSecr=1928320256
148,72.78269,192.168.11.38,255.255.255.255,UDP,209,,Ÿ,0.815229,"Jan  6, 2024 19:37:27.351631000 JST",7b2273656d616e74696373223a207b22656e74697479223a2022504944222c202262617365656e74697479223a2022616e79222c2022726f6c65223a2022373737222c20227370617469616c223a2022616e79222c202274656d706f72616c223a2022616e79227d2c20226461746170726f7065727479223a207b22666f726d6174223a2022696e616f6b615f70726f6772616d5f73616d706c655f73656d616e746963227d7d,58023  >  7000 Len=167
149,72.79091,192.168.11.39,192.168.11.38,TCP,74,,œ,0.00822,"Jan  6, 2024 19:37:27.359851000 JST",,46026  >  6000 [SYN] Seq=0 Win=64240 Len=0 MSS=1460 SACK_PERM TSval=962162740 TSecr=0 WS=128
150,72.791052,192.168.11.38,192.168.11.39,TCP,74,0.000142,,0.000142,"Jan  6, 2024 19:37:27.359993000 JST",,"6000  >  46026 [SYN, ACK] Seq=0 Ack=1 Win=65160 Len=0 MSS=1460 SACK_PERM TSval=3421139745 TSecr=962162740 WS=128"
151,72.798925,192.168.11.39,192.168.11.38,TCP,66,0.007873,,0.007873,"Jan  6, 2024 19:37:27.367866000 JST",,46026  >  6000 [ACK] Seq=1 Ack=1 Win=64256 Len=0 TSval=962162748 TSecr=3421139745
152,72.79961,192.168.11.39,192.168.11.38,TCP,93,,,0.000685,"Jan  6, 2024 19:37:27.368551000 JST",,"46026  >  6000 [PSH, ACK] Seq=1 Ack=1 Win=64256 Len=27 TSval=962162749 TSecr=3421139745 [TCP segment of a reassembled PDU]"
153,72.799698,192.168.11.38,192.168.11.39,TCP,66,0.000088,,0.000088,"Jan  6, 2024 19:37:27.368639000 JST",,6000  >  46026 [ACK] Seq=1 Ack=28 Win=65152 Len=0 TSval=3421139754 TSecr=962162749
154,72.79978,192.168.11.39,192.168.11.38,TCP,66,,,0.000082,"Jan  6, 2024 19:37:27.368721000 JST",,"46026  >  6000 [FIN, ACK] Seq=28 Ack=1 Win=64256 Len=0 TSval=962162749 TSecr=3421139745"
155,72.801572,192.168.11.38,192.168.11.39,TCP,66,0.001792,,0.001792,"Jan  6, 2024 19:37:27.370513000 JST",,"6000  >  46026 [FIN, ACK] Seq=1 Ack=29 Win=65152 Len=0 TSval=3421139756 TSecr=962162749"
156,72.810952,192.168.11.39,192.168.11.38,TCP,66,0.00938,,0.00938,"Jan  6, 2024 19:37:27.379893000 JST",,46026  >  6000 [ACK] Seq=29 Ack=2 Win=64256 Len=0 TSval=962162760 TSecr=3421139756
157,80.623469,192.168.11.38,192.168.11.37,TCP,74,,,7.812517,"Jan  6, 2024 19:37:35.192410000 JST",,55220  >  6000 [SYN] Seq=0 Win=64240 Len=0 MSS=1460 SACK_PERM TSval=1839480900 TSecr=0 WS=128
158,80.631195,192.168.11.37,192.168.11.38,TCP,74,0.007726,,0.007726,"Jan  6, 2024 19:37:35.200136000 JST",,"6000  >  55220 [SYN, ACK] Seq=0 Ack=1 Win=65160 Len=0 MSS=1460 SACK_PERM TSval=1928329134 TSecr=1839480900 WS=128"
159,80.63131,192.168.11.38,192.168.11.37,TCP,66,0.000115,,0.000115,"Jan  6, 2024 19:37:35.200251000 JST",,55220  >  6000 [ACK] Seq=1 Ack=1 Win=64256 Len=0 TSval=1839480908 TSecr=1928329134
160,80.631564,192.168.11.38,192.168.11.37,TCP,93,,,0.000254,"Jan  6, 2024 19:37:35.200505000 JST",,"55220  >  6000 [PSH, ACK] Seq=1 Ack=1 Win=64256 Len=27 TSval=1839480908 TSecr=1928329134 [TCP segment of a reassembled PDU]"
161,80.631678,192.168.11.38,192.168.11.37,TCP,66,,,0.000114,"Jan  6, 2024 19:37:35.200619000 JST",,"55220  >  6000 [FIN, ACK] Seq=28 Ack=1 Win=64256 Len=0 TSval=1839480909 TSecr=1928329134"
162,80.638337,192.168.11.37,192.168.11.38,TCP,66,0.006773,,0.006659,"Jan  6, 2024 19:37:35.207278000 JST",,6000  >  55220 [ACK] Seq=1 Ack=28 Win=65152 Len=0 TSval=1928329142 TSecr=1839480908
163,80.63873,192.168.11.37,192.168.11.38,TCP,66,0.007052,,0.000393,"Jan  6, 2024 19:37:35.207671000 JST",,"6000  >  55220 [FIN, ACK] Seq=1 Ack=29 Win=65152 Len=0 TSval=1928329142 TSecr=1839480909"
164,80.638775,192.168.11.38,192.168.11.37,TCP,66,0.000045,,0.000045,"Jan  6, 2024 19:37:35.207716000 JST",,55220  >  6000 [ACK] Seq=29 Ack=2 Win=64256 Len=0 TSval=1839480916 TSecr=1928329142
165,80.66771,192.168.11.38,255.255.255.255,UDP,209,,Ÿ,0.028935,"Jan  6, 2024 19:37:35.236651000 JST",7b2273656d616e74696373223a207b22656e74697479223a2022504944222c202262617365656e74697479223a2022616e79222c2022726f6c65223a2022373737222c20227370617469616c223a2022616e79222c202274656d706f72616c223a2022616e79227d2c20226461746170726f7065727479223a207b22666f726d6174223a2022696e616f6b615f70726f6772616d5f73616d706c655f73656d616e746963227d7d,47144  >  7000 Len=167
166,80.675186,192.168.11.39,192.168.11.38,TCP,74,,œ,0.007476,"Jan  6, 2024 19:37:35.244127000 JST",,50112  >  6000 [SYN] Seq=0 Win=64240 Len=0 MSS=1460 SACK_PERM TSval=962170625 TSecr=0 WS=128
167,80.675323,192.168.11.38,192.168.11.39,TCP,74,0.000137,,0.000137,"Jan  6, 2024 19:37:35.244264000 JST",,"6000  >  50112 [SYN, ACK] Seq=0 Ack=1 Win=65160 Len=0 MSS=1460 SACK_PERM TSval=3421147629 TSecr=962170625 WS=128"
168,80.682043,192.168.11.39,192.168.11.38,TCP,66,0.00672,,0.00672,"Jan  6, 2024 19:37:35.250984000 JST",,50112  >  6000 [ACK] Seq=1 Ack=1 Win=64256 Len=0 TSval=962170632 TSecr=3421147629
169,80.682644,192.168.11.39,192.168.11.38,TCP,93,,,0.000601,"Jan  6, 2024 19:37:35.251585000 JST",,"50112  >  6000 [PSH, ACK] Seq=1 Ack=1 Win=64256 Len=27 TSval=962170632 TSecr=3421147629 [TCP segment of a reassembled PDU]"
170,80.682742,192.168.11.38,192.168.11.39,TCP,66,0.000098,,0.000098,"Jan  6, 2024 19:37:35.251683000 JST",,6000  >  50112 [ACK] Seq=1 Ack=28 Win=65152 Len=0 TSval=3421147637 TSecr=962170632
171,80.682822,192.168.11.39,192.168.11.38,TCP,66,,,0.00008,"Jan  6, 2024 19:37:35.251763000 JST",,"50112  >  6000 [FIN, ACK] Seq=28 Ack=1 Win=64256 Len=0 TSval=962170632 TSecr=3421147629"
172,80.684182,192.168.11.38,192.168.11.39,TCP,66,0.00136,,0.00136,"Jan  6, 2024 19:37:35.253123000 JST",,"6000  >  50112 [FIN, ACK] Seq=1 Ack=29 Win=65152 Len=0 TSval=3421147638 TSecr=962170632"
173,80.691556,192.168.11.39,192.168.11.38,TCP,66,0.007374,,0.007374,"Jan  6, 2024 19:37:35.260497000 JST",,50112  >  6000 [ACK] Seq=29 Ack=2 Win=64256 Len=0 TSval=962170639 TSecr=3421147638
174,112.837685,192.168.11.38,192.168.11.37,TCP,74,,,32.146129,"Jan  6, 2024 19:38:07.406626000 JST",,39206  >  6000 [SYN] Seq=0 Win=64240 Len=0 MSS=1460 SACK_PERM TSval=1839513115 TSecr=0 WS=128
175,112.846236,192.168.11.37,192.168.11.38,TCP,74,0.008551,,0.008551,"Jan  6, 2024 19:38:07.415177000 JST",,"6000  >  39206 [SYN, ACK] Seq=0 Ack=1 Win=65160 Len=0 MSS=1460 SACK_PERM TSval=1928361350 TSecr=1839513115 WS=128"
176,112.846344,192.168.11.38,192.168.11.37,TCP,66,0.000108,,0.000108,"Jan  6, 2024 19:38:07.415285000 JST",,39206  >  6000 [ACK] Seq=1 Ack=1 Win=64256 Len=0 TSval=1839513123 TSecr=1928361350
177,112.846603,192.168.11.38,192.168.11.37,TCP,93,,,0.000259,"Jan  6, 2024 19:38:07.415544000 JST",,"39206  >  6000 [PSH, ACK] Seq=1 Ack=1 Win=64256 Len=27 TSval=1839513124 TSecr=1928361350 [TCP segment of a reassembled PDU]"
178,112.846721,192.168.11.38,192.168.11.37,TCP,66,,,0.000118,"Jan  6, 2024 19:38:07.415662000 JST",,"39206  >  6000 [FIN, ACK] Seq=28 Ack=1 Win=64256 Len=0 TSval=1839513124 TSecr=1928361350"
179,112.856152,192.168.11.37,192.168.11.38,TCP,66,0.009549,,0.009431,"Jan  6, 2024 19:38:07.425093000 JST",,6000  >  39206 [ACK] Seq=1 Ack=28 Win=65152 Len=0 TSval=1928361357 TSecr=1839513124
180,112.85637,192.168.11.37,192.168.11.38,TCP,66,0.009649,,0.000218,"Jan  6, 2024 19:38:07.425311000 JST",,"6000  >  39206 [FIN, ACK] Seq=1 Ack=29 Win=65152 Len=0 TSval=1928361359 TSecr=1839513124"
181,112.856413,192.168.11.38,192.168.11.37,TCP,66,0.000043,,0.000043,"Jan  6, 2024 19:38:07.425354000 JST",,39206  >  6000 [ACK] Seq=29 Ack=2 Win=64256 Len=0 TSval=1839513133 TSecr=1928361359
182,112.885306,192.168.11.38,255.255.255.255,UDP,209,,Ÿ,0.028893,"Jan  6, 2024 19:38:07.454247000 JST",7b2273656d616e74696373223a207b22656e74697479223a2022504944222c202262617365656e74697479223a2022616e79222c2022726f6c65223a2022373737222c20227370617469616c223a2022616e79222c202274656d706f72616c223a2022616e79227d2c20226461746170726f7065727479223a207b22666f726d6174223a2022696e616f6b615f70726f6772616d5f73616d706c655f73656d616e746963227d7d,33295  >  7000 Len=167
183,112.896796,192.168.11.39,192.168.11.38,TCP,74,,œ,0.01149,"Jan  6, 2024 19:38:07.465737000 JST",,54758  >  6000 [SYN] Seq=0 Win=64240 Len=0 MSS=1460 SACK_PERM TSval=962202846 TSecr=0 WS=128
