No.,Time,Source,Destination,Protocol,Length,The RTT to ACK the segment was,XXX,Time delta from previous captured frame,Arrival Time,Data,Info
1,0,192.168.11.39,192.168.11.38,TCP,74,,,0,"Jan  6, 2024 19:36:14.625957000 JST",,44510  >  6000 [SYN] Seq=0 Win=64240 Len=0 MSS=1460 SACK_PERM TSval=962090008 TSecr=0 WS=128
2,0.007006,192.168.11.38,192.168.11.39,TCP,74,0.007006,,0.007006,"Jan  6, 2024 19:36:14.632963000 JST",,"6000  >  44510 [SYN, ACK] Seq=0 Ack=1 Win=65160 Len=0 MSS=1460 SACK_PERM TSval=3421067016 TSecr=962090008 WS=128"
3,0.007122,192.168.11.39,192.168.11.38,TCP,66,0.000116,,0.000116,"Jan  6, 2024 19:36:14.633079000 JST",,44510  >  6000 [ACK] Seq=1 Ack=1 Win=64256 Len=0 TSval=962090019 TSecr=3421067016
4,0.00733,192.168.11.39,192.168.11.38,TCP,93,,,0.000208,"Jan  6, 2024 19:36:14.633287000 JST",,"44510  >  6000 [PSH, ACK] Seq=1 Ack=1 Win=64256 Len=27 TSval=962090019 TSecr=3421067016 [TCP segment of a reassembled PDU]"
5,0.007461,192.168.11.39,192.168.11.38,TCP,66,,,0.000131,"Jan  6, 2024 19:36:14.633418000 JST",,"44510  >  6000 [FIN, ACK] Seq=28 Ack=1 Win=64256 Len=0 TSval=962090019 TSecr=3421067016"
6,0.013682,192.168.11.38,192.168.11.39,TCP,66,0.006352,,0.006221,"Jan  6, 2024 19:36:14.639639000 JST",,6000  >  44510 [ACK] Seq=1 Ack=28 Win=65152 Len=0 TSval=3421067023 TSecr=962090019
7,0.014109,192.168.11.38,192.168.11.39,TCP,66,0.006648,,0.000427,"Jan  6, 2024 19:36:14.640066000 JST",,"6000  >  44510 [FIN, ACK] Seq=1 Ack=29 Win=65152 Len=0 TSval=3421067024 TSecr=962090019"
8,0.014155,192.168.11.39,192.168.11.38,TCP,66,0.000046,,0.000046,"Jan  6, 2024 19:36:14.640112000 JST",,44510  >  6000 [ACK] Seq=29 Ack=2 Win=64256 Len=0 TSval=962090026 TSecr=3421067024
9,0.045442,192.168.11.39,255.255.255.255,UDP,209,,Ÿ,0.031287,"Jan  6, 2024 19:36:14.671399000 JST",7b2273656d616e74696373223a207b22656e74697479223a2022504944222c202262617365656e74697479223a2022616e79222c2022726f6c65223a2022383838222c20227370617469616c223a2022616e79222c202274656d706f72616c223a2022616e79227d2c20226461746170726f7065727479223a207b22666f726d6174223a2022696e616f6b615f70726f6772616d5f73616d706c655f73656d616e746963227d7d,56724  >  7000 Len=167
10,0.057522,192.168.11.40,192.168.11.39,TCP,74,,œ,0.01208,"Jan  6, 2024 19:36:14.683479000 JST",,58370  >  6000 [SYN] Seq=0 Win=64240 Len=0 MSS=1460 SACK_PERM TSval=1105557892 TSecr=0 WS=128
11,0.057678,192.168.11.39,192.168.11.40,TCP,74,0.000156,,0.000156,"Jan  6, 2024 19:36:14.683635000 JST",,"6000  >  58370 [SYN, ACK] Seq=0 Ack=1 Win=65160 Len=0 MSS=1460 SACK_PERM TSval=1274238125 TSecr=1105557892 WS=128"
12,0.064455,192.168.11.40,192.168.11.39,TCP,66,0.006777,,0.006777,"Jan  6, 2024 19:36:14.690412000 JST",,58370  >  6000 [ACK] Seq=1 Ack=1 Win=64256 Len=0 TSval=1105557903 TSecr=1274238125
13,0.065031,192.168.11.40,192.168.11.39,TCP,93,,,0.000576,"Jan  6, 2024 19:36:14.690988000 JST",,"58370  >  6000 [PSH, ACK] Seq=1 Ack=1 Win=64256 Len=27 TSval=1105557903 TSecr=1274238125 [TCP segment of a reassembled PDU]"
14,0.06513,192.168.11.39,192.168.11.40,TCP,66,0.000099,,0.000099,"Jan  6, 2024 19:36:14.691087000 JST",,6000  >  58370 [ACK] Seq=1 Ack=28 Win=65152 Len=0 TSval=1274238133 TSecr=1105557903
15,0.065202,192.168.11.40,192.168.11.39,TCP,66,,,0.000072,"Jan  6, 2024 19:36:14.691159000 JST",,"58370  >  6000 [FIN, ACK] Seq=28 Ack=1 Win=64256 Len=0 TSval=1105557903 TSecr=1274238125"
16,0.066744,192.168.11.39,192.168.11.40,TCP,66,0.001542,,0.001542,"Jan  6, 2024 19:36:14.692701000 JST",,"6000  >  58370 [FIN, ACK] Seq=1 Ack=29 Win=65152 Len=0 TSval=1274238134 TSecr=1105557903"
17,0.073182,192.168.11.40,192.168.11.39,TCP,66,0.006438,,0.006438,"Jan  6, 2024 19:36:14.699139000 JST",,58370  >  6000 [ACK] Seq=29 Ack=2 Win=64256 Len=0 TSval=1105557911 TSecr=1274238134
18,8.247599,192.168.11.39,192.168.11.38,TCP,74,,,8.174417,"Jan  6, 2024 19:36:22.873556000 JST",,51810  >  6000 [SYN] Seq=0 Win=64240 Len=0 MSS=1460 SACK_PERM TSval=962098259 TSecr=0 WS=128
19,8.254213,192.168.11.38,192.168.11.39,TCP,74,0.006614,,0.006614,"Jan  6, 2024 19:36:22.880170000 JST",,"6000  >  51810 [SYN, ACK] Seq=0 Ack=1 Win=65160 Len=0 MSS=1460 SACK_PERM TSval=3421075263 TSecr=962098259 WS=128"
20,8.25432,192.168.11.39,192.168.11.38,TCP,66,0.000107,,0.000107,"Jan  6, 2024 19:36:22.880277000 JST",,51810  >  6000 [ACK] Seq=1 Ack=1 Win=64256 Len=0 TSval=962098266 TSecr=3421075263
21,8.254459,192.168.11.39,192.168.11.38,TCP,93,,,0.000139,"Jan  6, 2024 19:36:22.880416000 JST",,"51810  >  6000 [PSH, ACK] Seq=1 Ack=1 Win=64256 Len=27 TSval=962098266 TSecr=3421075263 [TCP segment of a reassembled PDU]"
22,8.254569,192.168.11.39,192.168.11.38,TCP,66,,,0.00011,"Jan  6, 2024 19:36:22.880526000 JST",,"51810  >  6000 [FIN, ACK] Seq=28 Ack=1 Win=64256 Len=0 TSval=962098266 TSecr=3421075263"
23,8.26187,192.168.11.38,192.168.11.39,TCP,66,0.007411,,0.007301,"Jan  6, 2024 19:36:22.887827000 JST",,6000  >  51810 [ACK] Seq=1 Ack=28 Win=65152 Len=0 TSval=3421075271 TSecr=962098266
24,8.262243,192.168.11.38,192.168.11.39,TCP,66,0.007674,,0.000373,"Jan  6, 2024 19:36:22.888200000 JST",,"6000  >  51810 [FIN, ACK] Seq=1 Ack=29 Win=65152 Len=0 TSval=3421075272 TSecr=962098266"
25,8.262291,192.168.11.39,192.168.11.38,TCP,66,0.000048,,0.000048,"Jan  6, 2024 19:36:22.888248000 JST",,51810  >  6000 [ACK] Seq=29 Ack=2 Win=64256 Len=0 TSval=962098274 TSecr=3421075272
26,8.293489,192.168.11.39,255.255.255.255,UDP,209,,Ÿ,0.031198,"Jan  6, 2024 19:36:22.919446000 JST",7b2273656d616e74696373223a207b22656e74697479223a2022504944222c202262617365656e74697479223a2022616e79222c2022726f6c65223a2022383838222c20227370617469616c223a2022616e79222c202274656d706f72616c223a2022616e79227d2c20226461746170726f7065727479223a207b22666f726d6174223a2022696e616f6b615f70726f6772616d5f73616d706c655f73656d616e746963227d7d,40837  >  7000 Len=167
27,8.301502,192.168.11.40,192.168.11.39,TCP,74,,œ,0.008013,"Jan  6, 2024 19:36:22.927459000 JST",,38588  >  6000 [SYN] Seq=0 Win=64240 Len=0 MSS=1460 SACK_PERM TSval=1105566140 TSecr=0 WS=128
28,8.301631,192.168.11.39,192.168.11.40,TCP,74,0.000129,,0.000129,"Jan  6, 2024 19:36:22.927588000 JST",,"6000  >  38588 [SYN, ACK] Seq=0 Ack=1 Win=65160 Len=0 MSS=1460 SACK_PERM TSval=1274246369 TSecr=1105566140 WS=128"
29,8.308057,192.168.11.40,192.168.11.39,TCP,66,0.006426,,0.006426,"Jan  6, 2024 19:36:22.934014000 JST",,38588  >  6000 [ACK] Seq=1 Ack=1 Win=64256 Len=0 TSval=1105566147 TSecr=1274246369
30,8.308544,192.168.11.40,192.168.11.39,TCP,93,,,0.000487,"Jan  6, 2024 19:36:22.934501000 JST",,"38588  >  6000 [PSH, ACK] Seq=1 Ack=1 Win=64256 Len=27 TSval=1105566147 TSecr=1274246369 [TCP segment of a reassembled PDU]"
31,8.30861,192.168.11.39,192.168.11.40,TCP,66,0.000066,,0.000066,"Jan  6, 2024 19:36:22.934567000 JST",,6000  >  38588 [ACK] Seq=1 Ack=28 Win=65152 Len=0 TSval=1274246376 TSecr=1105566147
32,8.308671,192.168.11.40,192.168.11.39,TCP,66,,,0.000061,"Jan  6, 2024 19:36:22.934628000 JST",,"38588  >  6000 [FIN, ACK] Seq=28 Ack=1 Win=64256 Len=0 TSval=1105566147 TSecr=1274246369"
33,8.309428,192.168.11.39,192.168.11.40,TCP,66,0.000757,,0.000757,"Jan  6, 2024 19:36:22.935385000 JST",,"6000  >  38588 [FIN, ACK] Seq=1 Ack=29 Win=65152 Len=0 TSval=1274246377 TSecr=1105566147"
34,8.318051,192.168.11.40,192.168.11.39,TCP,66,0.008623,,0.008623,"Jan  6, 2024 19:36:22.944008000 JST",,38588  >  6000 [ACK] Seq=29 Ack=2 Win=64256 Len=0 TSval=1105566157 TSecr=1274246377
35,18.093529,192.168.11.39,192.168.11.38,TCP,74,,,9.775478,"Jan  6, 2024 19:36:32.719486000 JST",,48016  >  6000 [SYN] Seq=0 Win=64240 Len=0 MSS=1460 SACK_PERM TSval=962108105 TSecr=0 WS=128
36,19.112119,192.168.11.39,192.168.11.38,TCP,74,,,1.01859,"Jan  6, 2024 19:36:33.738076000 JST",,[TCP Retransmission] 48016  >  6000 [SYN] Seq=0 Win=64240 Len=0 MSS=1460 SACK_PERM TSval=962109124 TSecr=0 WS=128
37,19.119388,192.168.11.38,192.168.11.39,TCP,74,1.025859,,0.007269,"Jan  6, 2024 19:36:33.745345000 JST",,"6000  >  48016 [SYN, ACK] Seq=0 Ack=1 Win=65160 Len=0 MSS=1460 SACK_PERM TSval=3421086128 TSecr=962109124 WS=128"
38,19.119507,192.168.11.39,192.168.11.38,TCP,66,0.000119,,0.000119,"Jan  6, 2024 19:36:33.745464000 JST",,48016  >  6000 [ACK] Seq=1 Ack=1 Win=64256 Len=0 TSval=962109131 TSecr=3421086128
39,19.11981,192.168.11.39,192.168.11.38,TCP,93,,,0.000303,"Jan  6, 2024 19:36:33.745767000 JST",,"48016  >  6000 [PSH, ACK] Seq=1 Ack=1 Win=64256 Len=27 TSval=962109131 TSecr=3421086128 [TCP segment of a reassembled PDU]"
40,19.119944,192.168.11.39,192.168.11.38,TCP,66,,,0.000134,"Jan  6, 2024 19:36:33.745901000 JST",,"48016  >  6000 [FIN, ACK] Seq=28 Ack=1 Win=64256 Len=0 TSval=962109131 TSecr=3421086128"
41,19.129215,192.168.11.38,192.168.11.39,TCP,66,0.009405,,0.009271,"Jan  6, 2024 19:36:33.755172000 JST",,6000  >  48016 [ACK] Seq=1 Ack=28 Win=65152 Len=0 TSval=3421086136 TSecr=962109131
42,19.132426,192.168.11.38,192.168.11.39,TCP,66,0.012482,,0.003211,"Jan  6, 2024 19:36:33.758383000 JST",,"6000  >  48016 [FIN, ACK] Seq=1 Ack=29 Win=65152 Len=0 TSval=3421086137 TSecr=962109131"
43,19.132474,192.168.11.39,192.168.11.38,TCP,66,0.000048,,0.000048,"Jan  6, 2024 19:36:33.758431000 JST",,48016  >  6000 [ACK] Seq=29 Ack=2 Win=64256 Len=0 TSval=962109144 TSecr=3421086137
44,19.16501,192.168.11.39,255.255.255.255,UDP,209,,Ÿ,0.032536,"Jan  6, 2024 19:36:33.790967000 JST",7b2273656d616e74696373223a207b22656e74697479223a2022504944222c202262617365656e74697479223a2022616e79222c2022726f6c65223a2022383838222c20227370617469616c223a2022616e79222c202274656d706f72616c223a2022616e79227d2c20226461746170726f7065727479223a207b22666f726d6174223a2022696e616f6b615f70726f6772616d5f73616d706c655f73656d616e746963227d7d,41452  >  7000 Len=167
45,19.173177,192.168.11.40,192.168.11.39,TCP,74,,œ,0.008167,"Jan  6, 2024 19:36:33.799134000 JST",,57712  >  6000 [SYN] Seq=0 Win=64240 Len=0 MSS=1460 SACK_PERM TSval=1105577012 TSecr=0 WS=128
46,19.173331,192.168.11.39,192.168.11.40,TCP,74,0.000154,,0.000154,"Jan  6, 2024 19:36:33.799288000 JST",,"6000  >  57712 [SYN, ACK] Seq=0 Ack=1 Win=65160 Len=0 MSS=1460 SACK_PERM TSval=1274257241 TSecr=1105577012 WS=128"
47,19.180349,192.168.11.40,192.168.11.39,TCP,66,0.007018,,0.007018,"Jan  6, 2024 19:36:33.806306000 JST",,57712  >  6000 [ACK] Seq=1 Ack=1 Win=64256 Len=0 TSval=1105577019 TSecr=1274257241
48,19.180891,192.168.11.40,192.168.11.39,TCP,93,,,0.000542,"Jan  6, 2024 19:36:33.806848000 JST",,"57712  >  6000 [PSH, ACK] Seq=1 Ack=1 Win=64256 Len=27 TSval=1105577019 TSecr=1274257241 [TCP segment of a reassembled PDU]"
49,19.180966,192.168.11.39,192.168.11.40,TCP,66,0.000075,,0.000075,"Jan  6, 2024 19:36:33.806923000 JST",,6000  >  57712 [ACK] Seq=1 Ack=28 Win=65152 Len=0 TSval=1274257248 TSecr=1105577019
50,19.181033,192.168.11.40,192.168.11.39,TCP,66,,,0.000067,"Jan  6, 2024 19:36:33.806990000 JST",,"57712  >  6000 [FIN, ACK] Seq=28 Ack=1 Win=64256 Len=0 TSval=1105577019 TSecr=1274257241"
51,19.182077,192.168.11.39,192.168.11.40,TCP,66,0.001044,,0.001044,"Jan  6, 2024 19:36:33.808034000 JST",,"6000  >  57712 [FIN, ACK] Seq=1 Ack=29 Win=65152 Len=0 TSval=1274257249 TSecr=1105577019"
52,19.19059,192.168.11.40,192.168.11.39,TCP,66,0.008513,,0.008513,"Jan  6, 2024 19:36:33.816547000 JST",,57712  >  6000 [ACK] Seq=29 Ack=2 Win=64256 Len=0 TSval=1105577027 TSecr=1274257249
53,28.019559,192.168.11.39,192.168.11.38,TCP,74,,,8.828969,"Jan  6, 2024 19:36:42.645516000 JST",,46166  >  6000 [SYN] Seq=0 Win=64240 Len=0 MSS=1460 SACK_PERM TSval=962118031 TSecr=0 WS=128
54,28.028558,192.168.11.38,192.168.11.39,TCP,74,0.008999,,0.008999,"Jan  6, 2024 19:36:42.654515000 JST",,"6000  >  46166 [SYN, ACK] Seq=0 Ack=1 Win=65160 Len=0 MSS=1460 SACK_PERM TSval=3421095035 TSecr=962118031 WS=128"
55,28.028669,192.168.11.39,192.168.11.38,TCP,66,0.000111,,0.000111,"Jan  6, 2024 19:36:42.654626000 JST",,46166  >  6000 [ACK] Seq=1 Ack=1 Win=64256 Len=0 TSval=962118040 TSecr=3421095035
56,28.028801,192.168.11.39,192.168.11.38,TCP,93,,,0.000132,"Jan  6, 2024 19:36:42.654758000 JST",,"46166  >  6000 [PSH, ACK] Seq=1 Ack=1 Win=64256 Len=27 TSval=962118040 TSecr=3421095035 [TCP segment of a reassembled PDU]"
57,28.028906,192.168.11.39,192.168.11.38,TCP,66,,,0.000105,"Jan  6, 2024 19:36:42.654863000 JST",,"46166  >  6000 [FIN, ACK] Seq=28 Ack=1 Win=64256 Len=0 TSval=962118040 TSecr=3421095035"
58,28.036984,192.168.11.38,192.168.11.39,TCP,66,0.008183,,0.008078,"Jan  6, 2024 19:36:42.662941000 JST",,6000  >  46166 [ACK] Seq=1 Ack=28 Win=65152 Len=0 TSval=3421095046 TSecr=962118040
59,28.04341,192.168.11.38,192.168.11.39,TCP,66,0.014504,,0.006426,"Jan  6, 2024 19:36:42.669367000 JST",,"6000  >  46166 [FIN, ACK] Seq=1 Ack=29 Win=65152 Len=0 TSval=3421095048 TSecr=962118040"
60,28.043457,192.168.11.39,192.168.11.38,TCP,66,0.000047,,0.000047,"Jan  6, 2024 19:36:42.669414000 JST",,46166  >  6000 [ACK] Seq=29 Ack=2 Win=64256 Len=0 TSval=962118055 TSecr=3421095048
61,28.073694,192.168.11.39,255.255.255.255,UDP,209,,Ÿ,0.030237,"Jan  6, 2024 19:36:42.699651000 JST",7b2273656d616e74696373223a207b22656e74697479223a2022504944222c202262617365656e74697479223a2022616e79222c2022726f6c65223a2022383838222c20227370617469616c223a2022616e79222c202274656d706f72616c223a2022616e79227d2c20226461746170726f7065727479223a207b22666f726d6174223a2022696e616f6b615f70726f6772616d5f73616d706c655f73656d616e746963227d7d,44213  >  7000 Len=167
62,28.08213,192.168.11.40,192.168.11.39,TCP,74,,œ,0.008436,"Jan  6, 2024 19:36:42.708087000 JST",,49196  >  6000 [SYN] Seq=0 Win=64240 Len=0 MSS=1460 SACK_PERM TSval=1105585921 TSecr=0 WS=128
63,28.082291,192.168.11.39,192.168.11.40,TCP,74,0.000161,,0.000161,"Jan  6, 2024 19:36:42.708248000 JST",,"6000  >  49196 [SYN, ACK] Seq=0 Ack=1 Win=65160 Len=0 MSS=1460 SACK_PERM TSval=1274266150 TSecr=1105585921 WS=128"
64,28.089069,192.168.11.40,192.168.11.39,TCP,66,0.006778,,0.006778,"Jan  6, 2024 19:36:42.715026000 JST",,49196  >  6000 [ACK] Seq=1 Ack=1 Win=64256 Len=0 TSval=1105585928 TSecr=1274266150
65,28.089736,192.168.11.40,192.168.11.39,TCP,93,,,0.000667,"Jan  6, 2024 19:36:42.715693000 JST",,"49196  >  6000 [PSH, ACK] Seq=1 Ack=1 Win=64256 Len=27 TSval=1105585928 TSecr=1274266150 [TCP segment of a reassembled PDU]"
66,28.08984,192.168.11.39,192.168.11.40,TCP,66,0.000104,,0.000104,"Jan  6, 2024 19:36:42.715797000 JST",,6000  >  49196 [ACK] Seq=1 Ack=28 Win=65152 Len=0 TSval=1274266157 TSecr=1105585928
67,28.089916,192.168.11.40,192.168.11.39,TCP,66,,,0.000076,"Jan  6, 2024 19:36:42.715873000 JST",,"49196  >  6000 [FIN, ACK] Seq=28 Ack=1 Win=64256 Len=0 TSval=1105585928 TSecr=1274266150"
68,28.091301,192.168.11.39,192.168.11.40,TCP,66,0.001385,,0.001385,"Jan  6, 2024 19:36:42.717258000 JST",,"6000  >  49196 [FIN, ACK] Seq=1 Ack=29 Win=65152 Len=0 TSval=1274266159 TSecr=1105585928"
69,28.099684,192.168.11.40,192.168.11.39,TCP,66,0.008383,,0.008383,"Jan  6, 2024 19:36:42.725641000 JST",,49196  >  6000 [ACK] Seq=29 Ack=2 Win=64256 Len=0 TSval=1105585936 TSecr=1274266159
70,35.83901,192.168.11.39,192.168.11.38,TCP,74,,,7.739326,"Jan  6, 2024 19:36:50.464967000 JST",,42680  >  6000 [SYN] Seq=0 Win=64240 Len=0 MSS=1460 SACK_PERM TSval=962125850 TSecr=0 WS=128
71,35.845863,192.168.11.38,192.168.11.39,TCP,74,0.006853,,0.006853,"Jan  6, 2024 19:36:50.471820000 JST",,"6000  >  42680 [SYN, ACK] Seq=0 Ack=1 Win=65160 Len=0 MSS=1460 SACK_PERM TSval=3421102855 TSecr=962125850 WS=128"
72,35.845983,192.168.11.39,192.168.11.38,TCP,66,0.00012,,0.00012,"Jan  6, 2024 19:36:50.471940000 JST",,42680  >  6000 [ACK] Seq=1 Ack=1 Win=64256 Len=0 TSval=962125857 TSecr=3421102855
73,35.846135,192.168.11.39,192.168.11.38,TCP,93,,,0.000152,"Jan  6, 2024 19:36:50.472092000 JST",,"42680  >  6000 [PSH, ACK] Seq=1 Ack=1 Win=64256 Len=27 TSval=962125858 TSecr=3421102855 [TCP segment of a reassembled PDU]"
74,35.846259,192.168.11.39,192.168.11.38,TCP,66,,,0.000124,"Jan  6, 2024 19:36:50.472216000 JST",,"42680  >  6000 [FIN, ACK] Seq=28 Ack=1 Win=64256 Len=0 TSval=962125858 TSecr=3421102855"
75,35.853162,192.168.11.38,192.168.11.39,TCP,66,0.007027,,0.006903,"Jan  6, 2024 19:36:50.479119000 JST",,6000  >  42680 [ACK] Seq=1 Ack=28 Win=65152 Len=0 TSval=3421102862 TSecr=962125858
76,35.853553,192.168.11.38,192.168.11.39,TCP,66,0.007294,,0.000391,"Jan  6, 2024 19:36:50.479510000 JST",,"6000  >  42680 [FIN, ACK] Seq=1 Ack=29 Win=65152 Len=0 TSval=3421102863 TSecr=962125858"
77,35.85362,192.168.11.39,192.168.11.38,TCP,66,0.000067,,0.000067,"Jan  6, 2024 19:36:50.479577000 JST",,42680  >  6000 [ACK] Seq=29 Ack=2 Win=64256 Len=0 TSval=962125865 TSecr=3421102863
78,35.885096,192.168.11.39,255.255.255.255,UDP,209,,Ÿ,0.031476,"Jan  6, 2024 19:36:50.511053000 JST",7b2273656d616e74696373223a207b22656e74697479223a2022504944222c202262617365656e74697479223a2022616e79222c2022726f6c65223a2022383838222c20227370617469616c223a2022616e79222c202274656d706f72616c223a2022616e79227d2c20226461746170726f7065727479223a207b22666f726d6174223a2022696e616f6b615f70726f6772616d5f73616d706c655f73656d616e746963227d7d,38869  >  7000 Len=167
79,35.892544,192.168.11.40,192.168.11.39,TCP,74,,œ,0.007448,"Jan  6, 2024 19:36:50.518501000 JST",,52402  >  6000 [SYN] Seq=0 Win=64240 Len=0 MSS=1460 SACK_PERM TSval=1105593731 TSecr=0 WS=128
80,35.892679,192.168.11.39,192.168.11.40,TCP,74,0.000135,,0.000135,"Jan  6, 2024 19:36:50.518636000 JST",,"6000  >  52402 [SYN, ACK] Seq=0 Ack=1 Win=65160 Len=0 MSS=1460 SACK_PERM TSval=1274273960 TSecr=1105593731 WS=128"
81,35.899355,192.168.11.40,192.168.11.39,TCP,66,0.006676,,0.006676,"Jan  6, 2024 19:36:50.525312000 JST",,52402  >  6000 [ACK] Seq=1 Ack=1 Win=64256 Len=0 TSval=1105593738 TSecr=1274273960
82,35.899924,192.168.11.40,192.168.11.39,TCP,93,,,0.000569,"Jan  6, 2024 19:36:50.525881000 JST",,"52402  >  6000 [PSH, ACK] Seq=1 Ack=1 Win=64256 Len=27 TSval=1105593738 TSecr=1274273960 [TCP segment of a reassembled PDU]"
83,35.900065,192.168.11.39,192.168.11.40,TCP,66,0.000141,,0.000141,"Jan  6, 2024 19:36:50.526022000 JST",,6000  >  52402 [ACK] Seq=1 Ack=28 Win=65152 Len=0 TSval=1274273967 TSecr=1105593738
84,35.900216,192.168.11.40,192.168.11.39,TCP,66,,,0.000151,"Jan  6, 2024 19:36:50.526173000 JST",,"52402  >  6000 [FIN, ACK] Seq=28 Ack=1 Win=64256 Len=0 TSval=1105593738 TSecr=1274273960"
85,35.90139,192.168.11.39,192.168.11.40,TCP,66,0.001174,,0.001174,"Jan  6, 2024 19:36:50.527347000 JST",,"6000  >  52402 [FIN, ACK] Seq=1 Ack=29 Win=65152 Len=0 TSval=1274273969 TSecr=1105593738"
86,35.90651,192.168.11.40,192.168.11.39,TCP,66,0.00512,,0.00512,"Jan  6, 2024 19:36:50.532467000 JST",,52402  >  6000 [ACK] Seq=29 Ack=2 Win=64256 Len=0 TSval=1105593746 TSecr=1274273969
87,43.657149,192.168.11.39,192.168.11.38,TCP,74,,,7.750639,"Jan  6, 2024 19:36:58.283106000 JST",,60030  >  6000 [SYN] Seq=0 Win=64240 Len=0 MSS=1460 SACK_PERM TSval=962133669 TSecr=0 WS=128
88,43.666225,192.168.11.38,192.168.11.39,TCP,74,0.009076,,0.009076,"Jan  6, 2024 19:36:58.292182000 JST",,"6000  >  60030 [SYN, ACK] Seq=0 Ack=1 Win=65160 Len=0 MSS=1460 SACK_PERM TSval=3421110673 TSecr=962133669 WS=128"
89,43.666355,192.168.11.39,192.168.11.38,TCP,66,0.00013,,0.00013,"Jan  6, 2024 19:36:58.292312000 JST",,60030  >  6000 [ACK] Seq=1 Ack=1 Win=64256 Len=0 TSval=962133678 TSecr=3421110673
90,43.666503,192.168.11.39,192.168.11.38,TCP,93,,,0.000148,"Jan  6, 2024 19:36:58.292460000 JST",,"60030  >  6000 [PSH, ACK] Seq=1 Ack=1 Win=64256 Len=27 TSval=962133678 TSecr=3421110673 [TCP segment of a reassembled PDU]"
91,43.666612,192.168.11.39,192.168.11.38,TCP,66,,,0.000109,"Jan  6, 2024 19:36:58.292569000 JST",,"60030  >  6000 [FIN, ACK] Seq=28 Ack=1 Win=64256 Len=0 TSval=962133678 TSecr=3421110673"
92,43.674289,192.168.11.38,192.168.11.39,TCP,66,0.007786,,0.007677,"Jan  6, 2024 19:36:58.300246000 JST",,6000  >  60030 [ACK] Seq=1 Ack=28 Win=65152 Len=0 TSval=3421110683 TSecr=962133678
93,43.674704,192.168.11.38,192.168.11.39,TCP,66,0.008092,,0.000415,"Jan  6, 2024 19:36:58.300661000 JST",,"6000  >  60030 [FIN, ACK] Seq=1 Ack=29 Win=65152 Len=0 TSval=3421110685 TSecr=962133678"
94,43.674766,192.168.11.39,192.168.11.38,TCP,66,0.000062,,0.000062,"Jan  6, 2024 19:36:58.300723000 JST",,60030  >  6000 [ACK] Seq=29 Ack=2 Win=64256 Len=0 TSval=962133686 TSecr=3421110685
95,43.706676,192.168.11.39,255.255.255.255,UDP,209,,Ÿ,0.03191,"Jan  6, 2024 19:36:58.332633000 JST",7b2273656d616e74696373223a207b22656e74697479223a2022504944222c202262617365656e74697479223a2022616e79222c2022726f6c65223a2022383838222c20227370617469616c223a2022616e79222c202274656d706f72616c223a2022616e79227d2c20226461746170726f7065727479223a207b22666f726d6174223a2022696e616f6b615f70726f6772616d5f73616d706c655f73656d616e746963227d7d,34345  >  7000 Len=167
96,43.715893,192.168.11.40,192.168.11.39,TCP,74,,œ,0.009217,"Jan  6, 2024 19:36:58.341850000 JST",,52412  >  6000 [SYN] Seq=0 Win=64240 Len=0 MSS=1460 SACK_PERM TSval=1105601555 TSecr=0 WS=128
97,43.716095,192.168.11.39,192.168.11.40,TCP,74,0.000202,,0.000202,"Jan  6, 2024 19:36:58.342052000 JST",,"6000  >  52412 [SYN, ACK] Seq=0 Ack=1 Win=65160 Len=0 MSS=1460 SACK_PERM TSval=1274281783 TSecr=1105601555 WS=128"
98,43.723597,192.168.11.40,192.168.11.39,TCP,66,0.007502,,0.007502,"Jan  6, 2024 19:36:58.349554000 JST",,52412  >  6000 [ACK] Seq=1 Ack=1 Win=64256 Len=0 TSval=1105601562 TSecr=1274281783
99,43.724617,192.168.11.40,192.168.11.39,TCP,93,,,0.00102,"Jan  6, 2024 19:36:58.350574000 JST",,"52412  >  6000 [PSH, ACK] Seq=1 Ack=1 Win=64256 Len=27 TSval=1105601563 TSecr=1274281783 [TCP segment of a reassembled PDU]"
100,43.724879,192.168.11.39,192.168.11.40,TCP,66,0.000262,,0.000262,"Jan  6, 2024 19:36:58.350836000 JST",,6000  >  52412 [ACK] Seq=1 Ack=28 Win=65152 Len=0 TSval=1274281792 TSecr=1105601563
101,43.725032,192.168.11.40,192.168.11.39,TCP,66,,,0.000153,"Jan  6, 2024 19:36:58.350989000 JST",,"52412  >  6000 [FIN, ACK] Seq=28 Ack=1 Win=64256 Len=0 TSval=1105601563 TSecr=1274281783"
102,43.727031,192.168.11.39,192.168.11.40,TCP,66,0.001999,,0.001999,"Jan  6, 2024 19:36:58.352988000 JST",,"6000  >  52412 [FIN, ACK] Seq=1 Ack=29 Win=65152 Len=0 TSval=1274281794 TSecr=1105601563"
103,43.733323,192.168.11.40,192.168.11.39,TCP,66,0.006292,,0.006292,"Jan  6, 2024 19:36:58.359280000 JST",,52412  >  6000 [ACK] Seq=29 Ack=2 Win=64256 Len=0 TSval=1105601571 TSecr=1274281794
104,51.512348,192.168.11.39,192.168.11.38,TCP,74,,,7.779025,"Jan  6, 2024 19:37:06.138305000 JST",,60036  >  6000 [SYN] Seq=0 Win=64240 Len=0 MSS=1460 SACK_PERM TSval=962141524 TSecr=0 WS=128
105,51.519663,192.168.11.38,192.168.11.39,TCP,74,0.007315,,0.007315,"Jan  6, 2024 19:37:06.145620000 JST",,"6000  >  60036 [SYN, ACK] Seq=0 Ack=1 Win=65160 Len=0 MSS=1460 SACK_PERM TSval=3421118529 TSecr=962141524 WS=128"
106,51.519762,192.168.11.39,192.168.11.38,TCP,66,0.000099,,0.000099,"Jan  6, 2024 19:37:06.145719000 JST",,60036  >  6000 [ACK] Seq=1 Ack=1 Win=64256 Len=0 TSval=962141531 TSecr=3421118529
107,51.519997,192.168.11.39,192.168.11.38,TCP,93,,,0.000235,"Jan  6, 2024 19:37:06.145954000 JST",,"60036  >  6000 [PSH, ACK] Seq=1 Ack=1 Win=64256 Len=27 TSval=962141531 TSecr=3421118529 [TCP segment of a reassembled PDU]"
108,51.520187,192.168.11.39,192.168.11.38,TCP,66,,,0.00019,"Jan  6, 2024 19:37:06.146144000 JST",,"60036  >  6000 [FIN, ACK] Seq=28 Ack=1 Win=64256 Len=0 TSval=962141532 TSecr=3421118529"
109,51.526979,192.168.11.38,192.168.11.39,TCP,66,0.006982,,0.006792,"Jan  6, 2024 19:37:06.152936000 JST",,6000  >  60036 [ACK] Seq=1 Ack=28 Win=65152 Len=0 TSval=3421118536 TSecr=962141531
110,51.527299,192.168.11.38,192.168.11.39,TCP,66,0.007112,,0.00032,"Jan  6, 2024 19:37:06.153256000 JST",,"6000  >  60036 [FIN, ACK] Seq=1 Ack=29 Win=65152 Len=0 TSval=3421118537 TSecr=962141532"
111,51.527348,192.168.11.39,192.168.11.38,TCP,66,0.000049,,0.000049,"Jan  6, 2024 19:37:06.153305000 JST",,60036  >  6000 [ACK] Seq=29 Ack=2 Win=64256 Len=0 TSval=962141539 TSecr=3421118537
112,51.558965,192.168.11.39,255.255.255.255,UDP,209,,Ÿ,0.031617,"Jan  6, 2024 19:37:06.184922000 JST",7b2273656d616e74696373223a207b22656e74697479223a2022504944222c202262617365656e74697479223a2022616e79222c2022726f6c65223a2022383838222c20227370617469616c223a2022616e79222c202274656d706f72616c223a2022616e79227d2c20226461746170726f7065727479223a207b22666f726d6174223a2022696e616f6b615f70726f6772616d5f73616d706c655f73656d616e746963227d7d,45930  >  7000 Len=167
113,51.566478,192.168.11.40,192.168.11.39,TCP,74,,œ,0.007513,"Jan  6, 2024 19:37:06.192435000 JST",,46202  >  6000 [SYN] Seq=0 Win=64240 Len=0 MSS=1460 SACK_PERM TSval=1105609405 TSecr=0 WS=128
114,51.566644,192.168.11.39,192.168.11.40,TCP,74,0.000166,,0.000166,"Jan  6, 2024 19:37:06.192601000 JST",,"6000  >  46202 [SYN, ACK] Seq=0 Ack=1 Win=65160 Len=0 MSS=1460 SACK_PERM TSval=1274289634 TSecr=1105609405 WS=128"
115,51.573321,192.168.11.40,192.168.11.39,TCP,66,0.006677,,0.006677,"Jan  6, 2024 19:37:06.199278000 JST",,46202  >  6000 [ACK] Seq=1 Ack=1 Win=64256 Len=0 TSval=1105609412 TSecr=1274289634
116,51.574047,192.168.11.40,192.168.11.39,TCP,93,,,0.000726,"Jan  6, 2024 19:37:06.200004000 JST",,"46202  >  6000 [PSH, ACK] Seq=1 Ack=1 Win=64256 Len=27 TSval=1105609412 TSecr=1274289634 [TCP segment of a reassembled PDU]"
117,51.574166,192.168.11.39,192.168.11.40,TCP,66,0.000119,,0.000119,"Jan  6, 2024 19:37:06.200123000 JST",,6000  >  46202 [ACK] Seq=1 Ack=28 Win=65152 Len=0 TSval=1274289642 TSecr=1105609412
118,51.574248,192.168.11.40,192.168.11.39,TCP,66,,,0.000082,"Jan  6, 2024 19:37:06.200205000 JST",,"46202  >  6000 [FIN, ACK] Seq=28 Ack=1 Win=64256 Len=0 TSval=1105609413 TSecr=1274289634"
119,51.576981,192.168.11.39,192.168.11.40,TCP,66,0.002733,,0.002733,"Jan  6, 2024 19:37:06.202938000 JST",,"6000  >  46202 [FIN, ACK] Seq=1 Ack=29 Win=65152 Len=0 TSval=1274289644 TSecr=1105609413"
120,51.784135,192.168.11.39,192.168.11.40,TCP,66,,,0.207154,"Jan  6, 2024 19:37:06.410092000 JST",,"[TCP Retransmission] 6000  >  46202 [FIN, ACK] Seq=1 Ack=29 Win=65152 Len=0 TSval=1274289852 TSecr=1105609413"
121,51.79185,192.168.11.40,192.168.11.39,TCP,66,0.214869,,0.007715,"Jan  6, 2024 19:37:06.417807000 JST",,46202  >  6000 [ACK] Seq=29 Ack=2 Win=64256 Len=0 TSval=1105609630 TSecr=1274289852
122,60.81964,192.168.11.39,192.168.11.38,TCP,74,,,9.02779,"Jan  6, 2024 19:37:15.445597000 JST",,51086  >  6000 [SYN] Seq=0 Win=64240 Len=0 MSS=1460 SACK_PERM TSval=962150831 TSecr=0 WS=128
123,60.826359,192.168.11.38,192.168.11.39,TCP,74,0.006719,,0.006719,"Jan  6, 2024 19:37:15.452316000 JST",,"6000  >  51086 [SYN, ACK] Seq=0 Ack=1 Win=65160 Len=0 MSS=1460 SACK_PERM TSval=3421127836 TSecr=962150831 WS=128"
124,60.826476,192.168.11.39,192.168.11.38,TCP,66,0.000117,,0.000117,"Jan  6, 2024 19:37:15.452433000 JST",,51086  >  6000 [ACK] Seq=1 Ack=1 Win=64256 Len=0 TSval=962150838 TSecr=3421127836
125,60.82666,192.168.11.39,192.168.11.38,TCP,93,,,0.000184,"Jan  6, 2024 19:37:15.452617000 JST",,"51086  >  6000 [PSH, ACK] Seq=1 Ack=1 Win=64256 Len=27 TSval=962150838 TSecr=3421127836 [TCP segment of a reassembled PDU]"
126,60.82677,192.168.11.39,192.168.11.38,TCP,66,,,0.00011,"Jan  6, 2024 19:37:15.452727000 JST",,"51086  >  6000 [FIN, ACK] Seq=28 Ack=1 Win=64256 Len=0 TSval=962150838 TSecr=3421127836"
127,60.834546,192.168.11.38,192.168.11.39,TCP,66,0.007886,,0.007776,"Jan  6, 2024 19:37:15.460503000 JST",,6000  >  51086 [ACK] Seq=1 Ack=28 Win=65152 Len=0 TSval=3421127843 TSecr=962150838
128,60.834777,192.168.11.38,192.168.11.39,TCP,66,0.008007,,0.000231,"Jan  6, 2024 19:37:15.460734000 JST",,"6000  >  51086 [FIN, ACK] Seq=1 Ack=29 Win=65152 Len=0 TSval=3421127845 TSecr=962150838"
129,60.834832,192.168.11.39,192.168.11.38,TCP,66,0.000055,,0.000055,"Jan  6, 2024 19:37:15.460789000 JST",,51086  >  6000 [ACK] Seq=29 Ack=2 Win=64256 Len=0 TSval=962150846 TSecr=3421127845
130,60.866897,192.168.11.39,255.255.255.255,UDP,209,,Ÿ,0.032065,"Jan  6, 2024 19:37:15.492854000 JST",7b2273656d616e74696373223a207b22656e74697479223a2022504944222c202262617365656e74697479223a2022616e79222c2022726f6c65223a2022383838222c20227370617469616c223a2022616e79222c202274656d706f72616c223a2022616e79227d2c20226461746170726f7065727479223a207b22666f726d6174223a2022696e616f6b615f70726f6772616d5f73616d706c655f73656d616e746963227d7d,41007  >  7000 Len=167
131,60.874943,192.168.11.40,192.168.11.39,TCP,74,,œ,0.008046,"Jan  6, 2024 19:37:15.500900000 JST",,33256  >  6000 [SYN] Seq=0 Win=64240 Len=0 MSS=1460 SACK_PERM TSval=1105618714 TSecr=0 WS=128
132,60.875097,192.168.11.39,192.168.11.40,TCP,74,0.000154,,0.000154,"Jan  6, 2024 19:37:15.501054000 JST",,"6000  >  33256 [SYN, ACK] Seq=0 Ack=1 Win=65160 Len=0 MSS=1460 SACK_PERM TSval=1274298943 TSecr=1105618714 WS=128"
133,60.882106,192.168.11.40,192.168.11.39,TCP,66,0.007009,,0.007009,"Jan  6, 2024 19:37:15.508063000 JST",,33256  >  6000 [ACK] Seq=1 Ack=1 Win=64256 Len=0 TSval=1105618721 TSecr=1274298943
134,60.882705,192.168.11.40,192.168.11.39,TCP,93,,,0.000599,"Jan  6, 2024 19:37:15.508662000 JST",,"33256  >  6000 [PSH, ACK] Seq=1 Ack=1 Win=64256 Len=27 TSval=1105618721 TSecr=1274298943 [TCP segment of a reassembled PDU]"
135,60.882814,192.168.11.39,192.168.11.40,TCP,66,0.000109,,0.000109,"Jan  6, 2024 19:37:15.508771000 JST",,6000  >  33256 [ACK] Seq=1 Ack=28 Win=65152 Len=0 TSval=1274298950 TSecr=1105618721
136,60.882884,192.168.11.40,192.168.11.39,TCP,66,,,0.00007,"Jan  6, 2024 19:37:15.508841000 JST",,"33256  >  6000 [FIN, ACK] Seq=28 Ack=1 Win=64256 Len=0 TSval=1105618721 TSecr=1274298943"
137,60.884921,192.168.11.39,192.168.11.40,TCP,66,0.002037,,0.002037,"Jan  6, 2024 19:37:15.510878000 JST",,"6000  >  33256 [FIN, ACK] Seq=1 Ack=29 Win=65152 Len=0 TSval=1274298952 TSecr=1105618721"
138,60.889823,192.168.11.40,192.168.11.39,TCP,66,0.004902,,0.004902,"Jan  6, 2024 19:37:15.515780000 JST",,33256  >  6000 [ACK] Seq=29 Ack=2 Win=64256 Len=0 TSval=1105618729 TSecr=1274298952
139,72.729075,192.168.11.39,192.168.11.38,TCP,74,,,11.839252,"Jan  6, 2024 19:37:27.355032000 JST",,46026  >  6000 [SYN] Seq=0 Win=64240 Len=0 MSS=1460 SACK_PERM TSval=962162740 TSecr=0 WS=128
140,72.736877,192.168.11.38,192.168.11.39,TCP,74,0.007802,,0.007802,"Jan  6, 2024 19:37:27.362834000 JST",,"6000  >  46026 [SYN, ACK] Seq=0 Ack=1 Win=65160 Len=0 MSS=1460 SACK_PERM TSval=3421139745 TSecr=962162740 WS=128"
141,72.736994,192.168.11.39,192.168.11.38,TCP,66,0.000117,,0.000117,"Jan  6, 2024 19:37:27.362951000 JST",,46026  >  6000 [ACK] Seq=1 Ack=1 Win=64256 Len=0 TSval=962162748 TSecr=3421139745
142,72.737265,192.168.11.39,192.168.11.38,TCP,93,,,0.000271,"Jan  6, 2024 19:37:27.363222000 JST",,"46026  >  6000 [PSH, ACK] Seq=1 Ack=1 Win=64256 Len=27 TSval=962162749 TSecr=3421139745 [TCP segment of a reassembled PDU]"
143,72.737373,192.168.11.39,192.168.11.38,TCP,66,,,0.000108,"Jan  6, 2024 19:37:27.363330000 JST",,"46026  >  6000 [FIN, ACK] Seq=28 Ack=1 Win=64256 Len=0 TSval=962162749 TSecr=3421139745"
144,72.747599,192.168.11.38,192.168.11.39,TCP,66,0.010334,,0.010226,"Jan  6, 2024 19:37:27.373556000 JST",,6000  >  46026 [ACK] Seq=1 Ack=28 Win=65152 Len=0 TSval=3421139754 TSecr=962162749
145,72.748748,192.168.11.38,192.168.11.39,TCP,66,0.011375,,0.001149,"Jan  6, 2024 19:37:27.374705000 JST",,"6000  >  46026 [FIN, ACK] Seq=1 Ack=29 Win=65152 Len=0 TSval=3421139756 TSecr=962162749"
146,72.748804,192.168.11.39,192.168.11.38,TCP,66,0.000056,,0.000056,"Jan  6, 2024 19:37:27.374761000 JST",,46026  >  6000 [ACK] Seq=29 Ack=2 Win=64256 Len=0 TSval=962162760 TSecr=3421139756
147,72.779822,192.168.11.39,255.255.255.255,UDP,209,,Ÿ,0.031018,"Jan  6, 2024 19:37:27.405779000 JST",7b2273656d616e74696373223a207b22656e74697479223a2022504944222c202262617365656e74697479223a2022616e79222c2022726f6c65223a2022383838222c20227370617469616c223a2022616e79222c202274656d706f72616c223a2022616e79227d2c20226461746170726f7065727479223a207b22666f726d6174223a2022696e616f6b615f70726f6772616d5f73616d706c655f73656d616e746963227d7d,33589  >  7000 Len=167
148,72.792058,192.168.11.40,192.168.11.39,TCP,74,,œ,0.012236,"Jan  6, 2024 19:37:27.418015000 JST",,53048  >  6000 [SYN] Seq=0 Win=64240 Len=0 MSS=1460 SACK_PERM TSval=1105630629 TSecr=0 WS=128
149,72.792208,192.168.11.39,192.168.11.40,TCP,74,0.00015,,0.00015,"Jan  6, 2024 19:37:27.418165000 JST",,"6000  >  53048 [SYN, ACK] Seq=0 Ack=1 Win=65160 Len=0 MSS=1460 SACK_PERM TSval=1274310860 TSecr=1105630629 WS=128"
150,72.79918,192.168.11.40,192.168.11.39,TCP,66,0.006972,,0.006972,"Jan  6, 2024 19:37:27.425137000 JST",,53048  >  6000 [ACK] Seq=1 Ack=1 Win=64256 Len=0 TSval=1105630638 TSecr=1274310860
151,72.799968,192.168.11.40,192.168.11.39,TCP,93,,,0.000788,"Jan  6, 2024 19:37:27.425925000 JST",,"53048  >  6000 [PSH, ACK] Seq=1 Ack=1 Win=64256 Len=27 TSval=1105630638 TSecr=1274310860 [TCP segment of a reassembled PDU]"
152,72.8001,192.168.11.39,192.168.11.40,TCP,66,0.000132,,0.000132,"Jan  6, 2024 19:37:27.426057000 JST",,6000  >  53048 [ACK] Seq=1 Ack=28 Win=65152 Len=0 TSval=1274310867 TSecr=1105630638
153,72.800274,192.168.11.40,192.168.11.39,TCP,66,,,0.000174,"Jan  6, 2024 19:37:27.426231000 JST",,"53048  >  6000 [FIN, ACK] Seq=28 Ack=1 Win=64256 Len=0 TSval=1105630639 TSecr=1274310860"
154,72.802275,192.168.11.39,192.168.11.40,TCP,66,0.002001,,0.002001,"Jan  6, 2024 19:37:27.428232000 JST",,"6000  >  53048 [FIN, ACK] Seq=1 Ack=29 Win=65152 Len=0 TSval=1274310870 TSecr=1105630639"
155,72.809809,192.168.11.40,192.168.11.39,TCP,66,0.007534,,0.007534,"Jan  6, 2024 19:37:27.435766000 JST",,53048  >  6000 [ACK] Seq=29 Ack=2 Win=64256 Len=0 TSval=1105630648 TSecr=1274310870
156,80.613431,192.168.11.39,192.168.11.38,TCP,74,,,7.803622,"Jan  6, 2024 19:37:35.239388000 JST",,50112  >  6000 [SYN] Seq=0 Win=64240 Len=0 MSS=1460 SACK_PERM TSval=962170625 TSecr=0 WS=128
157,80.620086,192.168.11.38,192.168.11.39,TCP,74,0.006655,,0.006655,"Jan  6, 2024 19:37:35.246043000 JST",,"6000  >  50112 [SYN, ACK] Seq=0 Ack=1 Win=65160 Len=0 MSS=1460 SACK_PERM TSval=3421147629 TSecr=962170625 WS=128"
158,80.620197,192.168.11.39,192.168.11.38,TCP,66,0.000111,,0.000111,"Jan  6, 2024 19:37:35.246154000 JST",,50112  >  6000 [ACK] Seq=1 Ack=1 Win=64256 Len=0 TSval=962170632 TSecr=3421147629
159,80.620378,192.168.11.39,192.168.11.38,TCP,93,,,0.000181,"Jan  6, 2024 19:37:35.246335000 JST",,"50112  >  6000 [PSH, ACK] Seq=1 Ack=1 Win=64256 Len=27 TSval=962170632 TSecr=3421147629 [TCP segment of a reassembled PDU]"
160,80.620504,192.168.11.39,192.168.11.38,TCP,66,,,0.000126,"Jan  6, 2024 19:37:35.246461000 JST",,"50112  >  6000 [FIN, ACK] Seq=28 Ack=1 Win=64256 Len=0 TSval=962170632 TSecr=3421147629"
161,80.627585,192.168.11.38,192.168.11.39,TCP,66,0.007207,,0.007081,"Jan  6, 2024 19:37:35.253542000 JST",,6000  >  50112 [ACK] Seq=1 Ack=28 Win=65152 Len=0 TSval=3421147637 TSecr=962170632
162,80.627963,192.168.11.38,192.168.11.39,TCP,66,0.007459,,0.000378,"Jan  6, 2024 19:37:35.253920000 JST",,"6000  >  50112 [FIN, ACK] Seq=1 Ack=29 Win=65152 Len=0 TSval=3421147638 TSecr=962170632"
163,80.62802,192.168.11.39,192.168.11.38,TCP,66,0.000057,,0.000057,"Jan  6, 2024 19:37:35.253977000 JST",,50112  >  6000 [ACK] Seq=29 Ack=2 Win=64256 Len=0 TSval=962170639 TSecr=3421147638
164,80.65857,192.168.11.39,255.255.255.255,UDP,209,,Ÿ,0.03055,"Jan  6, 2024 19:37:35.284527000 JST",7b2273656d616e74696373223a207b22656e74697479223a2022504944222c202262617365656e74697479223a2022616e79222c2022726f6c65223a2022383838222c20227370617469616c223a2022616e79222c202274656d706f72616c223a2022616e79227d2c20226461746170726f7065727479223a207b22666f726d6174223a2022696e616f6b615f70726f6772616d5f73616d706c655f73656d616e746963227d7d,54909  >  7000 Len=167
165,81.659951,192.168.11.39,255.255.255.255,UDP,209,,œ,1.001381,"Jan  6, 2024 19:37:36.285908000 JST",7b2273656d616e74696373223a207b22656e74697479223a2022504944222c202262617365656e74697479223a2022616e79222c2022726f6c65223a2022383838222c20227370617469616c223a2022616e79222c202274656d706f72616c223a2022616e79227d2c20226461746170726f7065727479223a207b22666f726d6174223a2022696e616f6b615f70726f6772616d5f73616d706c655f73656d616e746963227d7d,54909  >  7000 Len=167
166,81.668317,192.168.11.40,192.168.11.39,TCP,74,,œ,0.008366,"Jan  6, 2024 19:37:36.294274000 JST",,46528  >  6000 [SYN] Seq=0 Win=64240 Len=0 MSS=1460 SACK_PERM TSval=1105639507 TSecr=0 WS=128
167,81.668446,192.168.11.39,192.168.11.40,TCP,74,0.000129,,0.000129,"Jan  6, 2024 19:37:36.294403000 JST",,"6000  >  46528 [SYN, ACK] Seq=0 Ack=1 Win=65160 Len=0 MSS=1460 SACK_PERM TSval=1274319736 TSecr=1105639507 WS=128"
168,81.675311,192.168.11.40,192.168.11.39,TCP,66,0.006865,,0.006865,"Jan  6, 2024 19:37:36.301268000 JST",,46528  >  6000 [ACK] Seq=1 Ack=1 Win=64256 Len=0 TSval=1105639515 TSecr=1274319736
169,81.675909,192.168.11.40,192.168.11.39,TCP,93,,,0.000598,"Jan  6, 2024 19:37:36.301866000 JST",,"46528  >  6000 [PSH, ACK] Seq=1 Ack=1 Win=64256 Len=27 TSval=1105639515 TSecr=1274319736 [TCP segment of a reassembled PDU]"
170,81.676006,192.168.11.39,192.168.11.40,TCP,66,0.000097,,0.000097,"Jan  6, 2024 19:37:36.301963000 JST",,6000  >  46528 [ACK] Seq=1 Ack=28 Win=65152 Len=0 TSval=1274319743 TSecr=1105639515
171,81.676206,192.168.11.40,192.168.11.39,TCP,66,,,0.0002,"Jan  6, 2024 19:37:36.302163000 JST",,"46528  >  6000 [FIN, ACK] Seq=28 Ack=1 Win=64256 Len=0 TSval=1105639515 TSecr=1274319736"
172,81.677413,192.168.11.39,192.168.11.40,TCP,66,0.001207,,0.001207,"Jan  6, 2024 19:37:36.303370000 JST",,"6000  >  46528 [FIN, ACK] Seq=1 Ack=29 Win=65152 Len=0 TSval=1274319745 TSecr=1105639515"
173,81.683357,192.168.11.40,192.168.11.39,TCP,66,0.005944,,0.005944,"Jan  6, 2024 19:37:36.309314000 JST",,46528  >  6000 [ACK] Seq=29 Ack=2 Win=64256 Len=0 TSval=1105639522 TSecr=1274319745
174,112.834956,192.168.11.39,192.168.11.38,TCP,74,,,31.151599,"Jan  6, 2024 19:38:07.460913000 JST",,54758  >  6000 [SYN] Seq=0 Win=64240 Len=0 MSS=1460 SACK_PERM TSval=962202846 TSecr=0 WS=128
175,112.84158,192.168.11.38,192.168.11.39,TCP,74,0.006624,,0.006624,"Jan  6, 2024 19:38:07.467537000 JST",,"6000  >  54758 [SYN, ACK] Seq=0 Ack=1 Win=65160 Len=0 MSS=1460 SACK_PERM TSval=3421179851 TSecr=962202846 WS=128"
176,112.841688,192.168.11.39,192.168.11.38,TCP,66,0.000108,,0.000108,"Jan  6, 2024 19:38:07.467645000 JST",,54758  >  6000 [ACK] Seq=1 Ack=1 Win=64256 Len=0 TSval=962202853 TSecr=3421179851
177,112.841859,192.168.11.39,192.168.11.38,TCP,93,,,0.000171,"Jan  6, 2024 19:38:07.467816000 JST",,"54758  >  6000 [PSH, ACK] Seq=1 Ack=1 Win=64256 Len=27 TSval=962202853 TSecr=3421179851 [TCP segment of a reassembled PDU]"
178,112.841964,192.168.11.39,192.168.11.38,TCP,66,,,0.000105,"Jan  6, 2024 19:38:07.467921000 JST",,"54758  >  6000 [FIN, ACK] Seq=28 Ack=1 Win=64256 Len=0 TSval=962202853 TSecr=3421179851"
179,112.849344,192.168.11.38,192.168.11.39,TCP,66,0.007485,,0.00738,"Jan  6, 2024 19:38:07.475301000 JST",,6000  >  54758 [ACK] Seq=1 Ack=28 Win=65152 Len=0 TSval=3421179859 TSecr=962202853
180,112.84956,192.168.11.38,192.168.11.39,TCP,66,0.007596,,0.000216,"Jan  6, 2024 19:38:07.475517000 JST",,"6000  >  54758 [FIN, ACK] Seq=1 Ack=29 Win=65152 Len=0 TSval=3421179860 TSecr=962202853"
181,112.849605,192.168.11.39,192.168.11.38,TCP,66,0.000045,,0.000045,"Jan  6, 2024 19:38:07.475562000 JST",,54758  >  6000 [ACK] Seq=29 Ack=2 Win=64256 Len=0 TSval=962202861 TSecr=3421179860
182,112.881912,192.168.11.39,255.255.255.255,UDP,209,,Ÿ,0.032307,"Jan  6, 2024 19:38:07.507869000 JST",7b2273656d616e74696373223a207b22656e74697479223a2022504944222c202262617365656e74697479223a2022616e79222c2022726f6c65223a2022383838222c20227370617469616c223a2022616e79222c202274656d706f72616c223a2022616e79227d2c20226461746170726f7065727479223a207b22666f726d6174223a2022696e616f6b615f70726f6772616d5f73616d706c655f73656d616e746963227d7d,59409  >  7000 Len=167
183,112.892759,192.168.11.40,192.168.11.39,TCP,74,,œ,0.010847,"Jan  6, 2024 19:38:07.518716000 JST",,57718  >  6000 [SYN] Seq=0 Win=64240 Len=0 MSS=1460 SACK_PERM TSval=1105670732 TSecr=0 WS=128
