No.,Time,Source,Destination,Protocol,Length,The RTT to ACK the segment was,XXX,Time delta from previous captured frame,Arrival Time,Data,Info
1,0,192.168.11.40,192.168.11.39,TCP,74,,,0,"Jan  6, 2024 19:36:16.098833000 JST",,58370  >  6000 [SYN] Seq=0 Win=64240 Len=0 MSS=1460 SACK_PERM TSval=1105557892 TSecr=0 WS=128
2,0.006773,192.168.11.39,192.168.11.40,TCP,74,0.006773,,0.006773,"Jan  6, 2024 19:36:16.105606000 JST",,"6000  >  58370 [SYN, ACK] Seq=0 Ack=1 Win=65160 Len=0 MSS=1460 SACK_PERM TSval=1274238125 TSecr=1105557892 WS=128"
3,0.006878,192.168.11.40,192.168.11.39,TCP,66,0.000105,,0.000105,"Jan  6, 2024 19:36:16.105711000 JST",,58370  >  6000 [ACK] Seq=1 Ack=1 Win=64256 Len=0 TSval=1105557903 TSecr=1274238125
4,0.007041,192.168.11.40,192.168.11.39,TCP,93,,,0.000163,"Jan  6, 2024 19:36:16.105874000 JST",,"58370  >  6000 [PSH, ACK] Seq=1 Ack=1 Win=64256 Len=27 TSval=1105557903 TSecr=1274238125 [TCP segment of a reassembled PDU]"
5,0.007179,192.168.11.40,192.168.11.39,TCP,66,,,0.000138,"Jan  6, 2024 19:36:16.106012000 JST",,"58370  >  6000 [FIN, ACK] Seq=28 Ack=1 Win=64256 Len=0 TSval=1105557903 TSecr=1274238125"
6,0.014419,192.168.11.39,192.168.11.40,TCP,66,0.007378,,0.00724,"Jan  6, 2024 19:36:16.113252000 JST",,6000  >  58370 [ACK] Seq=1 Ack=28 Win=65152 Len=0 TSval=1274238133 TSecr=1105557903
7,0.014628,192.168.11.39,192.168.11.40,TCP,66,0.007449,,0.000209,"Jan  6, 2024 19:36:16.113461000 JST",,"6000  >  58370 [FIN, ACK] Seq=1 Ack=29 Win=65152 Len=0 TSval=1274238134 TSecr=1105557903"
8,0.014669,192.168.11.40,192.168.11.39,TCP,66,0.000041,,0.000041,"Jan  6, 2024 19:36:16.113502000 JST",,58370  >  6000 [ACK] Seq=29 Ack=2 Win=64256 Len=0 TSval=1105557911 TSecr=1274238134
9,0.044459,192.168.11.40,255.255.255.255,UDP,209,,Ÿ,0.02979,"Jan  6, 2024 19:36:16.143292000 JST",7b2273656d616e74696373223a207b22656e74697479223a2022504944222c202262617365656e74697479223a2022616e79222c2022726f6c65223a2022393939222c20227370617469616c223a2022616e79222c202274656d706f72616c223a2022616e79227d2c20226461746170726f7065727479223a207b22666f726d6174223a2022696e616f6b615f70726f6772616d5f73616d706c655f73656d616e746963227d7d,50358  >  7000 Len=167
10,0.05955,192.168.11.41,192.168.11.40,TCP,74,,œ,0.015091,"Jan  6, 2024 19:36:16.158383000 JST",,35434  >  6000 [SYN] Seq=0 Win=64240 Len=0 MSS=1460 SACK_PERM TSval=2564573123 TSecr=0 WS=128
11,0.059695,192.168.11.40,192.168.11.41,TCP,74,0.000145,,0.000145,"Jan  6, 2024 19:36:16.158528000 JST",,"6000  >  35434 [SYN, ACK] Seq=0 Ack=1 Win=65160 Len=0 MSS=1460 SACK_PERM TSval=104415868 TSecr=2564573123 WS=128"
12,0.066671,192.168.11.41,192.168.11.40,TCP,66,0.006976,,0.006976,"Jan  6, 2024 19:36:16.165504000 JST",,35434  >  6000 [ACK] Seq=1 Ack=1 Win=64256 Len=0 TSval=2564573137 TSecr=104415868
13,0.067193,192.168.11.41,192.168.11.40,TCP,93,,,0.000522,"Jan  6, 2024 19:36:16.166026000 JST",,"35434  >  6000 [PSH, ACK] Seq=1 Ack=1 Win=64256 Len=27 TSval=2564573137 TSecr=104415868 [TCP segment of a reassembled PDU]"
14,0.067275,192.168.11.40,192.168.11.41,TCP,66,0.000082,,0.000082,"Jan  6, 2024 19:36:16.166108000 JST",,6000  >  35434 [ACK] Seq=1 Ack=28 Win=65152 Len=0 TSval=104415875 TSecr=2564573137
15,0.067344,192.168.11.41,192.168.11.40,TCP,66,,,0.000069,"Jan  6, 2024 19:36:16.166177000 JST",,"35434  >  6000 [FIN, ACK] Seq=28 Ack=1 Win=64256 Len=0 TSval=2564573138 TSecr=104415868"
16,0.069334,192.168.11.40,192.168.11.41,TCP,66,0.00199,,0.00199,"Jan  6, 2024 19:36:16.168167000 JST",,"6000  >  35434 [FIN, ACK] Seq=1 Ack=29 Win=65152 Len=0 TSval=104415877 TSecr=2564573138"
17,0.07428,192.168.11.41,192.168.11.40,TCP,66,0.004946,,0.004946,"Jan  6, 2024 19:36:16.173113000 JST",,35434  >  6000 [ACK] Seq=29 Ack=2 Win=64256 Len=0 TSval=2564573145 TSecr=104415877
18,8.244127,192.168.11.40,192.168.11.39,TCP,74,,,8.169847,"Jan  6, 2024 19:36:24.342960000 JST",,38588  >  6000 [SYN] Seq=0 Win=64240 Len=0 MSS=1460 SACK_PERM TSval=1105566140 TSecr=0 WS=128
19,8.250705,192.168.11.39,192.168.11.40,TCP,74,0.006578,,0.006578,"Jan  6, 2024 19:36:24.349538000 JST",,"6000  >  38588 [SYN, ACK] Seq=0 Ack=1 Win=65160 Len=0 MSS=1460 SACK_PERM TSval=1274246369 TSecr=1105566140 WS=128"
20,8.250797,192.168.11.40,192.168.11.39,TCP,66,0.000092,,0.000092,"Jan  6, 2024 19:36:24.349630000 JST",,38588  >  6000 [ACK] Seq=1 Ack=1 Win=64256 Len=0 TSval=1105566147 TSecr=1274246369
21,8.250992,192.168.11.40,192.168.11.39,TCP,93,,,0.000195,"Jan  6, 2024 19:36:24.349825000 JST",,"38588  >  6000 [PSH, ACK] Seq=1 Ack=1 Win=64256 Len=27 TSval=1105566147 TSecr=1274246369 [TCP segment of a reassembled PDU]"
22,8.251108,192.168.11.40,192.168.11.39,TCP,66,,,0.000116,"Jan  6, 2024 19:36:24.349941000 JST",,"38588  >  6000 [FIN, ACK] Seq=28 Ack=1 Win=64256 Len=0 TSval=1105566147 TSecr=1274246369"
23,8.260064,192.168.11.39,192.168.11.40,TCP,66,0.009072,,0.008956,"Jan  6, 2024 19:36:24.358897000 JST",,6000  >  38588 [ACK] Seq=1 Ack=28 Win=65152 Len=0 TSval=1274246376 TSecr=1105566147
24,8.260445,192.168.11.39,192.168.11.40,TCP,66,0.009337,,0.000381,"Jan  6, 2024 19:36:24.359278000 JST",,"6000  >  38588 [FIN, ACK] Seq=1 Ack=29 Win=65152 Len=0 TSval=1274246377 TSecr=1105566147"
25,8.260492,192.168.11.40,192.168.11.39,TCP,66,0.000047,,0.000047,"Jan  6, 2024 19:36:24.359325000 JST",,38588  >  6000 [ACK] Seq=29 Ack=2 Win=64256 Len=0 TSval=1105566157 TSecr=1274246377
26,8.293038,192.168.11.40,255.255.255.255,UDP,209,,Ÿ,0.032546,"Jan  6, 2024 19:36:24.391871000 JST",7b2273656d616e74696373223a207b22656e74697479223a2022504944222c202262617365656e74697479223a2022616e79222c2022726f6c65223a2022393939222c20227370617469616c223a2022616e79222c202274656d706f72616c223a2022616e79227d2c20226461746170726f7065727479223a207b22666f726d6174223a2022696e616f6b615f70726f6772616d5f73616d706c655f73656d616e746963227d7d,55645  >  7000 Len=167
27,8.300571,192.168.11.41,192.168.11.40,TCP,74,,œ,0.007533,"Jan  6, 2024 19:36:24.399404000 JST",,52120  >  6000 [SYN] Seq=0 Win=64240 Len=0 MSS=1460 SACK_PERM TSval=2564581371 TSecr=0 WS=128
28,8.300694,192.168.11.40,192.168.11.41,TCP,74,0.000123,,0.000123,"Jan  6, 2024 19:36:24.399527000 JST",,"6000  >  52120 [SYN, ACK] Seq=0 Ack=1 Win=65160 Len=0 MSS=1460 SACK_PERM TSval=104424109 TSecr=2564581371 WS=128"
29,8.308708,192.168.11.41,192.168.11.40,TCP,66,0.008014,,0.008014,"Jan  6, 2024 19:36:24.407541000 JST",,52120  >  6000 [ACK] Seq=1 Ack=1 Win=64256 Len=0 TSval=2564581378 TSecr=104424109
30,8.309266,192.168.11.41,192.168.11.40,TCP,93,,,0.000558,"Jan  6, 2024 19:36:24.408099000 JST",,"52120  >  6000 [PSH, ACK] Seq=1 Ack=1 Win=64256 Len=27 TSval=2564581378 TSecr=104424109 [TCP segment of a reassembled PDU]"
31,8.309353,192.168.11.40,192.168.11.41,TCP,66,0.000087,,0.000087,"Jan  6, 2024 19:36:24.408186000 JST",,6000  >  52120 [ACK] Seq=1 Ack=28 Win=65152 Len=0 TSval=104424117 TSecr=2564581378
32,8.30942,192.168.11.41,192.168.11.40,TCP,66,,,0.000067,"Jan  6, 2024 19:36:24.408253000 JST",,"52120  >  6000 [FIN, ACK] Seq=28 Ack=1 Win=64256 Len=0 TSval=2564581378 TSecr=104424109"
33,8.310557,192.168.11.40,192.168.11.41,TCP,66,0.001137,,0.001137,"Jan  6, 2024 19:36:24.409390000 JST",,"6000  >  52120 [FIN, ACK] Seq=1 Ack=29 Win=65152 Len=0 TSval=104424119 TSecr=2564581378"
34,8.320611,192.168.11.41,192.168.11.40,TCP,66,0.010054,,0.010054,"Jan  6, 2024 19:36:24.419444000 JST",,52120  >  6000 [ACK] Seq=29 Ack=2 Win=64256 Len=0 TSval=2564581391 TSecr=104424119
35,19.115841,192.168.11.40,192.168.11.39,TCP,74,,,10.79523,"Jan  6, 2024 19:36:35.214674000 JST",,57712  >  6000 [SYN] Seq=0 Win=64240 Len=0 MSS=1460 SACK_PERM TSval=1105577012 TSecr=0 WS=128
36,19.122623,192.168.11.39,192.168.11.40,TCP,74,0.006782,,0.006782,"Jan  6, 2024 19:36:35.221456000 JST",,"6000  >  57712 [SYN, ACK] Seq=0 Ack=1 Win=65160 Len=0 MSS=1460 SACK_PERM TSval=1274257241 TSecr=1105577012 WS=128"
37,19.122721,192.168.11.40,192.168.11.39,TCP,66,0.000098,,0.000098,"Jan  6, 2024 19:36:35.221554000 JST",,57712  >  6000 [ACK] Seq=1 Ack=1 Win=64256 Len=0 TSval=1105577019 TSecr=1274257241
38,19.122952,192.168.11.40,192.168.11.39,TCP,93,,,0.000231,"Jan  6, 2024 19:36:35.221785000 JST",,"57712  >  6000 [PSH, ACK] Seq=1 Ack=1 Win=64256 Len=27 TSval=1105577019 TSecr=1274257241 [TCP segment of a reassembled PDU]"
39,19.123059,192.168.11.40,192.168.11.39,TCP,66,,,0.000107,"Jan  6, 2024 19:36:35.221892000 JST",,"57712  >  6000 [FIN, ACK] Seq=28 Ack=1 Win=64256 Len=0 TSval=1105577019 TSecr=1274257241"
40,19.130296,192.168.11.39,192.168.11.40,TCP,66,0.007344,,0.007237,"Jan  6, 2024 19:36:35.229129000 JST",,6000  >  57712 [ACK] Seq=1 Ack=28 Win=65152 Len=0 TSval=1274257248 TSecr=1105577019
41,19.130667,192.168.11.39,192.168.11.40,TCP,66,0.007608,,0.000371,"Jan  6, 2024 19:36:35.229500000 JST",,"6000  >  57712 [FIN, ACK] Seq=1 Ack=29 Win=65152 Len=0 TSval=1274257249 TSecr=1105577019"
42,19.130714,192.168.11.40,192.168.11.39,TCP,66,0.000047,,0.000047,"Jan  6, 2024 19:36:35.229547000 JST",,57712  >  6000 [ACK] Seq=29 Ack=2 Win=64256 Len=0 TSval=1105577027 TSecr=1274257249
43,19.160763,192.168.11.40,255.255.255.255,UDP,209,,Ÿ,0.030049,"Jan  6, 2024 19:36:35.259596000 JST",7b2273656d616e74696373223a207b22656e74697479223a2022504944222c202262617365656e74697479223a2022616e79222c2022726f6c65223a2022393939222c20227370617469616c223a2022616e79222c202274656d706f72616c223a2022616e79227d2c20226461746170726f7065727479223a207b22666f726d6174223a2022696e616f6b615f70726f6772616d5f73616d706c655f73656d616e746963227d7d,53740  >  7000 Len=167
44,19.170298,192.168.11.41,192.168.11.40,TCP,74,,œ,0.009535,"Jan  6, 2024 19:36:35.269131000 JST",,57528  >  6000 [SYN] Seq=0 Win=64240 Len=0 MSS=1460 SACK_PERM TSval=2564592239 TSecr=0 WS=128
45,19.170423,192.168.11.40,192.168.11.41,TCP,74,0.000125,,0.000125,"Jan  6, 2024 19:36:35.269256000 JST",,"6000  >  57528 [SYN, ACK] Seq=0 Ack=1 Win=65160 Len=0 MSS=1460 SACK_PERM TSval=104434978 TSecr=2564592239 WS=128"
46,19.177464,192.168.11.41,192.168.11.40,TCP,66,0.007041,,0.007041,"Jan  6, 2024 19:36:35.276297000 JST",,57528  >  6000 [ACK] Seq=1 Ack=1 Win=64256 Len=0 TSval=2564592248 TSecr=104434978
47,19.177958,192.168.11.41,192.168.11.40,TCP,93,,,0.000494,"Jan  6, 2024 19:36:35.276791000 JST",,"57528  >  6000 [PSH, ACK] Seq=1 Ack=1 Win=64256 Len=27 TSval=2564592248 TSecr=104434978 [TCP segment of a reassembled PDU]"
48,19.178003,192.168.11.40,192.168.11.41,TCP,66,0.000045,,0.000045,"Jan  6, 2024 19:36:35.276836000 JST",,6000  >  57528 [ACK] Seq=1 Ack=28 Win=65152 Len=0 TSval=104434986 TSecr=2564592248
49,19.178068,192.168.11.41,192.168.11.40,TCP,66,,,0.000065,"Jan  6, 2024 19:36:35.276901000 JST",,"57528  >  6000 [FIN, ACK] Seq=28 Ack=1 Win=64256 Len=0 TSval=2564592248 TSecr=104434978"
50,19.179591,192.168.11.40,192.168.11.41,TCP,66,0.001523,,0.001523,"Jan  6, 2024 19:36:35.278424000 JST",,"6000  >  57528 [FIN, ACK] Seq=1 Ack=29 Win=65152 Len=0 TSval=104434988 TSecr=2564592248"
51,19.185093,192.168.11.41,192.168.11.40,TCP,66,0.005502,,0.005502,"Jan  6, 2024 19:36:35.283926000 JST",,57528  >  6000 [ACK] Seq=29 Ack=2 Win=64256 Len=0 TSval=2564592256 TSecr=104434988
52,28.024926,192.168.11.40,192.168.11.39,TCP,74,,,8.839833,"Jan  6, 2024 19:36:44.123759000 JST",,49196  >  6000 [SYN] Seq=0 Win=64240 Len=0 MSS=1460 SACK_PERM TSval=1105585921 TSecr=0 WS=128
53,28.031741,192.168.11.39,192.168.11.40,TCP,74,0.006815,,0.006815,"Jan  6, 2024 19:36:44.130574000 JST",,"6000  >  49196 [SYN, ACK] Seq=0 Ack=1 Win=65160 Len=0 MSS=1460 SACK_PERM TSval=1274266150 TSecr=1105585921 WS=128"
54,28.03184,192.168.11.40,192.168.11.39,TCP,66,0.000099,,0.000099,"Jan  6, 2024 19:36:44.130673000 JST",,49196  >  6000 [ACK] Seq=1 Ack=1 Win=64256 Len=0 TSval=1105585928 TSecr=1274266150
55,28.032012,192.168.11.40,192.168.11.39,TCP,93,,,0.000172,"Jan  6, 2024 19:36:44.130845000 JST",,"49196  >  6000 [PSH, ACK] Seq=1 Ack=1 Win=64256 Len=27 TSval=1105585928 TSecr=1274266150 [TCP segment of a reassembled PDU]"
56,28.0321,192.168.11.40,192.168.11.39,TCP,66,,,0.000088,"Jan  6, 2024 19:36:44.130933000 JST",,"49196  >  6000 [FIN, ACK] Seq=28 Ack=1 Win=64256 Len=0 TSval=1105585928 TSecr=1274266150"
57,28.039523,192.168.11.39,192.168.11.40,TCP,66,0.007511,,0.007423,"Jan  6, 2024 19:36:44.138356000 JST",,6000  >  49196 [ACK] Seq=1 Ack=28 Win=65152 Len=0 TSval=1274266157 TSecr=1105585928
58,28.039914,192.168.11.39,192.168.11.40,TCP,66,0.007814,,0.000391,"Jan  6, 2024 19:36:44.138747000 JST",,"6000  >  49196 [FIN, ACK] Seq=1 Ack=29 Win=65152 Len=0 TSval=1274266159 TSecr=1105585928"
59,28.039966,192.168.11.40,192.168.11.39,TCP,66,0.000052,,0.000052,"Jan  6, 2024 19:36:44.138799000 JST",,49196  >  6000 [ACK] Seq=29 Ack=2 Win=64256 Len=0 TSval=1105585936 TSecr=1274266159
60,28.070634,192.168.11.40,255.255.255.255,UDP,209,,Ÿ,0.030668,"Jan  6, 2024 19:36:44.169467000 JST",7b2273656d616e74696373223a207b22656e74697479223a2022504944222c202262617365656e74697479223a2022616e79222c2022726f6c65223a2022393939222c20227370617469616c223a2022616e79222c202274656d706f72616c223a2022616e79227d2c20226461746170726f7065727479223a207b22666f726d6174223a2022696e616f6b615f70726f6772616d5f73616d706c655f73656d616e746963227d7d,46426  >  7000 Len=167
61,28.079139,192.168.11.41,192.168.11.40,TCP,74,,œ,0.008505,"Jan  6, 2024 19:36:44.177972000 JST",,49794  >  6000 [SYN] Seq=0 Win=64240 Len=0 MSS=1460 SACK_PERM TSval=2564601149 TSecr=0 WS=128
62,28.079272,192.168.11.40,192.168.11.41,TCP,74,0.000133,,0.000133,"Jan  6, 2024 19:36:44.178105000 JST",,"6000  >  49794 [SYN, ACK] Seq=0 Ack=1 Win=65160 Len=0 MSS=1460 SACK_PERM TSval=104443887 TSecr=2564601149 WS=128"
63,28.086208,192.168.11.41,192.168.11.40,TCP,66,0.006936,,0.006936,"Jan  6, 2024 19:36:44.185041000 JST",,49794  >  6000 [ACK] Seq=1 Ack=1 Win=64256 Len=0 TSval=2564601157 TSecr=104443887
64,28.086796,192.168.11.41,192.168.11.40,TCP,93,,,0.000588,"Jan  6, 2024 19:36:44.185629000 JST",,"49794  >  6000 [PSH, ACK] Seq=1 Ack=1 Win=64256 Len=27 TSval=2564601157 TSecr=104443887 [TCP segment of a reassembled PDU]"
65,28.086906,192.168.11.40,192.168.11.41,TCP,66,0.00011,,0.00011,"Jan  6, 2024 19:36:44.185739000 JST",,6000  >  49794 [ACK] Seq=1 Ack=28 Win=65152 Len=0 TSval=104443895 TSecr=2564601157
66,28.086985,192.168.11.41,192.168.11.40,TCP,66,,,0.000079,"Jan  6, 2024 19:36:44.185818000 JST",,"49794  >  6000 [FIN, ACK] Seq=28 Ack=1 Win=64256 Len=0 TSval=2564601157 TSecr=104443887"
67,28.088296,192.168.11.40,192.168.11.41,TCP,66,0.001311,,0.001311,"Jan  6, 2024 19:36:44.187129000 JST",,"6000  >  49794 [FIN, ACK] Seq=1 Ack=29 Win=65152 Len=0 TSval=104443896 TSecr=2564601157"
68,28.09433,192.168.11.41,192.168.11.40,TCP,66,0.006034,,0.006034,"Jan  6, 2024 19:36:44.193163000 JST",,49794  >  6000 [ACK] Seq=29 Ack=2 Win=64256 Len=0 TSval=2564601165 TSecr=104443896
69,35.835405,192.168.11.40,192.168.11.39,TCP,74,,,7.741075,"Jan  6, 2024 19:36:51.934238000 JST",,52402  >  6000 [SYN] Seq=0 Win=64240 Len=0 MSS=1460 SACK_PERM TSval=1105593731 TSecr=0 WS=128
70,35.842023,192.168.11.39,192.168.11.40,TCP,74,0.006618,,0.006618,"Jan  6, 2024 19:36:51.940856000 JST",,"6000  >  52402 [SYN, ACK] Seq=0 Ack=1 Win=65160 Len=0 MSS=1460 SACK_PERM TSval=1274273960 TSecr=1105593731 WS=128"
71,35.842131,192.168.11.40,192.168.11.39,TCP,66,0.000108,,0.000108,"Jan  6, 2024 19:36:51.940964000 JST",,52402  >  6000 [ACK] Seq=1 Ack=1 Win=64256 Len=0 TSval=1105593738 TSecr=1274273960
72,35.842294,192.168.11.40,192.168.11.39,TCP,93,,,0.000163,"Jan  6, 2024 19:36:51.941127000 JST",,"52402  >  6000 [PSH, ACK] Seq=1 Ack=1 Win=64256 Len=27 TSval=1105593738 TSecr=1274273960 [TCP segment of a reassembled PDU]"
73,35.842394,192.168.11.40,192.168.11.39,TCP,66,,,0.0001,"Jan  6, 2024 19:36:51.941227000 JST",,"52402  >  6000 [FIN, ACK] Seq=28 Ack=1 Win=64256 Len=0 TSval=1105593738 TSecr=1274273960"
74,35.849578,192.168.11.39,192.168.11.40,TCP,66,0.007284,,0.007184,"Jan  6, 2024 19:36:51.948411000 JST",,6000  >  52402 [ACK] Seq=1 Ack=28 Win=65152 Len=0 TSval=1274273967 TSecr=1105593738
75,35.849795,192.168.11.39,192.168.11.40,TCP,66,0.007401,,0.000217,"Jan  6, 2024 19:36:51.948628000 JST",,"6000  >  52402 [FIN, ACK] Seq=1 Ack=29 Win=65152 Len=0 TSval=1274273969 TSecr=1105593738"
76,35.849846,192.168.11.40,192.168.11.39,TCP,66,0.000051,,0.000051,"Jan  6, 2024 19:36:51.948679000 JST",,52402  >  6000 [ACK] Seq=29 Ack=2 Win=64256 Len=0 TSval=1105593746 TSecr=1274273969
77,35.88322,192.168.11.40,255.255.255.255,UDP,209,,Ÿ,0.033374,"Jan  6, 2024 19:36:51.982053000 JST",7b2273656d616e74696373223a207b22656e74697479223a2022504944222c202262617365656e74697479223a2022616e79222c2022726f6c65223a2022393939222c20227370617469616c223a2022616e79222c202274656d706f72616c223a2022616e79227d2c20226461746170726f7065727479223a207b22666f726d6174223a2022696e616f6b615f70726f6772616d5f73616d706c655f73656d616e746963227d7d,36712  >  7000 Len=167
78,35.891927,192.168.11.41,192.168.11.40,TCP,74,,œ,0.008707,"Jan  6, 2024 19:36:51.990760000 JST",,49804  >  6000 [SYN] Seq=0 Win=64240 Len=0 MSS=1460 SACK_PERM TSval=2564608962 TSecr=0 WS=128
79,35.892072,192.168.11.40,192.168.11.41,TCP,74,0.000145,,0.000145,"Jan  6, 2024 19:36:51.990905000 JST",,"6000  >  49804 [SYN, ACK] Seq=0 Ack=1 Win=65160 Len=0 MSS=1460 SACK_PERM TSval=104451700 TSecr=2564608962 WS=128"
80,35.900181,192.168.11.41,192.168.11.40,TCP,66,0.008109,,0.008109,"Jan  6, 2024 19:36:51.999014000 JST",,49804  >  6000 [ACK] Seq=1 Ack=1 Win=64256 Len=0 TSval=2564608971 TSecr=104451700
81,35.90072,192.168.11.41,192.168.11.40,TCP,93,,,0.000539,"Jan  6, 2024 19:36:51.999553000 JST",,"49804  >  6000 [PSH, ACK] Seq=1 Ack=1 Win=64256 Len=27 TSval=2564608971 TSecr=104451700 [TCP segment of a reassembled PDU]"
82,35.90084,192.168.11.40,192.168.11.41,TCP,66,0.00012,,0.00012,"Jan  6, 2024 19:36:51.999673000 JST",,6000  >  49804 [ACK] Seq=1 Ack=28 Win=65152 Len=0 TSval=104451709 TSecr=2564608971
83,35.900917,192.168.11.41,192.168.11.40,TCP,66,,,0.000077,"Jan  6, 2024 19:36:51.999750000 JST",,"49804  >  6000 [FIN, ACK] Seq=28 Ack=1 Win=64256 Len=0 TSval=2564608971 TSecr=104451700"
84,35.901996,192.168.11.40,192.168.11.41,TCP,66,0.001079,,0.001079,"Jan  6, 2024 19:36:52.000829000 JST",,"6000  >  49804 [FIN, ACK] Seq=1 Ack=29 Win=65152 Len=0 TSval=104451710 TSecr=2564608971"
85,35.909086,192.168.11.41,192.168.11.40,TCP,66,0.00709,,0.00709,"Jan  6, 2024 19:36:52.007919000 JST",,49804  >  6000 [ACK] Seq=29 Ack=2 Win=64256 Len=0 TSval=2564608979 TSecr=104451710
86,43.658748,192.168.11.40,192.168.11.39,TCP,74,,,7.749662,"Jan  6, 2024 19:36:59.757581000 JST",,52412  >  6000 [SYN] Seq=0 Win=64240 Len=0 MSS=1460 SACK_PERM TSval=1105601555 TSecr=0 WS=128
87,43.666258,192.168.11.39,192.168.11.40,TCP,74,0.00751,,0.00751,"Jan  6, 2024 19:36:59.765091000 JST",,"6000  >  52412 [SYN, ACK] Seq=0 Ack=1 Win=65160 Len=0 MSS=1460 SACK_PERM TSval=1274281783 TSecr=1105601555 WS=128"
88,43.666361,192.168.11.40,192.168.11.39,TCP,66,0.000103,,0.000103,"Jan  6, 2024 19:36:59.765194000 JST",,52412  >  6000 [ACK] Seq=1 Ack=1 Win=64256 Len=0 TSval=1105601562 TSecr=1274281783
89,43.666591,192.168.11.40,192.168.11.39,TCP,93,,,0.00023,"Jan  6, 2024 19:36:59.765424000 JST",,"52412  >  6000 [PSH, ACK] Seq=1 Ack=1 Win=64256 Len=27 TSval=1105601563 TSecr=1274281783 [TCP segment of a reassembled PDU]"
90,43.666699,192.168.11.40,192.168.11.39,TCP,66,,,0.000108,"Jan  6, 2024 19:36:59.765532000 JST",,"52412  >  6000 [FIN, ACK] Seq=28 Ack=1 Win=64256 Len=0 TSval=1105601563 TSecr=1274281783"
91,43.674614,192.168.11.39,192.168.11.40,TCP,66,0.008023,,0.007915,"Jan  6, 2024 19:36:59.773447000 JST",,6000  >  52412 [ACK] Seq=1 Ack=28 Win=65152 Len=0 TSval=1274281792 TSecr=1105601563
92,43.674829,192.168.11.39,192.168.11.40,TCP,66,0.00813,,0.000215,"Jan  6, 2024 19:36:59.773662000 JST",,"6000  >  52412 [FIN, ACK] Seq=1 Ack=29 Win=65152 Len=0 TSval=1274281794 TSecr=1105601563"
93,43.674872,192.168.11.40,192.168.11.39,TCP,66,0.000043,,0.000043,"Jan  6, 2024 19:36:59.773705000 JST",,52412  >  6000 [ACK] Seq=29 Ack=2 Win=64256 Len=0 TSval=1105601571 TSecr=1274281794
94,43.708033,192.168.11.40,255.255.255.255,UDP,209,,Ÿ,0.033161,"Jan  6, 2024 19:36:59.806866000 JST",7b2273656d616e74696373223a207b22656e74697479223a2022504944222c202262617365656e74697479223a2022616e79222c2022726f6c65223a2022393939222c20227370617469616c223a2022616e79222c202274656d706f72616c223a2022616e79227d2c20226461746170726f7065727479223a207b22666f726d6174223a2022696e616f6b615f70726f6772616d5f73616d706c655f73656d616e746963227d7d,39647  >  7000 Len=167
95,43.7193,192.168.11.41,192.168.11.40,TCP,74,,œ,0.011267,"Jan  6, 2024 19:36:59.818133000 JST",,39938  >  6000 [SYN] Seq=0 Win=64240 Len=0 MSS=1460 SACK_PERM TSval=2564616789 TSecr=0 WS=128
96,43.719464,192.168.11.40,192.168.11.41,TCP,74,0.000164,,0.000164,"Jan  6, 2024 19:36:59.818297000 JST",,"6000  >  39938 [SYN, ACK] Seq=0 Ack=1 Win=65160 Len=0 MSS=1460 SACK_PERM TSval=104459527 TSecr=2564616789 WS=128"
97,43.726523,192.168.11.41,192.168.11.40,TCP,66,0.007059,,0.007059,"Jan  6, 2024 19:36:59.825356000 JST",,39938  >  6000 [ACK] Seq=1 Ack=1 Win=64256 Len=0 TSval=2564616797 TSecr=104459527
98,43.726983,192.168.11.41,192.168.11.40,TCP,93,,,0.00046,"Jan  6, 2024 19:36:59.825816000 JST",,"39938  >  6000 [PSH, ACK] Seq=1 Ack=1 Win=64256 Len=27 TSval=2564616797 TSecr=104459527 [TCP segment of a reassembled PDU]"
99,43.727048,192.168.11.40,192.168.11.41,TCP,66,0.000065,,0.000065,"Jan  6, 2024 19:36:59.825881000 JST",,6000  >  39938 [ACK] Seq=1 Ack=28 Win=65152 Len=0 TSval=104459535 TSecr=2564616797
100,43.727114,192.168.11.41,192.168.11.40,TCP,66,,,0.000066,"Jan  6, 2024 19:36:59.825947000 JST",,"39938  >  6000 [FIN, ACK] Seq=28 Ack=1 Win=64256 Len=0 TSval=2564616797 TSecr=104459527"
101,43.727957,192.168.11.40,192.168.11.41,TCP,66,0.000843,,0.000843,"Jan  6, 2024 19:36:59.826790000 JST",,"6000  >  39938 [FIN, ACK] Seq=1 Ack=29 Win=65152 Len=0 TSval=104459536 TSecr=2564616797"
102,43.735234,192.168.11.41,192.168.11.40,TCP,66,0.007277,,0.007277,"Jan  6, 2024 19:36:59.834067000 JST",,39938  >  6000 [ACK] Seq=29 Ack=2 Win=64256 Len=0 TSval=2564616806 TSecr=104459536
103,51.509332,192.168.11.40,192.168.11.39,TCP,74,,,7.774098,"Jan  6, 2024 19:37:07.608165000 JST",,46202  >  6000 [SYN] Seq=0 Win=64240 Len=0 MSS=1460 SACK_PERM TSval=1105609405 TSecr=0 WS=128
104,51.51615,192.168.11.39,192.168.11.40,TCP,74,0.006818,,0.006818,"Jan  6, 2024 19:37:07.614983000 JST",,"6000  >  46202 [SYN, ACK] Seq=0 Ack=1 Win=65160 Len=0 MSS=1460 SACK_PERM TSval=1274289634 TSecr=1105609405 WS=128"
105,51.516249,192.168.11.40,192.168.11.39,TCP,66,0.000099,,0.000099,"Jan  6, 2024 19:37:07.615082000 JST",,46202  >  6000 [ACK] Seq=1 Ack=1 Win=64256 Len=0 TSval=1105609412 TSecr=1274289634
106,51.516407,192.168.11.40,192.168.11.39,TCP,93,,,0.000158,"Jan  6, 2024 19:37:07.615240000 JST",,"46202  >  6000 [PSH, ACK] Seq=1 Ack=1 Win=64256 Len=27 TSval=1105609412 TSecr=1274289634 [TCP segment of a reassembled PDU]"
107,51.516525,192.168.11.40,192.168.11.39,TCP,66,,,0.000118,"Jan  6, 2024 19:37:07.615358000 JST",,"46202  >  6000 [FIN, ACK] Seq=28 Ack=1 Win=64256 Len=0 TSval=1105609413 TSecr=1274289634"
108,51.525552,192.168.11.39,192.168.11.40,TCP,66,0.009145,,0.009027,"Jan  6, 2024 19:37:07.624385000 JST",,6000  >  46202 [ACK] Seq=1 Ack=28 Win=65152 Len=0 TSval=1274289642 TSecr=1105609412
109,51.734377,192.168.11.39,192.168.11.40,TCP,66,0.217852,,0.208825,"Jan  6, 2024 19:37:07.833210000 JST",,"6000  >  46202 [FIN, ACK] Seq=1 Ack=29 Win=65152 Len=0 TSval=1274289852 TSecr=1105609413"
110,51.734463,192.168.11.40,192.168.11.39,TCP,66,0.000086,,0.000086,"Jan  6, 2024 19:37:07.833296000 JST",,46202  >  6000 [ACK] Seq=29 Ack=2 Win=64256 Len=0 TSval=1105609630 TSecr=1274289852
111,51.7661,192.168.11.40,255.255.255.255,UDP,209,,Ÿ,0.031637,"Jan  6, 2024 19:37:07.864933000 JST",7b2273656d616e74696373223a207b22656e74697479223a2022504944222c202262617365656e74697479223a2022616e79222c2022726f6c65223a2022393939222c20227370617469616c223a2022616e79222c202274656d706f72616c223a2022616e79227d2c20226461746170726f7065727479223a207b22666f726d6174223a2022696e616f6b615f70726f6772616d5f73616d706c655f73656d616e746963227d7d,57930  >  7000 Len=167
112,51.774121,192.168.11.41,192.168.11.40,TCP,74,,œ,0.008021,"Jan  6, 2024 19:37:07.872954000 JST",,43040  >  6000 [SYN] Seq=0 Win=64240 Len=0 MSS=1460 SACK_PERM TSval=2564624845 TSecr=0 WS=128
113,51.774243,192.168.11.40,192.168.11.41,TCP,74,0.000122,,0.000122,"Jan  6, 2024 19:37:07.873076000 JST",,"6000  >  43040 [SYN, ACK] Seq=0 Ack=1 Win=65160 Len=0 MSS=1460 SACK_PERM TSval=104467582 TSecr=2564624845 WS=128"
114,51.780841,192.168.11.41,192.168.11.40,TCP,66,0.006598,,0.006598,"Jan  6, 2024 19:37:07.879674000 JST",,43040  >  6000 [ACK] Seq=1 Ack=1 Win=64256 Len=0 TSval=2564624851 TSecr=104467582
115,51.781329,192.168.11.41,192.168.11.40,TCP,93,,,0.000488,"Jan  6, 2024 19:37:07.880162000 JST",,"43040  >  6000 [PSH, ACK] Seq=1 Ack=1 Win=64256 Len=27 TSval=2564624851 TSecr=104467582 [TCP segment of a reassembled PDU]"
116,51.781406,192.168.11.40,192.168.11.41,TCP,66,0.000077,,0.000077,"Jan  6, 2024 19:37:07.880239000 JST",,6000  >  43040 [ACK] Seq=1 Ack=28 Win=65152 Len=0 TSval=104467589 TSecr=2564624851
117,51.781581,192.168.11.41,192.168.11.40,TCP,66,,,0.000175,"Jan  6, 2024 19:37:07.880414000 JST",,"43040  >  6000 [FIN, ACK] Seq=28 Ack=1 Win=64256 Len=0 TSval=2564624852 TSecr=104467582"
118,51.782642,192.168.11.40,192.168.11.41,TCP,66,0.001061,,0.001061,"Jan  6, 2024 19:37:07.881475000 JST",,"6000  >  43040 [FIN, ACK] Seq=1 Ack=29 Win=65152 Len=0 TSval=104467591 TSecr=2564624852"
119,51.794256,192.168.11.41,192.168.11.40,TCP,66,0.011614,,0.011614,"Jan  6, 2024 19:37:07.893089000 JST",,43040  >  6000 [ACK] Seq=29 Ack=2 Win=64256 Len=0 TSval=2564624859 TSecr=104467591
120,60.818037,192.168.11.40,192.168.11.39,TCP,74,,,9.023781,"Jan  6, 2024 19:37:16.916870000 JST",,33256  >  6000 [SYN] Seq=0 Win=64240 Len=0 MSS=1460 SACK_PERM TSval=1105618714 TSecr=0 WS=128
121,60.824647,192.168.11.39,192.168.11.40,TCP,74,0.00661,,0.00661,"Jan  6, 2024 19:37:16.923480000 JST",,"6000  >  33256 [SYN, ACK] Seq=0 Ack=1 Win=65160 Len=0 MSS=1460 SACK_PERM TSval=1274298943 TSecr=1105618714 WS=128"
122,60.824739,192.168.11.40,192.168.11.39,TCP,66,0.000092,,0.000092,"Jan  6, 2024 19:37:16.923572000 JST",,33256  >  6000 [ACK] Seq=1 Ack=1 Win=64256 Len=0 TSval=1105618721 TSecr=1274298943
123,60.824866,192.168.11.40,192.168.11.39,TCP,93,,,0.000127,"Jan  6, 2024 19:37:16.923699000 JST",,"33256  >  6000 [PSH, ACK] Seq=1 Ack=1 Win=64256 Len=27 TSval=1105618721 TSecr=1274298943 [TCP segment of a reassembled PDU]"
124,60.824967,192.168.11.40,192.168.11.39,TCP,66,,,0.000101,"Jan  6, 2024 19:37:16.923800000 JST",,"33256  >  6000 [FIN, ACK] Seq=28 Ack=1 Win=64256 Len=0 TSval=1105618721 TSecr=1274298943"
125,60.832475,192.168.11.39,192.168.11.40,TCP,66,0.007609,,0.007508,"Jan  6, 2024 19:37:16.931308000 JST",,6000  >  33256 [ACK] Seq=1 Ack=28 Win=65152 Len=0 TSval=1274298950 TSecr=1105618721
126,60.832686,192.168.11.39,192.168.11.40,TCP,66,0.007719,,0.000211,"Jan  6, 2024 19:37:16.931519000 JST",,"6000  >  33256 [FIN, ACK] Seq=1 Ack=29 Win=65152 Len=0 TSval=1274298952 TSecr=1105618721"
127,60.83273,192.168.11.40,192.168.11.39,TCP,66,0.000044,,0.000044,"Jan  6, 2024 19:37:16.931563000 JST",,33256  >  6000 [ACK] Seq=29 Ack=2 Win=64256 Len=0 TSval=1105618729 TSecr=1274298952
128,60.864952,192.168.11.40,255.255.255.255,UDP,209,,Ÿ,0.032222,"Jan  6, 2024 19:37:16.963785000 JST",7b2273656d616e74696373223a207b22656e74697479223a2022504944222c202262617365656e74697479223a2022616e79222c2022726f6c65223a2022393939222c20227370617469616c223a2022616e79222c202274656d706f72616c223a2022616e79227d2c20226461746170726f7065727479223a207b22666f726d6174223a2022696e616f6b615f70726f6772616d5f73616d706c655f73656d616e746963227d7d,50994  >  7000 Len=167
129,60.878437,192.168.11.41,192.168.11.40,TCP,74,,œ,0.013485,"Jan  6, 2024 19:37:16.977270000 JST",,56408  >  6000 [SYN] Seq=0 Win=64240 Len=0 MSS=1460 SACK_PERM TSval=2564633944 TSecr=0 WS=128
130,60.87856,192.168.11.40,192.168.11.41,TCP,74,0.000123,,0.000123,"Jan  6, 2024 19:37:16.977393000 JST",,"6000  >  56408 [SYN, ACK] Seq=0 Ack=1 Win=65160 Len=0 MSS=1460 SACK_PERM TSval=104476687 TSecr=2564633944 WS=128"
131,60.886851,192.168.11.41,192.168.11.40,TCP,66,0.008291,,0.008291,"Jan  6, 2024 19:37:16.985684000 JST",,56408  >  6000 [ACK] Seq=1 Ack=1 Win=64256 Len=0 TSval=2564633957 TSecr=104476687
132,60.887461,192.168.11.41,192.168.11.40,TCP,93,,,0.00061,"Jan  6, 2024 19:37:16.986294000 JST",,"56408  >  6000 [PSH, ACK] Seq=1 Ack=1 Win=64256 Len=27 TSval=2564633957 TSecr=104476687 [TCP segment of a reassembled PDU]"
133,60.887547,192.168.11.40,192.168.11.41,TCP,66,0.000086,,0.000086,"Jan  6, 2024 19:37:16.986380000 JST",,6000  >  56408 [ACK] Seq=1 Ack=28 Win=65152 Len=0 TSval=104476696 TSecr=2564633957
134,60.887621,192.168.11.41,192.168.11.40,TCP,66,,,0.000074,"Jan  6, 2024 19:37:16.986454000 JST",,"56408  >  6000 [FIN, ACK] Seq=28 Ack=1 Win=64256 Len=0 TSval=2564633958 TSecr=104476687"
135,60.889974,192.168.11.40,192.168.11.41,TCP,66,0.002353,,0.002353,"Jan  6, 2024 19:37:16.988807000 JST",,"6000  >  56408 [FIN, ACK] Seq=1 Ack=29 Win=65152 Len=0 TSval=104476698 TSecr=2564633958"
136,60.894565,192.168.11.41,192.168.11.40,TCP,66,0.004591,,0.004591,"Jan  6, 2024 19:37:16.993398000 JST",,56408  >  6000 [ACK] Seq=29 Ack=2 Win=64256 Len=0 TSval=2564633965 TSecr=104476698
137,72.732641,192.168.11.40,192.168.11.39,TCP,74,,,11.838076,"Jan  6, 2024 19:37:28.831474000 JST",,53048  >  6000 [SYN] Seq=0 Win=64240 Len=0 MSS=1460 SACK_PERM TSval=1105630629 TSecr=0 WS=128
138,72.74215,192.168.11.39,192.168.11.40,TCP,74,0.009509,,0.009509,"Jan  6, 2024 19:37:28.840983000 JST",,"6000  >  53048 [SYN, ACK] Seq=0 Ack=1 Win=65160 Len=0 MSS=1460 SACK_PERM TSval=1274310860 TSecr=1105630629 WS=128"
139,72.742255,192.168.11.40,192.168.11.39,TCP,66,0.000105,,0.000105,"Jan  6, 2024 19:37:28.841088000 JST",,53048  >  6000 [ACK] Seq=1 Ack=1 Win=64256 Len=0 TSval=1105630638 TSecr=1274310860
140,72.742416,192.168.11.40,192.168.11.39,TCP,93,,,0.000161,"Jan  6, 2024 19:37:28.841249000 JST",,"53048  >  6000 [PSH, ACK] Seq=1 Ack=1 Win=64256 Len=27 TSval=1105630638 TSecr=1274310860 [TCP segment of a reassembled PDU]"
141,72.742508,192.168.11.40,192.168.11.39,TCP,66,,,0.000092,"Jan  6, 2024 19:37:28.841341000 JST",,"53048  >  6000 [FIN, ACK] Seq=28 Ack=1 Win=64256 Len=0 TSval=1105630639 TSecr=1274310860"
142,72.74992,192.168.11.39,192.168.11.40,TCP,66,0.007504,,0.007412,"Jan  6, 2024 19:37:28.848753000 JST",,6000  >  53048 [ACK] Seq=1 Ack=28 Win=65152 Len=0 TSval=1274310867 TSecr=1105630638
143,72.75194,192.168.11.39,192.168.11.40,TCP,66,0.009432,,0.00202,"Jan  6, 2024 19:37:28.850773000 JST",,"6000  >  53048 [FIN, ACK] Seq=1 Ack=29 Win=65152 Len=0 TSval=1274310870 TSecr=1105630639"
144,72.751992,192.168.11.40,192.168.11.39,TCP,66,0.000052,,0.000052,"Jan  6, 2024 19:37:28.850825000 JST",,53048  >  6000 [ACK] Seq=29 Ack=2 Win=64256 Len=0 TSval=1105630648 TSecr=1274310870
145,72.780358,192.168.11.40,255.255.255.255,UDP,209,,Ÿ,0.028366,"Jan  6, 2024 19:37:28.879191000 JST",7b2273656d616e74696373223a207b22656e74697479223a2022504944222c202262617365656e74697479223a2022616e79222c2022726f6c65223a2022393939222c20227370617469616c223a2022616e79222c202274656d706f72616c223a2022616e79227d2c20226461746170726f7065727479223a207b22666f726d6174223a2022696e616f6b615f70726f6772616d5f73616d706c655f73656d616e746963227d7d,49134  >  7000 Len=167
146,72.787906,192.168.11.41,192.168.11.40,TCP,74,,œ,0.007548,"Jan  6, 2024 19:37:28.886739000 JST",,34480  >  6000 [SYN] Seq=0 Win=64240 Len=0 MSS=1460 SACK_PERM TSval=2564645858 TSecr=0 WS=128
147,72.788035,192.168.11.40,192.168.11.41,TCP,74,0.000129,,0.000129,"Jan  6, 2024 19:37:28.886868000 JST",,"6000  >  34480 [SYN, ACK] Seq=0 Ack=1 Win=65160 Len=0 MSS=1460 SACK_PERM TSval=104488596 TSecr=2564645858 WS=128"
148,72.797265,192.168.11.41,192.168.11.40,TCP,66,0.00923,,0.00923,"Jan  6, 2024 19:37:28.896098000 JST",,34480  >  6000 [ACK] Seq=1 Ack=1 Win=64256 Len=0 TSval=2564645865 TSecr=104488596
149,72.797803,192.168.11.41,192.168.11.40,TCP,93,,,0.000538,"Jan  6, 2024 19:37:28.896636000 JST",,"34480  >  6000 [PSH, ACK] Seq=1 Ack=1 Win=64256 Len=27 TSval=2564645865 TSecr=104488596 [TCP segment of a reassembled PDU]"
150,72.79787,192.168.11.40,192.168.11.41,TCP,66,0.000067,,0.000067,"Jan  6, 2024 19:37:28.896703000 JST",,6000  >  34480 [ACK] Seq=1 Ack=28 Win=65152 Len=0 TSval=104488606 TSecr=2564645865
151,72.797928,192.168.11.41,192.168.11.40,TCP,66,,,0.000058,"Jan  6, 2024 19:37:28.896761000 JST",,"34480  >  6000 [FIN, ACK] Seq=28 Ack=1 Win=64256 Len=0 TSval=2564645865 TSecr=104488596"
152,72.79927,192.168.11.40,192.168.11.41,TCP,66,0.001342,,0.001342,"Jan  6, 2024 19:37:28.898103000 JST",,"6000  >  34480 [FIN, ACK] Seq=1 Ack=29 Win=65152 Len=0 TSval=104488607 TSecr=2564645865"
153,72.804851,192.168.11.41,192.168.11.40,TCP,66,0.005581,,0.005581,"Jan  6, 2024 19:37:28.903684000 JST",,34480  >  6000 [ACK] Seq=29 Ack=2 Win=64256 Len=0 TSval=2564645875 TSecr=104488607
154,81.611413,192.168.11.40,192.168.11.39,TCP,74,,,8.806562,"Jan  6, 2024 19:37:37.710246000 JST",,46528  >  6000 [SYN] Seq=0 Win=64240 Len=0 MSS=1460 SACK_PERM TSval=1105639507 TSecr=0 WS=128
155,81.618427,192.168.11.39,192.168.11.40,TCP,74,0.007014,,0.007014,"Jan  6, 2024 19:37:37.717260000 JST",,"6000  >  46528 [SYN, ACK] Seq=0 Ack=1 Win=65160 Len=0 MSS=1460 SACK_PERM TSval=1274319736 TSecr=1105639507 WS=128"
156,81.618525,192.168.11.40,192.168.11.39,TCP,66,0.000098,,0.000098,"Jan  6, 2024 19:37:37.717358000 JST",,46528  >  6000 [ACK] Seq=1 Ack=1 Win=64256 Len=0 TSval=1105639515 TSecr=1274319736
157,81.618704,192.168.11.40,192.168.11.39,TCP,93,,,0.000179,"Jan  6, 2024 19:37:37.717537000 JST",,"46528  >  6000 [PSH, ACK] Seq=1 Ack=1 Win=64256 Len=27 TSval=1105639515 TSecr=1274319736 [TCP segment of a reassembled PDU]"
158,81.618799,192.168.11.40,192.168.11.39,TCP,66,,,0.000095,"Jan  6, 2024 19:37:37.717632000 JST",,"46528  >  6000 [FIN, ACK] Seq=28 Ack=1 Win=64256 Len=0 TSval=1105639515 TSecr=1274319736"
159,81.626016,192.168.11.39,192.168.11.40,TCP,66,0.007312,,0.007217,"Jan  6, 2024 19:37:37.724849000 JST",,6000  >  46528 [ACK] Seq=1 Ack=28 Win=65152 Len=0 TSval=1274319743 TSecr=1105639515
160,81.626363,192.168.11.39,192.168.11.40,TCP,66,0.007564,,0.000347,"Jan  6, 2024 19:37:37.725196000 JST",,"6000  >  46528 [FIN, ACK] Seq=1 Ack=29 Win=65152 Len=0 TSval=1274319745 TSecr=1105639515"
161,81.62641,192.168.11.40,192.168.11.39,TCP,66,0.000047,,0.000047,"Jan  6, 2024 19:37:37.725243000 JST",,46528  >  6000 [ACK] Seq=29 Ack=2 Win=64256 Len=0 TSval=1105639522 TSecr=1274319745
162,81.656988,192.168.11.40,255.255.255.255,UDP,209,,Ÿ,0.030578,"Jan  6, 2024 19:37:37.755821000 JST",7b2273656d616e74696373223a207b22656e74697479223a2022504944222c202262617365656e74697479223a2022616e79222c2022726f6c65223a2022393939222c20227370617469616c223a2022616e79222c202274656d706f72616c223a2022616e79227d2c20226461746170726f7065727479223a207b22666f726d6174223a2022696e616f6b615f70726f6772616d5f73616d706c655f73656d616e746963227d7d,49777  >  7000 Len=167
163,81.665104,192.168.11.41,192.168.11.40,TCP,74,,œ,0.008116,"Jan  6, 2024 19:37:37.763937000 JST",,56248  >  6000 [SYN] Seq=0 Win=64240 Len=0 MSS=1460 SACK_PERM TSval=2564654735 TSecr=0 WS=128
164,81.665233,192.168.11.40,192.168.11.41,TCP,74,0.000129,,0.000129,"Jan  6, 2024 19:37:37.764066000 JST",,"6000  >  56248 [SYN, ACK] Seq=0 Ack=1 Win=65160 Len=0 MSS=1460 SACK_PERM TSval=104497473 TSecr=2564654735 WS=128"
165,81.672944,192.168.11.41,192.168.11.40,TCP,66,0.007711,,0.007711,"Jan  6, 2024 19:37:37.771777000 JST",,56248  >  6000 [ACK] Seq=1 Ack=1 Win=64256 Len=0 TSval=2564654743 TSecr=104497473
166,81.673566,192.168.11.41,192.168.11.40,TCP,93,,,0.000622,"Jan  6, 2024 19:37:37.772399000 JST",,"56248  >  6000 [PSH, ACK] Seq=1 Ack=1 Win=64256 Len=27 TSval=2564654743 TSecr=104497473 [TCP segment of a reassembled PDU]"
167,81.67366,192.168.11.40,192.168.11.41,TCP,66,0.000094,,0.000094,"Jan  6, 2024 19:37:37.772493000 JST",,6000  >  56248 [ACK] Seq=1 Ack=28 Win=65152 Len=0 TSval=104497482 TSecr=2564654743
168,81.67374,192.168.11.41,192.168.11.40,TCP,66,,,0.00008,"Jan  6, 2024 19:37:37.772573000 JST",,"56248  >  6000 [FIN, ACK] Seq=28 Ack=1 Win=64256 Len=0 TSval=2564654743 TSecr=104497473"
169,81.675207,192.168.11.40,192.168.11.41,TCP,66,0.001467,,0.001467,"Jan  6, 2024 19:37:37.774040000 JST",,"6000  >  56248 [FIN, ACK] Seq=1 Ack=29 Win=65152 Len=0 TSval=104497483 TSecr=2564654743"
170,81.680161,192.168.11.41,192.168.11.40,TCP,66,0.004954,,0.004954,"Jan  6, 2024 19:37:37.778994000 JST",,56248  >  6000 [ACK] Seq=29 Ack=2 Win=64256 Len=0 TSval=2564654751 TSecr=104497483
171,112.836202,192.168.11.40,192.168.11.39,TCP,74,,,31.156041,"Jan  6, 2024 19:38:08.935035000 JST",,57718  >  6000 [SYN] Seq=0 Win=64240 Len=0 MSS=1460 SACK_PERM TSval=1105670732 TSecr=0 WS=128
172,112.843286,192.168.11.39,192.168.11.40,TCP,74,0.007084,,0.007084,"Jan  6, 2024 19:38:08.942119000 JST",,"6000  >  57718 [SYN, ACK] Seq=0 Ack=1 Win=65160 Len=0 MSS=1460 SACK_PERM TSval=1274350960 TSecr=1105670732 WS=128"
173,112.843399,192.168.11.40,192.168.11.39,TCP,66,0.000113,,0.000113,"Jan  6, 2024 19:38:08.942232000 JST",,57718  >  6000 [ACK] Seq=1 Ack=1 Win=64256 Len=0 TSval=1105670739 TSecr=1274350960
174,112.843636,192.168.11.40,192.168.11.39,TCP,93,,,0.000237,"Jan  6, 2024 19:38:08.942469000 JST",,"57718  >  6000 [PSH, ACK] Seq=1 Ack=1 Win=64256 Len=27 TSval=1105670740 TSecr=1274350960 [TCP segment of a reassembled PDU]"
175,112.84374,192.168.11.40,192.168.11.39,TCP,66,,,0.000104,"Jan  6, 2024 19:38:08.942573000 JST",,"57718  >  6000 [FIN, ACK] Seq=28 Ack=1 Win=64256 Len=0 TSval=1105670740 TSecr=1274350960"
176,112.8512,192.168.11.39,192.168.11.40,TCP,66,0.007564,,0.00746,"Jan  6, 2024 19:38:08.950033000 JST",,6000  >  57718 [ACK] Seq=1 Ack=28 Win=65152 Len=0 TSval=1274350968 TSecr=1105670740
177,112.851568,192.168.11.39,192.168.11.40,TCP,66,0.007828,,0.000368,"Jan  6, 2024 19:38:08.950401000 JST",,"6000  >  57718 [FIN, ACK] Seq=1 Ack=29 Win=65152 Len=0 TSval=1274350970 TSecr=1105670740"
178,112.851609,192.168.11.40,192.168.11.39,TCP,66,0.000041,,0.000041,"Jan  6, 2024 19:38:08.950442000 JST",,57718  >  6000 [ACK] Seq=29 Ack=2 Win=64256 Len=0 TSval=1105670748 TSecr=1274350970
179,112.880393,192.168.11.40,255.255.255.255,UDP,209,,Ÿ,0.028784,"Jan  6, 2024 19:38:08.979226000 JST",7b2273656d616e74696373223a207b22656e74697479223a2022504944222c202262617365656e74697479223a2022616e79222c2022726f6c65223a2022393939222c20227370617469616c223a2022616e79222c202274656d706f72616c223a2022616e79227d2c20226461746170726f7065727479223a207b22666f726d6174223a2022696e616f6b615f70726f6772616d5f73616d706c655f73656d616e746963227d7d,50071  >  7000 Len=167
180,112.887814,192.168.11.41,192.168.11.40,TCP,74,,œ,0.007421,"Jan  6, 2024 19:38:08.986647000 JST",,43880  >  6000 [SYN] Seq=0 Win=64240 Len=0 MSS=1460 SACK_PERM TSval=2564685958 TSecr=0 WS=128
181,112.88794,192.168.11.40,192.168.11.41,TCP,74,0.000126,,0.000126,"Jan  6, 2024 19:38:08.986773000 JST",,"6000  >  43880 [SYN, ACK] Seq=0 Ack=1 Win=65160 Len=0 MSS=1460 SACK_PERM TSval=104528696 TSecr=2564685958 WS=128"
182,112.894394,192.168.11.41,192.168.11.40,TCP,66,0.006454,,0.006454,"Jan  6, 2024 19:38:08.993227000 JST",,43880  >  6000 [ACK] Seq=1 Ack=1 Win=64256 Len=0 TSval=2564685965 TSecr=104528696
183,112.894773,192.168.11.41,192.168.11.40,TCP,93,,,0.000379,"Jan  6, 2024 19:38:08.993606000 JST",,"43880  >  6000 [PSH, ACK] Seq=1 Ack=1 Win=64256 Len=27 TSval=2564685965 TSecr=104528696 [TCP segment of a reassembled PDU]"
184,112.894816,192.168.11.40,192.168.11.41,TCP,66,0.000043,,0.000043,"Jan  6, 2024 19:38:08.993649000 JST",,6000  >  43880 [ACK] Seq=1 Ack=28 Win=65152 Len=0 TSval=104528703 TSecr=2564685965
185,112.894861,192.168.11.41,192.168.11.40,TCP,66,,,0.000045,"Jan  6, 2024 19:38:08.993694000 JST",,"43880  >  6000 [FIN, ACK] Seq=28 Ack=1 Win=64256 Len=0 TSval=2564685965 TSecr=104528696"
