No.,Time,Source,Destination,Protocol,Length,The RTT to ACK the segment was,XXX,Time delta from previous captured frame,Arrival Time,Data,Info
1,0,192.168.11.13,192.168.11.27,TCP,74,,,0,"Jan  6, 2024 19:36:10.899078000 JST",,35184  >  6000 [SYN] Seq=0 Win=64240 Len=0 MSS=1460 SACK_PERM TSval=523853482 TSecr=0 WS=128
2,0.006297,192.168.11.27,192.168.11.13,TCP,74,0.006297,,0.006297,"Jan  6, 2024 19:36:10.905375000 JST",,"6000  >  35184 [SYN, ACK] Seq=0 Ack=1 Win=65160 Len=0 MSS=1460 SACK_PERM TSval=359412216 TSecr=523853482 WS=128"
3,0.006416,192.168.11.13,192.168.11.27,TCP,66,0.000119,,0.000119,"Jan  6, 2024 19:36:10.905494000 JST",,35184  >  6000 [ACK] Seq=1 Ack=1 Win=64256 Len=0 TSval=523853491 TSecr=359412216
4,0.006614,192.168.11.13,192.168.11.27,TCP,93,,,0.000198,"Jan  6, 2024 19:36:10.905692000 JST",,"35184  >  6000 [PSH, ACK] Seq=1 Ack=1 Win=64256 Len=27 TSval=523853491 TSecr=359412216 [TCP segment of a reassembled PDU]"
5,0.006744,192.168.11.13,192.168.11.27,TCP,66,,,0.00013,"Jan  6, 2024 19:36:10.905822000 JST",,"35184  >  6000 [FIN, ACK] Seq=28 Ack=1 Win=64256 Len=0 TSval=523853491 TSecr=359412216"
6,0.021525,192.168.11.27,192.168.11.13,TCP,66,0.014911,,0.014781,"Jan  6, 2024 19:36:10.920603000 JST",,6000  >  35184 [ACK] Seq=1 Ack=28 Win=65152 Len=0 TSval=359412231 TSecr=523853491
7,0.021934,192.168.11.27,192.168.11.13,TCP,66,0.01519,,0.000409,"Jan  6, 2024 19:36:10.921012000 JST",,"6000  >  35184 [FIN, ACK] Seq=1 Ack=29 Win=65152 Len=0 TSval=359412232 TSecr=523853491"
8,0.021982,192.168.11.13,192.168.11.27,TCP,66,0.000048,,0.000048,"Jan  6, 2024 19:36:10.921060000 JST",,35184  >  6000 [ACK] Seq=29 Ack=2 Win=64256 Len=0 TSval=523853507 TSecr=359412232
9,0.052366,192.168.11.13,255.255.255.255,UDP,209,,Ÿ,0.030384,"Jan  6, 2024 19:36:10.951444000 JST",7b2273656d616e74696373223a207b22656e74697479223a2022504944222c202262617365656e74697479223a2022616e79222c2022726f6c65223a2022636363222c20227370617469616c223a2022616e79222c202274656d706f72616c223a2022616e79227d2c20226461746170726f7065727479223a207b22666f726d6174223a2022696e616f6b615f70726f6772616d5f73616d706c655f73656d616e746963227d7d,45053  >  7000 Len=167
10,0.061909,192.168.11.8,192.168.11.13,TCP,74,,œ,0.009543,"Jan  6, 2024 19:36:10.960987000 JST",,33384  >  6000 [SYN] Seq=0 Win=64240 Len=0 MSS=1460 SACK_PERM TSval=1308773088 TSecr=0 WS=128
11,0.06208,192.168.11.13,192.168.11.8,TCP,74,0.000171,,0.000171,"Jan  6, 2024 19:36:10.961158000 JST",,"6000  >  33384 [SYN, ACK] Seq=0 Ack=1 Win=65160 Len=0 MSS=1460 SACK_PERM TSval=499446543 TSecr=1308773088 WS=128"
12,0.068759,192.168.11.8,192.168.11.13,TCP,66,0.006679,,0.006679,"Jan  6, 2024 19:36:10.967837000 JST",,33384  >  6000 [ACK] Seq=1 Ack=1 Win=64256 Len=0 TSval=1308773098 TSecr=499446543
13,0.069346,192.168.11.8,192.168.11.13,TCP,93,,,0.000587,"Jan  6, 2024 19:36:10.968424000 JST",,"33384  >  6000 [PSH, ACK] Seq=1 Ack=1 Win=64256 Len=27 TSval=1308773098 TSecr=499446543 [TCP segment of a reassembled PDU]"
14,0.069454,192.168.11.13,192.168.11.8,TCP,66,0.000108,,0.000108,"Jan  6, 2024 19:36:10.968532000 JST",,6000  >  33384 [ACK] Seq=1 Ack=28 Win=65152 Len=0 TSval=499446550 TSecr=1308773098
15,0.069533,192.168.11.8,192.168.11.13,TCP,66,,,0.000079,"Jan  6, 2024 19:36:10.968611000 JST",,"33384  >  6000 [FIN, ACK] Seq=28 Ack=1 Win=64256 Len=0 TSval=1308773099 TSecr=499446543"
16,0.070979,192.168.11.13,192.168.11.8,TCP,66,0.001446,,0.001446,"Jan  6, 2024 19:36:10.970057000 JST",,"6000  >  33384 [FIN, ACK] Seq=1 Ack=29 Win=65152 Len=0 TSval=499446552 TSecr=1308773099"
17,0.077805,192.168.11.8,192.168.11.13,TCP,66,0.006826,,0.006826,"Jan  6, 2024 19:36:10.976883000 JST",,33384  >  6000 [ACK] Seq=29 Ack=2 Win=64256 Len=0 TSval=1308773106 TSecr=499446552
18,10.371923,192.168.11.13,192.168.11.27,TCP,74,,,10.294118,"Jan  6, 2024 19:36:21.271001000 JST",,37852  >  6000 [SYN] Seq=0 Win=64240 Len=0 MSS=1460 SACK_PERM TSval=523863857 TSecr=0 WS=128
19,10.379859,192.168.11.27,192.168.11.13,TCP,74,0.007936,,0.007936,"Jan  6, 2024 19:36:21.278937000 JST",,"6000  >  37852 [SYN, ACK] Seq=0 Ack=1 Win=65160 Len=0 MSS=1460 SACK_PERM TSval=359422589 TSecr=523863857 WS=128"
20,10.379976,192.168.11.13,192.168.11.27,TCP,66,0.000117,,0.000117,"Jan  6, 2024 19:36:21.279054000 JST",,37852  >  6000 [ACK] Seq=1 Ack=1 Win=64256 Len=0 TSval=523863865 TSecr=359422589
21,10.38016,192.168.11.13,192.168.11.27,TCP,93,,,0.000184,"Jan  6, 2024 19:36:21.279238000 JST",,"37852  >  6000 [PSH, ACK] Seq=1 Ack=1 Win=64256 Len=27 TSval=523863865 TSecr=359422589 [TCP segment of a reassembled PDU]"
22,10.380314,192.168.11.13,192.168.11.27,TCP,66,,,0.000154,"Jan  6, 2024 19:36:21.279392000 JST",,"37852  >  6000 [FIN, ACK] Seq=28 Ack=1 Win=64256 Len=0 TSval=523863865 TSecr=359422589"
23,10.386543,192.168.11.27,192.168.11.13,TCP,66,0.006383,,0.006229,"Jan  6, 2024 19:36:21.285621000 JST",,6000  >  37852 [ACK] Seq=1 Ack=28 Win=65152 Len=0 TSval=359422596 TSecr=523863865
24,10.386763,192.168.11.27,192.168.11.13,TCP,66,0.006449,,0.00022,"Jan  6, 2024 19:36:21.285841000 JST",,"6000  >  37852 [FIN, ACK] Seq=1 Ack=29 Win=65152 Len=0 TSval=359422597 TSecr=523863865"
25,10.386815,192.168.11.13,192.168.11.27,TCP,66,0.000052,,0.000052,"Jan  6, 2024 19:36:21.285893000 JST",,37852  >  6000 [ACK] Seq=29 Ack=2 Win=64256 Len=0 TSval=523863872 TSecr=359422597
26,10.417941,192.168.11.13,255.255.255.255,UDP,209,,Ÿ,0.031126,"Jan  6, 2024 19:36:21.317019000 JST",7b2273656d616e74696373223a207b22656e74697479223a2022504944222c202262617365656e74697479223a2022616e79222c2022726f6c65223a2022636363222c20227370617469616c223a2022616e79222c202274656d706f72616c223a2022616e79227d2c20226461746170726f7065727479223a207b22666f726d6174223a2022696e616f6b615f70726f6772616d5f73616d706c655f73656d616e746963227d7d,46806  >  7000 Len=167
27,10.42354,192.168.11.8,192.168.11.13,TCP,74,,œ,0.005599,"Jan  6, 2024 19:36:21.322618000 JST",,54884  >  6000 [SYN] Seq=0 Win=64240 Len=0 MSS=1460 SACK_PERM TSval=1308783453 TSecr=0 WS=128
28,10.423687,192.168.11.13,192.168.11.8,TCP,74,0.000147,,0.000147,"Jan  6, 2024 19:36:21.322765000 JST",,"6000  >  54884 [SYN, ACK] Seq=0 Ack=1 Win=65160 Len=0 MSS=1460 SACK_PERM TSval=499456904 TSecr=1308783453 WS=128"
29,10.430372,192.168.11.8,192.168.11.13,TCP,66,0.006685,,0.006685,"Jan  6, 2024 19:36:21.329450000 JST",,54884  >  6000 [ACK] Seq=1 Ack=1 Win=64256 Len=0 TSval=1308783460 TSecr=499456904
30,10.430933,192.168.11.8,192.168.11.13,TCP,93,,,0.000561,"Jan  6, 2024 19:36:21.330011000 JST",,"54884  >  6000 [PSH, ACK] Seq=1 Ack=1 Win=64256 Len=27 TSval=1308783460 TSecr=499456904 [TCP segment of a reassembled PDU]"
31,10.43102,192.168.11.13,192.168.11.8,TCP,66,0.000087,,0.000087,"Jan  6, 2024 19:36:21.330098000 JST",,6000  >  54884 [ACK] Seq=1 Ack=28 Win=65152 Len=0 TSval=499456912 TSecr=1308783460
32,10.431085,192.168.11.8,192.168.11.13,TCP,66,,,0.000065,"Jan  6, 2024 19:36:21.330163000 JST",,"54884  >  6000 [FIN, ACK] Seq=28 Ack=1 Win=64256 Len=0 TSval=1308783460 TSecr=499456904"
33,10.432415,192.168.11.13,192.168.11.8,TCP,66,0.00133,,0.00133,"Jan  6, 2024 19:36:21.331493000 JST",,"6000  >  54884 [FIN, ACK] Seq=1 Ack=29 Win=65152 Len=0 TSval=499456913 TSecr=1308783460"
34,10.438365,192.168.11.8,192.168.11.13,TCP,66,0.00595,,0.00595,"Jan  6, 2024 19:36:21.337443000 JST",,54884  >  6000 [ACK] Seq=29 Ack=2 Win=64256 Len=0 TSval=1308783468 TSecr=499456913
35,19.259354,192.168.11.13,192.168.11.27,TCP,74,,,8.820989,"Jan  6, 2024 19:36:30.158432000 JST",,42480  >  6000 [SYN] Seq=0 Win=64240 Len=0 MSS=1460 SACK_PERM TSval=523872744 TSecr=0 WS=128
36,19.266918,192.168.11.27,192.168.11.13,TCP,74,0.007564,,0.007564,"Jan  6, 2024 19:36:30.165996000 JST",,"6000  >  42480 [SYN, ACK] Seq=0 Ack=1 Win=65160 Len=0 MSS=1460 SACK_PERM TSval=359431476 TSecr=523872744 WS=128"
37,19.267035,192.168.11.13,192.168.11.27,TCP,66,0.000117,,0.000117,"Jan  6, 2024 19:36:30.166113000 JST",,42480  >  6000 [ACK] Seq=1 Ack=1 Win=64256 Len=0 TSval=523872752 TSecr=359431476
38,19.26742,192.168.11.13,192.168.11.27,TCP,93,,,0.000385,"Jan  6, 2024 19:36:30.166498000 JST",,"42480  >  6000 [PSH, ACK] Seq=1 Ack=1 Win=64256 Len=27 TSval=523872752 TSecr=359431476 [TCP segment of a reassembled PDU]"
39,19.267696,192.168.11.13,192.168.11.27,TCP,66,,,0.000276,"Jan  6, 2024 19:36:30.166774000 JST",,"42480  >  6000 [FIN, ACK] Seq=28 Ack=1 Win=64256 Len=0 TSval=523872752 TSecr=359431476"
40,19.273928,192.168.11.27,192.168.11.13,TCP,66,0.006508,,0.006232,"Jan  6, 2024 19:36:30.173006000 JST",,6000  >  42480 [ACK] Seq=1 Ack=28 Win=65152 Len=0 TSval=359431483 TSecr=523872752
41,19.274167,192.168.11.27,192.168.11.13,TCP,66,0.006471,,0.000239,"Jan  6, 2024 19:36:30.173245000 JST",,"6000  >  42480 [FIN, ACK] Seq=1 Ack=29 Win=65152 Len=0 TSval=359431485 TSecr=523872752"
42,19.274211,192.168.11.13,192.168.11.27,TCP,66,0.000044,,0.000044,"Jan  6, 2024 19:36:30.173289000 JST",,42480  >  6000 [ACK] Seq=29 Ack=2 Win=64256 Len=0 TSval=523872759 TSecr=359431485
43,19.307758,192.168.11.13,255.255.255.255,UDP,209,,Ÿ,0.033547,"Jan  6, 2024 19:36:30.206836000 JST",7b2273656d616e74696373223a207b22656e74697479223a2022504944222c202262617365656e74697479223a2022616e79222c2022726f6c65223a2022636363222c20227370617469616c223a2022616e79222c202274656d706f72616c223a2022616e79227d2c20226461746170726f7065727479223a207b22666f726d6174223a2022696e616f6b615f70726f6772616d5f73616d706c655f73656d616e746963227d7d,35844  >  7000 Len=167
44,19.313419,192.168.11.8,192.168.11.13,TCP,74,,œ,0.005661,"Jan  6, 2024 19:36:30.212497000 JST",,60010  >  6000 [SYN] Seq=0 Win=64240 Len=0 MSS=1460 SACK_PERM TSval=1308792343 TSecr=0 WS=128
45,19.313537,192.168.11.13,192.168.11.8,TCP,74,0.000118,,0.000118,"Jan  6, 2024 19:36:30.212615000 JST",,"6000  >  60010 [SYN, ACK] Seq=0 Ack=1 Win=65160 Len=0 MSS=1460 SACK_PERM TSval=499465794 TSecr=1308792343 WS=128"
46,19.32292,192.168.11.8,192.168.11.13,TCP,66,0.009383,,0.009383,"Jan  6, 2024 19:36:30.221998000 JST",,60010  >  6000 [ACK] Seq=1 Ack=1 Win=64256 Len=0 TSval=1308792352 TSecr=499465794
47,19.323418,192.168.11.8,192.168.11.13,TCP,93,,,0.000498,"Jan  6, 2024 19:36:30.222496000 JST",,"60010  >  6000 [PSH, ACK] Seq=1 Ack=1 Win=64256 Len=27 TSval=1308792352 TSecr=499465794 [TCP segment of a reassembled PDU]"
48,19.323516,192.168.11.13,192.168.11.8,TCP,66,0.000098,,0.000098,"Jan  6, 2024 19:36:30.222594000 JST",,6000  >  60010 [ACK] Seq=1 Ack=28 Win=65152 Len=0 TSval=499465804 TSecr=1308792352
49,19.32379,192.168.11.8,192.168.11.13,TCP,66,,,0.000274,"Jan  6, 2024 19:36:30.222868000 JST",,"60010  >  6000 [FIN, ACK] Seq=28 Ack=1 Win=64256 Len=0 TSval=1308792352 TSecr=499465794"
50,19.326559,192.168.11.13,192.168.11.8,TCP,66,0.002769,,0.002769,"Jan  6, 2024 19:36:30.225637000 JST",,"6000  >  60010 [FIN, ACK] Seq=1 Ack=29 Win=65152 Len=0 TSval=499465807 TSecr=1308792352"
51,19.333954,192.168.11.8,192.168.11.13,TCP,66,0.007395,,0.007395,"Jan  6, 2024 19:36:30.233032000 JST",,60010  >  6000 [ACK] Seq=29 Ack=2 Win=64256 Len=0 TSval=1308792363 TSecr=499465807
52,30.155526,192.168.11.13,192.168.11.27,TCP,74,,,10.821572,"Jan  6, 2024 19:36:41.054604000 JST",,33440  >  6000 [SYN] Seq=0 Win=64240 Len=0 MSS=1460 SACK_PERM TSval=523883640 TSecr=0 WS=128
53,30.163032,192.168.11.27,192.168.11.13,TCP,74,0.007506,,0.007506,"Jan  6, 2024 19:36:41.062110000 JST",,"6000  >  33440 [SYN, ACK] Seq=0 Ack=1 Win=65160 Len=0 MSS=1460 SACK_PERM TSval=359442372 TSecr=523883640 WS=128"
54,30.163148,192.168.11.13,192.168.11.27,TCP,66,0.000116,,0.000116,"Jan  6, 2024 19:36:41.062226000 JST",,33440  >  6000 [ACK] Seq=1 Ack=1 Win=64256 Len=0 TSval=523883648 TSecr=359442372
55,30.163326,192.168.11.13,192.168.11.27,TCP,93,,,0.000178,"Jan  6, 2024 19:36:41.062404000 JST",,"33440  >  6000 [PSH, ACK] Seq=1 Ack=1 Win=64256 Len=27 TSval=523883648 TSecr=359442372 [TCP segment of a reassembled PDU]"
56,30.163435,192.168.11.13,192.168.11.27,TCP,66,,,0.000109,"Jan  6, 2024 19:36:41.062513000 JST",,"33440  >  6000 [FIN, ACK] Seq=28 Ack=1 Win=64256 Len=0 TSval=523883648 TSecr=359442372"
57,30.171555,192.168.11.27,192.168.11.13,TCP,66,0.008229,,0.00812,"Jan  6, 2024 19:36:41.070633000 JST",,6000  >  33440 [ACK] Seq=1 Ack=28 Win=65152 Len=0 TSval=359442380 TSecr=523883648
58,30.171949,192.168.11.27,192.168.11.13,TCP,66,0.008514,,0.000394,"Jan  6, 2024 19:36:41.071027000 JST",,"6000  >  33440 [FIN, ACK] Seq=1 Ack=29 Win=65152 Len=0 TSval=359442381 TSecr=523883648"
59,30.171996,192.168.11.13,192.168.11.27,TCP,66,0.000047,,0.000047,"Jan  6, 2024 19:36:41.071074000 JST",,33440  >  6000 [ACK] Seq=29 Ack=2 Win=64256 Len=0 TSval=523883657 TSecr=359442381
60,30.200476,192.168.11.13,255.255.255.255,UDP,209,,Ÿ,0.02848,"Jan  6, 2024 19:36:41.099554000 JST",7b2273656d616e74696373223a207b22656e74697479223a2022504944222c202262617365656e74697479223a2022616e79222c2022726f6c65223a2022636363222c20227370617469616c223a2022616e79222c202274656d706f72616c223a2022616e79227d2c20226461746170726f7065727479223a207b22666f726d6174223a2022696e616f6b615f70726f6772616d5f73616d706c655f73656d616e746963227d7d,34289  >  7000 Len=167
61,30.206254,192.168.11.8,192.168.11.13,TCP,74,,œ,0.005778,"Jan  6, 2024 19:36:41.105332000 JST",,41852  >  6000 [SYN] Seq=0 Win=64240 Len=0 MSS=1460 SACK_PERM TSval=1308803236 TSecr=0 WS=128
62,30.206382,192.168.11.13,192.168.11.8,TCP,74,0.000128,,0.000128,"Jan  6, 2024 19:36:41.105460000 JST",,"6000  >  41852 [SYN, ACK] Seq=0 Ack=1 Win=65160 Len=0 MSS=1460 SACK_PERM TSval=499476687 TSecr=1308803236 WS=128"
63,30.213046,192.168.11.8,192.168.11.13,TCP,66,0.006664,,0.006664,"Jan  6, 2024 19:36:41.112124000 JST",,41852  >  6000 [ACK] Seq=1 Ack=1 Win=64256 Len=0 TSval=1308803243 TSecr=499476687
64,30.213637,192.168.11.8,192.168.11.13,TCP,93,,,0.000591,"Jan  6, 2024 19:36:41.112715000 JST",,"41852  >  6000 [PSH, ACK] Seq=1 Ack=1 Win=64256 Len=27 TSval=1308803243 TSecr=499476687 [TCP segment of a reassembled PDU]"
65,30.21372,192.168.11.13,192.168.11.8,TCP,66,0.000083,,0.000083,"Jan  6, 2024 19:36:41.112798000 JST",,6000  >  41852 [ACK] Seq=1 Ack=28 Win=65152 Len=0 TSval=499476694 TSecr=1308803243
66,30.213892,192.168.11.8,192.168.11.13,TCP,66,,,0.000172,"Jan  6, 2024 19:36:41.112970000 JST",,"41852  >  6000 [FIN, ACK] Seq=28 Ack=1 Win=64256 Len=0 TSval=1308803243 TSecr=499476687"
67,30.215866,192.168.11.13,192.168.11.8,TCP,66,0.001974,,0.001974,"Jan  6, 2024 19:36:41.114944000 JST",,"6000  >  41852 [FIN, ACK] Seq=1 Ack=29 Win=65152 Len=0 TSval=499476697 TSecr=1308803243"
68,30.220591,192.168.11.8,192.168.11.13,TCP,66,0.004725,,0.004725,"Jan  6, 2024 19:36:41.119669000 JST",,41852  >  6000 [ACK] Seq=29 Ack=2 Win=64256 Len=0 TSval=1308803250 TSecr=499476697
69,37.983821,192.168.11.13,192.168.11.27,TCP,74,,,7.76323,"Jan  6, 2024 19:36:48.882899000 JST",,50324  >  6000 [SYN] Seq=0 Win=64240 Len=0 MSS=1460 SACK_PERM TSval=523891469 TSecr=0 WS=128
70,37.991416,192.168.11.27,192.168.11.13,TCP,74,0.007595,,0.007595,"Jan  6, 2024 19:36:48.890494000 JST",,"6000  >  50324 [SYN, ACK] Seq=0 Ack=1 Win=65160 Len=0 MSS=1460 SACK_PERM TSval=359450201 TSecr=523891469 WS=128"
71,37.991521,192.168.11.13,192.168.11.27,TCP,66,0.000105,,0.000105,"Jan  6, 2024 19:36:48.890599000 JST",,50324  >  6000 [ACK] Seq=1 Ack=1 Win=64256 Len=0 TSval=523891476 TSecr=359450201
72,37.9917,192.168.11.13,192.168.11.27,TCP,93,,,0.000179,"Jan  6, 2024 19:36:48.890778000 JST",,"50324  >  6000 [PSH, ACK] Seq=1 Ack=1 Win=64256 Len=27 TSval=523891476 TSecr=359450201 [TCP segment of a reassembled PDU]"
73,37.991826,192.168.11.13,192.168.11.27,TCP,66,,,0.000126,"Jan  6, 2024 19:36:48.890904000 JST",,"50324  >  6000 [FIN, ACK] Seq=28 Ack=1 Win=64256 Len=0 TSval=523891477 TSecr=359450201"
74,37.999692,192.168.11.27,192.168.11.13,TCP,66,0.007992,,0.007866,"Jan  6, 2024 19:36:48.898770000 JST",,6000  >  50324 [ACK] Seq=1 Ack=28 Win=65152 Len=0 TSval=359450208 TSecr=523891476
75,38.00005,192.168.11.27,192.168.11.13,TCP,66,0.008224,,0.000358,"Jan  6, 2024 19:36:48.899128000 JST",,"6000  >  50324 [FIN, ACK] Seq=1 Ack=29 Win=65152 Len=0 TSval=359450210 TSecr=523891477"
76,38.0001,192.168.11.13,192.168.11.27,TCP,66,0.00005,,0.00005,"Jan  6, 2024 19:36:48.899178000 JST",,50324  >  6000 [ACK] Seq=29 Ack=2 Win=64256 Len=0 TSval=523891485 TSecr=359450210
77,38.029558,192.168.11.13,255.255.255.255,UDP,209,,Ÿ,0.029458,"Jan  6, 2024 19:36:48.928636000 JST",7b2273656d616e74696373223a207b22656e74697479223a2022504944222c202262617365656e74697479223a2022616e79222c2022726f6c65223a2022636363222c20227370617469616c223a2022616e79222c202274656d706f72616c223a2022616e79227d2c20226461746170726f7065727479223a207b22666f726d6174223a2022696e616f6b615f70726f6772616d5f73616d706c655f73656d616e746963227d7d,51525  >  7000 Len=167
78,38.035527,192.168.11.8,192.168.11.13,TCP,74,,œ,0.005969,"Jan  6, 2024 19:36:48.934605000 JST",,47330  >  6000 [SYN] Seq=0 Win=64240 Len=0 MSS=1460 SACK_PERM TSval=1308811065 TSecr=0 WS=128
79,38.035672,192.168.11.13,192.168.11.8,TCP,74,0.000145,,0.000145,"Jan  6, 2024 19:36:48.934750000 JST",,"6000  >  47330 [SYN, ACK] Seq=0 Ack=1 Win=65160 Len=0 MSS=1460 SACK_PERM TSval=499484516 TSecr=1308811065 WS=128"
80,38.042536,192.168.11.8,192.168.11.13,TCP,66,0.006864,,0.006864,"Jan  6, 2024 19:36:48.941614000 JST",,47330  >  6000 [ACK] Seq=1 Ack=1 Win=64256 Len=0 TSval=1308811072 TSecr=499484516
81,38.043261,192.168.11.8,192.168.11.13,TCP,93,,,0.000725,"Jan  6, 2024 19:36:48.942339000 JST",,"47330  >  6000 [PSH, ACK] Seq=1 Ack=1 Win=64256 Len=27 TSval=1308811072 TSecr=499484516 [TCP segment of a reassembled PDU]"
82,38.043397,192.168.11.13,192.168.11.8,TCP,66,0.000136,,0.000136,"Jan  6, 2024 19:36:48.942475000 JST",,6000  >  47330 [ACK] Seq=1 Ack=28 Win=65152 Len=0 TSval=499484524 TSecr=1308811072
83,38.043486,192.168.11.8,192.168.11.13,TCP,66,,,0.000089,"Jan  6, 2024 19:36:48.942564000 JST",,"47330  >  6000 [FIN, ACK] Seq=28 Ack=1 Win=64256 Len=0 TSval=1308811072 TSecr=499484516"
84,38.044818,192.168.11.13,192.168.11.8,TCP,66,0.001332,,0.001332,"Jan  6, 2024 19:36:48.943896000 JST",,"6000  >  47330 [FIN, ACK] Seq=1 Ack=29 Win=65152 Len=0 TSval=499484525 TSecr=1308811072"
85,38.051064,192.168.11.8,192.168.11.13,TCP,66,0.006246,,0.006246,"Jan  6, 2024 19:36:48.950142000 JST",,47330  >  6000 [ACK] Seq=29 Ack=2 Win=64256 Len=0 TSval=1308811080 TSecr=499484525
86,45.785471,192.168.11.13,192.168.11.27,TCP,74,,,7.734407,"Jan  6, 2024 19:36:56.684549000 JST",,50334  >  6000 [SYN] Seq=0 Win=64240 Len=0 MSS=1460 SACK_PERM TSval=523899270 TSecr=0 WS=128
87,45.793112,192.168.11.27,192.168.11.13,TCP,74,0.007641,,0.007641,"Jan  6, 2024 19:36:56.692190000 JST",,"6000  >  50334 [SYN, ACK] Seq=0 Ack=1 Win=65160 Len=0 MSS=1460 SACK_PERM TSval=359458003 TSecr=523899270 WS=128"
88,45.793234,192.168.11.13,192.168.11.27,TCP,66,0.000122,,0.000122,"Jan  6, 2024 19:36:56.692312000 JST",,50334  >  6000 [ACK] Seq=1 Ack=1 Win=64256 Len=0 TSval=523899278 TSecr=359458003
89,45.793441,192.168.11.13,192.168.11.27,TCP,93,,,0.000207,"Jan  6, 2024 19:36:56.692519000 JST",,"50334  >  6000 [PSH, ACK] Seq=1 Ack=1 Win=64256 Len=27 TSval=523899278 TSecr=359458003 [TCP segment of a reassembled PDU]"
90,45.793549,192.168.11.13,192.168.11.27,TCP,66,,,0.000108,"Jan  6, 2024 19:36:56.692627000 JST",,"50334  >  6000 [FIN, ACK] Seq=28 Ack=1 Win=64256 Len=0 TSval=523899278 TSecr=359458003"
91,45.800378,192.168.11.27,192.168.11.13,TCP,66,0.006937,,0.006829,"Jan  6, 2024 19:36:56.699456000 JST",,6000  >  50334 [ACK] Seq=1 Ack=28 Win=65152 Len=0 TSval=359458010 TSecr=523899278
92,45.800608,192.168.11.27,192.168.11.13,TCP,66,0.007059,,0.00023,"Jan  6, 2024 19:36:56.699686000 JST",,"6000  >  50334 [FIN, ACK] Seq=1 Ack=29 Win=65152 Len=0 TSval=359458012 TSecr=523899278"
93,45.800662,192.168.11.13,192.168.11.27,TCP,66,0.000054,,0.000054,"Jan  6, 2024 19:36:56.699740000 JST",,50334  >  6000 [ACK] Seq=29 Ack=2 Win=64256 Len=0 TSval=523899285 TSecr=359458012
94,45.834049,192.168.11.13,255.255.255.255,UDP,209,,Ÿ,0.033387,"Jan  6, 2024 19:36:56.733127000 JST",7b2273656d616e74696373223a207b22656e74697479223a2022504944222c202262617365656e74697479223a2022616e79222c2022726f6c65223a2022636363222c20227370617469616c223a2022616e79222c202274656d706f72616c223a2022616e79227d2c20226461746170726f7065727479223a207b22666f726d6174223a2022696e616f6b615f70726f6772616d5f73616d706c655f73656d616e746963227d7d,49227  >  7000 Len=167
95,45.839522,192.168.11.8,192.168.11.13,TCP,74,,œ,0.005473,"Jan  6, 2024 19:36:56.738600000 JST",,43674  >  6000 [SYN] Seq=0 Win=64240 Len=0 MSS=1460 SACK_PERM TSval=1308818869 TSecr=0 WS=128
96,45.839652,192.168.11.13,192.168.11.8,TCP,74,0.00013,,0.00013,"Jan  6, 2024 19:36:56.738730000 JST",,"6000  >  43674 [SYN, ACK] Seq=0 Ack=1 Win=65160 Len=0 MSS=1460 SACK_PERM TSval=499492320 TSecr=1308818869 WS=128"
97,45.846352,192.168.11.8,192.168.11.13,TCP,66,0.0067,,0.0067,"Jan  6, 2024 19:36:56.745430000 JST",,43674  >  6000 [ACK] Seq=1 Ack=1 Win=64256 Len=0 TSval=1308818876 TSecr=499492320
98,45.846852,192.168.11.8,192.168.11.13,TCP,93,,,0.0005,"Jan  6, 2024 19:36:56.745930000 JST",,"43674  >  6000 [PSH, ACK] Seq=1 Ack=1 Win=64256 Len=27 TSval=1308818876 TSecr=499492320 [TCP segment of a reassembled PDU]"
99,45.84693,192.168.11.13,192.168.11.8,TCP,66,0.000078,,0.000078,"Jan  6, 2024 19:36:56.746008000 JST",,6000  >  43674 [ACK] Seq=1 Ack=28 Win=65152 Len=0 TSval=499492328 TSecr=1308818876
100,45.846992,192.168.11.8,192.168.11.13,TCP,66,,,0.000062,"Jan  6, 2024 19:36:56.746070000 JST",,"43674  >  6000 [FIN, ACK] Seq=28 Ack=1 Win=64256 Len=0 TSval=1308818876 TSecr=499492320"
101,45.848025,192.168.11.13,192.168.11.8,TCP,66,0.001033,,0.001033,"Jan  6, 2024 19:36:56.747103000 JST",,"6000  >  43674 [FIN, ACK] Seq=1 Ack=29 Win=65152 Len=0 TSval=499492329 TSecr=1308818876"
102,45.854091,192.168.11.8,192.168.11.13,TCP,66,0.006066,,0.006066,"Jan  6, 2024 19:36:56.753169000 JST",,43674  >  6000 [ACK] Seq=29 Ack=2 Win=64256 Len=0 TSval=1308818883 TSecr=499492329
103,53.648245,192.168.11.13,192.168.11.27,TCP,74,,,7.794154,"Jan  6, 2024 19:37:04.547323000 JST",,46374  >  6000 [SYN] Seq=0 Win=64240 Len=0 MSS=1460 SACK_PERM TSval=523907133 TSecr=0 WS=128
104,53.655406,192.168.11.27,192.168.11.13,TCP,74,0.007161,,0.007161,"Jan  6, 2024 19:37:04.554484000 JST",,"6000  >  46374 [SYN, ACK] Seq=0 Ack=1 Win=65160 Len=0 MSS=1460 SACK_PERM TSval=359465865 TSecr=523907133 WS=128"
105,53.655533,192.168.11.13,192.168.11.27,TCP,66,0.000127,,0.000127,"Jan  6, 2024 19:37:04.554611000 JST",,46374  >  6000 [ACK] Seq=1 Ack=1 Win=64256 Len=0 TSval=523907140 TSecr=359465865
106,53.655719,192.168.11.13,192.168.11.27,TCP,93,,,0.000186,"Jan  6, 2024 19:37:04.554797000 JST",,"46374  >  6000 [PSH, ACK] Seq=1 Ack=1 Win=64256 Len=27 TSval=523907140 TSecr=359465865 [TCP segment of a reassembled PDU]"
107,53.655844,192.168.11.13,192.168.11.27,TCP,66,,,0.000125,"Jan  6, 2024 19:37:04.554922000 JST",,"46374  >  6000 [FIN, ACK] Seq=28 Ack=1 Win=64256 Len=0 TSval=523907141 TSecr=359465865"
108,53.663329,192.168.11.27,192.168.11.13,TCP,66,0.00761,,0.007485,"Jan  6, 2024 19:37:04.562407000 JST",,6000  >  46374 [ACK] Seq=1 Ack=28 Win=65152 Len=0 TSval=359465873 TSecr=523907140
109,53.663744,192.168.11.27,192.168.11.13,TCP,66,0.0079,,0.000415,"Jan  6, 2024 19:37:04.562822000 JST",,"6000  >  46374 [FIN, ACK] Seq=1 Ack=29 Win=65152 Len=0 TSval=359465874 TSecr=523907141"
110,53.663799,192.168.11.13,192.168.11.27,TCP,66,0.000055,,0.000055,"Jan  6, 2024 19:37:04.562877000 JST",,46374  >  6000 [ACK] Seq=29 Ack=2 Win=64256 Len=0 TSval=523907148 TSecr=359465874
111,53.692976,192.168.11.13,255.255.255.255,UDP,209,,Ÿ,0.029177,"Jan  6, 2024 19:37:04.592054000 JST",7b2273656d616e74696373223a207b22656e74697479223a2022504944222c202262617365656e74697479223a2022616e79222c2022726f6c65223a2022636363222c20227370617469616c223a2022616e79222c202274656d706f72616c223a2022616e79227d2c20226461746170726f7065727479223a207b22666f726d6174223a2022696e616f6b615f70726f6772616d5f73616d706c655f73656d616e746963227d7d,54138  >  7000 Len=167
112,53.710237,192.168.11.8,192.168.11.13,TCP,74,,œ,0.017261,"Jan  6, 2024 19:37:04.609315000 JST",,55316  >  6000 [SYN] Seq=0 Win=64240 Len=0 MSS=1460 SACK_PERM TSval=1308826728 TSecr=0 WS=128
113,53.710422,192.168.11.13,192.168.11.8,TCP,74,0.000185,,0.000185,"Jan  6, 2024 19:37:04.609500000 JST",,"6000  >  55316 [SYN, ACK] Seq=0 Ack=1 Win=65160 Len=0 MSS=1460 SACK_PERM TSval=499500191 TSecr=1308826728 WS=128"
114,53.717604,192.168.11.8,192.168.11.13,TCP,66,0.007182,,0.007182,"Jan  6, 2024 19:37:04.616682000 JST",,55316  >  6000 [ACK] Seq=1 Ack=1 Win=64256 Len=0 TSval=1308826747 TSecr=499500191
115,53.718231,192.168.11.8,192.168.11.13,TCP,93,,,0.000627,"Jan  6, 2024 19:37:04.617309000 JST",,"55316  >  6000 [PSH, ACK] Seq=1 Ack=1 Win=64256 Len=27 TSval=1308826747 TSecr=499500191 [TCP segment of a reassembled PDU]"
116,53.718317,192.168.11.13,192.168.11.8,TCP,66,0.000086,,0.000086,"Jan  6, 2024 19:37:04.617395000 JST",,6000  >  55316 [ACK] Seq=1 Ack=28 Win=65152 Len=0 TSval=499500199 TSecr=1308826747
117,53.718391,192.168.11.8,192.168.11.13,TCP,66,,,0.000074,"Jan  6, 2024 19:37:04.617469000 JST",,"55316  >  6000 [FIN, ACK] Seq=28 Ack=1 Win=64256 Len=0 TSval=1308826747 TSecr=499500191"
118,53.719722,192.168.11.13,192.168.11.8,TCP,66,0.001331,,0.001331,"Jan  6, 2024 19:37:04.618800000 JST",,"6000  >  55316 [FIN, ACK] Seq=1 Ack=29 Win=65152 Len=0 TSval=499500200 TSecr=1308826747"
119,53.725474,192.168.11.8,192.168.11.13,TCP,66,0.005752,,0.005752,"Jan  6, 2024 19:37:04.624552000 JST",,55316  >  6000 [ACK] Seq=29 Ack=2 Win=64256 Len=0 TSval=1308826755 TSecr=499500200
120,61.947391,192.168.11.13,192.168.11.27,TCP,74,,,8.221917,"Jan  6, 2024 19:37:12.846469000 JST",,33810  >  6000 [SYN] Seq=0 Win=64240 Len=0 MSS=1460 SACK_PERM TSval=523915432 TSecr=0 WS=128
121,61.954101,192.168.11.27,192.168.11.13,TCP,74,0.00671,,0.00671,"Jan  6, 2024 19:37:12.853179000 JST",,"6000  >  33810 [SYN, ACK] Seq=0 Ack=1 Win=65160 Len=0 MSS=1460 SACK_PERM TSval=359474164 TSecr=523915432 WS=128"
122,61.954209,192.168.11.13,192.168.11.27,TCP,66,0.000108,,0.000108,"Jan  6, 2024 19:37:12.853287000 JST",,33810  >  6000 [ACK] Seq=1 Ack=1 Win=64256 Len=0 TSval=523915439 TSecr=359474164
123,61.954365,192.168.11.13,192.168.11.27,TCP,93,,,0.000156,"Jan  6, 2024 19:37:12.853443000 JST",,"33810  >  6000 [PSH, ACK] Seq=1 Ack=1 Win=64256 Len=27 TSval=523915439 TSecr=359474164 [TCP segment of a reassembled PDU]"
124,61.954463,192.168.11.13,192.168.11.27,TCP,66,,,0.000098,"Jan  6, 2024 19:37:12.853541000 JST",,"33810  >  6000 [FIN, ACK] Seq=28 Ack=1 Win=64256 Len=0 TSval=523915439 TSecr=359474164"
125,61.96173,192.168.11.27,192.168.11.13,TCP,66,0.007365,,0.007267,"Jan  6, 2024 19:37:12.860808000 JST",,6000  >  33810 [ACK] Seq=1 Ack=28 Win=65152 Len=0 TSval=359474171 TSecr=523915439
126,61.961995,192.168.11.27,192.168.11.13,TCP,66,0.007532,,0.000265,"Jan  6, 2024 19:37:12.861073000 JST",,"6000  >  33810 [FIN, ACK] Seq=1 Ack=29 Win=65152 Len=0 TSval=359474173 TSecr=523915439"
127,61.962046,192.168.11.13,192.168.11.27,TCP,66,0.000051,,0.000051,"Jan  6, 2024 19:37:12.861124000 JST",,33810  >  6000 [ACK] Seq=29 Ack=2 Win=64256 Len=0 TSval=523915447 TSecr=359474173
128,61.993132,192.168.11.13,255.255.255.255,UDP,209,,Ÿ,0.031086,"Jan  6, 2024 19:37:12.892210000 JST",7b2273656d616e74696373223a207b22656e74697479223a2022504944222c202262617365656e74697479223a2022616e79222c2022726f6c65223a2022636363222c20227370617469616c223a2022616e79222c202274656d706f72616c223a2022616e79227d2c20226461746170726f7065727479223a207b22666f726d6174223a2022696e616f6b615f70726f6772616d5f73616d706c655f73656d616e746963227d7d,44237  >  7000 Len=167
129,61.999696,192.168.11.8,192.168.11.13,TCP,74,,œ,0.006564,"Jan  6, 2024 19:37:12.898774000 JST",,48068  >  6000 [SYN] Seq=0 Win=64240 Len=0 MSS=1460 SACK_PERM TSval=1308835028 TSecr=0 WS=128
130,61.999836,192.168.11.13,192.168.11.8,TCP,74,0.00014,,0.00014,"Jan  6, 2024 19:37:12.898914000 JST",,"6000  >  48068 [SYN, ACK] Seq=0 Ack=1 Win=65160 Len=0 MSS=1460 SACK_PERM TSval=499508481 TSecr=1308835028 WS=128"
131,62.006534,192.168.11.8,192.168.11.13,TCP,66,0.006698,,0.006698,"Jan  6, 2024 19:37:12.905612000 JST",,48068  >  6000 [ACK] Seq=1 Ack=1 Win=64256 Len=0 TSval=1308835036 TSecr=499508481
132,62.007105,192.168.11.8,192.168.11.13,TCP,93,,,0.000571,"Jan  6, 2024 19:37:12.906183000 JST",,"48068  >  6000 [PSH, ACK] Seq=1 Ack=1 Win=64256 Len=27 TSval=1308835036 TSecr=499508481 [TCP segment of a reassembled PDU]"
133,62.007212,192.168.11.13,192.168.11.8,TCP,66,0.000107,,0.000107,"Jan  6, 2024 19:37:12.906290000 JST",,6000  >  48068 [ACK] Seq=1 Ack=28 Win=65152 Len=0 TSval=499508488 TSecr=1308835036
134,62.007282,192.168.11.8,192.168.11.13,TCP,66,,,0.00007,"Jan  6, 2024 19:37:12.906360000 JST",,"48068  >  6000 [FIN, ACK] Seq=28 Ack=1 Win=64256 Len=0 TSval=1308835036 TSecr=499508481"
135,62.008517,192.168.11.13,192.168.11.8,TCP,66,0.001235,,0.001235,"Jan  6, 2024 19:37:12.907595000 JST",,"6000  >  48068 [FIN, ACK] Seq=1 Ack=29 Win=65152 Len=0 TSval=499508489 TSecr=1308835036"
136,62.014681,192.168.11.8,192.168.11.13,TCP,66,0.006164,,0.006164,"Jan  6, 2024 19:37:12.913759000 JST",,48068  >  6000 [ACK] Seq=29 Ack=2 Win=64256 Len=0 TSval=1308835044 TSecr=499508489
137,71.853699,192.168.11.13,192.168.11.27,TCP,74,,,9.839018,"Jan  6, 2024 19:37:22.752777000 JST",,47238  >  6000 [SYN] Seq=0 Win=64240 Len=0 MSS=1460 SACK_PERM TSval=523925338 TSecr=0 WS=128
138,71.860404,192.168.11.27,192.168.11.13,TCP,74,0.006705,,0.006705,"Jan  6, 2024 19:37:22.759482000 JST",,"6000  >  47238 [SYN, ACK] Seq=0 Ack=1 Win=65160 Len=0 MSS=1460 SACK_PERM TSval=359484070 TSecr=523925338 WS=128"
139,71.860521,192.168.11.13,192.168.11.27,TCP,66,0.000117,,0.000117,"Jan  6, 2024 19:37:22.759599000 JST",,47238  >  6000 [ACK] Seq=1 Ack=1 Win=64256 Len=0 TSval=523925345 TSecr=359484070
140,71.860671,192.168.11.13,192.168.11.27,TCP,93,,,0.00015,"Jan  6, 2024 19:37:22.759749000 JST",,"47238  >  6000 [PSH, ACK] Seq=1 Ack=1 Win=64256 Len=27 TSval=523925345 TSecr=359484070 [TCP segment of a reassembled PDU]"
141,71.860794,192.168.11.13,192.168.11.27,TCP,66,,,0.000123,"Jan  6, 2024 19:37:22.759872000 JST",,"47238  >  6000 [FIN, ACK] Seq=28 Ack=1 Win=64256 Len=0 TSval=523925346 TSecr=359484070"
142,71.867527,192.168.11.27,192.168.11.13,TCP,66,0.006856,,0.006733,"Jan  6, 2024 19:37:22.766605000 JST",,6000  >  47238 [ACK] Seq=1 Ack=28 Win=65152 Len=0 TSval=359484077 TSecr=523925345
143,71.867754,192.168.11.27,192.168.11.13,TCP,66,0.00696,,0.000227,"Jan  6, 2024 19:37:22.766832000 JST",,"6000  >  47238 [FIN, ACK] Seq=1 Ack=29 Win=65152 Len=0 TSval=359484079 TSecr=523925346"
144,71.867799,192.168.11.13,192.168.11.27,TCP,66,0.000045,,0.000045,"Jan  6, 2024 19:37:22.766877000 JST",,47238  >  6000 [ACK] Seq=29 Ack=2 Win=64256 Len=0 TSval=523925353 TSecr=359484079
145,71.897728,192.168.11.13,255.255.255.255,UDP,209,,Ÿ,0.029929,"Jan  6, 2024 19:37:22.796806000 JST",7b2273656d616e74696373223a207b22656e74697479223a2022504944222c202262617365656e74697479223a2022616e79222c2022726f6c65223a2022636363222c20227370617469616c223a2022616e79222c202274656d706f72616c223a2022616e79227d2c20226461746170726f7065727479223a207b22666f726d6174223a2022696e616f6b615f70726f6772616d5f73616d706c655f73656d616e746963227d7d,36694  >  7000 Len=167
146,71.906867,192.168.11.8,192.168.11.13,TCP,74,,œ,0.009139,"Jan  6, 2024 19:37:22.805945000 JST",,48096  >  6000 [SYN] Seq=0 Win=64240 Len=0 MSS=1460 SACK_PERM TSval=1308844933 TSecr=0 WS=128
147,71.907002,192.168.11.13,192.168.11.8,TCP,74,0.000135,,0.000135,"Jan  6, 2024 19:37:22.806080000 JST",,"6000  >  48096 [SYN, ACK] Seq=0 Ack=1 Win=65160 Len=0 MSS=1460 SACK_PERM TSval=499518388 TSecr=1308844933 WS=128"
148,71.913597,192.168.11.8,192.168.11.13,TCP,66,0.006595,,0.006595,"Jan  6, 2024 19:37:22.812675000 JST",,48096  >  6000 [ACK] Seq=1 Ack=1 Win=64256 Len=0 TSval=1308844943 TSecr=499518388
149,71.914211,192.168.11.8,192.168.11.13,TCP,93,,,0.000614,"Jan  6, 2024 19:37:22.813289000 JST",,"48096  >  6000 [PSH, ACK] Seq=1 Ack=1 Win=64256 Len=27 TSval=1308844943 TSecr=499518388 [TCP segment of a reassembled PDU]"
150,71.914347,192.168.11.13,192.168.11.8,TCP,66,0.000136,,0.000136,"Jan  6, 2024 19:37:22.813425000 JST",,6000  >  48096 [ACK] Seq=1 Ack=28 Win=65152 Len=0 TSval=499518395 TSecr=1308844943
151,71.914412,192.168.11.8,192.168.11.13,TCP,66,,,0.000065,"Jan  6, 2024 19:37:22.813490000 JST",,"48096  >  6000 [FIN, ACK] Seq=28 Ack=1 Win=64256 Len=0 TSval=1308844943 TSecr=499518388"
152,71.915387,192.168.11.13,192.168.11.8,TCP,66,0.000975,,0.000975,"Jan  6, 2024 19:37:22.814465000 JST",,"6000  >  48096 [FIN, ACK] Seq=1 Ack=29 Win=65152 Len=0 TSval=499518396 TSecr=1308844943"
153,71.92166,192.168.11.8,192.168.11.13,TCP,66,0.006273,,0.006273,"Jan  6, 2024 19:37:22.820738000 JST",,48096  >  6000 [ACK] Seq=29 Ack=2 Win=64256 Len=0 TSval=1308844951 TSecr=499518396
154,82.762766,192.168.11.13,192.168.11.27,TCP,74,,,10.841106,"Jan  6, 2024 19:37:33.661844000 JST",,56492  >  6000 [SYN] Seq=0 Win=64240 Len=0 MSS=1460 SACK_PERM TSval=523936247 TSecr=0 WS=128
155,82.769481,192.168.11.27,192.168.11.13,TCP,74,0.006715,,0.006715,"Jan  6, 2024 19:37:33.668559000 JST",,"6000  >  56492 [SYN, ACK] Seq=0 Ack=1 Win=65160 Len=0 MSS=1460 SACK_PERM TSval=359494979 TSecr=523936247 WS=128"
156,82.769594,192.168.11.13,192.168.11.27,TCP,66,0.000113,,0.000113,"Jan  6, 2024 19:37:33.668672000 JST",,56492  >  6000 [ACK] Seq=1 Ack=1 Win=64256 Len=0 TSval=523936254 TSecr=359494979
157,82.769802,192.168.11.13,192.168.11.27,TCP,93,,,0.000208,"Jan  6, 2024 19:37:33.668880000 JST",,"56492  >  6000 [PSH, ACK] Seq=1 Ack=1 Win=64256 Len=27 TSval=523936254 TSecr=359494979 [TCP segment of a reassembled PDU]"
158,82.769906,192.168.11.13,192.168.11.27,TCP,66,,,0.000104,"Jan  6, 2024 19:37:33.668984000 JST",,"56492  >  6000 [FIN, ACK] Seq=28 Ack=1 Win=64256 Len=0 TSval=523936255 TSecr=359494979"
159,82.77726,192.168.11.27,192.168.11.13,TCP,66,0.007458,,0.007354,"Jan  6, 2024 19:37:33.676338000 JST",,6000  >  56492 [ACK] Seq=1 Ack=28 Win=65152 Len=0 TSval=359494987 TSecr=523936254
160,82.777486,192.168.11.27,192.168.11.13,TCP,66,0.00758,,0.000226,"Jan  6, 2024 19:37:33.676564000 JST",,"6000  >  56492 [FIN, ACK] Seq=1 Ack=29 Win=65152 Len=0 TSval=359494989 TSecr=523936255"
161,82.777527,192.168.11.13,192.168.11.27,TCP,66,0.000041,,0.000041,"Jan  6, 2024 19:37:33.676605000 JST",,56492  >  6000 [ACK] Seq=29 Ack=2 Win=64256 Len=0 TSval=523936262 TSecr=359494989
162,82.810696,192.168.11.13,255.255.255.255,UDP,209,,Ÿ,0.033169,"Jan  6, 2024 19:37:33.709774000 JST",7b2273656d616e74696373223a207b22656e74697479223a2022504944222c202262617365656e74697479223a2022616e79222c2022726f6c65223a2022636363222c20227370617469616c223a2022616e79222c202274656d706f72616c223a2022616e79227d2c20226461746170726f7065727479223a207b22666f726d6174223a2022696e616f6b615f70726f6772616d5f73616d706c655f73656d616e746963227d7d,52115  >  7000 Len=167
163,82.820633,192.168.11.8,192.168.11.13,TCP,74,,œ,0.009937,"Jan  6, 2024 19:37:33.719711000 JST",,50348  >  6000 [SYN] Seq=0 Win=64240 Len=0 MSS=1460 SACK_PERM TSval=1308855846 TSecr=0 WS=128
164,82.820785,192.168.11.13,192.168.11.8,TCP,74,0.000152,,0.000152,"Jan  6, 2024 19:37:33.719863000 JST",,"6000  >  50348 [SYN, ACK] Seq=0 Ack=1 Win=65160 Len=0 MSS=1460 SACK_PERM TSval=499529301 TSecr=1308855846 WS=128"
165,82.827756,192.168.11.8,192.168.11.13,TCP,66,0.006971,,0.006971,"Jan  6, 2024 19:37:33.726834000 JST",,50348  >  6000 [ACK] Seq=1 Ack=1 Win=64256 Len=0 TSval=1308855857 TSecr=499529301
166,82.828414,192.168.11.8,192.168.11.13,TCP,93,,,0.000658,"Jan  6, 2024 19:37:33.727492000 JST",,"50348  >  6000 [PSH, ACK] Seq=1 Ack=1 Win=64256 Len=27 TSval=1308855857 TSecr=499529301 [TCP segment of a reassembled PDU]"
167,82.828531,192.168.11.13,192.168.11.8,TCP,66,0.000117,,0.000117,"Jan  6, 2024 19:37:33.727609000 JST",,6000  >  50348 [ACK] Seq=1 Ack=28 Win=65152 Len=0 TSval=499529309 TSecr=1308855857
168,82.828624,192.168.11.8,192.168.11.13,TCP,66,,,0.000093,"Jan  6, 2024 19:37:33.727702000 JST",,"50348  >  6000 [FIN, ACK] Seq=28 Ack=1 Win=64256 Len=0 TSval=1308855857 TSecr=499529301"
169,82.829846,192.168.11.13,192.168.11.8,TCP,66,0.001222,,0.001222,"Jan  6, 2024 19:37:33.728924000 JST",,"6000  >  50348 [FIN, ACK] Seq=1 Ack=29 Win=65152 Len=0 TSval=499529310 TSecr=1308855857"
170,82.835168,192.168.11.8,192.168.11.13,TCP,66,0.005322,,0.005322,"Jan  6, 2024 19:37:33.734246000 JST",,50348  >  6000 [ACK] Seq=29 Ack=2 Win=64256 Len=0 TSval=1308855865 TSecr=499529310
171,114.944779,192.168.11.13,192.168.11.27,TCP,74,,,32.109611,"Jan  6, 2024 19:38:05.843857000 JST",,35270  >  6000 [SYN] Seq=0 Win=64240 Len=0 MSS=1460 SACK_PERM TSval=523968429 TSecr=0 WS=128
172,114.951435,192.168.11.27,192.168.11.13,TCP,74,0.006656,,0.006656,"Jan  6, 2024 19:38:05.850513000 JST",,"6000  >  35270 [SYN, ACK] Seq=0 Ack=1 Win=65160 Len=0 MSS=1460 SACK_PERM TSval=359527161 TSecr=523968429 WS=128"
173,114.951542,192.168.11.13,192.168.11.27,TCP,66,0.000107,,0.000107,"Jan  6, 2024 19:38:05.850620000 JST",,35270  >  6000 [ACK] Seq=1 Ack=1 Win=64256 Len=0 TSval=523968436 TSecr=359527161
174,114.951668,192.168.11.13,192.168.11.27,TCP,93,,,0.000126,"Jan  6, 2024 19:38:05.850746000 JST",,"35270  >  6000 [PSH, ACK] Seq=1 Ack=1 Win=64256 Len=27 TSval=523968436 TSecr=359527161 [TCP segment of a reassembled PDU]"
175,114.951779,192.168.11.13,192.168.11.27,TCP,66,,,0.000111,"Jan  6, 2024 19:38:05.850857000 JST",,"35270  >  6000 [FIN, ACK] Seq=28 Ack=1 Win=64256 Len=0 TSval=523968437 TSecr=359527161"
176,114.958422,192.168.11.27,192.168.11.13,TCP,66,0.006754,,0.006643,"Jan  6, 2024 19:38:05.857500000 JST",,6000  >  35270 [ACK] Seq=1 Ack=28 Win=65152 Len=0 TSval=359527168 TSecr=523968436
177,114.958788,192.168.11.27,192.168.11.13,TCP,66,0.007009,,0.000366,"Jan  6, 2024 19:38:05.857866000 JST",,"6000  >  35270 [FIN, ACK] Seq=1 Ack=29 Win=65152 Len=0 TSval=359527170 TSecr=523968437"
178,114.958832,192.168.11.13,192.168.11.27,TCP,66,0.000044,,0.000044,"Jan  6, 2024 19:38:05.857910000 JST",,35270  >  6000 [ACK] Seq=29 Ack=2 Win=64256 Len=0 TSval=523968444 TSecr=359527170
179,114.986369,192.168.11.13,255.255.255.255,UDP,209,,Ÿ,0.027537,"Jan  6, 2024 19:38:05.885447000 JST",7b2273656d616e74696373223a207b22656e74697479223a2022504944222c202262617365656e74697479223a2022616e79222c2022726f6c65223a2022636363222c20227370617469616c223a2022616e79222c202274656d706f72616c223a2022616e79227d2c20226461746170726f7065727479223a207b22666f726d6174223a2022696e616f6b615f70726f6772616d5f73616d706c655f73656d616e746963227d7d,47036  >  7000 Len=167
180,114.991947,192.168.11.8,192.168.11.13,TCP,74,,œ,0.005578,"Jan  6, 2024 19:38:05.891025000 JST",,47798  >  6000 [SYN] Seq=0 Win=64240 Len=0 MSS=1460 SACK_PERM TSval=1308888022 TSecr=0 WS=128
181,114.992043,192.168.11.13,192.168.11.8,TCP,74,0.000096,,0.000096,"Jan  6, 2024 19:38:05.891121000 JST",,"6000  >  47798 [SYN, ACK] Seq=0 Ack=1 Win=65160 Len=0 MSS=1460 SACK_PERM TSval=499561473 TSecr=1308888022 WS=128"
182,115.0062,192.168.11.8,192.168.11.13,TCP,66,0.014157,,0.014157,"Jan  6, 2024 19:38:05.905278000 JST",,47798  >  6000 [ACK] Seq=1 Ack=1 Win=64256 Len=0 TSval=1308888028 TSecr=499561473
183,115.006646,192.168.11.8,192.168.11.13,TCP,93,,,0.000446,"Jan  6, 2024 19:38:05.905724000 JST",,"47798  >  6000 [PSH, ACK] Seq=1 Ack=1 Win=64256 Len=27 TSval=1308888028 TSecr=499561473 [TCP segment of a reassembled PDU]"
184,115.006702,192.168.11.13,192.168.11.8,TCP,66,0.000056,,0.000056,"Jan  6, 2024 19:38:05.905780000 JST",,6000  >  47798 [ACK] Seq=1 Ack=28 Win=65152 Len=0 TSval=499561487 TSecr=1308888028
185,115.006765,192.168.11.8,192.168.11.13,TCP,66,,,0.000063,"Jan  6, 2024 19:38:05.905843000 JST",,"47798  >  6000 [FIN, ACK] Seq=28 Ack=1 Win=64256 Len=0 TSval=1308888028 TSecr=499561473"
186,115.007513,192.168.11.13,192.168.11.8,TCP,66,0.000748,,0.000748,"Jan  6, 2024 19:38:05.906591000 JST",,"6000  >  47798 [FIN, ACK] Seq=1 Ack=29 Win=65152 Len=0 TSval=499561488 TSecr=1308888028"
