No.,Time,Source,Destination,Protocol,Length,The RTT to ACK the segment was,XXX,Time delta from previous captured frame,Arrival Time,Data,Info
1,0,192.168.11.8,192.168.11.13,TCP,74,,,0,"Jan  6, 2024 19:36:10.962371000 JST",,33384  >  6000 [SYN] Seq=0 Win=64240 Len=0 MSS=1460 SACK_PERM TSval=1308773088 TSecr=0 WS=128
2,0.006758,192.168.11.13,192.168.11.8,TCP,74,0.006758,,0.006758,"Jan  6, 2024 19:36:10.969129000 JST",,"6000  >  33384 [SYN, ACK] Seq=0 Ack=1 Win=65160 Len=0 MSS=1460 SACK_PERM TSval=499446543 TSecr=1308773088 WS=128"
3,0.006877,192.168.11.8,192.168.11.13,TCP,66,0.000119,,0.000119,"Jan  6, 2024 19:36:10.969248000 JST",,33384  >  6000 [ACK] Seq=1 Ack=1 Win=64256 Len=0 TSval=1308773098 TSecr=499446543
4,0.007056,192.168.11.8,192.168.11.13,TCP,93,,,0.000179,"Jan  6, 2024 19:36:10.969427000 JST",,"33384  >  6000 [PSH, ACK] Seq=1 Ack=1 Win=64256 Len=27 TSval=1308773098 TSecr=499446543 [TCP segment of a reassembled PDU]"
5,0.007183,192.168.11.8,192.168.11.13,TCP,66,,,0.000127,"Jan  6, 2024 19:36:10.969554000 JST",,"33384  >  6000 [FIN, ACK] Seq=28 Ack=1 Win=64256 Len=0 TSval=1308773099 TSecr=499446543"
6,0.01448,192.168.11.13,192.168.11.8,TCP,66,0.007424,,0.007297,"Jan  6, 2024 19:36:10.976851000 JST",,6000  >  33384 [ACK] Seq=1 Ack=28 Win=65152 Len=0 TSval=499446550 TSecr=1308773098
7,0.014854,192.168.11.13,192.168.11.8,TCP,66,0.007671,,0.000374,"Jan  6, 2024 19:36:10.977225000 JST",,"6000  >  33384 [FIN, ACK] Seq=1 Ack=29 Win=65152 Len=0 TSval=499446552 TSecr=1308773099"
8,0.014905,192.168.11.8,192.168.11.13,TCP,66,0.000051,,0.000051,"Jan  6, 2024 19:36:10.977276000 JST",,33384  >  6000 [ACK] Seq=29 Ack=2 Win=64256 Len=0 TSval=1308773106 TSecr=499446552
9,0.044554,192.168.11.8,255.255.255.255,UDP,209,,Åü,0.029649,"Jan  6, 2024 19:36:11.006925000 JST",7b2273656d616e74696373223a207b22656e74697479223a2022504944222c202262617365656e74697479223a2022616e79222c2022726f6c65223a2022646464222c20227370617469616c223a2022616e79222c202274656d706f72616c223a2022616e79227d2c20226461746170726f7065727479223a207b22666f726d6174223a2022696e616f6b615f70726f6772616d5f73616d706c655f73656d616e746963227d7d,51323  >  7000 Len=167
10,0.053205,192.168.11.23,192.168.11.8,TCP,74,,Åú,0.008651,"Jan  6, 2024 19:36:11.015576000 JST",,41384  >  6000 [SYN] Seq=0 Win=64240 Len=0 MSS=1460 SACK_PERM TSval=2381973557 TSecr=0 WS=128
11,0.053355,192.168.11.8,192.168.11.23,TCP,74,0.00015,,0.00015,"Jan  6, 2024 19:36:11.015726000 JST",,"6000  >  41384 [SYN, ACK] Seq=0 Ack=1 Win=65160 Len=0 MSS=1460 SACK_PERM TSval=3378229749 TSecr=2381973557 WS=128"
12,0.05994,192.168.11.23,192.168.11.8,TCP,66,0.006585,,0.006585,"Jan  6, 2024 19:36:11.022311000 JST",,41384  >  6000 [ACK] Seq=1 Ack=1 Win=64256 Len=0 TSval=2381973567 TSecr=3378229749
13,0.060534,192.168.11.23,192.168.11.8,TCP,93,,,0.000594,"Jan  6, 2024 19:36:11.022905000 JST",,"41384  >  6000 [PSH, ACK] Seq=1 Ack=1 Win=64256 Len=27 TSval=2381973567 TSecr=3378229749 [TCP segment of a reassembled PDU]"
14,0.060627,192.168.11.8,192.168.11.23,TCP,66,0.000093,,0.000093,"Jan  6, 2024 19:36:11.022998000 JST",,6000  >  41384 [ACK] Seq=1 Ack=28 Win=65152 Len=0 TSval=3378229756 TSecr=2381973567
15,0.060696,192.168.11.23,192.168.11.8,TCP,66,,,0.000069,"Jan  6, 2024 19:36:11.023067000 JST",,"41384  >  6000 [FIN, ACK] Seq=28 Ack=1 Win=64256 Len=0 TSval=2381973567 TSecr=3378229749"
16,0.062236,192.168.11.8,192.168.11.23,TCP,66,0.00154,,0.00154,"Jan  6, 2024 19:36:11.024607000 JST",,"6000  >  41384 [FIN, ACK] Seq=1 Ack=29 Win=65152 Len=0 TSval=3378229758 TSecr=2381973567"
17,0.068693,192.168.11.23,192.168.11.8,TCP,66,0.006457,,0.006457,"Jan  6, 2024 19:36:11.031064000 JST",,41384  >  6000 [ACK] Seq=29 Ack=2 Win=64256 Len=0 TSval=2381973575 TSecr=3378229758
18,10.361692,192.168.11.8,192.168.11.13,TCP,74,,,10.292999,"Jan  6, 2024 19:36:21.324063000 JST",,54884  >  6000 [SYN] Seq=0 Win=64240 Len=0 MSS=1460 SACK_PERM TSval=1308783453 TSecr=0 WS=128
19,10.368397,192.168.11.13,192.168.11.8,TCP,74,0.006705,,0.006705,"Jan  6, 2024 19:36:21.330768000 JST",,"6000  >  54884 [SYN, ACK] Seq=0 Ack=1 Win=65160 Len=0 MSS=1460 SACK_PERM TSval=499456904 TSecr=1308783453 WS=128"
20,10.368531,192.168.11.8,192.168.11.13,TCP,66,0.000134,,0.000134,"Jan  6, 2024 19:36:21.330902000 JST",,54884  >  6000 [ACK] Seq=1 Ack=1 Win=64256 Len=0 TSval=1308783460 TSecr=499456904
21,10.36871,192.168.11.8,192.168.11.13,TCP,93,,,0.000179,"Jan  6, 2024 19:36:21.331081000 JST",,"54884  >  6000 [PSH, ACK] Seq=1 Ack=1 Win=64256 Len=27 TSval=1308783460 TSecr=499456904 [TCP segment of a reassembled PDU]"
22,10.368841,192.168.11.8,192.168.11.13,TCP,66,,,0.000131,"Jan  6, 2024 19:36:21.331212000 JST",,"54884  >  6000 [FIN, ACK] Seq=28 Ack=1 Win=64256 Len=0 TSval=1308783460 TSecr=499456904"
23,10.375726,192.168.11.13,192.168.11.8,TCP,66,0.007016,,0.006885,"Jan  6, 2024 19:36:21.338097000 JST",,6000  >  54884 [ACK] Seq=1 Ack=28 Win=65152 Len=0 TSval=499456912 TSecr=1308783460
24,10.3761,192.168.11.13,192.168.11.8,TCP,66,0.007259,,0.000374,"Jan  6, 2024 19:36:21.338471000 JST",,"6000  >  54884 [FIN, ACK] Seq=1 Ack=29 Win=65152 Len=0 TSval=499456913 TSecr=1308783460"
25,10.376169,192.168.11.8,192.168.11.13,TCP,66,0.000069,,0.000069,"Jan  6, 2024 19:36:21.338540000 JST",,54884  >  6000 [ACK] Seq=29 Ack=2 Win=64256 Len=0 TSval=1308783468 TSecr=499456913
26,10.409827,192.168.11.8,255.255.255.255,UDP,209,,Åü,0.033658,"Jan  6, 2024 19:36:21.372198000 JST",7b2273656d616e74696373223a207b22656e74697479223a2022504944222c202262617365656e74697479223a2022616e79222c2022726f6c65223a2022646464222c20227370617469616c223a2022616e79222c202274656d706f72616c223a2022616e79227d2c20226461746170726f7065727479223a207b22666f726d6174223a2022696e616f6b615f70726f6772616d5f73616d706c655f73656d616e746963227d7d,55970  >  7000 Len=167
27,10.416689,192.168.11.23,192.168.11.8,TCP,74,,Åú,0.006862,"Jan  6, 2024 19:36:21.379060000 JST",,42094  >  6000 [SYN] Seq=0 Win=64240 Len=0 MSS=1460 SACK_PERM TSval=2381983922 TSecr=0 WS=128
28,10.416848,192.168.11.8,192.168.11.23,TCP,74,0.000159,,0.000159,"Jan  6, 2024 19:36:21.379219000 JST",,"6000  >  42094 [SYN, ACK] Seq=0 Ack=1 Win=65160 Len=0 MSS=1460 SACK_PERM TSval=3378240112 TSecr=2381983922 WS=128"
29,10.423589,192.168.11.23,192.168.11.8,TCP,66,0.006741,,0.006741,"Jan  6, 2024 19:36:21.385960000 JST",,42094  >  6000 [ACK] Seq=1 Ack=1 Win=64256 Len=0 TSval=2381983930 TSecr=3378240112
30,10.424283,192.168.11.23,192.168.11.8,TCP,93,,,0.000694,"Jan  6, 2024 19:36:21.386654000 JST",,"42094  >  6000 [PSH, ACK] Seq=1 Ack=1 Win=64256 Len=27 TSval=2381983930 TSecr=3378240112 [TCP segment of a reassembled PDU]"
31,10.424406,192.168.11.8,192.168.11.23,TCP,66,0.000123,,0.000123,"Jan  6, 2024 19:36:21.386777000 JST",,6000  >  42094 [ACK] Seq=1 Ack=28 Win=65152 Len=0 TSval=3378240120 TSecr=2381983930
32,10.424499,192.168.11.23,192.168.11.8,TCP,66,,,0.000093,"Jan  6, 2024 19:36:21.386870000 JST",,"42094  >  6000 [FIN, ACK] Seq=28 Ack=1 Win=64256 Len=0 TSval=2381983930 TSecr=3378240112"
33,10.425808,192.168.11.8,192.168.11.23,TCP,66,0.001309,,0.001309,"Jan  6, 2024 19:36:21.388179000 JST",,"6000  >  42094 [FIN, ACK] Seq=1 Ack=29 Win=65152 Len=0 TSval=3378240121 TSecr=2381983930"
34,10.43174,192.168.11.23,192.168.11.8,TCP,66,0.005932,,0.005932,"Jan  6, 2024 19:36:21.394111000 JST",,42094  >  6000 [ACK] Seq=29 Ack=2 Win=64256 Len=0 TSval=2381983938 TSecr=3378240121
35,19.251706,192.168.11.8,192.168.11.13,TCP,74,,,8.819966,"Jan  6, 2024 19:36:30.214077000 JST",,60010  >  6000 [SYN] Seq=0 Win=64240 Len=0 MSS=1460 SACK_PERM TSval=1308792343 TSecr=0 WS=128
36,19.260753,192.168.11.13,192.168.11.8,TCP,74,0.009047,,0.009047,"Jan  6, 2024 19:36:30.223124000 JST",,"6000  >  60010 [SYN, ACK] Seq=0 Ack=1 Win=65160 Len=0 MSS=1460 SACK_PERM TSval=499465794 TSecr=1308792343 WS=128"
37,19.26087,192.168.11.8,192.168.11.13,TCP,66,0.000117,,0.000117,"Jan  6, 2024 19:36:30.223241000 JST",,60010  >  6000 [ACK] Seq=1 Ack=1 Win=64256 Len=0 TSval=1308792352 TSecr=499465794
38,19.261021,192.168.11.8,192.168.11.13,TCP,93,,,0.000151,"Jan  6, 2024 19:36:30.223392000 JST",,"60010  >  6000 [PSH, ACK] Seq=1 Ack=1 Win=64256 Len=27 TSval=1308792352 TSecr=499465794 [TCP segment of a reassembled PDU]"
39,19.261119,192.168.11.8,192.168.11.13,TCP,66,,,0.000098,"Jan  6, 2024 19:36:30.223490000 JST",,"60010  >  6000 [FIN, ACK] Seq=28 Ack=1 Win=64256 Len=0 TSval=1308792352 TSecr=499465794"
40,19.268542,192.168.11.13,192.168.11.8,TCP,66,0.007521,,0.007423,"Jan  6, 2024 19:36:30.230913000 JST",,6000  >  60010 [ACK] Seq=1 Ack=28 Win=65152 Len=0 TSval=499465804 TSecr=1308792352
41,19.271251,192.168.11.13,192.168.11.8,TCP,66,0.010132,,0.002709,"Jan  6, 2024 19:36:30.233622000 JST",,"6000  >  60010 [FIN, ACK] Seq=1 Ack=29 Win=65152 Len=0 TSval=499465807 TSecr=1308792352"
42,19.27131,192.168.11.8,192.168.11.13,TCP,66,0.000059,,0.000059,"Jan  6, 2024 19:36:30.233681000 JST",,60010  >  6000 [ACK] Seq=29 Ack=2 Win=64256 Len=0 TSval=1308792363 TSecr=499465807
43,19.302368,192.168.11.8,255.255.255.255,UDP,209,,Åü,0.031058,"Jan  6, 2024 19:36:30.264739000 JST",7b2273656d616e74696373223a207b22656e74697479223a2022504944222c202262617365656e74697479223a2022616e79222c2022726f6c65223a2022646464222c20227370617469616c223a2022616e79222c202274656d706f72616c223a2022616e79227d2c20226461746170726f7065727479223a207b22666f726d6174223a2022696e616f6b615f70726f6772616d5f73616d706c655f73656d616e746963227d7d,44846  >  7000 Len=167
44,20.303708,192.168.11.8,255.255.255.255,UDP,209,,Åú,1.00134,"Jan  6, 2024 19:36:31.266079000 JST",7b2273656d616e74696373223a207b22656e74697479223a2022504944222c202262617365656e74697479223a2022616e79222c2022726f6c65223a2022646464222c20227370617469616c223a2022616e79222c202274656d706f72616c223a2022616e79227d2c20226461746170726f7065727479223a207b22666f726d6174223a2022696e616f6b615f70726f6772616d5f73616d706c655f73656d616e746963227d7d,44846  >  7000 Len=167
45,20.310933,192.168.11.23,192.168.11.8,TCP,74,,Åú,0.007225,"Jan  6, 2024 19:36:31.273304000 JST",,47348  >  6000 [SYN] Seq=0 Win=64240 Len=0 MSS=1460 SACK_PERM TSval=2381993817 TSecr=0 WS=128
46,20.311071,192.168.11.8,192.168.11.23,TCP,74,0.000138,,0.000138,"Jan  6, 2024 19:36:31.273442000 JST",,"6000  >  47348 [SYN, ACK] Seq=0 Ack=1 Win=65160 Len=0 MSS=1460 SACK_PERM TSval=3378250006 TSecr=2381993817 WS=128"
47,20.317673,192.168.11.23,192.168.11.8,TCP,66,0.006602,,0.006602,"Jan  6, 2024 19:36:31.280044000 JST",,47348  >  6000 [ACK] Seq=1 Ack=1 Win=64256 Len=0 TSval=2381993824 TSecr=3378250006
48,20.3182,192.168.11.23,192.168.11.8,TCP,93,,,0.000527,"Jan  6, 2024 19:36:31.280571000 JST",,"47348  >  6000 [PSH, ACK] Seq=1 Ack=1 Win=64256 Len=27 TSval=2381993825 TSecr=3378250006 [TCP segment of a reassembled PDU]"
49,20.318285,192.168.11.8,192.168.11.23,TCP,66,0.000085,,0.000085,"Jan  6, 2024 19:36:31.280656000 JST",,6000  >  47348 [ACK] Seq=1 Ack=28 Win=65152 Len=0 TSval=3378250014 TSecr=2381993825
50,20.318358,192.168.11.23,192.168.11.8,TCP,66,,,0.000073,"Jan  6, 2024 19:36:31.280729000 JST",,"47348  >  6000 [FIN, ACK] Seq=28 Ack=1 Win=64256 Len=0 TSval=2381993825 TSecr=3378250006"
51,20.319361,192.168.11.8,192.168.11.23,TCP,66,0.001003,,0.001003,"Jan  6, 2024 19:36:31.281732000 JST",,"6000  >  47348 [FIN, ACK] Seq=1 Ack=29 Win=65152 Len=0 TSval=3378250015 TSecr=2381993825"
52,20.325467,192.168.11.23,192.168.11.8,TCP,66,0.006106,,0.006106,"Jan  6, 2024 19:36:31.287838000 JST",,47348  >  6000 [ACK] Seq=29 Ack=2 Win=64256 Len=0 TSval=2381993832 TSecr=3378250015
53,30.144418,192.168.11.8,192.168.11.13,TCP,74,,,9.818951,"Jan  6, 2024 19:36:41.106789000 JST",,41852  >  6000 [SYN] Seq=0 Win=64240 Len=0 MSS=1460 SACK_PERM TSval=1308803236 TSecr=0 WS=128
54,30.151077,192.168.11.13,192.168.11.8,TCP,74,0.006659,,0.006659,"Jan  6, 2024 19:36:41.113448000 JST",,"6000  >  41852 [SYN, ACK] Seq=0 Ack=1 Win=65160 Len=0 MSS=1460 SACK_PERM TSval=499476687 TSecr=1308803236 WS=128"
55,30.151202,192.168.11.8,192.168.11.13,TCP,66,0.000125,,0.000125,"Jan  6, 2024 19:36:41.113573000 JST",,41852  >  6000 [ACK] Seq=1 Ack=1 Win=64256 Len=0 TSval=1308803243 TSecr=499476687
56,30.151385,192.168.11.8,192.168.11.13,TCP,93,,,0.000183,"Jan  6, 2024 19:36:41.113756000 JST",,"41852  >  6000 [PSH, ACK] Seq=1 Ack=1 Win=64256 Len=27 TSval=1308803243 TSecr=499476687 [TCP segment of a reassembled PDU]"
57,30.151474,192.168.11.8,192.168.11.13,TCP,66,,,0.000089,"Jan  6, 2024 19:36:41.113845000 JST",,"41852  >  6000 [FIN, ACK] Seq=28 Ack=1 Win=64256 Len=0 TSval=1308803243 TSecr=499476687"
58,30.158836,192.168.11.13,192.168.11.8,TCP,66,0.007451,,0.007362,"Jan  6, 2024 19:36:41.121207000 JST",,6000  >  41852 [ACK] Seq=1 Ack=28 Win=65152 Len=0 TSval=499476694 TSecr=1308803243
59,30.159061,192.168.11.13,192.168.11.8,TCP,66,0.007587,,0.000225,"Jan  6, 2024 19:36:41.121432000 JST",,"6000  >  41852 [FIN, ACK] Seq=1 Ack=29 Win=65152 Len=0 TSval=499476697 TSecr=1308803243"
60,30.159118,192.168.11.8,192.168.11.13,TCP,66,0.000057,,0.000057,"Jan  6, 2024 19:36:41.121489000 JST",,41852  >  6000 [ACK] Seq=29 Ack=2 Win=64256 Len=0 TSval=1308803250 TSecr=499476697
61,30.187841,192.168.11.8,255.255.255.255,UDP,209,,Åü,0.028723,"Jan  6, 2024 19:36:41.150212000 JST",7b2273656d616e74696373223a207b22656e74697479223a2022504944222c202262617365656e74697479223a2022616e79222c2022726f6c65223a2022646464222c20227370617469616c223a2022616e79222c202274656d706f72616c223a2022616e79227d2c20226461746170726f7065727479223a207b22666f726d6174223a2022696e616f6b615f70726f6772616d5f73616d706c655f73656d616e746963227d7d,48390  >  7000 Len=167
62,30.193823,192.168.11.23,192.168.11.8,TCP,74,,Åú,0.005982,"Jan  6, 2024 19:36:41.156194000 JST",,53678  >  6000 [SYN] Seq=0 Win=64240 Len=0 MSS=1460 SACK_PERM TSval=2382003700 TSecr=0 WS=128
63,30.193975,192.168.11.8,192.168.11.23,TCP,74,0.000152,,0.000152,"Jan  6, 2024 19:36:41.156346000 JST",,"6000  >  53678 [SYN, ACK] Seq=0 Ack=1 Win=65160 Len=0 MSS=1460 SACK_PERM TSval=3378259889 TSecr=2382003700 WS=128"
64,30.212844,192.168.11.23,192.168.11.8,TCP,66,0.018869,,0.018869,"Jan  6, 2024 19:36:41.175215000 JST",,53678  >  6000 [ACK] Seq=1 Ack=1 Win=64256 Len=0 TSval=2382003709 TSecr=3378259889
65,30.213507,192.168.11.23,192.168.11.8,TCP,93,,,0.000663,"Jan  6, 2024 19:36:41.175878000 JST",,"53678  >  6000 [PSH, ACK] Seq=1 Ack=1 Win=64256 Len=27 TSval=2382003709 TSecr=3378259889 [TCP segment of a reassembled PDU]"
66,30.213659,192.168.11.8,192.168.11.23,TCP,66,0.000152,,0.000152,"Jan  6, 2024 19:36:41.176030000 JST",,6000  >  53678 [ACK] Seq=1 Ack=28 Win=65152 Len=0 TSval=3378259909 TSecr=2382003709
67,30.213758,192.168.11.23,192.168.11.8,TCP,66,,,0.000099,"Jan  6, 2024 19:36:41.176129000 JST",,"53678  >  6000 [FIN, ACK] Seq=28 Ack=1 Win=64256 Len=0 TSval=2382003709 TSecr=3378259889"
68,30.214787,192.168.11.8,192.168.11.23,TCP,66,0.001029,,0.001029,"Jan  6, 2024 19:36:41.177158000 JST",,"6000  >  53678 [FIN, ACK] Seq=1 Ack=29 Win=65152 Len=0 TSval=3378259910 TSecr=2382003709"
69,30.221848,192.168.11.23,192.168.11.8,TCP,66,0.007061,,0.007061,"Jan  6, 2024 19:36:41.184219000 JST",,53678  >  6000 [ACK] Seq=29 Ack=2 Win=64256 Len=0 TSval=2382003728 TSecr=3378259910
70,37.973477,192.168.11.8,192.168.11.13,TCP,74,,,7.751629,"Jan  6, 2024 19:36:48.935848000 JST",,47330  >  6000 [SYN] Seq=0 Win=64240 Len=0 MSS=1460 SACK_PERM TSval=1308811065 TSecr=0 WS=128
71,37.980399,192.168.11.13,192.168.11.8,TCP,74,0.006922,,0.006922,"Jan  6, 2024 19:36:48.942770000 JST",,"6000  >  47330 [SYN, ACK] Seq=0 Ack=1 Win=65160 Len=0 MSS=1460 SACK_PERM TSval=499484516 TSecr=1308811065 WS=128"
72,37.980524,192.168.11.8,192.168.11.13,TCP,66,0.000125,,0.000125,"Jan  6, 2024 19:36:48.942895000 JST",,47330  >  6000 [ACK] Seq=1 Ack=1 Win=64256 Len=0 TSval=1308811072 TSecr=499484516
73,37.980693,192.168.11.8,192.168.11.13,TCP,93,,,0.000169,"Jan  6, 2024 19:36:48.943064000 JST",,"47330  >  6000 [PSH, ACK] Seq=1 Ack=1 Win=64256 Len=27 TSval=1308811072 TSecr=499484516 [TCP segment of a reassembled PDU]"
74,37.980801,192.168.11.8,192.168.11.13,TCP,66,,,0.000108,"Jan  6, 2024 19:36:48.943172000 JST",,"47330  >  6000 [FIN, ACK] Seq=28 Ack=1 Win=64256 Len=0 TSval=1308811072 TSecr=499484516"
75,37.988387,192.168.11.13,192.168.11.8,TCP,66,0.007694,,0.007586,"Jan  6, 2024 19:36:48.950758000 JST",,6000  >  47330 [ACK] Seq=1 Ack=28 Win=65152 Len=0 TSval=499484524 TSecr=1308811072
76,37.988782,192.168.11.13,192.168.11.8,TCP,66,0.007981,,0.000395,"Jan  6, 2024 19:36:48.951153000 JST",,"6000  >  47330 [FIN, ACK] Seq=1 Ack=29 Win=65152 Len=0 TSval=499484525 TSecr=1308811072"
77,37.988846,192.168.11.8,192.168.11.13,TCP,66,0.000064,,0.000064,"Jan  6, 2024 19:36:48.951217000 JST",,47330  >  6000 [ACK] Seq=29 Ack=2 Win=64256 Len=0 TSval=1308811080 TSecr=499484525
78,38.017995,192.168.11.8,255.255.255.255,UDP,209,,Åü,0.029149,"Jan  6, 2024 19:36:48.980366000 JST",7b2273656d616e74696373223a207b22656e74697479223a2022504944222c202262617365656e74697479223a2022616e79222c2022726f6c65223a2022646464222c20227370617469616c223a2022616e79222c202274656d706f72616c223a2022616e79227d2c20226461746170726f7065727479223a207b22666f726d6174223a2022696e616f6b615f70726f6772616d5f73616d706c655f73656d616e746963227d7d,48073  >  7000 Len=167
79,38.024848,192.168.11.23,192.168.11.8,TCP,74,,Åú,0.006853,"Jan  6, 2024 19:36:48.987219000 JST",,53684  >  6000 [SYN] Seq=0 Win=64240 Len=0 MSS=1460 SACK_PERM TSval=2382011530 TSecr=0 WS=128
80,38.025014,192.168.11.8,192.168.11.23,TCP,74,0.000166,,0.000166,"Jan  6, 2024 19:36:48.987385000 JST",,"6000  >  53684 [SYN, ACK] Seq=0 Ack=1 Win=65160 Len=0 MSS=1460 SACK_PERM TSval=3378267720 TSecr=2382011530 WS=128"
81,38.031768,192.168.11.23,192.168.11.8,TCP,66,0.006754,,0.006754,"Jan  6, 2024 19:36:48.994139000 JST",,53684  >  6000 [ACK] Seq=1 Ack=1 Win=64256 Len=0 TSval=2382011538 TSecr=3378267720
82,38.032302,192.168.11.23,192.168.11.8,TCP,93,,,0.000534,"Jan  6, 2024 19:36:48.994673000 JST",,"53684  >  6000 [PSH, ACK] Seq=1 Ack=1 Win=64256 Len=27 TSval=2382011538 TSecr=3378267720 [TCP segment of a reassembled PDU]"
83,38.032435,192.168.11.8,192.168.11.23,TCP,66,0.000133,,0.000133,"Jan  6, 2024 19:36:48.994806000 JST",,6000  >  53684 [ACK] Seq=1 Ack=28 Win=65152 Len=0 TSval=3378267728 TSecr=2382011538
84,38.032708,192.168.11.23,192.168.11.8,TCP,66,,,0.000273,"Jan  6, 2024 19:36:48.995079000 JST",,"53684  >  6000 [FIN, ACK] Seq=28 Ack=1 Win=64256 Len=0 TSval=2382011539 TSecr=3378267720"
85,38.03383,192.168.11.8,192.168.11.23,TCP,66,0.001122,,0.001122,"Jan  6, 2024 19:36:48.996201000 JST",,"6000  >  53684 [FIN, ACK] Seq=1 Ack=29 Win=65152 Len=0 TSval=3378267729 TSecr=2382011539"
86,38.040097,192.168.11.23,192.168.11.8,TCP,66,0.006267,,0.006267,"Jan  6, 2024 19:36:49.002468000 JST",,53684  >  6000 [ACK] Seq=29 Ack=2 Win=64256 Len=0 TSval=2382011546 TSecr=3378267729
87,45.777827,192.168.11.8,192.168.11.13,TCP,74,,,7.73773,"Jan  6, 2024 19:36:56.740198000 JST",,43674  >  6000 [SYN] Seq=0 Win=64240 Len=0 MSS=1460 SACK_PERM TSval=1308818869 TSecr=0 WS=128
88,45.784358,192.168.11.13,192.168.11.8,TCP,74,0.006531,,0.006531,"Jan  6, 2024 19:36:56.746729000 JST",,"6000  >  43674 [SYN, ACK] Seq=0 Ack=1 Win=65160 Len=0 MSS=1460 SACK_PERM TSval=499492320 TSecr=1308818869 WS=128"
89,45.784469,192.168.11.8,192.168.11.13,TCP,66,0.000111,,0.000111,"Jan  6, 2024 19:36:56.746840000 JST",,43674  >  6000 [ACK] Seq=1 Ack=1 Win=64256 Len=0 TSval=1308818876 TSecr=499492320
90,45.784671,192.168.11.8,192.168.11.13,TCP,93,,,0.000202,"Jan  6, 2024 19:36:56.747042000 JST",,"43674  >  6000 [PSH, ACK] Seq=1 Ack=1 Win=64256 Len=27 TSval=1308818876 TSecr=499492320 [TCP segment of a reassembled PDU]"
91,45.784776,192.168.11.8,192.168.11.13,TCP,66,,,0.000105,"Jan  6, 2024 19:36:56.747147000 JST",,"43674  >  6000 [FIN, ACK] Seq=28 Ack=1 Win=64256 Len=0 TSval=1308818876 TSecr=499492320"
92,45.79165,192.168.11.13,192.168.11.8,TCP,66,0.006979,,0.006874,"Jan  6, 2024 19:36:56.754021000 JST",,6000  >  43674 [ACK] Seq=1 Ack=28 Win=65152 Len=0 TSval=499492328 TSecr=1308818876
93,45.792009,192.168.11.13,192.168.11.8,TCP,66,0.007233,,0.000359,"Jan  6, 2024 19:36:56.754380000 JST",,"6000  >  43674 [FIN, ACK] Seq=1 Ack=29 Win=65152 Len=0 TSval=499492329 TSecr=1308818876"
94,45.792054,192.168.11.8,192.168.11.13,TCP,66,0.000045,,0.000045,"Jan  6, 2024 19:36:56.754425000 JST",,43674  >  6000 [ACK] Seq=29 Ack=2 Win=64256 Len=0 TSval=1308818883 TSecr=499492329
95,45.8207,192.168.11.8,255.255.255.255,UDP,209,,Åü,0.028646,"Jan  6, 2024 19:36:56.783071000 JST",7b2273656d616e74696373223a207b22656e74697479223a2022504944222c202262617365656e74697479223a2022616e79222c2022726f6c65223a2022646464222c20227370617469616c223a2022616e79222c202274656d706f72616c223a2022616e79227d2c20226461746170726f7065727479223a207b22666f726d6174223a2022696e616f6b615f70726f6772616d5f73616d706c655f73656d616e746963227d7d,50181  >  7000 Len=167
96,45.827306,192.168.11.23,192.168.11.8,TCP,74,,Åú,0.006606,"Jan  6, 2024 19:36:56.789677000 JST",,42666  >  6000 [SYN] Seq=0 Win=64240 Len=0 MSS=1460 SACK_PERM TSval=2382019333 TSecr=0 WS=128
97,45.827443,192.168.11.8,192.168.11.23,TCP,74,0.000137,,0.000137,"Jan  6, 2024 19:36:56.789814000 JST",,"6000  >  42666 [SYN, ACK] Seq=0 Ack=1 Win=65160 Len=0 MSS=1460 SACK_PERM TSval=3378275523 TSecr=2382019333 WS=128"
98,45.834096,192.168.11.23,192.168.11.8,TCP,66,0.006653,,0.006653,"Jan  6, 2024 19:36:56.796467000 JST",,42666  >  6000 [ACK] Seq=1 Ack=1 Win=64256 Len=0 TSval=2382019341 TSecr=3378275523
99,45.834662,192.168.11.23,192.168.11.8,TCP,93,,,0.000566,"Jan  6, 2024 19:36:56.797033000 JST",,"42666  >  6000 [PSH, ACK] Seq=1 Ack=1 Win=64256 Len=27 TSval=2382019341 TSecr=3378275523 [TCP segment of a reassembled PDU]"
100,45.834744,192.168.11.8,192.168.11.23,TCP,66,0.000082,,0.000082,"Jan  6, 2024 19:36:56.797115000 JST",,6000  >  42666 [ACK] Seq=1 Ack=28 Win=65152 Len=0 TSval=3378275530 TSecr=2382019341
101,45.834819,192.168.11.23,192.168.11.8,TCP,66,,,0.000075,"Jan  6, 2024 19:36:56.797190000 JST",,"42666  >  6000 [FIN, ACK] Seq=28 Ack=1 Win=64256 Len=0 TSval=2382019341 TSecr=3378275523"
102,45.835907,192.168.11.8,192.168.11.23,TCP,66,0.001088,,0.001088,"Jan  6, 2024 19:36:56.798278000 JST",,"6000  >  42666 [FIN, ACK] Seq=1 Ack=29 Win=65152 Len=0 TSval=3378275531 TSecr=2382019341"
103,45.841875,192.168.11.23,192.168.11.8,TCP,66,0.005968,,0.005968,"Jan  6, 2024 19:36:56.804246000 JST",,42666  >  6000 [ACK] Seq=29 Ack=2 Win=64256 Len=0 TSval=2382019348 TSecr=3378275531
104,53.636856,192.168.11.8,192.168.11.13,TCP,74,,,7.794981,"Jan  6, 2024 19:37:04.599227000 JST",,55316  >  6000 [SYN] Seq=0 Win=64240 Len=0 MSS=1460 SACK_PERM TSval=1308826728 TSecr=0 WS=128
105,53.655375,192.168.11.13,192.168.11.8,TCP,74,0.018519,,0.018519,"Jan  6, 2024 19:37:04.617746000 JST",,"6000  >  55316 [SYN, ACK] Seq=0 Ack=1 Win=65160 Len=0 MSS=1460 SACK_PERM TSval=499500191 TSecr=1308826728 WS=128"
106,53.655483,192.168.11.8,192.168.11.13,TCP,66,0.000108,,0.000108,"Jan  6, 2024 19:37:04.617854000 JST",,55316  >  6000 [ACK] Seq=1 Ack=1 Win=64256 Len=0 TSval=1308826747 TSecr=499500191
107,53.655656,192.168.11.8,192.168.11.13,TCP,93,,,0.000173,"Jan  6, 2024 19:37:04.618027000 JST",,"55316  >  6000 [PSH, ACK] Seq=1 Ack=1 Win=64256 Len=27 TSval=1308826747 TSecr=499500191 [TCP segment of a reassembled PDU]"
108,53.655748,192.168.11.8,192.168.11.13,TCP,66,,,0.000092,"Jan  6, 2024 19:37:04.618119000 JST",,"55316  >  6000 [FIN, ACK] Seq=28 Ack=1 Win=64256 Len=0 TSval=1308826747 TSecr=499500191"
109,53.663079,192.168.11.13,192.168.11.8,TCP,66,0.007423,,0.007331,"Jan  6, 2024 19:37:04.625450000 JST",,6000  >  55316 [ACK] Seq=1 Ack=28 Win=65152 Len=0 TSval=499500199 TSecr=1308826747
110,53.663456,192.168.11.13,192.168.11.8,TCP,66,0.007708,,0.000377,"Jan  6, 2024 19:37:04.625827000 JST",,"6000  >  55316 [FIN, ACK] Seq=1 Ack=29 Win=65152 Len=0 TSval=499500200 TSecr=1308826747"
111,53.663506,192.168.11.8,192.168.11.13,TCP,66,0.00005,,0.00005,"Jan  6, 2024 19:37:04.625877000 JST",,55316  >  6000 [ACK] Seq=29 Ack=2 Win=64256 Len=0 TSval=1308826755 TSecr=499500200
112,53.691578,192.168.11.8,255.255.255.255,UDP,209,,Åü,0.028072,"Jan  6, 2024 19:37:04.653949000 JST",7b2273656d616e74696373223a207b22656e74697479223a2022504944222c202262617365656e74697479223a2022616e79222c2022726f6c65223a2022646464222c20227370617469616c223a2022616e79222c202274656d706f72616c223a2022616e79227d2c20226461746170726f7065727479223a207b22666f726d6174223a2022696e616f6b615f70726f6772616d5f73616d706c655f73656d616e746963227d7d,36362  >  7000 Len=167
113,53.697343,192.168.11.23,192.168.11.8,TCP,74,,Åú,0.005765,"Jan  6, 2024 19:37:04.659714000 JST",,46874  >  6000 [SYN] Seq=0 Win=64240 Len=0 MSS=1460 SACK_PERM TSval=2382027204 TSecr=0 WS=128
114,53.697481,192.168.11.8,192.168.11.23,TCP,74,0.000138,,0.000138,"Jan  6, 2024 19:37:04.659852000 JST",,"6000  >  46874 [SYN, ACK] Seq=0 Ack=1 Win=65160 Len=0 MSS=1460 SACK_PERM TSval=3378283393 TSecr=2382027204 WS=128"
115,53.704349,192.168.11.23,192.168.11.8,TCP,66,0.006868,,0.006868,"Jan  6, 2024 19:37:04.666720000 JST",,46874  >  6000 [ACK] Seq=1 Ack=1 Win=64256 Len=0 TSval=2382027211 TSecr=3378283393
116,53.704954,192.168.11.23,192.168.11.8,TCP,93,,,0.000605,"Jan  6, 2024 19:37:04.667325000 JST",,"46874  >  6000 [PSH, ACK] Seq=1 Ack=1 Win=64256 Len=27 TSval=2382027211 TSecr=3378283393 [TCP segment of a reassembled PDU]"
117,53.705074,192.168.11.8,192.168.11.23,TCP,66,0.00012,,0.00012,"Jan  6, 2024 19:37:04.667445000 JST",,6000  >  46874 [ACK] Seq=1 Ack=28 Win=65152 Len=0 TSval=3378283400 TSecr=2382027211
118,53.70516,192.168.11.23,192.168.11.8,TCP,66,,,0.000086,"Jan  6, 2024 19:37:04.667531000 JST",,"46874  >  6000 [FIN, ACK] Seq=28 Ack=1 Win=64256 Len=0 TSval=2382027211 TSecr=3378283393"
119,53.706358,192.168.11.8,192.168.11.23,TCP,66,0.001198,,0.001198,"Jan  6, 2024 19:37:04.668729000 JST",,"6000  >  46874 [FIN, ACK] Seq=1 Ack=29 Win=65152 Len=0 TSval=3378283402 TSecr=2382027211"
120,53.712531,192.168.11.23,192.168.11.8,TCP,66,0.006173,,0.006173,"Jan  6, 2024 19:37:04.674902000 JST",,46874  >  6000 [ACK] Seq=29 Ack=2 Win=64256 Len=0 TSval=2382027219 TSecr=3378283402
121,61.93691,192.168.11.8,192.168.11.13,TCP,74,,,8.224379,"Jan  6, 2024 19:37:12.899281000 JST",,48068  >  6000 [SYN] Seq=0 Win=64240 Len=0 MSS=1460 SACK_PERM TSval=1308835028 TSecr=0 WS=128
122,61.944601,192.168.11.13,192.168.11.8,TCP,74,0.007691,,0.007691,"Jan  6, 2024 19:37:12.906972000 JST",,"6000  >  48068 [SYN, ACK] Seq=0 Ack=1 Win=65160 Len=0 MSS=1460 SACK_PERM TSval=499508481 TSecr=1308835028 WS=128"
123,61.944722,192.168.11.8,192.168.11.13,TCP,66,0.000121,,0.000121,"Jan  6, 2024 19:37:12.907093000 JST",,48068  >  6000 [ACK] Seq=1 Ack=1 Win=64256 Len=0 TSval=1308835036 TSecr=499508481
124,61.944868,192.168.11.8,192.168.11.13,TCP,93,,,0.000146,"Jan  6, 2024 19:37:12.907239000 JST",,"48068  >  6000 [PSH, ACK] Seq=1 Ack=1 Win=64256 Len=27 TSval=1308835036 TSecr=499508481 [TCP segment of a reassembled PDU]"
125,61.944974,192.168.11.8,192.168.11.13,TCP,66,,,0.000106,"Jan  6, 2024 19:37:12.907345000 JST",,"48068  >  6000 [FIN, ACK] Seq=28 Ack=1 Win=64256 Len=0 TSval=1308835036 TSecr=499508481"
126,61.951986,192.168.11.13,192.168.11.8,TCP,66,0.007118,,0.007012,"Jan  6, 2024 19:37:12.914357000 JST",,6000  >  48068 [ACK] Seq=1 Ack=28 Win=65152 Len=0 TSval=499508488 TSecr=1308835036
127,61.952391,192.168.11.13,192.168.11.8,TCP,66,0.007417,,0.000405,"Jan  6, 2024 19:37:12.914762000 JST",,"6000  >  48068 [FIN, ACK] Seq=1 Ack=29 Win=65152 Len=0 TSval=499508489 TSecr=1308835036"
128,61.952442,192.168.11.8,192.168.11.13,TCP,66,0.000051,,0.000051,"Jan  6, 2024 19:37:12.914813000 JST",,48068  >  6000 [ACK] Seq=29 Ack=2 Win=64256 Len=0 TSval=1308835044 TSecr=499508489
129,61.981142,192.168.11.8,255.255.255.255,UDP,209,,Åü,0.0287,"Jan  6, 2024 19:37:12.943513000 JST",7b2273656d616e74696373223a207b22656e74697479223a2022504944222c202262617365656e74697479223a2022616e79222c2022726f6c65223a2022646464222c20227370617469616c223a2022616e79222c202274656d706f72616c223a2022616e79227d2c20226461746170726f7065727479223a207b22666f726d6174223a2022696e616f6b615f70726f6772616d5f73616d706c655f73656d616e746963227d7d,54156  >  7000 Len=167
130,61.987441,192.168.11.23,192.168.11.8,TCP,74,,Åú,0.006299,"Jan  6, 2024 19:37:12.949812000 JST",,50518  >  6000 [SYN] Seq=0 Win=64240 Len=0 MSS=1460 SACK_PERM TSval=2382035494 TSecr=0 WS=128
131,61.987571,192.168.11.8,192.168.11.23,TCP,74,0.00013,,0.00013,"Jan  6, 2024 19:37:12.949942000 JST",,"6000  >  50518 [SYN, ACK] Seq=0 Ack=1 Win=65160 Len=0 MSS=1460 SACK_PERM TSval=3378291683 TSecr=2382035494 WS=128"
132,61.994337,192.168.11.23,192.168.11.8,TCP,66,0.006766,,0.006766,"Jan  6, 2024 19:37:12.956708000 JST",,50518  >  6000 [ACK] Seq=1 Ack=1 Win=64256 Len=0 TSval=2382035501 TSecr=3378291683
133,61.99489,192.168.11.23,192.168.11.8,TCP,93,,,0.000553,"Jan  6, 2024 19:37:12.957261000 JST",,"50518  >  6000 [PSH, ACK] Seq=1 Ack=1 Win=64256 Len=27 TSval=2382035501 TSecr=3378291683 [TCP segment of a reassembled PDU]"
134,61.994981,192.168.11.8,192.168.11.23,TCP,66,0.000091,,0.000091,"Jan  6, 2024 19:37:12.957352000 JST",,6000  >  50518 [ACK] Seq=1 Ack=28 Win=65152 Len=0 TSval=3378291690 TSecr=2382035501
135,61.99505,192.168.11.23,192.168.11.8,TCP,66,,,0.000069,"Jan  6, 2024 19:37:12.957421000 JST",,"50518  >  6000 [FIN, ACK] Seq=28 Ack=1 Win=64256 Len=0 TSval=2382035501 TSecr=3378291683"
136,61.99605,192.168.11.8,192.168.11.23,TCP,66,0.001,,0.001,"Jan  6, 2024 19:37:12.958421000 JST",,"6000  >  50518 [FIN, ACK] Seq=1 Ack=29 Win=65152 Len=0 TSval=3378291691 TSecr=2382035501"
137,62.002233,192.168.11.23,192.168.11.8,TCP,66,0.006183,,0.006183,"Jan  6, 2024 19:37:12.964604000 JST",,50518  >  6000 [ACK] Seq=29 Ack=2 Win=64256 Len=0 TSval=2382035509 TSecr=3378291691
138,71.841626,192.168.11.8,192.168.11.13,TCP,74,,,9.839393,"Jan  6, 2024 19:37:22.803997000 JST",,48096  >  6000 [SYN] Seq=0 Win=64240 Len=0 MSS=1460 SACK_PERM TSval=1308844933 TSecr=0 WS=128
139,71.851766,192.168.11.13,192.168.11.8,TCP,74,0.01014,,0.01014,"Jan  6, 2024 19:37:22.814137000 JST",,"6000  >  48096 [SYN, ACK] Seq=0 Ack=1 Win=65160 Len=0 MSS=1460 SACK_PERM TSval=499518388 TSecr=1308844933 WS=128"
140,71.851874,192.168.11.8,192.168.11.13,TCP,66,0.000108,,0.000108,"Jan  6, 2024 19:37:22.814245000 JST",,48096  >  6000 [ACK] Seq=1 Ack=1 Win=64256 Len=0 TSval=1308844943 TSecr=499518388
141,71.852005,192.168.11.8,192.168.11.13,TCP,93,,,0.000131,"Jan  6, 2024 19:37:22.814376000 JST",,"48096  >  6000 [PSH, ACK] Seq=1 Ack=1 Win=64256 Len=27 TSval=1308844943 TSecr=499518388 [TCP segment of a reassembled PDU]"
142,71.852136,192.168.11.8,192.168.11.13,TCP,66,,,0.000131,"Jan  6, 2024 19:37:22.814507000 JST",,"48096  >  6000 [FIN, ACK] Seq=28 Ack=1 Win=64256 Len=0 TSval=1308844943 TSecr=499518388"
143,71.859447,192.168.11.13,192.168.11.8,TCP,66,0.007442,,0.007311,"Jan  6, 2024 19:37:22.821818000 JST",,6000  >  48096 [ACK] Seq=1 Ack=28 Win=65152 Len=0 TSval=499518395 TSecr=1308844943
144,71.859657,192.168.11.13,192.168.11.8,TCP,66,0.007521,,0.00021,"Jan  6, 2024 19:37:22.822028000 JST",,"6000  >  48096 [FIN, ACK] Seq=1 Ack=29 Win=65152 Len=0 TSval=499518396 TSecr=1308844943"
145,71.859704,192.168.11.8,192.168.11.13,TCP,66,0.000047,,0.000047,"Jan  6, 2024 19:37:22.822075000 JST",,48096  >  6000 [ACK] Seq=29 Ack=2 Win=64256 Len=0 TSval=1308844951 TSecr=499518396
146,71.893295,192.168.11.8,255.255.255.255,UDP,209,,Åü,0.033591,"Jan  6, 2024 19:37:22.855666000 JST",7b2273656d616e74696373223a207b22656e74697479223a2022504944222c202262617365656e74697479223a2022616e79222c2022726f6c65223a2022646464222c20227370617469616c223a2022616e79222c202274656d706f72616c223a2022616e79227d2c20226461746170726f7065727479223a207b22666f726d6174223a2022696e616f6b615f70726f6772616d5f73616d706c655f73656d616e746963227d7d,49454  >  7000 Len=167
147,71.899543,192.168.11.23,192.168.11.8,TCP,74,,Åú,0.006248,"Jan  6, 2024 19:37:22.861914000 JST",,54610  >  6000 [SYN] Seq=0 Win=64240 Len=0 MSS=1460 SACK_PERM TSval=2382045406 TSecr=0 WS=128
148,71.899698,192.168.11.8,192.168.11.23,TCP,74,0.000155,,0.000155,"Jan  6, 2024 19:37:22.862069000 JST",,"6000  >  54610 [SYN, ACK] Seq=0 Ack=1 Win=65160 Len=0 MSS=1460 SACK_PERM TSval=3378301595 TSecr=2382045406 WS=128"
149,71.907131,192.168.11.23,192.168.11.8,TCP,66,0.007433,,0.007433,"Jan  6, 2024 19:37:22.869502000 JST",,54610  >  6000 [ACK] Seq=1 Ack=1 Win=64256 Len=0 TSval=2382045413 TSecr=3378301595
150,71.907843,192.168.11.23,192.168.11.8,TCP,93,,,0.000712,"Jan  6, 2024 19:37:22.870214000 JST",,"54610  >  6000 [PSH, ACK] Seq=1 Ack=1 Win=64256 Len=27 TSval=2382045413 TSecr=3378301595 [TCP segment of a reassembled PDU]"
151,71.90797,192.168.11.8,192.168.11.23,TCP,66,0.000127,,0.000127,"Jan  6, 2024 19:37:22.870341000 JST",,6000  >  54610 [ACK] Seq=1 Ack=28 Win=65152 Len=0 TSval=3378301603 TSecr=2382045413
152,71.908055,192.168.11.23,192.168.11.8,TCP,66,,,0.000085,"Jan  6, 2024 19:37:22.870426000 JST",,"54610  >  6000 [FIN, ACK] Seq=28 Ack=1 Win=64256 Len=0 TSval=2382045413 TSecr=3378301595"
153,71.909461,192.168.11.8,192.168.11.23,TCP,66,0.001406,,0.001406,"Jan  6, 2024 19:37:22.871832000 JST",,"6000  >  54610 [FIN, ACK] Seq=1 Ack=29 Win=65152 Len=0 TSval=3378301605 TSecr=2382045413"
154,71.914781,192.168.11.23,192.168.11.8,TCP,66,0.00532,,0.00532,"Jan  6, 2024 19:37:22.877152000 JST",,54610  >  6000 [ACK] Seq=29 Ack=2 Win=64256 Len=0 TSval=2382045422 TSecr=3378301605
155,82.754663,192.168.11.8,192.168.11.13,TCP,74,,,10.839882,"Jan  6, 2024 19:37:33.717034000 JST",,50348  >  6000 [SYN] Seq=0 Win=64240 Len=0 MSS=1460 SACK_PERM TSval=1308855846 TSecr=0 WS=128
156,82.765502,192.168.11.13,192.168.11.8,TCP,74,0.010839,,0.010839,"Jan  6, 2024 19:37:33.727873000 JST",,"6000  >  50348 [SYN, ACK] Seq=0 Ack=1 Win=65160 Len=0 MSS=1460 SACK_PERM TSval=499529301 TSecr=1308855846 WS=128"
157,82.765627,192.168.11.8,192.168.11.13,TCP,66,0.000125,,0.000125,"Jan  6, 2024 19:37:33.727998000 JST",,50348  >  6000 [ACK] Seq=1 Ack=1 Win=64256 Len=0 TSval=1308855857 TSecr=499529301
158,82.765804,192.168.11.8,192.168.11.13,TCP,93,,,0.000177,"Jan  6, 2024 19:37:33.728175000 JST",,"50348  >  6000 [PSH, ACK] Seq=1 Ack=1 Win=64256 Len=27 TSval=1308855857 TSecr=499529301 [TCP segment of a reassembled PDU]"
159,82.765896,192.168.11.8,192.168.11.13,TCP,66,,,0.000092,"Jan  6, 2024 19:37:33.728267000 JST",,"50348  >  6000 [FIN, ACK] Seq=28 Ack=1 Win=64256 Len=0 TSval=1308855857 TSecr=499529301"
160,82.77354,192.168.11.13,192.168.11.8,TCP,66,0.007736,,0.007644,"Jan  6, 2024 19:37:33.735911000 JST",,6000  >  50348 [ACK] Seq=1 Ack=28 Win=65152 Len=0 TSval=499529309 TSecr=1308855857
161,82.77376,192.168.11.13,192.168.11.8,TCP,66,0.007864,,0.00022,"Jan  6, 2024 19:37:33.736131000 JST",,"6000  >  50348 [FIN, ACK] Seq=1 Ack=29 Win=65152 Len=0 TSval=499529310 TSecr=1308855857"
162,82.773814,192.168.11.8,192.168.11.13,TCP,66,0.000054,,0.000054,"Jan  6, 2024 19:37:33.736185000 JST",,50348  >  6000 [ACK] Seq=29 Ack=2 Win=64256 Len=0 TSval=1308855865 TSecr=499529310
163,82.804822,192.168.11.8,255.255.255.255,UDP,209,,Åü,0.031008,"Jan  6, 2024 19:37:33.767193000 JST",7b2273656d616e74696373223a207b22656e74697479223a2022504944222c202262617365656e74697479223a2022616e79222c2022726f6c65223a2022646464222c20227370617469616c223a2022616e79222c202274656d706f72616c223a2022616e79227d2c20226461746170726f7065727479223a207b22666f726d6174223a2022696e616f6b615f70726f6772616d5f73616d706c655f73656d616e746963227d7d,48520  >  7000 Len=167
164,82.810823,192.168.11.23,192.168.11.8,TCP,74,,Åú,0.006001,"Jan  6, 2024 19:37:33.773194000 JST",,49524  >  6000 [SYN] Seq=0 Win=64240 Len=0 MSS=1460 SACK_PERM TSval=2382056317 TSecr=0 WS=128
165,82.810966,192.168.11.8,192.168.11.23,TCP,74,0.000143,,0.000143,"Jan  6, 2024 19:37:33.773337000 JST",,"6000  >  49524 [SYN, ACK] Seq=0 Ack=1 Win=65160 Len=0 MSS=1460 SACK_PERM TSval=3378312506 TSecr=2382056317 WS=128"
166,82.817999,192.168.11.23,192.168.11.8,TCP,66,0.007033,,0.007033,"Jan  6, 2024 19:37:33.780370000 JST",,49524  >  6000 [ACK] Seq=1 Ack=1 Win=64256 Len=0 TSval=2382056325 TSecr=3378312506
167,82.81859,192.168.11.23,192.168.11.8,TCP,93,,,0.000591,"Jan  6, 2024 19:37:33.780961000 JST",,"49524  >  6000 [PSH, ACK] Seq=1 Ack=1 Win=64256 Len=27 TSval=2382056325 TSecr=3378312506 [TCP segment of a reassembled PDU]"
168,82.818689,192.168.11.8,192.168.11.23,TCP,66,0.000099,,0.000099,"Jan  6, 2024 19:37:33.781060000 JST",,6000  >  49524 [ACK] Seq=1 Ack=28 Win=65152 Len=0 TSval=3378312514 TSecr=2382056325
169,82.818769,192.168.11.23,192.168.11.8,TCP,66,,,0.00008,"Jan  6, 2024 19:37:33.781140000 JST",,"49524  >  6000 [FIN, ACK] Seq=28 Ack=1 Win=64256 Len=0 TSval=2382056325 TSecr=3378312506"
170,82.819704,192.168.11.8,192.168.11.23,TCP,66,0.000935,,0.000935,"Jan  6, 2024 19:37:33.782075000 JST",,"6000  >  49524 [FIN, ACK] Seq=1 Ack=29 Win=65152 Len=0 TSval=3378312515 TSecr=2382056325"
171,82.825885,192.168.11.23,192.168.11.8,TCP,66,0.006181,,0.006181,"Jan  6, 2024 19:37:33.788256000 JST",,49524  >  6000 [ACK] Seq=29 Ack=2 Win=64256 Len=0 TSval=2382056332 TSecr=3378312515
172,114.930301,192.168.11.8,192.168.11.13,TCP,74,,,32.104416,"Jan  6, 2024 19:38:05.892672000 JST",,47798  >  6000 [SYN] Seq=0 Win=64240 Len=0 MSS=1460 SACK_PERM TSval=1308888022 TSecr=0 WS=128
173,114.936753,192.168.11.13,192.168.11.8,TCP,74,0.006452,,0.006452,"Jan  6, 2024 19:38:05.899124000 JST",,"6000  >  47798 [SYN, ACK] Seq=0 Ack=1 Win=65160 Len=0 MSS=1460 SACK_PERM TSval=499561473 TSecr=1308888022 WS=128"
174,114.936854,192.168.11.8,192.168.11.13,TCP,66,0.000101,,0.000101,"Jan  6, 2024 19:38:05.899225000 JST",,47798  >  6000 [ACK] Seq=1 Ack=1 Win=64256 Len=0 TSval=1308888028 TSecr=499561473
175,114.936982,192.168.11.8,192.168.11.13,TCP,93,,,0.000128,"Jan  6, 2024 19:38:05.899353000 JST",,"47798  >  6000 [PSH, ACK] Seq=1 Ack=1 Win=64256 Len=27 TSval=1308888028 TSecr=499561473 [TCP segment of a reassembled PDU]"
176,114.937082,192.168.11.8,192.168.11.13,TCP,66,,,0.0001,"Jan  6, 2024 19:38:05.899453000 JST",,"47798  >  6000 [FIN, ACK] Seq=28 Ack=1 Win=64256 Len=0 TSval=1308888028 TSecr=499561473"
177,114.951503,192.168.11.13,192.168.11.8,TCP,66,0.014521,,0.014421,"Jan  6, 2024 19:38:05.913874000 JST",,6000  >  47798 [ACK] Seq=1 Ack=28 Win=65152 Len=0 TSval=499561487 TSecr=1308888028
178,114.951888,192.168.11.13,192.168.11.8,TCP,66,0.014806,,0.000385,"Jan  6, 2024 19:38:05.914259000 JST",,"6000  >  47798 [FIN, ACK] Seq=1 Ack=29 Win=65152 Len=0 TSval=499561488 TSecr=1308888028"
179,114.95195,192.168.11.8,192.168.11.13,TCP,66,0.000062,,0.000062,"Jan  6, 2024 19:38:05.914321000 JST",,47798  >  6000 [ACK] Seq=29 Ack=2 Win=64256 Len=0 TSval=1308888043 TSecr=499561488
180,114.979732,192.168.11.8,255.255.255.255,UDP,209,,Åü,0.027782,"Jan  6, 2024 19:38:05.942103000 JST",7b2273656d616e74696373223a207b22656e74697479223a2022504944222c202262617365656e74697479223a2022616e79222c2022726f6c65223a2022646464222c20227370617469616c223a2022616e79222c202274656d706f72616c223a2022616e79227d2c20226461746170726f7065727479223a207b22666f726d6174223a2022696e616f6b615f70726f6772616d5f73616d706c655f73656d616e746963227d7d,49502  >  7000 Len=167
181,114.986504,192.168.11.23,192.168.11.8,TCP,74,,Åú,0.006772,"Jan  6, 2024 19:38:05.948875000 JST",,34594  >  6000 [SYN] Seq=0 Win=64240 Len=0 MSS=1460 SACK_PERM TSval=2382088492 TSecr=0 WS=128
182,114.986643,192.168.11.8,192.168.11.23,TCP,74,0.000139,,0.000139,"Jan  6, 2024 19:38:05.949014000 JST",,"6000  >  34594 [SYN, ACK] Seq=0 Ack=1 Win=65160 Len=0 MSS=1460 SACK_PERM TSval=3378344682 TSecr=2382088492 WS=128"
183,114.993912,192.168.11.23,192.168.11.8,TCP,66,0.007269,,0.007269,"Jan  6, 2024 19:38:05.956283000 JST",,34594  >  6000 [ACK] Seq=1 Ack=1 Win=64256 Len=0 TSval=2382088500 TSecr=3378344682
184,114.994559,192.168.11.23,192.168.11.8,TCP,93,,,0.000647,"Jan  6, 2024 19:38:05.956930000 JST",,"34594  >  6000 [PSH, ACK] Seq=1 Ack=1 Win=64256 Len=27 TSval=2382088501 TSecr=3378344682 [TCP segment of a reassembled PDU]"
