No.,Time,Source,Destination,Protocol,Length,The RTT to ACK the segment was,XXX,Time delta from previous captured frame,Arrival Time,Data,Info
1,0,192.168.11.30,192.168.11.10,TCP,74,,,0,"Jan  6, 2024 19:36:11.169384000 JST",,36634  >  6000 [SYN] Seq=0 Win=64240 Len=0 MSS=1460 SACK_PERM TSval=3430434424 TSecr=0 WS=128
2,0.006776,192.168.11.10,192.168.11.30,TCP,74,0.006776,,0.006776,"Jan  6, 2024 19:36:11.176160000 JST",,"6000  >  36634 [SYN, ACK] Seq=0 Ack=1 Win=65160 Len=0 MSS=1460 SACK_PERM TSval=2137777664 TSecr=3430434424 WS=128"
3,0.006892,192.168.11.30,192.168.11.10,TCP,66,0.000116,,0.000116,"Jan  6, 2024 19:36:11.176276000 JST",,36634  >  6000 [ACK] Seq=1 Ack=1 Win=64256 Len=0 TSval=3430434435 TSecr=2137777664
4,0.007109,192.168.11.30,192.168.11.10,TCP,93,,,0.000217,"Jan  6, 2024 19:36:11.176493000 JST",,"36634  >  6000 [PSH, ACK] Seq=1 Ack=1 Win=64256 Len=27 TSval=3430434435 TSecr=2137777664 [TCP segment of a reassembled PDU]"
5,0.007243,192.168.11.30,192.168.11.10,TCP,66,,,0.000134,"Jan  6, 2024 19:36:11.176627000 JST",,"36634  >  6000 [FIN, ACK] Seq=28 Ack=1 Win=64256 Len=0 TSval=3430434435 TSecr=2137777664"
6,0.01474,192.168.11.10,192.168.11.30,TCP,66,0.007631,,0.007497,"Jan  6, 2024 19:36:11.184124000 JST",,6000  >  36634 [ACK] Seq=1 Ack=28 Win=65152 Len=0 TSval=2137777671 TSecr=3430434435
7,0.014977,192.168.11.10,192.168.11.30,TCP,66,0.007734,,0.000237,"Jan  6, 2024 19:36:11.184361000 JST",,"6000  >  36634 [FIN, ACK] Seq=1 Ack=29 Win=65152 Len=0 TSval=2137777673 TSecr=3430434435"
8,0.015026,192.168.11.30,192.168.11.10,TCP,66,0.000049,,0.000049,"Jan  6, 2024 19:36:11.184410000 JST",,36634  >  6000 [ACK] Seq=29 Ack=2 Win=64256 Len=0 TSval=3430434443 TSecr=2137777673
9,0.048391,192.168.11.30,255.255.255.255,UDP,209,,Åü,0.033365,"Jan  6, 2024 19:36:11.217775000 JST",7b2273656d616e74696373223a207b22656e74697479223a2022504944222c202262617365656e74697479223a2022616e79222c2022726f6c65223a2022686868222c20227370617469616c223a2022616e79222c202274656d706f72616c223a2022616e79227d2c20226461746170726f7065727479223a207b22666f726d6174223a2022696e616f6b615f70726f6772616d5f73616d706c655f73656d616e746963227d7d,42228  >  7000 Len=167
10,0.057186,192.168.11.21,192.168.11.30,TCP,74,,Åú,0.008795,"Jan  6, 2024 19:36:11.226570000 JST",,50508  >  6000 [SYN] Seq=0 Win=64240 Len=0 MSS=1460 SACK_PERM TSval=2225407299 TSecr=0 WS=128
11,0.057363,192.168.11.30,192.168.11.21,TCP,74,0.000177,,0.000177,"Jan  6, 2024 19:36:11.226747000 JST",,"6000  >  50508 [SYN, ACK] Seq=0 Ack=1 Win=65160 Len=0 MSS=1460 SACK_PERM TSval=1385519499 TSecr=2225407299 WS=128"
12,0.064062,192.168.11.21,192.168.11.30,TCP,66,0.006699,,0.006699,"Jan  6, 2024 19:36:11.233446000 JST",,50508  >  6000 [ACK] Seq=1 Ack=1 Win=64256 Len=0 TSval=2225407308 TSecr=1385519499
13,0.064652,192.168.11.21,192.168.11.30,TCP,93,,,0.00059,"Jan  6, 2024 19:36:11.234036000 JST",,"50508  >  6000 [PSH, ACK] Seq=1 Ack=1 Win=64256 Len=27 TSval=2225407309 TSecr=1385519499 [TCP segment of a reassembled PDU]"
14,0.064761,192.168.11.30,192.168.11.21,TCP,66,0.000109,,0.000109,"Jan  6, 2024 19:36:11.234145000 JST",,6000  >  50508 [ACK] Seq=1 Ack=28 Win=65152 Len=0 TSval=1385519507 TSecr=2225407309
15,0.064868,192.168.11.21,192.168.11.30,TCP,66,,,0.000107,"Jan  6, 2024 19:36:11.234252000 JST",,"50508  >  6000 [FIN, ACK] Seq=28 Ack=1 Win=64256 Len=0 TSval=2225407309 TSecr=1385519499"
16,0.066584,192.168.11.30,192.168.11.21,TCP,66,0.001716,,0.001716,"Jan  6, 2024 19:36:11.235968000 JST",,"6000  >  50508 [FIN, ACK] Seq=1 Ack=29 Win=65152 Len=0 TSval=1385519508 TSecr=2225407309"
17,0.071219,192.168.11.21,192.168.11.30,TCP,66,0.004635,,0.004635,"Jan  6, 2024 19:36:11.240603000 JST",,50508  >  6000 [ACK] Seq=29 Ack=2 Win=64256 Len=0 TSval=2225407316 TSecr=1385519508
18,10.349666,192.168.11.30,192.168.11.10,TCP,74,,,10.278447,"Jan  6, 2024 19:36:21.519050000 JST",,43558  >  6000 [SYN] Seq=0 Win=64240 Len=0 MSS=1460 SACK_PERM TSval=3430444778 TSecr=0 WS=128
19,10.356362,192.168.11.10,192.168.11.30,TCP,74,0.006696,,0.006696,"Jan  6, 2024 19:36:21.525746000 JST",,"6000  >  43558 [SYN, ACK] Seq=0 Ack=1 Win=65160 Len=0 MSS=1460 SACK_PERM TSval=2137788013 TSecr=3430444778 WS=128"
20,10.356473,192.168.11.30,192.168.11.10,TCP,66,0.000111,,0.000111,"Jan  6, 2024 19:36:21.525857000 JST",,43558  >  6000 [ACK] Seq=1 Ack=1 Win=64256 Len=0 TSval=3430444784 TSecr=2137788013
21,10.356647,192.168.11.30,192.168.11.10,TCP,93,,,0.000174,"Jan  6, 2024 19:36:21.526031000 JST",,"43558  >  6000 [PSH, ACK] Seq=1 Ack=1 Win=64256 Len=27 TSval=3430444785 TSecr=2137788013 [TCP segment of a reassembled PDU]"
22,10.356757,192.168.11.30,192.168.11.10,TCP,66,,,0.00011,"Jan  6, 2024 19:36:21.526141000 JST",,"43558  >  6000 [FIN, ACK] Seq=28 Ack=1 Win=64256 Len=0 TSval=3430444785 TSecr=2137788013"
23,10.364012,192.168.11.10,192.168.11.30,TCP,66,0.007365,,0.007255,"Jan  6, 2024 19:36:21.533396000 JST",,6000  >  43558 [ACK] Seq=1 Ack=28 Win=65152 Len=0 TSval=2137788021 TSecr=3430444785
24,10.366593,192.168.11.10,192.168.11.30,TCP,66,0.009836,,0.002581,"Jan  6, 2024 19:36:21.535977000 JST",,"6000  >  43558 [FIN, ACK] Seq=1 Ack=29 Win=65152 Len=0 TSval=2137788023 TSecr=3430444785"
25,10.36664,192.168.11.30,192.168.11.10,TCP,66,0.000047,,0.000047,"Jan  6, 2024 19:36:21.536024000 JST",,43558  >  6000 [ACK] Seq=29 Ack=2 Win=64256 Len=0 TSval=3430444795 TSecr=2137788023
26,10.395891,192.168.11.30,255.255.255.255,UDP,209,,Åü,0.029251,"Jan  6, 2024 19:36:21.565275000 JST",7b2273656d616e74696373223a207b22656e74697479223a2022504944222c202262617365656e74697479223a2022616e79222c2022726f6c65223a2022686868222c20227370617469616c223a2022616e79222c202274656d706f72616c223a2022616e79227d2c20226461746170726f7065727479223a207b22666f726d6174223a2022696e616f6b615f70726f6772616d5f73616d706c655f73656d616e746963227d7d,33715  >  7000 Len=167
27,10.412845,192.168.11.21,192.168.11.30,TCP,74,,Åú,0.016954,"Jan  6, 2024 19:36:21.582229000 JST",,54428  >  6000 [SYN] Seq=0 Win=64240 Len=0 MSS=1460 SACK_PERM TSval=2225417646 TSecr=0 WS=128
28,10.413054,192.168.11.30,192.168.11.21,TCP,74,0.000209,,0.000209,"Jan  6, 2024 19:36:21.582438000 JST",,"6000  >  54428 [SYN, ACK] Seq=0 Ack=1 Win=65160 Len=0 MSS=1460 SACK_PERM TSval=1385529855 TSecr=2225417646 WS=128"
29,10.420715,192.168.11.21,192.168.11.30,TCP,66,0.007661,,0.007661,"Jan  6, 2024 19:36:21.590099000 JST",,54428  >  6000 [ACK] Seq=1 Ack=1 Win=64256 Len=0 TSval=2225417665 TSecr=1385529855
30,10.421756,192.168.11.21,192.168.11.30,TCP,93,,,0.001041,"Jan  6, 2024 19:36:21.591140000 JST",,"54428  >  6000 [PSH, ACK] Seq=1 Ack=1 Win=64256 Len=27 TSval=2225417665 TSecr=1385529855 [TCP segment of a reassembled PDU]"
31,10.421972,192.168.11.30,192.168.11.21,TCP,66,0.000216,,0.000216,"Jan  6, 2024 19:36:21.591356000 JST",,6000  >  54428 [ACK] Seq=1 Ack=28 Win=65152 Len=0 TSval=1385529864 TSecr=2225417665
32,10.422081,192.168.11.21,192.168.11.30,TCP,66,,,0.000109,"Jan  6, 2024 19:36:21.591465000 JST",,"54428  >  6000 [FIN, ACK] Seq=28 Ack=1 Win=64256 Len=0 TSval=2225417665 TSecr=1385529855"
33,10.42396,192.168.11.30,192.168.11.21,TCP,66,0.001879,,0.001879,"Jan  6, 2024 19:36:21.593344000 JST",,"6000  >  54428 [FIN, ACK] Seq=1 Ack=29 Win=65152 Len=0 TSval=1385529866 TSecr=2225417665"
34,10.428591,192.168.11.21,192.168.11.30,TCP,66,0.004631,,0.004631,"Jan  6, 2024 19:36:21.597975000 JST",,54428  >  6000 [ACK] Seq=29 Ack=2 Win=64256 Len=0 TSval=2225417673 TSecr=1385529866
35,20.237297,192.168.11.30,192.168.11.10,TCP,74,,,9.808706,"Jan  6, 2024 19:36:31.406681000 JST",,33280  >  6000 [SYN] Seq=0 Win=64240 Len=0 MSS=1460 SACK_PERM TSval=3430454665 TSecr=0 WS=128
36,20.243927,192.168.11.10,192.168.11.30,TCP,74,0.00663,,0.00663,"Jan  6, 2024 19:36:31.413311000 JST",,"6000  >  33280 [SYN, ACK] Seq=0 Ack=1 Win=65160 Len=0 MSS=1460 SACK_PERM TSval=2137797901 TSecr=3430454665 WS=128"
37,20.244042,192.168.11.30,192.168.11.10,TCP,66,0.000115,,0.000115,"Jan  6, 2024 19:36:31.413426000 JST",,33280  >  6000 [ACK] Seq=1 Ack=1 Win=64256 Len=0 TSval=3430454672 TSecr=2137797901
38,20.244201,192.168.11.30,192.168.11.10,TCP,93,,,0.000159,"Jan  6, 2024 19:36:31.413585000 JST",,"33280  >  6000 [PSH, ACK] Seq=1 Ack=1 Win=64256 Len=27 TSval=3430454672 TSecr=2137797901 [TCP segment of a reassembled PDU]"
39,20.244299,192.168.11.30,192.168.11.10,TCP,66,,,0.000098,"Jan  6, 2024 19:36:31.413683000 JST",,"33280  >  6000 [FIN, ACK] Seq=28 Ack=1 Win=64256 Len=0 TSval=3430454672 TSecr=2137797901"
40,20.251902,192.168.11.10,192.168.11.30,TCP,66,0.007701,,0.007603,"Jan  6, 2024 19:36:31.421286000 JST",,6000  >  33280 [ACK] Seq=1 Ack=28 Win=65152 Len=0 TSval=2137797908 TSecr=3430454672
41,20.252291,192.168.11.10,192.168.11.30,TCP,66,0.007992,,0.000389,"Jan  6, 2024 19:36:31.421675000 JST",,"6000  >  33280 [FIN, ACK] Seq=1 Ack=29 Win=65152 Len=0 TSval=2137797910 TSecr=3430454672"
42,20.252349,192.168.11.30,192.168.11.10,TCP,66,0.000058,,0.000058,"Jan  6, 2024 19:36:31.421733000 JST",,33280  >  6000 [ACK] Seq=29 Ack=2 Win=64256 Len=0 TSval=3430454680 TSecr=2137797910
43,20.280849,192.168.11.30,255.255.255.255,UDP,209,,Åü,0.0285,"Jan  6, 2024 19:36:31.450233000 JST",7b2273656d616e74696373223a207b22656e74697479223a2022504944222c202262617365656e74697479223a2022616e79222c2022726f6c65223a2022686868222c20227370617469616c223a2022616e79222c202274656d706f72616c223a2022616e79227d2c20226461746170726f7065727479223a207b22666f726d6174223a2022696e616f6b615f70726f6772616d5f73616d706c655f73656d616e746963227d7d,58367  >  7000 Len=167
44,20.286721,192.168.11.21,192.168.11.30,TCP,74,,Åú,0.005872,"Jan  6, 2024 19:36:31.456105000 JST",,59498  >  6000 [SYN] Seq=0 Win=64240 Len=0 MSS=1460 SACK_PERM TSval=2225427531 TSecr=0 WS=128
45,20.286878,192.168.11.30,192.168.11.21,TCP,74,0.000157,,0.000157,"Jan  6, 2024 19:36:31.456262000 JST",,"6000  >  59498 [SYN, ACK] Seq=0 Ack=1 Win=65160 Len=0 MSS=1460 SACK_PERM TSval=1385539729 TSecr=2225427531 WS=128"
46,20.293663,192.168.11.21,192.168.11.30,TCP,66,0.006785,,0.006785,"Jan  6, 2024 19:36:31.463047000 JST",,59498  >  6000 [ACK] Seq=1 Ack=1 Win=64256 Len=0 TSval=2225427538 TSecr=1385539729
47,20.294248,192.168.11.21,192.168.11.30,TCP,93,,,0.000585,"Jan  6, 2024 19:36:31.463632000 JST",,"59498  >  6000 [PSH, ACK] Seq=1 Ack=1 Win=64256 Len=27 TSval=2225427538 TSecr=1385539729 [TCP segment of a reassembled PDU]"
48,20.294352,192.168.11.30,192.168.11.21,TCP,66,0.000104,,0.000104,"Jan  6, 2024 19:36:31.463736000 JST",,6000  >  59498 [ACK] Seq=1 Ack=28 Win=65152 Len=0 TSval=1385539736 TSecr=2225427538
49,20.294431,192.168.11.21,192.168.11.30,TCP,66,,,0.000079,"Jan  6, 2024 19:36:31.463815000 JST",,"59498  >  6000 [FIN, ACK] Seq=28 Ack=1 Win=64256 Len=0 TSval=2225427538 TSecr=1385539729"
50,20.295525,192.168.11.30,192.168.11.21,TCP,66,0.001094,,0.001094,"Jan  6, 2024 19:36:31.464909000 JST",,"6000  >  59498 [FIN, ACK] Seq=1 Ack=29 Win=65152 Len=0 TSval=1385539737 TSecr=2225427538"
51,20.303107,192.168.11.21,192.168.11.30,TCP,66,0.007582,,0.007582,"Jan  6, 2024 19:36:31.472491000 JST",,59498  >  6000 [ACK] Seq=29 Ack=2 Win=64256 Len=0 TSval=2225427547 TSecr=1385539737
52,30.136295,192.168.11.30,192.168.11.10,TCP,74,,,9.833188,"Jan  6, 2024 19:36:41.305679000 JST",,44826  >  6000 [SYN] Seq=0 Win=64240 Len=0 MSS=1460 SACK_PERM TSval=3430464564 TSecr=0 WS=128
53,30.144521,192.168.11.10,192.168.11.30,TCP,74,0.008226,,0.008226,"Jan  6, 2024 19:36:41.313905000 JST",,"6000  >  44826 [SYN, ACK] Seq=0 Ack=1 Win=65160 Len=0 MSS=1460 SACK_PERM TSval=2137807800 TSecr=3430464564 WS=128"
54,30.144628,192.168.11.30,192.168.11.10,TCP,66,0.000107,,0.000107,"Jan  6, 2024 19:36:41.314012000 JST",,44826  >  6000 [ACK] Seq=1 Ack=1 Win=64256 Len=0 TSval=3430464573 TSecr=2137807800
55,30.144768,192.168.11.30,192.168.11.10,TCP,93,,,0.00014,"Jan  6, 2024 19:36:41.314152000 JST",,"44826  >  6000 [PSH, ACK] Seq=1 Ack=1 Win=64256 Len=27 TSval=3430464573 TSecr=2137807800 [TCP segment of a reassembled PDU]"
56,30.144885,192.168.11.30,192.168.11.10,TCP,66,,,0.000117,"Jan  6, 2024 19:36:41.314269000 JST",,"44826  >  6000 [FIN, ACK] Seq=28 Ack=1 Win=64256 Len=0 TSval=3430464573 TSecr=2137807800"
57,30.152071,192.168.11.10,192.168.11.30,TCP,66,0.007303,,0.007186,"Jan  6, 2024 19:36:41.321455000 JST",,6000  >  44826 [ACK] Seq=1 Ack=28 Win=65152 Len=0 TSval=2137807809 TSecr=3430464573
58,30.152444,192.168.11.10,192.168.11.30,TCP,66,0.007559,,0.000373,"Jan  6, 2024 19:36:41.321828000 JST",,"6000  >  44826 [FIN, ACK] Seq=1 Ack=29 Win=65152 Len=0 TSval=2137807810 TSecr=3430464573"
59,30.152494,192.168.11.30,192.168.11.10,TCP,66,0.00005,,0.00005,"Jan  6, 2024 19:36:41.321878000 JST",,44826  >  6000 [ACK] Seq=29 Ack=2 Win=64256 Len=0 TSval=3430464580 TSecr=2137807810
60,30.183649,192.168.11.30,255.255.255.255,UDP,209,,Åü,0.031155,"Jan  6, 2024 19:36:41.353033000 JST",7b2273656d616e74696373223a207b22656e74697479223a2022504944222c202262617365656e74697479223a2022616e79222c2022726f6c65223a2022686868222c20227370617469616c223a2022616e79222c202274656d706f72616c223a2022616e79227d2c20226461746170726f7065727479223a207b22666f726d6174223a2022696e616f6b615f70726f6772616d5f73616d706c655f73656d616e746963227d7d,49583  >  7000 Len=167
61,30.189314,192.168.11.21,192.168.11.30,TCP,74,,Åú,0.005665,"Jan  6, 2024 19:36:41.358698000 JST",,54474  >  6000 [SYN] Seq=0 Win=64240 Len=0 MSS=1460 SACK_PERM TSval=2225437434 TSecr=0 WS=128
62,30.189453,192.168.11.30,192.168.11.21,TCP,74,0.000139,,0.000139,"Jan  6, 2024 19:36:41.358837000 JST",,"6000  >  54474 [SYN, ACK] Seq=0 Ack=1 Win=65160 Len=0 MSS=1460 SACK_PERM TSval=1385549631 TSecr=2225437434 WS=128"
63,30.20116,192.168.11.21,192.168.11.30,TCP,66,0.011707,,0.011707,"Jan  6, 2024 19:36:41.370544000 JST",,54474  >  6000 [ACK] Seq=1 Ack=1 Win=64256 Len=0 TSval=2225437444 TSecr=1385549631
64,30.201723,192.168.11.21,192.168.11.30,TCP,93,,,0.000563,"Jan  6, 2024 19:36:41.371107000 JST",,"54474  >  6000 [PSH, ACK] Seq=1 Ack=1 Win=64256 Len=27 TSval=2225437444 TSecr=1385549631 [TCP segment of a reassembled PDU]"
65,30.201919,192.168.11.30,192.168.11.21,TCP,66,0.000196,,0.000196,"Jan  6, 2024 19:36:41.371303000 JST",,6000  >  54474 [ACK] Seq=1 Ack=28 Win=65152 Len=0 TSval=1385549644 TSecr=2225437444
66,30.20204,192.168.11.21,192.168.11.30,TCP,66,,,0.000121,"Jan  6, 2024 19:36:41.371424000 JST",,"54474  >  6000 [FIN, ACK] Seq=28 Ack=1 Win=64256 Len=0 TSval=2225437445 TSecr=1385549631"
67,30.20395,192.168.11.30,192.168.11.21,TCP,66,0.00191,,0.00191,"Jan  6, 2024 19:36:41.373334000 JST",,"6000  >  54474 [FIN, ACK] Seq=1 Ack=29 Win=65152 Len=0 TSval=1385549646 TSecr=2225437445"
68,30.2132,192.168.11.21,192.168.11.30,TCP,66,0.00925,,0.00925,"Jan  6, 2024 19:36:41.382584000 JST",,54474  >  6000 [ACK] Seq=29 Ack=2 Win=64256 Len=0 TSval=2225437457 TSecr=1385549646
69,37.951068,192.168.11.30,192.168.11.10,TCP,74,,,7.737868,"Jan  6, 2024 19:36:49.120452000 JST",,43518  >  6000 [SYN] Seq=0 Win=64240 Len=0 MSS=1460 SACK_PERM TSval=3430472379 TSecr=0 WS=128
70,37.958197,192.168.11.10,192.168.11.30,TCP,74,0.007129,,0.007129,"Jan  6, 2024 19:36:49.127581000 JST",,"6000  >  43518 [SYN, ACK] Seq=0 Ack=1 Win=65160 Len=0 MSS=1460 SACK_PERM TSval=2137815615 TSecr=3430472379 WS=128"
71,37.958316,192.168.11.30,192.168.11.10,TCP,66,0.000119,,0.000119,"Jan  6, 2024 19:36:49.127700000 JST",,43518  >  6000 [ACK] Seq=1 Ack=1 Win=64256 Len=0 TSval=3430472386 TSecr=2137815615
72,37.958495,192.168.11.30,192.168.11.10,TCP,93,,,0.000179,"Jan  6, 2024 19:36:49.127879000 JST",,"43518  >  6000 [PSH, ACK] Seq=1 Ack=1 Win=64256 Len=27 TSval=3430472386 TSecr=2137815615 [TCP segment of a reassembled PDU]"
73,37.958743,192.168.11.30,192.168.11.10,TCP,66,,,0.000248,"Jan  6, 2024 19:36:49.128127000 JST",,"43518  >  6000 [FIN, ACK] Seq=28 Ack=1 Win=64256 Len=0 TSval=3430472387 TSecr=2137815615"
74,37.96547,192.168.11.10,192.168.11.30,TCP,66,0.006975,,0.006727,"Jan  6, 2024 19:36:49.134854000 JST",,6000  >  43518 [ACK] Seq=1 Ack=28 Win=65152 Len=0 TSval=2137815622 TSecr=3430472386
75,37.965844,192.168.11.10,192.168.11.30,TCP,66,0.007101,,0.000374,"Jan  6, 2024 19:36:49.135228000 JST",,"6000  >  43518 [FIN, ACK] Seq=1 Ack=29 Win=65152 Len=0 TSval=2137815623 TSecr=3430472387"
76,37.965916,192.168.11.30,192.168.11.10,TCP,66,0.000072,,0.000072,"Jan  6, 2024 19:36:49.135300000 JST",,43518  >  6000 [ACK] Seq=29 Ack=2 Win=64256 Len=0 TSval=3430472394 TSecr=2137815623
77,37.994458,192.168.11.30,255.255.255.255,UDP,209,,Åü,0.028542,"Jan  6, 2024 19:36:49.163842000 JST",7b2273656d616e74696373223a207b22656e74697479223a2022504944222c202262617365656e74697479223a2022616e79222c2022726f6c65223a2022686868222c20227370617469616c223a2022616e79222c202274656d706f72616c223a2022616e79227d2c20226461746170726f7065727479223a207b22666f726d6174223a2022696e616f6b615f70726f6772616d5f73616d706c655f73656d616e746963227d7d,34540  >  7000 Len=167
78,38.000138,192.168.11.21,192.168.11.30,TCP,74,,Åú,0.00568,"Jan  6, 2024 19:36:49.169522000 JST",,51990  >  6000 [SYN] Seq=0 Win=64240 Len=0 MSS=1460 SACK_PERM TSval=2225445245 TSecr=0 WS=128
79,38.000243,192.168.11.30,192.168.11.21,TCP,74,0.000105,,0.000105,"Jan  6, 2024 19:36:49.169627000 JST",,"6000  >  51990 [SYN, ACK] Seq=0 Ack=1 Win=65160 Len=0 MSS=1460 SACK_PERM TSval=1385557442 TSecr=2225445245 WS=128"
80,38.012825,192.168.11.21,192.168.11.30,TCP,66,0.012582,,0.012582,"Jan  6, 2024 19:36:49.182209000 JST",,51990  >  6000 [ACK] Seq=1 Ack=1 Win=64256 Len=0 TSval=2225445257 TSecr=1385557442
81,38.013498,192.168.11.21,192.168.11.30,TCP,93,,,0.000673,"Jan  6, 2024 19:36:49.182882000 JST",,"51990  >  6000 [PSH, ACK] Seq=1 Ack=1 Win=64256 Len=27 TSval=2225445257 TSecr=1385557442 [TCP segment of a reassembled PDU]"
82,38.013633,192.168.11.30,192.168.11.21,TCP,66,0.000135,,0.000135,"Jan  6, 2024 19:36:49.183017000 JST",,6000  >  51990 [ACK] Seq=1 Ack=28 Win=65152 Len=0 TSval=1385557456 TSecr=2225445257
83,38.01375,192.168.11.21,192.168.11.30,TCP,66,,,0.000117,"Jan  6, 2024 19:36:49.183134000 JST",,"51990  >  6000 [FIN, ACK] Seq=28 Ack=1 Win=64256 Len=0 TSval=2225445257 TSecr=1385557442"
84,38.015139,192.168.11.30,192.168.11.21,TCP,66,0.001389,,0.001389,"Jan  6, 2024 19:36:49.184523000 JST",,"6000  >  51990 [FIN, ACK] Seq=1 Ack=29 Win=65152 Len=0 TSval=1385557457 TSecr=2225445257"
85,38.02127,192.168.11.21,192.168.11.30,TCP,66,0.006131,,0.006131,"Jan  6, 2024 19:36:49.190654000 JST",,51990  >  6000 [ACK] Seq=29 Ack=2 Win=64256 Len=0 TSval=2225445265 TSecr=1385557457
86,45.75724,192.168.11.30,192.168.11.10,TCP,74,,,7.73597,"Jan  6, 2024 19:36:56.926624000 JST",,60658  >  6000 [SYN] Seq=0 Win=64240 Len=0 MSS=1460 SACK_PERM TSval=3430480185 TSecr=0 WS=128
87,45.767898,192.168.11.10,192.168.11.30,TCP,74,0.010658,,0.010658,"Jan  6, 2024 19:36:56.937282000 JST",,"6000  >  60658 [SYN, ACK] Seq=0 Ack=1 Win=65160 Len=0 MSS=1460 SACK_PERM TSval=2137823421 TSecr=3430480185 WS=128"
88,45.768025,192.168.11.30,192.168.11.10,TCP,66,0.000127,,0.000127,"Jan  6, 2024 19:36:56.937409000 JST",,60658  >  6000 [ACK] Seq=1 Ack=1 Win=64256 Len=0 TSval=3430480196 TSecr=2137823421
89,45.768177,192.168.11.30,192.168.11.10,TCP,93,,,0.000152,"Jan  6, 2024 19:36:56.937561000 JST",,"60658  >  6000 [PSH, ACK] Seq=1 Ack=1 Win=64256 Len=27 TSval=3430480196 TSecr=2137823421 [TCP segment of a reassembled PDU]"
90,45.768272,192.168.11.30,192.168.11.10,TCP,66,,,0.000095,"Jan  6, 2024 19:36:56.937656000 JST",,"60658  >  6000 [FIN, ACK] Seq=28 Ack=1 Win=64256 Len=0 TSval=3430480196 TSecr=2137823421"
91,45.775386,192.168.11.10,192.168.11.30,TCP,66,0.007209,,0.007114,"Jan  6, 2024 19:36:56.944770000 JST",,6000  >  60658 [ACK] Seq=1 Ack=28 Win=65152 Len=0 TSval=2137823432 TSecr=3430480196
92,45.775787,192.168.11.10,192.168.11.30,TCP,66,0.007515,,0.000401,"Jan  6, 2024 19:36:56.945171000 JST",,"6000  >  60658 [FIN, ACK] Seq=1 Ack=29 Win=65152 Len=0 TSval=2137823433 TSecr=3430480196"
93,45.775853,192.168.11.30,192.168.11.10,TCP,66,0.000066,,0.000066,"Jan  6, 2024 19:36:56.945237000 JST",,60658  >  6000 [ACK] Seq=29 Ack=2 Win=64256 Len=0 TSval=3430480204 TSecr=2137823433
94,45.804028,192.168.11.30,255.255.255.255,UDP,209,,Åü,0.028175,"Jan  6, 2024 19:36:56.973412000 JST",7b2273656d616e74696373223a207b22656e74697479223a2022504944222c202262617365656e74697479223a2022616e79222c2022726f6c65223a2022686868222c20227370617469616c223a2022616e79222c202274656d706f72616c223a2022616e79227d2c20226461746170726f7065727479223a207b22666f726d6174223a2022696e616f6b615f70726f6772616d5f73616d706c655f73656d616e746963227d7d,37308  >  7000 Len=167
95,45.810811,192.168.11.21,192.168.11.30,TCP,74,,Åú,0.006783,"Jan  6, 2024 19:36:56.980195000 JST",,48602  >  6000 [SYN] Seq=0 Win=64240 Len=0 MSS=1460 SACK_PERM TSval=2225453054 TSecr=0 WS=128
96,45.810967,192.168.11.30,192.168.11.21,TCP,74,0.000156,,0.000156,"Jan  6, 2024 19:36:56.980351000 JST",,"6000  >  48602 [SYN, ACK] Seq=0 Ack=1 Win=65160 Len=0 MSS=1460 SACK_PERM TSval=1385565253 TSecr=2225453054 WS=128"
97,45.817611,192.168.11.21,192.168.11.30,TCP,66,0.006644,,0.006644,"Jan  6, 2024 19:36:56.986995000 JST",,48602  >  6000 [ACK] Seq=1 Ack=1 Win=64256 Len=0 TSval=2225453062 TSecr=1385565253
98,45.81826,192.168.11.21,192.168.11.30,TCP,93,,,0.000649,"Jan  6, 2024 19:36:56.987644000 JST",,"48602  >  6000 [PSH, ACK] Seq=1 Ack=1 Win=64256 Len=27 TSval=2225453062 TSecr=1385565253 [TCP segment of a reassembled PDU]"
99,45.818383,192.168.11.30,192.168.11.21,TCP,66,0.000123,,0.000123,"Jan  6, 2024 19:36:56.987767000 JST",,6000  >  48602 [ACK] Seq=1 Ack=28 Win=65152 Len=0 TSval=1385565260 TSecr=2225453062
100,45.818461,192.168.11.21,192.168.11.30,TCP,66,,,0.000078,"Jan  6, 2024 19:36:56.987845000 JST",,"48602  >  6000 [FIN, ACK] Seq=28 Ack=1 Win=64256 Len=0 TSval=2225453062 TSecr=1385565253"
101,45.819932,192.168.11.30,192.168.11.21,TCP,66,0.001471,,0.001471,"Jan  6, 2024 19:36:56.989316000 JST",,"6000  >  48602 [FIN, ACK] Seq=1 Ack=29 Win=65152 Len=0 TSval=1385565262 TSecr=2225453062"
102,45.825992,192.168.11.21,192.168.11.30,TCP,66,0.00606,,0.00606,"Jan  6, 2024 19:36:56.995376000 JST",,48602  >  6000 [ACK] Seq=29 Ack=2 Win=64256 Len=0 TSval=2225453070 TSecr=1385565262
103,53.623833,192.168.11.30,192.168.11.10,TCP,74,,,7.797841,"Jan  6, 2024 19:37:04.793217000 JST",,48266  >  6000 [SYN] Seq=0 Win=64240 Len=0 MSS=1460 SACK_PERM TSval=3430488052 TSecr=0 WS=128
104,53.631823,192.168.11.10,192.168.11.30,TCP,74,0.00799,,0.00799,"Jan  6, 2024 19:37:04.801207000 JST",,"6000  >  48266 [SYN, ACK] Seq=0 Ack=1 Win=65160 Len=0 MSS=1460 SACK_PERM TSval=2137831288 TSecr=3430488052 WS=128"
105,53.631932,192.168.11.30,192.168.11.10,TCP,66,0.000109,,0.000109,"Jan  6, 2024 19:37:04.801316000 JST",,48266  >  6000 [ACK] Seq=1 Ack=1 Win=64256 Len=0 TSval=3430488060 TSecr=2137831288
106,53.632067,192.168.11.30,192.168.11.10,TCP,93,,,0.000135,"Jan  6, 2024 19:37:04.801451000 JST",,"48266  >  6000 [PSH, ACK] Seq=1 Ack=1 Win=64256 Len=27 TSval=3430488060 TSecr=2137831288 [TCP segment of a reassembled PDU]"
107,53.632173,192.168.11.30,192.168.11.10,TCP,66,,,0.000106,"Jan  6, 2024 19:37:04.801557000 JST",,"48266  >  6000 [FIN, ACK] Seq=28 Ack=1 Win=64256 Len=0 TSval=3430488060 TSecr=2137831288"
108,53.639469,192.168.11.10,192.168.11.30,TCP,66,0.007402,,0.007296,"Jan  6, 2024 19:37:04.808853000 JST",,6000  >  48266 [ACK] Seq=1 Ack=28 Win=65152 Len=0 TSval=2137831296 TSecr=3430488060
109,53.639862,192.168.11.10,192.168.11.30,TCP,66,0.007689,,0.000393,"Jan  6, 2024 19:37:04.809246000 JST",,"6000  >  48266 [FIN, ACK] Seq=1 Ack=29 Win=65152 Len=0 TSval=2137831297 TSecr=3430488060"
110,53.639924,192.168.11.30,192.168.11.10,TCP,66,0.000062,,0.000062,"Jan  6, 2024 19:37:04.809308000 JST",,48266  >  6000 [ACK] Seq=29 Ack=2 Win=64256 Len=0 TSval=3430488068 TSecr=2137831297
111,53.668461,192.168.11.30,255.255.255.255,UDP,209,,Åü,0.028537,"Jan  6, 2024 19:37:04.837845000 JST",7b2273656d616e74696373223a207b22656e74697479223a2022504944222c202262617365656e74697479223a2022616e79222c2022726f6c65223a2022686868222c20227370617469616c223a2022616e79222c202274656d706f72616c223a2022616e79227d2c20226461746170726f7065727479223a207b22666f726d6174223a2022696e616f6b615f70726f6772616d5f73616d706c655f73656d616e746963227d7d,36978  >  7000 Len=167
112,53.67423,192.168.11.21,192.168.11.30,TCP,74,,Åú,0.005769,"Jan  6, 2024 19:37:04.843614000 JST",,48606  >  6000 [SYN] Seq=0 Win=64240 Len=0 MSS=1460 SACK_PERM TSval=2225460919 TSecr=0 WS=128
113,53.674366,192.168.11.30,192.168.11.21,TCP,74,0.000136,,0.000136,"Jan  6, 2024 19:37:04.843750000 JST",,"6000  >  48606 [SYN, ACK] Seq=0 Ack=1 Win=65160 Len=0 MSS=1460 SACK_PERM TSval=1385573116 TSecr=2225460919 WS=128"
114,53.681145,192.168.11.21,192.168.11.30,TCP,66,0.006779,,0.006779,"Jan  6, 2024 19:37:04.850529000 JST",,48606  >  6000 [ACK] Seq=1 Ack=1 Win=64256 Len=0 TSval=2225460925 TSecr=1385573116
115,53.681817,192.168.11.21,192.168.11.30,TCP,93,,,0.000672,"Jan  6, 2024 19:37:04.851201000 JST",,"48606  >  6000 [PSH, ACK] Seq=1 Ack=1 Win=64256 Len=27 TSval=2225460926 TSecr=1385573116 [TCP segment of a reassembled PDU]"
116,53.681942,192.168.11.30,192.168.11.21,TCP,66,0.000125,,0.000125,"Jan  6, 2024 19:37:04.851326000 JST",,6000  >  48606 [ACK] Seq=1 Ack=28 Win=65152 Len=0 TSval=1385573124 TSecr=2225460926
117,53.682054,192.168.11.21,192.168.11.30,TCP,66,,,0.000112,"Jan  6, 2024 19:37:04.851438000 JST",,"48606  >  6000 [FIN, ACK] Seq=28 Ack=1 Win=64256 Len=0 TSval=2225460926 TSecr=1385573116"
118,53.683691,192.168.11.30,192.168.11.21,TCP,66,0.001637,,0.001637,"Jan  6, 2024 19:37:04.853075000 JST",,"6000  >  48606 [FIN, ACK] Seq=1 Ack=29 Win=65152 Len=0 TSval=1385573126 TSecr=2225460926"
119,53.689588,192.168.11.21,192.168.11.30,TCP,66,0.005897,,0.005897,"Jan  6, 2024 19:37:04.858972000 JST",,48606  >  6000 [ACK] Seq=29 Ack=2 Win=64256 Len=0 TSval=2225460934 TSecr=1385573126
120,61.910756,192.168.11.30,192.168.11.10,TCP,74,,,8.221168,"Jan  6, 2024 19:37:13.080140000 JST",,41692  >  6000 [SYN] Seq=0 Win=64240 Len=0 MSS=1460 SACK_PERM TSval=3430496339 TSecr=0 WS=128
121,61.917443,192.168.11.10,192.168.11.30,TCP,74,0.006687,,0.006687,"Jan  6, 2024 19:37:13.086827000 JST",,"6000  >  41692 [SYN, ACK] Seq=0 Ack=1 Win=65160 Len=0 MSS=1460 SACK_PERM TSval=2137839574 TSecr=3430496339 WS=128"
122,61.917562,192.168.11.30,192.168.11.10,TCP,66,0.000119,,0.000119,"Jan  6, 2024 19:37:13.086946000 JST",,41692  >  6000 [ACK] Seq=1 Ack=1 Win=64256 Len=0 TSval=3430496346 TSecr=2137839574
123,61.917702,192.168.11.30,192.168.11.10,TCP,93,,,0.00014,"Jan  6, 2024 19:37:13.087086000 JST",,"41692  >  6000 [PSH, ACK] Seq=1 Ack=1 Win=64256 Len=27 TSval=3430496346 TSecr=2137839574 [TCP segment of a reassembled PDU]"
124,61.917814,192.168.11.30,192.168.11.10,TCP,66,,,0.000112,"Jan  6, 2024 19:37:13.087198000 JST",,"41692  >  6000 [FIN, ACK] Seq=28 Ack=1 Win=64256 Len=0 TSval=3430496346 TSecr=2137839574"
125,61.925963,192.168.11.10,192.168.11.30,TCP,66,0.008261,,0.008149,"Jan  6, 2024 19:37:13.095347000 JST",,6000  >  41692 [ACK] Seq=1 Ack=28 Win=65152 Len=0 TSval=2137839583 TSecr=3430496346
126,61.926336,192.168.11.10,192.168.11.30,TCP,66,0.008522,,0.000373,"Jan  6, 2024 19:37:13.095720000 JST",,"6000  >  41692 [FIN, ACK] Seq=1 Ack=29 Win=65152 Len=0 TSval=2137839584 TSecr=3430496346"
127,61.926404,192.168.11.30,192.168.11.10,TCP,66,0.000068,,0.000068,"Jan  6, 2024 19:37:13.095788000 JST",,41692  >  6000 [ACK] Seq=29 Ack=2 Win=64256 Len=0 TSval=3430496354 TSecr=2137839584
128,61.956365,192.168.11.30,255.255.255.255,UDP,209,,Åü,0.029961,"Jan  6, 2024 19:37:13.125749000 JST",7b2273656d616e74696373223a207b22656e74697479223a2022504944222c202262617365656e74697479223a2022616e79222c2022726f6c65223a2022686868222c20227370617469616c223a2022616e79222c202274656d706f72616c223a2022616e79227d2c20226461746170726f7065727479223a207b22666f726d6174223a2022696e616f6b615f70726f6772616d5f73616d706c655f73656d616e746963227d7d,41010  >  7000 Len=167
129,61.962184,192.168.11.21,192.168.11.30,TCP,74,,Åú,0.005819,"Jan  6, 2024 19:37:13.131568000 JST",,46256  >  6000 [SYN] Seq=0 Win=64240 Len=0 MSS=1460 SACK_PERM TSval=2225469206 TSecr=0 WS=128
130,61.962339,192.168.11.30,192.168.11.21,TCP,74,0.000155,,0.000155,"Jan  6, 2024 19:37:13.131723000 JST",,"6000  >  46256 [SYN, ACK] Seq=0 Ack=1 Win=65160 Len=0 MSS=1460 SACK_PERM TSval=1385581404 TSecr=2225469206 WS=128"
131,61.969172,192.168.11.21,192.168.11.30,TCP,66,0.006833,,0.006833,"Jan  6, 2024 19:37:13.138556000 JST",,46256  >  6000 [ACK] Seq=1 Ack=1 Win=64256 Len=0 TSval=2225469213 TSecr=1385581404
132,61.969792,192.168.11.21,192.168.11.30,TCP,93,,,0.00062,"Jan  6, 2024 19:37:13.139176000 JST",,"46256  >  6000 [PSH, ACK] Seq=1 Ack=1 Win=64256 Len=27 TSval=2225469214 TSecr=1385581404 [TCP segment of a reassembled PDU]"
133,61.969896,192.168.11.30,192.168.11.21,TCP,66,0.000104,,0.000104,"Jan  6, 2024 19:37:13.139280000 JST",,6000  >  46256 [ACK] Seq=1 Ack=28 Win=65152 Len=0 TSval=1385581412 TSecr=2225469214
134,61.969975,192.168.11.21,192.168.11.30,TCP,66,,,0.000079,"Jan  6, 2024 19:37:13.139359000 JST",,"46256  >  6000 [FIN, ACK] Seq=28 Ack=1 Win=64256 Len=0 TSval=2225469214 TSecr=1385581404"
135,61.971302,192.168.11.30,192.168.11.21,TCP,66,0.001327,,0.001327,"Jan  6, 2024 19:37:13.140686000 JST",,"6000  >  46256 [FIN, ACK] Seq=1 Ack=29 Win=65152 Len=0 TSval=1385581413 TSecr=2225469214"
136,61.977488,192.168.11.21,192.168.11.30,TCP,66,0.006186,,0.006186,"Jan  6, 2024 19:37:13.146872000 JST",,46256  >  6000 [ACK] Seq=29 Ack=2 Win=64256 Len=0 TSval=2225469221 TSecr=1385581413
137,71.838734,192.168.11.30,192.168.11.10,TCP,74,,,9.861246,"Jan  6, 2024 19:37:23.008118000 JST",,44078  >  6000 [SYN] Seq=0 Win=64240 Len=0 MSS=1460 SACK_PERM TSval=3430506267 TSecr=0 WS=128
138,71.846327,192.168.11.10,192.168.11.30,TCP,74,0.007593,,0.007593,"Jan  6, 2024 19:37:23.015711000 JST",,"6000  >  44078 [SYN, ACK] Seq=0 Ack=1 Win=65160 Len=0 MSS=1460 SACK_PERM TSval=2137849503 TSecr=3430506267 WS=128"
139,71.84643,192.168.11.30,192.168.11.10,TCP,66,0.000103,,0.000103,"Jan  6, 2024 19:37:23.015814000 JST",,44078  >  6000 [ACK] Seq=1 Ack=1 Win=64256 Len=0 TSval=3430506274 TSecr=2137849503
140,71.846662,192.168.11.30,192.168.11.10,TCP,93,,,0.000232,"Jan  6, 2024 19:37:23.016046000 JST",,"44078  >  6000 [PSH, ACK] Seq=1 Ack=1 Win=64256 Len=27 TSval=3430506275 TSecr=2137849503 [TCP segment of a reassembled PDU]"
141,71.846772,192.168.11.30,192.168.11.10,TCP,66,,,0.00011,"Jan  6, 2024 19:37:23.016156000 JST",,"44078  >  6000 [FIN, ACK] Seq=28 Ack=1 Win=64256 Len=0 TSval=3430506275 TSecr=2137849503"
142,71.854109,192.168.11.10,192.168.11.30,TCP,66,0.007447,,0.007337,"Jan  6, 2024 19:37:23.023493000 JST",,6000  >  44078 [ACK] Seq=1 Ack=28 Win=65152 Len=0 TSval=2137849511 TSecr=3430506275
143,71.854487,192.168.11.10,192.168.11.30,TCP,66,0.007715,,0.000378,"Jan  6, 2024 19:37:23.023871000 JST",,"6000  >  44078 [FIN, ACK] Seq=1 Ack=29 Win=65152 Len=0 TSval=2137849512 TSecr=3430506275"
144,71.854553,192.168.11.30,192.168.11.10,TCP,66,0.000066,,0.000066,"Jan  6, 2024 19:37:23.023937000 JST",,44078  >  6000 [ACK] Seq=29 Ack=2 Win=64256 Len=0 TSval=3430506282 TSecr=2137849512
145,71.883648,192.168.11.30,255.255.255.255,UDP,209,,Åü,0.029095,"Jan  6, 2024 19:37:23.053032000 JST",7b2273656d616e74696373223a207b22656e74697479223a2022504944222c202262617365656e74697479223a2022616e79222c2022726f6c65223a2022686868222c20227370617469616c223a2022616e79222c202274656d706f72616c223a2022616e79227d2c20226461746170726f7065727479223a207b22666f726d6174223a2022696e616f6b615f70726f6772616d5f73616d706c655f73656d616e746963227d7d,39922  >  7000 Len=167
146,71.889223,192.168.11.21,192.168.11.30,TCP,74,,Åú,0.005575,"Jan  6, 2024 19:37:23.058607000 JST",,49106  >  6000 [SYN] Seq=0 Win=64240 Len=0 MSS=1460 SACK_PERM TSval=2225479134 TSecr=0 WS=128
147,71.889357,192.168.11.30,192.168.11.21,TCP,74,0.000134,,0.000134,"Jan  6, 2024 19:37:23.058741000 JST",,"6000  >  49106 [SYN, ACK] Seq=0 Ack=1 Win=65160 Len=0 MSS=1460 SACK_PERM TSval=1385591331 TSecr=2225479134 WS=128"
148,71.895173,192.168.11.21,192.168.11.30,TCP,66,0.005816,,0.005816,"Jan  6, 2024 19:37:23.064557000 JST",,49106  >  6000 [ACK] Seq=1 Ack=1 Win=64256 Len=0 TSval=2225479139 TSecr=1385591331
149,71.895745,192.168.11.21,192.168.11.30,TCP,93,,,0.000572,"Jan  6, 2024 19:37:23.065129000 JST",,"49106  >  6000 [PSH, ACK] Seq=1 Ack=1 Win=64256 Len=27 TSval=2225479139 TSecr=1385591331 [TCP segment of a reassembled PDU]"
150,71.895845,192.168.11.30,192.168.11.21,TCP,66,0.0001,,0.0001,"Jan  6, 2024 19:37:23.065229000 JST",,6000  >  49106 [ACK] Seq=1 Ack=28 Win=65152 Len=0 TSval=1385591338 TSecr=2225479139
151,71.89593,192.168.11.21,192.168.11.30,TCP,66,,,0.000085,"Jan  6, 2024 19:37:23.065314000 JST",,"49106  >  6000 [FIN, ACK] Seq=28 Ack=1 Win=64256 Len=0 TSval=2225479140 TSecr=1385591331"
152,71.897397,192.168.11.30,192.168.11.21,TCP,66,0.001467,,0.001467,"Jan  6, 2024 19:37:23.066781000 JST",,"6000  >  49106 [FIN, ACK] Seq=1 Ack=29 Win=65152 Len=0 TSval=1385591339 TSecr=2225479140"
153,71.902659,192.168.11.21,192.168.11.30,TCP,66,0.005262,,0.005262,"Jan  6, 2024 19:37:23.072043000 JST",,49106  >  6000 [ACK] Seq=29 Ack=2 Win=64256 Len=0 TSval=2225479147 TSecr=1385591339
154,82.739447,192.168.11.30,192.168.11.10,TCP,74,,,10.836788,"Jan  6, 2024 19:37:33.908831000 JST",,56506  >  6000 [SYN] Seq=0 Win=64240 Len=0 MSS=1460 SACK_PERM TSval=3430517167 TSecr=0 WS=128
155,82.750107,192.168.11.10,192.168.11.30,TCP,74,0.01066,,0.01066,"Jan  6, 2024 19:37:33.919491000 JST",,"6000  >  56506 [SYN, ACK] Seq=0 Ack=1 Win=65160 Len=0 MSS=1460 SACK_PERM TSval=2137860407 TSecr=3430517167 WS=128"
156,82.750209,192.168.11.30,192.168.11.10,TCP,66,0.000102,,0.000102,"Jan  6, 2024 19:37:33.919593000 JST",,56506  >  6000 [ACK] Seq=1 Ack=1 Win=64256 Len=0 TSval=3430517178 TSecr=2137860407
157,82.750387,192.168.11.30,192.168.11.10,TCP,93,,,0.000178,"Jan  6, 2024 19:37:33.919771000 JST",,"56506  >  6000 [PSH, ACK] Seq=1 Ack=1 Win=64256 Len=27 TSval=3430517178 TSecr=2137860407 [TCP segment of a reassembled PDU]"
158,82.750497,192.168.11.30,192.168.11.10,TCP,66,,,0.00011,"Jan  6, 2024 19:37:33.919881000 JST",,"56506  >  6000 [FIN, ACK] Seq=28 Ack=1 Win=64256 Len=0 TSval=3430517178 TSecr=2137860407"
159,82.757315,192.168.11.10,192.168.11.30,TCP,66,0.006928,,0.006818,"Jan  6, 2024 19:37:33.926699000 JST",,6000  >  56506 [ACK] Seq=1 Ack=28 Win=65152 Len=0 TSval=2137860414 TSecr=3430517178
160,82.757533,192.168.11.10,192.168.11.30,TCP,66,0.007036,,0.000218,"Jan  6, 2024 19:37:33.926917000 JST",,"6000  >  56506 [FIN, ACK] Seq=1 Ack=29 Win=65152 Len=0 TSval=2137860415 TSecr=3430517178"
161,82.757581,192.168.11.30,192.168.11.10,TCP,66,0.000048,,0.000048,"Jan  6, 2024 19:37:33.926965000 JST",,56506  >  6000 [ACK] Seq=29 Ack=2 Win=64256 Len=0 TSval=3430517186 TSecr=2137860415
162,82.787028,192.168.11.30,255.255.255.255,UDP,209,,Åü,0.029447,"Jan  6, 2024 19:37:33.956412000 JST",7b2273656d616e74696373223a207b22656e74697479223a2022504944222c202262617365656e74697479223a2022616e79222c2022726f6c65223a2022686868222c20227370617469616c223a2022616e79222c202274656d706f72616c223a2022616e79227d2c20226461746170726f7065727479223a207b22666f726d6174223a2022696e616f6b615f70726f6772616d5f73616d706c655f73656d616e746963227d7d,52654  >  7000 Len=167
163,82.792607,192.168.11.21,192.168.11.30,TCP,74,,Åú,0.005579,"Jan  6, 2024 19:37:33.961991000 JST",,43640  >  6000 [SYN] Seq=0 Win=64240 Len=0 MSS=1460 SACK_PERM TSval=2225490037 TSecr=0 WS=128
164,82.79272,192.168.11.30,192.168.11.21,TCP,74,0.000113,,0.000113,"Jan  6, 2024 19:37:33.962104000 JST",,"6000  >  43640 [SYN, ACK] Seq=0 Ack=1 Win=65160 Len=0 MSS=1460 SACK_PERM TSval=1385602235 TSecr=2225490037 WS=128"
165,82.799474,192.168.11.21,192.168.11.30,TCP,66,0.006754,,0.006754,"Jan  6, 2024 19:37:33.968858000 JST",,43640  >  6000 [ACK] Seq=1 Ack=1 Win=64256 Len=0 TSval=2225490044 TSecr=1385602235
166,82.800112,192.168.11.21,192.168.11.30,TCP,93,,,0.000638,"Jan  6, 2024 19:37:33.969496000 JST",,"43640  >  6000 [PSH, ACK] Seq=1 Ack=1 Win=64256 Len=27 TSval=2225490044 TSecr=1385602235 [TCP segment of a reassembled PDU]"
167,82.8002,192.168.11.30,192.168.11.21,TCP,66,0.000088,,0.000088,"Jan  6, 2024 19:37:33.969584000 JST",,6000  >  43640 [ACK] Seq=1 Ack=28 Win=65152 Len=0 TSval=1385602242 TSecr=2225490044
168,82.800291,192.168.11.21,192.168.11.30,TCP,66,,,0.000091,"Jan  6, 2024 19:37:33.969675000 JST",,"43640  >  6000 [FIN, ACK] Seq=28 Ack=1 Win=64256 Len=0 TSval=2225490044 TSecr=1385602235"
169,82.801657,192.168.11.30,192.168.11.21,TCP,66,0.001366,,0.001366,"Jan  6, 2024 19:37:33.971041000 JST",,"6000  >  43640 [FIN, ACK] Seq=1 Ack=29 Win=65152 Len=0 TSval=1385602244 TSecr=2225490044"
170,82.807428,192.168.11.21,192.168.11.30,TCP,66,0.005771,,0.005771,"Jan  6, 2024 19:37:33.976812000 JST",,43640  >  6000 [ACK] Seq=29 Ack=2 Win=64256 Len=0 TSval=2225490052 TSecr=1385602244
171,114.919299,192.168.11.30,192.168.11.10,TCP,74,,,32.111871,"Jan  6, 2024 19:38:06.088683000 JST",,49612  >  6000 [SYN] Seq=0 Win=64240 Len=0 MSS=1460 SACK_PERM TSval=3430549347 TSecr=0 WS=128
172,114.925844,192.168.11.10,192.168.11.30,TCP,74,0.006545,,0.006545,"Jan  6, 2024 19:38:06.095228000 JST",,"6000  >  49612 [SYN, ACK] Seq=0 Ack=1 Win=65160 Len=0 MSS=1460 SACK_PERM TSval=2137892583 TSecr=3430549347 WS=128"
173,114.925953,192.168.11.30,192.168.11.10,TCP,66,0.000109,,0.000109,"Jan  6, 2024 19:38:06.095337000 JST",,49612  >  6000 [ACK] Seq=1 Ack=1 Win=64256 Len=0 TSval=3430549354 TSecr=2137892583
174,114.926095,192.168.11.30,192.168.11.10,TCP,93,,,0.000142,"Jan  6, 2024 19:38:06.095479000 JST",,"49612  >  6000 [PSH, ACK] Seq=1 Ack=1 Win=64256 Len=27 TSval=3430549354 TSecr=2137892583 [TCP segment of a reassembled PDU]"
175,114.926206,192.168.11.30,192.168.11.10,TCP,66,,,0.000111,"Jan  6, 2024 19:38:06.095590000 JST",,"49612  >  6000 [FIN, ACK] Seq=28 Ack=1 Win=64256 Len=0 TSval=3430549354 TSecr=2137892583"
176,114.934146,192.168.11.10,192.168.11.30,TCP,66,0.008051,,0.00794,"Jan  6, 2024 19:38:06.103530000 JST",,6000  >  49612 [ACK] Seq=1 Ack=28 Win=65152 Len=0 TSval=2137892591 TSecr=3430549354
177,114.934381,192.168.11.10,192.168.11.30,TCP,66,0.008175,,0.000235,"Jan  6, 2024 19:38:06.103765000 JST",,"6000  >  49612 [FIN, ACK] Seq=1 Ack=29 Win=65152 Len=0 TSval=2137892592 TSecr=3430549354"
178,114.93443,192.168.11.30,192.168.11.10,TCP,66,0.000049,,0.000049,"Jan  6, 2024 19:38:06.103814000 JST",,49612  >  6000 [ACK] Seq=29 Ack=2 Win=64256 Len=0 TSval=3430549362 TSecr=2137892592
179,114.963818,192.168.11.30,255.255.255.255,UDP,209,,Åü,0.029388,"Jan  6, 2024 19:38:06.133202000 JST",7b2273656d616e74696373223a207b22656e74697479223a2022504944222c202262617365656e74697479223a2022616e79222c2022726f6c65223a2022686868222c20227370617469616c223a2022616e79222c202274656d706f72616c223a2022616e79227d2c20226461746170726f7065727479223a207b22666f726d6174223a2022696e616f6b615f70726f6772616d5f73616d706c655f73656d616e746963227d7d,37934  >  7000 Len=167
180,114.970501,192.168.11.21,192.168.11.30,TCP,74,,Åú,0.006683,"Jan  6, 2024 19:38:06.139885000 JST",,46926  >  6000 [SYN] Seq=0 Win=64240 Len=0 MSS=1460 SACK_PERM TSval=2225522214 TSecr=0 WS=128
181,114.970645,192.168.11.30,192.168.11.21,TCP,74,0.000144,,0.000144,"Jan  6, 2024 19:38:06.140029000 JST",,"6000  >  46926 [SYN, ACK] Seq=0 Ack=1 Win=65160 Len=0 MSS=1460 SACK_PERM TSval=1385634413 TSecr=2225522214 WS=128"
182,114.986566,192.168.11.21,192.168.11.30,TCP,66,0.015921,,0.015921,"Jan  6, 2024 19:38:06.155950000 JST",,46926  >  6000 [ACK] Seq=1 Ack=1 Win=64256 Len=0 TSval=2225522222 TSecr=1385634413
183,114.987071,192.168.11.21,192.168.11.30,TCP,93,,,0.000505,"Jan  6, 2024 19:38:06.156455000 JST",,"46926  >  6000 [PSH, ACK] Seq=1 Ack=1 Win=64256 Len=27 TSval=2225522222 TSecr=1385634413 [TCP segment of a reassembled PDU]"
184,114.987135,192.168.11.30,192.168.11.21,TCP,66,0.000064,,0.000064,"Jan  6, 2024 19:38:06.156519000 JST",,6000  >  46926 [ACK] Seq=1 Ack=28 Win=65152 Len=0 TSval=1385634429 TSecr=2225522222
