No.,Time,Source,Destination,Protocol,Length,The RTT to ACK the segment was,XXX,Time delta from previous captured frame,Arrival Time,Data,Info
1,0,192.168.11.21,192.168.11.30,TCP,74,,,0,"Jan  6, 2024 19:36:11.223658000 JST",,50508  >  6000 [SYN] Seq=0 Win=64240 Len=0 MSS=1460 SACK_PERM TSval=2225407299 TSecr=0 WS=128
2,0.00677,192.168.11.30,192.168.11.21,TCP,74,0.00677,,0.00677,"Jan  6, 2024 19:36:11.230428000 JST",,"6000  >  50508 [SYN, ACK] Seq=0 Ack=1 Win=65160 Len=0 MSS=1460 SACK_PERM TSval=1385519499 TSecr=2225407299 WS=128"
3,0.006903,192.168.11.21,192.168.11.30,TCP,66,0.000133,,0.000133,"Jan  6, 2024 19:36:11.230561000 JST",,50508  >  6000 [ACK] Seq=1 Ack=1 Win=64256 Len=0 TSval=2225407308 TSecr=1385519499
4,0.007261,192.168.11.21,192.168.11.30,TCP,93,,,0.000358,"Jan  6, 2024 19:36:11.230919000 JST",,"50508  >  6000 [PSH, ACK] Seq=1 Ack=1 Win=64256 Len=27 TSval=2225407309 TSecr=1385519499 [TCP segment of a reassembled PDU]"
5,0.007434,192.168.11.21,192.168.11.30,TCP,66,,,0.000173,"Jan  6, 2024 19:36:11.231092000 JST",,"50508  >  6000 [FIN, ACK] Seq=28 Ack=1 Win=64256 Len=0 TSval=2225407309 TSecr=1385519499"
6,0.014424,192.168.11.30,192.168.11.21,TCP,66,0.007163,,0.00699,"Jan  6, 2024 19:36:11.238082000 JST",,6000  >  50508 [ACK] Seq=1 Ack=28 Win=65152 Len=0 TSval=1385519507 TSecr=2225407309
7,0.014671,192.168.11.30,192.168.11.21,TCP,66,0.007237,,0.000247,"Jan  6, 2024 19:36:11.238329000 JST",,"6000  >  50508 [FIN, ACK] Seq=1 Ack=29 Win=65152 Len=0 TSval=1385519508 TSecr=2225407309"
8,0.014728,192.168.11.21,192.168.11.30,TCP,66,0.000057,,0.000057,"Jan  6, 2024 19:36:11.238386000 JST",,50508  >  6000 [ACK] Seq=29 Ack=2 Win=64256 Len=0 TSval=2225407316 TSecr=1385519508
9,0.046887,192.168.11.21,255.255.255.255,UDP,209,,Ÿ,0.032159,"Jan  6, 2024 19:36:11.270545000 JST",7b2273656d616e74696373223a207b22656e74697479223a2022504944222c202262617365656e74697479223a2022616e79222c2022726f6c65223a2022696969222c20227370617469616c223a2022616e79222c202274656d706f72616c223a2022616e79227d2c20226461746170726f7065727479223a207b22666f726d6174223a2022696e616f6b615f70726f6772616d5f73616d706c655f73656d616e746963227d7d,49072  >  7000 Len=167
10,0.056463,192.168.11.28,192.168.11.21,TCP,74,,œ,0.009576,"Jan  6, 2024 19:36:11.280121000 JST",,46862  >  6000 [SYN] Seq=0 Win=64240 Len=0 MSS=1460 SACK_PERM TSval=3362997388 TSecr=0 WS=128
11,0.056645,192.168.11.21,192.168.11.28,TCP,74,0.000182,,0.000182,"Jan  6, 2024 19:36:11.280303000 JST",,"6000  >  46862 [SYN, ACK] Seq=0 Ack=1 Win=65160 Len=0 MSS=1460 SACK_PERM TSval=4062640234 TSecr=3362997388 WS=128"
12,0.063627,192.168.11.28,192.168.11.21,TCP,66,0.006982,,0.006982,"Jan  6, 2024 19:36:11.287285000 JST",,46862  >  6000 [ACK] Seq=1 Ack=1 Win=64256 Len=0 TSval=3362997398 TSecr=4062640234
13,0.064234,192.168.11.28,192.168.11.21,TCP,93,,,0.000607,"Jan  6, 2024 19:36:11.287892000 JST",,"46862  >  6000 [PSH, ACK] Seq=1 Ack=1 Win=64256 Len=27 TSval=3362997398 TSecr=4062640234 [TCP segment of a reassembled PDU]"
14,0.06433,192.168.11.21,192.168.11.28,TCP,66,0.000096,,0.000096,"Jan  6, 2024 19:36:11.287988000 JST",,6000  >  46862 [ACK] Seq=1 Ack=28 Win=65152 Len=0 TSval=4062640242 TSecr=3362997398
15,0.064395,192.168.11.28,192.168.11.21,TCP,66,,,0.000065,"Jan  6, 2024 19:36:11.288053000 JST",,"46862  >  6000 [FIN, ACK] Seq=28 Ack=1 Win=64256 Len=0 TSval=3362997399 TSecr=4062640234"
16,0.065951,192.168.11.21,192.168.11.28,TCP,66,0.001556,,0.001556,"Jan  6, 2024 19:36:11.289609000 JST",,"6000  >  46862 [FIN, ACK] Seq=1 Ack=29 Win=65152 Len=0 TSval=4062640243 TSecr=3362997399"
17,0.070697,192.168.11.28,192.168.11.21,TCP,66,0.004746,,0.004746,"Jan  6, 2024 19:36:11.294355000 JST",,46862  >  6000 [ACK] Seq=29 Ack=2 Win=64256 Len=0 TSval=3362997406 TSecr=4062640243
18,10.344492,192.168.11.21,192.168.11.30,TCP,74,,,10.273795,"Jan  6, 2024 19:36:21.568150000 JST",,54428  >  6000 [SYN] Seq=0 Win=64240 Len=0 MSS=1460 SACK_PERM TSval=2225417646 TSecr=0 WS=128
19,10.362949,192.168.11.30,192.168.11.21,TCP,74,0.018457,,0.018457,"Jan  6, 2024 19:36:21.586607000 JST",,"6000  >  54428 [SYN, ACK] Seq=0 Ack=1 Win=65160 Len=0 MSS=1460 SACK_PERM TSval=1385529855 TSecr=2225417646 WS=128"
20,10.363062,192.168.11.21,192.168.11.30,TCP,66,0.000113,,0.000113,"Jan  6, 2024 19:36:21.586720000 JST",,54428  >  6000 [ACK] Seq=1 Ack=1 Win=64256 Len=0 TSval=2225417665 TSecr=1385529855
21,10.36326,192.168.11.21,192.168.11.30,TCP,93,,,0.000198,"Jan  6, 2024 19:36:21.586918000 JST",,"54428  >  6000 [PSH, ACK] Seq=1 Ack=1 Win=64256 Len=27 TSval=2225417665 TSecr=1385529855 [TCP segment of a reassembled PDU]"
22,10.363391,192.168.11.21,192.168.11.30,TCP,66,,,0.000131,"Jan  6, 2024 19:36:21.587049000 JST",,"54428  >  6000 [FIN, ACK] Seq=28 Ack=1 Win=64256 Len=0 TSval=2225417665 TSecr=1385529855"
23,10.371697,192.168.11.30,192.168.11.21,TCP,66,0.008437,,0.008306,"Jan  6, 2024 19:36:21.595355000 JST",,6000  >  54428 [ACK] Seq=1 Ack=28 Win=65152 Len=0 TSval=1385529864 TSecr=2225417665
24,10.371916,192.168.11.30,192.168.11.21,TCP,66,0.008525,,0.000219,"Jan  6, 2024 19:36:21.595574000 JST",,"6000  >  54428 [FIN, ACK] Seq=1 Ack=29 Win=65152 Len=0 TSval=1385529866 TSecr=2225417665"
25,10.371964,192.168.11.21,192.168.11.30,TCP,66,0.000048,,0.000048,"Jan  6, 2024 19:36:21.595622000 JST",,54428  >  6000 [ACK] Seq=29 Ack=2 Win=64256 Len=0 TSval=2225417673 TSecr=1385529866
26,10.40478,192.168.11.21,255.255.255.255,UDP,209,,Ÿ,0.032816,"Jan  6, 2024 19:36:21.628438000 JST",7b2273656d616e74696373223a207b22656e74697479223a2022504944222c202262617365656e74697479223a2022616e79222c2022726f6c65223a2022696969222c20227370617469616c223a2022616e79222c202274656d706f72616c223a2022616e79227d2c20226461746170726f7065727479223a207b22666f726d6174223a2022696e616f6b615f70726f6772616d5f73616d706c655f73656d616e746963227d7d,53011  >  7000 Len=167
27,10.410514,192.168.11.28,192.168.11.21,TCP,74,,œ,0.005734,"Jan  6, 2024 19:36:21.634172000 JST",,55002  >  6000 [SYN] Seq=0 Win=64240 Len=0 MSS=1460 SACK_PERM TSval=3363007745 TSecr=0 WS=128
28,10.410647,192.168.11.21,192.168.11.28,TCP,74,0.000133,,0.000133,"Jan  6, 2024 19:36:21.634305000 JST",,"6000  >  55002 [SYN, ACK] Seq=0 Ack=1 Win=65160 Len=0 MSS=1460 SACK_PERM TSval=4062650588 TSecr=3363007745 WS=128"
29,10.417703,192.168.11.28,192.168.11.21,TCP,66,0.007056,,0.007056,"Jan  6, 2024 19:36:21.641361000 JST",,55002  >  6000 [ACK] Seq=1 Ack=1 Win=64256 Len=0 TSval=3363007752 TSecr=4062650588
30,10.418165,192.168.11.28,192.168.11.21,TCP,93,,,0.000462,"Jan  6, 2024 19:36:21.641823000 JST",,"55002  >  6000 [PSH, ACK] Seq=1 Ack=1 Win=64256 Len=27 TSval=3363007753 TSecr=4062650588 [TCP segment of a reassembled PDU]"
31,10.418254,192.168.11.21,192.168.11.28,TCP,66,0.000089,,0.000089,"Jan  6, 2024 19:36:21.641912000 JST",,6000  >  55002 [ACK] Seq=1 Ack=28 Win=65152 Len=0 TSval=4062650596 TSecr=3363007753
32,10.418315,192.168.11.28,192.168.11.21,TCP,66,,,0.000061,"Jan  6, 2024 19:36:21.641973000 JST",,"55002  >  6000 [FIN, ACK] Seq=28 Ack=1 Win=64256 Len=0 TSval=3363007753 TSecr=4062650588"
33,10.419368,192.168.11.21,192.168.11.28,TCP,66,0.001053,,0.001053,"Jan  6, 2024 19:36:21.643026000 JST",,"6000  >  55002 [FIN, ACK] Seq=1 Ack=29 Win=65152 Len=0 TSval=4062650597 TSecr=3363007753"
34,10.425673,192.168.11.28,192.168.11.21,TCP,66,0.006305,,0.006305,"Jan  6, 2024 19:36:21.649331000 JST",,55002  >  6000 [ACK] Seq=29 Ack=2 Win=64256 Len=0 TSval=3363007760 TSecr=4062650597
35,20.229584,192.168.11.21,192.168.11.30,TCP,74,,,9.803911,"Jan  6, 2024 19:36:31.453242000 JST",,59498  >  6000 [SYN] Seq=0 Win=64240 Len=0 MSS=1460 SACK_PERM TSval=2225427531 TSecr=0 WS=128
36,20.236416,192.168.11.30,192.168.11.21,TCP,74,0.006832,,0.006832,"Jan  6, 2024 19:36:31.460074000 JST",,"6000  >  59498 [SYN, ACK] Seq=0 Ack=1 Win=65160 Len=0 MSS=1460 SACK_PERM TSval=1385539729 TSecr=2225427531 WS=128"
37,20.236536,192.168.11.21,192.168.11.30,TCP,66,0.00012,,0.00012,"Jan  6, 2024 19:36:31.460194000 JST",,59498  >  6000 [ACK] Seq=1 Ack=1 Win=64256 Len=0 TSval=2225427538 TSecr=1385539729
38,20.236727,192.168.11.21,192.168.11.30,TCP,93,,,0.000191,"Jan  6, 2024 19:36:31.460385000 JST",,"59498  >  6000 [PSH, ACK] Seq=1 Ack=1 Win=64256 Len=27 TSval=2225427538 TSecr=1385539729 [TCP segment of a reassembled PDU]"
39,20.236846,192.168.11.21,192.168.11.30,TCP,66,,,0.000119,"Jan  6, 2024 19:36:31.460504000 JST",,"59498  >  6000 [FIN, ACK] Seq=28 Ack=1 Win=64256 Len=0 TSval=2225427538 TSecr=1385539729"
40,20.245073,192.168.11.30,192.168.11.21,TCP,66,0.008346,,0.008227,"Jan  6, 2024 19:36:31.468731000 JST",,6000  >  59498 [ACK] Seq=1 Ack=28 Win=65152 Len=0 TSval=1385539736 TSecr=2225427538
41,20.245477,192.168.11.30,192.168.11.21,TCP,66,0.008631,,0.000404,"Jan  6, 2024 19:36:31.469135000 JST",,"6000  >  59498 [FIN, ACK] Seq=1 Ack=29 Win=65152 Len=0 TSval=1385539737 TSecr=2225427538"
42,20.24553,192.168.11.21,192.168.11.30,TCP,66,0.000053,,0.000053,"Jan  6, 2024 19:36:31.469188000 JST",,59498  >  6000 [ACK] Seq=29 Ack=2 Win=64256 Len=0 TSval=2225427547 TSecr=1385539737
43,20.275757,192.168.11.21,255.255.255.255,UDP,209,,Ÿ,0.030227,"Jan  6, 2024 19:36:31.499415000 JST",7b2273656d616e74696373223a207b22656e74697479223a2022504944222c202262617365656e74697479223a2022616e79222c2022726f6c65223a2022696969222c20227370617469616c223a2022616e79222c202274656d706f72616c223a2022616e79227d2c20226461746170726f7065727479223a207b22666f726d6174223a2022696e616f6b615f70726f6772616d5f73616d706c655f73656d616e746963227d7d,47159  >  7000 Len=167
44,20.281621,192.168.11.28,192.168.11.21,TCP,74,,œ,0.005864,"Jan  6, 2024 19:36:31.505279000 JST",,38070  >  6000 [SYN] Seq=0 Win=64240 Len=0 MSS=1460 SACK_PERM TSval=3363017616 TSecr=0 WS=128
45,20.281773,192.168.11.21,192.168.11.28,TCP,74,0.000152,,0.000152,"Jan  6, 2024 19:36:31.505431000 JST",,"6000  >  38070 [SYN, ACK] Seq=0 Ack=1 Win=65160 Len=0 MSS=1460 SACK_PERM TSval=4062660459 TSecr=3363017616 WS=128"
46,20.28848,192.168.11.28,192.168.11.21,TCP,66,0.006707,,0.006707,"Jan  6, 2024 19:36:31.512138000 JST",,38070  >  6000 [ACK] Seq=1 Ack=1 Win=64256 Len=0 TSval=3363017623 TSecr=4062660459
47,20.289199,192.168.11.28,192.168.11.21,TCP,93,,,0.000719,"Jan  6, 2024 19:36:31.512857000 JST",,"38070  >  6000 [PSH, ACK] Seq=1 Ack=1 Win=64256 Len=27 TSval=3363017623 TSecr=4062660459 [TCP segment of a reassembled PDU]"
48,20.289301,192.168.11.21,192.168.11.28,TCP,66,0.000102,,0.000102,"Jan  6, 2024 19:36:31.512959000 JST",,6000  >  38070 [ACK] Seq=1 Ack=28 Win=65152 Len=0 TSval=4062660467 TSecr=3363017623
49,20.28938,192.168.11.28,192.168.11.21,TCP,66,,,0.000079,"Jan  6, 2024 19:36:31.513038000 JST",,"38070  >  6000 [FIN, ACK] Seq=28 Ack=1 Win=64256 Len=0 TSval=3363017623 TSecr=4062660459"
50,20.291291,192.168.11.21,192.168.11.28,TCP,66,0.001911,,0.001911,"Jan  6, 2024 19:36:31.514949000 JST",,"6000  >  38070 [FIN, ACK] Seq=1 Ack=29 Win=65152 Len=0 TSval=4062660469 TSecr=3363017623"
51,20.304008,192.168.11.28,192.168.11.21,TCP,66,0.012717,,0.012717,"Jan  6, 2024 19:36:31.527666000 JST",,38070  >  6000 [ACK] Seq=29 Ack=2 Win=64256 Len=0 TSval=3363017631 TSecr=4062660469
52,30.132216,192.168.11.21,192.168.11.30,TCP,74,,,9.828208,"Jan  6, 2024 19:36:41.355874000 JST",,54474  >  6000 [SYN] Seq=0 Win=64240 Len=0 MSS=1460 SACK_PERM TSval=2225437434 TSecr=0 WS=128
53,30.142646,192.168.11.30,192.168.11.21,TCP,74,0.01043,,0.01043,"Jan  6, 2024 19:36:41.366304000 JST",,"6000  >  54474 [SYN, ACK] Seq=0 Ack=1 Win=65160 Len=0 MSS=1460 SACK_PERM TSval=1385549631 TSecr=2225437434 WS=128"
54,30.142768,192.168.11.21,192.168.11.30,TCP,66,0.000122,,0.000122,"Jan  6, 2024 19:36:41.366426000 JST",,54474  >  6000 [ACK] Seq=1 Ack=1 Win=64256 Len=0 TSval=2225437444 TSecr=1385549631
55,30.142965,192.168.11.21,192.168.11.30,TCP,93,,,0.000197,"Jan  6, 2024 19:36:41.366623000 JST",,"54474  >  6000 [PSH, ACK] Seq=1 Ack=1 Win=64256 Len=27 TSval=2225437444 TSecr=1385549631 [TCP segment of a reassembled PDU]"
56,30.143061,192.168.11.21,192.168.11.30,TCP,66,,,0.000096,"Jan  6, 2024 19:36:41.366719000 JST",,"54474  >  6000 [FIN, ACK] Seq=28 Ack=1 Win=64256 Len=0 TSval=2225437445 TSecr=1385549631"
57,30.15556,192.168.11.30,192.168.11.21,TCP,66,0.012595,,0.012499,"Jan  6, 2024 19:36:41.379218000 JST",,6000  >  54474 [ACK] Seq=1 Ack=28 Win=65152 Len=0 TSval=1385549644 TSecr=2225437444
58,30.155957,192.168.11.30,192.168.11.21,TCP,66,0.012896,,0.000397,"Jan  6, 2024 19:36:41.379615000 JST",,"6000  >  54474 [FIN, ACK] Seq=1 Ack=29 Win=65152 Len=0 TSval=1385549646 TSecr=2225437445"
59,30.156007,192.168.11.21,192.168.11.30,TCP,66,0.00005,,0.00005,"Jan  6, 2024 19:36:41.379665000 JST",,54474  >  6000 [ACK] Seq=29 Ack=2 Win=64256 Len=0 TSval=2225437457 TSecr=1385549646
60,30.186286,192.168.11.21,255.255.255.255,UDP,209,,Ÿ,0.030279,"Jan  6, 2024 19:36:41.409944000 JST",7b2273656d616e74696373223a207b22656e74697479223a2022504944222c202262617365656e74697479223a2022616e79222c2022726f6c65223a2022696969222c20227370617469616c223a2022616e79222c202274656d706f72616c223a2022616e79227d2c20226461746170726f7065727479223a207b22666f726d6174223a2022696e616f6b615f70726f6772616d5f73616d706c655f73656d616e746963227d7d,48067  >  7000 Len=167
61,30.192211,192.168.11.28,192.168.11.21,TCP,74,,œ,0.005925,"Jan  6, 2024 19:36:41.415869000 JST",,40000  >  6000 [SYN] Seq=0 Win=64240 Len=0 MSS=1460 SACK_PERM TSval=3363027527 TSecr=0 WS=128
62,30.192373,192.168.11.21,192.168.11.28,TCP,74,0.000162,,0.000162,"Jan  6, 2024 19:36:41.416031000 JST",,"6000  >  40000 [SYN, ACK] Seq=0 Ack=1 Win=65160 Len=0 MSS=1460 SACK_PERM TSval=4062670370 TSecr=3363027527 WS=128"
63,30.200481,192.168.11.28,192.168.11.21,TCP,66,0.008108,,0.008108,"Jan  6, 2024 19:36:41.424139000 JST",,40000  >  6000 [ACK] Seq=1 Ack=1 Win=64256 Len=0 TSval=3363027535 TSecr=4062670370
64,30.20112,192.168.11.28,192.168.11.21,TCP,93,,,0.000639,"Jan  6, 2024 19:36:41.424778000 JST",,"40000  >  6000 [PSH, ACK] Seq=1 Ack=1 Win=64256 Len=27 TSval=3363027535 TSecr=4062670370 [TCP segment of a reassembled PDU]"
65,30.201214,192.168.11.21,192.168.11.28,TCP,66,0.000094,,0.000094,"Jan  6, 2024 19:36:41.424872000 JST",,6000  >  40000 [ACK] Seq=1 Ack=28 Win=65152 Len=0 TSval=4062670379 TSecr=3363027535
66,30.20129,192.168.11.28,192.168.11.21,TCP,66,,,0.000076,"Jan  6, 2024 19:36:41.424948000 JST",,"40000  >  6000 [FIN, ACK] Seq=28 Ack=1 Win=64256 Len=0 TSval=3363027535 TSecr=4062670370"
67,30.202504,192.168.11.21,192.168.11.28,TCP,66,0.001214,,0.001214,"Jan  6, 2024 19:36:41.426162000 JST",,"6000  >  40000 [FIN, ACK] Seq=1 Ack=29 Win=65152 Len=0 TSval=4062670380 TSecr=3363027535"
68,30.208586,192.168.11.28,192.168.11.21,TCP,66,0.006082,,0.006082,"Jan  6, 2024 19:36:41.432244000 JST",,40000  >  6000 [ACK] Seq=29 Ack=2 Win=64256 Len=0 TSval=3363027543 TSecr=4062670380
69,37.943078,192.168.11.21,192.168.11.30,TCP,74,,,7.734492,"Jan  6, 2024 19:36:49.166736000 JST",,51990  >  6000 [SYN] Seq=0 Win=64240 Len=0 MSS=1460 SACK_PERM TSval=2225445245 TSecr=0 WS=128
70,37.95553,192.168.11.30,192.168.11.21,TCP,74,0.012452,,0.012452,"Jan  6, 2024 19:36:49.179188000 JST",,"6000  >  51990 [SYN, ACK] Seq=0 Ack=1 Win=65160 Len=0 MSS=1460 SACK_PERM TSval=1385557442 TSecr=2225445245 WS=128"
71,37.955668,192.168.11.21,192.168.11.30,TCP,66,0.000138,,0.000138,"Jan  6, 2024 19:36:49.179326000 JST",,51990  >  6000 [ACK] Seq=1 Ack=1 Win=64256 Len=0 TSval=2225445257 TSecr=1385557442
72,37.955865,192.168.11.21,192.168.11.30,TCP,93,,,0.000197,"Jan  6, 2024 19:36:49.179523000 JST",,"51990  >  6000 [PSH, ACK] Seq=1 Ack=1 Win=64256 Len=27 TSval=2225445257 TSecr=1385557442 [TCP segment of a reassembled PDU]"
73,37.955999,192.168.11.21,192.168.11.30,TCP,66,,,0.000134,"Jan  6, 2024 19:36:49.179657000 JST",,"51990  >  6000 [FIN, ACK] Seq=28 Ack=1 Win=64256 Len=0 TSval=2225445257 TSecr=1385557442"
74,37.963275,192.168.11.30,192.168.11.21,TCP,66,0.00741,,0.007276,"Jan  6, 2024 19:36:49.186933000 JST",,6000  >  51990 [ACK] Seq=1 Ack=28 Win=65152 Len=0 TSval=1385557456 TSecr=2225445257
75,37.963667,192.168.11.30,192.168.11.21,TCP,66,0.007668,,0.000392,"Jan  6, 2024 19:36:49.187325000 JST",,"6000  >  51990 [FIN, ACK] Seq=1 Ack=29 Win=65152 Len=0 TSval=1385557457 TSecr=2225445257"
76,37.963717,192.168.11.21,192.168.11.30,TCP,66,0.00005,,0.00005,"Jan  6, 2024 19:36:49.187375000 JST",,51990  >  6000 [ACK] Seq=29 Ack=2 Win=64256 Len=0 TSval=2225445265 TSecr=1385557457
77,37.993465,192.168.11.21,255.255.255.255,UDP,209,,Ÿ,0.029748,"Jan  6, 2024 19:36:49.217123000 JST",7b2273656d616e74696373223a207b22656e74697479223a2022504944222c202262617365656e74697479223a2022616e79222c2022726f6c65223a2022696969222c20227370617469616c223a2022616e79222c202274656d706f72616c223a2022616e79227d2c20226461746170726f7065727479223a207b22666f726d6174223a2022696e616f6b615f70726f6772616d5f73616d706c655f73656d616e746963227d7d,43997  >  7000 Len=167
78,37.99918,192.168.11.28,192.168.11.21,TCP,74,,œ,0.005715,"Jan  6, 2024 19:36:49.222838000 JST",,57634  >  6000 [SYN] Seq=0 Win=64240 Len=0 MSS=1460 SACK_PERM TSval=3363035334 TSecr=0 WS=128
79,37.999336,192.168.11.21,192.168.11.28,TCP,74,0.000156,,0.000156,"Jan  6, 2024 19:36:49.222994000 JST",,"6000  >  57634 [SYN, ACK] Seq=0 Ack=1 Win=65160 Len=0 MSS=1460 SACK_PERM TSval=4062678177 TSecr=3363035334 WS=128"
80,38.006125,192.168.11.28,192.168.11.21,TCP,66,0.006789,,0.006789,"Jan  6, 2024 19:36:49.229783000 JST",,57634  >  6000 [ACK] Seq=1 Ack=1 Win=64256 Len=0 TSval=3363035341 TSecr=4062678177
81,38.006699,192.168.11.28,192.168.11.21,TCP,93,,,0.000574,"Jan  6, 2024 19:36:49.230357000 JST",,"57634  >  6000 [PSH, ACK] Seq=1 Ack=1 Win=64256 Len=27 TSval=3363035341 TSecr=4062678177 [TCP segment of a reassembled PDU]"
82,38.006789,192.168.11.21,192.168.11.28,TCP,66,0.00009,,0.00009,"Jan  6, 2024 19:36:49.230447000 JST",,6000  >  57634 [ACK] Seq=1 Ack=28 Win=65152 Len=0 TSval=4062678184 TSecr=3363035341
83,38.006862,192.168.11.28,192.168.11.21,TCP,66,,,0.000073,"Jan  6, 2024 19:36:49.230520000 JST",,"57634  >  6000 [FIN, ACK] Seq=28 Ack=1 Win=64256 Len=0 TSval=3363035341 TSecr=4062678177"
84,38.008744,192.168.11.21,192.168.11.28,TCP,66,0.001882,,0.001882,"Jan  6, 2024 19:36:49.232402000 JST",,"6000  >  57634 [FIN, ACK] Seq=1 Ack=29 Win=65152 Len=0 TSval=4062678186 TSecr=3363035341"
85,38.013619,192.168.11.28,192.168.11.21,TCP,66,0.004875,,0.004875,"Jan  6, 2024 19:36:49.237277000 JST",,57634  >  6000 [ACK] Seq=29 Ack=2 Win=64256 Len=0 TSval=3363035348 TSecr=4062678186
86,45.752628,192.168.11.21,192.168.11.30,TCP,74,,,7.739009,"Jan  6, 2024 19:36:56.976286000 JST",,48602  >  6000 [SYN] Seq=0 Win=64240 Len=0 MSS=1460 SACK_PERM TSval=2225453054 TSecr=0 WS=128
87,45.760336,192.168.11.30,192.168.11.21,TCP,74,0.007708,,0.007708,"Jan  6, 2024 19:36:56.983994000 JST",,"6000  >  48602 [SYN, ACK] Seq=0 Ack=1 Win=65160 Len=0 MSS=1460 SACK_PERM TSval=1385565253 TSecr=2225453054 WS=128"
88,45.760458,192.168.11.21,192.168.11.30,TCP,66,0.000122,,0.000122,"Jan  6, 2024 19:36:56.984116000 JST",,48602  >  6000 [ACK] Seq=1 Ack=1 Win=64256 Len=0 TSval=2225453062 TSecr=1385565253
89,45.760658,192.168.11.21,192.168.11.30,TCP,93,,,0.0002,"Jan  6, 2024 19:36:56.984316000 JST",,"48602  >  6000 [PSH, ACK] Seq=1 Ack=1 Win=64256 Len=27 TSval=2225453062 TSecr=1385565253 [TCP segment of a reassembled PDU]"
90,45.760758,192.168.11.21,192.168.11.30,TCP,66,,,0.0001,"Jan  6, 2024 19:36:56.984416000 JST",,"48602  >  6000 [FIN, ACK] Seq=28 Ack=1 Win=64256 Len=0 TSval=2225453062 TSecr=1385565253"
91,45.76802,192.168.11.30,192.168.11.21,TCP,66,0.007362,,0.007262,"Jan  6, 2024 19:36:56.991678000 JST",,6000  >  48602 [ACK] Seq=1 Ack=28 Win=65152 Len=0 TSval=1385565260 TSecr=2225453062
92,45.768465,192.168.11.30,192.168.11.21,TCP,66,0.007707,,0.000445,"Jan  6, 2024 19:36:56.992123000 JST",,"6000  >  48602 [FIN, ACK] Seq=1 Ack=29 Win=65152 Len=0 TSval=1385565262 TSecr=2225453062"
93,45.768514,192.168.11.21,192.168.11.30,TCP,66,0.000049,,0.000049,"Jan  6, 2024 19:36:56.992172000 JST",,48602  >  6000 [ACK] Seq=29 Ack=2 Win=64256 Len=0 TSval=2225453070 TSecr=1385565262
94,45.798257,192.168.11.21,255.255.255.255,UDP,209,,Ÿ,0.029743,"Jan  6, 2024 19:36:57.021915000 JST",7b2273656d616e74696373223a207b22656e74697479223a2022504944222c202262617365656e74697479223a2022616e79222c2022726f6c65223a2022696969222c20227370617469616c223a2022616e79222c202274656d706f72616c223a2022616e79227d2c20226461746170726f7065727479223a207b22666f726d6174223a2022696e616f6b615f70726f6772616d5f73616d706c655f73656d616e746963227d7d,51578  >  7000 Len=167
95,45.804676,192.168.11.28,192.168.11.21,TCP,74,,œ,0.006419,"Jan  6, 2024 19:36:57.028334000 JST",,43992  >  6000 [SYN] Seq=0 Win=64240 Len=0 MSS=1460 SACK_PERM TSval=3363043139 TSecr=0 WS=128
96,45.804832,192.168.11.21,192.168.11.28,TCP,74,0.000156,,0.000156,"Jan  6, 2024 19:36:57.028490000 JST",,"6000  >  43992 [SYN, ACK] Seq=0 Ack=1 Win=65160 Len=0 MSS=1460 SACK_PERM TSval=4062685982 TSecr=3363043139 WS=128"
97,45.811608,192.168.11.28,192.168.11.21,TCP,66,0.006776,,0.006776,"Jan  6, 2024 19:36:57.035266000 JST",,43992  >  6000 [ACK] Seq=1 Ack=1 Win=64256 Len=0 TSval=3363043146 TSecr=4062685982
98,45.812168,192.168.11.28,192.168.11.21,TCP,93,,,0.00056,"Jan  6, 2024 19:36:57.035826000 JST",,"43992  >  6000 [PSH, ACK] Seq=1 Ack=1 Win=64256 Len=27 TSval=3363043146 TSecr=4062685982 [TCP segment of a reassembled PDU]"
99,45.812262,192.168.11.21,192.168.11.28,TCP,66,0.000094,,0.000094,"Jan  6, 2024 19:36:57.035920000 JST",,6000  >  43992 [ACK] Seq=1 Ack=28 Win=65152 Len=0 TSval=4062685990 TSecr=3363043146
100,45.812345,192.168.11.28,192.168.11.21,TCP,66,,,0.000083,"Jan  6, 2024 19:36:57.036003000 JST",,"43992  >  6000 [FIN, ACK] Seq=28 Ack=1 Win=64256 Len=0 TSval=3363043147 TSecr=4062685982"
101,45.817788,192.168.11.21,192.168.11.28,TCP,66,0.005443,,0.005443,"Jan  6, 2024 19:36:57.041446000 JST",,"6000  >  43992 [FIN, ACK] Seq=1 Ack=29 Win=65152 Len=0 TSval=4062685995 TSecr=3363043147"
102,45.825105,192.168.11.28,192.168.11.21,TCP,66,0.007317,,0.007317,"Jan  6, 2024 19:36:57.048763000 JST",,43992  >  6000 [ACK] Seq=29 Ack=2 Win=64256 Len=0 TSval=3363043159 TSecr=4062685995
103,53.617164,192.168.11.21,192.168.11.30,TCP,74,,,7.792059,"Jan  6, 2024 19:37:04.840822000 JST",,48606  >  6000 [SYN] Seq=0 Win=64240 Len=0 MSS=1460 SACK_PERM TSval=2225460919 TSecr=0 WS=128
104,53.623851,192.168.11.30,192.168.11.21,TCP,74,0.006687,,0.006687,"Jan  6, 2024 19:37:04.847509000 JST",,"6000  >  48606 [SYN, ACK] Seq=0 Ack=1 Win=65160 Len=0 MSS=1460 SACK_PERM TSval=1385573116 TSecr=2225460919 WS=128"
105,53.623973,192.168.11.21,192.168.11.30,TCP,66,0.000122,,0.000122,"Jan  6, 2024 19:37:04.847631000 JST",,48606  >  6000 [ACK] Seq=1 Ack=1 Win=64256 Len=0 TSval=2225460925 TSecr=1385573116
106,53.624151,192.168.11.21,192.168.11.30,TCP,93,,,0.000178,"Jan  6, 2024 19:37:04.847809000 JST",,"48606  >  6000 [PSH, ACK] Seq=1 Ack=1 Win=64256 Len=27 TSval=2225460926 TSecr=1385573116 [TCP segment of a reassembled PDU]"
107,53.62427,192.168.11.21,192.168.11.30,TCP,66,,,0.000119,"Jan  6, 2024 19:37:04.847928000 JST",,"48606  >  6000 [FIN, ACK] Seq=28 Ack=1 Win=64256 Len=0 TSval=2225460926 TSecr=1385573116"
108,53.631905,192.168.11.30,192.168.11.21,TCP,66,0.007754,,0.007635,"Jan  6, 2024 19:37:04.855563000 JST",,6000  >  48606 [ACK] Seq=1 Ack=28 Win=65152 Len=0 TSval=1385573124 TSecr=2225460926
109,53.632119,192.168.11.30,192.168.11.21,TCP,66,0.007849,,0.000214,"Jan  6, 2024 19:37:04.855777000 JST",,"6000  >  48606 [FIN, ACK] Seq=1 Ack=29 Win=65152 Len=0 TSval=1385573126 TSecr=2225460926"
110,53.632167,192.168.11.21,192.168.11.30,TCP,66,0.000048,,0.000048,"Jan  6, 2024 19:37:04.855825000 JST",,48606  >  6000 [ACK] Seq=29 Ack=2 Win=64256 Len=0 TSval=2225460934 TSecr=1385573126
111,53.662139,192.168.11.21,255.255.255.255,UDP,209,,Ÿ,0.029972,"Jan  6, 2024 19:37:04.885797000 JST",7b2273656d616e74696373223a207b22656e74697479223a2022504944222c202262617365656e74697479223a2022616e79222c2022726f6c65223a2022696969222c20227370617469616c223a2022616e79222c202274656d706f72616c223a2022616e79227d2c20226461746170726f7065727479223a207b22666f726d6174223a2022696e616f6b615f70726f6772616d5f73616d706c655f73656d616e746963227d7d,51176  >  7000 Len=167
112,53.668928,192.168.11.28,192.168.11.21,TCP,74,,œ,0.006789,"Jan  6, 2024 19:37:04.892586000 JST",,43996  >  6000 [SYN] Seq=0 Win=64240 Len=0 MSS=1460 SACK_PERM TSval=3363051003 TSecr=0 WS=128
113,53.66913,192.168.11.21,192.168.11.28,TCP,74,0.000202,,0.000202,"Jan  6, 2024 19:37:04.892788000 JST",,"6000  >  43996 [SYN, ACK] Seq=0 Ack=1 Win=65160 Len=0 MSS=1460 SACK_PERM TSval=4062693847 TSecr=3363051003 WS=128"
114,53.676695,192.168.11.28,192.168.11.21,TCP,66,0.007565,,0.007565,"Jan  6, 2024 19:37:04.900353000 JST",,43996  >  6000 [ACK] Seq=1 Ack=1 Win=64256 Len=0 TSval=3363051011 TSecr=4062693847
115,53.677349,192.168.11.28,192.168.11.21,TCP,93,,,0.000654,"Jan  6, 2024 19:37:04.901007000 JST",,"43996  >  6000 [PSH, ACK] Seq=1 Ack=1 Win=64256 Len=27 TSval=3363051011 TSecr=4062693847 [TCP segment of a reassembled PDU]"
116,53.677446,192.168.11.21,192.168.11.28,TCP,66,0.000097,,0.000097,"Jan  6, 2024 19:37:04.901104000 JST",,6000  >  43996 [ACK] Seq=1 Ack=28 Win=65152 Len=0 TSval=4062693855 TSecr=3363051011
117,53.677526,192.168.11.28,192.168.11.21,TCP,66,,,0.00008,"Jan  6, 2024 19:37:04.901184000 JST",,"43996  >  6000 [FIN, ACK] Seq=28 Ack=1 Win=64256 Len=0 TSval=3363051011 TSecr=4062693847"
118,53.678518,192.168.11.21,192.168.11.28,TCP,66,0.000992,,0.000992,"Jan  6, 2024 19:37:04.902176000 JST",,"6000  >  43996 [FIN, ACK] Seq=1 Ack=29 Win=65152 Len=0 TSval=4062693856 TSecr=3363051011"
119,53.684912,192.168.11.28,192.168.11.21,TCP,66,0.006394,,0.006394,"Jan  6, 2024 19:37:04.908570000 JST",,43996  >  6000 [ACK] Seq=29 Ack=2 Win=64256 Len=0 TSval=3363051019 TSecr=4062693856
120,61.904998,192.168.11.21,192.168.11.30,TCP,74,,,8.220086,"Jan  6, 2024 19:37:13.128656000 JST",,46256  >  6000 [SYN] Seq=0 Win=64240 Len=0 MSS=1460 SACK_PERM TSval=2225469206 TSecr=0 WS=128
121,61.91184,192.168.11.30,192.168.11.21,TCP,74,0.006842,,0.006842,"Jan  6, 2024 19:37:13.135498000 JST",,"6000  >  46256 [SYN, ACK] Seq=0 Ack=1 Win=65160 Len=0 MSS=1460 SACK_PERM TSval=1385581404 TSecr=2225469206 WS=128"
122,61.911955,192.168.11.21,192.168.11.30,TCP,66,0.000115,,0.000115,"Jan  6, 2024 19:37:13.135613000 JST",,46256  >  6000 [ACK] Seq=1 Ack=1 Win=64256 Len=0 TSval=2225469213 TSecr=1385581404
123,61.912136,192.168.11.21,192.168.11.30,TCP,93,,,0.000181,"Jan  6, 2024 19:37:13.135794000 JST",,"46256  >  6000 [PSH, ACK] Seq=1 Ack=1 Win=64256 Len=27 TSval=2225469214 TSecr=1385581404 [TCP segment of a reassembled PDU]"
124,61.91225,192.168.11.21,192.168.11.30,TCP,66,,,0.000114,"Jan  6, 2024 19:37:13.135908000 JST",,"46256  >  6000 [FIN, ACK] Seq=28 Ack=1 Win=64256 Len=0 TSval=2225469214 TSecr=1385581404"
125,61.919443,192.168.11.30,192.168.11.21,TCP,66,0.007307,,0.007193,"Jan  6, 2024 19:37:13.143101000 JST",,6000  >  46256 [ACK] Seq=1 Ack=28 Win=65152 Len=0 TSval=1385581412 TSecr=2225469214
126,61.919822,192.168.11.30,192.168.11.21,TCP,66,0.007572,,0.000379,"Jan  6, 2024 19:37:13.143480000 JST",,"6000  >  46256 [FIN, ACK] Seq=1 Ack=29 Win=65152 Len=0 TSval=1385581413 TSecr=2225469214"
127,61.919875,192.168.11.21,192.168.11.30,TCP,66,0.000053,,0.000053,"Jan  6, 2024 19:37:13.143533000 JST",,46256  >  6000 [ACK] Seq=29 Ack=2 Win=64256 Len=0 TSval=2225469221 TSecr=1385581413
128,61.948963,192.168.11.21,255.255.255.255,UDP,209,,Ÿ,0.029088,"Jan  6, 2024 19:37:13.172621000 JST",7b2273656d616e74696373223a207b22656e74697479223a2022504944222c202262617365656e74697479223a2022616e79222c2022726f6c65223a2022696969222c20227370617469616c223a2022616e79222c202274656d706f72616c223a2022616e79227d2c20226461746170726f7065727479223a207b22666f726d6174223a2022696e616f6b615f70726f6772616d5f73616d706c655f73656d616e746963227d7d,34835  >  7000 Len=167
129,61.954743,192.168.11.28,192.168.11.21,TCP,74,,œ,0.00578,"Jan  6, 2024 19:37:13.178401000 JST",,45596  >  6000 [SYN] Seq=0 Win=64240 Len=0 MSS=1460 SACK_PERM TSval=3363059289 TSecr=0 WS=128
130,61.954883,192.168.11.21,192.168.11.28,TCP,74,0.00014,,0.00014,"Jan  6, 2024 19:37:13.178541000 JST",,"6000  >  45596 [SYN, ACK] Seq=0 Ack=1 Win=65160 Len=0 MSS=1460 SACK_PERM TSval=4062702132 TSecr=3363059289 WS=128"
131,61.961739,192.168.11.28,192.168.11.21,TCP,66,0.006856,,0.006856,"Jan  6, 2024 19:37:13.185397000 JST",,45596  >  6000 [ACK] Seq=1 Ack=1 Win=64256 Len=0 TSval=3363059296 TSecr=4062702132
132,61.962303,192.168.11.28,192.168.11.21,TCP,93,,,0.000564,"Jan  6, 2024 19:37:13.185961000 JST",,"45596  >  6000 [PSH, ACK] Seq=1 Ack=1 Win=64256 Len=27 TSval=3363059296 TSecr=4062702132 [TCP segment of a reassembled PDU]"
133,61.962395,192.168.11.21,192.168.11.28,TCP,66,0.000092,,0.000092,"Jan  6, 2024 19:37:13.186053000 JST",,6000  >  45596 [ACK] Seq=1 Ack=28 Win=65152 Len=0 TSval=4062702140 TSecr=3363059296
134,61.962467,192.168.11.28,192.168.11.21,TCP,66,,,0.000072,"Jan  6, 2024 19:37:13.186125000 JST",,"45596  >  6000 [FIN, ACK] Seq=28 Ack=1 Win=64256 Len=0 TSval=3363059297 TSecr=4062702132"
135,61.963618,192.168.11.21,192.168.11.28,TCP,66,0.001151,,0.001151,"Jan  6, 2024 19:37:13.187276000 JST",,"6000  >  45596 [FIN, ACK] Seq=1 Ack=29 Win=65152 Len=0 TSval=4062702141 TSecr=3363059297"
136,61.974161,192.168.11.28,192.168.11.21,TCP,66,0.010543,,0.010543,"Jan  6, 2024 19:37:13.197819000 JST",,45596  >  6000 [ACK] Seq=29 Ack=2 Win=64256 Len=0 TSval=3363059308 TSecr=4062702141
137,71.832189,192.168.11.21,192.168.11.30,TCP,74,,,9.858028,"Jan  6, 2024 19:37:23.055847000 JST",,49106  >  6000 [SYN] Seq=0 Win=64240 Len=0 MSS=1460 SACK_PERM TSval=2225479134 TSecr=0 WS=128
138,71.837752,192.168.11.30,192.168.11.21,TCP,74,0.005563,,0.005563,"Jan  6, 2024 19:37:23.061410000 JST",,"6000  >  49106 [SYN, ACK] Seq=0 Ack=1 Win=65160 Len=0 MSS=1460 SACK_PERM TSval=1385591331 TSecr=2225479134 WS=128"
139,71.837869,192.168.11.21,192.168.11.30,TCP,66,0.000117,,0.000117,"Jan  6, 2024 19:37:23.061527000 JST",,49106  >  6000 [ACK] Seq=1 Ack=1 Win=64256 Len=0 TSval=2225479139 TSecr=1385591331
140,71.838019,192.168.11.21,192.168.11.30,TCP,93,,,0.00015,"Jan  6, 2024 19:37:23.061677000 JST",,"49106  >  6000 [PSH, ACK] Seq=1 Ack=1 Win=64256 Len=27 TSval=2225479139 TSecr=1385591331 [TCP segment of a reassembled PDU]"
141,71.838127,192.168.11.21,192.168.11.30,TCP,66,,,0.000108,"Jan  6, 2024 19:37:23.061785000 JST",,"49106  >  6000 [FIN, ACK] Seq=28 Ack=1 Win=64256 Len=0 TSval=2225479140 TSecr=1385591331"
142,71.845526,192.168.11.30,192.168.11.21,TCP,66,0.007507,,0.007399,"Jan  6, 2024 19:37:23.069184000 JST",,6000  >  49106 [ACK] Seq=1 Ack=28 Win=65152 Len=0 TSval=1385591338 TSecr=2225479139
143,71.845779,192.168.11.30,192.168.11.21,TCP,66,0.007652,,0.000253,"Jan  6, 2024 19:37:23.069437000 JST",,"6000  >  49106 [FIN, ACK] Seq=1 Ack=29 Win=65152 Len=0 TSval=1385591339 TSecr=2225479140"
144,71.845825,192.168.11.21,192.168.11.30,TCP,66,0.000046,,0.000046,"Jan  6, 2024 19:37:23.069483000 JST",,49106  >  6000 [ACK] Seq=29 Ack=2 Win=64256 Len=0 TSval=2225479147 TSecr=1385591339
145,71.87726,192.168.11.21,255.255.255.255,UDP,209,,Ÿ,0.031435,"Jan  6, 2024 19:37:23.100918000 JST",7b2273656d616e74696373223a207b22656e74697479223a2022504944222c202262617365656e74697479223a2022616e79222c2022726f6c65223a2022696969222c20227370617469616c223a2022616e79222c202274656d706f72616c223a2022616e79227d2c20226461746170726f7065727479223a207b22666f726d6174223a2022696e616f6b615f70726f6772616d5f73616d706c655f73656d616e746963227d7d,36939  >  7000 Len=167
146,71.883983,192.168.11.28,192.168.11.21,TCP,74,,œ,0.006723,"Jan  6, 2024 19:37:23.107641000 JST",,40578  >  6000 [SYN] Seq=0 Win=64240 Len=0 MSS=1460 SACK_PERM TSval=3363069218 TSecr=0 WS=128
147,71.884154,192.168.11.21,192.168.11.28,TCP,74,0.000171,,0.000171,"Jan  6, 2024 19:37:23.107812000 JST",,"6000  >  40578 [SYN, ACK] Seq=0 Ack=1 Win=65160 Len=0 MSS=1460 SACK_PERM TSval=4062712062 TSecr=3363069218 WS=128"
148,71.890918,192.168.11.28,192.168.11.21,TCP,66,0.006764,,0.006764,"Jan  6, 2024 19:37:23.114576000 JST",,40578  >  6000 [ACK] Seq=1 Ack=1 Win=64256 Len=0 TSval=3363069226 TSecr=4062712062
149,71.891437,192.168.11.28,192.168.11.21,TCP,93,,,0.000519,"Jan  6, 2024 19:37:23.115095000 JST",,"40578  >  6000 [PSH, ACK] Seq=1 Ack=1 Win=64256 Len=27 TSval=3363069226 TSecr=4062712062 [TCP segment of a reassembled PDU]"
150,71.891534,192.168.11.21,192.168.11.28,TCP,66,0.000097,,0.000097,"Jan  6, 2024 19:37:23.115192000 JST",,6000  >  40578 [ACK] Seq=1 Ack=28 Win=65152 Len=0 TSval=4062712069 TSecr=3363069226
151,71.891608,192.168.11.28,192.168.11.21,TCP,66,,,0.000074,"Jan  6, 2024 19:37:23.115266000 JST",,"40578  >  6000 [FIN, ACK] Seq=28 Ack=1 Win=64256 Len=0 TSval=3363069226 TSecr=4062712062"
152,71.892464,192.168.11.21,192.168.11.28,TCP,66,0.000856,,0.000856,"Jan  6, 2024 19:37:23.116122000 JST",,"6000  >  40578 [FIN, ACK] Seq=1 Ack=29 Win=65152 Len=0 TSval=4062712070 TSecr=3363069226"
153,71.89882,192.168.11.28,192.168.11.21,TCP,66,0.006356,,0.006356,"Jan  6, 2024 19:37:23.122478000 JST",,40578  >  6000 [ACK] Seq=29 Ack=2 Win=64256 Len=0 TSval=3363069233 TSecr=4062712070
154,82.735567,192.168.11.21,192.168.11.30,TCP,74,,,10.836747,"Jan  6, 2024 19:37:33.959225000 JST",,43640  >  6000 [SYN] Seq=0 Win=64240 Len=0 MSS=1460 SACK_PERM TSval=2225490037 TSecr=0 WS=128
155,82.742082,192.168.11.30,192.168.11.21,TCP,74,0.006515,,0.006515,"Jan  6, 2024 19:37:33.965740000 JST",,"6000  >  43640 [SYN, ACK] Seq=0 Ack=1 Win=65160 Len=0 MSS=1460 SACK_PERM TSval=1385602235 TSecr=2225490037 WS=128"
156,82.742205,192.168.11.21,192.168.11.30,TCP,66,0.000123,,0.000123,"Jan  6, 2024 19:37:33.965863000 JST",,43640  >  6000 [ACK] Seq=1 Ack=1 Win=64256 Len=0 TSval=2225490044 TSecr=1385602235
157,82.742387,192.168.11.21,192.168.11.30,TCP,93,,,0.000182,"Jan  6, 2024 19:37:33.966045000 JST",,"43640  >  6000 [PSH, ACK] Seq=1 Ack=1 Win=64256 Len=27 TSval=2225490044 TSecr=1385602235 [TCP segment of a reassembled PDU]"
158,82.742485,192.168.11.21,192.168.11.30,TCP,66,,,0.000098,"Jan  6, 2024 19:37:33.966143000 JST",,"43640  >  6000 [FIN, ACK] Seq=28 Ack=1 Win=64256 Len=0 TSval=2225490044 TSecr=1385602235"
159,82.749892,192.168.11.30,192.168.11.21,TCP,66,0.007505,,0.007407,"Jan  6, 2024 19:37:33.973550000 JST",,6000  >  43640 [ACK] Seq=1 Ack=28 Win=65152 Len=0 TSval=1385602242 TSecr=2225490044
160,82.750143,192.168.11.30,192.168.11.21,TCP,66,0.007658,,0.000251,"Jan  6, 2024 19:37:33.973801000 JST",,"6000  >  43640 [FIN, ACK] Seq=1 Ack=29 Win=65152 Len=0 TSval=1385602244 TSecr=2225490044"
161,82.750197,192.168.11.21,192.168.11.30,TCP,66,0.000054,,0.000054,"Jan  6, 2024 19:37:33.973855000 JST",,43640  >  6000 [ACK] Seq=29 Ack=2 Win=64256 Len=0 TSval=2225490052 TSecr=1385602244
162,82.779885,192.168.11.21,255.255.255.255,UDP,209,,Ÿ,0.029688,"Jan  6, 2024 19:37:34.003543000 JST",7b2273656d616e74696373223a207b22656e74697479223a2022504944222c202262617365656e74697479223a2022616e79222c2022726f6c65223a2022696969222c20227370617469616c223a2022616e79222c202274656d706f72616c223a2022616e79227d2c20226461746170726f7065727479223a207b22666f726d6174223a2022696e616f6b615f70726f6772616d5f73616d706c655f73656d616e746963227d7d,44344  >  7000 Len=167
163,82.78964,192.168.11.28,192.168.11.21,TCP,74,,œ,0.009755,"Jan  6, 2024 19:37:34.013298000 JST",,46738  >  6000 [SYN] Seq=0 Win=64240 Len=0 MSS=1460 SACK_PERM TSval=3363080120 TSecr=0 WS=128
164,82.789785,192.168.11.21,192.168.11.28,TCP,74,0.000145,,0.000145,"Jan  6, 2024 19:37:34.013443000 JST",,"6000  >  46738 [SYN, ACK] Seq=0 Ack=1 Win=65160 Len=0 MSS=1460 SACK_PERM TSval=4062722967 TSecr=3363080120 WS=128"
165,82.796558,192.168.11.28,192.168.11.21,TCP,66,0.006773,,0.006773,"Jan  6, 2024 19:37:34.020216000 JST",,46738  >  6000 [ACK] Seq=1 Ack=1 Win=64256 Len=0 TSval=3363080131 TSecr=4062722967
166,82.797598,192.168.11.28,192.168.11.21,TCP,93,,,0.00104,"Jan  6, 2024 19:37:34.021256000 JST",,"46738  >  6000 [PSH, ACK] Seq=1 Ack=1 Win=64256 Len=27 TSval=3363080131 TSecr=4062722967 [TCP segment of a reassembled PDU]"
167,82.797716,192.168.11.21,192.168.11.28,TCP,66,0.000118,,0.000118,"Jan  6, 2024 19:37:34.021374000 JST",,6000  >  46738 [ACK] Seq=1 Ack=28 Win=65152 Len=0 TSval=4062722975 TSecr=3363080131
168,82.797793,192.168.11.28,192.168.11.21,TCP,66,,,0.000077,"Jan  6, 2024 19:37:34.021451000 JST",,"46738  >  6000 [FIN, ACK] Seq=28 Ack=1 Win=64256 Len=0 TSval=3363080131 TSecr=4062722967"
169,82.799032,192.168.11.21,192.168.11.28,TCP,66,0.001239,,0.001239,"Jan  6, 2024 19:37:34.022690000 JST",,"6000  >  46738 [FIN, ACK] Seq=1 Ack=29 Win=65152 Len=0 TSval=4062722976 TSecr=3363080131"
170,82.804475,192.168.11.28,192.168.11.21,TCP,66,0.005443,,0.005443,"Jan  6, 2024 19:37:34.028133000 JST",,46738  >  6000 [ACK] Seq=29 Ack=2 Win=64256 Len=0 TSval=3363080140 TSecr=4062722976
171,114.912396,192.168.11.21,192.168.11.30,TCP,74,,,32.107921,"Jan  6, 2024 19:38:06.136054000 JST",,46926  >  6000 [SYN] Seq=0 Win=64240 Len=0 MSS=1460 SACK_PERM TSval=2225522214 TSecr=0 WS=128
172,114.920097,192.168.11.30,192.168.11.21,TCP,74,0.007701,,0.007701,"Jan  6, 2024 19:38:06.143755000 JST",,"6000  >  46926 [SYN, ACK] Seq=0 Ack=1 Win=65160 Len=0 MSS=1460 SACK_PERM TSval=1385634413 TSecr=2225522214 WS=128"
173,114.920206,192.168.11.21,192.168.11.30,TCP,66,0.000109,,0.000109,"Jan  6, 2024 19:38:06.143864000 JST",,46926  >  6000 [ACK] Seq=1 Ack=1 Win=64256 Len=0 TSval=2225522222 TSecr=1385634413
174,114.920357,192.168.11.21,192.168.11.30,TCP,93,,,0.000151,"Jan  6, 2024 19:38:06.144015000 JST",,"46926  >  6000 [PSH, ACK] Seq=1 Ack=1 Win=64256 Len=27 TSval=2225522222 TSecr=1385634413 [TCP segment of a reassembled PDU]"
175,114.920468,192.168.11.21,192.168.11.30,TCP,66,,,0.000111,"Jan  6, 2024 19:38:06.144126000 JST",,"46926  >  6000 [FIN, ACK] Seq=28 Ack=1 Win=64256 Len=0 TSval=2225522222 TSecr=1385634413"
176,114.936539,192.168.11.30,192.168.11.21,TCP,66,0.016182,,0.016071,"Jan  6, 2024 19:38:06.160197000 JST",,6000  >  46926 [ACK] Seq=1 Ack=28 Win=65152 Len=0 TSval=1385634429 TSecr=2225522222
177,114.936921,192.168.11.30,192.168.11.21,TCP,66,0.016453,,0.000382,"Jan  6, 2024 19:38:06.160579000 JST",,"6000  >  46926 [FIN, ACK] Seq=1 Ack=29 Win=65152 Len=0 TSval=1385634430 TSecr=2225522222"
178,114.936975,192.168.11.21,192.168.11.30,TCP,66,0.000054,,0.000054,"Jan  6, 2024 19:38:06.160633000 JST",,46926  >  6000 [ACK] Seq=29 Ack=2 Win=64256 Len=0 TSval=2225522238 TSecr=1385634430
179,114.966476,192.168.11.21,255.255.255.255,UDP,209,,Ÿ,0.029501,"Jan  6, 2024 19:38:06.190134000 JST",7b2273656d616e74696373223a207b22656e74697479223a2022504944222c202262617365656e74697479223a2022616e79222c2022726f6c65223a2022696969222c20227370617469616c223a2022616e79222c202274656d706f72616c223a2022616e79227d2c20226461746170726f7065727479223a207b22666f726d6174223a2022696e616f6b615f70726f6772616d5f73616d706c655f73656d616e746963227d7d,35789  >  7000 Len=167
180,114.972138,192.168.11.28,192.168.11.21,TCP,74,,œ,0.005662,"Jan  6, 2024 19:38:06.195796000 JST",,57296  >  6000 [SYN] Seq=0 Win=64240 Len=0 MSS=1460 SACK_PERM TSval=3363112307 TSecr=0 WS=128
181,114.972293,192.168.11.21,192.168.11.28,TCP,74,0.000155,,0.000155,"Jan  6, 2024 19:38:06.195951000 JST",,"6000  >  57296 [SYN, ACK] Seq=0 Ack=1 Win=65160 Len=0 MSS=1460 SACK_PERM TSval=4062755150 TSecr=3363112307 WS=128"
182,114.979021,192.168.11.28,192.168.11.21,TCP,66,0.006728,,0.006728,"Jan  6, 2024 19:38:06.202679000 JST",,57296  >  6000 [ACK] Seq=1 Ack=1 Win=64256 Len=0 TSval=3363112314 TSecr=4062755150
183,114.979632,192.168.11.28,192.168.11.21,TCP,93,,,0.000611,"Jan  6, 2024 19:38:06.203290000 JST",,"57296  >  6000 [PSH, ACK] Seq=1 Ack=1 Win=64256 Len=27 TSval=3363112314 TSecr=4062755150 [TCP segment of a reassembled PDU]"
184,114.979719,192.168.11.21,192.168.11.28,TCP,66,0.000087,,0.000087,"Jan  6, 2024 19:38:06.203377000 JST",,6000  >  57296 [ACK] Seq=1 Ack=28 Win=65152 Len=0 TSval=4062755157 TSecr=3363112314
