No.,Time,Source,Destination,Protocol,Length,The RTT to ACK the segment was,XXX,Time delta from previous captured frame,Arrival Time,Data,Info
1,0,192.168.11.28,192.168.11.21,TCP,74,,,0,"Jan  6, 2024 19:36:11.275824000 JST",,46862  >  6000 [SYN] Seq=0 Win=64240 Len=0 MSS=1460 SACK_PERM TSval=3362997388 TSecr=0 WS=128
2,0.006779,192.168.11.21,192.168.11.28,TCP,74,0.006779,,0.006779,"Jan  6, 2024 19:36:11.282603000 JST",,"6000  >  46862 [SYN, ACK] Seq=0 Ack=1 Win=65160 Len=0 MSS=1460 SACK_PERM TSval=4062640234 TSecr=3362997388 WS=128"
3,0.006907,192.168.11.28,192.168.11.21,TCP,66,0.000128,,0.000128,"Jan  6, 2024 19:36:11.282731000 JST",,46862  >  6000 [ACK] Seq=1 Ack=1 Win=64256 Len=0 TSval=3362997398 TSecr=4062640234
4,0.007233,192.168.11.28,192.168.11.21,TCP,93,,,0.000326,"Jan  6, 2024 19:36:11.283057000 JST",,"46862  >  6000 [PSH, ACK] Seq=1 Ack=1 Win=64256 Len=27 TSval=3362997398 TSecr=4062640234 [TCP segment of a reassembled PDU]"
5,0.007433,192.168.11.28,192.168.11.21,TCP,66,,,0.0002,"Jan  6, 2024 19:36:11.283257000 JST",,"46862  >  6000 [FIN, ACK] Seq=28 Ack=1 Win=64256 Len=0 TSval=3362997399 TSecr=4062640234"
6,0.01452,192.168.11.21,192.168.11.28,TCP,66,0.007287,,0.007087,"Jan  6, 2024 19:36:11.290344000 JST",,6000  >  46862 [ACK] Seq=1 Ack=28 Win=65152 Len=0 TSval=4062640242 TSecr=3362997398
7,0.014765,192.168.11.21,192.168.11.28,TCP,66,0.007332,,0.000245,"Jan  6, 2024 19:36:11.290589000 JST",,"6000  >  46862 [FIN, ACK] Seq=1 Ack=29 Win=65152 Len=0 TSval=4062640243 TSecr=3362997399"
8,0.014812,192.168.11.28,192.168.11.21,TCP,66,0.000047,,0.000047,"Jan  6, 2024 19:36:11.290636000 JST",,46862  >  6000 [ACK] Seq=29 Ack=2 Win=64256 Len=0 TSval=3362997406 TSecr=4062640243
9,0.045772,192.168.11.28,255.255.255.255,UDP,209,,Ÿ,0.03096,"Jan  6, 2024 19:36:11.321596000 JST",7b2273656d616e74696373223a207b22656e74697479223a2022504944222c202262617365656e74697479223a2022616e79222c2022726f6c65223a20226a6a6a222c20227370617469616c223a2022616e79222c202274656d706f72616c223a2022616e79227d2c20226461746170726f7065727479223a207b22666f726d6174223a2022696e616f6b615f70726f6772616d5f73616d706c655f73656d616e746963227d7d,33752  >  7000 Len=167
10,0.054488,192.168.11.7,192.168.11.28,TCP,74,,œ,0.008716,"Jan  6, 2024 19:36:11.330312000 JST",,32858  >  6000 [SYN] Seq=0 Win=64240 Len=0 MSS=1460 SACK_PERM TSval=472755451 TSecr=0 WS=128
11,0.054659,192.168.11.28,192.168.11.7,TCP,74,0.000171,,0.000171,"Jan  6, 2024 19:36:11.330483000 JST",,"6000  >  32858 [SYN, ACK] Seq=0 Ack=1 Win=65160 Len=0 MSS=1460 SACK_PERM TSval=2519299185 TSecr=472755451 WS=128"
12,0.072081,192.168.11.7,192.168.11.28,TCP,66,0.017422,,0.017422,"Jan  6, 2024 19:36:11.347905000 JST",,32858  >  6000 [ACK] Seq=1 Ack=1 Win=64256 Len=0 TSval=472755461 TSecr=2519299185
13,0.072822,192.168.11.7,192.168.11.28,TCP,93,,,0.000741,"Jan  6, 2024 19:36:11.348646000 JST",,"32858  >  6000 [PSH, ACK] Seq=1 Ack=1 Win=64256 Len=27 TSval=472755461 TSecr=2519299185 [TCP segment of a reassembled PDU]"
14,0.073011,192.168.11.28,192.168.11.7,TCP,66,0.000189,,0.000189,"Jan  6, 2024 19:36:11.348835000 JST",,6000  >  32858 [ACK] Seq=1 Ack=28 Win=65152 Len=0 TSval=2519299203 TSecr=472755461
15,0.073202,192.168.11.7,192.168.11.28,TCP,66,,,0.000191,"Jan  6, 2024 19:36:11.349026000 JST",,"32858  >  6000 [FIN, ACK] Seq=28 Ack=1 Win=64256 Len=0 TSval=472755462 TSecr=2519299185"
16,0.075646,192.168.11.28,192.168.11.7,TCP,66,0.002444,,0.002444,"Jan  6, 2024 19:36:11.351470000 JST",,"6000  >  32858 [FIN, ACK] Seq=1 Ack=29 Win=65152 Len=0 TSval=2519299206 TSecr=472755462"
17,0.083844,192.168.11.7,192.168.11.28,TCP,66,0.008198,,0.008198,"Jan  6, 2024 19:36:11.359668000 JST",,32858  >  6000 [ACK] Seq=29 Ack=2 Win=64256 Len=0 TSval=472755483 TSecr=2519299206
18,10.354138,192.168.11.28,192.168.11.21,TCP,74,,,10.270294,"Jan  6, 2024 19:36:21.629962000 JST",,55002  >  6000 [SYN] Seq=0 Win=64240 Len=0 MSS=1460 SACK_PERM TSval=3363007745 TSecr=0 WS=128
19,10.361138,192.168.11.21,192.168.11.28,TCP,74,0.007,,0.007,"Jan  6, 2024 19:36:21.636962000 JST",,"6000  >  55002 [SYN, ACK] Seq=0 Ack=1 Win=65160 Len=0 MSS=1460 SACK_PERM TSval=4062650588 TSecr=3363007745 WS=128"
20,10.361246,192.168.11.28,192.168.11.21,TCP,66,0.000108,,0.000108,"Jan  6, 2024 19:36:21.637070000 JST",,55002  >  6000 [ACK] Seq=1 Ack=1 Win=64256 Len=0 TSval=3363007752 TSecr=4062650588
21,10.361434,192.168.11.28,192.168.11.21,TCP,93,,,0.000188,"Jan  6, 2024 19:36:21.637258000 JST",,"55002  >  6000 [PSH, ACK] Seq=1 Ack=1 Win=64256 Len=27 TSval=3363007753 TSecr=4062650588 [TCP segment of a reassembled PDU]"
22,10.361575,192.168.11.28,192.168.11.21,TCP,66,,,0.000141,"Jan  6, 2024 19:36:21.637399000 JST",,"55002  >  6000 [FIN, ACK] Seq=28 Ack=1 Win=64256 Len=0 TSval=3363007753 TSecr=4062650588"
23,10.368407,192.168.11.21,192.168.11.28,TCP,66,0.006973,,0.006832,"Jan  6, 2024 19:36:21.644231000 JST",,6000  >  55002 [ACK] Seq=1 Ack=28 Win=65152 Len=0 TSval=4062650596 TSecr=3363007753
24,10.368785,192.168.11.21,192.168.11.28,TCP,66,0.00721,,0.000378,"Jan  6, 2024 19:36:21.644609000 JST",,"6000  >  55002 [FIN, ACK] Seq=1 Ack=29 Win=65152 Len=0 TSval=4062650597 TSecr=3363007753"
25,10.368838,192.168.11.28,192.168.11.21,TCP,66,0.000053,,0.000053,"Jan  6, 2024 19:36:21.644662000 JST",,55002  >  6000 [ACK] Seq=29 Ack=2 Win=64256 Len=0 TSval=3363007760 TSecr=4062650597
26,10.398207,192.168.11.28,255.255.255.255,UDP,209,,Ÿ,0.029369,"Jan  6, 2024 19:36:21.674031000 JST",7b2273656d616e74696373223a207b22656e74697479223a2022504944222c202262617365656e74697479223a2022616e79222c2022726f6c65223a20226a6a6a222c20227370617469616c223a2022616e79222c202274656d706f72616c223a2022616e79227d2c20226461746170726f7065727479223a207b22666f726d6174223a2022696e616f6b615f70726f6772616d5f73616d706c655f73656d616e746963227d7d,34958  >  7000 Len=167
27,10.40492,192.168.11.7,192.168.11.28,TCP,74,,œ,0.006713,"Jan  6, 2024 19:36:21.680744000 JST",,44498  >  6000 [SYN] Seq=0 Win=64240 Len=0 MSS=1460 SACK_PERM TSval=472765803 TSecr=0 WS=128
28,10.40506,192.168.11.28,192.168.11.7,TCP,74,0.00014,,0.00014,"Jan  6, 2024 19:36:21.680884000 JST",,"6000  >  44498 [SYN, ACK] Seq=0 Ack=1 Win=65160 Len=0 MSS=1460 SACK_PERM TSval=2519309535 TSecr=472765803 WS=128"
29,10.411852,192.168.11.7,192.168.11.28,TCP,66,0.006792,,0.006792,"Jan  6, 2024 19:36:21.687676000 JST",,44498  >  6000 [ACK] Seq=1 Ack=1 Win=64256 Len=0 TSval=472765811 TSecr=2519309535
30,10.412394,192.168.11.7,192.168.11.28,TCP,93,,,0.000542,"Jan  6, 2024 19:36:21.688218000 JST",,"44498  >  6000 [PSH, ACK] Seq=1 Ack=1 Win=64256 Len=27 TSval=472765811 TSecr=2519309535 [TCP segment of a reassembled PDU]"
31,10.412468,192.168.11.28,192.168.11.7,TCP,66,0.000074,,0.000074,"Jan  6, 2024 19:36:21.688292000 JST",,6000  >  44498 [ACK] Seq=1 Ack=28 Win=65152 Len=0 TSval=2519309543 TSecr=472765811
32,10.412538,192.168.11.7,192.168.11.28,TCP,66,,,0.00007,"Jan  6, 2024 19:36:21.688362000 JST",,"44498  >  6000 [FIN, ACK] Seq=28 Ack=1 Win=64256 Len=0 TSval=472765811 TSecr=2519309535"
33,10.413672,192.168.11.28,192.168.11.7,TCP,66,0.001134,,0.001134,"Jan  6, 2024 19:36:21.689496000 JST",,"6000  >  44498 [FIN, ACK] Seq=1 Ack=29 Win=65152 Len=0 TSval=2519309544 TSecr=472765811"
34,10.419926,192.168.11.7,192.168.11.28,TCP,66,0.006254,,0.006254,"Jan  6, 2024 19:36:21.695750000 JST",,44498  >  6000 [ACK] Seq=29 Ack=2 Win=64256 Len=0 TSval=472765819 TSecr=2519309544
35,20.225048,192.168.11.28,192.168.11.21,TCP,74,,,9.805122,"Jan  6, 2024 19:36:31.500872000 JST",,38070  >  6000 [SYN] Seq=0 Win=64240 Len=0 MSS=1460 SACK_PERM TSval=3363017616 TSecr=0 WS=128
36,20.231876,192.168.11.21,192.168.11.28,TCP,74,0.006828,,0.006828,"Jan  6, 2024 19:36:31.507700000 JST",,"6000  >  38070 [SYN, ACK] Seq=0 Ack=1 Win=65160 Len=0 MSS=1460 SACK_PERM TSval=4062660459 TSecr=3363017616 WS=128"
37,20.231994,192.168.11.28,192.168.11.21,TCP,66,0.000118,,0.000118,"Jan  6, 2024 19:36:31.507818000 JST",,38070  >  6000 [ACK] Seq=1 Ack=1 Win=64256 Len=0 TSval=3363017623 TSecr=4062660459
38,20.232166,192.168.11.28,192.168.11.21,TCP,93,,,0.000172,"Jan  6, 2024 19:36:31.507990000 JST",,"38070  >  6000 [PSH, ACK] Seq=1 Ack=1 Win=64256 Len=27 TSval=3363017623 TSecr=4062660459 [TCP segment of a reassembled PDU]"
39,20.232256,192.168.11.28,192.168.11.21,TCP,66,,,0.00009,"Jan  6, 2024 19:36:31.508080000 JST",,"38070  >  6000 [FIN, ACK] Seq=28 Ack=1 Win=64256 Len=0 TSval=3363017623 TSecr=4062660459"
40,20.239518,192.168.11.21,192.168.11.28,TCP,66,0.007352,,0.007262,"Jan  6, 2024 19:36:31.515342000 JST",,6000  >  38070 [ACK] Seq=1 Ack=28 Win=65152 Len=0 TSval=4062660467 TSecr=3363017623
41,20.239726,192.168.11.21,192.168.11.28,TCP,66,0.00747,,0.000208,"Jan  6, 2024 19:36:31.515550000 JST",,"6000  >  38070 [FIN, ACK] Seq=1 Ack=29 Win=65152 Len=0 TSval=4062660469 TSecr=3363017623"
42,20.239771,192.168.11.28,192.168.11.21,TCP,66,0.000045,,0.000045,"Jan  6, 2024 19:36:31.515595000 JST",,38070  >  6000 [ACK] Seq=29 Ack=2 Win=64256 Len=0 TSval=3363017631 TSecr=4062660469
43,20.275553,192.168.11.28,255.255.255.255,UDP,209,,Ÿ,0.035782,"Jan  6, 2024 19:36:31.551377000 JST",7b2273656d616e74696373223a207b22656e74697479223a2022504944222c202262617365656e74697479223a2022616e79222c2022726f6c65223a20226a6a6a222c20227370617469616c223a2022616e79222c202274656d706f72616c223a2022616e79227d2c20226461746170726f7065727479223a207b22666f726d6174223a2022696e616f6b615f70726f6772616d5f73616d706c655f73656d616e746963227d7d,36717  >  7000 Len=167
44,20.281314,192.168.11.7,192.168.11.28,TCP,74,,œ,0.005761,"Jan  6, 2024 19:36:31.557138000 JST",,33680  >  6000 [SYN] Seq=0 Win=64240 Len=0 MSS=1460 SACK_PERM TSval=472775681 TSecr=0 WS=128
45,20.281464,192.168.11.28,192.168.11.7,TCP,74,0.00015,,0.00015,"Jan  6, 2024 19:36:31.557288000 JST",,"6000  >  33680 [SYN, ACK] Seq=0 Ack=1 Win=65160 Len=0 MSS=1460 SACK_PERM TSval=2519319412 TSecr=472775681 WS=128"
46,20.299344,192.168.11.7,192.168.11.28,TCP,66,0.01788,,0.01788,"Jan  6, 2024 19:36:31.575168000 JST",,33680  >  6000 [ACK] Seq=1 Ack=1 Win=64256 Len=0 TSval=472775687 TSecr=2519319412
47,20.300377,192.168.11.7,192.168.11.28,TCP,93,,,0.001033,"Jan  6, 2024 19:36:31.576201000 JST",,"33680  >  6000 [PSH, ACK] Seq=1 Ack=1 Win=64256 Len=27 TSval=472775688 TSecr=2519319412 [TCP segment of a reassembled PDU]"
48,20.30056,192.168.11.28,192.168.11.7,TCP,66,0.000183,,0.000183,"Jan  6, 2024 19:36:31.576384000 JST",,6000  >  33680 [ACK] Seq=1 Ack=28 Win=65152 Len=0 TSval=2519319431 TSecr=472775688
49,20.300662,192.168.11.7,192.168.11.28,TCP,66,,,0.000102,"Jan  6, 2024 19:36:31.576486000 JST",,"33680  >  6000 [FIN, ACK] Seq=28 Ack=1 Win=64256 Len=0 TSval=472775688 TSecr=2519319412"
50,20.302043,192.168.11.28,192.168.11.7,TCP,66,0.001381,,0.001381,"Jan  6, 2024 19:36:31.577867000 JST",,"6000  >  33680 [FIN, ACK] Seq=1 Ack=29 Win=65152 Len=0 TSval=2519319432 TSecr=472775688"
51,20.307888,192.168.11.7,192.168.11.28,TCP,66,0.005845,,0.005845,"Jan  6, 2024 19:36:31.583712000 JST",,33680  >  6000 [ACK] Seq=29 Ack=2 Win=64256 Len=0 TSval=472775707 TSecr=2519319432
52,30.135636,192.168.11.28,192.168.11.21,TCP,74,,,9.827748,"Jan  6, 2024 19:36:41.411460000 JST",,40000  >  6000 [SYN] Seq=0 Win=64240 Len=0 MSS=1460 SACK_PERM TSval=3363027527 TSecr=0 WS=128
53,30.143808,192.168.11.21,192.168.11.28,TCP,74,0.008172,,0.008172,"Jan  6, 2024 19:36:41.419632000 JST",,"6000  >  40000 [SYN, ACK] Seq=0 Ack=1 Win=65160 Len=0 MSS=1460 SACK_PERM TSval=4062670370 TSecr=3363027527 WS=128"
54,30.143929,192.168.11.28,192.168.11.21,TCP,66,0.000121,,0.000121,"Jan  6, 2024 19:36:41.419753000 JST",,40000  >  6000 [ACK] Seq=1 Ack=1 Win=64256 Len=0 TSval=3363027535 TSecr=4062670370
55,30.144109,192.168.11.28,192.168.11.21,TCP,93,,,0.00018,"Jan  6, 2024 19:36:41.419933000 JST",,"40000  >  6000 [PSH, ACK] Seq=1 Ack=1 Win=64256 Len=27 TSval=3363027535 TSecr=4062670370 [TCP segment of a reassembled PDU]"
56,30.144205,192.168.11.28,192.168.11.21,TCP,66,,,0.000096,"Jan  6, 2024 19:36:41.420029000 JST",,"40000  >  6000 [FIN, ACK] Seq=28 Ack=1 Win=64256 Len=0 TSval=3363027535 TSecr=4062670370"
57,30.15144,192.168.11.21,192.168.11.28,TCP,66,0.007331,,0.007235,"Jan  6, 2024 19:36:41.427264000 JST",,6000  >  40000 [ACK] Seq=1 Ack=28 Win=65152 Len=0 TSval=4062670379 TSecr=3363027535
58,30.151804,192.168.11.21,192.168.11.28,TCP,66,0.007599,,0.000364,"Jan  6, 2024 19:36:41.427628000 JST",,"6000  >  40000 [FIN, ACK] Seq=1 Ack=29 Win=65152 Len=0 TSval=4062670380 TSecr=3363027535"
59,30.151855,192.168.11.28,192.168.11.21,TCP,66,0.000051,,0.000051,"Jan  6, 2024 19:36:41.427679000 JST",,40000  >  6000 [ACK] Seq=29 Ack=2 Win=64256 Len=0 TSval=3363027543 TSecr=4062670380
60,30.181506,192.168.11.28,255.255.255.255,UDP,209,,Ÿ,0.029651,"Jan  6, 2024 19:36:41.457330000 JST",7b2273656d616e74696373223a207b22656e74697479223a2022504944222c202262617365656e74697479223a2022616e79222c2022726f6c65223a20226a6a6a222c20227370617469616c223a2022616e79222c202274656d706f72616c223a2022616e79227d2c20226461746170726f7065727479223a207b22666f726d6174223a2022696e616f6b615f70726f6772616d5f73616d706c655f73656d616e746963227d7d,48375  >  7000 Len=167
61,30.187244,192.168.11.7,192.168.11.28,TCP,74,,œ,0.005738,"Jan  6, 2024 19:36:41.463068000 JST",,44618  >  6000 [SYN] Seq=0 Win=64240 Len=0 MSS=1460 SACK_PERM TSval=472785587 TSecr=0 WS=128
62,30.18742,192.168.11.28,192.168.11.7,TCP,74,0.000176,,0.000176,"Jan  6, 2024 19:36:41.463244000 JST",,"6000  >  44618 [SYN, ACK] Seq=0 Ack=1 Win=65160 Len=0 MSS=1460 SACK_PERM TSval=2519329318 TSecr=472785587 WS=128"
63,30.199789,192.168.11.7,192.168.11.28,TCP,66,0.012369,,0.012369,"Jan  6, 2024 19:36:41.475613000 JST",,44618  >  6000 [ACK] Seq=1 Ack=1 Win=64256 Len=0 TSval=472785594 TSecr=2519329318
64,30.200489,192.168.11.7,192.168.11.28,TCP,93,,,0.0007,"Jan  6, 2024 19:36:41.476313000 JST",,"44618  >  6000 [PSH, ACK] Seq=1 Ack=1 Win=64256 Len=27 TSval=472785595 TSecr=2519329318 [TCP segment of a reassembled PDU]"
65,30.200612,192.168.11.28,192.168.11.7,TCP,66,0.000123,,0.000123,"Jan  6, 2024 19:36:41.476436000 JST",,6000  >  44618 [ACK] Seq=1 Ack=28 Win=65152 Len=0 TSval=2519329331 TSecr=472785595
66,30.200724,192.168.11.7,192.168.11.28,TCP,66,,,0.000112,"Jan  6, 2024 19:36:41.476548000 JST",,"44618  >  6000 [FIN, ACK] Seq=28 Ack=1 Win=64256 Len=0 TSval=472785595 TSecr=2519329318"
67,30.20203,192.168.11.28,192.168.11.7,TCP,66,0.001306,,0.001306,"Jan  6, 2024 19:36:41.477854000 JST",,"6000  >  44618 [FIN, ACK] Seq=1 Ack=29 Win=65152 Len=0 TSval=2519329332 TSecr=472785595"
68,30.214532,192.168.11.7,192.168.11.28,TCP,66,0.012502,,0.012502,"Jan  6, 2024 19:36:41.490356000 JST",,44618  >  6000 [ACK] Seq=29 Ack=2 Win=64256 Len=0 TSval=472785614 TSecr=2519329332
69,37.942705,192.168.11.28,192.168.11.21,TCP,74,,,7.728173,"Jan  6, 2024 19:36:49.218529000 JST",,57634  >  6000 [SYN] Seq=0 Win=64240 Len=0 MSS=1460 SACK_PERM TSval=3363035334 TSecr=0 WS=128
70,37.949459,192.168.11.21,192.168.11.28,TCP,74,0.006754,,0.006754,"Jan  6, 2024 19:36:49.225283000 JST",,"6000  >  57634 [SYN, ACK] Seq=0 Ack=1 Win=65160 Len=0 MSS=1460 SACK_PERM TSval=4062678177 TSecr=3363035334 WS=128"
71,37.949581,192.168.11.28,192.168.11.21,TCP,66,0.000122,,0.000122,"Jan  6, 2024 19:36:49.225405000 JST",,57634  >  6000 [ACK] Seq=1 Ack=1 Win=64256 Len=0 TSval=3363035341 TSecr=4062678177
72,37.949723,192.168.11.28,192.168.11.21,TCP,93,,,0.000142,"Jan  6, 2024 19:36:49.225547000 JST",,"57634  >  6000 [PSH, ACK] Seq=1 Ack=1 Win=64256 Len=27 TSval=3363035341 TSecr=4062678177 [TCP segment of a reassembled PDU]"
73,37.949828,192.168.11.28,192.168.11.21,TCP,66,,,0.000105,"Jan  6, 2024 19:36:49.225652000 JST",,"57634  >  6000 [FIN, ACK] Seq=28 Ack=1 Win=64256 Len=0 TSval=3363035341 TSecr=4062678177"
74,37.956932,192.168.11.21,192.168.11.28,TCP,66,0.007209,,0.007104,"Jan  6, 2024 19:36:49.232756000 JST",,6000  >  57634 [ACK] Seq=1 Ack=28 Win=65152 Len=0 TSval=4062678184 TSecr=3363035341
75,37.957178,192.168.11.21,192.168.11.28,TCP,66,0.00735,,0.000246,"Jan  6, 2024 19:36:49.233002000 JST",,"6000  >  57634 [FIN, ACK] Seq=1 Ack=29 Win=65152 Len=0 TSval=4062678186 TSecr=3363035341"
76,37.957234,192.168.11.28,192.168.11.21,TCP,66,0.000056,,0.000056,"Jan  6, 2024 19:36:49.233058000 JST",,57634  >  6000 [ACK] Seq=29 Ack=2 Win=64256 Len=0 TSval=3363035348 TSecr=4062678186
77,37.988873,192.168.11.28,255.255.255.255,UDP,209,,Ÿ,0.031639,"Jan  6, 2024 19:36:49.264697000 JST",7b2273656d616e74696373223a207b22656e74697479223a2022504944222c202262617365656e74697479223a2022616e79222c2022726f6c65223a20226a6a6a222c20227370617469616c223a2022616e79222c202274656d706f72616c223a2022616e79227d2c20226461746170726f7065727479223a207b22666f726d6174223a2022696e616f6b615f70726f6772616d5f73616d706c655f73656d616e746963227d7d,53175  >  7000 Len=167
78,37.999357,192.168.11.7,192.168.11.28,TCP,74,,œ,0.010484,"Jan  6, 2024 19:36:49.275181000 JST",,53496  >  6000 [SYN] Seq=0 Win=64240 Len=0 MSS=1460 SACK_PERM TSval=472793397 TSecr=0 WS=128
79,37.999525,192.168.11.28,192.168.11.7,TCP,74,0.000168,,0.000168,"Jan  6, 2024 19:36:49.275349000 JST",,"6000  >  53496 [SYN, ACK] Seq=0 Ack=1 Win=65160 Len=0 MSS=1460 SACK_PERM TSval=2519337130 TSecr=472793397 WS=128"
80,38.007288,192.168.11.7,192.168.11.28,TCP,66,0.007763,,0.007763,"Jan  6, 2024 19:36:49.283112000 JST",,53496  >  6000 [ACK] Seq=1 Ack=1 Win=64256 Len=0 TSval=472793407 TSecr=2519337130
81,38.007941,192.168.11.7,192.168.11.28,TCP,93,,,0.000653,"Jan  6, 2024 19:36:49.283765000 JST",,"53496  >  6000 [PSH, ACK] Seq=1 Ack=1 Win=64256 Len=27 TSval=472793407 TSecr=2519337130 [TCP segment of a reassembled PDU]"
82,38.008069,192.168.11.28,192.168.11.7,TCP,66,0.000128,,0.000128,"Jan  6, 2024 19:36:49.283893000 JST",,6000  >  53496 [ACK] Seq=1 Ack=28 Win=65152 Len=0 TSval=2519337138 TSecr=472793407
83,38.008168,192.168.11.7,192.168.11.28,TCP,66,,,0.000099,"Jan  6, 2024 19:36:49.283992000 JST",,"53496  >  6000 [FIN, ACK] Seq=28 Ack=1 Win=64256 Len=0 TSval=472793407 TSecr=2519337130"
84,38.009165,192.168.11.28,192.168.11.7,TCP,66,0.000997,,0.000997,"Jan  6, 2024 19:36:49.284989000 JST",,"6000  >  53496 [FIN, ACK] Seq=1 Ack=29 Win=65152 Len=0 TSval=2519337139 TSecr=472793407"
85,38.015442,192.168.11.7,192.168.11.28,TCP,66,0.006277,,0.006277,"Jan  6, 2024 19:36:49.291266000 JST",,53496  >  6000 [ACK] Seq=29 Ack=2 Win=64256 Len=0 TSval=472793414 TSecr=2519337139
86,45.747538,192.168.11.28,192.168.11.21,TCP,74,,,7.732096,"Jan  6, 2024 19:36:57.023362000 JST",,43992  >  6000 [SYN] Seq=0 Win=64240 Len=0 MSS=1460 SACK_PERM TSval=3363043139 TSecr=0 WS=128
87,45.754964,192.168.11.21,192.168.11.28,TCP,74,0.007426,,0.007426,"Jan  6, 2024 19:36:57.030788000 JST",,"6000  >  43992 [SYN, ACK] Seq=0 Ack=1 Win=65160 Len=0 MSS=1460 SACK_PERM TSval=4062685982 TSecr=3363043139 WS=128"
88,45.755077,192.168.11.28,192.168.11.21,TCP,66,0.000113,,0.000113,"Jan  6, 2024 19:36:57.030901000 JST",,43992  >  6000 [ACK] Seq=1 Ack=1 Win=64256 Len=0 TSval=3363043146 TSecr=4062685982
89,45.755242,192.168.11.28,192.168.11.21,TCP,93,,,0.000165,"Jan  6, 2024 19:36:57.031066000 JST",,"43992  >  6000 [PSH, ACK] Seq=1 Ack=1 Win=64256 Len=27 TSval=3363043146 TSecr=4062685982 [TCP segment of a reassembled PDU]"
90,45.755397,192.168.11.28,192.168.11.21,TCP,66,,,0.000155,"Jan  6, 2024 19:36:57.031221000 JST",,"43992  >  6000 [FIN, ACK] Seq=28 Ack=1 Win=64256 Len=0 TSval=3363043147 TSecr=4062685982"
91,45.762399,192.168.11.21,192.168.11.28,TCP,66,0.007157,,0.007002,"Jan  6, 2024 19:36:57.038223000 JST",,6000  >  43992 [ACK] Seq=1 Ack=28 Win=65152 Len=0 TSval=4062685990 TSecr=3363043146
92,45.767914,192.168.11.21,192.168.11.28,TCP,66,0.012517,,0.005515,"Jan  6, 2024 19:36:57.043738000 JST",,"6000  >  43992 [FIN, ACK] Seq=1 Ack=29 Win=65152 Len=0 TSval=4062685995 TSecr=3363043147"
93,45.767961,192.168.11.28,192.168.11.21,TCP,66,0.000047,,0.000047,"Jan  6, 2024 19:36:57.043785000 JST",,43992  >  6000 [ACK] Seq=29 Ack=2 Win=64256 Len=0 TSval=3363043159 TSecr=4062685995
94,45.79752,192.168.11.28,255.255.255.255,UDP,209,,Ÿ,0.029559,"Jan  6, 2024 19:36:57.073344000 JST",7b2273656d616e74696373223a207b22656e74697479223a2022504944222c202262617365656e74697479223a2022616e79222c2022726f6c65223a20226a6a6a222c20227370617469616c223a2022616e79222c202274656d706f72616c223a2022616e79227d2c20226461746170726f7065727479223a207b22666f726d6174223a2022696e616f6b615f70726f6772616d5f73616d706c655f73656d616e746963227d7d,53428  >  7000 Len=167
95,45.807675,192.168.11.7,192.168.11.28,TCP,74,,œ,0.010155,"Jan  6, 2024 19:36:57.083499000 JST",,36788  >  6000 [SYN] Seq=0 Win=64240 Len=0 MSS=1460 SACK_PERM TSval=472801202 TSecr=0 WS=128
96,45.807808,192.168.11.28,192.168.11.7,TCP,74,0.000133,,0.000133,"Jan  6, 2024 19:36:57.083632000 JST",,"6000  >  36788 [SYN, ACK] Seq=0 Ack=1 Win=65160 Len=0 MSS=1460 SACK_PERM TSval=2519344938 TSecr=472801202 WS=128"
97,45.814727,192.168.11.7,192.168.11.28,TCP,66,0.006919,,0.006919,"Jan  6, 2024 19:36:57.090551000 JST",,36788  >  6000 [ACK] Seq=1 Ack=1 Win=64256 Len=0 TSval=472801214 TSecr=2519344938
98,45.815326,192.168.11.7,192.168.11.28,TCP,93,,,0.000599,"Jan  6, 2024 19:36:57.091150000 JST",,"36788  >  6000 [PSH, ACK] Seq=1 Ack=1 Win=64256 Len=27 TSval=472801214 TSecr=2519344938 [TCP segment of a reassembled PDU]"
99,45.815431,192.168.11.28,192.168.11.7,TCP,66,0.000105,,0.000105,"Jan  6, 2024 19:36:57.091255000 JST",,6000  >  36788 [ACK] Seq=1 Ack=28 Win=65152 Len=0 TSval=2519344946 TSecr=472801214
100,45.815575,192.168.11.7,192.168.11.28,TCP,66,,,0.000144,"Jan  6, 2024 19:36:57.091399000 JST",,"36788  >  6000 [FIN, ACK] Seq=28 Ack=1 Win=64256 Len=0 TSval=472801214 TSecr=2519344938"
101,45.816796,192.168.11.28,192.168.11.7,TCP,66,0.001221,,0.001221,"Jan  6, 2024 19:36:57.092620000 JST",,"6000  >  36788 [FIN, ACK] Seq=1 Ack=29 Win=65152 Len=0 TSval=2519344947 TSecr=472801214"
102,45.822863,192.168.11.7,192.168.11.28,TCP,66,0.006067,,0.006067,"Jan  6, 2024 19:36:57.098687000 JST",,36788  >  6000 [ACK] Seq=29 Ack=2 Win=64256 Len=0 TSval=472801222 TSecr=2519344947
103,53.611419,192.168.11.28,192.168.11.21,TCP,74,,,7.788556,"Jan  6, 2024 19:37:04.887243000 JST",,43996  >  6000 [SYN] Seq=0 Win=64240 Len=0 MSS=1460 SACK_PERM TSval=3363051003 TSecr=0 WS=128
104,53.619582,192.168.11.21,192.168.11.28,TCP,74,0.008163,,0.008163,"Jan  6, 2024 19:37:04.895406000 JST",,"6000  >  43996 [SYN, ACK] Seq=0 Ack=1 Win=65160 Len=0 MSS=1460 SACK_PERM TSval=4062693847 TSecr=3363051003 WS=128"
105,53.619691,192.168.11.28,192.168.11.21,TCP,66,0.000109,,0.000109,"Jan  6, 2024 19:37:04.895515000 JST",,43996  >  6000 [ACK] Seq=1 Ack=1 Win=64256 Len=0 TSval=3363051011 TSecr=4062693847
106,53.619833,192.168.11.28,192.168.11.21,TCP,93,,,0.000142,"Jan  6, 2024 19:37:04.895657000 JST",,"43996  >  6000 [PSH, ACK] Seq=1 Ack=1 Win=64256 Len=27 TSval=3363051011 TSecr=4062693847 [TCP segment of a reassembled PDU]"
107,53.619938,192.168.11.28,192.168.11.21,TCP,66,,,0.000105,"Jan  6, 2024 19:37:04.895762000 JST",,"43996  >  6000 [FIN, ACK] Seq=28 Ack=1 Win=64256 Len=0 TSval=3363051011 TSecr=4062693847"
108,53.627649,192.168.11.21,192.168.11.28,TCP,66,0.007816,,0.007711,"Jan  6, 2024 19:37:04.903473000 JST",,6000  >  43996 [ACK] Seq=1 Ack=28 Win=65152 Len=0 TSval=4062693855 TSecr=3363051011
109,53.628012,192.168.11.21,192.168.11.28,TCP,66,0.008074,,0.000363,"Jan  6, 2024 19:37:04.903836000 JST",,"6000  >  43996 [FIN, ACK] Seq=1 Ack=29 Win=65152 Len=0 TSval=4062693856 TSecr=3363051011"
110,53.628061,192.168.11.28,192.168.11.21,TCP,66,0.000049,,0.000049,"Jan  6, 2024 19:37:04.903885000 JST",,43996  >  6000 [ACK] Seq=29 Ack=2 Win=64256 Len=0 TSval=3363051019 TSecr=4062693856
111,53.657208,192.168.11.28,255.255.255.255,UDP,209,,Ÿ,0.029147,"Jan  6, 2024 19:37:04.933032000 JST",7b2273656d616e74696373223a207b22656e74697479223a2022504944222c202262617365656e74697479223a2022616e79222c2022726f6c65223a20226a6a6a222c20227370617469616c223a2022616e79222c202274656d706f72616c223a2022616e79227d2c20226461746170726f7065727479223a207b22666f726d6174223a2022696e616f6b615f70726f6772616d5f73616d706c655f73656d616e746963227d7d,35096  >  7000 Len=167
112,53.662997,192.168.11.7,192.168.11.28,TCP,74,,œ,0.005789,"Jan  6, 2024 19:37:04.938821000 JST",,37778  >  6000 [SYN] Seq=0 Win=64240 Len=0 MSS=1460 SACK_PERM TSval=472809062 TSecr=0 WS=128
113,53.663135,192.168.11.28,192.168.11.7,TCP,74,0.000138,,0.000138,"Jan  6, 2024 19:37:04.938959000 JST",,"6000  >  37778 [SYN, ACK] Seq=0 Ack=1 Win=65160 Len=0 MSS=1460 SACK_PERM TSval=2519352793 TSecr=472809062 WS=128"
114,53.670258,192.168.11.7,192.168.11.28,TCP,66,0.007123,,0.007123,"Jan  6, 2024 19:37:04.946082000 JST",,37778  >  6000 [ACK] Seq=1 Ack=1 Win=64256 Len=0 TSval=472809069 TSecr=2519352793
115,53.670874,192.168.11.7,192.168.11.28,TCP,93,,,0.000616,"Jan  6, 2024 19:37:04.946698000 JST",,"37778  >  6000 [PSH, ACK] Seq=1 Ack=1 Win=64256 Len=27 TSval=472809069 TSecr=2519352793 [TCP segment of a reassembled PDU]"
116,53.670974,192.168.11.28,192.168.11.7,TCP,66,0.0001,,0.0001,"Jan  6, 2024 19:37:04.946798000 JST",,6000  >  37778 [ACK] Seq=1 Ack=28 Win=65152 Len=0 TSval=2519352801 TSecr=472809069
117,53.671049,192.168.11.7,192.168.11.28,TCP,66,,,0.000075,"Jan  6, 2024 19:37:04.946873000 JST",,"37778  >  6000 [FIN, ACK] Seq=28 Ack=1 Win=64256 Len=0 TSval=472809069 TSecr=2519352793"
118,53.672438,192.168.11.28,192.168.11.7,TCP,66,0.001389,,0.001389,"Jan  6, 2024 19:37:04.948262000 JST",,"6000  >  37778 [FIN, ACK] Seq=1 Ack=29 Win=65152 Len=0 TSval=2519352803 TSecr=472809069"
119,53.678877,192.168.11.7,192.168.11.28,TCP,66,0.006439,,0.006439,"Jan  6, 2024 19:37:04.954701000 JST",,37778  >  6000 [ACK] Seq=29 Ack=2 Win=64256 Len=0 TSval=472809077 TSecr=2519352803
120,61.898274,192.168.11.28,192.168.11.21,TCP,74,,,8.219397,"Jan  6, 2024 19:37:13.174098000 JST",,45596  >  6000 [SYN] Seq=0 Win=64240 Len=0 MSS=1460 SACK_PERM TSval=3363059289 TSecr=0 WS=128
121,61.904969,192.168.11.21,192.168.11.28,TCP,74,0.006695,,0.006695,"Jan  6, 2024 19:37:13.180793000 JST",,"6000  >  45596 [SYN, ACK] Seq=0 Ack=1 Win=65160 Len=0 MSS=1460 SACK_PERM TSval=4062702132 TSecr=3363059289 WS=128"
122,61.905075,192.168.11.28,192.168.11.21,TCP,66,0.000106,,0.000106,"Jan  6, 2024 19:37:13.180899000 JST",,45596  >  6000 [ACK] Seq=1 Ack=1 Win=64256 Len=0 TSval=3363059296 TSecr=4062702132
123,61.905213,192.168.11.28,192.168.11.21,TCP,93,,,0.000138,"Jan  6, 2024 19:37:13.181037000 JST",,"45596  >  6000 [PSH, ACK] Seq=1 Ack=1 Win=64256 Len=27 TSval=3363059296 TSecr=4062702132 [TCP segment of a reassembled PDU]"
124,61.90532,192.168.11.28,192.168.11.21,TCP,66,,,0.000107,"Jan  6, 2024 19:37:13.181144000 JST",,"45596  >  6000 [FIN, ACK] Seq=28 Ack=1 Win=64256 Len=0 TSval=3363059297 TSecr=4062702132"
125,61.916652,192.168.11.21,192.168.11.28,TCP,66,0.011439,,0.011332,"Jan  6, 2024 19:37:13.192476000 JST",,6000  >  45596 [ACK] Seq=1 Ack=28 Win=65152 Len=0 TSval=4062702140 TSecr=3363059296
126,61.917024,192.168.11.21,192.168.11.28,TCP,66,0.011704,,0.000372,"Jan  6, 2024 19:37:13.192848000 JST",,"6000  >  45596 [FIN, ACK] Seq=1 Ack=29 Win=65152 Len=0 TSval=4062702141 TSecr=3363059297"
127,61.917095,192.168.11.28,192.168.11.21,TCP,66,0.000071,,0.000071,"Jan  6, 2024 19:37:13.192919000 JST",,45596  >  6000 [ACK] Seq=29 Ack=2 Win=64256 Len=0 TSval=3363059308 TSecr=4062702141
128,61.946332,192.168.11.28,255.255.255.255,UDP,209,,Ÿ,0.029237,"Jan  6, 2024 19:37:13.222156000 JST",7b2273656d616e74696373223a207b22656e74697479223a2022504944222c202262617365656e74697479223a2022616e79222c2022726f6c65223a20226a6a6a222c20227370617469616c223a2022616e79222c202274656d706f72616c223a2022616e79227d2c20226461746170726f7065727479223a207b22666f726d6174223a2022696e616f6b615f70726f6772616d5f73616d706c655f73656d616e746963227d7d,41828  >  7000 Len=167
129,61.952069,192.168.11.7,192.168.11.28,TCP,74,,œ,0.005737,"Jan  6, 2024 19:37:13.227893000 JST",,37784  >  6000 [SYN] Seq=0 Win=64240 Len=0 MSS=1460 SACK_PERM TSval=472817351 TSecr=0 WS=128
130,61.95219,192.168.11.28,192.168.11.7,TCP,74,0.000121,,0.000121,"Jan  6, 2024 19:37:13.228014000 JST",,"6000  >  37784 [SYN, ACK] Seq=0 Ack=1 Win=65160 Len=0 MSS=1460 SACK_PERM TSval=2519361082 TSecr=472817351 WS=128"
131,61.958896,192.168.11.7,192.168.11.28,TCP,66,0.006706,,0.006706,"Jan  6, 2024 19:37:13.234720000 JST",,37784  >  6000 [ACK] Seq=1 Ack=1 Win=64256 Len=0 TSval=472817358 TSecr=2519361082
132,61.959623,192.168.11.7,192.168.11.28,TCP,93,,,0.000727,"Jan  6, 2024 19:37:13.235447000 JST",,"37784  >  6000 [PSH, ACK] Seq=1 Ack=1 Win=64256 Len=27 TSval=472817358 TSecr=2519361082 [TCP segment of a reassembled PDU]"
133,61.959766,192.168.11.28,192.168.11.7,TCP,66,0.000143,,0.000143,"Jan  6, 2024 19:37:13.235590000 JST",,6000  >  37784 [ACK] Seq=1 Ack=28 Win=65152 Len=0 TSval=2519361090 TSecr=472817358
134,61.959851,192.168.11.7,192.168.11.28,TCP,66,,,0.000085,"Jan  6, 2024 19:37:13.235675000 JST",,"37784  >  6000 [FIN, ACK] Seq=28 Ack=1 Win=64256 Len=0 TSval=472817358 TSecr=2519361082"
135,61.961138,192.168.11.28,192.168.11.7,TCP,66,0.001287,,0.001287,"Jan  6, 2024 19:37:13.236962000 JST",,"6000  >  37784 [FIN, ACK] Seq=1 Ack=29 Win=65152 Len=0 TSval=2519361091 TSecr=472817358"
136,61.967262,192.168.11.7,192.168.11.28,TCP,66,0.006124,,0.006124,"Jan  6, 2024 19:37:13.243086000 JST",,37784  >  6000 [ACK] Seq=29 Ack=2 Win=64256 Len=0 TSval=472817366 TSecr=2519361091
137,71.826482,192.168.11.28,192.168.11.21,TCP,74,,,9.85922,"Jan  6, 2024 19:37:23.102306000 JST",,40578  >  6000 [SYN] Seq=0 Win=64240 Len=0 MSS=1460 SACK_PERM TSval=3363069218 TSecr=0 WS=128
138,71.834256,192.168.11.21,192.168.11.28,TCP,74,0.007774,,0.007774,"Jan  6, 2024 19:37:23.110080000 JST",,"6000  >  40578 [SYN, ACK] Seq=0 Ack=1 Win=65160 Len=0 MSS=1460 SACK_PERM TSval=4062712062 TSecr=3363069218 WS=128"
139,71.834363,192.168.11.28,192.168.11.21,TCP,66,0.000107,,0.000107,"Jan  6, 2024 19:37:23.110187000 JST",,40578  >  6000 [ACK] Seq=1 Ack=1 Win=64256 Len=0 TSval=3363069226 TSecr=4062712062
140,71.834553,192.168.11.28,192.168.11.21,TCP,93,,,0.00019,"Jan  6, 2024 19:37:23.110377000 JST",,"40578  >  6000 [PSH, ACK] Seq=1 Ack=1 Win=64256 Len=27 TSval=3363069226 TSecr=4062712062 [TCP segment of a reassembled PDU]"
141,71.834659,192.168.11.28,192.168.11.21,TCP,66,,,0.000106,"Jan  6, 2024 19:37:23.110483000 JST",,"40578  >  6000 [FIN, ACK] Seq=28 Ack=1 Win=64256 Len=0 TSval=3363069226 TSecr=4062712062"
142,71.841631,192.168.11.21,192.168.11.28,TCP,66,0.007078,,0.006972,"Jan  6, 2024 19:37:23.117455000 JST",,6000  >  40578 [ACK] Seq=1 Ack=28 Win=65152 Len=0 TSval=4062712069 TSecr=3363069226
143,71.841991,192.168.11.21,192.168.11.28,TCP,66,0.007332,,0.00036,"Jan  6, 2024 19:37:23.117815000 JST",,"6000  >  40578 [FIN, ACK] Seq=1 Ack=29 Win=65152 Len=0 TSval=4062712070 TSecr=3363069226"
144,71.842036,192.168.11.28,192.168.11.21,TCP,66,0.000045,,0.000045,"Jan  6, 2024 19:37:23.117860000 JST",,40578  >  6000 [ACK] Seq=29 Ack=2 Win=64256 Len=0 TSval=3363069233 TSecr=4062712070
145,71.869548,192.168.11.28,255.255.255.255,UDP,209,,Ÿ,0.027512,"Jan  6, 2024 19:37:23.145372000 JST",7b2273656d616e74696373223a207b22656e74697479223a2022504944222c202262617365656e74697479223a2022616e79222c2022726f6c65223a20226a6a6a222c20227370617469616c223a2022616e79222c202274656d706f72616c223a2022616e79227d2c20226461746170726f7065727479223a207b22666f726d6174223a2022696e616f6b615f70726f6772616d5f73616d706c655f73656d616e746963227d7d,41597  >  7000 Len=167
146,71.875506,192.168.11.7,192.168.11.28,TCP,74,,œ,0.005958,"Jan  6, 2024 19:37:23.151330000 JST",,59148  >  6000 [SYN] Seq=0 Win=64240 Len=0 MSS=1460 SACK_PERM TSval=472827275 TSecr=0 WS=128
147,71.875633,192.168.11.28,192.168.11.7,TCP,74,0.000127,,0.000127,"Jan  6, 2024 19:37:23.151457000 JST",,"6000  >  59148 [SYN, ACK] Seq=0 Ack=1 Win=65160 Len=0 MSS=1460 SACK_PERM TSval=2519371006 TSecr=472827275 WS=128"
148,71.882504,192.168.11.7,192.168.11.28,TCP,66,0.006871,,0.006871,"Jan  6, 2024 19:37:23.158328000 JST",,59148  >  6000 [ACK] Seq=1 Ack=1 Win=64256 Len=0 TSval=472827282 TSecr=2519371006
149,71.883051,192.168.11.7,192.168.11.28,TCP,93,,,0.000547,"Jan  6, 2024 19:37:23.158875000 JST",,"59148  >  6000 [PSH, ACK] Seq=1 Ack=1 Win=64256 Len=27 TSval=472827282 TSecr=2519371006 [TCP segment of a reassembled PDU]"
150,71.88313,192.168.11.28,192.168.11.7,TCP,66,0.000079,,0.000079,"Jan  6, 2024 19:37:23.158954000 JST",,6000  >  59148 [ACK] Seq=1 Ack=28 Win=65152 Len=0 TSval=2519371013 TSecr=472827282
151,71.883204,192.168.11.7,192.168.11.28,TCP,66,,,0.000074,"Jan  6, 2024 19:37:23.159028000 JST",,"59148  >  6000 [FIN, ACK] Seq=28 Ack=1 Win=64256 Len=0 TSval=472827282 TSecr=2519371006"
152,71.888301,192.168.11.28,192.168.11.7,TCP,66,0.005097,,0.005097,"Jan  6, 2024 19:37:23.164125000 JST",,"6000  >  59148 [FIN, ACK] Seq=1 Ack=29 Win=65152 Len=0 TSval=2519371018 TSecr=472827282"
153,71.895709,192.168.11.7,192.168.11.28,TCP,66,0.007408,,0.007408,"Jan  6, 2024 19:37:23.171533000 JST",,59148  >  6000 [ACK] Seq=29 Ack=2 Win=64256 Len=0 TSval=472827294 TSecr=2519371018
154,82.729044,192.168.11.28,192.168.11.21,TCP,74,,,10.833335,"Jan  6, 2024 19:37:34.004868000 JST",,46738  >  6000 [SYN] Seq=0 Win=64240 Len=0 MSS=1460 SACK_PERM TSval=3363080120 TSecr=0 WS=128
155,82.739862,192.168.11.21,192.168.11.28,TCP,74,0.010818,,0.010818,"Jan  6, 2024 19:37:34.015686000 JST",,"6000  >  46738 [SYN, ACK] Seq=0 Ack=1 Win=65160 Len=0 MSS=1460 SACK_PERM TSval=4062722967 TSecr=3363080120 WS=128"
156,82.739969,192.168.11.28,192.168.11.21,TCP,66,0.000107,,0.000107,"Jan  6, 2024 19:37:34.015793000 JST",,46738  >  6000 [ACK] Seq=1 Ack=1 Win=64256 Len=0 TSval=3363080131 TSecr=4062722967
157,82.740113,192.168.11.28,192.168.11.21,TCP,93,,,0.000144,"Jan  6, 2024 19:37:34.015937000 JST",,"46738  >  6000 [PSH, ACK] Seq=1 Ack=1 Win=64256 Len=27 TSval=3363080131 TSecr=4062722967 [TCP segment of a reassembled PDU]"
158,82.740235,192.168.11.28,192.168.11.21,TCP,66,,,0.000122,"Jan  6, 2024 19:37:34.016059000 JST",,"46738  >  6000 [FIN, ACK] Seq=28 Ack=1 Win=64256 Len=0 TSval=3363080131 TSecr=4062722967"
159,82.748168,192.168.11.21,192.168.11.28,TCP,66,0.008055,,0.007933,"Jan  6, 2024 19:37:34.023992000 JST",,6000  >  46738 [ACK] Seq=1 Ack=28 Win=65152 Len=0 TSval=4062722975 TSecr=3363080131
160,82.748375,192.168.11.21,192.168.11.28,TCP,66,0.00814,,0.000207,"Jan  6, 2024 19:37:34.024199000 JST",,"6000  >  46738 [FIN, ACK] Seq=1 Ack=29 Win=65152 Len=0 TSval=4062722976 TSecr=3363080131"
161,82.74842,192.168.11.28,192.168.11.21,TCP,66,0.000045,,0.000045,"Jan  6, 2024 19:37:34.024244000 JST",,46738  >  6000 [ACK] Seq=29 Ack=2 Win=64256 Len=0 TSval=3363080140 TSecr=4062722976
162,82.778963,192.168.11.28,255.255.255.255,UDP,209,,Ÿ,0.030543,"Jan  6, 2024 19:37:34.054787000 JST",7b2273656d616e74696373223a207b22656e74697479223a2022504944222c202262617365656e74697479223a2022616e79222c2022726f6c65223a20226a6a6a222c20227370617469616c223a2022616e79222c202274656d706f72616c223a2022616e79227d2c20226461746170726f7065727479223a207b22666f726d6174223a2022696e616f6b615f70726f6772616d5f73616d706c655f73656d616e746963227d7d,37873  >  7000 Len=167
163,82.784663,192.168.11.7,192.168.11.28,TCP,74,,œ,0.0057,"Jan  6, 2024 19:37:34.060487000 JST",,36606  >  6000 [SYN] Seq=0 Win=64240 Len=0 MSS=1460 SACK_PERM TSval=472838184 TSecr=0 WS=128
164,82.784817,192.168.11.28,192.168.11.7,TCP,74,0.000154,,0.000154,"Jan  6, 2024 19:37:34.060641000 JST",,"6000  >  36606 [SYN, ACK] Seq=0 Ack=1 Win=65160 Len=0 MSS=1460 SACK_PERM TSval=2519381915 TSecr=472838184 WS=128"
165,82.791561,192.168.11.7,192.168.11.28,TCP,66,0.006744,,0.006744,"Jan  6, 2024 19:37:34.067385000 JST",,36606  >  6000 [ACK] Seq=1 Ack=1 Win=64256 Len=0 TSval=472838191 TSecr=2519381915
166,82.792245,192.168.11.7,192.168.11.28,TCP,93,,,0.000684,"Jan  6, 2024 19:37:34.068069000 JST",,"36606  >  6000 [PSH, ACK] Seq=1 Ack=1 Win=64256 Len=27 TSval=472838191 TSecr=2519381915 [TCP segment of a reassembled PDU]"
167,82.792357,192.168.11.28,192.168.11.7,TCP,66,0.000112,,0.000112,"Jan  6, 2024 19:37:34.068181000 JST",,6000  >  36606 [ACK] Seq=1 Ack=28 Win=65152 Len=0 TSval=2519381922 TSecr=472838191
168,82.792445,192.168.11.7,192.168.11.28,TCP,66,,,0.000088,"Jan  6, 2024 19:37:34.068269000 JST",,"36606  >  6000 [FIN, ACK] Seq=28 Ack=1 Win=64256 Len=0 TSval=472838191 TSecr=2519381915"
169,82.793782,192.168.11.28,192.168.11.7,TCP,66,0.001337,,0.001337,"Jan  6, 2024 19:37:34.069606000 JST",,"6000  >  36606 [FIN, ACK] Seq=1 Ack=29 Win=65152 Len=0 TSval=2519381924 TSecr=472838191"
170,82.800016,192.168.11.7,192.168.11.28,TCP,66,0.006234,,0.006234,"Jan  6, 2024 19:37:34.075840000 JST",,36606  >  6000 [ACK] Seq=29 Ack=2 Win=64256 Len=0 TSval=472838199 TSecr=2519381924
171,114.915704,192.168.11.28,192.168.11.21,TCP,74,,,32.115688,"Jan  6, 2024 19:38:06.191528000 JST",,57296  >  6000 [SYN] Seq=0 Win=64240 Len=0 MSS=1460 SACK_PERM TSval=3363112307 TSecr=0 WS=128
172,114.922302,192.168.11.21,192.168.11.28,TCP,74,0.006598,,0.006598,"Jan  6, 2024 19:38:06.198126000 JST",,"6000  >  57296 [SYN, ACK] Seq=0 Ack=1 Win=65160 Len=0 MSS=1460 SACK_PERM TSval=4062755150 TSecr=3363112307 WS=128"
173,114.922416,192.168.11.28,192.168.11.21,TCP,66,0.000114,,0.000114,"Jan  6, 2024 19:38:06.198240000 JST",,57296  >  6000 [ACK] Seq=1 Ack=1 Win=64256 Len=0 TSval=3363112314 TSecr=4062755150
174,114.922546,192.168.11.28,192.168.11.21,TCP,93,,,0.00013,"Jan  6, 2024 19:38:06.198370000 JST",,"57296  >  6000 [PSH, ACK] Seq=1 Ack=1 Win=64256 Len=27 TSval=3363112314 TSecr=4062755150 [TCP segment of a reassembled PDU]"
175,114.922653,192.168.11.28,192.168.11.21,TCP,66,,,0.000107,"Jan  6, 2024 19:38:06.198477000 JST",,"57296  >  6000 [FIN, ACK] Seq=28 Ack=1 Win=64256 Len=0 TSval=3363112314 TSecr=4062755150"
176,114.929823,192.168.11.21,192.168.11.28,TCP,66,0.007277,,0.00717,"Jan  6, 2024 19:38:06.205647000 JST",,6000  >  57296 [ACK] Seq=1 Ack=28 Win=65152 Len=0 TSval=4062755157 TSecr=3363112314
177,114.930189,192.168.11.21,192.168.11.28,TCP,66,0.007536,,0.000366,"Jan  6, 2024 19:38:06.206013000 JST",,"6000  >  57296 [FIN, ACK] Seq=1 Ack=29 Win=65152 Len=0 TSval=4062755158 TSecr=3363112314"
178,114.930245,192.168.11.28,192.168.11.21,TCP,66,0.000056,,0.000056,"Jan  6, 2024 19:38:06.206069000 JST",,57296  >  6000 [ACK] Seq=29 Ack=2 Win=64256 Len=0 TSval=3363112321 TSecr=4062755158
179,114.957972,192.168.11.28,255.255.255.255,UDP,209,,Ÿ,0.027727,"Jan  6, 2024 19:38:06.233796000 JST",7b2273656d616e74696373223a207b22656e74697479223a2022504944222c202262617365656e74697479223a2022616e79222c2022726f6c65223a20226a6a6a222c20227370617469616c223a2022616e79222c202274656d706f72616c223a2022616e79227d2c20226461746170726f7065727479223a207b22666f726d6174223a2022696e616f6b615f70726f6772616d5f73616d706c655f73656d616e746963227d7d,55726  >  7000 Len=167
180,114.964798,192.168.11.7,192.168.11.28,TCP,74,,œ,0.006826,"Jan  6, 2024 19:38:06.240622000 JST",,45438  >  6000 [SYN] Seq=0 Win=64240 Len=0 MSS=1460 SACK_PERM TSval=472870363 TSecr=0 WS=128
181,114.964965,192.168.11.28,192.168.11.7,TCP,74,0.000167,,0.000167,"Jan  6, 2024 19:38:06.240789000 JST",,"6000  >  45438 [SYN, ACK] Seq=0 Ack=1 Win=65160 Len=0 MSS=1460 SACK_PERM TSval=2519414095 TSecr=472870363 WS=128"
182,114.971764,192.168.11.7,192.168.11.28,TCP,66,0.006799,,0.006799,"Jan  6, 2024 19:38:06.247588000 JST",,45438  >  6000 [ACK] Seq=1 Ack=1 Win=64256 Len=0 TSval=472870371 TSecr=2519414095
183,114.972444,192.168.11.7,192.168.11.28,TCP,93,,,0.00068,"Jan  6, 2024 19:38:06.248268000 JST",,"45438  >  6000 [PSH, ACK] Seq=1 Ack=1 Win=64256 Len=27 TSval=472870371 TSecr=2519414095 [TCP segment of a reassembled PDU]"
184,114.972541,192.168.11.28,192.168.11.7,TCP,66,0.000097,,0.000097,"Jan  6, 2024 19:38:06.248365000 JST",,6000  >  45438 [ACK] Seq=1 Ack=28 Win=65152 Len=0 TSval=2519414103 TSecr=472870371
185,114.972626,192.168.11.7,192.168.11.28,TCP,66,,,0.000085,"Jan  6, 2024 19:38:06.248450000 JST",,"45438  >  6000 [FIN, ACK] Seq=28 Ack=1 Win=64256 Len=0 TSval=472870371 TSecr=2519414095"
