No.,Time,Source,Destination,Protocol,Length,The RTT to ACK the segment was,XXX,Time delta from previous captured frame,Arrival Time,Data,Info
1,0,192.168.11.25,192.168.11.26,TCP,74,,,0,"Jan  6, 2024 19:36:11.449530000 JST",,35348  >  6000 [SYN] Seq=0 Win=64240 Len=0 MSS=1460 SACK_PERM TSval=321334414 TSecr=0 WS=128
2,0.007339,192.168.11.26,192.168.11.25,TCP,74,0.007339,,0.007339,"Jan  6, 2024 19:36:11.456869000 JST",,"6000  >  35348 [SYN, ACK] Seq=0 Ack=1 Win=65160 Len=0 MSS=1460 SACK_PERM TSval=516400909 TSecr=321334414 WS=128"
3,0.007449,192.168.11.25,192.168.11.26,TCP,66,0.00011,,0.00011,"Jan  6, 2024 19:36:11.456979000 JST",,35348  >  6000 [ACK] Seq=1 Ack=1 Win=64256 Len=0 TSval=321334426 TSecr=516400909
4,0.007659,192.168.11.25,192.168.11.26,TCP,93,,,0.00021,"Jan  6, 2024 19:36:11.457189000 JST",,"35348  >  6000 [PSH, ACK] Seq=1 Ack=1 Win=64256 Len=27 TSval=321334426 TSecr=516400909 [TCP segment of a reassembled PDU]"
5,0.00779,192.168.11.25,192.168.11.26,TCP,66,,,0.000131,"Jan  6, 2024 19:36:11.457320000 JST",,"35348  >  6000 [FIN, ACK] Seq=28 Ack=1 Win=64256 Len=0 TSval=321334427 TSecr=516400909"
6,0.015681,192.168.11.26,192.168.11.25,TCP,66,0.008022,,0.007891,"Jan  6, 2024 19:36:11.465211000 JST",,6000  >  35348 [ACK] Seq=1 Ack=28 Win=65152 Len=0 TSval=516400918 TSecr=321334426
7,0.015918,192.168.11.26,192.168.11.25,TCP,66,0.008128,,0.000237,"Jan  6, 2024 19:36:11.465448000 JST",,"6000  >  35348 [FIN, ACK] Seq=1 Ack=29 Win=65152 Len=0 TSval=516400919 TSecr=321334427"
8,0.015966,192.168.11.25,192.168.11.26,TCP,66,0.000048,,0.000048,"Jan  6, 2024 19:36:11.465496000 JST",,35348  >  6000 [ACK] Seq=29 Ack=2 Win=64256 Len=0 TSval=321334435 TSecr=516400919
9,0.046996,192.168.11.25,255.255.255.255,UDP,209,,Ÿ,0.03103,"Jan  6, 2024 19:36:11.496526000 JST",7b2273656d616e74696373223a207b22656e74697479223a2022504944222c202262617365656e74697479223a2022616e79222c2022726f6c65223a20226d6d6d222c20227370617469616c223a2022616e79222c202274656d706f72616c223a2022616e79227d2c20226461746170726f7065727479223a207b22666f726d6174223a2022696e616f6b615f70726f6772616d5f73616d706c655f73656d616e746963227d7d,53262  >  7000 Len=167
10,0.055636,192.168.11.4,192.168.11.25,TCP,74,,œ,0.00864,"Jan  6, 2024 19:36:11.505166000 JST",,43762  >  6000 [SYN] Seq=0 Win=64240 Len=0 MSS=1460 SACK_PERM TSval=2744803300 TSecr=0 WS=128
11,0.05578,192.168.11.25,192.168.11.4,TCP,74,0.000144,,0.000144,"Jan  6, 2024 19:36:11.505310000 JST",,"6000  >  43762 [SYN, ACK] Seq=0 Ack=1 Win=65160 Len=0 MSS=1460 SACK_PERM TSval=2627840525 TSecr=2744803300 WS=128"
12,0.062468,192.168.11.4,192.168.11.25,TCP,66,0.006688,,0.006688,"Jan  6, 2024 19:36:11.511998000 JST",,43762  >  6000 [ACK] Seq=1 Ack=1 Win=64256 Len=0 TSval=2744803309 TSecr=2627840525
13,0.063161,192.168.11.4,192.168.11.25,TCP,93,,,0.000693,"Jan  6, 2024 19:36:11.512691000 JST",,"43762  >  6000 [PSH, ACK] Seq=1 Ack=1 Win=64256 Len=27 TSval=2744803309 TSecr=2627840525 [TCP segment of a reassembled PDU]"
14,0.063275,192.168.11.25,192.168.11.4,TCP,66,0.000114,,0.000114,"Jan  6, 2024 19:36:11.512805000 JST",,6000  >  43762 [ACK] Seq=1 Ack=28 Win=65152 Len=0 TSval=2627840533 TSecr=2744803309
15,0.063348,192.168.11.4,192.168.11.25,TCP,66,,,0.000073,"Jan  6, 2024 19:36:11.512878000 JST",,"43762  >  6000 [FIN, ACK] Seq=28 Ack=1 Win=64256 Len=0 TSval=2744803309 TSecr=2627840525"
16,0.064729,192.168.11.25,192.168.11.4,TCP,66,0.001381,,0.001381,"Jan  6, 2024 19:36:11.514259000 JST",,"6000  >  43762 [FIN, ACK] Seq=1 Ack=29 Win=65152 Len=0 TSval=2627840534 TSecr=2744803309"
17,0.070964,192.168.11.4,192.168.11.25,TCP,66,0.006235,,0.006235,"Jan  6, 2024 19:36:11.520494000 JST",,43762  >  6000 [ACK] Seq=29 Ack=2 Win=64256 Len=0 TSval=2744803317 TSecr=2627840534
18,10.318398,192.168.11.25,192.168.11.26,TCP,74,,,10.247434,"Jan  6, 2024 19:36:21.767928000 JST",,42788  >  6000 [SYN] Seq=0 Win=64240 Len=0 MSS=1460 SACK_PERM TSval=321344737 TSecr=0 WS=128
19,10.32713,192.168.11.26,192.168.11.25,TCP,74,0.008732,,0.008732,"Jan  6, 2024 19:36:21.776660000 JST",,"6000  >  42788 [SYN, ACK] Seq=0 Ack=1 Win=65160 Len=0 MSS=1460 SACK_PERM TSval=516411228 TSecr=321344737 WS=128"
20,10.327243,192.168.11.25,192.168.11.26,TCP,66,0.000113,,0.000113,"Jan  6, 2024 19:36:21.776773000 JST",,42788  >  6000 [ACK] Seq=1 Ack=1 Win=64256 Len=0 TSval=321344746 TSecr=516411228
21,10.327392,192.168.11.25,192.168.11.26,TCP,93,,,0.000149,"Jan  6, 2024 19:36:21.776922000 JST",,"42788  >  6000 [PSH, ACK] Seq=1 Ack=1 Win=64256 Len=27 TSval=321344746 TSecr=516411228 [TCP segment of a reassembled PDU]"
22,10.327542,192.168.11.25,192.168.11.26,TCP,66,,,0.00015,"Jan  6, 2024 19:36:21.777072000 JST",,"42788  >  6000 [FIN, ACK] Seq=28 Ack=1 Win=64256 Len=0 TSval=321344746 TSecr=516411228"
23,10.335062,192.168.11.26,192.168.11.25,TCP,66,0.00767,,0.00752,"Jan  6, 2024 19:36:21.784592000 JST",,6000  >  42788 [ACK] Seq=1 Ack=28 Win=65152 Len=0 TSval=516411237 TSecr=321344746
24,10.335439,192.168.11.26,192.168.11.25,TCP,66,0.007897,,0.000377,"Jan  6, 2024 19:36:21.784969000 JST",,"6000  >  42788 [FIN, ACK] Seq=1 Ack=29 Win=65152 Len=0 TSval=516411238 TSecr=321344746"
25,10.335486,192.168.11.25,192.168.11.26,TCP,66,0.000047,,0.000047,"Jan  6, 2024 19:36:21.785016000 JST",,42788  >  6000 [ACK] Seq=29 Ack=2 Win=64256 Len=0 TSval=321344754 TSecr=516411238
26,10.364458,192.168.11.25,255.255.255.255,UDP,209,,Ÿ,0.028972,"Jan  6, 2024 19:36:21.813988000 JST",7b2273656d616e74696373223a207b22656e74697479223a2022504944222c202262617365656e74697479223a2022616e79222c2022726f6c65223a20226d6d6d222c20227370617469616c223a2022616e79222c202274656d706f72616c223a2022616e79227d2c20226461746170726f7065727479223a207b22666f726d6174223a2022696e616f6b615f70726f6772616d5f73616d706c655f73656d616e746963227d7d,38697  >  7000 Len=167
27,10.37013,192.168.11.4,192.168.11.25,TCP,74,,œ,0.005672,"Jan  6, 2024 19:36:21.819660000 JST",,54164  >  6000 [SYN] Seq=0 Win=64240 Len=0 MSS=1460 SACK_PERM TSval=2744813617 TSecr=0 WS=128
28,10.370265,192.168.11.25,192.168.11.4,TCP,74,0.000135,,0.000135,"Jan  6, 2024 19:36:21.819795000 JST",,"6000  >  54164 [SYN, ACK] Seq=0 Ack=1 Win=65160 Len=0 MSS=1460 SACK_PERM TSval=2627850840 TSecr=2744813617 WS=128"
29,10.37686,192.168.11.4,192.168.11.25,TCP,66,0.006595,,0.006595,"Jan  6, 2024 19:36:21.826390000 JST",,54164  >  6000 [ACK] Seq=1 Ack=1 Win=64256 Len=0 TSval=2744813623 TSecr=2627850840
30,10.377374,192.168.11.4,192.168.11.25,TCP,93,,,0.000514,"Jan  6, 2024 19:36:21.826904000 JST",,"54164  >  6000 [PSH, ACK] Seq=1 Ack=1 Win=64256 Len=27 TSval=2744813624 TSecr=2627850840 [TCP segment of a reassembled PDU]"
31,10.377441,192.168.11.25,192.168.11.4,TCP,66,0.000067,,0.000067,"Jan  6, 2024 19:36:21.826971000 JST",,6000  >  54164 [ACK] Seq=1 Ack=28 Win=65152 Len=0 TSval=2627850847 TSecr=2744813624
32,10.377505,192.168.11.4,192.168.11.25,TCP,66,,,0.000064,"Jan  6, 2024 19:36:21.827035000 JST",,"54164  >  6000 [FIN, ACK] Seq=28 Ack=1 Win=64256 Len=0 TSval=2744813624 TSecr=2627850840"
33,10.378516,192.168.11.25,192.168.11.4,TCP,66,0.001011,,0.001011,"Jan  6, 2024 19:36:21.828046000 JST",,"6000  >  54164 [FIN, ACK] Seq=1 Ack=29 Win=65152 Len=0 TSval=2627850848 TSecr=2744813624"
34,10.385065,192.168.11.4,192.168.11.25,TCP,66,0.006549,,0.006549,"Jan  6, 2024 19:36:21.834595000 JST",,54164  >  6000 [ACK] Seq=29 Ack=2 Win=64256 Len=0 TSval=2744813631 TSecr=2627850848
35,20.210616,192.168.11.25,192.168.11.26,TCP,74,,,9.825551,"Jan  6, 2024 19:36:31.660146000 JST",,46580  >  6000 [SYN] Seq=0 Win=64240 Len=0 MSS=1460 SACK_PERM TSval=321354629 TSecr=0 WS=128
36,20.218921,192.168.11.26,192.168.11.25,TCP,74,0.008305,,0.008305,"Jan  6, 2024 19:36:31.668451000 JST",,"6000  >  46580 [SYN, ACK] Seq=0 Ack=1 Win=65160 Len=0 MSS=1460 SACK_PERM TSval=516421120 TSecr=321354629 WS=128"
37,20.219019,192.168.11.25,192.168.11.26,TCP,66,0.000098,,0.000098,"Jan  6, 2024 19:36:31.668549000 JST",,46580  >  6000 [ACK] Seq=1 Ack=1 Win=64256 Len=0 TSval=321354638 TSecr=516421120
38,20.219152,192.168.11.25,192.168.11.26,TCP,93,,,0.000133,"Jan  6, 2024 19:36:31.668682000 JST",,"46580  >  6000 [PSH, ACK] Seq=1 Ack=1 Win=64256 Len=27 TSval=321354638 TSecr=516421120 [TCP segment of a reassembled PDU]"
39,20.219275,192.168.11.25,192.168.11.26,TCP,66,,,0.000123,"Jan  6, 2024 19:36:31.668805000 JST",,"46580  >  6000 [FIN, ACK] Seq=28 Ack=1 Win=64256 Len=0 TSval=321354638 TSecr=516421120"
40,20.227148,192.168.11.26,192.168.11.25,TCP,66,0.007996,,0.007873,"Jan  6, 2024 19:36:31.676678000 JST",,6000  >  46580 [ACK] Seq=1 Ack=28 Win=65152 Len=0 TSval=516421129 TSecr=321354638
41,20.227495,192.168.11.26,192.168.11.25,TCP,66,0.00822,,0.000347,"Jan  6, 2024 19:36:31.677025000 JST",,"6000  >  46580 [FIN, ACK] Seq=1 Ack=29 Win=65152 Len=0 TSval=516421130 TSecr=321354638"
42,20.22754,192.168.11.25,192.168.11.26,TCP,66,0.000045,,0.000045,"Jan  6, 2024 19:36:31.677070000 JST",,46580  >  6000 [ACK] Seq=29 Ack=2 Win=64256 Len=0 TSval=321354646 TSecr=516421130
43,20.255774,192.168.11.25,255.255.255.255,UDP,209,,Ÿ,0.028234,"Jan  6, 2024 19:36:31.705304000 JST",7b2273656d616e74696373223a207b22656e74697479223a2022504944222c202262617365656e74697479223a2022616e79222c2022726f6c65223a20226d6d6d222c20227370617469616c223a2022616e79222c202274656d706f72616c223a2022616e79227d2c20226461746170726f7065727479223a207b22666f726d6174223a2022696e616f6b615f70726f6772616d5f73616d706c655f73656d616e746963227d7d,44292  >  7000 Len=167
44,20.261421,192.168.11.4,192.168.11.25,TCP,74,,œ,0.005647,"Jan  6, 2024 19:36:31.710951000 JST",,34662  >  6000 [SYN] Seq=0 Win=64240 Len=0 MSS=1460 SACK_PERM TSval=2744823508 TSecr=0 WS=128
45,20.261543,192.168.11.25,192.168.11.4,TCP,74,0.000122,,0.000122,"Jan  6, 2024 19:36:31.711073000 JST",,"6000  >  34662 [SYN, ACK] Seq=0 Ack=1 Win=65160 Len=0 MSS=1460 SACK_PERM TSval=2627860731 TSecr=2744823508 WS=128"
46,20.268314,192.168.11.4,192.168.11.25,TCP,66,0.006771,,0.006771,"Jan  6, 2024 19:36:31.717844000 JST",,34662  >  6000 [ACK] Seq=1 Ack=1 Win=64256 Len=0 TSval=2744823515 TSecr=2627860731
47,20.268801,192.168.11.4,192.168.11.25,TCP,93,,,0.000487,"Jan  6, 2024 19:36:31.718331000 JST",,"34662  >  6000 [PSH, ACK] Seq=1 Ack=1 Win=64256 Len=27 TSval=2744823515 TSecr=2627860731 [TCP segment of a reassembled PDU]"
48,20.268871,192.168.11.25,192.168.11.4,TCP,66,0.00007,,0.00007,"Jan  6, 2024 19:36:31.718401000 JST",,6000  >  34662 [ACK] Seq=1 Ack=28 Win=65152 Len=0 TSval=2627860739 TSecr=2744823515
49,20.268934,192.168.11.4,192.168.11.25,TCP,66,,,0.000063,"Jan  6, 2024 19:36:31.718464000 JST",,"34662  >  6000 [FIN, ACK] Seq=28 Ack=1 Win=64256 Len=0 TSval=2744823515 TSecr=2627860731"
50,20.269787,192.168.11.25,192.168.11.4,TCP,66,0.000853,,0.000853,"Jan  6, 2024 19:36:31.719317000 JST",,"6000  >  34662 [FIN, ACK] Seq=1 Ack=29 Win=65152 Len=0 TSval=2627860740 TSecr=2744823515"
51,20.27613,192.168.11.4,192.168.11.25,TCP,66,0.006343,,0.006343,"Jan  6, 2024 19:36:31.725660000 JST",,34662  >  6000 [ACK] Seq=29 Ack=2 Win=64256 Len=0 TSval=2744823522 TSecr=2627860740
52,30.115007,192.168.11.25,192.168.11.26,TCP,74,,,9.838877,"Jan  6, 2024 19:36:41.564537000 JST",,33800  >  6000 [SYN] Seq=0 Win=64240 Len=0 MSS=1460 SACK_PERM TSval=321364534 TSecr=0 WS=128
53,30.123293,192.168.11.26,192.168.11.25,TCP,74,0.008286,,0.008286,"Jan  6, 2024 19:36:41.572823000 JST",,"6000  >  33800 [SYN, ACK] Seq=0 Ack=1 Win=65160 Len=0 MSS=1460 SACK_PERM TSval=516431024 TSecr=321364534 WS=128"
54,30.123384,192.168.11.25,192.168.11.26,TCP,66,0.000091,,0.000091,"Jan  6, 2024 19:36:41.572914000 JST",,33800  >  6000 [ACK] Seq=1 Ack=1 Win=64256 Len=0 TSval=321364542 TSecr=516431024
55,30.123544,192.168.11.25,192.168.11.26,TCP,93,,,0.00016,"Jan  6, 2024 19:36:41.573074000 JST",,"33800  >  6000 [PSH, ACK] Seq=1 Ack=1 Win=64256 Len=27 TSval=321364542 TSecr=516431024 [TCP segment of a reassembled PDU]"
56,30.123634,192.168.11.25,192.168.11.26,TCP,66,,,0.00009,"Jan  6, 2024 19:36:41.573164000 JST",,"33800  >  6000 [FIN, ACK] Seq=28 Ack=1 Win=64256 Len=0 TSval=321364542 TSecr=516431024"
57,30.131196,192.168.11.26,192.168.11.25,TCP,66,0.007652,,0.007562,"Jan  6, 2024 19:36:41.580726000 JST",,6000  >  33800 [ACK] Seq=1 Ack=28 Win=65152 Len=0 TSval=516431033 TSecr=321364542
58,30.131577,192.168.11.26,192.168.11.25,TCP,66,0.007943,,0.000381,"Jan  6, 2024 19:36:41.581107000 JST",,"6000  >  33800 [FIN, ACK] Seq=1 Ack=29 Win=65152 Len=0 TSval=516431034 TSecr=321364542"
59,30.131625,192.168.11.25,192.168.11.26,TCP,66,0.000048,,0.000048,"Jan  6, 2024 19:36:41.581155000 JST",,33800  >  6000 [ACK] Seq=29 Ack=2 Win=64256 Len=0 TSval=321364550 TSecr=516431034
60,30.163731,192.168.11.25,255.255.255.255,UDP,209,,Ÿ,0.032106,"Jan  6, 2024 19:36:41.613261000 JST",7b2273656d616e74696373223a207b22656e74697479223a2022504944222c202262617365656e74697479223a2022616e79222c2022726f6c65223a20226d6d6d222c20227370617469616c223a2022616e79222c202274656d706f72616c223a2022616e79227d2c20226461746170726f7065727479223a207b22666f726d6174223a2022696e616f6b615f70726f6772616d5f73616d706c655f73656d616e746963227d7d,46801  >  7000 Len=167
61,30.169341,192.168.11.4,192.168.11.25,TCP,74,,œ,0.00561,"Jan  6, 2024 19:36:41.618871000 JST",,55928  >  6000 [SYN] Seq=0 Win=64240 Len=0 MSS=1460 SACK_PERM TSval=2744833416 TSecr=0 WS=128
62,30.169462,192.168.11.25,192.168.11.4,TCP,74,0.000121,,0.000121,"Jan  6, 2024 19:36:41.618992000 JST",,"6000  >  55928 [SYN, ACK] Seq=0 Ack=1 Win=65160 Len=0 MSS=1460 SACK_PERM TSval=2627870639 TSecr=2744833416 WS=128"
63,30.177029,192.168.11.4,192.168.11.25,TCP,66,0.007567,,0.007567,"Jan  6, 2024 19:36:41.626559000 JST",,55928  >  6000 [ACK] Seq=1 Ack=1 Win=64256 Len=0 TSval=2744833424 TSecr=2627870639
64,30.177499,192.168.11.4,192.168.11.25,TCP,93,,,0.00047,"Jan  6, 2024 19:36:41.627029000 JST",,"55928  >  6000 [PSH, ACK] Seq=1 Ack=1 Win=64256 Len=27 TSval=2744833424 TSecr=2627870639 [TCP segment of a reassembled PDU]"
65,30.177562,192.168.11.25,192.168.11.4,TCP,66,0.000063,,0.000063,"Jan  6, 2024 19:36:41.627092000 JST",,6000  >  55928 [ACK] Seq=1 Ack=28 Win=65152 Len=0 TSval=2627870647 TSecr=2744833424
66,30.177725,192.168.11.4,192.168.11.25,TCP,66,,,0.000163,"Jan  6, 2024 19:36:41.627255000 JST",,"55928  >  6000 [FIN, ACK] Seq=28 Ack=1 Win=64256 Len=0 TSval=2744833424 TSecr=2627870639"
67,30.178346,192.168.11.25,192.168.11.4,TCP,66,0.000621,,0.000621,"Jan  6, 2024 19:36:41.627876000 JST",,"6000  >  55928 [FIN, ACK] Seq=1 Ack=29 Win=65152 Len=0 TSval=2627870648 TSecr=2744833424"
68,30.185091,192.168.11.4,192.168.11.25,TCP,66,0.006745,,0.006745,"Jan  6, 2024 19:36:41.634621000 JST",,55928  >  6000 [ACK] Seq=29 Ack=2 Win=64256 Len=0 TSval=2744833431 TSecr=2627870648
69,37.92664,192.168.11.25,192.168.11.26,TCP,74,,,7.741549,"Jan  6, 2024 19:36:49.376170000 JST",,60292  >  6000 [SYN] Seq=0 Win=64240 Len=0 MSS=1460 SACK_PERM TSval=321372345 TSecr=0 WS=128
70,37.935259,192.168.11.26,192.168.11.25,TCP,74,0.008619,,0.008619,"Jan  6, 2024 19:36:49.384789000 JST",,"6000  >  60292 [SYN, ACK] Seq=0 Ack=1 Win=65160 Len=0 MSS=1460 SACK_PERM TSval=516438836 TSecr=321372345 WS=128"
71,37.935367,192.168.11.25,192.168.11.26,TCP,66,0.000108,,0.000108,"Jan  6, 2024 19:36:49.384897000 JST",,60292  >  6000 [ACK] Seq=1 Ack=1 Win=64256 Len=0 TSval=321372354 TSecr=516438836
72,37.935513,192.168.11.25,192.168.11.26,TCP,93,,,0.000146,"Jan  6, 2024 19:36:49.385043000 JST",,"60292  >  6000 [PSH, ACK] Seq=1 Ack=1 Win=64256 Len=27 TSval=321372354 TSecr=516438836 [TCP segment of a reassembled PDU]"
73,37.935612,192.168.11.25,192.168.11.26,TCP,66,,,0.000099,"Jan  6, 2024 19:36:49.385142000 JST",,"60292  >  6000 [FIN, ACK] Seq=28 Ack=1 Win=64256 Len=0 TSval=321372354 TSecr=516438836"
74,37.944109,192.168.11.26,192.168.11.25,TCP,66,0.008596,,0.008497,"Jan  6, 2024 19:36:49.393639000 JST",,6000  >  60292 [ACK] Seq=1 Ack=28 Win=65152 Len=0 TSval=516438846 TSecr=321372354
75,37.94431,192.168.11.26,192.168.11.25,TCP,66,0.008698,,0.000201,"Jan  6, 2024 19:36:49.393840000 JST",,"6000  >  60292 [FIN, ACK] Seq=1 Ack=29 Win=65152 Len=0 TSval=516438847 TSecr=321372354"
76,37.944362,192.168.11.25,192.168.11.26,TCP,66,0.000052,,0.000052,"Jan  6, 2024 19:36:49.393892000 JST",,60292  >  6000 [ACK] Seq=29 Ack=2 Win=64256 Len=0 TSval=321372363 TSecr=516438847
77,37.976292,192.168.11.25,255.255.255.255,UDP,209,,Ÿ,0.03193,"Jan  6, 2024 19:36:49.425822000 JST",7b2273656d616e74696373223a207b22656e74697479223a2022504944222c202262617365656e74697479223a2022616e79222c2022726f6c65223a20226d6d6d222c20227370617469616c223a2022616e79222c202274656d706f72616c223a2022616e79227d2c20226461746170726f7065727479223a207b22666f726d6174223a2022696e616f6b615f70726f6772616d5f73616d706c655f73656d616e746963227d7d,39631  >  7000 Len=167
78,37.982026,192.168.11.4,192.168.11.25,TCP,74,,œ,0.005734,"Jan  6, 2024 19:36:49.431556000 JST",,56696  >  6000 [SYN] Seq=0 Win=64240 Len=0 MSS=1460 SACK_PERM TSval=2744841229 TSecr=0 WS=128
79,37.982177,192.168.11.25,192.168.11.4,TCP,74,0.000151,,0.000151,"Jan  6, 2024 19:36:49.431707000 JST",,"6000  >  56696 [SYN, ACK] Seq=0 Ack=1 Win=65160 Len=0 MSS=1460 SACK_PERM TSval=2627878452 TSecr=2744841229 WS=128"
80,37.98919,192.168.11.4,192.168.11.25,TCP,66,0.007013,,0.007013,"Jan  6, 2024 19:36:49.438720000 JST",,56696  >  6000 [ACK] Seq=1 Ack=1 Win=64256 Len=0 TSval=2744841236 TSecr=2627878452
81,37.989706,192.168.11.4,192.168.11.25,TCP,93,,,0.000516,"Jan  6, 2024 19:36:49.439236000 JST",,"56696  >  6000 [PSH, ACK] Seq=1 Ack=1 Win=64256 Len=27 TSval=2744841236 TSecr=2627878452 [TCP segment of a reassembled PDU]"
82,37.989778,192.168.11.25,192.168.11.4,TCP,66,0.000072,,0.000072,"Jan  6, 2024 19:36:49.439308000 JST",,6000  >  56696 [ACK] Seq=1 Ack=28 Win=65152 Len=0 TSval=2627878459 TSecr=2744841236
83,37.989844,192.168.11.4,192.168.11.25,TCP,66,,,0.000066,"Jan  6, 2024 19:36:49.439374000 JST",,"56696  >  6000 [FIN, ACK] Seq=28 Ack=1 Win=64256 Len=0 TSval=2744841236 TSecr=2627878452"
84,37.990715,192.168.11.25,192.168.11.4,TCP,66,0.000871,,0.000871,"Jan  6, 2024 19:36:49.440245000 JST",,"6000  >  56696 [FIN, ACK] Seq=1 Ack=29 Win=65152 Len=0 TSval=2627878460 TSecr=2744841236"
85,37.997506,192.168.11.4,192.168.11.25,TCP,66,0.006791,,0.006791,"Jan  6, 2024 19:36:49.447036000 JST",,56696  >  6000 [ACK] Seq=29 Ack=2 Win=64256 Len=0 TSval=2744841244 TSecr=2627878460
86,45.721461,192.168.11.25,192.168.11.26,TCP,74,,,7.723955,"Jan  6, 2024 19:36:57.170991000 JST",,60634  >  6000 [SYN] Seq=0 Win=64240 Len=0 MSS=1460 SACK_PERM TSval=321380140 TSecr=0 WS=128
87,45.732477,192.168.11.26,192.168.11.25,TCP,74,0.011016,,0.011016,"Jan  6, 2024 19:36:57.182007000 JST",,"6000  >  60634 [SYN, ACK] Seq=0 Ack=1 Win=65160 Len=0 MSS=1460 SACK_PERM TSval=516446631 TSecr=321380140 WS=128"
88,45.732574,192.168.11.25,192.168.11.26,TCP,66,0.000097,,0.000097,"Jan  6, 2024 19:36:57.182104000 JST",,60634  >  6000 [ACK] Seq=1 Ack=1 Win=64256 Len=0 TSval=321380151 TSecr=516446631
89,45.732704,192.168.11.25,192.168.11.26,TCP,93,,,0.00013,"Jan  6, 2024 19:36:57.182234000 JST",,"60634  >  6000 [PSH, ACK] Seq=1 Ack=1 Win=64256 Len=27 TSval=321380151 TSecr=516446631 [TCP segment of a reassembled PDU]"
90,45.732814,192.168.11.25,192.168.11.26,TCP,66,,,0.00011,"Jan  6, 2024 19:36:57.182344000 JST",,"60634  >  6000 [FIN, ACK] Seq=28 Ack=1 Win=64256 Len=0 TSval=321380152 TSecr=516446631"
91,45.742392,192.168.11.26,192.168.11.25,TCP,66,0.009688,,0.009578,"Jan  6, 2024 19:36:57.191922000 JST",,6000  >  60634 [ACK] Seq=1 Ack=28 Win=65152 Len=0 TSval=516446644 TSecr=321380151
92,45.74263,192.168.11.26,192.168.11.25,TCP,66,0.009816,,0.000238,"Jan  6, 2024 19:36:57.192160000 JST",,"6000  >  60634 [FIN, ACK] Seq=1 Ack=29 Win=65152 Len=0 TSval=516446646 TSecr=321380152"
93,45.74268,192.168.11.25,192.168.11.26,TCP,66,0.00005,,0.00005,"Jan  6, 2024 19:36:57.192210000 JST",,60634  >  6000 [ACK] Seq=29 Ack=2 Win=64256 Len=0 TSval=321380161 TSecr=516446646
94,45.775174,192.168.11.25,255.255.255.255,UDP,209,,Ÿ,0.032494,"Jan  6, 2024 19:36:57.224704000 JST",7b2273656d616e74696373223a207b22656e74697479223a2022504944222c202262617365656e74697479223a2022616e79222c2022726f6c65223a20226d6d6d222c20227370617469616c223a2022616e79222c202274656d706f72616c223a2022616e79227d2c20226461746170726f7065727479223a207b22666f726d6174223a2022696e616f6b615f70726f6772616d5f73616d706c655f73656d616e746963227d7d,42776  >  7000 Len=167
95,45.780976,192.168.11.4,192.168.11.25,TCP,74,,œ,0.005802,"Jan  6, 2024 19:36:57.230506000 JST",,56430  >  6000 [SYN] Seq=0 Win=64240 Len=0 MSS=1460 SACK_PERM TSval=2744849027 TSecr=0 WS=128
96,45.781072,192.168.11.25,192.168.11.4,TCP,74,0.000096,,0.000096,"Jan  6, 2024 19:36:57.230602000 JST",,"6000  >  56430 [SYN, ACK] Seq=0 Ack=1 Win=65160 Len=0 MSS=1460 SACK_PERM TSval=2627886251 TSecr=2744849027 WS=128"
97,45.787549,192.168.11.4,192.168.11.25,TCP,66,0.006477,,0.006477,"Jan  6, 2024 19:36:57.237079000 JST",,56430  >  6000 [ACK] Seq=1 Ack=1 Win=64256 Len=0 TSval=2744849034 TSecr=2627886251
98,45.787965,192.168.11.4,192.168.11.25,TCP,93,,,0.000416,"Jan  6, 2024 19:36:57.237495000 JST",,"56430  >  6000 [PSH, ACK] Seq=1 Ack=1 Win=64256 Len=27 TSval=2744849034 TSecr=2627886251 [TCP segment of a reassembled PDU]"
99,45.788035,192.168.11.25,192.168.11.4,TCP,66,0.00007,,0.00007,"Jan  6, 2024 19:36:57.237565000 JST",,6000  >  56430 [ACK] Seq=1 Ack=28 Win=65152 Len=0 TSval=2627886258 TSecr=2744849034
100,45.788114,192.168.11.4,192.168.11.25,TCP,66,,,0.000079,"Jan  6, 2024 19:36:57.237644000 JST",,"56430  >  6000 [FIN, ACK] Seq=28 Ack=1 Win=64256 Len=0 TSval=2744849035 TSecr=2627886251"
101,45.788742,192.168.11.25,192.168.11.4,TCP,66,0.000628,,0.000628,"Jan  6, 2024 19:36:57.238272000 JST",,"6000  >  56430 [FIN, ACK] Seq=1 Ack=29 Win=65152 Len=0 TSval=2627886258 TSecr=2744849035"
102,45.795268,192.168.11.4,192.168.11.25,TCP,66,0.006526,,0.006526,"Jan  6, 2024 19:36:57.244798000 JST",,56430  >  6000 [ACK] Seq=29 Ack=2 Win=64256 Len=0 TSval=2744849042 TSecr=2627886258
103,53.586524,192.168.11.25,192.168.11.26,TCP,74,,,7.791256,"Jan  6, 2024 19:37:05.036054000 JST",,33192  >  6000 [SYN] Seq=0 Win=64240 Len=0 MSS=1460 SACK_PERM TSval=321388005 TSecr=0 WS=128
104,53.595825,192.168.11.26,192.168.11.25,TCP,74,0.009301,,0.009301,"Jan  6, 2024 19:37:05.045355000 JST",,"6000  >  33192 [SYN, ACK] Seq=0 Ack=1 Win=65160 Len=0 MSS=1460 SACK_PERM TSval=516454497 TSecr=321388005 WS=128"
105,53.59592,192.168.11.25,192.168.11.26,TCP,66,0.000095,,0.000095,"Jan  6, 2024 19:37:05.045450000 JST",,33192  >  6000 [ACK] Seq=1 Ack=1 Win=64256 Len=0 TSval=321388015 TSecr=516454497
106,53.596048,192.168.11.25,192.168.11.26,TCP,93,,,0.000128,"Jan  6, 2024 19:37:05.045578000 JST",,"33192  >  6000 [PSH, ACK] Seq=1 Ack=1 Win=64256 Len=27 TSval=321388015 TSecr=516454497 [TCP segment of a reassembled PDU]"
107,53.596159,192.168.11.25,192.168.11.26,TCP,66,,,0.000111,"Jan  6, 2024 19:37:05.045689000 JST",,"33192  >  6000 [FIN, ACK] Seq=28 Ack=1 Win=64256 Len=0 TSval=321388015 TSecr=516454497"
108,53.605381,192.168.11.26,192.168.11.25,TCP,66,0.009333,,0.009222,"Jan  6, 2024 19:37:05.054911000 JST",,6000  >  33192 [ACK] Seq=1 Ack=28 Win=65152 Len=0 TSval=516454506 TSecr=321388015
109,53.605583,192.168.11.26,192.168.11.25,TCP,66,0.009424,,0.000202,"Jan  6, 2024 19:37:05.055113000 JST",,"6000  >  33192 [FIN, ACK] Seq=1 Ack=29 Win=65152 Len=0 TSval=516454508 TSecr=321388015"
110,53.605626,192.168.11.25,192.168.11.26,TCP,66,0.000043,,0.000043,"Jan  6, 2024 19:37:05.055156000 JST",,33192  >  6000 [ACK] Seq=29 Ack=2 Win=64256 Len=0 TSval=321388024 TSecr=516454508
111,53.637289,192.168.11.25,255.255.255.255,UDP,209,,Ÿ,0.031663,"Jan  6, 2024 19:37:05.086819000 JST",7b2273656d616e74696373223a207b22656e74697479223a2022504944222c202262617365656e74697479223a2022616e79222c2022726f6c65223a20226d6d6d222c20227370617469616c223a2022616e79222c202274656d706f72616c223a2022616e79227d2c20226461746170726f7065727479223a207b22666f726d6174223a2022696e616f6b615f70726f6772616d5f73616d706c655f73656d616e746963227d7d,47579  >  7000 Len=167
112,53.64406,192.168.11.4,192.168.11.25,TCP,74,,œ,0.006771,"Jan  6, 2024 19:37:05.093590000 JST",,46380  >  6000 [SYN] Seq=0 Win=64240 Len=0 MSS=1460 SACK_PERM TSval=2744856890 TSecr=0 WS=128
113,53.644181,192.168.11.25,192.168.11.4,TCP,74,0.000121,,0.000121,"Jan  6, 2024 19:37:05.093711000 JST",,"6000  >  46380 [SYN, ACK] Seq=0 Ack=1 Win=65160 Len=0 MSS=1460 SACK_PERM TSval=2627894114 TSecr=2744856890 WS=128"
114,53.651401,192.168.11.4,192.168.11.25,TCP,66,0.00722,,0.00722,"Jan  6, 2024 19:37:05.100931000 JST",,46380  >  6000 [ACK] Seq=1 Ack=1 Win=64256 Len=0 TSval=2744856898 TSecr=2627894114
115,53.651996,192.168.11.4,192.168.11.25,TCP,93,,,0.000595,"Jan  6, 2024 19:37:05.101526000 JST",,"46380  >  6000 [PSH, ACK] Seq=1 Ack=1 Win=64256 Len=27 TSval=2744856898 TSecr=2627894114 [TCP segment of a reassembled PDU]"
116,53.652089,192.168.11.25,192.168.11.4,TCP,66,0.000093,,0.000093,"Jan  6, 2024 19:37:05.101619000 JST",,6000  >  46380 [ACK] Seq=1 Ack=28 Win=65152 Len=0 TSval=2627894122 TSecr=2744856898
117,53.652184,192.168.11.4,192.168.11.25,TCP,66,,,0.000095,"Jan  6, 2024 19:37:05.101714000 JST",,"46380  >  6000 [FIN, ACK] Seq=28 Ack=1 Win=64256 Len=0 TSval=2744856898 TSecr=2627894114"
118,53.653338,192.168.11.25,192.168.11.4,TCP,66,0.001154,,0.001154,"Jan  6, 2024 19:37:05.102868000 JST",,"6000  >  46380 [FIN, ACK] Seq=1 Ack=29 Win=65152 Len=0 TSval=2627894123 TSecr=2744856898"
119,53.659564,192.168.11.4,192.168.11.25,TCP,66,0.006226,,0.006226,"Jan  6, 2024 19:37:05.109094000 JST",,46380  >  6000 [ACK] Seq=29 Ack=2 Win=64256 Len=0 TSval=2744856906 TSecr=2627894123
120,61.890469,192.168.11.25,192.168.11.26,TCP,74,,,8.230905,"Jan  6, 2024 19:37:13.339999000 JST",,55948  >  6000 [SYN] Seq=0 Win=64240 Len=0 MSS=1460 SACK_PERM TSval=321396309 TSecr=0 WS=128
121,61.899104,192.168.11.26,192.168.11.25,TCP,74,0.008635,,0.008635,"Jan  6, 2024 19:37:13.348634000 JST",,"6000  >  55948 [SYN, ACK] Seq=0 Ack=1 Win=65160 Len=0 MSS=1460 SACK_PERM TSval=516462800 TSecr=321396309 WS=128"
122,61.899199,192.168.11.25,192.168.11.26,TCP,66,0.000095,,0.000095,"Jan  6, 2024 19:37:13.348729000 JST",,55948  >  6000 [ACK] Seq=1 Ack=1 Win=64256 Len=0 TSval=321396318 TSecr=516462800
123,61.899369,192.168.11.25,192.168.11.26,TCP,93,,,0.00017,"Jan  6, 2024 19:37:13.348899000 JST",,"55948  >  6000 [PSH, ACK] Seq=1 Ack=1 Win=64256 Len=27 TSval=321396318 TSecr=516462800 [TCP segment of a reassembled PDU]"
124,61.899462,192.168.11.25,192.168.11.26,TCP,66,,,0.000093,"Jan  6, 2024 19:37:13.348992000 JST",,"55948  >  6000 [FIN, ACK] Seq=28 Ack=1 Win=64256 Len=0 TSval=321396318 TSecr=516462800"
125,61.909269,192.168.11.26,192.168.11.25,TCP,66,0.0099,,0.009807,"Jan  6, 2024 19:37:13.358799000 JST",,6000  >  55948 [ACK] Seq=1 Ack=28 Win=65152 Len=0 TSval=516462810 TSecr=321396318
126,61.909474,192.168.11.26,192.168.11.25,TCP,66,0.010012,,0.000205,"Jan  6, 2024 19:37:13.359004000 JST",,"6000  >  55948 [FIN, ACK] Seq=1 Ack=29 Win=65152 Len=0 TSval=516462812 TSecr=321396318"
127,61.909516,192.168.11.25,192.168.11.26,TCP,66,0.000042,,0.000042,"Jan  6, 2024 19:37:13.359046000 JST",,55948  >  6000 [ACK] Seq=29 Ack=2 Win=64256 Len=0 TSval=321396328 TSecr=516462812
128,61.941216,192.168.11.25,255.255.255.255,UDP,209,,Ÿ,0.0317,"Jan  6, 2024 19:37:13.390746000 JST",7b2273656d616e74696373223a207b22656e74697479223a2022504944222c202262617365656e74697479223a2022616e79222c2022726f6c65223a20226d6d6d222c20227370617469616c223a2022616e79222c202274656d706f72616c223a2022616e79227d2c20226461746170726f7065727479223a207b22666f726d6174223a2022696e616f6b615f70726f6772616d5f73616d706c655f73656d616e746963227d7d,53616  >  7000 Len=167
129,61.950936,192.168.11.4,192.168.11.25,TCP,74,,œ,0.00972,"Jan  6, 2024 19:37:13.400466000 JST",,33378  >  6000 [SYN] Seq=0 Win=64240 Len=0 MSS=1460 SACK_PERM TSval=2744865193 TSecr=0 WS=128
130,61.951061,192.168.11.25,192.168.11.4,TCP,74,0.000125,,0.000125,"Jan  6, 2024 19:37:13.400591000 JST",,"6000  >  33378 [SYN, ACK] Seq=0 Ack=1 Win=65160 Len=0 MSS=1460 SACK_PERM TSval=2627902421 TSecr=2744865193 WS=128"
131,61.959095,192.168.11.4,192.168.11.25,TCP,66,0.008034,,0.008034,"Jan  6, 2024 19:37:13.408625000 JST",,33378  >  6000 [ACK] Seq=1 Ack=1 Win=64256 Len=0 TSval=2744865205 TSecr=2627902421
132,61.959589,192.168.11.4,192.168.11.25,TCP,93,,,0.000494,"Jan  6, 2024 19:37:13.409119000 JST",,"33378  >  6000 [PSH, ACK] Seq=1 Ack=1 Win=64256 Len=27 TSval=2744865205 TSecr=2627902421 [TCP segment of a reassembled PDU]"
133,61.959665,192.168.11.25,192.168.11.4,TCP,66,0.000076,,0.000076,"Jan  6, 2024 19:37:13.409195000 JST",,6000  >  33378 [ACK] Seq=1 Ack=28 Win=65152 Len=0 TSval=2627902429 TSecr=2744865205
134,61.959741,192.168.11.4,192.168.11.25,TCP,66,,,0.000076,"Jan  6, 2024 19:37:13.409271000 JST",,"33378  >  6000 [FIN, ACK] Seq=28 Ack=1 Win=64256 Len=0 TSval=2744865205 TSecr=2627902421"
135,61.960734,192.168.11.25,192.168.11.4,TCP,66,0.000993,,0.000993,"Jan  6, 2024 19:37:13.410264000 JST",,"6000  >  33378 [FIN, ACK] Seq=1 Ack=29 Win=65152 Len=0 TSval=2627902430 TSecr=2744865205"
136,61.967063,192.168.11.4,192.168.11.25,TCP,66,0.006329,,0.006329,"Jan  6, 2024 19:37:13.416593000 JST",,33378  >  6000 [ACK] Seq=29 Ack=2 Win=64256 Len=0 TSval=2744865213 TSecr=2627902430
137,72.823288,192.168.11.25,192.168.11.26,TCP,74,,,10.856225,"Jan  6, 2024 19:37:24.272818000 JST",,56520  >  6000 [SYN] Seq=0 Win=64240 Len=0 MSS=1460 SACK_PERM TSval=321407242 TSecr=0 WS=128
138,72.832765,192.168.11.26,192.168.11.25,TCP,74,0.009477,,0.009477,"Jan  6, 2024 19:37:24.282295000 JST",,"6000  >  56520 [SYN, ACK] Seq=0 Ack=1 Win=65160 Len=0 MSS=1460 SACK_PERM TSval=516473733 TSecr=321407242 WS=128"
139,72.832868,192.168.11.25,192.168.11.26,TCP,66,0.000103,,0.000103,"Jan  6, 2024 19:37:24.282398000 JST",,56520  >  6000 [ACK] Seq=1 Ack=1 Win=64256 Len=0 TSval=321407252 TSecr=516473733
140,72.833105,192.168.11.25,192.168.11.26,TCP,93,,,0.000237,"Jan  6, 2024 19:37:24.282635000 JST",,"56520  >  6000 [PSH, ACK] Seq=1 Ack=1 Win=64256 Len=27 TSval=321407252 TSecr=516473733 [TCP segment of a reassembled PDU]"
141,72.833194,192.168.11.25,192.168.11.26,TCP,66,,,0.000089,"Jan  6, 2024 19:37:24.282724000 JST",,"56520  >  6000 [FIN, ACK] Seq=28 Ack=1 Win=64256 Len=0 TSval=321407252 TSecr=516473733"
142,72.846331,192.168.11.26,192.168.11.25,TCP,66,0.013226,,0.013137,"Jan  6, 2024 19:37:24.295861000 JST",,6000  >  56520 [ACK] Seq=1 Ack=28 Win=65152 Len=0 TSval=516473744 TSecr=321407252
143,72.846654,192.168.11.26,192.168.11.25,TCP,66,0.01346,,0.000323,"Jan  6, 2024 19:37:24.296184000 JST",,"6000  >  56520 [FIN, ACK] Seq=1 Ack=29 Win=65152 Len=0 TSval=516473746 TSecr=321407252"
144,72.846705,192.168.11.25,192.168.11.26,TCP,66,0.000051,,0.000051,"Jan  6, 2024 19:37:24.296235000 JST",,56520  >  6000 [ACK] Seq=29 Ack=2 Win=64256 Len=0 TSval=321407265 TSecr=516473746
145,72.876161,192.168.11.25,255.255.255.255,UDP,209,,Ÿ,0.029456,"Jan  6, 2024 19:37:24.325691000 JST",7b2273656d616e74696373223a207b22656e74697479223a2022504944222c202262617365656e74697479223a2022616e79222c2022726f6c65223a20226d6d6d222c20227370617469616c223a2022616e79222c202274656d706f72616c223a2022616e79227d2c20226461746170726f7065727479223a207b22666f726d6174223a2022696e616f6b615f70726f6772616d5f73616d706c655f73656d616e746963227d7d,55757  >  7000 Len=167
146,72.881767,192.168.11.4,192.168.11.25,TCP,74,,œ,0.005606,"Jan  6, 2024 19:37:24.331297000 JST",,34530  >  6000 [SYN] Seq=0 Win=64240 Len=0 MSS=1460 SACK_PERM TSval=2744876128 TSecr=0 WS=128
147,72.881861,192.168.11.25,192.168.11.4,TCP,74,0.000094,,0.000094,"Jan  6, 2024 19:37:24.331391000 JST",,"6000  >  34530 [SYN, ACK] Seq=0 Ack=1 Win=65160 Len=0 MSS=1460 SACK_PERM TSval=2627913352 TSecr=2744876128 WS=128"
148,72.888447,192.168.11.4,192.168.11.25,TCP,66,0.006586,,0.006586,"Jan  6, 2024 19:37:24.337977000 JST",,34530  >  6000 [ACK] Seq=1 Ack=1 Win=64256 Len=0 TSval=2744876135 TSecr=2627913352
149,72.888884,192.168.11.4,192.168.11.25,TCP,93,,,0.000437,"Jan  6, 2024 19:37:24.338414000 JST",,"34530  >  6000 [PSH, ACK] Seq=1 Ack=1 Win=64256 Len=27 TSval=2744876135 TSecr=2627913352 [TCP segment of a reassembled PDU]"
150,72.888922,192.168.11.4,192.168.11.25,TCP,66,,,0.000038,"Jan  6, 2024 19:37:24.338452000 JST",,"34530  >  6000 [FIN, ACK] Seq=28 Ack=1 Win=64256 Len=0 TSval=2744876135 TSecr=2627913352"
151,72.888964,192.168.11.25,192.168.11.4,TCP,66,0.00008,,0.000042,"Jan  6, 2024 19:37:24.338494000 JST",,6000  >  34530 [ACK] Seq=1 Ack=28 Win=65152 Len=0 TSval=2627913359 TSecr=2744876135
152,72.889864,192.168.11.25,192.168.11.4,TCP,66,0.000942,,0.0009,"Jan  6, 2024 19:37:24.339394000 JST",,"6000  >  34530 [FIN, ACK] Seq=1 Ack=29 Win=65152 Len=0 TSval=2627913360 TSecr=2744876135"
153,72.896113,192.168.11.4,192.168.11.25,TCP,66,0.006249,,0.006249,"Jan  6, 2024 19:37:24.345643000 JST",,34530  >  6000 [ACK] Seq=29 Ack=2 Win=64256 Len=0 TSval=2744876142 TSecr=2627913360
154,82.708173,192.168.11.25,192.168.11.26,TCP,74,,,9.81206,"Jan  6, 2024 19:37:34.157703000 JST",,34150  >  6000 [SYN] Seq=0 Win=64240 Len=0 MSS=1460 SACK_PERM TSval=321417127 TSecr=0 WS=128
155,82.719147,192.168.11.26,192.168.11.25,TCP,74,0.010974,,0.010974,"Jan  6, 2024 19:37:34.168677000 JST",,"6000  >  34150 [SYN, ACK] Seq=0 Ack=1 Win=65160 Len=0 MSS=1460 SACK_PERM TSval=516483620 TSecr=321417127 WS=128"
156,82.719257,192.168.11.25,192.168.11.26,TCP,66,0.00011,,0.00011,"Jan  6, 2024 19:37:34.168787000 JST",,34150  >  6000 [ACK] Seq=1 Ack=1 Win=64256 Len=0 TSval=321417138 TSecr=516483620
157,82.719429,192.168.11.25,192.168.11.26,TCP,93,,,0.000172,"Jan  6, 2024 19:37:34.168959000 JST",,"34150  >  6000 [PSH, ACK] Seq=1 Ack=1 Win=64256 Len=27 TSval=321417138 TSecr=516483620 [TCP segment of a reassembled PDU]"
158,82.71952,192.168.11.25,192.168.11.26,TCP,66,,,0.000091,"Jan  6, 2024 19:37:34.169050000 JST",,"34150  >  6000 [FIN, ACK] Seq=28 Ack=1 Win=64256 Len=0 TSval=321417138 TSecr=516483620"
159,82.729367,192.168.11.26,192.168.11.25,TCP,66,0.009938,,0.009847,"Jan  6, 2024 19:37:34.178897000 JST",,6000  >  34150 [ACK] Seq=1 Ack=28 Win=65152 Len=0 TSval=516483631 TSecr=321417138
160,82.72957,192.168.11.26,192.168.11.25,TCP,66,0.01005,,0.000203,"Jan  6, 2024 19:37:34.179100000 JST",,"6000  >  34150 [FIN, ACK] Seq=1 Ack=29 Win=65152 Len=0 TSval=516483633 TSecr=321417138"
161,82.729623,192.168.11.25,192.168.11.26,TCP,66,0.000053,,0.000053,"Jan  6, 2024 19:37:34.179153000 JST",,34150  >  6000 [ACK] Seq=29 Ack=2 Win=64256 Len=0 TSval=321417148 TSecr=516483633
162,82.75976,192.168.11.25,255.255.255.255,UDP,209,,Ÿ,0.030137,"Jan  6, 2024 19:37:34.209290000 JST",7b2273656d616e74696373223a207b22656e74697479223a2022504944222c202262617365656e74697479223a2022616e79222c2022726f6c65223a20226d6d6d222c20227370617469616c223a2022616e79222c202274656d706f72616c223a2022616e79227d2c20226461746170726f7065727479223a207b22666f726d6174223a2022696e616f6b615f70726f6772616d5f73616d706c655f73656d616e746963227d7d,42664  >  7000 Len=167
163,82.766545,192.168.11.4,192.168.11.25,TCP,74,,œ,0.006785,"Jan  6, 2024 19:37:34.216075000 JST",,35994  >  6000 [SYN] Seq=0 Win=64240 Len=0 MSS=1460 SACK_PERM TSval=2744886012 TSecr=0 WS=128
164,82.766689,192.168.11.25,192.168.11.4,TCP,74,0.000144,,0.000144,"Jan  6, 2024 19:37:34.216219000 JST",,"6000  >  35994 [SYN, ACK] Seq=0 Ack=1 Win=65160 Len=0 MSS=1460 SACK_PERM TSval=2627923236 TSecr=2744886012 WS=128"
165,82.773268,192.168.11.4,192.168.11.25,TCP,66,0.006579,,0.006579,"Jan  6, 2024 19:37:34.222798000 JST",,35994  >  6000 [ACK] Seq=1 Ack=1 Win=64256 Len=0 TSval=2744886020 TSecr=2627923236
166,82.773803,192.168.11.4,192.168.11.25,TCP,93,,,0.000535,"Jan  6, 2024 19:37:34.223333000 JST",,"35994  >  6000 [PSH, ACK] Seq=1 Ack=1 Win=64256 Len=27 TSval=2744886020 TSecr=2627923236 [TCP segment of a reassembled PDU]"
167,82.773891,192.168.11.25,192.168.11.4,TCP,66,0.000088,,0.000088,"Jan  6, 2024 19:37:34.223421000 JST",,6000  >  35994 [ACK] Seq=1 Ack=28 Win=65152 Len=0 TSval=2627923244 TSecr=2744886020
168,82.773959,192.168.11.4,192.168.11.25,TCP,66,,,0.000068,"Jan  6, 2024 19:37:34.223489000 JST",,"35994  >  6000 [FIN, ACK] Seq=28 Ack=1 Win=64256 Len=0 TSval=2744886020 TSecr=2627923236"
169,82.774849,192.168.11.25,192.168.11.4,TCP,66,0.00089,,0.00089,"Jan  6, 2024 19:37:34.224379000 JST",,"6000  >  35994 [FIN, ACK] Seq=1 Ack=29 Win=65152 Len=0 TSval=2627923245 TSecr=2744886020"
170,82.790053,192.168.11.4,192.168.11.25,TCP,66,0.015204,,0.015204,"Jan  6, 2024 19:37:34.239583000 JST",,35994  >  6000 [ACK] Seq=29 Ack=2 Win=64256 Len=0 TSval=2744886027 TSecr=2627923245
171,114.883862,192.168.11.25,192.168.11.26,TCP,74,,,32.093809,"Jan  6, 2024 19:38:06.333392000 JST",,47136  >  6000 [SYN] Seq=0 Win=64240 Len=0 MSS=1460 SACK_PERM TSval=321449303 TSecr=0 WS=128
172,114.893049,192.168.11.26,192.168.11.25,TCP,74,0.009187,,0.009187,"Jan  6, 2024 19:38:06.342579000 JST",,"6000  >  47136 [SYN, ACK] Seq=0 Ack=1 Win=65160 Len=0 MSS=1460 SACK_PERM TSval=516515793 TSecr=321449303 WS=128"
173,114.893153,192.168.11.25,192.168.11.26,TCP,66,0.000104,,0.000104,"Jan  6, 2024 19:38:06.342683000 JST",,47136  >  6000 [ACK] Seq=1 Ack=1 Win=64256 Len=0 TSval=321449312 TSecr=516515793
174,114.893321,192.168.11.25,192.168.11.26,TCP,93,,,0.000168,"Jan  6, 2024 19:38:06.342851000 JST",,"47136  >  6000 [PSH, ACK] Seq=1 Ack=1 Win=64256 Len=27 TSval=321449312 TSecr=516515793 [TCP segment of a reassembled PDU]"
175,114.893438,192.168.11.25,192.168.11.26,TCP,66,,,0.000117,"Jan  6, 2024 19:38:06.342968000 JST",,"47136  >  6000 [FIN, ACK] Seq=28 Ack=1 Win=64256 Len=0 TSval=321449312 TSecr=516515793"
176,114.909757,192.168.11.26,192.168.11.25,TCP,66,0.016436,,0.016319,"Jan  6, 2024 19:38:06.359287000 JST",,6000  >  47136 [ACK] Seq=1 Ack=28 Win=65152 Len=0 TSval=516515811 TSecr=321449312
177,114.910128,192.168.11.26,192.168.11.25,TCP,66,0.01669,,0.000371,"Jan  6, 2024 19:38:06.359658000 JST",,"6000  >  47136 [FIN, ACK] Seq=1 Ack=29 Win=65152 Len=0 TSval=516515812 TSecr=321449312"
178,114.910172,192.168.11.25,192.168.11.26,TCP,66,0.000044,,0.000044,"Jan  6, 2024 19:38:06.359702000 JST",,47136  >  6000 [ACK] Seq=29 Ack=2 Win=64256 Len=0 TSval=321449329 TSecr=516515812
179,114.939945,192.168.11.25,255.255.255.255,UDP,209,,Ÿ,0.029773,"Jan  6, 2024 19:38:06.389475000 JST",7b2273656d616e74696373223a207b22656e74697479223a2022504944222c202262617365656e74697479223a2022616e79222c2022726f6c65223a20226d6d6d222c20227370617469616c223a2022616e79222c202274656d706f72616c223a2022616e79227d2c20226461746170726f7065727479223a207b22666f726d6174223a2022696e616f6b615f70726f6772616d5f73616d706c655f73656d616e746963227d7d,36326  >  7000 Len=167
180,114.94555,192.168.11.4,192.168.11.25,TCP,74,,œ,0.005605,"Jan  6, 2024 19:38:06.395080000 JST",,47582  >  6000 [SYN] Seq=0 Win=64240 Len=0 MSS=1460 SACK_PERM TSval=2744918192 TSecr=0 WS=128
181,114.94568,192.168.11.25,192.168.11.4,TCP,74,0.00013,,0.00013,"Jan  6, 2024 19:38:06.395210000 JST",,"6000  >  47582 [SYN, ACK] Seq=0 Ack=1 Win=65160 Len=0 MSS=1460 SACK_PERM TSval=2627955415 TSecr=2744918192 WS=128"
182,114.961567,192.168.11.4,192.168.11.25,TCP,66,0.015887,,0.015887,"Jan  6, 2024 19:38:06.411097000 JST",,47582  >  6000 [ACK] Seq=1 Ack=1 Win=64256 Len=0 TSval=2744918201 TSecr=2627955415
183,114.961967,192.168.11.4,192.168.11.25,TCP,93,,,0.0004,"Jan  6, 2024 19:38:06.411497000 JST",,"47582  >  6000 [PSH, ACK] Seq=1 Ack=1 Win=64256 Len=27 TSval=2744918202 TSecr=2627955415 [TCP segment of a reassembled PDU]"
184,114.962019,192.168.11.25,192.168.11.4,TCP,66,0.000052,,0.000052,"Jan  6, 2024 19:38:06.411549000 JST",,6000  >  47582 [ACK] Seq=1 Ack=28 Win=65152 Len=0 TSval=2627955432 TSecr=2744918202
185,114.96207,192.168.11.4,192.168.11.25,TCP,66,,,0.000051,"Jan  6, 2024 19:38:06.411600000 JST",,"47582  >  6000 [FIN, ACK] Seq=28 Ack=1 Win=64256 Len=0 TSval=2744918202 TSecr=2627955415"
186,114.96288,192.168.11.25,192.168.11.4,TCP,66,0.00081,,0.00081,"Jan  6, 2024 19:38:06.412410000 JST",,"6000  >  47582 [FIN, ACK] Seq=1 Ack=29 Win=65152 Len=0 TSval=2627955433 TSecr=2744918202"
