No.,Time,Source,Destination,Protocol,Length,The RTT to ACK the segment was,XXX,Time delta from previous captured frame,Arrival Time,Data,Info
1,0,192.168.11.4,192.168.11.25,TCP,74,,,0,"Jan  6, 2024 19:36:11.509251000 JST",,43762  >  6000 [SYN] Seq=0 Win=64240 Len=0 MSS=1460 SACK_PERM TSval=2744803300 TSecr=0 WS=128
2,0.006639,192.168.11.25,192.168.11.4,TCP,74,0.006639,,0.006639,"Jan  6, 2024 19:36:11.515890000 JST",,"6000  >  43762 [SYN, ACK] Seq=0 Ack=1 Win=65160 Len=0 MSS=1460 SACK_PERM TSval=2627840525 TSecr=2744803300 WS=128"
3,0.006763,192.168.11.4,192.168.11.25,TCP,66,0.000124,,0.000124,"Jan  6, 2024 19:36:11.516014000 JST",,43762  >  6000 [ACK] Seq=1 Ack=1 Win=64256 Len=0 TSval=2744803309 TSecr=2627840525
4,0.007073,192.168.11.4,192.168.11.25,TCP,93,,,0.00031,"Jan  6, 2024 19:36:11.516324000 JST",,"43762  >  6000 [PSH, ACK] Seq=1 Ack=1 Win=64256 Len=27 TSval=2744803309 TSecr=2627840525 [TCP segment of a reassembled PDU]"
5,0.007223,192.168.11.4,192.168.11.25,TCP,66,,,0.00015,"Jan  6, 2024 19:36:11.516474000 JST",,"43762  >  6000 [FIN, ACK] Seq=28 Ack=1 Win=64256 Len=0 TSval=2744803309 TSecr=2627840525"
6,0.01447,192.168.11.25,192.168.11.4,TCP,66,0.007397,,0.007247,"Jan  6, 2024 19:36:11.523721000 JST",,6000  >  43762 [ACK] Seq=1 Ack=28 Win=65152 Len=0 TSval=2627840533 TSecr=2744803309
7,0.014856,192.168.11.25,192.168.11.4,TCP,66,0.007633,,0.000386,"Jan  6, 2024 19:36:11.524107000 JST",,"6000  >  43762 [FIN, ACK] Seq=1 Ack=29 Win=65152 Len=0 TSval=2627840534 TSecr=2744803309"
8,0.014914,192.168.11.4,192.168.11.25,TCP,66,0.000058,,0.000058,"Jan  6, 2024 19:36:11.524165000 JST",,43762  >  6000 [ACK] Seq=29 Ack=2 Win=64256 Len=0 TSval=2744803317 TSecr=2627840534
9,0.045034,192.168.11.4,255.255.255.255,UDP,209,,Ÿ,0.03012,"Jan  6, 2024 19:36:11.554285000 JST",7b2273656d616e74696373223a207b22656e74697479223a2022504944222c202262617365656e74697479223a2022616e79222c2022726f6c65223a20226e6e6e222c20227370617469616c223a2022616e79222c202274656d706f72616c223a2022616e79227d2c20226461746170726f7065727479223a207b22666f726d6174223a2022696e616f6b615f70726f6772616d5f73616d706c655f73656d616e746963227d7d,53995  >  7000 Len=167
10,0.056021,192.168.11.5,192.168.11.4,TCP,74,,œ,0.010987,"Jan  6, 2024 19:36:11.565272000 JST",,54818  >  6000 [SYN] Seq=0 Win=64240 Len=0 MSS=1460 SACK_PERM TSval=1889998085 TSecr=0 WS=128
11,0.056186,192.168.11.4,192.168.11.5,TCP,74,0.000165,,0.000165,"Jan  6, 2024 19:36:11.565437000 JST",,"6000  >  54818 [SYN, ACK] Seq=0 Ack=1 Win=65160 Len=0 MSS=1460 SACK_PERM TSval=3933723440 TSecr=1889998085 WS=128"
12,0.062895,192.168.11.5,192.168.11.4,TCP,66,0.006709,,0.006709,"Jan  6, 2024 19:36:11.572146000 JST",,54818  >  6000 [ACK] Seq=1 Ack=1 Win=64256 Len=0 TSval=1889998097 TSecr=3933723440
13,0.06351,192.168.11.5,192.168.11.4,TCP,93,,,0.000615,"Jan  6, 2024 19:36:11.572761000 JST",,"54818  >  6000 [PSH, ACK] Seq=1 Ack=1 Win=64256 Len=27 TSval=1889998097 TSecr=3933723440 [TCP segment of a reassembled PDU]"
14,0.0636,192.168.11.4,192.168.11.5,TCP,66,0.00009,,0.00009,"Jan  6, 2024 19:36:11.572851000 JST",,6000  >  54818 [ACK] Seq=1 Ack=28 Win=65152 Len=0 TSval=3933723448 TSecr=1889998097
15,0.063677,192.168.11.5,192.168.11.4,TCP,66,,,0.000077,"Jan  6, 2024 19:36:11.572928000 JST",,"54818  >  6000 [FIN, ACK] Seq=28 Ack=1 Win=64256 Len=0 TSval=1889998098 TSecr=3933723440"
16,0.065096,192.168.11.4,192.168.11.5,TCP,66,0.001419,,0.001419,"Jan  6, 2024 19:36:11.574347000 JST",,"6000  >  54818 [FIN, ACK] Seq=1 Ack=29 Win=65152 Len=0 TSval=3933723449 TSecr=1889998098"
17,0.071516,192.168.11.5,192.168.11.4,TCP,66,0.00642,,0.00642,"Jan  6, 2024 19:36:11.580767000 JST",,54818  >  6000 [ACK] Seq=29 Ack=2 Win=64256 Len=0 TSval=1889998105 TSecr=3933723449
18,10.314511,192.168.11.4,192.168.11.25,TCP,74,,,10.242995,"Jan  6, 2024 19:36:21.823762000 JST",,54164  >  6000 [SYN] Seq=0 Win=64240 Len=0 MSS=1460 SACK_PERM TSval=2744813617 TSecr=0 WS=128
19,10.321078,192.168.11.25,192.168.11.4,TCP,74,0.006567,,0.006567,"Jan  6, 2024 19:36:21.830329000 JST",,"6000  >  54164 [SYN, ACK] Seq=0 Ack=1 Win=65160 Len=0 MSS=1460 SACK_PERM TSval=2627850840 TSecr=2744813617 WS=128"
20,10.321189,192.168.11.4,192.168.11.25,TCP,66,0.000111,,0.000111,"Jan  6, 2024 19:36:21.830440000 JST",,54164  >  6000 [ACK] Seq=1 Ack=1 Win=64256 Len=0 TSval=2744813623 TSecr=2627850840
21,10.321385,192.168.11.4,192.168.11.25,TCP,93,,,0.000196,"Jan  6, 2024 19:36:21.830636000 JST",,"54164  >  6000 [PSH, ACK] Seq=1 Ack=1 Win=64256 Len=27 TSval=2744813624 TSecr=2627850840 [TCP segment of a reassembled PDU]"
22,10.321508,192.168.11.4,192.168.11.25,TCP,66,,,0.000123,"Jan  6, 2024 19:36:21.830759000 JST",,"54164  >  6000 [FIN, ACK] Seq=28 Ack=1 Win=64256 Len=0 TSval=2744813624 TSecr=2627850840"
23,10.328401,192.168.11.25,192.168.11.4,TCP,66,0.007016,,0.006893,"Jan  6, 2024 19:36:21.837652000 JST",,6000  >  54164 [ACK] Seq=1 Ack=28 Win=65152 Len=0 TSval=2627850847 TSecr=2744813624
24,10.328767,192.168.11.25,192.168.11.4,TCP,66,0.007259,,0.000366,"Jan  6, 2024 19:36:21.838018000 JST",,"6000  >  54164 [FIN, ACK] Seq=1 Ack=29 Win=65152 Len=0 TSval=2627850848 TSecr=2744813624"
25,10.328825,192.168.11.4,192.168.11.25,TCP,66,0.000058,,0.000058,"Jan  6, 2024 19:36:21.838076000 JST",,54164  >  6000 [ACK] Seq=29 Ack=2 Win=64256 Len=0 TSval=2744813631 TSecr=2627850848
26,10.362898,192.168.11.4,255.255.255.255,UDP,209,,Ÿ,0.034073,"Jan  6, 2024 19:36:21.872149000 JST",7b2273656d616e74696373223a207b22656e74697479223a2022504944222c202262617365656e74697479223a2022616e79222c2022726f6c65223a20226e6e6e222c20227370617469616c223a2022616e79222c202274656d706f72616c223a2022616e79227d2c20226461746170726f7065727479223a207b22666f726d6174223a2022696e616f6b615f70726f6772616d5f73616d706c655f73656d616e746963227d7d,33005  >  7000 Len=167
27,10.370006,192.168.11.5,192.168.11.4,TCP,74,,œ,0.007108,"Jan  6, 2024 19:36:21.879257000 JST",,50306  >  6000 [SYN] Seq=0 Win=64240 Len=0 MSS=1460 SACK_PERM TSval=1890008403 TSecr=0 WS=128
28,10.370219,192.168.11.4,192.168.11.5,TCP,74,0.000213,,0.000213,"Jan  6, 2024 19:36:21.879470000 JST",,"6000  >  50306 [SYN, ACK] Seq=0 Ack=1 Win=65160 Len=0 MSS=1460 SACK_PERM TSval=3933733754 TSecr=1890008403 WS=128"
29,10.3769,192.168.11.5,192.168.11.4,TCP,66,0.006681,,0.006681,"Jan  6, 2024 19:36:21.886151000 JST",,50306  >  6000 [ACK] Seq=1 Ack=1 Win=64256 Len=0 TSval=1890008411 TSecr=3933733754
30,10.377466,192.168.11.5,192.168.11.4,TCP,93,,,0.000566,"Jan  6, 2024 19:36:21.886717000 JST",,"50306  >  6000 [PSH, ACK] Seq=1 Ack=1 Win=64256 Len=27 TSval=1890008411 TSecr=3933733754 [TCP segment of a reassembled PDU]"
31,10.37757,192.168.11.4,192.168.11.5,TCP,66,0.000104,,0.000104,"Jan  6, 2024 19:36:21.886821000 JST",,6000  >  50306 [ACK] Seq=1 Ack=28 Win=65152 Len=0 TSval=3933733762 TSecr=1890008411
32,10.377647,192.168.11.5,192.168.11.4,TCP,66,,,0.000077,"Jan  6, 2024 19:36:21.886898000 JST",,"50306  >  6000 [FIN, ACK] Seq=28 Ack=1 Win=64256 Len=0 TSval=1890008412 TSecr=3933733754"
33,10.379129,192.168.11.4,192.168.11.5,TCP,66,0.001482,,0.001482,"Jan  6, 2024 19:36:21.888380000 JST",,"6000  >  50306 [FIN, ACK] Seq=1 Ack=29 Win=65152 Len=0 TSval=3933733763 TSecr=1890008412"
34,10.384682,192.168.11.5,192.168.11.4,TCP,66,0.005553,,0.005553,"Jan  6, 2024 19:36:21.893933000 JST",,50306  >  6000 [ACK] Seq=29 Ack=2 Win=64256 Len=0 TSval=1890008419 TSecr=3933733763
35,20.205745,192.168.11.4,192.168.11.25,TCP,74,,,9.821063,"Jan  6, 2024 19:36:31.714996000 JST",,34662  >  6000 [SYN] Seq=0 Win=64240 Len=0 MSS=1460 SACK_PERM TSval=2744823508 TSecr=0 WS=128
36,20.212577,192.168.11.25,192.168.11.4,TCP,74,0.006832,,0.006832,"Jan  6, 2024 19:36:31.721828000 JST",,"6000  >  34662 [SYN, ACK] Seq=0 Ack=1 Win=65160 Len=0 MSS=1460 SACK_PERM TSval=2627860731 TSecr=2744823508 WS=128"
37,20.212683,192.168.11.4,192.168.11.25,TCP,66,0.000106,,0.000106,"Jan  6, 2024 19:36:31.721934000 JST",,34662  >  6000 [ACK] Seq=1 Ack=1 Win=64256 Len=0 TSval=2744823515 TSecr=2627860731
38,20.21288,192.168.11.4,192.168.11.25,TCP,93,,,0.000197,"Jan  6, 2024 19:36:31.722131000 JST",,"34662  >  6000 [PSH, ACK] Seq=1 Ack=1 Win=64256 Len=27 TSval=2744823515 TSecr=2627860731 [TCP segment of a reassembled PDU]"
39,20.212979,192.168.11.4,192.168.11.25,TCP,66,,,0.000099,"Jan  6, 2024 19:36:31.722230000 JST",,"34662  >  6000 [FIN, ACK] Seq=28 Ack=1 Win=64256 Len=0 TSval=2744823515 TSecr=2627860731"
40,20.219801,192.168.11.25,192.168.11.4,TCP,66,0.006921,,0.006822,"Jan  6, 2024 19:36:31.729052000 JST",,6000  >  34662 [ACK] Seq=1 Ack=28 Win=65152 Len=0 TSval=2627860739 TSecr=2744823515
41,20.22019,192.168.11.25,192.168.11.4,TCP,66,0.007211,,0.000389,"Jan  6, 2024 19:36:31.729441000 JST",,"6000  >  34662 [FIN, ACK] Seq=1 Ack=29 Win=65152 Len=0 TSval=2627860740 TSecr=2744823515"
42,20.220241,192.168.11.4,192.168.11.25,TCP,66,0.000051,,0.000051,"Jan  6, 2024 19:36:31.729492000 JST",,34662  >  6000 [ACK] Seq=29 Ack=2 Win=64256 Len=0 TSval=2744823522 TSecr=2627860740
43,20.250695,192.168.11.4,255.255.255.255,UDP,209,,Ÿ,0.030454,"Jan  6, 2024 19:36:31.759946000 JST",7b2273656d616e74696373223a207b22656e74697479223a2022504944222c202262617365656e74697479223a2022616e79222c2022726f6c65223a20226e6e6e222c20227370617469616c223a2022616e79222c202274656d706f72616c223a2022616e79227d2c20226461746170726f7065727479223a207b22666f726d6174223a2022696e616f6b615f70726f6772616d5f73616d706c655f73656d616e746963227d7d,33345  >  7000 Len=167
44,20.257758,192.168.11.5,192.168.11.4,TCP,74,,œ,0.007063,"Jan  6, 2024 19:36:31.767009000 JST",,43348  >  6000 [SYN] Seq=0 Win=64240 Len=0 MSS=1460 SACK_PERM TSval=1890018291 TSecr=0 WS=128
45,20.257898,192.168.11.4,192.168.11.5,TCP,74,0.00014,,0.00014,"Jan  6, 2024 19:36:31.767149000 JST",,"6000  >  43348 [SYN, ACK] Seq=0 Ack=1 Win=65160 Len=0 MSS=1460 SACK_PERM TSval=3933743642 TSecr=1890018291 WS=128"
46,20.264336,192.168.11.5,192.168.11.4,TCP,66,0.006438,,0.006438,"Jan  6, 2024 19:36:31.773587000 JST",,43348  >  6000 [ACK] Seq=1 Ack=1 Win=64256 Len=0 TSval=1890018299 TSecr=3933743642
47,20.26483,192.168.11.5,192.168.11.4,TCP,93,,,0.000494,"Jan  6, 2024 19:36:31.774081000 JST",,"43348  >  6000 [PSH, ACK] Seq=1 Ack=1 Win=64256 Len=27 TSval=1890018299 TSecr=3933743642 [TCP segment of a reassembled PDU]"
48,20.264916,192.168.11.4,192.168.11.5,TCP,66,0.000086,,0.000086,"Jan  6, 2024 19:36:31.774167000 JST",,6000  >  43348 [ACK] Seq=1 Ack=28 Win=65152 Len=0 TSval=3933743649 TSecr=1890018299
49,20.264989,192.168.11.5,192.168.11.4,TCP,66,,,0.000073,"Jan  6, 2024 19:36:31.774240000 JST",,"43348  >  6000 [FIN, ACK] Seq=28 Ack=1 Win=64256 Len=0 TSval=1890018299 TSecr=3933743642"
50,20.266112,192.168.11.4,192.168.11.5,TCP,66,0.001123,,0.001123,"Jan  6, 2024 19:36:31.775363000 JST",,"6000  >  43348 [FIN, ACK] Seq=1 Ack=29 Win=65152 Len=0 TSval=3933743650 TSecr=1890018299"
51,20.271924,192.168.11.5,192.168.11.4,TCP,66,0.005812,,0.005812,"Jan  6, 2024 19:36:31.781175000 JST",,43348  >  6000 [ACK] Seq=29 Ack=2 Win=64256 Len=0 TSval=1890018306 TSecr=3933743650
52,30.113741,192.168.11.4,192.168.11.25,TCP,74,,,9.841817,"Jan  6, 2024 19:36:41.622992000 JST",,55928  >  6000 [SYN] Seq=0 Win=64240 Len=0 MSS=1460 SACK_PERM TSval=2744833416 TSecr=0 WS=128
53,30.121335,192.168.11.25,192.168.11.4,TCP,74,0.007594,,0.007594,"Jan  6, 2024 19:36:41.630586000 JST",,"6000  >  55928 [SYN, ACK] Seq=0 Ack=1 Win=65160 Len=0 MSS=1460 SACK_PERM TSval=2627870639 TSecr=2744833416 WS=128"
54,30.121442,192.168.11.4,192.168.11.25,TCP,66,0.000107,,0.000107,"Jan  6, 2024 19:36:41.630693000 JST",,55928  >  6000 [ACK] Seq=1 Ack=1 Win=64256 Len=0 TSval=2744833424 TSecr=2627870639
55,30.121653,192.168.11.4,192.168.11.25,TCP,93,,,0.000211,"Jan  6, 2024 19:36:41.630904000 JST",,"55928  >  6000 [PSH, ACK] Seq=1 Ack=1 Win=64256 Len=27 TSval=2744833424 TSecr=2627870639 [TCP segment of a reassembled PDU]"
56,30.121761,192.168.11.4,192.168.11.25,TCP,66,,,0.000108,"Jan  6, 2024 19:36:41.631012000 JST",,"55928  >  6000 [FIN, ACK] Seq=28 Ack=1 Win=64256 Len=0 TSval=2744833424 TSecr=2627870639"
57,30.128773,192.168.11.25,192.168.11.4,TCP,66,0.00712,,0.007012,"Jan  6, 2024 19:36:41.638024000 JST",,6000  >  55928 [ACK] Seq=1 Ack=28 Win=65152 Len=0 TSval=2627870647 TSecr=2744833424
58,30.129137,192.168.11.25,192.168.11.4,TCP,66,0.007376,,0.000364,"Jan  6, 2024 19:36:41.638388000 JST",,"6000  >  55928 [FIN, ACK] Seq=1 Ack=29 Win=65152 Len=0 TSval=2627870648 TSecr=2744833424"
59,30.129187,192.168.11.4,192.168.11.25,TCP,66,0.00005,,0.00005,"Jan  6, 2024 19:36:41.638438000 JST",,55928  >  6000 [ACK] Seq=29 Ack=2 Win=64256 Len=0 TSval=2744833431 TSecr=2627870648
60,30.162723,192.168.11.4,255.255.255.255,UDP,209,,Ÿ,0.033536,"Jan  6, 2024 19:36:41.671974000 JST",7b2273656d616e74696373223a207b22656e74697479223a2022504944222c202262617365656e74697479223a2022616e79222c2022726f6c65223a20226e6e6e222c20227370617469616c223a2022616e79222c202274656d706f72616c223a2022616e79227d2c20226461746170726f7065727479223a207b22666f726d6174223a2022696e616f6b615f70726f6772616d5f73616d706c655f73656d616e746963227d7d,50344  >  7000 Len=167
61,30.17013,192.168.11.5,192.168.11.4,TCP,74,,œ,0.007407,"Jan  6, 2024 19:36:41.679381000 JST",,59164  >  6000 [SYN] Seq=0 Win=64240 Len=0 MSS=1460 SACK_PERM TSval=1890028203 TSecr=0 WS=128
62,30.170345,192.168.11.4,192.168.11.5,TCP,74,0.000215,,0.000215,"Jan  6, 2024 19:36:41.679596000 JST",,"6000  >  59164 [SYN, ACK] Seq=0 Ack=1 Win=65160 Len=0 MSS=1460 SACK_PERM TSval=3933753555 TSecr=1890028203 WS=128"
63,30.178477,192.168.11.5,192.168.11.4,TCP,66,0.008132,,0.008132,"Jan  6, 2024 19:36:41.687728000 JST",,59164  >  6000 [ACK] Seq=1 Ack=1 Win=64256 Len=0 TSval=1890028212 TSecr=3933753555
64,30.179404,192.168.11.5,192.168.11.4,TCP,93,,,0.000927,"Jan  6, 2024 19:36:41.688655000 JST",,"59164  >  6000 [PSH, ACK] Seq=1 Ack=1 Win=64256 Len=27 TSval=1890028213 TSecr=3933753555 [TCP segment of a reassembled PDU]"
65,30.179565,192.168.11.4,192.168.11.5,TCP,66,0.000161,,0.000161,"Jan  6, 2024 19:36:41.688816000 JST",,6000  >  59164 [ACK] Seq=1 Ack=28 Win=65152 Len=0 TSval=3933753564 TSecr=1890028213
66,30.179657,192.168.11.5,192.168.11.4,TCP,66,,,0.000092,"Jan  6, 2024 19:36:41.688908000 JST",,"59164  >  6000 [FIN, ACK] Seq=28 Ack=1 Win=64256 Len=0 TSval=1890028213 TSecr=3933753555"
67,30.181342,192.168.11.4,192.168.11.5,TCP,66,0.001685,,0.001685,"Jan  6, 2024 19:36:41.690593000 JST",,"6000  >  59164 [FIN, ACK] Seq=1 Ack=29 Win=65152 Len=0 TSval=3933753565 TSecr=1890028213"
68,30.188923,192.168.11.5,192.168.11.4,TCP,66,0.007581,,0.007581,"Jan  6, 2024 19:36:41.698174000 JST",,59164  >  6000 [ACK] Seq=29 Ack=2 Win=64256 Len=0 TSval=1890028223 TSecr=3933753565
69,37.926355,192.168.11.4,192.168.11.25,TCP,74,,,7.737432,"Jan  6, 2024 19:36:49.435606000 JST",,56696  >  6000 [SYN] Seq=0 Win=64240 Len=0 MSS=1460 SACK_PERM TSval=2744841229 TSecr=0 WS=128
70,37.933457,192.168.11.25,192.168.11.4,TCP,74,0.007102,,0.007102,"Jan  6, 2024 19:36:49.442708000 JST",,"6000  >  56696 [SYN, ACK] Seq=0 Ack=1 Win=65160 Len=0 MSS=1460 SACK_PERM TSval=2627878452 TSecr=2744841229 WS=128"
71,37.933591,192.168.11.4,192.168.11.25,TCP,66,0.000134,,0.000134,"Jan  6, 2024 19:36:49.442842000 JST",,56696  >  6000 [ACK] Seq=1 Ack=1 Win=64256 Len=0 TSval=2744841236 TSecr=2627878452
72,37.933784,192.168.11.4,192.168.11.25,TCP,93,,,0.000193,"Jan  6, 2024 19:36:49.443035000 JST",,"56696  >  6000 [PSH, ACK] Seq=1 Ack=1 Win=64256 Len=27 TSval=2744841236 TSecr=2627878452 [TCP segment of a reassembled PDU]"
73,37.933898,192.168.11.4,192.168.11.25,TCP,66,,,0.000114,"Jan  6, 2024 19:36:49.443149000 JST",,"56696  >  6000 [FIN, ACK] Seq=28 Ack=1 Win=64256 Len=0 TSval=2744841236 TSecr=2627878452"
74,37.940915,192.168.11.25,192.168.11.4,TCP,66,0.007131,,0.007017,"Jan  6, 2024 19:36:49.450166000 JST",,6000  >  56696 [ACK] Seq=1 Ack=28 Win=65152 Len=0 TSval=2627878459 TSecr=2744841236
75,37.941299,192.168.11.25,192.168.11.4,TCP,66,0.007401,,0.000384,"Jan  6, 2024 19:36:49.450550000 JST",,"6000  >  56696 [FIN, ACK] Seq=1 Ack=29 Win=65152 Len=0 TSval=2627878460 TSecr=2744841236"
76,37.941347,192.168.11.4,192.168.11.25,TCP,66,0.000048,,0.000048,"Jan  6, 2024 19:36:49.450598000 JST",,56696  >  6000 [ACK] Seq=29 Ack=2 Win=64256 Len=0 TSval=2744841244 TSecr=2627878460
77,37.974626,192.168.11.4,255.255.255.255,UDP,209,,Ÿ,0.033279,"Jan  6, 2024 19:36:49.483877000 JST",7b2273656d616e74696373223a207b22656e74697479223a2022504944222c202262617365656e74697479223a2022616e79222c2022726f6c65223a20226e6e6e222c20227370617469616c223a2022616e79222c202274656d706f72616c223a2022616e79227d2c20226461746170726f7065727479223a207b22666f726d6174223a2022696e616f6b615f70726f6772616d5f73616d706c655f73656d616e746963227d7d,33919  >  7000 Len=167
78,37.981431,192.168.11.5,192.168.11.4,TCP,74,,œ,0.006805,"Jan  6, 2024 19:36:49.490682000 JST",,59166  >  6000 [SYN] Seq=0 Win=64240 Len=0 MSS=1460 SACK_PERM TSval=1890036015 TSecr=0 WS=128
79,37.981587,192.168.11.4,192.168.11.5,TCP,74,0.000156,,0.000156,"Jan  6, 2024 19:36:49.490838000 JST",,"6000  >  59166 [SYN, ACK] Seq=0 Ack=1 Win=65160 Len=0 MSS=1460 SACK_PERM TSval=3933761366 TSecr=1890036015 WS=128"
80,37.989419,192.168.11.5,192.168.11.4,TCP,66,0.007832,,0.007832,"Jan  6, 2024 19:36:49.498670000 JST",,59166  >  6000 [ACK] Seq=1 Ack=1 Win=64256 Len=0 TSval=1890036023 TSecr=3933761366
81,37.990526,192.168.11.5,192.168.11.4,TCP,93,,,0.001107,"Jan  6, 2024 19:36:49.499777000 JST",,"59166  >  6000 [PSH, ACK] Seq=1 Ack=1 Win=64256 Len=27 TSval=1890036024 TSecr=3933761366 [TCP segment of a reassembled PDU]"
82,37.990621,192.168.11.5,192.168.11.4,TCP,66,,,0.000095,"Jan  6, 2024 19:36:49.499872000 JST",,"59166  >  6000 [FIN, ACK] Seq=28 Ack=1 Win=64256 Len=0 TSval=1890036024 TSecr=3933761366"
83,37.990687,192.168.11.4,192.168.11.5,TCP,66,0.000161,,0.000066,"Jan  6, 2024 19:36:49.499938000 JST",,6000  >  59166 [ACK] Seq=1 Ack=28 Win=65152 Len=0 TSval=3933761375 TSecr=1890036024
84,37.992195,192.168.11.4,192.168.11.5,TCP,66,0.001574,,0.001508,"Jan  6, 2024 19:36:49.501446000 JST",,"6000  >  59166 [FIN, ACK] Seq=1 Ack=29 Win=65152 Len=0 TSval=3933761376 TSecr=1890036024"
85,37.997513,192.168.11.5,192.168.11.4,TCP,66,0.005318,,0.005318,"Jan  6, 2024 19:36:49.506764000 JST",,59166  >  6000 [ACK] Seq=29 Ack=2 Win=64256 Len=0 TSval=1890036032 TSecr=3933761376
86,45.725224,192.168.11.4,192.168.11.25,TCP,74,,,7.727711,"Jan  6, 2024 19:36:57.234475000 JST",,56430  >  6000 [SYN] Seq=0 Win=64240 Len=0 MSS=1460 SACK_PERM TSval=2744849027 TSecr=0 WS=128
87,45.7319,192.168.11.25,192.168.11.4,TCP,74,0.006676,,0.006676,"Jan  6, 2024 19:36:57.241151000 JST",,"6000  >  56430 [SYN, ACK] Seq=0 Ack=1 Win=65160 Len=0 MSS=1460 SACK_PERM TSval=2627886251 TSecr=2744849027 WS=128"
88,45.732016,192.168.11.4,192.168.11.25,TCP,66,0.000116,,0.000116,"Jan  6, 2024 19:36:57.241267000 JST",,56430  >  6000 [ACK] Seq=1 Ack=1 Win=64256 Len=0 TSval=2744849034 TSecr=2627886251
89,45.732227,192.168.11.4,192.168.11.25,TCP,93,,,0.000211,"Jan  6, 2024 19:36:57.241478000 JST",,"56430  >  6000 [PSH, ACK] Seq=1 Ack=1 Win=64256 Len=27 TSval=2744849034 TSecr=2627886251 [TCP segment of a reassembled PDU]"
90,45.732331,192.168.11.4,192.168.11.25,TCP,66,,,0.000104,"Jan  6, 2024 19:36:57.241582000 JST",,"56430  >  6000 [FIN, ACK] Seq=28 Ack=1 Win=64256 Len=0 TSval=2744849035 TSecr=2627886251"
91,45.738915,192.168.11.25,192.168.11.4,TCP,66,0.006688,,0.006584,"Jan  6, 2024 19:36:57.248166000 JST",,6000  >  56430 [ACK] Seq=1 Ack=28 Win=65152 Len=0 TSval=2627886258 TSecr=2744849034
92,45.739354,192.168.11.25,192.168.11.4,TCP,66,0.007023,,0.000439,"Jan  6, 2024 19:36:57.248605000 JST",,"6000  >  56430 [FIN, ACK] Seq=1 Ack=29 Win=65152 Len=0 TSval=2627886258 TSecr=2744849035"
93,45.739402,192.168.11.4,192.168.11.25,TCP,66,0.000048,,0.000048,"Jan  6, 2024 19:36:57.248653000 JST",,56430  >  6000 [ACK] Seq=29 Ack=2 Win=64256 Len=0 TSval=2744849042 TSecr=2627886258
94,45.768903,192.168.11.4,255.255.255.255,UDP,209,,Ÿ,0.029501,"Jan  6, 2024 19:36:57.278154000 JST",7b2273656d616e74696373223a207b22656e74697479223a2022504944222c202262617365656e74697479223a2022616e79222c2022726f6c65223a20226e6e6e222c20227370617469616c223a2022616e79222c202274656d706f72616c223a2022616e79227d2c20226461746170726f7065727479223a207b22666f726d6174223a2022696e616f6b615f70726f6772616d5f73616d706c655f73656d616e746963227d7d,33271  >  7000 Len=167
95,45.775521,192.168.11.5,192.168.11.4,TCP,74,,œ,0.006618,"Jan  6, 2024 19:36:57.284772000 JST",,38848  >  6000 [SYN] Seq=0 Win=64240 Len=0 MSS=1460 SACK_PERM TSval=1890043809 TSecr=0 WS=128
96,45.775646,192.168.11.4,192.168.11.5,TCP,74,0.000125,,0.000125,"Jan  6, 2024 19:36:57.284897000 JST",,"6000  >  38848 [SYN, ACK] Seq=0 Ack=1 Win=65160 Len=0 MSS=1460 SACK_PERM TSval=3933769160 TSecr=1890043809 WS=128"
97,45.783588,192.168.11.5,192.168.11.4,TCP,66,0.007942,,0.007942,"Jan  6, 2024 19:36:57.292839000 JST",,38848  >  6000 [ACK] Seq=1 Ack=1 Win=64256 Len=0 TSval=1890043818 TSecr=3933769160
98,45.784156,192.168.11.5,192.168.11.4,TCP,93,,,0.000568,"Jan  6, 2024 19:36:57.293407000 JST",,"38848  >  6000 [PSH, ACK] Seq=1 Ack=1 Win=64256 Len=27 TSval=1890043818 TSecr=3933769160 [TCP segment of a reassembled PDU]"
99,45.784262,192.168.11.4,192.168.11.5,TCP,66,0.000106,,0.000106,"Jan  6, 2024 19:36:57.293513000 JST",,6000  >  38848 [ACK] Seq=1 Ack=28 Win=65152 Len=0 TSval=3933769168 TSecr=1890043818
100,45.784339,192.168.11.5,192.168.11.4,TCP,66,,,0.000077,"Jan  6, 2024 19:36:57.293590000 JST",,"38848  >  6000 [FIN, ACK] Seq=28 Ack=1 Win=64256 Len=0 TSval=1890043818 TSecr=3933769160"
101,45.785535,192.168.11.4,192.168.11.5,TCP,66,0.001196,,0.001196,"Jan  6, 2024 19:36:57.294786000 JST",,"6000  >  38848 [FIN, ACK] Seq=1 Ack=29 Win=65152 Len=0 TSval=3933769170 TSecr=1890043818"
102,45.791559,192.168.11.5,192.168.11.4,TCP,66,0.006024,,0.006024,"Jan  6, 2024 19:36:57.300810000 JST",,38848  >  6000 [ACK] Seq=29 Ack=2 Win=64256 Len=0 TSval=1890043826 TSecr=3933769170
103,53.587414,192.168.11.4,192.168.11.25,TCP,74,,,7.795855,"Jan  6, 2024 19:37:05.096665000 JST",,46380  >  6000 [SYN] Seq=0 Win=64240 Len=0 MSS=1460 SACK_PERM TSval=2744856890 TSecr=0 WS=128
104,53.595598,192.168.11.25,192.168.11.4,TCP,74,0.008184,,0.008184,"Jan  6, 2024 19:37:05.104849000 JST",,"6000  >  46380 [SYN, ACK] Seq=0 Ack=1 Win=65160 Len=0 MSS=1460 SACK_PERM TSval=2627894114 TSecr=2744856890 WS=128"
105,53.595706,192.168.11.4,192.168.11.25,TCP,66,0.000108,,0.000108,"Jan  6, 2024 19:37:05.104957000 JST",,46380  >  6000 [ACK] Seq=1 Ack=1 Win=64256 Len=0 TSval=2744856898 TSecr=2627894114
106,53.595895,192.168.11.4,192.168.11.25,TCP,93,,,0.000189,"Jan  6, 2024 19:37:05.105146000 JST",,"46380  >  6000 [PSH, ACK] Seq=1 Ack=1 Win=64256 Len=27 TSval=2744856898 TSecr=2627894114 [TCP segment of a reassembled PDU]"
107,53.596023,192.168.11.4,192.168.11.25,TCP,66,,,0.000128,"Jan  6, 2024 19:37:05.105274000 JST",,"46380  >  6000 [FIN, ACK] Seq=28 Ack=1 Win=64256 Len=0 TSval=2744856898 TSecr=2627894114"
108,53.603074,192.168.11.25,192.168.11.4,TCP,66,0.007179,,0.007051,"Jan  6, 2024 19:37:05.112325000 JST",,6000  >  46380 [ACK] Seq=1 Ack=28 Win=65152 Len=0 TSval=2627894122 TSecr=2744856898
109,53.603461,192.168.11.25,192.168.11.4,TCP,66,0.007438,,0.000387,"Jan  6, 2024 19:37:05.112712000 JST",,"6000  >  46380 [FIN, ACK] Seq=1 Ack=29 Win=65152 Len=0 TSval=2627894123 TSecr=2744856898"
110,53.603509,192.168.11.4,192.168.11.25,TCP,66,0.000048,,0.000048,"Jan  6, 2024 19:37:05.112760000 JST",,46380  >  6000 [ACK] Seq=29 Ack=2 Win=64256 Len=0 TSval=2744856906 TSecr=2627894123
111,53.633886,192.168.11.4,255.255.255.255,UDP,209,,Ÿ,0.030377,"Jan  6, 2024 19:37:05.143137000 JST",7b2273656d616e74696373223a207b22656e74697479223a2022504944222c202262617365656e74697479223a2022616e79222c2022726f6c65223a20226e6e6e222c20227370617469616c223a2022616e79222c202274656d706f72616c223a2022616e79227d2c20226461746170726f7065727479223a207b22666f726d6174223a2022696e616f6b615f70726f6772616d5f73616d706c655f73656d616e746963227d7d,49543  >  7000 Len=167
112,53.63992,192.168.11.5,192.168.11.4,TCP,74,,œ,0.006034,"Jan  6, 2024 19:37:05.149171000 JST",,59602  >  6000 [SYN] Seq=0 Win=64240 Len=0 MSS=1460 SACK_PERM TSval=1890051674 TSecr=0 WS=128
113,53.640074,192.168.11.4,192.168.11.5,TCP,74,0.000154,,0.000154,"Jan  6, 2024 19:37:05.149325000 JST",,"6000  >  59602 [SYN, ACK] Seq=0 Ack=1 Win=65160 Len=0 MSS=1460 SACK_PERM TSval=3933777024 TSecr=1890051674 WS=128"
114,53.647777,192.168.11.5,192.168.11.4,TCP,66,0.007703,,0.007703,"Jan  6, 2024 19:37:05.157028000 JST",,59602  >  6000 [ACK] Seq=1 Ack=1 Win=64256 Len=0 TSval=1890051682 TSecr=3933777024
115,53.648335,192.168.11.5,192.168.11.4,TCP,93,,,0.000558,"Jan  6, 2024 19:37:05.157586000 JST",,"59602  >  6000 [PSH, ACK] Seq=1 Ack=1 Win=64256 Len=27 TSval=1890051682 TSecr=3933777024 [TCP segment of a reassembled PDU]"
116,53.648415,192.168.11.4,192.168.11.5,TCP,66,0.00008,,0.00008,"Jan  6, 2024 19:37:05.157666000 JST",,6000  >  59602 [ACK] Seq=1 Ack=28 Win=65152 Len=0 TSval=3933777033 TSecr=1890051682
117,53.648485,192.168.11.5,192.168.11.4,TCP,66,,,0.00007,"Jan  6, 2024 19:37:05.157736000 JST",,"59602  >  6000 [FIN, ACK] Seq=28 Ack=1 Win=64256 Len=0 TSval=1890051682 TSecr=3933777024"
118,53.64963,192.168.11.4,192.168.11.5,TCP,66,0.001145,,0.001145,"Jan  6, 2024 19:37:05.158881000 JST",,"6000  >  59602 [FIN, ACK] Seq=1 Ack=29 Win=65152 Len=0 TSval=3933777034 TSecr=1890051682"
119,53.655819,192.168.11.5,192.168.11.4,TCP,66,0.006189,,0.006189,"Jan  6, 2024 19:37:05.165070000 JST",,59602  >  6000 [ACK] Seq=29 Ack=2 Win=64256 Len=0 TSval=1890051690 TSecr=3933777034
120,61.891375,192.168.11.4,192.168.11.25,TCP,74,,,8.235556,"Jan  6, 2024 19:37:13.400626000 JST",,33378  >  6000 [SYN] Seq=0 Win=64240 Len=0 MSS=1460 SACK_PERM TSval=2744865193 TSecr=0 WS=128
121,61.902449,192.168.11.25,192.168.11.4,TCP,74,0.011074,,0.011074,"Jan  6, 2024 19:37:13.411700000 JST",,"6000  >  33378 [SYN, ACK] Seq=0 Ack=1 Win=65160 Len=0 MSS=1460 SACK_PERM TSval=2627902421 TSecr=2744865193 WS=128"
122,61.902559,192.168.11.4,192.168.11.25,TCP,66,0.00011,,0.00011,"Jan  6, 2024 19:37:13.411810000 JST",,33378  >  6000 [ACK] Seq=1 Ack=1 Win=64256 Len=0 TSval=2744865205 TSecr=2627902421
123,61.902729,192.168.11.4,192.168.11.25,TCP,93,,,0.00017,"Jan  6, 2024 19:37:13.411980000 JST",,"33378  >  6000 [PSH, ACK] Seq=1 Ack=1 Win=64256 Len=27 TSval=2744865205 TSecr=2627902421 [TCP segment of a reassembled PDU]"
124,61.902828,192.168.11.4,192.168.11.25,TCP,66,,,0.000099,"Jan  6, 2024 19:37:13.412079000 JST",,"33378  >  6000 [FIN, ACK] Seq=28 Ack=1 Win=64256 Len=0 TSval=2744865205 TSecr=2627902421"
125,61.910649,192.168.11.25,192.168.11.4,TCP,66,0.00792,,0.007821,"Jan  6, 2024 19:37:13.419900000 JST",,6000  >  33378 [ACK] Seq=1 Ack=28 Win=65152 Len=0 TSval=2627902429 TSecr=2744865205
126,61.911028,192.168.11.25,192.168.11.4,TCP,66,0.0082,,0.000379,"Jan  6, 2024 19:37:13.420279000 JST",,"6000  >  33378 [FIN, ACK] Seq=1 Ack=29 Win=65152 Len=0 TSval=2627902430 TSecr=2744865205"
127,61.911089,192.168.11.4,192.168.11.25,TCP,66,0.000061,,0.000061,"Jan  6, 2024 19:37:13.420340000 JST",,33378  >  6000 [ACK] Seq=29 Ack=2 Win=64256 Len=0 TSval=2744865213 TSecr=2627902430
128,61.941539,192.168.11.4,255.255.255.255,UDP,209,,Ÿ,0.03045,"Jan  6, 2024 19:37:13.450790000 JST",7b2273656d616e74696373223a207b22656e74697479223a2022504944222c202262617365656e74697479223a2022616e79222c2022726f6c65223a20226e6e6e222c20227370617469616c223a2022616e79222c202274656d706f72616c223a2022616e79227d2c20226461746170726f7065727479223a207b22666f726d6174223a2022696e616f6b615f70726f6772616d5f73616d706c655f73656d616e746963227d7d,42540  >  7000 Len=167
129,61.947151,192.168.11.5,192.168.11.4,TCP,74,,œ,0.005612,"Jan  6, 2024 19:37:13.456402000 JST",,48838  >  6000 [SYN] Seq=0 Win=64240 Len=0 MSS=1460 SACK_PERM TSval=1890059981 TSecr=0 WS=128
130,61.947347,192.168.11.4,192.168.11.5,TCP,74,0.000196,,0.000196,"Jan  6, 2024 19:37:13.456598000 JST",,"6000  >  48838 [SYN, ACK] Seq=0 Ack=1 Win=65160 Len=0 MSS=1460 SACK_PERM TSval=3933785332 TSecr=1890059981 WS=128"
131,61.954452,192.168.11.5,192.168.11.4,TCP,66,0.007105,,0.007105,"Jan  6, 2024 19:37:13.463703000 JST",,48838  >  6000 [ACK] Seq=1 Ack=1 Win=64256 Len=0 TSval=1890059989 TSecr=3933785332
132,61.955068,192.168.11.5,192.168.11.4,TCP,93,,,0.000616,"Jan  6, 2024 19:37:13.464319000 JST",,"48838  >  6000 [PSH, ACK] Seq=1 Ack=1 Win=64256 Len=27 TSval=1890059989 TSecr=3933785332 [TCP segment of a reassembled PDU]"
133,61.955217,192.168.11.4,192.168.11.5,TCP,66,0.000149,,0.000149,"Jan  6, 2024 19:37:13.464468000 JST",,6000  >  48838 [ACK] Seq=1 Ack=28 Win=65152 Len=0 TSval=3933785339 TSecr=1890059989
134,61.95543,192.168.11.5,192.168.11.4,TCP,66,,,0.000213,"Jan  6, 2024 19:37:13.464681000 JST",,"48838  >  6000 [FIN, ACK] Seq=28 Ack=1 Win=64256 Len=0 TSval=1890059989 TSecr=3933785332"
135,61.956719,192.168.11.4,192.168.11.5,TCP,66,0.001289,,0.001289,"Jan  6, 2024 19:37:13.465970000 JST",,"6000  >  48838 [FIN, ACK] Seq=1 Ack=29 Win=65152 Len=0 TSval=3933785341 TSecr=1890059989"
136,61.961824,192.168.11.5,192.168.11.4,TCP,66,0.005105,,0.005105,"Jan  6, 2024 19:37:13.471075000 JST",,48838  >  6000 [ACK] Seq=29 Ack=2 Win=64256 Len=0 TSval=1890059996 TSecr=3933785341
137,72.826225,192.168.11.4,192.168.11.25,TCP,74,,,10.864401,"Jan  6, 2024 19:37:24.335476000 JST",,34530  >  6000 [SYN] Seq=0 Win=64240 Len=0 MSS=1460 SACK_PERM TSval=2744876128 TSecr=0 WS=128
138,72.832711,192.168.11.25,192.168.11.4,TCP,74,0.006486,,0.006486,"Jan  6, 2024 19:37:24.341962000 JST",,"6000  >  34530 [SYN, ACK] Seq=0 Ack=1 Win=65160 Len=0 MSS=1460 SACK_PERM TSval=2627913352 TSecr=2744876128 WS=128"
139,72.832852,192.168.11.4,192.168.11.25,TCP,66,0.000141,,0.000141,"Jan  6, 2024 19:37:24.342103000 JST",,34530  >  6000 [ACK] Seq=1 Ack=1 Win=64256 Len=0 TSval=2744876135 TSecr=2627913352
140,72.83307,192.168.11.4,192.168.11.25,TCP,93,,,0.000218,"Jan  6, 2024 19:37:24.342321000 JST",,"34530  >  6000 [PSH, ACK] Seq=1 Ack=1 Win=64256 Len=27 TSval=2744876135 TSecr=2627913352 [TCP segment of a reassembled PDU]"
141,72.833178,192.168.11.4,192.168.11.25,TCP,66,,,0.000108,"Jan  6, 2024 19:37:24.342429000 JST",,"34530  >  6000 [FIN, ACK] Seq=28 Ack=1 Win=64256 Len=0 TSval=2744876135 TSecr=2627913352"
142,72.839793,192.168.11.25,192.168.11.4,TCP,66,0.006723,,0.006615,"Jan  6, 2024 19:37:24.349044000 JST",,6000  >  34530 [ACK] Seq=1 Ack=28 Win=65152 Len=0 TSval=2627913359 TSecr=2744876135
143,72.840198,192.168.11.25,192.168.11.4,TCP,66,0.00702,,0.000405,"Jan  6, 2024 19:37:24.349449000 JST",,"6000  >  34530 [FIN, ACK] Seq=1 Ack=29 Win=65152 Len=0 TSval=2627913360 TSecr=2744876135"
144,72.840261,192.168.11.4,192.168.11.25,TCP,66,0.000063,,0.000063,"Jan  6, 2024 19:37:24.349512000 JST",,34530  >  6000 [ACK] Seq=29 Ack=2 Win=64256 Len=0 TSval=2744876142 TSecr=2627913360
145,72.870226,192.168.11.4,255.255.255.255,UDP,209,,Ÿ,0.029965,"Jan  6, 2024 19:37:24.379477000 JST",7b2273656d616e74696373223a207b22656e74697479223a2022504944222c202262617365656e74697479223a2022616e79222c2022726f6c65223a20226e6e6e222c20227370617469616c223a2022616e79222c202274656d706f72616c223a2022616e79227d2c20226461746170726f7065727479223a207b22666f726d6174223a2022696e616f6b615f70726f6772616d5f73616d706c655f73656d616e746963227d7d,37205  >  7000 Len=167
146,72.87605,192.168.11.5,192.168.11.4,TCP,74,,œ,0.005824,"Jan  6, 2024 19:37:24.385301000 JST",,57820  >  6000 [SYN] Seq=0 Win=64240 Len=0 MSS=1460 SACK_PERM TSval=1890070910 TSecr=0 WS=128
147,72.876192,192.168.11.4,192.168.11.5,TCP,74,0.000142,,0.000142,"Jan  6, 2024 19:37:24.385443000 JST",,"6000  >  57820 [SYN, ACK] Seq=0 Ack=1 Win=65160 Len=0 MSS=1460 SACK_PERM TSval=3933796260 TSecr=1890070910 WS=128"
148,72.883297,192.168.11.5,192.168.11.4,TCP,66,0.007105,,0.007105,"Jan  6, 2024 19:37:24.392548000 JST",,57820  >  6000 [ACK] Seq=1 Ack=1 Win=64256 Len=0 TSval=1890070917 TSecr=3933796260
149,72.883881,192.168.11.5,192.168.11.4,TCP,93,,,0.000584,"Jan  6, 2024 19:37:24.393132000 JST",,"57820  >  6000 [PSH, ACK] Seq=1 Ack=1 Win=64256 Len=27 TSval=1890070918 TSecr=3933796260 [TCP segment of a reassembled PDU]"
150,72.883971,192.168.11.4,192.168.11.5,TCP,66,0.00009,,0.00009,"Jan  6, 2024 19:37:24.393222000 JST",,6000  >  57820 [ACK] Seq=1 Ack=28 Win=65152 Len=0 TSval=3933796268 TSecr=1890070918
151,72.884034,192.168.11.5,192.168.11.4,TCP,66,,,0.000063,"Jan  6, 2024 19:37:24.393285000 JST",,"57820  >  6000 [FIN, ACK] Seq=28 Ack=1 Win=64256 Len=0 TSval=1890070918 TSecr=3933796260"
152,72.885816,192.168.11.4,192.168.11.5,TCP,66,0.001782,,0.001782,"Jan  6, 2024 19:37:24.395067000 JST",,"6000  >  57820 [FIN, ACK] Seq=1 Ack=29 Win=65152 Len=0 TSval=3933796270 TSecr=1890070918"
153,72.891454,192.168.11.5,192.168.11.4,TCP,66,0.005638,,0.005638,"Jan  6, 2024 19:37:24.400705000 JST",,57820  >  6000 [ACK] Seq=29 Ack=2 Win=64256 Len=0 TSval=1890070926 TSecr=3933796270
154,82.709914,192.168.11.4,192.168.11.25,TCP,74,,,9.81846,"Jan  6, 2024 19:37:34.219165000 JST",,35994  >  6000 [SYN] Seq=0 Win=64240 Len=0 MSS=1460 SACK_PERM TSval=2744886012 TSecr=0 WS=128
155,82.717598,192.168.11.25,192.168.11.4,TCP,74,0.007684,,0.007684,"Jan  6, 2024 19:37:34.226849000 JST",,"6000  >  35994 [SYN, ACK] Seq=0 Ack=1 Win=65160 Len=0 MSS=1460 SACK_PERM TSval=2627923236 TSecr=2744886012 WS=128"
156,82.717709,192.168.11.4,192.168.11.25,TCP,66,0.000111,,0.000111,"Jan  6, 2024 19:37:34.226960000 JST",,35994  >  6000 [ACK] Seq=1 Ack=1 Win=64256 Len=0 TSval=2744886020 TSecr=2627923236
157,82.717898,192.168.11.4,192.168.11.25,TCP,93,,,0.000189,"Jan  6, 2024 19:37:34.227149000 JST",,"35994  >  6000 [PSH, ACK] Seq=1 Ack=1 Win=64256 Len=27 TSval=2744886020 TSecr=2627923236 [TCP segment of a reassembled PDU]"
158,82.717991,192.168.11.4,192.168.11.25,TCP,66,,,0.000093,"Jan  6, 2024 19:37:34.227242000 JST",,"35994  >  6000 [FIN, ACK] Seq=28 Ack=1 Win=64256 Len=0 TSval=2744886020 TSecr=2627923236"
159,82.724791,192.168.11.25,192.168.11.4,TCP,66,0.006893,,0.0068,"Jan  6, 2024 19:37:34.234042000 JST",,6000  >  35994 [ACK] Seq=1 Ack=28 Win=65152 Len=0 TSval=2627923244 TSecr=2744886020
160,82.725169,192.168.11.25,192.168.11.4,TCP,66,0.007178,,0.000378,"Jan  6, 2024 19:37:34.234420000 JST",,"6000  >  35994 [FIN, ACK] Seq=1 Ack=29 Win=65152 Len=0 TSval=2627923245 TSecr=2744886020"
161,82.72522,192.168.11.4,192.168.11.25,TCP,66,0.000051,,0.000051,"Jan  6, 2024 19:37:34.234471000 JST",,35994  >  6000 [ACK] Seq=29 Ack=2 Win=64256 Len=0 TSval=2744886027 TSecr=2627923245
162,82.763233,192.168.11.4,255.255.255.255,UDP,209,,Ÿ,0.038013,"Jan  6, 2024 19:37:34.272484000 JST",7b2273656d616e74696373223a207b22656e74697479223a2022504944222c202262617365656e74697479223a2022616e79222c2022726f6c65223a20226e6e6e222c20227370617469616c223a2022616e79222c202274656d706f72616c223a2022616e79227d2c20226461746170726f7065727479223a207b22666f726d6174223a2022696e616f6b615f70726f6772616d5f73616d706c655f73656d616e746963227d7d,56298  >  7000 Len=167
163,82.769052,192.168.11.5,192.168.11.4,TCP,74,,œ,0.005819,"Jan  6, 2024 19:37:34.278303000 JST",,55354  >  6000 [SYN] Seq=0 Win=64240 Len=0 MSS=1460 SACK_PERM TSval=1890080803 TSecr=0 WS=128
164,82.769228,192.168.11.4,192.168.11.5,TCP,74,0.000176,,0.000176,"Jan  6, 2024 19:37:34.278479000 JST",,"6000  >  55354 [SYN, ACK] Seq=0 Ack=1 Win=65160 Len=0 MSS=1460 SACK_PERM TSval=3933806153 TSecr=1890080803 WS=128"
165,82.776147,192.168.11.5,192.168.11.4,TCP,66,0.006919,,0.006919,"Jan  6, 2024 19:37:34.285398000 JST",,55354  >  6000 [ACK] Seq=1 Ack=1 Win=64256 Len=0 TSval=1890080811 TSecr=3933806153
166,82.77657,192.168.11.5,192.168.11.4,TCP,93,,,0.000423,"Jan  6, 2024 19:37:34.285821000 JST",,"55354  >  6000 [PSH, ACK] Seq=1 Ack=1 Win=64256 Len=27 TSval=1890080811 TSecr=3933806153 [TCP segment of a reassembled PDU]"
167,82.776633,192.168.11.4,192.168.11.5,TCP,66,0.000063,,0.000063,"Jan  6, 2024 19:37:34.285884000 JST",,6000  >  55354 [ACK] Seq=1 Ack=28 Win=65152 Len=0 TSval=3933806161 TSecr=1890080811
168,82.776687,192.168.11.5,192.168.11.4,TCP,66,,,0.000054,"Jan  6, 2024 19:37:34.285938000 JST",,"55354  >  6000 [FIN, ACK] Seq=28 Ack=1 Win=64256 Len=0 TSval=1890080811 TSecr=3933806153"
169,82.777602,192.168.11.4,192.168.11.5,TCP,66,0.000915,,0.000915,"Jan  6, 2024 19:37:34.286853000 JST",,"6000  >  55354 [FIN, ACK] Seq=1 Ack=29 Win=65152 Len=0 TSval=3933806162 TSecr=1890080811"
170,82.784404,192.168.11.5,192.168.11.4,TCP,66,0.006802,,0.006802,"Jan  6, 2024 19:37:34.293655000 JST",,55354  >  6000 [ACK] Seq=29 Ack=2 Win=64256 Len=0 TSval=1890080818 TSecr=3933806162
171,114.889991,192.168.11.4,192.168.11.25,TCP,74,,,32.105587,"Jan  6, 2024 19:38:06.399242000 JST",,47582  >  6000 [SYN] Seq=0 Win=64240 Len=0 MSS=1460 SACK_PERM TSval=2744918192 TSecr=0 WS=128
172,114.899076,192.168.11.25,192.168.11.4,TCP,74,0.009085,,0.009085,"Jan  6, 2024 19:38:06.408327000 JST",,"6000  >  47582 [SYN, ACK] Seq=0 Ack=1 Win=65160 Len=0 MSS=1460 SACK_PERM TSval=2627955415 TSecr=2744918192 WS=128"
173,114.899207,192.168.11.4,192.168.11.25,TCP,66,0.000131,,0.000131,"Jan  6, 2024 19:38:06.408458000 JST",,47582  >  6000 [ACK] Seq=1 Ack=1 Win=64256 Len=0 TSval=2744918201 TSecr=2627955415
174,114.899436,192.168.11.4,192.168.11.25,TCP,93,,,0.000229,"Jan  6, 2024 19:38:06.408687000 JST",,"47582  >  6000 [PSH, ACK] Seq=1 Ack=1 Win=64256 Len=27 TSval=2744918202 TSecr=2627955415 [TCP segment of a reassembled PDU]"
175,114.899533,192.168.11.4,192.168.11.25,TCP,66,,,0.000097,"Jan  6, 2024 19:38:06.408784000 JST",,"47582  >  6000 [FIN, ACK] Seq=28 Ack=1 Win=64256 Len=0 TSval=2744918202 TSecr=2627955415"
176,114.916362,192.168.11.25,192.168.11.4,TCP,66,0.016926,,0.016829,"Jan  6, 2024 19:38:06.425613000 JST",,6000  >  47582 [ACK] Seq=1 Ack=28 Win=65152 Len=0 TSval=2627955432 TSecr=2744918202
177,114.916744,192.168.11.25,192.168.11.4,TCP,66,0.017211,,0.000382,"Jan  6, 2024 19:38:06.425995000 JST",,"6000  >  47582 [FIN, ACK] Seq=1 Ack=29 Win=65152 Len=0 TSval=2627955433 TSecr=2744918202"
178,114.916795,192.168.11.4,192.168.11.25,TCP,66,0.000051,,0.000051,"Jan  6, 2024 19:38:06.426046000 JST",,47582  >  6000 [ACK] Seq=29 Ack=2 Win=64256 Len=0 TSval=2744918219 TSecr=2627955433
179,114.945969,192.168.11.4,255.255.255.255,UDP,209,,Ÿ,0.029174,"Jan  6, 2024 19:38:06.455220000 JST",7b2273656d616e74696373223a207b22656e74697479223a2022504944222c202262617365656e74697479223a2022616e79222c2022726f6c65223a20226e6e6e222c20227370617469616c223a2022616e79222c202274656d706f72616c223a2022616e79227d2c20226461746170726f7065727479223a207b22666f726d6174223a2022696e616f6b615f70726f6772616d5f73616d706c655f73656d616e746963227d7d,58577  >  7000 Len=167
180,114.95159,192.168.11.5,192.168.11.4,TCP,74,,œ,0.005621,"Jan  6, 2024 19:38:06.460841000 JST",,55478  >  6000 [SYN] Seq=0 Win=64240 Len=0 MSS=1460 SACK_PERM TSval=1890112986 TSecr=0 WS=128
181,114.951736,192.168.11.4,192.168.11.5,TCP,74,0.000146,,0.000146,"Jan  6, 2024 19:38:06.460987000 JST",,"6000  >  55478 [SYN, ACK] Seq=0 Ack=1 Win=65160 Len=0 MSS=1460 SACK_PERM TSval=3933838336 TSecr=1890112986 WS=128"
182,114.95855,192.168.11.5,192.168.11.4,TCP,66,0.006814,,0.006814,"Jan  6, 2024 19:38:06.467801000 JST",,55478  >  6000 [ACK] Seq=1 Ack=1 Win=64256 Len=0 TSval=1890112993 TSecr=3933838336
183,114.959027,192.168.11.5,192.168.11.4,TCP,93,,,0.000477,"Jan  6, 2024 19:38:06.468278000 JST",,"55478  >  6000 [PSH, ACK] Seq=1 Ack=1 Win=64256 Len=27 TSval=1890112993 TSecr=3933838336 [TCP segment of a reassembled PDU]"
184,114.959105,192.168.11.4,192.168.11.5,TCP,66,0.000078,,0.000078,"Jan  6, 2024 19:38:06.468356000 JST",,6000  >  55478 [ACK] Seq=1 Ack=28 Win=65152 Len=0 TSval=3933838343 TSecr=1890112993
185,114.959436,192.168.11.5,192.168.11.4,TCP,66,,,0.000331,"Jan  6, 2024 19:38:06.468687000 JST",,"55478  >  6000 [FIN, ACK] Seq=28 Ack=1 Win=64256 Len=0 TSval=1890112993 TSecr=3933838336"
186,114.960183,192.168.11.4,192.168.11.5,TCP,66,0.000747,,0.000747,"Jan  6, 2024 19:38:06.469434000 JST",,"6000  >  55478 [FIN, ACK] Seq=1 Ack=29 Win=65152 Len=0 TSval=3933838344 TSecr=1890112993"
