No.,Time,Source,Destination,Protocol,Length,The RTT to ACK the segment was,XXX,Time delta from previous captured frame,Arrival Time,Data,Info
1,0,192.168.11.16,192.168.11.11,TCP,74,,,0,"Jan  6, 2024 19:36:11.671202000 JST",,44020  >  6000 [SYN] Seq=0 Win=64240 Len=0 MSS=1460 SACK_PERM TSval=1292920883 TSecr=0 WS=128
2,0.006463,192.168.11.11,192.168.11.16,TCP,74,0.006463,,0.006463,"Jan  6, 2024 19:36:11.677665000 JST",,"6000  >  44020 [SYN, ACK] Seq=0 Ack=1 Win=65160 Len=0 MSS=1460 SACK_PERM TSval=4085285872 TSecr=1292920883 WS=128"
3,0.00657,192.168.11.16,192.168.11.11,TCP,66,0.000107,,0.000107,"Jan  6, 2024 19:36:11.677772000 JST",,44020  >  6000 [ACK] Seq=1 Ack=1 Win=64256 Len=0 TSval=1292920892 TSecr=4085285872
4,0.006873,192.168.11.16,192.168.11.11,TCP,93,,,0.000303,"Jan  6, 2024 19:36:11.678075000 JST",,"44020  >  6000 [PSH, ACK] Seq=1 Ack=1 Win=64256 Len=27 TSval=1292920893 TSecr=4085285872 [TCP segment of a reassembled PDU]"
5,0.007047,192.168.11.16,192.168.11.11,TCP,66,,,0.000174,"Jan  6, 2024 19:36:11.678249000 JST",,"44020  >  6000 [FIN, ACK] Seq=28 Ack=1 Win=64256 Len=0 TSval=1292920893 TSecr=4085285872"
6,0.013639,192.168.11.11,192.168.11.16,TCP,66,0.006766,,0.006592,"Jan  6, 2024 19:36:11.684841000 JST",,6000  >  44020 [ACK] Seq=1 Ack=28 Win=65152 Len=0 TSval=4085285879 TSecr=1292920893
7,0.013797,192.168.11.11,192.168.11.16,TCP,66,0.00675,,0.000158,"Jan  6, 2024 19:36:11.684999000 JST",,"6000  >  44020 [FIN, ACK] Seq=1 Ack=29 Win=65152 Len=0 TSval=4085285881 TSecr=1292920893"
8,0.013844,192.168.11.16,192.168.11.11,TCP,66,0.000047,,0.000047,"Jan  6, 2024 19:36:11.685046000 JST",,44020  >  6000 [ACK] Seq=29 Ack=2 Win=64256 Len=0 TSval=1292920900 TSecr=4085285881
9,0.037869,192.168.11.16,255.255.255.255,UDP,209,,Ÿ,0.024025,"Jan  6, 2024 19:36:11.709071000 JST",7b2273656d616e74696373223a207b22656e74697479223a2022504944222c202262617365656e74697479223a2022616e79222c2022726f6c65223a2022717171222c20227370617469616c223a2022616e79222c202274656d706f72616c223a2022616e79227d2c20226461746170726f7065727479223a207b22666f726d6174223a2022696e616f6b615f70726f6772616d5f73616d706c655f73656d616e746963227d7d,45028  >  7000 Len=167
10,0.046035,192.168.11.17,192.168.11.16,TCP,74,,œ,0.008166,"Jan  6, 2024 19:36:11.717237000 JST",,37496  >  6000 [SYN] Seq=0 Win=64240 Len=0 MSS=1460 SACK_PERM TSval=54176311 TSecr=0 WS=128
11,0.046132,192.168.11.16,192.168.11.17,TCP,74,0.000097,,0.000097,"Jan  6, 2024 19:36:11.717334000 JST",,"6000  >  37496 [SYN, ACK] Seq=0 Ack=1 Win=65160 Len=0 MSS=1460 SACK_PERM TSval=950154025 TSecr=54176311 WS=128"
12,0.052698,192.168.11.17,192.168.11.16,TCP,66,0.006566,,0.006566,"Jan  6, 2024 19:36:11.723900000 JST",,37496  >  6000 [ACK] Seq=1 Ack=1 Win=64256 Len=0 TSval=54176320 TSecr=950154025
13,0.053255,192.168.11.17,192.168.11.16,TCP,93,,,0.000557,"Jan  6, 2024 19:36:11.724457000 JST",,"37496  >  6000 [PSH, ACK] Seq=1 Ack=1 Win=64256 Len=27 TSval=54176320 TSecr=950154025 [TCP segment of a reassembled PDU]"
14,0.053335,192.168.11.16,192.168.11.17,TCP,66,0.00008,,0.00008,"Jan  6, 2024 19:36:11.724537000 JST",,6000  >  37496 [ACK] Seq=1 Ack=28 Win=65152 Len=0 TSval=950154032 TSecr=54176320
15,0.053399,192.168.11.17,192.168.11.16,TCP,66,,,0.000064,"Jan  6, 2024 19:36:11.724601000 JST",,"37496  >  6000 [FIN, ACK] Seq=28 Ack=1 Win=64256 Len=0 TSval=54176321 TSecr=950154025"
16,0.055137,192.168.11.16,192.168.11.17,TCP,66,0.001738,,0.001738,"Jan  6, 2024 19:36:11.726339000 JST",,"6000  >  37496 [FIN, ACK] Seq=1 Ack=29 Win=65152 Len=0 TSval=950154034 TSecr=54176321"
17,0.060021,192.168.11.17,192.168.11.16,TCP,66,0.004884,,0.004884,"Jan  6, 2024 19:36:11.731223000 JST",,37496  >  6000 [ACK] Seq=29 Ack=2 Win=64256 Len=0 TSval=54176328 TSecr=950154034
18,10.298342,192.168.11.16,192.168.11.11,TCP,74,,,10.238321,"Jan  6, 2024 19:36:21.969544000 JST",,36848  >  6000 [SYN] Seq=0 Win=64240 Len=0 MSS=1460 SACK_PERM TSval=1292931184 TSecr=0 WS=128
19,10.304981,192.168.11.11,192.168.11.16,TCP,74,0.006639,,0.006639,"Jan  6, 2024 19:36:21.976183000 JST",,"6000  >  36848 [SYN, ACK] Seq=0 Ack=1 Win=65160 Len=0 MSS=1460 SACK_PERM TSval=4085296172 TSecr=1292931184 WS=128"
20,10.305096,192.168.11.16,192.168.11.11,TCP,66,0.000115,,0.000115,"Jan  6, 2024 19:36:21.976298000 JST",,36848  >  6000 [ACK] Seq=1 Ack=1 Win=64256 Len=0 TSval=1292931191 TSecr=4085296172
21,10.305277,192.168.11.16,192.168.11.11,TCP,93,,,0.000181,"Jan  6, 2024 19:36:21.976479000 JST",,"36848  >  6000 [PSH, ACK] Seq=1 Ack=1 Win=64256 Len=27 TSval=1292931191 TSecr=4085296172 [TCP segment of a reassembled PDU]"
22,10.305437,192.168.11.16,192.168.11.11,TCP,66,,,0.00016,"Jan  6, 2024 19:36:21.976639000 JST",,"36848  >  6000 [FIN, ACK] Seq=28 Ack=1 Win=64256 Len=0 TSval=1292931191 TSecr=4085296172"
23,10.312502,192.168.11.11,192.168.11.16,TCP,66,0.007225,,0.007065,"Jan  6, 2024 19:36:21.983704000 JST",,6000  >  36848 [ACK] Seq=1 Ack=28 Win=65152 Len=0 TSval=4085296178 TSecr=1292931191
24,10.312877,192.168.11.11,192.168.11.16,TCP,66,0.00744,,0.000375,"Jan  6, 2024 19:36:21.984079000 JST",,"6000  >  36848 [FIN, ACK] Seq=1 Ack=29 Win=65152 Len=0 TSval=4085296179 TSecr=1292931191"
25,10.312923,192.168.11.16,192.168.11.11,TCP,66,0.000046,,0.000046,"Jan  6, 2024 19:36:21.984125000 JST",,36848  >  6000 [ACK] Seq=29 Ack=2 Win=64256 Len=0 TSval=1292931199 TSecr=4085296179
26,10.348026,192.168.11.16,255.255.255.255,UDP,209,,Ÿ,0.035103,"Jan  6, 2024 19:36:22.019228000 JST",7b2273656d616e74696373223a207b22656e74697479223a2022504944222c202262617365656e74697479223a2022616e79222c2022726f6c65223a2022717171222c20227370617469616c223a2022616e79222c202274656d706f72616c223a2022616e79227d2c20226461746170726f7065727479223a207b22666f726d6174223a2022696e616f6b615f70726f6772616d5f73616d706c655f73656d616e746963227d7d,50400  >  7000 Len=167
27,10.353751,192.168.11.17,192.168.11.16,TCP,74,,œ,0.005725,"Jan  6, 2024 19:36:22.024953000 JST",,50494  >  6000 [SYN] Seq=0 Win=64240 Len=0 MSS=1460 SACK_PERM TSval=54186621 TSecr=0 WS=128
28,10.353897,192.168.11.16,192.168.11.17,TCP,74,0.000146,,0.000146,"Jan  6, 2024 19:36:22.025099000 JST",,"6000  >  50494 [SYN, ACK] Seq=0 Ack=1 Win=65160 Len=0 MSS=1460 SACK_PERM TSval=950164333 TSecr=54186621 WS=128"
29,10.365634,192.168.11.17,192.168.11.16,TCP,66,0.011737,,0.011737,"Jan  6, 2024 19:36:22.036836000 JST",,50494  >  6000 [ACK] Seq=1 Ack=1 Win=64256 Len=0 TSval=54186633 TSecr=950164333
30,10.366174,192.168.11.17,192.168.11.16,TCP,93,,,0.00054,"Jan  6, 2024 19:36:22.037376000 JST",,"50494  >  6000 [PSH, ACK] Seq=1 Ack=1 Win=64256 Len=27 TSval=54186633 TSecr=950164333 [TCP segment of a reassembled PDU]"
31,10.366252,192.168.11.16,192.168.11.17,TCP,66,0.000078,,0.000078,"Jan  6, 2024 19:36:22.037454000 JST",,6000  >  50494 [ACK] Seq=1 Ack=28 Win=65152 Len=0 TSval=950164345 TSecr=54186633
32,10.366323,192.168.11.17,192.168.11.16,TCP,66,,,0.000071,"Jan  6, 2024 19:36:22.037525000 JST",,"50494  >  6000 [FIN, ACK] Seq=28 Ack=1 Win=64256 Len=0 TSval=54186633 TSecr=950164333"
33,10.367543,192.168.11.16,192.168.11.17,TCP,66,0.00122,,0.00122,"Jan  6, 2024 19:36:22.038745000 JST",,"6000  >  50494 [FIN, ACK] Seq=1 Ack=29 Win=65152 Len=0 TSval=950164346 TSecr=54186633"
34,10.373746,192.168.11.17,192.168.11.16,TCP,66,0.006203,,0.006203,"Jan  6, 2024 19:36:22.044948000 JST",,50494  >  6000 [ACK] Seq=29 Ack=2 Win=64256 Len=0 TSval=54186641 TSecr=950164346
35,20.184038,192.168.11.16,192.168.11.11,TCP,74,,,9.810292,"Jan  6, 2024 19:36:31.855240000 JST",,57672  >  6000 [SYN] Seq=0 Win=64240 Len=0 MSS=1460 SACK_PERM TSval=1292941070 TSecr=0 WS=128
36,20.190482,192.168.11.11,192.168.11.16,TCP,74,0.006444,,0.006444,"Jan  6, 2024 19:36:31.861684000 JST",,"6000  >  57672 [SYN, ACK] Seq=0 Ack=1 Win=65160 Len=0 MSS=1460 SACK_PERM TSval=4085306056 TSecr=1292941070 WS=128"
37,20.190556,192.168.11.16,192.168.11.11,TCP,66,0.000074,,0.000074,"Jan  6, 2024 19:36:31.861758000 JST",,57672  >  6000 [ACK] Seq=1 Ack=1 Win=64256 Len=0 TSval=1292941076 TSecr=4085306056
38,20.190643,192.168.11.16,192.168.11.11,TCP,93,,,0.000087,"Jan  6, 2024 19:36:31.861845000 JST",,"57672  >  6000 [PSH, ACK] Seq=1 Ack=1 Win=64256 Len=27 TSval=1292941077 TSecr=4085306056 [TCP segment of a reassembled PDU]"
39,20.190706,192.168.11.16,192.168.11.11,TCP,66,,,0.000063,"Jan  6, 2024 19:36:31.861908000 JST",,"57672  >  6000 [FIN, ACK] Seq=28 Ack=1 Win=64256 Len=0 TSval=1292941077 TSecr=4085306056"
40,20.203942,192.168.11.11,192.168.11.16,TCP,66,0.013299,,0.013236,"Jan  6, 2024 19:36:31.875144000 JST",,6000  >  57672 [ACK] Seq=1 Ack=28 Win=65152 Len=0 TSval=4085306067 TSecr=1292941077
41,20.204167,192.168.11.11,192.168.11.16,TCP,66,0.013461,,0.000225,"Jan  6, 2024 19:36:31.875369000 JST",,"6000  >  57672 [FIN, ACK] Seq=1 Ack=29 Win=65152 Len=0 TSval=4085306069 TSecr=1292941077"
42,20.204199,192.168.11.16,192.168.11.11,TCP,66,0.000032,,0.000032,"Jan  6, 2024 19:36:31.875401000 JST",,57672  >  6000 [ACK] Seq=29 Ack=2 Win=64256 Len=0 TSval=1292941090 TSecr=4085306069
43,20.223412,192.168.11.16,255.255.255.255,UDP,209,,Ÿ,0.019213,"Jan  6, 2024 19:36:31.894614000 JST",7b2273656d616e74696373223a207b22656e74697479223a2022504944222c202262617365656e74697479223a2022616e79222c2022726f6c65223a2022717171222c20227370617469616c223a2022616e79222c202274656d706f72616c223a2022616e79227d2c20226461746170726f7065727479223a207b22666f726d6174223a2022696e616f6b615f70726f6772616d5f73616d706c655f73656d616e746963227d7d,46377  >  7000 Len=167
44,20.228869,192.168.11.17,192.168.11.16,TCP,74,,œ,0.005457,"Jan  6, 2024 19:36:31.900071000 JST",,39142  >  6000 [SYN] Seq=0 Win=64240 Len=0 MSS=1460 SACK_PERM TSval=54196496 TSecr=0 WS=128
45,20.228971,192.168.11.16,192.168.11.17,TCP,74,0.000102,,0.000102,"Jan  6, 2024 19:36:31.900173000 JST",,"6000  >  39142 [SYN, ACK] Seq=0 Ack=1 Win=65160 Len=0 MSS=1460 SACK_PERM TSval=950174208 TSecr=54196496 WS=128"
46,20.235322,192.168.11.17,192.168.11.16,TCP,66,0.006351,,0.006351,"Jan  6, 2024 19:36:31.906524000 JST",,39142  >  6000 [ACK] Seq=1 Ack=1 Win=64256 Len=0 TSval=54196503 TSecr=950174208
47,20.235504,192.168.11.17,192.168.11.16,TCP,93,,,0.000182,"Jan  6, 2024 19:36:31.906706000 JST",,"39142  >  6000 [PSH, ACK] Seq=1 Ack=1 Win=64256 Len=27 TSval=54196503 TSecr=950174208 [TCP segment of a reassembled PDU]"
48,20.235541,192.168.11.16,192.168.11.17,TCP,66,0.000037,,0.000037,"Jan  6, 2024 19:36:31.906743000 JST",,6000  >  39142 [ACK] Seq=1 Ack=28 Win=65152 Len=0 TSval=950174214 TSecr=54196503
49,20.236025,192.168.11.17,192.168.11.16,TCP,66,,,0.000484,"Jan  6, 2024 19:36:31.907227000 JST",,"39142  >  6000 [FIN, ACK] Seq=28 Ack=1 Win=64256 Len=0 TSval=54196503 TSecr=950174208"
50,20.236366,192.168.11.16,192.168.11.17,TCP,66,0.000341,,0.000341,"Jan  6, 2024 19:36:31.907568000 JST",,"6000  >  39142 [FIN, ACK] Seq=1 Ack=29 Win=65152 Len=0 TSval=950174215 TSecr=54196503"
51,20.242334,192.168.11.17,192.168.11.16,TCP,66,0.005968,,0.005968,"Jan  6, 2024 19:36:31.913536000 JST",,39142  >  6000 [ACK] Seq=29 Ack=2 Win=64256 Len=0 TSval=54196509 TSecr=950174215
52,30.105338,192.168.11.16,192.168.11.11,TCP,74,,,9.863004,"Jan  6, 2024 19:36:41.776540000 JST",,50154  >  6000 [SYN] Seq=0 Win=64240 Len=0 MSS=1460 SACK_PERM TSval=1292950991 TSecr=0 WS=128
53,30.112488,192.168.11.11,192.168.11.16,TCP,74,0.00715,,0.00715,"Jan  6, 2024 19:36:41.783690000 JST",,"6000  >  50154 [SYN, ACK] Seq=0 Ack=1 Win=65160 Len=0 MSS=1460 SACK_PERM TSval=4085315978 TSecr=1292950991 WS=128"
54,30.112561,192.168.11.16,192.168.11.11,TCP,66,0.000073,,0.000073,"Jan  6, 2024 19:36:41.783763000 JST",,50154  >  6000 [ACK] Seq=1 Ack=1 Win=64256 Len=0 TSval=1292950998 TSecr=4085315978
55,30.112668,192.168.11.16,192.168.11.11,TCP,93,,,0.000107,"Jan  6, 2024 19:36:41.783870000 JST",,"50154  >  6000 [PSH, ACK] Seq=1 Ack=1 Win=64256 Len=27 TSval=1292950999 TSecr=4085315978 [TCP segment of a reassembled PDU]"
56,30.11272,192.168.11.16,192.168.11.11,TCP,66,,,0.000052,"Jan  6, 2024 19:36:41.783922000 JST",,"50154  >  6000 [FIN, ACK] Seq=28 Ack=1 Win=64256 Len=0 TSval=1292950999 TSecr=4085315978"
57,30.119347,192.168.11.11,192.168.11.16,TCP,66,0.006679,,0.006627,"Jan  6, 2024 19:36:41.790549000 JST",,6000  >  50154 [ACK] Seq=1 Ack=28 Win=65152 Len=0 TSval=4085315985 TSecr=1292950999
58,30.119592,192.168.11.11,192.168.11.16,TCP,66,0.006872,,0.000245,"Jan  6, 2024 19:36:41.790794000 JST",,"6000  >  50154 [FIN, ACK] Seq=1 Ack=29 Win=65152 Len=0 TSval=4085315986 TSecr=1292950999"
59,30.119618,192.168.11.16,192.168.11.11,TCP,66,0.000026,,0.000026,"Jan  6, 2024 19:36:41.790820000 JST",,50154  >  6000 [ACK] Seq=29 Ack=2 Win=64256 Len=0 TSval=1292951006 TSecr=4085315986
60,30.137817,192.168.11.16,255.255.255.255,UDP,209,,Ÿ,0.018199,"Jan  6, 2024 19:36:41.809019000 JST",7b2273656d616e74696373223a207b22656e74697479223a2022504944222c202262617365656e74697479223a2022616e79222c2022726f6c65223a2022717171222c20227370617469616c223a2022616e79222c202274656d706f72616c223a2022616e79227d2c20226461746170726f7065727479223a207b22666f726d6174223a2022696e616f6b615f70726f6772616d5f73616d706c655f73656d616e746963227d7d,35040  >  7000 Len=167
61,30.143498,192.168.11.17,192.168.11.16,TCP,74,,œ,0.005681,"Jan  6, 2024 19:36:41.814700000 JST",,35280  >  6000 [SYN] Seq=0 Win=64240 Len=0 MSS=1460 SACK_PERM TSval=54206411 TSecr=0 WS=128
62,30.143624,192.168.11.16,192.168.11.17,TCP,74,0.000126,,0.000126,"Jan  6, 2024 19:36:41.814826000 JST",,"6000  >  35280 [SYN, ACK] Seq=0 Ack=1 Win=65160 Len=0 MSS=1460 SACK_PERM TSval=950184123 TSecr=54206411 WS=128"
63,30.150853,192.168.11.17,192.168.11.16,TCP,66,0.007229,,0.007229,"Jan  6, 2024 19:36:41.822055000 JST",,35280  >  6000 [ACK] Seq=1 Ack=1 Win=64256 Len=0 TSval=54206419 TSecr=950184123
64,30.151161,192.168.11.17,192.168.11.16,TCP,93,,,0.000308,"Jan  6, 2024 19:36:41.822363000 JST",,"35280  >  6000 [PSH, ACK] Seq=1 Ack=1 Win=64256 Len=27 TSval=54206419 TSecr=950184123 [TCP segment of a reassembled PDU]"
65,30.151203,192.168.11.16,192.168.11.17,TCP,66,0.000042,,0.000042,"Jan  6, 2024 19:36:41.822405000 JST",,6000  >  35280 [ACK] Seq=1 Ack=28 Win=65152 Len=0 TSval=950184130 TSecr=54206419
66,30.151235,192.168.11.17,192.168.11.16,TCP,66,,,0.000032,"Jan  6, 2024 19:36:41.822437000 JST",,"35280  >  6000 [FIN, ACK] Seq=28 Ack=1 Win=64256 Len=0 TSval=54206419 TSecr=950184123"
67,30.151942,192.168.11.16,192.168.11.17,TCP,66,0.000707,,0.000707,"Jan  6, 2024 19:36:41.823144000 JST",,"6000  >  35280 [FIN, ACK] Seq=1 Ack=29 Win=65152 Len=0 TSval=950184131 TSecr=54206419"
68,30.158097,192.168.11.17,192.168.11.16,TCP,66,0.006155,,0.006155,"Jan  6, 2024 19:36:41.829299000 JST",,35280  >  6000 [ACK] Seq=29 Ack=2 Win=64256 Len=0 TSval=54206425 TSecr=950184131
69,37.908436,192.168.11.16,192.168.11.11,TCP,74,,,7.750339,"Jan  6, 2024 19:36:49.579638000 JST",,32980  >  6000 [SYN] Seq=0 Win=64240 Len=0 MSS=1460 SACK_PERM TSval=1292958794 TSecr=0 WS=128
70,37.916218,192.168.11.11,192.168.11.16,TCP,74,0.007782,,0.007782,"Jan  6, 2024 19:36:49.587420000 JST",,"6000  >  32980 [SYN, ACK] Seq=0 Ack=1 Win=65160 Len=0 MSS=1460 SACK_PERM TSval=4085323782 TSecr=1292958794 WS=128"
71,37.916332,192.168.11.16,192.168.11.11,TCP,66,0.000114,,0.000114,"Jan  6, 2024 19:36:49.587534000 JST",,32980  >  6000 [ACK] Seq=1 Ack=1 Win=64256 Len=0 TSval=1292958802 TSecr=4085323782
72,37.916524,192.168.11.16,192.168.11.11,TCP,93,,,0.000192,"Jan  6, 2024 19:36:49.587726000 JST",,"32980  >  6000 [PSH, ACK] Seq=1 Ack=1 Win=64256 Len=27 TSval=1292958802 TSecr=4085323782 [TCP segment of a reassembled PDU]"
73,37.916629,192.168.11.16,192.168.11.11,TCP,66,,,0.000105,"Jan  6, 2024 19:36:49.587831000 JST",,"32980  >  6000 [FIN, ACK] Seq=28 Ack=1 Win=64256 Len=0 TSval=1292958803 TSecr=4085323782"
74,37.923826,192.168.11.11,192.168.11.16,TCP,66,0.007302,,0.007197,"Jan  6, 2024 19:36:49.595028000 JST",,6000  >  32980 [ACK] Seq=1 Ack=28 Win=65152 Len=0 TSval=4085323789 TSecr=1292958802
75,37.924215,192.168.11.11,192.168.11.16,TCP,66,0.007586,,0.000389,"Jan  6, 2024 19:36:49.595417000 JST",,"6000  >  32980 [FIN, ACK] Seq=1 Ack=29 Win=65152 Len=0 TSval=4085323791 TSecr=1292958803"
76,37.924271,192.168.11.16,192.168.11.11,TCP,66,0.000056,,0.000056,"Jan  6, 2024 19:36:49.595473000 JST",,32980  >  6000 [ACK] Seq=29 Ack=2 Win=64256 Len=0 TSval=1292958810 TSecr=4085323791
77,37.953768,192.168.11.16,255.255.255.255,UDP,209,,Ÿ,0.029497,"Jan  6, 2024 19:36:49.624970000 JST",7b2273656d616e74696373223a207b22656e74697479223a2022504944222c202262617365656e74697479223a2022616e79222c2022726f6c65223a2022717171222c20227370617469616c223a2022616e79222c202274656d706f72616c223a2022616e79227d2c20226461746170726f7065727479223a207b22666f726d6174223a2022696e616f6b615f70726f6772616d5f73616d706c655f73656d616e746963227d7d,60033  >  7000 Len=167
78,37.959475,192.168.11.17,192.168.11.16,TCP,74,,œ,0.005707,"Jan  6, 2024 19:36:49.630677000 JST",,41796  >  6000 [SYN] Seq=0 Win=64240 Len=0 MSS=1460 SACK_PERM TSval=54214227 TSecr=0 WS=128
79,37.959662,192.168.11.16,192.168.11.17,TCP,74,0.000187,,0.000187,"Jan  6, 2024 19:36:49.630864000 JST",,"6000  >  41796 [SYN, ACK] Seq=0 Ack=1 Win=65160 Len=0 MSS=1460 SACK_PERM TSval=950191939 TSecr=54214227 WS=128"
80,37.966923,192.168.11.17,192.168.11.16,TCP,66,0.007261,,0.007261,"Jan  6, 2024 19:36:49.638125000 JST",,41796  >  6000 [ACK] Seq=1 Ack=1 Win=64256 Len=0 TSval=54214234 TSecr=950191939
81,37.96752,192.168.11.17,192.168.11.16,TCP,93,,,0.000597,"Jan  6, 2024 19:36:49.638722000 JST",,"41796  >  6000 [PSH, ACK] Seq=1 Ack=1 Win=64256 Len=27 TSval=54214234 TSecr=950191939 [TCP segment of a reassembled PDU]"
82,37.967665,192.168.11.16,192.168.11.17,TCP,66,0.000145,,0.000145,"Jan  6, 2024 19:36:49.638867000 JST",,6000  >  41796 [ACK] Seq=1 Ack=28 Win=65152 Len=0 TSval=950191946 TSecr=54214234
83,37.967807,192.168.11.17,192.168.11.16,TCP,66,,,0.000142,"Jan  6, 2024 19:36:49.639009000 JST",,"41796  >  6000 [FIN, ACK] Seq=28 Ack=1 Win=64256 Len=0 TSval=54214235 TSecr=950191939"
84,37.969042,192.168.11.16,192.168.11.17,TCP,66,0.001235,,0.001235,"Jan  6, 2024 19:36:49.640244000 JST",,"6000  >  41796 [FIN, ACK] Seq=1 Ack=29 Win=65152 Len=0 TSval=950191948 TSecr=54214235"
85,37.974947,192.168.11.17,192.168.11.16,TCP,66,0.005905,,0.005905,"Jan  6, 2024 19:36:49.646149000 JST",,41796  >  6000 [ACK] Seq=29 Ack=2 Win=64256 Len=0 TSval=54214242 TSecr=950191948
86,45.715822,192.168.11.16,192.168.11.11,TCP,74,,,7.740875,"Jan  6, 2024 19:36:57.387024000 JST",,58008  >  6000 [SYN] Seq=0 Win=64240 Len=0 MSS=1460 SACK_PERM TSval=1292966602 TSecr=0 WS=128
87,45.724271,192.168.11.11,192.168.11.16,TCP,74,0.008449,,0.008449,"Jan  6, 2024 19:36:57.395473000 JST",,"6000  >  58008 [SYN, ACK] Seq=0 Ack=1 Win=65160 Len=0 MSS=1460 SACK_PERM TSval=4085331589 TSecr=1292966602 WS=128"
88,45.724379,192.168.11.16,192.168.11.11,TCP,66,0.000108,,0.000108,"Jan  6, 2024 19:36:57.395581000 JST",,58008  >  6000 [ACK] Seq=1 Ack=1 Win=64256 Len=0 TSval=1292966610 TSecr=4085331589
89,45.72454,192.168.11.16,192.168.11.11,TCP,93,,,0.000161,"Jan  6, 2024 19:36:57.395742000 JST",,"58008  >  6000 [PSH, ACK] Seq=1 Ack=1 Win=64256 Len=27 TSval=1292966610 TSecr=4085331589 [TCP segment of a reassembled PDU]"
90,45.724666,192.168.11.16,192.168.11.11,TCP,66,,,0.000126,"Jan  6, 2024 19:36:57.395868000 JST",,"58008  >  6000 [FIN, ACK] Seq=28 Ack=1 Win=64256 Len=0 TSval=1292966611 TSecr=4085331589"
91,45.732836,192.168.11.11,192.168.11.16,TCP,66,0.008296,,0.00817,"Jan  6, 2024 19:36:57.404038000 JST",,6000  >  58008 [ACK] Seq=1 Ack=28 Win=65152 Len=0 TSval=4085331598 TSecr=1292966610
92,45.73323,192.168.11.11,192.168.11.16,TCP,66,0.008564,,0.000394,"Jan  6, 2024 19:36:57.404432000 JST",,"6000  >  58008 [FIN, ACK] Seq=1 Ack=29 Win=65152 Len=0 TSval=4085331599 TSecr=1292966611"
93,45.733279,192.168.11.16,192.168.11.11,TCP,66,0.000049,,0.000049,"Jan  6, 2024 19:36:57.404481000 JST",,58008  >  6000 [ACK] Seq=29 Ack=2 Win=64256 Len=0 TSval=1292966619 TSecr=4085331599
94,45.762698,192.168.11.16,255.255.255.255,UDP,209,,Ÿ,0.029419,"Jan  6, 2024 19:36:57.433900000 JST",7b2273656d616e74696373223a207b22656e74697479223a2022504944222c202262617365656e74697479223a2022616e79222c2022726f6c65223a2022717171222c20227370617469616c223a2022616e79222c202274656d706f72616c223a2022616e79227d2c20226461746170726f7065727479223a207b22666f726d6174223a2022696e616f6b615f70726f6772616d5f73616d706c655f73656d616e746963227d7d,39685  >  7000 Len=167
95,45.769156,192.168.11.17,192.168.11.16,TCP,74,,œ,0.006458,"Jan  6, 2024 19:36:57.440358000 JST",,41804  >  6000 [SYN] Seq=0 Win=64240 Len=0 MSS=1460 SACK_PERM TSval=54222036 TSecr=0 WS=128
96,45.769301,192.168.11.16,192.168.11.17,TCP,74,0.000145,,0.000145,"Jan  6, 2024 19:36:57.440503000 JST",,"6000  >  41804 [SYN, ACK] Seq=0 Ack=1 Win=65160 Len=0 MSS=1460 SACK_PERM TSval=950199748 TSecr=54222036 WS=128"
97,45.776051,192.168.11.17,192.168.11.16,TCP,66,0.00675,,0.00675,"Jan  6, 2024 19:36:57.447253000 JST",,41804  >  6000 [ACK] Seq=1 Ack=1 Win=64256 Len=0 TSval=54222043 TSecr=950199748
98,45.776481,192.168.11.17,192.168.11.16,TCP,93,,,0.00043,"Jan  6, 2024 19:36:57.447683000 JST",,"41804  >  6000 [PSH, ACK] Seq=1 Ack=1 Win=64256 Len=27 TSval=54222043 TSecr=950199748 [TCP segment of a reassembled PDU]"
99,45.776551,192.168.11.16,192.168.11.17,TCP,66,0.00007,,0.00007,"Jan  6, 2024 19:36:57.447753000 JST",,6000  >  41804 [ACK] Seq=1 Ack=28 Win=65152 Len=0 TSval=950199755 TSecr=54222043
100,45.776616,192.168.11.17,192.168.11.16,TCP,66,,,0.000065,"Jan  6, 2024 19:36:57.447818000 JST",,"41804  >  6000 [FIN, ACK] Seq=28 Ack=1 Win=64256 Len=0 TSval=54222044 TSecr=950199748"
101,45.77749,192.168.11.16,192.168.11.17,TCP,66,0.000874,,0.000874,"Jan  6, 2024 19:36:57.448692000 JST",,"6000  >  41804 [FIN, ACK] Seq=1 Ack=29 Win=65152 Len=0 TSval=950199756 TSecr=54222044"
102,45.782879,192.168.11.17,192.168.11.16,TCP,66,0.005389,,0.005389,"Jan  6, 2024 19:36:57.454081000 JST",,41804  >  6000 [ACK] Seq=29 Ack=2 Win=64256 Len=0 TSval=54222051 TSecr=950199756
103,53.580169,192.168.11.16,192.168.11.11,TCP,74,,,7.79729,"Jan  6, 2024 19:37:05.251371000 JST",,58022  >  6000 [SYN] Seq=0 Win=64240 Len=0 MSS=1460 SACK_PERM TSval=1292974466 TSecr=0 WS=128
104,53.586838,192.168.11.11,192.168.11.16,TCP,74,0.006669,,0.006669,"Jan  6, 2024 19:37:05.258040000 JST",,"6000  >  58022 [SYN, ACK] Seq=0 Ack=1 Win=65160 Len=0 MSS=1460 SACK_PERM TSval=4085339453 TSecr=1292974466 WS=128"
105,53.586951,192.168.11.16,192.168.11.11,TCP,66,0.000113,,0.000113,"Jan  6, 2024 19:37:05.258153000 JST",,58022  >  6000 [ACK] Seq=1 Ack=1 Win=64256 Len=0 TSval=1292974473 TSecr=4085339453
106,53.5871,192.168.11.16,192.168.11.11,TCP,93,,,0.000149,"Jan  6, 2024 19:37:05.258302000 JST",,"58022  >  6000 [PSH, ACK] Seq=1 Ack=1 Win=64256 Len=27 TSval=1292974473 TSecr=4085339453 [TCP segment of a reassembled PDU]"
107,53.587201,192.168.11.16,192.168.11.11,TCP,66,,,0.000101,"Jan  6, 2024 19:37:05.258403000 JST",,"58022  >  6000 [FIN, ACK] Seq=28 Ack=1 Win=64256 Len=0 TSval=1292974473 TSecr=4085339453"
108,53.594835,192.168.11.11,192.168.11.16,TCP,66,0.007735,,0.007634,"Jan  6, 2024 19:37:05.266037000 JST",,6000  >  58022 [ACK] Seq=1 Ack=28 Win=65152 Len=0 TSval=4085339460 TSecr=1292974473
109,53.595217,192.168.11.11,192.168.11.16,TCP,66,0.008016,,0.000382,"Jan  6, 2024 19:37:05.266419000 JST",,"6000  >  58022 [FIN, ACK] Seq=1 Ack=29 Win=65152 Len=0 TSval=4085339461 TSecr=1292974473"
110,53.595263,192.168.11.16,192.168.11.11,TCP,66,0.000046,,0.000046,"Jan  6, 2024 19:37:05.266465000 JST",,58022  >  6000 [ACK] Seq=29 Ack=2 Win=64256 Len=0 TSval=1292974481 TSecr=4085339461
111,53.627078,192.168.11.16,255.255.255.255,UDP,209,,Ÿ,0.031815,"Jan  6, 2024 19:37:05.298280000 JST",7b2273656d616e74696373223a207b22656e74697479223a2022504944222c202262617365656e74697479223a2022616e79222c2022726f6c65223a2022717171222c20227370617469616c223a2022616e79222c202274656d706f72616c223a2022616e79227d2c20226461746170726f7065727479223a207b22666f726d6174223a2022696e616f6b615f70726f6772616d5f73616d706c655f73656d616e746963227d7d,38965  >  7000 Len=167
112,53.633842,192.168.11.17,192.168.11.16,TCP,74,,œ,0.006764,"Jan  6, 2024 19:37:05.305044000 JST",,41240  >  6000 [SYN] Seq=0 Win=64240 Len=0 MSS=1460 SACK_PERM TSval=54229900 TSecr=0 WS=128
113,53.633969,192.168.11.16,192.168.11.17,TCP,74,0.000127,,0.000127,"Jan  6, 2024 19:37:05.305171000 JST",,"6000  >  41240 [SYN, ACK] Seq=0 Ack=1 Win=65160 Len=0 MSS=1460 SACK_PERM TSval=950207613 TSecr=54229900 WS=128"
114,53.640591,192.168.11.17,192.168.11.16,TCP,66,0.006622,,0.006622,"Jan  6, 2024 19:37:05.311793000 JST",,41240  >  6000 [ACK] Seq=1 Ack=1 Win=64256 Len=0 TSval=54229908 TSecr=950207613
115,53.641066,192.168.11.17,192.168.11.16,TCP,93,,,0.000475,"Jan  6, 2024 19:37:05.312268000 JST",,"41240  >  6000 [PSH, ACK] Seq=1 Ack=1 Win=64256 Len=27 TSval=54229908 TSecr=950207613 [TCP segment of a reassembled PDU]"
116,53.641124,192.168.11.16,192.168.11.17,TCP,66,0.000058,,0.000058,"Jan  6, 2024 19:37:05.312326000 JST",,6000  >  41240 [ACK] Seq=1 Ack=28 Win=65152 Len=0 TSval=950207620 TSecr=54229908
117,53.641187,192.168.11.17,192.168.11.16,TCP,66,,,0.000063,"Jan  6, 2024 19:37:05.312389000 JST",,"41240  >  6000 [FIN, ACK] Seq=28 Ack=1 Win=64256 Len=0 TSval=54229908 TSecr=950207613"
118,53.642241,192.168.11.16,192.168.11.17,TCP,66,0.001054,,0.001054,"Jan  6, 2024 19:37:05.313443000 JST",,"6000  >  41240 [FIN, ACK] Seq=1 Ack=29 Win=65152 Len=0 TSval=950207621 TSecr=54229908"
119,53.648494,192.168.11.17,192.168.11.16,TCP,66,0.006253,,0.006253,"Jan  6, 2024 19:37:05.319696000 JST",,41240  >  6000 [ACK] Seq=29 Ack=2 Win=64256 Len=0 TSval=54229916 TSecr=950207621
120,61.878288,192.168.11.16,192.168.11.11,TCP,74,,,8.229794,"Jan  6, 2024 19:37:13.549490000 JST",,39178  >  6000 [SYN] Seq=0 Win=64240 Len=0 MSS=1460 SACK_PERM TSval=1292982764 TSecr=0 WS=128
121,61.884908,192.168.11.11,192.168.11.16,TCP,74,0.00662,,0.00662,"Jan  6, 2024 19:37:13.556110000 JST",,"6000  >  39178 [SYN, ACK] Seq=0 Ack=1 Win=65160 Len=0 MSS=1460 SACK_PERM TSval=4085347751 TSecr=1292982764 WS=128"
122,61.885012,192.168.11.16,192.168.11.11,TCP,66,0.000104,,0.000104,"Jan  6, 2024 19:37:13.556214000 JST",,39178  >  6000 [ACK] Seq=1 Ack=1 Win=64256 Len=0 TSval=1292982771 TSecr=4085347751
123,61.885148,192.168.11.16,192.168.11.11,TCP,93,,,0.000136,"Jan  6, 2024 19:37:13.556350000 JST",,"39178  >  6000 [PSH, ACK] Seq=1 Ack=1 Win=64256 Len=27 TSval=1292982771 TSecr=4085347751 [TCP segment of a reassembled PDU]"
124,61.885253,192.168.11.16,192.168.11.11,TCP,66,,,0.000105,"Jan  6, 2024 19:37:13.556455000 JST",,"39178  >  6000 [FIN, ACK] Seq=28 Ack=1 Win=64256 Len=0 TSval=1292982771 TSecr=4085347751"
125,61.892478,192.168.11.11,192.168.11.16,TCP,66,0.00733,,0.007225,"Jan  6, 2024 19:37:13.563680000 JST",,6000  >  39178 [ACK] Seq=1 Ack=28 Win=65152 Len=0 TSval=4085347758 TSecr=1292982771
126,61.892697,192.168.11.11,192.168.11.16,TCP,66,0.007444,,0.000219,"Jan  6, 2024 19:37:13.563899000 JST",,"6000  >  39178 [FIN, ACK] Seq=1 Ack=29 Win=65152 Len=0 TSval=4085347759 TSecr=1292982771"
127,61.892745,192.168.11.16,192.168.11.11,TCP,66,0.000048,,0.000048,"Jan  6, 2024 19:37:13.563947000 JST",,39178  >  6000 [ACK] Seq=29 Ack=2 Win=64256 Len=0 TSval=1292982779 TSecr=4085347759
128,61.921878,192.168.11.16,255.255.255.255,UDP,209,,Ÿ,0.029133,"Jan  6, 2024 19:37:13.593080000 JST",7b2273656d616e74696373223a207b22656e74697479223a2022504944222c202262617365656e74697479223a2022616e79222c2022726f6c65223a2022717171222c20227370617469616c223a2022616e79222c202274656d706f72616c223a2022616e79227d2c20226461746170726f7065727479223a207b22666f726d6174223a2022696e616f6b615f70726f6772616d5f73616d706c655f73656d616e746963227d7d,50855  >  7000 Len=167
129,61.93102,192.168.11.17,192.168.11.16,TCP,74,,œ,0.009142,"Jan  6, 2024 19:37:13.602222000 JST",,53596  >  6000 [SYN] Seq=0 Win=64240 Len=0 MSS=1460 SACK_PERM TSval=54238195 TSecr=0 WS=128
130,61.93117,192.168.11.16,192.168.11.17,TCP,74,0.00015,,0.00015,"Jan  6, 2024 19:37:13.602372000 JST",,"6000  >  53596 [SYN, ACK] Seq=0 Ack=1 Win=65160 Len=0 MSS=1460 SACK_PERM TSval=950215910 TSecr=54238195 WS=128"
131,61.9381,192.168.11.17,192.168.11.16,TCP,66,0.00693,,0.00693,"Jan  6, 2024 19:37:13.609302000 JST",,53596  >  6000 [ACK] Seq=1 Ack=1 Win=64256 Len=0 TSval=54238206 TSecr=950215910
132,61.938653,192.168.11.17,192.168.11.16,TCP,93,,,0.000553,"Jan  6, 2024 19:37:13.609855000 JST",,"53596  >  6000 [PSH, ACK] Seq=1 Ack=1 Win=64256 Len=27 TSval=54238206 TSecr=950215910 [TCP segment of a reassembled PDU]"
133,61.938738,192.168.11.16,192.168.11.17,TCP,66,0.000085,,0.000085,"Jan  6, 2024 19:37:13.609940000 JST",,6000  >  53596 [ACK] Seq=1 Ack=28 Win=65152 Len=0 TSval=950215918 TSecr=54238206
134,61.938807,192.168.11.17,192.168.11.16,TCP,66,,,0.000069,"Jan  6, 2024 19:37:13.610009000 JST",,"53596  >  6000 [FIN, ACK] Seq=28 Ack=1 Win=64256 Len=0 TSval=54238206 TSecr=950215910"
135,61.940091,192.168.11.16,192.168.11.17,TCP,66,0.001284,,0.001284,"Jan  6, 2024 19:37:13.611293000 JST",,"6000  >  53596 [FIN, ACK] Seq=1 Ack=29 Win=65152 Len=0 TSval=950215919 TSecr=54238206"
136,61.946418,192.168.11.17,192.168.11.16,TCP,66,0.006327,,0.006327,"Jan  6, 2024 19:37:13.617620000 JST",,53596  >  6000 [ACK] Seq=29 Ack=2 Win=64256 Len=0 TSval=54238213 TSecr=950215919
137,72.80814,192.168.11.16,192.168.11.11,TCP,74,,,10.861722,"Jan  6, 2024 19:37:24.479342000 JST",,45674  >  6000 [SYN] Seq=0 Win=64240 Len=0 MSS=1460 SACK_PERM TSval=1292993694 TSecr=0 WS=128
138,72.81488,192.168.11.11,192.168.11.16,TCP,74,0.00674,,0.00674,"Jan  6, 2024 19:37:24.486082000 JST",,"6000  >  45674 [SYN, ACK] Seq=0 Ack=1 Win=65160 Len=0 MSS=1460 SACK_PERM TSval=4085358681 TSecr=1292993694 WS=128"
139,72.814986,192.168.11.16,192.168.11.11,TCP,66,0.000106,,0.000106,"Jan  6, 2024 19:37:24.486188000 JST",,45674  >  6000 [ACK] Seq=1 Ack=1 Win=64256 Len=0 TSval=1292993701 TSecr=4085358681
140,72.81513,192.168.11.16,192.168.11.11,TCP,93,,,0.000144,"Jan  6, 2024 19:37:24.486332000 JST",,"45674  >  6000 [PSH, ACK] Seq=1 Ack=1 Win=64256 Len=27 TSval=1292993701 TSecr=4085358681 [TCP segment of a reassembled PDU]"
141,72.815235,192.168.11.16,192.168.11.11,TCP,66,,,0.000105,"Jan  6, 2024 19:37:24.486437000 JST",,"45674  >  6000 [FIN, ACK] Seq=28 Ack=1 Win=64256 Len=0 TSval=1292993701 TSecr=4085358681"
142,72.82196,192.168.11.11,192.168.11.16,TCP,66,0.00683,,0.006725,"Jan  6, 2024 19:37:24.493162000 JST",,6000  >  45674 [ACK] Seq=1 Ack=28 Win=65152 Len=0 TSval=4085358688 TSecr=1292993701
143,72.822363,192.168.11.11,192.168.11.16,TCP,66,0.007128,,0.000403,"Jan  6, 2024 19:37:24.493565000 JST",,"6000  >  45674 [FIN, ACK] Seq=1 Ack=29 Win=65152 Len=0 TSval=4085358689 TSecr=1292993701"
144,72.822414,192.168.11.16,192.168.11.11,TCP,66,0.000051,,0.000051,"Jan  6, 2024 19:37:24.493616000 JST",,45674  >  6000 [ACK] Seq=29 Ack=2 Win=64256 Len=0 TSval=1292993708 TSecr=4085358689
145,72.854331,192.168.11.16,255.255.255.255,UDP,209,,Ÿ,0.031917,"Jan  6, 2024 19:37:24.525533000 JST",7b2273656d616e74696373223a207b22656e74697479223a2022504944222c202262617365656e74697479223a2022616e79222c2022726f6c65223a2022717171222c20227370617469616c223a2022616e79222c202274656d706f72616c223a2022616e79227d2c20226461746170726f7065727479223a207b22666f726d6174223a2022696e616f6b615f70726f6772616d5f73616d706c655f73656d616e746963227d7d,36463  >  7000 Len=167
146,72.860114,192.168.11.17,192.168.11.16,TCP,74,,œ,0.005783,"Jan  6, 2024 19:37:24.531316000 JST",,32994  >  6000 [SYN] Seq=0 Win=64240 Len=0 MSS=1460 SACK_PERM TSval=54249127 TSecr=0 WS=128
147,72.860268,192.168.11.16,192.168.11.17,TCP,74,0.000154,,0.000154,"Jan  6, 2024 19:37:24.531470000 JST",,"6000  >  32994 [SYN, ACK] Seq=0 Ack=1 Win=65160 Len=0 MSS=1460 SACK_PERM TSval=950226839 TSecr=54249127 WS=128"
148,72.872351,192.168.11.17,192.168.11.16,TCP,66,0.012083,,0.012083,"Jan  6, 2024 19:37:24.543553000 JST",,32994  >  6000 [ACK] Seq=1 Ack=1 Win=64256 Len=0 TSval=54249139 TSecr=950226839
149,72.872942,192.168.11.17,192.168.11.16,TCP,93,,,0.000591,"Jan  6, 2024 19:37:24.544144000 JST",,"32994  >  6000 [PSH, ACK] Seq=1 Ack=1 Win=64256 Len=27 TSval=54249139 TSecr=950226839 [TCP segment of a reassembled PDU]"
150,72.87303,192.168.11.16,192.168.11.17,TCP,66,0.000088,,0.000088,"Jan  6, 2024 19:37:24.544232000 JST",,6000  >  32994 [ACK] Seq=1 Ack=28 Win=65152 Len=0 TSval=950226852 TSecr=54249139
151,72.87311,192.168.11.17,192.168.11.16,TCP,66,,,0.00008,"Jan  6, 2024 19:37:24.544312000 JST",,"32994  >  6000 [FIN, ACK] Seq=28 Ack=1 Win=64256 Len=0 TSval=54249140 TSecr=950226839"
152,72.874431,192.168.11.16,192.168.11.17,TCP,66,0.001321,,0.001321,"Jan  6, 2024 19:37:24.545633000 JST",,"6000  >  32994 [FIN, ACK] Seq=1 Ack=29 Win=65152 Len=0 TSval=950226853 TSecr=54249140"
153,72.880221,192.168.11.17,192.168.11.16,TCP,66,0.00579,,0.00579,"Jan  6, 2024 19:37:24.551423000 JST",,32994  >  6000 [ACK] Seq=29 Ack=2 Win=64256 Len=0 TSval=54249147 TSecr=950226853
154,82.700371,192.168.11.16,192.168.11.11,TCP,74,,,9.82015,"Jan  6, 2024 19:37:34.371573000 JST",,54894  >  6000 [SYN] Seq=0 Win=64240 Len=0 MSS=1460 SACK_PERM TSval=1293003586 TSecr=0 WS=128
155,82.707047,192.168.11.11,192.168.11.16,TCP,74,0.006676,,0.006676,"Jan  6, 2024 19:37:34.378249000 JST",,"6000  >  54894 [SYN, ACK] Seq=0 Ack=1 Win=65160 Len=0 MSS=1460 SACK_PERM TSval=4085368573 TSecr=1293003586 WS=128"
156,82.707162,192.168.11.16,192.168.11.11,TCP,66,0.000115,,0.000115,"Jan  6, 2024 19:37:34.378364000 JST",,54894  >  6000 [ACK] Seq=1 Ack=1 Win=64256 Len=0 TSval=1293003593 TSecr=4085368573
157,82.707339,192.168.11.16,192.168.11.11,TCP,93,,,0.000177,"Jan  6, 2024 19:37:34.378541000 JST",,"54894  >  6000 [PSH, ACK] Seq=1 Ack=1 Win=64256 Len=27 TSval=1293003593 TSecr=4085368573 [TCP segment of a reassembled PDU]"
158,82.70744,192.168.11.16,192.168.11.11,TCP,66,,,0.000101,"Jan  6, 2024 19:37:34.378642000 JST",,"54894  >  6000 [FIN, ACK] Seq=28 Ack=1 Win=64256 Len=0 TSval=1293003593 TSecr=4085368573"
159,82.714947,192.168.11.11,192.168.11.16,TCP,66,0.007608,,0.007507,"Jan  6, 2024 19:37:34.386149000 JST",,6000  >  54894 [ACK] Seq=1 Ack=28 Win=65152 Len=0 TSval=4085368580 TSecr=1293003593
160,82.716905,192.168.11.11,192.168.11.16,TCP,66,0.009465,,0.001958,"Jan  6, 2024 19:37:34.388107000 JST",,"6000  >  54894 [FIN, ACK] Seq=1 Ack=29 Win=65152 Len=0 TSval=4085368582 TSecr=1293003593"
161,82.716951,192.168.11.16,192.168.11.11,TCP,66,0.000046,,0.000046,"Jan  6, 2024 19:37:34.388153000 JST",,54894  >  6000 [ACK] Seq=29 Ack=2 Win=64256 Len=0 TSval=1293003603 TSecr=4085368582
162,82.75018,192.168.11.16,255.255.255.255,UDP,209,,Ÿ,0.033229,"Jan  6, 2024 19:37:34.421382000 JST",7b2273656d616e74696373223a207b22656e74697479223a2022504944222c202262617365656e74697479223a2022616e79222c2022726f6c65223a2022717171222c20227370617469616c223a2022616e79222c202274656d706f72616c223a2022616e79227d2c20226461746170726f7065727479223a207b22666f726d6174223a2022696e616f6b615f70726f6772616d5f73616d706c655f73656d616e746963227d7d,46178  >  7000 Len=167
163,82.756853,192.168.11.17,192.168.11.16,TCP,74,,œ,0.006673,"Jan  6, 2024 19:37:34.428055000 JST",,34642  >  6000 [SYN] Seq=0 Win=64240 Len=0 MSS=1460 SACK_PERM TSval=54259023 TSecr=0 WS=128
164,82.757003,192.168.11.16,192.168.11.17,TCP,74,0.00015,,0.00015,"Jan  6, 2024 19:37:34.428205000 JST",,"6000  >  34642 [SYN, ACK] Seq=0 Ack=1 Win=65160 Len=0 MSS=1460 SACK_PERM TSval=950236736 TSecr=54259023 WS=128"
165,82.763711,192.168.11.17,192.168.11.16,TCP,66,0.006708,,0.006708,"Jan  6, 2024 19:37:34.434913000 JST",,34642  >  6000 [ACK] Seq=1 Ack=1 Win=64256 Len=0 TSval=54259031 TSecr=950236736
166,82.764245,192.168.11.17,192.168.11.16,TCP,93,,,0.000534,"Jan  6, 2024 19:37:34.435447000 JST",,"34642  >  6000 [PSH, ACK] Seq=1 Ack=1 Win=64256 Len=27 TSval=54259031 TSecr=950236736 [TCP segment of a reassembled PDU]"
167,82.764332,192.168.11.16,192.168.11.17,TCP,66,0.000087,,0.000087,"Jan  6, 2024 19:37:34.435534000 JST",,6000  >  34642 [ACK] Seq=1 Ack=28 Win=65152 Len=0 TSval=950236743 TSecr=54259031
168,82.764405,192.168.11.17,192.168.11.16,TCP,66,,,0.000073,"Jan  6, 2024 19:37:34.435607000 JST",,"34642  >  6000 [FIN, ACK] Seq=28 Ack=1 Win=64256 Len=0 TSval=54259031 TSecr=950236736"
169,82.765682,192.168.11.16,192.168.11.17,TCP,66,0.001277,,0.001277,"Jan  6, 2024 19:37:34.436884000 JST",,"6000  >  34642 [FIN, ACK] Seq=1 Ack=29 Win=65152 Len=0 TSval=950236745 TSecr=54259031"
170,82.771942,192.168.11.17,192.168.11.16,TCP,66,0.00626,,0.00626,"Jan  6, 2024 19:37:34.443144000 JST",,34642  >  6000 [ACK] Seq=29 Ack=2 Win=64256 Len=0 TSval=54259039 TSecr=950236745
171,114.881318,192.168.11.16,192.168.11.11,TCP,74,,,32.109376,"Jan  6, 2024 19:38:06.552520000 JST",,54188  >  6000 [SYN] Seq=0 Win=64240 Len=0 MSS=1460 SACK_PERM TSval=1293035767 TSecr=0 WS=128
172,114.888385,192.168.11.11,192.168.11.16,TCP,74,0.007067,,0.007067,"Jan  6, 2024 19:38:06.559587000 JST",,"6000  >  54188 [SYN, ACK] Seq=0 Ack=1 Win=65160 Len=0 MSS=1460 SACK_PERM TSval=4085400754 TSecr=1293035767 WS=128"
173,114.888519,192.168.11.16,192.168.11.11,TCP,66,0.000134,,0.000134,"Jan  6, 2024 19:38:06.559721000 JST",,54188  >  6000 [ACK] Seq=1 Ack=1 Win=64256 Len=0 TSval=1293035774 TSecr=4085400754
174,114.888665,192.168.11.16,192.168.11.11,TCP,93,,,0.000146,"Jan  6, 2024 19:38:06.559867000 JST",,"54188  >  6000 [PSH, ACK] Seq=1 Ack=1 Win=64256 Len=27 TSval=1293035775 TSecr=4085400754 [TCP segment of a reassembled PDU]"
175,114.888787,192.168.11.16,192.168.11.11,TCP,66,,,0.000122,"Jan  6, 2024 19:38:06.559989000 JST",,"54188  >  6000 [FIN, ACK] Seq=28 Ack=1 Win=64256 Len=0 TSval=1293035775 TSecr=4085400754"
176,114.896044,192.168.11.11,192.168.11.16,TCP,66,0.007379,,0.007257,"Jan  6, 2024 19:38:06.567246000 JST",,6000  >  54188 [ACK] Seq=1 Ack=28 Win=65152 Len=0 TSval=4085400762 TSecr=1293035775
177,114.896273,192.168.11.11,192.168.11.16,TCP,66,0.007486,,0.000229,"Jan  6, 2024 19:38:06.567475000 JST",,"6000  >  54188 [FIN, ACK] Seq=1 Ack=29 Win=65152 Len=0 TSval=4085400764 TSecr=1293035775"
178,114.896318,192.168.11.16,192.168.11.11,TCP,66,0.000045,,0.000045,"Jan  6, 2024 19:38:06.567520000 JST",,54188  >  6000 [ACK] Seq=29 Ack=2 Win=64256 Len=0 TSval=1293035782 TSecr=4085400764
179,114.927976,192.168.11.16,255.255.255.255,UDP,209,,Ÿ,0.031658,"Jan  6, 2024 19:38:06.599178000 JST",7b2273656d616e74696373223a207b22656e74697479223a2022504944222c202262617365656e74697479223a2022616e79222c2022726f6c65223a2022717171222c20227370617469616c223a2022616e79222c202274656d706f72616c223a2022616e79227d2c20226461746170726f7065727479223a207b22666f726d6174223a2022696e616f6b615f70726f6772616d5f73616d706c655f73656d616e746963227d7d,42914  >  7000 Len=167
180,114.933533,192.168.11.17,192.168.11.16,TCP,74,,œ,0.005557,"Jan  6, 2024 19:38:06.604735000 JST",,54058  >  6000 [SYN] Seq=0 Win=64240 Len=0 MSS=1460 SACK_PERM TSval=54291201 TSecr=0 WS=128
181,114.933646,192.168.11.16,192.168.11.17,TCP,74,0.000113,,0.000113,"Jan  6, 2024 19:38:06.604848000 JST",,"6000  >  54058 [SYN, ACK] Seq=0 Ack=1 Win=65160 Len=0 MSS=1460 SACK_PERM TSval=950268913 TSecr=54291201 WS=128"
182,114.940249,192.168.11.17,192.168.11.16,TCP,66,0.006603,,0.006603,"Jan  6, 2024 19:38:06.611451000 JST",,54058  >  6000 [ACK] Seq=1 Ack=1 Win=64256 Len=0 TSval=54291208 TSecr=950268913
183,114.940747,192.168.11.17,192.168.11.16,TCP,93,,,0.000498,"Jan  6, 2024 19:38:06.611949000 JST",,"54058  >  6000 [PSH, ACK] Seq=1 Ack=1 Win=64256 Len=27 TSval=54291208 TSecr=950268913 [TCP segment of a reassembled PDU]"
184,114.940816,192.168.11.16,192.168.11.17,TCP,66,0.000069,,0.000069,"Jan  6, 2024 19:38:06.612018000 JST",,6000  >  54058 [ACK] Seq=1 Ack=28 Win=65152 Len=0 TSval=950268920 TSecr=54291208
185,114.940877,192.168.11.17,192.168.11.16,TCP,66,,,0.000061,"Jan  6, 2024 19:38:06.612079000 JST",,"54058  >  6000 [FIN, ACK] Seq=28 Ack=1 Win=64256 Len=0 TSval=54291208 TSecr=950268913"
