No.,Time,Source,Destination,Protocol,Length,The RTT to ACK the segment was,XXX,Time delta from previous captured frame,Arrival Time,Data,Info
1,0,192.168.11.17,192.168.11.16,TCP,74,,,0,"Jan  6, 2024 19:36:11.713694000 JST",,37496  >  6000 [SYN] Seq=0 Win=64240 Len=0 MSS=1460 SACK_PERM TSval=54176311 TSecr=0 WS=128
2,0.006367,192.168.11.16,192.168.11.17,TCP,74,0.006367,,0.006367,"Jan  6, 2024 19:36:11.720061000 JST",,"6000  >  37496 [SYN, ACK] Seq=0 Ack=1 Win=65160 Len=0 MSS=1460 SACK_PERM TSval=950154025 TSecr=54176311 WS=128"
3,0.006495,192.168.11.17,192.168.11.16,TCP,66,0.000128,,0.000128,"Jan  6, 2024 19:36:11.720189000 JST",,37496  >  6000 [ACK] Seq=1 Ack=1 Win=64256 Len=0 TSval=54176320 TSecr=950154025
4,0.006706,192.168.11.17,192.168.11.16,TCP,93,,,0.000211,"Jan  6, 2024 19:36:11.720400000 JST",,"37496  >  6000 [PSH, ACK] Seq=1 Ack=1 Win=64256 Len=27 TSval=54176320 TSecr=950154025 [TCP segment of a reassembled PDU]"
5,0.006845,192.168.11.17,192.168.11.16,TCP,66,,,0.000139,"Jan  6, 2024 19:36:11.720539000 JST",,"37496  >  6000 [FIN, ACK] Seq=28 Ack=1 Win=64256 Len=0 TSval=54176321 TSecr=950154025"
6,0.013759,192.168.11.16,192.168.11.17,TCP,66,0.007053,,0.006914,"Jan  6, 2024 19:36:11.727453000 JST",,6000  >  37496 [ACK] Seq=1 Ack=28 Win=65152 Len=0 TSval=950154032 TSecr=54176320
7,0.014025,192.168.11.16,192.168.11.17,TCP,66,0.00718,,0.000266,"Jan  6, 2024 19:36:11.727719000 JST",,"6000  >  37496 [FIN, ACK] Seq=1 Ack=29 Win=65152 Len=0 TSval=950154034 TSecr=54176321"
8,0.014071,192.168.11.17,192.168.11.16,TCP,66,0.000046,,0.000046,"Jan  6, 2024 19:36:11.727765000 JST",,37496  >  6000 [ACK] Seq=29 Ack=2 Win=64256 Len=0 TSval=54176328 TSecr=950154034
9,0.045741,192.168.11.17,255.255.255.255,UDP,209,,Ÿ,0.03167,"Jan  6, 2024 19:36:11.759435000 JST",7b2273656d616e74696373223a207b22656e74697479223a2022504944222c202262617365656e74697479223a2022616e79222c2022726f6c65223a2022727272222c20227370617469616c223a2022616e79222c202274656d706f72616c223a2022616e79227d2c20226461746170726f7065727479223a207b22666f726d6174223a2022696e616f6b615f70726f6772616d5f73616d706c655f73656d616e746963227d7d,59376  >  7000 Len=167
10,0.056274,192.168.11.19,192.168.11.17,TCP,74,,œ,0.010533,"Jan  6, 2024 19:36:11.769968000 JST",,60142  >  6000 [SYN] Seq=0 Win=64240 Len=0 MSS=1460 SACK_PERM TSval=2676159512 TSecr=0 WS=128
11,0.056444,192.168.11.17,192.168.11.19,TCP,74,0.00017,,0.00017,"Jan  6, 2024 19:36:11.770138000 JST",,"6000  >  60142 [SYN, ACK] Seq=0 Ack=1 Win=65160 Len=0 MSS=1460 SACK_PERM TSval=2210618491 TSecr=2676159512 WS=128"
12,0.063557,192.168.11.19,192.168.11.17,TCP,66,0.007113,,0.007113,"Jan  6, 2024 19:36:11.777251000 JST",,60142  >  6000 [ACK] Seq=1 Ack=1 Win=64256 Len=0 TSval=2676159524 TSecr=2210618491
13,0.064238,192.168.11.19,192.168.11.17,TCP,93,,,0.000681,"Jan  6, 2024 19:36:11.777932000 JST",,"60142  >  6000 [PSH, ACK] Seq=1 Ack=1 Win=64256 Len=27 TSval=2676159524 TSecr=2210618491 [TCP segment of a reassembled PDU]"
14,0.064356,192.168.11.17,192.168.11.19,TCP,66,0.000118,,0.000118,"Jan  6, 2024 19:36:11.778050000 JST",,6000  >  60142 [ACK] Seq=1 Ack=28 Win=65152 Len=0 TSval=2210618499 TSecr=2676159524
15,0.064439,192.168.11.19,192.168.11.17,TCP,66,,,0.000083,"Jan  6, 2024 19:36:11.778133000 JST",,"60142  >  6000 [FIN, ACK] Seq=28 Ack=1 Win=64256 Len=0 TSval=2676159524 TSecr=2210618491"
16,0.066822,192.168.11.17,192.168.11.19,TCP,66,0.002383,,0.002383,"Jan  6, 2024 19:36:11.780516000 JST",,"6000  >  60142 [FIN, ACK] Seq=1 Ack=29 Win=65152 Len=0 TSval=2210618501 TSecr=2676159524"
17,0.074437,192.168.11.19,192.168.11.17,TCP,66,0.007615,,0.007615,"Jan  6, 2024 19:36:11.788131000 JST",,60142  >  6000 [ACK] Seq=29 Ack=2 Win=64256 Len=0 TSval=2676159534 TSecr=2210618501
18,10.307513,192.168.11.17,192.168.11.16,TCP,74,,,10.233076,"Jan  6, 2024 19:36:22.021207000 JST",,50494  >  6000 [SYN] Seq=0 Win=64240 Len=0 MSS=1460 SACK_PERM TSval=54186621 TSecr=0 WS=128
19,10.31918,192.168.11.16,192.168.11.17,TCP,74,0.011667,,0.011667,"Jan  6, 2024 19:36:22.032874000 JST",,"6000  >  50494 [SYN, ACK] Seq=0 Ack=1 Win=65160 Len=0 MSS=1460 SACK_PERM TSval=950164333 TSecr=54186621 WS=128"
20,10.319298,192.168.11.17,192.168.11.16,TCP,66,0.000118,,0.000118,"Jan  6, 2024 19:36:22.032992000 JST",,50494  >  6000 [ACK] Seq=1 Ack=1 Win=64256 Len=0 TSval=54186633 TSecr=950164333
21,10.319451,192.168.11.17,192.168.11.16,TCP,93,,,0.000153,"Jan  6, 2024 19:36:22.033145000 JST",,"50494  >  6000 [PSH, ACK] Seq=1 Ack=1 Win=64256 Len=27 TSval=54186633 TSecr=950164333 [TCP segment of a reassembled PDU]"
22,10.319598,192.168.11.17,192.168.11.16,TCP,66,,,0.000147,"Jan  6, 2024 19:36:22.033292000 JST",,"50494  >  6000 [FIN, ACK] Seq=28 Ack=1 Win=64256 Len=0 TSval=54186633 TSecr=950164333"
23,10.326652,192.168.11.16,192.168.11.17,TCP,66,0.007201,,0.007054,"Jan  6, 2024 19:36:22.040346000 JST",,6000  >  50494 [ACK] Seq=1 Ack=28 Win=65152 Len=0 TSval=950164345 TSecr=54186633
24,10.327061,192.168.11.16,192.168.11.17,TCP,66,0.007463,,0.000409,"Jan  6, 2024 19:36:22.040755000 JST",,"6000  >  50494 [FIN, ACK] Seq=1 Ack=29 Win=65152 Len=0 TSval=950164346 TSecr=54186633"
25,10.327124,192.168.11.17,192.168.11.16,TCP,66,0.000063,,0.000063,"Jan  6, 2024 19:36:22.040818000 JST",,50494  >  6000 [ACK] Seq=29 Ack=2 Win=64256 Len=0 TSval=54186641 TSecr=950164346
26,10.357469,192.168.11.17,255.255.255.255,UDP,209,,Ÿ,0.030345,"Jan  6, 2024 19:36:22.071163000 JST",7b2273656d616e74696373223a207b22656e74697479223a2022504944222c202262617365656e74697479223a2022616e79222c2022726f6c65223a2022727272222c20227370617469616c223a2022616e79222c202274656d706f72616c223a2022616e79227d2c20226461746170726f7065727479223a207b22666f726d6174223a2022696e616f6b615f70726f6772616d5f73616d706c655f73656d616e746963227d7d,58594  >  7000 Len=167
27,10.3668,192.168.11.19,192.168.11.17,TCP,74,,œ,0.009331,"Jan  6, 2024 19:36:22.080494000 JST",,47544  >  6000 [SYN] Seq=0 Win=64240 Len=0 MSS=1460 SACK_PERM TSval=2676169823 TSecr=0 WS=128
28,10.36696,192.168.11.17,192.168.11.19,TCP,74,0.00016,,0.00016,"Jan  6, 2024 19:36:22.080654000 JST",,"6000  >  47544 [SYN, ACK] Seq=0 Ack=1 Win=65160 Len=0 MSS=1460 SACK_PERM TSval=2210628802 TSecr=2676169823 WS=128"
29,10.37381,192.168.11.19,192.168.11.17,TCP,66,0.00685,,0.00685,"Jan  6, 2024 19:36:22.087504000 JST",,47544  >  6000 [ACK] Seq=1 Ack=1 Win=64256 Len=0 TSval=2676169834 TSecr=2210628802
30,10.374501,192.168.11.19,192.168.11.17,TCP,93,,,0.000691,"Jan  6, 2024 19:36:22.088195000 JST",,"47544  >  6000 [PSH, ACK] Seq=1 Ack=1 Win=64256 Len=27 TSval=2676169834 TSecr=2210628802 [TCP segment of a reassembled PDU]"
31,10.374621,192.168.11.17,192.168.11.19,TCP,66,0.00012,,0.00012,"Jan  6, 2024 19:36:22.088315000 JST",,6000  >  47544 [ACK] Seq=1 Ack=28 Win=65152 Len=0 TSval=2210628809 TSecr=2676169834
32,10.374711,192.168.11.19,192.168.11.17,TCP,66,,,0.00009,"Jan  6, 2024 19:36:22.088405000 JST",,"47544  >  6000 [FIN, ACK] Seq=28 Ack=1 Win=64256 Len=0 TSval=2676169834 TSecr=2210628802"
33,10.375887,192.168.11.17,192.168.11.19,TCP,66,0.001176,,0.001176,"Jan  6, 2024 19:36:22.089581000 JST",,"6000  >  47544 [FIN, ACK] Seq=1 Ack=29 Win=65152 Len=0 TSval=2210628811 TSecr=2676169834"
34,10.382405,192.168.11.19,192.168.11.17,TCP,66,0.006518,,0.006518,"Jan  6, 2024 19:36:22.096099000 JST",,47544  >  6000 [ACK] Seq=29 Ack=2 Win=64256 Len=0 TSval=2676169842 TSecr=2210628811
35,20.182813,192.168.11.17,192.168.11.16,TCP,74,,,9.800408,"Jan  6, 2024 19:36:31.896507000 JST",,39142  >  6000 [SYN] Seq=0 Win=64240 Len=0 MSS=1460 SACK_PERM TSval=54196496 TSecr=0 WS=128
36,20.18916,192.168.11.16,192.168.11.17,TCP,74,0.006347,,0.006347,"Jan  6, 2024 19:36:31.902854000 JST",,"6000  >  39142 [SYN, ACK] Seq=0 Ack=1 Win=65160 Len=0 MSS=1460 SACK_PERM TSval=950174208 TSecr=54196496 WS=128"
37,20.189265,192.168.11.17,192.168.11.16,TCP,66,0.000105,,0.000105,"Jan  6, 2024 19:36:31.902959000 JST",,39142  >  6000 [ACK] Seq=1 Ack=1 Win=64256 Len=0 TSval=54196503 TSecr=950174208
38,20.189403,192.168.11.17,192.168.11.16,TCP,93,,,0.000138,"Jan  6, 2024 19:36:31.903097000 JST",,"39142  >  6000 [PSH, ACK] Seq=1 Ack=1 Win=64256 Len=27 TSval=54196503 TSecr=950174208 [TCP segment of a reassembled PDU]"
39,20.189509,192.168.11.17,192.168.11.16,TCP,66,,,0.000106,"Jan  6, 2024 19:36:31.903203000 JST",,"39142  >  6000 [FIN, ACK] Seq=28 Ack=1 Win=64256 Len=0 TSval=54196503 TSecr=950174208"
40,20.195165,192.168.11.16,192.168.11.17,TCP,66,0.005762,,0.005656,"Jan  6, 2024 19:36:31.908859000 JST",,6000  >  39142 [ACK] Seq=1 Ack=28 Win=65152 Len=0 TSval=950174214 TSecr=54196503
41,20.195598,192.168.11.16,192.168.11.17,TCP,66,0.006089,,0.000433,"Jan  6, 2024 19:36:31.909292000 JST",,"6000  >  39142 [FIN, ACK] Seq=1 Ack=29 Win=65152 Len=0 TSval=950174215 TSecr=54196503"
42,20.195644,192.168.11.17,192.168.11.16,TCP,66,0.000046,,0.000046,"Jan  6, 2024 19:36:31.909338000 JST",,39142  >  6000 [ACK] Seq=29 Ack=2 Win=64256 Len=0 TSval=54196509 TSecr=950174215
43,20.225332,192.168.11.17,255.255.255.255,UDP,209,,Ÿ,0.029688,"Jan  6, 2024 19:36:31.939026000 JST",7b2273656d616e74696373223a207b22656e74697479223a2022504944222c202262617365656e74697479223a2022616e79222c2022726f6c65223a2022727272222c20227370617469616c223a2022616e79222c202274656d706f72616c223a2022616e79227d2c20226461746170726f7065727479223a207b22666f726d6174223a2022696e616f6b615f70726f6772616d5f73616d706c655f73656d616e746963227d7d,36138  >  7000 Len=167
44,20.231166,192.168.11.19,192.168.11.17,TCP,74,,œ,0.005834,"Jan  6, 2024 19:36:31.944860000 JST",,33142  >  6000 [SYN] Seq=0 Win=64240 Len=0 MSS=1460 SACK_PERM TSval=2676179691 TSecr=0 WS=128
45,20.231315,192.168.11.17,192.168.11.19,TCP,74,0.000149,,0.000149,"Jan  6, 2024 19:36:31.945009000 JST",,"6000  >  33142 [SYN, ACK] Seq=0 Ack=1 Win=65160 Len=0 MSS=1460 SACK_PERM TSval=2210638666 TSecr=2676179691 WS=128"
46,20.238333,192.168.11.19,192.168.11.17,TCP,66,0.007018,,0.007018,"Jan  6, 2024 19:36:31.952027000 JST",,33142  >  6000 [ACK] Seq=1 Ack=1 Win=64256 Len=0 TSval=2676179698 TSecr=2210638666
47,20.238843,192.168.11.19,192.168.11.17,TCP,93,,,0.00051,"Jan  6, 2024 19:36:31.952537000 JST",,"33142  >  6000 [PSH, ACK] Seq=1 Ack=1 Win=64256 Len=27 TSval=2676179698 TSecr=2210638666 [TCP segment of a reassembled PDU]"
48,20.238932,192.168.11.17,192.168.11.19,TCP,66,0.000089,,0.000089,"Jan  6, 2024 19:36:31.952626000 JST",,6000  >  33142 [ACK] Seq=1 Ack=28 Win=65152 Len=0 TSval=2210638674 TSecr=2676179698
49,20.239005,192.168.11.19,192.168.11.17,TCP,66,,,0.000073,"Jan  6, 2024 19:36:31.952699000 JST",,"33142  >  6000 [FIN, ACK] Seq=28 Ack=1 Win=64256 Len=0 TSval=2676179699 TSecr=2210638666"
50,20.240029,192.168.11.17,192.168.11.19,TCP,66,0.001024,,0.001024,"Jan  6, 2024 19:36:31.953723000 JST",,"6000  >  33142 [FIN, ACK] Seq=1 Ack=29 Win=65152 Len=0 TSval=2210638675 TSecr=2676179699"
51,20.246337,192.168.11.19,192.168.11.17,TCP,66,0.006308,,0.006308,"Jan  6, 2024 19:36:31.960031000 JST",,33142  >  6000 [ACK] Seq=29 Ack=2 Win=64256 Len=0 TSval=2676179706 TSecr=2210638675
52,30.097405,192.168.11.17,192.168.11.16,TCP,74,,,9.851068,"Jan  6, 2024 19:36:41.811099000 JST",,35280  >  6000 [SYN] Seq=0 Win=64240 Len=0 MSS=1460 SACK_PERM TSval=54206411 TSecr=0 WS=128
53,30.10478,192.168.11.16,192.168.11.17,TCP,74,0.007375,,0.007375,"Jan  6, 2024 19:36:41.818474000 JST",,"6000  >  35280 [SYN, ACK] Seq=0 Ack=1 Win=65160 Len=0 MSS=1460 SACK_PERM TSval=950184123 TSecr=54206411 WS=128"
54,30.104893,192.168.11.17,192.168.11.16,TCP,66,0.000113,,0.000113,"Jan  6, 2024 19:36:41.818587000 JST",,35280  >  6000 [ACK] Seq=1 Ack=1 Win=64256 Len=0 TSval=54206419 TSecr=950184123
55,30.105059,192.168.11.17,192.168.11.16,TCP,93,,,0.000166,"Jan  6, 2024 19:36:41.818753000 JST",,"35280  >  6000 [PSH, ACK] Seq=1 Ack=1 Win=64256 Len=27 TSval=54206419 TSecr=950184123 [TCP segment of a reassembled PDU]"
56,30.105185,192.168.11.17,192.168.11.16,TCP,66,,,0.000126,"Jan  6, 2024 19:36:41.818879000 JST",,"35280  >  6000 [FIN, ACK] Seq=28 Ack=1 Win=64256 Len=0 TSval=54206419 TSecr=950184123"
57,30.11138,192.168.11.16,192.168.11.17,TCP,66,0.006321,,0.006195,"Jan  6, 2024 19:36:41.825074000 JST",,6000  >  35280 [ACK] Seq=1 Ack=28 Win=65152 Len=0 TSval=950184130 TSecr=54206419
58,30.111733,192.168.11.16,192.168.11.17,TCP,66,0.006548,,0.000353,"Jan  6, 2024 19:36:41.825427000 JST",,"6000  >  35280 [FIN, ACK] Seq=1 Ack=29 Win=65152 Len=0 TSval=950184131 TSecr=54206419"
59,30.111782,192.168.11.17,192.168.11.16,TCP,66,0.000049,,0.000049,"Jan  6, 2024 19:36:41.825476000 JST",,35280  >  6000 [ACK] Seq=29 Ack=2 Win=64256 Len=0 TSval=54206425 TSecr=950184131
60,30.145008,192.168.11.17,255.255.255.255,UDP,209,,Ÿ,0.033226,"Jan  6, 2024 19:36:41.858702000 JST",7b2273656d616e74696373223a207b22656e74697479223a2022504944222c202262617365656e74697479223a2022616e79222c2022726f6c65223a2022727272222c20227370617469616c223a2022616e79222c202274656d706f72616c223a2022616e79227d2c20226461746170726f7065727479223a207b22666f726d6174223a2022696e616f6b615f70726f6772616d5f73616d706c655f73656d616e746963227d7d,45769  >  7000 Len=167
61,30.150914,192.168.11.19,192.168.11.17,TCP,74,,œ,0.005906,"Jan  6, 2024 19:36:41.864608000 JST",,60600  >  6000 [SYN] Seq=0 Win=64240 Len=0 MSS=1460 SACK_PERM TSval=2676189611 TSecr=0 WS=128
62,30.151044,192.168.11.17,192.168.11.19,TCP,74,0.00013,,0.00013,"Jan  6, 2024 19:36:41.864738000 JST",,"6000  >  60600 [SYN, ACK] Seq=0 Ack=1 Win=65160 Len=0 MSS=1460 SACK_PERM TSval=2210648586 TSecr=2676189611 WS=128"
63,30.158752,192.168.11.19,192.168.11.17,TCP,66,0.007708,,0.007708,"Jan  6, 2024 19:36:41.872446000 JST",,60600  >  6000 [ACK] Seq=1 Ack=1 Win=64256 Len=0 TSval=2676189618 TSecr=2210648586
64,30.160203,192.168.11.19,192.168.11.17,TCP,93,,,0.001451,"Jan  6, 2024 19:36:41.873897000 JST",,"60600  >  6000 [PSH, ACK] Seq=1 Ack=1 Win=64256 Len=27 TSval=2676189618 TSecr=2210648586 [TCP segment of a reassembled PDU]"
65,30.16035,192.168.11.17,192.168.11.19,TCP,66,0.000147,,0.000147,"Jan  6, 2024 19:36:41.874044000 JST",,6000  >  60600 [ACK] Seq=1 Ack=28 Win=65152 Len=0 TSval=2210648595 TSecr=2676189618
66,30.16043,192.168.11.19,192.168.11.17,TCP,66,,,0.00008,"Jan  6, 2024 19:36:41.874124000 JST",,"60600  >  6000 [FIN, ACK] Seq=28 Ack=1 Win=64256 Len=0 TSval=2676189618 TSecr=2210648586"
67,30.16211,192.168.11.17,192.168.11.19,TCP,66,0.00168,,0.00168,"Jan  6, 2024 19:36:41.875804000 JST",,"6000  >  60600 [FIN, ACK] Seq=1 Ack=29 Win=65152 Len=0 TSval=2210648597 TSecr=2676189618"
68,30.169378,192.168.11.19,192.168.11.17,TCP,66,0.007268,,0.007268,"Jan  6, 2024 19:36:41.883072000 JST",,60600  >  6000 [ACK] Seq=29 Ack=2 Win=64256 Len=0 TSval=2676189629 TSecr=2210648597
69,37.913179,192.168.11.17,192.168.11.16,TCP,74,,,7.743801,"Jan  6, 2024 19:36:49.626873000 JST",,41796  >  6000 [SYN] Seq=0 Win=64240 Len=0 MSS=1460 SACK_PERM TSval=54214227 TSecr=0 WS=128
70,37.920454,192.168.11.16,192.168.11.17,TCP,74,0.007275,,0.007275,"Jan  6, 2024 19:36:49.634148000 JST",,"6000  >  41796 [SYN, ACK] Seq=0 Ack=1 Win=65160 Len=0 MSS=1460 SACK_PERM TSval=950191939 TSecr=54214227 WS=128"
71,37.920568,192.168.11.17,192.168.11.16,TCP,66,0.000114,,0.000114,"Jan  6, 2024 19:36:49.634262000 JST",,41796  >  6000 [ACK] Seq=1 Ack=1 Win=64256 Len=0 TSval=54214234 TSecr=950191939
72,37.920743,192.168.11.17,192.168.11.16,TCP,93,,,0.000175,"Jan  6, 2024 19:36:49.634437000 JST",,"41796  >  6000 [PSH, ACK] Seq=1 Ack=1 Win=64256 Len=27 TSval=54214234 TSecr=950191939 [TCP segment of a reassembled PDU]"
73,37.920851,192.168.11.17,192.168.11.16,TCP,66,,,0.000108,"Jan  6, 2024 19:36:49.634545000 JST",,"41796  >  6000 [FIN, ACK] Seq=28 Ack=1 Win=64256 Len=0 TSval=54214235 TSecr=950191939"
74,37.927997,192.168.11.16,192.168.11.17,TCP,66,0.007254,,0.007146,"Jan  6, 2024 19:36:49.641691000 JST",,6000  >  41796 [ACK] Seq=1 Ack=28 Win=65152 Len=0 TSval=950191946 TSecr=54214234
75,37.928355,192.168.11.16,192.168.11.17,TCP,66,0.007504,,0.000358,"Jan  6, 2024 19:36:49.642049000 JST",,"6000  >  41796 [FIN, ACK] Seq=1 Ack=29 Win=65152 Len=0 TSval=950191948 TSecr=54214235"
76,37.928401,192.168.11.17,192.168.11.16,TCP,66,0.000046,,0.000046,"Jan  6, 2024 19:36:49.642095000 JST",,41796  >  6000 [ACK] Seq=29 Ack=2 Win=64256 Len=0 TSval=54214242 TSecr=950191948
77,37.960394,192.168.11.17,255.255.255.255,UDP,209,,Ÿ,0.031993,"Jan  6, 2024 19:36:49.674088000 JST",7b2273656d616e74696373223a207b22656e74697479223a2022504944222c202262617365656e74697479223a2022616e79222c2022726f6c65223a2022727272222c20227370617469616c223a2022616e79222c202274656d706f72616c223a2022616e79227d2c20226461746170726f7065727479223a207b22666f726d6174223a2022696e616f6b615f70726f6772616d5f73616d706c655f73656d616e746963227d7d,60595  >  7000 Len=167
78,37.967283,192.168.11.19,192.168.11.17,TCP,74,,œ,0.006889,"Jan  6, 2024 19:36:49.680977000 JST",,54384  >  6000 [SYN] Seq=0 Win=64240 Len=0 MSS=1460 SACK_PERM TSval=2676197426 TSecr=0 WS=128
79,37.967422,192.168.11.17,192.168.11.19,TCP,74,0.000139,,0.000139,"Jan  6, 2024 19:36:49.681116000 JST",,"6000  >  54384 [SYN, ACK] Seq=0 Ack=1 Win=65160 Len=0 MSS=1460 SACK_PERM TSval=2210656402 TSecr=2676197426 WS=128"
80,37.975432,192.168.11.19,192.168.11.17,TCP,66,0.00801,,0.00801,"Jan  6, 2024 19:36:49.689126000 JST",,54384  >  6000 [ACK] Seq=1 Ack=1 Win=64256 Len=0 TSval=2676197436 TSecr=2210656402
81,37.976097,192.168.11.19,192.168.11.17,TCP,93,,,0.000665,"Jan  6, 2024 19:36:49.689791000 JST",,"54384  >  6000 [PSH, ACK] Seq=1 Ack=1 Win=64256 Len=27 TSval=2676197436 TSecr=2210656402 [TCP segment of a reassembled PDU]"
82,37.9762,192.168.11.17,192.168.11.19,TCP,66,0.000103,,0.000103,"Jan  6, 2024 19:36:49.689894000 JST",,6000  >  54384 [ACK] Seq=1 Ack=28 Win=65152 Len=0 TSval=2210656411 TSecr=2676197436
83,37.976277,192.168.11.19,192.168.11.17,TCP,66,,,0.000077,"Jan  6, 2024 19:36:49.689971000 JST",,"54384  >  6000 [FIN, ACK] Seq=28 Ack=1 Win=64256 Len=0 TSval=2676197436 TSecr=2210656402"
84,37.978357,192.168.11.17,192.168.11.19,TCP,66,0.00208,,0.00208,"Jan  6, 2024 19:36:49.692051000 JST",,"6000  >  54384 [FIN, ACK] Seq=1 Ack=29 Win=65152 Len=0 TSval=2210656413 TSecr=2676197436"
85,37.982699,192.168.11.19,192.168.11.17,TCP,66,0.004342,,0.004342,"Jan  6, 2024 19:36:49.696393000 JST",,54384  >  6000 [ACK] Seq=29 Ack=2 Win=64256 Len=0 TSval=2676197444 TSecr=2210656413
86,45.722367,192.168.11.17,192.168.11.16,TCP,74,,,7.739668,"Jan  6, 2024 19:36:57.436061000 JST",,41804  >  6000 [SYN] Seq=0 Win=64240 Len=0 MSS=1460 SACK_PERM TSval=54222036 TSecr=0 WS=128
87,45.72948,192.168.11.16,192.168.11.17,TCP,74,0.007113,,0.007113,"Jan  6, 2024 19:36:57.443174000 JST",,"6000  >  41804 [SYN, ACK] Seq=0 Ack=1 Win=65160 Len=0 MSS=1460 SACK_PERM TSval=950199748 TSecr=54222036 WS=128"
88,45.72959,192.168.11.17,192.168.11.16,TCP,66,0.00011,,0.00011,"Jan  6, 2024 19:36:57.443284000 JST",,41804  >  6000 [ACK] Seq=1 Ack=1 Win=64256 Len=0 TSval=54222043 TSecr=950199748
89,45.729794,192.168.11.17,192.168.11.16,TCP,93,,,0.000204,"Jan  6, 2024 19:36:57.443488000 JST",,"41804  >  6000 [PSH, ACK] Seq=1 Ack=1 Win=64256 Len=27 TSval=54222043 TSecr=950199748 [TCP segment of a reassembled PDU]"
90,45.729914,192.168.11.17,192.168.11.16,TCP,66,,,0.00012,"Jan  6, 2024 19:36:57.443608000 JST",,"41804  >  6000 [FIN, ACK] Seq=28 Ack=1 Win=64256 Len=0 TSval=54222044 TSecr=950199748"
91,45.736838,192.168.11.16,192.168.11.17,TCP,66,0.007044,,0.006924,"Jan  6, 2024 19:36:57.450532000 JST",,6000  >  41804 [ACK] Seq=1 Ack=28 Win=65152 Len=0 TSval=950199755 TSecr=54222043
92,45.737068,192.168.11.16,192.168.11.17,TCP,66,0.007154,,0.00023,"Jan  6, 2024 19:36:57.450762000 JST",,"6000  >  41804 [FIN, ACK] Seq=1 Ack=29 Win=65152 Len=0 TSval=950199756 TSecr=54222044"
93,45.737119,192.168.11.17,192.168.11.16,TCP,66,0.000051,,0.000051,"Jan  6, 2024 19:36:57.450813000 JST",,41804  >  6000 [ACK] Seq=29 Ack=2 Win=64256 Len=0 TSval=54222051 TSecr=950199756
94,45.76738,192.168.11.17,255.255.255.255,UDP,209,,Ÿ,0.030261,"Jan  6, 2024 19:36:57.481074000 JST",7b2273656d616e74696373223a207b22656e74697479223a2022504944222c202262617365656e74697479223a2022616e79222c2022726f6c65223a2022727272222c20227370617469616c223a2022616e79222c202274656d706f72616c223a2022616e79227d2c20226461746170726f7065727479223a207b22666f726d6174223a2022696e616f6b615f70726f6772616d5f73616d706c655f73656d616e746963227d7d,34869  >  7000 Len=167
95,45.774389,192.168.11.19,192.168.11.17,TCP,74,,œ,0.007009,"Jan  6, 2024 19:36:57.488083000 JST",,60972  >  6000 [SYN] Seq=0 Win=64240 Len=0 MSS=1460 SACK_PERM TSval=2676205233 TSecr=0 WS=128
96,45.774545,192.168.11.17,192.168.11.19,TCP,74,0.000156,,0.000156,"Jan  6, 2024 19:36:57.488239000 JST",,"6000  >  60972 [SYN, ACK] Seq=0 Ack=1 Win=65160 Len=0 MSS=1460 SACK_PERM TSval=2210664209 TSecr=2676205233 WS=128"
97,45.782338,192.168.11.19,192.168.11.17,TCP,66,0.007793,,0.007793,"Jan  6, 2024 19:36:57.496032000 JST",,60972  >  6000 [ACK] Seq=1 Ack=1 Win=64256 Len=0 TSval=2676205242 TSecr=2210664209
98,45.783042,192.168.11.19,192.168.11.17,TCP,93,,,0.000704,"Jan  6, 2024 19:36:57.496736000 JST",,"60972  >  6000 [PSH, ACK] Seq=1 Ack=1 Win=64256 Len=27 TSval=2676205243 TSecr=2210664209 [TCP segment of a reassembled PDU]"
99,45.78316,192.168.11.17,192.168.11.19,TCP,66,0.000118,,0.000118,"Jan  6, 2024 19:36:57.496854000 JST",,6000  >  60972 [ACK] Seq=1 Ack=28 Win=65152 Len=0 TSval=2210664218 TSecr=2676205243
100,45.783255,192.168.11.19,192.168.11.17,TCP,66,,,0.000095,"Jan  6, 2024 19:36:57.496949000 JST",,"60972  >  6000 [FIN, ACK] Seq=28 Ack=1 Win=64256 Len=0 TSval=2676205243 TSecr=2210664209"
101,45.784564,192.168.11.17,192.168.11.19,TCP,66,0.001309,,0.001309,"Jan  6, 2024 19:36:57.498258000 JST",,"6000  >  60972 [FIN, ACK] Seq=1 Ack=29 Win=65152 Len=0 TSval=2210664219 TSecr=2676205243"
102,45.79069,192.168.11.19,192.168.11.17,TCP,66,0.006126,,0.006126,"Jan  6, 2024 19:36:57.504384000 JST",,60972  >  6000 [ACK] Seq=29 Ack=2 Win=64256 Len=0 TSval=2676205251 TSecr=2210664219
103,53.586517,192.168.11.17,192.168.11.16,TCP,74,,,7.795827,"Jan  6, 2024 19:37:05.300211000 JST",,41240  >  6000 [SYN] Seq=0 Win=64240 Len=0 MSS=1460 SACK_PERM TSval=54229900 TSecr=0 WS=128
104,53.594272,192.168.11.16,192.168.11.17,TCP,74,0.007755,,0.007755,"Jan  6, 2024 19:37:05.307966000 JST",,"6000  >  41240 [SYN, ACK] Seq=0 Ack=1 Win=65160 Len=0 MSS=1460 SACK_PERM TSval=950207613 TSecr=54229900 WS=128"
105,53.594392,192.168.11.17,192.168.11.16,TCP,66,0.00012,,0.00012,"Jan  6, 2024 19:37:05.308086000 JST",,41240  >  6000 [ACK] Seq=1 Ack=1 Win=64256 Len=0 TSval=54229908 TSecr=950207613
106,53.594523,192.168.11.17,192.168.11.16,TCP,93,,,0.000131,"Jan  6, 2024 19:37:05.308217000 JST",,"41240  >  6000 [PSH, ACK] Seq=1 Ack=1 Win=64256 Len=27 TSval=54229908 TSecr=950207613 [TCP segment of a reassembled PDU]"
107,53.594632,192.168.11.17,192.168.11.16,TCP,66,,,0.000109,"Jan  6, 2024 19:37:05.308326000 JST",,"41240  >  6000 [FIN, ACK] Seq=28 Ack=1 Win=64256 Len=0 TSval=54229908 TSecr=950207613"
108,53.601426,192.168.11.16,192.168.11.17,TCP,66,0.006903,,0.006794,"Jan  6, 2024 19:37:05.315120000 JST",,6000  >  41240 [ACK] Seq=1 Ack=28 Win=65152 Len=0 TSval=950207620 TSecr=54229908
109,53.601885,192.168.11.16,192.168.11.17,TCP,66,0.007253,,0.000459,"Jan  6, 2024 19:37:05.315579000 JST",,"6000  >  41240 [FIN, ACK] Seq=1 Ack=29 Win=65152 Len=0 TSval=950207621 TSecr=54229908"
110,53.601947,192.168.11.17,192.168.11.16,TCP,66,0.000062,,0.000062,"Jan  6, 2024 19:37:05.315641000 JST",,41240  >  6000 [ACK] Seq=29 Ack=2 Win=64256 Len=0 TSval=54229916 TSecr=950207621
111,53.631762,192.168.11.17,255.255.255.255,UDP,209,,Ÿ,0.029815,"Jan  6, 2024 19:37:05.345456000 JST",7b2273656d616e74696373223a207b22656e74697479223a2022504944222c202262617365656e74697479223a2022616e79222c2022726f6c65223a2022727272222c20227370617469616c223a2022616e79222c202274656d706f72616c223a2022616e79227d2c20226461746170726f7065727479223a207b22666f726d6174223a2022696e616f6b615f70726f6772616d5f73616d706c655f73656d616e746963227d7d,45282  >  7000 Len=167
112,53.637649,192.168.11.19,192.168.11.17,TCP,74,,œ,0.005887,"Jan  6, 2024 19:37:05.351343000 JST",,41192  >  6000 [SYN] Seq=0 Win=64240 Len=0 MSS=1460 SACK_PERM TSval=2676213098 TSecr=0 WS=128
113,53.637828,192.168.11.17,192.168.11.19,TCP,74,0.000179,,0.000179,"Jan  6, 2024 19:37:05.351522000 JST",,"6000  >  41192 [SYN, ACK] Seq=0 Ack=1 Win=65160 Len=0 MSS=1460 SACK_PERM TSval=2210672072 TSecr=2676213098 WS=128"
114,53.645694,192.168.11.19,192.168.11.17,TCP,66,0.007866,,0.007866,"Jan  6, 2024 19:37:05.359388000 JST",,41192  >  6000 [ACK] Seq=1 Ack=1 Win=64256 Len=0 TSval=2676213106 TSecr=2210672072
115,53.646386,192.168.11.19,192.168.11.17,TCP,93,,,0.000692,"Jan  6, 2024 19:37:05.360080000 JST",,"41192  >  6000 [PSH, ACK] Seq=1 Ack=1 Win=64256 Len=27 TSval=2676213106 TSecr=2210672072 [TCP segment of a reassembled PDU]"
116,53.646506,192.168.11.17,192.168.11.19,TCP,66,0.00012,,0.00012,"Jan  6, 2024 19:37:05.360200000 JST",,6000  >  41192 [ACK] Seq=1 Ack=28 Win=65152 Len=0 TSval=2210672081 TSecr=2676213106
117,53.646583,192.168.11.19,192.168.11.17,TCP,66,,,0.000077,"Jan  6, 2024 19:37:05.360277000 JST",,"41192  >  6000 [FIN, ACK] Seq=28 Ack=1 Win=64256 Len=0 TSval=2676213106 TSecr=2210672072"
118,53.647883,192.168.11.17,192.168.11.19,TCP,66,0.0013,,0.0013,"Jan  6, 2024 19:37:05.361577000 JST",,"6000  >  41192 [FIN, ACK] Seq=1 Ack=29 Win=65152 Len=0 TSval=2210672083 TSecr=2676213106"
119,53.654191,192.168.11.19,192.168.11.17,TCP,66,0.006308,,0.006308,"Jan  6, 2024 19:37:05.367885000 JST",,41192  >  6000 [ACK] Seq=29 Ack=2 Win=64256 Len=0 TSval=2676213114 TSecr=2210672083
120,61.881235,192.168.11.17,192.168.11.16,TCP,74,,,8.227044,"Jan  6, 2024 19:37:13.594929000 JST",,53596  >  6000 [SYN] Seq=0 Win=64240 Len=0 MSS=1460 SACK_PERM TSval=54238195 TSecr=0 WS=128
121,61.891686,192.168.11.16,192.168.11.17,TCP,74,0.010451,,0.010451,"Jan  6, 2024 19:37:13.605380000 JST",,"6000  >  53596 [SYN, ACK] Seq=0 Ack=1 Win=65160 Len=0 MSS=1460 SACK_PERM TSval=950215910 TSecr=54238195 WS=128"
122,61.891797,192.168.11.17,192.168.11.16,TCP,66,0.000111,,0.000111,"Jan  6, 2024 19:37:13.605491000 JST",,53596  >  6000 [ACK] Seq=1 Ack=1 Win=64256 Len=0 TSval=54238206 TSecr=950215910
123,61.891938,192.168.11.17,192.168.11.16,TCP,93,,,0.000141,"Jan  6, 2024 19:37:13.605632000 JST",,"53596  >  6000 [PSH, ACK] Seq=1 Ack=1 Win=64256 Len=27 TSval=54238206 TSecr=950215910 [TCP segment of a reassembled PDU]"
124,61.892055,192.168.11.17,192.168.11.16,TCP,66,,,0.000117,"Jan  6, 2024 19:37:13.605749000 JST",,"53596  >  6000 [FIN, ACK] Seq=28 Ack=1 Win=64256 Len=0 TSval=54238206 TSecr=950215910"
125,61.899137,192.168.11.16,192.168.11.17,TCP,66,0.007199,,0.007082,"Jan  6, 2024 19:37:13.612831000 JST",,6000  >  53596 [ACK] Seq=1 Ack=28 Win=65152 Len=0 TSval=950215918 TSecr=54238206
126,61.899515,192.168.11.16,192.168.11.17,TCP,66,0.00746,,0.000378,"Jan  6, 2024 19:37:13.613209000 JST",,"6000  >  53596 [FIN, ACK] Seq=1 Ack=29 Win=65152 Len=0 TSval=950215919 TSecr=54238206"
127,61.899564,192.168.11.17,192.168.11.16,TCP,66,0.000049,,0.000049,"Jan  6, 2024 19:37:13.613258000 JST",,53596  >  6000 [ACK] Seq=29 Ack=2 Win=64256 Len=0 TSval=54238213 TSecr=950215919
128,61.930567,192.168.11.17,255.255.255.255,UDP,209,,Ÿ,0.031003,"Jan  6, 2024 19:37:13.644261000 JST",7b2273656d616e74696373223a207b22656e74697479223a2022504944222c202262617365656e74697479223a2022616e79222c2022726f6c65223a2022727272222c20227370617469616c223a2022616e79222c202274656d706f72616c223a2022616e79227d2c20226461746170726f7065727479223a207b22666f726d6174223a2022696e616f6b615f70726f6772616d5f73616d706c655f73656d616e746963227d7d,47637  >  7000 Len=167
129,61.936768,192.168.11.19,192.168.11.17,TCP,74,,œ,0.006201,"Jan  6, 2024 19:37:13.650462000 JST",,41198  >  6000 [SYN] Seq=0 Win=64240 Len=0 MSS=1460 SACK_PERM TSval=2676221397 TSecr=0 WS=128
130,61.936913,192.168.11.17,192.168.11.19,TCP,74,0.000145,,0.000145,"Jan  6, 2024 19:37:13.650607000 JST",,"6000  >  41198 [SYN, ACK] Seq=0 Ack=1 Win=65160 Len=0 MSS=1460 SACK_PERM TSval=2210680372 TSecr=2676221397 WS=128"
131,61.954541,192.168.11.19,192.168.11.17,TCP,66,0.017628,,0.017628,"Jan  6, 2024 19:37:13.668235000 JST",,41198  >  6000 [ACK] Seq=1 Ack=1 Win=64256 Len=0 TSval=2676221404 TSecr=2210680372
132,61.954948,192.168.11.19,192.168.11.17,TCP,93,,,0.000407,"Jan  6, 2024 19:37:13.668642000 JST",,"41198  >  6000 [PSH, ACK] Seq=1 Ack=1 Win=64256 Len=27 TSval=2676221404 TSecr=2210680372 [TCP segment of a reassembled PDU]"
133,61.955026,192.168.11.17,192.168.11.19,TCP,66,0.000078,,0.000078,"Jan  6, 2024 19:37:13.668720000 JST",,6000  >  41198 [ACK] Seq=1 Ack=28 Win=65152 Len=0 TSval=2210680390 TSecr=2676221404
134,61.955244,192.168.11.19,192.168.11.17,TCP,66,,,0.000218,"Jan  6, 2024 19:37:13.668938000 JST",,"41198  >  6000 [FIN, ACK] Seq=28 Ack=1 Win=64256 Len=0 TSval=2676221404 TSecr=2210680372"
135,61.956171,192.168.11.17,192.168.11.19,TCP,66,0.000927,,0.000927,"Jan  6, 2024 19:37:13.669865000 JST",,"6000  >  41198 [FIN, ACK] Seq=1 Ack=29 Win=65152 Len=0 TSval=2210680391 TSecr=2676221404"
136,61.962279,192.168.11.19,192.168.11.17,TCP,66,0.006108,,0.006108,"Jan  6, 2024 19:37:13.675973000 JST",,41198  >  6000 [ACK] Seq=29 Ack=2 Win=64256 Len=0 TSval=2676221423 TSecr=2210680391
137,72.813692,192.168.11.17,192.168.11.16,TCP,74,,,10.851413,"Jan  6, 2024 19:37:24.527386000 JST",,32994  >  6000 [SYN] Seq=0 Win=64240 Len=0 MSS=1460 SACK_PERM TSval=54249127 TSecr=0 WS=128
138,72.825471,192.168.11.16,192.168.11.17,TCP,74,0.011779,,0.011779,"Jan  6, 2024 19:37:24.539165000 JST",,"6000  >  32994 [SYN, ACK] Seq=0 Ack=1 Win=65160 Len=0 MSS=1460 SACK_PERM TSval=950226839 TSecr=54249127 WS=128"
139,72.825595,192.168.11.17,192.168.11.16,TCP,66,0.000124,,0.000124,"Jan  6, 2024 19:37:24.539289000 JST",,32994  >  6000 [ACK] Seq=1 Ack=1 Win=64256 Len=0 TSval=54249139 TSecr=950226839
140,72.825856,192.168.11.17,192.168.11.16,TCP,93,,,0.000261,"Jan  6, 2024 19:37:24.539550000 JST",,"32994  >  6000 [PSH, ACK] Seq=1 Ack=1 Win=64256 Len=27 TSval=54249139 TSecr=950226839 [TCP segment of a reassembled PDU]"
141,72.82597,192.168.11.17,192.168.11.16,TCP,66,,,0.000114,"Jan  6, 2024 19:37:24.539664000 JST",,"32994  >  6000 [FIN, ACK] Seq=28 Ack=1 Win=64256 Len=0 TSval=54249140 TSecr=950226839"
142,72.833355,192.168.11.16,192.168.11.17,TCP,66,0.007499,,0.007385,"Jan  6, 2024 19:37:24.547049000 JST",,6000  >  32994 [ACK] Seq=1 Ack=28 Win=65152 Len=0 TSval=950226852 TSecr=54249139
143,72.833598,192.168.11.16,192.168.11.17,TCP,66,0.007628,,0.000243,"Jan  6, 2024 19:37:24.547292000 JST",,"6000  >  32994 [FIN, ACK] Seq=1 Ack=29 Win=65152 Len=0 TSval=950226853 TSecr=54249140"
144,72.833658,192.168.11.17,192.168.11.16,TCP,66,0.00006,,0.00006,"Jan  6, 2024 19:37:24.547352000 JST",,32994  >  6000 [ACK] Seq=29 Ack=2 Win=64256 Len=0 TSval=54249147 TSecr=950226853
145,72.864066,192.168.11.17,255.255.255.255,UDP,209,,Ÿ,0.030408,"Jan  6, 2024 19:37:24.577760000 JST",7b2273656d616e74696373223a207b22656e74697479223a2022504944222c202262617365656e74697479223a2022616e79222c2022726f6c65223a2022727272222c20227370617469616c223a2022616e79222c202274656d706f72616c223a2022616e79227d2c20226461746170726f7065727479223a207b22666f726d6174223a2022696e616f6b615f70726f6772616d5f73616d706c655f73656d616e746963227d7d,37955  >  7000 Len=167
146,72.869681,192.168.11.19,192.168.11.17,TCP,74,,œ,0.005615,"Jan  6, 2024 19:37:24.583375000 JST",,47096  >  6000 [SYN] Seq=0 Win=64240 Len=0 MSS=1460 SACK_PERM TSval=2676232330 TSecr=0 WS=128
147,72.869873,192.168.11.17,192.168.11.19,TCP,74,0.000192,,0.000192,"Jan  6, 2024 19:37:24.583567000 JST",,"6000  >  47096 [SYN, ACK] Seq=0 Ack=1 Win=65160 Len=0 MSS=1460 SACK_PERM TSval=2210691305 TSecr=2676232330 WS=128"
148,72.876675,192.168.11.19,192.168.11.17,TCP,66,0.006802,,0.006802,"Jan  6, 2024 19:37:24.590369000 JST",,47096  >  6000 [ACK] Seq=1 Ack=1 Win=64256 Len=0 TSval=2676232337 TSecr=2210691305
149,72.877408,192.168.11.19,192.168.11.17,TCP,93,,,0.000733,"Jan  6, 2024 19:37:24.591102000 JST",,"47096  >  6000 [PSH, ACK] Seq=1 Ack=1 Win=64256 Len=27 TSval=2676232337 TSecr=2210691305 [TCP segment of a reassembled PDU]"
150,72.877516,192.168.11.17,192.168.11.19,TCP,66,0.000108,,0.000108,"Jan  6, 2024 19:37:24.591210000 JST",,6000  >  47096 [ACK] Seq=1 Ack=28 Win=65152 Len=0 TSval=2210691312 TSecr=2676232337
151,72.877598,192.168.11.19,192.168.11.17,TCP,66,,,0.000082,"Jan  6, 2024 19:37:24.591292000 JST",,"47096  >  6000 [FIN, ACK] Seq=28 Ack=1 Win=64256 Len=0 TSval=2676232337 TSecr=2210691305"
152,72.878955,192.168.11.17,192.168.11.19,TCP,66,0.001357,,0.001357,"Jan  6, 2024 19:37:24.592649000 JST",,"6000  >  47096 [FIN, ACK] Seq=1 Ack=29 Win=65152 Len=0 TSval=2210691314 TSecr=2676232337"
153,72.886207,192.168.11.19,192.168.11.17,TCP,66,0.007252,,0.007252,"Jan  6, 2024 19:37:24.599901000 JST",,47096  >  6000 [ACK] Seq=29 Ack=2 Win=64256 Len=0 TSval=2676232346 TSecr=2210691314
154,82.709534,192.168.11.17,192.168.11.16,TCP,74,,,9.823327,"Jan  6, 2024 19:37:34.423228000 JST",,34642  >  6000 [SYN] Seq=0 Win=64240 Len=0 MSS=1460 SACK_PERM TSval=54259023 TSecr=0 WS=128
155,82.717213,192.168.11.16,192.168.11.17,TCP,74,0.007679,,0.007679,"Jan  6, 2024 19:37:34.430907000 JST",,"6000  >  34642 [SYN, ACK] Seq=0 Ack=1 Win=65160 Len=0 MSS=1460 SACK_PERM TSval=950236736 TSecr=54259023 WS=128"
156,82.717327,192.168.11.17,192.168.11.16,TCP,66,0.000114,,0.000114,"Jan  6, 2024 19:37:34.431021000 JST",,34642  >  6000 [ACK] Seq=1 Ack=1 Win=64256 Len=0 TSval=54259031 TSecr=950236736
157,82.717464,192.168.11.17,192.168.11.16,TCP,93,,,0.000137,"Jan  6, 2024 19:37:34.431158000 JST",,"34642  >  6000 [PSH, ACK] Seq=1 Ack=1 Win=64256 Len=27 TSval=54259031 TSecr=950236736 [TCP segment of a reassembled PDU]"
158,82.717588,192.168.11.17,192.168.11.16,TCP,66,,,0.000124,"Jan  6, 2024 19:37:34.431282000 JST",,"34642  >  6000 [FIN, ACK] Seq=28 Ack=1 Win=64256 Len=0 TSval=54259031 TSecr=950236736"
159,82.724577,192.168.11.16,192.168.11.17,TCP,66,0.007113,,0.006989,"Jan  6, 2024 19:37:34.438271000 JST",,6000  >  34642 [ACK] Seq=1 Ack=28 Win=65152 Len=0 TSval=950236743 TSecr=54259031
160,82.724946,192.168.11.16,192.168.11.17,TCP,66,0.007358,,0.000369,"Jan  6, 2024 19:37:34.438640000 JST",,"6000  >  34642 [FIN, ACK] Seq=1 Ack=29 Win=65152 Len=0 TSval=950236745 TSecr=54259031"
161,82.724993,192.168.11.17,192.168.11.16,TCP,66,0.000047,,0.000047,"Jan  6, 2024 19:37:34.438687000 JST",,34642  >  6000 [ACK] Seq=29 Ack=2 Win=64256 Len=0 TSval=54259039 TSecr=950236745
162,82.754093,192.168.11.17,255.255.255.255,UDP,209,,Ÿ,0.0291,"Jan  6, 2024 19:37:34.467787000 JST",7b2273656d616e74696373223a207b22656e74697479223a2022504944222c202262617365656e74697479223a2022616e79222c2022726f6c65223a2022727272222c20227370617469616c223a2022616e79222c202274656d706f72616c223a2022616e79227d2c20226461746170726f7065727479223a207b22666f726d6174223a2022696e616f6b615f70726f6772616d5f73616d706c655f73656d616e746963227d7d,49392  >  7000 Len=167
163,82.759751,192.168.11.19,192.168.11.17,TCP,74,,œ,0.005658,"Jan  6, 2024 19:37:34.473445000 JST",,34408  >  6000 [SYN] Seq=0 Win=64240 Len=0 MSS=1460 SACK_PERM TSval=2676242220 TSecr=0 WS=128
164,82.759902,192.168.11.17,192.168.11.19,TCP,74,0.000151,,0.000151,"Jan  6, 2024 19:37:34.473596000 JST",,"6000  >  34408 [SYN, ACK] Seq=0 Ack=1 Win=65160 Len=0 MSS=1460 SACK_PERM TSval=2210701195 TSecr=2676242220 WS=128"
165,82.766632,192.168.11.19,192.168.11.17,TCP,66,0.00673,,0.00673,"Jan  6, 2024 19:37:34.480326000 JST",,34408  >  6000 [ACK] Seq=1 Ack=1 Win=64256 Len=0 TSval=2676242227 TSecr=2210701195
166,82.767129,192.168.11.19,192.168.11.17,TCP,93,,,0.000497,"Jan  6, 2024 19:37:34.480823000 JST",,"34408  >  6000 [PSH, ACK] Seq=1 Ack=1 Win=64256 Len=27 TSval=2676242227 TSecr=2210701195 [TCP segment of a reassembled PDU]"
167,82.767207,192.168.11.17,192.168.11.19,TCP,66,0.000078,,0.000078,"Jan  6, 2024 19:37:34.480901000 JST",,6000  >  34408 [ACK] Seq=1 Ack=28 Win=65152 Len=0 TSval=2210701202 TSecr=2676242227
168,82.767273,192.168.11.19,192.168.11.17,TCP,66,,,0.000066,"Jan  6, 2024 19:37:34.480967000 JST",,"34408  >  6000 [FIN, ACK] Seq=28 Ack=1 Win=64256 Len=0 TSval=2676242227 TSecr=2210701195"
169,82.768225,192.168.11.17,192.168.11.19,TCP,66,0.000952,,0.000952,"Jan  6, 2024 19:37:34.481919000 JST",,"6000  >  34408 [FIN, ACK] Seq=1 Ack=29 Win=65152 Len=0 TSval=2210701203 TSecr=2676242227"
170,82.777961,192.168.11.19,192.168.11.17,TCP,66,0.009736,,0.009736,"Jan  6, 2024 19:37:34.491655000 JST",,34408  >  6000 [ACK] Seq=29 Ack=2 Win=64256 Len=0 TSval=2676242235 TSecr=2210701203
171,114.887258,192.168.11.17,192.168.11.16,TCP,74,,,32.109297,"Jan  6, 2024 19:38:06.600952000 JST",,54058  >  6000 [SYN] Seq=0 Win=64240 Len=0 MSS=1460 SACK_PERM TSval=54291201 TSecr=0 WS=128
172,114.893833,192.168.11.16,192.168.11.17,TCP,74,0.006575,,0.006575,"Jan  6, 2024 19:38:06.607527000 JST",,"6000  >  54058 [SYN, ACK] Seq=0 Ack=1 Win=65160 Len=0 MSS=1460 SACK_PERM TSval=950268913 TSecr=54291201 WS=128"
173,114.893925,192.168.11.17,192.168.11.16,TCP,66,0.000092,,0.000092,"Jan  6, 2024 19:38:06.607619000 JST",,54058  >  6000 [ACK] Seq=1 Ack=1 Win=64256 Len=0 TSval=54291208 TSecr=950268913
174,114.894083,192.168.11.17,192.168.11.16,TCP,93,,,0.000158,"Jan  6, 2024 19:38:06.607777000 JST",,"54058  >  6000 [PSH, ACK] Seq=1 Ack=1 Win=64256 Len=27 TSval=54291208 TSecr=950268913 [TCP segment of a reassembled PDU]"
175,114.894186,192.168.11.17,192.168.11.16,TCP,66,,,0.000103,"Jan  6, 2024 19:38:06.607880000 JST",,"54058  >  6000 [FIN, ACK] Seq=28 Ack=1 Win=64256 Len=0 TSval=54291208 TSecr=950268913"
176,114.901035,192.168.11.16,192.168.11.17,TCP,66,0.006952,,0.006849,"Jan  6, 2024 19:38:06.614729000 JST",,6000  >  54058 [ACK] Seq=1 Ack=28 Win=65152 Len=0 TSval=950268920 TSecr=54291208
177,114.901389,192.168.11.16,192.168.11.17,TCP,66,0.007203,,0.000354,"Jan  6, 2024 19:38:06.615083000 JST",,"6000  >  54058 [FIN, ACK] Seq=1 Ack=29 Win=65152 Len=0 TSval=950268921 TSecr=54291208"
178,114.901432,192.168.11.17,192.168.11.16,TCP,66,0.000043,,0.000043,"Jan  6, 2024 19:38:06.615126000 JST",,54058  >  6000 [ACK] Seq=29 Ack=2 Win=64256 Len=0 TSval=54291215 TSecr=950268921
179,114.931107,192.168.11.17,255.255.255.255,UDP,209,,Ÿ,0.029675,"Jan  6, 2024 19:38:06.644801000 JST",7b2273656d616e74696373223a207b22656e74697479223a2022504944222c202262617365656e74697479223a2022616e79222c2022726f6c65223a2022727272222c20227370617469616c223a2022616e79222c202274656d706f72616c223a2022616e79227d2c20226461746170726f7065727479223a207b22666f726d6174223a2022696e616f6b615f70726f6772616d5f73616d706c655f73656d616e746963227d7d,46935  >  7000 Len=167
180,114.936797,192.168.11.19,192.168.11.17,TCP,74,,œ,0.00569,"Jan  6, 2024 19:38:06.650491000 JST",,36678  >  6000 [SYN] Seq=0 Win=64240 Len=0 MSS=1460 SACK_PERM TSval=2676274397 TSecr=0 WS=128
181,114.936939,192.168.11.17,192.168.11.19,TCP,74,0.000142,,0.000142,"Jan  6, 2024 19:38:06.650633000 JST",,"6000  >  36678 [SYN, ACK] Seq=0 Ack=1 Win=65160 Len=0 MSS=1460 SACK_PERM TSval=2210733372 TSecr=2676274397 WS=128"
182,114.943959,192.168.11.19,192.168.11.17,TCP,66,0.00702,,0.00702,"Jan  6, 2024 19:38:06.657653000 JST",,36678  >  6000 [ACK] Seq=1 Ack=1 Win=64256 Len=0 TSval=2676274404 TSecr=2210733372
183,114.944599,192.168.11.19,192.168.11.17,TCP,93,,,0.00064,"Jan  6, 2024 19:38:06.658293000 JST",,"36678  >  6000 [PSH, ACK] Seq=1 Ack=1 Win=64256 Len=27 TSval=2676274404 TSecr=2210733372 [TCP segment of a reassembled PDU]"
184,114.944707,192.168.11.17,192.168.11.19,TCP,66,0.000108,,0.000108,"Jan  6, 2024 19:38:06.658401000 JST",,6000  >  36678 [ACK] Seq=1 Ack=28 Win=65152 Len=0 TSval=2210733379 TSecr=2676274404
185,114.94479,192.168.11.19,192.168.11.17,TCP,66,,,0.000083,"Jan  6, 2024 19:38:06.658484000 JST",,"36678  >  6000 [FIN, ACK] Seq=28 Ack=1 Win=64256 Len=0 TSval=2676274404 TSecr=2210733372"
186,114.946263,192.168.11.17,192.168.11.19,TCP,66,0.001473,,0.001473,"Jan  6, 2024 19:38:06.659957000 JST",,"6000  >  36678 [FIN, ACK] Seq=1 Ack=29 Win=65152 Len=0 TSval=2210733381 TSecr=2676274404"
