No.,Time,Source,Destination,Protocol,Length,The RTT to ACK the segment was,XXX,Time delta from previous captured frame,Arrival Time,Data,Info
1,0,192.168.11.20,192.168.11.19,TCP,74,,,0,"Jan  6, 2024 19:36:11.820663000 JST",,53352  >  6000 [SYN] Seq=0 Win=64240 Len=0 MSS=1460 SACK_PERM TSval=3684867735 TSecr=0 WS=128
2,0.006744,192.168.11.19,192.168.11.20,TCP,74,0.006744,,0.006744,"Jan  6, 2024 19:36:11.827407000 JST",,"6000  >  53352 [SYN, ACK] Seq=0 Ack=1 Win=65160 Len=0 MSS=1460 SACK_PERM TSval=2336972710 TSecr=3684867735 WS=128"
3,0.006863,192.168.11.20,192.168.11.19,TCP,66,0.000119,,0.000119,"Jan  6, 2024 19:36:11.827526000 JST",,53352  >  6000 [ACK] Seq=1 Ack=1 Win=64256 Len=0 TSval=3684867744 TSecr=2336972710
4,0.007097,192.168.11.20,192.168.11.19,TCP,93,,,0.000234,"Jan  6, 2024 19:36:11.827760000 JST",,"53352  >  6000 [PSH, ACK] Seq=1 Ack=1 Win=64256 Len=27 TSval=3684867745 TSecr=2336972710 [TCP segment of a reassembled PDU]"
5,0.007233,192.168.11.20,192.168.11.19,TCP,66,,,0.000136,"Jan  6, 2024 19:36:11.827896000 JST",,"53352  >  6000 [FIN, ACK] Seq=28 Ack=1 Win=64256 Len=0 TSval=3684867745 TSecr=2336972710"
6,0.014477,192.168.11.19,192.168.11.20,TCP,66,0.00738,,0.007244,"Jan  6, 2024 19:36:11.835140000 JST",,6000  >  53352 [ACK] Seq=1 Ack=28 Win=65152 Len=0 TSval=2336972717 TSecr=3684867745
7,0.014698,192.168.11.19,192.168.11.20,TCP,66,0.007465,,0.000221,"Jan  6, 2024 19:36:11.835361000 JST",,"6000  >  53352 [FIN, ACK] Seq=1 Ack=29 Win=65152 Len=0 TSval=2336972719 TSecr=3684867745"
8,0.014743,192.168.11.20,192.168.11.19,TCP,66,0.000045,,0.000045,"Jan  6, 2024 19:36:11.835406000 JST",,53352  >  6000 [ACK] Seq=29 Ack=2 Win=64256 Len=0 TSval=3684867752 TSecr=2336972719
9,0.044768,192.168.11.20,255.255.255.255,UDP,209,,Åü,0.030025,"Jan  6, 2024 19:36:11.865431000 JST",7b2273656d616e74696373223a207b22656e74697479223a2022504944222c202262617365656e74697479223a2022616e79222c2022726f6c65223a2022747474222c20227370617469616c223a2022616e79222c202274656d706f72616c223a2022616e79227d2c20226461746170726f7065727479223a207b22666f726d6174223a2022696e616f6b615f70726f6772616d5f73616d706c655f73656d616e746963227d7d,56779  >  7000 Len=167
10,1.046059,192.168.11.20,255.255.255.255,UDP,209,,Åú,1.001291,"Jan  6, 2024 19:36:12.866722000 JST",7b2273656d616e74696373223a207b22656e74697479223a2022504944222c202262617365656e74697479223a2022616e79222c2022726f6c65223a2022747474222c20227370617469616c223a2022616e79222c202274656d706f72616c223a2022616e79227d2c20226461746170726f7065727479223a207b22666f726d6174223a2022696e616f6b615f70726f6772616d5f73616d706c655f73656d616e746963227d7d,56779  >  7000 Len=167
11,1.056088,192.168.11.12,192.168.11.20,TCP,74,,Åú,0.010029,"Jan  6, 2024 19:36:12.876751000 JST",,53982  >  6000 [SYN] Seq=0 Win=64240 Len=0 MSS=1460 SACK_PERM TSval=775406051 TSecr=0 WS=128
12,1.05622,192.168.11.20,192.168.11.12,TCP,74,0.000132,,0.000132,"Jan  6, 2024 19:36:12.876883000 JST",,"6000  >  53982 [SYN, ACK] Seq=0 Ack=1 Win=65160 Len=0 MSS=1460 SACK_PERM TSval=780898723 TSecr=775406051 WS=128"
13,1.06314,192.168.11.12,192.168.11.20,TCP,66,0.00692,,0.00692,"Jan  6, 2024 19:36:12.883803000 JST",,53982  >  6000 [ACK] Seq=1 Ack=1 Win=64256 Len=0 TSval=775406061 TSecr=780898723
14,1.06374,192.168.11.12,192.168.11.20,TCP,93,,,0.0006,"Jan  6, 2024 19:36:12.884403000 JST",,"53982  >  6000 [PSH, ACK] Seq=1 Ack=1 Win=64256 Len=27 TSval=775406062 TSecr=780898723 [TCP segment of a reassembled PDU]"
15,1.063841,192.168.11.20,192.168.11.12,TCP,66,0.000101,,0.000101,"Jan  6, 2024 19:36:12.884504000 JST",,6000  >  53982 [ACK] Seq=1 Ack=28 Win=65152 Len=0 TSval=780898730 TSecr=775406062
16,1.063929,192.168.11.12,192.168.11.20,TCP,66,,,0.000088,"Jan  6, 2024 19:36:12.884592000 JST",,"53982  >  6000 [FIN, ACK] Seq=28 Ack=1 Win=64256 Len=0 TSval=775406062 TSecr=780898723"
17,1.065496,192.168.11.20,192.168.11.12,TCP,66,0.001567,,0.001567,"Jan  6, 2024 19:36:12.886159000 JST",,"6000  >  53982 [FIN, ACK] Seq=1 Ack=29 Win=65152 Len=0 TSval=780898732 TSecr=775406062"
18,1.071435,192.168.11.12,192.168.11.20,TCP,66,0.005939,,0.005939,"Jan  6, 2024 19:36:12.892098000 JST",,53982  >  6000 [ACK] Seq=29 Ack=2 Win=64256 Len=0 TSval=775406069 TSecr=780898732
19,10.306219,192.168.11.20,192.168.11.19,TCP,74,,,9.234784,"Jan  6, 2024 19:36:22.126882000 JST",,54744  >  6000 [SYN] Seq=0 Win=64240 Len=0 MSS=1460 SACK_PERM TSval=3684878044 TSecr=0 WS=128
20,10.313176,192.168.11.19,192.168.11.20,TCP,74,0.006957,,0.006957,"Jan  6, 2024 19:36:22.133839000 JST",,"6000  >  54744 [SYN, ACK] Seq=0 Ack=1 Win=65160 Len=0 MSS=1460 SACK_PERM TSval=2336983016 TSecr=3684878044 WS=128"
21,10.313285,192.168.11.20,192.168.11.19,TCP,66,0.000109,,0.000109,"Jan  6, 2024 19:36:22.133948000 JST",,54744  >  6000 [ACK] Seq=1 Ack=1 Win=64256 Len=0 TSval=3684878051 TSecr=2336983016
22,10.313434,192.168.11.20,192.168.11.19,TCP,93,,,0.000149,"Jan  6, 2024 19:36:22.134097000 JST",,"54744  >  6000 [PSH, ACK] Seq=1 Ack=1 Win=64256 Len=27 TSval=3684878051 TSecr=2336983016 [TCP segment of a reassembled PDU]"
23,10.313545,192.168.11.20,192.168.11.19,TCP,66,,,0.000111,"Jan  6, 2024 19:36:22.134208000 JST",,"54744  >  6000 [FIN, ACK] Seq=28 Ack=1 Win=64256 Len=0 TSval=3684878051 TSecr=2336983016"
24,10.320544,192.168.11.19,192.168.11.20,TCP,66,0.00711,,0.006999,"Jan  6, 2024 19:36:22.141207000 JST",,6000  >  54744 [ACK] Seq=1 Ack=28 Win=65152 Len=0 TSval=2336983024 TSecr=3684878051
25,10.320899,192.168.11.19,192.168.11.20,TCP,66,0.007354,,0.000355,"Jan  6, 2024 19:36:22.141562000 JST",,"6000  >  54744 [FIN, ACK] Seq=1 Ack=29 Win=65152 Len=0 TSval=2336983025 TSecr=3684878051"
26,10.320958,192.168.11.20,192.168.11.19,TCP,66,0.000059,,0.000059,"Jan  6, 2024 19:36:22.141621000 JST",,54744  >  6000 [ACK] Seq=29 Ack=2 Win=64256 Len=0 TSval=3684878058 TSecr=2336983025
27,10.355782,192.168.11.20,255.255.255.255,UDP,209,,Åü,0.034824,"Jan  6, 2024 19:36:22.176445000 JST",7b2273656d616e74696373223a207b22656e74697479223a2022504944222c202262617365656e74697479223a2022616e79222c2022726f6c65223a2022747474222c20227370617469616c223a2022616e79222c202274656d706f72616c223a2022616e79227d2c20226461746170726f7065727479223a207b22666f726d6174223a2022696e616f6b615f70726f6772616d5f73616d706c655f73656d616e746963227d7d,49663  >  7000 Len=167
28,10.36295,192.168.11.12,192.168.11.20,TCP,74,,Åú,0.007168,"Jan  6, 2024 19:36:22.183613000 JST",,60714  >  6000 [SYN] Seq=0 Win=64240 Len=0 MSS=1460 SACK_PERM TSval=775415360 TSecr=0 WS=128
29,10.3631,192.168.11.20,192.168.11.12,TCP,74,0.00015,,0.00015,"Jan  6, 2024 19:36:22.183763000 JST",,"6000  >  60714 [SYN, ACK] Seq=0 Ack=1 Win=65160 Len=0 MSS=1460 SACK_PERM TSval=780908030 TSecr=775415360 WS=128"
30,10.369884,192.168.11.12,192.168.11.20,TCP,66,0.006784,,0.006784,"Jan  6, 2024 19:36:22.190547000 JST",,60714  >  6000 [ACK] Seq=1 Ack=1 Win=64256 Len=0 TSval=775415368 TSecr=780908030
31,10.370457,192.168.11.12,192.168.11.20,TCP,93,,,0.000573,"Jan  6, 2024 19:36:22.191120000 JST",,"60714  >  6000 [PSH, ACK] Seq=1 Ack=1 Win=64256 Len=27 TSval=775415368 TSecr=780908030 [TCP segment of a reassembled PDU]"
32,10.370539,192.168.11.20,192.168.11.12,TCP,66,0.000082,,0.000082,"Jan  6, 2024 19:36:22.191202000 JST",,6000  >  60714 [ACK] Seq=1 Ack=28 Win=65152 Len=0 TSval=780908037 TSecr=775415368
33,10.370619,192.168.11.12,192.168.11.20,TCP,66,,,0.00008,"Jan  6, 2024 19:36:22.191282000 JST",,"60714  >  6000 [FIN, ACK] Seq=28 Ack=1 Win=64256 Len=0 TSval=775415368 TSecr=780908030"
34,10.3717,192.168.11.20,192.168.11.12,TCP,66,0.001081,,0.001081,"Jan  6, 2024 19:36:22.192363000 JST",,"6000  >  60714 [FIN, ACK] Seq=1 Ack=29 Win=65152 Len=0 TSval=780908038 TSecr=775415368"
35,10.378348,192.168.11.12,192.168.11.20,TCP,66,0.006648,,0.006648,"Jan  6, 2024 19:36:22.199011000 JST",,60714  >  6000 [ACK] Seq=29 Ack=2 Win=64256 Len=0 TSval=775415376 TSecr=780908038
36,20.173296,192.168.11.20,192.168.11.19,TCP,74,,,9.794948,"Jan  6, 2024 19:36:31.993959000 JST",,54756  >  6000 [SYN] Seq=0 Win=64240 Len=0 MSS=1460 SACK_PERM TSval=3684887911 TSecr=0 WS=128
37,20.180363,192.168.11.19,192.168.11.20,TCP,74,0.007067,,0.007067,"Jan  6, 2024 19:36:32.001026000 JST",,"6000  >  54756 [SYN, ACK] Seq=0 Ack=1 Win=65160 Len=0 MSS=1460 SACK_PERM TSval=2336992883 TSecr=3684887911 WS=128"
38,20.180475,192.168.11.20,192.168.11.19,TCP,66,0.000112,,0.000112,"Jan  6, 2024 19:36:32.001138000 JST",,54756  >  6000 [ACK] Seq=1 Ack=1 Win=64256 Len=0 TSval=3684887918 TSecr=2336992883
39,20.180647,192.168.11.20,192.168.11.19,TCP,93,,,0.000172,"Jan  6, 2024 19:36:32.001310000 JST",,"54756  >  6000 [PSH, ACK] Seq=1 Ack=1 Win=64256 Len=27 TSval=3684887918 TSecr=2336992883 [TCP segment of a reassembled PDU]"
40,20.180757,192.168.11.20,192.168.11.19,TCP,66,,,0.00011,"Jan  6, 2024 19:36:32.001420000 JST",,"54756  >  6000 [FIN, ACK] Seq=28 Ack=1 Win=64256 Len=0 TSval=3684887918 TSecr=2336992883"
41,20.187525,192.168.11.19,192.168.11.20,TCP,66,0.006878,,0.006768,"Jan  6, 2024 19:36:32.008188000 JST",,6000  >  54756 [ACK] Seq=1 Ack=28 Win=65152 Len=0 TSval=2336992891 TSecr=3684887918
42,20.1879,192.168.11.19,192.168.11.20,TCP,66,0.007143,,0.000375,"Jan  6, 2024 19:36:32.008563000 JST",,"6000  >  54756 [FIN, ACK] Seq=1 Ack=29 Win=65152 Len=0 TSval=2336992892 TSecr=3684887918"
43,20.187944,192.168.11.20,192.168.11.19,TCP,66,0.000044,,0.000044,"Jan  6, 2024 19:36:32.008607000 JST",,54756  >  6000 [ACK] Seq=29 Ack=2 Win=64256 Len=0 TSval=3684887925 TSecr=2336992892
44,20.216894,192.168.11.20,255.255.255.255,UDP,209,,Åü,0.02895,"Jan  6, 2024 19:36:32.037557000 JST",7b2273656d616e74696373223a207b22656e74697479223a2022504944222c202262617365656e74697479223a2022616e79222c2022726f6c65223a2022747474222c20227370617469616c223a2022616e79222c202274656d706f72616c223a2022616e79227d2c20226461746170726f7065727479223a207b22666f726d6174223a2022696e616f6b615f70726f6772616d5f73616d706c655f73656d616e746963227d7d,46682  >  7000 Len=167
45,20.222527,192.168.11.12,192.168.11.20,TCP,74,,Åú,0.005633,"Jan  6, 2024 19:36:32.043190000 JST",,49588  >  6000 [SYN] Seq=0 Win=64240 Len=0 MSS=1460 SACK_PERM TSval=775425221 TSecr=0 WS=128
46,20.222654,192.168.11.20,192.168.11.12,TCP,74,0.000127,,0.000127,"Jan  6, 2024 19:36:32.043317000 JST",,"6000  >  49588 [SYN, ACK] Seq=0 Ack=1 Win=65160 Len=0 MSS=1460 SACK_PERM TSval=780917889 TSecr=775425221 WS=128"
47,20.229414,192.168.11.12,192.168.11.20,TCP,66,0.00676,,0.00676,"Jan  6, 2024 19:36:32.050077000 JST",,49588  >  6000 [ACK] Seq=1 Ack=1 Win=64256 Len=0 TSval=775425227 TSecr=780917889
48,20.229986,192.168.11.12,192.168.11.20,TCP,93,,,0.000572,"Jan  6, 2024 19:36:32.050649000 JST",,"49588  >  6000 [PSH, ACK] Seq=1 Ack=1 Win=64256 Len=27 TSval=775425228 TSecr=780917889 [TCP segment of a reassembled PDU]"
49,20.230064,192.168.11.20,192.168.11.12,TCP,66,0.000078,,0.000078,"Jan  6, 2024 19:36:32.050727000 JST",,6000  >  49588 [ACK] Seq=1 Ack=28 Win=65152 Len=0 TSval=780917896 TSecr=775425228
50,20.230134,192.168.11.12,192.168.11.20,TCP,66,,,0.00007,"Jan  6, 2024 19:36:32.050797000 JST",,"49588  >  6000 [FIN, ACK] Seq=28 Ack=1 Win=64256 Len=0 TSval=775425228 TSecr=780917889"
51,20.23132,192.168.11.20,192.168.11.12,TCP,66,0.001186,,0.001186,"Jan  6, 2024 19:36:32.051983000 JST",,"6000  >  49588 [FIN, ACK] Seq=1 Ack=29 Win=65152 Len=0 TSval=780917898 TSecr=775425228"
52,20.237334,192.168.11.12,192.168.11.20,TCP,66,0.006014,,0.006014,"Jan  6, 2024 19:36:32.057997000 JST",,49588  >  6000 [ACK] Seq=29 Ack=2 Win=64256 Len=0 TSval=775425235 TSecr=780917898
53,30.091788,192.168.11.20,192.168.11.19,TCP,74,,,9.854454,"Jan  6, 2024 19:36:41.912451000 JST",,60582  >  6000 [SYN] Seq=0 Win=64240 Len=0 MSS=1460 SACK_PERM TSval=3684897829 TSecr=0 WS=128
54,30.098558,192.168.11.19,192.168.11.20,TCP,74,0.00677,,0.00677,"Jan  6, 2024 19:36:41.919221000 JST",,"6000  >  60582 [SYN, ACK] Seq=0 Ack=1 Win=65160 Len=0 MSS=1460 SACK_PERM TSval=2337002802 TSecr=3684897829 WS=128"
55,30.098671,192.168.11.20,192.168.11.19,TCP,66,0.000113,,0.000113,"Jan  6, 2024 19:36:41.919334000 JST",,60582  >  6000 [ACK] Seq=1 Ack=1 Win=64256 Len=0 TSval=3684897836 TSecr=2337002802
56,30.098812,192.168.11.20,192.168.11.19,TCP,93,,,0.000141,"Jan  6, 2024 19:36:41.919475000 JST",,"60582  >  6000 [PSH, ACK] Seq=1 Ack=1 Win=64256 Len=27 TSval=3684897836 TSecr=2337002802 [TCP segment of a reassembled PDU]"
57,30.098939,192.168.11.20,192.168.11.19,TCP,66,,,0.000127,"Jan  6, 2024 19:36:41.919602000 JST",,"60582  >  6000 [FIN, ACK] Seq=28 Ack=1 Win=64256 Len=0 TSval=3684897836 TSecr=2337002802"
58,30.10592,192.168.11.19,192.168.11.20,TCP,66,0.007108,,0.006981,"Jan  6, 2024 19:36:41.926583000 JST",,6000  >  60582 [ACK] Seq=1 Ack=28 Win=65152 Len=0 TSval=2337002809 TSecr=3684897836
59,30.106284,192.168.11.19,192.168.11.20,TCP,66,0.007345,,0.000364,"Jan  6, 2024 19:36:41.926947000 JST",,"6000  >  60582 [FIN, ACK] Seq=1 Ack=29 Win=65152 Len=0 TSval=2337002810 TSecr=3684897836"
60,30.106336,192.168.11.20,192.168.11.19,TCP,66,0.000052,,0.000052,"Jan  6, 2024 19:36:41.926999000 JST",,60582  >  6000 [ACK] Seq=29 Ack=2 Win=64256 Len=0 TSval=3684897844 TSecr=2337002810
61,30.136476,192.168.11.20,255.255.255.255,UDP,209,,Åü,0.03014,"Jan  6, 2024 19:36:41.957139000 JST",7b2273656d616e74696373223a207b22656e74697479223a2022504944222c202262617365656e74697479223a2022616e79222c2022726f6c65223a2022747474222c20227370617469616c223a2022616e79222c202274656d706f72616c223a2022616e79227d2c20226461746170726f7065727479223a207b22666f726d6174223a2022696e616f6b615f70726f6772616d5f73616d706c655f73656d616e746963227d7d,42632  >  7000 Len=167
62,30.142842,192.168.11.12,192.168.11.20,TCP,74,,Åú,0.006366,"Jan  6, 2024 19:36:41.963505000 JST",,33442  >  6000 [SYN] Seq=0 Win=64240 Len=0 MSS=1460 SACK_PERM TSval=775435140 TSecr=0 WS=128
63,30.142982,192.168.11.20,192.168.11.12,TCP,74,0.00014,,0.00014,"Jan  6, 2024 19:36:41.963645000 JST",,"6000  >  33442 [SYN, ACK] Seq=0 Ack=1 Win=65160 Len=0 MSS=1460 SACK_PERM TSval=780927809 TSecr=775435140 WS=128"
64,30.15082,192.168.11.12,192.168.11.20,TCP,66,0.007838,,0.007838,"Jan  6, 2024 19:36:41.971483000 JST",,33442  >  6000 [ACK] Seq=1 Ack=1 Win=64256 Len=0 TSval=775435148 TSecr=780927809
65,30.151491,192.168.11.12,192.168.11.20,TCP,93,,,0.000671,"Jan  6, 2024 19:36:41.972154000 JST",,"33442  >  6000 [PSH, ACK] Seq=1 Ack=1 Win=64256 Len=27 TSval=775435148 TSecr=780927809 [TCP segment of a reassembled PDU]"
66,30.151615,192.168.11.20,192.168.11.12,TCP,66,0.000124,,0.000124,"Jan  6, 2024 19:36:41.972278000 JST",,6000  >  33442 [ACK] Seq=1 Ack=28 Win=65152 Len=0 TSval=780927818 TSecr=775435148
67,30.15169,192.168.11.12,192.168.11.20,TCP,66,,,0.000075,"Jan  6, 2024 19:36:41.972353000 JST",,"33442  >  6000 [FIN, ACK] Seq=28 Ack=1 Win=64256 Len=0 TSval=775435148 TSecr=780927809"
68,30.153046,192.168.11.20,192.168.11.12,TCP,66,0.001356,,0.001356,"Jan  6, 2024 19:36:41.973709000 JST",,"6000  >  33442 [FIN, ACK] Seq=1 Ack=29 Win=65152 Len=0 TSval=780927819 TSecr=775435148"
69,30.162893,192.168.11.12,192.168.11.20,TCP,66,0.009847,,0.009847,"Jan  6, 2024 19:36:41.983556000 JST",,33442  >  6000 [ACK] Seq=29 Ack=2 Win=64256 Len=0 TSval=775435161 TSecr=780927819
70,37.90755,192.168.11.20,192.168.11.19,TCP,74,,,7.744657,"Jan  6, 2024 19:36:49.728213000 JST",,52120  >  6000 [SYN] Seq=0 Win=64240 Len=0 MSS=1460 SACK_PERM TSval=3684905645 TSecr=0 WS=128
71,37.914645,192.168.11.19,192.168.11.20,TCP,74,0.007095,,0.007095,"Jan  6, 2024 19:36:49.735308000 JST",,"6000  >  52120 [SYN, ACK] Seq=0 Ack=1 Win=65160 Len=0 MSS=1460 SACK_PERM TSval=2337010618 TSecr=3684905645 WS=128"
72,37.914745,192.168.11.20,192.168.11.19,TCP,66,0.0001,,0.0001,"Jan  6, 2024 19:36:49.735408000 JST",,52120  >  6000 [ACK] Seq=1 Ack=1 Win=64256 Len=0 TSval=3684905652 TSecr=2337010618
73,37.914884,192.168.11.20,192.168.11.19,TCP,93,,,0.000139,"Jan  6, 2024 19:36:49.735547000 JST",,"52120  >  6000 [PSH, ACK] Seq=1 Ack=1 Win=64256 Len=27 TSval=3684905652 TSecr=2337010618 [TCP segment of a reassembled PDU]"
74,37.914989,192.168.11.20,192.168.11.19,TCP,66,,,0.000105,"Jan  6, 2024 19:36:49.735652000 JST",,"52120  >  6000 [FIN, ACK] Seq=28 Ack=1 Win=64256 Len=0 TSval=3684905652 TSecr=2337010618"
75,37.921943,192.168.11.19,192.168.11.20,TCP,66,0.007059,,0.006954,"Jan  6, 2024 19:36:49.742606000 JST",,6000  >  52120 [ACK] Seq=1 Ack=28 Win=65152 Len=0 TSval=2337010625 TSecr=3684905652
76,37.9223,192.168.11.19,192.168.11.20,TCP,66,0.007311,,0.000357,"Jan  6, 2024 19:36:49.742963000 JST",,"6000  >  52120 [FIN, ACK] Seq=1 Ack=29 Win=65152 Len=0 TSval=2337010626 TSecr=3684905652"
77,37.922343,192.168.11.20,192.168.11.19,TCP,66,0.000043,,0.000043,"Jan  6, 2024 19:36:49.743006000 JST",,52120  >  6000 [ACK] Seq=29 Ack=2 Win=64256 Len=0 TSval=3684905660 TSecr=2337010626
78,37.951426,192.168.11.20,255.255.255.255,UDP,209,,Åü,0.029083,"Jan  6, 2024 19:36:49.772089000 JST",7b2273656d616e74696373223a207b22656e74697479223a2022504944222c202262617365656e74697479223a2022616e79222c2022726f6c65223a2022747474222c20227370617469616c223a2022616e79222c202274656d706f72616c223a2022616e79227d2c20226461746170726f7065727479223a207b22666f726d6174223a2022696e616f6b615f70726f6772616d5f73616d706c655f73656d616e746963227d7d,45401  >  7000 Len=167
79,37.958187,192.168.11.12,192.168.11.20,TCP,74,,Åú,0.006761,"Jan  6, 2024 19:36:49.778850000 JST",,54552  >  6000 [SYN] Seq=0 Win=64240 Len=0 MSS=1460 SACK_PERM TSval=775442955 TSecr=0 WS=128
80,37.958327,192.168.11.20,192.168.11.12,TCP,74,0.00014,,0.00014,"Jan  6, 2024 19:36:49.778990000 JST",,"6000  >  54552 [SYN, ACK] Seq=0 Ack=1 Win=65160 Len=0 MSS=1460 SACK_PERM TSval=780935625 TSecr=775442955 WS=128"
81,37.965935,192.168.11.12,192.168.11.20,TCP,66,0.007608,,0.007608,"Jan  6, 2024 19:36:49.786598000 JST",,54552  >  6000 [ACK] Seq=1 Ack=1 Win=64256 Len=0 TSval=775442964 TSecr=780935625
82,37.966474,192.168.11.12,192.168.11.20,TCP,93,,,0.000539,"Jan  6, 2024 19:36:49.787137000 JST",,"54552  >  6000 [PSH, ACK] Seq=1 Ack=1 Win=64256 Len=27 TSval=775442964 TSecr=780935625 [TCP segment of a reassembled PDU]"
83,37.96655,192.168.11.20,192.168.11.12,TCP,66,0.000076,,0.000076,"Jan  6, 2024 19:36:49.787213000 JST",,6000  >  54552 [ACK] Seq=1 Ack=28 Win=65152 Len=0 TSval=780935633 TSecr=775442964
84,37.966611,192.168.11.12,192.168.11.20,TCP,66,,,0.000061,"Jan  6, 2024 19:36:49.787274000 JST",,"54552  >  6000 [FIN, ACK] Seq=28 Ack=1 Win=64256 Len=0 TSval=775442964 TSecr=780935625"
85,37.968494,192.168.11.20,192.168.11.12,TCP,66,0.001883,,0.001883,"Jan  6, 2024 19:36:49.789157000 JST",,"6000  >  54552 [FIN, ACK] Seq=1 Ack=29 Win=65152 Len=0 TSval=780935635 TSecr=775442964"
86,37.974819,192.168.11.12,192.168.11.20,TCP,66,0.006325,,0.006325,"Jan  6, 2024 19:36:49.795482000 JST",,54552  >  6000 [ACK] Seq=29 Ack=2 Win=64256 Len=0 TSval=775442972 TSecr=780935635
87,45.716335,192.168.11.20,192.168.11.19,TCP,74,,,7.741516,"Jan  6, 2024 19:36:57.536998000 JST",,34100  >  6000 [SYN] Seq=0 Win=64240 Len=0 MSS=1460 SACK_PERM TSval=3684913454 TSecr=0 WS=128
88,45.723199,192.168.11.19,192.168.11.20,TCP,74,0.006864,,0.006864,"Jan  6, 2024 19:36:57.543862000 JST",,"6000  >  34100 [SYN, ACK] Seq=0 Ack=1 Win=65160 Len=0 MSS=1460 SACK_PERM TSval=2337018426 TSecr=3684913454 WS=128"
89,45.7233,192.168.11.20,192.168.11.19,TCP,66,0.000101,,0.000101,"Jan  6, 2024 19:36:57.543963000 JST",,34100  >  6000 [ACK] Seq=1 Ack=1 Win=64256 Len=0 TSval=3684913461 TSecr=2337018426
90,45.723479,192.168.11.20,192.168.11.19,TCP,93,,,0.000179,"Jan  6, 2024 19:36:57.544142000 JST",,"34100  >  6000 [PSH, ACK] Seq=1 Ack=1 Win=64256 Len=27 TSval=3684913461 TSecr=2337018426 [TCP segment of a reassembled PDU]"
91,45.723576,192.168.11.20,192.168.11.19,TCP,66,,,0.000097,"Jan  6, 2024 19:36:57.544239000 JST",,"34100  >  6000 [FIN, ACK] Seq=28 Ack=1 Win=64256 Len=0 TSval=3684913461 TSecr=2337018426"
92,45.730516,192.168.11.19,192.168.11.20,TCP,66,0.007037,,0.00694,"Jan  6, 2024 19:36:57.551179000 JST",,6000  >  34100 [ACK] Seq=1 Ack=28 Win=65152 Len=0 TSval=2337018434 TSecr=3684913461
93,45.73087,192.168.11.19,192.168.11.20,TCP,66,0.007294,,0.000354,"Jan  6, 2024 19:36:57.551533000 JST",,"6000  >  34100 [FIN, ACK] Seq=1 Ack=29 Win=65152 Len=0 TSval=2337018435 TSecr=3684913461"
94,45.730914,192.168.11.20,192.168.11.19,TCP,66,0.000044,,0.000044,"Jan  6, 2024 19:36:57.551577000 JST",,34100  >  6000 [ACK] Seq=29 Ack=2 Win=64256 Len=0 TSval=3684913468 TSecr=2337018435
95,45.761722,192.168.11.20,255.255.255.255,UDP,209,,Åü,0.030808,"Jan  6, 2024 19:36:57.582385000 JST",7b2273656d616e74696373223a207b22656e74697479223a2022504944222c202262617365656e74697479223a2022616e79222c2022726f6c65223a2022747474222c20227370617469616c223a2022616e79222c202274656d706f72616c223a2022616e79227d2c20226461746170726f7065727479223a207b22666f726d6174223a2022696e616f6b615f70726f6772616d5f73616d706c655f73656d616e746963227d7d,40452  >  7000 Len=167
96,45.76854,192.168.11.12,192.168.11.20,TCP,74,,Åú,0.006818,"Jan  6, 2024 19:36:57.589203000 JST",,46864  >  6000 [SYN] Seq=0 Win=64240 Len=0 MSS=1460 SACK_PERM TSval=775450766 TSecr=0 WS=128
97,45.768681,192.168.11.20,192.168.11.12,TCP,74,0.000141,,0.000141,"Jan  6, 2024 19:36:57.589344000 JST",,"6000  >  46864 [SYN, ACK] Seq=0 Ack=1 Win=65160 Len=0 MSS=1460 SACK_PERM TSval=780943435 TSecr=775450766 WS=128"
98,45.776892,192.168.11.12,192.168.11.20,TCP,66,0.008211,,0.008211,"Jan  6, 2024 19:36:57.597555000 JST",,46864  >  6000 [ACK] Seq=1 Ack=1 Win=64256 Len=0 TSval=775450775 TSecr=780943435
99,45.778331,192.168.11.12,192.168.11.20,TCP,93,,,0.001439,"Jan  6, 2024 19:36:57.598994000 JST",,"46864  >  6000 [PSH, ACK] Seq=1 Ack=1 Win=64256 Len=27 TSval=775450775 TSecr=780943435 [TCP segment of a reassembled PDU]"
100,45.778722,192.168.11.20,192.168.11.12,TCP,66,0.000391,,0.000391,"Jan  6, 2024 19:36:57.599385000 JST",,6000  >  46864 [ACK] Seq=1 Ack=28 Win=65152 Len=0 TSval=780943445 TSecr=775450775
101,45.778923,192.168.11.12,192.168.11.20,TCP,66,,,0.000201,"Jan  6, 2024 19:36:57.599586000 JST",,"46864  >  6000 [FIN, ACK] Seq=28 Ack=1 Win=64256 Len=0 TSval=775450775 TSecr=780943435"
102,45.780276,192.168.11.20,192.168.11.12,TCP,66,0.001353,,0.001353,"Jan  6, 2024 19:36:57.600939000 JST",,"6000  >  46864 [FIN, ACK] Seq=1 Ack=29 Win=65152 Len=0 TSval=780943447 TSecr=775450775"
103,45.786111,192.168.11.12,192.168.11.20,TCP,66,0.005835,,0.005835,"Jan  6, 2024 19:36:57.606774000 JST",,46864  >  6000 [ACK] Seq=29 Ack=2 Win=64256 Len=0 TSval=775450784 TSecr=780943447
104,53.577497,192.168.11.20,192.168.11.19,TCP,74,,,7.791386,"Jan  6, 2024 19:37:05.398160000 JST",,53314  >  6000 [SYN] Seq=0 Win=64240 Len=0 MSS=1460 SACK_PERM TSval=3684921315 TSecr=0 WS=128
105,53.58524,192.168.11.19,192.168.11.20,TCP,74,0.007743,,0.007743,"Jan  6, 2024 19:37:05.405903000 JST",,"6000  >  53314 [SYN, ACK] Seq=0 Ack=1 Win=65160 Len=0 MSS=1460 SACK_PERM TSval=2337026288 TSecr=3684921315 WS=128"
106,53.585337,192.168.11.20,192.168.11.19,TCP,66,0.000097,,0.000097,"Jan  6, 2024 19:37:05.406000000 JST",,53314  >  6000 [ACK] Seq=1 Ack=1 Win=64256 Len=0 TSval=3684921323 TSecr=2337026288
107,53.585496,192.168.11.20,192.168.11.19,TCP,93,,,0.000159,"Jan  6, 2024 19:37:05.406159000 JST",,"53314  >  6000 [PSH, ACK] Seq=1 Ack=1 Win=64256 Len=27 TSval=3684921323 TSecr=2337026288 [TCP segment of a reassembled PDU]"
108,53.585615,192.168.11.20,192.168.11.19,TCP,66,,,0.000119,"Jan  6, 2024 19:37:05.406278000 JST",,"53314  >  6000 [FIN, ACK] Seq=28 Ack=1 Win=64256 Len=0 TSval=3684921323 TSecr=2337026288"
109,53.592844,192.168.11.19,192.168.11.20,TCP,66,0.007348,,0.007229,"Jan  6, 2024 19:37:05.413507000 JST",,6000  >  53314 [ACK] Seq=1 Ack=28 Win=65152 Len=0 TSval=2337026296 TSecr=3684921323
110,53.593211,192.168.11.19,192.168.11.20,TCP,66,0.007596,,0.000367,"Jan  6, 2024 19:37:05.413874000 JST",,"6000  >  53314 [FIN, ACK] Seq=1 Ack=29 Win=65152 Len=0 TSval=2337026297 TSecr=3684921323"
111,53.593258,192.168.11.20,192.168.11.19,TCP,66,0.000047,,0.000047,"Jan  6, 2024 19:37:05.413921000 JST",,53314  >  6000 [ACK] Seq=29 Ack=2 Win=64256 Len=0 TSval=3684921331 TSecr=2337026297
112,53.625613,192.168.11.20,255.255.255.255,UDP,209,,Åü,0.032355,"Jan  6, 2024 19:37:05.446276000 JST",7b2273656d616e74696373223a207b22656e74697479223a2022504944222c202262617365656e74697479223a2022616e79222c2022726f6c65223a2022747474222c20227370617469616c223a2022616e79222c202274656d706f72616c223a2022616e79227d2c20226461746170726f7065727479223a207b22666f726d6174223a2022696e616f6b615f70726f6772616d5f73616d706c655f73656d616e746963227d7d,44922  >  7000 Len=167
113,53.631259,192.168.11.12,192.168.11.20,TCP,74,,Åú,0.005646,"Jan  6, 2024 19:37:05.451922000 JST",,46866  >  6000 [SYN] Seq=0 Win=64240 Len=0 MSS=1460 SACK_PERM TSval=775458629 TSecr=0 WS=128
114,53.631409,192.168.11.20,192.168.11.12,TCP,74,0.00015,,0.00015,"Jan  6, 2024 19:37:05.452072000 JST",,"6000  >  46866 [SYN, ACK] Seq=0 Ack=1 Win=65160 Len=0 MSS=1460 SACK_PERM TSval=780951298 TSecr=775458629 WS=128"
115,53.641343,192.168.11.12,192.168.11.20,TCP,66,0.009934,,0.009934,"Jan  6, 2024 19:37:05.462006000 JST",,46866  >  6000 [ACK] Seq=1 Ack=1 Win=64256 Len=0 TSval=775458640 TSecr=780951298
116,53.642263,192.168.11.12,192.168.11.20,TCP,93,,,0.00092,"Jan  6, 2024 19:37:05.462926000 JST",,"46866  >  6000 [PSH, ACK] Seq=1 Ack=1 Win=64256 Len=27 TSval=775458640 TSecr=780951298 [TCP segment of a reassembled PDU]"
117,53.642454,192.168.11.20,192.168.11.12,TCP,66,0.000191,,0.000191,"Jan  6, 2024 19:37:05.463117000 JST",,6000  >  46866 [ACK] Seq=1 Ack=28 Win=65152 Len=0 TSval=780951309 TSecr=775458640
118,53.642554,192.168.11.12,192.168.11.20,TCP,66,,,0.0001,"Jan  6, 2024 19:37:05.463217000 JST",,"46866  >  6000 [FIN, ACK] Seq=28 Ack=1 Win=64256 Len=0 TSval=775458640 TSecr=780951298"
119,53.643749,192.168.11.20,192.168.11.12,TCP,66,0.001195,,0.001195,"Jan  6, 2024 19:37:05.464412000 JST",,"6000  >  46866 [FIN, ACK] Seq=1 Ack=29 Win=65152 Len=0 TSval=780951310 TSecr=775458640"
120,53.649602,192.168.11.12,192.168.11.20,TCP,66,0.005853,,0.005853,"Jan  6, 2024 19:37:05.470265000 JST",,46866  >  6000 [ACK] Seq=29 Ack=2 Win=64256 Len=0 TSval=775458648 TSecr=780951310
121,61.884399,192.168.11.20,192.168.11.19,TCP,74,,,8.234797,"Jan  6, 2024 19:37:13.705062000 JST",,40408  >  6000 [SYN] Seq=0 Win=64240 Len=0 MSS=1460 SACK_PERM TSval=3684929622 TSecr=0 WS=128
122,61.892372,192.168.11.19,192.168.11.20,TCP,74,0.007973,,0.007973,"Jan  6, 2024 19:37:13.713035000 JST",,"6000  >  40408 [SYN, ACK] Seq=0 Ack=1 Win=65160 Len=0 MSS=1460 SACK_PERM TSval=2337034595 TSecr=3684929622 WS=128"
123,61.892474,192.168.11.20,192.168.11.19,TCP,66,0.000102,,0.000102,"Jan  6, 2024 19:37:13.713137000 JST",,40408  >  6000 [ACK] Seq=1 Ack=1 Win=64256 Len=0 TSval=3684929630 TSecr=2337034595
124,61.892665,192.168.11.20,192.168.11.19,TCP,93,,,0.000191,"Jan  6, 2024 19:37:13.713328000 JST",,"40408  >  6000 [PSH, ACK] Seq=1 Ack=1 Win=64256 Len=27 TSval=3684929630 TSecr=2337034595 [TCP segment of a reassembled PDU]"
125,61.892761,192.168.11.20,192.168.11.19,TCP,66,,,0.000096,"Jan  6, 2024 19:37:13.713424000 JST",,"40408  >  6000 [FIN, ACK] Seq=28 Ack=1 Win=64256 Len=0 TSval=3684929630 TSecr=2337034595"
126,61.901427,192.168.11.19,192.168.11.20,TCP,66,0.008762,,0.008666,"Jan  6, 2024 19:37:13.722090000 JST",,6000  >  40408 [ACK] Seq=1 Ack=28 Win=65152 Len=0 TSval=2337034603 TSecr=3684929630
127,61.901677,192.168.11.19,192.168.11.20,TCP,66,0.008916,,0.00025,"Jan  6, 2024 19:37:13.722340000 JST",,"6000  >  40408 [FIN, ACK] Seq=1 Ack=29 Win=65152 Len=0 TSval=2337034605 TSecr=3684929630"
128,61.901721,192.168.11.20,192.168.11.19,TCP,66,0.000044,,0.000044,"Jan  6, 2024 19:37:13.722384000 JST",,40408  >  6000 [ACK] Seq=29 Ack=2 Win=64256 Len=0 TSval=3684929639 TSecr=2337034605
129,61.9313,192.168.11.20,255.255.255.255,UDP,209,,Åü,0.029579,"Jan  6, 2024 19:37:13.751963000 JST",7b2273656d616e74696373223a207b22656e74697479223a2022504944222c202262617365656e74697479223a2022616e79222c2022726f6c65223a2022747474222c20227370617469616c223a2022616e79222c202274656d706f72616c223a2022616e79227d2c20226461746170726f7065727479223a207b22666f726d6174223a2022696e616f6b615f70726f6772616d5f73616d706c655f73656d616e746963227d7d,54147  >  7000 Len=167
130,61.937077,192.168.11.12,192.168.11.20,TCP,74,,Åú,0.005777,"Jan  6, 2024 19:37:13.757740000 JST",,56156  >  6000 [SYN] Seq=0 Win=64240 Len=0 MSS=1460 SACK_PERM TSval=775466935 TSecr=0 WS=128
131,61.937242,192.168.11.20,192.168.11.12,TCP,74,0.000165,,0.000165,"Jan  6, 2024 19:37:13.757905000 JST",,"6000  >  56156 [SYN, ACK] Seq=0 Ack=1 Win=65160 Len=0 MSS=1460 SACK_PERM TSval=780959604 TSecr=775466935 WS=128"
132,61.944322,192.168.11.12,192.168.11.20,TCP,66,0.00708,,0.00708,"Jan  6, 2024 19:37:13.764985000 JST",,56156  >  6000 [ACK] Seq=1 Ack=1 Win=64256 Len=0 TSval=775466942 TSecr=780959604
133,61.944879,192.168.11.12,192.168.11.20,TCP,93,,,0.000557,"Jan  6, 2024 19:37:13.765542000 JST",,"56156  >  6000 [PSH, ACK] Seq=1 Ack=1 Win=64256 Len=27 TSval=775466943 TSecr=780959604 [TCP segment of a reassembled PDU]"
134,61.944959,192.168.11.20,192.168.11.12,TCP,66,0.00008,,0.00008,"Jan  6, 2024 19:37:13.765622000 JST",,6000  >  56156 [ACK] Seq=1 Ack=28 Win=65152 Len=0 TSval=780959611 TSecr=775466943
135,61.945174,192.168.11.12,192.168.11.20,TCP,66,,,0.000215,"Jan  6, 2024 19:37:13.765837000 JST",,"56156  >  6000 [FIN, ACK] Seq=28 Ack=1 Win=64256 Len=0 TSval=775466943 TSecr=780959604"
136,61.946117,192.168.11.20,192.168.11.12,TCP,66,0.000943,,0.000943,"Jan  6, 2024 19:37:13.766780000 JST",,"6000  >  56156 [FIN, ACK] Seq=1 Ack=29 Win=65152 Len=0 TSval=780959613 TSecr=775466943"
137,61.952556,192.168.11.12,192.168.11.20,TCP,66,0.006439,,0.006439,"Jan  6, 2024 19:37:13.773219000 JST",,56156  >  6000 [ACK] Seq=29 Ack=2 Win=64256 Len=0 TSval=775466950 TSecr=780959613
138,72.809811,192.168.11.20,192.168.11.19,TCP,74,,,10.857255,"Jan  6, 2024 19:37:24.630474000 JST",,58052  >  6000 [SYN] Seq=0 Win=64240 Len=0 MSS=1460 SACK_PERM TSval=3684940547 TSecr=0 WS=128
139,72.817063,192.168.11.19,192.168.11.20,TCP,74,0.007252,,0.007252,"Jan  6, 2024 19:37:24.637726000 JST",,"6000  >  58052 [SYN, ACK] Seq=0 Ack=1 Win=65160 Len=0 MSS=1460 SACK_PERM TSval=2337045520 TSecr=3684940547 WS=128"
140,72.817167,192.168.11.20,192.168.11.19,TCP,66,0.000104,,0.000104,"Jan  6, 2024 19:37:24.637830000 JST",,58052  >  6000 [ACK] Seq=1 Ack=1 Win=64256 Len=0 TSval=3684940555 TSecr=2337045520
141,72.817378,192.168.11.20,192.168.11.19,TCP,93,,,0.000211,"Jan  6, 2024 19:37:24.638041000 JST",,"58052  >  6000 [PSH, ACK] Seq=1 Ack=1 Win=64256 Len=27 TSval=3684940555 TSecr=2337045520 [TCP segment of a reassembled PDU]"
142,72.817486,192.168.11.20,192.168.11.19,TCP,66,,,0.000108,"Jan  6, 2024 19:37:24.638149000 JST",,"58052  >  6000 [FIN, ACK] Seq=28 Ack=1 Win=64256 Len=0 TSval=3684940555 TSecr=2337045520"
143,72.824204,192.168.11.19,192.168.11.20,TCP,66,0.006826,,0.006718,"Jan  6, 2024 19:37:24.644867000 JST",,6000  >  58052 [ACK] Seq=1 Ack=28 Win=65152 Len=0 TSval=2337045527 TSecr=3684940555
144,72.824587,192.168.11.19,192.168.11.20,TCP,66,0.007101,,0.000383,"Jan  6, 2024 19:37:24.645250000 JST",,"6000  >  58052 [FIN, ACK] Seq=1 Ack=29 Win=65152 Len=0 TSval=2337045528 TSecr=3684940555"
145,72.824644,192.168.11.20,192.168.11.19,TCP,66,0.000057,,0.000057,"Jan  6, 2024 19:37:24.645307000 JST",,58052  >  6000 [ACK] Seq=29 Ack=2 Win=64256 Len=0 TSval=3684940562 TSecr=2337045528
146,72.854167,192.168.11.20,255.255.255.255,UDP,209,,Åü,0.029523,"Jan  6, 2024 19:37:24.674830000 JST",7b2273656d616e74696373223a207b22656e74697479223a2022504944222c202262617365656e74697479223a2022616e79222c2022726f6c65223a2022747474222c20227370617469616c223a2022616e79222c202274656d706f72616c223a2022616e79227d2c20226461746170726f7065727479223a207b22666f726d6174223a2022696e616f6b615f70726f6772616d5f73616d706c655f73656d616e746963227d7d,52015  >  7000 Len=167
147,72.860419,192.168.11.12,192.168.11.20,TCP,74,,Åú,0.006252,"Jan  6, 2024 19:37:24.681082000 JST",,34970  >  6000 [SYN] Seq=0 Win=64240 Len=0 MSS=1460 SACK_PERM TSval=775477858 TSecr=0 WS=128
148,72.860561,192.168.11.20,192.168.11.12,TCP,74,0.000142,,0.000142,"Jan  6, 2024 19:37:24.681224000 JST",,"6000  >  34970 [SYN, ACK] Seq=0 Ack=1 Win=65160 Len=0 MSS=1460 SACK_PERM TSval=780970527 TSecr=775477858 WS=128"
149,72.86744,192.168.11.12,192.168.11.20,TCP,66,0.006879,,0.006879,"Jan  6, 2024 19:37:24.688103000 JST",,34970  >  6000 [ACK] Seq=1 Ack=1 Win=64256 Len=0 TSval=775477865 TSecr=780970527
150,72.868125,192.168.11.12,192.168.11.20,TCP,93,,,0.000685,"Jan  6, 2024 19:37:24.688788000 JST",,"34970  >  6000 [PSH, ACK] Seq=1 Ack=1 Win=64256 Len=27 TSval=775477866 TSecr=780970527 [TCP segment of a reassembled PDU]"
151,72.868246,192.168.11.20,192.168.11.12,TCP,66,0.000121,,0.000121,"Jan  6, 2024 19:37:24.688909000 JST",,6000  >  34970 [ACK] Seq=1 Ack=28 Win=65152 Len=0 TSval=780970535 TSecr=775477866
152,72.868333,192.168.11.12,192.168.11.20,TCP,66,,,0.000087,"Jan  6, 2024 19:37:24.688996000 JST",,"34970  >  6000 [FIN, ACK] Seq=28 Ack=1 Win=64256 Len=0 TSval=775477866 TSecr=780970527"
153,72.869642,192.168.11.20,192.168.11.12,TCP,66,0.001309,,0.001309,"Jan  6, 2024 19:37:24.690305000 JST",,"6000  >  34970 [FIN, ACK] Seq=1 Ack=29 Win=65152 Len=0 TSval=780970536 TSecr=775477866"
154,72.876768,192.168.11.12,192.168.11.20,TCP,66,0.007126,,0.007126,"Jan  6, 2024 19:37:24.697431000 JST",,34970  >  6000 [ACK] Seq=29 Ack=2 Win=64256 Len=0 TSval=775477873 TSecr=780970536
155,82.701429,192.168.11.20,192.168.11.19,TCP,74,,,9.824661,"Jan  6, 2024 19:37:34.522092000 JST",,50018  >  6000 [SYN] Seq=0 Win=64240 Len=0 MSS=1460 SACK_PERM TSval=3684950439 TSecr=0 WS=128
156,82.716369,192.168.11.19,192.168.11.20,TCP,74,0.01494,,0.01494,"Jan  6, 2024 19:37:34.537032000 JST",,"6000  >  50018 [SYN, ACK] Seq=0 Ack=1 Win=65160 Len=0 MSS=1460 SACK_PERM TSval=2337055419 TSecr=3684950439 WS=128"
157,82.716477,192.168.11.20,192.168.11.19,TCP,66,0.000108,,0.000108,"Jan  6, 2024 19:37:34.537140000 JST",,50018  >  6000 [ACK] Seq=1 Ack=1 Win=64256 Len=0 TSval=3684950454 TSecr=2337055419
158,82.71666,192.168.11.20,192.168.11.19,TCP,93,,,0.000183,"Jan  6, 2024 19:37:34.537323000 JST",,"50018  >  6000 [PSH, ACK] Seq=1 Ack=1 Win=64256 Len=27 TSval=3684950454 TSecr=2337055419 [TCP segment of a reassembled PDU]"
159,82.71679,192.168.11.20,192.168.11.19,TCP,66,,,0.00013,"Jan  6, 2024 19:37:34.537453000 JST",,"50018  >  6000 [FIN, ACK] Seq=28 Ack=1 Win=64256 Len=0 TSval=3684950454 TSecr=2337055419"
160,82.723897,192.168.11.19,192.168.11.20,TCP,66,0.007237,,0.007107,"Jan  6, 2024 19:37:34.544560000 JST",,6000  >  50018 [ACK] Seq=1 Ack=28 Win=65152 Len=0 TSval=2337055427 TSecr=3684950454
161,82.724293,192.168.11.19,192.168.11.20,TCP,66,0.007503,,0.000396,"Jan  6, 2024 19:37:34.544956000 JST",,"6000  >  50018 [FIN, ACK] Seq=1 Ack=29 Win=65152 Len=0 TSval=2337055428 TSecr=3684950454"
162,82.724342,192.168.11.20,192.168.11.19,TCP,66,0.000049,,0.000049,"Jan  6, 2024 19:37:34.545005000 JST",,50018  >  6000 [ACK] Seq=29 Ack=2 Win=64256 Len=0 TSval=3684950462 TSecr=2337055428
163,82.754657,192.168.11.20,255.255.255.255,UDP,209,,Åü,0.030315,"Jan  6, 2024 19:37:34.575320000 JST",7b2273656d616e74696373223a207b22656e74697479223a2022504944222c202262617365656e74697479223a2022616e79222c2022726f6c65223a2022747474222c20227370617469616c223a2022616e79222c202274656d706f72616c223a2022616e79227d2c20226461746170726f7065727479223a207b22666f726d6174223a2022696e616f6b615f70726f6772616d5f73616d706c655f73656d616e746963227d7d,45026  >  7000 Len=167
164,82.760345,192.168.11.12,192.168.11.20,TCP,74,,Åú,0.005688,"Jan  6, 2024 19:37:34.581008000 JST",,43296  >  6000 [SYN] Seq=0 Win=64240 Len=0 MSS=1460 SACK_PERM TSval=775487758 TSecr=0 WS=128
165,82.760486,192.168.11.20,192.168.11.12,TCP,74,0.000141,,0.000141,"Jan  6, 2024 19:37:34.581149000 JST",,"6000  >  43296 [SYN, ACK] Seq=0 Ack=1 Win=65160 Len=0 MSS=1460 SACK_PERM TSval=780980427 TSecr=775487758 WS=128"
166,82.767047,192.168.11.12,192.168.11.20,TCP,66,0.006561,,0.006561,"Jan  6, 2024 19:37:34.587710000 JST",,43296  >  6000 [ACK] Seq=1 Ack=1 Win=64256 Len=0 TSval=775487765 TSecr=780980427
167,82.767621,192.168.11.12,192.168.11.20,TCP,93,,,0.000574,"Jan  6, 2024 19:37:34.588284000 JST",,"43296  >  6000 [PSH, ACK] Seq=1 Ack=1 Win=64256 Len=27 TSval=775487765 TSecr=780980427 [TCP segment of a reassembled PDU]"
168,82.767714,192.168.11.20,192.168.11.12,TCP,66,0.000093,,0.000093,"Jan  6, 2024 19:37:34.588377000 JST",,6000  >  43296 [ACK] Seq=1 Ack=28 Win=65152 Len=0 TSval=780980434 TSecr=775487765
169,82.767782,192.168.11.12,192.168.11.20,TCP,66,,,0.000068,"Jan  6, 2024 19:37:34.588445000 JST",,"43296  >  6000 [FIN, ACK] Seq=28 Ack=1 Win=64256 Len=0 TSval=775487766 TSecr=780980427"
170,82.7689,192.168.11.20,192.168.11.12,TCP,66,0.001118,,0.001118,"Jan  6, 2024 19:37:34.589563000 JST",,"6000  >  43296 [FIN, ACK] Seq=1 Ack=29 Win=65152 Len=0 TSval=780980435 TSecr=775487766"
171,82.775204,192.168.11.12,192.168.11.20,TCP,66,0.006304,,0.006304,"Jan  6, 2024 19:37:34.595867000 JST",,43296  >  6000 [ACK] Seq=29 Ack=2 Win=64256 Len=0 TSval=775487773 TSecr=780980435
172,114.88088,192.168.11.20,192.168.11.19,TCP,74,,,32.105676,"Jan  6, 2024 19:38:06.701543000 JST",,59524  >  6000 [SYN] Seq=0 Win=64240 Len=0 MSS=1460 SACK_PERM TSval=3684982618 TSecr=0 WS=128
173,114.888406,192.168.11.19,192.168.11.20,TCP,74,0.007526,,0.007526,"Jan  6, 2024 19:38:06.709069000 JST",,"6000  >  59524 [SYN, ACK] Seq=0 Ack=1 Win=65160 Len=0 MSS=1460 SACK_PERM TSval=2337087591 TSecr=3684982618 WS=128"
174,114.888501,192.168.11.20,192.168.11.19,TCP,66,0.000095,,0.000095,"Jan  6, 2024 19:38:06.709164000 JST",,59524  >  6000 [ACK] Seq=1 Ack=1 Win=64256 Len=0 TSval=3684982626 TSecr=2337087591
175,114.888662,192.168.11.20,192.168.11.19,TCP,93,,,0.000161,"Jan  6, 2024 19:38:06.709325000 JST",,"59524  >  6000 [PSH, ACK] Seq=1 Ack=1 Win=64256 Len=27 TSval=3684982626 TSecr=2337087591 [TCP segment of a reassembled PDU]"
176,114.888764,192.168.11.20,192.168.11.19,TCP,66,,,0.000102,"Jan  6, 2024 19:38:06.709427000 JST",,"59524  >  6000 [FIN, ACK] Seq=28 Ack=1 Win=64256 Len=0 TSval=3684982626 TSecr=2337087591"
177,114.896544,192.168.11.19,192.168.11.20,TCP,66,0.007882,,0.00778,"Jan  6, 2024 19:38:06.717207000 JST",,6000  >  59524 [ACK] Seq=1 Ack=28 Win=65152 Len=0 TSval=2337087599 TSecr=3684982626
178,114.898208,192.168.11.19,192.168.11.20,TCP,66,0.009444,,0.001664,"Jan  6, 2024 19:38:06.718871000 JST",,"6000  >  59524 [FIN, ACK] Seq=1 Ack=29 Win=65152 Len=0 TSval=2337087602 TSecr=3684982626"
179,114.898252,192.168.11.20,192.168.11.19,TCP,66,0.000044,,0.000044,"Jan  6, 2024 19:38:06.718915000 JST",,59524  >  6000 [ACK] Seq=29 Ack=2 Win=64256 Len=0 TSval=3684982636 TSecr=2337087602
180,114.933827,192.168.11.20,255.255.255.255,UDP,209,,Åü,0.035575,"Jan  6, 2024 19:38:06.754490000 JST",7b2273656d616e74696373223a207b22656e74697479223a2022504944222c202262617365656e74697479223a2022616e79222c2022726f6c65223a2022747474222c20227370617469616c223a2022616e79222c202274656d706f72616c223a2022616e79227d2c20226461746170726f7065727479223a207b22666f726d6174223a2022696e616f6b615f70726f6772616d5f73616d706c655f73656d616e746963227d7d,38592  >  7000 Len=167
181,114.939322,192.168.11.12,192.168.11.20,TCP,74,,Åú,0.005495,"Jan  6, 2024 19:38:06.759985000 JST",,50464  >  6000 [SYN] Seq=0 Win=64240 Len=0 MSS=1460 SACK_PERM TSval=775519938 TSecr=0 WS=128
182,114.939453,192.168.11.20,192.168.11.12,TCP,74,0.000131,,0.000131,"Jan  6, 2024 19:38:06.760116000 JST",,"6000  >  50464 [SYN, ACK] Seq=0 Ack=1 Win=65160 Len=0 MSS=1460 SACK_PERM TSval=781012606 TSecr=775519938 WS=128"
183,114.946447,192.168.11.12,192.168.11.20,TCP,66,0.006994,,0.006994,"Jan  6, 2024 19:38:06.767110000 JST",,50464  >  6000 [ACK] Seq=1 Ack=1 Win=64256 Len=0 TSval=775519945 TSecr=781012606
184,114.946951,192.168.11.12,192.168.11.20,TCP,93,,,0.000504,"Jan  6, 2024 19:38:06.767614000 JST",,"50464  >  6000 [PSH, ACK] Seq=1 Ack=1 Win=64256 Len=27 TSval=775519945 TSecr=781012606 [TCP segment of a reassembled PDU]"
