No.,Time,Source,Destination,Protocol,Length,The RTT to ACK the segment was,XXX,Time delta from previous captured frame,Arrival Time,Data,Info
1,0,192.168.11.32,192.168.11.12,TCP,74,,,0,"Jan  6, 2024 19:36:12.920129000 JST",,46422  >  6000 [SYN] Seq=0 Win=64240 Len=0 MSS=1460 SACK_PERM TSval=1208401068 TSecr=0 WS=128
2,0.006695,192.168.11.12,192.168.11.32,TCP,74,0.006695,,0.006695,"Jan  6, 2024 19:36:12.926824000 JST",,"6000  >  46422 [SYN, ACK] Seq=0 Ack=1 Win=65160 Len=0 MSS=1460 SACK_PERM TSval=3750502038 TSecr=1208401068 WS=128"
3,0.006816,192.168.11.32,192.168.11.12,TCP,66,0.000121,,0.000121,"Jan  6, 2024 19:36:12.926945000 JST",,46422  >  6000 [ACK] Seq=1 Ack=1 Win=64256 Len=0 TSval=1208401078 TSecr=3750502038
4,0.007115,192.168.11.32,192.168.11.12,TCP,93,,,0.000299,"Jan  6, 2024 19:36:12.927244000 JST",,"46422  >  6000 [PSH, ACK] Seq=1 Ack=1 Win=64256 Len=27 TSval=1208401078 TSecr=3750502038 [TCP segment of a reassembled PDU]"
5,0.007268,192.168.11.32,192.168.11.12,TCP,66,,,0.000153,"Jan  6, 2024 19:36:12.927397000 JST",,"46422  >  6000 [FIN, ACK] Seq=28 Ack=1 Win=64256 Len=0 TSval=1208401078 TSecr=3750502038"
6,0.015947,192.168.11.12,192.168.11.32,TCP,66,0.008832,,0.008679,"Jan  6, 2024 19:36:12.936076000 JST",,6000  >  46422 [ACK] Seq=1 Ack=28 Win=65152 Len=0 TSval=3750502046 TSecr=1208401078
7,0.016173,192.168.11.12,192.168.11.32,TCP,66,0.008905,,0.000226,"Jan  6, 2024 19:36:12.936302000 JST",,"6000  >  46422 [FIN, ACK] Seq=1 Ack=29 Win=65152 Len=0 TSval=3750502048 TSecr=1208401078"
8,0.016223,192.168.11.32,192.168.11.12,TCP,66,0.00005,,0.00005,"Jan  6, 2024 19:36:12.936352000 JST",,46422  >  6000 [ACK] Seq=29 Ack=2 Win=64256 Len=0 TSval=1208401087 TSecr=3750502048
9,0.044826,192.168.11.32,255.255.255.255,UDP,209,,Åü,0.028603,"Jan  6, 2024 19:36:12.964955000 JST",7b2273656d616e74696373223a207b22656e74697479223a2022504944222c202262617365656e74697479223a2022616e79222c2022726f6c65223a2022767676222c20227370617469616c223a2022616e79222c202274656d706f72616c223a2022616e79227d2c20226461746170726f7065727479223a207b22666f726d6174223a2022696e616f6b615f70726f6772616d5f73616d706c655f73656d616e746963227d7d,34279  >  7000 Len=167
10,0.054337,192.168.11.18,192.168.11.32,TCP,74,,Åú,0.009511,"Jan  6, 2024 19:36:12.974466000 JST",,48542  >  6000 [SYN] Seq=0 Win=64240 Len=0 MSS=1460 SACK_PERM TSval=2989362458 TSecr=0 WS=128
11,0.054484,192.168.11.32,192.168.11.18,TCP,74,0.000147,,0.000147,"Jan  6, 2024 19:36:12.974613000 JST",,"6000  >  48542 [SYN, ACK] Seq=0 Ack=1 Win=65160 Len=0 MSS=1460 SACK_PERM TSval=3214861407 TSecr=2989362458 WS=128"
12,0.061127,192.168.11.18,192.168.11.32,TCP,66,0.006643,,0.006643,"Jan  6, 2024 19:36:12.981256000 JST",,48542  >  6000 [ACK] Seq=1 Ack=1 Win=64256 Len=0 TSval=2989362468 TSecr=3214861407
13,0.061732,192.168.11.18,192.168.11.32,TCP,93,,,0.000605,"Jan  6, 2024 19:36:12.981861000 JST",,"48542  >  6000 [PSH, ACK] Seq=1 Ack=1 Win=64256 Len=27 TSval=2989362469 TSecr=3214861407 [TCP segment of a reassembled PDU]"
14,0.061837,192.168.11.32,192.168.11.18,TCP,66,0.000105,,0.000105,"Jan  6, 2024 19:36:12.981966000 JST",,6000  >  48542 [ACK] Seq=1 Ack=28 Win=65152 Len=0 TSval=3214861415 TSecr=2989362469
15,0.061906,192.168.11.18,192.168.11.32,TCP,66,,,0.000069,"Jan  6, 2024 19:36:12.982035000 JST",,"48542  >  6000 [FIN, ACK] Seq=28 Ack=1 Win=64256 Len=0 TSval=2989362469 TSecr=3214861407"
16,0.063316,192.168.11.32,192.168.11.18,TCP,66,0.00141,,0.00141,"Jan  6, 2024 19:36:12.983445000 JST",,"6000  >  48542 [FIN, ACK] Seq=1 Ack=29 Win=65152 Len=0 TSval=3214861416 TSecr=2989362469"
17,0.069603,192.168.11.18,192.168.11.32,TCP,66,0.006287,,0.006287,"Jan  6, 2024 19:36:12.989732000 JST",,48542  >  6000 [ACK] Seq=29 Ack=2 Win=64256 Len=0 TSval=2989362476 TSecr=3214861416
18,9.307401,192.168.11.32,192.168.11.12,TCP,74,,,9.237798,"Jan  6, 2024 19:36:22.227530000 JST",,39996  >  6000 [SYN] Seq=0 Win=64240 Len=0 MSS=1460 SACK_PERM TSval=1208410378 TSecr=0 WS=128
19,9.316682,192.168.11.12,192.168.11.32,TCP,74,0.009281,,0.009281,"Jan  6, 2024 19:36:22.236811000 JST",,"6000  >  39996 [SYN, ACK] Seq=0 Ack=1 Win=65160 Len=0 MSS=1460 SACK_PERM TSval=3750511348 TSecr=1208410378 WS=128"
20,9.316774,192.168.11.32,192.168.11.12,TCP,66,0.000092,,0.000092,"Jan  6, 2024 19:36:22.236903000 JST",,39996  >  6000 [ACK] Seq=1 Ack=1 Win=64256 Len=0 TSval=1208410388 TSecr=3750511348
21,9.316931,192.168.11.32,192.168.11.12,TCP,93,,,0.000157,"Jan  6, 2024 19:36:22.237060000 JST",,"39996  >  6000 [PSH, ACK] Seq=1 Ack=1 Win=64256 Len=27 TSval=1208410388 TSecr=3750511348 [TCP segment of a reassembled PDU]"
22,9.317037,192.168.11.32,192.168.11.12,TCP,66,,,0.000106,"Jan  6, 2024 19:36:22.237166000 JST",,"39996  >  6000 [FIN, ACK] Seq=28 Ack=1 Win=64256 Len=0 TSval=1208410388 TSecr=3750511348"
23,9.324265,192.168.11.12,192.168.11.32,TCP,66,0.007334,,0.007228,"Jan  6, 2024 19:36:22.244394000 JST",,6000  >  39996 [ACK] Seq=1 Ack=28 Win=65152 Len=0 TSval=3750511355 TSecr=1208410388
24,9.324619,192.168.11.12,192.168.11.32,TCP,66,0.007582,,0.000354,"Jan  6, 2024 19:36:22.244748000 JST",,"6000  >  39996 [FIN, ACK] Seq=1 Ack=29 Win=65152 Len=0 TSval=3750511356 TSecr=1208410388"
25,9.324666,192.168.11.32,192.168.11.12,TCP,66,0.000047,,0.000047,"Jan  6, 2024 19:36:22.244795000 JST",,39996  >  6000 [ACK] Seq=29 Ack=2 Win=64256 Len=0 TSval=1208410396 TSecr=3750511356
26,9.353545,192.168.11.32,255.255.255.255,UDP,209,,Åü,0.028879,"Jan  6, 2024 19:36:22.273674000 JST",7b2273656d616e74696373223a207b22656e74697479223a2022504944222c202262617365656e74697479223a2022616e79222c2022726f6c65223a2022767676222c20227370617469616c223a2022616e79222c202274656d706f72616c223a2022616e79227d2c20226461746170726f7065727479223a207b22666f726d6174223a2022696e616f6b615f70726f6772616d5f73616d706c655f73656d616e746963227d7d,43806  >  7000 Len=167
27,9.360328,192.168.11.18,192.168.11.32,TCP,74,,Åú,0.006783,"Jan  6, 2024 19:36:22.280457000 JST",,54868  >  6000 [SYN] Seq=0 Win=64240 Len=0 MSS=1460 SACK_PERM TSval=2989371767 TSecr=0 WS=128
28,9.360471,192.168.11.32,192.168.11.18,TCP,74,0.000143,,0.000143,"Jan  6, 2024 19:36:22.280600000 JST",,"6000  >  54868 [SYN, ACK] Seq=0 Ack=1 Win=65160 Len=0 MSS=1460 SACK_PERM TSval=3214870713 TSecr=2989371767 WS=128"
29,9.367062,192.168.11.18,192.168.11.32,TCP,66,0.006591,,0.006591,"Jan  6, 2024 19:36:22.287191000 JST",,54868  >  6000 [ACK] Seq=1 Ack=1 Win=64256 Len=0 TSval=2989371774 TSecr=3214870713
30,9.367618,192.168.11.18,192.168.11.32,TCP,93,,,0.000556,"Jan  6, 2024 19:36:22.287747000 JST",,"54868  >  6000 [PSH, ACK] Seq=1 Ack=1 Win=64256 Len=27 TSval=2989371775 TSecr=3214870713 [TCP segment of a reassembled PDU]"
31,9.367711,192.168.11.32,192.168.11.18,TCP,66,0.000093,,0.000093,"Jan  6, 2024 19:36:22.287840000 JST",,6000  >  54868 [ACK] Seq=1 Ack=28 Win=65152 Len=0 TSval=3214870721 TSecr=2989371775
32,9.367782,192.168.11.18,192.168.11.32,TCP,66,,,0.000071,"Jan  6, 2024 19:36:22.287911000 JST",,"54868  >  6000 [FIN, ACK] Seq=28 Ack=1 Win=64256 Len=0 TSval=2989371775 TSecr=3214870713"
33,9.368876,192.168.11.32,192.168.11.18,TCP,66,0.001094,,0.001094,"Jan  6, 2024 19:36:22.289005000 JST",,"6000  >  54868 [FIN, ACK] Seq=1 Ack=29 Win=65152 Len=0 TSval=3214870722 TSecr=2989371775"
34,9.374942,192.168.11.18,192.168.11.32,TCP,66,0.006066,,0.006066,"Jan  6, 2024 19:36:22.295071000 JST",,54868  >  6000 [ACK] Seq=29 Ack=2 Win=64256 Len=0 TSval=2989371782 TSecr=3214870722
35,19.166656,192.168.11.32,192.168.11.12,TCP,74,,,9.791714,"Jan  6, 2024 19:36:32.086785000 JST",,38794  >  6000 [SYN] Seq=0 Win=64240 Len=0 MSS=1460 SACK_PERM TSval=1208420238 TSecr=0 WS=128
36,19.181007,192.168.11.12,192.168.11.32,TCP,74,0.014351,,0.014351,"Jan  6, 2024 19:36:32.101136000 JST",,"6000  >  38794 [SYN, ACK] Seq=0 Ack=1 Win=65160 Len=0 MSS=1460 SACK_PERM TSval=3750521211 TSecr=1208420238 WS=128"
37,19.181116,192.168.11.32,192.168.11.12,TCP,66,0.000109,,0.000109,"Jan  6, 2024 19:36:32.101245000 JST",,38794  >  6000 [ACK] Seq=1 Ack=1 Win=64256 Len=0 TSval=1208420252 TSecr=3750521211
38,19.181287,192.168.11.32,192.168.11.12,TCP,93,,,0.000171,"Jan  6, 2024 19:36:32.101416000 JST",,"38794  >  6000 [PSH, ACK] Seq=1 Ack=1 Win=64256 Len=27 TSval=1208420252 TSecr=3750521211 [TCP segment of a reassembled PDU]"
39,19.181398,192.168.11.32,192.168.11.12,TCP,66,,,0.000111,"Jan  6, 2024 19:36:32.101527000 JST",,"38794  >  6000 [FIN, ACK] Seq=28 Ack=1 Win=64256 Len=0 TSval=1208420252 TSecr=3750521211"
40,19.188617,192.168.11.12,192.168.11.32,TCP,66,0.00733,,0.007219,"Jan  6, 2024 19:36:32.108746000 JST",,6000  >  38794 [ACK] Seq=1 Ack=28 Win=65152 Len=0 TSval=3750521219 TSecr=1208420252
41,19.189006,192.168.11.12,192.168.11.32,TCP,66,0.007608,,0.000389,"Jan  6, 2024 19:36:32.109135000 JST",,"6000  >  38794 [FIN, ACK] Seq=1 Ack=29 Win=65152 Len=0 TSval=3750521221 TSecr=1208420252"
42,19.189054,192.168.11.32,192.168.11.12,TCP,66,0.000048,,0.000048,"Jan  6, 2024 19:36:32.109183000 JST",,38794  >  6000 [ACK] Seq=29 Ack=2 Win=64256 Len=0 TSval=1208420260 TSecr=3750521221
43,19.218746,192.168.11.32,255.255.255.255,UDP,209,,Åü,0.029692,"Jan  6, 2024 19:36:32.138875000 JST",7b2273656d616e74696373223a207b22656e74697479223a2022504944222c202262617365656e74697479223a2022616e79222c2022726f6c65223a2022767676222c20227370617469616c223a2022616e79222c202274656d706f72616c223a2022616e79227d2c20226461746170726f7065727479223a207b22666f726d6174223a2022696e616f6b615f70726f6772616d5f73616d706c655f73656d616e746963227d7d,33671  >  7000 Len=167
44,19.224523,192.168.11.18,192.168.11.32,TCP,74,,Åú,0.005777,"Jan  6, 2024 19:36:32.144652000 JST",,45746  >  6000 [SYN] Seq=0 Win=64240 Len=0 MSS=1460 SACK_PERM TSval=2989381632 TSecr=0 WS=128
45,19.224662,192.168.11.32,192.168.11.18,TCP,74,0.000139,,0.000139,"Jan  6, 2024 19:36:32.144791000 JST",,"6000  >  45746 [SYN, ACK] Seq=0 Ack=1 Win=65160 Len=0 MSS=1460 SACK_PERM TSval=3214880578 TSecr=2989381632 WS=128"
46,19.232497,192.168.11.18,192.168.11.32,TCP,66,0.007835,,0.007835,"Jan  6, 2024 19:36:32.152626000 JST",,45746  >  6000 [ACK] Seq=1 Ack=1 Win=64256 Len=0 TSval=2989381640 TSecr=3214880578
47,19.233083,192.168.11.18,192.168.11.32,TCP,93,,,0.000586,"Jan  6, 2024 19:36:32.153212000 JST",,"45746  >  6000 [PSH, ACK] Seq=1 Ack=1 Win=64256 Len=27 TSval=2989381640 TSecr=3214880578 [TCP segment of a reassembled PDU]"
48,19.233193,192.168.11.32,192.168.11.18,TCP,66,0.00011,,0.00011,"Jan  6, 2024 19:36:32.153322000 JST",,6000  >  45746 [ACK] Seq=1 Ack=28 Win=65152 Len=0 TSval=3214880586 TSecr=2989381640
49,19.233256,192.168.11.18,192.168.11.32,TCP,66,,,0.000063,"Jan  6, 2024 19:36:32.153385000 JST",,"45746  >  6000 [FIN, ACK] Seq=28 Ack=1 Win=64256 Len=0 TSval=2989381640 TSecr=3214880578"
50,19.234477,192.168.11.32,192.168.11.18,TCP,66,0.001221,,0.001221,"Jan  6, 2024 19:36:32.154606000 JST",,"6000  >  45746 [FIN, ACK] Seq=1 Ack=29 Win=65152 Len=0 TSval=3214880587 TSecr=2989381640"
51,19.240506,192.168.11.18,192.168.11.32,TCP,66,0.006029,,0.006029,"Jan  6, 2024 19:36:32.160635000 JST",,45746  >  6000 [ACK] Seq=29 Ack=2 Win=64256 Len=0 TSval=2989381648 TSecr=3214880587
52,29.089095,192.168.11.32,192.168.11.12,TCP,74,,,9.848589,"Jan  6, 2024 19:36:42.009224000 JST",,51338  >  6000 [SYN] Seq=0 Win=64240 Len=0 MSS=1460 SACK_PERM TSval=1208430160 TSecr=0 WS=128
53,29.09581,192.168.11.12,192.168.11.32,TCP,74,0.006715,,0.006715,"Jan  6, 2024 19:36:42.015939000 JST",,"6000  >  51338 [SYN, ACK] Seq=0 Ack=1 Win=65160 Len=0 MSS=1460 SACK_PERM TSval=3750531127 TSecr=1208430160 WS=128"
54,29.095928,192.168.11.32,192.168.11.12,TCP,66,0.000118,,0.000118,"Jan  6, 2024 19:36:42.016057000 JST",,51338  >  6000 [ACK] Seq=1 Ack=1 Win=64256 Len=0 TSval=1208430167 TSecr=3750531127
55,29.0961,192.168.11.32,192.168.11.12,TCP,93,,,0.000172,"Jan  6, 2024 19:36:42.016229000 JST",,"51338  >  6000 [PSH, ACK] Seq=1 Ack=1 Win=64256 Len=27 TSval=1208430167 TSecr=3750531127 [TCP segment of a reassembled PDU]"
56,29.096196,192.168.11.32,192.168.11.12,TCP,66,,,0.000096,"Jan  6, 2024 19:36:42.016325000 JST",,"51338  >  6000 [FIN, ACK] Seq=28 Ack=1 Win=64256 Len=0 TSval=1208430167 TSecr=3750531127"
57,29.103973,192.168.11.12,192.168.11.32,TCP,66,0.007873,,0.007777,"Jan  6, 2024 19:36:42.024102000 JST",,6000  >  51338 [ACK] Seq=1 Ack=28 Win=65152 Len=0 TSval=3750531134 TSecr=1208430167
58,29.109367,192.168.11.12,192.168.11.32,TCP,66,0.013171,,0.005394,"Jan  6, 2024 19:36:42.029496000 JST",,"6000  >  51338 [FIN, ACK] Seq=1 Ack=29 Win=65152 Len=0 TSval=3750531140 TSecr=1208430167"
59,29.109413,192.168.11.32,192.168.11.12,TCP,66,0.000046,,0.000046,"Jan  6, 2024 19:36:42.029542000 JST",,51338  >  6000 [ACK] Seq=29 Ack=2 Win=64256 Len=0 TSval=1208430180 TSecr=3750531140
60,29.139648,192.168.11.32,255.255.255.255,UDP,209,,Åü,0.030235,"Jan  6, 2024 19:36:42.059777000 JST",7b2273656d616e74696373223a207b22656e74697479223a2022504944222c202262617365656e74697479223a2022616e79222c2022726f6c65223a2022767676222c20227370617469616c223a2022616e79222c202274656d706f72616c223a2022616e79227d2c20226461746170726f7065727479223a207b22666f726d6174223a2022696e616f6b615f70726f6772616d5f73616d706c655f73656d616e746963227d7d,45737  >  7000 Len=167
61,29.145394,192.168.11.18,192.168.11.32,TCP,74,,Åú,0.005746,"Jan  6, 2024 19:36:42.065523000 JST",,40054  >  6000 [SYN] Seq=0 Win=64240 Len=0 MSS=1460 SACK_PERM TSval=2989391553 TSecr=0 WS=128
62,29.145542,192.168.11.32,192.168.11.18,TCP,74,0.000148,,0.000148,"Jan  6, 2024 19:36:42.065671000 JST",,"6000  >  40054 [SYN, ACK] Seq=0 Ack=1 Win=65160 Len=0 MSS=1460 SACK_PERM TSval=3214890499 TSecr=2989391553 WS=128"
63,29.153644,192.168.11.18,192.168.11.32,TCP,66,0.008102,,0.008102,"Jan  6, 2024 19:36:42.073773000 JST",,40054  >  6000 [ACK] Seq=1 Ack=1 Win=64256 Len=0 TSval=2989391560 TSecr=3214890499
64,29.154171,192.168.11.18,192.168.11.32,TCP,93,,,0.000527,"Jan  6, 2024 19:36:42.074300000 JST",,"40054  >  6000 [PSH, ACK] Seq=1 Ack=1 Win=64256 Len=27 TSval=2989391560 TSecr=3214890499 [TCP segment of a reassembled PDU]"
65,29.154249,192.168.11.32,192.168.11.18,TCP,66,0.000078,,0.000078,"Jan  6, 2024 19:36:42.074378000 JST",,6000  >  40054 [ACK] Seq=1 Ack=28 Win=65152 Len=0 TSval=3214890507 TSecr=2989391560
66,29.154311,192.168.11.18,192.168.11.32,TCP,66,,,0.000062,"Jan  6, 2024 19:36:42.074440000 JST",,"40054  >  6000 [FIN, ACK] Seq=28 Ack=1 Win=64256 Len=0 TSval=2989391560 TSecr=3214890499"
67,29.155303,192.168.11.32,192.168.11.18,TCP,66,0.000992,,0.000992,"Jan  6, 2024 19:36:42.075432000 JST",,"6000  >  40054 [FIN, ACK] Seq=1 Ack=29 Win=65152 Len=0 TSval=3214890508 TSecr=2989391560"
68,29.16254,192.168.11.18,192.168.11.32,TCP,66,0.007237,,0.007237,"Jan  6, 2024 19:36:42.082669000 JST",,40054  >  6000 [ACK] Seq=29 Ack=2 Win=64256 Len=0 TSval=2989391570 TSecr=3214890508
69,36.903204,192.168.11.32,192.168.11.12,TCP,74,,,7.740664,"Jan  6, 2024 19:36:49.823333000 JST",,47318  >  6000 [SYN] Seq=0 Win=64240 Len=0 MSS=1460 SACK_PERM TSval=1208437974 TSecr=0 WS=128
70,36.91073,192.168.11.12,192.168.11.32,TCP,74,0.007526,,0.007526,"Jan  6, 2024 19:36:49.830859000 JST",,"6000  >  47318 [SYN, ACK] Seq=0 Ack=1 Win=65160 Len=0 MSS=1460 SACK_PERM TSval=3750538941 TSecr=1208437974 WS=128"
71,36.910848,192.168.11.32,192.168.11.12,TCP,66,0.000118,,0.000118,"Jan  6, 2024 19:36:49.830977000 JST",,47318  >  6000 [ACK] Seq=1 Ack=1 Win=64256 Len=0 TSval=1208437982 TSecr=3750538941
72,36.910988,192.168.11.32,192.168.11.12,TCP,93,,,0.00014,"Jan  6, 2024 19:36:49.831117000 JST",,"47318  >  6000 [PSH, ACK] Seq=1 Ack=1 Win=64256 Len=27 TSval=1208437982 TSecr=3750538941 [TCP segment of a reassembled PDU]"
73,36.911096,192.168.11.32,192.168.11.12,TCP,66,,,0.000108,"Jan  6, 2024 19:36:49.831225000 JST",,"47318  >  6000 [FIN, ACK] Seq=28 Ack=1 Win=64256 Len=0 TSval=1208437982 TSecr=3750538941"
74,36.917851,192.168.11.12,192.168.11.32,TCP,66,0.006863,,0.006755,"Jan  6, 2024 19:36:49.837980000 JST",,6000  >  47318 [ACK] Seq=1 Ack=28 Win=65152 Len=0 TSval=3750538949 TSecr=1208437982
75,36.918226,192.168.11.12,192.168.11.32,TCP,66,0.00713,,0.000375,"Jan  6, 2024 19:36:49.838355000 JST",,"6000  >  47318 [FIN, ACK] Seq=1 Ack=29 Win=65152 Len=0 TSval=3750538950 TSecr=1208437982"
76,36.918271,192.168.11.32,192.168.11.12,TCP,66,0.000045,,0.000045,"Jan  6, 2024 19:36:49.838400000 JST",,47318  >  6000 [ACK] Seq=29 Ack=2 Win=64256 Len=0 TSval=1208437989 TSecr=3750538950
77,36.948351,192.168.11.32,255.255.255.255,UDP,209,,Åü,0.03008,"Jan  6, 2024 19:36:49.868480000 JST",7b2273656d616e74696373223a207b22656e74697479223a2022504944222c202262617365656e74697479223a2022616e79222c2022726f6c65223a2022767676222c20227370617469616c223a2022616e79222c202274656d706f72616c223a2022616e79227d2c20226461746170726f7065727479223a207b22666f726d6174223a2022696e616f6b615f70726f6772616d5f73616d706c655f73656d616e746963227d7d,40653  >  7000 Len=167
78,36.955407,192.168.11.18,192.168.11.32,TCP,74,,Åú,0.007056,"Jan  6, 2024 19:36:49.875536000 JST",,40064  >  6000 [SYN] Seq=0 Win=64240 Len=0 MSS=1460 SACK_PERM TSval=2989399361 TSecr=0 WS=128
79,36.955605,192.168.11.32,192.168.11.18,TCP,74,0.000198,,0.000198,"Jan  6, 2024 19:36:49.875734000 JST",,"6000  >  40064 [SYN, ACK] Seq=0 Ack=1 Win=65160 Len=0 MSS=1460 SACK_PERM TSval=3214898309 TSecr=2989399361 WS=128"
80,36.966058,192.168.11.18,192.168.11.32,TCP,66,0.010453,,0.010453,"Jan  6, 2024 19:36:49.886187000 JST",,40064  >  6000 [ACK] Seq=1 Ack=1 Win=64256 Len=0 TSval=2989399373 TSecr=3214898309
81,36.966627,192.168.11.18,192.168.11.32,TCP,93,,,0.000569,"Jan  6, 2024 19:36:49.886756000 JST",,"40064  >  6000 [PSH, ACK] Seq=1 Ack=1 Win=64256 Len=27 TSval=2989399373 TSecr=3214898309 [TCP segment of a reassembled PDU]"
82,36.966703,192.168.11.32,192.168.11.18,TCP,66,0.000076,,0.000076,"Jan  6, 2024 19:36:49.886832000 JST",,6000  >  40064 [ACK] Seq=1 Ack=28 Win=65152 Len=0 TSval=3214898320 TSecr=2989399373
83,36.96677,192.168.11.18,192.168.11.32,TCP,66,,,0.000067,"Jan  6, 2024 19:36:49.886899000 JST",,"40064  >  6000 [FIN, ACK] Seq=28 Ack=1 Win=64256 Len=0 TSval=2989399374 TSecr=3214898309"
84,36.968403,192.168.11.32,192.168.11.18,TCP,66,0.001633,,0.001633,"Jan  6, 2024 19:36:49.888532000 JST",,"6000  >  40064 [FIN, ACK] Seq=1 Ack=29 Win=65152 Len=0 TSval=3214898321 TSecr=2989399374"
85,36.973574,192.168.11.18,192.168.11.32,TCP,66,0.005171,,0.005171,"Jan  6, 2024 19:36:49.893703000 JST",,40064  >  6000 [ACK] Seq=29 Ack=2 Win=64256 Len=0 TSval=2989399381 TSecr=3214898321
86,44.71206,192.168.11.32,192.168.11.12,TCP,74,,,7.738486,"Jan  6, 2024 19:36:57.632189000 JST",,47712  >  6000 [SYN] Seq=0 Win=64240 Len=0 MSS=1460 SACK_PERM TSval=1208445783 TSecr=0 WS=128
87,44.719132,192.168.11.12,192.168.11.32,TCP,74,0.007072,,0.007072,"Jan  6, 2024 19:36:57.639261000 JST",,"6000  >  47712 [SYN, ACK] Seq=0 Ack=1 Win=65160 Len=0 MSS=1460 SACK_PERM TSval=3750546750 TSecr=1208445783 WS=128"
88,44.719243,192.168.11.32,192.168.11.12,TCP,66,0.000111,,0.000111,"Jan  6, 2024 19:36:57.639372000 JST",,47712  >  6000 [ACK] Seq=1 Ack=1 Win=64256 Len=0 TSval=1208445790 TSecr=3750546750
89,44.719387,192.168.11.32,192.168.11.12,TCP,93,,,0.000144,"Jan  6, 2024 19:36:57.639516000 JST",,"47712  >  6000 [PSH, ACK] Seq=1 Ack=1 Win=64256 Len=27 TSval=1208445790 TSecr=3750546750 [TCP segment of a reassembled PDU]"
90,44.719491,192.168.11.32,192.168.11.12,TCP,66,,,0.000104,"Jan  6, 2024 19:36:57.639620000 JST",,"47712  >  6000 [FIN, ACK] Seq=28 Ack=1 Win=64256 Len=0 TSval=1208445790 TSecr=3750546750"
91,44.726785,192.168.11.12,192.168.11.32,TCP,66,0.007398,,0.007294,"Jan  6, 2024 19:36:57.646914000 JST",,6000  >  47712 [ACK] Seq=1 Ack=28 Win=65152 Len=0 TSval=3750546757 TSecr=1208445790
92,44.727084,192.168.11.12,192.168.11.32,TCP,66,0.007593,,0.000299,"Jan  6, 2024 19:36:57.647213000 JST",,"6000  >  47712 [FIN, ACK] Seq=1 Ack=29 Win=65152 Len=0 TSval=3750546759 TSecr=1208445790"
93,44.727178,192.168.11.32,192.168.11.12,TCP,66,0.000094,,0.000094,"Jan  6, 2024 19:36:57.647307000 JST",,47712  >  6000 [ACK] Seq=29 Ack=2 Win=64256 Len=0 TSval=1208445798 TSecr=3750546759
94,44.761188,192.168.11.32,255.255.255.255,UDP,209,,Åü,0.03401,"Jan  6, 2024 19:36:57.681317000 JST",7b2273656d616e74696373223a207b22656e74697479223a2022504944222c202262617365656e74697479223a2022616e79222c2022726f6c65223a2022767676222c20227370617469616c223a2022616e79222c202274656d706f72616c223a2022616e79227d2c20226461746170726f7065727479223a207b22666f726d6174223a2022696e616f6b615f70726f6772616d5f73616d706c655f73656d616e746963227d7d,54493  >  7000 Len=167
95,44.770284,192.168.11.18,192.168.11.32,TCP,74,,Åú,0.009096,"Jan  6, 2024 19:36:57.690413000 JST",,51134  >  6000 [SYN] Seq=0 Win=64240 Len=0 MSS=1460 SACK_PERM TSval=2989407174 TSecr=0 WS=128
96,44.770437,192.168.11.32,192.168.11.18,TCP,74,0.000153,,0.000153,"Jan  6, 2024 19:36:57.690566000 JST",,"6000  >  51134 [SYN, ACK] Seq=0 Ack=1 Win=65160 Len=0 MSS=1460 SACK_PERM TSval=3214906123 TSecr=2989407174 WS=128"
97,44.778201,192.168.11.18,192.168.11.32,TCP,66,0.007764,,0.007764,"Jan  6, 2024 19:36:57.698330000 JST",,51134  >  6000 [ACK] Seq=1 Ack=1 Win=64256 Len=0 TSval=2989407185 TSecr=3214906123
98,44.779763,192.168.11.18,192.168.11.32,TCP,93,,,0.001562,"Jan  6, 2024 19:36:57.699892000 JST",,"51134  >  6000 [PSH, ACK] Seq=1 Ack=1 Win=64256 Len=27 TSval=2989407186 TSecr=3214906123 [TCP segment of a reassembled PDU]"
99,44.779944,192.168.11.32,192.168.11.18,TCP,66,0.000181,,0.000181,"Jan  6, 2024 19:36:57.700073000 JST",,6000  >  51134 [ACK] Seq=1 Ack=28 Win=65152 Len=0 TSval=3214906133 TSecr=2989407186
100,44.780042,192.168.11.18,192.168.11.32,TCP,66,,,0.000098,"Jan  6, 2024 19:36:57.700171000 JST",,"51134  >  6000 [FIN, ACK] Seq=28 Ack=1 Win=64256 Len=0 TSval=2989407186 TSecr=3214906123"
101,44.781485,192.168.11.32,192.168.11.18,TCP,66,0.001443,,0.001443,"Jan  6, 2024 19:36:57.701614000 JST",,"6000  >  51134 [FIN, ACK] Seq=1 Ack=29 Win=65152 Len=0 TSval=3214906134 TSecr=2989407186"
102,44.788404,192.168.11.18,192.168.11.32,TCP,66,0.006919,,0.006919,"Jan  6, 2024 19:36:57.708533000 JST",,51134  >  6000 [ACK] Seq=29 Ack=2 Win=64256 Len=0 TSval=2989407195 TSecr=3214906134
103,52.576047,192.168.11.32,192.168.11.12,TCP,74,,,7.787643,"Jan  6, 2024 19:37:05.496176000 JST",,41500  >  6000 [SYN] Seq=0 Win=64240 Len=0 MSS=1460 SACK_PERM TSval=1208453647 TSecr=0 WS=128
104,52.583851,192.168.11.12,192.168.11.32,TCP,74,0.007804,,0.007804,"Jan  6, 2024 19:37:05.503980000 JST",,"6000  >  41500 [SYN, ACK] Seq=0 Ack=1 Win=65160 Len=0 MSS=1460 SACK_PERM TSval=3750554615 TSecr=1208453647 WS=128"
105,52.583958,192.168.11.32,192.168.11.12,TCP,66,0.000107,,0.000107,"Jan  6, 2024 19:37:05.504087000 JST",,41500  >  6000 [ACK] Seq=1 Ack=1 Win=64256 Len=0 TSval=1208453655 TSecr=3750554615
106,52.584098,192.168.11.32,192.168.11.12,TCP,93,,,0.00014,"Jan  6, 2024 19:37:05.504227000 JST",,"41500  >  6000 [PSH, ACK] Seq=1 Ack=1 Win=64256 Len=27 TSval=1208453655 TSecr=3750554615 [TCP segment of a reassembled PDU]"
107,52.584204,192.168.11.32,192.168.11.12,TCP,66,,,0.000106,"Jan  6, 2024 19:37:05.504333000 JST",,"41500  >  6000 [FIN, ACK] Seq=28 Ack=1 Win=64256 Len=0 TSval=1208453655 TSecr=3750554615"
108,52.592128,192.168.11.12,192.168.11.32,TCP,66,0.00803,,0.007924,"Jan  6, 2024 19:37:05.512257000 JST",,6000  >  41500 [ACK] Seq=1 Ack=28 Win=65152 Len=0 TSval=3750554623 TSecr=1208453655
109,52.592527,192.168.11.12,192.168.11.32,TCP,66,0.008323,,0.000399,"Jan  6, 2024 19:37:05.512656000 JST",,"6000  >  41500 [FIN, ACK] Seq=1 Ack=29 Win=65152 Len=0 TSval=3750554624 TSecr=1208453655"
110,52.592579,192.168.11.32,192.168.11.12,TCP,66,0.000052,,0.000052,"Jan  6, 2024 19:37:05.512708000 JST",,41500  >  6000 [ACK] Seq=29 Ack=2 Win=64256 Len=0 TSval=1208453664 TSecr=3750554624
111,52.622972,192.168.11.32,255.255.255.255,UDP,209,,Åü,0.030393,"Jan  6, 2024 19:37:05.543101000 JST",7b2273656d616e74696373223a207b22656e74697479223a2022504944222c202262617365656e74697479223a2022616e79222c2022726f6c65223a2022767676222c20227370617469616c223a2022616e79222c202274656d706f72616c223a2022616e79227d2c20226461746170726f7065727479223a207b22666f726d6174223a2022696e616f6b615f70726f6772616d5f73616d706c655f73656d616e746963227d7d,39351  >  7000 Len=167
112,52.628684,192.168.11.18,192.168.11.32,TCP,74,,Åú,0.005712,"Jan  6, 2024 19:37:05.548813000 JST",,53628  >  6000 [SYN] Seq=0 Win=64240 Len=0 MSS=1460 SACK_PERM TSval=2989415036 TSecr=0 WS=128
113,52.628826,192.168.11.32,192.168.11.18,TCP,74,0.000142,,0.000142,"Jan  6, 2024 19:37:05.548955000 JST",,"6000  >  53628 [SYN, ACK] Seq=0 Ack=1 Win=65160 Len=0 MSS=1460 SACK_PERM TSval=3214913982 TSecr=2989415036 WS=128"
114,52.636448,192.168.11.18,192.168.11.32,TCP,66,0.007622,,0.007622,"Jan  6, 2024 19:37:05.556577000 JST",,53628  >  6000 [ACK] Seq=1 Ack=1 Win=64256 Len=0 TSval=2989415044 TSecr=3214913982
115,52.636985,192.168.11.18,192.168.11.32,TCP,93,,,0.000537,"Jan  6, 2024 19:37:05.557114000 JST",,"53628  >  6000 [PSH, ACK] Seq=1 Ack=1 Win=64256 Len=27 TSval=2989415044 TSecr=3214913982 [TCP segment of a reassembled PDU]"
116,52.637063,192.168.11.32,192.168.11.18,TCP,66,0.000078,,0.000078,"Jan  6, 2024 19:37:05.557192000 JST",,6000  >  53628 [ACK] Seq=1 Ack=28 Win=65152 Len=0 TSval=3214913990 TSecr=2989415044
117,52.637129,192.168.11.18,192.168.11.32,TCP,66,,,0.000066,"Jan  6, 2024 19:37:05.557258000 JST",,"53628  >  6000 [FIN, ACK] Seq=28 Ack=1 Win=64256 Len=0 TSval=2989415044 TSecr=3214913982"
118,52.638093,192.168.11.32,192.168.11.18,TCP,66,0.000964,,0.000964,"Jan  6, 2024 19:37:05.558222000 JST",,"6000  >  53628 [FIN, ACK] Seq=1 Ack=29 Win=65152 Len=0 TSval=3214913991 TSecr=2989415044"
119,52.644328,192.168.11.18,192.168.11.32,TCP,66,0.006235,,0.006235,"Jan  6, 2024 19:37:05.564457000 JST",,53628  >  6000 [ACK] Seq=29 Ack=2 Win=64256 Len=0 TSval=2989415051 TSecr=3214913991
120,60.87941,192.168.11.32,192.168.11.12,TCP,74,,,8.235082,"Jan  6, 2024 19:37:13.799539000 JST",,41510  >  6000 [SYN] Seq=0 Win=64240 Len=0 MSS=1460 SACK_PERM TSval=1208461950 TSecr=0 WS=128
121,60.887018,192.168.11.12,192.168.11.32,TCP,74,0.007608,,0.007608,"Jan  6, 2024 19:37:13.807147000 JST",,"6000  >  41510 [SYN, ACK] Seq=0 Ack=1 Win=65160 Len=0 MSS=1460 SACK_PERM TSval=3750562918 TSecr=1208461950 WS=128"
122,60.887133,192.168.11.32,192.168.11.12,TCP,66,0.000115,,0.000115,"Jan  6, 2024 19:37:13.807262000 JST",,41510  >  6000 [ACK] Seq=1 Ack=1 Win=64256 Len=0 TSval=1208461958 TSecr=3750562918
123,60.887305,192.168.11.32,192.168.11.12,TCP,93,,,0.000172,"Jan  6, 2024 19:37:13.807434000 JST",,"41510  >  6000 [PSH, ACK] Seq=1 Ack=1 Win=64256 Len=27 TSval=1208461958 TSecr=3750562918 [TCP segment of a reassembled PDU]"
124,60.887409,192.168.11.32,192.168.11.12,TCP,66,,,0.000104,"Jan  6, 2024 19:37:13.807538000 JST",,"41510  >  6000 [FIN, ACK] Seq=28 Ack=1 Win=64256 Len=0 TSval=1208461958 TSecr=3750562918"
125,60.894432,192.168.11.12,192.168.11.32,TCP,66,0.007127,,0.007023,"Jan  6, 2024 19:37:13.814561000 JST",,6000  >  41510 [ACK] Seq=1 Ack=28 Win=65152 Len=0 TSval=3750562925 TSecr=1208461958
126,60.8948,192.168.11.12,192.168.11.32,TCP,66,0.007391,,0.000368,"Jan  6, 2024 19:37:13.814929000 JST",,"6000  >  41510 [FIN, ACK] Seq=1 Ack=29 Win=65152 Len=0 TSval=3750562926 TSecr=1208461958"
127,60.894854,192.168.11.32,192.168.11.12,TCP,66,0.000054,,0.000054,"Jan  6, 2024 19:37:13.814983000 JST",,41510  >  6000 [ACK] Seq=29 Ack=2 Win=64256 Len=0 TSval=1208461966 TSecr=3750562926
128,60.925186,192.168.11.32,255.255.255.255,UDP,209,,Åü,0.030332,"Jan  6, 2024 19:37:13.845315000 JST",7b2273656d616e74696373223a207b22656e74697479223a2022504944222c202262617365656e74697479223a2022616e79222c2022726f6c65223a2022767676222c20227370617469616c223a2022616e79222c202274656d706f72616c223a2022616e79227d2c20226461746170726f7065727479223a207b22666f726d6174223a2022696e616f6b615f70726f6772616d5f73616d706c655f73656d616e746963227d7d,58203  >  7000 Len=167
129,60.931277,192.168.11.18,192.168.11.32,TCP,74,,Åú,0.006091,"Jan  6, 2024 19:37:13.851406000 JST",,33258  >  6000 [SYN] Seq=0 Win=64240 Len=0 MSS=1460 SACK_PERM TSval=2989423338 TSecr=0 WS=128
130,60.93142,192.168.11.32,192.168.11.18,TCP,74,0.000143,,0.000143,"Jan  6, 2024 19:37:13.851549000 JST",,"6000  >  33258 [SYN, ACK] Seq=0 Ack=1 Win=65160 Len=0 MSS=1460 SACK_PERM TSval=3214922284 TSecr=2989423338 WS=128"
131,60.938327,192.168.11.18,192.168.11.32,TCP,66,0.006907,,0.006907,"Jan  6, 2024 19:37:13.858456000 JST",,33258  >  6000 [ACK] Seq=1 Ack=1 Win=64256 Len=0 TSval=2989423346 TSecr=3214922284
132,60.938773,192.168.11.18,192.168.11.32,TCP,93,,,0.000446,"Jan  6, 2024 19:37:13.858902000 JST",,"33258  >  6000 [PSH, ACK] Seq=1 Ack=1 Win=64256 Len=27 TSval=2989423346 TSecr=3214922284 [TCP segment of a reassembled PDU]"
133,60.938843,192.168.11.32,192.168.11.18,TCP,66,0.00007,,0.00007,"Jan  6, 2024 19:37:13.858972000 JST",,6000  >  33258 [ACK] Seq=1 Ack=28 Win=65152 Len=0 TSval=3214922292 TSecr=2989423346
134,60.938896,192.168.11.18,192.168.11.32,TCP,66,,,0.000053,"Jan  6, 2024 19:37:13.859025000 JST",,"33258  >  6000 [FIN, ACK] Seq=28 Ack=1 Win=64256 Len=0 TSval=2989423346 TSecr=3214922284"
135,60.939798,192.168.11.32,192.168.11.18,TCP,66,0.000902,,0.000902,"Jan  6, 2024 19:37:13.859927000 JST",,"6000  >  33258 [FIN, ACK] Seq=1 Ack=29 Win=65152 Len=0 TSval=3214922293 TSecr=2989423346"
136,60.946111,192.168.11.18,192.168.11.32,TCP,66,0.006313,,0.006313,"Jan  6, 2024 19:37:13.866240000 JST",,33258  >  6000 [ACK] Seq=29 Ack=2 Win=64256 Len=0 TSval=2989423353 TSecr=3214922293
137,71.801375,192.168.11.32,192.168.11.12,TCP,74,,,10.855264,"Jan  6, 2024 19:37:24.721504000 JST",,47332  >  6000 [SYN] Seq=0 Win=64240 Len=0 MSS=1460 SACK_PERM TSval=1208472872 TSecr=0 WS=128
138,71.808431,192.168.11.12,192.168.11.32,TCP,74,0.007056,,0.007056,"Jan  6, 2024 19:37:24.728560000 JST",,"6000  >  47332 [SYN, ACK] Seq=0 Ack=1 Win=65160 Len=0 MSS=1460 SACK_PERM TSval=3750573839 TSecr=1208472872 WS=128"
139,71.808563,192.168.11.32,192.168.11.12,TCP,66,0.000132,,0.000132,"Jan  6, 2024 19:37:24.728692000 JST",,47332  >  6000 [ACK] Seq=1 Ack=1 Win=64256 Len=0 TSval=1208472880 TSecr=3750573839
140,71.808703,192.168.11.32,192.168.11.12,TCP,93,,,0.00014,"Jan  6, 2024 19:37:24.728832000 JST",,"47332  >  6000 [PSH, ACK] Seq=1 Ack=1 Win=64256 Len=27 TSval=1208472880 TSecr=3750573839 [TCP segment of a reassembled PDU]"
141,71.808818,192.168.11.32,192.168.11.12,TCP,66,,,0.000115,"Jan  6, 2024 19:37:24.728947000 JST",,"47332  >  6000 [FIN, ACK] Seq=28 Ack=1 Win=64256 Len=0 TSval=1208472880 TSecr=3750573839"
142,71.815585,192.168.11.12,192.168.11.32,TCP,66,0.006882,,0.006767,"Jan  6, 2024 19:37:24.735714000 JST",,6000  >  47332 [ACK] Seq=1 Ack=28 Win=65152 Len=0 TSval=3750573846 TSecr=1208472880
143,71.815973,192.168.11.12,192.168.11.32,TCP,66,0.007155,,0.000388,"Jan  6, 2024 19:37:24.736102000 JST",,"6000  >  47332 [FIN, ACK] Seq=1 Ack=29 Win=65152 Len=0 TSval=3750573848 TSecr=1208472880"
144,71.816037,192.168.11.32,192.168.11.12,TCP,66,0.000064,,0.000064,"Jan  6, 2024 19:37:24.736166000 JST",,47332  >  6000 [ACK] Seq=29 Ack=2 Win=64256 Len=0 TSval=1208472887 TSecr=3750573848
145,71.846203,192.168.11.32,255.255.255.255,UDP,209,,Åü,0.030166,"Jan  6, 2024 19:37:24.766332000 JST",7b2273656d616e74696373223a207b22656e74697479223a2022504944222c202262617365656e74697479223a2022616e79222c2022726f6c65223a2022767676222c20227370617469616c223a2022616e79222c202274656d706f72616c223a2022616e79227d2c20226461746170726f7065727479223a207b22666f726d6174223a2022696e616f6b615f70726f6772616d5f73616d706c655f73656d616e746963227d7d,38847  >  7000 Len=167
146,71.852022,192.168.11.18,192.168.11.32,TCP,74,,Åú,0.005819,"Jan  6, 2024 19:37:24.772151000 JST",,48512  >  6000 [SYN] Seq=0 Win=64240 Len=0 MSS=1460 SACK_PERM TSval=2989434259 TSecr=0 WS=128
147,71.852217,192.168.11.32,192.168.11.18,TCP,74,0.000195,,0.000195,"Jan  6, 2024 19:37:24.772346000 JST",,"6000  >  48512 [SYN, ACK] Seq=0 Ack=1 Win=65160 Len=0 MSS=1460 SACK_PERM TSval=3214933205 TSecr=2989434259 WS=128"
148,71.859327,192.168.11.18,192.168.11.32,TCP,66,0.00711,,0.00711,"Jan  6, 2024 19:37:24.779456000 JST",,48512  >  6000 [ACK] Seq=1 Ack=1 Win=64256 Len=0 TSval=2989434266 TSecr=3214933205
149,71.860008,192.168.11.18,192.168.11.32,TCP,93,,,0.000681,"Jan  6, 2024 19:37:24.780137000 JST",,"48512  >  6000 [PSH, ACK] Seq=1 Ack=1 Win=64256 Len=27 TSval=2989434267 TSecr=3214933205 [TCP segment of a reassembled PDU]"
150,71.860131,192.168.11.32,192.168.11.18,TCP,66,0.000123,,0.000123,"Jan  6, 2024 19:37:24.780260000 JST",,6000  >  48512 [ACK] Seq=1 Ack=28 Win=65152 Len=0 TSval=3214933213 TSecr=2989434267
151,71.86019,192.168.11.18,192.168.11.32,TCP,66,,,0.000059,"Jan  6, 2024 19:37:24.780319000 JST",,"48512  >  6000 [FIN, ACK] Seq=28 Ack=1 Win=64256 Len=0 TSval=2989434267 TSecr=3214933205"
152,71.861121,192.168.11.32,192.168.11.18,TCP,66,0.000931,,0.000931,"Jan  6, 2024 19:37:24.781250000 JST",,"6000  >  48512 [FIN, ACK] Seq=1 Ack=29 Win=65152 Len=0 TSval=3214933214 TSecr=2989434267"
153,71.867728,192.168.11.18,192.168.11.32,TCP,66,0.006607,,0.006607,"Jan  6, 2024 19:37:24.787857000 JST",,48512  >  6000 [ACK] Seq=29 Ack=2 Win=64256 Len=0 TSval=2989434275 TSecr=3214933214
154,81.699236,192.168.11.32,192.168.11.12,TCP,74,,,9.831508,"Jan  6, 2024 19:37:34.619365000 JST",,45756  >  6000 [SYN] Seq=0 Win=64240 Len=0 MSS=1460 SACK_PERM TSval=1208482770 TSecr=0 WS=128
155,81.706787,192.168.11.12,192.168.11.32,TCP,74,0.007551,,0.007551,"Jan  6, 2024 19:37:34.626916000 JST",,"6000  >  45756 [SYN, ACK] Seq=0 Ack=1 Win=65160 Len=0 MSS=1460 SACK_PERM TSval=3750583738 TSecr=1208482770 WS=128"
156,81.706927,192.168.11.32,192.168.11.12,TCP,66,0.00014,,0.00014,"Jan  6, 2024 19:37:34.627056000 JST",,45756  >  6000 [ACK] Seq=1 Ack=1 Win=64256 Len=0 TSval=1208482778 TSecr=3750583738
157,81.707065,192.168.11.32,192.168.11.12,TCP,93,,,0.000138,"Jan  6, 2024 19:37:34.627194000 JST",,"45756  >  6000 [PSH, ACK] Seq=1 Ack=1 Win=64256 Len=27 TSval=1208482778 TSecr=3750583738 [TCP segment of a reassembled PDU]"
158,81.70719,192.168.11.32,192.168.11.12,TCP,66,,,0.000125,"Jan  6, 2024 19:37:34.627319000 JST",,"45756  >  6000 [FIN, ACK] Seq=28 Ack=1 Win=64256 Len=0 TSval=1208482778 TSecr=3750583738"
159,81.71398,192.168.11.12,192.168.11.32,TCP,66,0.006915,,0.00679,"Jan  6, 2024 19:37:34.634109000 JST",,6000  >  45756 [ACK] Seq=1 Ack=28 Win=65152 Len=0 TSval=3750583745 TSecr=1208482778
160,81.714355,192.168.11.12,192.168.11.32,TCP,66,0.007165,,0.000375,"Jan  6, 2024 19:37:34.634484000 JST",,"6000  >  45756 [FIN, ACK] Seq=1 Ack=29 Win=65152 Len=0 TSval=3750583746 TSecr=1208482778"
161,81.714417,192.168.11.32,192.168.11.12,TCP,66,0.000062,,0.000062,"Jan  6, 2024 19:37:34.634546000 JST",,45756  >  6000 [ACK] Seq=29 Ack=2 Win=64256 Len=0 TSval=1208482785 TSecr=3750583746
162,81.742583,192.168.11.32,255.255.255.255,UDP,209,,Åü,0.028166,"Jan  6, 2024 19:37:34.662712000 JST",7b2273656d616e74696373223a207b22656e74697479223a2022504944222c202262617365656e74697479223a2022616e79222c2022726f6c65223a2022767676222c20227370617469616c223a2022616e79222c202274656d706f72616c223a2022616e79227d2c20226461746170726f7065727479223a207b22666f726d6174223a2022696e616f6b615f70726f6772616d5f73616d706c655f73656d616e746963227d7d,53958  >  7000 Len=167
163,81.748273,192.168.11.18,192.168.11.32,TCP,74,,Åú,0.00569,"Jan  6, 2024 19:37:34.668402000 JST",,40442  >  6000 [SYN] Seq=0 Win=64240 Len=0 MSS=1460 SACK_PERM TSval=2989444156 TSecr=0 WS=128
164,81.74846,192.168.11.32,192.168.11.18,TCP,74,0.000187,,0.000187,"Jan  6, 2024 19:37:34.668589000 JST",,"6000  >  40442 [SYN, ACK] Seq=0 Ack=1 Win=65160 Len=0 MSS=1460 SACK_PERM TSval=3214943101 TSecr=2989444156 WS=128"
165,81.755495,192.168.11.18,192.168.11.32,TCP,66,0.007035,,0.007035,"Jan  6, 2024 19:37:34.675624000 JST",,40442  >  6000 [ACK] Seq=1 Ack=1 Win=64256 Len=0 TSval=2989444163 TSecr=3214943101
166,81.756137,192.168.11.18,192.168.11.32,TCP,93,,,0.000642,"Jan  6, 2024 19:37:34.676266000 JST",,"40442  >  6000 [PSH, ACK] Seq=1 Ack=1 Win=64256 Len=27 TSval=2989444163 TSecr=3214943101 [TCP segment of a reassembled PDU]"
167,81.756251,192.168.11.32,192.168.11.18,TCP,66,0.000114,,0.000114,"Jan  6, 2024 19:37:34.676380000 JST",,6000  >  40442 [ACK] Seq=1 Ack=28 Win=65152 Len=0 TSval=3214943109 TSecr=2989444163
168,81.756311,192.168.11.18,192.168.11.32,TCP,66,,,0.00006,"Jan  6, 2024 19:37:34.676440000 JST",,"40442  >  6000 [FIN, ACK] Seq=28 Ack=1 Win=64256 Len=0 TSval=2989444163 TSecr=3214943101"
169,81.757279,192.168.11.32,192.168.11.18,TCP,66,0.000968,,0.000968,"Jan  6, 2024 19:37:34.677408000 JST",,"6000  >  40442 [FIN, ACK] Seq=1 Ack=29 Win=65152 Len=0 TSval=3214943110 TSecr=2989444163"
170,81.763668,192.168.11.18,192.168.11.32,TCP,66,0.006389,,0.006389,"Jan  6, 2024 19:37:34.683797000 JST",,40442  >  6000 [ACK] Seq=29 Ack=2 Win=64256 Len=0 TSval=2989444171 TSecr=3214943110
171,113.87834,192.168.11.32,192.168.11.12,TCP,74,,,32.114672,"Jan  6, 2024 19:38:06.798469000 JST",,37520  >  6000 [SYN] Seq=0 Win=64240 Len=0 MSS=1460 SACK_PERM TSval=1208514949 TSecr=0 WS=128
172,113.884792,192.168.11.12,192.168.11.32,TCP,74,0.006452,,0.006452,"Jan  6, 2024 19:38:06.804921000 JST",,"6000  >  37520 [SYN, ACK] Seq=0 Ack=1 Win=65160 Len=0 MSS=1460 SACK_PERM TSval=3750615916 TSecr=1208514949 WS=128"
173,113.884897,192.168.11.32,192.168.11.12,TCP,66,0.000105,,0.000105,"Jan  6, 2024 19:38:06.805026000 JST",,37520  >  6000 [ACK] Seq=1 Ack=1 Win=64256 Len=0 TSval=1208514956 TSecr=3750615916
174,113.885041,192.168.11.32,192.168.11.12,TCP,93,,,0.000144,"Jan  6, 2024 19:38:06.805170000 JST",,"37520  >  6000 [PSH, ACK] Seq=1 Ack=1 Win=64256 Len=27 TSval=1208514956 TSecr=3750615916 [TCP segment of a reassembled PDU]"
175,113.885157,192.168.11.32,192.168.11.12,TCP,66,,,0.000116,"Jan  6, 2024 19:38:06.805286000 JST",,"37520  >  6000 [FIN, ACK] Seq=28 Ack=1 Win=64256 Len=0 TSval=1208514956 TSecr=3750615916"
176,113.89225,192.168.11.12,192.168.11.32,TCP,66,0.007209,,0.007093,"Jan  6, 2024 19:38:06.812379000 JST",,6000  >  37520 [ACK] Seq=1 Ack=28 Win=65152 Len=0 TSval=3750615923 TSecr=1208514956
177,113.892613,192.168.11.12,192.168.11.32,TCP,66,0.007456,,0.000363,"Jan  6, 2024 19:38:06.812742000 JST",,"6000  >  37520 [FIN, ACK] Seq=1 Ack=29 Win=65152 Len=0 TSval=3750615924 TSecr=1208514956"
178,113.892673,192.168.11.32,192.168.11.12,TCP,66,0.00006,,0.00006,"Jan  6, 2024 19:38:06.812802000 JST",,37520  >  6000 [ACK] Seq=29 Ack=2 Win=64256 Len=0 TSval=1208514964 TSecr=3750615924
179,113.924438,192.168.11.32,255.255.255.255,UDP,209,,Åü,0.031765,"Jan  6, 2024 19:38:06.844567000 JST",7b2273656d616e74696373223a207b22656e74697479223a2022504944222c202262617365656e74697479223a2022616e79222c2022726f6c65223a2022767676222c20227370617469616c223a2022616e79222c202274656d706f72616c223a2022616e79227d2c20226461746170726f7065727479223a207b22666f726d6174223a2022696e616f6b615f70726f6772616d5f73616d706c655f73656d616e746963227d7d,51312  >  7000 Len=167
180,113.930386,192.168.11.18,192.168.11.32,TCP,74,,Åú,0.005948,"Jan  6, 2024 19:38:06.850515000 JST",,51812  >  6000 [SYN] Seq=0 Win=64240 Len=0 MSS=1460 SACK_PERM TSval=2989476338 TSecr=0 WS=128
181,113.930563,192.168.11.32,192.168.11.18,TCP,74,0.000177,,0.000177,"Jan  6, 2024 19:38:06.850692000 JST",,"6000  >  51812 [SYN, ACK] Seq=0 Ack=1 Win=65160 Len=0 MSS=1460 SACK_PERM TSval=3214975284 TSecr=2989476338 WS=128"
182,113.937412,192.168.11.18,192.168.11.32,TCP,66,0.006849,,0.006849,"Jan  6, 2024 19:38:06.857541000 JST",,51812  >  6000 [ACK] Seq=1 Ack=1 Win=64256 Len=0 TSval=2989476345 TSecr=3214975284
183,113.93809,192.168.11.18,192.168.11.32,TCP,93,,,0.000678,"Jan  6, 2024 19:38:06.858219000 JST",,"51812  >  6000 [PSH, ACK] Seq=1 Ack=1 Win=64256 Len=27 TSval=2989476345 TSecr=3214975284 [TCP segment of a reassembled PDU]"
184,113.938223,192.168.11.32,192.168.11.18,TCP,66,0.000133,,0.000133,"Jan  6, 2024 19:38:06.858352000 JST",,6000  >  51812 [ACK] Seq=1 Ack=28 Win=65152 Len=0 TSval=3214975291 TSecr=2989476345
