No.,Time,Source,Destination,Protocol,Length,The RTT to ACK the segment was,XXX,Time delta from previous captured frame,Arrival Time,Data,Info
1,0,192.168.11.18,192.168.11.32,TCP,74,,,0,"Jan  6, 2024 19:36:12.979114000 JST",,48542  >  6000 [SYN] Seq=0 Win=64240 Len=0 MSS=1460 SACK_PERM TSval=2989362458 TSecr=0 WS=128
2,0.006605,192.168.11.32,192.168.11.18,TCP,74,0.006605,,0.006605,"Jan  6, 2024 19:36:12.985719000 JST",,"6000  >  48542 [SYN, ACK] Seq=0 Ack=1 Win=65160 Len=0 MSS=1460 SACK_PERM TSval=3214861407 TSecr=2989362458 WS=128"
3,0.006729,192.168.11.18,192.168.11.32,TCP,66,0.000124,,0.000124,"Jan  6, 2024 19:36:12.985843000 JST",,48542  >  6000 [ACK] Seq=1 Ack=1 Win=64256 Len=0 TSval=2989362468 TSecr=3214861407
4,0.007162,192.168.11.18,192.168.11.32,TCP,93,,,0.000433,"Jan  6, 2024 19:36:12.986276000 JST",,"48542  >  6000 [PSH, ACK] Seq=1 Ack=1 Win=64256 Len=27 TSval=2989362469 TSecr=3214861407 [TCP segment of a reassembled PDU]"
5,0.007301,192.168.11.18,192.168.11.32,TCP,66,,,0.000139,"Jan  6, 2024 19:36:12.986415000 JST",,"48542  >  6000 [FIN, ACK] Seq=28 Ack=1 Win=64256 Len=0 TSval=2989362469 TSecr=3214861407"
6,0.014304,192.168.11.32,192.168.11.18,TCP,66,0.007142,,0.007003,"Jan  6, 2024 19:36:12.993418000 JST",,6000  >  48542 [ACK] Seq=1 Ack=28 Win=65152 Len=0 TSval=3214861415 TSecr=2989362469
7,0.014532,192.168.11.32,192.168.11.18,TCP,66,0.007231,,0.000228,"Jan  6, 2024 19:36:12.993646000 JST",,"6000  >  48542 [FIN, ACK] Seq=1 Ack=29 Win=65152 Len=0 TSval=3214861416 TSecr=2989362469"
8,0.014581,192.168.11.18,192.168.11.32,TCP,66,0.000049,,0.000049,"Jan  6, 2024 19:36:12.993695000 JST",,48542  >  6000 [ACK] Seq=29 Ack=2 Win=64256 Len=0 TSval=2989362476 TSecr=3214861416
9,0.045677,192.168.11.18,255.255.255.255,UDP,209,,Åü,0.031096,"Jan  6, 2024 19:36:13.024791000 JST",7b2273656d616e74696373223a207b22656e74697479223a2022504944222c202262617365656e74697479223a2022616e79222c2022726f6c65223a2022777777222c20227370617469616c223a2022616e79222c202274656d706f72616c223a2022616e79227d2c20226461746170726f7065727479223a207b22666f726d6174223a2022696e616f6b615f70726f6772616d5f73616d706c655f73656d616e746963227d7d,43819  >  7000 Len=167
10,0.055171,192.168.11.33,192.168.11.18,TCP,74,,Åú,0.009494,"Jan  6, 2024 19:36:13.034285000 JST",,33164  >  6000 [SYN] Seq=0 Win=64240 Len=0 MSS=1460 SACK_PERM TSval=3756295530 TSecr=0 WS=128
11,0.055351,192.168.11.18,192.168.11.33,TCP,74,0.00018,,0.00018,"Jan  6, 2024 19:36:13.034465000 JST",,"6000  >  33164 [SYN, ACK] Seq=0 Ack=1 Win=65160 Len=0 MSS=1460 SACK_PERM TSval=2450201074 TSecr=3756295530 WS=128"
12,0.062359,192.168.11.33,192.168.11.18,TCP,66,0.007008,,0.007008,"Jan  6, 2024 19:36:13.041473000 JST",,33164  >  6000 [ACK] Seq=1 Ack=1 Win=64256 Len=0 TSval=3756295541 TSecr=2450201074
13,0.06306,192.168.11.33,192.168.11.18,TCP,93,,,0.000701,"Jan  6, 2024 19:36:13.042174000 JST",,"33164  >  6000 [PSH, ACK] Seq=1 Ack=1 Win=64256 Len=27 TSval=3756295541 TSecr=2450201074 [TCP segment of a reassembled PDU]"
14,0.063158,192.168.11.18,192.168.11.33,TCP,66,0.000098,,0.000098,"Jan  6, 2024 19:36:13.042272000 JST",,6000  >  33164 [ACK] Seq=1 Ack=28 Win=65152 Len=0 TSval=2450201082 TSecr=3756295541
15,0.063239,192.168.11.33,192.168.11.18,TCP,66,,,0.000081,"Jan  6, 2024 19:36:13.042353000 JST",,"33164  >  6000 [FIN, ACK] Seq=28 Ack=1 Win=64256 Len=0 TSval=3756295541 TSecr=2450201074"
16,0.065546,192.168.11.18,192.168.11.33,TCP,66,0.002307,,0.002307,"Jan  6, 2024 19:36:13.044660000 JST",,"6000  >  33164 [FIN, ACK] Seq=1 Ack=29 Win=65152 Len=0 TSval=2450201084 TSecr=3756295541"
17,0.073084,192.168.11.33,192.168.11.18,TCP,66,0.007538,,0.007538,"Jan  6, 2024 19:36:13.052198000 JST",,33164  >  6000 [ACK] Seq=29 Ack=2 Win=64256 Len=0 TSval=3756295551 TSecr=2450201084
18,9.30493,192.168.11.18,192.168.11.32,TCP,74,,,9.231846,"Jan  6, 2024 19:36:22.284044000 JST",,54868  >  6000 [SYN] Seq=0 Win=64240 Len=0 MSS=1460 SACK_PERM TSval=2989371767 TSecr=0 WS=128
19,9.312636,192.168.11.32,192.168.11.18,TCP,74,0.007706,,0.007706,"Jan  6, 2024 19:36:22.291750000 JST",,"6000  >  54868 [SYN, ACK] Seq=0 Ack=1 Win=65160 Len=0 MSS=1460 SACK_PERM TSval=3214870713 TSecr=2989371767 WS=128"
20,9.312753,192.168.11.18,192.168.11.32,TCP,66,0.000117,,0.000117,"Jan  6, 2024 19:36:22.291867000 JST",,54868  >  6000 [ACK] Seq=1 Ack=1 Win=64256 Len=0 TSval=2989371774 TSecr=3214870713
21,9.31296,192.168.11.18,192.168.11.32,TCP,93,,,0.000207,"Jan  6, 2024 19:36:22.292074000 JST",,"54868  >  6000 [PSH, ACK] Seq=1 Ack=1 Win=64256 Len=27 TSval=2989371775 TSecr=3214870713 [TCP segment of a reassembled PDU]"
22,9.313085,192.168.11.18,192.168.11.32,TCP,66,,,0.000125,"Jan  6, 2024 19:36:22.292199000 JST",,"54868  >  6000 [FIN, ACK] Seq=28 Ack=1 Win=64256 Len=0 TSval=2989371775 TSecr=3214870713"
23,9.319937,192.168.11.32,192.168.11.18,TCP,66,0.006977,,0.006852,"Jan  6, 2024 19:36:22.299051000 JST",,6000  >  54868 [ACK] Seq=1 Ack=28 Win=65152 Len=0 TSval=3214870721 TSecr=2989371775
24,9.320159,192.168.11.32,192.168.11.18,TCP,66,0.007074,,0.000222,"Jan  6, 2024 19:36:22.299273000 JST",,"6000  >  54868 [FIN, ACK] Seq=1 Ack=29 Win=65152 Len=0 TSval=3214870722 TSecr=2989371775"
25,9.320204,192.168.11.18,192.168.11.32,TCP,66,0.000045,,0.000045,"Jan  6, 2024 19:36:22.299318000 JST",,54868  >  6000 [ACK] Seq=29 Ack=2 Win=64256 Len=0 TSval=2989371782 TSecr=3214870722
26,9.355063,192.168.11.18,255.255.255.255,UDP,209,,Åü,0.034859,"Jan  6, 2024 19:36:22.334177000 JST",7b2273656d616e74696373223a207b22656e74697479223a2022504944222c202262617365656e74697479223a2022616e79222c2022726f6c65223a2022777777222c20227370617469616c223a2022616e79222c202274656d706f72616c223a2022616e79227d2c20226461746170726f7065727479223a207b22666f726d6174223a2022696e616f6b615f70726f6772616d5f73616d706c655f73656d616e746963227d7d,55111  >  7000 Len=167
27,9.361286,192.168.11.33,192.168.11.18,TCP,74,,Åú,0.006223,"Jan  6, 2024 19:36:22.340400000 JST",,47374  >  6000 [SYN] Seq=0 Win=64240 Len=0 MSS=1460 SACK_PERM TSval=3756304840 TSecr=0 WS=128
28,9.361411,192.168.11.18,192.168.11.33,TCP,74,0.000125,,0.000125,"Jan  6, 2024 19:36:22.340525000 JST",,"6000  >  47374 [SYN, ACK] Seq=0 Ack=1 Win=65160 Len=0 MSS=1460 SACK_PERM TSval=2450210380 TSecr=3756304840 WS=128"
29,9.367992,192.168.11.33,192.168.11.18,TCP,66,0.006581,,0.006581,"Jan  6, 2024 19:36:22.347106000 JST",,47374  >  6000 [ACK] Seq=1 Ack=1 Win=64256 Len=0 TSval=3756304847 TSecr=2450210380
30,9.368457,192.168.11.33,192.168.11.18,TCP,93,,,0.000465,"Jan  6, 2024 19:36:22.347571000 JST",,"47374  >  6000 [PSH, ACK] Seq=1 Ack=1 Win=64256 Len=27 TSval=3756304847 TSecr=2450210380 [TCP segment of a reassembled PDU]"
31,9.368515,192.168.11.18,192.168.11.33,TCP,66,0.000058,,0.000058,"Jan  6, 2024 19:36:22.347629000 JST",,6000  >  47374 [ACK] Seq=1 Ack=28 Win=65152 Len=0 TSval=2450210387 TSecr=3756304847
32,9.368583,192.168.11.33,192.168.11.18,TCP,66,,,0.000068,"Jan  6, 2024 19:36:22.347697000 JST",,"47374  >  6000 [FIN, ACK] Seq=28 Ack=1 Win=64256 Len=0 TSval=3756304847 TSecr=2450210380"
33,9.36969,192.168.11.18,192.168.11.33,TCP,66,0.001107,,0.001107,"Jan  6, 2024 19:36:22.348804000 JST",,"6000  >  47374 [FIN, ACK] Seq=1 Ack=29 Win=65152 Len=0 TSval=2450210388 TSecr=3756304847"
34,9.376384,192.168.11.33,192.168.11.18,TCP,66,0.006694,,0.006694,"Jan  6, 2024 19:36:22.355498000 JST",,47374  >  6000 [ACK] Seq=29 Ack=2 Win=64256 Len=0 TSval=3756304855 TSecr=2450210388
35,19.17021,192.168.11.18,192.168.11.32,TCP,74,,,9.793826,"Jan  6, 2024 19:36:32.149324000 JST",,45746  >  6000 [SYN] Seq=0 Win=64240 Len=0 MSS=1460 SACK_PERM TSval=2989381632 TSecr=0 WS=128
36,19.177823,192.168.11.32,192.168.11.18,TCP,74,0.007613,,0.007613,"Jan  6, 2024 19:36:32.156937000 JST",,"6000  >  45746 [SYN, ACK] Seq=0 Ack=1 Win=65160 Len=0 MSS=1460 SACK_PERM TSval=3214880578 TSecr=2989381632 WS=128"
37,19.177929,192.168.11.18,192.168.11.32,TCP,66,0.000106,,0.000106,"Jan  6, 2024 19:36:32.157043000 JST",,45746  >  6000 [ACK] Seq=1 Ack=1 Win=64256 Len=0 TSval=2989381640 TSecr=3214880578
38,19.178115,192.168.11.18,192.168.11.32,TCP,93,,,0.000186,"Jan  6, 2024 19:36:32.157229000 JST",,"45746  >  6000 [PSH, ACK] Seq=1 Ack=1 Win=64256 Len=27 TSval=2989381640 TSecr=3214880578 [TCP segment of a reassembled PDU]"
39,19.178214,192.168.11.18,192.168.11.32,TCP,66,,,0.000099,"Jan  6, 2024 19:36:32.157328000 JST",,"45746  >  6000 [FIN, ACK] Seq=28 Ack=1 Win=64256 Len=0 TSval=2989381640 TSecr=3214880578"
40,19.185484,192.168.11.32,192.168.11.18,TCP,66,0.007369,,0.00727,"Jan  6, 2024 19:36:32.164598000 JST",,6000  >  45746 [ACK] Seq=1 Ack=28 Win=65152 Len=0 TSval=3214880586 TSecr=2989381640
41,19.185874,192.168.11.32,192.168.11.18,TCP,66,0.00766,,0.00039,"Jan  6, 2024 19:36:32.164988000 JST",,"6000  >  45746 [FIN, ACK] Seq=1 Ack=29 Win=65152 Len=0 TSval=3214880587 TSecr=2989381640"
42,19.185926,192.168.11.18,192.168.11.32,TCP,66,0.000052,,0.000052,"Jan  6, 2024 19:36:32.165040000 JST",,45746  >  6000 [ACK] Seq=29 Ack=2 Win=64256 Len=0 TSval=2989381648 TSecr=3214880587
43,19.217001,192.168.11.18,255.255.255.255,UDP,209,,Åü,0.031075,"Jan  6, 2024 19:36:32.196115000 JST",7b2273656d616e74696373223a207b22656e74697479223a2022504944222c202262617365656e74697479223a2022616e79222c2022726f6c65223a2022777777222c20227370617469616c223a2022616e79222c202274656d706f72616c223a2022616e79227d2c20226461746170726f7065727479223a207b22666f726d6174223a2022696e616f6b615f70726f6772616d5f73616d706c655f73656d616e746963227d7d,45692  >  7000 Len=167
44,19.223021,192.168.11.33,192.168.11.18,TCP,74,,Åú,0.00602,"Jan  6, 2024 19:36:32.202135000 JST",,52498  >  6000 [SYN] Seq=0 Win=64240 Len=0 MSS=1460 SACK_PERM TSval=3756314702 TSecr=0 WS=128
45,19.22317,192.168.11.18,192.168.11.33,TCP,74,0.000149,,0.000149,"Jan  6, 2024 19:36:32.202284000 JST",,"6000  >  52498 [SYN, ACK] Seq=0 Ack=1 Win=65160 Len=0 MSS=1460 SACK_PERM TSval=2450220242 TSecr=3756314702 WS=128"
46,19.229838,192.168.11.33,192.168.11.18,TCP,66,0.006668,,0.006668,"Jan  6, 2024 19:36:32.208952000 JST",,52498  >  6000 [ACK] Seq=1 Ack=1 Win=64256 Len=0 TSval=3756314709 TSecr=2450220242
47,19.230332,192.168.11.33,192.168.11.18,TCP,93,,,0.000494,"Jan  6, 2024 19:36:32.209446000 JST",,"52498  >  6000 [PSH, ACK] Seq=1 Ack=1 Win=64256 Len=27 TSval=3756314709 TSecr=2450220242 [TCP segment of a reassembled PDU]"
48,19.230411,192.168.11.18,192.168.11.33,TCP,66,0.000079,,0.000079,"Jan  6, 2024 19:36:32.209525000 JST",,6000  >  52498 [ACK] Seq=1 Ack=28 Win=65152 Len=0 TSval=2450220249 TSecr=3756314709
49,19.23048,192.168.11.33,192.168.11.18,TCP,66,,,0.000069,"Jan  6, 2024 19:36:32.209594000 JST",,"52498  >  6000 [FIN, ACK] Seq=28 Ack=1 Win=64256 Len=0 TSval=3756314709 TSecr=2450220242"
50,19.231563,192.168.11.18,192.168.11.33,TCP,66,0.001083,,0.001083,"Jan  6, 2024 19:36:32.210677000 JST",,"6000  >  52498 [FIN, ACK] Seq=1 Ack=29 Win=65152 Len=0 TSval=2450220250 TSecr=3756314709"
51,19.237586,192.168.11.33,192.168.11.18,TCP,66,0.006023,,0.006023,"Jan  6, 2024 19:36:32.216700000 JST",,52498  >  6000 [ACK] Seq=29 Ack=2 Win=64256 Len=0 TSval=3756314716 TSecr=2450220250
52,29.091055,192.168.11.18,192.168.11.32,TCP,74,,,9.853469,"Jan  6, 2024 19:36:42.070169000 JST",,40054  >  6000 [SYN] Seq=0 Win=64240 Len=0 MSS=1460 SACK_PERM TSval=2989391553 TSecr=0 WS=128
53,29.098302,192.168.11.32,192.168.11.18,TCP,74,0.007247,,0.007247,"Jan  6, 2024 19:36:42.077416000 JST",,"6000  >  40054 [SYN, ACK] Seq=0 Ack=1 Win=65160 Len=0 MSS=1460 SACK_PERM TSval=3214890499 TSecr=2989391553 WS=128"
54,29.098407,192.168.11.18,192.168.11.32,TCP,66,0.000105,,0.000105,"Jan  6, 2024 19:36:42.077521000 JST",,40054  >  6000 [ACK] Seq=1 Ack=1 Win=64256 Len=0 TSval=2989391560 TSecr=3214890499
55,29.098551,192.168.11.18,192.168.11.32,TCP,93,,,0.000144,"Jan  6, 2024 19:36:42.077665000 JST",,"40054  >  6000 [PSH, ACK] Seq=1 Ack=1 Win=64256 Len=27 TSval=2989391560 TSecr=3214890499 [TCP segment of a reassembled PDU]"
56,29.098674,192.168.11.18,192.168.11.32,TCP,66,,,0.000123,"Jan  6, 2024 19:36:42.077788000 JST",,"40054  >  6000 [FIN, ACK] Seq=28 Ack=1 Win=64256 Len=0 TSval=2989391560 TSecr=3214890499"
57,29.107539,192.168.11.32,192.168.11.18,TCP,66,0.008988,,0.008865,"Jan  6, 2024 19:36:42.086653000 JST",,6000  >  40054 [ACK] Seq=1 Ack=28 Win=65152 Len=0 TSval=3214890507 TSecr=2989391560
58,29.10793,192.168.11.32,192.168.11.18,TCP,66,0.009256,,0.000391,"Jan  6, 2024 19:36:42.087044000 JST",,"6000  >  40054 [FIN, ACK] Seq=1 Ack=29 Win=65152 Len=0 TSval=3214890508 TSecr=2989391560"
59,29.107978,192.168.11.18,192.168.11.32,TCP,66,0.000048,,0.000048,"Jan  6, 2024 19:36:42.087092000 JST",,40054  >  6000 [ACK] Seq=29 Ack=2 Win=64256 Len=0 TSval=2989391570 TSecr=3214890508
60,29.139187,192.168.11.18,255.255.255.255,UDP,209,,Åü,0.031209,"Jan  6, 2024 19:36:42.118301000 JST",7b2273656d616e74696373223a207b22656e74697479223a2022504944222c202262617365656e74697479223a2022616e79222c2022726f6c65223a2022777777222c20227370617469616c223a2022616e79222c202274656d706f72616c223a2022616e79227d2c20226461746170726f7065727479223a207b22666f726d6174223a2022696e616f6b615f70726f6772616d5f73616d706c655f73656d616e746963227d7d,60826  >  7000 Len=167
61,29.145111,192.168.11.33,192.168.11.18,TCP,74,,Åú,0.005924,"Jan  6, 2024 19:36:42.124225000 JST",,50744  >  6000 [SYN] Seq=0 Win=64240 Len=0 MSS=1460 SACK_PERM TSval=3756324624 TSecr=0 WS=128
62,29.145266,192.168.11.18,192.168.11.33,TCP,74,0.000155,,0.000155,"Jan  6, 2024 19:36:42.124380000 JST",,"6000  >  50744 [SYN, ACK] Seq=0 Ack=1 Win=65160 Len=0 MSS=1460 SACK_PERM TSval=2450230164 TSecr=3756324624 WS=128"
63,29.152897,192.168.11.33,192.168.11.18,TCP,66,0.007631,,0.007631,"Jan  6, 2024 19:36:42.132011000 JST",,50744  >  6000 [ACK] Seq=1 Ack=1 Win=64256 Len=0 TSval=3756324632 TSecr=2450230164
64,29.153463,192.168.11.33,192.168.11.18,TCP,93,,,0.000566,"Jan  6, 2024 19:36:42.132577000 JST",,"50744  >  6000 [PSH, ACK] Seq=1 Ack=1 Win=64256 Len=27 TSval=3756324632 TSecr=2450230164 [TCP segment of a reassembled PDU]"
65,29.153551,192.168.11.18,192.168.11.33,TCP,66,0.000088,,0.000088,"Jan  6, 2024 19:36:42.132665000 JST",,6000  >  50744 [ACK] Seq=1 Ack=28 Win=65152 Len=0 TSval=2450230172 TSecr=3756324632
66,29.153618,192.168.11.33,192.168.11.18,TCP,66,,,0.000067,"Jan  6, 2024 19:36:42.132732000 JST",,"50744  >  6000 [FIN, ACK] Seq=28 Ack=1 Win=64256 Len=0 TSval=3756324632 TSecr=2450230164"
67,29.154724,192.168.11.18,192.168.11.33,TCP,66,0.001106,,0.001106,"Jan  6, 2024 19:36:42.133838000 JST",,"6000  >  50744 [FIN, ACK] Seq=1 Ack=29 Win=65152 Len=0 TSval=2450230173 TSecr=3756324632"
68,29.160878,192.168.11.33,192.168.11.18,TCP,66,0.006154,,0.006154,"Jan  6, 2024 19:36:42.139992000 JST",,50744  >  6000 [ACK] Seq=29 Ack=2 Win=64256 Len=0 TSval=3756324639 TSecr=2450230173
69,36.899801,192.168.11.18,192.168.11.32,TCP,74,,,7.738923,"Jan  6, 2024 19:36:49.878915000 JST",,40064  >  6000 [SYN] Seq=0 Win=64240 Len=0 MSS=1460 SACK_PERM TSval=2989399361 TSecr=0 WS=128
70,36.911538,192.168.11.32,192.168.11.18,TCP,74,0.011737,,0.011737,"Jan  6, 2024 19:36:49.890652000 JST",,"6000  >  40064 [SYN, ACK] Seq=0 Ack=1 Win=65160 Len=0 MSS=1460 SACK_PERM TSval=3214898309 TSecr=2989399361 WS=128"
71,36.911661,192.168.11.18,192.168.11.32,TCP,66,0.000123,,0.000123,"Jan  6, 2024 19:36:49.890775000 JST",,40064  >  6000 [ACK] Seq=1 Ack=1 Win=64256 Len=0 TSval=2989399373 TSecr=3214898309
72,36.911858,192.168.11.18,192.168.11.32,TCP,93,,,0.000197,"Jan  6, 2024 19:36:49.890972000 JST",,"40064  >  6000 [PSH, ACK] Seq=1 Ack=1 Win=64256 Len=27 TSval=2989399373 TSecr=3214898309 [TCP segment of a reassembled PDU]"
73,36.911953,192.168.11.18,192.168.11.32,TCP,66,,,0.000095,"Jan  6, 2024 19:36:49.891067000 JST",,"40064  >  6000 [FIN, ACK] Seq=28 Ack=1 Win=64256 Len=0 TSval=2989399374 TSecr=3214898309"
74,36.919038,192.168.11.32,192.168.11.18,TCP,66,0.00718,,0.007085,"Jan  6, 2024 19:36:49.898152000 JST",,6000  >  40064 [ACK] Seq=1 Ack=28 Win=65152 Len=0 TSval=3214898320 TSecr=2989399373
75,36.919276,192.168.11.32,192.168.11.18,TCP,66,0.007323,,0.000238,"Jan  6, 2024 19:36:49.898390000 JST",,"6000  >  40064 [FIN, ACK] Seq=1 Ack=29 Win=65152 Len=0 TSval=3214898321 TSecr=2989399374"
76,36.91933,192.168.11.18,192.168.11.32,TCP,66,0.000054,,0.000054,"Jan  6, 2024 19:36:49.898444000 JST",,40064  >  6000 [ACK] Seq=29 Ack=2 Win=64256 Len=0 TSval=2989399381 TSecr=3214898321
77,36.956271,192.168.11.18,255.255.255.255,UDP,209,,Åü,0.036941,"Jan  6, 2024 19:36:49.935385000 JST",7b2273656d616e74696373223a207b22656e74697479223a2022504944222c202262617365656e74697479223a2022616e79222c2022726f6c65223a2022777777222c20227370617469616c223a2022616e79222c202274656d706f72616c223a2022616e79227d2c20226461746170726f7065727479223a207b22666f726d6174223a2022696e616f6b615f70726f6772616d5f73616d706c655f73656d616e746963227d7d,33283  >  7000 Len=167
78,36.962003,192.168.11.33,192.168.11.18,TCP,74,,Åú,0.005732,"Jan  6, 2024 19:36:49.941117000 JST",,46746  >  6000 [SYN] Seq=0 Win=64240 Len=0 MSS=1460 SACK_PERM TSval=3756332441 TSecr=0 WS=128
79,36.962179,192.168.11.18,192.168.11.33,TCP,74,0.000176,,0.000176,"Jan  6, 2024 19:36:49.941293000 JST",,"6000  >  46746 [SYN, ACK] Seq=0 Ack=1 Win=65160 Len=0 MSS=1460 SACK_PERM TSval=2450237981 TSecr=3756332441 WS=128"
80,36.968746,192.168.11.33,192.168.11.18,TCP,66,0.006567,,0.006567,"Jan  6, 2024 19:36:49.947860000 JST",,46746  >  6000 [ACK] Seq=1 Ack=1 Win=64256 Len=0 TSval=3756332448 TSecr=2450237981
81,36.969247,192.168.11.33,192.168.11.18,TCP,93,,,0.000501,"Jan  6, 2024 19:36:49.948361000 JST",,"46746  >  6000 [PSH, ACK] Seq=1 Ack=1 Win=64256 Len=27 TSval=3756332448 TSecr=2450237981 [TCP segment of a reassembled PDU]"
82,36.969332,192.168.11.18,192.168.11.33,TCP,66,0.000085,,0.000085,"Jan  6, 2024 19:36:49.948446000 JST",,6000  >  46746 [ACK] Seq=1 Ack=28 Win=65152 Len=0 TSval=2450237988 TSecr=3756332448
83,36.969406,192.168.11.33,192.168.11.18,TCP,66,,,0.000074,"Jan  6, 2024 19:36:49.948520000 JST",,"46746  >  6000 [FIN, ACK] Seq=28 Ack=1 Win=64256 Len=0 TSval=3756332448 TSecr=2450237981"
84,36.97058,192.168.11.18,192.168.11.33,TCP,66,0.001174,,0.001174,"Jan  6, 2024 19:36:49.949694000 JST",,"6000  >  46746 [FIN, ACK] Seq=1 Ack=29 Win=65152 Len=0 TSval=2450237989 TSecr=3756332448"
85,36.976578,192.168.11.33,192.168.11.18,TCP,66,0.005998,,0.005998,"Jan  6, 2024 19:36:49.955692000 JST",,46746  >  6000 [ACK] Seq=29 Ack=2 Win=64256 Len=0 TSval=3756332455 TSecr=2450237989
86,44.71254,192.168.11.18,192.168.11.32,TCP,74,,,7.735962,"Jan  6, 2024 19:36:57.691654000 JST",,51134  >  6000 [SYN] Seq=0 Win=64240 Len=0 MSS=1460 SACK_PERM TSval=2989407174 TSecr=0 WS=128
87,44.72368,192.168.11.32,192.168.11.18,TCP,74,0.01114,,0.01114,"Jan  6, 2024 19:36:57.702794000 JST",,"6000  >  51134 [SYN, ACK] Seq=0 Ack=1 Win=65160 Len=0 MSS=1460 SACK_PERM TSval=3214906123 TSecr=2989407174 WS=128"
88,44.723786,192.168.11.18,192.168.11.32,TCP,66,0.000106,,0.000106,"Jan  6, 2024 19:36:57.702900000 JST",,51134  >  6000 [ACK] Seq=1 Ack=1 Win=64256 Len=0 TSval=2989407185 TSecr=3214906123
89,44.72397,192.168.11.18,192.168.11.32,TCP,93,,,0.000184,"Jan  6, 2024 19:36:57.703084000 JST",,"51134  >  6000 [PSH, ACK] Seq=1 Ack=1 Win=64256 Len=27 TSval=2989407186 TSecr=3214906123 [TCP segment of a reassembled PDU]"
90,44.724071,192.168.11.18,192.168.11.32,TCP,66,,,0.000101,"Jan  6, 2024 19:36:57.703185000 JST",,"51134  >  6000 [FIN, ACK] Seq=28 Ack=1 Win=64256 Len=0 TSval=2989407186 TSecr=3214906123"
91,44.732747,192.168.11.32,192.168.11.18,TCP,66,0.008777,,0.008676,"Jan  6, 2024 19:36:57.711861000 JST",,6000  >  51134 [ACK] Seq=1 Ack=28 Win=65152 Len=0 TSval=3214906133 TSecr=2989407186
92,44.733112,192.168.11.32,192.168.11.18,TCP,66,0.009041,,0.000365,"Jan  6, 2024 19:36:57.712226000 JST",,"6000  >  51134 [FIN, ACK] Seq=1 Ack=29 Win=65152 Len=0 TSval=3214906134 TSecr=2989407186"
93,44.733166,192.168.11.18,192.168.11.32,TCP,66,0.000054,,0.000054,"Jan  6, 2024 19:36:57.712280000 JST",,51134  >  6000 [ACK] Seq=29 Ack=2 Win=64256 Len=0 TSval=2989407195 TSecr=3214906134
94,44.765191,192.168.11.18,255.255.255.255,UDP,209,,Åü,0.032025,"Jan  6, 2024 19:36:57.744305000 JST",7b2273656d616e74696373223a207b22656e74697479223a2022504944222c202262617365656e74697479223a2022616e79222c2022726f6c65223a2022777777222c20227370617469616c223a2022616e79222c202274656d706f72616c223a2022616e79227d2c20226461746170726f7065727479223a207b22666f726d6174223a2022696e616f6b615f70726f6772616d5f73616d706c655f73656d616e746963227d7d,44279  >  7000 Len=167
95,44.771154,192.168.11.33,192.168.11.18,TCP,74,,Åú,0.005963,"Jan  6, 2024 19:36:57.750268000 JST",,38128  >  6000 [SYN] Seq=0 Win=64240 Len=0 MSS=1460 SACK_PERM TSval=3756340250 TSecr=0 WS=128
96,44.771297,192.168.11.18,192.168.11.33,TCP,74,0.000143,,0.000143,"Jan  6, 2024 19:36:57.750411000 JST",,"6000  >  38128 [SYN, ACK] Seq=0 Ack=1 Win=65160 Len=0 MSS=1460 SACK_PERM TSval=2450245790 TSecr=3756340250 WS=128"
97,44.778152,192.168.11.33,192.168.11.18,TCP,66,0.006855,,0.006855,"Jan  6, 2024 19:36:57.757266000 JST",,38128  >  6000 [ACK] Seq=1 Ack=1 Win=64256 Len=0 TSval=3756340257 TSecr=2450245790
98,44.778803,192.168.11.33,192.168.11.18,TCP,93,,,0.000651,"Jan  6, 2024 19:36:57.757917000 JST",,"38128  >  6000 [PSH, ACK] Seq=1 Ack=1 Win=64256 Len=27 TSval=3756340257 TSecr=2450245790 [TCP segment of a reassembled PDU]"
99,44.778945,192.168.11.18,192.168.11.33,TCP,66,0.000142,,0.000142,"Jan  6, 2024 19:36:57.758059000 JST",,6000  >  38128 [ACK] Seq=1 Ack=28 Win=65152 Len=0 TSval=2450245797 TSecr=3756340257
100,44.77913,192.168.11.33,192.168.11.18,TCP,66,,,0.000185,"Jan  6, 2024 19:36:57.758244000 JST",,"38128  >  6000 [FIN, ACK] Seq=28 Ack=1 Win=64256 Len=0 TSval=3756340257 TSecr=2450245790"
101,44.780526,192.168.11.18,192.168.11.33,TCP,66,0.001396,,0.001396,"Jan  6, 2024 19:36:57.759640000 JST",,"6000  >  38128 [FIN, ACK] Seq=1 Ack=29 Win=65152 Len=0 TSval=2450245799 TSecr=3756340257"
102,44.786907,192.168.11.33,192.168.11.18,TCP,66,0.006381,,0.006381,"Jan  6, 2024 19:36:57.766021000 JST",,38128  >  6000 [ACK] Seq=29 Ack=2 Win=64256 Len=0 TSval=3756340265 TSecr=2450245799
103,52.574389,192.168.11.18,192.168.11.32,TCP,74,,,7.787482,"Jan  6, 2024 19:37:05.553503000 JST",,53628  >  6000 [SYN] Seq=0 Win=64240 Len=0 MSS=1460 SACK_PERM TSval=2989415036 TSecr=0 WS=128
104,52.582082,192.168.11.32,192.168.11.18,TCP,74,0.007693,,0.007693,"Jan  6, 2024 19:37:05.561196000 JST",,"6000  >  53628 [SYN, ACK] Seq=0 Ack=1 Win=65160 Len=0 MSS=1460 SACK_PERM TSval=3214913982 TSecr=2989415036 WS=128"
105,52.5822,192.168.11.18,192.168.11.32,TCP,66,0.000118,,0.000118,"Jan  6, 2024 19:37:05.561314000 JST",,53628  >  6000 [ACK] Seq=1 Ack=1 Win=64256 Len=0 TSval=2989415044 TSecr=3214913982
106,52.582384,192.168.11.18,192.168.11.32,TCP,93,,,0.000184,"Jan  6, 2024 19:37:05.561498000 JST",,"53628  >  6000 [PSH, ACK] Seq=1 Ack=1 Win=64256 Len=27 TSval=2989415044 TSecr=3214913982 [TCP segment of a reassembled PDU]"
107,52.58251,192.168.11.18,192.168.11.32,TCP,66,,,0.000126,"Jan  6, 2024 19:37:05.561624000 JST",,"53628  >  6000 [FIN, ACK] Seq=28 Ack=1 Win=64256 Len=0 TSval=2989415044 TSecr=3214913982"
108,52.589381,192.168.11.32,192.168.11.18,TCP,66,0.006997,,0.006871,"Jan  6, 2024 19:37:05.568495000 JST",,6000  >  53628 [ACK] Seq=1 Ack=28 Win=65152 Len=0 TSval=3214913990 TSecr=2989415044
109,52.589765,192.168.11.32,192.168.11.18,TCP,66,0.007255,,0.000384,"Jan  6, 2024 19:37:05.568879000 JST",,"6000  >  53628 [FIN, ACK] Seq=1 Ack=29 Win=65152 Len=0 TSval=3214913991 TSecr=2989415044"
110,52.589813,192.168.11.18,192.168.11.32,TCP,66,0.000048,,0.000048,"Jan  6, 2024 19:37:05.568927000 JST",,53628  >  6000 [ACK] Seq=29 Ack=2 Win=64256 Len=0 TSval=2989415051 TSecr=3214913991
111,52.621718,192.168.11.18,255.255.255.255,UDP,209,,Åü,0.031905,"Jan  6, 2024 19:37:05.600832000 JST",7b2273656d616e74696373223a207b22656e74697479223a2022504944222c202262617365656e74697479223a2022616e79222c2022726f6c65223a2022777777222c20227370617469616c223a2022616e79222c202274656d706f72616c223a2022616e79227d2c20226461746170726f7065727479223a207b22666f726d6174223a2022696e616f6b615f70726f6772616d5f73616d706c655f73656d616e746963227d7d,50688  >  7000 Len=167
112,52.628389,192.168.11.33,192.168.11.18,TCP,74,,Åú,0.006671,"Jan  6, 2024 19:37:05.607503000 JST",,38130  >  6000 [SYN] Seq=0 Win=64240 Len=0 MSS=1460 SACK_PERM TSval=3756348106 TSecr=0 WS=128
113,52.628541,192.168.11.18,192.168.11.33,TCP,74,0.000152,,0.000152,"Jan  6, 2024 19:37:05.607655000 JST",,"6000  >  38130 [SYN, ACK] Seq=0 Ack=1 Win=65160 Len=0 MSS=1460 SACK_PERM TSval=2450253647 TSecr=3756348106 WS=128"
114,52.6353,192.168.11.33,192.168.11.18,TCP,66,0.006759,,0.006759,"Jan  6, 2024 19:37:05.614414000 JST",,38130  >  6000 [ACK] Seq=1 Ack=1 Win=64256 Len=0 TSval=3756348114 TSecr=2450253647
115,52.635759,192.168.11.33,192.168.11.18,TCP,93,,,0.000459,"Jan  6, 2024 19:37:05.614873000 JST",,"38130  >  6000 [PSH, ACK] Seq=1 Ack=1 Win=64256 Len=27 TSval=3756348114 TSecr=2450253647 [TCP segment of a reassembled PDU]"
116,52.635816,192.168.11.18,192.168.11.33,TCP,66,0.000057,,0.000057,"Jan  6, 2024 19:37:05.614930000 JST",,6000  >  38130 [ACK] Seq=1 Ack=28 Win=65152 Len=0 TSval=2450253654 TSecr=3756348114
117,52.635888,192.168.11.33,192.168.11.18,TCP,66,,,0.000072,"Jan  6, 2024 19:37:05.615002000 JST",,"38130  >  6000 [FIN, ACK] Seq=28 Ack=1 Win=64256 Len=0 TSval=3756348115 TSecr=2450253647"
118,52.636934,192.168.11.18,192.168.11.33,TCP,66,0.001046,,0.001046,"Jan  6, 2024 19:37:05.616048000 JST",,"6000  >  38130 [FIN, ACK] Seq=1 Ack=29 Win=65152 Len=0 TSval=2450253656 TSecr=3756348115"
119,52.643459,192.168.11.33,192.168.11.18,TCP,66,0.006525,,0.006525,"Jan  6, 2024 19:37:05.622573000 JST",,38130  >  6000 [ACK] Seq=29 Ack=2 Win=64256 Len=0 TSval=3756348122 TSecr=2450253656
120,60.876629,192.168.11.18,192.168.11.32,TCP,74,,,8.23317,"Jan  6, 2024 19:37:13.855743000 JST",,33258  >  6000 [SYN] Seq=0 Win=64240 Len=0 MSS=1460 SACK_PERM TSval=2989423338 TSecr=0 WS=128
121,60.884141,192.168.11.32,192.168.11.18,TCP,74,0.007512,,0.007512,"Jan  6, 2024 19:37:13.863255000 JST",,"6000  >  33258 [SYN, ACK] Seq=0 Ack=1 Win=65160 Len=0 MSS=1460 SACK_PERM TSval=3214922284 TSecr=2989423338 WS=128"
122,60.884258,192.168.11.18,192.168.11.32,TCP,66,0.000117,,0.000117,"Jan  6, 2024 19:37:13.863372000 JST",,33258  >  6000 [ACK] Seq=1 Ack=1 Win=64256 Len=0 TSval=2989423346 TSecr=3214922284
123,60.884445,192.168.11.18,192.168.11.32,TCP,93,,,0.000187,"Jan  6, 2024 19:37:13.863559000 JST",,"33258  >  6000 [PSH, ACK] Seq=1 Ack=1 Win=64256 Len=27 TSval=2989423346 TSecr=3214922284 [TCP segment of a reassembled PDU]"
124,60.884575,192.168.11.18,192.168.11.32,TCP,66,,,0.00013,"Jan  6, 2024 19:37:13.863689000 JST",,"33258  >  6000 [FIN, ACK] Seq=28 Ack=1 Win=64256 Len=0 TSval=2989423346 TSecr=3214922284"
125,60.891178,192.168.11.32,192.168.11.18,TCP,66,0.006733,,0.006603,"Jan  6, 2024 19:37:13.870292000 JST",,6000  >  33258 [ACK] Seq=1 Ack=28 Win=65152 Len=0 TSval=3214922292 TSecr=2989423346
126,60.891563,192.168.11.32,192.168.11.18,TCP,66,0.006988,,0.000385,"Jan  6, 2024 19:37:13.870677000 JST",,"6000  >  33258 [FIN, ACK] Seq=1 Ack=29 Win=65152 Len=0 TSval=3214922293 TSecr=2989423346"
127,60.891608,192.168.11.18,192.168.11.32,TCP,66,0.000045,,0.000045,"Jan  6, 2024 19:37:13.870722000 JST",,33258  >  6000 [ACK] Seq=29 Ack=2 Win=64256 Len=0 TSval=2989423353 TSecr=3214922293
128,60.921373,192.168.11.18,255.255.255.255,UDP,209,,Åü,0.029765,"Jan  6, 2024 19:37:13.900487000 JST",7b2273656d616e74696373223a207b22656e74697479223a2022504944222c202262617365656e74697479223a2022616e79222c2022726f6c65223a2022777777222c20227370617469616c223a2022616e79222c202274656d706f72616c223a2022616e79227d2c20226461746170726f7065727479223a207b22666f726d6174223a2022696e616f6b615f70726f6772616d5f73616d706c655f73656d616e746963227d7d,58521  >  7000 Len=167
129,60.928435,192.168.11.33,192.168.11.18,TCP,74,,Åú,0.007062,"Jan  6, 2024 19:37:13.907549000 JST",,58730  >  6000 [SYN] Seq=0 Win=64240 Len=0 MSS=1460 SACK_PERM TSval=3756356406 TSecr=0 WS=128
130,60.928618,192.168.11.18,192.168.11.33,TCP,74,0.000183,,0.000183,"Jan  6, 2024 19:37:13.907732000 JST",,"6000  >  58730 [SYN, ACK] Seq=0 Ack=1 Win=65160 Len=0 MSS=1460 SACK_PERM TSval=2450261947 TSecr=3756356406 WS=128"
131,60.935322,192.168.11.33,192.168.11.18,TCP,66,0.006704,,0.006704,"Jan  6, 2024 19:37:13.914436000 JST",,58730  >  6000 [ACK] Seq=1 Ack=1 Win=64256 Len=0 TSval=3756356414 TSecr=2450261947
132,60.935818,192.168.11.33,192.168.11.18,TCP,93,,,0.000496,"Jan  6, 2024 19:37:13.914932000 JST",,"58730  >  6000 [PSH, ACK] Seq=1 Ack=1 Win=64256 Len=27 TSval=3756356415 TSecr=2450261947 [TCP segment of a reassembled PDU]"
133,60.935889,192.168.11.18,192.168.11.33,TCP,66,0.000071,,0.000071,"Jan  6, 2024 19:37:13.915003000 JST",,6000  >  58730 [ACK] Seq=1 Ack=28 Win=65152 Len=0 TSval=2450261954 TSecr=3756356415
134,60.935966,192.168.11.33,192.168.11.18,TCP,66,,,0.000077,"Jan  6, 2024 19:37:13.915080000 JST",,"58730  >  6000 [FIN, ACK] Seq=28 Ack=1 Win=64256 Len=0 TSval=3756356415 TSecr=2450261947"
135,60.937024,192.168.11.18,192.168.11.33,TCP,66,0.001058,,0.001058,"Jan  6, 2024 19:37:13.916138000 JST",,"6000  >  58730 [FIN, ACK] Seq=1 Ack=29 Win=65152 Len=0 TSval=2450261956 TSecr=3756356415"
136,60.943471,192.168.11.33,192.168.11.18,TCP,66,0.006447,,0.006447,"Jan  6, 2024 19:37:13.922585000 JST",,58730  >  6000 [ACK] Seq=29 Ack=2 Win=64256 Len=0 TSval=3756356422 TSecr=2450261956
137,71.797736,192.168.11.18,192.168.11.32,TCP,74,,,10.854265,"Jan  6, 2024 19:37:24.776850000 JST",,48512  >  6000 [SYN] Seq=0 Win=64240 Len=0 MSS=1460 SACK_PERM TSval=2989434259 TSecr=0 WS=128
138,71.804679,192.168.11.32,192.168.11.18,TCP,74,0.006943,,0.006943,"Jan  6, 2024 19:37:24.783793000 JST",,"6000  >  48512 [SYN, ACK] Seq=0 Ack=1 Win=65160 Len=0 MSS=1460 SACK_PERM TSval=3214933205 TSecr=2989434259 WS=128"
139,71.804789,192.168.11.18,192.168.11.32,TCP,66,0.00011,,0.00011,"Jan  6, 2024 19:37:24.783903000 JST",,48512  >  6000 [ACK] Seq=1 Ack=1 Win=64256 Len=0 TSval=2989434266 TSecr=3214933205
140,71.804982,192.168.11.18,192.168.11.32,TCP,93,,,0.000193,"Jan  6, 2024 19:37:24.784096000 JST",,"48512  >  6000 [PSH, ACK] Seq=1 Ack=1 Win=64256 Len=27 TSval=2989434267 TSecr=3214933205 [TCP segment of a reassembled PDU]"
141,71.805087,192.168.11.18,192.168.11.32,TCP,66,,,0.000105,"Jan  6, 2024 19:37:24.784201000 JST",,"48512  >  6000 [FIN, ACK] Seq=28 Ack=1 Win=64256 Len=0 TSval=2989434267 TSecr=3214933205"
142,71.812481,192.168.11.32,192.168.11.18,TCP,66,0.007499,,0.007394,"Jan  6, 2024 19:37:24.791595000 JST",,6000  >  48512 [ACK] Seq=1 Ack=28 Win=65152 Len=0 TSval=3214933213 TSecr=2989434267
143,71.812863,192.168.11.32,192.168.11.18,TCP,66,0.007776,,0.000382,"Jan  6, 2024 19:37:24.791977000 JST",,"6000  >  48512 [FIN, ACK] Seq=1 Ack=29 Win=65152 Len=0 TSval=3214933214 TSecr=2989434267"
144,71.812911,192.168.11.18,192.168.11.32,TCP,66,0.000048,,0.000048,"Jan  6, 2024 19:37:24.792025000 JST",,48512  >  6000 [ACK] Seq=29 Ack=2 Win=64256 Len=0 TSval=2989434275 TSecr=3214933214
145,71.84283,192.168.11.18,255.255.255.255,UDP,209,,Åü,0.029919,"Jan  6, 2024 19:37:24.821944000 JST",7b2273656d616e74696373223a207b22656e74697479223a2022504944222c202262617365656e74697479223a2022616e79222c2022726f6c65223a2022777777222c20227370617469616c223a2022616e79222c202274656d706f72616c223a2022616e79227d2c20226461746170726f7065727479223a207b22666f726d6174223a2022696e616f6b615f70726f6772616d5f73616d706c655f73656d616e746963227d7d,50467  >  7000 Len=167
146,71.852457,192.168.11.33,192.168.11.18,TCP,74,,Åú,0.009627,"Jan  6, 2024 19:37:24.831571000 JST",,39786  >  6000 [SYN] Seq=0 Win=64240 Len=0 MSS=1460 SACK_PERM TSval=3756367327 TSecr=0 WS=128
147,71.852609,192.168.11.18,192.168.11.33,TCP,74,0.000152,,0.000152,"Jan  6, 2024 19:37:24.831723000 JST",,"6000  >  39786 [SYN, ACK] Seq=0 Ack=1 Win=65160 Len=0 MSS=1460 SACK_PERM TSval=2450272871 TSecr=3756367327 WS=128"
148,71.859425,192.168.11.33,192.168.11.18,TCP,66,0.006816,,0.006816,"Jan  6, 2024 19:37:24.838539000 JST",,39786  >  6000 [ACK] Seq=1 Ack=1 Win=64256 Len=0 TSval=3756367338 TSecr=2450272871
149,71.860092,192.168.11.33,192.168.11.18,TCP,93,,,0.000667,"Jan  6, 2024 19:37:24.839206000 JST",,"39786  >  6000 [PSH, ACK] Seq=1 Ack=1 Win=64256 Len=27 TSval=3756367338 TSecr=2450272871 [TCP segment of a reassembled PDU]"
150,71.860205,192.168.11.18,192.168.11.33,TCP,66,0.000113,,0.000113,"Jan  6, 2024 19:37:24.839319000 JST",,6000  >  39786 [ACK] Seq=1 Ack=28 Win=65152 Len=0 TSval=2450272879 TSecr=3756367338
151,71.860313,192.168.11.33,192.168.11.18,TCP,66,,,0.000108,"Jan  6, 2024 19:37:24.839427000 JST",,"39786  >  6000 [FIN, ACK] Seq=28 Ack=1 Win=64256 Len=0 TSval=3756367338 TSecr=2450272871"
152,71.861721,192.168.11.18,192.168.11.33,TCP,66,0.001408,,0.001408,"Jan  6, 2024 19:37:24.840835000 JST",,"6000  >  39786 [FIN, ACK] Seq=1 Ack=29 Win=65152 Len=0 TSval=2450272880 TSecr=3756367338"
153,71.867559,192.168.11.33,192.168.11.18,TCP,66,0.005838,,0.005838,"Jan  6, 2024 19:37:24.846673000 JST",,39786  >  6000 [ACK] Seq=29 Ack=2 Win=64256 Len=0 TSval=3756367346 TSecr=2450272880
154,81.694113,192.168.11.18,192.168.11.32,TCP,74,,,9.826554,"Jan  6, 2024 19:37:34.673227000 JST",,40442  >  6000 [SYN] Seq=0 Win=64240 Len=0 MSS=1460 SACK_PERM TSval=2989444156 TSecr=0 WS=128
155,81.701264,192.168.11.32,192.168.11.18,TCP,74,0.007151,,0.007151,"Jan  6, 2024 19:37:34.680378000 JST",,"6000  >  40442 [SYN, ACK] Seq=0 Ack=1 Win=65160 Len=0 MSS=1460 SACK_PERM TSval=3214943101 TSecr=2989444156 WS=128"
156,81.701374,192.168.11.18,192.168.11.32,TCP,66,0.00011,,0.00011,"Jan  6, 2024 19:37:34.680488000 JST",,40442  >  6000 [ACK] Seq=1 Ack=1 Win=64256 Len=0 TSval=2989444163 TSecr=3214943101
157,81.701621,192.168.11.18,192.168.11.32,TCP,93,,,0.000247,"Jan  6, 2024 19:37:34.680735000 JST",,"40442  >  6000 [PSH, ACK] Seq=1 Ack=1 Win=64256 Len=27 TSval=2989444163 TSecr=3214943101 [TCP segment of a reassembled PDU]"
158,81.701758,192.168.11.18,192.168.11.32,TCP,66,,,0.000137,"Jan  6, 2024 19:37:34.680872000 JST",,"40442  >  6000 [FIN, ACK] Seq=28 Ack=1 Win=64256 Len=0 TSval=2989444163 TSecr=3214943101"
159,81.708654,192.168.11.32,192.168.11.18,TCP,66,0.007033,,0.006896,"Jan  6, 2024 19:37:34.687768000 JST",,6000  >  40442 [ACK] Seq=1 Ack=28 Win=65152 Len=0 TSval=3214943109 TSecr=2989444163
160,81.709035,192.168.11.32,192.168.11.18,TCP,66,0.007277,,0.000381,"Jan  6, 2024 19:37:34.688149000 JST",,"6000  >  40442 [FIN, ACK] Seq=1 Ack=29 Win=65152 Len=0 TSval=3214943110 TSecr=2989444163"
161,81.709083,192.168.11.18,192.168.11.32,TCP,66,0.000048,,0.000048,"Jan  6, 2024 19:37:34.688197000 JST",,40442  >  6000 [ACK] Seq=29 Ack=2 Win=64256 Len=0 TSval=2989444171 TSecr=3214943110
162,81.739084,192.168.11.18,255.255.255.255,UDP,209,,Åü,0.030001,"Jan  6, 2024 19:37:34.718198000 JST",7b2273656d616e74696373223a207b22656e74697479223a2022504944222c202262617365656e74697479223a2022616e79222c2022726f6c65223a2022777777222c20227370617469616c223a2022616e79222c202274656d706f72616c223a2022616e79227d2c20226461746170726f7065727479223a207b22666f726d6174223a2022696e616f6b615f70726f6772616d5f73616d706c655f73656d616e746963227d7d,36551  >  7000 Len=167
163,81.748829,192.168.11.33,192.168.11.18,TCP,74,,Åú,0.009745,"Jan  6, 2024 19:37:34.727943000 JST",,60130  >  6000 [SYN] Seq=0 Win=64240 Len=0 MSS=1460 SACK_PERM TSval=3756377224 TSecr=0 WS=128
164,81.748981,192.168.11.18,192.168.11.33,TCP,74,0.000152,,0.000152,"Jan  6, 2024 19:37:34.728095000 JST",,"6000  >  60130 [SYN, ACK] Seq=0 Ack=1 Win=65160 Len=0 MSS=1460 SACK_PERM TSval=2450282768 TSecr=3756377224 WS=128"
165,81.755661,192.168.11.33,192.168.11.18,TCP,66,0.00668,,0.00668,"Jan  6, 2024 19:37:34.734775000 JST",,60130  >  6000 [ACK] Seq=1 Ack=1 Win=64256 Len=0 TSval=3756377235 TSecr=2450282768
166,81.756233,192.168.11.33,192.168.11.18,TCP,93,,,0.000572,"Jan  6, 2024 19:37:34.735347000 JST",,"60130  >  6000 [PSH, ACK] Seq=1 Ack=1 Win=64256 Len=27 TSval=3756377235 TSecr=2450282768 [TCP segment of a reassembled PDU]"
167,81.756315,192.168.11.18,192.168.11.33,TCP,66,0.000082,,0.000082,"Jan  6, 2024 19:37:34.735429000 JST",,6000  >  60130 [ACK] Seq=1 Ack=28 Win=65152 Len=0 TSval=2450282775 TSecr=3756377235
168,81.756387,192.168.11.33,192.168.11.18,TCP,66,,,0.000072,"Jan  6, 2024 19:37:34.735501000 JST",,"60130  >  6000 [FIN, ACK] Seq=28 Ack=1 Win=64256 Len=0 TSval=3756377235 TSecr=2450282768"
169,81.75748,192.168.11.18,192.168.11.33,TCP,66,0.001093,,0.001093,"Jan  6, 2024 19:37:34.736594000 JST",,"6000  >  60130 [FIN, ACK] Seq=1 Ack=29 Win=65152 Len=0 TSval=2450282776 TSecr=3756377235"
170,81.763597,192.168.11.33,192.168.11.18,TCP,66,0.006117,,0.006117,"Jan  6, 2024 19:37:34.742711000 JST",,60130  >  6000 [ACK] Seq=29 Ack=2 Win=64256 Len=0 TSval=3756377242 TSecr=2450282776
171,113.87612,192.168.11.18,192.168.11.32,TCP,74,,,32.112523,"Jan  6, 2024 19:38:06.855234000 JST",,51812  >  6000 [SYN] Seq=0 Win=64240 Len=0 MSS=1460 SACK_PERM TSval=2989476338 TSecr=0 WS=128
172,113.882951,192.168.11.32,192.168.11.18,TCP,74,0.006831,,0.006831,"Jan  6, 2024 19:38:06.862065000 JST",,"6000  >  51812 [SYN, ACK] Seq=0 Ack=1 Win=65160 Len=0 MSS=1460 SACK_PERM TSval=3214975284 TSecr=2989476338 WS=128"
173,113.883061,192.168.11.18,192.168.11.32,TCP,66,0.00011,,0.00011,"Jan  6, 2024 19:38:06.862175000 JST",,51812  >  6000 [ACK] Seq=1 Ack=1 Win=64256 Len=0 TSval=2989476345 TSecr=3214975284
174,113.883293,192.168.11.18,192.168.11.32,TCP,93,,,0.000232,"Jan  6, 2024 19:38:06.862407000 JST",,"51812  >  6000 [PSH, ACK] Seq=1 Ack=1 Win=64256 Len=27 TSval=2989476345 TSecr=3214975284 [TCP segment of a reassembled PDU]"
175,113.883398,192.168.11.18,192.168.11.32,TCP,66,,,0.000105,"Jan  6, 2024 19:38:06.862512000 JST",,"51812  >  6000 [FIN, ACK] Seq=28 Ack=1 Win=64256 Len=0 TSval=2989476345 TSecr=3214975284"
176,113.890761,192.168.11.32,192.168.11.18,TCP,66,0.007468,,0.007363,"Jan  6, 2024 19:38:06.869875000 JST",,6000  >  51812 [ACK] Seq=1 Ack=28 Win=65152 Len=0 TSval=3214975291 TSecr=2989476345
177,113.890985,192.168.11.32,192.168.11.18,TCP,66,0.007587,,0.000224,"Jan  6, 2024 19:38:06.870099000 JST",,"6000  >  51812 [FIN, ACK] Seq=1 Ack=29 Win=65152 Len=0 TSval=3214975293 TSecr=2989476345"
178,113.891041,192.168.11.18,192.168.11.32,TCP,66,0.000056,,0.000056,"Jan  6, 2024 19:38:06.870155000 JST",,51812  >  6000 [ACK] Seq=29 Ack=2 Win=64256 Len=0 TSval=2989476353 TSecr=3214975293
179,113.921872,192.168.11.18,255.255.255.255,UDP,209,,Åü,0.030831,"Jan  6, 2024 19:38:06.900986000 JST",7b2273656d616e74696373223a207b22656e74697479223a2022504944222c202262617365656e74697479223a2022616e79222c2022726f6c65223a2022777777222c20227370617469616c223a2022616e79222c202274656d706f72616c223a2022616e79227d2c20226461746170726f7065727479223a207b22666f726d6174223a2022696e616f6b615f70726f6772616d5f73616d706c655f73656d616e746963227d7d,50460  >  7000 Len=167
180,113.92773,192.168.11.33,192.168.11.18,TCP,74,,Åú,0.005858,"Jan  6, 2024 19:38:06.906844000 JST",,44892  >  6000 [SYN] Seq=0 Win=64240 Len=0 MSS=1460 SACK_PERM TSval=3756409406 TSecr=0 WS=128
181,113.927893,192.168.11.18,192.168.11.33,TCP,74,0.000163,,0.000163,"Jan  6, 2024 19:38:06.907007000 JST",,"6000  >  44892 [SYN, ACK] Seq=0 Ack=1 Win=65160 Len=0 MSS=1460 SACK_PERM TSval=2450314946 TSecr=3756409406 WS=128"
182,113.93451,192.168.11.33,192.168.11.18,TCP,66,0.006617,,0.006617,"Jan  6, 2024 19:38:06.913624000 JST",,44892  >  6000 [ACK] Seq=1 Ack=1 Win=64256 Len=0 TSval=3756409413 TSecr=2450314946
183,113.935181,192.168.11.33,192.168.11.18,TCP,93,,,0.000671,"Jan  6, 2024 19:38:06.914295000 JST",,"44892  >  6000 [PSH, ACK] Seq=1 Ack=1 Win=64256 Len=27 TSval=3756409414 TSecr=2450314946 [TCP segment of a reassembled PDU]"
184,113.935287,192.168.11.18,192.168.11.33,TCP,66,0.000106,,0.000106,"Jan  6, 2024 19:38:06.914401000 JST",,6000  >  44892 [ACK] Seq=1 Ack=28 Win=65152 Len=0 TSval=2450314954 TSecr=3756409414
