No.,Time,Source,Destination,Protocol,Length,The RTT to ACK the segment was,XXX,Time delta from previous captured frame,Arrival Time,Data,Info
1,0,192.168.11.22,192.168.11.33,TCP,74,,,0,"Jan  6, 2024 19:36:13.080235000 JST",,36670  >  6000 [SYN] Seq=0 Win=64240 Len=0 MSS=1460 SACK_PERM TSval=240562892 TSecr=0 WS=128
2,0.010545,192.168.11.33,192.168.11.22,TCP,74,0.010545,,0.010545,"Jan  6, 2024 19:36:13.090780000 JST",,"6000  >  36670 [SYN, ACK] Seq=0 Ack=1 Win=65160 Len=0 MSS=1460 SACK_PERM TSval=1145410668 TSecr=240562892 WS=128"
3,0.010661,192.168.11.22,192.168.11.33,TCP,66,0.000116,,0.000116,"Jan  6, 2024 19:36:13.090896000 JST",,36670  >  6000 [ACK] Seq=1 Ack=1 Win=64256 Len=0 TSval=240562906 TSecr=1145410668
4,0.01085,192.168.11.22,192.168.11.33,TCP,93,,,0.000189,"Jan  6, 2024 19:36:13.091085000 JST",,"36670  >  6000 [PSH, ACK] Seq=1 Ack=1 Win=64256 Len=27 TSval=240562906 TSecr=1145410668 [TCP segment of a reassembled PDU]"
5,0.011023,192.168.11.22,192.168.11.33,TCP,66,,,0.000173,"Jan  6, 2024 19:36:13.091258000 JST",,"36670  >  6000 [FIN, ACK] Seq=28 Ack=1 Win=64256 Len=0 TSval=240562907 TSecr=1145410668"
6,0.018239,192.168.11.33,192.168.11.22,TCP,66,0.007389,,0.007216,"Jan  6, 2024 19:36:13.098474000 JST",,6000  >  36670 [ACK] Seq=1 Ack=28 Win=65152 Len=0 TSval=1145410676 TSecr=240562906
7,0.018624,192.168.11.33,192.168.11.22,TCP,66,0.007601,,0.000385,"Jan  6, 2024 19:36:13.098859000 JST",,"6000  >  36670 [FIN, ACK] Seq=1 Ack=29 Win=65152 Len=0 TSval=1145410677 TSecr=240562907"
8,0.018674,192.168.11.22,192.168.11.33,TCP,66,0.00005,,0.00005,"Jan  6, 2024 19:36:13.098909000 JST",,36670  >  6000 [ACK] Seq=29 Ack=2 Win=64256 Len=0 TSval=240562914 TSecr=1145410677
9,0.048818,192.168.11.22,255.255.255.255,UDP,209,,Ÿ,0.030144,"Jan  6, 2024 19:36:13.129053000 JST",7b2273656d616e74696373223a207b22656e74697479223a2022504944222c202262617365656e74697479223a2022616e79222c2022726f6c65223a2022797979222c20227370617469616c223a2022616e79222c202274656d706f72616c223a2022616e79227d2c20226461746170726f7065727479223a207b22666f726d6174223a2022696e616f6b615f70726f6772616d5f73616d706c655f73656d616e746963227d7d,54099  >  7000 Len=167
10,0.057494,192.168.11.35,192.168.11.22,TCP,74,,œ,0.008676,"Jan  6, 2024 19:36:13.137729000 JST",,54488  >  6000 [SYN] Seq=0 Win=64240 Len=0 MSS=1460 SACK_PERM TSval=1664350789 TSecr=0 WS=128
11,0.057653,192.168.11.22,192.168.11.35,TCP,74,0.000159,,0.000159,"Jan  6, 2024 19:36:13.137888000 JST",,"6000  >  54488 [SYN, ACK] Seq=0 Ack=1 Win=65160 Len=0 MSS=1460 SACK_PERM TSval=2848109696 TSecr=1664350789 WS=128"
12,0.064537,192.168.11.35,192.168.11.22,TCP,66,0.006884,,0.006884,"Jan  6, 2024 19:36:13.144772000 JST",,54488  >  6000 [ACK] Seq=1 Ack=1 Win=64256 Len=0 TSval=1664350799 TSecr=2848109696
13,0.06514,192.168.11.35,192.168.11.22,TCP,93,,,0.000603,"Jan  6, 2024 19:36:13.145375000 JST",,"54488  >  6000 [PSH, ACK] Seq=1 Ack=1 Win=64256 Len=27 TSval=1664350799 TSecr=2848109696 [TCP segment of a reassembled PDU]"
14,0.065243,192.168.11.22,192.168.11.35,TCP,66,0.000103,,0.000103,"Jan  6, 2024 19:36:13.145478000 JST",,6000  >  54488 [ACK] Seq=1 Ack=28 Win=65152 Len=0 TSval=2848109704 TSecr=1664350799
15,0.06533,192.168.11.35,192.168.11.22,TCP,66,,,0.000087,"Jan  6, 2024 19:36:13.145565000 JST",,"54488  >  6000 [FIN, ACK] Seq=28 Ack=1 Win=64256 Len=0 TSval=1664350799 TSecr=2848109696"
16,0.068202,192.168.11.22,192.168.11.35,TCP,66,0.002872,,0.002872,"Jan  6, 2024 19:36:13.148437000 JST",,"6000  >  54488 [FIN, ACK] Seq=1 Ack=29 Win=65152 Len=0 TSval=2848109707 TSecr=1664350799"
17,0.079963,192.168.11.35,192.168.11.22,TCP,66,0.011761,,0.011761,"Jan  6, 2024 19:36:13.160198000 JST",,54488  >  6000 [ACK] Seq=29 Ack=2 Win=64256 Len=0 TSval=1664350810 TSecr=2848109707
18,9.295965,192.168.11.22,192.168.11.33,TCP,74,,,9.216002,"Jan  6, 2024 19:36:22.376200000 JST",,54264  >  6000 [SYN] Seq=0 Win=64240 Len=0 MSS=1460 SACK_PERM TSval=240572191 TSecr=0 WS=128
19,9.303755,192.168.11.33,192.168.11.22,TCP,74,0.00779,,0.00779,"Jan  6, 2024 19:36:22.383990000 JST",,"6000  >  54264 [SYN, ACK] Seq=0 Ack=1 Win=65160 Len=0 MSS=1460 SACK_PERM TSval=1145419961 TSecr=240572191 WS=128"
20,9.303864,192.168.11.22,192.168.11.33,TCP,66,0.000109,,0.000109,"Jan  6, 2024 19:36:22.384099000 JST",,54264  >  6000 [ACK] Seq=1 Ack=1 Win=64256 Len=0 TSval=240572199 TSecr=1145419961
21,9.30405,192.168.11.22,192.168.11.33,TCP,93,,,0.000186,"Jan  6, 2024 19:36:22.384285000 JST",,"54264  >  6000 [PSH, ACK] Seq=1 Ack=1 Win=64256 Len=27 TSval=240572200 TSecr=1145419961 [TCP segment of a reassembled PDU]"
22,9.304195,192.168.11.22,192.168.11.33,TCP,66,,,0.000145,"Jan  6, 2024 19:36:22.384430000 JST",,"54264  >  6000 [FIN, ACK] Seq=28 Ack=1 Win=64256 Len=0 TSval=240572200 TSecr=1145419961"
23,9.311399,192.168.11.33,192.168.11.22,TCP,66,0.007349,,0.007204,"Jan  6, 2024 19:36:22.391634000 JST",,6000  >  54264 [ACK] Seq=1 Ack=28 Win=65152 Len=0 TSval=1145419969 TSecr=240572200
24,9.311778,192.168.11.33,192.168.11.22,TCP,66,0.007583,,0.000379,"Jan  6, 2024 19:36:22.392013000 JST",,"6000  >  54264 [FIN, ACK] Seq=1 Ack=29 Win=65152 Len=0 TSval=1145419970 TSecr=240572200"
25,9.311828,192.168.11.22,192.168.11.33,TCP,66,0.00005,,0.00005,"Jan  6, 2024 19:36:22.392063000 JST",,54264  >  6000 [ACK] Seq=29 Ack=2 Win=64256 Len=0 TSval=240572207 TSecr=1145419970
26,9.344015,192.168.11.22,255.255.255.255,UDP,209,,Ÿ,0.032187,"Jan  6, 2024 19:36:22.424250000 JST",7b2273656d616e74696373223a207b22656e74697479223a2022504944222c202262617365656e74697479223a2022616e79222c2022726f6c65223a2022797979222c20227370617469616c223a2022616e79222c202274656d706f72616c223a2022616e79227d2c20226461746170726f7065727479223a207b22666f726d6174223a2022696e616f6b615f70726f6772616d5f73616d706c655f73656d616e746963227d7d,35698  >  7000 Len=167
27,9.349911,192.168.11.35,192.168.11.22,TCP,74,,œ,0.005896,"Jan  6, 2024 19:36:22.430146000 JST",,51656  >  6000 [SYN] Seq=0 Win=64240 Len=0 MSS=1460 SACK_PERM TSval=1664360084 TSecr=0 WS=128
28,9.350093,192.168.11.22,192.168.11.35,TCP,74,0.000182,,0.000182,"Jan  6, 2024 19:36:22.430328000 JST",,"6000  >  51656 [SYN, ACK] Seq=0 Ack=1 Win=65160 Len=0 MSS=1460 SACK_PERM TSval=2848118989 TSecr=1664360084 WS=128"
29,9.366879,192.168.11.35,192.168.11.22,TCP,66,0.016786,,0.016786,"Jan  6, 2024 19:36:22.447114000 JST",,51656  >  6000 [ACK] Seq=1 Ack=1 Win=64256 Len=0 TSval=1664360092 TSecr=2848118989
30,9.367438,192.168.11.35,192.168.11.22,TCP,93,,,0.000559,"Jan  6, 2024 19:36:22.447673000 JST",,"51656  >  6000 [PSH, ACK] Seq=1 Ack=1 Win=64256 Len=27 TSval=1664360092 TSecr=2848118989 [TCP segment of a reassembled PDU]"
31,9.367521,192.168.11.22,192.168.11.35,TCP,66,0.000083,,0.000083,"Jan  6, 2024 19:36:22.447756000 JST",,6000  >  51656 [ACK] Seq=1 Ack=28 Win=65152 Len=0 TSval=2848119006 TSecr=1664360092
32,9.367594,192.168.11.35,192.168.11.22,TCP,66,,,0.000073,"Jan  6, 2024 19:36:22.447829000 JST",,"51656  >  6000 [FIN, ACK] Seq=28 Ack=1 Win=64256 Len=0 TSval=1664360092 TSecr=2848118989"
33,9.369488,192.168.11.22,192.168.11.35,TCP,66,0.001894,,0.001894,"Jan  6, 2024 19:36:22.449723000 JST",,"6000  >  51656 [FIN, ACK] Seq=1 Ack=29 Win=65152 Len=0 TSval=2848119008 TSecr=1664360092"
34,9.37381,192.168.11.35,192.168.11.22,TCP,66,0.004322,,0.004322,"Jan  6, 2024 19:36:22.454045000 JST",,51656  >  6000 [ACK] Seq=29 Ack=2 Win=64256 Len=0 TSval=1664360109 TSecr=2848119008
35,19.160413,192.168.11.22,192.168.11.33,TCP,74,,,9.786603,"Jan  6, 2024 19:36:32.240648000 JST",,51490  >  6000 [SYN] Seq=0 Win=64240 Len=0 MSS=1460 SACK_PERM TSval=240582056 TSecr=0 WS=128
36,19.167393,192.168.11.33,192.168.11.22,TCP,74,0.00698,,0.00698,"Jan  6, 2024 19:36:32.247628000 JST",,"6000  >  51490 [SYN, ACK] Seq=0 Ack=1 Win=65160 Len=0 MSS=1460 SACK_PERM TSval=1145429825 TSecr=240582056 WS=128"
37,19.167507,192.168.11.22,192.168.11.33,TCP,66,0.000114,,0.000114,"Jan  6, 2024 19:36:32.247742000 JST",,51490  >  6000 [ACK] Seq=1 Ack=1 Win=64256 Len=0 TSval=240582063 TSecr=1145429825
38,19.167713,192.168.11.22,192.168.11.33,TCP,93,,,0.000206,"Jan  6, 2024 19:36:32.247948000 JST",,"51490  >  6000 [PSH, ACK] Seq=1 Ack=1 Win=64256 Len=27 TSval=240582063 TSecr=1145429825 [TCP segment of a reassembled PDU]"
39,19.167819,192.168.11.22,192.168.11.33,TCP,66,,,0.000106,"Jan  6, 2024 19:36:32.248054000 JST",,"51490  >  6000 [FIN, ACK] Seq=28 Ack=1 Win=64256 Len=0 TSval=240582063 TSecr=1145429825"
40,19.175183,192.168.11.33,192.168.11.22,TCP,66,0.00747,,0.007364,"Jan  6, 2024 19:36:32.255418000 JST",,6000  >  51490 [ACK] Seq=1 Ack=28 Win=65152 Len=0 TSval=1145429833 TSecr=240582063
41,19.175562,192.168.11.33,192.168.11.22,TCP,66,0.007743,,0.000379,"Jan  6, 2024 19:36:32.255797000 JST",,"6000  >  51490 [FIN, ACK] Seq=1 Ack=29 Win=65152 Len=0 TSval=1145429834 TSecr=240582063"
42,19.17561,192.168.11.22,192.168.11.33,TCP,66,0.000048,,0.000048,"Jan  6, 2024 19:36:32.255845000 JST",,51490  >  6000 [ACK] Seq=29 Ack=2 Win=64256 Len=0 TSval=240582071 TSecr=1145429834
43,19.208795,192.168.11.22,255.255.255.255,UDP,209,,Ÿ,0.033185,"Jan  6, 2024 19:36:32.289030000 JST",7b2273656d616e74696373223a207b22656e74697479223a2022504944222c202262617365656e74697479223a2022616e79222c2022726f6c65223a2022797979222c20227370617469616c223a2022616e79222c202274656d706f72616c223a2022616e79227d2c20226461746170726f7065727479223a207b22666f726d6174223a2022696e616f6b615f70726f6772616d5f73616d706c655f73656d616e746963227d7d,49015  >  7000 Len=167
44,19.21441,192.168.11.35,192.168.11.22,TCP,74,,œ,0.005615,"Jan  6, 2024 19:36:32.294645000 JST",,44172  >  6000 [SYN] Seq=0 Win=64240 Len=0 MSS=1460 SACK_PERM TSval=1664369949 TSecr=0 WS=128
45,19.214528,192.168.11.22,192.168.11.35,TCP,74,0.000118,,0.000118,"Jan  6, 2024 19:36:32.294763000 JST",,"6000  >  44172 [SYN, ACK] Seq=0 Ack=1 Win=65160 Len=0 MSS=1460 SACK_PERM TSval=2848128853 TSecr=1664369949 WS=128"
46,19.22137,192.168.11.35,192.168.11.22,TCP,66,0.006842,,0.006842,"Jan  6, 2024 19:36:32.301605000 JST",,44172  >  6000 [ACK] Seq=1 Ack=1 Win=64256 Len=0 TSval=1664369956 TSecr=2848128853
47,19.221872,192.168.11.35,192.168.11.22,TCP,93,,,0.000502,"Jan  6, 2024 19:36:32.302107000 JST",,"44172  >  6000 [PSH, ACK] Seq=1 Ack=1 Win=64256 Len=27 TSval=1664369956 TSecr=2848128853 [TCP segment of a reassembled PDU]"
48,19.222011,192.168.11.22,192.168.11.35,TCP,66,0.000139,,0.000139,"Jan  6, 2024 19:36:32.302246000 JST",,6000  >  44172 [ACK] Seq=1 Ack=28 Win=65152 Len=0 TSval=2848128860 TSecr=1664369956
49,19.222162,192.168.11.35,192.168.11.22,TCP,66,,,0.000151,"Jan  6, 2024 19:36:32.302397000 JST",,"44172  >  6000 [FIN, ACK] Seq=28 Ack=1 Win=64256 Len=0 TSval=1664369957 TSecr=2848128853"
50,19.223213,192.168.11.22,192.168.11.35,TCP,66,0.001051,,0.001051,"Jan  6, 2024 19:36:32.303448000 JST",,"6000  >  44172 [FIN, ACK] Seq=1 Ack=29 Win=65152 Len=0 TSval=2848128862 TSecr=1664369957"
51,19.229392,192.168.11.35,192.168.11.22,TCP,66,0.006179,,0.006179,"Jan  6, 2024 19:36:32.309627000 JST",,44172  >  6000 [ACK] Seq=29 Ack=2 Win=64256 Len=0 TSval=1664369964 TSecr=2848128862
52,29.080007,192.168.11.22,192.168.11.33,TCP,74,,,9.850615,"Jan  6, 2024 19:36:42.160242000 JST",,59744  >  6000 [SYN] Seq=0 Win=64240 Len=0 MSS=1460 SACK_PERM TSval=240591976 TSecr=0 WS=128
53,29.087925,192.168.11.33,192.168.11.22,TCP,74,0.007918,,0.007918,"Jan  6, 2024 19:36:42.168160000 JST",,"6000  >  59744 [SYN, ACK] Seq=0 Ack=1 Win=65160 Len=0 MSS=1460 SACK_PERM TSval=1145439745 TSecr=240591976 WS=128"
54,29.088036,192.168.11.22,192.168.11.33,TCP,66,0.000111,,0.000111,"Jan  6, 2024 19:36:42.168271000 JST",,59744  >  6000 [ACK] Seq=1 Ack=1 Win=64256 Len=0 TSval=240591984 TSecr=1145439745
55,29.08822,192.168.11.22,192.168.11.33,TCP,93,,,0.000184,"Jan  6, 2024 19:36:42.168455000 JST",,"59744  >  6000 [PSH, ACK] Seq=1 Ack=1 Win=64256 Len=27 TSval=240591984 TSecr=1145439745 [TCP segment of a reassembled PDU]"
56,29.088344,192.168.11.22,192.168.11.33,TCP,66,,,0.000124,"Jan  6, 2024 19:36:42.168579000 JST",,"59744  >  6000 [FIN, ACK] Seq=28 Ack=1 Win=64256 Len=0 TSval=240591984 TSecr=1145439745"
57,29.104912,192.168.11.33,192.168.11.22,TCP,66,0.016692,,0.016568,"Jan  6, 2024 19:36:42.185147000 JST",,6000  >  59744 [ACK] Seq=1 Ack=28 Win=65152 Len=0 TSval=1145439761 TSecr=240591984
58,29.107573,192.168.11.33,192.168.11.22,TCP,66,0.019229,,0.002661,"Jan  6, 2024 19:36:42.187808000 JST",,"6000  >  59744 [FIN, ACK] Seq=1 Ack=29 Win=65152 Len=0 TSval=1145439764 TSecr=240591984"
59,29.107626,192.168.11.22,192.168.11.33,TCP,66,0.000053,,0.000053,"Jan  6, 2024 19:36:42.187861000 JST",,59744  >  6000 [ACK] Seq=29 Ack=2 Win=64256 Len=0 TSval=240592003 TSecr=1145439764
60,29.135825,192.168.11.22,255.255.255.255,UDP,209,,Ÿ,0.028199,"Jan  6, 2024 19:36:42.216060000 JST",7b2273656d616e74696373223a207b22656e74697479223a2022504944222c202262617365656e74697479223a2022616e79222c2022726f6c65223a2022797979222c20227370617469616c223a2022616e79222c202274656d706f72616c223a2022616e79227d2c20226461746170726f7065727479223a207b22666f726d6174223a2022696e616f6b615f70726f6772616d5f73616d706c655f73656d616e746963227d7d,45794  >  7000 Len=167
61,29.141393,192.168.11.35,192.168.11.22,TCP,74,,œ,0.005568,"Jan  6, 2024 19:36:42.221628000 JST",,49958  >  6000 [SYN] Seq=0 Win=64240 Len=0 MSS=1460 SACK_PERM TSval=1664379876 TSecr=0 WS=128
62,29.141528,192.168.11.22,192.168.11.35,TCP,74,0.000135,,0.000135,"Jan  6, 2024 19:36:42.221763000 JST",,"6000  >  49958 [SYN, ACK] Seq=0 Ack=1 Win=65160 Len=0 MSS=1460 SACK_PERM TSval=2848138780 TSecr=1664379876 WS=128"
63,29.148105,192.168.11.35,192.168.11.22,TCP,66,0.006577,,0.006577,"Jan  6, 2024 19:36:42.228340000 JST",,49958  >  6000 [ACK] Seq=1 Ack=1 Win=64256 Len=0 TSval=1664379883 TSecr=2848138780
64,29.148609,192.168.11.35,192.168.11.22,TCP,93,,,0.000504,"Jan  6, 2024 19:36:42.228844000 JST",,"49958  >  6000 [PSH, ACK] Seq=1 Ack=1 Win=64256 Len=27 TSval=1664379883 TSecr=2848138780 [TCP segment of a reassembled PDU]"
65,29.148679,192.168.11.22,192.168.11.35,TCP,66,0.00007,,0.00007,"Jan  6, 2024 19:36:42.228914000 JST",,6000  >  49958 [ACK] Seq=1 Ack=28 Win=65152 Len=0 TSval=2848138787 TSecr=1664379883
66,29.148746,192.168.11.35,192.168.11.22,TCP,66,,,0.000067,"Jan  6, 2024 19:36:42.228981000 JST",,"49958  >  6000 [FIN, ACK] Seq=28 Ack=1 Win=64256 Len=0 TSval=1664379883 TSecr=2848138780"
67,29.149815,192.168.11.22,192.168.11.35,TCP,66,0.001069,,0.001069,"Jan  6, 2024 19:36:42.230050000 JST",,"6000  >  49958 [FIN, ACK] Seq=1 Ack=29 Win=65152 Len=0 TSval=2848138788 TSecr=1664379883"
68,29.156002,192.168.11.35,192.168.11.22,TCP,66,0.006187,,0.006187,"Jan  6, 2024 19:36:42.236237000 JST",,49958  >  6000 [ACK] Seq=29 Ack=2 Win=64256 Len=0 TSval=1664379890 TSecr=2848138788
69,36.895843,192.168.11.22,192.168.11.33,TCP,74,,,7.739841,"Jan  6, 2024 19:36:49.976078000 JST",,43354  >  6000 [SYN] Seq=0 Win=64240 Len=0 MSS=1460 SACK_PERM TSval=240599791 TSecr=0 WS=128
70,36.904646,192.168.11.33,192.168.11.22,TCP,74,0.008803,,0.008803,"Jan  6, 2024 19:36:49.984881000 JST",,"6000  >  43354 [SYN, ACK] Seq=0 Ack=1 Win=65160 Len=0 MSS=1460 SACK_PERM TSval=1145447561 TSecr=240599791 WS=128"
71,36.904774,192.168.11.22,192.168.11.33,TCP,66,0.000128,,0.000128,"Jan  6, 2024 19:36:49.985009000 JST",,43354  >  6000 [ACK] Seq=1 Ack=1 Win=64256 Len=0 TSval=240599800 TSecr=1145447561
72,36.904966,192.168.11.22,192.168.11.33,TCP,93,,,0.000192,"Jan  6, 2024 19:36:49.985201000 JST",,"43354  >  6000 [PSH, ACK] Seq=1 Ack=1 Win=64256 Len=27 TSval=240599801 TSecr=1145447561 [TCP segment of a reassembled PDU]"
73,36.905077,192.168.11.22,192.168.11.33,TCP,66,,,0.000111,"Jan  6, 2024 19:36:49.985312000 JST",,"43354  >  6000 [FIN, ACK] Seq=28 Ack=1 Win=64256 Len=0 TSval=240599801 TSecr=1145447561"
74,36.912696,192.168.11.33,192.168.11.22,TCP,66,0.00773,,0.007619,"Jan  6, 2024 19:36:49.992931000 JST",,6000  >  43354 [ACK] Seq=1 Ack=28 Win=65152 Len=0 TSval=1145447570 TSecr=240599801
75,36.912924,192.168.11.33,192.168.11.22,TCP,66,0.007847,,0.000228,"Jan  6, 2024 19:36:49.993159000 JST",,"6000  >  43354 [FIN, ACK] Seq=1 Ack=29 Win=65152 Len=0 TSval=1145447571 TSecr=240599801"
76,36.912968,192.168.11.22,192.168.11.33,TCP,66,0.000044,,0.000044,"Jan  6, 2024 19:36:49.993203000 JST",,43354  >  6000 [ACK] Seq=29 Ack=2 Win=64256 Len=0 TSval=240599809 TSecr=1145447571
77,36.944636,192.168.11.22,255.255.255.255,UDP,209,,Ÿ,0.031668,"Jan  6, 2024 19:36:50.024871000 JST",7b2273656d616e74696373223a207b22656e74697479223a2022504944222c202262617365656e74697479223a2022616e79222c2022726f6c65223a2022797979222c20227370617469616c223a2022616e79222c202274656d706f72616c223a2022616e79227d2c20226461746170726f7065727479223a207b22666f726d6174223a2022696e616f6b615f70726f6772616d5f73616d706c655f73656d616e746963227d7d,51585  >  7000 Len=167
78,36.950377,192.168.11.35,192.168.11.22,TCP,74,,œ,0.005741,"Jan  6, 2024 19:36:50.030612000 JST",,58848  >  6000 [SYN] Seq=0 Win=64240 Len=0 MSS=1460 SACK_PERM TSval=1664387685 TSecr=0 WS=128
79,36.950551,192.168.11.22,192.168.11.35,TCP,74,0.000174,,0.000174,"Jan  6, 2024 19:36:50.030786000 JST",,"6000  >  58848 [SYN, ACK] Seq=0 Ack=1 Win=65160 Len=0 MSS=1460 SACK_PERM TSval=2848146589 TSecr=1664387685 WS=128"
80,36.957185,192.168.11.35,192.168.11.22,TCP,66,0.006634,,0.006634,"Jan  6, 2024 19:36:50.037420000 JST",,58848  >  6000 [ACK] Seq=1 Ack=1 Win=64256 Len=0 TSval=1664387692 TSecr=2848146589
81,36.957736,192.168.11.35,192.168.11.22,TCP,93,,,0.000551,"Jan  6, 2024 19:36:50.037971000 JST",,"58848  >  6000 [PSH, ACK] Seq=1 Ack=1 Win=64256 Len=27 TSval=1664387692 TSecr=2848146589 [TCP segment of a reassembled PDU]"
82,36.957809,192.168.11.22,192.168.11.35,TCP,66,0.000073,,0.000073,"Jan  6, 2024 19:36:50.038044000 JST",,6000  >  58848 [ACK] Seq=1 Ack=28 Win=65152 Len=0 TSval=2848146596 TSecr=1664387692
83,36.957876,192.168.11.35,192.168.11.22,TCP,66,,,0.000067,"Jan  6, 2024 19:36:50.038111000 JST",,"58848  >  6000 [FIN, ACK] Seq=28 Ack=1 Win=64256 Len=0 TSval=1664387692 TSecr=2848146589"
84,36.959183,192.168.11.22,192.168.11.35,TCP,66,0.001307,,0.001307,"Jan  6, 2024 19:36:50.039418000 JST",,"6000  >  58848 [FIN, ACK] Seq=1 Ack=29 Win=65152 Len=0 TSval=2848146598 TSecr=1664387692"
85,36.965173,192.168.11.35,192.168.11.22,TCP,66,0.00599,,0.00599,"Jan  6, 2024 19:36:50.045408000 JST",,58848  >  6000 [ACK] Seq=29 Ack=2 Win=64256 Len=0 TSval=1664387700 TSecr=2848146598
86,44.705751,192.168.11.22,192.168.11.33,TCP,74,,,7.740578,"Jan  6, 2024 19:36:57.785986000 JST",,48214  >  6000 [SYN] Seq=0 Win=64240 Len=0 MSS=1460 SACK_PERM TSval=240607601 TSecr=0 WS=128
87,44.721375,192.168.11.33,192.168.11.22,TCP,74,0.015624,,0.015624,"Jan  6, 2024 19:36:57.801610000 JST",,"6000  >  48214 [SYN, ACK] Seq=0 Ack=1 Win=65160 Len=0 MSS=1460 SACK_PERM TSval=1145455378 TSecr=240607601 WS=128"
88,44.721493,192.168.11.22,192.168.11.33,TCP,66,0.000118,,0.000118,"Jan  6, 2024 19:36:57.801728000 JST",,48214  >  6000 [ACK] Seq=1 Ack=1 Win=64256 Len=0 TSval=240607617 TSecr=1145455378
89,44.72164,192.168.11.22,192.168.11.33,TCP,93,,,0.000147,"Jan  6, 2024 19:36:57.801875000 JST",,"48214  >  6000 [PSH, ACK] Seq=1 Ack=1 Win=64256 Len=27 TSval=240607617 TSecr=1145455378 [TCP segment of a reassembled PDU]"
90,44.721753,192.168.11.22,192.168.11.33,TCP,66,,,0.000113,"Jan  6, 2024 19:36:57.801988000 JST",,"48214  >  6000 [FIN, ACK] Seq=28 Ack=1 Win=64256 Len=0 TSval=240607617 TSecr=1145455378"
91,44.728879,192.168.11.33,192.168.11.22,TCP,66,0.007239,,0.007126,"Jan  6, 2024 19:36:57.809114000 JST",,6000  >  48214 [ACK] Seq=1 Ack=28 Win=65152 Len=0 TSval=1145455387 TSecr=240607617
92,44.731704,192.168.11.33,192.168.11.22,TCP,66,0.009951,,0.002825,"Jan  6, 2024 19:36:57.811939000 JST",,"6000  >  48214 [FIN, ACK] Seq=1 Ack=29 Win=65152 Len=0 TSval=1145455389 TSecr=240607617"
93,44.73176,192.168.11.22,192.168.11.33,TCP,66,0.000056,,0.000056,"Jan  6, 2024 19:36:57.811995000 JST",,48214  >  6000 [ACK] Seq=29 Ack=2 Win=64256 Len=0 TSval=240607627 TSecr=1145455389
94,44.760312,192.168.11.22,255.255.255.255,UDP,209,,Ÿ,0.028552,"Jan  6, 2024 19:36:57.840547000 JST",7b2273656d616e74696373223a207b22656e74697479223a2022504944222c202262617365656e74697479223a2022616e79222c2022726f6c65223a2022797979222c20227370617469616c223a2022616e79222c202274656d706f72616c223a2022616e79227d2c20226461746170726f7065727479223a207b22666f726d6174223a2022696e616f6b615f70726f6772616d5f73616d706c655f73656d616e746963227d7d,60939  >  7000 Len=167
95,44.765776,192.168.11.35,192.168.11.22,TCP,74,,œ,0.005464,"Jan  6, 2024 19:36:57.846011000 JST",,44914  >  6000 [SYN] Seq=0 Win=64240 Len=0 MSS=1460 SACK_PERM TSval=1664395501 TSecr=0 WS=128
96,44.765895,192.168.11.22,192.168.11.35,TCP,74,0.000119,,0.000119,"Jan  6, 2024 19:36:57.846130000 JST",,"6000  >  44914 [SYN, ACK] Seq=0 Ack=1 Win=65160 Len=0 MSS=1460 SACK_PERM TSval=2848154404 TSecr=1664395501 WS=128"
97,44.772607,192.168.11.35,192.168.11.22,TCP,66,0.006712,,0.006712,"Jan  6, 2024 19:36:57.852842000 JST",,44914  >  6000 [ACK] Seq=1 Ack=1 Win=64256 Len=0 TSval=1664395507 TSecr=2848154404
98,44.773115,192.168.11.35,192.168.11.22,TCP,93,,,0.000508,"Jan  6, 2024 19:36:57.853350000 JST",,"44914  >  6000 [PSH, ACK] Seq=1 Ack=1 Win=64256 Len=27 TSval=1664395508 TSecr=2848154404 [TCP segment of a reassembled PDU]"
99,44.773187,192.168.11.22,192.168.11.35,TCP,66,0.000072,,0.000072,"Jan  6, 2024 19:36:57.853422000 JST",,6000  >  44914 [ACK] Seq=1 Ack=28 Win=65152 Len=0 TSval=2848154412 TSecr=1664395508
100,44.773248,192.168.11.35,192.168.11.22,TCP,66,,,0.000061,"Jan  6, 2024 19:36:57.853483000 JST",,"44914  >  6000 [FIN, ACK] Seq=28 Ack=1 Win=64256 Len=0 TSval=1664395508 TSecr=2848154404"
101,44.774418,192.168.11.22,192.168.11.35,TCP,66,0.00117,,0.00117,"Jan  6, 2024 19:36:57.854653000 JST",,"6000  >  44914 [FIN, ACK] Seq=1 Ack=29 Win=65152 Len=0 TSval=2848154413 TSecr=1664395508"
102,44.780457,192.168.11.35,192.168.11.22,TCP,66,0.006039,,0.006039,"Jan  6, 2024 19:36:57.860692000 JST",,44914  >  6000 [ACK] Seq=29 Ack=2 Win=64256 Len=0 TSval=1664395515 TSecr=2848154413
103,52.562353,192.168.11.22,192.168.11.33,TCP,74,,,7.781896,"Jan  6, 2024 19:37:05.642588000 JST",,38742  >  6000 [SYN] Seq=0 Win=64240 Len=0 MSS=1460 SACK_PERM TSval=240615458 TSecr=0 WS=128
104,52.57308,192.168.11.33,192.168.11.22,TCP,74,0.010727,,0.010727,"Jan  6, 2024 19:37:05.653315000 JST",,"6000  >  38742 [SYN, ACK] Seq=0 Ack=1 Win=65160 Len=0 MSS=1460 SACK_PERM TSval=1145463227 TSecr=240615458 WS=128"
105,52.573196,192.168.11.22,192.168.11.33,TCP,66,0.000116,,0.000116,"Jan  6, 2024 19:37:05.653431000 JST",,38742  >  6000 [ACK] Seq=1 Ack=1 Win=64256 Len=0 TSval=240615469 TSecr=1145463227
106,52.573346,192.168.11.22,192.168.11.33,TCP,93,,,0.00015,"Jan  6, 2024 19:37:05.653581000 JST",,"38742  >  6000 [PSH, ACK] Seq=1 Ack=1 Win=64256 Len=27 TSval=240615469 TSecr=1145463227 [TCP segment of a reassembled PDU]"
107,52.573441,192.168.11.22,192.168.11.33,TCP,66,,,0.000095,"Jan  6, 2024 19:37:05.653676000 JST",,"38742  >  6000 [FIN, ACK] Seq=28 Ack=1 Win=64256 Len=0 TSval=240615469 TSecr=1145463227"
108,52.582369,192.168.11.33,192.168.11.22,TCP,66,0.009023,,0.008928,"Jan  6, 2024 19:37:05.662604000 JST",,6000  >  38742 [ACK] Seq=1 Ack=28 Win=65152 Len=0 TSval=1145463239 TSecr=240615469
109,52.582613,192.168.11.33,192.168.11.22,TCP,66,0.009172,,0.000244,"Jan  6, 2024 19:37:05.662848000 JST",,"6000  >  38742 [FIN, ACK] Seq=1 Ack=29 Win=65152 Len=0 TSval=1145463241 TSecr=240615469"
110,52.582658,192.168.11.22,192.168.11.33,TCP,66,0.000045,,0.000045,"Jan  6, 2024 19:37:05.662893000 JST",,38742  >  6000 [ACK] Seq=29 Ack=2 Win=64256 Len=0 TSval=240615478 TSecr=1145463241
111,52.613349,192.168.11.22,255.255.255.255,UDP,209,,Ÿ,0.030691,"Jan  6, 2024 19:37:05.693584000 JST",7b2273656d616e74696373223a207b22656e74697479223a2022504944222c202262617365656e74697479223a2022616e79222c2022726f6c65223a2022797979222c20227370617469616c223a2022616e79222c202274656d706f72616c223a2022616e79227d2c20226461746170726f7065727479223a207b22666f726d6174223a2022696e616f6b615f70726f6772616d5f73616d706c655f73656d616e746963227d7d,37449  >  7000 Len=167
112,52.620048,192.168.11.35,192.168.11.22,TCP,74,,œ,0.006699,"Jan  6, 2024 19:37:05.700283000 JST",,44928  >  6000 [SYN] Seq=0 Win=64240 Len=0 MSS=1460 SACK_PERM TSval=1664403354 TSecr=0 WS=128
113,52.620205,192.168.11.22,192.168.11.35,TCP,74,0.000157,,0.000157,"Jan  6, 2024 19:37:05.700440000 JST",,"6000  >  44928 [SYN, ACK] Seq=0 Ack=1 Win=65160 Len=0 MSS=1460 SACK_PERM TSval=2848162259 TSecr=1664403354 WS=128"
114,52.634834,192.168.11.35,192.168.11.22,TCP,66,0.014629,,0.014629,"Jan  6, 2024 19:37:05.715069000 JST",,44928  >  6000 [ACK] Seq=1 Ack=1 Win=64256 Len=0 TSval=1664403362 TSecr=2848162259
115,52.635441,192.168.11.35,192.168.11.22,TCP,93,,,0.000607,"Jan  6, 2024 19:37:05.715676000 JST",,"44928  >  6000 [PSH, ACK] Seq=1 Ack=1 Win=64256 Len=27 TSval=1664403362 TSecr=2848162259 [TCP segment of a reassembled PDU]"
116,52.635524,192.168.11.22,192.168.11.35,TCP,66,0.000083,,0.000083,"Jan  6, 2024 19:37:05.715759000 JST",,6000  >  44928 [ACK] Seq=1 Ack=28 Win=65152 Len=0 TSval=2848162274 TSecr=1664403362
117,52.635592,192.168.11.35,192.168.11.22,TCP,66,,,0.000068,"Jan  6, 2024 19:37:05.715827000 JST",,"44928  >  6000 [FIN, ACK] Seq=28 Ack=1 Win=64256 Len=0 TSval=1664403362 TSecr=2848162259"
118,52.636891,192.168.11.22,192.168.11.35,TCP,66,0.001299,,0.001299,"Jan  6, 2024 19:37:05.717126000 JST",,"6000  >  44928 [FIN, ACK] Seq=1 Ack=29 Win=65152 Len=0 TSval=2848162275 TSecr=1664403362"
119,52.643129,192.168.11.35,192.168.11.22,TCP,66,0.006238,,0.006238,"Jan  6, 2024 19:37:05.723364000 JST",,44928  >  6000 [ACK] Seq=29 Ack=2 Win=64256 Len=0 TSval=1664403378 TSecr=2848162275
120,60.862057,192.168.11.22,192.168.11.33,TCP,74,,,8.218928,"Jan  6, 2024 19:37:13.942292000 JST",,52806  >  6000 [SYN] Seq=0 Win=64240 Len=0 MSS=1460 SACK_PERM TSval=240623757 TSecr=0 WS=128
121,60.868812,192.168.11.33,192.168.11.22,TCP,74,0.006755,,0.006755,"Jan  6, 2024 19:37:13.949047000 JST",,"6000  >  52806 [SYN, ACK] Seq=0 Ack=1 Win=65160 Len=0 MSS=1460 SACK_PERM TSval=1145471527 TSecr=240623757 WS=128"
122,60.868943,192.168.11.22,192.168.11.33,TCP,66,0.000131,,0.000131,"Jan  6, 2024 19:37:13.949178000 JST",,52806  >  6000 [ACK] Seq=1 Ack=1 Win=64256 Len=0 TSval=240623764 TSecr=1145471527
123,60.869118,192.168.11.22,192.168.11.33,TCP,93,,,0.000175,"Jan  6, 2024 19:37:13.949353000 JST",,"52806  >  6000 [PSH, ACK] Seq=1 Ack=1 Win=64256 Len=27 TSval=240623765 TSecr=1145471527 [TCP segment of a reassembled PDU]"
124,60.869214,192.168.11.22,192.168.11.33,TCP,66,,,0.000096,"Jan  6, 2024 19:37:13.949449000 JST",,"52806  >  6000 [FIN, ACK] Seq=28 Ack=1 Win=64256 Len=0 TSval=240623765 TSecr=1145471527"
125,60.876295,192.168.11.33,192.168.11.22,TCP,66,0.007177,,0.007081,"Jan  6, 2024 19:37:13.956530000 JST",,6000  >  52806 [ACK] Seq=1 Ack=28 Win=65152 Len=0 TSval=1145471534 TSecr=240623765
126,60.876511,192.168.11.33,192.168.11.22,TCP,66,0.007297,,0.000216,"Jan  6, 2024 19:37:13.956746000 JST",,"6000  >  52806 [FIN, ACK] Seq=1 Ack=29 Win=65152 Len=0 TSval=1145471535 TSecr=240623765"
127,60.876565,192.168.11.22,192.168.11.33,TCP,66,0.000054,,0.000054,"Jan  6, 2024 19:37:13.956800000 JST",,52806  >  6000 [ACK] Seq=29 Ack=2 Win=64256 Len=0 TSval=240623772 TSecr=1145471535
128,60.908848,192.168.11.22,255.255.255.255,UDP,209,,Ÿ,0.032283,"Jan  6, 2024 19:37:13.989083000 JST",7b2273656d616e74696373223a207b22656e74697479223a2022504944222c202262617365656e74697479223a2022616e79222c2022726f6c65223a2022797979222c20227370617469616c223a2022616e79222c202274656d706f72616c223a2022616e79227d2c20226461746170726f7065727479223a207b22666f726d6174223a2022696e616f6b615f70726f6772616d5f73616d706c655f73656d616e746963227d7d,46622  >  7000 Len=167
129,60.915507,192.168.11.35,192.168.11.22,TCP,74,,œ,0.006659,"Jan  6, 2024 19:37:13.995742000 JST",,53044  >  6000 [SYN] Seq=0 Win=64240 Len=0 MSS=1460 SACK_PERM TSval=1664411649 TSecr=0 WS=128
130,60.915665,192.168.11.22,192.168.11.35,TCP,74,0.000158,,0.000158,"Jan  6, 2024 19:37:13.995900000 JST",,"6000  >  53044 [SYN, ACK] Seq=0 Ack=1 Win=65160 Len=0 MSS=1460 SACK_PERM TSval=2848170554 TSecr=1664411649 WS=128"
131,60.922673,192.168.11.35,192.168.11.22,TCP,66,0.007008,,0.007008,"Jan  6, 2024 19:37:14.002908000 JST",,53044  >  6000 [ACK] Seq=1 Ack=1 Win=64256 Len=0 TSval=1664411657 TSecr=2848170554
132,60.92342,192.168.11.35,192.168.11.22,TCP,93,,,0.000747,"Jan  6, 2024 19:37:14.003655000 JST",,"53044  >  6000 [PSH, ACK] Seq=1 Ack=1 Win=64256 Len=27 TSval=1664411657 TSecr=2848170554 [TCP segment of a reassembled PDU]"
133,60.923534,192.168.11.22,192.168.11.35,TCP,66,0.000114,,0.000114,"Jan  6, 2024 19:37:14.003769000 JST",,6000  >  53044 [ACK] Seq=1 Ack=28 Win=65152 Len=0 TSval=2848170562 TSecr=1664411657
134,60.923613,192.168.11.35,192.168.11.22,TCP,66,,,0.000079,"Jan  6, 2024 19:37:14.003848000 JST",,"53044  >  6000 [FIN, ACK] Seq=28 Ack=1 Win=64256 Len=0 TSval=1664411657 TSecr=2848170554"
135,60.925399,192.168.11.22,192.168.11.35,TCP,66,0.001786,,0.001786,"Jan  6, 2024 19:37:14.005634000 JST",,"6000  >  53044 [FIN, ACK] Seq=1 Ack=29 Win=65152 Len=0 TSval=2848170564 TSecr=1664411657"
136,60.930094,192.168.11.35,192.168.11.22,TCP,66,0.004695,,0.004695,"Jan  6, 2024 19:37:14.010329000 JST",,53044  >  6000 [ACK] Seq=29 Ack=2 Win=64256 Len=0 TSval=1664411665 TSecr=2848170564
137,71.787726,192.168.11.22,192.168.11.33,TCP,74,,,10.857632,"Jan  6, 2024 19:37:24.867961000 JST",,39440  >  6000 [SYN] Seq=0 Win=64240 Len=0 MSS=1460 SACK_PERM TSval=240634683 TSecr=0 WS=128
138,71.794765,192.168.11.33,192.168.11.22,TCP,74,0.007039,,0.007039,"Jan  6, 2024 19:37:24.875000000 JST",,"6000  >  39440 [SYN, ACK] Seq=0 Ack=1 Win=65160 Len=0 MSS=1460 SACK_PERM TSval=1145482453 TSecr=240634683 WS=128"
139,71.794885,192.168.11.22,192.168.11.33,TCP,66,0.00012,,0.00012,"Jan  6, 2024 19:37:24.875120000 JST",,39440  >  6000 [ACK] Seq=1 Ack=1 Win=64256 Len=0 TSval=240634690 TSecr=1145482453
140,71.795055,192.168.11.22,192.168.11.33,TCP,93,,,0.00017,"Jan  6, 2024 19:37:24.875290000 JST",,"39440  >  6000 [PSH, ACK] Seq=1 Ack=1 Win=64256 Len=27 TSval=240634691 TSecr=1145482453 [TCP segment of a reassembled PDU]"
141,71.795151,192.168.11.22,192.168.11.33,TCP,66,,,0.000096,"Jan  6, 2024 19:37:24.875386000 JST",,"39440  >  6000 [FIN, ACK] Seq=28 Ack=1 Win=64256 Len=0 TSval=240634691 TSecr=1145482453"
142,71.802923,192.168.11.33,192.168.11.22,TCP,66,0.007868,,0.007772,"Jan  6, 2024 19:37:24.883158000 JST",,6000  >  39440 [ACK] Seq=1 Ack=28 Win=65152 Len=0 TSval=1145482460 TSecr=240634691
143,71.803139,192.168.11.33,192.168.11.22,TCP,66,0.007988,,0.000216,"Jan  6, 2024 19:37:24.883374000 JST",,"6000  >  39440 [FIN, ACK] Seq=1 Ack=29 Win=65152 Len=0 TSval=1145482462 TSecr=240634691"
144,71.803184,192.168.11.22,192.168.11.33,TCP,66,0.000045,,0.000045,"Jan  6, 2024 19:37:24.883419000 JST",,39440  >  6000 [ACK] Seq=29 Ack=2 Win=64256 Len=0 TSval=240634699 TSecr=1145482462
145,71.836191,192.168.11.22,255.255.255.255,UDP,209,,Ÿ,0.033007,"Jan  6, 2024 19:37:24.916426000 JST",7b2273656d616e74696373223a207b22656e74697479223a2022504944222c202262617365656e74697479223a2022616e79222c2022726f6c65223a2022797979222c20227370617469616c223a2022616e79222c202274656d706f72616c223a2022616e79227d2c20226461746170726f7065727479223a207b22666f726d6174223a2022696e616f6b615f70726f6772616d5f73616d706c655f73656d616e746963227d7d,41311  >  7000 Len=167
146,71.843104,192.168.11.35,192.168.11.22,TCP,74,,œ,0.006913,"Jan  6, 2024 19:37:24.923339000 JST",,60248  >  6000 [SYN] Seq=0 Win=64240 Len=0 MSS=1460 SACK_PERM TSval=1664422577 TSecr=0 WS=128
147,71.843259,192.168.11.22,192.168.11.35,TCP,74,0.000155,,0.000155,"Jan  6, 2024 19:37:24.923494000 JST",,"6000  >  60248 [SYN, ACK] Seq=0 Ack=1 Win=65160 Len=0 MSS=1460 SACK_PERM TSval=2848181482 TSecr=1664422577 WS=128"
148,71.850219,192.168.11.35,192.168.11.22,TCP,66,0.00696,,0.00696,"Jan  6, 2024 19:37:24.930454000 JST",,60248  >  6000 [ACK] Seq=1 Ack=1 Win=64256 Len=0 TSval=1664422585 TSecr=2848181482
149,71.850845,192.168.11.35,192.168.11.22,TCP,93,,,0.000626,"Jan  6, 2024 19:37:24.931080000 JST",,"60248  >  6000 [PSH, ACK] Seq=1 Ack=1 Win=64256 Len=27 TSval=1664422585 TSecr=2848181482 [TCP segment of a reassembled PDU]"
150,71.850942,192.168.11.22,192.168.11.35,TCP,66,0.000097,,0.000097,"Jan  6, 2024 19:37:24.931177000 JST",,6000  >  60248 [ACK] Seq=1 Ack=28 Win=65152 Len=0 TSval=2848181489 TSecr=1664422585
151,71.851025,192.168.11.35,192.168.11.22,TCP,66,,,0.000083,"Jan  6, 2024 19:37:24.931260000 JST",,"60248  >  6000 [FIN, ACK] Seq=28 Ack=1 Win=64256 Len=0 TSval=1664422585 TSecr=2848181482"
152,71.8534,192.168.11.22,192.168.11.35,TCP,66,0.002375,,0.002375,"Jan  6, 2024 19:37:24.933635000 JST",,"6000  >  60248 [FIN, ACK] Seq=1 Ack=29 Win=65152 Len=0 TSval=2848181492 TSecr=1664422585"
153,71.860861,192.168.11.35,192.168.11.22,TCP,66,0.007461,,0.007461,"Jan  6, 2024 19:37:24.941096000 JST",,60248  >  6000 [ACK] Seq=29 Ack=2 Win=64256 Len=0 TSval=1664422595 TSecr=2848181492
154,81.682188,192.168.11.22,192.168.11.33,TCP,74,,,9.821327,"Jan  6, 2024 19:37:34.762423000 JST",,55006  >  6000 [SYN] Seq=0 Win=64240 Len=0 MSS=1460 SACK_PERM TSval=240644578 TSecr=0 WS=128
155,81.688863,192.168.11.33,192.168.11.22,TCP,74,0.006675,,0.006675,"Jan  6, 2024 19:37:34.769098000 JST",,"6000  >  55006 [SYN, ACK] Seq=0 Ack=1 Win=65160 Len=0 MSS=1460 SACK_PERM TSval=1145492347 TSecr=240644578 WS=128"
156,81.688966,192.168.11.22,192.168.11.33,TCP,66,0.000103,,0.000103,"Jan  6, 2024 19:37:34.769201000 JST",,55006  >  6000 [ACK] Seq=1 Ack=1 Win=64256 Len=0 TSval=240644585 TSecr=1145492347
157,81.689143,192.168.11.22,192.168.11.33,TCP,93,,,0.000177,"Jan  6, 2024 19:37:34.769378000 JST",,"55006  >  6000 [PSH, ACK] Seq=1 Ack=1 Win=64256 Len=27 TSval=240644585 TSecr=1145492347 [TCP segment of a reassembled PDU]"
158,81.689254,192.168.11.22,192.168.11.33,TCP,66,,,0.000111,"Jan  6, 2024 19:37:34.769489000 JST",,"55006  >  6000 [FIN, ACK] Seq=28 Ack=1 Win=64256 Len=0 TSval=240644585 TSecr=1145492347"
159,81.696125,192.168.11.33,192.168.11.22,TCP,66,0.006982,,0.006871,"Jan  6, 2024 19:37:34.776360000 JST",,6000  >  55006 [ACK] Seq=1 Ack=28 Win=65152 Len=0 TSval=1145492354 TSecr=240644585
160,81.696491,192.168.11.33,192.168.11.22,TCP,66,0.007237,,0.000366,"Jan  6, 2024 19:37:34.776726000 JST",,"6000  >  55006 [FIN, ACK] Seq=1 Ack=29 Win=65152 Len=0 TSval=1145492355 TSecr=240644585"
161,81.696544,192.168.11.22,192.168.11.33,TCP,66,0.000053,,0.000053,"Jan  6, 2024 19:37:34.776779000 JST",,55006  >  6000 [ACK] Seq=29 Ack=2 Win=64256 Len=0 TSval=240644592 TSecr=1145492355
162,81.726259,192.168.11.22,255.255.255.255,UDP,209,,Ÿ,0.029715,"Jan  6, 2024 19:37:34.806494000 JST",7b2273656d616e74696373223a207b22656e74697479223a2022504944222c202262617365656e74697479223a2022616e79222c2022726f6c65223a2022797979222c20227370617469616c223a2022616e79222c202274656d706f72616c223a2022616e79227d2c20226461746170726f7065727479223a207b22666f726d6174223a2022696e616f6b615f70726f6772616d5f73616d706c655f73656d616e746963227d7d,38298  >  7000 Len=167
163,81.733031,192.168.11.35,192.168.11.22,TCP,74,,œ,0.006772,"Jan  6, 2024 19:37:34.813266000 JST",,58466  >  6000 [SYN] Seq=0 Win=64240 Len=0 MSS=1460 SACK_PERM TSval=1664432467 TSecr=0 WS=128
164,81.733167,192.168.11.22,192.168.11.35,TCP,74,0.000136,,0.000136,"Jan  6, 2024 19:37:34.813402000 JST",,"6000  >  58466 [SYN, ACK] Seq=0 Ack=1 Win=65160 Len=0 MSS=1460 SACK_PERM TSval=2848191372 TSecr=1664432467 WS=128"
165,81.739807,192.168.11.35,192.168.11.22,TCP,66,0.00664,,0.00664,"Jan  6, 2024 19:37:34.820042000 JST",,58466  >  6000 [ACK] Seq=1 Ack=1 Win=64256 Len=0 TSval=1664432475 TSecr=2848191372
166,81.740461,192.168.11.35,192.168.11.22,TCP,93,,,0.000654,"Jan  6, 2024 19:37:34.820696000 JST",,"58466  >  6000 [PSH, ACK] Seq=1 Ack=1 Win=64256 Len=27 TSval=1664432475 TSecr=2848191372 [TCP segment of a reassembled PDU]"
167,81.740576,192.168.11.22,192.168.11.35,TCP,66,0.000115,,0.000115,"Jan  6, 2024 19:37:34.820811000 JST",,6000  >  58466 [ACK] Seq=1 Ack=28 Win=65152 Len=0 TSval=2848191379 TSecr=1664432475
168,81.740684,192.168.11.35,192.168.11.22,TCP,66,,,0.000108,"Jan  6, 2024 19:37:34.820919000 JST",,"58466  >  6000 [FIN, ACK] Seq=28 Ack=1 Win=64256 Len=0 TSval=1664432475 TSecr=2848191372"
169,81.742277,192.168.11.22,192.168.11.35,TCP,66,0.001593,,0.001593,"Jan  6, 2024 19:37:34.822512000 JST",,"6000  >  58466 [FIN, ACK] Seq=1 Ack=29 Win=65152 Len=0 TSval=2848191381 TSecr=1664432475"
170,81.747728,192.168.11.35,192.168.11.22,TCP,66,0.005451,,0.005451,"Jan  6, 2024 19:37:34.827963000 JST",,58466  >  6000 [ACK] Seq=29 Ack=2 Win=64256 Len=0 TSval=1664432483 TSecr=2848191381
171,113.859968,192.168.11.22,192.168.11.33,TCP,74,,,32.11224,"Jan  6, 2024 19:38:06.940203000 JST",,55060  >  6000 [SYN] Seq=0 Win=64240 Len=0 MSS=1460 SACK_PERM TSval=240676755 TSecr=0 WS=128
172,113.874462,192.168.11.33,192.168.11.22,TCP,74,0.014494,,0.014494,"Jan  6, 2024 19:38:06.954697000 JST",,"6000  >  55060 [SYN, ACK] Seq=0 Ack=1 Win=65160 Len=0 MSS=1460 SACK_PERM TSval=1145524532 TSecr=240676755 WS=128"
173,113.874573,192.168.11.22,192.168.11.33,TCP,66,0.000111,,0.000111,"Jan  6, 2024 19:38:06.954808000 JST",,55060  >  6000 [ACK] Seq=1 Ack=1 Win=64256 Len=0 TSval=240676770 TSecr=1145524532
174,113.874744,192.168.11.22,192.168.11.33,TCP,93,,,0.000171,"Jan  6, 2024 19:38:06.954979000 JST",,"55060  >  6000 [PSH, ACK] Seq=1 Ack=1 Win=64256 Len=27 TSval=240676770 TSecr=1145524532 [TCP segment of a reassembled PDU]"
175,113.874843,192.168.11.22,192.168.11.33,TCP,66,,,0.000099,"Jan  6, 2024 19:38:06.955078000 JST",,"55060  >  6000 [FIN, ACK] Seq=28 Ack=1 Win=64256 Len=0 TSval=240676770 TSecr=1145524532"
176,113.881757,192.168.11.33,192.168.11.22,TCP,66,0.007013,,0.006914,"Jan  6, 2024 19:38:06.961992000 JST",,6000  >  55060 [ACK] Seq=1 Ack=28 Win=65152 Len=0 TSval=1145524540 TSecr=240676770
177,113.882176,192.168.11.33,192.168.11.22,TCP,66,0.007333,,0.000419,"Jan  6, 2024 19:38:06.962411000 JST",,"6000  >  55060 [FIN, ACK] Seq=1 Ack=29 Win=65152 Len=0 TSval=1145524541 TSecr=240676770"
178,113.882222,192.168.11.22,192.168.11.33,TCP,66,0.000046,,0.000046,"Jan  6, 2024 19:38:06.962457000 JST",,55060  >  6000 [ACK] Seq=29 Ack=2 Win=64256 Len=0 TSval=240676778 TSecr=1145524541
179,113.911538,192.168.11.22,255.255.255.255,UDP,209,,Ÿ,0.029316,"Jan  6, 2024 19:38:06.991773000 JST",7b2273656d616e74696373223a207b22656e74697479223a2022504944222c202262617365656e74697479223a2022616e79222c2022726f6c65223a2022797979222c20227370617469616c223a2022616e79222c202274656d706f72616c223a2022616e79227d2c20226461746170726f7065727479223a207b22666f726d6174223a2022696e616f6b615f70726f6772616d5f73616d706c655f73656d616e746963227d7d,51342  >  7000 Len=167
180,113.917089,192.168.11.35,192.168.11.22,TCP,74,,œ,0.005551,"Jan  6, 2024 19:38:06.997324000 JST",,33610  >  6000 [SYN] Seq=0 Win=64240 Len=0 MSS=1460 SACK_PERM TSval=1664464652 TSecr=0 WS=128
181,113.917261,192.168.11.22,192.168.11.35,TCP,74,0.000172,,0.000172,"Jan  6, 2024 19:38:06.997496000 JST",,"6000  >  33610 [SYN, ACK] Seq=0 Ack=1 Win=65160 Len=0 MSS=1460 SACK_PERM TSval=2848223556 TSecr=1664464652 WS=128"
182,113.924602,192.168.11.35,192.168.11.22,TCP,66,0.007341,,0.007341,"Jan  6, 2024 19:38:07.004837000 JST",,33610  >  6000 [ACK] Seq=1 Ack=1 Win=64256 Len=0 TSval=1664464659 TSecr=2848223556
183,113.925324,192.168.11.35,192.168.11.22,TCP,93,,,0.000722,"Jan  6, 2024 19:38:07.005559000 JST",,"33610  >  6000 [PSH, ACK] Seq=1 Ack=1 Win=64256 Len=27 TSval=1664464659 TSecr=2848223556 [TCP segment of a reassembled PDU]"
184,113.925426,192.168.11.22,192.168.11.35,TCP,66,0.000102,,0.000102,"Jan  6, 2024 19:38:07.005661000 JST",,6000  >  33610 [ACK] Seq=1 Ack=28 Win=65152 Len=0 TSval=2848223564 TSecr=1664464659
185,113.925507,192.168.11.35,192.168.11.22,TCP,66,,,0.000081,"Jan  6, 2024 19:38:07.005742000 JST",,"33610  >  6000 [FIN, ACK] Seq=28 Ack=1 Win=64256 Len=0 TSval=1664464659 TSecr=2848223556"
