No.,Time,Source,Destination,Protocol,Length,Time delta from previous captured frame,XXX,Arrival Time,Data,Info
9,0.051444,192.168.11.35,255.255.255.255,UDP,209,0.033705,Ÿ,"Jan  6, 2024 19:36:13.194365000 JST",7b2273656d616e74696373223a207b22656e74697479223a2022504944222c202262617365656e74697479223a2022616e79222c2022726f6c65223a20227a7a7a222c20227370617469616c223a2022616e79222c202274656d706f72616c223a2022616e79227d2c20226461746170726f7065727479223a207b22666f726d6174223a2022696e616f6b615f70726f6772616d5f73616d706c655f73656d616e746963227d7d,47945  >  7000 Len=167
10,0.063105,192.168.11.34,192.168.11.35,TCP,74,0.011661,œ,"Jan  6, 2024 19:36:13.206026000 JST",,50418  >  6000 [SYN] Seq=0 Win=64240 Len=0 MSS=1460 SACK_PERM TSval=158640082 TSecr=0 WS=128
26,9.350682,192.168.11.35,255.255.255.255,UDP,209,0.033652,Ÿ,"Jan  6, 2024 19:36:22.493603000 JST",7b2273656d616e74696373223a207b22656e74697479223a2022504944222c202262617365656e74697479223a2022616e79222c2022726f6c65223a20227a7a7a222c20227370617469616c223a2022616e79222c202274656d706f72616c223a2022616e79227d2c20226461746170726f7065727479223a207b22666f726d6174223a2022696e616f6b615f70726f6772616d5f73616d706c655f73656d616e746963227d7d,33207  >  7000 Len=167
27,9.361826,192.168.11.34,192.168.11.35,TCP,74,0.011144,œ,"Jan  6, 2024 19:36:22.504747000 JST",,52298  >  6000 [SYN] Seq=0 Win=64240 Len=0 MSS=1460 SACK_PERM TSval=158649383 TSecr=0 WS=128
28,9.361984,192.168.11.35,192.168.11.34,TCP,74,0.000158,,"Jan  6, 2024 19:36:22.504905000 JST",,"6000  >  52298 [SYN, ACK] Seq=0 Ack=1 Win=65160 Len=0 MSS=1460 SACK_PERM TSval=548193143 TSecr=158649383 WS=128"
29,9.369278,192.168.11.34,192.168.11.35,TCP,66,0.007294,,"Jan  6, 2024 19:36:22.512199000 JST",,52298  >  6000 [ACK] Seq=1 Ack=1 Win=64256 Len=0 TSval=158649391 TSecr=548193143
30,9.369815,192.168.11.34,192.168.11.35,TCP,93,0.000537,,"Jan  6, 2024 19:36:22.512736000 JST",,"52298  >  6000 [PSH, ACK] Seq=1 Ack=1 Win=64256 Len=27 TSval=158649391 TSecr=548193143 [TCP segment of a reassembled PDU]"
31,9.369889,192.168.11.35,192.168.11.34,TCP,66,0.000074,,"Jan  6, 2024 19:36:22.512810000 JST",,6000  >  52298 [ACK] Seq=1 Ack=28 Win=65152 Len=0 TSval=548193151 TSecr=158649391
32,9.369959,192.168.11.34,192.168.11.35,TCP,66,0.00007,,"Jan  6, 2024 19:36:22.512880000 JST",,"52298  >  6000 [FIN, ACK] Seq=28 Ack=1 Win=64256 Len=0 TSval=158649391 TSecr=548193143"
33,9.371269,192.168.11.35,192.168.11.34,TCP,66,0.00131,,"Jan  6, 2024 19:36:22.514190000 JST",,"6000  >  52298 [FIN, ACK] Seq=1 Ack=29 Win=65152 Len=0 TSval=548193152 TSecr=158649391"
34,9.377928,192.168.11.34,192.168.11.35,TCP,66,0.006659,,"Jan  6, 2024 19:36:22.520849000 JST",,52298  >  6000 [ACK] Seq=29 Ack=2 Win=64256 Len=0 TSval=158649399 TSecr=548193152
35,19.157091,192.168.11.35,192.168.11.22,TCP,74,9.779163,,"Jan  6, 2024 19:36:32.300012000 JST",,44172  >  6000 [SYN] Seq=0 Win=64240 Len=0 MSS=1460 SACK_PERM TSval=1664369949 TSecr=0 WS=128
36,19.16404,192.168.11.22,192.168.11.35,TCP,74,0.006949,,"Jan  6, 2024 19:36:32.306961000 JST",,"6000  >  44172 [SYN, ACK] Seq=0 Ack=1 Win=65160 Len=0 MSS=1460 SACK_PERM TSval=2848128853 TSecr=1664369949 WS=128"
37,19.164133,192.168.11.35,192.168.11.22,TCP,66,0.000093,,"Jan  6, 2024 19:36:32.307054000 JST",,44172  >  6000 [ACK] Seq=1 Ack=1 Win=64256 Len=0 TSval=1664369956 TSecr=2848128853
38,19.164291,192.168.11.35,192.168.11.22,TCP,93,0.000158,,"Jan  6, 2024 19:36:32.307212000 JST",,"44172  >  6000 [PSH, ACK] Seq=1 Ack=1 Win=64256 Len=27 TSval=1664369956 TSecr=2848128853 [TCP segment of a reassembled PDU]"
39,19.164428,192.168.11.35,192.168.11.22,TCP,66,0.000137,,"Jan  6, 2024 19:36:32.307349000 JST",,"44172  >  6000 [FIN, ACK] Seq=28 Ack=1 Win=64256 Len=0 TSval=1664369957 TSecr=2848128853"
40,19.171386,192.168.11.22,192.168.11.35,TCP,66,0.006958,,"Jan  6, 2024 19:36:32.314307000 JST",,6000  >  44172 [ACK] Seq=1 Ack=28 Win=65152 Len=0 TSval=2848128860 TSecr=1664369956
41,19.171768,192.168.11.22,192.168.11.35,TCP,66,0.000382,,"Jan  6, 2024 19:36:32.314689000 JST",,"6000  >  44172 [FIN, ACK] Seq=1 Ack=29 Win=65152 Len=0 TSval=2848128862 TSecr=1664369957"
42,19.171819,192.168.11.35,192.168.11.22,TCP,66,0.000051,,"Jan  6, 2024 19:36:32.314740000 JST",,44172  >  6000 [ACK] Seq=29 Ack=2 Win=64256 Len=0 TSval=1664369964 TSecr=2848128862
43,19.199033,192.168.11.35,255.255.255.255,UDP,209,0.027214,Ÿ,"Jan  6, 2024 19:36:32.341954000 JST",7b2273656d616e74696373223a207b22656e74697479223a2022504944222c202262617365656e74697479223a2022616e79222c2022726f6c65223a20227a7a7a222c20227370617469616c223a2022616e79222c202274656d706f72616c223a2022616e79227d2c20226461746170726f7065727479223a207b22666f726d6174223a2022696e616f6b615f70726f6772616d5f73616d706c655f73656d616e746963227d7d,38586  >  7000 Len=167
44,19.207958,192.168.11.34,192.168.11.35,TCP,74,0.008925,œ,"Jan  6, 2024 19:36:32.350879000 JST",,41558  >  6000 [SYN] Seq=0 Win=64240 Len=0 MSS=1460 SACK_PERM TSval=158659229 TSecr=0 WS=128
45,19.2081,192.168.11.35,192.168.11.34,TCP,74,0.000142,,"Jan  6, 2024 19:36:32.351021000 JST",,"6000  >  41558 [SYN, ACK] Seq=0 Ack=1 Win=65160 Len=0 MSS=1460 SACK_PERM TSval=548202989 TSecr=158659229 WS=128"
46,19.215431,192.168.11.34,192.168.11.35,TCP,66,0.007331,,"Jan  6, 2024 19:36:32.358352000 JST",,41558  >  6000 [ACK] Seq=1 Ack=1 Win=64256 Len=0 TSval=158659237 TSecr=548202989
47,19.215974,192.168.11.34,192.168.11.35,TCP,93,0.000543,,"Jan  6, 2024 19:36:32.358895000 JST",,"41558  >  6000 [PSH, ACK] Seq=1 Ack=1 Win=64256 Len=27 TSval=158659237 TSecr=548202989 [TCP segment of a reassembled PDU]"
48,19.216042,192.168.11.35,192.168.11.34,TCP,66,0.000068,,"Jan  6, 2024 19:36:32.358963000 JST",,6000  >  41558 [ACK] Seq=1 Ack=28 Win=65152 Len=0 TSval=548202997 TSecr=158659237
49,19.216108,192.168.11.34,192.168.11.35,TCP,66,0.000066,,"Jan  6, 2024 19:36:32.359029000 JST",,"41558  >  6000 [FIN, ACK] Seq=28 Ack=1 Win=64256 Len=0 TSval=158659237 TSecr=548202989"
50,19.217272,192.168.11.35,192.168.11.34,TCP,66,0.001164,,"Jan  6, 2024 19:36:32.360193000 JST",,"6000  >  41558 [FIN, ACK] Seq=1 Ack=29 Win=65152 Len=0 TSval=548202998 TSecr=158659237"
51,19.224081,192.168.11.34,192.168.11.35,TCP,66,0.006809,,"Jan  6, 2024 19:36:32.367002000 JST",,41558  >  6000 [ACK] Seq=29 Ack=2 Win=64256 Len=0 TSval=158659245 TSecr=548202998
52,29.084134,192.168.11.35,192.168.11.22,TCP,74,9.860053,,"Jan  6, 2024 19:36:42.227055000 JST",,49958  >  6000 [SYN] Seq=0 Win=64240 Len=0 MSS=1460 SACK_PERM TSval=1664379876 TSecr=0 WS=128
53,29.090761,192.168.11.22,192.168.11.35,TCP,74,0.006627,,"Jan  6, 2024 19:36:42.233682000 JST",,"6000  >  49958 [SYN, ACK] Seq=0 Ack=1 Win=65160 Len=0 MSS=1460 SACK_PERM TSval=2848138780 TSecr=1664379876 WS=128"
54,29.09086,192.168.11.35,192.168.11.22,TCP,66,0.000099,,"Jan  6, 2024 19:36:42.233781000 JST",,49958  >  6000 [ACK] Seq=1 Ack=1 Win=64256 Len=0 TSval=1664379883 TSecr=2848138780
55,29.091031,192.168.11.35,192.168.11.22,TCP,93,0.000171,,"Jan  6, 2024 19:36:42.233952000 JST",,"49958  >  6000 [PSH, ACK] Seq=1 Ack=1 Win=64256 Len=27 TSval=1664379883 TSecr=2848138780 [TCP segment of a reassembled PDU]"
56,29.091124,192.168.11.35,192.168.11.22,TCP,66,0.000093,,"Jan  6, 2024 19:36:42.234045000 JST",,"49958  >  6000 [FIN, ACK] Seq=28 Ack=1 Win=64256 Len=0 TSval=1664379883 TSecr=2848138780"
57,29.097961,192.168.11.22,192.168.11.35,TCP,66,0.006837,,"Jan  6, 2024 19:36:42.240882000 JST",,6000  >  49958 [ACK] Seq=1 Ack=28 Win=65152 Len=0 TSval=2848138787 TSecr=1664379883
58,29.098324,192.168.11.22,192.168.11.35,TCP,66,0.000363,,"Jan  6, 2024 19:36:42.241245000 JST",,"6000  >  49958 [FIN, ACK] Seq=1 Ack=29 Win=65152 Len=0 TSval=2848138788 TSecr=1664379883"
59,29.098386,192.168.11.35,192.168.11.22,TCP,66,0.000062,,"Jan  6, 2024 19:36:42.241307000 JST",,49958  >  6000 [ACK] Seq=29 Ack=2 Win=64256 Len=0 TSval=1664379890 TSecr=2848138788
60,29.125663,192.168.11.35,255.255.255.255,UDP,209,0.027277,Ÿ,"Jan  6, 2024 19:36:42.268584000 JST",7b2273656d616e74696373223a207b22656e74697479223a2022504944222c202262617365656e74697479223a2022616e79222c2022726f6c65223a20227a7a7a222c20227370617469616c223a2022616e79222c202274656d706f72616c223a2022616e79227d2c20226461746170726f7065727479223a207b22666f726d6174223a2022696e616f6b615f70726f6772616d5f73616d706c655f73656d616e746963227d7d,42900  >  7000 Len=167
61,29.135844,192.168.11.34,192.168.11.35,TCP,74,0.010181,œ,"Jan  6, 2024 19:36:42.278765000 JST",,37456  >  6000 [SYN] Seq=0 Win=64240 Len=0 MSS=1460 SACK_PERM TSval=158669156 TSecr=0 WS=128
62,29.135977,192.168.11.35,192.168.11.34,TCP,74,0.000133,,"Jan  6, 2024 19:36:42.278898000 JST",,"6000  >  37456 [SYN, ACK] Seq=0 Ack=1 Win=65160 Len=0 MSS=1460 SACK_PERM TSval=548212917 TSecr=158669156 WS=128"
63,29.142956,192.168.11.34,192.168.11.35,TCP,66,0.006979,,"Jan  6, 2024 19:36:42.285877000 JST",,37456  >  6000 [ACK] Seq=1 Ack=1 Win=64256 Len=0 TSval=158669165 TSecr=548212917
64,29.143419,192.168.11.34,192.168.11.35,TCP,93,0.000463,,"Jan  6, 2024 19:36:42.286340000 JST",,"37456  >  6000 [PSH, ACK] Seq=1 Ack=1 Win=64256 Len=27 TSval=158669165 TSecr=548212917 [TCP segment of a reassembled PDU]"
65,29.143485,192.168.11.35,192.168.11.34,TCP,66,0.000066,,"Jan  6, 2024 19:36:42.286406000 JST",,6000  >  37456 [ACK] Seq=1 Ack=28 Win=65152 Len=0 TSval=548212925 TSecr=158669165
66,29.143547,192.168.11.34,192.168.11.35,TCP,66,0.000062,,"Jan  6, 2024 19:36:42.286468000 JST",,"37456  >  6000 [FIN, ACK] Seq=28 Ack=1 Win=64256 Len=0 TSval=158669165 TSecr=548212917"
67,29.144681,192.168.11.35,192.168.11.34,TCP,66,0.001134,,"Jan  6, 2024 19:36:42.287602000 JST",,"6000  >  37456 [FIN, ACK] Seq=1 Ack=29 Win=65152 Len=0 TSval=548212926 TSecr=158669165"
68,29.161064,192.168.11.34,192.168.11.35,TCP,66,0.016383,,"Jan  6, 2024 19:36:42.303985000 JST",,37456  >  6000 [ACK] Seq=29 Ack=2 Win=64256 Len=0 TSval=158669173 TSecr=548212926
69,36.89302,192.168.11.35,192.168.11.22,TCP,74,7.731956,,"Jan  6, 2024 19:36:50.035941000 JST",,58848  >  6000 [SYN] Seq=0 Win=64240 Len=0 MSS=1460 SACK_PERM TSval=1664387685 TSecr=0 WS=128
70,36.899813,192.168.11.22,192.168.11.35,TCP,74,0.006793,,"Jan  6, 2024 19:36:50.042734000 JST",,"6000  >  58848 [SYN, ACK] Seq=0 Ack=1 Win=65160 Len=0 MSS=1460 SACK_PERM TSval=2848146589 TSecr=1664387685 WS=128"
71,36.899921,192.168.11.35,192.168.11.22,TCP,66,0.000108,,"Jan  6, 2024 19:36:50.042842000 JST",,58848  >  6000 [ACK] Seq=1 Ack=1 Win=64256 Len=0 TSval=1664387692 TSecr=2848146589
72,36.900089,192.168.11.35,192.168.11.22,TCP,93,0.000168,,"Jan  6, 2024 19:36:50.043010000 JST",,"58848  >  6000 [PSH, ACK] Seq=1 Ack=1 Win=64256 Len=27 TSval=1664387692 TSecr=2848146589 [TCP segment of a reassembled PDU]"
73,36.900181,192.168.11.35,192.168.11.22,TCP,66,0.000092,,"Jan  6, 2024 19:36:50.043102000 JST",,"58848  >  6000 [FIN, ACK] Seq=28 Ack=1 Win=64256 Len=0 TSval=1664387692 TSecr=2848146589"
74,36.907177,192.168.11.22,192.168.11.35,TCP,66,0.006996,,"Jan  6, 2024 19:36:50.050098000 JST",,6000  >  58848 [ACK] Seq=1 Ack=28 Win=65152 Len=0 TSval=2848146596 TSecr=1664387692
75,36.907555,192.168.11.22,192.168.11.35,TCP,66,0.000378,,"Jan  6, 2024 19:36:50.050476000 JST",,"6000  >  58848 [FIN, ACK] Seq=1 Ack=29 Win=65152 Len=0 TSval=2848146598 TSecr=1664387692"
76,36.907611,192.168.11.35,192.168.11.22,TCP,66,0.000056,,"Jan  6, 2024 19:36:50.050532000 JST",,58848  >  6000 [ACK] Seq=29 Ack=2 Win=64256 Len=0 TSval=1664387700 TSecr=2848146598
77,36.935494,192.168.11.35,255.255.255.255,UDP,209,0.027883,Ÿ,"Jan  6, 2024 19:36:50.078415000 JST",7b2273656d616e74696373223a207b22656e74697479223a2022504944222c202262617365656e74697479223a2022616e79222c2022726f6c65223a20227a7a7a222c20227370617469616c223a2022616e79222c202274656d706f72616c223a2022616e79227d2c20226461746170726f7065727479223a207b22666f726d6174223a2022696e616f6b615f70726f6772616d5f73616d706c655f73656d616e746963227d7d,57819  >  7000 Len=167
78,36.951817,192.168.11.34,192.168.11.35,TCP,74,0.016323,œ,"Jan  6, 2024 19:36:50.094738000 JST",,36522  >  6000 [SYN] Seq=0 Win=64240 Len=0 MSS=1460 SACK_PERM TSval=158676965 TSecr=0 WS=128
79,36.951997,192.168.11.35,192.168.11.34,TCP,74,0.00018,,"Jan  6, 2024 19:36:50.094918000 JST",,"6000  >  36522 [SYN, ACK] Seq=0 Ack=1 Win=65160 Len=0 MSS=1460 SACK_PERM TSval=548220733 TSecr=158676965 WS=128"
80,36.965139,192.168.11.34,192.168.11.35,TCP,66,0.013142,,"Jan  6, 2024 19:36:50.108060000 JST",,36522  >  6000 [ACK] Seq=1 Ack=1 Win=64256 Len=0 TSval=158676982 TSecr=548220733
81,36.965601,192.168.11.34,192.168.11.35,TCP,93,0.000462,,"Jan  6, 2024 19:36:50.108522000 JST",,"36522  >  6000 [PSH, ACK] Seq=1 Ack=1 Win=64256 Len=27 TSval=158676983 TSecr=548220733 [TCP segment of a reassembled PDU]"
82,36.96567,192.168.11.35,192.168.11.34,TCP,66,0.000069,,"Jan  6, 2024 19:36:50.108591000 JST",,6000  >  36522 [ACK] Seq=1 Ack=28 Win=65152 Len=0 TSval=548220747 TSecr=158676983
83,36.965727,192.168.11.34,192.168.11.35,TCP,66,0.000057,,"Jan  6, 2024 19:36:50.108648000 JST",,"36522  >  6000 [FIN, ACK] Seq=28 Ack=1 Win=64256 Len=0 TSval=158676983 TSecr=548220733"
84,36.96649,192.168.11.35,192.168.11.34,TCP,66,0.000763,,"Jan  6, 2024 19:36:50.109411000 JST",,"6000  >  36522 [FIN, ACK] Seq=1 Ack=29 Win=65152 Len=0 TSval=548220748 TSecr=158676983"
85,36.973353,192.168.11.34,192.168.11.35,TCP,66,0.006863,,"Jan  6, 2024 19:36:50.116274000 JST",,36522  >  6000 [ACK] Seq=29 Ack=2 Win=64256 Len=0 TSval=158676995 TSecr=548220748
86,44.708627,192.168.11.35,192.168.11.22,TCP,74,7.735274,,"Jan  6, 2024 19:36:57.851548000 JST",,44914  >  6000 [SYN] Seq=0 Win=64240 Len=0 MSS=1460 SACK_PERM TSval=1664395501 TSecr=0 WS=128
87,44.715205,192.168.11.22,192.168.11.35,TCP,74,0.006578,,"Jan  6, 2024 19:36:57.858126000 JST",,"6000  >  44914 [SYN, ACK] Seq=0 Ack=1 Win=65160 Len=0 MSS=1460 SACK_PERM TSval=2848154404 TSecr=1664395501 WS=128"
88,44.715298,192.168.11.35,192.168.11.22,TCP,66,0.000093,,"Jan  6, 2024 19:36:57.858219000 JST",,44914  >  6000 [ACK] Seq=1 Ack=1 Win=64256 Len=0 TSval=1664395507 TSecr=2848154404
89,44.715442,192.168.11.35,192.168.11.22,TCP,93,0.000144,,"Jan  6, 2024 19:36:57.858363000 JST",,"44914  >  6000 [PSH, ACK] Seq=1 Ack=1 Win=64256 Len=27 TSval=1664395508 TSecr=2848154404 [TCP segment of a reassembled PDU]"
90,44.715534,192.168.11.35,192.168.11.22,TCP,66,0.000092,,"Jan  6, 2024 19:36:57.858455000 JST",,"44914  >  6000 [FIN, ACK] Seq=28 Ack=1 Win=64256 Len=0 TSval=1664395508 TSecr=2848154404"
91,44.722486,192.168.11.22,192.168.11.35,TCP,66,0.006952,,"Jan  6, 2024 19:36:57.865407000 JST",,6000  >  44914 [ACK] Seq=1 Ack=28 Win=65152 Len=0 TSval=2848154412 TSecr=1664395508
92,44.722871,192.168.11.22,192.168.11.35,TCP,66,0.000385,,"Jan  6, 2024 19:36:57.865792000 JST",,"6000  >  44914 [FIN, ACK] Seq=1 Ack=29 Win=65152 Len=0 TSval=2848154413 TSecr=1664395508"
93,44.722915,192.168.11.35,192.168.11.22,TCP,66,0.000044,,"Jan  6, 2024 19:36:57.865836000 JST",,44914  >  6000 [ACK] Seq=29 Ack=2 Win=64256 Len=0 TSval=1664395515 TSecr=2848154413
94,44.754849,192.168.11.35,255.255.255.255,UDP,209,0.031934,Ÿ,"Jan  6, 2024 19:36:57.897770000 JST",7b2273656d616e74696373223a207b22656e74697479223a2022504944222c202262617365656e74697479223a2022616e79222c2022726f6c65223a20227a7a7a222c20227370617469616c223a2022616e79222c202274656d706f72616c223a2022616e79227d2c20226461746170726f7065727479223a207b22666f726d6174223a2022696e616f6b615f70726f6772616d5f73616d706c655f73656d616e746963227d7d,53036  >  7000 Len=167
95,44.764166,192.168.11.34,192.168.11.35,TCP,74,0.009317,œ,"Jan  6, 2024 19:36:57.907087000 JST",,36536  >  6000 [SYN] Seq=0 Win=64240 Len=0 MSS=1460 SACK_PERM TSval=158684785 TSecr=0 WS=128
96,44.764298,192.168.11.35,192.168.11.34,TCP,74,0.000132,,"Jan  6, 2024 19:36:57.907219000 JST",,"6000  >  36536 [SYN, ACK] Seq=0 Ack=1 Win=65160 Len=0 MSS=1460 SACK_PERM TSval=548228545 TSecr=158684785 WS=128"
97,44.771706,192.168.11.34,192.168.11.35,TCP,66,0.007408,,"Jan  6, 2024 19:36:57.914627000 JST",,36536  >  6000 [ACK] Seq=1 Ack=1 Win=64256 Len=0 TSval=158684793 TSecr=548228545
98,44.772326,192.168.11.34,192.168.11.35,TCP,93,0.00062,,"Jan  6, 2024 19:36:57.915247000 JST",,"36536  >  6000 [PSH, ACK] Seq=1 Ack=1 Win=64256 Len=27 TSval=158684793 TSecr=548228545 [TCP segment of a reassembled PDU]"
99,44.772442,192.168.11.35,192.168.11.34,TCP,66,0.000116,,"Jan  6, 2024 19:36:57.915363000 JST",,6000  >  36536 [ACK] Seq=1 Ack=28 Win=65152 Len=0 TSval=548228553 TSecr=158684793
100,44.772625,192.168.11.34,192.168.11.35,TCP,66,0.000183,,"Jan  6, 2024 19:36:57.915546000 JST",,"36536  >  6000 [FIN, ACK] Seq=28 Ack=1 Win=64256 Len=0 TSval=158684794 TSecr=548228545"
101,44.773874,192.168.11.35,192.168.11.34,TCP,66,0.001249,,"Jan  6, 2024 19:36:57.916795000 JST",,"6000  >  36536 [FIN, ACK] Seq=1 Ack=29 Win=65152 Len=0 TSval=548228555 TSecr=158684794"
102,44.782306,192.168.11.34,192.168.11.35,TCP,66,0.008432,,"Jan  6, 2024 19:36:57.925227000 JST",,36536  >  6000 [ACK] Seq=29 Ack=2 Win=64256 Len=0 TSval=158684803 TSecr=548228555
103,52.561792,192.168.11.35,192.168.11.22,TCP,74,7.779486,,"Jan  6, 2024 19:37:05.704713000 JST",,44928  >  6000 [SYN] Seq=0 Win=64240 Len=0 MSS=1460 SACK_PERM TSval=1664403354 TSecr=0 WS=128
104,52.56952,192.168.11.22,192.168.11.35,TCP,74,0.007728,,"Jan  6, 2024 19:37:05.712441000 JST",,"6000  >  44928 [SYN, ACK] Seq=0 Ack=1 Win=65160 Len=0 MSS=1460 SACK_PERM TSval=2848162259 TSecr=1664403354 WS=128"
105,52.569612,192.168.11.35,192.168.11.22,TCP,66,0.000092,,"Jan  6, 2024 19:37:05.712533000 JST",,44928  >  6000 [ACK] Seq=1 Ack=1 Win=64256 Len=0 TSval=1664403362 TSecr=2848162259
106,52.569771,192.168.11.35,192.168.11.22,TCP,93,0.000159,,"Jan  6, 2024 19:37:05.712692000 JST",,"44928  >  6000 [PSH, ACK] Seq=1 Ack=1 Win=64256 Len=27 TSval=1664403362 TSecr=2848162259 [TCP segment of a reassembled PDU]"
107,52.569879,192.168.11.35,192.168.11.22,TCP,66,0.000108,,"Jan  6, 2024 19:37:05.712800000 JST",,"44928  >  6000 [FIN, ACK] Seq=28 Ack=1 Win=64256 Len=0 TSval=1664403362 TSecr=2848162259"
108,52.585163,192.168.11.22,192.168.11.35,TCP,66,0.015284,,"Jan  6, 2024 19:37:05.728084000 JST",,6000  >  44928 [ACK] Seq=1 Ack=28 Win=65152 Len=0 TSval=2848162274 TSecr=1664403362
109,52.585553,192.168.11.22,192.168.11.35,TCP,66,0.00039,,"Jan  6, 2024 19:37:05.728474000 JST",,"6000  >  44928 [FIN, ACK] Seq=1 Ack=29 Win=65152 Len=0 TSval=2848162275 TSecr=1664403362"
110,52.585596,192.168.11.35,192.168.11.22,TCP,66,0.000043,,"Jan  6, 2024 19:37:05.728517000 JST",,44928  >  6000 [ACK] Seq=29 Ack=2 Win=64256 Len=0 TSval=1664403378 TSecr=2848162275
111,52.613118,192.168.11.35,255.255.255.255,UDP,209,0.027522,Ÿ,"Jan  6, 2024 19:37:05.756039000 JST",7b2273656d616e74696373223a207b22656e74697479223a2022504944222c202262617365656e74697479223a2022616e79222c2022726f6c65223a20227a7a7a222c20227370617469616c223a2022616e79222c202274656d706f72616c223a2022616e79227d2c20226461746170726f7065727479223a207b22666f726d6174223a2022696e616f6b615f70726f6772616d5f73616d706c655f73656d616e746963227d7d,52711  >  7000 Len=167
112,52.621992,192.168.11.34,192.168.11.35,TCP,74,0.008874,œ,"Jan  6, 2024 19:37:05.764913000 JST",,36244  >  6000 [SYN] Seq=0 Win=64240 Len=0 MSS=1460 SACK_PERM TSval=158692643 TSecr=0 WS=128
113,52.622121,192.168.11.35,192.168.11.34,TCP,74,0.000129,,"Jan  6, 2024 19:37:05.765042000 JST",,"6000  >  36244 [SYN, ACK] Seq=0 Ack=1 Win=65160 Len=0 MSS=1460 SACK_PERM TSval=548236403 TSecr=158692643 WS=128"
114,52.633841,192.168.11.34,192.168.11.35,TCP,93,0.01172,,"Jan  6, 2024 19:37:05.776762000 JST",,"36244  >  6000 [PSH, ACK] Seq=1 Ack=1 Win=64256 Len=27 TSval=158692655 TSecr=548236403 [TCP segment of a reassembled PDU]"
115,52.634067,192.168.11.35,192.168.11.34,TCP,66,0.000226,,"Jan  6, 2024 19:37:05.776988000 JST",,6000  >  36244 [ACK] Seq=1 Ack=28 Win=65152 Len=0 TSval=548236415 TSecr=158692655
116,52.634513,192.168.11.34,192.168.11.35,TCP,66,0.000446,,"Jan  6, 2024 19:37:05.777434000 JST",,36244  >  6000 [ACK] Seq=1 Ack=1 Win=64256 Len=0 TSval=158692655 TSecr=548236403
117,52.634572,192.168.11.35,192.168.11.34,TCP,66,0.000059,,"Jan  6, 2024 19:37:05.777493000 JST",,[TCP Dup ACK 115#1] 6000  >  36244 [ACK] Seq=1 Ack=28 Win=65152 Len=0 TSval=548236416 TSecr=158692655
118,52.634632,192.168.11.34,192.168.11.35,TCP,66,0.00006,,"Jan  6, 2024 19:37:05.777553000 JST",,"36244  >  6000 [FIN, ACK] Seq=28 Ack=1 Win=64256 Len=0 TSval=158692655 TSecr=548236403"
119,52.635765,192.168.11.35,192.168.11.34,TCP,66,0.001133,,"Jan  6, 2024 19:37:05.778686000 JST",,"6000  >  36244 [FIN, ACK] Seq=1 Ack=29 Win=65152 Len=0 TSval=548236417 TSecr=158692655"
120,52.643487,192.168.11.34,192.168.11.35,TCP,66,0.007722,,"Jan  6, 2024 19:37:05.786408000 JST",,36244  >  6000 [ACK] Seq=29 Ack=2 Win=64256 Len=0 TSval=158692664 TSecr=548236417
121,60.857248,192.168.11.35,192.168.11.22,TCP,74,8.213761,,"Jan  6, 2024 19:37:14.000169000 JST",,53044  >  6000 [SYN] Seq=0 Win=64240 Len=0 MSS=1460 SACK_PERM TSval=1664411649 TSecr=0 WS=128
122,60.864994,192.168.11.22,192.168.11.35,TCP,74,0.007746,,"Jan  6, 2024 19:37:14.007915000 JST",,"6000  >  53044 [SYN, ACK] Seq=0 Ack=1 Win=65160 Len=0 MSS=1460 SACK_PERM TSval=2848170554 TSecr=1664411649 WS=128"
123,60.865089,192.168.11.35,192.168.11.22,TCP,66,0.000095,,"Jan  6, 2024 19:37:14.008010000 JST",,53044  >  6000 [ACK] Seq=1 Ack=1 Win=64256 Len=0 TSval=1664411657 TSecr=2848170554
124,60.865284,192.168.11.35,192.168.11.22,TCP,93,0.000195,,"Jan  6, 2024 19:37:14.008205000 JST",,"53044  >  6000 [PSH, ACK] Seq=1 Ack=1 Win=64256 Len=27 TSval=1664411657 TSecr=2848170554 [TCP segment of a reassembled PDU]"
125,60.865376,192.168.11.35,192.168.11.22,TCP,66,0.000092,,"Jan  6, 2024 19:37:14.008297000 JST",,"53044  >  6000 [FIN, ACK] Seq=28 Ack=1 Win=64256 Len=0 TSval=1664411657 TSecr=2848170554"
126,60.872975,192.168.11.22,192.168.11.35,TCP,66,0.007599,,"Jan  6, 2024 19:37:14.015896000 JST",,6000  >  53044 [ACK] Seq=1 Ack=28 Win=65152 Len=0 TSval=2848170562 TSecr=1664411657
127,60.873198,192.168.11.22,192.168.11.35,TCP,66,0.000223,,"Jan  6, 2024 19:37:14.016119000 JST",,"6000  >  53044 [FIN, ACK] Seq=1 Ack=29 Win=65152 Len=0 TSval=2848170564 TSecr=1664411657"
128,60.873242,192.168.11.35,192.168.11.22,TCP,66,0.000044,,"Jan  6, 2024 19:37:14.016163000 JST",,53044  >  6000 [ACK] Seq=29 Ack=2 Win=64256 Len=0 TSval=1664411665 TSecr=2848170564
129,60.905619,192.168.11.35,255.255.255.255,UDP,209,0.032377,Ÿ,"Jan  6, 2024 19:37:14.048540000 JST",7b2273656d616e74696373223a207b22656e74697479223a2022504944222c202262617365656e74697479223a2022616e79222c2022726f6c65223a20227a7a7a222c20227370617469616c223a2022616e79222c202274656d706f72616c223a2022616e79227d2c20226461746170726f7065727479223a207b22666f726d6174223a2022696e616f6b615f70726f6772616d5f73616d706c655f73656d616e746963227d7d,48445  >  7000 Len=167
130,60.916563,192.168.11.34,192.168.11.35,TCP,74,0.010944,œ,"Jan  6, 2024 19:37:14.059484000 JST",,36344  >  6000 [SYN] Seq=0 Win=64240 Len=0 MSS=1460 SACK_PERM TSval=158700937 TSecr=0 WS=128
131,60.916711,192.168.11.35,192.168.11.34,TCP,74,0.000148,,"Jan  6, 2024 19:37:14.059632000 JST",,"6000  >  36344 [SYN, ACK] Seq=0 Ack=1 Win=65160 Len=0 MSS=1460 SACK_PERM TSval=548244698 TSecr=158700937 WS=128"
132,60.927323,192.168.11.34,192.168.11.35,TCP,93,0.010612,,"Jan  6, 2024 19:37:14.070244000 JST",,"36344  >  6000 [PSH, ACK] Seq=1 Ack=1 Win=64256 Len=27 TSval=158700947 TSecr=548244698 [TCP segment of a reassembled PDU]"
133,60.927672,192.168.11.35,192.168.11.34,TCP,66,0.000349,,"Jan  6, 2024 19:37:14.070593000 JST",,6000  >  36344 [ACK] Seq=1 Ack=28 Win=65152 Len=0 TSval=548244709 TSecr=158700947
134,60.928357,192.168.11.34,192.168.11.35,TCP,66,0.000685,,"Jan  6, 2024 19:37:14.071278000 JST",,36344  >  6000 [ACK] Seq=1 Ack=1 Win=64256 Len=0 TSval=158700946 TSecr=548244698
135,60.92852,192.168.11.35,192.168.11.34,TCP,66,0.000163,,"Jan  6, 2024 19:37:14.071441000 JST",,[TCP Dup ACK 133#1] 6000  >  36344 [ACK] Seq=1 Ack=28 Win=65152 Len=0 TSval=548244710 TSecr=158700947
136,60.928688,192.168.11.34,192.168.11.35,TCP,66,0.000168,,"Jan  6, 2024 19:37:14.071609000 JST",,"36344  >  6000 [FIN, ACK] Seq=28 Ack=1 Win=64256 Len=0 TSval=158700947 TSecr=548244698"
137,60.930047,192.168.11.35,192.168.11.34,TCP,66,0.001359,,"Jan  6, 2024 19:37:14.072968000 JST",,"6000  >  36344 [FIN, ACK] Seq=1 Ack=29 Win=65152 Len=0 TSval=548244711 TSecr=158700947"
138,60.937963,192.168.11.34,192.168.11.35,TCP,66,0.007916,,"Jan  6, 2024 19:37:14.080884000 JST",,36344  >  6000 [ACK] Seq=29 Ack=2 Win=64256 Len=0 TSval=158700959 TSecr=548244711
139,71.784624,192.168.11.35,192.168.11.22,TCP,74,10.846661,,"Jan  6, 2024 19:37:24.927545000 JST",,60248  >  6000 [SYN] Seq=0 Win=64240 Len=0 MSS=1460 SACK_PERM TSval=1664422577 TSecr=0 WS=128
140,71.792648,192.168.11.22,192.168.11.35,TCP,74,0.008024,,"Jan  6, 2024 19:37:24.935569000 JST",,"6000  >  60248 [SYN, ACK] Seq=0 Ack=1 Win=65160 Len=0 MSS=1460 SACK_PERM TSval=2848181482 TSecr=1664422577 WS=128"
141,71.792745,192.168.11.35,192.168.11.22,TCP,66,0.000097,,"Jan  6, 2024 19:37:24.935666000 JST",,60248  >  6000 [ACK] Seq=1 Ack=1 Win=64256 Len=0 TSval=1664422585 TSecr=2848181482
142,71.792913,192.168.11.35,192.168.11.22,TCP,93,0.000168,,"Jan  6, 2024 19:37:24.935834000 JST",,"60248  >  6000 [PSH, ACK] Seq=1 Ack=1 Win=64256 Len=27 TSval=1664422585 TSecr=2848181482 [TCP segment of a reassembled PDU]"
143,71.793007,192.168.11.35,192.168.11.22,TCP,66,0.000094,,"Jan  6, 2024 19:37:24.935928000 JST",,"60248  >  6000 [FIN, ACK] Seq=28 Ack=1 Win=64256 Len=0 TSval=1664422585 TSecr=2848181482"
144,71.800347,192.168.11.22,192.168.11.35,TCP,66,0.00734,,"Jan  6, 2024 19:37:24.943268000 JST",,6000  >  60248 [ACK] Seq=1 Ack=28 Win=65152 Len=0 TSval=2848181489 TSecr=1664422585
145,71.802893,192.168.11.22,192.168.11.35,TCP,66,0.002546,,"Jan  6, 2024 19:37:24.945814000 JST",,"6000  >  60248 [FIN, ACK] Seq=1 Ack=29 Win=65152 Len=0 TSval=2848181492 TSecr=1664422585"
146,71.802936,192.168.11.35,192.168.11.22,TCP,66,0.000043,,"Jan  6, 2024 19:37:24.945857000 JST",,60248  >  6000 [ACK] Seq=29 Ack=2 Win=64256 Len=0 TSval=1664422595 TSecr=2848181492
147,71.831519,192.168.11.35,255.255.255.255,UDP,209,0.028583,Ÿ,"Jan  6, 2024 19:37:24.974440000 JST",7b2273656d616e74696373223a207b22656e74697479223a2022504944222c202262617365656e74697479223a2022616e79222c2022726f6c65223a20227a7a7a222c20227370617469616c223a2022616e79222c202274656d706f72616c223a2022616e79227d2c20226461746170726f7065727479223a207b22666f726d6174223a2022696e616f6b615f70726f6772616d5f73616d706c655f73656d616e746963227d7d,40724  >  7000 Len=167
148,71.840748,192.168.11.34,192.168.11.35,TCP,74,0.009229,œ,"Jan  6, 2024 19:37:24.983669000 JST",,42894  >  6000 [SYN] Seq=0 Win=64240 Len=0 MSS=1460 SACK_PERM TSval=158711862 TSecr=0 WS=128
149,71.840885,192.168.11.35,192.168.11.34,TCP,74,0.000137,,"Jan  6, 2024 19:37:24.983806000 JST",,"6000  >  42894 [SYN, ACK] Seq=0 Ack=1 Win=65160 Len=0 MSS=1460 SACK_PERM TSval=548255622 TSecr=158711862 WS=128"
150,71.850187,192.168.11.34,192.168.11.35,TCP,66,0.009302,,"Jan  6, 2024 19:37:24.993108000 JST",,42894  >  6000 [ACK] Seq=1 Ack=1 Win=64256 Len=0 TSval=158711871 TSecr=548255622
151,71.850778,192.168.11.34,192.168.11.35,TCP,93,0.000591,,"Jan  6, 2024 19:37:24.993699000 JST",,"42894  >  6000 [PSH, ACK] Seq=1 Ack=1 Win=64256 Len=27 TSval=158711871 TSecr=548255622 [TCP segment of a reassembled PDU]"
152,71.850865,192.168.11.35,192.168.11.34,TCP,66,0.000087,,"Jan  6, 2024 19:37:24.993786000 JST",,6000  >  42894 [ACK] Seq=1 Ack=28 Win=65152 Len=0 TSval=548255632 TSecr=158711871
153,71.85095,192.168.11.34,192.168.11.35,TCP,66,0.000085,,"Jan  6, 2024 19:37:24.993871000 JST",,"42894  >  6000 [FIN, ACK] Seq=28 Ack=1 Win=64256 Len=0 TSval=158711871 TSecr=548255622"
154,71.852918,192.168.11.35,192.168.11.34,TCP,66,0.001968,,"Jan  6, 2024 19:37:24.995839000 JST",,"6000  >  42894 [FIN, ACK] Seq=1 Ack=29 Win=65152 Len=0 TSval=548255634 TSecr=158711871"
155,71.863007,192.168.11.34,192.168.11.35,TCP,66,0.010089,,"Jan  6, 2024 19:37:25.005928000 JST",,42894  >  6000 [ACK] Seq=29 Ack=2 Win=64256 Len=0 TSval=158711882 TSecr=548255634
156,81.674762,192.168.11.35,192.168.11.22,TCP,74,9.811755,,"Jan  6, 2024 19:37:34.817683000 JST",,58466  >  6000 [SYN] Seq=0 Win=64240 Len=0 MSS=1460 SACK_PERM TSval=1664432467 TSecr=0 WS=128
157,81.68253,192.168.11.22,192.168.11.35,TCP,74,0.007768,,"Jan  6, 2024 19:37:34.825451000 JST",,"6000  >  58466 [SYN, ACK] Seq=0 Ack=1 Win=65160 Len=0 MSS=1460 SACK_PERM TSval=2848191372 TSecr=1664432467 WS=128"
158,81.682627,192.168.11.35,192.168.11.22,TCP,66,0.000097,,"Jan  6, 2024 19:37:34.825548000 JST",,58466  >  6000 [ACK] Seq=1 Ack=1 Win=64256 Len=0 TSval=1664432475 TSecr=2848191372
159,81.68287,192.168.11.35,192.168.11.22,TCP,93,0.000243,,"Jan  6, 2024 19:37:34.825791000 JST",,"58466  >  6000 [PSH, ACK] Seq=1 Ack=1 Win=64256 Len=27 TSval=1664432475 TSecr=2848191372 [TCP segment of a reassembled PDU]"
160,81.682985,192.168.11.35,192.168.11.22,TCP,66,0.000115,,"Jan  6, 2024 19:37:34.825906000 JST",,"58466  >  6000 [FIN, ACK] Seq=28 Ack=1 Win=64256 Len=0 TSval=1664432475 TSecr=2848191372"
161,81.690399,192.168.11.22,192.168.11.35,TCP,66,0.007414,,"Jan  6, 2024 19:37:34.833320000 JST",,6000  >  58466 [ACK] Seq=1 Ack=28 Win=65152 Len=0 TSval=2848191379 TSecr=1664432475
162,81.690613,192.168.11.22,192.168.11.35,TCP,66,0.000214,,"Jan  6, 2024 19:37:34.833534000 JST",,"6000  >  58466 [FIN, ACK] Seq=1 Ack=29 Win=65152 Len=0 TSval=2848191381 TSecr=1664432475"
163,81.690659,192.168.11.35,192.168.11.22,TCP,66,0.000046,,"Jan  6, 2024 19:37:34.833580000 JST",,58466  >  6000 [ACK] Seq=29 Ack=2 Win=64256 Len=0 TSval=1664432483 TSecr=2848191381
164,81.720668,192.168.11.35,255.255.255.255,UDP,209,0.030009,Ÿ,"Jan  6, 2024 19:37:34.863589000 JST",7b2273656d616e74696373223a207b22656e74697479223a2022504944222c202262617365656e74697479223a2022616e79222c2022726f6c65223a20227a7a7a222c20227370617469616c223a2022616e79222c202274656d706f72616c223a2022616e79227d2c20226461746170726f7065727479223a207b22666f726d6174223a2022696e616f6b615f70726f6772616d5f73616d706c655f73656d616e746963227d7d,45644  >  7000 Len=167
165,81.72954,192.168.11.34,192.168.11.35,TCP,74,0.008872,œ,"Jan  6, 2024 19:37:34.872461000 JST",,32870  >  6000 [SYN] Seq=0 Win=64240 Len=0 MSS=1460 SACK_PERM TSval=158721751 TSecr=0 WS=128
166,81.72967,192.168.11.35,192.168.11.34,TCP,74,0.00013,,"Jan  6, 2024 19:37:34.872591000 JST",,"6000  >  32870 [SYN, ACK] Seq=0 Ack=1 Win=65160 Len=0 MSS=1460 SACK_PERM TSval=548265511 TSecr=158721751 WS=128"
167,81.739019,192.168.11.34,192.168.11.35,TCP,66,0.009349,,"Jan  6, 2024 19:37:34.881940000 JST",,32870  >  6000 [ACK] Seq=1 Ack=1 Win=64256 Len=0 TSval=158721760 TSecr=548265511
168,81.73999,192.168.11.34,192.168.11.35,TCP,93,0.000971,,"Jan  6, 2024 19:37:34.882911000 JST",,"32870  >  6000 [PSH, ACK] Seq=1 Ack=1 Win=64256 Len=27 TSval=158721760 TSecr=548265511 [TCP segment of a reassembled PDU]"
169,81.740177,192.168.11.35,192.168.11.34,TCP,66,0.000187,,"Jan  6, 2024 19:37:34.883098000 JST",,6000  >  32870 [ACK] Seq=1 Ack=28 Win=65152 Len=0 TSval=548265521 TSecr=158721760
170,81.740682,192.168.11.34,192.168.11.35,TCP,66,0.000505,,"Jan  6, 2024 19:37:34.883603000 JST",,"32870  >  6000 [FIN, ACK] Seq=28 Ack=1 Win=64256 Len=0 TSval=158721760 TSecr=548265511"
171,81.74162,192.168.11.35,192.168.11.34,TCP,66,0.000938,,"Jan  6, 2024 19:37:34.884541000 JST",,"6000  >  32870 [FIN, ACK] Seq=1 Ack=29 Win=65152 Len=0 TSval=548265523 TSecr=158721760"
172,81.749628,192.168.11.34,192.168.11.35,TCP,66,0.008008,,"Jan  6, 2024 19:37:34.892549000 JST",,32870  >  6000 [ACK] Seq=29 Ack=2 Win=64256 Len=0 TSval=158721770 TSecr=548265523
173,113.860055,192.168.11.35,192.168.11.22,TCP,74,32.110427,,"Jan  6, 2024 19:38:07.002976000 JST",,33610  >  6000 [SYN] Seq=0 Win=64240 Len=0 MSS=1460 SACK_PERM TSval=1664464652 TSecr=0 WS=128
174,113.866958,192.168.11.22,192.168.11.35,TCP,74,0.006903,,"Jan  6, 2024 19:38:07.009879000 JST",,"6000  >  33610 [SYN, ACK] Seq=0 Ack=1 Win=65160 Len=0 MSS=1460 SACK_PERM TSval=2848223556 TSecr=1664464652 WS=128"
175,113.867063,192.168.11.35,192.168.11.22,TCP,66,0.000105,,"Jan  6, 2024 19:38:07.009984000 JST",,33610  >  6000 [ACK] Seq=1 Ack=1 Win=64256 Len=0 TSval=1664464659 TSecr=2848223556
176,113.86723,192.168.11.35,192.168.11.22,TCP,93,0.000167,,"Jan  6, 2024 19:38:07.010151000 JST",,"33610  >  6000 [PSH, ACK] Seq=1 Ack=1 Win=64256 Len=27 TSval=1664464659 TSecr=2848223556 [TCP segment of a reassembled PDU]"
177,113.867318,192.168.11.35,192.168.11.22,TCP,66,0.000088,,"Jan  6, 2024 19:38:07.010239000 JST",,"33610  >  6000 [FIN, ACK] Seq=28 Ack=1 Win=64256 Len=0 TSval=1664464659 TSecr=2848223556"
178,113.875199,192.168.11.22,192.168.11.35,TCP,66,0.007881,,"Jan  6, 2024 19:38:07.018120000 JST",,6000  >  33610 [ACK] Seq=1 Ack=28 Win=65152 Len=0 TSval=2848223564 TSecr=1664464659
179,113.877437,192.168.11.22,192.168.11.35,TCP,66,0.002238,,"Jan  6, 2024 19:38:07.020358000 JST",,"6000  >  33610 [FIN, ACK] Seq=1 Ack=29 Win=65152 Len=0 TSval=2848223566 TSecr=1664464659"
180,113.87748,192.168.11.35,192.168.11.22,TCP,66,0.000043,,"Jan  6, 2024 19:38:07.020401000 JST",,33610  >  6000 [ACK] Seq=29 Ack=2 Win=64256 Len=0 TSval=1664464670 TSecr=2848223566
181,113.906235,192.168.11.35,255.255.255.255,UDP,209,0.028755,Ÿ,"Jan  6, 2024 19:38:07.049156000 JST",7b2273656d616e74696373223a207b22656e74697479223a2022504944222c202262617365656e74697479223a2022616e79222c2022726f6c65223a20227a7a7a222c20227370617469616c223a2022616e79222c202274656d706f72616c223a2022616e79227d2c20226461746170726f7065727479223a207b22666f726d6174223a2022696e616f6b615f70726f6772616d5f73616d706c655f73656d616e746963227d7d,51979  >  7000 Len=167
182,113.91481,192.168.11.34,192.168.11.35,TCP,74,0.008575,œ,"Jan  6, 2024 19:38:07.057731000 JST",,57630  >  6000 [SYN] Seq=0 Win=64240 Len=0 MSS=1460 SACK_PERM TSval=158753936 TSecr=0 WS=128
183,113.914948,192.168.11.35,192.168.11.34,TCP,74,0.000138,,"Jan  6, 2024 19:38:07.057869000 JST",,"6000  >  57630 [SYN, ACK] Seq=0 Ack=1 Win=65160 Len=0 MSS=1460 SACK_PERM TSval=548297696 TSecr=158753936 WS=128"
184,113.924153,192.168.11.34,192.168.11.35,TCP,93,0.009205,,"Jan  6, 2024 19:38:07.067074000 JST",,"57630  >  6000 [PSH, ACK] Seq=1 Ack=1 Win=64256 Len=27 TSval=158753945 TSecr=548297696 [TCP segment of a reassembled PDU]"
185,113.924411,192.168.11.35,192.168.11.34,TCP,66,0.000258,,"Jan  6, 2024 19:38:07.067332000 JST",,6000  >  57630 [ACK] Seq=1 Ack=28 Win=65152 Len=0 TSval=548297705 TSecr=158753945
186,113.925086,192.168.11.34,192.168.11.35,TCP,66,0.000675,,"Jan  6, 2024 19:38:07.068007000 JST",,57630  >  6000 [ACK] Seq=1 Ack=1 Win=64256 Len=0 TSval=158753945 TSecr=548297696
187,113.925243,192.168.11.35,192.168.11.34,TCP,66,0.000157,,"Jan  6, 2024 19:38:07.068164000 JST",,[TCP Dup ACK 185#1] 6000  >  57630 [ACK] Seq=1 Ack=28 Win=65152 Len=0 TSval=548297706 TSecr=158753945
188,113.925345,192.168.11.34,192.168.11.35,TCP,66,0.000102,,"Jan  6, 2024 19:38:07.068266000 JST",,"57630  >  6000 [FIN, ACK] Seq=28 Ack=1 Win=64256 Len=0 TSval=158753945 TSecr=548297696"
189,113.926464,192.168.11.35,192.168.11.34,TCP,66,0.001119,,"Jan  6, 2024 19:38:07.069385000 JST",,"6000  >  57630 [FIN, ACK] Seq=1 Ack=29 Win=65152 Len=0 TSval=548297708 TSecr=158753945"
190,113.940772,192.168.11.34,192.168.11.35,TCP,66,0.014308,,"Jan  6, 2024 19:38:07.083693000 JST",,57630  >  6000 [ACK] Seq=29 Ack=2 Win=64256 Len=0 TSval=158753956 TSecr=548297708
191,121.72493,192.168.11.35,192.168.11.22,TCP,74,7.784158,,"Jan  6, 2024 19:38:14.867851000 JST",,33612  >  6000 [SYN] Seq=0 Win=64240 Len=0 MSS=1460 SACK_PERM TSval=1664472517 TSecr=0 WS=128
192,121.732131,192.168.11.22,192.168.11.35,TCP,74,0.007201,,"Jan  6, 2024 19:38:14.875052000 JST",,"6000  >  33612 [SYN, ACK] Seq=0 Ack=1 Win=65160 Len=0 MSS=1460 SACK_PERM TSval=2848231421 TSecr=1664472517 WS=128"
193,121.732232,192.168.11.35,192.168.11.22,TCP,66,0.000101,,"Jan  6, 2024 19:38:14.875153000 JST",,33612  >  6000 [ACK] Seq=1 Ack=1 Win=64256 Len=0 TSval=1664472524 TSecr=2848231421
194,121.732555,192.168.11.35,192.168.11.22,TCP,93,0.000323,,"Jan  6, 2024 19:38:14.875476000 JST",,"33612  >  6000 [PSH, ACK] Seq=1 Ack=1 Win=64256 Len=27 TSval=1664472525 TSecr=2848231421 [TCP segment of a reassembled PDU]"
195,121.732658,192.168.11.35,192.168.11.22,TCP,66,0.000103,,"Jan  6, 2024 19:38:14.875579000 JST",,"33612  >  6000 [FIN, ACK] Seq=28 Ack=1 Win=64256 Len=0 TSval=1664472525 TSecr=2848231421"
196,121.739866,192.168.11.22,192.168.11.35,TCP,66,0.007208,,"Jan  6, 2024 19:38:14.882787000 JST",,6000  >  33612 [ACK] Seq=1 Ack=28 Win=65152 Len=0 TSval=2848231429 TSecr=1664472525
197,121.740106,192.168.11.22,192.168.11.35,TCP,66,0.00024,,"Jan  6, 2024 19:38:14.883027000 JST",,"6000  >  33612 [FIN, ACK] Seq=1 Ack=29 Win=65152 Len=0 TSval=2848231430 TSecr=1664472525"
198,121.740157,192.168.11.35,192.168.11.22,TCP,66,0.000051,,"Jan  6, 2024 19:38:14.883078000 JST",,33612  >  6000 [ACK] Seq=29 Ack=2 Win=64256 Len=0 TSval=1664472532 TSecr=2848231430
199,121.77021,192.168.11.35,255.255.255.255,UDP,209,0.030053,Ÿ,"Jan  6, 2024 19:38:14.913131000 JST",7b2273656d616e74696373223a207b22656e74697479223a2022504944222c202262617365656e74697479223a2022616e79222c2022726f6c65223a20227a7a7a222c20227370617469616c223a2022616e79222c202274656d706f72616c223a2022616e79227d2c20226461746170726f7065727479223a207b22666f726d6174223a2022696e616f6b615f70726f6772616d5f73616d706c655f73656d616e746963227d7d,53162  >  7000 Len=167
200,121.779094,192.168.11.34,192.168.11.35,TCP,74,0.008884,œ,"Jan  6, 2024 19:38:14.922015000 JST",,50598  >  6000 [SYN] Seq=0 Win=64240 Len=0 MSS=1460 SACK_PERM TSval=158761800 TSecr=0 WS=128
201,121.779247,192.168.11.35,192.168.11.34,TCP,74,0.000153,,"Jan  6, 2024 19:38:14.922168000 JST",,"6000  >  50598 [SYN, ACK] Seq=0 Ack=1 Win=65160 Len=0 MSS=1460 SACK_PERM TSval=548305560 TSecr=158761800 WS=128"
202,121.789744,192.168.11.34,192.168.11.35,TCP,66,0.010497,,"Jan  6, 2024 19:38:14.932665000 JST",,50598  >  6000 [ACK] Seq=1 Ack=1 Win=64256 Len=0 TSval=158761809 TSecr=548305560
203,121.790278,192.168.11.34,192.168.11.35,TCP,93,0.000534,,"Jan  6, 2024 19:38:14.933199000 JST",,"50598  >  6000 [PSH, ACK] Seq=1 Ack=1 Win=64256 Len=27 TSval=158761809 TSecr=548305560 [TCP segment of a reassembled PDU]"
204,121.790352,192.168.11.35,192.168.11.34,TCP,66,0.000074,,"Jan  6, 2024 19:38:14.933273000 JST",,6000  >  50598 [ACK] Seq=1 Ack=28 Win=65152 Len=0 TSval=548305571 TSecr=158761809
205,121.790421,192.168.11.34,192.168.11.35,TCP,66,0.000069,,"Jan  6, 2024 19:38:14.933342000 JST",,"50598  >  6000 [FIN, ACK] Seq=28 Ack=1 Win=64256 Len=0 TSval=158761809 TSecr=548305560"
206,121.791629,192.168.11.35,192.168.11.34,TCP,66,0.001208,,"Jan  6, 2024 19:38:14.934550000 JST",,"6000  >  50598 [FIN, ACK] Seq=1 Ack=29 Win=65152 Len=0 TSval=548305573 TSecr=158761809"
207,121.799264,192.168.11.34,192.168.11.35,TCP,66,0.007635,,"Jan  6, 2024 19:38:14.942185000 JST",,50598  >  6000 [ACK] Seq=29 Ack=2 Win=64256 Len=0 TSval=158761820 TSecr=548305573
208,129.568015,192.168.11.35,192.168.11.22,TCP,74,7.768751,,"Jan  6, 2024 19:38:22.710936000 JST",,58712  >  6000 [SYN] Seq=0 Win=64240 Len=0 MSS=1460 SACK_PERM TSval=1664480360 TSecr=0 WS=128
209,129.574289,192.168.11.22,192.168.11.35,TCP,74,0.006274,,"Jan  6, 2024 19:38:22.717210000 JST",,"6000  >  58712 [SYN, ACK] Seq=0 Ack=1 Win=65160 Len=0 MSS=1460 SACK_PERM TSval=2848239264 TSecr=1664480360 WS=128"
210,129.574344,192.168.11.35,192.168.11.22,TCP,66,0.000055,,"Jan  6, 2024 19:38:22.717265000 JST",,58712  >  6000 [ACK] Seq=1 Ack=1 Win=64256 Len=0 TSval=1664480366 TSecr=2848239264
211,129.574434,192.168.11.35,192.168.11.22,TCP,93,0.00009,,"Jan  6, 2024 19:38:22.717355000 JST",,"58712  >  6000 [PSH, ACK] Seq=1 Ack=1 Win=64256 Len=27 TSval=1664480367 TSecr=2848239264 [TCP segment of a reassembled PDU]"
212,129.574477,192.168.11.35,192.168.11.22,TCP,66,0.000043,,"Jan  6, 2024 19:38:22.717398000 JST",,"58712  >  6000 [FIN, ACK] Seq=28 Ack=1 Win=64256 Len=0 TSval=1664480367 TSecr=2848239264"
