No.,Time,Source,Destination,Protocol,Length,Time delta from previous captured frame,XXX,Data,Info
1,0,192.168.11.8,192.168.11.13,TCP,74,0,,,51146  >  6000 [SYN] Seq=0 Win=64240 Len=0 MSS=1460 SACK_PERM TSval=1728182267 TSecr=0 WS=128
2,0.007066,192.168.11.13,192.168.11.8,TCP,74,0.007066,,,"6000  >  51146 [SYN, ACK] Seq=0 Ack=1 Win=65160 Len=0 MSS=1460 SACK_PERM TSval=918855957 TSecr=1728182267 WS=128"
3,0.007167,192.168.11.8,192.168.11.13,TCP,66,0.000101,,,51146  >  6000 [ACK] Seq=1 Ack=1 Win=64256 Len=0 TSval=1728182278 TSecr=918855957
4,0.007386,192.168.11.8,192.168.11.13,TCP,93,0.000219,,,"51146  >  6000 [PSH, ACK] Seq=1 Ack=1 Win=64256 Len=27 TSval=1728182278 TSecr=918855957 [TCP segment of a reassembled PDU]"
5,0.007506,192.168.11.8,192.168.11.13,TCP,66,0.00012,,,"51146  >  6000 [FIN, ACK] Seq=28 Ack=1 Win=64256 Len=0 TSval=1728182278 TSecr=918855957"
6,0.022246,192.168.11.13,192.168.11.8,TCP,66,0.01474,,,6000  >  51146 [ACK] Seq=1 Ack=28 Win=65152 Len=0 TSval=918855972 TSecr=1728182278
7,0.02269,192.168.11.13,192.168.11.8,TCP,66,0.000444,,,"6000  >  51146 [FIN, ACK] Seq=1 Ack=29 Win=65152 Len=0 TSval=918855974 TSecr=1728182278"
8,0.022735,192.168.11.8,192.168.11.13,TCP,66,0.000045,,,51146  >  6000 [ACK] Seq=29 Ack=2 Win=64256 Len=0 TSval=1728182293 TSecr=918855974
9,0.049935,192.168.11.8,255.255.255.255,UDP,209,0.0272,Ÿ,7b2273656d616e74696373223a207b22656e74697479223a2022504944222c202262617365656e74697479223a2022616e79222c2022726f6c65223a2022646464222c20227370617469616c223a2022616e79222c202274656d706f72616c223a2022616e79227d2c20226461746170726f7065727479223a207b22666f726d6174223a2022696e616f6b615f70726f6772616d5f73616d706c655f73656d616e746963227d7d,53690  >  7000 Len=167
10,0.058111,192.168.11.23,192.168.11.8,TCP,74,0.008176,œ,,59358  >  6000 [SYN] Seq=0 Win=64240 Len=0 MSS=1460 SACK_PERM TSval=2801384558 TSecr=0 WS=128
11,0.058223,192.168.11.8,192.168.11.23,TCP,74,0.000112,,,"6000  >  59358 [SYN, ACK] Seq=0 Ack=1 Win=65160 Len=0 MSS=1460 SACK_PERM TSval=3797638933 TSecr=2801384558 WS=128"
12,0.064879,192.168.11.23,192.168.11.8,TCP,66,0.006656,,,59358  >  6000 [ACK] Seq=1 Ack=1 Win=64256 Len=0 TSval=2801384567 TSecr=3797638933
13,0.065482,192.168.11.23,192.168.11.8,TCP,93,0.000603,,,"59358  >  6000 [PSH, ACK] Seq=1 Ack=1 Win=64256 Len=27 TSval=2801384567 TSecr=3797638933 [TCP segment of a reassembled PDU]"
14,0.065567,192.168.11.8,192.168.11.23,TCP,66,0.000085,,,6000  >  59358 [ACK] Seq=1 Ack=28 Win=65152 Len=0 TSval=3797638940 TSecr=2801384567
15,0.065635,192.168.11.23,192.168.11.8,TCP,66,0.000068,,,"59358  >  6000 [FIN, ACK] Seq=28 Ack=1 Win=64256 Len=0 TSval=2801384567 TSecr=3797638933"
16,0.06766,192.168.11.8,192.168.11.23,TCP,66,0.002025,,,"6000  >  59358 [FIN, ACK] Seq=1 Ack=29 Win=65152 Len=0 TSval=3797638942 TSecr=2801384567"
17,0.072212,192.168.11.23,192.168.11.8,TCP,66,0.004552,,,59358  >  6000 [ACK] Seq=29 Ack=2 Win=64256 Len=0 TSval=2801384575 TSecr=3797638942
18,7.34986,192.168.11.8,192.168.11.13,TCP,74,7.277648,,,55280  >  6000 [SYN] Seq=0 Win=64240 Len=0 MSS=1460 SACK_PERM TSval=1728189620 TSecr=0 WS=128
19,7.359254,192.168.11.13,192.168.11.8,TCP,74,0.009394,,,"6000  >  55280 [SYN, ACK] Seq=0 Ack=1 Win=65160 Len=0 MSS=1460 SACK_PERM TSval=918863307 TSecr=1728189620 WS=128"
20,7.359349,192.168.11.8,192.168.11.13,TCP,66,0.000095,,,55280  >  6000 [ACK] Seq=1 Ack=1 Win=64256 Len=0 TSval=1728189630 TSecr=918863307
21,7.359511,192.168.11.8,192.168.11.13,TCP,93,0.000162,,,"55280  >  6000 [PSH, ACK] Seq=1 Ack=1 Win=64256 Len=27 TSval=1728189630 TSecr=918863307 [TCP segment of a reassembled PDU]"
22,7.359647,192.168.11.8,192.168.11.13,TCP,66,0.000136,,,"55280  >  6000 [FIN, ACK] Seq=28 Ack=1 Win=64256 Len=0 TSval=1728189630 TSecr=918863307"
23,7.377464,192.168.11.13,192.168.11.8,TCP,66,0.017817,,,6000  >  55280 [ACK] Seq=1 Ack=28 Win=65152 Len=0 TSval=918863328 TSecr=1728189630
24,7.377843,192.168.11.13,192.168.11.8,TCP,66,0.000379,,,"6000  >  55280 [FIN, ACK] Seq=1 Ack=29 Win=65152 Len=0 TSval=918863329 TSecr=1728189630"
25,7.377889,192.168.11.8,192.168.11.13,TCP,66,0.000046,,,55280  >  6000 [ACK] Seq=29 Ack=2 Win=64256 Len=0 TSval=1728189649 TSecr=918863329
26,7.404616,192.168.11.8,255.255.255.255,UDP,209,0.026727,Ÿ,7b2273656d616e74696373223a207b22656e74697479223a2022504944222c202262617365656e74697479223a2022616e79222c2022726f6c65223a2022646464222c20227370617469616c223a2022616e79222c202274656d706f72616c223a2022616e79227d2c20226461746170726f7065727479223a207b22666f726d6174223a2022696e616f6b615f70726f6772616d5f73616d706c655f73656d616e746963227d7d,45445  >  7000 Len=167
27,7.410276,192.168.11.23,192.168.11.8,TCP,74,0.00566,œ,,59366  >  6000 [SYN] Seq=0 Win=64240 Len=0 MSS=1460 SACK_PERM TSval=2801391913 TSecr=0 WS=128
28,7.410382,192.168.11.8,192.168.11.23,TCP,74,0.000106,,,"6000  >  59366 [SYN, ACK] Seq=0 Ack=1 Win=65160 Len=0 MSS=1460 SACK_PERM TSval=3797646285 TSecr=2801391913 WS=128"
29,7.417086,192.168.11.23,192.168.11.8,TCP,66,0.006704,,,59366  >  6000 [ACK] Seq=1 Ack=1 Win=64256 Len=0 TSval=2801391920 TSecr=3797646285
30,7.41757,192.168.11.23,192.168.11.8,TCP,93,0.000484,,,"59366  >  6000 [PSH, ACK] Seq=1 Ack=1 Win=64256 Len=27 TSval=2801391920 TSecr=3797646285 [TCP segment of a reassembled PDU]"
31,7.417656,192.168.11.8,192.168.11.23,TCP,66,0.000086,,,6000  >  59366 [ACK] Seq=1 Ack=28 Win=65152 Len=0 TSval=3797646292 TSecr=2801391920
32,7.417714,192.168.11.23,192.168.11.8,TCP,66,0.000058,,,"59366  >  6000 [FIN, ACK] Seq=28 Ack=1 Win=64256 Len=0 TSval=2801391920 TSecr=3797646285"
33,7.422187,192.168.11.8,192.168.11.23,TCP,66,0.004473,,,"6000  >  59366 [FIN, ACK] Seq=1 Ack=29 Win=65152 Len=0 TSval=3797646297 TSecr=2801391920"
34,7.430159,192.168.11.23,192.168.11.8,TCP,66,0.007972,,,59366  >  6000 [ACK] Seq=29 Ack=2 Win=64256 Len=0 TSval=2801391932 TSecr=3797646297
35,14.709239,192.168.11.8,192.168.11.13,TCP,74,7.27908,,,59726  >  6000 [SYN] Seq=0 Win=64240 Len=0 MSS=1460 SACK_PERM TSval=1728196980 TSecr=0 WS=128
36,14.716215,192.168.11.13,192.168.11.8,TCP,74,0.006976,,,"6000  >  59726 [SYN, ACK] Seq=0 Ack=1 Win=65160 Len=0 MSS=1460 SACK_PERM TSval=918870667 TSecr=1728196980 WS=128"
37,14.716311,192.168.11.8,192.168.11.13,TCP,66,0.000096,,,59726  >  6000 [ACK] Seq=1 Ack=1 Win=64256 Len=0 TSval=1728196987 TSecr=918870667
38,14.716445,192.168.11.8,192.168.11.13,TCP,93,0.000134,,,"59726  >  6000 [PSH, ACK] Seq=1 Ack=1 Win=64256 Len=27 TSval=1728196987 TSecr=918870667 [TCP segment of a reassembled PDU]"
39,14.716555,192.168.11.8,192.168.11.13,TCP,66,0.00011,,,"59726  >  6000 [FIN, ACK] Seq=28 Ack=1 Win=64256 Len=0 TSval=1728196987 TSecr=918870667"
40,14.724045,192.168.11.13,192.168.11.8,TCP,66,0.00749,,,6000  >  59726 [ACK] Seq=1 Ack=28 Win=65152 Len=0 TSval=918870675 TSecr=1728196987
41,14.724262,192.168.11.13,192.168.11.8,TCP,66,0.000217,,,"6000  >  59726 [FIN, ACK] Seq=1 Ack=29 Win=65152 Len=0 TSval=918870676 TSecr=1728196987"
42,14.724307,192.168.11.8,192.168.11.13,TCP,66,0.000045,,,59726  >  6000 [ACK] Seq=29 Ack=2 Win=64256 Len=0 TSval=1728196995 TSecr=918870676
43,14.752057,192.168.11.8,255.255.255.255,UDP,209,0.02775,Ÿ,7b2273656d616e74696373223a207b22656e74697479223a2022504944222c202262617365656e74697479223a2022616e79222c2022726f6c65223a2022646464222c20227370617469616c223a2022616e79222c202274656d706f72616c223a2022616e79227d2c20226461746170726f7065727479223a207b22666f726d6174223a2022696e616f6b615f70726f6772616d5f73616d706c655f73656d616e746963227d7d,49718  >  7000 Len=167
44,14.765902,192.168.11.23,192.168.11.8,TCP,74,0.013845,œ,,36232  >  6000 [SYN] Seq=0 Win=64240 Len=0 MSS=1460 SACK_PERM TSval=2801399261 TSecr=0 WS=128
45,14.766027,192.168.11.8,192.168.11.23,TCP,74,0.000125,,,"6000  >  36232 [SYN, ACK] Seq=0 Ack=1 Win=65160 Len=0 MSS=1460 SACK_PERM TSval=3797653641 TSecr=2801399261 WS=128"
46,14.773281,192.168.11.23,192.168.11.8,TCP,66,0.007254,,,36232  >  6000 [ACK] Seq=1 Ack=1 Win=64256 Len=0 TSval=2801399276 TSecr=3797653641
47,14.773827,192.168.11.23,192.168.11.8,TCP,93,0.000546,,,"36232  >  6000 [PSH, ACK] Seq=1 Ack=1 Win=64256 Len=27 TSval=2801399276 TSecr=3797653641 [TCP segment of a reassembled PDU]"
48,14.773929,192.168.11.8,192.168.11.23,TCP,66,0.000102,,,6000  >  36232 [ACK] Seq=1 Ack=28 Win=65152 Len=0 TSval=3797653649 TSecr=2801399276
49,14.774011,192.168.11.23,192.168.11.8,TCP,66,0.000082,,,"36232  >  6000 [FIN, ACK] Seq=28 Ack=1 Win=64256 Len=0 TSval=2801399276 TSecr=3797653641"
50,14.77516,192.168.11.8,192.168.11.23,TCP,66,0.001149,,,"6000  >  36232 [FIN, ACK] Seq=1 Ack=29 Win=65152 Len=0 TSval=3797653650 TSecr=2801399276"
51,14.781154,192.168.11.23,192.168.11.8,TCP,66,0.005994,,,36232  >  6000 [ACK] Seq=29 Ack=2 Win=64256 Len=0 TSval=2801399284 TSecr=3797653650
52,21.9158,192.168.11.8,192.168.11.13,TCP,74,7.134646,,,56706  >  6000 [SYN] Seq=0 Win=64240 Len=0 MSS=1460 SACK_PERM TSval=1728204186 TSecr=0 WS=128
53,21.922461,192.168.11.13,192.168.11.8,TCP,74,0.006661,,,"6000  >  56706 [SYN, ACK] Seq=0 Ack=1 Win=65160 Len=0 MSS=1460 SACK_PERM TSval=918877874 TSecr=1728204186 WS=128"
54,21.922568,192.168.11.8,192.168.11.13,TCP,66,0.000107,,,56706  >  6000 [ACK] Seq=1 Ack=1 Win=64256 Len=0 TSval=1728204193 TSecr=918877874
55,21.922739,192.168.11.8,192.168.11.13,TCP,93,0.000171,,,"56706  >  6000 [PSH, ACK] Seq=1 Ack=1 Win=64256 Len=27 TSval=1728204193 TSecr=918877874 [TCP segment of a reassembled PDU]"
56,21.922828,192.168.11.8,192.168.11.13,TCP,66,0.000089,,,"56706  >  6000 [FIN, ACK] Seq=28 Ack=1 Win=64256 Len=0 TSval=1728204193 TSecr=918877874"
57,21.929683,192.168.11.13,192.168.11.8,TCP,66,0.006855,,,6000  >  56706 [ACK] Seq=1 Ack=28 Win=65152 Len=0 TSval=918877881 TSecr=1728204193
58,21.930054,192.168.11.13,192.168.11.8,TCP,66,0.000371,,,"6000  >  56706 [FIN, ACK] Seq=1 Ack=29 Win=65152 Len=0 TSval=918877882 TSecr=1728204193"
59,21.930098,192.168.11.8,192.168.11.13,TCP,66,0.000044,,,56706  >  6000 [ACK] Seq=29 Ack=2 Win=64256 Len=0 TSval=1728204201 TSecr=918877882
60,21.95805,192.168.11.8,255.255.255.255,UDP,209,0.027952,Ÿ,7b2273656d616e74696373223a207b22656e74697479223a2022504944222c202262617365656e74697479223a2022616e79222c2022726f6c65223a2022646464222c20227370617469616c223a2022616e79222c202274656d706f72616c223a2022616e79227d2c20226461746170726f7065727479223a207b22666f726d6174223a2022696e616f6b615f70726f6772616d5f73616d706c655f73656d616e746963227d7d,35692  >  7000 Len=167
61,21.964114,192.168.11.23,192.168.11.8,TCP,74,0.006064,œ,,38216  >  6000 [SYN] Seq=0 Win=64240 Len=0 MSS=1460 SACK_PERM TSval=2801406467 TSecr=0 WS=128
62,21.964235,192.168.11.8,192.168.11.23,TCP,74,0.000121,,,"6000  >  38216 [SYN, ACK] Seq=0 Ack=1 Win=65160 Len=0 MSS=1460 SACK_PERM TSval=3797660839 TSecr=2801406467 WS=128"
63,21.970875,192.168.11.23,192.168.11.8,TCP,66,0.00664,,,38216  >  6000 [ACK] Seq=1 Ack=1 Win=64256 Len=0 TSval=2801406474 TSecr=3797660839
64,21.971393,192.168.11.23,192.168.11.8,TCP,93,0.000518,,,"38216  >  6000 [PSH, ACK] Seq=1 Ack=1 Win=64256 Len=27 TSval=2801406474 TSecr=3797660839 [TCP segment of a reassembled PDU]"
65,21.971457,192.168.11.8,192.168.11.23,TCP,66,0.000064,,,6000  >  38216 [ACK] Seq=1 Ack=28 Win=65152 Len=0 TSval=3797660846 TSecr=2801406474
66,21.971674,192.168.11.23,192.168.11.8,TCP,66,0.000217,,,"38216  >  6000 [FIN, ACK] Seq=28 Ack=1 Win=64256 Len=0 TSval=2801406474 TSecr=3797660839"
67,21.972571,192.168.11.8,192.168.11.23,TCP,66,0.000897,,,"6000  >  38216 [FIN, ACK] Seq=1 Ack=29 Win=65152 Len=0 TSval=3797660847 TSecr=2801406474"
68,21.979922,192.168.11.23,192.168.11.8,TCP,66,0.007351,,,38216  >  6000 [ACK] Seq=29 Ack=2 Win=64256 Len=0 TSval=2801406483 TSecr=3797660847
69,29.153344,192.168.11.8,192.168.11.13,TCP,74,7.173422,,,56712  >  6000 [SYN] Seq=0 Win=64240 Len=0 MSS=1460 SACK_PERM TSval=1728211424 TSecr=0 WS=128
70,29.160386,192.168.11.13,192.168.11.8,TCP,74,0.007042,,,"6000  >  56712 [SYN, ACK] Seq=0 Ack=1 Win=65160 Len=0 MSS=1460 SACK_PERM TSval=918885112 TSecr=1728211424 WS=128"
71,29.160489,192.168.11.8,192.168.11.13,TCP,66,0.000103,,,56712  >  6000 [ACK] Seq=1 Ack=1 Win=64256 Len=0 TSval=1728211431 TSecr=918885112
72,29.16062,192.168.11.8,192.168.11.13,TCP,93,0.000131,,,"56712  >  6000 [PSH, ACK] Seq=1 Ack=1 Win=64256 Len=27 TSval=1728211431 TSecr=918885112 [TCP segment of a reassembled PDU]"
73,29.160698,192.168.11.8,192.168.11.13,TCP,66,0.000078,,,"56712  >  6000 [FIN, ACK] Seq=28 Ack=1 Win=64256 Len=0 TSval=1728211431 TSecr=918885112"
74,29.168264,192.168.11.13,192.168.11.8,TCP,66,0.007566,,,6000  >  56712 [ACK] Seq=1 Ack=28 Win=65152 Len=0 TSval=918885120 TSecr=1728211431
75,29.168576,192.168.11.13,192.168.11.8,TCP,66,0.000312,,,"6000  >  56712 [FIN, ACK] Seq=1 Ack=29 Win=65152 Len=0 TSval=918885121 TSecr=1728211431"
76,29.168638,192.168.11.8,192.168.11.13,TCP,66,0.000062,,,56712  >  6000 [ACK] Seq=29 Ack=2 Win=64256 Len=0 TSval=1728211439 TSecr=918885121
77,29.195736,192.168.11.8,255.255.255.255,UDP,209,0.027098,Ÿ,7b2273656d616e74696373223a207b22656e74697479223a2022504944222c202262617365656e74697479223a2022616e79222c2022726f6c65223a2022646464222c20227370617469616c223a2022616e79222c202274656d706f72616c223a2022616e79227d2c20226461746170726f7065727479223a207b22666f726d6174223a2022696e616f6b615f70726f6772616d5f73616d706c655f73656d616e746963227d7d,58719  >  7000 Len=167
78,29.202411,192.168.11.23,192.168.11.8,TCP,74,0.006675,œ,,56666  >  6000 [SYN] Seq=0 Win=64240 Len=0 MSS=1460 SACK_PERM TSval=2801413705 TSecr=0 WS=128
79,29.202533,192.168.11.8,192.168.11.23,TCP,74,0.000122,,,"6000  >  56666 [SYN, ACK] Seq=0 Ack=1 Win=65160 Len=0 MSS=1460 SACK_PERM TSval=3797668077 TSecr=2801413705 WS=128"
80,29.209168,192.168.11.23,192.168.11.8,TCP,66,0.006635,,,56666  >  6000 [ACK] Seq=1 Ack=1 Win=64256 Len=0 TSval=2801413713 TSecr=3797668077
81,29.209718,192.168.11.23,192.168.11.8,TCP,93,0.00055,,,"56666  >  6000 [PSH, ACK] Seq=1 Ack=1 Win=64256 Len=27 TSval=2801413713 TSecr=3797668077 [TCP segment of a reassembled PDU]"
82,29.209808,192.168.11.8,192.168.11.23,TCP,66,0.00009,,,6000  >  56666 [ACK] Seq=1 Ack=28 Win=65152 Len=0 TSval=3797668084 TSecr=2801413713
83,29.20989,192.168.11.23,192.168.11.8,TCP,66,0.000082,,,"56666  >  6000 [FIN, ACK] Seq=28 Ack=1 Win=64256 Len=0 TSval=2801413713 TSecr=3797668077"
84,29.21073,192.168.11.8,192.168.11.23,TCP,66,0.00084,,,"6000  >  56666 [FIN, ACK] Seq=1 Ack=29 Win=65152 Len=0 TSval=3797668085 TSecr=2801413713"
85,29.217076,192.168.11.23,192.168.11.8,TCP,66,0.006346,,,56666  >  6000 [ACK] Seq=29 Ack=2 Win=64256 Len=0 TSval=2801413721 TSecr=3797668085
86,36.301578,192.168.11.8,192.168.11.13,TCP,74,7.084502,,,59088  >  6000 [SYN] Seq=0 Win=64240 Len=0 MSS=1460 SACK_PERM TSval=1728218572 TSecr=0 WS=128
87,36.308187,192.168.11.13,192.168.11.8,TCP,74,0.006609,,,"6000  >  59088 [SYN, ACK] Seq=0 Ack=1 Win=65160 Len=0 MSS=1460 SACK_PERM TSval=918892260 TSecr=1728218572 WS=128"
88,36.308293,192.168.11.8,192.168.11.13,TCP,66,0.000106,,,59088  >  6000 [ACK] Seq=1 Ack=1 Win=64256 Len=0 TSval=1728218579 TSecr=918892260
89,36.308491,192.168.11.8,192.168.11.13,TCP,93,0.000198,,,"59088  >  6000 [PSH, ACK] Seq=1 Ack=1 Win=64256 Len=27 TSval=1728218579 TSecr=918892260 [TCP segment of a reassembled PDU]"
90,36.308593,192.168.11.8,192.168.11.13,TCP,66,0.000102,,,"59088  >  6000 [FIN, ACK] Seq=28 Ack=1 Win=64256 Len=0 TSval=1728218579 TSecr=918892260"
91,36.315659,192.168.11.13,192.168.11.8,TCP,66,0.007066,,,6000  >  59088 [ACK] Seq=1 Ack=28 Win=65152 Len=0 TSval=918892268 TSecr=1728218579
92,36.316024,192.168.11.13,192.168.11.8,TCP,66,0.000365,,,"6000  >  59088 [FIN, ACK] Seq=1 Ack=29 Win=65152 Len=0 TSval=918892269 TSecr=1728218579"
93,36.316086,192.168.11.8,192.168.11.13,TCP,66,0.000062,,,59088  >  6000 [ACK] Seq=29 Ack=2 Win=64256 Len=0 TSval=1728218587 TSecr=918892269
94,36.351965,192.168.11.8,255.255.255.255,UDP,209,0.035879,Ÿ,7b2273656d616e74696373223a207b22656e74697479223a2022504944222c202262617365656e74697479223a2022616e79222c2022726f6c65223a2022646464222c20227370617469616c223a2022616e79222c202274656d706f72616c223a2022616e79227d2c20226461746170726f7065727479223a207b22666f726d6174223a2022696e616f6b615f70726f6772616d5f73616d706c655f73656d616e746963227d7d,42230  >  7000 Len=167
95,36.358102,192.168.11.23,192.168.11.8,TCP,74,0.006137,œ,,56678  >  6000 [SYN] Seq=0 Win=64240 Len=0 MSS=1460 SACK_PERM TSval=2801420862 TSecr=0 WS=128
96,36.358213,192.168.11.8,192.168.11.23,TCP,74,0.000111,,,"6000  >  56678 [SYN, ACK] Seq=0 Ack=1 Win=65160 Len=0 MSS=1460 SACK_PERM TSval=3797675233 TSecr=2801420862 WS=128"
97,36.364972,192.168.11.23,192.168.11.8,TCP,66,0.006759,,,56678  >  6000 [ACK] Seq=1 Ack=1 Win=64256 Len=0 TSval=2801420869 TSecr=3797675233
98,36.365357,192.168.11.23,192.168.11.8,TCP,93,0.000385,,,"56678  >  6000 [PSH, ACK] Seq=1 Ack=1 Win=64256 Len=27 TSval=2801420869 TSecr=3797675233 [TCP segment of a reassembled PDU]"
99,36.365432,192.168.11.8,192.168.11.23,TCP,66,0.000075,,,6000  >  56678 [ACK] Seq=1 Ack=28 Win=65152 Len=0 TSval=3797675240 TSecr=2801420869
100,36.365699,192.168.11.23,192.168.11.8,TCP,66,0.000267,,,"56678  >  6000 [FIN, ACK] Seq=28 Ack=1 Win=64256 Len=0 TSval=2801420869 TSecr=3797675233"
101,36.366731,192.168.11.8,192.168.11.23,TCP,66,0.001032,,,"6000  >  56678 [FIN, ACK] Seq=1 Ack=29 Win=65152 Len=0 TSval=3797675241 TSecr=2801420869"
102,36.374706,192.168.11.23,192.168.11.8,TCP,66,0.007975,,,56678  >  6000 [ACK] Seq=29 Ack=2 Win=64256 Len=0 TSval=2801420877 TSecr=3797675241
103,43.499585,192.168.11.8,192.168.11.13,TCP,74,7.124879,,,55246  >  6000 [SYN] Seq=0 Win=64240 Len=0 MSS=1460 SACK_PERM TSval=1728225770 TSecr=0 WS=128
104,43.506624,192.168.11.13,192.168.11.8,TCP,74,0.007039,,,"6000  >  55246 [SYN, ACK] Seq=0 Ack=1 Win=65160 Len=0 MSS=1460 SACK_PERM TSval=918899459 TSecr=1728225770 WS=128"
105,43.506723,192.168.11.8,192.168.11.13,TCP,66,0.000099,,,55246  >  6000 [ACK] Seq=1 Ack=1 Win=64256 Len=0 TSval=1728225777 TSecr=918899459
106,43.507105,192.168.11.8,192.168.11.13,TCP,93,0.000382,,,"55246  >  6000 [PSH, ACK] Seq=1 Ack=1 Win=64256 Len=27 TSval=1728225778 TSecr=918899459 [TCP segment of a reassembled PDU]"
107,43.507367,192.168.11.8,192.168.11.13,TCP,66,0.000262,,,"55246  >  6000 [FIN, ACK] Seq=28 Ack=1 Win=64256 Len=0 TSval=1728225778 TSecr=918899459"
108,43.514865,192.168.11.13,192.168.11.8,TCP,66,0.007498,,,6000  >  55246 [ACK] Seq=1 Ack=28 Win=65152 Len=0 TSval=918899467 TSecr=1728225778
109,43.515093,192.168.11.13,192.168.11.8,TCP,66,0.000228,,,"6000  >  55246 [FIN, ACK] Seq=1 Ack=29 Win=65152 Len=0 TSval=918899468 TSecr=1728225778"
110,43.515135,192.168.11.8,192.168.11.13,TCP,66,0.000042,,,55246  >  6000 [ACK] Seq=29 Ack=2 Win=64256 Len=0 TSval=1728225786 TSecr=918899468
111,43.549199,192.168.11.8,255.255.255.255,UDP,209,0.034064,Ÿ,7b2273656d616e74696373223a207b22656e74697479223a2022504944222c202262617365656e74697479223a2022616e79222c2022726f6c65223a2022646464222c20227370617469616c223a2022616e79222c202274656d706f72616c223a2022616e79227d2c20226461746170726f7065727479223a207b22666f726d6174223a2022696e616f6b615f70726f6772616d5f73616d706c655f73656d616e746963227d7d,42909  >  7000 Len=167
112,43.562819,192.168.11.23,192.168.11.8,TCP,74,0.01362,œ,,53038  >  6000 [SYN] Seq=0 Win=64240 Len=0 MSS=1460 SACK_PERM TSval=2801428059 TSecr=0 WS=128
113,43.562954,192.168.11.8,192.168.11.23,TCP,74,0.000135,,,"6000  >  53038 [SYN, ACK] Seq=0 Ack=1 Win=65160 Len=0 MSS=1460 SACK_PERM TSval=3797682438 TSecr=2801428059 WS=128"
114,43.569841,192.168.11.23,192.168.11.8,TCP,66,0.006887,,,53038  >  6000 [ACK] Seq=1 Ack=1 Win=64256 Len=0 TSval=2801428074 TSecr=3797682438
115,43.570381,192.168.11.23,192.168.11.8,TCP,93,0.00054,,,"53038  >  6000 [PSH, ACK] Seq=1 Ack=1 Win=64256 Len=27 TSval=2801428074 TSecr=3797682438 [TCP segment of a reassembled PDU]"
116,43.570482,192.168.11.8,192.168.11.23,TCP,66,0.000101,,,6000  >  53038 [ACK] Seq=1 Ack=28 Win=65152 Len=0 TSval=3797682445 TSecr=2801428074
117,43.57059,192.168.11.23,192.168.11.8,TCP,66,0.000108,,,"53038  >  6000 [FIN, ACK] Seq=28 Ack=1 Win=64256 Len=0 TSval=2801428074 TSecr=3797682438"
118,43.571744,192.168.11.8,192.168.11.23,TCP,66,0.001154,,,"6000  >  53038 [FIN, ACK] Seq=1 Ack=29 Win=65152 Len=0 TSval=3797682446 TSecr=2801428074"
119,43.576808,192.168.11.23,192.168.11.8,TCP,66,0.005064,,,53038  >  6000 [ACK] Seq=29 Ack=2 Win=64256 Len=0 TSval=2801428082 TSecr=3797682446
120,50.721359,192.168.11.8,192.168.11.13,TCP,74,7.144551,,,55254  >  6000 [SYN] Seq=0 Win=64240 Len=0 MSS=1460 SACK_PERM TSval=1728232992 TSecr=0 WS=128
121,50.727957,192.168.11.13,192.168.11.8,TCP,74,0.006598,,,"6000  >  55254 [SYN, ACK] Seq=0 Ack=1 Win=65160 Len=0 MSS=1460 SACK_PERM TSval=918906681 TSecr=1728232992 WS=128"
122,50.728079,192.168.11.8,192.168.11.13,TCP,66,0.000122,,,55254  >  6000 [ACK] Seq=1 Ack=1 Win=64256 Len=0 TSval=1728232999 TSecr=918906681
123,50.728235,192.168.11.8,192.168.11.13,TCP,93,0.000156,,,"55254  >  6000 [PSH, ACK] Seq=1 Ack=1 Win=64256 Len=27 TSval=1728232999 TSecr=918906681 [TCP segment of a reassembled PDU]"
124,50.728354,192.168.11.8,192.168.11.13,TCP,66,0.000119,,,"55254  >  6000 [FIN, ACK] Seq=28 Ack=1 Win=64256 Len=0 TSval=1728232999 TSecr=918906681"
125,50.735396,192.168.11.13,192.168.11.8,TCP,66,0.007042,,,6000  >  55254 [ACK] Seq=1 Ack=28 Win=65152 Len=0 TSval=918906688 TSecr=1728232999
126,50.735859,192.168.11.13,192.168.11.8,TCP,66,0.000463,,,"6000  >  55254 [FIN, ACK] Seq=1 Ack=29 Win=65152 Len=0 TSval=918906690 TSecr=1728232999"
127,50.735913,192.168.11.8,192.168.11.13,TCP,66,0.000054,,,55254  >  6000 [ACK] Seq=29 Ack=2 Win=64256 Len=0 TSval=1728233007 TSecr=918906690
128,50.763812,192.168.11.8,255.255.255.255,UDP,209,0.027899,Ÿ,7b2273656d616e74696373223a207b22656e74697479223a2022504944222c202262617365656e74697479223a2022616e79222c2022726f6c65223a2022646464222c20227370617469616c223a2022616e79222c202274656d706f72616c223a2022616e79227d2c20226461746170726f7065727479223a207b22666f726d6174223a2022696e616f6b615f70726f6772616d5f73616d706c655f73656d616e746963227d7d,32861  >  7000 Len=167
129,50.769817,192.168.11.23,192.168.11.8,TCP,74,0.006005,œ,,58316  >  6000 [SYN] Seq=0 Win=64240 Len=0 MSS=1460 SACK_PERM TSval=2801435274 TSecr=0 WS=128
130,50.769945,192.168.11.8,192.168.11.23,TCP,74,0.000128,,,"6000  >  58316 [SYN, ACK] Seq=0 Ack=1 Win=65160 Len=0 MSS=1460 SACK_PERM TSval=3797689645 TSecr=2801435274 WS=128"
131,50.777562,192.168.11.23,192.168.11.8,TCP,66,0.007617,,,58316  >  6000 [ACK] Seq=1 Ack=1 Win=64256 Len=0 TSval=2801435281 TSecr=3797689645
132,50.778124,192.168.11.23,192.168.11.8,TCP,93,0.000562,,,"58316  >  6000 [PSH, ACK] Seq=1 Ack=1 Win=64256 Len=27 TSval=2801435282 TSecr=3797689645 [TCP segment of a reassembled PDU]"
133,50.778233,192.168.11.8,192.168.11.23,TCP,66,0.000109,,,6000  >  58316 [ACK] Seq=1 Ack=28 Win=65152 Len=0 TSval=3797689653 TSecr=2801435282
134,50.778309,192.168.11.23,192.168.11.8,TCP,66,0.000076,,,"58316  >  6000 [FIN, ACK] Seq=28 Ack=1 Win=64256 Len=0 TSval=2801435282 TSecr=3797689645"
135,50.779603,192.168.11.8,192.168.11.23,TCP,66,0.001294,,,"6000  >  58316 [FIN, ACK] Seq=1 Ack=29 Win=65152 Len=0 TSval=3797689654 TSecr=2801435282"
136,50.785839,192.168.11.23,192.168.11.8,TCP,66,0.006236,,,58316  >  6000 [ACK] Seq=29 Ack=2 Win=64256 Len=0 TSval=2801435290 TSecr=3797689654
137,57.888264,192.168.11.8,192.168.11.13,TCP,74,7.102425,,,38584  >  6000 [SYN] Seq=0 Win=64240 Len=0 MSS=1460 SACK_PERM TSval=1728240159 TSecr=0 WS=128
138,57.897241,192.168.11.13,192.168.11.8,TCP,74,0.008977,,,"6000  >  38584 [SYN, ACK] Seq=0 Ack=1 Win=65160 Len=0 MSS=1460 SACK_PERM TSval=918913848 TSecr=1728240159 WS=128"
139,57.897355,192.168.11.8,192.168.11.13,TCP,66,0.000114,,,38584  >  6000 [ACK] Seq=1 Ack=1 Win=64256 Len=0 TSval=1728240168 TSecr=918913848
140,57.897609,192.168.11.8,192.168.11.13,TCP,93,0.000254,,,"38584  >  6000 [PSH, ACK] Seq=1 Ack=1 Win=64256 Len=27 TSval=1728240168 TSecr=918913848 [TCP segment of a reassembled PDU]"
141,57.897711,192.168.11.8,192.168.11.13,TCP,66,0.000102,,,"38584  >  6000 [FIN, ACK] Seq=28 Ack=1 Win=64256 Len=0 TSval=1728240168 TSecr=918913848"
142,57.905712,192.168.11.13,192.168.11.8,TCP,66,0.008001,,,6000  >  38584 [ACK] Seq=1 Ack=28 Win=65152 Len=0 TSval=918913859 TSecr=1728240168
143,57.906089,192.168.11.13,192.168.11.8,TCP,66,0.000377,,,"6000  >  38584 [FIN, ACK] Seq=1 Ack=29 Win=65152 Len=0 TSval=918913861 TSecr=1728240168"
144,57.906152,192.168.11.8,192.168.11.13,TCP,66,0.000063,,,38584  >  6000 [ACK] Seq=29 Ack=2 Win=64256 Len=0 TSval=1728240177 TSecr=918913861
145,57.933919,192.168.11.8,255.255.255.255,UDP,209,0.027767,Ÿ,7b2273656d616e74696373223a207b22656e74697479223a2022504944222c202262617365656e74697479223a2022616e79222c2022726f6c65223a2022646464222c20227370617469616c223a2022616e79222c202274656d706f72616c223a2022616e79227d2c20226461746170726f7065727479223a207b22666f726d6174223a2022696e616f6b615f70726f6772616d5f73616d706c655f73656d616e746963227d7d,44426  >  7000 Len=167
146,57.939558,192.168.11.23,192.168.11.8,TCP,74,0.005639,œ,,58328  >  6000 [SYN] Seq=0 Win=64240 Len=0 MSS=1460 SACK_PERM TSval=2801442445 TSecr=0 WS=128
147,57.939667,192.168.11.8,192.168.11.23,TCP,74,0.000109,,,"6000  >  58328 [SYN, ACK] Seq=0 Ack=1 Win=65160 Len=0 MSS=1460 SACK_PERM TSval=3797696814 TSecr=2801442445 WS=128"
148,57.946352,192.168.11.23,192.168.11.8,TCP,66,0.006685,,,58328  >  6000 [ACK] Seq=1 Ack=1 Win=64256 Len=0 TSval=2801442452 TSecr=3797696814
149,57.946901,192.168.11.23,192.168.11.8,TCP,93,0.000549,,,"58328  >  6000 [PSH, ACK] Seq=1 Ack=1 Win=64256 Len=27 TSval=2801442452 TSecr=3797696814 [TCP segment of a reassembled PDU]"
150,57.946947,192.168.11.23,192.168.11.8,TCP,66,0.000046,,,"58328  >  6000 [FIN, ACK] Seq=28 Ack=1 Win=64256 Len=0 TSval=2801442452 TSecr=3797696814"
151,57.947015,192.168.11.8,192.168.11.23,TCP,66,0.000068,,,6000  >  58328 [ACK] Seq=1 Ack=28 Win=65152 Len=0 TSval=3797696822 TSecr=2801442452
152,57.948192,192.168.11.8,192.168.11.23,TCP,66,0.001177,,,"6000  >  58328 [FIN, ACK] Seq=1 Ack=29 Win=65152 Len=0 TSval=3797696823 TSecr=2801442452"
153,57.954253,192.168.11.23,192.168.11.8,TCP,66,0.006061,,,58328  >  6000 [ACK] Seq=29 Ack=2 Win=64256 Len=0 TSval=2801442459 TSecr=3797696823
154,65.022763,192.168.11.8,192.168.11.13,TCP,74,7.06851,,,39770  >  6000 [SYN] Seq=0 Win=64240 Len=0 MSS=1460 SACK_PERM TSval=1728247293 TSecr=0 WS=128
155,65.030442,192.168.11.13,192.168.11.8,TCP,74,0.007679,,,"6000  >  39770 [SYN, ACK] Seq=0 Ack=1 Win=65160 Len=0 MSS=1460 SACK_PERM TSval=918920985 TSecr=1728247293 WS=128"
156,65.030552,192.168.11.8,192.168.11.13,TCP,66,0.00011,,,39770  >  6000 [ACK] Seq=1 Ack=1 Win=64256 Len=0 TSval=1728247301 TSecr=918920985
157,65.030748,192.168.11.8,192.168.11.13,TCP,93,0.000196,,,"39770  >  6000 [PSH, ACK] Seq=1 Ack=1 Win=64256 Len=27 TSval=1728247301 TSecr=918920985 [TCP segment of a reassembled PDU]"
158,65.030833,192.168.11.8,192.168.11.13,TCP,66,0.000085,,,"39770  >  6000 [FIN, ACK] Seq=28 Ack=1 Win=64256 Len=0 TSval=1728247301 TSecr=918920985"
159,65.038073,192.168.11.13,192.168.11.8,TCP,66,0.00724,,,6000  >  39770 [ACK] Seq=1 Ack=28 Win=65152 Len=0 TSval=918920992 TSecr=1728247301
160,65.038473,192.168.11.13,192.168.11.8,TCP,66,0.0004,,,"6000  >  39770 [FIN, ACK] Seq=1 Ack=29 Win=65152 Len=0 TSval=918920994 TSecr=1728247301"
161,65.038533,192.168.11.8,192.168.11.13,TCP,66,0.00006,,,39770  >  6000 [ACK] Seq=29 Ack=2 Win=64256 Len=0 TSval=1728247309 TSecr=918920994
162,65.068015,192.168.11.8,255.255.255.255,UDP,209,0.029482,Ÿ,7b2273656d616e74696373223a207b22656e74697479223a2022504944222c202262617365656e74697479223a2022616e79222c2022726f6c65223a2022646464222c20227370617469616c223a2022616e79222c202274656d706f72616c223a2022616e79227d2c20226461746170726f7065727479223a207b22666f726d6174223a2022696e616f6b615f70726f6772616d5f73616d706c655f73656d616e746963227d7d,60098  >  7000 Len=167
163,65.073496,192.168.11.23,192.168.11.8,TCP,74,0.005481,œ,,35370  >  6000 [SYN] Seq=0 Win=64240 Len=0 MSS=1460 SACK_PERM TSval=2801449579 TSecr=0 WS=128
164,65.073612,192.168.11.8,192.168.11.23,TCP,74,0.000116,,,"6000  >  35370 [SYN, ACK] Seq=0 Ack=1 Win=65160 Len=0 MSS=1460 SACK_PERM TSval=3797703948 TSecr=2801449579 WS=128"
165,65.080286,192.168.11.23,192.168.11.8,TCP,66,0.006674,,,35370  >  6000 [ACK] Seq=1 Ack=1 Win=64256 Len=0 TSval=2801449586 TSecr=3797703948
166,65.080733,192.168.11.23,192.168.11.8,TCP,93,0.000447,,,"35370  >  6000 [PSH, ACK] Seq=1 Ack=1 Win=64256 Len=27 TSval=2801449586 TSecr=3797703948 [TCP segment of a reassembled PDU]"
167,65.08087,192.168.11.8,192.168.11.23,TCP,66,0.000137,,,6000  >  35370 [ACK] Seq=1 Ack=28 Win=65152 Len=0 TSval=3797703955 TSecr=2801449586
168,65.081193,192.168.11.23,192.168.11.8,TCP,66,0.000323,,,"35370  >  6000 [FIN, ACK] Seq=28 Ack=1 Win=64256 Len=0 TSval=2801449586 TSecr=3797703948"
169,65.082324,192.168.11.8,192.168.11.23,TCP,66,0.001131,,,"6000  >  35370 [FIN, ACK] Seq=1 Ack=29 Win=65152 Len=0 TSval=3797703957 TSecr=2801449586"
170,65.0886,192.168.11.23,192.168.11.8,TCP,66,0.006276,,,35370  >  6000 [ACK] Seq=29 Ack=2 Win=64256 Len=0 TSval=2801449594 TSecr=3797703957
171,110.691532,192.168.11.8,192.168.11.13,TCP,74,45.602932,,,41776  >  6000 [SYN] Seq=0 Win=64240 Len=0 MSS=1460 SACK_PERM TSval=1728292962 TSecr=0 WS=128
172,110.699132,192.168.11.13,192.168.11.8,TCP,74,0.0076,,,"6000  >  41776 [SYN, ACK] Seq=0 Ack=1 Win=65160 Len=0 MSS=1460 SACK_PERM TSval=918966656 TSecr=1728292962 WS=128"
173,110.699237,192.168.11.8,192.168.11.13,TCP,66,0.000105,,,41776  >  6000 [ACK] Seq=1 Ack=1 Win=64256 Len=0 TSval=1728292970 TSecr=918966656
174,110.699437,192.168.11.8,192.168.11.13,TCP,93,0.0002,,,"41776  >  6000 [PSH, ACK] Seq=1 Ack=1 Win=64256 Len=27 TSval=1728292970 TSecr=918966656 [TCP segment of a reassembled PDU]"
175,110.699537,192.168.11.8,192.168.11.13,TCP,66,0.0001,,,"41776  >  6000 [FIN, ACK] Seq=28 Ack=1 Win=64256 Len=0 TSval=1728292970 TSecr=918966656"
176,110.706724,192.168.11.13,192.168.11.8,TCP,66,0.007187,,,6000  >  41776 [ACK] Seq=1 Ack=28 Win=65152 Len=0 TSval=918966663 TSecr=1728292970
177,110.707111,192.168.11.13,192.168.11.8,TCP,66,0.000387,,,"6000  >  41776 [FIN, ACK] Seq=1 Ack=29 Win=65152 Len=0 TSval=918966665 TSecr=1728292970"
178,110.707156,192.168.11.8,192.168.11.13,TCP,66,0.000045,,,41776  >  6000 [ACK] Seq=29 Ack=2 Win=64256 Len=0 TSval=1728292978 TSecr=918966665
179,110.736226,192.168.11.8,255.255.255.255,UDP,209,0.02907,Ÿ,7b2273656d616e74696373223a207b22656e74697479223a2022504944222c202262617365656e74697479223a2022616e79222c2022726f6c65223a2022646464222c20227370617469616c223a2022616e79222c202274656d706f72616c223a2022616e79227d2c20226461746170726f7065727479223a207b22666f726d6174223a2022696e616f6b615f70726f6772616d5f73616d706c655f73656d616e746963227d7d,51985  >  7000 Len=167
180,110.74182,192.168.11.23,192.168.11.8,TCP,74,0.005594,œ,,36776  >  6000 [SYN] Seq=0 Win=64240 Len=0 MSS=1460 SACK_PERM TSval=2801495250 TSecr=0 WS=128
181,110.741945,192.168.11.8,192.168.11.23,TCP,74,0.000125,,,"6000  >  36776 [SYN, ACK] Seq=0 Ack=1 Win=65160 Len=0 MSS=1460 SACK_PERM TSval=3797749617 TSecr=2801495250 WS=128"
182,110.748669,192.168.11.23,192.168.11.8,TCP,66,0.006724,,,36776  >  6000 [ACK] Seq=1 Ack=1 Win=64256 Len=0 TSval=2801495256 TSecr=3797749617
183,110.749324,192.168.11.23,192.168.11.8,TCP,93,0.000655,,,"36776  >  6000 [PSH, ACK] Seq=1 Ack=1 Win=64256 Len=27 TSval=2801495257 TSecr=3797749617 [TCP segment of a reassembled PDU]"
184,110.749409,192.168.11.8,192.168.11.23,TCP,66,0.000085,,,6000  >  36776 [ACK] Seq=1 Ack=28 Win=65152 Len=0 TSval=3797749624 TSecr=2801495257
185,110.749476,192.168.11.23,192.168.11.8,TCP,66,0.000067,,,"36776  >  6000 [FIN, ACK] Seq=28 Ack=1 Win=64256 Len=0 TSval=2801495257 TSecr=3797749617"
186,110.750703,192.168.11.8,192.168.11.23,TCP,66,0.001227,,,"6000  >  36776 [FIN, ACK] Seq=1 Ack=29 Win=65152 Len=0 TSval=3797749625 TSecr=2801495257"
187,110.756642,192.168.11.23,192.168.11.8,TCP,66,0.005939,,,36776  >  6000 [ACK] Seq=29 Ack=2 Win=64256 Len=0 TSval=2801495264 TSecr=3797749625
188,117.843188,192.168.11.8,192.168.11.13,TCP,74,7.086546,,,51518  >  6000 [SYN] Seq=0 Win=64240 Len=0 MSS=1460 SACK_PERM TSval=1728300114 TSecr=0 WS=128
189,117.850102,192.168.11.13,192.168.11.8,TCP,74,0.006914,,,"6000  >  51518 [SYN, ACK] Seq=0 Ack=1 Win=65160 Len=0 MSS=1460 SACK_PERM TSval=918973807 TSecr=1728300114 WS=128"
190,117.850165,192.168.11.8,192.168.11.13,TCP,66,0.000063,,,51518  >  6000 [ACK] Seq=1 Ack=1 Win=64256 Len=0 TSval=1728300121 TSecr=918973807
191,117.850261,192.168.11.8,192.168.11.13,TCP,93,0.000096,,,"51518  >  6000 [PSH, ACK] Seq=1 Ack=1 Win=64256 Len=27 TSval=1728300121 TSecr=918973807 [TCP segment of a reassembled PDU]"
192,117.850311,192.168.11.8,192.168.11.13,TCP,66,0.00005,,,"51518  >  6000 [FIN, ACK] Seq=28 Ack=1 Win=64256 Len=0 TSval=1728300121 TSecr=918973807"
193,117.857509,192.168.11.13,192.168.11.8,TCP,66,0.007198,,,6000  >  51518 [ACK] Seq=1 Ack=28 Win=65152 Len=0 TSval=918973815 TSecr=1728300121
194,117.857729,192.168.11.13,192.168.11.8,TCP,66,0.00022,,,"6000  >  51518 [FIN, ACK] Seq=1 Ack=29 Win=65152 Len=0 TSval=918973816 TSecr=1728300121"
195,117.857758,192.168.11.8,192.168.11.13,TCP,66,0.000029,,,51518  >  6000 [ACK] Seq=29 Ack=2 Win=64256 Len=0 TSval=1728300128 TSecr=918973816
196,117.876181,192.168.11.8,255.255.255.255,UDP,209,0.018423,Ÿ,7b2273656d616e74696373223a207b22656e74697479223a2022504944222c202262617365656e74697479223a2022616e79222c2022726f6c65223a2022646464222c20227370617469616c223a2022616e79222c202274656d706f72616c223a2022616e79227d2c20226461746170726f7065727479223a207b22666f726d6174223a2022696e616f6b615f70726f6772616d5f73616d706c655f73656d616e746963227d7d,58204  >  7000 Len=167
197,117.881457,192.168.11.23,192.168.11.8,TCP,74,0.005276,œ,,36786  >  6000 [SYN] Seq=0 Win=64240 Len=0 MSS=1460 SACK_PERM TSval=2801502390 TSecr=0 WS=128
198,117.881534,192.168.11.8,192.168.11.23,TCP,74,0.000077,,,"6000  >  36786 [SYN, ACK] Seq=0 Ack=1 Win=65160 Len=0 MSS=1460 SACK_PERM TSval=3797756756 TSecr=2801502390 WS=128"
199,117.888149,192.168.11.23,192.168.11.8,TCP,66,0.006615,,,36786  >  6000 [ACK] Seq=1 Ack=1 Win=64256 Len=0 TSval=2801502397 TSecr=3797756756
200,117.888424,192.168.11.23,192.168.11.8,TCP,93,0.000275,,,"36786  >  6000 [PSH, ACK] Seq=1 Ack=1 Win=64256 Len=27 TSval=2801502397 TSecr=3797756756 [TCP segment of a reassembled PDU]"
201,117.888462,192.168.11.8,192.168.11.23,TCP,66,0.000038,,,6000  >  36786 [ACK] Seq=1 Ack=28 Win=65152 Len=0 TSval=3797756763 TSecr=2801502397
202,117.888494,192.168.11.23,192.168.11.8,TCP,66,0.000032,,,"36786  >  6000 [FIN, ACK] Seq=28 Ack=1 Win=64256 Len=0 TSval=2801502397 TSecr=3797756756"
203,117.889077,192.168.11.8,192.168.11.23,TCP,66,0.000583,,,"6000  >  36786 [FIN, ACK] Seq=1 Ack=29 Win=65152 Len=0 TSval=3797756764 TSecr=2801502397"
204,117.895348,192.168.11.23,192.168.11.8,TCP,66,0.006271,,,36786  >  6000 [ACK] Seq=29 Ack=2 Win=64256 Len=0 TSval=2801502404 TSecr=3797756764
205,125.042328,192.168.11.8,192.168.11.13,TCP,74,7.14698,,,46086  >  6000 [SYN] Seq=0 Win=64240 Len=0 MSS=1460 SACK_PERM TSval=1728307313 TSecr=0 WS=128
206,125.050516,192.168.11.13,192.168.11.8,TCP,74,0.008188,,,"6000  >  46086 [SYN, ACK] Seq=0 Ack=1 Win=65160 Len=0 MSS=1460 SACK_PERM TSval=918981008 TSecr=1728307313 WS=128"
207,125.050641,192.168.11.8,192.168.11.13,TCP,66,0.000125,,,46086  >  6000 [ACK] Seq=1 Ack=1 Win=64256 Len=0 TSval=1728307321 TSecr=918981008
208,125.050795,192.168.11.8,192.168.11.13,TCP,93,0.000154,,,"46086  >  6000 [PSH, ACK] Seq=1 Ack=1 Win=64256 Len=27 TSval=1728307321 TSecr=918981008 [TCP segment of a reassembled PDU]"
209,125.050905,192.168.11.8,192.168.11.13,TCP,66,0.00011,,,"46086  >  6000 [FIN, ACK] Seq=28 Ack=1 Win=64256 Len=0 TSval=1728307322 TSecr=918981008"
210,125.058112,192.168.11.13,192.168.11.8,TCP,66,0.007207,,,6000  >  46086 [ACK] Seq=1 Ack=28 Win=65152 Len=0 TSval=918981016 TSecr=1728307321
211,125.058463,192.168.11.13,192.168.11.8,TCP,66,0.000351,,,"6000  >  46086 [FIN, ACK] Seq=1 Ack=29 Win=65152 Len=0 TSval=918981017 TSecr=1728307322"
212,125.058516,192.168.11.8,192.168.11.13,TCP,66,0.000053,,,46086  >  6000 [ACK] Seq=29 Ack=2 Win=64256 Len=0 TSval=1728307329 TSecr=918981017
213,125.085936,192.168.11.8,255.255.255.255,UDP,209,0.02742,Ÿ,7b2273656d616e74696373223a207b22656e74697479223a2022504944222c202262617365656e74697479223a2022616e79222c2022726f6c65223a2022646464222c20227370617469616c223a2022616e79222c202274656d706f72616c223a2022616e79227d2c20226461746170726f7065727479223a207b22666f726d6174223a2022696e616f6b615f70726f6772616d5f73616d706c655f73656d616e746963227d7d,51816  >  7000 Len=167
214,125.091821,192.168.11.23,192.168.11.8,TCP,74,0.005885,œ,,43716  >  6000 [SYN] Seq=0 Win=64240 Len=0 MSS=1460 SACK_PERM TSval=2801509600 TSecr=0 WS=128
215,125.091928,192.168.11.8,192.168.11.23,TCP,74,0.000107,,,"6000  >  43716 [SYN, ACK] Seq=0 Ack=1 Win=65160 Len=0 MSS=1460 SACK_PERM TSval=3797763967 TSecr=2801509600 WS=128"
216,125.107769,192.168.11.23,192.168.11.8,TCP,66,0.015841,,,43716  >  6000 [ACK] Seq=1 Ack=1 Win=64256 Len=0 TSval=2801509607 TSecr=3797763967
217,125.108283,192.168.11.23,192.168.11.8,TCP,93,0.000514,,,"43716  >  6000 [PSH, ACK] Seq=1 Ack=1 Win=64256 Len=27 TSval=2801509607 TSecr=3797763967 [TCP segment of a reassembled PDU]"
218,125.108359,192.168.11.8,192.168.11.23,TCP,66,0.000076,,,6000  >  43716 [ACK] Seq=1 Ack=28 Win=65152 Len=0 TSval=3797763983 TSecr=2801509607
219,125.108431,192.168.11.23,192.168.11.8,TCP,66,0.000072,,,"43716  >  6000 [FIN, ACK] Seq=28 Ack=1 Win=64256 Len=0 TSval=2801509608 TSecr=3797763967"
220,125.109304,192.168.11.8,192.168.11.23,TCP,66,0.000873,,,"6000  >  43716 [FIN, ACK] Seq=1 Ack=29 Win=65152 Len=0 TSval=3797763984 TSecr=2801509608"
221,125.115558,192.168.11.23,192.168.11.8,TCP,66,0.006254,,,43716  >  6000 [ACK] Seq=29 Ack=2 Win=64256 Len=0 TSval=2801509624 TSecr=3797763984
222,132.251708,192.168.11.8,192.168.11.13,TCP,74,7.13615,,,44894  >  6000 [SYN] Seq=0 Win=64240 Len=0 MSS=1460 SACK_PERM TSval=1728314522 TSecr=0 WS=128
223,132.259008,192.168.11.13,192.168.11.8,TCP,74,0.0073,,,"6000  >  44894 [SYN, ACK] Seq=0 Ack=1 Win=65160 Len=0 MSS=1460 SACK_PERM TSval=918988218 TSecr=1728314522 WS=128"
224,132.259073,192.168.11.8,192.168.11.13,TCP,66,0.000065,,,44894  >  6000 [ACK] Seq=1 Ack=1 Win=64256 Len=0 TSval=1728314530 TSecr=918988218
225,132.25917,192.168.11.8,192.168.11.13,TCP,93,0.000097,,,"44894  >  6000 [PSH, ACK] Seq=1 Ack=1 Win=64256 Len=27 TSval=1728314530 TSecr=918988218 [TCP segment of a reassembled PDU]"
226,132.259219,192.168.11.8,192.168.11.13,TCP,66,0.000049,,,"44894  >  6000 [FIN, ACK] Seq=28 Ack=1 Win=64256 Len=0 TSval=1728314530 TSecr=918988218"
227,132.26799,192.168.11.13,192.168.11.8,TCP,66,0.008771,,,6000  >  44894 [ACK] Seq=1 Ack=28 Win=65152 Len=0 TSval=918988226 TSecr=1728314530
228,132.268112,192.168.11.13,192.168.11.8,TCP,66,0.000122,,,"6000  >  44894 [FIN, ACK] Seq=1 Ack=29 Win=65152 Len=0 TSval=918988228 TSecr=1728314530"
229,132.268136,192.168.11.8,192.168.11.13,TCP,66,0.000024,,,44894  >  6000 [ACK] Seq=29 Ack=2 Win=64256 Len=0 TSval=1728314539 TSecr=918988228
230,132.288556,192.168.11.8,255.255.255.255,UDP,209,0.02042,Ÿ,7b2273656d616e74696373223a207b22656e74697479223a2022504944222c202262617365656e74697479223a2022616e79222c2022726f6c65223a2022646464222c20227370617469616c223a2022616e79222c202274656d706f72616c223a2022616e79227d2c20226461746170726f7065727479223a207b22666f726d6174223a2022696e616f6b615f70726f6772616d5f73616d706c655f73656d616e746963227d7d,48657  >  7000 Len=167
231,132.29393,192.168.11.23,192.168.11.8,TCP,74,0.005374,œ,,52620  >  6000 [SYN] Seq=0 Win=64240 Len=0 MSS=1460 SACK_PERM TSval=2801516803 TSecr=0 WS=128
232,132.294008,192.168.11.8,192.168.11.23,TCP,74,0.000078,,,"6000  >  52620 [SYN, ACK] Seq=0 Ack=1 Win=65160 Len=0 MSS=1460 SACK_PERM TSval=3797771169 TSecr=2801516803 WS=128"
233,132.300396,192.168.11.23,192.168.11.8,TCP,66,0.006388,,,52620  >  6000 [ACK] Seq=1 Ack=1 Win=64256 Len=0 TSval=2801516810 TSecr=3797771169
