"No.","Time","Source","Destination","Protocol","Length","The RTT to ACK the segment was","Time delta from previous captured frame","Arrival Time","Data","Info"
"1","0.000000","192.168.11.6","192.168.11.34","TCP","74","","0.000000000","Jan  8, 2024 13:40:13.736389000 JST","","56092  >  6000 [SYN] Seq=0 Win=64240 Len=0 MSS=1460 SACK_PERM TSval=1078041598 TSecr=0 WS=128"
"2","0.019971","192.168.11.34","192.168.11.6","TCP","74","0.019971000","0.019971000","Jan  8, 2024 13:40:13.756360000 JST","","6000  >  56092 [SYN, ACK] Seq=0 Ack=1 Win=65160 Len=0 MSS=1460 SACK_PERM TSval=3693124048 TSecr=1078041598 WS=128"
"3","0.020084","192.168.11.6","192.168.11.34","TCP","66","0.000113000","0.000113000","Jan  8, 2024 13:40:13.756473000 JST","","56092  >  6000 [ACK] Seq=1 Ack=1 Win=64256 Len=0 TSval=1078041621 TSecr=3693124048"
"4","0.020369","192.168.11.6","192.168.11.34","TCP","93","","0.000285000","Jan  8, 2024 13:40:13.756758000 JST","","56092  >  6000 [PSH, ACK] Seq=1 Ack=1 Win=64256 Len=27 TSval=1078041622 TSecr=3693124048 [TCP segment of a reassembled PDU]"
"5","0.020514","192.168.11.6","192.168.11.34","TCP","66","","0.000145000","Jan  8, 2024 13:40:13.756903000 JST","","56092  >  6000 [FIN, ACK] Seq=28 Ack=1 Win=64256 Len=0 TSval=1078041622 TSecr=3693124048"
"6","0.027789","192.168.11.34","192.168.11.6","TCP","66","0.007420000","0.007275000","Jan  8, 2024 13:40:13.764178000 JST","","6000  >  56092 [ACK] Seq=1 Ack=28 Win=65152 Len=0 TSval=3693124058 TSecr=1078041622"
"7","0.028223","192.168.11.34","192.168.11.6","TCP","66","0.007709000","0.000434000","Jan  8, 2024 13:40:13.764612000 JST","","6000  >  56092 [FIN, ACK] Seq=1 Ack=29 Win=65152 Len=0 TSval=3693124059 TSecr=1078041622"
"8","0.028283","192.168.11.6","192.168.11.34","TCP","66","0.000060000","0.000060000","Jan  8, 2024 13:40:13.764672000 JST","","56092  >  6000 [ACK] Seq=29 Ack=2 Win=64256 Len=0 TSval=1078041630 TSecr=3693124059"
"9","0.056191","192.168.11.6","255.255.255.255","UDP","209","","0.027908000","Jan  8, 2024 13:40:13.792580000 JST","7b2273656d616e74696373223a207b22656e74697479223a2022504944222c202262617365656e74697479223a2022616e79222c2022726f6c65223a2022323232222c20227370617469616c223a2022616e79222c202274656d706f72616c223a2022616e79227d2c20226461746170726f7065727479223a207b22666f726d6174223a2022696e616f6b615f70726f6772616d5f73616d706c655f73656d616e746963227d7d","48842  >  7000 Len=167"
"10","0.069859","192.168.11.29","192.168.11.6","TCP","74","","0.013668000","Jan  8, 2024 13:40:13.806248000 JST","","56060  >  6000 [SYN] Seq=0 Win=64240 Len=0 MSS=1460 SACK_PERM TSval=818751789 TSecr=0 WS=128"
"11","0.069996","192.168.11.6","192.168.11.29","TCP","74","0.000137000","0.000137000","Jan  8, 2024 13:40:13.806385000 JST","","6000  >  56060 [SYN, ACK] Seq=0 Ack=1 Win=65160 Len=0 MSS=1460 SACK_PERM TSval=677686001 TSecr=818751789 WS=128"
"12","0.077322","192.168.11.29","192.168.11.6","TCP","66","0.007326000","0.007326000","Jan  8, 2024 13:40:13.813711000 JST","","56060  >  6000 [ACK] Seq=1 Ack=1 Win=64256 Len=0 TSval=818751802 TSecr=677686001"
"13","0.077954","192.168.11.29","192.168.11.6","TCP","93","","0.000632000","Jan  8, 2024 13:40:13.814343000 JST","","56060  >  6000 [PSH, ACK] Seq=1 Ack=1 Win=64256 Len=27 TSval=818751802 TSecr=677686001 [TCP segment of a reassembled PDU]"
"14","0.078046","192.168.11.6","192.168.11.29","TCP","66","0.000092000","0.000092000","Jan  8, 2024 13:40:13.814435000 JST","","6000  >  56060 [ACK] Seq=1 Ack=28 Win=65152 Len=0 TSval=677686009 TSecr=818751802"
"15","0.078128","192.168.11.29","192.168.11.6","TCP","66","","0.000082000","Jan  8, 2024 13:40:13.814517000 JST","","56060  >  6000 [FIN, ACK] Seq=28 Ack=1 Win=64256 Len=0 TSval=818751802 TSecr=677686001"
"16","0.079451","192.168.11.6","192.168.11.29","TCP","66","0.001323000","0.001323000","Jan  8, 2024 13:40:13.815840000 JST","","6000  >  56060 [FIN, ACK] Seq=1 Ack=29 Win=65152 Len=0 TSval=677686011 TSecr=818751802"
"17","0.088790","192.168.11.29","192.168.11.6","TCP","66","0.009339000","0.009339000","Jan  8, 2024 13:40:13.825179000 JST","","56060  >  6000 [ACK] Seq=29 Ack=2 Win=64256 Len=0 TSval=818751810 TSecr=677686011"
"18","6.875572","192.168.11.6","192.168.11.34","TCP","74","","6.786782000","Jan  8, 2024 13:40:20.611961000 JST","","56108  >  6000 [SYN] Seq=0 Win=64240 Len=0 MSS=1460 SACK_PERM TSval=1078048477 TSecr=0 WS=128"
"19","6.882452","192.168.11.34","192.168.11.6","TCP","74","0.006880000","0.006880000","Jan  8, 2024 13:40:20.618841000 JST","","6000  >  56108 [SYN, ACK] Seq=0 Ack=1 Win=65160 Len=0 MSS=1460 SACK_PERM TSval=3693130913 TSecr=1078048477 WS=128"
"20","6.882548","192.168.11.6","192.168.11.34","TCP","66","0.000096000","0.000096000","Jan  8, 2024 13:40:20.618937000 JST","","56108  >  6000 [ACK] Seq=1 Ack=1 Win=64256 Len=0 TSval=1078048484 TSecr=3693130913"
"21","6.882705","192.168.11.6","192.168.11.34","TCP","93","","0.000157000","Jan  8, 2024 13:40:20.619094000 JST","","56108  >  6000 [PSH, ACK] Seq=1 Ack=1 Win=64256 Len=27 TSval=1078048484 TSecr=3693130913 [TCP segment of a reassembled PDU]"
"22","6.882840","192.168.11.6","192.168.11.34","TCP","66","","0.000135000","Jan  8, 2024 13:40:20.619229000 JST","","56108  >  6000 [FIN, ACK] Seq=28 Ack=1 Win=64256 Len=0 TSval=1078048484 TSecr=3693130913"
"23","6.890413","192.168.11.34","192.168.11.6","TCP","66","0.007708000","0.007573000","Jan  8, 2024 13:40:20.626802000 JST","","6000  >  56108 [ACK] Seq=1 Ack=28 Win=65152 Len=0 TSval=3693130921 TSecr=1078048484"
"24","6.890642","192.168.11.34","192.168.11.6","TCP","66","0.007802000","0.000229000","Jan  8, 2024 13:40:20.627031000 JST","","6000  >  56108 [FIN, ACK] Seq=1 Ack=29 Win=65152 Len=0 TSval=3693130923 TSecr=1078048484"
"25","6.890684","192.168.11.6","192.168.11.34","TCP","66","0.000042000","0.000042000","Jan  8, 2024 13:40:20.627073000 JST","","56108  >  6000 [ACK] Seq=29 Ack=2 Win=64256 Len=0 TSval=1078048492 TSecr=3693130923"
"26","6.921569","192.168.11.6","255.255.255.255","UDP","209","","0.030885000","Jan  8, 2024 13:40:20.657958000 JST","7b2273656d616e74696373223a207b22656e74697479223a2022504944222c202262617365656e74697479223a2022616e79222c2022726f6c65223a2022323232222c20227370617469616c223a2022616e79222c202274656d706f72616c223a2022616e79227d2c20226461746170726f7065727479223a207b22666f726d6174223a2022696e616f6b615f70726f6772616d5f73616d706c655f73656d616e746963227d7d","39325  >  7000 Len=167"
"27","6.932960","192.168.11.29","192.168.11.6","TCP","74","","0.011391000","Jan  8, 2024 13:40:20.669349000 JST","","35846  >  6000 [SYN] Seq=0 Win=64240 Len=0 MSS=1460 SACK_PERM TSval=818758658 TSecr=0 WS=128"
"28","6.933086","192.168.11.6","192.168.11.29","TCP","74","0.000126000","0.000126000","Jan  8, 2024 13:40:20.669475000 JST","","6000  >  35846 [SYN, ACK] Seq=0 Ack=1 Win=65160 Len=0 MSS=1460 SACK_PERM TSval=677692864 TSecr=818758658 WS=128"
"29","6.939766","192.168.11.29","192.168.11.6","TCP","66","0.006680000","0.006680000","Jan  8, 2024 13:40:20.676155000 JST","","35846  >  6000 [ACK] Seq=1 Ack=1 Win=64256 Len=0 TSval=818758665 TSecr=677692864"
"30","6.940261","192.168.11.29","192.168.11.6","TCP","93","","0.000495000","Jan  8, 2024 13:40:20.676650000 JST","","35846  >  6000 [PSH, ACK] Seq=1 Ack=1 Win=64256 Len=27 TSval=818758665 TSecr=677692864 [TCP segment of a reassembled PDU]"
"31","6.940347","192.168.11.6","192.168.11.29","TCP","66","0.000086000","0.000086000","Jan  8, 2024 13:40:20.676736000 JST","","6000  >  35846 [ACK] Seq=1 Ack=28 Win=65152 Len=0 TSval=677692872 TSecr=818758665"
"32","6.940407","192.168.11.29","192.168.11.6","TCP","66","","0.000060000","Jan  8, 2024 13:40:20.676796000 JST","","35846  >  6000 [FIN, ACK] Seq=28 Ack=1 Win=64256 Len=0 TSval=818758665 TSecr=677692864"
"33","6.941406","192.168.11.6","192.168.11.29","TCP","66","0.000999000","0.000999000","Jan  8, 2024 13:40:20.677795000 JST","","6000  >  35846 [FIN, ACK] Seq=1 Ack=29 Win=65152 Len=0 TSval=677692873 TSecr=818758665"
"34","6.947814","192.168.11.29","192.168.11.6","TCP","66","0.006408000","0.006408000","Jan  8, 2024 13:40:20.684203000 JST","","35846  >  6000 [ACK] Seq=29 Ack=2 Win=64256 Len=0 TSval=818758672 TSecr=677692873"
"35","14.608898","192.168.11.6","192.168.11.34","TCP","74","","7.661084000","Jan  8, 2024 13:40:28.345287000 JST","","58062  >  6000 [SYN] Seq=0 Win=64240 Len=0 MSS=1460 SACK_PERM TSval=1078056210 TSecr=0 WS=128"
"36","14.616085","192.168.11.34","192.168.11.6","TCP","74","0.007187000","0.007187000","Jan  8, 2024 13:40:28.352474000 JST","","6000  >  58062 [SYN, ACK] Seq=0 Ack=1 Win=65160 Len=0 MSS=1460 SACK_PERM TSval=3693138647 TSecr=1078056210 WS=128"
"37","14.616207","192.168.11.6","192.168.11.34","TCP","66","0.000122000","0.000122000","Jan  8, 2024 13:40:28.352596000 JST","","58062  >  6000 [ACK] Seq=1 Ack=1 Win=64256 Len=0 TSval=1078056218 TSecr=3693138647"
"38","14.616364","192.168.11.6","192.168.11.34","TCP","93","","0.000157000","Jan  8, 2024 13:40:28.352753000 JST","","58062  >  6000 [PSH, ACK] Seq=1 Ack=1 Win=64256 Len=27 TSval=1078056218 TSecr=3693138647 [TCP segment of a reassembled PDU]"
"39","14.616468","192.168.11.6","192.168.11.34","TCP","66","","0.000104000","Jan  8, 2024 13:40:28.352857000 JST","","58062  >  6000 [FIN, ACK] Seq=28 Ack=1 Win=64256 Len=0 TSval=1078056218 TSecr=3693138647"
"40","14.624028","192.168.11.34","192.168.11.6","TCP","66","0.007664000","0.007560000","Jan  8, 2024 13:40:28.360417000 JST","","6000  >  58062 [ACK] Seq=1 Ack=28 Win=65152 Len=0 TSval=3693138654 TSecr=1078056218"
"41","14.624285","192.168.11.34","192.168.11.6","TCP","66","0.007817000","0.000257000","Jan  8, 2024 13:40:28.360674000 JST","","6000  >  58062 [FIN, ACK] Seq=1 Ack=29 Win=65152 Len=0 TSval=3693138657 TSecr=1078056218"
"42","14.624328","192.168.11.6","192.168.11.34","TCP","66","0.000043000","0.000043000","Jan  8, 2024 13:40:28.360717000 JST","","58062  >  6000 [ACK] Seq=29 Ack=2 Win=64256 Len=0 TSval=1078056226 TSecr=3693138657"
"43","14.654530","192.168.11.6","255.255.255.255","UDP","209","","0.030202000","Jan  8, 2024 13:40:28.390919000 JST","7b2273656d616e74696373223a207b22656e74697479223a2022504944222c202262617365656e74697479223a2022616e79222c2022726f6c65223a2022323232222c20227370617469616c223a2022616e79222c202274656d706f72616c223a2022616e79227d2c20226461746170726f7065727479223a207b22666f726d6174223a2022696e616f6b615f70726f6772616d5f73616d706c655f73656d616e746963227d7d","51634  >  7000 Len=167"
"44","14.662533","192.168.11.29","192.168.11.6","TCP","74","","0.008003000","Jan  8, 2024 13:40:28.398922000 JST","","35862  >  6000 [SYN] Seq=0 Win=64240 Len=0 MSS=1460 SACK_PERM TSval=818766387 TSecr=0 WS=128"
"45","14.662667","192.168.11.6","192.168.11.29","TCP","74","0.000134000","0.000134000","Jan  8, 2024 13:40:28.399056000 JST","","6000  >  35862 [SYN, ACK] Seq=0 Ack=1 Win=65160 Len=0 MSS=1460 SACK_PERM TSval=677700594 TSecr=818766387 WS=128"
"46","14.669204","192.168.11.29","192.168.11.6","TCP","66","0.006537000","0.006537000","Jan  8, 2024 13:40:28.405593000 JST","","35862  >  6000 [ACK] Seq=1 Ack=1 Win=64256 Len=0 TSval=818766394 TSecr=677700594"
"47","14.669689","192.168.11.29","192.168.11.6","TCP","93","","0.000485000","Jan  8, 2024 13:40:28.406078000 JST","","35862  >  6000 [PSH, ACK] Seq=1 Ack=1 Win=64256 Len=27 TSval=818766394 TSecr=677700594 [TCP segment of a reassembled PDU]"
"48","14.669746","192.168.11.6","192.168.11.29","TCP","66","0.000057000","0.000057000","Jan  8, 2024 13:40:28.406135000 JST","","6000  >  35862 [ACK] Seq=1 Ack=28 Win=65152 Len=0 TSval=677700601 TSecr=818766394"
"49","14.669808","192.168.11.29","192.168.11.6","TCP","66","","0.000062000","Jan  8, 2024 13:40:28.406197000 JST","","35862  >  6000 [FIN, ACK] Seq=28 Ack=1 Win=64256 Len=0 TSval=818766394 TSecr=677700594"
"50","14.670676","192.168.11.6","192.168.11.29","TCP","66","0.000868000","0.000868000","Jan  8, 2024 13:40:28.407065000 JST","","6000  >  35862 [FIN, ACK] Seq=1 Ack=29 Win=65152 Len=0 TSval=677700602 TSecr=818766394"
"51","14.676907","192.168.11.29","192.168.11.6","TCP","66","0.006231000","0.006231000","Jan  8, 2024 13:40:28.413296000 JST","","35862  >  6000 [ACK] Seq=29 Ack=2 Win=64256 Len=0 TSval=818766402 TSecr=677700602"
"52","21.298366","192.168.11.6","192.168.11.34","TCP","74","","6.621459000","Jan  8, 2024 13:40:35.034755000 JST","","36010  >  6000 [SYN] Seq=0 Win=64240 Len=0 MSS=1460 SACK_PERM TSval=1078062900 TSecr=0 WS=128"
"53","21.309708","192.168.11.34","192.168.11.6","TCP","74","0.011342000","0.011342000","Jan  8, 2024 13:40:35.046097000 JST","","6000  >  36010 [SYN, ACK] Seq=0 Ack=1 Win=65160 Len=0 MSS=1460 SACK_PERM TSval=3693145338 TSecr=1078062900 WS=128"
"54","21.309803","192.168.11.6","192.168.11.34","TCP","66","0.000095000","0.000095000","Jan  8, 2024 13:40:35.046192000 JST","","36010  >  6000 [ACK] Seq=1 Ack=1 Win=64256 Len=0 TSval=1078062911 TSecr=3693145338"
"55","21.309992","192.168.11.6","192.168.11.34","TCP","93","","0.000189000","Jan  8, 2024 13:40:35.046381000 JST","","36010  >  6000 [PSH, ACK] Seq=1 Ack=1 Win=64256 Len=27 TSval=1078062911 TSecr=3693145338 [TCP segment of a reassembled PDU]"
"56","21.310081","192.168.11.6","192.168.11.34","TCP","66","","0.000089000","Jan  8, 2024 13:40:35.046470000 JST","","36010  >  6000 [FIN, ACK] Seq=28 Ack=1 Win=64256 Len=0 TSval=1078062911 TSecr=3693145338"
"57","21.316885","192.168.11.34","192.168.11.6","TCP","66","0.006893000","0.006804000","Jan  8, 2024 13:40:35.053274000 JST","","6000  >  36010 [ACK] Seq=1 Ack=28 Win=65152 Len=0 TSval=3693145347 TSecr=1078062911"
"58","21.317257","192.168.11.34","192.168.11.6","TCP","66","0.007176000","0.000372000","Jan  8, 2024 13:40:35.053646000 JST","","6000  >  36010 [FIN, ACK] Seq=1 Ack=29 Win=65152 Len=0 TSval=3693145348 TSecr=1078062911"
"59","21.317303","192.168.11.6","192.168.11.34","TCP","66","0.000046000","0.000046000","Jan  8, 2024 13:40:35.053692000 JST","","36010  >  6000 [ACK] Seq=29 Ack=2 Win=64256 Len=0 TSval=1078062919 TSecr=3693145348"
"60","21.346981","192.168.11.6","255.255.255.255","UDP","209","","0.029678000","Jan  8, 2024 13:40:35.083370000 JST","7b2273656d616e74696373223a207b22656e74697479223a2022504944222c202262617365656e74697479223a2022616e79222c2022726f6c65223a2022323232222c20227370617469616c223a2022616e79222c202274656d706f72616c223a2022616e79227d2c20226461746170726f7065727479223a207b22666f726d6174223a2022696e616f6b615f70726f6772616d5f73616d706c655f73656d616e746963227d7d","32807  >  7000 Len=167"
"61","21.354398","192.168.11.29","192.168.11.6","TCP","74","","0.007417000","Jan  8, 2024 13:40:35.090787000 JST","","36790  >  6000 [SYN] Seq=0 Win=64240 Len=0 MSS=1460 SACK_PERM TSval=818773079 TSecr=0 WS=128"
"62","21.354538","192.168.11.6","192.168.11.29","TCP","74","0.000140000","0.000140000","Jan  8, 2024 13:40:35.090927000 JST","","6000  >  36790 [SYN, ACK] Seq=0 Ack=1 Win=65160 Len=0 MSS=1460 SACK_PERM TSval=677707286 TSecr=818773079 WS=128"
"63","22.348403","192.168.11.6","255.255.255.255","UDP","209","","0.993865000","Jan  8, 2024 13:40:36.084792000 JST","7b2273656d616e74696373223a207b22656e74697479223a2022504944222c202262617365656e74697479223a2022616e79222c2022726f6c65223a2022323232222c20227370617469616c223a2022616e79222c202274656d706f72616c223a2022616e79227d2c20226461746170726f7065727479223a207b22666f726d6174223a2022696e616f6b615f70726f6772616d5f73616d706c655f73656d616e746963227d7d","32807  >  7000 Len=167"
"64","22.368241","192.168.11.6","192.168.11.29","TCP","74","","0.019838000","Jan  8, 2024 13:40:36.104630000 JST","","[TCP Retransmission] 6000  >  36790 [SYN, ACK] Seq=0 Ack=1 Win=65160 Len=0 MSS=1460 SACK_PERM TSval=677708300 TSecr=818773079 WS=128"
"65","22.370565","192.168.11.29","192.168.11.6","TCP","74","","0.002324000","Jan  8, 2024 13:40:36.106954000 JST","","[TCP Retransmission] 36790  >  6000 [SYN] Seq=0 Win=64240 Len=0 MSS=1460 SACK_PERM TSval=818774093 TSecr=0 WS=128"
"66","22.370628","192.168.11.6","192.168.11.29","TCP","74","0.000063000","0.000063000","Jan  8, 2024 13:40:36.107017000 JST","","[TCP Retransmission] 6000  >  36790 [SYN, ACK] Seq=0 Ack=1 Win=65160 Len=0 MSS=1460 SACK_PERM TSval=677708302 TSecr=818773079 WS=128"
"67","22.394564","192.168.11.29","192.168.11.6","TCP","66","0.023936000","0.023936000","Jan  8, 2024 13:40:36.130953000 JST","","36790  >  6000 [ACK] Seq=1 Ack=1 Win=64256 Len=0 TSval=818774116 TSecr=677708300"
"68","22.395068","192.168.11.29","192.168.11.6","TCP","93","","0.000504000","Jan  8, 2024 13:40:36.131457000 JST","","36790  >  6000 [PSH, ACK] Seq=1 Ack=1 Win=64256 Len=27 TSval=818774116 TSecr=677708300 [TCP segment of a reassembled PDU]"
"69","22.395136","192.168.11.6","192.168.11.29","TCP","66","0.000068000","0.000068000","Jan  8, 2024 13:40:36.131525000 JST","","6000  >  36790 [ACK] Seq=1 Ack=28 Win=65152 Len=0 TSval=677708326 TSecr=818774116"
"70","22.395202","192.168.11.29","192.168.11.6","TCP","66","","0.000066000","Jan  8, 2024 13:40:36.131591000 JST","","36790  >  6000 [FIN, ACK] Seq=28 Ack=1 Win=64256 Len=0 TSval=818774116 TSecr=677708300"
"71","22.396391","192.168.11.6","192.168.11.29","TCP","66","0.001189000","0.001189000","Jan  8, 2024 13:40:36.132780000 JST","","6000  >  36790 [FIN, ACK] Seq=1 Ack=29 Win=65152 Len=0 TSval=677708328 TSecr=818774116"
"72","22.398671","192.168.11.29","192.168.11.6","TCP","66","","0.002280000","Jan  8, 2024 13:40:36.135060000 JST","","[TCP Dup ACK 67#1] 36790  >  6000 [ACK] Seq=29 Ack=1 Win=64256 Len=0 TSval=818774124 TSecr=677708300"
"73","22.403825","192.168.11.29","192.168.11.6","TCP","66","0.007434000","0.005154000","Jan  8, 2024 13:40:36.140214000 JST","","36790  >  6000 [ACK] Seq=29 Ack=2 Win=64256 Len=0 TSval=818774127 TSecr=677708328"
"74","29.072066","192.168.11.6","192.168.11.34","TCP","74","","6.668241000","Jan  8, 2024 13:40:42.808455000 JST","","56660  >  6000 [SYN] Seq=0 Win=64240 Len=0 MSS=1460 SACK_PERM TSval=1078070673 TSecr=0 WS=128"
"75","29.080255","192.168.11.34","192.168.11.6","TCP","74","0.008189000","0.008189000","Jan  8, 2024 13:40:42.816644000 JST","","6000  >  56660 [SYN, ACK] Seq=0 Ack=1 Win=65160 Len=0 MSS=1460 SACK_PERM TSval=3693153111 TSecr=1078070673 WS=128"
"76","29.080355","192.168.11.6","192.168.11.34","TCP","66","0.000100000","0.000100000","Jan  8, 2024 13:40:42.816744000 JST","","56660  >  6000 [ACK] Seq=1 Ack=1 Win=64256 Len=0 TSval=1078070682 TSecr=3693153111"
"77","29.080544","192.168.11.6","192.168.11.34","TCP","93","","0.000189000","Jan  8, 2024 13:40:42.816933000 JST","","56660  >  6000 [PSH, ACK] Seq=1 Ack=1 Win=64256 Len=27 TSval=1078070682 TSecr=3693153111 [TCP segment of a reassembled PDU]"
"78","29.080647","192.168.11.6","192.168.11.34","TCP","66","","0.000103000","Jan  8, 2024 13:40:42.817036000 JST","","56660  >  6000 [FIN, ACK] Seq=28 Ack=1 Win=64256 Len=0 TSval=1078070682 TSecr=3693153111"
"79","29.094783","192.168.11.34","192.168.11.6","TCP","66","0.014239000","0.014136000","Jan  8, 2024 13:40:42.831172000 JST","","6000  >  56660 [ACK] Seq=1 Ack=28 Win=65152 Len=0 TSval=3693153125 TSecr=1078070682"
"80","29.095023","192.168.11.34","192.168.11.6","TCP","66","0.014376000","0.000240000","Jan  8, 2024 13:40:42.831412000 JST","","6000  >  56660 [FIN, ACK] Seq=1 Ack=29 Win=65152 Len=0 TSval=3693153127 TSecr=1078070682"
"81","29.095065","192.168.11.6","192.168.11.34","TCP","66","0.000042000","0.000042000","Jan  8, 2024 13:40:42.831454000 JST","","56660  >  6000 [ACK] Seq=29 Ack=2 Win=64256 Len=0 TSval=1078070696 TSecr=3693153127"
"82","29.126237","192.168.11.6","255.255.255.255","UDP","209","","0.031172000","Jan  8, 2024 13:40:42.862626000 JST","7b2273656d616e74696373223a207b22656e74697479223a2022504944222c202262617365656e74697479223a2022616e79222c2022726f6c65223a2022323232222c20227370617469616c223a2022616e79222c202274656d706f72616c223a2022616e79227d2c20226461746170726f7065727479223a207b22666f726d6174223a2022696e616f6b615f70726f6772616d5f73616d706c655f73656d616e746963227d7d","35399  >  7000 Len=167"
"83","29.133675","192.168.11.29","192.168.11.6","TCP","74","","0.007438000","Jan  8, 2024 13:40:42.870064000 JST","","53212  >  6000 [SYN] Seq=0 Win=64240 Len=0 MSS=1460 SACK_PERM TSval=818780858 TSecr=0 WS=128"
"84","29.133804","192.168.11.6","192.168.11.29","TCP","74","0.000129000","0.000129000","Jan  8, 2024 13:40:42.870193000 JST","","6000  >  53212 [SYN, ACK] Seq=0 Ack=1 Win=65160 Len=0 MSS=1460 SACK_PERM TSval=677715065 TSecr=818780858 WS=128"
"85","29.146679","192.168.11.29","192.168.11.6","TCP","66","0.012875000","0.012875000","Jan  8, 2024 13:40:42.883068000 JST","","53212  >  6000 [ACK] Seq=1 Ack=1 Win=64256 Len=0 TSval=818780868 TSecr=677715065"
"86","29.147677","192.168.11.29","192.168.11.6","TCP","93","","0.000998000","Jan  8, 2024 13:40:42.884066000 JST","","53212  >  6000 [PSH, ACK] Seq=1 Ack=1 Win=64256 Len=27 TSval=818780869 TSecr=677715065 [TCP segment of a reassembled PDU]"
"87","29.147818","192.168.11.6","192.168.11.29","TCP","66","0.000141000","0.000141000","Jan  8, 2024 13:40:42.884207000 JST","","6000  >  53212 [ACK] Seq=1 Ack=28 Win=65152 Len=0 TSval=677715079 TSecr=818780869"
"88","29.147913","192.168.11.29","192.168.11.6","TCP","66","","0.000095000","Jan  8, 2024 13:40:42.884302000 JST","","53212  >  6000 [FIN, ACK] Seq=28 Ack=1 Win=64256 Len=0 TSval=818780869 TSecr=677715065"
"89","29.149633","192.168.11.6","192.168.11.29","TCP","66","0.001720000","0.001720000","Jan  8, 2024 13:40:42.886022000 JST","","6000  >  53212 [FIN, ACK] Seq=1 Ack=29 Win=65152 Len=0 TSval=677715081 TSecr=818780869"
"90","29.154448","192.168.11.29","192.168.11.6","TCP","66","0.004815000","0.004815000","Jan  8, 2024 13:40:42.890837000 JST","","53212  >  6000 [ACK] Seq=29 Ack=2 Win=64256 Len=0 TSval=818780880 TSecr=677715081"
"91","35.808553","192.168.11.6","192.168.11.34","TCP","74","","6.654105000","Jan  8, 2024 13:40:49.544942000 JST","","56664  >  6000 [SYN] Seq=0 Win=64240 Len=0 MSS=1460 SACK_PERM TSval=1078077410 TSecr=0 WS=128"
"92","35.815228","192.168.11.34","192.168.11.6","TCP","74","0.006675000","0.006675000","Jan  8, 2024 13:40:49.551617000 JST","","6000  >  56664 [SYN, ACK] Seq=0 Ack=1 Win=65160 Len=0 MSS=1460 SACK_PERM TSval=3693159846 TSecr=1078077410 WS=128"
"93","35.815320","192.168.11.6","192.168.11.34","TCP","66","0.000092000","0.000092000","Jan  8, 2024 13:40:49.551709000 JST","","56664  >  6000 [ACK] Seq=1 Ack=1 Win=64256 Len=0 TSval=1078077417 TSecr=3693159846"
"94","35.815440","192.168.11.6","192.168.11.34","TCP","93","","0.000120000","Jan  8, 2024 13:40:49.551829000 JST","","56664  >  6000 [PSH, ACK] Seq=1 Ack=1 Win=64256 Len=27 TSval=1078077417 TSecr=3693159846 [TCP segment of a reassembled PDU]"
"95","35.815537","192.168.11.6","192.168.11.34","TCP","66","","0.000097000","Jan  8, 2024 13:40:49.551926000 JST","","56664  >  6000 [FIN, ACK] Seq=28 Ack=1 Win=64256 Len=0 TSval=1078077417 TSecr=3693159846"
"96","35.832153","192.168.11.6","192.168.11.34","TCP","66","","0.016616000","Jan  8, 2024 13:40:49.568542000 JST","","[TCP Retransmission] 56664  >  6000 [FIN, ACK] Seq=28 Ack=1 Win=64256 Len=0 TSval=1078077434 TSecr=3693159846"
"97","35.832829","192.168.11.34","192.168.11.6","TCP","66","0.017389000","0.000676000","Jan  8, 2024 13:40:49.569218000 JST","","6000  >  56664 [ACK] Seq=1 Ack=28 Win=65152 Len=0 TSval=3693159861 TSecr=1078077417"
"98","35.833043","192.168.11.34","192.168.11.6","TCP","66","0.017506000","0.000214000","Jan  8, 2024 13:40:49.569432000 JST","","6000  >  56664 [FIN, ACK] Seq=1 Ack=29 Win=65152 Len=0 TSval=3693159863 TSecr=1078077417"
"99","35.833083","192.168.11.6","192.168.11.34","TCP","66","0.000040000","0.000040000","Jan  8, 2024 13:40:49.569472000 JST","","56664  >  6000 [ACK] Seq=29 Ack=2 Win=64256 Len=0 TSval=1078077434 TSecr=3693159863"
"100","35.838987","192.168.11.34","192.168.11.6","TCP","78","","0.005904000","Jan  8, 2024 13:40:49.575376000 JST","","[TCP Dup ACK 98#1] 6000  >  56664 [ACK] Seq=2 Ack=29 Win=65152 Len=0 TSval=3693159870 TSecr=1078077434 SLE=28 SRE=29"
"101","35.862871","192.168.11.6","255.255.255.255","UDP","209","","0.023884000","Jan  8, 2024 13:40:49.599260000 JST","7b2273656d616e74696373223a207b22656e74697479223a2022504944222c202262617365656e74697479223a2022616e79222c2022726f6c65223a2022323232222c20227370617469616c223a2022616e79222c202274656d706f72616c223a2022616e79227d2c20226461746170726f7065727479223a207b22666f726d6174223a2022696e616f6b615f70726f6772616d5f73616d706c655f73656d616e746963227d7d","42815  >  7000 Len=167"
"102","35.870229","192.168.11.29","192.168.11.6","TCP","74","","0.007358000","Jan  8, 2024 13:40:49.606618000 JST","","34414  >  6000 [SYN] Seq=0 Win=64240 Len=0 MSS=1460 SACK_PERM TSval=818787595 TSecr=0 WS=128"
"103","35.870356","192.168.11.6","192.168.11.29","TCP","74","0.000127000","0.000127000","Jan  8, 2024 13:40:49.606745000 JST","","6000  >  34414 [SYN, ACK] Seq=0 Ack=1 Win=65160 Len=0 MSS=1460 SACK_PERM TSval=677721802 TSecr=818787595 WS=128"
"104","35.886133","192.168.11.29","192.168.11.6","TCP","66","0.015777000","0.015777000","Jan  8, 2024 13:40:49.622522000 JST","","34414  >  6000 [ACK] Seq=1 Ack=1 Win=64256 Len=0 TSval=818787602 TSecr=677721802"
"105","35.886570","192.168.11.29","192.168.11.6","TCP","93","","0.000437000","Jan  8, 2024 13:40:49.622959000 JST","","34414  >  6000 [PSH, ACK] Seq=1 Ack=1 Win=64256 Len=27 TSval=818787602 TSecr=677721802 [TCP segment of a reassembled PDU]"
"106","35.886634","192.168.11.6","192.168.11.29","TCP","66","0.000064000","0.000064000","Jan  8, 2024 13:40:49.623023000 JST","","6000  >  34414 [ACK] Seq=1 Ack=28 Win=65152 Len=0 TSval=677721818 TSecr=818787602"
"107","35.886690","192.168.11.29","192.168.11.6","TCP","66","","0.000056000","Jan  8, 2024 13:40:49.623079000 JST","","34414  >  6000 [FIN, ACK] Seq=28 Ack=1 Win=64256 Len=0 TSval=818787602 TSecr=677721802"
"108","35.887518","192.168.11.6","192.168.11.29","TCP","66","0.000828000","0.000828000","Jan  8, 2024 13:40:49.623907000 JST","","6000  >  34414 [FIN, ACK] Seq=1 Ack=29 Win=65152 Len=0 TSval=677721819 TSecr=818787602"
"109","35.899417","192.168.11.29","192.168.11.6","TCP","66","0.011899000","0.011899000","Jan  8, 2024 13:40:49.635806000 JST","","34414  >  6000 [ACK] Seq=29 Ack=2 Win=64256 Len=0 TSval=818787619 TSecr=677721819"
"110","42.551546","192.168.11.6","192.168.11.34","TCP","74","","6.652129000","Jan  8, 2024 13:40:56.287935000 JST","","47144  >  6000 [SYN] Seq=0 Win=64240 Len=0 MSS=1460 SACK_PERM TSval=1078084153 TSecr=0 WS=128"
"111","42.563461","192.168.11.34","192.168.11.6","TCP","74","0.011915000","0.011915000","Jan  8, 2024 13:40:56.299850000 JST","","6000  >  47144 [SYN, ACK] Seq=0 Ack=1 Win=65160 Len=0 MSS=1460 SACK_PERM TSval=3693166591 TSecr=1078084153 WS=128"
"112","42.563562","192.168.11.6","192.168.11.34","TCP","66","0.000101000","0.000101000","Jan  8, 2024 13:40:56.299951000 JST","","47144  >  6000 [ACK] Seq=1 Ack=1 Win=64256 Len=0 TSval=1078084165 TSecr=3693166591"
"113","42.563950","192.168.11.6","192.168.11.34","TCP","93","","0.000388000","Jan  8, 2024 13:40:56.300339000 JST","","47144  >  6000 [PSH, ACK] Seq=1 Ack=1 Win=64256 Len=27 TSval=1078084165 TSecr=3693166591 [TCP segment of a reassembled PDU]"
"114","42.564283","192.168.11.6","192.168.11.34","TCP","66","","0.000333000","Jan  8, 2024 13:40:56.300672000 JST","","47144  >  6000 [FIN, ACK] Seq=28 Ack=1 Win=64256 Len=0 TSval=1078084166 TSecr=3693166591"
"115","42.571977","192.168.11.34","192.168.11.6","TCP","66","0.008027000","0.007694000","Jan  8, 2024 13:40:56.308366000 JST","","6000  >  47144 [ACK] Seq=1 Ack=28 Win=65152 Len=0 TSval=3693166602 TSecr=1078084165"
"116","42.572233","192.168.11.34","192.168.11.6","TCP","66","0.007950000","0.000256000","Jan  8, 2024 13:40:56.308622000 JST","","6000  >  47144 [FIN, ACK] Seq=1 Ack=29 Win=65152 Len=0 TSval=3693166604 TSecr=1078084166"
"117","42.572275","192.168.11.6","192.168.11.34","TCP","66","0.000042000","0.000042000","Jan  8, 2024 13:40:56.308664000 JST","","47144  >  6000 [ACK] Seq=29 Ack=2 Win=64256 Len=0 TSval=1078084174 TSecr=3693166604"
"118","42.602857","192.168.11.6","255.255.255.255","UDP","209","","0.030582000","Jan  8, 2024 13:40:56.339246000 JST","7b2273656d616e74696373223a207b22656e74697479223a2022504944222c202262617365656e74697479223a2022616e79222c2022726f6c65223a2022323232222c20227370617469616c223a2022616e79222c202274656d706f72616c223a2022616e79227d2c20226461746170726f7065727479223a207b22666f726d6174223a2022696e616f6b615f70726f6772616d5f73616d706c655f73656d616e746963227d7d","56690  >  7000 Len=167"
"119","42.610337","192.168.11.29","192.168.11.6","TCP","74","","0.007480000","Jan  8, 2024 13:40:56.346726000 JST","","34426  >  6000 [SYN] Seq=0 Win=64240 Len=0 MSS=1460 SACK_PERM TSval=818794335 TSecr=0 WS=128"
"120","42.610461","192.168.11.6","192.168.11.29","TCP","74","0.000124000","0.000124000","Jan  8, 2024 13:40:56.346850000 JST","","6000  >  34426 [SYN, ACK] Seq=0 Ack=1 Win=65160 Len=0 MSS=1460 SACK_PERM TSval=677728542 TSecr=818794335 WS=128"
"121","42.617492","192.168.11.29","192.168.11.6","TCP","66","0.007031000","0.007031000","Jan  8, 2024 13:40:56.353881000 JST","","34426  >  6000 [ACK] Seq=1 Ack=1 Win=64256 Len=0 TSval=818794342 TSecr=677728542"
"122","42.617921","192.168.11.29","192.168.11.6","TCP","93","","0.000429000","Jan  8, 2024 13:40:56.354310000 JST","","34426  >  6000 [PSH, ACK] Seq=1 Ack=1 Win=64256 Len=27 TSval=818794342 TSecr=677728542 [TCP segment of a reassembled PDU]"
"123","42.618002","192.168.11.6","192.168.11.29","TCP","66","0.000081000","0.000081000","Jan  8, 2024 13:40:56.354391000 JST","","6000  >  34426 [ACK] Seq=1 Ack=28 Win=65152 Len=0 TSval=677728549 TSecr=818794342"
"124","42.618275","192.168.11.29","192.168.11.6","TCP","66","","0.000273000","Jan  8, 2024 13:40:56.354664000 JST","","34426  >  6000 [FIN, ACK] Seq=28 Ack=1 Win=64256 Len=0 TSval=818794342 TSecr=677728542"
"125","42.620856","192.168.11.6","192.168.11.29","TCP","66","0.002581000","0.002581000","Jan  8, 2024 13:40:56.357245000 JST","","6000  >  34426 [FIN, ACK] Seq=1 Ack=29 Win=65152 Len=0 TSval=677728552 TSecr=818794342"
"126","42.627966","192.168.11.29","192.168.11.6","TCP","66","0.007110000","0.007110000","Jan  8, 2024 13:40:56.364355000 JST","","34426  >  6000 [ACK] Seq=29 Ack=2 Win=64256 Len=0 TSval=818794352 TSecr=677728552"
"127","49.274400","192.168.11.6","192.168.11.34","TCP","74","","6.646434000","Jan  8, 2024 13:41:03.010789000 JST","","58482  >  6000 [SYN] Seq=0 Win=64240 Len=0 MSS=1460 SACK_PERM TSval=1078090876 TSecr=0 WS=128"
"128","49.281258","192.168.11.34","192.168.11.6","TCP","74","0.006858000","0.006858000","Jan  8, 2024 13:41:03.017647000 JST","","6000  >  58482 [SYN, ACK] Seq=0 Ack=1 Win=65160 Len=0 MSS=1460 SACK_PERM TSval=3693173312 TSecr=1078090876 WS=128"
"129","49.281369","192.168.11.6","192.168.11.34","TCP","66","0.000111000","0.000111000","Jan  8, 2024 13:41:03.017758000 JST","","58482  >  6000 [ACK] Seq=1 Ack=1 Win=64256 Len=0 TSval=1078090883 TSecr=3693173312"
"130","49.281544","192.168.11.6","192.168.11.34","TCP","93","","0.000175000","Jan  8, 2024 13:41:03.017933000 JST","","58482  >  6000 [PSH, ACK] Seq=1 Ack=1 Win=64256 Len=27 TSval=1078090883 TSecr=3693173312 [TCP segment of a reassembled PDU]"
"131","49.281639","192.168.11.6","192.168.11.34","TCP","66","","0.000095000","Jan  8, 2024 13:41:03.018028000 JST","","58482  >  6000 [FIN, ACK] Seq=28 Ack=1 Win=64256 Len=0 TSval=1078090883 TSecr=3693173312"
"132","49.289100","192.168.11.34","192.168.11.6","TCP","66","0.007556000","0.007461000","Jan  8, 2024 13:41:03.025489000 JST","","6000  >  58482 [ACK] Seq=1 Ack=28 Win=65152 Len=0 TSval=3693173319 TSecr=1078090883"
"133","49.289347","192.168.11.34","192.168.11.6","TCP","66","0.007708000","0.000247000","Jan  8, 2024 13:41:03.025736000 JST","","6000  >  58482 [FIN, ACK] Seq=1 Ack=29 Win=65152 Len=0 TSval=3693173321 TSecr=1078090883"
"134","49.289390","192.168.11.6","192.168.11.34","TCP","66","0.000043000","0.000043000","Jan  8, 2024 13:41:03.025779000 JST","","58482  >  6000 [ACK] Seq=29 Ack=2 Win=64256 Len=0 TSval=1078090891 TSecr=3693173321"
"135","49.320081","192.168.11.6","255.255.255.255","UDP","209","","0.030691000","Jan  8, 2024 13:41:03.056470000 JST","7b2273656d616e74696373223a207b22656e74697479223a2022504944222c202262617365656e74697479223a2022616e79222c2022726f6c65223a2022323232222c20227370617469616c223a2022616e79222c202274656d706f72616c223a2022616e79227d2c20226461746170726f7065727479223a207b22666f726d6174223a2022696e616f6b615f70726f6772616d5f73616d706c655f73656d616e746963227d7d","39976  >  7000 Len=167"
"136","49.340577","192.168.11.29","192.168.11.6","TCP","74","","0.020496000","Jan  8, 2024 13:41:03.076966000 JST","","37476  >  6000 [SYN] Seq=0 Win=64240 Len=0 MSS=1460 SACK_PERM TSval=818801054 TSecr=0 WS=128"
"137","49.340701","192.168.11.6","192.168.11.29","TCP","74","0.000124000","0.000124000","Jan  8, 2024 13:41:03.077090000 JST","","6000  >  37476 [SYN, ACK] Seq=0 Ack=1 Win=65160 Len=0 MSS=1460 SACK_PERM TSval=677735272 TSecr=818801054 WS=128"
"138","49.349515","192.168.11.29","192.168.11.6","TCP","66","0.008814000","0.008814000","Jan  8, 2024 13:41:03.085904000 JST","","37476  >  6000 [ACK] Seq=1 Ack=1 Win=64256 Len=0 TSval=818801072 TSecr=677735272"
"139","49.349918","192.168.11.29","192.168.11.6","TCP","93","","0.000403000","Jan  8, 2024 13:41:03.086307000 JST","","37476  >  6000 [PSH, ACK] Seq=1 Ack=1 Win=64256 Len=27 TSval=818801072 TSecr=677735272 [TCP segment of a reassembled PDU]"
"140","49.349960","192.168.11.6","192.168.11.29","TCP","66","0.000042000","0.000042000","Jan  8, 2024 13:41:03.086349000 JST","","6000  >  37476 [ACK] Seq=1 Ack=28 Win=65152 Len=0 TSval=677735281 TSecr=818801072"
"141","49.350009","192.168.11.29","192.168.11.6","TCP","66","","0.000049000","Jan  8, 2024 13:41:03.086398000 JST","","37476  >  6000 [FIN, ACK] Seq=28 Ack=1 Win=64256 Len=0 TSval=818801072 TSecr=677735272"
"142","49.350752","192.168.11.6","192.168.11.29","TCP","66","0.000743000","0.000743000","Jan  8, 2024 13:41:03.087141000 JST","","6000  >  37476 [FIN, ACK] Seq=1 Ack=29 Win=65152 Len=0 TSval=677735282 TSecr=818801072"
"143","49.356976","192.168.11.29","192.168.11.6","TCP","66","0.006224000","0.006224000","Jan  8, 2024 13:41:03.093365000 JST","","37476  >  6000 [ACK] Seq=29 Ack=2 Win=64256 Len=0 TSval=818801082 TSecr=677735282"
"144","55.995095","192.168.11.6","192.168.11.34","TCP","74","","6.638119000","Jan  8, 2024 13:41:09.731484000 JST","","58488  >  6000 [SYN] Seq=0 Win=64240 Len=0 MSS=1460 SACK_PERM TSval=1078097596 TSecr=0 WS=128"
"145","56.001956","192.168.11.34","192.168.11.6","TCP","74","0.006861000","0.006861000","Jan  8, 2024 13:41:09.738345000 JST","","6000  >  58488 [SYN, ACK] Seq=0 Ack=1 Win=65160 Len=0 MSS=1460 SACK_PERM TSval=3693180033 TSecr=1078097596 WS=128"
"146","56.002053","192.168.11.6","192.168.11.34","TCP","66","0.000097000","0.000097000","Jan  8, 2024 13:41:09.738442000 JST","","58488  >  6000 [ACK] Seq=1 Ack=1 Win=64256 Len=0 TSval=1078097603 TSecr=3693180033"
"147","56.002194","192.168.11.6","192.168.11.34","TCP","93","","0.000141000","Jan  8, 2024 13:41:09.738583000 JST","","58488  >  6000 [PSH, ACK] Seq=1 Ack=1 Win=64256 Len=27 TSval=1078097604 TSecr=3693180033 [TCP segment of a reassembled PDU]"
"148","56.002284","192.168.11.6","192.168.11.34","TCP","66","","0.000090000","Jan  8, 2024 13:41:09.738673000 JST","","58488  >  6000 [FIN, ACK] Seq=28 Ack=1 Win=64256 Len=0 TSval=1078097604 TSecr=3693180033"
"149","56.012423","192.168.11.34","192.168.11.6","TCP","66","0.010229000","0.010139000","Jan  8, 2024 13:41:09.748812000 JST","","6000  >  58488 [ACK] Seq=1 Ack=28 Win=65152 Len=0 TSval=3693180042 TSecr=1078097604"
"150","56.012666","192.168.11.34","192.168.11.6","TCP","66","0.010382000","0.000243000","Jan  8, 2024 13:41:09.749055000 JST","","6000  >  58488 [FIN, ACK] Seq=1 Ack=29 Win=65152 Len=0 TSval=3693180044 TSecr=1078097604"
"151","56.012709","192.168.11.6","192.168.11.34","TCP","66","0.000043000","0.000043000","Jan  8, 2024 13:41:09.749098000 JST","","58488  >  6000 [ACK] Seq=29 Ack=2 Win=64256 Len=0 TSval=1078097614 TSecr=3693180044"
"152","56.044690","192.168.11.6","255.255.255.255","UDP","209","","0.031981000","Jan  8, 2024 13:41:09.781079000 JST","7b2273656d616e74696373223a207b22656e74697479223a2022504944222c202262617365656e74697479223a2022616e79222c2022726f6c65223a2022323232222c20227370617469616c223a2022616e79222c202274656d706f72616c223a2022616e79227d2c20226461746170726f7065727479223a207b22666f726d6174223a2022696e616f6b615f70726f6772616d5f73616d706c655f73656d616e746963227d7d","47749  >  7000 Len=167"
"153","56.052026","192.168.11.29","192.168.11.6","TCP","74","","0.007336000","Jan  8, 2024 13:41:09.788415000 JST","","57588  >  6000 [SYN] Seq=0 Win=64240 Len=0 MSS=1460 SACK_PERM TSval=818807777 TSecr=0 WS=128"
"154","56.052187","192.168.11.6","192.168.11.29","TCP","74","0.000161000","0.000161000","Jan  8, 2024 13:41:09.788576000 JST","","6000  >  57588 [SYN, ACK] Seq=0 Ack=1 Win=65160 Len=0 MSS=1460 SACK_PERM TSval=677741984 TSecr=818807777 WS=128"
"155","56.058904","192.168.11.29","192.168.11.6","TCP","66","0.006717000","0.006717000","Jan  8, 2024 13:41:09.795293000 JST","","57588  >  6000 [ACK] Seq=1 Ack=1 Win=64256 Len=0 TSval=818807784 TSecr=677741984"
"156","56.059507","192.168.11.29","192.168.11.6","TCP","93","","0.000603000","Jan  8, 2024 13:41:09.795896000 JST","","57588  >  6000 [PSH, ACK] Seq=1 Ack=1 Win=64256 Len=27 TSval=818807784 TSecr=677741984 [TCP segment of a reassembled PDU]"
"157","56.059601","192.168.11.6","192.168.11.29","TCP","66","0.000094000","0.000094000","Jan  8, 2024 13:41:09.795990000 JST","","6000  >  57588 [ACK] Seq=1 Ack=28 Win=65152 Len=0 TSval=677741991 TSecr=818807784"
"158","56.059676","192.168.11.29","192.168.11.6","TCP","66","","0.000075000","Jan  8, 2024 13:41:09.796065000 JST","","57588  >  6000 [FIN, ACK] Seq=28 Ack=1 Win=64256 Len=0 TSval=818807784 TSecr=677741984"
"159","56.061037","192.168.11.6","192.168.11.29","TCP","66","0.001361000","0.001361000","Jan  8, 2024 13:41:09.797426000 JST","","6000  >  57588 [FIN, ACK] Seq=1 Ack=29 Win=65152 Len=0 TSval=677741992 TSecr=818807784"
"160","56.066861","192.168.11.29","192.168.11.6","TCP","66","0.005824000","0.005824000","Jan  8, 2024 13:41:09.803250000 JST","","57588  >  6000 [ACK] Seq=29 Ack=2 Win=64256 Len=0 TSval=818807791 TSecr=677741992"
"161","62.642102","192.168.11.6","192.168.11.34","TCP","74","","6.575241000","Jan  8, 2024 13:41:16.378491000 JST","","33112  >  6000 [SYN] Seq=0 Win=64240 Len=0 MSS=1460 SACK_PERM TSval=1078104243 TSecr=0 WS=128"
"162","62.648916","192.168.11.34","192.168.11.6","TCP","74","0.006814000","0.006814000","Jan  8, 2024 13:41:16.385305000 JST","","6000  >  33112 [SYN, ACK] Seq=0 Ack=1 Win=65160 Len=0 MSS=1460 SACK_PERM TSval=3693186679 TSecr=1078104243 WS=128"
"163","62.649013","192.168.11.6","192.168.11.34","TCP","66","0.000097000","0.000097000","Jan  8, 2024 13:41:16.385402000 JST","","33112  >  6000 [ACK] Seq=1 Ack=1 Win=64256 Len=0 TSval=1078104250 TSecr=3693186679"
"164","62.649146","192.168.11.6","192.168.11.34","TCP","93","","0.000133000","Jan  8, 2024 13:41:16.385535000 JST","","33112  >  6000 [PSH, ACK] Seq=1 Ack=1 Win=64256 Len=27 TSval=1078104251 TSecr=3693186679 [TCP segment of a reassembled PDU]"
"165","62.649233","192.168.11.6","192.168.11.34","TCP","66","","0.000087000","Jan  8, 2024 13:41:16.385622000 JST","","33112  >  6000 [FIN, ACK] Seq=28 Ack=1 Win=64256 Len=0 TSval=1078104251 TSecr=3693186679"
"166","62.664948","192.168.11.34","192.168.11.6","TCP","66","0.015802000","0.015715000","Jan  8, 2024 13:41:16.401337000 JST","","6000  >  33112 [ACK] Seq=1 Ack=28 Win=65152 Len=0 TSval=3693186696 TSecr=1078104251"
"167","62.665318","192.168.11.34","192.168.11.6","TCP","66","0.016085000","0.000370000","Jan  8, 2024 13:41:16.401707000 JST","","6000  >  33112 [FIN, ACK] Seq=1 Ack=29 Win=65152 Len=0 TSval=3693186697 TSecr=1078104251"
"168","62.665361","192.168.11.6","192.168.11.34","TCP","66","0.000043000","0.000043000","Jan  8, 2024 13:41:16.401750000 JST","","33112  >  6000 [ACK] Seq=29 Ack=2 Win=64256 Len=0 TSval=1078104267 TSecr=3693186697"
