No.,Time,Source,Destination,Protocol,Length,The RTT to ACK the segment was,XXX,Time delta from previous captured frame,Arrival Time,Data,Info
9,0.046285,192.168.11.17,255.255.255.255,UDP,209,,Ÿ,0.030853,"Jan  5, 2024 21:25:08.724196000 JST",7b2273656d616e74696373223a207b22656e74697479223a2022504944222c202262617365656e74697479223a2022616e79222c2022726f6c65223a2022343434222c20227370617469616c223a2022616e79222c202274656d706f72616c223a2022616e79227d2c20226461746170726f7065727479223a207b22666f726d6174223a2022696e616f6b615f70726f6772616d5f73616d706c655f73656d616e746963227d7d,42544  >  7000 Len=167
10,0.057806,192.168.11.14,192.168.11.17,TCP,74,,œ,0.011521,"Jan  5, 2024 21:25:08.735717000 JST",,57348  >  6000 [SYN] Seq=0 Win=64240 Len=0 MSS=1460 SACK_PERM TSval=2612148038 TSecr=0 WS=128
11,0.05797,192.168.11.17,192.168.11.14,TCP,74,0.000164,,0.000164,"Jan  5, 2024 21:25:08.735881000 JST",,"6000  >  57348 [SYN, ACK] Seq=0 Ack=1 Win=65160 Len=0 MSS=1460 SACK_PERM TSval=281286147 TSecr=2612148038 WS=128"
12,0.064782,192.168.11.14,192.168.11.17,TCP,66,0.006812,,0.006812,"Jan  5, 2024 21:25:08.742693000 JST",,57348  >  6000 [ACK] Seq=1 Ack=1 Win=64256 Len=0 TSval=2612148048 TSecr=281286147
13,0.065477,192.168.11.14,192.168.11.17,TCP,93,,,0.000695,"Jan  5, 2024 21:25:08.743388000 JST",,"57348  >  6000 [PSH, ACK] Seq=1 Ack=1 Win=64256 Len=27 TSval=2612148048 TSecr=281286147 [TCP segment of a reassembled PDU]"
14,0.065578,192.168.11.17,192.168.11.14,TCP,66,0.000101,,0.000101,"Jan  5, 2024 21:25:08.743489000 JST",,6000  >  57348 [ACK] Seq=1 Ack=28 Win=65152 Len=0 TSval=281286154 TSecr=2612148048
15,0.06568,192.168.11.14,192.168.11.17,TCP,66,,,0.000102,"Jan  5, 2024 21:25:08.743591000 JST",,"57348  >  6000 [FIN, ACK] Seq=28 Ack=1 Win=64256 Len=0 TSval=2612148048 TSecr=281286147"
16,0.068568,192.168.11.17,192.168.11.14,TCP,66,0.002888,,0.002888,"Jan  5, 2024 21:25:08.746479000 JST",,"6000  >  57348 [FIN, ACK] Seq=1 Ack=29 Win=65152 Len=0 TSval=281286157 TSecr=2612148048"
17,0.076002,192.168.11.14,192.168.11.17,TCP,66,0.007434,,0.007434,"Jan  5, 2024 21:25:08.753913000 JST",,57348  >  6000 [ACK] Seq=29 Ack=2 Win=64256 Len=0 TSval=2612148059 TSecr=281286157
18,7.709458,192.168.11.17,192.168.11.4,TCP,74,,,7.633456,"Jan  5, 2024 21:25:16.387369000 JST",,51074  >  6000 [SYN] Seq=0 Win=64240 Len=0 MSS=1460 SACK_PERM TSval=1610863033 TSecr=0 WS=128
19,7.716306,192.168.11.4,192.168.11.17,TCP,74,0.006848,,0.006848,"Jan  5, 2024 21:25:16.394217000 JST",,"6000  >  51074 [SYN, ACK] Seq=0 Ack=1 Win=65160 Len=0 MSS=1460 SACK_PERM TSval=2677265238 TSecr=1610863033 WS=128"
20,7.716404,192.168.11.17,192.168.11.4,TCP,66,0.000098,,0.000098,"Jan  5, 2024 21:25:16.394315000 JST",,51074  >  6000 [ACK] Seq=1 Ack=1 Win=64256 Len=0 TSval=1610863040 TSecr=2677265238
21,7.716676,192.168.11.17,192.168.11.4,TCP,93,,,0.000272,"Jan  5, 2024 21:25:16.394587000 JST",,"51074  >  6000 [PSH, ACK] Seq=1 Ack=1 Win=64256 Len=27 TSval=1610863041 TSecr=2677265238 [TCP segment of a reassembled PDU]"
22,7.716834,192.168.11.17,192.168.11.4,TCP,66,,,0.000158,"Jan  5, 2024 21:25:16.394745000 JST",,"51074  >  6000 [FIN, ACK] Seq=28 Ack=1 Win=64256 Len=0 TSval=1610863041 TSecr=2677265238"
23,7.72756,192.168.11.4,192.168.11.17,TCP,66,0.010884,,0.010726,"Jan  5, 2024 21:25:16.405471000 JST",,6000  >  51074 [ACK] Seq=1 Ack=28 Win=65152 Len=0 TSval=2677265246 TSecr=1610863041
24,7.727983,192.168.11.4,192.168.11.17,TCP,66,0.011149,,0.000423,"Jan  5, 2024 21:25:16.405894000 JST",,"6000  >  51074 [FIN, ACK] Seq=1 Ack=29 Win=65152 Len=0 TSval=2677265248 TSecr=1610863041"
25,7.728031,192.168.11.17,192.168.11.4,TCP,66,0.000048,,0.000048,"Jan  5, 2024 21:25:16.405942000 JST",,51074  >  6000 [ACK] Seq=29 Ack=2 Win=64256 Len=0 TSval=1610863052 TSecr=2677265248
26,7.756686,192.168.11.17,255.255.255.255,UDP,209,,Ÿ,0.028655,"Jan  5, 2024 21:25:16.434597000 JST",7b2273656d616e74696373223a207b22656e74697479223a2022504944222c202262617365656e74697479223a2022616e79222c2022726f6c65223a2022343434222c20227370617469616c223a2022616e79222c202274656d706f72616c223a2022616e79227d2c20226461746170726f7065727479223a207b22666f726d6174223a2022696e616f6b615f70726f6772616d5f73616d706c655f73656d616e746963227d7d,36719  >  7000 Len=167
27,7.766353,192.168.11.14,192.168.11.17,TCP,74,,œ,0.009667,"Jan  5, 2024 21:25:16.444264000 JST",,54498  >  6000 [SYN] Seq=0 Win=64240 Len=0 MSS=1460 SACK_PERM TSval=2612155749 TSecr=0 WS=128
28,7.766506,192.168.11.17,192.168.11.14,TCP,74,0.000153,,0.000153,"Jan  5, 2024 21:25:16.444417000 JST",,"6000  >  54498 [SYN, ACK] Seq=0 Ack=1 Win=65160 Len=0 MSS=1460 SACK_PERM TSval=281293855 TSecr=2612155749 WS=128"
29,7.7763,192.168.11.14,192.168.11.17,TCP,66,0.009794,,0.009794,"Jan  5, 2024 21:25:16.454211000 JST",,54498  >  6000 [ACK] Seq=1 Ack=1 Win=64256 Len=0 TSval=2612155757 TSecr=281293855
30,7.776798,192.168.11.14,192.168.11.17,TCP,93,,,0.000498,"Jan  5, 2024 21:25:16.454709000 JST",,"54498  >  6000 [PSH, ACK] Seq=1 Ack=1 Win=64256 Len=27 TSval=2612155757 TSecr=281293855 [TCP segment of a reassembled PDU]"
31,7.776884,192.168.11.17,192.168.11.14,TCP,66,0.000086,,0.000086,"Jan  5, 2024 21:25:16.454795000 JST",,6000  >  54498 [ACK] Seq=1 Ack=28 Win=65152 Len=0 TSval=281293866 TSecr=2612155757
32,7.776956,192.168.11.14,192.168.11.17,TCP,66,,,0.000072,"Jan  5, 2024 21:25:16.454867000 JST",,"54498  >  6000 [FIN, ACK] Seq=28 Ack=1 Win=64256 Len=0 TSval=2612155758 TSecr=281293855"
33,7.779013,192.168.11.17,192.168.11.14,TCP,66,0.002057,,0.002057,"Jan  5, 2024 21:25:16.456924000 JST",,"6000  >  54498 [FIN, ACK] Seq=1 Ack=29 Win=65152 Len=0 TSval=281293868 TSecr=2612155758"
34,7.793388,192.168.11.14,192.168.11.17,TCP,66,0.014375,,0.014375,"Jan  5, 2024 21:25:16.471299000 JST",,54498  >  6000 [ACK] Seq=29 Ack=2 Win=64256 Len=0 TSval=2612155767 TSecr=281293868
35,15.4238,192.168.11.17,192.168.11.4,TCP,74,,,7.630412,"Jan  5, 2024 21:25:24.101711000 JST",,47770  >  6000 [SYN] Seq=0 Win=64240 Len=0 MSS=1460 SACK_PERM TSval=1610870748 TSecr=0 WS=128
36,15.430502,192.168.11.4,192.168.11.17,TCP,74,0.006702,,0.006702,"Jan  5, 2024 21:25:24.108413000 JST",,"6000  >  47770 [SYN, ACK] Seq=0 Ack=1 Win=65160 Len=0 MSS=1460 SACK_PERM TSval=2677272952 TSecr=1610870748 WS=128"
37,15.430608,192.168.11.17,192.168.11.4,TCP,66,0.000106,,0.000106,"Jan  5, 2024 21:25:24.108519000 JST",,47770  >  6000 [ACK] Seq=1 Ack=1 Win=64256 Len=0 TSval=1610870754 TSecr=2677272952
38,15.430791,192.168.11.17,192.168.11.4,TCP,93,,,0.000183,"Jan  5, 2024 21:25:24.108702000 JST",,"47770  >  6000 [PSH, ACK] Seq=1 Ack=1 Win=64256 Len=27 TSval=1610870755 TSecr=2677272952 [TCP segment of a reassembled PDU]"
39,15.430894,192.168.11.17,192.168.11.4,TCP,66,,,0.000103,"Jan  5, 2024 21:25:24.108805000 JST",,"47770  >  6000 [FIN, ACK] Seq=28 Ack=1 Win=64256 Len=0 TSval=1610870755 TSecr=2677272952"
40,15.438327,192.168.11.4,192.168.11.17,TCP,66,0.007536,,0.007433,"Jan  5, 2024 21:25:24.116238000 JST",,6000  >  47770 [ACK] Seq=1 Ack=28 Win=65152 Len=0 TSval=2677272959 TSecr=1610870755
41,15.438542,192.168.11.4,192.168.11.17,TCP,66,0.007648,,0.000215,"Jan  5, 2024 21:25:24.116453000 JST",,"6000  >  47770 [FIN, ACK] Seq=1 Ack=29 Win=65152 Len=0 TSval=2677272961 TSecr=1610870755"
42,15.438587,192.168.11.17,192.168.11.4,TCP,66,0.000045,,0.000045,"Jan  5, 2024 21:25:24.116498000 JST",,47770  >  6000 [ACK] Seq=29 Ack=2 Win=64256 Len=0 TSval=1610870762 TSecr=2677272961
43,15.468621,192.168.11.17,255.255.255.255,UDP,209,,Ÿ,0.030034,"Jan  5, 2024 21:25:24.146532000 JST",7b2273656d616e74696373223a207b22656e74697479223a2022504944222c202262617365656e74697479223a2022616e79222c2022726f6c65223a2022343434222c20227370617469616c223a2022616e79222c202274656d706f72616c223a2022616e79227d2c20226461746170726f7065727479223a207b22666f726d6174223a2022696e616f6b615f70726f6772616d5f73616d706c655f73656d616e746963227d7d,38577  >  7000 Len=167
44,15.476343,192.168.11.14,192.168.11.17,TCP,74,,œ,0.007722,"Jan  5, 2024 21:25:24.154254000 JST",,57646  >  6000 [SYN] Seq=0 Win=64240 Len=0 MSS=1460 SACK_PERM TSval=2612163460 TSecr=0 WS=128
45,15.476492,192.168.11.17,192.168.11.14,TCP,74,0.000149,,0.000149,"Jan  5, 2024 21:25:24.154403000 JST",,"6000  >  57646 [SYN, ACK] Seq=0 Ack=1 Win=65160 Len=0 MSS=1460 SACK_PERM TSval=281301565 TSecr=2612163460 WS=128"
46,15.483116,192.168.11.14,192.168.11.17,TCP,66,0.006624,,0.006624,"Jan  5, 2024 21:25:24.161027000 JST",,57646  >  6000 [ACK] Seq=1 Ack=1 Win=64256 Len=0 TSval=2612163466 TSecr=281301565
47,15.483707,192.168.11.14,192.168.11.17,TCP,93,,,0.000591,"Jan  5, 2024 21:25:24.161618000 JST",,"57646  >  6000 [PSH, ACK] Seq=1 Ack=1 Win=64256 Len=27 TSval=2612163467 TSecr=281301565 [TCP segment of a reassembled PDU]"
48,15.483795,192.168.11.17,192.168.11.14,TCP,66,0.000088,,0.000088,"Jan  5, 2024 21:25:24.161706000 JST",,6000  >  57646 [ACK] Seq=1 Ack=28 Win=65152 Len=0 TSval=281301573 TSecr=2612163467
49,15.483857,192.168.11.14,192.168.11.17,TCP,66,,,0.000062,"Jan  5, 2024 21:25:24.161768000 JST",,"57646  >  6000 [FIN, ACK] Seq=28 Ack=1 Win=64256 Len=0 TSval=2612163467 TSecr=281301565"
50,15.48522,192.168.11.17,192.168.11.14,TCP,66,0.001363,,0.001363,"Jan  5, 2024 21:25:24.163131000 JST",,"6000  >  57646 [FIN, ACK] Seq=1 Ack=29 Win=65152 Len=0 TSval=281301574 TSecr=2612163467"
51,15.491498,192.168.11.14,192.168.11.17,TCP,66,0.006278,,0.006278,"Jan  5, 2024 21:25:24.169409000 JST",,57646  >  6000 [ACK] Seq=29 Ack=2 Win=64256 Len=0 TSval=2612163474 TSecr=281301574
52,22.044524,192.168.11.17,192.168.11.4,TCP,74,,,6.553026,"Jan  5, 2024 21:25:30.722435000 JST",,48142  >  6000 [SYN] Seq=0 Win=64240 Len=0 MSS=1460 SACK_PERM TSval=1610877368 TSecr=0 WS=128
53,22.051237,192.168.11.4,192.168.11.17,TCP,74,0.006713,,0.006713,"Jan  5, 2024 21:25:30.729148000 JST",,"6000  >  48142 [SYN, ACK] Seq=0 Ack=1 Win=65160 Len=0 MSS=1460 SACK_PERM TSval=2677279573 TSecr=1610877368 WS=128"
54,22.05135,192.168.11.17,192.168.11.4,TCP,66,0.000113,,0.000113,"Jan  5, 2024 21:25:30.729261000 JST",,48142  >  6000 [ACK] Seq=1 Ack=1 Win=64256 Len=0 TSval=1610877375 TSecr=2677279573
55,22.051526,192.168.11.17,192.168.11.4,TCP,93,,,0.000176,"Jan  5, 2024 21:25:30.729437000 JST",,"48142  >  6000 [PSH, ACK] Seq=1 Ack=1 Win=64256 Len=27 TSval=1610877375 TSecr=2677279573 [TCP segment of a reassembled PDU]"
56,22.051691,192.168.11.17,192.168.11.4,TCP,66,,,0.000165,"Jan  5, 2024 21:25:30.729602000 JST",,"48142  >  6000 [FIN, ACK] Seq=28 Ack=1 Win=64256 Len=0 TSval=1610877376 TSecr=2677279573"
57,22.058761,192.168.11.4,192.168.11.17,TCP,66,0.007235,,0.00707,"Jan  5, 2024 21:25:30.736672000 JST",,6000  >  48142 [ACK] Seq=1 Ack=28 Win=65152 Len=0 TSval=2677279580 TSecr=1610877375
58,22.059129,192.168.11.4,192.168.11.17,TCP,66,0.007438,,0.000368,"Jan  5, 2024 21:25:30.737040000 JST",,"6000  >  48142 [FIN, ACK] Seq=1 Ack=29 Win=65152 Len=0 TSval=2677279581 TSecr=1610877376"
59,22.059183,192.168.11.17,192.168.11.4,TCP,66,0.000054,,0.000054,"Jan  5, 2024 21:25:30.737094000 JST",,48142  >  6000 [ACK] Seq=29 Ack=2 Win=64256 Len=0 TSval=1610877383 TSecr=2677279581
60,22.090358,192.168.11.17,255.255.255.255,UDP,209,,Ÿ,0.031175,"Jan  5, 2024 21:25:30.768269000 JST",7b2273656d616e74696373223a207b22656e74697479223a2022504944222c202262617365656e74697479223a2022616e79222c2022726f6c65223a2022343434222c20227370617469616c223a2022616e79222c202274656d706f72616c223a2022616e79227d2c20226461746170726f7065727479223a207b22666f726d6174223a2022696e616f6b615f70726f6772616d5f73616d706c655f73656d616e746963227d7d,39472  >  7000 Len=167
61,22.098491,192.168.11.14,192.168.11.17,TCP,74,,œ,0.008133,"Jan  5, 2024 21:25:30.776402000 JST",,57656  >  6000 [SYN] Seq=0 Win=64240 Len=0 MSS=1460 SACK_PERM TSval=2612170082 TSecr=0 WS=128
62,22.098639,192.168.11.17,192.168.11.14,TCP,74,0.000148,,0.000148,"Jan  5, 2024 21:25:30.776550000 JST",,"6000  >  57656 [SYN, ACK] Seq=0 Ack=1 Win=65160 Len=0 MSS=1460 SACK_PERM TSval=281308188 TSecr=2612170082 WS=128"
63,22.105557,192.168.11.14,192.168.11.17,TCP,66,0.006918,,0.006918,"Jan  5, 2024 21:25:30.783468000 JST",,57656  >  6000 [ACK] Seq=1 Ack=1 Win=64256 Len=0 TSval=2612170089 TSecr=281308188
64,22.106095,192.168.11.14,192.168.11.17,TCP,93,,,0.000538,"Jan  5, 2024 21:25:30.784006000 JST",,"57656  >  6000 [PSH, ACK] Seq=1 Ack=1 Win=64256 Len=27 TSval=2612170089 TSecr=281308188 [TCP segment of a reassembled PDU]"
65,22.106172,192.168.11.17,192.168.11.14,TCP,66,0.000077,,0.000077,"Jan  5, 2024 21:25:30.784083000 JST",,6000  >  57656 [ACK] Seq=1 Ack=28 Win=65152 Len=0 TSval=281308195 TSecr=2612170089
66,22.106243,192.168.11.14,192.168.11.17,TCP,66,,,0.000071,"Jan  5, 2024 21:25:30.784154000 JST",,"57656  >  6000 [FIN, ACK] Seq=28 Ack=1 Win=64256 Len=0 TSval=2612170089 TSecr=281308188"
67,22.107321,192.168.11.17,192.168.11.14,TCP,66,0.001078,,0.001078,"Jan  5, 2024 21:25:30.785232000 JST",,"6000  >  57656 [FIN, ACK] Seq=1 Ack=29 Win=65152 Len=0 TSval=281308196 TSecr=2612170089"
68,22.11406,192.168.11.14,192.168.11.17,TCP,66,0.006739,,0.006739,"Jan  5, 2024 21:25:30.791971000 JST",,57656  >  6000 [ACK] Seq=29 Ack=2 Win=64256 Len=0 TSval=2612170097 TSecr=281308196
69,28.722533,192.168.11.17,192.168.11.4,TCP,74,,,6.608473,"Jan  5, 2024 21:25:37.400444000 JST",,56092  >  6000 [SYN] Seq=0 Win=64240 Len=0 MSS=1460 SACK_PERM TSval=1610884046 TSecr=0 WS=128
70,28.73209,192.168.11.4,192.168.11.17,TCP,74,0.009557,,0.009557,"Jan  5, 2024 21:25:37.410001000 JST",,"6000  >  56092 [SYN, ACK] Seq=0 Ack=1 Win=65160 Len=0 MSS=1460 SACK_PERM TSval=2677286253 TSecr=1610884046 WS=128"
71,28.732198,192.168.11.17,192.168.11.4,TCP,66,0.000108,,0.000108,"Jan  5, 2024 21:25:37.410109000 JST",,56092  >  6000 [ACK] Seq=1 Ack=1 Win=64256 Len=0 TSval=1610884056 TSecr=2677286253
72,28.732373,192.168.11.17,192.168.11.4,TCP,93,,,0.000175,"Jan  5, 2024 21:25:37.410284000 JST",,"56092  >  6000 [PSH, ACK] Seq=1 Ack=1 Win=64256 Len=27 TSval=1610884056 TSecr=2677286253 [TCP segment of a reassembled PDU]"
73,28.732484,192.168.11.17,192.168.11.4,TCP,66,,,0.000111,"Jan  5, 2024 21:25:37.410395000 JST",,"56092  >  6000 [FIN, ACK] Seq=28 Ack=1 Win=64256 Len=0 TSval=1610884056 TSecr=2677286253"
74,28.740237,192.168.11.4,192.168.11.17,TCP,66,0.007864,,0.007753,"Jan  5, 2024 21:25:37.418148000 JST",,6000  >  56092 [ACK] Seq=1 Ack=28 Win=65152 Len=0 TSval=2677286261 TSecr=1610884056
75,28.740468,192.168.11.4,192.168.11.17,TCP,66,0.007984,,0.000231,"Jan  5, 2024 21:25:37.418379000 JST",,"6000  >  56092 [FIN, ACK] Seq=1 Ack=29 Win=65152 Len=0 TSval=2677286263 TSecr=1610884056"
76,28.740513,192.168.11.17,192.168.11.4,TCP,66,0.000045,,0.000045,"Jan  5, 2024 21:25:37.418424000 JST",,56092  >  6000 [ACK] Seq=29 Ack=2 Win=64256 Len=0 TSval=1610884064 TSecr=2677286263
77,28.771459,192.168.11.17,255.255.255.255,UDP,209,,Ÿ,0.030946,"Jan  5, 2024 21:25:37.449370000 JST",7b2273656d616e74696373223a207b22656e74697479223a2022504944222c202262617365656e74697479223a2022616e79222c2022726f6c65223a2022343434222c20227370617469616c223a2022616e79222c202274656d706f72616c223a2022616e79227d2c20226461746170726f7065727479223a207b22666f726d6174223a2022696e616f6b615f70726f6772616d5f73616d706c655f73656d616e746963227d7d,55980  >  7000 Len=167
78,28.779642,192.168.11.14,192.168.11.17,TCP,74,,œ,0.008183,"Jan  5, 2024 21:25:37.457553000 JST",,46346  >  6000 [SYN] Seq=0 Win=64240 Len=0 MSS=1460 SACK_PERM TSval=2612176763 TSecr=0 WS=128
79,28.779794,192.168.11.17,192.168.11.14,TCP,74,0.000152,,0.000152,"Jan  5, 2024 21:25:37.457705000 JST",,"6000  >  46346 [SYN, ACK] Seq=0 Ack=1 Win=65160 Len=0 MSS=1460 SACK_PERM TSval=281314869 TSecr=2612176763 WS=128"
80,28.786398,192.168.11.14,192.168.11.17,TCP,66,0.006604,,0.006604,"Jan  5, 2024 21:25:37.464309000 JST",,46346  >  6000 [ACK] Seq=1 Ack=1 Win=64256 Len=0 TSval=2612176770 TSecr=281314869
81,28.786861,192.168.11.14,192.168.11.17,TCP,93,,,0.000463,"Jan  5, 2024 21:25:37.464772000 JST",,"46346  >  6000 [PSH, ACK] Seq=1 Ack=1 Win=64256 Len=27 TSval=2612176770 TSecr=281314869 [TCP segment of a reassembled PDU]"
82,28.786917,192.168.11.17,192.168.11.14,TCP,66,0.000056,,0.000056,"Jan  5, 2024 21:25:37.464828000 JST",,6000  >  46346 [ACK] Seq=1 Ack=28 Win=65152 Len=0 TSval=281314876 TSecr=2612176770
83,28.786976,192.168.11.14,192.168.11.17,TCP,66,,,0.000059,"Jan  5, 2024 21:25:37.464887000 JST",,"46346  >  6000 [FIN, ACK] Seq=28 Ack=1 Win=64256 Len=0 TSval=2612176770 TSecr=281314869"
84,28.788192,192.168.11.17,192.168.11.14,TCP,66,0.001216,,0.001216,"Jan  5, 2024 21:25:37.466103000 JST",,"6000  >  46346 [FIN, ACK] Seq=1 Ack=29 Win=65152 Len=0 TSval=281314877 TSecr=2612176770"
85,28.794638,192.168.11.14,192.168.11.17,TCP,66,0.006446,,0.006446,"Jan  5, 2024 21:25:37.472549000 JST",,46346  >  6000 [ACK] Seq=29 Ack=2 Win=64256 Len=0 TSval=2612176777 TSecr=281314877
86,35.332546,192.168.11.17,192.168.11.4,TCP,74,,,6.537908,"Jan  5, 2024 21:25:44.010457000 JST",,56108  >  6000 [SYN] Seq=0 Win=64240 Len=0 MSS=1460 SACK_PERM TSval=1610890656 TSecr=0 WS=128
87,35.339258,192.168.11.4,192.168.11.17,TCP,74,0.006712,,0.006712,"Jan  5, 2024 21:25:44.017169000 JST",,"6000  >  56108 [SYN, ACK] Seq=0 Ack=1 Win=65160 Len=0 MSS=1460 SACK_PERM TSval=2677292861 TSecr=1610890656 WS=128"
88,35.339369,192.168.11.17,192.168.11.4,TCP,66,0.000111,,0.000111,"Jan  5, 2024 21:25:44.017280000 JST",,56108  >  6000 [ACK] Seq=1 Ack=1 Win=64256 Len=0 TSval=1610890663 TSecr=2677292861
89,35.33957,192.168.11.17,192.168.11.4,TCP,93,,,0.000201,"Jan  5, 2024 21:25:44.017481000 JST",,"56108  >  6000 [PSH, ACK] Seq=1 Ack=1 Win=64256 Len=27 TSval=1610890663 TSecr=2677292861 [TCP segment of a reassembled PDU]"
90,35.339721,192.168.11.17,192.168.11.4,TCP,66,,,0.000151,"Jan  5, 2024 21:25:44.017632000 JST",,"56108  >  6000 [FIN, ACK] Seq=28 Ack=1 Win=64256 Len=0 TSval=1610890664 TSecr=2677292861"
91,35.347308,192.168.11.4,192.168.11.17,TCP,66,0.007738,,0.007587,"Jan  5, 2024 21:25:44.025219000 JST",,6000  >  56108 [ACK] Seq=1 Ack=28 Win=65152 Len=0 TSval=2677292868 TSecr=1610890663
92,35.347531,192.168.11.4,192.168.11.17,TCP,66,0.00781,,0.000223,"Jan  5, 2024 21:25:44.025442000 JST",,"6000  >  56108 [FIN, ACK] Seq=1 Ack=29 Win=65152 Len=0 TSval=2677292870 TSecr=1610890664"
93,35.347608,192.168.11.17,192.168.11.4,TCP,66,0.000077,,0.000077,"Jan  5, 2024 21:25:44.025519000 JST",,56108  >  6000 [ACK] Seq=29 Ack=2 Win=64256 Len=0 TSval=1610890671 TSecr=2677292870
94,35.377487,192.168.11.17,255.255.255.255,UDP,209,,Ÿ,0.029879,"Jan  5, 2024 21:25:44.055398000 JST",7b2273656d616e74696373223a207b22656e74697479223a2022504944222c202262617365656e74697479223a2022616e79222c2022726f6c65223a2022343434222c20227370617469616c223a2022616e79222c202274656d706f72616c223a2022616e79227d2c20226461746170726f7065727479223a207b22666f726d6174223a2022696e616f6b615f70726f6772616d5f73616d706c655f73656d616e746963227d7d,55100  >  7000 Len=167
95,35.385762,192.168.11.14,192.168.11.17,TCP,74,,œ,0.008275,"Jan  5, 2024 21:25:44.063673000 JST",,39212  >  6000 [SYN] Seq=0 Win=64240 Len=0 MSS=1460 SACK_PERM TSval=2612183369 TSecr=0 WS=128
96,35.385906,192.168.11.17,192.168.11.14,TCP,74,0.000144,,0.000144,"Jan  5, 2024 21:25:44.063817000 JST",,"6000  >  39212 [SYN, ACK] Seq=0 Ack=1 Win=65160 Len=0 MSS=1460 SACK_PERM TSval=281321475 TSecr=2612183369 WS=128"
97,35.392546,192.168.11.14,192.168.11.17,TCP,66,0.00664,,0.00664,"Jan  5, 2024 21:25:44.070457000 JST",,39212  >  6000 [ACK] Seq=1 Ack=1 Win=64256 Len=0 TSval=2612183376 TSecr=281321475
98,35.393076,192.168.11.14,192.168.11.17,TCP,93,,,0.00053,"Jan  5, 2024 21:25:44.070987000 JST",,"39212  >  6000 [PSH, ACK] Seq=1 Ack=1 Win=64256 Len=27 TSval=2612183376 TSecr=281321475 [TCP segment of a reassembled PDU]"
99,35.393165,192.168.11.17,192.168.11.14,TCP,66,0.000089,,0.000089,"Jan  5, 2024 21:25:44.071076000 JST",,6000  >  39212 [ACK] Seq=1 Ack=28 Win=65152 Len=0 TSval=281321482 TSecr=2612183376
100,35.393246,192.168.11.14,192.168.11.17,TCP,66,,,0.000081,"Jan  5, 2024 21:25:44.071157000 JST",,"39212  >  6000 [FIN, ACK] Seq=28 Ack=1 Win=64256 Len=0 TSval=2612183376 TSecr=281321475"
101,35.394584,192.168.11.17,192.168.11.14,TCP,66,0.001338,,0.001338,"Jan  5, 2024 21:25:44.072495000 JST",,"6000  >  39212 [FIN, ACK] Seq=1 Ack=29 Win=65152 Len=0 TSval=281321483 TSecr=2612183376"
102,35.400707,192.168.11.14,192.168.11.17,TCP,66,0.006123,,0.006123,"Jan  5, 2024 21:25:44.078618000 JST",,39212  >  6000 [ACK] Seq=29 Ack=2 Win=64256 Len=0 TSval=2612183384 TSecr=281321483
103,41.977545,192.168.11.17,192.168.11.4,TCP,74,,,6.576838,"Jan  5, 2024 21:25:50.655456000 JST",,33530  >  6000 [SYN] Seq=0 Win=64240 Len=0 MSS=1460 SACK_PERM TSval=1610897301 TSecr=0 WS=128
104,41.984153,192.168.11.4,192.168.11.17,TCP,74,0.006608,,0.006608,"Jan  5, 2024 21:25:50.662064000 JST",,"6000  >  33530 [SYN, ACK] Seq=0 Ack=1 Win=65160 Len=0 MSS=1460 SACK_PERM TSval=2677299505 TSecr=1610897301 WS=128"
105,41.984268,192.168.11.17,192.168.11.4,TCP,66,0.000115,,0.000115,"Jan  5, 2024 21:25:50.662179000 JST",,33530  >  6000 [ACK] Seq=1 Ack=1 Win=64256 Len=0 TSval=1610897308 TSecr=2677299505
106,41.984487,192.168.11.17,192.168.11.4,TCP,93,,,0.000219,"Jan  5, 2024 21:25:50.662398000 JST",,"33530  >  6000 [PSH, ACK] Seq=1 Ack=1 Win=64256 Len=27 TSval=1610897308 TSecr=2677299505 [TCP segment of a reassembled PDU]"
107,41.984602,192.168.11.17,192.168.11.4,TCP,66,,,0.000115,"Jan  5, 2024 21:25:50.662513000 JST",,"33530  >  6000 [FIN, ACK] Seq=28 Ack=1 Win=64256 Len=0 TSval=1610897309 TSecr=2677299505"
108,41.998367,192.168.11.4,192.168.11.17,TCP,66,0.01388,,0.013765,"Jan  5, 2024 21:25:50.676278000 JST",,6000  >  33530 [ACK] Seq=1 Ack=28 Win=65152 Len=0 TSval=2677299519 TSecr=1610897308
109,41.998758,192.168.11.4,192.168.11.17,TCP,66,0.014156,,0.000391,"Jan  5, 2024 21:25:50.676669000 JST",,"6000  >  33530 [FIN, ACK] Seq=1 Ack=29 Win=65152 Len=0 TSval=2677299521 TSecr=1610897309"
110,41.998821,192.168.11.17,192.168.11.4,TCP,66,0.000063,,0.000063,"Jan  5, 2024 21:25:50.676732000 JST",,33530  >  6000 [ACK] Seq=29 Ack=2 Win=64256 Len=0 TSval=1610897323 TSecr=2677299521
111,42.029234,192.168.11.17,255.255.255.255,UDP,209,,Ÿ,0.030413,"Jan  5, 2024 21:25:50.707145000 JST",7b2273656d616e74696373223a207b22656e74697479223a2022504944222c202262617365656e74697479223a2022616e79222c2022726f6c65223a2022343434222c20227370617469616c223a2022616e79222c202274656d706f72616c223a2022616e79227d2c20226461746170726f7065727479223a207b22666f726d6174223a2022696e616f6b615f70726f6772616d5f73616d706c655f73656d616e746963227d7d,54011  >  7000 Len=167
112,42.038613,192.168.11.14,192.168.11.17,TCP,74,,œ,0.009379,"Jan  5, 2024 21:25:50.716524000 JST",,39220  >  6000 [SYN] Seq=0 Win=64240 Len=0 MSS=1460 SACK_PERM TSval=2612190022 TSecr=0 WS=128
113,42.038752,192.168.11.17,192.168.11.14,TCP,74,0.000139,,0.000139,"Jan  5, 2024 21:25:50.716663000 JST",,"6000  >  39220 [SYN, ACK] Seq=0 Ack=1 Win=65160 Len=0 MSS=1460 SACK_PERM TSval=281328128 TSecr=2612190022 WS=128"
114,42.045847,192.168.11.14,192.168.11.17,TCP,66,0.007095,,0.007095,"Jan  5, 2024 21:25:50.723758000 JST",,39220  >  6000 [ACK] Seq=1 Ack=1 Win=64256 Len=0 TSval=2612190029 TSecr=281328128
115,42.046478,192.168.11.14,192.168.11.17,TCP,93,,,0.000631,"Jan  5, 2024 21:25:50.724389000 JST",,"39220  >  6000 [PSH, ACK] Seq=1 Ack=1 Win=64256 Len=27 TSval=2612190029 TSecr=281328128 [TCP segment of a reassembled PDU]"
116,42.046586,192.168.11.17,192.168.11.14,TCP,66,0.000108,,0.000108,"Jan  5, 2024 21:25:50.724497000 JST",,6000  >  39220 [ACK] Seq=1 Ack=28 Win=65152 Len=0 TSval=281328135 TSecr=2612190029
117,42.046673,192.168.11.14,192.168.11.17,TCP,66,,,0.000087,"Jan  5, 2024 21:25:50.724584000 JST",,"39220  >  6000 [FIN, ACK] Seq=28 Ack=1 Win=64256 Len=0 TSval=2612190029 TSecr=281328128"
118,42.048174,192.168.11.17,192.168.11.14,TCP,66,0.001501,,0.001501,"Jan  5, 2024 21:25:50.726085000 JST",,"6000  >  39220 [FIN, ACK] Seq=1 Ack=29 Win=65152 Len=0 TSval=281328137 TSecr=2612190029"
119,42.054493,192.168.11.14,192.168.11.17,TCP,66,0.006319,,0.006319,"Jan  5, 2024 21:25:50.732404000 JST",,39220  >  6000 [ACK] Seq=29 Ack=2 Win=64256 Len=0 TSval=2612190037 TSecr=281328137
120,48.625406,192.168.11.17,192.168.11.4,TCP,74,,,6.570913,"Jan  5, 2024 21:25:57.303317000 JST",,55950  >  6000 [SYN] Seq=0 Win=64240 Len=0 MSS=1460 SACK_PERM TSval=1610903949 TSecr=0 WS=128
121,48.632169,192.168.11.4,192.168.11.17,TCP,74,0.006763,,0.006763,"Jan  5, 2024 21:25:57.310080000 JST",,"6000  >  55950 [SYN, ACK] Seq=0 Ack=1 Win=65160 Len=0 MSS=1460 SACK_PERM TSval=2677306153 TSecr=1610903949 WS=128"
122,48.632284,192.168.11.17,192.168.11.4,TCP,66,0.000115,,0.000115,"Jan  5, 2024 21:25:57.310195000 JST",,55950  >  6000 [ACK] Seq=1 Ack=1 Win=64256 Len=0 TSval=1610903956 TSecr=2677306153
123,48.632467,192.168.11.17,192.168.11.4,TCP,93,,,0.000183,"Jan  5, 2024 21:25:57.310378000 JST",,"55950  >  6000 [PSH, ACK] Seq=1 Ack=1 Win=64256 Len=27 TSval=1610903956 TSecr=2677306153 [TCP segment of a reassembled PDU]"
124,48.632567,192.168.11.17,192.168.11.4,TCP,66,,,0.0001,"Jan  5, 2024 21:25:57.310478000 JST",,"55950  >  6000 [FIN, ACK] Seq=28 Ack=1 Win=64256 Len=0 TSval=1610903956 TSecr=2677306153"
125,48.640433,192.168.11.4,192.168.11.17,TCP,66,0.007966,,0.007866,"Jan  5, 2024 21:25:57.318344000 JST",,6000  >  55950 [ACK] Seq=1 Ack=28 Win=65152 Len=0 TSval=2677306161 TSecr=1610903956
126,48.640675,192.168.11.4,192.168.11.17,TCP,66,0.008108,,0.000242,"Jan  5, 2024 21:25:57.318586000 JST",,"6000  >  55950 [FIN, ACK] Seq=1 Ack=29 Win=65152 Len=0 TSval=2677306163 TSecr=1610903956"
127,48.64072,192.168.11.17,192.168.11.4,TCP,66,0.000045,,0.000045,"Jan  5, 2024 21:25:57.318631000 JST",,55950  >  6000 [ACK] Seq=29 Ack=2 Win=64256 Len=0 TSval=1610903965 TSecr=2677306163
128,48.670036,192.168.11.17,255.255.255.255,UDP,209,,Ÿ,0.029316,"Jan  5, 2024 21:25:57.347947000 JST",7b2273656d616e74696373223a207b22656e74697479223a2022504944222c202262617365656e74697479223a2022616e79222c2022726f6c65223a2022343434222c20227370617469616c223a2022616e79222c202274656d706f72616c223a2022616e79227d2c20226461746170726f7065727479223a207b22666f726d6174223a2022696e616f6b615f70726f6772616d5f73616d706c655f73656d616e746963227d7d,57452  >  7000 Len=167
129,49.67135,192.168.11.17,255.255.255.255,UDP,209,,œ,1.001314,"Jan  5, 2024 21:25:58.349261000 JST",7b2273656d616e74696373223a207b22656e74697479223a2022504944222c202262617365656e74697479223a2022616e79222c2022726f6c65223a2022343434222c20227370617469616c223a2022616e79222c202274656d706f72616c223a2022616e79227d2c20226461746170726f7065727479223a207b22666f726d6174223a2022696e616f6b615f70726f6772616d5f73616d706c655f73656d616e746963227d7d,57452  >  7000 Len=167
130,49.685314,192.168.11.14,192.168.11.17,TCP,74,,œ,0.013964,"Jan  5, 2024 21:25:58.363225000 JST",,32996  >  6000 [SYN] Seq=0 Win=64240 Len=0 MSS=1460 SACK_PERM TSval=2612197669 TSecr=0 WS=128
131,49.68548,192.168.11.17,192.168.11.14,TCP,74,0.000166,,0.000166,"Jan  5, 2024 21:25:58.363391000 JST",,"6000  >  32996 [SYN, ACK] Seq=0 Ack=1 Win=65160 Len=0 MSS=1460 SACK_PERM TSval=281335774 TSecr=2612197669 WS=128"
132,49.692295,192.168.11.14,192.168.11.17,TCP,66,0.006815,,0.006815,"Jan  5, 2024 21:25:58.370206000 JST",,32996  >  6000 [ACK] Seq=1 Ack=1 Win=64256 Len=0 TSval=2612197676 TSecr=281335774
133,49.692848,192.168.11.14,192.168.11.17,TCP,93,,,0.000553,"Jan  5, 2024 21:25:58.370759000 JST",,"32996  >  6000 [PSH, ACK] Seq=1 Ack=1 Win=64256 Len=27 TSval=2612197676 TSecr=281335774 [TCP segment of a reassembled PDU]"
134,49.692935,192.168.11.17,192.168.11.14,TCP,66,0.000087,,0.000087,"Jan  5, 2024 21:25:58.370846000 JST",,6000  >  32996 [ACK] Seq=1 Ack=28 Win=65152 Len=0 TSval=281335782 TSecr=2612197676
135,49.69301,192.168.11.14,192.168.11.17,TCP,66,,,0.000075,"Jan  5, 2024 21:25:58.370921000 JST",,"32996  >  6000 [FIN, ACK] Seq=28 Ack=1 Win=64256 Len=0 TSval=2612197676 TSecr=281335774"
136,49.694044,192.168.11.17,192.168.11.14,TCP,66,0.001034,,0.001034,"Jan  5, 2024 21:25:58.371955000 JST",,"6000  >  32996 [FIN, ACK] Seq=1 Ack=29 Win=65152 Len=0 TSval=281335783 TSecr=2612197676"
137,49.699988,192.168.11.14,192.168.11.17,TCP,66,0.005944,,0.005944,"Jan  5, 2024 21:25:58.377899000 JST",,32996  >  6000 [ACK] Seq=29 Ack=2 Win=64256 Len=0 TSval=2612197683 TSecr=281335783
138,56.268594,192.168.11.17,192.168.11.4,TCP,74,,,6.568606,"Jan  5, 2024 21:26:04.946505000 JST",,55956  >  6000 [SYN] Seq=0 Win=64240 Len=0 MSS=1460 SACK_PERM TSval=1610911592 TSecr=0 WS=128
139,56.275564,192.168.11.4,192.168.11.17,TCP,74,0.00697,,0.00697,"Jan  5, 2024 21:26:04.953475000 JST",,"6000  >  55956 [SYN, ACK] Seq=0 Ack=1 Win=65160 Len=0 MSS=1460 SACK_PERM TSval=2677313797 TSecr=1610911592 WS=128"
140,56.275712,192.168.11.17,192.168.11.4,TCP,66,0.000148,,0.000148,"Jan  5, 2024 21:26:04.953623000 JST",,55956  >  6000 [ACK] Seq=1 Ack=1 Win=64256 Len=0 TSval=1610911600 TSecr=2677313797
141,56.275896,192.168.11.17,192.168.11.4,TCP,93,,,0.000184,"Jan  5, 2024 21:26:04.953807000 JST",,"55956  >  6000 [PSH, ACK] Seq=1 Ack=1 Win=64256 Len=27 TSval=1610911600 TSecr=2677313797 [TCP segment of a reassembled PDU]"
142,56.276018,192.168.11.17,192.168.11.4,TCP,66,,,0.000122,"Jan  5, 2024 21:26:04.953929000 JST",,"55956  >  6000 [FIN, ACK] Seq=28 Ack=1 Win=64256 Len=0 TSval=1610911600 TSecr=2677313797"
143,56.28303,192.168.11.4,192.168.11.17,TCP,66,0.007134,,0.007012,"Jan  5, 2024 21:26:04.960941000 JST",,6000  >  55956 [ACK] Seq=1 Ack=28 Win=65152 Len=0 TSval=2677313804 TSecr=1610911600
144,56.283399,192.168.11.4,192.168.11.17,TCP,66,0.007381,,0.000369,"Jan  5, 2024 21:26:04.961310000 JST",,"6000  >  55956 [FIN, ACK] Seq=1 Ack=29 Win=65152 Len=0 TSval=2677313805 TSecr=1610911600"
145,56.28346,192.168.11.17,192.168.11.4,TCP,66,0.000061,,0.000061,"Jan  5, 2024 21:26:04.961371000 JST",,55956  >  6000 [ACK] Seq=29 Ack=2 Win=64256 Len=0 TSval=1610911607 TSecr=2677313805
146,56.31291,192.168.11.17,255.255.255.255,UDP,209,,Ÿ,0.02945,"Jan  5, 2024 21:26:04.990821000 JST",7b2273656d616e74696373223a207b22656e74697479223a2022504944222c202262617365656e74697479223a2022616e79222c2022726f6c65223a2022343434222c20227370617469616c223a2022616e79222c202274656d706f72616c223a2022616e79227d2c20226461746170726f7065727479223a207b22666f726d6174223a2022696e616f6b615f70726f6772616d5f73616d706c655f73656d616e746963227d7d,38896  >  7000 Len=167
147,56.320907,192.168.11.14,192.168.11.17,TCP,74,,œ,0.007997,"Jan  5, 2024 21:26:04.998818000 JST",,54224  >  6000 [SYN] Seq=0 Win=64240 Len=0 MSS=1460 SACK_PERM TSval=2612204304 TSecr=0 WS=128
148,56.321035,192.168.11.17,192.168.11.14,TCP,74,0.000128,,0.000128,"Jan  5, 2024 21:26:04.998946000 JST",,"6000  >  54224 [SYN, ACK] Seq=0 Ack=1 Win=65160 Len=0 MSS=1460 SACK_PERM TSval=281342410 TSecr=2612204304 WS=128"
149,56.327803,192.168.11.14,192.168.11.17,TCP,66,0.006768,,0.006768,"Jan  5, 2024 21:26:05.005714000 JST",,54224  >  6000 [ACK] Seq=1 Ack=1 Win=64256 Len=0 TSval=2612204311 TSecr=281342410
150,56.328403,192.168.11.14,192.168.11.17,TCP,93,,,0.0006,"Jan  5, 2024 21:26:05.006314000 JST",,"54224  >  6000 [PSH, ACK] Seq=1 Ack=1 Win=64256 Len=27 TSval=2612204311 TSecr=281342410 [TCP segment of a reassembled PDU]"
151,56.328499,192.168.11.17,192.168.11.14,TCP,66,0.000096,,0.000096,"Jan  5, 2024 21:26:05.006410000 JST",,6000  >  54224 [ACK] Seq=1 Ack=28 Win=65152 Len=0 TSval=281342417 TSecr=2612204311
152,56.328572,192.168.11.14,192.168.11.17,TCP,66,,,0.000073,"Jan  5, 2024 21:26:05.006483000 JST",,"54224  >  6000 [FIN, ACK] Seq=28 Ack=1 Win=64256 Len=0 TSval=2612204311 TSecr=281342410"
153,56.329751,192.168.11.17,192.168.11.14,TCP,66,0.001179,,0.001179,"Jan  5, 2024 21:26:05.007662000 JST",,"6000  >  54224 [FIN, ACK] Seq=1 Ack=29 Win=65152 Len=0 TSval=281342419 TSecr=2612204311"
154,56.336179,192.168.11.14,192.168.11.17,TCP,66,0.006428,,0.006428,"Jan  5, 2024 21:26:05.014090000 JST",,54224  >  6000 [ACK] Seq=29 Ack=2 Win=64256 Len=0 TSval=2612204319 TSecr=281342419
155,62.907803,192.168.11.17,192.168.11.4,TCP,74,,,6.571624,"Jan  5, 2024 21:26:11.585714000 JST",,33608  >  6000 [SYN] Seq=0 Win=64240 Len=0 MSS=1460 SACK_PERM TSval=1610918232 TSecr=0 WS=128
156,62.914754,192.168.11.4,192.168.11.17,TCP,74,0.006951,,0.006951,"Jan  5, 2024 21:26:11.592665000 JST",,"6000  >  33608 [SYN, ACK] Seq=0 Ack=1 Win=65160 Len=0 MSS=1460 SACK_PERM TSval=2677320436 TSecr=1610918232 WS=128"
157,62.914854,192.168.11.17,192.168.11.4,TCP,66,0.0001,,0.0001,"Jan  5, 2024 21:26:11.592765000 JST",,33608  >  6000 [ACK] Seq=1 Ack=1 Win=64256 Len=0 TSval=1610918239 TSecr=2677320436
158,62.915056,192.168.11.17,192.168.11.4,TCP,93,,,0.000202,"Jan  5, 2024 21:26:11.592967000 JST",,"33608  >  6000 [PSH, ACK] Seq=1 Ack=1 Win=64256 Len=27 TSval=1610918239 TSecr=2677320436 [TCP segment of a reassembled PDU]"
159,62.915162,192.168.11.17,192.168.11.4,TCP,66,,,0.000106,"Jan  5, 2024 21:26:11.593073000 JST",,"33608  >  6000 [FIN, ACK] Seq=28 Ack=1 Win=64256 Len=0 TSval=1610918239 TSecr=2677320436"
160,62.924093,192.168.11.4,192.168.11.17,TCP,66,0.009037,,0.008931,"Jan  5, 2024 21:26:11.602004000 JST",,6000  >  33608 [ACK] Seq=1 Ack=28 Win=65152 Len=0 TSval=2677320443 TSecr=1610918239
161,62.924483,192.168.11.4,192.168.11.17,TCP,66,0.009321,,0.00039,"Jan  5, 2024 21:26:11.602394000 JST",,"6000  >  33608 [FIN, ACK] Seq=1 Ack=29 Win=65152 Len=0 TSval=2677320445 TSecr=1610918239"
162,62.924527,192.168.11.17,192.168.11.4,TCP,66,0.000044,,0.000044,"Jan  5, 2024 21:26:11.602438000 JST",,33608  >  6000 [ACK] Seq=29 Ack=2 Win=64256 Len=0 TSval=1610918248 TSecr=2677320445
163,62.952785,192.168.11.17,255.255.255.255,UDP,209,,Ÿ,0.028258,"Jan  5, 2024 21:26:11.630696000 JST",7b2273656d616e74696373223a207b22656e74697479223a2022504944222c202262617365656e74697479223a2022616e79222c2022726f6c65223a2022343434222c20227370617469616c223a2022616e79222c202274656d706f72616c223a2022616e79227d2c20226461746170726f7065727479223a207b22666f726d6174223a2022696e616f6b615f70726f6772616d5f73616d706c655f73656d616e746963227d7d,45090  >  7000 Len=167
164,62.961256,192.168.11.14,192.168.11.17,TCP,74,,œ,0.008471,"Jan  5, 2024 21:26:11.639167000 JST",,54230  >  6000 [SYN] Seq=0 Win=64240 Len=0 MSS=1460 SACK_PERM TSval=2612210944 TSecr=0 WS=128
165,62.961419,192.168.11.17,192.168.11.14,TCP,74,0.000163,,0.000163,"Jan  5, 2024 21:26:11.639330000 JST",,"6000  >  54230 [SYN, ACK] Seq=0 Ack=1 Win=65160 Len=0 MSS=1460 SACK_PERM TSval=281349050 TSecr=2612210944 WS=128"
166,62.968373,192.168.11.14,192.168.11.17,TCP,66,0.006954,,0.006954,"Jan  5, 2024 21:26:11.646284000 JST",,54230  >  6000 [ACK] Seq=1 Ack=1 Win=64256 Len=0 TSval=2612210951 TSecr=281349050
167,62.968875,192.168.11.14,192.168.11.17,TCP,93,,,0.000502,"Jan  5, 2024 21:26:11.646786000 JST",,"54230  >  6000 [PSH, ACK] Seq=1 Ack=1 Win=64256 Len=27 TSval=2612210952 TSecr=281349050 [TCP segment of a reassembled PDU]"
168,62.968947,192.168.11.17,192.168.11.14,TCP,66,0.000072,,0.000072,"Jan  5, 2024 21:26:11.646858000 JST",,6000  >  54230 [ACK] Seq=1 Ack=28 Win=65152 Len=0 TSval=281349058 TSecr=2612210952
169,62.969014,192.168.11.14,192.168.11.17,TCP,66,,,0.000067,"Jan  5, 2024 21:26:11.646925000 JST",,"54230  >  6000 [FIN, ACK] Seq=28 Ack=1 Win=64256 Len=0 TSval=2612210952 TSecr=281349050"
170,62.970054,192.168.11.17,192.168.11.14,TCP,66,0.00104,,0.00104,"Jan  5, 2024 21:26:11.647965000 JST",,"6000  >  54230 [FIN, ACK] Seq=1 Ack=29 Win=65152 Len=0 TSval=281349059 TSecr=2612210952"
171,62.976304,192.168.11.14,192.168.11.17,TCP,66,0.00625,,0.00625,"Jan  5, 2024 21:26:11.654215000 JST",,54230  >  6000 [ACK] Seq=29 Ack=2 Win=64256 Len=0 TSval=2612210959 TSecr=281349059
172,76.94457,192.168.11.17,192.168.11.4,TCP,74,,,13.968266,"Jan  5, 2024 21:26:25.622481000 JST",,45890  >  6000 [SYN] Seq=0 Win=64240 Len=0 MSS=1460 SACK_PERM TSval=1610932268 TSecr=0 WS=128
173,76.953679,192.168.11.4,192.168.11.17,TCP,74,0.009109,,0.009109,"Jan  5, 2024 21:26:25.631590000 JST",,"6000  >  45890 [SYN, ACK] Seq=0 Ack=1 Win=65160 Len=0 MSS=1460 SACK_PERM TSval=2677334475 TSecr=1610932268 WS=128"
174,76.953786,192.168.11.17,192.168.11.4,TCP,66,0.000107,,0.000107,"Jan  5, 2024 21:26:25.631697000 JST",,45890  >  6000 [ACK] Seq=1 Ack=1 Win=64256 Len=0 TSval=1610932278 TSecr=2677334475
175,76.953958,192.168.11.17,192.168.11.4,TCP,93,,,0.000172,"Jan  5, 2024 21:26:25.631869000 JST",,"45890  >  6000 [PSH, ACK] Seq=1 Ack=1 Win=64256 Len=27 TSval=1610932278 TSecr=2677334475 [TCP segment of a reassembled PDU]"
176,76.954064,192.168.11.17,192.168.11.4,TCP,66,,,0.000106,"Jan  5, 2024 21:26:25.631975000 JST",,"45890  >  6000 [FIN, ACK] Seq=28 Ack=1 Win=64256 Len=0 TSval=1610932278 TSecr=2677334475"
177,76.960889,192.168.11.4,192.168.11.17,TCP,66,0.006931,,0.006825,"Jan  5, 2024 21:26:25.638800000 JST",,6000  >  45890 [ACK] Seq=1 Ack=28 Win=65152 Len=0 TSval=2677334482 TSecr=1610932278
178,76.961263,192.168.11.4,192.168.11.17,TCP,66,0.007199,,0.000374,"Jan  5, 2024 21:26:25.639174000 JST",,"6000  >  45890 [FIN, ACK] Seq=1 Ack=29 Win=65152 Len=0 TSval=2677334483 TSecr=1610932278"
179,76.961308,192.168.11.17,192.168.11.4,TCP,66,0.000045,,0.000045,"Jan  5, 2024 21:26:25.639219000 JST",,45890  >  6000 [ACK] Seq=29 Ack=2 Win=64256 Len=0 TSval=1610932285 TSecr=2677334483
180,76.990224,192.168.11.17,255.255.255.255,UDP,209,,Ÿ,0.028916,"Jan  5, 2024 21:26:25.668135000 JST",7b2273656d616e74696373223a207b22656e74697479223a2022504944222c202262617365656e74697479223a2022616e79222c2022726f6c65223a2022343434222c20227370617469616c223a2022616e79222c202274656d706f72616c223a2022616e79227d2c20226461746170726f7065727479223a207b22666f726d6174223a2022696e616f6b615f70726f6772616d5f73616d706c655f73656d616e746963227d7d,49234  >  7000 Len=167
181,76.998307,192.168.11.14,192.168.11.17,TCP,74,,œ,0.008083,"Jan  5, 2024 21:26:25.676218000 JST",,35140  >  6000 [SYN] Seq=0 Win=64240 Len=0 MSS=1460 SACK_PERM TSval=2612224982 TSecr=0 WS=128
182,76.998464,192.168.11.17,192.168.11.14,TCP,74,0.000157,,0.000157,"Jan  5, 2024 21:26:25.676375000 JST",,"6000  >  35140 [SYN, ACK] Seq=0 Ack=1 Win=65160 Len=0 MSS=1460 SACK_PERM TSval=281363087 TSecr=2612224982 WS=128"
183,77.004994,192.168.11.14,192.168.11.17,TCP,66,0.00653,,0.00653,"Jan  5, 2024 21:26:25.682905000 JST",,35140  >  6000 [ACK] Seq=1 Ack=1 Win=64256 Len=0 TSval=2612224988 TSecr=281363087
184,77.005451,192.168.11.14,192.168.11.17,TCP,93,,,0.000457,"Jan  5, 2024 21:26:25.683362000 JST",,"35140  >  6000 [PSH, ACK] Seq=1 Ack=1 Win=64256 Len=27 TSval=2612224989 TSecr=281363087 [TCP segment of a reassembled PDU]"
185,77.005509,192.168.11.17,192.168.11.14,TCP,66,0.000058,,0.000058,"Jan  5, 2024 21:26:25.683420000 JST",,6000  >  35140 [ACK] Seq=1 Ack=28 Win=65152 Len=0 TSval=281363094 TSecr=2612224989
186,77.005572,192.168.11.14,192.168.11.17,TCP,66,,,0.000063,"Jan  5, 2024 21:26:25.683483000 JST",,"35140  >  6000 [FIN, ACK] Seq=28 Ack=1 Win=64256 Len=0 TSval=2612224989 TSecr=281363087"
187,77.006556,192.168.11.17,192.168.11.14,TCP,66,0.000984,,0.000984,"Jan  5, 2024 21:26:25.684467000 JST",,"6000  >  35140 [FIN, ACK] Seq=1 Ack=29 Win=65152 Len=0 TSval=281363095 TSecr=2612224989"
188,77.012752,192.168.11.14,192.168.11.17,TCP,66,0.006196,,0.006196,"Jan  5, 2024 21:26:25.690663000 JST",,35140  >  6000 [ACK] Seq=29 Ack=2 Win=64256 Len=0 TSval=2612224996 TSecr=281363095
189,83.5576,192.168.11.17,192.168.11.4,TCP,74,,,6.544848,"Jan  5, 2024 21:26:32.235511000 JST",,55286  >  6000 [SYN] Seq=0 Win=64240 Len=0 MSS=1460 SACK_PERM TSval=1610938881 TSecr=0 WS=128
190,83.564235,192.168.11.4,192.168.11.17,TCP,74,0.006635,,0.006635,"Jan  5, 2024 21:26:32.242146000 JST",,"6000  >  55286 [SYN, ACK] Seq=0 Ack=1 Win=65160 Len=0 MSS=1460 SACK_PERM TSval=2677341086 TSecr=1610938881 WS=128"
191,83.564335,192.168.11.17,192.168.11.4,TCP,66,0.0001,,0.0001,"Jan  5, 2024 21:26:32.242246000 JST",,55286  >  6000 [ACK] Seq=1 Ack=1 Win=64256 Len=0 TSval=1610938888 TSecr=2677341086
192,83.564564,192.168.11.17,192.168.11.4,TCP,93,,,0.000229,"Jan  5, 2024 21:26:32.242475000 JST",,"55286  >  6000 [PSH, ACK] Seq=1 Ack=1 Win=64256 Len=27 TSval=1610938888 TSecr=2677341086 [TCP segment of a reassembled PDU]"
