"No.","Time","Source","Destination","Protocol","Length","The RTT to ACK the segment was","Time delta from previous captured frame","Arrival Time","Data","Info"
"1","0.000000","192.168.11.15","192.168.11.31","TCP","74","","0.000000000","Jan  8, 2024 13:40:13.915774000 JST","","57634  >  6000 [SYN] Seq=0 Win=64240 Len=0 MSS=1460 SACK_PERM TSval=2835976075 TSecr=0 WS=128"
"2","0.007001","192.168.11.31","192.168.11.15","TCP","74","0.007001000","0.007001000","Jan  8, 2024 13:40:13.922775000 JST","","6000  >  57634 [SYN, ACK] Seq=0 Ack=1 Win=65160 Len=0 MSS=1460 SACK_PERM TSval=710141155 TSecr=2835976075 WS=128"
"3","0.007104","192.168.11.15","192.168.11.31","TCP","66","0.000103000","0.000103000","Jan  8, 2024 13:40:13.922878000 JST","","57634  >  6000 [ACK] Seq=1 Ack=1 Win=64256 Len=0 TSval=2835976084 TSecr=710141155"
"4","0.007294","192.168.11.15","192.168.11.31","TCP","93","","0.000190000","Jan  8, 2024 13:40:13.923068000 JST","","57634  >  6000 [PSH, ACK] Seq=1 Ack=1 Win=64256 Len=27 TSval=2835976085 TSecr=710141155 [TCP segment of a reassembled PDU]"
"5","0.007420","192.168.11.15","192.168.11.31","TCP","66","","0.000126000","Jan  8, 2024 13:40:13.923194000 JST","","57634  >  6000 [FIN, ACK] Seq=28 Ack=1 Win=64256 Len=0 TSval=2835976085 TSecr=710141155"
"6","0.014227","192.168.11.31","192.168.11.15","TCP","66","0.006933000","0.006807000","Jan  8, 2024 13:40:13.930001000 JST","","6000  >  57634 [ACK] Seq=1 Ack=28 Win=65152 Len=0 TSval=710141162 TSecr=2835976085"
"7","0.014593","192.168.11.31","192.168.11.15","TCP","66","0.007173000","0.000366000","Jan  8, 2024 13:40:13.930367000 JST","","6000  >  57634 [FIN, ACK] Seq=1 Ack=29 Win=65152 Len=0 TSval=710141163 TSecr=2835976085"
"8","0.014653","192.168.11.15","192.168.11.31","TCP","66","0.000060000","0.000060000","Jan  8, 2024 13:40:13.930427000 JST","","57634  >  6000 [ACK] Seq=29 Ack=2 Win=64256 Len=0 TSval=2835976092 TSecr=710141163"
"9","6.844469","192.168.11.15","192.168.11.31","TCP","74","","6.829816000","Jan  8, 2024 13:40:20.760243000 JST","","47822  >  6000 [SYN] Seq=0 Win=64240 Len=0 MSS=1460 SACK_PERM TSval=2835982922 TSecr=0 WS=128"
"10","6.852745","192.168.11.31","192.168.11.15","TCP","74","0.008276000","0.008276000","Jan  8, 2024 13:40:20.768519000 JST","","6000  >  47822 [SYN, ACK] Seq=0 Ack=1 Win=65160 Len=0 MSS=1460 SACK_PERM TSval=710148000 TSecr=2835982922 WS=128"
"11","6.852844","192.168.11.15","192.168.11.31","TCP","66","0.000099000","0.000099000","Jan  8, 2024 13:40:20.768618000 JST","","47822  >  6000 [ACK] Seq=1 Ack=1 Win=64256 Len=0 TSval=2835982930 TSecr=710148000"
"12","6.852973","192.168.11.15","192.168.11.31","TCP","93","","0.000129000","Jan  8, 2024 13:40:20.768747000 JST","","47822  >  6000 [PSH, ACK] Seq=1 Ack=1 Win=64256 Len=27 TSval=2835982930 TSecr=710148000 [TCP segment of a reassembled PDU]"
"13","6.853081","192.168.11.15","192.168.11.31","TCP","66","","0.000108000","Jan  8, 2024 13:40:20.768855000 JST","","47822  >  6000 [FIN, ACK] Seq=28 Ack=1 Win=64256 Len=0 TSval=2835982930 TSecr=710148000"
"14","6.869032","192.168.11.31","192.168.11.15","TCP","66","0.016059000","0.015951000","Jan  8, 2024 13:40:20.784806000 JST","","6000  >  47822 [ACK] Seq=1 Ack=28 Win=65152 Len=0 TSval=710148016 TSecr=2835982930"
"15","6.869446","192.168.11.31","192.168.11.15","TCP","66","0.016365000","0.000414000","Jan  8, 2024 13:40:20.785220000 JST","","6000  >  47822 [FIN, ACK] Seq=1 Ack=29 Win=65152 Len=0 TSval=710148018 TSecr=2835982930"
"16","6.869491","192.168.11.15","192.168.11.31","TCP","66","0.000045000","0.000045000","Jan  8, 2024 13:40:20.785265000 JST","","47822  >  6000 [ACK] Seq=29 Ack=2 Win=64256 Len=0 TSval=2835982947 TSecr=710148018"
"17","14.576888","192.168.11.15","192.168.11.31","TCP","74","","7.707397000","Jan  8, 2024 13:40:28.492662000 JST","","47514  >  6000 [SYN] Seq=0 Win=64240 Len=0 MSS=1460 SACK_PERM TSval=2835990654 TSecr=0 WS=128"
"18","14.583740","192.168.11.31","192.168.11.15","TCP","74","0.006852000","0.006852000","Jan  8, 2024 13:40:28.499514000 JST","","6000  >  47514 [SYN, ACK] Seq=0 Ack=1 Win=65160 Len=0 MSS=1460 SACK_PERM TSval=710155731 TSecr=2835990654 WS=128"
"19","14.583839","192.168.11.15","192.168.11.31","TCP","66","0.000099000","0.000099000","Jan  8, 2024 13:40:28.499613000 JST","","47514  >  6000 [ACK] Seq=1 Ack=1 Win=64256 Len=0 TSval=2835990661 TSecr=710155731"
"20","14.583977","192.168.11.15","192.168.11.31","TCP","93","","0.000138000","Jan  8, 2024 13:40:28.499751000 JST","","47514  >  6000 [PSH, ACK] Seq=1 Ack=1 Win=64256 Len=27 TSval=2835990661 TSecr=710155731 [TCP segment of a reassembled PDU]"
"21","14.584096","192.168.11.15","192.168.11.31","TCP","66","","0.000119000","Jan  8, 2024 13:40:28.499870000 JST","","47514  >  6000 [FIN, ACK] Seq=28 Ack=1 Win=64256 Len=0 TSval=2835990661 TSecr=710155731"
"22","14.591421","192.168.11.31","192.168.11.15","TCP","66","0.007444000","0.007325000","Jan  8, 2024 13:40:28.507195000 JST","","6000  >  47514 [ACK] Seq=1 Ack=28 Win=65152 Len=0 TSval=710155739 TSecr=2835990661"
"23","14.591793","192.168.11.31","192.168.11.15","TCP","66","0.007697000","0.000372000","Jan  8, 2024 13:40:28.507567000 JST","","6000  >  47514 [FIN, ACK] Seq=1 Ack=29 Win=65152 Len=0 TSval=710155740 TSecr=2835990661"
"24","14.591836","192.168.11.15","192.168.11.31","TCP","66","0.000043000","0.000043000","Jan  8, 2024 13:40:28.507610000 JST","","47514  >  6000 [ACK] Seq=29 Ack=2 Win=64256 Len=0 TSval=2835990669 TSecr=710155740"
"25","22.316003","192.168.11.15","192.168.11.31","TCP","74","","7.724167000","Jan  8, 2024 13:40:36.231777000 JST","","47522  >  6000 [SYN] Seq=0 Win=64240 Len=0 MSS=1460 SACK_PERM TSval=2835998393 TSecr=0 WS=128"
"26","22.322645","192.168.11.31","192.168.11.15","TCP","74","0.006642000","0.006642000","Jan  8, 2024 13:40:36.238419000 JST","","6000  >  47522 [SYN, ACK] Seq=0 Ack=1 Win=65160 Len=0 MSS=1460 SACK_PERM TSval=710163470 TSecr=2835998393 WS=128"
"27","22.322744","192.168.11.15","192.168.11.31","TCP","66","0.000099000","0.000099000","Jan  8, 2024 13:40:36.238518000 JST","","47522  >  6000 [ACK] Seq=1 Ack=1 Win=64256 Len=0 TSval=2835998400 TSecr=710163470"
"28","22.322995","192.168.11.15","192.168.11.31","TCP","93","","0.000251000","Jan  8, 2024 13:40:36.238769000 JST","","47522  >  6000 [PSH, ACK] Seq=1 Ack=1 Win=64256 Len=27 TSval=2835998400 TSecr=710163470 [TCP segment of a reassembled PDU]"
"29","22.323093","192.168.11.15","192.168.11.31","TCP","66","","0.000098000","Jan  8, 2024 13:40:36.238867000 JST","","47522  >  6000 [FIN, ACK] Seq=28 Ack=1 Win=64256 Len=0 TSval=2835998400 TSecr=710163470"
"30","22.329933","192.168.11.31","192.168.11.15","TCP","66","0.006938000","0.006840000","Jan  8, 2024 13:40:36.245707000 JST","","6000  >  47522 [ACK] Seq=1 Ack=28 Win=65152 Len=0 TSval=710163478 TSecr=2835998400"
"31","22.330292","192.168.11.31","192.168.11.15","TCP","66","0.007199000","0.000359000","Jan  8, 2024 13:40:36.246066000 JST","","6000  >  47522 [FIN, ACK] Seq=1 Ack=29 Win=65152 Len=0 TSval=710163479 TSecr=2835998400"
"32","22.330341","192.168.11.15","192.168.11.31","TCP","66","0.000049000","0.000049000","Jan  8, 2024 13:40:36.246115000 JST","","47522  >  6000 [ACK] Seq=29 Ack=2 Win=64256 Len=0 TSval=2835998408 TSecr=710163479"
"33","29.050552","192.168.11.15","192.168.11.31","TCP","74","","6.720211000","Jan  8, 2024 13:40:42.966326000 JST","","40548  >  6000 [SYN] Seq=0 Win=64240 Len=0 MSS=1460 SACK_PERM TSval=2836005128 TSecr=0 WS=128"
"34","29.057153","192.168.11.31","192.168.11.15","TCP","74","0.006601000","0.006601000","Jan  8, 2024 13:40:42.972927000 JST","","6000  >  40548 [SYN, ACK] Seq=0 Ack=1 Win=65160 Len=0 MSS=1460 SACK_PERM TSval=710170205 TSecr=2836005128 WS=128"
"35","29.057252","192.168.11.15","192.168.11.31","TCP","66","0.000099000","0.000099000","Jan  8, 2024 13:40:42.973026000 JST","","40548  >  6000 [ACK] Seq=1 Ack=1 Win=64256 Len=0 TSval=2836005135 TSecr=710170205"
"36","29.057485","192.168.11.15","192.168.11.31","TCP","93","","0.000233000","Jan  8, 2024 13:40:42.973259000 JST","","40548  >  6000 [PSH, ACK] Seq=1 Ack=1 Win=64256 Len=27 TSval=2836005135 TSecr=710170205 [TCP segment of a reassembled PDU]"
"37","29.057587","192.168.11.15","192.168.11.31","TCP","66","","0.000102000","Jan  8, 2024 13:40:42.973361000 JST","","40548  >  6000 [FIN, ACK] Seq=28 Ack=1 Win=64256 Len=0 TSval=2836005135 TSecr=710170205"
"38","29.070061","192.168.11.31","192.168.11.15","TCP","66","0.012576000","0.012474000","Jan  8, 2024 13:40:42.985835000 JST","","6000  >  40548 [ACK] Seq=1 Ack=28 Win=65152 Len=0 TSval=710170215 TSecr=2836005135"
"39","29.070304","192.168.11.31","192.168.11.15","TCP","66","0.012717000","0.000243000","Jan  8, 2024 13:40:42.986078000 JST","","6000  >  40548 [FIN, ACK] Seq=1 Ack=29 Win=65152 Len=0 TSval=710170217 TSecr=2836005135"
"40","29.070347","192.168.11.15","192.168.11.31","TCP","66","0.000043000","0.000043000","Jan  8, 2024 13:40:42.986121000 JST","","40548  >  6000 [ACK] Seq=29 Ack=2 Win=64256 Len=0 TSval=2836005148 TSecr=710170217"
"41","35.797448","192.168.11.15","192.168.11.31","TCP","74","","6.727101000","Jan  8, 2024 13:40:49.713222000 JST","","33526  >  6000 [SYN] Seq=0 Win=64240 Len=0 MSS=1460 SACK_PERM TSval=2836011875 TSecr=0 WS=128"
"42","35.803998","192.168.11.31","192.168.11.15","TCP","74","0.006550000","0.006550000","Jan  8, 2024 13:40:49.719772000 JST","","6000  >  33526 [SYN, ACK] Seq=0 Ack=1 Win=65160 Len=0 MSS=1460 SACK_PERM TSval=710176952 TSecr=2836011875 WS=128"
"43","35.804113","192.168.11.15","192.168.11.31","TCP","66","0.000115000","0.000115000","Jan  8, 2024 13:40:49.719887000 JST","","33526  >  6000 [ACK] Seq=1 Ack=1 Win=64256 Len=0 TSval=2836011881 TSecr=710176952"
"44","35.804318","192.168.11.15","192.168.11.31","TCP","93","","0.000205000","Jan  8, 2024 13:40:49.720092000 JST","","33526  >  6000 [PSH, ACK] Seq=1 Ack=1 Win=64256 Len=27 TSval=2836011882 TSecr=710176952 [TCP segment of a reassembled PDU]"
"45","35.804432","192.168.11.15","192.168.11.31","TCP","66","","0.000114000","Jan  8, 2024 13:40:49.720206000 JST","","33526  >  6000 [FIN, ACK] Seq=28 Ack=1 Win=64256 Len=0 TSval=2836011882 TSecr=710176952"
"46","35.811803","192.168.11.31","192.168.11.15","TCP","66","0.007485000","0.007371000","Jan  8, 2024 13:40:49.727577000 JST","","6000  >  33526 [ACK] Seq=1 Ack=28 Win=65152 Len=0 TSval=710176959 TSecr=2836011882"
"47","35.812183","192.168.11.31","192.168.11.15","TCP","66","0.007751000","0.000380000","Jan  8, 2024 13:40:49.727957000 JST","","6000  >  33526 [FIN, ACK] Seq=1 Ack=29 Win=65152 Len=0 TSval=710176960 TSecr=2836011882"
"48","35.812233","192.168.11.15","192.168.11.31","TCP","66","0.000050000","0.000050000","Jan  8, 2024 13:40:49.728007000 JST","","33526  >  6000 [ACK] Seq=29 Ack=2 Win=64256 Len=0 TSval=2836011890 TSecr=710176960"
"49","42.535163","192.168.11.15","192.168.11.31","TCP","74","","6.722930000","Jan  8, 2024 13:40:56.450937000 JST","","33542  >  6000 [SYN] Seq=0 Win=64240 Len=0 MSS=1460 SACK_PERM TSval=2836018612 TSecr=0 WS=128"
"50","42.541718","192.168.11.31","192.168.11.15","TCP","74","0.006555000","0.006555000","Jan  8, 2024 13:40:56.457492000 JST","","6000  >  33542 [SYN, ACK] Seq=0 Ack=1 Win=65160 Len=0 MSS=1460 SACK_PERM TSval=710183689 TSecr=2836018612 WS=128"
"51","42.541812","192.168.11.15","192.168.11.31","TCP","66","0.000094000","0.000094000","Jan  8, 2024 13:40:56.457586000 JST","","33542  >  6000 [ACK] Seq=1 Ack=1 Win=64256 Len=0 TSval=2836018619 TSecr=710183689"
"52","42.541982","192.168.11.15","192.168.11.31","TCP","93","","0.000170000","Jan  8, 2024 13:40:56.457756000 JST","","33542  >  6000 [PSH, ACK] Seq=1 Ack=1 Win=64256 Len=27 TSval=2836018619 TSecr=710183689 [TCP segment of a reassembled PDU]"
"53","42.542072","192.168.11.15","192.168.11.31","TCP","66","","0.000090000","Jan  8, 2024 13:40:56.457846000 JST","","33542  >  6000 [FIN, ACK] Seq=28 Ack=1 Win=64256 Len=0 TSval=2836018619 TSecr=710183689"
"54","42.549131","192.168.11.31","192.168.11.15","TCP","66","0.007149000","0.007059000","Jan  8, 2024 13:40:56.464905000 JST","","6000  >  33542 [ACK] Seq=1 Ack=28 Win=65152 Len=0 TSval=710183697 TSecr=2836018619"
"55","42.549480","192.168.11.31","192.168.11.15","TCP","66","0.007408000","0.000349000","Jan  8, 2024 13:40:56.465254000 JST","","6000  >  33542 [FIN, ACK] Seq=1 Ack=29 Win=65152 Len=0 TSval=710183698 TSecr=2836018619"
"56","42.549524","192.168.11.15","192.168.11.31","TCP","66","0.000044000","0.000044000","Jan  8, 2024 13:40:56.465298000 JST","","33542  >  6000 [ACK] Seq=29 Ack=2 Win=64256 Len=0 TSval=2836018627 TSecr=710183698"
"57","49.251697","192.168.11.15","192.168.11.31","TCP","74","","6.702173000","Jan  8, 2024 13:41:03.167471000 JST","","50518  >  6000 [SYN] Seq=0 Win=64240 Len=0 MSS=1460 SACK_PERM TSval=2836025329 TSecr=0 WS=128"
"58","49.266431","192.168.11.31","192.168.11.15","TCP","74","0.014734000","0.014734000","Jan  8, 2024 13:41:03.182205000 JST","","6000  >  50518 [SYN, ACK] Seq=0 Ack=1 Win=65160 Len=0 MSS=1460 SACK_PERM TSval=710190406 TSecr=2836025329 WS=128"
"59","49.266537","192.168.11.15","192.168.11.31","TCP","66","0.000106000","0.000106000","Jan  8, 2024 13:41:03.182311000 JST","","50518  >  6000 [ACK] Seq=1 Ack=1 Win=64256 Len=0 TSval=2836025344 TSecr=710190406"
"60","49.266732","192.168.11.15","192.168.11.31","TCP","93","","0.000195000","Jan  8, 2024 13:41:03.182506000 JST","","50518  >  6000 [PSH, ACK] Seq=1 Ack=1 Win=64256 Len=27 TSval=2836025344 TSecr=710190406 [TCP segment of a reassembled PDU]"
"61","49.266822","192.168.11.15","192.168.11.31","TCP","66","","0.000090000","Jan  8, 2024 13:41:03.182596000 JST","","50518  >  6000 [FIN, ACK] Seq=28 Ack=1 Win=64256 Len=0 TSval=2836025344 TSecr=710190406"
"62","49.278618","192.168.11.31","192.168.11.15","TCP","66","0.011886000","0.011796000","Jan  8, 2024 13:41:03.194392000 JST","","6000  >  50518 [ACK] Seq=1 Ack=28 Win=65152 Len=0 TSval=710190426 TSecr=2836025344"
"63","49.278999","192.168.11.31","192.168.11.15","TCP","66","0.012177000","0.000381000","Jan  8, 2024 13:41:03.194773000 JST","","6000  >  50518 [FIN, ACK] Seq=1 Ack=29 Win=65152 Len=0 TSval=710190427 TSecr=2836025344"
"64","49.279045","192.168.11.15","192.168.11.31","TCP","66","0.000046000","0.000046000","Jan  8, 2024 13:41:03.194819000 JST","","50518  >  6000 [ACK] Seq=29 Ack=2 Win=64256 Len=0 TSval=2836025356 TSecr=710190427"
"65","55.963905","192.168.11.15","192.168.11.31","TCP","74","","6.684860000","Jan  8, 2024 13:41:09.879679000 JST","","60348  >  6000 [SYN] Seq=0 Win=64240 Len=0 MSS=1460 SACK_PERM TSval=2836032041 TSecr=0 WS=128"
"66","55.969416","192.168.11.31","192.168.11.15","TCP","74","0.005511000","0.005511000","Jan  8, 2024 13:41:09.885190000 JST","","6000  >  60348 [SYN, ACK] Seq=0 Ack=1 Win=65160 Len=0 MSS=1460 SACK_PERM TSval=710197118 TSecr=2836032041 WS=128"
"67","55.969507","192.168.11.15","192.168.11.31","TCP","66","0.000091000","0.000091000","Jan  8, 2024 13:41:09.885281000 JST","","60348  >  6000 [ACK] Seq=1 Ack=1 Win=64256 Len=0 TSval=2836032047 TSecr=710197118"
"68","55.969631","192.168.11.15","192.168.11.31","TCP","93","","0.000124000","Jan  8, 2024 13:41:09.885405000 JST","","60348  >  6000 [PSH, ACK] Seq=1 Ack=1 Win=64256 Len=27 TSval=2836032047 TSecr=710197118 [TCP segment of a reassembled PDU]"
"69","55.969736","192.168.11.15","192.168.11.31","TCP","66","","0.000105000","Jan  8, 2024 13:41:09.885510000 JST","","60348  >  6000 [FIN, ACK] Seq=28 Ack=1 Win=64256 Len=0 TSval=2836032047 TSecr=710197118"
"70","55.976605","192.168.11.31","192.168.11.15","TCP","66","0.006974000","0.006869000","Jan  8, 2024 13:41:09.892379000 JST","","6000  >  60348 [ACK] Seq=1 Ack=28 Win=65152 Len=0 TSval=710197124 TSecr=2836032047"
"71","55.976961","192.168.11.31","192.168.11.15","TCP","66","0.007225000","0.000356000","Jan  8, 2024 13:41:09.892735000 JST","","6000  >  60348 [FIN, ACK] Seq=1 Ack=29 Win=65152 Len=0 TSval=710197125 TSecr=2836032047"
"72","55.977009","192.168.11.15","192.168.11.31","TCP","66","0.000048000","0.000048000","Jan  8, 2024 13:41:09.892783000 JST","","60348  >  6000 [ACK] Seq=29 Ack=2 Win=64256 Len=0 TSval=2836032054 TSecr=710197125"
"73","62.616871","192.168.11.15","192.168.11.31","TCP","74","","6.639862000","Jan  8, 2024 13:41:16.532645000 JST","","54324  >  6000 [SYN] Seq=0 Win=64240 Len=0 MSS=1460 SACK_PERM TSval=2836038694 TSecr=0 WS=128"
"74","62.623402","192.168.11.31","192.168.11.15","TCP","74","0.006531000","0.006531000","Jan  8, 2024 13:41:16.539176000 JST","","6000  >  54324 [SYN, ACK] Seq=0 Ack=1 Win=65160 Len=0 MSS=1460 SACK_PERM TSval=710203771 TSecr=2836038694 WS=128"
"75","62.623500","192.168.11.15","192.168.11.31","TCP","66","0.000098000","0.000098000","Jan  8, 2024 13:41:16.539274000 JST","","54324  >  6000 [ACK] Seq=1 Ack=1 Win=64256 Len=0 TSval=2836038701 TSecr=710203771"
"76","62.623660","192.168.11.15","192.168.11.31","TCP","93","","0.000160000","Jan  8, 2024 13:41:16.539434000 JST","","54324  >  6000 [PSH, ACK] Seq=1 Ack=1 Win=64256 Len=27 TSval=2836038701 TSecr=710203771 [TCP segment of a reassembled PDU]"
"77","62.623766","192.168.11.15","192.168.11.31","TCP","66","","0.000106000","Jan  8, 2024 13:41:16.539540000 JST","","54324  >  6000 [FIN, ACK] Seq=28 Ack=1 Win=64256 Len=0 TSval=2836038701 TSecr=710203771"
"78","62.631227","192.168.11.31","192.168.11.15","TCP","66","0.007567000","0.007461000","Jan  8, 2024 13:41:16.547001000 JST","","6000  >  54324 [ACK] Seq=1 Ack=28 Win=65152 Len=0 TSval=710203779 TSecr=2836038701"
"79","62.631595","192.168.11.31","192.168.11.15","TCP","66","0.007829000","0.000368000","Jan  8, 2024 13:41:16.547369000 JST","","6000  >  54324 [FIN, ACK] Seq=1 Ack=29 Win=65152 Len=0 TSval=710203780 TSecr=2836038701"
"80","62.631648","192.168.11.15","192.168.11.31","TCP","66","0.000053000","0.000053000","Jan  8, 2024 13:41:16.547422000 JST","","54324  >  6000 [ACK] Seq=29 Ack=2 Win=64256 Len=0 TSval=2836038709 TSecr=710203780"
"81","122.674869","192.168.11.15","192.168.11.31","TCP","74","","60.043221000","Jan  8, 2024 13:42:16.590643000 JST","","57416  >  6000 [SYN] Seq=0 Win=64240 Len=0 MSS=1460 SACK_PERM TSval=2836098752 TSecr=0 WS=128"
"82","122.684992","192.168.11.31","192.168.11.15","TCP","74","0.010123000","0.010123000","Jan  8, 2024 13:42:16.600766000 JST","","6000  >  57416 [SYN, ACK] Seq=0 Ack=1 Win=65160 Len=0 MSS=1460 SACK_PERM TSval=710263830 TSecr=2836098752 WS=128"
"83","122.685090","192.168.11.15","192.168.11.31","TCP","66","0.000098000","0.000098000","Jan  8, 2024 13:42:16.600864000 JST","","57416  >  6000 [ACK] Seq=1 Ack=1 Win=64256 Len=0 TSval=2836098762 TSecr=710263830"
"84","122.685248","192.168.11.15","192.168.11.31","TCP","93","","0.000158000","Jan  8, 2024 13:42:16.601022000 JST","","57416  >  6000 [PSH, ACK] Seq=1 Ack=1 Win=64256 Len=27 TSval=2836098763 TSecr=710263830 [TCP segment of a reassembled PDU]"
"85","122.685368","192.168.11.15","192.168.11.31","TCP","66","","0.000120000","Jan  8, 2024 13:42:16.601142000 JST","","57416  >  6000 [FIN, ACK] Seq=28 Ack=1 Win=64256 Len=0 TSval=2836098763 TSecr=710263830"
"86","122.693547","192.168.11.31","192.168.11.15","TCP","66","0.008299000","0.008179000","Jan  8, 2024 13:42:16.609321000 JST","","6000  >  57416 [ACK] Seq=1 Ack=28 Win=65152 Len=0 TSval=710263840 TSecr=2836098763"
"87","122.696046","192.168.11.31","192.168.11.15","TCP","66","0.010678000","0.002499000","Jan  8, 2024 13:42:16.611820000 JST","","6000  >  57416 [FIN, ACK] Seq=1 Ack=29 Win=65152 Len=0 TSval=710263841 TSecr=2836098763"
"88","122.696090","192.168.11.15","192.168.11.31","TCP","66","0.000044000","0.000044000","Jan  8, 2024 13:42:16.611864000 JST","","57416  >  6000 [ACK] Seq=29 Ack=2 Win=64256 Len=0 TSval=2836098773 TSecr=710263841"
"89","130.430133","192.168.11.15","192.168.11.31","TCP","74","","7.734043000","Jan  8, 2024 13:42:24.345907000 JST","","57430  >  6000 [SYN] Seq=0 Win=64240 Len=0 MSS=1460 SACK_PERM TSval=2836106507 TSecr=0 WS=128"
"90","130.444701","192.168.11.31","192.168.11.15","TCP","74","0.014568000","0.014568000","Jan  8, 2024 13:42:24.360475000 JST","","6000  >  57430 [SYN, ACK] Seq=0 Ack=1 Win=65160 Len=0 MSS=1460 SACK_PERM TSval=710271592 TSecr=2836106507 WS=128"
"91","130.444799","192.168.11.15","192.168.11.31","TCP","66","0.000098000","0.000098000","Jan  8, 2024 13:42:24.360573000 JST","","57430  >  6000 [ACK] Seq=1 Ack=1 Win=64256 Len=0 TSval=2836106522 TSecr=710271592"
"92","130.444927","192.168.11.15","192.168.11.31","TCP","93","","0.000128000","Jan  8, 2024 13:42:24.360701000 JST","","57430  >  6000 [PSH, ACK] Seq=1 Ack=1 Win=64256 Len=27 TSval=2836106522 TSecr=710271592 [TCP segment of a reassembled PDU]"
"93","130.445031","192.168.11.15","192.168.11.31","TCP","66","","0.000104000","Jan  8, 2024 13:42:24.360805000 JST","","57430  >  6000 [FIN, ACK] Seq=28 Ack=1 Win=64256 Len=0 TSval=2836106522 TSecr=710271592"
"94","130.453156","192.168.11.31","192.168.11.15","TCP","66","0.008229000","0.008125000","Jan  8, 2024 13:42:24.368930000 JST","","6000  >  57430 [ACK] Seq=1 Ack=28 Win=65152 Len=0 TSval=710271601 TSecr=2836106522"
"95","130.453520","192.168.11.31","192.168.11.15","TCP","66","0.008489000","0.000364000","Jan  8, 2024 13:42:24.369294000 JST","","6000  >  57430 [FIN, ACK] Seq=1 Ack=29 Win=65152 Len=0 TSval=710271602 TSecr=2836106522"
"96","130.453562","192.168.11.15","192.168.11.31","TCP","66","0.000042000","0.000042000","Jan  8, 2024 13:42:24.369336000 JST","","57430  >  6000 [ACK] Seq=29 Ack=2 Win=64256 Len=0 TSval=2836106531 TSecr=710271602"
"97","137.160327","192.168.11.15","192.168.11.31","TCP","74","","6.706765000","Jan  8, 2024 13:42:31.076101000 JST","","41144  >  6000 [SYN] Seq=0 Win=64240 Len=0 MSS=1460 SACK_PERM TSval=2836113238 TSecr=0 WS=128"
"98","137.169521","192.168.11.31","192.168.11.15","TCP","74","0.009194000","0.009194000","Jan  8, 2024 13:42:31.085295000 JST","","6000  >  41144 [SYN, ACK] Seq=0 Ack=1 Win=65160 Len=0 MSS=1460 SACK_PERM TSval=710278317 TSecr=2836113238 WS=128"
"99","137.169632","192.168.11.15","192.168.11.31","TCP","66","0.000111000","0.000111000","Jan  8, 2024 13:42:31.085406000 JST","","41144  >  6000 [ACK] Seq=1 Ack=1 Win=64256 Len=0 TSval=2836113247 TSecr=710278317"
"100","137.169891","192.168.11.15","192.168.11.31","TCP","93","","0.000259000","Jan  8, 2024 13:42:31.085665000 JST","","41144  >  6000 [PSH, ACK] Seq=1 Ack=1 Win=64256 Len=27 TSval=2836113247 TSecr=710278317 [TCP segment of a reassembled PDU]"
"101","137.169987","192.168.11.15","192.168.11.31","TCP","66","","0.000096000","Jan  8, 2024 13:42:31.085761000 JST","","41144  >  6000 [FIN, ACK] Seq=28 Ack=1 Win=64256 Len=0 TSval=2836113247 TSecr=710278317"
"102","137.177411","192.168.11.31","192.168.11.15","TCP","66","0.007520000","0.007424000","Jan  8, 2024 13:42:31.093185000 JST","","6000  >  41144 [ACK] Seq=1 Ack=28 Win=65152 Len=0 TSval=710278325 TSecr=2836113247"
"103","137.177773","192.168.11.31","192.168.11.15","TCP","66","0.007786000","0.000362000","Jan  8, 2024 13:42:31.093547000 JST","","6000  >  41144 [FIN, ACK] Seq=1 Ack=29 Win=65152 Len=0 TSval=710278326 TSecr=2836113247"
"104","137.177816","192.168.11.15","192.168.11.31","TCP","66","0.000043000","0.000043000","Jan  8, 2024 13:42:31.093590000 JST","","41144  >  6000 [ACK] Seq=29 Ack=2 Win=64256 Len=0 TSval=2836113255 TSecr=710278326"
"105","144.926831","192.168.11.15","192.168.11.31","TCP","74","","7.749015000","Jan  8, 2024 13:42:38.842605000 JST","","56806  >  6000 [SYN] Seq=0 Win=64240 Len=0 MSS=1460 SACK_PERM TSval=2836121004 TSecr=0 WS=128"
"106","144.933607","192.168.11.31","192.168.11.15","TCP","74","0.006776000","0.006776000","Jan  8, 2024 13:42:38.849381000 JST","","6000  >  56806 [SYN, ACK] Seq=0 Ack=1 Win=65160 Len=0 MSS=1460 SACK_PERM TSval=710286081 TSecr=2836121004 WS=128"
"107","144.933710","192.168.11.15","192.168.11.31","TCP","66","0.000103000","0.000103000","Jan  8, 2024 13:42:38.849484000 JST","","56806  >  6000 [ACK] Seq=1 Ack=1 Win=64256 Len=0 TSval=2836121011 TSecr=710286081"
"108","144.933954","192.168.11.15","192.168.11.31","TCP","93","","0.000244000","Jan  8, 2024 13:42:38.849728000 JST","","56806  >  6000 [PSH, ACK] Seq=1 Ack=1 Win=64256 Len=27 TSval=2836121011 TSecr=710286081 [TCP segment of a reassembled PDU]"
"109","144.934056","192.168.11.15","192.168.11.31","TCP","66","","0.000102000","Jan  8, 2024 13:42:38.849830000 JST","","56806  >  6000 [FIN, ACK] Seq=28 Ack=1 Win=64256 Len=0 TSval=2836121011 TSecr=710286081"
"110","144.941579","192.168.11.31","192.168.11.15","TCP","66","0.007625000","0.007523000","Jan  8, 2024 13:42:38.857353000 JST","","6000  >  56806 [ACK] Seq=1 Ack=28 Win=65152 Len=0 TSval=710286089 TSecr=2836121011"
"111","144.941805","192.168.11.31","192.168.11.15","TCP","66","0.007749000","0.000226000","Jan  8, 2024 13:42:38.857579000 JST","","6000  >  56806 [FIN, ACK] Seq=1 Ack=29 Win=65152 Len=0 TSval=710286090 TSecr=2836121011"
"112","144.941848","192.168.11.15","192.168.11.31","TCP","66","0.000043000","0.000043000","Jan  8, 2024 13:42:38.857622000 JST","","56806  >  6000 [ACK] Seq=29 Ack=2 Win=64256 Len=0 TSval=2836121019 TSecr=710286090"
"113","151.613244","192.168.11.15","192.168.11.31","TCP","74","","6.671396000","Jan  8, 2024 13:42:45.529018000 JST","","56820  >  6000 [SYN] Seq=0 Win=64240 Len=0 MSS=1460 SACK_PERM TSval=2836127691 TSecr=0 WS=128"
"114","151.619794","192.168.11.31","192.168.11.15","TCP","74","0.006550000","0.006550000","Jan  8, 2024 13:42:45.535568000 JST","","6000  >  56820 [SYN, ACK] Seq=0 Ack=1 Win=65160 Len=0 MSS=1460 SACK_PERM TSval=710292768 TSecr=2836127691 WS=128"
"115","151.619891","192.168.11.15","192.168.11.31","TCP","66","0.000097000","0.000097000","Jan  8, 2024 13:42:45.535665000 JST","","56820  >  6000 [ACK] Seq=1 Ack=1 Win=64256 Len=0 TSval=2836127697 TSecr=710292768"
"116","151.620125","192.168.11.15","192.168.11.31","TCP","93","","0.000234000","Jan  8, 2024 13:42:45.535899000 JST","","56820  >  6000 [PSH, ACK] Seq=1 Ack=1 Win=64256 Len=27 TSval=2836127697 TSecr=710292768 [TCP segment of a reassembled PDU]"
"117","151.620252","192.168.11.15","192.168.11.31","TCP","66","","0.000127000","Jan  8, 2024 13:42:45.536026000 JST","","56820  >  6000 [FIN, ACK] Seq=28 Ack=1 Win=64256 Len=0 TSval=2836127698 TSecr=710292768"
"118","151.627533","192.168.11.31","192.168.11.15","TCP","66","0.007408000","0.007281000","Jan  8, 2024 13:42:45.543307000 JST","","6000  >  56820 [ACK] Seq=1 Ack=28 Win=65152 Len=0 TSval=710292775 TSecr=2836127697"
"119","151.627906","192.168.11.31","192.168.11.15","TCP","66","0.007654000","0.000373000","Jan  8, 2024 13:42:45.543680000 JST","","6000  >  56820 [FIN, ACK] Seq=1 Ack=29 Win=65152 Len=0 TSval=710292776 TSecr=2836127698"
"120","151.627950","192.168.11.15","192.168.11.31","TCP","66","0.000044000","0.000044000","Jan  8, 2024 13:42:45.543724000 JST","","56820  >  6000 [ACK] Seq=29 Ack=2 Win=64256 Len=0 TSval=2836127705 TSecr=710292776"
"121","159.404874","192.168.11.15","192.168.11.31","TCP","74","","7.776924000","Jan  8, 2024 13:42:53.320648000 JST","","49294  >  6000 [SYN] Seq=0 Win=64240 Len=0 MSS=1460 SACK_PERM TSval=2836135482 TSecr=0 WS=128"
"122","159.411674","192.168.11.31","192.168.11.15","TCP","74","0.006800000","0.006800000","Jan  8, 2024 13:42:53.327448000 JST","","6000  >  49294 [SYN, ACK] Seq=0 Ack=1 Win=65160 Len=0 MSS=1460 SACK_PERM TSval=710300560 TSecr=2836135482 WS=128"
"123","159.411770","192.168.11.15","192.168.11.31","TCP","66","0.000096000","0.000096000","Jan  8, 2024 13:42:53.327544000 JST","","49294  >  6000 [ACK] Seq=1 Ack=1 Win=64256 Len=0 TSval=2836135489 TSecr=710300560"
"124","159.411938","192.168.11.15","192.168.11.31","TCP","93","","0.000168000","Jan  8, 2024 13:42:53.327712000 JST","","49294  >  6000 [PSH, ACK] Seq=1 Ack=1 Win=64256 Len=27 TSval=2836135489 TSecr=710300560 [TCP segment of a reassembled PDU]"
"125","159.412027","192.168.11.15","192.168.11.31","TCP","66","","0.000089000","Jan  8, 2024 13:42:53.327801000 JST","","49294  >  6000 [FIN, ACK] Seq=28 Ack=1 Win=64256 Len=0 TSval=2836135489 TSecr=710300560"
"126","159.420711","192.168.11.31","192.168.11.15","TCP","66","0.008773000","0.008684000","Jan  8, 2024 13:42:53.336485000 JST","","6000  >  49294 [ACK] Seq=1 Ack=28 Win=65152 Len=0 TSval=710300568 TSecr=2836135489"
"127","159.421073","192.168.11.31","192.168.11.15","TCP","66","0.009046000","0.000362000","Jan  8, 2024 13:42:53.336847000 JST","","6000  >  49294 [FIN, ACK] Seq=1 Ack=29 Win=65152 Len=0 TSval=710300570 TSecr=2836135489"
"128","159.421114","192.168.11.15","192.168.11.31","TCP","66","0.000041000","0.000041000","Jan  8, 2024 13:42:53.336888000 JST","","49294  >  6000 [ACK] Seq=29 Ack=2 Win=64256 Len=0 TSval=2836135498 TSecr=710300570"
"129","166.128839","192.168.11.15","192.168.11.31","TCP","74","","6.707725000","Jan  8, 2024 13:43:00.044613000 JST","","59176  >  6000 [SYN] Seq=0 Win=64240 Len=0 MSS=1460 SACK_PERM TSval=2836142206 TSecr=0 WS=128"
"130","166.135389","192.168.11.31","192.168.11.15","TCP","74","0.006550000","0.006550000","Jan  8, 2024 13:43:00.051163000 JST","","6000  >  59176 [SYN, ACK] Seq=0 Ack=1 Win=65160 Len=0 MSS=1460 SACK_PERM TSval=710307283 TSecr=2836142206 WS=128"
"131","166.135484","192.168.11.15","192.168.11.31","TCP","66","0.000095000","0.000095000","Jan  8, 2024 13:43:00.051258000 JST","","59176  >  6000 [ACK] Seq=1 Ack=1 Win=64256 Len=0 TSval=2836142213 TSecr=710307283"
"132","166.135604","192.168.11.15","192.168.11.31","TCP","93","","0.000120000","Jan  8, 2024 13:43:00.051378000 JST","","59176  >  6000 [PSH, ACK] Seq=1 Ack=1 Win=64256 Len=27 TSval=2836142213 TSecr=710307283 [TCP segment of a reassembled PDU]"
"133","166.135715","192.168.11.15","192.168.11.31","TCP","66","","0.000111000","Jan  8, 2024 13:43:00.051489000 JST","","59176  >  6000 [FIN, ACK] Seq=28 Ack=1 Win=64256 Len=0 TSval=2836142213 TSecr=710307283"
"134","166.150604","192.168.11.31","192.168.11.15","TCP","66","0.015000000","0.014889000","Jan  8, 2024 13:43:00.066378000 JST","","6000  >  59176 [ACK] Seq=1 Ack=28 Win=65152 Len=0 TSval=710307298 TSecr=2836142213"
"135","166.150957","192.168.11.31","192.168.11.15","TCP","66","0.015242000","0.000353000","Jan  8, 2024 13:43:00.066731000 JST","","6000  >  59176 [FIN, ACK] Seq=1 Ack=29 Win=65152 Len=0 TSval=710307299 TSecr=2836142213"
"136","166.151000","192.168.11.15","192.168.11.31","TCP","66","0.000043000","0.000043000","Jan  8, 2024 13:43:00.066774000 JST","","59176  >  6000 [ACK] Seq=29 Ack=2 Win=64256 Len=0 TSval=2836142228 TSecr=710307299"
"137","172.785411","192.168.11.15","192.168.11.31","TCP","74","","6.634411000","Jan  8, 2024 13:43:06.701185000 JST","","47954  >  6000 [SYN] Seq=0 Win=64240 Len=0 MSS=1460 SACK_PERM TSval=2836148863 TSecr=0 WS=128"
"138","172.791868","192.168.11.31","192.168.11.15","TCP","74","0.006457000","0.006457000","Jan  8, 2024 13:43:06.707642000 JST","","6000  >  47954 [SYN, ACK] Seq=0 Ack=1 Win=65160 Len=0 MSS=1460 SACK_PERM TSval=710313940 TSecr=2836148863 WS=128"
"139","172.791967","192.168.11.15","192.168.11.31","TCP","66","0.000099000","0.000099000","Jan  8, 2024 13:43:06.707741000 JST","","47954  >  6000 [ACK] Seq=1 Ack=1 Win=64256 Len=0 TSval=2836148869 TSecr=710313940"
"140","172.792096","192.168.11.15","192.168.11.31","TCP","93","","0.000129000","Jan  8, 2024 13:43:06.707870000 JST","","47954  >  6000 [PSH, ACK] Seq=1 Ack=1 Win=64256 Len=27 TSval=2836148869 TSecr=710313940 [TCP segment of a reassembled PDU]"
"141","172.792189","192.168.11.15","192.168.11.31","TCP","66","","0.000093000","Jan  8, 2024 13:43:06.707963000 JST","","47954  >  6000 [FIN, ACK] Seq=28 Ack=1 Win=64256 Len=0 TSval=2836148870 TSecr=710313940"
"142","172.799659","192.168.11.31","192.168.11.15","TCP","66","0.007563000","0.007470000","Jan  8, 2024 13:43:06.715433000 JST","","6000  >  47954 [ACK] Seq=1 Ack=28 Win=65152 Len=0 TSval=710313947 TSecr=2836148869"
"143","172.799861","192.168.11.31","192.168.11.15","TCP","66","0.007672000","0.000202000","Jan  8, 2024 13:43:06.715635000 JST","","6000  >  47954 [FIN, ACK] Seq=1 Ack=29 Win=65152 Len=0 TSval=710313949 TSecr=2836148870"
"144","172.799904","192.168.11.15","192.168.11.31","TCP","66","0.000043000","0.000043000","Jan  8, 2024 13:43:06.715678000 JST","","47954  >  6000 [ACK] Seq=29 Ack=2 Win=64256 Len=0 TSval=2836148877 TSecr=710313949"
"145","179.488009","192.168.11.15","192.168.11.31","TCP","74","","6.688105000","Jan  8, 2024 13:43:13.403783000 JST","","47962  >  6000 [SYN] Seq=0 Win=64240 Len=0 MSS=1460 SACK_PERM TSval=2836155565 TSecr=0 WS=128"
"146","180.511197","192.168.11.15","192.168.11.31","TCP","74","","1.023188000","Jan  8, 2024 13:43:14.426971000 JST","","[TCP Retransmission] 47962  >  6000 [SYN] Seq=0 Win=64240 Len=0 MSS=1460 SACK_PERM TSval=2836156589 TSecr=0 WS=128"
"147","180.517822","192.168.11.31","192.168.11.15","TCP","74","1.029813000","0.006625000","Jan  8, 2024 13:43:14.433596000 JST","","6000  >  47962 [SYN, ACK] Seq=0 Ack=1 Win=65160 Len=0 MSS=1460 SACK_PERM TSval=710321666 TSecr=2836156589 WS=128"
"148","180.517929","192.168.11.15","192.168.11.31","TCP","66","0.000107000","0.000107000","Jan  8, 2024 13:43:14.433703000 JST","","47962  >  6000 [ACK] Seq=1 Ack=1 Win=64256 Len=0 TSval=2836156595 TSecr=710321666"
"149","180.518092","192.168.11.15","192.168.11.31","TCP","93","","0.000163000","Jan  8, 2024 13:43:14.433866000 JST","","47962  >  6000 [PSH, ACK] Seq=1 Ack=1 Win=64256 Len=27 TSval=2836156595 TSecr=710321666 [TCP segment of a reassembled PDU]"
"150","180.518210","192.168.11.15","192.168.11.31","TCP","66","","0.000118000","Jan  8, 2024 13:43:14.433984000 JST","","47962  >  6000 [FIN, ACK] Seq=28 Ack=1 Win=64256 Len=0 TSval=2836156596 TSecr=710321666"
"151","180.528356","192.168.11.31","192.168.11.15","TCP","66","0.010264000","0.010146000","Jan  8, 2024 13:43:14.444130000 JST","","6000  >  47962 [ACK] Seq=1 Ack=28 Win=65152 Len=0 TSval=710321676 TSecr=2836156595"
"152","180.528741","192.168.11.31","192.168.11.15","TCP","66","0.010531000","0.000385000","Jan  8, 2024 13:43:14.444515000 JST","","6000  >  47962 [FIN, ACK] Seq=1 Ack=29 Win=65152 Len=0 TSval=710321677 TSecr=2836156596"
"153","180.528785","192.168.11.15","192.168.11.31","TCP","66","0.000044000","0.000044000","Jan  8, 2024 13:43:14.444559000 JST","","47962  >  6000 [ACK] Seq=29 Ack=2 Win=64256 Len=0 TSval=2836156606 TSecr=710321677"
"154","188.417302","192.168.11.15","192.168.11.31","TCP","74","","7.888517000","Jan  8, 2024 13:43:22.333076000 JST","","44458  >  6000 [SYN] Seq=0 Win=64240 Len=0 MSS=1460 SACK_PERM TSval=2836164495 TSecr=0 WS=128"
"155","188.423844","192.168.11.31","192.168.11.15","TCP","74","0.006542000","0.006542000","Jan  8, 2024 13:43:22.339618000 JST","","6000  >  44458 [SYN, ACK] Seq=0 Ack=1 Win=65160 Len=0 MSS=1460 SACK_PERM TSval=710329572 TSecr=2836164495 WS=128"
"156","188.423946","192.168.11.15","192.168.11.31","TCP","66","0.000102000","0.000102000","Jan  8, 2024 13:43:22.339720000 JST","","44458  >  6000 [ACK] Seq=1 Ack=1 Win=64256 Len=0 TSval=2836164501 TSecr=710329572"
"157","188.424182","192.168.11.15","192.168.11.31","TCP","93","","0.000236000","Jan  8, 2024 13:43:22.339956000 JST","","44458  >  6000 [PSH, ACK] Seq=1 Ack=1 Win=64256 Len=27 TSval=2836164502 TSecr=710329572 [TCP segment of a reassembled PDU]"
"158","188.424287","192.168.11.15","192.168.11.31","TCP","66","","0.000105000","Jan  8, 2024 13:43:22.340061000 JST","","44458  >  6000 [FIN, ACK] Seq=28 Ack=1 Win=64256 Len=0 TSval=2836164502 TSecr=710329572"
"159","188.435174","192.168.11.31","192.168.11.15","TCP","66","0.010992000","0.010887000","Jan  8, 2024 13:43:22.350948000 JST","","6000  >  44458 [ACK] Seq=1 Ack=28 Win=65152 Len=0 TSval=710329580 TSecr=2836164502"
"160","188.435391","192.168.11.31","192.168.11.15","TCP","66","0.011104000","0.000217000","Jan  8, 2024 13:43:22.351165000 JST","","6000  >  44458 [FIN, ACK] Seq=1 Ack=29 Win=65152 Len=0 TSval=710329582 TSecr=2836164502"
"161","188.435434","192.168.11.15","192.168.11.31","TCP","66","0.000043000","0.000043000","Jan  8, 2024 13:43:22.351208000 JST","","44458  >  6000 [ACK] Seq=29 Ack=2 Win=64256 Len=0 TSval=2836164513 TSecr=710329582"
"162","210.609033","192.168.11.15","192.168.11.31","TCP","74","","22.173599000","Jan  8, 2024 13:43:44.524807000 JST","","53874  >  6000 [SYN] Seq=0 Win=64240 Len=0 MSS=1460 SACK_PERM TSval=2836186686 TSecr=0 WS=128"
"163","210.618162","192.168.11.31","192.168.11.15","TCP","74","0.009129000","0.009129000","Jan  8, 2024 13:43:44.533936000 JST","","6000  >  53874 [SYN, ACK] Seq=0 Ack=1 Win=65160 Len=0 MSS=1460 SACK_PERM TSval=710351763 TSecr=2836186686 WS=128"
"164","210.618257","192.168.11.15","192.168.11.31","TCP","66","0.000095000","0.000095000","Jan  8, 2024 13:43:44.534031000 JST","","53874  >  6000 [ACK] Seq=1 Ack=1 Win=64256 Len=0 TSval=2836186696 TSecr=710351763"
"165","210.618422","192.168.11.15","192.168.11.31","TCP","93","","0.000165000","Jan  8, 2024 13:43:44.534196000 JST","","53874  >  6000 [PSH, ACK] Seq=1 Ack=1 Win=64256 Len=27 TSval=2836186696 TSecr=710351763 [TCP segment of a reassembled PDU]"
"166","210.618540","192.168.11.15","192.168.11.31","TCP","66","","0.000118000","Jan  8, 2024 13:43:44.534314000 JST","","53874  >  6000 [FIN, ACK] Seq=28 Ack=1 Win=64256 Len=0 TSval=2836186696 TSecr=710351763"
"167","210.627719","192.168.11.31","192.168.11.15","TCP","66","0.009297000","0.009179000","Jan  8, 2024 13:43:44.543493000 JST","","6000  >  53874 [ACK] Seq=1 Ack=28 Win=65152 Len=0 TSval=710351774 TSecr=2836186696"
"168","210.630290","192.168.11.31","192.168.11.15","TCP","66","0.011750000","0.002571000","Jan  8, 2024 13:43:44.546064000 JST","","6000  >  53874 [FIN, ACK] Seq=1 Ack=29 Win=65152 Len=0 TSval=710351775 TSecr=2836186696"
"169","210.630333","192.168.11.15","192.168.11.31","TCP","66","0.000043000","0.000043000","Jan  8, 2024 13:43:44.546107000 JST","","53874  >  6000 [ACK] Seq=29 Ack=2 Win=64256 Len=0 TSval=2836186708 TSecr=710351775"
"170","218.347617","192.168.11.15","192.168.11.31","TCP","74","","7.717284000","Jan  8, 2024 13:43:52.263391000 JST","","38596  >  6000 [SYN] Seq=0 Win=64240 Len=0 MSS=1460 SACK_PERM TSval=2836194425 TSecr=0 WS=128"
"171","218.353961","192.168.11.31","192.168.11.15","TCP","74","0.006344000","0.006344000","Jan  8, 2024 13:43:52.269735000 JST","","6000  >  38596 [SYN, ACK] Seq=0 Ack=1 Win=65160 Len=0 MSS=1460 SACK_PERM TSval=710359502 TSecr=2836194425 WS=128"
"172","218.354057","192.168.11.15","192.168.11.31","TCP","66","0.000096000","0.000096000","Jan  8, 2024 13:43:52.269831000 JST","","38596  >  6000 [ACK] Seq=1 Ack=1 Win=64256 Len=0 TSval=2836194431 TSecr=710359502"
"173","218.354215","192.168.11.15","192.168.11.31","TCP","93","","0.000158000","Jan  8, 2024 13:43:52.269989000 JST","","38596  >  6000 [PSH, ACK] Seq=1 Ack=1 Win=64256 Len=27 TSval=2836194432 TSecr=710359502 [TCP segment of a reassembled PDU]"
"174","218.354303","192.168.11.15","192.168.11.31","TCP","66","","0.000088000","Jan  8, 2024 13:43:52.270077000 JST","","38596  >  6000 [FIN, ACK] Seq=28 Ack=1 Win=64256 Len=0 TSval=2836194432 TSecr=710359502"
"175","218.367724","192.168.11.31","192.168.11.15","TCP","66","0.013509000","0.013421000","Jan  8, 2024 13:43:52.283498000 JST","","6000  >  38596 [ACK] Seq=1 Ack=28 Win=65152 Len=0 TSval=710359516 TSecr=2836194432"
"176","218.368094","192.168.11.31","192.168.11.15","TCP","66","0.013791000","0.000370000","Jan  8, 2024 13:43:52.283868000 JST","","6000  >  38596 [FIN, ACK] Seq=1 Ack=29 Win=65152 Len=0 TSval=710359517 TSecr=2836194432"
"177","218.368140","192.168.11.15","192.168.11.31","TCP","66","0.000046000","0.000046000","Jan  8, 2024 13:43:52.283914000 JST","","38596  >  6000 [ACK] Seq=29 Ack=2 Win=64256 Len=0 TSval=2836194445 TSecr=710359517"
"178","225.277653","192.168.11.15","192.168.11.31","TCP","74","","6.909513000","Jan  8, 2024 13:43:59.193427000 JST","","51572  >  6000 [SYN] Seq=0 Win=64240 Len=0 MSS=1460 SACK_PERM TSval=2836201355 TSecr=0 WS=128"
"179","225.284468","192.168.11.31","192.168.11.15","TCP","74","0.006815000","0.006815000","Jan  8, 2024 13:43:59.200242000 JST","","6000  >  51572 [SYN, ACK] Seq=0 Ack=1 Win=65160 Len=0 MSS=1460 SACK_PERM TSval=710366432 TSecr=2836201355 WS=128"
