"No.","Time","Source","Destination","Protocol","Length","The RTT to ACK the segment was","Time delta from previous captured frame","Arrival Time","Data","Info"
"1","0.000000","192.168.11.27","192.168.11.42","TCP","74","","0.000000000","Jan  8, 2024 13:40:12.255085000 JST","","54718  >  6000 [SYN] Seq=0 Win=64240 Len=0 MSS=1460 SACK_PERM TSval=538433072 TSecr=0 WS=128"
"2","0.007365","192.168.11.42","192.168.11.27","TCP","74","0.007365000","0.007365000","Jan  8, 2024 13:40:12.262450000 JST","","6000  >  54718 [SYN, ACK] Seq=0 Ack=1 Win=65160 Len=0 MSS=1460 SACK_PERM TSval=1753402754 TSecr=538433072 WS=128"
"3","0.007484","192.168.11.27","192.168.11.42","TCP","66","0.000119000","0.000119000","Jan  8, 2024 13:40:12.262569000 JST","","54718  >  6000 [ACK] Seq=1 Ack=1 Win=64256 Len=0 TSval=538433080 TSecr=1753402754"
"4","0.007756","192.168.11.27","192.168.11.42","TCP","93","","0.000272000","Jan  8, 2024 13:40:12.262841000 JST","","54718  >  6000 [PSH, ACK] Seq=1 Ack=1 Win=64256 Len=27 TSval=538433080 TSecr=1753402754 [TCP segment of a reassembled PDU]"
"5","0.007873","192.168.11.27","192.168.11.42","TCP","66","","0.000117000","Jan  8, 2024 13:40:12.262958000 JST","","54718  >  6000 [FIN, ACK] Seq=28 Ack=1 Win=64256 Len=0 TSval=538433080 TSecr=1753402754"
"6","0.013979","192.168.11.42","192.168.11.27","TCP","66","0.006223000","0.006106000","Jan  8, 2024 13:40:12.269064000 JST","","6000  >  54718 [ACK] Seq=1 Ack=28 Win=65152 Len=0 TSval=1753402761 TSecr=538433080"
"7","0.041687","192.168.11.27","255.255.255.255","UDP","209","","0.027708000","Jan  8, 2024 13:40:12.296772000 JST","7b2273656d616e74696373223a207b22656e74697479223a2022504944222c202262617365656e74697479223a2022616e79222c2022726f6c65223a2022626262222c20227370617469616c223a2022616e79222c202274656d706f72616c223a2022616e79227d2c20226461746170726f7065727479223a207b22666f726d6174223a2022696e616f6b615f70726f6772616d5f73616d706c655f73656d616e746963227d7d","41520  >  7000 Len=167"
"8","0.047705","192.168.11.13","192.168.11.27","TCP","74","","0.006018000","Jan  8, 2024 13:40:12.302790000 JST","","35714  >  6000 [SYN] Seq=0 Win=64240 Len=0 MSS=1460 SACK_PERM TSval=675294876 TSecr=0 WS=128"
"9","0.047860","192.168.11.27","192.168.11.13","TCP","74","0.000155000","0.000155000","Jan  8, 2024 13:40:12.302945000 JST","","6000  >  35714 [SYN, ACK] Seq=0 Ack=1 Win=65160 Len=0 MSS=1460 SACK_PERM TSval=510853602 TSecr=675294876 WS=128"
"10","0.054606","192.168.11.13","192.168.11.27","TCP","66","0.006746000","0.006746000","Jan  8, 2024 13:40:12.309691000 JST","","35714  >  6000 [ACK] Seq=1 Ack=1 Win=64256 Len=0 TSval=675294883 TSecr=510853602"
"11","0.055262","192.168.11.13","192.168.11.27","TCP","93","","0.000656000","Jan  8, 2024 13:40:12.310347000 JST","","35714  >  6000 [PSH, ACK] Seq=1 Ack=1 Win=64256 Len=27 TSval=675294883 TSecr=510853602 [TCP segment of a reassembled PDU]"
"12","0.055356","192.168.11.27","192.168.11.13","TCP","66","0.000094000","0.000094000","Jan  8, 2024 13:40:12.310441000 JST","","6000  >  35714 [ACK] Seq=1 Ack=28 Win=65152 Len=0 TSval=510853610 TSecr=675294883"
"13","0.055436","192.168.11.13","192.168.11.27","TCP","66","","0.000080000","Jan  8, 2024 13:40:12.310521000 JST","","35714  >  6000 [FIN, ACK] Seq=28 Ack=1 Win=64256 Len=0 TSval=675294883 TSecr=510853602"
"14","0.057157","192.168.11.27","192.168.11.13","TCP","66","0.001721000","0.001721000","Jan  8, 2024 13:40:12.312242000 JST","","6000  >  35714 [FIN, ACK] Seq=1 Ack=29 Win=65152 Len=0 TSval=510853612 TSecr=675294883"
"15","0.068026","192.168.11.42","192.168.11.27","TCP","66","0.060153000","0.010869000","Jan  8, 2024 13:40:12.323111000 JST","","6000  >  54718 [ACK] Seq=1 Ack=29 Win=65152 Len=0 TSval=1753402805 TSecr=538433080"
"16","0.068410","192.168.11.13","192.168.11.27","TCP","66","0.011253000","0.000384000","Jan  8, 2024 13:40:12.323495000 JST","","35714  >  6000 [ACK] Seq=29 Ack=2 Win=64256 Len=0 TSval=675294890 TSecr=510853612"
"17","6.866261","192.168.11.27","192.168.11.42","TCP","74","","6.797851000","Jan  8, 2024 13:40:19.121346000 JST","","54734  >  6000 [SYN] Seq=0 Win=64240 Len=0 MSS=1460 SACK_PERM TSval=538439939 TSecr=0 WS=128"
"18","6.874380","192.168.11.42","192.168.11.27","TCP","74","0.008119000","0.008119000","Jan  8, 2024 13:40:19.129465000 JST","","6000  >  54734 [SYN, ACK] Seq=0 Ack=1 Win=65160 Len=0 MSS=1460 SACK_PERM TSval=1753409621 TSecr=538439939 WS=128"
"19","6.874488","192.168.11.27","192.168.11.42","TCP","66","0.000108000","0.000108000","Jan  8, 2024 13:40:19.129573000 JST","","54734  >  6000 [ACK] Seq=1 Ack=1 Win=64256 Len=0 TSval=538439947 TSecr=1753409621"
"20","6.874705","192.168.11.27","192.168.11.42","TCP","93","","0.000217000","Jan  8, 2024 13:40:19.129790000 JST","","54734  >  6000 [PSH, ACK] Seq=1 Ack=1 Win=64256 Len=27 TSval=538439947 TSecr=1753409621 [TCP segment of a reassembled PDU]"
"21","6.874835","192.168.11.27","192.168.11.42","TCP","66","","0.000130000","Jan  8, 2024 13:40:19.129920000 JST","","54734  >  6000 [FIN, ACK] Seq=28 Ack=1 Win=64256 Len=0 TSval=538439947 TSecr=1753409621"
"22","6.882776","192.168.11.42","192.168.11.27","TCP","66","0.008071000","0.007941000","Jan  8, 2024 13:40:19.137861000 JST","","6000  >  54734 [ACK] Seq=1 Ack=28 Win=65152 Len=0 TSval=1753409628 TSecr=538439947"
"23","6.883194","192.168.11.42","192.168.11.27","TCP","66","","0.000418000","Jan  8, 2024 13:40:19.138279000 JST","","6000  >  54718 [FIN, ACK] Seq=1 Ack=29 Win=65152 Len=0 TSval=1753409629 TSecr=538433080"
"24","6.883270","192.168.11.27","192.168.11.42","TCP","66","0.000076000","0.000076000","Jan  8, 2024 13:40:19.138355000 JST","","54718  >  6000 [ACK] Seq=29 Ack=2 Win=64256 Len=0 TSval=538439956 TSecr=1753409629"
"25","6.910664","192.168.11.27","255.255.255.255","UDP","209","","0.027394000","Jan  8, 2024 13:40:19.165749000 JST","7b2273656d616e74696373223a207b22656e74697479223a2022504944222c202262617365656e74697479223a2022616e79222c2022726f6c65223a2022626262222c20227370617469616c223a2022616e79222c202274656d706f72616c223a2022616e79227d2c20226461746170726f7065727479223a207b22666f726d6174223a2022696e616f6b615f70726f6772616d5f73616d706c655f73656d616e746963227d7d","33176  >  7000 Len=167"
"26","6.916314","192.168.11.13","192.168.11.27","TCP","74","","0.005650000","Jan  8, 2024 13:40:19.171399000 JST","","37284  >  6000 [SYN] Seq=0 Win=64240 Len=0 MSS=1460 SACK_PERM TSval=675301744 TSecr=0 WS=128"
"27","6.916427","192.168.11.27","192.168.11.13","TCP","74","0.000113000","0.000113000","Jan  8, 2024 13:40:19.171512000 JST","","6000  >  37284 [SYN, ACK] Seq=0 Ack=1 Win=65160 Len=0 MSS=1460 SACK_PERM TSval=510860471 TSecr=675301744 WS=128"
"28","6.923003","192.168.11.13","192.168.11.27","TCP","66","0.006576000","0.006576000","Jan  8, 2024 13:40:19.178088000 JST","","37284  >  6000 [ACK] Seq=1 Ack=1 Win=64256 Len=0 TSval=675301751 TSecr=510860471"
"29","6.923604","192.168.11.13","192.168.11.27","TCP","93","","0.000601000","Jan  8, 2024 13:40:19.178689000 JST","","37284  >  6000 [PSH, ACK] Seq=1 Ack=1 Win=64256 Len=27 TSval=675301751 TSecr=510860471 [TCP segment of a reassembled PDU]"
"30","6.923701","192.168.11.27","192.168.11.13","TCP","66","0.000097000","0.000097000","Jan  8, 2024 13:40:19.178786000 JST","","6000  >  37284 [ACK] Seq=1 Ack=28 Win=65152 Len=0 TSval=510860478 TSecr=675301751"
"31","6.923774","192.168.11.13","192.168.11.27","TCP","66","","0.000073000","Jan  8, 2024 13:40:19.178859000 JST","","37284  >  6000 [FIN, ACK] Seq=28 Ack=1 Win=64256 Len=0 TSval=675301751 TSecr=510860471"
"32","6.925624","192.168.11.27","192.168.11.13","TCP","66","0.001850000","0.001850000","Jan  8, 2024 13:40:19.180709000 JST","","6000  >  37284 [FIN, ACK] Seq=1 Ack=29 Win=65152 Len=0 TSval=510860480 TSecr=675301751"
"33","6.925862","192.168.11.42","192.168.11.27","TCP","66","0.051027000","0.000238000","Jan  8, 2024 13:40:19.180947000 JST","","6000  >  54734 [ACK] Seq=1 Ack=29 Win=65152 Len=0 TSval=1753409673 TSecr=538439947"
"34","6.933003","192.168.11.13","192.168.11.27","TCP","66","0.007379000","0.007141000","Jan  8, 2024 13:40:19.188088000 JST","","37284  >  6000 [ACK] Seq=29 Ack=2 Win=64256 Len=0 TSval=675301761 TSecr=510860480"
"35","13.724336","192.168.11.27","192.168.11.42","TCP","74","","6.791333000","Jan  8, 2024 13:40:25.979421000 JST","","34346  >  6000 [SYN] Seq=0 Win=64240 Len=0 MSS=1460 SACK_PERM TSval=538446797 TSecr=0 WS=128"
"36","13.731991","192.168.11.42","192.168.11.27","TCP","74","0.007655000","0.007655000","Jan  8, 2024 13:40:25.987076000 JST","","6000  >  34346 [SYN, ACK] Seq=0 Ack=1 Win=65160 Len=0 MSS=1460 SACK_PERM TSval=1753416479 TSecr=538446797 WS=128"
"37","13.732112","192.168.11.27","192.168.11.42","TCP","66","0.000121000","0.000121000","Jan  8, 2024 13:40:25.987197000 JST","","34346  >  6000 [ACK] Seq=1 Ack=1 Win=64256 Len=0 TSval=538446805 TSecr=1753416479"
"38","13.732301","192.168.11.27","192.168.11.42","TCP","93","","0.000189000","Jan  8, 2024 13:40:25.987386000 JST","","34346  >  6000 [PSH, ACK] Seq=1 Ack=1 Win=64256 Len=27 TSval=538446805 TSecr=1753416479 [TCP segment of a reassembled PDU]"
"39","13.732396","192.168.11.27","192.168.11.42","TCP","66","","0.000095000","Jan  8, 2024 13:40:25.987481000 JST","","34346  >  6000 [FIN, ACK] Seq=28 Ack=1 Win=64256 Len=0 TSval=538446805 TSecr=1753416479"
"40","13.739273","192.168.11.42","192.168.11.27","TCP","66","0.006972000","0.006877000","Jan  8, 2024 13:40:25.994358000 JST","","6000  >  34346 [ACK] Seq=1 Ack=28 Win=65152 Len=0 TSval=1753416486 TSecr=538446805"
"41","13.739644","192.168.11.42","192.168.11.27","TCP","66","","0.000371000","Jan  8, 2024 13:40:25.994729000 JST","","6000  >  54734 [FIN, ACK] Seq=1 Ack=29 Win=65152 Len=0 TSval=1753416487 TSecr=538439947"
"42","13.739718","192.168.11.27","192.168.11.42","TCP","66","0.000074000","0.000074000","Jan  8, 2024 13:40:25.994803000 JST","","54734  >  6000 [ACK] Seq=29 Ack=2 Win=64256 Len=0 TSval=538446812 TSecr=1753416487"
"43","13.767707","192.168.11.27","255.255.255.255","UDP","209","","0.027989000","Jan  8, 2024 13:40:26.022792000 JST","7b2273656d616e74696373223a207b22656e74697479223a2022504944222c202262617365656e74697479223a2022616e79222c2022726f6c65223a2022626262222c20227370617469616c223a2022616e79222c202274656d706f72616c223a2022616e79227d2c20226461746170726f7065727479223a207b22666f726d6174223a2022696e616f6b615f70726f6772616d5f73616d706c655f73656d616e746963227d7d","50594  >  7000 Len=167"
"44","13.773379","192.168.11.13","192.168.11.27","TCP","74","","0.005672000","Jan  8, 2024 13:40:26.028464000 JST","","37300  >  6000 [SYN] Seq=0 Win=64240 Len=0 MSS=1460 SACK_PERM TSval=675308601 TSecr=0 WS=128"
"45","13.773509","192.168.11.27","192.168.11.13","TCP","74","0.000130000","0.000130000","Jan  8, 2024 13:40:26.028594000 JST","","6000  >  37300 [SYN, ACK] Seq=0 Ack=1 Win=65160 Len=0 MSS=1460 SACK_PERM TSval=510867328 TSecr=675308601 WS=128"
"46","13.780162","192.168.11.13","192.168.11.27","TCP","66","0.006653000","0.006653000","Jan  8, 2024 13:40:26.035247000 JST","","37300  >  6000 [ACK] Seq=1 Ack=1 Win=64256 Len=0 TSval=675308608 TSecr=510867328"
"47","13.780837","192.168.11.13","192.168.11.27","TCP","93","","0.000675000","Jan  8, 2024 13:40:26.035922000 JST","","37300  >  6000 [PSH, ACK] Seq=1 Ack=1 Win=64256 Len=27 TSval=675308608 TSecr=510867328 [TCP segment of a reassembled PDU]"
"48","13.781002","192.168.11.27","192.168.11.13","TCP","66","0.000165000","0.000165000","Jan  8, 2024 13:40:26.036087000 JST","","6000  >  37300 [ACK] Seq=1 Ack=28 Win=65152 Len=0 TSval=510867335 TSecr=675308608"
"49","13.781090","192.168.11.13","192.168.11.27","TCP","66","","0.000088000","Jan  8, 2024 13:40:26.036175000 JST","","37300  >  6000 [FIN, ACK] Seq=28 Ack=1 Win=64256 Len=0 TSval=675308608 TSecr=510867328"
"50","13.781139","192.168.11.42","192.168.11.27","TCP","66","0.048743000","0.000049000","Jan  8, 2024 13:40:26.036224000 JST","","6000  >  34346 [ACK] Seq=1 Ack=29 Win=65152 Len=0 TSval=1753416529 TSecr=538446805"
"51","13.782706","192.168.11.27","192.168.11.13","TCP","66","0.001616000","0.001567000","Jan  8, 2024 13:40:26.037791000 JST","","6000  >  37300 [FIN, ACK] Seq=1 Ack=29 Win=65152 Len=0 TSval=510867337 TSecr=675308608"
"52","13.788366","192.168.11.13","192.168.11.27","TCP","66","0.005660000","0.005660000","Jan  8, 2024 13:40:26.043451000 JST","","37300  >  6000 [ACK] Seq=29 Ack=2 Win=64256 Len=0 TSval=675308616 TSecr=510867337"
"53","21.435375","192.168.11.27","192.168.11.42","TCP","74","","7.647009000","Jan  8, 2024 13:40:33.690460000 JST","","48514  >  6000 [SYN] Seq=0 Win=64240 Len=0 MSS=1460 SACK_PERM TSval=538454508 TSecr=0 WS=128"
"54","21.442945","192.168.11.42","192.168.11.27","TCP","74","0.007570000","0.007570000","Jan  8, 2024 13:40:33.698030000 JST","","6000  >  48514 [SYN, ACK] Seq=0 Ack=1 Win=65160 Len=0 MSS=1460 SACK_PERM TSval=1753424190 TSecr=538454508 WS=128"
"55","21.443085","192.168.11.27","192.168.11.42","TCP","66","0.000140000","0.000140000","Jan  8, 2024 13:40:33.698170000 JST","","48514  >  6000 [ACK] Seq=1 Ack=1 Win=64256 Len=0 TSval=538454515 TSecr=1753424190"
"56","21.443336","192.168.11.27","192.168.11.42","TCP","93","","0.000251000","Jan  8, 2024 13:40:33.698421000 JST","","48514  >  6000 [PSH, ACK] Seq=1 Ack=1 Win=64256 Len=27 TSval=538454516 TSecr=1753424190 [TCP segment of a reassembled PDU]"
"57","21.443432","192.168.11.27","192.168.11.42","TCP","66","","0.000096000","Jan  8, 2024 13:40:33.698517000 JST","","48514  >  6000 [FIN, ACK] Seq=28 Ack=1 Win=64256 Len=0 TSval=538454516 TSecr=1753424190"
"58","21.450329","192.168.11.42","192.168.11.27","TCP","66","0.006993000","0.006897000","Jan  8, 2024 13:40:33.705414000 JST","","6000  >  48514 [ACK] Seq=1 Ack=28 Win=65152 Len=0 TSval=1753424197 TSecr=538454516"
"59","21.450728","192.168.11.42","192.168.11.27","TCP","66","","0.000399000","Jan  8, 2024 13:40:33.705813000 JST","","6000  >  34346 [FIN, ACK] Seq=1 Ack=29 Win=65152 Len=0 TSval=1753424198 TSecr=538446805"
"60","21.450811","192.168.11.27","192.168.11.42","TCP","66","0.000083000","0.000083000","Jan  8, 2024 13:40:33.705896000 JST","","34346  >  6000 [ACK] Seq=29 Ack=2 Win=64256 Len=0 TSval=538454523 TSecr=1753424198"
"61","21.478794","192.168.11.27","255.255.255.255","UDP","209","","0.027983000","Jan  8, 2024 13:40:33.733879000 JST","7b2273656d616e74696373223a207b22656e74697479223a2022504944222c202262617365656e74697479223a2022616e79222c2022726f6c65223a2022626262222c20227370617469616c223a2022616e79222c202274656d706f72616c223a2022616e79227d2c20226461746170726f7065727479223a207b22666f726d6174223a2022696e616f6b615f70726f6772616d5f73616d706c655f73656d616e746963227d7d","59561  >  7000 Len=167"
"62","21.485141","192.168.11.13","192.168.11.27","TCP","74","","0.006347000","Jan  8, 2024 13:40:33.740226000 JST","","49018  >  6000 [SYN] Seq=0 Win=64240 Len=0 MSS=1460 SACK_PERM TSval=675316313 TSecr=0 WS=128"
"63","21.485286","192.168.11.27","192.168.11.13","TCP","74","0.000145000","0.000145000","Jan  8, 2024 13:40:33.740371000 JST","","6000  >  49018 [SYN, ACK] Seq=0 Ack=1 Win=65160 Len=0 MSS=1460 SACK_PERM TSval=510875040 TSecr=675316313 WS=128"
"64","21.502554","192.168.11.42","192.168.11.27","TCP","66","0.059122000","0.017268000","Jan  8, 2024 13:40:33.757639000 JST","","6000  >  48514 [ACK] Seq=1 Ack=29 Win=65152 Len=0 TSval=1753424241 TSecr=538454516"
"65","21.503209","192.168.11.13","192.168.11.27","TCP","66","0.017923000","0.000655000","Jan  8, 2024 13:40:33.758294000 JST","","49018  >  6000 [ACK] Seq=1 Ack=1 Win=64256 Len=0 TSval=675316324 TSecr=510875040"
"66","21.503413","192.168.11.13","192.168.11.27","TCP","93","","0.000204000","Jan  8, 2024 13:40:33.758498000 JST","","49018  >  6000 [PSH, ACK] Seq=1 Ack=1 Win=64256 Len=27 TSval=675316324 TSecr=510875040 [TCP segment of a reassembled PDU]"
"67","21.503506","192.168.11.27","192.168.11.13","TCP","66","0.000093000","0.000093000","Jan  8, 2024 13:40:33.758591000 JST","","6000  >  49018 [ACK] Seq=1 Ack=28 Win=65152 Len=0 TSval=510875058 TSecr=675316324"
"68","21.503603","192.168.11.13","192.168.11.27","TCP","66","","0.000097000","Jan  8, 2024 13:40:33.758688000 JST","","49018  >  6000 [FIN, ACK] Seq=28 Ack=1 Win=64256 Len=0 TSval=675316324 TSecr=510875040"
"69","21.505340","192.168.11.27","192.168.11.13","TCP","66","0.001737000","0.001737000","Jan  8, 2024 13:40:33.760425000 JST","","6000  >  49018 [FIN, ACK] Seq=1 Ack=29 Win=65152 Len=0 TSval=510875060 TSecr=675316324"
"70","21.510083","192.168.11.13","192.168.11.27","TCP","66","0.004743000","0.004743000","Jan  8, 2024 13:40:33.765168000 JST","","49018  >  6000 [ACK] Seq=29 Ack=2 Win=64256 Len=0 TSval=675316339 TSecr=510875060"
"71","29.170986","192.168.11.27","192.168.11.42","TCP","74","","7.660903000","Jan  8, 2024 13:40:41.426071000 JST","","48528  >  6000 [SYN] Seq=0 Win=64240 Len=0 MSS=1460 SACK_PERM TSval=538462243 TSecr=0 WS=128"
"72","29.180120","192.168.11.42","192.168.11.27","TCP","74","0.009134000","0.009134000","Jan  8, 2024 13:40:41.435205000 JST","","6000  >  48528 [SYN, ACK] Seq=0 Ack=1 Win=65160 Len=0 MSS=1460 SACK_PERM TSval=1753431926 TSecr=538462243 WS=128"
"73","29.180245","192.168.11.27","192.168.11.42","TCP","66","0.000125000","0.000125000","Jan  8, 2024 13:40:41.435330000 JST","","48528  >  6000 [ACK] Seq=1 Ack=1 Win=64256 Len=0 TSval=538462253 TSecr=1753431926"
"74","29.180411","192.168.11.27","192.168.11.42","TCP","93","","0.000166000","Jan  8, 2024 13:40:41.435496000 JST","","48528  >  6000 [PSH, ACK] Seq=1 Ack=1 Win=64256 Len=27 TSval=538462253 TSecr=1753431926 [TCP segment of a reassembled PDU]"
"75","29.180534","192.168.11.27","192.168.11.42","TCP","66","","0.000123000","Jan  8, 2024 13:40:41.435619000 JST","","48528  >  6000 [FIN, ACK] Seq=28 Ack=1 Win=64256 Len=0 TSval=538462253 TSecr=1753431926"
"76","29.187632","192.168.11.42","192.168.11.27","TCP","66","0.007221000","0.007098000","Jan  8, 2024 13:40:41.442717000 JST","","6000  >  48528 [ACK] Seq=1 Ack=28 Win=65152 Len=0 TSval=1753431934 TSecr=538462253"
"77","29.188002","192.168.11.42","192.168.11.27","TCP","66","","0.000370000","Jan  8, 2024 13:40:41.443087000 JST","","6000  >  48514 [FIN, ACK] Seq=1 Ack=29 Win=65152 Len=0 TSval=1753431935 TSecr=538454516"
"78","29.188085","192.168.11.27","192.168.11.42","TCP","66","0.000083000","0.000083000","Jan  8, 2024 13:40:41.443170000 JST","","48514  >  6000 [ACK] Seq=29 Ack=2 Win=64256 Len=0 TSval=538462260 TSecr=1753431935"
"79","29.216803","192.168.11.27","255.255.255.255","UDP","209","","0.028718000","Jan  8, 2024 13:40:41.471888000 JST","7b2273656d616e74696373223a207b22656e74697479223a2022504944222c202262617365656e74697479223a2022616e79222c2022726f6c65223a2022626262222c20227370617469616c223a2022616e79222c202274656d706f72616c223a2022616e79227d2c20226461746170726f7065727479223a207b22666f726d6174223a2022696e616f6b615f70726f6772616d5f73616d706c655f73656d616e746963227d7d","41426  >  7000 Len=167"
"80","29.222597","192.168.11.13","192.168.11.27","TCP","74","","0.005794000","Jan  8, 2024 13:40:41.477682000 JST","","45276  >  6000 [SYN] Seq=0 Win=64240 Len=0 MSS=1460 SACK_PERM TSval=675324051 TSecr=0 WS=128"
"81","29.222728","192.168.11.27","192.168.11.13","TCP","74","0.000131000","0.000131000","Jan  8, 2024 13:40:41.477813000 JST","","6000  >  45276 [SYN, ACK] Seq=0 Ack=1 Win=65160 Len=0 MSS=1460 SACK_PERM TSval=510882777 TSecr=675324051 WS=128"
"82","29.229836","192.168.11.42","192.168.11.27","TCP","66","0.049302000","0.007108000","Jan  8, 2024 13:40:41.484921000 JST","","6000  >  48528 [ACK] Seq=1 Ack=29 Win=65152 Len=0 TSval=1753431977 TSecr=538462253"
"83","29.230415","192.168.11.13","192.168.11.27","TCP","66","0.007687000","0.000579000","Jan  8, 2024 13:40:41.485500000 JST","","45276  >  6000 [ACK] Seq=1 Ack=1 Win=64256 Len=0 TSval=675324058 TSecr=510882777"
"84","29.230635","192.168.11.13","192.168.11.27","TCP","93","","0.000220000","Jan  8, 2024 13:40:41.485720000 JST","","45276  >  6000 [PSH, ACK] Seq=1 Ack=1 Win=64256 Len=27 TSval=675324059 TSecr=510882777 [TCP segment of a reassembled PDU]"
"85","29.230739","192.168.11.27","192.168.11.13","TCP","66","0.000104000","0.000104000","Jan  8, 2024 13:40:41.485824000 JST","","6000  >  45276 [ACK] Seq=1 Ack=28 Win=65152 Len=0 TSval=510882785 TSecr=675324059"
"86","29.230880","192.168.11.13","192.168.11.27","TCP","66","","0.000141000","Jan  8, 2024 13:40:41.485965000 JST","","45276  >  6000 [FIN, ACK] Seq=28 Ack=1 Win=64256 Len=0 TSval=675324059 TSecr=510882777"
"87","29.232899","192.168.11.27","192.168.11.13","TCP","66","0.002019000","0.002019000","Jan  8, 2024 13:40:41.487984000 JST","","6000  >  45276 [FIN, ACK] Seq=1 Ack=29 Win=65152 Len=0 TSval=510882787 TSecr=675324059"
"88","29.237235","192.168.11.13","192.168.11.27","TCP","66","0.004336000","0.004336000","Jan  8, 2024 13:40:41.492320000 JST","","45276  >  6000 [ACK] Seq=29 Ack=2 Win=64256 Len=0 TSval=675324066 TSecr=510882787"
"89","35.915688","192.168.11.27","192.168.11.42","TCP","74","","6.678453000","Jan  8, 2024 13:40:48.170773000 JST","","43798  >  6000 [SYN] Seq=0 Win=64240 Len=0 MSS=1460 SACK_PERM TSval=538468988 TSecr=0 WS=128"
"90","35.924377","192.168.11.42","192.168.11.27","TCP","74","0.008689000","0.008689000","Jan  8, 2024 13:40:48.179462000 JST","","6000  >  43798 [SYN, ACK] Seq=0 Ack=1 Win=65160 Len=0 MSS=1460 SACK_PERM TSval=1753438670 TSecr=538468988 WS=128"
"91","35.924498","192.168.11.27","192.168.11.42","TCP","66","0.000121000","0.000121000","Jan  8, 2024 13:40:48.179583000 JST","","43798  >  6000 [ACK] Seq=1 Ack=1 Win=64256 Len=0 TSval=538468997 TSecr=1753438670"
"92","35.924691","192.168.11.27","192.168.11.42","TCP","93","","0.000193000","Jan  8, 2024 13:40:48.179776000 JST","","43798  >  6000 [PSH, ACK] Seq=1 Ack=1 Win=64256 Len=27 TSval=538468997 TSecr=1753438670 [TCP segment of a reassembled PDU]"
"93","35.924789","192.168.11.27","192.168.11.42","TCP","66","","0.000098000","Jan  8, 2024 13:40:48.179874000 JST","","43798  >  6000 [FIN, ACK] Seq=28 Ack=1 Win=64256 Len=0 TSval=538468997 TSecr=1753438670"
"94","35.931595","192.168.11.42","192.168.11.27","TCP","66","0.006904000","0.006806000","Jan  8, 2024 13:40:48.186680000 JST","","6000  >  43798 [ACK] Seq=1 Ack=28 Win=65152 Len=0 TSval=1753438678 TSecr=538468997"
"95","35.931949","192.168.11.42","192.168.11.27","TCP","66","","0.000354000","Jan  8, 2024 13:40:48.187034000 JST","","6000  >  48528 [FIN, ACK] Seq=1 Ack=29 Win=65152 Len=0 TSval=1753438679 TSecr=538462253"
"96","35.932022","192.168.11.27","192.168.11.42","TCP","66","0.000073000","0.000073000","Jan  8, 2024 13:40:48.187107000 JST","","48528  >  6000 [ACK] Seq=29 Ack=2 Win=64256 Len=0 TSval=538469004 TSecr=1753438679"
"97","35.959747","192.168.11.27","255.255.255.255","UDP","209","","0.027725000","Jan  8, 2024 13:40:48.214832000 JST","7b2273656d616e74696373223a207b22656e74697479223a2022504944222c202262617365656e74697479223a2022616e79222c2022726f6c65223a2022626262222c20227370617469616c223a2022616e79222c202274656d706f72616c223a2022616e79227d2c20226461746170726f7065727479223a207b22666f726d6174223a2022696e616f6b615f70726f6772616d5f73616d706c655f73656d616e746963227d7d","37718  >  7000 Len=167"
"98","35.965377","192.168.11.13","192.168.11.27","TCP","74","","0.005630000","Jan  8, 2024 13:40:48.220462000 JST","","33128  >  6000 [SYN] Seq=0 Win=64240 Len=0 MSS=1460 SACK_PERM TSval=675330793 TSecr=0 WS=128"
"99","35.965504","192.168.11.27","192.168.11.13","TCP","74","0.000127000","0.000127000","Jan  8, 2024 13:40:48.220589000 JST","","6000  >  33128 [SYN, ACK] Seq=0 Ack=1 Win=65160 Len=0 MSS=1460 SACK_PERM TSval=510889520 TSecr=675330793 WS=128"
"100","35.972087","192.168.11.13","192.168.11.27","TCP","66","0.006583000","0.006583000","Jan  8, 2024 13:40:48.227172000 JST","","33128  >  6000 [ACK] Seq=1 Ack=1 Win=64256 Len=0 TSval=675330800 TSecr=510889520"
"101","35.972802","192.168.11.13","192.168.11.27","TCP","93","","0.000715000","Jan  8, 2024 13:40:48.227887000 JST","","33128  >  6000 [PSH, ACK] Seq=1 Ack=1 Win=64256 Len=27 TSval=675330800 TSecr=510889520 [TCP segment of a reassembled PDU]"
"102","35.972968","192.168.11.27","192.168.11.13","TCP","66","0.000166000","0.000166000","Jan  8, 2024 13:40:48.228053000 JST","","6000  >  33128 [ACK] Seq=1 Ack=28 Win=65152 Len=0 TSval=510889527 TSecr=675330800"
"103","35.973059","192.168.11.13","192.168.11.27","TCP","66","","0.000091000","Jan  8, 2024 13:40:48.228144000 JST","","33128  >  6000 [FIN, ACK] Seq=28 Ack=1 Win=64256 Len=0 TSval=675330800 TSecr=510889520"
"104","35.973103","192.168.11.42","192.168.11.27","TCP","66","0.048314000","0.000044000","Jan  8, 2024 13:40:48.228188000 JST","","6000  >  43798 [ACK] Seq=1 Ack=29 Win=65152 Len=0 TSval=1753438721 TSecr=538468997"
"105","35.974808","192.168.11.27","192.168.11.13","TCP","66","0.001749000","0.001705000","Jan  8, 2024 13:40:48.229893000 JST","","6000  >  33128 [FIN, ACK] Seq=1 Ack=29 Win=65152 Len=0 TSval=510889529 TSecr=675330800"
"106","35.983870","192.168.11.13","192.168.11.27","TCP","66","0.009062000","0.009062000","Jan  8, 2024 13:40:48.238955000 JST","","33128  >  6000 [ACK] Seq=29 Ack=2 Win=64256 Len=0 TSval=675330808 TSecr=510889529"
"107","42.665743","192.168.11.27","192.168.11.42","TCP","74","","6.681873000","Jan  8, 2024 13:40:54.920828000 JST","","55014  >  6000 [SYN] Seq=0 Win=64240 Len=0 MSS=1460 SACK_PERM TSval=538475738 TSecr=0 WS=128"
"108","42.673414","192.168.11.42","192.168.11.27","TCP","74","0.007671000","0.007671000","Jan  8, 2024 13:40:54.928499000 JST","","6000  >  55014 [SYN, ACK] Seq=0 Ack=1 Win=65160 Len=0 MSS=1460 SACK_PERM TSval=1753445419 TSecr=538475738 WS=128"
"109","42.673526","192.168.11.27","192.168.11.42","TCP","66","0.000112000","0.000112000","Jan  8, 2024 13:40:54.928611000 JST","","55014  >  6000 [ACK] Seq=1 Ack=1 Win=64256 Len=0 TSval=538475746 TSecr=1753445419"
"110","42.673719","192.168.11.27","192.168.11.42","TCP","93","","0.000193000","Jan  8, 2024 13:40:54.928804000 JST","","55014  >  6000 [PSH, ACK] Seq=1 Ack=1 Win=64256 Len=27 TSval=538475746 TSecr=1753445419 [TCP segment of a reassembled PDU]"
"111","42.673814","192.168.11.27","192.168.11.42","TCP","66","","0.000095000","Jan  8, 2024 13:40:54.928899000 JST","","55014  >  6000 [FIN, ACK] Seq=28 Ack=1 Win=64256 Len=0 TSval=538475746 TSecr=1753445419"
"112","42.680883","192.168.11.42","192.168.11.27","TCP","66","0.007164000","0.007069000","Jan  8, 2024 13:40:54.935968000 JST","","6000  >  55014 [ACK] Seq=1 Ack=28 Win=65152 Len=0 TSval=1753445428 TSecr=538475746"
"113","42.681264","192.168.11.42","192.168.11.27","TCP","66","","0.000381000","Jan  8, 2024 13:40:54.936349000 JST","","6000  >  43798 [FIN, ACK] Seq=1 Ack=29 Win=65152 Len=0 TSval=1753445428 TSecr=538468997"
"114","42.681339","192.168.11.27","192.168.11.42","TCP","66","0.000075000","0.000075000","Jan  8, 2024 13:40:54.936424000 JST","","43798  >  6000 [ACK] Seq=29 Ack=2 Win=64256 Len=0 TSval=538475754 TSecr=1753445428"
"115","42.709887","192.168.11.27","255.255.255.255","UDP","209","","0.028548000","Jan  8, 2024 13:40:54.964972000 JST","7b2273656d616e74696373223a207b22656e74697479223a2022504944222c202262617365656e74697479223a2022616e79222c2022726f6c65223a2022626262222c20227370617469616c223a2022616e79222c202274656d706f72616c223a2022616e79227d2c20226461746170726f7065727479223a207b22666f726d6174223a2022696e616f6b615f70726f6772616d5f73616d706c655f73656d616e746963227d7d","54550  >  7000 Len=167"
"116","42.716825","192.168.11.13","192.168.11.27","TCP","74","","0.006938000","Jan  8, 2024 13:40:54.971910000 JST","","33134  >  6000 [SYN] Seq=0 Win=64240 Len=0 MSS=1460 SACK_PERM TSval=675337544 TSecr=0 WS=128"
"117","42.716971","192.168.11.27","192.168.11.13","TCP","74","0.000146000","0.000146000","Jan  8, 2024 13:40:54.972056000 JST","","6000  >  33134 [SYN, ACK] Seq=0 Ack=1 Win=65160 Len=0 MSS=1460 SACK_PERM TSval=510896271 TSecr=675337544 WS=128"
"118","42.722069","192.168.11.42","192.168.11.27","TCP","66","0.048255000","0.005098000","Jan  8, 2024 13:40:54.977154000 JST","","6000  >  55014 [ACK] Seq=1 Ack=29 Win=65152 Len=0 TSval=1753445469 TSecr=538475746"
"119","42.723570","192.168.11.13","192.168.11.27","TCP","66","0.006599000","0.001501000","Jan  8, 2024 13:40:54.978655000 JST","","33134  >  6000 [ACK] Seq=1 Ack=1 Win=64256 Len=0 TSval=675337552 TSecr=510896271"
"120","42.724155","192.168.11.13","192.168.11.27","TCP","93","","0.000585000","Jan  8, 2024 13:40:54.979240000 JST","","33134  >  6000 [PSH, ACK] Seq=1 Ack=1 Win=64256 Len=27 TSval=675337552 TSecr=510896271 [TCP segment of a reassembled PDU]"
"121","42.724255","192.168.11.27","192.168.11.13","TCP","66","0.000100000","0.000100000","Jan  8, 2024 13:40:54.979340000 JST","","6000  >  33134 [ACK] Seq=1 Ack=28 Win=65152 Len=0 TSval=510896279 TSecr=675337552"
"122","42.724327","192.168.11.13","192.168.11.27","TCP","66","","0.000072000","Jan  8, 2024 13:40:54.979412000 JST","","33134  >  6000 [FIN, ACK] Seq=28 Ack=1 Win=64256 Len=0 TSval=675337552 TSecr=510896271"
"123","42.725959","192.168.11.27","192.168.11.13","TCP","66","0.001632000","0.001632000","Jan  8, 2024 13:40:54.981044000 JST","","6000  >  33134 [FIN, ACK] Seq=1 Ack=29 Win=65152 Len=0 TSval=510896280 TSecr=675337552"
"124","42.737121","192.168.11.13","192.168.11.27","TCP","66","0.011162000","0.011162000","Jan  8, 2024 13:40:54.992206000 JST","","33134  >  6000 [ACK] Seq=29 Ack=2 Win=64256 Len=0 TSval=675337559 TSecr=510896280"
"125","49.416765","192.168.11.27","192.168.11.42","TCP","74","","6.679644000","Jan  8, 2024 13:41:01.671850000 JST","","55028  >  6000 [SYN] Seq=0 Win=64240 Len=0 MSS=1460 SACK_PERM TSval=538482489 TSecr=0 WS=128"
"126","49.424367","192.168.11.42","192.168.11.27","TCP","74","0.007602000","0.007602000","Jan  8, 2024 13:41:01.679452000 JST","","6000  >  55028 [SYN, ACK] Seq=0 Ack=1 Win=65160 Len=0 MSS=1460 SACK_PERM TSval=1753452171 TSecr=538482489 WS=128"
"127","49.424473","192.168.11.27","192.168.11.42","TCP","66","0.000106000","0.000106000","Jan  8, 2024 13:41:01.679558000 JST","","55028  >  6000 [ACK] Seq=1 Ack=1 Win=64256 Len=0 TSval=538482497 TSecr=1753452171"
"128","49.424663","192.168.11.27","192.168.11.42","TCP","93","","0.000190000","Jan  8, 2024 13:41:01.679748000 JST","","55028  >  6000 [PSH, ACK] Seq=1 Ack=1 Win=64256 Len=27 TSval=538482497 TSecr=1753452171 [TCP segment of a reassembled PDU]"
"129","49.424756","192.168.11.27","192.168.11.42","TCP","66","","0.000093000","Jan  8, 2024 13:41:01.679841000 JST","","55028  >  6000 [FIN, ACK] Seq=28 Ack=1 Win=64256 Len=0 TSval=538482497 TSecr=1753452171"
"130","49.431585","192.168.11.42","192.168.11.27","TCP","66","0.006922000","0.006829000","Jan  8, 2024 13:41:01.686670000 JST","","6000  >  55028 [ACK] Seq=1 Ack=28 Win=65152 Len=0 TSval=1753452178 TSecr=538482497"
"131","49.431987","192.168.11.42","192.168.11.27","TCP","66","","0.000402000","Jan  8, 2024 13:41:01.687072000 JST","","6000  >  55014 [FIN, ACK] Seq=1 Ack=29 Win=65152 Len=0 TSval=1753452179 TSecr=538475746"
"132","49.432051","192.168.11.27","192.168.11.42","TCP","66","0.000064000","0.000064000","Jan  8, 2024 13:41:01.687136000 JST","","55014  >  6000 [ACK] Seq=29 Ack=2 Win=64256 Len=0 TSval=538482504 TSecr=1753452179"
"133","49.460868","192.168.11.27","255.255.255.255","UDP","209","","0.028817000","Jan  8, 2024 13:41:01.715953000 JST","7b2273656d616e74696373223a207b22656e74697479223a2022504944222c202262617365656e74697479223a2022616e79222c2022726f6c65223a2022626262222c20227370617469616c223a2022616e79222c202274656d706f72616c223a2022616e79227d2c20226461746170726f7065727479223a207b22666f726d6174223a2022696e616f6b615f70726f6772616d5f73616d706c655f73656d616e746963227d7d","59686  >  7000 Len=167"
"134","49.466746","192.168.11.13","192.168.11.27","TCP","74","","0.005878000","Jan  8, 2024 13:41:01.721831000 JST","","37686  >  6000 [SYN] Seq=0 Win=64240 Len=0 MSS=1460 SACK_PERM TSval=675344295 TSecr=0 WS=128"
"135","49.466866","192.168.11.27","192.168.11.13","TCP","74","0.000120000","0.000120000","Jan  8, 2024 13:41:01.721951000 JST","","6000  >  37686 [SYN, ACK] Seq=0 Ack=1 Win=65160 Len=0 MSS=1460 SACK_PERM TSval=510903021 TSecr=675344295 WS=128"
"136","49.473580","192.168.11.13","192.168.11.27","TCP","66","0.006714000","0.006714000","Jan  8, 2024 13:41:01.728665000 JST","","37686  >  6000 [ACK] Seq=1 Ack=1 Win=64256 Len=0 TSval=675344302 TSecr=510903021"
"137","49.474158","192.168.11.13","192.168.11.27","TCP","93","","0.000578000","Jan  8, 2024 13:41:01.729243000 JST","","37686  >  6000 [PSH, ACK] Seq=1 Ack=1 Win=64256 Len=27 TSval=675344302 TSecr=510903021 [TCP segment of a reassembled PDU]"
"138","49.474239","192.168.11.27","192.168.11.13","TCP","66","0.000081000","0.000081000","Jan  8, 2024 13:41:01.729324000 JST","","6000  >  37686 [ACK] Seq=1 Ack=28 Win=65152 Len=0 TSval=510903029 TSecr=675344302"
"139","49.474339","192.168.11.13","192.168.11.27","TCP","66","","0.000100000","Jan  8, 2024 13:41:01.729424000 JST","","37686  >  6000 [FIN, ACK] Seq=28 Ack=1 Win=64256 Len=0 TSval=675344302 TSecr=510903021"
"140","49.474386","192.168.11.42","192.168.11.27","TCP","66","0.049630000","0.000047000","Jan  8, 2024 13:41:01.729471000 JST","","6000  >  55028 [ACK] Seq=1 Ack=29 Win=65152 Len=0 TSval=1753452221 TSecr=538482497"
"141","49.475735","192.168.11.27","192.168.11.13","TCP","66","0.001396000","0.001349000","Jan  8, 2024 13:41:01.730820000 JST","","6000  >  37686 [FIN, ACK] Seq=1 Ack=29 Win=65152 Len=0 TSval=510903030 TSecr=675344302"
"142","49.481544","192.168.11.13","192.168.11.27","TCP","66","0.005809000","0.005809000","Jan  8, 2024 13:41:01.736629000 JST","","37686  >  6000 [ACK] Seq=29 Ack=2 Win=64256 Len=0 TSval=675344309 TSecr=510903030"
"143","56.131481","192.168.11.27","192.168.11.42","TCP","74","","6.649937000","Jan  8, 2024 13:41:08.386566000 JST","","43208  >  6000 [SYN] Seq=0 Win=64240 Len=0 MSS=1460 SACK_PERM TSval=538489204 TSecr=0 WS=128"
"144","56.139218","192.168.11.42","192.168.11.27","TCP","74","0.007737000","0.007737000","Jan  8, 2024 13:41:08.394303000 JST","","6000  >  43208 [SYN, ACK] Seq=0 Ack=1 Win=65160 Len=0 MSS=1460 SACK_PERM TSval=1753458886 TSecr=538489204 WS=128"
"145","56.139326","192.168.11.27","192.168.11.42","TCP","66","0.000108000","0.000108000","Jan  8, 2024 13:41:08.394411000 JST","","43208  >  6000 [ACK] Seq=1 Ack=1 Win=64256 Len=0 TSval=538489212 TSecr=1753458886"
"146","56.139476","192.168.11.27","192.168.11.42","TCP","93","","0.000150000","Jan  8, 2024 13:41:08.394561000 JST","","43208  >  6000 [PSH, ACK] Seq=1 Ack=1 Win=64256 Len=27 TSval=538489212 TSecr=1753458886 [TCP segment of a reassembled PDU]"
"147","56.139576","192.168.11.27","192.168.11.42","TCP","66","","0.000100000","Jan  8, 2024 13:41:08.394661000 JST","","43208  >  6000 [FIN, ACK] Seq=28 Ack=1 Win=64256 Len=0 TSval=538489212 TSecr=1753458886"
"148","56.146630","192.168.11.42","192.168.11.27","TCP","66","0.007154000","0.007054000","Jan  8, 2024 13:41:08.401715000 JST","","6000  >  43208 [ACK] Seq=1 Ack=28 Win=65152 Len=0 TSval=1753458893 TSecr=538489212"
"149","56.146992","192.168.11.42","192.168.11.27","TCP","66","","0.000362000","Jan  8, 2024 13:41:08.402077000 JST","","6000  >  55028 [FIN, ACK] Seq=1 Ack=29 Win=65152 Len=0 TSval=1753458894 TSecr=538482497"
"150","56.147054","192.168.11.27","192.168.11.42","TCP","66","0.000062000","0.000062000","Jan  8, 2024 13:41:08.402139000 JST","","55028  >  6000 [ACK] Seq=29 Ack=2 Win=64256 Len=0 TSval=538489219 TSecr=1753458894"
"151","56.174735","192.168.11.27","255.255.255.255","UDP","209","","0.027681000","Jan  8, 2024 13:41:08.429820000 JST","7b2273656d616e74696373223a207b22656e74697479223a2022504944222c202262617365656e74697479223a2022616e79222c2022726f6c65223a2022626262222c20227370617469616c223a2022616e79222c202274656d706f72616c223a2022616e79227d2c20226461746170726f7065727479223a207b22666f726d6174223a2022696e616f6b615f70726f6772616d5f73616d706c655f73656d616e746963227d7d","59333  >  7000 Len=167"
"152","56.180955","192.168.11.13","192.168.11.27","TCP","74","","0.006220000","Jan  8, 2024 13:41:08.436040000 JST","","51438  >  6000 [SYN] Seq=0 Win=64240 Len=0 MSS=1460 SACK_PERM TSval=675351009 TSecr=0 WS=128"
"153","56.181074","192.168.11.27","192.168.11.13","TCP","74","0.000119000","0.000119000","Jan  8, 2024 13:41:08.436159000 JST","","6000  >  51438 [SYN, ACK] Seq=0 Ack=1 Win=65160 Len=0 MSS=1460 SACK_PERM TSval=510909735 TSecr=675351009 WS=128"
"154","56.187990","192.168.11.13","192.168.11.27","TCP","66","0.006916000","0.006916000","Jan  8, 2024 13:41:08.443075000 JST","","51438  >  6000 [ACK] Seq=1 Ack=1 Win=64256 Len=0 TSval=675351016 TSecr=510909735"
"155","56.188469","192.168.11.13","192.168.11.27","TCP","93","","0.000479000","Jan  8, 2024 13:41:08.443554000 JST","","51438  >  6000 [PSH, ACK] Seq=1 Ack=1 Win=64256 Len=27 TSval=675351016 TSecr=510909735 [TCP segment of a reassembled PDU]"
"156","56.188539","192.168.11.27","192.168.11.13","TCP","66","0.000070000","0.000070000","Jan  8, 2024 13:41:08.443624000 JST","","6000  >  51438 [ACK] Seq=1 Ack=28 Win=65152 Len=0 TSval=510909743 TSecr=675351016"
"157","56.188613","192.168.11.13","192.168.11.27","TCP","66","","0.000074000","Jan  8, 2024 13:41:08.443698000 JST","","51438  >  6000 [FIN, ACK] Seq=28 Ack=1 Win=64256 Len=0 TSval=675351016 TSecr=510909735"
"158","56.190037","192.168.11.27","192.168.11.13","TCP","66","0.001424000","0.001424000","Jan  8, 2024 13:41:08.445122000 JST","","6000  >  51438 [FIN, ACK] Seq=1 Ack=29 Win=65152 Len=0 TSval=510909744 TSecr=675351016"
"159","56.192793","192.168.11.42","192.168.11.27","TCP","66","0.053217000","0.002756000","Jan  8, 2024 13:41:08.447878000 JST","","6000  >  43208 [ACK] Seq=1 Ack=29 Win=65152 Len=0 TSval=1753458941 TSecr=538489212"
"160","56.194771","192.168.11.13","192.168.11.27","TCP","66","0.004734000","0.001978000","Jan  8, 2024 13:41:08.449856000 JST","","51438  >  6000 [ACK] Seq=29 Ack=2 Win=64256 Len=0 TSval=675351024 TSecr=510909744"
"161","62.827879","192.168.11.27","192.168.11.42","TCP","74","","6.633108000","Jan  8, 2024 13:41:15.082964000 JST","","33372  >  6000 [SYN] Seq=0 Win=64240 Len=0 MSS=1460 SACK_PERM TSval=538495900 TSecr=0 WS=128"
"162","62.835770","192.168.11.42","192.168.11.27","TCP","74","0.007891000","0.007891000","Jan  8, 2024 13:41:15.090855000 JST","","6000  >  33372 [SYN, ACK] Seq=0 Ack=1 Win=65160 Len=0 MSS=1460 SACK_PERM TSval=1753465583 TSecr=538495900 WS=128"
"163","62.835874","192.168.11.27","192.168.11.42","TCP","66","0.000104000","0.000104000","Jan  8, 2024 13:41:15.090959000 JST","","33372  >  6000 [ACK] Seq=1 Ack=1 Win=64256 Len=0 TSval=538495908 TSecr=1753465583"
"164","62.836082","192.168.11.27","192.168.11.42","TCP","93","","0.000208000","Jan  8, 2024 13:41:15.091167000 JST","","33372  >  6000 [PSH, ACK] Seq=1 Ack=1 Win=64256 Len=27 TSval=538495908 TSecr=1753465583 [TCP segment of a reassembled PDU]"
"165","62.836185","192.168.11.27","192.168.11.42","TCP","66","","0.000103000","Jan  8, 2024 13:41:15.091270000 JST","","33372  >  6000 [FIN, ACK] Seq=28 Ack=1 Win=64256 Len=0 TSval=538495909 TSecr=1753465583"
"166","62.843009","192.168.11.42","192.168.11.27","TCP","66","0.006927000","0.006824000","Jan  8, 2024 13:41:15.098094000 JST","","6000  >  33372 [ACK] Seq=1 Ack=28 Win=65152 Len=0 TSval=1753465590 TSecr=538495908"
"167","62.843466","192.168.11.42","192.168.11.27","TCP","66","","0.000457000","Jan  8, 2024 13:41:15.098551000 JST","","6000  >  43208 [FIN, ACK] Seq=1 Ack=29 Win=65152 Len=0 TSval=1753465591 TSecr=538489212"
"168","62.843532","192.168.11.27","192.168.11.42","TCP","66","0.000066000","0.000066000","Jan  8, 2024 13:41:15.098617000 JST","","43208  >  6000 [ACK] Seq=29 Ack=2 Win=64256 Len=0 TSval=538495916 TSecr=1753465591"
"169","62.871420","192.168.11.27","255.255.255.255","UDP","209","","0.027888000","Jan  8, 2024 13:41:15.126505000 JST","7b2273656d616e74696373223a207b22656e74697479223a2022504944222c202262617365656e74697479223a2022616e79222c2022726f6c65223a2022626262222c20227370617469616c223a2022616e79222c202274656d706f72616c223a2022616e79227d2c20226461746170726f7065727479223a207b22666f726d6174223a2022696e616f6b615f70726f6772616d5f73616d706c655f73656d616e746963227d7d","43468  >  7000 Len=167"
