No.,Time,Source,Destination,Protocol,Length,Time delta from previous captured frame,XXX,Arrival Time,Data,Info
9,0.047922,192.168.11.13,255.255.255.255,UDP,209,0.032931,Ÿ,"Jan  5, 2024 21:25:07.217866000 JST",7b2273656d616e74696373223a207b22656e74697479223a2022504944222c202262617365656e74697479223a2022616e79222c2022726f6c65223a2022636363222c20227370617469616c223a2022616e79222c202274656d706f72616c223a2022616e79227d2c20226461746170726f7065727479223a207b22666f726d6174223a2022696e616f6b615f70726f6772616d5f73616d706c655f73656d616e746963227d7d,47419  >  7000 Len=167
10,0.056175,192.168.11.31,192.168.11.13,TCP,74,0.008253,œ,"Jan  5, 2024 21:25:07.226119000 JST",,42782  >  6000 [SYN] Seq=0 Win=64240 Len=0 MSS=1460 SACK_PERM TSval=1072367682 TSecr=0 WS=128
26,6.951862,192.168.11.13,255.255.255.255,UDP,209,0.03076,Ÿ,"Jan  5, 2024 21:25:14.121806000 JST",7b2273656d616e74696373223a207b22656e74697479223a2022504944222c202262617365656e74697479223a2022616e79222c2022726f6c65223a2022636363222c20227370617469616c223a2022616e79222c202274656d706f72616c223a2022616e79227d2c20226461746170726f7065727479223a207b22666f726d6174223a2022696e616f6b615f70726f6772616d5f73616d706c655f73656d616e746963227d7d,56663  >  7000 Len=167
27,6.959294,192.168.11.31,192.168.11.13,TCP,74,0.007432,œ,"Jan  5, 2024 21:25:14.129238000 JST",,48090  >  6000 [SYN] Seq=0 Win=64240 Len=0 MSS=1460 SACK_PERM TSval=1072374585 TSecr=0 WS=128
43,14.671845,192.168.11.13,255.255.255.255,UDP,209,0.03053,Ÿ,"Jan  5, 2024 21:25:21.841789000 JST",7b2273656d616e74696373223a207b22656e74697479223a2022504944222c202262617365656e74697479223a2022616e79222c2022726f6c65223a2022636363222c20227370617469616c223a2022616e79222c202274656d706f72616c223a2022616e79227d2c20226461746170726f7065727479223a207b22666f726d6174223a2022696e616f6b615f70726f6772616d5f73616d706c655f73656d616e746963227d7d,37742  >  7000 Len=167
44,14.680382,192.168.11.31,192.168.11.13,TCP,74,0.008537,œ,"Jan  5, 2024 21:25:21.850326000 JST",,48094  >  6000 [SYN] Seq=0 Win=64240 Len=0 MSS=1460 SACK_PERM TSval=1072382306 TSecr=0 WS=128
62,22.322211,192.168.11.13,255.255.255.255,UDP,209,0.029508,Ÿ,"Jan  5, 2024 21:25:29.492155000 JST",7b2273656d616e74696373223a207b22656e74697479223a2022504944222c202262617365656e74697479223a2022616e79222c2022726f6c65223a2022636363222c20227370617469616c223a2022616e79222c202274656d706f72616c223a2022616e79227d2c20226461746170726f7065727479223a207b22666f726d6174223a2022696e616f6b615f70726f6772616d5f73616d706c655f73656d616e746963227d7d,55242  >  7000 Len=167
63,22.330217,192.168.11.31,192.168.11.13,TCP,74,0.008006,œ,"Jan  5, 2024 21:25:29.500161000 JST",,39760  >  6000 [SYN] Seq=0 Win=64240 Len=0 MSS=1460 SACK_PERM TSval=1072389955 TSecr=0 WS=128
79,28.95245,192.168.11.13,255.255.255.255,UDP,209,0.032161,Ÿ,"Jan  5, 2024 21:25:36.122394000 JST",7b2273656d616e74696373223a207b22656e74697479223a2022504944222c202262617365656e74697479223a2022616e79222c2022726f6c65223a2022636363222c20227370617469616c223a2022616e79222c202274656d706f72616c223a2022616e79227d2c20226461746170726f7065727479223a207b22666f726d6174223a2022696e616f6b615f70726f6772616d5f73616d706c655f73656d616e746963227d7d,57641  >  7000 Len=167
80,28.963532,192.168.11.31,192.168.11.13,TCP,74,0.011082,œ,"Jan  5, 2024 21:25:36.133476000 JST",,41794  >  6000 [SYN] Seq=0 Win=64240 Len=0 MSS=1460 SACK_PERM TSval=1072396586 TSecr=0 WS=128
96,35.615104,192.168.11.13,255.255.255.255,UDP,209,0.028904,Ÿ,"Jan  5, 2024 21:25:42.785048000 JST",7b2273656d616e74696373223a207b22656e74697479223a2022504944222c202262617365656e74697479223a2022616e79222c2022726f6c65223a2022636363222c20227370617469616c223a2022616e79222c202274656d706f72616c223a2022616e79227d2c20226461746170726f7065727479223a207b22666f726d6174223a2022696e616f6b615f70726f6772616d5f73616d706c655f73656d616e746963227d7d,32841  >  7000 Len=167
97,35.624458,192.168.11.31,192.168.11.13,TCP,74,0.009354,œ,"Jan  5, 2024 21:25:42.794402000 JST",,51520  >  6000 [SYN] Seq=0 Win=64240 Len=0 MSS=1460 SACK_PERM TSval=1072403249 TSecr=0 WS=128
113,42.230082,192.168.11.13,255.255.255.255,UDP,209,0.028898,Ÿ,"Jan  5, 2024 21:25:49.400026000 JST",7b2273656d616e74696373223a207b22656e74697479223a2022504944222c202262617365656e74697479223a2022616e79222c2022726f6c65223a2022636363222c20227370617469616c223a2022616e79222c202274656d706f72616c223a2022616e79227d2c20226461746170726f7065727479223a207b22666f726d6174223a2022696e616f6b615f70726f6772616d5f73616d706c655f73656d616e746963227d7d,56978  >  7000 Len=167
114,42.238463,192.168.11.31,192.168.11.13,TCP,74,0.008381,œ,"Jan  5, 2024 21:25:49.408407000 JST",,51526  >  6000 [SYN] Seq=0 Win=64240 Len=0 MSS=1460 SACK_PERM TSval=1072409863 TSecr=0 WS=128
130,48.903727,192.168.11.13,255.255.255.255,UDP,209,0.030506,Ÿ,"Jan  5, 2024 21:25:56.073671000 JST",7b2273656d616e74696373223a207b22656e74697479223a2022504944222c202262617365656e74697479223a2022616e79222c2022726f6c65223a2022636363222c20227370617469616c223a2022616e79222c202274656d706f72616c223a2022616e79227d2c20226461746170726f7065727479223a207b22666f726d6174223a2022696e616f6b615f70726f6772616d5f73616d706c655f73656d616e746963227d7d,47750  >  7000 Len=167
131,48.911943,192.168.11.31,192.168.11.13,TCP,74,0.008216,œ,"Jan  5, 2024 21:25:56.081887000 JST",,43696  >  6000 [SYN] Seq=0 Win=64240 Len=0 MSS=1460 SACK_PERM TSval=1072416536 TSecr=0 WS=128
147,56.517103,192.168.11.13,255.255.255.255,UDP,209,0.029217,Ÿ,"Jan  5, 2024 21:26:03.687047000 JST",7b2273656d616e74696373223a207b22656e74697479223a2022504944222c202262617365656e74697479223a2022616e79222c2022726f6c65223a2022636363222c20227370617469616c223a2022616e79222c202274656d706f72616c223a2022616e79227d2c20226461746170726f7065727479223a207b22666f726d6174223a2022696e616f6b615f70726f6772616d5f73616d706c655f73656d616e746963227d7d,42527  >  7000 Len=167
148,56.525082,192.168.11.31,192.168.11.13,TCP,74,0.007979,œ,"Jan  5, 2024 21:26:03.695026000 JST",,49212  >  6000 [SYN] Seq=0 Win=64240 Len=0 MSS=1460 SACK_PERM TSval=1072424149 TSecr=0 WS=128
164,63.155369,192.168.11.13,255.255.255.255,UDP,209,0.029631,Ÿ,"Jan  5, 2024 21:26:10.325313000 JST",7b2273656d616e74696373223a207b22656e74697479223a2022504944222c202262617365656e74697479223a2022616e79222c2022726f6c65223a2022636363222c20227370617469616c223a2022616e79222c202274656d706f72616c223a2022616e79227d2c20226461746170726f7065727479223a207b22666f726d6174223a2022696e616f6b615f70726f6772616d5f73616d706c655f73656d616e746963227d7d,38040  >  7000 Len=167
165,63.165335,192.168.11.31,192.168.11.13,TCP,74,0.009966,œ,"Jan  5, 2024 21:26:10.335279000 JST",,49220  >  6000 [SYN] Seq=0 Win=64240 Len=0 MSS=1460 SACK_PERM TSval=1072430788 TSecr=0 WS=128
181,77.165169,192.168.11.13,255.255.255.255,UDP,209,0.028364,Ÿ,"Jan  5, 2024 21:26:24.335113000 JST",7b2273656d616e74696373223a207b22656e74697479223a2022504944222c202262617365656e74697479223a2022616e79222c2022726f6c65223a2022636363222c20227370617469616c223a2022616e79222c202274656d706f72616c223a2022616e79227d2c20226461746170726f7065727479223a207b22666f726d6174223a2022696e616f6b615f70726f6772616d5f73616d706c655f73656d616e746963227d7d,40821  >  7000 Len=167
182,77.173185,192.168.11.31,192.168.11.13,TCP,74,0.008016,œ,"Jan  5, 2024 21:26:24.343129000 JST",,41440  >  6000 [SYN] Seq=0 Win=64240 Len=0 MSS=1460 SACK_PERM TSval=1072444796 TSecr=0 WS=128
198,83.838238,192.168.11.13,255.255.255.255,UDP,209,0.028778,Ÿ,"Jan  5, 2024 21:26:31.008182000 JST",7b2273656d616e74696373223a207b22656e74697479223a2022504944222c202262617365656e74697479223a2022616e79222c2022726f6c65223a2022636363222c20227370617469616c223a2022616e79222c202274656d706f72616c223a2022616e79227d2c20226461746170726f7065727479223a207b22666f726d6174223a2022696e616f6b615f70726f6772616d5f73616d706c655f73656d616e746963227d7d,39395  >  7000 Len=167
199,83.84808,192.168.11.31,192.168.11.13,TCP,74,0.009842,œ,"Jan  5, 2024 21:26:31.018024000 JST",,41454  >  6000 [SYN] Seq=0 Win=64240 Len=0 MSS=1460 SACK_PERM TSval=1072451469 TSecr=0 WS=128
215,90.447892,192.168.11.13,255.255.255.255,UDP,209,0.031766,Ÿ,"Jan  5, 2024 21:26:37.617836000 JST",7b2273656d616e74696373223a207b22656e74697479223a2022504944222c202262617365656e74697479223a2022616e79222c2022726f6c65223a2022636363222c20227370617469616c223a2022616e79222c202274656d706f72616c223a2022616e79227d2c20226461746170726f7065727479223a207b22666f726d6174223a2022696e616f6b615f70726f6772616d5f73616d706c655f73656d616e746963227d7d,40723  >  7000 Len=167
216,90.456066,192.168.11.31,192.168.11.13,TCP,74,0.008174,œ,"Jan  5, 2024 21:26:37.626010000 JST",,44424  >  6000 [SYN] Seq=0 Win=64240 Len=0 MSS=1460 SACK_PERM TSval=1072458079 TSecr=0 WS=128
232,99.100676,192.168.11.13,255.255.255.255,UDP,209,0.029717,Ÿ,"Jan  5, 2024 21:26:46.270620000 JST",7b2273656d616e74696373223a207b22656e74697479223a2022504944222c202262617365656e74697479223a2022616e79222c2022726f6c65223a2022636363222c20227370617469616c223a2022616e79222c202274656d706f72616c223a2022616e79227d2c20226461746170726f7065727479223a207b22666f726d6174223a2022696e616f6b615f70726f6772616d5f73616d706c655f73656d616e746963227d7d,42762  >  7000 Len=167
233,99.12211,192.168.11.31,192.168.11.13,TCP,74,0.021434,œ,"Jan  5, 2024 21:26:46.292054000 JST",,57168  >  6000 [SYN] Seq=0 Win=64240 Len=0 MSS=1460 SACK_PERM TSval=1072466735 TSecr=0 WS=128
249,105.772957,192.168.11.13,255.255.255.255,UDP,209,0.029768,Ÿ,"Jan  5, 2024 21:26:52.942901000 JST",7b2273656d616e74696373223a207b22656e74697479223a2022504944222c202262617365656e74697479223a2022616e79222c2022726f6c65223a2022636363222c20227370617469616c223a2022616e79222c202274656d706f72616c223a2022616e79227d2c20226461746170726f7065727479223a207b22666f726d6174223a2022696e616f6b615f70726f6772616d5f73616d706c655f73656d616e746963227d7d,51611  >  7000 Len=167
250,105.780993,192.168.11.31,192.168.11.13,TCP,74,0.008036,œ,"Jan  5, 2024 21:26:52.950937000 JST",,45720  >  6000 [SYN] Seq=0 Win=64240 Len=0 MSS=1460 SACK_PERM TSval=1072473403 TSecr=0 WS=128
266,113.391059,192.168.11.13,255.255.255.255,UDP,209,0.028843,Ÿ,"Jan  5, 2024 21:27:00.561003000 JST",7b2273656d616e74696373223a207b22656e74697479223a2022504944222c202262617365656e74697479223a2022616e79222c2022726f6c65223a2022636363222c20227370617469616c223a2022616e79222c202274656d706f72616c223a2022616e79227d2c20226461746170726f7065727479223a207b22666f726d6174223a2022696e616f6b615f70726f6772616d5f73616d706c655f73656d616e746963227d7d,54935  >  7000 Len=167
267,113.398984,192.168.11.31,192.168.11.13,TCP,74,0.007925,œ,"Jan  5, 2024 21:27:00.568928000 JST",,45736  >  6000 [SYN] Seq=0 Win=64240 Len=0 MSS=1460 SACK_PERM TSval=1072481021 TSecr=0 WS=128
283,120.019925,192.168.11.13,255.255.255.255,UDP,209,0.029227,Ÿ,"Jan  5, 2024 21:27:07.189869000 JST",7b2273656d616e74696373223a207b22656e74697479223a2022504944222c202262617365656e74697479223a2022616e79222c2022726f6c65223a2022636363222c20227370617469616c223a2022616e79222c202274656d706f72616c223a2022616e79227d2c20226461746170726f7065727479223a207b22666f726d6174223a2022696e616f6b615f70726f6772616d5f73616d706c655f73656d616e746963227d7d,42541  >  7000 Len=167
284,120.027871,192.168.11.31,192.168.11.13,TCP,74,0.007946,œ,"Jan  5, 2024 21:27:07.197815000 JST",,38942  >  6000 [SYN] Seq=0 Win=64240 Len=0 MSS=1460 SACK_PERM TSval=1072487650 TSecr=0 WS=128
300,126.63589,192.168.11.13,255.255.255.255,UDP,209,0.029637,Ÿ,"Jan  5, 2024 21:27:13.805834000 JST",7b2273656d616e74696373223a207b22656e74697479223a2022504944222c202262617365656e74697479223a2022616e79222c2022726f6c65223a2022636363222c20227370617469616c223a2022616e79222c202274656d706f72616c223a2022616e79227d2c20226461746170726f7065727479223a207b22666f726d6174223a2022696e616f6b615f70726f6772616d5f73616d706c655f73656d616e746963227d7d,59454  >  7000 Len=167
301,126.643816,192.168.11.31,192.168.11.13,TCP,74,0.007926,œ,"Jan  5, 2024 21:27:13.813760000 JST",,43730  >  6000 [SYN] Seq=0 Win=64240 Len=0 MSS=1460 SACK_PERM TSval=1072494265 TSecr=0 WS=128
317,136.265633,192.168.11.13,255.255.255.255,UDP,209,0.031502,Ÿ,"Jan  5, 2024 21:27:23.435577000 JST",7b2273656d616e74696373223a207b22656e74697479223a2022504944222c202262617365656e74697479223a2022616e79222c2022726f6c65223a2022636363222c20227370617469616c223a2022616e79222c202274656d706f72616c223a2022616e79227d2c20226461746170726f7065727479223a207b22666f726d6174223a2022696e616f6b615f70726f6772616d5f73616d706c655f73656d616e746963227d7d,50922  >  7000 Len=167
318,136.273555,192.168.11.31,192.168.11.13,TCP,74,0.007922,œ,"Jan  5, 2024 21:27:23.443499000 JST",,50980  >  6000 [SYN] Seq=0 Win=64240 Len=0 MSS=1460 SACK_PERM TSval=1072503895 TSecr=0 WS=128
334,143.929001,192.168.11.13,255.255.255.255,UDP,209,0.030098,Ÿ,"Jan  5, 2024 21:27:31.098945000 JST",7b2273656d616e74696373223a207b22656e74697479223a2022504944222c202262617365656e74697479223a2022616e79222c2022726f6c65223a2022636363222c20227370617469616c223a2022616e79222c202274656d706f72616c223a2022616e79227d2c20226461746170726f7065727479223a207b22666f726d6174223a2022696e616f6b615f70726f6772616d5f73616d706c655f73656d616e746963227d7d,45506  >  7000 Len=167
335,143.937396,192.168.11.31,192.168.11.13,TCP,74,0.008395,œ,"Jan  5, 2024 21:27:31.107340000 JST",,50996  >  6000 [SYN] Seq=0 Win=64240 Len=0 MSS=1460 SACK_PERM TSval=1072511558 TSecr=0 WS=128
351,160.827204,192.168.11.13,255.255.255.255,UDP,209,0.028215,Ÿ,"Jan  5, 2024 21:27:47.997148000 JST",7b2273656d616e74696373223a207b22656e74697479223a2022504944222c202262617365656e74697479223a2022616e79222c2022726f6c65223a2022636363222c20227370617469616c223a2022616e79222c202274656d706f72616c223a2022616e79227d2c20226461746170726f7065727479223a207b22666f726d6174223a2022696e616f6b615f70726f6772616d5f73616d706c655f73656d616e746963227d7d,51458  >  7000 Len=167
352,160.835894,192.168.11.31,192.168.11.13,TCP,74,0.00869,œ,"Jan  5, 2024 21:27:48.005838000 JST",,59400  >  6000 [SYN] Seq=0 Win=64240 Len=0 MSS=1460 SACK_PERM TSval=1072528456 TSecr=0 WS=128
368,167.751752,192.168.11.13,255.255.255.255,UDP,209,0.029076,Ÿ,"Jan  5, 2024 21:27:54.921696000 JST",7b2273656d616e74696373223a207b22656e74697479223a2022504944222c202262617365656e74697479223a2022616e79222c2022726f6c65223a2022636363222c20227370617469616c223a2022616e79222c202274656d706f72616c223a2022616e79227d2c20226461746170726f7065727479223a207b22666f726d6174223a2022696e616f6b615f70726f6772616d5f73616d706c655f73656d616e746963227d7d,54920  >  7000 Len=167
369,167.759228,192.168.11.31,192.168.11.13,TCP,74,0.007476,œ,"Jan  5, 2024 21:27:54.929172000 JST",,48968  >  6000 [SYN] Seq=0 Win=64240 Len=0 MSS=1460 SACK_PERM TSval=1072535379 TSecr=0 WS=128
385,174.419079,192.168.11.13,255.255.255.255,UDP,209,0.029857,Ÿ,"Jan  5, 2024 21:28:01.589023000 JST",7b2273656d616e74696373223a207b22656e74697479223a2022504944222c202262617365656e74697479223a2022616e79222c2022726f6c65223a2022636363222c20227370617469616c223a2022616e79222c202274656d706f72616c223a2022616e79227d2c20226461746170726f7065727479223a207b22666f726d6174223a2022696e616f6b615f70726f6772616d5f73616d706c655f73656d616e746963227d7d,49989  >  7000 Len=167
386,174.428884,192.168.11.31,192.168.11.13,TCP,74,0.009805,œ,"Jan  5, 2024 21:28:01.598828000 JST",,48970  >  6000 [SYN] Seq=0 Win=64240 Len=0 MSS=1460 SACK_PERM TSval=1072542047 TSecr=0 WS=128
402,181.031884,192.168.11.13,255.255.255.255,UDP,209,0.030731,Ÿ,"Jan  5, 2024 21:28:08.201828000 JST",7b2273656d616e74696373223a207b22656e74697479223a2022504944222c202262617365656e74697479223a2022616e79222c2022726f6c65223a2022636363222c20227370617469616c223a2022616e79222c202274656d706f72616c223a2022616e79227d2c20226461746170726f7065727479223a207b22666f726d6174223a2022696e616f6b615f70726f6772616d5f73616d706c655f73656d616e746963227d7d,43741  >  7000 Len=167
403,181.040549,192.168.11.31,192.168.11.13,TCP,74,0.008665,œ,"Jan  5, 2024 21:28:08.210493000 JST",,53124  >  6000 [SYN] Seq=0 Win=64240 Len=0 MSS=1460 SACK_PERM TSval=1072548660 TSecr=0 WS=128
419,189.726605,192.168.11.13,255.255.255.255,UDP,209,0.029156,Ÿ,"Jan  5, 2024 21:28:16.896549000 JST",7b2273656d616e74696373223a207b22656e74697479223a2022504944222c202262617365656e74697479223a2022616e79222c2022726f6c65223a2022636363222c20227370617469616c223a2022616e79222c202274656d706f72616c223a2022616e79227d2c20226461746170726f7065727479223a207b22666f726d6174223a2022696e616f6b615f70726f6772616d5f73616d706c655f73656d616e746963227d7d,47950  >  7000 Len=167
420,189.737571,192.168.11.31,192.168.11.13,TCP,74,0.010966,œ,"Jan  5, 2024 21:28:16.907515000 JST",,33044  >  6000 [SYN] Seq=0 Win=64240 Len=0 MSS=1460 SACK_PERM TSval=1072557357 TSecr=0 WS=128
436,197.373095,192.168.11.13,255.255.255.255,UDP,209,0.028516,Ÿ,"Jan  5, 2024 21:28:24.543039000 JST",7b2273656d616e74696373223a207b22656e74697479223a2022504944222c202262617365656e74697479223a2022616e79222c2022726f6c65223a2022636363222c20227370617469616c223a2022616e79222c202274656d706f72616c223a2022616e79227d2c20226461746170726f7065727479223a207b22666f726d6174223a2022696e616f6b615f70726f6772616d5f73616d706c655f73656d616e746963227d7d,38823  >  7000 Len=167
437,197.381308,192.168.11.31,192.168.11.13,TCP,74,0.008213,œ,"Jan  5, 2024 21:28:24.551252000 JST",,37360  >  6000 [SYN] Seq=0 Win=64240 Len=0 MSS=1460 SACK_PERM TSval=1072565001 TSecr=0 WS=128
453,204.054177,192.168.11.13,255.255.255.255,UDP,209,0.03081,Ÿ,"Jan  5, 2024 21:28:31.224121000 JST",7b2273656d616e74696373223a207b22656e74697479223a2022504944222c202262617365656e74697479223a2022616e79222c2022726f6c65223a2022636363222c20227370617469616c223a2022616e79222c202274656d706f72616c223a2022616e79227d2c20226461746170726f7065727479223a207b22666f726d6174223a2022696e616f6b615f70726f6772616d5f73616d706c655f73656d616e746963227d7d,35496  >  7000 Len=167
454,204.061618,192.168.11.31,192.168.11.13,TCP,74,0.007441,œ,"Jan  5, 2024 21:28:31.231562000 JST",,37374  >  6000 [SYN] Seq=0 Win=64240 Len=0 MSS=1460 SACK_PERM TSval=1072571681 TSecr=0 WS=128
470,211.671324,192.168.11.13,255.255.255.255,UDP,209,0.032104,Ÿ,"Jan  5, 2024 21:28:38.841268000 JST",7b2273656d616e74696373223a207b22656e74697479223a2022504944222c202262617365656e74697479223a2022616e79222c2022726f6c65223a2022636363222c20227370617469616c223a2022616e79222c202274656d706f72616c223a2022616e79227d2c20226461746170726f7065727479223a207b22666f726d6174223a2022696e616f6b615f70726f6772616d5f73616d706c655f73656d616e746963227d7d,60230  >  7000 Len=167
471,212.672717,192.168.11.13,255.255.255.255,UDP,209,1.001393,œ,"Jan  5, 2024 21:28:39.842661000 JST",7b2273656d616e74696373223a207b22656e74697479223a2022504944222c202262617365656e74697479223a2022616e79222c2022726f6c65223a2022636363222c20227370617469616c223a2022616e79222c202274656d706f72616c223a2022616e79227d2c20226461746170726f7065727479223a207b22666f726d6174223a2022696e616f6b615f70726f6772616d5f73616d706c655f73656d616e746963227d7d,60230  >  7000 Len=167
472,212.680686,192.168.11.31,192.168.11.13,TCP,74,0.007969,œ,"Jan  5, 2024 21:28:39.850630000 JST",,41476  >  6000 [SYN] Seq=0 Win=64240 Len=0 MSS=1460 SACK_PERM TSval=1072580299 TSecr=0 WS=128
488,219.272612,192.168.11.13,255.255.255.255,UDP,209,0.031299,Ÿ,"Jan  5, 2024 21:28:46.442556000 JST",7b2273656d616e74696373223a207b22656e74697479223a2022504944222c202262617365656e74697479223a2022616e79222c2022726f6c65223a2022636363222c20227370617469616c223a2022616e79222c202274656d706f72616c223a2022616e79227d2c20226461746170726f7065727479223a207b22666f726d6174223a2022696e616f6b615f70726f6772616d5f73616d706c655f73656d616e746963227d7d,41735  >  7000 Len=167
489,219.28124,192.168.11.31,192.168.11.13,TCP,74,0.008628,œ,"Jan  5, 2024 21:28:46.451184000 JST",,39210  >  6000 [SYN] Seq=0 Win=64240 Len=0 MSS=1460 SACK_PERM TSval=1072586900 TSecr=0 WS=128
505,226.940992,192.168.11.13,255.255.255.255,UDP,209,0.028687,Ÿ,"Jan  5, 2024 21:28:54.110936000 JST",7b2273656d616e74696373223a207b22656e74697479223a2022504944222c202262617365656e74697479223a2022616e79222c2022726f6c65223a2022636363222c20227370617469616c223a2022616e79222c202274656d706f72616c223a2022616e79227d2c20226461746170726f7065727479223a207b22666f726d6174223a2022696e616f6b615f70726f6772616d5f73616d706c655f73656d616e746963227d7d,53789  >  7000 Len=167
506,226.950181,192.168.11.31,192.168.11.13,TCP,74,0.009189,œ,"Jan  5, 2024 21:28:54.120125000 JST",,33396  >  6000 [SYN] Seq=0 Win=64240 Len=0 MSS=1460 SACK_PERM TSval=1072594568 TSecr=0 WS=128
522,245.742705,192.168.11.13,255.255.255.255,UDP,209,0.02817,Ÿ,"Jan  5, 2024 21:29:12.912649000 JST",7b2273656d616e74696373223a207b22656e74697479223a2022504944222c202262617365656e74697479223a2022616e79222c2022726f6c65223a2022636363222c20227370617469616c223a2022616e79222c202274656d706f72616c223a2022616e79227d2c20226461746170726f7065727479223a207b22666f726d6174223a2022696e616f6b615f70726f6772616d5f73616d706c655f73656d616e746963227d7d,35404  >  7000 Len=167
523,245.75161,192.168.11.31,192.168.11.13,TCP,74,0.008905,œ,"Jan  5, 2024 21:29:12.921554000 JST",,43724  >  6000 [SYN] Seq=0 Win=64240 Len=0 MSS=1460 SACK_PERM TSval=1072613369 TSecr=0 WS=128
539,252.391377,192.168.11.13,255.255.255.255,UDP,209,0.029029,Ÿ,"Jan  5, 2024 21:29:19.561321000 JST",7b2273656d616e74696373223a207b22656e74697479223a2022504944222c202262617365656e74697479223a2022616e79222c2022726f6c65223a2022636363222c20227370617469616c223a2022616e79222c202274656d706f72616c223a2022616e79227d2c20226461746170726f7065727479223a207b22666f726d6174223a2022696e616f6b615f70726f6772616d5f73616d706c655f73656d616e746963227d7d,47483  >  7000 Len=167
540,252.401296,192.168.11.31,192.168.11.13,TCP,74,0.009919,œ,"Jan  5, 2024 21:29:19.571240000 JST",,43738  >  6000 [SYN] Seq=0 Win=64240 Len=0 MSS=1460 SACK_PERM TSval=1072620017 TSecr=0 WS=128
556,259.010735,192.168.11.13,255.255.255.255,UDP,209,0.030697,Ÿ,"Jan  5, 2024 21:29:26.180679000 JST",7b2273656d616e74696373223a207b22656e74697479223a2022504944222c202262617365656e74697479223a2022616e79222c2022726f6c65223a2022636363222c20227370617469616c223a2022616e79222c202274656d706f72616c223a2022616e79227d2c20226461746170726f7065727479223a207b22666f726d6174223a2022696e616f6b615f70726f6772616d5f73616d706c655f73656d616e746963227d7d,41113  >  7000 Len=167
557,259.01866,192.168.11.31,192.168.11.13,TCP,74,0.007925,œ,"Jan  5, 2024 21:29:26.188604000 JST",,38836  >  6000 [SYN] Seq=0 Win=64240 Len=0 MSS=1460 SACK_PERM TSval=1072626636 TSecr=0 WS=128
573,267.658408,192.168.11.13,255.255.255.255,UDP,209,0.028575,Ÿ,"Jan  5, 2024 21:29:34.828352000 JST",7b2273656d616e74696373223a207b22656e74697479223a2022504944222c202262617365656e74697479223a2022616e79222c2022726f6c65223a2022636363222c20227370617469616c223a2022616e79222c202274656d706f72616c223a2022616e79227d2c20226461746170726f7065727479223a207b22666f726d6174223a2022696e616f6b615f70726f6772616d5f73616d706c655f73656d616e746963227d7d,42193  >  7000 Len=167
574,267.667216,192.168.11.31,192.168.11.13,TCP,74,0.008808,œ,"Jan  5, 2024 21:29:34.837160000 JST",,60450  >  6000 [SYN] Seq=0 Win=64240 Len=0 MSS=1460 SACK_PERM TSval=1072635284 TSecr=0 WS=128
575,267.667361,192.168.11.13,192.168.11.31,TCP,74,0.000145,,"Jan  5, 2024 21:29:34.837305000 JST",,"6000  >  60450 [SYN, ACK] Seq=0 Ack=1 Win=65160 Len=0 MSS=1460 SACK_PERM TSval=844055321 TSecr=1072635284 WS=128"
576,267.674038,192.168.11.31,192.168.11.13,TCP,66,0.006677,,"Jan  5, 2024 21:29:34.843982000 JST",,60450  >  6000 [ACK] Seq=1 Ack=1 Win=64256 Len=0 TSval=1072635291 TSecr=844055321
577,267.674556,192.168.11.31,192.168.11.13,TCP,93,0.000518,,"Jan  5, 2024 21:29:34.844500000 JST",,"60450  >  6000 [PSH, ACK] Seq=1 Ack=1 Win=64256 Len=27 TSval=1072635291 TSecr=844055321 [TCP segment of a reassembled PDU]"
578,267.674664,192.168.11.13,192.168.11.31,TCP,66,0.000108,,"Jan  5, 2024 21:29:34.844608000 JST",,6000  >  60450 [ACK] Seq=1 Ack=28 Win=65152 Len=0 TSval=844055328 TSecr=1072635291
579,267.674725,192.168.11.31,192.168.11.13,TCP,66,0.000061,,"Jan  5, 2024 21:29:34.844669000 JST",,"60450  >  6000 [FIN, ACK] Seq=28 Ack=1 Win=64256 Len=0 TSval=1072635291 TSecr=844055321"
580,267.675846,192.168.11.13,192.168.11.31,TCP,66,0.001121,,"Jan  5, 2024 21:29:34.845790000 JST",,"6000  >  60450 [FIN, ACK] Seq=1 Ack=29 Win=65152 Len=0 TSval=844055329 TSecr=1072635291"
581,267.681378,192.168.11.31,192.168.11.13,TCP,66,0.005532,,"Jan  5, 2024 21:29:34.851322000 JST",,60450  >  6000 [ACK] Seq=29 Ack=2 Win=64256 Len=0 TSval=1072635298 TSecr=844055329
582,275.244727,192.168.11.13,192.168.11.6,TCP,74,7.563349,,"Jan  5, 2024 21:29:42.414671000 JST",,39690  >  6000 [SYN] Seq=0 Win=64240 Len=0 MSS=1460 SACK_PERM TSval=3908153643 TSecr=0 WS=128
583,275.251404,192.168.11.6,192.168.11.13,TCP,74,0.006677,,"Jan  5, 2024 21:29:42.421348000 JST",,"6000  >  39690 [SYN, ACK] Seq=0 Ack=1 Win=65160 Len=0 MSS=1460 SACK_PERM TSval=1058018707 TSecr=3908153643 WS=128"
584,275.251521,192.168.11.13,192.168.11.6,TCP,66,0.000117,,"Jan  5, 2024 21:29:42.421465000 JST",,39690  >  6000 [ACK] Seq=1 Ack=1 Win=64256 Len=0 TSval=3908153650 TSecr=1058018707
585,275.251697,192.168.11.13,192.168.11.6,TCP,93,0.000176,,"Jan  5, 2024 21:29:42.421641000 JST",,"39690  >  6000 [PSH, ACK] Seq=1 Ack=1 Win=64256 Len=27 TSval=3908153650 TSecr=1058018707 [TCP segment of a reassembled PDU]"
586,275.251828,192.168.11.13,192.168.11.6,TCP,66,0.000131,,"Jan  5, 2024 21:29:42.421772000 JST",,"39690  >  6000 [FIN, ACK] Seq=28 Ack=1 Win=64256 Len=0 TSval=3908153650 TSecr=1058018707"
587,275.258102,192.168.11.6,192.168.11.13,TCP,66,0.006274,,"Jan  5, 2024 21:29:42.428046000 JST",,6000  >  39690 [ACK] Seq=1 Ack=28 Win=65152 Len=0 TSval=1058018714 TSecr=3908153650
588,275.260128,192.168.11.6,192.168.11.13,TCP,66,0.002026,,"Jan  5, 2024 21:29:42.430072000 JST",,"6000  >  39690 [FIN, ACK] Seq=1 Ack=29 Win=65152 Len=0 TSval=1058018716 TSecr=3908153650"
589,275.26018,192.168.11.13,192.168.11.6,TCP,66,0.000052,,"Jan  5, 2024 21:29:42.430124000 JST",,39690  >  6000 [ACK] Seq=29 Ack=2 Win=64256 Len=0 TSval=3908153659 TSecr=1058018716
590,275.289051,192.168.11.13,255.255.255.255,UDP,209,0.028871,Ÿ,"Jan  5, 2024 21:29:42.458995000 JST",7b2273656d616e74696373223a207b22656e74697479223a2022504944222c202262617365656e74697479223a2022616e79222c2022726f6c65223a2022636363222c20227370617469616c223a2022616e79222c202274656d706f72616c223a2022616e79227d2c20226461746170726f7065727479223a207b22666f726d6174223a2022696e616f6b615f70726f6772616d5f73616d706c655f73656d616e746963227d7d,58280  >  7000 Len=167
591,275.29778,192.168.11.31,192.168.11.13,TCP,74,0.008729,œ,"Jan  5, 2024 21:29:42.467724000 JST",,60414  >  6000 [SYN] Seq=0 Win=64240 Len=0 MSS=1460 SACK_PERM TSval=1072642914 TSecr=0 WS=128
592,275.297928,192.168.11.13,192.168.11.31,TCP,74,0.000148,,"Jan  5, 2024 21:29:42.467872000 JST",,"6000  >  60414 [SYN, ACK] Seq=0 Ack=1 Win=65160 Len=0 MSS=1460 SACK_PERM TSval=844062951 TSecr=1072642914 WS=128"
593,275.304762,192.168.11.31,192.168.11.13,TCP,66,0.006834,,"Jan  5, 2024 21:29:42.474706000 JST",,60414  >  6000 [ACK] Seq=1 Ack=1 Win=64256 Len=0 TSval=1072642921 TSecr=844062951
594,275.305318,192.168.11.31,192.168.11.13,TCP,93,0.000556,,"Jan  5, 2024 21:29:42.475262000 JST",,"60414  >  6000 [PSH, ACK] Seq=1 Ack=1 Win=64256 Len=27 TSval=1072642921 TSecr=844062951 [TCP segment of a reassembled PDU]"
595,275.305412,192.168.11.13,192.168.11.31,TCP,66,0.000094,,"Jan  5, 2024 21:29:42.475356000 JST",,6000  >  60414 [ACK] Seq=1 Ack=28 Win=65152 Len=0 TSval=844062959 TSecr=1072642921
596,275.305483,192.168.11.31,192.168.11.13,TCP,66,0.000071,,"Jan  5, 2024 21:29:42.475427000 JST",,"60414  >  6000 [FIN, ACK] Seq=28 Ack=1 Win=64256 Len=0 TSval=1072642922 TSecr=844062951"
597,275.306898,192.168.11.13,192.168.11.31,TCP,66,0.001415,,"Jan  5, 2024 21:29:42.476842000 JST",,"6000  >  60414 [FIN, ACK] Seq=1 Ack=29 Win=65152 Len=0 TSval=844062960 TSecr=1072642922"
598,275.311696,192.168.11.31,192.168.11.13,TCP,66,0.004798,,"Jan  5, 2024 21:29:42.481640000 JST",,60414  >  6000 [ACK] Seq=29 Ack=2 Win=64256 Len=0 TSval=1072642929 TSecr=844062960
599,281.877812,192.168.11.13,192.168.11.6,TCP,74,6.566116,,"Jan  5, 2024 21:29:49.047756000 JST",,52062  >  6000 [SYN] Seq=0 Win=64240 Len=0 MSS=1460 SACK_PERM TSval=3908160276 TSecr=0 WS=128
600,281.884499,192.168.11.6,192.168.11.13,TCP,74,0.006687,,"Jan  5, 2024 21:29:49.054443000 JST",,"6000  >  52062 [SYN, ACK] Seq=0 Ack=1 Win=65160 Len=0 MSS=1460 SACK_PERM TSval=1058025340 TSecr=3908160276 WS=128"
601,281.884618,192.168.11.13,192.168.11.6,TCP,66,0.000119,,"Jan  5, 2024 21:29:49.054562000 JST",,52062  >  6000 [ACK] Seq=1 Ack=1 Win=64256 Len=0 TSval=3908160283 TSecr=1058025340
602,281.884792,192.168.11.13,192.168.11.6,TCP,93,0.000174,,"Jan  5, 2024 21:29:49.054736000 JST",,"52062  >  6000 [PSH, ACK] Seq=1 Ack=1 Win=64256 Len=27 TSval=3908160283 TSecr=1058025340 [TCP segment of a reassembled PDU]"
603,281.884916,192.168.11.13,192.168.11.6,TCP,66,0.000124,,"Jan  5, 2024 21:29:49.054860000 JST",,"52062  >  6000 [FIN, ACK] Seq=28 Ack=1 Win=64256 Len=0 TSval=3908160283 TSecr=1058025340"
604,281.901075,192.168.11.6,192.168.11.13,TCP,66,0.016159,,"Jan  5, 2024 21:29:49.071019000 JST",,6000  >  52062 [ACK] Seq=1 Ack=28 Win=65152 Len=0 TSval=1058025357 TSecr=3908160283
605,281.901481,192.168.11.6,192.168.11.13,TCP,66,0.000406,,"Jan  5, 2024 21:29:49.071425000 JST",,"6000  >  52062 [FIN, ACK] Seq=1 Ack=29 Win=65152 Len=0 TSval=1058025358 TSecr=3908160283"
606,281.901545,192.168.11.13,192.168.11.6,TCP,66,0.000064,,"Jan  5, 2024 21:29:49.071489000 JST",,52062  >  6000 [ACK] Seq=29 Ack=2 Win=64256 Len=0 TSval=3908160300 TSecr=1058025358
607,281.929776,192.168.11.13,255.255.255.255,UDP,209,0.028231,Ÿ,"Jan  5, 2024 21:29:49.099720000 JST",7b2273656d616e74696373223a207b22656e74697479223a2022504944222c202262617365656e74697479223a2022616e79222c2022726f6c65223a2022636363222c20227370617469616c223a2022616e79222c202274656d706f72616c223a2022616e79227d2c20226461746170726f7065727479223a207b22666f726d6174223a2022696e616f6b615f70726f6772616d5f73616d706c655f73656d616e746963227d7d,40065  >  7000 Len=167
608,281.937947,192.168.11.31,192.168.11.13,TCP,74,0.008171,œ,"Jan  5, 2024 21:29:49.107891000 JST",,60416  >  6000 [SYN] Seq=0 Win=64240 Len=0 MSS=1460 SACK_PERM TSval=1072649554 TSecr=0 WS=128
609,281.938121,192.168.11.13,192.168.11.31,TCP,74,0.000174,,"Jan  5, 2024 21:29:49.108065000 JST",,"6000  >  60416 [SYN, ACK] Seq=0 Ack=1 Win=65160 Len=0 MSS=1460 SACK_PERM TSval=844069592 TSecr=1072649554 WS=128"
610,281.944673,192.168.11.31,192.168.11.13,TCP,66,0.006552,,"Jan  5, 2024 21:29:49.114617000 JST",,60416  >  6000 [ACK] Seq=1 Ack=1 Win=64256 Len=0 TSval=1072649561 TSecr=844069592
611,281.94523,192.168.11.31,192.168.11.13,TCP,93,0.000557,,"Jan  5, 2024 21:29:49.115174000 JST",,"60416  >  6000 [PSH, ACK] Seq=1 Ack=1 Win=64256 Len=27 TSval=1072649561 TSecr=844069592 [TCP segment of a reassembled PDU]"
612,281.945351,192.168.11.13,192.168.11.31,TCP,66,0.000121,,"Jan  5, 2024 21:29:49.115295000 JST",,6000  >  60416 [ACK] Seq=1 Ack=28 Win=65152 Len=0 TSval=844069599 TSecr=1072649561
613,281.945427,192.168.11.31,192.168.11.13,TCP,66,0.000076,,"Jan  5, 2024 21:29:49.115371000 JST",,"60416  >  6000 [FIN, ACK] Seq=28 Ack=1 Win=64256 Len=0 TSval=1072649561 TSecr=844069592"
614,281.946665,192.168.11.13,192.168.11.31,TCP,66,0.001238,,"Jan  5, 2024 21:29:49.116609000 JST",,"6000  >  60416 [FIN, ACK] Seq=1 Ack=29 Win=65152 Len=0 TSval=844069600 TSecr=1072649561"
615,281.951928,192.168.11.31,192.168.11.13,TCP,66,0.005263,,"Jan  5, 2024 21:29:49.121872000 JST",,60416  >  6000 [ACK] Seq=29 Ack=2 Win=64256 Len=0 TSval=1072649569 TSecr=844069600
616,289.493206,192.168.11.13,192.168.11.6,TCP,74,7.541278,,"Jan  5, 2024 21:29:56.663150000 JST",,52064  >  6000 [SYN] Seq=0 Win=64240 Len=0 MSS=1460 SACK_PERM TSval=3908167892 TSecr=0 WS=128
617,289.499902,192.168.11.6,192.168.11.13,TCP,74,0.006696,,"Jan  5, 2024 21:29:56.669846000 JST",,"6000  >  52064 [SYN, ACK] Seq=0 Ack=1 Win=65160 Len=0 MSS=1460 SACK_PERM TSval=1058032955 TSecr=3908167892 WS=128"
618,289.500019,192.168.11.13,192.168.11.6,TCP,66,0.000117,,"Jan  5, 2024 21:29:56.669963000 JST",,52064  >  6000 [ACK] Seq=1 Ack=1 Win=64256 Len=0 TSval=3908167898 TSecr=1058032955
619,289.50022,192.168.11.13,192.168.11.6,TCP,93,0.000201,,"Jan  5, 2024 21:29:56.670164000 JST",,"52064  >  6000 [PSH, ACK] Seq=1 Ack=1 Win=64256 Len=27 TSval=3908167899 TSecr=1058032955 [TCP segment of a reassembled PDU]"
620,289.500333,192.168.11.13,192.168.11.6,TCP,66,0.000113,,"Jan  5, 2024 21:29:56.670277000 JST",,"52064  >  6000 [FIN, ACK] Seq=28 Ack=1 Win=64256 Len=0 TSval=3908167899 TSecr=1058032955"
621,289.507453,192.168.11.6,192.168.11.13,TCP,66,0.00712,,"Jan  5, 2024 21:29:56.677397000 JST",,6000  >  52064 [ACK] Seq=1 Ack=28 Win=65152 Len=0 TSval=1058032963 TSecr=3908167899
622,289.507683,192.168.11.6,192.168.11.13,TCP,66,0.00023,,"Jan  5, 2024 21:29:56.677627000 JST",,"6000  >  52064 [FIN, ACK] Seq=1 Ack=29 Win=65152 Len=0 TSval=1058032965 TSecr=3908167899"
623,289.507734,192.168.11.13,192.168.11.6,TCP,66,0.000051,,"Jan  5, 2024 21:29:56.677678000 JST",,52064  >  6000 [ACK] Seq=29 Ack=2 Win=64256 Len=0 TSval=3908167906 TSecr=1058032965
624,289.538234,192.168.11.13,255.255.255.255,UDP,209,0.0305,Ÿ,"Jan  5, 2024 21:29:56.708178000 JST",7b2273656d616e74696373223a207b22656e74697479223a2022504944222c202262617365656e74697479223a2022616e79222c2022726f6c65223a2022636363222c20227370617469616c223a2022616e79222c202274656d706f72616c223a2022616e79227d2c20226461746170726f7065727479223a207b22666f726d6174223a2022696e616f6b615f70726f6772616d5f73616d706c655f73656d616e746963227d7d,33693  >  7000 Len=167
625,289.5463,192.168.11.31,192.168.11.13,TCP,74,0.008066,œ,"Jan  5, 2024 21:29:56.716244000 JST",,54728  >  6000 [SYN] Seq=0 Win=64240 Len=0 MSS=1460 SACK_PERM TSval=1072657162 TSecr=0 WS=128
626,289.546451,192.168.11.13,192.168.11.31,TCP,74,0.000151,,"Jan  5, 2024 21:29:56.716395000 JST",,"6000  >  54728 [SYN, ACK] Seq=0 Ack=1 Win=65160 Len=0 MSS=1460 SACK_PERM TSval=844077200 TSecr=1072657162 WS=128"
627,289.553424,192.168.11.31,192.168.11.13,TCP,66,0.006973,,"Jan  5, 2024 21:29:56.723368000 JST",,54728  >  6000 [ACK] Seq=1 Ack=1 Win=64256 Len=0 TSval=1072657169 TSecr=844077200
628,289.554116,192.168.11.31,192.168.11.13,TCP,93,0.000692,,"Jan  5, 2024 21:29:56.724060000 JST",,"54728  >  6000 [PSH, ACK] Seq=1 Ack=1 Win=64256 Len=27 TSval=1072657170 TSecr=844077200 [TCP segment of a reassembled PDU]"
629,289.554237,192.168.11.13,192.168.11.31,TCP,66,0.000121,,"Jan  5, 2024 21:29:56.724181000 JST",,6000  >  54728 [ACK] Seq=1 Ack=28 Win=65152 Len=0 TSval=844077208 TSecr=1072657170
630,289.554315,192.168.11.31,192.168.11.13,TCP,66,0.000078,,"Jan  5, 2024 21:29:56.724259000 JST",,"54728  >  6000 [FIN, ACK] Seq=28 Ack=1 Win=64256 Len=0 TSval=1072657170 TSecr=844077200"
631,289.555613,192.168.11.13,192.168.11.31,TCP,66,0.001298,,"Jan  5, 2024 21:29:56.725557000 JST",,"6000  >  54728 [FIN, ACK] Seq=1 Ack=29 Win=65152 Len=0 TSval=844077209 TSecr=1072657170"
632,289.561436,192.168.11.31,192.168.11.13,TCP,66,0.005823,,"Jan  5, 2024 21:29:56.731380000 JST",,54728  >  6000 [ACK] Seq=29 Ack=2 Win=64256 Len=0 TSval=1072657177 TSecr=844077209
633,296.362713,192.168.11.13,192.168.11.6,TCP,74,6.801277,,"Jan  5, 2024 21:30:03.532657000 JST",,56630  >  6000 [SYN] Seq=0 Win=64240 Len=0 MSS=1460 SACK_PERM TSval=3908174761 TSecr=0 WS=128
634,296.369871,192.168.11.6,192.168.11.13,TCP,74,0.007158,,"Jan  5, 2024 21:30:03.539815000 JST",,"6000  >  56630 [SYN, ACK] Seq=0 Ack=1 Win=65160 Len=0 MSS=1460 SACK_PERM TSval=1058039825 TSecr=3908174761 WS=128"
635,296.370018,192.168.11.13,192.168.11.6,TCP,66,0.000147,,"Jan  5, 2024 21:30:03.539962000 JST",,56630  >  6000 [ACK] Seq=1 Ack=1 Win=64256 Len=0 TSval=3908174768 TSecr=1058039825
636,296.370228,192.168.11.13,192.168.11.6,TCP,93,0.00021,,"Jan  5, 2024 21:30:03.540172000 JST",,"56630  >  6000 [PSH, ACK] Seq=1 Ack=1 Win=64256 Len=27 TSval=3908174769 TSecr=1058039825 [TCP segment of a reassembled PDU]"
637,296.370324,192.168.11.13,192.168.11.6,TCP,66,0.000096,,"Jan  5, 2024 21:30:03.540268000 JST",,"56630  >  6000 [FIN, ACK] Seq=28 Ack=1 Win=64256 Len=0 TSval=3908174769 TSecr=1058039825"
638,296.377486,192.168.11.6,192.168.11.13,TCP,66,0.007162,,"Jan  5, 2024 21:30:03.547430000 JST",,6000  >  56630 [ACK] Seq=1 Ack=28 Win=65152 Len=0 TSval=1058039833 TSecr=3908174769
639,296.377735,192.168.11.6,192.168.11.13,TCP,66,0.000249,,"Jan  5, 2024 21:30:03.547679000 JST",,"6000  >  56630 [FIN, ACK] Seq=1 Ack=29 Win=65152 Len=0 TSval=1058039834 TSecr=3908174769"
640,296.377798,192.168.11.13,192.168.11.6,TCP,66,0.000063,,"Jan  5, 2024 21:30:03.547742000 JST",,56630  >  6000 [ACK] Seq=29 Ack=2 Win=64256 Len=0 TSval=3908174776 TSecr=1058039834
641,296.406991,192.168.11.13,255.255.255.255,UDP,209,0.029193,Ÿ,"Jan  5, 2024 21:30:03.576935000 JST",7b2273656d616e74696373223a207b22656e74697479223a2022504944222c202262617365656e74697479223a2022616e79222c2022726f6c65223a2022636363222c20227370617469616c223a2022616e79222c202274656d706f72616c223a2022616e79227d2c20226461746170726f7065727479223a207b22666f726d6174223a2022696e616f6b615f70726f6772616d5f73616d706c655f73656d616e746963227d7d,53531  >  7000 Len=167
642,296.417327,192.168.11.31,192.168.11.13,TCP,74,0.010336,œ,"Jan  5, 2024 21:30:03.587271000 JST",,50772  >  6000 [SYN] Seq=0 Win=64240 Len=0 MSS=1460 SACK_PERM TSval=1072664031 TSecr=0 WS=128
643,296.417479,192.168.11.13,192.168.11.31,TCP,74,0.000152,,"Jan  5, 2024 21:30:03.587423000 JST",,"6000  >  50772 [SYN, ACK] Seq=0 Ack=1 Win=65160 Len=0 MSS=1460 SACK_PERM TSval=844084071 TSecr=1072664031 WS=128"
644,296.424213,192.168.11.31,192.168.11.13,TCP,66,0.006734,,"Jan  5, 2024 21:30:03.594157000 JST",,50772  >  6000 [ACK] Seq=1 Ack=1 Win=64256 Len=0 TSval=1072664040 TSecr=844084071
645,296.424775,192.168.11.31,192.168.11.13,TCP,93,0.000562,,"Jan  5, 2024 21:30:03.594719000 JST",,"50772  >  6000 [PSH, ACK] Seq=1 Ack=1 Win=64256 Len=27 TSval=1072664040 TSecr=844084071 [TCP segment of a reassembled PDU]"
646,296.424894,192.168.11.13,192.168.11.31,TCP,66,0.000119,,"Jan  5, 2024 21:30:03.594838000 JST",,6000  >  50772 [ACK] Seq=1 Ack=28 Win=65152 Len=0 TSval=844084078 TSecr=1072664040
647,296.424964,192.168.11.31,192.168.11.13,TCP,66,0.00007,,"Jan  5, 2024 21:30:03.594908000 JST",,"50772  >  6000 [FIN, ACK] Seq=28 Ack=1 Win=64256 Len=0 TSval=1072664040 TSecr=844084071"
648,296.426844,192.168.11.13,192.168.11.31,TCP,66,0.00188,,"Jan  5, 2024 21:30:03.596788000 JST",,"6000  >  50772 [FIN, ACK] Seq=1 Ack=29 Win=65152 Len=0 TSval=844084080 TSecr=1072664040"
649,296.43634,192.168.11.31,192.168.11.13,TCP,66,0.009496,,"Jan  5, 2024 21:30:03.606284000 JST",,50772  >  6000 [ACK] Seq=29 Ack=2 Win=64256 Len=0 TSval=1072664051 TSecr=844084080
650,304.063824,192.168.11.13,192.168.11.6,TCP,74,7.627484,,"Jan  5, 2024 21:30:11.233768000 JST",,50280  >  6000 [SYN] Seq=0 Win=64240 Len=0 MSS=1460 SACK_PERM TSval=3908182462 TSecr=0 WS=128
651,304.070612,192.168.11.6,192.168.11.13,TCP,74,0.006788,,"Jan  5, 2024 21:30:11.240556000 JST",,"6000  >  50280 [SYN, ACK] Seq=0 Ack=1 Win=65160 Len=0 MSS=1460 SACK_PERM TSval=1058047526 TSecr=3908182462 WS=128"
652,304.070717,192.168.11.13,192.168.11.6,TCP,66,0.000105,,"Jan  5, 2024 21:30:11.240661000 JST",,50280  >  6000 [ACK] Seq=1 Ack=1 Win=64256 Len=0 TSval=3908182469 TSecr=1058047526
653,304.070885,192.168.11.13,192.168.11.6,TCP,93,0.000168,,"Jan  5, 2024 21:30:11.240829000 JST",,"50280  >  6000 [PSH, ACK] Seq=1 Ack=1 Win=64256 Len=27 TSval=3908182469 TSecr=1058047526 [TCP segment of a reassembled PDU]"
654,304.071011,192.168.11.13,192.168.11.6,TCP,66,0.000126,,"Jan  5, 2024 21:30:11.240955000 JST",,"50280  >  6000 [FIN, ACK] Seq=28 Ack=1 Win=64256 Len=0 TSval=3908182470 TSecr=1058047526"
655,304.078093,192.168.11.6,192.168.11.13,TCP,66,0.007082,,"Jan  5, 2024 21:30:11.248037000 JST",,6000  >  50280 [ACK] Seq=1 Ack=28 Win=65152 Len=0 TSval=1058047533 TSecr=3908182469
656,304.078305,192.168.11.6,192.168.11.13,TCP,66,0.000212,,"Jan  5, 2024 21:30:11.248249000 JST",,"6000  >  50280 [FIN, ACK] Seq=1 Ack=29 Win=65152 Len=0 TSval=1058047535 TSecr=3908182470"
