No.,Time,Source,Destination,Protocol,Length,The RTT to ACK the segment was,Time delta from previous captured frame,Arrival Time,Data,Info
1,0,192.168.11.8,192.168.11.13,TCP,74,,0,"Jan  8, 2024 13:40:12.360212000 JST",,43848  >  6000 [SYN] Seq=0 Win=64240 Len=0 MSS=1460 SACK_PERM TSval=1460214489 TSecr=0 WS=128
2,0.007806,192.168.11.13,192.168.11.8,TCP,74,0.007806,0.007806,"Jan  8, 2024 13:40:12.368018000 JST",,"6000  >  43848 [SYN, ACK] Seq=0 Ack=1 Win=65160 Len=0 MSS=1460 SACK_PERM TSval=650887930 TSecr=1460214489 WS=128"
3,0.007919,192.168.11.8,192.168.11.13,TCP,66,0.000113,0.000113,"Jan  8, 2024 13:40:12.368131000 JST",,43848  >  6000 [ACK] Seq=1 Ack=1 Win=64256 Len=0 TSval=1460214497 TSecr=650887930
4,0.008109,192.168.11.8,192.168.11.13,TCP,93,,0.00019,"Jan  8, 2024 13:40:12.368321000 JST",,"43848  >  6000 [PSH, ACK] Seq=1 Ack=1 Win=64256 Len=27 TSval=1460214497 TSecr=650887930 [TCP segment of a reassembled PDU]"
5,0.008227,192.168.11.8,192.168.11.13,TCP,66,,0.000118,"Jan  8, 2024 13:40:12.368439000 JST",,"43848  >  6000 [FIN, ACK] Seq=28 Ack=1 Win=64256 Len=0 TSval=1460214497 TSecr=650887930"
6,0.025054,192.168.11.13,192.168.11.8,TCP,66,0.016945,0.016827,"Jan  8, 2024 13:40:12.385266000 JST",,6000  >  43848 [ACK] Seq=1 Ack=28 Win=65152 Len=0 TSval=650887947 TSecr=1460214497
7,0.025443,192.168.11.13,192.168.11.8,TCP,66,0.017216,0.000389,"Jan  8, 2024 13:40:12.385655000 JST",,"6000  >  43848 [FIN, ACK] Seq=1 Ack=29 Win=65152 Len=0 TSval=650887948 TSecr=1460214497"
8,0.025498,192.168.11.8,192.168.11.13,TCP,66,0.000055,0.000055,"Jan  8, 2024 13:40:12.385710000 JST",,43848  >  6000 [ACK] Seq=29 Ack=2 Win=64256 Len=0 TSval=1460214515 TSecr=650887948
9,0.055061,192.168.11.8,255.255.255.255,UDP,209,,0.029563,"Jan  8, 2024 13:40:12.415273000 JST",7b2273656d616e74696373223a207b22656e74697479223a2022504944222c202262617365656e74697479223a2022616e79222c2022726f6c65223a2022646464222c20227370617469616c223a2022616e79222c202274656d706f72616c223a2022616e79227d2c20226461746170726f7065727479223a207b22666f726d6174223a2022696e616f6b615f70726f6772616d5f73616d706c655f73656d616e746963227d7d,38273  >  7000 Len=167
10,0.060889,192.168.11.23,192.168.11.8,TCP,74,,0.005828,"Jan  8, 2024 13:40:12.421101000 JST",,59592  >  6000 [SYN] Seq=0 Win=64240 Len=0 MSS=1460 SACK_PERM TSval=2533415050 TSecr=0 WS=128
11,0.061036,192.168.11.8,192.168.11.23,TCP,74,0.000147,0.000147,"Jan  8, 2024 13:40:12.421248000 JST",,"6000  >  59592 [SYN, ACK] Seq=0 Ack=1 Win=65160 Len=0 MSS=1460 SACK_PERM TSval=3529671154 TSecr=2533415050 WS=128"
12,0.067632,192.168.11.23,192.168.11.8,TCP,66,0.006596,0.006596,"Jan  8, 2024 13:40:12.427844000 JST",,59592  >  6000 [ACK] Seq=1 Ack=1 Win=64256 Len=0 TSval=2533415057 TSecr=3529671154
13,0.068141,192.168.11.23,192.168.11.8,TCP,93,,0.000509,"Jan  8, 2024 13:40:12.428353000 JST",,"59592  >  6000 [PSH, ACK] Seq=1 Ack=1 Win=64256 Len=27 TSval=2533415057 TSecr=3529671154 [TCP segment of a reassembled PDU]"
14,0.06822,192.168.11.8,192.168.11.23,TCP,66,0.000079,0.000079,"Jan  8, 2024 13:40:12.428432000 JST",,6000  >  59592 [ACK] Seq=1 Ack=28 Win=65152 Len=0 TSval=3529671161 TSecr=2533415057
15,0.068284,192.168.11.23,192.168.11.8,TCP,66,,0.000064,"Jan  8, 2024 13:40:12.428496000 JST",,"59592  >  6000 [FIN, ACK] Seq=28 Ack=1 Win=64256 Len=0 TSval=2533415057 TSecr=3529671154"
16,0.069562,192.168.11.8,192.168.11.23,TCP,66,0.001278,0.001278,"Jan  8, 2024 13:40:12.429774000 JST",,"6000  >  59592 [FIN, ACK] Seq=1 Ack=29 Win=65152 Len=0 TSval=3529671163 TSecr=2533415057"
17,0.075084,192.168.11.23,192.168.11.8,TCP,66,0.005522,0.005522,"Jan  8, 2024 13:40:12.435296000 JST",,59592  >  6000 [ACK] Seq=29 Ack=2 Win=64256 Len=0 TSval=2533415064 TSecr=3529671163
18,6.862492,192.168.11.8,192.168.11.13,TCP,74,,6.787408,"Jan  8, 2024 13:40:19.222704000 JST",,43850  >  6000 [SYN] Seq=0 Win=64240 Len=0 MSS=1460 SACK_PERM TSval=1460221352 TSecr=0 WS=128
19,6.869935,192.168.11.13,192.168.11.8,TCP,74,0.007443,0.007443,"Jan  8, 2024 13:40:19.230147000 JST",,"6000  >  43850 [SYN, ACK] Seq=0 Ack=1 Win=65160 Len=0 MSS=1460 SACK_PERM TSval=650894791 TSecr=1460221352 WS=128"
20,6.870055,192.168.11.8,192.168.11.13,TCP,66,0.00012,0.00012,"Jan  8, 2024 13:40:19.230267000 JST",,43850  >  6000 [ACK] Seq=1 Ack=1 Win=64256 Len=0 TSval=1460221359 TSecr=650894791
21,6.870235,192.168.11.8,192.168.11.13,TCP,93,,0.00018,"Jan  8, 2024 13:40:19.230447000 JST",,"43850  >  6000 [PSH, ACK] Seq=1 Ack=1 Win=64256 Len=27 TSval=1460221359 TSecr=650894791 [TCP segment of a reassembled PDU]"
22,6.870413,192.168.11.8,192.168.11.13,TCP,66,,0.000178,"Jan  8, 2024 13:40:19.230625000 JST",,"43850  >  6000 [FIN, ACK] Seq=28 Ack=1 Win=64256 Len=0 TSval=1460221360 TSecr=650894791"
23,6.877725,192.168.11.13,192.168.11.8,TCP,66,0.00749,0.007312,"Jan  8, 2024 13:40:19.237937000 JST",,6000  >  43850 [ACK] Seq=1 Ack=28 Win=65152 Len=0 TSval=650894800 TSecr=1460221359
24,6.878123,192.168.11.13,192.168.11.8,TCP,66,0.00771,0.000398,"Jan  8, 2024 13:40:19.238335000 JST",,"6000  >  43850 [FIN, ACK] Seq=1 Ack=29 Win=65152 Len=0 TSval=650894801 TSecr=1460221360"
25,6.87819,192.168.11.8,192.168.11.13,TCP,66,0.000067,0.000067,"Jan  8, 2024 13:40:19.238402000 JST",,43850  >  6000 [ACK] Seq=29 Ack=2 Win=64256 Len=0 TSval=1460221367 TSecr=650894801
26,6.908211,192.168.11.8,255.255.255.255,UDP,209,,0.030021,"Jan  8, 2024 13:40:19.268423000 JST",7b2273656d616e74696373223a207b22656e74697479223a2022504944222c202262617365656e74697479223a2022616e79222c2022726f6c65223a2022646464222c20227370617469616c223a2022616e79222c202274656d706f72616c223a2022616e79227d2c20226461746170726f7065727479223a207b22666f726d6174223a2022696e616f6b615f70726f6772616d5f73616d706c655f73656d616e746963227d7d,38787  >  7000 Len=167
27,6.914006,192.168.11.23,192.168.11.8,TCP,74,,0.005795,"Jan  8, 2024 13:40:19.274218000 JST",,59604  >  6000 [SYN] Seq=0 Win=64240 Len=0 MSS=1460 SACK_PERM TSval=2533421903 TSecr=0 WS=128
28,6.914166,192.168.11.8,192.168.11.23,TCP,74,0.00016,0.00016,"Jan  8, 2024 13:40:19.274378000 JST",,"6000  >  59604 [SYN, ACK] Seq=0 Ack=1 Win=65160 Len=0 MSS=1460 SACK_PERM TSval=3529678007 TSecr=2533421903 WS=128"
29,6.922568,192.168.11.23,192.168.11.8,TCP,66,0.008402,0.008402,"Jan  8, 2024 13:40:19.282780000 JST",,59604  >  6000 [ACK] Seq=1 Ack=1 Win=64256 Len=0 TSval=2533421912 TSecr=3529678007
30,6.923254,192.168.11.23,192.168.11.8,TCP,93,,0.000686,"Jan  8, 2024 13:40:19.283466000 JST",,"59604  >  6000 [PSH, ACK] Seq=1 Ack=1 Win=64256 Len=27 TSval=2533421912 TSecr=3529678007 [TCP segment of a reassembled PDU]"
31,6.923392,192.168.11.8,192.168.11.23,TCP,66,0.000138,0.000138,"Jan  8, 2024 13:40:19.283604000 JST",,6000  >  59604 [ACK] Seq=1 Ack=28 Win=65152 Len=0 TSval=3529678017 TSecr=2533421912
32,6.923486,192.168.11.23,192.168.11.8,TCP,66,,0.000094,"Jan  8, 2024 13:40:19.283698000 JST",,"59604  >  6000 [FIN, ACK] Seq=28 Ack=1 Win=64256 Len=0 TSval=2533421912 TSecr=3529678007"
33,6.924802,192.168.11.8,192.168.11.23,TCP,66,0.001316,0.001316,"Jan  8, 2024 13:40:19.285014000 JST",,"6000  >  59604 [FIN, ACK] Seq=1 Ack=29 Win=65152 Len=0 TSval=3529678018 TSecr=2533421912"
34,6.930958,192.168.11.23,192.168.11.8,TCP,66,0.006156,0.006156,"Jan  8, 2024 13:40:19.291170000 JST",,59604  >  6000 [ACK] Seq=29 Ack=2 Win=64256 Len=0 TSval=2533421920 TSecr=3529678018
35,13.720466,192.168.11.8,192.168.11.13,TCP,74,,6.789508,"Jan  8, 2024 13:40:26.080678000 JST",,43138  >  6000 [SYN] Seq=0 Win=64240 Len=0 MSS=1460 SACK_PERM TSval=1460228210 TSecr=0 WS=128
36,13.729538,192.168.11.13,192.168.11.8,TCP,74,0.009072,0.009072,"Jan  8, 2024 13:40:26.089750000 JST",,"6000  >  43138 [SYN, ACK] Seq=0 Ack=1 Win=65160 Len=0 MSS=1460 SACK_PERM TSval=650901649 TSecr=1460228210 WS=128"
37,13.729669,192.168.11.8,192.168.11.13,TCP,66,0.000131,0.000131,"Jan  8, 2024 13:40:26.089881000 JST",,43138  >  6000 [ACK] Seq=1 Ack=1 Win=64256 Len=0 TSval=1460228219 TSecr=650901649
38,13.729847,192.168.11.8,192.168.11.13,TCP,93,,0.000178,"Jan  8, 2024 13:40:26.090059000 JST",,"43138  >  6000 [PSH, ACK] Seq=1 Ack=1 Win=64256 Len=27 TSval=1460228219 TSecr=650901649 [TCP segment of a reassembled PDU]"
39,13.729944,192.168.11.8,192.168.11.13,TCP,66,,0.000097,"Jan  8, 2024 13:40:26.090156000 JST",,"43138  >  6000 [FIN, ACK] Seq=28 Ack=1 Win=64256 Len=0 TSval=1460228219 TSecr=650901649"
40,13.737327,192.168.11.13,192.168.11.8,TCP,66,0.00748,0.007383,"Jan  8, 2024 13:40:26.097539000 JST",,6000  >  43138 [ACK] Seq=1 Ack=28 Win=65152 Len=0 TSval=650901659 TSecr=1460228219
41,13.741803,192.168.11.13,192.168.11.8,TCP,66,0.011859,0.004476,"Jan  8, 2024 13:40:26.102015000 JST",,"6000  >  43138 [FIN, ACK] Seq=1 Ack=29 Win=65152 Len=0 TSval=650901661 TSecr=1460228219"
42,13.741871,192.168.11.8,192.168.11.13,TCP,66,0.000068,0.000068,"Jan  8, 2024 13:40:26.102083000 JST",,43138  >  6000 [ACK] Seq=29 Ack=2 Win=64256 Len=0 TSval=1460228231 TSecr=650901661
43,13.781142,192.168.11.8,255.255.255.255,UDP,209,,0.039271,"Jan  8, 2024 13:40:26.141354000 JST",7b2273656d616e74696373223a207b22656e74697479223a2022504944222c202262617365656e74697479223a2022616e79222c2022726f6c65223a2022646464222c20227370617469616c223a2022616e79222c202274656d706f72616c223a2022616e79227d2c20226461746170726f7065727479223a207b22666f726d6174223a2022696e616f6b615f70726f6772616d5f73616d706c655f73656d616e746963227d7d,54111  >  7000 Len=167
44,13.788321,192.168.11.23,192.168.11.8,TCP,74,,0.007179,"Jan  8, 2024 13:40:26.148533000 JST",,55004  >  6000 [SYN] Seq=0 Win=64240 Len=0 MSS=1460 SACK_PERM TSval=2533428776 TSecr=0 WS=128
45,13.788491,192.168.11.8,192.168.11.23,TCP,74,0.00017,0.00017,"Jan  8, 2024 13:40:26.148703000 JST",,"6000  >  55004 [SYN, ACK] Seq=0 Ack=1 Win=65160 Len=0 MSS=1460 SACK_PERM TSval=3529684882 TSecr=2533428776 WS=128"
46,13.796126,192.168.11.23,192.168.11.8,TCP,66,0.007635,0.007635,"Jan  8, 2024 13:40:26.156338000 JST",,55004  >  6000 [ACK] Seq=1 Ack=1 Win=64256 Len=0 TSval=2533428785 TSecr=3529684882
47,13.796767,192.168.11.23,192.168.11.8,TCP,93,,0.000641,"Jan  8, 2024 13:40:26.156979000 JST",,"55004  >  6000 [PSH, ACK] Seq=1 Ack=1 Win=64256 Len=27 TSval=2533428786 TSecr=3529684882 [TCP segment of a reassembled PDU]"
48,13.796897,192.168.11.8,192.168.11.23,TCP,66,0.00013,0.00013,"Jan  8, 2024 13:40:26.157109000 JST",,6000  >  55004 [ACK] Seq=1 Ack=28 Win=65152 Len=0 TSval=3529684890 TSecr=2533428786
49,13.796985,192.168.11.23,192.168.11.8,TCP,66,,0.000088,"Jan  8, 2024 13:40:26.157197000 JST",,"55004  >  6000 [FIN, ACK] Seq=28 Ack=1 Win=64256 Len=0 TSval=2533428786 TSecr=3529684882"
50,13.798564,192.168.11.8,192.168.11.23,TCP,66,0.001579,0.001579,"Jan  8, 2024 13:40:26.158776000 JST",,"6000  >  55004 [FIN, ACK] Seq=1 Ack=29 Win=65152 Len=0 TSval=3529684891 TSecr=2533428786"
51,13.803971,192.168.11.23,192.168.11.8,TCP,66,0.005407,0.005407,"Jan  8, 2024 13:40:26.164183000 JST",,55004  >  6000 [ACK] Seq=29 Ack=2 Win=64256 Len=0 TSval=2533428793 TSecr=3529684891
52,21.439965,192.168.11.8,192.168.11.13,TCP,74,,7.635994,"Jan  8, 2024 13:40:33.800177000 JST",,56560  >  6000 [SYN] Seq=0 Win=64240 Len=0 MSS=1460 SACK_PERM TSval=1460235929 TSecr=0 WS=128
53,21.447506,192.168.11.13,192.168.11.8,TCP,74,0.007541,0.007541,"Jan  8, 2024 13:40:33.807718000 JST",,"6000  >  56560 [SYN, ACK] Seq=0 Ack=1 Win=65160 Len=0 MSS=1460 SACK_PERM TSval=650909369 TSecr=1460235929 WS=128"
54,21.447633,192.168.11.8,192.168.11.13,TCP,66,0.000127,0.000127,"Jan  8, 2024 13:40:33.807845000 JST",,56560  >  6000 [ACK] Seq=1 Ack=1 Win=64256 Len=0 TSval=1460235937 TSecr=650909369
55,21.447787,192.168.11.8,192.168.11.13,TCP,93,,0.000154,"Jan  8, 2024 13:40:33.807999000 JST",,"56560  >  6000 [PSH, ACK] Seq=1 Ack=1 Win=64256 Len=27 TSval=1460235937 TSecr=650909369 [TCP segment of a reassembled PDU]"
56,21.44788,192.168.11.8,192.168.11.13,TCP,66,,0.000093,"Jan  8, 2024 13:40:33.808092000 JST",,"56560  >  6000 [FIN, ACK] Seq=28 Ack=1 Win=64256 Len=0 TSval=1460235937 TSecr=650909369"
57,21.454901,192.168.11.13,192.168.11.8,TCP,66,0.007114,0.007021,"Jan  8, 2024 13:40:33.815113000 JST",,6000  >  56560 [ACK] Seq=1 Ack=28 Win=65152 Len=0 TSval=650909377 TSecr=1460235937
58,21.455155,192.168.11.13,192.168.11.8,TCP,66,0.007275,0.000254,"Jan  8, 2024 13:40:33.815367000 JST",,"6000  >  56560 [FIN, ACK] Seq=1 Ack=29 Win=65152 Len=0 TSval=650909379 TSecr=1460235937"
59,21.45522,192.168.11.8,192.168.11.13,TCP,66,0.000065,0.000065,"Jan  8, 2024 13:40:33.815432000 JST",,56560  >  6000 [ACK] Seq=29 Ack=2 Win=64256 Len=0 TSval=1460235944 TSecr=650909379
60,21.486964,192.168.11.8,255.255.255.255,UDP,209,,0.031744,"Jan  8, 2024 13:40:33.847176000 JST",7b2273656d616e74696373223a207b22656e74697479223a2022504944222c202262617365656e74697479223a2022616e79222c2022726f6c65223a2022646464222c20227370617469616c223a2022616e79222c202274656d706f72616c223a2022616e79227d2c20226461746170726f7065727479223a207b22666f726d6174223a2022696e616f6b615f70726f6772616d5f73616d706c655f73656d616e746963227d7d,43100  >  7000 Len=167
61,21.493696,192.168.11.23,192.168.11.8,TCP,74,,0.006732,"Jan  8, 2024 13:40:33.853908000 JST",,51370  >  6000 [SYN] Seq=0 Win=64240 Len=0 MSS=1460 SACK_PERM TSval=2533436482 TSecr=0 WS=128
62,21.493862,192.168.11.8,192.168.11.23,TCP,74,0.000166,0.000166,"Jan  8, 2024 13:40:33.854074000 JST",,"6000  >  51370 [SYN, ACK] Seq=0 Ack=1 Win=65160 Len=0 MSS=1460 SACK_PERM TSval=3529692587 TSecr=2533436482 WS=128"
63,21.502065,192.168.11.23,192.168.11.8,TCP,66,0.008203,0.008203,"Jan  8, 2024 13:40:33.862277000 JST",,51370  >  6000 [ACK] Seq=1 Ack=1 Win=64256 Len=0 TSval=2533436491 TSecr=3529692587
64,21.502773,192.168.11.23,192.168.11.8,TCP,93,,0.000708,"Jan  8, 2024 13:40:33.862985000 JST",,"51370  >  6000 [PSH, ACK] Seq=1 Ack=1 Win=64256 Len=27 TSval=2533436491 TSecr=3529692587 [TCP segment of a reassembled PDU]"
65,21.50293,192.168.11.8,192.168.11.23,TCP,66,0.000157,0.000157,"Jan  8, 2024 13:40:33.863142000 JST",,6000  >  51370 [ACK] Seq=1 Ack=28 Win=65152 Len=0 TSval=3529692596 TSecr=2533436491
66,21.503023,192.168.11.23,192.168.11.8,TCP,66,,0.000093,"Jan  8, 2024 13:40:33.863235000 JST",,"51370  >  6000 [FIN, ACK] Seq=28 Ack=1 Win=64256 Len=0 TSval=2533436492 TSecr=3529692587"
67,21.504468,192.168.11.8,192.168.11.23,TCP,66,0.001445,0.001445,"Jan  8, 2024 13:40:33.864680000 JST",,"6000  >  51370 [FIN, ACK] Seq=1 Ack=29 Win=65152 Len=0 TSval=3529692598 TSecr=2533436492"
68,21.510042,192.168.11.23,192.168.11.8,TCP,66,0.005574,0.005574,"Jan  8, 2024 13:40:33.870254000 JST",,51370  >  6000 [ACK] Seq=29 Ack=2 Win=64256 Len=0 TSval=2533436499 TSecr=3529692598
69,29.169354,192.168.11.8,192.168.11.13,TCP,74,,7.659312,"Jan  8, 2024 13:40:41.529566000 JST",,56566  >  6000 [SYN] Seq=0 Win=64240 Len=0 MSS=1460 SACK_PERM TSval=1460243659 TSecr=0 WS=128
70,29.175958,192.168.11.13,192.168.11.8,TCP,74,0.006604,0.006604,"Jan  8, 2024 13:40:41.536170000 JST",,"6000  >  56566 [SYN, ACK] Seq=0 Ack=1 Win=65160 Len=0 MSS=1460 SACK_PERM TSval=650917098 TSecr=1460243659 WS=128"
71,29.176075,192.168.11.8,192.168.11.13,TCP,66,0.000117,0.000117,"Jan  8, 2024 13:40:41.536287000 JST",,56566  >  6000 [ACK] Seq=1 Ack=1 Win=64256 Len=0 TSval=1460243665 TSecr=650917098
72,29.17621,192.168.11.8,192.168.11.13,TCP,93,,0.000135,"Jan  8, 2024 13:40:41.536422000 JST",,"56566  >  6000 [PSH, ACK] Seq=1 Ack=1 Win=64256 Len=27 TSval=1460243665 TSecr=650917098 [TCP segment of a reassembled PDU]"
73,29.176313,192.168.11.8,192.168.11.13,TCP,66,,0.000103,"Jan  8, 2024 13:40:41.536525000 JST",,"56566  >  6000 [FIN, ACK] Seq=28 Ack=1 Win=64256 Len=0 TSval=1460243666 TSecr=650917098"
74,29.183364,192.168.11.13,192.168.11.8,TCP,66,0.007154,0.007051,"Jan  8, 2024 13:40:41.543576000 JST",,6000  >  56566 [ACK] Seq=1 Ack=28 Win=65152 Len=0 TSval=650917105 TSecr=1460243665
75,29.183728,192.168.11.13,192.168.11.8,TCP,66,0.007415,0.000364,"Jan  8, 2024 13:40:41.543940000 JST",,"6000  >  56566 [FIN, ACK] Seq=1 Ack=29 Win=65152 Len=0 TSval=650917107 TSecr=1460243666"
76,29.183775,192.168.11.8,192.168.11.13,TCP,66,0.000047,0.000047,"Jan  8, 2024 13:40:41.543987000 JST",,56566  >  6000 [ACK] Seq=29 Ack=2 Win=64256 Len=0 TSval=1460243673 TSecr=650917107
77,29.212745,192.168.11.8,255.255.255.255,UDP,209,,0.02897,"Jan  8, 2024 13:40:41.572957000 JST",7b2273656d616e74696373223a207b22656e74697479223a2022504944222c202262617365656e74697479223a2022616e79222c2022726f6c65223a2022646464222c20227370617469616c223a2022616e79222c202274656d706f72616c223a2022616e79227d2c20226461746170726f7065727479223a207b22666f726d6174223a2022696e616f6b615f70726f6772616d5f73616d706c655f73656d616e746963227d7d,50618  >  7000 Len=167
78,29.219702,192.168.11.23,192.168.11.8,TCP,74,,0.006957,"Jan  8, 2024 13:40:41.579914000 JST",,36496  >  6000 [SYN] Seq=0 Win=64240 Len=0 MSS=1460 SACK_PERM TSval=2533444208 TSecr=0 WS=128
79,29.219844,192.168.11.8,192.168.11.23,TCP,74,0.000142,0.000142,"Jan  8, 2024 13:40:41.580056000 JST",,"6000  >  36496 [SYN, ACK] Seq=0 Ack=1 Win=65160 Len=0 MSS=1460 SACK_PERM TSval=3529700313 TSecr=2533444208 WS=128"
80,29.227516,192.168.11.23,192.168.11.8,TCP,66,0.007672,0.007672,"Jan  8, 2024 13:40:41.587728000 JST",,36496  >  6000 [ACK] Seq=1 Ack=1 Win=64256 Len=0 TSval=2533444217 TSecr=3529700313
81,29.228157,192.168.11.23,192.168.11.8,TCP,93,,0.000641,"Jan  8, 2024 13:40:41.588369000 JST",,"36496  >  6000 [PSH, ACK] Seq=1 Ack=1 Win=64256 Len=27 TSval=2533444217 TSecr=3529700313 [TCP segment of a reassembled PDU]"
82,29.228253,192.168.11.8,192.168.11.23,TCP,66,0.000096,0.000096,"Jan  8, 2024 13:40:41.588465000 JST",,6000  >  36496 [ACK] Seq=1 Ack=28 Win=65152 Len=0 TSval=3529700321 TSecr=2533444217
83,29.228465,192.168.11.23,192.168.11.8,TCP,66,,0.000212,"Jan  8, 2024 13:40:41.588677000 JST",,"36496  >  6000 [FIN, ACK] Seq=28 Ack=1 Win=64256 Len=0 TSval=2533444217 TSecr=3529700313"
84,29.229369,192.168.11.8,192.168.11.23,TCP,66,0.000904,0.000904,"Jan  8, 2024 13:40:41.589581000 JST",,"6000  >  36496 [FIN, ACK] Seq=1 Ack=29 Win=65152 Len=0 TSval=3529700323 TSecr=2533444217"
85,29.23593,192.168.11.23,192.168.11.8,TCP,66,0.006561,0.006561,"Jan  8, 2024 13:40:41.596142000 JST",,36496  >  6000 [ACK] Seq=29 Ack=2 Win=64256 Len=0 TSval=2533444225 TSecr=3529700323
86,35.912746,192.168.11.8,192.168.11.13,TCP,74,,6.676816,"Jan  8, 2024 13:40:48.272958000 JST",,57248  >  6000 [SYN] Seq=0 Win=64240 Len=0 MSS=1460 SACK_PERM TSval=1460250402 TSecr=0 WS=128
87,35.920704,192.168.11.13,192.168.11.8,TCP,74,0.007958,0.007958,"Jan  8, 2024 13:40:48.280916000 JST",,"6000  >  57248 [SYN, ACK] Seq=0 Ack=1 Win=65160 Len=0 MSS=1460 SACK_PERM TSval=650923843 TSecr=1460250402 WS=128"
88,35.92084,192.168.11.8,192.168.11.13,TCP,66,0.000136,0.000136,"Jan  8, 2024 13:40:48.281052000 JST",,57248  >  6000 [ACK] Seq=1 Ack=1 Win=64256 Len=0 TSval=1460250410 TSecr=650923843
89,35.920982,192.168.11.8,192.168.11.13,TCP,93,,0.000142,"Jan  8, 2024 13:40:48.281194000 JST",,"57248  >  6000 [PSH, ACK] Seq=1 Ack=1 Win=64256 Len=27 TSval=1460250410 TSecr=650923843 [TCP segment of a reassembled PDU]"
90,35.921085,192.168.11.8,192.168.11.13,TCP,66,,0.000103,"Jan  8, 2024 13:40:48.281297000 JST",,"57248  >  6000 [FIN, ACK] Seq=28 Ack=1 Win=64256 Len=0 TSval=1460250410 TSecr=650923843"
91,35.928299,192.168.11.13,192.168.11.8,TCP,66,0.007317,0.007214,"Jan  8, 2024 13:40:48.288511000 JST",,6000  >  57248 [ACK] Seq=1 Ack=28 Win=65152 Len=0 TSval=650923850 TSecr=1460250410
92,35.928697,192.168.11.13,192.168.11.8,TCP,66,0.007612,0.000398,"Jan  8, 2024 13:40:48.288909000 JST",,"6000  >  57248 [FIN, ACK] Seq=1 Ack=29 Win=65152 Len=0 TSval=650923852 TSecr=1460250410"
93,35.928768,192.168.11.8,192.168.11.13,TCP,66,0.000071,0.000071,"Jan  8, 2024 13:40:48.288980000 JST",,57248  >  6000 [ACK] Seq=29 Ack=2 Win=64256 Len=0 TSval=1460250418 TSecr=650923852
94,35.958262,192.168.11.8,255.255.255.255,UDP,209,,0.029494,"Jan  8, 2024 13:40:48.318474000 JST",7b2273656d616e74696373223a207b22656e74697479223a2022504944222c202262617365656e74697479223a2022616e79222c2022726f6c65223a2022646464222c20227370617469616c223a2022616e79222c202274656d706f72616c223a2022616e79227d2c20226461746170726f7065727479223a207b22666f726d6174223a2022696e616f6b615f70726f6772616d5f73616d706c655f73656d616e746963227d7d,60417  >  7000 Len=167
95,35.963996,192.168.11.23,192.168.11.8,TCP,74,,0.005734,"Jan  8, 2024 13:40:48.324208000 JST",,36508  >  6000 [SYN] Seq=0 Win=64240 Len=0 MSS=1460 SACK_PERM TSval=2533450953 TSecr=0 WS=128
96,35.96416,192.168.11.8,192.168.11.23,TCP,74,0.000164,0.000164,"Jan  8, 2024 13:40:48.324372000 JST",,"6000  >  36508 [SYN, ACK] Seq=0 Ack=1 Win=65160 Len=0 MSS=1460 SACK_PERM TSval=3529707057 TSecr=2533450953 WS=128"
97,35.971855,192.168.11.23,192.168.11.8,TCP,66,0.007695,0.007695,"Jan  8, 2024 13:40:48.332067000 JST",,36508  >  6000 [ACK] Seq=1 Ack=1 Win=64256 Len=0 TSval=2533450961 TSecr=3529707057
98,35.972486,192.168.11.23,192.168.11.8,TCP,93,,0.000631,"Jan  8, 2024 13:40:48.332698000 JST",,"36508  >  6000 [PSH, ACK] Seq=1 Ack=1 Win=64256 Len=27 TSval=2533450961 TSecr=3529707057 [TCP segment of a reassembled PDU]"
99,35.972613,192.168.11.8,192.168.11.23,TCP,66,0.000127,0.000127,"Jan  8, 2024 13:40:48.332825000 JST",,6000  >  36508 [ACK] Seq=1 Ack=28 Win=65152 Len=0 TSval=3529707066 TSecr=2533450961
100,35.972695,192.168.11.23,192.168.11.8,TCP,66,,0.000082,"Jan  8, 2024 13:40:48.332907000 JST",,"36508  >  6000 [FIN, ACK] Seq=28 Ack=1 Win=64256 Len=0 TSval=2533450961 TSecr=3529707057"
101,35.974512,192.168.11.8,192.168.11.23,TCP,66,0.001817,0.001817,"Jan  8, 2024 13:40:48.334724000 JST",,"6000  >  36508 [FIN, ACK] Seq=1 Ack=29 Win=65152 Len=0 TSval=3529707067 TSecr=2533450961"
102,35.979072,192.168.11.23,192.168.11.8,TCP,66,0.00456,0.00456,"Jan  8, 2024 13:40:48.339284000 JST",,36508  >  6000 [ACK] Seq=29 Ack=2 Win=64256 Len=0 TSval=2533450969 TSecr=3529707067
103,42.66591,192.168.11.8,192.168.11.13,TCP,74,,6.686838,"Jan  8, 2024 13:40:55.026122000 JST",,45186  >  6000 [SYN] Seq=0 Win=64240 Len=0 MSS=1460 SACK_PERM TSval=1460257155 TSecr=0 WS=128
104,42.672575,192.168.11.13,192.168.11.8,TCP,74,0.006665,0.006665,"Jan  8, 2024 13:40:55.032787000 JST",,"6000  >  45186 [SYN, ACK] Seq=0 Ack=1 Win=65160 Len=0 MSS=1460 SACK_PERM TSval=650930595 TSecr=1460257155 WS=128"
105,42.672681,192.168.11.8,192.168.11.13,TCP,66,0.000106,0.000106,"Jan  8, 2024 13:40:55.032893000 JST",,45186  >  6000 [ACK] Seq=1 Ack=1 Win=64256 Len=0 TSval=1460257162 TSecr=650930595
106,42.67289,192.168.11.8,192.168.11.13,TCP,93,,0.000209,"Jan  8, 2024 13:40:55.033102000 JST",,"45186  >  6000 [PSH, ACK] Seq=1 Ack=1 Win=64256 Len=27 TSval=1460257162 TSecr=650930595 [TCP segment of a reassembled PDU]"
107,42.672996,192.168.11.8,192.168.11.13,TCP,66,,0.000106,"Jan  8, 2024 13:40:55.033208000 JST",,"45186  >  6000 [FIN, ACK] Seq=28 Ack=1 Win=64256 Len=0 TSval=1460257162 TSecr=650930595"
108,42.679803,192.168.11.13,192.168.11.8,TCP,66,0.006913,0.006807,"Jan  8, 2024 13:40:55.040015000 JST",,6000  >  45186 [ACK] Seq=1 Ack=28 Win=65152 Len=0 TSval=650930602 TSecr=1460257162
109,42.680175,192.168.11.13,192.168.11.8,TCP,66,0.007179,0.000372,"Jan  8, 2024 13:40:55.040387000 JST",,"6000  >  45186 [FIN, ACK] Seq=1 Ack=29 Win=65152 Len=0 TSval=650930603 TSecr=1460257162"
110,42.680231,192.168.11.8,192.168.11.13,TCP,66,0.000056,0.000056,"Jan  8, 2024 13:40:55.040443000 JST",,45186  >  6000 [ACK] Seq=29 Ack=2 Win=64256 Len=0 TSval=1460257169 TSecr=650930603
111,42.710989,192.168.11.8,255.255.255.255,UDP,209,,0.030758,"Jan  8, 2024 13:40:55.071201000 JST",7b2273656d616e74696373223a207b22656e74697479223a2022504944222c202262617365656e74697479223a2022616e79222c2022726f6c65223a2022646464222c20227370617469616c223a2022616e79222c202274656d706f72616c223a2022616e79227d2c20226461746170726f7065727479223a207b22666f726d6174223a2022696e616f6b615f70726f6772616d5f73616d706c655f73656d616e746963227d7d,41436  >  7000 Len=167
112,42.717001,192.168.11.23,192.168.11.8,TCP,74,,0.006012,"Jan  8, 2024 13:40:55.077213000 JST",,60928  >  6000 [SYN] Seq=0 Win=64240 Len=0 MSS=1460 SACK_PERM TSval=2533457706 TSecr=0 WS=128
113,42.717144,192.168.11.8,192.168.11.23,TCP,74,0.000143,0.000143,"Jan  8, 2024 13:40:55.077356000 JST",,"6000  >  60928 [SYN, ACK] Seq=0 Ack=1 Win=65160 Len=0 MSS=1460 SACK_PERM TSval=3529713810 TSecr=2533457706 WS=128"
114,42.72384,192.168.11.23,192.168.11.8,TCP,66,0.006696,0.006696,"Jan  8, 2024 13:40:55.084052000 JST",,60928  >  6000 [ACK] Seq=1 Ack=1 Win=64256 Len=0 TSval=2533457713 TSecr=3529713810
115,42.724522,192.168.11.23,192.168.11.8,TCP,93,,0.000682,"Jan  8, 2024 13:40:55.084734000 JST",,"60928  >  6000 [PSH, ACK] Seq=1 Ack=1 Win=64256 Len=27 TSval=2533457713 TSecr=3529713810 [TCP segment of a reassembled PDU]"
116,42.724646,192.168.11.8,192.168.11.23,TCP,66,0.000124,0.000124,"Jan  8, 2024 13:40:55.084858000 JST",,6000  >  60928 [ACK] Seq=1 Ack=28 Win=65152 Len=0 TSval=3529713818 TSecr=2533457713
117,42.724733,192.168.11.23,192.168.11.8,TCP,66,,0.000087,"Jan  8, 2024 13:40:55.084945000 JST",,"60928  >  6000 [FIN, ACK] Seq=28 Ack=1 Win=64256 Len=0 TSval=2533457713 TSecr=3529713810"
118,42.726172,192.168.11.8,192.168.11.23,TCP,66,0.001439,0.001439,"Jan  8, 2024 13:40:55.086384000 JST",,"6000  >  60928 [FIN, ACK] Seq=1 Ack=29 Win=65152 Len=0 TSval=3529713819 TSecr=2533457713"
119,42.731635,192.168.11.23,192.168.11.8,TCP,66,0.005463,0.005463,"Jan  8, 2024 13:40:55.091847000 JST",,60928  >  6000 [ACK] Seq=29 Ack=2 Win=64256 Len=0 TSval=2533457721 TSecr=3529713819
120,49.410306,192.168.11.8,192.168.11.13,TCP,74,,6.678671,"Jan  8, 2024 13:41:01.770518000 JST",,45196  >  6000 [SYN] Seq=0 Win=64240 Len=0 MSS=1460 SACK_PERM TSval=1460263899 TSecr=0 WS=128
121,49.418156,192.168.11.13,192.168.11.8,TCP,74,0.00785,0.00785,"Jan  8, 2024 13:41:01.778368000 JST",,"6000  >  45196 [SYN, ACK] Seq=0 Ack=1 Win=65160 Len=0 MSS=1460 SACK_PERM TSval=650937340 TSecr=1460263899 WS=128"
122,49.418302,192.168.11.8,192.168.11.13,TCP,66,0.000146,0.000146,"Jan  8, 2024 13:41:01.778514000 JST",,45196  >  6000 [ACK] Seq=1 Ack=1 Win=64256 Len=0 TSval=1460263907 TSecr=650937340
123,49.418553,192.168.11.8,192.168.11.13,TCP,93,,0.000251,"Jan  8, 2024 13:41:01.778765000 JST",,"45196  >  6000 [PSH, ACK] Seq=1 Ack=1 Win=64256 Len=27 TSval=1460263908 TSecr=650937340 [TCP segment of a reassembled PDU]"
124,49.418673,192.168.11.8,192.168.11.13,TCP,66,,0.00012,"Jan  8, 2024 13:41:01.778885000 JST",,"45196  >  6000 [FIN, ACK] Seq=28 Ack=1 Win=64256 Len=0 TSval=1460263908 TSecr=650937340"
125,49.425848,192.168.11.13,192.168.11.8,TCP,66,0.007295,0.007175,"Jan  8, 2024 13:41:01.786060000 JST",,6000  >  45196 [ACK] Seq=1 Ack=28 Win=65152 Len=0 TSval=650937348 TSecr=1460263908
126,49.426218,192.168.11.13,192.168.11.8,TCP,66,0.007545,0.00037,"Jan  8, 2024 13:41:01.786430000 JST",,"6000  >  45196 [FIN, ACK] Seq=1 Ack=29 Win=65152 Len=0 TSval=650937349 TSecr=1460263908"
127,49.426291,192.168.11.8,192.168.11.13,TCP,66,0.000073,0.000073,"Jan  8, 2024 13:41:01.786503000 JST",,45196  >  6000 [ACK] Seq=29 Ack=2 Win=64256 Len=0 TSval=1460263915 TSecr=650937349
128,49.456189,192.168.11.8,255.255.255.255,UDP,209,,0.029898,"Jan  8, 2024 13:41:01.816401000 JST",7b2273656d616e74696373223a207b22656e74697479223a2022504944222c202262617365656e74697479223a2022616e79222c2022726f6c65223a2022646464222c20227370617469616c223a2022616e79222c202274656d706f72616c223a2022616e79227d2c20226461746170726f7065727479223a207b22666f726d6174223a2022696e616f6b615f70726f6772616d5f73616d706c655f73656d616e746963227d7d,58421  >  7000 Len=167
129,49.461953,192.168.11.23,192.168.11.8,TCP,74,,0.005764,"Jan  8, 2024 13:41:01.822165000 JST",,46242  >  6000 [SYN] Seq=0 Win=64240 Len=0 MSS=1460 SACK_PERM TSval=2533464451 TSecr=0 WS=128
130,49.462092,192.168.11.8,192.168.11.23,TCP,74,0.000139,0.000139,"Jan  8, 2024 13:41:01.822304000 JST",,"6000  >  46242 [SYN, ACK] Seq=0 Ack=1 Win=65160 Len=0 MSS=1460 SACK_PERM TSval=3529720555 TSecr=2533464451 WS=128"
131,49.46897,192.168.11.23,192.168.11.8,TCP,66,0.006878,0.006878,"Jan  8, 2024 13:41:01.829182000 JST",,46242  >  6000 [ACK] Seq=1 Ack=1 Win=64256 Len=0 TSval=2533464458 TSecr=3529720555
132,49.4694,192.168.11.23,192.168.11.8,TCP,93,,0.00043,"Jan  8, 2024 13:41:01.829612000 JST",,"46242  >  6000 [PSH, ACK] Seq=1 Ack=1 Win=64256 Len=27 TSval=2533464458 TSecr=3529720555 [TCP segment of a reassembled PDU]"
133,49.469479,192.168.11.8,192.168.11.23,TCP,66,0.000079,0.000079,"Jan  8, 2024 13:41:01.829691000 JST",,6000  >  46242 [ACK] Seq=1 Ack=28 Win=65152 Len=0 TSval=3529720563 TSecr=2533464458
134,49.46968,192.168.11.23,192.168.11.8,TCP,66,,0.000201,"Jan  8, 2024 13:41:01.829892000 JST",,"46242  >  6000 [FIN, ACK] Seq=28 Ack=1 Win=64256 Len=0 TSval=2533464459 TSecr=3529720555"
135,49.471045,192.168.11.8,192.168.11.23,TCP,66,0.001365,0.001365,"Jan  8, 2024 13:41:01.831257000 JST",,"6000  >  46242 [FIN, ACK] Seq=1 Ack=29 Win=65152 Len=0 TSval=3529720564 TSecr=2533464459"
136,49.476257,192.168.11.23,192.168.11.8,TCP,66,0.005212,0.005212,"Jan  8, 2024 13:41:01.836469000 JST",,46242  >  6000 [ACK] Seq=29 Ack=2 Win=64256 Len=0 TSval=2533464466 TSecr=3529720564
137,56.125819,192.168.11.8,192.168.11.13,TCP,74,,6.649562,"Jan  8, 2024 13:41:08.486031000 JST",,36070  >  6000 [SYN] Seq=0 Win=64240 Len=0 MSS=1460 SACK_PERM TSval=1460270615 TSecr=0 WS=128
138,56.13348,192.168.11.13,192.168.11.8,TCP,74,0.007661,0.007661,"Jan  8, 2024 13:41:08.493692000 JST",,"6000  >  36070 [SYN, ACK] Seq=0 Ack=1 Win=65160 Len=0 MSS=1460 SACK_PERM TSval=650944056 TSecr=1460270615 WS=128"
139,56.133595,192.168.11.8,192.168.11.13,TCP,66,0.000115,0.000115,"Jan  8, 2024 13:41:08.493807000 JST",,36070  >  6000 [ACK] Seq=1 Ack=1 Win=64256 Len=0 TSval=1460270623 TSecr=650944056
140,56.133772,192.168.11.8,192.168.11.13,TCP,93,,0.000177,"Jan  8, 2024 13:41:08.493984000 JST",,"36070  >  6000 [PSH, ACK] Seq=1 Ack=1 Win=64256 Len=27 TSval=1460270623 TSecr=650944056 [TCP segment of a reassembled PDU]"
141,56.133867,192.168.11.8,192.168.11.13,TCP,66,,0.000095,"Jan  8, 2024 13:41:08.494079000 JST",,"36070  >  6000 [FIN, ACK] Seq=28 Ack=1 Win=64256 Len=0 TSval=1460270623 TSecr=650944056"
142,56.141476,192.168.11.13,192.168.11.8,TCP,66,0.007704,0.007609,"Jan  8, 2024 13:41:08.501688000 JST",,6000  >  36070 [ACK] Seq=1 Ack=28 Win=65152 Len=0 TSval=650944063 TSecr=1460270623
143,56.141709,192.168.11.13,192.168.11.8,TCP,66,0.007842,0.000233,"Jan  8, 2024 13:41:08.501921000 JST",,"6000  >  36070 [FIN, ACK] Seq=1 Ack=29 Win=65152 Len=0 TSval=650944065 TSecr=1460270623"
144,56.141767,192.168.11.8,192.168.11.13,TCP,66,0.000058,0.000058,"Jan  8, 2024 13:41:08.501979000 JST",,36070  >  6000 [ACK] Seq=29 Ack=2 Win=64256 Len=0 TSval=1460270631 TSecr=650944065
145,56.171702,192.168.11.8,255.255.255.255,UDP,209,,0.029935,"Jan  8, 2024 13:41:08.531914000 JST",7b2273656d616e74696373223a207b22656e74697479223a2022504944222c202262617365656e74697479223a2022616e79222c2022726f6c65223a2022646464222c20227370617469616c223a2022616e79222c202274656d706f72616c223a2022616e79227d2c20226461746170726f7065727479223a207b22666f726d6174223a2022696e616f6b615f70726f6772616d5f73616d706c655f73656d616e746963227d7d,35542  >  7000 Len=167
146,56.177412,192.168.11.23,192.168.11.8,TCP,74,,0.00571,"Jan  8, 2024 13:41:08.537624000 JST",,46248  >  6000 [SYN] Seq=0 Win=64240 Len=0 MSS=1460 SACK_PERM TSval=2533471167 TSecr=0 WS=128
147,56.177537,192.168.11.8,192.168.11.23,TCP,74,0.000125,0.000125,"Jan  8, 2024 13:41:08.537749000 JST",,"6000  >  46248 [SYN, ACK] Seq=0 Ack=1 Win=65160 Len=0 MSS=1460 SACK_PERM TSval=3529727271 TSecr=2533471167 WS=128"
148,56.184147,192.168.11.23,192.168.11.8,TCP,66,0.00661,0.00661,"Jan  8, 2024 13:41:08.544359000 JST",,46248  >  6000 [ACK] Seq=1 Ack=1 Win=64256 Len=0 TSval=2533471174 TSecr=3529727271
149,56.184778,192.168.11.23,192.168.11.8,TCP,93,,0.000631,"Jan  8, 2024 13:41:08.544990000 JST",,"46248  >  6000 [PSH, ACK] Seq=1 Ack=1 Win=64256 Len=27 TSval=2533471174 TSecr=3529727271 [TCP segment of a reassembled PDU]"
150,56.184889,192.168.11.8,192.168.11.23,TCP,66,0.000111,0.000111,"Jan  8, 2024 13:41:08.545101000 JST",,6000  >  46248 [ACK] Seq=1 Ack=28 Win=65152 Len=0 TSval=3529727278 TSecr=2533471174
151,56.184978,192.168.11.23,192.168.11.8,TCP,66,,0.000089,"Jan  8, 2024 13:41:08.545190000 JST",,"46248  >  6000 [FIN, ACK] Seq=28 Ack=1 Win=64256 Len=0 TSval=2533471174 TSecr=3529727271"
152,56.186477,192.168.11.8,192.168.11.23,TCP,66,0.001499,0.001499,"Jan  8, 2024 13:41:08.546689000 JST",,"6000  >  46248 [FIN, ACK] Seq=1 Ack=29 Win=65152 Len=0 TSval=3529727280 TSecr=2533471174"
153,56.191903,192.168.11.23,192.168.11.8,TCP,66,0.005426,0.005426,"Jan  8, 2024 13:41:08.552115000 JST",,46248  >  6000 [ACK] Seq=29 Ack=2 Win=64256 Len=0 TSval=2533471182 TSecr=3529727280
154,62.822933,192.168.11.8,192.168.11.13,TCP,74,,6.63103,"Jan  8, 2024 13:41:15.183145000 JST",,56832  >  6000 [SYN] Seq=0 Win=64240 Len=0 MSS=1460 SACK_PERM TSval=1460277312 TSecr=0 WS=128
155,62.830775,192.168.11.13,192.168.11.8,TCP,74,0.007842,0.007842,"Jan  8, 2024 13:41:15.190987000 JST",,"6000  >  56832 [SYN, ACK] Seq=0 Ack=1 Win=65160 Len=0 MSS=1460 SACK_PERM TSval=650950753 TSecr=1460277312 WS=128"
156,62.830914,192.168.11.8,192.168.11.13,TCP,66,0.000139,0.000139,"Jan  8, 2024 13:41:15.191126000 JST",,56832  >  6000 [ACK] Seq=1 Ack=1 Win=64256 Len=0 TSval=1460277320 TSecr=650950753
157,62.831095,192.168.11.8,192.168.11.13,TCP,93,,0.000181,"Jan  8, 2024 13:41:15.191307000 JST",,"56832  >  6000 [PSH, ACK] Seq=1 Ack=1 Win=64256 Len=27 TSval=1460277320 TSecr=650950753 [TCP segment of a reassembled PDU]"
158,62.8312,192.168.11.8,192.168.11.13,TCP,66,,0.000105,"Jan  8, 2024 13:41:15.191412000 JST",,"56832  >  6000 [FIN, ACK] Seq=28 Ack=1 Win=64256 Len=0 TSval=1460277320 TSecr=650950753"
159,62.838729,192.168.11.13,192.168.11.8,TCP,66,0.007634,0.007529,"Jan  8, 2024 13:41:15.198941000 JST",,6000  >  56832 [ACK] Seq=1 Ack=28 Win=65152 Len=0 TSval=650950761 TSecr=1460277320
160,62.840771,192.168.11.13,192.168.11.8,TCP,66,0.009571,0.002042,"Jan  8, 2024 13:41:15.200983000 JST",,"6000  >  56832 [FIN, ACK] Seq=1 Ack=29 Win=65152 Len=0 TSval=650950762 TSecr=1460277320"
161,62.840827,192.168.11.8,192.168.11.13,TCP,66,0.000056,0.000056,"Jan  8, 2024 13:41:15.201039000 JST",,56832  >  6000 [ACK] Seq=29 Ack=2 Win=64256 Len=0 TSval=1460277330 TSecr=650950762
162,62.869511,192.168.11.8,255.255.255.255,UDP,209,,0.028684,"Jan  8, 2024 13:41:15.229723000 JST",7b2273656d616e74696373223a207b22656e74697479223a2022504944222c202262617365656e74697479223a2022616e79222c2022726f6c65223a2022646464222c20227370617469616c223a2022616e79222c202274656d706f72616c223a2022616e79227d2c20226461746170726f7065727479223a207b22666f726d6174223a2022696e616f6b615f70726f6772616d5f73616d706c655f73656d616e746963227d7d,42561  >  7000 Len=167
163,62.87526,192.168.11.23,192.168.11.8,TCP,74,,0.005749,"Jan  8, 2024 13:41:15.235472000 JST",,36820  >  6000 [SYN] Seq=0 Win=64240 Len=0 MSS=1460 SACK_PERM TSval=2533477865 TSecr=0 WS=128
164,62.875404,192.168.11.8,192.168.11.23,TCP,74,0.000144,0.000144,"Jan  8, 2024 13:41:15.235616000 JST",,"6000  >  36820 [SYN, ACK] Seq=0 Ack=1 Win=65160 Len=0 MSS=1460 SACK_PERM TSval=3529733969 TSecr=2533477865 WS=128"
165,62.882301,192.168.11.23,192.168.11.8,TCP,66,0.006897,0.006897,"Jan  8, 2024 13:41:15.242513000 JST",,36820  >  6000 [ACK] Seq=1 Ack=1 Win=64256 Len=0 TSval=2533477872 TSecr=3529733969
166,62.882964,192.168.11.23,192.168.11.8,TCP,93,,0.000663,"Jan  8, 2024 13:41:15.243176000 JST",,"36820  >  6000 [PSH, ACK] Seq=1 Ack=1 Win=64256 Len=27 TSval=2533477872 TSecr=3529733969 [TCP segment of a reassembled PDU]"
167,62.883092,192.168.11.8,192.168.11.23,TCP,66,0.000128,0.000128,"Jan  8, 2024 13:41:15.243304000 JST",,6000  >  36820 [ACK] Seq=1 Ack=28 Win=65152 Len=0 TSval=3529733976 TSecr=2533477872
168,62.8834,192.168.11.23,192.168.11.8,TCP,66,,0.000308,"Jan  8, 2024 13:41:15.243612000 JST",,"36820  >  6000 [FIN, ACK] Seq=28 Ack=1 Win=64256 Len=0 TSval=2533477872 TSecr=3529733969"
169,62.884585,192.168.11.8,192.168.11.23,TCP,66,0.001185,0.001185,"Jan  8, 2024 13:41:15.244797000 JST",,"6000  >  36820 [FIN, ACK] Seq=1 Ack=29 Win=65152 Len=0 TSval=3529733978 TSecr=2533477872"
170,62.891086,192.168.11.23,192.168.11.8,TCP,66,0.006501,0.006501,"Jan  8, 2024 13:41:15.251298000 JST",,36820  >  6000 [ACK] Seq=29 Ack=2 Win=64256 Len=0 TSval=2533477880 TSecr=3529733978
171,122.841465,192.168.11.8,192.168.11.13,TCP,74,,59.950379,"Jan  8, 2024 13:42:15.201677000 JST",,36638  >  6000 [SYN] Seq=0 Win=64240 Len=0 MSS=1460 SACK_PERM TSval=1460337331 TSecr=0 WS=128
172,122.8492,192.168.11.13,192.168.11.8,TCP,74,0.007735,0.007735,"Jan  8, 2024 13:42:15.209412000 JST",,"6000  >  36638 [SYN, ACK] Seq=0 Ack=1 Win=65160 Len=0 MSS=1460 SACK_PERM TSval=651010771 TSecr=1460337331 WS=128"
173,122.849312,192.168.11.8,192.168.11.13,TCP,66,0.000112,0.000112,"Jan  8, 2024 13:42:15.209524000 JST",,36638  >  6000 [ACK] Seq=1 Ack=1 Win=64256 Len=0 TSval=1460337339 TSecr=651010771
174,122.849493,192.168.11.8,192.168.11.13,TCP,93,,0.000181,"Jan  8, 2024 13:42:15.209705000 JST",,"36638  >  6000 [PSH, ACK] Seq=1 Ack=1 Win=64256 Len=27 TSval=1460337339 TSecr=651010771 [TCP segment of a reassembled PDU]"
175,122.849595,192.168.11.8,192.168.11.13,TCP,66,,0.000102,"Jan  8, 2024 13:42:15.209807000 JST",,"36638  >  6000 [FIN, ACK] Seq=28 Ack=1 Win=64256 Len=0 TSval=1460337339 TSecr=651010771"
176,122.856972,192.168.11.13,192.168.11.8,TCP,66,0.007479,0.007377,"Jan  8, 2024 13:42:15.217184000 JST",,6000  >  36638 [ACK] Seq=1 Ack=28 Win=65152 Len=0 TSval=651010779 TSecr=1460337339
177,122.857356,192.168.11.13,192.168.11.8,TCP,66,0.007761,0.000384,"Jan  8, 2024 13:42:15.217568000 JST",,"6000  >  36638 [FIN, ACK] Seq=1 Ack=29 Win=65152 Len=0 TSval=651010780 TSecr=1460337339"
178,122.857403,192.168.11.8,192.168.11.13,TCP,66,0.000047,0.000047,"Jan  8, 2024 13:42:15.217615000 JST",,36638  >  6000 [ACK] Seq=29 Ack=2 Win=64256 Len=0 TSval=1460337347 TSecr=651010780
179,122.887217,192.168.11.8,255.255.255.255,UDP,209,,0.029814,"Jan  8, 2024 13:42:15.247429000 JST",7b2273656d616e74696373223a207b22656e74697479223a2022504944222c202262617365656e74697479223a2022616e79222c2022726f6c65223a2022646464222c20227370617469616c223a2022616e79222c202274656d706f72616c223a2022616e79227d2c20226461746170726f7065727479223a207b22666f726d6174223a2022696e616f6b615f70726f6772616d5f73616d706c655f73656d616e746963227d7d,41176  >  7000 Len=167
180,122.89321,192.168.11.23,192.168.11.8,TCP,74,,0.005993,"Jan  8, 2024 13:42:15.253422000 JST",,45540  >  6000 [SYN] Seq=0 Win=64240 Len=0 MSS=1460 SACK_PERM TSval=2533537883 TSecr=0 WS=128
181,122.893362,192.168.11.8,192.168.11.23,TCP,74,0.000152,0.000152,"Jan  8, 2024 13:42:15.253574000 JST",,"6000  >  45540 [SYN, ACK] Seq=0 Ack=1 Win=65160 Len=0 MSS=1460 SACK_PERM TSval=3529793987 TSecr=2533537883 WS=128"
182,122.899907,192.168.11.23,192.168.11.8,TCP,66,0.006545,0.006545,"Jan  8, 2024 13:42:15.260119000 JST",,45540  >  6000 [ACK] Seq=1 Ack=1 Win=64256 Len=0 TSval=2533537890 TSecr=3529793987
183,122.90041,192.168.11.23,192.168.11.8,TCP,93,,0.000503,"Jan  8, 2024 13:42:15.260622000 JST",,"45540  >  6000 [PSH, ACK] Seq=1 Ack=1 Win=64256 Len=27 TSval=2533537890 TSecr=3529793987 [TCP segment of a reassembled PDU]"
184,122.900481,192.168.11.8,192.168.11.23,TCP,66,0.000071,0.000071,"Jan  8, 2024 13:42:15.260693000 JST",,6000  >  45540 [ACK] Seq=1 Ack=28 Win=65152 Len=0 TSval=3529793994 TSecr=2533537890
185,122.900542,192.168.11.23,192.168.11.8,TCP,66,,0.000061,"Jan  8, 2024 13:42:15.260754000 JST",,"45540  >  6000 [FIN, ACK] Seq=28 Ack=1 Win=64256 Len=0 TSval=2533537890 TSecr=3529793987"
186,122.90163,192.168.11.8,192.168.11.23,TCP,66,0.001088,0.001088,"Jan  8, 2024 13:42:15.261842000 JST",,"6000  >  45540 [FIN, ACK] Seq=1 Ack=29 Win=65152 Len=0 TSval=3529793995 TSecr=2533537890"
187,122.90803,192.168.11.23,192.168.11.8,TCP,66,0.0064,0.0064,"Jan  8, 2024 13:42:15.268242000 JST",,45540  >  6000 [ACK] Seq=29 Ack=2 Win=64256 Len=0 TSval=2533537897 TSecr=3529793995
