"No.","Time","Source","Destination","Protocol","Length","The RTT to ACK the segment was","Time delta from previous captured frame","Arrival Time","Data","Info"
"1","0.000000","192.168.11.23","192.168.11.8","TCP","74","","0.000000000","Jan  8, 2024 13:40:12.498886000 JST","","59592  >  6000 [SYN] Seq=0 Win=64240 Len=0 MSS=1460 SACK_PERM TSval=2533415050 TSecr=0 WS=128"
"2","0.006617","192.168.11.8","192.168.11.23","TCP","74","0.006617000","0.006617000","Jan  8, 2024 13:40:12.505503000 JST","","6000  >  59592 [SYN, ACK] Seq=0 Ack=1 Win=65160 Len=0 MSS=1460 SACK_PERM TSval=3529671154 TSecr=2533415050 WS=128"
"3","0.006727","192.168.11.23","192.168.11.8","TCP","66","0.000110000","0.000110000","Jan  8, 2024 13:40:12.505613000 JST","","59592  >  6000 [ACK] Seq=1 Ack=1 Win=64256 Len=0 TSval=2533415057 TSecr=3529671154"
"4","0.006934","192.168.11.23","192.168.11.8","TCP","93","","0.000207000","Jan  8, 2024 13:40:12.505820000 JST","","59592  >  6000 [PSH, ACK] Seq=1 Ack=1 Win=64256 Len=27 TSval=2533415057 TSecr=3529671154 [TCP segment of a reassembled PDU]"
"5","0.007051","192.168.11.23","192.168.11.8","TCP","66","","0.000117000","Jan  8, 2024 13:40:12.505937000 JST","","59592  >  6000 [FIN, ACK] Seq=28 Ack=1 Win=64256 Len=0 TSval=2533415057 TSecr=3529671154"
"6","0.013879","192.168.11.8","192.168.11.23","TCP","66","0.006945000","0.006828000","Jan  8, 2024 13:40:12.512765000 JST","","6000  >  59592 [ACK] Seq=1 Ack=28 Win=65152 Len=0 TSval=3529671161 TSecr=2533415057"
"7","0.014089","192.168.11.8","192.168.11.23","TCP","66","0.007038000","0.000210000","Jan  8, 2024 13:40:12.512975000 JST","","6000  >  59592 [FIN, ACK] Seq=1 Ack=29 Win=65152 Len=0 TSval=3529671163 TSecr=2533415057"
"8","0.014134","192.168.11.23","192.168.11.8","TCP","66","0.000045000","0.000045000","Jan  8, 2024 13:40:12.513020000 JST","","59592  >  6000 [ACK] Seq=29 Ack=2 Win=64256 Len=0 TSval=2533415064 TSecr=3529671163"
"9","0.050940","192.168.11.23","255.255.255.255","UDP","209","","0.036806000","Jan  8, 2024 13:40:12.549826000 JST","7b2273656d616e74696373223a207b22656e74697479223a2022504944222c202262617365656e74697479223a2022616e79222c2022726f6c65223a2022656565222c20227370617469616c223a2022616e79222c202274656d706f72616c223a2022616e79227d2c20226461746170726f7065727479223a207b22666f726d6174223a2022696e616f6b615f70726f6772616d5f73616d706c655f73656d616e746963227d7d","45595  >  7000 Len=167"
"10","0.057243","192.168.11.9","192.168.11.23","TCP","74","","0.006303000","Jan  8, 2024 13:40:12.556129000 JST","","51712  >  6000 [SYN] Seq=0 Win=64240 Len=0 MSS=1460 SACK_PERM TSval=2557068039 TSecr=0 WS=128"
"11","0.057412","192.168.11.23","192.168.11.9","TCP","74","0.000169000","0.000169000","Jan  8, 2024 13:40:12.556298000 JST","","6000  >  51712 [SYN, ACK] Seq=0 Ack=1 Win=65160 Len=0 MSS=1460 SACK_PERM TSval=4294462720 TSecr=2557068039 WS=128"
"12","0.065100","192.168.11.9","192.168.11.23","TCP","66","0.007688000","0.007688000","Jan  8, 2024 13:40:12.563986000 JST","","51712  >  6000 [ACK] Seq=1 Ack=1 Win=64256 Len=0 TSval=2557068047 TSecr=4294462720"
"13","0.065565","192.168.11.9","192.168.11.23","TCP","93","","0.000465000","Jan  8, 2024 13:40:12.564451000 JST","","51712  >  6000 [PSH, ACK] Seq=1 Ack=1 Win=64256 Len=27 TSval=2557068047 TSecr=4294462720 [TCP segment of a reassembled PDU]"
"14","0.065640","192.168.11.23","192.168.11.9","TCP","66","0.000075000","0.000075000","Jan  8, 2024 13:40:12.564526000 JST","","6000  >  51712 [ACK] Seq=1 Ack=28 Win=65152 Len=0 TSval=4294462729 TSecr=2557068047"
"15","0.065697","192.168.11.9","192.168.11.23","TCP","66","","0.000057000","Jan  8, 2024 13:40:12.564583000 JST","","51712  >  6000 [FIN, ACK] Seq=28 Ack=1 Win=64256 Len=0 TSval=2557068047 TSecr=4294462720"
"16","0.066974","192.168.11.23","192.168.11.9","TCP","66","0.001277000","0.001277000","Jan  8, 2024 13:40:12.565860000 JST","","6000  >  51712 [FIN, ACK] Seq=1 Ack=29 Win=65152 Len=0 TSval=4294462730 TSecr=2557068047"
"17","0.072833","192.168.11.9","192.168.11.23","TCP","66","0.005859000","0.005859000","Jan  8, 2024 13:40:12.571719000 JST","","51712  >  6000 [ACK] Seq=29 Ack=2 Win=64256 Len=0 TSval=2557068054 TSecr=4294462730"
"18","6.853176","192.168.11.23","192.168.11.8","TCP","74","","6.780343000","Jan  8, 2024 13:40:19.352062000 JST","","59604  >  6000 [SYN] Seq=0 Win=64240 Len=0 MSS=1460 SACK_PERM TSval=2533421903 TSecr=0 WS=128"
"19","6.861332","192.168.11.8","192.168.11.23","TCP","74","0.008156000","0.008156000","Jan  8, 2024 13:40:19.360218000 JST","","6000  >  59604 [SYN, ACK] Seq=0 Ack=1 Win=65160 Len=0 MSS=1460 SACK_PERM TSval=3529678007 TSecr=2533421903 WS=128"
"20","6.861460","192.168.11.23","192.168.11.8","TCP","66","0.000128000","0.000128000","Jan  8, 2024 13:40:19.360346000 JST","","59604  >  6000 [ACK] Seq=1 Ack=1 Win=64256 Len=0 TSval=2533421912 TSecr=3529678007"
"21","6.861700","192.168.11.23","192.168.11.8","TCP","93","","0.000240000","Jan  8, 2024 13:40:19.360586000 JST","","59604  >  6000 [PSH, ACK] Seq=1 Ack=1 Win=64256 Len=27 TSval=2533421912 TSecr=3529678007 [TCP segment of a reassembled PDU]"
"22","6.861850","192.168.11.23","192.168.11.8","TCP","66","","0.000150000","Jan  8, 2024 13:40:19.360736000 JST","","59604  >  6000 [FIN, ACK] Seq=28 Ack=1 Win=64256 Len=0 TSval=2533421912 TSecr=3529678007"
"23","6.869224","192.168.11.8","192.168.11.23","TCP","66","0.007524000","0.007374000","Jan  8, 2024 13:40:19.368110000 JST","","6000  >  59604 [ACK] Seq=1 Ack=28 Win=65152 Len=0 TSval=3529678017 TSecr=2533421912"
"24","6.869710","192.168.11.8","192.168.11.23","TCP","66","0.007860000","0.000486000","Jan  8, 2024 13:40:19.368596000 JST","","6000  >  59604 [FIN, ACK] Seq=1 Ack=29 Win=65152 Len=0 TSval=3529678018 TSecr=2533421912"
"25","6.869768","192.168.11.23","192.168.11.8","TCP","66","0.000058000","0.000058000","Jan  8, 2024 13:40:19.368654000 JST","","59604  >  6000 [ACK] Seq=29 Ack=2 Win=64256 Len=0 TSval=2533421920 TSecr=3529678018"
"26","6.898255","192.168.11.23","255.255.255.255","UDP","209","","0.028487000","Jan  8, 2024 13:40:19.397141000 JST","7b2273656d616e74696373223a207b22656e74697479223a2022504944222c202262617365656e74697479223a2022616e79222c2022726f6c65223a2022656565222c20227370617469616c223a2022616e79222c202274656d706f72616c223a2022616e79227d2c20226461746170726f7065727479223a207b22666f726d6174223a2022696e616f6b615f70726f6772616d5f73616d706c655f73656d616e746963227d7d","44008  >  7000 Len=167"
"27","6.904070","192.168.11.9","192.168.11.23","TCP","74","","0.005815000","Jan  8, 2024 13:40:19.402956000 JST","","56984  >  6000 [SYN] Seq=0 Win=64240 Len=0 MSS=1460 SACK_PERM TSval=2557074886 TSecr=0 WS=128"
"28","6.904200","192.168.11.23","192.168.11.9","TCP","74","0.000130000","0.000130000","Jan  8, 2024 13:40:19.403086000 JST","","6000  >  56984 [SYN, ACK] Seq=0 Ack=1 Win=65160 Len=0 MSS=1460 SACK_PERM TSval=4294469567 TSecr=2557074886 WS=128"
"29","6.910880","192.168.11.9","192.168.11.23","TCP","66","0.006680000","0.006680000","Jan  8, 2024 13:40:19.409766000 JST","","56984  >  6000 [ACK] Seq=1 Ack=1 Win=64256 Len=0 TSval=2557074893 TSecr=4294469567"
"30","6.911460","192.168.11.9","192.168.11.23","TCP","93","","0.000580000","Jan  8, 2024 13:40:19.410346000 JST","","56984  >  6000 [PSH, ACK] Seq=1 Ack=1 Win=64256 Len=27 TSval=2557074893 TSecr=4294469567 [TCP segment of a reassembled PDU]"
"31","6.911586","192.168.11.23","192.168.11.9","TCP","66","0.000126000","0.000126000","Jan  8, 2024 13:40:19.410472000 JST","","6000  >  56984 [ACK] Seq=1 Ack=28 Win=65152 Len=0 TSval=4294469575 TSecr=2557074893"
"32","6.911662","192.168.11.9","192.168.11.23","TCP","66","","0.000076000","Jan  8, 2024 13:40:19.410548000 JST","","56984  >  6000 [FIN, ACK] Seq=28 Ack=1 Win=64256 Len=0 TSval=2557074893 TSecr=4294469567"
"33","6.912889","192.168.11.23","192.168.11.9","TCP","66","0.001227000","0.001227000","Jan  8, 2024 13:40:19.411775000 JST","","6000  >  56984 [FIN, ACK] Seq=1 Ack=29 Win=65152 Len=0 TSval=4294469576 TSecr=2557074893"
"34","6.919305","192.168.11.9","192.168.11.23","TCP","66","0.006416000","0.006416000","Jan  8, 2024 13:40:19.418191000 JST","","56984  >  6000 [ACK] Seq=29 Ack=2 Win=64256 Len=0 TSval=2557074901 TSecr=4294469576"
"35","13.726181","192.168.11.23","192.168.11.8","TCP","74","","6.806876000","Jan  8, 2024 13:40:26.225067000 JST","","55004  >  6000 [SYN] Seq=0 Win=64240 Len=0 MSS=1460 SACK_PERM TSval=2533428776 TSecr=0 WS=128"
"36","13.735169","192.168.11.8","192.168.11.23","TCP","74","0.008988000","0.008988000","Jan  8, 2024 13:40:26.234055000 JST","","6000  >  55004 [SYN, ACK] Seq=0 Ack=1 Win=65160 Len=0 MSS=1460 SACK_PERM TSval=3529684882 TSecr=2533428776 WS=128"
"37","13.735287","192.168.11.23","192.168.11.8","TCP","66","0.000118000","0.000118000","Jan  8, 2024 13:40:26.234173000 JST","","55004  >  6000 [ACK] Seq=1 Ack=1 Win=64256 Len=0 TSval=2533428785 TSecr=3529684882"
"38","13.735453","192.168.11.23","192.168.11.8","TCP","93","","0.000166000","Jan  8, 2024 13:40:26.234339000 JST","","55004  >  6000 [PSH, ACK] Seq=1 Ack=1 Win=64256 Len=27 TSval=2533428786 TSecr=3529684882 [TCP segment of a reassembled PDU]"
"39","13.735556","192.168.11.23","192.168.11.8","TCP","66","","0.000103000","Jan  8, 2024 13:40:26.234442000 JST","","55004  >  6000 [FIN, ACK] Seq=28 Ack=1 Win=64256 Len=0 TSval=2533428786 TSecr=3529684882"
"40","13.742870","192.168.11.8","192.168.11.23","TCP","66","0.007417000","0.007314000","Jan  8, 2024 13:40:26.241756000 JST","","6000  >  55004 [ACK] Seq=1 Ack=28 Win=65152 Len=0 TSval=3529684890 TSecr=2533428786"
"41","13.743087","192.168.11.8","192.168.11.23","TCP","66","0.007531000","0.000217000","Jan  8, 2024 13:40:26.241973000 JST","","6000  >  55004 [FIN, ACK] Seq=1 Ack=29 Win=65152 Len=0 TSval=3529684891 TSecr=2533428786"
"42","13.743130","192.168.11.23","192.168.11.8","TCP","66","0.000043000","0.000043000","Jan  8, 2024 13:40:26.242016000 JST","","55004  >  6000 [ACK] Seq=29 Ack=2 Win=64256 Len=0 TSval=2533428793 TSecr=3529684891"
"43","13.772481","192.168.11.23","255.255.255.255","UDP","209","","0.029351000","Jan  8, 2024 13:40:26.271367000 JST","7b2273656d616e74696373223a207b22656e74697479223a2022504944222c202262617365656e74697479223a2022616e79222c2022726f6c65223a2022656565222c20227370617469616c223a2022616e79222c202274656d706f72616c223a2022616e79227d2c20226461746170726f7065727479223a207b22666f726d6174223a2022696e616f6b615f70726f6772616d5f73616d706c655f73656d616e746963227d7d","58241  >  7000 Len=167"
"44","13.778198","192.168.11.9","192.168.11.23","TCP","74","","0.005717000","Jan  8, 2024 13:40:26.277084000 JST","","47542  >  6000 [SYN] Seq=0 Win=64240 Len=0 MSS=1460 SACK_PERM TSval=2557081760 TSecr=0 WS=128"
"45","13.778323","192.168.11.23","192.168.11.9","TCP","74","0.000125000","0.000125000","Jan  8, 2024 13:40:26.277209000 JST","","6000  >  47542 [SYN, ACK] Seq=0 Ack=1 Win=65160 Len=0 MSS=1460 SACK_PERM TSval=4294476441 TSecr=2557081760 WS=128"
"46","13.785204","192.168.11.9","192.168.11.23","TCP","66","0.006881000","0.006881000","Jan  8, 2024 13:40:26.284090000 JST","","47542  >  6000 [ACK] Seq=1 Ack=1 Win=64256 Len=0 TSval=2557081767 TSecr=4294476441"
"47","13.785856","192.168.11.9","192.168.11.23","TCP","93","","0.000652000","Jan  8, 2024 13:40:26.284742000 JST","","47542  >  6000 [PSH, ACK] Seq=1 Ack=1 Win=64256 Len=27 TSval=2557081767 TSecr=4294476441 [TCP segment of a reassembled PDU]"
"48","13.785974","192.168.11.23","192.168.11.9","TCP","66","0.000118000","0.000118000","Jan  8, 2024 13:40:26.284860000 JST","","6000  >  47542 [ACK] Seq=1 Ack=28 Win=65152 Len=0 TSval=4294476449 TSecr=2557081767"
"49","13.786057","192.168.11.9","192.168.11.23","TCP","66","","0.000083000","Jan  8, 2024 13:40:26.284943000 JST","","47542  >  6000 [FIN, ACK] Seq=28 Ack=1 Win=64256 Len=0 TSval=2557081767 TSecr=4294476441"
"50","13.787514","192.168.11.23","192.168.11.9","TCP","66","0.001457000","0.001457000","Jan  8, 2024 13:40:26.286400000 JST","","6000  >  47542 [FIN, ACK] Seq=1 Ack=29 Win=65152 Len=0 TSval=4294476451 TSecr=2557081767"
"51","13.792466","192.168.11.9","192.168.11.23","TCP","66","0.004952000","0.004952000","Jan  8, 2024 13:40:26.291352000 JST","","47542  >  6000 [ACK] Seq=29 Ack=2 Win=64256 Len=0 TSval=2557081775 TSecr=4294476451"
"52","21.431874","192.168.11.23","192.168.11.8","TCP","74","","7.639408000","Jan  8, 2024 13:40:33.930760000 JST","","51370  >  6000 [SYN] Seq=0 Win=64240 Len=0 MSS=1460 SACK_PERM TSval=2533436482 TSecr=0 WS=128"
"53","21.441033","192.168.11.8","192.168.11.23","TCP","74","0.009159000","0.009159000","Jan  8, 2024 13:40:33.939919000 JST","","6000  >  51370 [SYN, ACK] Seq=0 Ack=1 Win=65160 Len=0 MSS=1460 SACK_PERM TSval=3529692587 TSecr=2533436482 WS=128"
"54","21.441139","192.168.11.23","192.168.11.8","TCP","66","0.000106000","0.000106000","Jan  8, 2024 13:40:33.940025000 JST","","51370  >  6000 [ACK] Seq=1 Ack=1 Win=64256 Len=0 TSval=2533436491 TSecr=3529692587"
"55","21.441280","192.168.11.23","192.168.11.8","TCP","93","","0.000141000","Jan  8, 2024 13:40:33.940166000 JST","","51370  >  6000 [PSH, ACK] Seq=1 Ack=1 Win=64256 Len=27 TSval=2533436491 TSecr=3529692587 [TCP segment of a reassembled PDU]"
"56","21.441541","192.168.11.23","192.168.11.8","TCP","66","","0.000261000","Jan  8, 2024 13:40:33.940427000 JST","","51370  >  6000 [FIN, ACK] Seq=28 Ack=1 Win=64256 Len=0 TSval=2533436492 TSecr=3529692587"
"57","21.448878","192.168.11.8","192.168.11.23","TCP","66","0.007598000","0.007337000","Jan  8, 2024 13:40:33.947764000 JST","","6000  >  51370 [ACK] Seq=1 Ack=28 Win=65152 Len=0 TSval=3529692596 TSecr=2533436491"
"58","21.449093","192.168.11.8","192.168.11.23","TCP","66","0.007552000","0.000215000","Jan  8, 2024 13:40:33.947979000 JST","","6000  >  51370 [FIN, ACK] Seq=1 Ack=29 Win=65152 Len=0 TSval=3529692598 TSecr=2533436492"
"59","21.449136","192.168.11.23","192.168.11.8","TCP","66","0.000043000","0.000043000","Jan  8, 2024 13:40:33.948022000 JST","","51370  >  6000 [ACK] Seq=29 Ack=2 Win=64256 Len=0 TSval=2533436499 TSecr=3529692598"
"60","21.479315","192.168.11.23","255.255.255.255","UDP","209","","0.030179000","Jan  8, 2024 13:40:33.978201000 JST","7b2273656d616e74696373223a207b22656e74697479223a2022504944222c202262617365656e74697479223a2022616e79222c2022726f6c65223a2022656565222c20227370617469616c223a2022616e79222c202274656d706f72616c223a2022616e79227d2c20226461746170726f7065727479223a207b22666f726d6174223a2022696e616f6b615f70726f6772616d5f73616d706c655f73656d616e746963227d7d","59196  >  7000 Len=167"
"61","21.484673","192.168.11.9","192.168.11.23","TCP","74","","0.005358000","Jan  8, 2024 13:40:33.983559000 JST","","47554  >  6000 [SYN] Seq=0 Win=64240 Len=0 MSS=1460 SACK_PERM TSval=2557089466 TSecr=0 WS=128"
"62","21.484790","192.168.11.23","192.168.11.9","TCP","74","0.000117000","0.000117000","Jan  8, 2024 13:40:33.983676000 JST","","6000  >  47554 [SYN, ACK] Seq=0 Ack=1 Win=65160 Len=0 MSS=1460 SACK_PERM TSval=4294484148 TSecr=2557089466 WS=128"
"63","21.491334","192.168.11.9","192.168.11.23","TCP","66","0.006544000","0.006544000","Jan  8, 2024 13:40:33.990220000 JST","","47554  >  6000 [ACK] Seq=1 Ack=1 Win=64256 Len=0 TSval=2557089473 TSecr=4294484148"
"64","21.491961","192.168.11.9","192.168.11.23","TCP","93","","0.000627000","Jan  8, 2024 13:40:33.990847000 JST","","47554  >  6000 [PSH, ACK] Seq=1 Ack=1 Win=64256 Len=27 TSval=2557089473 TSecr=4294484148 [TCP segment of a reassembled PDU]"
"65","21.492064","192.168.11.23","192.168.11.9","TCP","66","0.000103000","0.000103000","Jan  8, 2024 13:40:33.990950000 JST","","6000  >  47554 [ACK] Seq=1 Ack=28 Win=65152 Len=0 TSval=4294484155 TSecr=2557089473"
"66","21.492145","192.168.11.9","192.168.11.23","TCP","66","","0.000081000","Jan  8, 2024 13:40:33.991031000 JST","","47554  >  6000 [FIN, ACK] Seq=28 Ack=1 Win=64256 Len=0 TSval=2557089473 TSecr=4294484148"
"67","21.493364","192.168.11.23","192.168.11.9","TCP","66","0.001219000","0.001219000","Jan  8, 2024 13:40:33.992250000 JST","","6000  >  47554 [FIN, ACK] Seq=1 Ack=29 Win=65152 Len=0 TSval=4294484156 TSecr=2557089473"
"68","21.497864","192.168.11.9","192.168.11.23","TCP","66","0.004500000","0.004500000","Jan  8, 2024 13:40:33.996750000 JST","","47554  >  6000 [ACK] Seq=29 Ack=2 Win=64256 Len=0 TSval=2557089480 TSecr=4294484156"
"69","29.157938","192.168.11.23","192.168.11.8","TCP","74","","7.660074000","Jan  8, 2024 13:40:41.656824000 JST","","36496  >  6000 [SYN] Seq=0 Win=64240 Len=0 MSS=1460 SACK_PERM TSval=2533444208 TSecr=0 WS=128"
"70","29.166640","192.168.11.8","192.168.11.23","TCP","74","0.008702000","0.008702000","Jan  8, 2024 13:40:41.665526000 JST","","6000  >  36496 [SYN, ACK] Seq=0 Ack=1 Win=65160 Len=0 MSS=1460 SACK_PERM TSval=3529700313 TSecr=2533444208 WS=128"
"71","29.166769","192.168.11.23","192.168.11.8","TCP","66","0.000129000","0.000129000","Jan  8, 2024 13:40:41.665655000 JST","","36496  >  6000 [ACK] Seq=1 Ack=1 Win=64256 Len=0 TSval=2533444217 TSecr=3529700313"
"72","29.166906","192.168.11.23","192.168.11.8","TCP","93","","0.000137000","Jan  8, 2024 13:40:41.665792000 JST","","36496  >  6000 [PSH, ACK] Seq=1 Ack=1 Win=64256 Len=27 TSval=2533444217 TSecr=3529700313 [TCP segment of a reassembled PDU]"
"73","29.167027","192.168.11.23","192.168.11.8","TCP","66","","0.000121000","Jan  8, 2024 13:40:41.665913000 JST","","36496  >  6000 [FIN, ACK] Seq=28 Ack=1 Win=64256 Len=0 TSval=2533444217 TSecr=3529700313"
"74","29.174242","192.168.11.8","192.168.11.23","TCP","66","0.007336000","0.007215000","Jan  8, 2024 13:40:41.673128000 JST","","6000  >  36496 [ACK] Seq=1 Ack=28 Win=65152 Len=0 TSval=3529700321 TSecr=2533444217"
"75","29.174617","192.168.11.8","192.168.11.23","TCP","66","0.007590000","0.000375000","Jan  8, 2024 13:40:41.673503000 JST","","6000  >  36496 [FIN, ACK] Seq=1 Ack=29 Win=65152 Len=0 TSval=3529700323 TSecr=2533444217"
"76","29.174673","192.168.11.23","192.168.11.8","TCP","66","0.000056000","0.000056000","Jan  8, 2024 13:40:41.673559000 JST","","36496  >  6000 [ACK] Seq=29 Ack=2 Win=64256 Len=0 TSval=2533444225 TSecr=3529700323"
"77","29.203053","192.168.11.23","255.255.255.255","UDP","209","","0.028380000","Jan  8, 2024 13:40:41.701939000 JST","7b2273656d616e74696373223a207b22656e74697479223a2022504944222c202262617365656e74697479223a2022616e79222c2022726f6c65223a2022656565222c20227370617469616c223a2022616e79222c202274656d706f72616c223a2022616e79227d2c20226461746170726f7065727479223a207b22666f726d6174223a2022696e616f6b615f70726f6772616d5f73616d706c655f73656d616e746963227d7d","47883  >  7000 Len=167"
"78","29.208755","192.168.11.9","192.168.11.23","TCP","74","","0.005702000","Jan  8, 2024 13:40:41.707641000 JST","","45326  >  6000 [SYN] Seq=0 Win=64240 Len=0 MSS=1460 SACK_PERM TSval=2557097190 TSecr=0 WS=128"
"79","29.208896","192.168.11.23","192.168.11.9","TCP","74","0.000141000","0.000141000","Jan  8, 2024 13:40:41.707782000 JST","","6000  >  45326 [SYN, ACK] Seq=0 Ack=1 Win=65160 Len=0 MSS=1460 SACK_PERM TSval=4294491872 TSecr=2557097190 WS=128"
"80","29.215550","192.168.11.9","192.168.11.23","TCP","66","0.006654000","0.006654000","Jan  8, 2024 13:40:41.714436000 JST","","45326  >  6000 [ACK] Seq=1 Ack=1 Win=64256 Len=0 TSval=2557097197 TSecr=4294491872"
"81","29.216115","192.168.11.9","192.168.11.23","TCP","93","","0.000565000","Jan  8, 2024 13:40:41.715001000 JST","","45326  >  6000 [PSH, ACK] Seq=1 Ack=1 Win=64256 Len=27 TSval=2557097197 TSecr=4294491872 [TCP segment of a reassembled PDU]"
"82","29.216204","192.168.11.23","192.168.11.9","TCP","66","0.000089000","0.000089000","Jan  8, 2024 13:40:41.715090000 JST","","6000  >  45326 [ACK] Seq=1 Ack=28 Win=65152 Len=0 TSval=4294491879 TSecr=2557097197"
"83","29.216269","192.168.11.9","192.168.11.23","TCP","66","","0.000065000","Jan  8, 2024 13:40:41.715155000 JST","","45326  >  6000 [FIN, ACK] Seq=28 Ack=1 Win=64256 Len=0 TSval=2557097197 TSecr=4294491872"
"84","29.217300","192.168.11.23","192.168.11.9","TCP","66","0.001031000","0.001031000","Jan  8, 2024 13:40:41.716186000 JST","","6000  >  45326 [FIN, ACK] Seq=1 Ack=29 Win=65152 Len=0 TSval=4294491880 TSecr=2557097197"
"85","29.223409","192.168.11.9","192.168.11.23","TCP","66","0.006109000","0.006109000","Jan  8, 2024 13:40:41.722295000 JST","","45326  >  6000 [ACK] Seq=29 Ack=2 Win=64256 Len=0 TSval=2557097205 TSecr=4294491880"
"86","35.903296","192.168.11.23","192.168.11.8","TCP","74","","6.679887000","Jan  8, 2024 13:40:48.402182000 JST","","36508  >  6000 [SYN] Seq=0 Win=64240 Len=0 MSS=1460 SACK_PERM TSval=2533450953 TSecr=0 WS=128"
"87","35.910995","192.168.11.8","192.168.11.23","TCP","74","0.007699000","0.007699000","Jan  8, 2024 13:40:48.409881000 JST","","6000  >  36508 [SYN, ACK] Seq=0 Ack=1 Win=65160 Len=0 MSS=1460 SACK_PERM TSval=3529707057 TSecr=2533450953 WS=128"
"88","35.911104","192.168.11.23","192.168.11.8","TCP","66","0.000109000","0.000109000","Jan  8, 2024 13:40:48.409990000 JST","","36508  >  6000 [ACK] Seq=1 Ack=1 Win=64256 Len=0 TSval=2533450961 TSecr=3529707057"
"89","35.911239","192.168.11.23","192.168.11.8","TCP","93","","0.000135000","Jan  8, 2024 13:40:48.410125000 JST","","36508  >  6000 [PSH, ACK] Seq=1 Ack=1 Win=64256 Len=27 TSval=2533450961 TSecr=3529707057 [TCP segment of a reassembled PDU]"
"90","35.911344","192.168.11.23","192.168.11.8","TCP","66","","0.000105000","Jan  8, 2024 13:40:48.410230000 JST","","36508  >  6000 [FIN, ACK] Seq=28 Ack=1 Win=64256 Len=0 TSval=2533450961 TSecr=3529707057"
"91","35.918537","192.168.11.8","192.168.11.23","TCP","66","0.007298000","0.007193000","Jan  8, 2024 13:40:48.417423000 JST","","6000  >  36508 [ACK] Seq=1 Ack=28 Win=65152 Len=0 TSval=3529707066 TSecr=2533450961"
"92","35.918783","192.168.11.8","192.168.11.23","TCP","66","0.007439000","0.000246000","Jan  8, 2024 13:40:48.417669000 JST","","6000  >  36508 [FIN, ACK] Seq=1 Ack=29 Win=65152 Len=0 TSval=3529707067 TSecr=2533450961"
"93","35.918828","192.168.11.23","192.168.11.8","TCP","66","0.000045000","0.000045000","Jan  8, 2024 13:40:48.417714000 JST","","36508  >  6000 [ACK] Seq=29 Ack=2 Win=64256 Len=0 TSval=2533450969 TSecr=3529707067"
"94","35.950080","192.168.11.23","255.255.255.255","UDP","209","","0.031252000","Jan  8, 2024 13:40:48.448966000 JST","7b2273656d616e74696373223a207b22656e74697479223a2022504944222c202262617365656e74697479223a2022616e79222c2022726f6c65223a2022656565222c20227370617469616c223a2022616e79222c202274656d706f72616c223a2022616e79227d2c20226461746170726f7065727479223a207b22666f726d6174223a2022696e616f6b615f70726f6772616d5f73616d706c655f73656d616e746963227d7d","44781  >  7000 Len=167"
"95","35.956832","192.168.11.9","192.168.11.23","TCP","74","","0.006752000","Jan  8, 2024 13:40:48.455718000 JST","","45942  >  6000 [SYN] Seq=0 Win=64240 Len=0 MSS=1460 SACK_PERM TSval=2557103937 TSecr=0 WS=128"
"96","35.956973","192.168.11.23","192.168.11.9","TCP","74","0.000141000","0.000141000","Jan  8, 2024 13:40:48.455859000 JST","","6000  >  45942 [SYN, ACK] Seq=0 Ack=1 Win=65160 Len=0 MSS=1460 SACK_PERM TSval=4294498620 TSecr=2557103937 WS=128"
"97","35.964020","192.168.11.9","192.168.11.23","TCP","66","0.007047000","0.007047000","Jan  8, 2024 13:40:48.462906000 JST","","45942  >  6000 [ACK] Seq=1 Ack=1 Win=64256 Len=0 TSval=2557103945 TSecr=4294498620"
"98","35.964719","192.168.11.9","192.168.11.23","TCP","93","","0.000699000","Jan  8, 2024 13:40:48.463605000 JST","","45942  >  6000 [PSH, ACK] Seq=1 Ack=1 Win=64256 Len=27 TSval=2557103946 TSecr=4294498620 [TCP segment of a reassembled PDU]"
"99","35.964827","192.168.11.23","192.168.11.9","TCP","66","0.000108000","0.000108000","Jan  8, 2024 13:40:48.463713000 JST","","6000  >  45942 [ACK] Seq=1 Ack=28 Win=65152 Len=0 TSval=4294498628 TSecr=2557103946"
"100","35.964903","192.168.11.9","192.168.11.23","TCP","66","","0.000076000","Jan  8, 2024 13:40:48.463789000 JST","","45942  >  6000 [FIN, ACK] Seq=28 Ack=1 Win=64256 Len=0 TSval=2557103946 TSecr=4294498620"
"101","35.966439","192.168.11.23","192.168.11.9","TCP","66","0.001536000","0.001536000","Jan  8, 2024 13:40:48.465325000 JST","","6000  >  45942 [FIN, ACK] Seq=1 Ack=29 Win=65152 Len=0 TSval=4294498629 TSecr=2557103946"
"102","35.971851","192.168.11.9","192.168.11.23","TCP","66","0.005412000","0.005412000","Jan  8, 2024 13:40:48.470737000 JST","","45942  >  6000 [ACK] Seq=29 Ack=2 Win=64256 Len=0 TSval=2557103954 TSecr=4294498629"
"103","42.656179","192.168.11.23","192.168.11.8","TCP","74","","6.684328000","Jan  8, 2024 13:40:55.155065000 JST","","60928  >  6000 [SYN] Seq=0 Win=64240 Len=0 MSS=1460 SACK_PERM TSval=2533457706 TSecr=0 WS=128"
"104","42.662968","192.168.11.8","192.168.11.23","TCP","74","0.006789000","0.006789000","Jan  8, 2024 13:40:55.161854000 JST","","6000  >  60928 [SYN, ACK] Seq=0 Ack=1 Win=65160 Len=0 MSS=1460 SACK_PERM TSval=3529713810 TSecr=2533457706 WS=128"
"105","42.663105","192.168.11.23","192.168.11.8","TCP","66","0.000137000","0.000137000","Jan  8, 2024 13:40:55.161991000 JST","","60928  >  6000 [ACK] Seq=1 Ack=1 Win=64256 Len=0 TSval=2533457713 TSecr=3529713810"
"106","42.663286","192.168.11.23","192.168.11.8","TCP","93","","0.000181000","Jan  8, 2024 13:40:55.162172000 JST","","60928  >  6000 [PSH, ACK] Seq=1 Ack=1 Win=64256 Len=27 TSval=2533457713 TSecr=3529713810 [TCP segment of a reassembled PDU]"
"107","42.663387","192.168.11.23","192.168.11.8","TCP","66","","0.000101000","Jan  8, 2024 13:40:55.162273000 JST","","60928  >  6000 [FIN, ACK] Seq=28 Ack=1 Win=64256 Len=0 TSval=2533457713 TSecr=3529713810"
"108","42.670853","192.168.11.8","192.168.11.23","TCP","66","0.007567000","0.007466000","Jan  8, 2024 13:40:55.169739000 JST","","6000  >  60928 [ACK] Seq=1 Ack=28 Win=65152 Len=0 TSval=3529713818 TSecr=2533457713"
"109","42.671083","192.168.11.8","192.168.11.23","TCP","66","0.007696000","0.000230000","Jan  8, 2024 13:40:55.169969000 JST","","6000  >  60928 [FIN, ACK] Seq=1 Ack=29 Win=65152 Len=0 TSval=3529713819 TSecr=2533457713"
"110","42.671131","192.168.11.23","192.168.11.8","TCP","66","0.000048000","0.000048000","Jan  8, 2024 13:40:55.170017000 JST","","60928  >  6000 [ACK] Seq=29 Ack=2 Win=64256 Len=0 TSval=2533457721 TSecr=3529713819"
"111","42.702244","192.168.11.23","255.255.255.255","UDP","209","","0.031113000","Jan  8, 2024 13:40:55.201130000 JST","7b2273656d616e74696373223a207b22656e74697479223a2022504944222c202262617365656e74697479223a2022616e79222c2022726f6c65223a2022656565222c20227370617469616c223a2022616e79222c202274656d706f72616c223a2022616e79227d2c20226461746170726f7065727479223a207b22666f726d6174223a2022696e616f6b615f70726f6772616d5f73616d706c655f73656d616e746963227d7d","60041  >  7000 Len=167"
"112","42.707866","192.168.11.9","192.168.11.23","TCP","74","","0.005622000","Jan  8, 2024 13:40:55.206752000 JST","","45952  >  6000 [SYN] Seq=0 Win=64240 Len=0 MSS=1460 SACK_PERM TSval=2557110689 TSecr=0 WS=128"
"113","42.707985","192.168.11.23","192.168.11.9","TCP","74","0.000119000","0.000119000","Jan  8, 2024 13:40:55.206871000 JST","","6000  >  45952 [SYN, ACK] Seq=0 Ack=1 Win=65160 Len=0 MSS=1460 SACK_PERM TSval=4294505371 TSecr=2557110689 WS=128"
"114","42.714628","192.168.11.9","192.168.11.23","TCP","66","0.006643000","0.006643000","Jan  8, 2024 13:40:55.213514000 JST","","45952  >  6000 [ACK] Seq=1 Ack=1 Win=64256 Len=0 TSval=2557110696 TSecr=4294505371"
"115","42.715274","192.168.11.9","192.168.11.23","TCP","93","","0.000646000","Jan  8, 2024 13:40:55.214160000 JST","","45952  >  6000 [PSH, ACK] Seq=1 Ack=1 Win=64256 Len=27 TSval=2557110696 TSecr=4294505371 [TCP segment of a reassembled PDU]"
"116","42.715387","192.168.11.23","192.168.11.9","TCP","66","0.000113000","0.000113000","Jan  8, 2024 13:40:55.214273000 JST","","6000  >  45952 [ACK] Seq=1 Ack=28 Win=65152 Len=0 TSval=4294505378 TSecr=2557110696"
"117","42.715482","192.168.11.9","192.168.11.23","TCP","66","","0.000095000","Jan  8, 2024 13:40:55.214368000 JST","","45952  >  6000 [FIN, ACK] Seq=28 Ack=1 Win=64256 Len=0 TSval=2557110696 TSecr=4294505371"
"118","42.716799","192.168.11.23","192.168.11.9","TCP","66","0.001317000","0.001317000","Jan  8, 2024 13:40:55.215685000 JST","","6000  >  45952 [FIN, ACK] Seq=1 Ack=29 Win=65152 Len=0 TSval=4294505380 TSecr=2557110696"
"119","42.722277","192.168.11.9","192.168.11.23","TCP","66","0.005478000","0.005478000","Jan  8, 2024 13:40:55.221163000 JST","","45952  >  6000 [ACK] Seq=29 Ack=2 Win=64256 Len=0 TSval=2557110704 TSecr=4294505380"
"120","49.401267","192.168.11.23","192.168.11.8","TCP","74","","6.678990000","Jan  8, 2024 13:41:01.900153000 JST","","46242  >  6000 [SYN] Seq=0 Win=64240 Len=0 MSS=1460 SACK_PERM TSval=2533464451 TSecr=0 WS=128"
"121","49.408030","192.168.11.8","192.168.11.23","TCP","74","0.006763000","0.006763000","Jan  8, 2024 13:41:01.906916000 JST","","6000  >  46242 [SYN, ACK] Seq=0 Ack=1 Win=65160 Len=0 MSS=1460 SACK_PERM TSval=3529720555 TSecr=2533464451 WS=128"
"122","49.408161","192.168.11.23","192.168.11.8","TCP","66","0.000131000","0.000131000","Jan  8, 2024 13:41:01.907047000 JST","","46242  >  6000 [ACK] Seq=1 Ack=1 Win=64256 Len=0 TSval=2533464458 TSecr=3529720555"
"123","49.408301","192.168.11.23","192.168.11.8","TCP","93","","0.000140000","Jan  8, 2024 13:41:01.907187000 JST","","46242  >  6000 [PSH, ACK] Seq=1 Ack=1 Win=64256 Len=27 TSval=2533464458 TSecr=3529720555 [TCP segment of a reassembled PDU]"
"124","49.408416","192.168.11.23","192.168.11.8","TCP","66","","0.000115000","Jan  8, 2024 13:41:01.907302000 JST","","46242  >  6000 [FIN, ACK] Seq=28 Ack=1 Win=64256 Len=0 TSval=2533464459 TSecr=3529720555"
"125","49.415494","192.168.11.8","192.168.11.23","TCP","66","0.007193000","0.007078000","Jan  8, 2024 13:41:01.914380000 JST","","6000  >  46242 [ACK] Seq=1 Ack=28 Win=65152 Len=0 TSval=3529720563 TSecr=2533464458"
"126","49.415722","192.168.11.8","192.168.11.23","TCP","66","0.007306000","0.000228000","Jan  8, 2024 13:41:01.914608000 JST","","6000  >  46242 [FIN, ACK] Seq=1 Ack=29 Win=65152 Len=0 TSval=3529720564 TSecr=2533464459"
"127","49.415785","192.168.11.23","192.168.11.8","TCP","66","0.000063000","0.000063000","Jan  8, 2024 13:41:01.914671000 JST","","46242  >  6000 [ACK] Seq=29 Ack=2 Win=64256 Len=0 TSval=2533464466 TSecr=3529720564"
"128","49.446536","192.168.11.23","255.255.255.255","UDP","209","","0.030751000","Jan  8, 2024 13:41:01.945422000 JST","7b2273656d616e74696373223a207b22656e74697479223a2022504944222c202262617365656e74697479223a2022616e79222c2022726f6c65223a2022656565222c20227370617469616c223a2022616e79222c202274656d706f72616c223a2022616e79227d2c20226461746170726f7065727479223a207b22666f726d6174223a2022696e616f6b615f70726f6772616d5f73616d706c655f73656d616e746963227d7d","59386  >  7000 Len=167"
"129","49.453562","192.168.11.9","192.168.11.23","TCP","74","","0.007026000","Jan  8, 2024 13:41:01.952448000 JST","","55040  >  6000 [SYN] Seq=0 Win=64240 Len=0 MSS=1460 SACK_PERM TSval=2557117434 TSecr=0 WS=128"
"130","49.453732","192.168.11.23","192.168.11.9","TCP","74","0.000170000","0.000170000","Jan  8, 2024 13:41:01.952618000 JST","","6000  >  55040 [SYN, ACK] Seq=0 Ack=1 Win=65160 Len=0 MSS=1460 SACK_PERM TSval=4294512117 TSecr=2557117434 WS=128"
"131","49.460768","192.168.11.9","192.168.11.23","TCP","66","0.007036000","0.007036000","Jan  8, 2024 13:41:01.959654000 JST","","55040  >  6000 [ACK] Seq=1 Ack=1 Win=64256 Len=0 TSval=2557117442 TSecr=4294512117"
"132","49.461525","192.168.11.9","192.168.11.23","TCP","93","","0.000757000","Jan  8, 2024 13:41:01.960411000 JST","","55040  >  6000 [PSH, ACK] Seq=1 Ack=1 Win=64256 Len=27 TSval=2557117442 TSecr=4294512117 [TCP segment of a reassembled PDU]"
"133","49.461657","192.168.11.23","192.168.11.9","TCP","66","0.000132000","0.000132000","Jan  8, 2024 13:41:01.960543000 JST","","6000  >  55040 [ACK] Seq=1 Ack=28 Win=65152 Len=0 TSval=4294512125 TSecr=2557117442"
"134","49.461739","192.168.11.9","192.168.11.23","TCP","66","","0.000082000","Jan  8, 2024 13:41:01.960625000 JST","","55040  >  6000 [FIN, ACK] Seq=28 Ack=1 Win=64256 Len=0 TSval=2557117442 TSecr=4294512117"
"135","49.463219","192.168.11.23","192.168.11.9","TCP","66","0.001480000","0.001480000","Jan  8, 2024 13:41:01.962105000 JST","","6000  >  55040 [FIN, ACK] Seq=1 Ack=29 Win=65152 Len=0 TSval=4294512126 TSecr=2557117442"
"136","49.469289","192.168.11.9","192.168.11.23","TCP","66","0.006070000","0.006070000","Jan  8, 2024 13:41:01.968175000 JST","","55040  >  6000 [ACK] Seq=29 Ack=2 Win=64256 Len=0 TSval=2557117450 TSecr=4294512126"
"137","56.116866","192.168.11.23","192.168.11.8","TCP","74","","6.647577000","Jan  8, 2024 13:41:08.615752000 JST","","46248  >  6000 [SYN] Seq=0 Win=64240 Len=0 MSS=1460 SACK_PERM TSval=2533471167 TSecr=0 WS=128"
"138","56.123406","192.168.11.8","192.168.11.23","TCP","74","0.006540000","0.006540000","Jan  8, 2024 13:41:08.622292000 JST","","6000  >  46248 [SYN, ACK] Seq=0 Ack=1 Win=65160 Len=0 MSS=1460 SACK_PERM TSval=3529727271 TSecr=2533471167 WS=128"
"139","56.123524","192.168.11.23","192.168.11.8","TCP","66","0.000118000","0.000118000","Jan  8, 2024 13:41:08.622410000 JST","","46248  >  6000 [ACK] Seq=1 Ack=1 Win=64256 Len=0 TSval=2533471174 TSecr=3529727271"
"140","56.123777","192.168.11.23","192.168.11.8","TCP","93","","0.000253000","Jan  8, 2024 13:41:08.622663000 JST","","46248  >  6000 [PSH, ACK] Seq=1 Ack=1 Win=64256 Len=27 TSval=2533471174 TSecr=3529727271 [TCP segment of a reassembled PDU]"
"141","56.123899","192.168.11.23","192.168.11.8","TCP","66","","0.000122000","Jan  8, 2024 13:41:08.622785000 JST","","46248  >  6000 [FIN, ACK] Seq=28 Ack=1 Win=64256 Len=0 TSval=2533471174 TSecr=3529727271"
"142","56.131138","192.168.11.8","192.168.11.23","TCP","66","0.007361000","0.007239000","Jan  8, 2024 13:41:08.630024000 JST","","6000  >  46248 [ACK] Seq=1 Ack=28 Win=65152 Len=0 TSval=3529727278 TSecr=2533471174"
"143","56.131386","192.168.11.8","192.168.11.23","TCP","66","0.007487000","0.000248000","Jan  8, 2024 13:41:08.630272000 JST","","6000  >  46248 [FIN, ACK] Seq=1 Ack=29 Win=65152 Len=0 TSval=3529727280 TSecr=2533471174"
"144","56.131440","192.168.11.23","192.168.11.8","TCP","66","0.000054000","0.000054000","Jan  8, 2024 13:41:08.630326000 JST","","46248  >  6000 [ACK] Seq=29 Ack=2 Win=64256 Len=0 TSval=2533471182 TSecr=3529727280"
"145","56.161688","192.168.11.23","255.255.255.255","UDP","209","","0.030248000","Jan  8, 2024 13:41:08.660574000 JST","7b2273656d616e74696373223a207b22656e74697479223a2022504944222c202262617365656e74697479223a2022616e79222c2022726f6c65223a2022656565222c20227370617469616c223a2022616e79222c202274656d706f72616c223a2022616e79227d2c20226461746170726f7065727479223a207b22666f726d6174223a2022696e616f6b615f70726f6772616d5f73616d706c655f73656d616e746963227d7d","48368  >  7000 Len=167"
"146","56.168426","192.168.11.9","192.168.11.23","TCP","74","","0.006738000","Jan  8, 2024 13:41:08.667312000 JST","","52662  >  6000 [SYN] Seq=0 Win=64240 Len=0 MSS=1460 SACK_PERM TSval=2557124149 TSecr=0 WS=128"
"147","56.168548","192.168.11.23","192.168.11.9","TCP","74","0.000122000","0.000122000","Jan  8, 2024 13:41:08.667434000 JST","","6000  >  52662 [SYN, ACK] Seq=0 Ack=1 Win=65160 Len=0 MSS=1460 SACK_PERM TSval=4294518832 TSecr=2557124149 WS=128"
"148","56.175790","192.168.11.9","192.168.11.23","TCP","66","0.007242000","0.007242000","Jan  8, 2024 13:41:08.674676000 JST","","52662  >  6000 [ACK] Seq=1 Ack=1 Win=64256 Len=0 TSval=2557124157 TSecr=4294518832"
"149","56.176401","192.168.11.9","192.168.11.23","TCP","93","","0.000611000","Jan  8, 2024 13:41:08.675287000 JST","","52662  >  6000 [PSH, ACK] Seq=1 Ack=1 Win=64256 Len=27 TSval=2557124157 TSecr=4294518832 [TCP segment of a reassembled PDU]"
"150","56.176497","192.168.11.23","192.168.11.9","TCP","66","0.000096000","0.000096000","Jan  8, 2024 13:41:08.675383000 JST","","6000  >  52662 [ACK] Seq=1 Ack=28 Win=65152 Len=0 TSval=4294518840 TSecr=2557124157"
"151","56.176576","192.168.11.9","192.168.11.23","TCP","66","","0.000079000","Jan  8, 2024 13:41:08.675462000 JST","","52662  >  6000 [FIN, ACK] Seq=28 Ack=1 Win=64256 Len=0 TSval=2557124157 TSecr=4294518832"
"152","56.179059","192.168.11.23","192.168.11.9","TCP","66","0.002483000","0.002483000","Jan  8, 2024 13:41:08.677945000 JST","","6000  >  52662 [FIN, ACK] Seq=1 Ack=29 Win=65152 Len=0 TSval=4294518842 TSecr=2557124157"
"153","56.186044","192.168.11.9","192.168.11.23","TCP","66","0.006985000","0.006985000","Jan  8, 2024 13:41:08.684930000 JST","","52662  >  6000 [ACK] Seq=29 Ack=2 Win=64256 Len=0 TSval=2557124167 TSecr=4294518842"
"154","62.814753","192.168.11.23","192.168.11.8","TCP","74","","6.628709000","Jan  8, 2024 13:41:15.313639000 JST","","36820  >  6000 [SYN] Seq=0 Win=64240 Len=0 MSS=1460 SACK_PERM TSval=2533477865 TSecr=0 WS=128"
"155","62.821344","192.168.11.8","192.168.11.23","TCP","74","0.006591000","0.006591000","Jan  8, 2024 13:41:15.320230000 JST","","6000  >  36820 [SYN, ACK] Seq=0 Ack=1 Win=65160 Len=0 MSS=1460 SACK_PERM TSval=3529733969 TSecr=2533477865 WS=128"
"156","62.821476","192.168.11.23","192.168.11.8","TCP","66","0.000132000","0.000132000","Jan  8, 2024 13:41:15.320362000 JST","","36820  >  6000 [ACK] Seq=1 Ack=1 Win=64256 Len=0 TSval=2533477872 TSecr=3529733969"
"157","62.821696","192.168.11.23","192.168.11.8","TCP","93","","0.000220000","Jan  8, 2024 13:41:15.320582000 JST","","36820  >  6000 [PSH, ACK] Seq=1 Ack=1 Win=64256 Len=27 TSval=2533477872 TSecr=3529733969 [TCP segment of a reassembled PDU]"
"158","62.821812","192.168.11.23","192.168.11.8","TCP","66","","0.000116000","Jan  8, 2024 13:41:15.320698000 JST","","36820  >  6000 [FIN, ACK] Seq=28 Ack=1 Win=64256 Len=0 TSval=2533477872 TSecr=3529733969"
"159","62.829356","192.168.11.8","192.168.11.23","TCP","66","0.007660000","0.007544000","Jan  8, 2024 13:41:15.328242000 JST","","6000  >  36820 [ACK] Seq=1 Ack=28 Win=65152 Len=0 TSval=3529733976 TSecr=2533477872"
"160","62.829790","192.168.11.8","192.168.11.23","TCP","66","0.007978000","0.000434000","Jan  8, 2024 13:41:15.328676000 JST","","6000  >  36820 [FIN, ACK] Seq=1 Ack=29 Win=65152 Len=0 TSval=3529733978 TSecr=2533477872"
"161","62.829855","192.168.11.23","192.168.11.8","TCP","66","0.000065000","0.000065000","Jan  8, 2024 13:41:15.328741000 JST","","36820  >  6000 [ACK] Seq=29 Ack=2 Win=64256 Len=0 TSval=2533477880 TSecr=3529733978"
"162","62.858629","192.168.11.23","255.255.255.255","UDP","209","","0.028774000","Jan  8, 2024 13:41:15.357515000 JST","7b2273656d616e74696373223a207b22656e74697479223a2022504944222c202262617365656e74697479223a2022616e79222c2022726f6c65223a2022656565222c20227370617469616c223a2022616e79222c202274656d706f72616c223a2022616e79227d2c20226461746170726f7065727479223a207b22666f726d6174223a2022696e616f6b615f70726f6772616d5f73616d706c655f73656d616e746963227d7d","45865  >  7000 Len=167"
"163","62.865398","192.168.11.9","192.168.11.23","TCP","74","","0.006769000","Jan  8, 2024 13:41:15.364284000 JST","","52664  >  6000 [SYN] Seq=0 Win=64240 Len=0 MSS=1460 SACK_PERM TSval=2557130846 TSecr=0 WS=128"
"164","62.865526","192.168.11.23","192.168.11.9","TCP","74","0.000128000","0.000128000","Jan  8, 2024 13:41:15.364412000 JST","","6000  >  52664 [SYN, ACK] Seq=0 Ack=1 Win=65160 Len=0 MSS=1460 SACK_PERM TSval=4294525529 TSecr=2557130846 WS=128"
"165","62.872260","192.168.11.9","192.168.11.23","TCP","66","0.006734000","0.006734000","Jan  8, 2024 13:41:15.371146000 JST","","52664  >  6000 [ACK] Seq=1 Ack=1 Win=64256 Len=0 TSval=2557130854 TSecr=4294525529"
"166","62.872873","192.168.11.9","192.168.11.23","TCP","93","","0.000613000","Jan  8, 2024 13:41:15.371759000 JST","","52664  >  6000 [PSH, ACK] Seq=1 Ack=1 Win=64256 Len=27 TSval=2557130854 TSecr=4294525529 [TCP segment of a reassembled PDU]"
"167","62.872989","192.168.11.23","192.168.11.9","TCP","66","0.000116000","0.000116000","Jan  8, 2024 13:41:15.371875000 JST","","6000  >  52664 [ACK] Seq=1 Ack=28 Win=65152 Len=0 TSval=4294525536 TSecr=2557130854"
"168","62.873067","192.168.11.9","192.168.11.23","TCP","66","","0.000078000","Jan  8, 2024 13:41:15.371953000 JST","","52664  >  6000 [FIN, ACK] Seq=28 Ack=1 Win=64256 Len=0 TSval=2557130854 TSecr=4294525529"
