"No.","Time","Source","Destination","Protocol","Length","The RTT to ACK the segment was","Time delta from previous captured frame","Arrival Time","Data","Info"
"1","0.000000","192.168.11.9","192.168.11.23","TCP","74","","0.000000000","Jan  8, 2024 13:40:12.450499000 JST","","51712  >  6000 [SYN] Seq=0 Win=64240 Len=0 MSS=1460 SACK_PERM TSval=2557068039 TSecr=0 WS=128"
"2","0.007970","192.168.11.23","192.168.11.9","TCP","74","0.007970000","0.007970000","Jan  8, 2024 13:40:12.458469000 JST","","6000  >  51712 [SYN, ACK] Seq=0 Ack=1 Win=65160 Len=0 MSS=1460 SACK_PERM TSval=4294462720 TSecr=2557068039 WS=128"
"3","0.008105","192.168.11.9","192.168.11.23","TCP","66","0.000135000","0.000135000","Jan  8, 2024 13:40:12.458604000 JST","","51712  >  6000 [ACK] Seq=1 Ack=1 Win=64256 Len=0 TSval=2557068047 TSecr=4294462720"
"4","0.008274","192.168.11.9","192.168.11.23","TCP","93","","0.000169000","Jan  8, 2024 13:40:12.458773000 JST","","51712  >  6000 [PSH, ACK] Seq=1 Ack=1 Win=64256 Len=27 TSval=2557068047 TSecr=4294462720 [TCP segment of a reassembled PDU]"
"5","0.008411","192.168.11.9","192.168.11.23","TCP","66","","0.000137000","Jan  8, 2024 13:40:12.458910000 JST","","51712  >  6000 [FIN, ACK] Seq=28 Ack=1 Win=64256 Len=0 TSval=2557068047 TSecr=4294462720"
"6","0.015167","192.168.11.23","192.168.11.9","TCP","66","0.006893000","0.006756000","Jan  8, 2024 13:40:12.465666000 JST","","6000  >  51712 [ACK] Seq=1 Ack=28 Win=65152 Len=0 TSval=4294462729 TSecr=2557068047"
"7","0.015544","192.168.11.23","192.168.11.9","TCP","66","0.007133000","0.000377000","Jan  8, 2024 13:40:12.466043000 JST","","6000  >  51712 [FIN, ACK] Seq=1 Ack=29 Win=65152 Len=0 TSval=4294462730 TSecr=2557068047"
"8","0.015599","192.168.11.9","192.168.11.23","TCP","66","0.000055000","0.000055000","Jan  8, 2024 13:40:12.466098000 JST","","51712  >  6000 [ACK] Seq=29 Ack=2 Win=64256 Len=0 TSval=2557068054 TSecr=4294462730"
"9","0.046626","192.168.11.9","255.255.255.255","UDP","209","","0.031027000","Jan  8, 2024 13:40:12.497125000 JST","7b2273656d616e74696373223a207b22656e74697479223a2022504944222c202262617365656e74697479223a2022616e79222c2022726f6c65223a2022666666222c20227370617469616c223a2022616e79222c202274656d706f72616c223a2022616e79227d2c20226461746170726f7065727479223a207b22666f726d6174223a2022696e616f6b615f70726f6772616d5f73616d706c655f73656d616e746963227d7d","46524  >  7000 Len=167"
"10","0.052664","192.168.11.10","192.168.11.9","TCP","74","","0.006038000","Jan  8, 2024 13:40:12.503163000 JST","","44438  >  6000 [SYN] Seq=0 Win=64240 Len=0 MSS=1460 SACK_PERM TSval=1289094514 TSecr=0 WS=128"
"11","0.052821","192.168.11.9","192.168.11.10","TCP","74","0.000157000","0.000157000","Jan  8, 2024 13:40:12.503320000 JST","","6000  >  44438 [SYN, ACK] Seq=0 Ack=1 Win=65160 Len=0 MSS=1460 SACK_PERM TSval=780761739 TSecr=1289094514 WS=128"
"12","0.060827","192.168.11.10","192.168.11.9","TCP","66","0.008006000","0.008006000","Jan  8, 2024 13:40:12.511326000 JST","","44438  >  6000 [ACK] Seq=1 Ack=1 Win=64256 Len=0 TSval=1289094522 TSecr=780761739"
"13","0.061323","192.168.11.10","192.168.11.9","TCP","93","","0.000496000","Jan  8, 2024 13:40:12.511822000 JST","","44438  >  6000 [PSH, ACK] Seq=1 Ack=1 Win=64256 Len=27 TSval=1289094522 TSecr=780761739 [TCP segment of a reassembled PDU]"
"14","0.061416","192.168.11.9","192.168.11.10","TCP","66","0.000093000","0.000093000","Jan  8, 2024 13:40:12.511915000 JST","","6000  >  44438 [ACK] Seq=1 Ack=28 Win=65152 Len=0 TSval=780761747 TSecr=1289094522"
"15","0.061487","192.168.11.10","192.168.11.9","TCP","66","","0.000071000","Jan  8, 2024 13:40:12.511986000 JST","","44438  >  6000 [FIN, ACK] Seq=28 Ack=1 Win=64256 Len=0 TSval=1289094523 TSecr=780761739"
"16","0.063136","192.168.11.9","192.168.11.10","TCP","66","0.001649000","0.001649000","Jan  8, 2024 13:40:12.513635000 JST","","6000  >  44438 [FIN, ACK] Seq=1 Ack=29 Win=65152 Len=0 TSval=780761749 TSecr=1289094523"
"17","0.067660","192.168.11.10","192.168.11.9","TCP","66","0.004524000","0.004524000","Jan  8, 2024 13:40:12.518159000 JST","","44438  >  6000 [ACK] Seq=29 Ack=2 Win=64256 Len=0 TSval=1289094530 TSecr=780761749"
"18","6.847030","192.168.11.9","192.168.11.23","TCP","74","","6.779370000","Jan  8, 2024 13:40:19.297529000 JST","","56984  >  6000 [SYN] Seq=0 Win=64240 Len=0 MSS=1460 SACK_PERM TSval=2557074886 TSecr=0 WS=128"
"19","6.853666","192.168.11.23","192.168.11.9","TCP","74","0.006636000","0.006636000","Jan  8, 2024 13:40:19.304165000 JST","","6000  >  56984 [SYN, ACK] Seq=0 Ack=1 Win=65160 Len=0 MSS=1460 SACK_PERM TSval=4294469567 TSecr=2557074886 WS=128"
"20","6.853782","192.168.11.9","192.168.11.23","TCP","66","0.000116000","0.000116000","Jan  8, 2024 13:40:19.304281000 JST","","56984  >  6000 [ACK] Seq=1 Ack=1 Win=64256 Len=0 TSval=2557074893 TSecr=4294469567"
"21","6.853932","192.168.11.9","192.168.11.23","TCP","93","","0.000150000","Jan  8, 2024 13:40:19.304431000 JST","","56984  >  6000 [PSH, ACK] Seq=1 Ack=1 Win=64256 Len=27 TSval=2557074893 TSecr=4294469567 [TCP segment of a reassembled PDU]"
"22","6.854072","192.168.11.9","192.168.11.23","TCP","66","","0.000140000","Jan  8, 2024 13:40:19.304571000 JST","","56984  >  6000 [FIN, ACK] Seq=28 Ack=1 Win=64256 Len=0 TSval=2557074893 TSecr=4294469567"
"23","6.861418","192.168.11.23","192.168.11.9","TCP","66","0.007486000","0.007346000","Jan  8, 2024 13:40:19.311917000 JST","","6000  >  56984 [ACK] Seq=1 Ack=28 Win=65152 Len=0 TSval=4294469575 TSecr=2557074893"
"24","6.861799","192.168.11.23","192.168.11.9","TCP","66","0.007727000","0.000381000","Jan  8, 2024 13:40:19.312298000 JST","","6000  >  56984 [FIN, ACK] Seq=1 Ack=29 Win=65152 Len=0 TSval=4294469576 TSecr=2557074893"
"25","6.861856","192.168.11.9","192.168.11.23","TCP","66","0.000057000","0.000057000","Jan  8, 2024 13:40:19.312355000 JST","","56984  >  6000 [ACK] Seq=29 Ack=2 Win=64256 Len=0 TSval=2557074901 TSecr=4294469576"
"26","6.890646","192.168.11.9","255.255.255.255","UDP","209","","0.028790000","Jan  8, 2024 13:40:19.341145000 JST","7b2273656d616e74696373223a207b22656e74697479223a2022504944222c202262617365656e74697479223a2022616e79222c2022726f6c65223a2022666666222c20227370617469616c223a2022616e79222c202274656d706f72616c223a2022616e79227d2c20226461746170726f7065727479223a207b22666f726d6174223a2022696e616f6b615f70726f6772616d5f73616d706c655f73656d616e746963227d7d","40296  >  7000 Len=167"
"27","6.897590","192.168.11.10","192.168.11.9","TCP","74","","0.006944000","Jan  8, 2024 13:40:19.348089000 JST","","44452  >  6000 [SYN] Seq=0 Win=64240 Len=0 MSS=1460 SACK_PERM TSval=1289101358 TSecr=0 WS=128"
"28","6.897769","192.168.11.9","192.168.11.10","TCP","74","0.000179000","0.000179000","Jan  8, 2024 13:40:19.348268000 JST","","6000  >  44452 [SYN, ACK] Seq=0 Ack=1 Win=65160 Len=0 MSS=1460 SACK_PERM TSval=780768584 TSecr=1289101358 WS=128"
"29","6.904678","192.168.11.10","192.168.11.9","TCP","66","0.006909000","0.006909000","Jan  8, 2024 13:40:19.355177000 JST","","44452  >  6000 [ACK] Seq=1 Ack=1 Win=64256 Len=0 TSval=1289101366 TSecr=780768584"
"30","6.905328","192.168.11.10","192.168.11.9","TCP","93","","0.000650000","Jan  8, 2024 13:40:19.355827000 JST","","44452  >  6000 [PSH, ACK] Seq=1 Ack=1 Win=64256 Len=27 TSval=1289101366 TSecr=780768584 [TCP segment of a reassembled PDU]"
"31","6.905454","192.168.11.9","192.168.11.10","TCP","66","0.000126000","0.000126000","Jan  8, 2024 13:40:19.355953000 JST","","6000  >  44452 [ACK] Seq=1 Ack=28 Win=65152 Len=0 TSval=780768591 TSecr=1289101366"
"32","6.905581","192.168.11.10","192.168.11.9","TCP","66","","0.000127000","Jan  8, 2024 13:40:19.356080000 JST","","44452  >  6000 [FIN, ACK] Seq=28 Ack=1 Win=64256 Len=0 TSval=1289101366 TSecr=780768584"
"33","6.907096","192.168.11.9","192.168.11.10","TCP","66","0.001515000","0.001515000","Jan  8, 2024 13:40:19.357595000 JST","","6000  >  44452 [FIN, ACK] Seq=1 Ack=29 Win=65152 Len=0 TSval=780768593 TSecr=1289101366"
"34","6.912491","192.168.11.10","192.168.11.9","TCP","66","0.005395000","0.005395000","Jan  8, 2024 13:40:19.362990000 JST","","44452  >  6000 [ACK] Seq=29 Ack=2 Win=64256 Len=0 TSval=1289101374 TSecr=780768593"
"35","13.721144","192.168.11.9","192.168.11.23","TCP","74","","6.808653000","Jan  8, 2024 13:40:26.171643000 JST","","47542  >  6000 [SYN] Seq=0 Win=64240 Len=0 MSS=1460 SACK_PERM TSval=2557081760 TSecr=0 WS=128"
"36","13.727986","192.168.11.23","192.168.11.9","TCP","74","0.006842000","0.006842000","Jan  8, 2024 13:40:26.178485000 JST","","6000  >  47542 [SYN, ACK] Seq=0 Ack=1 Win=65160 Len=0 MSS=1460 SACK_PERM TSval=4294476441 TSecr=2557081760 WS=128"
"37","13.728099","192.168.11.9","192.168.11.23","TCP","66","0.000113000","0.000113000","Jan  8, 2024 13:40:26.178598000 JST","","47542  >  6000 [ACK] Seq=1 Ack=1 Win=64256 Len=0 TSval=2557081767 TSecr=4294476441"
"38","13.728240","192.168.11.9","192.168.11.23","TCP","93","","0.000141000","Jan  8, 2024 13:40:26.178739000 JST","","47542  >  6000 [PSH, ACK] Seq=1 Ack=1 Win=64256 Len=27 TSval=2557081767 TSecr=4294476441 [TCP segment of a reassembled PDU]"
"39","13.728357","192.168.11.9","192.168.11.23","TCP","66","","0.000117000","Jan  8, 2024 13:40:26.178856000 JST","","47542  >  6000 [FIN, ACK] Seq=28 Ack=1 Win=64256 Len=0 TSval=2557081767 TSecr=4294476441"
"40","13.735546","192.168.11.23","192.168.11.9","TCP","66","0.007306000","0.007189000","Jan  8, 2024 13:40:26.186045000 JST","","6000  >  47542 [ACK] Seq=1 Ack=28 Win=65152 Len=0 TSval=4294476449 TSecr=2557081767"
"41","13.735776","192.168.11.23","192.168.11.9","TCP","66","0.007419000","0.000230000","Jan  8, 2024 13:40:26.186275000 JST","","6000  >  47542 [FIN, ACK] Seq=1 Ack=29 Win=65152 Len=0 TSval=4294476451 TSecr=2557081767"
"42","13.735832","192.168.11.9","192.168.11.23","TCP","66","0.000056000","0.000056000","Jan  8, 2024 13:40:26.186331000 JST","","47542  >  6000 [ACK] Seq=29 Ack=2 Win=64256 Len=0 TSval=2557081775 TSecr=4294476451"
"43","13.768344","192.168.11.9","255.255.255.255","UDP","209","","0.032512000","Jan  8, 2024 13:40:26.218843000 JST","7b2273656d616e74696373223a207b22656e74697479223a2022504944222c202262617365656e74697479223a2022616e79222c2022726f6c65223a2022666666222c20227370617469616c223a2022616e79222c202274656d706f72616c223a2022616e79227d2c20226461746170726f7065727479223a207b22666f726d6174223a2022696e616f6b615f70726f6772616d5f73616d706c655f73656d616e746963227d7d","52031  >  7000 Len=167"
"44","13.774080","192.168.11.10","192.168.11.9","TCP","74","","0.005736000","Jan  8, 2024 13:40:26.224579000 JST","","51902  >  6000 [SYN] Seq=0 Win=64240 Len=0 MSS=1460 SACK_PERM TSval=1289108236 TSecr=0 WS=128"
"45","13.774221","192.168.11.9","192.168.11.10","TCP","74","0.000141000","0.000141000","Jan  8, 2024 13:40:26.224720000 JST","","6000  >  51902 [SYN, ACK] Seq=0 Ack=1 Win=65160 Len=0 MSS=1460 SACK_PERM TSval=780775460 TSecr=1289108236 WS=128"
"46","13.781773","192.168.11.10","192.168.11.9","TCP","66","0.007552000","0.007552000","Jan  8, 2024 13:40:26.232272000 JST","","51902  >  6000 [ACK] Seq=1 Ack=1 Win=64256 Len=0 TSval=1289108243 TSecr=780775460"
"47","13.782186","192.168.11.10","192.168.11.9","TCP","93","","0.000413000","Jan  8, 2024 13:40:26.232685000 JST","","51902  >  6000 [PSH, ACK] Seq=1 Ack=1 Win=64256 Len=27 TSval=1289108244 TSecr=780775460 [TCP segment of a reassembled PDU]"
"48","13.782282","192.168.11.9","192.168.11.10","TCP","66","0.000096000","0.000096000","Jan  8, 2024 13:40:26.232781000 JST","","6000  >  51902 [ACK] Seq=1 Ack=28 Win=65152 Len=0 TSval=780775468 TSecr=1289108244"
"49","13.782569","192.168.11.10","192.168.11.9","TCP","66","","0.000287000","Jan  8, 2024 13:40:26.233068000 JST","","51902  >  6000 [FIN, ACK] Seq=28 Ack=1 Win=64256 Len=0 TSval=1289108244 TSecr=780775460"
"50","13.783804","192.168.11.9","192.168.11.10","TCP","66","0.001235000","0.001235000","Jan  8, 2024 13:40:26.234303000 JST","","6000  >  51902 [FIN, ACK] Seq=1 Ack=29 Win=65152 Len=0 TSval=780775470 TSecr=1289108244"
"51","13.789725","192.168.11.10","192.168.11.9","TCP","66","0.005921000","0.005921000","Jan  8, 2024 13:40:26.240224000 JST","","51902  >  6000 [ACK] Seq=29 Ack=2 Win=64256 Len=0 TSval=1289108251 TSecr=780775470"
"52","21.427645","192.168.11.9","192.168.11.23","TCP","74","","7.637920000","Jan  8, 2024 13:40:33.878144000 JST","","47554  >  6000 [SYN] Seq=0 Win=64240 Len=0 MSS=1460 SACK_PERM TSval=2557089466 TSecr=0 WS=128"
"53","21.434056","192.168.11.23","192.168.11.9","TCP","74","0.006411000","0.006411000","Jan  8, 2024 13:40:33.884555000 JST","","6000  >  47554 [SYN, ACK] Seq=0 Ack=1 Win=65160 Len=0 MSS=1460 SACK_PERM TSval=4294484148 TSecr=2557089466 WS=128"
"54","21.434166","192.168.11.9","192.168.11.23","TCP","66","0.000110000","0.000110000","Jan  8, 2024 13:40:33.884665000 JST","","47554  >  6000 [ACK] Seq=1 Ack=1 Win=64256 Len=0 TSval=2557089473 TSecr=4294484148"
"55","21.434313","192.168.11.9","192.168.11.23","TCP","93","","0.000147000","Jan  8, 2024 13:40:33.884812000 JST","","47554  >  6000 [PSH, ACK] Seq=1 Ack=1 Win=64256 Len=27 TSval=2557089473 TSecr=4294484148 [TCP segment of a reassembled PDU]"
"56","21.434416","192.168.11.9","192.168.11.23","TCP","66","","0.000103000","Jan  8, 2024 13:40:33.884915000 JST","","47554  >  6000 [FIN, ACK] Seq=28 Ack=1 Win=64256 Len=0 TSval=2557089473 TSecr=4294484148"
"57","21.441404","192.168.11.23","192.168.11.9","TCP","66","0.007091000","0.006988000","Jan  8, 2024 13:40:33.891903000 JST","","6000  >  47554 [ACK] Seq=1 Ack=28 Win=65152 Len=0 TSval=4294484155 TSecr=2557089473"
"58","21.441530","192.168.11.23","192.168.11.9","TCP","66","0.007114000","0.000126000","Jan  8, 2024 13:40:33.892029000 JST","","6000  >  47554 [FIN, ACK] Seq=1 Ack=29 Win=65152 Len=0 TSval=4294484156 TSecr=2557089473"
"59","21.441559","192.168.11.9","192.168.11.23","TCP","66","0.000029000","0.000029000","Jan  8, 2024 13:40:33.892058000 JST","","47554  >  6000 [ACK] Seq=29 Ack=2 Win=64256 Len=0 TSval=2557089480 TSecr=4294484156"
"60","21.465583","192.168.11.9","255.255.255.255","UDP","209","","0.024024000","Jan  8, 2024 13:40:33.916082000 JST","7b2273656d616e74696373223a207b22656e74697479223a2022504944222c202262617365656e74697479223a2022616e79222c2022726f6c65223a2022666666222c20227370617469616c223a2022616e79222c202274656d706f72616c223a2022616e79227d2c20226461746170726f7065727479223a207b22666f726d6174223a2022696e616f6b615f70726f6772616d5f73616d706c655f73656d616e746963227d7d","37448  >  7000 Len=167"
"61","21.470872","192.168.11.10","192.168.11.9","TCP","74","","0.005289000","Jan  8, 2024 13:40:33.921371000 JST","","58888  >  6000 [SYN] Seq=0 Win=64240 Len=0 MSS=1460 SACK_PERM TSval=1289115933 TSecr=0 WS=128"
"62","21.470958","192.168.11.9","192.168.11.10","TCP","74","0.000086000","0.000086000","Jan  8, 2024 13:40:33.921457000 JST","","6000  >  58888 [SYN, ACK] Seq=0 Ack=1 Win=65160 Len=0 MSS=1460 SACK_PERM TSval=780783157 TSecr=1289115933 WS=128"
"63","21.477162","192.168.11.10","192.168.11.9","TCP","66","0.006204000","0.006204000","Jan  8, 2024 13:40:33.927661000 JST","","58888  >  6000 [ACK] Seq=1 Ack=1 Win=64256 Len=0 TSval=1289115939 TSecr=780783157"
"64","21.477436","192.168.11.10","192.168.11.9","TCP","93","","0.000274000","Jan  8, 2024 13:40:33.927935000 JST","","58888  >  6000 [PSH, ACK] Seq=1 Ack=1 Win=64256 Len=27 TSval=1289115939 TSecr=780783157 [TCP segment of a reassembled PDU]"
"65","21.477477","192.168.11.9","192.168.11.10","TCP","66","0.000041000","0.000041000","Jan  8, 2024 13:40:33.927976000 JST","","6000  >  58888 [ACK] Seq=1 Ack=28 Win=65152 Len=0 TSval=780783163 TSecr=1289115939"
"66","21.477515","192.168.11.10","192.168.11.9","TCP","66","","0.000038000","Jan  8, 2024 13:40:33.928014000 JST","","58888  >  6000 [FIN, ACK] Seq=28 Ack=1 Win=64256 Len=0 TSval=1289115939 TSecr=780783157"
"67","21.478010","192.168.11.9","192.168.11.10","TCP","66","0.000495000","0.000495000","Jan  8, 2024 13:40:33.928509000 JST","","6000  >  58888 [FIN, ACK] Seq=1 Ack=29 Win=65152 Len=0 TSval=780783164 TSecr=1289115939"
"68","21.492531","192.168.11.10","192.168.11.9","TCP","66","0.014521000","0.014521000","Jan  8, 2024 13:40:33.943030000 JST","","58888  >  6000 [ACK] Seq=29 Ack=2 Win=64256 Len=0 TSval=1289115954 TSecr=780783164"
"69","29.151581","192.168.11.9","192.168.11.23","TCP","74","","7.659050000","Jan  8, 2024 13:40:41.602080000 JST","","45326  >  6000 [SYN] Seq=0 Win=64240 Len=0 MSS=1460 SACK_PERM TSval=2557097190 TSecr=0 WS=128"
"70","29.158262","192.168.11.23","192.168.11.9","TCP","74","0.006681000","0.006681000","Jan  8, 2024 13:40:41.608761000 JST","","6000  >  45326 [SYN, ACK] Seq=0 Ack=1 Win=65160 Len=0 MSS=1460 SACK_PERM TSval=4294491872 TSecr=2557097190 WS=128"
"71","29.158386","192.168.11.9","192.168.11.23","TCP","66","0.000124000","0.000124000","Jan  8, 2024 13:40:41.608885000 JST","","45326  >  6000 [ACK] Seq=1 Ack=1 Win=64256 Len=0 TSval=2557097197 TSecr=4294491872"
"72","29.158561","192.168.11.9","192.168.11.23","TCP","93","","0.000175000","Jan  8, 2024 13:40:41.609060000 JST","","45326  >  6000 [PSH, ACK] Seq=1 Ack=1 Win=64256 Len=27 TSval=2557097197 TSecr=4294491872 [TCP segment of a reassembled PDU]"
"73","29.158669","192.168.11.9","192.168.11.23","TCP","66","","0.000108000","Jan  8, 2024 13:40:41.609168000 JST","","45326  >  6000 [FIN, ACK] Seq=28 Ack=1 Win=64256 Len=0 TSval=2557097197 TSecr=4294491872"
"74","29.165538","192.168.11.23","192.168.11.9","TCP","66","0.006977000","0.006869000","Jan  8, 2024 13:40:41.616037000 JST","","6000  >  45326 [ACK] Seq=1 Ack=28 Win=65152 Len=0 TSval=4294491879 TSecr=2557097197"
"75","29.165912","192.168.11.23","192.168.11.9","TCP","66","0.007243000","0.000374000","Jan  8, 2024 13:40:41.616411000 JST","","6000  >  45326 [FIN, ACK] Seq=1 Ack=29 Win=65152 Len=0 TSval=4294491880 TSecr=2557097197"
"76","29.165977","192.168.11.9","192.168.11.23","TCP","66","0.000065000","0.000065000","Jan  8, 2024 13:40:41.616476000 JST","","45326  >  6000 [ACK] Seq=29 Ack=2 Win=64256 Len=0 TSval=2557097205 TSecr=4294491880"
"77","29.194527","192.168.11.9","255.255.255.255","UDP","209","","0.028550000","Jan  8, 2024 13:40:41.645026000 JST","7b2273656d616e74696373223a207b22656e74697479223a2022504944222c202262617365656e74697479223a2022616e79222c2022726f6c65223a2022666666222c20227370617469616c223a2022616e79222c202274656d706f72616c223a2022616e79227d2c20226461746170726f7065727479223a207b22666f726d6174223a2022696e616f6b615f70726f6772616d5f73616d706c655f73656d616e746963227d7d","60283  >  7000 Len=167"
"78","29.208558","192.168.11.10","192.168.11.9","TCP","74","","0.014031000","Jan  8, 2024 13:40:41.659057000 JST","","40168  >  6000 [SYN] Seq=0 Win=64240 Len=0 MSS=1460 SACK_PERM TSval=1289123662 TSecr=0 WS=128"
"79","29.208736","192.168.11.9","192.168.11.10","TCP","74","0.000178000","0.000178000","Jan  8, 2024 13:40:41.659235000 JST","","6000  >  40168 [SYN, ACK] Seq=0 Ack=1 Win=65160 Len=0 MSS=1460 SACK_PERM TSval=780790895 TSecr=1289123662 WS=128"
"80","29.215809","192.168.11.10","192.168.11.9","TCP","66","0.007073000","0.007073000","Jan  8, 2024 13:40:41.666308000 JST","","40168  >  6000 [ACK] Seq=1 Ack=1 Win=64256 Len=0 TSval=1289123677 TSecr=780790895"
"81","29.216729","192.168.11.10","192.168.11.9","TCP","93","","0.000920000","Jan  8, 2024 13:40:41.667228000 JST","","40168  >  6000 [PSH, ACK] Seq=1 Ack=1 Win=64256 Len=27 TSval=1289123677 TSecr=780790895 [TCP segment of a reassembled PDU]"
"82","29.216867","192.168.11.9","192.168.11.10","TCP","66","0.000138000","0.000138000","Jan  8, 2024 13:40:41.667366000 JST","","6000  >  40168 [ACK] Seq=1 Ack=28 Win=65152 Len=0 TSval=780790903 TSecr=1289123677"
"83","29.216950","192.168.11.10","192.168.11.9","TCP","66","","0.000083000","Jan  8, 2024 13:40:41.667449000 JST","","40168  >  6000 [FIN, ACK] Seq=28 Ack=1 Win=64256 Len=0 TSval=1289123677 TSecr=780790895"
"84","29.218604","192.168.11.9","192.168.11.10","TCP","66","0.001654000","0.001654000","Jan  8, 2024 13:40:41.669103000 JST","","6000  >  40168 [FIN, ACK] Seq=1 Ack=29 Win=65152 Len=0 TSval=780790904 TSecr=1289123677"
"85","29.223824","192.168.11.10","192.168.11.9","TCP","66","0.005220000","0.005220000","Jan  8, 2024 13:40:41.674323000 JST","","40168  >  6000 [ACK] Seq=29 Ack=2 Win=64256 Len=0 TSval=1289123686 TSecr=780790904"
"86","35.898556","192.168.11.9","192.168.11.23","TCP","74","","6.674732000","Jan  8, 2024 13:40:48.349055000 JST","","45942  >  6000 [SYN] Seq=0 Win=64240 Len=0 MSS=1460 SACK_PERM TSval=2557103937 TSecr=0 WS=128"
"87","35.906515","192.168.11.23","192.168.11.9","TCP","74","0.007959000","0.007959000","Jan  8, 2024 13:40:48.357014000 JST","","6000  >  45942 [SYN, ACK] Seq=0 Ack=1 Win=65160 Len=0 MSS=1460 SACK_PERM TSval=4294498620 TSecr=2557103937 WS=128"
"88","35.906642","192.168.11.9","192.168.11.23","TCP","66","0.000127000","0.000127000","Jan  8, 2024 13:40:48.357141000 JST","","45942  >  6000 [ACK] Seq=1 Ack=1 Win=64256 Len=0 TSval=2557103945 TSecr=4294498620"
"89","35.906860","192.168.11.9","192.168.11.23","TCP","93","","0.000218000","Jan  8, 2024 13:40:48.357359000 JST","","45942  >  6000 [PSH, ACK] Seq=1 Ack=1 Win=64256 Len=27 TSval=2557103946 TSecr=4294498620 [TCP segment of a reassembled PDU]"
"90","35.906973","192.168.11.9","192.168.11.23","TCP","66","","0.000113000","Jan  8, 2024 13:40:48.357472000 JST","","45942  >  6000 [FIN, ACK] Seq=28 Ack=1 Win=64256 Len=0 TSval=2557103946 TSecr=4294498620"
"91","35.914474","192.168.11.23","192.168.11.9","TCP","66","0.007614000","0.007501000","Jan  8, 2024 13:40:48.364973000 JST","","6000  >  45942 [ACK] Seq=1 Ack=28 Win=65152 Len=0 TSval=4294498628 TSecr=2557103946"
"92","35.914815","192.168.11.23","192.168.11.9","TCP","66","0.007842000","0.000341000","Jan  8, 2024 13:40:48.365314000 JST","","6000  >  45942 [FIN, ACK] Seq=1 Ack=29 Win=65152 Len=0 TSval=4294498629 TSecr=2557103946"
"93","35.914873","192.168.11.9","192.168.11.23","TCP","66","0.000058000","0.000058000","Jan  8, 2024 13:40:48.365372000 JST","","45942  >  6000 [ACK] Seq=29 Ack=2 Win=64256 Len=0 TSval=2557103954 TSecr=4294498629"
"94","35.945250","192.168.11.9","255.255.255.255","UDP","209","","0.030377000","Jan  8, 2024 13:40:48.395749000 JST","7b2273656d616e74696373223a207b22656e74697479223a2022504944222c202262617365656e74697479223a2022616e79222c2022726f6c65223a2022666666222c20227370617469616c223a2022616e79222c202274656d706f72616c223a2022616e79227d2c20226461746170726f7065727479223a207b22666f726d6174223a2022696e616f6b615f70726f6772616d5f73616d706c655f73656d616e746963227d7d","46716  >  7000 Len=167"
"95","35.951206","192.168.11.10","192.168.11.9","TCP","74","","0.005956000","Jan  8, 2024 13:40:48.401705000 JST","","40184  >  6000 [SYN] Seq=0 Win=64240 Len=0 MSS=1460 SACK_PERM TSval=1289130413 TSecr=0 WS=128"
"96","35.951362","192.168.11.9","192.168.11.10","TCP","74","0.000156000","0.000156000","Jan  8, 2024 13:40:48.401861000 JST","","6000  >  40184 [SYN, ACK] Seq=0 Ack=1 Win=65160 Len=0 MSS=1460 SACK_PERM TSval=780797637 TSecr=1289130413 WS=128"
"97","35.958036","192.168.11.10","192.168.11.9","TCP","66","0.006674000","0.006674000","Jan  8, 2024 13:40:48.408535000 JST","","40184  >  6000 [ACK] Seq=1 Ack=1 Win=64256 Len=0 TSval=1289130419 TSecr=780797637"
"98","35.958685","192.168.11.10","192.168.11.9","TCP","93","","0.000649000","Jan  8, 2024 13:40:48.409184000 JST","","40184  >  6000 [PSH, ACK] Seq=1 Ack=1 Win=64256 Len=27 TSval=1289130420 TSecr=780797637 [TCP segment of a reassembled PDU]"
"99","35.958848","192.168.11.9","192.168.11.10","TCP","66","0.000163000","0.000163000","Jan  8, 2024 13:40:48.409347000 JST","","6000  >  40184 [ACK] Seq=1 Ack=28 Win=65152 Len=0 TSval=780797645 TSecr=1289130420"
"100","35.959027","192.168.11.10","192.168.11.9","TCP","66","","0.000179000","Jan  8, 2024 13:40:48.409526000 JST","","40184  >  6000 [FIN, ACK] Seq=28 Ack=1 Win=64256 Len=0 TSval=1289130420 TSecr=780797637"
"101","35.960432","192.168.11.9","192.168.11.10","TCP","66","0.001405000","0.001405000","Jan  8, 2024 13:40:48.410931000 JST","","6000  >  40184 [FIN, ACK] Seq=1 Ack=29 Win=65152 Len=0 TSval=780797646 TSecr=1289130420"
"102","35.965702","192.168.11.10","192.168.11.9","TCP","66","0.005270000","0.005270000","Jan  8, 2024 13:40:48.416201000 JST","","40184  >  6000 [ACK] Seq=29 Ack=2 Win=64256 Len=0 TSval=1289130427 TSecr=780797646"
"103","42.650659","192.168.11.9","192.168.11.23","TCP","74","","6.684957000","Jan  8, 2024 13:40:55.101158000 JST","","45952  >  6000 [SYN] Seq=0 Win=64240 Len=0 MSS=1460 SACK_PERM TSval=2557110689 TSecr=0 WS=128"
"104","42.657220","192.168.11.23","192.168.11.9","TCP","74","0.006561000","0.006561000","Jan  8, 2024 13:40:55.107719000 JST","","6000  >  45952 [SYN, ACK] Seq=0 Ack=1 Win=65160 Len=0 MSS=1460 SACK_PERM TSval=4294505371 TSecr=2557110689 WS=128"
"105","42.657344","192.168.11.9","192.168.11.23","TCP","66","0.000124000","0.000124000","Jan  8, 2024 13:40:55.107843000 JST","","45952  >  6000 [ACK] Seq=1 Ack=1 Win=64256 Len=0 TSval=2557110696 TSecr=4294505371"
"106","42.657523","192.168.11.9","192.168.11.23","TCP","93","","0.000179000","Jan  8, 2024 13:40:55.108022000 JST","","45952  >  6000 [PSH, ACK] Seq=1 Ack=1 Win=64256 Len=27 TSval=2557110696 TSecr=4294505371 [TCP segment of a reassembled PDU]"
"107","42.657635","192.168.11.9","192.168.11.23","TCP","66","","0.000112000","Jan  8, 2024 13:40:55.108134000 JST","","45952  >  6000 [FIN, ACK] Seq=28 Ack=1 Win=64256 Len=0 TSval=2557110696 TSecr=4294505371"
"108","42.664959","192.168.11.23","192.168.11.9","TCP","66","0.007436000","0.007324000","Jan  8, 2024 13:40:55.115458000 JST","","6000  >  45952 [ACK] Seq=1 Ack=28 Win=65152 Len=0 TSval=4294505378 TSecr=2557110696"
"109","42.665183","192.168.11.23","192.168.11.9","TCP","66","0.007548000","0.000224000","Jan  8, 2024 13:40:55.115682000 JST","","6000  >  45952 [FIN, ACK] Seq=1 Ack=29 Win=65152 Len=0 TSval=4294505380 TSecr=2557110696"
"110","42.665239","192.168.11.9","192.168.11.23","TCP","66","0.000056000","0.000056000","Jan  8, 2024 13:40:55.115738000 JST","","45952  >  6000 [ACK] Seq=29 Ack=2 Win=64256 Len=0 TSval=2557110704 TSecr=4294505380"
"111","42.696271","192.168.11.9","255.255.255.255","UDP","209","","0.031032000","Jan  8, 2024 13:40:55.146770000 JST","7b2273656d616e74696373223a207b22656e74697479223a2022504944222c202262617365656e74697479223a2022616e79222c2022726f6c65223a2022666666222c20227370617469616c223a2022616e79222c202274656d706f72616c223a2022616e79227d2c20226461746170726f7065727479223a207b22666f726d6174223a2022696e616f6b615f70726f6772616d5f73616d706c655f73656d616e746963227d7d","46061  >  7000 Len=167"
"112","42.702947","192.168.11.10","192.168.11.9","TCP","74","","0.006676000","Jan  8, 2024 13:40:55.153446000 JST","","44964  >  6000 [SYN] Seq=0 Win=64240 Len=0 MSS=1460 SACK_PERM TSval=1289137163 TSecr=0 WS=128"
"113","42.703108","192.168.11.9","192.168.11.10","TCP","74","0.000161000","0.000161000","Jan  8, 2024 13:40:55.153607000 JST","","6000  >  44964 [SYN, ACK] Seq=0 Ack=1 Win=65160 Len=0 MSS=1460 SACK_PERM TSval=780804389 TSecr=1289137163 WS=128"
"114","42.709838","192.168.11.10","192.168.11.9","TCP","66","0.006730000","0.006730000","Jan  8, 2024 13:40:55.160337000 JST","","44964  >  6000 [ACK] Seq=1 Ack=1 Win=64256 Len=0 TSval=1289137171 TSecr=780804389"
"115","42.710539","192.168.11.10","192.168.11.9","TCP","93","","0.000701000","Jan  8, 2024 13:40:55.161038000 JST","","44964  >  6000 [PSH, ACK] Seq=1 Ack=1 Win=64256 Len=27 TSval=1289137171 TSecr=780804389 [TCP segment of a reassembled PDU]"
"116","42.710655","192.168.11.9","192.168.11.10","TCP","66","0.000116000","0.000116000","Jan  8, 2024 13:40:55.161154000 JST","","6000  >  44964 [ACK] Seq=1 Ack=28 Win=65152 Len=0 TSval=780804396 TSecr=1289137171"
"117","42.710854","192.168.11.10","192.168.11.9","TCP","66","","0.000199000","Jan  8, 2024 13:40:55.161353000 JST","","44964  >  6000 [FIN, ACK] Seq=28 Ack=1 Win=64256 Len=0 TSval=1289137172 TSecr=780804389"
"118","42.712462","192.168.11.9","192.168.11.10","TCP","66","0.001608000","0.001608000","Jan  8, 2024 13:40:55.162961000 JST","","6000  >  44964 [FIN, ACK] Seq=1 Ack=29 Win=65152 Len=0 TSval=780804398 TSecr=1289137172"
"119","42.717085","192.168.11.10","192.168.11.9","TCP","66","0.004623000","0.004623000","Jan  8, 2024 13:40:55.167584000 JST","","44964  >  6000 [ACK] Seq=29 Ack=2 Win=64256 Len=0 TSval=1289137179 TSecr=780804398"
"120","49.395068","192.168.11.9","192.168.11.23","TCP","74","","6.677983000","Jan  8, 2024 13:41:01.845567000 JST","","55040  >  6000 [SYN] Seq=0 Win=64240 Len=0 MSS=1460 SACK_PERM TSval=2557117434 TSecr=0 WS=128"
"121","49.402971","192.168.11.23","192.168.11.9","TCP","74","0.007903000","0.007903000","Jan  8, 2024 13:41:01.853470000 JST","","6000  >  55040 [SYN, ACK] Seq=0 Ack=1 Win=65160 Len=0 MSS=1460 SACK_PERM TSval=4294512117 TSecr=2557117434 WS=128"
"122","49.403096","192.168.11.9","192.168.11.23","TCP","66","0.000125000","0.000125000","Jan  8, 2024 13:41:01.853595000 JST","","55040  >  6000 [ACK] Seq=1 Ack=1 Win=64256 Len=0 TSval=2557117442 TSecr=4294512117"
"123","49.403278","192.168.11.9","192.168.11.23","TCP","93","","0.000182000","Jan  8, 2024 13:41:01.853777000 JST","","55040  >  6000 [PSH, ACK] Seq=1 Ack=1 Win=64256 Len=27 TSval=2557117442 TSecr=4294512117 [TCP segment of a reassembled PDU]"
"124","49.403375","192.168.11.9","192.168.11.23","TCP","66","","0.000097000","Jan  8, 2024 13:41:01.853874000 JST","","55040  >  6000 [FIN, ACK] Seq=28 Ack=1 Win=64256 Len=0 TSval=2557117442 TSecr=4294512117"
"125","49.411055","192.168.11.23","192.168.11.9","TCP","66","0.007777000","0.007680000","Jan  8, 2024 13:41:01.861554000 JST","","6000  >  55040 [ACK] Seq=1 Ack=28 Win=65152 Len=0 TSval=4294512125 TSecr=2557117442"
"126","49.411467","192.168.11.23","192.168.11.9","TCP","66","0.008092000","0.000412000","Jan  8, 2024 13:41:01.861966000 JST","","6000  >  55040 [FIN, ACK] Seq=1 Ack=29 Win=65152 Len=0 TSval=4294512126 TSecr=2557117442"
"127","49.411530","192.168.11.9","192.168.11.23","TCP","66","0.000063000","0.000063000","Jan  8, 2024 13:41:01.862029000 JST","","55040  >  6000 [ACK] Seq=29 Ack=2 Win=64256 Len=0 TSval=2557117450 TSecr=4294512126"
"128","49.442068","192.168.11.9","255.255.255.255","UDP","209","","0.030538000","Jan  8, 2024 13:41:01.892567000 JST","7b2273656d616e74696373223a207b22656e74697479223a2022504944222c202262617365656e74697479223a2022616e79222c2022726f6c65223a2022666666222c20227370617469616c223a2022616e79222c202274656d706f72616c223a2022616e79227d2c20226461746170726f7065727479223a207b22666f726d6174223a2022696e616f6b615f70726f6772616d5f73616d706c655f73656d616e746963227d7d","49270  >  7000 Len=167"
"129","49.447863","192.168.11.10","192.168.11.9","TCP","74","","0.005795000","Jan  8, 2024 13:41:01.898362000 JST","","55578  >  6000 [SYN] Seq=0 Win=64240 Len=0 MSS=1460 SACK_PERM TSval=1289143909 TSecr=0 WS=128"
"130","49.448010","192.168.11.9","192.168.11.10","TCP","74","0.000147000","0.000147000","Jan  8, 2024 13:41:01.898509000 JST","","6000  >  55578 [SYN, ACK] Seq=0 Ack=1 Win=65160 Len=0 MSS=1460 SACK_PERM TSval=780811134 TSecr=1289143909 WS=128"
"131","49.454920","192.168.11.10","192.168.11.9","TCP","66","0.006910000","0.006910000","Jan  8, 2024 13:41:01.905419000 JST","","55578  >  6000 [ACK] Seq=1 Ack=1 Win=64256 Len=0 TSval=1289143916 TSecr=780811134"
"132","49.455610","192.168.11.10","192.168.11.9","TCP","93","","0.000690000","Jan  8, 2024 13:41:01.906109000 JST","","55578  >  6000 [PSH, ACK] Seq=1 Ack=1 Win=64256 Len=27 TSval=1289143916 TSecr=780811134 [TCP segment of a reassembled PDU]"
"133","49.455704","192.168.11.9","192.168.11.10","TCP","66","0.000094000","0.000094000","Jan  8, 2024 13:41:01.906203000 JST","","6000  >  55578 [ACK] Seq=1 Ack=28 Win=65152 Len=0 TSval=780811141 TSecr=1289143916"
"134","49.455804","192.168.11.10","192.168.11.9","TCP","66","","0.000100000","Jan  8, 2024 13:41:01.906303000 JST","","55578  >  6000 [FIN, ACK] Seq=28 Ack=1 Win=64256 Len=0 TSval=1289143916 TSecr=780811134"
"135","49.457924","192.168.11.9","192.168.11.10","TCP","66","0.002120000","0.002120000","Jan  8, 2024 13:41:01.908423000 JST","","6000  >  55578 [FIN, ACK] Seq=1 Ack=29 Win=65152 Len=0 TSval=780811144 TSecr=1289143916"
"136","49.464944","192.168.11.10","192.168.11.9","TCP","66","0.007020000","0.007020000","Jan  8, 2024 13:41:01.915443000 JST","","55578  >  6000 [ACK] Seq=29 Ack=2 Win=64256 Len=0 TSval=1289143926 TSecr=780811144"
"137","56.110094","192.168.11.9","192.168.11.23","TCP","74","","6.645150000","Jan  8, 2024 13:41:08.560593000 JST","","52662  >  6000 [SYN] Seq=0 Win=64240 Len=0 MSS=1460 SACK_PERM TSval=2557124149 TSecr=0 WS=128"
"138","56.118146","192.168.11.23","192.168.11.9","TCP","74","0.008052000","0.008052000","Jan  8, 2024 13:41:08.568645000 JST","","6000  >  52662 [SYN, ACK] Seq=0 Ack=1 Win=65160 Len=0 MSS=1460 SACK_PERM TSval=4294518832 TSecr=2557124149 WS=128"
"139","56.118265","192.168.11.9","192.168.11.23","TCP","66","0.000119000","0.000119000","Jan  8, 2024 13:41:08.568764000 JST","","52662  >  6000 [ACK] Seq=1 Ack=1 Win=64256 Len=0 TSval=2557124157 TSecr=4294518832"
"140","56.118418","192.168.11.9","192.168.11.23","TCP","93","","0.000153000","Jan  8, 2024 13:41:08.568917000 JST","","52662  >  6000 [PSH, ACK] Seq=1 Ack=1 Win=64256 Len=27 TSval=2557124157 TSecr=4294518832 [TCP segment of a reassembled PDU]"
"141","56.118546","192.168.11.9","192.168.11.23","TCP","66","","0.000128000","Jan  8, 2024 13:41:08.569045000 JST","","52662  >  6000 [FIN, ACK] Seq=28 Ack=1 Win=64256 Len=0 TSval=2557124157 TSecr=4294518832"
"142","56.125755","192.168.11.23","192.168.11.9","TCP","66","0.007337000","0.007209000","Jan  8, 2024 13:41:08.576254000 JST","","6000  >  52662 [ACK] Seq=1 Ack=28 Win=65152 Len=0 TSval=4294518840 TSecr=2557124157"
"143","56.128267","192.168.11.23","192.168.11.9","TCP","66","0.009721000","0.002512000","Jan  8, 2024 13:41:08.578766000 JST","","6000  >  52662 [FIN, ACK] Seq=1 Ack=29 Win=65152 Len=0 TSval=4294518842 TSecr=2557124157"
"144","56.128314","192.168.11.9","192.168.11.23","TCP","66","0.000047000","0.000047000","Jan  8, 2024 13:41:08.578813000 JST","","52662  >  6000 [ACK] Seq=29 Ack=2 Win=64256 Len=0 TSval=2557124167 TSecr=4294518842"
"145","56.157156","192.168.11.9","255.255.255.255","UDP","209","","0.028842000","Jan  8, 2024 13:41:08.607655000 JST","7b2273656d616e74696373223a207b22656e74697479223a2022504944222c202262617365656e74697479223a2022616e79222c2022726f6c65223a2022666666222c20227370617469616c223a2022616e79222c202274656d706f72616c223a2022616e79227d2c20226461746170726f7065727479223a207b22666f726d6174223a2022696e616f6b615f70726f6772616d5f73616d706c655f73656d616e746963227d7d","56441  >  7000 Len=167"
"146","56.162654","192.168.11.10","192.168.11.9","TCP","74","","0.005498000","Jan  8, 2024 13:41:08.613153000 JST","","55584  >  6000 [SYN] Seq=0 Win=64240 Len=0 MSS=1460 SACK_PERM TSval=1289150624 TSecr=0 WS=128"
"147","56.162792","192.168.11.9","192.168.11.10","TCP","74","0.000138000","0.000138000","Jan  8, 2024 13:41:08.613291000 JST","","6000  >  55584 [SYN, ACK] Seq=0 Ack=1 Win=65160 Len=0 MSS=1460 SACK_PERM TSval=780817849 TSecr=1289150624 WS=128"
"148","56.169536","192.168.11.10","192.168.11.9","TCP","66","0.006744000","0.006744000","Jan  8, 2024 13:41:08.620035000 JST","","55584  >  6000 [ACK] Seq=1 Ack=1 Win=64256 Len=0 TSval=1289150631 TSecr=780817849"
"149","56.170020","192.168.11.10","192.168.11.9","TCP","93","","0.000484000","Jan  8, 2024 13:41:08.620519000 JST","","55584  >  6000 [PSH, ACK] Seq=1 Ack=1 Win=64256 Len=27 TSval=1289150631 TSecr=780817849 [TCP segment of a reassembled PDU]"
"150","56.170110","192.168.11.9","192.168.11.10","TCP","66","0.000090000","0.000090000","Jan  8, 2024 13:41:08.620609000 JST","","6000  >  55584 [ACK] Seq=1 Ack=28 Win=65152 Len=0 TSval=780817856 TSecr=1289150631"
"151","56.172621","192.168.11.10","192.168.11.9","TCP","66","","0.002511000","Jan  8, 2024 13:41:08.623120000 JST","","55584  >  6000 [FIN, ACK] Seq=28 Ack=1 Win=64256 Len=0 TSval=1289150631 TSecr=780817849"
"152","56.172987","192.168.11.9","192.168.11.10","TCP","66","0.000366000","0.000366000","Jan  8, 2024 13:41:08.623486000 JST","","6000  >  55584 [FIN, ACK] Seq=1 Ack=29 Win=65152 Len=0 TSval=780817859 TSecr=1289150631"
"153","56.179894","192.168.11.10","192.168.11.9","TCP","66","0.006907000","0.006907000","Jan  8, 2024 13:41:08.630393000 JST","","55584  >  6000 [ACK] Seq=29 Ack=2 Win=64256 Len=0 TSval=1289150641 TSecr=780817859"
"154","62.807001","192.168.11.9","192.168.11.23","TCP","74","","6.627107000","Jan  8, 2024 13:41:15.257500000 JST","","52664  >  6000 [SYN] Seq=0 Win=64240 Len=0 MSS=1460 SACK_PERM TSval=2557130846 TSecr=0 WS=128"
"155","62.814614","192.168.11.23","192.168.11.9","TCP","74","0.007613000","0.007613000","Jan  8, 2024 13:41:15.265113000 JST","","6000  >  52664 [SYN, ACK] Seq=0 Ack=1 Win=65160 Len=0 MSS=1460 SACK_PERM TSval=4294525529 TSecr=2557130846 WS=128"
"156","62.814750","192.168.11.9","192.168.11.23","TCP","66","0.000136000","0.000136000","Jan  8, 2024 13:41:15.265249000 JST","","52664  >  6000 [ACK] Seq=1 Ack=1 Win=64256 Len=0 TSval=2557130854 TSecr=4294525529"
"157","62.814931","192.168.11.9","192.168.11.23","TCP","93","","0.000181000","Jan  8, 2024 13:41:15.265430000 JST","","52664  >  6000 [PSH, ACK] Seq=1 Ack=1 Win=64256 Len=27 TSval=2557130854 TSecr=4294525529 [TCP segment of a reassembled PDU]"
"158","62.815052","192.168.11.9","192.168.11.23","TCP","66","","0.000121000","Jan  8, 2024 13:41:15.265551000 JST","","52664  >  6000 [FIN, ACK] Seq=28 Ack=1 Win=64256 Len=0 TSval=2557130854 TSecr=4294525529"
"159","62.822250","192.168.11.23","192.168.11.9","TCP","66","0.007319000","0.007198000","Jan  8, 2024 13:41:15.272749000 JST","","6000  >  52664 [ACK] Seq=1 Ack=28 Win=65152 Len=0 TSval=4294525536 TSecr=2557130854"
"160","62.824357","192.168.11.23","192.168.11.9","TCP","66","0.009305000","0.002107000","Jan  8, 2024 13:41:15.274856000 JST","","6000  >  52664 [FIN, ACK] Seq=1 Ack=29 Win=65152 Len=0 TSval=4294525538 TSecr=2557130854"
"161","62.824409","192.168.11.9","192.168.11.23","TCP","66","0.000052000","0.000052000","Jan  8, 2024 13:41:15.274908000 JST","","52664  >  6000 [ACK] Seq=29 Ack=2 Win=64256 Len=0 TSval=2557130863 TSecr=4294525538"
"162","62.853700","192.168.11.9","255.255.255.255","UDP","209","","0.029291000","Jan  8, 2024 13:41:15.304199000 JST","7b2273656d616e74696373223a207b22656e74697479223a2022504944222c202262617365656e74697479223a2022616e79222c2022726f6c65223a2022666666222c20227370617469616c223a2022616e79222c202274656d706f72616c223a2022616e79227d2c20226461746170726f7065727479223a207b22666f726d6174223a2022696e616f6b615f70726f6772616d5f73616d706c655f73656d616e746963227d7d","41100  >  7000 Len=167"
"163","62.859385","192.168.11.10","192.168.11.9","TCP","74","","0.005685000","Jan  8, 2024 13:41:15.309884000 JST","","37038  >  6000 [SYN] Seq=0 Win=64240 Len=0 MSS=1460 SACK_PERM TSval=1289157321 TSecr=0 WS=128"
"164","62.859509","192.168.11.9","192.168.11.10","TCP","74","0.000124000","0.000124000","Jan  8, 2024 13:41:15.310008000 JST","","6000  >  37038 [SYN, ACK] Seq=0 Ack=1 Win=65160 Len=0 MSS=1460 SACK_PERM TSval=780824545 TSecr=1289157321 WS=128"
"165","62.866302","192.168.11.10","192.168.11.9","TCP","66","0.006793000","0.006793000","Jan  8, 2024 13:41:15.316801000 JST","","37038  >  6000 [ACK] Seq=1 Ack=1 Win=64256 Len=0 TSval=1289157328 TSecr=780824545"
"166","62.867176","192.168.11.10","192.168.11.9","TCP","93","","0.000874000","Jan  8, 2024 13:41:15.317675000 JST","","37038  >  6000 [PSH, ACK] Seq=1 Ack=1 Win=64256 Len=27 TSval=1289157328 TSecr=780824545 [TCP segment of a reassembled PDU]"
"167","62.867282","192.168.11.9","192.168.11.10","TCP","66","0.000106000","0.000106000","Jan  8, 2024 13:41:15.317781000 JST","","6000  >  37038 [ACK] Seq=1 Ack=28 Win=65152 Len=0 TSval=780824553 TSecr=1289157328"
"168","62.867363","192.168.11.10","192.168.11.9","TCP","66","","0.000081000","Jan  8, 2024 13:41:15.317862000 JST","","37038  >  6000 [FIN, ACK] Seq=28 Ack=1 Win=64256 Len=0 TSval=1289157328 TSecr=780824545"
