"No.","Time","Source","Destination","Protocol","Length","The RTT to ACK the segment was","Time delta from previous captured frame","Arrival Time","Data","Info"
"1","0.000000","192.168.11.30","192.168.11.10","TCP","74","","0.000000000","Jan  8, 2024 13:40:12.537969000 JST","","60372  >  6000 [SYN] Seq=0 Win=64240 Len=0 MSS=1460 SACK_PERM TSval=3581875796 TSecr=0 WS=128"
"2","0.008634","192.168.11.10","192.168.11.30","TCP","74","0.008634000","0.008634000","Jan  8, 2024 13:40:12.546603000 JST","","6000  >  60372 [SYN, ACK] Seq=0 Ack=1 Win=65160 Len=0 MSS=1460 SACK_PERM TSval=2289219051 TSecr=3581875796 WS=128"
"3","0.008750","192.168.11.30","192.168.11.10","TCP","66","0.000116000","0.000116000","Jan  8, 2024 13:40:12.546719000 JST","","60372  >  6000 [ACK] Seq=1 Ack=1 Win=64256 Len=0 TSval=3581875805 TSecr=2289219051"
"4","0.009074","192.168.11.30","192.168.11.10","TCP","93","","0.000324000","Jan  8, 2024 13:40:12.547043000 JST","","60372  >  6000 [PSH, ACK] Seq=1 Ack=1 Win=64256 Len=27 TSval=3581875806 TSecr=2289219051 [TCP segment of a reassembled PDU]"
"5","0.009195","192.168.11.30","192.168.11.10","TCP","66","","0.000121000","Jan  8, 2024 13:40:12.547164000 JST","","60372  >  6000 [FIN, ACK] Seq=28 Ack=1 Win=64256 Len=0 TSval=3581875806 TSecr=2289219051"
"6","0.020566","192.168.11.10","192.168.11.30","TCP","66","0.011492000","0.011371000","Jan  8, 2024 13:40:12.558535000 JST","","6000  >  60372 [ACK] Seq=1 Ack=28 Win=65152 Len=0 TSval=2289219063 TSecr=3581875806"
"7","0.020818","192.168.11.10","192.168.11.30","TCP","66","0.011623000","0.000252000","Jan  8, 2024 13:40:12.558787000 JST","","6000  >  60372 [FIN, ACK] Seq=1 Ack=29 Win=65152 Len=0 TSval=2289219065 TSecr=3581875806"
"8","0.020866","192.168.11.30","192.168.11.10","TCP","66","0.000048000","0.000048000","Jan  8, 2024 13:40:12.558835000 JST","","60372  >  6000 [ACK] Seq=29 Ack=2 Win=64256 Len=0 TSval=3581875817 TSecr=2289219065"
"9","0.053542","192.168.11.30","255.255.255.255","UDP","209","","0.032676000","Jan  8, 2024 13:40:12.591511000 JST","7b2273656d616e74696373223a207b22656e74697479223a2022504944222c202262617365656e74697479223a2022616e79222c2022726f6c65223a2022686868222c20227370617469616c223a2022616e79222c202274656d706f72616c223a2022616e79227d2c20226461746170726f7065727479223a207b22666f726d6174223a2022696e616f6b615f70726f6772616d5f73616d706c655f73656d616e746963227d7d","39903  >  7000 Len=167"
"10","0.061506","192.168.11.21","192.168.11.30","TCP","74","","0.007964000","Jan  8, 2024 13:40:12.599475000 JST","","34200  >  6000 [SYN] Seq=0 Win=64240 Len=0 MSS=1460 SACK_PERM TSval=2376848688 TSecr=0 WS=128"
"11","0.061681","192.168.11.30","192.168.11.21","TCP","74","0.000175000","0.000175000","Jan  8, 2024 13:40:12.599650000 JST","","6000  >  34200 [SYN, ACK] Seq=0 Ack=1 Win=65160 Len=0 MSS=1460 SACK_PERM TSval=1536960872 TSecr=2376848688 WS=128"
"12","0.078758","192.168.11.21","192.168.11.30","TCP","66","0.017077000","0.017077000","Jan  8, 2024 13:40:12.616727000 JST","","34200  >  6000 [ACK] Seq=1 Ack=1 Win=64256 Len=0 TSval=2376848695 TSecr=1536960872"
"13","0.079334","192.168.11.21","192.168.11.30","TCP","93","","0.000576000","Jan  8, 2024 13:40:12.617303000 JST","","34200  >  6000 [PSH, ACK] Seq=1 Ack=1 Win=64256 Len=27 TSval=2376848695 TSecr=1536960872 [TCP segment of a reassembled PDU]"
"14","0.079421","192.168.11.30","192.168.11.21","TCP","66","0.000087000","0.000087000","Jan  8, 2024 13:40:12.617390000 JST","","6000  >  34200 [ACK] Seq=1 Ack=28 Win=65152 Len=0 TSval=1536960890 TSecr=2376848695"
"15","0.079507","192.168.11.21","192.168.11.30","TCP","66","","0.000086000","Jan  8, 2024 13:40:12.617476000 JST","","34200  >  6000 [FIN, ACK] Seq=28 Ack=1 Win=64256 Len=0 TSval=2376848696 TSecr=1536960872"
"16","0.081245","192.168.11.30","192.168.11.21","TCP","66","0.001738000","0.001738000","Jan  8, 2024 13:40:12.619214000 JST","","6000  >  34200 [FIN, ACK] Seq=1 Ack=29 Win=65152 Len=0 TSval=1536960892 TSecr=2376848696"
"17","0.088806","192.168.11.21","192.168.11.30","TCP","66","0.007561000","0.007561000","Jan  8, 2024 13:40:12.626775000 JST","","34200  >  6000 [ACK] Seq=29 Ack=2 Win=64256 Len=0 TSval=2376848715 TSecr=1536960892"
"18","6.844412","192.168.11.30","192.168.11.10","TCP","74","","6.755606000","Jan  8, 2024 13:40:19.382381000 JST","","58482  >  6000 [SYN] Seq=0 Win=64240 Len=0 MSS=1460 SACK_PERM TSval=3581882641 TSecr=0 WS=128"
"19","6.852988","192.168.11.10","192.168.11.30","TCP","74","0.008576000","0.008576000","Jan  8, 2024 13:40:19.390957000 JST","","6000  >  58482 [SYN, ACK] Seq=0 Ack=1 Win=65160 Len=0 MSS=1460 SACK_PERM TSval=2289225896 TSecr=3581882641 WS=128"
"20","6.853107","192.168.11.30","192.168.11.10","TCP","66","0.000119000","0.000119000","Jan  8, 2024 13:40:19.391076000 JST","","58482  >  6000 [ACK] Seq=1 Ack=1 Win=64256 Len=0 TSval=3581882650 TSecr=2289225896"
"21","6.853286","192.168.11.30","192.168.11.10","TCP","93","","0.000179000","Jan  8, 2024 13:40:19.391255000 JST","","58482  >  6000 [PSH, ACK] Seq=1 Ack=1 Win=64256 Len=27 TSval=3581882650 TSecr=2289225896 [TCP segment of a reassembled PDU]"
"22","6.853413","192.168.11.30","192.168.11.10","TCP","66","","0.000127000","Jan  8, 2024 13:40:19.391382000 JST","","58482  >  6000 [FIN, ACK] Seq=28 Ack=1 Win=64256 Len=0 TSval=3581882650 TSecr=2289225896"
"23","6.863670","192.168.11.10","192.168.11.30","TCP","66","0.010384000","0.010257000","Jan  8, 2024 13:40:19.401639000 JST","","6000  >  58482 [ACK] Seq=1 Ack=28 Win=65152 Len=0 TSval=2289225904 TSecr=3581882650"
"24","6.864059","192.168.11.10","192.168.11.30","TCP","66","0.010646000","0.000389000","Jan  8, 2024 13:40:19.402028000 JST","","6000  >  58482 [FIN, ACK] Seq=1 Ack=29 Win=65152 Len=0 TSval=2289225906 TSecr=3581882650"
"25","6.864105","192.168.11.30","192.168.11.10","TCP","66","0.000046000","0.000046000","Jan  8, 2024 13:40:19.402074000 JST","","58482  >  6000 [ACK] Seq=29 Ack=2 Win=64256 Len=0 TSval=3581882661 TSecr=2289225906"
"26","6.898338","192.168.11.30","255.255.255.255","UDP","209","","0.034233000","Jan  8, 2024 13:40:19.436307000 JST","7b2273656d616e74696373223a207b22656e74697479223a2022504944222c202262617365656e74697479223a2022616e79222c2022726f6c65223a2022686868222c20227370617469616c223a2022616e79222c202274656d706f72616c223a2022616e79227d2c20226461746170726f7065727479223a207b22666f726d6174223a2022696e616f6b615f70726f6772616d5f73616d706c655f73656d616e746963227d7d","47497  >  7000 Len=167"
"27","6.919640","192.168.11.21","192.168.11.30","TCP","74","","0.021302000","Jan  8, 2024 13:40:19.457609000 JST","","58552  >  6000 [SYN] Seq=0 Win=64240 Len=0 MSS=1460 SACK_PERM TSval=2376855536 TSecr=0 WS=128"
"28","6.919827","192.168.11.30","192.168.11.21","TCP","74","0.000187000","0.000187000","Jan  8, 2024 13:40:19.457796000 JST","","6000  >  58552 [SYN, ACK] Seq=0 Ack=1 Win=65160 Len=0 MSS=1460 SACK_PERM TSval=1536967730 TSecr=2376855536 WS=128"
"29","6.942054","192.168.11.21","192.168.11.30","TCP","66","0.022227000","0.022227000","Jan  8, 2024 13:40:19.480023000 JST","","58552  >  6000 [ACK] Seq=1 Ack=1 Win=64256 Len=0 TSval=2376855569 TSecr=1536967730"
"30","6.942548","192.168.11.21","192.168.11.30","TCP","93","","0.000494000","Jan  8, 2024 13:40:19.480517000 JST","","58552  >  6000 [PSH, ACK] Seq=1 Ack=1 Win=64256 Len=27 TSval=2376855569 TSecr=1536967730 [TCP segment of a reassembled PDU]"
"31","6.942621","192.168.11.30","192.168.11.21","TCP","66","0.000073000","0.000073000","Jan  8, 2024 13:40:19.480590000 JST","","6000  >  58552 [ACK] Seq=1 Ack=28 Win=65152 Len=0 TSval=1536967753 TSecr=2376855569"
"32","6.942685","192.168.11.21","192.168.11.30","TCP","66","","0.000064000","Jan  8, 2024 13:40:19.480654000 JST","","58552  >  6000 [FIN, ACK] Seq=28 Ack=1 Win=64256 Len=0 TSval=2376855569 TSecr=1536967730"
"33","6.943634","192.168.11.30","192.168.11.21","TCP","66","0.000949000","0.000949000","Jan  8, 2024 13:40:19.481603000 JST","","6000  >  58552 [FIN, ACK] Seq=1 Ack=29 Win=65152 Len=0 TSval=1536967754 TSecr=2376855569"
"34","6.954395","192.168.11.21","192.168.11.30","TCP","66","0.010761000","0.010761000","Jan  8, 2024 13:40:19.492364000 JST","","58552  >  6000 [ACK] Seq=29 Ack=2 Win=64256 Len=0 TSval=2376855578 TSecr=1536967754"
"35","13.714923","192.168.11.30","192.168.11.10","TCP","74","","6.760528000","Jan  8, 2024 13:40:26.252892000 JST","","59948  >  6000 [SYN] Seq=0 Win=64240 Len=0 MSS=1460 SACK_PERM TSval=3581889511 TSecr=0 WS=128"
"36","13.723482","192.168.11.10","192.168.11.30","TCP","74","0.008559000","0.008559000","Jan  8, 2024 13:40:26.261451000 JST","","6000  >  59948 [SYN, ACK] Seq=0 Ack=1 Win=65160 Len=0 MSS=1460 SACK_PERM TSval=2289232766 TSecr=3581889511 WS=128"
"37","13.723602","192.168.11.30","192.168.11.10","TCP","66","0.000120000","0.000120000","Jan  8, 2024 13:40:26.261571000 JST","","59948  >  6000 [ACK] Seq=1 Ack=1 Win=64256 Len=0 TSval=3581889520 TSecr=2289232766"
"38","13.723819","192.168.11.30","192.168.11.10","TCP","93","","0.000217000","Jan  8, 2024 13:40:26.261788000 JST","","59948  >  6000 [PSH, ACK] Seq=1 Ack=1 Win=64256 Len=27 TSval=3581889520 TSecr=2289232766 [TCP segment of a reassembled PDU]"
"39","13.723924","192.168.11.30","192.168.11.10","TCP","66","","0.000105000","Jan  8, 2024 13:40:26.261893000 JST","","59948  >  6000 [FIN, ACK] Seq=28 Ack=1 Win=64256 Len=0 TSval=3581889520 TSecr=2289232766"
"40","13.733509","192.168.11.10","192.168.11.30","TCP","66","0.009690000","0.009585000","Jan  8, 2024 13:40:26.271478000 JST","","6000  >  59948 [ACK] Seq=1 Ack=28 Win=65152 Len=0 TSval=2289232775 TSecr=3581889520"
"41","13.733718","192.168.11.10","192.168.11.30","TCP","66","0.009794000","0.000209000","Jan  8, 2024 13:40:26.271687000 JST","","6000  >  59948 [FIN, ACK] Seq=1 Ack=29 Win=65152 Len=0 TSval=2289232776 TSecr=3581889520"
"42","13.733766","192.168.11.30","192.168.11.10","TCP","66","0.000048000","0.000048000","Jan  8, 2024 13:40:26.271735000 JST","","59948  >  6000 [ACK] Seq=29 Ack=2 Win=64256 Len=0 TSval=3581889530 TSecr=2289232776"
"43","13.764679","192.168.11.30","255.255.255.255","UDP","209","","0.030913000","Jan  8, 2024 13:40:26.302648000 JST","7b2273656d616e74696373223a207b22656e74697479223a2022504944222c202262617365656e74697479223a2022616e79222c2022726f6c65223a2022686868222c20227370617469616c223a2022616e79222c202274656d706f72616c223a2022616e79227d2c20226461746170726f7065727479223a207b22666f726d6174223a2022696e616f6b615f70726f6772616d5f73616d706c655f73656d616e746963227d7d","38679  >  7000 Len=167"
"44","13.781563","192.168.11.21","192.168.11.30","TCP","74","","0.016884000","Jan  8, 2024 13:40:26.319532000 JST","","42958  >  6000 [SYN] Seq=0 Win=64240 Len=0 MSS=1460 SACK_PERM TSval=2376862404 TSecr=0 WS=128"
"45","13.781708","192.168.11.30","192.168.11.21","TCP","74","0.000145000","0.000145000","Jan  8, 2024 13:40:26.319677000 JST","","6000  >  42958 [SYN, ACK] Seq=0 Ack=1 Win=65160 Len=0 MSS=1460 SACK_PERM TSval=1536974592 TSecr=2376862404 WS=128"
"46","13.788957","192.168.11.21","192.168.11.30","TCP","66","0.007249000","0.007249000","Jan  8, 2024 13:40:26.326926000 JST","","42958  >  6000 [ACK] Seq=1 Ack=1 Win=64256 Len=0 TSval=2376862415 TSecr=1536974592"
"47","13.789510","192.168.11.21","192.168.11.30","TCP","93","","0.000553000","Jan  8, 2024 13:40:26.327479000 JST","","42958  >  6000 [PSH, ACK] Seq=1 Ack=1 Win=64256 Len=27 TSval=2376862415 TSecr=1536974592 [TCP segment of a reassembled PDU]"
"48","13.789583","192.168.11.30","192.168.11.21","TCP","66","0.000073000","0.000073000","Jan  8, 2024 13:40:26.327552000 JST","","6000  >  42958 [ACK] Seq=1 Ack=28 Win=65152 Len=0 TSval=1536974600 TSecr=2376862415"
"49","13.789653","192.168.11.21","192.168.11.30","TCP","66","","0.000070000","Jan  8, 2024 13:40:26.327622000 JST","","42958  >  6000 [FIN, ACK] Seq=28 Ack=1 Win=64256 Len=0 TSval=2376862415 TSecr=1536974592"
"50","13.791331","192.168.11.30","192.168.11.21","TCP","66","0.001678000","0.001678000","Jan  8, 2024 13:40:26.329300000 JST","","6000  >  42958 [FIN, ACK] Seq=1 Ack=29 Win=65152 Len=0 TSval=1536974602 TSecr=2376862415"
"51","13.796467","192.168.11.21","192.168.11.30","TCP","66","0.005136000","0.005136000","Jan  8, 2024 13:40:26.334436000 JST","","42958  >  6000 [ACK] Seq=29 Ack=2 Win=64256 Len=0 TSval=2376862423 TSecr=1536974602"
"52","21.422307","192.168.11.30","192.168.11.10","TCP","74","","7.625840000","Jan  8, 2024 13:40:33.960276000 JST","","48484  >  6000 [SYN] Seq=0 Win=64240 Len=0 MSS=1460 SACK_PERM TSval=3581897219 TSecr=0 WS=128"
"53","21.430475","192.168.11.10","192.168.11.30","TCP","74","0.008168000","0.008168000","Jan  8, 2024 13:40:33.968444000 JST","","6000  >  48484 [SYN, ACK] Seq=0 Ack=1 Win=65160 Len=0 MSS=1460 SACK_PERM TSval=2289240473 TSecr=3581897219 WS=128"
"54","21.430578","192.168.11.30","192.168.11.10","TCP","66","0.000103000","0.000103000","Jan  8, 2024 13:40:33.968547000 JST","","48484  >  6000 [ACK] Seq=1 Ack=1 Win=64256 Len=0 TSval=3581897227 TSecr=2289240473"
"55","21.430782","192.168.11.30","192.168.11.10","TCP","93","","0.000204000","Jan  8, 2024 13:40:33.968751000 JST","","48484  >  6000 [PSH, ACK] Seq=1 Ack=1 Win=64256 Len=27 TSval=3581897227 TSecr=2289240473 [TCP segment of a reassembled PDU]"
"56","21.430890","192.168.11.30","192.168.11.10","TCP","66","","0.000108000","Jan  8, 2024 13:40:33.968859000 JST","","48484  >  6000 [FIN, ACK] Seq=28 Ack=1 Win=64256 Len=0 TSval=3581897227 TSecr=2289240473"
"57","21.438745","192.168.11.10","192.168.11.30","TCP","66","0.007963000","0.007855000","Jan  8, 2024 13:40:33.976714000 JST","","6000  >  48484 [ACK] Seq=1 Ack=28 Win=65152 Len=0 TSval=2289240482 TSecr=3581897227"
"58","21.438962","192.168.11.10","192.168.11.30","TCP","66","0.008072000","0.000217000","Jan  8, 2024 13:40:33.976931000 JST","","6000  >  48484 [FIN, ACK] Seq=1 Ack=29 Win=65152 Len=0 TSval=2289240483 TSecr=3581897227"
"59","21.439009","192.168.11.30","192.168.11.10","TCP","66","0.000047000","0.000047000","Jan  8, 2024 13:40:33.976978000 JST","","48484  >  6000 [ACK] Seq=29 Ack=2 Win=64256 Len=0 TSval=3581897236 TSecr=2289240483"
"60","21.472014","192.168.11.30","255.255.255.255","UDP","209","","0.033005000","Jan  8, 2024 13:40:34.009983000 JST","7b2273656d616e74696373223a207b22656e74697479223a2022504944222c202262617365656e74697479223a2022616e79222c2022726f6c65223a2022686868222c20227370617469616c223a2022616e79222c202274656d706f72616c223a2022616e79227d2c20226461746170726f7065727479223a207b22666f726d6174223a2022696e616f6b615f70726f6772616d5f73616d706c655f73656d616e746963227d7d","60271  >  7000 Len=167"
"61","21.481429","192.168.11.21","192.168.11.30","TCP","74","","0.009415000","Jan  8, 2024 13:40:34.019398000 JST","","42970  >  6000 [SYN] Seq=0 Win=64240 Len=0 MSS=1460 SACK_PERM TSval=2376870106 TSecr=0 WS=128"
"62","21.481578","192.168.11.30","192.168.11.21","TCP","74","0.000149000","0.000149000","Jan  8, 2024 13:40:34.019547000 JST","","6000  >  42970 [SYN, ACK] Seq=0 Ack=1 Win=65160 Len=0 MSS=1460 SACK_PERM TSval=1536982292 TSecr=2376870106 WS=128"
"63","21.488228","192.168.11.21","192.168.11.30","TCP","66","0.006650000","0.006650000","Jan  8, 2024 13:40:34.026197000 JST","","42970  >  6000 [ACK] Seq=1 Ack=1 Win=64256 Len=0 TSval=2376870115 TSecr=1536982292"
"64","21.488669","192.168.11.21","192.168.11.30","TCP","93","","0.000441000","Jan  8, 2024 13:40:34.026638000 JST","","42970  >  6000 [PSH, ACK] Seq=1 Ack=1 Win=64256 Len=27 TSval=2376870115 TSecr=1536982292 [TCP segment of a reassembled PDU]"
"65","21.488743","192.168.11.30","192.168.11.21","TCP","66","0.000074000","0.000074000","Jan  8, 2024 13:40:34.026712000 JST","","6000  >  42970 [ACK] Seq=1 Ack=28 Win=65152 Len=0 TSval=1536982299 TSecr=2376870115"
"66","21.488811","192.168.11.21","192.168.11.30","TCP","66","","0.000068000","Jan  8, 2024 13:40:34.026780000 JST","","42970  >  6000 [FIN, ACK] Seq=28 Ack=1 Win=64256 Len=0 TSval=2376870115 TSecr=1536982292"
"67","21.489889","192.168.11.30","192.168.11.21","TCP","66","0.001078000","0.001078000","Jan  8, 2024 13:40:34.027858000 JST","","6000  >  42970 [FIN, ACK] Seq=1 Ack=29 Win=65152 Len=0 TSval=1536982300 TSecr=2376870115"
"68","21.495892","192.168.11.21","192.168.11.30","TCP","66","0.006003000","0.006003000","Jan  8, 2024 13:40:34.033861000 JST","","42970  >  6000 [ACK] Seq=29 Ack=2 Win=64256 Len=0 TSval=2376870122 TSecr=1536982300"
"69","29.152670","192.168.11.30","192.168.11.10","TCP","74","","7.656778000","Jan  8, 2024 13:40:41.690639000 JST","","48498  >  6000 [SYN] Seq=0 Win=64240 Len=0 MSS=1460 SACK_PERM TSval=3581904949 TSecr=0 WS=128"
"70","29.161363","192.168.11.10","192.168.11.30","TCP","74","0.008693000","0.008693000","Jan  8, 2024 13:40:41.699332000 JST","","6000  >  48498 [SYN, ACK] Seq=0 Ack=1 Win=65160 Len=0 MSS=1460 SACK_PERM TSval=2289248204 TSecr=3581904949 WS=128"
"71","29.161483","192.168.11.30","192.168.11.10","TCP","66","0.000120000","0.000120000","Jan  8, 2024 13:40:41.699452000 JST","","48498  >  6000 [ACK] Seq=1 Ack=1 Win=64256 Len=0 TSval=3581904958 TSecr=2289248204"
"72","29.161674","192.168.11.30","192.168.11.10","TCP","93","","0.000191000","Jan  8, 2024 13:40:41.699643000 JST","","48498  >  6000 [PSH, ACK] Seq=1 Ack=1 Win=64256 Len=27 TSval=3581904958 TSecr=2289248204 [TCP segment of a reassembled PDU]"
"73","29.161770","192.168.11.30","192.168.11.10","TCP","66","","0.000096000","Jan  8, 2024 13:40:41.699739000 JST","","48498  >  6000 [FIN, ACK] Seq=28 Ack=1 Win=64256 Len=0 TSval=3581904958 TSecr=2289248204"
"74","29.169578","192.168.11.10","192.168.11.30","TCP","66","0.007904000","0.007808000","Jan  8, 2024 13:40:41.707547000 JST","","6000  >  48498 [ACK] Seq=1 Ack=28 Win=65152 Len=0 TSval=2289248213 TSecr=3581904958"
"75","29.169816","192.168.11.10","192.168.11.30","TCP","66","0.008046000","0.000238000","Jan  8, 2024 13:40:41.707785000 JST","","6000  >  48498 [FIN, ACK] Seq=1 Ack=29 Win=65152 Len=0 TSval=2289248214 TSecr=3581904958"
"76","29.169878","192.168.11.30","192.168.11.10","TCP","66","0.000062000","0.000062000","Jan  8, 2024 13:40:41.707847000 JST","","48498  >  6000 [ACK] Seq=29 Ack=2 Win=64256 Len=0 TSval=3581904966 TSecr=2289248214"
"77","29.203726","192.168.11.30","255.255.255.255","UDP","209","","0.033848000","Jan  8, 2024 13:40:41.741695000 JST","7b2273656d616e74696373223a207b22656e74697479223a2022504944222c202262617365656e74697479223a2022616e79222c2022726f6c65223a2022686868222c20227370617469616c223a2022616e79222c202274656d706f72616c223a2022616e79227d2c20226461746170726f7065727479223a207b22666f726d6174223a2022696e616f6b615f70726f6772616d5f73616d706c655f73656d616e746963227d7d","54151  >  7000 Len=167"
"78","29.211265","192.168.11.21","192.168.11.30","TCP","74","","0.007539000","Jan  8, 2024 13:40:41.749234000 JST","","39172  >  6000 [SYN] Seq=0 Win=64240 Len=0 MSS=1460 SACK_PERM TSval=2376877838 TSecr=0 WS=128"
"79","29.211415","192.168.11.30","192.168.11.21","TCP","74","0.000150000","0.000150000","Jan  8, 2024 13:40:41.749384000 JST","","6000  >  39172 [SYN, ACK] Seq=0 Ack=1 Win=65160 Len=0 MSS=1460 SACK_PERM TSval=1536990022 TSecr=2376877838 WS=128"
"80","29.218400","192.168.11.21","192.168.11.30","TCP","66","0.006985000","0.006985000","Jan  8, 2024 13:40:41.756369000 JST","","39172  >  6000 [ACK] Seq=1 Ack=1 Win=64256 Len=0 TSval=2376877845 TSecr=1536990022"
"81","29.218968","192.168.11.21","192.168.11.30","TCP","93","","0.000568000","Jan  8, 2024 13:40:41.756937000 JST","","39172  >  6000 [PSH, ACK] Seq=1 Ack=1 Win=64256 Len=27 TSval=2376877845 TSecr=1536990022 [TCP segment of a reassembled PDU]"
"82","29.219076","192.168.11.30","192.168.11.21","TCP","66","0.000108000","0.000108000","Jan  8, 2024 13:40:41.757045000 JST","","6000  >  39172 [ACK] Seq=1 Ack=28 Win=65152 Len=0 TSval=1536990030 TSecr=2376877845"
"83","29.219152","192.168.11.21","192.168.11.30","TCP","66","","0.000076000","Jan  8, 2024 13:40:41.757121000 JST","","39172  >  6000 [FIN, ACK] Seq=28 Ack=1 Win=64256 Len=0 TSval=2376877845 TSecr=1536990022"
"84","29.220431","192.168.11.30","192.168.11.21","TCP","66","0.001279000","0.001279000","Jan  8, 2024 13:40:41.758400000 JST","","6000  >  39172 [FIN, ACK] Seq=1 Ack=29 Win=65152 Len=0 TSval=1536990031 TSecr=2376877845"
"85","29.237255","192.168.11.21","192.168.11.30","TCP","66","0.016824000","0.016824000","Jan  8, 2024 13:40:41.775224000 JST","","39172  >  6000 [ACK] Seq=29 Ack=2 Win=64256 Len=0 TSval=2376877852 TSecr=1536990031"
"86","35.893345","192.168.11.30","192.168.11.10","TCP","74","","6.656090000","Jan  8, 2024 13:40:48.431314000 JST","","41712  >  6000 [SYN] Seq=0 Win=64240 Len=0 MSS=1460 SACK_PERM TSval=3581911690 TSecr=0 WS=128"
"87","35.905212","192.168.11.10","192.168.11.30","TCP","74","0.011867000","0.011867000","Jan  8, 2024 13:40:48.443181000 JST","","6000  >  41712 [SYN, ACK] Seq=0 Ack=1 Win=65160 Len=0 MSS=1460 SACK_PERM TSval=2289254947 TSecr=3581911690 WS=128"
"88","35.905346","192.168.11.30","192.168.11.10","TCP","66","0.000134000","0.000134000","Jan  8, 2024 13:40:48.443315000 JST","","41712  >  6000 [ACK] Seq=1 Ack=1 Win=64256 Len=0 TSval=3581911702 TSecr=2289254947"
"89","35.905511","192.168.11.30","192.168.11.10","TCP","93","","0.000165000","Jan  8, 2024 13:40:48.443480000 JST","","41712  >  6000 [PSH, ACK] Seq=1 Ack=1 Win=64256 Len=27 TSval=3581911702 TSecr=2289254947 [TCP segment of a reassembled PDU]"
"90","35.905610","192.168.11.30","192.168.11.10","TCP","66","","0.000099000","Jan  8, 2024 13:40:48.443579000 JST","","41712  >  6000 [FIN, ACK] Seq=28 Ack=1 Win=64256 Len=0 TSval=3581911702 TSecr=2289254947"
"91","35.916709","192.168.11.10","192.168.11.30","TCP","66","0.011198000","0.011099000","Jan  8, 2024 13:40:48.454678000 JST","","6000  >  41712 [ACK] Seq=1 Ack=28 Win=65152 Len=0 TSval=2289254959 TSecr=3581911702"
"92","35.917113","192.168.11.10","192.168.11.30","TCP","66","","0.000404000","Jan  8, 2024 13:40:48.455082000 JST","","6000  >  41712 [FIN, ACK] Seq=1 Ack=28 Win=65152 Len=0 TSval=2289254960 TSecr=3581911702"
"93","35.917167","192.168.11.30","192.168.11.10","TCP","66","0.000054000","0.000054000","Jan  8, 2024 13:40:48.455136000 JST","","41712  >  6000 [ACK] Seq=29 Ack=2 Win=64256 Len=0 TSval=3581911714 TSecr=2289254960"
"94","35.919046","192.168.11.10","192.168.11.30","TCP","66","0.013436000","0.001879000","Jan  8, 2024 13:40:48.457015000 JST","","6000  >  41712 [ACK] Seq=2 Ack=29 Win=65152 Len=0 TSval=2289254963 TSecr=3581911702"
"95","35.946938","192.168.11.30","255.255.255.255","UDP","209","","0.027892000","Jan  8, 2024 13:40:48.484907000 JST","7b2273656d616e74696373223a207b22656e74697479223a2022504944222c202262617365656e74697479223a2022616e79222c2022726f6c65223a2022686868222c20227370617469616c223a2022616e79222c202274656d706f72616c223a2022616e79227d2c20226461746170726f7065727479223a207b22666f726d6174223a2022696e616f6b615f70726f6772616d5f73616d706c655f73656d616e746963227d7d","35678  >  7000 Len=167"
"96","35.957693","192.168.11.21","192.168.11.30","TCP","74","","0.010755000","Jan  8, 2024 13:40:48.495662000 JST","","54944  >  6000 [SYN] Seq=0 Win=64240 Len=0 MSS=1460 SACK_PERM TSval=2376884584 TSecr=0 WS=128"
"97","35.957837","192.168.11.30","192.168.11.21","TCP","74","0.000144000","0.000144000","Jan  8, 2024 13:40:48.495806000 JST","","6000  >  54944 [SYN, ACK] Seq=0 Ack=1 Win=65160 Len=0 MSS=1460 SACK_PERM TSval=1536996768 TSecr=2376884584 WS=128"
"98","35.965364","192.168.11.21","192.168.11.30","TCP","66","0.007527000","0.007527000","Jan  8, 2024 13:40:48.503333000 JST","","54944  >  6000 [ACK] Seq=1 Ack=1 Win=64256 Len=0 TSval=2376884592 TSecr=1536996768"
"99","35.965835","192.168.11.21","192.168.11.30","TCP","93","","0.000471000","Jan  8, 2024 13:40:48.503804000 JST","","54944  >  6000 [PSH, ACK] Seq=1 Ack=1 Win=64256 Len=27 TSval=2376884592 TSecr=1536996768 [TCP segment of a reassembled PDU]"
"100","35.965923","192.168.11.30","192.168.11.21","TCP","66","0.000088000","0.000088000","Jan  8, 2024 13:40:48.503892000 JST","","6000  >  54944 [ACK] Seq=1 Ack=28 Win=65152 Len=0 TSval=1536996776 TSecr=2376884592"
"101","35.966024","192.168.11.21","192.168.11.30","TCP","66","","0.000101000","Jan  8, 2024 13:40:48.503993000 JST","","54944  >  6000 [FIN, ACK] Seq=28 Ack=1 Win=64256 Len=0 TSval=2376884592 TSecr=1536996768"
"102","35.966996","192.168.11.30","192.168.11.21","TCP","66","0.000972000","0.000972000","Jan  8, 2024 13:40:48.504965000 JST","","6000  >  54944 [FIN, ACK] Seq=1 Ack=29 Win=65152 Len=0 TSval=1536996778 TSecr=2376884592"
"103","35.973173","192.168.11.21","192.168.11.30","TCP","66","0.006177000","0.006177000","Jan  8, 2024 13:40:48.511142000 JST","","54944  >  6000 [ACK] Seq=29 Ack=2 Win=64256 Len=0 TSval=2376884599 TSecr=1536996778"
"104","42.646068","192.168.11.30","192.168.11.10","TCP","74","","6.672895000","Jan  8, 2024 13:40:55.184037000 JST","","36144  >  6000 [SYN] Seq=0 Win=64240 Len=0 MSS=1460 SACK_PERM TSval=3581918443 TSecr=0 WS=128"
"105","42.654539","192.168.11.10","192.168.11.30","TCP","74","0.008471000","0.008471000","Jan  8, 2024 13:40:55.192508000 JST","","6000  >  36144 [SYN, ACK] Seq=0 Ack=1 Win=65160 Len=0 MSS=1460 SACK_PERM TSval=2289261697 TSecr=3581918443 WS=128"
"106","42.654668","192.168.11.30","192.168.11.10","TCP","66","0.000129000","0.000129000","Jan  8, 2024 13:40:55.192637000 JST","","36144  >  6000 [ACK] Seq=1 Ack=1 Win=64256 Len=0 TSval=3581918451 TSecr=2289261697"
"107","42.654822","192.168.11.30","192.168.11.10","TCP","93","","0.000154000","Jan  8, 2024 13:40:55.192791000 JST","","36144  >  6000 [PSH, ACK] Seq=1 Ack=1 Win=64256 Len=27 TSval=3581918451 TSecr=2289261697 [TCP segment of a reassembled PDU]"
"108","42.654944","192.168.11.30","192.168.11.10","TCP","66","","0.000122000","Jan  8, 2024 13:40:55.192913000 JST","","36144  >  6000 [FIN, ACK] Seq=28 Ack=1 Win=64256 Len=0 TSval=3581918451 TSecr=2289261697"
"109","42.663970","192.168.11.10","192.168.11.30","TCP","66","0.009148000","0.009026000","Jan  8, 2024 13:40:55.201939000 JST","","6000  >  36144 [ACK] Seq=1 Ack=28 Win=65152 Len=0 TSval=2289261706 TSecr=3581918451"
"110","42.664335","192.168.11.10","192.168.11.30","TCP","66","0.009391000","0.000365000","Jan  8, 2024 13:40:55.202304000 JST","","6000  >  36144 [FIN, ACK] Seq=1 Ack=29 Win=65152 Len=0 TSval=2289261708 TSecr=3581918451"
"111","42.664404","192.168.11.30","192.168.11.10","TCP","66","0.000069000","0.000069000","Jan  8, 2024 13:40:55.202373000 JST","","36144  >  6000 [ACK] Seq=29 Ack=2 Win=64256 Len=0 TSval=3581918461 TSecr=2289261708"
"112","42.694982","192.168.11.30","255.255.255.255","UDP","209","","0.030578000","Jan  8, 2024 13:40:55.232951000 JST","7b2273656d616e74696373223a207b22656e74697479223a2022504944222c202262617365656e74697479223a2022616e79222c2022726f6c65223a2022686868222c20227370617469616c223a2022616e79222c202274656d706f72616c223a2022616e79227d2c20226461746170726f7065727479223a207b22666f726d6174223a2022696e616f6b615f70726f6772616d5f73616d706c655f73656d616e746963227d7d","45604  >  7000 Len=167"
"113","42.702516","192.168.11.21","192.168.11.30","TCP","74","","0.007534000","Jan  8, 2024 13:40:55.240485000 JST","","54960  >  6000 [SYN] Seq=0 Win=64240 Len=0 MSS=1460 SACK_PERM TSval=2376891329 TSecr=0 WS=128"
"114","42.702694","192.168.11.30","192.168.11.21","TCP","74","0.000178000","0.000178000","Jan  8, 2024 13:40:55.240663000 JST","","6000  >  54960 [SYN, ACK] Seq=0 Ack=1 Win=65160 Len=0 MSS=1460 SACK_PERM TSval=1537003513 TSecr=2376891329 WS=128"
"115","42.712737","192.168.11.21","192.168.11.30","TCP","66","0.010043000","0.010043000","Jan  8, 2024 13:40:55.250706000 JST","","54960  >  6000 [ACK] Seq=1 Ack=1 Win=64256 Len=0 TSval=2376891336 TSecr=1537003513"
"116","42.713244","192.168.11.21","192.168.11.30","TCP","93","","0.000507000","Jan  8, 2024 13:40:55.251213000 JST","","54960  >  6000 [PSH, ACK] Seq=1 Ack=1 Win=64256 Len=27 TSval=2376891336 TSecr=1537003513 [TCP segment of a reassembled PDU]"
"117","42.713340","192.168.11.30","192.168.11.21","TCP","66","0.000096000","0.000096000","Jan  8, 2024 13:40:55.251309000 JST","","6000  >  54960 [ACK] Seq=1 Ack=28 Win=65152 Len=0 TSval=1537003524 TSecr=2376891336"
"118","42.713403","192.168.11.21","192.168.11.30","TCP","66","","0.000063000","Jan  8, 2024 13:40:55.251372000 JST","","54960  >  6000 [FIN, ACK] Seq=28 Ack=1 Win=64256 Len=0 TSval=2376891336 TSecr=1537003513"
"119","42.714453","192.168.11.30","192.168.11.21","TCP","66","0.001050000","0.001050000","Jan  8, 2024 13:40:55.252422000 JST","","6000  >  54960 [FIN, ACK] Seq=1 Ack=29 Win=65152 Len=0 TSval=1537003525 TSecr=2376891336"
"120","42.720617","192.168.11.21","192.168.11.30","TCP","66","0.006164000","0.006164000","Jan  8, 2024 13:40:55.258586000 JST","","54960  >  6000 [ACK] Seq=29 Ack=2 Win=64256 Len=0 TSval=2376891347 TSecr=1537003525"
"121","49.391358","192.168.11.30","192.168.11.10","TCP","74","","6.670741000","Jan  8, 2024 13:41:01.929327000 JST","","36156  >  6000 [SYN] Seq=0 Win=64240 Len=0 MSS=1460 SACK_PERM TSval=3581925188 TSecr=0 WS=128"
"122","49.401162","192.168.11.10","192.168.11.30","TCP","74","0.009804000","0.009804000","Jan  8, 2024 13:41:01.939131000 JST","","6000  >  36156 [SYN, ACK] Seq=0 Ack=1 Win=65160 Len=0 MSS=1460 SACK_PERM TSval=2289268444 TSecr=3581925188 WS=128"
"123","49.401286","192.168.11.30","192.168.11.10","TCP","66","0.000124000","0.000124000","Jan  8, 2024 13:41:01.939255000 JST","","36156  >  6000 [ACK] Seq=1 Ack=1 Win=64256 Len=0 TSval=3581925198 TSecr=2289268444"
"124","49.401498","192.168.11.30","192.168.11.10","TCP","93","","0.000212000","Jan  8, 2024 13:41:01.939467000 JST","","36156  >  6000 [PSH, ACK] Seq=1 Ack=1 Win=64256 Len=27 TSval=3581925198 TSecr=2289268444 [TCP segment of a reassembled PDU]"
"125","49.401603","192.168.11.30","192.168.11.10","TCP","66","","0.000105000","Jan  8, 2024 13:41:01.939572000 JST","","36156  >  6000 [FIN, ACK] Seq=28 Ack=1 Win=64256 Len=0 TSval=3581925198 TSecr=2289268444"
"126","49.409481","192.168.11.10","192.168.11.30","TCP","66","0.007983000","0.007878000","Jan  8, 2024 13:41:01.947450000 JST","","6000  >  36156 [ACK] Seq=1 Ack=28 Win=65152 Len=0 TSval=2289268453 TSecr=3581925198"
"127","49.411898","192.168.11.10","192.168.11.30","TCP","66","0.010295000","0.002417000","Jan  8, 2024 13:41:01.949867000 JST","","6000  >  36156 [FIN, ACK] Seq=1 Ack=29 Win=65152 Len=0 TSval=2289268455 TSecr=3581925198"
"128","49.411956","192.168.11.30","192.168.11.10","TCP","66","0.000058000","0.000058000","Jan  8, 2024 13:41:01.949925000 JST","","36156  >  6000 [ACK] Seq=29 Ack=2 Win=64256 Len=0 TSval=3581925208 TSecr=2289268455"
"129","49.442655","192.168.11.30","255.255.255.255","UDP","209","","0.030699000","Jan  8, 2024 13:41:01.980624000 JST","7b2273656d616e74696373223a207b22656e74697479223a2022504944222c202262617365656e74697479223a2022616e79222c2022726f6c65223a2022686868222c20227370617469616c223a2022616e79222c202274656d706f72616c223a2022616e79227d2c20226461746170726f7065727479223a207b22666f726d6174223a2022696e616f6b615f70726f6772616d5f73616d706c655f73656d616e746963227d7d","56467  >  7000 Len=167"
"130","49.450283","192.168.11.21","192.168.11.30","TCP","74","","0.007628000","Jan  8, 2024 13:41:01.988252000 JST","","47786  >  6000 [SYN] Seq=0 Win=64240 Len=0 MSS=1460 SACK_PERM TSval=2376898077 TSecr=0 WS=128"
"131","49.450438","192.168.11.30","192.168.11.21","TCP","74","0.000155000","0.000155000","Jan  8, 2024 13:41:01.988407000 JST","","6000  >  47786 [SYN, ACK] Seq=0 Ack=1 Win=65160 Len=0 MSS=1460 SACK_PERM TSval=1537010261 TSecr=2376898077 WS=128"
"132","49.458593","192.168.11.21","192.168.11.30","TCP","66","0.008155000","0.008155000","Jan  8, 2024 13:41:01.996562000 JST","","47786  >  6000 [ACK] Seq=1 Ack=1 Win=64256 Len=0 TSval=2376898084 TSecr=1537010261"
"133","49.459275","192.168.11.21","192.168.11.30","TCP","93","","0.000682000","Jan  8, 2024 13:41:01.997244000 JST","","47786  >  6000 [PSH, ACK] Seq=1 Ack=1 Win=64256 Len=27 TSval=2376898084 TSecr=1537010261 [TCP segment of a reassembled PDU]"
"134","49.459406","192.168.11.30","192.168.11.21","TCP","66","0.000131000","0.000131000","Jan  8, 2024 13:41:01.997375000 JST","","6000  >  47786 [ACK] Seq=1 Ack=28 Win=65152 Len=0 TSval=1537010270 TSecr=2376898084"
"135","49.459502","192.168.11.21","192.168.11.30","TCP","66","","0.000096000","Jan  8, 2024 13:41:01.997471000 JST","","47786  >  6000 [FIN, ACK] Seq=28 Ack=1 Win=64256 Len=0 TSval=2376898084 TSecr=1537010261"
"136","49.460980","192.168.11.30","192.168.11.21","TCP","66","0.001478000","0.001478000","Jan  8, 2024 13:41:01.998949000 JST","","6000  >  47786 [FIN, ACK] Seq=1 Ack=29 Win=65152 Len=0 TSval=1537010271 TSecr=2376898084"
"137","49.468125","192.168.11.21","192.168.11.30","TCP","66","0.007145000","0.007145000","Jan  8, 2024 13:41:02.006094000 JST","","47786  >  6000 [ACK] Seq=29 Ack=2 Win=64256 Len=0 TSval=2376898094 TSecr=1537010271"
"138","56.104513","192.168.11.30","192.168.11.10","TCP","74","","6.636388000","Jan  8, 2024 13:41:08.642482000 JST","","50920  >  6000 [SYN] Seq=0 Win=64240 Len=0 MSS=1460 SACK_PERM TSval=3581931901 TSecr=0 WS=128"
"139","56.114436","192.168.11.10","192.168.11.30","TCP","74","0.009923000","0.009923000","Jan  8, 2024 13:41:08.652405000 JST","","6000  >  50920 [SYN, ACK] Seq=0 Ack=1 Win=65160 Len=0 MSS=1460 SACK_PERM TSval=2289275157 TSecr=3581931901 WS=128"
"140","56.114553","192.168.11.30","192.168.11.10","TCP","66","0.000117000","0.000117000","Jan  8, 2024 13:41:08.652522000 JST","","50920  >  6000 [ACK] Seq=1 Ack=1 Win=64256 Len=0 TSval=3581931911 TSecr=2289275157"
"141","56.114748","192.168.11.30","192.168.11.10","TCP","93","","0.000195000","Jan  8, 2024 13:41:08.652717000 JST","","50920  >  6000 [PSH, ACK] Seq=1 Ack=1 Win=64256 Len=27 TSval=3581931911 TSecr=2289275157 [TCP segment of a reassembled PDU]"
"142","56.114857","192.168.11.30","192.168.11.10","TCP","66","","0.000109000","Jan  8, 2024 13:41:08.652826000 JST","","50920  >  6000 [FIN, ACK] Seq=28 Ack=1 Win=64256 Len=0 TSval=3581931911 TSecr=2289275157"
"143","56.122935","192.168.11.10","192.168.11.30","TCP","66","0.008187000","0.008078000","Jan  8, 2024 13:41:08.660904000 JST","","6000  >  50920 [ACK] Seq=1 Ack=28 Win=65152 Len=0 TSval=2289275166 TSecr=3581931911"
"144","56.123164","192.168.11.10","192.168.11.30","TCP","66","0.008307000","0.000229000","Jan  8, 2024 13:41:08.661133000 JST","","6000  >  50920 [FIN, ACK] Seq=1 Ack=29 Win=65152 Len=0 TSval=2289275167 TSecr=3581931911"
"145","56.123219","192.168.11.30","192.168.11.10","TCP","66","0.000055000","0.000055000","Jan  8, 2024 13:41:08.661188000 JST","","50920  >  6000 [ACK] Seq=29 Ack=2 Win=64256 Len=0 TSval=3581931920 TSecr=2289275167"
"146","56.158575","192.168.11.30","255.255.255.255","UDP","209","","0.035356000","Jan  8, 2024 13:41:08.696544000 JST","7b2273656d616e74696373223a207b22656e74697479223a2022504944222c202262617365656e74697479223a2022616e79222c2022726f6c65223a2022686868222c20227370617469616c223a2022616e79222c202274656d706f72616c223a2022616e79227d2c20226461746170726f7065727479223a207b22666f726d6174223a2022696e616f6b615f70726f6772616d5f73616d706c655f73656d616e746963227d7d","42385  >  7000 Len=167"
"147","56.166219","192.168.11.21","192.168.11.30","TCP","74","","0.007644000","Jan  8, 2024 13:41:08.704188000 JST","","38096  >  6000 [SYN] Seq=0 Win=64240 Len=0 MSS=1460 SACK_PERM TSval=2376904793 TSecr=0 WS=128"
"148","56.166373","192.168.11.30","192.168.11.21","TCP","74","0.000154000","0.000154000","Jan  8, 2024 13:41:08.704342000 JST","","6000  >  38096 [SYN, ACK] Seq=0 Ack=1 Win=65160 Len=0 MSS=1460 SACK_PERM TSval=1537016977 TSecr=2376904793 WS=128"
"149","56.172992","192.168.11.21","192.168.11.30","TCP","66","0.006619000","0.006619000","Jan  8, 2024 13:41:08.710961000 JST","","38096  >  6000 [ACK] Seq=1 Ack=1 Win=64256 Len=0 TSval=2376904799 TSecr=1537016977"
"150","56.173676","192.168.11.21","192.168.11.30","TCP","93","","0.000684000","Jan  8, 2024 13:41:08.711645000 JST","","38096  >  6000 [PSH, ACK] Seq=1 Ack=1 Win=64256 Len=27 TSval=2376904800 TSecr=1537016977 [TCP segment of a reassembled PDU]"
"151","56.173813","192.168.11.30","192.168.11.21","TCP","66","0.000137000","0.000137000","Jan  8, 2024 13:41:08.711782000 JST","","6000  >  38096 [ACK] Seq=1 Ack=28 Win=65152 Len=0 TSval=1537016984 TSecr=2376904800"
"152","56.173902","192.168.11.21","192.168.11.30","TCP","66","","0.000089000","Jan  8, 2024 13:41:08.711871000 JST","","38096  >  6000 [FIN, ACK] Seq=28 Ack=1 Win=64256 Len=0 TSval=2376904800 TSecr=1537016977"
"153","56.175419","192.168.11.30","192.168.11.21","TCP","66","0.001517000","0.001517000","Jan  8, 2024 13:41:08.713388000 JST","","6000  >  38096 [FIN, ACK] Seq=1 Ack=29 Win=65152 Len=0 TSval=1537016986 TSecr=2376904800"
"154","56.180916","192.168.11.21","192.168.11.30","TCP","66","0.005497000","0.005497000","Jan  8, 2024 13:41:08.718885000 JST","","38096  >  6000 [ACK] Seq=29 Ack=2 Win=64256 Len=0 TSval=2376904807 TSecr=1537016986"
"155","62.802405","192.168.11.30","192.168.11.10","TCP","74","","6.621489000","Jan  8, 2024 13:41:15.340374000 JST","","41640  >  6000 [SYN] Seq=0 Win=64240 Len=0 MSS=1460 SACK_PERM TSval=3581938599 TSecr=0 WS=128"
"156","62.813272","192.168.11.10","192.168.11.30","TCP","74","0.010867000","0.010867000","Jan  8, 2024 13:41:15.351241000 JST","","6000  >  41640 [SYN, ACK] Seq=0 Ack=1 Win=65160 Len=0 MSS=1460 SACK_PERM TSval=2289281855 TSecr=3581938599 WS=128"
"157","62.813388","192.168.11.30","192.168.11.10","TCP","66","0.000116000","0.000116000","Jan  8, 2024 13:41:15.351357000 JST","","41640  >  6000 [ACK] Seq=1 Ack=1 Win=64256 Len=0 TSval=3581938610 TSecr=2289281855"
"158","62.813588","192.168.11.30","192.168.11.10","TCP","93","","0.000200000","Jan  8, 2024 13:41:15.351557000 JST","","41640  >  6000 [PSH, ACK] Seq=1 Ack=1 Win=64256 Len=27 TSval=3581938610 TSecr=2289281855 [TCP segment of a reassembled PDU]"
"159","62.813685","192.168.11.30","192.168.11.10","TCP","66","","0.000097000","Jan  8, 2024 13:41:15.351654000 JST","","41640  >  6000 [FIN, ACK] Seq=28 Ack=1 Win=64256 Len=0 TSval=3581938610 TSecr=2289281855"
"160","62.822832","192.168.11.10","192.168.11.30","TCP","66","0.009244000","0.009147000","Jan  8, 2024 13:41:15.360801000 JST","","6000  >  41640 [ACK] Seq=1 Ack=28 Win=65152 Len=0 TSval=2289281866 TSecr=3581938610"
"161","62.823041","192.168.11.10","192.168.11.30","TCP","66","0.009356000","0.000209000","Jan  8, 2024 13:41:15.361010000 JST","","6000  >  41640 [FIN, ACK] Seq=1 Ack=29 Win=65152 Len=0 TSval=2289281867 TSecr=3581938610"
"162","62.823091","192.168.11.30","192.168.11.10","TCP","66","0.000050000","0.000050000","Jan  8, 2024 13:41:15.361060000 JST","","41640  >  6000 [ACK] Seq=29 Ack=2 Win=64256 Len=0 TSval=3581938620 TSecr=2289281867"
"163","62.855286","192.168.11.30","255.255.255.255","UDP","209","","0.032195000","Jan  8, 2024 13:41:15.393255000 JST","7b2273656d616e74696373223a207b22656e74697479223a2022504944222c202262617365656e74697479223a2022616e79222c2022726f6c65223a2022686868222c20227370617469616c223a2022616e79222c202274656d706f72616c223a2022616e79227d2c20226461746170726f7065727479223a207b22666f726d6174223a2022696e616f6b615f70726f6772616d5f73616d706c655f73656d616e746963227d7d","52124  >  7000 Len=167"
"164","62.862841","192.168.11.21","192.168.11.30","TCP","74","","0.007555000","Jan  8, 2024 13:41:15.400810000 JST","","38098  >  6000 [SYN] Seq=0 Win=64240 Len=0 MSS=1460 SACK_PERM TSval=2376911489 TSecr=0 WS=128"
"165","62.863001","192.168.11.30","192.168.11.21","TCP","74","0.000160000","0.000160000","Jan  8, 2024 13:41:15.400970000 JST","","6000  >  38098 [SYN, ACK] Seq=0 Ack=1 Win=65160 Len=0 MSS=1460 SACK_PERM TSval=1537023674 TSecr=2376911489 WS=128"
"166","62.869729","192.168.11.21","192.168.11.30","TCP","66","0.006728000","0.006728000","Jan  8, 2024 13:41:15.407698000 JST","","38098  >  6000 [ACK] Seq=1 Ack=1 Win=64256 Len=0 TSval=2376911496 TSecr=1537023674"
"167","62.870480","192.168.11.21","192.168.11.30","TCP","93","","0.000751000","Jan  8, 2024 13:41:15.408449000 JST","","38098  >  6000 [PSH, ACK] Seq=1 Ack=1 Win=64256 Len=27 TSval=2376911496 TSecr=1537023674 [TCP segment of a reassembled PDU]"
