"No.","Time","Source","Destination","Protocol","Length","The RTT to ACK the segment was","Time delta from previous captured frame","Arrival Time","Data","Info"
"1","0.000000","192.168.11.7","192.168.11.28","TCP","74","","0.000000000","Jan  8, 2024 13:40:12.532275000 JST","","60084  >  6000 [SYN] Seq=0 Win=64240 Len=0 MSS=1460 SACK_PERM TSval=624196798 TSecr=0 WS=128"
"2","0.010117","192.168.11.28","192.168.11.7","TCP","74","0.010117000","0.010117000","Jan  8, 2024 13:40:12.542392000 JST","","6000  >  60084 [SYN, ACK] Seq=0 Ack=1 Win=65160 Len=0 MSS=1460 SACK_PERM TSval=2670740583 TSecr=624196798 WS=128"
"3","0.010229","192.168.11.7","192.168.11.28","TCP","66","0.000112000","0.000112000","Jan  8, 2024 13:40:12.542504000 JST","","60084  >  6000 [ACK] Seq=1 Ack=1 Win=64256 Len=0 TSval=624196808 TSecr=2670740583"
"4","0.010469","192.168.11.7","192.168.11.28","TCP","93","","0.000240000","Jan  8, 2024 13:40:12.542744000 JST","","60084  >  6000 [PSH, ACK] Seq=1 Ack=1 Win=64256 Len=27 TSval=624196809 TSecr=2670740583 [TCP segment of a reassembled PDU]"
"5","0.010580","192.168.11.7","192.168.11.28","TCP","66","","0.000111000","Jan  8, 2024 13:40:12.542855000 JST","","60084  >  6000 [FIN, ACK] Seq=28 Ack=1 Win=64256 Len=0 TSval=624196809 TSecr=2670740583"
"6","0.018541","192.168.11.28","192.168.11.7","TCP","66","0.008072000","0.007961000","Jan  8, 2024 13:40:12.550816000 JST","","6000  >  60084 [ACK] Seq=1 Ack=28 Win=65152 Len=0 TSval=2670740592 TSecr=624196809"
"7","0.018918","192.168.11.28","192.168.11.7","TCP","66","","0.000377000","Jan  8, 2024 13:40:12.551193000 JST","","[TCP Dup ACK 6#1] 6000  >  60084 [ACK] Seq=1 Ack=28 Win=65152 Len=0 TSval=2670740592 TSecr=624196809"
"8","0.018969","192.168.11.28","192.168.11.7","TCP","66","0.008389000","0.000051000","Jan  8, 2024 13:40:12.551244000 JST","","6000  >  60084 [FIN, ACK] Seq=1 Ack=29 Win=65152 Len=0 TSval=2670740594 TSecr=624196809"
"9","0.019013","192.168.11.7","192.168.11.28","TCP","66","0.000044000","0.000044000","Jan  8, 2024 13:40:12.551288000 JST","","60084  >  6000 [ACK] Seq=29 Ack=2 Win=64256 Len=0 TSval=624196817 TSecr=2670740594"
"10","0.051348","192.168.11.7","255.255.255.255","UDP","209","","0.032335000","Jan  8, 2024 13:40:12.583623000 JST","7b2273656d616e74696373223a207b22656e74697479223a2022504944222c202262617365656e74697479223a2022616e79222c2022726f6c65223a20226b6b6b222c20227370617469616c223a2022616e79222c202274656d706f72616c223a2022616e79227d2c20226461746170726f7065727479223a207b22666f726d6174223a2022696e616f6b615f70726f6772616d5f73616d706c655f73656d616e746963227d7d","48370  >  7000 Len=167"
"11","0.070098","192.168.11.26","192.168.11.7","TCP","74","","0.018750000","Jan  8, 2024 13:40:12.602373000 JST","","52260  >  6000 [SYN] Seq=0 Win=64240 Len=0 MSS=1460 SACK_PERM TSval=141349137 TSecr=0 WS=128"
"12","0.070314","192.168.11.7","192.168.11.26","TCP","74","0.000216000","0.000216000","Jan  8, 2024 13:40:12.602589000 JST","","6000  >  52260 [SYN, ACK] Seq=0 Ack=1 Win=65160 Len=0 MSS=1460 SACK_PERM TSval=987788160 TSecr=141349137 WS=128"
"13","0.087802","192.168.11.26","192.168.11.7","TCP","66","0.017488000","0.017488000","Jan  8, 2024 13:40:12.620077000 JST","","52260  >  6000 [ACK] Seq=1 Ack=1 Win=64256 Len=0 TSval=141349158 TSecr=987788160"
"14","0.088270","192.168.11.26","192.168.11.7","TCP","93","","0.000468000","Jan  8, 2024 13:40:12.620545000 JST","","52260  >  6000 [PSH, ACK] Seq=1 Ack=1 Win=64256 Len=27 TSval=141349158 TSecr=987788160 [TCP segment of a reassembled PDU]"
"15","0.088355","192.168.11.7","192.168.11.26","TCP","66","0.000085000","0.000085000","Jan  8, 2024 13:40:12.620630000 JST","","6000  >  52260 [ACK] Seq=1 Ack=28 Win=65152 Len=0 TSval=987788178 TSecr=141349158"
"16","0.088414","192.168.11.26","192.168.11.7","TCP","66","","0.000059000","Jan  8, 2024 13:40:12.620689000 JST","","52260  >  6000 [FIN, ACK] Seq=28 Ack=1 Win=64256 Len=0 TSval=141349159 TSecr=987788160"
"17","0.089561","192.168.11.7","192.168.11.26","TCP","66","0.001147000","0.001147000","Jan  8, 2024 13:40:12.621836000 JST","","6000  >  52260 [FIN, ACK] Seq=1 Ack=29 Win=65152 Len=0 TSval=987788179 TSecr=141349159"
"18","0.097595","192.168.11.26","192.168.11.7","TCP","66","0.008034000","0.008034000","Jan  8, 2024 13:40:12.629870000 JST","","52260  >  6000 [ACK] Seq=29 Ack=2 Win=64256 Len=0 TSval=141349173 TSecr=987788179"
"19","6.904960","192.168.11.7","192.168.11.28","TCP","74","","6.807365000","Jan  8, 2024 13:40:19.437235000 JST","","37356  >  6000 [SYN] Seq=0 Win=64240 Len=0 MSS=1460 SACK_PERM TSval=624203703 TSecr=0 WS=128"
"20","6.919030","192.168.11.28","192.168.11.7","TCP","74","0.014070000","0.014070000","Jan  8, 2024 13:40:19.451305000 JST","","6000  >  37356 [SYN, ACK] Seq=0 Ack=1 Win=65160 Len=0 MSS=1460 SACK_PERM TSval=2670747491 TSecr=624203703 WS=128"
"21","6.919135","192.168.11.7","192.168.11.28","TCP","66","0.000105000","0.000105000","Jan  8, 2024 13:40:19.451410000 JST","","37356  >  6000 [ACK] Seq=1 Ack=1 Win=64256 Len=0 TSval=624203717 TSecr=2670747491"
"22","6.919342","192.168.11.7","192.168.11.28","TCP","93","","0.000207000","Jan  8, 2024 13:40:19.451617000 JST","","37356  >  6000 [PSH, ACK] Seq=1 Ack=1 Win=64256 Len=27 TSval=624203718 TSecr=2670747491 [TCP segment of a reassembled PDU]"
"23","6.919467","192.168.11.7","192.168.11.28","TCP","66","","0.000125000","Jan  8, 2024 13:40:19.451742000 JST","","37356  >  6000 [FIN, ACK] Seq=28 Ack=1 Win=64256 Len=0 TSval=624203718 TSecr=2670747491"
"24","6.929740","192.168.11.28","192.168.11.7","TCP","66","0.010398000","0.010273000","Jan  8, 2024 13:40:19.462015000 JST","","6000  >  37356 [ACK] Seq=1 Ack=28 Win=65152 Len=0 TSval=2670747503 TSecr=624203718"
"25","6.929971","192.168.11.28","192.168.11.7","TCP","66","0.010504000","0.000231000","Jan  8, 2024 13:40:19.462246000 JST","","6000  >  37356 [FIN, ACK] Seq=1 Ack=29 Win=65152 Len=0 TSval=2670747505 TSecr=624203718"
"26","6.930016","192.168.11.7","192.168.11.28","TCP","66","0.000045000","0.000045000","Jan  8, 2024 13:40:19.462291000 JST","","37356  >  6000 [ACK] Seq=29 Ack=2 Win=64256 Len=0 TSval=624203728 TSecr=2670747505"
"27","6.974993","192.168.11.7","255.255.255.255","UDP","209","","0.044977000","Jan  8, 2024 13:40:19.507268000 JST","7b2273656d616e74696373223a207b22656e74697479223a2022504944222c202262617365656e74697479223a2022616e79222c2022726f6c65223a20226b6b6b222c20227370617469616c223a2022616e79222c202274656d706f72616c223a2022616e79227d2c20226461746170726f7065727479223a207b22666f726d6174223a2022696e616f6b615f70726f6772616d5f73616d706c655f73656d616e746963227d7d","56510  >  7000 Len=167"
"28","6.992275","192.168.11.26","192.168.11.7","TCP","74","","0.017282000","Jan  8, 2024 13:40:19.524550000 JST","","52272  >  6000 [SYN] Seq=0 Win=64240 Len=0 MSS=1460 SACK_PERM TSval=141356068 TSecr=0 WS=128"
"29","6.992493","192.168.11.7","192.168.11.26","TCP","74","0.000218000","0.000218000","Jan  8, 2024 13:40:19.524768000 JST","","6000  >  52272 [SYN, ACK] Seq=0 Ack=1 Win=65160 Len=0 MSS=1460 SACK_PERM TSval=987795082 TSecr=141356068 WS=128"
"30","7.014252","192.168.11.26","192.168.11.7","TCP","66","0.021759000","0.021759000","Jan  8, 2024 13:40:19.546527000 JST","","52272  >  6000 [ACK] Seq=1 Ack=1 Win=64256 Len=0 TSval=141356089 TSecr=987795082"
"31","7.014788","192.168.11.26","192.168.11.7","TCP","93","","0.000536000","Jan  8, 2024 13:40:19.547063000 JST","","52272  >  6000 [PSH, ACK] Seq=1 Ack=1 Win=64256 Len=27 TSval=141356089 TSecr=987795082 [TCP segment of a reassembled PDU]"
"32","7.014860","192.168.11.7","192.168.11.26","TCP","66","0.000072000","0.000072000","Jan  8, 2024 13:40:19.547135000 JST","","6000  >  52272 [ACK] Seq=1 Ack=28 Win=65152 Len=0 TSval=987795104 TSecr=141356089"
"33","7.014930","192.168.11.26","192.168.11.7","TCP","66","","0.000070000","Jan  8, 2024 13:40:19.547205000 JST","","52272  >  6000 [FIN, ACK] Seq=28 Ack=1 Win=64256 Len=0 TSval=141356089 TSecr=987795082"
"34","7.016073","192.168.11.7","192.168.11.26","TCP","66","0.001143000","0.001143000","Jan  8, 2024 13:40:19.548348000 JST","","6000  >  52272 [FIN, ACK] Seq=1 Ack=29 Win=65152 Len=0 TSval=987795105 TSecr=141356089"
"35","7.023891","192.168.11.26","192.168.11.7","TCP","66","0.007818000","0.007818000","Jan  8, 2024 13:40:19.556166000 JST","","52272  >  6000 [ACK] Seq=29 Ack=2 Win=64256 Len=0 TSval=141356100 TSecr=987795105"
"36","13.717119","192.168.11.7","192.168.11.28","TCP","74","","6.693228000","Jan  8, 2024 13:40:26.249394000 JST","","40644  >  6000 [SYN] Seq=0 Win=64240 Len=0 MSS=1460 SACK_PERM TSval=624210515 TSecr=0 WS=128"
"37","13.727347","192.168.11.28","192.168.11.7","TCP","74","0.010228000","0.010228000","Jan  8, 2024 13:40:26.259622000 JST","","6000  >  40644 [SYN, ACK] Seq=0 Ack=1 Win=65160 Len=0 MSS=1460 SACK_PERM TSval=2670754300 TSecr=624210515 WS=128"
"38","13.727476","192.168.11.7","192.168.11.28","TCP","66","0.000129000","0.000129000","Jan  8, 2024 13:40:26.259751000 JST","","40644  >  6000 [ACK] Seq=1 Ack=1 Win=64256 Len=0 TSval=624210526 TSecr=2670754300"
"39","13.727651","192.168.11.7","192.168.11.28","TCP","93","","0.000175000","Jan  8, 2024 13:40:26.259926000 JST","","40644  >  6000 [PSH, ACK] Seq=1 Ack=1 Win=64256 Len=27 TSval=624210526 TSecr=2670754300 [TCP segment of a reassembled PDU]"
"40","13.727752","192.168.11.7","192.168.11.28","TCP","66","","0.000101000","Jan  8, 2024 13:40:26.260027000 JST","","40644  >  6000 [FIN, ACK] Seq=28 Ack=1 Win=64256 Len=0 TSval=624210526 TSecr=2670754300"
"41","13.735764","192.168.11.28","192.168.11.7","TCP","66","0.008113000","0.008012000","Jan  8, 2024 13:40:26.268039000 JST","","6000  >  40644 [ACK] Seq=1 Ack=28 Win=65152 Len=0 TSval=2670754309 TSecr=624210526"
"42","13.736176","192.168.11.28","192.168.11.7","TCP","66","","0.000412000","Jan  8, 2024 13:40:26.268451000 JST","","[TCP Dup ACK 41#1] 6000  >  40644 [ACK] Seq=1 Ack=28 Win=65152 Len=0 TSval=2670754310 TSecr=624210526"
"43","13.736227","192.168.11.28","192.168.11.7","TCP","66","0.008475000","0.000051000","Jan  8, 2024 13:40:26.268502000 JST","","6000  >  40644 [FIN, ACK] Seq=1 Ack=29 Win=65152 Len=0 TSval=2670754311 TSecr=624210526"
"44","13.736288","192.168.11.7","192.168.11.28","TCP","66","0.000061000","0.000061000","Jan  8, 2024 13:40:26.268563000 JST","","40644  >  6000 [ACK] Seq=29 Ack=2 Win=64256 Len=0 TSval=624210535 TSecr=2670754311"
"45","13.766981","192.168.11.7","255.255.255.255","UDP","209","","0.030693000","Jan  8, 2024 13:40:26.299256000 JST","7b2273656d616e74696373223a207b22656e74697479223a2022504944222c202262617365656e74697479223a2022616e79222c2022726f6c65223a20226b6b6b222c20227370617469616c223a2022616e79222c202274656d706f72616c223a2022616e79227d2c20226461746170726f7065727479223a207b22666f726d6174223a2022696e616f6b615f70726f6772616d5f73616d706c655f73656d616e746963227d7d","58651  >  7000 Len=167"
"46","13.776612","192.168.11.26","192.168.11.7","TCP","74","","0.009631000","Jan  8, 2024 13:40:26.308887000 JST","","39886  >  6000 [SYN] Seq=0 Win=64240 Len=0 MSS=1460 SACK_PERM TSval=141362852 TSecr=0 WS=128"
"47","13.776765","192.168.11.7","192.168.11.26","TCP","74","0.000153000","0.000153000","Jan  8, 2024 13:40:26.309040000 JST","","6000  >  39886 [SYN, ACK] Seq=0 Ack=1 Win=65160 Len=0 MSS=1460 SACK_PERM TSval=987801866 TSecr=141362852 WS=128"
"48","13.784851","192.168.11.26","192.168.11.7","TCP","66","0.008086000","0.008086000","Jan  8, 2024 13:40:26.317126000 JST","","39886  >  6000 [ACK] Seq=1 Ack=1 Win=64256 Len=0 TSval=141362861 TSecr=987801866"
"49","13.785353","192.168.11.26","192.168.11.7","TCP","93","","0.000502000","Jan  8, 2024 13:40:26.317628000 JST","","39886  >  6000 [PSH, ACK] Seq=1 Ack=1 Win=64256 Len=27 TSval=141362862 TSecr=987801866 [TCP segment of a reassembled PDU]"
"50","13.785449","192.168.11.7","192.168.11.26","TCP","66","0.000096000","0.000096000","Jan  8, 2024 13:40:26.317724000 JST","","6000  >  39886 [ACK] Seq=1 Ack=28 Win=65152 Len=0 TSval=987801875 TSecr=141362862"
"51","13.785518","192.168.11.26","192.168.11.7","TCP","66","","0.000069000","Jan  8, 2024 13:40:26.317793000 JST","","39886  >  6000 [FIN, ACK] Seq=28 Ack=1 Win=64256 Len=0 TSval=141362862 TSecr=987801866"
"52","13.786577","192.168.11.7","192.168.11.26","TCP","66","0.001059000","0.001059000","Jan  8, 2024 13:40:26.318852000 JST","","6000  >  39886 [FIN, ACK] Seq=1 Ack=29 Win=65152 Len=0 TSval=987801876 TSecr=141362862"
"53","13.794370","192.168.11.26","192.168.11.7","TCP","66","0.007793000","0.007793000","Jan  8, 2024 13:40:26.326645000 JST","","39886  >  6000 [ACK] Seq=29 Ack=2 Win=64256 Len=0 TSval=141362870 TSecr=987801876"
"54","21.409819","192.168.11.7","192.168.11.28","TCP","74","","7.615449000","Jan  8, 2024 13:40:33.942094000 JST","","40650  >  6000 [SYN] Seq=0 Win=64240 Len=0 MSS=1460 SACK_PERM TSval=624218208 TSecr=0 WS=128"
"55","21.420451","192.168.11.28","192.168.11.7","TCP","74","0.010632000","0.010632000","Jan  8, 2024 13:40:33.952726000 JST","","6000  >  40650 [SYN, ACK] Seq=0 Ack=1 Win=65160 Len=0 MSS=1460 SACK_PERM TSval=2670761993 TSecr=624218208 WS=128"
"56","21.420583","192.168.11.7","192.168.11.28","TCP","66","0.000132000","0.000132000","Jan  8, 2024 13:40:33.952858000 JST","","40650  >  6000 [ACK] Seq=1 Ack=1 Win=64256 Len=0 TSval=624218219 TSecr=2670761993"
"57","21.420788","192.168.11.7","192.168.11.28","TCP","93","","0.000205000","Jan  8, 2024 13:40:33.953063000 JST","","40650  >  6000 [PSH, ACK] Seq=1 Ack=1 Win=64256 Len=27 TSval=624218219 TSecr=2670761993 [TCP segment of a reassembled PDU]"
"58","21.420898","192.168.11.7","192.168.11.28","TCP","66","","0.000110000","Jan  8, 2024 13:40:33.953173000 JST","","40650  >  6000 [FIN, ACK] Seq=28 Ack=1 Win=64256 Len=0 TSval=624218219 TSecr=2670761993"
"59","21.429666","192.168.11.28","192.168.11.7","TCP","66","0.008878000","0.008768000","Jan  8, 2024 13:40:33.961941000 JST","","6000  >  40650 [ACK] Seq=1 Ack=28 Win=65152 Len=0 TSval=2670762003 TSecr=624218219"
"60","21.430060","192.168.11.28","192.168.11.7","TCP","66","","0.000394000","Jan  8, 2024 13:40:33.962335000 JST","","[TCP Dup ACK 59#1] 6000  >  40650 [ACK] Seq=1 Ack=28 Win=65152 Len=0 TSval=2670762004 TSecr=624218219"
"61","21.430118","192.168.11.28","192.168.11.7","TCP","66","0.009220000","0.000058000","Jan  8, 2024 13:40:33.962393000 JST","","6000  >  40650 [FIN, ACK] Seq=1 Ack=29 Win=65152 Len=0 TSval=2670762005 TSecr=624218219"
"62","21.430172","192.168.11.7","192.168.11.28","TCP","66","0.000054000","0.000054000","Jan  8, 2024 13:40:33.962447000 JST","","40650  >  6000 [ACK] Seq=29 Ack=2 Win=64256 Len=0 TSval=624218228 TSecr=2670762005"
"63","21.461945","192.168.11.7","255.255.255.255","UDP","209","","0.031773000","Jan  8, 2024 13:40:33.994220000 JST","7b2273656d616e74696373223a207b22656e74697479223a2022504944222c202262617365656e74697479223a2022616e79222c2022726f6c65223a20226b6b6b222c20227370617469616c223a2022616e79222c202274656d706f72616c223a2022616e79227d2c20226461746170726f7065727479223a207b22666f726d6174223a2022696e616f6b615f70726f6772616d5f73616d706c655f73656d616e746963227d7d","51739  >  7000 Len=167"
"64","21.470514","192.168.11.26","192.168.11.7","TCP","74","","0.008569000","Jan  8, 2024 13:40:34.002789000 JST","","53926  >  6000 [SYN] Seq=0 Win=64240 Len=0 MSS=1460 SACK_PERM TSval=141370547 TSecr=0 WS=128"
"65","21.470666","192.168.11.7","192.168.11.26","TCP","74","0.000152000","0.000152000","Jan  8, 2024 13:40:34.002941000 JST","","6000  >  53926 [SYN, ACK] Seq=0 Ack=1 Win=65160 Len=0 MSS=1460 SACK_PERM TSval=987809560 TSecr=141370547 WS=128"
"66","21.478898","192.168.11.26","192.168.11.7","TCP","66","0.008232000","0.008232000","Jan  8, 2024 13:40:34.011173000 JST","","53926  >  6000 [ACK] Seq=1 Ack=1 Win=64256 Len=0 TSval=141370555 TSecr=987809560"
"67","21.479451","192.168.11.26","192.168.11.7","TCP","93","","0.000553000","Jan  8, 2024 13:40:34.011726000 JST","","53926  >  6000 [PSH, ACK] Seq=1 Ack=1 Win=64256 Len=27 TSval=141370556 TSecr=987809560 [TCP segment of a reassembled PDU]"
"68","21.479577","192.168.11.7","192.168.11.26","TCP","66","0.000126000","0.000126000","Jan  8, 2024 13:40:34.011852000 JST","","6000  >  53926 [ACK] Seq=1 Ack=28 Win=65152 Len=0 TSval=987809569 TSecr=141370556"
"69","21.479647","192.168.11.26","192.168.11.7","TCP","66","","0.000070000","Jan  8, 2024 13:40:34.011922000 JST","","53926  >  6000 [FIN, ACK] Seq=28 Ack=1 Win=64256 Len=0 TSval=141370556 TSecr=987809560"
"70","21.480759","192.168.11.7","192.168.11.26","TCP","66","0.001112000","0.001112000","Jan  8, 2024 13:40:34.013034000 JST","","6000  >  53926 [FIN, ACK] Seq=1 Ack=29 Win=65152 Len=0 TSval=987809570 TSecr=141370556"
"71","21.488205","192.168.11.26","192.168.11.7","TCP","66","0.007446000","0.007446000","Jan  8, 2024 13:40:34.020480000 JST","","53926  >  6000 [ACK] Seq=29 Ack=2 Win=64256 Len=0 TSval=141370564 TSecr=987809570"
"72","29.152519","192.168.11.7","192.168.11.28","TCP","74","","7.664314000","Jan  8, 2024 13:40:41.684794000 JST","","37818  >  6000 [SYN] Seq=0 Win=64240 Len=0 MSS=1460 SACK_PERM TSval=624225951 TSecr=0 WS=128"
"73","29.162845","192.168.11.28","192.168.11.7","TCP","74","0.010326000","0.010326000","Jan  8, 2024 13:40:41.695120000 JST","","6000  >  37818 [SYN, ACK] Seq=0 Ack=1 Win=65160 Len=0 MSS=1460 SACK_PERM TSval=2670769736 TSecr=624225951 WS=128"
"74","29.162964","192.168.11.7","192.168.11.28","TCP","66","0.000119000","0.000119000","Jan  8, 2024 13:40:41.695239000 JST","","37818  >  6000 [ACK] Seq=1 Ack=1 Win=64256 Len=0 TSval=624225961 TSecr=2670769736"
"75","29.163135","192.168.11.7","192.168.11.28","TCP","93","","0.000171000","Jan  8, 2024 13:40:41.695410000 JST","","37818  >  6000 [PSH, ACK] Seq=1 Ack=1 Win=64256 Len=27 TSval=624225961 TSecr=2670769736 [TCP segment of a reassembled PDU]"
"76","29.163249","192.168.11.7","192.168.11.28","TCP","66","","0.000114000","Jan  8, 2024 13:40:41.695524000 JST","","37818  >  6000 [FIN, ACK] Seq=28 Ack=1 Win=64256 Len=0 TSval=624225962 TSecr=2670769736"
"77","29.171240","192.168.11.28","192.168.11.7","TCP","66","0.008105000","0.007991000","Jan  8, 2024 13:40:41.703515000 JST","","6000  >  37818 [ACK] Seq=1 Ack=28 Win=65152 Len=0 TSval=2670769745 TSecr=624225961"
"78","29.171473","192.168.11.28","192.168.11.7","TCP","66","0.008224000","0.000233000","Jan  8, 2024 13:40:41.703748000 JST","","6000  >  37818 [FIN, ACK] Seq=1 Ack=29 Win=65152 Len=0 TSval=2670769747 TSecr=624225962"
"79","29.171535","192.168.11.7","192.168.11.28","TCP","66","0.000062000","0.000062000","Jan  8, 2024 13:40:41.703810000 JST","","37818  >  6000 [ACK] Seq=29 Ack=2 Win=64256 Len=0 TSval=624225970 TSecr=2670769747"
"80","29.205022","192.168.11.7","255.255.255.255","UDP","209","","0.033487000","Jan  8, 2024 13:40:41.737297000 JST","7b2273656d616e74696373223a207b22656e74697479223a2022504944222c202262617365656e74697479223a2022616e79222c2022726f6c65223a20226b6b6b222c20227370617469616c223a2022616e79222c202274656d706f72616c223a2022616e79227d2c20226461746170726f7065727479223a207b22666f726d6174223a2022696e616f6b615f70726f6772616d5f73616d706c655f73656d616e746963227d7d","50543  >  7000 Len=167"
"81","29.214507","192.168.11.26","192.168.11.7","TCP","74","","0.009485000","Jan  8, 2024 13:40:41.746782000 JST","","33110  >  6000 [SYN] Seq=0 Win=64240 Len=0 MSS=1460 SACK_PERM TSval=141378291 TSecr=0 WS=128"
"82","29.214651","192.168.11.7","192.168.11.26","TCP","74","0.000144000","0.000144000","Jan  8, 2024 13:40:41.746926000 JST","","6000  >  33110 [SYN, ACK] Seq=0 Ack=1 Win=65160 Len=0 MSS=1460 SACK_PERM TSval=987817304 TSecr=141378291 WS=128"
"83","29.223793","192.168.11.26","192.168.11.7","TCP","66","0.009142000","0.009142000","Jan  8, 2024 13:40:41.756068000 JST","","33110  >  6000 [ACK] Seq=1 Ack=1 Win=64256 Len=0 TSval=141378299 TSecr=987817304"
"84","29.224785","192.168.11.26","192.168.11.7","TCP","93","","0.000992000","Jan  8, 2024 13:40:41.757060000 JST","","33110  >  6000 [PSH, ACK] Seq=1 Ack=1 Win=64256 Len=27 TSval=141378300 TSecr=987817304 [TCP segment of a reassembled PDU]"
"85","29.225028","192.168.11.7","192.168.11.26","TCP","66","0.000243000","0.000243000","Jan  8, 2024 13:40:41.757303000 JST","","6000  >  33110 [ACK] Seq=1 Ack=28 Win=65152 Len=0 TSval=987817314 TSecr=141378300"
"86","29.225188","192.168.11.26","192.168.11.7","TCP","66","","0.000160000","Jan  8, 2024 13:40:41.757463000 JST","","33110  >  6000 [FIN, ACK] Seq=28 Ack=1 Win=64256 Len=0 TSval=141378300 TSecr=987817304"
"87","29.227040","192.168.11.7","192.168.11.26","TCP","66","0.001852000","0.001852000","Jan  8, 2024 13:40:41.759315000 JST","","6000  >  33110 [FIN, ACK] Seq=1 Ack=29 Win=65152 Len=0 TSval=987817316 TSecr=141378300"
"88","29.239699","192.168.11.26","192.168.11.7","TCP","66","0.012659000","0.012659000","Jan  8, 2024 13:40:41.771974000 JST","","33110  >  6000 [ACK] Seq=29 Ack=2 Win=64256 Len=0 TSval=141378310 TSecr=987817316"
"89","35.886087","192.168.11.7","192.168.11.28","TCP","74","","6.646388000","Jan  8, 2024 13:40:48.418362000 JST","","52512  >  6000 [SYN] Seq=0 Win=64240 Len=0 MSS=1460 SACK_PERM TSval=624232684 TSecr=0 WS=128"
"90","35.896322","192.168.11.28","192.168.11.7","TCP","74","0.010235000","0.010235000","Jan  8, 2024 13:40:48.428597000 JST","","6000  >  52512 [SYN, ACK] Seq=0 Ack=1 Win=65160 Len=0 MSS=1460 SACK_PERM TSval=2670776469 TSecr=624232684 WS=128"
"91","35.896435","192.168.11.7","192.168.11.28","TCP","66","0.000113000","0.000113000","Jan  8, 2024 13:40:48.428710000 JST","","52512  >  6000 [ACK] Seq=1 Ack=1 Win=64256 Len=0 TSval=624232695 TSecr=2670776469"
"92","35.896608","192.168.11.7","192.168.11.28","TCP","93","","0.000173000","Jan  8, 2024 13:40:48.428883000 JST","","52512  >  6000 [PSH, ACK] Seq=1 Ack=1 Win=64256 Len=27 TSval=624232695 TSecr=2670776469 [TCP segment of a reassembled PDU]"
"93","35.896719","192.168.11.7","192.168.11.28","TCP","66","","0.000111000","Jan  8, 2024 13:40:48.428994000 JST","","52512  >  6000 [FIN, ACK] Seq=28 Ack=1 Win=64256 Len=0 TSval=624232695 TSecr=2670776469"
"94","35.904773","192.168.11.28","192.168.11.7","TCP","66","0.008165000","0.008054000","Jan  8, 2024 13:40:48.437048000 JST","","6000  >  52512 [ACK] Seq=1 Ack=28 Win=65152 Len=0 TSval=2670776479 TSecr=624232695"
"95","35.905007","192.168.11.28","192.168.11.7","TCP","66","0.008288000","0.000234000","Jan  8, 2024 13:40:48.437282000 JST","","6000  >  52512 [FIN, ACK] Seq=1 Ack=29 Win=65152 Len=0 TSval=2670776480 TSecr=624232695"
"96","35.905051","192.168.11.7","192.168.11.28","TCP","66","0.000044000","0.000044000","Jan  8, 2024 13:40:48.437326000 JST","","52512  >  6000 [ACK] Seq=29 Ack=2 Win=64256 Len=0 TSval=624232703 TSecr=2670776480"
"97","35.937422","192.168.11.7","255.255.255.255","UDP","209","","0.032371000","Jan  8, 2024 13:40:48.469697000 JST","7b2273656d616e74696373223a207b22656e74697479223a2022504944222c202262617365656e74697479223a2022616e79222c2022726f6c65223a20226b6b6b222c20227370617469616c223a2022616e79222c202274656d706f72616c223a2022616e79227d2c20226461746170726f7065727479223a207b22666f726d6174223a2022696e616f6b615f70726f6772616d5f73616d706c655f73656d616e746963227d7d","34361  >  7000 Len=167"
"98","35.949063","192.168.11.26","192.168.11.7","TCP","74","","0.011641000","Jan  8, 2024 13:40:48.481338000 JST","","33120  >  6000 [SYN] Seq=0 Win=64240 Len=0 MSS=1460 SACK_PERM TSval=141385023 TSecr=0 WS=128"
"99","35.949304","192.168.11.7","192.168.11.26","TCP","74","0.000241000","0.000241000","Jan  8, 2024 13:40:48.481579000 JST","","6000  >  33120 [SYN, ACK] Seq=0 Ack=1 Win=65160 Len=0 MSS=1460 SACK_PERM TSval=987824039 TSecr=141385023 WS=128"
"100","35.958858","192.168.11.26","192.168.11.7","TCP","66","0.009554000","0.009554000","Jan  8, 2024 13:40:48.491133000 JST","","33120  >  6000 [ACK] Seq=1 Ack=1 Win=64256 Len=0 TSval=141385034 TSecr=987824039"
"101","35.959616","192.168.11.26","192.168.11.7","TCP","93","","0.000758000","Jan  8, 2024 13:40:48.491891000 JST","","33120  >  6000 [PSH, ACK] Seq=1 Ack=1 Win=64256 Len=27 TSval=141385034 TSecr=987824039 [TCP segment of a reassembled PDU]"
"102","35.959772","192.168.11.7","192.168.11.26","TCP","66","0.000156000","0.000156000","Jan  8, 2024 13:40:48.492047000 JST","","6000  >  33120 [ACK] Seq=1 Ack=28 Win=65152 Len=0 TSval=987824049 TSecr=141385034"
"103","35.959864","192.168.11.26","192.168.11.7","TCP","66","","0.000092000","Jan  8, 2024 13:40:48.492139000 JST","","33120  >  6000 [FIN, ACK] Seq=28 Ack=1 Win=64256 Len=0 TSval=141385035 TSecr=987824039"
"104","35.961519","192.168.11.7","192.168.11.26","TCP","66","0.001655000","0.001655000","Jan  8, 2024 13:40:48.493794000 JST","","6000  >  33120 [FIN, ACK] Seq=1 Ack=29 Win=65152 Len=0 TSval=987824051 TSecr=141385035"
"105","35.969391","192.168.11.26","192.168.11.7","TCP","66","0.007872000","0.007872000","Jan  8, 2024 13:40:48.501666000 JST","","33120  >  6000 [ACK] Seq=29 Ack=2 Win=64256 Len=0 TSval=141385045 TSecr=987824051"
"106","42.632675","192.168.11.7","192.168.11.28","TCP","74","","6.663284000","Jan  8, 2024 13:40:55.164950000 JST","","55670  >  6000 [SYN] Seq=0 Win=64240 Len=0 MSS=1460 SACK_PERM TSval=624239431 TSecr=0 WS=128"
"107","42.645357","192.168.11.28","192.168.11.7","TCP","74","0.012682000","0.012682000","Jan  8, 2024 13:40:55.177632000 JST","","6000  >  55670 [SYN, ACK] Seq=0 Ack=1 Win=65160 Len=0 MSS=1460 SACK_PERM TSval=2670783216 TSecr=624239431 WS=128"
"108","42.645459","192.168.11.7","192.168.11.28","TCP","66","0.000102000","0.000102000","Jan  8, 2024 13:40:55.177734000 JST","","55670  >  6000 [ACK] Seq=1 Ack=1 Win=64256 Len=0 TSval=624239444 TSecr=2670783216"
"109","42.645617","192.168.11.7","192.168.11.28","TCP","93","","0.000158000","Jan  8, 2024 13:40:55.177892000 JST","","55670  >  6000 [PSH, ACK] Seq=1 Ack=1 Win=64256 Len=27 TSval=624239444 TSecr=2670783216 [TCP segment of a reassembled PDU]"
"110","42.645724","192.168.11.7","192.168.11.28","TCP","66","","0.000107000","Jan  8, 2024 13:40:55.177999000 JST","","55670  >  6000 [FIN, ACK] Seq=28 Ack=1 Win=64256 Len=0 TSval=624239444 TSecr=2670783216"
"111","42.654953","192.168.11.28","192.168.11.7","TCP","66","0.009336000","0.009229000","Jan  8, 2024 13:40:55.187228000 JST","","6000  >  55670 [ACK] Seq=1 Ack=28 Win=65152 Len=0 TSval=2670783229 TSecr=624239444"
"112","42.657449","192.168.11.28","192.168.11.7","TCP","66","0.011725000","0.002496000","Jan  8, 2024 13:40:55.189724000 JST","","6000  >  55670 [FIN, ACK] Seq=1 Ack=29 Win=65152 Len=0 TSval=2670783231 TSecr=624239444"
"113","42.657496","192.168.11.7","192.168.11.28","TCP","66","0.000047000","0.000047000","Jan  8, 2024 13:40:55.189771000 JST","","55670  >  6000 [ACK] Seq=29 Ack=2 Win=64256 Len=0 TSval=624239456 TSecr=2670783231"
"114","42.687960","192.168.11.7","255.255.255.255","UDP","209","","0.030464000","Jan  8, 2024 13:40:55.220235000 JST","7b2273656d616e74696373223a207b22656e74697479223a2022504944222c202262617365656e74697479223a2022616e79222c2022726f6c65223a20226b6b6b222c20227370617469616c223a2022616e79222c202274656d706f72616c223a2022616e79227d2c20226461746170726f7065727479223a207b22666f726d6174223a2022696e616f6b615f70726f6772616d5f73616d706c655f73656d616e746963227d7d","56136  >  7000 Len=167"
"115","42.706589","192.168.11.26","192.168.11.7","TCP","74","","0.018629000","Jan  8, 2024 13:40:55.238864000 JST","","39176  >  6000 [SYN] Seq=0 Win=64240 Len=0 MSS=1460 SACK_PERM TSval=141391778 TSecr=0 WS=128"
"116","42.706867","192.168.11.7","192.168.11.26","TCP","74","0.000278000","0.000278000","Jan  8, 2024 13:40:55.239142000 JST","","6000  >  39176 [SYN, ACK] Seq=0 Ack=1 Win=65160 Len=0 MSS=1460 SACK_PERM TSval=987830796 TSecr=141391778 WS=128"
"117","42.719652","192.168.11.26","192.168.11.7","TCP","93","0.012785000","0.012785000","Jan  8, 2024 13:40:55.251927000 JST","","39176  >  6000 [PSH, ACK] Seq=1 Ack=1 Win=64256 Len=27 TSval=141391795 TSecr=987830796 [TCP segment of a reassembled PDU]"
"118","42.719828","192.168.11.7","192.168.11.26","TCP","66","0.000176000","0.000176000","Jan  8, 2024 13:40:55.252103000 JST","","6000  >  39176 [ACK] Seq=1 Ack=28 Win=65152 Len=0 TSval=987830809 TSecr=141391795"
"119","42.720203","192.168.11.26","192.168.11.7","TCP","66","","0.000375000","Jan  8, 2024 13:40:55.252478000 JST","","39176  >  6000 [ACK] Seq=1 Ack=1 Win=64256 Len=0 TSval=141391795 TSecr=987830796"
"120","42.720237","192.168.11.7","192.168.11.26","TCP","66","","0.000034000","Jan  8, 2024 13:40:55.252512000 JST","","[TCP Dup ACK 118#1] 6000  >  39176 [ACK] Seq=1 Ack=28 Win=65152 Len=0 TSval=987830810 TSecr=141391795"
"121","42.720282","192.168.11.26","192.168.11.7","TCP","66","","0.000045000","Jan  8, 2024 13:40:55.252557000 JST","","39176  >  6000 [FIN, ACK] Seq=28 Ack=1 Win=64256 Len=0 TSval=141391795 TSecr=987830796"
"122","42.721168","192.168.11.7","192.168.11.26","TCP","66","0.000886000","0.000886000","Jan  8, 2024 13:40:55.253443000 JST","","6000  >  39176 [FIN, ACK] Seq=1 Ack=29 Win=65152 Len=0 TSval=987830810 TSecr=141391795"
"123","42.729950","192.168.11.26","192.168.11.7","TCP","66","0.008782000","0.008782000","Jan  8, 2024 13:40:55.262225000 JST","","39176  >  6000 [ACK] Seq=29 Ack=2 Win=64256 Len=0 TSval=141391805 TSecr=987830810"
"124","49.391197","192.168.11.7","192.168.11.28","TCP","74","","6.661247000","Jan  8, 2024 13:41:01.923472000 JST","","55686  >  6000 [SYN] Seq=0 Win=64240 Len=0 MSS=1460 SACK_PERM TSval=624246189 TSecr=0 WS=128"
"125","49.401520","192.168.11.28","192.168.11.7","TCP","74","0.010323000","0.010323000","Jan  8, 2024 13:41:01.933795000 JST","","6000  >  55686 [SYN, ACK] Seq=0 Ack=1 Win=65160 Len=0 MSS=1460 SACK_PERM TSval=2670789974 TSecr=624246189 WS=128"
"126","49.401629","192.168.11.7","192.168.11.28","TCP","66","0.000109000","0.000109000","Jan  8, 2024 13:41:01.933904000 JST","","55686  >  6000 [ACK] Seq=1 Ack=1 Win=64256 Len=0 TSval=624246200 TSecr=2670789974"
"127","49.401797","192.168.11.7","192.168.11.28","TCP","93","","0.000168000","Jan  8, 2024 13:41:01.934072000 JST","","55686  >  6000 [PSH, ACK] Seq=1 Ack=1 Win=64256 Len=27 TSval=624246200 TSecr=2670789974 [TCP segment of a reassembled PDU]"
"128","49.401926","192.168.11.7","192.168.11.28","TCP","66","","0.000129000","Jan  8, 2024 13:41:01.934201000 JST","","55686  >  6000 [FIN, ACK] Seq=28 Ack=1 Win=64256 Len=0 TSval=624246200 TSecr=2670789974"
"129","49.415808","192.168.11.28","192.168.11.7","TCP","66","0.014011000","0.013882000","Jan  8, 2024 13:41:01.948083000 JST","","6000  >  55686 [ACK] Seq=1 Ack=28 Win=65152 Len=0 TSval=2670789984 TSecr=624246200"
"130","49.416170","192.168.11.28","192.168.11.7","TCP","66","0.014244000","0.000362000","Jan  8, 2024 13:41:01.948445000 JST","","6000  >  55686 [FIN, ACK] Seq=1 Ack=29 Win=65152 Len=0 TSval=2670789985 TSecr=624246200"
"131","49.416216","192.168.11.7","192.168.11.28","TCP","66","0.000046000","0.000046000","Jan  8, 2024 13:41:01.948491000 JST","","55686  >  6000 [ACK] Seq=29 Ack=2 Win=64256 Len=0 TSval=624246214 TSecr=2670789985"
"132","49.447655","192.168.11.7","255.255.255.255","UDP","209","","0.031439000","Jan  8, 2024 13:41:01.979930000 JST","7b2273656d616e74696373223a207b22656e74697479223a2022504944222c202262617365656e74697479223a2022616e79222c2022726f6c65223a20226b6b6b222c20227370617469616c223a2022616e79222c202274656d706f72616c223a2022616e79227d2c20226461746170726f7065727479223a207b22666f726d6174223a2022696e616f6b615f70726f6772616d5f73616d706c655f73656d616e746963227d7d","40390  >  7000 Len=167"
"133","49.456695","192.168.11.26","192.168.11.7","TCP","74","","0.009040000","Jan  8, 2024 13:41:01.988970000 JST","","60644  >  6000 [SYN] Seq=0 Win=64240 Len=0 MSS=1460 SACK_PERM TSval=141398533 TSecr=0 WS=128"
"134","49.456837","192.168.11.7","192.168.11.26","TCP","74","0.000142000","0.000142000","Jan  8, 2024 13:41:01.989112000 JST","","6000  >  60644 [SYN, ACK] Seq=0 Ack=1 Win=65160 Len=0 MSS=1460 SACK_PERM TSval=987837546 TSecr=141398533 WS=128"
"135","49.465066","192.168.11.26","192.168.11.7","TCP","66","0.008229000","0.008229000","Jan  8, 2024 13:41:01.997341000 JST","","60644  >  6000 [ACK] Seq=1 Ack=1 Win=64256 Len=0 TSval=141398542 TSecr=987837546"
"136","49.465795","192.168.11.26","192.168.11.7","TCP","93","","0.000729000","Jan  8, 2024 13:41:01.998070000 JST","","60644  >  6000 [PSH, ACK] Seq=1 Ack=1 Win=64256 Len=27 TSval=141398542 TSecr=987837546 [TCP segment of a reassembled PDU]"
"137","49.465926","192.168.11.7","192.168.11.26","TCP","66","0.000131000","0.000131000","Jan  8, 2024 13:41:01.998201000 JST","","6000  >  60644 [ACK] Seq=1 Ack=28 Win=65152 Len=0 TSval=987837555 TSecr=141398542"
"138","49.466032","192.168.11.26","192.168.11.7","TCP","66","","0.000106000","Jan  8, 2024 13:41:01.998307000 JST","","60644  >  6000 [FIN, ACK] Seq=28 Ack=1 Win=64256 Len=0 TSval=141398542 TSecr=987837546"
"139","49.467346","192.168.11.7","192.168.11.26","TCP","66","0.001314000","0.001314000","Jan  8, 2024 13:41:01.999621000 JST","","6000  >  60644 [FIN, ACK] Seq=1 Ack=29 Win=65152 Len=0 TSval=987837557 TSecr=141398542"
"140","49.474404","192.168.11.26","192.168.11.7","TCP","66","0.007058000","0.007058000","Jan  8, 2024 13:41:02.006679000 JST","","60644  >  6000 [ACK] Seq=29 Ack=2 Win=64256 Len=0 TSval=141398550 TSecr=987837557"
"141","56.104505","192.168.11.7","192.168.11.28","TCP","74","","6.630101000","Jan  8, 2024 13:41:08.636780000 JST","","34514  >  6000 [SYN] Seq=0 Win=64240 Len=0 MSS=1460 SACK_PERM TSval=624252903 TSecr=0 WS=128"
"142","56.114742","192.168.11.28","192.168.11.7","TCP","74","0.010237000","0.010237000","Jan  8, 2024 13:41:08.647017000 JST","","6000  >  34514 [SYN, ACK] Seq=0 Ack=1 Win=65160 Len=0 MSS=1460 SACK_PERM TSval=2670796687 TSecr=624252903 WS=128"
"143","56.114860","192.168.11.7","192.168.11.28","TCP","66","0.000118000","0.000118000","Jan  8, 2024 13:41:08.647135000 JST","","34514  >  6000 [ACK] Seq=1 Ack=1 Win=64256 Len=0 TSval=624252913 TSecr=2670796687"
"144","56.115059","192.168.11.7","192.168.11.28","TCP","93","","0.000199000","Jan  8, 2024 13:41:08.647334000 JST","","34514  >  6000 [PSH, ACK] Seq=1 Ack=1 Win=64256 Len=27 TSval=624252913 TSecr=2670796687 [TCP segment of a reassembled PDU]"
"145","56.115163","192.168.11.7","192.168.11.28","TCP","66","","0.000104000","Jan  8, 2024 13:41:08.647438000 JST","","34514  >  6000 [FIN, ACK] Seq=28 Ack=1 Win=64256 Len=0 TSval=624252913 TSecr=2670796687"
"146","56.123081","192.168.11.28","192.168.11.7","TCP","66","0.008022000","0.007918000","Jan  8, 2024 13:41:08.655356000 JST","","6000  >  34514 [ACK] Seq=1 Ack=28 Win=65152 Len=0 TSval=2670796697 TSecr=624252913"
"147","56.125669","192.168.11.28","192.168.11.7","TCP","66","0.010506000","0.002588000","Jan  8, 2024 13:41:08.657944000 JST","","6000  >  34514 [FIN, ACK] Seq=1 Ack=29 Win=65152 Len=0 TSval=2670796699 TSecr=624252913"
"148","56.125725","192.168.11.7","192.168.11.28","TCP","66","0.000056000","0.000056000","Jan  8, 2024 13:41:08.658000000 JST","","34514  >  6000 [ACK] Seq=29 Ack=2 Win=64256 Len=0 TSval=624252924 TSecr=2670796699"
"149","56.157025","192.168.11.7","255.255.255.255","UDP","209","","0.031300000","Jan  8, 2024 13:41:08.689300000 JST","7b2273656d616e74696373223a207b22656e74697479223a2022504944222c202262617365656e74697479223a2022616e79222c2022726f6c65223a20226b6b6b222c20227370617469616c223a2022616e79222c202274656d706f72616c223a2022616e79227d2c20226461746170726f7065727479223a207b22666f726d6174223a2022696e616f6b615f70726f6772616d5f73616d706c655f73656d616e746963227d7d","37403  >  7000 Len=167"
"150","56.179778","192.168.11.26","192.168.11.7","TCP","74","","0.022753000","Jan  8, 2024 13:41:08.712053000 JST","","60656  >  6000 [SYN] Seq=0 Win=64240 Len=0 MSS=1460 SACK_PERM TSval=141405245 TSecr=0 WS=128"
"151","56.179940","192.168.11.7","192.168.11.26","TCP","74","0.000162000","0.000162000","Jan  8, 2024 13:41:08.712215000 JST","","6000  >  60656 [SYN, ACK] Seq=0 Ack=1 Win=65160 Len=0 MSS=1460 SACK_PERM TSval=987844269 TSecr=141405245 WS=128"
"152","56.187519","192.168.11.26","192.168.11.7","TCP","66","0.007579000","0.007579000","Jan  8, 2024 13:41:08.719794000 JST","","60656  >  6000 [ACK] Seq=1 Ack=1 Win=64256 Len=0 TSval=141405264 TSecr=987844269"
"153","56.187911","192.168.11.26","192.168.11.7","TCP","93","","0.000392000","Jan  8, 2024 13:41:08.720186000 JST","","60656  >  6000 [PSH, ACK] Seq=1 Ack=1 Win=64256 Len=27 TSval=141405264 TSecr=987844269 [TCP segment of a reassembled PDU]"
"154","56.187970","192.168.11.7","192.168.11.26","TCP","66","0.000059000","0.000059000","Jan  8, 2024 13:41:08.720245000 JST","","6000  >  60656 [ACK] Seq=1 Ack=28 Win=65152 Len=0 TSval=987844277 TSecr=141405264"
"155","56.188023","192.168.11.26","192.168.11.7","TCP","66","","0.000053000","Jan  8, 2024 13:41:08.720298000 JST","","60656  >  6000 [FIN, ACK] Seq=28 Ack=1 Win=64256 Len=0 TSval=141405265 TSecr=987844269"
"156","56.188948","192.168.11.7","192.168.11.26","TCP","66","0.000925000","0.000925000","Jan  8, 2024 13:41:08.721223000 JST","","6000  >  60656 [FIN, ACK] Seq=1 Ack=29 Win=65152 Len=0 TSval=987844278 TSecr=141405265"
"157","56.197097","192.168.11.26","192.168.11.7","TCP","66","0.008149000","0.008149000","Jan  8, 2024 13:41:08.729372000 JST","","60656  >  6000 [ACK] Seq=29 Ack=2 Win=64256 Len=0 TSval=141405273 TSecr=987844278"
"158","62.794945","192.168.11.7","192.168.11.28","TCP","74","","6.597848000","Jan  8, 2024 13:41:15.327220000 JST","","49650  >  6000 [SYN] Seq=0 Win=64240 Len=0 MSS=1460 SACK_PERM TSval=624259593 TSecr=0 WS=128"
"159","62.804089","192.168.11.28","192.168.11.7","TCP","74","0.009144000","0.009144000","Jan  8, 2024 13:41:15.336364000 JST","","6000  >  49650 [SYN, ACK] Seq=0 Ack=1 Win=65160 Len=0 MSS=1460 SACK_PERM TSval=2670803377 TSecr=624259593 WS=128"
"160","62.804213","192.168.11.7","192.168.11.28","TCP","66","0.000124000","0.000124000","Jan  8, 2024 13:41:15.336488000 JST","","49650  >  6000 [ACK] Seq=1 Ack=1 Win=64256 Len=0 TSval=624259602 TSecr=2670803377"
"161","62.804414","192.168.11.7","192.168.11.28","TCP","93","","0.000201000","Jan  8, 2024 13:41:15.336689000 JST","","49650  >  6000 [PSH, ACK] Seq=1 Ack=1 Win=64256 Len=27 TSval=624259603 TSecr=2670803377 [TCP segment of a reassembled PDU]"
"162","62.804519","192.168.11.7","192.168.11.28","TCP","66","","0.000105000","Jan  8, 2024 13:41:15.336794000 JST","","49650  >  6000 [FIN, ACK] Seq=28 Ack=1 Win=64256 Len=0 TSval=624259603 TSecr=2670803377"
"163","62.812703","192.168.11.28","192.168.11.7","TCP","66","0.008289000","0.008184000","Jan  8, 2024 13:41:15.344978000 JST","","6000  >  49650 [ACK] Seq=1 Ack=28 Win=65152 Len=0 TSval=2670803387 TSecr=624259603"
"164","62.812992","192.168.11.28","192.168.11.7","TCP","66","0.008473000","0.000289000","Jan  8, 2024 13:41:15.345267000 JST","","6000  >  49650 [FIN, ACK] Seq=1 Ack=29 Win=65152 Len=0 TSval=2670803388 TSecr=624259603"
"165","62.813103","192.168.11.7","192.168.11.28","TCP","66","0.000111000","0.000111000","Jan  8, 2024 13:41:15.345378000 JST","","49650  >  6000 [ACK] Seq=29 Ack=2 Win=64256 Len=0 TSval=624259611 TSecr=2670803388"
"166","62.843861","192.168.11.7","255.255.255.255","UDP","209","","0.030758000","Jan  8, 2024 13:41:15.376136000 JST","7b2273656d616e74696373223a207b22656e74697479223a2022504944222c202262617365656e74697479223a2022616e79222c2022726f6c65223a20226b6b6b222c20227370617469616c223a2022616e79222c202274656d706f72616c223a2022616e79227d2c20226461746170726f7065727479223a207b22666f726d6174223a2022696e616f6b615f70726f6772616d5f73616d706c655f73656d616e746963227d7d","41905  >  7000 Len=167"
"167","62.854817","192.168.11.26","192.168.11.7","TCP","74","","0.010956000","Jan  8, 2024 13:41:15.387092000 JST","","55806  >  6000 [SYN] Seq=0 Win=64240 Len=0 MSS=1460 SACK_PERM TSval=141411929 TSecr=0 WS=128"
"168","62.854975","192.168.11.7","192.168.11.26","TCP","74","0.000158000","0.000158000","Jan  8, 2024 13:41:15.387250000 JST","","6000  >  55806 [SYN, ACK] Seq=0 Ack=1 Win=65160 Len=0 MSS=1460 SACK_PERM TSval=987850944 TSecr=141411929 WS=128"
"169","62.862883","192.168.11.26","192.168.11.7","TCP","66","0.007908000","0.007908000","Jan  8, 2024 13:41:15.395158000 JST","","55806  >  6000 [ACK] Seq=1 Ack=1 Win=64256 Len=0 TSval=141411939 TSecr=987850944"
