"No.","Time","Source","Destination","Protocol","Length","The RTT to ACK the segment was","Time delta from previous captured frame","Arrival Time","Data","Info"
"1","0.000000","192.168.11.26","192.168.11.7","TCP","74","","0.000000000","Jan  8, 2024 13:40:12.786713000 JST","","52260  >  6000 [SYN] Seq=0 Win=64240 Len=0 MSS=1460 SACK_PERM TSval=141349137 TSecr=0 WS=128"
"2","0.017140","192.168.11.7","192.168.11.26","TCP","74","0.017140000","0.017140000","Jan  8, 2024 13:40:12.803853000 JST","","6000  >  52260 [SYN, ACK] Seq=0 Ack=1 Win=65160 Len=0 MSS=1460 SACK_PERM TSval=987788160 TSecr=141349137 WS=128"
"3","0.017278","192.168.11.26","192.168.11.7","TCP","66","0.000138000","0.000138000","Jan  8, 2024 13:40:12.803991000 JST","","52260  >  6000 [ACK] Seq=1 Ack=1 Win=64256 Len=0 TSval=141349158 TSecr=987788160"
"4","0.017572","192.168.11.26","192.168.11.7","TCP","93","","0.000294000","Jan  8, 2024 13:40:12.804285000 JST","","52260  >  6000 [PSH, ACK] Seq=1 Ack=1 Win=64256 Len=27 TSval=141349158 TSecr=987788160 [TCP segment of a reassembled PDU]"
"5","0.017770","192.168.11.26","192.168.11.7","TCP","66","","0.000198000","Jan  8, 2024 13:40:12.804483000 JST","","52260  >  6000 [FIN, ACK] Seq=28 Ack=1 Win=64256 Len=0 TSval=141349159 TSecr=987788160"
"6","0.032059","192.168.11.7","192.168.11.26","TCP","66","0.014487000","0.014289000","Jan  8, 2024 13:40:12.818772000 JST","","6000  >  52260 [ACK] Seq=1 Ack=28 Win=65152 Len=0 TSval=987788178 TSecr=141349158"
"7","0.032437","192.168.11.7","192.168.11.26","TCP","66","0.014667000","0.000378000","Jan  8, 2024 13:40:12.819150000 JST","","6000  >  52260 [FIN, ACK] Seq=1 Ack=29 Win=65152 Len=0 TSval=987788179 TSecr=141349159"
"8","0.032488","192.168.11.26","192.168.11.7","TCP","66","0.000051000","0.000051000","Jan  8, 2024 13:40:12.819201000 JST","","52260  >  6000 [ACK] Seq=29 Ack=2 Win=64256 Len=0 TSval=141349173 TSecr=987788179"
"9","0.063764","192.168.11.26","255.255.255.255","UDP","209","","0.031276000","Jan  8, 2024 13:40:12.850477000 JST","7b2273656d616e74696373223a207b22656e74697479223a2022504944222c202262617365656e74697479223a2022616e79222c2022726f6c65223a20226c6c6c222c20227370617469616c223a2022616e79222c202274656d706f72616c223a2022616e79227d2c20226461746170726f7065727479223a207b22666f726d6174223a2022696e616f6b615f70726f6772616d5f73616d706c655f73656d616e746963227d7d","56016  >  7000 Len=167"
"10","0.076298","192.168.11.25","192.168.11.26","TCP","74","","0.012534000","Jan  8, 2024 13:40:12.863011000 JST","","45514  >  6000 [SYN] Seq=0 Win=64240 Len=0 MSS=1460 SACK_PERM TSval=472775825 TSecr=0 WS=128"
"11","0.076479","192.168.11.26","192.168.11.25","TCP","74","0.000181000","0.000181000","Jan  8, 2024 13:40:12.863192000 JST","","6000  >  45514 [SYN, ACK] Seq=0 Ack=1 Win=65160 Len=0 MSS=1460 SACK_PERM TSval=667842305 TSecr=472775825 WS=128"
"12","0.088323","192.168.11.25","192.168.11.26","TCP","66","0.011844000","0.011844000","Jan  8, 2024 13:40:12.875036000 JST","","45514  >  6000 [ACK] Seq=1 Ack=1 Win=64256 Len=0 TSval=472775842 TSecr=667842305"
"13","0.089066","192.168.11.25","192.168.11.26","TCP","93","","0.000743000","Jan  8, 2024 13:40:12.875779000 JST","","45514  >  6000 [PSH, ACK] Seq=1 Ack=1 Win=64256 Len=27 TSval=472775842 TSecr=667842305 [TCP segment of a reassembled PDU]"
"14","0.089200","192.168.11.26","192.168.11.25","TCP","66","0.000134000","0.000134000","Jan  8, 2024 13:40:12.875913000 JST","","6000  >  45514 [ACK] Seq=1 Ack=28 Win=65152 Len=0 TSval=667842318 TSecr=472775842"
"15","0.089286","192.168.11.25","192.168.11.26","TCP","66","","0.000086000","Jan  8, 2024 13:40:12.875999000 JST","","45514  >  6000 [FIN, ACK] Seq=28 Ack=1 Win=64256 Len=0 TSval=472775842 TSecr=667842305"
"16","0.091153","192.168.11.26","192.168.11.25","TCP","66","0.001867000","0.001867000","Jan  8, 2024 13:40:12.877866000 JST","","6000  >  45514 [FIN, ACK] Seq=1 Ack=29 Win=65152 Len=0 TSval=667842320 TSecr=472775842"
"17","0.100894","192.168.11.25","192.168.11.26","TCP","66","0.009741000","0.009741000","Jan  8, 2024 13:40:12.887607000 JST","","45514  >  6000 [ACK] Seq=29 Ack=2 Win=64256 Len=0 TSval=472775855 TSecr=667842320"
"18","6.927088","192.168.11.26","192.168.11.7","TCP","74","","6.826194000","Jan  8, 2024 13:40:19.713801000 JST","","52272  >  6000 [SYN] Seq=0 Win=64240 Len=0 MSS=1460 SACK_PERM TSval=141356068 TSecr=0 WS=128"
"19","6.947979","192.168.11.7","192.168.11.26","TCP","74","0.020891000","0.020891000","Jan  8, 2024 13:40:19.734692000 JST","","6000  >  52272 [SYN, ACK] Seq=0 Ack=1 Win=65160 Len=0 MSS=1460 SACK_PERM TSval=987795082 TSecr=141356068 WS=128"
"20","6.948098","192.168.11.26","192.168.11.7","TCP","66","0.000119000","0.000119000","Jan  8, 2024 13:40:19.734811000 JST","","52272  >  6000 [ACK] Seq=1 Ack=1 Win=64256 Len=0 TSval=141356089 TSecr=987795082"
"21","6.948330","192.168.11.26","192.168.11.7","TCP","93","","0.000232000","Jan  8, 2024 13:40:19.735043000 JST","","52272  >  6000 [PSH, ACK] Seq=1 Ack=1 Win=64256 Len=27 TSval=141356089 TSecr=987795082 [TCP segment of a reassembled PDU]"
"22","6.948477","192.168.11.26","192.168.11.7","TCP","66","","0.000147000","Jan  8, 2024 13:40:19.735190000 JST","","52272  >  6000 [FIN, ACK] Seq=28 Ack=1 Win=64256 Len=0 TSval=141356089 TSecr=987795082"
"23","6.958484","192.168.11.7","192.168.11.26","TCP","66","0.010154000","0.010007000","Jan  8, 2024 13:40:19.745197000 JST","","6000  >  52272 [ACK] Seq=1 Ack=28 Win=65152 Len=0 TSval=987795104 TSecr=141356089"
"24","6.958862","192.168.11.7","192.168.11.26","TCP","66","0.010385000","0.000378000","Jan  8, 2024 13:40:19.745575000 JST","","6000  >  52272 [FIN, ACK] Seq=1 Ack=29 Win=65152 Len=0 TSval=987795105 TSecr=141356089"
"25","6.958913","192.168.11.26","192.168.11.7","TCP","66","0.000051000","0.000051000","Jan  8, 2024 13:40:19.745626000 JST","","52272  >  6000 [ACK] Seq=29 Ack=2 Win=64256 Len=0 TSval=141356100 TSecr=987795105"
"26","6.992956","192.168.11.26","255.255.255.255","UDP","209","","0.034043000","Jan  8, 2024 13:40:19.779669000 JST","7b2273656d616e74696373223a207b22656e74697479223a2022504944222c202262617365656e74697479223a2022616e79222c2022726f6c65223a20226c6c6c222c20227370617469616c223a2022616e79222c202274656d706f72616c223a2022616e79227d2c20226461746170726f7065727479223a207b22666f726d6174223a2022696e616f6b615f70726f6772616d5f73616d706c655f73656d616e746963227d7d","43245  >  7000 Len=167"
"27","7.003299","192.168.11.25","192.168.11.26","TCP","74","","0.010343000","Jan  8, 2024 13:40:19.790012000 JST","","45516  >  6000 [SYN] Seq=0 Win=64240 Len=0 MSS=1460 SACK_PERM TSval=472782754 TSecr=0 WS=128"
"28","7.003438","192.168.11.26","192.168.11.25","TCP","74","0.000139000","0.000139000","Jan  8, 2024 13:40:19.790151000 JST","","6000  >  45516 [SYN, ACK] Seq=0 Ack=1 Win=65160 Len=0 MSS=1460 SACK_PERM TSval=667849232 TSecr=472782754 WS=128"
"29","7.012410","192.168.11.25","192.168.11.26","TCP","66","0.008972000","0.008972000","Jan  8, 2024 13:40:19.799123000 JST","","45516  >  6000 [ACK] Seq=1 Ack=1 Win=64256 Len=0 TSval=472782766 TSecr=667849232"
"30","7.013477","192.168.11.25","192.168.11.26","TCP","93","","0.001067000","Jan  8, 2024 13:40:19.800190000 JST","","45516  >  6000 [PSH, ACK] Seq=1 Ack=1 Win=64256 Len=27 TSval=472782766 TSecr=667849232 [TCP segment of a reassembled PDU]"
"31","7.013715","192.168.11.26","192.168.11.25","TCP","66","0.000238000","0.000238000","Jan  8, 2024 13:40:19.800428000 JST","","6000  >  45516 [ACK] Seq=1 Ack=28 Win=65152 Len=0 TSval=667849242 TSecr=472782766"
"32","7.013938","192.168.11.25","192.168.11.26","TCP","66","","0.000223000","Jan  8, 2024 13:40:19.800651000 JST","","45516  >  6000 [FIN, ACK] Seq=28 Ack=1 Win=64256 Len=0 TSval=472782766 TSecr=667849232"
"33","7.016104","192.168.11.26","192.168.11.25","TCP","66","0.002166000","0.002166000","Jan  8, 2024 13:40:19.802817000 JST","","6000  >  45516 [FIN, ACK] Seq=1 Ack=29 Win=65152 Len=0 TSval=667849245 TSecr=472782766"
"34","7.031660","192.168.11.25","192.168.11.26","TCP","66","0.015556000","0.015556000","Jan  8, 2024 13:40:19.818373000 JST","","45516  >  6000 [ACK] Seq=29 Ack=2 Win=64256 Len=0 TSval=472782778 TSecr=667849245"
"35","13.710729","192.168.11.26","192.168.11.7","TCP","74","","6.679069000","Jan  8, 2024 13:40:26.497442000 JST","","39886  >  6000 [SYN] Seq=0 Win=64240 Len=0 MSS=1460 SACK_PERM TSval=141362852 TSecr=0 WS=128"
"36","13.720572","192.168.11.7","192.168.11.26","TCP","74","0.009843000","0.009843000","Jan  8, 2024 13:40:26.507285000 JST","","6000  >  39886 [SYN, ACK] Seq=0 Ack=1 Win=65160 Len=0 MSS=1460 SACK_PERM TSval=987801866 TSecr=141362852 WS=128"
"37","13.720668","192.168.11.26","192.168.11.7","TCP","66","0.000096000","0.000096000","Jan  8, 2024 13:40:26.507381000 JST","","39886  >  6000 [ACK] Seq=1 Ack=1 Win=64256 Len=0 TSval=141362861 TSecr=987801866"
"38","13.720857","192.168.11.26","192.168.11.7","TCP","93","","0.000189000","Jan  8, 2024 13:40:26.507570000 JST","","39886  >  6000 [PSH, ACK] Seq=1 Ack=1 Win=64256 Len=27 TSval=141362862 TSecr=987801866 [TCP segment of a reassembled PDU]"
"39","13.720948","192.168.11.26","192.168.11.7","TCP","66","","0.000091000","Jan  8, 2024 13:40:26.507661000 JST","","39886  >  6000 [FIN, ACK] Seq=28 Ack=1 Win=64256 Len=0 TSval=141362862 TSecr=987801866"
"40","13.728804","192.168.11.7","192.168.11.26","TCP","66","0.007947000","0.007856000","Jan  8, 2024 13:40:26.515517000 JST","","6000  >  39886 [ACK] Seq=1 Ack=28 Win=65152 Len=0 TSval=987801875 TSecr=141362862"
"41","13.729174","192.168.11.7","192.168.11.26","TCP","66","0.008226000","0.000370000","Jan  8, 2024 13:40:26.515887000 JST","","6000  >  39886 [FIN, ACK] Seq=1 Ack=29 Win=65152 Len=0 TSval=987801876 TSecr=141362862"
"42","13.729220","192.168.11.26","192.168.11.7","TCP","66","0.000046000","0.000046000","Jan  8, 2024 13:40:26.515933000 JST","","39886  >  6000 [ACK] Seq=29 Ack=2 Win=64256 Len=0 TSval=141362870 TSecr=987801876"
"43","13.758376","192.168.11.26","255.255.255.255","UDP","209","","0.029156000","Jan  8, 2024 13:40:26.545089000 JST","7b2273656d616e74696373223a207b22656e74697479223a2022504944222c202262617365656e74697479223a2022616e79222c2022726f6c65223a20226c6c6c222c20227370617469616c223a2022616e79222c202274656d706f72616c223a2022616e79227d2c20226461746170726f7065727479223a207b22666f726d6174223a2022696e616f6b615f70726f6772616d5f73616d706c655f73656d616e746963227d7d","47338  >  7000 Len=167"
"44","13.771049","192.168.11.25","192.168.11.26","TCP","74","","0.012673000","Jan  8, 2024 13:40:26.557762000 JST","","43416  >  6000 [SYN] Seq=0 Win=64240 Len=0 MSS=1460 SACK_PERM TSval=472789523 TSecr=0 WS=128"
"45","13.771183","192.168.11.26","192.168.11.25","TCP","74","0.000134000","0.000134000","Jan  8, 2024 13:40:26.557896000 JST","","6000  >  43416 [SYN, ACK] Seq=0 Ack=1 Win=65160 Len=0 MSS=1460 SACK_PERM TSval=667856000 TSecr=472789523 WS=128"
"46","13.788606","192.168.11.25","192.168.11.26","TCP","66","0.017423000","0.017423000","Jan  8, 2024 13:40:26.575319000 JST","","43416  >  6000 [ACK] Seq=1 Ack=1 Win=64256 Len=0 TSval=472789543 TSecr=667856000"
"47","13.789110","192.168.11.25","192.168.11.26","TCP","93","","0.000504000","Jan  8, 2024 13:40:26.575823000 JST","","43416  >  6000 [PSH, ACK] Seq=1 Ack=1 Win=64256 Len=27 TSval=472789543 TSecr=667856000 [TCP segment of a reassembled PDU]"
"48","13.789174","192.168.11.26","192.168.11.25","TCP","66","0.000064000","0.000064000","Jan  8, 2024 13:40:26.575887000 JST","","6000  >  43416 [ACK] Seq=1 Ack=28 Win=65152 Len=0 TSval=667856018 TSecr=472789543"
"49","13.789250","192.168.11.25","192.168.11.26","TCP","66","","0.000076000","Jan  8, 2024 13:40:26.575963000 JST","","43416  >  6000 [FIN, ACK] Seq=28 Ack=1 Win=64256 Len=0 TSval=472789543 TSecr=667856000"
"50","13.790305","192.168.11.26","192.168.11.25","TCP","66","0.001055000","0.001055000","Jan  8, 2024 13:40:26.577018000 JST","","6000  >  43416 [FIN, ACK] Seq=1 Ack=29 Win=65152 Len=0 TSval=667856019 TSecr=472789543"
"51","13.798138","192.168.11.25","192.168.11.26","TCP","66","0.007833000","0.007833000","Jan  8, 2024 13:40:26.584851000 JST","","43416  >  6000 [ACK] Seq=29 Ack=2 Win=64256 Len=0 TSval=472789552 TSecr=667856019"
"52","21.405911","192.168.11.26","192.168.11.7","TCP","74","","7.607773000","Jan  8, 2024 13:40:34.192624000 JST","","53926  >  6000 [SYN] Seq=0 Win=64240 Len=0 MSS=1460 SACK_PERM TSval=141370547 TSecr=0 WS=128"
"53","21.414410","192.168.11.7","192.168.11.26","TCP","74","0.008499000","0.008499000","Jan  8, 2024 13:40:34.201123000 JST","","6000  >  53926 [SYN, ACK] Seq=0 Ack=1 Win=65160 Len=0 MSS=1460 SACK_PERM TSval=987809560 TSecr=141370547 WS=128"
"54","21.414505","192.168.11.26","192.168.11.7","TCP","66","0.000095000","0.000095000","Jan  8, 2024 13:40:34.201218000 JST","","53926  >  6000 [ACK] Seq=1 Ack=1 Win=64256 Len=0 TSval=141370555 TSecr=987809560"
"55","21.414696","192.168.11.26","192.168.11.7","TCP","93","","0.000191000","Jan  8, 2024 13:40:34.201409000 JST","","53926  >  6000 [PSH, ACK] Seq=1 Ack=1 Win=64256 Len=27 TSval=141370556 TSecr=987809560 [TCP segment of a reassembled PDU]"
"56","21.414797","192.168.11.26","192.168.11.7","TCP","66","","0.000101000","Jan  8, 2024 13:40:34.201510000 JST","","53926  >  6000 [FIN, ACK] Seq=28 Ack=1 Win=64256 Len=0 TSval=141370556 TSecr=987809560"
"57","21.422798","192.168.11.7","192.168.11.26","TCP","66","0.008102000","0.008001000","Jan  8, 2024 13:40:34.209511000 JST","","6000  >  53926 [ACK] Seq=1 Ack=28 Win=65152 Len=0 TSval=987809569 TSecr=141370556"
"58","21.423042","192.168.11.7","192.168.11.26","TCP","66","0.008245000","0.000244000","Jan  8, 2024 13:40:34.209755000 JST","","6000  >  53926 [FIN, ACK] Seq=1 Ack=29 Win=65152 Len=0 TSval=987809570 TSecr=141370556"
"59","21.423086","192.168.11.26","192.168.11.7","TCP","66","0.000044000","0.000044000","Jan  8, 2024 13:40:34.209799000 JST","","53926  >  6000 [ACK] Seq=29 Ack=2 Win=64256 Len=0 TSval=141370564 TSecr=987809570"
"60","21.452610","192.168.11.26","255.255.255.255","UDP","209","","0.029524000","Jan  8, 2024 13:40:34.239323000 JST","7b2273656d616e74696373223a207b22656e74697479223a2022504944222c202262617365656e74697479223a2022616e79222c2022726f6c65223a20226c6c6c222c20227370617469616c223a2022616e79222c202274656d706f72616c223a2022616e79227d2c20226461746170726f7065727479223a207b22666f726d6174223a2022696e616f6b615f70726f6772616d5f73616d706c655f73656d616e746963227d7d","51697  >  7000 Len=167"
"61","21.459916","192.168.11.25","192.168.11.26","TCP","74","","0.007306000","Jan  8, 2024 13:40:34.246629000 JST","","59312  >  6000 [SYN] Seq=0 Win=64240 Len=0 MSS=1460 SACK_PERM TSval=472797214 TSecr=0 WS=128"
"62","21.460031","192.168.11.26","192.168.11.25","TCP","74","0.000115000","0.000115000","Jan  8, 2024 13:40:34.246744000 JST","","6000  >  59312 [SYN, ACK] Seq=0 Ack=1 Win=65160 Len=0 MSS=1460 SACK_PERM TSval=667863689 TSecr=472797214 WS=128"
"63","21.470772","192.168.11.25","192.168.11.26","TCP","66","0.010741000","0.010741000","Jan  8, 2024 13:40:34.257485000 JST","","59312  >  6000 [ACK] Seq=1 Ack=1 Win=64256 Len=0 TSval=472797224 TSecr=667863689"
"64","21.471457","192.168.11.25","192.168.11.26","TCP","93","","0.000685000","Jan  8, 2024 13:40:34.258170000 JST","","59312  >  6000 [PSH, ACK] Seq=1 Ack=1 Win=64256 Len=27 TSval=472797225 TSecr=667863689 [TCP segment of a reassembled PDU]"
"65","21.471552","192.168.11.26","192.168.11.25","TCP","66","0.000095000","0.000095000","Jan  8, 2024 13:40:34.258265000 JST","","6000  >  59312 [ACK] Seq=1 Ack=28 Win=65152 Len=0 TSval=667863700 TSecr=472797225"
"66","21.471631","192.168.11.25","192.168.11.26","TCP","66","","0.000079000","Jan  8, 2024 13:40:34.258344000 JST","","59312  >  6000 [FIN, ACK] Seq=28 Ack=1 Win=64256 Len=0 TSval=472797225 TSecr=667863689"
"67","21.473269","192.168.11.26","192.168.11.25","TCP","66","0.001638000","0.001638000","Jan  8, 2024 13:40:34.259982000 JST","","6000  >  59312 [FIN, ACK] Seq=1 Ack=29 Win=65152 Len=0 TSval=667863702 TSecr=472797225"
"68","21.482438","192.168.11.25","192.168.11.26","TCP","66","0.009169000","0.009169000","Jan  8, 2024 13:40:34.269151000 JST","","59312  >  6000 [ACK] Seq=29 Ack=2 Win=64256 Len=0 TSval=472797236 TSecr=667863702"
"69","29.149819","192.168.11.26","192.168.11.7","TCP","74","","7.667381000","Jan  8, 2024 13:40:41.936532000 JST","","33110  >  6000 [SYN] Seq=0 Win=64240 Len=0 MSS=1460 SACK_PERM TSval=141378291 TSecr=0 WS=128"
"70","29.158422","192.168.11.7","192.168.11.26","TCP","74","0.008603000","0.008603000","Jan  8, 2024 13:40:41.945135000 JST","","6000  >  33110 [SYN, ACK] Seq=0 Ack=1 Win=65160 Len=0 MSS=1460 SACK_PERM TSval=987817304 TSecr=141378291 WS=128"
"71","29.158522","192.168.11.26","192.168.11.7","TCP","66","0.000100000","0.000100000","Jan  8, 2024 13:40:41.945235000 JST","","33110  >  6000 [ACK] Seq=1 Ack=1 Win=64256 Len=0 TSval=141378299 TSecr=987817304"
"72","29.158767","192.168.11.26","192.168.11.7","TCP","93","","0.000245000","Jan  8, 2024 13:40:41.945480000 JST","","33110  >  6000 [PSH, ACK] Seq=1 Ack=1 Win=64256 Len=27 TSval=141378300 TSecr=987817304 [TCP segment of a reassembled PDU]"
"73","29.158876","192.168.11.26","192.168.11.7","TCP","66","","0.000109000","Jan  8, 2024 13:40:41.945589000 JST","","33110  >  6000 [FIN, ACK] Seq=28 Ack=1 Win=64256 Len=0 TSval=141378300 TSecr=987817304"
"74","29.169057","192.168.11.7","192.168.11.26","TCP","66","0.010290000","0.010181000","Jan  8, 2024 13:40:41.955770000 JST","","6000  >  33110 [ACK] Seq=1 Ack=28 Win=65152 Len=0 TSval=987817314 TSecr=141378300"
"75","29.169300","192.168.11.7","192.168.11.26","TCP","66","0.010424000","0.000243000","Jan  8, 2024 13:40:41.956013000 JST","","6000  >  33110 [FIN, ACK] Seq=1 Ack=29 Win=65152 Len=0 TSval=987817316 TSecr=141378300"
"76","29.169343","192.168.11.26","192.168.11.7","TCP","66","0.000043000","0.000043000","Jan  8, 2024 13:40:41.956056000 JST","","33110  >  6000 [ACK] Seq=29 Ack=2 Win=64256 Len=0 TSval=141378310 TSecr=987817316"
"77","29.202386","192.168.11.26","255.255.255.255","UDP","209","","0.033043000","Jan  8, 2024 13:40:41.989099000 JST","7b2273656d616e74696373223a207b22656e74697479223a2022504944222c202262617365656e74697479223a2022616e79222c2022726f6c65223a20226c6c6c222c20227370617469616c223a2022616e79222c202274656d706f72616c223a2022616e79227d2c20226461746170726f7065727479223a207b22666f726d6174223a2022696e616f6b615f70726f6772616d5f73616d706c655f73656d616e746963227d7d","59426  >  7000 Len=167"
"78","29.212153","192.168.11.25","192.168.11.26","TCP","74","","0.009767000","Jan  8, 2024 13:40:41.998866000 JST","","45528  >  6000 [SYN] Seq=0 Win=64240 Len=0 MSS=1460 SACK_PERM TSval=472804966 TSecr=0 WS=128"
"79","29.212297","192.168.11.26","192.168.11.25","TCP","74","0.000144000","0.000144000","Jan  8, 2024 13:40:41.999010000 JST","","6000  >  45528 [SYN, ACK] Seq=0 Ack=1 Win=65160 Len=0 MSS=1460 SACK_PERM TSval=667871441 TSecr=472804966 WS=128"
"80","29.221600","192.168.11.25","192.168.11.26","TCP","66","0.009303000","0.009303000","Jan  8, 2024 13:40:42.008313000 JST","","45528  >  6000 [ACK] Seq=1 Ack=1 Win=64256 Len=0 TSval=472804975 TSecr=667871441"
"81","29.222124","192.168.11.25","192.168.11.26","TCP","93","","0.000524000","Jan  8, 2024 13:40:42.008837000 JST","","45528  >  6000 [PSH, ACK] Seq=1 Ack=1 Win=64256 Len=27 TSval=472804976 TSecr=667871441 [TCP segment of a reassembled PDU]"
"82","29.222193","192.168.11.26","192.168.11.25","TCP","66","0.000069000","0.000069000","Jan  8, 2024 13:40:42.008906000 JST","","6000  >  45528 [ACK] Seq=1 Ack=28 Win=65152 Len=0 TSval=667871451 TSecr=472804976"
"83","29.222258","192.168.11.25","192.168.11.26","TCP","66","","0.000065000","Jan  8, 2024 13:40:42.008971000 JST","","45528  >  6000 [FIN, ACK] Seq=28 Ack=1 Win=64256 Len=0 TSval=472804976 TSecr=667871441"
"84","29.224513","192.168.11.26","192.168.11.25","TCP","66","0.002255000","0.002255000","Jan  8, 2024 13:40:42.011226000 JST","","6000  >  45528 [FIN, ACK] Seq=1 Ack=29 Win=65152 Len=0 TSval=667871453 TSecr=472804976"
"85","29.233520","192.168.11.25","192.168.11.26","TCP","66","0.009007000","0.009007000","Jan  8, 2024 13:40:42.020233000 JST","","45528  >  6000 [ACK] Seq=29 Ack=2 Win=64256 Len=0 TSval=472804987 TSecr=667871453"
"86","35.882625","192.168.11.26","192.168.11.7","TCP","74","","6.649105000","Jan  8, 2024 13:40:48.669338000 JST","","33120  >  6000 [SYN] Seq=0 Win=64240 Len=0 MSS=1460 SACK_PERM TSval=141385023 TSecr=0 WS=128"
"87","35.893411","192.168.11.7","192.168.11.26","TCP","74","0.010786000","0.010786000","Jan  8, 2024 13:40:48.680124000 JST","","6000  >  33120 [SYN, ACK] Seq=0 Ack=1 Win=65160 Len=0 MSS=1460 SACK_PERM TSval=987824039 TSecr=141385023 WS=128"
"88","35.893511","192.168.11.26","192.168.11.7","TCP","66","0.000100000","0.000100000","Jan  8, 2024 13:40:48.680224000 JST","","33120  >  6000 [ACK] Seq=1 Ack=1 Win=64256 Len=0 TSval=141385034 TSecr=987824039"
"89","35.893643","192.168.11.26","192.168.11.7","TCP","93","","0.000132000","Jan  8, 2024 13:40:48.680356000 JST","","33120  >  6000 [PSH, ACK] Seq=1 Ack=1 Win=64256 Len=27 TSval=141385034 TSecr=987824039 [TCP segment of a reassembled PDU]"
"90","35.893818","192.168.11.26","192.168.11.7","TCP","66","","0.000175000","Jan  8, 2024 13:40:48.680531000 JST","","33120  >  6000 [FIN, ACK] Seq=28 Ack=1 Win=64256 Len=0 TSval=141385035 TSecr=987824039"
"91","35.903711","192.168.11.7","192.168.11.26","TCP","66","0.010068000","0.009893000","Jan  8, 2024 13:40:48.690424000 JST","","6000  >  33120 [ACK] Seq=1 Ack=28 Win=65152 Len=0 TSval=987824049 TSecr=141385034"
"92","35.904083","192.168.11.7","192.168.11.26","TCP","66","0.010265000","0.000372000","Jan  8, 2024 13:40:48.690796000 JST","","6000  >  33120 [FIN, ACK] Seq=1 Ack=29 Win=65152 Len=0 TSval=987824051 TSecr=141385035"
"93","35.904128","192.168.11.26","192.168.11.7","TCP","66","0.000045000","0.000045000","Jan  8, 2024 13:40:48.690841000 JST","","33120  >  6000 [ACK] Seq=29 Ack=2 Win=64256 Len=0 TSval=141385045 TSecr=987824051"
"94","35.934002","192.168.11.26","255.255.255.255","UDP","209","","0.029874000","Jan  8, 2024 13:40:48.720715000 JST","7b2273656d616e74696373223a207b22656e74697479223a2022504944222c202262617365656e74697479223a2022616e79222c2022726f6c65223a20226c6c6c222c20227370617469616c223a2022616e79222c202274656d706f72616c223a2022616e79227d2c20226461746170726f7065727479223a207b22666f726d6174223a2022696e616f6b615f70726f6772616d5f73616d706c655f73656d616e746963227d7d","39534  >  7000 Len=167"
"95","35.940949","192.168.11.25","192.168.11.26","TCP","74","","0.006947000","Jan  8, 2024 13:40:48.727662000 JST","","45530  >  6000 [SYN] Seq=0 Win=64240 Len=0 MSS=1460 SACK_PERM TSval=472811696 TSecr=0 WS=128"
"96","35.941072","192.168.11.26","192.168.11.25","TCP","74","0.000123000","0.000123000","Jan  8, 2024 13:40:48.727785000 JST","","6000  >  45530 [SYN, ACK] Seq=0 Ack=1 Win=65160 Len=0 MSS=1460 SACK_PERM TSval=667878170 TSecr=472811696 WS=128"
"97","35.949240","192.168.11.25","192.168.11.26","TCP","66","0.008168000","0.008168000","Jan  8, 2024 13:40:48.735953000 JST","","45530  >  6000 [ACK] Seq=1 Ack=1 Win=64256 Len=0 TSval=472811704 TSecr=667878170"
"98","35.950060","192.168.11.25","192.168.11.26","TCP","93","","0.000820000","Jan  8, 2024 13:40:48.736773000 JST","","45530  >  6000 [PSH, ACK] Seq=1 Ack=1 Win=64256 Len=27 TSval=472811704 TSecr=667878170 [TCP segment of a reassembled PDU]"
"99","35.950166","192.168.11.26","192.168.11.25","TCP","66","0.000106000","0.000106000","Jan  8, 2024 13:40:48.736879000 JST","","6000  >  45530 [ACK] Seq=1 Ack=28 Win=65152 Len=0 TSval=667878179 TSecr=472811704"
"100","35.950248","192.168.11.25","192.168.11.26","TCP","66","","0.000082000","Jan  8, 2024 13:40:48.736961000 JST","","45530  >  6000 [FIN, ACK] Seq=28 Ack=1 Win=64256 Len=0 TSval=472811704 TSecr=667878170"
"101","35.951324","192.168.11.26","192.168.11.25","TCP","66","0.001076000","0.001076000","Jan  8, 2024 13:40:48.738037000 JST","","6000  >  45530 [FIN, ACK] Seq=1 Ack=29 Win=65152 Len=0 TSval=667878180 TSecr=472811704"
"102","35.958740","192.168.11.25","192.168.11.26","TCP","66","0.007416000","0.007416000","Jan  8, 2024 13:40:48.745453000 JST","","45530  >  6000 [ACK] Seq=29 Ack=2 Win=64256 Len=0 TSval=472811712 TSecr=667878180"
"103","42.636880","192.168.11.26","192.168.11.7","TCP","74","","6.678140000","Jan  8, 2024 13:40:55.423593000 JST","","39176  >  6000 [SYN] Seq=0 Win=64240 Len=0 MSS=1460 SACK_PERM TSval=141391778 TSecr=0 WS=128"
"104","42.654145","192.168.11.7","192.168.11.26","TCP","74","0.017265000","0.017265000","Jan  8, 2024 13:40:55.440858000 JST","","6000  >  39176 [SYN, ACK] Seq=0 Ack=1 Win=65160 Len=0 MSS=1460 SACK_PERM TSval=987830796 TSecr=141391778 WS=128"
"105","42.654259","192.168.11.26","192.168.11.7","TCP","66","0.000114000","0.000114000","Jan  8, 2024 13:40:55.440972000 JST","","39176  >  6000 [ACK] Seq=1 Ack=1 Win=64256 Len=0 TSval=141391795 TSecr=987830796"
"106","42.654393","192.168.11.26","192.168.11.7","TCP","93","","0.000134000","Jan  8, 2024 13:40:55.441106000 JST","","39176  >  6000 [PSH, ACK] Seq=1 Ack=1 Win=64256 Len=27 TSval=141391795 TSecr=987830796 [TCP segment of a reassembled PDU]"
"107","42.654505","192.168.11.26","192.168.11.7","TCP","66","","0.000112000","Jan  8, 2024 13:40:55.441218000 JST","","39176  >  6000 [FIN, ACK] Seq=28 Ack=1 Win=64256 Len=0 TSval=141391795 TSecr=987830796"
"108","42.663435","192.168.11.7","192.168.11.26","TCP","66","0.009042000","0.008930000","Jan  8, 2024 13:40:55.450148000 JST","","6000  >  39176 [ACK] Seq=1 Ack=28 Win=65152 Len=0 TSval=987830809 TSecr=141391795"
"109","42.663852","192.168.11.7","192.168.11.26","TCP","66","","0.000417000","Jan  8, 2024 13:40:55.450565000 JST","","[TCP Dup ACK 108#1] 6000  >  39176 [ACK] Seq=1 Ack=28 Win=65152 Len=0 TSval=987830810 TSecr=141391795"
"110","42.663912","192.168.11.7","192.168.11.26","TCP","66","0.009407000","0.000060000","Jan  8, 2024 13:40:55.450625000 JST","","6000  >  39176 [FIN, ACK] Seq=1 Ack=29 Win=65152 Len=0 TSval=987830810 TSecr=141391795"
"111","42.663965","192.168.11.26","192.168.11.7","TCP","66","0.000053000","0.000053000","Jan  8, 2024 13:40:55.450678000 JST","","39176  >  6000 [ACK] Seq=29 Ack=2 Win=64256 Len=0 TSval=141391805 TSecr=987830810"
"112","42.696555","192.168.11.26","255.255.255.255","UDP","209","","0.032590000","Jan  8, 2024 13:40:55.483268000 JST","7b2273656d616e74696373223a207b22656e74697479223a2022504944222c202262617365656e74697479223a2022616e79222c2022726f6c65223a20226c6c6c222c20227370617469616c223a2022616e79222c202274656d706f72616c223a2022616e79227d2c20226461746170726f7065727479223a207b22666f726d6174223a2022696e616f6b615f70726f6772616d5f73616d706c655f73656d616e746963227d7d","42308  >  7000 Len=167"
"113","42.704244","192.168.11.25","192.168.11.26","TCP","74","","0.007689000","Jan  8, 2024 13:40:55.490957000 JST","","35842  >  6000 [SYN] Seq=0 Win=64240 Len=0 MSS=1460 SACK_PERM TSval=472818458 TSecr=0 WS=128"
"114","42.704397","192.168.11.26","192.168.11.25","TCP","74","0.000153000","0.000153000","Jan  8, 2024 13:40:55.491110000 JST","","6000  >  35842 [SYN, ACK] Seq=0 Ack=1 Win=65160 Len=0 MSS=1460 SACK_PERM TSval=667884933 TSecr=472818458 WS=128"
"115","42.720776","192.168.11.25","192.168.11.26","TCP","66","0.016379000","0.016379000","Jan  8, 2024 13:40:55.507489000 JST","","35842  >  6000 [ACK] Seq=1 Ack=1 Win=64256 Len=0 TSval=472818467 TSecr=667884933"
"116","42.721290","192.168.11.25","192.168.11.26","TCP","93","","0.000514000","Jan  8, 2024 13:40:55.508003000 JST","","35842  >  6000 [PSH, ACK] Seq=1 Ack=1 Win=64256 Len=27 TSval=472818468 TSecr=667884933 [TCP segment of a reassembled PDU]"
"117","42.721382","192.168.11.26","192.168.11.25","TCP","66","0.000092000","0.000092000","Jan  8, 2024 13:40:55.508095000 JST","","6000  >  35842 [ACK] Seq=1 Ack=28 Win=65152 Len=0 TSval=667884950 TSecr=472818468"
"118","42.721480","192.168.11.25","192.168.11.26","TCP","66","","0.000098000","Jan  8, 2024 13:40:55.508193000 JST","","35842  >  6000 [FIN, ACK] Seq=28 Ack=1 Win=64256 Len=0 TSval=472818468 TSecr=667884933"
"119","42.722488","192.168.11.26","192.168.11.25","TCP","66","0.001008000","0.001008000","Jan  8, 2024 13:40:55.509201000 JST","","6000  >  35842 [FIN, ACK] Seq=1 Ack=29 Win=65152 Len=0 TSval=667884951 TSecr=472818468"
"120","42.730285","192.168.11.25","192.168.11.26","TCP","66","0.007797000","0.007797000","Jan  8, 2024 13:40:55.516998000 JST","","35842  >  6000 [ACK] Seq=29 Ack=2 Win=64256 Len=0 TSval=472818484 TSecr=667884951"
"121","49.391952","192.168.11.26","192.168.11.7","TCP","74","","6.661667000","Jan  8, 2024 13:41:02.178665000 JST","","60644  >  6000 [SYN] Seq=0 Win=64240 Len=0 MSS=1460 SACK_PERM TSval=141398533 TSecr=0 WS=128"
"122","49.400615","192.168.11.7","192.168.11.26","TCP","74","0.008663000","0.008663000","Jan  8, 2024 13:41:02.187328000 JST","","6000  >  60644 [SYN, ACK] Seq=0 Ack=1 Win=65160 Len=0 MSS=1460 SACK_PERM TSval=987837546 TSecr=141398533 WS=128"
"123","49.400710","192.168.11.26","192.168.11.7","TCP","66","0.000095000","0.000095000","Jan  8, 2024 13:41:02.187423000 JST","","60644  >  6000 [ACK] Seq=1 Ack=1 Win=64256 Len=0 TSval=141398542 TSecr=987837546"
"124","49.400900","192.168.11.26","192.168.11.7","TCP","93","","0.000190000","Jan  8, 2024 13:41:02.187613000 JST","","60644  >  6000 [PSH, ACK] Seq=1 Ack=1 Win=64256 Len=27 TSval=141398542 TSecr=987837546 [TCP segment of a reassembled PDU]"
"125","49.401000","192.168.11.26","192.168.11.7","TCP","66","","0.000100000","Jan  8, 2024 13:41:02.187713000 JST","","60644  >  6000 [FIN, ACK] Seq=28 Ack=1 Win=64256 Len=0 TSval=141398542 TSecr=987837546"
"126","49.409183","192.168.11.7","192.168.11.26","TCP","66","0.008283000","0.008183000","Jan  8, 2024 13:41:02.195896000 JST","","6000  >  60644 [ACK] Seq=1 Ack=28 Win=65152 Len=0 TSval=987837555 TSecr=141398542"
"127","49.409396","192.168.11.7","192.168.11.26","TCP","66","0.008396000","0.000213000","Jan  8, 2024 13:41:02.196109000 JST","","6000  >  60644 [FIN, ACK] Seq=1 Ack=29 Win=65152 Len=0 TSval=987837557 TSecr=141398542"
"128","49.409440","192.168.11.26","192.168.11.7","TCP","66","0.000044000","0.000044000","Jan  8, 2024 13:41:02.196153000 JST","","60644  >  6000 [ACK] Seq=29 Ack=2 Win=64256 Len=0 TSval=141398550 TSecr=987837557"
"129","49.438964","192.168.11.26","255.255.255.255","UDP","209","","0.029524000","Jan  8, 2024 13:41:02.225677000 JST","7b2273656d616e74696373223a207b22656e74697479223a2022504944222c202262617365656e74697479223a2022616e79222c2022726f6c65223a20226c6c6c222c20227370617469616c223a2022616e79222c202274656d706f72616c223a2022616e79227d2c20226461746170726f7065727479223a207b22666f726d6174223a2022696e616f6b615f70726f6772616d5f73616d706c655f73656d616e746963227d7d","53061  >  7000 Len=167"
"130","49.447172","192.168.11.25","192.168.11.26","TCP","74","","0.008208000","Jan  8, 2024 13:41:02.233885000 JST","","56276  >  6000 [SYN] Seq=0 Win=64240 Len=0 MSS=1460 SACK_PERM TSval=472825201 TSecr=0 WS=128"
"131","49.447293","192.168.11.26","192.168.11.25","TCP","74","0.000121000","0.000121000","Jan  8, 2024 13:41:02.234006000 JST","","6000  >  56276 [SYN, ACK] Seq=0 Ack=1 Win=65160 Len=0 MSS=1460 SACK_PERM TSval=667891676 TSecr=472825201 WS=128"
"132","49.470903","192.168.11.25","192.168.11.26","TCP","66","0.023610000","0.023610000","Jan  8, 2024 13:41:02.257616000 JST","","56276  >  6000 [ACK] Seq=1 Ack=1 Win=64256 Len=0 TSval=472825225 TSecr=667891676"
"133","49.471367","192.168.11.25","192.168.11.26","TCP","93","","0.000464000","Jan  8, 2024 13:41:02.258080000 JST","","56276  >  6000 [PSH, ACK] Seq=1 Ack=1 Win=64256 Len=27 TSval=472825225 TSecr=667891676 [TCP segment of a reassembled PDU]"
"134","49.471427","192.168.11.26","192.168.11.25","TCP","66","0.000060000","0.000060000","Jan  8, 2024 13:41:02.258140000 JST","","6000  >  56276 [ACK] Seq=1 Ack=28 Win=65152 Len=0 TSval=667891700 TSecr=472825225"
"135","49.471486","192.168.11.25","192.168.11.26","TCP","66","","0.000059000","Jan  8, 2024 13:41:02.258199000 JST","","56276  >  6000 [FIN, ACK] Seq=28 Ack=1 Win=64256 Len=0 TSval=472825225 TSecr=667891676"
"136","49.472268","192.168.11.26","192.168.11.25","TCP","66","0.000782000","0.000782000","Jan  8, 2024 13:41:02.258981000 JST","","6000  >  56276 [FIN, ACK] Seq=1 Ack=29 Win=65152 Len=0 TSval=667891701 TSecr=472825225"
"137","49.480397","192.168.11.25","192.168.11.26","TCP","66","0.008129000","0.008129000","Jan  8, 2024 13:41:02.267110000 JST","","56276  >  6000 [ACK] Seq=29 Ack=2 Win=64256 Len=0 TSval=472825235 TSecr=667891701"
"138","56.103794","192.168.11.26","192.168.11.7","TCP","74","","6.623397000","Jan  8, 2024 13:41:08.890507000 JST","","60656  >  6000 [SYN] Seq=0 Win=64240 Len=0 MSS=1460 SACK_PERM TSval=141405245 TSecr=0 WS=128"
"139","56.123389","192.168.11.7","192.168.11.26","TCP","74","0.019595000","0.019595000","Jan  8, 2024 13:41:08.910102000 JST","","6000  >  60656 [SYN, ACK] Seq=0 Ack=1 Win=65160 Len=0 MSS=1460 SACK_PERM TSval=987844269 TSecr=141405245 WS=128"
"140","56.123487","192.168.11.26","192.168.11.7","TCP","66","0.000098000","0.000098000","Jan  8, 2024 13:41:08.910200000 JST","","60656  >  6000 [ACK] Seq=1 Ack=1 Win=64256 Len=0 TSval=141405264 TSecr=987844269"
"141","56.123650","192.168.11.26","192.168.11.7","TCP","93","","0.000163000","Jan  8, 2024 13:41:08.910363000 JST","","60656  >  6000 [PSH, ACK] Seq=1 Ack=1 Win=64256 Len=27 TSval=141405264 TSecr=987844269 [TCP segment of a reassembled PDU]"
"142","56.123772","192.168.11.26","192.168.11.7","TCP","66","","0.000122000","Jan  8, 2024 13:41:08.910485000 JST","","60656  >  6000 [FIN, ACK] Seq=28 Ack=1 Win=64256 Len=0 TSval=141405265 TSecr=987844269"
"143","56.131763","192.168.11.7","192.168.11.26","TCP","66","0.008113000","0.007991000","Jan  8, 2024 13:41:08.918476000 JST","","6000  >  60656 [ACK] Seq=1 Ack=28 Win=65152 Len=0 TSval=987844277 TSecr=141405264"
"144","56.132149","192.168.11.7","192.168.11.26","TCP","66","0.008377000","0.000386000","Jan  8, 2024 13:41:08.918862000 JST","","6000  >  60656 [FIN, ACK] Seq=1 Ack=29 Win=65152 Len=0 TSval=987844278 TSecr=141405265"
"145","56.132199","192.168.11.26","192.168.11.7","TCP","66","0.000050000","0.000050000","Jan  8, 2024 13:41:08.918912000 JST","","60656  >  6000 [ACK] Seq=29 Ack=2 Win=64256 Len=0 TSval=141405273 TSecr=987844278"
"146","56.161904","192.168.11.26","255.255.255.255","UDP","209","","0.029705000","Jan  8, 2024 13:41:08.948617000 JST","7b2273656d616e74696373223a207b22656e74697479223a2022504944222c202262617365656e74697479223a2022616e79222c2022726f6c65223a20226c6c6c222c20227370617469616c223a2022616e79222c202274656d706f72616c223a2022616e79227d2c20226461746170726f7065727479223a207b22666f726d6174223a2022696e616f6b615f70726f6772616d5f73616d706c655f73656d616e746963227d7d","38928  >  7000 Len=167"
"147","56.168841","192.168.11.25","192.168.11.26","TCP","74","","0.006937000","Jan  8, 2024 13:41:08.955554000 JST","","56288  >  6000 [SYN] Seq=0 Win=64240 Len=0 MSS=1460 SACK_PERM TSval=472831924 TSecr=0 WS=128"
"148","56.168962","192.168.11.26","192.168.11.25","TCP","74","0.000121000","0.000121000","Jan  8, 2024 13:41:08.955675000 JST","","6000  >  56288 [SYN, ACK] Seq=0 Ack=1 Win=65160 Len=0 MSS=1460 SACK_PERM TSval=667898398 TSecr=472831924 WS=128"
"149","56.178450","192.168.11.25","192.168.11.26","TCP","66","0.009488000","0.009488000","Jan  8, 2024 13:41:08.965163000 JST","","56288  >  6000 [ACK] Seq=1 Ack=1 Win=64256 Len=0 TSval=472831933 TSecr=667898398"
"150","56.179083","192.168.11.25","192.168.11.26","TCP","93","","0.000633000","Jan  8, 2024 13:41:08.965796000 JST","","56288  >  6000 [PSH, ACK] Seq=1 Ack=1 Win=64256 Len=27 TSval=472831933 TSecr=667898398 [TCP segment of a reassembled PDU]"
"151","56.179170","192.168.11.26","192.168.11.25","TCP","66","0.000087000","0.000087000","Jan  8, 2024 13:41:08.965883000 JST","","6000  >  56288 [ACK] Seq=1 Ack=28 Win=65152 Len=0 TSval=667898408 TSecr=472831933"
"152","56.179244","192.168.11.25","192.168.11.26","TCP","66","","0.000074000","Jan  8, 2024 13:41:08.965957000 JST","","56288  >  6000 [FIN, ACK] Seq=28 Ack=1 Win=64256 Len=0 TSval=472831933 TSecr=667898398"
"153","56.180918","192.168.11.26","192.168.11.25","TCP","66","0.001674000","0.001674000","Jan  8, 2024 13:41:08.967631000 JST","","6000  >  56288 [FIN, ACK] Seq=1 Ack=29 Win=65152 Len=0 TSval=667898410 TSecr=472831933"
"154","56.190238","192.168.11.25","192.168.11.26","TCP","66","0.009320000","0.009320000","Jan  8, 2024 13:41:08.976951000 JST","","56288  >  6000 [ACK] Seq=29 Ack=2 Win=64256 Len=0 TSval=472831944 TSecr=667898410"
"155","62.788613","192.168.11.26","192.168.11.7","TCP","74","","6.598375000","Jan  8, 2024 13:41:15.575326000 JST","","55806  >  6000 [SYN] Seq=0 Win=64240 Len=0 MSS=1460 SACK_PERM TSval=141411929 TSecr=0 WS=128"
"156","62.798518","192.168.11.7","192.168.11.26","TCP","74","0.009905000","0.009905000","Jan  8, 2024 13:41:15.585231000 JST","","6000  >  55806 [SYN, ACK] Seq=0 Ack=1 Win=65160 Len=0 MSS=1460 SACK_PERM TSval=987850944 TSecr=141411929 WS=128"
"157","62.798626","192.168.11.26","192.168.11.7","TCP","66","0.000108000","0.000108000","Jan  8, 2024 13:41:15.585339000 JST","","55806  >  6000 [ACK] Seq=1 Ack=1 Win=64256 Len=0 TSval=141411939 TSecr=987850944"
"158","62.798817","192.168.11.26","192.168.11.7","TCP","93","","0.000191000","Jan  8, 2024 13:41:15.585530000 JST","","55806  >  6000 [PSH, ACK] Seq=1 Ack=1 Win=64256 Len=27 TSval=141411940 TSecr=987850944 [TCP segment of a reassembled PDU]"
"159","62.798908","192.168.11.26","192.168.11.7","TCP","66","","0.000091000","Jan  8, 2024 13:41:15.585621000 JST","","55806  >  6000 [FIN, ACK] Seq=28 Ack=1 Win=64256 Len=0 TSval=141411940 TSecr=987850944"
"160","62.806762","192.168.11.7","192.168.11.26","TCP","78","","0.007854000","Jan  8, 2024 13:41:15.593475000 JST","","[TCP Window Update] 6000  >  55806 [ACK] Seq=1 Ack=1 Win=65280 Len=0 TSval=987850953 TSecr=141411939 SLE=28 SRE=29"
"161","62.807022","192.168.11.7","192.168.11.26","TCP","66","0.008114000","0.000260000","Jan  8, 2024 13:41:15.593735000 JST","","6000  >  55806 [ACK] Seq=1 Ack=29 Win=65280 Len=0 TSval=987850953 TSecr=141411940"
"162","62.809248","192.168.11.7","192.168.11.26","TCP","66","","0.002226000","Jan  8, 2024 13:41:15.595961000 JST","","6000  >  55806 [FIN, ACK] Seq=1 Ack=29 Win=65280 Len=0 TSval=987850954 TSecr=141411940"
"163","62.809305","192.168.11.26","192.168.11.7","TCP","66","0.000057000","0.000057000","Jan  8, 2024 13:41:15.596018000 JST","","55806  >  6000 [ACK] Seq=29 Ack=2 Win=64256 Len=0 TSval=141411950 TSecr=987850954"
"164","62.838032","192.168.11.26","255.255.255.255","UDP","209","","0.028727000","Jan  8, 2024 13:41:15.624745000 JST","7b2273656d616e74696373223a207b22656e74697479223a2022504944222c202262617365656e74697479223a2022616e79222c2022726f6c65223a20226c6c6c222c20227370617469616c223a2022616e79222c202274656d706f72616c223a2022616e79227d2c20226461746170726f7065727479223a207b22666f726d6174223a2022696e616f6b615f70726f6772616d5f73616d706c655f73656d616e746963227d7d","51335  >  7000 Len=167"
"165","62.845133","192.168.11.25","192.168.11.26","TCP","74","","0.007101000","Jan  8, 2024 13:41:15.631846000 JST","","51000  >  6000 [SYN] Seq=0 Win=64240 Len=0 MSS=1460 SACK_PERM TSval=472838600 TSecr=0 WS=128"
"166","62.845232","192.168.11.26","192.168.11.25","TCP","74","0.000099000","0.000099000","Jan  8, 2024 13:41:15.631945000 JST","","6000  >  51000 [SYN, ACK] Seq=0 Ack=1 Win=65160 Len=0 MSS=1460 SACK_PERM TSval=667905074 TSecr=472838600 WS=128"
"167","62.859368","192.168.11.25","192.168.11.26","TCP","66","0.014136000","0.014136000","Jan  8, 2024 13:41:15.646081000 JST","","51000  >  6000 [ACK] Seq=1 Ack=1 Win=64256 Len=0 TSval=472838607 TSecr=667905074"
"168","62.859809","192.168.11.25","192.168.11.26","TCP","93","","0.000441000","Jan  8, 2024 13:41:15.646522000 JST","","51000  >  6000 [PSH, ACK] Seq=1 Ack=1 Win=64256 Len=27 TSval=472838607 TSecr=667905074 [TCP segment of a reassembled PDU]"
"169","62.859874","192.168.11.26","192.168.11.25","TCP","66","0.000065000","0.000065000","Jan  8, 2024 13:41:15.646587000 JST","","6000  >  51000 [ACK] Seq=1 Ack=28 Win=65152 Len=0 TSval=667905089 TSecr=472838607"
