"No.","Time","Source","Destination","Protocol","Length","The RTT to ACK the segment was","Time delta from previous captured frame","Arrival Time","Data","Info"
"1","0.000000","192.168.11.4","192.168.11.25","TCP","74","","0.000000000","Jan  8, 2024 13:40:12.908639000 JST","","54260  >  6000 [SYN] Seq=0 Win=64240 Len=0 MSS=1460 SACK_PERM TSval=2896244699 TSecr=0 WS=128"
"2","0.006576","192.168.11.25","192.168.11.4","TCP","74","0.006576000","0.006576000","Jan  8, 2024 13:40:12.915215000 JST","","6000  >  54260 [SYN, ACK] Seq=0 Ack=1 Win=65160 Len=0 MSS=1460 SACK_PERM TSval=2779281942 TSecr=2896244699 WS=128"
"3","0.006676","192.168.11.4","192.168.11.25","TCP","66","0.000100000","0.000100000","Jan  8, 2024 13:40:12.915315000 JST","","54260  >  6000 [ACK] Seq=1 Ack=1 Win=64256 Len=0 TSval=2896244708 TSecr=2779281942"
"4","0.006869","192.168.11.4","192.168.11.25","TCP","93","","0.000193000","Jan  8, 2024 13:40:12.915508000 JST","","54260  >  6000 [PSH, ACK] Seq=1 Ack=1 Win=64256 Len=27 TSval=2896244708 TSecr=2779281942 [TCP segment of a reassembled PDU]"
"5","0.006997","192.168.11.4","192.168.11.25","TCP","66","","0.000128000","Jan  8, 2024 13:40:12.915636000 JST","","54260  >  6000 [FIN, ACK] Seq=28 Ack=1 Win=64256 Len=0 TSval=2896244709 TSecr=2779281942"
"6","0.015106","192.168.11.25","192.168.11.4","TCP","66","0.008237000","0.008109000","Jan  8, 2024 13:40:12.923745000 JST","","6000  >  54260 [ACK] Seq=1 Ack=28 Win=65152 Len=0 TSval=2779281950 TSecr=2896244708"
"7","0.015318","192.168.11.25","192.168.11.4","TCP","66","0.008321000","0.000212000","Jan  8, 2024 13:40:12.923957000 JST","","6000  >  54260 [FIN, ACK] Seq=1 Ack=29 Win=65152 Len=0 TSval=2779281952 TSecr=2896244709"
"8","0.015363","192.168.11.4","192.168.11.25","TCP","66","0.000045000","0.000045000","Jan  8, 2024 13:40:12.924002000 JST","","54260  >  6000 [ACK] Seq=29 Ack=2 Win=64256 Len=0 TSval=2896244717 TSecr=2779281952"
"9","0.045613","192.168.11.4","255.255.255.255","UDP","209","","0.030250000","Jan  8, 2024 13:40:12.954252000 JST","7b2273656d616e74696373223a207b22656e74697479223a2022504944222c202262617365656e74697479223a2022616e79222c2022726f6c65223a20226e6e6e222c20227370617469616c223a2022616e79222c202274656d706f72616c223a2022616e79227d2c20226461746170726f7065727479223a207b22666f726d6174223a2022696e616f6b615f70726f6772616d5f73616d706c655f73656d616e746963227d7d","39293  >  7000 Len=167"
"10","0.054067","192.168.11.5","192.168.11.4","TCP","74","","0.008454000","Jan  8, 2024 13:40:12.962706000 JST","","34126  >  6000 [SYN] Seq=0 Win=64240 Len=0 MSS=1460 SACK_PERM TSval=2041439479 TSecr=0 WS=128"
"11","0.054210","192.168.11.4","192.168.11.5","TCP","74","0.000143000","0.000143000","Jan  8, 2024 13:40:12.962849000 JST","","6000  >  34126 [SYN, ACK] Seq=0 Ack=1 Win=65160 Len=0 MSS=1460 SACK_PERM TSval=4085164838 TSecr=2041439479 WS=128"
"12","0.060852","192.168.11.5","192.168.11.4","TCP","66","0.006642000","0.006642000","Jan  8, 2024 13:40:12.969491000 JST","","34126  >  6000 [ACK] Seq=1 Ack=1 Win=64256 Len=0 TSval=2041439489 TSecr=4085164838"
"13","0.061277","192.168.11.5","192.168.11.4","TCP","93","","0.000425000","Jan  8, 2024 13:40:12.969916000 JST","","34126  >  6000 [PSH, ACK] Seq=1 Ack=1 Win=64256 Len=27 TSval=2041439489 TSecr=4085164838 [TCP segment of a reassembled PDU]"
"14","0.061369","192.168.11.4","192.168.11.5","TCP","66","0.000092000","0.000092000","Jan  8, 2024 13:40:12.970008000 JST","","6000  >  34126 [ACK] Seq=1 Ack=28 Win=65152 Len=0 TSval=4085164845 TSecr=2041439489"
"15","0.061699","192.168.11.5","192.168.11.4","TCP","66","","0.000330000","Jan  8, 2024 13:40:12.970338000 JST","","34126  >  6000 [FIN, ACK] Seq=28 Ack=1 Win=64256 Len=0 TSval=2041439489 TSecr=4085164838"
"16","0.063118","192.168.11.4","192.168.11.5","TCP","66","0.001419000","0.001419000","Jan  8, 2024 13:40:12.971757000 JST","","6000  >  34126 [FIN, ACK] Seq=1 Ack=29 Win=65152 Len=0 TSval=4085164847 TSecr=2041439489"
"17","0.069137","192.168.11.5","192.168.11.4","TCP","66","0.006019000","0.006019000","Jan  8, 2024 13:40:12.977776000 JST","","34126  >  6000 [ACK] Seq=29 Ack=2 Win=64256 Len=0 TSval=2041439497 TSecr=4085164847"
"18","6.929733","192.168.11.4","192.168.11.25","TCP","74","","6.860596000","Jan  8, 2024 13:40:19.838372000 JST","","53374  >  6000 [SYN] Seq=0 Win=64240 Len=0 MSS=1460 SACK_PERM TSval=2896251631 TSecr=0 WS=128"
"19","6.937780","192.168.11.25","192.168.11.4","TCP","74","0.008047000","0.008047000","Jan  8, 2024 13:40:19.846419000 JST","","6000  >  53374 [SYN, ACK] Seq=0 Ack=1 Win=65160 Len=0 MSS=1460 SACK_PERM TSval=2779288873 TSecr=2896251631 WS=128"
"20","6.937873","192.168.11.4","192.168.11.25","TCP","66","0.000093000","0.000093000","Jan  8, 2024 13:40:19.846512000 JST","","53374  >  6000 [ACK] Seq=1 Ack=1 Win=64256 Len=0 TSval=2896251639 TSecr=2779288873"
"21","6.938000","192.168.11.4","192.168.11.25","TCP","93","","0.000127000","Jan  8, 2024 13:40:19.846639000 JST","","53374  >  6000 [PSH, ACK] Seq=1 Ack=1 Win=64256 Len=27 TSval=2896251640 TSecr=2779288873 [TCP segment of a reassembled PDU]"
"22","6.938117","192.168.11.4","192.168.11.25","TCP","66","","0.000117000","Jan  8, 2024 13:40:19.846756000 JST","","53374  >  6000 [FIN, ACK] Seq=28 Ack=1 Win=64256 Len=0 TSval=2896251640 TSecr=2779288873"
"23","6.945132","192.168.11.25","192.168.11.4","TCP","66","0.007132000","0.007015000","Jan  8, 2024 13:40:19.853771000 JST","","6000  >  53374 [ACK] Seq=1 Ack=28 Win=65152 Len=0 TSval=2779288880 TSecr=2896251640"
"24","6.945492","192.168.11.25","192.168.11.4","TCP","66","0.007375000","0.000360000","Jan  8, 2024 13:40:19.854131000 JST","","6000  >  53374 [FIN, ACK] Seq=1 Ack=29 Win=65152 Len=0 TSval=2779288882 TSecr=2896251640"
"25","6.945535","192.168.11.4","192.168.11.25","TCP","66","0.000043000","0.000043000","Jan  8, 2024 13:40:19.854174000 JST","","53374  >  6000 [ACK] Seq=29 Ack=2 Win=64256 Len=0 TSval=2896251647 TSecr=2779288882"
"26","6.971929","192.168.11.4","255.255.255.255","UDP","209","","0.026394000","Jan  8, 2024 13:40:19.880568000 JST","7b2273656d616e74696373223a207b22656e74697479223a2022504944222c202262617365656e74697479223a2022616e79222c2022726f6c65223a20226e6e6e222c20227370617469616c223a2022616e79222c202274656d706f72616c223a2022616e79227d2c20226461746170726f7065727479223a207b22666f726d6174223a2022696e616f6b615f70726f6772616d5f73616d706c655f73656d616e746963227d7d","56607  >  7000 Len=167"
"27","6.977425","192.168.11.5","192.168.11.4","TCP","74","","0.005496000","Jan  8, 2024 13:40:19.886064000 JST","","34128  >  6000 [SYN] Seq=0 Win=64240 Len=0 MSS=1460 SACK_PERM TSval=2041446405 TSecr=0 WS=128"
"28","6.977521","192.168.11.4","192.168.11.5","TCP","74","0.000096000","0.000096000","Jan  8, 2024 13:40:19.886160000 JST","","6000  >  34128 [SYN, ACK] Seq=0 Ack=1 Win=65160 Len=0 MSS=1460 SACK_PERM TSval=4085171761 TSecr=2041446405 WS=128"
"29","6.984123","192.168.11.5","192.168.11.4","TCP","66","0.006602000","0.006602000","Jan  8, 2024 13:40:19.892762000 JST","","34128  >  6000 [ACK] Seq=1 Ack=1 Win=64256 Len=0 TSval=2041446412 TSecr=4085171761"
"30","6.985117","192.168.11.5","192.168.11.4","TCP","93","","0.000994000","Jan  8, 2024 13:40:19.893756000 JST","","34128  >  6000 [PSH, ACK] Seq=1 Ack=1 Win=64256 Len=27 TSval=2041446412 TSecr=4085171761 [TCP segment of a reassembled PDU]"
"31","6.985229","192.168.11.4","192.168.11.5","TCP","66","0.000112000","0.000112000","Jan  8, 2024 13:40:19.893868000 JST","","6000  >  34128 [ACK] Seq=1 Ack=28 Win=65152 Len=0 TSval=4085171769 TSecr=2041446412"
"32","6.985325","192.168.11.5","192.168.11.4","TCP","66","","0.000096000","Jan  8, 2024 13:40:19.893964000 JST","","34128  >  6000 [FIN, ACK] Seq=28 Ack=1 Win=64256 Len=0 TSval=2041446412 TSecr=4085171761"
"33","6.986475","192.168.11.4","192.168.11.5","TCP","66","0.001150000","0.001150000","Jan  8, 2024 13:40:19.895114000 JST","","6000  >  34128 [FIN, ACK] Seq=1 Ack=29 Win=65152 Len=0 TSval=4085171770 TSecr=2041446412"
"34","6.992664","192.168.11.5","192.168.11.4","TCP","66","0.006189000","0.006189000","Jan  8, 2024 13:40:19.901303000 JST","","34128  >  6000 [ACK] Seq=29 Ack=2 Win=64256 Len=0 TSval=2041446420 TSecr=4085171770"
"35","13.695438","192.168.11.4","192.168.11.25","TCP","74","","6.702774000","Jan  8, 2024 13:40:26.604077000 JST","","47846  >  6000 [SYN] Seq=0 Win=64240 Len=0 MSS=1460 SACK_PERM TSval=2896258397 TSecr=0 WS=128"
"36","13.702030","192.168.11.25","192.168.11.4","TCP","74","0.006592000","0.006592000","Jan  8, 2024 13:40:26.610669000 JST","","6000  >  47846 [SYN, ACK] Seq=0 Ack=1 Win=65160 Len=0 MSS=1460 SACK_PERM TSval=2779295638 TSecr=2896258397 WS=128"
"37","13.702125","192.168.11.4","192.168.11.25","TCP","66","0.000095000","0.000095000","Jan  8, 2024 13:40:26.610764000 JST","","47846  >  6000 [ACK] Seq=1 Ack=1 Win=64256 Len=0 TSval=2896258404 TSecr=2779295638"
"38","13.702287","192.168.11.4","192.168.11.25","TCP","93","","0.000162000","Jan  8, 2024 13:40:26.610926000 JST","","47846  >  6000 [PSH, ACK] Seq=1 Ack=1 Win=64256 Len=27 TSval=2896258404 TSecr=2779295638 [TCP segment of a reassembled PDU]"
"39","13.702399","192.168.11.4","192.168.11.25","TCP","66","","0.000112000","Jan  8, 2024 13:40:26.611038000 JST","","47846  >  6000 [FIN, ACK] Seq=28 Ack=1 Win=64256 Len=0 TSval=2896258404 TSecr=2779295638"
"40","13.709312","192.168.11.25","192.168.11.4","TCP","66","0.007025000","0.006913000","Jan  8, 2024 13:40:26.617951000 JST","","6000  >  47846 [ACK] Seq=1 Ack=28 Win=65152 Len=0 TSval=2779295645 TSecr=2896258404"
"41","13.709519","192.168.11.25","192.168.11.4","TCP","66","0.007120000","0.000207000","Jan  8, 2024 13:40:26.618158000 JST","","6000  >  47846 [FIN, ACK] Seq=1 Ack=29 Win=65152 Len=0 TSval=2779295646 TSecr=2896258404"
"42","13.709562","192.168.11.4","192.168.11.25","TCP","66","0.000043000","0.000043000","Jan  8, 2024 13:40:26.618201000 JST","","47846  >  6000 [ACK] Seq=29 Ack=2 Win=64256 Len=0 TSval=2896258411 TSecr=2779295646"
"43","13.738046","192.168.11.4","255.255.255.255","UDP","209","","0.028484000","Jan  8, 2024 13:40:26.646685000 JST","7b2273656d616e74696373223a207b22656e74697479223a2022504944222c202262617365656e74697479223a2022616e79222c2022726f6c65223a20226e6e6e222c20227370617469616c223a2022616e79222c202274656d706f72616c223a2022616e79227d2c20226461746170726f7065727479223a207b22666f726d6174223a2022696e616f6b615f70726f6772616d5f73616d706c655f73656d616e746963227d7d","49662  >  7000 Len=167"
"44","13.743595","192.168.11.5","192.168.11.4","TCP","74","","0.005549000","Jan  8, 2024 13:40:26.652234000 JST","","45822  >  6000 [SYN] Seq=0 Win=64240 Len=0 MSS=1460 SACK_PERM TSval=2041453172 TSecr=0 WS=128"
"45","13.743698","192.168.11.4","192.168.11.5","TCP","74","0.000103000","0.000103000","Jan  8, 2024 13:40:26.652337000 JST","","6000  >  45822 [SYN, ACK] Seq=0 Ack=1 Win=65160 Len=0 MSS=1460 SACK_PERM TSval=4085178527 TSecr=2041453172 WS=128"
"46","13.750192","192.168.11.5","192.168.11.4","TCP","66","0.006494000","0.006494000","Jan  8, 2024 13:40:26.658831000 JST","","45822  >  6000 [ACK] Seq=1 Ack=1 Win=64256 Len=0 TSval=2041453178 TSecr=4085178527"
"47","13.750685","192.168.11.5","192.168.11.4","TCP","93","","0.000493000","Jan  8, 2024 13:40:26.659324000 JST","","45822  >  6000 [PSH, ACK] Seq=1 Ack=1 Win=64256 Len=27 TSval=2041453178 TSecr=4085178527 [TCP segment of a reassembled PDU]"
"48","13.750776","192.168.11.4","192.168.11.5","TCP","66","0.000091000","0.000091000","Jan  8, 2024 13:40:26.659415000 JST","","6000  >  45822 [ACK] Seq=1 Ack=28 Win=65152 Len=0 TSval=4085178534 TSecr=2041453178"
"49","13.750846","192.168.11.5","192.168.11.4","TCP","66","","0.000070000","Jan  8, 2024 13:40:26.659485000 JST","","45822  >  6000 [FIN, ACK] Seq=28 Ack=1 Win=64256 Len=0 TSval=2041453179 TSecr=4085178527"
"50","13.751936","192.168.11.4","192.168.11.5","TCP","66","0.001090000","0.001090000","Jan  8, 2024 13:40:26.660575000 JST","","6000  >  45822 [FIN, ACK] Seq=1 Ack=29 Win=65152 Len=0 TSval=4085178535 TSecr=2041453179"
"51","13.758154","192.168.11.5","192.168.11.4","TCP","66","0.006218000","0.006218000","Jan  8, 2024 13:40:26.666793000 JST","","45822  >  6000 [ACK] Seq=29 Ack=2 Win=64256 Len=0 TSval=2041453186 TSecr=4085178535"
"52","21.379312","192.168.11.4","192.168.11.25","TCP","74","","7.621158000","Jan  8, 2024 13:40:34.287951000 JST","","35616  >  6000 [SYN] Seq=0 Win=64240 Len=0 MSS=1460 SACK_PERM TSval=2896266081 TSecr=0 WS=128"
"53","21.385792","192.168.11.25","192.168.11.4","TCP","74","0.006480000","0.006480000","Jan  8, 2024 13:40:34.294431000 JST","","6000  >  35616 [SYN, ACK] Seq=0 Ack=1 Win=65160 Len=0 MSS=1460 SACK_PERM TSval=2779303321 TSecr=2896266081 WS=128"
"54","21.385897","192.168.11.4","192.168.11.25","TCP","66","0.000105000","0.000105000","Jan  8, 2024 13:40:34.294536000 JST","","35616  >  6000 [ACK] Seq=1 Ack=1 Win=64256 Len=0 TSval=2896266087 TSecr=2779303321"
"55","21.386084","192.168.11.4","192.168.11.25","TCP","93","","0.000187000","Jan  8, 2024 13:40:34.294723000 JST","","35616  >  6000 [PSH, ACK] Seq=1 Ack=1 Win=64256 Len=27 TSval=2896266088 TSecr=2779303321 [TCP segment of a reassembled PDU]"
"56","21.386181","192.168.11.4","192.168.11.25","TCP","66","","0.000097000","Jan  8, 2024 13:40:34.294820000 JST","","35616  >  6000 [FIN, ACK] Seq=28 Ack=1 Win=64256 Len=0 TSval=2896266088 TSecr=2779303321"
"57","21.393029","192.168.11.25","192.168.11.4","TCP","66","0.006945000","0.006848000","Jan  8, 2024 13:40:34.301668000 JST","","6000  >  35616 [ACK] Seq=1 Ack=28 Win=65152 Len=0 TSval=2779303328 TSecr=2896266088"
"58","21.393407","192.168.11.25","192.168.11.4","TCP","66","0.007226000","0.000378000","Jan  8, 2024 13:40:34.302046000 JST","","6000  >  35616 [FIN, ACK] Seq=1 Ack=29 Win=65152 Len=0 TSval=2779303330 TSecr=2896266088"
"59","21.393449","192.168.11.4","192.168.11.25","TCP","66","0.000042000","0.000042000","Jan  8, 2024 13:40:34.302088000 JST","","35616  >  6000 [ACK] Seq=29 Ack=2 Win=64256 Len=0 TSval=2896266095 TSecr=2779303330"
"60","21.422837","192.168.11.4","255.255.255.255","UDP","209","","0.029388000","Jan  8, 2024 13:40:34.331476000 JST","7b2273656d616e74696373223a207b22656e74697479223a2022504944222c202262617365656e74697479223a2022616e79222c2022726f6c65223a20226e6e6e222c20227370617469616c223a2022616e79222c202274656d706f72616c223a2022616e79227d2c20226461746170726f7065727479223a207b22666f726d6174223a2022696e616f6b615f70726f6772616d5f73616d706c655f73656d616e746963227d7d","45616  >  7000 Len=167"
"61","21.429715","192.168.11.5","192.168.11.4","TCP","74","","0.006878000","Jan  8, 2024 13:40:34.338354000 JST","","35402  >  6000 [SYN] Seq=0 Win=64240 Len=0 MSS=1460 SACK_PERM TSval=2041460856 TSecr=0 WS=128"
"62","21.429840","192.168.11.4","192.168.11.5","TCP","74","0.000125000","0.000125000","Jan  8, 2024 13:40:34.338479000 JST","","6000  >  35402 [SYN, ACK] Seq=0 Ack=1 Win=65160 Len=0 MSS=1460 SACK_PERM TSval=4085186213 TSecr=2041460856 WS=128"
"63","21.436664","192.168.11.5","192.168.11.4","TCP","66","0.006824000","0.006824000","Jan  8, 2024 13:40:34.345303000 JST","","35402  >  6000 [ACK] Seq=1 Ack=1 Win=64256 Len=0 TSval=2041460864 TSecr=4085186213"
"64","21.437296","192.168.11.5","192.168.11.4","TCP","93","","0.000632000","Jan  8, 2024 13:40:34.345935000 JST","","35402  >  6000 [PSH, ACK] Seq=1 Ack=1 Win=64256 Len=27 TSval=2041460865 TSecr=4085186213 [TCP segment of a reassembled PDU]"
"65","21.437395","192.168.11.4","192.168.11.5","TCP","66","0.000099000","0.000099000","Jan  8, 2024 13:40:34.346034000 JST","","6000  >  35402 [ACK] Seq=1 Ack=28 Win=65152 Len=0 TSval=4085186221 TSecr=2041460865"
"66","21.437476","192.168.11.5","192.168.11.4","TCP","66","","0.000081000","Jan  8, 2024 13:40:34.346115000 JST","","35402  >  6000 [FIN, ACK] Seq=28 Ack=1 Win=64256 Len=0 TSval=2041460865 TSecr=4085186213"
"67","21.438625","192.168.11.4","192.168.11.5","TCP","66","0.001149000","0.001149000","Jan  8, 2024 13:40:34.347264000 JST","","6000  >  35402 [FIN, ACK] Seq=1 Ack=29 Win=65152 Len=0 TSval=4085186222 TSecr=2041460865"
"68","21.444814","192.168.11.5","192.168.11.4","TCP","66","0.006189000","0.006189000","Jan  8, 2024 13:40:34.353453000 JST","","35402  >  6000 [ACK] Seq=29 Ack=2 Win=64256 Len=0 TSval=2041460872 TSecr=4085186222"
"69","29.131118","192.168.11.4","192.168.11.25","TCP","74","","7.686304000","Jan  8, 2024 13:40:42.039757000 JST","","35618  >  6000 [SYN] Seq=0 Win=64240 Len=0 MSS=1460 SACK_PERM TSval=2896273833 TSecr=0 WS=128"
"70","29.138724","192.168.11.25","192.168.11.4","TCP","74","0.007606000","0.007606000","Jan  8, 2024 13:40:42.047363000 JST","","6000  >  35618 [SYN, ACK] Seq=0 Ack=1 Win=65160 Len=0 MSS=1460 SACK_PERM TSval=2779311074 TSecr=2896273833 WS=128"
"71","29.138821","192.168.11.4","192.168.11.25","TCP","66","0.000097000","0.000097000","Jan  8, 2024 13:40:42.047460000 JST","","35618  >  6000 [ACK] Seq=1 Ack=1 Win=64256 Len=0 TSval=2896273840 TSecr=2779311074"
"72","29.138987","192.168.11.4","192.168.11.25","TCP","93","","0.000166000","Jan  8, 2024 13:40:42.047626000 JST","","35618  >  6000 [PSH, ACK] Seq=1 Ack=1 Win=64256 Len=27 TSval=2896273841 TSecr=2779311074 [TCP segment of a reassembled PDU]"
"73","29.139075","192.168.11.4","192.168.11.25","TCP","66","","0.000088000","Jan  8, 2024 13:40:42.047714000 JST","","35618  >  6000 [FIN, ACK] Seq=28 Ack=1 Win=64256 Len=0 TSval=2896273841 TSecr=2779311074"
"74","29.145998","192.168.11.25","192.168.11.4","TCP","66","0.007011000","0.006923000","Jan  8, 2024 13:40:42.054637000 JST","","6000  >  35618 [ACK] Seq=1 Ack=28 Win=65152 Len=0 TSval=2779311081 TSecr=2896273841"
"75","29.146364","192.168.11.25","192.168.11.4","TCP","66","0.007289000","0.000366000","Jan  8, 2024 13:40:42.055003000 JST","","6000  >  35618 [FIN, ACK] Seq=1 Ack=29 Win=65152 Len=0 TSval=2779311082 TSecr=2896273841"
"76","29.146407","192.168.11.4","192.168.11.25","TCP","66","0.000043000","0.000043000","Jan  8, 2024 13:40:42.055046000 JST","","35618  >  6000 [ACK] Seq=29 Ack=2 Win=64256 Len=0 TSval=2896273848 TSecr=2779311082"
"77","29.174799","192.168.11.4","255.255.255.255","UDP","209","","0.028392000","Jan  8, 2024 13:40:42.083438000 JST","7b2273656d616e74696373223a207b22656e74697479223a2022504944222c202262617365656e74697479223a2022616e79222c2022726f6c65223a20226e6e6e222c20227370617469616c223a2022616e79222c202274656d706f72616c223a2022616e79227d2c20226461746170726f7065727479223a207b22666f726d6174223a2022696e616f6b615f70726f6772616d5f73616d706c655f73656d616e746963227d7d","50702  >  7000 Len=167"
"78","29.183143","192.168.11.5","192.168.11.4","TCP","74","","0.008344000","Jan  8, 2024 13:40:42.091782000 JST","","42072  >  6000 [SYN] Seq=0 Win=64240 Len=0 MSS=1460 SACK_PERM TSval=2041468608 TSecr=0 WS=128"
"79","29.183263","192.168.11.4","192.168.11.5","TCP","74","0.000120000","0.000120000","Jan  8, 2024 13:40:42.091902000 JST","","6000  >  42072 [SYN, ACK] Seq=0 Ack=1 Win=65160 Len=0 MSS=1460 SACK_PERM TSval=4085193967 TSecr=2041468608 WS=128"
"80","29.196621","192.168.11.5","192.168.11.4","TCP","66","0.013358000","0.013358000","Jan  8, 2024 13:40:42.105260000 JST","","42072  >  6000 [ACK] Seq=1 Ack=1 Win=64256 Len=0 TSval=2041468618 TSecr=4085193967"
"81","29.197212","192.168.11.5","192.168.11.4","TCP","93","","0.000591000","Jan  8, 2024 13:40:42.105851000 JST","","42072  >  6000 [PSH, ACK] Seq=1 Ack=1 Win=64256 Len=27 TSval=2041468618 TSecr=4085193967 [TCP segment of a reassembled PDU]"
"82","29.197287","192.168.11.4","192.168.11.5","TCP","66","0.000075000","0.000075000","Jan  8, 2024 13:40:42.105926000 JST","","6000  >  42072 [ACK] Seq=1 Ack=28 Win=65152 Len=0 TSval=4085193981 TSecr=2041468618"
"83","29.197352","192.168.11.5","192.168.11.4","TCP","66","","0.000065000","Jan  8, 2024 13:40:42.105991000 JST","","42072  >  6000 [FIN, ACK] Seq=28 Ack=1 Win=64256 Len=0 TSval=2041468618 TSecr=4085193967"
"84","29.198224","192.168.11.4","192.168.11.5","TCP","66","0.000872000","0.000872000","Jan  8, 2024 13:40:42.106863000 JST","","6000  >  42072 [FIN, ACK] Seq=1 Ack=29 Win=65152 Len=0 TSval=4085193982 TSecr=2041468618"
"85","29.204455","192.168.11.5","192.168.11.4","TCP","66","0.006231000","0.006231000","Jan  8, 2024 13:40:42.113094000 JST","","42072  >  6000 [ACK] Seq=29 Ack=2 Win=64256 Len=0 TSval=2041468632 TSecr=4085193982"
"86","35.862388","192.168.11.4","192.168.11.25","TCP","74","","6.657933000","Jan  8, 2024 13:40:48.771027000 JST","","54034  >  6000 [SYN] Seq=0 Win=64240 Len=0 MSS=1460 SACK_PERM TSval=2896280564 TSecr=0 WS=128"
"87","35.868934","192.168.11.25","192.168.11.4","TCP","74","0.006546000","0.006546000","Jan  8, 2024 13:40:48.777573000 JST","","6000  >  54034 [SYN, ACK] Seq=0 Ack=1 Win=65160 Len=0 MSS=1460 SACK_PERM TSval=2779317804 TSecr=2896280564 WS=128"
"88","35.869037","192.168.11.4","192.168.11.25","TCP","66","0.000103000","0.000103000","Jan  8, 2024 13:40:48.777676000 JST","","54034  >  6000 [ACK] Seq=1 Ack=1 Win=64256 Len=0 TSval=2896280571 TSecr=2779317804"
"89","35.869199","192.168.11.4","192.168.11.25","TCP","93","","0.000162000","Jan  8, 2024 13:40:48.777838000 JST","","54034  >  6000 [PSH, ACK] Seq=1 Ack=1 Win=64256 Len=27 TSval=2896280571 TSecr=2779317804 [TCP segment of a reassembled PDU]"
"90","35.869319","192.168.11.4","192.168.11.25","TCP","66","","0.000120000","Jan  8, 2024 13:40:48.777958000 JST","","54034  >  6000 [FIN, ACK] Seq=28 Ack=1 Win=64256 Len=0 TSval=2896280571 TSecr=2779317804"
"91","35.876234","192.168.11.25","192.168.11.4","TCP","66","0.007035000","0.006915000","Jan  8, 2024 13:40:48.784873000 JST","","6000  >  54034 [ACK] Seq=1 Ack=28 Win=65152 Len=0 TSval=2779317812 TSecr=2896280571"
"92","35.876454","192.168.11.25","192.168.11.4","TCP","66","0.007135000","0.000220000","Jan  8, 2024 13:40:48.785093000 JST","","6000  >  54034 [FIN, ACK] Seq=1 Ack=29 Win=65152 Len=0 TSval=2779317813 TSecr=2896280571"
"93","35.876505","192.168.11.4","192.168.11.25","TCP","66","0.000051000","0.000051000","Jan  8, 2024 13:40:48.785144000 JST","","54034  >  6000 [ACK] Seq=29 Ack=2 Win=64256 Len=0 TSval=2896280578 TSecr=2779317813"
"94","35.905326","192.168.11.4","255.255.255.255","UDP","209","","0.028821000","Jan  8, 2024 13:40:48.813965000 JST","7b2273656d616e74696373223a207b22656e74697479223a2022504944222c202262617365656e74697479223a2022616e79222c2022726f6c65223a20226e6e6e222c20227370617469616c223a2022616e79222c202274656d706f72616c223a2022616e79227d2c20226461746170726f7065727479223a207b22666f726d6174223a2022696e616f6b615f70726f6772616d5f73616d706c655f73656d616e746963227d7d","36834  >  7000 Len=167"
"95","35.911035","192.168.11.5","192.168.11.4","TCP","74","","0.005709000","Jan  8, 2024 13:40:48.819674000 JST","","42086  >  6000 [SYN] Seq=0 Win=64240 Len=0 MSS=1460 SACK_PERM TSval=2041475339 TSecr=0 WS=128"
"96","35.911134","192.168.11.4","192.168.11.5","TCP","74","0.000099000","0.000099000","Jan  8, 2024 13:40:48.819773000 JST","","6000  >  42086 [SYN, ACK] Seq=0 Ack=1 Win=65160 Len=0 MSS=1460 SACK_PERM TSval=4085200695 TSecr=2041475339 WS=128"
"97","35.917742","192.168.11.5","192.168.11.4","TCP","66","0.006608000","0.006608000","Jan  8, 2024 13:40:48.826381000 JST","","42086  >  6000 [ACK] Seq=1 Ack=1 Win=64256 Len=0 TSval=2041475346 TSecr=4085200695"
"98","35.918235","192.168.11.5","192.168.11.4","TCP","93","","0.000493000","Jan  8, 2024 13:40:48.826874000 JST","","42086  >  6000 [PSH, ACK] Seq=1 Ack=1 Win=64256 Len=27 TSval=2041475346 TSecr=4085200695 [TCP segment of a reassembled PDU]"
"99","35.918300","192.168.11.4","192.168.11.5","TCP","66","0.000065000","0.000065000","Jan  8, 2024 13:40:48.826939000 JST","","6000  >  42086 [ACK] Seq=1 Ack=28 Win=65152 Len=0 TSval=4085200702 TSecr=2041475346"
"100","35.918376","192.168.11.5","192.168.11.4","TCP","66","","0.000076000","Jan  8, 2024 13:40:48.827015000 JST","","42086  >  6000 [FIN, ACK] Seq=28 Ack=1 Win=64256 Len=0 TSval=2041475346 TSecr=4085200695"
"101","35.919450","192.168.11.4","192.168.11.5","TCP","66","0.001074000","0.001074000","Jan  8, 2024 13:40:48.828089000 JST","","6000  >  42086 [FIN, ACK] Seq=1 Ack=29 Win=65152 Len=0 TSval=4085200703 TSecr=2041475346"
"102","35.925670","192.168.11.5","192.168.11.4","TCP","66","0.006220000","0.006220000","Jan  8, 2024 13:40:48.834309000 JST","","42086  >  6000 [ACK] Seq=29 Ack=2 Win=64256 Len=0 TSval=2041475353 TSecr=4085200703"
"103","42.628885","192.168.11.4","192.168.11.25","TCP","74","","6.703215000","Jan  8, 2024 13:40:55.537524000 JST","","41164  >  6000 [SYN] Seq=0 Win=64240 Len=0 MSS=1460 SACK_PERM TSval=2896287330 TSecr=0 WS=128"
"104","42.636519","192.168.11.25","192.168.11.4","TCP","74","0.007634000","0.007634000","Jan  8, 2024 13:40:55.545158000 JST","","6000  >  41164 [SYN, ACK] Seq=0 Ack=1 Win=65160 Len=0 MSS=1460 SACK_PERM TSval=2779324572 TSecr=2896287330 WS=128"
"105","42.636624","192.168.11.4","192.168.11.25","TCP","66","0.000105000","0.000105000","Jan  8, 2024 13:40:55.545263000 JST","","41164  >  6000 [ACK] Seq=1 Ack=1 Win=64256 Len=0 TSval=2896287338 TSecr=2779324572"
"106","42.636786","192.168.11.4","192.168.11.25","TCP","93","","0.000162000","Jan  8, 2024 13:40:55.545425000 JST","","41164  >  6000 [PSH, ACK] Seq=1 Ack=1 Win=64256 Len=27 TSval=2896287338 TSecr=2779324572 [TCP segment of a reassembled PDU]"
"107","42.636884","192.168.11.4","192.168.11.25","TCP","66","","0.000098000","Jan  8, 2024 13:40:55.545523000 JST","","41164  >  6000 [FIN, ACK] Seq=28 Ack=1 Win=64256 Len=0 TSval=2896287338 TSecr=2779324572"
"108","42.646135","192.168.11.25","192.168.11.4","TCP","66","0.009349000","0.009251000","Jan  8, 2024 13:40:55.554774000 JST","","6000  >  41164 [ACK] Seq=1 Ack=28 Win=65152 Len=0 TSval=2779324581 TSecr=2896287338"
"109","42.646486","192.168.11.25","192.168.11.4","TCP","66","0.009602000","0.000351000","Jan  8, 2024 13:40:55.555125000 JST","","6000  >  41164 [FIN, ACK] Seq=1 Ack=29 Win=65152 Len=0 TSval=2779324583 TSecr=2896287338"
"110","42.646531","192.168.11.4","192.168.11.25","TCP","66","0.000045000","0.000045000","Jan  8, 2024 13:40:55.555170000 JST","","41164  >  6000 [ACK] Seq=29 Ack=2 Win=64256 Len=0 TSval=2896287348 TSecr=2779324583"
"111","42.673219","192.168.11.4","255.255.255.255","UDP","209","","0.026688000","Jan  8, 2024 13:40:55.581858000 JST","7b2273656d616e74696373223a207b22656e74697479223a2022504944222c202262617365656e74697479223a2022616e79222c2022726f6c65223a20226e6e6e222c20227370617469616c223a2022616e79222c202274656d706f72616c223a2022616e79227d2c20226461746170726f7065727479223a207b22666f726d6174223a2022696e616f6b615f70726f6772616d5f73616d706c655f73656d616e746963227d7d","33100  >  7000 Len=167"
"112","42.678812","192.168.11.5","192.168.11.4","TCP","74","","0.005593000","Jan  8, 2024 13:40:55.587451000 JST","","49570  >  6000 [SYN] Seq=0 Win=64240 Len=0 MSS=1460 SACK_PERM TSval=2041482107 TSecr=0 WS=128"
"113","42.678911","192.168.11.4","192.168.11.5","TCP","74","0.000099000","0.000099000","Jan  8, 2024 13:40:55.587550000 JST","","6000  >  49570 [SYN, ACK] Seq=0 Ack=1 Win=65160 Len=0 MSS=1460 SACK_PERM TSval=4085207463 TSecr=2041482107 WS=128"
"114","42.685585","192.168.11.5","192.168.11.4","TCP","66","0.006674000","0.006674000","Jan  8, 2024 13:40:55.594224000 JST","","49570  >  6000 [ACK] Seq=1 Ack=1 Win=64256 Len=0 TSval=2041482113 TSecr=4085207463"
"115","42.686097","192.168.11.5","192.168.11.4","TCP","93","","0.000512000","Jan  8, 2024 13:40:55.594736000 JST","","49570  >  6000 [PSH, ACK] Seq=1 Ack=1 Win=64256 Len=27 TSval=2041482114 TSecr=4085207463 [TCP segment of a reassembled PDU]"
"116","42.686146","192.168.11.5","192.168.11.4","TCP","66","","0.000049000","Jan  8, 2024 13:40:55.594785000 JST","","49570  >  6000 [FIN, ACK] Seq=28 Ack=1 Win=64256 Len=0 TSval=2041482114 TSecr=4085207463"
"117","42.686180","192.168.11.4","192.168.11.5","TCP","66","0.000083000","0.000034000","Jan  8, 2024 13:40:55.594819000 JST","","6000  >  49570 [ACK] Seq=1 Ack=28 Win=65152 Len=0 TSval=4085207470 TSecr=2041482114"
"118","42.687333","192.168.11.4","192.168.11.5","TCP","66","0.001187000","0.001153000","Jan  8, 2024 13:40:55.595972000 JST","","6000  >  49570 [FIN, ACK] Seq=1 Ack=29 Win=65152 Len=0 TSval=4085207471 TSecr=2041482114"
"119","42.693192","192.168.11.5","192.168.11.4","TCP","66","0.005859000","0.005859000","Jan  8, 2024 13:40:55.601831000 JST","","49570  >  6000 [ACK] Seq=29 Ack=2 Win=64256 Len=0 TSval=2041482121 TSecr=4085207471"
"120","49.378346","192.168.11.4","192.168.11.25","TCP","74","","6.685154000","Jan  8, 2024 13:41:02.286985000 JST","","41180  >  6000 [SYN] Seq=0 Win=64240 Len=0 MSS=1460 SACK_PERM TSval=2896294080 TSecr=0 WS=128"
"121","49.384941","192.168.11.25","192.168.11.4","TCP","74","0.006595000","0.006595000","Jan  8, 2024 13:41:02.293580000 JST","","6000  >  41180 [SYN, ACK] Seq=0 Ack=1 Win=65160 Len=0 MSS=1460 SACK_PERM TSval=2779331320 TSecr=2896294080 WS=128"
"122","49.385039","192.168.11.4","192.168.11.25","TCP","66","0.000098000","0.000098000","Jan  8, 2024 13:41:02.293678000 JST","","41180  >  6000 [ACK] Seq=1 Ack=1 Win=64256 Len=0 TSval=2896294087 TSecr=2779331320"
"123","49.385196","192.168.11.4","192.168.11.25","TCP","93","","0.000157000","Jan  8, 2024 13:41:02.293835000 JST","","41180  >  6000 [PSH, ACK] Seq=1 Ack=1 Win=64256 Len=27 TSval=2896294087 TSecr=2779331320 [TCP segment of a reassembled PDU]"
"124","49.385312","192.168.11.4","192.168.11.25","TCP","66","","0.000116000","Jan  8, 2024 13:41:02.293951000 JST","","41180  >  6000 [FIN, ACK] Seq=28 Ack=1 Win=64256 Len=0 TSval=2896294087 TSecr=2779331320"
"125","49.392458","192.168.11.25","192.168.11.4","TCP","66","0.007262000","0.007146000","Jan  8, 2024 13:41:02.301097000 JST","","6000  >  41180 [ACK] Seq=1 Ack=28 Win=65152 Len=0 TSval=2779331328 TSecr=2896294087"
"126","49.392681","192.168.11.25","192.168.11.4","TCP","66","0.007369000","0.000223000","Jan  8, 2024 13:41:02.301320000 JST","","6000  >  41180 [FIN, ACK] Seq=1 Ack=29 Win=65152 Len=0 TSval=2779331330 TSecr=2896294087"
"127","49.392721","192.168.11.4","192.168.11.25","TCP","66","0.000040000","0.000040000","Jan  8, 2024 13:41:02.301360000 JST","","41180  >  6000 [ACK] Seq=29 Ack=2 Win=64256 Len=0 TSval=2896294094 TSecr=2779331330"
"128","49.422379","192.168.11.4","255.255.255.255","UDP","209","","0.029658000","Jan  8, 2024 13:41:02.331018000 JST","7b2273656d616e74696373223a207b22656e74697479223a2022504944222c202262617365656e74697479223a2022616e79222c2022726f6c65223a20226e6e6e222c20227370617469616c223a2022616e79222c202274656d706f72616c223a2022616e79227d2c20226461746170726f7065727479223a207b22666f726d6174223a2022696e616f6b615f70726f6772616d5f73616d706c655f73656d616e746963227d7d","54617  >  7000 Len=167"
"129","49.427849","192.168.11.5","192.168.11.4","TCP","74","","0.005470000","Jan  8, 2024 13:41:02.336488000 JST","","58986  >  6000 [SYN] Seq=0 Win=64240 Len=0 MSS=1460 SACK_PERM TSval=2041488856 TSecr=0 WS=128"
"130","49.427971","192.168.11.4","192.168.11.5","TCP","74","0.000122000","0.000122000","Jan  8, 2024 13:41:02.336610000 JST","","6000  >  58986 [SYN, ACK] Seq=0 Ack=1 Win=65160 Len=0 MSS=1460 SACK_PERM TSval=4085214212 TSecr=2041488856 WS=128"
"131","49.434595","192.168.11.5","192.168.11.4","TCP","66","0.006624000","0.006624000","Jan  8, 2024 13:41:02.343234000 JST","","58986  >  6000 [ACK] Seq=1 Ack=1 Win=64256 Len=0 TSval=2041488862 TSecr=4085214212"
"132","49.435137","192.168.11.5","192.168.11.4","TCP","93","","0.000542000","Jan  8, 2024 13:41:02.343776000 JST","","58986  >  6000 [PSH, ACK] Seq=1 Ack=1 Win=64256 Len=27 TSval=2041488863 TSecr=4085214212 [TCP segment of a reassembled PDU]"
"133","49.435224","192.168.11.4","192.168.11.5","TCP","66","0.000087000","0.000087000","Jan  8, 2024 13:41:02.343863000 JST","","6000  >  58986 [ACK] Seq=1 Ack=28 Win=65152 Len=0 TSval=4085214219 TSecr=2041488863"
"134","49.435300","192.168.11.5","192.168.11.4","TCP","66","","0.000076000","Jan  8, 2024 13:41:02.343939000 JST","","58986  >  6000 [FIN, ACK] Seq=28 Ack=1 Win=64256 Len=0 TSval=2041488863 TSecr=4085214212"
"135","49.436493","192.168.11.4","192.168.11.5","TCP","66","0.001193000","0.001193000","Jan  8, 2024 13:41:02.345132000 JST","","6000  >  58986 [FIN, ACK] Seq=1 Ack=29 Win=65152 Len=0 TSval=4085214220 TSecr=2041488863"
"136","49.443353","192.168.11.5","192.168.11.4","TCP","66","0.006860000","0.006860000","Jan  8, 2024 13:41:02.351992000 JST","","58986  >  6000 [ACK] Seq=29 Ack=2 Win=64256 Len=0 TSval=2041488871 TSecr=4085214220"
"137","56.087781","192.168.11.4","192.168.11.25","TCP","74","","6.644428000","Jan  8, 2024 13:41:08.996420000 JST","","34484  >  6000 [SYN] Seq=0 Win=64240 Len=0 MSS=1460 SACK_PERM TSval=2896300789 TSecr=0 WS=128"
"138","56.094379","192.168.11.25","192.168.11.4","TCP","74","0.006598000","0.006598000","Jan  8, 2024 13:41:09.003018000 JST","","6000  >  34484 [SYN, ACK] Seq=0 Ack=1 Win=65160 Len=0 MSS=1460 SACK_PERM TSval=2779338030 TSecr=2896300789 WS=128"
"139","56.094475","192.168.11.4","192.168.11.25","TCP","66","0.000096000","0.000096000","Jan  8, 2024 13:41:09.003114000 JST","","34484  >  6000 [ACK] Seq=1 Ack=1 Win=64256 Len=0 TSval=2896300796 TSecr=2779338030"
"140","56.094664","192.168.11.4","192.168.11.25","TCP","93","","0.000189000","Jan  8, 2024 13:41:09.003303000 JST","","34484  >  6000 [PSH, ACK] Seq=1 Ack=1 Win=64256 Len=27 TSval=2896300796 TSecr=2779338030 [TCP segment of a reassembled PDU]"
"141","56.094752","192.168.11.4","192.168.11.25","TCP","66","","0.000088000","Jan  8, 2024 13:41:09.003391000 JST","","34484  >  6000 [FIN, ACK] Seq=28 Ack=1 Win=64256 Len=0 TSval=2896300796 TSecr=2779338030"
"142","56.101852","192.168.11.25","192.168.11.4","TCP","66","0.007188000","0.007100000","Jan  8, 2024 13:41:09.010491000 JST","","6000  >  34484 [ACK] Seq=1 Ack=28 Win=65152 Len=0 TSval=2779338037 TSecr=2896300796"
"143","56.102209","192.168.11.25","192.168.11.4","TCP","66","0.007457000","0.000357000","Jan  8, 2024 13:41:09.010848000 JST","","6000  >  34484 [FIN, ACK] Seq=1 Ack=29 Win=65152 Len=0 TSval=2779338038 TSecr=2896300796"
"144","56.102250","192.168.11.4","192.168.11.25","TCP","66","0.000041000","0.000041000","Jan  8, 2024 13:41:09.010889000 JST","","34484  >  6000 [ACK] Seq=29 Ack=2 Win=64256 Len=0 TSval=2896300804 TSecr=2779338038"
"145","56.131448","192.168.11.4","255.255.255.255","UDP","209","","0.029198000","Jan  8, 2024 13:41:09.040087000 JST","7b2273656d616e74696373223a207b22656e74697479223a2022504944222c202262617365656e74697479223a2022616e79222c2022726f6c65223a20226e6e6e222c20227370617469616c223a2022616e79222c202274656d706f72616c223a2022616e79227d2c20226461746170726f7065727479223a207b22666f726d6174223a2022696e616f6b615f70726f6772616d5f73616d706c655f73656d616e746963227d7d","57486  >  7000 Len=167"
"146","56.136929","192.168.11.5","192.168.11.4","TCP","74","","0.005481000","Jan  8, 2024 13:41:09.045568000 JST","","59000  >  6000 [SYN] Seq=0 Win=64240 Len=0 MSS=1460 SACK_PERM TSval=2041495565 TSecr=0 WS=128"
"147","56.137031","192.168.11.4","192.168.11.5","TCP","74","0.000102000","0.000102000","Jan  8, 2024 13:41:09.045670000 JST","","6000  >  59000 [SYN, ACK] Seq=0 Ack=1 Win=65160 Len=0 MSS=1460 SACK_PERM TSval=4085220921 TSecr=2041495565 WS=128"
"148","56.144520","192.168.11.5","192.168.11.4","TCP","66","0.007489000","0.007489000","Jan  8, 2024 13:41:09.053159000 JST","","59000  >  6000 [ACK] Seq=1 Ack=1 Win=64256 Len=0 TSval=2041495573 TSecr=4085220921"
"149","56.145017","192.168.11.5","192.168.11.4","TCP","93","","0.000497000","Jan  8, 2024 13:41:09.053656000 JST","","59000  >  6000 [PSH, ACK] Seq=1 Ack=1 Win=64256 Len=27 TSval=2041495573 TSecr=4085220921 [TCP segment of a reassembled PDU]"
"150","56.145100","192.168.11.4","192.168.11.5","TCP","66","0.000083000","0.000083000","Jan  8, 2024 13:41:09.053739000 JST","","6000  >  59000 [ACK] Seq=1 Ack=28 Win=65152 Len=0 TSval=4085220929 TSecr=2041495573"
"151","56.145178","192.168.11.5","192.168.11.4","TCP","66","","0.000078000","Jan  8, 2024 13:41:09.053817000 JST","","59000  >  6000 [FIN, ACK] Seq=28 Ack=1 Win=64256 Len=0 TSval=2041495573 TSecr=4085220921"
"152","56.146225","192.168.11.4","192.168.11.5","TCP","66","0.001047000","0.001047000","Jan  8, 2024 13:41:09.054864000 JST","","6000  >  59000 [FIN, ACK] Seq=1 Ack=29 Win=65152 Len=0 TSval=4085220930 TSecr=2041495573"
"153","56.152323","192.168.11.5","192.168.11.4","TCP","66","0.006098000","0.006098000","Jan  8, 2024 13:41:09.060962000 JST","","59000  >  6000 [ACK] Seq=29 Ack=2 Win=64256 Len=0 TSval=2041495580 TSecr=4085220930"
"154","62.768546","192.168.11.4","192.168.11.25","TCP","74","","6.616223000","Jan  8, 2024 13:41:15.677185000 JST","","36408  >  6000 [SYN] Seq=0 Win=64240 Len=0 MSS=1460 SACK_PERM TSval=2896307470 TSecr=0 WS=128"
"155","62.775351","192.168.11.25","192.168.11.4","TCP","74","0.006805000","0.006805000","Jan  8, 2024 13:41:15.683990000 JST","","6000  >  36408 [SYN, ACK] Seq=0 Ack=1 Win=65160 Len=0 MSS=1460 SACK_PERM TSval=2779344711 TSecr=2896307470 WS=128"
"156","62.775462","192.168.11.4","192.168.11.25","TCP","66","0.000111000","0.000111000","Jan  8, 2024 13:41:15.684101000 JST","","36408  >  6000 [ACK] Seq=1 Ack=1 Win=64256 Len=0 TSval=2896307477 TSecr=2779344711"
"157","62.775651","192.168.11.4","192.168.11.25","TCP","93","","0.000189000","Jan  8, 2024 13:41:15.684290000 JST","","36408  >  6000 [PSH, ACK] Seq=1 Ack=1 Win=64256 Len=27 TSval=2896307477 TSecr=2779344711 [TCP segment of a reassembled PDU]"
"158","62.775739","192.168.11.4","192.168.11.25","TCP","66","","0.000088000","Jan  8, 2024 13:41:15.684378000 JST","","36408  >  6000 [FIN, ACK] Seq=28 Ack=1 Win=64256 Len=0 TSval=2896307477 TSecr=2779344711"
"159","62.782650","192.168.11.25","192.168.11.4","TCP","66","0.006999000","0.006911000","Jan  8, 2024 13:41:15.691289000 JST","","6000  >  36408 [ACK] Seq=1 Ack=28 Win=65152 Len=0 TSval=2779344718 TSecr=2896307477"
"160","62.783001","192.168.11.25","192.168.11.4","TCP","66","0.007262000","0.000351000","Jan  8, 2024 13:41:15.691640000 JST","","6000  >  36408 [FIN, ACK] Seq=1 Ack=29 Win=65152 Len=0 TSval=2779344719 TSecr=2896307477"
"161","62.783054","192.168.11.4","192.168.11.25","TCP","66","0.000053000","0.000053000","Jan  8, 2024 13:41:15.691693000 JST","","36408  >  6000 [ACK] Seq=29 Ack=2 Win=64256 Len=0 TSval=2896307485 TSecr=2779344719"
"162","62.811015","192.168.11.4","255.255.255.255","UDP","209","","0.027961000","Jan  8, 2024 13:41:15.719654000 JST","7b2273656d616e74696373223a207b22656e74697479223a2022504944222c202262617365656e74697479223a2022616e79222c2022726f6c65223a20226e6e6e222c20227370617469616c223a2022616e79222c202274656d706f72616c223a2022616e79227d2c20226461746170726f7065727479223a207b22666f726d6174223a2022696e616f6b615f70726f6772616d5f73616d706c655f73656d616e746963227d7d","42342  >  7000 Len=167"
"163","62.816899","192.168.11.5","192.168.11.4","TCP","74","","0.005884000","Jan  8, 2024 13:41:15.725538000 JST","","52852  >  6000 [SYN] Seq=0 Win=64240 Len=0 MSS=1460 SACK_PERM TSval=2041502244 TSecr=0 WS=128"
"164","62.817021","192.168.11.4","192.168.11.5","TCP","74","0.000122000","0.000122000","Jan  8, 2024 13:41:15.725660000 JST","","6000  >  52852 [SYN, ACK] Seq=0 Ack=1 Win=65160 Len=0 MSS=1460 SACK_PERM TSval=4085227601 TSecr=2041502244 WS=128"
"165","62.823668","192.168.11.5","192.168.11.4","TCP","66","0.006647000","0.006647000","Jan  8, 2024 13:41:15.732307000 JST","","52852  >  6000 [ACK] Seq=1 Ack=1 Win=64256 Len=0 TSval=2041502252 TSecr=4085227601"
"166","62.824343","192.168.11.5","192.168.11.4","TCP","93","","0.000675000","Jan  8, 2024 13:41:15.732982000 JST","","52852  >  6000 [PSH, ACK] Seq=1 Ack=1 Win=64256 Len=27 TSval=2041502252 TSecr=4085227601 [TCP segment of a reassembled PDU]"
"167","62.824448","192.168.11.4","192.168.11.5","TCP","66","0.000105000","0.000105000","Jan  8, 2024 13:41:15.733087000 JST","","6000  >  52852 [ACK] Seq=1 Ack=28 Win=65152 Len=0 TSval=4085227608 TSecr=2041502252"
"168","62.824531","192.168.11.5","192.168.11.4","TCP","66","","0.000083000","Jan  8, 2024 13:41:15.733170000 JST","","52852  >  6000 [FIN, ACK] Seq=28 Ack=1 Win=64256 Len=0 TSval=2041502252 TSecr=4085227601"
