"No.","Time","Source","Destination","Protocol","Length","The RTT to ACK the segment was","Time delta from previous captured frame","Arrival Time","Data","Info"
"1","0.000000","192.168.11.11","192.168.11.5","TCP","74","","0.000000000","Jan  8, 2024 13:40:13.004807000 JST","","44454  >  6000 [SYN] Seq=0 Win=64240 Len=0 MSS=1460 SACK_PERM TSval=1928974027 TSecr=0 WS=128"
"2","0.006812","192.168.11.5","192.168.11.11","TCP","74","0.006812000","0.006812000","Jan  8, 2024 13:40:13.011619000 JST","","6000  >  44454 [SYN, ACK] Seq=0 Ack=1 Win=65160 Len=0 MSS=1460 SACK_PERM TSval=2817114934 TSecr=1928974027 WS=128"
"3","0.006919","192.168.11.11","192.168.11.5","TCP","66","0.000107000","0.000107000","Jan  8, 2024 13:40:13.011726000 JST","","44454  >  6000 [ACK] Seq=1 Ack=1 Win=64256 Len=0 TSval=1928974036 TSecr=2817114934"
"4","0.007168","192.168.11.11","192.168.11.5","TCP","93","","0.000249000","Jan  8, 2024 13:40:13.011975000 JST","","44454  >  6000 [PSH, ACK] Seq=1 Ack=1 Win=64256 Len=27 TSval=1928974036 TSecr=2817114934 [TCP segment of a reassembled PDU]"
"5","0.007298","192.168.11.11","192.168.11.5","TCP","66","","0.000130000","Jan  8, 2024 13:40:13.012105000 JST","","44454  >  6000 [FIN, ACK] Seq=28 Ack=1 Win=64256 Len=0 TSval=1928974037 TSecr=2817114934"
"6","0.022980","192.168.11.5","192.168.11.11","TCP","66","0.015812000","0.015682000","Jan  8, 2024 13:40:13.027787000 JST","","6000  >  44454 [ACK] Seq=1 Ack=28 Win=65152 Len=0 TSval=2817114950 TSecr=1928974036"
"7","0.023348","192.168.11.5","192.168.11.11","TCP","66","0.016050000","0.000368000","Jan  8, 2024 13:40:13.028155000 JST","","6000  >  44454 [FIN, ACK] Seq=1 Ack=29 Win=65152 Len=0 TSval=2817114951 TSecr=1928974037"
"8","0.023392","192.168.11.11","192.168.11.5","TCP","66","0.000044000","0.000044000","Jan  8, 2024 13:40:13.028199000 JST","","44454  >  6000 [ACK] Seq=29 Ack=2 Win=64256 Len=0 TSval=1928974053 TSecr=2817114951"
"9","0.051128","192.168.11.11","255.255.255.255","UDP","209","","0.027736000","Jan  8, 2024 13:40:13.055935000 JST","7b2273656d616e74696373223a207b22656e74697479223a2022504944222c202262617365656e74697479223a2022616e79222c2022726f6c65223a2022707070222c20227370617469616c223a2022616e79222c202274656d706f72616c223a2022616e79227d2c20226461746170726f7065727479223a207b22666f726d6174223a2022696e616f6b615f70726f6772616d5f73616d706c655f73656d616e746963227d7d","41705  >  7000 Len=167"
"10","0.060155","192.168.11.16","192.168.11.11","TCP","74","","0.009027000","Jan  8, 2024 13:40:13.064962000 JST","","54504  >  6000 [SYN] Seq=0 Win=64240 Len=0 MSS=1460 SACK_PERM TSval=1444362337 TSecr=0 WS=128"
"11","0.066703","192.168.11.11","192.168.11.16","TCP","74","0.006548000","0.006548000","Jan  8, 2024 13:40:13.071510000 JST","","6000  >  54504 [SYN, ACK] Seq=0 Ack=1 Win=65160 Len=0 MSS=1460 SACK_PERM TSval=4236727262 TSecr=1444362337 WS=128"
"12","0.075709","192.168.11.16","192.168.11.11","TCP","66","0.009006000","0.009006000","Jan  8, 2024 13:40:13.080516000 JST","","54504  >  6000 [ACK] Seq=1 Ack=1 Win=64256 Len=0 TSval=1444362352 TSecr=4236727262"
"13","0.076385","192.168.11.16","192.168.11.11","TCP","93","","0.000676000","Jan  8, 2024 13:40:13.081192000 JST","","54504  >  6000 [PSH, ACK] Seq=1 Ack=1 Win=64256 Len=27 TSval=1444362352 TSecr=4236727262 [TCP segment of a reassembled PDU]"
"14","0.076454","192.168.11.11","192.168.11.16","TCP","66","0.000069000","0.000069000","Jan  8, 2024 13:40:13.081261000 JST","","6000  >  54504 [ACK] Seq=1 Ack=28 Win=65152 Len=0 TSval=4236727278 TSecr=1444362352"
"15","0.076523","192.168.11.16","192.168.11.11","TCP","66","","0.000069000","Jan  8, 2024 13:40:13.081330000 JST","","54504  >  6000 [FIN, ACK] Seq=28 Ack=1 Win=64256 Len=0 TSval=1444362352 TSecr=4236727262"
"16","0.078173","192.168.11.11","192.168.11.16","TCP","66","0.001650000","0.001650000","Jan  8, 2024 13:40:13.082980000 JST","","6000  >  54504 [FIN, ACK] Seq=1 Ack=29 Win=65152 Len=0 TSval=4236727279 TSecr=1444362352"
"17","0.087147","192.168.11.16","192.168.11.11","TCP","66","0.008974000","0.008974000","Jan  8, 2024 13:40:13.091954000 JST","","54504  >  6000 [ACK] Seq=29 Ack=2 Win=64256 Len=0 TSval=1444362364 TSecr=4236727279"
"18","6.920225","192.168.11.11","192.168.11.5","TCP","74","","6.833078000","Jan  8, 2024 13:40:19.925032000 JST","","44464  >  6000 [SYN] Seq=0 Win=64240 Len=0 MSS=1460 SACK_PERM TSval=1928980949 TSecr=0 WS=128"
"19","6.927907","192.168.11.5","192.168.11.11","TCP","74","0.007682000","0.007682000","Jan  8, 2024 13:40:19.932714000 JST","","6000  >  44464 [SYN, ACK] Seq=0 Ack=1 Win=65160 Len=0 MSS=1460 SACK_PERM TSval=2817121855 TSecr=1928980949 WS=128"
"20","6.927998","192.168.11.11","192.168.11.5","TCP","66","0.000091000","0.000091000","Jan  8, 2024 13:40:19.932805000 JST","","44464  >  6000 [ACK] Seq=1 Ack=1 Win=64256 Len=0 TSval=1928980957 TSecr=2817121855"
"21","6.928204","192.168.11.11","192.168.11.5","TCP","93","","0.000206000","Jan  8, 2024 13:40:19.933011000 JST","","44464  >  6000 [PSH, ACK] Seq=1 Ack=1 Win=64256 Len=27 TSval=1928980957 TSecr=2817121855 [TCP segment of a reassembled PDU]"
"22","6.928353","192.168.11.11","192.168.11.5","TCP","66","","0.000149000","Jan  8, 2024 13:40:19.933160000 JST","","44464  >  6000 [FIN, ACK] Seq=28 Ack=1 Win=64256 Len=0 TSval=1928980958 TSecr=2817121855"
"23","6.935368","192.168.11.5","192.168.11.11","TCP","66","0.007164000","0.007015000","Jan  8, 2024 13:40:19.940175000 JST","","6000  >  44464 [ACK] Seq=1 Ack=28 Win=65152 Len=0 TSval=2817121862 TSecr=1928980957"
"24","6.935614","192.168.11.5","192.168.11.11","TCP","66","0.007261000","0.000246000","Jan  8, 2024 13:40:19.940421000 JST","","6000  >  44464 [FIN, ACK] Seq=1 Ack=29 Win=65152 Len=0 TSval=2817121864 TSecr=1928980958"
"25","6.935656","192.168.11.11","192.168.11.5","TCP","66","0.000042000","0.000042000","Jan  8, 2024 13:40:19.940463000 JST","","44464  >  6000 [ACK] Seq=29 Ack=2 Win=64256 Len=0 TSval=1928980965 TSecr=2817121864"
"26","6.964749","192.168.11.11","255.255.255.255","UDP","209","","0.029093000","Jan  8, 2024 13:40:19.969556000 JST","7b2273656d616e74696373223a207b22656e74697479223a2022504944222c202262617365656e74697479223a2022616e79222c2022726f6c65223a2022707070222c20227370617469616c223a2022616e79222c202274656d706f72616c223a2022616e79227d2c20226461746170726f7065727479223a207b22666f726d6174223a2022696e616f6b615f70726f6772616d5f73616d706c655f73656d616e746963227d7d","39851  >  7000 Len=167"
"27","6.973417","192.168.11.16","192.168.11.11","TCP","74","","0.008668000","Jan  8, 2024 13:40:19.978224000 JST","","37024  >  6000 [SYN] Seq=0 Win=64240 Len=0 MSS=1460 SACK_PERM TSval=1444369251 TSecr=0 WS=128"
"28","6.973528","192.168.11.11","192.168.11.16","TCP","74","0.000111000","0.000111000","Jan  8, 2024 13:40:19.978335000 JST","","6000  >  37024 [SYN, ACK] Seq=0 Ack=1 Win=65160 Len=0 MSS=1460 SACK_PERM TSval=4236734175 TSecr=1444369251 WS=128"
"29","6.980655","192.168.11.16","192.168.11.11","TCP","66","0.007127000","0.007127000","Jan  8, 2024 13:40:19.985462000 JST","","37024  >  6000 [ACK] Seq=1 Ack=1 Win=64256 Len=0 TSval=1444369258 TSecr=4236734175"
"30","6.981176","192.168.11.16","192.168.11.11","TCP","93","","0.000521000","Jan  8, 2024 13:40:19.985983000 JST","","37024  >  6000 [PSH, ACK] Seq=1 Ack=1 Win=64256 Len=27 TSval=1444369259 TSecr=4236734175 [TCP segment of a reassembled PDU]"
"31","6.981267","192.168.11.11","192.168.11.16","TCP","66","0.000091000","0.000091000","Jan  8, 2024 13:40:19.986074000 JST","","6000  >  37024 [ACK] Seq=1 Ack=28 Win=65152 Len=0 TSval=4236734183 TSecr=1444369259"
"32","6.981329","192.168.11.16","192.168.11.11","TCP","66","","0.000062000","Jan  8, 2024 13:40:19.986136000 JST","","37024  >  6000 [FIN, ACK] Seq=28 Ack=1 Win=64256 Len=0 TSval=1444369259 TSecr=4236734175"
"33","6.983053","192.168.11.11","192.168.11.16","TCP","66","0.001724000","0.001724000","Jan  8, 2024 13:40:19.987860000 JST","","6000  >  37024 [FIN, ACK] Seq=1 Ack=29 Win=65152 Len=0 TSval=4236734184 TSecr=1444369259"
"34","6.993919","192.168.11.16","192.168.11.11","TCP","66","0.010866000","0.010866000","Jan  8, 2024 13:40:19.998726000 JST","","37024  >  6000 [ACK] Seq=29 Ack=2 Win=64256 Len=0 TSval=1444369269 TSecr=4236734184"
"35","13.685311","192.168.11.11","192.168.11.5","TCP","74","","6.691392000","Jan  8, 2024 13:40:26.690118000 JST","","50348  >  6000 [SYN] Seq=0 Win=64240 Len=0 MSS=1460 SACK_PERM TSval=1928987715 TSecr=0 WS=128"
"36","13.692010","192.168.11.5","192.168.11.11","TCP","74","0.006699000","0.006699000","Jan  8, 2024 13:40:26.696817000 JST","","6000  >  50348 [SYN, ACK] Seq=0 Ack=1 Win=65160 Len=0 MSS=1460 SACK_PERM TSval=2817128619 TSecr=1928987715 WS=128"
"37","13.692101","192.168.11.11","192.168.11.5","TCP","66","0.000091000","0.000091000","Jan  8, 2024 13:40:26.696908000 JST","","50348  >  6000 [ACK] Seq=1 Ack=1 Win=64256 Len=0 TSval=1928987721 TSecr=2817128619"
"38","13.692310","192.168.11.11","192.168.11.5","TCP","93","","0.000209000","Jan  8, 2024 13:40:26.697117000 JST","","50348  >  6000 [PSH, ACK] Seq=1 Ack=1 Win=64256 Len=27 TSval=1928987722 TSecr=2817128619 [TCP segment of a reassembled PDU]"
"39","13.692440","192.168.11.11","192.168.11.5","TCP","66","","0.000130000","Jan  8, 2024 13:40:26.697247000 JST","","50348  >  6000 [FIN, ACK] Seq=28 Ack=1 Win=64256 Len=0 TSval=1928987722 TSecr=2817128619"
"40","13.699619","192.168.11.5","192.168.11.11","TCP","66","0.007309000","0.007179000","Jan  8, 2024 13:40:26.704426000 JST","","6000  >  50348 [ACK] Seq=1 Ack=28 Win=65152 Len=0 TSval=2817128626 TSecr=1928987722"
"41","13.703814","192.168.11.5","192.168.11.11","TCP","66","0.011374000","0.004195000","Jan  8, 2024 13:40:26.708621000 JST","","6000  >  50348 [FIN, ACK] Seq=1 Ack=29 Win=65152 Len=0 TSval=2817128631 TSecr=1928987722"
"42","13.703857","192.168.11.11","192.168.11.5","TCP","66","0.000043000","0.000043000","Jan  8, 2024 13:40:26.708664000 JST","","50348  >  6000 [ACK] Seq=29 Ack=2 Win=64256 Len=0 TSval=1928987733 TSecr=2817128631"
"43","13.731162","192.168.11.11","255.255.255.255","UDP","209","","0.027305000","Jan  8, 2024 13:40:26.735969000 JST","7b2273656d616e74696373223a207b22656e74697479223a2022504944222c202262617365656e74697479223a2022616e79222c2022726f6c65223a2022707070222c20227370617469616c223a2022616e79222c202274656d706f72616c223a2022616e79227d2c20226461746170726f7065727479223a207b22666f726d6174223a2022696e616f6b615f70726f6772616d5f73616d706c655f73656d616e746963227d7d","52892  >  7000 Len=167"
"44","13.741361","192.168.11.16","192.168.11.11","TCP","74","","0.010199000","Jan  8, 2024 13:40:26.746168000 JST","","45818  >  6000 [SYN] Seq=0 Win=64240 Len=0 MSS=1460 SACK_PERM TSval=1444376018 TSecr=0 WS=128"
"45","13.741489","192.168.11.11","192.168.11.16","TCP","74","0.000128000","0.000128000","Jan  8, 2024 13:40:26.746296000 JST","","6000  >  45818 [SYN, ACK] Seq=0 Ack=1 Win=65160 Len=0 MSS=1460 SACK_PERM TSval=4236740943 TSecr=1444376018 WS=128"
"46","13.748717","192.168.11.16","192.168.11.11","TCP","66","0.007228000","0.007228000","Jan  8, 2024 13:40:26.753524000 JST","","45818  >  6000 [ACK] Seq=1 Ack=1 Win=64256 Len=0 TSval=1444376026 TSecr=4236740943"
"47","13.749300","192.168.11.16","192.168.11.11","TCP","93","","0.000583000","Jan  8, 2024 13:40:26.754107000 JST","","45818  >  6000 [PSH, ACK] Seq=1 Ack=1 Win=64256 Len=27 TSval=1444376026 TSecr=4236740943 [TCP segment of a reassembled PDU]"
"48","13.749372","192.168.11.11","192.168.11.16","TCP","66","0.000072000","0.000072000","Jan  8, 2024 13:40:26.754179000 JST","","6000  >  45818 [ACK] Seq=1 Ack=28 Win=65152 Len=0 TSval=4236740951 TSecr=1444376026"
"49","13.749440","192.168.11.16","192.168.11.11","TCP","66","","0.000068000","Jan  8, 2024 13:40:26.754247000 JST","","45818  >  6000 [FIN, ACK] Seq=28 Ack=1 Win=64256 Len=0 TSval=1444376027 TSecr=4236740943"
"50","13.750866","192.168.11.11","192.168.11.16","TCP","66","0.001426000","0.001426000","Jan  8, 2024 13:40:26.755673000 JST","","6000  >  45818 [FIN, ACK] Seq=1 Ack=29 Win=65152 Len=0 TSval=4236740952 TSecr=1444376027"
"51","13.758363","192.168.11.16","192.168.11.11","TCP","66","0.007497000","0.007497000","Jan  8, 2024 13:40:26.763170000 JST","","45818  >  6000 [ACK] Seq=29 Ack=2 Win=64256 Len=0 TSval=1444376035 TSecr=4236740952"
"52","21.372484","192.168.11.11","192.168.11.5","TCP","74","","7.614121000","Jan  8, 2024 13:40:34.377291000 JST","","34784  >  6000 [SYN] Seq=0 Win=64240 Len=0 MSS=1460 SACK_PERM TSval=1928995402 TSecr=0 WS=128"
"53","21.379080","192.168.11.5","192.168.11.11","TCP","74","0.006596000","0.006596000","Jan  8, 2024 13:40:34.383887000 JST","","6000  >  34784 [SYN, ACK] Seq=0 Ack=1 Win=65160 Len=0 MSS=1460 SACK_PERM TSval=2817136306 TSecr=1928995402 WS=128"
"54","21.379171","192.168.11.11","192.168.11.5","TCP","66","0.000091000","0.000091000","Jan  8, 2024 13:40:34.383978000 JST","","34784  >  6000 [ACK] Seq=1 Ack=1 Win=64256 Len=0 TSval=1928995408 TSecr=2817136306"
"55","21.379326","192.168.11.11","192.168.11.5","TCP","93","","0.000155000","Jan  8, 2024 13:40:34.384133000 JST","","34784  >  6000 [PSH, ACK] Seq=1 Ack=1 Win=64256 Len=27 TSval=1928995409 TSecr=2817136306 [TCP segment of a reassembled PDU]"
"56","21.379445","192.168.11.11","192.168.11.5","TCP","66","","0.000119000","Jan  8, 2024 13:40:34.384252000 JST","","34784  >  6000 [FIN, ACK] Seq=28 Ack=1 Win=64256 Len=0 TSval=1928995409 TSecr=2817136306"
"57","21.386247","192.168.11.5","192.168.11.11","TCP","66","0.006921000","0.006802000","Jan  8, 2024 13:40:34.391054000 JST","","6000  >  34784 [ACK] Seq=1 Ack=28 Win=65152 Len=0 TSval=2817136313 TSecr=1928995409"
"58","21.386624","192.168.11.5","192.168.11.11","TCP","66","0.007179000","0.000377000","Jan  8, 2024 13:40:34.391431000 JST","","6000  >  34784 [FIN, ACK] Seq=1 Ack=29 Win=65152 Len=0 TSval=2817136314 TSecr=1928995409"
"59","21.386666","192.168.11.11","192.168.11.5","TCP","66","0.000042000","0.000042000","Jan  8, 2024 13:40:34.391473000 JST","","34784  >  6000 [ACK] Seq=29 Ack=2 Win=64256 Len=0 TSval=1928995416 TSecr=2817136314"
"60","21.414860","192.168.11.11","255.255.255.255","UDP","209","","0.028194000","Jan  8, 2024 13:40:34.419667000 JST","7b2273656d616e74696373223a207b22656e74697479223a2022504944222c202262617365656e74697479223a2022616e79222c2022726f6c65223a2022707070222c20227370617469616c223a2022616e79222c202274656d706f72616c223a2022616e79227d2c20226461746170726f7065727479223a207b22666f726d6174223a2022696e616f6b615f70726f6772616d5f73616d706c655f73656d616e746963227d7d","37316  >  7000 Len=167"
"61","21.424666","192.168.11.16","192.168.11.11","TCP","74","","0.009806000","Jan  8, 2024 13:40:34.429473000 JST","","45828  >  6000 [SYN] Seq=0 Win=64240 Len=0 MSS=1460 SACK_PERM TSval=1444383701 TSecr=0 WS=128"
"62","21.424791","192.168.11.11","192.168.11.16","TCP","74","0.000125000","0.000125000","Jan  8, 2024 13:40:34.429598000 JST","","6000  >  45828 [SYN, ACK] Seq=0 Ack=1 Win=65160 Len=0 MSS=1460 SACK_PERM TSval=4236748626 TSecr=1444383701 WS=128"
"63","21.433066","192.168.11.16","192.168.11.11","TCP","66","0.008275000","0.008275000","Jan  8, 2024 13:40:34.437873000 JST","","45828  >  6000 [ACK] Seq=1 Ack=1 Win=64256 Len=0 TSval=1444383711 TSecr=4236748626"
"64","21.433626","192.168.11.16","192.168.11.11","TCP","93","","0.000560000","Jan  8, 2024 13:40:34.438433000 JST","","45828  >  6000 [PSH, ACK] Seq=1 Ack=1 Win=64256 Len=27 TSval=1444383711 TSecr=4236748626 [TCP segment of a reassembled PDU]"
"65","21.433702","192.168.11.11","192.168.11.16","TCP","66","0.000076000","0.000076000","Jan  8, 2024 13:40:34.438509000 JST","","6000  >  45828 [ACK] Seq=1 Ack=28 Win=65152 Len=0 TSval=4236748635 TSecr=1444383711"
"66","21.433769","192.168.11.16","192.168.11.11","TCP","66","","0.000067000","Jan  8, 2024 13:40:34.438576000 JST","","45828  >  6000 [FIN, ACK] Seq=28 Ack=1 Win=64256 Len=0 TSval=1444383711 TSecr=4236748626"
"67","21.435843","192.168.11.11","192.168.11.16","TCP","66","0.002074000","0.002074000","Jan  8, 2024 13:40:34.440650000 JST","","6000  >  45828 [FIN, ACK] Seq=1 Ack=29 Win=65152 Len=0 TSval=4236748637 TSecr=1444383711"
"68","21.444821","192.168.11.16","192.168.11.11","TCP","66","0.008978000","0.008978000","Jan  8, 2024 13:40:34.449628000 JST","","45828  >  6000 [ACK] Seq=29 Ack=2 Win=64256 Len=0 TSval=1444383721 TSecr=4236748637"
"69","29.134046","192.168.11.11","192.168.11.5","TCP","74","","7.689225000","Jan  8, 2024 13:40:42.138853000 JST","","34788  >  6000 [SYN] Seq=0 Win=64240 Len=0 MSS=1460 SACK_PERM TSval=1929003163 TSecr=0 WS=128"
"70","29.144056","192.168.11.5","192.168.11.11","TCP","74","0.010010000","0.010010000","Jan  8, 2024 13:40:42.148863000 JST","","6000  >  34788 [SYN, ACK] Seq=0 Ack=1 Win=65160 Len=0 MSS=1460 SACK_PERM TSval=2817144068 TSecr=1929003163 WS=128"
"71","29.144147","192.168.11.11","192.168.11.5","TCP","66","0.000091000","0.000091000","Jan  8, 2024 13:40:42.148954000 JST","","34788  >  6000 [ACK] Seq=1 Ack=1 Win=64256 Len=0 TSval=1929003173 TSecr=2817144068"
"72","29.144343","192.168.11.11","192.168.11.5","TCP","93","","0.000196000","Jan  8, 2024 13:40:42.149150000 JST","","34788  >  6000 [PSH, ACK] Seq=1 Ack=1 Win=64256 Len=27 TSval=1929003174 TSecr=2817144068 [TCP segment of a reassembled PDU]"
"73","29.144444","192.168.11.11","192.168.11.5","TCP","66","","0.000101000","Jan  8, 2024 13:40:42.149251000 JST","","34788  >  6000 [FIN, ACK] Seq=28 Ack=1 Win=64256 Len=0 TSval=1929003174 TSecr=2817144068"
"74","29.151814","192.168.11.5","192.168.11.11","TCP","66","0.007471000","0.007370000","Jan  8, 2024 13:40:42.156621000 JST","","6000  >  34788 [ACK] Seq=1 Ack=28 Win=65152 Len=0 TSval=2817144078 TSecr=1929003174"
"75","29.152283","192.168.11.5","192.168.11.11","TCP","66","0.007839000","0.000469000","Jan  8, 2024 13:40:42.157090000 JST","","6000  >  34788 [FIN, ACK] Seq=1 Ack=29 Win=65152 Len=0 TSval=2817144080 TSecr=1929003174"
"76","29.152326","192.168.11.11","192.168.11.5","TCP","66","0.000043000","0.000043000","Jan  8, 2024 13:40:42.157133000 JST","","34788  >  6000 [ACK] Seq=29 Ack=2 Win=64256 Len=0 TSval=1929003182 TSecr=2817144080"
"77","29.180683","192.168.11.11","255.255.255.255","UDP","209","","0.028357000","Jan  8, 2024 13:40:42.185490000 JST","7b2273656d616e74696373223a207b22656e74697479223a2022504944222c202262617365656e74697479223a2022616e79222c2022726f6c65223a2022707070222c20227370617469616c223a2022616e79222c202274656d706f72616c223a2022616e79227d2c20226461746170726f7065727479223a207b22666f726d6174223a2022696e616f6b615f70726f6772616d5f73616d706c655f73656d616e746963227d7d","45119  >  7000 Len=167"
"78","29.190220","192.168.11.16","192.168.11.11","TCP","74","","0.009537000","Jan  8, 2024 13:40:42.195027000 JST","","59672  >  6000 [SYN] Seq=0 Win=64240 Len=0 MSS=1460 SACK_PERM TSval=1444391467 TSecr=0 WS=128"
"79","29.190350","192.168.11.11","192.168.11.16","TCP","74","0.000130000","0.000130000","Jan  8, 2024 13:40:42.195157000 JST","","6000  >  59672 [SYN, ACK] Seq=0 Ack=1 Win=65160 Len=0 MSS=1460 SACK_PERM TSval=4236756392 TSecr=1444391467 WS=128"
"80","29.198470","192.168.11.16","192.168.11.11","TCP","66","0.008120000","0.008120000","Jan  8, 2024 13:40:42.203277000 JST","","59672  >  6000 [ACK] Seq=1 Ack=1 Win=64256 Len=0 TSval=1444391476 TSecr=4236756392"
"81","29.199042","192.168.11.16","192.168.11.11","TCP","93","","0.000572000","Jan  8, 2024 13:40:42.203849000 JST","","59672  >  6000 [PSH, ACK] Seq=1 Ack=1 Win=64256 Len=27 TSval=1444391476 TSecr=4236756392 [TCP segment of a reassembled PDU]"
"82","29.199252","192.168.11.16","192.168.11.11","TCP","66","","0.000210000","Jan  8, 2024 13:40:42.204059000 JST","","59672  >  6000 [FIN, ACK] Seq=28 Ack=1 Win=64256 Len=0 TSval=1444391477 TSecr=4236756392"
"83","29.199574","192.168.11.11","192.168.11.16","TCP","66","0.000532000","0.000322000","Jan  8, 2024 13:40:42.204381000 JST","","6000  >  59672 [ACK] Seq=1 Ack=28 Win=65152 Len=0 TSval=4236756401 TSecr=1444391476"
"84","29.201869","192.168.11.11","192.168.11.16","TCP","66","0.002617000","0.002295000","Jan  8, 2024 13:40:42.206676000 JST","","6000  >  59672 [FIN, ACK] Seq=1 Ack=29 Win=65152 Len=0 TSval=4236756403 TSecr=1444391477"
"85","29.211376","192.168.11.16","192.168.11.11","TCP","66","0.009507000","0.009507000","Jan  8, 2024 13:40:42.216183000 JST","","59672  >  6000 [ACK] Seq=29 Ack=2 Win=64256 Len=0 TSval=1444391488 TSecr=4236756403"
"86","35.854145","192.168.11.11","192.168.11.5","TCP","74","","6.642769000","Jan  8, 2024 13:40:48.858952000 JST","","49924  >  6000 [SYN] Seq=0 Win=64240 Len=0 MSS=1460 SACK_PERM TSval=1929009883 TSecr=0 WS=128"
"87","35.860987","192.168.11.5","192.168.11.11","TCP","74","0.006842000","0.006842000","Jan  8, 2024 13:40:48.865794000 JST","","6000  >  49924 [SYN, ACK] Seq=0 Ack=1 Win=65160 Len=0 MSS=1460 SACK_PERM TSval=2817150788 TSecr=1929009883 WS=128"
"88","35.861079","192.168.11.11","192.168.11.5","TCP","66","0.000092000","0.000092000","Jan  8, 2024 13:40:48.865886000 JST","","49924  >  6000 [ACK] Seq=1 Ack=1 Win=64256 Len=0 TSval=1929009890 TSecr=2817150788"
"89","35.861259","192.168.11.11","192.168.11.5","TCP","93","","0.000180000","Jan  8, 2024 13:40:48.866066000 JST","","49924  >  6000 [PSH, ACK] Seq=1 Ack=1 Win=64256 Len=27 TSval=1929009891 TSecr=2817150788 [TCP segment of a reassembled PDU]"
"90","35.861364","192.168.11.11","192.168.11.5","TCP","66","","0.000105000","Jan  8, 2024 13:40:48.866171000 JST","","49924  >  6000 [FIN, ACK] Seq=28 Ack=1 Win=64256 Len=0 TSval=1929009891 TSecr=2817150788"
"91","35.870650","192.168.11.5","192.168.11.11","TCP","66","0.009286000","0.009286000","Jan  8, 2024 13:40:48.875457000 JST","","6000  >  49924 [FIN, ACK] Seq=1 Ack=29 Win=65152 Len=0 TSval=2817150796 TSecr=1929009891"
"92","35.870706","192.168.11.11","192.168.11.5","TCP","66","0.000056000","0.000056000","Jan  8, 2024 13:40:48.875513000 JST","","49924  >  6000 [ACK] Seq=29 Ack=2 Win=64256 Len=0 TSval=1929009900 TSecr=2817150796"
"93","35.902607","192.168.11.11","255.255.255.255","UDP","209","","0.031901000","Jan  8, 2024 13:40:48.907414000 JST","7b2273656d616e74696373223a207b22656e74697479223a2022504944222c202262617365656e74697479223a2022616e79222c2022726f6c65223a2022707070222c20227370617469616c223a2022616e79222c202274656d706f72616c223a2022616e79227d2c20226461746170726f7065727479223a207b22666f726d6174223a2022696e616f6b615f70726f6772616d5f73616d706c655f73656d616e746963227d7d","45681  >  7000 Len=167"
"94","35.912937","192.168.11.16","192.168.11.11","TCP","74","","0.010330000","Jan  8, 2024 13:40:48.917744000 JST","","43290  >  6000 [SYN] Seq=0 Win=64240 Len=0 MSS=1460 SACK_PERM TSval=1444398189 TSecr=0 WS=128"
"95","35.913068","192.168.11.11","192.168.11.16","TCP","74","0.000131000","0.000131000","Jan  8, 2024 13:40:48.917875000 JST","","6000  >  43290 [SYN, ACK] Seq=0 Ack=1 Win=65160 Len=0 MSS=1460 SACK_PERM TSval=4236763114 TSecr=1444398189 WS=128"
"96","35.922328","192.168.11.16","192.168.11.11","TCP","66","0.009260000","0.009260000","Jan  8, 2024 13:40:48.927135000 JST","","43290  >  6000 [ACK] Seq=1 Ack=1 Win=64256 Len=0 TSval=1444398200 TSecr=4236763114"
"97","35.922929","192.168.11.16","192.168.11.11","TCP","93","","0.000601000","Jan  8, 2024 13:40:48.927736000 JST","","43290  >  6000 [PSH, ACK] Seq=1 Ack=1 Win=64256 Len=27 TSval=1444398200 TSecr=4236763114 [TCP segment of a reassembled PDU]"
"98","35.923009","192.168.11.11","192.168.11.16","TCP","66","0.000080000","0.000080000","Jan  8, 2024 13:40:48.927816000 JST","","6000  >  43290 [ACK] Seq=1 Ack=28 Win=65152 Len=0 TSval=4236763124 TSecr=1444398200"
"99","35.923078","192.168.11.16","192.168.11.11","TCP","66","","0.000069000","Jan  8, 2024 13:40:48.927885000 JST","","43290  >  6000 [FIN, ACK] Seq=28 Ack=1 Win=64256 Len=0 TSval=1444398200 TSecr=4236763114"
"100","35.925652","192.168.11.11","192.168.11.16","TCP","66","0.002574000","0.002574000","Jan  8, 2024 13:40:48.930459000 JST","","6000  >  43290 [FIN, ACK] Seq=1 Ack=29 Win=65152 Len=0 TSval=4236763127 TSecr=1444398200"
"101","35.935155","192.168.11.16","192.168.11.11","TCP","66","0.009503000","0.009503000","Jan  8, 2024 13:40:48.939962000 JST","","43290  >  6000 [ACK] Seq=29 Ack=2 Win=64256 Len=0 TSval=1444398211 TSecr=4236763127"
"102","42.619837","192.168.11.11","192.168.11.5","TCP","74","","6.684682000","Jan  8, 2024 13:40:55.624644000 JST","","49402  >  6000 [SYN] Seq=0 Win=64240 Len=0 MSS=1460 SACK_PERM TSval=1929016649 TSecr=0 WS=128"
"103","42.626607","192.168.11.5","192.168.11.11","TCP","74","0.006770000","0.006770000","Jan  8, 2024 13:40:55.631414000 JST","","6000  >  49402 [SYN, ACK] Seq=0 Ack=1 Win=65160 Len=0 MSS=1460 SACK_PERM TSval=2817157553 TSecr=1929016649 WS=128"
"104","42.626703","192.168.11.11","192.168.11.5","TCP","66","0.000096000","0.000096000","Jan  8, 2024 13:40:55.631510000 JST","","49402  >  6000 [ACK] Seq=1 Ack=1 Win=64256 Len=0 TSval=1929016656 TSecr=2817157553"
"105","42.626870","192.168.11.11","192.168.11.5","TCP","93","","0.000167000","Jan  8, 2024 13:40:55.631677000 JST","","49402  >  6000 [PSH, ACK] Seq=1 Ack=1 Win=64256 Len=27 TSval=1929016656 TSecr=2817157553 [TCP segment of a reassembled PDU]"
"106","42.626959","192.168.11.11","192.168.11.5","TCP","66","","0.000089000","Jan  8, 2024 13:40:55.631766000 JST","","49402  >  6000 [FIN, ACK] Seq=28 Ack=1 Win=64256 Len=0 TSval=1929016656 TSecr=2817157553"
"107","42.634847","192.168.11.5","192.168.11.11","TCP","66","0.007977000","0.007888000","Jan  8, 2024 13:40:55.639654000 JST","","6000  >  49402 [ACK] Seq=1 Ack=28 Win=65152 Len=0 TSval=2817157561 TSecr=1929016656"
"108","42.635217","192.168.11.5","192.168.11.11","TCP","66","0.008258000","0.000370000","Jan  8, 2024 13:40:55.640024000 JST","","6000  >  49402 [FIN, ACK] Seq=1 Ack=29 Win=65152 Len=0 TSval=2817157562 TSecr=1929016656"
"109","42.635269","192.168.11.11","192.168.11.5","TCP","66","0.000052000","0.000052000","Jan  8, 2024 13:40:55.640076000 JST","","49402  >  6000 [ACK] Seq=29 Ack=2 Win=64256 Len=0 TSval=1929016665 TSecr=2817157562"
"110","42.663880","192.168.11.11","255.255.255.255","UDP","209","","0.028611000","Jan  8, 2024 13:40:55.668687000 JST","7b2273656d616e74696373223a207b22656e74697479223a2022504944222c202262617365656e74697479223a2022616e79222c2022726f6c65223a2022707070222c20227370617469616c223a2022616e79222c202274656d706f72616c223a2022616e79227d2c20226461746170726f7065727479223a207b22666f726d6174223a2022696e616f6b615f70726f6772616d5f73616d706c655f73656d616e746963227d7d","51032  >  7000 Len=167"
"111","42.675039","192.168.11.16","192.168.11.11","TCP","74","","0.011159000","Jan  8, 2024 13:40:55.679846000 JST","","43294  >  6000 [SYN] Seq=0 Win=64240 Len=0 MSS=1460 SACK_PERM TSval=1444404953 TSecr=0 WS=128"
"112","42.675166","192.168.11.11","192.168.11.16","TCP","74","0.000127000","0.000127000","Jan  8, 2024 13:40:55.679973000 JST","","6000  >  43294 [SYN, ACK] Seq=0 Ack=1 Win=65160 Len=0 MSS=1460 SACK_PERM TSval=4236769876 TSecr=1444404953 WS=128"
"113","42.683341","192.168.11.16","192.168.11.11","TCP","66","0.008175000","0.008175000","Jan  8, 2024 13:40:55.688148000 JST","","43294  >  6000 [ACK] Seq=1 Ack=1 Win=64256 Len=0 TSval=1444404961 TSecr=4236769876"
"114","42.684356","192.168.11.16","192.168.11.11","TCP","93","","0.001015000","Jan  8, 2024 13:40:55.689163000 JST","","43294  >  6000 [PSH, ACK] Seq=1 Ack=1 Win=64256 Len=27 TSval=1444404961 TSecr=4236769876 [TCP segment of a reassembled PDU]"
"115","42.684529","192.168.11.11","192.168.11.16","TCP","66","0.000173000","0.000173000","Jan  8, 2024 13:40:55.689336000 JST","","6000  >  43294 [ACK] Seq=1 Ack=28 Win=65152 Len=0 TSval=4236769886 TSecr=1444404961"
"116","42.684640","192.168.11.16","192.168.11.11","TCP","66","","0.000111000","Jan  8, 2024 13:40:55.689447000 JST","","43294  >  6000 [FIN, ACK] Seq=28 Ack=1 Win=64256 Len=0 TSval=1444404961 TSecr=4236769876"
"117","42.686718","192.168.11.11","192.168.11.16","TCP","66","0.002078000","0.002078000","Jan  8, 2024 13:40:55.691525000 JST","","6000  >  43294 [FIN, ACK] Seq=1 Ack=29 Win=65152 Len=0 TSval=4236769888 TSecr=1444404961"
"118","42.693851","192.168.11.16","192.168.11.11","TCP","66","0.007133000","0.007133000","Jan  8, 2024 13:40:55.698658000 JST","","43294  >  6000 [ACK] Seq=29 Ack=2 Win=64256 Len=0 TSval=1444404971 TSecr=4236769888"
"119","49.370421","192.168.11.11","192.168.11.5","TCP","74","","6.676570000","Jan  8, 2024 13:41:02.375228000 JST","","49408  >  6000 [SYN] Seq=0 Win=64240 Len=0 MSS=1460 SACK_PERM TSval=1929023400 TSecr=0 WS=128"
"120","49.376948","192.168.11.5","192.168.11.11","TCP","74","0.006527000","0.006527000","Jan  8, 2024 13:41:02.381755000 JST","","6000  >  49408 [SYN, ACK] Seq=0 Ack=1 Win=65160 Len=0 MSS=1460 SACK_PERM TSval=2817164304 TSecr=1929023400 WS=128"
"121","49.377043","192.168.11.11","192.168.11.5","TCP","66","0.000095000","0.000095000","Jan  8, 2024 13:41:02.381850000 JST","","49408  >  6000 [ACK] Seq=1 Ack=1 Win=64256 Len=0 TSval=1929023406 TSecr=2817164304"
"122","49.377234","192.168.11.11","192.168.11.5","TCP","93","","0.000191000","Jan  8, 2024 13:41:02.382041000 JST","","49408  >  6000 [PSH, ACK] Seq=1 Ack=1 Win=64256 Len=27 TSval=1929023407 TSecr=2817164304 [TCP segment of a reassembled PDU]"
"123","49.377332","192.168.11.11","192.168.11.5","TCP","66","","0.000098000","Jan  8, 2024 13:41:02.382139000 JST","","49408  >  6000 [FIN, ACK] Seq=28 Ack=1 Win=64256 Len=0 TSval=1929023407 TSecr=2817164304"
"124","49.384196","192.168.11.5","192.168.11.11","TCP","66","0.006962000","0.006864000","Jan  8, 2024 13:41:02.389003000 JST","","6000  >  49408 [ACK] Seq=1 Ack=28 Win=65152 Len=0 TSval=2817164311 TSecr=1929023407"
"125","49.384591","192.168.11.5","192.168.11.11","TCP","66","0.007259000","0.000395000","Jan  8, 2024 13:41:02.389398000 JST","","6000  >  49408 [FIN, ACK] Seq=1 Ack=29 Win=65152 Len=0 TSval=2817164312 TSecr=1929023407"
"126","49.384633","192.168.11.11","192.168.11.5","TCP","66","0.000042000","0.000042000","Jan  8, 2024 13:41:02.389440000 JST","","49408  >  6000 [ACK] Seq=29 Ack=2 Win=64256 Len=0 TSval=1929023414 TSecr=2817164312"
"127","49.411372","192.168.11.11","255.255.255.255","UDP","209","","0.026739000","Jan  8, 2024 13:41:02.416179000 JST","7b2273656d616e74696373223a207b22656e74697479223a2022504944222c202262617365656e74697479223a2022616e79222c2022726f6c65223a2022707070222c20227370617469616c223a2022616e79222c202274656d706f72616c223a2022616e79227d2c20226461746170726f7065727479223a207b22666f726d6174223a2022696e616f6b615f70726f6772616d5f73616d706c655f73656d616e746963227d7d","59736  >  7000 Len=167"
"128","49.420460","192.168.11.16","192.168.11.11","TCP","74","","0.009088000","Jan  8, 2024 13:41:02.425267000 JST","","43670  >  6000 [SYN] Seq=0 Win=64240 Len=0 MSS=1460 SACK_PERM TSval=1444411698 TSecr=0 WS=128"
"129","49.420591","192.168.11.11","192.168.11.16","TCP","74","0.000131000","0.000131000","Jan  8, 2024 13:41:02.425398000 JST","","6000  >  43670 [SYN, ACK] Seq=0 Ack=1 Win=65160 Len=0 MSS=1460 SACK_PERM TSval=4236776622 TSecr=1444411698 WS=128"
"130","49.431044","192.168.11.16","192.168.11.11","TCP","66","0.010453000","0.010453000","Jan  8, 2024 13:41:02.435851000 JST","","43670  >  6000 [ACK] Seq=1 Ack=1 Win=64256 Len=0 TSval=1444411708 TSecr=4236776622"
"131","49.431612","192.168.11.16","192.168.11.11","TCP","93","","0.000568000","Jan  8, 2024 13:41:02.436419000 JST","","43670  >  6000 [PSH, ACK] Seq=1 Ack=1 Win=64256 Len=27 TSval=1444411709 TSecr=4236776622 [TCP segment of a reassembled PDU]"
"132","49.431722","192.168.11.11","192.168.11.16","TCP","66","0.000110000","0.000110000","Jan  8, 2024 13:41:02.436529000 JST","","6000  >  43670 [ACK] Seq=1 Ack=28 Win=65152 Len=0 TSval=4236776633 TSecr=1444411709"
"133","49.431801","192.168.11.16","192.168.11.11","TCP","66","","0.000079000","Jan  8, 2024 13:41:02.436608000 JST","","43670  >  6000 [FIN, ACK] Seq=28 Ack=1 Win=64256 Len=0 TSval=1444411709 TSecr=4236776622"
"134","49.434229","192.168.11.11","192.168.11.16","TCP","66","0.002428000","0.002428000","Jan  8, 2024 13:41:02.439036000 JST","","6000  >  43670 [FIN, ACK] Seq=1 Ack=29 Win=65152 Len=0 TSval=4236776635 TSecr=1444411709"
"135","49.443844","192.168.11.16","192.168.11.11","TCP","66","0.009615000","0.009615000","Jan  8, 2024 13:41:02.448651000 JST","","43670  >  6000 [ACK] Seq=29 Ack=2 Win=64256 Len=0 TSval=1444411720 TSecr=4236776635"
"136","56.079418","192.168.11.11","192.168.11.5","TCP","74","","6.635574000","Jan  8, 2024 13:41:09.084225000 JST","","60874  >  6000 [SYN] Seq=0 Win=64240 Len=0 MSS=1460 SACK_PERM TSval=1929030109 TSecr=0 WS=128"
"137","56.085974","192.168.11.5","192.168.11.11","TCP","74","0.006556000","0.006556000","Jan  8, 2024 13:41:09.090781000 JST","","6000  >  60874 [SYN, ACK] Seq=0 Ack=1 Win=65160 Len=0 MSS=1460 SACK_PERM TSval=2817171013 TSecr=1929030109 WS=128"
"138","56.086071","192.168.11.11","192.168.11.5","TCP","66","0.000097000","0.000097000","Jan  8, 2024 13:41:09.090878000 JST","","60874  >  6000 [ACK] Seq=1 Ack=1 Win=64256 Len=0 TSval=1929030115 TSecr=2817171013"
"139","56.086225","192.168.11.11","192.168.11.5","TCP","93","","0.000154000","Jan  8, 2024 13:41:09.091032000 JST","","60874  >  6000 [PSH, ACK] Seq=1 Ack=1 Win=64256 Len=27 TSval=1929030116 TSecr=2817171013 [TCP segment of a reassembled PDU]"
"140","56.086327","192.168.11.11","192.168.11.5","TCP","66","","0.000102000","Jan  8, 2024 13:41:09.091134000 JST","","60874  >  6000 [FIN, ACK] Seq=28 Ack=1 Win=64256 Len=0 TSval=1929030116 TSecr=2817171013"
"141","56.093434","192.168.11.5","192.168.11.11","TCP","66","0.007209000","0.007107000","Jan  8, 2024 13:41:09.098241000 JST","","6000  >  60874 [ACK] Seq=1 Ack=28 Win=65152 Len=0 TSval=2817171020 TSecr=1929030116"
"142","56.093673","192.168.11.5","192.168.11.11","TCP","66","0.007346000","0.000239000","Jan  8, 2024 13:41:09.098480000 JST","","6000  >  60874 [FIN, ACK] Seq=1 Ack=29 Win=65152 Len=0 TSval=2817171022 TSecr=1929030116"
"143","56.093715","192.168.11.11","192.168.11.5","TCP","66","0.000042000","0.000042000","Jan  8, 2024 13:41:09.098522000 JST","","60874  >  6000 [ACK] Seq=29 Ack=2 Win=64256 Len=0 TSval=1929030123 TSecr=2817171022"
"144","56.122355","192.168.11.11","255.255.255.255","UDP","209","","0.028640000","Jan  8, 2024 13:41:09.127162000 JST","7b2273656d616e74696373223a207b22656e74697479223a2022504944222c202262617365656e74697479223a2022616e79222c2022726f6c65223a2022707070222c20227370617469616c223a2022616e79222c202274656d706f72616c223a2022616e79227d2c20226461746170726f7065727479223a207b22666f726d6174223a2022696e616f6b615f70726f6772616d5f73616d706c655f73656d616e746963227d7d","33359  >  7000 Len=167"
"145","56.131864","192.168.11.16","192.168.11.11","TCP","74","","0.009509000","Jan  8, 2024 13:41:09.136671000 JST","","45802  >  6000 [SYN] Seq=0 Win=64240 Len=0 MSS=1460 SACK_PERM TSval=1444418409 TSecr=0 WS=128"
"146","56.131994","192.168.11.11","192.168.11.16","TCP","74","0.000130000","0.000130000","Jan  8, 2024 13:41:09.136801000 JST","","6000  >  45802 [SYN, ACK] Seq=0 Ack=1 Win=65160 Len=0 MSS=1460 SACK_PERM TSval=4236783333 TSecr=1444418409 WS=128"
"147","56.144299","192.168.11.16","192.168.11.11","TCP","66","0.012305000","0.012305000","Jan  8, 2024 13:41:09.149106000 JST","","45802  >  6000 [ACK] Seq=1 Ack=1 Win=64256 Len=0 TSval=1444418418 TSecr=4236783333"
"148","56.144811","192.168.11.16","192.168.11.11","TCP","93","","0.000512000","Jan  8, 2024 13:41:09.149618000 JST","","45802  >  6000 [PSH, ACK] Seq=1 Ack=1 Win=64256 Len=27 TSval=1444418418 TSecr=4236783333 [TCP segment of a reassembled PDU]"
"149","56.144883","192.168.11.11","192.168.11.16","TCP","66","0.000072000","0.000072000","Jan  8, 2024 13:41:09.149690000 JST","","6000  >  45802 [ACK] Seq=1 Ack=28 Win=65152 Len=0 TSval=4236783346 TSecr=1444418418"
"150","56.144949","192.168.11.16","192.168.11.11","TCP","66","","0.000066000","Jan  8, 2024 13:41:09.149756000 JST","","45802  >  6000 [FIN, ACK] Seq=28 Ack=1 Win=64256 Len=0 TSval=1444418418 TSecr=4236783333"
"151","56.145808","192.168.11.11","192.168.11.16","TCP","66","0.000859000","0.000859000","Jan  8, 2024 13:41:09.150615000 JST","","6000  >  45802 [FIN, ACK] Seq=1 Ack=29 Win=65152 Len=0 TSval=4236783347 TSecr=1444418418"
"152","56.152616","192.168.11.16","192.168.11.11","TCP","66","0.006808000","0.006808000","Jan  8, 2024 13:41:09.157423000 JST","","45802  >  6000 [ACK] Seq=29 Ack=2 Win=64256 Len=0 TSval=1444418430 TSecr=4236783347"
"153","62.759427","192.168.11.11","192.168.11.5","TCP","74","","6.606811000","Jan  8, 2024 13:41:15.764234000 JST","","37840  >  6000 [SYN] Seq=0 Win=64240 Len=0 MSS=1460 SACK_PERM TSval=1929036789 TSecr=0 WS=128"
"154","62.766960","192.168.11.5","192.168.11.11","TCP","74","0.007533000","0.007533000","Jan  8, 2024 13:41:15.771767000 JST","","6000  >  37840 [SYN, ACK] Seq=0 Ack=1 Win=65160 Len=0 MSS=1460 SACK_PERM TSval=2817177694 TSecr=1929036789 WS=128"
"155","62.767075","192.168.11.11","192.168.11.5","TCP","66","0.000115000","0.000115000","Jan  8, 2024 13:41:15.771882000 JST","","37840  >  6000 [ACK] Seq=1 Ack=1 Win=64256 Len=0 TSval=1929036796 TSecr=2817177694"
"156","62.767235","192.168.11.11","192.168.11.5","TCP","93","","0.000160000","Jan  8, 2024 13:41:15.772042000 JST","","37840  >  6000 [PSH, ACK] Seq=1 Ack=1 Win=64256 Len=27 TSval=1929036797 TSecr=2817177694 [TCP segment of a reassembled PDU]"
"157","62.767326","192.168.11.11","192.168.11.5","TCP","66","","0.000091000","Jan  8, 2024 13:41:15.772133000 JST","","37840  >  6000 [FIN, ACK] Seq=28 Ack=1 Win=64256 Len=0 TSval=1929036797 TSecr=2817177694"
"158","62.774442","192.168.11.5","192.168.11.11","TCP","66","0.007207000","0.007116000","Jan  8, 2024 13:41:15.779249000 JST","","6000  >  37840 [ACK] Seq=1 Ack=28 Win=65152 Len=0 TSval=2817177701 TSecr=1929036797"
"159","62.774813","192.168.11.5","192.168.11.11","TCP","66","0.007487000","0.000371000","Jan  8, 2024 13:41:15.779620000 JST","","6000  >  37840 [FIN, ACK] Seq=1 Ack=29 Win=65152 Len=0 TSval=2817177703 TSecr=1929036797"
"160","62.774873","192.168.11.11","192.168.11.5","TCP","66","0.000060000","0.000060000","Jan  8, 2024 13:41:15.779680000 JST","","37840  >  6000 [ACK] Seq=29 Ack=2 Win=64256 Len=0 TSval=1929036804 TSecr=2817177703"
"161","62.803153","192.168.11.11","255.255.255.255","UDP","209","","0.028280000","Jan  8, 2024 13:41:15.807960000 JST","7b2273656d616e74696373223a207b22656e74697479223a2022504944222c202262617365656e74697479223a2022616e79222c2022726f6c65223a2022707070222c20227370617469616c223a2022616e79222c202274656d706f72616c223a2022616e79227d2c20226461746170726f7065727479223a207b22666f726d6174223a2022696e616f6b615f70726f6772616d5f73616d706c655f73656d616e746963227d7d","58701  >  7000 Len=167"
"162","62.812446","192.168.11.16","192.168.11.11","TCP","74","","0.009293000","Jan  8, 2024 13:41:15.817253000 JST","","45804  >  6000 [SYN] Seq=0 Win=64240 Len=0 MSS=1460 SACK_PERM TSval=1444425089 TSecr=0 WS=128"
"163","62.812585","192.168.11.11","192.168.11.16","TCP","74","0.000139000","0.000139000","Jan  8, 2024 13:41:15.817392000 JST","","6000  >  45804 [SYN, ACK] Seq=0 Ack=1 Win=65160 Len=0 MSS=1460 SACK_PERM TSval=4236790014 TSecr=1444425089 WS=128"
"164","62.820711","192.168.11.16","192.168.11.11","TCP","66","0.008126000","0.008126000","Jan  8, 2024 13:41:15.825518000 JST","","45804  >  6000 [ACK] Seq=1 Ack=1 Win=64256 Len=0 TSval=1444425098 TSecr=4236790014"
"165","62.821440","192.168.11.16","192.168.11.11","TCP","93","","0.000729000","Jan  8, 2024 13:41:15.826247000 JST","","45804  >  6000 [PSH, ACK] Seq=1 Ack=1 Win=64256 Len=27 TSval=1444425098 TSecr=4236790014 [TCP segment of a reassembled PDU]"
"166","62.821606","192.168.11.11","192.168.11.16","TCP","66","0.000166000","0.000166000","Jan  8, 2024 13:41:15.826413000 JST","","6000  >  45804 [ACK] Seq=1 Ack=28 Win=65152 Len=0 TSval=4236790023 TSecr=1444425098"
"167","62.821700","192.168.11.16","192.168.11.11","TCP","66","","0.000094000","Jan  8, 2024 13:41:15.826507000 JST","","45804  >  6000 [FIN, ACK] Seq=28 Ack=1 Win=64256 Len=0 TSval=1444425098 TSecr=4236790014"
"168","62.822831","192.168.11.11","192.168.11.16","TCP","66","0.001131000","0.001131000","Jan  8, 2024 13:41:15.827638000 JST","","6000  >  45804 [FIN, ACK] Seq=1 Ack=29 Win=65152 Len=0 TSval=4236790024 TSecr=1444425098"
