"No.","Time","Source","Destination","Protocol","Length","The RTT to ACK the segment was","Time delta from previous captured frame","Arrival Time","Data","Info"
"1","0.000000","192.168.11.16","192.168.11.11","TCP","74","","0.000000000","Jan  8, 2024 13:40:13.122814000 JST","","54504  >  6000 [SYN] Seq=0 Win=64240 Len=0 MSS=1460 SACK_PERM TSval=1444362337 TSecr=0 WS=128"
"2","0.014353","192.168.11.11","192.168.11.16","TCP","74","0.014353000","0.014353000","Jan  8, 2024 13:40:13.137167000 JST","","6000  >  54504 [SYN, ACK] Seq=0 Ack=1 Win=65160 Len=0 MSS=1460 SACK_PERM TSval=4236727262 TSecr=1444362337 WS=128"
"3","0.014465","192.168.11.16","192.168.11.11","TCP","66","0.000112000","0.000112000","Jan  8, 2024 13:40:13.137279000 JST","","54504  >  6000 [ACK] Seq=1 Ack=1 Win=64256 Len=0 TSval=1444362352 TSecr=4236727262"
"4","0.014650","192.168.11.16","192.168.11.11","TCP","93","","0.000185000","Jan  8, 2024 13:40:13.137464000 JST","","54504  >  6000 [PSH, ACK] Seq=1 Ack=1 Win=64256 Len=27 TSval=1444362352 TSecr=4236727262 [TCP segment of a reassembled PDU]"
"5","0.014801","192.168.11.16","192.168.11.11","TCP","66","","0.000151000","Jan  8, 2024 13:40:13.137615000 JST","","54504  >  6000 [FIN, ACK] Seq=28 Ack=1 Win=64256 Len=0 TSval=1444362352 TSecr=4236727262"
"6","0.023798","192.168.11.11","192.168.11.16","TCP","66","0.009148000","0.008997000","Jan  8, 2024 13:40:13.146612000 JST","","6000  >  54504 [ACK] Seq=1 Ack=28 Win=65152 Len=0 TSval=4236727278 TSecr=1444362352"
"7","0.026027","192.168.11.11","192.168.11.16","TCP","66","0.011226000","0.002229000","Jan  8, 2024 13:40:13.148841000 JST","","6000  >  54504 [FIN, ACK] Seq=1 Ack=29 Win=65152 Len=0 TSval=4236727279 TSecr=1444362352"
"8","0.026076","192.168.11.16","192.168.11.11","TCP","66","0.000049000","0.000049000","Jan  8, 2024 13:40:13.148890000 JST","","54504  >  6000 [ACK] Seq=29 Ack=2 Win=64256 Len=0 TSval=1444362364 TSecr=4236727279"
"9","0.056151","192.168.11.16","255.255.255.255","UDP","209","","0.030075000","Jan  8, 2024 13:40:13.178965000 JST","7b2273656d616e74696373223a207b22656e74697479223a2022504944222c202262617365656e74697479223a2022616e79222c2022726f6c65223a2022717171222c20227370617469616c223a2022616e79222c202274656d706f72616c223a2022616e79227d2c20226461746170726f7065727479223a207b22666f726d6174223a2022696e616f6b615f70726f6772616d5f73616d706c655f73656d616e746963227d7d","47914  >  7000 Len=167"
"10","0.064084","192.168.11.17","192.168.11.16","TCP","74","","0.007933000","Jan  8, 2024 13:40:13.186898000 JST","","50014  >  6000 [SYN] Seq=0 Win=64240 Len=0 MSS=1460 SACK_PERM TSval=205617722 TSecr=0 WS=128"
"11","0.064248","192.168.11.16","192.168.11.17","TCP","74","0.000164000","0.000164000","Jan  8, 2024 13:40:13.187062000 JST","","6000  >  50014 [SYN, ACK] Seq=0 Ack=1 Win=65160 Len=0 MSS=1460 SACK_PERM TSval=1101595495 TSecr=205617722 WS=128"
"12","0.072054","192.168.11.17","192.168.11.16","TCP","66","0.007806000","0.007806000","Jan  8, 2024 13:40:13.194868000 JST","","50014  >  6000 [ACK] Seq=1 Ack=1 Win=64256 Len=0 TSval=205617729 TSecr=1101595495"
"13","0.072598","192.168.11.17","192.168.11.16","TCP","93","","0.000544000","Jan  8, 2024 13:40:13.195412000 JST","","50014  >  6000 [PSH, ACK] Seq=1 Ack=1 Win=64256 Len=27 TSval=205617729 TSecr=1101595495 [TCP segment of a reassembled PDU]"
"14","0.072679","192.168.11.16","192.168.11.17","TCP","66","0.000081000","0.000081000","Jan  8, 2024 13:40:13.195493000 JST","","6000  >  50014 [ACK] Seq=1 Ack=28 Win=65152 Len=0 TSval=1101595503 TSecr=205617729"
"15","0.072750","192.168.11.17","192.168.11.16","TCP","66","","0.000071000","Jan  8, 2024 13:40:13.195564000 JST","","50014  >  6000 [FIN, ACK] Seq=28 Ack=1 Win=64256 Len=0 TSval=205617729 TSecr=1101595495"
"16","0.074179","192.168.11.16","192.168.11.17","TCP","66","0.001429000","0.001429000","Jan  8, 2024 13:40:13.196993000 JST","","6000  >  50014 [FIN, ACK] Seq=1 Ack=29 Win=65152 Len=0 TSval=1101595505 TSecr=205617729"
"17","0.079452","192.168.11.17","192.168.11.16","TCP","66","0.005273000","0.005273000","Jan  8, 2024 13:40:13.202266000 JST","","50014  >  6000 [ACK] Seq=29 Ack=2 Win=64256 Len=0 TSval=205617738 TSecr=1101595505"
"18","6.913298","192.168.11.16","192.168.11.11","TCP","74","","6.833846000","Jan  8, 2024 13:40:20.036112000 JST","","37024  >  6000 [SYN] Seq=0 Win=64240 Len=0 MSS=1460 SACK_PERM TSval=1444369251 TSecr=0 WS=128"
"19","6.920754","192.168.11.11","192.168.11.16","TCP","74","0.007456000","0.007456000","Jan  8, 2024 13:40:20.043568000 JST","","6000  >  37024 [SYN, ACK] Seq=0 Ack=1 Win=65160 Len=0 MSS=1460 SACK_PERM TSval=4236734175 TSecr=1444369251 WS=128"
"20","6.920876","192.168.11.16","192.168.11.11","TCP","66","0.000122000","0.000122000","Jan  8, 2024 13:40:20.043690000 JST","","37024  >  6000 [ACK] Seq=1 Ack=1 Win=64256 Len=0 TSval=1444369258 TSecr=4236734175"
"21","6.921024","192.168.11.16","192.168.11.11","TCP","93","","0.000148000","Jan  8, 2024 13:40:20.043838000 JST","","37024  >  6000 [PSH, ACK] Seq=1 Ack=1 Win=64256 Len=27 TSval=1444369259 TSecr=4236734175 [TCP segment of a reassembled PDU]"
"22","6.921170","192.168.11.16","192.168.11.11","TCP","66","","0.000146000","Jan  8, 2024 13:40:20.043984000 JST","","37024  >  6000 [FIN, ACK] Seq=28 Ack=1 Win=64256 Len=0 TSval=1444369259 TSecr=4236734175"
"23","6.928991","192.168.11.11","192.168.11.16","TCP","66","0.007967000","0.007821000","Jan  8, 2024 13:40:20.051805000 JST","","6000  >  37024 [ACK] Seq=1 Ack=28 Win=65152 Len=0 TSval=4236734183 TSecr=1444369259"
"24","6.931350","192.168.11.11","192.168.11.16","TCP","66","0.010180000","0.002359000","Jan  8, 2024 13:40:20.054164000 JST","","6000  >  37024 [FIN, ACK] Seq=1 Ack=29 Win=65152 Len=0 TSval=4236734184 TSecr=1444369259"
"25","6.931398","192.168.11.16","192.168.11.11","TCP","66","0.000048000","0.000048000","Jan  8, 2024 13:40:20.054212000 JST","","37024  >  6000 [ACK] Seq=29 Ack=2 Win=64256 Len=0 TSval=1444369269 TSecr=4236734184"
"26","6.963927","192.168.11.16","255.255.255.255","UDP","209","","0.032529000","Jan  8, 2024 13:40:20.086741000 JST","7b2273656d616e74696373223a207b22656e74697479223a2022504944222c202262617365656e74697479223a2022616e79222c2022726f6c65223a2022717171222c20227370617469616c223a2022616e79222c202274656d706f72616c223a2022616e79227d2c20226461746170726f7065727479223a207b22666f726d6174223a2022696e616f6b615f70726f6772616d5f73616d706c655f73656d616e746963227d7d","44292  >  7000 Len=167"
"27","6.976634","192.168.11.17","192.168.11.16","TCP","74","","0.012707000","Jan  8, 2024 13:40:20.099448000 JST","","37722  >  6000 [SYN] Seq=0 Win=64240 Len=0 MSS=1460 SACK_PERM TSval=205624632 TSecr=0 WS=128"
"28","6.976845","192.168.11.16","192.168.11.17","TCP","74","0.000211000","0.000211000","Jan  8, 2024 13:40:20.099659000 JST","","6000  >  37722 [SYN, ACK] Seq=0 Ack=1 Win=65160 Len=0 MSS=1460 SACK_PERM TSval=1101602407 TSecr=205624632 WS=128"
"29","6.984234","192.168.11.17","192.168.11.16","TCP","66","0.007389000","0.007389000","Jan  8, 2024 13:40:20.107048000 JST","","37722  >  6000 [ACK] Seq=1 Ack=1 Win=64256 Len=0 TSval=205624642 TSecr=1101602407"
"30","6.985016","192.168.11.17","192.168.11.16","TCP","93","","0.000782000","Jan  8, 2024 13:40:20.107830000 JST","","37722  >  6000 [PSH, ACK] Seq=1 Ack=1 Win=64256 Len=27 TSval=205624642 TSecr=1101602407 [TCP segment of a reassembled PDU]"
"31","6.985231","192.168.11.16","192.168.11.17","TCP","66","0.000215000","0.000215000","Jan  8, 2024 13:40:20.108045000 JST","","6000  >  37722 [ACK] Seq=1 Ack=28 Win=65152 Len=0 TSval=1101602416 TSecr=205624642"
"32","6.985334","192.168.11.17","192.168.11.16","TCP","66","","0.000103000","Jan  8, 2024 13:40:20.108148000 JST","","37722  >  6000 [FIN, ACK] Seq=28 Ack=1 Win=64256 Len=0 TSval=205624642 TSecr=1101602407"
"33","6.987116","192.168.11.16","192.168.11.17","TCP","66","0.001782000","0.001782000","Jan  8, 2024 13:40:20.109930000 JST","","6000  >  37722 [FIN, ACK] Seq=1 Ack=29 Win=65152 Len=0 TSval=1101602418 TSecr=205624642"
"34","6.992771","192.168.11.17","192.168.11.16","TCP","66","0.005655000","0.005655000","Jan  8, 2024 13:40:20.115585000 JST","","37722  >  6000 [ACK] Seq=29 Ack=2 Win=64256 Len=0 TSval=205624650 TSecr=1101602418"
"35","13.680192","192.168.11.16","192.168.11.11","TCP","74","","6.687421000","Jan  8, 2024 13:40:26.803006000 JST","","45818  >  6000 [SYN] Seq=0 Win=64240 Len=0 MSS=1460 SACK_PERM TSval=1444376018 TSecr=0 WS=128"
"36","13.688707","192.168.11.11","192.168.11.16","TCP","74","0.008515000","0.008515000","Jan  8, 2024 13:40:26.811521000 JST","","6000  >  45818 [SYN, ACK] Seq=0 Ack=1 Win=65160 Len=0 MSS=1460 SACK_PERM TSval=4236740943 TSecr=1444376018 WS=128"
"37","13.688820","192.168.11.16","192.168.11.11","TCP","66","0.000113000","0.000113000","Jan  8, 2024 13:40:26.811634000 JST","","45818  >  6000 [ACK] Seq=1 Ack=1 Win=64256 Len=0 TSval=1444376026 TSecr=4236740943"
"38","13.688962","192.168.11.16","192.168.11.11","TCP","93","","0.000142000","Jan  8, 2024 13:40:26.811776000 JST","","45818  >  6000 [PSH, ACK] Seq=1 Ack=1 Win=64256 Len=27 TSval=1444376026 TSecr=4236740943 [TCP segment of a reassembled PDU]"
"39","13.689069","192.168.11.16","192.168.11.11","TCP","66","","0.000107000","Jan  8, 2024 13:40:26.811883000 JST","","45818  >  6000 [FIN, ACK] Seq=28 Ack=1 Win=64256 Len=0 TSval=1444376027 TSecr=4236740943"
"40","13.697323","192.168.11.11","192.168.11.16","TCP","66","0.008361000","0.008254000","Jan  8, 2024 13:40:26.820137000 JST","","6000  >  45818 [ACK] Seq=1 Ack=28 Win=65152 Len=0 TSval=4236740951 TSecr=1444376026"
"41","13.697564","192.168.11.11","192.168.11.16","TCP","66","0.008495000","0.000241000","Jan  8, 2024 13:40:26.820378000 JST","","6000  >  45818 [FIN, ACK] Seq=1 Ack=29 Win=65152 Len=0 TSval=4236740952 TSecr=1444376027"
"42","13.697620","192.168.11.16","192.168.11.11","TCP","66","0.000056000","0.000056000","Jan  8, 2024 13:40:26.820434000 JST","","45818  >  6000 [ACK] Seq=29 Ack=2 Win=64256 Len=0 TSval=1444376035 TSecr=4236740952"
"43","13.727547","192.168.11.16","255.255.255.255","UDP","209","","0.029927000","Jan  8, 2024 13:40:26.850361000 JST","7b2273656d616e74696373223a207b22656e74697479223a2022504944222c202262617365656e74697479223a2022616e79222c2022726f6c65223a2022717171222c20227370617469616c223a2022616e79222c202274656d706f72616c223a2022616e79227d2c20226461746170726f7065727479223a207b22666f726d6174223a2022696e616f6b615f70726f6772616d5f73616d706c655f73656d616e746963227d7d","43163  >  7000 Len=167"
"44","14.729646","192.168.11.16","255.255.255.255","UDP","209","","1.002099000","Jan  8, 2024 13:40:27.852460000 JST","7b2273656d616e74696373223a207b22656e74697479223a2022504944222c202262617365656e74697479223a2022616e79222c2022726f6c65223a2022717171222c20227370617469616c223a2022616e79222c202274656d706f72616c223a2022616e79227d2c20226461746170726f7065727479223a207b22666f726d6174223a2022696e616f6b615f70726f6772616d5f73616d706c655f73656d616e746963227d7d","43163  >  7000 Len=167"
"45","14.738827","192.168.11.17","192.168.11.16","TCP","74","","0.009181000","Jan  8, 2024 13:40:27.861641000 JST","","37724  >  6000 [SYN] Seq=0 Win=64240 Len=0 MSS=1460 SACK_PERM TSval=205632397 TSecr=0 WS=128"
"46","14.738959","192.168.11.16","192.168.11.17","TCP","74","0.000132000","0.000132000","Jan  8, 2024 13:40:27.861773000 JST","","6000  >  37724 [SYN, ACK] Seq=0 Ack=1 Win=65160 Len=0 MSS=1460 SACK_PERM TSval=1101610169 TSecr=205632397 WS=128"
"47","14.745873","192.168.11.17","192.168.11.16","TCP","66","0.006914000","0.006914000","Jan  8, 2024 13:40:27.868687000 JST","","37724  >  6000 [ACK] Seq=1 Ack=1 Win=64256 Len=0 TSval=205632404 TSecr=1101610169"
"48","14.746367","192.168.11.17","192.168.11.16","TCP","93","","0.000494000","Jan  8, 2024 13:40:27.869181000 JST","","37724  >  6000 [PSH, ACK] Seq=1 Ack=1 Win=64256 Len=27 TSval=205632404 TSecr=1101610169 [TCP segment of a reassembled PDU]"
"49","14.746440","192.168.11.16","192.168.11.17","TCP","66","0.000073000","0.000073000","Jan  8, 2024 13:40:27.869254000 JST","","6000  >  37724 [ACK] Seq=1 Ack=28 Win=65152 Len=0 TSval=1101610177 TSecr=205632404"
"50","14.746512","192.168.11.17","192.168.11.16","TCP","66","","0.000072000","Jan  8, 2024 13:40:27.869326000 JST","","37724  >  6000 [FIN, ACK] Seq=28 Ack=1 Win=64256 Len=0 TSval=205632404 TSecr=1101610169"
"51","14.747486","192.168.11.16","192.168.11.17","TCP","66","0.000974000","0.000974000","Jan  8, 2024 13:40:27.870300000 JST","","6000  >  37724 [FIN, ACK] Seq=1 Ack=29 Win=65152 Len=0 TSval=1101610178 TSecr=205632404"
"52","14.757193","192.168.11.17","192.168.11.16","TCP","66","0.009707000","0.009707000","Jan  8, 2024 13:40:27.880007000 JST","","37724  >  6000 [ACK] Seq=29 Ack=2 Win=64256 Len=0 TSval=205632415 TSecr=1101610178"
"53","21.363474","192.168.11.16","192.168.11.11","TCP","74","","6.606281000","Jan  8, 2024 13:40:34.486288000 JST","","45828  >  6000 [SYN] Seq=0 Win=64240 Len=0 MSS=1460 SACK_PERM TSval=1444383701 TSecr=0 WS=128"
"54","21.373163","192.168.11.11","192.168.11.16","TCP","74","0.009689000","0.009689000","Jan  8, 2024 13:40:34.495977000 JST","","6000  >  45828 [SYN, ACK] Seq=0 Ack=1 Win=65160 Len=0 MSS=1460 SACK_PERM TSval=4236748626 TSecr=1444383701 WS=128"
"55","21.373274","192.168.11.16","192.168.11.11","TCP","66","0.000111000","0.000111000","Jan  8, 2024 13:40:34.496088000 JST","","45828  >  6000 [ACK] Seq=1 Ack=1 Win=64256 Len=0 TSval=1444383711 TSecr=4236748626"
"56","21.373454","192.168.11.16","192.168.11.11","TCP","93","","0.000180000","Jan  8, 2024 13:40:34.496268000 JST","","45828  >  6000 [PSH, ACK] Seq=1 Ack=1 Win=64256 Len=27 TSval=1444383711 TSecr=4236748626 [TCP segment of a reassembled PDU]"
"57","21.373547","192.168.11.16","192.168.11.11","TCP","66","","0.000093000","Jan  8, 2024 13:40:34.496361000 JST","","45828  >  6000 [FIN, ACK] Seq=28 Ack=1 Win=64256 Len=0 TSval=1444383711 TSecr=4236748626"
"58","21.381434","192.168.11.11","192.168.11.16","TCP","66","0.007980000","0.007887000","Jan  8, 2024 13:40:34.504248000 JST","","6000  >  45828 [ACK] Seq=1 Ack=28 Win=65152 Len=0 TSval=4236748635 TSecr=1444383711"
"59","21.383841","192.168.11.11","192.168.11.16","TCP","66","0.010294000","0.002407000","Jan  8, 2024 13:40:34.506655000 JST","","6000  >  45828 [FIN, ACK] Seq=1 Ack=29 Win=65152 Len=0 TSval=4236748637 TSecr=1444383711"
"60","21.383887","192.168.11.16","192.168.11.11","TCP","66","0.000046000","0.000046000","Jan  8, 2024 13:40:34.506701000 JST","","45828  >  6000 [ACK] Seq=29 Ack=2 Win=64256 Len=0 TSval=1444383721 TSecr=4236748637"
"61","21.414400","192.168.11.16","255.255.255.255","UDP","209","","0.030513000","Jan  8, 2024 13:40:34.537214000 JST","7b2273656d616e74696373223a207b22656e74697479223a2022504944222c202262617365656e74697479223a2022616e79222c2022726f6c65223a2022717171222c20227370617469616c223a2022616e79222c202274656d706f72616c223a2022616e79227d2c20226461746170726f7065727479223a207b22666f726d6174223a2022696e616f6b615f70726f6772616d5f73616d706c655f73656d616e746963227d7d","57190  >  7000 Len=167"
"62","21.422393","192.168.11.17","192.168.11.16","TCP","74","","0.007993000","Jan  8, 2024 13:40:34.545207000 JST","","42526  >  6000 [SYN] Seq=0 Win=64240 Len=0 MSS=1460 SACK_PERM TSval=205639080 TSecr=0 WS=128"
"63","21.422541","192.168.11.16","192.168.11.17","TCP","74","0.000148000","0.000148000","Jan  8, 2024 13:40:34.545355000 JST","","6000  >  42526 [SYN, ACK] Seq=0 Ack=1 Win=65160 Len=0 MSS=1460 SACK_PERM TSval=1101616853 TSecr=205639080 WS=128"
"64","21.429216","192.168.11.17","192.168.11.16","TCP","66","0.006675000","0.006675000","Jan  8, 2024 13:40:34.552030000 JST","","42526  >  6000 [ACK] Seq=1 Ack=1 Win=64256 Len=0 TSval=205639087 TSecr=1101616853"
"65","21.429746","192.168.11.17","192.168.11.16","TCP","93","","0.000530000","Jan  8, 2024 13:40:34.552560000 JST","","42526  >  6000 [PSH, ACK] Seq=1 Ack=1 Win=64256 Len=27 TSval=205639087 TSecr=1101616853 [TCP segment of a reassembled PDU]"
"66","21.429834","192.168.11.16","192.168.11.17","TCP","66","0.000088000","0.000088000","Jan  8, 2024 13:40:34.552648000 JST","","6000  >  42526 [ACK] Seq=1 Ack=28 Win=65152 Len=0 TSval=1101616860 TSecr=205639087"
"67","21.429908","192.168.11.17","192.168.11.16","TCP","66","","0.000074000","Jan  8, 2024 13:40:34.552722000 JST","","42526  >  6000 [FIN, ACK] Seq=28 Ack=1 Win=64256 Len=0 TSval=205639087 TSecr=1101616853"
"68","21.431153","192.168.11.16","192.168.11.17","TCP","66","0.001245000","0.001245000","Jan  8, 2024 13:40:34.553967000 JST","","6000  >  42526 [FIN, ACK] Seq=1 Ack=29 Win=65152 Len=0 TSval=1101616862 TSecr=205639087"
"69","21.437342","192.168.11.17","192.168.11.16","TCP","66","0.006189000","0.006189000","Jan  8, 2024 13:40:34.560156000 JST","","42526  >  6000 [ACK] Seq=29 Ack=2 Win=64256 Len=0 TSval=205639095 TSecr=1101616862"
"70","29.129844","192.168.11.16","192.168.11.11","TCP","74","","7.692502000","Jan  8, 2024 13:40:42.252658000 JST","","59672  >  6000 [SYN] Seq=0 Win=64240 Len=0 MSS=1460 SACK_PERM TSval=1444391467 TSecr=0 WS=128"
"71","29.138586","192.168.11.11","192.168.11.16","TCP","74","0.008742000","0.008742000","Jan  8, 2024 13:40:42.261400000 JST","","6000  >  59672 [SYN, ACK] Seq=0 Ack=1 Win=65160 Len=0 MSS=1460 SACK_PERM TSval=4236756392 TSecr=1444391467 WS=128"
"72","29.138706","192.168.11.16","192.168.11.11","TCP","66","0.000120000","0.000120000","Jan  8, 2024 13:40:42.261520000 JST","","59672  >  6000 [ACK] Seq=1 Ack=1 Win=64256 Len=0 TSval=1444391476 TSecr=4236756392"
"73","29.138926","192.168.11.16","192.168.11.11","TCP","93","","0.000220000","Jan  8, 2024 13:40:42.261740000 JST","","59672  >  6000 [PSH, ACK] Seq=1 Ack=1 Win=64256 Len=27 TSval=1444391476 TSecr=4236756392 [TCP segment of a reassembled PDU]"
"74","29.139036","192.168.11.16","192.168.11.11","TCP","66","","0.000110000","Jan  8, 2024 13:40:42.261850000 JST","","59672  >  6000 [FIN, ACK] Seq=28 Ack=1 Win=64256 Len=0 TSval=1444391477 TSecr=4236756392"
"75","29.146804","192.168.11.11","192.168.11.16","TCP","66","0.007878000","0.007768000","Jan  8, 2024 13:40:42.269618000 JST","","6000  >  59672 [ACK] Seq=1 Ack=28 Win=65152 Len=0 TSval=4236756401 TSecr=1444391476"
"76","29.150469","192.168.11.11","192.168.11.16","TCP","66","0.011433000","0.003665000","Jan  8, 2024 13:40:42.273283000 JST","","6000  >  59672 [FIN, ACK] Seq=1 Ack=29 Win=65152 Len=0 TSval=4236756403 TSecr=1444391477"
"77","29.150531","192.168.11.16","192.168.11.11","TCP","66","0.000062000","0.000062000","Jan  8, 2024 13:40:42.273345000 JST","","59672  >  6000 [ACK] Seq=29 Ack=2 Win=64256 Len=0 TSval=1444391488 TSecr=4236756403"
"78","29.182034","192.168.11.16","255.255.255.255","UDP","209","","0.031503000","Jan  8, 2024 13:40:42.304848000 JST","7b2273656d616e74696373223a207b22656e74697479223a2022504944222c202262617365656e74697479223a2022616e79222c2022726f6c65223a2022717171222c20227370617469616c223a2022616e79222c202274656d706f72616c223a2022616e79227d2c20226461746170726f7065727479223a207b22666f726d6174223a2022696e616f6b615f70726f6772616d5f73616d706c655f73656d616e746963227d7d","44804  >  7000 Len=167"
"79","29.191559","192.168.11.17","192.168.11.16","TCP","74","","0.009525000","Jan  8, 2024 13:40:42.314373000 JST","","36700  >  6000 [SYN] Seq=0 Win=64240 Len=0 MSS=1460 SACK_PERM TSval=205646847 TSecr=0 WS=128"
"80","29.191703","192.168.11.16","192.168.11.17","TCP","74","0.000144000","0.000144000","Jan  8, 2024 13:40:42.314517000 JST","","6000  >  36700 [SYN, ACK] Seq=0 Ack=1 Win=65160 Len=0 MSS=1460 SACK_PERM TSval=1101624622 TSecr=205646847 WS=128"
"81","29.203783","192.168.11.17","192.168.11.16","TCP","66","0.012080000","0.012080000","Jan  8, 2024 13:40:42.326597000 JST","","36700  >  6000 [ACK] Seq=1 Ack=1 Win=64256 Len=0 TSval=205646861 TSecr=1101624622"
"82","29.204372","192.168.11.17","192.168.11.16","TCP","93","","0.000589000","Jan  8, 2024 13:40:42.327186000 JST","","36700  >  6000 [PSH, ACK] Seq=1 Ack=1 Win=64256 Len=27 TSval=205646861 TSecr=1101624622 [TCP segment of a reassembled PDU]"
"83","29.204453","192.168.11.16","192.168.11.17","TCP","66","0.000081000","0.000081000","Jan  8, 2024 13:40:42.327267000 JST","","6000  >  36700 [ACK] Seq=1 Ack=28 Win=65152 Len=0 TSval=1101624635 TSecr=205646861"
"84","29.204524","192.168.11.17","192.168.11.16","TCP","66","","0.000071000","Jan  8, 2024 13:40:42.327338000 JST","","36700  >  6000 [FIN, ACK] Seq=28 Ack=1 Win=64256 Len=0 TSval=205646861 TSecr=1101624622"
"85","29.205962","192.168.11.16","192.168.11.17","TCP","66","0.001438000","0.001438000","Jan  8, 2024 13:40:42.328776000 JST","","6000  >  36700 [FIN, ACK] Seq=1 Ack=29 Win=65152 Len=0 TSval=1101624636 TSecr=205646861"
"86","29.210838","192.168.11.17","192.168.11.16","TCP","66","0.004876000","0.004876000","Jan  8, 2024 13:40:42.333652000 JST","","36700  >  6000 [ACK] Seq=29 Ack=2 Win=64256 Len=0 TSval=205646869 TSecr=1101624636"
"87","35.851498","192.168.11.16","192.168.11.11","TCP","74","","6.640660000","Jan  8, 2024 13:40:48.974312000 JST","","43290  >  6000 [SYN] Seq=0 Win=64240 Len=0 MSS=1460 SACK_PERM TSval=1444398189 TSecr=0 WS=128"
"88","35.862429","192.168.11.11","192.168.11.16","TCP","74","0.010931000","0.010931000","Jan  8, 2024 13:40:48.985243000 JST","","6000  >  43290 [SYN, ACK] Seq=0 Ack=1 Win=65160 Len=0 MSS=1460 SACK_PERM TSval=4236763114 TSecr=1444398189 WS=128"
"89","35.862529","192.168.11.16","192.168.11.11","TCP","66","0.000100000","0.000100000","Jan  8, 2024 13:40:48.985343000 JST","","43290  >  6000 [ACK] Seq=1 Ack=1 Win=64256 Len=0 TSval=1444398200 TSecr=4236763114"
"90","35.862699","192.168.11.16","192.168.11.11","TCP","93","","0.000170000","Jan  8, 2024 13:40:48.985513000 JST","","43290  >  6000 [PSH, ACK] Seq=1 Ack=1 Win=64256 Len=27 TSval=1444398200 TSecr=4236763114 [TCP segment of a reassembled PDU]"
"91","35.862789","192.168.11.16","192.168.11.11","TCP","66","","0.000090000","Jan  8, 2024 13:40:48.985603000 JST","","43290  >  6000 [FIN, ACK] Seq=28 Ack=1 Win=64256 Len=0 TSval=1444398200 TSecr=4236763114"
"92","35.871471","192.168.11.11","192.168.11.16","TCP","66","0.008772000","0.008682000","Jan  8, 2024 13:40:48.994285000 JST","","6000  >  43290 [ACK] Seq=1 Ack=28 Win=65152 Len=0 TSval=4236763124 TSecr=1444398200"
"93","35.873306","192.168.11.11","192.168.11.16","TCP","66","0.010517000","0.001835000","Jan  8, 2024 13:40:48.996120000 JST","","6000  >  43290 [FIN, ACK] Seq=1 Ack=29 Win=65152 Len=0 TSval=4236763127 TSecr=1444398200"
"94","35.873352","192.168.11.16","192.168.11.11","TCP","66","0.000046000","0.000046000","Jan  8, 2024 13:40:48.996166000 JST","","43290  >  6000 [ACK] Seq=29 Ack=2 Win=64256 Len=0 TSval=1444398211 TSecr=4236763127"
"95","35.904982","192.168.11.16","255.255.255.255","UDP","209","","0.031630000","Jan  8, 2024 13:40:49.027796000 JST","7b2273656d616e74696373223a207b22656e74697479223a2022504944222c202262617365656e74697479223a2022616e79222c2022726f6c65223a2022717171222c20227370617469616c223a2022616e79222c202274656d706f72616c223a2022616e79227d2c20226461746170726f7065727479223a207b22666f726d6174223a2022696e616f6b615f70726f6772616d5f73616d706c655f73656d616e746963227d7d","54009  >  7000 Len=167"
"96","35.912538","192.168.11.17","192.168.11.16","TCP","74","","0.007556000","Jan  8, 2024 13:40:49.035352000 JST","","36702  >  6000 [SYN] Seq=0 Win=64240 Len=0 MSS=1460 SACK_PERM TSval=205653570 TSecr=0 WS=128"
"97","35.912673","192.168.11.16","192.168.11.17","TCP","74","0.000135000","0.000135000","Jan  8, 2024 13:40:49.035487000 JST","","6000  >  36702 [SYN, ACK] Seq=0 Ack=1 Win=65160 Len=0 MSS=1460 SACK_PERM TSval=1101631343 TSecr=205653570 WS=128"
"98","35.919504","192.168.11.17","192.168.11.16","TCP","66","0.006831000","0.006831000","Jan  8, 2024 13:40:49.042318000 JST","","36702  >  6000 [ACK] Seq=1 Ack=1 Win=64256 Len=0 TSval=205653577 TSecr=1101631343"
"99","35.920099","192.168.11.17","192.168.11.16","TCP","93","","0.000595000","Jan  8, 2024 13:40:49.042913000 JST","","36702  >  6000 [PSH, ACK] Seq=1 Ack=1 Win=64256 Len=27 TSval=205653577 TSecr=1101631343 [TCP segment of a reassembled PDU]"
"100","35.920181","192.168.11.16","192.168.11.17","TCP","66","0.000082000","0.000082000","Jan  8, 2024 13:40:49.042995000 JST","","6000  >  36702 [ACK] Seq=1 Ack=28 Win=65152 Len=0 TSval=1101631351 TSecr=205653577"
"101","35.920253","192.168.11.17","192.168.11.16","TCP","66","","0.000072000","Jan  8, 2024 13:40:49.043067000 JST","","36702  >  6000 [FIN, ACK] Seq=28 Ack=1 Win=64256 Len=0 TSval=205653577 TSecr=1101631343"
"102","35.921576","192.168.11.16","192.168.11.17","TCP","66","0.001323000","0.001323000","Jan  8, 2024 13:40:49.044390000 JST","","6000  >  36702 [FIN, ACK] Seq=1 Ack=29 Win=65152 Len=0 TSval=1101631352 TSecr=205653577"
"103","35.927327","192.168.11.17","192.168.11.16","TCP","66","0.005751000","0.005751000","Jan  8, 2024 13:40:49.050141000 JST","","36702  >  6000 [ACK] Seq=29 Ack=2 Win=64256 Len=0 TSval=205653585 TSecr=1101631352"
"104","42.615145","192.168.11.16","192.168.11.11","TCP","74","","6.687818000","Jan  8, 2024 13:40:55.737959000 JST","","43294  >  6000 [SYN] Seq=0 Win=64240 Len=0 MSS=1460 SACK_PERM TSval=1444404953 TSecr=0 WS=128"
"105","42.623479","192.168.11.11","192.168.11.16","TCP","74","0.008334000","0.008334000","Jan  8, 2024 13:40:55.746293000 JST","","6000  >  43294 [SYN, ACK] Seq=0 Ack=1 Win=65160 Len=0 MSS=1460 SACK_PERM TSval=4236769876 TSecr=1444404953 WS=128"
"106","42.623579","192.168.11.16","192.168.11.11","TCP","66","0.000100000","0.000100000","Jan  8, 2024 13:40:55.746393000 JST","","43294  >  6000 [ACK] Seq=1 Ack=1 Win=64256 Len=0 TSval=1444404961 TSecr=4236769876"
"107","42.623754","192.168.11.16","192.168.11.11","TCP","93","","0.000175000","Jan  8, 2024 13:40:55.746568000 JST","","43294  >  6000 [PSH, ACK] Seq=1 Ack=1 Win=64256 Len=27 TSval=1444404961 TSecr=4236769876 [TCP segment of a reassembled PDU]"
"108","42.623842","192.168.11.16","192.168.11.11","TCP","66","","0.000088000","Jan  8, 2024 13:40:55.746656000 JST","","43294  >  6000 [FIN, ACK] Seq=28 Ack=1 Win=64256 Len=0 TSval=1444404961 TSecr=4236769876"
"109","42.633027","192.168.11.11","192.168.11.16","TCP","66","0.009273000","0.009185000","Jan  8, 2024 13:40:55.755841000 JST","","6000  >  43294 [ACK] Seq=1 Ack=28 Win=65152 Len=0 TSval=4236769886 TSecr=1444404961"
"110","42.633271","192.168.11.11","192.168.11.16","TCP","66","0.009429000","0.000244000","Jan  8, 2024 13:40:55.756085000 JST","","6000  >  43294 [FIN, ACK] Seq=1 Ack=29 Win=65152 Len=0 TSval=4236769888 TSecr=1444404961"
"111","42.633315","192.168.11.16","192.168.11.11","TCP","66","0.000044000","0.000044000","Jan  8, 2024 13:40:55.756129000 JST","","43294  >  6000 [ACK] Seq=29 Ack=2 Win=64256 Len=0 TSval=1444404971 TSecr=4236769888"
"112","42.662179","192.168.11.16","255.255.255.255","UDP","209","","0.028864000","Jan  8, 2024 13:40:55.784993000 JST","7b2273656d616e74696373223a207b22656e74697479223a2022504944222c202262617365656e74697479223a2022616e79222c2022726f6c65223a2022717171222c20227370617469616c223a2022616e79222c202274656d706f72616c223a2022616e79227d2c20226461746170726f7065727479223a207b22666f726d6174223a2022696e616f6b615f70726f6772616d5f73616d706c655f73656d616e746963227d7d","57688  >  7000 Len=167"
"113","42.669523","192.168.11.17","192.168.11.16","TCP","74","","0.007344000","Jan  8, 2024 13:40:55.792337000 JST","","45022  >  6000 [SYN] Seq=0 Win=64240 Len=0 MSS=1460 SACK_PERM TSval=205660327 TSecr=0 WS=128"
"114","42.669629","192.168.11.16","192.168.11.17","TCP","74","0.000106000","0.000106000","Jan  8, 2024 13:40:55.792443000 JST","","6000  >  45022 [SYN, ACK] Seq=0 Ack=1 Win=65160 Len=0 MSS=1460 SACK_PERM TSval=1101638100 TSecr=205660327 WS=128"
"115","42.676230","192.168.11.17","192.168.11.16","TCP","66","0.006601000","0.006601000","Jan  8, 2024 13:40:55.799044000 JST","","45022  >  6000 [ACK] Seq=1 Ack=1 Win=64256 Len=0 TSval=205660334 TSecr=1101638100"
"116","42.676773","192.168.11.17","192.168.11.16","TCP","93","","0.000543000","Jan  8, 2024 13:40:55.799587000 JST","","45022  >  6000 [PSH, ACK] Seq=1 Ack=1 Win=64256 Len=27 TSval=205660334 TSecr=1101638100 [TCP segment of a reassembled PDU]"
"117","42.676838","192.168.11.16","192.168.11.17","TCP","66","0.000065000","0.000065000","Jan  8, 2024 13:40:55.799652000 JST","","6000  >  45022 [ACK] Seq=1 Ack=28 Win=65152 Len=0 TSval=1101638107 TSecr=205660334"
"118","42.676905","192.168.11.17","192.168.11.16","TCP","66","","0.000067000","Jan  8, 2024 13:40:55.799719000 JST","","45022  >  6000 [FIN, ACK] Seq=28 Ack=1 Win=64256 Len=0 TSval=205660334 TSecr=1101638100"
"119","42.678058","192.168.11.16","192.168.11.17","TCP","66","0.001153000","0.001153000","Jan  8, 2024 13:40:55.800872000 JST","","6000  >  45022 [FIN, ACK] Seq=1 Ack=29 Win=65152 Len=0 TSval=1101638109 TSecr=205660334"
"120","42.684602","192.168.11.17","192.168.11.16","TCP","66","0.006544000","0.006544000","Jan  8, 2024 13:40:55.807416000 JST","","45022  >  6000 [ACK] Seq=29 Ack=2 Win=64256 Len=0 TSval=205660342 TSecr=1101638109"
"121","49.360386","192.168.11.16","192.168.11.11","TCP","74","","6.675784000","Jan  8, 2024 13:41:02.483200000 JST","","43670  >  6000 [SYN] Seq=0 Win=64240 Len=0 MSS=1460 SACK_PERM TSval=1444411698 TSecr=0 WS=128"
"122","49.370719","192.168.11.11","192.168.11.16","TCP","74","0.010333000","0.010333000","Jan  8, 2024 13:41:02.493533000 JST","","6000  >  43670 [SYN, ACK] Seq=0 Ack=1 Win=65160 Len=0 MSS=1460 SACK_PERM TSval=4236776622 TSecr=1444411698 WS=128"
"123","49.370814","192.168.11.16","192.168.11.11","TCP","66","0.000095000","0.000095000","Jan  8, 2024 13:41:02.493628000 JST","","43670  >  6000 [ACK] Seq=1 Ack=1 Win=64256 Len=0 TSval=1444411708 TSecr=4236776622"
"124","49.370970","192.168.11.16","192.168.11.11","TCP","93","","0.000156000","Jan  8, 2024 13:41:02.493784000 JST","","43670  >  6000 [PSH, ACK] Seq=1 Ack=1 Win=64256 Len=27 TSval=1444411709 TSecr=4236776622 [TCP segment of a reassembled PDU]"
"125","49.371067","192.168.11.16","192.168.11.11","TCP","66","","0.000097000","Jan  8, 2024 13:41:02.493881000 JST","","43670  >  6000 [FIN, ACK] Seq=28 Ack=1 Win=64256 Len=0 TSval=1444411709 TSecr=4236776622"
"126","49.379520","192.168.11.11","192.168.11.16","TCP","66","0.008550000","0.008453000","Jan  8, 2024 13:41:02.502334000 JST","","6000  >  43670 [ACK] Seq=1 Ack=28 Win=65152 Len=0 TSval=4236776633 TSecr=1444411709"
"127","49.382021","192.168.11.11","192.168.11.16","TCP","66","0.010954000","0.002501000","Jan  8, 2024 13:41:02.504835000 JST","","6000  >  43670 [FIN, ACK] Seq=1 Ack=29 Win=65152 Len=0 TSval=4236776635 TSecr=1444411709"
"128","49.382064","192.168.11.16","192.168.11.11","TCP","66","0.000043000","0.000043000","Jan  8, 2024 13:41:02.504878000 JST","","43670  >  6000 [ACK] Seq=29 Ack=2 Win=64256 Len=0 TSval=1444411720 TSecr=4236776635"
"129","49.412919","192.168.11.16","255.255.255.255","UDP","209","","0.030855000","Jan  8, 2024 13:41:02.535733000 JST","7b2273656d616e74696373223a207b22656e74697479223a2022504944222c202262617365656e74697479223a2022616e79222c2022726f6c65223a2022717171222c20227370617469616c223a2022616e79222c202274656d706f72616c223a2022616e79227d2c20226461746170726f7065727479223a207b22666f726d6174223a2022696e616f6b615f70726f6772616d5f73616d706c655f73656d616e746963227d7d","37458  >  7000 Len=167"
"130","49.420284","192.168.11.17","192.168.11.16","TCP","74","","0.007365000","Jan  8, 2024 13:41:02.543098000 JST","","50378  >  6000 [SYN] Seq=0 Win=64240 Len=0 MSS=1460 SACK_PERM TSval=205667078 TSecr=0 WS=128"
"131","49.420407","192.168.11.16","192.168.11.17","TCP","74","0.000123000","0.000123000","Jan  8, 2024 13:41:02.543221000 JST","","6000  >  50378 [SYN, ACK] Seq=0 Ack=1 Win=65160 Len=0 MSS=1460 SACK_PERM TSval=1101644851 TSecr=205667078 WS=128"
"132","49.427050","192.168.11.17","192.168.11.16","TCP","66","0.006643000","0.006643000","Jan  8, 2024 13:41:02.549864000 JST","","50378  >  6000 [ACK] Seq=1 Ack=1 Win=64256 Len=0 TSval=205667085 TSecr=1101644851"
"133","49.427405","192.168.11.17","192.168.11.16","TCP","93","","0.000355000","Jan  8, 2024 13:41:02.550219000 JST","","50378  >  6000 [PSH, ACK] Seq=1 Ack=1 Win=64256 Len=27 TSval=205667085 TSecr=1101644851 [TCP segment of a reassembled PDU]"
"134","49.427471","192.168.11.16","192.168.11.17","TCP","66","0.000066000","0.000066000","Jan  8, 2024 13:41:02.550285000 JST","","6000  >  50378 [ACK] Seq=1 Ack=28 Win=65152 Len=0 TSval=1101644858 TSecr=205667085"
"135","49.427692","192.168.11.17","192.168.11.16","TCP","66","","0.000221000","Jan  8, 2024 13:41:02.550506000 JST","","50378  >  6000 [FIN, ACK] Seq=28 Ack=1 Win=64256 Len=0 TSval=205667085 TSecr=1101644851"
"136","49.428840","192.168.11.16","192.168.11.17","TCP","66","0.001148000","0.001148000","Jan  8, 2024 13:41:02.551654000 JST","","6000  >  50378 [FIN, ACK] Seq=1 Ack=29 Win=65152 Len=0 TSval=1101644859 TSecr=205667085"
"137","49.434872","192.168.11.17","192.168.11.16","TCP","66","0.006032000","0.006032000","Jan  8, 2024 13:41:02.557686000 JST","","50378  >  6000 [ACK] Seq=29 Ack=2 Win=64256 Len=0 TSval=205667092 TSecr=1101644859"
"138","56.071115","192.168.11.16","192.168.11.11","TCP","74","","6.636243000","Jan  8, 2024 13:41:09.193929000 JST","","45802  >  6000 [SYN] Seq=0 Win=64240 Len=0 MSS=1460 SACK_PERM TSval=1444418409 TSecr=0 WS=128"
"139","56.080100","192.168.11.11","192.168.11.16","TCP","74","0.008985000","0.008985000","Jan  8, 2024 13:41:09.202914000 JST","","6000  >  45802 [SYN, ACK] Seq=0 Ack=1 Win=65160 Len=0 MSS=1460 SACK_PERM TSval=4236783333 TSecr=1444418409 WS=128"
"140","56.080202","192.168.11.16","192.168.11.11","TCP","66","0.000102000","0.000102000","Jan  8, 2024 13:41:09.203016000 JST","","45802  >  6000 [ACK] Seq=1 Ack=1 Win=64256 Len=0 TSval=1444418418 TSecr=4236783333"
"141","56.080367","192.168.11.16","192.168.11.11","TCP","93","","0.000165000","Jan  8, 2024 13:41:09.203181000 JST","","45802  >  6000 [PSH, ACK] Seq=1 Ack=1 Win=64256 Len=27 TSval=1444418418 TSecr=4236783333 [TCP segment of a reassembled PDU]"
"142","56.080468","192.168.11.16","192.168.11.11","TCP","66","","0.000101000","Jan  8, 2024 13:41:09.203282000 JST","","45802  >  6000 [FIN, ACK] Seq=28 Ack=1 Win=64256 Len=0 TSval=1444418418 TSecr=4236783333"
"143","56.092606","192.168.11.11","192.168.11.16","TCP","66","0.012239000","0.012138000","Jan  8, 2024 13:41:09.215420000 JST","","6000  >  45802 [ACK] Seq=1 Ack=28 Win=65152 Len=0 TSval=4236783346 TSecr=1444418418"
"144","56.092822","192.168.11.11","192.168.11.16","TCP","66","0.012354000","0.000216000","Jan  8, 2024 13:41:09.215636000 JST","","6000  >  45802 [FIN, ACK] Seq=1 Ack=29 Win=65152 Len=0 TSval=4236783347 TSecr=1444418418"
"145","56.092856","192.168.11.16","192.168.11.11","TCP","66","0.000034000","0.000034000","Jan  8, 2024 13:41:09.215670000 JST","","45802  >  6000 [ACK] Seq=29 Ack=2 Win=64256 Len=0 TSval=1444418430 TSecr=4236783347"
"146","56.112917","192.168.11.16","255.255.255.255","UDP","209","","0.020061000","Jan  8, 2024 13:41:09.235731000 JST","7b2273656d616e74696373223a207b22656e74697479223a2022504944222c202262617365656e74697479223a2022616e79222c2022726f6c65223a2022717171222c20227370617469616c223a2022616e79222c202274656d706f72616c223a2022616e79227d2c20226461746170726f7065727479223a207b22666f726d6174223a2022696e616f6b615f70726f6772616d5f73616d706c655f73656d616e746963227d7d","35120  >  7000 Len=167"
"147","56.126210","192.168.11.17","192.168.11.16","TCP","74","","0.013293000","Jan  8, 2024 13:41:09.249024000 JST","","50380  >  6000 [SYN] Seq=0 Win=64240 Len=0 MSS=1460 SACK_PERM TSval=205673778 TSecr=0 WS=128"
"148","56.126279","192.168.11.16","192.168.11.17","TCP","74","0.000069000","0.000069000","Jan  8, 2024 13:41:09.249093000 JST","","6000  >  50380 [SYN, ACK] Seq=0 Ack=1 Win=65160 Len=0 MSS=1460 SACK_PERM TSval=1101651557 TSecr=205673778 WS=128"
"149","56.136843","192.168.11.17","192.168.11.16","TCP","66","0.010564000","0.010564000","Jan  8, 2024 13:41:09.259657000 JST","","50380  >  6000 [ACK] Seq=1 Ack=1 Win=64256 Len=0 TSval=205673791 TSecr=1101651557"
"150","56.137061","192.168.11.17","192.168.11.16","TCP","93","","0.000218000","Jan  8, 2024 13:41:09.259875000 JST","","50380  >  6000 [PSH, ACK] Seq=1 Ack=1 Win=64256 Len=27 TSval=205673791 TSecr=1101651557 [TCP segment of a reassembled PDU]"
"151","56.137102","192.168.11.16","192.168.11.17","TCP","66","0.000041000","0.000041000","Jan  8, 2024 13:41:09.259916000 JST","","6000  >  50380 [ACK] Seq=1 Ack=28 Win=65152 Len=0 TSval=1101651568 TSecr=205673791"
"152","56.137714","192.168.11.16","192.168.11.17","TCP","66","","0.000612000","Jan  8, 2024 13:41:09.260528000 JST","","6000  >  50380 [FIN, ACK] Seq=1 Ack=28 Win=65152 Len=0 TSval=1101651568 TSecr=205673791"
"153","56.146137","192.168.11.17","192.168.11.16","TCP","66","","0.008423000","Jan  8, 2024 13:41:09.268951000 JST","","50380  >  6000 [FIN, ACK] Seq=28 Ack=1 Win=64256 Len=0 TSval=205673791 TSecr=1101651557"
"154","56.146174","192.168.11.16","192.168.11.17","TCP","66","0.000037000","0.000037000","Jan  8, 2024 13:41:09.268988000 JST","","6000  >  50380 [ACK] Seq=2 Ack=29 Win=65152 Len=0 TSval=1101651577 TSecr=205673791"
"155","56.150078","192.168.11.17","192.168.11.16","TCP","66","0.012364000","0.003904000","Jan  8, 2024 13:41:09.272892000 JST","","50380  >  6000 [ACK] Seq=29 Ack=2 Win=64256 Len=0 TSval=205673808 TSecr=1101651568"
"156","62.751734","192.168.11.16","192.168.11.11","TCP","74","","6.601656000","Jan  8, 2024 13:41:15.874548000 JST","","45804  >  6000 [SYN] Seq=0 Win=64240 Len=0 MSS=1460 SACK_PERM TSval=1444425089 TSecr=0 WS=128"
"157","62.760716","192.168.11.11","192.168.11.16","TCP","74","0.008982000","0.008982000","Jan  8, 2024 13:41:15.883530000 JST","","6000  >  45804 [SYN, ACK] Seq=0 Ack=1 Win=65160 Len=0 MSS=1460 SACK_PERM TSval=4236790014 TSecr=1444425089 WS=128"
"158","62.760776","192.168.11.16","192.168.11.11","TCP","66","0.000060000","0.000060000","Jan  8, 2024 13:41:15.883590000 JST","","45804  >  6000 [ACK] Seq=1 Ack=1 Win=64256 Len=0 TSval=1444425098 TSecr=4236790014"
"159","62.760853","192.168.11.16","192.168.11.11","TCP","93","","0.000077000","Jan  8, 2024 13:41:15.883667000 JST","","45804  >  6000 [PSH, ACK] Seq=1 Ack=1 Win=64256 Len=27 TSval=1444425098 TSecr=4236790014 [TCP segment of a reassembled PDU]"
"160","62.760903","192.168.11.16","192.168.11.11","TCP","66","","0.000050000","Jan  8, 2024 13:41:15.883717000 JST","","45804  >  6000 [FIN, ACK] Seq=28 Ack=1 Win=64256 Len=0 TSval=1444425098 TSecr=4236790014"
"161","62.769057","192.168.11.11","192.168.11.16","TCP","66","0.008204000","0.008154000","Jan  8, 2024 13:41:15.891871000 JST","","6000  >  45804 [ACK] Seq=1 Ack=28 Win=65152 Len=0 TSval=4236790023 TSecr=1444425098"
"162","62.769187","192.168.11.11","192.168.11.16","TCP","66","0.008284000","0.000130000","Jan  8, 2024 13:41:15.892001000 JST","","6000  >  45804 [FIN, ACK] Seq=1 Ack=29 Win=65152 Len=0 TSval=4236790024 TSecr=1444425098"
"163","62.769210","192.168.11.16","192.168.11.11","TCP","66","0.000023000","0.000023000","Jan  8, 2024 13:41:15.892024000 JST","","45804  >  6000 [ACK] Seq=29 Ack=2 Win=64256 Len=0 TSval=1444425107 TSecr=4236790024"
"164","62.789179","192.168.11.16","255.255.255.255","UDP","209","","0.019969000","Jan  8, 2024 13:41:15.911993000 JST","7b2273656d616e74696373223a207b22656e74697479223a2022504944222c202262617365656e74697479223a2022616e79222c2022726f6c65223a2022717171222c20227370617469616c223a2022616e79222c202274656d706f72616c223a2022616e79227d2c20226461746170726f7065727479223a207b22666f726d6174223a2022696e616f6b615f70726f6772616d5f73616d706c655f73656d616e746963227d7d","36341  >  7000 Len=167"
"165","62.796218","192.168.11.17","192.168.11.16","TCP","74","","0.007039000","Jan  8, 2024 13:41:15.919032000 JST","","32822  >  6000 [SYN] Seq=0 Win=64240 Len=0 MSS=1460 SACK_PERM TSval=205680454 TSecr=0 WS=128"
"166","62.796298","192.168.11.16","192.168.11.17","TCP","74","0.000080000","0.000080000","Jan  8, 2024 13:41:15.919112000 JST","","6000  >  32822 [SYN, ACK] Seq=0 Ack=1 Win=65160 Len=0 MSS=1460 SACK_PERM TSval=1101658227 TSecr=205680454 WS=128"
