"No.","Time","Source","Destination","Protocol","Length","The RTT to ACK the segment was","Time delta from previous captured frame","Arrival Time","Data","Info"
"1","0.000000","192.168.11.17","192.168.11.16","TCP","74","","0.000000000","Jan  8, 2024 13:40:13.121929000 JST","","50014  >  6000 [SYN] Seq=0 Win=64240 Len=0 MSS=1460 SACK_PERM TSval=205617722 TSecr=0 WS=128"
"2","0.006814","192.168.11.16","192.168.11.17","TCP","74","0.006814000","0.006814000","Jan  8, 2024 13:40:13.128743000 JST","","6000  >  50014 [SYN, ACK] Seq=0 Ack=1 Win=65160 Len=0 MSS=1460 SACK_PERM TSval=1101595495 TSecr=205617722 WS=128"
"3","0.006931","192.168.11.17","192.168.11.16","TCP","66","0.000117000","0.000117000","Jan  8, 2024 13:40:13.128860000 JST","","50014  >  6000 [ACK] Seq=1 Ack=1 Win=64256 Len=0 TSval=205617729 TSecr=1101595495"
"4","0.007258","192.168.11.17","192.168.11.16","TCP","93","","0.000327000","Jan  8, 2024 13:40:13.129187000 JST","","50014  >  6000 [PSH, ACK] Seq=1 Ack=1 Win=64256 Len=27 TSval=205617729 TSecr=1101595495 [TCP segment of a reassembled PDU]"
"5","0.007382","192.168.11.17","192.168.11.16","TCP","66","","0.000124000","Jan  8, 2024 13:40:13.129311000 JST","","50014  >  6000 [FIN, ACK] Seq=28 Ack=1 Win=64256 Len=0 TSval=205617729 TSecr=1101595495"
"6","0.015489","192.168.11.16","192.168.11.17","TCP","66","0.008231000","0.008107000","Jan  8, 2024 13:40:13.137418000 JST","","6000  >  50014 [ACK] Seq=1 Ack=28 Win=65152 Len=0 TSval=1101595503 TSecr=205617729"
"7","0.015743","192.168.11.16","192.168.11.17","TCP","66","0.008361000","0.000254000","Jan  8, 2024 13:40:13.137672000 JST","","6000  >  50014 [FIN, ACK] Seq=1 Ack=29 Win=65152 Len=0 TSval=1101595505 TSecr=205617729"
"8","0.015790","192.168.11.17","192.168.11.16","TCP","66","0.000047000","0.000047000","Jan  8, 2024 13:40:13.137719000 JST","","50014  >  6000 [ACK] Seq=29 Ack=2 Win=64256 Len=0 TSval=205617738 TSecr=1101595505"
"9","0.044178","192.168.11.17","255.255.255.255","UDP","209","","0.028388000","Jan  8, 2024 13:40:13.166107000 JST","7b2273656d616e74696373223a207b22656e74697479223a2022504944222c202262617365656e74697479223a2022616e79222c2022726f6c65223a2022727272222c20227370617469616c223a2022616e79222c202274656d706f72616c223a2022616e79227d2c20226461746170726f7065727479223a207b22666f726d6174223a2022696e616f6b615f70726f6772616d5f73616d706c655f73656d616e746963227d7d","40130  >  7000 Len=167"
"10","0.065466","192.168.11.19","192.168.11.17","TCP","74","","0.021288000","Jan  8, 2024 13:40:13.187395000 JST","","41046  >  6000 [SYN] Seq=0 Win=64240 Len=0 MSS=1460 SACK_PERM TSval=2827600943 TSecr=0 WS=128"
"11","0.065761","192.168.11.17","192.168.11.19","TCP","74","0.000295000","0.000295000","Jan  8, 2024 13:40:13.187690000 JST","","6000  >  41046 [SYN, ACK] Seq=0 Ack=1 Win=65160 Len=0 MSS=1460 SACK_PERM TSval=2362059909 TSecr=2827600943 WS=128"
"12","0.072910","192.168.11.19","192.168.11.17","TCP","66","0.007149000","0.007149000","Jan  8, 2024 13:40:13.194839000 JST","","41046  >  6000 [ACK] Seq=1 Ack=1 Win=64256 Len=0 TSval=2827600954 TSecr=2362059909"
"13","0.073449","192.168.11.19","192.168.11.17","TCP","93","","0.000539000","Jan  8, 2024 13:40:13.195378000 JST","","41046  >  6000 [PSH, ACK] Seq=1 Ack=1 Win=64256 Len=27 TSval=2827600954 TSecr=2362059909 [TCP segment of a reassembled PDU]"
"14","0.073558","192.168.11.17","192.168.11.19","TCP","66","0.000109000","0.000109000","Jan  8, 2024 13:40:13.195487000 JST","","6000  >  41046 [ACK] Seq=1 Ack=28 Win=65152 Len=0 TSval=2362059916 TSecr=2827600954"
"15","0.073695","192.168.11.19","192.168.11.17","TCP","66","","0.000137000","Jan  8, 2024 13:40:13.195624000 JST","","41046  >  6000 [FIN, ACK] Seq=28 Ack=1 Win=64256 Len=0 TSval=2827600954 TSecr=2362059909"
"16","0.074930","192.168.11.17","192.168.11.19","TCP","66","0.001235000","0.001235000","Jan  8, 2024 13:40:13.196859000 JST","","6000  >  41046 [FIN, ACK] Seq=1 Ack=29 Win=65152 Len=0 TSval=2362059918 TSecr=2827600954"
"17","0.081224","192.168.11.19","192.168.11.17","TCP","66","0.006294000","0.006294000","Jan  8, 2024 13:40:13.203153000 JST","","41046  >  6000 [ACK] Seq=29 Ack=2 Win=64256 Len=0 TSval=2827600962 TSecr=2362059918"
"18","6.910434","192.168.11.17","192.168.11.16","TCP","74","","6.829210000","Jan  8, 2024 13:40:20.032363000 JST","","37722  >  6000 [SYN] Seq=0 Win=64240 Len=0 MSS=1460 SACK_PERM TSval=205624632 TSecr=0 WS=128"
"19","6.919609","192.168.11.16","192.168.11.17","TCP","74","0.009175000","0.009175000","Jan  8, 2024 13:40:20.041538000 JST","","6000  >  37722 [SYN, ACK] Seq=0 Ack=1 Win=65160 Len=0 MSS=1460 SACK_PERM TSval=1101602407 TSecr=205624632 WS=128"
"20","6.919717","192.168.11.17","192.168.11.16","TCP","66","0.000108000","0.000108000","Jan  8, 2024 13:40:20.041646000 JST","","37722  >  6000 [ACK] Seq=1 Ack=1 Win=64256 Len=0 TSval=205624642 TSecr=1101602407"
"21","6.919873","192.168.11.17","192.168.11.16","TCP","93","","0.000156000","Jan  8, 2024 13:40:20.041802000 JST","","37722  >  6000 [PSH, ACK] Seq=1 Ack=1 Win=64256 Len=27 TSval=205624642 TSecr=1101602407 [TCP segment of a reassembled PDU]"
"22","6.919983","192.168.11.17","192.168.11.16","TCP","66","","0.000110000","Jan  8, 2024 13:40:20.041912000 JST","","37722  >  6000 [FIN, ACK] Seq=28 Ack=1 Win=64256 Len=0 TSval=205624642 TSecr=1101602407"
"23","6.928167","192.168.11.16","192.168.11.17","TCP","66","0.008294000","0.008184000","Jan  8, 2024 13:40:20.050096000 JST","","6000  >  37722 [ACK] Seq=1 Ack=28 Win=65152 Len=0 TSval=1101602416 TSecr=205624642"
"24","6.928397","192.168.11.16","192.168.11.17","TCP","66","0.008414000","0.000230000","Jan  8, 2024 13:40:20.050326000 JST","","6000  >  37722 [FIN, ACK] Seq=1 Ack=29 Win=65152 Len=0 TSval=1101602418 TSecr=205624642"
"25","6.928440","192.168.11.17","192.168.11.16","TCP","66","0.000043000","0.000043000","Jan  8, 2024 13:40:20.050369000 JST","","37722  >  6000 [ACK] Seq=29 Ack=2 Win=64256 Len=0 TSval=205624650 TSecr=1101602418"
"26","6.958429","192.168.11.17","255.255.255.255","UDP","209","","0.029989000","Jan  8, 2024 13:40:20.080358000 JST","7b2273656d616e74696373223a207b22656e74697479223a2022504944222c202262617365656e74697479223a2022616e79222c2022726f6c65223a2022727272222c20227370617469616c223a2022616e79222c202274656d706f72616c223a2022616e79227d2c20226461746170726f7065727479223a207b22666f726d6174223a2022696e616f6b615f70726f6772616d5f73616d706c655f73656d616e746963227d7d","49309  >  7000 Len=167"
"27","6.966910","192.168.11.19","192.168.11.17","TCP","74","","0.008481000","Jan  8, 2024 13:40:20.088839000 JST","","39722  >  6000 [SYN] Seq=0 Win=64240 Len=0 MSS=1460 SACK_PERM TSval=2827607847 TSecr=0 WS=128"
"28","6.967063","192.168.11.17","192.168.11.19","TCP","74","0.000153000","0.000153000","Jan  8, 2024 13:40:20.088992000 JST","","6000  >  39722 [SYN, ACK] Seq=0 Ack=1 Win=65160 Len=0 MSS=1460 SACK_PERM TSval=2362066810 TSecr=2827607847 WS=128"
"29","6.976452","192.168.11.19","192.168.11.17","TCP","66","0.009389000","0.009389000","Jan  8, 2024 13:40:20.098381000 JST","","39722  >  6000 [ACK] Seq=1 Ack=1 Win=64256 Len=0 TSval=2827607855 TSecr=2362066810"
"30","6.977113","192.168.11.19","192.168.11.17","TCP","93","","0.000661000","Jan  8, 2024 13:40:20.099042000 JST","","39722  >  6000 [PSH, ACK] Seq=1 Ack=1 Win=64256 Len=27 TSval=2827607855 TSecr=2362066810 [TCP segment of a reassembled PDU]"
"31","6.977235","192.168.11.17","192.168.11.19","TCP","66","0.000122000","0.000122000","Jan  8, 2024 13:40:20.099164000 JST","","6000  >  39722 [ACK] Seq=1 Ack=28 Win=65152 Len=0 TSval=2362066820 TSecr=2827607855"
"32","6.977335","192.168.11.19","192.168.11.17","TCP","66","","0.000100000","Jan  8, 2024 13:40:20.099264000 JST","","39722  >  6000 [FIN, ACK] Seq=28 Ack=1 Win=64256 Len=0 TSval=2827607855 TSecr=2362066810"
"33","6.978607","192.168.11.17","192.168.11.19","TCP","66","0.001272000","0.001272000","Jan  8, 2024 13:40:20.100536000 JST","","6000  >  39722 [FIN, ACK] Seq=1 Ack=29 Win=65152 Len=0 TSval=2362066822 TSecr=2827607855"
"34","7.001026","192.168.11.19","192.168.11.17","TCP","66","0.022419000","0.022419000","Jan  8, 2024 13:40:20.122955000 JST","","39722  >  6000 [ACK] Seq=29 Ack=2 Win=64256 Len=0 TSval=2827607866 TSecr=2362066822"
"35","14.674845","192.168.11.17","192.168.11.16","TCP","74","","7.673819000","Jan  8, 2024 13:40:27.796774000 JST","","37724  >  6000 [SYN] Seq=0 Win=64240 Len=0 MSS=1460 SACK_PERM TSval=205632397 TSecr=0 WS=128"
"36","14.681752","192.168.11.16","192.168.11.17","TCP","74","0.006907000","0.006907000","Jan  8, 2024 13:40:27.803681000 JST","","6000  >  37724 [SYN, ACK] Seq=0 Ack=1 Win=65160 Len=0 MSS=1460 SACK_PERM TSval=1101610169 TSecr=205632397 WS=128"
"37","14.681877","192.168.11.17","192.168.11.16","TCP","66","0.000125000","0.000125000","Jan  8, 2024 13:40:27.803806000 JST","","37724  >  6000 [ACK] Seq=1 Ack=1 Win=64256 Len=0 TSval=205632404 TSecr=1101610169"
"38","14.682027","192.168.11.17","192.168.11.16","TCP","93","","0.000150000","Jan  8, 2024 13:40:27.803956000 JST","","37724  >  6000 [PSH, ACK] Seq=1 Ack=1 Win=64256 Len=27 TSval=205632404 TSecr=1101610169 [TCP segment of a reassembled PDU]"
"39","14.682149","192.168.11.17","192.168.11.16","TCP","66","","0.000122000","Jan  8, 2024 13:40:27.804078000 JST","","37724  >  6000 [FIN, ACK] Seq=28 Ack=1 Win=64256 Len=0 TSval=205632404 TSecr=1101610169"
"40","14.690309","192.168.11.16","192.168.11.17","TCP","66","0.008282000","0.008160000","Jan  8, 2024 13:40:27.812238000 JST","","6000  >  37724 [ACK] Seq=1 Ack=28 Win=65152 Len=0 TSval=1101610177 TSecr=205632404"
"41","14.692827","192.168.11.16","192.168.11.17","TCP","66","0.010678000","0.002518000","Jan  8, 2024 13:40:27.814756000 JST","","6000  >  37724 [FIN, ACK] Seq=1 Ack=29 Win=65152 Len=0 TSval=1101610178 TSecr=205632404"
"42","14.692879","192.168.11.17","192.168.11.16","TCP","66","0.000052000","0.000052000","Jan  8, 2024 13:40:27.814808000 JST","","37724  >  6000 [ACK] Seq=29 Ack=2 Win=64256 Len=0 TSval=205632415 TSecr=1101610178"
"43","14.721907","192.168.11.17","255.255.255.255","UDP","209","","0.029028000","Jan  8, 2024 13:40:27.843836000 JST","7b2273656d616e74696373223a207b22656e74697479223a2022504944222c202262617365656e74697479223a2022616e79222c2022726f6c65223a2022727272222c20227370617469616c223a2022616e79222c202274656d706f72616c223a2022616e79227d2c20226461746170726f7065727479223a207b22666f726d6174223a2022696e616f6b615f70726f6772616d5f73616d706c655f73656d616e746963227d7d","53144  >  7000 Len=167"
"44","14.731344","192.168.11.19","192.168.11.17","TCP","74","","0.009437000","Jan  8, 2024 13:40:27.853273000 JST","","50400  >  6000 [SYN] Seq=0 Win=64240 Len=0 MSS=1460 SACK_PERM TSval=2827615610 TSecr=0 WS=128"
"45","14.731500","192.168.11.17","192.168.11.19","TCP","74","0.000156000","0.000156000","Jan  8, 2024 13:40:27.853429000 JST","","6000  >  50400 [SYN, ACK] Seq=0 Ack=1 Win=65160 Len=0 MSS=1460 SACK_PERM TSval=2362074574 TSecr=2827615610 WS=128"
"46","14.738614","192.168.11.19","192.168.11.17","TCP","66","0.007114000","0.007114000","Jan  8, 2024 13:40:27.860543000 JST","","50400  >  6000 [ACK] Seq=1 Ack=1 Win=64256 Len=0 TSval=2827615619 TSecr=2362074574"
"47","14.739307","192.168.11.19","192.168.11.17","TCP","93","","0.000693000","Jan  8, 2024 13:40:27.861236000 JST","","50400  >  6000 [PSH, ACK] Seq=1 Ack=1 Win=64256 Len=27 TSval=2827615619 TSecr=2362074574 [TCP segment of a reassembled PDU]"
"48","14.739424","192.168.11.17","192.168.11.19","TCP","66","0.000117000","0.000117000","Jan  8, 2024 13:40:27.861353000 JST","","6000  >  50400 [ACK] Seq=1 Ack=28 Win=65152 Len=0 TSval=2362074582 TSecr=2827615619"
"49","14.739512","192.168.11.19","192.168.11.17","TCP","66","","0.000088000","Jan  8, 2024 13:40:27.861441000 JST","","50400  >  6000 [FIN, ACK] Seq=28 Ack=1 Win=64256 Len=0 TSval=2827615620 TSecr=2362074574"
"50","14.740838","192.168.11.17","192.168.11.19","TCP","66","0.001326000","0.001326000","Jan  8, 2024 13:40:27.862767000 JST","","6000  >  50400 [FIN, ACK] Seq=1 Ack=29 Win=65152 Len=0 TSval=2362074584 TSecr=2827615620"
"51","14.745856","192.168.11.19","192.168.11.17","TCP","66","0.005018000","0.005018000","Jan  8, 2024 13:40:27.867785000 JST","","50400  >  6000 [ACK] Seq=29 Ack=2 Win=64256 Len=0 TSval=2827615627 TSecr=2362074584"
"52","21.358279","192.168.11.17","192.168.11.16","TCP","74","","6.612423000","Jan  8, 2024 13:40:34.480208000 JST","","42526  >  6000 [SYN] Seq=0 Win=64240 Len=0 MSS=1460 SACK_PERM TSval=205639080 TSecr=0 WS=128"
"53","21.364970","192.168.11.16","192.168.11.17","TCP","74","0.006691000","0.006691000","Jan  8, 2024 13:40:34.486899000 JST","","6000  >  42526 [SYN, ACK] Seq=0 Ack=1 Win=65160 Len=0 MSS=1460 SACK_PERM TSval=1101616853 TSecr=205639080 WS=128"
"54","21.365102","192.168.11.17","192.168.11.16","TCP","66","0.000132000","0.000132000","Jan  8, 2024 13:40:34.487031000 JST","","42526  >  6000 [ACK] Seq=1 Ack=1 Win=64256 Len=0 TSval=205639087 TSecr=1101616853"
"55","21.365247","192.168.11.17","192.168.11.16","TCP","93","","0.000145000","Jan  8, 2024 13:40:34.487176000 JST","","42526  >  6000 [PSH, ACK] Seq=1 Ack=1 Win=64256 Len=27 TSval=205639087 TSecr=1101616853 [TCP segment of a reassembled PDU]"
"56","21.365369","192.168.11.17","192.168.11.16","TCP","66","","0.000122000","Jan  8, 2024 13:40:34.487298000 JST","","42526  >  6000 [FIN, ACK] Seq=28 Ack=1 Win=64256 Len=0 TSval=205639087 TSecr=1101616853"
"57","21.372513","192.168.11.16","192.168.11.17","TCP","66","0.007266000","0.007144000","Jan  8, 2024 13:40:34.494442000 JST","","6000  >  42526 [ACK] Seq=1 Ack=28 Win=65152 Len=0 TSval=1101616860 TSecr=205639087"
"58","21.372910","192.168.11.16","192.168.11.17","TCP","66","0.007541000","0.000397000","Jan  8, 2024 13:40:34.494839000 JST","","6000  >  42526 [FIN, ACK] Seq=1 Ack=29 Win=65152 Len=0 TSval=1101616862 TSecr=205639087"
"59","21.372994","192.168.11.17","192.168.11.16","TCP","66","0.000084000","0.000084000","Jan  8, 2024 13:40:34.494923000 JST","","42526  >  6000 [ACK] Seq=29 Ack=2 Win=64256 Len=0 TSval=205639095 TSecr=1101616862"
"60","21.401401","192.168.11.17","255.255.255.255","UDP","209","","0.028407000","Jan  8, 2024 13:40:34.523330000 JST","7b2273656d616e74696373223a207b22656e74697479223a2022504944222c202262617365656e74697479223a2022616e79222c2022726f6c65223a2022727272222c20227370617469616c223a2022616e79222c202274656d706f72616c223a2022616e79227d2c20226461746170726f7065727479223a207b22666f726d6174223a2022696e616f6b615f70726f6772616d5f73616d706c655f73656d616e746963227d7d","47765  >  7000 Len=167"
"61","21.410072","192.168.11.19","192.168.11.17","TCP","74","","0.008671000","Jan  8, 2024 13:40:34.532001000 JST","","50402  >  6000 [SYN] Seq=0 Win=64240 Len=0 MSS=1460 SACK_PERM TSval=2827622290 TSecr=0 WS=128"
"62","21.410241","192.168.11.17","192.168.11.19","TCP","74","0.000169000","0.000169000","Jan  8, 2024 13:40:34.532170000 JST","","6000  >  50402 [SYN, ACK] Seq=0 Ack=1 Win=65160 Len=0 MSS=1460 SACK_PERM TSval=2362081253 TSecr=2827622290 WS=128"
"63","21.417378","192.168.11.19","192.168.11.17","TCP","66","0.007137000","0.007137000","Jan  8, 2024 13:40:34.539307000 JST","","50402  >  6000 [ACK] Seq=1 Ack=1 Win=64256 Len=0 TSval=2827622298 TSecr=2362081253"
"64","21.418175","192.168.11.19","192.168.11.17","TCP","93","","0.000797000","Jan  8, 2024 13:40:34.540104000 JST","","50402  >  6000 [PSH, ACK] Seq=1 Ack=1 Win=64256 Len=27 TSval=2827622298 TSecr=2362081253 [TCP segment of a reassembled PDU]"
"65","21.418328","192.168.11.17","192.168.11.19","TCP","66","0.000153000","0.000153000","Jan  8, 2024 13:40:34.540257000 JST","","6000  >  50402 [ACK] Seq=1 Ack=28 Win=65152 Len=0 TSval=2362081261 TSecr=2827622298"
"66","21.418418","192.168.11.19","192.168.11.17","TCP","66","","0.000090000","Jan  8, 2024 13:40:34.540347000 JST","","50402  >  6000 [FIN, ACK] Seq=28 Ack=1 Win=64256 Len=0 TSval=2827622298 TSecr=2362081253"
"67","21.419777","192.168.11.17","192.168.11.19","TCP","66","0.001359000","0.001359000","Jan  8, 2024 13:40:34.541706000 JST","","6000  >  50402 [FIN, ACK] Seq=1 Ack=29 Win=65152 Len=0 TSval=2362081263 TSecr=2827622298"
"68","21.426039","192.168.11.19","192.168.11.17","TCP","66","0.006262000","0.006262000","Jan  8, 2024 13:40:34.547968000 JST","","50402  >  6000 [ACK] Seq=29 Ack=2 Win=64256 Len=0 TSval=2827622307 TSecr=2362081263"
"69","29.125456","192.168.11.17","192.168.11.16","TCP","74","","7.699417000","Jan  8, 2024 13:40:42.247385000 JST","","36700  >  6000 [SYN] Seq=0 Win=64240 Len=0 MSS=1460 SACK_PERM TSval=205646847 TSecr=0 WS=128"
"70","29.139151","192.168.11.16","192.168.11.17","TCP","74","0.013695000","0.013695000","Jan  8, 2024 13:40:42.261080000 JST","","6000  >  36700 [SYN, ACK] Seq=0 Ack=1 Win=65160 Len=0 MSS=1460 SACK_PERM TSval=1101624622 TSecr=205646847 WS=128"
"71","29.139244","192.168.11.17","192.168.11.16","TCP","66","0.000093000","0.000093000","Jan  8, 2024 13:40:42.261173000 JST","","36700  >  6000 [ACK] Seq=1 Ack=1 Win=64256 Len=0 TSval=205646861 TSecr=1101624622"
"72","29.139404","192.168.11.17","192.168.11.16","TCP","93","","0.000160000","Jan  8, 2024 13:40:42.261333000 JST","","36700  >  6000 [PSH, ACK] Seq=1 Ack=1 Win=64256 Len=27 TSval=205646861 TSecr=1101624622 [TCP segment of a reassembled PDU]"
"73","29.139494","192.168.11.17","192.168.11.16","TCP","66","","0.000090000","Jan  8, 2024 13:40:42.261423000 JST","","36700  >  6000 [FIN, ACK] Seq=28 Ack=1 Win=64256 Len=0 TSval=205646861 TSecr=1101624622"
"74","29.147112","192.168.11.16","192.168.11.17","TCP","66","0.007708000","0.007618000","Jan  8, 2024 13:40:42.269041000 JST","","6000  >  36700 [ACK] Seq=1 Ack=28 Win=65152 Len=0 TSval=1101624635 TSecr=205646861"
"75","29.147352","192.168.11.16","192.168.11.17","TCP","66","0.007858000","0.000240000","Jan  8, 2024 13:40:42.269281000 JST","","6000  >  36700 [FIN, ACK] Seq=1 Ack=29 Win=65152 Len=0 TSval=1101624636 TSecr=205646861"
"76","29.147403","192.168.11.17","192.168.11.16","TCP","66","0.000051000","0.000051000","Jan  8, 2024 13:40:42.269332000 JST","","36700  >  6000 [ACK] Seq=29 Ack=2 Win=64256 Len=0 TSval=205646869 TSecr=1101624636"
"77","29.178841","192.168.11.17","255.255.255.255","UDP","209","","0.031438000","Jan  8, 2024 13:40:42.300770000 JST","7b2273656d616e74696373223a207b22656e74697479223a2022504944222c202262617365656e74697479223a2022616e79222c2022726f6c65223a2022727272222c20227370617469616c223a2022616e79222c202274656d706f72616c223a2022616e79227d2c20226461746170726f7065727479223a207b22666f726d6174223a2022696e616f6b615f70726f6772616d5f73616d706c655f73656d616e746963227d7d","37017  >  7000 Len=167"
"78","29.186465","192.168.11.19","192.168.11.17","TCP","74","","0.007624000","Jan  8, 2024 13:40:42.308394000 JST","","58552  >  6000 [SYN] Seq=0 Win=64240 Len=0 MSS=1460 SACK_PERM TSval=2827630067 TSecr=0 WS=128"
"79","29.186596","192.168.11.17","192.168.11.19","TCP","74","0.000131000","0.000131000","Jan  8, 2024 13:40:42.308525000 JST","","6000  >  58552 [SYN, ACK] Seq=0 Ack=1 Win=65160 Len=0 MSS=1460 SACK_PERM TSval=2362089030 TSecr=2827630067 WS=128"
"80","29.193244","192.168.11.19","192.168.11.17","TCP","66","0.006648000","0.006648000","Jan  8, 2024 13:40:42.315173000 JST","","58552  >  6000 [ACK] Seq=1 Ack=1 Win=64256 Len=0 TSval=2827630074 TSecr=2362089030"
"81","29.193848","192.168.11.19","192.168.11.17","TCP","93","","0.000604000","Jan  8, 2024 13:40:42.315777000 JST","","58552  >  6000 [PSH, ACK] Seq=1 Ack=1 Win=64256 Len=27 TSval=2827630075 TSecr=2362089030 [TCP segment of a reassembled PDU]"
"82","29.193936","192.168.11.17","192.168.11.19","TCP","66","0.000088000","0.000088000","Jan  8, 2024 13:40:42.315865000 JST","","6000  >  58552 [ACK] Seq=1 Ack=28 Win=65152 Len=0 TSval=2362089037 TSecr=2827630075"
"83","29.194009","192.168.11.19","192.168.11.17","TCP","66","","0.000073000","Jan  8, 2024 13:40:42.315938000 JST","","58552  >  6000 [FIN, ACK] Seq=28 Ack=1 Win=64256 Len=0 TSval=2827630075 TSecr=2362089030"
"84","29.195038","192.168.11.17","192.168.11.19","TCP","66","0.001029000","0.001029000","Jan  8, 2024 13:40:42.316967000 JST","","6000  >  58552 [FIN, ACK] Seq=1 Ack=29 Win=65152 Len=0 TSval=2362089038 TSecr=2827630075"
"85","29.201734","192.168.11.19","192.168.11.17","TCP","66","0.006696000","0.006696000","Jan  8, 2024 13:40:42.323663000 JST","","58552  >  6000 [ACK] Seq=29 Ack=2 Win=64256 Len=0 TSval=2827630082 TSecr=2362089038"
"86","35.848286","192.168.11.17","192.168.11.16","TCP","74","","6.646552000","Jan  8, 2024 13:40:48.970215000 JST","","36702  >  6000 [SYN] Seq=0 Win=64240 Len=0 MSS=1460 SACK_PERM TSval=205653570 TSecr=0 WS=128"
"87","35.855087","192.168.11.16","192.168.11.17","TCP","74","0.006801000","0.006801000","Jan  8, 2024 13:40:48.977016000 JST","","6000  >  36702 [SYN, ACK] Seq=0 Ack=1 Win=65160 Len=0 MSS=1460 SACK_PERM TSval=1101631343 TSecr=205653570 WS=128"
"88","35.855186","192.168.11.17","192.168.11.16","TCP","66","0.000099000","0.000099000","Jan  8, 2024 13:40:48.977115000 JST","","36702  >  6000 [ACK] Seq=1 Ack=1 Win=64256 Len=0 TSval=205653577 TSecr=1101631343"
"89","35.855349","192.168.11.17","192.168.11.16","TCP","93","","0.000163000","Jan  8, 2024 13:40:48.977278000 JST","","36702  >  6000 [PSH, ACK] Seq=1 Ack=1 Win=64256 Len=27 TSval=205653577 TSecr=1101631343 [TCP segment of a reassembled PDU]"
"90","35.855451","192.168.11.17","192.168.11.16","TCP","66","","0.000102000","Jan  8, 2024 13:40:48.977380000 JST","","36702  >  6000 [FIN, ACK] Seq=28 Ack=1 Win=64256 Len=0 TSval=205653577 TSecr=1101631343"
"91","35.862666","192.168.11.16","192.168.11.17","TCP","66","0.007317000","0.007215000","Jan  8, 2024 13:40:48.984595000 JST","","6000  >  36702 [ACK] Seq=1 Ack=28 Win=65152 Len=0 TSval=1101631351 TSecr=205653577"
"92","35.863024","192.168.11.16","192.168.11.17","TCP","66","0.007573000","0.000358000","Jan  8, 2024 13:40:48.984953000 JST","","6000  >  36702 [FIN, ACK] Seq=1 Ack=29 Win=65152 Len=0 TSval=1101631352 TSecr=205653577"
"93","35.863067","192.168.11.17","192.168.11.16","TCP","66","0.000043000","0.000043000","Jan  8, 2024 13:40:48.984996000 JST","","36702  >  6000 [ACK] Seq=29 Ack=2 Win=64256 Len=0 TSval=205653585 TSecr=1101631352"
"94","35.890467","192.168.11.17","255.255.255.255","UDP","209","","0.027400000","Jan  8, 2024 13:40:49.012396000 JST","7b2273656d616e74696373223a207b22656e74697479223a2022504944222c202262617365656e74697479223a2022616e79222c2022726f6c65223a2022727272222c20227370617469616c223a2022616e79222c202274656d706f72616c223a2022616e79227d2c20226461746170726f7065727479223a207b22666f726d6174223a2022696e616f6b615f70726f6772616d5f73616d706c655f73656d616e746963227d7d","40420  >  7000 Len=167"
"95","35.899760","192.168.11.19","192.168.11.17","TCP","74","","0.009293000","Jan  8, 2024 13:40:49.021689000 JST","","60598  >  6000 [SYN] Seq=0 Win=64240 Len=0 MSS=1460 SACK_PERM TSval=2827636779 TSecr=0 WS=128"
"96","35.899886","192.168.11.17","192.168.11.19","TCP","74","0.000126000","0.000126000","Jan  8, 2024 13:40:49.021815000 JST","","6000  >  60598 [SYN, ACK] Seq=0 Ack=1 Win=65160 Len=0 MSS=1460 SACK_PERM TSval=2362095743 TSecr=2827636779 WS=128"
"97","35.906471","192.168.11.19","192.168.11.17","TCP","66","0.006585000","0.006585000","Jan  8, 2024 13:40:49.028400000 JST","","60598  >  6000 [ACK] Seq=1 Ack=1 Win=64256 Len=0 TSval=2827636788 TSecr=2362095743"
"98","35.906973","192.168.11.19","192.168.11.17","TCP","93","","0.000502000","Jan  8, 2024 13:40:49.028902000 JST","","60598  >  6000 [PSH, ACK] Seq=1 Ack=1 Win=64256 Len=27 TSval=2827636788 TSecr=2362095743 [TCP segment of a reassembled PDU]"
"99","35.907043","192.168.11.17","192.168.11.19","TCP","66","0.000070000","0.000070000","Jan  8, 2024 13:40:49.028972000 JST","","6000  >  60598 [ACK] Seq=1 Ack=28 Win=65152 Len=0 TSval=2362095750 TSecr=2827636788"
"100","35.907107","192.168.11.19","192.168.11.17","TCP","66","","0.000064000","Jan  8, 2024 13:40:49.029036000 JST","","60598  >  6000 [FIN, ACK] Seq=28 Ack=1 Win=64256 Len=0 TSval=2827636788 TSecr=2362095743"
"101","35.908156","192.168.11.17","192.168.11.19","TCP","66","0.001049000","0.001049000","Jan  8, 2024 13:40:49.030085000 JST","","6000  >  60598 [FIN, ACK] Seq=1 Ack=29 Win=65152 Len=0 TSval=2362095751 TSecr=2827636788"
"102","35.914361","192.168.11.19","192.168.11.17","TCP","66","0.006205000","0.006205000","Jan  8, 2024 13:40:49.036290000 JST","","60598  >  6000 [ACK] Seq=29 Ack=2 Win=64256 Len=0 TSval=2827636795 TSecr=2362095751"
"103","42.605522","192.168.11.17","192.168.11.16","TCP","74","","6.691161000","Jan  8, 2024 13:40:55.727451000 JST","","45022  >  6000 [SYN] Seq=0 Win=64240 Len=0 MSS=1460 SACK_PERM TSval=205660327 TSecr=0 WS=128"
"104","42.611936","192.168.11.16","192.168.11.17","TCP","74","0.006414000","0.006414000","Jan  8, 2024 13:40:55.733865000 JST","","6000  >  45022 [SYN, ACK] Seq=0 Ack=1 Win=65160 Len=0 MSS=1460 SACK_PERM TSval=1101638100 TSecr=205660327 WS=128"
"105","42.612035","192.168.11.17","192.168.11.16","TCP","66","0.000099000","0.000099000","Jan  8, 2024 13:40:55.733964000 JST","","45022  >  6000 [ACK] Seq=1 Ack=1 Win=64256 Len=0 TSval=205660334 TSecr=1101638100"
"106","42.612226","192.168.11.17","192.168.11.16","TCP","93","","0.000191000","Jan  8, 2024 13:40:55.734155000 JST","","45022  >  6000 [PSH, ACK] Seq=1 Ack=1 Win=64256 Len=27 TSval=205660334 TSecr=1101638100 [TCP segment of a reassembled PDU]"
"107","42.612330","192.168.11.17","192.168.11.16","TCP","66","","0.000104000","Jan  8, 2024 13:40:55.734259000 JST","","45022  >  6000 [FIN, ACK] Seq=28 Ack=1 Win=64256 Len=0 TSval=205660334 TSecr=1101638100"
"108","42.619345","192.168.11.16","192.168.11.17","TCP","66","0.007119000","0.007015000","Jan  8, 2024 13:40:55.741274000 JST","","6000  >  45022 [ACK] Seq=1 Ack=28 Win=65152 Len=0 TSval=1101638107 TSecr=205660334"
"109","42.619719","192.168.11.16","192.168.11.17","TCP","66","0.007389000","0.000374000","Jan  8, 2024 13:40:55.741648000 JST","","6000  >  45022 [FIN, ACK] Seq=1 Ack=29 Win=65152 Len=0 TSval=1101638109 TSecr=205660334"
"110","42.619782","192.168.11.17","192.168.11.16","TCP","66","0.000063000","0.000063000","Jan  8, 2024 13:40:55.741711000 JST","","45022  >  6000 [ACK] Seq=29 Ack=2 Win=64256 Len=0 TSval=205660342 TSecr=1101638109"
"111","42.651865","192.168.11.17","255.255.255.255","UDP","209","","0.032083000","Jan  8, 2024 13:40:55.773794000 JST","7b2273656d616e74696373223a207b22656e74697479223a2022504944222c202262617365656e74697479223a2022616e79222c2022726f6c65223a2022727272222c20227370617469616c223a2022616e79222c202274656d706f72616c223a2022616e79227d2c20226461746170726f7065727479223a207b22666f726d6174223a2022696e616f6b615f70726f6772616d5f73616d706c655f73656d616e746963227d7d","55489  >  7000 Len=167"
"112","42.662996","192.168.11.19","192.168.11.17","TCP","74","","0.011131000","Jan  8, 2024 13:40:55.784925000 JST","","49870  >  6000 [SYN] Seq=0 Win=64240 Len=0 MSS=1460 SACK_PERM TSval=2827643544 TSecr=0 WS=128"
"113","42.663135","192.168.11.17","192.168.11.19","TCP","74","0.000139000","0.000139000","Jan  8, 2024 13:40:55.785064000 JST","","6000  >  49870 [SYN, ACK] Seq=0 Ack=1 Win=65160 Len=0 MSS=1460 SACK_PERM TSval=2362102506 TSecr=2827643544 WS=128"
"114","42.671321","192.168.11.19","192.168.11.17","TCP","66","0.008186000","0.008186000","Jan  8, 2024 13:40:55.793250000 JST","","49870  >  6000 [ACK] Seq=1 Ack=1 Win=64256 Len=0 TSval=2827643551 TSecr=2362102506"
"115","42.671858","192.168.11.19","192.168.11.17","TCP","93","","0.000537000","Jan  8, 2024 13:40:55.793787000 JST","","49870  >  6000 [PSH, ACK] Seq=1 Ack=1 Win=64256 Len=27 TSval=2827643551 TSecr=2362102506 [TCP segment of a reassembled PDU]"
"116","42.671923","192.168.11.17","192.168.11.19","TCP","66","0.000065000","0.000065000","Jan  8, 2024 13:40:55.793852000 JST","","6000  >  49870 [ACK] Seq=1 Ack=28 Win=65152 Len=0 TSval=2362102515 TSecr=2827643551"
"117","42.671997","192.168.11.19","192.168.11.17","TCP","66","","0.000074000","Jan  8, 2024 13:40:55.793926000 JST","","49870  >  6000 [FIN, ACK] Seq=28 Ack=1 Win=64256 Len=0 TSval=2827643551 TSecr=2362102506"
"118","42.673212","192.168.11.17","192.168.11.19","TCP","66","0.001215000","0.001215000","Jan  8, 2024 13:40:55.795141000 JST","","6000  >  49870 [FIN, ACK] Seq=1 Ack=29 Win=65152 Len=0 TSval=2362102516 TSecr=2827643551"
"119","42.693852","192.168.11.19","192.168.11.17","TCP","66","0.020640000","0.020640000","Jan  8, 2024 13:40:55.815781000 JST","","49870  >  6000 [ACK] Seq=29 Ack=2 Win=64256 Len=0 TSval=2827643570 TSecr=2362102516"
"120","49.356218","192.168.11.17","192.168.11.16","TCP","74","","6.662366000","Jan  8, 2024 13:41:02.478147000 JST","","50378  >  6000 [SYN] Seq=0 Win=64240 Len=0 MSS=1460 SACK_PERM TSval=205667078 TSecr=0 WS=128"
"121","49.362775","192.168.11.16","192.168.11.17","TCP","74","0.006557000","0.006557000","Jan  8, 2024 13:41:02.484704000 JST","","6000  >  50378 [SYN, ACK] Seq=0 Ack=1 Win=65160 Len=0 MSS=1460 SACK_PERM TSval=1101644851 TSecr=205667078 WS=128"
"122","49.362884","192.168.11.17","192.168.11.16","TCP","66","0.000109000","0.000109000","Jan  8, 2024 13:41:02.484813000 JST","","50378  >  6000 [ACK] Seq=1 Ack=1 Win=64256 Len=0 TSval=205667085 TSecr=1101644851"
"123","49.363053","192.168.11.17","192.168.11.16","TCP","93","","0.000169000","Jan  8, 2024 13:41:02.484982000 JST","","50378  >  6000 [PSH, ACK] Seq=1 Ack=1 Win=64256 Len=27 TSval=205667085 TSecr=1101644851 [TCP segment of a reassembled PDU]"
"124","49.363152","192.168.11.17","192.168.11.16","TCP","66","","0.000099000","Jan  8, 2024 13:41:02.485081000 JST","","50378  >  6000 [FIN, ACK] Seq=28 Ack=1 Win=64256 Len=0 TSval=205667085 TSecr=1101644851"
"125","49.370033","192.168.11.16","192.168.11.17","TCP","66","0.006980000","0.006881000","Jan  8, 2024 13:41:02.491962000 JST","","6000  >  50378 [ACK] Seq=1 Ack=28 Win=65152 Len=0 TSval=1101644858 TSecr=205667085"
"126","49.370398","192.168.11.16","192.168.11.17","TCP","66","0.007246000","0.000365000","Jan  8, 2024 13:41:02.492327000 JST","","6000  >  50378 [FIN, ACK] Seq=1 Ack=29 Win=65152 Len=0 TSval=1101644859 TSecr=205667085"
"127","49.370458","192.168.11.17","192.168.11.16","TCP","66","0.000060000","0.000060000","Jan  8, 2024 13:41:02.492387000 JST","","50378  >  6000 [ACK] Seq=29 Ack=2 Win=64256 Len=0 TSval=205667092 TSecr=1101644859"
"128","49.398459","192.168.11.17","255.255.255.255","UDP","209","","0.028001000","Jan  8, 2024 13:41:02.520388000 JST","7b2273656d616e74696373223a207b22656e74697479223a2022504944222c202262617365656e74697479223a2022616e79222c2022726f6c65223a2022727272222c20227370617469616c223a2022616e79222c202274656d706f72616c223a2022616e79227d2c20226461746170726f7065727479223a207b22666f726d6174223a2022696e616f6b615f70726f6772616d5f73616d706c655f73656d616e746963227d7d","42271  >  7000 Len=167"
"129","49.411611","192.168.11.19","192.168.11.17","TCP","74","","0.013152000","Jan  8, 2024 13:41:02.533540000 JST","","49880  >  6000 [SYN] Seq=0 Win=64240 Len=0 MSS=1460 SACK_PERM TSval=2827650287 TSecr=0 WS=128"
"130","49.411747","192.168.11.17","192.168.11.19","TCP","74","0.000136000","0.000136000","Jan  8, 2024 13:41:02.533676000 JST","","6000  >  49880 [SYN, ACK] Seq=0 Ack=1 Win=65160 Len=0 MSS=1460 SACK_PERM TSval=2362109255 TSecr=2827650287 WS=128"
"131","49.418377","192.168.11.19","192.168.11.17","TCP","66","0.006630000","0.006630000","Jan  8, 2024 13:41:02.540306000 JST","","49880  >  6000 [ACK] Seq=1 Ack=1 Win=64256 Len=0 TSval=2827650299 TSecr=2362109255"
"132","49.418910","192.168.11.19","192.168.11.17","TCP","93","","0.000533000","Jan  8, 2024 13:41:02.540839000 JST","","49880  >  6000 [PSH, ACK] Seq=1 Ack=1 Win=64256 Len=27 TSval=2827650300 TSecr=2362109255 [TCP segment of a reassembled PDU]"
"133","49.418959","192.168.11.19","192.168.11.17","TCP","66","","0.000049000","Jan  8, 2024 13:41:02.540888000 JST","","49880  >  6000 [FIN, ACK] Seq=28 Ack=1 Win=64256 Len=0 TSval=2827650300 TSecr=2362109255"
"134","49.418990","192.168.11.17","192.168.11.19","TCP","66","0.000080000","0.000031000","Jan  8, 2024 13:41:02.540919000 JST","","6000  >  49880 [ACK] Seq=1 Ack=28 Win=65152 Len=0 TSval=2362109262 TSecr=2827650300"
"135","49.420588","192.168.11.17","192.168.11.19","TCP","66","0.001629000","0.001598000","Jan  8, 2024 13:41:02.542517000 JST","","6000  >  49880 [FIN, ACK] Seq=1 Ack=29 Win=65152 Len=0 TSval=2362109263 TSecr=2827650300"
"136","49.425155","192.168.11.19","192.168.11.17","TCP","66","0.004567000","0.004567000","Jan  8, 2024 13:41:02.547084000 JST","","49880  >  6000 [ACK] Seq=29 Ack=2 Win=64256 Len=0 TSval=2827650307 TSecr=2362109263"
"137","56.056020","192.168.11.17","192.168.11.16","TCP","74","","6.630865000","Jan  8, 2024 13:41:09.177949000 JST","","50380  >  6000 [SYN] Seq=0 Win=64240 Len=0 MSS=1460 SACK_PERM TSval=205673778 TSecr=0 WS=128"
"138","56.068730","192.168.11.16","192.168.11.17","TCP","74","0.012710000","0.012710000","Jan  8, 2024 13:41:09.190659000 JST","","6000  >  50380 [SYN, ACK] Seq=0 Ack=1 Win=65160 Len=0 MSS=1460 SACK_PERM TSval=1101651557 TSecr=205673778 WS=128"
"139","56.068838","192.168.11.17","192.168.11.16","TCP","66","0.000108000","0.000108000","Jan  8, 2024 13:41:09.190767000 JST","","50380  >  6000 [ACK] Seq=1 Ack=1 Win=64256 Len=0 TSval=205673791 TSecr=1101651557"
"140","56.069031","192.168.11.17","192.168.11.16","TCP","93","","0.000193000","Jan  8, 2024 13:41:09.190960000 JST","","50380  >  6000 [PSH, ACK] Seq=1 Ack=1 Win=64256 Len=27 TSval=205673791 TSecr=1101651557 [TCP segment of a reassembled PDU]"
"141","56.069119","192.168.11.17","192.168.11.16","TCP","66","","0.000088000","Jan  8, 2024 13:41:09.191048000 JST","","50380  >  6000 [FIN, ACK] Seq=28 Ack=1 Win=64256 Len=0 TSval=205673791 TSecr=1101651557"
"142","56.085778","192.168.11.16","192.168.11.17","TCP","66","0.016747000","0.016659000","Jan  8, 2024 13:41:09.207707000 JST","","6000  >  50380 [ACK] Seq=1 Ack=28 Win=65152 Len=0 TSval=1101651568 TSecr=205673791"
"143","56.086150","192.168.11.16","192.168.11.17","TCP","66","","0.000372000","Jan  8, 2024 13:41:09.208079000 JST","","6000  >  50380 [FIN, ACK] Seq=1 Ack=28 Win=65152 Len=0 TSval=1101651568 TSecr=205673791"
"144","56.086202","192.168.11.17","192.168.11.16","TCP","66","0.000052000","0.000052000","Jan  8, 2024 13:41:09.208131000 JST","","50380  >  6000 [ACK] Seq=29 Ack=2 Win=64256 Len=0 TSval=205673808 TSecr=1101651568"
"145","56.088386","192.168.11.16","192.168.11.17","TCP","66","0.019267000","0.002184000","Jan  8, 2024 13:41:09.210315000 JST","","6000  >  50380 [ACK] Seq=2 Ack=29 Win=65152 Len=0 TSval=1101651577 TSecr=205673791"
"146","56.111968","192.168.11.17","255.255.255.255","UDP","209","","0.023582000","Jan  8, 2024 13:41:09.233897000 JST","7b2273656d616e74696373223a207b22656e74697479223a2022504944222c202262617365656e74697479223a2022616e79222c2022726f6c65223a2022727272222c20227370617469616c223a2022616e79222c202274656d706f72616c223a2022616e79227d2c20226461746170726f7065727479223a207b22666f726d6174223a2022696e616f6b615f70726f6772616d5f73616d706c655f73656d616e746963227d7d","54832  >  7000 Len=167"
"147","56.124178","192.168.11.19","192.168.11.17","TCP","74","","0.012210000","Jan  8, 2024 13:41:09.246107000 JST","","35218  >  6000 [SYN] Seq=0 Win=64240 Len=0 MSS=1460 SACK_PERM TSval=2827657002 TSecr=0 WS=128"
"148","56.124310","192.168.11.17","192.168.11.19","TCP","74","0.000132000","0.000132000","Jan  8, 2024 13:41:09.246239000 JST","","6000  >  35218 [SYN, ACK] Seq=0 Ack=1 Win=65160 Len=0 MSS=1460 SACK_PERM TSval=2362115967 TSecr=2827657002 WS=128"
"149","56.130940","192.168.11.19","192.168.11.17","TCP","66","0.006630000","0.006630000","Jan  8, 2024 13:41:09.252869000 JST","","35218  >  6000 [ACK] Seq=1 Ack=1 Win=64256 Len=0 TSval=2827657012 TSecr=2362115967"
"150","56.131467","192.168.11.19","192.168.11.17","TCP","93","","0.000527000","Jan  8, 2024 13:41:09.253396000 JST","","35218  >  6000 [PSH, ACK] Seq=1 Ack=1 Win=64256 Len=27 TSval=2827657012 TSecr=2362115967 [TCP segment of a reassembled PDU]"
"151","56.131554","192.168.11.17","192.168.11.19","TCP","66","0.000087000","0.000087000","Jan  8, 2024 13:41:09.253483000 JST","","6000  >  35218 [ACK] Seq=1 Ack=28 Win=65152 Len=0 TSval=2362115974 TSecr=2827657012"
"152","56.131620","192.168.11.19","192.168.11.17","TCP","66","","0.000066000","Jan  8, 2024 13:41:09.253549000 JST","","35218  >  6000 [FIN, ACK] Seq=28 Ack=1 Win=64256 Len=0 TSval=2827657012 TSecr=2362115967"
"153","56.132573","192.168.11.17","192.168.11.19","TCP","66","0.000953000","0.000953000","Jan  8, 2024 13:41:09.254502000 JST","","6000  >  35218 [FIN, ACK] Seq=1 Ack=29 Win=65152 Len=0 TSval=2362115976 TSecr=2827657012"
"154","56.138830","192.168.11.19","192.168.11.17","TCP","66","0.006257000","0.006257000","Jan  8, 2024 13:41:09.260759000 JST","","35218  >  6000 [ACK] Seq=29 Ack=2 Win=64256 Len=0 TSval=2827657020 TSecr=2362115976"
"155","62.732287","192.168.11.17","192.168.11.16","TCP","74","","6.593457000","Jan  8, 2024 13:41:15.854216000 JST","","32822  >  6000 [SYN] Seq=0 Win=64240 Len=0 MSS=1460 SACK_PERM TSval=205680454 TSecr=0 WS=128"
"156","62.738959","192.168.11.16","192.168.11.17","TCP","74","0.006672000","0.006672000","Jan  8, 2024 13:41:15.860888000 JST","","6000  >  32822 [SYN, ACK] Seq=0 Ack=1 Win=65160 Len=0 MSS=1460 SACK_PERM TSval=1101658227 TSecr=205680454 WS=128"
"157","62.739050","192.168.11.17","192.168.11.16","TCP","66","0.000091000","0.000091000","Jan  8, 2024 13:41:15.860979000 JST","","32822  >  6000 [ACK] Seq=1 Ack=1 Win=64256 Len=0 TSval=205680461 TSecr=1101658227"
"158","62.739204","192.168.11.17","192.168.11.16","TCP","93","","0.000154000","Jan  8, 2024 13:41:15.861133000 JST","","32822  >  6000 [PSH, ACK] Seq=1 Ack=1 Win=64256 Len=27 TSval=205680461 TSecr=1101658227 [TCP segment of a reassembled PDU]"
"159","62.739323","192.168.11.17","192.168.11.16","TCP","66","","0.000119000","Jan  8, 2024 13:41:15.861252000 JST","","32822  >  6000 [FIN, ACK] Seq=28 Ack=1 Win=64256 Len=0 TSval=205680461 TSecr=1101658227"
"160","62.745464","192.168.11.16","192.168.11.17","TCP","66","0.006260000","0.006141000","Jan  8, 2024 13:41:15.867393000 JST","","6000  >  32822 [ACK] Seq=1 Ack=28 Win=65152 Len=0 TSval=1101658234 TSecr=205680461"
"161","62.745884","192.168.11.16","192.168.11.17","TCP","66","0.006561000","0.000420000","Jan  8, 2024 13:41:15.867813000 JST","","6000  >  32822 [FIN, ACK] Seq=1 Ack=29 Win=65152 Len=0 TSval=1101658234 TSecr=205680461"
"162","62.745927","192.168.11.17","192.168.11.16","TCP","66","0.000043000","0.000043000","Jan  8, 2024 13:41:15.867856000 JST","","32822  >  6000 [ACK] Seq=29 Ack=2 Win=64256 Len=0 TSval=205680468 TSecr=1101658234"
"163","62.774354","192.168.11.17","255.255.255.255","UDP","209","","0.028427000","Jan  8, 2024 13:41:15.896283000 JST","7b2273656d616e74696373223a207b22656e74697479223a2022504944222c202262617365656e74697479223a2022616e79222c2022726f6c65223a2022727272222c20227370617469616c223a2022616e79222c202274656d706f72616c223a2022616e79227d2c20226461746170726f7065727479223a207b22666f726d6174223a2022696e616f6b615f70726f6772616d5f73616d706c655f73656d616e746963227d7d","48842  >  7000 Len=167"
"164","62.781829","192.168.11.19","192.168.11.17","TCP","74","","0.007475000","Jan  8, 2024 13:41:15.903758000 JST","","36252  >  6000 [SYN] Seq=0 Win=64240 Len=0 MSS=1460 SACK_PERM TSval=2827663663 TSecr=0 WS=128"
"165","62.781963","192.168.11.17","192.168.11.19","TCP","74","0.000134000","0.000134000","Jan  8, 2024 13:41:15.903892000 JST","","6000  >  36252 [SYN, ACK] Seq=0 Ack=1 Win=65160 Len=0 MSS=1460 SACK_PERM TSval=2362122625 TSecr=2827663663 WS=128"
"166","62.788675","192.168.11.19","192.168.11.17","TCP","66","0.006712000","0.006712000","Jan  8, 2024 13:41:15.910604000 JST","","36252  >  6000 [ACK] Seq=1 Ack=1 Win=64256 Len=0 TSval=2827663670 TSecr=2362122625"
"167","62.789249","192.168.11.19","192.168.11.17","TCP","93","","0.000574000","Jan  8, 2024 13:41:15.911178000 JST","","36252  >  6000 [PSH, ACK] Seq=1 Ack=1 Win=64256 Len=27 TSval=2827663670 TSecr=2362122625 [TCP segment of a reassembled PDU]"
"168","62.789344","192.168.11.17","192.168.11.19","TCP","66","0.000095000","0.000095000","Jan  8, 2024 13:41:15.911273000 JST","","6000  >  36252 [ACK] Seq=1 Ack=28 Win=65152 Len=0 TSval=2362122632 TSecr=2827663670"
