"No.","Time","Source","Destination","Protocol","Length","The RTT to ACK the segment was","Time delta from previous captured frame","Arrival Time","Data","Info"
"1","0.000000","192.168.11.20","192.168.11.19","TCP","74","","0.000000000","Jan  8, 2024 13:40:13.247124000 JST","","49302  >  6000 [SYN] Seq=0 Win=64240 Len=0 MSS=1460 SACK_PERM TSval=3836309164 TSecr=0 WS=128"
"2","0.021361","192.168.11.19","192.168.11.20","TCP","74","0.021361000","0.021361000","Jan  8, 2024 13:40:13.268485000 JST","","6000  >  49302 [SYN, ACK] Seq=0 Ack=1 Win=65160 Len=0 MSS=1460 SACK_PERM TSval=2488414142 TSecr=3836309164 WS=128"
"3","0.021475","192.168.11.20","192.168.11.19","TCP","66","0.000114000","0.000114000","Jan  8, 2024 13:40:13.268599000 JST","","49302  >  6000 [ACK] Seq=1 Ack=1 Win=64256 Len=0 TSval=3836309185 TSecr=2488414142"
"4","0.021816","192.168.11.20","192.168.11.19","TCP","93","","0.000341000","Jan  8, 2024 13:40:13.268940000 JST","","49302  >  6000 [PSH, ACK] Seq=1 Ack=1 Win=64256 Len=27 TSval=3836309186 TSecr=2488414142 [TCP segment of a reassembled PDU]"
"5","0.021972","192.168.11.20","192.168.11.19","TCP","66","","0.000156000","Jan  8, 2024 13:40:13.269096000 JST","","49302  >  6000 [FIN, ACK] Seq=28 Ack=1 Win=64256 Len=0 TSval=3836309186 TSecr=2488414142"
"6","0.028320","192.168.11.19","192.168.11.20","TCP","66","0.006504000","0.006348000","Jan  8, 2024 13:40:13.275444000 JST","","6000  >  49302 [ACK] Seq=1 Ack=28 Win=65152 Len=0 TSval=2488414163 TSecr=3836309186"
"7","0.028566","192.168.11.19","192.168.11.20","TCP","66","0.006594000","0.000246000","Jan  8, 2024 13:40:13.275690000 JST","","6000  >  49302 [FIN, ACK] Seq=1 Ack=29 Win=65152 Len=0 TSval=2488414165 TSecr=3836309186"
"8","0.028611","192.168.11.20","192.168.11.19","TCP","66","0.000045000","0.000045000","Jan  8, 2024 13:40:13.275735000 JST","","49302  >  6000 [ACK] Seq=29 Ack=2 Win=64256 Len=0 TSval=3836309192 TSecr=2488414165"
"9","0.058679","192.168.11.20","255.255.255.255","UDP","209","","0.030068000","Jan  8, 2024 13:40:13.305803000 JST","7b2273656d616e74696373223a207b22656e74697479223a2022504944222c202262617365656e74697479223a2022616e79222c2022726f6c65223a2022747474222c20227370617469616c223a2022616e79222c202274656d706f72616c223a2022616e79227d2c20226461746170726f7065727479223a207b22666f726d6174223a2022696e616f6b615f70726f6772616d5f73616d706c655f73656d616e746963227d7d","55108  >  7000 Len=167"
"10","0.067771","192.168.11.12","192.168.11.20","TCP","74","","0.009092000","Jan  8, 2024 13:40:13.314895000 JST","","39002  >  6000 [SYN] Seq=0 Win=64240 Len=0 MSS=1460 SACK_PERM TSval=926846487 TSecr=0 WS=128"
"11","0.067903","192.168.11.20","192.168.11.12","TCP","74","0.000132000","0.000132000","Jan  8, 2024 13:40:13.315027000 JST","","6000  >  39002 [SYN, ACK] Seq=0 Ack=1 Win=65160 Len=0 MSS=1460 SACK_PERM TSval=932339161 TSecr=926846487 WS=128"
"12","0.077979","192.168.11.12","192.168.11.20","TCP","66","0.010076000","0.010076000","Jan  8, 2024 13:40:13.325103000 JST","","39002  >  6000 [ACK] Seq=1 Ack=1 Win=64256 Len=0 TSval=926846497 TSecr=932339161"
"13","0.078548","192.168.11.12","192.168.11.20","TCP","93","","0.000569000","Jan  8, 2024 13:40:13.325672000 JST","","39002  >  6000 [PSH, ACK] Seq=1 Ack=1 Win=64256 Len=27 TSval=926846498 TSecr=932339161 [TCP segment of a reassembled PDU]"
"14","0.078652","192.168.11.20","192.168.11.12","TCP","66","0.000104000","0.000104000","Jan  8, 2024 13:40:13.325776000 JST","","6000  >  39002 [ACK] Seq=1 Ack=28 Win=65152 Len=0 TSval=932339171 TSecr=926846498"
"15","0.078732","192.168.11.12","192.168.11.20","TCP","66","","0.000080000","Jan  8, 2024 13:40:13.325856000 JST","","39002  >  6000 [FIN, ACK] Seq=28 Ack=1 Win=64256 Len=0 TSval=926846498 TSecr=932339161"
"16","0.080239","192.168.11.20","192.168.11.12","TCP","66","0.001507000","0.001507000","Jan  8, 2024 13:40:13.327363000 JST","","6000  >  39002 [FIN, ACK] Seq=1 Ack=29 Win=65152 Len=0 TSval=932339173 TSecr=926846498"
"17","0.088221","192.168.11.12","192.168.11.20","TCP","66","0.007982000","0.007982000","Jan  8, 2024 13:40:13.335345000 JST","","39002  >  6000 [ACK] Seq=29 Ack=2 Win=64256 Len=0 TSval=926846506 TSecr=932339173"
"18","6.919123","192.168.11.20","192.168.11.19","TCP","74","","6.830902000","Jan  8, 2024 13:40:20.166247000 JST","","49318  >  6000 [SYN] Seq=0 Win=64240 Len=0 MSS=1460 SACK_PERM TSval=3836316083 TSecr=0 WS=128"
"19","6.926172","192.168.11.19","192.168.11.20","TCP","74","0.007049000","0.007049000","Jan  8, 2024 13:40:20.173296000 JST","","6000  >  49318 [SYN, ACK] Seq=0 Ack=1 Win=65160 Len=0 MSS=1460 SACK_PERM TSval=2488421061 TSecr=3836316083 WS=128"
"20","6.926279","192.168.11.20","192.168.11.19","TCP","66","0.000107000","0.000107000","Jan  8, 2024 13:40:20.173403000 JST","","49318  >  6000 [ACK] Seq=1 Ack=1 Win=64256 Len=0 TSval=3836316090 TSecr=2488421061"
"21","6.926462","192.168.11.20","192.168.11.19","TCP","93","","0.000183000","Jan  8, 2024 13:40:20.173586000 JST","","49318  >  6000 [PSH, ACK] Seq=1 Ack=1 Win=64256 Len=27 TSval=3836316090 TSecr=2488421061 [TCP segment of a reassembled PDU]"
"22","6.926590","192.168.11.20","192.168.11.19","TCP","66","","0.000128000","Jan  8, 2024 13:40:20.173714000 JST","","49318  >  6000 [FIN, ACK] Seq=28 Ack=1 Win=64256 Len=0 TSval=3836316090 TSecr=2488421061"
"23","6.939021","192.168.11.19","192.168.11.20","TCP","66","0.012559000","0.012431000","Jan  8, 2024 13:40:20.186145000 JST","","6000  >  49318 [ACK] Seq=1 Ack=28 Win=65152 Len=0 TSval=2488421071 TSecr=3836316090"
"24","6.939406","192.168.11.19","192.168.11.20","TCP","66","0.012816000","0.000385000","Jan  8, 2024 13:40:20.186530000 JST","","6000  >  49318 [FIN, ACK] Seq=1 Ack=29 Win=65152 Len=0 TSval=2488421073 TSecr=3836316090"
"25","6.939451","192.168.11.20","192.168.11.19","TCP","66","0.000045000","0.000045000","Jan  8, 2024 13:40:20.186575000 JST","","49318  >  6000 [ACK] Seq=29 Ack=2 Win=64256 Len=0 TSval=3836316103 TSecr=2488421073"
"26","6.970684","192.168.11.20","255.255.255.255","UDP","209","","0.031233000","Jan  8, 2024 13:40:20.217808000 JST","7b2273656d616e74696373223a207b22656e74697479223a2022504944222c202262617365656e74697479223a2022616e79222c2022726f6c65223a2022747474222c20227370617469616c223a2022616e79222c202274656d706f72616c223a2022616e79227d2c20226461746170726f7065727479223a207b22666f726d6174223a2022696e616f6b615f70726f6772616d5f73616d706c655f73656d616e746963227d7d","57836  >  7000 Len=167"
"27","6.978302","192.168.11.12","192.168.11.20","TCP","74","","0.007618000","Jan  8, 2024 13:40:20.225426000 JST","","42106  >  6000 [SYN] Seq=0 Win=64240 Len=0 MSS=1460 SACK_PERM TSval=926853399 TSecr=0 WS=128"
"28","6.978447","192.168.11.20","192.168.11.12","TCP","74","0.000145000","0.000145000","Jan  8, 2024 13:40:20.225571000 JST","","6000  >  42106 [SYN, ACK] Seq=0 Ack=1 Win=65160 Len=0 MSS=1460 SACK_PERM TSval=932346071 TSecr=926853399 WS=128"
"29","6.985319","192.168.11.12","192.168.11.20","TCP","66","0.006872000","0.006872000","Jan  8, 2024 13:40:20.232443000 JST","","42106  >  6000 [ACK] Seq=1 Ack=1 Win=64256 Len=0 TSval=926853406 TSecr=932346071"
"30","6.986347","192.168.11.12","192.168.11.20","TCP","93","","0.001028000","Jan  8, 2024 13:40:20.233471000 JST","","42106  >  6000 [PSH, ACK] Seq=1 Ack=1 Win=64256 Len=27 TSval=926853406 TSecr=932346071 [TCP segment of a reassembled PDU]"
"31","6.986479","192.168.11.20","192.168.11.12","TCP","66","0.000132000","0.000132000","Jan  8, 2024 13:40:20.233603000 JST","","6000  >  42106 [ACK] Seq=1 Ack=28 Win=65152 Len=0 TSval=932346079 TSecr=926853406"
"32","6.986563","192.168.11.12","192.168.11.20","TCP","66","","0.000084000","Jan  8, 2024 13:40:20.233687000 JST","","42106  >  6000 [FIN, ACK] Seq=28 Ack=1 Win=64256 Len=0 TSval=926853406 TSecr=932346071"
"33","6.987904","192.168.11.20","192.168.11.12","TCP","66","0.001341000","0.001341000","Jan  8, 2024 13:40:20.235028000 JST","","6000  >  42106 [FIN, ACK] Seq=1 Ack=29 Win=65152 Len=0 TSval=932346081 TSecr=926853406"
"34","6.995446","192.168.11.12","192.168.11.20","TCP","66","0.007542000","0.007542000","Jan  8, 2024 13:40:20.242570000 JST","","42106  >  6000 [ACK] Seq=29 Ack=2 Win=64256 Len=0 TSval=926853414 TSecr=932346081"
"35","14.661345","192.168.11.20","192.168.11.19","TCP","74","","7.665899000","Jan  8, 2024 13:40:27.908469000 JST","","46210  >  6000 [SYN] Seq=0 Win=64240 Len=0 MSS=1460 SACK_PERM TSval=3836323825 TSecr=0 WS=128"
"36","14.668005","192.168.11.19","192.168.11.20","TCP","74","0.006660000","0.006660000","Jan  8, 2024 13:40:27.915129000 JST","","6000  >  46210 [SYN, ACK] Seq=0 Ack=1 Win=65160 Len=0 MSS=1460 SACK_PERM TSval=2488428803 TSecr=3836323825 WS=128"
"37","14.668116","192.168.11.20","192.168.11.19","TCP","66","0.000111000","0.000111000","Jan  8, 2024 13:40:27.915240000 JST","","46210  >  6000 [ACK] Seq=1 Ack=1 Win=64256 Len=0 TSval=3836323832 TSecr=2488428803"
"38","14.668298","192.168.11.20","192.168.11.19","TCP","93","","0.000182000","Jan  8, 2024 13:40:27.915422000 JST","","46210  >  6000 [PSH, ACK] Seq=1 Ack=1 Win=64256 Len=27 TSval=3836323832 TSecr=2488428803 [TCP segment of a reassembled PDU]"
"39","14.668412","192.168.11.20","192.168.11.19","TCP","66","","0.000114000","Jan  8, 2024 13:40:27.915536000 JST","","46210  >  6000 [FIN, ACK] Seq=28 Ack=1 Win=64256 Len=0 TSval=3836323832 TSecr=2488428803"
"40","14.677142","192.168.11.19","192.168.11.20","TCP","66","0.008844000","0.008730000","Jan  8, 2024 13:40:27.924266000 JST","","6000  >  46210 [ACK] Seq=1 Ack=28 Win=65152 Len=0 TSval=2488428810 TSecr=3836323832"
"41","14.677514","192.168.11.19","192.168.11.20","TCP","66","0.009102000","0.000372000","Jan  8, 2024 13:40:27.924638000 JST","","6000  >  46210 [FIN, ACK] Seq=1 Ack=29 Win=65152 Len=0 TSval=2488428812 TSecr=3836323832"
"42","14.677558","192.168.11.20","192.168.11.19","TCP","66","0.000044000","0.000044000","Jan  8, 2024 13:40:27.924682000 JST","","46210  >  6000 [ACK] Seq=29 Ack=2 Win=64256 Len=0 TSval=3836323841 TSecr=2488428812"
"43","14.710306","192.168.11.20","255.255.255.255","UDP","209","","0.032748000","Jan  8, 2024 13:40:27.957430000 JST","7b2273656d616e74696373223a207b22656e74697479223a2022504944222c202262617365656e74697479223a2022616e79222c2022726f6c65223a2022747474222c20227370617469616c223a2022616e79222c202274656d706f72616c223a2022616e79227d2c20226461746170726f7065727479223a207b22666f726d6174223a2022696e616f6b615f70726f6772616d5f73616d706c655f73656d616e746963227d7d","33270  >  7000 Len=167"
"44","14.723408","192.168.11.12","192.168.11.20","TCP","74","","0.013102000","Jan  8, 2024 13:40:27.970532000 JST","","52020  >  6000 [SYN] Seq=0 Win=64240 Len=0 MSS=1460 SACK_PERM TSval=926861141 TSecr=0 WS=128"
"45","14.723628","192.168.11.20","192.168.11.12","TCP","74","0.000220000","0.000220000","Jan  8, 2024 13:40:27.970752000 JST","","6000  >  52020 [SYN, ACK] Seq=0 Ack=1 Win=65160 Len=0 MSS=1460 SACK_PERM TSval=932353816 TSecr=926861141 WS=128"
"46","14.730987","192.168.11.12","192.168.11.20","TCP","66","0.007359000","0.007359000","Jan  8, 2024 13:40:27.978111000 JST","","52020  >  6000 [ACK] Seq=1 Ack=1 Win=64256 Len=0 TSval=926861151 TSecr=932353816"
"47","14.731981","192.168.11.12","192.168.11.20","TCP","93","","0.000994000","Jan  8, 2024 13:40:27.979105000 JST","","52020  >  6000 [PSH, ACK] Seq=1 Ack=1 Win=64256 Len=27 TSval=926861151 TSecr=932353816 [TCP segment of a reassembled PDU]"
"48","14.732170","192.168.11.20","192.168.11.12","TCP","66","0.000189000","0.000189000","Jan  8, 2024 13:40:27.979294000 JST","","6000  >  52020 [ACK] Seq=1 Ack=28 Win=65152 Len=0 TSval=932353825 TSecr=926861151"
"49","14.732309","192.168.11.12","192.168.11.20","TCP","66","","0.000139000","Jan  8, 2024 13:40:27.979433000 JST","","52020  >  6000 [FIN, ACK] Seq=28 Ack=1 Win=64256 Len=0 TSval=926861151 TSecr=932353816"
"50","14.734147","192.168.11.20","192.168.11.12","TCP","66","0.001838000","0.001838000","Jan  8, 2024 13:40:27.981271000 JST","","6000  >  52020 [FIN, ACK] Seq=1 Ack=29 Win=65152 Len=0 TSval=932353827 TSecr=926861151"
"51","14.742090","192.168.11.12","192.168.11.20","TCP","66","0.007943000","0.007943000","Jan  8, 2024 13:40:27.989214000 JST","","52020  >  6000 [ACK] Seq=29 Ack=2 Win=64256 Len=0 TSval=926861160 TSecr=932353827"
"52","21.343039","192.168.11.20","192.168.11.19","TCP","74","","6.600949000","Jan  8, 2024 13:40:34.590163000 JST","","54172  >  6000 [SYN] Seq=0 Win=64240 Len=0 MSS=1460 SACK_PERM TSval=3836330507 TSecr=0 WS=128"
"53","21.349722","192.168.11.19","192.168.11.20","TCP","74","0.006683000","0.006683000","Jan  8, 2024 13:40:34.596846000 JST","","6000  >  54172 [SYN, ACK] Seq=0 Ack=1 Win=65160 Len=0 MSS=1460 SACK_PERM TSval=2488435485 TSecr=3836330507 WS=128"
"54","21.349826","192.168.11.20","192.168.11.19","TCP","66","0.000104000","0.000104000","Jan  8, 2024 13:40:34.596950000 JST","","54172  >  6000 [ACK] Seq=1 Ack=1 Win=64256 Len=0 TSval=3836330514 TSecr=2488435485"
"55","21.350031","192.168.11.20","192.168.11.19","TCP","93","","0.000205000","Jan  8, 2024 13:40:34.597155000 JST","","54172  >  6000 [PSH, ACK] Seq=1 Ack=1 Win=64256 Len=27 TSval=3836330514 TSecr=2488435485 [TCP segment of a reassembled PDU]"
"56","21.350134","192.168.11.20","192.168.11.19","TCP","66","","0.000103000","Jan  8, 2024 13:40:34.597258000 JST","","54172  >  6000 [FIN, ACK] Seq=28 Ack=1 Win=64256 Len=0 TSval=3836330514 TSecr=2488435485"
"57","21.357228","192.168.11.19","192.168.11.20","TCP","66","0.007197000","0.007094000","Jan  8, 2024 13:40:34.604352000 JST","","6000  >  54172 [ACK] Seq=1 Ack=28 Win=65152 Len=0 TSval=2488435492 TSecr=3836330514"
"58","21.357626","192.168.11.19","192.168.11.20","TCP","66","0.007492000","0.000398000","Jan  8, 2024 13:40:34.604750000 JST","","6000  >  54172 [FIN, ACK] Seq=1 Ack=29 Win=65152 Len=0 TSval=2488435493 TSecr=3836330514"
"59","21.357674","192.168.11.20","192.168.11.19","TCP","66","0.000048000","0.000048000","Jan  8, 2024 13:40:34.604798000 JST","","54172  >  6000 [ACK] Seq=29 Ack=2 Win=64256 Len=0 TSval=3836330522 TSecr=2488435493"
"60","21.387563","192.168.11.20","255.255.255.255","UDP","209","","0.029889000","Jan  8, 2024 13:40:34.634687000 JST","7b2273656d616e74696373223a207b22656e74697479223a2022504944222c202262617365656e74697479223a2022616e79222c2022726f6c65223a2022747474222c20227370617469616c223a2022616e79222c202274656d706f72616c223a2022616e79227d2c20226461746170726f7065727479223a207b22666f726d6174223a2022696e616f6b615f70726f6772616d5f73616d706c655f73656d616e746963227d7d","54445  >  7000 Len=167"
"61","21.403278","192.168.11.12","192.168.11.20","TCP","74","","0.015715000","Jan  8, 2024 13:40:34.650402000 JST","","52030  >  6000 [SYN] Seq=0 Win=64240 Len=0 MSS=1460 SACK_PERM TSval=926867821 TSecr=0 WS=128"
"62","21.403479","192.168.11.20","192.168.11.12","TCP","74","0.000201000","0.000201000","Jan  8, 2024 13:40:34.650603000 JST","","6000  >  52030 [SYN, ACK] Seq=0 Ack=1 Win=65160 Len=0 MSS=1460 SACK_PERM TSval=932360496 TSecr=926867821 WS=128"
"63","21.420390","192.168.11.12","192.168.11.20","TCP","66","0.016911000","0.016911000","Jan  8, 2024 13:40:34.667514000 JST","","52030  >  6000 [ACK] Seq=1 Ack=1 Win=64256 Len=0 TSval=926867836 TSecr=932360496"
"64","21.420910","192.168.11.12","192.168.11.20","TCP","93","","0.000520000","Jan  8, 2024 13:40:34.668034000 JST","","52030  >  6000 [PSH, ACK] Seq=1 Ack=1 Win=64256 Len=27 TSval=926867836 TSecr=932360496 [TCP segment of a reassembled PDU]"
"65","21.420979","192.168.11.20","192.168.11.12","TCP","66","0.000069000","0.000069000","Jan  8, 2024 13:40:34.668103000 JST","","6000  >  52030 [ACK] Seq=1 Ack=28 Win=65152 Len=0 TSval=932360514 TSecr=926867836"
"66","21.421042","192.168.11.12","192.168.11.20","TCP","66","","0.000063000","Jan  8, 2024 13:40:34.668166000 JST","","52030  >  6000 [FIN, ACK] Seq=28 Ack=1 Win=64256 Len=0 TSval=926867836 TSecr=932360496"
"67","21.422197","192.168.11.20","192.168.11.12","TCP","66","0.001155000","0.001155000","Jan  8, 2024 13:40:34.669321000 JST","","6000  >  52030 [FIN, ACK] Seq=1 Ack=29 Win=65152 Len=0 TSval=932360515 TSecr=926867836"
"68","21.429419","192.168.11.12","192.168.11.20","TCP","66","0.007222000","0.007222000","Jan  8, 2024 13:40:34.676543000 JST","","52030  >  6000 [ACK] Seq=29 Ack=2 Win=64256 Len=0 TSval=926867850 TSecr=932360515"
"69","29.116515","192.168.11.20","192.168.11.19","TCP","74","","7.687096000","Jan  8, 2024 13:40:42.363639000 JST","","55698  >  6000 [SYN] Seq=0 Win=64240 Len=0 MSS=1460 SACK_PERM TSval=3836338280 TSecr=0 WS=128"
"70","29.125455","192.168.11.19","192.168.11.20","TCP","74","0.008940000","0.008940000","Jan  8, 2024 13:40:42.372579000 JST","","6000  >  55698 [SYN, ACK] Seq=0 Ack=1 Win=65160 Len=0 MSS=1460 SACK_PERM TSval=2488443258 TSecr=3836338280 WS=128"
"71","29.125576","192.168.11.20","192.168.11.19","TCP","66","0.000121000","0.000121000","Jan  8, 2024 13:40:42.372700000 JST","","55698  >  6000 [ACK] Seq=1 Ack=1 Win=64256 Len=0 TSval=3836338289 TSecr=2488443258"
"72","29.125834","192.168.11.20","192.168.11.19","TCP","93","","0.000258000","Jan  8, 2024 13:40:42.372958000 JST","","55698  >  6000 [PSH, ACK] Seq=1 Ack=1 Win=64256 Len=27 TSval=3836338290 TSecr=2488443258 [TCP segment of a reassembled PDU]"
"73","29.125942","192.168.11.20","192.168.11.19","TCP","66","","0.000108000","Jan  8, 2024 13:40:42.373066000 JST","","55698  >  6000 [FIN, ACK] Seq=28 Ack=1 Win=64256 Len=0 TSval=3836338290 TSecr=2488443258"
"74","29.133244","192.168.11.19","192.168.11.20","TCP","66","0.007410000","0.007302000","Jan  8, 2024 13:40:42.380368000 JST","","6000  >  55698 [ACK] Seq=1 Ack=28 Win=65152 Len=0 TSval=2488443268 TSecr=3836338290"
"75","29.133473","192.168.11.19","192.168.11.20","TCP","66","0.007531000","0.000229000","Jan  8, 2024 13:40:42.380597000 JST","","6000  >  55698 [FIN, ACK] Seq=1 Ack=29 Win=65152 Len=0 TSval=2488443270 TSecr=3836338290"
"76","29.133517","192.168.11.20","192.168.11.19","TCP","66","0.000044000","0.000044000","Jan  8, 2024 13:40:42.380641000 JST","","55698  >  6000 [ACK] Seq=29 Ack=2 Win=64256 Len=0 TSval=3836338297 TSecr=2488443270"
"77","29.163800","192.168.11.20","255.255.255.255","UDP","209","","0.030283000","Jan  8, 2024 13:40:42.410924000 JST","7b2273656d616e74696373223a207b22656e74697479223a2022504944222c202262617365656e74697479223a2022616e79222c2022726f6c65223a2022747474222c20227370617469616c223a2022616e79222c202274656d706f72616c223a2022616e79227d2c20226461746170726f7065727479223a207b22666f726d6174223a2022696e616f6b615f70726f6772616d5f73616d706c655f73656d616e746963227d7d","56228  >  7000 Len=167"
"78","29.172754","192.168.11.12","192.168.11.20","TCP","74","","0.008954000","Jan  8, 2024 13:40:42.419878000 JST","","37204  >  6000 [SYN] Seq=0 Win=64240 Len=0 MSS=1460 SACK_PERM TSval=926875592 TSecr=0 WS=128"
"79","29.172909","192.168.11.20","192.168.11.12","TCP","74","0.000155000","0.000155000","Jan  8, 2024 13:40:42.420033000 JST","","6000  >  37204 [SYN, ACK] Seq=0 Ack=1 Win=65160 Len=0 MSS=1460 SACK_PERM TSval=932368266 TSecr=926875592 WS=128"
"80","29.183872","192.168.11.12","192.168.11.20","TCP","66","0.010963000","0.010963000","Jan  8, 2024 13:40:42.430996000 JST","","37204  >  6000 [ACK] Seq=1 Ack=1 Win=64256 Len=0 TSval=926875600 TSecr=932368266"
"81","29.184403","192.168.11.12","192.168.11.20","TCP","93","","0.000531000","Jan  8, 2024 13:40:42.431527000 JST","","37204  >  6000 [PSH, ACK] Seq=1 Ack=1 Win=64256 Len=27 TSval=926875601 TSecr=932368266 [TCP segment of a reassembled PDU]"
"82","29.184499","192.168.11.20","192.168.11.12","TCP","66","0.000096000","0.000096000","Jan  8, 2024 13:40:42.431623000 JST","","6000  >  37204 [ACK] Seq=1 Ack=28 Win=65152 Len=0 TSval=932368277 TSecr=926875601"
"83","29.184579","192.168.11.12","192.168.11.20","TCP","66","","0.000080000","Jan  8, 2024 13:40:42.431703000 JST","","37204  >  6000 [FIN, ACK] Seq=28 Ack=1 Win=64256 Len=0 TSval=926875601 TSecr=932368266"
"84","29.185899","192.168.11.20","192.168.11.12","TCP","66","0.001320000","0.001320000","Jan  8, 2024 13:40:42.433023000 JST","","6000  >  37204 [FIN, ACK] Seq=1 Ack=29 Win=65152 Len=0 TSval=932368279 TSecr=926875601"
"85","29.191514","192.168.11.12","192.168.11.20","TCP","66","0.005615000","0.005615000","Jan  8, 2024 13:40:42.438638000 JST","","37204  >  6000 [ACK] Seq=29 Ack=2 Win=64256 Len=0 TSval=926875612 TSecr=932368279"
"86","35.830193","192.168.11.20","192.168.11.19","TCP","74","","6.638679000","Jan  8, 2024 13:40:49.077317000 JST","","55708  >  6000 [SYN] Seq=0 Win=64240 Len=0 MSS=1460 SACK_PERM TSval=3836344994 TSecr=0 WS=128"
"87","35.837364","192.168.11.19","192.168.11.20","TCP","74","0.007171000","0.007171000","Jan  8, 2024 13:40:49.084488000 JST","","6000  >  55708 [SYN, ACK] Seq=0 Ack=1 Win=65160 Len=0 MSS=1460 SACK_PERM TSval=2488449972 TSecr=3836344994 WS=128"
"88","35.837482","192.168.11.20","192.168.11.19","TCP","66","0.000118000","0.000118000","Jan  8, 2024 13:40:49.084606000 JST","","55708  >  6000 [ACK] Seq=1 Ack=1 Win=64256 Len=0 TSval=3836345001 TSecr=2488449972"
"89","35.837775","192.168.11.20","192.168.11.19","TCP","93","","0.000293000","Jan  8, 2024 13:40:49.084899000 JST","","55708  >  6000 [PSH, ACK] Seq=1 Ack=1 Win=64256 Len=27 TSval=3836345002 TSecr=2488449972 [TCP segment of a reassembled PDU]"
"90","35.837873","192.168.11.20","192.168.11.19","TCP","66","","0.000098000","Jan  8, 2024 13:40:49.084997000 JST","","55708  >  6000 [FIN, ACK] Seq=28 Ack=1 Win=64256 Len=0 TSval=3836345002 TSecr=2488449972"
"91","35.844789","192.168.11.19","192.168.11.20","TCP","66","0.007014000","0.006916000","Jan  8, 2024 13:40:49.091913000 JST","","6000  >  55708 [ACK] Seq=1 Ack=28 Win=65152 Len=0 TSval=2488449980 TSecr=3836345002"
"92","35.845018","192.168.11.19","192.168.11.20","TCP","66","0.007145000","0.000229000","Jan  8, 2024 13:40:49.092142000 JST","","6000  >  55708 [FIN, ACK] Seq=1 Ack=29 Win=65152 Len=0 TSval=2488449981 TSecr=3836345002"
"93","35.845072","192.168.11.20","192.168.11.19","TCP","66","0.000054000","0.000054000","Jan  8, 2024 13:40:49.092196000 JST","","55708  >  6000 [ACK] Seq=29 Ack=2 Win=64256 Len=0 TSval=3836345009 TSecr=2488449981"
"94","35.875453","192.168.11.20","255.255.255.255","UDP","209","","0.030381000","Jan  8, 2024 13:40:49.122577000 JST","7b2273656d616e74696373223a207b22656e74697479223a2022504944222c202262617365656e74697479223a2022616e79222c2022726f6c65223a2022747474222c20227370617469616c223a2022616e79222c202274656d706f72616c223a2022616e79227d2c20226461746170726f7065727479223a207b22666f726d6174223a2022696e616f6b615f70726f6772616d5f73616d706c655f73656d616e746963227d7d","51211  >  7000 Len=167"
"95","35.885838","192.168.11.12","192.168.11.20","TCP","74","","0.010385000","Jan  8, 2024 13:40:49.132962000 JST","","33106  >  6000 [SYN] Seq=0 Win=64240 Len=0 MSS=1460 SACK_PERM TSval=926882304 TSecr=0 WS=128"
"96","35.885997","192.168.11.20","192.168.11.12","TCP","74","0.000159000","0.000159000","Jan  8, 2024 13:40:49.133121000 JST","","6000  >  33106 [SYN, ACK] Seq=0 Ack=1 Win=65160 Len=0 MSS=1460 SACK_PERM TSval=932374979 TSecr=926882304 WS=128"
"97","35.892619","192.168.11.12","192.168.11.20","TCP","66","0.006622000","0.006622000","Jan  8, 2024 13:40:49.139743000 JST","","33106  >  6000 [ACK] Seq=1 Ack=1 Win=64256 Len=0 TSval=926882313 TSecr=932374979"
"98","35.893191","192.168.11.12","192.168.11.20","TCP","93","","0.000572000","Jan  8, 2024 13:40:49.140315000 JST","","33106  >  6000 [PSH, ACK] Seq=1 Ack=1 Win=64256 Len=27 TSval=926882313 TSecr=932374979 [TCP segment of a reassembled PDU]"
"99","35.893309","192.168.11.20","192.168.11.12","TCP","66","0.000118000","0.000118000","Jan  8, 2024 13:40:49.140433000 JST","","6000  >  33106 [ACK] Seq=1 Ack=28 Win=65152 Len=0 TSval=932374986 TSecr=926882313"
"100","35.893370","192.168.11.12","192.168.11.20","TCP","66","","0.000061000","Jan  8, 2024 13:40:49.140494000 JST","","33106  >  6000 [FIN, ACK] Seq=28 Ack=1 Win=64256 Len=0 TSval=926882314 TSecr=932374979"
"101","35.894527","192.168.11.20","192.168.11.12","TCP","66","0.001157000","0.001157000","Jan  8, 2024 13:40:49.141651000 JST","","6000  >  33106 [FIN, ACK] Seq=1 Ack=29 Win=65152 Len=0 TSval=932374987 TSecr=926882314"
"102","35.914305","192.168.11.12","192.168.11.20","TCP","66","0.019778000","0.019778000","Jan  8, 2024 13:40:49.161429000 JST","","33106  >  6000 [ACK] Seq=29 Ack=2 Win=64256 Len=0 TSval=926882328 TSecr=932374987"
"103","42.608333","192.168.11.20","192.168.11.19","TCP","74","","6.694028000","Jan  8, 2024 13:40:55.855457000 JST","","58990  >  6000 [SYN] Seq=0 Win=64240 Len=0 MSS=1460 SACK_PERM TSval=3836351772 TSecr=0 WS=128"
"104","42.614972","192.168.11.19","192.168.11.20","TCP","74","0.006639000","0.006639000","Jan  8, 2024 13:40:55.862096000 JST","","6000  >  58990 [SYN, ACK] Seq=0 Ack=1 Win=65160 Len=0 MSS=1460 SACK_PERM TSval=2488456750 TSecr=3836351772 WS=128"
"105","42.615082","192.168.11.20","192.168.11.19","TCP","66","0.000110000","0.000110000","Jan  8, 2024 13:40:55.862206000 JST","","58990  >  6000 [ACK] Seq=1 Ack=1 Win=64256 Len=0 TSval=3836351779 TSecr=2488456750"
"106","42.615221","192.168.11.20","192.168.11.19","TCP","93","","0.000139000","Jan  8, 2024 13:40:55.862345000 JST","","58990  >  6000 [PSH, ACK] Seq=1 Ack=1 Win=64256 Len=27 TSval=3836351779 TSecr=2488456750 [TCP segment of a reassembled PDU]"
"107","42.615339","192.168.11.20","192.168.11.19","TCP","66","","0.000118000","Jan  8, 2024 13:40:55.862463000 JST","","58990  >  6000 [FIN, ACK] Seq=28 Ack=1 Win=64256 Len=0 TSval=3836351779 TSecr=2488456750"
"108","42.622385","192.168.11.19","192.168.11.20","TCP","66","0.007164000","0.007046000","Jan  8, 2024 13:40:55.869509000 JST","","6000  >  58990 [ACK] Seq=1 Ack=28 Win=65152 Len=0 TSval=2488456757 TSecr=3836351779"
"109","42.622759","192.168.11.19","192.168.11.20","TCP","66","0.007420000","0.000374000","Jan  8, 2024 13:40:55.869883000 JST","","6000  >  58990 [FIN, ACK] Seq=1 Ack=29 Win=65152 Len=0 TSval=2488456758 TSecr=3836351779"
"110","42.622808","192.168.11.20","192.168.11.19","TCP","66","0.000049000","0.000049000","Jan  8, 2024 13:40:55.869932000 JST","","58990  >  6000 [ACK] Seq=29 Ack=2 Win=64256 Len=0 TSval=3836351787 TSecr=2488456758"
"111","42.654551","192.168.11.20","255.255.255.255","UDP","209","","0.031743000","Jan  8, 2024 13:40:55.901675000 JST","7b2273656d616e74696373223a207b22656e74697479223a2022504944222c202262617365656e74697479223a2022616e79222c2022726f6c65223a2022747474222c20227370617469616c223a2022616e79222c202274656d706f72616c223a2022616e79227d2c20226461746170726f7065727479223a207b22666f726d6174223a2022696e616f6b615f70726f6772616d5f73616d706c655f73656d616e746963227d7d","56666  >  7000 Len=167"
"112","42.662072","192.168.11.12","192.168.11.20","TCP","74","","0.007521000","Jan  8, 2024 13:40:55.909196000 JST","","33114  >  6000 [SYN] Seq=0 Win=64240 Len=0 MSS=1460 SACK_PERM TSval=926889083 TSecr=0 WS=128"
"113","42.662218","192.168.11.20","192.168.11.12","TCP","74","0.000146000","0.000146000","Jan  8, 2024 13:40:55.909342000 JST","","6000  >  33114 [SYN, ACK] Seq=0 Ack=1 Win=65160 Len=0 MSS=1460 SACK_PERM TSval=932381755 TSecr=926889083 WS=128"
"114","42.669926","192.168.11.12","192.168.11.20","TCP","66","0.007708000","0.007708000","Jan  8, 2024 13:40:55.917050000 JST","","33114  >  6000 [ACK] Seq=1 Ack=1 Win=64256 Len=0 TSval=926889090 TSecr=932381755"
"115","42.670609","192.168.11.12","192.168.11.20","TCP","93","","0.000683000","Jan  8, 2024 13:40:55.917733000 JST","","33114  >  6000 [PSH, ACK] Seq=1 Ack=1 Win=64256 Len=27 TSval=926889090 TSecr=932381755 [TCP segment of a reassembled PDU]"
"116","42.670722","192.168.11.20","192.168.11.12","TCP","66","0.000113000","0.000113000","Jan  8, 2024 13:40:55.917846000 JST","","6000  >  33114 [ACK] Seq=1 Ack=28 Win=65152 Len=0 TSval=932381764 TSecr=926889090"
"117","42.670813","192.168.11.12","192.168.11.20","TCP","66","","0.000091000","Jan  8, 2024 13:40:55.917937000 JST","","33114  >  6000 [FIN, ACK] Seq=28 Ack=1 Win=64256 Len=0 TSval=926889090 TSecr=932381755"
"118","42.672145","192.168.11.20","192.168.11.12","TCP","66","0.001332000","0.001332000","Jan  8, 2024 13:40:55.919269000 JST","","6000  >  33114 [FIN, ACK] Seq=1 Ack=29 Win=65152 Len=0 TSval=932381765 TSecr=926889090"
"119","42.678443","192.168.11.12","192.168.11.20","TCP","66","0.006298000","0.006298000","Jan  8, 2024 13:40:55.925567000 JST","","33114  >  6000 [ACK] Seq=29 Ack=2 Win=64256 Len=0 TSval=926889098 TSecr=932381765"
"120","49.341340","192.168.11.20","192.168.11.19","TCP","74","","6.662897000","Jan  8, 2024 13:41:02.588464000 JST","","37548  >  6000 [SYN] Seq=0 Win=64240 Len=0 MSS=1460 SACK_PERM TSval=3836358505 TSecr=0 WS=128"
"121","49.354059","192.168.11.19","192.168.11.20","TCP","74","0.012719000","0.012719000","Jan  8, 2024 13:41:02.601183000 JST","","6000  >  37548 [SYN, ACK] Seq=0 Ack=1 Win=65160 Len=0 MSS=1460 SACK_PERM TSval=2488463483 TSecr=3836358505 WS=128"
"122","49.354164","192.168.11.20","192.168.11.19","TCP","66","0.000105000","0.000105000","Jan  8, 2024 13:41:02.601288000 JST","","37548  >  6000 [ACK] Seq=1 Ack=1 Win=64256 Len=0 TSval=3836358518 TSecr=2488463483"
"123","49.354371","192.168.11.20","192.168.11.19","TCP","93","","0.000207000","Jan  8, 2024 13:41:02.601495000 JST","","37548  >  6000 [PSH, ACK] Seq=1 Ack=1 Win=64256 Len=27 TSval=3836358518 TSecr=2488463483 [TCP segment of a reassembled PDU]"
"124","49.354482","192.168.11.20","192.168.11.19","TCP","66","","0.000111000","Jan  8, 2024 13:41:02.601606000 JST","","37548  >  6000 [FIN, ACK] Seq=28 Ack=1 Win=64256 Len=0 TSval=3836358518 TSecr=2488463483"
"125","49.370538","192.168.11.19","192.168.11.20","TCP","66","0.016167000","0.016056000","Jan  8, 2024 13:41:02.617662000 JST","","6000  >  37548 [ACK] Seq=1 Ack=28 Win=65152 Len=0 TSval=2488463505 TSecr=3836358518"
"126","49.370902","192.168.11.19","192.168.11.20","TCP","66","0.016420000","0.000364000","Jan  8, 2024 13:41:02.618026000 JST","","6000  >  37548 [FIN, ACK] Seq=1 Ack=29 Win=65152 Len=0 TSval=2488463506 TSecr=3836358518"
"127","49.370949","192.168.11.20","192.168.11.19","TCP","66","0.000047000","0.000047000","Jan  8, 2024 13:41:02.618073000 JST","","37548  >  6000 [ACK] Seq=29 Ack=2 Win=64256 Len=0 TSval=3836358535 TSecr=2488463506"
"128","49.399554","192.168.11.20","255.255.255.255","UDP","209","","0.028605000","Jan  8, 2024 13:41:02.646678000 JST","7b2273656d616e74696373223a207b22656e74697479223a2022504944222c202262617365656e74697479223a2022616e79222c2022726f6c65223a2022747474222c20227370617469616c223a2022616e79222c202274656d706f72616c223a2022616e79227d2c20226461746170726f7065727479223a207b22666f726d6174223a2022696e616f6b615f70726f6772616d5f73616d706c655f73656d616e746963227d7d","36631  >  7000 Len=167"
"129","49.407239","192.168.11.12","192.168.11.20","TCP","74","","0.007685000","Jan  8, 2024 13:41:02.654363000 JST","","37394  >  6000 [SYN] Seq=0 Win=64240 Len=0 MSS=1460 SACK_PERM TSval=926895828 TSecr=0 WS=128"
"130","49.407399","192.168.11.20","192.168.11.12","TCP","74","0.000160000","0.000160000","Jan  8, 2024 13:41:02.654523000 JST","","6000  >  37394 [SYN, ACK] Seq=0 Ack=1 Win=65160 Len=0 MSS=1460 SACK_PERM TSval=932388500 TSecr=926895828 WS=128"
"131","49.416839","192.168.11.12","192.168.11.20","TCP","66","0.009440000","0.009440000","Jan  8, 2024 13:41:02.663963000 JST","","37394  >  6000 [ACK] Seq=1 Ack=1 Win=64256 Len=0 TSval=926895837 TSecr=932388500"
"132","49.417337","192.168.11.12","192.168.11.20","TCP","93","","0.000498000","Jan  8, 2024 13:41:02.664461000 JST","","37394  >  6000 [PSH, ACK] Seq=1 Ack=1 Win=64256 Len=27 TSval=926895838 TSecr=932388500 [TCP segment of a reassembled PDU]"
"133","49.417429","192.168.11.20","192.168.11.12","TCP","66","0.000092000","0.000092000","Jan  8, 2024 13:41:02.664553000 JST","","6000  >  37394 [ACK] Seq=1 Ack=28 Win=65152 Len=0 TSval=932388510 TSecr=926895838"
"134","49.417498","192.168.11.12","192.168.11.20","TCP","66","","0.000069000","Jan  8, 2024 13:41:02.664622000 JST","","37394  >  6000 [FIN, ACK] Seq=28 Ack=1 Win=64256 Len=0 TSval=926895838 TSecr=932388500"
"135","49.418998","192.168.11.20","192.168.11.12","TCP","66","0.001500000","0.001500000","Jan  8, 2024 13:41:02.666122000 JST","","6000  >  37394 [FIN, ACK] Seq=1 Ack=29 Win=65152 Len=0 TSval=932388512 TSecr=926895838"
"136","49.424062","192.168.11.12","192.168.11.20","TCP","66","0.005064000","0.005064000","Jan  8, 2024 13:41:02.671186000 JST","","37394  >  6000 [ACK] Seq=29 Ack=2 Win=64256 Len=0 TSval=926895845 TSecr=932388512"
"137","56.053179","192.168.11.20","192.168.11.19","TCP","74","","6.629117000","Jan  8, 2024 13:41:09.300303000 JST","","37558  >  6000 [SYN] Seq=0 Win=64240 Len=0 MSS=1460 SACK_PERM TSval=3836365217 TSecr=0 WS=128"
"138","56.060622","192.168.11.19","192.168.11.20","TCP","74","0.007443000","0.007443000","Jan  8, 2024 13:41:09.307746000 JST","","6000  >  37558 [SYN, ACK] Seq=0 Ack=1 Win=65160 Len=0 MSS=1460 SACK_PERM TSval=2488470196 TSecr=3836365217 WS=128"
"139","56.060742","192.168.11.20","192.168.11.19","TCP","66","0.000120000","0.000120000","Jan  8, 2024 13:41:09.307866000 JST","","37558  >  6000 [ACK] Seq=1 Ack=1 Win=64256 Len=0 TSval=3836365225 TSecr=2488470196"
"140","56.060924","192.168.11.20","192.168.11.19","TCP","93","","0.000182000","Jan  8, 2024 13:41:09.308048000 JST","","37558  >  6000 [PSH, ACK] Seq=1 Ack=1 Win=64256 Len=27 TSval=3836365225 TSecr=2488470196 [TCP segment of a reassembled PDU]"
"141","56.061037","192.168.11.20","192.168.11.19","TCP","66","","0.000113000","Jan  8, 2024 13:41:09.308161000 JST","","37558  >  6000 [FIN, ACK] Seq=28 Ack=1 Win=64256 Len=0 TSval=3836365225 TSecr=2488470196"
"142","56.068669","192.168.11.19","192.168.11.20","TCP","66","0.007745000","0.007632000","Jan  8, 2024 13:41:09.315793000 JST","","6000  >  37558 [ACK] Seq=1 Ack=28 Win=65152 Len=0 TSval=2488470203 TSecr=3836365225"
"143","56.068922","192.168.11.19","192.168.11.20","TCP","66","0.007885000","0.000253000","Jan  8, 2024 13:41:09.316046000 JST","","6000  >  37558 [FIN, ACK] Seq=1 Ack=29 Win=65152 Len=0 TSval=2488470205 TSecr=3836365225"
"144","56.068983","192.168.11.20","192.168.11.19","TCP","66","0.000061000","0.000061000","Jan  8, 2024 13:41:09.316107000 JST","","37558  >  6000 [ACK] Seq=29 Ack=2 Win=64256 Len=0 TSval=3836365233 TSecr=2488470205"
"145","56.099137","192.168.11.20","255.255.255.255","UDP","209","","0.030154000","Jan  8, 2024 13:41:09.346261000 JST","7b2273656d616e74696373223a207b22656e74697479223a2022504944222c202262617365656e74697479223a2022616e79222c2022726f6c65223a2022747474222c20227370617469616c223a2022616e79222c202274656d706f72616c223a2022616e79227d2c20226461746170726f7065727479223a207b22666f726d6174223a2022696e616f6b615f70726f6772616d5f73616d706c655f73656d616e746963227d7d","55348  >  7000 Len=167"
"146","56.113759","192.168.11.12","192.168.11.20","TCP","74","","0.014622000","Jan  8, 2024 13:41:09.360883000 JST","","51976  >  6000 [SYN] Seq=0 Win=64240 Len=0 MSS=1460 SACK_PERM TSval=926902527 TSecr=0 WS=128"
"147","56.113894","192.168.11.20","192.168.11.12","TCP","74","0.000135000","0.000135000","Jan  8, 2024 13:41:09.361018000 JST","","6000  >  51976 [SYN, ACK] Seq=0 Ack=1 Win=65160 Len=0 MSS=1460 SACK_PERM TSval=932395207 TSecr=926902527 WS=128"
"148","56.120758","192.168.11.12","192.168.11.20","TCP","66","0.006864000","0.006864000","Jan  8, 2024 13:41:09.367882000 JST","","51976  >  6000 [ACK] Seq=1 Ack=1 Win=64256 Len=0 TSval=926902541 TSecr=932395207"
"149","56.121397","192.168.11.12","192.168.11.20","TCP","93","","0.000639000","Jan  8, 2024 13:41:09.368521000 JST","","51976  >  6000 [PSH, ACK] Seq=1 Ack=1 Win=64256 Len=27 TSval=926902541 TSecr=932395207 [TCP segment of a reassembled PDU]"
"150","56.121490","192.168.11.20","192.168.11.12","TCP","66","0.000093000","0.000093000","Jan  8, 2024 13:41:09.368614000 JST","","6000  >  51976 [ACK] Seq=1 Ack=28 Win=65152 Len=0 TSval=932395214 TSecr=926902541"
"151","56.121548","192.168.11.12","192.168.11.20","TCP","66","","0.000058000","Jan  8, 2024 13:41:09.368672000 JST","","51976  >  6000 [FIN, ACK] Seq=28 Ack=1 Win=64256 Len=0 TSval=926902542 TSecr=932395207"
"152","56.122543","192.168.11.20","192.168.11.12","TCP","66","0.000995000","0.000995000","Jan  8, 2024 13:41:09.369667000 JST","","6000  >  51976 [FIN, ACK] Seq=1 Ack=29 Win=65152 Len=0 TSval=932395215 TSecr=926902542"
"153","56.128508","192.168.11.12","192.168.11.20","TCP","66","0.005965000","0.005965000","Jan  8, 2024 13:41:09.375632000 JST","","51976  >  6000 [ACK] Seq=29 Ack=2 Win=64256 Len=0 TSval=926902549 TSecr=932395215"
"154","62.709772","192.168.11.20","192.168.11.19","TCP","74","","6.581264000","Jan  8, 2024 13:41:15.956896000 JST","","43716  >  6000 [SYN] Seq=0 Win=64240 Len=0 MSS=1460 SACK_PERM TSval=3836371874 TSecr=0 WS=128"
"155","62.720012","192.168.11.19","192.168.11.20","TCP","74","0.010240000","0.010240000","Jan  8, 2024 13:41:15.967136000 JST","","6000  >  43716 [SYN, ACK] Seq=0 Ack=1 Win=65160 Len=0 MSS=1460 SACK_PERM TSval=2488476855 TSecr=3836371874 WS=128"
"156","62.720120","192.168.11.20","192.168.11.19","TCP","66","0.000108000","0.000108000","Jan  8, 2024 13:41:15.967244000 JST","","43716  >  6000 [ACK] Seq=1 Ack=1 Win=64256 Len=0 TSval=3836371884 TSecr=2488476855"
"157","62.720292","192.168.11.20","192.168.11.19","TCP","93","","0.000172000","Jan  8, 2024 13:41:15.967416000 JST","","43716  >  6000 [PSH, ACK] Seq=1 Ack=1 Win=64256 Len=27 TSval=3836371884 TSecr=2488476855 [TCP segment of a reassembled PDU]"
"158","62.720403","192.168.11.20","192.168.11.19","TCP","66","","0.000111000","Jan  8, 2024 13:41:15.967527000 JST","","43716  >  6000 [FIN, ACK] Seq=28 Ack=1 Win=64256 Len=0 TSval=3836371884 TSecr=2488476855"
"159","62.727450","192.168.11.19","192.168.11.20","TCP","66","0.007158000","0.007047000","Jan  8, 2024 13:41:15.974574000 JST","","6000  >  43716 [ACK] Seq=1 Ack=28 Win=65152 Len=0 TSval=2488476862 TSecr=3836371884"
"160","62.727825","192.168.11.19","192.168.11.20","TCP","66","0.007422000","0.000375000","Jan  8, 2024 13:41:15.974949000 JST","","6000  >  43716 [FIN, ACK] Seq=1 Ack=29 Win=65152 Len=0 TSval=2488476864 TSecr=3836371884"
"161","62.727877","192.168.11.20","192.168.11.19","TCP","66","0.000052000","0.000052000","Jan  8, 2024 13:41:15.975001000 JST","","43716  >  6000 [ACK] Seq=29 Ack=2 Win=64256 Len=0 TSval=3836371892 TSecr=2488476864"
"162","62.757150","192.168.11.20","255.255.255.255","UDP","209","","0.029273000","Jan  8, 2024 13:41:16.004274000 JST","7b2273656d616e74696373223a207b22656e74697479223a2022504944222c202262617365656e74697479223a2022616e79222c2022726f6c65223a2022747474222c20227370617469616c223a2022616e79222c202274656d706f72616c223a2022616e79227d2c20226461746170726f7065727479223a207b22666f726d6174223a2022696e616f6b615f70726f6772616d5f73616d706c655f73656d616e746963227d7d","40686  >  7000 Len=167"
"163","62.769744","192.168.11.12","192.168.11.20","TCP","74","","0.012594000","Jan  8, 2024 13:41:16.016868000 JST","","43894  >  6000 [SYN] Seq=0 Win=64240 Len=0 MSS=1460 SACK_PERM TSval=926909185 TSecr=0 WS=128"
"164","62.769954","192.168.11.20","192.168.11.12","TCP","74","0.000210000","0.000210000","Jan  8, 2024 13:41:16.017078000 JST","","6000  >  43894 [SYN, ACK] Seq=0 Ack=1 Win=65160 Len=0 MSS=1460 SACK_PERM TSval=932401863 TSecr=926909185 WS=128"
"165","62.779078","192.168.11.12","192.168.11.20","TCP","66","0.009124000","0.009124000","Jan  8, 2024 13:41:16.026202000 JST","","43894  >  6000 [ACK] Seq=1 Ack=1 Win=64256 Len=0 TSval=926909197 TSecr=932401863"
"166","62.779827","192.168.11.12","192.168.11.20","TCP","93","","0.000749000","Jan  8, 2024 13:41:16.026951000 JST","","43894  >  6000 [PSH, ACK] Seq=1 Ack=1 Win=64256 Len=27 TSval=926909197 TSecr=932401863 [TCP segment of a reassembled PDU]"
"167","62.779961","192.168.11.20","192.168.11.12","TCP","66","0.000134000","0.000134000","Jan  8, 2024 13:41:16.027085000 JST","","6000  >  43894 [ACK] Seq=1 Ack=28 Win=65152 Len=0 TSval=932401873 TSecr=926909197"
"168","62.780054","192.168.11.12","192.168.11.20","TCP","66","","0.000093000","Jan  8, 2024 13:41:16.027178000 JST","","43894  >  6000 [FIN, ACK] Seq=28 Ack=1 Win=64256 Len=0 TSval=926909197 TSecr=932401863"
