"No.","Time","Source","Destination","Protocol","Length","The RTT to ACK the segment was","Time delta from previous captured frame","Arrival Time","Data","Info"
"1","0.000000","192.168.11.33","192.168.11.18","TCP","74","","0.000000000","Jan  8, 2024 13:40:13.497896000 JST","","37586  >  6000 [SYN] Seq=0 Win=64240 Len=0 MSS=1460 SACK_PERM TSval=3907735989 TSecr=0 WS=128"
"2","0.008854","192.168.11.18","192.168.11.33","TCP","74","0.008854000","0.008854000","Jan  8, 2024 13:40:13.506750000 JST","","6000  >  37586 [SYN, ACK] Seq=0 Ack=1 Win=65160 Len=0 MSS=1460 SACK_PERM TSval=2601641542 TSecr=3907735989 WS=128"
"3","0.008963","192.168.11.33","192.168.11.18","TCP","66","0.000109000","0.000109000","Jan  8, 2024 13:40:13.506859000 JST","","37586  >  6000 [ACK] Seq=1 Ack=1 Win=64256 Len=0 TSval=3907736015 TSecr=2601641542"
"4","0.009147","192.168.11.33","192.168.11.18","TCP","93","","0.000184000","Jan  8, 2024 13:40:13.507043000 JST","","37586  >  6000 [PSH, ACK] Seq=1 Ack=1 Win=64256 Len=27 TSval=3907736015 TSecr=2601641542 [TCP segment of a reassembled PDU]"
"5","0.009275","192.168.11.33","192.168.11.18","TCP","66","","0.000128000","Jan  8, 2024 13:40:13.507171000 JST","","37586  >  6000 [FIN, ACK] Seq=28 Ack=1 Win=64256 Len=0 TSval=3907736015 TSecr=2601641542"
"6","0.016322","192.168.11.18","192.168.11.33","TCP","66","0.007175000","0.007047000","Jan  8, 2024 13:40:13.514218000 JST","","6000  >  37586 [ACK] Seq=1 Ack=28 Win=65152 Len=0 TSval=2601641551 TSecr=3907736015"
"7","0.016752","192.168.11.18","192.168.11.33","TCP","66","0.007477000","0.000430000","Jan  8, 2024 13:40:13.514648000 JST","","6000  >  37586 [FIN, ACK] Seq=1 Ack=29 Win=65152 Len=0 TSval=2601641552 TSecr=3907736015"
"8","0.016796","192.168.11.33","192.168.11.18","TCP","66","0.000044000","0.000044000","Jan  8, 2024 13:40:13.514692000 JST","","37586  >  6000 [ACK] Seq=29 Ack=2 Win=64256 Len=0 TSval=3907736023 TSecr=2601641552"
"9","0.044821","192.168.11.33","255.255.255.255","UDP","209","","0.028025000","Jan  8, 2024 13:40:13.542717000 JST","7b2273656d616e74696373223a207b22656e74697479223a2022504944222c202262617365656e74697479223a2022616e79222c2022726f6c65223a2022787878222c20227370617469616c223a2022616e79222c202274656d706f72616c223a2022616e79227d2c20226461746170726f7065727479223a207b22666f726d6174223a2022696e616f6b615f70726f6772616d5f73616d706c655f73656d616e746963227d7d","38763  >  7000 Len=167"
"10","0.059040","192.168.11.22","192.168.11.33","TCP","74","","0.014219000","Jan  8, 2024 13:40:13.556936000 JST","","45086  >  6000 [SYN] Seq=0 Win=64240 Len=0 MSS=1460 SACK_PERM TSval=392003362 TSecr=0 WS=128"
"11","0.059192","192.168.11.33","192.168.11.22","TCP","74","0.000152000","0.000152000","Jan  8, 2024 13:40:13.557088000 JST","","6000  >  45086 [SYN, ACK] Seq=0 Ack=1 Win=65160 Len=0 MSS=1460 SACK_PERM TSval=1296851134 TSecr=392003362 WS=128"
"12","0.065909","192.168.11.22","192.168.11.33","TCP","66","0.006717000","0.006717000","Jan  8, 2024 13:40:13.563805000 JST","","45086  >  6000 [ACK] Seq=1 Ack=1 Win=64256 Len=0 TSval=392003376 TSecr=1296851134"
"13","0.066495","192.168.11.22","192.168.11.33","TCP","93","","0.000586000","Jan  8, 2024 13:40:13.564391000 JST","","45086  >  6000 [PSH, ACK] Seq=1 Ack=1 Win=64256 Len=27 TSval=392003376 TSecr=1296851134 [TCP segment of a reassembled PDU]"
"14","0.066603","192.168.11.33","192.168.11.22","TCP","66","0.000108000","0.000108000","Jan  8, 2024 13:40:13.564499000 JST","","6000  >  45086 [ACK] Seq=1 Ack=28 Win=65152 Len=0 TSval=1296851141 TSecr=392003376"
"15","0.066690","192.168.11.22","192.168.11.33","TCP","66","","0.000087000","Jan  8, 2024 13:40:13.564586000 JST","","45086  >  6000 [FIN, ACK] Seq=28 Ack=1 Win=64256 Len=0 TSval=392003376 TSecr=1296851134"
"16","0.067993","192.168.11.33","192.168.11.22","TCP","66","0.001303000","0.001303000","Jan  8, 2024 13:40:13.565889000 JST","","6000  >  45086 [FIN, ACK] Seq=1 Ack=29 Win=65152 Len=0 TSval=1296851143 TSecr=392003376"
"17","0.074476","192.168.11.22","192.168.11.33","TCP","66","0.006483000","0.006483000","Jan  8, 2024 13:40:13.572372000 JST","","45086  >  6000 [ACK] Seq=29 Ack=2 Win=64256 Len=0 TSval=392003384 TSecr=1296851143"
"18","6.888023","192.168.11.33","192.168.11.18","TCP","74","","6.813547000","Jan  8, 2024 13:40:20.385919000 JST","","56378  >  6000 [SYN] Seq=0 Win=64240 Len=0 MSS=1460 SACK_PERM TSval=3907742894 TSecr=0 WS=128"
"19","6.894919","192.168.11.18","192.168.11.33","TCP","74","0.006896000","0.006896000","Jan  8, 2024 13:40:20.392815000 JST","","6000  >  56378 [SYN, ACK] Seq=0 Ack=1 Win=65160 Len=0 MSS=1460 SACK_PERM TSval=2601648429 TSecr=3907742894 WS=128"
"20","6.895018","192.168.11.33","192.168.11.18","TCP","66","0.000099000","0.000099000","Jan  8, 2024 13:40:20.392914000 JST","","56378  >  6000 [ACK] Seq=1 Ack=1 Win=64256 Len=0 TSval=3907742901 TSecr=2601648429"
"21","6.895152","192.168.11.33","192.168.11.18","TCP","93","","0.000134000","Jan  8, 2024 13:40:20.393048000 JST","","56378  >  6000 [PSH, ACK] Seq=1 Ack=1 Win=64256 Len=27 TSval=3907742901 TSecr=2601648429 [TCP segment of a reassembled PDU]"
"22","6.895274","192.168.11.33","192.168.11.18","TCP","66","","0.000122000","Jan  8, 2024 13:40:20.393170000 JST","","56378  >  6000 [FIN, ACK] Seq=28 Ack=1 Win=64256 Len=0 TSval=3907742901 TSecr=2601648429"
"23","6.904188","192.168.11.18","192.168.11.33","TCP","66","0.009036000","0.008914000","Jan  8, 2024 13:40:20.402084000 JST","","6000  >  56378 [ACK] Seq=1 Ack=28 Win=65152 Len=0 TSval=2601648438 TSecr=3907742901"
"24","6.904397","192.168.11.18","192.168.11.33","TCP","66","0.009123000","0.000209000","Jan  8, 2024 13:40:20.402293000 JST","","6000  >  56378 [FIN, ACK] Seq=1 Ack=29 Win=65152 Len=0 TSval=2601648440 TSecr=3907742901"
"25","6.904441","192.168.11.33","192.168.11.18","TCP","66","0.000044000","0.000044000","Jan  8, 2024 13:40:20.402337000 JST","","56378  >  6000 [ACK] Seq=29 Ack=2 Win=64256 Len=0 TSval=3907742910 TSecr=2601648440"
"26","6.934397","192.168.11.33","255.255.255.255","UDP","209","","0.029956000","Jan  8, 2024 13:40:20.432293000 JST","7b2273656d616e74696373223a207b22656e74697479223a2022504944222c202262617365656e74697479223a2022616e79222c2022726f6c65223a2022787878222c20227370617469616c223a2022616e79222c202274656d706f72616c223a2022616e79227d2c20226461746170726f7065727479223a207b22666f726d6174223a2022696e616f6b615f70726f6772616d5f73616d706c655f73656d616e746963227d7d","51602  >  7000 Len=167"
"27","6.941767","192.168.11.22","192.168.11.33","TCP","74","","0.007370000","Jan  8, 2024 13:40:20.439663000 JST","","54600  >  6000 [SYN] Seq=0 Win=64240 Len=0 MSS=1460 SACK_PERM TSval=392010252 TSecr=0 WS=128"
"28","6.941879","192.168.11.33","192.168.11.22","TCP","74","0.000112000","0.000112000","Jan  8, 2024 13:40:20.439775000 JST","","6000  >  54600 [SYN, ACK] Seq=0 Ack=1 Win=65160 Len=0 MSS=1460 SACK_PERM TSval=1296858017 TSecr=392010252 WS=128"
"29","6.948970","192.168.11.22","192.168.11.33","TCP","66","0.007091000","0.007091000","Jan  8, 2024 13:40:20.446866000 JST","","54600  >  6000 [ACK] Seq=1 Ack=1 Win=64256 Len=0 TSval=392010258 TSecr=1296858017"
"30","6.949443","192.168.11.22","192.168.11.33","TCP","93","","0.000473000","Jan  8, 2024 13:40:20.447339000 JST","","54600  >  6000 [PSH, ACK] Seq=1 Ack=1 Win=64256 Len=27 TSval=392010258 TSecr=1296858017 [TCP segment of a reassembled PDU]"
"31","6.949514","192.168.11.33","192.168.11.22","TCP","66","0.000071000","0.000071000","Jan  8, 2024 13:40:20.447410000 JST","","6000  >  54600 [ACK] Seq=1 Ack=28 Win=65152 Len=0 TSval=1296858024 TSecr=392010258"
"32","6.949576","192.168.11.22","192.168.11.33","TCP","66","","0.000062000","Jan  8, 2024 13:40:20.447472000 JST","","54600  >  6000 [FIN, ACK] Seq=28 Ack=1 Win=64256 Len=0 TSval=392010258 TSecr=1296858017"
"33","6.950342","192.168.11.33","192.168.11.22","TCP","66","0.000766000","0.000766000","Jan  8, 2024 13:40:20.448238000 JST","","6000  >  54600 [FIN, ACK] Seq=1 Ack=29 Win=65152 Len=0 TSval=1296858025 TSecr=392010258"
"34","6.959001","192.168.11.22","192.168.11.33","TCP","66","0.008659000","0.008659000","Jan  8, 2024 13:40:20.456897000 JST","","54600  >  6000 [ACK] Seq=29 Ack=2 Win=64256 Len=0 TSval=392010266 TSecr=1296858025"
"35","14.630845","192.168.11.33","192.168.11.18","TCP","74","","7.671844000","Jan  8, 2024 13:40:28.128741000 JST","","48130  >  6000 [SYN] Seq=0 Win=64240 Len=0 MSS=1460 SACK_PERM TSval=3907750637 TSecr=0 WS=128"
"36","14.640816","192.168.11.18","192.168.11.33","TCP","74","0.009971000","0.009971000","Jan  8, 2024 13:40:28.138712000 JST","","6000  >  48130 [SYN, ACK] Seq=0 Ack=1 Win=65160 Len=0 MSS=1460 SACK_PERM TSval=2601656172 TSecr=3907750637 WS=128"
"37","14.640917","192.168.11.33","192.168.11.18","TCP","66","0.000101000","0.000101000","Jan  8, 2024 13:40:28.138813000 JST","","48130  >  6000 [ACK] Seq=1 Ack=1 Win=64256 Len=0 TSval=3907750647 TSecr=2601656172"
"38","14.641046","192.168.11.33","192.168.11.18","TCP","93","","0.000129000","Jan  8, 2024 13:40:28.138942000 JST","","48130  >  6000 [PSH, ACK] Seq=1 Ack=1 Win=64256 Len=27 TSval=3907750647 TSecr=2601656172 [TCP segment of a reassembled PDU]"
"39","14.641145","192.168.11.33","192.168.11.18","TCP","66","","0.000099000","Jan  8, 2024 13:40:28.139041000 JST","","48130  >  6000 [FIN, ACK] Seq=28 Ack=1 Win=64256 Len=0 TSval=3907750647 TSecr=2601656172"
"40","14.648148","192.168.11.18","192.168.11.33","TCP","66","0.007102000","0.007003000","Jan  8, 2024 13:40:28.146044000 JST","","6000  >  48130 [ACK] Seq=1 Ack=28 Win=65152 Len=0 TSval=2601656182 TSecr=3907750647"
"41","14.648510","192.168.11.18","192.168.11.33","TCP","66","0.007365000","0.000362000","Jan  8, 2024 13:40:28.146406000 JST","","6000  >  48130 [FIN, ACK] Seq=1 Ack=29 Win=65152 Len=0 TSval=2601656184 TSecr=3907750647"
"42","14.648579","192.168.11.33","192.168.11.18","TCP","66","0.000069000","0.000069000","Jan  8, 2024 13:40:28.146475000 JST","","48130  >  6000 [ACK] Seq=29 Ack=2 Win=64256 Len=0 TSval=3907750654 TSecr=2601656184"
"43","14.681847","192.168.11.33","255.255.255.255","UDP","209","","0.033268000","Jan  8, 2024 13:40:28.179743000 JST","7b2273656d616e74696373223a207b22656e74697479223a2022504944222c202262617365656e74697479223a2022616e79222c2022726f6c65223a2022787878222c20227370617469616c223a2022616e79222c202274656d706f72616c223a2022616e79227d2c20226461746170726f7065727479223a207b22666f726d6174223a2022696e616f6b615f70726f6772616d5f73616d706c655f73656d616e746963227d7d","45766  >  7000 Len=167"
"44","14.689324","192.168.11.22","192.168.11.33","TCP","74","","0.007477000","Jan  8, 2024 13:40:28.187220000 JST","","43314  >  6000 [SYN] Seq=0 Win=64240 Len=0 MSS=1460 SACK_PERM TSval=392017999 TSecr=0 WS=128"
"45","14.689479","192.168.11.33","192.168.11.22","TCP","74","0.000155000","0.000155000","Jan  8, 2024 13:40:28.187375000 JST","","6000  >  43314 [SYN, ACK] Seq=0 Ack=1 Win=65160 Len=0 MSS=1460 SACK_PERM TSval=1296865764 TSecr=392017999 WS=128"
"46","14.696499","192.168.11.22","192.168.11.33","TCP","66","0.007020000","0.007020000","Jan  8, 2024 13:40:28.194395000 JST","","43314  >  6000 [ACK] Seq=1 Ack=1 Win=64256 Len=0 TSval=392018006 TSecr=1296865764"
"47","14.697397","192.168.11.22","192.168.11.33","TCP","93","","0.000898000","Jan  8, 2024 13:40:28.195293000 JST","","43314  >  6000 [PSH, ACK] Seq=1 Ack=1 Win=64256 Len=27 TSval=392018006 TSecr=1296865764 [TCP segment of a reassembled PDU]"
"48","14.697510","192.168.11.33","192.168.11.22","TCP","66","0.000113000","0.000113000","Jan  8, 2024 13:40:28.195406000 JST","","6000  >  43314 [ACK] Seq=1 Ack=28 Win=65152 Len=0 TSval=1296865772 TSecr=392018006"
"49","14.697558","192.168.11.22","192.168.11.33","TCP","66","","0.000048000","Jan  8, 2024 13:40:28.195454000 JST","","43314  >  6000 [FIN, ACK] Seq=28 Ack=1 Win=64256 Len=0 TSval=392018006 TSecr=1296865764"
"50","14.698701","192.168.11.33","192.168.11.22","TCP","66","0.001143000","0.001143000","Jan  8, 2024 13:40:28.196597000 JST","","6000  >  43314 [FIN, ACK] Seq=1 Ack=29 Win=65152 Len=0 TSval=1296865774 TSecr=392018006"
"51","14.704940","192.168.11.22","192.168.11.33","TCP","66","0.006239000","0.006239000","Jan  8, 2024 13:40:28.202836000 JST","","43314  >  6000 [ACK] Seq=29 Ack=2 Win=64256 Len=0 TSval=392018014 TSecr=1296865774"
"52","21.307749","192.168.11.33","192.168.11.18","TCP","74","","6.602809000","Jan  8, 2024 13:40:34.805645000 JST","","48146  >  6000 [SYN] Seq=0 Win=64240 Len=0 MSS=1460 SACK_PERM TSval=3907757314 TSecr=0 WS=128"
"53","21.314919","192.168.11.18","192.168.11.33","TCP","74","0.007170000","0.007170000","Jan  8, 2024 13:40:34.812815000 JST","","6000  >  48146 [SYN, ACK] Seq=0 Ack=1 Win=65160 Len=0 MSS=1460 SACK_PERM TSval=2601662849 TSecr=3907757314 WS=128"
"54","21.315027","192.168.11.33","192.168.11.18","TCP","66","0.000108000","0.000108000","Jan  8, 2024 13:40:34.812923000 JST","","48146  >  6000 [ACK] Seq=1 Ack=1 Win=64256 Len=0 TSval=3907757321 TSecr=2601662849"
"55","21.315154","192.168.11.33","192.168.11.18","TCP","93","","0.000127000","Jan  8, 2024 13:40:34.813050000 JST","","48146  >  6000 [PSH, ACK] Seq=1 Ack=1 Win=64256 Len=27 TSval=3907757321 TSecr=2601662849 [TCP segment of a reassembled PDU]"
"56","21.315251","192.168.11.33","192.168.11.18","TCP","66","","0.000097000","Jan  8, 2024 13:40:34.813147000 JST","","48146  >  6000 [FIN, ACK] Seq=28 Ack=1 Win=64256 Len=0 TSval=3907757321 TSecr=2601662849"
"57","21.323468","192.168.11.18","192.168.11.33","TCP","66","0.008314000","0.008217000","Jan  8, 2024 13:40:34.821364000 JST","","6000  >  48146 [ACK] Seq=1 Ack=28 Win=65152 Len=0 TSval=2601662856 TSecr=3907757321"
"58","21.326146","192.168.11.18","192.168.11.33","TCP","66","0.010895000","0.002678000","Jan  8, 2024 13:40:34.824042000 JST","","6000  >  48146 [FIN, ACK] Seq=1 Ack=29 Win=65152 Len=0 TSval=2601662858 TSecr=3907757321"
"59","21.326200","192.168.11.33","192.168.11.18","TCP","66","0.000054000","0.000054000","Jan  8, 2024 13:40:34.824096000 JST","","48146  >  6000 [ACK] Seq=29 Ack=2 Win=64256 Len=0 TSval=3907757332 TSecr=2601662858"
"60","21.353949","192.168.11.33","255.255.255.255","UDP","209","","0.027749000","Jan  8, 2024 13:40:34.851845000 JST","7b2273656d616e74696373223a207b22656e74697479223a2022504944222c202262617365656e74697479223a2022616e79222c2022726f6c65223a2022787878222c20227370617469616c223a2022616e79222c202274656d706f72616c223a2022616e79227d2c20226461746170726f7065727479223a207b22666f726d6174223a2022696e616f6b615f70726f6772616d5f73616d706c655f73656d616e746963227d7d","55999  >  7000 Len=167"
"61","21.361787","192.168.11.22","192.168.11.33","TCP","74","","0.007838000","Jan  8, 2024 13:40:34.859683000 JST","","60506  >  6000 [SYN] Seq=0 Win=64240 Len=0 MSS=1460 SACK_PERM TSval=392024672 TSecr=0 WS=128"
"62","21.361914","192.168.11.33","192.168.11.22","TCP","74","0.000127000","0.000127000","Jan  8, 2024 13:40:34.859810000 JST","","6000  >  60506 [SYN, ACK] Seq=0 Ack=1 Win=65160 Len=0 MSS=1460 SACK_PERM TSval=1296872437 TSecr=392024672 WS=128"
"63","21.368688","192.168.11.22","192.168.11.33","TCP","66","0.006774000","0.006774000","Jan  8, 2024 13:40:34.866584000 JST","","60506  >  6000 [ACK] Seq=1 Ack=1 Win=64256 Len=0 TSval=392024678 TSecr=1296872437"
"64","21.369300","192.168.11.22","192.168.11.33","TCP","93","","0.000612000","Jan  8, 2024 13:40:34.867196000 JST","","60506  >  6000 [PSH, ACK] Seq=1 Ack=1 Win=64256 Len=27 TSval=392024679 TSecr=1296872437 [TCP segment of a reassembled PDU]"
"65","21.369394","192.168.11.33","192.168.11.22","TCP","66","0.000094000","0.000094000","Jan  8, 2024 13:40:34.867290000 JST","","6000  >  60506 [ACK] Seq=1 Ack=28 Win=65152 Len=0 TSval=1296872444 TSecr=392024679"
"66","21.369482","192.168.11.22","192.168.11.33","TCP","66","","0.000088000","Jan  8, 2024 13:40:34.867378000 JST","","60506  >  6000 [FIN, ACK] Seq=28 Ack=1 Win=64256 Len=0 TSval=392024679 TSecr=1296872437"
"67","21.370509","192.168.11.33","192.168.11.22","TCP","66","0.001027000","0.001027000","Jan  8, 2024 13:40:34.868405000 JST","","6000  >  60506 [FIN, ACK] Seq=1 Ack=29 Win=65152 Len=0 TSval=1296872445 TSecr=392024679"
"68","21.376871","192.168.11.22","192.168.11.33","TCP","66","0.006362000","0.006362000","Jan  8, 2024 13:40:34.874767000 JST","","60506  >  6000 [ACK] Seq=29 Ack=2 Win=64256 Len=0 TSval=392024686 TSecr=1296872445"
"69","29.086015","192.168.11.33","192.168.11.18","TCP","74","","7.709144000","Jan  8, 2024 13:40:42.583911000 JST","","42644  >  6000 [SYN] Seq=0 Win=64240 Len=0 MSS=1460 SACK_PERM TSval=3907765092 TSecr=0 WS=128"
"70","29.093025","192.168.11.18","192.168.11.33","TCP","74","0.007010000","0.007010000","Jan  8, 2024 13:40:42.590921000 JST","","6000  >  42644 [SYN, ACK] Seq=0 Ack=1 Win=65160 Len=0 MSS=1460 SACK_PERM TSval=2601670627 TSecr=3907765092 WS=128"
"71","29.093128","192.168.11.33","192.168.11.18","TCP","66","0.000103000","0.000103000","Jan  8, 2024 13:40:42.591024000 JST","","42644  >  6000 [ACK] Seq=1 Ack=1 Win=64256 Len=0 TSval=3907765099 TSecr=2601670627"
"72","29.093285","192.168.11.33","192.168.11.18","TCP","93","","0.000157000","Jan  8, 2024 13:40:42.591181000 JST","","42644  >  6000 [PSH, ACK] Seq=1 Ack=1 Win=64256 Len=27 TSval=3907765099 TSecr=2601670627 [TCP segment of a reassembled PDU]"
"73","29.093381","192.168.11.33","192.168.11.18","TCP","66","","0.000096000","Jan  8, 2024 13:40:42.591277000 JST","","42644  >  6000 [FIN, ACK] Seq=28 Ack=1 Win=64256 Len=0 TSval=3907765099 TSecr=2601670627"
"74","29.100453","192.168.11.18","192.168.11.33","TCP","66","0.007168000","0.007072000","Jan  8, 2024 13:40:42.598349000 JST","","6000  >  42644 [ACK] Seq=1 Ack=28 Win=65152 Len=0 TSval=2601670635 TSecr=3907765099"
"75","29.100819","192.168.11.18","192.168.11.33","TCP","66","0.007438000","0.000366000","Jan  8, 2024 13:40:42.598715000 JST","","6000  >  42644 [FIN, ACK] Seq=1 Ack=29 Win=65152 Len=0 TSval=2601670636 TSecr=3907765099"
"76","29.100866","192.168.11.33","192.168.11.18","TCP","66","0.000047000","0.000047000","Jan  8, 2024 13:40:42.598762000 JST","","42644  >  6000 [ACK] Seq=29 Ack=2 Win=64256 Len=0 TSval=3907765107 TSecr=2601670636"
"77","29.130593","192.168.11.33","255.255.255.255","UDP","209","","0.029727000","Jan  8, 2024 13:40:42.628489000 JST","7b2273656d616e74696373223a207b22656e74697479223a2022504944222c202262617365656e74697479223a2022616e79222c2022726f6c65223a2022787878222c20227370617469616c223a2022616e79222c202274656d706f72616c223a2022616e79227d2c20226461746170726f7065727479223a207b22666f726d6174223a2022696e616f6b615f70726f6772616d5f73616d706c655f73656d616e746963227d7d","48931  >  7000 Len=167"
"78","29.139252","192.168.11.22","192.168.11.33","TCP","74","","0.008659000","Jan  8, 2024 13:40:42.637148000 JST","","60516  >  6000 [SYN] Seq=0 Win=64240 Len=0 MSS=1460 SACK_PERM TSval=392032449 TSecr=0 WS=128"
"79","29.139382","192.168.11.33","192.168.11.22","TCP","74","0.000130000","0.000130000","Jan  8, 2024 13:40:42.637278000 JST","","6000  >  60516 [SYN, ACK] Seq=0 Ack=1 Win=65160 Len=0 MSS=1460 SACK_PERM TSval=1296880214 TSecr=392032449 WS=128"
"80","29.146048","192.168.11.22","192.168.11.33","TCP","66","0.006666000","0.006666000","Jan  8, 2024 13:40:42.643944000 JST","","60516  >  6000 [ACK] Seq=1 Ack=1 Win=64256 Len=0 TSval=392032456 TSecr=1296880214"
"81","29.146668","192.168.11.22","192.168.11.33","TCP","93","","0.000620000","Jan  8, 2024 13:40:42.644564000 JST","","60516  >  6000 [PSH, ACK] Seq=1 Ack=1 Win=64256 Len=27 TSval=392032456 TSecr=1296880214 [TCP segment of a reassembled PDU]"
"82","29.146762","192.168.11.33","192.168.11.22","TCP","66","0.000094000","0.000094000","Jan  8, 2024 13:40:42.644658000 JST","","6000  >  60516 [ACK] Seq=1 Ack=28 Win=65152 Len=0 TSval=1296880222 TSecr=392032456"
"83","29.146857","192.168.11.22","192.168.11.33","TCP","66","","0.000095000","Jan  8, 2024 13:40:42.644753000 JST","","60516  >  6000 [FIN, ACK] Seq=28 Ack=1 Win=64256 Len=0 TSval=392032456 TSecr=1296880214"
"84","29.148057","192.168.11.33","192.168.11.22","TCP","66","0.001200000","0.001200000","Jan  8, 2024 13:40:42.645953000 JST","","6000  >  60516 [FIN, ACK] Seq=1 Ack=29 Win=65152 Len=0 TSval=1296880223 TSecr=392032456"
"85","29.154352","192.168.11.22","192.168.11.33","TCP","66","0.006295000","0.006295000","Jan  8, 2024 13:40:42.652248000 JST","","60516  >  6000 [ACK] Seq=29 Ack=2 Win=64256 Len=0 TSval=392032464 TSecr=1296880223"
"86","35.815674","192.168.11.33","192.168.11.18","TCP","74","","6.661322000","Jan  8, 2024 13:40:49.313570000 JST","","45590  >  6000 [SYN] Seq=0 Win=64240 Len=0 MSS=1460 SACK_PERM TSval=3907771822 TSecr=0 WS=128"
"87","35.825431","192.168.11.18","192.168.11.33","TCP","74","0.009757000","0.009757000","Jan  8, 2024 13:40:49.323327000 JST","","6000  >  45590 [SYN, ACK] Seq=0 Ack=1 Win=65160 Len=0 MSS=1460 SACK_PERM TSval=2601677357 TSecr=3907771822 WS=128"
"88","35.825536","192.168.11.33","192.168.11.18","TCP","66","0.000105000","0.000105000","Jan  8, 2024 13:40:49.323432000 JST","","45590  >  6000 [ACK] Seq=1 Ack=1 Win=64256 Len=0 TSval=3907771831 TSecr=2601677357"
"89","35.825702","192.168.11.33","192.168.11.18","TCP","93","","0.000166000","Jan  8, 2024 13:40:49.323598000 JST","","45590  >  6000 [PSH, ACK] Seq=1 Ack=1 Win=64256 Len=27 TSval=3907771832 TSecr=2601677357 [TCP segment of a reassembled PDU]"
"90","35.825793","192.168.11.33","192.168.11.18","TCP","66","","0.000091000","Jan  8, 2024 13:40:49.323689000 JST","","45590  >  6000 [FIN, ACK] Seq=28 Ack=1 Win=64256 Len=0 TSval=3907771832 TSecr=2601677357"
"91","35.832847","192.168.11.18","192.168.11.33","TCP","66","0.007145000","0.007054000","Jan  8, 2024 13:40:49.330743000 JST","","6000  >  45590 [ACK] Seq=1 Ack=28 Win=65152 Len=0 TSval=2601677367 TSecr=3907771832"
"92","35.833219","192.168.11.18","192.168.11.33","TCP","66","0.007426000","0.000372000","Jan  8, 2024 13:40:49.331115000 JST","","6000  >  45590 [FIN, ACK] Seq=1 Ack=29 Win=65152 Len=0 TSval=2601677368 TSecr=3907771832"
"93","35.833274","192.168.11.33","192.168.11.18","TCP","66","0.000055000","0.000055000","Jan  8, 2024 13:40:49.331170000 JST","","45590  >  6000 [ACK] Seq=29 Ack=2 Win=64256 Len=0 TSval=3907771839 TSecr=2601677368"
"94","35.861932","192.168.11.33","255.255.255.255","UDP","209","","0.028658000","Jan  8, 2024 13:40:49.359828000 JST","7b2273656d616e74696373223a207b22656e74697479223a2022504944222c202262617365656e74697479223a2022616e79222c2022726f6c65223a2022787878222c20227370617469616c223a2022616e79222c202274656d706f72616c223a2022616e79227d2c20226461746170726f7065727479223a207b22666f726d6174223a2022696e616f6b615f70726f6772616d5f73616d706c655f73656d616e746963227d7d","53489  >  7000 Len=167"
"95","35.871912","192.168.11.22","192.168.11.33","TCP","74","","0.009980000","Jan  8, 2024 13:40:49.369808000 JST","","44146  >  6000 [SYN] Seq=0 Win=64240 Len=0 MSS=1460 SACK_PERM TSval=392039181 TSecr=0 WS=128"
"96","35.872056","192.168.11.33","192.168.11.22","TCP","74","0.000144000","0.000144000","Jan  8, 2024 13:40:49.369952000 JST","","6000  >  44146 [SYN, ACK] Seq=0 Ack=1 Win=65160 Len=0 MSS=1460 SACK_PERM TSval=1296886947 TSecr=392039181 WS=128"
"97","35.879028","192.168.11.22","192.168.11.33","TCP","66","0.006972000","0.006972000","Jan  8, 2024 13:40:49.376924000 JST","","44146  >  6000 [ACK] Seq=1 Ack=1 Win=64256 Len=0 TSval=392039188 TSecr=1296886947"
"98","35.879662","192.168.11.22","192.168.11.33","TCP","93","","0.000634000","Jan  8, 2024 13:40:49.377558000 JST","","44146  >  6000 [PSH, ACK] Seq=1 Ack=1 Win=64256 Len=27 TSval=392039189 TSecr=1296886947 [TCP segment of a reassembled PDU]"
"99","35.879763","192.168.11.33","192.168.11.22","TCP","66","0.000101000","0.000101000","Jan  8, 2024 13:40:49.377659000 JST","","6000  >  44146 [ACK] Seq=1 Ack=28 Win=65152 Len=0 TSval=1296886955 TSecr=392039189"
"100","35.879858","192.168.11.22","192.168.11.33","TCP","66","","0.000095000","Jan  8, 2024 13:40:49.377754000 JST","","44146  >  6000 [FIN, ACK] Seq=28 Ack=1 Win=64256 Len=0 TSval=392039189 TSecr=1296886947"
"101","35.881644","192.168.11.33","192.168.11.22","TCP","66","0.001786000","0.001786000","Jan  8, 2024 13:40:49.379540000 JST","","6000  >  44146 [FIN, ACK] Seq=1 Ack=29 Win=65152 Len=0 TSval=1296886957 TSecr=392039189"
"102","35.886207","192.168.11.22","192.168.11.33","TCP","66","0.004563000","0.004563000","Jan  8, 2024 13:40:49.384103000 JST","","44146  >  6000 [ACK] Seq=29 Ack=2 Win=64256 Len=0 TSval=392039196 TSecr=1296886957"
"103","42.558643","192.168.11.33","192.168.11.18","TCP","74","","6.672436000","Jan  8, 2024 13:40:56.056539000 JST","","45604  >  6000 [SYN] Seq=0 Win=64240 Len=0 MSS=1460 SACK_PERM TSval=3907778565 TSecr=0 WS=128"
"104","42.565547","192.168.11.18","192.168.11.33","TCP","74","0.006904000","0.006904000","Jan  8, 2024 13:40:56.063443000 JST","","6000  >  45604 [SYN, ACK] Seq=0 Ack=1 Win=65160 Len=0 MSS=1460 SACK_PERM TSval=2601684100 TSecr=3907778565 WS=128"
"105","42.565654","192.168.11.33","192.168.11.18","TCP","66","0.000107000","0.000107000","Jan  8, 2024 13:40:56.063550000 JST","","45604  >  6000 [ACK] Seq=1 Ack=1 Win=64256 Len=0 TSval=3907778572 TSecr=2601684100"
"106","42.565824","192.168.11.33","192.168.11.18","TCP","93","","0.000170000","Jan  8, 2024 13:40:56.063720000 JST","","45604  >  6000 [PSH, ACK] Seq=1 Ack=1 Win=64256 Len=27 TSval=3907778572 TSecr=2601684100 [TCP segment of a reassembled PDU]"
"107","42.565954","192.168.11.33","192.168.11.18","TCP","66","","0.000130000","Jan  8, 2024 13:40:56.063850000 JST","","45604  >  6000 [FIN, ACK] Seq=28 Ack=1 Win=64256 Len=0 TSval=3907778572 TSecr=2601684100"
"108","42.573030","192.168.11.18","192.168.11.33","TCP","66","0.007206000","0.007076000","Jan  8, 2024 13:40:56.070926000 JST","","6000  >  45604 [ACK] Seq=1 Ack=28 Win=65152 Len=0 TSval=2601684107 TSecr=3907778572"
"109","42.573412","192.168.11.18","192.168.11.33","TCP","66","0.007458000","0.000382000","Jan  8, 2024 13:40:56.071308000 JST","","6000  >  45604 [FIN, ACK] Seq=1 Ack=29 Win=65152 Len=0 TSval=2601684108 TSecr=3907778572"
"110","42.573477","192.168.11.33","192.168.11.18","TCP","66","0.000065000","0.000065000","Jan  8, 2024 13:40:56.071373000 JST","","45604  >  6000 [ACK] Seq=29 Ack=2 Win=64256 Len=0 TSval=3907778579 TSecr=2601684108"
"111","42.602363","192.168.11.33","255.255.255.255","UDP","209","","0.028886000","Jan  8, 2024 13:40:56.100259000 JST","7b2273656d616e74696373223a207b22656e74697479223a2022504944222c202262617365656e74697479223a2022616e79222c2022726f6c65223a2022787878222c20227370617469616c223a2022616e79222c202274656d706f72616c223a2022616e79227d2c20226461746170726f7065727479223a207b22666f726d6174223a2022696e616f6b615f70726f6772616d5f73616d706c655f73656d616e746963227d7d","45296  >  7000 Len=167"
"112","42.609760","192.168.11.22","192.168.11.33","TCP","74","","0.007397000","Jan  8, 2024 13:40:56.107656000 JST","","37736  >  6000 [SYN] Seq=0 Win=64240 Len=0 MSS=1460 SACK_PERM TSval=392045920 TSecr=0 WS=128"
"113","42.609889","192.168.11.33","192.168.11.22","TCP","74","0.000129000","0.000129000","Jan  8, 2024 13:40:56.107785000 JST","","6000  >  37736 [SYN, ACK] Seq=0 Ack=1 Win=65160 Len=0 MSS=1460 SACK_PERM TSval=1296893685 TSecr=392045920 WS=128"
"114","42.616593","192.168.11.22","192.168.11.33","TCP","66","0.006704000","0.006704000","Jan  8, 2024 13:40:56.114489000 JST","","37736  >  6000 [ACK] Seq=1 Ack=1 Win=64256 Len=0 TSval=392045926 TSecr=1296893685"
"115","42.617049","192.168.11.22","192.168.11.33","TCP","93","","0.000456000","Jan  8, 2024 13:40:56.114945000 JST","","37736  >  6000 [PSH, ACK] Seq=1 Ack=1 Win=64256 Len=27 TSval=392045926 TSecr=1296893685 [TCP segment of a reassembled PDU]"
"116","42.617151","192.168.11.33","192.168.11.22","TCP","66","0.000102000","0.000102000","Jan  8, 2024 13:40:56.115047000 JST","","6000  >  37736 [ACK] Seq=1 Ack=28 Win=65152 Len=0 TSval=1296893692 TSecr=392045926"
"117","42.617428","192.168.11.22","192.168.11.33","TCP","66","","0.000277000","Jan  8, 2024 13:40:56.115324000 JST","","37736  >  6000 [FIN, ACK] Seq=28 Ack=1 Win=64256 Len=0 TSval=392045927 TSecr=1296893685"
"118","42.618597","192.168.11.33","192.168.11.22","TCP","66","0.001169000","0.001169000","Jan  8, 2024 13:40:56.116493000 JST","","6000  >  37736 [FIN, ACK] Seq=1 Ack=29 Win=65152 Len=0 TSval=1296893694 TSecr=392045927"
"119","42.625305","192.168.11.22","192.168.11.33","TCP","66","0.006708000","0.006708000","Jan  8, 2024 13:40:56.123201000 JST","","37736  >  6000 [ACK] Seq=29 Ack=2 Win=64256 Len=0 TSval=392045936 TSecr=1296893694"
"120","49.308243","192.168.11.33","192.168.11.18","TCP","74","","6.682938000","Jan  8, 2024 13:41:02.806139000 JST","","36046  >  6000 [SYN] Seq=0 Win=64240 Len=0 MSS=1460 SACK_PERM TSval=3907785314 TSecr=0 WS=128"
"121","49.315062","192.168.11.18","192.168.11.33","TCP","74","0.006819000","0.006819000","Jan  8, 2024 13:41:02.812958000 JST","","6000  >  36046 [SYN, ACK] Seq=0 Ack=1 Win=65160 Len=0 MSS=1460 SACK_PERM TSval=2601690849 TSecr=3907785314 WS=128"
"122","49.315154","192.168.11.33","192.168.11.18","TCP","66","0.000092000","0.000092000","Jan  8, 2024 13:41:02.813050000 JST","","36046  >  6000 [ACK] Seq=1 Ack=1 Win=64256 Len=0 TSval=3907785321 TSecr=2601690849"
"123","49.315346","192.168.11.33","192.168.11.18","TCP","93","","0.000192000","Jan  8, 2024 13:41:02.813242000 JST","","36046  >  6000 [PSH, ACK] Seq=1 Ack=1 Win=64256 Len=27 TSval=3907785321 TSecr=2601690849 [TCP segment of a reassembled PDU]"
"124","49.315457","192.168.11.33","192.168.11.18","TCP","66","","0.000111000","Jan  8, 2024 13:41:02.813353000 JST","","36046  >  6000 [FIN, ACK] Seq=28 Ack=1 Win=64256 Len=0 TSval=3907785321 TSecr=2601690849"
"125","49.322211","192.168.11.18","192.168.11.33","TCP","66","0.006865000","0.006754000","Jan  8, 2024 13:41:02.820107000 JST","","6000  >  36046 [ACK] Seq=1 Ack=28 Win=65152 Len=0 TSval=2601690856 TSecr=3907785321"
"126","49.322574","192.168.11.18","192.168.11.33","TCP","66","0.007117000","0.000363000","Jan  8, 2024 13:41:02.820470000 JST","","6000  >  36046 [FIN, ACK] Seq=1 Ack=29 Win=65152 Len=0 TSval=2601690858 TSecr=3907785321"
"127","49.322623","192.168.11.33","192.168.11.18","TCP","66","0.000049000","0.000049000","Jan  8, 2024 13:41:02.820519000 JST","","36046  >  6000 [ACK] Seq=29 Ack=2 Win=64256 Len=0 TSval=3907785329 TSecr=2601690858"
"128","49.349439","192.168.11.33","255.255.255.255","UDP","209","","0.026816000","Jan  8, 2024 13:41:02.847335000 JST","7b2273656d616e74696373223a207b22656e74697479223a2022504944222c202262617365656e74697479223a2022616e79222c2022726f6c65223a2022787878222c20227370617469616c223a2022616e79222c202274656d706f72616c223a2022616e79227d2c20226461746170726f7065727479223a207b22666f726d6174223a2022696e616f6b615f70726f6772616d5f73616d706c655f73656d616e746963227d7d","46623  >  7000 Len=167"
"129","49.358183","192.168.11.22","192.168.11.33","TCP","74","","0.008744000","Jan  8, 2024 13:41:02.856079000 JST","","37738  >  6000 [SYN] Seq=0 Win=64240 Len=0 MSS=1460 SACK_PERM TSval=392052668 TSecr=0 WS=128"
"130","49.358301","192.168.11.33","192.168.11.22","TCP","74","0.000118000","0.000118000","Jan  8, 2024 13:41:02.856197000 JST","","6000  >  37738 [SYN, ACK] Seq=0 Ack=1 Win=65160 Len=0 MSS=1460 SACK_PERM TSval=1296900433 TSecr=392052668 WS=128"
"131","49.365416","192.168.11.22","192.168.11.33","TCP","66","0.007115000","0.007115000","Jan  8, 2024 13:41:02.863312000 JST","","37738  >  6000 [ACK] Seq=1 Ack=1 Win=64256 Len=0 TSval=392052675 TSecr=1296900433"
"132","49.366037","192.168.11.22","192.168.11.33","TCP","93","","0.000621000","Jan  8, 2024 13:41:02.863933000 JST","","37738  >  6000 [PSH, ACK] Seq=1 Ack=1 Win=64256 Len=27 TSval=392052675 TSecr=1296900433 [TCP segment of a reassembled PDU]"
"133","49.366123","192.168.11.33","192.168.11.22","TCP","66","0.000086000","0.000086000","Jan  8, 2024 13:41:02.864019000 JST","","6000  >  37738 [ACK] Seq=1 Ack=28 Win=65152 Len=0 TSval=1296900441 TSecr=392052675"
"134","49.366196","192.168.11.22","192.168.11.33","TCP","66","","0.000073000","Jan  8, 2024 13:41:02.864092000 JST","","37738  >  6000 [FIN, ACK] Seq=28 Ack=1 Win=64256 Len=0 TSval=392052675 TSecr=1296900433"
"135","49.367467","192.168.11.33","192.168.11.22","TCP","66","0.001271000","0.001271000","Jan  8, 2024 13:41:02.865363000 JST","","6000  >  37738 [FIN, ACK] Seq=1 Ack=29 Win=65152 Len=0 TSval=1296900442 TSecr=392052675"
"136","49.373337","192.168.11.22","192.168.11.33","TCP","66","0.005870000","0.005870000","Jan  8, 2024 13:41:02.871233000 JST","","37738  >  6000 [ACK] Seq=29 Ack=2 Win=64256 Len=0 TSval=392052683 TSecr=1296900442"
"137","56.016711","192.168.11.33","192.168.11.18","TCP","74","","6.643374000","Jan  8, 2024 13:41:09.514607000 JST","","39500  >  6000 [SYN] Seq=0 Win=64240 Len=0 MSS=1460 SACK_PERM TSval=3907792023 TSecr=0 WS=128"
"138","56.023492","192.168.11.18","192.168.11.33","TCP","74","0.006781000","0.006781000","Jan  8, 2024 13:41:09.521388000 JST","","6000  >  39500 [SYN, ACK] Seq=0 Ack=1 Win=65160 Len=0 MSS=1460 SACK_PERM TSval=2601697558 TSecr=3907792023 WS=128"
"139","56.023596","192.168.11.33","192.168.11.18","TCP","66","0.000104000","0.000104000","Jan  8, 2024 13:41:09.521492000 JST","","39500  >  6000 [ACK] Seq=1 Ack=1 Win=64256 Len=0 TSval=3907792030 TSecr=2601697558"
"140","56.023754","192.168.11.33","192.168.11.18","TCP","93","","0.000158000","Jan  8, 2024 13:41:09.521650000 JST","","39500  >  6000 [PSH, ACK] Seq=1 Ack=1 Win=64256 Len=27 TSval=3907792030 TSecr=2601697558 [TCP segment of a reassembled PDU]"
"141","56.023856","192.168.11.33","192.168.11.18","TCP","66","","0.000102000","Jan  8, 2024 13:41:09.521752000 JST","","39500  >  6000 [FIN, ACK] Seq=28 Ack=1 Win=64256 Len=0 TSval=3907792030 TSecr=2601697558"
"142","56.030882","192.168.11.18","192.168.11.33","TCP","66","0.007128000","0.007026000","Jan  8, 2024 13:41:09.528778000 JST","","6000  >  39500 [ACK] Seq=1 Ack=28 Win=65152 Len=0 TSval=2601697565 TSecr=3907792030"
"143","56.031249","192.168.11.18","192.168.11.33","TCP","66","0.007393000","0.000367000","Jan  8, 2024 13:41:09.529145000 JST","","6000  >  39500 [FIN, ACK] Seq=1 Ack=29 Win=65152 Len=0 TSval=2601697567 TSecr=3907792030"
"144","56.031293","192.168.11.33","192.168.11.18","TCP","66","0.000044000","0.000044000","Jan  8, 2024 13:41:09.529189000 JST","","39500  >  6000 [ACK] Seq=29 Ack=2 Win=64256 Len=0 TSval=3907792037 TSecr=2601697567"
"145","56.060149","192.168.11.33","255.255.255.255","UDP","209","","0.028856000","Jan  8, 2024 13:41:09.558045000 JST","7b2273656d616e74696373223a207b22656e74697479223a2022504944222c202262617365656e74697479223a2022616e79222c2022726f6c65223a2022787878222c20227370617469616c223a2022616e79222c202274656d706f72616c223a2022616e79227d2c20226461746170726f7065727479223a207b22666f726d6174223a2022696e616f6b615f70726f6772616d5f73616d706c655f73656d616e746963227d7d","56508  >  7000 Len=167"
"146","56.074855","192.168.11.22","192.168.11.33","TCP","74","","0.014706000","Jan  8, 2024 13:41:09.572751000 JST","","56506  >  6000 [SYN] Seq=0 Win=64240 Len=0 MSS=1460 SACK_PERM TSval=392059380 TSecr=0 WS=128"
"147","56.075033","192.168.11.33","192.168.11.22","TCP","74","0.000178000","0.000178000","Jan  8, 2024 13:41:09.572929000 JST","","6000  >  56506 [SYN, ACK] Seq=0 Ack=1 Win=65160 Len=0 MSS=1460 SACK_PERM TSval=1296907150 TSecr=392059380 WS=128"
"148","56.087580","192.168.11.22","192.168.11.33","TCP","66","0.012547000","0.012547000","Jan  8, 2024 13:41:09.585476000 JST","","56506  >  6000 [ACK] Seq=1 Ack=1 Win=64256 Len=0 TSval=392059397 TSecr=1296907150"
"149","56.088090","192.168.11.22","192.168.11.33","TCP","93","","0.000510000","Jan  8, 2024 13:41:09.585986000 JST","","56506  >  6000 [PSH, ACK] Seq=1 Ack=1 Win=64256 Len=27 TSval=392059398 TSecr=1296907150 [TCP segment of a reassembled PDU]"
"150","56.088158","192.168.11.33","192.168.11.22","TCP","66","0.000068000","0.000068000","Jan  8, 2024 13:41:09.586054000 JST","","6000  >  56506 [ACK] Seq=1 Ack=28 Win=65152 Len=0 TSval=1296907163 TSecr=392059398"
"151","56.088222","192.168.11.22","192.168.11.33","TCP","66","","0.000064000","Jan  8, 2024 13:41:09.586118000 JST","","56506  >  6000 [FIN, ACK] Seq=28 Ack=1 Win=64256 Len=0 TSval=392059398 TSecr=1296907150"
"152","56.089139","192.168.11.33","192.168.11.22","TCP","66","0.000917000","0.000917000","Jan  8, 2024 13:41:09.587035000 JST","","6000  >  56506 [FIN, ACK] Seq=1 Ack=29 Win=65152 Len=0 TSval=1296907164 TSecr=392059398"
"153","56.095289","192.168.11.22","192.168.11.33","TCP","66","0.006150000","0.006150000","Jan  8, 2024 13:41:09.593185000 JST","","56506  >  6000 [ACK] Seq=29 Ack=2 Win=64256 Len=0 TSval=392059405 TSecr=1296907164"
"154","62.673665","192.168.11.33","192.168.11.18","TCP","74","","6.578376000","Jan  8, 2024 13:41:16.171561000 JST","","39506  >  6000 [SYN] Seq=0 Win=64240 Len=0 MSS=1460 SACK_PERM TSval=3907798680 TSecr=0 WS=128"
"155","62.682929","192.168.11.18","192.168.11.33","TCP","74","0.009264000","0.009264000","Jan  8, 2024 13:41:16.180825000 JST","","6000  >  39506 [SYN, ACK] Seq=0 Ack=1 Win=65160 Len=0 MSS=1460 SACK_PERM TSval=2601704217 TSecr=3907798680 WS=128"
"156","62.683030","192.168.11.33","192.168.11.18","TCP","66","0.000101000","0.000101000","Jan  8, 2024 13:41:16.180926000 JST","","39506  >  6000 [ACK] Seq=1 Ack=1 Win=64256 Len=0 TSval=3907798689 TSecr=2601704217"
"157","62.683195","192.168.11.33","192.168.11.18","TCP","93","","0.000165000","Jan  8, 2024 13:41:16.181091000 JST","","39506  >  6000 [PSH, ACK] Seq=1 Ack=1 Win=64256 Len=27 TSval=3907798689 TSecr=2601704217 [TCP segment of a reassembled PDU]"
"158","62.683284","192.168.11.33","192.168.11.18","TCP","66","","0.000089000","Jan  8, 2024 13:41:16.181180000 JST","","39506  >  6000 [FIN, ACK] Seq=28 Ack=1 Win=64256 Len=0 TSval=3907798689 TSecr=2601704217"
"159","62.690123","192.168.11.18","192.168.11.33","TCP","66","0.006928000","0.006839000","Jan  8, 2024 13:41:16.188019000 JST","","6000  >  39506 [ACK] Seq=1 Ack=28 Win=65152 Len=0 TSval=2601704224 TSecr=3907798689"
"160","62.690511","192.168.11.18","192.168.11.33","TCP","66","0.007227000","0.000388000","Jan  8, 2024 13:41:16.188407000 JST","","6000  >  39506 [FIN, ACK] Seq=1 Ack=29 Win=65152 Len=0 TSval=2601704226 TSecr=3907798689"
"161","62.690557","192.168.11.33","192.168.11.18","TCP","66","0.000046000","0.000046000","Jan  8, 2024 13:41:16.188453000 JST","","39506  >  6000 [ACK] Seq=29 Ack=2 Win=64256 Len=0 TSval=3907798696 TSecr=2601704226"
"162","62.720821","192.168.11.33","255.255.255.255","UDP","209","","0.030264000","Jan  8, 2024 13:41:16.218717000 JST","7b2273656d616e74696373223a207b22656e74697479223a2022504944222c202262617365656e74697479223a2022616e79222c2022726f6c65223a2022787878222c20227370617469616c223a2022616e79222c202274656d706f72616c223a2022616e79227d2c20226461746170726f7065727479223a207b22666f726d6174223a2022696e616f6b615f70726f6772616d5f73616d706c655f73656d616e746963227d7d","44641  >  7000 Len=167"
"163","62.728268","192.168.11.22","192.168.11.33","TCP","74","","0.007447000","Jan  8, 2024 13:41:16.226164000 JST","","60892  >  6000 [SYN] Seq=0 Win=64240 Len=0 MSS=1460 SACK_PERM TSval=392066038 TSecr=0 WS=128"
"164","62.728415","192.168.11.33","192.168.11.22","TCP","74","0.000147000","0.000147000","Jan  8, 2024 13:41:16.226311000 JST","","6000  >  60892 [SYN, ACK] Seq=0 Ack=1 Win=65160 Len=0 MSS=1460 SACK_PERM TSval=1296913803 TSecr=392066038 WS=128"
"165","62.735067","192.168.11.22","192.168.11.33","TCP","66","0.006652000","0.006652000","Jan  8, 2024 13:41:16.232963000 JST","","60892  >  6000 [ACK] Seq=1 Ack=1 Win=64256 Len=0 TSval=392066045 TSecr=1296913803"
"166","62.735691","192.168.11.22","192.168.11.33","TCP","93","","0.000624000","Jan  8, 2024 13:41:16.233587000 JST","","60892  >  6000 [PSH, ACK] Seq=1 Ack=1 Win=64256 Len=27 TSval=392066045 TSecr=1296913803 [TCP segment of a reassembled PDU]"
"167","62.735777","192.168.11.33","192.168.11.22","TCP","66","0.000086000","0.000086000","Jan  8, 2024 13:41:16.233673000 JST","","6000  >  60892 [ACK] Seq=1 Ack=28 Win=65152 Len=0 TSval=1296913811 TSecr=392066045"
"168","62.735854","192.168.11.22","192.168.11.33","TCP","66","","0.000077000","Jan  8, 2024 13:41:16.233750000 JST","","60892  >  6000 [FIN, ACK] Seq=28 Ack=1 Win=64256 Len=0 TSval=392066045 TSecr=1296913803"
