"No.","Time","Source","Destination","Protocol","Length","The RTT to ACK the segment was","Time delta from previous captured frame","Arrival Time","Data","Info"
"1","0.000000","192.168.11.34","192.168.11.35","TCP","74","","0.000000000","Jan  8, 2024 13:40:13.670973000 JST","","49892  >  6000 [SYN] Seq=0 Win=64240 Len=0 MSS=1460 SACK_PERM TSval=310080558 TSecr=0 WS=128"
"2","0.009271","192.168.11.35","192.168.11.34","TCP","74","0.009271000","0.009271000","Jan  8, 2024 13:40:13.680244000 JST","","6000  >  49892 [SYN, ACK] Seq=0 Ack=1 Win=65160 Len=0 MSS=1460 SACK_PERM TSval=699624315 TSecr=310080558 WS=128"
"3","0.009394","192.168.11.34","192.168.11.35","TCP","66","0.000123000","0.000123000","Jan  8, 2024 13:40:13.680367000 JST","","49892  >  6000 [ACK] Seq=1 Ack=1 Win=64256 Len=0 TSval=310080572 TSecr=699624315"
"4","0.009681","192.168.11.34","192.168.11.35","TCP","93","","0.000287000","Jan  8, 2024 13:40:13.680654000 JST","","49892  >  6000 [PSH, ACK] Seq=1 Ack=1 Win=64256 Len=27 TSval=310080572 TSecr=699624315 [TCP segment of a reassembled PDU]"
"5","0.009825","192.168.11.34","192.168.11.35","TCP","66","","0.000144000","Jan  8, 2024 13:40:13.680798000 JST","","49892  >  6000 [FIN, ACK] Seq=28 Ack=1 Win=64256 Len=0 TSval=310080572 TSecr=699624315"
"6","0.018745","192.168.11.35","192.168.11.34","TCP","66","0.009064000","0.008920000","Jan  8, 2024 13:40:13.689718000 JST","","6000  >  49892 [ACK] Seq=1 Ack=28 Win=65152 Len=0 TSval=699624324 TSecr=310080572"
"7","0.019005","192.168.11.35","192.168.11.34","TCP","66","0.009180000","0.000260000","Jan  8, 2024 13:40:13.689978000 JST","","6000  >  49892 [FIN, ACK] Seq=1 Ack=29 Win=65152 Len=0 TSval=699624325 TSecr=310080572"
"8","0.019062","192.168.11.34","192.168.11.35","TCP","66","0.000057000","0.000057000","Jan  8, 2024 13:40:13.690035000 JST","","49892  >  6000 [ACK] Seq=29 Ack=2 Win=64256 Len=0 TSval=310080581 TSecr=699624325"
"9","0.056923","192.168.11.34","255.255.255.255","UDP","209","","0.037861000","Jan  8, 2024 13:40:13.727896000 JST","7b2273656d616e74696373223a207b22656e74697479223a2022504944222c202262617365656e74697479223a2022616e79222c2022726f6c65223a2022313131222c20227370617469616c223a2022616e79222c202274656d706f72616c223a2022616e79227d2c20226461746170726f7065727479223a207b22666f726d6174223a2022696e616f6b615f70726f6772616d5f73616d706c655f73656d616e746963227d7d","56486  >  7000 Len=167"
"10","0.079084","192.168.11.6","192.168.11.34","TCP","74","","0.022161000","Jan  8, 2024 13:40:13.750057000 JST","","56092  >  6000 [SYN] Seq=0 Win=64240 Len=0 MSS=1460 SACK_PERM TSval=1078041598 TSecr=0 WS=128"
"11","0.079256","192.168.11.34","192.168.11.6","TCP","74","0.000172000","0.000172000","Jan  8, 2024 13:40:13.750229000 JST","","6000  >  56092 [SYN, ACK] Seq=0 Ack=1 Win=65160 Len=0 MSS=1460 SACK_PERM TSval=3693124048 TSecr=1078041598 WS=128"
"12","0.088194","192.168.11.6","192.168.11.34","TCP","66","0.008938000","0.008938000","Jan  8, 2024 13:40:13.759167000 JST","","56092  >  6000 [ACK] Seq=1 Ack=1 Win=64256 Len=0 TSval=1078041621 TSecr=3693124048"
"13","0.088709","192.168.11.6","192.168.11.34","TCP","93","","0.000515000","Jan  8, 2024 13:40:13.759682000 JST","","56092  >  6000 [PSH, ACK] Seq=1 Ack=1 Win=64256 Len=27 TSval=1078041622 TSecr=3693124048 [TCP segment of a reassembled PDU]"
"14","0.088777","192.168.11.34","192.168.11.6","TCP","66","0.000068000","0.000068000","Jan  8, 2024 13:40:13.759750000 JST","","6000  >  56092 [ACK] Seq=1 Ack=28 Win=65152 Len=0 TSval=3693124058 TSecr=1078041622"
"15","0.088995","192.168.11.6","192.168.11.34","TCP","66","","0.000218000","Jan  8, 2024 13:40:13.759968000 JST","","56092  >  6000 [FIN, ACK] Seq=28 Ack=1 Win=64256 Len=0 TSval=1078041622 TSecr=3693124048"
"16","0.090044","192.168.11.34","192.168.11.6","TCP","66","0.001049000","0.001049000","Jan  8, 2024 13:40:13.761017000 JST","","6000  >  56092 [FIN, ACK] Seq=1 Ack=29 Win=65152 Len=0 TSval=3693124059 TSecr=1078041622"
"17","0.096803","192.168.11.6","192.168.11.34","TCP","66","0.006759000","0.006759000","Jan  8, 2024 13:40:13.767776000 JST","","56092  >  6000 [ACK] Seq=29 Ack=2 Win=64256 Len=0 TSval=1078041630 TSecr=3693124059"
"18","6.871176","192.168.11.34","192.168.11.35","TCP","74","","6.774373000","Jan  8, 2024 13:40:20.542149000 JST","","41044  >  6000 [SYN] Seq=0 Win=64240 Len=0 MSS=1460 SACK_PERM TSval=310087433 TSecr=0 WS=128"
"19","6.879813","192.168.11.35","192.168.11.34","TCP","74","0.008637000","0.008637000","Jan  8, 2024 13:40:20.550786000 JST","","6000  >  41044 [SYN, ACK] Seq=0 Ack=1 Win=65160 Len=0 MSS=1460 SACK_PERM TSval=699631186 TSecr=310087433 WS=128"
"20","6.879919","192.168.11.34","192.168.11.35","TCP","66","0.000106000","0.000106000","Jan  8, 2024 13:40:20.550892000 JST","","41044  >  6000 [ACK] Seq=1 Ack=1 Win=64256 Len=0 TSval=310087442 TSecr=699631186"
"21","6.880104","192.168.11.34","192.168.11.35","TCP","93","","0.000185000","Jan  8, 2024 13:40:20.551077000 JST","","41044  >  6000 [PSH, ACK] Seq=1 Ack=1 Win=64256 Len=27 TSval=310087442 TSecr=699631186 [TCP segment of a reassembled PDU]"
"22","6.880247","192.168.11.34","192.168.11.35","TCP","66","","0.000143000","Jan  8, 2024 13:40:20.551220000 JST","","41044  >  6000 [FIN, ACK] Seq=28 Ack=1 Win=64256 Len=0 TSval=310087442 TSecr=699631186"
"23","6.901293","192.168.11.35","192.168.11.34","TCP","66","0.021189000","0.021046000","Jan  8, 2024 13:40:20.572266000 JST","","6000  >  41044 [ACK] Seq=1 Ack=28 Win=65152 Len=0 TSval=699631207 TSecr=310087442"
"24","6.901699","192.168.11.35","192.168.11.34","TCP","66","0.021452000","0.000406000","Jan  8, 2024 13:40:20.572672000 JST","","6000  >  41044 [FIN, ACK] Seq=1 Ack=29 Win=65152 Len=0 TSval=699631208 TSecr=310087442"
"25","6.901750","192.168.11.34","192.168.11.35","TCP","66","0.000051000","0.000051000","Jan  8, 2024 13:40:20.572723000 JST","","41044  >  6000 [ACK] Seq=29 Ack=2 Win=64256 Len=0 TSval=310087464 TSecr=699631208"
"26","6.936127","192.168.11.34","255.255.255.255","UDP","209","","0.034377000","Jan  8, 2024 13:40:20.607100000 JST","7b2273656d616e74696373223a207b22656e74697479223a2022504944222c202262617365656e74697479223a2022616e79222c2022726f6c65223a2022313131222c20227370617469616c223a2022616e79222c202274656d706f72616c223a2022616e79227d2c20226461746170726f7065727479223a207b22666f726d6174223a2022696e616f6b615f70726f6772616d5f73616d706c655f73656d616e746963227d7d","48393  >  7000 Len=167"
"27","6.943621","192.168.11.6","192.168.11.34","TCP","74","","0.007494000","Jan  8, 2024 13:40:20.614594000 JST","","56108  >  6000 [SYN] Seq=0 Win=64240 Len=0 MSS=1460 SACK_PERM TSval=1078048477 TSecr=0 WS=128"
"28","6.943773","192.168.11.34","192.168.11.6","TCP","74","0.000152000","0.000152000","Jan  8, 2024 13:40:20.614746000 JST","","6000  >  56108 [SYN, ACK] Seq=0 Ack=1 Win=65160 Len=0 MSS=1460 SACK_PERM TSval=3693130913 TSecr=1078048477 WS=128"
"29","6.950996","192.168.11.6","192.168.11.34","TCP","66","0.007223000","0.007223000","Jan  8, 2024 13:40:20.621969000 JST","","56108  >  6000 [ACK] Seq=1 Ack=1 Win=64256 Len=0 TSval=1078048484 TSecr=3693130913"
"30","6.951725","192.168.11.6","192.168.11.34","TCP","93","","0.000729000","Jan  8, 2024 13:40:20.622698000 JST","","56108  >  6000 [PSH, ACK] Seq=1 Ack=1 Win=64256 Len=27 TSval=1078048484 TSecr=3693130913 [TCP segment of a reassembled PDU]"
"31","6.951838","192.168.11.34","192.168.11.6","TCP","66","0.000113000","0.000113000","Jan  8, 2024 13:40:20.622811000 JST","","6000  >  56108 [ACK] Seq=1 Ack=28 Win=65152 Len=0 TSval=3693130921 TSecr=1078048484"
"32","6.951916","192.168.11.6","192.168.11.34","TCP","66","","0.000078000","Jan  8, 2024 13:40:20.622889000 JST","","56108  >  6000 [FIN, ACK] Seq=28 Ack=1 Win=64256 Len=0 TSval=1078048484 TSecr=3693130913"
"33","6.953867","192.168.11.34","192.168.11.6","TCP","66","0.001951000","0.001951000","Jan  8, 2024 13:40:20.624840000 JST","","6000  >  56108 [FIN, ACK] Seq=1 Ack=29 Win=65152 Len=0 TSval=3693130923 TSecr=1078048484"
"34","6.958756","192.168.11.6","192.168.11.34","TCP","66","0.004889000","0.004889000","Jan  8, 2024 13:40:20.629729000 JST","","56108  >  6000 [ACK] Seq=29 Ack=2 Win=64256 Len=0 TSval=1078048492 TSecr=3693130923"
"35","14.617566","192.168.11.34","192.168.11.35","TCP","74","","7.658810000","Jan  8, 2024 13:40:28.288539000 JST","","34296  >  6000 [SYN] Seq=0 Win=64240 Len=0 MSS=1460 SACK_PERM TSval=310095180 TSecr=0 WS=128"
"36","14.626591","192.168.11.35","192.168.11.34","TCP","74","0.009025000","0.009025000","Jan  8, 2024 13:40:28.297564000 JST","","6000  >  34296 [SYN, ACK] Seq=0 Ack=1 Win=65160 Len=0 MSS=1460 SACK_PERM TSval=699638932 TSecr=310095180 WS=128"
"37","14.626701","192.168.11.34","192.168.11.35","TCP","66","0.000110000","0.000110000","Jan  8, 2024 13:40:28.297674000 JST","","34296  >  6000 [ACK] Seq=1 Ack=1 Win=64256 Len=0 TSval=310095189 TSecr=699638932"
"38","14.626885","192.168.11.34","192.168.11.35","TCP","93","","0.000184000","Jan  8, 2024 13:40:28.297858000 JST","","34296  >  6000 [PSH, ACK] Seq=1 Ack=1 Win=64256 Len=27 TSval=310095189 TSecr=699638932 [TCP segment of a reassembled PDU]"
"39","14.626998","192.168.11.34","192.168.11.35","TCP","66","","0.000113000","Jan  8, 2024 13:40:28.297971000 JST","","34296  >  6000 [FIN, ACK] Seq=28 Ack=1 Win=64256 Len=0 TSval=310095189 TSecr=699638932"
"40","14.635612","192.168.11.35","192.168.11.34","TCP","66","0.008727000","0.008614000","Jan  8, 2024 13:40:28.306585000 JST","","6000  >  34296 [ACK] Seq=1 Ack=28 Win=65152 Len=0 TSval=699638941 TSecr=310095189"
"41","14.636024","192.168.11.35","192.168.11.34","TCP","66","","0.000412000","Jan  8, 2024 13:40:28.306997000 JST","","[TCP Dup ACK 40#1] 6000  >  34296 [ACK] Seq=1 Ack=28 Win=65152 Len=0 TSval=699638941 TSecr=310095189"
"42","14.636073","192.168.11.35","192.168.11.34","TCP","66","0.009075000","0.000049000","Jan  8, 2024 13:40:28.307046000 JST","","6000  >  34296 [FIN, ACK] Seq=1 Ack=29 Win=65152 Len=0 TSval=699638943 TSecr=310095189"
"43","14.636117","192.168.11.34","192.168.11.35","TCP","66","0.000044000","0.000044000","Jan  8, 2024 13:40:28.307090000 JST","","34296  >  6000 [ACK] Seq=29 Ack=2 Win=64256 Len=0 TSval=310095198 TSecr=699638943"
"44","14.666080","192.168.11.34","255.255.255.255","UDP","209","","0.029963000","Jan  8, 2024 13:40:28.337053000 JST","7b2273656d616e74696373223a207b22656e74697479223a2022504944222c202262617365656e74697479223a2022616e79222c2022726f6c65223a2022313131222c20227370617469616c223a2022616e79222c202274656d706f72616c223a2022616e79227d2c20226461746170726f7065727479223a207b22666f726d6174223a2022696e616f6b615f70726f6772616d5f73616d706c655f73656d616e746963227d7d","56619  >  7000 Len=167"
"45","14.677442","192.168.11.6","192.168.11.34","TCP","74","","0.011362000","Jan  8, 2024 13:40:28.348415000 JST","","58062  >  6000 [SYN] Seq=0 Win=64240 Len=0 MSS=1460 SACK_PERM TSval=1078056210 TSecr=0 WS=128"
"46","14.677572","192.168.11.34","192.168.11.6","TCP","74","0.000130000","0.000130000","Jan  8, 2024 13:40:28.348545000 JST","","6000  >  58062 [SYN, ACK] Seq=0 Ack=1 Win=65160 Len=0 MSS=1460 SACK_PERM TSval=3693138647 TSecr=1078056210 WS=128"
"47","14.684421","192.168.11.6","192.168.11.34","TCP","66","0.006849000","0.006849000","Jan  8, 2024 13:40:28.355394000 JST","","58062  >  6000 [ACK] Seq=1 Ack=1 Win=64256 Len=0 TSval=1078056218 TSecr=3693138647"
"48","14.685159","192.168.11.6","192.168.11.34","TCP","93","","0.000738000","Jan  8, 2024 13:40:28.356132000 JST","","58062  >  6000 [PSH, ACK] Seq=1 Ack=1 Win=64256 Len=27 TSval=1078056218 TSecr=3693138647 [TCP segment of a reassembled PDU]"
"49","14.685279","192.168.11.34","192.168.11.6","TCP","66","0.000120000","0.000120000","Jan  8, 2024 13:40:28.356252000 JST","","6000  >  58062 [ACK] Seq=1 Ack=28 Win=65152 Len=0 TSval=3693138654 TSecr=1078056218"
"50","14.685361","192.168.11.6","192.168.11.34","TCP","66","","0.000082000","Jan  8, 2024 13:40:28.356334000 JST","","58062  >  6000 [FIN, ACK] Seq=28 Ack=1 Win=64256 Len=0 TSval=1078056218 TSecr=3693138647"
"51","14.687566","192.168.11.34","192.168.11.6","TCP","66","0.002205000","0.002205000","Jan  8, 2024 13:40:28.358539000 JST","","6000  >  58062 [FIN, ACK] Seq=1 Ack=29 Win=65152 Len=0 TSval=3693138657 TSecr=1078056218"
"52","14.692207","192.168.11.6","192.168.11.34","TCP","66","0.004641000","0.004641000","Jan  8, 2024 13:40:28.363180000 JST","","58062  >  6000 [ACK] Seq=29 Ack=2 Win=64256 Len=0 TSval=1078056226 TSecr=3693138657"
"53","21.293780","192.168.11.34","192.168.11.35","TCP","74","","6.601573000","Jan  8, 2024 13:40:34.964753000 JST","","34298  >  6000 [SYN] Seq=0 Win=64240 Len=0 MSS=1460 SACK_PERM TSval=310101856 TSecr=0 WS=128"
"54","21.302476","192.168.11.35","192.168.11.34","TCP","74","0.008696000","0.008696000","Jan  8, 2024 13:40:34.973449000 JST","","6000  >  34298 [SYN, ACK] Seq=0 Ack=1 Win=65160 Len=0 MSS=1460 SACK_PERM TSval=699645608 TSecr=310101856 WS=128"
"55","21.302588","192.168.11.34","192.168.11.35","TCP","66","0.000112000","0.000112000","Jan  8, 2024 13:40:34.973561000 JST","","34298  >  6000 [ACK] Seq=1 Ack=1 Win=64256 Len=0 TSval=310101865 TSecr=699645608"
"56","21.302771","192.168.11.34","192.168.11.35","TCP","93","","0.000183000","Jan  8, 2024 13:40:34.973744000 JST","","34298  >  6000 [PSH, ACK] Seq=1 Ack=1 Win=64256 Len=27 TSval=310101865 TSecr=699645608 [TCP segment of a reassembled PDU]"
"57","21.302888","192.168.11.34","192.168.11.35","TCP","66","","0.000117000","Jan  8, 2024 13:40:34.973861000 JST","","34298  >  6000 [FIN, ACK] Seq=28 Ack=1 Win=64256 Len=0 TSval=310101865 TSecr=699645608"
"58","21.310963","192.168.11.35","192.168.11.34","TCP","66","0.008192000","0.008075000","Jan  8, 2024 13:40:34.981936000 JST","","6000  >  34298 [ACK] Seq=1 Ack=28 Win=65152 Len=0 TSval=699645617 TSecr=310101865"
"59","21.311322","192.168.11.35","192.168.11.34","TCP","66","0.008434000","0.000359000","Jan  8, 2024 13:40:34.982295000 JST","","6000  >  34298 [FIN, ACK] Seq=1 Ack=29 Win=65152 Len=0 TSval=699645618 TSecr=310101865"
"60","21.311366","192.168.11.34","192.168.11.35","TCP","66","0.000044000","0.000044000","Jan  8, 2024 13:40:34.982339000 JST","","34298  >  6000 [ACK] Seq=29 Ack=2 Win=64256 Len=0 TSval=310101874 TSecr=699645618"
"61","21.347368","192.168.11.34","255.255.255.255","UDP","209","","0.036002000","Jan  8, 2024 13:40:35.018341000 JST","7b2273656d616e74696373223a207b22656e74697479223a2022504944222c202262617365656e74697479223a2022616e79222c2022726f6c65223a2022313131222c20227370617469616c223a2022616e79222c202274656d706f72616c223a2022616e79227d2c20226461746170726f7065727479223a207b22666f726d6174223a2022696e616f6b615f70726f6772616d5f73616d706c655f73656d616e746963227d7d","38985  >  7000 Len=167"
"62","21.368210","192.168.11.6","192.168.11.34","TCP","74","","0.020842000","Jan  8, 2024 13:40:35.039183000 JST","","36010  >  6000 [SYN] Seq=0 Win=64240 Len=0 MSS=1460 SACK_PERM TSval=1078062900 TSecr=0 WS=128"
"63","21.368363","192.168.11.34","192.168.11.6","TCP","74","0.000153000","0.000153000","Jan  8, 2024 13:40:35.039336000 JST","","6000  >  36010 [SYN, ACK] Seq=0 Ack=1 Win=65160 Len=0 MSS=1460 SACK_PERM TSval=3693145338 TSecr=1078062900 WS=128"
"64","21.377734","192.168.11.6","192.168.11.34","TCP","66","0.009371000","0.009371000","Jan  8, 2024 13:40:35.048707000 JST","","36010  >  6000 [ACK] Seq=1 Ack=1 Win=64256 Len=0 TSval=1078062911 TSecr=3693145338"
"65","21.378174","192.168.11.6","192.168.11.34","TCP","93","","0.000440000","Jan  8, 2024 13:40:35.049147000 JST","","36010  >  6000 [PSH, ACK] Seq=1 Ack=1 Win=64256 Len=27 TSval=1078062911 TSecr=3693145338 [TCP segment of a reassembled PDU]"
"66","21.378241","192.168.11.34","192.168.11.6","TCP","66","0.000067000","0.000067000","Jan  8, 2024 13:40:35.049214000 JST","","6000  >  36010 [ACK] Seq=1 Ack=28 Win=65152 Len=0 TSval=3693145347 TSecr=1078062911"
"67","21.378387","192.168.11.6","192.168.11.34","TCP","66","","0.000146000","Jan  8, 2024 13:40:35.049360000 JST","","36010  >  6000 [FIN, ACK] Seq=28 Ack=1 Win=64256 Len=0 TSval=1078062911 TSecr=3693145338"
"68","21.379266","192.168.11.34","192.168.11.6","TCP","66","0.000879000","0.000879000","Jan  8, 2024 13:40:35.050239000 JST","","6000  >  36010 [FIN, ACK] Seq=1 Ack=29 Win=65152 Len=0 TSval=3693145348 TSecr=1078062911"
"69","21.385429","192.168.11.6","192.168.11.34","TCP","66","0.006163000","0.006163000","Jan  8, 2024 13:40:35.056402000 JST","","36010  >  6000 [ACK] Seq=29 Ack=2 Win=64256 Len=0 TSval=1078062919 TSecr=3693145348"
"70","29.083104","192.168.11.34","192.168.11.35","TCP","74","","7.697675000","Jan  8, 2024 13:40:42.754077000 JST","","50950  >  6000 [SYN] Seq=0 Win=64240 Len=0 MSS=1460 SACK_PERM TSval=310109645 TSecr=0 WS=128"
"71","29.091677","192.168.11.35","192.168.11.34","TCP","74","0.008573000","0.008573000","Jan  8, 2024 13:40:42.762650000 JST","","6000  >  50950 [SYN, ACK] Seq=0 Ack=1 Win=65160 Len=0 MSS=1460 SACK_PERM TSval=699653398 TSecr=310109645 WS=128"
"72","29.091787","192.168.11.34","192.168.11.35","TCP","66","0.000110000","0.000110000","Jan  8, 2024 13:40:42.762760000 JST","","50950  >  6000 [ACK] Seq=1 Ack=1 Win=64256 Len=0 TSval=310109654 TSecr=699653398"
"73","29.091921","192.168.11.34","192.168.11.35","TCP","93","","0.000134000","Jan  8, 2024 13:40:42.762894000 JST","","50950  >  6000 [PSH, ACK] Seq=1 Ack=1 Win=64256 Len=27 TSval=310109654 TSecr=699653398 [TCP segment of a reassembled PDU]"
"74","29.092031","192.168.11.34","192.168.11.35","TCP","66","","0.000110000","Jan  8, 2024 13:40:42.763004000 JST","","50950  >  6000 [FIN, ACK] Seq=28 Ack=1 Win=64256 Len=0 TSval=310109654 TSecr=699653398"
"75","29.100418","192.168.11.35","192.168.11.34","TCP","66","0.008497000","0.008387000","Jan  8, 2024 13:40:42.771391000 JST","","6000  >  50950 [ACK] Seq=1 Ack=28 Win=65152 Len=0 TSval=699653406 TSecr=310109654"
"76","29.100636","192.168.11.35","192.168.11.34","TCP","66","0.008605000","0.000218000","Jan  8, 2024 13:40:42.771609000 JST","","6000  >  50950 [FIN, ACK] Seq=1 Ack=29 Win=65152 Len=0 TSval=699653408 TSecr=310109654"
"77","29.100679","192.168.11.34","192.168.11.35","TCP","66","0.000043000","0.000043000","Jan  8, 2024 13:40:42.771652000 JST","","50950  >  6000 [ACK] Seq=29 Ack=2 Win=64256 Len=0 TSval=310109663 TSecr=699653408"
"78","29.132547","192.168.11.34","255.255.255.255","UDP","209","","0.031868000","Jan  8, 2024 13:40:42.803520000 JST","7b2273656d616e74696373223a207b22656e74697479223a2022504944222c202262617365656e74697479223a2022616e79222c2022726f6c65223a2022313131222c20227370617469616c223a2022616e79222c202274656d706f72616c223a2022616e79227d2c20226461746170726f7065727479223a207b22666f726d6174223a2022696e616f6b615f70726f6772616d5f73616d706c655f73656d616e746963227d7d","46595  >  7000 Len=167"
"79","29.141615","192.168.11.6","192.168.11.34","TCP","74","","0.009068000","Jan  8, 2024 13:40:42.812588000 JST","","56660  >  6000 [SYN] Seq=0 Win=64240 Len=0 MSS=1460 SACK_PERM TSval=1078070673 TSecr=0 WS=128"
"80","29.141760","192.168.11.34","192.168.11.6","TCP","74","0.000145000","0.000145000","Jan  8, 2024 13:40:42.812733000 JST","","6000  >  56660 [SYN, ACK] Seq=0 Ack=1 Win=65160 Len=0 MSS=1460 SACK_PERM TSval=3693153111 TSecr=1078070673 WS=128"
"81","29.155086","192.168.11.6","192.168.11.34","TCP","66","0.013326000","0.013326000","Jan  8, 2024 13:40:42.826059000 JST","","56660  >  6000 [ACK] Seq=1 Ack=1 Win=64256 Len=0 TSval=1078070682 TSecr=3693153111"
"82","29.155869","192.168.11.6","192.168.11.34","TCP","93","","0.000783000","Jan  8, 2024 13:40:42.826842000 JST","","56660  >  6000 [PSH, ACK] Seq=1 Ack=1 Win=64256 Len=27 TSval=1078070682 TSecr=3693153111 [TCP segment of a reassembled PDU]"
"83","29.156034","192.168.11.34","192.168.11.6","TCP","66","0.000165000","0.000165000","Jan  8, 2024 13:40:42.827007000 JST","","6000  >  56660 [ACK] Seq=1 Ack=28 Win=65152 Len=0 TSval=3693153125 TSecr=1078070682"
"84","29.156126","192.168.11.6","192.168.11.34","TCP","66","","0.000092000","Jan  8, 2024 13:40:42.827099000 JST","","56660  >  6000 [FIN, ACK] Seq=28 Ack=1 Win=64256 Len=0 TSval=1078070682 TSecr=3693153111"
"85","29.157725","192.168.11.34","192.168.11.6","TCP","66","0.001599000","0.001599000","Jan  8, 2024 13:40:42.828698000 JST","","6000  >  56660 [FIN, ACK] Seq=1 Ack=29 Win=65152 Len=0 TSval=3693153127 TSecr=1078070682"
"86","29.162542","192.168.11.6","192.168.11.34","TCP","66","0.004817000","0.004817000","Jan  8, 2024 13:40:42.833515000 JST","","56660  >  6000 [ACK] Seq=29 Ack=2 Win=64256 Len=0 TSval=1078070696 TSecr=3693153127"
"87","35.803394","192.168.11.34","192.168.11.35","TCP","74","","6.640852000","Jan  8, 2024 13:40:49.474367000 JST","","58134  >  6000 [SYN] Seq=0 Win=64240 Len=0 MSS=1460 SACK_PERM TSval=310116366 TSecr=0 WS=128"
"88","35.812100","192.168.11.35","192.168.11.34","TCP","74","0.008706000","0.008706000","Jan  8, 2024 13:40:49.483073000 JST","","6000  >  58134 [SYN, ACK] Seq=0 Ack=1 Win=65160 Len=0 MSS=1460 SACK_PERM TSval=699660118 TSecr=310116366 WS=128"
"89","35.812210","192.168.11.34","192.168.11.35","TCP","66","0.000110000","0.000110000","Jan  8, 2024 13:40:49.483183000 JST","","58134  >  6000 [ACK] Seq=1 Ack=1 Win=64256 Len=0 TSval=310116374 TSecr=699660118"
"90","35.812351","192.168.11.34","192.168.11.35","TCP","93","","0.000141000","Jan  8, 2024 13:40:49.483324000 JST","","58134  >  6000 [PSH, ACK] Seq=1 Ack=1 Win=64256 Len=27 TSval=310116375 TSecr=699660118 [TCP segment of a reassembled PDU]"
"91","35.812446","192.168.11.34","192.168.11.35","TCP","66","","0.000095000","Jan  8, 2024 13:40:49.483419000 JST","","58134  >  6000 [FIN, ACK] Seq=28 Ack=1 Win=64256 Len=0 TSval=310116375 TSecr=699660118"
"92","35.834042","192.168.11.35","192.168.11.34","TCP","66","0.021691000","0.021596000","Jan  8, 2024 13:40:49.505015000 JST","","6000  >  58134 [ACK] Seq=1 Ack=28 Win=65152 Len=0 TSval=699660135 TSecr=310116375"
"93","35.834426","192.168.11.35","192.168.11.34","TCP","66","0.021980000","0.000384000","Jan  8, 2024 13:40:49.505399000 JST","","6000  >  58134 [FIN, ACK] Seq=1 Ack=29 Win=65152 Len=0 TSval=699660137 TSecr=310116375"
"94","35.834496","192.168.11.34","192.168.11.35","TCP","66","0.000070000","0.000070000","Jan  8, 2024 13:40:49.505469000 JST","","58134  >  6000 [ACK] Seq=29 Ack=2 Win=64256 Len=0 TSval=310116397 TSecr=699660137"
"95","35.869065","192.168.11.34","255.255.255.255","UDP","209","","0.034569000","Jan  8, 2024 13:40:49.540038000 JST","7b2273656d616e74696373223a207b22656e74697479223a2022504944222c202262617365656e74697479223a2022616e79222c2022726f6c65223a2022313131222c20227370617469616c223a2022616e79222c202274656d706f72616c223a2022616e79227d2c20226461746170726f7065727479223a207b22666f726d6174223a2022696e616f6b615f70726f6772616d5f73616d706c655f73656d616e746963227d7d","38756  >  7000 Len=167"
"96","35.876542","192.168.11.6","192.168.11.34","TCP","74","","0.007477000","Jan  8, 2024 13:40:49.547515000 JST","","56664  >  6000 [SYN] Seq=0 Win=64240 Len=0 MSS=1460 SACK_PERM TSval=1078077410 TSecr=0 WS=128"
"97","35.876703","192.168.11.34","192.168.11.6","TCP","74","0.000161000","0.000161000","Jan  8, 2024 13:40:49.547676000 JST","","6000  >  56664 [SYN, ACK] Seq=0 Ack=1 Win=65160 Len=0 MSS=1460 SACK_PERM TSval=3693159846 TSecr=1078077410 WS=128"
"98","35.891113","192.168.11.6","192.168.11.34","TCP","66","0.014410000","0.014410000","Jan  8, 2024 13:40:49.562086000 JST","","56664  >  6000 [ACK] Seq=1 Ack=1 Win=64256 Len=0 TSval=1078077417 TSecr=3693159846"
"99","35.892028","192.168.11.6","192.168.11.34","TCP","93","","0.000915000","Jan  8, 2024 13:40:49.563001000 JST","","56664  >  6000 [PSH, ACK] Seq=1 Ack=1 Win=64256 Len=27 TSval=1078077417 TSecr=3693159846 [TCP segment of a reassembled PDU]"
"100","35.892175","192.168.11.34","192.168.11.6","TCP","66","0.000147000","0.000147000","Jan  8, 2024 13:40:49.563148000 JST","","6000  >  56664 [ACK] Seq=1 Ack=28 Win=65152 Len=0 TSval=3693159861 TSecr=1078077417"
"101","35.892298","192.168.11.6","192.168.11.34","TCP","66","","0.000123000","Jan  8, 2024 13:40:49.563271000 JST","","56664  >  6000 [FIN, ACK] Seq=28 Ack=1 Win=64256 Len=0 TSval=1078077417 TSecr=3693159846"
"102","35.893895","192.168.11.34","192.168.11.6","TCP","66","0.001597000","0.001597000","Jan  8, 2024 13:40:49.564868000 JST","","6000  >  56664 [FIN, ACK] Seq=1 Ack=29 Win=65152 Len=0 TSval=3693159863 TSecr=1078077417"
"103","35.900410","192.168.11.6","192.168.11.34","TCP","66","","0.006515000","Jan  8, 2024 13:40:49.571383000 JST","","[TCP Retransmission] 56664  >  6000 [FIN, ACK] Seq=28 Ack=1 Win=64256 Len=0 TSval=1078077434 TSecr=3693159846"
"104","35.900491","192.168.11.34","192.168.11.6","TCP","78","0.000081000","0.000081000","Jan  8, 2024 13:40:49.571464000 JST","","[TCP Dup ACK 102#1] 6000  >  56664 [ACK] Seq=2 Ack=29 Win=65152 Len=0 TSval=3693159870 TSecr=1078077434 SLE=28 SRE=29"
"105","35.900735","192.168.11.6","192.168.11.34","TCP","66","0.006840000","0.000244000","Jan  8, 2024 13:40:49.571708000 JST","","56664  >  6000 [ACK] Seq=29 Ack=2 Win=64256 Len=0 TSval=1078077434 TSecr=3693159863"
"106","42.563191","192.168.11.34","192.168.11.35","TCP","74","","6.662456000","Jan  8, 2024 13:40:56.234164000 JST","","58150  >  6000 [SYN] Seq=0 Win=64240 Len=0 MSS=1460 SACK_PERM TSval=310123125 TSecr=0 WS=128"
"107","42.571834","192.168.11.35","192.168.11.34","TCP","74","0.008643000","0.008643000","Jan  8, 2024 13:40:56.242807000 JST","","6000  >  58150 [SYN, ACK] Seq=0 Ack=1 Win=65160 Len=0 MSS=1460 SACK_PERM TSval=699666877 TSecr=310123125 WS=128"
"108","42.571936","192.168.11.34","192.168.11.35","TCP","66","0.000102000","0.000102000","Jan  8, 2024 13:40:56.242909000 JST","","58150  >  6000 [ACK] Seq=1 Ack=1 Win=64256 Len=0 TSval=310123134 TSecr=699666877"
"109","42.572071","192.168.11.34","192.168.11.35","TCP","93","","0.000135000","Jan  8, 2024 13:40:56.243044000 JST","","58150  >  6000 [PSH, ACK] Seq=1 Ack=1 Win=64256 Len=27 TSval=310123134 TSecr=699666877 [TCP segment of a reassembled PDU]"
"110","42.572188","192.168.11.34","192.168.11.35","TCP","66","","0.000117000","Jan  8, 2024 13:40:56.243161000 JST","","58150  >  6000 [FIN, ACK] Seq=28 Ack=1 Win=64256 Len=0 TSval=310123134 TSecr=699666877"
"111","42.580004","192.168.11.35","192.168.11.34","TCP","66","0.007933000","0.007816000","Jan  8, 2024 13:40:56.250977000 JST","","6000  >  58150 [ACK] Seq=1 Ack=28 Win=65152 Len=0 TSval=699666886 TSecr=310123134"
"112","42.580215","192.168.11.35","192.168.11.34","TCP","66","0.008027000","0.000211000","Jan  8, 2024 13:40:56.251188000 JST","","6000  >  58150 [FIN, ACK] Seq=1 Ack=29 Win=65152 Len=0 TSval=699666888 TSecr=310123134"
"113","42.580262","192.168.11.34","192.168.11.35","TCP","66","0.000047000","0.000047000","Jan  8, 2024 13:40:56.251235000 JST","","58150  >  6000 [ACK] Seq=29 Ack=2 Win=64256 Len=0 TSval=310123142 TSecr=699666888"
"114","42.612021","192.168.11.34","255.255.255.255","UDP","209","","0.031759000","Jan  8, 2024 13:40:56.282994000 JST","7b2273656d616e74696373223a207b22656e74697479223a2022504944222c202262617365656e74697479223a2022616e79222c2022726f6c65223a2022313131222c20227370617469616c223a2022616e79222c202274656d706f72616c223a2022616e79227d2c20226461746170726f7065727479223a207b22666f726d6174223a2022696e616f6b615f70726f6772616d5f73616d706c655f73656d616e746963227d7d","50262  >  7000 Len=167"
"115","42.621452","192.168.11.6","192.168.11.34","TCP","74","","0.009431000","Jan  8, 2024 13:40:56.292425000 JST","","47144  >  6000 [SYN] Seq=0 Win=64240 Len=0 MSS=1460 SACK_PERM TSval=1078084153 TSecr=0 WS=128"
"116","42.621600","192.168.11.34","192.168.11.6","TCP","74","0.000148000","0.000148000","Jan  8, 2024 13:40:56.292573000 JST","","6000  >  47144 [SYN, ACK] Seq=0 Ack=1 Win=65160 Len=0 MSS=1460 SACK_PERM TSval=3693166591 TSecr=1078084153 WS=128"
"117","42.631769","192.168.11.6","192.168.11.34","TCP","66","0.010169000","0.010169000","Jan  8, 2024 13:40:56.302742000 JST","","47144  >  6000 [ACK] Seq=1 Ack=1 Win=64256 Len=0 TSval=1078084165 TSecr=3693166591"
"118","42.632800","192.168.11.6","192.168.11.34","TCP","93","","0.001031000","Jan  8, 2024 13:40:56.303773000 JST","","47144  >  6000 [PSH, ACK] Seq=1 Ack=1 Win=64256 Len=27 TSval=1078084165 TSecr=3693166591 [TCP segment of a reassembled PDU]"
"119","42.633014","192.168.11.34","192.168.11.6","TCP","66","0.000214000","0.000214000","Jan  8, 2024 13:40:56.303987000 JST","","6000  >  47144 [ACK] Seq=1 Ack=28 Win=65152 Len=0 TSval=3693166602 TSecr=1078084165"
"120","42.633194","192.168.11.6","192.168.11.34","TCP","66","","0.000180000","Jan  8, 2024 13:40:56.304167000 JST","","47144  >  6000 [FIN, ACK] Seq=28 Ack=1 Win=64256 Len=0 TSval=1078084166 TSecr=3693166591"
"121","42.634998","192.168.11.34","192.168.11.6","TCP","66","0.001804000","0.001804000","Jan  8, 2024 13:40:56.305971000 JST","","6000  >  47144 [FIN, ACK] Seq=1 Ack=29 Win=65152 Len=0 TSval=3693166604 TSecr=1078084166"
"122","42.639560","192.168.11.6","192.168.11.34","TCP","66","0.004562000","0.004562000","Jan  8, 2024 13:40:56.310533000 JST","","47144  >  6000 [ACK] Seq=29 Ack=2 Win=64256 Len=0 TSval=1078084174 TSecr=3693166604"
"123","49.285440","192.168.11.34","192.168.11.35","TCP","74","","6.645880000","Jan  8, 2024 13:41:02.956413000 JST","","41414  >  6000 [SYN] Seq=0 Win=64240 Len=0 MSS=1460 SACK_PERM TSval=310129848 TSecr=0 WS=128"
"124","49.295759","192.168.11.35","192.168.11.34","TCP","74","0.010319000","0.010319000","Jan  8, 2024 13:41:02.966732000 JST","","6000  >  41414 [SYN, ACK] Seq=0 Ack=1 Win=65160 Len=0 MSS=1460 SACK_PERM TSval=699673601 TSecr=310129848 WS=128"
"125","49.295872","192.168.11.34","192.168.11.35","TCP","66","0.000113000","0.000113000","Jan  8, 2024 13:41:02.966845000 JST","","41414  >  6000 [ACK] Seq=1 Ack=1 Win=64256 Len=0 TSval=310129858 TSecr=699673601"
"126","49.296049","192.168.11.34","192.168.11.35","TCP","93","","0.000177000","Jan  8, 2024 13:41:02.967022000 JST","","41414  >  6000 [PSH, ACK] Seq=1 Ack=1 Win=64256 Len=27 TSval=310129858 TSecr=699673601 [TCP segment of a reassembled PDU]"
"127","49.296157","192.168.11.34","192.168.11.35","TCP","66","","0.000108000","Jan  8, 2024 13:41:02.967130000 JST","","41414  >  6000 [FIN, ACK] Seq=28 Ack=1 Win=64256 Len=0 TSval=310129858 TSecr=699673601"
"128","49.304093","192.168.11.35","192.168.11.34","TCP","66","0.008044000","0.007936000","Jan  8, 2024 13:41:02.975066000 JST","","6000  >  41414 [ACK] Seq=1 Ack=28 Win=65152 Len=0 TSval=699673610 TSecr=310129858"
"129","49.304322","192.168.11.35","192.168.11.34","TCP","66","0.008165000","0.000229000","Jan  8, 2024 13:41:02.975295000 JST","","6000  >  41414 [FIN, ACK] Seq=1 Ack=29 Win=65152 Len=0 TSval=699673612 TSecr=310129858"
"130","49.304366","192.168.11.34","192.168.11.35","TCP","66","0.000044000","0.000044000","Jan  8, 2024 13:41:02.975339000 JST","","41414  >  6000 [ACK] Seq=29 Ack=2 Win=64256 Len=0 TSval=310129867 TSecr=699673612"
"131","49.334923","192.168.11.34","255.255.255.255","UDP","209","","0.030557000","Jan  8, 2024 13:41:03.005896000 JST","7b2273656d616e74696373223a207b22656e74697479223a2022504944222c202262617365656e74697479223a2022616e79222c2022726f6c65223a2022313131222c20227370617469616c223a2022616e79222c202274656d706f72616c223a2022616e79227d2c20226461746170726f7065727479223a207b22666f726d6174223a2022696e616f6b615f70726f6772616d5f73616d706c655f73656d616e746963227d7d","47440  >  7000 Len=167"
"132","49.342387","192.168.11.6","192.168.11.34","TCP","74","","0.007464000","Jan  8, 2024 13:41:03.013360000 JST","","58482  >  6000 [SYN] Seq=0 Win=64240 Len=0 MSS=1460 SACK_PERM TSval=1078090876 TSecr=0 WS=128"
"133","49.342529","192.168.11.34","192.168.11.6","TCP","74","0.000142000","0.000142000","Jan  8, 2024 13:41:03.013502000 JST","","6000  >  58482 [SYN, ACK] Seq=0 Ack=1 Win=65160 Len=0 MSS=1460 SACK_PERM TSval=3693173312 TSecr=1078090876 WS=128"
"134","49.349505","192.168.11.6","192.168.11.34","TCP","66","0.006976000","0.006976000","Jan  8, 2024 13:41:03.020478000 JST","","58482  >  6000 [ACK] Seq=1 Ack=1 Win=64256 Len=0 TSval=1078090883 TSecr=3693173312"
"135","49.349986","192.168.11.6","192.168.11.34","TCP","93","","0.000481000","Jan  8, 2024 13:41:03.020959000 JST","","58482  >  6000 [PSH, ACK] Seq=1 Ack=1 Win=64256 Len=27 TSval=1078090883 TSecr=3693173312 [TCP segment of a reassembled PDU]"
"136","49.350094","192.168.11.34","192.168.11.6","TCP","66","0.000108000","0.000108000","Jan  8, 2024 13:41:03.021067000 JST","","6000  >  58482 [ACK] Seq=1 Ack=28 Win=65152 Len=0 TSval=3693173319 TSecr=1078090883"
"137","49.350475","192.168.11.6","192.168.11.34","TCP","66","","0.000381000","Jan  8, 2024 13:41:03.021448000 JST","","58482  >  6000 [FIN, ACK] Seq=28 Ack=1 Win=64256 Len=0 TSval=1078090883 TSecr=3693173312"
"138","49.351809","192.168.11.34","192.168.11.6","TCP","66","0.001334000","0.001334000","Jan  8, 2024 13:41:03.022782000 JST","","6000  >  58482 [FIN, ACK] Seq=1 Ack=29 Win=65152 Len=0 TSval=3693173321 TSecr=1078090883"
"139","49.359174","192.168.11.6","192.168.11.34","TCP","66","0.007365000","0.007365000","Jan  8, 2024 13:41:03.030147000 JST","","58482  >  6000 [ACK] Seq=29 Ack=2 Win=64256 Len=0 TSval=1078090891 TSecr=3693173321"
"140","56.006553","192.168.11.34","192.168.11.35","TCP","74","","6.647379000","Jan  8, 2024 13:41:09.677526000 JST","","51620  >  6000 [SYN] Seq=0 Win=64240 Len=0 MSS=1460 SACK_PERM TSval=310136569 TSecr=0 WS=128"
"141","56.015018","192.168.11.35","192.168.11.34","TCP","74","0.008465000","0.008465000","Jan  8, 2024 13:41:09.685991000 JST","","6000  >  51620 [SYN, ACK] Seq=0 Ack=1 Win=65160 Len=0 MSS=1460 SACK_PERM TSval=699680321 TSecr=310136569 WS=128"
"142","56.015115","192.168.11.34","192.168.11.35","TCP","66","0.000097000","0.000097000","Jan  8, 2024 13:41:09.686088000 JST","","51620  >  6000 [ACK] Seq=1 Ack=1 Win=64256 Len=0 TSval=310136577 TSecr=699680321"
"143","56.015257","192.168.11.34","192.168.11.35","TCP","93","","0.000142000","Jan  8, 2024 13:41:09.686230000 JST","","51620  >  6000 [PSH, ACK] Seq=1 Ack=1 Win=64256 Len=27 TSval=310136577 TSecr=699680321 [TCP segment of a reassembled PDU]"
"144","56.015367","192.168.11.34","192.168.11.35","TCP","66","","0.000110000","Jan  8, 2024 13:41:09.686340000 JST","","51620  >  6000 [FIN, ACK] Seq=28 Ack=1 Win=64256 Len=0 TSval=310136578 TSecr=699680321"
"145","56.023215","192.168.11.35","192.168.11.34","TCP","66","0.007958000","0.007848000","Jan  8, 2024 13:41:09.694188000 JST","","6000  >  51620 [ACK] Seq=1 Ack=28 Win=65152 Len=0 TSval=699680329 TSecr=310136577"
"146","56.023589","192.168.11.35","192.168.11.34","TCP","66","0.008222000","0.000374000","Jan  8, 2024 13:41:09.694562000 JST","","6000  >  51620 [FIN, ACK] Seq=1 Ack=29 Win=65152 Len=0 TSval=699680331 TSecr=310136578"
"147","56.023634","192.168.11.34","192.168.11.35","TCP","66","0.000045000","0.000045000","Jan  8, 2024 13:41:09.694607000 JST","","51620  >  6000 [ACK] Seq=29 Ack=2 Win=64256 Len=0 TSval=310136586 TSecr=699680331"
"148","56.055651","192.168.11.34","255.255.255.255","UDP","209","","0.032017000","Jan  8, 2024 13:41:09.726624000 JST","7b2273656d616e74696373223a207b22656e74697479223a2022504944222c202262617365656e74697479223a2022616e79222c2022726f6c65223a2022313131222c20227370617469616c223a2022616e79222c202274656d706f72616c223a2022616e79227d2c20226461746170726f7065727479223a207b22666f726d6174223a2022696e616f6b615f70726f6772616d5f73616d706c655f73656d616e746963227d7d","49319  >  7000 Len=167"
"149","56.063292","192.168.11.6","192.168.11.34","TCP","74","","0.007641000","Jan  8, 2024 13:41:09.734265000 JST","","58488  >  6000 [SYN] Seq=0 Win=64240 Len=0 MSS=1460 SACK_PERM TSval=1078097596 TSecr=0 WS=128"
"150","56.063437","192.168.11.34","192.168.11.6","TCP","74","0.000145000","0.000145000","Jan  8, 2024 13:41:09.734410000 JST","","6000  >  58488 [SYN, ACK] Seq=0 Ack=1 Win=65160 Len=0 MSS=1460 SACK_PERM TSval=3693180033 TSecr=1078097596 WS=128"
"151","56.070578","192.168.11.6","192.168.11.34","TCP","66","0.007141000","0.007141000","Jan  8, 2024 13:41:09.741551000 JST","","58488  >  6000 [ACK] Seq=1 Ack=1 Win=64256 Len=0 TSval=1078097603 TSecr=3693180033"
"152","56.073028","192.168.11.6","192.168.11.34","TCP","93","","0.002450000","Jan  8, 2024 13:41:09.744001000 JST","","58488  >  6000 [PSH, ACK] Seq=1 Ack=1 Win=64256 Len=27 TSval=1078097604 TSecr=3693180033 [TCP segment of a reassembled PDU]"
"153","56.073230","192.168.11.34","192.168.11.6","TCP","66","0.000202000","0.000202000","Jan  8, 2024 13:41:09.744203000 JST","","6000  >  58488 [ACK] Seq=1 Ack=28 Win=65152 Len=0 TSval=3693180042 TSecr=1078097604"
"154","56.073700","192.168.11.6","192.168.11.34","TCP","66","","0.000470000","Jan  8, 2024 13:41:09.744673000 JST","","58488  >  6000 [FIN, ACK] Seq=28 Ack=1 Win=64256 Len=0 TSval=1078097604 TSecr=3693180033"
"155","56.075308","192.168.11.34","192.168.11.6","TCP","66","0.001608000","0.001608000","Jan  8, 2024 13:41:09.746281000 JST","","6000  >  58488 [FIN, ACK] Seq=1 Ack=29 Win=65152 Len=0 TSval=3693180044 TSecr=1078097604"
"156","56.079931","192.168.11.6","192.168.11.34","TCP","66","0.004623000","0.004623000","Jan  8, 2024 13:41:09.750904000 JST","","58488  >  6000 [ACK] Seq=29 Ack=2 Win=64256 Len=0 TSval=1078097614 TSecr=3693180044"
"157","62.655240","192.168.11.34","192.168.11.35","TCP","74","","6.575309000","Jan  8, 2024 13:41:16.326213000 JST","","51626  >  6000 [SYN] Seq=0 Win=64240 Len=0 MSS=1460 SACK_PERM TSval=310143217 TSecr=0 WS=128"
"158","62.663883","192.168.11.35","192.168.11.34","TCP","74","0.008643000","0.008643000","Jan  8, 2024 13:41:16.334856000 JST","","6000  >  51626 [SYN, ACK] Seq=0 Ack=1 Win=65160 Len=0 MSS=1460 SACK_PERM TSval=699686969 TSecr=310143217 WS=128"
"159","62.663993","192.168.11.34","192.168.11.35","TCP","66","0.000110000","0.000110000","Jan  8, 2024 13:41:16.334966000 JST","","51626  >  6000 [ACK] Seq=1 Ack=1 Win=64256 Len=0 TSval=310143226 TSecr=699686969"
"160","62.664126","192.168.11.34","192.168.11.35","TCP","93","","0.000133000","Jan  8, 2024 13:41:16.335099000 JST","","51626  >  6000 [PSH, ACK] Seq=1 Ack=1 Win=64256 Len=27 TSval=310143226 TSecr=699686969 [TCP segment of a reassembled PDU]"
"161","62.664242","192.168.11.34","192.168.11.35","TCP","66","","0.000116000","Jan  8, 2024 13:41:16.335215000 JST","","51626  >  6000 [FIN, ACK] Seq=28 Ack=1 Win=64256 Len=0 TSval=310143226 TSecr=699686969"
"162","62.672097","192.168.11.35","192.168.11.34","TCP","66","0.007971000","0.007855000","Jan  8, 2024 13:41:16.343070000 JST","","6000  >  51626 [ACK] Seq=1 Ack=28 Win=65152 Len=0 TSval=699686978 TSecr=310143226"
"163","62.672461","192.168.11.35","192.168.11.34","TCP","66","0.008219000","0.000364000","Jan  8, 2024 13:41:16.343434000 JST","","6000  >  51626 [FIN, ACK] Seq=1 Ack=29 Win=65152 Len=0 TSval=699686979 TSecr=310143226"
"164","62.672507","192.168.11.34","192.168.11.35","TCP","66","0.000046000","0.000046000","Jan  8, 2024 13:41:16.343480000 JST","","51626  >  6000 [ACK] Seq=29 Ack=2 Win=64256 Len=0 TSval=310143235 TSecr=699686979"
"165","62.702638","192.168.11.34","255.255.255.255","UDP","209","","0.030131000","Jan  8, 2024 13:41:16.373611000 JST","7b2273656d616e74696373223a207b22656e74697479223a2022504944222c202262617365656e74697479223a2022616e79222c2022726f6c65223a2022313131222c20227370617469616c223a2022616e79222c202274656d706f72616c223a2022616e79227d2c20226461746170726f7065727479223a207b22666f726d6174223a2022696e616f6b615f70726f6772616d5f73616d706c655f73656d616e746963227d7d","34698  >  7000 Len=167"
"166","62.710081","192.168.11.6","192.168.11.34","TCP","74","","0.007443000","Jan  8, 2024 13:41:16.381054000 JST","","33112  >  6000 [SYN] Seq=0 Win=64240 Len=0 MSS=1460 SACK_PERM TSval=1078104243 TSecr=0 WS=128"
"167","62.710235","192.168.11.34","192.168.11.6","TCP","74","0.000154000","0.000154000","Jan  8, 2024 13:41:16.381208000 JST","","6000  >  33112 [SYN, ACK] Seq=0 Ack=1 Win=65160 Len=0 MSS=1460 SACK_PERM TSval=3693186679 TSecr=1078104243 WS=128"
"168","62.725715","192.168.11.6","192.168.11.34","TCP","66","0.015480000","0.015480000","Jan  8, 2024 13:41:16.396688000 JST","","33112  >  6000 [ACK] Seq=1 Ack=1 Win=64256 Len=0 TSval=1078104250 TSecr=3693186679"
