"No.","Time","Source","Destination","Protocol","Length","The RTT to ACK the segment was","Time delta from previous captured frame","Arrival Time","Data","Info"
"1","0.000000","192.168.11.30","192.168.11.10","TCP","74","","0.000000000","Jan  8, 2024 10:29:12.931623000 JST","","36362  >  6000 [SYN] Seq=0 Win=64240 Len=0 MSS=1460 SACK_PERM TSval=3570416190 TSecr=0 WS=128"
"2","0.007176","192.168.11.10","192.168.11.30","TCP","74","0.007176000","0.007176000","Jan  8, 2024 10:29:12.938799000 JST","","6000  >  36362 [SYN, ACK] Seq=0 Ack=1 Win=65160 Len=0 MSS=1460 SACK_PERM TSval=2277759430 TSecr=3570416190 WS=128"
"3","0.007303","192.168.11.30","192.168.11.10","TCP","66","0.000127000","0.000127000","Jan  8, 2024 10:29:12.938926000 JST","","36362  >  6000 [ACK] Seq=1 Ack=1 Win=64256 Len=0 TSval=3570416197 TSecr=2277759430"
"4","0.007591","192.168.11.30","192.168.11.10","TCP","93","","0.000288000","Jan  8, 2024 10:29:12.939214000 JST","","36362  >  6000 [PSH, ACK] Seq=1 Ack=1 Win=64256 Len=27 TSval=3570416198 TSecr=2277759430 [TCP segment of a reassembled PDU]"
"5","0.007759","192.168.11.30","192.168.11.10","TCP","66","","0.000168000","Jan  8, 2024 10:29:12.939382000 JST","","36362  >  6000 [FIN, ACK] Seq=28 Ack=1 Win=64256 Len=0 TSval=3570416198 TSecr=2277759430"
"6","0.014785","192.168.11.10","192.168.11.30","TCP","66","0.007194000","0.007026000","Jan  8, 2024 10:29:12.946408000 JST","","6000  >  36362 [ACK] Seq=1 Ack=28 Win=65152 Len=0 TSval=2277759438 TSecr=3570416198"
"7","0.015022","192.168.11.10","192.168.11.30","TCP","66","0.007263000","0.000237000","Jan  8, 2024 10:29:12.946645000 JST","","6000  >  36362 [FIN, ACK] Seq=1 Ack=29 Win=65152 Len=0 TSval=2277759440 TSecr=3570416198"
"8","0.015072","192.168.11.30","192.168.11.10","TCP","66","0.000050000","0.000050000","Jan  8, 2024 10:29:12.946695000 JST","","36362  >  6000 [ACK] Seq=29 Ack=2 Win=64256 Len=0 TSval=3570416205 TSecr=2277759440"
"9","0.045807","192.168.11.30","255.255.255.255","UDP","209","","0.030735000","Jan  8, 2024 10:29:12.977430000 JST","7b2273656d616e74696373223a207b22656e74697479223a2022504944222c202262617365656e74697479223a2022616e79222c2022726f6c65223a2022686868222c20227370617469616c223a2022616e79222c202274656d706f72616c223a2022616e79227d2c20226461746170726f7065727479223a207b22666f726d6174223a2022696e616f6b615f70726f6772616d5f73616d706c655f73656d616e746963227d7d","51854  >  7000 Len=167"
"10","0.052848","192.168.11.21","192.168.11.30","TCP","74","","0.007041000","Jan  8, 2024 10:29:12.984471000 JST","","54352  >  6000 [SYN] Seq=0 Win=64240 Len=0 MSS=1460 SACK_PERM TSval=2365389064 TSecr=0 WS=128"
"11","0.053014","192.168.11.30","192.168.11.21","TCP","74","0.000166000","0.000166000","Jan  8, 2024 10:29:12.984637000 JST","","6000  >  54352 [SYN, ACK] Seq=0 Ack=1 Win=65160 Len=0 MSS=1460 SACK_PERM TSval=1525501257 TSecr=2365389064 WS=128"
"12","0.059734","192.168.11.21","192.168.11.30","TCP","66","0.006720000","0.006720000","Jan  8, 2024 10:29:12.991357000 JST","","54352  >  6000 [ACK] Seq=1 Ack=1 Win=64256 Len=0 TSval=2365389072 TSecr=1525501257"
"13","0.060353","192.168.11.21","192.168.11.30","TCP","93","","0.000619000","Jan  8, 2024 10:29:12.991976000 JST","","54352  >  6000 [PSH, ACK] Seq=1 Ack=1 Win=64256 Len=27 TSval=2365389072 TSecr=1525501257 [TCP segment of a reassembled PDU]"
"14","0.060455","192.168.11.30","192.168.11.21","TCP","66","0.000102000","0.000102000","Jan  8, 2024 10:29:12.992078000 JST","","6000  >  54352 [ACK] Seq=1 Ack=28 Win=65152 Len=0 TSval=1525501265 TSecr=2365389072"
"15","0.060534","192.168.11.21","192.168.11.30","TCP","66","","0.000079000","Jan  8, 2024 10:29:12.992157000 JST","","54352  >  6000 [FIN, ACK] Seq=28 Ack=1 Win=64256 Len=0 TSval=2365389072 TSecr=1525501257"
"16","0.061913","192.168.11.30","192.168.11.21","TCP","66","0.001379000","0.001379000","Jan  8, 2024 10:29:12.993536000 JST","","6000  >  54352 [FIN, ACK] Seq=1 Ack=29 Win=65152 Len=0 TSval=1525501266 TSecr=2365389072"
"17","0.067809","192.168.11.21","192.168.11.30","TCP","66","0.005896000","0.005896000","Jan  8, 2024 10:29:12.999432000 JST","","54352  >  6000 [ACK] Seq=29 Ack=2 Win=64256 Len=0 TSval=2365389080 TSecr=1525501266"
"18","6.175442","192.168.11.30","192.168.11.10","TCP","74","","6.107633000","Jan  8, 2024 10:29:19.107065000 JST","","36368  >  6000 [SYN] Seq=0 Win=64240 Len=0 MSS=1460 SACK_PERM TSval=3570422366 TSecr=0 WS=128"
"19","6.182047","192.168.11.10","192.168.11.30","TCP","74","0.006605000","0.006605000","Jan  8, 2024 10:29:19.113670000 JST","","6000  >  36368 [SYN, ACK] Seq=0 Ack=1 Win=65160 Len=0 MSS=1460 SACK_PERM TSval=2277765606 TSecr=3570422366 WS=128"
"20","6.182157","192.168.11.30","192.168.11.10","TCP","66","0.000110000","0.000110000","Jan  8, 2024 10:29:19.113780000 JST","","36368  >  6000 [ACK] Seq=1 Ack=1 Win=64256 Len=0 TSval=3570422372 TSecr=2277765606"
"21","6.182363","192.168.11.30","192.168.11.10","TCP","93","","0.000206000","Jan  8, 2024 10:29:19.113986000 JST","","36368  >  6000 [PSH, ACK] Seq=1 Ack=1 Win=64256 Len=27 TSval=3570422373 TSecr=2277765606 [TCP segment of a reassembled PDU]"
"22","6.182502","192.168.11.30","192.168.11.10","TCP","66","","0.000139000","Jan  8, 2024 10:29:19.114125000 JST","","36368  >  6000 [FIN, ACK] Seq=28 Ack=1 Win=64256 Len=0 TSval=3570422373 TSecr=2277765606"
"23","6.189960","192.168.11.10","192.168.11.30","TCP","66","0.007597000","0.007458000","Jan  8, 2024 10:29:19.121583000 JST","","6000  >  36368 [ACK] Seq=1 Ack=28 Win=65152 Len=0 TSval=2277765614 TSecr=3570422373"
"24","6.190351","192.168.11.10","192.168.11.30","TCP","66","0.007849000","0.000391000","Jan  8, 2024 10:29:19.121974000 JST","","6000  >  36368 [FIN, ACK] Seq=1 Ack=29 Win=65152 Len=0 TSval=2277765615 TSecr=3570422373"
"25","6.190403","192.168.11.30","192.168.11.10","TCP","66","0.000052000","0.000052000","Jan  8, 2024 10:29:19.122026000 JST","","36368  >  6000 [ACK] Seq=29 Ack=2 Win=64256 Len=0 TSval=3570422381 TSecr=2277765615"
"26","6.223325","192.168.11.30","255.255.255.255","UDP","209","","0.032922000","Jan  8, 2024 10:29:19.154948000 JST","7b2273656d616e74696373223a207b22656e74697479223a2022504944222c202262617365656e74697479223a2022616e79222c2022726f6c65223a2022686868222c20227370617469616c223a2022616e79222c202274656d706f72616c223a2022616e79227d2c20226461746170726f7065727479223a207b22666f726d6174223a2022696e616f6b615f70726f6772616d5f73616d706c655f73656d616e746963227d7d","35074  >  7000 Len=167"
"27","6.229205","192.168.11.21","192.168.11.30","TCP","74","","0.005880000","Jan  8, 2024 10:29:19.160828000 JST","","45204  >  6000 [SYN] Seq=0 Win=64240 Len=0 MSS=1460 SACK_PERM TSval=2365395241 TSecr=0 WS=128"
"28","6.229351","192.168.11.30","192.168.11.21","TCP","74","0.000146000","0.000146000","Jan  8, 2024 10:29:19.160974000 JST","","6000  >  45204 [SYN, ACK] Seq=0 Ack=1 Win=65160 Len=0 MSS=1460 SACK_PERM TSval=1525507434 TSecr=2365395241 WS=128"
"29","6.237071","192.168.11.21","192.168.11.30","TCP","66","0.007720000","0.007720000","Jan  8, 2024 10:29:19.168694000 JST","","45204  >  6000 [ACK] Seq=1 Ack=1 Win=64256 Len=0 TSval=2365395248 TSecr=1525507434"
"30","6.237712","192.168.11.21","192.168.11.30","TCP","93","","0.000641000","Jan  8, 2024 10:29:19.169335000 JST","","45204  >  6000 [PSH, ACK] Seq=1 Ack=1 Win=64256 Len=27 TSval=2365395248 TSecr=1525507434 [TCP segment of a reassembled PDU]"
"31","6.237838","192.168.11.30","192.168.11.21","TCP","66","0.000126000","0.000126000","Jan  8, 2024 10:29:19.169461000 JST","","6000  >  45204 [ACK] Seq=1 Ack=28 Win=65152 Len=0 TSval=1525507442 TSecr=2365395248"
"32","6.237925","192.168.11.21","192.168.11.30","TCP","66","","0.000087000","Jan  8, 2024 10:29:19.169548000 JST","","45204  >  6000 [FIN, ACK] Seq=28 Ack=1 Win=64256 Len=0 TSval=2365395248 TSecr=1525507434"
"33","6.239276","192.168.11.30","192.168.11.21","TCP","66","0.001351000","0.001351000","Jan  8, 2024 10:29:19.170899000 JST","","6000  >  45204 [FIN, ACK] Seq=1 Ack=29 Win=65152 Len=0 TSval=1525507443 TSecr=2365395248"
"34","6.245366","192.168.11.21","192.168.11.30","TCP","66","0.006090000","0.006090000","Jan  8, 2024 10:29:19.176989000 JST","","45204  >  6000 [ACK] Seq=29 Ack=2 Win=64256 Len=0 TSval=2365395257 TSecr=1525507443"
"35","12.273190","192.168.11.30","192.168.11.10","TCP","74","","6.027824000","Jan  8, 2024 10:29:25.204813000 JST","","39484  >  6000 [SYN] Seq=0 Win=64240 Len=0 MSS=1460 SACK_PERM TSval=3570428463 TSecr=0 WS=128"
"36","12.279892","192.168.11.10","192.168.11.30","TCP","74","0.006702000","0.006702000","Jan  8, 2024 10:29:25.211515000 JST","","6000  >  39484 [SYN, ACK] Seq=0 Ack=1 Win=65160 Len=0 MSS=1460 SACK_PERM TSval=2277771704 TSecr=3570428463 WS=128"
"37","12.280000","192.168.11.30","192.168.11.10","TCP","66","0.000108000","0.000108000","Jan  8, 2024 10:29:25.211623000 JST","","39484  >  6000 [ACK] Seq=1 Ack=1 Win=64256 Len=0 TSval=3570428470 TSecr=2277771704"
"38","12.280173","192.168.11.30","192.168.11.10","TCP","93","","0.000173000","Jan  8, 2024 10:29:25.211796000 JST","","39484  >  6000 [PSH, ACK] Seq=1 Ack=1 Win=64256 Len=27 TSval=3570428470 TSecr=2277771704 [TCP segment of a reassembled PDU]"
"39","12.280342","192.168.11.30","192.168.11.10","TCP","66","","0.000169000","Jan  8, 2024 10:29:25.211965000 JST","","39484  >  6000 [FIN, ACK] Seq=28 Ack=1 Win=64256 Len=0 TSval=3570428471 TSecr=2277771704"
"40","12.287746","192.168.11.10","192.168.11.30","TCP","66","0.007573000","0.007404000","Jan  8, 2024 10:29:25.219369000 JST","","6000  >  39484 [ACK] Seq=1 Ack=28 Win=65152 Len=0 TSval=2277771711 TSecr=3570428470"
"41","12.288117","192.168.11.10","192.168.11.30","TCP","66","0.007775000","0.000371000","Jan  8, 2024 10:29:25.219740000 JST","","6000  >  39484 [FIN, ACK] Seq=1 Ack=29 Win=65152 Len=0 TSval=2277771713 TSecr=3570428471"
"42","12.288170","192.168.11.30","192.168.11.10","TCP","66","0.000053000","0.000053000","Jan  8, 2024 10:29:25.219793000 JST","","39484  >  6000 [ACK] Seq=29 Ack=2 Win=64256 Len=0 TSval=3570428478 TSecr=2277771713"
"43","12.318421","192.168.11.30","255.255.255.255","UDP","209","","0.030251000","Jan  8, 2024 10:29:25.250044000 JST","7b2273656d616e74696373223a207b22656e74697479223a2022504944222c202262617365656e74697479223a2022616e79222c2022726f6c65223a2022686868222c20227370617469616c223a2022616e79222c202274656d706f72616c223a2022616e79227d2c20226461746170726f7065727479223a207b22666f726d6174223a2022696e616f6b615f70726f6772616d5f73616d706c655f73656d616e746963227d7d","38181  >  7000 Len=167"
"44","12.324243","192.168.11.21","192.168.11.30","TCP","74","","0.005822000","Jan  8, 2024 10:29:25.255866000 JST","","45216  >  6000 [SYN] Seq=0 Win=64240 Len=0 MSS=1460 SACK_PERM TSval=2365401336 TSecr=0 WS=128"
"45","12.324422","192.168.11.30","192.168.11.21","TCP","74","0.000179000","0.000179000","Jan  8, 2024 10:29:25.256045000 JST","","6000  >  45216 [SYN, ACK] Seq=0 Ack=1 Win=65160 Len=0 MSS=1460 SACK_PERM TSval=1525513529 TSecr=2365401336 WS=128"
"46","12.331663","192.168.11.21","192.168.11.30","TCP","66","0.007241000","0.007241000","Jan  8, 2024 10:29:25.263286000 JST","","45216  >  6000 [ACK] Seq=1 Ack=1 Win=64256 Len=0 TSval=2365401344 TSecr=1525513529"
"47","12.332577","192.168.11.21","192.168.11.30","TCP","93","","0.000914000","Jan  8, 2024 10:29:25.264200000 JST","","45216  >  6000 [PSH, ACK] Seq=1 Ack=1 Win=64256 Len=27 TSval=2365401344 TSecr=1525513529 [TCP segment of a reassembled PDU]"
"48","12.332705","192.168.11.30","192.168.11.21","TCP","66","0.000128000","0.000128000","Jan  8, 2024 10:29:25.264328000 JST","","6000  >  45216 [ACK] Seq=1 Ack=28 Win=65152 Len=0 TSval=1525513537 TSecr=2365401344"
"49","12.332794","192.168.11.21","192.168.11.30","TCP","66","","0.000089000","Jan  8, 2024 10:29:25.264417000 JST","","45216  >  6000 [FIN, ACK] Seq=28 Ack=1 Win=64256 Len=0 TSval=2365401344 TSecr=1525513529"
"50","12.334098","192.168.11.30","192.168.11.21","TCP","66","0.001304000","0.001304000","Jan  8, 2024 10:29:25.265721000 JST","","6000  >  45216 [FIN, ACK] Seq=1 Ack=29 Win=65152 Len=0 TSval=1525513538 TSecr=2365401344"
"51","12.341118","192.168.11.21","192.168.11.30","TCP","66","0.007020000","0.007020000","Jan  8, 2024 10:29:25.272741000 JST","","45216  >  6000 [ACK] Seq=29 Ack=2 Win=64256 Len=0 TSval=2365401352 TSecr=1525513538"
"52","18.382454","192.168.11.30","192.168.11.10","TCP","74","","6.041336000","Jan  8, 2024 10:29:31.314077000 JST","","39486  >  6000 [SYN] Seq=0 Win=64240 Len=0 MSS=1460 SACK_PERM TSval=3570434573 TSecr=0 WS=128"
"53","18.389148","192.168.11.10","192.168.11.30","TCP","74","0.006694000","0.006694000","Jan  8, 2024 10:29:31.320771000 JST","","6000  >  39486 [SYN, ACK] Seq=0 Ack=1 Win=65160 Len=0 MSS=1460 SACK_PERM TSval=2277777813 TSecr=3570434573 WS=128"
"54","18.389255","192.168.11.30","192.168.11.10","TCP","66","0.000107000","0.000107000","Jan  8, 2024 10:29:31.320878000 JST","","39486  >  6000 [ACK] Seq=1 Ack=1 Win=64256 Len=0 TSval=3570434579 TSecr=2277777813"
"55","18.389438","192.168.11.30","192.168.11.10","TCP","93","","0.000183000","Jan  8, 2024 10:29:31.321061000 JST","","39486  >  6000 [PSH, ACK] Seq=1 Ack=1 Win=64256 Len=27 TSval=3570434580 TSecr=2277777813 [TCP segment of a reassembled PDU]"
"56","18.389544","192.168.11.30","192.168.11.10","TCP","66","","0.000106000","Jan  8, 2024 10:29:31.321167000 JST","","39486  >  6000 [FIN, ACK] Seq=28 Ack=1 Win=64256 Len=0 TSval=3570434580 TSecr=2277777813"
"57","18.396755","192.168.11.10","192.168.11.30","TCP","66","0.007317000","0.007211000","Jan  8, 2024 10:29:31.328378000 JST","","6000  >  39486 [ACK] Seq=1 Ack=28 Win=65152 Len=0 TSval=2277777820 TSecr=3570434580"
"58","18.397130","192.168.11.10","192.168.11.30","TCP","66","0.007586000","0.000375000","Jan  8, 2024 10:29:31.328753000 JST","","6000  >  39486 [FIN, ACK] Seq=1 Ack=29 Win=65152 Len=0 TSval=2277777822 TSecr=3570434580"
"59","18.397180","192.168.11.30","192.168.11.10","TCP","66","0.000050000","0.000050000","Jan  8, 2024 10:29:31.328803000 JST","","39486  >  6000 [ACK] Seq=29 Ack=2 Win=64256 Len=0 TSval=3570434587 TSecr=2277777822"
"60","18.426742","192.168.11.30","255.255.255.255","UDP","209","","0.029562000","Jan  8, 2024 10:29:31.358365000 JST","7b2273656d616e74696373223a207b22656e74697479223a2022504944222c202262617365656e74697479223a2022616e79222c2022726f6c65223a2022686868222c20227370617469616c223a2022616e79222c202274656d706f72616c223a2022616e79227d2c20226461746170726f7065727479223a207b22666f726d6174223a2022696e616f6b615f70726f6772616d5f73616d706c655f73656d616e746963227d7d","59055  >  7000 Len=167"
"61","18.432572","192.168.11.21","192.168.11.30","TCP","74","","0.005830000","Jan  8, 2024 10:29:31.364195000 JST","","52628  >  6000 [SYN] Seq=0 Win=64240 Len=0 MSS=1460 SACK_PERM TSval=2365407444 TSecr=0 WS=128"
"62","18.432713","192.168.11.30","192.168.11.21","TCP","74","0.000141000","0.000141000","Jan  8, 2024 10:29:31.364336000 JST","","6000  >  52628 [SYN, ACK] Seq=0 Ack=1 Win=65160 Len=0 MSS=1460 SACK_PERM TSval=1525519637 TSecr=2365407444 WS=128"
"63","18.439810","192.168.11.21","192.168.11.30","TCP","66","0.007097000","0.007097000","Jan  8, 2024 10:29:31.371433000 JST","","52628  >  6000 [ACK] Seq=1 Ack=1 Win=64256 Len=0 TSval=2365407451 TSecr=1525519637"
"64","18.440602","192.168.11.21","192.168.11.30","TCP","93","","0.000792000","Jan  8, 2024 10:29:31.372225000 JST","","52628  >  6000 [PSH, ACK] Seq=1 Ack=1 Win=64256 Len=27 TSval=2365407451 TSecr=1525519637 [TCP segment of a reassembled PDU]"
"65","18.440730","192.168.11.30","192.168.11.21","TCP","66","0.000128000","0.000128000","Jan  8, 2024 10:29:31.372353000 JST","","6000  >  52628 [ACK] Seq=1 Ack=28 Win=65152 Len=0 TSval=1525519645 TSecr=2365407451"
"66","18.441029","192.168.11.21","192.168.11.30","TCP","66","","0.000299000","Jan  8, 2024 10:29:31.372652000 JST","","52628  >  6000 [FIN, ACK] Seq=28 Ack=1 Win=64256 Len=0 TSval=2365407452 TSecr=1525519637"
"67","18.442370","192.168.11.30","192.168.11.21","TCP","66","0.001341000","0.001341000","Jan  8, 2024 10:29:31.373993000 JST","","6000  >  52628 [FIN, ACK] Seq=1 Ack=29 Win=65152 Len=0 TSval=1525519647 TSecr=2365407452"
"68","18.450309","192.168.11.21","192.168.11.30","TCP","66","0.007939000","0.007939000","Jan  8, 2024 10:29:31.381932000 JST","","52628  >  6000 [ACK] Seq=29 Ack=2 Win=64256 Len=0 TSval=2365407461 TSecr=1525519647"
"69","25.508584","192.168.11.30","192.168.11.10","TCP","74","","7.058275000","Jan  8, 2024 10:29:38.440207000 JST","","41936  >  6000 [SYN] Seq=0 Win=64240 Len=0 MSS=1460 SACK_PERM TSval=3570441699 TSecr=0 WS=128"
"70","25.516220","192.168.11.10","192.168.11.30","TCP","74","0.007636000","0.007636000","Jan  8, 2024 10:29:38.447843000 JST","","6000  >  41936 [SYN, ACK] Seq=0 Ack=1 Win=65160 Len=0 MSS=1460 SACK_PERM TSval=2277784939 TSecr=3570441699 WS=128"
"71","25.516355","192.168.11.30","192.168.11.10","TCP","66","0.000135000","0.000135000","Jan  8, 2024 10:29:38.447978000 JST","","41936  >  6000 [ACK] Seq=1 Ack=1 Win=64256 Len=0 TSval=3570441707 TSecr=2277784939"
"72","25.516614","192.168.11.30","192.168.11.10","TCP","93","","0.000259000","Jan  8, 2024 10:29:38.448237000 JST","","41936  >  6000 [PSH, ACK] Seq=1 Ack=1 Win=64256 Len=27 TSval=3570441707 TSecr=2277784939 [TCP segment of a reassembled PDU]"
"73","25.516749","192.168.11.30","192.168.11.10","TCP","66","","0.000135000","Jan  8, 2024 10:29:38.448372000 JST","","41936  >  6000 [FIN, ACK] Seq=28 Ack=1 Win=64256 Len=0 TSval=3570441707 TSecr=2277784939"
"74","25.524189","192.168.11.10","192.168.11.30","TCP","66","0.007575000","0.007440000","Jan  8, 2024 10:29:38.455812000 JST","","6000  >  41936 [ACK] Seq=1 Ack=28 Win=65152 Len=0 TSval=2277784948 TSecr=3570441707"
"75","25.524598","192.168.11.10","192.168.11.30","TCP","66","0.007849000","0.000409000","Jan  8, 2024 10:29:38.456221000 JST","","6000  >  41936 [FIN, ACK] Seq=1 Ack=29 Win=65152 Len=0 TSval=2277784949 TSecr=3570441707"
"76","25.524668","192.168.11.30","192.168.11.10","TCP","66","0.000070000","0.000070000","Jan  8, 2024 10:29:38.456291000 JST","","41936  >  6000 [ACK] Seq=29 Ack=2 Win=64256 Len=0 TSval=3570441715 TSecr=2277784949"
"77","25.554663","192.168.11.30","255.255.255.255","UDP","209","","0.029995000","Jan  8, 2024 10:29:38.486286000 JST","7b2273656d616e74696373223a207b22656e74697479223a2022504944222c202262617365656e74697479223a2022616e79222c2022726f6c65223a2022686868222c20227370617469616c223a2022616e79222c202274656d706f72616c223a2022616e79227d2c20226461746170726f7065727479223a207b22666f726d6174223a2022696e616f6b615f70726f6772616d5f73616d706c655f73656d616e746963227d7d","37521  >  7000 Len=167"
"78","25.561336","192.168.11.21","192.168.11.30","TCP","74","","0.006673000","Jan  8, 2024 10:29:38.492959000 JST","","43424  >  6000 [SYN] Seq=0 Win=64240 Len=0 MSS=1460 SACK_PERM TSval=2365414572 TSecr=0 WS=128"
"79","25.561472","192.168.11.30","192.168.11.21","TCP","74","0.000136000","0.000136000","Jan  8, 2024 10:29:38.493095000 JST","","6000  >  43424 [SYN, ACK] Seq=0 Ack=1 Win=65160 Len=0 MSS=1460 SACK_PERM TSval=1525526766 TSecr=2365414572 WS=128"
"80","25.569219","192.168.11.21","192.168.11.30","TCP","66","0.007747000","0.007747000","Jan  8, 2024 10:29:38.500842000 JST","","43424  >  6000 [ACK] Seq=1 Ack=1 Win=64256 Len=0 TSval=2365414581 TSecr=1525526766"
"81","25.569879","192.168.11.21","192.168.11.30","TCP","93","","0.000660000","Jan  8, 2024 10:29:38.501502000 JST","","43424  >  6000 [PSH, ACK] Seq=1 Ack=1 Win=64256 Len=27 TSval=2365414581 TSecr=1525526766 [TCP segment of a reassembled PDU]"
"82","25.569985","192.168.11.30","192.168.11.21","TCP","66","0.000106000","0.000106000","Jan  8, 2024 10:29:38.501608000 JST","","6000  >  43424 [ACK] Seq=1 Ack=28 Win=65152 Len=0 TSval=1525526774 TSecr=2365414581"
"83","25.570096","192.168.11.21","192.168.11.30","TCP","66","","0.000111000","Jan  8, 2024 10:29:38.501719000 JST","","43424  >  6000 [FIN, ACK] Seq=28 Ack=1 Win=64256 Len=0 TSval=2365414581 TSecr=1525526766"
"84","25.571526","192.168.11.30","192.168.11.21","TCP","66","0.001430000","0.001430000","Jan  8, 2024 10:29:38.503149000 JST","","6000  >  43424 [FIN, ACK] Seq=1 Ack=29 Win=65152 Len=0 TSval=1525526776 TSecr=2365414581"
"85","25.578152","192.168.11.21","192.168.11.30","TCP","66","0.006626000","0.006626000","Jan  8, 2024 10:29:38.509775000 JST","","43424  >  6000 [ACK] Seq=29 Ack=2 Win=64256 Len=0 TSval=2365414589 TSecr=1525526776"
"86","31.602349","192.168.11.30","192.168.11.10","TCP","74","","6.024197000","Jan  8, 2024 10:29:44.533972000 JST","","54492  >  6000 [SYN] Seq=0 Win=64240 Len=0 MSS=1460 SACK_PERM TSval=3570447793 TSecr=0 WS=128"
"87","31.608939","192.168.11.10","192.168.11.30","TCP","74","0.006590000","0.006590000","Jan  8, 2024 10:29:44.540562000 JST","","6000  >  54492 [SYN, ACK] Seq=0 Ack=1 Win=65160 Len=0 MSS=1460 SACK_PERM TSval=2277791033 TSecr=3570447793 WS=128"
"88","31.609057","192.168.11.30","192.168.11.10","TCP","66","0.000118000","0.000118000","Jan  8, 2024 10:29:44.540680000 JST","","54492  >  6000 [ACK] Seq=1 Ack=1 Win=64256 Len=0 TSval=3570447799 TSecr=2277791033"
"89","31.609250","192.168.11.30","192.168.11.10","TCP","93","","0.000193000","Jan  8, 2024 10:29:44.540873000 JST","","54492  >  6000 [PSH, ACK] Seq=1 Ack=1 Win=64256 Len=27 TSval=3570447799 TSecr=2277791033 [TCP segment of a reassembled PDU]"
"90","31.609359","192.168.11.30","192.168.11.10","TCP","66","","0.000109000","Jan  8, 2024 10:29:44.540982000 JST","","54492  >  6000 [FIN, ACK] Seq=28 Ack=1 Win=64256 Len=0 TSval=3570447800 TSecr=2277791033"
"91","31.616593","192.168.11.10","192.168.11.30","TCP","66","0.007343000","0.007234000","Jan  8, 2024 10:29:44.548216000 JST","","6000  >  54492 [ACK] Seq=1 Ack=28 Win=65152 Len=0 TSval=2277791040 TSecr=3570447799"
"92","31.616821","192.168.11.10","192.168.11.30","TCP","66","0.007462000","0.000228000","Jan  8, 2024 10:29:44.548444000 JST","","6000  >  54492 [FIN, ACK] Seq=1 Ack=29 Win=65152 Len=0 TSval=2277791042 TSecr=3570447800"
"93","31.616878","192.168.11.30","192.168.11.10","TCP","66","0.000057000","0.000057000","Jan  8, 2024 10:29:44.548501000 JST","","54492  >  6000 [ACK] Seq=29 Ack=2 Win=64256 Len=0 TSval=3570447807 TSecr=2277791042"
"94","31.647013","192.168.11.30","255.255.255.255","UDP","209","","0.030135000","Jan  8, 2024 10:29:44.578636000 JST","7b2273656d616e74696373223a207b22656e74697479223a2022504944222c202262617365656e74697479223a2022616e79222c2022726f6c65223a2022686868222c20227370617469616c223a2022616e79222c202274656d706f72616c223a2022616e79227d2c20226461746170726f7065727479223a207b22666f726d6174223a2022696e616f6b615f70726f6772616d5f73616d706c655f73656d616e746963227d7d","34480  >  7000 Len=167"
"95","31.653721","192.168.11.21","192.168.11.30","TCP","74","","0.006708000","Jan  8, 2024 10:29:44.585344000 JST","","43432  >  6000 [SYN] Seq=0 Win=64240 Len=0 MSS=1460 SACK_PERM TSval=2365420665 TSecr=0 WS=128"
"96","31.653873","192.168.11.30","192.168.11.21","TCP","74","0.000152000","0.000152000","Jan  8, 2024 10:29:44.585496000 JST","","6000  >  43432 [SYN, ACK] Seq=0 Ack=1 Win=65160 Len=0 MSS=1460 SACK_PERM TSval=1525532858 TSecr=2365420665 WS=128"
"97","31.661584","192.168.11.21","192.168.11.30","TCP","66","0.007711000","0.007711000","Jan  8, 2024 10:29:44.593207000 JST","","43432  >  6000 [ACK] Seq=1 Ack=1 Win=64256 Len=0 TSval=2365420673 TSecr=1525532858"
"98","31.662240","192.168.11.21","192.168.11.30","TCP","93","","0.000656000","Jan  8, 2024 10:29:44.593863000 JST","","43432  >  6000 [PSH, ACK] Seq=1 Ack=1 Win=64256 Len=27 TSval=2365420674 TSecr=1525532858 [TCP segment of a reassembled PDU]"
"99","31.662371","192.168.11.30","192.168.11.21","TCP","66","0.000131000","0.000131000","Jan  8, 2024 10:29:44.593994000 JST","","6000  >  43432 [ACK] Seq=1 Ack=28 Win=65152 Len=0 TSval=1525532866 TSecr=2365420674"
"100","31.662453","192.168.11.21","192.168.11.30","TCP","66","","0.000082000","Jan  8, 2024 10:29:44.594076000 JST","","43432  >  6000 [FIN, ACK] Seq=28 Ack=1 Win=64256 Len=0 TSval=2365420674 TSecr=1525532858"
"101","31.663809","192.168.11.30","192.168.11.21","TCP","66","0.001356000","0.001356000","Jan  8, 2024 10:29:44.595432000 JST","","6000  >  43432 [FIN, ACK] Seq=1 Ack=29 Win=65152 Len=0 TSval=1525532868 TSecr=2365420674"
"102","31.669453","192.168.11.21","192.168.11.30","TCP","66","0.005644000","0.005644000","Jan  8, 2024 10:29:44.601076000 JST","","43432  >  6000 [ACK] Seq=29 Ack=2 Win=64256 Len=0 TSval=2365420681 TSecr=1525532868"
"103","37.719752","192.168.11.30","192.168.11.10","TCP","74","","6.050299000","Jan  8, 2024 10:29:50.651375000 JST","","54504  >  6000 [SYN] Seq=0 Win=64240 Len=0 MSS=1460 SACK_PERM TSval=3570453910 TSecr=0 WS=128"
"104","37.726342","192.168.11.10","192.168.11.30","TCP","74","0.006590000","0.006590000","Jan  8, 2024 10:29:50.657965000 JST","","6000  >  54504 [SYN, ACK] Seq=0 Ack=1 Win=65160 Len=0 MSS=1460 SACK_PERM TSval=2277797150 TSecr=3570453910 WS=128"
"105","37.726451","192.168.11.30","192.168.11.10","TCP","66","0.000109000","0.000109000","Jan  8, 2024 10:29:50.658074000 JST","","54504  >  6000 [ACK] Seq=1 Ack=1 Win=64256 Len=0 TSval=3570453917 TSecr=2277797150"
"106","37.726631","192.168.11.30","192.168.11.10","TCP","93","","0.000180000","Jan  8, 2024 10:29:50.658254000 JST","","54504  >  6000 [PSH, ACK] Seq=1 Ack=1 Win=64256 Len=27 TSval=3570453917 TSecr=2277797150 [TCP segment of a reassembled PDU]"
"107","37.726745","192.168.11.30","192.168.11.10","TCP","66","","0.000114000","Jan  8, 2024 10:29:50.658368000 JST","","54504  >  6000 [FIN, ACK] Seq=28 Ack=1 Win=64256 Len=0 TSval=3570453917 TSecr=2277797150"
"108","37.734167","192.168.11.10","192.168.11.30","TCP","66","0.007536000","0.007422000","Jan  8, 2024 10:29:50.665790000 JST","","6000  >  54504 [ACK] Seq=1 Ack=28 Win=65152 Len=0 TSval=2277797158 TSecr=3570453917"
"109","37.734531","192.168.11.10","192.168.11.30","TCP","66","0.007786000","0.000364000","Jan  8, 2024 10:29:50.666154000 JST","","6000  >  54504 [FIN, ACK] Seq=1 Ack=29 Win=65152 Len=0 TSval=2277797159 TSecr=3570453917"
"110","37.734582","192.168.11.30","192.168.11.10","TCP","66","0.000051000","0.000051000","Jan  8, 2024 10:29:50.666205000 JST","","54504  >  6000 [ACK] Seq=29 Ack=2 Win=64256 Len=0 TSval=3570453925 TSecr=2277797159"
"111","37.766976","192.168.11.30","255.255.255.255","UDP","209","","0.032394000","Jan  8, 2024 10:29:50.698599000 JST","7b2273656d616e74696373223a207b22656e74697479223a2022504944222c202262617365656e74697479223a2022616e79222c2022726f6c65223a2022686868222c20227370617469616c223a2022616e79222c202274656d706f72616c223a2022616e79227d2c20226461746170726f7065727479223a207b22666f726d6174223a2022696e616f6b615f70726f6772616d5f73616d706c655f73656d616e746963227d7d","56604  >  7000 Len=167"
"112","37.773783","192.168.11.21","192.168.11.30","TCP","74","","0.006807000","Jan  8, 2024 10:29:50.705406000 JST","","55724  >  6000 [SYN] Seq=0 Win=64240 Len=0 MSS=1460 SACK_PERM TSval=2365426785 TSecr=0 WS=128"
"113","37.773938","192.168.11.30","192.168.11.21","TCP","74","0.000155000","0.000155000","Jan  8, 2024 10:29:50.705561000 JST","","6000  >  55724 [SYN, ACK] Seq=0 Ack=1 Win=65160 Len=0 MSS=1460 SACK_PERM TSval=1525538978 TSecr=2365426785 WS=128"
"114","37.781718","192.168.11.21","192.168.11.30","TCP","66","0.007780000","0.007780000","Jan  8, 2024 10:29:50.713341000 JST","","55724  >  6000 [ACK] Seq=1 Ack=1 Win=64256 Len=0 TSval=2365426794 TSecr=1525538978"
"115","37.782351","192.168.11.21","192.168.11.30","TCP","93","","0.000633000","Jan  8, 2024 10:29:50.713974000 JST","","55724  >  6000 [PSH, ACK] Seq=1 Ack=1 Win=64256 Len=27 TSval=2365426794 TSecr=1525538978 [TCP segment of a reassembled PDU]"
"116","37.782474","192.168.11.30","192.168.11.21","TCP","66","0.000123000","0.000123000","Jan  8, 2024 10:29:50.714097000 JST","","6000  >  55724 [ACK] Seq=1 Ack=28 Win=65152 Len=0 TSval=1525538987 TSecr=2365426794"
"117","37.782563","192.168.11.21","192.168.11.30","TCP","66","","0.000089000","Jan  8, 2024 10:29:50.714186000 JST","","55724  >  6000 [FIN, ACK] Seq=28 Ack=1 Win=64256 Len=0 TSval=2365426794 TSecr=1525538978"
"118","37.783854","192.168.11.30","192.168.11.21","TCP","66","0.001291000","0.001291000","Jan  8, 2024 10:29:50.715477000 JST","","6000  >  55724 [FIN, ACK] Seq=1 Ack=29 Win=65152 Len=0 TSval=1525538988 TSecr=2365426794"
"119","37.789776","192.168.11.21","192.168.11.30","TCP","66","0.005922000","0.005922000","Jan  8, 2024 10:29:50.721399000 JST","","55724  >  6000 [ACK] Seq=29 Ack=2 Win=64256 Len=0 TSval=2365426801 TSecr=1525538988"
"120","43.838575","192.168.11.30","192.168.11.10","TCP","74","","6.048799000","Jan  8, 2024 10:29:56.770198000 JST","","45944  >  6000 [SYN] Seq=0 Win=64240 Len=0 MSS=1460 SACK_PERM TSval=3570460029 TSecr=0 WS=128"
"121","43.845184","192.168.11.10","192.168.11.30","TCP","74","0.006609000","0.006609000","Jan  8, 2024 10:29:56.776807000 JST","","6000  >  45944 [SYN, ACK] Seq=0 Ack=1 Win=65160 Len=0 MSS=1460 SACK_PERM TSval=2277803269 TSecr=3570460029 WS=128"
"122","43.845296","192.168.11.30","192.168.11.10","TCP","66","0.000112000","0.000112000","Jan  8, 2024 10:29:56.776919000 JST","","45944  >  6000 [ACK] Seq=1 Ack=1 Win=64256 Len=0 TSval=3570460035 TSecr=2277803269"
"123","43.845475","192.168.11.30","192.168.11.10","TCP","93","","0.000179000","Jan  8, 2024 10:29:56.777098000 JST","","45944  >  6000 [PSH, ACK] Seq=1 Ack=1 Win=64256 Len=27 TSval=3570460036 TSecr=2277803269 [TCP segment of a reassembled PDU]"
"124","43.845590","192.168.11.30","192.168.11.10","TCP","66","","0.000115000","Jan  8, 2024 10:29:56.777213000 JST","","45944  >  6000 [FIN, ACK] Seq=28 Ack=1 Win=64256 Len=0 TSval=3570460036 TSecr=2277803269"
"125","43.862586","192.168.11.10","192.168.11.30","TCP","66","0.017111000","0.016996000","Jan  8, 2024 10:29:56.794209000 JST","","6000  >  45944 [ACK] Seq=1 Ack=28 Win=65152 Len=0 TSval=2277803285 TSecr=3570460036"
"126","43.862972","192.168.11.10","192.168.11.30","TCP","66","0.017382000","0.000386000","Jan  8, 2024 10:29:56.794595000 JST","","6000  >  45944 [FIN, ACK] Seq=1 Ack=29 Win=65152 Len=0 TSval=2277803287 TSecr=3570460036"
"127","43.863026","192.168.11.30","192.168.11.10","TCP","66","0.000054000","0.000054000","Jan  8, 2024 10:29:56.794649000 JST","","45944  >  6000 [ACK] Seq=29 Ack=2 Win=64256 Len=0 TSval=3570460053 TSecr=2277803287"
"128","43.891526","192.168.11.30","255.255.255.255","UDP","209","","0.028500000","Jan  8, 2024 10:29:56.823149000 JST","7b2273656d616e74696373223a207b22656e74697479223a2022504944222c202262617365656e74697479223a2022616e79222c2022726f6c65223a2022686868222c20227370617469616c223a2022616e79222c202274656d706f72616c223a2022616e79227d2c20226461746170726f7065727479223a207b22666f726d6174223a2022696e616f6b615f70726f6772616d5f73616d706c655f73656d616e746963227d7d","46819  >  7000 Len=167"
"129","43.897486","192.168.11.21","192.168.11.30","TCP","74","","0.005960000","Jan  8, 2024 10:29:56.829109000 JST","","37272  >  6000 [SYN] Seq=0 Win=64240 Len=0 MSS=1460 SACK_PERM TSval=2365432909 TSecr=0 WS=128"
"130","43.897623","192.168.11.30","192.168.11.21","TCP","74","0.000137000","0.000137000","Jan  8, 2024 10:29:56.829246000 JST","","6000  >  37272 [SYN, ACK] Seq=0 Ack=1 Win=65160 Len=0 MSS=1460 SACK_PERM TSval=1525545102 TSecr=2365432909 WS=128"
"131","43.905445","192.168.11.21","192.168.11.30","TCP","66","0.007822000","0.007822000","Jan  8, 2024 10:29:56.837068000 JST","","37272  >  6000 [ACK] Seq=1 Ack=1 Win=64256 Len=0 TSval=2365432917 TSecr=1525545102"
"132","43.906137","192.168.11.21","192.168.11.30","TCP","93","","0.000692000","Jan  8, 2024 10:29:56.837760000 JST","","37272  >  6000 [PSH, ACK] Seq=1 Ack=1 Win=64256 Len=27 TSval=2365432917 TSecr=1525545102 [TCP segment of a reassembled PDU]"
"133","43.906254","192.168.11.30","192.168.11.21","TCP","66","0.000117000","0.000117000","Jan  8, 2024 10:29:56.837877000 JST","","6000  >  37272 [ACK] Seq=1 Ack=28 Win=65152 Len=0 TSval=1525545110 TSecr=2365432917"
"134","43.906345","192.168.11.21","192.168.11.30","TCP","66","","0.000091000","Jan  8, 2024 10:29:56.837968000 JST","","37272  >  6000 [FIN, ACK] Seq=28 Ack=1 Win=64256 Len=0 TSval=2365432918 TSecr=1525545102"
"135","43.907807","192.168.11.30","192.168.11.21","TCP","66","0.001462000","0.001462000","Jan  8, 2024 10:29:56.839430000 JST","","6000  >  37272 [FIN, ACK] Seq=1 Ack=29 Win=65152 Len=0 TSval=1525545112 TSecr=2365432918"
"136","43.913489","192.168.11.21","192.168.11.30","TCP","66","0.005682000","0.005682000","Jan  8, 2024 10:29:56.845112000 JST","","37272  >  6000 [ACK] Seq=29 Ack=2 Win=64256 Len=0 TSval=2365432925 TSecr=1525545112"
"137","49.931960","192.168.11.30","192.168.11.10","TCP","74","","6.018471000","Jan  8, 2024 10:30:02.863583000 JST","","43158  >  6000 [SYN] Seq=0 Win=64240 Len=0 MSS=1460 SACK_PERM TSval=3570466122 TSecr=0 WS=128"
"138","49.938490","192.168.11.10","192.168.11.30","TCP","74","0.006530000","0.006530000","Jan  8, 2024 10:30:02.870113000 JST","","6000  >  43158 [SYN, ACK] Seq=0 Ack=1 Win=65160 Len=0 MSS=1460 SACK_PERM TSval=2277809362 TSecr=3570466122 WS=128"
"139","49.938610","192.168.11.30","192.168.11.10","TCP","66","0.000120000","0.000120000","Jan  8, 2024 10:30:02.870233000 JST","","43158  >  6000 [ACK] Seq=1 Ack=1 Win=64256 Len=0 TSval=3570466129 TSecr=2277809362"
"140","49.938783","192.168.11.30","192.168.11.10","TCP","93","","0.000173000","Jan  8, 2024 10:30:02.870406000 JST","","43158  >  6000 [PSH, ACK] Seq=1 Ack=1 Win=64256 Len=27 TSval=3570466129 TSecr=2277809362 [TCP segment of a reassembled PDU]"
"141","49.938890","192.168.11.30","192.168.11.10","TCP","66","","0.000107000","Jan  8, 2024 10:30:02.870513000 JST","","43158  >  6000 [FIN, ACK] Seq=28 Ack=1 Win=64256 Len=0 TSval=3570466129 TSecr=2277809362"
"142","49.945914","192.168.11.10","192.168.11.30","TCP","66","0.007131000","0.007024000","Jan  8, 2024 10:30:02.877537000 JST","","6000  >  43158 [ACK] Seq=1 Ack=28 Win=65152 Len=0 TSval=2277809370 TSecr=3570466129"
"143","49.946277","192.168.11.10","192.168.11.30","TCP","66","0.007387000","0.000363000","Jan  8, 2024 10:30:02.877900000 JST","","6000  >  43158 [FIN, ACK] Seq=1 Ack=29 Win=65152 Len=0 TSval=2277809371 TSecr=3570466129"
"144","49.946324","192.168.11.30","192.168.11.10","TCP","66","0.000047000","0.000047000","Jan  8, 2024 10:30:02.877947000 JST","","43158  >  6000 [ACK] Seq=29 Ack=2 Win=64256 Len=0 TSval=3570466137 TSecr=2277809371"
"145","49.974937","192.168.11.30","255.255.255.255","UDP","209","","0.028613000","Jan  8, 2024 10:30:02.906560000 JST","7b2273656d616e74696373223a207b22656e74697479223a2022504944222c202262617365656e74697479223a2022616e79222c2022726f6c65223a2022686868222c20227370617469616c223a2022616e79222c202274656d706f72616c223a2022616e79227d2c20226461746170726f7065727479223a207b22666f726d6174223a2022696e616f6b615f70726f6772616d5f73616d706c655f73656d616e746963227d7d","41498  >  7000 Len=167"
"146","49.981658","192.168.11.21","192.168.11.30","TCP","74","","0.006721000","Jan  8, 2024 10:30:02.913281000 JST","","37282  >  6000 [SYN] Seq=0 Win=64240 Len=0 MSS=1460 SACK_PERM TSval=2365438993 TSecr=0 WS=128"
"147","49.981798","192.168.11.30","192.168.11.21","TCP","74","0.000140000","0.000140000","Jan  8, 2024 10:30:02.913421000 JST","","6000  >  37282 [SYN, ACK] Seq=0 Ack=1 Win=65160 Len=0 MSS=1460 SACK_PERM TSval=1525551186 TSecr=2365438993 WS=128"
"148","49.988591","192.168.11.21","192.168.11.30","TCP","66","0.006793000","0.006793000","Jan  8, 2024 10:30:02.920214000 JST","","37282  >  6000 [ACK] Seq=1 Ack=1 Win=64256 Len=0 TSval=2365439000 TSecr=1525551186"
"149","49.989220","192.168.11.21","192.168.11.30","TCP","93","","0.000629000","Jan  8, 2024 10:30:02.920843000 JST","","37282  >  6000 [PSH, ACK] Seq=1 Ack=1 Win=64256 Len=27 TSval=2365439001 TSecr=1525551186 [TCP segment of a reassembled PDU]"
"150","49.989338","192.168.11.30","192.168.11.21","TCP","66","0.000118000","0.000118000","Jan  8, 2024 10:30:02.920961000 JST","","6000  >  37282 [ACK] Seq=1 Ack=28 Win=65152 Len=0 TSval=1525551193 TSecr=2365439001"
"151","49.989418","192.168.11.21","192.168.11.30","TCP","66","","0.000080000","Jan  8, 2024 10:30:02.921041000 JST","","37282  >  6000 [FIN, ACK] Seq=28 Ack=1 Win=64256 Len=0 TSval=2365439001 TSecr=1525551186"
"152","49.990674","192.168.11.30","192.168.11.21","TCP","66","0.001256000","0.001256000","Jan  8, 2024 10:30:02.922297000 JST","","6000  >  37282 [FIN, ACK] Seq=1 Ack=29 Win=65152 Len=0 TSval=1525551195 TSecr=2365439001"
"153","49.996353","192.168.11.21","192.168.11.30","TCP","66","0.005679000","0.005679000","Jan  8, 2024 10:30:02.927976000 JST","","37282  >  6000 [ACK] Seq=29 Ack=2 Win=64256 Len=0 TSval=2365439008 TSecr=1525551195"
"154","56.052218","192.168.11.30","192.168.11.10","TCP","74","","6.055865000","Jan  8, 2024 10:30:08.983841000 JST","","43174  >  6000 [SYN] Seq=0 Win=64240 Len=0 MSS=1460 SACK_PERM TSval=3570472242 TSecr=0 WS=128"
"155","56.059854","192.168.11.10","192.168.11.30","TCP","74","0.007636000","0.007636000","Jan  8, 2024 10:30:08.991477000 JST","","6000  >  43174 [SYN, ACK] Seq=0 Ack=1 Win=65160 Len=0 MSS=1460 SACK_PERM TSval=2277815483 TSecr=3570472242 WS=128"
"156","56.059957","192.168.11.30","192.168.11.10","TCP","66","0.000103000","0.000103000","Jan  8, 2024 10:30:08.991580000 JST","","43174  >  6000 [ACK] Seq=1 Ack=1 Win=64256 Len=0 TSval=3570472250 TSecr=2277815483"
"157","56.060106","192.168.11.30","192.168.11.10","TCP","93","","0.000149000","Jan  8, 2024 10:30:08.991729000 JST","","43174  >  6000 [PSH, ACK] Seq=1 Ack=1 Win=64256 Len=27 TSval=3570472250 TSecr=2277815483 [TCP segment of a reassembled PDU]"
"158","56.060205","192.168.11.30","192.168.11.10","TCP","66","","0.000099000","Jan  8, 2024 10:30:08.991828000 JST","","43174  >  6000 [FIN, ACK] Seq=28 Ack=1 Win=64256 Len=0 TSval=3570472250 TSecr=2277815483"
"159","56.067161","192.168.11.10","192.168.11.30","TCP","66","0.007055000","0.006956000","Jan  8, 2024 10:30:08.998784000 JST","","6000  >  43174 [ACK] Seq=1 Ack=28 Win=65152 Len=0 TSval=2277815491 TSecr=3570472250"
"160","56.067376","192.168.11.10","192.168.11.30","TCP","66","0.007171000","0.000215000","Jan  8, 2024 10:30:08.998999000 JST","","6000  >  43174 [FIN, ACK] Seq=1 Ack=29 Win=65152 Len=0 TSval=2277815493 TSecr=3570472250"
"161","56.067422","192.168.11.30","192.168.11.10","TCP","66","0.000046000","0.000046000","Jan  8, 2024 10:30:08.999045000 JST","","43174  >  6000 [ACK] Seq=29 Ack=2 Win=64256 Len=0 TSval=3570472258 TSecr=2277815493"
"162","56.098902","192.168.11.30","255.255.255.255","UDP","209","","0.031480000","Jan  8, 2024 10:30:09.030525000 JST","7b2273656d616e74696373223a207b22656e74697479223a2022504944222c202262617365656e74697479223a2022616e79222c2022726f6c65223a2022686868222c20227370617469616c223a2022616e79222c202274656d706f72616c223a2022616e79227d2c20226461746170726f7065727479223a207b22666f726d6174223a2022696e616f6b615f70726f6772616d5f73616d706c655f73656d616e746963227d7d","36951  >  7000 Len=167"
"163","56.104615","192.168.11.21","192.168.11.30","TCP","74","","0.005713000","Jan  8, 2024 10:30:09.036238000 JST","","43122  >  6000 [SYN] Seq=0 Win=64240 Len=0 MSS=1460 SACK_PERM TSval=2365445117 TSecr=0 WS=128"
"164","56.104757","192.168.11.30","192.168.11.21","TCP","74","0.000142000","0.000142000","Jan  8, 2024 10:30:09.036380000 JST","","6000  >  43122 [SYN, ACK] Seq=0 Ack=1 Win=65160 Len=0 MSS=1460 SACK_PERM TSval=1525557309 TSecr=2365445117 WS=128"
"165","56.111441","192.168.11.21","192.168.11.30","TCP","66","0.006684000","0.006684000","Jan  8, 2024 10:30:09.043064000 JST","","43122  >  6000 [ACK] Seq=1 Ack=1 Win=64256 Len=0 TSval=2365445123 TSecr=1525557309"
"166","56.112013","192.168.11.21","192.168.11.30","TCP","93","","0.000572000","Jan  8, 2024 10:30:09.043636000 JST","","43122  >  6000 [PSH, ACK] Seq=1 Ack=1 Win=64256 Len=27 TSval=2365445124 TSecr=1525557309 [TCP segment of a reassembled PDU]"
"167","56.112123","192.168.11.30","192.168.11.21","TCP","66","0.000110000","0.000110000","Jan  8, 2024 10:30:09.043746000 JST","","6000  >  43122 [ACK] Seq=1 Ack=28 Win=65152 Len=0 TSval=1525557316 TSecr=2365445124"
