"No.","Time","Source","Destination","Protocol","Length","The RTT to ACK the segment was","Time delta from previous captured frame","Arrival Time","Data","Info"
"1","0.000000","192.168.11.28","192.168.11.21","TCP","74","","0.000000000","Jan  8, 2024 10:29:13.038965000 JST","","46076  >  6000 [SYN] Seq=0 Win=64240 Len=0 MSS=1460 SACK_PERM TSval=3502979154 TSecr=0 WS=128"
"2","0.007808","192.168.11.21","192.168.11.28","TCP","74","0.007808000","0.007808000","Jan  8, 2024 10:29:13.046773000 JST","","6000  >  46076 [SYN, ACK] Seq=0 Ack=1 Win=65160 Len=0 MSS=1460 SACK_PERM TSval=4202621995 TSecr=3502979154 WS=128"
"3","0.007927","192.168.11.28","192.168.11.21","TCP","66","0.000119000","0.000119000","Jan  8, 2024 10:29:13.046892000 JST","","46076  >  6000 [ACK] Seq=1 Ack=1 Win=64256 Len=0 TSval=3502979162 TSecr=4202621995"
"4","0.008104","192.168.11.28","192.168.11.21","TCP","93","","0.000177000","Jan  8, 2024 10:29:13.047069000 JST","","46076  >  6000 [PSH, ACK] Seq=1 Ack=1 Win=64256 Len=27 TSval=3502979162 TSecr=4202621995 [TCP segment of a reassembled PDU]"
"5","0.008291","192.168.11.28","192.168.11.21","TCP","66","","0.000187000","Jan  8, 2024 10:29:13.047256000 JST","","46076  >  6000 [FIN, ACK] Seq=28 Ack=1 Win=64256 Len=0 TSval=3502979163 TSecr=4202621995"
"6","0.015544","192.168.11.21","192.168.11.28","TCP","66","0.007440000","0.007253000","Jan  8, 2024 10:29:13.054509000 JST","","6000  >  46076 [ACK] Seq=1 Ack=28 Win=65152 Len=0 TSval=4202622003 TSecr=3502979162"
"7","0.015965","192.168.11.21","192.168.11.28","TCP","66","0.007674000","0.000421000","Jan  8, 2024 10:29:13.054930000 JST","","6000  >  46076 [FIN, ACK] Seq=1 Ack=29 Win=65152 Len=0 TSval=4202622005 TSecr=3502979163"
"8","0.016013","192.168.11.28","192.168.11.21","TCP","66","0.000048000","0.000048000","Jan  8, 2024 10:29:13.054978000 JST","","46076  >  6000 [ACK] Seq=29 Ack=2 Win=64256 Len=0 TSval=3502979170 TSecr=4202622005"
"9","0.045141","192.168.11.28","255.255.255.255","UDP","209","","0.029128000","Jan  8, 2024 10:29:13.084106000 JST","7b2273656d616e74696373223a207b22656e74697479223a2022504944222c202262617365656e74697479223a2022616e79222c2022726f6c65223a20226a6a6a222c20227370617469616c223a2022616e79222c202274656d706f72616c223a2022616e79227d2c20226461746170726f7065727479223a207b22666f726d6174223a2022696e616f6b615f70726f6772616d5f73616d706c655f73656d616e746963227d7d","39314  >  7000 Len=167"
"10","0.052330","192.168.11.7","192.168.11.28","TCP","74","","0.007189000","Jan  8, 2024 10:29:13.091295000 JST","","54870  >  6000 [SYN] Seq=0 Win=64240 Len=0 MSS=1460 SACK_PERM TSval=612737166 TSecr=0 WS=128"
"11","0.052487","192.168.11.28","192.168.11.7","TCP","74","0.000157000","0.000157000","Jan  8, 2024 10:29:13.091452000 JST","","6000  >  54870 [SYN, ACK] Seq=0 Ack=1 Win=65160 Len=0 MSS=1460 SACK_PERM TSval=2659280946 TSecr=612737166 WS=128"
"12","0.073019","192.168.11.7","192.168.11.28","TCP","66","0.020532000","0.020532000","Jan  8, 2024 10:29:13.111984000 JST","","54870  >  6000 [ACK] Seq=1 Ack=1 Win=64256 Len=0 TSval=612737175 TSecr=2659280946"
"13","0.073581","192.168.11.7","192.168.11.28","TCP","93","","0.000562000","Jan  8, 2024 10:29:13.112546000 JST","","54870  >  6000 [PSH, ACK] Seq=1 Ack=1 Win=64256 Len=27 TSval=612737175 TSecr=2659280946 [TCP segment of a reassembled PDU]"
"14","0.073659","192.168.11.28","192.168.11.7","TCP","66","0.000078000","0.000078000","Jan  8, 2024 10:29:13.112624000 JST","","6000  >  54870 [ACK] Seq=1 Ack=28 Win=65152 Len=0 TSval=2659280967 TSecr=612737175"
"15","0.073726","192.168.11.7","192.168.11.28","TCP","66","","0.000067000","Jan  8, 2024 10:29:13.112691000 JST","","54870  >  6000 [FIN, ACK] Seq=28 Ack=1 Win=64256 Len=0 TSval=612737175 TSecr=2659280946"
"16","0.074838","192.168.11.28","192.168.11.7","TCP","66","0.001112000","0.001112000","Jan  8, 2024 10:29:13.113803000 JST","","6000  >  54870 [FIN, ACK] Seq=1 Ack=29 Win=65152 Len=0 TSval=2659280968 TSecr=612737175"
"17","0.080896","192.168.11.7","192.168.11.28","TCP","66","0.006058000","0.006058000","Jan  8, 2024 10:29:13.119861000 JST","","54870  >  6000 [ACK] Seq=29 Ack=2 Win=64256 Len=0 TSval=612737195 TSecr=2659280968"
"18","6.174049","192.168.11.28","192.168.11.21","TCP","74","","6.093153000","Jan  8, 2024 10:29:19.213014000 JST","","48128  >  6000 [SYN] Seq=0 Win=64240 Len=0 MSS=1460 SACK_PERM TSval=3502985328 TSecr=0 WS=128"
"19","6.181129","192.168.11.21","192.168.11.28","TCP","74","0.007080000","0.007080000","Jan  8, 2024 10:29:19.220094000 JST","","6000  >  48128 [SYN, ACK] Seq=0 Ack=1 Win=65160 Len=0 MSS=1460 SACK_PERM TSval=4202628169 TSecr=3502985328 WS=128"
"20","6.181240","192.168.11.28","192.168.11.21","TCP","66","0.000111000","0.000111000","Jan  8, 2024 10:29:19.220205000 JST","","48128  >  6000 [ACK] Seq=1 Ack=1 Win=64256 Len=0 TSval=3502985336 TSecr=4202628169"
"21","6.181432","192.168.11.28","192.168.11.21","TCP","93","","0.000192000","Jan  8, 2024 10:29:19.220397000 JST","","48128  >  6000 [PSH, ACK] Seq=1 Ack=1 Win=64256 Len=27 TSval=3502985336 TSecr=4202628169 [TCP segment of a reassembled PDU]"
"22","6.181556","192.168.11.28","192.168.11.21","TCP","66","","0.000124000","Jan  8, 2024 10:29:19.220521000 JST","","48128  >  6000 [FIN, ACK] Seq=28 Ack=1 Win=64256 Len=0 TSval=3502985336 TSecr=4202628169"
"23","6.188759","192.168.11.21","192.168.11.28","TCP","66","0.007327000","0.007203000","Jan  8, 2024 10:29:19.227724000 JST","","6000  >  48128 [ACK] Seq=1 Ack=28 Win=65152 Len=0 TSval=4202628177 TSecr=3502985336"
"24","6.189124","192.168.11.21","192.168.11.28","TCP","66","0.007568000","0.000365000","Jan  8, 2024 10:29:19.228089000 JST","","6000  >  48128 [FIN, ACK] Seq=1 Ack=29 Win=65152 Len=0 TSval=4202628178 TSecr=3502985336"
"25","6.189177","192.168.11.28","192.168.11.21","TCP","66","0.000053000","0.000053000","Jan  8, 2024 10:29:19.228142000 JST","","48128  >  6000 [ACK] Seq=29 Ack=2 Win=64256 Len=0 TSval=3502985343 TSecr=4202628178"
"26","6.220045","192.168.11.28","255.255.255.255","UDP","209","","0.030868000","Jan  8, 2024 10:29:19.259010000 JST","7b2273656d616e74696373223a207b22656e74697479223a2022504944222c202262617365656e74697479223a2022616e79222c2022726f6c65223a20226a6a6a222c20227370617469616c223a2022616e79222c202274656d706f72616c223a2022616e79227d2c20226461746170726f7065727479223a207b22666f726d6174223a2022696e616f6b615f70726f6772616d5f73616d706c655f73656d616e746963227d7d","38608  >  7000 Len=167"
"27","6.226423","192.168.11.7","192.168.11.28","TCP","74","","0.006378000","Jan  8, 2024 10:29:19.265388000 JST","","41894  >  6000 [SYN] Seq=0 Win=64240 Len=0 MSS=1460 SACK_PERM TSval=612743340 TSecr=0 WS=128"
"28","6.226586","192.168.11.28","192.168.11.7","TCP","74","0.000163000","0.000163000","Jan  8, 2024 10:29:19.265551000 JST","","6000  >  41894 [SYN, ACK] Seq=0 Ack=1 Win=65160 Len=0 MSS=1460 SACK_PERM TSval=2659287120 TSecr=612743340 WS=128"
"29","6.233902","192.168.11.7","192.168.11.28","TCP","66","0.007316000","0.007316000","Jan  8, 2024 10:29:19.272867000 JST","","41894  >  6000 [ACK] Seq=1 Ack=1 Win=64256 Len=0 TSval=612743348 TSecr=2659287120"
"30","6.234552","192.168.11.7","192.168.11.28","TCP","93","","0.000650000","Jan  8, 2024 10:29:19.273517000 JST","","41894  >  6000 [PSH, ACK] Seq=1 Ack=1 Win=64256 Len=27 TSval=612743349 TSecr=2659287120 [TCP segment of a reassembled PDU]"
"31","6.234653","192.168.11.28","192.168.11.7","TCP","66","0.000101000","0.000101000","Jan  8, 2024 10:29:19.273618000 JST","","6000  >  41894 [ACK] Seq=1 Ack=28 Win=65152 Len=0 TSval=2659287128 TSecr=612743349"
"32","6.234730","192.168.11.7","192.168.11.28","TCP","66","","0.000077000","Jan  8, 2024 10:29:19.273695000 JST","","41894  >  6000 [FIN, ACK] Seq=28 Ack=1 Win=64256 Len=0 TSval=612743349 TSecr=2659287120"
"33","6.236929","192.168.11.28","192.168.11.7","TCP","66","0.002199000","0.002199000","Jan  8, 2024 10:29:19.275894000 JST","","6000  >  41894 [FIN, ACK] Seq=1 Ack=29 Win=65152 Len=0 TSval=2659287130 TSecr=612743349"
"34","6.242953","192.168.11.7","192.168.11.28","TCP","66","0.006024000","0.006024000","Jan  8, 2024 10:29:19.281918000 JST","","41894  >  6000 [ACK] Seq=29 Ack=2 Win=64256 Len=0 TSval=612743357 TSecr=2659287130"
"35","12.270212","192.168.11.28","192.168.11.21","TCP","74","","6.027259000","Jan  8, 2024 10:29:25.309177000 JST","","48132  >  6000 [SYN] Seq=0 Win=64240 Len=0 MSS=1460 SACK_PERM TSval=3502991425 TSecr=0 WS=128"
"36","12.276957","192.168.11.21","192.168.11.28","TCP","74","0.006745000","0.006745000","Jan  8, 2024 10:29:25.315922000 JST","","6000  >  48132 [SYN, ACK] Seq=0 Ack=1 Win=65160 Len=0 MSS=1460 SACK_PERM TSval=4202634265 TSecr=3502991425 WS=128"
"37","12.277064","192.168.11.28","192.168.11.21","TCP","66","0.000107000","0.000107000","Jan  8, 2024 10:29:25.316029000 JST","","48132  >  6000 [ACK] Seq=1 Ack=1 Win=64256 Len=0 TSval=3502991431 TSecr=4202634265"
"38","12.277244","192.168.11.28","192.168.11.21","TCP","93","","0.000180000","Jan  8, 2024 10:29:25.316209000 JST","","48132  >  6000 [PSH, ACK] Seq=1 Ack=1 Win=64256 Len=27 TSval=3502991432 TSecr=4202634265 [TCP segment of a reassembled PDU]"
"39","12.277350","192.168.11.28","192.168.11.21","TCP","66","","0.000106000","Jan  8, 2024 10:29:25.316315000 JST","","48132  >  6000 [FIN, ACK] Seq=28 Ack=1 Win=64256 Len=0 TSval=3502991432 TSecr=4202634265"
"40","12.284632","192.168.11.21","192.168.11.28","TCP","66","0.007388000","0.007282000","Jan  8, 2024 10:29:25.323597000 JST","","6000  >  48132 [ACK] Seq=1 Ack=28 Win=65152 Len=0 TSval=4202634273 TSecr=3502991432"
"41","12.285027","192.168.11.21","192.168.11.28","TCP","66","0.007677000","0.000395000","Jan  8, 2024 10:29:25.323992000 JST","","6000  >  48132 [FIN, ACK] Seq=1 Ack=29 Win=65152 Len=0 TSval=4202634274 TSecr=3502991432"
"42","12.285082","192.168.11.28","192.168.11.21","TCP","66","0.000055000","0.000055000","Jan  8, 2024 10:29:25.324047000 JST","","48132  >  6000 [ACK] Seq=29 Ack=2 Win=64256 Len=0 TSval=3502991439 TSecr=4202634274"
"43","12.313951","192.168.11.28","255.255.255.255","UDP","209","","0.028869000","Jan  8, 2024 10:29:25.352916000 JST","7b2273656d616e74696373223a207b22656e74697479223a2022504944222c202262617365656e74697479223a2022616e79222c2022726f6c65223a20226a6a6a222c20227370617469616c223a2022616e79222c202274656d706f72616c223a2022616e79227d2c20226461746170726f7065727479223a207b22666f726d6174223a2022696e616f6b615f70726f6772616d5f73616d706c655f73656d616e746963227d7d","43009  >  7000 Len=167"
"44","12.319664","192.168.11.7","192.168.11.28","TCP","74","","0.005713000","Jan  8, 2024 10:29:25.358629000 JST","","60484  >  6000 [SYN] Seq=0 Win=64240 Len=0 MSS=1460 SACK_PERM TSval=612749434 TSecr=0 WS=128"
"45","12.319786","192.168.11.28","192.168.11.7","TCP","74","0.000122000","0.000122000","Jan  8, 2024 10:29:25.358751000 JST","","6000  >  60484 [SYN, ACK] Seq=0 Ack=1 Win=65160 Len=0 MSS=1460 SACK_PERM TSval=2659293213 TSecr=612749434 WS=128"
"46","12.326853","192.168.11.7","192.168.11.28","TCP","66","0.007067000","0.007067000","Jan  8, 2024 10:29:25.365818000 JST","","60484  >  6000 [ACK] Seq=1 Ack=1 Win=64256 Len=0 TSval=612749441 TSecr=2659293213"
"47","12.327433","192.168.11.7","192.168.11.28","TCP","93","","0.000580000","Jan  8, 2024 10:29:25.366398000 JST","","60484  >  6000 [PSH, ACK] Seq=1 Ack=1 Win=64256 Len=27 TSval=612749442 TSecr=2659293213 [TCP segment of a reassembled PDU]"
"48","12.327537","192.168.11.28","192.168.11.7","TCP","66","0.000104000","0.000104000","Jan  8, 2024 10:29:25.366502000 JST","","6000  >  60484 [ACK] Seq=1 Ack=28 Win=65152 Len=0 TSval=2659293221 TSecr=612749442"
"49","12.327615","192.168.11.7","192.168.11.28","TCP","66","","0.000078000","Jan  8, 2024 10:29:25.366580000 JST","","60484  >  6000 [FIN, ACK] Seq=28 Ack=1 Win=64256 Len=0 TSval=612749442 TSecr=2659293213"
"50","12.329879","192.168.11.28","192.168.11.7","TCP","66","0.002264000","0.002264000","Jan  8, 2024 10:29:25.368844000 JST","","6000  >  60484 [FIN, ACK] Seq=1 Ack=29 Win=65152 Len=0 TSval=2659293223 TSecr=612749442"
"51","12.338656","192.168.11.7","192.168.11.28","TCP","66","0.008777000","0.008777000","Jan  8, 2024 10:29:25.377621000 JST","","60484  >  6000 [ACK] Seq=29 Ack=2 Win=64256 Len=0 TSval=612749451 TSecr=2659293223"
"52","18.378741","192.168.11.28","192.168.11.21","TCP","74","","6.040085000","Jan  8, 2024 10:29:31.417706000 JST","","37988  >  6000 [SYN] Seq=0 Win=64240 Len=0 MSS=1460 SACK_PERM TSval=3502997533 TSecr=0 WS=128"
"53","18.386454","192.168.11.21","192.168.11.28","TCP","74","0.007713000","0.007713000","Jan  8, 2024 10:29:31.425419000 JST","","6000  >  37988 [SYN, ACK] Seq=0 Ack=1 Win=65160 Len=0 MSS=1460 SACK_PERM TSval=4202640374 TSecr=3502997533 WS=128"
"54","18.386566","192.168.11.28","192.168.11.21","TCP","66","0.000112000","0.000112000","Jan  8, 2024 10:29:31.425531000 JST","","37988  >  6000 [ACK] Seq=1 Ack=1 Win=64256 Len=0 TSval=3502997541 TSecr=4202640374"
"55","18.386752","192.168.11.28","192.168.11.21","TCP","93","","0.000186000","Jan  8, 2024 10:29:31.425717000 JST","","37988  >  6000 [PSH, ACK] Seq=1 Ack=1 Win=64256 Len=27 TSval=3502997541 TSecr=4202640374 [TCP segment of a reassembled PDU]"
"56","18.386876","192.168.11.28","192.168.11.21","TCP","66","","0.000124000","Jan  8, 2024 10:29:31.425841000 JST","","37988  >  6000 [FIN, ACK] Seq=28 Ack=1 Win=64256 Len=0 TSval=3502997541 TSecr=4202640374"
"57","18.394119","192.168.11.21","192.168.11.28","TCP","66","0.007367000","0.007243000","Jan  8, 2024 10:29:31.433084000 JST","","6000  >  37988 [ACK] Seq=1 Ack=28 Win=65152 Len=0 TSval=4202640382 TSecr=3502997541"
"58","18.394493","192.168.11.21","192.168.11.28","TCP","66","0.007617000","0.000374000","Jan  8, 2024 10:29:31.433458000 JST","","6000  >  37988 [FIN, ACK] Seq=1 Ack=29 Win=65152 Len=0 TSval=4202640383 TSecr=3502997541"
"59","18.394552","192.168.11.28","192.168.11.21","TCP","66","0.000059000","0.000059000","Jan  8, 2024 10:29:31.433517000 JST","","37988  >  6000 [ACK] Seq=29 Ack=2 Win=64256 Len=0 TSval=3502997549 TSecr=4202640383"
"60","18.423475","192.168.11.28","255.255.255.255","UDP","209","","0.028923000","Jan  8, 2024 10:29:31.462440000 JST","7b2273656d616e74696373223a207b22656e74697479223a2022504944222c202262617365656e74697479223a2022616e79222c2022726f6c65223a20226a6a6a222c20227370617469616c223a2022616e79222c202274656d706f72616c223a2022616e79227d2c20226461746170726f7065727479223a207b22666f726d6174223a2022696e616f6b615f70726f6772616d5f73616d706c655f73656d616e746963227d7d","48081  >  7000 Len=167"
"61","18.429180","192.168.11.7","192.168.11.28","TCP","74","","0.005705000","Jan  8, 2024 10:29:31.468145000 JST","","60500  >  6000 [SYN] Seq=0 Win=64240 Len=0 MSS=1460 SACK_PERM TSval=612755544 TSecr=0 WS=128"
"62","18.429315","192.168.11.28","192.168.11.7","TCP","74","0.000135000","0.000135000","Jan  8, 2024 10:29:31.468280000 JST","","6000  >  60500 [SYN, ACK] Seq=0 Ack=1 Win=65160 Len=0 MSS=1460 SACK_PERM TSval=2659299323 TSecr=612755544 WS=128"
"63","18.437177","192.168.11.7","192.168.11.28","TCP","66","0.007862000","0.007862000","Jan  8, 2024 10:29:31.476142000 JST","","60500  >  6000 [ACK] Seq=1 Ack=1 Win=64256 Len=0 TSval=612755551 TSecr=2659299323"
"64","18.437818","192.168.11.7","192.168.11.28","TCP","93","","0.000641000","Jan  8, 2024 10:29:31.476783000 JST","","60500  >  6000 [PSH, ACK] Seq=1 Ack=1 Win=64256 Len=27 TSval=612755552 TSecr=2659299323 [TCP segment of a reassembled PDU]"
"65","18.437931","192.168.11.28","192.168.11.7","TCP","66","0.000113000","0.000113000","Jan  8, 2024 10:29:31.476896000 JST","","6000  >  60500 [ACK] Seq=1 Ack=28 Win=65152 Len=0 TSval=2659299331 TSecr=612755552"
"66","18.438012","192.168.11.7","192.168.11.28","TCP","66","","0.000081000","Jan  8, 2024 10:29:31.476977000 JST","","60500  >  6000 [FIN, ACK] Seq=28 Ack=1 Win=64256 Len=0 TSval=612755552 TSecr=2659299323"
"67","18.440234","192.168.11.28","192.168.11.7","TCP","66","0.002222000","0.002222000","Jan  8, 2024 10:29:31.479199000 JST","","6000  >  60500 [FIN, ACK] Seq=1 Ack=29 Win=65152 Len=0 TSval=2659299333 TSecr=612755552"
"68","18.449606","192.168.11.7","192.168.11.28","TCP","66","0.009372000","0.009372000","Jan  8, 2024 10:29:31.488571000 JST","","60500  >  6000 [ACK] Seq=29 Ack=2 Win=64256 Len=0 TSval=612755563 TSecr=2659299333"
"69","25.505889","192.168.11.28","192.168.11.21","TCP","74","","7.056283000","Jan  8, 2024 10:29:38.544854000 JST","","38592  >  6000 [SYN] Seq=0 Win=64240 Len=0 MSS=1460 SACK_PERM TSval=3503004660 TSecr=0 WS=128"
"70","25.512474","192.168.11.21","192.168.11.28","TCP","74","0.006585000","0.006585000","Jan  8, 2024 10:29:38.551439000 JST","","6000  >  38592 [SYN, ACK] Seq=0 Ack=1 Win=65160 Len=0 MSS=1460 SACK_PERM TSval=4202647501 TSecr=3503004660 WS=128"
"71","25.512588","192.168.11.28","192.168.11.21","TCP","66","0.000114000","0.000114000","Jan  8, 2024 10:29:38.551553000 JST","","38592  >  6000 [ACK] Seq=1 Ack=1 Win=64256 Len=0 TSval=3503004667 TSecr=4202647501"
"72","25.512783","192.168.11.28","192.168.11.21","TCP","93","","0.000195000","Jan  8, 2024 10:29:38.551748000 JST","","38592  >  6000 [PSH, ACK] Seq=1 Ack=1 Win=64256 Len=27 TSval=3503004667 TSecr=4202647501 [TCP segment of a reassembled PDU]"
"73","25.512908","192.168.11.28","192.168.11.21","TCP","66","","0.000125000","Jan  8, 2024 10:29:38.551873000 JST","","38592  >  6000 [FIN, ACK] Seq=28 Ack=1 Win=64256 Len=0 TSval=3503004667 TSecr=4202647501"
"74","25.519969","192.168.11.21","192.168.11.28","TCP","66","0.007186000","0.007061000","Jan  8, 2024 10:29:38.558934000 JST","","6000  >  38592 [ACK] Seq=1 Ack=28 Win=65152 Len=0 TSval=4202647508 TSecr=3503004667"
"75","25.520353","192.168.11.21","192.168.11.28","TCP","66","0.007445000","0.000384000","Jan  8, 2024 10:29:38.559318000 JST","","6000  >  38592 [FIN, ACK] Seq=1 Ack=29 Win=65152 Len=0 TSval=4202647509 TSecr=3503004667"
"76","25.520409","192.168.11.28","192.168.11.21","TCP","66","0.000056000","0.000056000","Jan  8, 2024 10:29:38.559374000 JST","","38592  >  6000 [ACK] Seq=29 Ack=2 Win=64256 Len=0 TSval=3503004675 TSecr=4202647509"
"77","25.548229","192.168.11.28","255.255.255.255","UDP","209","","0.027820000","Jan  8, 2024 10:29:38.587194000 JST","7b2273656d616e74696373223a207b22656e74697479223a2022504944222c202262617365656e74697479223a2022616e79222c2022726f6c65223a20226a6a6a222c20227370617469616c223a2022616e79222c202274656d706f72616c223a2022616e79227d2c20226461746170726f7065727479223a207b22666f726d6174223a2022696e616f6b615f70726f6772616d5f73616d706c655f73656d616e746963227d7d","51088  >  7000 Len=167"
"78","25.554822","192.168.11.7","192.168.11.28","TCP","74","","0.006593000","Jan  8, 2024 10:29:38.593787000 JST","","58122  >  6000 [SYN] Seq=0 Win=64240 Len=0 MSS=1460 SACK_PERM TSval=612762668 TSecr=0 WS=128"
"79","25.554955","192.168.11.28","192.168.11.7","TCP","74","0.000133000","0.000133000","Jan  8, 2024 10:29:38.593920000 JST","","6000  >  58122 [SYN, ACK] Seq=0 Ack=1 Win=65160 Len=0 MSS=1460 SACK_PERM TSval=2659306448 TSecr=612762668 WS=128"
"80","25.561721","192.168.11.7","192.168.11.28","TCP","66","0.006766000","0.006766000","Jan  8, 2024 10:29:38.600686000 JST","","58122  >  6000 [ACK] Seq=1 Ack=1 Win=64256 Len=0 TSval=612762676 TSecr=2659306448"
"81","25.562378","192.168.11.7","192.168.11.28","TCP","93","","0.000657000","Jan  8, 2024 10:29:38.601343000 JST","","58122  >  6000 [PSH, ACK] Seq=1 Ack=1 Win=64256 Len=27 TSval=612762676 TSecr=2659306448 [TCP segment of a reassembled PDU]"
"82","25.562481","192.168.11.28","192.168.11.7","TCP","66","0.000103000","0.000103000","Jan  8, 2024 10:29:38.601446000 JST","","6000  >  58122 [ACK] Seq=1 Ack=28 Win=65152 Len=0 TSval=2659306456 TSecr=612762676"
"83","25.562552","192.168.11.7","192.168.11.28","TCP","66","","0.000071000","Jan  8, 2024 10:29:38.601517000 JST","","58122  >  6000 [FIN, ACK] Seq=28 Ack=1 Win=64256 Len=0 TSval=612762676 TSecr=2659306448"
"84","25.564924","192.168.11.28","192.168.11.7","TCP","66","0.002372000","0.002372000","Jan  8, 2024 10:29:38.603889000 JST","","6000  >  58122 [FIN, ACK] Seq=1 Ack=29 Win=65152 Len=0 TSval=2659306458 TSecr=612762676"
"85","25.572361","192.168.11.7","192.168.11.28","TCP","66","0.007437000","0.007437000","Jan  8, 2024 10:29:38.611326000 JST","","58122  >  6000 [ACK] Seq=29 Ack=2 Win=64256 Len=0 TSval=612762686 TSecr=2659306458"
"86","31.600580","192.168.11.28","192.168.11.21","TCP","74","","6.028219000","Jan  8, 2024 10:29:44.639545000 JST","","38596  >  6000 [SYN] Seq=0 Win=64240 Len=0 MSS=1460 SACK_PERM TSval=3503010755 TSecr=0 WS=128"
"87","31.607641","192.168.11.21","192.168.11.28","TCP","74","0.007061000","0.007061000","Jan  8, 2024 10:29:44.646606000 JST","","6000  >  38596 [SYN, ACK] Seq=0 Ack=1 Win=65160 Len=0 MSS=1460 SACK_PERM TSval=4202653595 TSecr=3503010755 WS=128"
"88","31.607761","192.168.11.28","192.168.11.21","TCP","66","0.000120000","0.000120000","Jan  8, 2024 10:29:44.646726000 JST","","38596  >  6000 [ACK] Seq=1 Ack=1 Win=64256 Len=0 TSval=3503010762 TSecr=4202653595"
"89","31.607935","192.168.11.28","192.168.11.21","TCP","93","","0.000174000","Jan  8, 2024 10:29:44.646900000 JST","","38596  >  6000 [PSH, ACK] Seq=1 Ack=1 Win=64256 Len=27 TSval=3503010762 TSecr=4202653595 [TCP segment of a reassembled PDU]"
"90","31.608041","192.168.11.28","192.168.11.21","TCP","66","","0.000106000","Jan  8, 2024 10:29:44.647006000 JST","","38596  >  6000 [FIN, ACK] Seq=28 Ack=1 Win=64256 Len=0 TSval=3503010762 TSecr=4202653595"
"91","31.615296","192.168.11.21","192.168.11.28","TCP","66","0.007361000","0.007255000","Jan  8, 2024 10:29:44.654261000 JST","","6000  >  38596 [ACK] Seq=1 Ack=28 Win=65152 Len=0 TSval=4202653603 TSecr=3503010762"
"92","31.615683","192.168.11.21","192.168.11.28","TCP","66","0.007642000","0.000387000","Jan  8, 2024 10:29:44.654648000 JST","","6000  >  38596 [FIN, ACK] Seq=1 Ack=29 Win=65152 Len=0 TSval=4202653604 TSecr=3503010762"
"93","31.615756","192.168.11.28","192.168.11.21","TCP","66","0.000073000","0.000073000","Jan  8, 2024 10:29:44.654721000 JST","","38596  >  6000 [ACK] Seq=29 Ack=2 Win=64256 Len=0 TSval=3503010770 TSecr=4202653604"
"94","31.644728","192.168.11.28","255.255.255.255","UDP","209","","0.028972000","Jan  8, 2024 10:29:44.683693000 JST","7b2273656d616e74696373223a207b22656e74697479223a2022504944222c202262617365656e74697479223a2022616e79222c2022726f6c65223a20226a6a6a222c20227370617469616c223a2022616e79222c202274656d706f72616c223a2022616e79227d2c20226461746170726f7065727479223a207b22666f726d6174223a2022696e616f6b615f70726f6772616d5f73616d706c655f73656d616e746963227d7d","50861  >  7000 Len=167"
"95","31.651453","192.168.11.7","192.168.11.28","TCP","74","","0.006725000","Jan  8, 2024 10:29:44.690418000 JST","","59550  >  6000 [SYN] Seq=0 Win=64240 Len=0 MSS=1460 SACK_PERM TSval=612768765 TSecr=0 WS=128"
"96","31.651597","192.168.11.28","192.168.11.7","TCP","74","0.000144000","0.000144000","Jan  8, 2024 10:29:44.690562000 JST","","6000  >  59550 [SYN, ACK] Seq=0 Ack=1 Win=65160 Len=0 MSS=1460 SACK_PERM TSval=2659312545 TSecr=612768765 WS=128"
"97","31.668905","192.168.11.7","192.168.11.28","TCP","66","0.017308000","0.017308000","Jan  8, 2024 10:29:44.707870000 JST","","59550  >  6000 [ACK] Seq=1 Ack=1 Win=64256 Len=0 TSval=612768776 TSecr=2659312545"
"98","31.669690","192.168.11.7","192.168.11.28","TCP","93","","0.000785000","Jan  8, 2024 10:29:44.708655000 JST","","59550  >  6000 [PSH, ACK] Seq=1 Ack=1 Win=64256 Len=27 TSval=612768776 TSecr=2659312545 [TCP segment of a reassembled PDU]"
"99","31.669832","192.168.11.28","192.168.11.7","TCP","66","0.000142000","0.000142000","Jan  8, 2024 10:29:44.708797000 JST","","6000  >  59550 [ACK] Seq=1 Ack=28 Win=65152 Len=0 TSval=2659312563 TSecr=612768776"
"100","31.669939","192.168.11.7","192.168.11.28","TCP","66","","0.000107000","Jan  8, 2024 10:29:44.708904000 JST","","59550  >  6000 [FIN, ACK] Seq=28 Ack=1 Win=64256 Len=0 TSval=612768776 TSecr=2659312545"
"101","31.671650","192.168.11.28","192.168.11.7","TCP","66","0.001711000","0.001711000","Jan  8, 2024 10:29:44.710615000 JST","","6000  >  59550 [FIN, ACK] Seq=1 Ack=29 Win=65152 Len=0 TSval=2659312565 TSecr=612768776"
"102","31.676435","192.168.11.7","192.168.11.28","TCP","66","0.004785000","0.004785000","Jan  8, 2024 10:29:44.715400000 JST","","59550  >  6000 [ACK] Seq=29 Ack=2 Win=64256 Len=0 TSval=612768791 TSecr=2659312565"
"103","37.721792","192.168.11.28","192.168.11.21","TCP","74","","6.045357000","Jan  8, 2024 10:29:50.760757000 JST","","48762  >  6000 [SYN] Seq=0 Win=64240 Len=0 MSS=1460 SACK_PERM TSval=3503016876 TSecr=0 WS=128"
"104","37.728941","192.168.11.21","192.168.11.28","TCP","74","0.007149000","0.007149000","Jan  8, 2024 10:29:50.767906000 JST","","6000  >  48762 [SYN, ACK] Seq=0 Ack=1 Win=65160 Len=0 MSS=1460 SACK_PERM TSval=4202659717 TSecr=3503016876 WS=128"
"105","37.729058","192.168.11.28","192.168.11.21","TCP","66","0.000117000","0.000117000","Jan  8, 2024 10:29:50.768023000 JST","","48762  >  6000 [ACK] Seq=1 Ack=1 Win=64256 Len=0 TSval=3503016883 TSecr=4202659717"
"106","37.729241","192.168.11.28","192.168.11.21","TCP","93","","0.000183000","Jan  8, 2024 10:29:50.768206000 JST","","48762  >  6000 [PSH, ACK] Seq=1 Ack=1 Win=64256 Len=27 TSval=3503016884 TSecr=4202659717 [TCP segment of a reassembled PDU]"
"107","37.729362","192.168.11.28","192.168.11.21","TCP","66","","0.000121000","Jan  8, 2024 10:29:50.768327000 JST","","48762  >  6000 [FIN, ACK] Seq=28 Ack=1 Win=64256 Len=0 TSval=3503016884 TSecr=4202659717"
"108","37.737343","192.168.11.21","192.168.11.28","TCP","66","0.008102000","0.007981000","Jan  8, 2024 10:29:50.776308000 JST","","6000  >  48762 [ACK] Seq=1 Ack=28 Win=65152 Len=0 TSval=4202659725 TSecr=3503016884"
"109","37.739309","192.168.11.21","192.168.11.28","TCP","66","0.009947000","0.001966000","Jan  8, 2024 10:29:50.778274000 JST","","6000  >  48762 [FIN, ACK] Seq=1 Ack=29 Win=65152 Len=0 TSval=4202659727 TSecr=3503016884"
"110","37.739366","192.168.11.28","192.168.11.21","TCP","66","0.000057000","0.000057000","Jan  8, 2024 10:29:50.778331000 JST","","48762  >  6000 [ACK] Seq=29 Ack=2 Win=64256 Len=0 TSval=3503016894 TSecr=4202659727"
"111","37.767899","192.168.11.28","255.255.255.255","UDP","209","","0.028533000","Jan  8, 2024 10:29:50.806864000 JST","7b2273656d616e74696373223a207b22656e74697479223a2022504944222c202262617365656e74697479223a2022616e79222c2022726f6c65223a20226a6a6a222c20227370617469616c223a2022616e79222c202274656d706f72616c223a2022616e79227d2c20226461746170726f7065727479223a207b22666f726d6174223a2022696e616f6b615f70726f6772616d5f73616d706c655f73656d616e746963227d7d","40078  >  7000 Len=167"
"112","37.774983","192.168.11.7","192.168.11.28","TCP","74","","0.007084000","Jan  8, 2024 10:29:50.813948000 JST","","59566  >  6000 [SYN] Seq=0 Win=64240 Len=0 MSS=1460 SACK_PERM TSval=612774888 TSecr=0 WS=128"
"113","37.775155","192.168.11.28","192.168.11.7","TCP","74","0.000172000","0.000172000","Jan  8, 2024 10:29:50.814120000 JST","","6000  >  59566 [SYN, ACK] Seq=0 Ack=1 Win=65160 Len=0 MSS=1460 SACK_PERM TSval=2659318668 TSecr=612774888 WS=128"
"114","37.781765","192.168.11.7","192.168.11.28","TCP","66","0.006610000","0.006610000","Jan  8, 2024 10:29:50.820730000 JST","","59566  >  6000 [ACK] Seq=1 Ack=1 Win=64256 Len=0 TSval=612774896 TSecr=2659318668"
"115","37.782399","192.168.11.7","192.168.11.28","TCP","93","","0.000634000","Jan  8, 2024 10:29:50.821364000 JST","","59566  >  6000 [PSH, ACK] Seq=1 Ack=1 Win=64256 Len=27 TSval=612774897 TSecr=2659318668 [TCP segment of a reassembled PDU]"
"116","37.782524","192.168.11.28","192.168.11.7","TCP","66","0.000125000","0.000125000","Jan  8, 2024 10:29:50.821489000 JST","","6000  >  59566 [ACK] Seq=1 Ack=28 Win=65152 Len=0 TSval=2659318676 TSecr=612774897"
"117","37.782621","192.168.11.7","192.168.11.28","TCP","66","","0.000097000","Jan  8, 2024 10:29:50.821586000 JST","","59566  >  6000 [FIN, ACK] Seq=28 Ack=1 Win=64256 Len=0 TSval=612774897 TSecr=2659318668"
"118","37.784039","192.168.11.28","192.168.11.7","TCP","66","0.001418000","0.001418000","Jan  8, 2024 10:29:50.823004000 JST","","6000  >  59566 [FIN, ACK] Seq=1 Ack=29 Win=65152 Len=0 TSval=2659318677 TSecr=612774897"
"119","37.789860","192.168.11.7","192.168.11.28","TCP","66","0.005821000","0.005821000","Jan  8, 2024 10:29:50.828825000 JST","","59566  >  6000 [ACK] Seq=29 Ack=2 Win=64256 Len=0 TSval=612774904 TSecr=2659318677"
"120","43.842972","192.168.11.28","192.168.11.21","TCP","74","","6.053112000","Jan  8, 2024 10:29:56.881937000 JST","","54256  >  6000 [SYN] Seq=0 Win=64240 Len=0 MSS=1460 SACK_PERM TSval=3503022997 TSecr=0 WS=128"
"121","43.849853","192.168.11.21","192.168.11.28","TCP","74","0.006881000","0.006881000","Jan  8, 2024 10:29:56.888818000 JST","","6000  >  54256 [SYN, ACK] Seq=0 Ack=1 Win=65160 Len=0 MSS=1460 SACK_PERM TSval=4202665838 TSecr=3503022997 WS=128"
"122","43.849984","192.168.11.28","192.168.11.21","TCP","66","0.000131000","0.000131000","Jan  8, 2024 10:29:56.888949000 JST","","54256  >  6000 [ACK] Seq=1 Ack=1 Win=64256 Len=0 TSval=3503023004 TSecr=4202665838"
"123","43.850158","192.168.11.28","192.168.11.21","TCP","93","","0.000174000","Jan  8, 2024 10:29:56.889123000 JST","","54256  >  6000 [PSH, ACK] Seq=1 Ack=1 Win=64256 Len=27 TSval=3503023004 TSecr=4202665838 [TCP segment of a reassembled PDU]"
"124","43.850299","192.168.11.28","192.168.11.21","TCP","66","","0.000141000","Jan  8, 2024 10:29:56.889264000 JST","","54256  >  6000 [FIN, ACK] Seq=28 Ack=1 Win=64256 Len=0 TSval=3503023005 TSecr=4202665838"
"125","43.861794","192.168.11.21","192.168.11.28","TCP","66","0.011636000","0.011495000","Jan  8, 2024 10:29:56.900759000 JST","","6000  >  54256 [ACK] Seq=1 Ack=28 Win=65152 Len=0 TSval=4202665850 TSecr=3503023004"
"126","43.865098","192.168.11.21","192.168.11.28","TCP","66","0.014799000","0.003304000","Jan  8, 2024 10:29:56.904063000 JST","","6000  >  54256 [FIN, ACK] Seq=1 Ack=29 Win=65152 Len=0 TSval=4202665853 TSecr=3503023005"
"127","43.865160","192.168.11.28","192.168.11.21","TCP","66","0.000062000","0.000062000","Jan  8, 2024 10:29:56.904125000 JST","","54256  >  6000 [ACK] Seq=29 Ack=2 Win=64256 Len=0 TSval=3503023019 TSecr=4202665853"
"128","43.893548","192.168.11.28","255.255.255.255","UDP","209","","0.028388000","Jan  8, 2024 10:29:56.932513000 JST","7b2273656d616e74696373223a207b22656e74697479223a2022504944222c202262617365656e74697479223a2022616e79222c2022726f6c65223a20226a6a6a222c20227370617469616c223a2022616e79222c202274656d706f72616c223a2022616e79227d2c20226461746170726f7065727479223a207b22666f726d6174223a2022696e616f6b615f70726f6772616d5f73616d706c655f73656d616e746963227d7d","36313  >  7000 Len=167"
"129","43.899153","192.168.11.7","192.168.11.28","TCP","74","","0.005605000","Jan  8, 2024 10:29:56.938118000 JST","","54578  >  6000 [SYN] Seq=0 Win=64240 Len=0 MSS=1460 SACK_PERM TSval=612781014 TSecr=0 WS=128"
"130","43.899295","192.168.11.28","192.168.11.7","TCP","74","0.000142000","0.000142000","Jan  8, 2024 10:29:56.938260000 JST","","6000  >  54578 [SYN, ACK] Seq=0 Ack=1 Win=65160 Len=0 MSS=1460 SACK_PERM TSval=2659324793 TSecr=612781014 WS=128"
"131","43.905927","192.168.11.7","192.168.11.28","TCP","66","0.006632000","0.006632000","Jan  8, 2024 10:29:56.944892000 JST","","54578  >  6000 [ACK] Seq=1 Ack=1 Win=64256 Len=0 TSval=612781020 TSecr=2659324793"
"132","43.906549","192.168.11.7","192.168.11.28","TCP","93","","0.000622000","Jan  8, 2024 10:29:56.945514000 JST","","54578  >  6000 [PSH, ACK] Seq=1 Ack=1 Win=64256 Len=27 TSval=612781021 TSecr=2659324793 [TCP segment of a reassembled PDU]"
"133","43.906653","192.168.11.28","192.168.11.7","TCP","66","0.000104000","0.000104000","Jan  8, 2024 10:29:56.945618000 JST","","6000  >  54578 [ACK] Seq=1 Ack=28 Win=65152 Len=0 TSval=2659324800 TSecr=612781021"
"134","43.906715","192.168.11.7","192.168.11.28","TCP","66","","0.000062000","Jan  8, 2024 10:29:56.945680000 JST","","54578  >  6000 [FIN, ACK] Seq=28 Ack=1 Win=64256 Len=0 TSval=612781021 TSecr=2659324793"
"135","43.908668","192.168.11.28","192.168.11.7","TCP","66","0.001953000","0.001953000","Jan  8, 2024 10:29:56.947633000 JST","","6000  >  54578 [FIN, ACK] Seq=1 Ack=29 Win=65152 Len=0 TSval=2659324802 TSecr=612781021"
"136","43.913278","192.168.11.7","192.168.11.28","TCP","66","0.004610000","0.004610000","Jan  8, 2024 10:29:56.952243000 JST","","54578  >  6000 [ACK] Seq=29 Ack=2 Win=64256 Len=0 TSval=612781028 TSecr=2659324802"
"137","49.926715","192.168.11.28","192.168.11.21","TCP","74","","6.013437000","Jan  8, 2024 10:30:02.965680000 JST","","54260  >  6000 [SYN] Seq=0 Win=64240 Len=0 MSS=1460 SACK_PERM TSval=3503029081 TSecr=0 WS=128"
"138","49.933421","192.168.11.21","192.168.11.28","TCP","74","0.006706000","0.006706000","Jan  8, 2024 10:30:02.972386000 JST","","6000  >  54260 [SYN, ACK] Seq=0 Ack=1 Win=65160 Len=0 MSS=1460 SACK_PERM TSval=4202671922 TSecr=3503029081 WS=128"
"139","49.933527","192.168.11.28","192.168.11.21","TCP","66","0.000106000","0.000106000","Jan  8, 2024 10:30:02.972492000 JST","","54260  >  6000 [ACK] Seq=1 Ack=1 Win=64256 Len=0 TSval=3503029088 TSecr=4202671922"
"140","49.933700","192.168.11.28","192.168.11.21","TCP","93","","0.000173000","Jan  8, 2024 10:30:02.972665000 JST","","54260  >  6000 [PSH, ACK] Seq=1 Ack=1 Win=64256 Len=27 TSval=3503029088 TSecr=4202671922 [TCP segment of a reassembled PDU]"
"141","49.933812","192.168.11.28","192.168.11.21","TCP","66","","0.000112000","Jan  8, 2024 10:30:02.972777000 JST","","54260  >  6000 [FIN, ACK] Seq=28 Ack=1 Win=64256 Len=0 TSval=3503029088 TSecr=4202671922"
"142","49.940880","192.168.11.21","192.168.11.28","TCP","66","0.007180000","0.007068000","Jan  8, 2024 10:30:02.979845000 JST","","6000  >  54260 [ACK] Seq=1 Ack=28 Win=65152 Len=0 TSval=4202671929 TSecr=3503029088"
"143","49.941260","192.168.11.21","192.168.11.28","TCP","66","0.007448000","0.000380000","Jan  8, 2024 10:30:02.980225000 JST","","6000  >  54260 [FIN, ACK] Seq=1 Ack=29 Win=65152 Len=0 TSval=4202671930 TSecr=3503029088"
"144","49.941307","192.168.11.28","192.168.11.21","TCP","66","0.000047000","0.000047000","Jan  8, 2024 10:30:02.980272000 JST","","54260  >  6000 [ACK] Seq=29 Ack=2 Win=64256 Len=0 TSval=3503029096 TSecr=4202671930"
"145","49.970543","192.168.11.28","255.255.255.255","UDP","209","","0.029236000","Jan  8, 2024 10:30:03.009508000 JST","7b2273656d616e74696373223a207b22656e74697479223a2022504944222c202262617365656e74697479223a2022616e79222c2022726f6c65223a20226a6a6a222c20227370617469616c223a2022616e79222c202274656d706f72616c223a2022616e79227d2c20226461746170726f7065727479223a207b22666f726d6174223a2022696e616f6b615f70726f6772616d5f73616d706c655f73656d616e746963227d7d","49042  >  7000 Len=167"
"146","49.977119","192.168.11.7","192.168.11.28","TCP","74","","0.006576000","Jan  8, 2024 10:30:03.016084000 JST","","54590  >  6000 [SYN] Seq=0 Win=64240 Len=0 MSS=1460 SACK_PERM TSval=612787091 TSecr=0 WS=128"
"147","49.977257","192.168.11.28","192.168.11.7","TCP","74","0.000138000","0.000138000","Jan  8, 2024 10:30:03.016222000 JST","","6000  >  54590 [SYN, ACK] Seq=0 Ack=1 Win=65160 Len=0 MSS=1460 SACK_PERM TSval=2659330871 TSecr=612787091 WS=128"
"148","49.993095","192.168.11.7","192.168.11.28","TCP","66","0.015838000","0.015838000","Jan  8, 2024 10:30:03.032060000 JST","","54590  >  6000 [ACK] Seq=1 Ack=1 Win=64256 Len=0 TSval=612787098 TSecr=2659330871"
"149","49.993654","192.168.11.7","192.168.11.28","TCP","93","","0.000559000","Jan  8, 2024 10:30:03.032619000 JST","","54590  >  6000 [PSH, ACK] Seq=1 Ack=1 Win=64256 Len=27 TSval=612787099 TSecr=2659330871 [TCP segment of a reassembled PDU]"
"150","49.993728","192.168.11.28","192.168.11.7","TCP","66","0.000074000","0.000074000","Jan  8, 2024 10:30:03.032693000 JST","","6000  >  54590 [ACK] Seq=1 Ack=28 Win=65152 Len=0 TSval=2659330887 TSecr=612787099"
"151","49.993798","192.168.11.7","192.168.11.28","TCP","66","","0.000070000","Jan  8, 2024 10:30:03.032763000 JST","","54590  >  6000 [FIN, ACK] Seq=28 Ack=1 Win=64256 Len=0 TSval=612787099 TSecr=2659330871"
"152","49.995164","192.168.11.28","192.168.11.7","TCP","66","0.001366000","0.001366000","Jan  8, 2024 10:30:03.034129000 JST","","6000  >  54590 [FIN, ACK] Seq=1 Ack=29 Win=65152 Len=0 TSval=2659330888 TSecr=612787099"
"153","50.001034","192.168.11.7","192.168.11.28","TCP","66","0.005870000","0.005870000","Jan  8, 2024 10:30:03.039999000 JST","","54590  >  6000 [ACK] Seq=29 Ack=2 Win=64256 Len=0 TSval=612787115 TSecr=2659330888"
"154","56.048510","192.168.11.28","192.168.11.21","TCP","74","","6.047476000","Jan  8, 2024 10:30:09.087475000 JST","","38008  >  6000 [SYN] Seq=0 Win=64240 Len=0 MSS=1460 SACK_PERM TSval=3503035203 TSecr=0 WS=128"
"155","56.055233","192.168.11.21","192.168.11.28","TCP","74","0.006723000","0.006723000","Jan  8, 2024 10:30:09.094198000 JST","","6000  >  38008 [SYN, ACK] Seq=0 Ack=1 Win=65160 Len=0 MSS=1460 SACK_PERM TSval=4202678043 TSecr=3503035203 WS=128"
"156","56.055363","192.168.11.28","192.168.11.21","TCP","66","0.000130000","0.000130000","Jan  8, 2024 10:30:09.094328000 JST","","38008  >  6000 [ACK] Seq=1 Ack=1 Win=64256 Len=0 TSval=3503035210 TSecr=4202678043"
"157","56.055537","192.168.11.28","192.168.11.21","TCP","93","","0.000174000","Jan  8, 2024 10:30:09.094502000 JST","","38008  >  6000 [PSH, ACK] Seq=1 Ack=1 Win=64256 Len=27 TSval=3503035210 TSecr=4202678043 [TCP segment of a reassembled PDU]"
"158","56.055642","192.168.11.28","192.168.11.21","TCP","66","","0.000105000","Jan  8, 2024 10:30:09.094607000 JST","","38008  >  6000 [FIN, ACK] Seq=28 Ack=1 Win=64256 Len=0 TSval=3503035210 TSecr=4202678043"
"159","56.063728","192.168.11.21","192.168.11.28","TCP","66","0.008191000","0.008086000","Jan  8, 2024 10:30:09.102693000 JST","","6000  >  38008 [ACK] Seq=1 Ack=28 Win=65152 Len=0 TSval=4202678052 TSecr=3503035210"
"160","56.064103","192.168.11.21","192.168.11.28","TCP","66","0.008461000","0.000375000","Jan  8, 2024 10:30:09.103068000 JST","","6000  >  38008 [FIN, ACK] Seq=1 Ack=29 Win=65152 Len=0 TSval=4202678053 TSecr=3503035210"
"161","56.064189","192.168.11.28","192.168.11.21","TCP","66","0.000086000","0.000086000","Jan  8, 2024 10:30:09.103154000 JST","","38008  >  6000 [ACK] Seq=29 Ack=2 Win=64256 Len=0 TSval=3503035218 TSecr=4202678053"
"162","56.093428","192.168.11.28","255.255.255.255","UDP","209","","0.029239000","Jan  8, 2024 10:30:09.132393000 JST","7b2273656d616e74696373223a207b22656e74697479223a2022504944222c202262617365656e74697479223a2022616e79222c2022726f6c65223a20226a6a6a222c20227370617469616c223a2022616e79222c202274656d706f72616c223a2022616e79227d2c20226461746170726f7065727479223a207b22666f726d6174223a2022696e616f6b615f70726f6772616d5f73616d706c655f73656d616e746963227d7d","44512  >  7000 Len=167"
"163","56.099089","192.168.11.7","192.168.11.28","TCP","74","","0.005661000","Jan  8, 2024 10:30:09.138054000 JST","","60346  >  6000 [SYN] Seq=0 Win=64240 Len=0 MSS=1460 SACK_PERM TSval=612793214 TSecr=0 WS=128"
"164","56.099225","192.168.11.28","192.168.11.7","TCP","74","0.000136000","0.000136000","Jan  8, 2024 10:30:09.138190000 JST","","6000  >  60346 [SYN, ACK] Seq=0 Ack=1 Win=65160 Len=0 MSS=1460 SACK_PERM TSval=2659336993 TSecr=612793214 WS=128"
"165","56.106030","192.168.11.7","192.168.11.28","TCP","66","0.006805000","0.006805000","Jan  8, 2024 10:30:09.144995000 JST","","60346  >  6000 [ACK] Seq=1 Ack=1 Win=64256 Len=0 TSval=612793220 TSecr=2659336993"
"166","56.106598","192.168.11.7","192.168.11.28","TCP","93","","0.000568000","Jan  8, 2024 10:30:09.145563000 JST","","60346  >  6000 [PSH, ACK] Seq=1 Ack=1 Win=64256 Len=27 TSval=612793221 TSecr=2659336993 [TCP segment of a reassembled PDU]"
"167","56.106688","192.168.11.28","192.168.11.7","TCP","66","0.000090000","0.000090000","Jan  8, 2024 10:30:09.145653000 JST","","6000  >  60346 [ACK] Seq=1 Ack=28 Win=65152 Len=0 TSval=2659337000 TSecr=612793221"
"168","56.106758","192.168.11.7","192.168.11.28","TCP","66","","0.000070000","Jan  8, 2024 10:30:09.145723000 JST","","60346  >  6000 [FIN, ACK] Seq=28 Ack=1 Win=64256 Len=0 TSval=612793221 TSecr=2659336993"
