"No.","Time","Source","Destination","Protocol","Length","The RTT to ACK the segment was","Time delta from previous captured frame","Arrival Time","Data","Info"
"1","0.000000","192.168.11.4","192.168.11.25","TCP","74","","0.000000000","Jan  8, 2024 10:29:13.260125000 JST","","49232  >  6000 [SYN] Seq=0 Win=64240 Len=0 MSS=1460 SACK_PERM TSval=2884785053 TSecr=0 WS=128"
"2","0.006582","192.168.11.25","192.168.11.4","TCP","74","0.006582000","0.006582000","Jan  8, 2024 10:29:13.266707000 JST","","6000  >  49232 [SYN, ACK] Seq=0 Ack=1 Win=65160 Len=0 MSS=1460 SACK_PERM TSval=2767822287 TSecr=2884785053 WS=128"
"3","0.006699","192.168.11.4","192.168.11.25","TCP","66","0.000117000","0.000117000","Jan  8, 2024 10:29:13.266824000 JST","","49232  >  6000 [ACK] Seq=1 Ack=1 Win=64256 Len=0 TSval=2884785060 TSecr=2767822287"
"4","0.006992","192.168.11.4","192.168.11.25","TCP","93","","0.000293000","Jan  8, 2024 10:29:13.267117000 JST","","49232  >  6000 [PSH, ACK] Seq=1 Ack=1 Win=64256 Len=27 TSval=2884785060 TSecr=2767822287 [TCP segment of a reassembled PDU]"
"5","0.007132","192.168.11.4","192.168.11.25","TCP","66","","0.000140000","Jan  8, 2024 10:29:13.267257000 JST","","49232  >  6000 [FIN, ACK] Seq=28 Ack=1 Win=64256 Len=0 TSval=2884785060 TSecr=2767822287"
"6","0.013817","192.168.11.25","192.168.11.4","TCP","66","0.006825000","0.006685000","Jan  8, 2024 10:29:13.273942000 JST","","6000  >  49232 [ACK] Seq=1 Ack=28 Win=65152 Len=0 TSval=2767822295 TSecr=2884785060"
"7","0.014054","192.168.11.25","192.168.11.4","TCP","66","0.006922000","0.000237000","Jan  8, 2024 10:29:13.274179000 JST","","6000  >  49232 [FIN, ACK] Seq=1 Ack=29 Win=65152 Len=0 TSval=2767822296 TSecr=2884785060"
"8","0.014100","192.168.11.4","192.168.11.25","TCP","66","0.000046000","0.000046000","Jan  8, 2024 10:29:13.274225000 JST","","49232  >  6000 [ACK] Seq=29 Ack=2 Win=64256 Len=0 TSval=2884785067 TSecr=2767822296"
"9","0.045419","192.168.11.4","255.255.255.255","UDP","209","","0.031319000","Jan  8, 2024 10:29:13.305544000 JST","7b2273656d616e74696373223a207b22656e74697479223a2022504944222c202262617365656e74697479223a2022616e79222c2022726f6c65223a20226e6e6e222c20227370617469616c223a2022616e79222c202274656d706f72616c223a2022616e79227d2c20226461746170726f7065727479223a207b22666f726d6174223a2022696e616f6b615f70726f6772616d5f73616d706c655f73656d616e746963227d7d","52106  >  7000 Len=167"
"10","0.061679","192.168.11.5","192.168.11.4","TCP","74","","0.016260000","Jan  8, 2024 10:29:13.321804000 JST","","33730  >  6000 [SYN] Seq=0 Win=64240 Len=0 MSS=1460 SACK_PERM TSval=2029979840 TSecr=0 WS=128"
"11","0.061852","192.168.11.4","192.168.11.5","TCP","74","0.000173000","0.000173000","Jan  8, 2024 10:29:13.321977000 JST","","6000  >  33730 [SYN, ACK] Seq=0 Ack=1 Win=65160 Len=0 MSS=1460 SACK_PERM TSval=4073705197 TSecr=2029979840 WS=128"
"12","0.069942","192.168.11.5","192.168.11.4","TCP","66","0.008090000","0.008090000","Jan  8, 2024 10:29:13.330067000 JST","","33730  >  6000 [ACK] Seq=1 Ack=1 Win=64256 Len=0 TSval=2029979855 TSecr=4073705197"
"13","0.070535","192.168.11.5","192.168.11.4","TCP","93","","0.000593000","Jan  8, 2024 10:29:13.330660000 JST","","33730  >  6000 [PSH, ACK] Seq=1 Ack=1 Win=64256 Len=27 TSval=2029979855 TSecr=4073705197 [TCP segment of a reassembled PDU]"
"14","0.070640","192.168.11.4","192.168.11.5","TCP","66","0.000105000","0.000105000","Jan  8, 2024 10:29:13.330765000 JST","","6000  >  33730 [ACK] Seq=1 Ack=28 Win=65152 Len=0 TSval=4073705206 TSecr=2029979855"
"15","0.070716","192.168.11.5","192.168.11.4","TCP","66","","0.000076000","Jan  8, 2024 10:29:13.330841000 JST","","33730  >  6000 [FIN, ACK] Seq=28 Ack=1 Win=64256 Len=0 TSval=2029979856 TSecr=4073705197"
"16","0.072160","192.168.11.4","192.168.11.5","TCP","66","0.001444000","0.001444000","Jan  8, 2024 10:29:13.332285000 JST","","6000  >  33730 [FIN, ACK] Seq=1 Ack=29 Win=65152 Len=0 TSval=4073705207 TSecr=2029979856"
"17","0.079714","192.168.11.5","192.168.11.4","TCP","66","0.007554000","0.007554000","Jan  8, 2024 10:29:13.339839000 JST","","33730  >  6000 [ACK] Seq=29 Ack=2 Win=64256 Len=0 TSval=2029979863 TSecr=4073705207"
"18","6.156045","192.168.11.4","192.168.11.25","TCP","74","","6.076331000","Jan  8, 2024 10:29:19.416170000 JST","","49242  >  6000 [SYN] Seq=0 Win=64240 Len=0 MSS=1460 SACK_PERM TSval=2884791209 TSecr=0 WS=128"
"19","6.162702","192.168.11.25","192.168.11.4","TCP","74","0.006657000","0.006657000","Jan  8, 2024 10:29:19.422827000 JST","","6000  >  49242 [SYN, ACK] Seq=0 Ack=1 Win=65160 Len=0 MSS=1460 SACK_PERM TSval=2767828443 TSecr=2884791209 WS=128"
"20","6.162817","192.168.11.4","192.168.11.25","TCP","66","0.000115000","0.000115000","Jan  8, 2024 10:29:19.422942000 JST","","49242  >  6000 [ACK] Seq=1 Ack=1 Win=64256 Len=0 TSval=2884791216 TSecr=2767828443"
"21","6.163003","192.168.11.4","192.168.11.25","TCP","93","","0.000186000","Jan  8, 2024 10:29:19.423128000 JST","","49242  >  6000 [PSH, ACK] Seq=1 Ack=1 Win=64256 Len=27 TSval=2884791216 TSecr=2767828443 [TCP segment of a reassembled PDU]"
"22","6.163130","192.168.11.4","192.168.11.25","TCP","66","","0.000127000","Jan  8, 2024 10:29:19.423255000 JST","","49242  >  6000 [FIN, ACK] Seq=28 Ack=1 Win=64256 Len=0 TSval=2884791216 TSecr=2767828443"
"23","6.170287","192.168.11.25","192.168.11.4","TCP","66","0.007284000","0.007157000","Jan  8, 2024 10:29:19.430412000 JST","","6000  >  49242 [ACK] Seq=1 Ack=28 Win=65152 Len=0 TSval=2767828451 TSecr=2884791216"
"24","6.170525","192.168.11.25","192.168.11.4","TCP","66","0.007395000","0.000238000","Jan  8, 2024 10:29:19.430650000 JST","","6000  >  49242 [FIN, ACK] Seq=1 Ack=29 Win=65152 Len=0 TSval=2767828453 TSecr=2884791216"
"25","6.170579","192.168.11.4","192.168.11.25","TCP","66","0.000054000","0.000054000","Jan  8, 2024 10:29:19.430704000 JST","","49242  >  6000 [ACK] Seq=29 Ack=2 Win=64256 Len=0 TSval=2884791224 TSecr=2767828453"
"26","6.204288","192.168.11.4","255.255.255.255","UDP","209","","0.033709000","Jan  8, 2024 10:29:19.464413000 JST","7b2273656d616e74696373223a207b22656e74697479223a2022504944222c202262617365656e74697479223a2022616e79222c2022726f6c65223a20226e6e6e222c20227370617469616c223a2022616e79222c202274656d706f72616c223a2022616e79227d2c20226461746170726f7065727479223a207b22666f726d6174223a2022696e616f6b615f70726f6772616d5f73616d706c655f73656d616e746963227d7d","48328  >  7000 Len=167"
"27","6.211843","192.168.11.5","192.168.11.4","TCP","74","","0.007555000","Jan  8, 2024 10:29:19.471968000 JST","","33736  >  6000 [SYN] Seq=0 Win=64240 Len=0 MSS=1460 SACK_PERM TSval=2029985997 TSecr=0 WS=128"
"28","6.211980","192.168.11.4","192.168.11.5","TCP","74","0.000137000","0.000137000","Jan  8, 2024 10:29:19.472105000 JST","","6000  >  33736 [SYN, ACK] Seq=0 Ack=1 Win=65160 Len=0 MSS=1460 SACK_PERM TSval=4073711347 TSecr=2029985997 WS=128"
"29","6.218640","192.168.11.5","192.168.11.4","TCP","66","0.006660000","0.006660000","Jan  8, 2024 10:29:19.478765000 JST","","33736  >  6000 [ACK] Seq=1 Ack=1 Win=64256 Len=0 TSval=2029986004 TSecr=4073711347"
"30","6.219308","192.168.11.5","192.168.11.4","TCP","93","","0.000668000","Jan  8, 2024 10:29:19.479433000 JST","","33736  >  6000 [PSH, ACK] Seq=1 Ack=1 Win=64256 Len=27 TSval=2029986004 TSecr=4073711347 [TCP segment of a reassembled PDU]"
"31","6.219431","192.168.11.4","192.168.11.5","TCP","66","0.000123000","0.000123000","Jan  8, 2024 10:29:19.479556000 JST","","6000  >  33736 [ACK] Seq=1 Ack=28 Win=65152 Len=0 TSval=4073711354 TSecr=2029986004"
"32","6.219519","192.168.11.5","192.168.11.4","TCP","66","","0.000088000","Jan  8, 2024 10:29:19.479644000 JST","","33736  >  6000 [FIN, ACK] Seq=28 Ack=1 Win=64256 Len=0 TSval=2029986004 TSecr=4073711347"
"33","6.221104","192.168.11.4","192.168.11.5","TCP","66","0.001585000","0.001585000","Jan  8, 2024 10:29:19.481229000 JST","","6000  >  33736 [FIN, ACK] Seq=1 Ack=29 Win=65152 Len=0 TSval=4073711356 TSecr=2029986004"
"34","6.226057","192.168.11.5","192.168.11.4","TCP","66","0.004953000","0.004953000","Jan  8, 2024 10:29:19.486182000 JST","","33736  >  6000 [ACK] Seq=29 Ack=2 Win=64256 Len=0 TSval=2029986012 TSecr=4073711356"
"35","12.254652","192.168.11.4","192.168.11.25","TCP","74","","6.028595000","Jan  8, 2024 10:29:25.514777000 JST","","57280  >  6000 [SYN] Seq=0 Win=64240 Len=0 MSS=1460 SACK_PERM TSval=2884797308 TSecr=0 WS=128"
"36","12.261249","192.168.11.25","192.168.11.4","TCP","74","0.006597000","0.006597000","Jan  8, 2024 10:29:25.521374000 JST","","6000  >  57280 [SYN, ACK] Seq=0 Ack=1 Win=65160 Len=0 MSS=1460 SACK_PERM TSval=2767834542 TSecr=2884797308 WS=128"
"37","12.261356","192.168.11.4","192.168.11.25","TCP","66","0.000107000","0.000107000","Jan  8, 2024 10:29:25.521481000 JST","","57280  >  6000 [ACK] Seq=1 Ack=1 Win=64256 Len=0 TSval=2884797314 TSecr=2767834542"
"38","12.261523","192.168.11.4","192.168.11.25","TCP","93","","0.000167000","Jan  8, 2024 10:29:25.521648000 JST","","57280  >  6000 [PSH, ACK] Seq=1 Ack=1 Win=64256 Len=27 TSval=2884797315 TSecr=2767834542 [TCP segment of a reassembled PDU]"
"39","12.261627","192.168.11.4","192.168.11.25","TCP","66","","0.000104000","Jan  8, 2024 10:29:25.521752000 JST","","57280  >  6000 [FIN, ACK] Seq=28 Ack=1 Win=64256 Len=0 TSval=2884797315 TSecr=2767834542"
"40","12.279330","192.168.11.25","192.168.11.4","TCP","66","0.017807000","0.017703000","Jan  8, 2024 10:29:25.539455000 JST","","6000  >  57280 [ACK] Seq=1 Ack=28 Win=65152 Len=0 TSval=2767834560 TSecr=2884797315"
"41","12.279691","192.168.11.25","192.168.11.4","TCP","66","0.018064000","0.000361000","Jan  8, 2024 10:29:25.539816000 JST","","6000  >  57280 [FIN, ACK] Seq=1 Ack=29 Win=65152 Len=0 TSval=2767834561 TSecr=2884797315"
"42","12.279750","192.168.11.4","192.168.11.25","TCP","66","0.000059000","0.000059000","Jan  8, 2024 10:29:25.539875000 JST","","57280  >  6000 [ACK] Seq=29 Ack=2 Win=64256 Len=0 TSval=2884797333 TSecr=2767834561"
"43","12.307861","192.168.11.4","255.255.255.255","UDP","209","","0.028111000","Jan  8, 2024 10:29:25.567986000 JST","7b2273656d616e74696373223a207b22656e74697479223a2022504944222c202262617365656e74697479223a2022616e79222c2022726f6c65223a20226e6e6e222c20227370617469616c223a2022616e79222c202274656d706f72616c223a2022616e79227d2c20226461746170726f7065727479223a207b22666f726d6174223a2022696e616f6b615f70726f6772616d5f73616d706c655f73656d616e746963227d7d","43629  >  7000 Len=167"
"44","12.315380","192.168.11.5","192.168.11.4","TCP","74","","0.007519000","Jan  8, 2024 10:29:25.575505000 JST","","60610  >  6000 [SYN] Seq=0 Win=64240 Len=0 MSS=1460 SACK_PERM TSval=2029992101 TSecr=0 WS=128"
"45","12.315514","192.168.11.4","192.168.11.5","TCP","74","0.000134000","0.000134000","Jan  8, 2024 10:29:25.575639000 JST","","6000  >  60610 [SYN, ACK] Seq=0 Ack=1 Win=65160 Len=0 MSS=1460 SACK_PERM TSval=4073717451 TSecr=2029992101 WS=128"
"46","12.322451","192.168.11.5","192.168.11.4","TCP","66","0.006937000","0.006937000","Jan  8, 2024 10:29:25.582576000 JST","","60610  >  6000 [ACK] Seq=1 Ack=1 Win=64256 Len=0 TSval=2029992108 TSecr=4073717451"
"47","12.323026","192.168.11.5","192.168.11.4","TCP","93","","0.000575000","Jan  8, 2024 10:29:25.583151000 JST","","60610  >  6000 [PSH, ACK] Seq=1 Ack=1 Win=64256 Len=27 TSval=2029992108 TSecr=4073717451 [TCP segment of a reassembled PDU]"
"48","12.323144","192.168.11.4","192.168.11.5","TCP","66","0.000118000","0.000118000","Jan  8, 2024 10:29:25.583269000 JST","","6000  >  60610 [ACK] Seq=1 Ack=28 Win=65152 Len=0 TSval=4073717458 TSecr=2029992108"
"49","12.323222","192.168.11.5","192.168.11.4","TCP","66","","0.000078000","Jan  8, 2024 10:29:25.583347000 JST","","60610  >  6000 [FIN, ACK] Seq=28 Ack=1 Win=64256 Len=0 TSval=2029992108 TSecr=4073717451"
"50","12.324625","192.168.11.4","192.168.11.5","TCP","66","0.001403000","0.001403000","Jan  8, 2024 10:29:25.584750000 JST","","6000  >  60610 [FIN, ACK] Seq=1 Ack=29 Win=65152 Len=0 TSval=4073717460 TSecr=2029992108"
"51","12.331100","192.168.11.5","192.168.11.4","TCP","66","0.006475000","0.006475000","Jan  8, 2024 10:29:25.591225000 JST","","60610  >  6000 [ACK] Seq=29 Ack=2 Win=64256 Len=0 TSval=2029992116 TSecr=4073717460"
"52","18.372331","192.168.11.4","192.168.11.25","TCP","74","","6.041231000","Jan  8, 2024 10:29:31.632456000 JST","","57294  >  6000 [SYN] Seq=0 Win=64240 Len=0 MSS=1460 SACK_PERM TSval=2884803425 TSecr=0 WS=128"
"53","18.383070","192.168.11.25","192.168.11.4","TCP","74","0.010739000","0.010739000","Jan  8, 2024 10:29:31.643195000 JST","","6000  >  57294 [SYN, ACK] Seq=0 Ack=1 Win=65160 Len=0 MSS=1460 SACK_PERM TSval=2767840661 TSecr=2884803425 WS=128"
"54","18.383178","192.168.11.4","192.168.11.25","TCP","66","0.000108000","0.000108000","Jan  8, 2024 10:29:31.643303000 JST","","57294  >  6000 [ACK] Seq=1 Ack=1 Win=64256 Len=0 TSval=2884803436 TSecr=2767840661"
"55","18.383365","192.168.11.4","192.168.11.25","TCP","93","","0.000187000","Jan  8, 2024 10:29:31.643490000 JST","","57294  >  6000 [PSH, ACK] Seq=1 Ack=1 Win=64256 Len=27 TSval=2884803436 TSecr=2767840661 [TCP segment of a reassembled PDU]"
"56","18.383458","192.168.11.4","192.168.11.25","TCP","66","","0.000093000","Jan  8, 2024 10:29:31.643583000 JST","","57294  >  6000 [FIN, ACK] Seq=28 Ack=1 Win=64256 Len=0 TSval=2884803437 TSecr=2767840661"
"57","18.390587","192.168.11.25","192.168.11.4","TCP","66","0.007222000","0.007129000","Jan  8, 2024 10:29:31.650712000 JST","","6000  >  57294 [ACK] Seq=1 Ack=28 Win=65152 Len=0 TSval=2767840671 TSecr=2884803436"
"58","18.390953","192.168.11.25","192.168.11.4","TCP","66","0.007495000","0.000366000","Jan  8, 2024 10:29:31.651078000 JST","","6000  >  57294 [FIN, ACK] Seq=1 Ack=29 Win=65152 Len=0 TSval=2767840673 TSecr=2884803437"
"59","18.391004","192.168.11.4","192.168.11.25","TCP","66","0.000051000","0.000051000","Jan  8, 2024 10:29:31.651129000 JST","","57294  >  6000 [ACK] Seq=29 Ack=2 Win=64256 Len=0 TSval=2884803444 TSecr=2767840673"
"60","18.418792","192.168.11.4","255.255.255.255","UDP","209","","0.027788000","Jan  8, 2024 10:29:31.678917000 JST","7b2273656d616e74696373223a207b22656e74697479223a2022504944222c202262617365656e74697479223a2022616e79222c2022726f6c65223a20226e6e6e222c20227370617469616c223a2022616e79222c202274656d706f72616c223a2022616e79227d2c20226461746170726f7065727479223a207b22666f726d6174223a2022696e616f6b615f70726f6772616d5f73616d706c655f73656d616e746963227d7d","57269  >  7000 Len=167"
"61","18.426353","192.168.11.5","192.168.11.4","TCP","74","","0.007561000","Jan  8, 2024 10:29:31.686478000 JST","","41112  >  6000 [SYN] Seq=0 Win=64240 Len=0 MSS=1460 SACK_PERM TSval=2029998212 TSecr=0 WS=128"
"62","18.426494","192.168.11.4","192.168.11.5","TCP","74","0.000141000","0.000141000","Jan  8, 2024 10:29:31.686619000 JST","","6000  >  41112 [SYN, ACK] Seq=0 Ack=1 Win=65160 Len=0 MSS=1460 SACK_PERM TSval=4073723562 TSecr=2029998212 WS=128"
"63","18.433221","192.168.11.5","192.168.11.4","TCP","66","0.006727000","0.006727000","Jan  8, 2024 10:29:31.693346000 JST","","41112  >  6000 [ACK] Seq=1 Ack=1 Win=64256 Len=0 TSval=2029998219 TSecr=4073723562"
"64","18.433861","192.168.11.5","192.168.11.4","TCP","93","","0.000640000","Jan  8, 2024 10:29:31.693986000 JST","","41112  >  6000 [PSH, ACK] Seq=1 Ack=1 Win=64256 Len=27 TSval=2029998219 TSecr=4073723562 [TCP segment of a reassembled PDU]"
"65","18.433963","192.168.11.4","192.168.11.5","TCP","66","0.000102000","0.000102000","Jan  8, 2024 10:29:31.694088000 JST","","6000  >  41112 [ACK] Seq=1 Ack=28 Win=65152 Len=0 TSval=4073723569 TSecr=2029998219"
"66","18.434041","192.168.11.5","192.168.11.4","TCP","66","","0.000078000","Jan  8, 2024 10:29:31.694166000 JST","","41112  >  6000 [FIN, ACK] Seq=28 Ack=1 Win=64256 Len=0 TSval=2029998219 TSecr=4073723562"
"67","18.435407","192.168.11.4","192.168.11.5","TCP","66","0.001366000","0.001366000","Jan  8, 2024 10:29:31.695532000 JST","","6000  >  41112 [FIN, ACK] Seq=1 Ack=29 Win=65152 Len=0 TSval=4073723570 TSecr=2029998219"
"68","18.441516","192.168.11.5","192.168.11.4","TCP","66","0.006109000","0.006109000","Jan  8, 2024 10:29:31.701641000 JST","","41112  >  6000 [ACK] Seq=29 Ack=2 Win=64256 Len=0 TSval=2029998226 TSecr=4073723570"
"69","25.485429","192.168.11.4","192.168.11.25","TCP","74","","7.043913000","Jan  8, 2024 10:29:38.745554000 JST","","56474  >  6000 [SYN] Seq=0 Win=64240 Len=0 MSS=1460 SACK_PERM TSval=2884810538 TSecr=0 WS=128"
"70","25.492536","192.168.11.25","192.168.11.4","TCP","74","0.007107000","0.007107000","Jan  8, 2024 10:29:38.752661000 JST","","6000  >  56474 [SYN, ACK] Seq=0 Ack=1 Win=65160 Len=0 MSS=1460 SACK_PERM TSval=2767847773 TSecr=2884810538 WS=128"
"71","25.492658","192.168.11.4","192.168.11.25","TCP","66","0.000122000","0.000122000","Jan  8, 2024 10:29:38.752783000 JST","","56474  >  6000 [ACK] Seq=1 Ack=1 Win=64256 Len=0 TSval=2884810546 TSecr=2767847773"
"72","25.492841","192.168.11.4","192.168.11.25","TCP","93","","0.000183000","Jan  8, 2024 10:29:38.752966000 JST","","56474  >  6000 [PSH, ACK] Seq=1 Ack=1 Win=64256 Len=27 TSval=2884810546 TSecr=2767847773 [TCP segment of a reassembled PDU]"
"73","25.492960","192.168.11.4","192.168.11.25","TCP","66","","0.000119000","Jan  8, 2024 10:29:38.753085000 JST","","56474  >  6000 [FIN, ACK] Seq=28 Ack=1 Win=64256 Len=0 TSval=2884810546 TSecr=2767847773"
"74","25.500236","192.168.11.25","192.168.11.4","TCP","66","0.007395000","0.007276000","Jan  8, 2024 10:29:38.760361000 JST","","6000  >  56474 [ACK] Seq=1 Ack=28 Win=65152 Len=0 TSval=2767847781 TSecr=2884810546"
"75","25.500530","192.168.11.25","192.168.11.4","TCP","66","0.007570000","0.000294000","Jan  8, 2024 10:29:38.760655000 JST","","6000  >  56474 [FIN, ACK] Seq=1 Ack=29 Win=65152 Len=0 TSval=2767847783 TSecr=2884810546"
"76","25.500588","192.168.11.4","192.168.11.25","TCP","66","0.000058000","0.000058000","Jan  8, 2024 10:29:38.760713000 JST","","56474  >  6000 [ACK] Seq=29 Ack=2 Win=64256 Len=0 TSval=2884810554 TSecr=2767847783"
"77","25.529919","192.168.11.4","255.255.255.255","UDP","209","","0.029331000","Jan  8, 2024 10:29:38.790044000 JST","7b2273656d616e74696373223a207b22656e74697479223a2022504944222c202262617365656e74697479223a2022616e79222c2022726f6c65223a20226e6e6e222c20227370617469616c223a2022616e79222c202274656d706f72616c223a2022616e79227d2c20226461746170726f7065727479223a207b22666f726d6174223a2022696e616f6b615f70726f6772616d5f73616d706c655f73656d616e746963227d7d","38375  >  7000 Len=167"
"78","25.539098","192.168.11.5","192.168.11.4","TCP","74","","0.009179000","Jan  8, 2024 10:29:38.799223000 JST","","41128  >  6000 [SYN] Seq=0 Win=64240 Len=0 MSS=1460 SACK_PERM TSval=2030005323 TSecr=0 WS=128"
"79","25.539222","192.168.11.4","192.168.11.5","TCP","74","0.000124000","0.000124000","Jan  8, 2024 10:29:38.799347000 JST","","6000  >  41128 [SYN, ACK] Seq=0 Ack=1 Win=65160 Len=0 MSS=1460 SACK_PERM TSval=4073730674 TSecr=2030005323 WS=128"
"80","25.547537","192.168.11.5","192.168.11.4","TCP","66","0.008315000","0.008315000","Jan  8, 2024 10:29:38.807662000 JST","","41128  >  6000 [ACK] Seq=1 Ack=1 Win=64256 Len=0 TSval=2030005331 TSecr=4073730674"
"81","25.548037","192.168.11.5","192.168.11.4","TCP","93","","0.000500000","Jan  8, 2024 10:29:38.808162000 JST","","41128  >  6000 [PSH, ACK] Seq=1 Ack=1 Win=64256 Len=27 TSval=2030005332 TSecr=4073730674 [TCP segment of a reassembled PDU]"
"82","25.548128","192.168.11.4","192.168.11.5","TCP","66","0.000091000","0.000091000","Jan  8, 2024 10:29:38.808253000 JST","","6000  >  41128 [ACK] Seq=1 Ack=28 Win=65152 Len=0 TSval=4073730683 TSecr=2030005332"
"83","25.548197","192.168.11.5","192.168.11.4","TCP","66","","0.000069000","Jan  8, 2024 10:29:38.808322000 JST","","41128  >  6000 [FIN, ACK] Seq=28 Ack=1 Win=64256 Len=0 TSval=2030005332 TSecr=4073730674"
"84","25.549273","192.168.11.4","192.168.11.5","TCP","66","0.001076000","0.001076000","Jan  8, 2024 10:29:38.809398000 JST","","6000  >  41128 [FIN, ACK] Seq=1 Ack=29 Win=65152 Len=0 TSval=4073730684 TSecr=2030005332"
"85","25.555867","192.168.11.5","192.168.11.4","TCP","66","0.006594000","0.006594000","Jan  8, 2024 10:29:38.815992000 JST","","41128  >  6000 [ACK] Seq=29 Ack=2 Win=64256 Len=0 TSval=2030005341 TSecr=4073730684"
"86","31.591430","192.168.11.4","192.168.11.25","TCP","74","","6.035563000","Jan  8, 2024 10:29:44.851555000 JST","","42578  >  6000 [SYN] Seq=0 Win=64240 Len=0 MSS=1460 SACK_PERM TSval=2884816644 TSecr=0 WS=128"
"87","31.599517","192.168.11.25","192.168.11.4","TCP","74","0.008087000","0.008087000","Jan  8, 2024 10:29:44.859642000 JST","","6000  >  42578 [SYN, ACK] Seq=0 Ack=1 Win=65160 Len=0 MSS=1460 SACK_PERM TSval=2767853880 TSecr=2884816644 WS=128"
"88","31.599627","192.168.11.4","192.168.11.25","TCP","66","0.000110000","0.000110000","Jan  8, 2024 10:29:44.859752000 JST","","42578  >  6000 [ACK] Seq=1 Ack=1 Win=64256 Len=0 TSval=2884816653 TSecr=2767853880"
"89","31.599810","192.168.11.4","192.168.11.25","TCP","93","","0.000183000","Jan  8, 2024 10:29:44.859935000 JST","","42578  >  6000 [PSH, ACK] Seq=1 Ack=1 Win=64256 Len=27 TSval=2884816653 TSecr=2767853880 [TCP segment of a reassembled PDU]"
"90","31.599902","192.168.11.4","192.168.11.25","TCP","66","","0.000092000","Jan  8, 2024 10:29:44.860027000 JST","","42578  >  6000 [FIN, ACK] Seq=28 Ack=1 Win=64256 Len=0 TSval=2884816653 TSecr=2767853880"
"91","31.607226","192.168.11.25","192.168.11.4","TCP","66","0.007416000","0.007324000","Jan  8, 2024 10:29:44.867351000 JST","","6000  >  42578 [ACK] Seq=1 Ack=28 Win=65152 Len=0 TSval=2767853888 TSecr=2884816653"
"92","31.607459","192.168.11.25","192.168.11.4","TCP","66","0.007557000","0.000233000","Jan  8, 2024 10:29:44.867584000 JST","","6000  >  42578 [FIN, ACK] Seq=1 Ack=29 Win=65152 Len=0 TSval=2767853890 TSecr=2884816653"
"93","31.607511","192.168.11.4","192.168.11.25","TCP","66","0.000052000","0.000052000","Jan  8, 2024 10:29:44.867636000 JST","","42578  >  6000 [ACK] Seq=29 Ack=2 Win=64256 Len=0 TSval=2884816661 TSecr=2767853890"
"94","31.637616","192.168.11.4","255.255.255.255","UDP","209","","0.030105000","Jan  8, 2024 10:29:44.897741000 JST","7b2273656d616e74696373223a207b22656e74697479223a2022504944222c202262617365656e74697479223a2022616e79222c2022726f6c65223a20226e6e6e222c20227370617469616c223a2022616e79222c202274656d706f72616c223a2022616e79227d2c20226461746170726f7065727479223a207b22666f726d6174223a2022696e616f6b615f70726f6772616d5f73616d706c655f73656d616e746963227d7d","56241  >  7000 Len=167"
"95","31.645088","192.168.11.5","192.168.11.4","TCP","74","","0.007472000","Jan  8, 2024 10:29:44.905213000 JST","","33104  >  6000 [SYN] Seq=0 Win=64240 Len=0 MSS=1460 SACK_PERM TSval=2030011431 TSecr=0 WS=128"
"96","31.645226","192.168.11.4","192.168.11.5","TCP","74","0.000138000","0.000138000","Jan  8, 2024 10:29:44.905351000 JST","","6000  >  33104 [SYN, ACK] Seq=0 Ack=1 Win=65160 Len=0 MSS=1460 SACK_PERM TSval=4073736780 TSecr=2030011431 WS=128"
"97","31.661110","192.168.11.5","192.168.11.4","TCP","66","0.015884000","0.015884000","Jan  8, 2024 10:29:44.921235000 JST","","33104  >  6000 [ACK] Seq=1 Ack=1 Win=64256 Len=0 TSval=2030011437 TSecr=4073736780"
"98","31.661799","192.168.11.5","192.168.11.4","TCP","93","","0.000689000","Jan  8, 2024 10:29:44.921924000 JST","","33104  >  6000 [PSH, ACK] Seq=1 Ack=1 Win=64256 Len=27 TSval=2030011438 TSecr=4073736780 [TCP segment of a reassembled PDU]"
"99","31.661946","192.168.11.4","192.168.11.5","TCP","66","0.000147000","0.000147000","Jan  8, 2024 10:29:44.922071000 JST","","6000  >  33104 [ACK] Seq=1 Ack=28 Win=65152 Len=0 TSval=4073736797 TSecr=2030011438"
"100","31.662037","192.168.11.5","192.168.11.4","TCP","66","","0.000091000","Jan  8, 2024 10:29:44.922162000 JST","","33104  >  6000 [FIN, ACK] Seq=28 Ack=1 Win=64256 Len=0 TSval=2030011438 TSecr=4073736780"
"101","31.663506","192.168.11.4","192.168.11.5","TCP","66","0.001469000","0.001469000","Jan  8, 2024 10:29:44.923631000 JST","","6000  >  33104 [FIN, ACK] Seq=1 Ack=29 Win=65152 Len=0 TSval=4073736799 TSecr=2030011438"
"102","31.669177","192.168.11.5","192.168.11.4","TCP","66","0.005671000","0.005671000","Jan  8, 2024 10:29:44.929302000 JST","","33104  >  6000 [ACK] Seq=29 Ack=2 Win=64256 Len=0 TSval=2030011455 TSecr=4073736799"
"103","37.702587","192.168.11.4","192.168.11.25","TCP","74","","6.033410000","Jan  8, 2024 10:29:50.962712000 JST","","42590  >  6000 [SYN] Seq=0 Win=64240 Len=0 MSS=1460 SACK_PERM TSval=2884822756 TSecr=0 WS=128"
"104","37.709247","192.168.11.25","192.168.11.4","TCP","74","0.006660000","0.006660000","Jan  8, 2024 10:29:50.969372000 JST","","6000  >  42590 [SYN, ACK] Seq=0 Ack=1 Win=65160 Len=0 MSS=1460 SACK_PERM TSval=2767859990 TSecr=2884822756 WS=128"
"105","37.709361","192.168.11.4","192.168.11.25","TCP","66","0.000114000","0.000114000","Jan  8, 2024 10:29:50.969486000 JST","","42590  >  6000 [ACK] Seq=1 Ack=1 Win=64256 Len=0 TSval=2884822762 TSecr=2767859990"
"106","37.709547","192.168.11.4","192.168.11.25","TCP","93","","0.000186000","Jan  8, 2024 10:29:50.969672000 JST","","42590  >  6000 [PSH, ACK] Seq=1 Ack=1 Win=64256 Len=27 TSval=2884822763 TSecr=2767859990 [TCP segment of a reassembled PDU]"
"107","37.709639","192.168.11.4","192.168.11.25","TCP","66","","0.000092000","Jan  8, 2024 10:29:50.969764000 JST","","42590  >  6000 [FIN, ACK] Seq=28 Ack=1 Win=64256 Len=0 TSval=2884822763 TSecr=2767859990"
"108","37.716796","192.168.11.25","192.168.11.4","TCP","66","0.007249000","0.007157000","Jan  8, 2024 10:29:50.976921000 JST","","6000  >  42590 [ACK] Seq=1 Ack=28 Win=65152 Len=0 TSval=2767859997 TSecr=2884822763"
"109","37.717027","192.168.11.25","192.168.11.4","TCP","66","0.007388000","0.000231000","Jan  8, 2024 10:29:50.977152000 JST","","6000  >  42590 [FIN, ACK] Seq=1 Ack=29 Win=65152 Len=0 TSval=2767859999 TSecr=2884822763"
"110","37.717081","192.168.11.4","192.168.11.25","TCP","66","0.000054000","0.000054000","Jan  8, 2024 10:29:50.977206000 JST","","42590  >  6000 [ACK] Seq=29 Ack=2 Win=64256 Len=0 TSval=2884822770 TSecr=2767859999"
"111","37.748785","192.168.11.4","255.255.255.255","UDP","209","","0.031704000","Jan  8, 2024 10:29:51.008910000 JST","7b2273656d616e74696373223a207b22656e74697479223a2022504944222c202262617365656e74697479223a2022616e79222c2022726f6c65223a20226e6e6e222c20227370617469616c223a2022616e79222c202274656d706f72616c223a2022616e79227d2c20226461746170726f7065727479223a207b22666f726d6174223a2022696e616f6b615f70726f6772616d5f73616d706c655f73656d616e746963227d7d","54259  >  7000 Len=167"
"112","37.756182","192.168.11.5","192.168.11.4","TCP","74","","0.007397000","Jan  8, 2024 10:29:51.016307000 JST","","40662  >  6000 [SYN] Seq=0 Win=64240 Len=0 MSS=1460 SACK_PERM TSval=2030017542 TSecr=0 WS=128"
"113","37.756326","192.168.11.4","192.168.11.5","TCP","74","0.000144000","0.000144000","Jan  8, 2024 10:29:51.016451000 JST","","6000  >  40662 [SYN, ACK] Seq=0 Ack=1 Win=65160 Len=0 MSS=1460 SACK_PERM TSval=4073742891 TSecr=2030017542 WS=128"
"114","37.764349","192.168.11.5","192.168.11.4","TCP","66","0.008023000","0.008023000","Jan  8, 2024 10:29:51.024474000 JST","","40662  >  6000 [ACK] Seq=1 Ack=1 Win=64256 Len=0 TSval=2030017548 TSecr=4073742891"
"115","37.765019","192.168.11.5","192.168.11.4","TCP","93","","0.000670000","Jan  8, 2024 10:29:51.025144000 JST","","40662  >  6000 [PSH, ACK] Seq=1 Ack=1 Win=64256 Len=27 TSval=2030017549 TSecr=4073742891 [TCP segment of a reassembled PDU]"
"116","37.765151","192.168.11.4","192.168.11.5","TCP","66","0.000132000","0.000132000","Jan  8, 2024 10:29:51.025276000 JST","","6000  >  40662 [ACK] Seq=1 Ack=28 Win=65152 Len=0 TSval=4073742900 TSecr=2030017549"
"117","37.765225","192.168.11.5","192.168.11.4","TCP","66","","0.000074000","Jan  8, 2024 10:29:51.025350000 JST","","40662  >  6000 [FIN, ACK] Seq=28 Ack=1 Win=64256 Len=0 TSval=2030017549 TSecr=4073742891"
"118","37.767064","192.168.11.4","192.168.11.5","TCP","66","0.001839000","0.001839000","Jan  8, 2024 10:29:51.027189000 JST","","6000  >  40662 [FIN, ACK] Seq=1 Ack=29 Win=65152 Len=0 TSval=4073742902 TSecr=2030017549"
"119","37.771541","192.168.11.5","192.168.11.4","TCP","66","0.004477000","0.004477000","Jan  8, 2024 10:29:51.031666000 JST","","40662  >  6000 [ACK] Seq=29 Ack=2 Win=64256 Len=0 TSval=2030017557 TSecr=4073742902"
"120","43.829305","192.168.11.4","192.168.11.25","TCP","74","","6.057764000","Jan  8, 2024 10:29:57.089430000 JST","","42658  >  6000 [SYN] Seq=0 Win=64240 Len=0 MSS=1460 SACK_PERM TSval=2884828882 TSecr=0 WS=128"
"121","43.835860","192.168.11.25","192.168.11.4","TCP","74","0.006555000","0.006555000","Jan  8, 2024 10:29:57.095985000 JST","","6000  >  42658 [SYN, ACK] Seq=0 Ack=1 Win=65160 Len=0 MSS=1460 SACK_PERM TSval=2767866117 TSecr=2884828882 WS=128"
"122","43.835963","192.168.11.4","192.168.11.25","TCP","66","0.000103000","0.000103000","Jan  8, 2024 10:29:57.096088000 JST","","42658  >  6000 [ACK] Seq=1 Ack=1 Win=64256 Len=0 TSval=2884828889 TSecr=2767866117"
"123","43.836137","192.168.11.4","192.168.11.25","TCP","93","","0.000174000","Jan  8, 2024 10:29:57.096262000 JST","","42658  >  6000 [PSH, ACK] Seq=1 Ack=1 Win=64256 Len=27 TSval=2884828889 TSecr=2767866117 [TCP segment of a reassembled PDU]"
"124","43.836262","192.168.11.4","192.168.11.25","TCP","66","","0.000125000","Jan  8, 2024 10:29:57.096387000 JST","","42658  >  6000 [FIN, ACK] Seq=28 Ack=1 Win=64256 Len=0 TSval=2884828889 TSecr=2767866117"
"125","43.843307","192.168.11.25","192.168.11.4","TCP","66","0.007170000","0.007045000","Jan  8, 2024 10:29:57.103432000 JST","","6000  >  42658 [ACK] Seq=1 Ack=28 Win=65152 Len=0 TSval=2767866124 TSecr=2884828889"
"126","43.843519","192.168.11.25","192.168.11.4","TCP","66","0.007257000","0.000212000","Jan  8, 2024 10:29:57.103644000 JST","","6000  >  42658 [FIN, ACK] Seq=1 Ack=29 Win=65152 Len=0 TSval=2767866126 TSecr=2884828889"
"127","43.843563","192.168.11.4","192.168.11.25","TCP","66","0.000044000","0.000044000","Jan  8, 2024 10:29:57.103688000 JST","","42658  >  6000 [ACK] Seq=29 Ack=2 Win=64256 Len=0 TSval=2884828897 TSecr=2767866126"
"128","43.874206","192.168.11.4","255.255.255.255","UDP","209","","0.030643000","Jan  8, 2024 10:29:57.134331000 JST","7b2273656d616e74696373223a207b22656e74697479223a2022504944222c202262617365656e74697479223a2022616e79222c2022726f6c65223a20226e6e6e222c20227370617469616c223a2022616e79222c202274656d706f72616c223a2022616e79227d2c20226461746170726f7065727479223a207b22666f726d6174223a2022696e616f6b615f70726f6772616d5f73616d706c655f73656d616e746963227d7d","52380  >  7000 Len=167"
"129","43.882280","192.168.11.5","192.168.11.4","TCP","74","","0.008074000","Jan  8, 2024 10:29:57.142405000 JST","","40678  >  6000 [SYN] Seq=0 Win=64240 Len=0 MSS=1460 SACK_PERM TSval=2030023667 TSecr=0 WS=128"
"130","43.882450","192.168.11.4","192.168.11.5","TCP","74","0.000170000","0.000170000","Jan  8, 2024 10:29:57.142575000 JST","","6000  >  40678 [SYN, ACK] Seq=0 Ack=1 Win=65160 Len=0 MSS=1460 SACK_PERM TSval=4073749018 TSecr=2030023667 WS=128"
"131","43.889517","192.168.11.5","192.168.11.4","TCP","66","0.007067000","0.007067000","Jan  8, 2024 10:29:57.149642000 JST","","40678  >  6000 [ACK] Seq=1 Ack=1 Win=64256 Len=0 TSval=2030023675 TSecr=4073749018"
"132","43.890248","192.168.11.5","192.168.11.4","TCP","93","","0.000731000","Jan  8, 2024 10:29:57.150373000 JST","","40678  >  6000 [PSH, ACK] Seq=1 Ack=1 Win=64256 Len=27 TSval=2030023675 TSecr=4073749018 [TCP segment of a reassembled PDU]"
"133","43.890375","192.168.11.4","192.168.11.5","TCP","66","0.000127000","0.000127000","Jan  8, 2024 10:29:57.150500000 JST","","6000  >  40678 [ACK] Seq=1 Ack=28 Win=65152 Len=0 TSval=4073749025 TSecr=2030023675"
"134","43.890457","192.168.11.5","192.168.11.4","TCP","66","","0.000082000","Jan  8, 2024 10:29:57.150582000 JST","","40678  >  6000 [FIN, ACK] Seq=28 Ack=1 Win=64256 Len=0 TSval=2030023675 TSecr=4073749018"
"135","43.892690","192.168.11.4","192.168.11.5","TCP","66","0.002233000","0.002233000","Jan  8, 2024 10:29:57.152815000 JST","","6000  >  40678 [FIN, ACK] Seq=1 Ack=29 Win=65152 Len=0 TSval=4073749028 TSecr=2030023675"
"136","43.897618","192.168.11.5","192.168.11.4","TCP","66","0.004928000","0.004928000","Jan  8, 2024 10:29:57.157743000 JST","","40678  >  6000 [ACK] Seq=29 Ack=2 Win=64256 Len=0 TSval=2030023683 TSecr=4073749028"
"137","49.914305","192.168.11.4","192.168.11.25","TCP","74","","6.016687000","Jan  8, 2024 10:30:03.174430000 JST","","33004  >  6000 [SYN] Seq=0 Win=64240 Len=0 MSS=1460 SACK_PERM TSval=2884834967 TSecr=0 WS=128"
"138","49.924914","192.168.11.25","192.168.11.4","TCP","74","0.010609000","0.010609000","Jan  8, 2024 10:30:03.185039000 JST","","6000  >  33004 [SYN, ACK] Seq=0 Ack=1 Win=65160 Len=0 MSS=1460 SACK_PERM TSval=2767872203 TSecr=2884834967 WS=128"
"139","49.925038","192.168.11.4","192.168.11.25","TCP","66","0.000124000","0.000124000","Jan  8, 2024 10:30:03.185163000 JST","","33004  >  6000 [ACK] Seq=1 Ack=1 Win=64256 Len=0 TSval=2884834978 TSecr=2767872203"
"140","49.925224","192.168.11.4","192.168.11.25","TCP","93","","0.000186000","Jan  8, 2024 10:30:03.185349000 JST","","33004  >  6000 [PSH, ACK] Seq=1 Ack=1 Win=64256 Len=27 TSval=2884834978 TSecr=2767872203 [TCP segment of a reassembled PDU]"
"141","49.925350","192.168.11.4","192.168.11.25","TCP","66","","0.000126000","Jan  8, 2024 10:30:03.185475000 JST","","33004  >  6000 [FIN, ACK] Seq=28 Ack=1 Win=64256 Len=0 TSval=2884834978 TSecr=2767872203"
"142","49.935933","192.168.11.25","192.168.11.4","TCP","66","0.010709000","0.010583000","Jan  8, 2024 10:30:03.196058000 JST","","6000  >  33004 [ACK] Seq=1 Ack=28 Win=65152 Len=0 TSval=2767872213 TSecr=2884834978"
"143","49.942909","192.168.11.25","192.168.11.4","TCP","66","0.017559000","0.006976000","Jan  8, 2024 10:30:03.203034000 JST","","6000  >  33004 [FIN, ACK] Seq=1 Ack=29 Win=65152 Len=0 TSval=2767872215 TSecr=2884834978"
"144","49.942972","192.168.11.4","192.168.11.25","TCP","66","0.000063000","0.000063000","Jan  8, 2024 10:30:03.203097000 JST","","33004  >  6000 [ACK] Seq=29 Ack=2 Win=64256 Len=0 TSval=2884834996 TSecr=2767872215"
"145","49.972244","192.168.11.4","255.255.255.255","UDP","209","","0.029272000","Jan  8, 2024 10:30:03.232369000 JST","7b2273656d616e74696373223a207b22656e74697479223a2022504944222c202262617365656e74697479223a2022616e79222c2022726f6c65223a20226e6e6e222c20227370617469616c223a2022616e79222c202274656d706f72616c223a2022616e79227d2c20226461746170726f7065727479223a207b22666f726d6174223a2022696e616f6b615f70726f6772616d5f73616d706c655f73656d616e746963227d7d","52510  >  7000 Len=167"
"146","49.979726","192.168.11.5","192.168.11.4","TCP","74","","0.007482000","Jan  8, 2024 10:30:03.239851000 JST","","60222  >  6000 [SYN] Seq=0 Win=64240 Len=0 MSS=1460 SACK_PERM TSval=2030029765 TSecr=0 WS=128"
"147","49.979884","192.168.11.4","192.168.11.5","TCP","74","0.000158000","0.000158000","Jan  8, 2024 10:30:03.240009000 JST","","6000  >  60222 [SYN, ACK] Seq=0 Ack=1 Win=65160 Len=0 MSS=1460 SACK_PERM TSval=4073755115 TSecr=2030029765 WS=128"
"148","49.986940","192.168.11.5","192.168.11.4","TCP","66","0.007056000","0.007056000","Jan  8, 2024 10:30:03.247065000 JST","","60222  >  6000 [ACK] Seq=1 Ack=1 Win=64256 Len=0 TSval=2030029772 TSecr=4073755115"
"149","49.987613","192.168.11.5","192.168.11.4","TCP","93","","0.000673000","Jan  8, 2024 10:30:03.247738000 JST","","60222  >  6000 [PSH, ACK] Seq=1 Ack=1 Win=64256 Len=27 TSval=2030029772 TSecr=4073755115 [TCP segment of a reassembled PDU]"
"150","49.987723","192.168.11.4","192.168.11.5","TCP","66","0.000110000","0.000110000","Jan  8, 2024 10:30:03.247848000 JST","","6000  >  60222 [ACK] Seq=1 Ack=28 Win=65152 Len=0 TSval=4073755123 TSecr=2030029772"
"151","49.987799","192.168.11.5","192.168.11.4","TCP","66","","0.000076000","Jan  8, 2024 10:30:03.247924000 JST","","60222  >  6000 [FIN, ACK] Seq=28 Ack=1 Win=64256 Len=0 TSval=2030029772 TSecr=4073755115"
"152","49.989872","192.168.11.4","192.168.11.5","TCP","66","0.002073000","0.002073000","Jan  8, 2024 10:30:03.249997000 JST","","6000  >  60222 [FIN, ACK] Seq=1 Ack=29 Win=65152 Len=0 TSval=4073755125 TSecr=2030029772"
"153","49.996867","192.168.11.5","192.168.11.4","TCP","66","0.006995000","0.006995000","Jan  8, 2024 10:30:03.256992000 JST","","60222  >  6000 [ACK] Seq=29 Ack=2 Win=64256 Len=0 TSval=2030029782 TSecr=4073755125"
"154","56.030169","192.168.11.4","192.168.11.25","TCP","74","","6.033302000","Jan  8, 2024 10:30:09.290294000 JST","","33018  >  6000 [SYN] Seq=0 Win=64240 Len=0 MSS=1460 SACK_PERM TSval=2884841083 TSecr=0 WS=128"
"155","56.036726","192.168.11.25","192.168.11.4","TCP","74","0.006557000","0.006557000","Jan  8, 2024 10:30:09.296851000 JST","","6000  >  33018 [SYN, ACK] Seq=0 Ack=1 Win=65160 Len=0 MSS=1460 SACK_PERM TSval=2767878317 TSecr=2884841083 WS=128"
"156","56.036865","192.168.11.4","192.168.11.25","TCP","66","0.000139000","0.000139000","Jan  8, 2024 10:30:09.296990000 JST","","33018  >  6000 [ACK] Seq=1 Ack=1 Win=64256 Len=0 TSval=2884841090 TSecr=2767878317"
"157","56.037071","192.168.11.4","192.168.11.25","TCP","93","","0.000206000","Jan  8, 2024 10:30:09.297196000 JST","","33018  >  6000 [PSH, ACK] Seq=1 Ack=1 Win=64256 Len=27 TSval=2884841090 TSecr=2767878317 [TCP segment of a reassembled PDU]"
"158","56.037181","192.168.11.4","192.168.11.25","TCP","66","","0.000110000","Jan  8, 2024 10:30:09.297306000 JST","","33018  >  6000 [FIN, ACK] Seq=28 Ack=1 Win=64256 Len=0 TSval=2884841090 TSecr=2767878317"
"159","56.044292","192.168.11.25","192.168.11.4","TCP","66","0.007221000","0.007111000","Jan  8, 2024 10:30:09.304417000 JST","","6000  >  33018 [ACK] Seq=1 Ack=28 Win=65152 Len=0 TSval=2767878325 TSecr=2884841090"
"160","56.044568","192.168.11.25","192.168.11.4","TCP","66","0.007387000","0.000276000","Jan  8, 2024 10:30:09.304693000 JST","","6000  >  33018 [FIN, ACK] Seq=1 Ack=29 Win=65152 Len=0 TSval=2767878327 TSecr=2884841090"
"161","56.044631","192.168.11.4","192.168.11.25","TCP","66","0.000063000","0.000063000","Jan  8, 2024 10:30:09.304756000 JST","","33018  >  6000 [ACK] Seq=29 Ack=2 Win=64256 Len=0 TSval=2884841098 TSecr=2767878327"
"162","56.076260","192.168.11.4","255.255.255.255","UDP","209","","0.031629000","Jan  8, 2024 10:30:09.336385000 JST","7b2273656d616e74696373223a207b22656e74697479223a2022504944222c202262617365656e74697479223a2022616e79222c2022726f6c65223a20226e6e6e222c20227370617469616c223a2022616e79222c202274656d706f72616c223a2022616e79227d2c20226461746170726f7065727479223a207b22666f726d6174223a2022696e616f6b615f70726f6772616d5f73616d706c655f73656d616e746963227d7d","32834  >  7000 Len=167"
"163","56.083736","192.168.11.5","192.168.11.4","TCP","74","","0.007476000","Jan  8, 2024 10:30:09.343861000 JST","","60226  >  6000 [SYN] Seq=0 Win=64240 Len=0 MSS=1460 SACK_PERM TSval=2030035869 TSecr=0 WS=128"
"164","56.083961","192.168.11.4","192.168.11.5","TCP","74","0.000225000","0.000225000","Jan  8, 2024 10:30:09.344086000 JST","","6000  >  60226 [SYN, ACK] Seq=0 Ack=1 Win=65160 Len=0 MSS=1460 SACK_PERM TSval=4073761219 TSecr=2030035869 WS=128"
"165","56.090969","192.168.11.5","192.168.11.4","TCP","66","0.007008000","0.007008000","Jan  8, 2024 10:30:09.351094000 JST","","60226  >  6000 [ACK] Seq=1 Ack=1 Win=64256 Len=0 TSval=2030035876 TSecr=4073761219"
"166","56.091505","192.168.11.5","192.168.11.4","TCP","93","","0.000536000","Jan  8, 2024 10:30:09.351630000 JST","","60226  >  6000 [PSH, ACK] Seq=1 Ack=1 Win=64256 Len=27 TSval=2030035876 TSecr=4073761219 [TCP segment of a reassembled PDU]"
"167","56.091623","192.168.11.4","192.168.11.5","TCP","66","0.000118000","0.000118000","Jan  8, 2024 10:30:09.351748000 JST","","6000  >  60226 [ACK] Seq=1 Ack=28 Win=65152 Len=0 TSval=4073761227 TSecr=2030035876"
"168","56.093604","192.168.11.5","192.168.11.4","TCP","66","","0.001981000","Jan  8, 2024 10:30:09.353729000 JST","","60226  >  6000 [FIN, ACK] Seq=28 Ack=1 Win=64256 Len=0 TSval=2030035876 TSecr=4073761219"
