"No.","Time","Source","Destination","Protocol","Length","The RTT to ACK the segment was","Time delta from previous captured frame","Arrival Time","Data","Info"
"1","0.000000","192.168.11.5","192.168.11.4","TCP","74","","0.000000000","Jan  8, 2024 10:29:13.316137000 JST","","33730  >  6000 [SYN] Seq=0 Win=64240 Len=0 MSS=1460 SACK_PERM TSval=2029979840 TSecr=0 WS=128"
"2","0.010233","192.168.11.4","192.168.11.5","TCP","74","0.010233000","0.010233000","Jan  8, 2024 10:29:13.326370000 JST","","6000  >  33730 [SYN, ACK] Seq=0 Ack=1 Win=65160 Len=0 MSS=1460 SACK_PERM TSval=4073705197 TSecr=2029979840 WS=128"
"3","0.010351","192.168.11.5","192.168.11.4","TCP","66","0.000118000","0.000118000","Jan  8, 2024 10:29:13.326488000 JST","","33730  >  6000 [ACK] Seq=1 Ack=1 Win=64256 Len=0 TSval=2029979855 TSecr=4073705197"
"4","0.010559","192.168.11.5","192.168.11.4","TCP","93","","0.000208000","Jan  8, 2024 10:29:13.326696000 JST","","33730  >  6000 [PSH, ACK] Seq=1 Ack=1 Win=64256 Len=27 TSval=2029979855 TSecr=4073705197 [TCP segment of a reassembled PDU]"
"5","0.010725","192.168.11.5","192.168.11.4","TCP","66","","0.000166000","Jan  8, 2024 10:29:13.326862000 JST","","33730  >  6000 [FIN, ACK] Seq=28 Ack=1 Win=64256 Len=0 TSval=2029979856 TSecr=4073705197"
"6","0.018341","192.168.11.4","192.168.11.5","TCP","66","0.007782000","0.007616000","Jan  8, 2024 10:29:13.334478000 JST","","6000  >  33730 [ACK] Seq=1 Ack=28 Win=65152 Len=0 TSval=4073705206 TSecr=2029979855"
"7","0.018568","192.168.11.4","192.168.11.5","TCP","66","0.007843000","0.000227000","Jan  8, 2024 10:29:13.334705000 JST","","6000  >  33730 [FIN, ACK] Seq=1 Ack=29 Win=65152 Len=0 TSval=4073705207 TSecr=2029979856"
"8","0.018622","192.168.11.5","192.168.11.4","TCP","66","0.000054000","0.000054000","Jan  8, 2024 10:29:13.334759000 JST","","33730  >  6000 [ACK] Seq=29 Ack=2 Win=64256 Len=0 TSval=2029979863 TSecr=4073705207"
"9","0.050435","192.168.11.5","255.255.255.255","UDP","209","","0.031813000","Jan  8, 2024 10:29:13.366572000 JST","7b2273656d616e74696373223a207b22656e74697479223a2022504944222c202262617365656e74697479223a2022616e79222c2022726f6c65223a20226f6f6f222c20227370617469616c223a2022616e79222c202274656d706f72616c223a2022616e79227d2c20226461746170726f7065727479223a207b22666f726d6174223a2022696e616f6b615f70726f6772616d5f73616d706c655f73656d616e746963227d7d","57289  >  7000 Len=167"
"10","0.062942","192.168.11.11","192.168.11.5","TCP","74","","0.012507000","Jan  8, 2024 10:29:13.379079000 JST","","42584  >  6000 [SYN] Seq=0 Win=64240 Len=0 MSS=1460 SACK_PERM TSval=1917514397 TSecr=0 WS=128"
"11","0.063083","192.168.11.5","192.168.11.11","TCP","74","0.000141000","0.000141000","Jan  8, 2024 10:29:13.379220000 JST","","6000  >  42584 [SYN, ACK] Seq=0 Ack=1 Win=65160 Len=0 MSS=1460 SACK_PERM TSval=2805655308 TSecr=1917514397 WS=128"
"12","0.071287","192.168.11.11","192.168.11.5","TCP","66","0.008204000","0.008204000","Jan  8, 2024 10:29:13.387424000 JST","","42584  >  6000 [ACK] Seq=1 Ack=1 Win=64256 Len=0 TSval=1917514410 TSecr=2805655308"
"13","0.071749","192.168.11.11","192.168.11.5","TCP","93","","0.000462000","Jan  8, 2024 10:29:13.387886000 JST","","42584  >  6000 [PSH, ACK] Seq=1 Ack=1 Win=64256 Len=27 TSval=1917514410 TSecr=2805655308 [TCP segment of a reassembled PDU]"
"14","0.071822","192.168.11.5","192.168.11.11","TCP","66","0.000073000","0.000073000","Jan  8, 2024 10:29:13.387959000 JST","","6000  >  42584 [ACK] Seq=1 Ack=28 Win=65152 Len=0 TSval=2805655317 TSecr=1917514410"
"15","0.071879","192.168.11.11","192.168.11.5","TCP","66","","0.000057000","Jan  8, 2024 10:29:13.388016000 JST","","42584  >  6000 [FIN, ACK] Seq=28 Ack=1 Win=64256 Len=0 TSval=1917514410 TSecr=2805655308"
"16","0.073099","192.168.11.5","192.168.11.11","TCP","66","0.001220000","0.001220000","Jan  8, 2024 10:29:13.389236000 JST","","6000  >  42584 [FIN, ACK] Seq=1 Ack=29 Win=65152 Len=0 TSval=2805655318 TSecr=1917514410"
"17","0.079498","192.168.11.11","192.168.11.5","TCP","66","0.006399000","0.006399000","Jan  8, 2024 10:29:13.395635000 JST","","42584  >  6000 [ACK] Seq=29 Ack=2 Win=64256 Len=0 TSval=1917514418 TSecr=2805655318"
"18","6.152602","192.168.11.5","192.168.11.4","TCP","74","","6.073104000","Jan  8, 2024 10:29:19.468739000 JST","","33736  >  6000 [SYN] Seq=0 Win=64240 Len=0 MSS=1460 SACK_PERM TSval=2029985997 TSecr=0 WS=128"
"19","6.159207","192.168.11.4","192.168.11.5","TCP","74","0.006605000","0.006605000","Jan  8, 2024 10:29:19.475344000 JST","","6000  >  33736 [SYN, ACK] Seq=0 Ack=1 Win=65160 Len=0 MSS=1460 SACK_PERM TSval=4073711347 TSecr=2029985997 WS=128"
"20","6.159317","192.168.11.5","192.168.11.4","TCP","66","0.000110000","0.000110000","Jan  8, 2024 10:29:19.475454000 JST","","33736  >  6000 [ACK] Seq=1 Ack=1 Win=64256 Len=0 TSval=2029986004 TSecr=4073711347"
"21","6.159467","192.168.11.5","192.168.11.4","TCP","93","","0.000150000","Jan  8, 2024 10:29:19.475604000 JST","","33736  >  6000 [PSH, ACK] Seq=1 Ack=1 Win=64256 Len=27 TSval=2029986004 TSecr=4073711347 [TCP segment of a reassembled PDU]"
"22","6.159608","192.168.11.5","192.168.11.4","TCP","66","","0.000141000","Jan  8, 2024 10:29:19.475745000 JST","","33736  >  6000 [FIN, ACK] Seq=28 Ack=1 Win=64256 Len=0 TSval=2029986004 TSecr=4073711347"
"23","6.166769","192.168.11.4","192.168.11.5","TCP","66","0.007302000","0.007161000","Jan  8, 2024 10:29:19.482906000 JST","","6000  >  33736 [ACK] Seq=1 Ack=28 Win=65152 Len=0 TSval=4073711354 TSecr=2029986004"
"24","6.167008","192.168.11.4","192.168.11.5","TCP","66","0.007400000","0.000239000","Jan  8, 2024 10:29:19.483145000 JST","","6000  >  33736 [FIN, ACK] Seq=1 Ack=29 Win=65152 Len=0 TSval=4073711356 TSecr=2029986004"
"25","6.167054","192.168.11.5","192.168.11.4","TCP","66","0.000046000","0.000046000","Jan  8, 2024 10:29:19.483191000 JST","","33736  >  6000 [ACK] Seq=29 Ack=2 Win=64256 Len=0 TSval=2029986012 TSecr=4073711356"
"26","6.198566","192.168.11.5","255.255.255.255","UDP","209","","0.031512000","Jan  8, 2024 10:29:19.514703000 JST","7b2273656d616e74696373223a207b22656e74697479223a2022504944222c202262617365656e74697479223a2022616e79222c2022726f6c65223a20226f6f6f222c20227370617469616c223a2022616e79222c202274656d706f72616c223a2022616e79227d2c20226461746170726f7065727479223a207b22666f726d6174223a2022696e616f6b615f70726f6772616d5f73616d706c655f73656d616e746963227d7d","35016  >  7000 Len=167"
"27","6.206274","192.168.11.11","192.168.11.5","TCP","74","","0.007708000","Jan  8, 2024 10:29:19.522411000 JST","","42596  >  6000 [SYN] Seq=0 Win=64240 Len=0 MSS=1460 SACK_PERM TSval=1917520545 TSecr=0 WS=128"
"28","6.206428","192.168.11.5","192.168.11.11","TCP","74","0.000154000","0.000154000","Jan  8, 2024 10:29:19.522565000 JST","","6000  >  42596 [SYN, ACK] Seq=0 Ack=1 Win=65160 Len=0 MSS=1460 SACK_PERM TSval=2805661451 TSecr=1917520545 WS=128"
"29","6.213094","192.168.11.11","192.168.11.5","TCP","66","0.006666000","0.006666000","Jan  8, 2024 10:29:19.529231000 JST","","42596  >  6000 [ACK] Seq=1 Ack=1 Win=64256 Len=0 TSval=1917520552 TSecr=2805661451"
"30","6.213811","192.168.11.11","192.168.11.5","TCP","93","","0.000717000","Jan  8, 2024 10:29:19.529948000 JST","","42596  >  6000 [PSH, ACK] Seq=1 Ack=1 Win=64256 Len=27 TSval=1917520552 TSecr=2805661451 [TCP segment of a reassembled PDU]"
"31","6.213943","192.168.11.5","192.168.11.11","TCP","66","0.000132000","0.000132000","Jan  8, 2024 10:29:19.530080000 JST","","6000  >  42596 [ACK] Seq=1 Ack=28 Win=65152 Len=0 TSval=2805661459 TSecr=1917520552"
"32","6.214026","192.168.11.11","192.168.11.5","TCP","66","","0.000083000","Jan  8, 2024 10:29:19.530163000 JST","","42596  >  6000 [FIN, ACK] Seq=28 Ack=1 Win=64256 Len=0 TSval=1917520552 TSecr=2805661451"
"33","6.216199","192.168.11.5","192.168.11.11","TCP","66","0.002173000","0.002173000","Jan  8, 2024 10:29:19.532336000 JST","","6000  >  42596 [FIN, ACK] Seq=1 Ack=29 Win=65152 Len=0 TSval=2805661461 TSecr=1917520552"
"34","6.220776","192.168.11.11","192.168.11.5","TCP","66","0.004577000","0.004577000","Jan  8, 2024 10:29:19.536913000 JST","","42596  >  6000 [ACK] Seq=29 Ack=2 Win=64256 Len=0 TSval=1917520560 TSecr=2805661461"
"35","12.256141","192.168.11.5","192.168.11.4","TCP","74","","6.035365000","Jan  8, 2024 10:29:25.572278000 JST","","60610  >  6000 [SYN] Seq=0 Win=64240 Len=0 MSS=1460 SACK_PERM TSval=2029992101 TSecr=0 WS=128"
"36","12.262708","192.168.11.4","192.168.11.5","TCP","74","0.006567000","0.006567000","Jan  8, 2024 10:29:25.578845000 JST","","6000  >  60610 [SYN, ACK] Seq=0 Ack=1 Win=65160 Len=0 MSS=1460 SACK_PERM TSval=4073717451 TSecr=2029992101 WS=128"
"37","12.262816","192.168.11.5","192.168.11.4","TCP","66","0.000108000","0.000108000","Jan  8, 2024 10:29:25.578953000 JST","","60610  >  6000 [ACK] Seq=1 Ack=1 Win=64256 Len=0 TSval=2029992108 TSecr=4073717451"
"38","12.262996","192.168.11.5","192.168.11.4","TCP","93","","0.000180000","Jan  8, 2024 10:29:25.579133000 JST","","60610  >  6000 [PSH, ACK] Seq=1 Ack=1 Win=64256 Len=27 TSval=2029992108 TSecr=4073717451 [TCP segment of a reassembled PDU]"
"39","12.263099","192.168.11.5","192.168.11.4","TCP","66","","0.000103000","Jan  8, 2024 10:29:25.579236000 JST","","60610  >  6000 [FIN, ACK] Seq=28 Ack=1 Win=64256 Len=0 TSval=2029992108 TSecr=4073717451"
"40","12.270926","192.168.11.4","192.168.11.5","TCP","66","0.007930000","0.007827000","Jan  8, 2024 10:29:25.587063000 JST","","6000  >  60610 [ACK] Seq=1 Ack=28 Win=65152 Len=0 TSval=4073717458 TSecr=2029992108"
"41","12.271153","192.168.11.4","192.168.11.5","TCP","66","0.008054000","0.000227000","Jan  8, 2024 10:29:25.587290000 JST","","6000  >  60610 [FIN, ACK] Seq=1 Ack=29 Win=65152 Len=0 TSval=4073717460 TSecr=2029992108"
"42","12.271201","192.168.11.5","192.168.11.4","TCP","66","0.000048000","0.000048000","Jan  8, 2024 10:29:25.587338000 JST","","60610  >  6000 [ACK] Seq=29 Ack=2 Win=64256 Len=0 TSval=2029992116 TSecr=4073717460"
"43","12.304534","192.168.11.5","255.255.255.255","UDP","209","","0.033333000","Jan  8, 2024 10:29:25.620671000 JST","7b2273656d616e74696373223a207b22656e74697479223a2022504944222c202262617365656e74697479223a2022616e79222c2022726f6c65223a20226f6f6f222c20227370617469616c223a2022616e79222c202274656d706f72616c223a2022616e79227d2c20226461746170726f7065727479223a207b22666f726d6174223a2022696e616f6b615f70726f6772616d5f73616d706c655f73656d616e746963227d7d","37333  >  7000 Len=167"
"44","12.312155","192.168.11.11","192.168.11.5","TCP","74","","0.007621000","Jan  8, 2024 10:29:25.628292000 JST","","54894  >  6000 [SYN] Seq=0 Win=64240 Len=0 MSS=1460 SACK_PERM TSval=1917526651 TSecr=0 WS=128"
"45","12.312303","192.168.11.5","192.168.11.11","TCP","74","0.000148000","0.000148000","Jan  8, 2024 10:29:25.628440000 JST","","6000  >  54894 [SYN, ACK] Seq=0 Ack=1 Win=65160 Len=0 MSS=1460 SACK_PERM TSval=2805667557 TSecr=1917526651 WS=128"
"46","12.319014","192.168.11.11","192.168.11.5","TCP","66","0.006711000","0.006711000","Jan  8, 2024 10:29:25.635151000 JST","","54894  >  6000 [ACK] Seq=1 Ack=1 Win=64256 Len=0 TSval=1917526658 TSecr=2805667557"
"47","12.319658","192.168.11.11","192.168.11.5","TCP","93","","0.000644000","Jan  8, 2024 10:29:25.635795000 JST","","54894  >  6000 [PSH, ACK] Seq=1 Ack=1 Win=64256 Len=27 TSval=1917526658 TSecr=2805667557 [TCP segment of a reassembled PDU]"
"48","12.319752","192.168.11.5","192.168.11.11","TCP","66","0.000094000","0.000094000","Jan  8, 2024 10:29:25.635889000 JST","","6000  >  54894 [ACK] Seq=1 Ack=28 Win=65152 Len=0 TSval=2805667564 TSecr=1917526658"
"49","12.319836","192.168.11.11","192.168.11.5","TCP","66","","0.000084000","Jan  8, 2024 10:29:25.635973000 JST","","54894  >  6000 [FIN, ACK] Seq=28 Ack=1 Win=64256 Len=0 TSval=1917526658 TSecr=2805667557"
"50","12.321317","192.168.11.5","192.168.11.11","TCP","66","0.001481000","0.001481000","Jan  8, 2024 10:29:25.637454000 JST","","6000  >  54894 [FIN, ACK] Seq=1 Ack=29 Win=65152 Len=0 TSval=2805667566 TSecr=1917526658"
"51","12.327793","192.168.11.11","192.168.11.5","TCP","66","0.006476000","0.006476000","Jan  8, 2024 10:29:25.643930000 JST","","54894  >  6000 [ACK] Seq=29 Ack=2 Win=64256 Len=0 TSval=1917526666 TSecr=2805667566"
"52","18.367093","192.168.11.5","192.168.11.4","TCP","74","","6.039300000","Jan  8, 2024 10:29:31.683230000 JST","","41112  >  6000 [SYN] Seq=0 Win=64240 Len=0 MSS=1460 SACK_PERM TSval=2029998212 TSecr=0 WS=128"
"53","18.373665","192.168.11.4","192.168.11.5","TCP","74","0.006572000","0.006572000","Jan  8, 2024 10:29:31.689802000 JST","","6000  >  41112 [SYN, ACK] Seq=0 Ack=1 Win=65160 Len=0 MSS=1460 SACK_PERM TSval=4073723562 TSecr=2029998212 WS=128"
"54","18.373801","192.168.11.5","192.168.11.4","TCP","66","0.000136000","0.000136000","Jan  8, 2024 10:29:31.689938000 JST","","41112  >  6000 [ACK] Seq=1 Ack=1 Win=64256 Len=0 TSval=2029998219 TSecr=4073723562"
"55","18.373981","192.168.11.5","192.168.11.4","TCP","93","","0.000180000","Jan  8, 2024 10:29:31.690118000 JST","","41112  >  6000 [PSH, ACK] Seq=1 Ack=1 Win=64256 Len=27 TSval=2029998219 TSecr=4073723562 [TCP segment of a reassembled PDU]"
"56","18.374106","192.168.11.5","192.168.11.4","TCP","66","","0.000125000","Jan  8, 2024 10:29:31.690243000 JST","","41112  >  6000 [FIN, ACK] Seq=28 Ack=1 Win=64256 Len=0 TSval=2029998219 TSecr=4073723562"
"57","18.381304","192.168.11.4","192.168.11.5","TCP","66","0.007323000","0.007198000","Jan  8, 2024 10:29:31.697441000 JST","","6000  >  41112 [ACK] Seq=1 Ack=28 Win=65152 Len=0 TSval=4073723569 TSecr=2029998219"
"58","18.381670","192.168.11.4","192.168.11.5","TCP","66","0.007564000","0.000366000","Jan  8, 2024 10:29:31.697807000 JST","","6000  >  41112 [FIN, ACK] Seq=1 Ack=29 Win=65152 Len=0 TSval=4073723570 TSecr=2029998219"
"59","18.381750","192.168.11.5","192.168.11.4","TCP","66","0.000080000","0.000080000","Jan  8, 2024 10:29:31.697887000 JST","","41112  >  6000 [ACK] Seq=29 Ack=2 Win=64256 Len=0 TSval=2029998226 TSecr=4073723570"
"60","18.412271","192.168.11.5","255.255.255.255","UDP","209","","0.030521000","Jan  8, 2024 10:29:31.728408000 JST","7b2273656d616e74696373223a207b22656e74697479223a2022504944222c202262617365656e74697479223a2022616e79222c2022726f6c65223a20226f6f6f222c20227370617469616c223a2022616e79222c202274656d706f72616c223a2022616e79227d2c20226461746170726f7065727479223a207b22666f726d6174223a2022696e616f6b615f70726f6772616d5f73616d706c655f73656d616e746963227d7d","37081  >  7000 Len=167"
"61","18.419991","192.168.11.11","192.168.11.5","TCP","74","","0.007720000","Jan  8, 2024 10:29:31.736128000 JST","","54900  >  6000 [SYN] Seq=0 Win=64240 Len=0 MSS=1460 SACK_PERM TSval=1917532759 TSecr=0 WS=128"
"62","18.420148","192.168.11.5","192.168.11.11","TCP","74","0.000157000","0.000157000","Jan  8, 2024 10:29:31.736285000 JST","","6000  >  54900 [SYN, ACK] Seq=0 Ack=1 Win=65160 Len=0 MSS=1460 SACK_PERM TSval=2805673665 TSecr=1917532759 WS=128"
"63","18.431927","192.168.11.11","192.168.11.5","TCP","66","0.011779000","0.011779000","Jan  8, 2024 10:29:31.748064000 JST","","54900  >  6000 [ACK] Seq=1 Ack=1 Win=64256 Len=0 TSval=1917532768 TSecr=2805673665"
"64","18.432522","192.168.11.11","192.168.11.5","TCP","93","","0.000595000","Jan  8, 2024 10:29:31.748659000 JST","","54900  >  6000 [PSH, ACK] Seq=1 Ack=1 Win=64256 Len=27 TSval=1917532768 TSecr=2805673665 [TCP segment of a reassembled PDU]"
"65","18.432580","192.168.11.11","192.168.11.5","TCP","66","","0.000058000","Jan  8, 2024 10:29:31.748717000 JST","","54900  >  6000 [FIN, ACK] Seq=28 Ack=1 Win=64256 Len=0 TSval=1917532768 TSecr=2805673665"
"66","18.432641","192.168.11.5","192.168.11.11","TCP","66","0.000119000","0.000061000","Jan  8, 2024 10:29:31.748778000 JST","","6000  >  54900 [ACK] Seq=1 Ack=28 Win=65152 Len=0 TSval=2805673677 TSecr=1917532768"
"67","18.435142","192.168.11.5","192.168.11.11","TCP","66","0.002562000","0.002501000","Jan  8, 2024 10:29:31.751279000 JST","","6000  >  54900 [FIN, ACK] Seq=1 Ack=29 Win=65152 Len=0 TSval=2805673680 TSecr=1917532768"
"68","18.442295","192.168.11.11","192.168.11.5","TCP","66","0.007153000","0.007153000","Jan  8, 2024 10:29:31.758432000 JST","","54900  >  6000 [ACK] Seq=29 Ack=2 Win=64256 Len=0 TSval=1917532781 TSecr=2805673680"
"69","25.478238","192.168.11.5","192.168.11.4","TCP","74","","7.035943000","Jan  8, 2024 10:29:38.794375000 JST","","41128  >  6000 [SYN] Seq=0 Win=64240 Len=0 MSS=1460 SACK_PERM TSval=2030005323 TSecr=0 WS=128"
"70","25.486440","192.168.11.4","192.168.11.5","TCP","74","0.008202000","0.008202000","Jan  8, 2024 10:29:38.802577000 JST","","6000  >  41128 [SYN, ACK] Seq=0 Ack=1 Win=65160 Len=0 MSS=1460 SACK_PERM TSval=4073730674 TSecr=2030005323 WS=128"
"71","25.486572","192.168.11.5","192.168.11.4","TCP","66","0.000132000","0.000132000","Jan  8, 2024 10:29:38.802709000 JST","","41128  >  6000 [ACK] Seq=1 Ack=1 Win=64256 Len=0 TSval=2030005331 TSecr=4073730674"
"72","25.486762","192.168.11.5","192.168.11.4","TCP","93","","0.000190000","Jan  8, 2024 10:29:38.802899000 JST","","41128  >  6000 [PSH, ACK] Seq=1 Ack=1 Win=64256 Len=27 TSval=2030005332 TSecr=4073730674 [TCP segment of a reassembled PDU]"
"73","25.486875","192.168.11.5","192.168.11.4","TCP","66","","0.000113000","Jan  8, 2024 10:29:38.803012000 JST","","41128  >  6000 [FIN, ACK] Seq=28 Ack=1 Win=64256 Len=0 TSval=2030005332 TSecr=4073730674"
"74","25.495864","192.168.11.4","192.168.11.5","TCP","66","0.009102000","0.008989000","Jan  8, 2024 10:29:38.812001000 JST","","6000  >  41128 [ACK] Seq=1 Ack=28 Win=65152 Len=0 TSval=4073730683 TSecr=2030005332"
"75","25.496271","192.168.11.4","192.168.11.5","TCP","66","0.009396000","0.000407000","Jan  8, 2024 10:29:38.812408000 JST","","6000  >  41128 [FIN, ACK] Seq=1 Ack=29 Win=65152 Len=0 TSval=4073730684 TSecr=2030005332"
"76","25.496326","192.168.11.5","192.168.11.4","TCP","66","0.000055000","0.000055000","Jan  8, 2024 10:29:38.812463000 JST","","41128  >  6000 [ACK] Seq=29 Ack=2 Win=64256 Len=0 TSval=2030005341 TSecr=4073730684"
"77","25.528623","192.168.11.5","255.255.255.255","UDP","209","","0.032297000","Jan  8, 2024 10:29:38.844760000 JST","7b2273656d616e74696373223a207b22656e74697479223a2022504944222c202262617365656e74697479223a2022616e79222c2022726f6c65223a20226f6f6f222c20227370617469616c223a2022616e79222c202274656d706f72616c223a2022616e79227d2c20226461746170726f7065727479223a207b22666f726d6174223a2022696e616f6b615f70726f6772616d5f73616d706c655f73656d616e746963227d7d","41102  >  7000 Len=167"
"78","25.536283","192.168.11.11","192.168.11.5","TCP","74","","0.007660000","Jan  8, 2024 10:29:38.852420000 JST","","34004  >  6000 [SYN] Seq=0 Win=64240 Len=0 MSS=1460 SACK_PERM TSval=1917539875 TSecr=0 WS=128"
"79","25.536447","192.168.11.5","192.168.11.11","TCP","74","0.000164000","0.000164000","Jan  8, 2024 10:29:38.852584000 JST","","6000  >  34004 [SYN, ACK] Seq=0 Ack=1 Win=65160 Len=0 MSS=1460 SACK_PERM TSval=2805680781 TSecr=1917539875 WS=128"
"80","25.543296","192.168.11.11","192.168.11.5","TCP","66","0.006849000","0.006849000","Jan  8, 2024 10:29:38.859433000 JST","","34004  >  6000 [ACK] Seq=1 Ack=1 Win=64256 Len=0 TSval=1917539882 TSecr=2805680781"
"81","25.543901","192.168.11.11","192.168.11.5","TCP","93","","0.000605000","Jan  8, 2024 10:29:38.860038000 JST","","34004  >  6000 [PSH, ACK] Seq=1 Ack=1 Win=64256 Len=27 TSval=1917539882 TSecr=2805680781 [TCP segment of a reassembled PDU]"
"82","25.544017","192.168.11.5","192.168.11.11","TCP","66","0.000116000","0.000116000","Jan  8, 2024 10:29:38.860154000 JST","","6000  >  34004 [ACK] Seq=1 Ack=28 Win=65152 Len=0 TSval=2805680789 TSecr=1917539882"
"83","25.544095","192.168.11.11","192.168.11.5","TCP","66","","0.000078000","Jan  8, 2024 10:29:38.860232000 JST","","34004  >  6000 [FIN, ACK] Seq=28 Ack=1 Win=64256 Len=0 TSval=1917539882 TSecr=2805680781"
"84","25.545308","192.168.11.5","192.168.11.11","TCP","66","0.001213000","0.001213000","Jan  8, 2024 10:29:38.861445000 JST","","6000  >  34004 [FIN, ACK] Seq=1 Ack=29 Win=65152 Len=0 TSval=2805680790 TSecr=1917539882"
"85","25.551474","192.168.11.11","192.168.11.5","TCP","66","0.006166000","0.006166000","Jan  8, 2024 10:29:38.867611000 JST","","34004  >  6000 [ACK] Seq=29 Ack=2 Win=64256 Len=0 TSval=1917539890 TSecr=2805680790"
"86","31.585856","192.168.11.5","192.168.11.4","TCP","74","","6.034382000","Jan  8, 2024 10:29:44.901993000 JST","","33104  >  6000 [SYN] Seq=0 Win=64240 Len=0 MSS=1460 SACK_PERM TSval=2030011431 TSecr=0 WS=128"
"87","31.592433","192.168.11.4","192.168.11.5","TCP","74","0.006577000","0.006577000","Jan  8, 2024 10:29:44.908570000 JST","","6000  >  33104 [SYN, ACK] Seq=0 Ack=1 Win=65160 Len=0 MSS=1460 SACK_PERM TSval=4073736780 TSecr=2030011431 WS=128"
"88","31.592565","192.168.11.5","192.168.11.4","TCP","66","0.000132000","0.000132000","Jan  8, 2024 10:29:44.908702000 JST","","33104  >  6000 [ACK] Seq=1 Ack=1 Win=64256 Len=0 TSval=2030011437 TSecr=4073736780"
"89","31.592761","192.168.11.5","192.168.11.4","TCP","93","","0.000196000","Jan  8, 2024 10:29:44.908898000 JST","","33104  >  6000 [PSH, ACK] Seq=1 Ack=1 Win=64256 Len=27 TSval=2030011438 TSecr=4073736780 [TCP segment of a reassembled PDU]"
"90","31.592874","192.168.11.5","192.168.11.4","TCP","66","","0.000113000","Jan  8, 2024 10:29:44.909011000 JST","","33104  >  6000 [FIN, ACK] Seq=28 Ack=1 Win=64256 Len=0 TSval=2030011438 TSecr=4073736780"
"91","31.609299","192.168.11.4","192.168.11.5","TCP","66","0.016538000","0.016425000","Jan  8, 2024 10:29:44.925436000 JST","","6000  >  33104 [ACK] Seq=1 Ack=28 Win=65152 Len=0 TSval=4073736797 TSecr=2030011438"
"92","31.609698","192.168.11.4","192.168.11.5","TCP","66","0.016824000","0.000399000","Jan  8, 2024 10:29:44.925835000 JST","","6000  >  33104 [FIN, ACK] Seq=1 Ack=29 Win=65152 Len=0 TSval=4073736799 TSecr=2030011438"
"93","31.609782","192.168.11.5","192.168.11.4","TCP","66","0.000084000","0.000084000","Jan  8, 2024 10:29:44.925919000 JST","","33104  >  6000 [ACK] Seq=29 Ack=2 Win=64256 Len=0 TSval=2030011455 TSecr=4073736799"
"94","31.640546","192.168.11.5","255.255.255.255","UDP","209","","0.030764000","Jan  8, 2024 10:29:44.956683000 JST","7b2273656d616e74696373223a207b22656e74697479223a2022504944222c202262617365656e74697479223a2022616e79222c2022726f6c65223a20226f6f6f222c20227370617469616c223a2022616e79222c202274656d706f72616c223a2022616e79227d2c20226461746170726f7065727479223a207b22666f726d6174223a2022696e616f6b615f70726f6772616d5f73616d706c655f73656d616e746963227d7d","33609  >  7000 Len=167"
"95","31.648650","192.168.11.11","192.168.11.5","TCP","74","","0.008104000","Jan  8, 2024 10:29:44.964787000 JST","","38752  >  6000 [SYN] Seq=0 Win=64240 Len=0 MSS=1460 SACK_PERM TSval=1917545987 TSecr=0 WS=128"
"96","31.648798","192.168.11.5","192.168.11.11","TCP","74","0.000148000","0.000148000","Jan  8, 2024 10:29:44.964935000 JST","","6000  >  38752 [SYN, ACK] Seq=0 Ack=1 Win=65160 Len=0 MSS=1460 SACK_PERM TSval=2805686894 TSecr=1917545987 WS=128"
"97","31.655443","192.168.11.11","192.168.11.5","TCP","66","0.006645000","0.006645000","Jan  8, 2024 10:29:44.971580000 JST","","38752  >  6000 [ACK] Seq=1 Ack=1 Win=64256 Len=0 TSval=1917545994 TSecr=2805686894"
"98","31.656116","192.168.11.11","192.168.11.5","TCP","93","","0.000673000","Jan  8, 2024 10:29:44.972253000 JST","","38752  >  6000 [PSH, ACK] Seq=1 Ack=1 Win=64256 Len=27 TSval=1917545994 TSecr=2805686894 [TCP segment of a reassembled PDU]"
"99","31.656237","192.168.11.5","192.168.11.11","TCP","66","0.000121000","0.000121000","Jan  8, 2024 10:29:44.972374000 JST","","6000  >  38752 [ACK] Seq=1 Ack=28 Win=65152 Len=0 TSval=2805686901 TSecr=1917545994"
"100","31.656322","192.168.11.11","192.168.11.5","TCP","66","","0.000085000","Jan  8, 2024 10:29:44.972459000 JST","","38752  >  6000 [FIN, ACK] Seq=28 Ack=1 Win=64256 Len=0 TSval=1917545994 TSecr=2805686894"
"101","31.657776","192.168.11.5","192.168.11.11","TCP","66","0.001454000","0.001454000","Jan  8, 2024 10:29:44.973913000 JST","","6000  >  38752 [FIN, ACK] Seq=1 Ack=29 Win=65152 Len=0 TSval=2805686902 TSecr=1917545994"
"102","31.664014","192.168.11.11","192.168.11.5","TCP","66","0.006238000","0.006238000","Jan  8, 2024 10:29:44.980151000 JST","","38752  >  6000 [ACK] Seq=29 Ack=2 Win=64256 Len=0 TSval=1917546002 TSecr=2805686902"
"103","37.696937","192.168.11.5","192.168.11.4","TCP","74","","6.032923000","Jan  8, 2024 10:29:51.013074000 JST","","40662  >  6000 [SYN] Seq=0 Win=64240 Len=0 MSS=1460 SACK_PERM TSval=2030017542 TSecr=0 WS=128"
"104","37.703563","192.168.11.4","192.168.11.5","TCP","74","0.006626000","0.006626000","Jan  8, 2024 10:29:51.019700000 JST","","6000  >  40662 [SYN, ACK] Seq=0 Ack=1 Win=65160 Len=0 MSS=1460 SACK_PERM TSval=4073742891 TSecr=2030017542 WS=128"
"105","37.703687","192.168.11.5","192.168.11.4","TCP","66","0.000124000","0.000124000","Jan  8, 2024 10:29:51.019824000 JST","","40662  >  6000 [ACK] Seq=1 Ack=1 Win=64256 Len=0 TSval=2030017548 TSecr=4073742891"
"106","37.703862","192.168.11.5","192.168.11.4","TCP","93","","0.000175000","Jan  8, 2024 10:29:51.019999000 JST","","40662  >  6000 [PSH, ACK] Seq=1 Ack=1 Win=64256 Len=27 TSval=2030017549 TSecr=4073742891 [TCP segment of a reassembled PDU]"
"107","37.703958","192.168.11.5","192.168.11.4","TCP","66","","0.000096000","Jan  8, 2024 10:29:51.020095000 JST","","40662  >  6000 [FIN, ACK] Seq=28 Ack=1 Win=64256 Len=0 TSval=2030017549 TSecr=4073742891"
"108","37.712433","192.168.11.4","192.168.11.5","TCP","66","0.008571000","0.008475000","Jan  8, 2024 10:29:51.028570000 JST","","6000  >  40662 [ACK] Seq=1 Ack=28 Win=65152 Len=0 TSval=4073742900 TSecr=2030017549"
"109","37.712646","192.168.11.4","192.168.11.5","TCP","66","0.008688000","0.000213000","Jan  8, 2024 10:29:51.028783000 JST","","6000  >  40662 [FIN, ACK] Seq=1 Ack=29 Win=65152 Len=0 TSval=4073742902 TSecr=2030017549"
"110","37.712693","192.168.11.5","192.168.11.4","TCP","66","0.000047000","0.000047000","Jan  8, 2024 10:29:51.028830000 JST","","40662  >  6000 [ACK] Seq=29 Ack=2 Win=64256 Len=0 TSval=2030017557 TSecr=4073742902"
"111","37.742970","192.168.11.5","255.255.255.255","UDP","209","","0.030277000","Jan  8, 2024 10:29:51.059107000 JST","7b2273656d616e74696373223a207b22656e74697479223a2022504944222c202262617365656e74697479223a2022616e79222c2022726f6c65223a20226f6f6f222c20227370617469616c223a2022616e79222c202274656d706f72616c223a2022616e79227d2c20226461746170726f7065727479223a207b22666f726d6174223a2022696e616f6b615f70726f6772616d5f73616d706c655f73656d616e746963227d7d","45185  >  7000 Len=167"
"112","37.750800","192.168.11.11","192.168.11.5","TCP","74","","0.007830000","Jan  8, 2024 10:29:51.066937000 JST","","38764  >  6000 [SYN] Seq=0 Win=64240 Len=0 MSS=1460 SACK_PERM TSval=1917552089 TSecr=0 WS=128"
"113","37.750949","192.168.11.5","192.168.11.11","TCP","74","0.000149000","0.000149000","Jan  8, 2024 10:29:51.067086000 JST","","6000  >  38764 [SYN, ACK] Seq=0 Ack=1 Win=65160 Len=0 MSS=1460 SACK_PERM TSval=2805692996 TSecr=1917552089 WS=128"
"114","37.757609","192.168.11.11","192.168.11.5","TCP","66","0.006660000","0.006660000","Jan  8, 2024 10:29:51.073746000 JST","","38764  >  6000 [ACK] Seq=1 Ack=1 Win=64256 Len=0 TSval=1917552096 TSecr=2805692996"
"115","37.758255","192.168.11.11","192.168.11.5","TCP","93","","0.000646000","Jan  8, 2024 10:29:51.074392000 JST","","38764  >  6000 [PSH, ACK] Seq=1 Ack=1 Win=64256 Len=27 TSval=1917552096 TSecr=2805692996 [TCP segment of a reassembled PDU]"
"116","37.758386","192.168.11.5","192.168.11.11","TCP","66","0.000131000","0.000131000","Jan  8, 2024 10:29:51.074523000 JST","","6000  >  38764 [ACK] Seq=1 Ack=28 Win=65152 Len=0 TSval=2805693003 TSecr=1917552096"
"117","37.758476","192.168.11.11","192.168.11.5","TCP","66","","0.000090000","Jan  8, 2024 10:29:51.074613000 JST","","38764  >  6000 [FIN, ACK] Seq=28 Ack=1 Win=64256 Len=0 TSval=1917552097 TSecr=2805692996"
"118","37.759902","192.168.11.5","192.168.11.11","TCP","66","0.001426000","0.001426000","Jan  8, 2024 10:29:51.076039000 JST","","6000  >  38764 [FIN, ACK] Seq=1 Ack=29 Win=65152 Len=0 TSval=2805693005 TSecr=1917552097"
"119","37.768646","192.168.11.11","192.168.11.5","TCP","66","0.008744000","0.008744000","Jan  8, 2024 10:29:51.084783000 JST","","38764  >  6000 [ACK] Seq=29 Ack=2 Win=64256 Len=0 TSval=1917552104 TSecr=2805693005"
"120","43.822465","192.168.11.5","192.168.11.4","TCP","74","","6.053819000","Jan  8, 2024 10:29:57.138602000 JST","","40678  >  6000 [SYN] Seq=0 Win=64240 Len=0 MSS=1460 SACK_PERM TSval=2030023667 TSecr=0 WS=128"
"121","43.829724","192.168.11.4","192.168.11.5","TCP","74","0.007259000","0.007259000","Jan  8, 2024 10:29:57.145861000 JST","","6000  >  40678 [SYN, ACK] Seq=0 Ack=1 Win=65160 Len=0 MSS=1460 SACK_PERM TSval=4073749018 TSecr=2030023667 WS=128"
"122","43.829854","192.168.11.5","192.168.11.4","TCP","66","0.000130000","0.000130000","Jan  8, 2024 10:29:57.145991000 JST","","40678  >  6000 [ACK] Seq=1 Ack=1 Win=64256 Len=0 TSval=2030023675 TSecr=4073749018"
"123","43.830006","192.168.11.5","192.168.11.4","TCP","93","","0.000152000","Jan  8, 2024 10:29:57.146143000 JST","","40678  >  6000 [PSH, ACK] Seq=1 Ack=1 Win=64256 Len=27 TSval=2030023675 TSecr=4073749018 [TCP segment of a reassembled PDU]"
"124","43.830100","192.168.11.5","192.168.11.4","TCP","66","","0.000094000","Jan  8, 2024 10:29:57.146237000 JST","","40678  >  6000 [FIN, ACK] Seq=28 Ack=1 Win=64256 Len=0 TSval=2030023675 TSecr=4073749018"
"125","43.838261","192.168.11.4","192.168.11.5","TCP","66","0.008255000","0.008161000","Jan  8, 2024 10:29:57.154398000 JST","","6000  >  40678 [ACK] Seq=1 Ack=28 Win=65152 Len=0 TSval=4073749025 TSecr=2030023675"
"126","43.838510","192.168.11.4","192.168.11.5","TCP","66","0.008410000","0.000249000","Jan  8, 2024 10:29:57.154647000 JST","","6000  >  40678 [FIN, ACK] Seq=1 Ack=29 Win=65152 Len=0 TSval=4073749028 TSecr=2030023675"
"127","43.838576","192.168.11.5","192.168.11.4","TCP","66","0.000066000","0.000066000","Jan  8, 2024 10:29:57.154713000 JST","","40678  >  6000 [ACK] Seq=29 Ack=2 Win=64256 Len=0 TSval=2030023683 TSecr=4073749028"
"128","43.866680","192.168.11.5","255.255.255.255","UDP","209","","0.028104000","Jan  8, 2024 10:29:57.182817000 JST","7b2273656d616e74696373223a207b22656e74697479223a2022504944222c202262617365656e74697479223a2022616e79222c2022726f6c65223a20226f6f6f222c20227370617469616c223a2022616e79222c202274656d706f72616c223a2022616e79227d2c20226461746170726f7065727479223a207b22666f726d6174223a2022696e616f6b615f70726f6772616d5f73616d706c655f73656d616e746963227d7d","32979  >  7000 Len=167"
"129","43.877549","192.168.11.11","192.168.11.5","TCP","74","","0.010869000","Jan  8, 2024 10:29:57.193686000 JST","","37628  >  6000 [SYN] Seq=0 Win=64240 Len=0 MSS=1460 SACK_PERM TSval=1917558216 TSecr=0 WS=128"
"130","43.877738","192.168.11.5","192.168.11.11","TCP","74","0.000189000","0.000189000","Jan  8, 2024 10:29:57.193875000 JST","","6000  >  37628 [SYN, ACK] Seq=0 Ack=1 Win=65160 Len=0 MSS=1460 SACK_PERM TSval=2805699122 TSecr=1917558216 WS=128"
"131","43.884474","192.168.11.11","192.168.11.5","TCP","66","0.006736000","0.006736000","Jan  8, 2024 10:29:57.200611000 JST","","37628  >  6000 [ACK] Seq=1 Ack=1 Win=64256 Len=0 TSval=1917558223 TSecr=2805699122"
"132","43.885104","192.168.11.11","192.168.11.5","TCP","93","","0.000630000","Jan  8, 2024 10:29:57.201241000 JST","","37628  >  6000 [PSH, ACK] Seq=1 Ack=1 Win=64256 Len=27 TSval=1917558223 TSecr=2805699122 [TCP segment of a reassembled PDU]"
"133","43.885230","192.168.11.5","192.168.11.11","TCP","66","0.000126000","0.000126000","Jan  8, 2024 10:29:57.201367000 JST","","6000  >  37628 [ACK] Seq=1 Ack=28 Win=65152 Len=0 TSval=2805699130 TSecr=1917558223"
"134","43.885313","192.168.11.11","192.168.11.5","TCP","66","","0.000083000","Jan  8, 2024 10:29:57.201450000 JST","","37628  >  6000 [FIN, ACK] Seq=28 Ack=1 Win=64256 Len=0 TSval=1917558223 TSecr=2805699122"
"135","43.886400","192.168.11.5","192.168.11.11","TCP","66","0.001087000","0.001087000","Jan  8, 2024 10:29:57.202537000 JST","","6000  >  37628 [FIN, ACK] Seq=1 Ack=29 Win=65152 Len=0 TSval=2805699131 TSecr=1917558223"
"136","43.891956","192.168.11.11","192.168.11.5","TCP","66","0.005556000","0.005556000","Jan  8, 2024 10:29:57.208093000 JST","","37628  >  6000 [ACK] Seq=29 Ack=2 Win=64256 Len=0 TSval=1917558231 TSecr=2805699131"
"137","49.920448","192.168.11.5","192.168.11.4","TCP","74","","6.028492000","Jan  8, 2024 10:30:03.236585000 JST","","60222  >  6000 [SYN] Seq=0 Win=64240 Len=0 MSS=1460 SACK_PERM TSval=2030029765 TSecr=0 WS=128"
"138","49.927088","192.168.11.4","192.168.11.5","TCP","74","0.006640000","0.006640000","Jan  8, 2024 10:30:03.243225000 JST","","6000  >  60222 [SYN, ACK] Seq=0 Ack=1 Win=65160 Len=0 MSS=1460 SACK_PERM TSval=4073755115 TSecr=2030029765 WS=128"
"139","49.927200","192.168.11.5","192.168.11.4","TCP","66","0.000112000","0.000112000","Jan  8, 2024 10:30:03.243337000 JST","","60222  >  6000 [ACK] Seq=1 Ack=1 Win=64256 Len=0 TSval=2030029772 TSecr=4073755115"
"140","49.927350","192.168.11.5","192.168.11.4","TCP","93","","0.000150000","Jan  8, 2024 10:30:03.243487000 JST","","60222  >  6000 [PSH, ACK] Seq=1 Ack=1 Win=64256 Len=27 TSval=2030029772 TSecr=4073755115 [TCP segment of a reassembled PDU]"
"141","49.927443","192.168.11.5","192.168.11.4","TCP","66","","0.000093000","Jan  8, 2024 10:30:03.243580000 JST","","60222  >  6000 [FIN, ACK] Seq=28 Ack=1 Win=64256 Len=0 TSval=2030029772 TSecr=4073755115"
"142","49.935120","192.168.11.4","192.168.11.5","TCP","66","0.007770000","0.007677000","Jan  8, 2024 10:30:03.251257000 JST","","6000  >  60222 [ACK] Seq=1 Ack=28 Win=65152 Len=0 TSval=4073755123 TSecr=2030029772"
"143","49.937125","192.168.11.4","192.168.11.5","TCP","66","0.009682000","0.002005000","Jan  8, 2024 10:30:03.253262000 JST","","6000  >  60222 [FIN, ACK] Seq=1 Ack=29 Win=65152 Len=0 TSval=4073755125 TSecr=2030029772"
"144","49.937170","192.168.11.5","192.168.11.4","TCP","66","0.000045000","0.000045000","Jan  8, 2024 10:30:03.253307000 JST","","60222  >  6000 [ACK] Seq=29 Ack=2 Win=64256 Len=0 TSval=2030029782 TSecr=4073755125"
"145","49.965643","192.168.11.5","255.255.255.255","UDP","209","","0.028473000","Jan  8, 2024 10:30:03.281780000 JST","7b2273656d616e74696373223a207b22656e74697479223a2022504944222c202262617365656e74697479223a2022616e79222c2022726f6c65223a20226f6f6f222c20227370617469616c223a2022616e79222c202274656d706f72616c223a2022616e79227d2c20226461746170726f7065727479223a207b22666f726d6174223a2022696e616f6b615f70726f6772616d5f73616d706c655f73656d616e746963227d7d","48507  >  7000 Len=167"
"146","49.976102","192.168.11.11","192.168.11.5","TCP","74","","0.010459000","Jan  8, 2024 10:30:03.292239000 JST","","37842  >  6000 [SYN] Seq=0 Win=64240 Len=0 MSS=1460 SACK_PERM TSval=1917564315 TSecr=0 WS=128"
"147","49.976244","192.168.11.5","192.168.11.11","TCP","74","0.000142000","0.000142000","Jan  8, 2024 10:30:03.292381000 JST","","6000  >  37842 [SYN, ACK] Seq=0 Ack=1 Win=65160 Len=0 MSS=1460 SACK_PERM TSval=2805705221 TSecr=1917564315 WS=128"
"148","49.982907","192.168.11.11","192.168.11.5","TCP","66","0.006663000","0.006663000","Jan  8, 2024 10:30:03.299044000 JST","","37842  >  6000 [ACK] Seq=1 Ack=1 Win=64256 Len=0 TSval=1917564322 TSecr=2805705221"
"149","49.983264","192.168.11.11","192.168.11.5","TCP","93","","0.000357000","Jan  8, 2024 10:30:03.299401000 JST","","37842  >  6000 [PSH, ACK] Seq=1 Ack=1 Win=64256 Len=27 TSval=1917564322 TSecr=2805705221 [TCP segment of a reassembled PDU]"
"150","49.983344","192.168.11.5","192.168.11.11","TCP","66","0.000080000","0.000080000","Jan  8, 2024 10:30:03.299481000 JST","","6000  >  37842 [ACK] Seq=1 Ack=28 Win=65152 Len=0 TSval=2805705228 TSecr=1917564322"
"151","49.983578","192.168.11.11","192.168.11.5","TCP","66","","0.000234000","Jan  8, 2024 10:30:03.299715000 JST","","37842  >  6000 [FIN, ACK] Seq=28 Ack=1 Win=64256 Len=0 TSval=1917564322 TSecr=2805705221"
"152","49.984571","192.168.11.5","192.168.11.11","TCP","66","0.000993000","0.000993000","Jan  8, 2024 10:30:03.300708000 JST","","6000  >  37842 [FIN, ACK] Seq=1 Ack=29 Win=65152 Len=0 TSval=2805705229 TSecr=1917564322"
"153","49.990802","192.168.11.11","192.168.11.5","TCP","66","0.006231000","0.006231000","Jan  8, 2024 10:30:03.306939000 JST","","37842  >  6000 [ACK] Seq=29 Ack=2 Win=64256 Len=0 TSval=1917564329 TSecr=2805705229"
"154","56.024483","192.168.11.5","192.168.11.4","TCP","74","","6.033681000","Jan  8, 2024 10:30:09.340620000 JST","","60226  >  6000 [SYN] Seq=0 Win=64240 Len=0 MSS=1460 SACK_PERM TSval=2030035869 TSecr=0 WS=128"
"155","56.031269","192.168.11.4","192.168.11.5","TCP","74","0.006786000","0.006786000","Jan  8, 2024 10:30:09.347406000 JST","","6000  >  60226 [SYN, ACK] Seq=0 Ack=1 Win=65160 Len=0 MSS=1460 SACK_PERM TSval=4073761219 TSecr=2030035869 WS=128"
"156","56.031387","192.168.11.5","192.168.11.4","TCP","66","0.000118000","0.000118000","Jan  8, 2024 10:30:09.347524000 JST","","60226  >  6000 [ACK] Seq=1 Ack=1 Win=64256 Len=0 TSval=2030035876 TSecr=4073761219"
"157","56.031528","192.168.11.5","192.168.11.4","TCP","93","","0.000141000","Jan  8, 2024 10:30:09.347665000 JST","","60226  >  6000 [PSH, ACK] Seq=1 Ack=1 Win=64256 Len=27 TSval=2030035876 TSecr=4073761219 [TCP segment of a reassembled PDU]"
"158","56.031651","192.168.11.5","192.168.11.4","TCP","66","","0.000123000","Jan  8, 2024 10:30:09.347788000 JST","","60226  >  6000 [FIN, ACK] Seq=28 Ack=1 Win=64256 Len=0 TSval=2030035876 TSecr=4073761219"
"159","56.038397","192.168.11.4","192.168.11.5","TCP","66","0.006869000","0.006746000","Jan  8, 2024 10:30:09.354534000 JST","","6000  >  60226 [ACK] Seq=1 Ack=28 Win=65152 Len=0 TSval=4073761227 TSecr=2030035876"
"160","56.042088","192.168.11.4","192.168.11.5","TCP","66","0.010437000","0.003691000","Jan  8, 2024 10:30:09.358225000 JST","","6000  >  60226 [FIN, ACK] Seq=1 Ack=29 Win=65152 Len=0 TSval=4073761230 TSecr=2030035876"
"161","56.042133","192.168.11.5","192.168.11.4","TCP","66","0.000045000","0.000045000","Jan  8, 2024 10:30:09.358270000 JST","","60226  >  6000 [ACK] Seq=29 Ack=2 Win=64256 Len=0 TSval=2030035887 TSecr=4073761230"
"162","56.071229","192.168.11.5","255.255.255.255","UDP","209","","0.029096000","Jan  8, 2024 10:30:09.387366000 JST","7b2273656d616e74696373223a207b22656e74697479223a2022504944222c202262617365656e74697479223a2022616e79222c2022726f6c65223a20226f6f6f222c20227370617469616c223a2022616e79222c202274656d706f72616c223a2022616e79227d2c20226461746170726f7065727479223a207b22666f726d6174223a2022696e616f6b615f70726f6772616d5f73616d706c655f73656d616e746963227d7d","43933  >  7000 Len=167"
"163","56.079312","192.168.11.11","192.168.11.5","TCP","74","","0.008083000","Jan  8, 2024 10:30:09.395449000 JST","","37848  >  6000 [SYN] Seq=0 Win=64240 Len=0 MSS=1460 SACK_PERM TSval=1917570418 TSecr=0 WS=128"
"164","56.079470","192.168.11.5","192.168.11.11","TCP","74","0.000158000","0.000158000","Jan  8, 2024 10:30:09.395607000 JST","","6000  >  37848 [SYN, ACK] Seq=0 Ack=1 Win=65160 Len=0 MSS=1460 SACK_PERM TSval=2805711324 TSecr=1917570418 WS=128"
"165","56.086349","192.168.11.11","192.168.11.5","TCP","66","0.006879000","0.006879000","Jan  8, 2024 10:30:09.402486000 JST","","37848  >  6000 [ACK] Seq=1 Ack=1 Win=64256 Len=0 TSval=1917570425 TSecr=2805711324"
"166","56.086874","192.168.11.11","192.168.11.5","TCP","93","","0.000525000","Jan  8, 2024 10:30:09.403011000 JST","","37848  >  6000 [PSH, ACK] Seq=1 Ack=1 Win=64256 Len=27 TSval=1917570425 TSecr=2805711324 [TCP segment of a reassembled PDU]"
"167","56.086977","192.168.11.5","192.168.11.11","TCP","66","0.000103000","0.000103000","Jan  8, 2024 10:30:09.403114000 JST","","6000  >  37848 [ACK] Seq=1 Ack=28 Win=65152 Len=0 TSval=2805711332 TSecr=1917570425"
"168","56.087051","192.168.11.11","192.168.11.5","TCP","66","","0.000074000","Jan  8, 2024 10:30:09.403188000 JST","","37848  >  6000 [FIN, ACK] Seq=28 Ack=1 Win=64256 Len=0 TSval=1917570425 TSecr=2805711324"
