"No.","Time","Source","Destination","Protocol","Length","The RTT to ACK the segment was","Time delta from previous captured frame","Arrival Time","Data","Info"
"1","0.000000","192.168.11.16","192.168.11.11","TCP","74","","0.000000000","Jan  8, 2024 10:29:13.443883000 JST","","47292  >  6000 [SYN] Seq=0 Win=64240 Len=0 MSS=1460 SACK_PERM TSval=1432902655 TSecr=0 WS=128"
"2","0.006764","192.168.11.11","192.168.11.16","TCP","74","0.006764000","0.006764000","Jan  8, 2024 10:29:13.450647000 JST","","6000  >  47292 [SYN, ACK] Seq=0 Ack=1 Win=65160 Len=0 MSS=1460 SACK_PERM TSval=4225267629 TSecr=1432902655 WS=128"
"3","0.006914","192.168.11.16","192.168.11.11","TCP","66","0.000150000","0.000150000","Jan  8, 2024 10:29:13.450797000 JST","","47292  >  6000 [ACK] Seq=1 Ack=1 Win=64256 Len=0 TSval=1432902665 TSecr=4225267629"
"4","0.007183","192.168.11.16","192.168.11.11","TCP","93","","0.000269000","Jan  8, 2024 10:29:13.451066000 JST","","47292  >  6000 [PSH, ACK] Seq=1 Ack=1 Win=64256 Len=27 TSval=1432902666 TSecr=4225267629 [TCP segment of a reassembled PDU]"
"5","0.007341","192.168.11.16","192.168.11.11","TCP","66","","0.000158000","Jan  8, 2024 10:29:13.451224000 JST","","47292  >  6000 [FIN, ACK] Seq=28 Ack=1 Win=64256 Len=0 TSval=1432902666 TSecr=4225267629"
"6","0.014419","192.168.11.11","192.168.11.16","TCP","66","0.007236000","0.007078000","Jan  8, 2024 10:29:13.458302000 JST","","6000  >  47292 [ACK] Seq=1 Ack=28 Win=65152 Len=0 TSval=4225267637 TSecr=1432902666"
"7","0.014813","192.168.11.11","192.168.11.16","TCP","66","0.007472000","0.000394000","Jan  8, 2024 10:29:13.458696000 JST","","6000  >  47292 [FIN, ACK] Seq=1 Ack=29 Win=65152 Len=0 TSval=4225267638 TSecr=1432902666"
"8","0.014860","192.168.11.16","192.168.11.11","TCP","66","0.000047000","0.000047000","Jan  8, 2024 10:29:13.458743000 JST","","47292  >  6000 [ACK] Seq=29 Ack=2 Win=64256 Len=0 TSval=1432902673 TSecr=4225267638"
"9","0.043398","192.168.11.16","255.255.255.255","UDP","209","","0.028538000","Jan  8, 2024 10:29:13.487281000 JST","7b2273656d616e74696373223a207b22656e74697479223a2022504944222c202262617365656e74697479223a2022616e79222c2022726f6c65223a2022717171222c20227370617469616c223a2022616e79222c202274656d706f72616c223a2022616e79227d2c20226461746170726f7065727479223a207b22666f726d6174223a2022696e616f6b615f70726f6772616d5f73616d706c655f73656d616e746963227d7d","44094  >  7000 Len=167"
"10","0.054686","192.168.11.17","192.168.11.16","TCP","74","","0.011288000","Jan  8, 2024 10:29:13.498569000 JST","","37612  >  6000 [SYN] Seq=0 Win=64240 Len=0 MSS=1460 SACK_PERM TSval=194158077 TSecr=0 WS=128"
"11","0.054853","192.168.11.16","192.168.11.17","TCP","74","0.000167000","0.000167000","Jan  8, 2024 10:29:13.498736000 JST","","6000  >  37612 [SYN, ACK] Seq=0 Ack=1 Win=65160 Len=0 MSS=1460 SACK_PERM TSval=1090135806 TSecr=194158077 WS=128"
"12","0.061592","192.168.11.17","192.168.11.16","TCP","66","0.006739000","0.006739000","Jan  8, 2024 10:29:13.505475000 JST","","37612  >  6000 [ACK] Seq=1 Ack=1 Win=64256 Len=0 TSval=194158087 TSecr=1090135806"
"13","0.062322","192.168.11.17","192.168.11.16","TCP","93","","0.000730000","Jan  8, 2024 10:29:13.506205000 JST","","37612  >  6000 [PSH, ACK] Seq=1 Ack=1 Win=64256 Len=27 TSval=194158087 TSecr=1090135806 [TCP segment of a reassembled PDU]"
"14","0.062442","192.168.11.16","192.168.11.17","TCP","66","0.000120000","0.000120000","Jan  8, 2024 10:29:13.506325000 JST","","6000  >  37612 [ACK] Seq=1 Ack=28 Win=65152 Len=0 TSval=1090135814 TSecr=194158087"
"15","0.062517","192.168.11.17","192.168.11.16","TCP","66","","0.000075000","Jan  8, 2024 10:29:13.506400000 JST","","37612  >  6000 [FIN, ACK] Seq=28 Ack=1 Win=64256 Len=0 TSval=194158087 TSecr=1090135806"
"16","0.064940","192.168.11.16","192.168.11.17","TCP","66","0.002423000","0.002423000","Jan  8, 2024 10:29:13.508823000 JST","","6000  >  37612 [FIN, ACK] Seq=1 Ack=29 Win=65152 Len=0 TSval=1090135816 TSecr=194158087"
"17","0.072252","192.168.11.17","192.168.11.16","TCP","66","0.007312000","0.007312000","Jan  8, 2024 10:29:13.516135000 JST","","37612  >  6000 [ACK] Seq=29 Ack=2 Win=64256 Len=0 TSval=194158097 TSecr=1090135816"
"18","6.137918","192.168.11.16","192.168.11.11","TCP","74","","6.065666000","Jan  8, 2024 10:29:19.581801000 JST","","35114  >  6000 [SYN] Seq=0 Win=64240 Len=0 MSS=1460 SACK_PERM TSval=1432908796 TSecr=0 WS=128"
"19","6.144560","192.168.11.11","192.168.11.16","TCP","74","0.006642000","0.006642000","Jan  8, 2024 10:29:19.588443000 JST","","6000  >  35114 [SYN, ACK] Seq=0 Ack=1 Win=65160 Len=0 MSS=1460 SACK_PERM TSval=4225273767 TSecr=1432908796 WS=128"
"20","6.144678","192.168.11.16","192.168.11.11","TCP","66","0.000118000","0.000118000","Jan  8, 2024 10:29:19.588561000 JST","","35114  >  6000 [ACK] Seq=1 Ack=1 Win=64256 Len=0 TSval=1432908803 TSecr=4225273767"
"21","6.144943","192.168.11.16","192.168.11.11","TCP","93","","0.000265000","Jan  8, 2024 10:29:19.588826000 JST","","35114  >  6000 [PSH, ACK] Seq=1 Ack=1 Win=64256 Len=27 TSval=1432908804 TSecr=4225273767 [TCP segment of a reassembled PDU]"
"22","6.145085","192.168.11.16","192.168.11.11","TCP","66","","0.000142000","Jan  8, 2024 10:29:19.588968000 JST","","35114  >  6000 [FIN, ACK] Seq=28 Ack=1 Win=64256 Len=0 TSval=1432908804 TSecr=4225273767"
"23","6.152165","192.168.11.11","192.168.11.16","TCP","66","0.007222000","0.007080000","Jan  8, 2024 10:29:19.596048000 JST","","6000  >  35114 [ACK] Seq=1 Ack=28 Win=65152 Len=0 TSval=4225273775 TSecr=1432908804"
"24","6.152541","192.168.11.11","192.168.11.16","TCP","66","0.007456000","0.000376000","Jan  8, 2024 10:29:19.596424000 JST","","6000  >  35114 [FIN, ACK] Seq=1 Ack=29 Win=65152 Len=0 TSval=4225273776 TSecr=1432908804"
"25","6.152588","192.168.11.16","192.168.11.11","TCP","66","0.000047000","0.000047000","Jan  8, 2024 10:29:19.596471000 JST","","35114  >  6000 [ACK] Seq=29 Ack=2 Win=64256 Len=0 TSval=1432908811 TSecr=4225273776"
"26","6.180637","192.168.11.16","255.255.255.255","UDP","209","","0.028049000","Jan  8, 2024 10:29:19.624520000 JST","7b2273656d616e74696373223a207b22656e74697479223a2022504944222c202262617365656e74697479223a2022616e79222c2022726f6c65223a2022717171222c20227370617469616c223a2022616e79222c202274656d706f72616c223a2022616e79227d2c20226461746170726f7065727479223a207b22666f726d6174223a2022696e616f6b615f70726f6772616d5f73616d706c655f73656d616e746963227d7d","35769  >  7000 Len=167"
"27","6.188175","192.168.11.17","192.168.11.16","TCP","74","","0.007538000","Jan  8, 2024 10:29:19.632058000 JST","","51880  >  6000 [SYN] Seq=0 Win=64240 Len=0 MSS=1460 SACK_PERM TSval=194164213 TSecr=0 WS=128"
"28","6.188329","192.168.11.16","192.168.11.17","TCP","74","0.000154000","0.000154000","Jan  8, 2024 10:29:19.632212000 JST","","6000  >  51880 [SYN, ACK] Seq=0 Ack=1 Win=65160 Len=0 MSS=1460 SACK_PERM TSval=1090141940 TSecr=194164213 WS=128"
"29","6.195714","192.168.11.17","192.168.11.16","TCP","66","0.007385000","0.007385000","Jan  8, 2024 10:29:19.639597000 JST","","51880  >  6000 [ACK] Seq=1 Ack=1 Win=64256 Len=0 TSval=194164220 TSecr=1090141940"
"30","6.196329","192.168.11.17","192.168.11.16","TCP","93","","0.000615000","Jan  8, 2024 10:29:19.640212000 JST","","51880  >  6000 [PSH, ACK] Seq=1 Ack=1 Win=64256 Len=27 TSval=194164221 TSecr=1090141940 [TCP segment of a reassembled PDU]"
"31","6.196406","192.168.11.16","192.168.11.17","TCP","66","0.000077000","0.000077000","Jan  8, 2024 10:29:19.640289000 JST","","6000  >  51880 [ACK] Seq=1 Ack=28 Win=65152 Len=0 TSval=1090141948 TSecr=194164221"
"32","6.196474","192.168.11.17","192.168.11.16","TCP","66","","0.000068000","Jan  8, 2024 10:29:19.640357000 JST","","51880  >  6000 [FIN, ACK] Seq=28 Ack=1 Win=64256 Len=0 TSval=194164221 TSecr=1090141940"
"33","6.197820","192.168.11.16","192.168.11.17","TCP","66","0.001346000","0.001346000","Jan  8, 2024 10:29:19.641703000 JST","","6000  >  51880 [FIN, ACK] Seq=1 Ack=29 Win=65152 Len=0 TSval=1090141949 TSecr=194164221"
"34","6.208576","192.168.11.17","192.168.11.16","TCP","66","0.010756000","0.010756000","Jan  8, 2024 10:29:19.652459000 JST","","51880  >  6000 [ACK] Seq=29 Ack=2 Win=64256 Len=0 TSval=194164233 TSecr=1090141949"
"35","12.244850","192.168.11.16","192.168.11.11","TCP","74","","6.036274000","Jan  8, 2024 10:29:25.688733000 JST","","35122  >  6000 [SYN] Seq=0 Win=64240 Len=0 MSS=1460 SACK_PERM TSval=1432914903 TSecr=0 WS=128"
"36","12.251656","192.168.11.11","192.168.11.16","TCP","74","0.006806000","0.006806000","Jan  8, 2024 10:29:25.695539000 JST","","6000  >  35122 [SYN, ACK] Seq=0 Ack=1 Win=65160 Len=0 MSS=1460 SACK_PERM TSval=4225279874 TSecr=1432914903 WS=128"
"37","12.251772","192.168.11.16","192.168.11.11","TCP","66","0.000116000","0.000116000","Jan  8, 2024 10:29:25.695655000 JST","","35122  >  6000 [ACK] Seq=1 Ack=1 Win=64256 Len=0 TSval=1432914910 TSecr=4225279874"
"38","12.251966","192.168.11.16","192.168.11.11","TCP","93","","0.000194000","Jan  8, 2024 10:29:25.695849000 JST","","35122  >  6000 [PSH, ACK] Seq=1 Ack=1 Win=64256 Len=27 TSval=1432914911 TSecr=4225279874 [TCP segment of a reassembled PDU]"
"39","12.252084","192.168.11.16","192.168.11.11","TCP","66","","0.000118000","Jan  8, 2024 10:29:25.695967000 JST","","35122  >  6000 [FIN, ACK] Seq=28 Ack=1 Win=64256 Len=0 TSval=1432914911 TSecr=4225279874"
"40","12.259260","192.168.11.11","192.168.11.16","TCP","66","0.007294000","0.007176000","Jan  8, 2024 10:29:25.703143000 JST","","6000  >  35122 [ACK] Seq=1 Ack=28 Win=65152 Len=0 TSval=4225279881 TSecr=1432914911"
"41","12.259474","192.168.11.11","192.168.11.16","TCP","66","0.007390000","0.000214000","Jan  8, 2024 10:29:25.703357000 JST","","6000  >  35122 [FIN, ACK] Seq=1 Ack=29 Win=65152 Len=0 TSval=4225279883 TSecr=1432914911"
"42","12.259520","192.168.11.16","192.168.11.11","TCP","66","0.000046000","0.000046000","Jan  8, 2024 10:29:25.703403000 JST","","35122  >  6000 [ACK] Seq=29 Ack=2 Win=64256 Len=0 TSval=1432914918 TSecr=4225279883"
"43","12.298158","192.168.11.16","255.255.255.255","UDP","209","","0.038638000","Jan  8, 2024 10:29:25.742041000 JST","7b2273656d616e74696373223a207b22656e74697479223a2022504944222c202262617365656e74697479223a2022616e79222c2022726f6c65223a2022717171222c20227370617469616c223a2022616e79222c202274656d706f72616c223a2022616e79227d2c20226461746170726f7065727479223a207b22666f726d6174223a2022696e616f6b615f70726f6772616d5f73616d706c655f73656d616e746963227d7d","38617  >  7000 Len=167"
"44","12.307518","192.168.11.17","192.168.11.16","TCP","74","","0.009360000","Jan  8, 2024 10:29:25.751401000 JST","","51894  >  6000 [SYN] Seq=0 Win=64240 Len=0 MSS=1460 SACK_PERM TSval=194170332 TSecr=0 WS=128"
"45","12.307668","192.168.11.16","192.168.11.17","TCP","74","0.000150000","0.000150000","Jan  8, 2024 10:29:25.751551000 JST","","6000  >  51894 [SYN, ACK] Seq=0 Ack=1 Win=65160 Len=0 MSS=1460 SACK_PERM TSval=1090148059 TSecr=194170332 WS=128"
"46","12.323810","192.168.11.17","192.168.11.16","TCP","66","0.016142000","0.016142000","Jan  8, 2024 10:29:25.767693000 JST","","51894  >  6000 [ACK] Seq=1 Ack=1 Win=64256 Len=0 TSval=194170339 TSecr=1090148059"
"47","12.324549","192.168.11.17","192.168.11.16","TCP","93","","0.000739000","Jan  8, 2024 10:29:25.768432000 JST","","51894  >  6000 [PSH, ACK] Seq=1 Ack=1 Win=64256 Len=27 TSval=194170340 TSecr=1090148059 [TCP segment of a reassembled PDU]"
"48","12.324643","192.168.11.16","192.168.11.17","TCP","66","0.000094000","0.000094000","Jan  8, 2024 10:29:25.768526000 JST","","6000  >  51894 [ACK] Seq=1 Ack=28 Win=65152 Len=0 TSval=1090148076 TSecr=194170340"
"49","12.324717","192.168.11.17","192.168.11.16","TCP","66","","0.000074000","Jan  8, 2024 10:29:25.768600000 JST","","51894  >  6000 [FIN, ACK] Seq=28 Ack=1 Win=64256 Len=0 TSval=194170340 TSecr=1090148059"
"50","12.325710","192.168.11.16","192.168.11.17","TCP","66","0.000993000","0.000993000","Jan  8, 2024 10:29:25.769593000 JST","","6000  >  51894 [FIN, ACK] Seq=1 Ack=29 Win=65152 Len=0 TSval=1090148077 TSecr=194170340"
"51","12.331729","192.168.11.17","192.168.11.16","TCP","66","0.006019000","0.006019000","Jan  8, 2024 10:29:25.775612000 JST","","51894  >  6000 [ACK] Seq=29 Ack=2 Win=64256 Len=0 TSval=194170357 TSecr=1090148077"
"52","18.362753","192.168.11.16","192.168.11.11","TCP","74","","6.031024000","Jan  8, 2024 10:29:31.806636000 JST","","45372  >  6000 [SYN] Seq=0 Win=64240 Len=0 MSS=1460 SACK_PERM TSval=1432921021 TSecr=0 WS=128"
"53","18.369585","192.168.11.11","192.168.11.16","TCP","74","0.006832000","0.006832000","Jan  8, 2024 10:29:31.813468000 JST","","6000  >  45372 [SYN, ACK] Seq=0 Ack=1 Win=65160 Len=0 MSS=1460 SACK_PERM TSval=4225285992 TSecr=1432921021 WS=128"
"54","18.369695","192.168.11.16","192.168.11.11","TCP","66","0.000110000","0.000110000","Jan  8, 2024 10:29:31.813578000 JST","","45372  >  6000 [ACK] Seq=1 Ack=1 Win=64256 Len=0 TSval=1432921028 TSecr=4225285992"
"55","18.369869","192.168.11.16","192.168.11.11","TCP","93","","0.000174000","Jan  8, 2024 10:29:31.813752000 JST","","45372  >  6000 [PSH, ACK] Seq=1 Ack=1 Win=64256 Len=27 TSval=1432921028 TSecr=4225285992 [TCP segment of a reassembled PDU]"
"56","18.369961","192.168.11.16","192.168.11.11","TCP","66","","0.000092000","Jan  8, 2024 10:29:31.813844000 JST","","45372  >  6000 [FIN, ACK] Seq=28 Ack=1 Win=64256 Len=0 TSval=1432921029 TSecr=4225285992"
"57","18.378472","192.168.11.11","192.168.11.16","TCP","66","0.008603000","0.008511000","Jan  8, 2024 10:29:31.822355000 JST","","6000  >  45372 [ACK] Seq=1 Ack=28 Win=65152 Len=0 TSval=4225286000 TSecr=1432921028"
"58","18.378843","192.168.11.11","192.168.11.16","TCP","66","0.008882000","0.000371000","Jan  8, 2024 10:29:31.822726000 JST","","6000  >  45372 [FIN, ACK] Seq=1 Ack=29 Win=65152 Len=0 TSval=4225286001 TSecr=1432921029"
"59","18.378916","192.168.11.16","192.168.11.11","TCP","66","0.000073000","0.000073000","Jan  8, 2024 10:29:31.822799000 JST","","45372  >  6000 [ACK] Seq=29 Ack=2 Win=64256 Len=0 TSval=1432921037 TSecr=4225286001"
"60","18.408776","192.168.11.16","255.255.255.255","UDP","209","","0.029860000","Jan  8, 2024 10:29:31.852659000 JST","7b2273656d616e74696373223a207b22656e74697479223a2022504944222c202262617365656e74697479223a2022616e79222c2022726f6c65223a2022717171222c20227370617469616c223a2022616e79222c202274656d706f72616c223a2022616e79227d2c20226461746170726f7065727479223a207b22666f726d6174223a2022696e616f6b615f70726f6772616d5f73616d706c655f73656d616e746963227d7d","46407  >  7000 Len=167"
"61","18.422727","192.168.11.17","192.168.11.16","TCP","74","","0.013951000","Jan  8, 2024 10:29:31.866610000 JST","","41584  >  6000 [SYN] Seq=0 Win=64240 Len=0 MSS=1460 SACK_PERM TSval=194176446 TSecr=0 WS=128"
"62","18.422918","192.168.11.16","192.168.11.17","TCP","74","0.000191000","0.000191000","Jan  8, 2024 10:29:31.866801000 JST","","6000  >  41584 [SYN, ACK] Seq=0 Ack=1 Win=65160 Len=0 MSS=1460 SACK_PERM TSval=1090154174 TSecr=194176446 WS=128"
"63","18.429676","192.168.11.17","192.168.11.16","TCP","66","0.006758000","0.006758000","Jan  8, 2024 10:29:31.873559000 JST","","41584  >  6000 [ACK] Seq=1 Ack=1 Win=64256 Len=0 TSval=194176455 TSecr=1090154174"
"64","18.430298","192.168.11.17","192.168.11.16","TCP","93","","0.000622000","Jan  8, 2024 10:29:31.874181000 JST","","41584  >  6000 [PSH, ACK] Seq=1 Ack=1 Win=64256 Len=27 TSval=194176455 TSecr=1090154174 [TCP segment of a reassembled PDU]"
"65","18.430391","192.168.11.16","192.168.11.17","TCP","66","0.000093000","0.000093000","Jan  8, 2024 10:29:31.874274000 JST","","6000  >  41584 [ACK] Seq=1 Ack=28 Win=65152 Len=0 TSval=1090154182 TSecr=194176455"
"66","18.430476","192.168.11.17","192.168.11.16","TCP","66","","0.000085000","Jan  8, 2024 10:29:31.874359000 JST","","41584  >  6000 [FIN, ACK] Seq=28 Ack=1 Win=64256 Len=0 TSval=194176455 TSecr=1090154174"
"67","18.431575","192.168.11.16","192.168.11.17","TCP","66","0.001099000","0.001099000","Jan  8, 2024 10:29:31.875458000 JST","","6000  >  41584 [FIN, ACK] Seq=1 Ack=29 Win=65152 Len=0 TSval=1090154183 TSecr=194176455"
"68","18.437790","192.168.11.17","192.168.11.16","TCP","66","0.006215000","0.006215000","Jan  8, 2024 10:29:31.881673000 JST","","41584  >  6000 [ACK] Seq=29 Ack=2 Win=64256 Len=0 TSval=194176463 TSecr=1090154183"
"69","25.469285","192.168.11.16","192.168.11.11","TCP","74","","7.031495000","Jan  8, 2024 10:29:38.913168000 JST","","48924  >  6000 [SYN] Seq=0 Win=64240 Len=0 MSS=1460 SACK_PERM TSval=1432928128 TSecr=0 WS=128"
"70","25.479903","192.168.11.11","192.168.11.16","TCP","74","0.010618000","0.010618000","Jan  8, 2024 10:29:38.923786000 JST","","6000  >  48924 [SYN, ACK] Seq=0 Ack=1 Win=65160 Len=0 MSS=1460 SACK_PERM TSval=4225293099 TSecr=1432928128 WS=128"
"71","25.480014","192.168.11.16","192.168.11.11","TCP","66","0.000111000","0.000111000","Jan  8, 2024 10:29:38.923897000 JST","","48924  >  6000 [ACK] Seq=1 Ack=1 Win=64256 Len=0 TSval=1432928139 TSecr=4225293099"
"72","25.480163","192.168.11.16","192.168.11.11","TCP","93","","0.000149000","Jan  8, 2024 10:29:38.924046000 JST","","48924  >  6000 [PSH, ACK] Seq=1 Ack=1 Win=64256 Len=27 TSval=1432928139 TSecr=4225293099 [TCP segment of a reassembled PDU]"
"73","25.480258","192.168.11.16","192.168.11.11","TCP","66","","0.000095000","Jan  8, 2024 10:29:38.924141000 JST","","48924  >  6000 [FIN, ACK] Seq=28 Ack=1 Win=64256 Len=0 TSval=1432928139 TSecr=4225293099"
"74","25.489973","192.168.11.11","192.168.11.16","TCP","66","0.009810000","0.009715000","Jan  8, 2024 10:29:38.933856000 JST","","6000  >  48924 [ACK] Seq=1 Ack=28 Win=65152 Len=0 TSval=4225293112 TSecr=1432928139"
"75","25.490346","192.168.11.11","192.168.11.16","TCP","66","0.010088000","0.000373000","Jan  8, 2024 10:29:38.934229000 JST","","6000  >  48924 [FIN, ACK] Seq=1 Ack=29 Win=65152 Len=0 TSval=4225293114 TSecr=1432928139"
"76","25.490407","192.168.11.16","192.168.11.11","TCP","66","0.000061000","0.000061000","Jan  8, 2024 10:29:38.934290000 JST","","48924  >  6000 [ACK] Seq=29 Ack=2 Win=64256 Len=0 TSval=1432928149 TSecr=4225293114"
"77","25.520207","192.168.11.16","255.255.255.255","UDP","209","","0.029800000","Jan  8, 2024 10:29:38.964090000 JST","7b2273656d616e74696373223a207b22656e74697479223a2022504944222c202262617365656e74697479223a2022616e79222c2022726f6c65223a2022717171222c20227370617469616c223a2022616e79222c202274656d706f72616c223a2022616e79227d2c20226461746170726f7065727479223a207b22666f726d6174223a2022696e616f6b615f70726f6772616d5f73616d706c655f73656d616e746963227d7d","50926  >  7000 Len=167"
"78","25.528347","192.168.11.17","192.168.11.16","TCP","74","","0.008140000","Jan  8, 2024 10:29:38.972230000 JST","","41600  >  6000 [SYN] Seq=0 Win=64240 Len=0 MSS=1460 SACK_PERM TSval=194183553 TSecr=0 WS=128"
"79","25.528547","192.168.11.16","192.168.11.17","TCP","74","0.000200000","0.000200000","Jan  8, 2024 10:29:38.972430000 JST","","6000  >  41600 [SYN, ACK] Seq=0 Ack=1 Win=65160 Len=0 MSS=1460 SACK_PERM TSval=1090161280 TSecr=194183553 WS=128"
"80","25.535568","192.168.11.17","192.168.11.16","TCP","66","0.007021000","0.007021000","Jan  8, 2024 10:29:38.979451000 JST","","41600  >  6000 [ACK] Seq=1 Ack=1 Win=64256 Len=0 TSval=194183560 TSecr=1090161280"
"81","25.536222","192.168.11.17","192.168.11.16","TCP","93","","0.000654000","Jan  8, 2024 10:29:38.980105000 JST","","41600  >  6000 [PSH, ACK] Seq=1 Ack=1 Win=64256 Len=27 TSval=194183561 TSecr=1090161280 [TCP segment of a reassembled PDU]"
"82","25.536337","192.168.11.16","192.168.11.17","TCP","66","0.000115000","0.000115000","Jan  8, 2024 10:29:38.980220000 JST","","6000  >  41600 [ACK] Seq=1 Ack=28 Win=65152 Len=0 TSval=1090161288 TSecr=194183561"
"83","25.536450","192.168.11.17","192.168.11.16","TCP","66","","0.000113000","Jan  8, 2024 10:29:38.980333000 JST","","41600  >  6000 [FIN, ACK] Seq=28 Ack=1 Win=64256 Len=0 TSval=194183561 TSecr=1090161280"
"84","25.537755","192.168.11.16","192.168.11.17","TCP","66","0.001305000","0.001305000","Jan  8, 2024 10:29:38.981638000 JST","","6000  >  41600 [FIN, ACK] Seq=1 Ack=29 Win=65152 Len=0 TSval=1090161289 TSecr=194183561"
"85","25.544424","192.168.11.17","192.168.11.16","TCP","66","0.006669000","0.006669000","Jan  8, 2024 10:29:38.988307000 JST","","41600  >  6000 [ACK] Seq=29 Ack=2 Win=64256 Len=0 TSval=194183569 TSecr=1090161289"
"86","31.578831","192.168.11.16","192.168.11.11","TCP","74","","6.034407000","Jan  8, 2024 10:29:45.022714000 JST","","48930  >  6000 [SYN] Seq=0 Win=64240 Len=0 MSS=1460 SACK_PERM TSval=1432934237 TSecr=0 WS=128"
"87","31.585613","192.168.11.11","192.168.11.16","TCP","74","0.006782000","0.006782000","Jan  8, 2024 10:29:45.029496000 JST","","6000  >  48930 [SYN, ACK] Seq=0 Ack=1 Win=65160 Len=0 MSS=1460 SACK_PERM TSval=4225299208 TSecr=1432934237 WS=128"
"88","31.585734","192.168.11.16","192.168.11.11","TCP","66","0.000121000","0.000121000","Jan  8, 2024 10:29:45.029617000 JST","","48930  >  6000 [ACK] Seq=1 Ack=1 Win=64256 Len=0 TSval=1432934244 TSecr=4225299208"
"89","31.585867","192.168.11.16","192.168.11.11","TCP","93","","0.000133000","Jan  8, 2024 10:29:45.029750000 JST","","48930  >  6000 [PSH, ACK] Seq=1 Ack=1 Win=64256 Len=27 TSval=1432934244 TSecr=4225299208 [TCP segment of a reassembled PDU]"
"90","31.585975","192.168.11.16","192.168.11.11","TCP","66","","0.000108000","Jan  8, 2024 10:29:45.029858000 JST","","48930  >  6000 [FIN, ACK] Seq=28 Ack=1 Win=64256 Len=0 TSval=1432934245 TSecr=4225299208"
"91","31.593013","192.168.11.11","192.168.11.16","TCP","66","0.007146000","0.007038000","Jan  8, 2024 10:29:45.036896000 JST","","6000  >  48930 [ACK] Seq=1 Ack=28 Win=65152 Len=0 TSval=4225299215 TSecr=1432934244"
"92","31.593376","192.168.11.11","192.168.11.16","TCP","66","0.007401000","0.000363000","Jan  8, 2024 10:29:45.037259000 JST","","6000  >  48930 [FIN, ACK] Seq=1 Ack=29 Win=65152 Len=0 TSval=4225299216 TSecr=1432934245"
"93","31.593422","192.168.11.16","192.168.11.11","TCP","66","0.000046000","0.000046000","Jan  8, 2024 10:29:45.037305000 JST","","48930  >  6000 [ACK] Seq=29 Ack=2 Win=64256 Len=0 TSval=1432934252 TSecr=4225299216"
"94","31.622654","192.168.11.16","255.255.255.255","UDP","209","","0.029232000","Jan  8, 2024 10:29:45.066537000 JST","7b2273656d616e74696373223a207b22656e74697479223a2022504944222c202262617365656e74697479223a2022616e79222c2022726f6c65223a2022717171222c20227370617469616c223a2022616e79222c202274656d706f72616c223a2022616e79227d2c20226461746170726f7065727479223a207b22666f726d6174223a2022696e616f6b615f70726f6772616d5f73616d706c655f73656d616e746963227d7d","46387  >  7000 Len=167"
"95","31.633185","192.168.11.17","192.168.11.16","TCP","74","","0.010531000","Jan  8, 2024 10:29:45.077068000 JST","","41508  >  6000 [SYN] Seq=0 Win=64240 Len=0 MSS=1460 SACK_PERM TSval=194189656 TSecr=0 WS=128"
"96","31.633334","192.168.11.16","192.168.11.17","TCP","74","0.000149000","0.000149000","Jan  8, 2024 10:29:45.077217000 JST","","6000  >  41508 [SYN, ACK] Seq=0 Ack=1 Win=65160 Len=0 MSS=1460 SACK_PERM TSval=1090167385 TSecr=194189656 WS=128"
"97","31.639965","192.168.11.17","192.168.11.16","TCP","66","0.006631000","0.006631000","Jan  8, 2024 10:29:45.083848000 JST","","41508  >  6000 [ACK] Seq=1 Ack=1 Win=64256 Len=0 TSval=194189665 TSecr=1090167385"
"98","31.640617","192.168.11.17","192.168.11.16","TCP","93","","0.000652000","Jan  8, 2024 10:29:45.084500000 JST","","41508  >  6000 [PSH, ACK] Seq=1 Ack=1 Win=64256 Len=27 TSval=194189665 TSecr=1090167385 [TCP segment of a reassembled PDU]"
"99","31.640739","192.168.11.16","192.168.11.17","TCP","66","0.000122000","0.000122000","Jan  8, 2024 10:29:45.084622000 JST","","6000  >  41508 [ACK] Seq=1 Ack=28 Win=65152 Len=0 TSval=1090167392 TSecr=194189665"
"100","31.640829","192.168.11.17","192.168.11.16","TCP","66","","0.000090000","Jan  8, 2024 10:29:45.084712000 JST","","41508  >  6000 [FIN, ACK] Seq=28 Ack=1 Win=64256 Len=0 TSval=194189665 TSecr=1090167385"
"101","31.642037","192.168.11.16","192.168.11.17","TCP","66","0.001208000","0.001208000","Jan  8, 2024 10:29:45.085920000 JST","","6000  >  41508 [FIN, ACK] Seq=1 Ack=29 Win=65152 Len=0 TSval=1090167394 TSecr=194189665"
"102","31.648168","192.168.11.17","192.168.11.16","TCP","66","0.006131000","0.006131000","Jan  8, 2024 10:29:45.092051000 JST","","41508  >  6000 [ACK] Seq=29 Ack=2 Win=64256 Len=0 TSval=194189673 TSecr=1090167394"
"103","37.686487","192.168.11.16","192.168.11.11","TCP","74","","6.038319000","Jan  8, 2024 10:29:51.130370000 JST","","38240  >  6000 [SYN] Seq=0 Win=64240 Len=0 MSS=1460 SACK_PERM TSval=1432940345 TSecr=0 WS=128"
"104","37.693556","192.168.11.11","192.168.11.16","TCP","74","0.007069000","0.007069000","Jan  8, 2024 10:29:51.137439000 JST","","6000  >  38240 [SYN, ACK] Seq=0 Ack=1 Win=65160 Len=0 MSS=1460 SACK_PERM TSval=4225305316 TSecr=1432940345 WS=128"
"105","37.693668","192.168.11.16","192.168.11.11","TCP","66","0.000112000","0.000112000","Jan  8, 2024 10:29:51.137551000 JST","","38240  >  6000 [ACK] Seq=1 Ack=1 Win=64256 Len=0 TSval=1432940352 TSecr=4225305316"
"106","37.693838","192.168.11.16","192.168.11.11","TCP","93","","0.000170000","Jan  8, 2024 10:29:51.137721000 JST","","38240  >  6000 [PSH, ACK] Seq=1 Ack=1 Win=64256 Len=27 TSval=1432940352 TSecr=4225305316 [TCP segment of a reassembled PDU]"
"107","37.693938","192.168.11.16","192.168.11.11","TCP","66","","0.000100000","Jan  8, 2024 10:29:51.137821000 JST","","38240  >  6000 [FIN, ACK] Seq=28 Ack=1 Win=64256 Len=0 TSval=1432940353 TSecr=4225305316"
"108","37.702727","192.168.11.11","192.168.11.16","TCP","66","0.008889000","0.008789000","Jan  8, 2024 10:29:51.146610000 JST","","6000  >  38240 [ACK] Seq=1 Ack=28 Win=65152 Len=0 TSval=4225305325 TSecr=1432940352"
"109","37.705651","192.168.11.11","192.168.11.16","TCP","66","0.011713000","0.002924000","Jan  8, 2024 10:29:51.149534000 JST","","6000  >  38240 [FIN, ACK] Seq=1 Ack=29 Win=65152 Len=0 TSval=4225305327 TSecr=1432940353"
"110","37.705705","192.168.11.16","192.168.11.11","TCP","66","0.000054000","0.000054000","Jan  8, 2024 10:29:51.149588000 JST","","38240  >  6000 [ACK] Seq=29 Ack=2 Win=64256 Len=0 TSval=1432940364 TSecr=4225305327"
"111","37.734821","192.168.11.16","255.255.255.255","UDP","209","","0.029116000","Jan  8, 2024 10:29:51.178704000 JST","7b2273656d616e74696373223a207b22656e74697479223a2022504944222c202262617365656e74697479223a2022616e79222c2022726f6c65223a2022717171222c20227370617469616c223a2022616e79222c202274656d706f72616c223a2022616e79227d2c20226461746170726f7065727479223a207b22666f726d6174223a2022696e616f6b615f70726f6772616d5f73616d706c655f73656d616e746963227d7d","55689  >  7000 Len=167"
"112","37.742675","192.168.11.17","192.168.11.16","TCP","74","","0.007854000","Jan  8, 2024 10:29:51.186558000 JST","","48802  >  6000 [SYN] Seq=0 Win=64240 Len=0 MSS=1460 SACK_PERM TSval=194195767 TSecr=0 WS=128"
"113","37.742825","192.168.11.16","192.168.11.17","TCP","74","0.000150000","0.000150000","Jan  8, 2024 10:29:51.186708000 JST","","6000  >  48802 [SYN, ACK] Seq=0 Ack=1 Win=65160 Len=0 MSS=1460 SACK_PERM TSval=1090173494 TSecr=194195767 WS=128"
"114","37.758842","192.168.11.17","192.168.11.16","TCP","66","0.016017000","0.016017000","Jan  8, 2024 10:29:51.202725000 JST","","48802  >  6000 [ACK] Seq=1 Ack=1 Win=64256 Len=0 TSval=194195775 TSecr=1090173494"
"115","37.759405","192.168.11.17","192.168.11.16","TCP","93","","0.000563000","Jan  8, 2024 10:29:51.203288000 JST","","48802  >  6000 [PSH, ACK] Seq=1 Ack=1 Win=64256 Len=27 TSval=194195775 TSecr=1090173494 [TCP segment of a reassembled PDU]"
"116","37.759479","192.168.11.16","192.168.11.17","TCP","66","0.000074000","0.000074000","Jan  8, 2024 10:29:51.203362000 JST","","6000  >  48802 [ACK] Seq=1 Ack=28 Win=65152 Len=0 TSval=1090173511 TSecr=194195775"
"117","37.759547","192.168.11.17","192.168.11.16","TCP","66","","0.000068000","Jan  8, 2024 10:29:51.203430000 JST","","48802  >  6000 [FIN, ACK] Seq=28 Ack=1 Win=64256 Len=0 TSval=194195775 TSecr=1090173494"
"118","37.760548","192.168.11.16","192.168.11.17","TCP","66","0.001001000","0.001001000","Jan  8, 2024 10:29:51.204431000 JST","","6000  >  48802 [FIN, ACK] Seq=1 Ack=29 Win=65152 Len=0 TSval=1090173512 TSecr=194195775"
"119","37.767954","192.168.11.17","192.168.11.16","TCP","66","0.007406000","0.007406000","Jan  8, 2024 10:29:51.211837000 JST","","48802  >  6000 [ACK] Seq=29 Ack=2 Win=64256 Len=0 TSval=194195792 TSecr=1090173512"
"120","43.812883","192.168.11.16","192.168.11.11","TCP","74","","6.044929000","Jan  8, 2024 10:29:57.256766000 JST","","50284  >  6000 [SYN] Seq=0 Win=64240 Len=0 MSS=1460 SACK_PERM TSval=1432946471 TSecr=0 WS=128"
"121","43.820444","192.168.11.11","192.168.11.16","TCP","74","0.007561000","0.007561000","Jan  8, 2024 10:29:57.264327000 JST","","6000  >  50284 [SYN, ACK] Seq=0 Ack=1 Win=65160 Len=0 MSS=1460 SACK_PERM TSval=4225311443 TSecr=1432946471 WS=128"
"122","43.820554","192.168.11.16","192.168.11.11","TCP","66","0.000110000","0.000110000","Jan  8, 2024 10:29:57.264437000 JST","","50284  >  6000 [ACK] Seq=1 Ack=1 Win=64256 Len=0 TSval=1432946479 TSecr=4225311443"
"123","43.820696","192.168.11.16","192.168.11.11","TCP","93","","0.000142000","Jan  8, 2024 10:29:57.264579000 JST","","50284  >  6000 [PSH, ACK] Seq=1 Ack=1 Win=64256 Len=27 TSval=1432946479 TSecr=4225311443 [TCP segment of a reassembled PDU]"
"124","43.820822","192.168.11.16","192.168.11.11","TCP","66","","0.000126000","Jan  8, 2024 10:29:57.264705000 JST","","50284  >  6000 [FIN, ACK] Seq=28 Ack=1 Win=64256 Len=0 TSval=1432946479 TSecr=4225311443"
"125","43.828489","192.168.11.11","192.168.11.16","TCP","66","0.007793000","0.007667000","Jan  8, 2024 10:29:57.272372000 JST","","6000  >  50284 [ACK] Seq=1 Ack=28 Win=65152 Len=0 TSval=4225311450 TSecr=1432946479"
"126","43.828727","192.168.11.11","192.168.11.16","TCP","66","0.007905000","0.000238000","Jan  8, 2024 10:29:57.272610000 JST","","6000  >  50284 [FIN, ACK] Seq=1 Ack=29 Win=65152 Len=0 TSval=4225311453 TSecr=1432946479"
"127","43.828770","192.168.11.16","192.168.11.11","TCP","66","0.000043000","0.000043000","Jan  8, 2024 10:29:57.272653000 JST","","50284  >  6000 [ACK] Seq=29 Ack=2 Win=64256 Len=0 TSval=1432946487 TSecr=4225311453"
"128","43.859977","192.168.11.16","255.255.255.255","UDP","209","","0.031207000","Jan  8, 2024 10:29:57.303860000 JST","7b2273656d616e74696373223a207b22656e74697479223a2022504944222c202262617365656e74697479223a2022616e79222c2022726f6c65223a2022717171222c20227370617469616c223a2022616e79222c202274656d706f72616c223a2022616e79227d2c20226461746170726f7065727479223a207b22666f726d6174223a2022696e616f6b615f70726f6772616d5f73616d706c655f73656d616e746963227d7d","58217  >  7000 Len=167"
"129","43.867949","192.168.11.17","192.168.11.16","TCP","74","","0.007972000","Jan  8, 2024 10:29:57.311832000 JST","","48806  >  6000 [SYN] Seq=0 Win=64240 Len=0 MSS=1460 SACK_PERM TSval=194201893 TSecr=0 WS=128"
"130","43.868092","192.168.11.16","192.168.11.17","TCP","74","0.000143000","0.000143000","Jan  8, 2024 10:29:57.311975000 JST","","6000  >  48806 [SYN, ACK] Seq=0 Ack=1 Win=65160 Len=0 MSS=1460 SACK_PERM TSval=1090179620 TSecr=194201893 WS=128"
"131","43.875728","192.168.11.17","192.168.11.16","TCP","66","0.007636000","0.007636000","Jan  8, 2024 10:29:57.319611000 JST","","48806  >  6000 [ACK] Seq=1 Ack=1 Win=64256 Len=0 TSval=194201900 TSecr=1090179620"
"132","43.876406","192.168.11.17","192.168.11.16","TCP","93","","0.000678000","Jan  8, 2024 10:29:57.320289000 JST","","48806  >  6000 [PSH, ACK] Seq=1 Ack=1 Win=64256 Len=27 TSval=194201900 TSecr=1090179620 [TCP segment of a reassembled PDU]"
"133","43.876496","192.168.11.16","192.168.11.17","TCP","66","0.000090000","0.000090000","Jan  8, 2024 10:29:57.320379000 JST","","6000  >  48806 [ACK] Seq=1 Ack=28 Win=65152 Len=0 TSval=1090179628 TSecr=194201900"
"134","43.876583","192.168.11.17","192.168.11.16","TCP","66","","0.000087000","Jan  8, 2024 10:29:57.320466000 JST","","48806  >  6000 [FIN, ACK] Seq=28 Ack=1 Win=64256 Len=0 TSval=194201900 TSecr=1090179620"
"135","43.878007","192.168.11.16","192.168.11.17","TCP","66","0.001424000","0.001424000","Jan  8, 2024 10:29:57.321890000 JST","","6000  >  48806 [FIN, ACK] Seq=1 Ack=29 Win=65152 Len=0 TSval=1090179630 TSecr=194201900"
"136","43.884951","192.168.11.17","192.168.11.16","TCP","66","0.006944000","0.006944000","Jan  8, 2024 10:29:57.328834000 JST","","48806  >  6000 [ACK] Seq=29 Ack=2 Win=64256 Len=0 TSval=194201909 TSecr=1090179630"
"137","49.909462","192.168.11.16","192.168.11.11","TCP","74","","6.024511000","Jan  8, 2024 10:30:03.353345000 JST","","50292  >  6000 [SYN] Seq=0 Win=64240 Len=0 MSS=1460 SACK_PERM TSval=1432952568 TSecr=0 WS=128"
"138","49.916564","192.168.11.11","192.168.11.16","TCP","74","0.007102000","0.007102000","Jan  8, 2024 10:30:03.360447000 JST","","6000  >  50292 [SYN, ACK] Seq=0 Ack=1 Win=65160 Len=0 MSS=1460 SACK_PERM TSval=4225317539 TSecr=1432952568 WS=128"
"139","49.916676","192.168.11.16","192.168.11.11","TCP","66","0.000112000","0.000112000","Jan  8, 2024 10:30:03.360559000 JST","","50292  >  6000 [ACK] Seq=1 Ack=1 Win=64256 Len=0 TSval=1432952575 TSecr=4225317539"
"140","49.916852","192.168.11.16","192.168.11.11","TCP","93","","0.000176000","Jan  8, 2024 10:30:03.360735000 JST","","50292  >  6000 [PSH, ACK] Seq=1 Ack=1 Win=64256 Len=27 TSval=1432952575 TSecr=4225317539 [TCP segment of a reassembled PDU]"
"141","49.916954","192.168.11.16","192.168.11.11","TCP","66","","0.000102000","Jan  8, 2024 10:30:03.360837000 JST","","50292  >  6000 [FIN, ACK] Seq=28 Ack=1 Win=64256 Len=0 TSval=1432952576 TSecr=4225317539"
"142","49.924743","192.168.11.11","192.168.11.16","TCP","66","0.007891000","0.007789000","Jan  8, 2024 10:30:03.368626000 JST","","6000  >  50292 [ACK] Seq=1 Ack=28 Win=65152 Len=0 TSval=4225317547 TSecr=1432952575"
"143","49.926711","192.168.11.11","192.168.11.16","TCP","66","0.009757000","0.001968000","Jan  8, 2024 10:30:03.370594000 JST","","6000  >  50292 [FIN, ACK] Seq=1 Ack=29 Win=65152 Len=0 TSval=4225317549 TSecr=1432952576"
"144","49.926760","192.168.11.16","192.168.11.11","TCP","66","0.000049000","0.000049000","Jan  8, 2024 10:30:03.370643000 JST","","50292  >  6000 [ACK] Seq=29 Ack=2 Win=64256 Len=0 TSval=1432952585 TSecr=4225317549"
"145","49.958653","192.168.11.16","255.255.255.255","UDP","209","","0.031893000","Jan  8, 2024 10:30:03.402536000 JST","7b2273656d616e74696373223a207b22656e74697479223a2022504944222c202262617365656e74697479223a2022616e79222c2022726f6c65223a2022717171222c20227370617469616c223a2022616e79222c202274656d706f72616c223a2022616e79227d2c20226461746170726f7065727479223a207b22666f726d6174223a2022696e616f6b615f70726f6772616d5f73616d706c655f73656d616e746963227d7d","44598  >  7000 Len=167"
"146","49.967347","192.168.11.17","192.168.11.16","TCP","74","","0.008694000","Jan  8, 2024 10:30:03.411230000 JST","","36620  >  6000 [SYN] Seq=0 Win=64240 Len=0 MSS=1460 SACK_PERM TSval=194207992 TSecr=0 WS=128"
"147","49.967502","192.168.11.16","192.168.11.17","TCP","74","0.000155000","0.000155000","Jan  8, 2024 10:30:03.411385000 JST","","6000  >  36620 [SYN, ACK] Seq=0 Ack=1 Win=65160 Len=0 MSS=1460 SACK_PERM TSval=1090185719 TSecr=194207992 WS=128"
"148","49.974239","192.168.11.17","192.168.11.16","TCP","66","0.006737000","0.006737000","Jan  8, 2024 10:30:03.418122000 JST","","36620  >  6000 [ACK] Seq=1 Ack=1 Win=64256 Len=0 TSval=194207999 TSecr=1090185719"
"149","49.974772","192.168.11.17","192.168.11.16","TCP","93","","0.000533000","Jan  8, 2024 10:30:03.418655000 JST","","36620  >  6000 [PSH, ACK] Seq=1 Ack=1 Win=64256 Len=27 TSval=194207999 TSecr=1090185719 [TCP segment of a reassembled PDU]"
"150","49.974851","192.168.11.16","192.168.11.17","TCP","66","0.000079000","0.000079000","Jan  8, 2024 10:30:03.418734000 JST","","6000  >  36620 [ACK] Seq=1 Ack=28 Win=65152 Len=0 TSval=1090185726 TSecr=194207999"
"151","49.975080","192.168.11.17","192.168.11.16","TCP","66","","0.000229000","Jan  8, 2024 10:30:03.418963000 JST","","36620  >  6000 [FIN, ACK] Seq=28 Ack=1 Win=64256 Len=0 TSval=194208000 TSecr=1090185719"
"152","49.976073","192.168.11.16","192.168.11.17","TCP","66","0.000993000","0.000993000","Jan  8, 2024 10:30:03.419956000 JST","","6000  >  36620 [FIN, ACK] Seq=1 Ack=29 Win=65152 Len=0 TSval=1090185728 TSecr=194208000"
"153","49.982366","192.168.11.17","192.168.11.16","TCP","66","0.006293000","0.006293000","Jan  8, 2024 10:30:03.426249000 JST","","36620  >  6000 [ACK] Seq=29 Ack=2 Win=64256 Len=0 TSval=194208007 TSecr=1090185728"
"154","56.015846","192.168.11.16","192.168.11.11","TCP","74","","6.033480000","Jan  8, 2024 10:30:09.459729000 JST","","54404  >  6000 [SYN] Seq=0 Win=64240 Len=0 MSS=1460 SACK_PERM TSval=1432958674 TSecr=0 WS=128"
"155","56.022290","192.168.11.11","192.168.11.16","TCP","74","0.006444000","0.006444000","Jan  8, 2024 10:30:09.466173000 JST","","6000  >  54404 [SYN, ACK] Seq=0 Ack=1 Win=65160 Len=0 MSS=1460 SACK_PERM TSval=4225323645 TSecr=1432958674 WS=128"
"156","56.022399","192.168.11.16","192.168.11.11","TCP","66","0.000109000","0.000109000","Jan  8, 2024 10:30:09.466282000 JST","","54404  >  6000 [ACK] Seq=1 Ack=1 Win=64256 Len=0 TSval=1432958681 TSecr=4225323645"
"157","56.022546","192.168.11.16","192.168.11.11","TCP","93","","0.000147000","Jan  8, 2024 10:30:09.466429000 JST","","54404  >  6000 [PSH, ACK] Seq=1 Ack=1 Win=64256 Len=27 TSval=1432958681 TSecr=4225323645 [TCP segment of a reassembled PDU]"
"158","56.022666","192.168.11.16","192.168.11.11","TCP","66","","0.000120000","Jan  8, 2024 10:30:09.466549000 JST","","54404  >  6000 [FIN, ACK] Seq=28 Ack=1 Win=64256 Len=0 TSval=1432958681 TSecr=4225323645"
"159","56.029651","192.168.11.11","192.168.11.16","TCP","66","0.007105000","0.006985000","Jan  8, 2024 10:30:09.473534000 JST","","6000  >  54404 [ACK] Seq=1 Ack=28 Win=65152 Len=0 TSval=4225323652 TSecr=1432958681"
"160","56.029862","192.168.11.11","192.168.11.16","TCP","66","0.007196000","0.000211000","Jan  8, 2024 10:30:09.473745000 JST","","6000  >  54404 [FIN, ACK] Seq=1 Ack=29 Win=65152 Len=0 TSval=4225323654 TSecr=1432958681"
"161","56.029908","192.168.11.16","192.168.11.11","TCP","66","0.000046000","0.000046000","Jan  8, 2024 10:30:09.473791000 JST","","54404  >  6000 [ACK] Seq=29 Ack=2 Win=64256 Len=0 TSval=1432958688 TSecr=4225323654"
"162","56.060940","192.168.11.16","255.255.255.255","UDP","209","","0.031032000","Jan  8, 2024 10:30:09.504823000 JST","7b2273656d616e74696373223a207b22656e74697479223a2022504944222c202262617365656e74697479223a2022616e79222c2022726f6c65223a2022717171222c20227370617469616c223a2022616e79222c202274656d706f72616c223a2022616e79227d2c20226461746170726f7065727479223a207b22666f726d6174223a2022696e616f6b615f70726f6772616d5f73616d706c655f73656d616e746963227d7d","38221  >  7000 Len=167"
"163","56.068523","192.168.11.17","192.168.11.16","TCP","74","","0.007583000","Jan  8, 2024 10:30:09.512406000 JST","","36630  >  6000 [SYN] Seq=0 Win=64240 Len=0 MSS=1460 SACK_PERM TSval=194214093 TSecr=0 WS=128"
"164","56.068743","192.168.11.16","192.168.11.17","TCP","74","0.000220000","0.000220000","Jan  8, 2024 10:30:09.512626000 JST","","6000  >  36630 [SYN, ACK] Seq=0 Ack=1 Win=65160 Len=0 MSS=1460 SACK_PERM TSval=1090191820 TSecr=194214093 WS=128"
"165","56.075541","192.168.11.17","192.168.11.16","TCP","66","0.006798000","0.006798000","Jan  8, 2024 10:30:09.519424000 JST","","36630  >  6000 [ACK] Seq=1 Ack=1 Win=64256 Len=0 TSval=194214100 TSecr=1090191820"
"166","56.076214","192.168.11.17","192.168.11.16","TCP","93","","0.000673000","Jan  8, 2024 10:30:09.520097000 JST","","36630  >  6000 [PSH, ACK] Seq=1 Ack=1 Win=64256 Len=27 TSval=194214101 TSecr=1090191820 [TCP segment of a reassembled PDU]"
"167","56.076331","192.168.11.16","192.168.11.17","TCP","66","0.000117000","0.000117000","Jan  8, 2024 10:30:09.520214000 JST","","6000  >  36630 [ACK] Seq=1 Ack=28 Win=65152 Len=0 TSval=1090191828 TSecr=194214101"
"168","56.076407","192.168.11.17","192.168.11.16","TCP","66","","0.000076000","Jan  8, 2024 10:30:09.520290000 JST","","36630  >  6000 [FIN, ACK] Seq=28 Ack=1 Win=64256 Len=0 TSval=194214101 TSecr=1090191820"
