No.,Time,Source,Destination,Protocol,Length,The RTT to ACK the segment was,XXX,Time delta from previous captured frame,Arrival Time,Data,Info
1,0,192.168.11.27,192.168.11.42,TCP,74,,,0,"Jan  8, 2024 10:29:12.647856000 JST",,57842  >  6000 [SYN] Seq=0 Win=64240 Len=0 MSS=1460 SACK_PERM TSval=526973465 TSecr=0 WS=128
2,0.008377,192.168.11.42,192.168.11.27,TCP,74,0.008377,,0.008377,"Jan  8, 2024 10:29:12.656233000 JST",,"6000  >  57842 [SYN, ACK] Seq=0 Ack=1 Win=65160 Len=0 MSS=1460 SACK_PERM TSval=1741943154 TSecr=526973465 WS=128"
3,0.008494,192.168.11.27,192.168.11.42,TCP,66,0.000117,,0.000117,"Jan  8, 2024 10:29:12.656350000 JST",,57842  >  6000 [ACK] Seq=1 Ack=1 Win=64256 Len=0 TSval=526973474 TSecr=1741943154
4,0.008782,192.168.11.27,192.168.11.42,TCP,93,,,0.000288,"Jan  8, 2024 10:29:12.656638000 JST",,"57842  >  6000 [PSH, ACK] Seq=1 Ack=1 Win=64256 Len=27 TSval=526973474 TSecr=1741943154 [TCP segment of a reassembled PDU]"
5,0.00892,192.168.11.27,192.168.11.42,TCP,66,,,0.000138,"Jan  8, 2024 10:29:12.656776000 JST",,"57842  >  6000 [FIN, ACK] Seq=28 Ack=1 Win=64256 Len=0 TSval=526973474 TSecr=1741943154"
6,0.015011,192.168.11.42,192.168.11.27,TCP,66,0.006229,,0.006091,"Jan  8, 2024 10:29:12.662867000 JST",,6000  >  57842 [ACK] Seq=1 Ack=28 Win=65152 Len=0 TSval=1741943162 TSecr=526973474
7,0.043382,192.168.11.27,255.255.255.255,UDP,209,,Ÿ,0.028371,"Jan  8, 2024 10:29:12.691238000 JST",7b2273656d616e74696373223a207b22656e74697479223a2022504944222c202262617365656e74697479223a2022616e79222c2022726f6c65223a2022626262222c20227370617469616c223a2022616e79222c202274656d706f72616c223a2022616e79227d2c20226461746170726f7065727479223a207b22666f726d6174223a2022696e616f6b615f70726f6772616d5f73616d706c655f73656d616e746963227d7d,45597  >  7000 Len=167
8,0.050403,192.168.11.13,192.168.11.27,TCP,74,,œ,0.007021,"Jan  8, 2024 10:29:12.698259000 JST",,44466  >  6000 [SYN] Seq=0 Win=64240 Len=0 MSS=1460 SACK_PERM TSval=663835276 TSecr=0 WS=128
9,0.050545,192.168.11.27,192.168.11.13,TCP,74,0.000142,,0.000142,"Jan  8, 2024 10:29:12.698401000 JST",,"6000  >  44466 [SYN, ACK] Seq=0 Ack=1 Win=65160 Len=0 MSS=1460 SACK_PERM TSval=499393998 TSecr=663835276 WS=128"
10,0.057817,192.168.11.42,192.168.11.27,TCP,66,0.048897,,0.007272,"Jan  8, 2024 10:29:12.705673000 JST",,6000  >  57842 [ACK] Seq=1 Ack=29 Win=65152 Len=0 TSval=1741943205 TSecr=526973474
11,0.058433,192.168.11.13,192.168.11.27,TCP,66,0.007888,,0.000616,"Jan  8, 2024 10:29:12.706289000 JST",,44466  >  6000 [ACK] Seq=1 Ack=1 Win=64256 Len=0 TSval=663835285 TSecr=499393998
12,0.058635,192.168.11.13,192.168.11.27,TCP,93,,,0.000202,"Jan  8, 2024 10:29:12.706491000 JST",,"44466  >  6000 [PSH, ACK] Seq=1 Ack=1 Win=64256 Len=27 TSval=663835286 TSecr=499393998 [TCP segment of a reassembled PDU]"
13,0.058702,192.168.11.27,192.168.11.13,TCP,66,0.000067,,0.000067,"Jan  8, 2024 10:29:12.706558000 JST",,6000  >  44466 [ACK] Seq=1 Ack=28 Win=65152 Len=0 TSval=499394006 TSecr=663835286
14,0.05878,192.168.11.13,192.168.11.27,TCP,66,,,0.000078,"Jan  8, 2024 10:29:12.706636000 JST",,"44466  >  6000 [FIN, ACK] Seq=28 Ack=1 Win=64256 Len=0 TSval=663835286 TSecr=499393998"
15,0.061565,192.168.11.27,192.168.11.13,TCP,66,0.002785,,0.002785,"Jan  8, 2024 10:29:12.709421000 JST",,"6000  >  44466 [FIN, ACK] Seq=1 Ack=29 Win=65152 Len=0 TSval=499394009 TSecr=663835286"
16,0.068711,192.168.11.13,192.168.11.27,TCP,66,0.007146,,0.007146,"Jan  8, 2024 10:29:12.716567000 JST",,44466  >  6000 [ACK] Seq=29 Ack=2 Win=64256 Len=0 TSval=663835295 TSecr=499394009
17,6.176526,192.168.11.27,192.168.11.42,TCP,74,,,6.107815,"Jan  8, 2024 10:29:18.824382000 JST",,57858  >  6000 [SYN] Seq=0 Win=64240 Len=0 MSS=1460 SACK_PERM TSval=526979642 TSecr=0 WS=128
18,6.18345,192.168.11.42,192.168.11.27,TCP,74,0.006924,,0.006924,"Jan  8, 2024 10:29:18.831306000 JST",,"6000  >  57858 [SYN, ACK] Seq=0 Ack=1 Win=65160 Len=0 MSS=1460 SACK_PERM TSval=1741949330 TSecr=526979642 WS=128"
19,6.183565,192.168.11.27,192.168.11.42,TCP,66,0.000115,,0.000115,"Jan  8, 2024 10:29:18.831421000 JST",,57858  >  6000 [ACK] Seq=1 Ack=1 Win=64256 Len=0 TSval=526979649 TSecr=1741949330
20,6.183778,192.168.11.27,192.168.11.42,TCP,93,,,0.000213,"Jan  8, 2024 10:29:18.831634000 JST",,"57858  >  6000 [PSH, ACK] Seq=1 Ack=1 Win=64256 Len=27 TSval=526979649 TSecr=1741949330 [TCP segment of a reassembled PDU]"
21,6.183902,192.168.11.27,192.168.11.42,TCP,66,,,0.000124,"Jan  8, 2024 10:29:18.831758000 JST",,"57858  >  6000 [FIN, ACK] Seq=28 Ack=1 Win=64256 Len=0 TSval=526979649 TSecr=1741949330"
22,6.190825,192.168.11.42,192.168.11.27,TCP,66,0.007047,,0.006923,"Jan  8, 2024 10:29:18.838681000 JST",,6000  >  57858 [ACK] Seq=1 Ack=28 Win=65152 Len=0 TSval=1741949337 TSecr=526979649
23,6.191067,192.168.11.42,192.168.11.27,TCP,66,,,0.000242,"Jan  8, 2024 10:29:18.838923000 JST",,"6000  >  57842 [FIN, ACK] Seq=1 Ack=29 Win=65152 Len=0 TSval=1741949339 TSecr=526973474"
24,6.191135,192.168.11.27,192.168.11.42,TCP,66,0.000068,,0.000068,"Jan  8, 2024 10:29:18.838991000 JST",,57842  >  6000 [ACK] Seq=29 Ack=2 Win=64256 Len=0 TSval=526979656 TSecr=1741949339
25,6.220719,192.168.11.27,255.255.255.255,UDP,209,,Ÿ,0.029584,"Jan  8, 2024 10:29:18.868575000 JST",7b2273656d616e74696373223a207b22656e74697479223a2022504944222c202262617365656e74697479223a2022616e79222c2022726f6c65223a2022626262222c20227370617469616c223a2022616e79222c202274656d706f72616c223a2022616e79227d2c20226461746170726f7065727479223a207b22666f726d6174223a2022696e616f6b615f70726f6772616d5f73616d706c655f73656d616e746963227d7d,35276  >  7000 Len=167
26,6.226483,192.168.11.13,192.168.11.27,TCP,74,,œ,0.005764,"Jan  8, 2024 10:29:18.874339000 JST",,48050  >  6000 [SYN] Seq=0 Win=64240 Len=0 MSS=1460 SACK_PERM TSval=663841454 TSecr=0 WS=128
27,6.22664,192.168.11.27,192.168.11.13,TCP,74,0.000157,,0.000157,"Jan  8, 2024 10:29:18.874496000 JST",,"6000  >  48050 [SYN, ACK] Seq=0 Ack=1 Win=65160 Len=0 MSS=1460 SACK_PERM TSval=499400174 TSecr=663841454 WS=128"
28,6.234407,192.168.11.13,192.168.11.27,TCP,66,0.007767,,0.007767,"Jan  8, 2024 10:29:18.882263000 JST",,48050  >  6000 [ACK] Seq=1 Ack=1 Win=64256 Len=0 TSval=663841461 TSecr=499400174
29,6.235004,192.168.11.13,192.168.11.27,TCP,93,,,0.000597,"Jan  8, 2024 10:29:18.882860000 JST",,"48050  >  6000 [PSH, ACK] Seq=1 Ack=1 Win=64256 Len=27 TSval=663841461 TSecr=499400174 [TCP segment of a reassembled PDU]"
30,6.23509,192.168.11.27,192.168.11.13,TCP,66,0.000086,,0.000086,"Jan  8, 2024 10:29:18.882946000 JST",,6000  >  48050 [ACK] Seq=1 Ack=28 Win=65152 Len=0 TSval=499400182 TSecr=663841461
31,6.235162,192.168.11.13,192.168.11.27,TCP,66,,,0.000072,"Jan  8, 2024 10:29:18.883018000 JST",,"48050  >  6000 [FIN, ACK] Seq=28 Ack=1 Win=64256 Len=0 TSval=663841462 TSecr=499400174"
32,6.236712,192.168.11.27,192.168.11.13,TCP,66,0.00155,,0.00155,"Jan  8, 2024 10:29:18.884568000 JST",,"6000  >  48050 [FIN, ACK] Seq=1 Ack=29 Win=65152 Len=0 TSval=499400184 TSecr=663841462"
33,6.24709,192.168.11.42,192.168.11.27,TCP,66,0.063188,,0.010378,"Jan  8, 2024 10:29:18.894946000 JST",,6000  >  57858 [ACK] Seq=1 Ack=29 Win=65152 Len=0 TSval=1741949385 TSecr=526979649
34,6.247616,192.168.11.13,192.168.11.27,TCP,66,0.010904,,0.000526,"Jan  8, 2024 10:29:18.895472000 JST",,48050  >  6000 [ACK] Seq=29 Ack=2 Win=64256 Len=0 TSval=663841469 TSecr=499400184
35,12.276581,192.168.11.27,192.168.11.42,TCP,74,,,6.028965,"Jan  8, 2024 10:29:24.924437000 JST",,60646  >  6000 [SYN] Seq=0 Win=64240 Len=0 MSS=1460 SACK_PERM TSval=526985742 TSecr=0 WS=128
36,12.284479,192.168.11.42,192.168.11.27,TCP,74,0.007898,,0.007898,"Jan  8, 2024 10:29:24.932335000 JST",,"6000  >  60646 [SYN, ACK] Seq=0 Ack=1 Win=65160 Len=0 MSS=1460 SACK_PERM TSval=1741955431 TSecr=526985742 WS=128"
37,12.28459,192.168.11.27,192.168.11.42,TCP,66,0.000111,,0.000111,"Jan  8, 2024 10:29:24.932446000 JST",,60646  >  6000 [ACK] Seq=1 Ack=1 Win=64256 Len=0 TSval=526985750 TSecr=1741955431
38,12.28478,192.168.11.27,192.168.11.42,TCP,93,,,0.00019,"Jan  8, 2024 10:29:24.932636000 JST",,"60646  >  6000 [PSH, ACK] Seq=1 Ack=1 Win=64256 Len=27 TSval=526985750 TSecr=1741955431 [TCP segment of a reassembled PDU]"
39,12.284873,192.168.11.27,192.168.11.42,TCP,66,,,0.000093,"Jan  8, 2024 10:29:24.932729000 JST",,"60646  >  6000 [FIN, ACK] Seq=28 Ack=1 Win=64256 Len=0 TSval=526985750 TSecr=1741955431"
40,12.291764,192.168.11.42,192.168.11.27,TCP,66,0.006984,,0.006891,"Jan  8, 2024 10:29:24.939620000 JST",,6000  >  60646 [ACK] Seq=1 Ack=28 Win=65152 Len=0 TSval=1741955438 TSecr=526985750
41,12.292013,192.168.11.42,192.168.11.27,TCP,66,,,0.000249,"Jan  8, 2024 10:29:24.939869000 JST",,"6000  >  57858 [FIN, ACK] Seq=1 Ack=29 Win=65152 Len=0 TSval=1741955440 TSecr=526979649"
42,12.292078,192.168.11.27,192.168.11.42,TCP,66,0.000065,,0.000065,"Jan  8, 2024 10:29:24.939934000 JST",,57858  >  6000 [ACK] Seq=29 Ack=2 Win=64256 Len=0 TSval=526985757 TSecr=1741955440
43,12.322183,192.168.11.27,255.255.255.255,UDP,209,,Ÿ,0.030105,"Jan  8, 2024 10:29:24.970039000 JST",7b2273656d616e74696373223a207b22656e74697479223a2022504944222c202262617365656e74697479223a2022616e79222c2022726f6c65223a2022626262222c20227370617469616c223a2022616e79222c202274656d706f72616c223a2022616e79227d2c20226461746170726f7065727479223a207b22666f726d6174223a2022696e616f6b615f70726f6772616d5f73616d706c655f73656d616e746963227d7d,50840  >  7000 Len=167
44,12.328359,192.168.11.13,192.168.11.27,TCP,74,,œ,0.006176,"Jan  8, 2024 10:29:24.976215000 JST",,48064  >  6000 [SYN] Seq=0 Win=64240 Len=0 MSS=1460 SACK_PERM TSval=663847555 TSecr=0 WS=128
45,12.328503,192.168.11.27,192.168.11.13,TCP,74,0.000144,,0.000144,"Jan  8, 2024 10:29:24.976359000 JST",,"6000  >  48064 [SYN, ACK] Seq=0 Ack=1 Win=65160 Len=0 MSS=1460 SACK_PERM TSval=499406276 TSecr=663847555 WS=128"
46,12.334279,192.168.11.42,192.168.11.27,TCP,66,0.049406,,0.005776,"Jan  8, 2024 10:29:24.982135000 JST",,6000  >  60646 [ACK] Seq=1 Ack=29 Win=65152 Len=0 TSval=1741955481 TSecr=526985750
47,12.334847,192.168.11.13,192.168.11.27,TCP,66,0.006344,,0.000568,"Jan  8, 2024 10:29:24.982703000 JST",,48064  >  6000 [ACK] Seq=1 Ack=1 Win=64256 Len=0 TSval=663847562 TSecr=499406276
48,12.335004,192.168.11.13,192.168.11.27,TCP,93,,,0.000157,"Jan  8, 2024 10:29:24.982860000 JST",,"48064  >  6000 [PSH, ACK] Seq=1 Ack=1 Win=64256 Len=27 TSval=663847562 TSecr=499406276 [TCP segment of a reassembled PDU]"
49,12.335078,192.168.11.27,192.168.11.13,TCP,66,0.000074,,0.000074,"Jan  8, 2024 10:29:24.982934000 JST",,6000  >  48064 [ACK] Seq=1 Ack=28 Win=65152 Len=0 TSval=499406282 TSecr=663847562
50,12.335155,192.168.11.13,192.168.11.27,TCP,66,,,0.000077,"Jan  8, 2024 10:29:24.983011000 JST",,"48064  >  6000 [FIN, ACK] Seq=28 Ack=1 Win=64256 Len=0 TSval=663847562 TSecr=499406276"
51,12.336761,192.168.11.27,192.168.11.13,TCP,66,0.001606,,0.001606,"Jan  8, 2024 10:29:24.984617000 JST",,"6000  >  48064 [FIN, ACK] Seq=1 Ack=29 Win=65152 Len=0 TSval=499406284 TSecr=663847562"
52,12.341894,192.168.11.13,192.168.11.27,TCP,66,0.005133,,0.005133,"Jan  8, 2024 10:29:24.989750000 JST",,48064  >  6000 [ACK] Seq=29 Ack=2 Win=64256 Len=0 TSval=663847569 TSecr=499406284
53,18.392283,192.168.11.27,192.168.11.42,TCP,74,,,6.050389,"Jan  8, 2024 10:29:31.040139000 JST",,60652  >  6000 [SYN] Seq=0 Win=64240 Len=0 MSS=1460 SACK_PERM TSval=526991857 TSecr=0 WS=128
54,18.399944,192.168.11.42,192.168.11.27,TCP,74,0.007661,,0.007661,"Jan  8, 2024 10:29:31.047800000 JST",,"6000  >  60652 [SYN, ACK] Seq=0 Ack=1 Win=65160 Len=0 MSS=1460 SACK_PERM TSval=1741961547 TSecr=526991857 WS=128"
55,18.400063,192.168.11.27,192.168.11.42,TCP,66,0.000119,,0.000119,"Jan  8, 2024 10:29:31.047919000 JST",,60652  >  6000 [ACK] Seq=1 Ack=1 Win=64256 Len=0 TSval=526991865 TSecr=1741961547
56,18.400205,192.168.11.27,192.168.11.42,TCP,93,,,0.000142,"Jan  8, 2024 10:29:31.048061000 JST",,"60652  >  6000 [PSH, ACK] Seq=1 Ack=1 Win=64256 Len=27 TSval=526991865 TSecr=1741961547 [TCP segment of a reassembled PDU]"
57,18.400327,192.168.11.27,192.168.11.42,TCP,66,,,0.000122,"Jan  8, 2024 10:29:31.048183000 JST",,"60652  >  6000 [FIN, ACK] Seq=28 Ack=1 Win=64256 Len=0 TSval=526991866 TSecr=1741961547"
58,18.40768,192.168.11.42,192.168.11.27,TCP,66,0.007475,,0.007353,"Jan  8, 2024 10:29:31.055536000 JST",,6000  >  60652 [ACK] Seq=1 Ack=28 Win=65152 Len=0 TSval=1741961554 TSecr=526991865
59,18.407922,192.168.11.42,192.168.11.27,TCP,66,,,0.000242,"Jan  8, 2024 10:29:31.055778000 JST",,"6000  >  60646 [FIN, ACK] Seq=1 Ack=29 Win=65152 Len=0 TSval=1741961555 TSecr=526985750"
60,18.408007,192.168.11.27,192.168.11.42,TCP,66,0.000085,,0.000085,"Jan  8, 2024 10:29:31.055863000 JST",,60646  >  6000 [ACK] Seq=29 Ack=2 Win=64256 Len=0 TSval=526991873 TSecr=1741961555
61,18.437025,192.168.11.27,255.255.255.255,UDP,209,,Ÿ,0.029018,"Jan  8, 2024 10:29:31.084881000 JST",7b2273656d616e74696373223a207b22656e74697479223a2022504944222c202262617365656e74697479223a2022616e79222c2022726f6c65223a2022626262222c20227370617469616c223a2022616e79222c202274656d706f72616c223a2022616e79227d2c20226461746170726f7065727479223a207b22666f726d6174223a2022696e616f6b615f70726f6772616d5f73616d706c655f73656d616e746963227d7d,41313  >  7000 Len=167
62,18.44375,192.168.11.13,192.168.11.27,TCP,74,,œ,0.006725,"Jan  8, 2024 10:29:31.091606000 JST",,40526  >  6000 [SYN] Seq=0 Win=64240 Len=0 MSS=1460 SACK_PERM TSval=663853670 TSecr=0 WS=128
63,18.443878,192.168.11.27,192.168.11.13,TCP,74,0.000128,,0.000128,"Jan  8, 2024 10:29:31.091734000 JST",,"6000  >  40526 [SYN, ACK] Seq=0 Ack=1 Win=65160 Len=0 MSS=1460 SACK_PERM TSval=499412391 TSecr=663853670 WS=128"
64,18.449916,192.168.11.42,192.168.11.27,TCP,66,0.049589,,0.006038,"Jan  8, 2024 10:29:31.097772000 JST",,6000  >  60652 [ACK] Seq=1 Ack=29 Win=65152 Len=0 TSval=1741961597 TSecr=526991866
65,18.450529,192.168.11.13,192.168.11.27,TCP,66,0.006651,,0.000613,"Jan  8, 2024 10:29:31.098385000 JST",,40526  >  6000 [ACK] Seq=1 Ack=1 Win=64256 Len=0 TSval=663853677 TSecr=499412391
66,18.450761,192.168.11.13,192.168.11.27,TCP,93,,,0.000232,"Jan  8, 2024 10:29:31.098617000 JST",,"40526  >  6000 [PSH, ACK] Seq=1 Ack=1 Win=64256 Len=27 TSval=663853678 TSecr=499412391 [TCP segment of a reassembled PDU]"
67,18.450853,192.168.11.27,192.168.11.13,TCP,66,0.000092,,0.000092,"Jan  8, 2024 10:29:31.098709000 JST",,6000  >  40526 [ACK] Seq=1 Ack=28 Win=65152 Len=0 TSval=499412398 TSecr=663853678
68,18.45093,192.168.11.13,192.168.11.27,TCP,66,,,0.000077,"Jan  8, 2024 10:29:31.098786000 JST",,"40526  >  6000 [FIN, ACK] Seq=28 Ack=1 Win=64256 Len=0 TSval=663853678 TSecr=499412391"
69,18.453837,192.168.11.27,192.168.11.13,TCP,66,0.002907,,0.002907,"Jan  8, 2024 10:29:31.101693000 JST",,"6000  >  40526 [FIN, ACK] Seq=1 Ack=29 Win=65152 Len=0 TSval=499412401 TSecr=663853678"
70,18.461137,192.168.11.13,192.168.11.27,TCP,66,0.0073,,0.0073,"Jan  8, 2024 10:29:31.108993000 JST",,40526  >  6000 [ACK] Seq=29 Ack=2 Win=64256 Len=0 TSval=663853687 TSecr=499412401
71,25.521258,192.168.11.27,192.168.11.42,TCP,74,,,7.060121,"Jan  8, 2024 10:29:38.169114000 JST",,47514  >  6000 [SYN] Seq=0 Win=64240 Len=0 MSS=1460 SACK_PERM TSval=526998986 TSecr=0 WS=128
72,25.528805,192.168.11.42,192.168.11.27,TCP,74,0.007547,,0.007547,"Jan  8, 2024 10:29:38.176661000 JST",,"6000  >  47514 [SYN, ACK] Seq=0 Ack=1 Win=65160 Len=0 MSS=1460 SACK_PERM TSval=1741968676 TSecr=526998986 WS=128"
73,25.528941,192.168.11.27,192.168.11.42,TCP,66,0.000136,,0.000136,"Jan  8, 2024 10:29:38.176797000 JST",,47514  >  6000 [ACK] Seq=1 Ack=1 Win=64256 Len=0 TSval=526998994 TSecr=1741968676
74,25.529097,192.168.11.27,192.168.11.42,TCP,93,,,0.000156,"Jan  8, 2024 10:29:38.176953000 JST",,"47514  >  6000 [PSH, ACK] Seq=1 Ack=1 Win=64256 Len=27 TSval=526998994 TSecr=1741968676 [TCP segment of a reassembled PDU]"
75,25.52919,192.168.11.27,192.168.11.42,TCP,66,,,0.000093,"Jan  8, 2024 10:29:38.177046000 JST",,"47514  >  6000 [FIN, ACK] Seq=28 Ack=1 Win=64256 Len=0 TSval=526998994 TSecr=1741968676"
76,25.53603,192.168.11.42,192.168.11.27,TCP,66,0.006933,,0.00684,"Jan  8, 2024 10:29:38.183886000 JST",,6000  >  47514 [ACK] Seq=1 Ack=28 Win=65152 Len=0 TSval=1741968683 TSecr=526998994
77,25.53639,192.168.11.42,192.168.11.27,TCP,66,,,0.00036,"Jan  8, 2024 10:29:38.184246000 JST",,"6000  >  60652 [FIN, ACK] Seq=1 Ack=29 Win=65152 Len=0 TSval=1741968683 TSecr=526991866"
78,25.536464,192.168.11.27,192.168.11.42,TCP,66,0.000074,,0.000074,"Jan  8, 2024 10:29:38.184320000 JST",,60652  >  6000 [ACK] Seq=29 Ack=2 Win=64256 Len=0 TSval=526999002 TSecr=1741968683
79,25.565169,192.168.11.27,255.255.255.255,UDP,209,,Ÿ,0.028705,"Jan  8, 2024 10:29:38.213025000 JST",7b2273656d616e74696373223a207b22656e74697479223a2022504944222c202262617365656e74697479223a2022616e79222c2022726f6c65223a2022626262222c20227370617469616c223a2022616e79222c202274656d706f72616c223a2022616e79227d2c20226461746170726f7065727479223a207b22666f726d6174223a2022696e616f6b615f70726f6772616d5f73616d706c655f73656d616e746963227d7d,54215  >  7000 Len=167
80,25.570864,192.168.11.13,192.168.11.27,TCP,74,,œ,0.005695,"Jan  8, 2024 10:29:38.218720000 JST",,52510  >  6000 [SYN] Seq=0 Win=64240 Len=0 MSS=1460 SACK_PERM TSval=663860798 TSecr=0 WS=128
81,25.570999,192.168.11.27,192.168.11.13,TCP,74,0.000135,,0.000135,"Jan  8, 2024 10:29:38.218855000 JST",,"6000  >  52510 [SYN, ACK] Seq=0 Ack=1 Win=65160 Len=0 MSS=1460 SACK_PERM TSval=499419518 TSecr=663860798 WS=128"
82,25.577611,192.168.11.13,192.168.11.27,TCP,66,0.006612,,0.006612,"Jan  8, 2024 10:29:38.225467000 JST",,52510  >  6000 [ACK] Seq=1 Ack=1 Win=64256 Len=0 TSval=663860805 TSecr=499419518
83,25.578219,192.168.11.13,192.168.11.27,TCP,93,,,0.000608,"Jan  8, 2024 10:29:38.226075000 JST",,"52510  >  6000 [PSH, ACK] Seq=1 Ack=1 Win=64256 Len=27 TSval=663860805 TSecr=499419518 [TCP segment of a reassembled PDU]"
84,25.578354,192.168.11.27,192.168.11.13,TCP,66,0.000135,,0.000135,"Jan  8, 2024 10:29:38.226210000 JST",,6000  >  52510 [ACK] Seq=1 Ack=28 Win=65152 Len=0 TSval=499419525 TSecr=663860805
85,25.578542,192.168.11.13,192.168.11.27,TCP,66,,,0.000188,"Jan  8, 2024 10:29:38.226398000 JST",,"52510  >  6000 [FIN, ACK] Seq=28 Ack=1 Win=64256 Len=0 TSval=663860805 TSecr=499419518"
86,25.578589,192.168.11.42,192.168.11.27,TCP,66,0.049399,,0.000047,"Jan  8, 2024 10:29:38.226445000 JST",,6000  >  47514 [ACK] Seq=1 Ack=29 Win=65152 Len=0 TSval=1741968725 TSecr=526998994
87,25.579715,192.168.11.27,192.168.11.13,TCP,66,0.001173,,0.001126,"Jan  8, 2024 10:29:38.227571000 JST",,"6000  >  52510 [FIN, ACK] Seq=1 Ack=29 Win=65152 Len=0 TSval=499419527 TSecr=663860805"
88,25.585833,192.168.11.13,192.168.11.27,TCP,66,0.006118,,0.006118,"Jan  8, 2024 10:29:38.233689000 JST",,52510  >  6000 [ACK] Seq=29 Ack=2 Win=64256 Len=0 TSval=663860812 TSecr=499419527
89,31.606268,192.168.11.27,192.168.11.42,TCP,74,,,6.020435,"Jan  8, 2024 10:29:44.254124000 JST",,36524  >  6000 [SYN] Seq=0 Win=64240 Len=0 MSS=1460 SACK_PERM TSval=527005071 TSecr=0 WS=128
90,31.614076,192.168.11.42,192.168.11.27,TCP,74,0.007808,,0.007808,"Jan  8, 2024 10:29:44.261932000 JST",,"6000  >  36524 [SYN, ACK] Seq=0 Ack=1 Win=65160 Len=0 MSS=1460 SACK_PERM TSval=1741974761 TSecr=527005071 WS=128"
91,31.614183,192.168.11.27,192.168.11.42,TCP,66,0.000107,,0.000107,"Jan  8, 2024 10:29:44.262039000 JST",,36524  >  6000 [ACK] Seq=1 Ack=1 Win=64256 Len=0 TSval=527005079 TSecr=1741974761
92,31.614354,192.168.11.27,192.168.11.42,TCP,93,,,0.000171,"Jan  8, 2024 10:29:44.262210000 JST",,"36524  >  6000 [PSH, ACK] Seq=1 Ack=1 Win=64256 Len=27 TSval=527005080 TSecr=1741974761 [TCP segment of a reassembled PDU]"
93,31.614465,192.168.11.27,192.168.11.42,TCP,66,,,0.000111,"Jan  8, 2024 10:29:44.262321000 JST",,"36524  >  6000 [FIN, ACK] Seq=28 Ack=1 Win=64256 Len=0 TSval=527005080 TSecr=1741974761"
94,31.621257,192.168.11.42,192.168.11.27,TCP,66,0.006903,,0.006792,"Jan  8, 2024 10:29:44.269113000 JST",,6000  >  36524 [ACK] Seq=1 Ack=28 Win=65152 Len=0 TSval=1741974768 TSecr=527005080
95,31.62163,192.168.11.42,192.168.11.27,TCP,66,,,0.000373,"Jan  8, 2024 10:29:44.269486000 JST",,"6000  >  47514 [FIN, ACK] Seq=1 Ack=29 Win=65152 Len=0 TSval=1741974768 TSecr=526998994"
96,31.621705,192.168.11.27,192.168.11.42,TCP,66,0.000075,,0.000075,"Jan  8, 2024 10:29:44.269561000 JST",,47514  >  6000 [ACK] Seq=29 Ack=2 Win=64256 Len=0 TSval=527005087 TSecr=1741974768
97,31.649592,192.168.11.27,255.255.255.255,UDP,209,,Ÿ,0.027887,"Jan  8, 2024 10:29:44.297448000 JST",7b2273656d616e74696373223a207b22656e74697479223a2022504944222c202262617365656e74697479223a2022616e79222c2022726f6c65223a2022626262222c20227370617469616c223a2022616e79222c202274656d706f72616c223a2022616e79227d2c20226461746170726f7065727479223a207b22666f726d6174223a2022696e616f6b615f70726f6772616d5f73616d706c655f73656d616e746963227d7d,40217  >  7000 Len=167
98,31.656311,192.168.11.13,192.168.11.27,TCP,74,,œ,0.006719,"Jan  8, 2024 10:29:44.304167000 JST",,52522  >  6000 [SYN] Seq=0 Win=64240 Len=0 MSS=1460 SACK_PERM TSval=663866882 TSecr=0 WS=128
99,31.656439,192.168.11.27,192.168.11.13,TCP,74,0.000128,,0.000128,"Jan  8, 2024 10:29:44.304295000 JST",,"6000  >  52522 [SYN, ACK] Seq=0 Ack=1 Win=65160 Len=0 MSS=1460 SACK_PERM TSval=499425604 TSecr=663866882 WS=128"
100,31.661932,192.168.11.42,192.168.11.27,TCP,66,0.047467,,0.005493,"Jan  8, 2024 10:29:44.309788000 JST",,6000  >  36524 [ACK] Seq=1 Ack=29 Win=65152 Len=0 TSval=1741974809 TSecr=527005080
101,31.662576,192.168.11.13,192.168.11.27,TCP,66,0.006137,,0.000644,"Jan  8, 2024 10:29:44.310432000 JST",,52522  >  6000 [ACK] Seq=1 Ack=1 Win=64256 Len=0 TSval=663866890 TSecr=499425604
102,31.662787,192.168.11.13,192.168.11.27,TCP,93,,,0.000211,"Jan  8, 2024 10:29:44.310643000 JST",,"52522  >  6000 [PSH, ACK] Seq=1 Ack=1 Win=64256 Len=27 TSval=663866890 TSecr=499425604 [TCP segment of a reassembled PDU]"
103,31.662881,192.168.11.27,192.168.11.13,TCP,66,0.000094,,0.000094,"Jan  8, 2024 10:29:44.310737000 JST",,6000  >  52522 [ACK] Seq=1 Ack=28 Win=65152 Len=0 TSval=499425610 TSecr=663866890
104,31.662966,192.168.11.13,192.168.11.27,TCP,66,,,0.000085,"Jan  8, 2024 10:29:44.310822000 JST",,"52522  >  6000 [FIN, ACK] Seq=28 Ack=1 Win=64256 Len=0 TSval=663866890 TSecr=499425604"
105,31.665021,192.168.11.27,192.168.11.13,TCP,66,0.002055,,0.002055,"Jan  8, 2024 10:29:44.312877000 JST",,"6000  >  52522 [FIN, ACK] Seq=1 Ack=29 Win=65152 Len=0 TSval=499425612 TSecr=663866890"
106,31.669332,192.168.11.13,192.168.11.27,TCP,66,0.004311,,0.004311,"Jan  8, 2024 10:29:44.317188000 JST",,52522  >  6000 [ACK] Seq=29 Ack=2 Win=64256 Len=0 TSval=663866897 TSecr=499425612
107,37.716549,192.168.11.27,192.168.11.42,TCP,74,,,6.047217,"Jan  8, 2024 10:29:50.364405000 JST",,36538  >  6000 [SYN] Seq=0 Win=64240 Len=0 MSS=1460 SACK_PERM TSval=527011182 TSecr=0 WS=128
108,37.724312,192.168.11.42,192.168.11.27,TCP,74,0.007763,,0.007763,"Jan  8, 2024 10:29:50.372168000 JST",,"6000  >  36538 [SYN, ACK] Seq=0 Ack=1 Win=65160 Len=0 MSS=1460 SACK_PERM TSval=1741980871 TSecr=527011182 WS=128"
109,37.724457,192.168.11.27,192.168.11.42,TCP,66,0.000145,,0.000145,"Jan  8, 2024 10:29:50.372313000 JST",,36538  >  6000 [ACK] Seq=1 Ack=1 Win=64256 Len=0 TSval=527011190 TSecr=1741980871
110,37.724642,192.168.11.27,192.168.11.42,TCP,93,,,0.000185,"Jan  8, 2024 10:29:50.372498000 JST",,"36538  >  6000 [PSH, ACK] Seq=1 Ack=1 Win=64256 Len=27 TSval=527011190 TSecr=1741980871 [TCP segment of a reassembled PDU]"
111,37.724735,192.168.11.27,192.168.11.42,TCP,66,,,0.000093,"Jan  8, 2024 10:29:50.372591000 JST",,"36538  >  6000 [FIN, ACK] Seq=28 Ack=1 Win=64256 Len=0 TSval=527011190 TSecr=1741980871"
112,37.73169,192.168.11.42,192.168.11.27,TCP,66,0.007048,,0.006955,"Jan  8, 2024 10:29:50.379546000 JST",,6000  >  36538 [ACK] Seq=1 Ack=28 Win=65152 Len=0 TSval=1741980878 TSecr=527011190
113,37.732066,192.168.11.42,192.168.11.27,TCP,66,,,0.000376,"Jan  8, 2024 10:29:50.379922000 JST",,"6000  >  36524 [FIN, ACK] Seq=1 Ack=29 Win=65152 Len=0 TSval=1741980879 TSecr=527005080"
114,37.732146,192.168.11.27,192.168.11.42,TCP,66,0.00008,,0.00008,"Jan  8, 2024 10:29:50.380002000 JST",,36524  >  6000 [ACK] Seq=29 Ack=2 Win=64256 Len=0 TSval=527011197 TSecr=1741980879
115,37.762259,192.168.11.27,255.255.255.255,UDP,209,,Ÿ,0.030113,"Jan  8, 2024 10:29:50.410115000 JST",7b2273656d616e74696373223a207b22656e74697479223a2022504944222c202262617365656e74697479223a2022616e79222c2022726f6c65223a2022626262222c20227370617469616c223a2022616e79222c202274656d706f72616c223a2022616e79227d2c20226461746170726f7065727479223a207b22666f726d6174223a2022696e616f6b615f70726f6772616d5f73616d706c655f73656d616e746963227d7d,46028  >  7000 Len=167
116,37.769215,192.168.11.13,192.168.11.27,TCP,74,,œ,0.006956,"Jan  8, 2024 10:29:50.417071000 JST",,34444  >  6000 [SYN] Seq=0 Win=64240 Len=0 MSS=1460 SACK_PERM TSval=663872995 TSecr=0 WS=128
117,37.769388,192.168.11.27,192.168.11.13,TCP,74,0.000173,,0.000173,"Jan  8, 2024 10:29:50.417244000 JST",,"6000  >  34444 [SYN, ACK] Seq=0 Ack=1 Win=65160 Len=0 MSS=1460 SACK_PERM TSval=499431717 TSecr=663872995 WS=128"
118,37.774272,192.168.11.42,192.168.11.27,TCP,66,0.049537,,0.004884,"Jan  8, 2024 10:29:50.422128000 JST",,6000  >  36538 [ACK] Seq=1 Ack=29 Win=65152 Len=0 TSval=1741980921 TSecr=527011190
119,37.775973,192.168.11.13,192.168.11.27,TCP,66,0.006585,,0.001701,"Jan  8, 2024 10:29:50.423829000 JST",,34444  >  6000 [ACK] Seq=1 Ack=1 Win=64256 Len=0 TSval=663873003 TSecr=499431717
120,37.776598,192.168.11.13,192.168.11.27,TCP,93,,,0.000625,"Jan  8, 2024 10:29:50.424454000 JST",,"34444  >  6000 [PSH, ACK] Seq=1 Ack=1 Win=64256 Len=27 TSval=663873003 TSecr=499431717 [TCP segment of a reassembled PDU]"
121,37.77674,192.168.11.27,192.168.11.13,TCP,66,0.000142,,0.000142,"Jan  8, 2024 10:29:50.424596000 JST",,6000  >  34444 [ACK] Seq=1 Ack=28 Win=65152 Len=0 TSval=499431724 TSecr=663873003
122,37.776833,192.168.11.13,192.168.11.27,TCP,66,,,0.000093,"Jan  8, 2024 10:29:50.424689000 JST",,"34444  >  6000 [FIN, ACK] Seq=28 Ack=1 Win=64256 Len=0 TSval=663873003 TSecr=499431717"
123,37.77888,192.168.11.27,192.168.11.13,TCP,66,0.002047,,0.002047,"Jan  8, 2024 10:29:50.426736000 JST",,"6000  >  34444 [FIN, ACK] Seq=1 Ack=29 Win=65152 Len=0 TSval=499431726 TSecr=663873003"
124,37.783502,192.168.11.13,192.168.11.27,TCP,66,0.004622,,0.004622,"Jan  8, 2024 10:29:50.431358000 JST",,34444  >  6000 [ACK] Seq=29 Ack=2 Win=64256 Len=0 TSval=663873011 TSecr=499431726
125,43.84597,192.168.11.27,192.168.11.42,TCP,74,,,6.062468,"Jan  8, 2024 10:29:56.493826000 JST",,58410  >  6000 [SYN] Seq=0 Win=64240 Len=0 MSS=1460 SACK_PERM TSval=527017311 TSecr=0 WS=128
126,43.85371,192.168.11.42,192.168.11.27,TCP,74,0.00774,,0.00774,"Jan  8, 2024 10:29:56.501566000 JST",,"6000  >  58410 [SYN, ACK] Seq=0 Ack=1 Win=65160 Len=0 MSS=1460 SACK_PERM TSval=1741987000 TSecr=527017311 WS=128"
127,43.853815,192.168.11.27,192.168.11.42,TCP,66,0.000105,,0.000105,"Jan  8, 2024 10:29:56.501671000 JST",,58410  >  6000 [ACK] Seq=1 Ack=1 Win=64256 Len=0 TSval=527017319 TSecr=1741987000
128,43.853985,192.168.11.27,192.168.11.42,TCP,93,,,0.00017,"Jan  8, 2024 10:29:56.501841000 JST",,"58410  >  6000 [PSH, ACK] Seq=1 Ack=1 Win=64256 Len=27 TSval=527017319 TSecr=1741987000 [TCP segment of a reassembled PDU]"
129,43.854077,192.168.11.27,192.168.11.42,TCP,66,,,0.000092,"Jan  8, 2024 10:29:56.501933000 JST",,"58410  >  6000 [FIN, ACK] Seq=28 Ack=1 Win=64256 Len=0 TSval=527017319 TSecr=1741987000"
130,43.860968,192.168.11.42,192.168.11.27,TCP,66,0.006983,,0.006891,"Jan  8, 2024 10:29:56.508824000 JST",,6000  >  58410 [ACK] Seq=1 Ack=28 Win=65152 Len=0 TSval=1741987008 TSecr=527017319
131,43.861354,192.168.11.42,192.168.11.27,TCP,66,,,0.000386,"Jan  8, 2024 10:29:56.509210000 JST",,"6000  >  36538 [FIN, ACK] Seq=1 Ack=29 Win=65152 Len=0 TSval=1741987008 TSecr=527011190"
132,43.861422,192.168.11.27,192.168.11.42,TCP,66,0.000068,,0.000068,"Jan  8, 2024 10:29:56.509278000 JST",,36538  >  6000 [ACK] Seq=29 Ack=2 Win=64256 Len=0 TSval=527017327 TSecr=1741987008
133,43.891283,192.168.11.27,255.255.255.255,UDP,209,,Ÿ,0.029861,"Jan  8, 2024 10:29:56.539139000 JST",7b2273656d616e74696373223a207b22656e74697479223a2022504944222c202262617365656e74697479223a2022616e79222c2022726f6c65223a2022626262222c20227370617469616c223a2022616e79222c202274656d706f72616c223a2022616e79227d2c20226461746170726f7065727479223a207b22666f726d6174223a2022696e616f6b615f70726f6772616d5f73616d706c655f73656d616e746963227d7d,58684  >  7000 Len=167
134,43.89705,192.168.11.13,192.168.11.27,TCP,74,,œ,0.005767,"Jan  8, 2024 10:29:56.544906000 JST",,34460  >  6000 [SYN] Seq=0 Win=64240 Len=0 MSS=1460 SACK_PERM TSval=663879124 TSecr=0 WS=128
135,43.897215,192.168.11.27,192.168.11.13,TCP,74,0.000165,,0.000165,"Jan  8, 2024 10:29:56.545071000 JST",,"6000  >  34460 [SYN, ACK] Seq=0 Ack=1 Win=65160 Len=0 MSS=1460 SACK_PERM TSval=499437844 TSecr=663879124 WS=128"
136,43.901515,192.168.11.42,192.168.11.27,TCP,66,0.047438,,0.0043,"Jan  8, 2024 10:29:56.549371000 JST",,6000  >  58410 [ACK] Seq=1 Ack=29 Win=65152 Len=0 TSval=1741987049 TSecr=527017319
137,43.904301,192.168.11.13,192.168.11.27,TCP,66,0.007086,,0.002786,"Jan  8, 2024 10:29:56.552157000 JST",,34460  >  6000 [ACK] Seq=1 Ack=1 Win=64256 Len=0 TSval=663879131 TSecr=499437844
138,43.904892,192.168.11.13,192.168.11.27,TCP,93,,,0.000591,"Jan  8, 2024 10:29:56.552748000 JST",,"34460  >  6000 [PSH, ACK] Seq=1 Ack=1 Win=64256 Len=27 TSval=663879131 TSecr=499437844 [TCP segment of a reassembled PDU]"
139,43.905016,192.168.11.27,192.168.11.13,TCP,66,0.000124,,0.000124,"Jan  8, 2024 10:29:56.552872000 JST",,6000  >  34460 [ACK] Seq=1 Ack=28 Win=65152 Len=0 TSval=499437852 TSecr=663879131
140,43.905097,192.168.11.13,192.168.11.27,TCP,66,,,0.000081,"Jan  8, 2024 10:29:56.552953000 JST",,"34460  >  6000 [FIN, ACK] Seq=28 Ack=1 Win=64256 Len=0 TSval=663879131 TSecr=499437844"
141,43.907,192.168.11.27,192.168.11.13,TCP,66,0.001903,,0.001903,"Jan  8, 2024 10:29:56.554856000 JST",,"6000  >  34460 [FIN, ACK] Seq=1 Ack=29 Win=65152 Len=0 TSval=499437854 TSecr=663879131"
142,43.911622,192.168.11.13,192.168.11.27,TCP,66,0.004622,,0.004622,"Jan  8, 2024 10:29:56.559478000 JST",,34460  >  6000 [ACK] Seq=29 Ack=2 Win=64256 Len=0 TSval=663879139 TSecr=499437854
143,49.936396,192.168.11.27,192.168.11.42,TCP,74,,,6.024774,"Jan  8, 2024 10:30:02.584252000 JST",,55718  >  6000 [SYN] Seq=0 Win=64240 Len=0 MSS=1460 SACK_PERM TSval=527023402 TSecr=0 WS=128
144,49.944012,192.168.11.42,192.168.11.27,TCP,74,0.007616,,0.007616,"Jan  8, 2024 10:30:02.591868000 JST",,"6000  >  55718 [SYN, ACK] Seq=0 Ack=1 Win=65160 Len=0 MSS=1460 SACK_PERM TSval=1741993091 TSecr=527023402 WS=128"
145,49.944136,192.168.11.27,192.168.11.42,TCP,66,0.000124,,0.000124,"Jan  8, 2024 10:30:02.591992000 JST",,55718  >  6000 [ACK] Seq=1 Ack=1 Win=64256 Len=0 TSval=527023409 TSecr=1741993091
146,49.944282,192.168.11.27,192.168.11.42,TCP,93,,,0.000146,"Jan  8, 2024 10:30:02.592138000 JST",,"55718  >  6000 [PSH, ACK] Seq=1 Ack=1 Win=64256 Len=27 TSval=527023409 TSecr=1741993091 [TCP segment of a reassembled PDU]"
147,49.944404,192.168.11.27,192.168.11.42,TCP,66,,,0.000122,"Jan  8, 2024 10:30:02.592260000 JST",,"55718  >  6000 [FIN, ACK] Seq=28 Ack=1 Win=64256 Len=0 TSval=527023410 TSecr=1741993091"
148,49.952191,192.168.11.42,192.168.11.27,TCP,66,0.007909,,0.007787,"Jan  8, 2024 10:30:02.600047000 JST",,6000  >  55718 [ACK] Seq=1 Ack=28 Win=65152 Len=0 TSval=1741993098 TSecr=527023409
149,49.952583,192.168.11.42,192.168.11.27,TCP,66,,,0.000392,"Jan  8, 2024 10:30:02.600439000 JST",,"6000  >  58410 [FIN, ACK] Seq=1 Ack=29 Win=65152 Len=0 TSval=1741993098 TSecr=527017319"
150,49.952664,192.168.11.27,192.168.11.42,TCP,66,0.000081,,0.000081,"Jan  8, 2024 10:30:02.600520000 JST",,58410  >  6000 [ACK] Seq=29 Ack=2 Win=64256 Len=0 TSval=527023418 TSecr=1741993098
151,49.981066,192.168.11.27,255.255.255.255,UDP,209,,Ÿ,0.028402,"Jan  8, 2024 10:30:02.628922000 JST",7b2273656d616e74696373223a207b22656e74697479223a2022504944222c202262617365656e74697479223a2022616e79222c2022726f6c65223a2022626262222c20227370617469616c223a2022616e79222c202274656d706f72616c223a2022616e79227d2c20226461746170726f7065727479223a207b22666f726d6174223a2022696e616f6b615f70726f6772616d5f73616d706c655f73656d616e746963227d7d,54836  >  7000 Len=167
152,49.986785,192.168.11.13,192.168.11.27,TCP,74,,œ,0.005719,"Jan  8, 2024 10:30:02.634641000 JST",,52572  >  6000 [SYN] Seq=0 Win=64240 Len=0 MSS=1460 SACK_PERM TSval=663885214 TSecr=0 WS=128
153,49.986891,192.168.11.27,192.168.11.13,TCP,74,0.000106,,0.000106,"Jan  8, 2024 10:30:02.634747000 JST",,"6000  >  52572 [SYN, ACK] Seq=0 Ack=1 Win=65160 Len=0 MSS=1460 SACK_PERM TSval=499443934 TSecr=663885214 WS=128"
154,50.003057,192.168.11.13,192.168.11.27,TCP,66,0.016166,,0.016166,"Jan  8, 2024 10:30:02.650913000 JST",,52572  >  6000 [ACK] Seq=1 Ack=1 Win=64256 Len=0 TSval=663885221 TSecr=499443934
155,50.003637,192.168.11.13,192.168.11.27,TCP,93,,,0.00058,"Jan  8, 2024 10:30:02.651493000 JST",,"52572  >  6000 [PSH, ACK] Seq=1 Ack=1 Win=64256 Len=27 TSval=663885221 TSecr=499443934 [TCP segment of a reassembled PDU]"
156,50.003705,192.168.11.27,192.168.11.13,TCP,66,0.000068,,0.000068,"Jan  8, 2024 10:30:02.651561000 JST",,6000  >  52572 [ACK] Seq=1 Ack=28 Win=65152 Len=0 TSval=499443951 TSecr=663885221
157,50.00377,192.168.11.13,192.168.11.27,TCP,66,,,0.000065,"Jan  8, 2024 10:30:02.651626000 JST",,"52572  >  6000 [FIN, ACK] Seq=28 Ack=1 Win=64256 Len=0 TSval=663885221 TSecr=499443934"
158,50.003825,192.168.11.42,192.168.11.27,TCP,66,0.059421,,0.000055,"Jan  8, 2024 10:30:02.651681000 JST",,6000  >  55718 [ACK] Seq=1 Ack=29 Win=65152 Len=0 TSval=1741993141 TSecr=527023410
159,50.005287,192.168.11.27,192.168.11.13,TCP,66,0.001517,,0.001462,"Jan  8, 2024 10:30:02.653143000 JST",,"6000  >  52572 [FIN, ACK] Seq=1 Ack=29 Win=65152 Len=0 TSval=499443952 TSecr=663885221"
160,50.010606,192.168.11.13,192.168.11.27,TCP,66,0.005319,,0.005319,"Jan  8, 2024 10:30:02.658462000 JST",,52572  >  6000 [ACK] Seq=29 Ack=2 Win=64256 Len=0 TSval=663885238 TSecr=499443952
161,56.059468,192.168.11.27,192.168.11.42,TCP,74,,,6.048862,"Jan  8, 2024 10:30:08.707324000 JST",,55722  >  6000 [SYN] Seq=0 Win=64240 Len=0 MSS=1460 SACK_PERM TSval=527029525 TSecr=0 WS=128
162,56.067199,192.168.11.42,192.168.11.27,TCP,74,0.007731,,0.007731,"Jan  8, 2024 10:30:08.715055000 JST",,"6000  >  55722 [SYN, ACK] Seq=0 Ack=1 Win=65160 Len=0 MSS=1460 SACK_PERM TSval=1741999214 TSecr=527029525 WS=128"
163,56.067309,192.168.11.27,192.168.11.42,TCP,66,0.00011,,0.00011,"Jan  8, 2024 10:30:08.715165000 JST",,55722  >  6000 [ACK] Seq=1 Ack=1 Win=64256 Len=0 TSval=527029532 TSecr=1741999214
164,56.067452,192.168.11.27,192.168.11.42,TCP,93,,,0.000143,"Jan  8, 2024 10:30:08.715308000 JST",,"55722  >  6000 [PSH, ACK] Seq=1 Ack=1 Win=64256 Len=27 TSval=527029533 TSecr=1741999214 [TCP segment of a reassembled PDU]"
165,56.067546,192.168.11.27,192.168.11.42,TCP,66,,,0.000094,"Jan  8, 2024 10:30:08.715402000 JST",,"55722  >  6000 [FIN, ACK] Seq=28 Ack=1 Win=64256 Len=0 TSval=527029533 TSecr=1741999214"
166,56.074923,192.168.11.42,192.168.11.27,TCP,66,0.007471,,0.007377,"Jan  8, 2024 10:30:08.722779000 JST",,6000  >  55722 [ACK] Seq=1 Ack=28 Win=65152 Len=0 TSval=1741999221 TSecr=527029533
167,56.075286,192.168.11.42,192.168.11.27,TCP,66,,,0.000363,"Jan  8, 2024 10:30:08.723142000 JST",,"6000  >  55718 [FIN, ACK] Seq=1 Ack=29 Win=65152 Len=0 TSval=1741999222 TSecr=527023410"
168,56.07535,192.168.11.27,192.168.11.42,TCP,66,0.000064,,0.000064,"Jan  8, 2024 10:30:08.723206000 JST",,55718  >  6000 [ACK] Seq=29 Ack=2 Win=64256 Len=0 TSval=527029541 TSecr=1741999222
169,56.103358,192.168.11.27,255.255.255.255,UDP,209,,Ÿ,0.028008,"Jan  8, 2024 10:30:08.751214000 JST",7b2273656d616e74696373223a207b22656e74697479223a2022504944222c202262617365656e74697479223a2022616e79222c2022726f6c65223a2022626262222c20227370617469616c223a2022616e79222c202274656d706f72616c223a2022616e79227d2c20226461746170726f7065727479223a207b22666f726d6174223a2022696e616f6b615f70726f6772616d5f73616d706c655f73656d616e746963227d7d,46577  >  7000 Len=167
170,56.10896,192.168.11.13,192.168.11.27,TCP,74,,œ,0.005602,"Jan  8, 2024 10:30:08.756816000 JST",,37064  >  6000 [SYN] Seq=0 Win=64240 Len=0 MSS=1460 SACK_PERM TSval=663891336 TSecr=0 WS=128
171,56.109079,192.168.11.27,192.168.11.13,TCP,74,0.000119,,0.000119,"Jan  8, 2024 10:30:08.756935000 JST",,"6000  >  37064 [SYN, ACK] Seq=0 Ack=1 Win=65160 Len=0 MSS=1460 SACK_PERM TSval=499450056 TSecr=663891336 WS=128"
172,56.123031,192.168.11.13,192.168.11.27,TCP,66,0.013952,,0.013952,"Jan  8, 2024 10:30:08.770887000 JST",,37064  >  6000 [ACK] Seq=1 Ack=1 Win=64256 Len=0 TSval=663891343 TSecr=499450056
173,56.123615,192.168.11.13,192.168.11.27,TCP,93,,,0.000584,"Jan  8, 2024 10:30:08.771471000 JST",,"37064  >  6000 [PSH, ACK] Seq=1 Ack=1 Win=64256 Len=27 TSval=663891343 TSecr=499450056 [TCP segment of a reassembled PDU]"
174,56.123698,192.168.11.27,192.168.11.13,TCP,66,0.000083,,0.000083,"Jan  8, 2024 10:30:08.771554000 JST",,6000  >  37064 [ACK] Seq=1 Ack=28 Win=65152 Len=0 TSval=499450071 TSecr=663891343
175,56.123753,192.168.11.13,192.168.11.27,TCP,66,,,0.000055,"Jan  8, 2024 10:30:08.771609000 JST",,"37064  >  6000 [FIN, ACK] Seq=28 Ack=1 Win=64256 Len=0 TSval=663891343 TSecr=499450056"
176,56.123961,192.168.11.42,192.168.11.27,TCP,66,0.056415,,0.000208,"Jan  8, 2024 10:30:08.771817000 JST",,6000  >  55722 [ACK] Seq=1 Ack=29 Win=65152 Len=0 TSval=1741999265 TSecr=527029533
177,56.125429,192.168.11.27,192.168.11.13,TCP,66,0.001676,,0.001468,"Jan  8, 2024 10:30:08.773285000 JST",,"6000  >  37064 [FIN, ACK] Seq=1 Ack=29 Win=65152 Len=0 TSval=499450073 TSecr=663891343"
178,56.130969,192.168.11.13,192.168.11.27,TCP,66,0.00554,,0.00554,"Jan  8, 2024 10:30:08.778825000 JST",,37064  >  6000 [ACK] Seq=29 Ack=2 Win=64256 Len=0 TSval=663891358 TSecr=499450073
179,62.194471,192.168.11.42,192.168.11.27,TCP,66,,,6.063502,"Jan  8, 2024 10:30:14.842327000 JST",,"6000  >  55722 [FIN, ACK] Seq=1 Ack=29 Win=65152 Len=0 TSval=1742005340 TSecr=527029533"
180,62.194571,192.168.11.27,192.168.11.42,TCP,66,0.0001,,0.0001,"Jan  8, 2024 10:30:14.842427000 JST",,55722  >  6000 [ACK] Seq=29 Ack=2 Win=64256 Len=0 TSval=527035660 TSecr=1742005340
181,87.236023,192.168.11.27,192.168.11.42,TCP,74,,,25.041452,"Jan  8, 2024 10:30:39.883879000 JST",,34702  >  6000 [SYN] Seq=0 Win=64240 Len=0 MSS=1460 SACK_PERM TSval=527060701 TSecr=0 WS=128
182,87.243391,192.168.11.42,192.168.11.27,TCP,74,0.007368,,0.007368,"Jan  8, 2024 10:30:39.891247000 JST",,"6000  >  34702 [SYN, ACK] Seq=0 Ack=1 Win=65160 Len=0 MSS=1460 SACK_PERM TSval=1742030390 TSecr=527060701 WS=128"
183,87.243509,192.168.11.27,192.168.11.42,TCP,66,0.000118,,0.000118,"Jan  8, 2024 10:30:39.891365000 JST",,34702  >  6000 [ACK] Seq=1 Ack=1 Win=64256 Len=0 TSval=527060709 TSecr=1742030390
184,87.243696,192.168.11.27,192.168.11.42,TCP,93,,,0.000187,"Jan  8, 2024 10:30:39.891552000 JST",,"34702  >  6000 [PSH, ACK] Seq=1 Ack=1 Win=64256 Len=27 TSval=527060709 TSecr=1742030390 [TCP segment of a reassembled PDU]"
185,87.243816,192.168.11.27,192.168.11.42,TCP,66,,,0.00012,"Jan  8, 2024 10:30:39.891672000 JST",,"34702  >  6000 [FIN, ACK] Seq=28 Ack=1 Win=64256 Len=0 TSval=527060709 TSecr=1742030390"
186,87.250558,192.168.11.42,192.168.11.27,TCP,66,0.006862,,0.006742,"Jan  8, 2024 10:30:39.898414000 JST",,6000  >  34702 [ACK] Seq=1 Ack=28 Win=65152 Len=0 TSval=1742030397 TSecr=527060709
