No.,Time,Source,Destination,Protocol,Length,The RTT to ACK the segment was,XXX,Time delta from previous captured frame,Arrival Time,Data,Info
1,0,192.168.11.13,192.168.11.27,TCP,74,,,0,"Jan  8, 2024 10:29:12.690821000 JST",,44466  >  6000 [SYN] Seq=0 Win=64240 Len=0 MSS=1460 SACK_PERM TSval=663835276 TSecr=0 WS=128
2,0.008622,192.168.11.27,192.168.11.13,TCP,74,0.008622,,0.008622,"Jan  8, 2024 10:29:12.699443000 JST",,"6000  >  44466 [SYN, ACK] Seq=0 Ack=1 Win=65160 Len=0 MSS=1460 SACK_PERM TSval=499393998 TSecr=663835276 WS=128"
3,0.008761,192.168.11.13,192.168.11.27,TCP,66,0.000139,,0.000139,"Jan  8, 2024 10:29:12.699582000 JST",,44466  >  6000 [ACK] Seq=1 Ack=1 Win=64256 Len=0 TSval=663835285 TSecr=499393998
4,0.009058,192.168.11.13,192.168.11.27,TCP,93,,,0.000297,"Jan  8, 2024 10:29:12.699879000 JST",,"44466  >  6000 [PSH, ACK] Seq=1 Ack=1 Win=64256 Len=27 TSval=663835286 TSecr=499393998 [TCP segment of a reassembled PDU]"
5,0.0092,192.168.11.13,192.168.11.27,TCP,66,,,0.000142,"Jan  8, 2024 10:29:12.700021000 JST",,"44466  >  6000 [FIN, ACK] Seq=28 Ack=1 Win=64256 Len=0 TSval=663835286 TSecr=499393998"
6,0.015951,192.168.11.27,192.168.11.13,TCP,66,0.006893,,0.006751,"Jan  8, 2024 10:29:12.706772000 JST",,6000  >  44466 [ACK] Seq=1 Ack=28 Win=65152 Len=0 TSval=499394006 TSecr=663835286
7,0.018657,192.168.11.27,192.168.11.13,TCP,66,0.009457,,0.002706,"Jan  8, 2024 10:29:12.709478000 JST",,"6000  >  44466 [FIN, ACK] Seq=1 Ack=29 Win=65152 Len=0 TSval=499394009 TSecr=663835286"
8,0.018705,192.168.11.13,192.168.11.27,TCP,66,0.000048,,0.000048,"Jan  8, 2024 10:29:12.709526000 JST",,44466  >  6000 [ACK] Seq=29 Ack=2 Win=64256 Len=0 TSval=663835295 TSecr=499394009
9,0.047649,192.168.11.13,255.255.255.255,UDP,209,,Ÿ,0.028944,"Jan  8, 2024 10:29:12.738470000 JST",7b2273656d616e74696373223a207b22656e74697479223a2022504944222c202262617365656e74697479223a2022616e79222c2022726f6c65223a2022636363222c20227370617469616c223a2022616e79222c202274656d706f72616c223a2022616e79227d2c20226461746170726f7065727479223a207b22666f726d6174223a2022696e616f6b615f70726f6772616d5f73616d706c655f73656d616e746963227d7d,41616  >  7000 Len=167
10,0.053782,192.168.11.8,192.168.11.13,TCP,74,,œ,0.006133,"Jan  8, 2024 10:29:12.744603000 JST",,48038  >  6000 [SYN] Seq=0 Win=64240 Len=0 MSS=1460 SACK_PERM TSval=1448754876 TSecr=0 WS=128
11,0.053921,192.168.11.13,192.168.11.8,TCP,74,0.000139,,0.000139,"Jan  8, 2024 10:29:12.744742000 JST",,"6000  >  48038 [SYN, ACK] Seq=0 Ack=1 Win=65160 Len=0 MSS=1460 SACK_PERM TSval=639428326 TSecr=1448754876 WS=128"
12,0.061758,192.168.11.8,192.168.11.13,TCP,66,0.007837,,0.007837,"Jan  8, 2024 10:29:12.752579000 JST",,48038  >  6000 [ACK] Seq=1 Ack=1 Win=64256 Len=0 TSval=1448754884 TSecr=639428326
13,0.062423,192.168.11.8,192.168.11.13,TCP,93,,,0.000665,"Jan  8, 2024 10:29:12.753244000 JST",,"48038  >  6000 [PSH, ACK] Seq=1 Ack=1 Win=64256 Len=27 TSval=1448754884 TSecr=639428326 [TCP segment of a reassembled PDU]"
14,0.062518,192.168.11.13,192.168.11.8,TCP,66,0.000095,,0.000095,"Jan  8, 2024 10:29:12.753339000 JST",,6000  >  48038 [ACK] Seq=1 Ack=28 Win=65152 Len=0 TSval=639428335 TSecr=1448754884
15,0.062586,192.168.11.8,192.168.11.13,TCP,66,,,0.000068,"Jan  8, 2024 10:29:12.753407000 JST",,"48038  >  6000 [FIN, ACK] Seq=28 Ack=1 Win=64256 Len=0 TSval=1448754884 TSecr=639428326"
16,0.063813,192.168.11.13,192.168.11.8,TCP,66,0.001227,,0.001227,"Jan  8, 2024 10:29:12.754634000 JST",,"6000  >  48038 [FIN, ACK] Seq=1 Ack=29 Win=65152 Len=0 TSval=639428336 TSecr=1448754884"
17,0.069515,192.168.11.8,192.168.11.13,TCP,66,0.005702,,0.005702,"Jan  8, 2024 10:29:12.760336000 JST",,48038  >  6000 [ACK] Seq=29 Ack=2 Win=64256 Len=0 TSval=1448754891 TSecr=639428336
18,6.177078,192.168.11.13,192.168.11.27,TCP,74,,,6.107563,"Jan  8, 2024 10:29:18.867899000 JST",,48050  >  6000 [SYN] Seq=0 Win=64240 Len=0 MSS=1460 SACK_PERM TSval=663841454 TSecr=0 WS=128
19,6.184688,192.168.11.27,192.168.11.13,TCP,74,0.00761,,0.00761,"Jan  8, 2024 10:29:18.875509000 JST",,"6000  >  48050 [SYN, ACK] Seq=0 Ack=1 Win=65160 Len=0 MSS=1460 SACK_PERM TSval=499400174 TSecr=663841454 WS=128"
20,6.1848,192.168.11.13,192.168.11.27,TCP,66,0.000112,,0.000112,"Jan  8, 2024 10:29:18.875621000 JST",,48050  >  6000 [ACK] Seq=1 Ack=1 Win=64256 Len=0 TSval=663841461 TSecr=499400174
21,6.185007,192.168.11.13,192.168.11.27,TCP,93,,,0.000207,"Jan  8, 2024 10:29:18.875828000 JST",,"48050  >  6000 [PSH, ACK] Seq=1 Ack=1 Win=64256 Len=27 TSval=663841461 TSecr=499400174 [TCP segment of a reassembled PDU]"
22,6.185136,192.168.11.13,192.168.11.27,TCP,66,,,0.000129,"Jan  8, 2024 10:29:18.875957000 JST",,"48050  >  6000 [FIN, ACK] Seq=28 Ack=1 Win=64256 Len=0 TSval=663841462 TSecr=499400174"
23,6.192014,192.168.11.27,192.168.11.13,TCP,66,0.007007,,0.006878,"Jan  8, 2024 10:29:18.882835000 JST",,6000  >  48050 [ACK] Seq=1 Ack=28 Win=65152 Len=0 TSval=499400182 TSecr=663841461
24,6.192249,192.168.11.27,192.168.11.13,TCP,66,0.007113,,0.000235,"Jan  8, 2024 10:29:18.883070000 JST",,"6000  >  48050 [FIN, ACK] Seq=1 Ack=29 Win=65152 Len=0 TSval=499400184 TSecr=663841462"
25,6.192294,192.168.11.13,192.168.11.27,TCP,66,0.000045,,0.000045,"Jan  8, 2024 10:29:18.883115000 JST",,48050  >  6000 [ACK] Seq=29 Ack=2 Win=64256 Len=0 TSval=663841469 TSecr=499400184
26,6.226615,192.168.11.13,255.255.255.255,UDP,209,,Ÿ,0.034321,"Jan  8, 2024 10:29:18.917436000 JST",7b2273656d616e74696373223a207b22656e74697479223a2022504944222c202262617365656e74697479223a2022616e79222c2022726f6c65223a2022636363222c20227370617469616c223a2022616e79222c202274656d706f72616c223a2022616e79227d2c20226461746170726f7065727479223a207b22666f726d6174223a2022696e616f6b615f70726f6772616d5f73616d706c655f73656d616e746963227d7d,54003  >  7000 Len=167
27,6.232142,192.168.11.8,192.168.11.13,TCP,74,,œ,0.005527,"Jan  8, 2024 10:29:18.922963000 JST",,48054  >  6000 [SYN] Seq=0 Win=64240 Len=0 MSS=1460 SACK_PERM TSval=1448761054 TSecr=0 WS=128
28,6.232268,192.168.11.13,192.168.11.8,TCP,74,0.000126,,0.000126,"Jan  8, 2024 10:29:18.923089000 JST",,"6000  >  48054 [SYN, ACK] Seq=0 Ack=1 Win=65160 Len=0 MSS=1460 SACK_PERM TSval=639434505 TSecr=1448761054 WS=128"
29,6.23886,192.168.11.8,192.168.11.13,TCP,66,0.006592,,0.006592,"Jan  8, 2024 10:29:18.929681000 JST",,48054  >  6000 [ACK] Seq=1 Ack=1 Win=64256 Len=0 TSval=1448761061 TSecr=639434505
30,6.239446,192.168.11.8,192.168.11.13,TCP,93,,,0.000586,"Jan  8, 2024 10:29:18.930267000 JST",,"48054  >  6000 [PSH, ACK] Seq=1 Ack=1 Win=64256 Len=27 TSval=1448761061 TSecr=639434505 [TCP segment of a reassembled PDU]"
31,6.239539,192.168.11.13,192.168.11.8,TCP,66,0.000093,,0.000093,"Jan  8, 2024 10:29:18.930360000 JST",,6000  >  48054 [ACK] Seq=1 Ack=28 Win=65152 Len=0 TSval=639434512 TSecr=1448761061
32,6.239614,192.168.11.8,192.168.11.13,TCP,66,,,0.000075,"Jan  8, 2024 10:29:18.930435000 JST",,"48054  >  6000 [FIN, ACK] Seq=28 Ack=1 Win=64256 Len=0 TSval=1448761061 TSecr=639434505"
33,6.240862,192.168.11.13,192.168.11.8,TCP,66,0.001248,,0.001248,"Jan  8, 2024 10:29:18.931683000 JST",,"6000  >  48054 [FIN, ACK] Seq=1 Ack=29 Win=65152 Len=0 TSval=639434513 TSecr=1448761061"
34,6.246757,192.168.11.8,192.168.11.13,TCP,66,0.005895,,0.005895,"Jan  8, 2024 10:29:18.937578000 JST",,48054  >  6000 [ACK] Seq=29 Ack=2 Win=64256 Len=0 TSval=1448761069 TSecr=639434513
35,12.278946,192.168.11.13,192.168.11.27,TCP,74,,,6.032189,"Jan  8, 2024 10:29:24.969767000 JST",,48064  >  6000 [SYN] Seq=0 Win=64240 Len=0 MSS=1460 SACK_PERM TSval=663847555 TSecr=0 WS=128
36,12.285594,192.168.11.27,192.168.11.13,TCP,74,0.006648,,0.006648,"Jan  8, 2024 10:29:24.976415000 JST",,"6000  >  48064 [SYN, ACK] Seq=0 Ack=1 Win=65160 Len=0 MSS=1460 SACK_PERM TSval=499406276 TSecr=663847555 WS=128"
37,12.285703,192.168.11.13,192.168.11.27,TCP,66,0.000109,,0.000109,"Jan  8, 2024 10:29:24.976524000 JST",,48064  >  6000 [ACK] Seq=1 Ack=1 Win=64256 Len=0 TSval=663847562 TSecr=499406276
38,12.285841,192.168.11.13,192.168.11.27,TCP,93,,,0.000138,"Jan  8, 2024 10:29:24.976662000 JST",,"48064  >  6000 [PSH, ACK] Seq=1 Ack=1 Win=64256 Len=27 TSval=663847562 TSecr=499406276 [TCP segment of a reassembled PDU]"
39,12.285936,192.168.11.13,192.168.11.27,TCP,66,,,0.000095,"Jan  8, 2024 10:29:24.976757000 JST",,"48064  >  6000 [FIN, ACK] Seq=28 Ack=1 Win=64256 Len=0 TSval=663847562 TSecr=499406276"
40,12.292474,192.168.11.27,192.168.11.13,TCP,66,0.006633,,0.006538,"Jan  8, 2024 10:29:24.983295000 JST",,6000  >  48064 [ACK] Seq=1 Ack=28 Win=65152 Len=0 TSval=499406282 TSecr=663847562
41,12.292708,192.168.11.27,192.168.11.13,TCP,66,0.006772,,0.000234,"Jan  8, 2024 10:29:24.983529000 JST",,"6000  >  48064 [FIN, ACK] Seq=1 Ack=29 Win=65152 Len=0 TSval=499406284 TSecr=663847562"
42,12.292751,192.168.11.13,192.168.11.27,TCP,66,0.000043,,0.000043,"Jan  8, 2024 10:29:24.983572000 JST",,48064  >  6000 [ACK] Seq=29 Ack=2 Win=64256 Len=0 TSval=663847569 TSecr=499406284
43,12.322696,192.168.11.13,255.255.255.255,UDP,209,,Ÿ,0.029945,"Jan  8, 2024 10:29:25.013517000 JST",7b2273656d616e74696373223a207b22656e74697479223a2022504944222c202262617365656e74697479223a2022616e79222c2022726f6c65223a2022636363222c20227370617469616c223a2022616e79222c202274656d706f72616c223a2022616e79227d2c20226461746170726f7065727479223a207b22666f726d6174223a2022696e616f6b615f70726f6772616d5f73616d706c655f73656d616e746963227d7d,59139  >  7000 Len=167
44,12.328414,192.168.11.8,192.168.11.13,TCP,74,,œ,0.005718,"Jan  8, 2024 10:29:25.019235000 JST",,60908  >  6000 [SYN] Seq=0 Win=64240 Len=0 MSS=1460 SACK_PERM TSval=1448767151 TSecr=0 WS=128
45,12.328549,192.168.11.13,192.168.11.8,TCP,74,0.000135,,0.000135,"Jan  8, 2024 10:29:25.019370000 JST",,"6000  >  60908 [SYN, ACK] Seq=0 Ack=1 Win=65160 Len=0 MSS=1460 SACK_PERM TSval=639440601 TSecr=1448767151 WS=128"
46,12.33556,192.168.11.8,192.168.11.13,TCP,66,0.007011,,0.007011,"Jan  8, 2024 10:29:25.026381000 JST",,60908  >  6000 [ACK] Seq=1 Ack=1 Win=64256 Len=0 TSval=1448767158 TSecr=639440601
47,12.336084,192.168.11.8,192.168.11.13,TCP,93,,,0.000524,"Jan  8, 2024 10:29:25.026905000 JST",,"60908  >  6000 [PSH, ACK] Seq=1 Ack=1 Win=64256 Len=27 TSval=1448767158 TSecr=639440601 [TCP segment of a reassembled PDU]"
48,12.33617,192.168.11.13,192.168.11.8,TCP,66,0.000086,,0.000086,"Jan  8, 2024 10:29:25.026991000 JST",,6000  >  60908 [ACK] Seq=1 Ack=28 Win=65152 Len=0 TSval=639440609 TSecr=1448767158
49,12.33624,192.168.11.8,192.168.11.13,TCP,66,,,0.00007,"Jan  8, 2024 10:29:25.027061000 JST",,"60908  >  6000 [FIN, ACK] Seq=28 Ack=1 Win=64256 Len=0 TSval=1448767158 TSecr=639440601"
50,12.33741,192.168.11.13,192.168.11.8,TCP,66,0.00117,,0.00117,"Jan  8, 2024 10:29:25.028231000 JST",,"6000  >  60908 [FIN, ACK] Seq=1 Ack=29 Win=65152 Len=0 TSval=639440610 TSecr=1448767158"
51,12.343098,192.168.11.8,192.168.11.13,TCP,66,0.005688,,0.005688,"Jan  8, 2024 10:29:25.033919000 JST",,60908  >  6000 [ACK] Seq=29 Ack=2 Win=64256 Len=0 TSval=1448767165 TSecr=639440610
52,18.393307,192.168.11.13,192.168.11.27,TCP,74,,,6.050209,"Jan  8, 2024 10:29:31.084128000 JST",,40526  >  6000 [SYN] Seq=0 Win=64240 Len=0 MSS=1460 SACK_PERM TSval=663853670 TSecr=0 WS=128
53,18.400915,192.168.11.27,192.168.11.13,TCP,74,0.007608,,0.007608,"Jan  8, 2024 10:29:31.091736000 JST",,"6000  >  40526 [SYN, ACK] Seq=0 Ack=1 Win=65160 Len=0 MSS=1460 SACK_PERM TSval=499412391 TSecr=663853670 WS=128"
54,18.401021,192.168.11.13,192.168.11.27,TCP,66,0.000106,,0.000106,"Jan  8, 2024 10:29:31.091842000 JST",,40526  >  6000 [ACK] Seq=1 Ack=1 Win=64256 Len=0 TSval=663853677 TSecr=499412391
55,18.401159,192.168.11.13,192.168.11.27,TCP,93,,,0.000138,"Jan  8, 2024 10:29:31.091980000 JST",,"40526  >  6000 [PSH, ACK] Seq=1 Ack=1 Win=64256 Len=27 TSval=663853678 TSecr=499412391 [TCP segment of a reassembled PDU]"
56,18.40128,192.168.11.13,192.168.11.27,TCP,66,,,0.000121,"Jan  8, 2024 10:29:31.092101000 JST",,"40526  >  6000 [FIN, ACK] Seq=28 Ack=1 Win=64256 Len=0 TSval=663853678 TSecr=499412391"
57,18.407985,192.168.11.27,192.168.11.13,TCP,66,0.006826,,0.006705,"Jan  8, 2024 10:29:31.098806000 JST",,6000  >  40526 [ACK] Seq=1 Ack=28 Win=65152 Len=0 TSval=499412398 TSecr=663853678
58,18.410895,192.168.11.27,192.168.11.13,TCP,66,0.009615,,0.00291,"Jan  8, 2024 10:29:31.101716000 JST",,"6000  >  40526 [FIN, ACK] Seq=1 Ack=29 Win=65152 Len=0 TSval=499412401 TSecr=663853678"
59,18.410948,192.168.11.13,192.168.11.27,TCP,66,0.000053,,0.000053,"Jan  8, 2024 10:29:31.101769000 JST",,40526  >  6000 [ACK] Seq=29 Ack=2 Win=64256 Len=0 TSval=663853687 TSecr=499412401
60,18.440073,192.168.11.13,255.255.255.255,UDP,209,,Ÿ,0.029125,"Jan  8, 2024 10:29:31.130894000 JST",7b2273656d616e74696373223a207b22656e74697479223a2022504944222c202262617365656e74697479223a2022616e79222c2022726f6c65223a2022636363222c20227370617469616c223a2022616e79222c202274656d706f72616c223a2022616e79227d2c20226461746170726f7065727479223a207b22666f726d6174223a2022696e616f6b615f70726f6772616d5f73616d706c655f73656d616e746963227d7d,55838  >  7000 Len=167
61,18.445836,192.168.11.8,192.168.11.13,TCP,74,,œ,0.005763,"Jan  8, 2024 10:29:31.136657000 JST",,60914  >  6000 [SYN] Seq=0 Win=64240 Len=0 MSS=1460 SACK_PERM TSval=1448773268 TSecr=0 WS=128
62,18.44598,192.168.11.13,192.168.11.8,TCP,74,0.000144,,0.000144,"Jan  8, 2024 10:29:31.136801000 JST",,"6000  >  60914 [SYN, ACK] Seq=0 Ack=1 Win=65160 Len=0 MSS=1460 SACK_PERM TSval=639446718 TSecr=1448773268 WS=128"
63,18.452725,192.168.11.8,192.168.11.13,TCP,66,0.006745,,0.006745,"Jan  8, 2024 10:29:31.143546000 JST",,60914  >  6000 [ACK] Seq=1 Ack=1 Win=64256 Len=0 TSval=1448773275 TSecr=639446718
64,18.453286,192.168.11.8,192.168.11.13,TCP,93,,,0.000561,"Jan  8, 2024 10:29:31.144107000 JST",,"60914  >  6000 [PSH, ACK] Seq=1 Ack=1 Win=64256 Len=27 TSval=1448773275 TSecr=639446718 [TCP segment of a reassembled PDU]"
65,18.453374,192.168.11.13,192.168.11.8,TCP,66,0.000088,,0.000088,"Jan  8, 2024 10:29:31.144195000 JST",,6000  >  60914 [ACK] Seq=1 Ack=28 Win=65152 Len=0 TSval=639446726 TSecr=1448773275
66,18.453448,192.168.11.8,192.168.11.13,TCP,66,,,0.000074,"Jan  8, 2024 10:29:31.144269000 JST",,"60914  >  6000 [FIN, ACK] Seq=28 Ack=1 Win=64256 Len=0 TSval=1448773275 TSecr=639446718"
67,18.454694,192.168.11.13,192.168.11.8,TCP,66,0.001246,,0.001246,"Jan  8, 2024 10:29:31.145515000 JST",,"6000  >  60914 [FIN, ACK] Seq=1 Ack=29 Win=65152 Len=0 TSval=639446727 TSecr=1448773275"
68,18.460489,192.168.11.8,192.168.11.13,TCP,66,0.005795,,0.005795,"Jan  8, 2024 10:29:31.151310000 JST",,60914  >  6000 [ACK] Seq=29 Ack=2 Win=64256 Len=0 TSval=1448773283 TSecr=639446727
69,25.521405,192.168.11.13,192.168.11.27,TCP,74,,,7.060916,"Jan  8, 2024 10:29:38.212226000 JST",,52510  >  6000 [SYN] Seq=0 Win=64240 Len=0 MSS=1460 SACK_PERM TSval=663860798 TSecr=0 WS=128
70,25.528037,192.168.11.27,192.168.11.13,TCP,74,0.006632,,0.006632,"Jan  8, 2024 10:29:38.218858000 JST",,"6000  >  52510 [SYN, ACK] Seq=0 Ack=1 Win=65160 Len=0 MSS=1460 SACK_PERM TSval=499419518 TSecr=663860798 WS=128"
71,25.52817,192.168.11.13,192.168.11.27,TCP,66,0.000133,,0.000133,"Jan  8, 2024 10:29:38.218991000 JST",,52510  >  6000 [ACK] Seq=1 Ack=1 Win=64256 Len=0 TSval=663860805 TSecr=499419518
72,25.528312,192.168.11.13,192.168.11.27,TCP,93,,,0.000142,"Jan  8, 2024 10:29:38.219133000 JST",,"52510  >  6000 [PSH, ACK] Seq=1 Ack=1 Win=64256 Len=27 TSval=663860805 TSecr=499419518 [TCP segment of a reassembled PDU]"
73,25.528438,192.168.11.13,192.168.11.27,TCP,66,,,0.000126,"Jan  8, 2024 10:29:38.219259000 JST",,"52510  >  6000 [FIN, ACK] Seq=28 Ack=1 Win=64256 Len=0 TSval=663860805 TSecr=499419518"
74,25.535607,192.168.11.27,192.168.11.13,TCP,66,0.007295,,0.007169,"Jan  8, 2024 10:29:38.226428000 JST",,6000  >  52510 [ACK] Seq=1 Ack=28 Win=65152 Len=0 TSval=499419525 TSecr=663860805
75,25.535985,192.168.11.27,192.168.11.13,TCP,66,0.007547,,0.000378,"Jan  8, 2024 10:29:38.226806000 JST",,"6000  >  52510 [FIN, ACK] Seq=1 Ack=29 Win=65152 Len=0 TSval=499419527 TSecr=663860805"
76,25.536053,192.168.11.13,192.168.11.27,TCP,66,0.000068,,0.000068,"Jan  8, 2024 10:29:38.226874000 JST",,52510  >  6000 [ACK] Seq=29 Ack=2 Win=64256 Len=0 TSval=663860812 TSecr=499419527
77,25.564638,192.168.11.13,255.255.255.255,UDP,209,,Ÿ,0.028585,"Jan  8, 2024 10:29:38.255459000 JST",7b2273656d616e74696373223a207b22656e74697479223a2022504944222c202262617365656e74697479223a2022616e79222c2022726f6c65223a2022636363222c20227370617469616c223a2022616e79222c202274656d706f72616c223a2022616e79227d2c20226461746170726f7065727479223a207b22666f726d6174223a2022696e616f6b615f70726f6772616d5f73616d706c655f73656d616e746963227d7d,40443  >  7000 Len=167
78,25.570285,192.168.11.8,192.168.11.13,TCP,74,,œ,0.005647,"Jan  8, 2024 10:29:38.261106000 JST",,34012  >  6000 [SYN] Seq=0 Win=64240 Len=0 MSS=1460 SACK_PERM TSval=1448780392 TSecr=0 WS=128
79,25.570426,192.168.11.13,192.168.11.8,TCP,74,0.000141,,0.000141,"Jan  8, 2024 10:29:38.261247000 JST",,"6000  >  34012 [SYN, ACK] Seq=0 Ack=1 Win=65160 Len=0 MSS=1460 SACK_PERM TSval=639453843 TSecr=1448780392 WS=128"
80,25.576989,192.168.11.8,192.168.11.13,TCP,66,0.006563,,0.006563,"Jan  8, 2024 10:29:38.267810000 JST",,34012  >  6000 [ACK] Seq=1 Ack=1 Win=64256 Len=0 TSval=1448780399 TSecr=639453843
81,25.577609,192.168.11.8,192.168.11.13,TCP,93,,,0.00062,"Jan  8, 2024 10:29:38.268430000 JST",,"34012  >  6000 [PSH, ACK] Seq=1 Ack=1 Win=64256 Len=27 TSval=1448780399 TSecr=639453843 [TCP segment of a reassembled PDU]"
82,25.577725,192.168.11.13,192.168.11.8,TCP,66,0.000116,,0.000116,"Jan  8, 2024 10:29:38.268546000 JST",,6000  >  34012 [ACK] Seq=1 Ack=28 Win=65152 Len=0 TSval=639453850 TSecr=1448780399
83,25.577817,192.168.11.8,192.168.11.13,TCP,66,,,0.000092,"Jan  8, 2024 10:29:38.268638000 JST",,"34012  >  6000 [FIN, ACK] Seq=28 Ack=1 Win=64256 Len=0 TSval=1448780399 TSecr=639453843"
84,25.579079,192.168.11.13,192.168.11.8,TCP,66,0.001262,,0.001262,"Jan  8, 2024 10:29:38.269900000 JST",,"6000  >  34012 [FIN, ACK] Seq=1 Ack=29 Win=65152 Len=0 TSval=639453851 TSecr=1448780399"
85,25.58503,192.168.11.8,192.168.11.13,TCP,66,0.005951,,0.005951,"Jan  8, 2024 10:29:38.275851000 JST",,34012  >  6000 [ACK] Seq=29 Ack=2 Win=64256 Len=0 TSval=1448780407 TSecr=639453851
86,31.605864,192.168.11.13,192.168.11.27,TCP,74,,,6.020834,"Jan  8, 2024 10:29:44.296685000 JST",,52522  >  6000 [SYN] Seq=0 Win=64240 Len=0 MSS=1460 SACK_PERM TSval=663866882 TSecr=0 WS=128
87,31.613469,192.168.11.27,192.168.11.13,TCP,74,0.007605,,0.007605,"Jan  8, 2024 10:29:44.304290000 JST",,"6000  >  52522 [SYN, ACK] Seq=0 Ack=1 Win=65160 Len=0 MSS=1460 SACK_PERM TSval=499425604 TSecr=663866882 WS=128"
88,31.613582,192.168.11.13,192.168.11.27,TCP,66,0.000113,,0.000113,"Jan  8, 2024 10:29:44.304403000 JST",,52522  >  6000 [ACK] Seq=1 Ack=1 Win=64256 Len=0 TSval=663866890 TSecr=499425604
89,31.613729,192.168.11.13,192.168.11.27,TCP,93,,,0.000147,"Jan  8, 2024 10:29:44.304550000 JST",,"52522  >  6000 [PSH, ACK] Seq=1 Ack=1 Win=64256 Len=27 TSval=663866890 TSecr=499425604 [TCP segment of a reassembled PDU]"
90,31.613849,192.168.11.13,192.168.11.27,TCP,66,,,0.00012,"Jan  8, 2024 10:29:44.304670000 JST",,"52522  >  6000 [FIN, ACK] Seq=28 Ack=1 Win=64256 Len=0 TSval=663866890 TSecr=499425604"
91,31.620073,192.168.11.27,192.168.11.13,TCP,66,0.006344,,0.006224,"Jan  8, 2024 10:29:44.310894000 JST",,6000  >  52522 [ACK] Seq=1 Ack=28 Win=65152 Len=0 TSval=499425610 TSecr=663866890
92,31.620322,192.168.11.27,192.168.11.13,TCP,66,0.006473,,0.000249,"Jan  8, 2024 10:29:44.311143000 JST",,"6000  >  52522 [FIN, ACK] Seq=1 Ack=29 Win=65152 Len=0 TSval=499425612 TSecr=663866890"
93,31.620368,192.168.11.13,192.168.11.27,TCP,66,0.000046,,0.000046,"Jan  8, 2024 10:29:44.311189000 JST",,52522  >  6000 [ACK] Seq=29 Ack=2 Win=64256 Len=0 TSval=663866897 TSecr=499425612
94,31.651005,192.168.11.13,255.255.255.255,UDP,209,,Ÿ,0.030637,"Jan  8, 2024 10:29:44.341826000 JST",7b2273656d616e74696373223a207b22656e74697479223a2022504944222c202262617365656e74697479223a2022616e79222c2022726f6c65223a2022636363222c20227370617469616c223a2022616e79222c202274656d706f72616c223a2022616e79227d2c20226461746170726f7065727479223a207b22666f726d6174223a2022696e616f6b615f70726f6772616d5f73616d706c655f73656d616e746963227d7d,50221  >  7000 Len=167
95,31.656399,192.168.11.8,192.168.11.13,TCP,74,,œ,0.005394,"Jan  8, 2024 10:29:44.347220000 JST",,55926  >  6000 [SYN] Seq=0 Win=64240 Len=0 MSS=1460 SACK_PERM TSval=1448786479 TSecr=0 WS=128
96,31.656526,192.168.11.13,192.168.11.8,TCP,74,0.000127,,0.000127,"Jan  8, 2024 10:29:44.347347000 JST",,"6000  >  55926 [SYN, ACK] Seq=0 Ack=1 Win=65160 Len=0 MSS=1460 SACK_PERM TSval=639459929 TSecr=1448786479 WS=128"
97,31.663066,192.168.11.8,192.168.11.13,TCP,66,0.00654,,0.00654,"Jan  8, 2024 10:29:44.353887000 JST",,55926  >  6000 [ACK] Seq=1 Ack=1 Win=64256 Len=0 TSval=1448786485 TSecr=639459929
98,31.663685,192.168.11.8,192.168.11.13,TCP,93,,,0.000619,"Jan  8, 2024 10:29:44.354506000 JST",,"55926  >  6000 [PSH, ACK] Seq=1 Ack=1 Win=64256 Len=27 TSval=1448786485 TSecr=639459929 [TCP segment of a reassembled PDU]"
99,31.66378,192.168.11.13,192.168.11.8,TCP,66,0.000095,,0.000095,"Jan  8, 2024 10:29:44.354601000 JST",,6000  >  55926 [ACK] Seq=1 Ack=28 Win=65152 Len=0 TSval=639459936 TSecr=1448786485
100,31.663859,192.168.11.8,192.168.11.13,TCP,66,,,0.000079,"Jan  8, 2024 10:29:44.354680000 JST",,"55926  >  6000 [FIN, ACK] Seq=28 Ack=1 Win=64256 Len=0 TSval=1448786486 TSecr=639459929"
101,31.665007,192.168.11.13,192.168.11.8,TCP,66,0.001148,,0.001148,"Jan  8, 2024 10:29:44.355828000 JST",,"6000  >  55926 [FIN, ACK] Seq=1 Ack=29 Win=65152 Len=0 TSval=639459937 TSecr=1448786486"
102,31.670871,192.168.11.8,192.168.11.13,TCP,66,0.005864,,0.005864,"Jan  8, 2024 10:29:44.361692000 JST",,55926  >  6000 [ACK] Seq=29 Ack=2 Win=64256 Len=0 TSval=1448786493 TSecr=639459937
103,37.718646,192.168.11.13,192.168.11.27,TCP,74,,,6.047775,"Jan  8, 2024 10:29:50.409467000 JST",,34444  >  6000 [SYN] Seq=0 Win=64240 Len=0 MSS=1460 SACK_PERM TSval=663872995 TSecr=0 WS=128
104,37.72645,192.168.11.27,192.168.11.13,TCP,74,0.007804,,0.007804,"Jan  8, 2024 10:29:50.417271000 JST",,"6000  >  34444 [SYN, ACK] Seq=0 Ack=1 Win=65160 Len=0 MSS=1460 SACK_PERM TSval=499431717 TSecr=663872995 WS=128"
105,37.726569,192.168.11.13,192.168.11.27,TCP,66,0.000119,,0.000119,"Jan  8, 2024 10:29:50.417390000 JST",,34444  >  6000 [ACK] Seq=1 Ack=1 Win=64256 Len=0 TSval=663873003 TSecr=499431717
106,37.72674,192.168.11.13,192.168.11.27,TCP,93,,,0.000171,"Jan  8, 2024 10:29:50.417561000 JST",,"34444  >  6000 [PSH, ACK] Seq=1 Ack=1 Win=64256 Len=27 TSval=663873003 TSecr=499431717 [TCP segment of a reassembled PDU]"
107,37.726834,192.168.11.13,192.168.11.27,TCP,66,,,0.000094,"Jan  8, 2024 10:29:50.417655000 JST",,"34444  >  6000 [FIN, ACK] Seq=28 Ack=1 Win=64256 Len=0 TSval=663873003 TSecr=499431717"
108,37.733918,192.168.11.27,192.168.11.13,TCP,66,0.007178,,0.007084,"Jan  8, 2024 10:29:50.424739000 JST",,6000  >  34444 [ACK] Seq=1 Ack=28 Win=65152 Len=0 TSval=499431724 TSecr=663873003
109,37.734211,192.168.11.27,192.168.11.13,TCP,66,0.007377,,0.000293,"Jan  8, 2024 10:29:50.425032000 JST",,"6000  >  34444 [FIN, ACK] Seq=1 Ack=29 Win=65152 Len=0 TSval=499431726 TSecr=663873003"
110,37.734268,192.168.11.13,192.168.11.27,TCP,66,0.000057,,0.000057,"Jan  8, 2024 10:29:50.425089000 JST",,34444  >  6000 [ACK] Seq=29 Ack=2 Win=64256 Len=0 TSval=663873011 TSecr=499431726
111,37.76672,192.168.11.13,255.255.255.255,UDP,209,,Ÿ,0.032452,"Jan  8, 2024 10:29:50.457541000 JST",7b2273656d616e74696373223a207b22656e74697479223a2022504944222c202262617365656e74697479223a2022616e79222c2022726f6c65223a2022636363222c20227370617469616c223a2022616e79222c202274656d706f72616c223a2022616e79227d2c20226461746170726f7065727479223a207b22666f726d6174223a2022696e616f6b615f70726f6772616d5f73616d706c655f73656d616e746963227d7d,40764  >  7000 Len=167
112,37.772434,192.168.11.8,192.168.11.13,TCP,74,,œ,0.005714,"Jan  8, 2024 10:29:50.463255000 JST",,55928  >  6000 [SYN] Seq=0 Win=64240 Len=0 MSS=1460 SACK_PERM TSval=1448792595 TSecr=0 WS=128
113,37.772596,192.168.11.13,192.168.11.8,TCP,74,0.000162,,0.000162,"Jan  8, 2024 10:29:50.463417000 JST",,"6000  >  55928 [SYN, ACK] Seq=0 Ack=1 Win=65160 Len=0 MSS=1460 SACK_PERM TSval=639466045 TSecr=1448792595 WS=128"
114,37.779243,192.168.11.8,192.168.11.13,TCP,66,0.006647,,0.006647,"Jan  8, 2024 10:29:50.470064000 JST",,55928  >  6000 [ACK] Seq=1 Ack=1 Win=64256 Len=0 TSval=1448792601 TSecr=639466045
115,37.779934,192.168.11.8,192.168.11.13,TCP,93,,,0.000691,"Jan  8, 2024 10:29:50.470755000 JST",,"55928  >  6000 [PSH, ACK] Seq=1 Ack=1 Win=64256 Len=27 TSval=1448792602 TSecr=639466045 [TCP segment of a reassembled PDU]"
116,37.780066,192.168.11.13,192.168.11.8,TCP,66,0.000132,,0.000132,"Jan  8, 2024 10:29:50.470887000 JST",,6000  >  55928 [ACK] Seq=1 Ack=28 Win=65152 Len=0 TSval=639466052 TSecr=1448792602
117,37.780128,192.168.11.8,192.168.11.13,TCP,66,,,0.000062,"Jan  8, 2024 10:29:50.470949000 JST",,"55928  >  6000 [FIN, ACK] Seq=28 Ack=1 Win=64256 Len=0 TSval=1448792602 TSecr=639466045"
118,37.781294,192.168.11.13,192.168.11.8,TCP,66,0.001166,,0.001166,"Jan  8, 2024 10:29:50.472115000 JST",,"6000  >  55928 [FIN, ACK] Seq=1 Ack=29 Win=65152 Len=0 TSval=639466054 TSecr=1448792602"
119,37.787539,192.168.11.8,192.168.11.13,TCP,66,0.006245,,0.006245,"Jan  8, 2024 10:29:50.478360000 JST",,55928  >  6000 [ACK] Seq=29 Ack=2 Win=64256 Len=0 TSval=1448792609 TSecr=639466054
120,43.847547,192.168.11.13,192.168.11.27,TCP,74,,,6.060008,"Jan  8, 2024 10:29:56.538368000 JST",,34460  >  6000 [SYN] Seq=0 Win=64240 Len=0 MSS=1460 SACK_PERM TSval=663879124 TSecr=0 WS=128
121,43.854283,192.168.11.27,192.168.11.13,TCP,74,0.006736,,0.006736,"Jan  8, 2024 10:29:56.545104000 JST",,"6000  >  34460 [SYN, ACK] Seq=0 Ack=1 Win=65160 Len=0 MSS=1460 SACK_PERM TSval=499437844 TSecr=663879124 WS=128"
122,43.85441,192.168.11.13,192.168.11.27,TCP,66,0.000127,,0.000127,"Jan  8, 2024 10:29:56.545231000 JST",,34460  >  6000 [ACK] Seq=1 Ack=1 Win=64256 Len=0 TSval=663879131 TSecr=499437844
123,43.854557,192.168.11.13,192.168.11.27,TCP,93,,,0.000147,"Jan  8, 2024 10:29:56.545378000 JST",,"34460  >  6000 [PSH, ACK] Seq=1 Ack=1 Win=64256 Len=27 TSval=663879131 TSecr=499437844 [TCP segment of a reassembled PDU]"
124,43.854663,192.168.11.13,192.168.11.27,TCP,66,,,0.000106,"Jan  8, 2024 10:29:56.545484000 JST",,"34460  >  6000 [FIN, ACK] Seq=28 Ack=1 Win=64256 Len=0 TSval=663879131 TSecr=499437844"
125,43.862242,192.168.11.27,192.168.11.13,TCP,66,0.007685,,0.007579,"Jan  8, 2024 10:29:56.553063000 JST",,6000  >  34460 [ACK] Seq=1 Ack=28 Win=65152 Len=0 TSval=499437852 TSecr=663879131
126,43.862491,192.168.11.27,192.168.11.13,TCP,66,0.007828,,0.000249,"Jan  8, 2024 10:29:56.553312000 JST",,"6000  >  34460 [FIN, ACK] Seq=1 Ack=29 Win=65152 Len=0 TSval=499437854 TSecr=663879131"
127,43.862546,192.168.11.13,192.168.11.27,TCP,66,0.000055,,0.000055,"Jan  8, 2024 10:29:56.553367000 JST",,34460  >  6000 [ACK] Seq=29 Ack=2 Win=64256 Len=0 TSval=663879139 TSecr=499437854
128,43.892869,192.168.11.13,255.255.255.255,UDP,209,,Ÿ,0.030323,"Jan  8, 2024 10:29:56.583690000 JST",7b2273656d616e74696373223a207b22656e74697479223a2022504944222c202262617365656e74697479223a2022616e79222c2022726f6c65223a2022636363222c20227370617469616c223a2022616e79222c202274656d706f72616c223a2022616e79227d2c20226461746170726f7065727479223a207b22666f726d6174223a2022696e616f6b615f70726f6772616d5f73616d706c655f73656d616e746963227d7d,43761  >  7000 Len=167
129,43.898678,192.168.11.8,192.168.11.13,TCP,74,,œ,0.005809,"Jan  8, 2024 10:29:56.589499000 JST",,37556  >  6000 [SYN] Seq=0 Win=64240 Len=0 MSS=1460 SACK_PERM TSval=1448798721 TSecr=0 WS=128
130,43.898828,192.168.11.13,192.168.11.8,TCP,74,0.00015,,0.00015,"Jan  8, 2024 10:29:56.589649000 JST",,"6000  >  37556 [SYN, ACK] Seq=0 Ack=1 Win=65160 Len=0 MSS=1460 SACK_PERM TSval=639472171 TSecr=1448798721 WS=128"
131,43.906593,192.168.11.8,192.168.11.13,TCP,66,0.007765,,0.007765,"Jan  8, 2024 10:29:56.597414000 JST",,37556  >  6000 [ACK] Seq=1 Ack=1 Win=64256 Len=0 TSval=1448798729 TSecr=639472171
132,43.907199,192.168.11.8,192.168.11.13,TCP,93,,,0.000606,"Jan  8, 2024 10:29:56.598020000 JST",,"37556  >  6000 [PSH, ACK] Seq=1 Ack=1 Win=64256 Len=27 TSval=1448798729 TSecr=639472171 [TCP segment of a reassembled PDU]"
133,43.907319,192.168.11.13,192.168.11.8,TCP,66,0.00012,,0.00012,"Jan  8, 2024 10:29:56.598140000 JST",,6000  >  37556 [ACK] Seq=1 Ack=28 Win=65152 Len=0 TSval=639472180 TSecr=1448798729
134,43.907399,192.168.11.8,192.168.11.13,TCP,66,,,0.00008,"Jan  8, 2024 10:29:56.598220000 JST",,"37556  >  6000 [FIN, ACK] Seq=28 Ack=1 Win=64256 Len=0 TSval=1448798729 TSecr=639472171"
135,43.908704,192.168.11.13,192.168.11.8,TCP,66,0.001305,,0.001305,"Jan  8, 2024 10:29:56.599525000 JST",,"6000  >  37556 [FIN, ACK] Seq=1 Ack=29 Win=65152 Len=0 TSval=639472181 TSecr=1448798729"
136,43.914832,192.168.11.8,192.168.11.13,TCP,66,0.006128,,0.006128,"Jan  8, 2024 10:29:56.605653000 JST",,37556  >  6000 [ACK] Seq=29 Ack=2 Win=64256 Len=0 TSval=1448798737 TSecr=639472181
137,49.937279,192.168.11.13,192.168.11.27,TCP,74,,,6.022447,"Jan  8, 2024 10:30:02.628100000 JST",,52572  >  6000 [SYN] Seq=0 Win=64240 Len=0 MSS=1460 SACK_PERM TSval=663885214 TSecr=0 WS=128
138,49.943949,192.168.11.27,192.168.11.13,TCP,74,0.00667,,0.00667,"Jan  8, 2024 10:30:02.634770000 JST",,"6000  >  52572 [SYN, ACK] Seq=0 Ack=1 Win=65160 Len=0 MSS=1460 SACK_PERM TSval=499443934 TSecr=663885214 WS=128"
139,49.944085,192.168.11.13,192.168.11.27,TCP,66,0.000136,,0.000136,"Jan  8, 2024 10:30:02.634906000 JST",,52572  >  6000 [ACK] Seq=1 Ack=1 Win=64256 Len=0 TSval=663885221 TSecr=499443934
140,49.944223,192.168.11.13,192.168.11.27,TCP,93,,,0.000138,"Jan  8, 2024 10:30:02.635044000 JST",,"52572  >  6000 [PSH, ACK] Seq=1 Ack=1 Win=64256 Len=27 TSval=663885221 TSecr=499443934 [TCP segment of a reassembled PDU]"
141,49.944324,192.168.11.13,192.168.11.27,TCP,66,,,0.000101,"Jan  8, 2024 10:30:02.635145000 JST",,"52572  >  6000 [FIN, ACK] Seq=28 Ack=1 Win=64256 Len=0 TSval=663885221 TSecr=499443934"
142,49.961217,192.168.11.27,192.168.11.13,TCP,66,0.016994,,0.016893,"Jan  8, 2024 10:30:02.652038000 JST",,6000  >  52572 [ACK] Seq=1 Ack=28 Win=65152 Len=0 TSval=499443951 TSecr=663885221
143,49.961486,192.168.11.27,192.168.11.13,TCP,66,0.017162,,0.000269,"Jan  8, 2024 10:30:02.652307000 JST",,"6000  >  52572 [FIN, ACK] Seq=1 Ack=29 Win=65152 Len=0 TSval=499443952 TSecr=663885221"
144,49.961552,192.168.11.13,192.168.11.27,TCP,66,0.000066,,0.000066,"Jan  8, 2024 10:30:02.652373000 JST",,52572  >  6000 [ACK] Seq=29 Ack=2 Win=64256 Len=0 TSval=663885238 TSecr=499443952
145,49.989428,192.168.11.13,255.255.255.255,UDP,209,,Ÿ,0.027876,"Jan  8, 2024 10:30:02.680249000 JST",7b2273656d616e74696373223a207b22656e74697479223a2022504944222c202262617365656e74697479223a2022616e79222c2022726f6c65223a2022636363222c20227370617469616c223a2022616e79222c202274656d706f72616c223a2022616e79227d2c20226461746170726f7065727479223a207b22666f726d6174223a2022696e616f6b615f70726f6772616d5f73616d706c655f73656d616e746963227d7d,41771  >  7000 Len=167
146,49.995438,192.168.11.8,192.168.11.13,TCP,74,,œ,0.00601,"Jan  8, 2024 10:30:02.686259000 JST",,50370  >  6000 [SYN] Seq=0 Win=64240 Len=0 MSS=1460 SACK_PERM TSval=1448804817 TSecr=0 WS=128
147,49.995582,192.168.11.13,192.168.11.8,TCP,74,0.000144,,0.000144,"Jan  8, 2024 10:30:02.686403000 JST",,"6000  >  50370 [SYN, ACK] Seq=0 Ack=1 Win=65160 Len=0 MSS=1460 SACK_PERM TSval=639478268 TSecr=1448804817 WS=128"
148,50.002605,192.168.11.8,192.168.11.13,TCP,66,0.007023,,0.007023,"Jan  8, 2024 10:30:02.693426000 JST",,50370  >  6000 [ACK] Seq=1 Ack=1 Win=64256 Len=0 TSval=1448804825 TSecr=639478268
149,50.003199,192.168.11.8,192.168.11.13,TCP,93,,,0.000594,"Jan  8, 2024 10:30:02.694020000 JST",,"50370  >  6000 [PSH, ACK] Seq=1 Ack=1 Win=64256 Len=27 TSval=1448804825 TSecr=639478268 [TCP segment of a reassembled PDU]"
150,50.003315,192.168.11.13,192.168.11.8,TCP,66,0.000116,,0.000116,"Jan  8, 2024 10:30:02.694136000 JST",,6000  >  50370 [ACK] Seq=1 Ack=28 Win=65152 Len=0 TSval=639478276 TSecr=1448804825
151,50.003382,192.168.11.8,192.168.11.13,TCP,66,,,0.000067,"Jan  8, 2024 10:30:02.694203000 JST",,"50370  >  6000 [FIN, ACK] Seq=28 Ack=1 Win=64256 Len=0 TSval=1448804825 TSecr=639478268"
152,50.005201,192.168.11.13,192.168.11.8,TCP,66,0.001819,,0.001819,"Jan  8, 2024 10:30:02.696022000 JST",,"6000  >  50370 [FIN, ACK] Seq=1 Ack=29 Win=65152 Len=0 TSval=639478278 TSecr=1448804825"
153,50.010748,192.168.11.8,192.168.11.13,TCP,66,0.005547,,0.005547,"Jan  8, 2024 10:30:02.701569000 JST",,50370  >  6000 [ACK] Seq=29 Ack=2 Win=64256 Len=0 TSval=1448804833 TSecr=639478278
154,56.05953,192.168.11.13,192.168.11.27,TCP,74,,,6.048782,"Jan  8, 2024 10:30:08.750351000 JST",,37064  >  6000 [SYN] Seq=0 Win=64240 Len=0 MSS=1460 SACK_PERM TSval=663891336 TSecr=0 WS=128
155,56.066096,192.168.11.27,192.168.11.13,TCP,74,0.006566,,0.006566,"Jan  8, 2024 10:30:08.756917000 JST",,"6000  >  37064 [SYN, ACK] Seq=0 Ack=1 Win=65160 Len=0 MSS=1460 SACK_PERM TSval=499450056 TSecr=663891336 WS=128"
156,56.066204,192.168.11.13,192.168.11.27,TCP,66,0.000108,,0.000108,"Jan  8, 2024 10:30:08.757025000 JST",,37064  >  6000 [ACK] Seq=1 Ack=1 Win=64256 Len=0 TSval=663891343 TSecr=499450056
157,56.066388,192.168.11.13,192.168.11.27,TCP,93,,,0.000184,"Jan  8, 2024 10:30:08.757209000 JST",,"37064  >  6000 [PSH, ACK] Seq=1 Ack=1 Win=64256 Len=27 TSval=663891343 TSecr=499450056 [TCP segment of a reassembled PDU]"
158,56.066512,192.168.11.13,192.168.11.27,TCP,66,,,0.000124,"Jan  8, 2024 10:30:08.757333000 JST",,"37064  >  6000 [FIN, ACK] Seq=28 Ack=1 Win=64256 Len=0 TSval=663891343 TSecr=499450056"
159,56.081431,192.168.11.27,192.168.11.13,TCP,66,0.015043,,0.014919,"Jan  8, 2024 10:30:08.772252000 JST",,6000  >  37064 [ACK] Seq=1 Ack=28 Win=65152 Len=0 TSval=499450071 TSecr=663891343
160,56.081678,192.168.11.27,192.168.11.13,TCP,66,0.015166,,0.000247,"Jan  8, 2024 10:30:08.772499000 JST",,"6000  >  37064 [FIN, ACK] Seq=1 Ack=29 Win=65152 Len=0 TSval=499450073 TSecr=663891343"
161,56.081732,192.168.11.13,192.168.11.27,TCP,66,0.000054,,0.000054,"Jan  8, 2024 10:30:08.772553000 JST",,37064  >  6000 [ACK] Seq=29 Ack=2 Win=64256 Len=0 TSval=663891358 TSecr=499450073
162,56.111142,192.168.11.13,255.255.255.255,UDP,209,,Ÿ,0.02941,"Jan  8, 2024 10:30:08.801963000 JST",7b2273656d616e74696373223a207b22656e74697479223a2022504944222c202262617365656e74697479223a2022616e79222c2022726f6c65223a2022636363222c20227370617469616c223a2022616e79222c202274656d706f72616c223a2022616e79227d2c20226461746170726f7065727479223a207b22666f726d6174223a2022696e616f6b615f70726f6772616d5f73616d706c655f73656d616e746963227d7d,41565  >  7000 Len=167
163,56.11771,192.168.11.8,192.168.11.13,TCP,74,,œ,0.006568,"Jan  8, 2024 10:30:08.808531000 JST",,50376  >  6000 [SYN] Seq=0 Win=64240 Len=0 MSS=1460 SACK_PERM TSval=1448810939 TSecr=0 WS=128
164,56.117829,192.168.11.13,192.168.11.8,TCP,74,0.000119,,0.000119,"Jan  8, 2024 10:30:08.808650000 JST",,"6000  >  50376 [SYN, ACK] Seq=0 Ack=1 Win=65160 Len=0 MSS=1460 SACK_PERM TSval=639484390 TSecr=1448810939 WS=128"
165,56.124381,192.168.11.8,192.168.11.13,TCP,66,0.006552,,0.006552,"Jan  8, 2024 10:30:08.815202000 JST",,50376  >  6000 [ACK] Seq=1 Ack=1 Win=64256 Len=0 TSval=1448810947 TSecr=639484390
166,56.12498,192.168.11.8,192.168.11.13,TCP,93,,,0.000599,"Jan  8, 2024 10:30:08.815801000 JST",,"50376  >  6000 [PSH, ACK] Seq=1 Ack=1 Win=64256 Len=27 TSval=1448810947 TSecr=639484390 [TCP segment of a reassembled PDU]"
167,56.12509,192.168.11.13,192.168.11.8,TCP,66,0.00011,,0.00011,"Jan  8, 2024 10:30:08.815911000 JST",,6000  >  50376 [ACK] Seq=1 Ack=28 Win=65152 Len=0 TSval=639484397 TSecr=1448810947
168,56.125158,192.168.11.8,192.168.11.13,TCP,66,,,0.000068,"Jan  8, 2024 10:30:08.815979000 JST",,"50376  >  6000 [FIN, ACK] Seq=28 Ack=1 Win=64256 Len=0 TSval=1448810947 TSecr=639484390"
169,56.127132,192.168.11.13,192.168.11.8,TCP,66,0.001974,,0.001974,"Jan  8, 2024 10:30:08.817953000 JST",,"6000  >  50376 [FIN, ACK] Seq=1 Ack=29 Win=65152 Len=0 TSval=639484400 TSecr=1448810947"
170,56.131724,192.168.11.8,192.168.11.13,TCP,66,0.004592,,0.004592,"Jan  8, 2024 10:30:08.822545000 JST",,50376  >  6000 [ACK] Seq=29 Ack=2 Win=64256 Len=0 TSval=1448810954 TSecr=639484400
171,87.235408,192.168.11.13,192.168.11.27,TCP,74,,,31.103684,"Jan  8, 2024 10:30:39.926229000 JST",,33776  >  6000 [SYN] Seq=0 Win=64240 Len=0 MSS=1460 SACK_PERM TSval=663922512 TSecr=0 WS=128
172,87.243156,192.168.11.27,192.168.11.13,TCP,74,0.007748,,0.007748,"Jan  8, 2024 10:30:39.933977000 JST",,"6000  >  33776 [SYN, ACK] Seq=0 Ack=1 Win=65160 Len=0 MSS=1460 SACK_PERM TSval=499481233 TSecr=663922512 WS=128"
173,87.243292,192.168.11.13,192.168.11.27,TCP,66,0.000136,,0.000136,"Jan  8, 2024 10:30:39.934113000 JST",,33776  >  6000 [ACK] Seq=1 Ack=1 Win=64256 Len=0 TSval=663922520 TSecr=499481233
174,87.243462,192.168.11.13,192.168.11.27,TCP,93,,,0.00017,"Jan  8, 2024 10:30:39.934283000 JST",,"33776  >  6000 [PSH, ACK] Seq=1 Ack=1 Win=64256 Len=27 TSval=663922520 TSecr=499481233 [TCP segment of a reassembled PDU]"
175,87.243588,192.168.11.13,192.168.11.27,TCP,66,,,0.000126,"Jan  8, 2024 10:30:39.934409000 JST",,"33776  >  6000 [FIN, ACK] Seq=28 Ack=1 Win=64256 Len=0 TSval=663922520 TSecr=499481233"
176,87.250723,192.168.11.27,192.168.11.13,TCP,66,0.007261,,0.007135,"Jan  8, 2024 10:30:39.941544000 JST",,6000  >  33776 [ACK] Seq=1 Ack=28 Win=65152 Len=0 TSval=499481241 TSecr=663922520
177,87.250933,192.168.11.27,192.168.11.13,TCP,66,0.007345,,0.00021,"Jan  8, 2024 10:30:39.941754000 JST",,"6000  >  33776 [FIN, ACK] Seq=1 Ack=29 Win=65152 Len=0 TSval=499481243 TSecr=663922520"
178,87.250988,192.168.11.13,192.168.11.27,TCP,66,0.000055,,0.000055,"Jan  8, 2024 10:30:39.941809000 JST",,33776  >  6000 [ACK] Seq=29 Ack=2 Win=64256 Len=0 TSval=663922527 TSecr=499481243
179,87.280982,192.168.11.13,255.255.255.255,UDP,209,,Ÿ,0.029994,"Jan  8, 2024 10:30:39.971803000 JST",7b2273656d616e74696373223a207b22656e74697479223a2022504944222c202262617365656e74697479223a2022616e79222c2022726f6c65223a2022636363222c20227370617469616c223a2022616e79222c202274656d706f72616c223a2022616e79227d2c20226461746170726f7065727479223a207b22666f726d6174223a2022696e616f6b615f70726f6772616d5f73616d706c655f73656d616e746963227d7d,57576  >  7000 Len=167
180,87.286595,192.168.11.8,192.168.11.13,TCP,74,,œ,0.005613,"Jan  8, 2024 10:30:39.977416000 JST",,38248  >  6000 [SYN] Seq=0 Win=64240 Len=0 MSS=1460 SACK_PERM TSval=1448842109 TSecr=0 WS=128
181,87.286732,192.168.11.13,192.168.11.8,TCP,74,0.000137,,0.000137,"Jan  8, 2024 10:30:39.977553000 JST",,"6000  >  38248 [SYN, ACK] Seq=0 Ack=1 Win=65160 Len=0 MSS=1460 SACK_PERM TSval=639515559 TSecr=1448842109 WS=128"
182,87.293328,192.168.11.8,192.168.11.13,TCP,66,0.006596,,0.006596,"Jan  8, 2024 10:30:39.984149000 JST",,38248  >  6000 [ACK] Seq=1 Ack=1 Win=64256 Len=0 TSval=1448842116 TSecr=639515559
183,87.294117,192.168.11.8,192.168.11.13,TCP,93,,,0.000789,"Jan  8, 2024 10:30:39.984938000 JST",,"38248  >  6000 [PSH, ACK] Seq=1 Ack=1 Win=64256 Len=27 TSval=1448842116 TSecr=639515559 [TCP segment of a reassembled PDU]"
184,87.294224,192.168.11.13,192.168.11.8,TCP,66,0.000107,,0.000107,"Jan  8, 2024 10:30:39.985045000 JST",,6000  >  38248 [ACK] Seq=1 Ack=28 Win=65152 Len=0 TSval=639515567 TSecr=1448842116
185,87.294298,192.168.11.8,192.168.11.13,TCP,66,,,0.000074,"Jan  8, 2024 10:30:39.985119000 JST",,"38248  >  6000 [FIN, ACK] Seq=28 Ack=1 Win=64256 Len=0 TSval=1448842116 TSecr=639515559"
186,87.296104,192.168.11.13,192.168.11.8,TCP,66,0.001806,,0.001806,"Jan  8, 2024 10:30:39.986925000 JST",,"6000  >  38248 [FIN, ACK] Seq=1 Ack=29 Win=65152 Len=0 TSval=639515569 TSecr=1448842116"
