No.,Time,Source,Destination,Protocol,Length,The RTT to ACK the segment was,XXX,Time delta from previous captured frame,Arrival Time,Data,Info
1,0,192.168.11.8,192.168.11.13,TCP,74,,,0,"Jan  8, 2024 10:29:12.746965000 JST",,48038  >  6000 [SYN] Seq=0 Win=64240 Len=0 MSS=1460 SACK_PERM TSval=1448754876 TSecr=0 WS=128
2,0.007735,192.168.11.13,192.168.11.8,TCP,74,0.007735,,0.007735,"Jan  8, 2024 10:29:12.754700000 JST",,"6000  >  48038 [SYN, ACK] Seq=0 Ack=1 Win=65160 Len=0 MSS=1460 SACK_PERM TSval=639428326 TSecr=1448754876 WS=128"
3,0.007862,192.168.11.8,192.168.11.13,TCP,66,0.000127,,0.000127,"Jan  8, 2024 10:29:12.754827000 JST",,48038  >  6000 [ACK] Seq=1 Ack=1 Win=64256 Len=0 TSval=1448754884 TSecr=639428326
4,0.008139,192.168.11.8,192.168.11.13,TCP,93,,,0.000277,"Jan  8, 2024 10:29:12.755104000 JST",,"48038  >  6000 [PSH, ACK] Seq=1 Ack=1 Win=64256 Len=27 TSval=1448754884 TSecr=639428326 [TCP segment of a reassembled PDU]"
5,0.008299,192.168.11.8,192.168.11.13,TCP,66,,,0.00016,"Jan  8, 2024 10:29:12.755264000 JST",,"48038  >  6000 [FIN, ACK] Seq=28 Ack=1 Win=64256 Len=0 TSval=1448754884 TSecr=639428326"
6,0.015253,192.168.11.13,192.168.11.8,TCP,66,0.007114,,0.006954,"Jan  8, 2024 10:29:12.762218000 JST",,6000  >  48038 [ACK] Seq=1 Ack=28 Win=65152 Len=0 TSval=639428335 TSecr=1448754884
7,0.015472,192.168.11.13,192.168.11.8,TCP,66,0.007173,,0.000219,"Jan  8, 2024 10:29:12.762437000 JST",,"6000  >  48038 [FIN, ACK] Seq=1 Ack=29 Win=65152 Len=0 TSval=639428336 TSecr=1448754884"
8,0.015548,192.168.11.8,192.168.11.13,TCP,66,0.000076,,0.000076,"Jan  8, 2024 10:29:12.762513000 JST",,48038  >  6000 [ACK] Seq=29 Ack=2 Win=64256 Len=0 TSval=1448754891 TSecr=639428336
9,0.048184,192.168.11.8,255.255.255.255,UDP,209,,Ÿ,0.032636,"Jan  8, 2024 10:29:12.795149000 JST",7b2273656d616e74696373223a207b22656e74697479223a2022504944222c202262617365656e74697479223a2022616e79222c2022726f6c65223a2022646464222c20227370617469616c223a2022616e79222c202274656d706f72616c223a2022616e79227d2c20226461746170726f7065727479223a207b22666f726d6174223a2022696e616f6b615f70726f6772616d5f73616d706c655f73656d616e746963227d7d,36353  >  7000 Len=167
10,0.055309,192.168.11.23,192.168.11.8,TCP,74,,œ,0.007125,"Jan  8, 2024 10:29:12.802274000 JST",,38424  >  6000 [SYN] Seq=0 Win=64240 Len=0 MSS=1460 SACK_PERM TSval=2521955372 TSecr=0 WS=128
11,0.055489,192.168.11.8,192.168.11.23,TCP,74,0.00018,,0.00018,"Jan  8, 2024 10:29:12.802454000 JST",,"6000  >  38424 [SYN, ACK] Seq=0 Ack=1 Win=65160 Len=0 MSS=1460 SACK_PERM TSval=3518211535 TSecr=2521955372 WS=128"
12,0.063257,192.168.11.23,192.168.11.8,TCP,66,0.007768,,0.007768,"Jan  8, 2024 10:29:12.810222000 JST",,38424  >  6000 [ACK] Seq=1 Ack=1 Win=64256 Len=0 TSval=2521955381 TSecr=3518211535
13,0.063982,192.168.11.23,192.168.11.8,TCP,93,,,0.000725,"Jan  8, 2024 10:29:12.810947000 JST",,"38424  >  6000 [PSH, ACK] Seq=1 Ack=1 Win=64256 Len=27 TSval=2521955381 TSecr=3518211535 [TCP segment of a reassembled PDU]"
14,0.064114,192.168.11.8,192.168.11.23,TCP,66,0.000132,,0.000132,"Jan  8, 2024 10:29:12.811079000 JST",,6000  >  38424 [ACK] Seq=1 Ack=28 Win=65152 Len=0 TSval=3518211544 TSecr=2521955381
15,0.0642,192.168.11.23,192.168.11.8,TCP,66,,,0.000086,"Jan  8, 2024 10:29:12.811165000 JST",,"38424  >  6000 [FIN, ACK] Seq=28 Ack=1 Win=64256 Len=0 TSval=2521955381 TSecr=3518211535"
16,0.065838,192.168.11.8,192.168.11.23,TCP,66,0.001638,,0.001638,"Jan  8, 2024 10:29:12.812803000 JST",,"6000  >  38424 [FIN, ACK] Seq=1 Ack=29 Win=65152 Len=0 TSval=3518211546 TSecr=2521955381"
17,0.070406,192.168.11.23,192.168.11.8,TCP,66,0.004568,,0.004568,"Jan  8, 2024 10:29:12.817371000 JST",,38424  >  6000 [ACK] Seq=29 Ack=2 Win=64256 Len=0 TSval=2521955388 TSecr=3518211546
18,6.178514,192.168.11.8,192.168.11.13,TCP,74,,,6.108108,"Jan  8, 2024 10:29:18.925479000 JST",,48054  >  6000 [SYN] Seq=0 Win=64240 Len=0 MSS=1460 SACK_PERM TSval=1448761054 TSecr=0 WS=128
19,6.18495,192.168.11.13,192.168.11.8,TCP,74,0.006436,,0.006436,"Jan  8, 2024 10:29:18.931915000 JST",,"6000  >  48054 [SYN, ACK] Seq=0 Ack=1 Win=65160 Len=0 MSS=1460 SACK_PERM TSval=639434505 TSecr=1448761054 WS=128"
20,6.185054,192.168.11.8,192.168.11.13,TCP,66,0.000104,,0.000104,"Jan  8, 2024 10:29:18.932019000 JST",,48054  >  6000 [ACK] Seq=1 Ack=1 Win=64256 Len=0 TSval=1448761061 TSecr=639434505
21,6.185261,192.168.11.8,192.168.11.13,TCP,93,,,0.000207,"Jan  8, 2024 10:29:18.932226000 JST",,"48054  >  6000 [PSH, ACK] Seq=1 Ack=1 Win=64256 Len=27 TSval=1448761061 TSecr=639434505 [TCP segment of a reassembled PDU]"
22,6.185386,192.168.11.8,192.168.11.13,TCP,66,,,0.000125,"Jan  8, 2024 10:29:18.932351000 JST",,"48054  >  6000 [FIN, ACK] Seq=28 Ack=1 Win=64256 Len=0 TSval=1448761061 TSecr=639434505"
23,6.192357,192.168.11.13,192.168.11.8,TCP,66,0.007096,,0.006971,"Jan  8, 2024 10:29:18.939322000 JST",,6000  >  48054 [ACK] Seq=1 Ack=28 Win=65152 Len=0 TSval=639434512 TSecr=1448761061
24,6.192724,192.168.11.13,192.168.11.8,TCP,66,0.007338,,0.000367,"Jan  8, 2024 10:29:18.939689000 JST",,"6000  >  48054 [FIN, ACK] Seq=1 Ack=29 Win=65152 Len=0 TSval=639434513 TSecr=1448761061"
25,6.192775,192.168.11.8,192.168.11.13,TCP,66,0.000051,,0.000051,"Jan  8, 2024 10:29:18.939740000 JST",,48054  >  6000 [ACK] Seq=29 Ack=2 Win=64256 Len=0 TSval=1448761069 TSecr=639434513
26,6.221815,192.168.11.8,255.255.255.255,UDP,209,,Ÿ,0.02904,"Jan  8, 2024 10:29:18.968780000 JST",7b2273656d616e74696373223a207b22656e74697479223a2022504944222c202262617365656e74697479223a2022616e79222c2022726f6c65223a2022646464222c20227370617469616c223a2022616e79222c202274656d706f72616c223a2022616e79227d2c20226461746170726f7065727479223a207b22666f726d6174223a2022696e616f6b615f70726f6772616d5f73616d706c655f73656d616e746963227d7d,46407  >  7000 Len=167
27,6.227952,192.168.11.23,192.168.11.8,TCP,74,,œ,0.006137,"Jan  8, 2024 10:29:18.974917000 JST",,38430  >  6000 [SYN] Seq=0 Win=64240 Len=0 MSS=1460 SACK_PERM TSval=2521961545 TSecr=0 WS=128
28,6.228102,192.168.11.8,192.168.11.23,TCP,74,0.00015,,0.00015,"Jan  8, 2024 10:29:18.975067000 JST",,"6000  >  38430 [SYN, ACK] Seq=0 Ack=1 Win=65160 Len=0 MSS=1460 SACK_PERM TSval=3518217708 TSecr=2521961545 WS=128"
29,6.242647,192.168.11.23,192.168.11.8,TCP,66,0.014545,,0.014545,"Jan  8, 2024 10:29:18.989612000 JST",,38430  >  6000 [ACK] Seq=1 Ack=1 Win=64256 Len=0 TSval=2521961560 TSecr=3518217708
30,6.243124,192.168.11.23,192.168.11.8,TCP,93,,,0.000477,"Jan  8, 2024 10:29:18.990089000 JST",,"38430  >  6000 [PSH, ACK] Seq=1 Ack=1 Win=64256 Len=27 TSval=2521961560 TSecr=3518217708 [TCP segment of a reassembled PDU]"
31,6.243216,192.168.11.8,192.168.11.23,TCP,66,0.000092,,0.000092,"Jan  8, 2024 10:29:18.990181000 JST",,6000  >  38430 [ACK] Seq=1 Ack=28 Win=65152 Len=0 TSval=3518217723 TSecr=2521961560
32,6.243281,192.168.11.23,192.168.11.8,TCP,66,,,0.000065,"Jan  8, 2024 10:29:18.990246000 JST",,"38430  >  6000 [FIN, ACK] Seq=28 Ack=1 Win=64256 Len=0 TSval=2521961561 TSecr=3518217708"
33,6.245567,192.168.11.8,192.168.11.23,TCP,66,0.002286,,0.002286,"Jan  8, 2024 10:29:18.992532000 JST",,"6000  >  38430 [FIN, ACK] Seq=1 Ack=29 Win=65152 Len=0 TSval=3518217725 TSecr=2521961561"
34,6.252364,192.168.11.23,192.168.11.8,TCP,66,0.006797,,0.006797,"Jan  8, 2024 10:29:18.999329000 JST",,38430  >  6000 [ACK] Seq=29 Ack=2 Win=64256 Len=0 TSval=2521961570 TSecr=3518217725
35,12.27465,192.168.11.8,192.168.11.13,TCP,74,,,6.022286,"Jan  8, 2024 10:29:25.021615000 JST",,60908  >  6000 [SYN] Seq=0 Win=64240 Len=0 MSS=1460 SACK_PERM TSval=1448767151 TSecr=0 WS=128
36,12.281628,192.168.11.13,192.168.11.8,TCP,74,0.006978,,0.006978,"Jan  8, 2024 10:29:25.028593000 JST",,"6000  >  60908 [SYN, ACK] Seq=0 Ack=1 Win=65160 Len=0 MSS=1460 SACK_PERM TSval=639440601 TSecr=1448767151 WS=128"
37,12.281732,192.168.11.8,192.168.11.13,TCP,66,0.000104,,0.000104,"Jan  8, 2024 10:29:25.028697000 JST",,60908  >  6000 [ACK] Seq=1 Ack=1 Win=64256 Len=0 TSval=1448767158 TSecr=639440601
38,12.281935,192.168.11.8,192.168.11.13,TCP,93,,,0.000203,"Jan  8, 2024 10:29:25.028900000 JST",,"60908  >  6000 [PSH, ACK] Seq=1 Ack=1 Win=64256 Len=27 TSval=1448767158 TSecr=639440601 [TCP segment of a reassembled PDU]"
39,12.282045,192.168.11.8,192.168.11.13,TCP,66,,,0.00011,"Jan  8, 2024 10:29:25.029010000 JST",,"60908  >  6000 [FIN, ACK] Seq=28 Ack=1 Win=64256 Len=0 TSval=1448767158 TSecr=639440601"
40,12.289184,192.168.11.13,192.168.11.8,TCP,66,0.007249,,0.007139,"Jan  8, 2024 10:29:25.036149000 JST",,6000  >  60908 [ACK] Seq=1 Ack=28 Win=65152 Len=0 TSval=639440609 TSecr=1448767158
41,12.289403,192.168.11.13,192.168.11.8,TCP,66,0.007358,,0.000219,"Jan  8, 2024 10:29:25.036368000 JST",,"6000  >  60908 [FIN, ACK] Seq=1 Ack=29 Win=65152 Len=0 TSval=639440610 TSecr=1448767158"
42,12.28945,192.168.11.8,192.168.11.13,TCP,66,0.000047,,0.000047,"Jan  8, 2024 10:29:25.036415000 JST",,60908  >  6000 [ACK] Seq=29 Ack=2 Win=64256 Len=0 TSval=1448767165 TSecr=639440610
43,12.320201,192.168.11.8,255.255.255.255,UDP,209,,Ÿ,0.030751,"Jan  8, 2024 10:29:25.067166000 JST",7b2273656d616e74696373223a207b22656e74697479223a2022504944222c202262617365656e74697479223a2022616e79222c2022726f6c65223a2022646464222c20227370617469616c223a2022616e79222c202274656d706f72616c223a2022616e79227d2c20226461746170726f7065727479223a207b22666f726d6174223a2022696e616f6b615f70726f6772616d5f73616d706c655f73656d616e746963227d7d,42405  >  7000 Len=167
44,12.325928,192.168.11.23,192.168.11.8,TCP,74,,œ,0.005727,"Jan  8, 2024 10:29:25.072893000 JST",,60768  >  6000 [SYN] Seq=0 Win=64240 Len=0 MSS=1460 SACK_PERM TSval=2521967643 TSecr=0 WS=128
45,12.32608,192.168.11.8,192.168.11.23,TCP,74,0.000152,,0.000152,"Jan  8, 2024 10:29:25.073045000 JST",,"6000  >  60768 [SYN, ACK] Seq=0 Ack=1 Win=65160 Len=0 MSS=1460 SACK_PERM TSval=3518223806 TSecr=2521967643 WS=128"
46,12.332969,192.168.11.23,192.168.11.8,TCP,66,0.006889,,0.006889,"Jan  8, 2024 10:29:25.079934000 JST",,60768  >  6000 [ACK] Seq=1 Ack=1 Win=64256 Len=0 TSval=2521967650 TSecr=3518223806
47,12.333571,192.168.11.23,192.168.11.8,TCP,93,,,0.000602,"Jan  8, 2024 10:29:25.080536000 JST",,"60768  >  6000 [PSH, ACK] Seq=1 Ack=1 Win=64256 Len=27 TSval=2521967651 TSecr=3518223806 [TCP segment of a reassembled PDU]"
48,12.333685,192.168.11.8,192.168.11.23,TCP,66,0.000114,,0.000114,"Jan  8, 2024 10:29:25.080650000 JST",,6000  >  60768 [ACK] Seq=1 Ack=28 Win=65152 Len=0 TSval=3518223814 TSecr=2521967651
49,12.333773,192.168.11.23,192.168.11.8,TCP,66,,,0.000088,"Jan  8, 2024 10:29:25.080738000 JST",,"60768  >  6000 [FIN, ACK] Seq=28 Ack=1 Win=64256 Len=0 TSval=2521967651 TSecr=3518223806"
50,12.3352,192.168.11.8,192.168.11.23,TCP,66,0.001427,,0.001427,"Jan  8, 2024 10:29:25.082165000 JST",,"6000  >  60768 [FIN, ACK] Seq=1 Ack=29 Win=65152 Len=0 TSval=3518223815 TSecr=2521967651"
51,12.342335,192.168.11.23,192.168.11.8,TCP,66,0.007135,,0.007135,"Jan  8, 2024 10:29:25.089300000 JST",,60768  >  6000 [ACK] Seq=29 Ack=2 Win=64256 Len=0 TSval=2521967660 TSecr=3518223815
52,18.392124,192.168.11.8,192.168.11.13,TCP,74,,,6.049789,"Jan  8, 2024 10:29:31.139089000 JST",,60914  >  6000 [SYN] Seq=0 Win=64240 Len=0 MSS=1460 SACK_PERM TSval=1448773268 TSecr=0 WS=128
53,18.398738,192.168.11.13,192.168.11.8,TCP,74,0.006614,,0.006614,"Jan  8, 2024 10:29:31.145703000 JST",,"6000  >  60914 [SYN, ACK] Seq=0 Ack=1 Win=65160 Len=0 MSS=1460 SACK_PERM TSval=639446718 TSecr=1448773268 WS=128"
54,18.398844,192.168.11.8,192.168.11.13,TCP,66,0.000106,,0.000106,"Jan  8, 2024 10:29:31.145809000 JST",,60914  >  6000 [ACK] Seq=1 Ack=1 Win=64256 Len=0 TSval=1448773275 TSecr=639446718
55,18.399046,192.168.11.8,192.168.11.13,TCP,93,,,0.000202,"Jan  8, 2024 10:29:31.146011000 JST",,"60914  >  6000 [PSH, ACK] Seq=1 Ack=1 Win=64256 Len=27 TSval=1448773275 TSecr=639446718 [TCP segment of a reassembled PDU]"
56,18.399141,192.168.11.8,192.168.11.13,TCP,66,,,0.000095,"Jan  8, 2024 10:29:31.146106000 JST",,"60914  >  6000 [FIN, ACK] Seq=28 Ack=1 Win=64256 Len=0 TSval=1448773275 TSecr=639446718"
57,18.406181,192.168.11.13,192.168.11.8,TCP,66,0.007135,,0.00704,"Jan  8, 2024 10:29:31.153146000 JST",,6000  >  60914 [ACK] Seq=1 Ack=28 Win=65152 Len=0 TSval=639446726 TSecr=1448773275
58,18.406562,192.168.11.13,192.168.11.8,TCP,66,0.007421,,0.000381,"Jan  8, 2024 10:29:31.153527000 JST",,"6000  >  60914 [FIN, ACK] Seq=1 Ack=29 Win=65152 Len=0 TSval=639446727 TSecr=1448773275"
59,18.40661,192.168.11.8,192.168.11.13,TCP,66,0.000048,,0.000048,"Jan  8, 2024 10:29:31.153575000 JST",,60914  >  6000 [ACK] Seq=29 Ack=2 Win=64256 Len=0 TSval=1448773283 TSecr=639446727
60,18.435386,192.168.11.8,255.255.255.255,UDP,209,,Ÿ,0.028776,"Jan  8, 2024 10:29:31.182351000 JST",7b2273656d616e74696373223a207b22656e74697479223a2022504944222c202262617365656e74697479223a2022616e79222c2022726f6c65223a2022646464222c20227370617469616c223a2022616e79222c202274656d706f72616c223a2022616e79227d2c20226461746170726f7065727479223a207b22666f726d6174223a2022696e616f6b615f70726f6772616d5f73616d706c655f73656d616e746963227d7d,47472  >  7000 Len=167
61,18.442261,192.168.11.23,192.168.11.8,TCP,74,,œ,0.006875,"Jan  8, 2024 10:29:31.189226000 JST",,54194  >  6000 [SYN] Seq=0 Win=64240 Len=0 MSS=1460 SACK_PERM TSval=2521973759 TSecr=0 WS=128
62,18.442436,192.168.11.8,192.168.11.23,TCP,74,0.000175,,0.000175,"Jan  8, 2024 10:29:31.189401000 JST",,"6000  >  54194 [SYN, ACK] Seq=0 Ack=1 Win=65160 Len=0 MSS=1460 SACK_PERM TSval=3518229922 TSecr=2521973759 WS=128"
63,18.44964,192.168.11.23,192.168.11.8,TCP,66,0.007204,,0.007204,"Jan  8, 2024 10:29:31.196605000 JST",,54194  >  6000 [ACK] Seq=1 Ack=1 Win=64256 Len=0 TSval=2521973767 TSecr=3518229922
64,18.450255,192.168.11.23,192.168.11.8,TCP,93,,,0.000615,"Jan  8, 2024 10:29:31.197220000 JST",,"54194  >  6000 [PSH, ACK] Seq=1 Ack=1 Win=64256 Len=27 TSval=2521973767 TSecr=3518229922 [TCP segment of a reassembled PDU]"
65,18.450367,192.168.11.8,192.168.11.23,TCP,66,0.000112,,0.000112,"Jan  8, 2024 10:29:31.197332000 JST",,6000  >  54194 [ACK] Seq=1 Ack=28 Win=65152 Len=0 TSval=3518229930 TSecr=2521973767
66,18.450456,192.168.11.23,192.168.11.8,TCP,66,,,0.000089,"Jan  8, 2024 10:29:31.197421000 JST",,"54194  >  6000 [FIN, ACK] Seq=28 Ack=1 Win=64256 Len=0 TSval=2521973767 TSecr=3518229922"
67,18.451957,192.168.11.8,192.168.11.23,TCP,66,0.001501,,0.001501,"Jan  8, 2024 10:29:31.198922000 JST",,"6000  >  54194 [FIN, ACK] Seq=1 Ack=29 Win=65152 Len=0 TSval=3518229932 TSecr=2521973767"
68,18.457293,192.168.11.23,192.168.11.8,TCP,66,0.005336,,0.005336,"Jan  8, 2024 10:29:31.204258000 JST",,54194  >  6000 [ACK] Seq=29 Ack=2 Win=64256 Len=0 TSval=2521973775 TSecr=3518229932
69,25.516552,192.168.11.8,192.168.11.13,TCP,74,,,7.059259,"Jan  8, 2024 10:29:38.263517000 JST",,34012  >  6000 [SYN] Seq=0 Win=64240 Len=0 MSS=1460 SACK_PERM TSval=1448780392 TSecr=0 WS=128
70,25.523095,192.168.11.13,192.168.11.8,TCP,74,0.006543,,0.006543,"Jan  8, 2024 10:29:38.270060000 JST",,"6000  >  34012 [SYN, ACK] Seq=0 Ack=1 Win=65160 Len=0 MSS=1460 SACK_PERM TSval=639453843 TSecr=1448780392 WS=128"
71,25.523214,192.168.11.8,192.168.11.13,TCP,66,0.000119,,0.000119,"Jan  8, 2024 10:29:38.270179000 JST",,34012  >  6000 [ACK] Seq=1 Ack=1 Win=64256 Len=0 TSval=1448780399 TSecr=639453843
72,25.523367,192.168.11.8,192.168.11.13,TCP,93,,,0.000153,"Jan  8, 2024 10:29:38.270332000 JST",,"34012  >  6000 [PSH, ACK] Seq=1 Ack=1 Win=64256 Len=27 TSval=1448780399 TSecr=639453843 [TCP segment of a reassembled PDU]"
73,25.523478,192.168.11.8,192.168.11.13,TCP,66,,,0.000111,"Jan  8, 2024 10:29:38.270443000 JST",,"34012  >  6000 [FIN, ACK] Seq=28 Ack=1 Win=64256 Len=0 TSval=1448780399 TSecr=639453843"
74,25.530574,192.168.11.13,192.168.11.8,TCP,66,0.007207,,0.007096,"Jan  8, 2024 10:29:38.277539000 JST",,6000  >  34012 [ACK] Seq=1 Ack=28 Win=65152 Len=0 TSval=639453850 TSecr=1448780399
75,25.530963,192.168.11.13,192.168.11.8,TCP,66,0.007485,,0.000389,"Jan  8, 2024 10:29:38.277928000 JST",,"6000  >  34012 [FIN, ACK] Seq=1 Ack=29 Win=65152 Len=0 TSval=639453851 TSecr=1448780399"
76,25.53102,192.168.11.8,192.168.11.13,TCP,66,0.000057,,0.000057,"Jan  8, 2024 10:29:38.277985000 JST",,34012  >  6000 [ACK] Seq=29 Ack=2 Win=64256 Len=0 TSval=1448780407 TSecr=639453851
77,25.557374,192.168.11.8,255.255.255.255,UDP,209,,Ÿ,0.026354,"Jan  8, 2024 10:29:38.304339000 JST",7b2273656d616e74696373223a207b22656e74697479223a2022504944222c202262617365656e74697479223a2022616e79222c2022726f6c65223a2022646464222c20227370617469616c223a2022616e79222c202274656d706f72616c223a2022616e79227d2c20226461746170726f7065727479223a207b22666f726d6174223a2022696e616f6b615f70726f6772616d5f73616d706c655f73656d616e746963227d7d,45264  >  7000 Len=167
78,25.564029,192.168.11.23,192.168.11.8,TCP,74,,œ,0.006655,"Jan  8, 2024 10:29:38.310994000 JST",,54196  >  6000 [SYN] Seq=0 Win=64240 Len=0 MSS=1460 SACK_PERM TSval=2521980881 TSecr=0 WS=128
79,25.564159,192.168.11.8,192.168.11.23,TCP,74,0.00013,,0.00013,"Jan  8, 2024 10:29:38.311124000 JST",,"6000  >  54196 [SYN, ACK] Seq=0 Ack=1 Win=65160 Len=0 MSS=1460 SACK_PERM TSval=3518237044 TSecr=2521980881 WS=128"
80,25.570696,192.168.11.23,192.168.11.8,TCP,66,0.006537,,0.006537,"Jan  8, 2024 10:29:38.317661000 JST",,54196  >  6000 [ACK] Seq=1 Ack=1 Win=64256 Len=0 TSval=2521980888 TSecr=3518237044
81,25.571133,192.168.11.23,192.168.11.8,TCP,93,,,0.000437,"Jan  8, 2024 10:29:38.318098000 JST",,"54196  >  6000 [PSH, ACK] Seq=1 Ack=1 Win=64256 Len=27 TSval=2521980888 TSecr=3518237044 [TCP segment of a reassembled PDU]"
82,25.571252,192.168.11.8,192.168.11.23,TCP,66,0.000119,,0.000119,"Jan  8, 2024 10:29:38.318217000 JST",,6000  >  54196 [ACK] Seq=1 Ack=28 Win=65152 Len=0 TSval=3518237051 TSecr=2521980888
83,25.571626,192.168.11.23,192.168.11.8,TCP,66,,,0.000374,"Jan  8, 2024 10:29:38.318591000 JST",,"54196  >  6000 [FIN, ACK] Seq=28 Ack=1 Win=64256 Len=0 TSval=2521980889 TSecr=3518237044"
84,25.572991,192.168.11.8,192.168.11.23,TCP,66,0.001365,,0.001365,"Jan  8, 2024 10:29:38.319956000 JST",,"6000  >  54196 [FIN, ACK] Seq=1 Ack=29 Win=65152 Len=0 TSval=3518237053 TSecr=2521980889"
85,25.578832,192.168.11.23,192.168.11.8,TCP,66,0.005841,,0.005841,"Jan  8, 2024 10:29:38.325797000 JST",,54196  >  6000 [ACK] Seq=29 Ack=2 Win=64256 Len=0 TSval=2521980896 TSecr=3518237053
86,31.602709,192.168.11.8,192.168.11.13,TCP,74,,,6.023877,"Jan  8, 2024 10:29:44.349674000 JST",,55926  >  6000 [SYN] Seq=0 Win=64240 Len=0 MSS=1460 SACK_PERM TSval=1448786479 TSecr=0 WS=128
87,31.60916,192.168.11.13,192.168.11.8,TCP,74,0.006451,,0.006451,"Jan  8, 2024 10:29:44.356125000 JST",,"6000  >  55926 [SYN, ACK] Seq=0 Ack=1 Win=65160 Len=0 MSS=1460 SACK_PERM TSval=639459929 TSecr=1448786479 WS=128"
88,31.609261,192.168.11.8,192.168.11.13,TCP,66,0.000101,,0.000101,"Jan  8, 2024 10:29:44.356226000 JST",,55926  >  6000 [ACK] Seq=1 Ack=1 Win=64256 Len=0 TSval=1448786485 TSecr=639459929
89,31.609452,192.168.11.8,192.168.11.13,TCP,93,,,0.000191,"Jan  8, 2024 10:29:44.356417000 JST",,"55926  >  6000 [PSH, ACK] Seq=1 Ack=1 Win=64256 Len=27 TSval=1448786485 TSecr=639459929 [TCP segment of a reassembled PDU]"
90,31.609552,192.168.11.8,192.168.11.13,TCP,66,,,0.0001,"Jan  8, 2024 10:29:44.356517000 JST",,"55926  >  6000 [FIN, ACK] Seq=28 Ack=1 Win=64256 Len=0 TSval=1448786486 TSecr=639459929"
91,31.616588,192.168.11.13,192.168.11.8,TCP,66,0.007136,,0.007036,"Jan  8, 2024 10:29:44.363553000 JST",,6000  >  55926 [ACK] Seq=1 Ack=28 Win=65152 Len=0 TSval=639459936 TSecr=1448786485
92,31.616924,192.168.11.13,192.168.11.8,TCP,66,0.007372,,0.000336,"Jan  8, 2024 10:29:44.363889000 JST",,"6000  >  55926 [FIN, ACK] Seq=1 Ack=29 Win=65152 Len=0 TSval=639459937 TSecr=1448786486"
93,31.616966,192.168.11.8,192.168.11.13,TCP,66,0.000042,,0.000042,"Jan  8, 2024 10:29:44.363931000 JST",,55926  >  6000 [ACK] Seq=29 Ack=2 Win=64256 Len=0 TSval=1448786493 TSecr=639459937
94,31.643231,192.168.11.8,255.255.255.255,UDP,209,,Ÿ,0.026265,"Jan  8, 2024 10:29:44.390196000 JST",7b2273656d616e74696373223a207b22656e74697479223a2022504944222c202262617365656e74697479223a2022616e79222c2022726f6c65223a2022646464222c20227370617469616c223a2022616e79222c202274656d706f72616c223a2022616e79227d2c20226461746170726f7065727479223a207b22666f726d6174223a2022696e616f6b615f70726f6772616d5f73616d706c655f73656d616e746963227d7d,55768  >  7000 Len=167
95,31.649826,192.168.11.23,192.168.11.8,TCP,74,,œ,0.006595,"Jan  8, 2024 10:29:44.396791000 JST",,36846  >  6000 [SYN] Seq=0 Win=64240 Len=0 MSS=1460 SACK_PERM TSval=2521986966 TSecr=0 WS=128
96,31.649939,192.168.11.8,192.168.11.23,TCP,74,0.000113,,0.000113,"Jan  8, 2024 10:29:44.396904000 JST",,"6000  >  36846 [SYN, ACK] Seq=0 Ack=1 Win=65160 Len=0 MSS=1460 SACK_PERM TSval=3518243130 TSecr=2521986966 WS=128"
97,31.656473,192.168.11.23,192.168.11.8,TCP,66,0.006534,,0.006534,"Jan  8, 2024 10:29:44.403438000 JST",,36846  >  6000 [ACK] Seq=1 Ack=1 Win=64256 Len=0 TSval=2521986974 TSecr=3518243130
98,31.657644,192.168.11.23,192.168.11.8,TCP,93,,,0.001171,"Jan  8, 2024 10:29:44.404609000 JST",,"36846  >  6000 [PSH, ACK] Seq=1 Ack=1 Win=64256 Len=27 TSval=2521986974 TSecr=3518243130 [TCP segment of a reassembled PDU]"
99,31.657793,192.168.11.8,192.168.11.23,TCP,66,0.000149,,0.000149,"Jan  8, 2024 10:29:44.404758000 JST",,6000  >  36846 [ACK] Seq=1 Ack=28 Win=65152 Len=0 TSval=3518243138 TSecr=2521986974
100,31.657872,192.168.11.23,192.168.11.8,TCP,66,,,0.000079,"Jan  8, 2024 10:29:44.404837000 JST",,"36846  >  6000 [FIN, ACK] Seq=28 Ack=1 Win=64256 Len=0 TSval=2521986974 TSecr=3518243130"
101,31.659331,192.168.11.8,192.168.11.23,TCP,66,0.001459,,0.001459,"Jan  8, 2024 10:29:44.406296000 JST",,"6000  >  36846 [FIN, ACK] Seq=1 Ack=29 Win=65152 Len=0 TSval=3518243139 TSecr=2521986974"
102,31.663887,192.168.11.23,192.168.11.8,TCP,66,0.004556,,0.004556,"Jan  8, 2024 10:29:44.410852000 JST",,36846  >  6000 [ACK] Seq=29 Ack=2 Win=64256 Len=0 TSval=2521986982 TSecr=3518243139
103,37.718622,192.168.11.8,192.168.11.13,TCP,74,,,6.054735,"Jan  8, 2024 10:29:50.465587000 JST",,55928  >  6000 [SYN] Seq=0 Win=64240 Len=0 MSS=1460 SACK_PERM TSval=1448792595 TSecr=0 WS=128
104,37.725334,192.168.11.13,192.168.11.8,TCP,74,0.006712,,0.006712,"Jan  8, 2024 10:29:50.472299000 JST",,"6000  >  55928 [SYN, ACK] Seq=0 Ack=1 Win=65160 Len=0 MSS=1460 SACK_PERM TSval=639466045 TSecr=1448792595 WS=128"
105,37.725459,192.168.11.8,192.168.11.13,TCP,66,0.000125,,0.000125,"Jan  8, 2024 10:29:50.472424000 JST",,55928  >  6000 [ACK] Seq=1 Ack=1 Win=64256 Len=0 TSval=1448792601 TSecr=639466045
106,37.725663,192.168.11.8,192.168.11.13,TCP,93,,,0.000204,"Jan  8, 2024 10:29:50.472628000 JST",,"55928  >  6000 [PSH, ACK] Seq=1 Ack=1 Win=64256 Len=27 TSval=1448792602 TSecr=639466045 [TCP segment of a reassembled PDU]"
107,37.725775,192.168.11.8,192.168.11.13,TCP,66,,,0.000112,"Jan  8, 2024 10:29:50.472740000 JST",,"55928  >  6000 [FIN, ACK] Seq=28 Ack=1 Win=64256 Len=0 TSval=1448792602 TSecr=639466045"
108,37.732872,192.168.11.13,192.168.11.8,TCP,66,0.007209,,0.007097,"Jan  8, 2024 10:29:50.479837000 JST",,6000  >  55928 [ACK] Seq=1 Ack=28 Win=65152 Len=0 TSval=639466052 TSecr=1448792602
109,37.73325,192.168.11.13,192.168.11.8,TCP,66,0.007475,,0.000378,"Jan  8, 2024 10:29:50.480215000 JST",,"6000  >  55928 [FIN, ACK] Seq=1 Ack=29 Win=65152 Len=0 TSval=639466054 TSecr=1448792602"
110,37.733316,192.168.11.8,192.168.11.13,TCP,66,0.000066,,0.000066,"Jan  8, 2024 10:29:50.480281000 JST",,55928  >  6000 [ACK] Seq=29 Ack=2 Win=64256 Len=0 TSval=1448792609 TSecr=639466054
111,37.762445,192.168.11.8,255.255.255.255,UDP,209,,Ÿ,0.029129,"Jan  8, 2024 10:29:50.509410000 JST",7b2273656d616e74696373223a207b22656e74697479223a2022504944222c202262617365656e74697479223a2022616e79222c2022726f6c65223a2022646464222c20227370617469616c223a2022616e79222c202274656d706f72616c223a2022616e79227d2c20226461746170726f7065727479223a207b22666f726d6174223a2022696e616f6b615f70726f6772616d5f73616d706c655f73656d616e746963227d7d,46313  >  7000 Len=167
112,37.769151,192.168.11.23,192.168.11.8,TCP,74,,œ,0.006706,"Jan  8, 2024 10:29:50.516116000 JST",,36852  >  6000 [SYN] Seq=0 Win=64240 Len=0 MSS=1460 SACK_PERM TSval=2521993086 TSecr=0 WS=128
113,37.769283,192.168.11.8,192.168.11.23,TCP,74,0.000132,,0.000132,"Jan  8, 2024 10:29:50.516248000 JST",,"6000  >  36852 [SYN, ACK] Seq=0 Ack=1 Win=65160 Len=0 MSS=1460 SACK_PERM TSval=3518249249 TSecr=2521993086 WS=128"
114,37.787114,192.168.11.23,192.168.11.8,TCP,66,0.017831,,0.017831,"Jan  8, 2024 10:29:50.534079000 JST",,36852  >  6000 [ACK] Seq=1 Ack=1 Win=64256 Len=0 TSval=2521993094 TSecr=3518249249
115,37.787658,192.168.11.23,192.168.11.8,TCP,93,,,0.000544,"Jan  8, 2024 10:29:50.534623000 JST",,"36852  >  6000 [PSH, ACK] Seq=1 Ack=1 Win=64256 Len=27 TSval=2521993094 TSecr=3518249249 [TCP segment of a reassembled PDU]"
116,37.787745,192.168.11.8,192.168.11.23,TCP,66,0.000087,,0.000087,"Jan  8, 2024 10:29:50.534710000 JST",,6000  >  36852 [ACK] Seq=1 Ack=28 Win=65152 Len=0 TSval=3518249268 TSecr=2521993094
117,37.787822,192.168.11.23,192.168.11.8,TCP,66,,,0.000077,"Jan  8, 2024 10:29:50.534787000 JST",,"36852  >  6000 [FIN, ACK] Seq=28 Ack=1 Win=64256 Len=0 TSval=2521993094 TSecr=3518249249"
118,37.788745,192.168.11.8,192.168.11.23,TCP,66,0.000923,,0.000923,"Jan  8, 2024 10:29:50.535710000 JST",,"6000  >  36852 [FIN, ACK] Seq=1 Ack=29 Win=65152 Len=0 TSval=3518249269 TSecr=2521993094"
119,37.794857,192.168.11.23,192.168.11.8,TCP,66,0.006112,,0.006112,"Jan  8, 2024 10:29:50.541822000 JST",,36852  >  6000 [ACK] Seq=29 Ack=2 Win=64256 Len=0 TSval=2521993112 TSecr=3518249269
120,43.844762,192.168.11.8,192.168.11.13,TCP,74,,,6.049905,"Jan  8, 2024 10:29:56.591727000 JST",,37556  >  6000 [SYN] Seq=0 Win=64240 Len=0 MSS=1460 SACK_PERM TSval=1448798721 TSecr=0 WS=128
121,43.852612,192.168.11.13,192.168.11.8,TCP,74,0.00785,,0.00785,"Jan  8, 2024 10:29:56.599577000 JST",,"6000  >  37556 [SYN, ACK] Seq=0 Ack=1 Win=65160 Len=0 MSS=1460 SACK_PERM TSval=639472171 TSecr=1448798721 WS=128"
122,43.852733,192.168.11.8,192.168.11.13,TCP,66,0.000121,,0.000121,"Jan  8, 2024 10:29:56.599698000 JST",,37556  >  6000 [ACK] Seq=1 Ack=1 Win=64256 Len=0 TSval=1448798729 TSecr=639472171
123,43.852916,192.168.11.8,192.168.11.13,TCP,93,,,0.000183,"Jan  8, 2024 10:29:56.599881000 JST",,"37556  >  6000 [PSH, ACK] Seq=1 Ack=1 Win=64256 Len=27 TSval=1448798729 TSecr=639472171 [TCP segment of a reassembled PDU]"
124,43.853032,192.168.11.8,192.168.11.13,TCP,66,,,0.000116,"Jan  8, 2024 10:29:56.599997000 JST",,"37556  >  6000 [FIN, ACK] Seq=28 Ack=1 Win=64256 Len=0 TSval=1448798729 TSecr=639472171"
125,43.860201,192.168.11.13,192.168.11.8,TCP,66,0.007285,,0.007169,"Jan  8, 2024 10:29:56.607166000 JST",,6000  >  37556 [ACK] Seq=1 Ack=28 Win=65152 Len=0 TSval=639472180 TSecr=1448798729
126,43.860604,192.168.11.13,192.168.11.8,TCP,66,0.007572,,0.000403,"Jan  8, 2024 10:29:56.607569000 JST",,"6000  >  37556 [FIN, ACK] Seq=1 Ack=29 Win=65152 Len=0 TSval=639472181 TSecr=1448798729"
127,43.860683,192.168.11.8,192.168.11.13,TCP,66,0.000079,,0.000079,"Jan  8, 2024 10:29:56.607648000 JST",,37556  >  6000 [ACK] Seq=29 Ack=2 Win=64256 Len=0 TSval=1448798737 TSecr=639472181
128,43.891203,192.168.11.8,255.255.255.255,UDP,209,,Ÿ,0.03052,"Jan  8, 2024 10:29:56.638168000 JST",7b2273656d616e74696373223a207b22656e74697479223a2022504944222c202262617365656e74697479223a2022616e79222c2022726f6c65223a2022646464222c20227370617469616c223a2022616e79222c202274656d706f72616c223a2022616e79227d2c20226461746170726f7065727479223a207b22666f726d6174223a2022696e616f6b615f70726f6772616d5f73616d706c655f73656d616e746963227d7d,57090  >  7000 Len=167
129,43.896957,192.168.11.23,192.168.11.8,TCP,74,,œ,0.005754,"Jan  8, 2024 10:29:56.643922000 JST",,58012  >  6000 [SYN] Seq=0 Win=64240 Len=0 MSS=1460 SACK_PERM TSval=2521999215 TSecr=0 WS=128
130,43.897134,192.168.11.8,192.168.11.23,TCP,74,0.000177,,0.000177,"Jan  8, 2024 10:29:56.644099000 JST",,"6000  >  58012 [SYN, ACK] Seq=0 Ack=1 Win=65160 Len=0 MSS=1460 SACK_PERM TSval=3518255377 TSecr=2521999215 WS=128"
131,43.904068,192.168.11.23,192.168.11.8,TCP,66,0.006934,,0.006934,"Jan  8, 2024 10:29:56.651033000 JST",,58012  >  6000 [ACK] Seq=1 Ack=1 Win=64256 Len=0 TSval=2521999221 TSecr=3518255377
132,43.904749,192.168.11.23,192.168.11.8,TCP,93,,,0.000681,"Jan  8, 2024 10:29:56.651714000 JST",,"58012  >  6000 [PSH, ACK] Seq=1 Ack=1 Win=64256 Len=27 TSval=2521999222 TSecr=3518255377 [TCP segment of a reassembled PDU]"
133,43.904871,192.168.11.8,192.168.11.23,TCP,66,0.000122,,0.000122,"Jan  8, 2024 10:29:56.651836000 JST",,6000  >  58012 [ACK] Seq=1 Ack=28 Win=65152 Len=0 TSval=3518255385 TSecr=2521999222
134,43.904953,192.168.11.23,192.168.11.8,TCP,66,,,0.000082,"Jan  8, 2024 10:29:56.651918000 JST",,"58012  >  6000 [FIN, ACK] Seq=28 Ack=1 Win=64256 Len=0 TSval=2521999222 TSecr=3518255377"
135,43.907113,192.168.11.8,192.168.11.23,TCP,66,0.00216,,0.00216,"Jan  8, 2024 10:29:56.654078000 JST",,"6000  >  58012 [FIN, ACK] Seq=1 Ack=29 Win=65152 Len=0 TSval=3518255387 TSecr=2521999222"
136,43.914427,192.168.11.23,192.168.11.8,TCP,66,0.007314,,0.007314,"Jan  8, 2024 10:29:56.661392000 JST",,58012  >  6000 [ACK] Seq=29 Ack=2 Win=64256 Len=0 TSval=2521999231 TSecr=3518255387
137,49.941371,192.168.11.8,192.168.11.13,TCP,74,,,6.026944,"Jan  8, 2024 10:30:02.688336000 JST",,50370  >  6000 [SYN] Seq=0 Win=64240 Len=0 MSS=1460 SACK_PERM TSval=1448804817 TSecr=0 WS=128
138,49.948668,192.168.11.13,192.168.11.8,TCP,74,0.007297,,0.007297,"Jan  8, 2024 10:30:02.695633000 JST",,"6000  >  50370 [SYN, ACK] Seq=0 Ack=1 Win=65160 Len=0 MSS=1460 SACK_PERM TSval=639478268 TSecr=1448804817 WS=128"
139,49.948799,192.168.11.8,192.168.11.13,TCP,66,0.000131,,0.000131,"Jan  8, 2024 10:30:02.695764000 JST",,50370  >  6000 [ACK] Seq=1 Ack=1 Win=64256 Len=0 TSval=1448804825 TSecr=639478268
140,49.948967,192.168.11.8,192.168.11.13,TCP,93,,,0.000168,"Jan  8, 2024 10:30:02.695932000 JST",,"50370  >  6000 [PSH, ACK] Seq=1 Ack=1 Win=64256 Len=27 TSval=1448804825 TSecr=639478268 [TCP segment of a reassembled PDU]"
141,49.949093,192.168.11.8,192.168.11.13,TCP,66,,,0.000126,"Jan  8, 2024 10:30:02.696058000 JST",,"50370  >  6000 [FIN, ACK] Seq=28 Ack=1 Win=64256 Len=0 TSval=1448804825 TSecr=639478268"
142,49.957173,192.168.11.13,192.168.11.8,TCP,66,0.008206,,0.00808,"Jan  8, 2024 10:30:02.704138000 JST",,6000  >  50370 [ACK] Seq=1 Ack=28 Win=65152 Len=0 TSval=639478276 TSecr=1448804825
143,49.957407,192.168.11.13,192.168.11.8,TCP,66,0.008314,,0.000234,"Jan  8, 2024 10:30:02.704372000 JST",,"6000  >  50370 [FIN, ACK] Seq=1 Ack=29 Win=65152 Len=0 TSval=639478278 TSecr=1448804825"
144,49.957455,192.168.11.8,192.168.11.13,TCP,66,0.000048,,0.000048,"Jan  8, 2024 10:30:02.704420000 JST",,50370  >  6000 [ACK] Seq=29 Ack=2 Win=64256 Len=0 TSval=1448804833 TSecr=639478278
145,49.98853,192.168.11.8,255.255.255.255,UDP,209,,Ÿ,0.031075,"Jan  8, 2024 10:30:02.735495000 JST",7b2273656d616e74696373223a207b22656e74697479223a2022504944222c202262617365656e74697479223a2022616e79222c2022726f6c65223a2022646464222c20227370617469616c223a2022616e79222c202274656d706f72616c223a2022616e79227d2c20226461746170726f7065727479223a207b22666f726d6174223a2022696e616f6b615f70726f6772616d5f73616d706c655f73656d616e746963227d7d,47593  >  7000 Len=167
146,49.994191,192.168.11.23,192.168.11.8,TCP,74,,œ,0.005661,"Jan  8, 2024 10:30:02.741156000 JST",,36420  >  6000 [SYN] Seq=0 Win=64240 Len=0 MSS=1460 SACK_PERM TSval=2522005312 TSecr=0 WS=128
147,49.994331,192.168.11.8,192.168.11.23,TCP,74,0.00014,,0.00014,"Jan  8, 2024 10:30:02.741296000 JST",,"6000  >  36420 [SYN, ACK] Seq=0 Ack=1 Win=65160 Len=0 MSS=1460 SACK_PERM TSval=3518261474 TSecr=2522005312 WS=128"
148,50.001333,192.168.11.23,192.168.11.8,TCP,66,0.007002,,0.007002,"Jan  8, 2024 10:30:02.748298000 JST",,36420  >  6000 [ACK] Seq=1 Ack=1 Win=64256 Len=0 TSval=2522005319 TSecr=3518261474
149,50.002379,192.168.11.23,192.168.11.8,TCP,93,,,0.001046,"Jan  8, 2024 10:30:02.749344000 JST",,"36420  >  6000 [PSH, ACK] Seq=1 Ack=1 Win=64256 Len=27 TSval=2522005319 TSecr=3518261474 [TCP segment of a reassembled PDU]"
150,50.002493,192.168.11.8,192.168.11.23,TCP,66,0.000114,,0.000114,"Jan  8, 2024 10:30:02.749458000 JST",,6000  >  36420 [ACK] Seq=1 Ack=28 Win=65152 Len=0 TSval=3518261482 TSecr=2522005319
151,50.002561,192.168.11.23,192.168.11.8,TCP,66,,,0.000068,"Jan  8, 2024 10:30:02.749526000 JST",,"36420  >  6000 [FIN, ACK] Seq=28 Ack=1 Win=64256 Len=0 TSval=2522005319 TSecr=3518261474"
152,50.004041,192.168.11.8,192.168.11.23,TCP,66,0.00148,,0.00148,"Jan  8, 2024 10:30:02.751006000 JST",,"6000  >  36420 [FIN, ACK] Seq=1 Ack=29 Win=65152 Len=0 TSval=3518261484 TSecr=2522005319"
153,50.008721,192.168.11.23,192.168.11.8,TCP,66,0.00468,,0.00468,"Jan  8, 2024 10:30:02.755686000 JST",,36420  >  6000 [ACK] Seq=29 Ack=2 Win=64256 Len=0 TSval=2522005327 TSecr=3518261484
154,56.06302,192.168.11.8,192.168.11.13,TCP,74,,,6.054299,"Jan  8, 2024 10:30:08.809985000 JST",,50376  >  6000 [SYN] Seq=0 Win=64240 Len=0 MSS=1460 SACK_PERM TSval=1448810939 TSecr=0 WS=128
155,56.070484,192.168.11.13,192.168.11.8,TCP,74,0.007464,,0.007464,"Jan  8, 2024 10:30:08.817449000 JST",,"6000  >  50376 [SYN, ACK] Seq=0 Ack=1 Win=65160 Len=0 MSS=1460 SACK_PERM TSval=639484390 TSecr=1448810939 WS=128"
156,56.070592,192.168.11.8,192.168.11.13,TCP,66,0.000108,,0.000108,"Jan  8, 2024 10:30:08.817557000 JST",,50376  >  6000 [ACK] Seq=1 Ack=1 Win=64256 Len=0 TSval=1448810947 TSecr=639484390
157,56.070802,192.168.11.8,192.168.11.13,TCP,93,,,0.00021,"Jan  8, 2024 10:30:08.817767000 JST",,"50376  >  6000 [PSH, ACK] Seq=1 Ack=1 Win=64256 Len=27 TSval=1448810947 TSecr=639484390 [TCP segment of a reassembled PDU]"
158,56.070915,192.168.11.8,192.168.11.13,TCP,66,,,0.000113,"Jan  8, 2024 10:30:08.817880000 JST",,"50376  >  6000 [FIN, ACK] Seq=28 Ack=1 Win=64256 Len=0 TSval=1448810947 TSecr=639484390"
159,56.077869,192.168.11.13,192.168.11.8,TCP,66,0.007067,,0.006954,"Jan  8, 2024 10:30:08.824834000 JST",,6000  >  50376 [ACK] Seq=1 Ack=28 Win=65152 Len=0 TSval=639484397 TSecr=1448810947
160,56.078082,192.168.11.13,192.168.11.8,TCP,66,0.007167,,0.000213,"Jan  8, 2024 10:30:08.825047000 JST",,"6000  >  50376 [FIN, ACK] Seq=1 Ack=29 Win=65152 Len=0 TSval=639484400 TSecr=1448810947"
161,56.078128,192.168.11.8,192.168.11.13,TCP,66,0.000046,,0.000046,"Jan  8, 2024 10:30:08.825093000 JST",,50376  >  6000 [ACK] Seq=29 Ack=2 Win=64256 Len=0 TSval=1448810954 TSecr=639484400
162,56.109798,192.168.11.8,255.255.255.255,UDP,209,,Ÿ,0.03167,"Jan  8, 2024 10:30:08.856763000 JST",7b2273656d616e74696373223a207b22656e74697479223a2022504944222c202262617365656e74697479223a2022616e79222c2022726f6c65223a2022646464222c20227370617469616c223a2022616e79222c202274656d706f72616c223a2022616e79227d2c20226461746170726f7065727479223a207b22666f726d6174223a2022696e616f6b615f70726f6772616d5f73616d706c655f73656d616e746963227d7d,42177  >  7000 Len=167
163,56.115731,192.168.11.23,192.168.11.8,TCP,74,,œ,0.005933,"Jan  8, 2024 10:30:08.862696000 JST",,36426  >  6000 [SYN] Seq=0 Win=64240 Len=0 MSS=1460 SACK_PERM TSval=2522011433 TSecr=0 WS=128
164,56.115886,192.168.11.8,192.168.11.23,TCP,74,0.000155,,0.000155,"Jan  8, 2024 10:30:08.862851000 JST",,"6000  >  36426 [SYN, ACK] Seq=0 Ack=1 Win=65160 Len=0 MSS=1460 SACK_PERM TSval=3518267596 TSecr=2522011433 WS=128"
165,56.122607,192.168.11.23,192.168.11.8,TCP,66,0.006721,,0.006721,"Jan  8, 2024 10:30:08.869572000 JST",,36426  >  6000 [ACK] Seq=1 Ack=1 Win=64256 Len=0 TSval=2522011440 TSecr=3518267596
166,56.123254,192.168.11.23,192.168.11.8,TCP,93,,,0.000647,"Jan  8, 2024 10:30:08.870219000 JST",,"36426  >  6000 [PSH, ACK] Seq=1 Ack=1 Win=64256 Len=27 TSval=2522011441 TSecr=3518267596 [TCP segment of a reassembled PDU]"
167,56.123369,192.168.11.8,192.168.11.23,TCP,66,0.000115,,0.000115,"Jan  8, 2024 10:30:08.870334000 JST",,6000  >  36426 [ACK] Seq=1 Ack=28 Win=65152 Len=0 TSval=3518267603 TSecr=2522011441
168,56.123452,192.168.11.23,192.168.11.8,TCP,66,,,0.000083,"Jan  8, 2024 10:30:08.870417000 JST",,"36426  >  6000 [FIN, ACK] Seq=28 Ack=1 Win=64256 Len=0 TSval=2522011441 TSecr=3518267596"
169,56.125605,192.168.11.8,192.168.11.23,TCP,66,0.002153,,0.002153,"Jan  8, 2024 10:30:08.872570000 JST",,"6000  >  36426 [FIN, ACK] Seq=1 Ack=29 Win=65152 Len=0 TSval=3518267606 TSecr=2522011441"
170,56.133092,192.168.11.23,192.168.11.8,TCP,66,0.007487,,0.007487,"Jan  8, 2024 10:30:08.880057000 JST",,36426  >  6000 [ACK] Seq=29 Ack=2 Win=64256 Len=0 TSval=2522011451 TSecr=3518267606
171,87.232935,192.168.11.8,192.168.11.13,TCP,74,,,31.099843,"Jan  8, 2024 10:30:39.979900000 JST",,38248  >  6000 [SYN] Seq=0 Win=64240 Len=0 MSS=1460 SACK_PERM TSval=1448842109 TSecr=0 WS=128
172,87.239483,192.168.11.13,192.168.11.8,TCP,74,0.006548,,0.006548,"Jan  8, 2024 10:30:39.986448000 JST",,"6000  >  38248 [SYN, ACK] Seq=0 Ack=1 Win=65160 Len=0 MSS=1460 SACK_PERM TSval=639515559 TSecr=1448842109 WS=128"
173,87.239622,192.168.11.8,192.168.11.13,TCP,66,0.000139,,0.000139,"Jan  8, 2024 10:30:39.986587000 JST",,38248  >  6000 [ACK] Seq=1 Ack=1 Win=64256 Len=0 TSval=1448842116 TSecr=639515559
174,87.239798,192.168.11.8,192.168.11.13,TCP,93,,,0.000176,"Jan  8, 2024 10:30:39.986763000 JST",,"38248  >  6000 [PSH, ACK] Seq=1 Ack=1 Win=64256 Len=27 TSval=1448842116 TSecr=639515559 [TCP segment of a reassembled PDU]"
175,87.239912,192.168.11.8,192.168.11.13,TCP,66,,,0.000114,"Jan  8, 2024 10:30:39.986877000 JST",,"38248  >  6000 [FIN, ACK] Seq=28 Ack=1 Win=64256 Len=0 TSval=1448842116 TSecr=639515559"
176,87.247113,192.168.11.13,192.168.11.8,TCP,66,0.007315,,0.007201,"Jan  8, 2024 10:30:39.994078000 JST",,6000  >  38248 [ACK] Seq=1 Ack=28 Win=65152 Len=0 TSval=639515567 TSecr=1448842116
177,87.247348,192.168.11.13,192.168.11.8,TCP,66,0.007436,,0.000235,"Jan  8, 2024 10:30:39.994313000 JST",,"6000  >  38248 [FIN, ACK] Seq=1 Ack=29 Win=65152 Len=0 TSval=639515569 TSecr=1448842116"
178,87.247397,192.168.11.8,192.168.11.13,TCP,66,0.000049,,0.000049,"Jan  8, 2024 10:30:39.994362000 JST",,38248  >  6000 [ACK] Seq=29 Ack=2 Win=64256 Len=0 TSval=1448842123 TSecr=639515569
179,87.279006,192.168.11.8,255.255.255.255,UDP,209,,Ÿ,0.031609,"Jan  8, 2024 10:30:40.025971000 JST",7b2273656d616e74696373223a207b22656e74697479223a2022504944222c202262617365656e74697479223a2022616e79222c2022726f6c65223a2022646464222c20227370617469616c223a2022616e79222c202274656d706f72616c223a2022616e79227d2c20226461746170726f7065727479223a207b22666f726d6174223a2022696e616f6b615f70726f6772616d5f73616d706c655f73656d616e746963227d7d,47213  >  7000 Len=167
180,87.285752,192.168.11.23,192.168.11.8,TCP,74,,œ,0.006746,"Jan  8, 2024 10:30:40.032717000 JST",,35288  >  6000 [SYN] Seq=0 Win=64240 Len=0 MSS=1460 SACK_PERM TSval=2522042603 TSecr=0 WS=128
181,87.285899,192.168.11.8,192.168.11.23,TCP,74,0.000147,,0.000147,"Jan  8, 2024 10:30:40.032864000 JST",,"6000  >  35288 [SYN, ACK] Seq=0 Ack=1 Win=65160 Len=0 MSS=1460 SACK_PERM TSval=3518298766 TSecr=2522042603 WS=128"
182,87.292587,192.168.11.23,192.168.11.8,TCP,66,0.006688,,0.006688,"Jan  8, 2024 10:30:40.039552000 JST",,35288  >  6000 [ACK] Seq=1 Ack=1 Win=64256 Len=0 TSval=2522042610 TSecr=3518298766
183,87.293031,192.168.11.23,192.168.11.8,TCP,93,,,0.000444,"Jan  8, 2024 10:30:40.039996000 JST",,"35288  >  6000 [PSH, ACK] Seq=1 Ack=1 Win=64256 Len=27 TSval=2522042611 TSecr=3518298766 [TCP segment of a reassembled PDU]"
184,87.293127,192.168.11.8,192.168.11.23,TCP,66,0.000096,,0.000096,"Jan  8, 2024 10:30:40.040092000 JST",,6000  >  35288 [ACK] Seq=1 Ack=28 Win=65152 Len=0 TSval=3518298773 TSecr=2522042611
185,87.29348,192.168.11.23,192.168.11.8,TCP,66,,,0.000353,"Jan  8, 2024 10:30:40.040445000 JST",,"35288  >  6000 [FIN, ACK] Seq=28 Ack=1 Win=64256 Len=0 TSval=2522042611 TSecr=3518298766"
186,87.296195,192.168.11.8,192.168.11.23,TCP,66,0.002715,,0.002715,"Jan  8, 2024 10:30:40.043160000 JST",,"6000  >  35288 [FIN, ACK] Seq=1 Ack=29 Win=65152 Len=0 TSval=3518298776 TSecr=2522042611"
