No.,Time,Source,Destination,Protocol,Length,The RTT to ACK the segment was,XXX,Time delta from previous captured frame,Arrival Time,Data,Info
1,0,192.168.11.23,192.168.11.8,TCP,74,,,0,"Jan  8, 2024 10:29:12.820475000 JST",,38424  >  6000 [SYN] Seq=0 Win=64240 Len=0 MSS=1460 SACK_PERM TSval=2521955372 TSecr=0 WS=128
2,0.008855,192.168.11.8,192.168.11.23,TCP,74,0.008855,,0.008855,"Jan  8, 2024 10:29:12.829330000 JST",,"6000  >  38424 [SYN, ACK] Seq=0 Ack=1 Win=65160 Len=0 MSS=1460 SACK_PERM TSval=3518211535 TSecr=2521955372 WS=128"
3,0.008976,192.168.11.23,192.168.11.8,TCP,66,0.000121,,0.000121,"Jan  8, 2024 10:29:12.829451000 JST",,38424  >  6000 [ACK] Seq=1 Ack=1 Win=64256 Len=0 TSval=2521955381 TSecr=3518211535
4,0.009287,192.168.11.23,192.168.11.8,TCP,93,,,0.000311,"Jan  8, 2024 10:29:12.829762000 JST",,"38424  >  6000 [PSH, ACK] Seq=1 Ack=1 Win=64256 Len=27 TSval=2521955381 TSecr=3518211535 [TCP segment of a reassembled PDU]"
5,0.009421,192.168.11.23,192.168.11.8,TCP,66,,,0.000134,"Jan  8, 2024 10:29:12.829896000 JST",,"38424  >  6000 [FIN, ACK] Seq=28 Ack=1 Win=64256 Len=0 TSval=2521955381 TSecr=3518211535"
6,0.016513,192.168.11.8,192.168.11.23,TCP,66,0.007226,,0.007092,"Jan  8, 2024 10:29:12.836988000 JST",,6000  >  38424 [ACK] Seq=1 Ack=28 Win=65152 Len=0 TSval=3518211544 TSecr=2521955381
7,0.016746,192.168.11.8,192.168.11.23,TCP,66,0.007325,,0.000233,"Jan  8, 2024 10:29:12.837221000 JST",,"6000  >  38424 [FIN, ACK] Seq=1 Ack=29 Win=65152 Len=0 TSval=3518211546 TSecr=2521955381"
8,0.016795,192.168.11.23,192.168.11.8,TCP,66,0.000049,,0.000049,"Jan  8, 2024 10:29:12.837270000 JST",,38424  >  6000 [ACK] Seq=29 Ack=2 Win=64256 Len=0 TSval=2521955388 TSecr=3518211546
9,0.048468,192.168.11.23,255.255.255.255,UDP,209,,Ÿ,0.031673,"Jan  8, 2024 10:29:12.868943000 JST",7b2273656d616e74696373223a207b22656e74697479223a2022504944222c202262617365656e74697479223a2022616e79222c2022726f6c65223a2022656565222c20227370617469616c223a2022616e79222c202274656d706f72616c223a2022616e79227d2c20226461746170726f7065727479223a207b22666f726d6174223a2022696e616f6b615f70726f6772616d5f73616d706c655f73656d616e746963227d7d,33388  >  7000 Len=167
10,0.054553,192.168.11.9,192.168.11.23,TCP,74,,œ,0.006085,"Jan  8, 2024 10:29:12.875028000 JST",,39884  >  6000 [SYN] Seq=0 Win=64240 Len=0 MSS=1460 SACK_PERM TSval=2545608430 TSecr=0 WS=128
11,0.054692,192.168.11.23,192.168.11.9,TCP,74,0.000139,,0.000139,"Jan  8, 2024 10:29:12.875167000 JST",,"6000  >  39884 [SYN, ACK] Seq=0 Ack=1 Win=65160 Len=0 MSS=1460 SACK_PERM TSval=4283003039 TSecr=2545608430 WS=128"
12,0.062431,192.168.11.9,192.168.11.23,TCP,66,0.007739,,0.007739,"Jan  8, 2024 10:29:12.882906000 JST",,39884  >  6000 [ACK] Seq=1 Ack=1 Win=64256 Len=0 TSval=2545608438 TSecr=4283003039
13,0.062979,192.168.11.9,192.168.11.23,TCP,93,,,0.000548,"Jan  8, 2024 10:29:12.883454000 JST",,"39884  >  6000 [PSH, ACK] Seq=1 Ack=1 Win=64256 Len=27 TSval=2545608438 TSecr=4283003039 [TCP segment of a reassembled PDU]"
14,0.063059,192.168.11.23,192.168.11.9,TCP,66,0.00008,,0.00008,"Jan  8, 2024 10:29:12.883534000 JST",,6000  >  39884 [ACK] Seq=1 Ack=28 Win=65152 Len=0 TSval=4283003048 TSecr=2545608438
15,0.063132,192.168.11.9,192.168.11.23,TCP,66,,,0.000073,"Jan  8, 2024 10:29:12.883607000 JST",,"39884  >  6000 [FIN, ACK] Seq=28 Ack=1 Win=64256 Len=0 TSval=2545608438 TSecr=4283003039"
16,0.064681,192.168.11.23,192.168.11.9,TCP,66,0.001549,,0.001549,"Jan  8, 2024 10:29:12.885156000 JST",,"6000  >  39884 [FIN, ACK] Seq=1 Ack=29 Win=65152 Len=0 TSval=4283003049 TSecr=2545608438"
17,0.069882,192.168.11.9,192.168.11.23,TCP,66,0.005201,,0.005201,"Jan  8, 2024 10:29:12.890357000 JST",,39884  >  6000 [ACK] Seq=29 Ack=2 Win=64256 Len=0 TSval=2545608445 TSecr=4283003049
18,6.173457,192.168.11.23,192.168.11.8,TCP,74,,,6.103575,"Jan  8, 2024 10:29:18.993932000 JST",,38430  >  6000 [SYN] Seq=0 Win=64240 Len=0 MSS=1460 SACK_PERM TSval=2521961545 TSecr=0 WS=128
19,6.1884,192.168.11.8,192.168.11.23,TCP,74,0.014943,,0.014943,"Jan  8, 2024 10:29:19.008875000 JST",,"6000  >  38430 [SYN, ACK] Seq=0 Ack=1 Win=65160 Len=0 MSS=1460 SACK_PERM TSval=3518217708 TSecr=2521961545 WS=128"
20,6.188513,192.168.11.23,192.168.11.8,TCP,66,0.000113,,0.000113,"Jan  8, 2024 10:29:19.008988000 JST",,38430  >  6000 [ACK] Seq=1 Ack=1 Win=64256 Len=0 TSval=2521961560 TSecr=3518217708
21,6.188684,192.168.11.23,192.168.11.8,TCP,93,,,0.000171,"Jan  8, 2024 10:29:19.009159000 JST",,"38430  >  6000 [PSH, ACK] Seq=1 Ack=1 Win=64256 Len=27 TSval=2521961560 TSecr=3518217708 [TCP segment of a reassembled PDU]"
22,6.188808,192.168.11.23,192.168.11.8,TCP,66,,,0.000124,"Jan  8, 2024 10:29:19.009283000 JST",,"38430  >  6000 [FIN, ACK] Seq=28 Ack=1 Win=64256 Len=0 TSval=2521961561 TSecr=3518217708"
23,6.196006,192.168.11.8,192.168.11.23,TCP,66,0.007322,,0.007198,"Jan  8, 2024 10:29:19.016481000 JST",,6000  >  38430 [ACK] Seq=1 Ack=28 Win=65152 Len=0 TSval=3518217723 TSecr=2521961560
24,6.197999,192.168.11.8,192.168.11.23,TCP,66,0.009191,,0.001993,"Jan  8, 2024 10:29:19.018474000 JST",,"6000  >  38430 [FIN, ACK] Seq=1 Ack=29 Win=65152 Len=0 TSval=3518217725 TSecr=2521961561"
25,6.198043,192.168.11.23,192.168.11.8,TCP,66,0.000044,,0.000044,"Jan  8, 2024 10:29:19.018518000 JST",,38430  >  6000 [ACK] Seq=29 Ack=2 Win=64256 Len=0 TSval=2521961570 TSecr=3518217725
26,6.226673,192.168.11.23,255.255.255.255,UDP,209,,Ÿ,0.02863,"Jan  8, 2024 10:29:19.047148000 JST",7b2273656d616e74696373223a207b22656e74697479223a2022504944222c202262617365656e74697479223a2022616e79222c2022726f6c65223a2022656565222c20227370617469616c223a2022616e79222c202274656d706f72616c223a2022616e79227d2c20226461746170726f7065727479223a207b22666f726d6174223a2022696e616f6b615f70726f6772616d5f73616d706c655f73656d616e746963227d7d,49715  >  7000 Len=167
27,6.232331,192.168.11.9,192.168.11.23,TCP,74,,œ,0.005658,"Jan  8, 2024 10:29:19.052806000 JST",,56754  >  6000 [SYN] Seq=0 Win=64240 Len=0 MSS=1460 SACK_PERM TSval=2545614608 TSecr=0 WS=128
28,6.232465,192.168.11.23,192.168.11.9,TCP,74,0.000134,,0.000134,"Jan  8, 2024 10:29:19.052940000 JST",,"6000  >  56754 [SYN, ACK] Seq=0 Ack=1 Win=65160 Len=0 MSS=1460 SACK_PERM TSval=4283009217 TSecr=2545614608 WS=128"
29,6.239532,192.168.11.9,192.168.11.23,TCP,66,0.007067,,0.007067,"Jan  8, 2024 10:29:19.060007000 JST",,56754  >  6000 [ACK] Seq=1 Ack=1 Win=64256 Len=0 TSval=2545614615 TSecr=4283009217
30,6.240126,192.168.11.9,192.168.11.23,TCP,93,,,0.000594,"Jan  8, 2024 10:29:19.060601000 JST",,"56754  >  6000 [PSH, ACK] Seq=1 Ack=1 Win=64256 Len=27 TSval=2545614615 TSecr=4283009217 [TCP segment of a reassembled PDU]"
31,6.240208,192.168.11.23,192.168.11.9,TCP,66,0.000082,,0.000082,"Jan  8, 2024 10:29:19.060683000 JST",,6000  >  56754 [ACK] Seq=1 Ack=28 Win=65152 Len=0 TSval=4283009225 TSecr=2545614615
32,6.240273,192.168.11.9,192.168.11.23,TCP,66,,,0.000065,"Jan  8, 2024 10:29:19.060748000 JST",,"56754  >  6000 [FIN, ACK] Seq=28 Ack=1 Win=64256 Len=0 TSval=2545614615 TSecr=4283009217"
33,6.241867,192.168.11.23,192.168.11.9,TCP,66,0.001594,,0.001594,"Jan  8, 2024 10:29:19.062342000 JST",,"6000  >  56754 [FIN, ACK] Seq=1 Ack=29 Win=65152 Len=0 TSval=4283009227 TSecr=2545614615"
34,6.246526,192.168.11.9,192.168.11.23,TCP,66,0.004659,,0.004659,"Jan  8, 2024 10:29:19.067001000 JST",,56754  >  6000 [ACK] Seq=29 Ack=2 Win=64256 Len=0 TSval=2545614622 TSecr=4283009227
35,12.271679,192.168.11.23,192.168.11.8,TCP,74,,,6.025153,"Jan  8, 2024 10:29:25.092154000 JST",,60768  >  6000 [SYN] Seq=0 Win=64240 Len=0 MSS=1460 SACK_PERM TSval=2521967643 TSecr=0 WS=128
36,12.27867,192.168.11.8,192.168.11.23,TCP,74,0.006991,,0.006991,"Jan  8, 2024 10:29:25.099145000 JST",,"6000  >  60768 [SYN, ACK] Seq=0 Ack=1 Win=65160 Len=0 MSS=1460 SACK_PERM TSval=3518223806 TSecr=2521967643 WS=128"
37,12.278781,192.168.11.23,192.168.11.8,TCP,66,0.000111,,0.000111,"Jan  8, 2024 10:29:25.099256000 JST",,60768  >  6000 [ACK] Seq=1 Ack=1 Win=64256 Len=0 TSval=2521967650 TSecr=3518223806
38,12.278961,192.168.11.23,192.168.11.8,TCP,93,,,0.00018,"Jan  8, 2024 10:29:25.099436000 JST",,"60768  >  6000 [PSH, ACK] Seq=1 Ack=1 Win=64256 Len=27 TSval=2521967651 TSecr=3518223806 [TCP segment of a reassembled PDU]"
39,12.279058,192.168.11.23,192.168.11.8,TCP,66,,,0.000097,"Jan  8, 2024 10:29:25.099533000 JST",,"60768  >  6000 [FIN, ACK] Seq=28 Ack=1 Win=64256 Len=0 TSval=2521967651 TSecr=3518223806"
40,12.287415,192.168.11.8,192.168.11.23,TCP,66,0.008454,,0.008357,"Jan  8, 2024 10:29:25.107890000 JST",,6000  >  60768 [ACK] Seq=1 Ack=28 Win=65152 Len=0 TSval=3518223814 TSecr=2521967651
41,12.287808,192.168.11.8,192.168.11.23,TCP,66,0.00875,,0.000393,"Jan  8, 2024 10:29:25.108283000 JST",,"6000  >  60768 [FIN, ACK] Seq=1 Ack=29 Win=65152 Len=0 TSval=3518223815 TSecr=2521967651"
42,12.287855,192.168.11.23,192.168.11.8,TCP,66,0.000047,,0.000047,"Jan  8, 2024 10:29:25.108330000 JST",,60768  >  6000 [ACK] Seq=29 Ack=2 Win=64256 Len=0 TSval=2521967660 TSecr=3518223815
43,12.318117,192.168.11.23,255.255.255.255,UDP,209,,Ÿ,0.030262,"Jan  8, 2024 10:29:25.138592000 JST",7b2273656d616e74696373223a207b22656e74697479223a2022504944222c202262617365656e74697479223a2022616e79222c2022726f6c65223a2022656565222c20227370617469616c223a2022616e79222c202274656d706f72616c223a2022616e79227d2c20226461746170726f7065727479223a207b22666f726d6174223a2022696e616f6b615f70726f6772616d5f73616d706c655f73656d616e746963227d7d,54974  >  7000 Len=167
44,12.324159,192.168.11.9,192.168.11.23,TCP,74,,œ,0.006042,"Jan  8, 2024 10:29:25.144634000 JST",,56770  >  6000 [SYN] Seq=0 Win=64240 Len=0 MSS=1460 SACK_PERM TSval=2545620699 TSecr=0 WS=128
45,12.324314,192.168.11.23,192.168.11.9,TCP,74,0.000155,,0.000155,"Jan  8, 2024 10:29:25.144789000 JST",,"6000  >  56770 [SYN, ACK] Seq=0 Ack=1 Win=65160 Len=0 MSS=1460 SACK_PERM TSval=4283015309 TSecr=2545620699 WS=128"
46,12.331676,192.168.11.9,192.168.11.23,TCP,66,0.007362,,0.007362,"Jan  8, 2024 10:29:25.152151000 JST",,56770  >  6000 [ACK] Seq=1 Ack=1 Win=64256 Len=0 TSval=2545620707 TSecr=4283015309
47,12.332358,192.168.11.9,192.168.11.23,TCP,93,,,0.000682,"Jan  8, 2024 10:29:25.152833000 JST",,"56770  >  6000 [PSH, ACK] Seq=1 Ack=1 Win=64256 Len=27 TSval=2545620707 TSecr=4283015309 [TCP segment of a reassembled PDU]"
48,12.332451,192.168.11.23,192.168.11.9,TCP,66,0.000093,,0.000093,"Jan  8, 2024 10:29:25.152926000 JST",,6000  >  56770 [ACK] Seq=1 Ack=28 Win=65152 Len=0 TSval=4283015317 TSecr=2545620707
49,12.332566,192.168.11.9,192.168.11.23,TCP,66,,,0.000115,"Jan  8, 2024 10:29:25.153041000 JST",,"56770  >  6000 [FIN, ACK] Seq=28 Ack=1 Win=64256 Len=0 TSval=2545620707 TSecr=4283015309"
50,12.335095,192.168.11.23,192.168.11.9,TCP,66,0.002529,,0.002529,"Jan  8, 2024 10:29:25.155570000 JST",,"6000  >  56770 [FIN, ACK] Seq=1 Ack=29 Win=65152 Len=0 TSval=4283015320 TSecr=2545620707"
51,12.344832,192.168.11.9,192.168.11.23,TCP,66,0.009737,,0.009737,"Jan  8, 2024 10:29:25.165307000 JST",,56770  >  6000 [ACK] Seq=29 Ack=2 Win=64256 Len=0 TSval=2545620720 TSecr=4283015320
52,18.387036,192.168.11.23,192.168.11.8,TCP,74,,,6.042204,"Jan  8, 2024 10:29:31.207511000 JST",,54194  >  6000 [SYN] Seq=0 Win=64240 Len=0 MSS=1460 SACK_PERM TSval=2521973759 TSecr=0 WS=128
53,18.395235,192.168.11.8,192.168.11.23,TCP,74,0.008199,,0.008199,"Jan  8, 2024 10:29:31.215710000 JST",,"6000  >  54194 [SYN, ACK] Seq=0 Ack=1 Win=65160 Len=0 MSS=1460 SACK_PERM TSval=3518229922 TSecr=2521973759 WS=128"
54,18.395349,192.168.11.23,192.168.11.8,TCP,66,0.000114,,0.000114,"Jan  8, 2024 10:29:31.215824000 JST",,54194  >  6000 [ACK] Seq=1 Ack=1 Win=64256 Len=0 TSval=2521973767 TSecr=3518229922
55,18.395555,192.168.11.23,192.168.11.8,TCP,93,,,0.000206,"Jan  8, 2024 10:29:31.216030000 JST",,"54194  >  6000 [PSH, ACK] Seq=1 Ack=1 Win=64256 Len=27 TSval=2521973767 TSecr=3518229922 [TCP segment of a reassembled PDU]"
56,18.395668,192.168.11.23,192.168.11.8,TCP,66,,,0.000113,"Jan  8, 2024 10:29:31.216143000 JST",,"54194  >  6000 [FIN, ACK] Seq=28 Ack=1 Win=64256 Len=0 TSval=2521973767 TSecr=3518229922"
57,18.403047,192.168.11.8,192.168.11.23,TCP,66,0.007492,,0.007379,"Jan  8, 2024 10:29:31.223522000 JST",,6000  >  54194 [ACK] Seq=1 Ack=28 Win=65152 Len=0 TSval=3518229930 TSecr=2521973767
58,18.403297,192.168.11.8,192.168.11.23,TCP,66,0.007629,,0.00025,"Jan  8, 2024 10:29:31.223772000 JST",,"6000  >  54194 [FIN, ACK] Seq=1 Ack=29 Win=65152 Len=0 TSval=3518229932 TSecr=2521973767"
59,18.40335,192.168.11.23,192.168.11.8,TCP,66,0.000053,,0.000053,"Jan  8, 2024 10:29:31.223825000 JST",,54194  >  6000 [ACK] Seq=29 Ack=2 Win=64256 Len=0 TSval=2521973775 TSecr=3518229932
60,18.434278,192.168.11.23,255.255.255.255,UDP,209,,Ÿ,0.030928,"Jan  8, 2024 10:29:31.254753000 JST",7b2273656d616e74696373223a207b22656e74697479223a2022504944222c202262617365656e74697479223a2022616e79222c2022726f6c65223a2022656565222c20227370617469616c223a2022616e79222c202274656d706f72616c223a2022616e79227d2c20226461746170726f7065727479223a207b22666f726d6174223a2022696e616f6b615f70726f6772616d5f73616d706c655f73656d616e746963227d7d,42676  >  7000 Len=167
61,18.439932,192.168.11.9,192.168.11.23,TCP,74,,œ,0.005654,"Jan  8, 2024 10:29:31.260407000 JST",,52240  >  6000 [SYN] Seq=0 Win=64240 Len=0 MSS=1460 SACK_PERM TSval=2545626815 TSecr=0 WS=128
62,18.440059,192.168.11.23,192.168.11.9,TCP,74,0.000127,,0.000127,"Jan  8, 2024 10:29:31.260534000 JST",,"6000  >  52240 [SYN, ACK] Seq=0 Ack=1 Win=65160 Len=0 MSS=1460 SACK_PERM TSval=4283021425 TSecr=2545626815 WS=128"
63,18.44668,192.168.11.9,192.168.11.23,TCP,66,0.006621,,0.006621,"Jan  8, 2024 10:29:31.267155000 JST",,52240  >  6000 [ACK] Seq=1 Ack=1 Win=64256 Len=0 TSval=2545626822 TSecr=4283021425
64,18.447266,192.168.11.9,192.168.11.23,TCP,93,,,0.000586,"Jan  8, 2024 10:29:31.267741000 JST",,"52240  >  6000 [PSH, ACK] Seq=1 Ack=1 Win=64256 Len=27 TSval=2545626822 TSecr=4283021425 [TCP segment of a reassembled PDU]"
65,18.447349,192.168.11.23,192.168.11.9,TCP,66,0.000083,,0.000083,"Jan  8, 2024 10:29:31.267824000 JST",,6000  >  52240 [ACK] Seq=1 Ack=28 Win=65152 Len=0 TSval=4283021432 TSecr=2545626822
66,18.447422,192.168.11.9,192.168.11.23,TCP,66,,,0.000073,"Jan  8, 2024 10:29:31.267897000 JST",,"52240  >  6000 [FIN, ACK] Seq=28 Ack=1 Win=64256 Len=0 TSval=2545626822 TSecr=4283021425"
67,18.449185,192.168.11.23,192.168.11.9,TCP,66,0.001763,,0.001763,"Jan  8, 2024 10:29:31.269660000 JST",,"6000  >  52240 [FIN, ACK] Seq=1 Ack=29 Win=65152 Len=0 TSval=4283021434 TSecr=2545626822"
68,18.453645,192.168.11.9,192.168.11.23,TCP,66,0.00446,,0.00446,"Jan  8, 2024 10:29:31.274120000 JST",,52240  >  6000 [ACK] Seq=29 Ack=2 Win=64256 Len=0 TSval=2545626829 TSecr=4283021434
69,25.509003,192.168.11.23,192.168.11.8,TCP,74,,,7.055358,"Jan  8, 2024 10:29:38.329478000 JST",,54196  >  6000 [SYN] Seq=0 Win=64240 Len=0 MSS=1460 SACK_PERM TSval=2521980881 TSecr=0 WS=128
70,25.516529,192.168.11.8,192.168.11.23,TCP,74,0.007526,,0.007526,"Jan  8, 2024 10:29:38.337004000 JST",,"6000  >  54196 [SYN, ACK] Seq=0 Ack=1 Win=65160 Len=0 MSS=1460 SACK_PERM TSval=3518237044 TSecr=2521980881 WS=128"
71,25.516641,192.168.11.23,192.168.11.8,TCP,66,0.000112,,0.000112,"Jan  8, 2024 10:29:38.337116000 JST",,54196  >  6000 [ACK] Seq=1 Ack=1 Win=64256 Len=0 TSval=2521980888 TSecr=3518237044
72,25.51681,192.168.11.23,192.168.11.8,TCP,93,,,0.000169,"Jan  8, 2024 10:29:38.337285000 JST",,"54196  >  6000 [PSH, ACK] Seq=1 Ack=1 Win=64256 Len=27 TSval=2521980888 TSecr=3518237044 [TCP segment of a reassembled PDU]"
73,25.516912,192.168.11.23,192.168.11.8,TCP,66,,,0.000102,"Jan  8, 2024 10:29:38.337387000 JST",,"54196  >  6000 [FIN, ACK] Seq=28 Ack=1 Win=64256 Len=0 TSval=2521980889 TSecr=3518237044"
74,25.524127,192.168.11.8,192.168.11.23,TCP,66,0.007317,,0.007215,"Jan  8, 2024 10:29:38.344602000 JST",,6000  >  54196 [ACK] Seq=1 Ack=28 Win=65152 Len=0 TSval=3518237051 TSecr=2521980888
75,25.524515,192.168.11.8,192.168.11.23,TCP,66,0.007603,,0.000388,"Jan  8, 2024 10:29:38.344990000 JST",,"6000  >  54196 [FIN, ACK] Seq=1 Ack=29 Win=65152 Len=0 TSval=3518237053 TSecr=2521980889"
76,25.524566,192.168.11.23,192.168.11.8,TCP,66,0.000051,,0.000051,"Jan  8, 2024 10:29:38.345041000 JST",,54196  >  6000 [ACK] Seq=29 Ack=2 Win=64256 Len=0 TSval=2521980896 TSecr=3518237053
77,25.553882,192.168.11.23,255.255.255.255,UDP,209,,Ÿ,0.029316,"Jan  8, 2024 10:29:38.374357000 JST",7b2273656d616e74696373223a207b22656e74697479223a2022504944222c202262617365656e74697479223a2022616e79222c2022726f6c65223a2022656565222c20227370617469616c223a2022616e79222c202274656d706f72616c223a2022616e79227d2c20226461746170726f7065727479223a207b22666f726d6174223a2022696e616f6b615f70726f6772616d5f73616d706c655f73656d616e746963227d7d,57439  >  7000 Len=167
78,25.56463,192.168.11.9,192.168.11.23,TCP,74,,œ,0.010748,"Jan  8, 2024 10:29:38.385105000 JST",,34712  >  6000 [SYN] Seq=0 Win=64240 Len=0 MSS=1460 SACK_PERM TSval=2545633935 TSecr=0 WS=128
79,25.564782,192.168.11.23,192.168.11.9,TCP,74,0.000152,,0.000152,"Jan  8, 2024 10:29:38.385257000 JST",,"6000  >  34712 [SYN, ACK] Seq=0 Ack=1 Win=65160 Len=0 MSS=1460 SACK_PERM TSval=4283028549 TSecr=2545633935 WS=128"
80,25.571921,192.168.11.9,192.168.11.23,TCP,66,0.007139,,0.007139,"Jan  8, 2024 10:29:38.392396000 JST",,34712  >  6000 [ACK] Seq=1 Ack=1 Win=64256 Len=0 TSval=2545633947 TSecr=4283028549
81,25.572609,192.168.11.9,192.168.11.23,TCP,93,,,0.000688,"Jan  8, 2024 10:29:38.393084000 JST",,"34712  >  6000 [PSH, ACK] Seq=1 Ack=1 Win=64256 Len=27 TSval=2545633947 TSecr=4283028549 [TCP segment of a reassembled PDU]"
82,25.572755,192.168.11.23,192.168.11.9,TCP,66,0.000146,,0.000146,"Jan  8, 2024 10:29:38.393230000 JST",,6000  >  34712 [ACK] Seq=1 Ack=28 Win=65152 Len=0 TSval=4283028557 TSecr=2545633947
83,25.572846,192.168.11.9,192.168.11.23,TCP,66,,,0.000091,"Jan  8, 2024 10:29:38.393321000 JST",,"34712  >  6000 [FIN, ACK] Seq=28 Ack=1 Win=64256 Len=0 TSval=2545633947 TSecr=4283028549"
84,25.574365,192.168.11.23,192.168.11.9,TCP,66,0.001519,,0.001519,"Jan  8, 2024 10:29:38.394840000 JST",,"6000  >  34712 [FIN, ACK] Seq=1 Ack=29 Win=65152 Len=0 TSval=4283028559 TSecr=2545633947"
85,25.579902,192.168.11.9,192.168.11.23,TCP,66,0.005537,,0.005537,"Jan  8, 2024 10:29:38.400377000 JST",,34712  >  6000 [ACK] Seq=29 Ack=2 Win=64256 Len=0 TSval=2545633955 TSecr=4283028559
86,31.594845,192.168.11.23,192.168.11.8,TCP,74,,,6.014943,"Jan  8, 2024 10:29:44.415320000 JST",,36846  >  6000 [SYN] Seq=0 Win=64240 Len=0 MSS=1460 SACK_PERM TSval=2521986966 TSecr=0 WS=128
87,31.602334,192.168.11.8,192.168.11.23,TCP,74,0.007489,,0.007489,"Jan  8, 2024 10:29:44.422809000 JST",,"6000  >  36846 [SYN, ACK] Seq=0 Ack=1 Win=65160 Len=0 MSS=1460 SACK_PERM TSval=3518243130 TSecr=2521986966 WS=128"
88,31.602451,192.168.11.23,192.168.11.8,TCP,66,0.000117,,0.000117,"Jan  8, 2024 10:29:44.422926000 JST",,36846  >  6000 [ACK] Seq=1 Ack=1 Win=64256 Len=0 TSval=2521986974 TSecr=3518243130
89,31.602676,192.168.11.23,192.168.11.8,TCP,93,,,0.000225,"Jan  8, 2024 10:29:44.423151000 JST",,"36846  >  6000 [PSH, ACK] Seq=1 Ack=1 Win=64256 Len=27 TSval=2521986974 TSecr=3518243130 [TCP segment of a reassembled PDU]"
90,31.602786,192.168.11.23,192.168.11.8,TCP,66,,,0.00011,"Jan  8, 2024 10:29:44.423261000 JST",,"36846  >  6000 [FIN, ACK] Seq=28 Ack=1 Win=64256 Len=0 TSval=2521986974 TSecr=3518243130"
91,31.61032,192.168.11.8,192.168.11.23,TCP,66,0.007644,,0.007534,"Jan  8, 2024 10:29:44.430795000 JST",,6000  >  36846 [ACK] Seq=1 Ack=28 Win=65152 Len=0 TSval=3518243138 TSecr=2521986974
92,31.610536,192.168.11.8,192.168.11.23,TCP,66,0.00775,,0.000216,"Jan  8, 2024 10:29:44.431011000 JST",,"6000  >  36846 [FIN, ACK] Seq=1 Ack=29 Win=65152 Len=0 TSval=3518243139 TSecr=2521986974"
93,31.61058,192.168.11.23,192.168.11.8,TCP,66,0.000044,,0.000044,"Jan  8, 2024 10:29:44.431055000 JST",,36846  >  6000 [ACK] Seq=29 Ack=2 Win=64256 Len=0 TSval=2521986982 TSecr=3518243139
94,31.641781,192.168.11.23,255.255.255.255,UDP,209,,Ÿ,0.031201,"Jan  8, 2024 10:29:44.462256000 JST",7b2273656d616e74696373223a207b22656e74697479223a2022504944222c202262617365656e74697479223a2022616e79222c2022726f6c65223a2022656565222c20227370617469616c223a2022616e79222c202274656d706f72616c223a2022616e79227d2c20226461746170726f7065727479223a207b22666f726d6174223a2022696e616f6b615f70726f6772616d5f73616d706c655f73656d616e746963227d7d,36699  >  7000 Len=167
95,31.64799,192.168.11.9,192.168.11.23,TCP,74,,œ,0.006209,"Jan  8, 2024 10:29:44.468465000 JST",,34722  >  6000 [SYN] Seq=0 Win=64240 Len=0 MSS=1460 SACK_PERM TSval=2545640023 TSecr=0 WS=128
96,31.648124,192.168.11.23,192.168.11.9,TCP,74,0.000134,,0.000134,"Jan  8, 2024 10:29:44.468599000 JST",,"6000  >  34722 [SYN, ACK] Seq=0 Ack=1 Win=65160 Len=0 MSS=1460 SACK_PERM TSval=4283034633 TSecr=2545640023 WS=128"
97,31.655534,192.168.11.9,192.168.11.23,TCP,66,0.00741,,0.00741,"Jan  8, 2024 10:29:44.476009000 JST",,34722  >  6000 [ACK] Seq=1 Ack=1 Win=64256 Len=0 TSval=2545640030 TSecr=4283034633
98,31.655974,192.168.11.9,192.168.11.23,TCP,93,,,0.00044,"Jan  8, 2024 10:29:44.476449000 JST",,"34722  >  6000 [PSH, ACK] Seq=1 Ack=1 Win=64256 Len=27 TSval=2545640031 TSecr=4283034633 [TCP segment of a reassembled PDU]"
99,31.656066,192.168.11.23,192.168.11.9,TCP,66,0.000092,,0.000092,"Jan  8, 2024 10:29:44.476541000 JST",,6000  >  34722 [ACK] Seq=1 Ack=28 Win=65152 Len=0 TSval=4283034641 TSecr=2545640031
100,31.657556,192.168.11.23,192.168.11.9,TCP,66,,,0.00149,"Jan  8, 2024 10:29:44.478031000 JST",,"6000  >  34722 [FIN, ACK] Seq=1 Ack=28 Win=65152 Len=0 TSval=4283034642 TSecr=2545640031"
101,31.658036,192.168.11.9,192.168.11.23,TCP,66,,,0.00048,"Jan  8, 2024 10:29:44.478511000 JST",,"34722  >  6000 [FIN, ACK] Seq=28 Ack=1 Win=64256 Len=0 TSval=2545640031 TSecr=4283034633"
102,31.658172,192.168.11.23,192.168.11.9,TCP,66,0.000136,,0.000136,"Jan  8, 2024 10:29:44.478647000 JST",,6000  >  34722 [ACK] Seq=2 Ack=29 Win=65152 Len=0 TSval=4283034643 TSecr=2545640031
103,31.665859,192.168.11.9,192.168.11.23,TCP,66,0.008303,,0.007687,"Jan  8, 2024 10:29:44.486334000 JST",,34722  >  6000 [ACK] Seq=29 Ack=2 Win=64256 Len=0 TSval=2545640040 TSecr=4283034642
104,37.714128,192.168.11.23,192.168.11.8,TCP,74,,,6.048269,"Jan  8, 2024 10:29:50.534603000 JST",,36852  >  6000 [SYN] Seq=0 Win=64240 Len=0 MSS=1460 SACK_PERM TSval=2521993086 TSecr=0 WS=128
105,37.721754,192.168.11.8,192.168.11.23,TCP,74,0.007626,,0.007626,"Jan  8, 2024 10:29:50.542229000 JST",,"6000  >  36852 [SYN, ACK] Seq=0 Ack=1 Win=65160 Len=0 MSS=1460 SACK_PERM TSval=3518249249 TSecr=2521993086 WS=128"
106,37.721866,192.168.11.23,192.168.11.8,TCP,66,0.000112,,0.000112,"Jan  8, 2024 10:29:50.542341000 JST",,36852  >  6000 [ACK] Seq=1 Ack=1 Win=64256 Len=0 TSval=2521993094 TSecr=3518249249
107,37.72204,192.168.11.23,192.168.11.8,TCP,93,,,0.000174,"Jan  8, 2024 10:29:50.542515000 JST",,"36852  >  6000 [PSH, ACK] Seq=1 Ack=1 Win=64256 Len=27 TSval=2521993094 TSecr=3518249249 [TCP segment of a reassembled PDU]"
108,37.722146,192.168.11.23,192.168.11.8,TCP,66,,,0.000106,"Jan  8, 2024 10:29:50.542621000 JST",,"36852  >  6000 [FIN, ACK] Seq=28 Ack=1 Win=64256 Len=0 TSval=2521993094 TSecr=3518249249"
109,37.740319,192.168.11.8,192.168.11.23,TCP,66,0.018279,,0.018173,"Jan  8, 2024 10:29:50.560794000 JST",,6000  >  36852 [ACK] Seq=1 Ack=28 Win=65152 Len=0 TSval=3518249268 TSecr=2521993094
110,37.740714,192.168.11.8,192.168.11.23,TCP,66,0.018568,,0.000395,"Jan  8, 2024 10:29:50.561189000 JST",,"6000  >  36852 [FIN, ACK] Seq=1 Ack=29 Win=65152 Len=0 TSval=3518249269 TSecr=2521993094"
111,37.740771,192.168.11.23,192.168.11.8,TCP,66,0.000057,,0.000057,"Jan  8, 2024 10:29:50.561246000 JST",,36852  >  6000 [ACK] Seq=29 Ack=2 Win=64256 Len=0 TSval=2521993112 TSecr=3518249269
112,37.769078,192.168.11.23,255.255.255.255,UDP,209,,Ÿ,0.028307,"Jan  8, 2024 10:29:50.589553000 JST",7b2273656d616e74696373223a207b22656e74697479223a2022504944222c202262617365656e74697479223a2022616e79222c2022726f6c65223a2022656565222c20227370617469616c223a2022616e79222c202274656d706f72616c223a2022616e79227d2c20226461746170726f7065727479223a207b22666f726d6174223a2022696e616f6b615f70726f6772616d5f73616d706c655f73656d616e746963227d7d,38875  >  7000 Len=167
113,37.775182,192.168.11.9,192.168.11.23,TCP,74,,œ,0.006104,"Jan  8, 2024 10:29:50.595657000 JST",,56140  >  6000 [SYN] Seq=0 Win=64240 Len=0 MSS=1460 SACK_PERM TSval=2545646150 TSecr=0 WS=128
114,37.775323,192.168.11.23,192.168.11.9,TCP,74,0.000141,,0.000141,"Jan  8, 2024 10:29:50.595798000 JST",,"6000  >  56140 [SYN, ACK] Seq=0 Ack=1 Win=65160 Len=0 MSS=1460 SACK_PERM TSval=4283040760 TSecr=2545646150 WS=128"
115,37.782184,192.168.11.9,192.168.11.23,TCP,66,0.006861,,0.006861,"Jan  8, 2024 10:29:50.602659000 JST",,56140  >  6000 [ACK] Seq=1 Ack=1 Win=64256 Len=0 TSval=2545646157 TSecr=4283040760
116,37.782728,192.168.11.9,192.168.11.23,TCP,93,,,0.000544,"Jan  8, 2024 10:29:50.603203000 JST",,"56140  >  6000 [PSH, ACK] Seq=1 Ack=1 Win=64256 Len=27 TSval=2545646157 TSecr=4283040760 [TCP segment of a reassembled PDU]"
117,37.78282,192.168.11.23,192.168.11.9,TCP,66,0.000092,,0.000092,"Jan  8, 2024 10:29:50.603295000 JST",,6000  >  56140 [ACK] Seq=1 Ack=28 Win=65152 Len=0 TSval=4283040767 TSecr=2545646157
118,37.782907,192.168.11.9,192.168.11.23,TCP,66,,,0.000087,"Jan  8, 2024 10:29:50.603382000 JST",,"56140  >  6000 [FIN, ACK] Seq=28 Ack=1 Win=64256 Len=0 TSval=2545646157 TSecr=4283040760"
119,37.784289,192.168.11.23,192.168.11.9,TCP,66,0.001382,,0.001382,"Jan  8, 2024 10:29:50.604764000 JST",,"6000  >  56140 [FIN, ACK] Seq=1 Ack=29 Win=65152 Len=0 TSval=4283040769 TSecr=2545646157"
120,37.789691,192.168.11.9,192.168.11.23,TCP,66,0.005402,,0.005402,"Jan  8, 2024 10:29:50.610166000 JST",,56140  >  6000 [ACK] Seq=29 Ack=2 Win=64256 Len=0 TSval=2545646165 TSecr=4283040769
121,43.842969,192.168.11.23,192.168.11.8,TCP,74,,,6.053278,"Jan  8, 2024 10:29:56.663444000 JST",,58012  >  6000 [SYN] Seq=0 Win=64240 Len=0 MSS=1460 SACK_PERM TSval=2521999215 TSecr=0 WS=128
122,43.84969,192.168.11.8,192.168.11.23,TCP,74,0.006721,,0.006721,"Jan  8, 2024 10:29:56.670165000 JST",,"6000  >  58012 [SYN, ACK] Seq=0 Ack=1 Win=65160 Len=0 MSS=1460 SACK_PERM TSval=3518255377 TSecr=2521999215 WS=128"
123,43.849808,192.168.11.23,192.168.11.8,TCP,66,0.000118,,0.000118,"Jan  8, 2024 10:29:56.670283000 JST",,58012  >  6000 [ACK] Seq=1 Ack=1 Win=64256 Len=0 TSval=2521999221 TSecr=3518255377
124,43.849996,192.168.11.23,192.168.11.8,TCP,93,,,0.000188,"Jan  8, 2024 10:29:56.670471000 JST",,"58012  >  6000 [PSH, ACK] Seq=1 Ack=1 Win=64256 Len=27 TSval=2521999222 TSecr=3518255377 [TCP segment of a reassembled PDU]"
125,43.850108,192.168.11.23,192.168.11.8,TCP,66,,,0.000112,"Jan  8, 2024 10:29:56.670583000 JST",,"58012  >  6000 [FIN, ACK] Seq=28 Ack=1 Win=64256 Len=0 TSval=2521999222 TSecr=3518255377"
126,43.857594,192.168.11.8,192.168.11.23,TCP,66,0.007598,,0.007486,"Jan  8, 2024 10:29:56.678069000 JST",,6000  >  58012 [ACK] Seq=1 Ack=28 Win=65152 Len=0 TSval=3518255385 TSecr=2521999222
127,43.859641,192.168.11.8,192.168.11.23,TCP,66,0.009533,,0.002047,"Jan  8, 2024 10:29:56.680116000 JST",,"6000  >  58012 [FIN, ACK] Seq=1 Ack=29 Win=65152 Len=0 TSval=3518255387 TSecr=2521999222"
128,43.859694,192.168.11.23,192.168.11.8,TCP,66,0.000053,,0.000053,"Jan  8, 2024 10:29:56.680169000 JST",,58012  >  6000 [ACK] Seq=29 Ack=2 Win=64256 Len=0 TSval=2521999231 TSecr=3518255387
129,43.888988,192.168.11.23,255.255.255.255,UDP,209,,Ÿ,0.029294,"Jan  8, 2024 10:29:56.709463000 JST",7b2273656d616e74696373223a207b22656e74697479223a2022504944222c202262617365656e74697479223a2022616e79222c2022726f6c65223a2022656565222c20227370617469616c223a2022616e79222c202274656d706f72616c223a2022616e79227d2c20226461746170726f7065727479223a207b22666f726d6174223a2022696e616f6b615f70726f6772616d5f73616d706c655f73656d616e746963227d7d,47894  >  7000 Len=167
130,43.894724,192.168.11.9,192.168.11.23,TCP,74,,œ,0.005736,"Jan  8, 2024 10:29:56.715199000 JST",,44362  >  6000 [SYN] Seq=0 Win=64240 Len=0 MSS=1460 SACK_PERM TSval=2545652270 TSecr=0 WS=128
131,43.894867,192.168.11.23,192.168.11.9,TCP,74,0.000143,,0.000143,"Jan  8, 2024 10:29:56.715342000 JST",,"6000  >  44362 [SYN, ACK] Seq=0 Ack=1 Win=65160 Len=0 MSS=1460 SACK_PERM TSval=4283046880 TSecr=2545652270 WS=128"
132,43.902602,192.168.11.9,192.168.11.23,TCP,66,0.007735,,0.007735,"Jan  8, 2024 10:29:56.723077000 JST",,44362  >  6000 [ACK] Seq=1 Ack=1 Win=64256 Len=0 TSval=2545652276 TSecr=4283046880
133,43.903259,192.168.11.9,192.168.11.23,TCP,93,,,0.000657,"Jan  8, 2024 10:29:56.723734000 JST",,"44362  >  6000 [PSH, ACK] Seq=1 Ack=1 Win=64256 Len=27 TSval=2545652277 TSecr=4283046880 [TCP segment of a reassembled PDU]"
134,43.9034,192.168.11.23,192.168.11.9,TCP,66,0.000141,,0.000141,"Jan  8, 2024 10:29:56.723875000 JST",,6000  >  44362 [ACK] Seq=1 Ack=28 Win=65152 Len=0 TSval=4283046888 TSecr=2545652277
135,43.903487,192.168.11.9,192.168.11.23,TCP,66,,,0.000087,"Jan  8, 2024 10:29:56.723962000 JST",,"44362  >  6000 [FIN, ACK] Seq=28 Ack=1 Win=64256 Len=0 TSval=2545652277 TSecr=4283046880"
136,43.904944,192.168.11.23,192.168.11.9,TCP,66,0.001457,,0.001457,"Jan  8, 2024 10:29:56.725419000 JST",,"6000  >  44362 [FIN, ACK] Seq=1 Ack=29 Win=65152 Len=0 TSval=4283046890 TSecr=2545652277"
137,43.912775,192.168.11.9,192.168.11.23,TCP,66,0.007831,,0.007831,"Jan  8, 2024 10:29:56.733250000 JST",,44362  >  6000 [ACK] Seq=29 Ack=2 Win=64256 Len=0 TSval=2545652287 TSecr=4283046890
138,49.940266,192.168.11.23,192.168.11.8,TCP,74,,,6.027491,"Jan  8, 2024 10:30:02.760741000 JST",,36420  >  6000 [SYN] Seq=0 Win=64240 Len=0 MSS=1460 SACK_PERM TSval=2522005312 TSecr=0 WS=128
139,49.947317,192.168.11.8,192.168.11.23,TCP,74,0.007051,,0.007051,"Jan  8, 2024 10:30:02.767792000 JST",,"6000  >  36420 [SYN, ACK] Seq=0 Ack=1 Win=65160 Len=0 MSS=1460 SACK_PERM TSval=3518261474 TSecr=2522005312 WS=128"
140,49.947434,192.168.11.23,192.168.11.8,TCP,66,0.000117,,0.000117,"Jan  8, 2024 10:30:02.767909000 JST",,36420  >  6000 [ACK] Seq=1 Ack=1 Win=64256 Len=0 TSval=2522005319 TSecr=3518261474
141,49.94761,192.168.11.23,192.168.11.8,TCP,93,,,0.000176,"Jan  8, 2024 10:30:02.768085000 JST",,"36420  >  6000 [PSH, ACK] Seq=1 Ack=1 Win=64256 Len=27 TSval=2522005319 TSecr=3518261474 [TCP segment of a reassembled PDU]"
142,49.947702,192.168.11.23,192.168.11.8,TCP,66,,,0.000092,"Jan  8, 2024 10:30:02.768177000 JST",,"36420  >  6000 [FIN, ACK] Seq=28 Ack=1 Win=64256 Len=0 TSval=2522005319 TSecr=3518261474"
143,49.9551,192.168.11.8,192.168.11.23,TCP,66,0.00749,,0.007398,"Jan  8, 2024 10:30:02.775575000 JST",,6000  >  36420 [ACK] Seq=1 Ack=28 Win=65152 Len=0 TSval=3518261482 TSecr=2522005319
144,49.955331,192.168.11.8,192.168.11.23,TCP,66,0.007629,,0.000231,"Jan  8, 2024 10:30:02.775806000 JST",,"6000  >  36420 [FIN, ACK] Seq=1 Ack=29 Win=65152 Len=0 TSval=3518261484 TSecr=2522005319"
145,49.955387,192.168.11.23,192.168.11.8,TCP,66,0.000056,,0.000056,"Jan  8, 2024 10:30:02.775862000 JST",,36420  >  6000 [ACK] Seq=29 Ack=2 Win=64256 Len=0 TSval=2522005327 TSecr=3518261484
146,49.98504,192.168.11.23,255.255.255.255,UDP,209,,Ÿ,0.029653,"Jan  8, 2024 10:30:02.805515000 JST",7b2273656d616e74696373223a207b22656e74697479223a2022504944222c202262617365656e74697479223a2022616e79222c2022726f6c65223a2022656565222c20227370617469616c223a2022616e79222c202274656d706f72616c223a2022616e79227d2c20226461746170726f7065727479223a207b22666f726d6174223a2022696e616f6b615f70726f6772616d5f73616d706c655f73656d616e746963227d7d,45627  >  7000 Len=167
147,49.990856,192.168.11.9,192.168.11.23,TCP,74,,œ,0.005816,"Jan  8, 2024 10:30:02.811331000 JST",,44370  >  6000 [SYN] Seq=0 Win=64240 Len=0 MSS=1460 SACK_PERM TSval=2545658366 TSecr=0 WS=128
148,49.990988,192.168.11.23,192.168.11.9,TCP,74,0.000132,,0.000132,"Jan  8, 2024 10:30:02.811463000 JST",,"6000  >  44370 [SYN, ACK] Seq=0 Ack=1 Win=65160 Len=0 MSS=1460 SACK_PERM TSval=4283052976 TSecr=2545658366 WS=128"
149,49.997883,192.168.11.9,192.168.11.23,TCP,66,0.006895,,0.006895,"Jan  8, 2024 10:30:02.818358000 JST",,44370  >  6000 [ACK] Seq=1 Ack=1 Win=64256 Len=0 TSval=2545658373 TSecr=4283052976
150,49.998466,192.168.11.9,192.168.11.23,TCP,93,,,0.000583,"Jan  8, 2024 10:30:02.818941000 JST",,"44370  >  6000 [PSH, ACK] Seq=1 Ack=1 Win=64256 Len=27 TSval=2545658373 TSecr=4283052976 [TCP segment of a reassembled PDU]"
151,49.998569,192.168.11.23,192.168.11.9,TCP,66,0.000103,,0.000103,"Jan  8, 2024 10:30:02.819044000 JST",,6000  >  44370 [ACK] Seq=1 Ack=28 Win=65152 Len=0 TSval=4283052983 TSecr=2545658373
152,49.99864,192.168.11.9,192.168.11.23,TCP,66,,,0.000071,"Jan  8, 2024 10:30:02.819115000 JST",,"44370  >  6000 [FIN, ACK] Seq=28 Ack=1 Win=64256 Len=0 TSval=2545658373 TSecr=4283052976"
153,49.999747,192.168.11.23,192.168.11.9,TCP,66,0.001107,,0.001107,"Jan  8, 2024 10:30:02.820222000 JST",,"6000  >  44370 [FIN, ACK] Seq=1 Ack=29 Win=65152 Len=0 TSval=4283052984 TSecr=2545658373"
154,50.00681,192.168.11.9,192.168.11.23,TCP,66,0.007063,,0.007063,"Jan  8, 2024 10:30:02.827285000 JST",,44370  >  6000 [ACK] Seq=29 Ack=2 Win=64256 Len=0 TSval=2545658381 TSecr=4283052984
155,56.061546,192.168.11.23,192.168.11.8,TCP,74,,,6.054736,"Jan  8, 2024 10:30:08.882021000 JST",,36426  >  6000 [SYN] Seq=0 Win=64240 Len=0 MSS=1460 SACK_PERM TSval=2522011433 TSecr=0 WS=128
156,56.068499,192.168.11.8,192.168.11.23,TCP,74,0.006953,,0.006953,"Jan  8, 2024 10:30:08.888974000 JST",,"6000  >  36426 [SYN, ACK] Seq=0 Ack=1 Win=65160 Len=0 MSS=1460 SACK_PERM TSval=3518267596 TSecr=2522011433 WS=128"
157,56.068618,192.168.11.23,192.168.11.8,TCP,66,0.000119,,0.000119,"Jan  8, 2024 10:30:08.889093000 JST",,36426  >  6000 [ACK] Seq=1 Ack=1 Win=64256 Len=0 TSval=2522011440 TSecr=3518267596
158,56.068823,192.168.11.23,192.168.11.8,TCP,93,,,0.000205,"Jan  8, 2024 10:30:08.889298000 JST",,"36426  >  6000 [PSH, ACK] Seq=1 Ack=1 Win=64256 Len=27 TSval=2522011441 TSecr=3518267596 [TCP segment of a reassembled PDU]"
159,56.068926,192.168.11.23,192.168.11.8,TCP,66,,,0.000103,"Jan  8, 2024 10:30:08.889401000 JST",,"36426  >  6000 [FIN, ACK] Seq=28 Ack=1 Win=64256 Len=0 TSval=2522011441 TSecr=3518267596"
160,56.078415,192.168.11.8,192.168.11.23,TCP,66,0.009592,,0.009489,"Jan  8, 2024 10:30:08.898890000 JST",,6000  >  36426 [ACK] Seq=1 Ack=28 Win=65152 Len=0 TSval=3518267603 TSecr=2522011441
161,56.078781,192.168.11.8,192.168.11.23,TCP,66,0.009855,,0.000366,"Jan  8, 2024 10:30:08.899256000 JST",,"6000  >  36426 [FIN, ACK] Seq=1 Ack=29 Win=65152 Len=0 TSval=3518267606 TSecr=2522011441"
162,56.078829,192.168.11.23,192.168.11.8,TCP,66,0.000048,,0.000048,"Jan  8, 2024 10:30:08.899304000 JST",,36426  >  6000 [ACK] Seq=29 Ack=2 Win=64256 Len=0 TSval=2522011451 TSecr=3518267606
163,56.106856,192.168.11.23,255.255.255.255,UDP,209,,Ÿ,0.028027,"Jan  8, 2024 10:30:08.927331000 JST",7b2273656d616e74696373223a207b22656e74697479223a2022504944222c202262617365656e74697479223a2022616e79222c2022726f6c65223a2022656565222c20227370617469616c223a2022616e79222c202274656d706f72616c223a2022616e79227d2c20226461746170726f7065727479223a207b22666f726d6174223a2022696e616f6b615f70726f6772616d5f73616d706c655f73656d616e746963227d7d,54099  >  7000 Len=167
164,56.113851,192.168.11.9,192.168.11.23,TCP,74,,œ,0.006995,"Jan  8, 2024 10:30:08.934326000 JST",,33000  >  6000 [SYN] Seq=0 Win=64240 Len=0 MSS=1460 SACK_PERM TSval=2545664488 TSecr=0 WS=128
165,56.114006,192.168.11.23,192.168.11.9,TCP,74,0.000155,,0.000155,"Jan  8, 2024 10:30:08.934481000 JST",,"6000  >  33000 [SYN, ACK] Seq=0 Ack=1 Win=65160 Len=0 MSS=1460 SACK_PERM TSval=4283059099 TSecr=2545664488 WS=128"
166,56.120743,192.168.11.9,192.168.11.23,TCP,66,0.006737,,0.006737,"Jan  8, 2024 10:30:08.941218000 JST",,33000  >  6000 [ACK] Seq=1 Ack=1 Win=64256 Len=0 TSval=2545664495 TSecr=4283059099
167,56.121357,192.168.11.9,192.168.11.23,TCP,93,,,0.000614,"Jan  8, 2024 10:30:08.941832000 JST",,"33000  >  6000 [PSH, ACK] Seq=1 Ack=1 Win=64256 Len=27 TSval=2545664496 TSecr=4283059099 [TCP segment of a reassembled PDU]"
168,56.121448,192.168.11.23,192.168.11.9,TCP,66,0.000091,,0.000091,"Jan  8, 2024 10:30:08.941923000 JST",,6000  >  33000 [ACK] Seq=1 Ack=28 Win=65152 Len=0 TSval=4283059106 TSecr=2545664496
169,56.121536,192.168.11.9,192.168.11.23,TCP,66,,,0.000088,"Jan  8, 2024 10:30:08.942011000 JST",,"33000  >  6000 [FIN, ACK] Seq=28 Ack=1 Win=64256 Len=0 TSval=2545664496 TSecr=4283059099"
170,56.122953,192.168.11.23,192.168.11.9,TCP,66,0.001417,,0.001417,"Jan  8, 2024 10:30:08.943428000 JST",,"6000  >  33000 [FIN, ACK] Seq=1 Ack=29 Win=65152 Len=0 TSval=4283059108 TSecr=2545664496"
171,56.128647,192.168.11.9,192.168.11.23,TCP,66,0.005694,,0.005694,"Jan  8, 2024 10:30:08.949122000 JST",,33000  >  6000 [ACK] Seq=29 Ack=2 Win=64256 Len=0 TSval=2545664503 TSecr=4283059108
172,87.230936,192.168.11.23,192.168.11.8,TCP,74,,,31.102289,"Jan  8, 2024 10:30:40.051411000 JST",,35288  >  6000 [SYN] Seq=0 Win=64240 Len=0 MSS=1460 SACK_PERM TSval=2522042603 TSecr=0 WS=128
173,87.238628,192.168.11.8,192.168.11.23,TCP,74,0.007692,,0.007692,"Jan  8, 2024 10:30:40.059103000 JST",,"6000  >  35288 [SYN, ACK] Seq=0 Ack=1 Win=65160 Len=0 MSS=1460 SACK_PERM TSval=3518298766 TSecr=2522042603 WS=128"
174,87.238736,192.168.11.23,192.168.11.8,TCP,66,0.000108,,0.000108,"Jan  8, 2024 10:30:40.059211000 JST",,35288  >  6000 [ACK] Seq=1 Ack=1 Win=64256 Len=0 TSval=2522042610 TSecr=3518298766
175,87.238941,192.168.11.23,192.168.11.8,TCP,93,,,0.000205,"Jan  8, 2024 10:30:40.059416000 JST",,"35288  >  6000 [PSH, ACK] Seq=1 Ack=1 Win=64256 Len=27 TSval=2522042611 TSecr=3518298766 [TCP segment of a reassembled PDU]"
176,87.239044,192.168.11.23,192.168.11.8,TCP,66,,,0.000103,"Jan  8, 2024 10:30:40.059519000 JST",,"35288  >  6000 [FIN, ACK] Seq=28 Ack=1 Win=64256 Len=0 TSval=2522042611 TSecr=3518298766"
177,87.246202,192.168.11.8,192.168.11.23,TCP,66,0.007261,,0.007158,"Jan  8, 2024 10:30:40.066677000 JST",,6000  >  35288 [ACK] Seq=1 Ack=28 Win=65152 Len=0 TSval=3518298773 TSecr=2522042611
178,87.249194,192.168.11.8,192.168.11.23,TCP,66,0.01015,,0.002992,"Jan  8, 2024 10:30:40.069669000 JST",,"6000  >  35288 [FIN, ACK] Seq=1 Ack=29 Win=65152 Len=0 TSval=3518298776 TSecr=2522042611"
179,87.249239,192.168.11.23,192.168.11.8,TCP,66,0.000045,,0.000045,"Jan  8, 2024 10:30:40.069714000 JST",,35288  >  6000 [ACK] Seq=29 Ack=2 Win=64256 Len=0 TSval=2522042621 TSecr=3518298776
180,87.280169,192.168.11.23,255.255.255.255,UDP,209,,Ÿ,0.03093,"Jan  8, 2024 10:30:40.100644000 JST",7b2273656d616e74696373223a207b22656e74697479223a2022504944222c202262617365656e74697479223a2022616e79222c2022726f6c65223a2022656565222c20227370617469616c223a2022616e79222c202274656d706f72616c223a2022616e79227d2c20226461746170726f7065727479223a207b22666f726d6174223a2022696e616f6b615f70726f6772616d5f73616d706c655f73656d616e746963227d7d,39160  >  7000 Len=167
181,87.285889,192.168.11.9,192.168.11.23,TCP,74,,œ,0.00572,"Jan  8, 2024 10:30:40.106364000 JST",,49834  >  6000 [SYN] Seq=0 Win=64240 Len=0 MSS=1460 SACK_PERM TSval=2545695661 TSecr=0 WS=128
182,87.286062,192.168.11.23,192.168.11.9,TCP,74,0.000173,,0.000173,"Jan  8, 2024 10:30:40.106537000 JST",,"6000  >  49834 [SYN, ACK] Seq=0 Ack=1 Win=65160 Len=0 MSS=1460 SACK_PERM TSval=4283090271 TSecr=2545695661 WS=128"
183,87.293161,192.168.11.9,192.168.11.23,TCP,66,0.007099,,0.007099,"Jan  8, 2024 10:30:40.113636000 JST",,49834  >  6000 [ACK] Seq=1 Ack=1 Win=64256 Len=0 TSval=2545695667 TSecr=4283090271
184,87.293853,192.168.11.9,192.168.11.23,TCP,93,,,0.000692,"Jan  8, 2024 10:30:40.114328000 JST",,"49834  >  6000 [PSH, ACK] Seq=1 Ack=1 Win=64256 Len=27 TSval=2545695668 TSecr=4283090271 [TCP segment of a reassembled PDU]"
185,87.293967,192.168.11.23,192.168.11.9,TCP,66,0.000114,,0.000114,"Jan  8, 2024 10:30:40.114442000 JST",,6000  >  49834 [ACK] Seq=1 Ack=28 Win=65152 Len=0 TSval=4283090279 TSecr=2545695668
