No.,Time,Source,Destination,Protocol,Length,The RTT to ACK the segment was,XXX,Time delta from previous captured frame,Arrival Time,Data,Info
1,0,192.168.11.21,192.168.11.30,TCP,74,,,0,"Jan  8, 2024 10:29:12.985881000 JST",,54352  >  6000 [SYN] Seq=0 Win=64240 Len=0 MSS=1460 SACK_PERM TSval=2365389064 TSecr=0 WS=128
2,0.007719,192.168.11.30,192.168.11.21,TCP,74,0.007719,,0.007719,"Jan  8, 2024 10:29:12.993600000 JST",,"6000  >  54352 [SYN, ACK] Seq=0 Ack=1 Win=65160 Len=0 MSS=1460 SACK_PERM TSval=1525501257 TSecr=2365389064 WS=128"
3,0.007831,192.168.11.21,192.168.11.30,TCP,66,0.000112,,0.000112,"Jan  8, 2024 10:29:12.993712000 JST",,54352  >  6000 [ACK] Seq=1 Ack=1 Win=64256 Len=0 TSval=2365389072 TSecr=1525501257
4,0.008009,192.168.11.21,192.168.11.30,TCP,93,,,0.000178,"Jan  8, 2024 10:29:12.993890000 JST",,"54352  >  6000 [PSH, ACK] Seq=1 Ack=1 Win=64256 Len=27 TSval=2365389072 TSecr=1525501257 [TCP segment of a reassembled PDU]"
5,0.008158,192.168.11.21,192.168.11.30,TCP,66,,,0.000149,"Jan  8, 2024 10:29:12.994039000 JST",,"54352  >  6000 [FIN, ACK] Seq=28 Ack=1 Win=64256 Len=0 TSval=2365389072 TSecr=1525501257"
6,0.015559,192.168.11.30,192.168.11.21,TCP,66,0.00755,,0.007401,"Jan  8, 2024 10:29:13.001440000 JST",,6000  >  54352 [ACK] Seq=1 Ack=28 Win=65152 Len=0 TSval=1525501265 TSecr=2365389072
7,0.015782,192.168.11.30,192.168.11.21,TCP,66,0.007624,,0.000223,"Jan  8, 2024 10:29:13.001663000 JST",,"6000  >  54352 [FIN, ACK] Seq=1 Ack=29 Win=65152 Len=0 TSval=1525501266 TSecr=2365389072"
8,0.015836,192.168.11.21,192.168.11.30,TCP,66,0.000054,,0.000054,"Jan  8, 2024 10:29:13.001717000 JST",,54352  >  6000 [ACK] Seq=29 Ack=2 Win=64256 Len=0 TSval=2365389080 TSecr=1525501266
9,0.049107,192.168.11.21,255.255.255.255,UDP,209,,Ÿ,0.033271,"Jan  8, 2024 10:29:13.034988000 JST",7b2273656d616e74696373223a207b22656e74697479223a2022504944222c202262617365656e74697479223a2022616e79222c2022726f6c65223a2022696969222c20227370617469616c223a2022616e79222c202274656d706f72616c223a2022616e79227d2c20226461746170726f7065727479223a207b22666f726d6174223a2022696e616f6b615f70726f6772616d5f73616d706c655f73656d616e746963227d7d,33556  >  7000 Len=167
10,0.055053,192.168.11.28,192.168.11.21,TCP,74,,œ,0.005946,"Jan  8, 2024 10:29:13.040934000 JST",,46076  >  6000 [SYN] Seq=0 Win=64240 Len=0 MSS=1460 SACK_PERM TSval=3502979154 TSecr=0 WS=128
11,0.055232,192.168.11.21,192.168.11.28,TCP,74,0.000179,,0.000179,"Jan  8, 2024 10:29:13.041113000 JST",,"6000  >  46076 [SYN, ACK] Seq=0 Ack=1 Win=65160 Len=0 MSS=1460 SACK_PERM TSval=4202621995 TSecr=3502979154 WS=128"
12,0.063138,192.168.11.28,192.168.11.21,TCP,66,0.007906,,0.007906,"Jan  8, 2024 10:29:13.049019000 JST",,46076  >  6000 [ACK] Seq=1 Ack=1 Win=64256 Len=0 TSval=3502979162 TSecr=4202621995
13,0.063722,192.168.11.28,192.168.11.21,TCP,93,,,0.000584,"Jan  8, 2024 10:29:13.049603000 JST",,"46076  >  6000 [PSH, ACK] Seq=1 Ack=1 Win=64256 Len=27 TSval=3502979162 TSecr=4202621995 [TCP segment of a reassembled PDU]"
14,0.063827,192.168.11.21,192.168.11.28,TCP,66,0.000105,,0.000105,"Jan  8, 2024 10:29:13.049708000 JST",,6000  >  46076 [ACK] Seq=1 Ack=28 Win=65152 Len=0 TSval=4202622003 TSecr=3502979162
15,0.063913,192.168.11.28,192.168.11.21,TCP,66,,,0.000086,"Jan  8, 2024 10:29:13.049794000 JST",,"46076  >  6000 [FIN, ACK] Seq=28 Ack=1 Win=64256 Len=0 TSval=3502979163 TSecr=4202621995"
16,0.065379,192.168.11.21,192.168.11.28,TCP,66,0.001466,,0.001466,"Jan  8, 2024 10:29:13.051260000 JST",,"6000  >  46076 [FIN, ACK] Seq=1 Ack=29 Win=65152 Len=0 TSval=4202622005 TSecr=3502979163"
17,0.071467,192.168.11.28,192.168.11.21,TCP,66,0.006088,,0.006088,"Jan  8, 2024 10:29:13.057348000 JST",,46076  >  6000 [ACK] Seq=29 Ack=2 Win=64256 Len=0 TSval=3502979170 TSecr=4202622005
18,6.177304,192.168.11.21,192.168.11.30,TCP,74,,,6.105837,"Jan  8, 2024 10:29:19.163185000 JST",,45204  >  6000 [SYN] Seq=0 Win=64240 Len=0 MSS=1460 SACK_PERM TSval=2365395241 TSecr=0 WS=128
19,6.184096,192.168.11.30,192.168.11.21,TCP,74,0.006792,,0.006792,"Jan  8, 2024 10:29:19.169977000 JST",,"6000  >  45204 [SYN, ACK] Seq=0 Ack=1 Win=65160 Len=0 MSS=1460 SACK_PERM TSval=1525507434 TSecr=2365395241 WS=128"
20,6.184213,192.168.11.21,192.168.11.30,TCP,66,0.000117,,0.000117,"Jan  8, 2024 10:29:19.170094000 JST",,45204  >  6000 [ACK] Seq=1 Ack=1 Win=64256 Len=0 TSval=2365395248 TSecr=1525507434
21,6.184357,192.168.11.21,192.168.11.30,TCP,93,,,0.000144,"Jan  8, 2024 10:29:19.170238000 JST",,"45204  >  6000 [PSH, ACK] Seq=1 Ack=1 Win=64256 Len=27 TSval=2365395248 TSecr=1525507434 [TCP segment of a reassembled PDU]"
22,6.184494,192.168.11.21,192.168.11.30,TCP,66,,,0.000137,"Jan  8, 2024 10:29:19.170375000 JST",,"45204  >  6000 [FIN, ACK] Seq=28 Ack=1 Win=64256 Len=0 TSval=2365395248 TSecr=1525507434"
23,6.192689,192.168.11.30,192.168.11.21,TCP,66,0.008332,,0.008195,"Jan  8, 2024 10:29:19.178570000 JST",,6000  >  45204 [ACK] Seq=1 Ack=28 Win=65152 Len=0 TSval=1525507442 TSecr=2365395248
24,6.193082,192.168.11.30,192.168.11.21,TCP,66,0.008588,,0.000393,"Jan  8, 2024 10:29:19.178963000 JST",,"6000  >  45204 [FIN, ACK] Seq=1 Ack=29 Win=65152 Len=0 TSval=1525507443 TSecr=2365395248"
25,6.193141,192.168.11.21,192.168.11.30,TCP,66,0.000059,,0.000059,"Jan  8, 2024 10:29:19.179022000 JST",,45204  >  6000 [ACK] Seq=29 Ack=2 Win=64256 Len=0 TSval=2365395257 TSecr=1525507443
26,6.223355,192.168.11.21,255.255.255.255,UDP,209,,Ÿ,0.030214,"Jan  8, 2024 10:29:19.209236000 JST",7b2273656d616e74696373223a207b22656e74697479223a2022504944222c202262617365656e74697479223a2022616e79222c2022726f6c65223a2022696969222c20227370617469616c223a2022616e79222c202274656d706f72616c223a2022616e79227d2c20226461746170726f7065727479223a207b22666f726d6174223a2022696e616f6b615f70726f6772616d5f73616d706c655f73656d616e746963227d7d,37688  >  7000 Len=167
27,6.228955,192.168.11.28,192.168.11.21,TCP,74,,œ,0.0056,"Jan  8, 2024 10:29:19.214836000 JST",,48128  >  6000 [SYN] Seq=0 Win=64240 Len=0 MSS=1460 SACK_PERM TSval=3502985328 TSecr=0 WS=128
28,6.229106,192.168.11.21,192.168.11.28,TCP,74,0.000151,,0.000151,"Jan  8, 2024 10:29:19.214987000 JST",,"6000  >  48128 [SYN, ACK] Seq=0 Ack=1 Win=65160 Len=0 MSS=1460 SACK_PERM TSval=4202628169 TSecr=3502985328 WS=128"
29,6.236328,192.168.11.28,192.168.11.21,TCP,66,0.007222,,0.007222,"Jan  8, 2024 10:29:19.222209000 JST",,48128  >  6000 [ACK] Seq=1 Ack=1 Win=64256 Len=0 TSval=3502985336 TSecr=4202628169
30,6.236806,192.168.11.28,192.168.11.21,TCP,93,,,0.000478,"Jan  8, 2024 10:29:19.222687000 JST",,"48128  >  6000 [PSH, ACK] Seq=1 Ack=1 Win=64256 Len=27 TSval=3502985336 TSecr=4202628169 [TCP segment of a reassembled PDU]"
31,6.236923,192.168.11.21,192.168.11.28,TCP,66,0.000117,,0.000117,"Jan  8, 2024 10:29:19.222804000 JST",,6000  >  48128 [ACK] Seq=1 Ack=28 Win=65152 Len=0 TSval=4202628177 TSecr=3502985336
32,6.237153,192.168.11.28,192.168.11.21,TCP,66,,,0.00023,"Jan  8, 2024 10:29:19.223034000 JST",,"48128  >  6000 [FIN, ACK] Seq=28 Ack=1 Win=64256 Len=0 TSval=3502985336 TSecr=4202628169"
33,6.23833,192.168.11.21,192.168.11.28,TCP,66,0.001177,,0.001177,"Jan  8, 2024 10:29:19.224211000 JST",,"6000  >  48128 [FIN, ACK] Seq=1 Ack=29 Win=65152 Len=0 TSval=4202628178 TSecr=3502985336"
34,6.244227,192.168.11.28,192.168.11.21,TCP,66,0.005897,,0.005897,"Jan  8, 2024 10:29:19.230108000 JST",,48128  >  6000 [ACK] Seq=29 Ack=2 Win=64256 Len=0 TSval=3502985343 TSecr=4202628178
35,12.272443,192.168.11.21,192.168.11.30,TCP,74,,,6.028216,"Jan  8, 2024 10:29:25.258324000 JST",,45216  >  6000 [SYN] Seq=0 Win=64240 Len=0 MSS=1460 SACK_PERM TSval=2365401336 TSecr=0 WS=128
36,12.279744,192.168.11.30,192.168.11.21,TCP,74,0.007301,,0.007301,"Jan  8, 2024 10:29:25.265625000 JST",,"6000  >  45216 [SYN, ACK] Seq=0 Ack=1 Win=65160 Len=0 MSS=1460 SACK_PERM TSval=1525513529 TSecr=2365401336 WS=128"
37,12.279863,192.168.11.21,192.168.11.30,TCP,66,0.000119,,0.000119,"Jan  8, 2024 10:29:25.265744000 JST",,45216  >  6000 [ACK] Seq=1 Ack=1 Win=64256 Len=0 TSval=2365401344 TSecr=1525513529
38,12.280016,192.168.11.21,192.168.11.30,TCP,93,,,0.000153,"Jan  8, 2024 10:29:25.265897000 JST",,"45216  >  6000 [PSH, ACK] Seq=1 Ack=1 Win=64256 Len=27 TSval=2365401344 TSecr=1525513529 [TCP segment of a reassembled PDU]"
39,12.280148,192.168.11.21,192.168.11.30,TCP,66,,,0.000132,"Jan  8, 2024 10:29:25.266029000 JST",,"45216  >  6000 [FIN, ACK] Seq=28 Ack=1 Win=64256 Len=0 TSval=2365401344 TSecr=1525513529"
40,12.287601,192.168.11.30,192.168.11.21,TCP,66,0.007585,,0.007453,"Jan  8, 2024 10:29:25.273482000 JST",,6000  >  45216 [ACK] Seq=1 Ack=28 Win=65152 Len=0 TSval=1525513537 TSecr=2365401344
41,12.287963,192.168.11.30,192.168.11.21,TCP,66,0.007815,,0.000362,"Jan  8, 2024 10:29:25.273844000 JST",,"6000  >  45216 [FIN, ACK] Seq=1 Ack=29 Win=65152 Len=0 TSval=1525513538 TSecr=2365401344"
42,12.28801,192.168.11.21,192.168.11.30,TCP,66,0.000047,,0.000047,"Jan  8, 2024 10:29:25.273891000 JST",,45216  >  6000 [ACK] Seq=29 Ack=2 Win=64256 Len=0 TSval=2365401352 TSecr=1525513538
43,12.319496,192.168.11.21,255.255.255.255,UDP,209,,Ÿ,0.031486,"Jan  8, 2024 10:29:25.305377000 JST",7b2273656d616e74696373223a207b22656e74697479223a2022504944222c202262617365656e74697479223a2022616e79222c2022726f6c65223a2022696969222c20227370617469616c223a2022616e79222c202274656d706f72616c223a2022616e79227d2c20226461746170726f7065727479223a207b22666f726d6174223a2022696e616f6b615f70726f6772616d5f73616d706c655f73656d616e746963227d7d,55827  >  7000 Len=167
44,12.325186,192.168.11.28,192.168.11.21,TCP,74,,œ,0.00569,"Jan  8, 2024 10:29:25.311067000 JST",,48132  >  6000 [SYN] Seq=0 Win=64240 Len=0 MSS=1460 SACK_PERM TSval=3502991425 TSecr=0 WS=128
45,12.325337,192.168.11.21,192.168.11.28,TCP,74,0.000151,,0.000151,"Jan  8, 2024 10:29:25.311218000 JST",,"6000  >  48132 [SYN, ACK] Seq=0 Ack=1 Win=65160 Len=0 MSS=1460 SACK_PERM TSval=4202634265 TSecr=3502991425 WS=128"
46,12.332125,192.168.11.28,192.168.11.21,TCP,66,0.006788,,0.006788,"Jan  8, 2024 10:29:25.318006000 JST",,48132  >  6000 [ACK] Seq=1 Ack=1 Win=64256 Len=0 TSval=3502991431 TSecr=4202634265
47,12.332755,192.168.11.28,192.168.11.21,TCP,93,,,0.00063,"Jan  8, 2024 10:29:25.318636000 JST",,"48132  >  6000 [PSH, ACK] Seq=1 Ack=1 Win=64256 Len=27 TSval=3502991432 TSecr=4202634265 [TCP segment of a reassembled PDU]"
48,12.332867,192.168.11.21,192.168.11.28,TCP,66,0.000112,,0.000112,"Jan  8, 2024 10:29:25.318748000 JST",,6000  >  48132 [ACK] Seq=1 Ack=28 Win=65152 Len=0 TSval=4202634273 TSecr=3502991432
49,12.332947,192.168.11.28,192.168.11.21,TCP,66,,,0.00008,"Jan  8, 2024 10:29:25.318828000 JST",,"48132  >  6000 [FIN, ACK] Seq=28 Ack=1 Win=64256 Len=0 TSval=3502991432 TSecr=4202634265"
50,12.334188,192.168.11.21,192.168.11.28,TCP,66,0.001241,,0.001241,"Jan  8, 2024 10:29:25.320069000 JST",,"6000  >  48132 [FIN, ACK] Seq=1 Ack=29 Win=65152 Len=0 TSval=4202634274 TSecr=3502991432"
51,12.340259,192.168.11.28,192.168.11.21,TCP,66,0.006071,,0.006071,"Jan  8, 2024 10:29:25.326140000 JST",,48132  >  6000 [ACK] Seq=29 Ack=2 Win=64256 Len=0 TSval=3502991439 TSecr=4202634274
52,18.380689,192.168.11.21,192.168.11.30,TCP,74,,,6.04043,"Jan  8, 2024 10:29:31.366570000 JST",,52628  >  6000 [SYN] Seq=0 Win=64240 Len=0 MSS=1460 SACK_PERM TSval=2365407444 TSecr=0 WS=128
53,18.387518,192.168.11.30,192.168.11.21,TCP,74,0.006829,,0.006829,"Jan  8, 2024 10:29:31.373399000 JST",,"6000  >  52628 [SYN, ACK] Seq=0 Ack=1 Win=65160 Len=0 MSS=1460 SACK_PERM TSval=1525519637 TSecr=2365407444 WS=128"
54,18.387636,192.168.11.21,192.168.11.30,TCP,66,0.000118,,0.000118,"Jan  8, 2024 10:29:31.373517000 JST",,52628  >  6000 [ACK] Seq=1 Ack=1 Win=64256 Len=0 TSval=2365407451 TSecr=1525519637
55,18.387791,192.168.11.21,192.168.11.30,TCP,93,,,0.000155,"Jan  8, 2024 10:29:31.373672000 JST",,"52628  >  6000 [PSH, ACK] Seq=1 Ack=1 Win=64256 Len=27 TSval=2365407451 TSecr=1525519637 [TCP segment of a reassembled PDU]"
56,18.387899,192.168.11.21,192.168.11.30,TCP,66,,,0.000108,"Jan  8, 2024 10:29:31.373780000 JST",,"52628  >  6000 [FIN, ACK] Seq=28 Ack=1 Win=64256 Len=0 TSval=2365407452 TSecr=1525519637"
57,18.396826,192.168.11.30,192.168.11.21,TCP,66,0.009035,,0.008927,"Jan  8, 2024 10:29:31.382707000 JST",,6000  >  52628 [ACK] Seq=1 Ack=28 Win=65152 Len=0 TSval=1525519645 TSecr=2365407451
58,18.397196,192.168.11.30,192.168.11.21,TCP,66,0.009297,,0.00037,"Jan  8, 2024 10:29:31.383077000 JST",,"6000  >  52628 [FIN, ACK] Seq=1 Ack=29 Win=65152 Len=0 TSval=1525519647 TSecr=2365407452"
59,18.397242,192.168.11.21,192.168.11.30,TCP,66,0.000046,,0.000046,"Jan  8, 2024 10:29:31.383123000 JST",,52628  >  6000 [ACK] Seq=29 Ack=2 Win=64256 Len=0 TSval=2365407461 TSecr=1525519647
60,18.428052,192.168.11.21,255.255.255.255,UDP,209,,Ÿ,0.03081,"Jan  8, 2024 10:29:31.413933000 JST",7b2273656d616e74696373223a207b22656e74697479223a2022504944222c202262617365656e74697479223a2022616e79222c2022726f6c65223a2022696969222c20227370617469616c223a2022616e79222c202274656d706f72616c223a2022616e79227d2c20226461746170726f7065727479223a207b22666f726d6174223a2022696e616f6b615f70726f6772616d5f73616d706c655f73656d616e746963227d7d,60800  >  7000 Len=167
61,18.433727,192.168.11.28,192.168.11.21,TCP,74,,œ,0.005675,"Jan  8, 2024 10:29:31.419608000 JST",,37988  >  6000 [SYN] Seq=0 Win=64240 Len=0 MSS=1460 SACK_PERM TSval=3502997533 TSecr=0 WS=128
62,18.433888,192.168.11.21,192.168.11.28,TCP,74,0.000161,,0.000161,"Jan  8, 2024 10:29:31.419769000 JST",,"6000  >  37988 [SYN, ACK] Seq=0 Ack=1 Win=65160 Len=0 MSS=1460 SACK_PERM TSval=4202640374 TSecr=3502997533 WS=128"
63,18.441717,192.168.11.28,192.168.11.21,TCP,66,0.007829,,0.007829,"Jan  8, 2024 10:29:31.427598000 JST",,37988  >  6000 [ACK] Seq=1 Ack=1 Win=64256 Len=0 TSval=3502997541 TSecr=4202640374
64,18.442324,192.168.11.28,192.168.11.21,TCP,93,,,0.000607,"Jan  8, 2024 10:29:31.428205000 JST",,"37988  >  6000 [PSH, ACK] Seq=1 Ack=1 Win=64256 Len=27 TSval=3502997541 TSecr=4202640374 [TCP segment of a reassembled PDU]"
65,18.442421,192.168.11.21,192.168.11.28,TCP,66,0.000097,,0.000097,"Jan  8, 2024 10:29:31.428302000 JST",,6000  >  37988 [ACK] Seq=1 Ack=28 Win=65152 Len=0 TSval=4202640382 TSecr=3502997541
66,18.442499,192.168.11.28,192.168.11.21,TCP,66,,,0.000078,"Jan  8, 2024 10:29:31.428380000 JST",,"37988  >  6000 [FIN, ACK] Seq=28 Ack=1 Win=64256 Len=0 TSval=3502997541 TSecr=4202640374"
67,18.443787,192.168.11.21,192.168.11.28,TCP,66,0.001288,,0.001288,"Jan  8, 2024 10:29:31.429668000 JST",,"6000  >  37988 [FIN, ACK] Seq=1 Ack=29 Win=65152 Len=0 TSval=4202640383 TSecr=3502997541"
68,18.45001,192.168.11.28,192.168.11.21,TCP,66,0.006223,,0.006223,"Jan  8, 2024 10:29:31.435891000 JST",,37988  >  6000 [ACK] Seq=29 Ack=2 Win=64256 Len=0 TSval=3502997549 TSecr=4202640383
69,25.508569,192.168.11.21,192.168.11.30,TCP,74,,,7.058559,"Jan  8, 2024 10:29:38.494450000 JST",,43424  >  6000 [SYN] Seq=0 Win=64240 Len=0 MSS=1460 SACK_PERM TSval=2365414572 TSecr=0 WS=128
70,25.517217,192.168.11.30,192.168.11.21,TCP,74,0.008648,,0.008648,"Jan  8, 2024 10:29:38.503098000 JST",,"6000  >  43424 [SYN, ACK] Seq=0 Ack=1 Win=65160 Len=0 MSS=1460 SACK_PERM TSval=1525526766 TSecr=2365414572 WS=128"
71,25.517339,192.168.11.21,192.168.11.30,TCP,66,0.000122,,0.000122,"Jan  8, 2024 10:29:38.503220000 JST",,43424  >  6000 [ACK] Seq=1 Ack=1 Win=64256 Len=0 TSval=2365414581 TSecr=1525526766
72,25.517481,192.168.11.21,192.168.11.30,TCP,93,,,0.000142,"Jan  8, 2024 10:29:38.503362000 JST",,"43424  >  6000 [PSH, ACK] Seq=1 Ack=1 Win=64256 Len=27 TSval=2365414581 TSecr=1525526766 [TCP segment of a reassembled PDU]"
73,25.517609,192.168.11.21,192.168.11.30,TCP,66,,,0.000128,"Jan  8, 2024 10:29:38.503490000 JST",,"43424  >  6000 [FIN, ACK] Seq=28 Ack=1 Win=64256 Len=0 TSval=2365414581 TSecr=1525526766"
74,25.525115,192.168.11.30,192.168.11.21,TCP,66,0.007634,,0.007506,"Jan  8, 2024 10:29:38.510996000 JST",,6000  >  43424 [ACK] Seq=1 Ack=28 Win=65152 Len=0 TSval=1525526774 TSecr=2365414581
75,25.5255,192.168.11.30,192.168.11.21,TCP,66,0.007891,,0.000385,"Jan  8, 2024 10:29:38.511381000 JST",,"6000  >  43424 [FIN, ACK] Seq=1 Ack=29 Win=65152 Len=0 TSval=1525526776 TSecr=2365414581"
76,25.525559,192.168.11.21,192.168.11.30,TCP,66,0.000059,,0.000059,"Jan  8, 2024 10:29:38.511440000 JST",,43424  >  6000 [ACK] Seq=29 Ack=2 Win=64256 Len=0 TSval=2365414589 TSecr=1525526776
77,25.555195,192.168.11.21,255.255.255.255,UDP,209,,Ÿ,0.029636,"Jan  8, 2024 10:29:38.541076000 JST",7b2273656d616e74696373223a207b22656e74697479223a2022504944222c202262617365656e74697479223a2022616e79222c2022726f6c65223a2022696969222c20227370617469616c223a2022616e79222c202274656d706f72616c223a2022616e79227d2c20226461746170726f7065727479223a207b22666f726d6174223a2022696e616f6b615f70726f6772616d5f73616d706c655f73656d616e746963227d7d,37968  >  7000 Len=167
78,25.56079,192.168.11.28,192.168.11.21,TCP,74,,œ,0.005595,"Jan  8, 2024 10:29:38.546671000 JST",,38592  >  6000 [SYN] Seq=0 Win=64240 Len=0 MSS=1460 SACK_PERM TSval=3503004660 TSecr=0 WS=128
79,25.560915,192.168.11.21,192.168.11.28,TCP,74,0.000125,,0.000125,"Jan  8, 2024 10:29:38.546796000 JST",,"6000  >  38592 [SYN, ACK] Seq=0 Ack=1 Win=65160 Len=0 MSS=1460 SACK_PERM TSval=4202647501 TSecr=3503004660 WS=128"
80,25.567551,192.168.11.28,192.168.11.21,TCP,66,0.006636,,0.006636,"Jan  8, 2024 10:29:38.553432000 JST",,38592  >  6000 [ACK] Seq=1 Ack=1 Win=64256 Len=0 TSval=3503004667 TSecr=4202647501
81,25.568154,192.168.11.28,192.168.11.21,TCP,93,,,0.000603,"Jan  8, 2024 10:29:38.554035000 JST",,"38592  >  6000 [PSH, ACK] Seq=1 Ack=1 Win=64256 Len=27 TSval=3503004667 TSecr=4202647501 [TCP segment of a reassembled PDU]"
82,25.568285,192.168.11.21,192.168.11.28,TCP,66,0.000131,,0.000131,"Jan  8, 2024 10:29:38.554166000 JST",,6000  >  38592 [ACK] Seq=1 Ack=28 Win=65152 Len=0 TSval=4202647508 TSecr=3503004667
83,25.568365,192.168.11.28,192.168.11.21,TCP,66,,,0.00008,"Jan  8, 2024 10:29:38.554246000 JST",,"38592  >  6000 [FIN, ACK] Seq=28 Ack=1 Win=64256 Len=0 TSval=3503004667 TSecr=4202647501"
84,25.569381,192.168.11.21,192.168.11.28,TCP,66,0.001016,,0.001016,"Jan  8, 2024 10:29:38.555262000 JST",,"6000  >  38592 [FIN, ACK] Seq=1 Ack=29 Win=65152 Len=0 TSval=4202647509 TSecr=3503004667"
85,25.57567,192.168.11.28,192.168.11.21,TCP,66,0.006289,,0.006289,"Jan  8, 2024 10:29:38.561551000 JST",,38592  >  6000 [ACK] Seq=29 Ack=2 Win=64256 Len=0 TSval=3503004675 TSecr=4202647509
86,31.600937,192.168.11.21,192.168.11.30,TCP,74,,,6.025267,"Jan  8, 2024 10:29:44.586818000 JST",,43432  >  6000 [SYN] Seq=0 Win=64240 Len=0 MSS=1460 SACK_PERM TSval=2365420665 TSecr=0 WS=128
87,31.609621,192.168.11.30,192.168.11.21,TCP,74,0.008684,,0.008684,"Jan  8, 2024 10:29:44.595502000 JST",,"6000  >  43432 [SYN, ACK] Seq=0 Ack=1 Win=65160 Len=0 MSS=1460 SACK_PERM TSval=1525532858 TSecr=2365420665 WS=128"
88,31.609734,192.168.11.21,192.168.11.30,TCP,66,0.000113,,0.000113,"Jan  8, 2024 10:29:44.595615000 JST",,43432  >  6000 [ACK] Seq=1 Ack=1 Win=64256 Len=0 TSval=2365420673 TSecr=1525532858
89,31.609884,192.168.11.21,192.168.11.30,TCP,93,,,0.00015,"Jan  8, 2024 10:29:44.595765000 JST",,"43432  >  6000 [PSH, ACK] Seq=1 Ack=1 Win=64256 Len=27 TSval=2365420674 TSecr=1525532858 [TCP segment of a reassembled PDU]"
90,31.609989,192.168.11.21,192.168.11.30,TCP,66,,,0.000105,"Jan  8, 2024 10:29:44.595870000 JST",,"43432  >  6000 [FIN, ACK] Seq=28 Ack=1 Win=64256 Len=0 TSval=2365420674 TSecr=1525532858"
91,31.61738,192.168.11.30,192.168.11.21,TCP,66,0.007496,,0.007391,"Jan  8, 2024 10:29:44.603261000 JST",,6000  >  43432 [ACK] Seq=1 Ack=28 Win=65152 Len=0 TSval=1525532866 TSecr=2365420674
92,31.617622,192.168.11.30,192.168.11.21,TCP,66,0.007633,,0.000242,"Jan  8, 2024 10:29:44.603503000 JST",,"6000  >  43432 [FIN, ACK] Seq=1 Ack=29 Win=65152 Len=0 TSval=1525532868 TSecr=2365420674"
93,31.617671,192.168.11.21,192.168.11.30,TCP,66,0.000049,,0.000049,"Jan  8, 2024 10:29:44.603552000 JST",,43432  >  6000 [ACK] Seq=29 Ack=2 Win=64256 Len=0 TSval=2365420681 TSecr=1525532868
94,31.64976,192.168.11.21,255.255.255.255,UDP,209,,Ÿ,0.032089,"Jan  8, 2024 10:29:44.635641000 JST",7b2273656d616e74696373223a207b22656e74697479223a2022504944222c202262617365656e74697479223a2022616e79222c2022726f6c65223a2022696969222c20227370617469616c223a2022616e79222c202274656d706f72616c223a2022616e79227d2c20226461746170726f7065727479223a207b22666f726d6174223a2022696e616f6b615f70726f6772616d5f73616d706c655f73656d616e746963227d7d,51992  >  7000 Len=167
95,31.655644,192.168.11.28,192.168.11.21,TCP,74,,œ,0.005884,"Jan  8, 2024 10:29:44.641525000 JST",,38596  >  6000 [SYN] Seq=0 Win=64240 Len=0 MSS=1460 SACK_PERM TSval=3503010755 TSecr=0 WS=128
96,31.65577,192.168.11.21,192.168.11.28,TCP,74,0.000126,,0.000126,"Jan  8, 2024 10:29:44.641651000 JST",,"6000  >  38596 [SYN, ACK] Seq=0 Ack=1 Win=65160 Len=0 MSS=1460 SACK_PERM TSval=4202653595 TSecr=3503010755 WS=128"
97,31.662851,192.168.11.28,192.168.11.21,TCP,66,0.007081,,0.007081,"Jan  8, 2024 10:29:44.648732000 JST",,38596  >  6000 [ACK] Seq=1 Ack=1 Win=64256 Len=0 TSval=3503010762 TSecr=4202653595
98,31.66348,192.168.11.28,192.168.11.21,TCP,93,,,0.000629,"Jan  8, 2024 10:29:44.649361000 JST",,"38596  >  6000 [PSH, ACK] Seq=1 Ack=1 Win=64256 Len=27 TSval=3503010762 TSecr=4202653595 [TCP segment of a reassembled PDU]"
99,31.663578,192.168.11.21,192.168.11.28,TCP,66,0.000098,,0.000098,"Jan  8, 2024 10:29:44.649459000 JST",,6000  >  38596 [ACK] Seq=1 Ack=28 Win=65152 Len=0 TSval=4202653603 TSecr=3503010762
100,31.663665,192.168.11.28,192.168.11.21,TCP,66,,,0.000087,"Jan  8, 2024 10:29:44.649546000 JST",,"38596  >  6000 [FIN, ACK] Seq=28 Ack=1 Win=64256 Len=0 TSval=3503010762 TSecr=4202653595"
101,31.66471,192.168.11.21,192.168.11.28,TCP,66,0.001045,,0.001045,"Jan  8, 2024 10:29:44.650591000 JST",,"6000  >  38596 [FIN, ACK] Seq=1 Ack=29 Win=65152 Len=0 TSval=4202653604 TSecr=3503010762"
102,31.671329,192.168.11.28,192.168.11.21,TCP,66,0.006619,,0.006619,"Jan  8, 2024 10:29:44.657210000 JST",,38596  >  6000 [ACK] Seq=29 Ack=2 Win=64256 Len=0 TSval=3503010770 TSecr=4202653604
103,37.72093,192.168.11.21,192.168.11.30,TCP,74,,,6.049601,"Jan  8, 2024 10:29:50.706811000 JST",,55724  >  6000 [SYN] Seq=0 Win=64240 Len=0 MSS=1460 SACK_PERM TSval=2365426785 TSecr=0 WS=128
104,37.72973,192.168.11.30,192.168.11.21,TCP,74,0.0088,,0.0088,"Jan  8, 2024 10:29:50.715611000 JST",,"6000  >  55724 [SYN, ACK] Seq=0 Ack=1 Win=65160 Len=0 MSS=1460 SACK_PERM TSval=1525538978 TSecr=2365426785 WS=128"
105,37.729869,192.168.11.21,192.168.11.30,TCP,66,0.000139,,0.000139,"Jan  8, 2024 10:29:50.715750000 JST",,55724  >  6000 [ACK] Seq=1 Ack=1 Win=64256 Len=0 TSval=2365426794 TSecr=1525538978
106,37.730021,192.168.11.21,192.168.11.30,TCP,93,,,0.000152,"Jan  8, 2024 10:29:50.715902000 JST",,"55724  >  6000 [PSH, ACK] Seq=1 Ack=1 Win=64256 Len=27 TSval=2365426794 TSecr=1525538978 [TCP segment of a reassembled PDU]"
107,37.730133,192.168.11.21,192.168.11.30,TCP,66,,,0.000112,"Jan  8, 2024 10:29:50.716014000 JST",,"55724  >  6000 [FIN, ACK] Seq=28 Ack=1 Win=64256 Len=0 TSval=2365426794 TSecr=1525538978"
108,37.73737,192.168.11.30,192.168.11.21,TCP,66,0.007349,,0.007237,"Jan  8, 2024 10:29:50.723251000 JST",,6000  >  55724 [ACK] Seq=1 Ack=28 Win=65152 Len=0 TSval=1525538987 TSecr=2365426794
109,37.737762,192.168.11.30,192.168.11.21,TCP,66,0.007629,,0.000392,"Jan  8, 2024 10:29:50.723643000 JST",,"6000  >  55724 [FIN, ACK] Seq=1 Ack=29 Win=65152 Len=0 TSval=1525538988 TSecr=2365426794"
110,37.737833,192.168.11.21,192.168.11.30,TCP,66,0.000071,,0.000071,"Jan  8, 2024 10:29:50.723714000 JST",,55724  >  6000 [ACK] Seq=29 Ack=2 Win=64256 Len=0 TSval=2365426801 TSecr=1525538988
111,37.771033,192.168.11.21,255.255.255.255,UDP,209,,Ÿ,0.0332,"Jan  8, 2024 10:29:50.756914000 JST",7b2273656d616e74696373223a207b22656e74697479223a2022504944222c202262617365656e74697479223a2022616e79222c2022726f6c65223a2022696969222c20227370617469616c223a2022616e79222c202274656d706f72616c223a2022616e79227d2c20226461746170726f7065727479223a207b22666f726d6174223a2022696e616f6b615f70726f6772616d5f73616d706c655f73656d616e746963227d7d,36763  >  7000 Len=167
112,37.776838,192.168.11.28,192.168.11.21,TCP,74,,œ,0.005805,"Jan  8, 2024 10:29:50.762719000 JST",,48762  >  6000 [SYN] Seq=0 Win=64240 Len=0 MSS=1460 SACK_PERM TSval=3503016876 TSecr=0 WS=128
113,37.776998,192.168.11.21,192.168.11.28,TCP,74,0.00016,,0.00016,"Jan  8, 2024 10:29:50.762879000 JST",,"6000  >  48762 [SYN, ACK] Seq=0 Ack=1 Win=65160 Len=0 MSS=1460 SACK_PERM TSval=4202659717 TSecr=3503016876 WS=128"
114,37.784466,192.168.11.28,192.168.11.21,TCP,66,0.007468,,0.007468,"Jan  8, 2024 10:29:50.770347000 JST",,48762  >  6000 [ACK] Seq=1 Ack=1 Win=64256 Len=0 TSval=3503016883 TSecr=4202659717
115,37.78531,192.168.11.28,192.168.11.21,TCP,93,,,0.000844,"Jan  8, 2024 10:29:50.771191000 JST",,"48762  >  6000 [PSH, ACK] Seq=1 Ack=1 Win=64256 Len=27 TSval=3503016884 TSecr=4202659717 [TCP segment of a reassembled PDU]"
116,37.785463,192.168.11.21,192.168.11.28,TCP,66,0.000153,,0.000153,"Jan  8, 2024 10:29:50.771344000 JST",,6000  >  48762 [ACK] Seq=1 Ack=28 Win=65152 Len=0 TSval=4202659725 TSecr=3503016884
117,37.785553,192.168.11.28,192.168.11.21,TCP,66,,,0.00009,"Jan  8, 2024 10:29:50.771434000 JST",,"48762  >  6000 [FIN, ACK] Seq=28 Ack=1 Win=64256 Len=0 TSval=3503016884 TSecr=4202659717"
118,37.787744,192.168.11.21,192.168.11.28,TCP,66,0.002191,,0.002191,"Jan  8, 2024 10:29:50.773625000 JST",,"6000  >  48762 [FIN, ACK] Seq=1 Ack=29 Win=65152 Len=0 TSval=4202659727 TSecr=3503016884"
119,37.794577,192.168.11.28,192.168.11.21,TCP,66,0.006833,,0.006833,"Jan  8, 2024 10:29:50.780458000 JST",,48762  >  6000 [ACK] Seq=29 Ack=2 Win=64256 Len=0 TSval=3503016894 TSecr=4202659727
120,43.845526,192.168.11.21,192.168.11.30,TCP,74,,,6.050949,"Jan  8, 2024 10:29:56.831407000 JST",,37272  >  6000 [SYN] Seq=0 Win=64240 Len=0 MSS=1460 SACK_PERM TSval=2365432909 TSecr=0 WS=128
121,43.853403,192.168.11.30,192.168.11.21,TCP,74,0.007877,,0.007877,"Jan  8, 2024 10:29:56.839284000 JST",,"6000  >  37272 [SYN, ACK] Seq=0 Ack=1 Win=65160 Len=0 MSS=1460 SACK_PERM TSval=1525545102 TSecr=2365432909 WS=128"
122,43.853523,192.168.11.21,192.168.11.30,TCP,66,0.00012,,0.00012,"Jan  8, 2024 10:29:56.839404000 JST",,37272  >  6000 [ACK] Seq=1 Ack=1 Win=64256 Len=0 TSval=2365432917 TSecr=1525545102
123,43.853705,192.168.11.21,192.168.11.30,TCP,93,,,0.000182,"Jan  8, 2024 10:29:56.839586000 JST",,"37272  >  6000 [PSH, ACK] Seq=1 Ack=1 Win=64256 Len=27 TSval=2365432917 TSecr=1525545102 [TCP segment of a reassembled PDU]"
124,43.853817,192.168.11.21,192.168.11.30,TCP,66,,,0.000112,"Jan  8, 2024 10:29:56.839698000 JST",,"37272  >  6000 [FIN, ACK] Seq=28 Ack=1 Win=64256 Len=0 TSval=2365432918 TSecr=1525545102"
125,43.861494,192.168.11.30,192.168.11.21,TCP,66,0.007789,,0.007677,"Jan  8, 2024 10:29:56.847375000 JST",,6000  >  37272 [ACK] Seq=1 Ack=28 Win=65152 Len=0 TSval=1525545110 TSecr=2365432917
126,43.861734,192.168.11.30,192.168.11.21,TCP,66,0.007917,,0.00024,"Jan  8, 2024 10:29:56.847615000 JST",,"6000  >  37272 [FIN, ACK] Seq=1 Ack=29 Win=65152 Len=0 TSval=1525545112 TSecr=2365432918"
127,43.86179,192.168.11.21,192.168.11.30,TCP,66,0.000056,,0.000056,"Jan  8, 2024 10:29:56.847671000 JST",,37272  >  6000 [ACK] Seq=29 Ack=2 Win=64256 Len=0 TSval=2365432925 TSecr=1525545112
128,43.892128,192.168.11.21,255.255.255.255,UDP,209,,Ÿ,0.030338,"Jan  8, 2024 10:29:56.878009000 JST",7b2273656d616e74696373223a207b22656e74697479223a2022504944222c202262617365656e74697479223a2022616e79222c2022726f6c65223a2022696969222c20227370617469616c223a2022616e79222c202274656d706f72616c223a2022616e79227d2c20226461746170726f7065727479223a207b22666f726d6174223a2022696e616f6b615f70726f6772616d5f73616d706c655f73656d616e746963227d7d,40135  >  7000 Len=167
129,43.898149,192.168.11.28,192.168.11.21,TCP,74,,œ,0.006021,"Jan  8, 2024 10:29:56.884030000 JST",,54256  >  6000 [SYN] Seq=0 Win=64240 Len=0 MSS=1460 SACK_PERM TSval=3503022997 TSecr=0 WS=128
130,43.898293,192.168.11.21,192.168.11.28,TCP,74,0.000144,,0.000144,"Jan  8, 2024 10:29:56.884174000 JST",,"6000  >  54256 [SYN, ACK] Seq=0 Ack=1 Win=65160 Len=0 MSS=1460 SACK_PERM TSval=4202665838 TSecr=3503022997 WS=128"
131,43.90942,192.168.11.28,192.168.11.21,TCP,66,0.011127,,0.011127,"Jan  8, 2024 10:29:56.895301000 JST",,54256  >  6000 [ACK] Seq=1 Ack=1 Win=64256 Len=0 TSval=3503023004 TSecr=4202665838
132,43.909999,192.168.11.28,192.168.11.21,TCP,93,,,0.000579,"Jan  8, 2024 10:29:56.895880000 JST",,"54256  >  6000 [PSH, ACK] Seq=1 Ack=1 Win=64256 Len=27 TSval=3503023004 TSecr=4202665838 [TCP segment of a reassembled PDU]"
133,43.910107,192.168.11.21,192.168.11.28,TCP,66,0.000108,,0.000108,"Jan  8, 2024 10:29:56.895988000 JST",,6000  >  54256 [ACK] Seq=1 Ack=28 Win=65152 Len=0 TSval=4202665850 TSecr=3503023004
134,43.910194,192.168.11.28,192.168.11.21,TCP,66,,,0.000087,"Jan  8, 2024 10:29:56.896075000 JST",,"54256  >  6000 [FIN, ACK] Seq=28 Ack=1 Win=64256 Len=0 TSval=3503023005 TSecr=4202665838"
135,43.913218,192.168.11.21,192.168.11.28,TCP,66,0.003024,,0.003024,"Jan  8, 2024 10:29:56.899099000 JST",,"6000  >  54256 [FIN, ACK] Seq=1 Ack=29 Win=65152 Len=0 TSval=4202665853 TSecr=3503023005"
136,43.920423,192.168.11.28,192.168.11.21,TCP,66,0.007205,,0.007205,"Jan  8, 2024 10:29:56.906304000 JST",,54256  >  6000 [ACK] Seq=29 Ack=2 Win=64256 Len=0 TSval=3503023019 TSecr=4202665853
137,49.928918,192.168.11.21,192.168.11.30,TCP,74,,,6.008495,"Jan  8, 2024 10:30:02.914799000 JST",,37282  >  6000 [SYN] Seq=0 Win=64240 Len=0 MSS=1460 SACK_PERM TSval=2365438993 TSecr=0 WS=128
138,49.936559,192.168.11.30,192.168.11.21,TCP,74,0.007641,,0.007641,"Jan  8, 2024 10:30:02.922440000 JST",,"6000  >  37282 [SYN, ACK] Seq=0 Ack=1 Win=65160 Len=0 MSS=1460 SACK_PERM TSval=1525551186 TSecr=2365438993 WS=128"
139,49.936681,192.168.11.21,192.168.11.30,TCP,66,0.000122,,0.000122,"Jan  8, 2024 10:30:02.922562000 JST",,37282  >  6000 [ACK] Seq=1 Ack=1 Win=64256 Len=0 TSval=2365439000 TSecr=1525551186
140,49.936899,192.168.11.21,192.168.11.30,TCP,93,,,0.000218,"Jan  8, 2024 10:30:02.922780000 JST",,"37282  >  6000 [PSH, ACK] Seq=1 Ack=1 Win=64256 Len=27 TSval=2365439001 TSecr=1525551186 [TCP segment of a reassembled PDU]"
141,49.937014,192.168.11.21,192.168.11.30,TCP,66,,,0.000115,"Jan  8, 2024 10:30:02.922895000 JST",,"37282  >  6000 [FIN, ACK] Seq=28 Ack=1 Win=64256 Len=0 TSval=2365439001 TSecr=1525551186"
142,49.944477,192.168.11.30,192.168.11.21,TCP,66,0.007578,,0.007463,"Jan  8, 2024 10:30:02.930358000 JST",,6000  >  37282 [ACK] Seq=1 Ack=28 Win=65152 Len=0 TSval=1525551193 TSecr=2365439001
143,49.944689,192.168.11.30,192.168.11.21,TCP,66,0.007675,,0.000212,"Jan  8, 2024 10:30:02.930570000 JST",,"6000  >  37282 [FIN, ACK] Seq=1 Ack=29 Win=65152 Len=0 TSval=1525551195 TSecr=2365439001"
144,49.944737,192.168.11.21,192.168.11.30,TCP,66,0.000048,,0.000048,"Jan  8, 2024 10:30:02.930618000 JST",,37282  >  6000 [ACK] Seq=29 Ack=2 Win=64256 Len=0 TSval=2365439008 TSecr=1525551195
145,49.975974,192.168.11.21,255.255.255.255,UDP,209,,Ÿ,0.031237,"Jan  8, 2024 10:30:02.961855000 JST",7b2273656d616e74696373223a207b22656e74697479223a2022504944222c202262617365656e74697479223a2022616e79222c2022726f6c65223a2022696969222c20227370617469616c223a2022616e79222c202274656d706f72616c223a2022616e79227d2c20226461746170726f7065727479223a207b22666f726d6174223a2022696e616f6b615f70726f6772616d5f73616d706c655f73656d616e746963227d7d,46789  >  7000 Len=167
146,49.981673,192.168.11.28,192.168.11.21,TCP,74,,œ,0.005699,"Jan  8, 2024 10:30:02.967554000 JST",,54260  >  6000 [SYN] Seq=0 Win=64240 Len=0 MSS=1460 SACK_PERM TSval=3503029081 TSecr=0 WS=128
147,49.981833,192.168.11.21,192.168.11.28,TCP,74,0.00016,,0.00016,"Jan  8, 2024 10:30:02.967714000 JST",,"6000  >  54260 [SYN, ACK] Seq=0 Ack=1 Win=65160 Len=0 MSS=1460 SACK_PERM TSval=4202671922 TSecr=3503029081 WS=128"
148,49.988566,192.168.11.28,192.168.11.21,TCP,66,0.006733,,0.006733,"Jan  8, 2024 10:30:02.974447000 JST",,54260  >  6000 [ACK] Seq=1 Ack=1 Win=64256 Len=0 TSval=3503029088 TSecr=4202671922
149,49.989148,192.168.11.28,192.168.11.21,TCP,93,,,0.000582,"Jan  8, 2024 10:30:02.975029000 JST",,"54260  >  6000 [PSH, ACK] Seq=1 Ack=1 Win=64256 Len=27 TSval=3503029088 TSecr=4202671922 [TCP segment of a reassembled PDU]"
150,49.989239,192.168.11.21,192.168.11.28,TCP,66,0.000091,,0.000091,"Jan  8, 2024 10:30:02.975120000 JST",,6000  >  54260 [ACK] Seq=1 Ack=28 Win=65152 Len=0 TSval=4202671929 TSecr=3503029088
151,49.989309,192.168.11.28,192.168.11.21,TCP,66,,,0.00007,"Jan  8, 2024 10:30:02.975190000 JST",,"54260  >  6000 [FIN, ACK] Seq=28 Ack=1 Win=64256 Len=0 TSval=3503029088 TSecr=4202671922"
152,49.990508,192.168.11.21,192.168.11.28,TCP,66,0.001199,,0.001199,"Jan  8, 2024 10:30:02.976389000 JST",,"6000  >  54260 [FIN, ACK] Seq=1 Ack=29 Win=65152 Len=0 TSval=4202671930 TSecr=3503029088"
153,49.996967,192.168.11.28,192.168.11.21,TCP,66,0.006459,,0.006459,"Jan  8, 2024 10:30:02.982848000 JST",,54260  >  6000 [ACK] Seq=29 Ack=2 Win=64256 Len=0 TSval=3503029096 TSecr=4202671930
154,56.052897,192.168.11.21,192.168.11.30,TCP,74,,,6.05593,"Jan  8, 2024 10:30:09.038778000 JST",,43122  >  6000 [SYN] Seq=0 Win=64240 Len=0 MSS=1460 SACK_PERM TSval=2365445117 TSecr=0 WS=128
155,56.059539,192.168.11.30,192.168.11.21,TCP,74,0.006642,,0.006642,"Jan  8, 2024 10:30:09.045420000 JST",,"6000  >  43122 [SYN, ACK] Seq=0 Ack=1 Win=65160 Len=0 MSS=1460 SACK_PERM TSval=1525557309 TSecr=2365445117 WS=128"
156,56.059668,192.168.11.21,192.168.11.30,TCP,66,0.000129,,0.000129,"Jan  8, 2024 10:30:09.045549000 JST",,43122  >  6000 [ACK] Seq=1 Ack=1 Win=64256 Len=0 TSval=2365445123 TSecr=1525557309
157,56.059891,192.168.11.21,192.168.11.30,TCP,93,,,0.000223,"Jan  8, 2024 10:30:09.045772000 JST",,"43122  >  6000 [PSH, ACK] Seq=1 Ack=1 Win=64256 Len=27 TSval=2365445124 TSecr=1525557309 [TCP segment of a reassembled PDU]"
158,56.060006,192.168.11.21,192.168.11.30,TCP,66,,,0.000115,"Jan  8, 2024 10:30:09.045887000 JST",,"43122  >  6000 [FIN, ACK] Seq=28 Ack=1 Win=64256 Len=0 TSval=2365445124 TSecr=1525557309"
159,56.067112,192.168.11.30,192.168.11.21,TCP,66,0.007221,,0.007106,"Jan  8, 2024 10:30:09.052993000 JST",,6000  >  43122 [ACK] Seq=1 Ack=28 Win=65152 Len=0 TSval=1525557316 TSecr=2365445124
160,56.067485,192.168.11.30,192.168.11.21,TCP,66,0.007479,,0.000373,"Jan  8, 2024 10:30:09.053366000 JST",,"6000  >  43122 [FIN, ACK] Seq=1 Ack=29 Win=65152 Len=0 TSval=1525557318 TSecr=2365445124"
161,56.067538,192.168.11.21,192.168.11.30,TCP,66,0.000053,,0.000053,"Jan  8, 2024 10:30:09.053419000 JST",,43122  >  6000 [ACK] Seq=29 Ack=2 Win=64256 Len=0 TSval=2365445131 TSecr=1525557318
162,56.097679,192.168.11.21,255.255.255.255,UDP,209,,Ÿ,0.030141,"Jan  8, 2024 10:30:09.083560000 JST",7b2273656d616e74696373223a207b22656e74697479223a2022504944222c202262617365656e74697479223a2022616e79222c2022726f6c65223a2022696969222c20227370617469616c223a2022616e79222c202274656d706f72616c223a2022616e79227d2c20226461746170726f7065727479223a207b22666f726d6174223a2022696e616f6b615f70726f6772616d5f73616d706c655f73656d616e746963227d7d,33525  >  7000 Len=167
163,56.10349,192.168.11.28,192.168.11.21,TCP,74,,œ,0.005811,"Jan  8, 2024 10:30:09.089371000 JST",,38008  >  6000 [SYN] Seq=0 Win=64240 Len=0 MSS=1460 SACK_PERM TSval=3503035203 TSecr=0 WS=128
164,56.10364,192.168.11.21,192.168.11.28,TCP,74,0.00015,,0.00015,"Jan  8, 2024 10:30:09.089521000 JST",,"6000  >  38008 [SYN, ACK] Seq=0 Ack=1 Win=65160 Len=0 MSS=1460 SACK_PERM TSval=4202678043 TSecr=3503035203 WS=128"
165,56.111408,192.168.11.28,192.168.11.21,TCP,66,0.007768,,0.007768,"Jan  8, 2024 10:30:09.097289000 JST",,38008  >  6000 [ACK] Seq=1 Ack=1 Win=64256 Len=0 TSval=3503035210 TSecr=4202678043
166,56.111963,192.168.11.28,192.168.11.21,TCP,93,,,0.000555,"Jan  8, 2024 10:30:09.097844000 JST",,"38008  >  6000 [PSH, ACK] Seq=1 Ack=1 Win=64256 Len=27 TSval=3503035210 TSecr=4202678043 [TCP segment of a reassembled PDU]"
167,56.112053,192.168.11.21,192.168.11.28,TCP,66,0.00009,,0.00009,"Jan  8, 2024 10:30:09.097934000 JST",,6000  >  38008 [ACK] Seq=1 Ack=28 Win=65152 Len=0 TSval=4202678052 TSecr=3503035210
168,56.112132,192.168.11.28,192.168.11.21,TCP,66,,,0.000079,"Jan  8, 2024 10:30:09.098013000 JST",,"38008  >  6000 [FIN, ACK] Seq=28 Ack=1 Win=64256 Len=0 TSval=3503035210 TSecr=4202678043"
169,56.113366,192.168.11.21,192.168.11.28,TCP,66,0.001234,,0.001234,"Jan  8, 2024 10:30:09.099247000 JST",,"6000  >  38008 [FIN, ACK] Seq=1 Ack=29 Win=65152 Len=0 TSval=4202678053 TSecr=3503035210"
170,56.119599,192.168.11.28,192.168.11.21,TCP,66,0.006233,,0.006233,"Jan  8, 2024 10:30:09.105480000 JST",,38008  >  6000 [ACK] Seq=29 Ack=2 Win=64256 Len=0 TSval=3503035218 TSecr=4202678053
171,87.227614,192.168.11.21,192.168.11.30,TCP,74,,,31.108015,"Jan  8, 2024 10:30:40.213495000 JST",,41824  >  6000 [SYN] Seq=0 Win=64240 Len=0 MSS=1460 SACK_PERM TSval=2365476291 TSecr=0 WS=128
172,87.235633,192.168.11.30,192.168.11.21,TCP,74,0.008019,,0.008019,"Jan  8, 2024 10:30:40.221514000 JST",,"6000  >  41824 [SYN, ACK] Seq=0 Ack=1 Win=65160 Len=0 MSS=1460 SACK_PERM TSval=1525588485 TSecr=2365476291 WS=128"
173,87.235751,192.168.11.21,192.168.11.30,TCP,66,0.000118,,0.000118,"Jan  8, 2024 10:30:40.221632000 JST",,41824  >  6000 [ACK] Seq=1 Ack=1 Win=64256 Len=0 TSval=2365476299 TSecr=1525588485
174,87.235943,192.168.11.21,192.168.11.30,TCP,93,,,0.000192,"Jan  8, 2024 10:30:40.221824000 JST",,"41824  >  6000 [PSH, ACK] Seq=1 Ack=1 Win=64256 Len=27 TSval=2365476300 TSecr=1525588485 [TCP segment of a reassembled PDU]"
175,87.236039,192.168.11.21,192.168.11.30,TCP,66,,,0.000096,"Jan  8, 2024 10:30:40.221920000 JST",,"41824  >  6000 [FIN, ACK] Seq=28 Ack=1 Win=64256 Len=0 TSval=2365476300 TSecr=1525588485"
176,87.243293,192.168.11.30,192.168.11.21,TCP,66,0.00735,,0.007254,"Jan  8, 2024 10:30:40.229174000 JST",,6000  >  41824 [ACK] Seq=1 Ack=28 Win=65152 Len=0 TSval=1525588492 TSecr=2365476300
177,87.243534,192.168.11.30,192.168.11.21,TCP,66,0.007495,,0.000241,"Jan  8, 2024 10:30:40.229415000 JST",,"6000  >  41824 [FIN, ACK] Seq=1 Ack=29 Win=65152 Len=0 TSval=1525588494 TSecr=2365476300"
178,87.243593,192.168.11.21,192.168.11.30,TCP,66,0.000059,,0.000059,"Jan  8, 2024 10:30:40.229474000 JST",,41824  >  6000 [ACK] Seq=29 Ack=2 Win=64256 Len=0 TSval=2365476307 TSecr=1525588494
179,87.274638,192.168.11.21,255.255.255.255,UDP,209,,Ÿ,0.031045,"Jan  8, 2024 10:30:40.260519000 JST",7b2273656d616e74696373223a207b22656e74697479223a2022504944222c202262617365656e74697479223a2022616e79222c2022726f6c65223a2022696969222c20227370617469616c223a2022616e79222c202274656d706f72616c223a2022616e79227d2c20226461746170726f7065727479223a207b22666f726d6174223a2022696e616f6b615f70726f6772616d5f73616d706c655f73656d616e746963227d7d,42272  >  7000 Len=167
180,87.280633,192.168.11.28,192.168.11.21,TCP,74,,œ,0.005995,"Jan  8, 2024 10:30:40.266514000 JST",,46794  >  6000 [SYN] Seq=0 Win=64240 Len=0 MSS=1460 SACK_PERM TSval=3503066380 TSecr=0 WS=128
181,87.280803,192.168.11.21,192.168.11.28,TCP,74,0.00017,,0.00017,"Jan  8, 2024 10:30:40.266684000 JST",,"6000  >  46794 [SYN, ACK] Seq=0 Ack=1 Win=65160 Len=0 MSS=1460 SACK_PERM TSval=4202709220 TSecr=3503066380 WS=128"
182,87.291064,192.168.11.28,192.168.11.21,TCP,66,0.010261,,0.010261,"Jan  8, 2024 10:30:40.276945000 JST",,46794  >  6000 [ACK] Seq=1 Ack=1 Win=64256 Len=0 TSval=3503066387 TSecr=4202709220
183,87.291598,192.168.11.28,192.168.11.21,TCP,93,,,0.000534,"Jan  8, 2024 10:30:40.277479000 JST",,"46794  >  6000 [PSH, ACK] Seq=1 Ack=1 Win=64256 Len=27 TSval=3503066387 TSecr=4202709220 [TCP segment of a reassembled PDU]"
184,87.291693,192.168.11.21,192.168.11.28,TCP,66,0.000095,,0.000095,"Jan  8, 2024 10:30:40.277574000 JST",,6000  >  46794 [ACK] Seq=1 Ack=28 Win=65152 Len=0 TSval=4202709231 TSecr=3503066387
