No.,Time,Source,Destination,Protocol,Length,The RTT to ACK the segment was,XXX,Time delta from previous captured frame,Arrival Time,Data,Info
1,0,192.168.11.28,192.168.11.21,TCP,74,,,0,"Jan  8, 2024 10:29:13.038965000 JST",,46076  >  6000 [SYN] Seq=0 Win=64240 Len=0 MSS=1460 SACK_PERM TSval=3502979154 TSecr=0 WS=128
2,0.007808,192.168.11.21,192.168.11.28,TCP,74,0.007808,,0.007808,"Jan  8, 2024 10:29:13.046773000 JST",,"6000  >  46076 [SYN, ACK] Seq=0 Ack=1 Win=65160 Len=0 MSS=1460 SACK_PERM TSval=4202621995 TSecr=3502979154 WS=128"
3,0.007927,192.168.11.28,192.168.11.21,TCP,66,0.000119,,0.000119,"Jan  8, 2024 10:29:13.046892000 JST",,46076  >  6000 [ACK] Seq=1 Ack=1 Win=64256 Len=0 TSval=3502979162 TSecr=4202621995
4,0.008104,192.168.11.28,192.168.11.21,TCP,93,,,0.000177,"Jan  8, 2024 10:29:13.047069000 JST",,"46076  >  6000 [PSH, ACK] Seq=1 Ack=1 Win=64256 Len=27 TSval=3502979162 TSecr=4202621995 [TCP segment of a reassembled PDU]"
5,0.008291,192.168.11.28,192.168.11.21,TCP,66,,,0.000187,"Jan  8, 2024 10:29:13.047256000 JST",,"46076  >  6000 [FIN, ACK] Seq=28 Ack=1 Win=64256 Len=0 TSval=3502979163 TSecr=4202621995"
6,0.015544,192.168.11.21,192.168.11.28,TCP,66,0.00744,,0.007253,"Jan  8, 2024 10:29:13.054509000 JST",,6000  >  46076 [ACK] Seq=1 Ack=28 Win=65152 Len=0 TSval=4202622003 TSecr=3502979162
7,0.015965,192.168.11.21,192.168.11.28,TCP,66,0.007674,,0.000421,"Jan  8, 2024 10:29:13.054930000 JST",,"6000  >  46076 [FIN, ACK] Seq=1 Ack=29 Win=65152 Len=0 TSval=4202622005 TSecr=3502979163"
8,0.016013,192.168.11.28,192.168.11.21,TCP,66,0.000048,,0.000048,"Jan  8, 2024 10:29:13.054978000 JST",,46076  >  6000 [ACK] Seq=29 Ack=2 Win=64256 Len=0 TSval=3502979170 TSecr=4202622005
9,0.045141,192.168.11.28,255.255.255.255,UDP,209,,Ÿ,0.029128,"Jan  8, 2024 10:29:13.084106000 JST",7b2273656d616e74696373223a207b22656e74697479223a2022504944222c202262617365656e74697479223a2022616e79222c2022726f6c65223a20226a6a6a222c20227370617469616c223a2022616e79222c202274656d706f72616c223a2022616e79227d2c20226461746170726f7065727479223a207b22666f726d6174223a2022696e616f6b615f70726f6772616d5f73616d706c655f73656d616e746963227d7d,39314  >  7000 Len=167
10,0.05233,192.168.11.7,192.168.11.28,TCP,74,,œ,0.007189,"Jan  8, 2024 10:29:13.091295000 JST",,54870  >  6000 [SYN] Seq=0 Win=64240 Len=0 MSS=1460 SACK_PERM TSval=612737166 TSecr=0 WS=128
11,0.052487,192.168.11.28,192.168.11.7,TCP,74,0.000157,,0.000157,"Jan  8, 2024 10:29:13.091452000 JST",,"6000  >  54870 [SYN, ACK] Seq=0 Ack=1 Win=65160 Len=0 MSS=1460 SACK_PERM TSval=2659280946 TSecr=612737166 WS=128"
12,0.073019,192.168.11.7,192.168.11.28,TCP,66,0.020532,,0.020532,"Jan  8, 2024 10:29:13.111984000 JST",,54870  >  6000 [ACK] Seq=1 Ack=1 Win=64256 Len=0 TSval=612737175 TSecr=2659280946
13,0.073581,192.168.11.7,192.168.11.28,TCP,93,,,0.000562,"Jan  8, 2024 10:29:13.112546000 JST",,"54870  >  6000 [PSH, ACK] Seq=1 Ack=1 Win=64256 Len=27 TSval=612737175 TSecr=2659280946 [TCP segment of a reassembled PDU]"
14,0.073659,192.168.11.28,192.168.11.7,TCP,66,0.000078,,0.000078,"Jan  8, 2024 10:29:13.112624000 JST",,6000  >  54870 [ACK] Seq=1 Ack=28 Win=65152 Len=0 TSval=2659280967 TSecr=612737175
15,0.073726,192.168.11.7,192.168.11.28,TCP,66,,,0.000067,"Jan  8, 2024 10:29:13.112691000 JST",,"54870  >  6000 [FIN, ACK] Seq=28 Ack=1 Win=64256 Len=0 TSval=612737175 TSecr=2659280946"
16,0.074838,192.168.11.28,192.168.11.7,TCP,66,0.001112,,0.001112,"Jan  8, 2024 10:29:13.113803000 JST",,"6000  >  54870 [FIN, ACK] Seq=1 Ack=29 Win=65152 Len=0 TSval=2659280968 TSecr=612737175"
17,0.080896,192.168.11.7,192.168.11.28,TCP,66,0.006058,,0.006058,"Jan  8, 2024 10:29:13.119861000 JST",,54870  >  6000 [ACK] Seq=29 Ack=2 Win=64256 Len=0 TSval=612737195 TSecr=2659280968
18,6.174049,192.168.11.28,192.168.11.21,TCP,74,,,6.093153,"Jan  8, 2024 10:29:19.213014000 JST",,48128  >  6000 [SYN] Seq=0 Win=64240 Len=0 MSS=1460 SACK_PERM TSval=3502985328 TSecr=0 WS=128
19,6.181129,192.168.11.21,192.168.11.28,TCP,74,0.00708,,0.00708,"Jan  8, 2024 10:29:19.220094000 JST",,"6000  >  48128 [SYN, ACK] Seq=0 Ack=1 Win=65160 Len=0 MSS=1460 SACK_PERM TSval=4202628169 TSecr=3502985328 WS=128"
20,6.18124,192.168.11.28,192.168.11.21,TCP,66,0.000111,,0.000111,"Jan  8, 2024 10:29:19.220205000 JST",,48128  >  6000 [ACK] Seq=1 Ack=1 Win=64256 Len=0 TSval=3502985336 TSecr=4202628169
21,6.181432,192.168.11.28,192.168.11.21,TCP,93,,,0.000192,"Jan  8, 2024 10:29:19.220397000 JST",,"48128  >  6000 [PSH, ACK] Seq=1 Ack=1 Win=64256 Len=27 TSval=3502985336 TSecr=4202628169 [TCP segment of a reassembled PDU]"
22,6.181556,192.168.11.28,192.168.11.21,TCP,66,,,0.000124,"Jan  8, 2024 10:29:19.220521000 JST",,"48128  >  6000 [FIN, ACK] Seq=28 Ack=1 Win=64256 Len=0 TSval=3502985336 TSecr=4202628169"
23,6.188759,192.168.11.21,192.168.11.28,TCP,66,0.007327,,0.007203,"Jan  8, 2024 10:29:19.227724000 JST",,6000  >  48128 [ACK] Seq=1 Ack=28 Win=65152 Len=0 TSval=4202628177 TSecr=3502985336
24,6.189124,192.168.11.21,192.168.11.28,TCP,66,0.007568,,0.000365,"Jan  8, 2024 10:29:19.228089000 JST",,"6000  >  48128 [FIN, ACK] Seq=1 Ack=29 Win=65152 Len=0 TSval=4202628178 TSecr=3502985336"
25,6.189177,192.168.11.28,192.168.11.21,TCP,66,0.000053,,0.000053,"Jan  8, 2024 10:29:19.228142000 JST",,48128  >  6000 [ACK] Seq=29 Ack=2 Win=64256 Len=0 TSval=3502985343 TSecr=4202628178
26,6.220045,192.168.11.28,255.255.255.255,UDP,209,,Ÿ,0.030868,"Jan  8, 2024 10:29:19.259010000 JST",7b2273656d616e74696373223a207b22656e74697479223a2022504944222c202262617365656e74697479223a2022616e79222c2022726f6c65223a20226a6a6a222c20227370617469616c223a2022616e79222c202274656d706f72616c223a2022616e79227d2c20226461746170726f7065727479223a207b22666f726d6174223a2022696e616f6b615f70726f6772616d5f73616d706c655f73656d616e746963227d7d,38608  >  7000 Len=167
27,6.226423,192.168.11.7,192.168.11.28,TCP,74,,œ,0.006378,"Jan  8, 2024 10:29:19.265388000 JST",,41894  >  6000 [SYN] Seq=0 Win=64240 Len=0 MSS=1460 SACK_PERM TSval=612743340 TSecr=0 WS=128
28,6.226586,192.168.11.28,192.168.11.7,TCP,74,0.000163,,0.000163,"Jan  8, 2024 10:29:19.265551000 JST",,"6000  >  41894 [SYN, ACK] Seq=0 Ack=1 Win=65160 Len=0 MSS=1460 SACK_PERM TSval=2659287120 TSecr=612743340 WS=128"
29,6.233902,192.168.11.7,192.168.11.28,TCP,66,0.007316,,0.007316,"Jan  8, 2024 10:29:19.272867000 JST",,41894  >  6000 [ACK] Seq=1 Ack=1 Win=64256 Len=0 TSval=612743348 TSecr=2659287120
30,6.234552,192.168.11.7,192.168.11.28,TCP,93,,,0.00065,"Jan  8, 2024 10:29:19.273517000 JST",,"41894  >  6000 [PSH, ACK] Seq=1 Ack=1 Win=64256 Len=27 TSval=612743349 TSecr=2659287120 [TCP segment of a reassembled PDU]"
31,6.234653,192.168.11.28,192.168.11.7,TCP,66,0.000101,,0.000101,"Jan  8, 2024 10:29:19.273618000 JST",,6000  >  41894 [ACK] Seq=1 Ack=28 Win=65152 Len=0 TSval=2659287128 TSecr=612743349
32,6.23473,192.168.11.7,192.168.11.28,TCP,66,,,0.000077,"Jan  8, 2024 10:29:19.273695000 JST",,"41894  >  6000 [FIN, ACK] Seq=28 Ack=1 Win=64256 Len=0 TSval=612743349 TSecr=2659287120"
33,6.236929,192.168.11.28,192.168.11.7,TCP,66,0.002199,,0.002199,"Jan  8, 2024 10:29:19.275894000 JST",,"6000  >  41894 [FIN, ACK] Seq=1 Ack=29 Win=65152 Len=0 TSval=2659287130 TSecr=612743349"
34,6.242953,192.168.11.7,192.168.11.28,TCP,66,0.006024,,0.006024,"Jan  8, 2024 10:29:19.281918000 JST",,41894  >  6000 [ACK] Seq=29 Ack=2 Win=64256 Len=0 TSval=612743357 TSecr=2659287130
35,12.270212,192.168.11.28,192.168.11.21,TCP,74,,,6.027259,"Jan  8, 2024 10:29:25.309177000 JST",,48132  >  6000 [SYN] Seq=0 Win=64240 Len=0 MSS=1460 SACK_PERM TSval=3502991425 TSecr=0 WS=128
36,12.276957,192.168.11.21,192.168.11.28,TCP,74,0.006745,,0.006745,"Jan  8, 2024 10:29:25.315922000 JST",,"6000  >  48132 [SYN, ACK] Seq=0 Ack=1 Win=65160 Len=0 MSS=1460 SACK_PERM TSval=4202634265 TSecr=3502991425 WS=128"
37,12.277064,192.168.11.28,192.168.11.21,TCP,66,0.000107,,0.000107,"Jan  8, 2024 10:29:25.316029000 JST",,48132  >  6000 [ACK] Seq=1 Ack=1 Win=64256 Len=0 TSval=3502991431 TSecr=4202634265
38,12.277244,192.168.11.28,192.168.11.21,TCP,93,,,0.00018,"Jan  8, 2024 10:29:25.316209000 JST",,"48132  >  6000 [PSH, ACK] Seq=1 Ack=1 Win=64256 Len=27 TSval=3502991432 TSecr=4202634265 [TCP segment of a reassembled PDU]"
39,12.27735,192.168.11.28,192.168.11.21,TCP,66,,,0.000106,"Jan  8, 2024 10:29:25.316315000 JST",,"48132  >  6000 [FIN, ACK] Seq=28 Ack=1 Win=64256 Len=0 TSval=3502991432 TSecr=4202634265"
40,12.284632,192.168.11.21,192.168.11.28,TCP,66,0.007388,,0.007282,"Jan  8, 2024 10:29:25.323597000 JST",,6000  >  48132 [ACK] Seq=1 Ack=28 Win=65152 Len=0 TSval=4202634273 TSecr=3502991432
41,12.285027,192.168.11.21,192.168.11.28,TCP,66,0.007677,,0.000395,"Jan  8, 2024 10:29:25.323992000 JST",,"6000  >  48132 [FIN, ACK] Seq=1 Ack=29 Win=65152 Len=0 TSval=4202634274 TSecr=3502991432"
42,12.285082,192.168.11.28,192.168.11.21,TCP,66,0.000055,,0.000055,"Jan  8, 2024 10:29:25.324047000 JST",,48132  >  6000 [ACK] Seq=29 Ack=2 Win=64256 Len=0 TSval=3502991439 TSecr=4202634274
43,12.313951,192.168.11.28,255.255.255.255,UDP,209,,Ÿ,0.028869,"Jan  8, 2024 10:29:25.352916000 JST",7b2273656d616e74696373223a207b22656e74697479223a2022504944222c202262617365656e74697479223a2022616e79222c2022726f6c65223a20226a6a6a222c20227370617469616c223a2022616e79222c202274656d706f72616c223a2022616e79227d2c20226461746170726f7065727479223a207b22666f726d6174223a2022696e616f6b615f70726f6772616d5f73616d706c655f73656d616e746963227d7d,43009  >  7000 Len=167
44,12.319664,192.168.11.7,192.168.11.28,TCP,74,,œ,0.005713,"Jan  8, 2024 10:29:25.358629000 JST",,60484  >  6000 [SYN] Seq=0 Win=64240 Len=0 MSS=1460 SACK_PERM TSval=612749434 TSecr=0 WS=128
45,12.319786,192.168.11.28,192.168.11.7,TCP,74,0.000122,,0.000122,"Jan  8, 2024 10:29:25.358751000 JST",,"6000  >  60484 [SYN, ACK] Seq=0 Ack=1 Win=65160 Len=0 MSS=1460 SACK_PERM TSval=2659293213 TSecr=612749434 WS=128"
46,12.326853,192.168.11.7,192.168.11.28,TCP,66,0.007067,,0.007067,"Jan  8, 2024 10:29:25.365818000 JST",,60484  >  6000 [ACK] Seq=1 Ack=1 Win=64256 Len=0 TSval=612749441 TSecr=2659293213
47,12.327433,192.168.11.7,192.168.11.28,TCP,93,,,0.00058,"Jan  8, 2024 10:29:25.366398000 JST",,"60484  >  6000 [PSH, ACK] Seq=1 Ack=1 Win=64256 Len=27 TSval=612749442 TSecr=2659293213 [TCP segment of a reassembled PDU]"
48,12.327537,192.168.11.28,192.168.11.7,TCP,66,0.000104,,0.000104,"Jan  8, 2024 10:29:25.366502000 JST",,6000  >  60484 [ACK] Seq=1 Ack=28 Win=65152 Len=0 TSval=2659293221 TSecr=612749442
49,12.327615,192.168.11.7,192.168.11.28,TCP,66,,,0.000078,"Jan  8, 2024 10:29:25.366580000 JST",,"60484  >  6000 [FIN, ACK] Seq=28 Ack=1 Win=64256 Len=0 TSval=612749442 TSecr=2659293213"
50,12.329879,192.168.11.28,192.168.11.7,TCP,66,0.002264,,0.002264,"Jan  8, 2024 10:29:25.368844000 JST",,"6000  >  60484 [FIN, ACK] Seq=1 Ack=29 Win=65152 Len=0 TSval=2659293223 TSecr=612749442"
51,12.338656,192.168.11.7,192.168.11.28,TCP,66,0.008777,,0.008777,"Jan  8, 2024 10:29:25.377621000 JST",,60484  >  6000 [ACK] Seq=29 Ack=2 Win=64256 Len=0 TSval=612749451 TSecr=2659293223
52,18.378741,192.168.11.28,192.168.11.21,TCP,74,,,6.040085,"Jan  8, 2024 10:29:31.417706000 JST",,37988  >  6000 [SYN] Seq=0 Win=64240 Len=0 MSS=1460 SACK_PERM TSval=3502997533 TSecr=0 WS=128
53,18.386454,192.168.11.21,192.168.11.28,TCP,74,0.007713,,0.007713,"Jan  8, 2024 10:29:31.425419000 JST",,"6000  >  37988 [SYN, ACK] Seq=0 Ack=1 Win=65160 Len=0 MSS=1460 SACK_PERM TSval=4202640374 TSecr=3502997533 WS=128"
54,18.386566,192.168.11.28,192.168.11.21,TCP,66,0.000112,,0.000112,"Jan  8, 2024 10:29:31.425531000 JST",,37988  >  6000 [ACK] Seq=1 Ack=1 Win=64256 Len=0 TSval=3502997541 TSecr=4202640374
55,18.386752,192.168.11.28,192.168.11.21,TCP,93,,,0.000186,"Jan  8, 2024 10:29:31.425717000 JST",,"37988  >  6000 [PSH, ACK] Seq=1 Ack=1 Win=64256 Len=27 TSval=3502997541 TSecr=4202640374 [TCP segment of a reassembled PDU]"
56,18.386876,192.168.11.28,192.168.11.21,TCP,66,,,0.000124,"Jan  8, 2024 10:29:31.425841000 JST",,"37988  >  6000 [FIN, ACK] Seq=28 Ack=1 Win=64256 Len=0 TSval=3502997541 TSecr=4202640374"
57,18.394119,192.168.11.21,192.168.11.28,TCP,66,0.007367,,0.007243,"Jan  8, 2024 10:29:31.433084000 JST",,6000  >  37988 [ACK] Seq=1 Ack=28 Win=65152 Len=0 TSval=4202640382 TSecr=3502997541
58,18.394493,192.168.11.21,192.168.11.28,TCP,66,0.007617,,0.000374,"Jan  8, 2024 10:29:31.433458000 JST",,"6000  >  37988 [FIN, ACK] Seq=1 Ack=29 Win=65152 Len=0 TSval=4202640383 TSecr=3502997541"
59,18.394552,192.168.11.28,192.168.11.21,TCP,66,0.000059,,0.000059,"Jan  8, 2024 10:29:31.433517000 JST",,37988  >  6000 [ACK] Seq=29 Ack=2 Win=64256 Len=0 TSval=3502997549 TSecr=4202640383
60,18.423475,192.168.11.28,255.255.255.255,UDP,209,,Ÿ,0.028923,"Jan  8, 2024 10:29:31.462440000 JST",7b2273656d616e74696373223a207b22656e74697479223a2022504944222c202262617365656e74697479223a2022616e79222c2022726f6c65223a20226a6a6a222c20227370617469616c223a2022616e79222c202274656d706f72616c223a2022616e79227d2c20226461746170726f7065727479223a207b22666f726d6174223a2022696e616f6b615f70726f6772616d5f73616d706c655f73656d616e746963227d7d,48081  >  7000 Len=167
61,18.42918,192.168.11.7,192.168.11.28,TCP,74,,œ,0.005705,"Jan  8, 2024 10:29:31.468145000 JST",,60500  >  6000 [SYN] Seq=0 Win=64240 Len=0 MSS=1460 SACK_PERM TSval=612755544 TSecr=0 WS=128
62,18.429315,192.168.11.28,192.168.11.7,TCP,74,0.000135,,0.000135,"Jan  8, 2024 10:29:31.468280000 JST",,"6000  >  60500 [SYN, ACK] Seq=0 Ack=1 Win=65160 Len=0 MSS=1460 SACK_PERM TSval=2659299323 TSecr=612755544 WS=128"
63,18.437177,192.168.11.7,192.168.11.28,TCP,66,0.007862,,0.007862,"Jan  8, 2024 10:29:31.476142000 JST",,60500  >  6000 [ACK] Seq=1 Ack=1 Win=64256 Len=0 TSval=612755551 TSecr=2659299323
64,18.437818,192.168.11.7,192.168.11.28,TCP,93,,,0.000641,"Jan  8, 2024 10:29:31.476783000 JST",,"60500  >  6000 [PSH, ACK] Seq=1 Ack=1 Win=64256 Len=27 TSval=612755552 TSecr=2659299323 [TCP segment of a reassembled PDU]"
65,18.437931,192.168.11.28,192.168.11.7,TCP,66,0.000113,,0.000113,"Jan  8, 2024 10:29:31.476896000 JST",,6000  >  60500 [ACK] Seq=1 Ack=28 Win=65152 Len=0 TSval=2659299331 TSecr=612755552
66,18.438012,192.168.11.7,192.168.11.28,TCP,66,,,0.000081,"Jan  8, 2024 10:29:31.476977000 JST",,"60500  >  6000 [FIN, ACK] Seq=28 Ack=1 Win=64256 Len=0 TSval=612755552 TSecr=2659299323"
67,18.440234,192.168.11.28,192.168.11.7,TCP,66,0.002222,,0.002222,"Jan  8, 2024 10:29:31.479199000 JST",,"6000  >  60500 [FIN, ACK] Seq=1 Ack=29 Win=65152 Len=0 TSval=2659299333 TSecr=612755552"
68,18.449606,192.168.11.7,192.168.11.28,TCP,66,0.009372,,0.009372,"Jan  8, 2024 10:29:31.488571000 JST",,60500  >  6000 [ACK] Seq=29 Ack=2 Win=64256 Len=0 TSval=612755563 TSecr=2659299333
69,25.505889,192.168.11.28,192.168.11.21,TCP,74,,,7.056283,"Jan  8, 2024 10:29:38.544854000 JST",,38592  >  6000 [SYN] Seq=0 Win=64240 Len=0 MSS=1460 SACK_PERM TSval=3503004660 TSecr=0 WS=128
70,25.512474,192.168.11.21,192.168.11.28,TCP,74,0.006585,,0.006585,"Jan  8, 2024 10:29:38.551439000 JST",,"6000  >  38592 [SYN, ACK] Seq=0 Ack=1 Win=65160 Len=0 MSS=1460 SACK_PERM TSval=4202647501 TSecr=3503004660 WS=128"
71,25.512588,192.168.11.28,192.168.11.21,TCP,66,0.000114,,0.000114,"Jan  8, 2024 10:29:38.551553000 JST",,38592  >  6000 [ACK] Seq=1 Ack=1 Win=64256 Len=0 TSval=3503004667 TSecr=4202647501
72,25.512783,192.168.11.28,192.168.11.21,TCP,93,,,0.000195,"Jan  8, 2024 10:29:38.551748000 JST",,"38592  >  6000 [PSH, ACK] Seq=1 Ack=1 Win=64256 Len=27 TSval=3503004667 TSecr=4202647501 [TCP segment of a reassembled PDU]"
73,25.512908,192.168.11.28,192.168.11.21,TCP,66,,,0.000125,"Jan  8, 2024 10:29:38.551873000 JST",,"38592  >  6000 [FIN, ACK] Seq=28 Ack=1 Win=64256 Len=0 TSval=3503004667 TSecr=4202647501"
74,25.519969,192.168.11.21,192.168.11.28,TCP,66,0.007186,,0.007061,"Jan  8, 2024 10:29:38.558934000 JST",,6000  >  38592 [ACK] Seq=1 Ack=28 Win=65152 Len=0 TSval=4202647508 TSecr=3503004667
75,25.520353,192.168.11.21,192.168.11.28,TCP,66,0.007445,,0.000384,"Jan  8, 2024 10:29:38.559318000 JST",,"6000  >  38592 [FIN, ACK] Seq=1 Ack=29 Win=65152 Len=0 TSval=4202647509 TSecr=3503004667"
76,25.520409,192.168.11.28,192.168.11.21,TCP,66,0.000056,,0.000056,"Jan  8, 2024 10:29:38.559374000 JST",,38592  >  6000 [ACK] Seq=29 Ack=2 Win=64256 Len=0 TSval=3503004675 TSecr=4202647509
77,25.548229,192.168.11.28,255.255.255.255,UDP,209,,Ÿ,0.02782,"Jan  8, 2024 10:29:38.587194000 JST",7b2273656d616e74696373223a207b22656e74697479223a2022504944222c202262617365656e74697479223a2022616e79222c2022726f6c65223a20226a6a6a222c20227370617469616c223a2022616e79222c202274656d706f72616c223a2022616e79227d2c20226461746170726f7065727479223a207b22666f726d6174223a2022696e616f6b615f70726f6772616d5f73616d706c655f73656d616e746963227d7d,51088  >  7000 Len=167
78,25.554822,192.168.11.7,192.168.11.28,TCP,74,,œ,0.006593,"Jan  8, 2024 10:29:38.593787000 JST",,58122  >  6000 [SYN] Seq=0 Win=64240 Len=0 MSS=1460 SACK_PERM TSval=612762668 TSecr=0 WS=128
79,25.554955,192.168.11.28,192.168.11.7,TCP,74,0.000133,,0.000133,"Jan  8, 2024 10:29:38.593920000 JST",,"6000  >  58122 [SYN, ACK] Seq=0 Ack=1 Win=65160 Len=0 MSS=1460 SACK_PERM TSval=2659306448 TSecr=612762668 WS=128"
80,25.561721,192.168.11.7,192.168.11.28,TCP,66,0.006766,,0.006766,"Jan  8, 2024 10:29:38.600686000 JST",,58122  >  6000 [ACK] Seq=1 Ack=1 Win=64256 Len=0 TSval=612762676 TSecr=2659306448
81,25.562378,192.168.11.7,192.168.11.28,TCP,93,,,0.000657,"Jan  8, 2024 10:29:38.601343000 JST",,"58122  >  6000 [PSH, ACK] Seq=1 Ack=1 Win=64256 Len=27 TSval=612762676 TSecr=2659306448 [TCP segment of a reassembled PDU]"
82,25.562481,192.168.11.28,192.168.11.7,TCP,66,0.000103,,0.000103,"Jan  8, 2024 10:29:38.601446000 JST",,6000  >  58122 [ACK] Seq=1 Ack=28 Win=65152 Len=0 TSval=2659306456 TSecr=612762676
83,25.562552,192.168.11.7,192.168.11.28,TCP,66,,,0.000071,"Jan  8, 2024 10:29:38.601517000 JST",,"58122  >  6000 [FIN, ACK] Seq=28 Ack=1 Win=64256 Len=0 TSval=612762676 TSecr=2659306448"
84,25.564924,192.168.11.28,192.168.11.7,TCP,66,0.002372,,0.002372,"Jan  8, 2024 10:29:38.603889000 JST",,"6000  >  58122 [FIN, ACK] Seq=1 Ack=29 Win=65152 Len=0 TSval=2659306458 TSecr=612762676"
85,25.572361,192.168.11.7,192.168.11.28,TCP,66,0.007437,,0.007437,"Jan  8, 2024 10:29:38.611326000 JST",,58122  >  6000 [ACK] Seq=29 Ack=2 Win=64256 Len=0 TSval=612762686 TSecr=2659306458
86,31.60058,192.168.11.28,192.168.11.21,TCP,74,,,6.028219,"Jan  8, 2024 10:29:44.639545000 JST",,38596  >  6000 [SYN] Seq=0 Win=64240 Len=0 MSS=1460 SACK_PERM TSval=3503010755 TSecr=0 WS=128
87,31.607641,192.168.11.21,192.168.11.28,TCP,74,0.007061,,0.007061,"Jan  8, 2024 10:29:44.646606000 JST",,"6000  >  38596 [SYN, ACK] Seq=0 Ack=1 Win=65160 Len=0 MSS=1460 SACK_PERM TSval=4202653595 TSecr=3503010755 WS=128"
88,31.607761,192.168.11.28,192.168.11.21,TCP,66,0.00012,,0.00012,"Jan  8, 2024 10:29:44.646726000 JST",,38596  >  6000 [ACK] Seq=1 Ack=1 Win=64256 Len=0 TSval=3503010762 TSecr=4202653595
89,31.607935,192.168.11.28,192.168.11.21,TCP,93,,,0.000174,"Jan  8, 2024 10:29:44.646900000 JST",,"38596  >  6000 [PSH, ACK] Seq=1 Ack=1 Win=64256 Len=27 TSval=3503010762 TSecr=4202653595 [TCP segment of a reassembled PDU]"
90,31.608041,192.168.11.28,192.168.11.21,TCP,66,,,0.000106,"Jan  8, 2024 10:29:44.647006000 JST",,"38596  >  6000 [FIN, ACK] Seq=28 Ack=1 Win=64256 Len=0 TSval=3503010762 TSecr=4202653595"
91,31.615296,192.168.11.21,192.168.11.28,TCP,66,0.007361,,0.007255,"Jan  8, 2024 10:29:44.654261000 JST",,6000  >  38596 [ACK] Seq=1 Ack=28 Win=65152 Len=0 TSval=4202653603 TSecr=3503010762
92,31.615683,192.168.11.21,192.168.11.28,TCP,66,0.007642,,0.000387,"Jan  8, 2024 10:29:44.654648000 JST",,"6000  >  38596 [FIN, ACK] Seq=1 Ack=29 Win=65152 Len=0 TSval=4202653604 TSecr=3503010762"
93,31.615756,192.168.11.28,192.168.11.21,TCP,66,0.000073,,0.000073,"Jan  8, 2024 10:29:44.654721000 JST",,38596  >  6000 [ACK] Seq=29 Ack=2 Win=64256 Len=0 TSval=3503010770 TSecr=4202653604
94,31.644728,192.168.11.28,255.255.255.255,UDP,209,,Ÿ,0.028972,"Jan  8, 2024 10:29:44.683693000 JST",7b2273656d616e74696373223a207b22656e74697479223a2022504944222c202262617365656e74697479223a2022616e79222c2022726f6c65223a20226a6a6a222c20227370617469616c223a2022616e79222c202274656d706f72616c223a2022616e79227d2c20226461746170726f7065727479223a207b22666f726d6174223a2022696e616f6b615f70726f6772616d5f73616d706c655f73656d616e746963227d7d,50861  >  7000 Len=167
95,31.651453,192.168.11.7,192.168.11.28,TCP,74,,œ,0.006725,"Jan  8, 2024 10:29:44.690418000 JST",,59550  >  6000 [SYN] Seq=0 Win=64240 Len=0 MSS=1460 SACK_PERM TSval=612768765 TSecr=0 WS=128
96,31.651597,192.168.11.28,192.168.11.7,TCP,74,0.000144,,0.000144,"Jan  8, 2024 10:29:44.690562000 JST",,"6000  >  59550 [SYN, ACK] Seq=0 Ack=1 Win=65160 Len=0 MSS=1460 SACK_PERM TSval=2659312545 TSecr=612768765 WS=128"
97,31.668905,192.168.11.7,192.168.11.28,TCP,66,0.017308,,0.017308,"Jan  8, 2024 10:29:44.707870000 JST",,59550  >  6000 [ACK] Seq=1 Ack=1 Win=64256 Len=0 TSval=612768776 TSecr=2659312545
98,31.66969,192.168.11.7,192.168.11.28,TCP,93,,,0.000785,"Jan  8, 2024 10:29:44.708655000 JST",,"59550  >  6000 [PSH, ACK] Seq=1 Ack=1 Win=64256 Len=27 TSval=612768776 TSecr=2659312545 [TCP segment of a reassembled PDU]"
99,31.669832,192.168.11.28,192.168.11.7,TCP,66,0.000142,,0.000142,"Jan  8, 2024 10:29:44.708797000 JST",,6000  >  59550 [ACK] Seq=1 Ack=28 Win=65152 Len=0 TSval=2659312563 TSecr=612768776
100,31.669939,192.168.11.7,192.168.11.28,TCP,66,,,0.000107,"Jan  8, 2024 10:29:44.708904000 JST",,"59550  >  6000 [FIN, ACK] Seq=28 Ack=1 Win=64256 Len=0 TSval=612768776 TSecr=2659312545"
101,31.67165,192.168.11.28,192.168.11.7,TCP,66,0.001711,,0.001711,"Jan  8, 2024 10:29:44.710615000 JST",,"6000  >  59550 [FIN, ACK] Seq=1 Ack=29 Win=65152 Len=0 TSval=2659312565 TSecr=612768776"
102,31.676435,192.168.11.7,192.168.11.28,TCP,66,0.004785,,0.004785,"Jan  8, 2024 10:29:44.715400000 JST",,59550  >  6000 [ACK] Seq=29 Ack=2 Win=64256 Len=0 TSval=612768791 TSecr=2659312565
103,37.721792,192.168.11.28,192.168.11.21,TCP,74,,,6.045357,"Jan  8, 2024 10:29:50.760757000 JST",,48762  >  6000 [SYN] Seq=0 Win=64240 Len=0 MSS=1460 SACK_PERM TSval=3503016876 TSecr=0 WS=128
104,37.728941,192.168.11.21,192.168.11.28,TCP,74,0.007149,,0.007149,"Jan  8, 2024 10:29:50.767906000 JST",,"6000  >  48762 [SYN, ACK] Seq=0 Ack=1 Win=65160 Len=0 MSS=1460 SACK_PERM TSval=4202659717 TSecr=3503016876 WS=128"
105,37.729058,192.168.11.28,192.168.11.21,TCP,66,0.000117,,0.000117,"Jan  8, 2024 10:29:50.768023000 JST",,48762  >  6000 [ACK] Seq=1 Ack=1 Win=64256 Len=0 TSval=3503016883 TSecr=4202659717
106,37.729241,192.168.11.28,192.168.11.21,TCP,93,,,0.000183,"Jan  8, 2024 10:29:50.768206000 JST",,"48762  >  6000 [PSH, ACK] Seq=1 Ack=1 Win=64256 Len=27 TSval=3503016884 TSecr=4202659717 [TCP segment of a reassembled PDU]"
107,37.729362,192.168.11.28,192.168.11.21,TCP,66,,,0.000121,"Jan  8, 2024 10:29:50.768327000 JST",,"48762  >  6000 [FIN, ACK] Seq=28 Ack=1 Win=64256 Len=0 TSval=3503016884 TSecr=4202659717"
108,37.737343,192.168.11.21,192.168.11.28,TCP,66,0.008102,,0.007981,"Jan  8, 2024 10:29:50.776308000 JST",,6000  >  48762 [ACK] Seq=1 Ack=28 Win=65152 Len=0 TSval=4202659725 TSecr=3503016884
109,37.739309,192.168.11.21,192.168.11.28,TCP,66,0.009947,,0.001966,"Jan  8, 2024 10:29:50.778274000 JST",,"6000  >  48762 [FIN, ACK] Seq=1 Ack=29 Win=65152 Len=0 TSval=4202659727 TSecr=3503016884"
110,37.739366,192.168.11.28,192.168.11.21,TCP,66,0.000057,,0.000057,"Jan  8, 2024 10:29:50.778331000 JST",,48762  >  6000 [ACK] Seq=29 Ack=2 Win=64256 Len=0 TSval=3503016894 TSecr=4202659727
111,37.767899,192.168.11.28,255.255.255.255,UDP,209,,Ÿ,0.028533,"Jan  8, 2024 10:29:50.806864000 JST",7b2273656d616e74696373223a207b22656e74697479223a2022504944222c202262617365656e74697479223a2022616e79222c2022726f6c65223a20226a6a6a222c20227370617469616c223a2022616e79222c202274656d706f72616c223a2022616e79227d2c20226461746170726f7065727479223a207b22666f726d6174223a2022696e616f6b615f70726f6772616d5f73616d706c655f73656d616e746963227d7d,40078  >  7000 Len=167
112,37.774983,192.168.11.7,192.168.11.28,TCP,74,,œ,0.007084,"Jan  8, 2024 10:29:50.813948000 JST",,59566  >  6000 [SYN] Seq=0 Win=64240 Len=0 MSS=1460 SACK_PERM TSval=612774888 TSecr=0 WS=128
113,37.775155,192.168.11.28,192.168.11.7,TCP,74,0.000172,,0.000172,"Jan  8, 2024 10:29:50.814120000 JST",,"6000  >  59566 [SYN, ACK] Seq=0 Ack=1 Win=65160 Len=0 MSS=1460 SACK_PERM TSval=2659318668 TSecr=612774888 WS=128"
114,37.781765,192.168.11.7,192.168.11.28,TCP,66,0.00661,,0.00661,"Jan  8, 2024 10:29:50.820730000 JST",,59566  >  6000 [ACK] Seq=1 Ack=1 Win=64256 Len=0 TSval=612774896 TSecr=2659318668
115,37.782399,192.168.11.7,192.168.11.28,TCP,93,,,0.000634,"Jan  8, 2024 10:29:50.821364000 JST",,"59566  >  6000 [PSH, ACK] Seq=1 Ack=1 Win=64256 Len=27 TSval=612774897 TSecr=2659318668 [TCP segment of a reassembled PDU]"
116,37.782524,192.168.11.28,192.168.11.7,TCP,66,0.000125,,0.000125,"Jan  8, 2024 10:29:50.821489000 JST",,6000  >  59566 [ACK] Seq=1 Ack=28 Win=65152 Len=0 TSval=2659318676 TSecr=612774897
117,37.782621,192.168.11.7,192.168.11.28,TCP,66,,,0.000097,"Jan  8, 2024 10:29:50.821586000 JST",,"59566  >  6000 [FIN, ACK] Seq=28 Ack=1 Win=64256 Len=0 TSval=612774897 TSecr=2659318668"
118,37.784039,192.168.11.28,192.168.11.7,TCP,66,0.001418,,0.001418,"Jan  8, 2024 10:29:50.823004000 JST",,"6000  >  59566 [FIN, ACK] Seq=1 Ack=29 Win=65152 Len=0 TSval=2659318677 TSecr=612774897"
119,37.78986,192.168.11.7,192.168.11.28,TCP,66,0.005821,,0.005821,"Jan  8, 2024 10:29:50.828825000 JST",,59566  >  6000 [ACK] Seq=29 Ack=2 Win=64256 Len=0 TSval=612774904 TSecr=2659318677
120,43.842972,192.168.11.28,192.168.11.21,TCP,74,,,6.053112,"Jan  8, 2024 10:29:56.881937000 JST",,54256  >  6000 [SYN] Seq=0 Win=64240 Len=0 MSS=1460 SACK_PERM TSval=3503022997 TSecr=0 WS=128
121,43.849853,192.168.11.21,192.168.11.28,TCP,74,0.006881,,0.006881,"Jan  8, 2024 10:29:56.888818000 JST",,"6000  >  54256 [SYN, ACK] Seq=0 Ack=1 Win=65160 Len=0 MSS=1460 SACK_PERM TSval=4202665838 TSecr=3503022997 WS=128"
122,43.849984,192.168.11.28,192.168.11.21,TCP,66,0.000131,,0.000131,"Jan  8, 2024 10:29:56.888949000 JST",,54256  >  6000 [ACK] Seq=1 Ack=1 Win=64256 Len=0 TSval=3503023004 TSecr=4202665838
123,43.850158,192.168.11.28,192.168.11.21,TCP,93,,,0.000174,"Jan  8, 2024 10:29:56.889123000 JST",,"54256  >  6000 [PSH, ACK] Seq=1 Ack=1 Win=64256 Len=27 TSval=3503023004 TSecr=4202665838 [TCP segment of a reassembled PDU]"
124,43.850299,192.168.11.28,192.168.11.21,TCP,66,,,0.000141,"Jan  8, 2024 10:29:56.889264000 JST",,"54256  >  6000 [FIN, ACK] Seq=28 Ack=1 Win=64256 Len=0 TSval=3503023005 TSecr=4202665838"
125,43.861794,192.168.11.21,192.168.11.28,TCP,66,0.011636,,0.011495,"Jan  8, 2024 10:29:56.900759000 JST",,6000  >  54256 [ACK] Seq=1 Ack=28 Win=65152 Len=0 TSval=4202665850 TSecr=3503023004
126,43.865098,192.168.11.21,192.168.11.28,TCP,66,0.014799,,0.003304,"Jan  8, 2024 10:29:56.904063000 JST",,"6000  >  54256 [FIN, ACK] Seq=1 Ack=29 Win=65152 Len=0 TSval=4202665853 TSecr=3503023005"
127,43.86516,192.168.11.28,192.168.11.21,TCP,66,0.000062,,0.000062,"Jan  8, 2024 10:29:56.904125000 JST",,54256  >  6000 [ACK] Seq=29 Ack=2 Win=64256 Len=0 TSval=3503023019 TSecr=4202665853
128,43.893548,192.168.11.28,255.255.255.255,UDP,209,,Ÿ,0.028388,"Jan  8, 2024 10:29:56.932513000 JST",7b2273656d616e74696373223a207b22656e74697479223a2022504944222c202262617365656e74697479223a2022616e79222c2022726f6c65223a20226a6a6a222c20227370617469616c223a2022616e79222c202274656d706f72616c223a2022616e79227d2c20226461746170726f7065727479223a207b22666f726d6174223a2022696e616f6b615f70726f6772616d5f73616d706c655f73656d616e746963227d7d,36313  >  7000 Len=167
129,43.899153,192.168.11.7,192.168.11.28,TCP,74,,œ,0.005605,"Jan  8, 2024 10:29:56.938118000 JST",,54578  >  6000 [SYN] Seq=0 Win=64240 Len=0 MSS=1460 SACK_PERM TSval=612781014 TSecr=0 WS=128
130,43.899295,192.168.11.28,192.168.11.7,TCP,74,0.000142,,0.000142,"Jan  8, 2024 10:29:56.938260000 JST",,"6000  >  54578 [SYN, ACK] Seq=0 Ack=1 Win=65160 Len=0 MSS=1460 SACK_PERM TSval=2659324793 TSecr=612781014 WS=128"
131,43.905927,192.168.11.7,192.168.11.28,TCP,66,0.006632,,0.006632,"Jan  8, 2024 10:29:56.944892000 JST",,54578  >  6000 [ACK] Seq=1 Ack=1 Win=64256 Len=0 TSval=612781020 TSecr=2659324793
132,43.906549,192.168.11.7,192.168.11.28,TCP,93,,,0.000622,"Jan  8, 2024 10:29:56.945514000 JST",,"54578  >  6000 [PSH, ACK] Seq=1 Ack=1 Win=64256 Len=27 TSval=612781021 TSecr=2659324793 [TCP segment of a reassembled PDU]"
133,43.906653,192.168.11.28,192.168.11.7,TCP,66,0.000104,,0.000104,"Jan  8, 2024 10:29:56.945618000 JST",,6000  >  54578 [ACK] Seq=1 Ack=28 Win=65152 Len=0 TSval=2659324800 TSecr=612781021
134,43.906715,192.168.11.7,192.168.11.28,TCP,66,,,0.000062,"Jan  8, 2024 10:29:56.945680000 JST",,"54578  >  6000 [FIN, ACK] Seq=28 Ack=1 Win=64256 Len=0 TSval=612781021 TSecr=2659324793"
135,43.908668,192.168.11.28,192.168.11.7,TCP,66,0.001953,,0.001953,"Jan  8, 2024 10:29:56.947633000 JST",,"6000  >  54578 [FIN, ACK] Seq=1 Ack=29 Win=65152 Len=0 TSval=2659324802 TSecr=612781021"
136,43.913278,192.168.11.7,192.168.11.28,TCP,66,0.00461,,0.00461,"Jan  8, 2024 10:29:56.952243000 JST",,54578  >  6000 [ACK] Seq=29 Ack=2 Win=64256 Len=0 TSval=612781028 TSecr=2659324802
137,49.926715,192.168.11.28,192.168.11.21,TCP,74,,,6.013437,"Jan  8, 2024 10:30:02.965680000 JST",,54260  >  6000 [SYN] Seq=0 Win=64240 Len=0 MSS=1460 SACK_PERM TSval=3503029081 TSecr=0 WS=128
138,49.933421,192.168.11.21,192.168.11.28,TCP,74,0.006706,,0.006706,"Jan  8, 2024 10:30:02.972386000 JST",,"6000  >  54260 [SYN, ACK] Seq=0 Ack=1 Win=65160 Len=0 MSS=1460 SACK_PERM TSval=4202671922 TSecr=3503029081 WS=128"
139,49.933527,192.168.11.28,192.168.11.21,TCP,66,0.000106,,0.000106,"Jan  8, 2024 10:30:02.972492000 JST",,54260  >  6000 [ACK] Seq=1 Ack=1 Win=64256 Len=0 TSval=3503029088 TSecr=4202671922
140,49.9337,192.168.11.28,192.168.11.21,TCP,93,,,0.000173,"Jan  8, 2024 10:30:02.972665000 JST",,"54260  >  6000 [PSH, ACK] Seq=1 Ack=1 Win=64256 Len=27 TSval=3503029088 TSecr=4202671922 [TCP segment of a reassembled PDU]"
141,49.933812,192.168.11.28,192.168.11.21,TCP,66,,,0.000112,"Jan  8, 2024 10:30:02.972777000 JST",,"54260  >  6000 [FIN, ACK] Seq=28 Ack=1 Win=64256 Len=0 TSval=3503029088 TSecr=4202671922"
142,49.94088,192.168.11.21,192.168.11.28,TCP,66,0.00718,,0.007068,"Jan  8, 2024 10:30:02.979845000 JST",,6000  >  54260 [ACK] Seq=1 Ack=28 Win=65152 Len=0 TSval=4202671929 TSecr=3503029088
143,49.94126,192.168.11.21,192.168.11.28,TCP,66,0.007448,,0.00038,"Jan  8, 2024 10:30:02.980225000 JST",,"6000  >  54260 [FIN, ACK] Seq=1 Ack=29 Win=65152 Len=0 TSval=4202671930 TSecr=3503029088"
144,49.941307,192.168.11.28,192.168.11.21,TCP,66,0.000047,,0.000047,"Jan  8, 2024 10:30:02.980272000 JST",,54260  >  6000 [ACK] Seq=29 Ack=2 Win=64256 Len=0 TSval=3503029096 TSecr=4202671930
145,49.970543,192.168.11.28,255.255.255.255,UDP,209,,Ÿ,0.029236,"Jan  8, 2024 10:30:03.009508000 JST",7b2273656d616e74696373223a207b22656e74697479223a2022504944222c202262617365656e74697479223a2022616e79222c2022726f6c65223a20226a6a6a222c20227370617469616c223a2022616e79222c202274656d706f72616c223a2022616e79227d2c20226461746170726f7065727479223a207b22666f726d6174223a2022696e616f6b615f70726f6772616d5f73616d706c655f73656d616e746963227d7d,49042  >  7000 Len=167
146,49.977119,192.168.11.7,192.168.11.28,TCP,74,,œ,0.006576,"Jan  8, 2024 10:30:03.016084000 JST",,54590  >  6000 [SYN] Seq=0 Win=64240 Len=0 MSS=1460 SACK_PERM TSval=612787091 TSecr=0 WS=128
147,49.977257,192.168.11.28,192.168.11.7,TCP,74,0.000138,,0.000138,"Jan  8, 2024 10:30:03.016222000 JST",,"6000  >  54590 [SYN, ACK] Seq=0 Ack=1 Win=65160 Len=0 MSS=1460 SACK_PERM TSval=2659330871 TSecr=612787091 WS=128"
148,49.993095,192.168.11.7,192.168.11.28,TCP,66,0.015838,,0.015838,"Jan  8, 2024 10:30:03.032060000 JST",,54590  >  6000 [ACK] Seq=1 Ack=1 Win=64256 Len=0 TSval=612787098 TSecr=2659330871
149,49.993654,192.168.11.7,192.168.11.28,TCP,93,,,0.000559,"Jan  8, 2024 10:30:03.032619000 JST",,"54590  >  6000 [PSH, ACK] Seq=1 Ack=1 Win=64256 Len=27 TSval=612787099 TSecr=2659330871 [TCP segment of a reassembled PDU]"
150,49.993728,192.168.11.28,192.168.11.7,TCP,66,0.000074,,0.000074,"Jan  8, 2024 10:30:03.032693000 JST",,6000  >  54590 [ACK] Seq=1 Ack=28 Win=65152 Len=0 TSval=2659330887 TSecr=612787099
151,49.993798,192.168.11.7,192.168.11.28,TCP,66,,,0.00007,"Jan  8, 2024 10:30:03.032763000 JST",,"54590  >  6000 [FIN, ACK] Seq=28 Ack=1 Win=64256 Len=0 TSval=612787099 TSecr=2659330871"
152,49.995164,192.168.11.28,192.168.11.7,TCP,66,0.001366,,0.001366,"Jan  8, 2024 10:30:03.034129000 JST",,"6000  >  54590 [FIN, ACK] Seq=1 Ack=29 Win=65152 Len=0 TSval=2659330888 TSecr=612787099"
153,50.001034,192.168.11.7,192.168.11.28,TCP,66,0.00587,,0.00587,"Jan  8, 2024 10:30:03.039999000 JST",,54590  >  6000 [ACK] Seq=29 Ack=2 Win=64256 Len=0 TSval=612787115 TSecr=2659330888
154,56.04851,192.168.11.28,192.168.11.21,TCP,74,,,6.047476,"Jan  8, 2024 10:30:09.087475000 JST",,38008  >  6000 [SYN] Seq=0 Win=64240 Len=0 MSS=1460 SACK_PERM TSval=3503035203 TSecr=0 WS=128
155,56.055233,192.168.11.21,192.168.11.28,TCP,74,0.006723,,0.006723,"Jan  8, 2024 10:30:09.094198000 JST",,"6000  >  38008 [SYN, ACK] Seq=0 Ack=1 Win=65160 Len=0 MSS=1460 SACK_PERM TSval=4202678043 TSecr=3503035203 WS=128"
156,56.055363,192.168.11.28,192.168.11.21,TCP,66,0.00013,,0.00013,"Jan  8, 2024 10:30:09.094328000 JST",,38008  >  6000 [ACK] Seq=1 Ack=1 Win=64256 Len=0 TSval=3503035210 TSecr=4202678043
157,56.055537,192.168.11.28,192.168.11.21,TCP,93,,,0.000174,"Jan  8, 2024 10:30:09.094502000 JST",,"38008  >  6000 [PSH, ACK] Seq=1 Ack=1 Win=64256 Len=27 TSval=3503035210 TSecr=4202678043 [TCP segment of a reassembled PDU]"
158,56.055642,192.168.11.28,192.168.11.21,TCP,66,,,0.000105,"Jan  8, 2024 10:30:09.094607000 JST",,"38008  >  6000 [FIN, ACK] Seq=28 Ack=1 Win=64256 Len=0 TSval=3503035210 TSecr=4202678043"
159,56.063728,192.168.11.21,192.168.11.28,TCP,66,0.008191,,0.008086,"Jan  8, 2024 10:30:09.102693000 JST",,6000  >  38008 [ACK] Seq=1 Ack=28 Win=65152 Len=0 TSval=4202678052 TSecr=3503035210
160,56.064103,192.168.11.21,192.168.11.28,TCP,66,0.008461,,0.000375,"Jan  8, 2024 10:30:09.103068000 JST",,"6000  >  38008 [FIN, ACK] Seq=1 Ack=29 Win=65152 Len=0 TSval=4202678053 TSecr=3503035210"
161,56.064189,192.168.11.28,192.168.11.21,TCP,66,0.000086,,0.000086,"Jan  8, 2024 10:30:09.103154000 JST",,38008  >  6000 [ACK] Seq=29 Ack=2 Win=64256 Len=0 TSval=3503035218 TSecr=4202678053
162,56.093428,192.168.11.28,255.255.255.255,UDP,209,,Ÿ,0.029239,"Jan  8, 2024 10:30:09.132393000 JST",7b2273656d616e74696373223a207b22656e74697479223a2022504944222c202262617365656e74697479223a2022616e79222c2022726f6c65223a20226a6a6a222c20227370617469616c223a2022616e79222c202274656d706f72616c223a2022616e79227d2c20226461746170726f7065727479223a207b22666f726d6174223a2022696e616f6b615f70726f6772616d5f73616d706c655f73656d616e746963227d7d,44512  >  7000 Len=167
163,56.099089,192.168.11.7,192.168.11.28,TCP,74,,œ,0.005661,"Jan  8, 2024 10:30:09.138054000 JST",,60346  >  6000 [SYN] Seq=0 Win=64240 Len=0 MSS=1460 SACK_PERM TSval=612793214 TSecr=0 WS=128
164,56.099225,192.168.11.28,192.168.11.7,TCP,74,0.000136,,0.000136,"Jan  8, 2024 10:30:09.138190000 JST",,"6000  >  60346 [SYN, ACK] Seq=0 Ack=1 Win=65160 Len=0 MSS=1460 SACK_PERM TSval=2659336993 TSecr=612793214 WS=128"
165,56.10603,192.168.11.7,192.168.11.28,TCP,66,0.006805,,0.006805,"Jan  8, 2024 10:30:09.144995000 JST",,60346  >  6000 [ACK] Seq=1 Ack=1 Win=64256 Len=0 TSval=612793220 TSecr=2659336993
166,56.106598,192.168.11.7,192.168.11.28,TCP,93,,,0.000568,"Jan  8, 2024 10:30:09.145563000 JST",,"60346  >  6000 [PSH, ACK] Seq=1 Ack=1 Win=64256 Len=27 TSval=612793221 TSecr=2659336993 [TCP segment of a reassembled PDU]"
167,56.106688,192.168.11.28,192.168.11.7,TCP,66,0.00009,,0.00009,"Jan  8, 2024 10:30:09.145653000 JST",,6000  >  60346 [ACK] Seq=1 Ack=28 Win=65152 Len=0 TSval=2659337000 TSecr=612793221
168,56.106758,192.168.11.7,192.168.11.28,TCP,66,,,0.00007,"Jan  8, 2024 10:30:09.145723000 JST",,"60346  >  6000 [FIN, ACK] Seq=28 Ack=1 Win=64256 Len=0 TSval=612793221 TSecr=2659336993"
169,56.107968,192.168.11.28,192.168.11.7,TCP,66,0.00121,,0.00121,"Jan  8, 2024 10:30:09.146933000 JST",,"6000  >  60346 [FIN, ACK] Seq=1 Ack=29 Win=65152 Len=0 TSval=2659337001 TSecr=612793221"
170,56.113862,192.168.11.7,192.168.11.28,TCP,66,0.005894,,0.005894,"Jan  8, 2024 10:30:09.152827000 JST",,60346  >  6000 [ACK] Seq=29 Ack=2 Win=64256 Len=0 TSval=612793228 TSecr=2659337001
171,87.225665,192.168.11.28,192.168.11.21,TCP,74,,,31.111803,"Jan  8, 2024 10:30:40.264630000 JST",,46794  >  6000 [SYN] Seq=0 Win=64240 Len=0 MSS=1460 SACK_PERM TSval=3503066380 TSecr=0 WS=128
172,87.232446,192.168.11.21,192.168.11.28,TCP,74,0.006781,,0.006781,"Jan  8, 2024 10:30:40.271411000 JST",,"6000  >  46794 [SYN, ACK] Seq=0 Ack=1 Win=65160 Len=0 MSS=1460 SACK_PERM TSval=4202709220 TSecr=3503066380 WS=128"
173,87.232582,192.168.11.28,192.168.11.21,TCP,66,0.000136,,0.000136,"Jan  8, 2024 10:30:40.271547000 JST",,46794  >  6000 [ACK] Seq=1 Ack=1 Win=64256 Len=0 TSval=3503066387 TSecr=4202709220
174,87.232739,192.168.11.28,192.168.11.21,TCP,93,,,0.000157,"Jan  8, 2024 10:30:40.271704000 JST",,"46794  >  6000 [PSH, ACK] Seq=1 Ack=1 Win=64256 Len=27 TSval=3503066387 TSecr=4202709220 [TCP segment of a reassembled PDU]"
175,87.232861,192.168.11.28,192.168.11.21,TCP,66,,,0.000122,"Jan  8, 2024 10:30:40.271826000 JST",,"46794  >  6000 [FIN, ACK] Seq=28 Ack=1 Win=64256 Len=0 TSval=3503066387 TSecr=4202709220"
176,87.243386,192.168.11.21,192.168.11.28,TCP,66,0.010647,,0.010525,"Jan  8, 2024 10:30:40.282351000 JST",,6000  >  46794 [ACK] Seq=1 Ack=28 Win=65152 Len=0 TSval=4202709231 TSecr=3503066387
177,87.243761,192.168.11.21,192.168.11.28,TCP,66,0.0109,,0.000375,"Jan  8, 2024 10:30:40.282726000 JST",,"6000  >  46794 [FIN, ACK] Seq=1 Ack=29 Win=65152 Len=0 TSval=4202709232 TSecr=3503066387"
178,87.24383,192.168.11.28,192.168.11.21,TCP,66,0.000069,,0.000069,"Jan  8, 2024 10:30:40.282795000 JST",,46794  >  6000 [ACK] Seq=29 Ack=2 Win=64256 Len=0 TSval=3503066398 TSecr=4202709232
179,87.272414,192.168.11.28,255.255.255.255,UDP,209,,Ÿ,0.028584,"Jan  8, 2024 10:30:40.311379000 JST",7b2273656d616e74696373223a207b22656e74697479223a2022504944222c202262617365656e74697479223a2022616e79222c2022726f6c65223a20226a6a6a222c20227370617469616c223a2022616e79222c202274656d706f72616c223a2022616e79227d2c20226461746170726f7065727479223a207b22666f726d6174223a2022696e616f6b615f70726f6772616d5f73616d706c655f73656d616e746963227d7d,51117  >  7000 Len=167
180,87.279052,192.168.11.7,192.168.11.28,TCP,74,,œ,0.006638,"Jan  8, 2024 10:30:40.318017000 JST",,59562  >  6000 [SYN] Seq=0 Win=64240 Len=0 MSS=1460 SACK_PERM TSval=612824393 TSecr=0 WS=128
181,87.279227,192.168.11.28,192.168.11.7,TCP,74,0.000175,,0.000175,"Jan  8, 2024 10:30:40.318192000 JST",,"6000  >  59562 [SYN, ACK] Seq=0 Ack=1 Win=65160 Len=0 MSS=1460 SACK_PERM TSval=2659368173 TSecr=612824393 WS=128"
182,87.285923,192.168.11.7,192.168.11.28,TCP,66,0.006696,,0.006696,"Jan  8, 2024 10:30:40.324888000 JST",,59562  >  6000 [ACK] Seq=1 Ack=1 Win=64256 Len=0 TSval=612824400 TSecr=2659368173
183,87.286463,192.168.11.7,192.168.11.28,TCP,93,,,0.00054,"Jan  8, 2024 10:30:40.325428000 JST",,"59562  >  6000 [PSH, ACK] Seq=1 Ack=1 Win=64256 Len=27 TSval=612824401 TSecr=2659368173 [TCP segment of a reassembled PDU]"
184,87.286563,192.168.11.28,192.168.11.7,TCP,66,0.0001,,0.0001,"Jan  8, 2024 10:30:40.325528000 JST",,6000  >  59562 [ACK] Seq=1 Ack=28 Win=65152 Len=0 TSval=2659368180 TSecr=612824401
185,87.286635,192.168.11.7,192.168.11.28,TCP,66,,,0.000072,"Jan  8, 2024 10:30:40.325600000 JST",,"59562  >  6000 [FIN, ACK] Seq=28 Ack=1 Win=64256 Len=0 TSval=612824401 TSecr=2659368173"
