No.,Time,Source,Destination,Protocol,Length,The RTT to ACK the segment was,XXX,Time delta from previous captured frame,Arrival Time,Data,Info
1,0,192.168.11.26,192.168.11.7,TCP,74,,,0,"Jan  8, 2024 10:29:13.153199000 JST",,38390  >  6000 [SYN] Seq=0 Win=64240 Len=0 MSS=1460 SACK_PERM TSval=129889507 TSecr=0 WS=128
2,0.009465,192.168.11.7,192.168.11.26,TCP,74,0.009465,,0.009465,"Jan  8, 2024 10:29:13.162664000 JST",,"6000  >  38390 [SYN, ACK] Seq=0 Ack=1 Win=65160 Len=0 MSS=1460 SACK_PERM TSval=976328527 TSecr=129889507 WS=128"
3,0.009604,192.168.11.26,192.168.11.7,TCP,66,0.000139,,0.000139,"Jan  8, 2024 10:29:13.162803000 JST",,38390  >  6000 [ACK] Seq=1 Ack=1 Win=64256 Len=0 TSval=129889517 TSecr=976328527
4,0.009796,192.168.11.26,192.168.11.7,TCP,93,,,0.000192,"Jan  8, 2024 10:29:13.162995000 JST",,"38390  >  6000 [PSH, ACK] Seq=1 Ack=1 Win=64256 Len=27 TSval=129889517 TSecr=976328527 [TCP segment of a reassembled PDU]"
5,0.00994,192.168.11.26,192.168.11.7,TCP,66,,,0.000144,"Jan  8, 2024 10:29:13.163139000 JST",,"38390  >  6000 [FIN, ACK] Seq=28 Ack=1 Win=64256 Len=0 TSval=129889517 TSecr=976328527"
6,0.017757,192.168.11.7,192.168.11.26,TCP,66,0.007961,,0.007817,"Jan  8, 2024 10:29:13.170956000 JST",,6000  >  38390 [ACK] Seq=1 Ack=28 Win=65152 Len=0 TSval=976328536 TSecr=129889517
7,0.017995,192.168.11.7,192.168.11.26,TCP,66,0.008055,,0.000238,"Jan  8, 2024 10:29:13.171194000 JST",,"6000  >  38390 [FIN, ACK] Seq=1 Ack=29 Win=65152 Len=0 TSval=976328538 TSecr=129889517"
8,0.018055,192.168.11.26,192.168.11.7,TCP,66,0.00006,,0.00006,"Jan  8, 2024 10:29:13.171254000 JST",,38390  >  6000 [ACK] Seq=29 Ack=2 Win=64256 Len=0 TSval=129889525 TSecr=976328538
9,0.050413,192.168.11.26,255.255.255.255,UDP,209,,Ÿ,0.032358,"Jan  8, 2024 10:29:13.203612000 JST",7b2273656d616e74696373223a207b22656e74697479223a2022504944222c202262617365656e74697479223a2022616e79222c2022726f6c65223a20226c6c6c222c20227370617469616c223a2022616e79222c202274656d706f72616c223a2022616e79227d2c20226461746170726f7065727479223a207b22666f726d6174223a2022696e616f6b615f70726f6772616d5f73616d706c655f73656d616e746963227d7d,34496  >  7000 Len=167
10,0.063643,192.168.11.25,192.168.11.26,TCP,74,,œ,0.01323,"Jan  8, 2024 10:29:13.216842000 JST",,50400  >  6000 [SYN] Seq=0 Win=64240 Len=0 MSS=1460 SACK_PERM TSval=461316181 TSecr=0 WS=128
11,0.06383,192.168.11.26,192.168.11.25,TCP,74,0.000187,,0.000187,"Jan  8, 2024 10:29:13.217029000 JST",,"6000  >  50400 [SYN, ACK] Seq=0 Ack=1 Win=65160 Len=0 MSS=1460 SACK_PERM TSval=656382659 TSecr=461316181 WS=128"
12,0.070671,192.168.11.25,192.168.11.26,TCP,66,0.006841,,0.006841,"Jan  8, 2024 10:29:13.223870000 JST",,50400  >  6000 [ACK] Seq=1 Ack=1 Win=64256 Len=0 TSval=461316190 TSecr=656382659
13,0.071354,192.168.11.25,192.168.11.26,TCP,93,,,0.000683,"Jan  8, 2024 10:29:13.224553000 JST",,"50400  >  6000 [PSH, ACK] Seq=1 Ack=1 Win=64256 Len=27 TSval=461316190 TSecr=656382659 [TCP segment of a reassembled PDU]"
14,0.071455,192.168.11.26,192.168.11.25,TCP,66,0.000101,,0.000101,"Jan  8, 2024 10:29:13.224654000 JST",,6000  >  50400 [ACK] Seq=1 Ack=28 Win=65152 Len=0 TSval=656382667 TSecr=461316190
15,0.071533,192.168.11.25,192.168.11.26,TCP,66,,,0.000078,"Jan  8, 2024 10:29:13.224732000 JST",,"50400  >  6000 [FIN, ACK] Seq=28 Ack=1 Win=64256 Len=0 TSval=461316190 TSecr=656382659"
16,0.073453,192.168.11.26,192.168.11.25,TCP,66,0.00192,,0.00192,"Jan  8, 2024 10:29:13.226652000 JST",,"6000  >  50400 [FIN, ACK] Seq=1 Ack=29 Win=65152 Len=0 TSval=656382669 TSecr=461316190"
17,0.078597,192.168.11.25,192.168.11.26,TCP,66,0.005144,,0.005144,"Jan  8, 2024 10:29:13.231796000 JST",,50400  >  6000 [ACK] Seq=29 Ack=2 Win=64256 Len=0 TSval=461316198 TSecr=656382669
18,6.158854,192.168.11.26,192.168.11.7,TCP,74,,,6.080257,"Jan  8, 2024 10:29:19.312053000 JST",,38392  >  6000 [SYN] Seq=0 Win=64240 Len=0 MSS=1460 SACK_PERM TSval=129895666 TSecr=0 WS=128
19,6.167484,192.168.11.7,192.168.11.26,TCP,74,0.00863,,0.00863,"Jan  8, 2024 10:29:19.320683000 JST",,"6000  >  38392 [SYN, ACK] Seq=0 Ack=1 Win=65160 Len=0 MSS=1460 SACK_PERM TSval=976334685 TSecr=129895666 WS=128"
20,6.167599,192.168.11.26,192.168.11.7,TCP,66,0.000115,,0.000115,"Jan  8, 2024 10:29:19.320798000 JST",,38392  >  6000 [ACK] Seq=1 Ack=1 Win=64256 Len=0 TSval=129895675 TSecr=976334685
21,6.16778,192.168.11.26,192.168.11.7,TCP,93,,,0.000181,"Jan  8, 2024 10:29:19.320979000 JST",,"38392  >  6000 [PSH, ACK] Seq=1 Ack=1 Win=64256 Len=27 TSval=129895675 TSecr=976334685 [TCP segment of a reassembled PDU]"
22,6.167929,192.168.11.26,192.168.11.7,TCP,66,,,0.000149,"Jan  8, 2024 10:29:19.321128000 JST",,"38392  >  6000 [FIN, ACK] Seq=28 Ack=1 Win=64256 Len=0 TSval=129895675 TSecr=976334685"
23,6.175796,192.168.11.7,192.168.11.26,TCP,66,0.008016,,0.007867,"Jan  8, 2024 10:29:19.328995000 JST",,6000  >  38392 [ACK] Seq=1 Ack=28 Win=65152 Len=0 TSval=976334694 TSecr=129895675
24,6.17835,192.168.11.7,192.168.11.26,TCP,66,0.010421,,0.002554,"Jan  8, 2024 10:29:19.331549000 JST",,"6000  >  38392 [FIN, ACK] Seq=1 Ack=29 Win=65152 Len=0 TSval=976334697 TSecr=129895675"
25,6.1784,192.168.11.26,192.168.11.7,TCP,66,0.00005,,0.00005,"Jan  8, 2024 10:29:19.331599000 JST",,38392  >  6000 [ACK] Seq=29 Ack=2 Win=64256 Len=0 TSval=129895686 TSecr=976334697
26,6.21154,192.168.11.26,255.255.255.255,UDP,209,,Ÿ,0.03314,"Jan  8, 2024 10:29:19.364739000 JST",7b2273656d616e74696373223a207b22656e74697479223a2022504944222c202262617365656e74697479223a2022616e79222c2022726f6c65223a20226c6c6c222c20227370617469616c223a2022616e79222c202274656d706f72616c223a2022616e79227d2c20226461746170726f7065727479223a207b22666f726d6174223a2022696e616f6b615f70726f6772616d5f73616d706c655f73656d616e746963227d7d,53556  >  7000 Len=167
27,6.219033,192.168.11.25,192.168.11.26,TCP,74,,œ,0.007493,"Jan  8, 2024 10:29:19.372232000 JST",,50412  >  6000 [SYN] Seq=0 Win=64240 Len=0 MSS=1460 SACK_PERM TSval=461322338 TSecr=0 WS=128
28,6.219201,192.168.11.26,192.168.11.25,TCP,74,0.000168,,0.000168,"Jan  8, 2024 10:29:19.372400000 JST",,"6000  >  50412 [SYN, ACK] Seq=0 Ack=1 Win=65160 Len=0 MSS=1460 SACK_PERM TSval=656388814 TSecr=461322338 WS=128"
29,6.22589,192.168.11.25,192.168.11.26,TCP,66,0.006689,,0.006689,"Jan  8, 2024 10:29:19.379089000 JST",,50412  >  6000 [ACK] Seq=1 Ack=1 Win=64256 Len=0 TSval=461322345 TSecr=656388814
30,6.226439,192.168.11.25,192.168.11.26,TCP,93,,,0.000549,"Jan  8, 2024 10:29:19.379638000 JST",,"50412  >  6000 [PSH, ACK] Seq=1 Ack=1 Win=64256 Len=27 TSval=461322345 TSecr=656388814 [TCP segment of a reassembled PDU]"
31,6.226519,192.168.11.26,192.168.11.25,TCP,66,0.00008,,0.00008,"Jan  8, 2024 10:29:19.379718000 JST",,6000  >  50412 [ACK] Seq=1 Ack=28 Win=65152 Len=0 TSval=656388822 TSecr=461322345
32,6.226593,192.168.11.25,192.168.11.26,TCP,66,,,0.000074,"Jan  8, 2024 10:29:19.379792000 JST",,"50412  >  6000 [FIN, ACK] Seq=28 Ack=1 Win=64256 Len=0 TSval=461322346 TSecr=656388814"
33,6.22779,192.168.11.26,192.168.11.25,TCP,66,0.001197,,0.001197,"Jan  8, 2024 10:29:19.380989000 JST",,"6000  >  50412 [FIN, ACK] Seq=1 Ack=29 Win=65152 Len=0 TSval=656388823 TSecr=461322346"
34,6.235771,192.168.11.25,192.168.11.26,TCP,66,0.007981,,0.007981,"Jan  8, 2024 10:29:19.388970000 JST",,50412  >  6000 [ACK] Seq=29 Ack=2 Win=64256 Len=0 TSval=461322355 TSecr=656388823
35,12.258427,192.168.11.26,192.168.11.7,TCP,74,,,6.022656,"Jan  8, 2024 10:29:25.411626000 JST",,52044  >  6000 [SYN] Seq=0 Win=64240 Len=0 MSS=1460 SACK_PERM TSval=129901766 TSecr=0 WS=128
36,12.267027,192.168.11.7,192.168.11.26,TCP,74,0.0086,,0.0086,"Jan  8, 2024 10:29:25.420226000 JST",,"6000  >  52044 [SYN, ACK] Seq=0 Ack=1 Win=65160 Len=0 MSS=1460 SACK_PERM TSval=976340785 TSecr=129901766 WS=128"
37,12.267141,192.168.11.26,192.168.11.7,TCP,66,0.000114,,0.000114,"Jan  8, 2024 10:29:25.420340000 JST",,52044  >  6000 [ACK] Seq=1 Ack=1 Win=64256 Len=0 TSval=129901774 TSecr=976340785
38,12.267356,192.168.11.26,192.168.11.7,TCP,93,,,0.000215,"Jan  8, 2024 10:29:25.420555000 JST",,"52044  >  6000 [PSH, ACK] Seq=1 Ack=1 Win=64256 Len=27 TSval=129901775 TSecr=976340785 [TCP segment of a reassembled PDU]"
39,12.267458,192.168.11.26,192.168.11.7,TCP,66,,,0.000102,"Jan  8, 2024 10:29:25.420657000 JST",,"52044  >  6000 [FIN, ACK] Seq=28 Ack=1 Win=64256 Len=0 TSval=129901775 TSecr=976340785"
40,12.275363,192.168.11.7,192.168.11.26,TCP,66,0.008007,,0.007905,"Jan  8, 2024 10:29:25.428562000 JST",,6000  >  52044 [ACK] Seq=1 Ack=28 Win=65152 Len=0 TSval=976340794 TSecr=129901775
41,12.277819,192.168.11.7,192.168.11.26,TCP,66,0.010361,,0.002456,"Jan  8, 2024 10:29:25.431018000 JST",,"6000  >  52044 [FIN, ACK] Seq=1 Ack=29 Win=65152 Len=0 TSval=976340796 TSecr=129901775"
42,12.277869,192.168.11.26,192.168.11.7,TCP,66,0.00005,,0.00005,"Jan  8, 2024 10:29:25.431068000 JST",,52044  >  6000 [ACK] Seq=29 Ack=2 Win=64256 Len=0 TSval=129901785 TSecr=976340796
43,12.308211,192.168.11.26,255.255.255.255,UDP,209,,Ÿ,0.030342,"Jan  8, 2024 10:29:25.461410000 JST",7b2273656d616e74696373223a207b22656e74697479223a2022504944222c202262617365656e74697479223a2022616e79222c2022726f6c65223a20226c6c6c222c20227370617469616c223a2022616e79222c202274656d706f72616c223a2022616e79227d2c20226461746170726f7065727479223a207b22666f726d6174223a2022696e616f6b615f70726f6772616d5f73616d706c655f73656d616e746963227d7d,37338  >  7000 Len=167
44,12.315853,192.168.11.25,192.168.11.26,TCP,74,,œ,0.007642,"Jan  8, 2024 10:29:25.469052000 JST",,36548  >  6000 [SYN] Seq=0 Win=64240 Len=0 MSS=1460 SACK_PERM TSval=461328435 TSecr=0 WS=128
45,12.316003,192.168.11.26,192.168.11.25,TCP,74,0.00015,,0.00015,"Jan  8, 2024 10:29:25.469202000 JST",,"6000  >  36548 [SYN, ACK] Seq=0 Ack=1 Win=65160 Len=0 MSS=1460 SACK_PERM TSval=656394911 TSecr=461328435 WS=128"
46,12.322738,192.168.11.25,192.168.11.26,TCP,66,0.006735,,0.006735,"Jan  8, 2024 10:29:25.475937000 JST",,36548  >  6000 [ACK] Seq=1 Ack=1 Win=64256 Len=0 TSval=461328442 TSecr=656394911
47,12.32354,192.168.11.25,192.168.11.26,TCP,93,,,0.000802,"Jan  8, 2024 10:29:25.476739000 JST",,"36548  >  6000 [PSH, ACK] Seq=1 Ack=1 Win=64256 Len=27 TSval=461328442 TSecr=656394911 [TCP segment of a reassembled PDU]"
48,12.32366,192.168.11.26,192.168.11.25,TCP,66,0.00012,,0.00012,"Jan  8, 2024 10:29:25.476859000 JST",,6000  >  36548 [ACK] Seq=1 Ack=28 Win=65152 Len=0 TSval=656394919 TSecr=461328442
49,12.323746,192.168.11.25,192.168.11.26,TCP,66,,,0.000086,"Jan  8, 2024 10:29:25.476945000 JST",,"36548  >  6000 [FIN, ACK] Seq=28 Ack=1 Win=64256 Len=0 TSval=461328442 TSecr=656394911"
50,12.32499,192.168.11.26,192.168.11.25,TCP,66,0.001244,,0.001244,"Jan  8, 2024 10:29:25.478189000 JST",,"6000  >  36548 [FIN, ACK] Seq=1 Ack=29 Win=65152 Len=0 TSval=656394920 TSecr=461328442"
51,12.330794,192.168.11.25,192.168.11.26,TCP,66,0.005804,,0.005804,"Jan  8, 2024 10:29:25.483993000 JST",,36548  >  6000 [ACK] Seq=29 Ack=2 Win=64256 Len=0 TSval=461328450 TSecr=656394920
52,18.367579,192.168.11.26,192.168.11.7,TCP,74,,,6.036785,"Jan  8, 2024 10:29:31.520778000 JST",,46442  >  6000 [SYN] Seq=0 Win=64240 Len=0 MSS=1460 SACK_PERM TSval=129907875 TSecr=0 WS=128
53,18.376358,192.168.11.7,192.168.11.26,TCP,74,0.008779,,0.008779,"Jan  8, 2024 10:29:31.529557000 JST",,"6000  >  46442 [SYN, ACK] Seq=0 Ack=1 Win=65160 Len=0 MSS=1460 SACK_PERM TSval=976346894 TSecr=129907875 WS=128"
54,18.376469,192.168.11.26,192.168.11.7,TCP,66,0.000111,,0.000111,"Jan  8, 2024 10:29:31.529668000 JST",,46442  >  6000 [ACK] Seq=1 Ack=1 Win=64256 Len=0 TSval=129907884 TSecr=976346894
55,18.376615,192.168.11.26,192.168.11.7,TCP,93,,,0.000146,"Jan  8, 2024 10:29:31.529814000 JST",,"46442  >  6000 [PSH, ACK] Seq=1 Ack=1 Win=64256 Len=27 TSval=129907884 TSecr=976346894 [TCP segment of a reassembled PDU]"
56,18.376722,192.168.11.26,192.168.11.7,TCP,66,,,0.000107,"Jan  8, 2024 10:29:31.529921000 JST",,"46442  >  6000 [FIN, ACK] Seq=28 Ack=1 Win=64256 Len=0 TSval=129907884 TSecr=976346894"
57,18.385605,192.168.11.7,192.168.11.26,TCP,66,0.00899,,0.008883,"Jan  8, 2024 10:29:31.538804000 JST",,6000  >  46442 [ACK] Seq=1 Ack=28 Win=65152 Len=0 TSval=976346904 TSecr=129907884
58,18.391143,192.168.11.7,192.168.11.26,TCP,66,0.014421,,0.005538,"Jan  8, 2024 10:29:31.544342000 JST",,"6000  >  46442 [FIN, ACK] Seq=1 Ack=29 Win=65152 Len=0 TSval=976346906 TSecr=129907884"
59,18.391217,192.168.11.26,192.168.11.7,TCP,66,0.000074,,0.000074,"Jan  8, 2024 10:29:31.544416000 JST",,46442  >  6000 [ACK] Seq=29 Ack=2 Win=64256 Len=0 TSval=129907898 TSecr=976346906
60,18.421666,192.168.11.26,255.255.255.255,UDP,209,,Ÿ,0.030449,"Jan  8, 2024 10:29:31.574865000 JST",7b2273656d616e74696373223a207b22656e74697479223a2022504944222c202262617365656e74697479223a2022616e79222c2022726f6c65223a20226c6c6c222c20227370617469616c223a2022616e79222c202274656d706f72616c223a2022616e79227d2c20226461746170726f7065727479223a207b22666f726d6174223a2022696e616f6b615f70726f6772616d5f73616d706c655f73656d616e746963227d7d,43668  >  7000 Len=167
61,18.429342,192.168.11.25,192.168.11.26,TCP,74,,œ,0.007676,"Jan  8, 2024 10:29:31.582541000 JST",,36556  >  6000 [SYN] Seq=0 Win=64240 Len=0 MSS=1460 SACK_PERM TSval=461334549 TSecr=0 WS=128
62,18.429485,192.168.11.26,192.168.11.25,TCP,74,0.000143,,0.000143,"Jan  8, 2024 10:29:31.582684000 JST",,"6000  >  36556 [SYN, ACK] Seq=0 Ack=1 Win=65160 Len=0 MSS=1460 SACK_PERM TSval=656401025 TSecr=461334549 WS=128"
63,18.443839,192.168.11.25,192.168.11.26,TCP,66,0.014354,,0.014354,"Jan  8, 2024 10:29:31.597038000 JST",,36556  >  6000 [ACK] Seq=1 Ack=1 Win=64256 Len=0 TSval=461334556 TSecr=656401025
64,18.444518,192.168.11.25,192.168.11.26,TCP,93,,,0.000679,"Jan  8, 2024 10:29:31.597717000 JST",,"36556  >  6000 [PSH, ACK] Seq=1 Ack=1 Win=64256 Len=27 TSval=461334556 TSecr=656401025 [TCP segment of a reassembled PDU]"
65,18.444661,192.168.11.26,192.168.11.25,TCP,66,0.000143,,0.000143,"Jan  8, 2024 10:29:31.597860000 JST",,6000  >  36556 [ACK] Seq=1 Ack=28 Win=65152 Len=0 TSval=656401040 TSecr=461334556
66,18.444761,192.168.11.25,192.168.11.26,TCP,66,,,0.0001,"Jan  8, 2024 10:29:31.597960000 JST",,"36556  >  6000 [FIN, ACK] Seq=28 Ack=1 Win=64256 Len=0 TSval=461334556 TSecr=656401025"
67,18.445675,192.168.11.26,192.168.11.25,TCP,66,0.000914,,0.000914,"Jan  8, 2024 10:29:31.598874000 JST",,"6000  >  36556 [FIN, ACK] Seq=1 Ack=29 Win=65152 Len=0 TSval=656401041 TSecr=461334556"
68,18.451761,192.168.11.25,192.168.11.26,TCP,66,0.006086,,0.006086,"Jan  8, 2024 10:29:31.604960000 JST",,36556  >  6000 [ACK] Seq=29 Ack=2 Win=64256 Len=0 TSval=461334571 TSecr=656401041
69,25.488279,192.168.11.26,192.168.11.7,TCP,74,,,7.036518,"Jan  8, 2024 10:29:38.641478000 JST",,46456  >  6000 [SYN] Seq=0 Win=64240 Len=0 MSS=1460 SACK_PERM TSval=129914996 TSecr=0 WS=128
70,25.496928,192.168.11.7,192.168.11.26,TCP,74,0.008649,,0.008649,"Jan  8, 2024 10:29:38.650127000 JST",,"6000  >  46456 [SYN, ACK] Seq=0 Ack=1 Win=65160 Len=0 MSS=1460 SACK_PERM TSval=976354015 TSecr=129914996 WS=128"
71,25.497048,192.168.11.26,192.168.11.7,TCP,66,0.00012,,0.00012,"Jan  8, 2024 10:29:38.650247000 JST",,46456  >  6000 [ACK] Seq=1 Ack=1 Win=64256 Len=0 TSval=129915004 TSecr=976354015
72,25.497194,192.168.11.26,192.168.11.7,TCP,93,,,0.000146,"Jan  8, 2024 10:29:38.650393000 JST",,"46456  >  6000 [PSH, ACK] Seq=1 Ack=1 Win=64256 Len=27 TSval=129915004 TSecr=976354015 [TCP segment of a reassembled PDU]"
73,25.497326,192.168.11.26,192.168.11.7,TCP,66,,,0.000132,"Jan  8, 2024 10:29:38.650525000 JST",,"46456  >  6000 [FIN, ACK] Seq=28 Ack=1 Win=64256 Len=0 TSval=129915005 TSecr=976354015"
74,25.506337,192.168.11.7,192.168.11.26,TCP,66,0.009143,,0.009011,"Jan  8, 2024 10:29:38.659536000 JST",,6000  >  46456 [ACK] Seq=1 Ack=28 Win=65152 Len=0 TSval=976354024 TSecr=129915004
75,25.506555,192.168.11.7,192.168.11.26,TCP,66,0.009229,,0.000218,"Jan  8, 2024 10:29:38.659754000 JST",,"6000  >  46456 [FIN, ACK] Seq=1 Ack=29 Win=65152 Len=0 TSval=976354026 TSecr=129915005"
76,25.506602,192.168.11.26,192.168.11.7,TCP,66,0.000047,,0.000047,"Jan  8, 2024 10:29:38.659801000 JST",,46456  >  6000 [ACK] Seq=29 Ack=2 Win=64256 Len=0 TSval=129915014 TSecr=976354026
77,25.538128,192.168.11.26,255.255.255.255,UDP,209,,Ÿ,0.031526,"Jan  8, 2024 10:29:38.691327000 JST",7b2273656d616e74696373223a207b22656e74697479223a2022504944222c202262617365656e74697479223a2022616e79222c2022726f6c65223a20226c6c6c222c20227370617469616c223a2022616e79222c202274656d706f72616c223a2022616e79227d2c20226461746170726f7065727479223a207b22666f726d6174223a2022696e616f6b615f70726f6772616d5f73616d706c655f73656d616e746963227d7d,53437  >  7000 Len=167
78,25.547271,192.168.11.25,192.168.11.26,TCP,74,,œ,0.009143,"Jan  8, 2024 10:29:38.700470000 JST",,47758  >  6000 [SYN] Seq=0 Win=64240 Len=0 MSS=1460 SACK_PERM TSval=461341665 TSecr=0 WS=128
79,25.547427,192.168.11.26,192.168.11.25,TCP,74,0.000156,,0.000156,"Jan  8, 2024 10:29:38.700626000 JST",,"6000  >  47758 [SYN, ACK] Seq=0 Ack=1 Win=65160 Len=0 MSS=1460 SACK_PERM TSval=656408143 TSecr=461341665 WS=128"
80,25.559605,192.168.11.25,192.168.11.26,TCP,66,0.012178,,0.012178,"Jan  8, 2024 10:29:38.712804000 JST",,47758  >  6000 [ACK] Seq=1 Ack=1 Win=64256 Len=0 TSval=461341676 TSecr=656408143
81,25.56042,192.168.11.25,192.168.11.26,TCP,93,,,0.000815,"Jan  8, 2024 10:29:38.713619000 JST",,"47758  >  6000 [PSH, ACK] Seq=1 Ack=1 Win=64256 Len=27 TSval=461341676 TSecr=656408143 [TCP segment of a reassembled PDU]"
82,25.560599,192.168.11.26,192.168.11.25,TCP,66,0.000179,,0.000179,"Jan  8, 2024 10:29:38.713798000 JST",,6000  >  47758 [ACK] Seq=1 Ack=28 Win=65152 Len=0 TSval=656408156 TSecr=461341676
83,25.560875,192.168.11.25,192.168.11.26,TCP,66,,,0.000276,"Jan  8, 2024 10:29:38.714074000 JST",,"47758  >  6000 [FIN, ACK] Seq=28 Ack=1 Win=64256 Len=0 TSval=461341676 TSecr=656408143"
84,25.562129,192.168.11.26,192.168.11.25,TCP,66,0.001254,,0.001254,"Jan  8, 2024 10:29:38.715328000 JST",,"6000  >  47758 [FIN, ACK] Seq=1 Ack=29 Win=65152 Len=0 TSval=656408157 TSecr=461341676"
85,25.567948,192.168.11.25,192.168.11.26,TCP,66,0.005819,,0.005819,"Jan  8, 2024 10:29:38.721147000 JST",,47758  >  6000 [ACK] Seq=29 Ack=2 Win=64256 Len=0 TSval=461341687 TSecr=656408157
86,31.59852,192.168.11.26,192.168.11.7,TCP,74,,,6.030572,"Jan  8, 2024 10:29:44.751719000 JST",,47022  >  6000 [SYN] Seq=0 Win=64240 Len=0 MSS=1460 SACK_PERM TSval=129921106 TSecr=0 WS=128
87,31.60966,192.168.11.7,192.168.11.26,TCP,74,0.01114,,0.01114,"Jan  8, 2024 10:29:44.762859000 JST",,"6000  >  47022 [SYN, ACK] Seq=0 Ack=1 Win=65160 Len=0 MSS=1460 SACK_PERM TSval=976360128 TSecr=129921106 WS=128"
88,31.609782,192.168.11.26,192.168.11.7,TCP,66,0.000122,,0.000122,"Jan  8, 2024 10:29:44.762981000 JST",,47022  >  6000 [ACK] Seq=1 Ack=1 Win=64256 Len=0 TSval=129921117 TSecr=976360128
89,31.609941,192.168.11.26,192.168.11.7,TCP,93,,,0.000159,"Jan  8, 2024 10:29:44.763140000 JST",,"47022  >  6000 [PSH, ACK] Seq=1 Ack=1 Win=64256 Len=27 TSval=129921117 TSecr=976360128 [TCP segment of a reassembled PDU]"
90,31.610042,192.168.11.26,192.168.11.7,TCP,66,,,0.000101,"Jan  8, 2024 10:29:44.763241000 JST",,"47022  >  6000 [FIN, ACK] Seq=28 Ack=1 Win=64256 Len=0 TSval=129921117 TSecr=976360128"
91,31.619026,192.168.11.7,192.168.11.26,TCP,66,0.009085,,0.008984,"Jan  8, 2024 10:29:44.772225000 JST",,6000  >  47022 [ACK] Seq=1 Ack=28 Win=65152 Len=0 TSval=976360137 TSecr=129921117
92,31.619258,192.168.11.7,192.168.11.26,TCP,66,0.009216,,0.000232,"Jan  8, 2024 10:29:44.772457000 JST",,"6000  >  47022 [FIN, ACK] Seq=1 Ack=29 Win=65152 Len=0 TSval=976360139 TSecr=129921117"
93,31.619317,192.168.11.26,192.168.11.7,TCP,66,0.000059,,0.000059,"Jan  8, 2024 10:29:44.772516000 JST",,47022  >  6000 [ACK] Seq=29 Ack=2 Win=64256 Len=0 TSval=129921127 TSecr=976360139
94,31.64858,192.168.11.26,255.255.255.255,UDP,209,,Ÿ,0.029263,"Jan  8, 2024 10:29:44.801779000 JST",7b2273656d616e74696373223a207b22656e74697479223a2022504944222c202262617365656e74697479223a2022616e79222c2022726f6c65223a20226c6c6c222c20227370617469616c223a2022616e79222c202274656d706f72616c223a2022616e79227d2c20226461746170726f7065727479223a207b22666f726d6174223a2022696e616f6b615f70726f6772616d5f73616d706c655f73656d616e746963227d7d,35994  >  7000 Len=167
95,31.655954,192.168.11.25,192.168.11.26,TCP,74,,œ,0.007374,"Jan  8, 2024 10:29:44.809153000 JST",,60260  >  6000 [SYN] Seq=0 Win=64240 Len=0 MSS=1460 SACK_PERM TSval=461347775 TSecr=0 WS=128
96,31.656115,192.168.11.26,192.168.11.25,TCP,74,0.000161,,0.000161,"Jan  8, 2024 10:29:44.809314000 JST",,"6000  >  60260 [SYN, ACK] Seq=0 Ack=1 Win=65160 Len=0 MSS=1460 SACK_PERM TSval=656414251 TSecr=461347775 WS=128"
97,31.662816,192.168.11.25,192.168.11.26,TCP,66,0.006701,,0.006701,"Jan  8, 2024 10:29:44.816015000 JST",,60260  >  6000 [ACK] Seq=1 Ack=1 Win=64256 Len=0 TSval=461347782 TSecr=656414251
98,31.663535,192.168.11.25,192.168.11.26,TCP,93,,,0.000719,"Jan  8, 2024 10:29:44.816734000 JST",,"60260  >  6000 [PSH, ACK] Seq=1 Ack=1 Win=64256 Len=27 TSval=461347782 TSecr=656414251 [TCP segment of a reassembled PDU]"
99,31.663664,192.168.11.26,192.168.11.25,TCP,66,0.000129,,0.000129,"Jan  8, 2024 10:29:44.816863000 JST",,6000  >  60260 [ACK] Seq=1 Ack=28 Win=65152 Len=0 TSval=656414259 TSecr=461347782
100,31.663754,192.168.11.25,192.168.11.26,TCP,66,,,0.00009,"Jan  8, 2024 10:29:44.816953000 JST",,"60260  >  6000 [FIN, ACK] Seq=28 Ack=1 Win=64256 Len=0 TSval=461347782 TSecr=656414251"
101,31.66511,192.168.11.26,192.168.11.25,TCP,66,0.001356,,0.001356,"Jan  8, 2024 10:29:44.818309000 JST",,"6000  >  60260 [FIN, ACK] Seq=1 Ack=29 Win=65152 Len=0 TSval=656414260 TSecr=461347782"
102,31.671166,192.168.11.25,192.168.11.26,TCP,66,0.006056,,0.006056,"Jan  8, 2024 10:29:44.824365000 JST",,60260  >  6000 [ACK] Seq=29 Ack=2 Win=64256 Len=0 TSval=461347790 TSecr=656414260
103,37.708842,192.168.11.26,192.168.11.7,TCP,74,,,6.037676,"Jan  8, 2024 10:29:50.862041000 JST",,34334  >  6000 [SYN] Seq=0 Win=64240 Len=0 MSS=1460 SACK_PERM TSval=129927216 TSecr=0 WS=128
104,37.717556,192.168.11.7,192.168.11.26,TCP,74,0.008714,,0.008714,"Jan  8, 2024 10:29:50.870755000 JST",,"6000  >  34334 [SYN, ACK] Seq=0 Ack=1 Win=65160 Len=0 MSS=1460 SACK_PERM TSval=976366236 TSecr=129927216 WS=128"
105,37.717669,192.168.11.26,192.168.11.7,TCP,66,0.000113,,0.000113,"Jan  8, 2024 10:29:50.870868000 JST",,34334  >  6000 [ACK] Seq=1 Ack=1 Win=64256 Len=0 TSval=129927225 TSecr=976366236
106,37.717845,192.168.11.26,192.168.11.7,TCP,93,,,0.000176,"Jan  8, 2024 10:29:50.871044000 JST",,"34334  >  6000 [PSH, ACK] Seq=1 Ack=1 Win=64256 Len=27 TSval=129927225 TSecr=976366236 [TCP segment of a reassembled PDU]"
107,37.717944,192.168.11.26,192.168.11.7,TCP,66,,,0.000099,"Jan  8, 2024 10:29:50.871143000 JST",,"34334  >  6000 [FIN, ACK] Seq=28 Ack=1 Win=64256 Len=0 TSval=129927225 TSecr=976366236"
108,37.725916,192.168.11.7,192.168.11.26,TCP,66,0.008071,,0.007972,"Jan  8, 2024 10:29:50.879115000 JST",,6000  >  34334 [ACK] Seq=1 Ack=28 Win=65152 Len=0 TSval=976366244 TSecr=129927225
109,37.726311,192.168.11.7,192.168.11.26,TCP,66,0.008367,,0.000395,"Jan  8, 2024 10:29:50.879510000 JST",,"6000  >  34334 [FIN, ACK] Seq=1 Ack=29 Win=65152 Len=0 TSval=976366245 TSecr=129927225"
110,37.726372,192.168.11.26,192.168.11.7,TCP,66,0.000061,,0.000061,"Jan  8, 2024 10:29:50.879571000 JST",,34334  >  6000 [ACK] Seq=29 Ack=2 Win=64256 Len=0 TSval=129927234 TSecr=976366245
111,37.758993,192.168.11.26,255.255.255.255,UDP,209,,Ÿ,0.032621,"Jan  8, 2024 10:29:50.912192000 JST",7b2273656d616e74696373223a207b22656e74697479223a2022504944222c202262617365656e74697479223a2022616e79222c2022726f6c65223a20226c6c6c222c20227370617469616c223a2022616e79222c202274656d706f72616c223a2022616e79227d2c20226461746170726f7065727479223a207b22666f726d6174223a2022696e616f6b615f70726f6772616d5f73616d706c655f73656d616e746963227d7d,34126  >  7000 Len=167
112,37.766724,192.168.11.25,192.168.11.26,TCP,74,,œ,0.007731,"Jan  8, 2024 10:29:50.919923000 JST",,60268  >  6000 [SYN] Seq=0 Win=64240 Len=0 MSS=1460 SACK_PERM TSval=461353886 TSecr=0 WS=128
113,37.76687,192.168.11.26,192.168.11.25,TCP,74,0.000146,,0.000146,"Jan  8, 2024 10:29:50.920069000 JST",,"6000  >  60268 [SYN, ACK] Seq=0 Ack=1 Win=65160 Len=0 MSS=1460 SACK_PERM TSval=656420362 TSecr=461353886 WS=128"
114,37.774967,192.168.11.25,192.168.11.26,TCP,66,0.008097,,0.008097,"Jan  8, 2024 10:29:50.928166000 JST",,60268  >  6000 [ACK] Seq=1 Ack=1 Win=64256 Len=0 TSval=461353894 TSecr=656420362
115,37.775741,192.168.11.25,192.168.11.26,TCP,93,,,0.000774,"Jan  8, 2024 10:29:50.928940000 JST",,"60268  >  6000 [PSH, ACK] Seq=1 Ack=1 Win=64256 Len=27 TSval=461353894 TSecr=656420362 [TCP segment of a reassembled PDU]"
116,37.77589,192.168.11.26,192.168.11.25,TCP,66,0.000149,,0.000149,"Jan  8, 2024 10:29:50.929089000 JST",,6000  >  60268 [ACK] Seq=1 Ack=28 Win=65152 Len=0 TSval=656420371 TSecr=461353894
117,37.775991,192.168.11.25,192.168.11.26,TCP,66,,,0.000101,"Jan  8, 2024 10:29:50.929190000 JST",,"60268  >  6000 [FIN, ACK] Seq=28 Ack=1 Win=64256 Len=0 TSval=461353894 TSecr=656420362"
118,37.777282,192.168.11.26,192.168.11.25,TCP,66,0.001291,,0.001291,"Jan  8, 2024 10:29:50.930481000 JST",,"6000  >  60268 [FIN, ACK] Seq=1 Ack=29 Win=65152 Len=0 TSval=656420373 TSecr=461353894"
119,37.783775,192.168.11.25,192.168.11.26,TCP,66,0.006493,,0.006493,"Jan  8, 2024 10:29:50.936974000 JST",,60268  >  6000 [ACK] Seq=29 Ack=2 Win=64256 Len=0 TSval=461353903 TSecr=656420373
120,43.833511,192.168.11.26,192.168.11.7,TCP,74,,,6.049736,"Jan  8, 2024 10:29:56.986710000 JST",,34340  >  6000 [SYN] Seq=0 Win=64240 Len=0 MSS=1460 SACK_PERM TSval=129933341 TSecr=0 WS=128
121,43.845736,192.168.11.7,192.168.11.26,TCP,74,0.012225,,0.012225,"Jan  8, 2024 10:29:56.998935000 JST",,"6000  >  34340 [SYN, ACK] Seq=0 Ack=1 Win=65160 Len=0 MSS=1460 SACK_PERM TSval=976372364 TSecr=129933341 WS=128"
122,43.845879,192.168.11.26,192.168.11.7,TCP,66,0.000143,,0.000143,"Jan  8, 2024 10:29:56.999078000 JST",,34340  >  6000 [ACK] Seq=1 Ack=1 Win=64256 Len=0 TSval=129933353 TSecr=976372364
123,43.846042,192.168.11.26,192.168.11.7,TCP,93,,,0.000163,"Jan  8, 2024 10:29:56.999241000 JST",,"34340  >  6000 [PSH, ACK] Seq=1 Ack=1 Win=64256 Len=27 TSval=129933353 TSecr=976372364 [TCP segment of a reassembled PDU]"
124,43.846172,192.168.11.26,192.168.11.7,TCP,66,,,0.00013,"Jan  8, 2024 10:29:56.999371000 JST",,"34340  >  6000 [FIN, ACK] Seq=28 Ack=1 Win=64256 Len=0 TSval=129933353 TSecr=976372364"
125,43.856386,192.168.11.7,192.168.11.26,TCP,66,0.010344,,0.010214,"Jan  8, 2024 10:29:57.009585000 JST",,6000  >  34340 [ACK] Seq=1 Ack=28 Win=65152 Len=0 TSval=976372374 TSecr=129933353
126,43.856758,192.168.11.7,192.168.11.26,TCP,66,0.010586,,0.000372,"Jan  8, 2024 10:29:57.009957000 JST",,"6000  >  34340 [FIN, ACK] Seq=1 Ack=29 Win=65152 Len=0 TSval=976372376 TSecr=129933353"
127,43.856827,192.168.11.26,192.168.11.7,TCP,66,0.000069,,0.000069,"Jan  8, 2024 10:29:57.010026000 JST",,34340  >  6000 [ACK] Seq=29 Ack=2 Win=64256 Len=0 TSval=129933364 TSecr=976372376
128,43.886519,192.168.11.26,255.255.255.255,UDP,209,,Ÿ,0.029692,"Jan  8, 2024 10:29:57.039718000 JST",7b2273656d616e74696373223a207b22656e74697479223a2022504944222c202262617365656e74697479223a2022616e79222c2022726f6c65223a20226c6c6c222c20227370617469616c223a2022616e79222c202274656d706f72616c223a2022616e79227d2c20226461746170726f7065727479223a207b22666f726d6174223a2022696e616f6b615f70726f6772616d5f73616d706c655f73656d616e746963227d7d,56865  >  7000 Len=167
129,43.89646,192.168.11.25,192.168.11.26,TCP,74,,œ,0.009941,"Jan  8, 2024 10:29:57.049659000 JST",,40548  >  6000 [SYN] Seq=0 Win=64240 Len=0 MSS=1460 SACK_PERM TSval=461360016 TSecr=0 WS=128
130,43.89662,192.168.11.26,192.168.11.25,TCP,74,0.00016,,0.00016,"Jan  8, 2024 10:29:57.049819000 JST",,"6000  >  40548 [SYN, ACK] Seq=0 Ack=1 Win=65160 Len=0 MSS=1460 SACK_PERM TSval=656426492 TSecr=461360016 WS=128"
131,43.903656,192.168.11.25,192.168.11.26,TCP,66,0.007036,,0.007036,"Jan  8, 2024 10:29:57.056855000 JST",,40548  >  6000 [ACK] Seq=1 Ack=1 Win=64256 Len=0 TSval=461360023 TSecr=656426492
132,43.904336,192.168.11.25,192.168.11.26,TCP,93,,,0.00068,"Jan  8, 2024 10:29:57.057535000 JST",,"40548  >  6000 [PSH, ACK] Seq=1 Ack=1 Win=64256 Len=27 TSval=461360023 TSecr=656426492 [TCP segment of a reassembled PDU]"
133,43.904468,192.168.11.26,192.168.11.25,TCP,66,0.000132,,0.000132,"Jan  8, 2024 10:29:57.057667000 JST",,6000  >  40548 [ACK] Seq=1 Ack=28 Win=65152 Len=0 TSval=656426500 TSecr=461360023
134,43.904553,192.168.11.25,192.168.11.26,TCP,66,,,0.000085,"Jan  8, 2024 10:29:57.057752000 JST",,"40548  >  6000 [FIN, ACK] Seq=28 Ack=1 Win=64256 Len=0 TSval=461360023 TSecr=656426492"
135,43.905693,192.168.11.26,192.168.11.25,TCP,66,0.00114,,0.00114,"Jan  8, 2024 10:29:57.058892000 JST",,"6000  >  40548 [FIN, ACK] Seq=1 Ack=29 Win=65152 Len=0 TSval=656426501 TSecr=461360023"
136,43.912141,192.168.11.25,192.168.11.26,TCP,66,0.006448,,0.006448,"Jan  8, 2024 10:29:57.065340000 JST",,40548  >  6000 [ACK] Seq=29 Ack=2 Win=64256 Len=0 TSval=461360031 TSecr=656426501
137,49.918808,192.168.11.26,192.168.11.7,TCP,74,,,6.006667,"Jan  8, 2024 10:30:03.072007000 JST",,41432  >  6000 [SYN] Seq=0 Win=64240 Len=0 MSS=1460 SACK_PERM TSval=129939426 TSecr=0 WS=128
138,49.927539,192.168.11.7,192.168.11.26,TCP,74,0.008731,,0.008731,"Jan  8, 2024 10:30:03.080738000 JST",,"6000  >  41432 [SYN, ACK] Seq=0 Ack=1 Win=65160 Len=0 MSS=1460 SACK_PERM TSval=976378445 TSecr=129939426 WS=128"
139,49.927655,192.168.11.26,192.168.11.7,TCP,66,0.000116,,0.000116,"Jan  8, 2024 10:30:03.080854000 JST",,41432  >  6000 [ACK] Seq=1 Ack=1 Win=64256 Len=0 TSval=129939435 TSecr=976378445
140,49.927804,192.168.11.26,192.168.11.7,TCP,93,,,0.000149,"Jan  8, 2024 10:30:03.081003000 JST",,"41432  >  6000 [PSH, ACK] Seq=1 Ack=1 Win=64256 Len=27 TSval=129939435 TSecr=976378445 [TCP segment of a reassembled PDU]"
141,49.927931,192.168.11.26,192.168.11.7,TCP,66,,,0.000127,"Jan  8, 2024 10:30:03.081130000 JST",,"41432  >  6000 [FIN, ACK] Seq=28 Ack=1 Win=64256 Len=0 TSval=129939435 TSecr=976378445"
142,49.940478,192.168.11.7,192.168.11.26,TCP,66,0.012674,,0.012547,"Jan  8, 2024 10:30:03.093677000 JST",,6000  >  41432 [ACK] Seq=1 Ack=28 Win=65152 Len=0 TSval=976378457 TSecr=129939435
143,49.940864,192.168.11.7,192.168.11.26,TCP,66,,,0.000386,"Jan  8, 2024 10:30:03.094063000 JST",,[TCP Dup ACK 142#1] 6000  >  41432 [ACK] Seq=1 Ack=28 Win=65152 Len=0 TSval=976378458 TSecr=129939435
144,49.940925,192.168.11.7,192.168.11.26,TCP,66,0.012994,,0.000061,"Jan  8, 2024 10:30:03.094124000 JST",,"6000  >  41432 [FIN, ACK] Seq=1 Ack=29 Win=65152 Len=0 TSval=976378460 TSecr=129939435"
145,49.940969,192.168.11.26,192.168.11.7,TCP,66,0.000044,,0.000044,"Jan  8, 2024 10:30:03.094168000 JST",,41432  >  6000 [ACK] Seq=29 Ack=2 Win=64256 Len=0 TSval=129939448 TSecr=976378460
146,49.973067,192.168.11.26,255.255.255.255,UDP,209,,Ÿ,0.032098,"Jan  8, 2024 10:30:03.126266000 JST",7b2273656d616e74696373223a207b22656e74697479223a2022504944222c202262617365656e74697479223a2022616e79222c2022726f6c65223a20226c6c6c222c20227370617469616c223a2022616e79222c202274656d706f72616c223a2022616e79227d2c20226461746170726f7065727479223a207b22666f726d6174223a2022696e616f6b615f70726f6772616d5f73616d706c655f73656d616e746963227d7d,33390  >  7000 Len=167
147,49.980584,192.168.11.25,192.168.11.26,TCP,74,,œ,0.007517,"Jan  8, 2024 10:30:03.133783000 JST",,46936  >  6000 [SYN] Seq=0 Win=64240 Len=0 MSS=1460 SACK_PERM TSval=461366100 TSecr=0 WS=128
148,49.980747,192.168.11.26,192.168.11.25,TCP,74,0.000163,,0.000163,"Jan  8, 2024 10:30:03.133946000 JST",,"6000  >  46936 [SYN, ACK] Seq=0 Ack=1 Win=65160 Len=0 MSS=1460 SACK_PERM TSval=656432576 TSecr=461366100 WS=128"
149,49.987499,192.168.11.25,192.168.11.26,TCP,66,0.006752,,0.006752,"Jan  8, 2024 10:30:03.140698000 JST",,46936  >  6000 [ACK] Seq=1 Ack=1 Win=64256 Len=0 TSval=461366107 TSecr=656432576
150,49.988154,192.168.11.25,192.168.11.26,TCP,93,,,0.000655,"Jan  8, 2024 10:30:03.141353000 JST",,"46936  >  6000 [PSH, ACK] Seq=1 Ack=1 Win=64256 Len=27 TSval=461366107 TSecr=656432576 [TCP segment of a reassembled PDU]"
151,49.988271,192.168.11.26,192.168.11.25,TCP,66,0.000117,,0.000117,"Jan  8, 2024 10:30:03.141470000 JST",,6000  >  46936 [ACK] Seq=1 Ack=28 Win=65152 Len=0 TSval=656432584 TSecr=461366107
152,49.988362,192.168.11.25,192.168.11.26,TCP,66,,,0.000091,"Jan  8, 2024 10:30:03.141561000 JST",,"46936  >  6000 [FIN, ACK] Seq=28 Ack=1 Win=64256 Len=0 TSval=461366107 TSecr=656432576"
153,49.989604,192.168.11.26,192.168.11.25,TCP,66,0.001242,,0.001242,"Jan  8, 2024 10:30:03.142803000 JST",,"6000  >  46936 [FIN, ACK] Seq=1 Ack=29 Win=65152 Len=0 TSval=656432585 TSecr=461366107"
154,49.995873,192.168.11.25,192.168.11.26,TCP,66,0.006269,,0.006269,"Jan  8, 2024 10:30:03.149072000 JST",,46936  >  6000 [ACK] Seq=29 Ack=2 Win=64256 Len=0 TSval=461366115 TSecr=656432585
155,56.031658,192.168.11.26,192.168.11.7,TCP,74,,,6.035785,"Jan  8, 2024 10:30:09.184857000 JST",,41438  >  6000 [SYN] Seq=0 Win=64240 Len=0 MSS=1460 SACK_PERM TSval=129945539 TSecr=0 WS=128
156,56.041253,192.168.11.7,192.168.11.26,TCP,74,0.009595,,0.009595,"Jan  8, 2024 10:30:09.194452000 JST",,"6000  >  41438 [SYN, ACK] Seq=0 Ack=1 Win=65160 Len=0 MSS=1460 SACK_PERM TSval=976384558 TSecr=129945539 WS=128"
157,56.041368,192.168.11.26,192.168.11.7,TCP,66,0.000115,,0.000115,"Jan  8, 2024 10:30:09.194567000 JST",,41438  >  6000 [ACK] Seq=1 Ack=1 Win=64256 Len=0 TSval=129945549 TSecr=976384558
158,56.041513,192.168.11.26,192.168.11.7,TCP,93,,,0.000145,"Jan  8, 2024 10:30:09.194712000 JST",,"41438  >  6000 [PSH, ACK] Seq=1 Ack=1 Win=64256 Len=27 TSval=129945549 TSecr=976384558 [TCP segment of a reassembled PDU]"
159,56.041619,192.168.11.26,192.168.11.7,TCP,66,,,0.000106,"Jan  8, 2024 10:30:09.194818000 JST",,"41438  >  6000 [FIN, ACK] Seq=28 Ack=1 Win=64256 Len=0 TSval=129945549 TSecr=976384558"
160,56.053142,192.168.11.7,192.168.11.26,TCP,66,0.011629,,0.011523,"Jan  8, 2024 10:30:09.206341000 JST",,6000  >  41438 [ACK] Seq=1 Ack=28 Win=65152 Len=0 TSval=976384571 TSecr=129945549
161,56.05338,192.168.11.7,192.168.11.26,TCP,66,0.011761,,0.000238,"Jan  8, 2024 10:30:09.206579000 JST",,"6000  >  41438 [FIN, ACK] Seq=1 Ack=29 Win=65152 Len=0 TSval=976384573 TSecr=129945549"
162,56.053429,192.168.11.26,192.168.11.7,TCP,66,0.000049,,0.000049,"Jan  8, 2024 10:30:09.206628000 JST",,41438  >  6000 [ACK] Seq=29 Ack=2 Win=64256 Len=0 TSval=129945561 TSecr=976384573
163,56.088854,192.168.11.26,255.255.255.255,UDP,209,,Ÿ,0.035425,"Jan  8, 2024 10:30:09.242053000 JST",7b2273656d616e74696373223a207b22656e74697479223a2022504944222c202262617365656e74697479223a2022616e79222c2022726f6c65223a20226c6c6c222c20227370617469616c223a2022616e79222c202274656d706f72616c223a2022616e79227d2c20226461746170726f7065727479223a207b22666f726d6174223a2022696e616f6b615f70726f6772616d5f73616d706c655f73656d616e746963227d7d,34852  >  7000 Len=167
164,56.096429,192.168.11.25,192.168.11.26,TCP,74,,œ,0.007575,"Jan  8, 2024 10:30:09.249628000 JST",,46938  >  6000 [SYN] Seq=0 Win=64240 Len=0 MSS=1460 SACK_PERM TSval=461372216 TSecr=0 WS=128
165,56.096578,192.168.11.26,192.168.11.25,TCP,74,0.000149,,0.000149,"Jan  8, 2024 10:30:09.249777000 JST",,"6000  >  46938 [SYN, ACK] Seq=0 Ack=1 Win=65160 Len=0 MSS=1460 SACK_PERM TSval=656438692 TSecr=461372216 WS=128"
166,56.103313,192.168.11.25,192.168.11.26,TCP,66,0.006735,,0.006735,"Jan  8, 2024 10:30:09.256512000 JST",,46938  >  6000 [ACK] Seq=1 Ack=1 Win=64256 Len=0 TSval=461372223 TSecr=656438692
167,56.103951,192.168.11.25,192.168.11.26,TCP,93,,,0.000638,"Jan  8, 2024 10:30:09.257150000 JST",,"46938  >  6000 [PSH, ACK] Seq=1 Ack=1 Win=64256 Len=27 TSval=461372223 TSecr=656438692 [TCP segment of a reassembled PDU]"
168,56.104086,192.168.11.26,192.168.11.25,TCP,66,0.000135,,0.000135,"Jan  8, 2024 10:30:09.257285000 JST",,6000  >  46938 [ACK] Seq=1 Ack=28 Win=65152 Len=0 TSval=656438699 TSecr=461372223
169,56.104178,192.168.11.25,192.168.11.26,TCP,66,,,0.000092,"Jan  8, 2024 10:30:09.257377000 JST",,"46938  >  6000 [FIN, ACK] Seq=28 Ack=1 Win=64256 Len=0 TSval=461372223 TSecr=656438692"
170,56.105454,192.168.11.26,192.168.11.25,TCP,66,0.001276,,0.001276,"Jan  8, 2024 10:30:09.258653000 JST",,"6000  >  46938 [FIN, ACK] Seq=1 Ack=29 Win=65152 Len=0 TSval=656438701 TSecr=461372223"
171,56.111725,192.168.11.25,192.168.11.26,TCP,66,0.006271,,0.006271,"Jan  8, 2024 10:30:09.264924000 JST",,46938  >  6000 [ACK] Seq=29 Ack=2 Win=64256 Len=0 TSval=461372231 TSecr=656438701
172,87.20994,192.168.11.26,192.168.11.7,TCP,74,,,31.098215,"Jan  8, 2024 10:30:40.363139000 JST",,33802  >  6000 [SYN] Seq=0 Win=64240 Len=0 MSS=1460 SACK_PERM TSval=129976717 TSecr=0 WS=128
173,87.218489,192.168.11.7,192.168.11.26,TCP,74,0.008549,,0.008549,"Jan  8, 2024 10:30:40.371688000 JST",,"6000  >  33802 [SYN, ACK] Seq=0 Ack=1 Win=65160 Len=0 MSS=1460 SACK_PERM TSval=976415736 TSecr=129976717 WS=128"
174,87.21862,192.168.11.26,192.168.11.7,TCP,66,0.000131,,0.000131,"Jan  8, 2024 10:30:40.371819000 JST",,33802  >  6000 [ACK] Seq=1 Ack=1 Win=64256 Len=0 TSval=129976726 TSecr=976415736
175,87.218764,192.168.11.26,192.168.11.7,TCP,93,,,0.000144,"Jan  8, 2024 10:30:40.371963000 JST",,"33802  >  6000 [PSH, ACK] Seq=1 Ack=1 Win=64256 Len=27 TSval=129976726 TSecr=976415736 [TCP segment of a reassembled PDU]"
176,87.218896,192.168.11.26,192.168.11.7,TCP,66,,,0.000132,"Jan  8, 2024 10:30:40.372095000 JST",,"33802  >  6000 [FIN, ACK] Seq=28 Ack=1 Win=64256 Len=0 TSval=129976726 TSecr=976415736"
177,87.226782,192.168.11.7,192.168.11.26,TCP,66,0.008018,,0.007886,"Jan  8, 2024 10:30:40.379981000 JST",,6000  >  33802 [ACK] Seq=1 Ack=28 Win=65152 Len=0 TSval=976415745 TSecr=129976726
178,87.229237,192.168.11.7,192.168.11.26,TCP,66,0.010341,,0.002455,"Jan  8, 2024 10:30:40.382436000 JST",,"6000  >  33802 [FIN, ACK] Seq=1 Ack=29 Win=65152 Len=0 TSval=976415748 TSecr=129976726"
179,87.229304,192.168.11.26,192.168.11.7,TCP,66,0.000067,,0.000067,"Jan  8, 2024 10:30:40.382503000 JST",,33802  >  6000 [ACK] Seq=29 Ack=2 Win=64256 Len=0 TSval=129976737 TSecr=976415748
180,87.261394,192.168.11.26,255.255.255.255,UDP,209,,Ÿ,0.03209,"Jan  8, 2024 10:30:40.414593000 JST",7b2273656d616e74696373223a207b22656e74697479223a2022504944222c202262617365656e74697479223a2022616e79222c2022726f6c65223a20226c6c6c222c20227370617469616c223a2022616e79222c202274656d706f72616c223a2022616e79227d2c20226461746170726f7065727479223a207b22666f726d6174223a2022696e616f6b615f70726f6772616d5f73616d706c655f73656d616e746963227d7d,46699  >  7000 Len=167
181,87.268708,192.168.11.25,192.168.11.26,TCP,74,,œ,0.007314,"Jan  8, 2024 10:30:40.421907000 JST",,34316  >  6000 [SYN] Seq=0 Win=64240 Len=0 MSS=1460 SACK_PERM TSval=461403388 TSecr=0 WS=128
182,87.268898,192.168.11.26,192.168.11.25,TCP,74,0.00019,,0.00019,"Jan  8, 2024 10:30:40.422097000 JST",,"6000  >  34316 [SYN, ACK] Seq=0 Ack=1 Win=65160 Len=0 MSS=1460 SACK_PERM TSval=656469864 TSecr=461403388 WS=128"
183,87.275829,192.168.11.25,192.168.11.26,TCP,66,0.006931,,0.006931,"Jan  8, 2024 10:30:40.429028000 JST",,34316  >  6000 [ACK] Seq=1 Ack=1 Win=64256 Len=0 TSval=461403395 TSecr=656469864
184,87.276471,192.168.11.25,192.168.11.26,TCP,93,,,0.000642,"Jan  8, 2024 10:30:40.429670000 JST",,"34316  >  6000 [PSH, ACK] Seq=1 Ack=1 Win=64256 Len=27 TSval=461403395 TSecr=656469864 [TCP segment of a reassembled PDU]"
185,87.276631,192.168.11.26,192.168.11.25,TCP,66,0.00016,,0.00016,"Jan  8, 2024 10:30:40.429830000 JST",,6000  >  34316 [ACK] Seq=1 Ack=28 Win=65152 Len=0 TSval=656469872 TSecr=461403395
186,87.276706,192.168.11.25,192.168.11.26,TCP,66,,,0.000075,"Jan  8, 2024 10:30:40.429905000 JST",,"34316  >  6000 [FIN, ACK] Seq=28 Ack=1 Win=64256 Len=0 TSval=461403395 TSecr=656469864"
187,87.278057,192.168.11.26,192.168.11.25,TCP,66,0.001351,,0.001351,"Jan  8, 2024 10:30:40.431256000 JST",,"6000  >  34316 [FIN, ACK] Seq=1 Ack=29 Win=65152 Len=0 TSval=656469873 TSecr=461403395"
