No.,Time,Source,Destination,Protocol,Length,The RTT to ACK the segment was,XXX,Time delta from previous captured frame,Arrival Time,Data,Info
1,0,192.168.11.5,192.168.11.4,TCP,74,,,0,"Jan  8, 2024 10:29:13.316137000 JST",,33730  >  6000 [SYN] Seq=0 Win=64240 Len=0 MSS=1460 SACK_PERM TSval=2029979840 TSecr=0 WS=128
2,0.010233,192.168.11.4,192.168.11.5,TCP,74,0.010233,,0.010233,"Jan  8, 2024 10:29:13.326370000 JST",,"6000  >  33730 [SYN, ACK] Seq=0 Ack=1 Win=65160 Len=0 MSS=1460 SACK_PERM TSval=4073705197 TSecr=2029979840 WS=128"
3,0.010351,192.168.11.5,192.168.11.4,TCP,66,0.000118,,0.000118,"Jan  8, 2024 10:29:13.326488000 JST",,33730  >  6000 [ACK] Seq=1 Ack=1 Win=64256 Len=0 TSval=2029979855 TSecr=4073705197
4,0.010559,192.168.11.5,192.168.11.4,TCP,93,,,0.000208,"Jan  8, 2024 10:29:13.326696000 JST",,"33730  >  6000 [PSH, ACK] Seq=1 Ack=1 Win=64256 Len=27 TSval=2029979855 TSecr=4073705197 [TCP segment of a reassembled PDU]"
5,0.010725,192.168.11.5,192.168.11.4,TCP,66,,,0.000166,"Jan  8, 2024 10:29:13.326862000 JST",,"33730  >  6000 [FIN, ACK] Seq=28 Ack=1 Win=64256 Len=0 TSval=2029979856 TSecr=4073705197"
6,0.018341,192.168.11.4,192.168.11.5,TCP,66,0.007782,,0.007616,"Jan  8, 2024 10:29:13.334478000 JST",,6000  >  33730 [ACK] Seq=1 Ack=28 Win=65152 Len=0 TSval=4073705206 TSecr=2029979855
7,0.018568,192.168.11.4,192.168.11.5,TCP,66,0.007843,,0.000227,"Jan  8, 2024 10:29:13.334705000 JST",,"6000  >  33730 [FIN, ACK] Seq=1 Ack=29 Win=65152 Len=0 TSval=4073705207 TSecr=2029979856"
8,0.018622,192.168.11.5,192.168.11.4,TCP,66,0.000054,,0.000054,"Jan  8, 2024 10:29:13.334759000 JST",,33730  >  6000 [ACK] Seq=29 Ack=2 Win=64256 Len=0 TSval=2029979863 TSecr=4073705207
9,0.050435,192.168.11.5,255.255.255.255,UDP,209,,Ÿ,0.031813,"Jan  8, 2024 10:29:13.366572000 JST",7b2273656d616e74696373223a207b22656e74697479223a2022504944222c202262617365656e74697479223a2022616e79222c2022726f6c65223a20226f6f6f222c20227370617469616c223a2022616e79222c202274656d706f72616c223a2022616e79227d2c20226461746170726f7065727479223a207b22666f726d6174223a2022696e616f6b615f70726f6772616d5f73616d706c655f73656d616e746963227d7d,57289  >  7000 Len=167
10,0.062942,192.168.11.11,192.168.11.5,TCP,74,,œ,0.012507,"Jan  8, 2024 10:29:13.379079000 JST",,42584  >  6000 [SYN] Seq=0 Win=64240 Len=0 MSS=1460 SACK_PERM TSval=1917514397 TSecr=0 WS=128
11,0.063083,192.168.11.5,192.168.11.11,TCP,74,0.000141,,0.000141,"Jan  8, 2024 10:29:13.379220000 JST",,"6000  >  42584 [SYN, ACK] Seq=0 Ack=1 Win=65160 Len=0 MSS=1460 SACK_PERM TSval=2805655308 TSecr=1917514397 WS=128"
12,0.071287,192.168.11.11,192.168.11.5,TCP,66,0.008204,,0.008204,"Jan  8, 2024 10:29:13.387424000 JST",,42584  >  6000 [ACK] Seq=1 Ack=1 Win=64256 Len=0 TSval=1917514410 TSecr=2805655308
13,0.071749,192.168.11.11,192.168.11.5,TCP,93,,,0.000462,"Jan  8, 2024 10:29:13.387886000 JST",,"42584  >  6000 [PSH, ACK] Seq=1 Ack=1 Win=64256 Len=27 TSval=1917514410 TSecr=2805655308 [TCP segment of a reassembled PDU]"
14,0.071822,192.168.11.5,192.168.11.11,TCP,66,0.000073,,0.000073,"Jan  8, 2024 10:29:13.387959000 JST",,6000  >  42584 [ACK] Seq=1 Ack=28 Win=65152 Len=0 TSval=2805655317 TSecr=1917514410
15,0.071879,192.168.11.11,192.168.11.5,TCP,66,,,0.000057,"Jan  8, 2024 10:29:13.388016000 JST",,"42584  >  6000 [FIN, ACK] Seq=28 Ack=1 Win=64256 Len=0 TSval=1917514410 TSecr=2805655308"
16,0.073099,192.168.11.5,192.168.11.11,TCP,66,0.00122,,0.00122,"Jan  8, 2024 10:29:13.389236000 JST",,"6000  >  42584 [FIN, ACK] Seq=1 Ack=29 Win=65152 Len=0 TSval=2805655318 TSecr=1917514410"
17,0.079498,192.168.11.11,192.168.11.5,TCP,66,0.006399,,0.006399,"Jan  8, 2024 10:29:13.395635000 JST",,42584  >  6000 [ACK] Seq=29 Ack=2 Win=64256 Len=0 TSval=1917514418 TSecr=2805655318
18,6.152602,192.168.11.5,192.168.11.4,TCP,74,,,6.073104,"Jan  8, 2024 10:29:19.468739000 JST",,33736  >  6000 [SYN] Seq=0 Win=64240 Len=0 MSS=1460 SACK_PERM TSval=2029985997 TSecr=0 WS=128
19,6.159207,192.168.11.4,192.168.11.5,TCP,74,0.006605,,0.006605,"Jan  8, 2024 10:29:19.475344000 JST",,"6000  >  33736 [SYN, ACK] Seq=0 Ack=1 Win=65160 Len=0 MSS=1460 SACK_PERM TSval=4073711347 TSecr=2029985997 WS=128"
20,6.159317,192.168.11.5,192.168.11.4,TCP,66,0.00011,,0.00011,"Jan  8, 2024 10:29:19.475454000 JST",,33736  >  6000 [ACK] Seq=1 Ack=1 Win=64256 Len=0 TSval=2029986004 TSecr=4073711347
21,6.159467,192.168.11.5,192.168.11.4,TCP,93,,,0.00015,"Jan  8, 2024 10:29:19.475604000 JST",,"33736  >  6000 [PSH, ACK] Seq=1 Ack=1 Win=64256 Len=27 TSval=2029986004 TSecr=4073711347 [TCP segment of a reassembled PDU]"
22,6.159608,192.168.11.5,192.168.11.4,TCP,66,,,0.000141,"Jan  8, 2024 10:29:19.475745000 JST",,"33736  >  6000 [FIN, ACK] Seq=28 Ack=1 Win=64256 Len=0 TSval=2029986004 TSecr=4073711347"
23,6.166769,192.168.11.4,192.168.11.5,TCP,66,0.007302,,0.007161,"Jan  8, 2024 10:29:19.482906000 JST",,6000  >  33736 [ACK] Seq=1 Ack=28 Win=65152 Len=0 TSval=4073711354 TSecr=2029986004
24,6.167008,192.168.11.4,192.168.11.5,TCP,66,0.0074,,0.000239,"Jan  8, 2024 10:29:19.483145000 JST",,"6000  >  33736 [FIN, ACK] Seq=1 Ack=29 Win=65152 Len=0 TSval=4073711356 TSecr=2029986004"
25,6.167054,192.168.11.5,192.168.11.4,TCP,66,0.000046,,0.000046,"Jan  8, 2024 10:29:19.483191000 JST",,33736  >  6000 [ACK] Seq=29 Ack=2 Win=64256 Len=0 TSval=2029986012 TSecr=4073711356
26,6.198566,192.168.11.5,255.255.255.255,UDP,209,,Ÿ,0.031512,"Jan  8, 2024 10:29:19.514703000 JST",7b2273656d616e74696373223a207b22656e74697479223a2022504944222c202262617365656e74697479223a2022616e79222c2022726f6c65223a20226f6f6f222c20227370617469616c223a2022616e79222c202274656d706f72616c223a2022616e79227d2c20226461746170726f7065727479223a207b22666f726d6174223a2022696e616f6b615f70726f6772616d5f73616d706c655f73656d616e746963227d7d,35016  >  7000 Len=167
27,6.206274,192.168.11.11,192.168.11.5,TCP,74,,œ,0.007708,"Jan  8, 2024 10:29:19.522411000 JST",,42596  >  6000 [SYN] Seq=0 Win=64240 Len=0 MSS=1460 SACK_PERM TSval=1917520545 TSecr=0 WS=128
28,6.206428,192.168.11.5,192.168.11.11,TCP,74,0.000154,,0.000154,"Jan  8, 2024 10:29:19.522565000 JST",,"6000  >  42596 [SYN, ACK] Seq=0 Ack=1 Win=65160 Len=0 MSS=1460 SACK_PERM TSval=2805661451 TSecr=1917520545 WS=128"
29,6.213094,192.168.11.11,192.168.11.5,TCP,66,0.006666,,0.006666,"Jan  8, 2024 10:29:19.529231000 JST",,42596  >  6000 [ACK] Seq=1 Ack=1 Win=64256 Len=0 TSval=1917520552 TSecr=2805661451
30,6.213811,192.168.11.11,192.168.11.5,TCP,93,,,0.000717,"Jan  8, 2024 10:29:19.529948000 JST",,"42596  >  6000 [PSH, ACK] Seq=1 Ack=1 Win=64256 Len=27 TSval=1917520552 TSecr=2805661451 [TCP segment of a reassembled PDU]"
31,6.213943,192.168.11.5,192.168.11.11,TCP,66,0.000132,,0.000132,"Jan  8, 2024 10:29:19.530080000 JST",,6000  >  42596 [ACK] Seq=1 Ack=28 Win=65152 Len=0 TSval=2805661459 TSecr=1917520552
32,6.214026,192.168.11.11,192.168.11.5,TCP,66,,,0.000083,"Jan  8, 2024 10:29:19.530163000 JST",,"42596  >  6000 [FIN, ACK] Seq=28 Ack=1 Win=64256 Len=0 TSval=1917520552 TSecr=2805661451"
33,6.216199,192.168.11.5,192.168.11.11,TCP,66,0.002173,,0.002173,"Jan  8, 2024 10:29:19.532336000 JST",,"6000  >  42596 [FIN, ACK] Seq=1 Ack=29 Win=65152 Len=0 TSval=2805661461 TSecr=1917520552"
34,6.220776,192.168.11.11,192.168.11.5,TCP,66,0.004577,,0.004577,"Jan  8, 2024 10:29:19.536913000 JST",,42596  >  6000 [ACK] Seq=29 Ack=2 Win=64256 Len=0 TSval=1917520560 TSecr=2805661461
35,12.256141,192.168.11.5,192.168.11.4,TCP,74,,,6.035365,"Jan  8, 2024 10:29:25.572278000 JST",,60610  >  6000 [SYN] Seq=0 Win=64240 Len=0 MSS=1460 SACK_PERM TSval=2029992101 TSecr=0 WS=128
36,12.262708,192.168.11.4,192.168.11.5,TCP,74,0.006567,,0.006567,"Jan  8, 2024 10:29:25.578845000 JST",,"6000  >  60610 [SYN, ACK] Seq=0 Ack=1 Win=65160 Len=0 MSS=1460 SACK_PERM TSval=4073717451 TSecr=2029992101 WS=128"
37,12.262816,192.168.11.5,192.168.11.4,TCP,66,0.000108,,0.000108,"Jan  8, 2024 10:29:25.578953000 JST",,60610  >  6000 [ACK] Seq=1 Ack=1 Win=64256 Len=0 TSval=2029992108 TSecr=4073717451
38,12.262996,192.168.11.5,192.168.11.4,TCP,93,,,0.00018,"Jan  8, 2024 10:29:25.579133000 JST",,"60610  >  6000 [PSH, ACK] Seq=1 Ack=1 Win=64256 Len=27 TSval=2029992108 TSecr=4073717451 [TCP segment of a reassembled PDU]"
39,12.263099,192.168.11.5,192.168.11.4,TCP,66,,,0.000103,"Jan  8, 2024 10:29:25.579236000 JST",,"60610  >  6000 [FIN, ACK] Seq=28 Ack=1 Win=64256 Len=0 TSval=2029992108 TSecr=4073717451"
40,12.270926,192.168.11.4,192.168.11.5,TCP,66,0.00793,,0.007827,"Jan  8, 2024 10:29:25.587063000 JST",,6000  >  60610 [ACK] Seq=1 Ack=28 Win=65152 Len=0 TSval=4073717458 TSecr=2029992108
41,12.271153,192.168.11.4,192.168.11.5,TCP,66,0.008054,,0.000227,"Jan  8, 2024 10:29:25.587290000 JST",,"6000  >  60610 [FIN, ACK] Seq=1 Ack=29 Win=65152 Len=0 TSval=4073717460 TSecr=2029992108"
42,12.271201,192.168.11.5,192.168.11.4,TCP,66,0.000048,,0.000048,"Jan  8, 2024 10:29:25.587338000 JST",,60610  >  6000 [ACK] Seq=29 Ack=2 Win=64256 Len=0 TSval=2029992116 TSecr=4073717460
43,12.304534,192.168.11.5,255.255.255.255,UDP,209,,Ÿ,0.033333,"Jan  8, 2024 10:29:25.620671000 JST",7b2273656d616e74696373223a207b22656e74697479223a2022504944222c202262617365656e74697479223a2022616e79222c2022726f6c65223a20226f6f6f222c20227370617469616c223a2022616e79222c202274656d706f72616c223a2022616e79227d2c20226461746170726f7065727479223a207b22666f726d6174223a2022696e616f6b615f70726f6772616d5f73616d706c655f73656d616e746963227d7d,37333  >  7000 Len=167
44,12.312155,192.168.11.11,192.168.11.5,TCP,74,,œ,0.007621,"Jan  8, 2024 10:29:25.628292000 JST",,54894  >  6000 [SYN] Seq=0 Win=64240 Len=0 MSS=1460 SACK_PERM TSval=1917526651 TSecr=0 WS=128
45,12.312303,192.168.11.5,192.168.11.11,TCP,74,0.000148,,0.000148,"Jan  8, 2024 10:29:25.628440000 JST",,"6000  >  54894 [SYN, ACK] Seq=0 Ack=1 Win=65160 Len=0 MSS=1460 SACK_PERM TSval=2805667557 TSecr=1917526651 WS=128"
46,12.319014,192.168.11.11,192.168.11.5,TCP,66,0.006711,,0.006711,"Jan  8, 2024 10:29:25.635151000 JST",,54894  >  6000 [ACK] Seq=1 Ack=1 Win=64256 Len=0 TSval=1917526658 TSecr=2805667557
47,12.319658,192.168.11.11,192.168.11.5,TCP,93,,,0.000644,"Jan  8, 2024 10:29:25.635795000 JST",,"54894  >  6000 [PSH, ACK] Seq=1 Ack=1 Win=64256 Len=27 TSval=1917526658 TSecr=2805667557 [TCP segment of a reassembled PDU]"
48,12.319752,192.168.11.5,192.168.11.11,TCP,66,0.000094,,0.000094,"Jan  8, 2024 10:29:25.635889000 JST",,6000  >  54894 [ACK] Seq=1 Ack=28 Win=65152 Len=0 TSval=2805667564 TSecr=1917526658
49,12.319836,192.168.11.11,192.168.11.5,TCP,66,,,0.000084,"Jan  8, 2024 10:29:25.635973000 JST",,"54894  >  6000 [FIN, ACK] Seq=28 Ack=1 Win=64256 Len=0 TSval=1917526658 TSecr=2805667557"
50,12.321317,192.168.11.5,192.168.11.11,TCP,66,0.001481,,0.001481,"Jan  8, 2024 10:29:25.637454000 JST",,"6000  >  54894 [FIN, ACK] Seq=1 Ack=29 Win=65152 Len=0 TSval=2805667566 TSecr=1917526658"
51,12.327793,192.168.11.11,192.168.11.5,TCP,66,0.006476,,0.006476,"Jan  8, 2024 10:29:25.643930000 JST",,54894  >  6000 [ACK] Seq=29 Ack=2 Win=64256 Len=0 TSval=1917526666 TSecr=2805667566
52,18.367093,192.168.11.5,192.168.11.4,TCP,74,,,6.0393,"Jan  8, 2024 10:29:31.683230000 JST",,41112  >  6000 [SYN] Seq=0 Win=64240 Len=0 MSS=1460 SACK_PERM TSval=2029998212 TSecr=0 WS=128
53,18.373665,192.168.11.4,192.168.11.5,TCP,74,0.006572,,0.006572,"Jan  8, 2024 10:29:31.689802000 JST",,"6000  >  41112 [SYN, ACK] Seq=0 Ack=1 Win=65160 Len=0 MSS=1460 SACK_PERM TSval=4073723562 TSecr=2029998212 WS=128"
54,18.373801,192.168.11.5,192.168.11.4,TCP,66,0.000136,,0.000136,"Jan  8, 2024 10:29:31.689938000 JST",,41112  >  6000 [ACK] Seq=1 Ack=1 Win=64256 Len=0 TSval=2029998219 TSecr=4073723562
55,18.373981,192.168.11.5,192.168.11.4,TCP,93,,,0.00018,"Jan  8, 2024 10:29:31.690118000 JST",,"41112  >  6000 [PSH, ACK] Seq=1 Ack=1 Win=64256 Len=27 TSval=2029998219 TSecr=4073723562 [TCP segment of a reassembled PDU]"
56,18.374106,192.168.11.5,192.168.11.4,TCP,66,,,0.000125,"Jan  8, 2024 10:29:31.690243000 JST",,"41112  >  6000 [FIN, ACK] Seq=28 Ack=1 Win=64256 Len=0 TSval=2029998219 TSecr=4073723562"
57,18.381304,192.168.11.4,192.168.11.5,TCP,66,0.007323,,0.007198,"Jan  8, 2024 10:29:31.697441000 JST",,6000  >  41112 [ACK] Seq=1 Ack=28 Win=65152 Len=0 TSval=4073723569 TSecr=2029998219
58,18.38167,192.168.11.4,192.168.11.5,TCP,66,0.007564,,0.000366,"Jan  8, 2024 10:29:31.697807000 JST",,"6000  >  41112 [FIN, ACK] Seq=1 Ack=29 Win=65152 Len=0 TSval=4073723570 TSecr=2029998219"
59,18.38175,192.168.11.5,192.168.11.4,TCP,66,0.00008,,0.00008,"Jan  8, 2024 10:29:31.697887000 JST",,41112  >  6000 [ACK] Seq=29 Ack=2 Win=64256 Len=0 TSval=2029998226 TSecr=4073723570
60,18.412271,192.168.11.5,255.255.255.255,UDP,209,,Ÿ,0.030521,"Jan  8, 2024 10:29:31.728408000 JST",7b2273656d616e74696373223a207b22656e74697479223a2022504944222c202262617365656e74697479223a2022616e79222c2022726f6c65223a20226f6f6f222c20227370617469616c223a2022616e79222c202274656d706f72616c223a2022616e79227d2c20226461746170726f7065727479223a207b22666f726d6174223a2022696e616f6b615f70726f6772616d5f73616d706c655f73656d616e746963227d7d,37081  >  7000 Len=167
61,18.419991,192.168.11.11,192.168.11.5,TCP,74,,œ,0.00772,"Jan  8, 2024 10:29:31.736128000 JST",,54900  >  6000 [SYN] Seq=0 Win=64240 Len=0 MSS=1460 SACK_PERM TSval=1917532759 TSecr=0 WS=128
62,18.420148,192.168.11.5,192.168.11.11,TCP,74,0.000157,,0.000157,"Jan  8, 2024 10:29:31.736285000 JST",,"6000  >  54900 [SYN, ACK] Seq=0 Ack=1 Win=65160 Len=0 MSS=1460 SACK_PERM TSval=2805673665 TSecr=1917532759 WS=128"
63,18.431927,192.168.11.11,192.168.11.5,TCP,66,0.011779,,0.011779,"Jan  8, 2024 10:29:31.748064000 JST",,54900  >  6000 [ACK] Seq=1 Ack=1 Win=64256 Len=0 TSval=1917532768 TSecr=2805673665
64,18.432522,192.168.11.11,192.168.11.5,TCP,93,,,0.000595,"Jan  8, 2024 10:29:31.748659000 JST",,"54900  >  6000 [PSH, ACK] Seq=1 Ack=1 Win=64256 Len=27 TSval=1917532768 TSecr=2805673665 [TCP segment of a reassembled PDU]"
65,18.43258,192.168.11.11,192.168.11.5,TCP,66,,,0.000058,"Jan  8, 2024 10:29:31.748717000 JST",,"54900  >  6000 [FIN, ACK] Seq=28 Ack=1 Win=64256 Len=0 TSval=1917532768 TSecr=2805673665"
66,18.432641,192.168.11.5,192.168.11.11,TCP,66,0.000119,,0.000061,"Jan  8, 2024 10:29:31.748778000 JST",,6000  >  54900 [ACK] Seq=1 Ack=28 Win=65152 Len=0 TSval=2805673677 TSecr=1917532768
67,18.435142,192.168.11.5,192.168.11.11,TCP,66,0.002562,,0.002501,"Jan  8, 2024 10:29:31.751279000 JST",,"6000  >  54900 [FIN, ACK] Seq=1 Ack=29 Win=65152 Len=0 TSval=2805673680 TSecr=1917532768"
68,18.442295,192.168.11.11,192.168.11.5,TCP,66,0.007153,,0.007153,"Jan  8, 2024 10:29:31.758432000 JST",,54900  >  6000 [ACK] Seq=29 Ack=2 Win=64256 Len=0 TSval=1917532781 TSecr=2805673680
69,25.478238,192.168.11.5,192.168.11.4,TCP,74,,,7.035943,"Jan  8, 2024 10:29:38.794375000 JST",,41128  >  6000 [SYN] Seq=0 Win=64240 Len=0 MSS=1460 SACK_PERM TSval=2030005323 TSecr=0 WS=128
70,25.48644,192.168.11.4,192.168.11.5,TCP,74,0.008202,,0.008202,"Jan  8, 2024 10:29:38.802577000 JST",,"6000  >  41128 [SYN, ACK] Seq=0 Ack=1 Win=65160 Len=0 MSS=1460 SACK_PERM TSval=4073730674 TSecr=2030005323 WS=128"
71,25.486572,192.168.11.5,192.168.11.4,TCP,66,0.000132,,0.000132,"Jan  8, 2024 10:29:38.802709000 JST",,41128  >  6000 [ACK] Seq=1 Ack=1 Win=64256 Len=0 TSval=2030005331 TSecr=4073730674
72,25.486762,192.168.11.5,192.168.11.4,TCP,93,,,0.00019,"Jan  8, 2024 10:29:38.802899000 JST",,"41128  >  6000 [PSH, ACK] Seq=1 Ack=1 Win=64256 Len=27 TSval=2030005332 TSecr=4073730674 [TCP segment of a reassembled PDU]"
73,25.486875,192.168.11.5,192.168.11.4,TCP,66,,,0.000113,"Jan  8, 2024 10:29:38.803012000 JST",,"41128  >  6000 [FIN, ACK] Seq=28 Ack=1 Win=64256 Len=0 TSval=2030005332 TSecr=4073730674"
74,25.495864,192.168.11.4,192.168.11.5,TCP,66,0.009102,,0.008989,"Jan  8, 2024 10:29:38.812001000 JST",,6000  >  41128 [ACK] Seq=1 Ack=28 Win=65152 Len=0 TSval=4073730683 TSecr=2030005332
75,25.496271,192.168.11.4,192.168.11.5,TCP,66,0.009396,,0.000407,"Jan  8, 2024 10:29:38.812408000 JST",,"6000  >  41128 [FIN, ACK] Seq=1 Ack=29 Win=65152 Len=0 TSval=4073730684 TSecr=2030005332"
76,25.496326,192.168.11.5,192.168.11.4,TCP,66,0.000055,,0.000055,"Jan  8, 2024 10:29:38.812463000 JST",,41128  >  6000 [ACK] Seq=29 Ack=2 Win=64256 Len=0 TSval=2030005341 TSecr=4073730684
77,25.528623,192.168.11.5,255.255.255.255,UDP,209,,Ÿ,0.032297,"Jan  8, 2024 10:29:38.844760000 JST",7b2273656d616e74696373223a207b22656e74697479223a2022504944222c202262617365656e74697479223a2022616e79222c2022726f6c65223a20226f6f6f222c20227370617469616c223a2022616e79222c202274656d706f72616c223a2022616e79227d2c20226461746170726f7065727479223a207b22666f726d6174223a2022696e616f6b615f70726f6772616d5f73616d706c655f73656d616e746963227d7d,41102  >  7000 Len=167
78,25.536283,192.168.11.11,192.168.11.5,TCP,74,,œ,0.00766,"Jan  8, 2024 10:29:38.852420000 JST",,34004  >  6000 [SYN] Seq=0 Win=64240 Len=0 MSS=1460 SACK_PERM TSval=1917539875 TSecr=0 WS=128
79,25.536447,192.168.11.5,192.168.11.11,TCP,74,0.000164,,0.000164,"Jan  8, 2024 10:29:38.852584000 JST",,"6000  >  34004 [SYN, ACK] Seq=0 Ack=1 Win=65160 Len=0 MSS=1460 SACK_PERM TSval=2805680781 TSecr=1917539875 WS=128"
80,25.543296,192.168.11.11,192.168.11.5,TCP,66,0.006849,,0.006849,"Jan  8, 2024 10:29:38.859433000 JST",,34004  >  6000 [ACK] Seq=1 Ack=1 Win=64256 Len=0 TSval=1917539882 TSecr=2805680781
81,25.543901,192.168.11.11,192.168.11.5,TCP,93,,,0.000605,"Jan  8, 2024 10:29:38.860038000 JST",,"34004  >  6000 [PSH, ACK] Seq=1 Ack=1 Win=64256 Len=27 TSval=1917539882 TSecr=2805680781 [TCP segment of a reassembled PDU]"
82,25.544017,192.168.11.5,192.168.11.11,TCP,66,0.000116,,0.000116,"Jan  8, 2024 10:29:38.860154000 JST",,6000  >  34004 [ACK] Seq=1 Ack=28 Win=65152 Len=0 TSval=2805680789 TSecr=1917539882
83,25.544095,192.168.11.11,192.168.11.5,TCP,66,,,0.000078,"Jan  8, 2024 10:29:38.860232000 JST",,"34004  >  6000 [FIN, ACK] Seq=28 Ack=1 Win=64256 Len=0 TSval=1917539882 TSecr=2805680781"
84,25.545308,192.168.11.5,192.168.11.11,TCP,66,0.001213,,0.001213,"Jan  8, 2024 10:29:38.861445000 JST",,"6000  >  34004 [FIN, ACK] Seq=1 Ack=29 Win=65152 Len=0 TSval=2805680790 TSecr=1917539882"
85,25.551474,192.168.11.11,192.168.11.5,TCP,66,0.006166,,0.006166,"Jan  8, 2024 10:29:38.867611000 JST",,34004  >  6000 [ACK] Seq=29 Ack=2 Win=64256 Len=0 TSval=1917539890 TSecr=2805680790
86,31.585856,192.168.11.5,192.168.11.4,TCP,74,,,6.034382,"Jan  8, 2024 10:29:44.901993000 JST",,33104  >  6000 [SYN] Seq=0 Win=64240 Len=0 MSS=1460 SACK_PERM TSval=2030011431 TSecr=0 WS=128
87,31.592433,192.168.11.4,192.168.11.5,TCP,74,0.006577,,0.006577,"Jan  8, 2024 10:29:44.908570000 JST",,"6000  >  33104 [SYN, ACK] Seq=0 Ack=1 Win=65160 Len=0 MSS=1460 SACK_PERM TSval=4073736780 TSecr=2030011431 WS=128"
88,31.592565,192.168.11.5,192.168.11.4,TCP,66,0.000132,,0.000132,"Jan  8, 2024 10:29:44.908702000 JST",,33104  >  6000 [ACK] Seq=1 Ack=1 Win=64256 Len=0 TSval=2030011437 TSecr=4073736780
89,31.592761,192.168.11.5,192.168.11.4,TCP,93,,,0.000196,"Jan  8, 2024 10:29:44.908898000 JST",,"33104  >  6000 [PSH, ACK] Seq=1 Ack=1 Win=64256 Len=27 TSval=2030011438 TSecr=4073736780 [TCP segment of a reassembled PDU]"
90,31.592874,192.168.11.5,192.168.11.4,TCP,66,,,0.000113,"Jan  8, 2024 10:29:44.909011000 JST",,"33104  >  6000 [FIN, ACK] Seq=28 Ack=1 Win=64256 Len=0 TSval=2030011438 TSecr=4073736780"
91,31.609299,192.168.11.4,192.168.11.5,TCP,66,0.016538,,0.016425,"Jan  8, 2024 10:29:44.925436000 JST",,6000  >  33104 [ACK] Seq=1 Ack=28 Win=65152 Len=0 TSval=4073736797 TSecr=2030011438
92,31.609698,192.168.11.4,192.168.11.5,TCP,66,0.016824,,0.000399,"Jan  8, 2024 10:29:44.925835000 JST",,"6000  >  33104 [FIN, ACK] Seq=1 Ack=29 Win=65152 Len=0 TSval=4073736799 TSecr=2030011438"
93,31.609782,192.168.11.5,192.168.11.4,TCP,66,0.000084,,0.000084,"Jan  8, 2024 10:29:44.925919000 JST",,33104  >  6000 [ACK] Seq=29 Ack=2 Win=64256 Len=0 TSval=2030011455 TSecr=4073736799
94,31.640546,192.168.11.5,255.255.255.255,UDP,209,,Ÿ,0.030764,"Jan  8, 2024 10:29:44.956683000 JST",7b2273656d616e74696373223a207b22656e74697479223a2022504944222c202262617365656e74697479223a2022616e79222c2022726f6c65223a20226f6f6f222c20227370617469616c223a2022616e79222c202274656d706f72616c223a2022616e79227d2c20226461746170726f7065727479223a207b22666f726d6174223a2022696e616f6b615f70726f6772616d5f73616d706c655f73656d616e746963227d7d,33609  >  7000 Len=167
95,31.64865,192.168.11.11,192.168.11.5,TCP,74,,œ,0.008104,"Jan  8, 2024 10:29:44.964787000 JST",,38752  >  6000 [SYN] Seq=0 Win=64240 Len=0 MSS=1460 SACK_PERM TSval=1917545987 TSecr=0 WS=128
96,31.648798,192.168.11.5,192.168.11.11,TCP,74,0.000148,,0.000148,"Jan  8, 2024 10:29:44.964935000 JST",,"6000  >  38752 [SYN, ACK] Seq=0 Ack=1 Win=65160 Len=0 MSS=1460 SACK_PERM TSval=2805686894 TSecr=1917545987 WS=128"
97,31.655443,192.168.11.11,192.168.11.5,TCP,66,0.006645,,0.006645,"Jan  8, 2024 10:29:44.971580000 JST",,38752  >  6000 [ACK] Seq=1 Ack=1 Win=64256 Len=0 TSval=1917545994 TSecr=2805686894
98,31.656116,192.168.11.11,192.168.11.5,TCP,93,,,0.000673,"Jan  8, 2024 10:29:44.972253000 JST",,"38752  >  6000 [PSH, ACK] Seq=1 Ack=1 Win=64256 Len=27 TSval=1917545994 TSecr=2805686894 [TCP segment of a reassembled PDU]"
99,31.656237,192.168.11.5,192.168.11.11,TCP,66,0.000121,,0.000121,"Jan  8, 2024 10:29:44.972374000 JST",,6000  >  38752 [ACK] Seq=1 Ack=28 Win=65152 Len=0 TSval=2805686901 TSecr=1917545994
100,31.656322,192.168.11.11,192.168.11.5,TCP,66,,,0.000085,"Jan  8, 2024 10:29:44.972459000 JST",,"38752  >  6000 [FIN, ACK] Seq=28 Ack=1 Win=64256 Len=0 TSval=1917545994 TSecr=2805686894"
101,31.657776,192.168.11.5,192.168.11.11,TCP,66,0.001454,,0.001454,"Jan  8, 2024 10:29:44.973913000 JST",,"6000  >  38752 [FIN, ACK] Seq=1 Ack=29 Win=65152 Len=0 TSval=2805686902 TSecr=1917545994"
102,31.664014,192.168.11.11,192.168.11.5,TCP,66,0.006238,,0.006238,"Jan  8, 2024 10:29:44.980151000 JST",,38752  >  6000 [ACK] Seq=29 Ack=2 Win=64256 Len=0 TSval=1917546002 TSecr=2805686902
103,37.696937,192.168.11.5,192.168.11.4,TCP,74,,,6.032923,"Jan  8, 2024 10:29:51.013074000 JST",,40662  >  6000 [SYN] Seq=0 Win=64240 Len=0 MSS=1460 SACK_PERM TSval=2030017542 TSecr=0 WS=128
104,37.703563,192.168.11.4,192.168.11.5,TCP,74,0.006626,,0.006626,"Jan  8, 2024 10:29:51.019700000 JST",,"6000  >  40662 [SYN, ACK] Seq=0 Ack=1 Win=65160 Len=0 MSS=1460 SACK_PERM TSval=4073742891 TSecr=2030017542 WS=128"
105,37.703687,192.168.11.5,192.168.11.4,TCP,66,0.000124,,0.000124,"Jan  8, 2024 10:29:51.019824000 JST",,40662  >  6000 [ACK] Seq=1 Ack=1 Win=64256 Len=0 TSval=2030017548 TSecr=4073742891
106,37.703862,192.168.11.5,192.168.11.4,TCP,93,,,0.000175,"Jan  8, 2024 10:29:51.019999000 JST",,"40662  >  6000 [PSH, ACK] Seq=1 Ack=1 Win=64256 Len=27 TSval=2030017549 TSecr=4073742891 [TCP segment of a reassembled PDU]"
107,37.703958,192.168.11.5,192.168.11.4,TCP,66,,,0.000096,"Jan  8, 2024 10:29:51.020095000 JST",,"40662  >  6000 [FIN, ACK] Seq=28 Ack=1 Win=64256 Len=0 TSval=2030017549 TSecr=4073742891"
108,37.712433,192.168.11.4,192.168.11.5,TCP,66,0.008571,,0.008475,"Jan  8, 2024 10:29:51.028570000 JST",,6000  >  40662 [ACK] Seq=1 Ack=28 Win=65152 Len=0 TSval=4073742900 TSecr=2030017549
109,37.712646,192.168.11.4,192.168.11.5,TCP,66,0.008688,,0.000213,"Jan  8, 2024 10:29:51.028783000 JST",,"6000  >  40662 [FIN, ACK] Seq=1 Ack=29 Win=65152 Len=0 TSval=4073742902 TSecr=2030017549"
110,37.712693,192.168.11.5,192.168.11.4,TCP,66,0.000047,,0.000047,"Jan  8, 2024 10:29:51.028830000 JST",,40662  >  6000 [ACK] Seq=29 Ack=2 Win=64256 Len=0 TSval=2030017557 TSecr=4073742902
111,37.74297,192.168.11.5,255.255.255.255,UDP,209,,Ÿ,0.030277,"Jan  8, 2024 10:29:51.059107000 JST",7b2273656d616e74696373223a207b22656e74697479223a2022504944222c202262617365656e74697479223a2022616e79222c2022726f6c65223a20226f6f6f222c20227370617469616c223a2022616e79222c202274656d706f72616c223a2022616e79227d2c20226461746170726f7065727479223a207b22666f726d6174223a2022696e616f6b615f70726f6772616d5f73616d706c655f73656d616e746963227d7d,45185  >  7000 Len=167
112,37.7508,192.168.11.11,192.168.11.5,TCP,74,,œ,0.00783,"Jan  8, 2024 10:29:51.066937000 JST",,38764  >  6000 [SYN] Seq=0 Win=64240 Len=0 MSS=1460 SACK_PERM TSval=1917552089 TSecr=0 WS=128
113,37.750949,192.168.11.5,192.168.11.11,TCP,74,0.000149,,0.000149,"Jan  8, 2024 10:29:51.067086000 JST",,"6000  >  38764 [SYN, ACK] Seq=0 Ack=1 Win=65160 Len=0 MSS=1460 SACK_PERM TSval=2805692996 TSecr=1917552089 WS=128"
114,37.757609,192.168.11.11,192.168.11.5,TCP,66,0.00666,,0.00666,"Jan  8, 2024 10:29:51.073746000 JST",,38764  >  6000 [ACK] Seq=1 Ack=1 Win=64256 Len=0 TSval=1917552096 TSecr=2805692996
115,37.758255,192.168.11.11,192.168.11.5,TCP,93,,,0.000646,"Jan  8, 2024 10:29:51.074392000 JST",,"38764  >  6000 [PSH, ACK] Seq=1 Ack=1 Win=64256 Len=27 TSval=1917552096 TSecr=2805692996 [TCP segment of a reassembled PDU]"
116,37.758386,192.168.11.5,192.168.11.11,TCP,66,0.000131,,0.000131,"Jan  8, 2024 10:29:51.074523000 JST",,6000  >  38764 [ACK] Seq=1 Ack=28 Win=65152 Len=0 TSval=2805693003 TSecr=1917552096
117,37.758476,192.168.11.11,192.168.11.5,TCP,66,,,0.00009,"Jan  8, 2024 10:29:51.074613000 JST",,"38764  >  6000 [FIN, ACK] Seq=28 Ack=1 Win=64256 Len=0 TSval=1917552097 TSecr=2805692996"
118,37.759902,192.168.11.5,192.168.11.11,TCP,66,0.001426,,0.001426,"Jan  8, 2024 10:29:51.076039000 JST",,"6000  >  38764 [FIN, ACK] Seq=1 Ack=29 Win=65152 Len=0 TSval=2805693005 TSecr=1917552097"
119,37.768646,192.168.11.11,192.168.11.5,TCP,66,0.008744,,0.008744,"Jan  8, 2024 10:29:51.084783000 JST",,38764  >  6000 [ACK] Seq=29 Ack=2 Win=64256 Len=0 TSval=1917552104 TSecr=2805693005
120,43.822465,192.168.11.5,192.168.11.4,TCP,74,,,6.053819,"Jan  8, 2024 10:29:57.138602000 JST",,40678  >  6000 [SYN] Seq=0 Win=64240 Len=0 MSS=1460 SACK_PERM TSval=2030023667 TSecr=0 WS=128
121,43.829724,192.168.11.4,192.168.11.5,TCP,74,0.007259,,0.007259,"Jan  8, 2024 10:29:57.145861000 JST",,"6000  >  40678 [SYN, ACK] Seq=0 Ack=1 Win=65160 Len=0 MSS=1460 SACK_PERM TSval=4073749018 TSecr=2030023667 WS=128"
122,43.829854,192.168.11.5,192.168.11.4,TCP,66,0.00013,,0.00013,"Jan  8, 2024 10:29:57.145991000 JST",,40678  >  6000 [ACK] Seq=1 Ack=1 Win=64256 Len=0 TSval=2030023675 TSecr=4073749018
123,43.830006,192.168.11.5,192.168.11.4,TCP,93,,,0.000152,"Jan  8, 2024 10:29:57.146143000 JST",,"40678  >  6000 [PSH, ACK] Seq=1 Ack=1 Win=64256 Len=27 TSval=2030023675 TSecr=4073749018 [TCP segment of a reassembled PDU]"
124,43.8301,192.168.11.5,192.168.11.4,TCP,66,,,0.000094,"Jan  8, 2024 10:29:57.146237000 JST",,"40678  >  6000 [FIN, ACK] Seq=28 Ack=1 Win=64256 Len=0 TSval=2030023675 TSecr=4073749018"
125,43.838261,192.168.11.4,192.168.11.5,TCP,66,0.008255,,0.008161,"Jan  8, 2024 10:29:57.154398000 JST",,6000  >  40678 [ACK] Seq=1 Ack=28 Win=65152 Len=0 TSval=4073749025 TSecr=2030023675
126,43.83851,192.168.11.4,192.168.11.5,TCP,66,0.00841,,0.000249,"Jan  8, 2024 10:29:57.154647000 JST",,"6000  >  40678 [FIN, ACK] Seq=1 Ack=29 Win=65152 Len=0 TSval=4073749028 TSecr=2030023675"
127,43.838576,192.168.11.5,192.168.11.4,TCP,66,0.000066,,0.000066,"Jan  8, 2024 10:29:57.154713000 JST",,40678  >  6000 [ACK] Seq=29 Ack=2 Win=64256 Len=0 TSval=2030023683 TSecr=4073749028
128,43.86668,192.168.11.5,255.255.255.255,UDP,209,,Ÿ,0.028104,"Jan  8, 2024 10:29:57.182817000 JST",7b2273656d616e74696373223a207b22656e74697479223a2022504944222c202262617365656e74697479223a2022616e79222c2022726f6c65223a20226f6f6f222c20227370617469616c223a2022616e79222c202274656d706f72616c223a2022616e79227d2c20226461746170726f7065727479223a207b22666f726d6174223a2022696e616f6b615f70726f6772616d5f73616d706c655f73656d616e746963227d7d,32979  >  7000 Len=167
129,43.877549,192.168.11.11,192.168.11.5,TCP,74,,œ,0.010869,"Jan  8, 2024 10:29:57.193686000 JST",,37628  >  6000 [SYN] Seq=0 Win=64240 Len=0 MSS=1460 SACK_PERM TSval=1917558216 TSecr=0 WS=128
130,43.877738,192.168.11.5,192.168.11.11,TCP,74,0.000189,,0.000189,"Jan  8, 2024 10:29:57.193875000 JST",,"6000  >  37628 [SYN, ACK] Seq=0 Ack=1 Win=65160 Len=0 MSS=1460 SACK_PERM TSval=2805699122 TSecr=1917558216 WS=128"
131,43.884474,192.168.11.11,192.168.11.5,TCP,66,0.006736,,0.006736,"Jan  8, 2024 10:29:57.200611000 JST",,37628  >  6000 [ACK] Seq=1 Ack=1 Win=64256 Len=0 TSval=1917558223 TSecr=2805699122
132,43.885104,192.168.11.11,192.168.11.5,TCP,93,,,0.00063,"Jan  8, 2024 10:29:57.201241000 JST",,"37628  >  6000 [PSH, ACK] Seq=1 Ack=1 Win=64256 Len=27 TSval=1917558223 TSecr=2805699122 [TCP segment of a reassembled PDU]"
133,43.88523,192.168.11.5,192.168.11.11,TCP,66,0.000126,,0.000126,"Jan  8, 2024 10:29:57.201367000 JST",,6000  >  37628 [ACK] Seq=1 Ack=28 Win=65152 Len=0 TSval=2805699130 TSecr=1917558223
134,43.885313,192.168.11.11,192.168.11.5,TCP,66,,,0.000083,"Jan  8, 2024 10:29:57.201450000 JST",,"37628  >  6000 [FIN, ACK] Seq=28 Ack=1 Win=64256 Len=0 TSval=1917558223 TSecr=2805699122"
135,43.8864,192.168.11.5,192.168.11.11,TCP,66,0.001087,,0.001087,"Jan  8, 2024 10:29:57.202537000 JST",,"6000  >  37628 [FIN, ACK] Seq=1 Ack=29 Win=65152 Len=0 TSval=2805699131 TSecr=1917558223"
136,43.891956,192.168.11.11,192.168.11.5,TCP,66,0.005556,,0.005556,"Jan  8, 2024 10:29:57.208093000 JST",,37628  >  6000 [ACK] Seq=29 Ack=2 Win=64256 Len=0 TSval=1917558231 TSecr=2805699131
137,49.920448,192.168.11.5,192.168.11.4,TCP,74,,,6.028492,"Jan  8, 2024 10:30:03.236585000 JST",,60222  >  6000 [SYN] Seq=0 Win=64240 Len=0 MSS=1460 SACK_PERM TSval=2030029765 TSecr=0 WS=128
138,49.927088,192.168.11.4,192.168.11.5,TCP,74,0.00664,,0.00664,"Jan  8, 2024 10:30:03.243225000 JST",,"6000  >  60222 [SYN, ACK] Seq=0 Ack=1 Win=65160 Len=0 MSS=1460 SACK_PERM TSval=4073755115 TSecr=2030029765 WS=128"
139,49.9272,192.168.11.5,192.168.11.4,TCP,66,0.000112,,0.000112,"Jan  8, 2024 10:30:03.243337000 JST",,60222  >  6000 [ACK] Seq=1 Ack=1 Win=64256 Len=0 TSval=2030029772 TSecr=4073755115
140,49.92735,192.168.11.5,192.168.11.4,TCP,93,,,0.00015,"Jan  8, 2024 10:30:03.243487000 JST",,"60222  >  6000 [PSH, ACK] Seq=1 Ack=1 Win=64256 Len=27 TSval=2030029772 TSecr=4073755115 [TCP segment of a reassembled PDU]"
141,49.927443,192.168.11.5,192.168.11.4,TCP,66,,,0.000093,"Jan  8, 2024 10:30:03.243580000 JST",,"60222  >  6000 [FIN, ACK] Seq=28 Ack=1 Win=64256 Len=0 TSval=2030029772 TSecr=4073755115"
142,49.93512,192.168.11.4,192.168.11.5,TCP,66,0.00777,,0.007677,"Jan  8, 2024 10:30:03.251257000 JST",,6000  >  60222 [ACK] Seq=1 Ack=28 Win=65152 Len=0 TSval=4073755123 TSecr=2030029772
143,49.937125,192.168.11.4,192.168.11.5,TCP,66,0.009682,,0.002005,"Jan  8, 2024 10:30:03.253262000 JST",,"6000  >  60222 [FIN, ACK] Seq=1 Ack=29 Win=65152 Len=0 TSval=4073755125 TSecr=2030029772"
144,49.93717,192.168.11.5,192.168.11.4,TCP,66,0.000045,,0.000045,"Jan  8, 2024 10:30:03.253307000 JST",,60222  >  6000 [ACK] Seq=29 Ack=2 Win=64256 Len=0 TSval=2030029782 TSecr=4073755125
145,49.965643,192.168.11.5,255.255.255.255,UDP,209,,Ÿ,0.028473,"Jan  8, 2024 10:30:03.281780000 JST",7b2273656d616e74696373223a207b22656e74697479223a2022504944222c202262617365656e74697479223a2022616e79222c2022726f6c65223a20226f6f6f222c20227370617469616c223a2022616e79222c202274656d706f72616c223a2022616e79227d2c20226461746170726f7065727479223a207b22666f726d6174223a2022696e616f6b615f70726f6772616d5f73616d706c655f73656d616e746963227d7d,48507  >  7000 Len=167
146,49.976102,192.168.11.11,192.168.11.5,TCP,74,,œ,0.010459,"Jan  8, 2024 10:30:03.292239000 JST",,37842  >  6000 [SYN] Seq=0 Win=64240 Len=0 MSS=1460 SACK_PERM TSval=1917564315 TSecr=0 WS=128
147,49.976244,192.168.11.5,192.168.11.11,TCP,74,0.000142,,0.000142,"Jan  8, 2024 10:30:03.292381000 JST",,"6000  >  37842 [SYN, ACK] Seq=0 Ack=1 Win=65160 Len=0 MSS=1460 SACK_PERM TSval=2805705221 TSecr=1917564315 WS=128"
148,49.982907,192.168.11.11,192.168.11.5,TCP,66,0.006663,,0.006663,"Jan  8, 2024 10:30:03.299044000 JST",,37842  >  6000 [ACK] Seq=1 Ack=1 Win=64256 Len=0 TSval=1917564322 TSecr=2805705221
149,49.983264,192.168.11.11,192.168.11.5,TCP,93,,,0.000357,"Jan  8, 2024 10:30:03.299401000 JST",,"37842  >  6000 [PSH, ACK] Seq=1 Ack=1 Win=64256 Len=27 TSval=1917564322 TSecr=2805705221 [TCP segment of a reassembled PDU]"
150,49.983344,192.168.11.5,192.168.11.11,TCP,66,0.00008,,0.00008,"Jan  8, 2024 10:30:03.299481000 JST",,6000  >  37842 [ACK] Seq=1 Ack=28 Win=65152 Len=0 TSval=2805705228 TSecr=1917564322
151,49.983578,192.168.11.11,192.168.11.5,TCP,66,,,0.000234,"Jan  8, 2024 10:30:03.299715000 JST",,"37842  >  6000 [FIN, ACK] Seq=28 Ack=1 Win=64256 Len=0 TSval=1917564322 TSecr=2805705221"
152,49.984571,192.168.11.5,192.168.11.11,TCP,66,0.000993,,0.000993,"Jan  8, 2024 10:30:03.300708000 JST",,"6000  >  37842 [FIN, ACK] Seq=1 Ack=29 Win=65152 Len=0 TSval=2805705229 TSecr=1917564322"
153,49.990802,192.168.11.11,192.168.11.5,TCP,66,0.006231,,0.006231,"Jan  8, 2024 10:30:03.306939000 JST",,37842  >  6000 [ACK] Seq=29 Ack=2 Win=64256 Len=0 TSval=1917564329 TSecr=2805705229
154,56.024483,192.168.11.5,192.168.11.4,TCP,74,,,6.033681,"Jan  8, 2024 10:30:09.340620000 JST",,60226  >  6000 [SYN] Seq=0 Win=64240 Len=0 MSS=1460 SACK_PERM TSval=2030035869 TSecr=0 WS=128
155,56.031269,192.168.11.4,192.168.11.5,TCP,74,0.006786,,0.006786,"Jan  8, 2024 10:30:09.347406000 JST",,"6000  >  60226 [SYN, ACK] Seq=0 Ack=1 Win=65160 Len=0 MSS=1460 SACK_PERM TSval=4073761219 TSecr=2030035869 WS=128"
156,56.031387,192.168.11.5,192.168.11.4,TCP,66,0.000118,,0.000118,"Jan  8, 2024 10:30:09.347524000 JST",,60226  >  6000 [ACK] Seq=1 Ack=1 Win=64256 Len=0 TSval=2030035876 TSecr=4073761219
157,56.031528,192.168.11.5,192.168.11.4,TCP,93,,,0.000141,"Jan  8, 2024 10:30:09.347665000 JST",,"60226  >  6000 [PSH, ACK] Seq=1 Ack=1 Win=64256 Len=27 TSval=2030035876 TSecr=4073761219 [TCP segment of a reassembled PDU]"
158,56.031651,192.168.11.5,192.168.11.4,TCP,66,,,0.000123,"Jan  8, 2024 10:30:09.347788000 JST",,"60226  >  6000 [FIN, ACK] Seq=28 Ack=1 Win=64256 Len=0 TSval=2030035876 TSecr=4073761219"
159,56.038397,192.168.11.4,192.168.11.5,TCP,66,0.006869,,0.006746,"Jan  8, 2024 10:30:09.354534000 JST",,6000  >  60226 [ACK] Seq=1 Ack=28 Win=65152 Len=0 TSval=4073761227 TSecr=2030035876
160,56.042088,192.168.11.4,192.168.11.5,TCP,66,0.010437,,0.003691,"Jan  8, 2024 10:30:09.358225000 JST",,"6000  >  60226 [FIN, ACK] Seq=1 Ack=29 Win=65152 Len=0 TSval=4073761230 TSecr=2030035876"
161,56.042133,192.168.11.5,192.168.11.4,TCP,66,0.000045,,0.000045,"Jan  8, 2024 10:30:09.358270000 JST",,60226  >  6000 [ACK] Seq=29 Ack=2 Win=64256 Len=0 TSval=2030035887 TSecr=4073761230
162,56.071229,192.168.11.5,255.255.255.255,UDP,209,,Ÿ,0.029096,"Jan  8, 2024 10:30:09.387366000 JST",7b2273656d616e74696373223a207b22656e74697479223a2022504944222c202262617365656e74697479223a2022616e79222c2022726f6c65223a20226f6f6f222c20227370617469616c223a2022616e79222c202274656d706f72616c223a2022616e79227d2c20226461746170726f7065727479223a207b22666f726d6174223a2022696e616f6b615f70726f6772616d5f73616d706c655f73656d616e746963227d7d,43933  >  7000 Len=167
163,56.079312,192.168.11.11,192.168.11.5,TCP,74,,œ,0.008083,"Jan  8, 2024 10:30:09.395449000 JST",,37848  >  6000 [SYN] Seq=0 Win=64240 Len=0 MSS=1460 SACK_PERM TSval=1917570418 TSecr=0 WS=128
164,56.07947,192.168.11.5,192.168.11.11,TCP,74,0.000158,,0.000158,"Jan  8, 2024 10:30:09.395607000 JST",,"6000  >  37848 [SYN, ACK] Seq=0 Ack=1 Win=65160 Len=0 MSS=1460 SACK_PERM TSval=2805711324 TSecr=1917570418 WS=128"
165,56.086349,192.168.11.11,192.168.11.5,TCP,66,0.006879,,0.006879,"Jan  8, 2024 10:30:09.402486000 JST",,37848  >  6000 [ACK] Seq=1 Ack=1 Win=64256 Len=0 TSval=1917570425 TSecr=2805711324
166,56.086874,192.168.11.11,192.168.11.5,TCP,93,,,0.000525,"Jan  8, 2024 10:30:09.403011000 JST",,"37848  >  6000 [PSH, ACK] Seq=1 Ack=1 Win=64256 Len=27 TSval=1917570425 TSecr=2805711324 [TCP segment of a reassembled PDU]"
167,56.086977,192.168.11.5,192.168.11.11,TCP,66,0.000103,,0.000103,"Jan  8, 2024 10:30:09.403114000 JST",,6000  >  37848 [ACK] Seq=1 Ack=28 Win=65152 Len=0 TSval=2805711332 TSecr=1917570425
168,56.087051,192.168.11.11,192.168.11.5,TCP,66,,,0.000074,"Jan  8, 2024 10:30:09.403188000 JST",,"37848  >  6000 [FIN, ACK] Seq=28 Ack=1 Win=64256 Len=0 TSval=1917570425 TSecr=2805711324"
169,56.088254,192.168.11.5,192.168.11.11,TCP,66,0.001203,,0.001203,"Jan  8, 2024 10:30:09.404391000 JST",,"6000  >  37848 [FIN, ACK] Seq=1 Ack=29 Win=65152 Len=0 TSval=2805711333 TSecr=1917570425"
170,56.094574,192.168.11.11,192.168.11.5,TCP,66,0.00632,,0.00632,"Jan  8, 2024 10:30:09.410711000 JST",,37848  >  6000 [ACK] Seq=29 Ack=2 Win=64256 Len=0 TSval=1917570433 TSecr=2805711333
171,87.202655,192.168.11.5,192.168.11.4,TCP,74,,,31.108081,"Jan  8, 2024 10:30:40.518792000 JST",,38556  >  6000 [SYN] Seq=0 Win=64240 Len=0 MSS=1460 SACK_PERM TSval=2030067047 TSecr=0 WS=128
172,87.209352,192.168.11.4,192.168.11.5,TCP,74,0.006697,,0.006697,"Jan  8, 2024 10:30:40.525489000 JST",,"6000  >  38556 [SYN, ACK] Seq=0 Ack=1 Win=65160 Len=0 MSS=1460 SACK_PERM TSval=4073792397 TSecr=2030067047 WS=128"
173,87.209466,192.168.11.5,192.168.11.4,TCP,66,0.000114,,0.000114,"Jan  8, 2024 10:30:40.525603000 JST",,38556  >  6000 [ACK] Seq=1 Ack=1 Win=64256 Len=0 TSval=2030067054 TSecr=4073792397
174,87.209878,192.168.11.5,192.168.11.4,TCP,93,,,0.000412,"Jan  8, 2024 10:30:40.526015000 JST",,"38556  >  6000 [PSH, ACK] Seq=1 Ack=1 Win=64256 Len=27 TSval=2030067055 TSecr=4073792397 [TCP segment of a reassembled PDU]"
175,87.21014,192.168.11.5,192.168.11.4,TCP,66,,,0.000262,"Jan  8, 2024 10:30:40.526277000 JST",,"38556  >  6000 [FIN, ACK] Seq=28 Ack=1 Win=64256 Len=0 TSval=2030067055 TSecr=4073792397"
176,87.216828,192.168.11.4,192.168.11.5,TCP,66,0.00695,,0.006688,"Jan  8, 2024 10:30:40.532965000 JST",,6000  >  38556 [ACK] Seq=1 Ack=28 Win=65152 Len=0 TSval=4073792405 TSecr=2030067055
177,87.217203,192.168.11.4,192.168.11.5,TCP,66,0.007063,,0.000375,"Jan  8, 2024 10:30:40.533340000 JST",,"6000  >  38556 [FIN, ACK] Seq=1 Ack=29 Win=65152 Len=0 TSval=4073792406 TSecr=2030067055"
178,87.217247,192.168.11.5,192.168.11.4,TCP,66,0.000044,,0.000044,"Jan  8, 2024 10:30:40.533384000 JST",,38556  >  6000 [ACK] Seq=29 Ack=2 Win=64256 Len=0 TSval=2030067062 TSecr=4073792406
179,87.245902,192.168.11.5,255.255.255.255,UDP,209,,Ÿ,0.028655,"Jan  8, 2024 10:30:40.562039000 JST",7b2273656d616e74696373223a207b22656e74697479223a2022504944222c202262617365656e74697479223a2022616e79222c2022726f6c65223a20226f6f6f222c20227370617469616c223a2022616e79222c202274656d706f72616c223a2022616e79227d2c20226461746170726f7065727479223a207b22666f726d6174223a2022696e616f6b615f70726f6772616d5f73616d706c655f73656d616e746963227d7d,58887  >  7000 Len=167
180,87.253465,192.168.11.11,192.168.11.5,TCP,74,,œ,0.007563,"Jan  8, 2024 10:30:40.569602000 JST",,38618  >  6000 [SYN] Seq=0 Win=64240 Len=0 MSS=1460 SACK_PERM TSval=1917601592 TSecr=0 WS=128
181,87.253648,192.168.11.5,192.168.11.11,TCP,74,0.000183,,0.000183,"Jan  8, 2024 10:30:40.569785000 JST",,"6000  >  38618 [SYN, ACK] Seq=0 Ack=1 Win=65160 Len=0 MSS=1460 SACK_PERM TSval=2805742498 TSecr=1917601592 WS=128"
182,87.260361,192.168.11.11,192.168.11.5,TCP,66,0.006713,,0.006713,"Jan  8, 2024 10:30:40.576498000 JST",,38618  >  6000 [ACK] Seq=1 Ack=1 Win=64256 Len=0 TSval=1917601599 TSecr=2805742498
183,87.261001,192.168.11.11,192.168.11.5,TCP,93,,,0.00064,"Jan  8, 2024 10:30:40.577138000 JST",,"38618  >  6000 [PSH, ACK] Seq=1 Ack=1 Win=64256 Len=27 TSval=1917601599 TSecr=2805742498 [TCP segment of a reassembled PDU]"
184,87.261098,192.168.11.5,192.168.11.11,TCP,66,0.000097,,0.000097,"Jan  8, 2024 10:30:40.577235000 JST",,6000  >  38618 [ACK] Seq=1 Ack=28 Win=65152 Len=0 TSval=2805742506 TSecr=1917601599
185,87.261176,192.168.11.11,192.168.11.5,TCP,66,,,0.000078,"Jan  8, 2024 10:30:40.577313000 JST",,"38618  >  6000 [FIN, ACK] Seq=28 Ack=1 Win=64256 Len=0 TSval=1917601599 TSecr=2805742498"
186,87.263204,192.168.11.5,192.168.11.11,TCP,66,0.002028,,0.002028,"Jan  8, 2024 10:30:40.579341000 JST",,"6000  >  38618 [FIN, ACK] Seq=1 Ack=29 Win=65152 Len=0 TSval=2805742508 TSecr=1917601599"
