No.,Time,Source,Destination,Protocol,Length,The RTT to ACK the segment was,XXX,Time delta from previous captured frame,Arrival Time,Data,Info
1,0,192.168.11.11,192.168.11.5,TCP,74,,,0,"Jan  8, 2024 10:29:13.376846000 JST",,42584  >  6000 [SYN] Seq=0 Win=64240 Len=0 MSS=1460 SACK_PERM TSval=1917514397 TSecr=0 WS=128
2,0.008313,192.168.11.5,192.168.11.11,TCP,74,0.008313,,0.008313,"Jan  8, 2024 10:29:13.385159000 JST",,"6000  >  42584 [SYN, ACK] Seq=0 Ack=1 Win=65160 Len=0 MSS=1460 SACK_PERM TSval=2805655308 TSecr=1917514397 WS=128"
3,0.008432,192.168.11.11,192.168.11.5,TCP,66,0.000119,,0.000119,"Jan  8, 2024 10:29:13.385278000 JST",,42584  >  6000 [ACK] Seq=1 Ack=1 Win=64256 Len=0 TSval=1917514410 TSecr=2805655308
4,0.008672,192.168.11.11,192.168.11.5,TCP,93,,,0.00024,"Jan  8, 2024 10:29:13.385518000 JST",,"42584  >  6000 [PSH, ACK] Seq=1 Ack=1 Win=64256 Len=27 TSval=1917514410 TSecr=2805655308 [TCP segment of a reassembled PDU]"
5,0.008808,192.168.11.11,192.168.11.5,TCP,66,,,0.000136,"Jan  8, 2024 10:29:13.385654000 JST",,"42584  >  6000 [FIN, ACK] Seq=28 Ack=1 Win=64256 Len=0 TSval=1917514410 TSecr=2805655308"
6,0.016156,192.168.11.5,192.168.11.11,TCP,66,0.007484,,0.007348,"Jan  8, 2024 10:29:13.393002000 JST",,6000  >  42584 [ACK] Seq=1 Ack=28 Win=65152 Len=0 TSval=2805655317 TSecr=1917514410
7,0.016523,192.168.11.5,192.168.11.11,TCP,66,0.007715,,0.000367,"Jan  8, 2024 10:29:13.393369000 JST",,"6000  >  42584 [FIN, ACK] Seq=1 Ack=29 Win=65152 Len=0 TSval=2805655318 TSecr=1917514410"
8,0.016572,192.168.11.11,192.168.11.5,TCP,66,0.000049,,0.000049,"Jan  8, 2024 10:29:13.393418000 JST",,42584  >  6000 [ACK] Seq=29 Ack=2 Win=64256 Len=0 TSval=1917514418 TSecr=2805655318
9,0.044766,192.168.11.11,255.255.255.255,UDP,209,,Ÿ,0.028194,"Jan  8, 2024 10:29:13.421612000 JST",7b2273656d616e74696373223a207b22656e74697479223a2022504944222c202262617365656e74697479223a2022616e79222c2022726f6c65223a2022707070222c20227370617469616c223a2022616e79222c202274656d706f72616c223a2022616e79227d2c20226461746170726f7065727479223a207b22666f726d6174223a2022696e616f6b615f70726f6772616d5f73616d706c655f73656d616e746963227d7d,59127  >  7000 Len=167
10,0.055799,192.168.11.16,192.168.11.11,TCP,74,,œ,0.011033,"Jan  8, 2024 10:29:13.432645000 JST",,47292  >  6000 [SYN] Seq=0 Win=64240 Len=0 MSS=1460 SACK_PERM TSval=1432902655 TSecr=0 WS=128
11,0.055942,192.168.11.11,192.168.11.16,TCP,74,0.000143,,0.000143,"Jan  8, 2024 10:29:13.432788000 JST",,"6000  >  47292 [SYN, ACK] Seq=0 Ack=1 Win=65160 Len=0 MSS=1460 SACK_PERM TSval=4225267629 TSecr=1432902655 WS=128"
12,0.062984,192.168.11.16,192.168.11.11,TCP,66,0.007042,,0.007042,"Jan  8, 2024 10:29:13.439830000 JST",,47292  >  6000 [ACK] Seq=1 Ack=1 Win=64256 Len=0 TSval=1432902665 TSecr=4225267629
13,0.063474,192.168.11.16,192.168.11.11,TCP,93,,,0.00049,"Jan  8, 2024 10:29:13.440320000 JST",,"47292  >  6000 [PSH, ACK] Seq=1 Ack=1 Win=64256 Len=27 TSval=1432902666 TSecr=4225267629 [TCP segment of a reassembled PDU]"
14,0.06355,192.168.11.11,192.168.11.16,TCP,66,0.000076,,0.000076,"Jan  8, 2024 10:29:13.440396000 JST",,6000  >  47292 [ACK] Seq=1 Ack=28 Win=65152 Len=0 TSval=4225267637 TSecr=1432902666
15,0.063611,192.168.11.16,192.168.11.11,TCP,66,,,0.000061,"Jan  8, 2024 10:29:13.440457000 JST",,"47292  >  6000 [FIN, ACK] Seq=28 Ack=1 Win=64256 Len=0 TSval=1432902666 TSecr=4225267629"
16,0.065048,192.168.11.11,192.168.11.16,TCP,66,0.001437,,0.001437,"Jan  8, 2024 10:29:13.441894000 JST",,"6000  >  47292 [FIN, ACK] Seq=1 Ack=29 Win=65152 Len=0 TSval=4225267638 TSecr=1432902666"
17,0.070877,192.168.11.16,192.168.11.11,TCP,66,0.005829,,0.005829,"Jan  8, 2024 10:29:13.447723000 JST",,47292  >  6000 [ACK] Seq=29 Ack=2 Win=64256 Len=0 TSval=1432902673 TSecr=4225267638
18,6.143589,192.168.11.11,192.168.11.5,TCP,74,,,6.072712,"Jan  8, 2024 10:29:19.520435000 JST",,42596  >  6000 [SYN] Seq=0 Win=64240 Len=0 MSS=1460 SACK_PERM TSval=1917520545 TSecr=0 WS=128
19,6.150316,192.168.11.5,192.168.11.11,TCP,74,0.006727,,0.006727,"Jan  8, 2024 10:29:19.527162000 JST",,"6000  >  42596 [SYN, ACK] Seq=0 Ack=1 Win=65160 Len=0 MSS=1460 SACK_PERM TSval=2805661451 TSecr=1917520545 WS=128"
20,6.150422,192.168.11.11,192.168.11.5,TCP,66,0.000106,,0.000106,"Jan  8, 2024 10:29:19.527268000 JST",,42596  >  6000 [ACK] Seq=1 Ack=1 Win=64256 Len=0 TSval=1917520552 TSecr=2805661451
21,6.150627,192.168.11.11,192.168.11.5,TCP,93,,,0.000205,"Jan  8, 2024 10:29:19.527473000 JST",,"42596  >  6000 [PSH, ACK] Seq=1 Ack=1 Win=64256 Len=27 TSval=1917520552 TSecr=2805661451 [TCP segment of a reassembled PDU]"
22,6.150766,192.168.11.11,192.168.11.5,TCP,66,,,0.000139,"Jan  8, 2024 10:29:19.527612000 JST",,"42596  >  6000 [FIN, ACK] Seq=28 Ack=1 Win=64256 Len=0 TSval=1917520552 TSecr=2805661451"
23,6.158139,192.168.11.5,192.168.11.11,TCP,66,0.007512,,0.007373,"Jan  8, 2024 10:29:19.534985000 JST",,6000  >  42596 [ACK] Seq=1 Ack=28 Win=65152 Len=0 TSval=2805661459 TSecr=1917520552
24,6.158388,192.168.11.5,192.168.11.11,TCP,66,0.007622,,0.000249,"Jan  8, 2024 10:29:19.535234000 JST",,"6000  >  42596 [FIN, ACK] Seq=1 Ack=29 Win=65152 Len=0 TSval=2805661461 TSecr=1917520552"
25,6.158434,192.168.11.11,192.168.11.5,TCP,66,0.000046,,0.000046,"Jan  8, 2024 10:29:19.535280000 JST",,42596  >  6000 [ACK] Seq=29 Ack=2 Win=64256 Len=0 TSval=1917520560 TSecr=2805661461
26,6.185998,192.168.11.11,255.255.255.255,UDP,209,,Ÿ,0.027564,"Jan  8, 2024 10:29:19.562844000 JST",7b2273656d616e74696373223a207b22656e74697479223a2022504944222c202262617365656e74697479223a2022616e79222c2022726f6c65223a2022707070222c20227370617469616c223a2022616e79222c202274656d706f72616c223a2022616e79227d2c20226461746170726f7065727479223a207b22666f726d6174223a2022696e616f6b615f70726f6772616d5f73616d706c655f73656d616e746963227d7d,55697  >  7000 Len=167
27,6.193569,192.168.11.16,192.168.11.11,TCP,74,,œ,0.007571,"Jan  8, 2024 10:29:19.570415000 JST",,35114  >  6000 [SYN] Seq=0 Win=64240 Len=0 MSS=1460 SACK_PERM TSval=1432908796 TSecr=0 WS=128
28,6.193693,192.168.11.11,192.168.11.16,TCP,74,0.000124,,0.000124,"Jan  8, 2024 10:29:19.570539000 JST",,"6000  >  35114 [SYN, ACK] Seq=0 Ack=1 Win=65160 Len=0 MSS=1460 SACK_PERM TSval=4225273767 TSecr=1432908796 WS=128"
29,6.200651,192.168.11.16,192.168.11.11,TCP,66,0.006958,,0.006958,"Jan  8, 2024 10:29:19.577497000 JST",,35114  >  6000 [ACK] Seq=1 Ack=1 Win=64256 Len=0 TSval=1432908803 TSecr=4225273767
30,6.201174,192.168.11.16,192.168.11.11,TCP,93,,,0.000523,"Jan  8, 2024 10:29:19.578020000 JST",,"35114  >  6000 [PSH, ACK] Seq=1 Ack=1 Win=64256 Len=27 TSval=1432908804 TSecr=4225273767 [TCP segment of a reassembled PDU]"
31,6.201254,192.168.11.11,192.168.11.16,TCP,66,0.00008,,0.00008,"Jan  8, 2024 10:29:19.578100000 JST",,6000  >  35114 [ACK] Seq=1 Ack=28 Win=65152 Len=0 TSval=4225273775 TSecr=1432908804
32,6.201312,192.168.11.16,192.168.11.11,TCP,66,,,0.000058,"Jan  8, 2024 10:29:19.578158000 JST",,"35114  >  6000 [FIN, ACK] Seq=28 Ack=1 Win=64256 Len=0 TSval=1432908804 TSecr=4225273767"
33,6.202427,192.168.11.11,192.168.11.16,TCP,66,0.001115,,0.001115,"Jan  8, 2024 10:29:19.579273000 JST",,"6000  >  35114 [FIN, ACK] Seq=1 Ack=29 Win=65152 Len=0 TSval=4225273776 TSecr=1432908804"
34,6.208551,192.168.11.16,192.168.11.11,TCP,66,0.006124,,0.006124,"Jan  8, 2024 10:29:19.585397000 JST",,35114  >  6000 [ACK] Seq=29 Ack=2 Win=64256 Len=0 TSval=1432908811 TSecr=4225273776
35,12.249462,192.168.11.11,192.168.11.5,TCP,74,,,6.040911,"Jan  8, 2024 10:29:25.626308000 JST",,54894  >  6000 [SYN] Seq=0 Win=64240 Len=0 MSS=1460 SACK_PERM TSval=1917526651 TSecr=0 WS=128
36,12.256268,192.168.11.5,192.168.11.11,TCP,74,0.006806,,0.006806,"Jan  8, 2024 10:29:25.633114000 JST",,"6000  >  54894 [SYN, ACK] Seq=0 Ack=1 Win=65160 Len=0 MSS=1460 SACK_PERM TSval=2805667557 TSecr=1917526651 WS=128"
37,12.256381,192.168.11.11,192.168.11.5,TCP,66,0.000113,,0.000113,"Jan  8, 2024 10:29:25.633227000 JST",,54894  >  6000 [ACK] Seq=1 Ack=1 Win=64256 Len=0 TSval=1917526658 TSecr=2805667557
38,12.256604,192.168.11.11,192.168.11.5,TCP,93,,,0.000223,"Jan  8, 2024 10:29:25.633450000 JST",,"54894  >  6000 [PSH, ACK] Seq=1 Ack=1 Win=64256 Len=27 TSval=1917526658 TSecr=2805667557 [TCP segment of a reassembled PDU]"
39,12.256727,192.168.11.11,192.168.11.5,TCP,66,,,0.000123,"Jan  8, 2024 10:29:25.633573000 JST",,"54894  >  6000 [FIN, ACK] Seq=28 Ack=1 Win=64256 Len=0 TSval=1917526658 TSecr=2805667557"
40,12.26429,192.168.11.5,192.168.11.11,TCP,66,0.007686,,0.007563,"Jan  8, 2024 10:29:25.641136000 JST",,6000  >  54894 [ACK] Seq=1 Ack=28 Win=65152 Len=0 TSval=2805667564 TSecr=1917526658
41,12.264519,192.168.11.5,192.168.11.11,TCP,66,0.007792,,0.000229,"Jan  8, 2024 10:29:25.641365000 JST",,"6000  >  54894 [FIN, ACK] Seq=1 Ack=29 Win=65152 Len=0 TSval=2805667566 TSecr=1917526658"
42,12.264564,192.168.11.11,192.168.11.5,TCP,66,0.000045,,0.000045,"Jan  8, 2024 10:29:25.641410000 JST",,54894  >  6000 [ACK] Seq=29 Ack=2 Win=64256 Len=0 TSval=1917526666 TSecr=2805667566
43,12.293002,192.168.11.11,255.255.255.255,UDP,209,,Ÿ,0.028438,"Jan  8, 2024 10:29:25.669848000 JST",7b2273656d616e74696373223a207b22656e74697479223a2022504944222c202262617365656e74697479223a2022616e79222c2022726f6c65223a2022707070222c20227370617469616c223a2022616e79222c202274656d706f72616c223a2022616e79227d2c20226461746170726f7065727479223a207b22666f726d6174223a2022696e616f6b615f70726f6772616d5f73616d706c655f73656d616e746963227d7d,40209  >  7000 Len=167
44,12.300497,192.168.11.16,192.168.11.11,TCP,74,,œ,0.007495,"Jan  8, 2024 10:29:25.677343000 JST",,35122  >  6000 [SYN] Seq=0 Win=64240 Len=0 MSS=1460 SACK_PERM TSval=1432914903 TSecr=0 WS=128
45,12.300653,192.168.11.11,192.168.11.16,TCP,74,0.000156,,0.000156,"Jan  8, 2024 10:29:25.677499000 JST",,"6000  >  35122 [SYN, ACK] Seq=0 Ack=1 Win=65160 Len=0 MSS=1460 SACK_PERM TSval=4225279874 TSecr=1432914903 WS=128"
46,12.307505,192.168.11.16,192.168.11.11,TCP,66,0.006852,,0.006852,"Jan  8, 2024 10:29:25.684351000 JST",,35122  >  6000 [ACK] Seq=1 Ack=1 Win=64256 Len=0 TSval=1432914910 TSecr=4225279874
47,12.308072,192.168.11.16,192.168.11.11,TCP,93,,,0.000567,"Jan  8, 2024 10:29:25.684918000 JST",,"35122  >  6000 [PSH, ACK] Seq=1 Ack=1 Win=64256 Len=27 TSval=1432914911 TSecr=4225279874 [TCP segment of a reassembled PDU]"
48,12.308229,192.168.11.11,192.168.11.16,TCP,66,0.000157,,0.000157,"Jan  8, 2024 10:29:25.685075000 JST",,6000  >  35122 [ACK] Seq=1 Ack=28 Win=65152 Len=0 TSval=4225279881 TSecr=1432914911
49,12.308415,192.168.11.16,192.168.11.11,TCP,66,,,0.000186,"Jan  8, 2024 10:29:25.685261000 JST",,"35122  >  6000 [FIN, ACK] Seq=28 Ack=1 Win=64256 Len=0 TSval=1432914911 TSecr=4225279874"
50,12.309752,192.168.11.11,192.168.11.16,TCP,66,0.001337,,0.001337,"Jan  8, 2024 10:29:25.686598000 JST",,"6000  >  35122 [FIN, ACK] Seq=1 Ack=29 Win=65152 Len=0 TSval=4225279883 TSecr=1432914911"
51,12.317768,192.168.11.16,192.168.11.11,TCP,66,0.008016,,0.008016,"Jan  8, 2024 10:29:25.694614000 JST",,35122  >  6000 [ACK] Seq=29 Ack=2 Win=64256 Len=0 TSval=1432914918 TSecr=4225279883
52,18.357339,192.168.11.11,192.168.11.5,TCP,74,,,6.039571,"Jan  8, 2024 10:29:31.734185000 JST",,54900  >  6000 [SYN] Seq=0 Win=64240 Len=0 MSS=1460 SACK_PERM TSval=1917532759 TSecr=0 WS=128
53,18.366548,192.168.11.5,192.168.11.11,TCP,74,0.009209,,0.009209,"Jan  8, 2024 10:29:31.743394000 JST",,"6000  >  54900 [SYN, ACK] Seq=0 Ack=1 Win=65160 Len=0 MSS=1460 SACK_PERM TSval=2805673665 TSecr=1917532759 WS=128"
54,18.366676,192.168.11.11,192.168.11.5,TCP,66,0.000128,,0.000128,"Jan  8, 2024 10:29:31.743522000 JST",,54900  >  6000 [ACK] Seq=1 Ack=1 Win=64256 Len=0 TSval=1917532768 TSecr=2805673665
55,18.366862,192.168.11.11,192.168.11.5,TCP,93,,,0.000186,"Jan  8, 2024 10:29:31.743708000 JST",,"54900  >  6000 [PSH, ACK] Seq=1 Ack=1 Win=64256 Len=27 TSval=1917532768 TSecr=2805673665 [TCP segment of a reassembled PDU]"
56,18.366959,192.168.11.11,192.168.11.5,TCP,66,,,0.000097,"Jan  8, 2024 10:29:31.743805000 JST",,"54900  >  6000 [FIN, ACK] Seq=28 Ack=1 Win=64256 Len=0 TSval=1917532768 TSecr=2805673665"
57,18.376514,192.168.11.5,192.168.11.11,TCP,66,0.009652,,0.009555,"Jan  8, 2024 10:29:31.753360000 JST",,6000  >  54900 [ACK] Seq=1 Ack=28 Win=65152 Len=0 TSval=2805673677 TSecr=1917532768
58,18.379196,192.168.11.5,192.168.11.11,TCP,66,0.012237,,0.002682,"Jan  8, 2024 10:29:31.756042000 JST",,"6000  >  54900 [FIN, ACK] Seq=1 Ack=29 Win=65152 Len=0 TSval=2805673680 TSecr=1917532768"
59,18.379252,192.168.11.11,192.168.11.5,TCP,66,0.000056,,0.000056,"Jan  8, 2024 10:29:31.756098000 JST",,54900  >  6000 [ACK] Seq=29 Ack=2 Win=64256 Len=0 TSval=1917532781 TSecr=2805673680
60,18.410173,192.168.11.11,255.255.255.255,UDP,209,,Ÿ,0.030921,"Jan  8, 2024 10:29:31.787019000 JST",7b2273656d616e74696373223a207b22656e74697479223a2022504944222c202262617365656e74697479223a2022616e79222c2022726f6c65223a2022707070222c20227370617469616c223a2022616e79222c202274656d706f72616c223a2022616e79227d2c20226461746170726f7065727479223a207b22666f726d6174223a2022696e616f6b615f70726f6772616d5f73616d706c655f73656d616e746963227d7d,44229  >  7000 Len=167
61,18.418519,192.168.11.16,192.168.11.11,TCP,74,,œ,0.008346,"Jan  8, 2024 10:29:31.795365000 JST",,45372  >  6000 [SYN] Seq=0 Win=64240 Len=0 MSS=1460 SACK_PERM TSval=1432921021 TSecr=0 WS=128
62,18.41868,192.168.11.11,192.168.11.16,TCP,74,0.000161,,0.000161,"Jan  8, 2024 10:29:31.795526000 JST",,"6000  >  45372 [SYN, ACK] Seq=0 Ack=1 Win=65160 Len=0 MSS=1460 SACK_PERM TSval=4225285992 TSecr=1432921021 WS=128"
63,18.4259,192.168.11.16,192.168.11.11,TCP,66,0.00722,,0.00722,"Jan  8, 2024 10:29:31.802746000 JST",,45372  >  6000 [ACK] Seq=1 Ack=1 Win=64256 Len=0 TSval=1432921028 TSecr=4225285992
64,18.426467,192.168.11.16,192.168.11.11,TCP,93,,,0.000567,"Jan  8, 2024 10:29:31.803313000 JST",,"45372  >  6000 [PSH, ACK] Seq=1 Ack=1 Win=64256 Len=27 TSval=1432921028 TSecr=4225285992 [TCP segment of a reassembled PDU]"
65,18.426567,192.168.11.11,192.168.11.16,TCP,66,0.0001,,0.0001,"Jan  8, 2024 10:29:31.803413000 JST",,6000  >  45372 [ACK] Seq=1 Ack=28 Win=65152 Len=0 TSval=4225286000 TSecr=1432921028
66,18.426667,192.168.11.16,192.168.11.11,TCP,66,,,0.0001,"Jan  8, 2024 10:29:31.803513000 JST",,"45372  >  6000 [FIN, ACK] Seq=28 Ack=1 Win=64256 Len=0 TSval=1432921029 TSecr=4225285992"
67,18.427947,192.168.11.11,192.168.11.16,TCP,66,0.00128,,0.00128,"Jan  8, 2024 10:29:31.804793000 JST",,"6000  >  45372 [FIN, ACK] Seq=1 Ack=29 Win=65152 Len=0 TSval=4225286001 TSecr=1432921029"
68,18.43514,192.168.11.16,192.168.11.11,TCP,66,0.007193,,0.007193,"Jan  8, 2024 10:29:31.811986000 JST",,45372  >  6000 [ACK] Seq=29 Ack=2 Win=64256 Len=0 TSval=1432921037 TSecr=4225286001
69,25.473661,192.168.11.11,192.168.11.5,TCP,74,,,7.038521,"Jan  8, 2024 10:29:38.850507000 JST",,34004  >  6000 [SYN] Seq=0 Win=64240 Len=0 MSS=1460 SACK_PERM TSval=1917539875 TSecr=0 WS=128
70,25.480506,192.168.11.5,192.168.11.11,TCP,74,0.006845,,0.006845,"Jan  8, 2024 10:29:38.857352000 JST",,"6000  >  34004 [SYN, ACK] Seq=0 Ack=1 Win=65160 Len=0 MSS=1460 SACK_PERM TSval=2805680781 TSecr=1917539875 WS=128"
71,25.480628,192.168.11.11,192.168.11.5,TCP,66,0.000122,,0.000122,"Jan  8, 2024 10:29:38.857474000 JST",,34004  >  6000 [ACK] Seq=1 Ack=1 Win=64256 Len=0 TSval=1917539882 TSecr=2805680781
72,25.480817,192.168.11.11,192.168.11.5,TCP,93,,,0.000189,"Jan  8, 2024 10:29:38.857663000 JST",,"34004  >  6000 [PSH, ACK] Seq=1 Ack=1 Win=64256 Len=27 TSval=1917539882 TSecr=2805680781 [TCP segment of a reassembled PDU]"
73,25.480943,192.168.11.11,192.168.11.5,TCP,66,,,0.000126,"Jan  8, 2024 10:29:38.857789000 JST",,"34004  >  6000 [FIN, ACK] Seq=28 Ack=1 Win=64256 Len=0 TSval=1917539882 TSecr=2805680781"
74,25.488236,192.168.11.5,192.168.11.11,TCP,66,0.007419,,0.007293,"Jan  8, 2024 10:29:38.865082000 JST",,6000  >  34004 [ACK] Seq=1 Ack=28 Win=65152 Len=0 TSval=2805680789 TSecr=1917539882
75,25.48846,192.168.11.5,192.168.11.11,TCP,66,0.007517,,0.000224,"Jan  8, 2024 10:29:38.865306000 JST",,"6000  >  34004 [FIN, ACK] Seq=1 Ack=29 Win=65152 Len=0 TSval=2805680790 TSecr=1917539882"
76,25.488506,192.168.11.11,192.168.11.5,TCP,66,0.000046,,0.000046,"Jan  8, 2024 10:29:38.865352000 JST",,34004  >  6000 [ACK] Seq=29 Ack=2 Win=64256 Len=0 TSval=1917539890 TSecr=2805680790
77,25.517147,192.168.11.11,255.255.255.255,UDP,209,,Ÿ,0.028641,"Jan  8, 2024 10:29:38.893993000 JST",7b2273656d616e74696373223a207b22656e74697479223a2022504944222c202262617365656e74697479223a2022616e79222c2022726f6c65223a2022707070222c20227370617469616c223a2022616e79222c202274656d706f72616c223a2022616e79227d2c20226461746170726f7065727479223a207b22666f726d6174223a2022696e616f6b615f70726f6772616d5f73616d706c655f73656d616e746963227d7d,34240  >  7000 Len=167
78,25.525982,192.168.11.16,192.168.11.11,TCP,74,,œ,0.008835,"Jan  8, 2024 10:29:38.902828000 JST",,48924  >  6000 [SYN] Seq=0 Win=64240 Len=0 MSS=1460 SACK_PERM TSval=1432928128 TSecr=0 WS=128
79,25.526143,192.168.11.11,192.168.11.16,TCP,74,0.000161,,0.000161,"Jan  8, 2024 10:29:38.902989000 JST",,"6000  >  48924 [SYN, ACK] Seq=0 Ack=1 Win=65160 Len=0 MSS=1460 SACK_PERM TSval=4225293099 TSecr=1432928128 WS=128"
80,25.538367,192.168.11.16,192.168.11.11,TCP,66,0.012224,,0.012224,"Jan  8, 2024 10:29:38.915213000 JST",,48924  >  6000 [ACK] Seq=1 Ack=1 Win=64256 Len=0 TSval=1432928139 TSecr=4225293099
81,25.538927,192.168.11.16,192.168.11.11,TCP,93,,,0.00056,"Jan  8, 2024 10:29:38.915773000 JST",,"48924  >  6000 [PSH, ACK] Seq=1 Ack=1 Win=64256 Len=27 TSval=1432928139 TSecr=4225293099 [TCP segment of a reassembled PDU]"
82,25.539017,192.168.11.11,192.168.11.16,TCP,66,0.00009,,0.00009,"Jan  8, 2024 10:29:38.915863000 JST",,6000  >  48924 [ACK] Seq=1 Ack=28 Win=65152 Len=0 TSval=4225293112 TSecr=1432928139
83,25.539091,192.168.11.16,192.168.11.11,TCP,66,,,0.000074,"Jan  8, 2024 10:29:38.915937000 JST",,"48924  >  6000 [FIN, ACK] Seq=28 Ack=1 Win=64256 Len=0 TSval=1432928139 TSecr=4225293099"
84,25.540316,192.168.11.11,192.168.11.16,TCP,66,0.001225,,0.001225,"Jan  8, 2024 10:29:38.917162000 JST",,"6000  >  48924 [FIN, ACK] Seq=1 Ack=29 Win=65152 Len=0 TSval=4225293114 TSecr=1432928139"
85,25.546437,192.168.11.16,192.168.11.11,TCP,66,0.006121,,0.006121,"Jan  8, 2024 10:29:38.923283000 JST",,48924  >  6000 [ACK] Seq=29 Ack=2 Win=64256 Len=0 TSval=1432928149 TSecr=4225293114
86,31.586024,192.168.11.11,192.168.11.5,TCP,74,,,6.039587,"Jan  8, 2024 10:29:44.962870000 JST",,38752  >  6000 [SYN] Seq=0 Win=64240 Len=0 MSS=1460 SACK_PERM TSval=1917545987 TSecr=0 WS=128
87,31.592689,192.168.11.5,192.168.11.11,TCP,74,0.006665,,0.006665,"Jan  8, 2024 10:29:44.969535000 JST",,"6000  >  38752 [SYN, ACK] Seq=0 Ack=1 Win=65160 Len=0 MSS=1460 SACK_PERM TSval=2805686894 TSecr=1917545987 WS=128"
88,31.592797,192.168.11.11,192.168.11.5,TCP,66,0.000108,,0.000108,"Jan  8, 2024 10:29:44.969643000 JST",,38752  >  6000 [ACK] Seq=1 Ack=1 Win=64256 Len=0 TSval=1917545994 TSecr=2805686894
89,31.592973,192.168.11.11,192.168.11.5,TCP,93,,,0.000176,"Jan  8, 2024 10:29:44.969819000 JST",,"38752  >  6000 [PSH, ACK] Seq=1 Ack=1 Win=64256 Len=27 TSval=1917545994 TSecr=2805686894 [TCP segment of a reassembled PDU]"
90,31.593061,192.168.11.11,192.168.11.5,TCP,66,,,0.000088,"Jan  8, 2024 10:29:44.969907000 JST",,"38752  >  6000 [FIN, ACK] Seq=28 Ack=1 Win=64256 Len=0 TSval=1917545994 TSecr=2805686894"
91,31.600404,192.168.11.5,192.168.11.11,TCP,66,0.007431,,0.007343,"Jan  8, 2024 10:29:44.977250000 JST",,6000  >  38752 [ACK] Seq=1 Ack=28 Win=65152 Len=0 TSval=2805686901 TSecr=1917545994
92,31.600817,192.168.11.5,192.168.11.11,TCP,66,0.007756,,0.000413,"Jan  8, 2024 10:29:44.977663000 JST",,"6000  >  38752 [FIN, ACK] Seq=1 Ack=29 Win=65152 Len=0 TSval=2805686902 TSecr=1917545994"
93,31.60086,192.168.11.11,192.168.11.5,TCP,66,0.000043,,0.000043,"Jan  8, 2024 10:29:44.977706000 JST",,38752  >  6000 [ACK] Seq=29 Ack=2 Win=64256 Len=0 TSval=1917546002 TSecr=2805686902
94,31.626942,192.168.11.11,255.255.255.255,UDP,209,,Ÿ,0.026082,"Jan  8, 2024 10:29:45.003788000 JST",7b2273656d616e74696373223a207b22656e74697479223a2022504944222c202262617365656e74697479223a2022616e79222c2022726f6c65223a2022707070222c20227370617469616c223a2022616e79222c202274656d706f72616c223a2022616e79227d2c20226461746170726f7065727479223a207b22666f726d6174223a2022696e616f6b615f70726f6772616d5f73616d706c655f73656d616e746963227d7d,36293  >  7000 Len=167
95,31.63455,192.168.11.16,192.168.11.11,TCP,74,,œ,0.007608,"Jan  8, 2024 10:29:45.011396000 JST",,48930  >  6000 [SYN] Seq=0 Win=64240 Len=0 MSS=1460 SACK_PERM TSval=1432934237 TSecr=0 WS=128
96,31.634672,192.168.11.11,192.168.11.16,TCP,74,0.000122,,0.000122,"Jan  8, 2024 10:29:45.011518000 JST",,"6000  >  48930 [SYN, ACK] Seq=0 Ack=1 Win=65160 Len=0 MSS=1460 SACK_PERM TSval=4225299208 TSecr=1432934237 WS=128"
97,31.64147,192.168.11.16,192.168.11.11,TCP,66,0.006798,,0.006798,"Jan  8, 2024 10:29:45.018316000 JST",,48930  >  6000 [ACK] Seq=1 Ack=1 Win=64256 Len=0 TSval=1432934244 TSecr=4225299208
98,31.641952,192.168.11.16,192.168.11.11,TCP,93,,,0.000482,"Jan  8, 2024 10:29:45.018798000 JST",,"48930  >  6000 [PSH, ACK] Seq=1 Ack=1 Win=64256 Len=27 TSval=1432934244 TSecr=4225299208 [TCP segment of a reassembled PDU]"
99,31.642049,192.168.11.11,192.168.11.16,TCP,66,0.000097,,0.000097,"Jan  8, 2024 10:29:45.018895000 JST",,6000  >  48930 [ACK] Seq=1 Ack=28 Win=65152 Len=0 TSval=4225299215 TSecr=1432934244
100,31.642117,192.168.11.16,192.168.11.11,TCP,66,,,0.000068,"Jan  8, 2024 10:29:45.018963000 JST",,"48930  >  6000 [FIN, ACK] Seq=28 Ack=1 Win=64256 Len=0 TSval=1432934245 TSecr=4225299208"
101,31.643194,192.168.11.11,192.168.11.16,TCP,66,0.001077,,0.001077,"Jan  8, 2024 10:29:45.020040000 JST",,"6000  >  48930 [FIN, ACK] Seq=1 Ack=29 Win=65152 Len=0 TSval=4225299216 TSecr=1432934245"
102,31.649359,192.168.11.16,192.168.11.11,TCP,66,0.006165,,0.006165,"Jan  8, 2024 10:29:45.026205000 JST",,48930  >  6000 [ACK] Seq=29 Ack=2 Win=64256 Len=0 TSval=1432934252 TSecr=4225299216
103,37.687792,192.168.11.11,192.168.11.5,TCP,74,,,6.038433,"Jan  8, 2024 10:29:51.064638000 JST",,38764  >  6000 [SYN] Seq=0 Win=64240 Len=0 MSS=1460 SACK_PERM TSval=1917552089 TSecr=0 WS=128
104,37.694804,192.168.11.5,192.168.11.11,TCP,74,0.007012,,0.007012,"Jan  8, 2024 10:29:51.071650000 JST",,"6000  >  38764 [SYN, ACK] Seq=0 Ack=1 Win=65160 Len=0 MSS=1460 SACK_PERM TSval=2805692996 TSecr=1917552089 WS=128"
105,37.694908,192.168.11.11,192.168.11.5,TCP,66,0.000104,,0.000104,"Jan  8, 2024 10:29:51.071754000 JST",,38764  >  6000 [ACK] Seq=1 Ack=1 Win=64256 Len=0 TSval=1917552096 TSecr=2805692996
106,37.695071,192.168.11.11,192.168.11.5,TCP,93,,,0.000163,"Jan  8, 2024 10:29:51.071917000 JST",,"38764  >  6000 [PSH, ACK] Seq=1 Ack=1 Win=64256 Len=27 TSval=1917552096 TSecr=2805692996 [TCP segment of a reassembled PDU]"
107,37.695154,192.168.11.11,192.168.11.5,TCP,66,,,0.000083,"Jan  8, 2024 10:29:51.072000000 JST",,"38764  >  6000 [FIN, ACK] Seq=28 Ack=1 Win=64256 Len=0 TSval=1917552097 TSecr=2805692996"
108,37.702519,192.168.11.5,192.168.11.11,TCP,66,0.007448,,0.007365,"Jan  8, 2024 10:29:51.079365000 JST",,6000  >  38764 [ACK] Seq=1 Ack=28 Win=65152 Len=0 TSval=2805693003 TSecr=1917552096
109,37.702881,192.168.11.5,192.168.11.11,TCP,66,0.007727,,0.000362,"Jan  8, 2024 10:29:51.079727000 JST",,"6000  >  38764 [FIN, ACK] Seq=1 Ack=29 Win=65152 Len=0 TSval=2805693005 TSecr=1917552097"
110,37.702923,192.168.11.11,192.168.11.5,TCP,66,0.000042,,0.000042,"Jan  8, 2024 10:29:51.079769000 JST",,38764  >  6000 [ACK] Seq=29 Ack=2 Win=64256 Len=0 TSval=1917552104 TSecr=2805693005
111,37.734086,192.168.11.11,255.255.255.255,UDP,209,,Ÿ,0.031163,"Jan  8, 2024 10:29:51.110932000 JST",7b2273656d616e74696373223a207b22656e74697479223a2022504944222c202262617365656e74697479223a2022616e79222c2022726f6c65223a2022707070222c20227370617469616c223a2022616e79222c202274656d706f72616c223a2022616e79227d2c20226461746170726f7065727479223a207b22666f726d6174223a2022696e616f6b615f70726f6772616d5f73616d706c655f73656d616e746963227d7d,38154  >  7000 Len=167
112,37.7421,192.168.11.16,192.168.11.11,TCP,74,,œ,0.008014,"Jan  8, 2024 10:29:51.118946000 JST",,38240  >  6000 [SYN] Seq=0 Win=64240 Len=0 MSS=1460 SACK_PERM TSval=1432940345 TSecr=0 WS=128
113,37.742279,192.168.11.11,192.168.11.16,TCP,74,0.000179,,0.000179,"Jan  8, 2024 10:29:51.119125000 JST",,"6000  >  38240 [SYN, ACK] Seq=0 Ack=1 Win=65160 Len=0 MSS=1460 SACK_PERM TSval=4225305316 TSecr=1432940345 WS=128"
114,37.750835,192.168.11.16,192.168.11.11,TCP,66,0.008556,,0.008556,"Jan  8, 2024 10:29:51.127681000 JST",,38240  >  6000 [ACK] Seq=1 Ack=1 Win=64256 Len=0 TSval=1432940352 TSecr=4225305316
115,37.751557,192.168.11.16,192.168.11.11,TCP,93,,,0.000722,"Jan  8, 2024 10:29:51.128403000 JST",,"38240  >  6000 [PSH, ACK] Seq=1 Ack=1 Win=64256 Len=27 TSval=1432940352 TSecr=4225305316 [TCP segment of a reassembled PDU]"
116,37.751659,192.168.11.11,192.168.11.16,TCP,66,0.000102,,0.000102,"Jan  8, 2024 10:29:51.128505000 JST",,6000  >  38240 [ACK] Seq=1 Ack=28 Win=65152 Len=0 TSval=4225305325 TSecr=1432940352
117,37.751755,192.168.11.16,192.168.11.11,TCP,66,,,0.000096,"Jan  8, 2024 10:29:51.128601000 JST",,"38240  >  6000 [FIN, ACK] Seq=28 Ack=1 Win=64256 Len=0 TSval=1432940353 TSecr=4225305316"
118,37.753858,192.168.11.11,192.168.11.16,TCP,66,0.002103,,0.002103,"Jan  8, 2024 10:29:51.130704000 JST",,"6000  >  38240 [FIN, ACK] Seq=1 Ack=29 Win=65152 Len=0 TSval=4225305327 TSecr=1432940353"
119,37.761647,192.168.11.16,192.168.11.11,TCP,66,0.007789,,0.007789,"Jan  8, 2024 10:29:51.138493000 JST",,38240  >  6000 [ACK] Seq=29 Ack=2 Win=64256 Len=0 TSval=1432940364 TSecr=4225305327
120,43.814397,192.168.11.11,192.168.11.5,TCP,74,,,6.05275,"Jan  8, 2024 10:29:57.191243000 JST",,37628  >  6000 [SYN] Seq=0 Win=64240 Len=0 MSS=1460 SACK_PERM TSval=1917558216 TSecr=0 WS=128
121,43.821655,192.168.11.5,192.168.11.11,TCP,74,0.007258,,0.007258,"Jan  8, 2024 10:29:57.198501000 JST",,"6000  >  37628 [SYN, ACK] Seq=0 Ack=1 Win=65160 Len=0 MSS=1460 SACK_PERM TSval=2805699122 TSecr=1917558216 WS=128"
122,43.821764,192.168.11.11,192.168.11.5,TCP,66,0.000109,,0.000109,"Jan  8, 2024 10:29:57.198610000 JST",,37628  >  6000 [ACK] Seq=1 Ack=1 Win=64256 Len=0 TSval=1917558223 TSecr=2805699122
123,43.821947,192.168.11.11,192.168.11.5,TCP,93,,,0.000183,"Jan  8, 2024 10:29:57.198793000 JST",,"37628  >  6000 [PSH, ACK] Seq=1 Ack=1 Win=64256 Len=27 TSval=1917558223 TSecr=2805699122 [TCP segment of a reassembled PDU]"
124,43.822051,192.168.11.11,192.168.11.5,TCP,66,,,0.000104,"Jan  8, 2024 10:29:57.198897000 JST",,"37628  >  6000 [FIN, ACK] Seq=28 Ack=1 Win=64256 Len=0 TSval=1917558223 TSecr=2805699122"
125,43.829532,192.168.11.5,192.168.11.11,TCP,66,0.007585,,0.007481,"Jan  8, 2024 10:29:57.206378000 JST",,6000  >  37628 [ACK] Seq=1 Ack=28 Win=65152 Len=0 TSval=2805699130 TSecr=1917558223
126,43.829784,192.168.11.5,192.168.11.11,TCP,66,0.007733,,0.000252,"Jan  8, 2024 10:29:57.206630000 JST",,"6000  >  37628 [FIN, ACK] Seq=1 Ack=29 Win=65152 Len=0 TSval=2805699131 TSecr=1917558223"
127,43.829831,192.168.11.11,192.168.11.5,TCP,66,0.000047,,0.000047,"Jan  8, 2024 10:29:57.206677000 JST",,37628  >  6000 [ACK] Seq=29 Ack=2 Win=64256 Len=0 TSval=1917558231 TSecr=2805699131
128,43.85966,192.168.11.11,255.255.255.255,UDP,209,,Ÿ,0.029829,"Jan  8, 2024 10:29:57.236506000 JST",7b2273656d616e74696373223a207b22656e74697479223a2022504944222c202262617365656e74697479223a2022616e79222c2022726f6c65223a2022707070222c20227370617469616c223a2022616e79222c202274656d706f72616c223a2022616e79227d2c20226461746170726f7065727479223a207b22666f726d6174223a2022696e616f6b615f70726f6772616d5f73616d706c655f73656d616e746963227d7d,58873  >  7000 Len=167
129,43.869053,192.168.11.16,192.168.11.11,TCP,74,,œ,0.009393,"Jan  8, 2024 10:29:57.245899000 JST",,50284  >  6000 [SYN] Seq=0 Win=64240 Len=0 MSS=1460 SACK_PERM TSval=1432946471 TSecr=0 WS=128
130,43.869204,192.168.11.11,192.168.11.16,TCP,74,0.000151,,0.000151,"Jan  8, 2024 10:29:57.246050000 JST",,"6000  >  50284 [SYN, ACK] Seq=0 Ack=1 Win=65160 Len=0 MSS=1460 SACK_PERM TSval=4225311443 TSecr=1432946471 WS=128"
131,43.876355,192.168.11.16,192.168.11.11,TCP,66,0.007151,,0.007151,"Jan  8, 2024 10:29:57.253201000 JST",,50284  >  6000 [ACK] Seq=1 Ack=1 Win=64256 Len=0 TSval=1432946479 TSecr=4225311443
132,43.877057,192.168.11.16,192.168.11.11,TCP,93,,,0.000702,"Jan  8, 2024 10:29:57.253903000 JST",,"50284  >  6000 [PSH, ACK] Seq=1 Ack=1 Win=64256 Len=27 TSval=1432946479 TSecr=4225311443 [TCP segment of a reassembled PDU]"
133,43.877174,192.168.11.11,192.168.11.16,TCP,66,0.000117,,0.000117,"Jan  8, 2024 10:29:57.254020000 JST",,6000  >  50284 [ACK] Seq=1 Ack=28 Win=65152 Len=0 TSval=4225311450 TSecr=1432946479
134,43.877253,192.168.11.16,192.168.11.11,TCP,66,,,0.000079,"Jan  8, 2024 10:29:57.254099000 JST",,"50284  >  6000 [FIN, ACK] Seq=28 Ack=1 Win=64256 Len=0 TSval=1432946479 TSecr=4225311443"
135,43.879481,192.168.11.11,192.168.11.16,TCP,66,0.002228,,0.002228,"Jan  8, 2024 10:29:57.256327000 JST",,"6000  >  50284 [FIN, ACK] Seq=1 Ack=29 Win=65152 Len=0 TSval=4225311453 TSecr=1432946479"
136,43.884384,192.168.11.16,192.168.11.11,TCP,66,0.004903,,0.004903,"Jan  8, 2024 10:29:57.261230000 JST",,50284  >  6000 [ACK] Seq=29 Ack=2 Win=64256 Len=0 TSval=1432946487 TSecr=4225311453
137,49.913506,192.168.11.11,192.168.11.5,TCP,74,,,6.029122,"Jan  8, 2024 10:30:03.290352000 JST",,37842  >  6000 [SYN] Seq=0 Win=64240 Len=0 MSS=1460 SACK_PERM TSval=1917564315 TSecr=0 WS=128
138,49.920125,192.168.11.5,192.168.11.11,TCP,74,0.006619,,0.006619,"Jan  8, 2024 10:30:03.296971000 JST",,"6000  >  37842 [SYN, ACK] Seq=0 Ack=1 Win=65160 Len=0 MSS=1460 SACK_PERM TSval=2805705221 TSecr=1917564315 WS=128"
139,49.920264,192.168.11.11,192.168.11.5,TCP,66,0.000139,,0.000139,"Jan  8, 2024 10:30:03.297110000 JST",,37842  >  6000 [ACK] Seq=1 Ack=1 Win=64256 Len=0 TSval=1917564322 TSecr=2805705221
140,49.920442,192.168.11.11,192.168.11.5,TCP,93,,,0.000178,"Jan  8, 2024 10:30:03.297288000 JST",,"37842  >  6000 [PSH, ACK] Seq=1 Ack=1 Win=64256 Len=27 TSval=1917564322 TSecr=2805705221 [TCP segment of a reassembled PDU]"
141,49.920547,192.168.11.11,192.168.11.5,TCP,66,,,0.000105,"Jan  8, 2024 10:30:03.297393000 JST",,"37842  >  6000 [FIN, ACK] Seq=28 Ack=1 Win=64256 Len=0 TSval=1917564322 TSecr=2805705221"
142,49.927469,192.168.11.5,192.168.11.11,TCP,66,0.007027,,0.006922,"Jan  8, 2024 10:30:03.304315000 JST",,6000  >  37842 [ACK] Seq=1 Ack=28 Win=65152 Len=0 TSval=2805705228 TSecr=1917564322
143,49.92784,192.168.11.5,192.168.11.11,TCP,66,0.007293,,0.000371,"Jan  8, 2024 10:30:03.304686000 JST",,"6000  >  37842 [FIN, ACK] Seq=1 Ack=29 Win=65152 Len=0 TSval=2805705229 TSecr=1917564322"
144,49.927889,192.168.11.11,192.168.11.5,TCP,66,0.000049,,0.000049,"Jan  8, 2024 10:30:03.304735000 JST",,37842  >  6000 [ACK] Seq=29 Ack=2 Win=64256 Len=0 TSval=1917564329 TSecr=2805705229
145,49.957504,192.168.11.11,255.255.255.255,UDP,209,,Ÿ,0.029615,"Jan  8, 2024 10:30:03.334350000 JST",7b2273656d616e74696373223a207b22656e74697479223a2022504944222c202262617365656e74697479223a2022616e79222c2022726f6c65223a2022707070222c20227370617469616c223a2022616e79222c202274656d706f72616c223a2022616e79227d2c20226461746170726f7065727479223a207b22666f726d6174223a2022696e616f6b615f70726f6772616d5f73616d706c655f73656d616e746963227d7d,60403  >  7000 Len=167
146,49.965387,192.168.11.16,192.168.11.11,TCP,74,,œ,0.007883,"Jan  8, 2024 10:30:03.342233000 JST",,50292  >  6000 [SYN] Seq=0 Win=64240 Len=0 MSS=1460 SACK_PERM TSval=1432952568 TSecr=0 WS=128
147,49.965544,192.168.11.11,192.168.11.16,TCP,74,0.000157,,0.000157,"Jan  8, 2024 10:30:03.342390000 JST",,"6000  >  50292 [SYN, ACK] Seq=0 Ack=1 Win=65160 Len=0 MSS=1460 SACK_PERM TSval=4225317539 TSecr=1432952568 WS=128"
148,49.972628,192.168.11.16,192.168.11.11,TCP,66,0.007084,,0.007084,"Jan  8, 2024 10:30:03.349474000 JST",,50292  >  6000 [ACK] Seq=1 Ack=1 Win=64256 Len=0 TSval=1432952575 TSecr=4225317539
149,49.973352,192.168.11.16,192.168.11.11,TCP,93,,,0.000724,"Jan  8, 2024 10:30:03.350198000 JST",,"50292  >  6000 [PSH, ACK] Seq=1 Ack=1 Win=64256 Len=27 TSval=1432952575 TSecr=4225317539 [TCP segment of a reassembled PDU]"
150,49.97347,192.168.11.11,192.168.11.16,TCP,66,0.000118,,0.000118,"Jan  8, 2024 10:30:03.350316000 JST",,6000  >  50292 [ACK] Seq=1 Ack=28 Win=65152 Len=0 TSval=4225317547 TSecr=1432952575
151,49.973552,192.168.11.16,192.168.11.11,TCP,66,,,0.000082,"Jan  8, 2024 10:30:03.350398000 JST",,"50292  >  6000 [FIN, ACK] Seq=28 Ack=1 Win=64256 Len=0 TSval=1432952576 TSecr=4225317539"
152,49.975692,192.168.11.11,192.168.11.16,TCP,66,0.00214,,0.00214,"Jan  8, 2024 10:30:03.352538000 JST",,"6000  >  50292 [FIN, ACK] Seq=1 Ack=29 Win=65152 Len=0 TSval=4225317549 TSecr=1432952576"
153,49.983146,192.168.11.16,192.168.11.11,TCP,66,0.007454,,0.007454,"Jan  8, 2024 10:30:03.359992000 JST",,50292  >  6000 [ACK] Seq=29 Ack=2 Win=64256 Len=0 TSval=1432952585 TSecr=4225317549
154,56.016706,192.168.11.11,192.168.11.5,TCP,74,,,6.03356,"Jan  8, 2024 10:30:09.393552000 JST",,37848  >  6000 [SYN] Seq=0 Win=64240 Len=0 MSS=1460 SACK_PERM TSval=1917570418 TSecr=0 WS=128
155,56.023416,192.168.11.5,192.168.11.11,TCP,74,0.00671,,0.00671,"Jan  8, 2024 10:30:09.400262000 JST",,"6000  >  37848 [SYN, ACK] Seq=0 Ack=1 Win=65160 Len=0 MSS=1460 SACK_PERM TSval=2805711324 TSecr=1917570418 WS=128"
156,56.02353,192.168.11.11,192.168.11.5,TCP,66,0.000114,,0.000114,"Jan  8, 2024 10:30:09.400376000 JST",,37848  >  6000 [ACK] Seq=1 Ack=1 Win=64256 Len=0 TSval=1917570425 TSecr=2805711324
157,56.023718,192.168.11.11,192.168.11.5,TCP,93,,,0.000188,"Jan  8, 2024 10:30:09.400564000 JST",,"37848  >  6000 [PSH, ACK] Seq=1 Ack=1 Win=64256 Len=27 TSval=1917570425 TSecr=2805711324 [TCP segment of a reassembled PDU]"
158,56.023812,192.168.11.11,192.168.11.5,TCP,66,,,0.000094,"Jan  8, 2024 10:30:09.400658000 JST",,"37848  >  6000 [FIN, ACK] Seq=28 Ack=1 Win=64256 Len=0 TSval=1917570425 TSecr=2805711324"
159,56.031015,192.168.11.5,192.168.11.11,TCP,66,0.007297,,0.007203,"Jan  8, 2024 10:30:09.407861000 JST",,6000  >  37848 [ACK] Seq=1 Ack=28 Win=65152 Len=0 TSval=2805711332 TSecr=1917570425
160,56.031381,192.168.11.5,192.168.11.11,TCP,66,0.007569,,0.000366,"Jan  8, 2024 10:30:09.408227000 JST",,"6000  >  37848 [FIN, ACK] Seq=1 Ack=29 Win=65152 Len=0 TSval=2805711333 TSecr=1917570425"
161,56.031427,192.168.11.11,192.168.11.5,TCP,66,0.000046,,0.000046,"Jan  8, 2024 10:30:09.408273000 JST",,37848  >  6000 [ACK] Seq=29 Ack=2 Win=64256 Len=0 TSval=1917570433 TSecr=2805711333
162,56.063775,192.168.11.11,255.255.255.255,UDP,209,,Ÿ,0.032348,"Jan  8, 2024 10:30:09.440621000 JST",7b2273656d616e74696373223a207b22656e74697479223a2022504944222c202262617365656e74697479223a2022616e79222c2022726f6c65223a2022707070222c20227370617469616c223a2022616e79222c202274656d706f72616c223a2022616e79227d2c20226461746170726f7065727479223a207b22666f726d6174223a2022696e616f6b615f70726f6772616d5f73616d706c655f73656d616e746963227d7d,51688  >  7000 Len=167
163,56.071201,192.168.11.16,192.168.11.11,TCP,74,,œ,0.007426,"Jan  8, 2024 10:30:09.448047000 JST",,54404  >  6000 [SYN] Seq=0 Win=64240 Len=0 MSS=1460 SACK_PERM TSval=1432958674 TSecr=0 WS=128
164,56.071324,192.168.11.11,192.168.11.16,TCP,74,0.000123,,0.000123,"Jan  8, 2024 10:30:09.448170000 JST",,"6000  >  54404 [SYN, ACK] Seq=0 Ack=1 Win=65160 Len=0 MSS=1460 SACK_PERM TSval=4225323645 TSecr=1432958674 WS=128"
165,56.077887,192.168.11.16,192.168.11.11,TCP,66,0.006563,,0.006563,"Jan  8, 2024 10:30:09.454733000 JST",,54404  >  6000 [ACK] Seq=1 Ack=1 Win=64256 Len=0 TSval=1432958681 TSecr=4225323645
166,56.078496,192.168.11.16,192.168.11.11,TCP,93,,,0.000609,"Jan  8, 2024 10:30:09.455342000 JST",,"54404  >  6000 [PSH, ACK] Seq=1 Ack=1 Win=64256 Len=27 TSval=1432958681 TSecr=4225323645 [TCP segment of a reassembled PDU]"
167,56.07859,192.168.11.11,192.168.11.16,TCP,66,0.000094,,0.000094,"Jan  8, 2024 10:30:09.455436000 JST",,6000  >  54404 [ACK] Seq=1 Ack=28 Win=65152 Len=0 TSval=4225323652 TSecr=1432958681
168,56.078651,192.168.11.16,192.168.11.11,TCP,66,,,0.000061,"Jan  8, 2024 10:30:09.455497000 JST",,"54404  >  6000 [FIN, ACK] Seq=28 Ack=1 Win=64256 Len=0 TSval=1432958681 TSecr=4225323645"
169,56.08042,192.168.11.11,192.168.11.16,TCP,66,0.001769,,0.001769,"Jan  8, 2024 10:30:09.457266000 JST",,"6000  >  54404 [FIN, ACK] Seq=1 Ack=29 Win=65152 Len=0 TSval=4225323654 TSecr=1432958681"
170,56.085575,192.168.11.16,192.168.11.11,TCP,66,0.005155,,0.005155,"Jan  8, 2024 10:30:09.462421000 JST",,54404  >  6000 [ACK] Seq=29 Ack=2 Win=64256 Len=0 TSval=1432958688 TSecr=4225323654
171,87.19087,192.168.11.11,192.168.11.5,TCP,74,,,31.105295,"Jan  8, 2024 10:30:40.567716000 JST",,38618  >  6000 [SYN] Seq=0 Win=64240 Len=0 MSS=1460 SACK_PERM TSval=1917601592 TSecr=0 WS=128
172,87.197666,192.168.11.5,192.168.11.11,TCP,74,0.006796,,0.006796,"Jan  8, 2024 10:30:40.574512000 JST",,"6000  >  38618 [SYN, ACK] Seq=0 Ack=1 Win=65160 Len=0 MSS=1460 SACK_PERM TSval=2805742498 TSecr=1917601592 WS=128"
173,87.197774,192.168.11.11,192.168.11.5,TCP,66,0.000108,,0.000108,"Jan  8, 2024 10:30:40.574620000 JST",,38618  >  6000 [ACK] Seq=1 Ack=1 Win=64256 Len=0 TSval=1917601599 TSecr=2805742498
174,87.197905,192.168.11.11,192.168.11.5,TCP,93,,,0.000131,"Jan  8, 2024 10:30:40.574751000 JST",,"38618  >  6000 [PSH, ACK] Seq=1 Ack=1 Win=64256 Len=27 TSval=1917601599 TSecr=2805742498 [TCP segment of a reassembled PDU]"
175,87.198026,192.168.11.11,192.168.11.5,TCP,66,,,0.000121,"Jan  8, 2024 10:30:40.574872000 JST",,"38618  >  6000 [FIN, ACK] Seq=28 Ack=1 Win=64256 Len=0 TSval=1917601599 TSecr=2805742498"
176,87.205139,192.168.11.5,192.168.11.11,TCP,66,0.007234,,0.007113,"Jan  8, 2024 10:30:40.581985000 JST",,6000  >  38618 [ACK] Seq=1 Ack=28 Win=65152 Len=0 TSval=2805742506 TSecr=1917601599
177,87.207142,192.168.11.5,192.168.11.11,TCP,66,0.009116,,0.002003,"Jan  8, 2024 10:30:40.583988000 JST",,"6000  >  38618 [FIN, ACK] Seq=1 Ack=29 Win=65152 Len=0 TSval=2805742508 TSecr=1917601599"
178,87.207191,192.168.11.11,192.168.11.5,TCP,66,0.000049,,0.000049,"Jan  8, 2024 10:30:40.584037000 JST",,38618  >  6000 [ACK] Seq=29 Ack=2 Win=64256 Len=0 TSval=1917601609 TSecr=2805742508
179,87.239387,192.168.11.11,255.255.255.255,UDP,209,,Ÿ,0.032196,"Jan  8, 2024 10:30:40.616233000 JST",7b2273656d616e74696373223a207b22656e74697479223a2022504944222c202262617365656e74697479223a2022616e79222c2022726f6c65223a2022707070222c20227370617469616c223a2022616e79222c202274656d706f72616c223a2022616e79227d2c20226461746170726f7065727479223a207b22666f726d6174223a2022696e616f6b615f70726f6772616d5f73616d706c655f73656d616e746963227d7d,36775  >  7000 Len=167
180,87.247268,192.168.11.16,192.168.11.11,TCP,74,,œ,0.007881,"Jan  8, 2024 10:30:40.624114000 JST",,54790  >  6000 [SYN] Seq=0 Win=64240 Len=0 MSS=1460 SACK_PERM TSval=1432989850 TSecr=0 WS=128
181,87.247446,192.168.11.11,192.168.11.16,TCP,74,0.000178,,0.000178,"Jan  8, 2024 10:30:40.624292000 JST",,"6000  >  54790 [SYN, ACK] Seq=0 Ack=1 Win=65160 Len=0 MSS=1460 SACK_PERM TSval=4225354821 TSecr=1432989850 WS=128"
182,87.254301,192.168.11.16,192.168.11.11,TCP,66,0.006855,,0.006855,"Jan  8, 2024 10:30:40.631147000 JST",,54790  >  6000 [ACK] Seq=1 Ack=1 Win=64256 Len=0 TSval=1432989857 TSecr=4225354821
183,87.254706,192.168.11.16,192.168.11.11,TCP,93,,,0.000405,"Jan  8, 2024 10:30:40.631552000 JST",,"54790  >  6000 [PSH, ACK] Seq=1 Ack=1 Win=64256 Len=27 TSval=1432989857 TSecr=4225354821 [TCP segment of a reassembled PDU]"
184,87.254805,192.168.11.11,192.168.11.16,TCP,66,0.000099,,0.000099,"Jan  8, 2024 10:30:40.631651000 JST",,6000  >  54790 [ACK] Seq=1 Ack=28 Win=65152 Len=0 TSval=4225354828 TSecr=1432989857
185,87.25507,192.168.11.16,192.168.11.11,TCP,66,,,0.000265,"Jan  8, 2024 10:30:40.631916000 JST",,"54790  >  6000 [FIN, ACK] Seq=28 Ack=1 Win=64256 Len=0 TSval=1432989858 TSecr=4225354821"
