No.,Time,Source,Destination,Protocol,Length,The RTT to ACK the segment was,XXX,Time delta from previous captured frame,Arrival Time,Data,Info
1,0,192.168.11.17,192.168.11.16,TCP,74,,,0,"Jan  8, 2024 10:29:13.479853000 JST",,37612  >  6000 [SYN] Seq=0 Win=64240 Len=0 MSS=1460 SACK_PERM TSval=194158077 TSecr=0 WS=128
2,0.006739,192.168.11.16,192.168.11.17,TCP,74,0.006739,,0.006739,"Jan  8, 2024 10:29:13.486592000 JST",,"6000  >  37612 [SYN, ACK] Seq=0 Ack=1 Win=65160 Len=0 MSS=1460 SACK_PERM TSval=1090135806 TSecr=194158077 WS=128"
3,0.006837,192.168.11.17,192.168.11.16,TCP,66,0.000098,,0.000098,"Jan  8, 2024 10:29:13.486690000 JST",,37612  >  6000 [ACK] Seq=1 Ack=1 Win=64256 Len=0 TSval=194158087 TSecr=1090135806
4,0.007053,192.168.11.17,192.168.11.16,TCP,93,,,0.000216,"Jan  8, 2024 10:29:13.486906000 JST",,"37612  >  6000 [PSH, ACK] Seq=1 Ack=1 Win=64256 Len=27 TSval=194158087 TSecr=1090135806 [TCP segment of a reassembled PDU]"
5,0.007178,192.168.11.17,192.168.11.16,TCP,66,,,0.000125,"Jan  8, 2024 10:29:13.487031000 JST",,"37612  >  6000 [FIN, ACK] Seq=28 Ack=1 Win=64256 Len=0 TSval=194158087 TSecr=1090135806"
6,0.014404,192.168.11.16,192.168.11.17,TCP,66,0.007351,,0.007226,"Jan  8, 2024 10:29:13.494257000 JST",,6000  >  37612 [ACK] Seq=1 Ack=28 Win=65152 Len=0 TSval=1090135814 TSecr=194158087
7,0.016987,192.168.11.16,192.168.11.17,TCP,66,0.009809,,0.002583,"Jan  8, 2024 10:29:13.496840000 JST",,"6000  >  37612 [FIN, ACK] Seq=1 Ack=29 Win=65152 Len=0 TSval=1090135816 TSecr=194158087"
8,0.017036,192.168.11.17,192.168.11.16,TCP,66,0.000049,,0.000049,"Jan  8, 2024 10:29:13.496889000 JST",,37612  >  6000 [ACK] Seq=29 Ack=2 Win=64256 Len=0 TSval=194158097 TSecr=1090135816
9,0.049457,192.168.11.17,255.255.255.255,UDP,209,,Ÿ,0.032421,"Jan  8, 2024 10:29:13.529310000 JST",7b2273656d616e74696373223a207b22656e74697479223a2022504944222c202262617365656e74697479223a2022616e79222c2022726f6c65223a2022727272222c20227370617469616c223a2022616e79222c202274656d706f72616c223a2022616e79227d2c20226461746170726f7065727479223a207b22666f726d6174223a2022696e616f6b615f70726f6772616d5f73616d706c655f73656d616e746963227d7d,54743  >  7000 Len=167
10,0.060466,192.168.11.19,192.168.11.17,TCP,74,,œ,0.011009,"Jan  8, 2024 10:29:13.540319000 JST",,47492  >  6000 [SYN] Seq=0 Win=64240 Len=0 MSS=1460 SACK_PERM TSval=2816141285 TSecr=0 WS=128
11,0.060638,192.168.11.17,192.168.11.19,TCP,74,0.000172,,0.000172,"Jan  8, 2024 10:29:13.540491000 JST",,"6000  >  47492 [SYN, ACK] Seq=0 Ack=1 Win=65160 Len=0 MSS=1460 SACK_PERM TSval=2350600261 TSecr=2816141285 WS=128"
12,0.069289,192.168.11.19,192.168.11.17,TCP,66,0.008651,,0.008651,"Jan  8, 2024 10:29:13.549142000 JST",,47492  >  6000 [ACK] Seq=1 Ack=1 Win=64256 Len=0 TSval=2816141297 TSecr=2350600261
13,0.069942,192.168.11.19,192.168.11.17,TCP,93,,,0.000653,"Jan  8, 2024 10:29:13.549795000 JST",,"47492  >  6000 [PSH, ACK] Seq=1 Ack=1 Win=64256 Len=27 TSval=2816141298 TSecr=2350600261 [TCP segment of a reassembled PDU]"
14,0.070062,192.168.11.17,192.168.11.19,TCP,66,0.00012,,0.00012,"Jan  8, 2024 10:29:13.549915000 JST",,6000  >  47492 [ACK] Seq=1 Ack=28 Win=65152 Len=0 TSval=2350600271 TSecr=2816141298
15,0.070159,192.168.11.19,192.168.11.17,TCP,66,,,0.000097,"Jan  8, 2024 10:29:13.550012000 JST",,"47492  >  6000 [FIN, ACK] Seq=28 Ack=1 Win=64256 Len=0 TSval=2816141298 TSecr=2350600261"
16,0.071833,192.168.11.17,192.168.11.19,TCP,66,0.001674,,0.001674,"Jan  8, 2024 10:29:13.551686000 JST",,"6000  >  47492 [FIN, ACK] Seq=1 Ack=29 Win=65152 Len=0 TSval=2350600273 TSecr=2816141298"
17,0.076765,192.168.11.19,192.168.11.17,TCP,66,0.004932,,0.004932,"Jan  8, 2024 10:29:13.556618000 JST",,47492  >  6000 [ACK] Seq=29 Ack=2 Win=64256 Len=0 TSval=2816141305 TSecr=2350600273
18,6.133574,192.168.11.17,192.168.11.16,TCP,74,,,6.056809,"Jan  8, 2024 10:29:19.613427000 JST",,51880  >  6000 [SYN] Seq=0 Win=64240 Len=0 MSS=1460 SACK_PERM TSval=194164213 TSecr=0 WS=128
19,6.140467,192.168.11.16,192.168.11.17,TCP,74,0.006893,,0.006893,"Jan  8, 2024 10:29:19.620320000 JST",,"6000  >  51880 [SYN, ACK] Seq=0 Ack=1 Win=65160 Len=0 MSS=1460 SACK_PERM TSval=1090141940 TSecr=194164213 WS=128"
20,6.140582,192.168.11.17,192.168.11.16,TCP,66,0.000115,,0.000115,"Jan  8, 2024 10:29:19.620435000 JST",,51880  >  6000 [ACK] Seq=1 Ack=1 Win=64256 Len=0 TSval=194164220 TSecr=1090141940
21,6.140727,192.168.11.17,192.168.11.16,TCP,93,,,0.000145,"Jan  8, 2024 10:29:19.620580000 JST",,"51880  >  6000 [PSH, ACK] Seq=1 Ack=1 Win=64256 Len=27 TSval=194164221 TSecr=1090141940 [TCP segment of a reassembled PDU]"
22,6.140872,192.168.11.17,192.168.11.16,TCP,66,,,0.000145,"Jan  8, 2024 10:29:19.620725000 JST",,"51880  >  6000 [FIN, ACK] Seq=28 Ack=1 Win=64256 Len=0 TSval=194164221 TSecr=1090141940"
23,6.152606,192.168.11.16,192.168.11.17,TCP,66,0.011734,,0.011734,"Jan  8, 2024 10:29:19.632459000 JST",,"6000  >  51880 [FIN, ACK] Seq=1 Ack=29 Win=65152 Len=0 TSval=1090141949 TSecr=194164221"
24,6.152681,192.168.11.17,192.168.11.16,TCP,66,0.000075,,0.000075,"Jan  8, 2024 10:29:19.632534000 JST",,51880  >  6000 [ACK] Seq=29 Ack=2 Win=64256 Len=0 TSval=194164233 TSecr=1090141949
25,6.185183,192.168.11.17,255.255.255.255,UDP,209,,Ÿ,0.032502,"Jan  8, 2024 10:29:19.665036000 JST",7b2273656d616e74696373223a207b22656e74697479223a2022504944222c202262617365656e74697479223a2022616e79222c2022726f6c65223a2022727272222c20227370617469616c223a2022616e79222c202274656d706f72616c223a2022616e79227d2c20226461746170726f7065727479223a207b22666f726d6174223a2022696e616f6b615f70726f6772616d5f73616d706c655f73656d616e746963227d7d,33187  >  7000 Len=167
26,6.193896,192.168.11.19,192.168.11.17,TCP,74,,œ,0.008713,"Jan  8, 2024 10:29:19.673749000 JST",,45642  >  6000 [SYN] Seq=0 Win=64240 Len=0 MSS=1460 SACK_PERM TSval=2816147421 TSecr=0 WS=128
27,6.194039,192.168.11.17,192.168.11.19,TCP,74,0.000143,,0.000143,"Jan  8, 2024 10:29:19.673892000 JST",,"6000  >  45642 [SYN, ACK] Seq=0 Ack=1 Win=65160 Len=0 MSS=1460 SACK_PERM TSval=2350606395 TSecr=2816147421 WS=128"
28,6.20091,192.168.11.19,192.168.11.17,TCP,66,0.006871,,0.006871,"Jan  8, 2024 10:29:19.680763000 JST",,45642  >  6000 [ACK] Seq=1 Ack=1 Win=64256 Len=0 TSval=2816147429 TSecr=2350606395
29,6.201602,192.168.11.19,192.168.11.17,TCP,93,,,0.000692,"Jan  8, 2024 10:29:19.681455000 JST",,"45642  >  6000 [PSH, ACK] Seq=1 Ack=1 Win=64256 Len=27 TSval=2816147429 TSecr=2350606395 [TCP segment of a reassembled PDU]"
30,6.201712,192.168.11.17,192.168.11.19,TCP,66,0.00011,,0.00011,"Jan  8, 2024 10:29:19.681565000 JST",,6000  >  45642 [ACK] Seq=1 Ack=28 Win=65152 Len=0 TSval=2350606403 TSecr=2816147429
31,6.201793,192.168.11.19,192.168.11.17,TCP,66,,,0.000081,"Jan  8, 2024 10:29:19.681646000 JST",,"45642  >  6000 [FIN, ACK] Seq=28 Ack=1 Win=64256 Len=0 TSval=2816147429 TSecr=2350606395"
32,6.203169,192.168.11.17,192.168.11.19,TCP,66,0.001376,,0.001376,"Jan  8, 2024 10:29:19.683022000 JST",,"6000  >  45642 [FIN, ACK] Seq=1 Ack=29 Win=65152 Len=0 TSval=2350606404 TSecr=2816147429"
33,6.210866,192.168.11.19,192.168.11.17,TCP,66,0.007697,,0.007697,"Jan  8, 2024 10:29:19.690719000 JST",,45642  >  6000 [ACK] Seq=29 Ack=2 Win=64256 Len=0 TSval=2816147437 TSecr=2350606404
34,12.252427,192.168.11.17,192.168.11.16,TCP,74,,,6.041561,"Jan  8, 2024 10:29:25.732280000 JST",,51894  >  6000 [SYN] Seq=0 Win=64240 Len=0 MSS=1460 SACK_PERM TSval=194170332 TSecr=0 WS=128
35,12.259412,192.168.11.16,192.168.11.17,TCP,74,0.006985,,0.006985,"Jan  8, 2024 10:29:25.739265000 JST",,"6000  >  51894 [SYN, ACK] Seq=0 Ack=1 Win=65160 Len=0 MSS=1460 SACK_PERM TSval=1090148059 TSecr=194170332 WS=128"
36,12.259518,192.168.11.17,192.168.11.16,TCP,66,0.000106,,0.000106,"Jan  8, 2024 10:29:25.739371000 JST",,51894  >  6000 [ACK] Seq=1 Ack=1 Win=64256 Len=0 TSval=194170339 TSecr=1090148059
37,12.259698,192.168.11.17,192.168.11.16,TCP,93,,,0.00018,"Jan  8, 2024 10:29:25.739551000 JST",,"51894  >  6000 [PSH, ACK] Seq=1 Ack=1 Win=64256 Len=27 TSval=194170340 TSecr=1090148059 [TCP segment of a reassembled PDU]"
38,12.259824,192.168.11.17,192.168.11.16,TCP,66,,,0.000126,"Jan  8, 2024 10:29:25.739677000 JST",,"51894  >  6000 [FIN, ACK] Seq=28 Ack=1 Win=64256 Len=0 TSval=194170340 TSecr=1090148059"
39,12.276581,192.168.11.16,192.168.11.17,TCP,66,0.016883,,0.016757,"Jan  8, 2024 10:29:25.756434000 JST",,6000  >  51894 [ACK] Seq=1 Ack=28 Win=65152 Len=0 TSval=1090148076 TSecr=194170340
40,12.276973,192.168.11.16,192.168.11.17,TCP,66,0.017149,,0.000392,"Jan  8, 2024 10:29:25.756826000 JST",,"6000  >  51894 [FIN, ACK] Seq=1 Ack=29 Win=65152 Len=0 TSval=1090148077 TSecr=194170340"
41,12.277019,192.168.11.17,192.168.11.16,TCP,66,0.000046,,0.000046,"Jan  8, 2024 10:29:25.756872000 JST",,51894  >  6000 [ACK] Seq=29 Ack=2 Win=64256 Len=0 TSval=194170357 TSecr=1090148077
42,12.305458,192.168.11.17,255.255.255.255,UDP,209,,Ÿ,0.028439,"Jan  8, 2024 10:29:25.785311000 JST",7b2273656d616e74696373223a207b22656e74697479223a2022504944222c202262617365656e74697479223a2022616e79222c2022726f6c65223a2022727272222c20227370617469616c223a2022616e79222c202274656d706f72616c223a2022616e79227d2c20226461746170726f7065727479223a207b22666f726d6174223a2022696e616f6b615f70726f6772616d5f73616d706c655f73656d616e746963227d7d,59706  >  7000 Len=167
43,12.315035,192.168.11.19,192.168.11.17,TCP,74,,œ,0.009577,"Jan  8, 2024 10:29:25.794888000 JST",,55032  >  6000 [SYN] Seq=0 Win=64240 Len=0 MSS=1460 SACK_PERM TSval=2816153542 TSecr=0 WS=128
44,12.315182,192.168.11.17,192.168.11.19,TCP,74,0.000147,,0.000147,"Jan  8, 2024 10:29:25.795035000 JST",,"6000  >  55032 [SYN, ACK] Seq=0 Ack=1 Win=65160 Len=0 MSS=1460 SACK_PERM TSval=2350612516 TSecr=2816153542 WS=128"
45,12.323843,192.168.11.19,192.168.11.17,TCP,66,0.008661,,0.008661,"Jan  8, 2024 10:29:25.803696000 JST",,55032  >  6000 [ACK] Seq=1 Ack=1 Win=64256 Len=0 TSval=2816153550 TSecr=2350612516
46,12.324483,192.168.11.19,192.168.11.17,TCP,93,,,0.00064,"Jan  8, 2024 10:29:25.804336000 JST",,"55032  >  6000 [PSH, ACK] Seq=1 Ack=1 Win=64256 Len=27 TSval=2816153550 TSecr=2350612516 [TCP segment of a reassembled PDU]"
47,12.324606,192.168.11.17,192.168.11.19,TCP,66,0.000123,,0.000123,"Jan  8, 2024 10:29:25.804459000 JST",,6000  >  55032 [ACK] Seq=1 Ack=28 Win=65152 Len=0 TSval=2350612525 TSecr=2816153550
48,12.32469,192.168.11.19,192.168.11.17,TCP,66,,,0.000084,"Jan  8, 2024 10:29:25.804543000 JST",,"55032  >  6000 [FIN, ACK] Seq=28 Ack=1 Win=64256 Len=0 TSval=2816153550 TSecr=2350612516"
49,12.325972,192.168.11.17,192.168.11.19,TCP,66,0.001282,,0.001282,"Jan  8, 2024 10:29:25.805825000 JST",,"6000  >  55032 [FIN, ACK] Seq=1 Ack=29 Win=65152 Len=0 TSval=2350612527 TSecr=2816153550"
50,12.333881,192.168.11.19,192.168.11.17,TCP,66,0.007909,,0.007909,"Jan  8, 2024 10:29:25.813734000 JST",,55032  >  6000 [ACK] Seq=29 Ack=2 Win=64256 Len=0 TSval=2816153562 TSecr=2350612527
51,18.366018,192.168.11.17,192.168.11.16,TCP,74,,,6.032137,"Jan  8, 2024 10:29:31.845871000 JST",,41584  >  6000 [SYN] Seq=0 Win=64240 Len=0 MSS=1460 SACK_PERM TSval=194176446 TSecr=0 WS=128
52,18.374689,192.168.11.16,192.168.11.17,TCP,74,0.008671,,0.008671,"Jan  8, 2024 10:29:31.854542000 JST",,"6000  >  41584 [SYN, ACK] Seq=0 Ack=1 Win=65160 Len=0 MSS=1460 SACK_PERM TSval=1090154174 TSecr=194176446 WS=128"
53,18.374791,192.168.11.17,192.168.11.16,TCP,66,0.000102,,0.000102,"Jan  8, 2024 10:29:31.854644000 JST",,41584  >  6000 [ACK] Seq=1 Ack=1 Win=64256 Len=0 TSval=194176455 TSecr=1090154174
54,18.374953,192.168.11.17,192.168.11.16,TCP,93,,,0.000162,"Jan  8, 2024 10:29:31.854806000 JST",,"41584  >  6000 [PSH, ACK] Seq=1 Ack=1 Win=64256 Len=27 TSval=194176455 TSecr=1090154174 [TCP segment of a reassembled PDU]"
55,18.375052,192.168.11.17,192.168.11.16,TCP,66,,,0.000099,"Jan  8, 2024 10:29:31.854905000 JST",,"41584  >  6000 [FIN, ACK] Seq=28 Ack=1 Win=64256 Len=0 TSval=194176455 TSecr=1090154174"
56,18.382448,192.168.11.16,192.168.11.17,TCP,66,0.007495,,0.007396,"Jan  8, 2024 10:29:31.862301000 JST",,6000  >  41584 [ACK] Seq=1 Ack=28 Win=65152 Len=0 TSval=1090154182 TSecr=194176455
57,18.382812,192.168.11.16,192.168.11.17,TCP,66,0.00776,,0.000364,"Jan  8, 2024 10:29:31.862665000 JST",,"6000  >  41584 [FIN, ACK] Seq=1 Ack=29 Win=65152 Len=0 TSval=1090154183 TSecr=194176455"
58,18.382857,192.168.11.17,192.168.11.16,TCP,66,0.000045,,0.000045,"Jan  8, 2024 10:29:31.862710000 JST",,41584  >  6000 [ACK] Seq=29 Ack=2 Win=64256 Len=0 TSval=194176463 TSecr=1090154183
59,18.412427,192.168.11.17,255.255.255.255,UDP,209,,Ÿ,0.02957,"Jan  8, 2024 10:29:31.892280000 JST",7b2273656d616e74696373223a207b22656e74697479223a2022504944222c202262617365656e74697479223a2022616e79222c2022726f6c65223a2022727272222c20227370617469616c223a2022616e79222c202274656d706f72616c223a2022616e79227d2c20226461746170726f7065727479223a207b22666f726d6174223a2022696e616f6b615f70726f6772616d5f73616d706c655f73656d616e746963227d7d,52221  >  7000 Len=167
60,18.42028,192.168.11.19,192.168.11.17,TCP,74,,œ,0.007853,"Jan  8, 2024 10:29:31.900133000 JST",,55038  >  6000 [SYN] Seq=0 Win=64240 Len=0 MSS=1460 SACK_PERM TSval=2816159649 TSecr=0 WS=128
61,18.420425,192.168.11.17,192.168.11.19,TCP,74,0.000145,,0.000145,"Jan  8, 2024 10:29:31.900278000 JST",,"6000  >  55038 [SYN, ACK] Seq=0 Ack=1 Win=65160 Len=0 MSS=1460 SACK_PERM TSval=2350618621 TSecr=2816159649 WS=128"
62,18.427097,192.168.11.19,192.168.11.17,TCP,66,0.006672,,0.006672,"Jan  8, 2024 10:29:31.906950000 JST",,55038  >  6000 [ACK] Seq=1 Ack=1 Win=64256 Len=0 TSval=2816159655 TSecr=2350618621
63,18.427747,192.168.11.19,192.168.11.17,TCP,93,,,0.00065,"Jan  8, 2024 10:29:31.907600000 JST",,"55038  >  6000 [PSH, ACK] Seq=1 Ack=1 Win=64256 Len=27 TSval=2816159656 TSecr=2350618621 [TCP segment of a reassembled PDU]"
64,18.427826,192.168.11.17,192.168.11.19,TCP,66,0.000079,,0.000079,"Jan  8, 2024 10:29:31.907679000 JST",,6000  >  55038 [ACK] Seq=1 Ack=28 Win=65152 Len=0 TSval=2350618629 TSecr=2816159656
65,18.427896,192.168.11.19,192.168.11.17,TCP,66,,,0.00007,"Jan  8, 2024 10:29:31.907749000 JST",,"55038  >  6000 [FIN, ACK] Seq=28 Ack=1 Win=64256 Len=0 TSval=2816159656 TSecr=2350618621"
66,18.429123,192.168.11.17,192.168.11.19,TCP,66,0.001227,,0.001227,"Jan  8, 2024 10:29:31.908976000 JST",,"6000  >  55038 [FIN, ACK] Seq=1 Ack=29 Win=65152 Len=0 TSval=2350618630 TSecr=2816159656"
67,18.435112,192.168.11.19,192.168.11.17,TCP,66,0.005989,,0.005989,"Jan  8, 2024 10:29:31.914965000 JST",,55038  >  6000 [ACK] Seq=29 Ack=2 Win=64256 Len=0 TSval=2816159663 TSecr=2350618630
68,25.473015,192.168.11.17,192.168.11.16,TCP,74,,,7.037903,"Jan  8, 2024 10:29:38.952868000 JST",,41600  >  6000 [SYN] Seq=0 Win=64240 Len=0 MSS=1460 SACK_PERM TSval=194183553 TSecr=0 WS=128
69,25.480438,192.168.11.16,192.168.11.17,TCP,74,0.007423,,0.007423,"Jan  8, 2024 10:29:38.960291000 JST",,"6000  >  41600 [SYN, ACK] Seq=0 Ack=1 Win=65160 Len=0 MSS=1460 SACK_PERM TSval=1090161280 TSecr=194183553 WS=128"
70,25.480543,192.168.11.17,192.168.11.16,TCP,66,0.000105,,0.000105,"Jan  8, 2024 10:29:38.960396000 JST",,41600  >  6000 [ACK] Seq=1 Ack=1 Win=64256 Len=0 TSval=194183560 TSecr=1090161280
71,25.480718,192.168.11.17,192.168.11.16,TCP,93,,,0.000175,"Jan  8, 2024 10:29:38.960571000 JST",,"41600  >  6000 [PSH, ACK] Seq=1 Ack=1 Win=64256 Len=27 TSval=194183561 TSecr=1090161280 [TCP segment of a reassembled PDU]"
72,25.480822,192.168.11.17,192.168.11.16,TCP,66,,,0.000104,"Jan  8, 2024 10:29:38.960675000 JST",,"41600  >  6000 [FIN, ACK] Seq=28 Ack=1 Win=64256 Len=0 TSval=194183561 TSecr=1090161280"
73,25.48824,192.168.11.16,192.168.11.17,TCP,66,0.007522,,0.007418,"Jan  8, 2024 10:29:38.968093000 JST",,6000  >  41600 [ACK] Seq=1 Ack=28 Win=65152 Len=0 TSval=1090161288 TSecr=194183561
74,25.488601,192.168.11.16,192.168.11.17,TCP,66,0.007779,,0.000361,"Jan  8, 2024 10:29:38.968454000 JST",,"6000  >  41600 [FIN, ACK] Seq=1 Ack=29 Win=65152 Len=0 TSval=1090161289 TSecr=194183561"
75,25.488646,192.168.11.17,192.168.11.16,TCP,66,0.000045,,0.000045,"Jan  8, 2024 10:29:38.968499000 JST",,41600  >  6000 [ACK] Seq=29 Ack=2 Win=64256 Len=0 TSval=194183569 TSecr=1090161289
76,25.518781,192.168.11.17,255.255.255.255,UDP,209,,Ÿ,0.030135,"Jan  8, 2024 10:29:38.998634000 JST",7b2273656d616e74696373223a207b22656e74697479223a2022504944222c202262617365656e74697479223a2022616e79222c2022726f6c65223a2022727272222c20227370617469616c223a2022616e79222c202274656d706f72616c223a2022616e79227d2c20226461746170726f7065727479223a207b22666f726d6174223a2022696e616f6b615f70726f6772616d5f73616d706c655f73656d616e746963227d7d,59020  >  7000 Len=167
77,25.531009,192.168.11.19,192.168.11.17,TCP,74,,œ,0.012228,"Jan  8, 2024 10:29:39.010862000 JST",,38210  >  6000 [SYN] Seq=0 Win=64240 Len=0 MSS=1460 SACK_PERM TSval=2816166758 TSecr=0 WS=128
78,25.531163,192.168.11.17,192.168.11.19,TCP,74,0.000154,,0.000154,"Jan  8, 2024 10:29:39.011016000 JST",,"6000  >  38210 [SYN, ACK] Seq=0 Ack=1 Win=65160 Len=0 MSS=1460 SACK_PERM TSval=2350625732 TSecr=2816166758 WS=128"
79,25.540532,192.168.11.19,192.168.11.17,TCP,66,0.009369,,0.009369,"Jan  8, 2024 10:29:39.020385000 JST",,38210  >  6000 [ACK] Seq=1 Ack=1 Win=64256 Len=0 TSval=2816166769 TSecr=2350625732
80,25.541097,192.168.11.19,192.168.11.17,TCP,93,,,0.000565,"Jan  8, 2024 10:29:39.020950000 JST",,"38210  >  6000 [PSH, ACK] Seq=1 Ack=1 Win=64256 Len=27 TSval=2816166769 TSecr=2350625732 [TCP segment of a reassembled PDU]"
81,25.541185,192.168.11.17,192.168.11.19,TCP,66,0.000088,,0.000088,"Jan  8, 2024 10:29:39.021038000 JST",,6000  >  38210 [ACK] Seq=1 Ack=28 Win=65152 Len=0 TSval=2350625742 TSecr=2816166769
82,25.54126,192.168.11.19,192.168.11.17,TCP,66,,,0.000075,"Jan  8, 2024 10:29:39.021113000 JST",,"38210  >  6000 [FIN, ACK] Seq=28 Ack=1 Win=64256 Len=0 TSval=2816166769 TSecr=2350625732"
83,25.542869,192.168.11.17,192.168.11.19,TCP,66,0.001609,,0.001609,"Jan  8, 2024 10:29:39.022722000 JST",,"6000  >  38210 [FIN, ACK] Seq=1 Ack=29 Win=65152 Len=0 TSval=2350625744 TSecr=2816166769"
84,25.547869,192.168.11.19,192.168.11.17,TCP,66,0.005,,0.005,"Jan  8, 2024 10:29:39.027722000 JST",,38210  >  6000 [ACK] Seq=29 Ack=2 Win=64256 Len=0 TSval=2816166777 TSecr=2350625744
85,31.576616,192.168.11.17,192.168.11.16,TCP,74,,,6.028747,"Jan  8, 2024 10:29:45.056469000 JST",,41508  >  6000 [SYN] Seq=0 Win=64240 Len=0 MSS=1460 SACK_PERM TSval=194189656 TSecr=0 WS=128
86,31.585071,192.168.11.16,192.168.11.17,TCP,74,0.008455,,0.008455,"Jan  8, 2024 10:29:45.064924000 JST",,"6000  >  41508 [SYN, ACK] Seq=0 Ack=1 Win=65160 Len=0 MSS=1460 SACK_PERM TSval=1090167385 TSecr=194189656 WS=128"
87,31.585186,192.168.11.17,192.168.11.16,TCP,66,0.000115,,0.000115,"Jan  8, 2024 10:29:45.065039000 JST",,41508  >  6000 [ACK] Seq=1 Ack=1 Win=64256 Len=0 TSval=194189665 TSecr=1090167385
88,31.58533,192.168.11.17,192.168.11.16,TCP,93,,,0.000144,"Jan  8, 2024 10:29:45.065183000 JST",,"41508  >  6000 [PSH, ACK] Seq=1 Ack=1 Win=64256 Len=27 TSval=194189665 TSecr=1090167385 [TCP segment of a reassembled PDU]"
89,31.585424,192.168.11.17,192.168.11.16,TCP,66,,,0.000094,"Jan  8, 2024 10:29:45.065277000 JST",,"41508  >  6000 [FIN, ACK] Seq=28 Ack=1 Win=64256 Len=0 TSval=194189665 TSecr=1090167385"
90,31.592727,192.168.11.16,192.168.11.17,TCP,66,0.007397,,0.007303,"Jan  8, 2024 10:29:45.072580000 JST",,6000  >  41508 [ACK] Seq=1 Ack=28 Win=65152 Len=0 TSval=1090167392 TSecr=194189665
91,31.593098,192.168.11.16,192.168.11.17,TCP,66,0.007674,,0.000371,"Jan  8, 2024 10:29:45.072951000 JST",,"6000  >  41508 [FIN, ACK] Seq=1 Ack=29 Win=65152 Len=0 TSval=1090167394 TSecr=194189665"
92,31.593141,192.168.11.17,192.168.11.16,TCP,66,0.000043,,0.000043,"Jan  8, 2024 10:29:45.072994000 JST",,41508  >  6000 [ACK] Seq=29 Ack=2 Win=64256 Len=0 TSval=194189673 TSecr=1090167394
93,31.622057,192.168.11.17,255.255.255.255,UDP,209,,Ÿ,0.028916,"Jan  8, 2024 10:29:45.101910000 JST",7b2273656d616e74696373223a207b22656e74697479223a2022504944222c202262617365656e74697479223a2022616e79222c2022726f6c65223a2022727272222c20227370617469616c223a2022616e79222c202274656d706f72616c223a2022616e79227d2c20226461746170726f7065727479223a207b22666f726d6174223a2022696e616f6b615f70726f6772616d5f73616d706c655f73656d616e746963227d7d,60998  >  7000 Len=167
94,31.629553,192.168.11.19,192.168.11.17,TCP,74,,œ,0.007496,"Jan  8, 2024 10:29:45.109406000 JST",,38216  >  6000 [SYN] Seq=0 Win=64240 Len=0 MSS=1460 SACK_PERM TSval=2816172858 TSecr=0 WS=128
95,31.629701,192.168.11.17,192.168.11.19,TCP,74,0.000148,,0.000148,"Jan  8, 2024 10:29:45.109554000 JST",,"6000  >  38216 [SYN, ACK] Seq=0 Ack=1 Win=65160 Len=0 MSS=1460 SACK_PERM TSval=2350631831 TSecr=2816172858 WS=128"
96,31.636442,192.168.11.19,192.168.11.17,TCP,66,0.006741,,0.006741,"Jan  8, 2024 10:29:45.116295000 JST",,38216  >  6000 [ACK] Seq=1 Ack=1 Win=64256 Len=0 TSval=2816172865 TSecr=2350631831
97,31.636974,192.168.11.19,192.168.11.17,TCP,93,,,0.000532,"Jan  8, 2024 10:29:45.116827000 JST",,"38216  >  6000 [PSH, ACK] Seq=1 Ack=1 Win=64256 Len=27 TSval=2816172865 TSecr=2350631831 [TCP segment of a reassembled PDU]"
98,31.637051,192.168.11.17,192.168.11.19,TCP,66,0.000077,,0.000077,"Jan  8, 2024 10:29:45.116904000 JST",,6000  >  38216 [ACK] Seq=1 Ack=28 Win=65152 Len=0 TSval=2350631838 TSecr=2816172865
99,31.637118,192.168.11.19,192.168.11.17,TCP,66,,,0.000067,"Jan  8, 2024 10:29:45.116971000 JST",,"38216  >  6000 [FIN, ACK] Seq=28 Ack=1 Win=64256 Len=0 TSval=2816172865 TSecr=2350631831"
100,31.638336,192.168.11.17,192.168.11.19,TCP,66,0.001218,,0.001218,"Jan  8, 2024 10:29:45.118189000 JST",,"6000  >  38216 [FIN, ACK] Seq=1 Ack=29 Win=65152 Len=0 TSval=2350631839 TSecr=2816172865"
101,31.644295,192.168.11.19,192.168.11.17,TCP,66,0.005959,,0.005959,"Jan  8, 2024 10:29:45.124148000 JST",,38216  >  6000 [ACK] Seq=29 Ack=2 Win=64256 Len=0 TSval=2816172872 TSecr=2350631839
102,37.687509,192.168.11.17,192.168.11.16,TCP,74,,,6.043214,"Jan  8, 2024 10:29:51.167362000 JST",,48802  >  6000 [SYN] Seq=0 Win=64240 Len=0 MSS=1460 SACK_PERM TSval=194195767 TSecr=0 WS=128
103,37.694681,192.168.11.16,192.168.11.17,TCP,74,0.007172,,0.007172,"Jan  8, 2024 10:29:51.174534000 JST",,"6000  >  48802 [SYN, ACK] Seq=0 Ack=1 Win=65160 Len=0 MSS=1460 SACK_PERM TSval=1090173494 TSecr=194195767 WS=128"
104,37.694795,192.168.11.17,192.168.11.16,TCP,66,0.000114,,0.000114,"Jan  8, 2024 10:29:51.174648000 JST",,48802  >  6000 [ACK] Seq=1 Ack=1 Win=64256 Len=0 TSval=194195775 TSecr=1090173494
105,37.69497,192.168.11.17,192.168.11.16,TCP,93,,,0.000175,"Jan  8, 2024 10:29:51.174823000 JST",,"48802  >  6000 [PSH, ACK] Seq=1 Ack=1 Win=64256 Len=27 TSval=194195775 TSecr=1090173494 [TCP segment of a reassembled PDU]"
106,37.695066,192.168.11.17,192.168.11.16,TCP,66,,,0.000096,"Jan  8, 2024 10:29:51.174919000 JST",,"48802  >  6000 [FIN, ACK] Seq=28 Ack=1 Win=64256 Len=0 TSval=194195775 TSecr=1090173494"
107,37.711262,192.168.11.16,192.168.11.17,TCP,66,0.016292,,0.016196,"Jan  8, 2024 10:29:51.191115000 JST",,6000  >  48802 [ACK] Seq=1 Ack=28 Win=65152 Len=0 TSval=1090173511 TSecr=194195775
108,37.711689,192.168.11.16,192.168.11.17,TCP,66,0.016623,,0.000427,"Jan  8, 2024 10:29:51.191542000 JST",,"6000  >  48802 [FIN, ACK] Seq=1 Ack=29 Win=65152 Len=0 TSval=1090173512 TSecr=194195775"
109,37.71174,192.168.11.17,192.168.11.16,TCP,66,0.000051,,0.000051,"Jan  8, 2024 10:29:51.191593000 JST",,48802  >  6000 [ACK] Seq=29 Ack=2 Win=64256 Len=0 TSval=194195792 TSecr=1090173512
110,37.744222,192.168.11.17,255.255.255.255,UDP,209,,Ÿ,0.032482,"Jan  8, 2024 10:29:51.224075000 JST",7b2273656d616e74696373223a207b22656e74697479223a2022504944222c202262617365656e74697479223a2022616e79222c2022726f6c65223a2022727272222c20227370617469616c223a2022616e79222c202274656d706f72616c223a2022616e79227d2c20226461746170726f7065727479223a207b22666f726d6174223a2022696e616f6b615f70726f6772616d5f73616d706c655f73656d616e746963227d7d,37111  >  7000 Len=167
111,37.75384,192.168.11.19,192.168.11.17,TCP,74,,œ,0.009618,"Jan  8, 2024 10:29:51.233693000 JST",,57150  >  6000 [SYN] Seq=0 Win=64240 Len=0 MSS=1460 SACK_PERM TSval=2816178982 TSecr=0 WS=128
112,37.753995,192.168.11.17,192.168.11.19,TCP,74,0.000155,,0.000155,"Jan  8, 2024 10:29:51.233848000 JST",,"6000  >  57150 [SYN, ACK] Seq=0 Ack=1 Win=65160 Len=0 MSS=1460 SACK_PERM TSval=2350637955 TSecr=2816178982 WS=128"
113,37.761187,192.168.11.19,192.168.11.17,TCP,66,0.007192,,0.007192,"Jan  8, 2024 10:29:51.241040000 JST",,57150  >  6000 [ACK] Seq=1 Ack=1 Win=64256 Len=0 TSval=2816178989 TSecr=2350637955
114,37.76177,192.168.11.19,192.168.11.17,TCP,93,,,0.000583,"Jan  8, 2024 10:29:51.241623000 JST",,"57150  >  6000 [PSH, ACK] Seq=1 Ack=1 Win=64256 Len=27 TSval=2816178990 TSecr=2350637955 [TCP segment of a reassembled PDU]"
115,37.761856,192.168.11.17,192.168.11.19,TCP,66,0.000086,,0.000086,"Jan  8, 2024 10:29:51.241709000 JST",,6000  >  57150 [ACK] Seq=1 Ack=28 Win=65152 Len=0 TSval=2350637963 TSecr=2816178990
116,37.761928,192.168.11.19,192.168.11.17,TCP,66,,,0.000072,"Jan  8, 2024 10:29:51.241781000 JST",,"57150  >  6000 [FIN, ACK] Seq=28 Ack=1 Win=64256 Len=0 TSval=2816178990 TSecr=2350637955"
117,37.763155,192.168.11.17,192.168.11.19,TCP,66,0.001227,,0.001227,"Jan  8, 2024 10:29:51.243008000 JST",,"6000  >  57150 [FIN, ACK] Seq=1 Ack=29 Win=65152 Len=0 TSval=2350637964 TSecr=2816178990"
118,37.769279,192.168.11.19,192.168.11.17,TCP,66,0.006124,,0.006124,"Jan  8, 2024 10:29:51.249132000 JST",,57150  >  6000 [ACK] Seq=29 Ack=2 Win=64256 Len=0 TSval=2816178997 TSecr=2350637964
119,43.812708,192.168.11.17,192.168.11.16,TCP,74,,,6.043429,"Jan  8, 2024 10:29:57.292561000 JST",,48806  >  6000 [SYN] Seq=0 Win=64240 Len=0 MSS=1460 SACK_PERM TSval=194201893 TSecr=0 WS=128
120,43.8198,192.168.11.16,192.168.11.17,TCP,74,0.007092,,0.007092,"Jan  8, 2024 10:29:57.299653000 JST",,"6000  >  48806 [SYN, ACK] Seq=0 Ack=1 Win=65160 Len=0 MSS=1460 SACK_PERM TSval=1090179620 TSecr=194201893 WS=128"
121,43.81991,192.168.11.17,192.168.11.16,TCP,66,0.00011,,0.00011,"Jan  8, 2024 10:29:57.299763000 JST",,48806  >  6000 [ACK] Seq=1 Ack=1 Win=64256 Len=0 TSval=194201900 TSecr=1090179620
122,43.82005,192.168.11.17,192.168.11.16,TCP,93,,,0.00014,"Jan  8, 2024 10:29:57.299903000 JST",,"48806  >  6000 [PSH, ACK] Seq=1 Ack=1 Win=64256 Len=27 TSval=194201900 TSecr=1090179620 [TCP segment of a reassembled PDU]"
123,43.820152,192.168.11.17,192.168.11.16,TCP,66,,,0.000102,"Jan  8, 2024 10:29:57.300005000 JST",,"48806  >  6000 [FIN, ACK] Seq=28 Ack=1 Win=64256 Len=0 TSval=194201900 TSecr=1090179620"
124,43.828313,192.168.11.16,192.168.11.17,TCP,66,0.008263,,0.008161,"Jan  8, 2024 10:29:57.308166000 JST",,6000  >  48806 [ACK] Seq=1 Ack=28 Win=65152 Len=0 TSval=1090179628 TSecr=194201900
125,43.828668,192.168.11.16,192.168.11.17,TCP,66,0.008516,,0.000355,"Jan  8, 2024 10:29:57.308521000 JST",,"6000  >  48806 [FIN, ACK] Seq=1 Ack=29 Win=65152 Len=0 TSval=1090179630 TSecr=194201900"
126,43.828717,192.168.11.17,192.168.11.16,TCP,66,0.000049,,0.000049,"Jan  8, 2024 10:29:57.308570000 JST",,48806  >  6000 [ACK] Seq=29 Ack=2 Win=64256 Len=0 TSval=194201909 TSecr=1090179630
127,43.859281,192.168.11.17,255.255.255.255,UDP,209,,Ÿ,0.030564,"Jan  8, 2024 10:29:57.339134000 JST",7b2273656d616e74696373223a207b22656e74697479223a2022504944222c202262617365656e74697479223a2022616e79222c2022726f6c65223a2022727272222c20227370617469616c223a2022616e79222c202274656d706f72616c223a2022616e79227d2c20226461746170726f7065727479223a207b22666f726d6174223a2022696e616f6b615f70726f6772616d5f73616d706c655f73656d616e746963227d7d,53325  >  7000 Len=167
128,43.867578,192.168.11.19,192.168.11.17,TCP,74,,œ,0.008297,"Jan  8, 2024 10:29:57.347431000 JST",,47340  >  6000 [SYN] Seq=0 Win=64240 Len=0 MSS=1460 SACK_PERM TSval=2816185095 TSecr=0 WS=128
129,43.867766,192.168.11.17,192.168.11.19,TCP,74,0.000188,,0.000188,"Jan  8, 2024 10:29:57.347619000 JST",,"6000  >  47340 [SYN, ACK] Seq=0 Ack=1 Win=65160 Len=0 MSS=1460 SACK_PERM TSval=2350644069 TSecr=2816185095 WS=128"
130,43.87452,192.168.11.19,192.168.11.17,TCP,66,0.006754,,0.006754,"Jan  8, 2024 10:29:57.354373000 JST",,47340  >  6000 [ACK] Seq=1 Ack=1 Win=64256 Len=0 TSval=2816185103 TSecr=2350644069
131,43.875054,192.168.11.19,192.168.11.17,TCP,93,,,0.000534,"Jan  8, 2024 10:29:57.354907000 JST",,"47340  >  6000 [PSH, ACK] Seq=1 Ack=1 Win=64256 Len=27 TSval=2816185103 TSecr=2350644069 [TCP segment of a reassembled PDU]"
132,43.875128,192.168.11.17,192.168.11.19,TCP,66,0.000074,,0.000074,"Jan  8, 2024 10:29:57.354981000 JST",,6000  >  47340 [ACK] Seq=1 Ack=28 Win=65152 Len=0 TSval=2350644076 TSecr=2816185103
133,43.875195,192.168.11.19,192.168.11.17,TCP,66,,,0.000067,"Jan  8, 2024 10:29:57.355048000 JST",,"47340  >  6000 [FIN, ACK] Seq=28 Ack=1 Win=64256 Len=0 TSval=2816185103 TSecr=2350644069"
134,43.876555,192.168.11.17,192.168.11.19,TCP,66,0.00136,,0.00136,"Jan  8, 2024 10:29:57.356408000 JST",,"6000  >  47340 [FIN, ACK] Seq=1 Ack=29 Win=65152 Len=0 TSval=2350644077 TSecr=2816185103"
135,43.882838,192.168.11.19,192.168.11.17,TCP,66,0.006283,,0.006283,"Jan  8, 2024 10:29:57.362691000 JST",,47340  >  6000 [ACK] Seq=29 Ack=2 Win=64256 Len=0 TSval=2816185111 TSecr=2350644077
136,49.912388,192.168.11.17,192.168.11.16,TCP,74,,,6.02955,"Jan  8, 2024 10:30:03.392241000 JST",,36620  >  6000 [SYN] Seq=0 Win=64240 Len=0 MSS=1460 SACK_PERM TSval=194207992 TSecr=0 WS=128
137,49.919308,192.168.11.16,192.168.11.17,TCP,74,0.00692,,0.00692,"Jan  8, 2024 10:30:03.399161000 JST",,"6000  >  36620 [SYN, ACK] Seq=0 Ack=1 Win=65160 Len=0 MSS=1460 SACK_PERM TSval=1090185719 TSecr=194207992 WS=128"
138,49.919426,192.168.11.17,192.168.11.16,TCP,66,0.000118,,0.000118,"Jan  8, 2024 10:30:03.399279000 JST",,36620  >  6000 [ACK] Seq=1 Ack=1 Win=64256 Len=0 TSval=194207999 TSecr=1090185719
139,49.919562,192.168.11.17,192.168.11.16,TCP,93,,,0.000136,"Jan  8, 2024 10:30:03.399415000 JST",,"36620  >  6000 [PSH, ACK] Seq=1 Ack=1 Win=64256 Len=27 TSval=194207999 TSecr=1090185719 [TCP segment of a reassembled PDU]"
140,49.919719,192.168.11.17,192.168.11.16,TCP,66,,,0.000157,"Jan  8, 2024 10:30:03.399572000 JST",,"36620  >  6000 [FIN, ACK] Seq=28 Ack=1 Win=64256 Len=0 TSval=194208000 TSecr=1090185719"
141,49.926701,192.168.11.16,192.168.11.17,TCP,66,0.007139,,0.006982,"Jan  8, 2024 10:30:03.406554000 JST",,6000  >  36620 [ACK] Seq=1 Ack=28 Win=65152 Len=0 TSval=1090185726 TSecr=194207999
142,49.927067,192.168.11.16,192.168.11.17,TCP,66,0.007348,,0.000366,"Jan  8, 2024 10:30:03.406920000 JST",,"6000  >  36620 [FIN, ACK] Seq=1 Ack=29 Win=65152 Len=0 TSval=1090185728 TSecr=194208000"
143,49.927114,192.168.11.17,192.168.11.16,TCP,66,0.000047,,0.000047,"Jan  8, 2024 10:30:03.406967000 JST",,36620  >  6000 [ACK] Seq=29 Ack=2 Win=64256 Len=0 TSval=194208007 TSecr=1090185728
144,49.955732,192.168.11.17,255.255.255.255,UDP,209,,Ÿ,0.028618,"Jan  8, 2024 10:30:03.435585000 JST",7b2273656d616e74696373223a207b22656e74697479223a2022504944222c202262617365656e74697479223a2022616e79222c2022726f6c65223a2022727272222c20227370617469616c223a2022616e79222c202274656d706f72616c223a2022616e79227d2c20226461746170726f7065727479223a207b22666f726d6174223a2022696e616f6b615f70726f6772616d5f73616d706c655f73656d616e746963227d7d,49372  >  7000 Len=167
145,49.963431,192.168.11.19,192.168.11.17,TCP,74,,œ,0.007699,"Jan  8, 2024 10:30:03.443284000 JST",,47346  >  6000 [SYN] Seq=0 Win=64240 Len=0 MSS=1460 SACK_PERM TSval=2816191192 TSecr=0 WS=128
146,49.963587,192.168.11.17,192.168.11.19,TCP,74,0.000156,,0.000156,"Jan  8, 2024 10:30:03.443440000 JST",,"6000  >  47346 [SYN, ACK] Seq=0 Ack=1 Win=65160 Len=0 MSS=1460 SACK_PERM TSval=2350650164 TSecr=2816191192 WS=128"
147,49.970261,192.168.11.19,192.168.11.17,TCP,66,0.006674,,0.006674,"Jan  8, 2024 10:30:03.450114000 JST",,47346  >  6000 [ACK] Seq=1 Ack=1 Win=64256 Len=0 TSval=2816191199 TSecr=2350650164
148,49.97085,192.168.11.19,192.168.11.17,TCP,93,,,0.000589,"Jan  8, 2024 10:30:03.450703000 JST",,"47346  >  6000 [PSH, ACK] Seq=1 Ack=1 Win=64256 Len=27 TSval=2816191199 TSecr=2350650164 [TCP segment of a reassembled PDU]"
149,49.970904,192.168.11.19,192.168.11.17,TCP,66,,,0.000054,"Jan  8, 2024 10:30:03.450757000 JST",,"47346  >  6000 [FIN, ACK] Seq=28 Ack=1 Win=64256 Len=0 TSval=2816191199 TSecr=2350650164"
150,49.970939,192.168.11.17,192.168.11.19,TCP,66,0.000089,,0.000035,"Jan  8, 2024 10:30:03.450792000 JST",,6000  >  47346 [ACK] Seq=1 Ack=28 Win=65152 Len=0 TSval=2350650172 TSecr=2816191199
151,49.972376,192.168.11.17,192.168.11.19,TCP,66,0.001472,,0.001437,"Jan  8, 2024 10:30:03.452229000 JST",,"6000  >  47346 [FIN, ACK] Seq=1 Ack=29 Win=65152 Len=0 TSval=2350650173 TSecr=2816191199"
152,49.977619,192.168.11.19,192.168.11.17,TCP,66,0.005243,,0.005243,"Jan  8, 2024 10:30:03.457472000 JST",,47346  >  6000 [ACK] Seq=29 Ack=2 Win=64256 Len=0 TSval=2816191206 TSecr=2350650173
153,56.013625,192.168.11.17,192.168.11.16,TCP,74,,,6.036006,"Jan  8, 2024 10:30:09.493478000 JST",,36630  >  6000 [SYN] Seq=0 Win=64240 Len=0 MSS=1460 SACK_PERM TSval=194214093 TSecr=0 WS=128
154,56.020405,192.168.11.16,192.168.11.17,TCP,74,0.00678,,0.00678,"Jan  8, 2024 10:30:09.500258000 JST",,"6000  >  36630 [SYN, ACK] Seq=0 Ack=1 Win=65160 Len=0 MSS=1460 SACK_PERM TSval=1090191820 TSecr=194214093 WS=128"
155,56.020516,192.168.11.17,192.168.11.16,TCP,66,0.000111,,0.000111,"Jan  8, 2024 10:30:09.500369000 JST",,36630  >  6000 [ACK] Seq=1 Ack=1 Win=64256 Len=0 TSval=194214100 TSecr=1090191820
156,56.020684,192.168.11.17,192.168.11.16,TCP,93,,,0.000168,"Jan  8, 2024 10:30:09.500537000 JST",,"36630  >  6000 [PSH, ACK] Seq=1 Ack=1 Win=64256 Len=27 TSval=194214101 TSecr=1090191820 [TCP segment of a reassembled PDU]"
157,56.020778,192.168.11.17,192.168.11.16,TCP,66,,,0.000094,"Jan  8, 2024 10:30:09.500631000 JST",,"36630  >  6000 [FIN, ACK] Seq=28 Ack=1 Win=64256 Len=0 TSval=194214101 TSecr=1090191820"
158,56.028086,192.168.11.16,192.168.11.17,TCP,66,0.007402,,0.007308,"Jan  8, 2024 10:30:09.507939000 JST",,6000  >  36630 [ACK] Seq=1 Ack=28 Win=65152 Len=0 TSval=1090191828 TSecr=194214101
159,56.028323,192.168.11.16,192.168.11.17,TCP,66,0.007545,,0.000237,"Jan  8, 2024 10:30:09.508176000 JST",,"6000  >  36630 [FIN, ACK] Seq=1 Ack=29 Win=65152 Len=0 TSval=1090191829 TSecr=194214101"
160,56.028367,192.168.11.17,192.168.11.16,TCP,66,0.000044,,0.000044,"Jan  8, 2024 10:30:09.508220000 JST",,36630  >  6000 [ACK] Seq=29 Ack=2 Win=64256 Len=0 TSval=194214108 TSecr=1090191829
161,56.058918,192.168.11.17,255.255.255.255,UDP,209,,Ÿ,0.030551,"Jan  8, 2024 10:30:09.538771000 JST",7b2273656d616e74696373223a207b22656e74697479223a2022504944222c202262617365656e74697479223a2022616e79222c2022726f6c65223a2022727272222c20227370617469616c223a2022616e79222c202274656d706f72616c223a2022616e79227d2c20226461746170726f7065727479223a207b22666f726d6174223a2022696e616f6b615f70726f6772616d5f73616d706c655f73656d616e746963227d7d,37974  >  7000 Len=167
162,56.066329,192.168.11.19,192.168.11.17,TCP,74,,œ,0.007411,"Jan  8, 2024 10:30:09.546182000 JST",,55872  >  6000 [SYN] Seq=0 Win=64240 Len=0 MSS=1460 SACK_PERM TSval=2816197295 TSecr=0 WS=128
163,56.06648,192.168.11.17,192.168.11.19,TCP,74,0.000151,,0.000151,"Jan  8, 2024 10:30:09.546333000 JST",,"6000  >  55872 [SYN, ACK] Seq=0 Ack=1 Win=65160 Len=0 MSS=1460 SACK_PERM TSval=2350656267 TSecr=2816197295 WS=128"
164,56.073059,192.168.11.19,192.168.11.17,TCP,66,0.006579,,0.006579,"Jan  8, 2024 10:30:09.552912000 JST",,55872  >  6000 [ACK] Seq=1 Ack=1 Win=64256 Len=0 TSval=2816197301 TSecr=2350656267
165,56.073654,192.168.11.19,192.168.11.17,TCP,93,,,0.000595,"Jan  8, 2024 10:30:09.553507000 JST",,"55872  >  6000 [PSH, ACK] Seq=1 Ack=1 Win=64256 Len=27 TSval=2816197302 TSecr=2350656267 [TCP segment of a reassembled PDU]"
166,56.073746,192.168.11.17,192.168.11.19,TCP,66,0.000092,,0.000092,"Jan  8, 2024 10:30:09.553599000 JST",,6000  >  55872 [ACK] Seq=1 Ack=28 Win=65152 Len=0 TSval=2350656275 TSecr=2816197302
167,56.073822,192.168.11.19,192.168.11.17,TCP,66,,,0.000076,"Jan  8, 2024 10:30:09.553675000 JST",,"55872  >  6000 [FIN, ACK] Seq=28 Ack=1 Win=64256 Len=0 TSval=2816197302 TSecr=2350656267"
168,56.074868,192.168.11.17,192.168.11.19,TCP,66,0.001046,,0.001046,"Jan  8, 2024 10:30:09.554721000 JST",,"6000  >  55872 [FIN, ACK] Seq=1 Ack=29 Win=65152 Len=0 TSval=2350656276 TSecr=2816197302"
169,56.083815,192.168.11.19,192.168.11.17,TCP,66,0.008947,,0.008947,"Jan  8, 2024 10:30:09.563668000 JST",,55872  >  6000 [ACK] Seq=29 Ack=2 Win=64256 Len=0 TSval=2816197311 TSecr=2350656276
170,87.192991,192.168.11.17,192.168.11.16,TCP,74,,,31.109176,"Jan  8, 2024 10:30:40.672844000 JST",,44992  >  6000 [SYN] Seq=0 Win=64240 Len=0 MSS=1460 SACK_PERM TSval=194245273 TSecr=0 WS=128
171,87.20016,192.168.11.16,192.168.11.17,TCP,74,0.007169,,0.007169,"Jan  8, 2024 10:30:40.680013000 JST",,"6000  >  44992 [SYN, ACK] Seq=0 Ack=1 Win=65160 Len=0 MSS=1460 SACK_PERM TSval=1090223000 TSecr=194245273 WS=128"
172,87.200287,192.168.11.17,192.168.11.16,TCP,66,0.000127,,0.000127,"Jan  8, 2024 10:30:40.680140000 JST",,44992  >  6000 [ACK] Seq=1 Ack=1 Win=64256 Len=0 TSval=194245280 TSecr=1090223000
173,87.200432,192.168.11.17,192.168.11.16,TCP,93,,,0.000145,"Jan  8, 2024 10:30:40.680285000 JST",,"44992  >  6000 [PSH, ACK] Seq=1 Ack=1 Win=64256 Len=27 TSval=194245280 TSecr=1090223000 [TCP segment of a reassembled PDU]"
174,87.200538,192.168.11.17,192.168.11.16,TCP,66,,,0.000106,"Jan  8, 2024 10:30:40.680391000 JST",,"44992  >  6000 [FIN, ACK] Seq=28 Ack=1 Win=64256 Len=0 TSval=194245280 TSecr=1090223000"
175,87.208312,192.168.11.16,192.168.11.17,TCP,66,0.00788,,0.007774,"Jan  8, 2024 10:30:40.688165000 JST",,6000  >  44992 [ACK] Seq=1 Ack=28 Win=65152 Len=0 TSval=1090223008 TSecr=194245280
176,87.208682,192.168.11.16,192.168.11.17,TCP,66,0.008144,,0.00037,"Jan  8, 2024 10:30:40.688535000 JST",,"6000  >  44992 [FIN, ACK] Seq=1 Ack=29 Win=65152 Len=0 TSval=1090223010 TSecr=194245280"
177,87.20875,192.168.11.17,192.168.11.16,TCP,66,0.000068,,0.000068,"Jan  8, 2024 10:30:40.688603000 JST",,44992  >  6000 [ACK] Seq=29 Ack=2 Win=64256 Len=0 TSval=194245289 TSecr=1090223010
178,87.236745,192.168.11.17,255.255.255.255,UDP,209,,Ÿ,0.027995,"Jan  8, 2024 10:30:40.716598000 JST",7b2273656d616e74696373223a207b22656e74697479223a2022504944222c202262617365656e74697479223a2022616e79222c2022726f6c65223a2022727272222c20227370617469616c223a2022616e79222c202274656d706f72616c223a2022616e79227d2c20226461746170726f7065727479223a207b22666f726d6174223a2022696e616f6b615f70726f6772616d5f73616d706c655f73656d616e746963227d7d,36648  >  7000 Len=167
179,87.245628,192.168.11.19,192.168.11.17,TCP,74,,œ,0.008883,"Jan  8, 2024 10:30:40.725481000 JST",,43724  >  6000 [SYN] Seq=0 Win=64240 Len=0 MSS=1460 SACK_PERM TSval=2816228474 TSecr=0 WS=128
180,87.245802,192.168.11.17,192.168.11.19,TCP,74,0.000174,,0.000174,"Jan  8, 2024 10:30:40.725655000 JST",,"6000  >  43724 [SYN, ACK] Seq=0 Ack=1 Win=65160 Len=0 MSS=1460 SACK_PERM TSval=2350687447 TSecr=2816228474 WS=128"
181,87.252876,192.168.11.19,192.168.11.17,TCP,66,0.007074,,0.007074,"Jan  8, 2024 10:30:40.732729000 JST",,43724  >  6000 [ACK] Seq=1 Ack=1 Win=64256 Len=0 TSval=2816228481 TSecr=2350687447
182,87.253479,192.168.11.19,192.168.11.17,TCP,93,,,0.000603,"Jan  8, 2024 10:30:40.733332000 JST",,"43724  >  6000 [PSH, ACK] Seq=1 Ack=1 Win=64256 Len=27 TSval=2816228481 TSecr=2350687447 [TCP segment of a reassembled PDU]"
183,87.253575,192.168.11.17,192.168.11.19,TCP,66,0.000096,,0.000096,"Jan  8, 2024 10:30:40.733428000 JST",,6000  >  43724 [ACK] Seq=1 Ack=28 Win=65152 Len=0 TSval=2350687454 TSecr=2816228481
184,87.253653,192.168.11.19,192.168.11.17,TCP,66,,,0.000078,"Jan  8, 2024 10:30:40.733506000 JST",,"43724  >  6000 [FIN, ACK] Seq=28 Ack=1 Win=64256 Len=0 TSval=2816228482 TSecr=2350687447"
185,87.254673,192.168.11.17,192.168.11.19,TCP,66,0.00102,,0.00102,"Jan  8, 2024 10:30:40.734526000 JST",,"6000  >  43724 [FIN, ACK] Seq=1 Ack=29 Win=65152 Len=0 TSval=2350687456 TSecr=2816228482"
