No.,Time,Source,Destination,Protocol,Length,The RTT to ACK the segment was,XXX,Time delta from previous captured frame,Arrival Time,Data,Info
1,0,192.168.11.20,192.168.11.19,TCP,74,,,0,"Jan  8, 2024 10:29:13.596156000 JST",,34428  >  6000 [SYN] Seq=0 Win=64240 Len=0 MSS=1460 SACK_PERM TSval=3824849509 TSecr=0 WS=128
2,0.006741,192.168.11.19,192.168.11.20,TCP,74,0.006741,,0.006741,"Jan  8, 2024 10:29:13.602897000 JST",,"6000  >  34428 [SYN, ACK] Seq=0 Ack=1 Win=65160 Len=0 MSS=1460 SACK_PERM TSval=2476954486 TSecr=3824849509 WS=128"
3,0.006875,192.168.11.20,192.168.11.19,TCP,66,0.000134,,0.000134,"Jan  8, 2024 10:29:13.603031000 JST",,34428  >  6000 [ACK] Seq=1 Ack=1 Win=64256 Len=0 TSval=3824849520 TSecr=2476954486
4,0.007179,192.168.11.20,192.168.11.19,TCP,93,,,0.000304,"Jan  8, 2024 10:29:13.603335000 JST",,"34428  >  6000 [PSH, ACK] Seq=1 Ack=1 Win=64256 Len=27 TSval=3824849520 TSecr=2476954486 [TCP segment of a reassembled PDU]"
5,0.007333,192.168.11.20,192.168.11.19,TCP,66,,,0.000154,"Jan  8, 2024 10:29:13.603489000 JST",,"34428  >  6000 [FIN, ACK] Seq=28 Ack=1 Win=64256 Len=0 TSval=3824849520 TSecr=2476954486"
6,0.016794,192.168.11.19,192.168.11.20,TCP,66,0.009615,,0.009461,"Jan  8, 2024 10:29:13.612950000 JST",,6000  >  34428 [ACK] Seq=1 Ack=28 Win=65152 Len=0 TSval=2476954496 TSecr=3824849520
7,0.01704,192.168.11.19,192.168.11.20,TCP,66,0.009707,,0.000246,"Jan  8, 2024 10:29:13.613196000 JST",,"6000  >  34428 [FIN, ACK] Seq=1 Ack=29 Win=65152 Len=0 TSval=2476954498 TSecr=3824849520"
8,0.017088,192.168.11.20,192.168.11.19,TCP,66,0.000048,,0.000048,"Jan  8, 2024 10:29:13.613244000 JST",,34428  >  6000 [ACK] Seq=29 Ack=2 Win=64256 Len=0 TSval=3824849530 TSecr=2476954498
9,0.051117,192.168.11.20,255.255.255.255,UDP,209,,Ÿ,0.034029,"Jan  8, 2024 10:29:13.647273000 JST",7b2273656d616e74696373223a207b22656e74697479223a2022504944222c202262617365656e74697479223a2022616e79222c2022726f6c65223a2022747474222c20227370617469616c223a2022616e79222c202274656d706f72616c223a2022616e79227d2c20226461746170726f7065727479223a207b22666f726d6174223a2022696e616f6b615f70726f6772616d5f73616d706c655f73656d616e746963227d7d,42094  >  7000 Len=167
10,0.065548,192.168.11.12,192.168.11.20,TCP,74,,œ,0.014431,"Jan  8, 2024 10:29:13.661704000 JST",,33788  >  6000 [SYN] Seq=0 Win=64240 Len=0 MSS=1460 SACK_PERM TSval=915386832 TSecr=0 WS=128
11,0.065699,192.168.11.20,192.168.11.12,TCP,74,0.000151,,0.000151,"Jan  8, 2024 10:29:13.661855000 JST",,"6000  >  33788 [SYN, ACK] Seq=0 Ack=1 Win=65160 Len=0 MSS=1460 SACK_PERM TSval=920879508 TSecr=915386832 WS=128"
12,0.077901,192.168.11.12,192.168.11.20,TCP,66,0.012202,,0.012202,"Jan  8, 2024 10:29:13.674057000 JST",,33788  >  6000 [ACK] Seq=1 Ack=1 Win=64256 Len=0 TSval=915386845 TSecr=920879508
13,0.078845,192.168.11.12,192.168.11.20,TCP,93,,,0.000944,"Jan  8, 2024 10:29:13.675001000 JST",,"33788  >  6000 [PSH, ACK] Seq=1 Ack=1 Win=64256 Len=27 TSval=915386845 TSecr=920879508 [TCP segment of a reassembled PDU]"
14,0.079099,192.168.11.20,192.168.11.12,TCP,66,0.000254,,0.000254,"Jan  8, 2024 10:29:13.675255000 JST",,6000  >  33788 [ACK] Seq=1 Ack=28 Win=65152 Len=0 TSval=920879521 TSecr=915386845
15,0.079312,192.168.11.12,192.168.11.20,TCP,66,,,0.000213,"Jan  8, 2024 10:29:13.675468000 JST",,"33788  >  6000 [FIN, ACK] Seq=28 Ack=1 Win=64256 Len=0 TSval=915386846 TSecr=920879508"
16,0.082948,192.168.11.20,192.168.11.12,TCP,66,0.003636,,0.003636,"Jan  8, 2024 10:29:13.679104000 JST",,"6000  >  33788 [FIN, ACK] Seq=1 Ack=29 Win=65152 Len=0 TSval=920879525 TSecr=915386846"
17,0.089204,192.168.11.12,192.168.11.20,TCP,66,0.006256,,0.006256,"Jan  8, 2024 10:29:13.685360000 JST",,33788  >  6000 [ACK] Seq=29 Ack=2 Win=64256 Len=0 TSval=915386861 TSecr=920879525
18,6.128178,192.168.11.20,192.168.11.19,TCP,74,,,6.038974,"Jan  8, 2024 10:29:19.724334000 JST",,34438  >  6000 [SYN] Seq=0 Win=64240 Len=0 MSS=1460 SACK_PERM TSval=3824855641 TSecr=0 WS=128
19,6.137412,192.168.11.19,192.168.11.20,TCP,74,0.009234,,0.009234,"Jan  8, 2024 10:29:19.733568000 JST",,"6000  >  34438 [SYN, ACK] Seq=0 Ack=1 Win=65160 Len=0 MSS=1460 SACK_PERM TSval=2476960617 TSecr=3824855641 WS=128"
20,6.137517,192.168.11.20,192.168.11.19,TCP,66,0.000105,,0.000105,"Jan  8, 2024 10:29:19.733673000 JST",,34438  >  6000 [ACK] Seq=1 Ack=1 Win=64256 Len=0 TSval=3824855650 TSecr=2476960617
21,6.137724,192.168.11.20,192.168.11.19,TCP,93,,,0.000207,"Jan  8, 2024 10:29:19.733880000 JST",,"34438  >  6000 [PSH, ACK] Seq=1 Ack=1 Win=64256 Len=27 TSval=3824855651 TSecr=2476960617 [TCP segment of a reassembled PDU]"
22,6.137855,192.168.11.20,192.168.11.19,TCP,66,,,0.000131,"Jan  8, 2024 10:29:19.734011000 JST",,"34438  >  6000 [FIN, ACK] Seq=28 Ack=1 Win=64256 Len=0 TSval=3824855651 TSecr=2476960617"
23,6.145357,192.168.11.19,192.168.11.20,TCP,66,0.007633,,0.007502,"Jan  8, 2024 10:29:19.741513000 JST",,6000  >  34438 [ACK] Seq=1 Ack=28 Win=65152 Len=0 TSval=2476960625 TSecr=3824855651
24,6.145734,192.168.11.19,192.168.11.20,TCP,66,0.007879,,0.000377,"Jan  8, 2024 10:29:19.741890000 JST",,"6000  >  34438 [FIN, ACK] Seq=1 Ack=29 Win=65152 Len=0 TSval=2476960626 TSecr=3824855651"
25,6.145779,192.168.11.20,192.168.11.19,TCP,66,0.000045,,0.000045,"Jan  8, 2024 10:29:19.741935000 JST",,34438  >  6000 [ACK] Seq=29 Ack=2 Win=64256 Len=0 TSval=3824855659 TSecr=2476960626
26,6.174078,192.168.11.20,255.255.255.255,UDP,209,,Ÿ,0.028299,"Jan  8, 2024 10:29:19.770234000 JST",7b2273656d616e74696373223a207b22656e74697479223a2022504944222c202262617365656e74697479223a2022616e79222c2022726f6c65223a2022747474222c20227370617469616c223a2022616e79222c202274656d706f72616c223a2022616e79227d2c20226461746170726f7065727479223a207b22666f726d6174223a2022696e616f6b615f70726f6772616d5f73616d706c655f73656d616e746963227d7d,60211  >  7000 Len=167
27,6.181748,192.168.11.12,192.168.11.20,TCP,74,,œ,0.00767,"Jan  8, 2024 10:29:19.777904000 JST",,50238  >  6000 [SYN] Seq=0 Win=64240 Len=0 MSS=1460 SACK_PERM TSval=915392954 TSecr=0 WS=128
28,6.181906,192.168.11.20,192.168.11.12,TCP,74,0.000158,,0.000158,"Jan  8, 2024 10:29:19.778062000 JST",,"6000  >  50238 [SYN, ACK] Seq=0 Ack=1 Win=65160 Len=0 MSS=1460 SACK_PERM TSval=920885624 TSecr=915392954 WS=128"
29,6.201362,192.168.11.12,192.168.11.20,TCP,66,0.019456,,0.019456,"Jan  8, 2024 10:29:19.797518000 JST",,50238  >  6000 [ACK] Seq=1 Ack=1 Win=64256 Len=0 TSval=915392961 TSecr=920885624
30,6.201885,192.168.11.12,192.168.11.20,TCP,93,,,0.000523,"Jan  8, 2024 10:29:19.798041000 JST",,"50238  >  6000 [PSH, ACK] Seq=1 Ack=1 Win=64256 Len=27 TSval=915392961 TSecr=920885624 [TCP segment of a reassembled PDU]"
31,6.201961,192.168.11.20,192.168.11.12,TCP,66,0.000076,,0.000076,"Jan  8, 2024 10:29:19.798117000 JST",,6000  >  50238 [ACK] Seq=1 Ack=28 Win=65152 Len=0 TSval=920885644 TSecr=915392961
32,6.202032,192.168.11.12,192.168.11.20,TCP,66,,,0.000071,"Jan  8, 2024 10:29:19.798188000 JST",,"50238  >  6000 [FIN, ACK] Seq=28 Ack=1 Win=64256 Len=0 TSval=915392961 TSecr=920885624"
33,6.203088,192.168.11.20,192.168.11.12,TCP,66,0.001056,,0.001056,"Jan  8, 2024 10:29:19.799244000 JST",,"6000  >  50238 [FIN, ACK] Seq=1 Ack=29 Win=65152 Len=0 TSval=920885645 TSecr=915392961"
34,6.209662,192.168.11.12,192.168.11.20,TCP,66,0.006574,,0.006574,"Jan  8, 2024 10:29:19.805818000 JST",,50238  >  6000 [ACK] Seq=29 Ack=2 Win=64256 Len=0 TSval=915392981 TSecr=920885645
35,12.251347,192.168.11.20,192.168.11.19,TCP,74,,,6.041685,"Jan  8, 2024 10:29:25.847503000 JST",,33204  >  6000 [SYN] Seq=0 Win=64240 Len=0 MSS=1460 SACK_PERM TSval=3824861764 TSecr=0 WS=128
36,12.25833,192.168.11.19,192.168.11.20,TCP,74,0.006983,,0.006983,"Jan  8, 2024 10:29:25.854486000 JST",,"6000  >  33204 [SYN, ACK] Seq=0 Ack=1 Win=65160 Len=0 MSS=1460 SACK_PERM TSval=2476966738 TSecr=3824861764 WS=128"
37,12.258453,192.168.11.20,192.168.11.19,TCP,66,0.000123,,0.000123,"Jan  8, 2024 10:29:25.854609000 JST",,33204  >  6000 [ACK] Seq=1 Ack=1 Win=64256 Len=0 TSval=3824861771 TSecr=2476966738
38,12.258639,192.168.11.20,192.168.11.19,TCP,93,,,0.000186,"Jan  8, 2024 10:29:25.854795000 JST",,"33204  >  6000 [PSH, ACK] Seq=1 Ack=1 Win=64256 Len=27 TSval=3824861772 TSecr=2476966738 [TCP segment of a reassembled PDU]"
39,12.258754,192.168.11.20,192.168.11.19,TCP,66,,,0.000115,"Jan  8, 2024 10:29:25.854910000 JST",,"33204  >  6000 [FIN, ACK] Seq=28 Ack=1 Win=64256 Len=0 TSval=3824861772 TSecr=2476966738"
40,12.265665,192.168.11.19,192.168.11.20,TCP,66,0.007026,,0.006911,"Jan  8, 2024 10:29:25.861821000 JST",,6000  >  33204 [ACK] Seq=1 Ack=28 Win=65152 Len=0 TSval=2476966745 TSecr=3824861772
41,12.265887,192.168.11.19,192.168.11.20,TCP,66,0.007133,,0.000222,"Jan  8, 2024 10:29:25.862043000 JST",,"6000  >  33204 [FIN, ACK] Seq=1 Ack=29 Win=65152 Len=0 TSval=2476966747 TSecr=3824861772"
42,12.265937,192.168.11.20,192.168.11.19,TCP,66,0.00005,,0.00005,"Jan  8, 2024 10:29:25.862093000 JST",,33204  >  6000 [ACK] Seq=29 Ack=2 Win=64256 Len=0 TSval=3824861779 TSecr=2476966747
43,12.297252,192.168.11.20,255.255.255.255,UDP,209,,Ÿ,0.031315,"Jan  8, 2024 10:29:25.893408000 JST",7b2273656d616e74696373223a207b22656e74697479223a2022504944222c202262617365656e74697479223a2022616e79222c2022726f6c65223a2022747474222c20227370617469616c223a2022616e79222c202274656d706f72616c223a2022616e79227d2c20226461746170726f7065727479223a207b22666f726d6174223a2022696e616f6b615f70726f6772616d5f73616d706c655f73656d616e746963227d7d,34436  >  7000 Len=167
44,12.309506,192.168.11.12,192.168.11.20,TCP,74,,œ,0.012254,"Jan  8, 2024 10:29:25.905662000 JST",,50244  >  6000 [SYN] Seq=0 Win=64240 Len=0 MSS=1460 SACK_PERM TSval=915399080 TSecr=0 WS=128
45,12.30967,192.168.11.20,192.168.11.12,TCP,74,0.000164,,0.000164,"Jan  8, 2024 10:29:25.905826000 JST",,"6000  >  50244 [SYN, ACK] Seq=0 Ack=1 Win=65160 Len=0 MSS=1460 SACK_PERM TSval=920891752 TSecr=915399080 WS=128"
46,12.319103,192.168.11.12,192.168.11.20,TCP,66,0.009433,,0.009433,"Jan  8, 2024 10:29:25.915259000 JST",,50244  >  6000 [ACK] Seq=1 Ack=1 Win=64256 Len=0 TSval=915399091 TSecr=920891752
47,12.31977,192.168.11.12,192.168.11.20,TCP,93,,,0.000667,"Jan  8, 2024 10:29:25.915926000 JST",,"50244  >  6000 [PSH, ACK] Seq=1 Ack=1 Win=64256 Len=27 TSval=915399091 TSecr=920891752 [TCP segment of a reassembled PDU]"
48,12.319983,192.168.11.20,192.168.11.12,TCP,66,0.000213,,0.000213,"Jan  8, 2024 10:29:25.916139000 JST",,6000  >  50244 [ACK] Seq=1 Ack=28 Win=65152 Len=0 TSval=920891762 TSecr=915399091
49,12.320131,192.168.11.12,192.168.11.20,TCP,66,,,0.000148,"Jan  8, 2024 10:29:25.916287000 JST",,"50244  >  6000 [FIN, ACK] Seq=28 Ack=1 Win=64256 Len=0 TSval=915399091 TSecr=920891752"
50,12.322398,192.168.11.20,192.168.11.12,TCP,66,0.002267,,0.002267,"Jan  8, 2024 10:29:25.918554000 JST",,"6000  >  50244 [FIN, ACK] Seq=1 Ack=29 Win=65152 Len=0 TSval=920891764 TSecr=915399091"
51,12.327269,192.168.11.12,192.168.11.20,TCP,66,0.004871,,0.004871,"Jan  8, 2024 10:29:25.923425000 JST",,50244  >  6000 [ACK] Seq=29 Ack=2 Win=64256 Len=0 TSval=915399099 TSecr=920891764
52,18.356156,192.168.11.20,192.168.11.19,TCP,74,,,6.028887,"Jan  8, 2024 10:29:31.952312000 JST",,33214  >  6000 [SYN] Seq=0 Win=64240 Len=0 MSS=1460 SACK_PERM TSval=3824867869 TSecr=0 WS=128
53,18.365132,192.168.11.19,192.168.11.20,TCP,74,0.008976,,0.008976,"Jan  8, 2024 10:29:31.961288000 JST",,"6000  >  33214 [SYN, ACK] Seq=0 Ack=1 Win=65160 Len=0 MSS=1460 SACK_PERM TSval=2476972845 TSecr=3824867869 WS=128"
54,18.365237,192.168.11.20,192.168.11.19,TCP,66,0.000105,,0.000105,"Jan  8, 2024 10:29:31.961393000 JST",,33214  >  6000 [ACK] Seq=1 Ack=1 Win=64256 Len=0 TSval=3824867878 TSecr=2476972845
55,18.365438,192.168.11.20,192.168.11.19,TCP,93,,,0.000201,"Jan  8, 2024 10:29:31.961594000 JST",,"33214  >  6000 [PSH, ACK] Seq=1 Ack=1 Win=64256 Len=27 TSval=3824867878 TSecr=2476972845 [TCP segment of a reassembled PDU]"
56,18.365546,192.168.11.20,192.168.11.19,TCP,66,,,0.000108,"Jan  8, 2024 10:29:31.961702000 JST",,"33214  >  6000 [FIN, ACK] Seq=28 Ack=1 Win=64256 Len=0 TSval=3824867878 TSecr=2476972845"
57,18.384583,192.168.11.19,192.168.11.20,TCP,66,0.019145,,0.019037,"Jan  8, 2024 10:29:31.980739000 JST",,6000  >  33214 [ACK] Seq=1 Ack=28 Win=65152 Len=0 TSval=2476972862 TSecr=3824867878
58,18.384964,192.168.11.19,192.168.11.20,TCP,66,0.019418,,0.000381,"Jan  8, 2024 10:29:31.981120000 JST",,"6000  >  33214 [FIN, ACK] Seq=1 Ack=29 Win=65152 Len=0 TSval=2476972863 TSecr=3824867878"
59,18.385008,192.168.11.20,192.168.11.19,TCP,66,0.000044,,0.000044,"Jan  8, 2024 10:29:31.981164000 JST",,33214  >  6000 [ACK] Seq=29 Ack=2 Win=64256 Len=0 TSval=3824867898 TSecr=2476972863
60,18.413299,192.168.11.20,255.255.255.255,UDP,209,,Ÿ,0.028291,"Jan  8, 2024 10:29:32.009455000 JST",7b2273656d616e74696373223a207b22656e74697479223a2022504944222c202262617365656e74697479223a2022616e79222c2022726f6c65223a2022747474222c20227370617469616c223a2022616e79222c202274656d706f72616c223a2022616e79227d2c20226461746170726f7065727479223a207b22666f726d6174223a2022696e616f6b615f70726f6772616d5f73616d706c655f73656d616e746963227d7d,40737  >  7000 Len=167
61,19.414657,192.168.11.20,255.255.255.255,UDP,209,,œ,1.001358,"Jan  8, 2024 10:29:33.010813000 JST",7b2273656d616e74696373223a207b22656e74697479223a2022504944222c202262617365656e74697479223a2022616e79222c2022726f6c65223a2022747474222c20227370617469616c223a2022616e79222c202274656d706f72616c223a2022616e79227d2c20226461746170726f7065727479223a207b22666f726d6174223a2022696e616f6b615f70726f6772616d5f73616d706c655f73656d616e746963227d7d,40737  >  7000 Len=167
62,19.425673,192.168.11.12,192.168.11.20,TCP,74,,œ,0.011016,"Jan  8, 2024 10:29:33.021829000 JST",,43686  >  6000 [SYN] Seq=0 Win=64240 Len=0 MSS=1460 SACK_PERM TSval=915406195 TSecr=0 WS=128
63,19.425824,192.168.11.20,192.168.11.12,TCP,74,0.000151,,0.000151,"Jan  8, 2024 10:29:33.021980000 JST",,"6000  >  43686 [SYN, ACK] Seq=0 Ack=1 Win=65160 Len=0 MSS=1460 SACK_PERM TSval=920898868 TSecr=915406195 WS=128"
64,19.432483,192.168.11.12,192.168.11.20,TCP,66,0.006659,,0.006659,"Jan  8, 2024 10:29:33.028639000 JST",,43686  >  6000 [ACK] Seq=1 Ack=1 Win=64256 Len=0 TSval=915406204 TSecr=920898868
65,19.433001,192.168.11.12,192.168.11.20,TCP,93,,,0.000518,"Jan  8, 2024 10:29:33.029157000 JST",,"43686  >  6000 [PSH, ACK] Seq=1 Ack=1 Win=64256 Len=27 TSval=915406205 TSecr=920898868 [TCP segment of a reassembled PDU]"
66,19.433072,192.168.11.20,192.168.11.12,TCP,66,0.000071,,0.000071,"Jan  8, 2024 10:29:33.029228000 JST",,6000  >  43686 [ACK] Seq=1 Ack=28 Win=65152 Len=0 TSval=920898875 TSecr=915406205
67,19.433134,192.168.11.12,192.168.11.20,TCP,66,,,0.000062,"Jan  8, 2024 10:29:33.029290000 JST",,"43686  >  6000 [FIN, ACK] Seq=28 Ack=1 Win=64256 Len=0 TSval=915406205 TSecr=920898868"
68,19.434128,192.168.11.20,192.168.11.12,TCP,66,0.000994,,0.000994,"Jan  8, 2024 10:29:33.030284000 JST",,"6000  >  43686 [FIN, ACK] Seq=1 Ack=29 Win=65152 Len=0 TSval=920898876 TSecr=915406205"
69,19.440222,192.168.11.12,192.168.11.20,TCP,66,0.006094,,0.006094,"Jan  8, 2024 10:29:33.036378000 JST",,43686  >  6000 [ACK] Seq=29 Ack=2 Win=64256 Len=0 TSval=915406212 TSecr=920898876
70,25.466393,192.168.11.20,192.168.11.19,TCP,74,,,6.026171,"Jan  8, 2024 10:29:39.062549000 JST",,34834  >  6000 [SYN] Seq=0 Win=64240 Len=0 MSS=1460 SACK_PERM TSval=3824874979 TSecr=0 WS=128
71,25.473029,192.168.11.19,192.168.11.20,TCP,74,0.006636,,0.006636,"Jan  8, 2024 10:29:39.069185000 JST",,"6000  >  34834 [SYN, ACK] Seq=0 Ack=1 Win=65160 Len=0 MSS=1460 SACK_PERM TSval=2476979953 TSecr=3824874979 WS=128"
72,25.473148,192.168.11.20,192.168.11.19,TCP,66,0.000119,,0.000119,"Jan  8, 2024 10:29:39.069304000 JST",,34834  >  6000 [ACK] Seq=1 Ack=1 Win=64256 Len=0 TSval=3824874986 TSecr=2476979953
73,25.473337,192.168.11.20,192.168.11.19,TCP,93,,,0.000189,"Jan  8, 2024 10:29:39.069493000 JST",,"34834  >  6000 [PSH, ACK] Seq=1 Ack=1 Win=64256 Len=27 TSval=3824874986 TSecr=2476979953 [TCP segment of a reassembled PDU]"
74,25.473448,192.168.11.20,192.168.11.19,TCP,66,,,0.000111,"Jan  8, 2024 10:29:39.069604000 JST",,"34834  >  6000 [FIN, ACK] Seq=28 Ack=1 Win=64256 Len=0 TSval=3824874986 TSecr=2476979953"
75,25.479995,192.168.11.19,192.168.11.20,TCP,66,0.006658,,0.006547,"Jan  8, 2024 10:29:39.076151000 JST",,6000  >  34834 [ACK] Seq=1 Ack=28 Win=65152 Len=0 TSval=2476979960 TSecr=3824874986
76,25.48037,192.168.11.19,192.168.11.20,TCP,66,0.006922,,0.000375,"Jan  8, 2024 10:29:39.076526000 JST",,"6000  >  34834 [FIN, ACK] Seq=1 Ack=29 Win=65152 Len=0 TSval=2476979961 TSecr=3824874986"
77,25.480426,192.168.11.20,192.168.11.19,TCP,66,0.000056,,0.000056,"Jan  8, 2024 10:29:39.076582000 JST",,34834  >  6000 [ACK] Seq=29 Ack=2 Win=64256 Len=0 TSval=3824874993 TSecr=2476979961
78,25.518979,192.168.11.20,255.255.255.255,UDP,209,,Ÿ,0.038553,"Jan  8, 2024 10:29:39.115135000 JST",7b2273656d616e74696373223a207b22656e74697479223a2022504944222c202262617365656e74697479223a2022616e79222c2022726f6c65223a2022747474222c20227370617469616c223a2022616e79222c202274656d706f72616c223a2022616e79227d2c20226461746170726f7065727479223a207b22666f726d6174223a2022696e616f6b615f70726f6772616d5f73616d706c655f73656d616e746963227d7d,38018  >  7000 Len=167
79,25.528034,192.168.11.12,192.168.11.20,TCP,74,,œ,0.009055,"Jan  8, 2024 10:29:39.124190000 JST",,52768  >  6000 [SYN] Seq=0 Win=64240 Len=0 MSS=1460 SACK_PERM TSval=915412298 TSecr=0 WS=128
80,25.52819,192.168.11.20,192.168.11.12,TCP,74,0.000156,,0.000156,"Jan  8, 2024 10:29:39.124346000 JST",,"6000  >  52768 [SYN, ACK] Seq=0 Ack=1 Win=65160 Len=0 MSS=1460 SACK_PERM TSval=920904970 TSecr=915412298 WS=128"
81,25.535077,192.168.11.12,192.168.11.20,TCP,66,0.006887,,0.006887,"Jan  8, 2024 10:29:39.131233000 JST",,52768  >  6000 [ACK] Seq=1 Ack=1 Win=64256 Len=0 TSval=915412307 TSecr=920904970
82,25.535619,192.168.11.12,192.168.11.20,TCP,93,,,0.000542,"Jan  8, 2024 10:29:39.131775000 JST",,"52768  >  6000 [PSH, ACK] Seq=1 Ack=1 Win=64256 Len=27 TSval=915412307 TSecr=920904970 [TCP segment of a reassembled PDU]"
83,25.535705,192.168.11.20,192.168.11.12,TCP,66,0.000086,,0.000086,"Jan  8, 2024 10:29:39.131861000 JST",,6000  >  52768 [ACK] Seq=1 Ack=28 Win=65152 Len=0 TSval=920904978 TSecr=915412307
84,25.535784,192.168.11.12,192.168.11.20,TCP,66,,,0.000079,"Jan  8, 2024 10:29:39.131940000 JST",,"52768  >  6000 [FIN, ACK] Seq=28 Ack=1 Win=64256 Len=0 TSval=915412307 TSecr=920904970"
85,25.537335,192.168.11.20,192.168.11.12,TCP,66,0.001551,,0.001551,"Jan  8, 2024 10:29:39.133491000 JST",,"6000  >  52768 [FIN, ACK] Seq=1 Ack=29 Win=65152 Len=0 TSval=920904979 TSecr=915412307"
86,25.543835,192.168.11.12,192.168.11.20,TCP,66,0.0065,,0.0065,"Jan  8, 2024 10:29:39.139991000 JST",,52768  >  6000 [ACK] Seq=29 Ack=2 Win=64256 Len=0 TSval=915412315 TSecr=920904979
87,31.56346,192.168.11.20,192.168.11.19,TCP,74,,,6.019625,"Jan  8, 2024 10:29:45.159616000 JST",,46664  >  6000 [SYN] Seq=0 Win=64240 Len=0 MSS=1460 SACK_PERM TSval=3824881076 TSecr=0 WS=128
88,31.572329,192.168.11.19,192.168.11.20,TCP,74,0.008869,,0.008869,"Jan  8, 2024 10:29:45.168485000 JST",,"6000  >  46664 [SYN, ACK] Seq=0 Ack=1 Win=65160 Len=0 MSS=1460 SACK_PERM TSval=2476986052 TSecr=3824881076 WS=128"
89,31.572439,192.168.11.20,192.168.11.19,TCP,66,0.00011,,0.00011,"Jan  8, 2024 10:29:45.168595000 JST",,46664  >  6000 [ACK] Seq=1 Ack=1 Win=64256 Len=0 TSval=3824881085 TSecr=2476986052
90,31.572791,192.168.11.20,192.168.11.19,TCP,93,,,0.000352,"Jan  8, 2024 10:29:45.168947000 JST",,"46664  >  6000 [PSH, ACK] Seq=1 Ack=1 Win=64256 Len=27 TSval=3824881086 TSecr=2476986052 [TCP segment of a reassembled PDU]"
91,31.5729,192.168.11.20,192.168.11.19,TCP,66,,,0.000109,"Jan  8, 2024 10:29:45.169056000 JST",,"46664  >  6000 [FIN, ACK] Seq=28 Ack=1 Win=64256 Len=0 TSval=3824881086 TSecr=2476986052"
92,31.580066,192.168.11.19,192.168.11.20,TCP,66,0.007275,,0.007166,"Jan  8, 2024 10:29:45.176222000 JST",,6000  >  46664 [ACK] Seq=1 Ack=28 Win=65152 Len=0 TSval=2476986060 TSecr=3824881086
93,31.580426,192.168.11.19,192.168.11.20,TCP,66,0.007526,,0.00036,"Jan  8, 2024 10:29:45.176582000 JST",,"6000  >  46664 [FIN, ACK] Seq=1 Ack=29 Win=65152 Len=0 TSval=2476986061 TSecr=3824881086"
94,31.580473,192.168.11.20,192.168.11.19,TCP,66,0.000047,,0.000047,"Jan  8, 2024 10:29:45.176629000 JST",,46664  >  6000 [ACK] Seq=29 Ack=2 Win=64256 Len=0 TSval=3824881093 TSecr=2476986061
95,31.608966,192.168.11.20,255.255.255.255,UDP,209,,Ÿ,0.028493,"Jan  8, 2024 10:29:45.205122000 JST",7b2273656d616e74696373223a207b22656e74697479223a2022504944222c202262617365656e74697479223a2022616e79222c2022726f6c65223a2022747474222c20227370617469616c223a2022616e79222c202274656d706f72616c223a2022616e79227d2c20226461746170726f7065727479223a207b22666f726d6174223a2022696e616f6b615f70726f6772616d5f73616d706c655f73656d616e746963227d7d,38836  >  7000 Len=167
96,31.616806,192.168.11.12,192.168.11.20,TCP,74,,œ,0.00784,"Jan  8, 2024 10:29:45.212962000 JST",,52776  >  6000 [SYN] Seq=0 Win=64240 Len=0 MSS=1460 SACK_PERM TSval=915418389 TSecr=0 WS=128
97,31.616938,192.168.11.20,192.168.11.12,TCP,74,0.000132,,0.000132,"Jan  8, 2024 10:29:45.213094000 JST",,"6000  >  52776 [SYN, ACK] Seq=0 Ack=1 Win=65160 Len=0 MSS=1460 SACK_PERM TSval=920911059 TSecr=915418389 WS=128"
98,31.625199,192.168.11.12,192.168.11.20,TCP,66,0.008261,,0.008261,"Jan  8, 2024 10:29:45.221355000 JST",,52776  >  6000 [ACK] Seq=1 Ack=1 Win=64256 Len=0 TSval=915418397 TSecr=920911059
99,31.62571,192.168.11.12,192.168.11.20,TCP,93,,,0.000511,"Jan  8, 2024 10:29:45.221866000 JST",,"52776  >  6000 [PSH, ACK] Seq=1 Ack=1 Win=64256 Len=27 TSval=915418397 TSecr=920911059 [TCP segment of a reassembled PDU]"
100,31.625783,192.168.11.20,192.168.11.12,TCP,66,0.000073,,0.000073,"Jan  8, 2024 10:29:45.221939000 JST",,6000  >  52776 [ACK] Seq=1 Ack=28 Win=65152 Len=0 TSval=920911068 TSecr=915418397
101,31.625842,192.168.11.12,192.168.11.20,TCP,66,,,0.000059,"Jan  8, 2024 10:29:45.221998000 JST",,"52776  >  6000 [FIN, ACK] Seq=28 Ack=1 Win=64256 Len=0 TSval=915418398 TSecr=920911059"
102,31.627033,192.168.11.20,192.168.11.12,TCP,66,0.001191,,0.001191,"Jan  8, 2024 10:29:45.223189000 JST",,"6000  >  52776 [FIN, ACK] Seq=1 Ack=29 Win=65152 Len=0 TSval=920911069 TSecr=915418398"
103,31.633206,192.168.11.12,192.168.11.20,TCP,66,0.006173,,0.006173,"Jan  8, 2024 10:29:45.229362000 JST",,52776  >  6000 [ACK] Seq=29 Ack=2 Win=64256 Len=0 TSval=915418405 TSecr=920911069
104,37.685236,192.168.11.20,192.168.11.19,TCP,74,,,6.05203,"Jan  8, 2024 10:29:51.281392000 JST",,46676  >  6000 [SYN] Seq=0 Win=64240 Len=0 MSS=1460 SACK_PERM TSval=3824887198 TSecr=0 WS=128
105,37.691948,192.168.11.19,192.168.11.20,TCP,74,0.006712,,0.006712,"Jan  8, 2024 10:29:51.288104000 JST",,"6000  >  46676 [SYN, ACK] Seq=0 Ack=1 Win=65160 Len=0 MSS=1460 SACK_PERM TSval=2476992172 TSecr=3824887198 WS=128"
106,37.692067,192.168.11.20,192.168.11.19,TCP,66,0.000119,,0.000119,"Jan  8, 2024 10:29:51.288223000 JST",,46676  >  6000 [ACK] Seq=1 Ack=1 Win=64256 Len=0 TSval=3824887205 TSecr=2476992172
107,37.692279,192.168.11.20,192.168.11.19,TCP,93,,,0.000212,"Jan  8, 2024 10:29:51.288435000 JST",,"46676  >  6000 [PSH, ACK] Seq=1 Ack=1 Win=64256 Len=27 TSval=3824887205 TSecr=2476992172 [TCP segment of a reassembled PDU]"
108,37.692386,192.168.11.20,192.168.11.19,TCP,66,,,0.000107,"Jan  8, 2024 10:29:51.288542000 JST",,"46676  >  6000 [FIN, ACK] Seq=28 Ack=1 Win=64256 Len=0 TSval=3824887205 TSecr=2476992172"
109,37.708589,192.168.11.20,192.168.11.19,TCP,66,,,0.016203,"Jan  8, 2024 10:29:51.304745000 JST",,"[TCP Retransmission] 46676  >  6000 [FIN, ACK] Seq=28 Ack=1 Win=64256 Len=0 TSval=3824887222 TSecr=2476992172"
110,37.71331,192.168.11.19,192.168.11.20,TCP,66,0.021031,,0.004721,"Jan  8, 2024 10:29:51.309466000 JST",,6000  >  46676 [ACK] Seq=1 Ack=28 Win=65152 Len=0 TSval=2476992183 TSecr=3824887205
111,37.713701,192.168.11.19,192.168.11.20,TCP,66,0.021315,,0.000391,"Jan  8, 2024 10:29:51.309857000 JST",,"6000  >  46676 [FIN, ACK] Seq=1 Ack=29 Win=65152 Len=0 TSval=2476992184 TSecr=3824887205"
112,37.713775,192.168.11.20,192.168.11.19,TCP,66,0.000074,,0.000074,"Jan  8, 2024 10:29:51.309931000 JST",,46676  >  6000 [ACK] Seq=29 Ack=2 Win=64256 Len=0 TSval=3824887227 TSecr=2476992184
113,37.716438,192.168.11.19,192.168.11.20,TCP,78,,,0.002663,"Jan  8, 2024 10:29:51.312594000 JST",,[TCP Dup ACK 111#1] 6000  >  46676 [ACK] Seq=2 Ack=29 Win=65152 Len=0 TSval=2476992196 TSecr=3824887222 SLE=28 SRE=29
114,37.742008,192.168.11.20,255.255.255.255,UDP,209,,Ÿ,0.02557,"Jan  8, 2024 10:29:51.338164000 JST",7b2273656d616e74696373223a207b22656e74697479223a2022504944222c202262617365656e74697479223a2022616e79222c2022726f6c65223a2022747474222c20227370617469616c223a2022616e79222c202274656d706f72616c223a2022616e79227d2c20226461746170726f7065727479223a207b22666f726d6174223a2022696e616f6b615f70726f6772616d5f73616d706c655f73656d616e746963227d7d,50576  >  7000 Len=167
115,37.749598,192.168.11.12,192.168.11.20,TCP,74,,œ,0.00759,"Jan  8, 2024 10:29:51.345754000 JST",,35894  >  6000 [SYN] Seq=0 Win=64240 Len=0 MSS=1460 SACK_PERM TSval=915424522 TSecr=0 WS=128
116,37.749729,192.168.11.20,192.168.11.12,TCP,74,0.000131,,0.000131,"Jan  8, 2024 10:29:51.345885000 JST",,"6000  >  35894 [SYN, ACK] Seq=0 Ack=1 Win=65160 Len=0 MSS=1460 SACK_PERM TSval=920917192 TSecr=915424522 WS=128"
117,37.756699,192.168.11.12,192.168.11.20,TCP,66,0.00697,,0.00697,"Jan  8, 2024 10:29:51.352855000 JST",,35894  >  6000 [ACK] Seq=1 Ack=1 Win=64256 Len=0 TSval=915424529 TSecr=920917192
118,37.757258,192.168.11.12,192.168.11.20,TCP,93,,,0.000559,"Jan  8, 2024 10:29:51.353414000 JST",,"35894  >  6000 [PSH, ACK] Seq=1 Ack=1 Win=64256 Len=27 TSval=915424529 TSecr=920917192 [TCP segment of a reassembled PDU]"
119,37.757336,192.168.11.20,192.168.11.12,TCP,66,0.000078,,0.000078,"Jan  8, 2024 10:29:51.353492000 JST",,6000  >  35894 [ACK] Seq=1 Ack=28 Win=65152 Len=0 TSval=920917199 TSecr=915424529
120,37.757415,192.168.11.12,192.168.11.20,TCP,66,,,0.000079,"Jan  8, 2024 10:29:51.353571000 JST",,"35894  >  6000 [FIN, ACK] Seq=28 Ack=1 Win=64256 Len=0 TSval=915424529 TSecr=920917192"
121,37.758763,192.168.11.20,192.168.11.12,TCP,66,0.001348,,0.001348,"Jan  8, 2024 10:29:51.354919000 JST",,"6000  >  35894 [FIN, ACK] Seq=1 Ack=29 Win=65152 Len=0 TSval=920917201 TSecr=915424529"
122,37.767465,192.168.11.12,192.168.11.20,TCP,66,0.008702,,0.008702,"Jan  8, 2024 10:29:51.363621000 JST",,35894  >  6000 [ACK] Seq=29 Ack=2 Win=64256 Len=0 TSval=915424536 TSecr=920917201
123,43.800423,192.168.11.20,192.168.11.19,TCP,74,,,6.032958,"Jan  8, 2024 10:29:57.396579000 JST",,36076  >  6000 [SYN] Seq=0 Win=64240 Len=0 MSS=1460 SACK_PERM TSval=3824893313 TSecr=0 WS=128
124,43.806962,192.168.11.19,192.168.11.20,TCP,74,0.006539,,0.006539,"Jan  8, 2024 10:29:57.403118000 JST",,"6000  >  36076 [SYN, ACK] Seq=0 Ack=1 Win=65160 Len=0 MSS=1460 SACK_PERM TSval=2476998287 TSecr=3824893313 WS=128"
125,43.80707,192.168.11.20,192.168.11.19,TCP,66,0.000108,,0.000108,"Jan  8, 2024 10:29:57.403226000 JST",,36076  >  6000 [ACK] Seq=1 Ack=1 Win=64256 Len=0 TSval=3824893320 TSecr=2476998287
126,43.807247,192.168.11.20,192.168.11.19,TCP,93,,,0.000177,"Jan  8, 2024 10:29:57.403403000 JST",,"36076  >  6000 [PSH, ACK] Seq=1 Ack=1 Win=64256 Len=27 TSval=3824893320 TSecr=2476998287 [TCP segment of a reassembled PDU]"
127,43.807372,192.168.11.20,192.168.11.19,TCP,66,,,0.000125,"Jan  8, 2024 10:29:57.403528000 JST",,"36076  >  6000 [FIN, ACK] Seq=28 Ack=1 Win=64256 Len=0 TSval=3824893320 TSecr=2476998287"
128,43.814053,192.168.11.19,192.168.11.20,TCP,66,0.006806,,0.006681,"Jan  8, 2024 10:29:57.410209000 JST",,6000  >  36076 [ACK] Seq=1 Ack=28 Win=65152 Len=0 TSval=2476998294 TSecr=3824893320
129,43.814423,192.168.11.19,192.168.11.20,TCP,66,0.007051,,0.00037,"Jan  8, 2024 10:29:57.410579000 JST",,"6000  >  36076 [FIN, ACK] Seq=1 Ack=29 Win=65152 Len=0 TSval=2476998295 TSecr=3824893320"
130,43.81447,192.168.11.20,192.168.11.19,TCP,66,0.000047,,0.000047,"Jan  8, 2024 10:29:57.410626000 JST",,36076  >  6000 [ACK] Seq=29 Ack=2 Win=64256 Len=0 TSval=3824893327 TSecr=2476998295
131,43.843331,192.168.11.20,255.255.255.255,UDP,209,,Ÿ,0.028861,"Jan  8, 2024 10:29:57.439487000 JST",7b2273656d616e74696373223a207b22656e74697479223a2022504944222c202262617365656e74697479223a2022616e79222c2022726f6c65223a2022747474222c20227370617469616c223a2022616e79222c202274656d706f72616c223a2022616e79227d2c20226461746170726f7065727479223a207b22666f726d6174223a2022696e616f6b615f70726f6772616d5f73616d706c655f73656d616e746963227d7d,38492  >  7000 Len=167
132,43.857272,192.168.11.12,192.168.11.20,TCP,74,,œ,0.013941,"Jan  8, 2024 10:29:57.453428000 JST",,52620  >  6000 [SYN] Seq=0 Win=64240 Len=0 MSS=1460 SACK_PERM TSval=915430627 TSecr=0 WS=128
133,43.857429,192.168.11.20,192.168.11.12,TCP,74,0.000157,,0.000157,"Jan  8, 2024 10:29:57.453585000 JST",,"6000  >  52620 [SYN, ACK] Seq=0 Ack=1 Win=65160 Len=0 MSS=1460 SACK_PERM TSval=920923299 TSecr=915430627 WS=128"
134,43.86429,192.168.11.12,192.168.11.20,TCP,66,0.006861,,0.006861,"Jan  8, 2024 10:29:57.460446000 JST",,52620  >  6000 [ACK] Seq=1 Ack=1 Win=64256 Len=0 TSval=915430636 TSecr=920923299
135,43.864648,192.168.11.12,192.168.11.20,TCP,93,,,0.000358,"Jan  8, 2024 10:29:57.460804000 JST",,"52620  >  6000 [PSH, ACK] Seq=1 Ack=1 Win=64256 Len=27 TSval=915430636 TSecr=920923299 [TCP segment of a reassembled PDU]"
136,43.864717,192.168.11.20,192.168.11.12,TCP,66,0.000069,,0.000069,"Jan  8, 2024 10:29:57.460873000 JST",,6000  >  52620 [ACK] Seq=1 Ack=28 Win=65152 Len=0 TSval=920923307 TSecr=915430636
137,43.864907,192.168.11.12,192.168.11.20,TCP,66,,,0.00019,"Jan  8, 2024 10:29:57.461063000 JST",,"52620  >  6000 [FIN, ACK] Seq=28 Ack=1 Win=64256 Len=0 TSval=915430636 TSecr=920923299"
138,43.866137,192.168.11.20,192.168.11.12,TCP,66,0.00123,,0.00123,"Jan  8, 2024 10:29:57.462293000 JST",,"6000  >  52620 [FIN, ACK] Seq=1 Ack=29 Win=65152 Len=0 TSval=920923308 TSecr=915430636"
139,43.872069,192.168.11.12,192.168.11.20,TCP,66,0.005932,,0.005932,"Jan  8, 2024 10:29:57.468225000 JST",,52620  >  6000 [ACK] Seq=29 Ack=2 Win=64256 Len=0 TSval=915430644 TSecr=920923308
140,49.899488,192.168.11.20,192.168.11.19,TCP,74,,,6.027419,"Jan  8, 2024 10:30:03.495644000 JST",,39376  >  6000 [SYN] Seq=0 Win=64240 Len=0 MSS=1460 SACK_PERM TSval=3824899412 TSecr=0 WS=128
141,49.90616,192.168.11.19,192.168.11.20,TCP,74,0.006672,,0.006672,"Jan  8, 2024 10:30:03.502316000 JST",,"6000  >  39376 [SYN, ACK] Seq=0 Ack=1 Win=65160 Len=0 MSS=1460 SACK_PERM TSval=2477004386 TSecr=3824899412 WS=128"
142,49.906279,192.168.11.20,192.168.11.19,TCP,66,0.000119,,0.000119,"Jan  8, 2024 10:30:03.502435000 JST",,39376  >  6000 [ACK] Seq=1 Ack=1 Win=64256 Len=0 TSval=3824899419 TSecr=2477004386
143,49.906457,192.168.11.20,192.168.11.19,TCP,93,,,0.000178,"Jan  8, 2024 10:30:03.502613000 JST",,"39376  >  6000 [PSH, ACK] Seq=1 Ack=1 Win=64256 Len=27 TSval=3824899419 TSecr=2477004386 [TCP segment of a reassembled PDU]"
144,49.906588,192.168.11.20,192.168.11.19,TCP,66,,,0.000131,"Jan  8, 2024 10:30:03.502744000 JST",,"39376  >  6000 [FIN, ACK] Seq=28 Ack=1 Win=64256 Len=0 TSval=3824899420 TSecr=2477004386"
145,49.913774,192.168.11.19,192.168.11.20,TCP,66,0.007317,,0.007186,"Jan  8, 2024 10:30:03.509930000 JST",,6000  >  39376 [ACK] Seq=1 Ack=28 Win=65152 Len=0 TSval=2477004393 TSecr=3824899419
146,49.922449,192.168.11.19,192.168.11.20,TCP,66,0.015861,,0.008675,"Jan  8, 2024 10:30:03.518605000 JST",,"6000  >  39376 [FIN, ACK] Seq=1 Ack=29 Win=65152 Len=0 TSval=2477004395 TSecr=3824899420"
147,49.922496,192.168.11.20,192.168.11.19,TCP,66,0.000047,,0.000047,"Jan  8, 2024 10:30:03.518652000 JST",,39376  >  6000 [ACK] Seq=29 Ack=2 Win=64256 Len=0 TSval=3824899435 TSecr=2477004395
148,49.950604,192.168.11.20,255.255.255.255,UDP,209,,Ÿ,0.028108,"Jan  8, 2024 10:30:03.546760000 JST",7b2273656d616e74696373223a207b22656e74697479223a2022504944222c202262617365656e74697479223a2022616e79222c2022726f6c65223a2022747474222c20227370617469616c223a2022616e79222c202274656d706f72616c223a2022616e79227d2c20226461746170726f7065727479223a207b22666f726d6174223a2022696e616f6b615f70726f6772616d5f73616d706c655f73656d616e746963227d7d,34011  >  7000 Len=167
149,49.958219,192.168.11.12,192.168.11.20,TCP,74,,œ,0.007615,"Jan  8, 2024 10:30:03.554375000 JST",,52628  >  6000 [SYN] Seq=0 Win=64240 Len=0 MSS=1460 SACK_PERM TSval=915436730 TSecr=0 WS=128
150,49.95837,192.168.11.20,192.168.11.12,TCP,74,0.000151,,0.000151,"Jan  8, 2024 10:30:03.554526000 JST",,"6000  >  52628 [SYN, ACK] Seq=0 Ack=1 Win=65160 Len=0 MSS=1460 SACK_PERM TSval=920929400 TSecr=915436730 WS=128"
151,49.965368,192.168.11.12,192.168.11.20,TCP,66,0.006998,,0.006998,"Jan  8, 2024 10:30:03.561524000 JST",,52628  >  6000 [ACK] Seq=1 Ack=1 Win=64256 Len=0 TSval=915436737 TSecr=920929400
152,49.965881,192.168.11.12,192.168.11.20,TCP,93,,,0.000513,"Jan  8, 2024 10:30:03.562037000 JST",,"52628  >  6000 [PSH, ACK] Seq=1 Ack=1 Win=64256 Len=27 TSval=915436737 TSecr=920929400 [TCP segment of a reassembled PDU]"
153,49.965951,192.168.11.20,192.168.11.12,TCP,66,0.00007,,0.00007,"Jan  8, 2024 10:30:03.562107000 JST",,6000  >  52628 [ACK] Seq=1 Ack=28 Win=65152 Len=0 TSval=920929408 TSecr=915436737
154,49.966017,192.168.11.12,192.168.11.20,TCP,66,,,0.000066,"Jan  8, 2024 10:30:03.562173000 JST",,"52628  >  6000 [FIN, ACK] Seq=28 Ack=1 Win=64256 Len=0 TSval=915436737 TSecr=920929400"
155,49.967251,192.168.11.20,192.168.11.12,TCP,66,0.001234,,0.001234,"Jan  8, 2024 10:30:03.563407000 JST",,"6000  >  52628 [FIN, ACK] Seq=1 Ack=29 Win=65152 Len=0 TSval=920929409 TSecr=915436737"
156,49.973752,192.168.11.12,192.168.11.20,TCP,66,0.006501,,0.006501,"Jan  8, 2024 10:30:03.569908000 JST",,52628  >  6000 [ACK] Seq=29 Ack=2 Win=64256 Len=0 TSval=915436745 TSecr=920929409
157,55.99987,192.168.11.20,192.168.11.19,TCP,74,,,6.026118,"Jan  8, 2024 10:30:09.596026000 JST",,39384  >  6000 [SYN] Seq=0 Win=64240 Len=0 MSS=1460 SACK_PERM TSval=3824905513 TSecr=0 WS=128
158,56.006477,192.168.11.19,192.168.11.20,TCP,74,0.006607,,0.006607,"Jan  8, 2024 10:30:09.602633000 JST",,"6000  >  39384 [SYN, ACK] Seq=0 Ack=1 Win=65160 Len=0 MSS=1460 SACK_PERM TSval=2477010486 TSecr=3824905513 WS=128"
159,56.006598,192.168.11.20,192.168.11.19,TCP,66,0.000121,,0.000121,"Jan  8, 2024 10:30:09.602754000 JST",,39384  >  6000 [ACK] Seq=1 Ack=1 Win=64256 Len=0 TSval=3824905520 TSecr=2477010486
160,56.006806,192.168.11.20,192.168.11.19,TCP,93,,,0.000208,"Jan  8, 2024 10:30:09.602962000 JST",,"39384  >  6000 [PSH, ACK] Seq=1 Ack=1 Win=64256 Len=27 TSval=3824905520 TSecr=2477010486 [TCP segment of a reassembled PDU]"
161,56.006914,192.168.11.20,192.168.11.19,TCP,66,,,0.000108,"Jan  8, 2024 10:30:09.603070000 JST",,"39384  >  6000 [FIN, ACK] Seq=28 Ack=1 Win=64256 Len=0 TSval=3824905520 TSecr=2477010486"
162,56.014339,192.168.11.19,192.168.11.20,TCP,66,0.007533,,0.007425,"Jan  8, 2024 10:30:09.610495000 JST",,6000  >  39384 [ACK] Seq=1 Ack=28 Win=65152 Len=0 TSval=2477010494 TSecr=3824905520
163,56.014726,192.168.11.19,192.168.11.20,TCP,66,0.007812,,0.000387,"Jan  8, 2024 10:30:09.610882000 JST",,"6000  >  39384 [FIN, ACK] Seq=1 Ack=29 Win=65152 Len=0 TSval=2477010495 TSecr=3824905520"
164,56.01479,192.168.11.20,192.168.11.19,TCP,66,0.000064,,0.000064,"Jan  8, 2024 10:30:09.610946000 JST",,39384  >  6000 [ACK] Seq=29 Ack=2 Win=64256 Len=0 TSval=3824905528 TSecr=2477010495
165,56.043777,192.168.11.20,255.255.255.255,UDP,209,,Ÿ,0.028987,"Jan  8, 2024 10:30:09.639933000 JST",7b2273656d616e74696373223a207b22656e74697479223a2022504944222c202262617365656e74697479223a2022616e79222c2022726f6c65223a2022747474222c20227370617469616c223a2022616e79222c202274656d706f72616c223a2022616e79227d2c20226461746170726f7065727479223a207b22666f726d6174223a2022696e616f6b615f70726f6772616d5f73616d706c655f73656d616e746963227d7d,52304  >  7000 Len=167
166,56.051354,192.168.11.12,192.168.11.20,TCP,74,,œ,0.007577,"Jan  8, 2024 10:30:09.647510000 JST",,36418  >  6000 [SYN] Seq=0 Win=64240 Len=0 MSS=1460 SACK_PERM TSval=915442823 TSecr=0 WS=128
167,56.051517,192.168.11.20,192.168.11.12,TCP,74,0.000163,,0.000163,"Jan  8, 2024 10:30:09.647673000 JST",,"6000  >  36418 [SYN, ACK] Seq=0 Ack=1 Win=65160 Len=0 MSS=1460 SACK_PERM TSval=920935493 TSecr=915442823 WS=128"
168,56.059087,192.168.11.12,192.168.11.20,TCP,66,0.00757,,0.00757,"Jan  8, 2024 10:30:09.655243000 JST",,36418  >  6000 [ACK] Seq=1 Ack=1 Win=64256 Len=0 TSval=915442831 TSecr=920935493
169,56.059595,192.168.11.12,192.168.11.20,TCP,93,,,0.000508,"Jan  8, 2024 10:30:09.655751000 JST",,"36418  >  6000 [PSH, ACK] Seq=1 Ack=1 Win=64256 Len=27 TSval=915442831 TSecr=920935493 [TCP segment of a reassembled PDU]"
170,56.059678,192.168.11.20,192.168.11.12,TCP,66,0.000083,,0.000083,"Jan  8, 2024 10:30:09.655834000 JST",,6000  >  36418 [ACK] Seq=1 Ack=28 Win=65152 Len=0 TSval=920935502 TSecr=915442831
171,56.059746,192.168.11.12,192.168.11.20,TCP,66,,,0.000068,"Jan  8, 2024 10:30:09.655902000 JST",,"36418  >  6000 [FIN, ACK] Seq=28 Ack=1 Win=64256 Len=0 TSval=915442831 TSecr=920935493"
172,56.060931,192.168.11.20,192.168.11.12,TCP,66,0.001185,,0.001185,"Jan  8, 2024 10:30:09.657087000 JST",,"6000  >  36418 [FIN, ACK] Seq=1 Ack=29 Win=65152 Len=0 TSval=920935503 TSecr=915442831"
173,56.067019,192.168.11.12,192.168.11.20,TCP,66,0.006088,,0.006088,"Jan  8, 2024 10:30:09.663175000 JST",,36418  >  6000 [ACK] Seq=29 Ack=2 Win=64256 Len=0 TSval=915442839 TSecr=920935503
174,87.176273,192.168.11.20,192.168.11.19,TCP,74,,,31.109254,"Jan  8, 2024 10:30:40.772429000 JST",,40638  >  6000 [SYN] Seq=0 Win=64240 Len=0 MSS=1460 SACK_PERM TSval=3824936689 TSecr=0 WS=128
175,87.183978,192.168.11.19,192.168.11.20,TCP,74,0.007705,,0.007705,"Jan  8, 2024 10:30:40.780134000 JST",,"6000  >  40638 [SYN, ACK] Seq=0 Ack=1 Win=65160 Len=0 MSS=1460 SACK_PERM TSval=2477041664 TSecr=3824936689 WS=128"
176,87.18409,192.168.11.20,192.168.11.19,TCP,66,0.000112,,0.000112,"Jan  8, 2024 10:30:40.780246000 JST",,40638  >  6000 [ACK] Seq=1 Ack=1 Win=64256 Len=0 TSval=3824936697 TSecr=2477041664
177,87.184261,192.168.11.20,192.168.11.19,TCP,93,,,0.000171,"Jan  8, 2024 10:30:40.780417000 JST",,"40638  >  6000 [PSH, ACK] Seq=1 Ack=1 Win=64256 Len=27 TSval=3824936697 TSecr=2477041664 [TCP segment of a reassembled PDU]"
178,87.184388,192.168.11.20,192.168.11.19,TCP,66,,,0.000127,"Jan  8, 2024 10:30:40.780544000 JST",,"40638  >  6000 [FIN, ACK] Seq=28 Ack=1 Win=64256 Len=0 TSval=3824936697 TSecr=2477041664"
179,87.192008,192.168.11.19,192.168.11.20,TCP,66,0.007747,,0.00762,"Jan  8, 2024 10:30:40.788164000 JST",,6000  >  40638 [ACK] Seq=1 Ack=28 Win=65152 Len=0 TSval=2477041671 TSecr=3824936697
180,87.19224,192.168.11.19,192.168.11.20,TCP,66,0.007852,,0.000232,"Jan  8, 2024 10:30:40.788396000 JST",,"6000  >  40638 [FIN, ACK] Seq=1 Ack=29 Win=65152 Len=0 TSval=2477041673 TSecr=3824936697"
181,87.192287,192.168.11.20,192.168.11.19,TCP,66,0.000047,,0.000047,"Jan  8, 2024 10:30:40.788443000 JST",,40638  >  6000 [ACK] Seq=29 Ack=2 Win=64256 Len=0 TSval=3824936705 TSecr=2477041673
182,87.22267,192.168.11.20,255.255.255.255,UDP,209,,Ÿ,0.030383,"Jan  8, 2024 10:30:40.818826000 JST",7b2273656d616e74696373223a207b22656e74697479223a2022504944222c202262617365656e74697479223a2022616e79222c2022726f6c65223a2022747474222c20227370617469616c223a2022616e79222c202274656d706f72616c223a2022616e79227d2c20226461746170726f7065727479223a207b22666f726d6174223a2022696e616f6b615f70726f6772616d5f73616d706c655f73656d616e746963227d7d,50134  >  7000 Len=167
183,87.23057,192.168.11.12,192.168.11.20,TCP,74,,œ,0.0079,"Jan  8, 2024 10:30:40.826726000 JST",,51870  >  6000 [SYN] Seq=0 Win=64240 Len=0 MSS=1460 SACK_PERM TSval=915474002 TSecr=0 WS=128
184,87.230734,192.168.11.20,192.168.11.12,TCP,74,0.000164,,0.000164,"Jan  8, 2024 10:30:40.826890000 JST",,"6000  >  51870 [SYN, ACK] Seq=0 Ack=1 Win=65160 Len=0 MSS=1460 SACK_PERM TSval=920966673 TSecr=915474002 WS=128"
