No.,Time,Source,Destination,Protocol,Length,Time delta from previous captured frame,XXX,Data,Info
1,0,192.168.11.43,192.168.11.24,TCP,74,0,,,36742  >  6000 [SYN] Seq=0 Win=64240 Len=0 MSS=1460 SACK_PERM TSval=193273145 TSecr=0 WS=128
2,0.006912,192.168.11.24,192.168.11.43,TCP,74,0.006912,,,"6000  >  36742 [SYN, ACK] Seq=0 Ack=1 Win=65160 Len=0 MSS=1460 SACK_PERM TSval=2888947855 TSecr=193273145 WS=128"
3,0.007024,192.168.11.43,192.168.11.24,TCP,66,0.000112,,,36742  >  6000 [ACK] Seq=1 Ack=1 Win=64256 Len=0 TSval=193273155 TSecr=2888947855
4,0.007288,192.168.11.43,192.168.11.24,TCP,93,0.000264,,,"36742  >  6000 [PSH, ACK] Seq=1 Ack=1 Win=64256 Len=27 TSval=193273155 TSecr=2888947855 [TCP segment of a reassembled PDU]"
5,0.007424,192.168.11.43,192.168.11.24,TCP,66,0.000136,,,"36742  >  6000 [FIN, ACK] Seq=28 Ack=1 Win=64256 Len=0 TSval=193273155 TSecr=2888947855"
6,0.015742,192.168.11.24,192.168.11.43,TCP,66,0.008318,,,6000  >  36742 [ACK] Seq=1 Ack=28 Win=65152 Len=0 TSval=2888947863 TSecr=193273155
7,0.015974,192.168.11.24,192.168.11.43,TCP,66,0.000232,,,"6000  >  36742 [FIN, ACK] Seq=1 Ack=29 Win=65152 Len=0 TSval=2888947865 TSecr=193273155"
8,0.016023,192.168.11.43,192.168.11.24,TCP,66,0.000049,,,36742  >  6000 [ACK] Seq=29 Ack=2 Win=64256 Len=0 TSval=193273164 TSecr=2888947865
9,0.046615,192.168.11.43,255.255.255.255,UDP,209,0.030592,Ÿ,7b2273656d616e74696373223a207b22656e74697479223a2022504944222c202262617365656e74697479223a2022616e79222c2022726f6c65223a2022303033222c20227370617469616c223a2022616e79222c202274656d706f72616c223a2022616e79227d2c20226461746170726f7065727479223a207b22666f726d6174223a2022696e616f6b615f70726f6772616d5f73616d706c655f73656d616e746963227d7d,57880  >  7000 Len=167
10,0.057473,192.168.11.44,192.168.11.43,TCP,74,0.010858,œ,,57962  >  6000 [SYN] Seq=0 Win=64240 Len=0 MSS=1460 SACK_PERM TSval=887585698 TSecr=0 WS=128
11,0.057645,192.168.11.43,192.168.11.44,TCP,74,0.000172,,,"6000  >  57962 [SYN, ACK] Seq=0 Ack=1 Win=65160 Len=0 MSS=1460 SACK_PERM TSval=1294035782 TSecr=887585698 WS=128"
12,0.06463,192.168.11.44,192.168.11.43,TCP,66,0.006985,,,57962  >  6000 [ACK] Seq=1 Ack=1 Win=64256 Len=0 TSval=887585708 TSecr=1294035782
13,0.065191,192.168.11.44,192.168.11.43,TCP,93,0.000561,,,"57962  >  6000 [PSH, ACK] Seq=1 Ack=1 Win=64256 Len=27 TSval=887585709 TSecr=1294035782 [TCP segment of a reassembled PDU]"
14,0.065269,192.168.11.43,192.168.11.44,TCP,66,0.000078,,,6000  >  57962 [ACK] Seq=1 Ack=28 Win=65152 Len=0 TSval=1294035789 TSecr=887585709
15,0.065337,192.168.11.44,192.168.11.43,TCP,66,0.000068,,,"57962  >  6000 [FIN, ACK] Seq=28 Ack=1 Win=64256 Len=0 TSval=887585709 TSecr=1294035782"
16,0.066872,192.168.11.43,192.168.11.44,TCP,66,0.001535,,,"6000  >  57962 [FIN, ACK] Seq=1 Ack=29 Win=65152 Len=0 TSval=1294035791 TSecr=887585709"
17,0.072092,192.168.11.44,192.168.11.43,TCP,66,0.00522,,,57962  >  6000 [ACK] Seq=29 Ack=2 Win=64256 Len=0 TSval=887585716 TSecr=1294035791
18,7.264137,192.168.11.43,192.168.11.24,TCP,74,7.192045,,,40188  >  6000 [SYN] Seq=0 Win=64240 Len=0 MSS=1460 SACK_PERM TSval=193280412 TSecr=0 WS=128
19,7.270775,192.168.11.24,192.168.11.43,TCP,74,0.006638,,,"6000  >  40188 [SYN, ACK] Seq=0 Ack=1 Win=65160 Len=0 MSS=1460 SACK_PERM TSval=2888955118 TSecr=193280412 WS=128"
20,7.270882,192.168.11.43,192.168.11.24,TCP,66,0.000107,,,40188  >  6000 [ACK] Seq=1 Ack=1 Win=64256 Len=0 TSval=193280419 TSecr=2888955118
21,7.271063,192.168.11.43,192.168.11.24,TCP,93,0.000181,,,"40188  >  6000 [PSH, ACK] Seq=1 Ack=1 Win=64256 Len=27 TSval=193280419 TSecr=2888955118 [TCP segment of a reassembled PDU]"
22,7.271208,192.168.11.43,192.168.11.24,TCP,66,0.000145,,,"40188  >  6000 [FIN, ACK] Seq=28 Ack=1 Win=64256 Len=0 TSval=193280419 TSecr=2888955118"
23,7.278399,192.168.11.24,192.168.11.43,TCP,66,0.007191,,,6000  >  40188 [ACK] Seq=1 Ack=28 Win=65152 Len=0 TSval=2888955126 TSecr=193280419
24,7.278616,192.168.11.24,192.168.11.43,TCP,66,0.000217,,,"6000  >  40188 [FIN, ACK] Seq=1 Ack=29 Win=65152 Len=0 TSval=2888955127 TSecr=193280419"
25,7.27866,192.168.11.43,192.168.11.24,TCP,66,0.000044,,,40188  >  6000 [ACK] Seq=29 Ack=2 Win=64256 Len=0 TSval=193280427 TSecr=2888955127
26,7.313596,192.168.11.43,255.255.255.255,UDP,209,0.034936,Ÿ,7b2273656d616e74696373223a207b22656e74697479223a2022504944222c202262617365656e74697479223a2022616e79222c2022726f6c65223a2022303033222c20227370617469616c223a2022616e79222c202274656d706f72616c223a2022616e79227d2c20226461746170726f7065727479223a207b22666f726d6174223a2022696e616f6b615f70726f6772616d5f73616d706c655f73656d616e746963227d7d,42784  >  7000 Len=167
27,7.32698,192.168.11.44,192.168.11.43,TCP,74,0.013384,œ,,57966  >  6000 [SYN] Seq=0 Win=64240 Len=0 MSS=1460 SACK_PERM TSval=887592971 TSecr=0 WS=128
28,7.327153,192.168.11.43,192.168.11.44,TCP,74,0.000173,,,"6000  >  57966 [SYN, ACK] Seq=0 Ack=1 Win=65160 Len=0 MSS=1460 SACK_PERM TSval=1294043051 TSecr=887592971 WS=128"
29,7.333659,192.168.11.44,192.168.11.43,TCP,66,0.006506,,,57966  >  6000 [ACK] Seq=1 Ack=1 Win=64256 Len=0 TSval=887592978 TSecr=1294043051
30,7.334092,192.168.11.44,192.168.11.43,TCP,93,0.000433,,,"57966  >  6000 [PSH, ACK] Seq=1 Ack=1 Win=64256 Len=27 TSval=887592978 TSecr=1294043051 [TCP segment of a reassembled PDU]"
31,7.334156,192.168.11.43,192.168.11.44,TCP,66,0.000064,,,6000  >  57966 [ACK] Seq=1 Ack=28 Win=65152 Len=0 TSval=1294043058 TSecr=887592978
32,7.334209,192.168.11.44,192.168.11.43,TCP,66,0.000053,,,"57966  >  6000 [FIN, ACK] Seq=28 Ack=1 Win=64256 Len=0 TSval=887592978 TSecr=1294043051"
33,7.335072,192.168.11.43,192.168.11.44,TCP,66,0.000863,,,"6000  >  57966 [FIN, ACK] Seq=1 Ack=29 Win=65152 Len=0 TSval=1294043059 TSecr=887592978"
34,7.347255,192.168.11.44,192.168.11.43,TCP,66,0.012183,,,57966  >  6000 [ACK] Seq=29 Ack=2 Win=64256 Len=0 TSval=887592990 TSecr=1294043059
35,14.574167,192.168.11.43,192.168.11.24,TCP,74,7.226912,,,42758  >  6000 [SYN] Seq=0 Win=64240 Len=0 MSS=1460 SACK_PERM TSval=193287722 TSecr=0 WS=128
36,14.580835,192.168.11.24,192.168.11.43,TCP,74,0.006668,,,"6000  >  42758 [SYN, ACK] Seq=0 Ack=1 Win=65160 Len=0 MSS=1460 SACK_PERM TSval=2888962428 TSecr=193287722 WS=128"
37,14.580947,192.168.11.43,192.168.11.24,TCP,66,0.000112,,,42758  >  6000 [ACK] Seq=1 Ack=1 Win=64256 Len=0 TSval=193287729 TSecr=2888962428
38,14.581226,192.168.11.43,192.168.11.24,TCP,93,0.000279,,,"42758  >  6000 [PSH, ACK] Seq=1 Ack=1 Win=64256 Len=27 TSval=193287729 TSecr=2888962428 [TCP segment of a reassembled PDU]"
39,14.581342,192.168.11.43,192.168.11.24,TCP,66,0.000116,,,"42758  >  6000 [FIN, ACK] Seq=28 Ack=1 Win=64256 Len=0 TSval=193287729 TSecr=2888962428"
40,14.589142,192.168.11.24,192.168.11.43,TCP,66,0.0078,,,6000  >  42758 [ACK] Seq=1 Ack=28 Win=65152 Len=0 TSval=2888962436 TSecr=193287729
41,14.589553,192.168.11.24,192.168.11.43,TCP,66,0.000411,,,"6000  >  42758 [FIN, ACK] Seq=1 Ack=29 Win=65152 Len=0 TSval=2888962438 TSecr=193287729"
42,14.589599,192.168.11.43,192.168.11.24,TCP,66,0.000046,,,42758  >  6000 [ACK] Seq=29 Ack=2 Win=64256 Len=0 TSval=193287738 TSecr=2888962438
43,14.61882,192.168.11.43,255.255.255.255,UDP,209,0.029221,Ÿ,7b2273656d616e74696373223a207b22656e74697479223a2022504944222c202262617365656e74697479223a2022616e79222c2022726f6c65223a2022303033222c20227370617469616c223a2022616e79222c202274656d706f72616c223a2022616e79227d2c20226461746170726f7065727479223a207b22666f726d6174223a2022696e616f6b615f70726f6772616d5f73616d706c655f73656d616e746963227d7d,42305  >  7000 Len=167
44,14.629522,192.168.11.44,192.168.11.43,TCP,74,0.010702,œ,,52236  >  6000 [SYN] Seq=0 Win=64240 Len=0 MSS=1460 SACK_PERM TSval=887600274 TSecr=0 WS=128
45,14.629653,192.168.11.43,192.168.11.44,TCP,74,0.000131,,,"6000  >  52236 [SYN, ACK] Seq=0 Ack=1 Win=65160 Len=0 MSS=1460 SACK_PERM TSval=1294050354 TSecr=887600274 WS=128"
46,14.636395,192.168.11.44,192.168.11.43,TCP,66,0.006742,,,52236  >  6000 [ACK] Seq=1 Ack=1 Win=64256 Len=0 TSval=887600281 TSecr=1294050354
47,14.636856,192.168.11.44,192.168.11.43,TCP,93,0.000461,,,"52236  >  6000 [PSH, ACK] Seq=1 Ack=1 Win=64256 Len=27 TSval=887600281 TSecr=1294050354 [TCP segment of a reassembled PDU]"
48,14.636941,192.168.11.43,192.168.11.44,TCP,66,0.000085,,,6000  >  52236 [ACK] Seq=1 Ack=28 Win=65152 Len=0 TSval=1294050361 TSecr=887600281
49,14.636996,192.168.11.44,192.168.11.43,TCP,66,0.000055,,,"52236  >  6000 [FIN, ACK] Seq=28 Ack=1 Win=64256 Len=0 TSval=887600281 TSecr=1294050354"
50,14.637952,192.168.11.43,192.168.11.44,TCP,66,0.000956,,,"6000  >  52236 [FIN, ACK] Seq=1 Ack=29 Win=65152 Len=0 TSval=1294050362 TSecr=887600281"
51,14.644128,192.168.11.44,192.168.11.43,TCP,66,0.006176,,,52236  >  6000 [ACK] Seq=29 Ack=2 Win=64256 Len=0 TSval=887600288 TSecr=1294050362
52,21.779852,192.168.11.43,192.168.11.24,TCP,74,7.135724,,,42760  >  6000 [SYN] Seq=0 Win=64240 Len=0 MSS=1460 SACK_PERM TSval=193294928 TSecr=0 WS=128
53,21.786585,192.168.11.24,192.168.11.43,TCP,74,0.006733,,,"6000  >  42760 [SYN, ACK] Seq=0 Ack=1 Win=65160 Len=0 MSS=1460 SACK_PERM TSval=2888969633 TSecr=193294928 WS=128"
54,21.786685,192.168.11.43,192.168.11.24,TCP,66,0.0001,,,42760  >  6000 [ACK] Seq=1 Ack=1 Win=64256 Len=0 TSval=193294935 TSecr=2888969633
55,21.786847,192.168.11.43,192.168.11.24,TCP,93,0.000162,,,"42760  >  6000 [PSH, ACK] Seq=1 Ack=1 Win=64256 Len=27 TSval=193294935 TSecr=2888969633 [TCP segment of a reassembled PDU]"
56,21.786951,192.168.11.43,192.168.11.24,TCP,66,0.000104,,,"42760  >  6000 [FIN, ACK] Seq=28 Ack=1 Win=64256 Len=0 TSval=193294935 TSecr=2888969633"
57,21.795765,192.168.11.24,192.168.11.43,TCP,66,0.008814,,,6000  >  42760 [ACK] Seq=1 Ack=28 Win=65152 Len=0 TSval=2888969642 TSecr=193294935
58,21.795981,192.168.11.24,192.168.11.43,TCP,66,0.000216,,,"6000  >  42760 [FIN, ACK] Seq=1 Ack=29 Win=65152 Len=0 TSval=2888969644 TSecr=193294935"
59,21.796025,192.168.11.43,192.168.11.24,TCP,66,0.000044,,,42760  >  6000 [ACK] Seq=29 Ack=2 Win=64256 Len=0 TSval=193294944 TSecr=2888969644
60,21.824937,192.168.11.43,255.255.255.255,UDP,209,0.028912,Ÿ,7b2273656d616e74696373223a207b22656e74697479223a2022504944222c202262617365656e74697479223a2022616e79222c2022726f6c65223a2022303033222c20227370617469616c223a2022616e79222c202274656d706f72616c223a2022616e79227d2c20226461746170726f7065727479223a207b22666f726d6174223a2022696e616f6b615f70726f6772616d5f73616d706c655f73656d616e746963227d7d,40298  >  7000 Len=167
61,21.836104,192.168.11.44,192.168.11.43,TCP,74,0.011167,œ,,54668  >  6000 [SYN] Seq=0 Win=64240 Len=0 MSS=1460 SACK_PERM TSval=887607478 TSecr=0 WS=128
62,21.836231,192.168.11.43,192.168.11.44,TCP,74,0.000127,,,"6000  >  54668 [SYN, ACK] Seq=0 Ack=1 Win=65160 Len=0 MSS=1460 SACK_PERM TSval=1294057560 TSecr=887607478 WS=128"
63,21.842917,192.168.11.44,192.168.11.43,TCP,66,0.006686,,,54668  >  6000 [ACK] Seq=1 Ack=1 Win=64256 Len=0 TSval=887607488 TSecr=1294057560
64,21.843399,192.168.11.44,192.168.11.43,TCP,93,0.000482,,,"54668  >  6000 [PSH, ACK] Seq=1 Ack=1 Win=64256 Len=27 TSval=887607488 TSecr=1294057560 [TCP segment of a reassembled PDU]"
65,21.843465,192.168.11.43,192.168.11.44,TCP,66,0.000066,,,6000  >  54668 [ACK] Seq=1 Ack=28 Win=65152 Len=0 TSval=1294057567 TSecr=887607488
66,21.843625,192.168.11.44,192.168.11.43,TCP,66,0.00016,,,"54668  >  6000 [FIN, ACK] Seq=28 Ack=1 Win=64256 Len=0 TSval=887607488 TSecr=1294057560"
67,21.84457,192.168.11.43,192.168.11.44,TCP,66,0.000945,,,"6000  >  54668 [FIN, ACK] Seq=1 Ack=29 Win=65152 Len=0 TSval=1294057569 TSecr=887607488"
68,21.850823,192.168.11.44,192.168.11.43,TCP,66,0.006253,,,54668  >  6000 [ACK] Seq=29 Ack=2 Win=64256 Len=0 TSval=887607496 TSecr=1294057569
69,28.969054,192.168.11.43,192.168.11.24,TCP,74,7.118231,,,38654  >  6000 [SYN] Seq=0 Win=64240 Len=0 MSS=1460 SACK_PERM TSval=193302117 TSecr=0 WS=128
70,28.975838,192.168.11.24,192.168.11.43,TCP,74,0.006784,,,"6000  >  38654 [SYN, ACK] Seq=0 Ack=1 Win=65160 Len=0 MSS=1460 SACK_PERM TSval=2888976823 TSecr=193302117 WS=128"
71,28.975941,192.168.11.43,192.168.11.24,TCP,66,0.000103,,,38654  >  6000 [ACK] Seq=1 Ack=1 Win=64256 Len=0 TSval=193302124 TSecr=2888976823
72,28.976102,192.168.11.43,192.168.11.24,TCP,93,0.000161,,,"38654  >  6000 [PSH, ACK] Seq=1 Ack=1 Win=64256 Len=27 TSval=193302124 TSecr=2888976823 [TCP segment of a reassembled PDU]"
73,28.976192,192.168.11.43,192.168.11.24,TCP,66,0.00009,,,"38654  >  6000 [FIN, ACK] Seq=28 Ack=1 Win=64256 Len=0 TSval=193302124 TSecr=2888976823"
74,28.982985,192.168.11.24,192.168.11.43,TCP,66,0.006793,,,6000  >  38654 [ACK] Seq=1 Ack=28 Win=65152 Len=0 TSval=2888976830 TSecr=193302124
75,28.983343,192.168.11.24,192.168.11.43,TCP,66,0.000358,,,"6000  >  38654 [FIN, ACK] Seq=1 Ack=29 Win=65152 Len=0 TSval=2888976831 TSecr=193302124"
76,28.983384,192.168.11.43,192.168.11.24,TCP,66,0.000041,,,38654  >  6000 [ACK] Seq=29 Ack=2 Win=64256 Len=0 TSval=193302131 TSecr=2888976831
77,29.012455,192.168.11.43,255.255.255.255,UDP,209,0.029071,Ÿ,7b2273656d616e74696373223a207b22656e74697479223a2022504944222c202262617365656e74697479223a2022616e79222c2022726f6c65223a2022303033222c20227370617469616c223a2022616e79222c202274656d706f72616c223a2022616e79227d2c20226461746170726f7065727479223a207b22666f726d6174223a2022696e616f6b615f70726f6772616d5f73616d706c655f73656d616e746963227d7d,45159  >  7000 Len=167
78,29.021216,192.168.11.44,192.168.11.43,TCP,74,0.008761,œ,,54684  >  6000 [SYN] Seq=0 Win=64240 Len=0 MSS=1460 SACK_PERM TSval=887614665 TSecr=0 WS=128
79,29.021367,192.168.11.43,192.168.11.44,TCP,74,0.000151,,,"6000  >  54684 [SYN, ACK] Seq=0 Ack=1 Win=65160 Len=0 MSS=1460 SACK_PERM TSval=1294064745 TSecr=887614665 WS=128"
80,29.028428,192.168.11.44,192.168.11.43,TCP,66,0.007061,,,54684  >  6000 [ACK] Seq=1 Ack=1 Win=64256 Len=0 TSval=887614673 TSecr=1294064745
81,29.029016,192.168.11.44,192.168.11.43,TCP,93,0.000588,,,"54684  >  6000 [PSH, ACK] Seq=1 Ack=1 Win=64256 Len=27 TSval=887614673 TSecr=1294064745 [TCP segment of a reassembled PDU]"
82,29.029098,192.168.11.43,192.168.11.44,TCP,66,0.000082,,,6000  >  54684 [ACK] Seq=1 Ack=28 Win=65152 Len=0 TSval=1294064753 TSecr=887614673
83,29.029163,192.168.11.44,192.168.11.43,TCP,66,0.000065,,,"54684  >  6000 [FIN, ACK] Seq=28 Ack=1 Win=64256 Len=0 TSval=887614673 TSecr=1294064745"
84,29.030237,192.168.11.43,192.168.11.44,TCP,66,0.001074,,,"6000  >  54684 [FIN, ACK] Seq=1 Ack=29 Win=65152 Len=0 TSval=1294064754 TSecr=887614673"
85,29.036321,192.168.11.44,192.168.11.43,TCP,66,0.006084,,,54684  >  6000 [ACK] Seq=29 Ack=2 Win=64256 Len=0 TSval=887614681 TSecr=1294064754
86,36.133688,192.168.11.43,192.168.11.24,TCP,74,7.097367,,,39292  >  6000 [SYN] Seq=0 Win=64240 Len=0 MSS=1460 SACK_PERM TSval=193309282 TSecr=0 WS=128
87,36.140673,192.168.11.24,192.168.11.43,TCP,74,0.006985,,,"6000  >  39292 [SYN, ACK] Seq=0 Ack=1 Win=65160 Len=0 MSS=1460 SACK_PERM TSval=2888983987 TSecr=193309282 WS=128"
88,36.140774,192.168.11.43,192.168.11.24,TCP,66,0.000101,,,39292  >  6000 [ACK] Seq=1 Ack=1 Win=64256 Len=0 TSval=193309289 TSecr=2888983987
89,36.140907,192.168.11.43,192.168.11.24,TCP,93,0.000133,,,"39292  >  6000 [PSH, ACK] Seq=1 Ack=1 Win=64256 Len=27 TSval=193309289 TSecr=2888983987 [TCP segment of a reassembled PDU]"
90,36.141018,192.168.11.43,192.168.11.24,TCP,66,0.000111,,,"39292  >  6000 [FIN, ACK] Seq=28 Ack=1 Win=64256 Len=0 TSval=193309289 TSecr=2888983987"
91,36.148013,192.168.11.24,192.168.11.43,TCP,66,0.006995,,,6000  >  39292 [ACK] Seq=1 Ack=28 Win=65152 Len=0 TSval=2888983994 TSecr=193309289
92,36.148378,192.168.11.24,192.168.11.43,TCP,66,0.000365,,,"6000  >  39292 [FIN, ACK] Seq=1 Ack=29 Win=65152 Len=0 TSval=2888983995 TSecr=193309289"
93,36.148421,192.168.11.43,192.168.11.24,TCP,66,0.000043,,,39292  >  6000 [ACK] Seq=29 Ack=2 Win=64256 Len=0 TSval=193309296 TSecr=2888983995
94,36.176437,192.168.11.43,255.255.255.255,UDP,209,0.028016,Ÿ,7b2273656d616e74696373223a207b22656e74697479223a2022504944222c202262617365656e74697479223a2022616e79222c2022726f6c65223a2022303033222c20227370617469616c223a2022616e79222c202274656d706f72616c223a2022616e79227d2c20226461746170726f7065727479223a207b22666f726d6174223a2022696e616f6b615f70726f6772616d5f73616d706c655f73656d616e746963227d7d,56697  >  7000 Len=167
95,36.184524,192.168.11.44,192.168.11.43,TCP,74,0.008087,œ,,50228  >  6000 [SYN] Seq=0 Win=64240 Len=0 MSS=1460 SACK_PERM TSval=887621830 TSecr=0 WS=128
96,36.184643,192.168.11.43,192.168.11.44,TCP,74,0.000119,,,"6000  >  50228 [SYN, ACK] Seq=0 Ack=1 Win=65160 Len=0 MSS=1460 SACK_PERM TSval=1294071909 TSecr=887621830 WS=128"
97,36.19129,192.168.11.44,192.168.11.43,TCP,66,0.006647,,,50228  >  6000 [ACK] Seq=1 Ack=1 Win=64256 Len=0 TSval=887621837 TSecr=1294071909
98,36.191966,192.168.11.44,192.168.11.43,TCP,93,0.000676,,,"50228  >  6000 [PSH, ACK] Seq=1 Ack=1 Win=64256 Len=27 TSval=887621837 TSecr=1294071909 [TCP segment of a reassembled PDU]"
99,36.192059,192.168.11.43,192.168.11.44,TCP,66,0.000093,,,6000  >  50228 [ACK] Seq=1 Ack=28 Win=65152 Len=0 TSval=1294071916 TSecr=887621837
100,36.192127,192.168.11.44,192.168.11.43,TCP,66,0.000068,,,"50228  >  6000 [FIN, ACK] Seq=28 Ack=1 Win=64256 Len=0 TSval=887621837 TSecr=1294071909"
101,36.193314,192.168.11.43,192.168.11.44,TCP,66,0.001187,,,"6000  >  50228 [FIN, ACK] Seq=1 Ack=29 Win=65152 Len=0 TSval=1294071917 TSecr=887621837"
102,36.199592,192.168.11.44,192.168.11.43,TCP,66,0.006278,,,50228  >  6000 [ACK] Seq=29 Ack=2 Win=64256 Len=0 TSval=887621844 TSecr=1294071917
103,43.3784,192.168.11.43,192.168.11.24,TCP,74,7.178808,,,39294  >  6000 [SYN] Seq=0 Win=64240 Len=0 MSS=1460 SACK_PERM TSval=193316526 TSecr=0 WS=128
104,43.385114,192.168.11.24,192.168.11.43,TCP,74,0.006714,,,"6000  >  39294 [SYN, ACK] Seq=0 Ack=1 Win=65160 Len=0 MSS=1460 SACK_PERM TSval=2888991231 TSecr=193316526 WS=128"
105,43.385209,192.168.11.43,192.168.11.24,TCP,66,0.000095,,,39294  >  6000 [ACK] Seq=1 Ack=1 Win=64256 Len=0 TSval=193316533 TSecr=2888991231
106,43.385336,192.168.11.43,192.168.11.24,TCP,93,0.000127,,,"39294  >  6000 [PSH, ACK] Seq=1 Ack=1 Win=64256 Len=27 TSval=193316533 TSecr=2888991231 [TCP segment of a reassembled PDU]"
107,43.385455,192.168.11.43,192.168.11.24,TCP,66,0.000119,,,"39294  >  6000 [FIN, ACK] Seq=28 Ack=1 Win=64256 Len=0 TSval=193316533 TSecr=2888991231"
108,43.392797,192.168.11.24,192.168.11.43,TCP,66,0.007342,,,6000  >  39294 [ACK] Seq=1 Ack=28 Win=65152 Len=0 TSval=2888991239 TSecr=193316533
109,43.393174,192.168.11.24,192.168.11.43,TCP,66,0.000377,,,"6000  >  39294 [FIN, ACK] Seq=1 Ack=29 Win=65152 Len=0 TSval=2888991240 TSecr=193316533"
110,43.393233,192.168.11.43,192.168.11.24,TCP,66,0.000059,,,39294  >  6000 [ACK] Seq=29 Ack=2 Win=64256 Len=0 TSval=193316541 TSecr=2888991240
111,43.424583,192.168.11.43,255.255.255.255,UDP,209,0.03135,Ÿ,7b2273656d616e74696373223a207b22656e74697479223a2022504944222c202262617365656e74697479223a2022616e79222c2022726f6c65223a2022303033222c20227370617469616c223a2022616e79222c202274656d706f72616c223a2022616e79227d2c20226461746170726f7065727479223a207b22666f726d6174223a2022696e616f6b615f70726f6772616d5f73616d706c655f73656d616e746963227d7d,38270  >  7000 Len=167
112,43.432217,192.168.11.44,192.168.11.43,TCP,74,0.007634,œ,,33886  >  6000 [SYN] Seq=0 Win=64240 Len=0 MSS=1460 SACK_PERM TSval=887629078 TSecr=0 WS=128
113,43.432327,192.168.11.43,192.168.11.44,TCP,74,0.00011,,,"6000  >  33886 [SYN, ACK] Seq=0 Ack=1 Win=65160 Len=0 MSS=1460 SACK_PERM TSval=1294079156 TSecr=887629078 WS=128"
114,43.438677,192.168.11.44,192.168.11.43,TCP,66,0.00635,,,33886  >  6000 [ACK] Seq=1 Ack=1 Win=64256 Len=0 TSval=887629084 TSecr=1294079156
115,43.43913,192.168.11.44,192.168.11.43,TCP,93,0.000453,,,"33886  >  6000 [PSH, ACK] Seq=1 Ack=1 Win=64256 Len=27 TSval=887629085 TSecr=1294079156 [TCP segment of a reassembled PDU]"
116,43.439202,192.168.11.43,192.168.11.44,TCP,66,0.000072,,,6000  >  33886 [ACK] Seq=1 Ack=28 Win=65152 Len=0 TSval=1294079163 TSecr=887629085
117,43.439261,192.168.11.44,192.168.11.43,TCP,66,0.000059,,,"33886  >  6000 [FIN, ACK] Seq=28 Ack=1 Win=64256 Len=0 TSval=887629085 TSecr=1294079156"
118,43.440251,192.168.11.43,192.168.11.44,TCP,66,0.00099,,,"6000  >  33886 [FIN, ACK] Seq=1 Ack=29 Win=65152 Len=0 TSval=1294079164 TSecr=887629085"
119,43.446966,192.168.11.44,192.168.11.43,TCP,66,0.006715,,,33886  >  6000 [ACK] Seq=29 Ack=2 Win=64256 Len=0 TSval=887629092 TSecr=1294079164
120,50.543979,192.168.11.43,192.168.11.24,TCP,74,7.097013,,,59850  >  6000 [SYN] Seq=0 Win=64240 Len=0 MSS=1460 SACK_PERM TSval=193323692 TSecr=0 WS=128
121,50.550638,192.168.11.24,192.168.11.43,TCP,74,0.006659,,,"6000  >  59850 [SYN, ACK] Seq=0 Ack=1 Win=65160 Len=0 MSS=1460 SACK_PERM TSval=2888998397 TSecr=193323692 WS=128"
122,50.550756,192.168.11.43,192.168.11.24,TCP,66,0.000118,,,59850  >  6000 [ACK] Seq=1 Ack=1 Win=64256 Len=0 TSval=193323699 TSecr=2888998397
123,50.551012,192.168.11.43,192.168.11.24,TCP,93,0.000256,,,"59850  >  6000 [PSH, ACK] Seq=1 Ack=1 Win=64256 Len=27 TSval=193323699 TSecr=2888998397 [TCP segment of a reassembled PDU]"
124,50.551132,192.168.11.43,192.168.11.24,TCP,66,0.00012,,,"59850  >  6000 [FIN, ACK] Seq=28 Ack=1 Win=64256 Len=0 TSval=193323699 TSecr=2888998397"
125,50.558098,192.168.11.24,192.168.11.43,TCP,66,0.006966,,,6000  >  59850 [ACK] Seq=1 Ack=28 Win=65152 Len=0 TSval=2888998404 TSecr=193323699
126,50.558318,192.168.11.24,192.168.11.43,TCP,66,0.00022,,,"6000  >  59850 [FIN, ACK] Seq=1 Ack=29 Win=65152 Len=0 TSval=2888998405 TSecr=193323699"
127,50.55837,192.168.11.43,192.168.11.24,TCP,66,0.000052,,,59850  >  6000 [ACK] Seq=29 Ack=2 Win=64256 Len=0 TSval=193323706 TSecr=2888998405
128,50.588881,192.168.11.43,255.255.255.255,UDP,209,0.030511,Ÿ,7b2273656d616e74696373223a207b22656e74697479223a2022504944222c202262617365656e74697479223a2022616e79222c2022726f6c65223a2022303033222c20227370617469616c223a2022616e79222c202274656d706f72616c223a2022616e79227d2c20226461746170726f7065727479223a207b22666f726d6174223a2022696e616f6b615f70726f6772616d5f73616d706c655f73656d616e746963227d7d,60872  >  7000 Len=167
129,50.596953,192.168.11.44,192.168.11.43,TCP,74,0.008072,œ,,50566  >  6000 [SYN] Seq=0 Win=64240 Len=0 MSS=1460 SACK_PERM TSval=887636243 TSecr=0 WS=128
130,50.597099,192.168.11.43,192.168.11.44,TCP,74,0.000146,,,"6000  >  50566 [SYN, ACK] Seq=0 Ack=1 Win=65160 Len=0 MSS=1460 SACK_PERM TSval=1294086321 TSecr=887636243 WS=128"
131,50.603854,192.168.11.44,192.168.11.43,TCP,66,0.006755,,,50566  >  6000 [ACK] Seq=1 Ack=1 Win=64256 Len=0 TSval=887636250 TSecr=1294086321
132,50.604362,192.168.11.44,192.168.11.43,TCP,93,0.000508,,,"50566  >  6000 [PSH, ACK] Seq=1 Ack=1 Win=64256 Len=27 TSval=887636250 TSecr=1294086321 [TCP segment of a reassembled PDU]"
133,50.604454,192.168.11.43,192.168.11.44,TCP,66,0.000092,,,6000  >  50566 [ACK] Seq=1 Ack=28 Win=65152 Len=0 TSval=1294086328 TSecr=887636250
134,50.604522,192.168.11.44,192.168.11.43,TCP,66,0.000068,,,"50566  >  6000 [FIN, ACK] Seq=28 Ack=1 Win=64256 Len=0 TSval=887636250 TSecr=1294086321"
135,50.605572,192.168.11.43,192.168.11.44,TCP,66,0.00105,,,"6000  >  50566 [FIN, ACK] Seq=1 Ack=29 Win=65152 Len=0 TSval=1294086330 TSecr=887636250"
136,50.611758,192.168.11.44,192.168.11.43,TCP,66,0.006186,,,50566  >  6000 [ACK] Seq=29 Ack=2 Win=64256 Len=0 TSval=887636257 TSecr=1294086330
137,57.68625,192.168.11.43,192.168.11.24,TCP,74,7.074492,,,52150  >  6000 [SYN] Seq=0 Win=64240 Len=0 MSS=1460 SACK_PERM TSval=193330834 TSecr=0 WS=128
138,57.693198,192.168.11.24,192.168.11.43,TCP,74,0.006948,,,"6000  >  52150 [SYN, ACK] Seq=0 Ack=1 Win=65160 Len=0 MSS=1460 SACK_PERM TSval=2889005539 TSecr=193330834 WS=128"
139,57.693316,192.168.11.43,192.168.11.24,TCP,66,0.000118,,,52150  >  6000 [ACK] Seq=1 Ack=1 Win=64256 Len=0 TSval=193330841 TSecr=2889005539
140,57.693544,192.168.11.43,192.168.11.24,TCP,93,0.000228,,,"52150  >  6000 [PSH, ACK] Seq=1 Ack=1 Win=64256 Len=27 TSval=193330842 TSecr=2889005539 [TCP segment of a reassembled PDU]"
141,57.693648,192.168.11.43,192.168.11.24,TCP,66,0.000104,,,"52150  >  6000 [FIN, ACK] Seq=28 Ack=1 Win=64256 Len=0 TSval=193330842 TSecr=2889005539"
142,57.700347,192.168.11.24,192.168.11.43,TCP,66,0.006699,,,6000  >  52150 [ACK] Seq=1 Ack=28 Win=65152 Len=0 TSval=2889005546 TSecr=193330842
143,57.700721,192.168.11.24,192.168.11.43,TCP,66,0.000374,,,"6000  >  52150 [FIN, ACK] Seq=1 Ack=29 Win=65152 Len=0 TSval=2889005547 TSecr=193330842"
144,57.700778,192.168.11.43,192.168.11.24,TCP,66,0.000057,,,52150  >  6000 [ACK] Seq=29 Ack=2 Win=64256 Len=0 TSval=193330849 TSecr=2889005547
145,57.7297,192.168.11.43,255.255.255.255,UDP,209,0.028922,Ÿ,7b2273656d616e74696373223a207b22656e74697479223a2022504944222c202262617365656e74697479223a2022616e79222c2022726f6c65223a2022303033222c20227370617469616c223a2022616e79222c202274656d706f72616c223a2022616e79227d2c20226461746170726f7065727479223a207b22666f726d6174223a2022696e616f6b615f70726f6772616d5f73616d706c655f73656d616e746963227d7d,33428  >  7000 Len=167
146,57.74004,192.168.11.44,192.168.11.43,TCP,74,0.01034,œ,,50568  >  6000 [SYN] Seq=0 Win=64240 Len=0 MSS=1460 SACK_PERM TSval=887643386 TSecr=0 WS=128
147,57.740175,192.168.11.43,192.168.11.44,TCP,74,0.000135,,,"6000  >  50568 [SYN, ACK] Seq=0 Ack=1 Win=65160 Len=0 MSS=1460 SACK_PERM TSval=1294093464 TSecr=887643386 WS=128"
148,57.746686,192.168.11.44,192.168.11.43,TCP,66,0.006511,,,50568  >  6000 [ACK] Seq=1 Ack=1 Win=64256 Len=0 TSval=887643393 TSecr=1294093464
149,57.747197,192.168.11.44,192.168.11.43,TCP,93,0.000511,,,"50568  >  6000 [PSH, ACK] Seq=1 Ack=1 Win=64256 Len=27 TSval=887643393 TSecr=1294093464 [TCP segment of a reassembled PDU]"
150,57.747261,192.168.11.43,192.168.11.44,TCP,66,0.000064,,,6000  >  50568 [ACK] Seq=1 Ack=28 Win=65152 Len=0 TSval=1294093471 TSecr=887643393
151,57.747325,192.168.11.44,192.168.11.43,TCP,66,0.000064,,,"50568  >  6000 [FIN, ACK] Seq=28 Ack=1 Win=64256 Len=0 TSval=887643393 TSecr=1294093464"
152,57.748612,192.168.11.43,192.168.11.44,TCP,66,0.001287,,,"6000  >  50568 [FIN, ACK] Seq=1 Ack=29 Win=65152 Len=0 TSval=1294093473 TSecr=887643393"
153,57.755007,192.168.11.44,192.168.11.43,TCP,66,0.006395,,,50568  >  6000 [ACK] Seq=29 Ack=2 Win=64256 Len=0 TSval=887643401 TSecr=1294093473
154,64.830119,192.168.11.43,192.168.11.24,TCP,74,7.075112,,,42752  >  6000 [SYN] Seq=0 Win=64240 Len=0 MSS=1460 SACK_PERM TSval=193337978 TSecr=0 WS=128
155,64.836764,192.168.11.24,192.168.11.43,TCP,74,0.006645,,,"6000  >  42752 [SYN, ACK] Seq=0 Ack=1 Win=65160 Len=0 MSS=1460 SACK_PERM TSval=2889012682 TSecr=193337978 WS=128"
156,64.836879,192.168.11.43,192.168.11.24,TCP,66,0.000115,,,42752  >  6000 [ACK] Seq=1 Ack=1 Win=64256 Len=0 TSval=193337985 TSecr=2889012682
157,64.837053,192.168.11.43,192.168.11.24,TCP,93,0.000174,,,"42752  >  6000 [PSH, ACK] Seq=1 Ack=1 Win=64256 Len=27 TSval=193337985 TSecr=2889012682 [TCP segment of a reassembled PDU]"
158,64.837142,192.168.11.43,192.168.11.24,TCP,66,0.000089,,,"42752  >  6000 [FIN, ACK] Seq=28 Ack=1 Win=64256 Len=0 TSval=193337985 TSecr=2889012682"
159,64.844276,192.168.11.24,192.168.11.43,TCP,66,0.007134,,,6000  >  42752 [ACK] Seq=1 Ack=28 Win=65152 Len=0 TSval=2889012690 TSecr=193337985
160,64.844517,192.168.11.24,192.168.11.43,TCP,66,0.000241,,,"6000  >  42752 [FIN, ACK] Seq=1 Ack=29 Win=65152 Len=0 TSval=2889012692 TSecr=193337985"
161,64.844586,192.168.11.43,192.168.11.24,TCP,66,0.000069,,,42752  >  6000 [ACK] Seq=29 Ack=2 Win=64256 Len=0 TSval=193337993 TSecr=2889012692
162,64.87613,192.168.11.43,255.255.255.255,UDP,209,0.031544,Ÿ,7b2273656d616e74696373223a207b22656e74697479223a2022504944222c202262617365656e74697479223a2022616e79222c2022726f6c65223a2022303033222c20227370617469616c223a2022616e79222c202274656d706f72616c223a2022616e79227d2c20226461746170726f7065727479223a207b22666f726d6174223a2022696e616f6b615f70726f6772616d5f73616d706c655f73656d616e746963227d7d,56835  >  7000 Len=167
163,64.883784,192.168.11.44,192.168.11.43,TCP,74,0.007654,œ,,57582  >  6000 [SYN] Seq=0 Win=64240 Len=0 MSS=1460 SACK_PERM TSval=887650530 TSecr=0 WS=128
164,64.883935,192.168.11.43,192.168.11.44,TCP,74,0.000151,,,"6000  >  57582 [SYN, ACK] Seq=0 Ack=1 Win=65160 Len=0 MSS=1460 SACK_PERM TSval=1294100608 TSecr=887650530 WS=128"
165,64.890648,192.168.11.44,192.168.11.43,TCP,66,0.006713,,,57582  >  6000 [ACK] Seq=1 Ack=1 Win=64256 Len=0 TSval=887650537 TSecr=1294100608
166,64.891167,192.168.11.44,192.168.11.43,TCP,93,0.000519,,,"57582  >  6000 [PSH, ACK] Seq=1 Ack=1 Win=64256 Len=27 TSval=887650537 TSecr=1294100608 [TCP segment of a reassembled PDU]"
167,64.891249,192.168.11.43,192.168.11.44,TCP,66,0.000082,,,6000  >  57582 [ACK] Seq=1 Ack=28 Win=65152 Len=0 TSval=1294100615 TSecr=887650537
168,64.891315,192.168.11.44,192.168.11.43,TCP,66,0.000066,,,"57582  >  6000 [FIN, ACK] Seq=28 Ack=1 Win=64256 Len=0 TSval=887650537 TSecr=1294100608"
169,64.89243,192.168.11.43,192.168.11.44,TCP,66,0.001115,,,"6000  >  57582 [FIN, ACK] Seq=1 Ack=29 Win=65152 Len=0 TSval=1294100616 TSecr=887650537"
170,64.898979,192.168.11.44,192.168.11.43,TCP,66,0.006549,,,57582  >  6000 [ACK] Seq=29 Ack=2 Win=64256 Len=0 TSval=887650545 TSecr=1294100616
171,110.505977,192.168.11.43,192.168.11.24,TCP,74,45.606998,,,35836  >  6000 [SYN] Seq=0 Win=64240 Len=0 MSS=1460 SACK_PERM TSval=193383654 TSecr=0 WS=128
172,110.512813,192.168.11.24,192.168.11.43,TCP,74,0.006836,,,"6000  >  35836 [SYN, ACK] Seq=0 Ack=1 Win=65160 Len=0 MSS=1460 SACK_PERM TSval=2889058357 TSecr=193383654 WS=128"
173,110.512918,192.168.11.43,192.168.11.24,TCP,66,0.000105,,,35836  >  6000 [ACK] Seq=1 Ack=1 Win=64256 Len=0 TSval=193383661 TSecr=2889058357
174,110.513107,192.168.11.43,192.168.11.24,TCP,93,0.000189,,,"35836  >  6000 [PSH, ACK] Seq=1 Ack=1 Win=64256 Len=27 TSval=193383661 TSecr=2889058357 [TCP segment of a reassembled PDU]"
175,110.513197,192.168.11.43,192.168.11.24,TCP,66,0.00009,,,"35836  >  6000 [FIN, ACK] Seq=28 Ack=1 Win=64256 Len=0 TSval=193383661 TSecr=2889058357"
176,110.520336,192.168.11.24,192.168.11.43,TCP,66,0.007139,,,6000  >  35836 [ACK] Seq=1 Ack=28 Win=65152 Len=0 TSval=2889058364 TSecr=193383661
177,110.522322,192.168.11.24,192.168.11.43,TCP,66,0.001986,,,"6000  >  35836 [FIN, ACK] Seq=1 Ack=29 Win=65152 Len=0 TSval=2889058365 TSecr=193383661"
178,110.522365,192.168.11.43,192.168.11.24,TCP,66,0.000043,,,35836  >  6000 [ACK] Seq=29 Ack=2 Win=64256 Len=0 TSval=193383670 TSecr=2889058365
179,110.549801,192.168.11.43,255.255.255.255,UDP,209,0.027436,Ÿ,7b2273656d616e74696373223a207b22656e74697479223a2022504944222c202262617365656e74697479223a2022616e79222c2022726f6c65223a2022303033222c20227370617469616c223a2022616e79222c202274656d706f72616c223a2022616e79227d2c20226461746170726f7065727479223a207b22666f726d6174223a2022696e616f6b615f70726f6772616d5f73616d706c655f73656d616e746963227d7d,37494  >  7000 Len=167
180,110.557464,192.168.11.44,192.168.11.43,TCP,74,0.007663,œ,,59772  >  6000 [SYN] Seq=0 Win=64240 Len=0 MSS=1460 SACK_PERM TSval=887696205 TSecr=0 WS=128
181,110.557604,192.168.11.43,192.168.11.44,TCP,74,0.00014,,,"6000  >  59772 [SYN, ACK] Seq=0 Ack=1 Win=65160 Len=0 MSS=1460 SACK_PERM TSval=1294146282 TSecr=887696205 WS=128"
182,110.5642,192.168.11.44,192.168.11.43,TCP,66,0.006596,,,59772  >  6000 [ACK] Seq=1 Ack=1 Win=64256 Len=0 TSval=887696212 TSecr=1294146282
183,110.564712,192.168.11.44,192.168.11.43,TCP,93,0.000512,,,"59772  >  6000 [PSH, ACK] Seq=1 Ack=1 Win=64256 Len=27 TSval=887696213 TSecr=1294146282 [TCP segment of a reassembled PDU]"
184,110.564778,192.168.11.43,192.168.11.44,TCP,66,0.000066,,,6000  >  59772 [ACK] Seq=1 Ack=28 Win=65152 Len=0 TSval=1294146289 TSecr=887696213
185,110.564841,192.168.11.44,192.168.11.43,TCP,66,0.000063,,,"59772  >  6000 [FIN, ACK] Seq=28 Ack=1 Win=64256 Len=0 TSval=887696213 TSecr=1294146282"
186,110.565803,192.168.11.43,192.168.11.44,TCP,66,0.000962,,,"6000  >  59772 [FIN, ACK] Seq=1 Ack=29 Win=65152 Len=0 TSval=1294146290 TSecr=887696213"
187,110.57234,192.168.11.44,192.168.11.43,TCP,66,0.006537,,,59772  >  6000 [ACK] Seq=29 Ack=2 Win=64256 Len=0 TSval=887696220 TSecr=1294146290
188,117.689725,192.168.11.43,192.168.11.24,TCP,74,7.117385,,,51498  >  6000 [SYN] Seq=0 Win=64240 Len=0 MSS=1460 SACK_PERM TSval=193390838 TSecr=0 WS=128
189,117.696255,192.168.11.24,192.168.11.43,TCP,74,0.00653,,,"6000  >  51498 [SYN, ACK] Seq=0 Ack=1 Win=65160 Len=0 MSS=1460 SACK_PERM TSval=2889065540 TSecr=193390838 WS=128"
190,117.696354,192.168.11.43,192.168.11.24,TCP,66,0.000099,,,51498  >  6000 [ACK] Seq=1 Ack=1 Win=64256 Len=0 TSval=193390844 TSecr=2889065540
191,117.696514,192.168.11.43,192.168.11.24,TCP,93,0.00016,,,"51498  >  6000 [PSH, ACK] Seq=1 Ack=1 Win=64256 Len=27 TSval=193390845 TSecr=2889065540 [TCP segment of a reassembled PDU]"
192,117.696633,192.168.11.43,192.168.11.24,TCP,66,0.000119,,,"51498  >  6000 [FIN, ACK] Seq=28 Ack=1 Win=64256 Len=0 TSval=193390845 TSecr=2889065540"
193,117.704403,192.168.11.24,192.168.11.43,TCP,66,0.00777,,,6000  >  51498 [ACK] Seq=1 Ack=28 Win=65152 Len=0 TSval=2889065548 TSecr=193390845
194,117.704773,192.168.11.24,192.168.11.43,TCP,66,0.00037,,,"6000  >  51498 [FIN, ACK] Seq=1 Ack=29 Win=65152 Len=0 TSval=2889065549 TSecr=193390845"
195,117.704815,192.168.11.43,192.168.11.24,TCP,66,0.000042,,,51498  >  6000 [ACK] Seq=29 Ack=2 Win=64256 Len=0 TSval=193390853 TSecr=2889065549
196,117.732192,192.168.11.43,255.255.255.255,UDP,209,0.027377,Ÿ,7b2273656d616e74696373223a207b22656e74697479223a2022504944222c202262617365656e74697479223a2022616e79222c2022726f6c65223a2022303033222c20227370617469616c223a2022616e79222c202274656d706f72616c223a2022616e79227d2c20226461746170726f7065727479223a207b22666f726d6174223a2022696e616f6b615f70726f6772616d5f73616d706c655f73656d616e746963227d7d,47092  >  7000 Len=167
197,117.740219,192.168.11.44,192.168.11.43,TCP,74,0.008027,œ,,59782  >  6000 [SYN] Seq=0 Win=64240 Len=0 MSS=1460 SACK_PERM TSval=887703388 TSecr=0 WS=128
198,117.740366,192.168.11.43,192.168.11.44,TCP,74,0.000147,,,"6000  >  59782 [SYN, ACK] Seq=0 Ack=1 Win=65160 Len=0 MSS=1460 SACK_PERM TSval=1294153464 TSecr=887703388 WS=128"
199,117.74702,192.168.11.44,192.168.11.43,TCP,66,0.006654,,,59782  >  6000 [ACK] Seq=1 Ack=1 Win=64256 Len=0 TSval=887703395 TSecr=1294153464
200,117.747698,192.168.11.44,192.168.11.43,TCP,93,0.000678,,,"59782  >  6000 [PSH, ACK] Seq=1 Ack=1 Win=64256 Len=27 TSval=887703395 TSecr=1294153464 [TCP segment of a reassembled PDU]"
201,117.74778,192.168.11.43,192.168.11.44,TCP,66,0.000082,,,6000  >  59782 [ACK] Seq=1 Ack=28 Win=65152 Len=0 TSval=1294153472 TSecr=887703395
202,117.747862,192.168.11.44,192.168.11.43,TCP,66,0.000082,,,"59782  >  6000 [FIN, ACK] Seq=28 Ack=1 Win=64256 Len=0 TSval=887703396 TSecr=1294153464"
203,117.749655,192.168.11.43,192.168.11.44,TCP,66,0.001793,,,"6000  >  59782 [FIN, ACK] Seq=1 Ack=29 Win=65152 Len=0 TSval=1294153474 TSecr=887703396"
204,117.754347,192.168.11.44,192.168.11.43,TCP,66,0.004692,,,59782  >  6000 [ACK] Seq=29 Ack=2 Win=64256 Len=0 TSval=887703403 TSecr=1294153474
205,124.9205,192.168.11.43,192.168.11.24,TCP,74,7.166153,,,48120  >  6000 [SYN] Seq=0 Win=64240 Len=0 MSS=1460 SACK_PERM TSval=193398068 TSecr=0 WS=128
206,124.92715,192.168.11.24,192.168.11.43,TCP,74,0.00665,,,"6000  >  48120 [SYN, ACK] Seq=0 Ack=1 Win=65160 Len=0 MSS=1460 SACK_PERM TSval=2889072771 TSecr=193398068 WS=128"
207,124.927245,192.168.11.43,192.168.11.24,TCP,66,0.000095,,,48120  >  6000 [ACK] Seq=1 Ack=1 Win=64256 Len=0 TSval=193398075 TSecr=2889072771
208,124.927399,192.168.11.43,192.168.11.24,TCP,93,0.000154,,,"48120  >  6000 [PSH, ACK] Seq=1 Ack=1 Win=64256 Len=27 TSval=193398075 TSecr=2889072771 [TCP segment of a reassembled PDU]"
209,124.927534,192.168.11.43,192.168.11.24,TCP,66,0.000135,,,"48120  >  6000 [FIN, ACK] Seq=28 Ack=1 Win=64256 Len=0 TSval=193398076 TSecr=2889072771"
210,124.934396,192.168.11.24,192.168.11.43,TCP,66,0.006862,,,6000  >  48120 [ACK] Seq=1 Ack=28 Win=65152 Len=0 TSval=2889072778 TSecr=193398075
211,124.934747,192.168.11.24,192.168.11.43,TCP,66,0.000351,,,"6000  >  48120 [FIN, ACK] Seq=1 Ack=29 Win=65152 Len=0 TSval=2889072779 TSecr=193398076"
212,124.934789,192.168.11.43,192.168.11.24,TCP,66,0.000042,,,48120  >  6000 [ACK] Seq=29 Ack=2 Win=64256 Len=0 TSval=193398083 TSecr=2889072779
213,124.961973,192.168.11.43,255.255.255.255,UDP,209,0.027184,Ÿ,7b2273656d616e74696373223a207b22656e74697479223a2022504944222c202262617365656e74697479223a2022616e79222c2022726f6c65223a2022303033222c20227370617469616c223a2022616e79222c202274656d706f72616c223a2022616e79227d2c20226461746170726f7065727479223a207b22666f726d6174223a2022696e616f6b615f70726f6772616d5f73616d706c655f73656d616e746963227d7d,41705  >  7000 Len=167
214,124.969971,192.168.11.44,192.168.11.43,TCP,74,0.007998,œ,,36816  >  6000 [SYN] Seq=0 Win=64240 Len=0 MSS=1460 SACK_PERM TSval=887710618 TSecr=0 WS=128
215,124.970102,192.168.11.43,192.168.11.44,TCP,74,0.000131,,,"6000  >  36816 [SYN, ACK] Seq=0 Ack=1 Win=65160 Len=0 MSS=1460 SACK_PERM TSval=1294160694 TSecr=887710618 WS=128"
216,124.978088,192.168.11.44,192.168.11.43,TCP,66,0.007986,,,36816  >  6000 [ACK] Seq=1 Ack=1 Win=64256 Len=0 TSval=887710626 TSecr=1294160694
217,124.978661,192.168.11.44,192.168.11.43,TCP,93,0.000573,,,"36816  >  6000 [PSH, ACK] Seq=1 Ack=1 Win=64256 Len=27 TSval=887710627 TSecr=1294160694 [TCP segment of a reassembled PDU]"
218,124.978749,192.168.11.43,192.168.11.44,TCP,66,0.000088,,,6000  >  36816 [ACK] Seq=1 Ack=28 Win=65152 Len=0 TSval=1294160703 TSecr=887710627
219,124.978819,192.168.11.44,192.168.11.43,TCP,66,0.00007,,,"36816  >  6000 [FIN, ACK] Seq=28 Ack=1 Win=64256 Len=0 TSval=887710627 TSecr=1294160694"
220,124.980743,192.168.11.43,192.168.11.44,TCP,66,0.001924,,,"6000  >  36816 [FIN, ACK] Seq=1 Ack=29 Win=65152 Len=0 TSval=1294160705 TSecr=887710627"
221,124.987799,192.168.11.44,192.168.11.43,TCP,66,0.007056,,,36816  >  6000 [ACK] Seq=29 Ack=2 Win=64256 Len=0 TSval=887710636 TSecr=1294160705
222,132.080187,192.168.11.43,192.168.11.24,TCP,74,7.092388,,,48124  >  6000 [SYN] Seq=0 Win=64240 Len=0 MSS=1460 SACK_PERM TSval=193405228 TSecr=0 WS=128
223,132.086794,192.168.11.24,192.168.11.43,TCP,74,0.006607,,,"6000  >  48124 [SYN, ACK] Seq=0 Ack=1 Win=65160 Len=0 MSS=1460 SACK_PERM TSval=2889079930 TSecr=193405228 WS=128"
224,132.086898,192.168.11.43,192.168.11.24,TCP,66,0.000104,,,48124  >  6000 [ACK] Seq=1 Ack=1 Win=64256 Len=0 TSval=193405235 TSecr=2889079930
225,132.087038,192.168.11.43,192.168.11.24,TCP,93,0.00014,,,"48124  >  6000 [PSH, ACK] Seq=1 Ack=1 Win=64256 Len=27 TSval=193405235 TSecr=2889079930 [TCP segment of a reassembled PDU]"
226,132.087138,192.168.11.43,192.168.11.24,TCP,66,0.0001,,,"48124  >  6000 [FIN, ACK] Seq=28 Ack=1 Win=64256 Len=0 TSval=193405235 TSecr=2889079930"
227,132.094268,192.168.11.24,192.168.11.43,TCP,66,0.00713,,,6000  >  48124 [ACK] Seq=1 Ack=28 Win=65152 Len=0 TSval=2889079938 TSecr=193405235
228,132.094621,192.168.11.24,192.168.11.43,TCP,66,0.000353,,,"6000  >  48124 [FIN, ACK] Seq=1 Ack=29 Win=65152 Len=0 TSval=2889079939 TSecr=193405235"
229,132.094676,192.168.11.43,192.168.11.24,TCP,66,0.000055,,,48124  >  6000 [ACK] Seq=29 Ack=2 Win=64256 Len=0 TSval=193405243 TSecr=2889079939
230,132.121631,192.168.11.43,255.255.255.255,UDP,209,0.026955,Ÿ,7b2273656d616e74696373223a207b22656e74697479223a2022504944222c202262617365656e74697479223a2022616e79222c2022726f6c65223a2022303033222c20227370617469616c223a2022616e79222c202274656d706f72616c223a2022616e79227d2c20226461746170726f7065727479223a207b22666f726d6174223a2022696e616f6b615f70726f6772616d5f73616d706c655f73656d616e746963227d7d,60257  >  7000 Len=167
231,132.129171,192.168.11.44,192.168.11.43,TCP,74,0.00754,œ,,39752  >  6000 [SYN] Seq=0 Win=64240 Len=0 MSS=1460 SACK_PERM TSval=887717778 TSecr=0 WS=128
232,132.129284,192.168.11.43,192.168.11.44,TCP,74,0.000113,,,"6000  >  39752 [SYN, ACK] Seq=0 Ack=1 Win=65160 Len=0 MSS=1460 SACK_PERM TSval=1294167853 TSecr=887717778 WS=128"
