No.,Time,Source,Destination,Protocol,Length,Time delta from previous captured frame,XXX,Data,Info
1,0,192.168.11.44,192.168.11.43,TCP,74,0,,,57962  >  6000 [SYN] Seq=0 Win=64240 Len=0 MSS=1460 SACK_PERM TSval=887585698 TSecr=0 WS=128
2,0.00669,192.168.11.43,192.168.11.44,TCP,74,0.00669,,,"6000  >  57962 [SYN, ACK] Seq=0 Ack=1 Win=65160 Len=0 MSS=1460 SACK_PERM TSval=1294035782 TSecr=887585698 WS=128"
3,0.006798,192.168.11.44,192.168.11.43,TCP,66,0.000108,,,57962  >  6000 [ACK] Seq=1 Ack=1 Win=64256 Len=0 TSval=887585708 TSecr=1294035782
4,0.006994,192.168.11.44,192.168.11.43,TCP,93,0.000196,,,"57962  >  6000 [PSH, ACK] Seq=1 Ack=1 Win=64256 Len=27 TSval=887585709 TSecr=1294035782 [TCP segment of a reassembled PDU]"
5,0.007129,192.168.11.44,192.168.11.43,TCP,66,0.000135,,,"57962  >  6000 [FIN, ACK] Seq=28 Ack=1 Win=64256 Len=0 TSval=887585709 TSecr=1294035782"
6,0.014397,192.168.11.43,192.168.11.44,TCP,66,0.007268,,,6000  >  57962 [ACK] Seq=1 Ack=28 Win=65152 Len=0 TSval=1294035789 TSecr=887585709
7,0.014607,192.168.11.43,192.168.11.44,TCP,66,0.00021,,,"6000  >  57962 [FIN, ACK] Seq=1 Ack=29 Win=65152 Len=0 TSval=1294035791 TSecr=887585709"
8,0.01465,192.168.11.44,192.168.11.43,TCP,66,0.000043,,,57962  >  6000 [ACK] Seq=29 Ack=2 Win=64256 Len=0 TSval=887585716 TSecr=1294035791
9,0.045529,192.168.11.44,255.255.255.255,UDP,209,0.030879,Ÿ,7b2273656d616e74696373223a207b22656e74697479223a2022504944222c202262617365656e74697479223a2022616e79222c2022726f6c65223a2022303034222c20227370617469616c223a2022616e79222c202274656d706f72616c223a2022616e79227d2c20226461746170726f7065727479223a207b22666f726d6174223a2022696e616f6b615f70726f6772616d5f73616d706c655f73656d616e746963227d7d,58423  >  7000 Len=167
10,0.056986,192.168.11.45,192.168.11.44,TCP,74,0.011457,œ,,59692  >  6000 [SYN] Seq=0 Win=64240 Len=0 MSS=1460 SACK_PERM TSval=2649140422 TSecr=0 WS=128
11,0.057124,192.168.11.44,192.168.11.45,TCP,74,0.000138,,,"6000  >  59692 [SYN, ACK] Seq=0 Ack=1 Win=65160 Len=0 MSS=1460 SACK_PERM TSval=1499226379 TSecr=2649140422 WS=128"
12,0.063662,192.168.11.45,192.168.11.44,TCP,66,0.006538,,,59692  >  6000 [ACK] Seq=1 Ack=1 Win=64256 Len=0 TSval=2649140432 TSecr=1499226379
13,0.064153,192.168.11.45,192.168.11.44,TCP,93,0.000491,,,"59692  >  6000 [PSH, ACK] Seq=1 Ack=1 Win=64256 Len=27 TSval=2649140432 TSecr=1499226379 [TCP segment of a reassembled PDU]"
14,0.064235,192.168.11.44,192.168.11.45,TCP,66,0.000082,,,6000  >  59692 [ACK] Seq=1 Ack=28 Win=65152 Len=0 TSval=1499226386 TSecr=2649140432
15,0.064293,192.168.11.45,192.168.11.44,TCP,66,0.000058,,,"59692  >  6000 [FIN, ACK] Seq=28 Ack=1 Win=64256 Len=0 TSval=2649140433 TSecr=1499226379"
16,0.065964,192.168.11.44,192.168.11.45,TCP,66,0.001671,,,"6000  >  59692 [FIN, ACK] Seq=1 Ack=29 Win=65152 Len=0 TSval=1499226387 TSecr=2649140433"
17,0.070482,192.168.11.45,192.168.11.44,TCP,66,0.004518,,,59692  >  6000 [ACK] Seq=29 Ack=2 Win=64256 Len=0 TSval=2649140440 TSecr=1499226387
18,7.269656,192.168.11.44,192.168.11.43,TCP,74,7.199174,,,57966  >  6000 [SYN] Seq=0 Win=64240 Len=0 MSS=1460 SACK_PERM TSval=887592971 TSecr=0 WS=128
19,7.276419,192.168.11.43,192.168.11.44,TCP,74,0.006763,,,"6000  >  57966 [SYN, ACK] Seq=0 Ack=1 Win=65160 Len=0 MSS=1460 SACK_PERM TSval=1294043051 TSecr=887592971 WS=128"
20,7.27651,192.168.11.44,192.168.11.43,TCP,66,0.000091,,,57966  >  6000 [ACK] Seq=1 Ack=1 Win=64256 Len=0 TSval=887592978 TSecr=1294043051
21,7.276634,192.168.11.44,192.168.11.43,TCP,93,0.000124,,,"57966  >  6000 [PSH, ACK] Seq=1 Ack=1 Win=64256 Len=27 TSval=887592978 TSecr=1294043051 [TCP segment of a reassembled PDU]"
22,7.276749,192.168.11.44,192.168.11.43,TCP,66,0.000115,,,"57966  >  6000 [FIN, ACK] Seq=28 Ack=1 Win=64256 Len=0 TSval=887592978 TSecr=1294043051"
23,7.288162,192.168.11.43,192.168.11.44,TCP,66,0.011413,,,6000  >  57966 [ACK] Seq=1 Ack=28 Win=65152 Len=0 TSval=1294043058 TSecr=887592978
24,7.288531,192.168.11.43,192.168.11.44,TCP,66,0.000369,,,"6000  >  57966 [FIN, ACK] Seq=1 Ack=29 Win=65152 Len=0 TSval=1294043059 TSecr=887592978"
25,7.288576,192.168.11.44,192.168.11.43,TCP,66,0.000045,,,57966  >  6000 [ACK] Seq=29 Ack=2 Win=64256 Len=0 TSval=887592990 TSecr=1294043059
26,7.319613,192.168.11.44,255.255.255.255,UDP,209,0.031037,Ÿ,7b2273656d616e74696373223a207b22656e74697479223a2022504944222c202262617365656e74697479223a2022616e79222c2022726f6c65223a2022303034222c20227370617469616c223a2022616e79222c202274656d706f72616c223a2022616e79227d2c20226461746170726f7065727479223a207b22666f726d6174223a2022696e616f6b615f70726f6772616d5f73616d706c655f73656d616e746963227d7d,58417  >  7000 Len=167
27,7.33085,192.168.11.45,192.168.11.44,TCP,74,0.011237,œ,,59394  >  6000 [SYN] Seq=0 Win=64240 Len=0 MSS=1460 SACK_PERM TSval=2649147696 TSecr=0 WS=128
28,7.330983,192.168.11.44,192.168.11.45,TCP,74,0.000133,,,"6000  >  59394 [SYN, ACK] Seq=0 Ack=1 Win=65160 Len=0 MSS=1460 SACK_PERM TSval=1499233653 TSecr=2649147696 WS=128"
29,7.337682,192.168.11.45,192.168.11.44,TCP,66,0.006699,,,59394  >  6000 [ACK] Seq=1 Ack=1 Win=64256 Len=0 TSval=2649147706 TSecr=1499233653
30,7.338274,192.168.11.45,192.168.11.44,TCP,93,0.000592,,,"59394  >  6000 [PSH, ACK] Seq=1 Ack=1 Win=64256 Len=27 TSval=2649147706 TSecr=1499233653 [TCP segment of a reassembled PDU]"
31,7.33837,192.168.11.44,192.168.11.45,TCP,66,0.000096,,,6000  >  59394 [ACK] Seq=1 Ack=28 Win=65152 Len=0 TSval=1499233660 TSecr=2649147706
32,7.338445,192.168.11.45,192.168.11.44,TCP,66,0.000075,,,"59394  >  6000 [FIN, ACK] Seq=28 Ack=1 Win=64256 Len=0 TSval=2649147706 TSecr=1499233653"
33,7.340121,192.168.11.44,192.168.11.45,TCP,66,0.001676,,,"6000  >  59394 [FIN, ACK] Seq=1 Ack=29 Win=65152 Len=0 TSval=1499233662 TSecr=2649147706"
34,7.34491,192.168.11.45,192.168.11.44,TCP,66,0.004789,,,59394  >  6000 [ACK] Seq=29 Ack=2 Win=64256 Len=0 TSval=2649147714 TSecr=1499233662
35,14.572638,192.168.11.44,192.168.11.43,TCP,74,7.227728,,,52236  >  6000 [SYN] Seq=0 Win=64240 Len=0 MSS=1460 SACK_PERM TSval=887600274 TSecr=0 WS=128
36,14.579487,192.168.11.43,192.168.11.44,TCP,74,0.006849,,,"6000  >  52236 [SYN, ACK] Seq=0 Ack=1 Win=65160 Len=0 MSS=1460 SACK_PERM TSval=1294050354 TSecr=887600274 WS=128"
37,14.579587,192.168.11.44,192.168.11.43,TCP,66,0.0001,,,52236  >  6000 [ACK] Seq=1 Ack=1 Win=64256 Len=0 TSval=887600281 TSecr=1294050354
38,14.579757,192.168.11.44,192.168.11.43,TCP,93,0.00017,,,"52236  >  6000 [PSH, ACK] Seq=1 Ack=1 Win=64256 Len=27 TSval=887600281 TSecr=1294050354 [TCP segment of a reassembled PDU]"
39,14.579849,192.168.11.44,192.168.11.43,TCP,66,0.000092,,,"52236  >  6000 [FIN, ACK] Seq=28 Ack=1 Win=64256 Len=0 TSval=887600281 TSecr=1294050354"
40,14.586542,192.168.11.43,192.168.11.44,TCP,66,0.006693,,,6000  >  52236 [ACK] Seq=1 Ack=28 Win=65152 Len=0 TSval=1294050361 TSecr=887600281
41,14.586923,192.168.11.43,192.168.11.44,TCP,66,0.000381,,,"6000  >  52236 [FIN, ACK] Seq=1 Ack=29 Win=65152 Len=0 TSval=1294050362 TSecr=887600281"
42,14.586973,192.168.11.44,192.168.11.43,TCP,66,0.00005,,,52236  >  6000 [ACK] Seq=29 Ack=2 Win=64256 Len=0 TSval=887600288 TSecr=1294050362
43,14.614627,192.168.11.44,255.255.255.255,UDP,209,0.027654,Ÿ,7b2273656d616e74696373223a207b22656e74697479223a2022504944222c202262617365656e74697479223a2022616e79222c2022726f6c65223a2022303034222c20227370617469616c223a2022616e79222c202274656d706f72616c223a2022616e79227d2c20226461746170726f7065727479223a207b22666f726d6174223a2022696e616f6b615f70726f6772616d5f73616d706c655f73656d616e746963227d7d,57251  >  7000 Len=167
44,14.622209,192.168.11.45,192.168.11.44,TCP,74,0.007582,œ,,36636  >  6000 [SYN] Seq=0 Win=64240 Len=0 MSS=1460 SACK_PERM TSval=2649154990 TSecr=0 WS=128
45,14.622332,192.168.11.44,192.168.11.45,TCP,74,0.000123,,,"6000  >  36636 [SYN, ACK] Seq=0 Ack=1 Win=65160 Len=0 MSS=1460 SACK_PERM TSval=1499240944 TSecr=2649154990 WS=128"
46,14.629755,192.168.11.45,192.168.11.44,TCP,66,0.007423,,,36636  >  6000 [ACK] Seq=1 Ack=1 Win=64256 Len=0 TSval=2649154998 TSecr=1499240944
47,14.630374,192.168.11.45,192.168.11.44,TCP,93,0.000619,,,"36636  >  6000 [PSH, ACK] Seq=1 Ack=1 Win=64256 Len=27 TSval=2649154998 TSecr=1499240944 [TCP segment of a reassembled PDU]"
48,14.630462,192.168.11.44,192.168.11.45,TCP,66,0.000088,,,6000  >  36636 [ACK] Seq=1 Ack=28 Win=65152 Len=0 TSval=1499240952 TSecr=2649154998
49,14.630539,192.168.11.45,192.168.11.44,TCP,66,0.000077,,,"36636  >  6000 [FIN, ACK] Seq=28 Ack=1 Win=64256 Len=0 TSval=2649154998 TSecr=1499240944"
50,14.631819,192.168.11.44,192.168.11.45,TCP,66,0.00128,,,"6000  >  36636 [FIN, ACK] Seq=1 Ack=29 Win=65152 Len=0 TSval=1499240953 TSecr=2649154998"
51,14.638142,192.168.11.45,192.168.11.44,TCP,66,0.006323,,,36636  >  6000 [ACK] Seq=29 Ack=2 Win=64256 Len=0 TSval=2649155006 TSecr=1499240953
52,21.776236,192.168.11.44,192.168.11.43,TCP,74,7.138094,,,54668  >  6000 [SYN] Seq=0 Win=64240 Len=0 MSS=1460 SACK_PERM TSval=887607478 TSecr=0 WS=128
53,21.786117,192.168.11.43,192.168.11.44,TCP,74,0.009881,,,"6000  >  54668 [SYN, ACK] Seq=0 Ack=1 Win=65160 Len=0 MSS=1460 SACK_PERM TSval=1294057560 TSecr=887607478 WS=128"
54,21.786218,192.168.11.44,192.168.11.43,TCP,66,0.000101,,,54668  >  6000 [ACK] Seq=1 Ack=1 Win=64256 Len=0 TSval=887607488 TSecr=1294057560
55,21.786383,192.168.11.44,192.168.11.43,TCP,93,0.000165,,,"54668  >  6000 [PSH, ACK] Seq=1 Ack=1 Win=64256 Len=27 TSval=887607488 TSecr=1294057560 [TCP segment of a reassembled PDU]"
56,21.786502,192.168.11.44,192.168.11.43,TCP,66,0.000119,,,"54668  >  6000 [FIN, ACK] Seq=28 Ack=1 Win=64256 Len=0 TSval=887607488 TSecr=1294057560"
57,21.79361,192.168.11.43,192.168.11.44,TCP,66,0.007108,,,6000  >  54668 [ACK] Seq=1 Ack=28 Win=65152 Len=0 TSval=1294057567 TSecr=887607488
58,21.793967,192.168.11.43,192.168.11.44,TCP,66,0.000357,,,"6000  >  54668 [FIN, ACK] Seq=1 Ack=29 Win=65152 Len=0 TSval=1294057569 TSecr=887607488"
59,21.79402,192.168.11.44,192.168.11.43,TCP,66,0.000053,,,54668  >  6000 [ACK] Seq=29 Ack=2 Win=64256 Len=0 TSval=887607496 TSecr=1294057569
60,21.824578,192.168.11.44,255.255.255.255,UDP,209,0.030558,Ÿ,7b2273656d616e74696373223a207b22656e74697479223a2022504944222c202262617365656e74697479223a2022616e79222c2022726f6c65223a2022303034222c20227370617469616c223a2022616e79222c202274656d706f72616c223a2022616e79227d2c20226461746170726f7065727479223a207b22666f726d6174223a2022696e616f6b615f70726f6772616d5f73616d706c655f73656d616e746963227d7d,54398  >  7000 Len=167
61,21.83275,192.168.11.45,192.168.11.44,TCP,74,0.008172,œ,,36642  >  6000 [SYN] Seq=0 Win=64240 Len=0 MSS=1460 SACK_PERM TSval=2649162201 TSecr=0 WS=128
62,21.832865,192.168.11.44,192.168.11.45,TCP,74,0.000115,,,"6000  >  36642 [SYN, ACK] Seq=0 Ack=1 Win=65160 Len=0 MSS=1460 SACK_PERM TSval=1499248154 TSecr=2649162201 WS=128"
63,21.840504,192.168.11.45,192.168.11.44,TCP,66,0.007639,,,36642  >  6000 [ACK] Seq=1 Ack=1 Win=64256 Len=0 TSval=2649162208 TSecr=1499248154
64,21.840976,192.168.11.45,192.168.11.44,TCP,93,0.000472,,,"36642  >  6000 [PSH, ACK] Seq=1 Ack=1 Win=64256 Len=27 TSval=2649162208 TSecr=1499248154 [TCP segment of a reassembled PDU]"
65,21.841117,192.168.11.44,192.168.11.45,TCP,66,0.000141,,,6000  >  36642 [ACK] Seq=1 Ack=28 Win=65152 Len=0 TSval=1499248163 TSecr=2649162208
66,21.841318,192.168.11.45,192.168.11.44,TCP,66,0.000201,,,"36642  >  6000 [FIN, ACK] Seq=28 Ack=1 Win=64256 Len=0 TSval=2649162208 TSecr=1499248154"
67,21.842915,192.168.11.44,192.168.11.45,TCP,66,0.001597,,,"6000  >  36642 [FIN, ACK] Seq=1 Ack=29 Win=65152 Len=0 TSval=1499248164 TSecr=2649162208"
68,21.848905,192.168.11.45,192.168.11.44,TCP,66,0.00599,,,36642  >  6000 [ACK] Seq=29 Ack=2 Win=64256 Len=0 TSval=2649162217 TSecr=1499248164
69,28.963671,192.168.11.44,192.168.11.43,TCP,74,7.114766,,,54684  >  6000 [SYN] Seq=0 Win=64240 Len=0 MSS=1460 SACK_PERM TSval=887614665 TSecr=0 WS=128
70,28.971481,192.168.11.43,192.168.11.44,TCP,74,0.00781,,,"6000  >  54684 [SYN, ACK] Seq=0 Ack=1 Win=65160 Len=0 MSS=1460 SACK_PERM TSval=1294064745 TSecr=887614665 WS=128"
71,28.97159,192.168.11.44,192.168.11.43,TCP,66,0.000109,,,54684  >  6000 [ACK] Seq=1 Ack=1 Win=64256 Len=0 TSval=887614673 TSecr=1294064745
72,28.971782,192.168.11.44,192.168.11.43,TCP,93,0.000192,,,"54684  >  6000 [PSH, ACK] Seq=1 Ack=1 Win=64256 Len=27 TSval=887614673 TSecr=1294064745 [TCP segment of a reassembled PDU]"
73,28.971871,192.168.11.44,192.168.11.43,TCP,66,0.000089,,,"54684  >  6000 [FIN, ACK] Seq=28 Ack=1 Win=64256 Len=0 TSval=887614673 TSecr=1294064745"
74,28.979338,192.168.11.43,192.168.11.44,TCP,66,0.007467,,,6000  >  54684 [ACK] Seq=1 Ack=28 Win=65152 Len=0 TSval=1294064753 TSecr=887614673
75,28.979707,192.168.11.43,192.168.11.44,TCP,66,0.000369,,,"6000  >  54684 [FIN, ACK] Seq=1 Ack=29 Win=65152 Len=0 TSval=1294064754 TSecr=887614673"
76,28.97975,192.168.11.44,192.168.11.43,TCP,66,0.000043,,,54684  >  6000 [ACK] Seq=29 Ack=2 Win=64256 Len=0 TSval=887614681 TSecr=1294064754
77,29.006826,192.168.11.44,255.255.255.255,UDP,209,0.027076,Ÿ,7b2273656d616e74696373223a207b22656e74697479223a2022504944222c202262617365656e74697479223a2022616e79222c2022726f6c65223a2022303034222c20227370617469616c223a2022616e79222c202274656d706f72616c223a2022616e79227d2c20226461746170726f7065727479223a207b22666f726d6174223a2022696e616f6b615f70726f6772616d5f73616d706c655f73656d616e746963227d7d,42590  >  7000 Len=167
78,29.015955,192.168.11.45,192.168.11.44,TCP,74,0.009129,œ,,49254  >  6000 [SYN] Seq=0 Win=64240 Len=0 MSS=1460 SACK_PERM TSval=2649169384 TSecr=0 WS=128
79,29.016097,192.168.11.44,192.168.11.45,TCP,74,0.000142,,,"6000  >  49254 [SYN, ACK] Seq=0 Ack=1 Win=65160 Len=0 MSS=1460 SACK_PERM TSval=1499255338 TSecr=2649169384 WS=128"
80,29.022832,192.168.11.45,192.168.11.44,TCP,66,0.006735,,,49254  >  6000 [ACK] Seq=1 Ack=1 Win=64256 Len=0 TSval=2649169391 TSecr=1499255338
81,29.023423,192.168.11.45,192.168.11.44,TCP,93,0.000591,,,"49254  >  6000 [PSH, ACK] Seq=1 Ack=1 Win=64256 Len=27 TSval=2649169391 TSecr=1499255338 [TCP segment of a reassembled PDU]"
82,29.023509,192.168.11.44,192.168.11.45,TCP,66,0.000086,,,6000  >  49254 [ACK] Seq=1 Ack=28 Win=65152 Len=0 TSval=1499255345 TSecr=2649169391
83,29.023585,192.168.11.45,192.168.11.44,TCP,66,0.000076,,,"49254  >  6000 [FIN, ACK] Seq=28 Ack=1 Win=64256 Len=0 TSval=2649169391 TSecr=1499255338"
84,29.024848,192.168.11.44,192.168.11.45,TCP,66,0.001263,,,"6000  >  49254 [FIN, ACK] Seq=1 Ack=29 Win=65152 Len=0 TSval=1499255346 TSecr=2649169391"
85,29.030848,192.168.11.45,192.168.11.44,TCP,66,0.006,,,49254  >  6000 [ACK] Seq=29 Ack=2 Win=64256 Len=0 TSval=2649169399 TSecr=1499255346
86,36.128154,192.168.11.44,192.168.11.43,TCP,74,7.097306,,,50228  >  6000 [SYN] Seq=0 Win=64240 Len=0 MSS=1460 SACK_PERM TSval=887621830 TSecr=0 WS=128
87,36.134963,192.168.11.43,192.168.11.44,TCP,74,0.006809,,,"6000  >  50228 [SYN, ACK] Seq=0 Ack=1 Win=65160 Len=0 MSS=1460 SACK_PERM TSval=1294071909 TSecr=887621830 WS=128"
88,36.135069,192.168.11.44,192.168.11.43,TCP,66,0.000106,,,50228  >  6000 [ACK] Seq=1 Ack=1 Win=64256 Len=0 TSval=887621837 TSecr=1294071909
89,36.13526,192.168.11.44,192.168.11.43,TCP,93,0.000191,,,"50228  >  6000 [PSH, ACK] Seq=1 Ack=1 Win=64256 Len=27 TSval=887621837 TSecr=1294071909 [TCP segment of a reassembled PDU]"
90,36.135347,192.168.11.44,192.168.11.43,TCP,66,0.000087,,,"50228  >  6000 [FIN, ACK] Seq=28 Ack=1 Win=64256 Len=0 TSval=887621837 TSecr=1294071909"
91,36.142507,192.168.11.43,192.168.11.44,TCP,66,0.00716,,,6000  >  50228 [ACK] Seq=1 Ack=28 Win=65152 Len=0 TSval=1294071916 TSecr=887621837
92,36.142897,192.168.11.43,192.168.11.44,TCP,66,0.00039,,,"6000  >  50228 [FIN, ACK] Seq=1 Ack=29 Win=65152 Len=0 TSval=1294071917 TSecr=887621837"
93,36.14294,192.168.11.44,192.168.11.43,TCP,66,0.000043,,,50228  >  6000 [ACK] Seq=29 Ack=2 Win=64256 Len=0 TSval=887621844 TSecr=1294071917
94,36.171442,192.168.11.44,255.255.255.255,UDP,209,0.028502,Ÿ,7b2273656d616e74696373223a207b22656e74697479223a2022504944222c202262617365656e74697479223a2022616e79222c2022726f6c65223a2022303034222c20227370617469616c223a2022616e79222c202274656d706f72616c223a2022616e79227d2c20226461746170726f7065727479223a207b22666f726d6174223a2022696e616f6b615f70726f6772616d5f73616d706c655f73656d616e746963227d7d,39217  >  7000 Len=167
95,36.184357,192.168.11.45,192.168.11.44,TCP,74,0.012915,œ,,33424  >  6000 [SYN] Seq=0 Win=64240 Len=0 MSS=1460 SACK_PERM TSval=2649176552 TSecr=0 WS=128
96,36.184542,192.168.11.44,192.168.11.45,TCP,74,0.000185,,,"6000  >  33424 [SYN, ACK] Seq=0 Ack=1 Win=65160 Len=0 MSS=1460 SACK_PERM TSval=1499262506 TSecr=2649176552 WS=128"
97,36.19139,192.168.11.45,192.168.11.44,TCP,66,0.006848,,,33424  >  6000 [ACK] Seq=1 Ack=1 Win=64256 Len=0 TSval=2649176559 TSecr=1499262506
98,36.192384,192.168.11.45,192.168.11.44,TCP,93,0.000994,,,"33424  >  6000 [PSH, ACK] Seq=1 Ack=1 Win=64256 Len=27 TSval=2649176559 TSecr=1499262506 [TCP segment of a reassembled PDU]"
99,36.192541,192.168.11.44,192.168.11.45,TCP,66,0.000157,,,6000  >  33424 [ACK] Seq=1 Ack=28 Win=65152 Len=0 TSval=1499262514 TSecr=2649176559
100,36.19263,192.168.11.45,192.168.11.44,TCP,66,0.000089,,,"33424  >  6000 [FIN, ACK] Seq=28 Ack=1 Win=64256 Len=0 TSval=2649176559 TSecr=1499262506"
101,36.194218,192.168.11.44,192.168.11.45,TCP,66,0.001588,,,"6000  >  33424 [FIN, ACK] Seq=1 Ack=29 Win=65152 Len=0 TSval=1499262516 TSecr=2649176559"
102,36.200247,192.168.11.45,192.168.11.44,TCP,66,0.006029,,,33424  >  6000 [ACK] Seq=29 Ack=2 Win=64256 Len=0 TSval=2649176568 TSecr=1499262516
103,43.37639,192.168.11.44,192.168.11.43,TCP,74,7.176143,,,33886  >  6000 [SYN] Seq=0 Win=64240 Len=0 MSS=1460 SACK_PERM TSval=887629078 TSecr=0 WS=128
104,43.382826,192.168.11.43,192.168.11.44,TCP,74,0.006436,,,"6000  >  33886 [SYN, ACK] Seq=0 Ack=1 Win=65160 Len=0 MSS=1460 SACK_PERM TSval=1294079156 TSecr=887629078 WS=128"
105,43.382922,192.168.11.44,192.168.11.43,TCP,66,0.000096,,,33886  >  6000 [ACK] Seq=1 Ack=1 Win=64256 Len=0 TSval=887629084 TSecr=1294079156
106,43.383055,192.168.11.44,192.168.11.43,TCP,93,0.000133,,,"33886  >  6000 [PSH, ACK] Seq=1 Ack=1 Win=64256 Len=27 TSval=887629085 TSecr=1294079156 [TCP segment of a reassembled PDU]"
107,43.383172,192.168.11.44,192.168.11.43,TCP,66,0.000117,,,"33886  >  6000 [FIN, ACK] Seq=28 Ack=1 Win=64256 Len=0 TSval=887629085 TSecr=1294079156"
108,43.390046,192.168.11.43,192.168.11.44,TCP,66,0.006874,,,6000  >  33886 [ACK] Seq=1 Ack=28 Win=65152 Len=0 TSval=1294079163 TSecr=887629085
109,43.390254,192.168.11.43,192.168.11.44,TCP,66,0.000208,,,"6000  >  33886 [FIN, ACK] Seq=1 Ack=29 Win=65152 Len=0 TSval=1294079164 TSecr=887629085"
110,43.390297,192.168.11.44,192.168.11.43,TCP,66,0.000043,,,33886  >  6000 [ACK] Seq=29 Ack=2 Win=64256 Len=0 TSval=887629092 TSecr=1294079164
111,43.418609,192.168.11.44,255.255.255.255,UDP,209,0.028312,Ÿ,7b2273656d616e74696373223a207b22656e74697479223a2022504944222c202262617365656e74697479223a2022616e79222c2022726f6c65223a2022303034222c20227370617469616c223a2022616e79222c202274656d706f72616c223a2022616e79227d2c20226461746170726f7065727479223a207b22666f726d6174223a2022696e616f6b615f70726f6772616d5f73616d706c655f73656d616e746963227d7d,58683  >  7000 Len=167
112,43.427349,192.168.11.45,192.168.11.44,TCP,74,0.00874,œ,,57940  >  6000 [SYN] Seq=0 Win=64240 Len=0 MSS=1460 SACK_PERM TSval=2649183794 TSecr=0 WS=128
113,43.427472,192.168.11.44,192.168.11.45,TCP,74,0.000123,,,"6000  >  57940 [SYN, ACK] Seq=0 Ack=1 Win=65160 Len=0 MSS=1460 SACK_PERM TSval=1499269749 TSecr=2649183794 WS=128"
114,43.434164,192.168.11.45,192.168.11.44,TCP,66,0.006692,,,57940  >  6000 [ACK] Seq=1 Ack=1 Win=64256 Len=0 TSval=2649183802 TSecr=1499269749
115,43.434753,192.168.11.45,192.168.11.44,TCP,93,0.000589,,,"57940  >  6000 [PSH, ACK] Seq=1 Ack=1 Win=64256 Len=27 TSval=2649183802 TSecr=1499269749 [TCP segment of a reassembled PDU]"
116,43.434845,192.168.11.44,192.168.11.45,TCP,66,0.000092,,,6000  >  57940 [ACK] Seq=1 Ack=28 Win=65152 Len=0 TSval=1499269756 TSecr=2649183802
117,43.434924,192.168.11.45,192.168.11.44,TCP,66,0.000079,,,"57940  >  6000 [FIN, ACK] Seq=28 Ack=1 Win=64256 Len=0 TSval=2649183802 TSecr=1499269749"
118,43.43608,192.168.11.44,192.168.11.45,TCP,66,0.001156,,,"6000  >  57940 [FIN, ACK] Seq=1 Ack=29 Win=65152 Len=0 TSval=1499269758 TSecr=2649183802"
119,43.442422,192.168.11.45,192.168.11.44,TCP,66,0.006342,,,57940  >  6000 [ACK] Seq=29 Ack=2 Win=64256 Len=0 TSval=2649183810 TSecr=1499269758
120,50.541312,192.168.11.44,192.168.11.43,TCP,74,7.09889,,,50566  >  6000 [SYN] Seq=0 Win=64240 Len=0 MSS=1460 SACK_PERM TSval=887636243 TSecr=0 WS=128
121,50.54793,192.168.11.43,192.168.11.44,TCP,74,0.006618,,,"6000  >  50566 [SYN, ACK] Seq=0 Ack=1 Win=65160 Len=0 MSS=1460 SACK_PERM TSval=1294086321 TSecr=887636243 WS=128"
122,50.548028,192.168.11.44,192.168.11.43,TCP,66,0.000098,,,50566  >  6000 [ACK] Seq=1 Ack=1 Win=64256 Len=0 TSval=887636250 TSecr=1294086321
123,50.548159,192.168.11.44,192.168.11.43,TCP,93,0.000131,,,"50566  >  6000 [PSH, ACK] Seq=1 Ack=1 Win=64256 Len=27 TSval=887636250 TSecr=1294086321 [TCP segment of a reassembled PDU]"
124,50.548273,192.168.11.44,192.168.11.43,TCP,66,0.000114,,,"50566  >  6000 [FIN, ACK] Seq=28 Ack=1 Win=64256 Len=0 TSval=887636250 TSecr=1294086321"
125,50.555361,192.168.11.43,192.168.11.44,TCP,66,0.007088,,,6000  >  50566 [ACK] Seq=1 Ack=28 Win=65152 Len=0 TSval=1294086328 TSecr=887636250
126,50.555726,192.168.11.43,192.168.11.44,TCP,66,0.000365,,,"6000  >  50566 [FIN, ACK] Seq=1 Ack=29 Win=65152 Len=0 TSval=1294086330 TSecr=887636250"
127,50.55577,192.168.11.44,192.168.11.43,TCP,66,0.000044,,,50566  >  6000 [ACK] Seq=29 Ack=2 Win=64256 Len=0 TSval=887636257 TSecr=1294086330
128,50.583269,192.168.11.44,255.255.255.255,UDP,209,0.027499,Ÿ,7b2273656d616e74696373223a207b22656e74697479223a2022504944222c202262617365656e74697479223a2022616e79222c2022726f6c65223a2022303034222c20227370617469616c223a2022616e79222c202274656d706f72616c223a2022616e79227d2c20226461746170726f7065727479223a207b22666f726d6174223a2022696e616f6b615f70726f6772616d5f73616d706c655f73656d616e746963227d7d,56797  >  7000 Len=167
129,50.590756,192.168.11.45,192.168.11.44,TCP,74,0.007487,œ,,57944  >  6000 [SYN] Seq=0 Win=64240 Len=0 MSS=1460 SACK_PERM TSval=2649190958 TSecr=0 WS=128
130,50.590871,192.168.11.44,192.168.11.45,TCP,74,0.000115,,,"6000  >  57944 [SYN, ACK] Seq=0 Ack=1 Win=65160 Len=0 MSS=1460 SACK_PERM TSval=1499276912 TSecr=2649190958 WS=128"
131,50.597621,192.168.11.45,192.168.11.44,TCP,66,0.00675,,,57944  >  6000 [ACK] Seq=1 Ack=1 Win=64256 Len=0 TSval=2649190965 TSecr=1499276912
132,50.598301,192.168.11.45,192.168.11.44,TCP,93,0.00068,,,"57944  >  6000 [PSH, ACK] Seq=1 Ack=1 Win=64256 Len=27 TSval=2649190965 TSecr=1499276912 [TCP segment of a reassembled PDU]"
133,50.59838,192.168.11.44,192.168.11.45,TCP,66,0.000079,,,6000  >  57944 [ACK] Seq=1 Ack=28 Win=65152 Len=0 TSval=1499276920 TSecr=2649190965
134,50.598621,192.168.11.45,192.168.11.44,TCP,66,0.000241,,,"57944  >  6000 [FIN, ACK] Seq=28 Ack=1 Win=64256 Len=0 TSval=2649190965 TSecr=1499276912"
135,50.600453,192.168.11.44,192.168.11.45,TCP,66,0.001832,,,"6000  >  57944 [FIN, ACK] Seq=1 Ack=29 Win=65152 Len=0 TSval=1499276922 TSecr=2649190965"
136,50.605421,192.168.11.45,192.168.11.44,TCP,66,0.004968,,,57944  >  6000 [ACK] Seq=29 Ack=2 Win=64256 Len=0 TSval=2649190973 TSecr=1499276922
137,57.684476,192.168.11.44,192.168.11.43,TCP,74,7.079055,,,50568  >  6000 [SYN] Seq=0 Win=64240 Len=0 MSS=1460 SACK_PERM TSval=887643386 TSecr=0 WS=128
138,57.691249,192.168.11.43,192.168.11.44,TCP,74,0.006773,,,"6000  >  50568 [SYN, ACK] Seq=0 Ack=1 Win=65160 Len=0 MSS=1460 SACK_PERM TSval=1294093464 TSecr=887643386 WS=128"
139,57.691348,192.168.11.44,192.168.11.43,TCP,66,0.000099,,,50568  >  6000 [ACK] Seq=1 Ack=1 Win=64256 Len=0 TSval=887643393 TSecr=1294093464
140,57.691509,192.168.11.44,192.168.11.43,TCP,93,0.000161,,,"50568  >  6000 [PSH, ACK] Seq=1 Ack=1 Win=64256 Len=27 TSval=887643393 TSecr=1294093464 [TCP segment of a reassembled PDU]"
141,57.69161,192.168.11.44,192.168.11.43,TCP,66,0.000101,,,"50568  >  6000 [FIN, ACK] Seq=28 Ack=1 Win=64256 Len=0 TSval=887643393 TSecr=1294093464"
142,57.698675,192.168.11.43,192.168.11.44,TCP,66,0.007065,,,6000  >  50568 [ACK] Seq=1 Ack=28 Win=65152 Len=0 TSval=1294093471 TSecr=887643393
143,57.699042,192.168.11.43,192.168.11.44,TCP,66,0.000367,,,"6000  >  50568 [FIN, ACK] Seq=1 Ack=29 Win=65152 Len=0 TSval=1294093473 TSecr=887643393"
144,57.699086,192.168.11.44,192.168.11.43,TCP,66,0.000044,,,50568  >  6000 [ACK] Seq=29 Ack=2 Win=64256 Len=0 TSval=887643401 TSecr=1294093473
145,57.726142,192.168.11.44,255.255.255.255,UDP,209,0.027056,Ÿ,7b2273656d616e74696373223a207b22656e74697479223a2022504944222c202262617365656e74697479223a2022616e79222c2022726f6c65223a2022303034222c20227370617469616c223a2022616e79222c202274656d706f72616c223a2022616e79227d2c20226461746170726f7065727479223a207b22666f726d6174223a2022696e616f6b615f70726f6772616d5f73616d706c655f73656d616e746963227d7d,57615  >  7000 Len=167
146,57.733763,192.168.11.45,192.168.11.44,TCP,74,0.007621,œ,,55752  >  6000 [SYN] Seq=0 Win=64240 Len=0 MSS=1460 SACK_PERM TSval=2649198101 TSecr=0 WS=128
147,57.733866,192.168.11.44,192.168.11.45,TCP,74,0.000103,,,"6000  >  55752 [SYN, ACK] Seq=0 Ack=1 Win=65160 Len=0 MSS=1460 SACK_PERM TSval=1499284055 TSecr=2649198101 WS=128"
148,57.740729,192.168.11.45,192.168.11.44,TCP,66,0.006863,,,55752  >  6000 [ACK] Seq=1 Ack=1 Win=64256 Len=0 TSval=2649198108 TSecr=1499284055
149,57.741393,192.168.11.45,192.168.11.44,TCP,93,0.000664,,,"55752  >  6000 [PSH, ACK] Seq=1 Ack=1 Win=64256 Len=27 TSval=2649198108 TSecr=1499284055 [TCP segment of a reassembled PDU]"
150,57.741492,192.168.11.44,192.168.11.45,TCP,66,0.000099,,,6000  >  55752 [ACK] Seq=1 Ack=28 Win=65152 Len=0 TSval=1499284063 TSecr=2649198108
151,57.741573,192.168.11.45,192.168.11.44,TCP,66,0.000081,,,"55752  >  6000 [FIN, ACK] Seq=28 Ack=1 Win=64256 Len=0 TSval=2649198108 TSecr=1499284055"
152,57.742855,192.168.11.44,192.168.11.45,TCP,66,0.001282,,,"6000  >  55752 [FIN, ACK] Seq=1 Ack=29 Win=65152 Len=0 TSval=1499284064 TSecr=2649198108"
153,57.748984,192.168.11.45,192.168.11.44,TCP,66,0.006129,,,55752  >  6000 [ACK] Seq=29 Ack=2 Win=64256 Len=0 TSval=2649198116 TSecr=1499284064
154,64.828597,192.168.11.44,192.168.11.43,TCP,74,7.079613,,,57582  >  6000 [SYN] Seq=0 Win=64240 Len=0 MSS=1460 SACK_PERM TSval=887650530 TSecr=0 WS=128
155,64.835459,192.168.11.43,192.168.11.44,TCP,74,0.006862,,,"6000  >  57582 [SYN, ACK] Seq=0 Ack=1 Win=65160 Len=0 MSS=1460 SACK_PERM TSval=1294100608 TSecr=887650530 WS=128"
156,64.835555,192.168.11.44,192.168.11.43,TCP,66,0.000096,,,57582  >  6000 [ACK] Seq=1 Ack=1 Win=64256 Len=0 TSval=887650537 TSecr=1294100608
157,64.835725,192.168.11.44,192.168.11.43,TCP,93,0.00017,,,"57582  >  6000 [PSH, ACK] Seq=1 Ack=1 Win=64256 Len=27 TSval=887650537 TSecr=1294100608 [TCP segment of a reassembled PDU]"
158,64.835812,192.168.11.44,192.168.11.43,TCP,66,0.000087,,,"57582  >  6000 [FIN, ACK] Seq=28 Ack=1 Win=64256 Len=0 TSval=887650537 TSecr=1294100608"
159,64.842651,192.168.11.43,192.168.11.44,TCP,66,0.006839,,,6000  >  57582 [ACK] Seq=1 Ack=28 Win=65152 Len=0 TSval=1294100615 TSecr=887650537
160,64.843012,192.168.11.43,192.168.11.44,TCP,66,0.000361,,,"6000  >  57582 [FIN, ACK] Seq=1 Ack=29 Win=65152 Len=0 TSval=1294100616 TSecr=887650537"
161,64.843064,192.168.11.44,192.168.11.43,TCP,66,0.000052,,,57582  >  6000 [ACK] Seq=29 Ack=2 Win=64256 Len=0 TSval=887650545 TSecr=1294100616
162,64.871888,192.168.11.44,255.255.255.255,UDP,209,0.028824,Ÿ,7b2273656d616e74696373223a207b22656e74697479223a2022504944222c202262617365656e74697479223a2022616e79222c2022726f6c65223a2022303034222c20227370617469616c223a2022616e79222c202274656d706f72616c223a2022616e79227d2c20226461746170726f7065727479223a207b22666f726d6174223a2022696e616f6b615f70726f6772616d5f73616d706c655f73656d616e746963227d7d,38349  >  7000 Len=167
163,64.880547,192.168.11.45,192.168.11.44,TCP,74,0.008659,œ,,37690  >  6000 [SYN] Seq=0 Win=64240 Len=0 MSS=1460 SACK_PERM TSval=2649205247 TSecr=0 WS=128
164,64.880669,192.168.11.44,192.168.11.45,TCP,74,0.000122,,,"6000  >  37690 [SYN, ACK] Seq=0 Ack=1 Win=65160 Len=0 MSS=1460 SACK_PERM TSval=1499291202 TSecr=2649205247 WS=128"
165,64.889597,192.168.11.45,192.168.11.44,TCP,66,0.008928,,,37690  >  6000 [ACK] Seq=1 Ack=1 Win=64256 Len=0 TSval=2649205255 TSecr=1499291202
166,64.890118,192.168.11.45,192.168.11.44,TCP,93,0.000521,,,"37690  >  6000 [PSH, ACK] Seq=1 Ack=1 Win=64256 Len=27 TSval=2649205255 TSecr=1499291202 [TCP segment of a reassembled PDU]"
167,64.890172,192.168.11.45,192.168.11.44,TCP,66,0.000054,,,"37690  >  6000 [FIN, ACK] Seq=28 Ack=1 Win=64256 Len=0 TSval=2649205255 TSecr=1499291202"
168,64.890202,192.168.11.44,192.168.11.45,TCP,66,0.00003,,,6000  >  37690 [ACK] Seq=1 Ack=28 Win=65152 Len=0 TSval=1499291212 TSecr=2649205255
169,64.891422,192.168.11.44,192.168.11.45,TCP,66,0.00122,,,"6000  >  37690 [FIN, ACK] Seq=1 Ack=29 Win=65152 Len=0 TSval=1499291213 TSecr=2649205255"
170,64.89622,192.168.11.45,192.168.11.44,TCP,66,0.004798,,,37690  >  6000 [ACK] Seq=29 Ack=2 Win=64256 Len=0 TSval=2649205264 TSecr=1499291213
171,110.503952,192.168.11.44,192.168.11.43,TCP,74,45.607732,,,59772  >  6000 [SYN] Seq=0 Win=64240 Len=0 MSS=1460 SACK_PERM TSval=887696205 TSecr=0 WS=128
172,110.510525,192.168.11.43,192.168.11.44,TCP,74,0.006573,,,"6000  >  59772 [SYN, ACK] Seq=0 Ack=1 Win=65160 Len=0 MSS=1460 SACK_PERM TSval=1294146282 TSecr=887696205 WS=128"
173,110.510624,192.168.11.44,192.168.11.43,TCP,66,0.000099,,,59772  >  6000 [ACK] Seq=1 Ack=1 Win=64256 Len=0 TSval=887696212 TSecr=1294146282
174,110.510998,192.168.11.44,192.168.11.43,TCP,93,0.000374,,,"59772  >  6000 [PSH, ACK] Seq=1 Ack=1 Win=64256 Len=27 TSval=887696213 TSecr=1294146282 [TCP segment of a reassembled PDU]"
175,110.51126,192.168.11.44,192.168.11.43,TCP,66,0.000262,,,"59772  >  6000 [FIN, ACK] Seq=28 Ack=1 Win=64256 Len=0 TSval=887696213 TSecr=1294146282"
176,110.517723,192.168.11.43,192.168.11.44,TCP,66,0.006463,,,6000  >  59772 [ACK] Seq=1 Ack=28 Win=65152 Len=0 TSval=1294146289 TSecr=887696213
177,110.518076,192.168.11.43,192.168.11.44,TCP,66,0.000353,,,"6000  >  59772 [FIN, ACK] Seq=1 Ack=29 Win=65152 Len=0 TSval=1294146290 TSecr=887696213"
178,110.518123,192.168.11.44,192.168.11.43,TCP,66,0.000047,,,59772  >  6000 [ACK] Seq=29 Ack=2 Win=64256 Len=0 TSval=887696220 TSecr=1294146290
179,110.549353,192.168.11.44,255.255.255.255,UDP,209,0.03123,Ÿ,7b2273656d616e74696373223a207b22656e74697479223a2022504944222c202262617365656e74697479223a2022616e79222c2022726f6c65223a2022303034222c20227370617469616c223a2022616e79222c202274656d706f72616c223a2022616e79227d2c20226461746170726f7065727479223a207b22666f726d6174223a2022696e616f6b615f70726f6772616d5f73616d706c655f73656d616e746963227d7d,51064  >  7000 Len=167
180,110.557516,192.168.11.45,192.168.11.44,TCP,74,0.008163,œ,,57298  >  6000 [SYN] Seq=0 Win=64240 Len=0 MSS=1460 SACK_PERM TSval=2649250924 TSecr=0 WS=128
181,110.557663,192.168.11.44,192.168.11.45,TCP,74,0.000147,,,"6000  >  57298 [SYN, ACK] Seq=0 Ack=1 Win=65160 Len=0 MSS=1460 SACK_PERM TSval=1499336879 TSecr=2649250924 WS=128"
182,110.571468,192.168.11.45,192.168.11.44,TCP,66,0.013805,,,57298  >  6000 [ACK] Seq=1 Ack=1 Win=64256 Len=0 TSval=2649250931 TSecr=1499336879
183,110.571962,192.168.11.45,192.168.11.44,TCP,93,0.000494,,,"57298  >  6000 [PSH, ACK] Seq=1 Ack=1 Win=64256 Len=27 TSval=2649250931 TSecr=1499336879 [TCP segment of a reassembled PDU]"
184,110.57202,192.168.11.44,192.168.11.45,TCP,66,0.000058,,,6000  >  57298 [ACK] Seq=1 Ack=28 Win=65152 Len=0 TSval=1499336894 TSecr=2649250931
185,110.572086,192.168.11.45,192.168.11.44,TCP,66,0.000066,,,"57298  >  6000 [FIN, ACK] Seq=28 Ack=1 Win=64256 Len=0 TSval=2649250931 TSecr=1499336879"
186,110.573541,192.168.11.44,192.168.11.45,TCP,66,0.001455,,,"6000  >  57298 [FIN, ACK] Seq=1 Ack=29 Win=65152 Len=0 TSval=1499336895 TSecr=2649250931"
187,110.578998,192.168.11.45,192.168.11.44,TCP,66,0.005457,,,57298  >  6000 [ACK] Seq=29 Ack=2 Win=64256 Len=0 TSval=2649250945 TSecr=1499336895
188,117.68634,192.168.11.44,192.168.11.43,TCP,74,7.107342,,,59782  >  6000 [SYN] Seq=0 Win=64240 Len=0 MSS=1460 SACK_PERM TSval=887703388 TSecr=0 WS=128
189,117.693567,192.168.11.43,192.168.11.44,TCP,74,0.007227,,,"6000  >  59782 [SYN, ACK] Seq=0 Ack=1 Win=65160 Len=0 MSS=1460 SACK_PERM TSval=1294153464 TSecr=887703388 WS=128"
190,117.693665,192.168.11.44,192.168.11.43,TCP,66,0.000098,,,59782  >  6000 [ACK] Seq=1 Ack=1 Win=64256 Len=0 TSval=887703395 TSecr=1294153464
191,117.693901,192.168.11.44,192.168.11.43,TCP,93,0.000236,,,"59782  >  6000 [PSH, ACK] Seq=1 Ack=1 Win=64256 Len=27 TSval=887703395 TSecr=1294153464 [TCP segment of a reassembled PDU]"
192,117.694025,192.168.11.44,192.168.11.43,TCP,66,0.000124,,,"59782  >  6000 [FIN, ACK] Seq=28 Ack=1 Win=64256 Len=0 TSval=887703396 TSecr=1294153464"
193,117.701088,192.168.11.43,192.168.11.44,TCP,66,0.007063,,,6000  >  59782 [ACK] Seq=1 Ack=28 Win=65152 Len=0 TSval=1294153472 TSecr=887703395
194,117.701326,192.168.11.43,192.168.11.44,TCP,66,0.000238,,,"6000  >  59782 [FIN, ACK] Seq=1 Ack=29 Win=65152 Len=0 TSval=1294153474 TSecr=887703396"
195,117.701368,192.168.11.44,192.168.11.43,TCP,66,0.000042,,,59782  >  6000 [ACK] Seq=29 Ack=2 Win=64256 Len=0 TSval=887703403 TSecr=1294153474
196,117.731624,192.168.11.44,255.255.255.255,UDP,209,0.030256,Ÿ,7b2273656d616e74696373223a207b22656e74697479223a2022504944222c202262617365656e74697479223a2022616e79222c2022726f6c65223a2022303034222c20227370617469616c223a2022616e79222c202274656d706f72616c223a2022616e79227d2c20226461746170726f7065727479223a207b22666f726d6174223a2022696e616f6b615f70726f6772616d5f73616d706c655f73656d616e746963227d7d,38747  >  7000 Len=167
197,117.73962,192.168.11.45,192.168.11.44,TCP,74,0.007996,œ,,40650  >  6000 [SYN] Seq=0 Win=64240 Len=0 MSS=1460 SACK_PERM TSval=2649258106 TSecr=0 WS=128
198,117.739742,192.168.11.44,192.168.11.45,TCP,74,0.000122,,,"6000  >  40650 [SYN, ACK] Seq=0 Ack=1 Win=65160 Len=0 MSS=1460 SACK_PERM TSval=1499344061 TSecr=2649258106 WS=128"
199,117.746443,192.168.11.45,192.168.11.44,TCP,66,0.006701,,,40650  >  6000 [ACK] Seq=1 Ack=1 Win=64256 Len=0 TSval=2649258113 TSecr=1499344061
200,117.747085,192.168.11.45,192.168.11.44,TCP,93,0.000642,,,"40650  >  6000 [PSH, ACK] Seq=1 Ack=1 Win=64256 Len=27 TSval=2649258113 TSecr=1499344061 [TCP segment of a reassembled PDU]"
201,117.74719,192.168.11.44,192.168.11.45,TCP,66,0.000105,,,6000  >  40650 [ACK] Seq=1 Ack=28 Win=65152 Len=0 TSval=1499344069 TSecr=2649258113
202,117.747271,192.168.11.45,192.168.11.44,TCP,66,0.000081,,,"40650  >  6000 [FIN, ACK] Seq=28 Ack=1 Win=64256 Len=0 TSval=2649258113 TSecr=1499344061"
203,117.748524,192.168.11.44,192.168.11.45,TCP,66,0.001253,,,"6000  >  40650 [FIN, ACK] Seq=1 Ack=29 Win=65152 Len=0 TSval=1499344070 TSecr=2649258113"
204,117.755517,192.168.11.45,192.168.11.44,TCP,66,0.006993,,,40650  >  6000 [ACK] Seq=29 Ack=2 Win=64256 Len=0 TSval=2649258121 TSecr=1499344070
205,124.916864,192.168.11.44,192.168.11.43,TCP,74,7.161347,,,36816  >  6000 [SYN] Seq=0 Win=64240 Len=0 MSS=1460 SACK_PERM TSval=887710618 TSecr=0 WS=128
206,124.924656,192.168.11.43,192.168.11.44,TCP,74,0.007792,,,"6000  >  36816 [SYN, ACK] Seq=0 Ack=1 Win=65160 Len=0 MSS=1460 SACK_PERM TSval=1294160694 TSecr=887710618 WS=128"
207,124.92476,192.168.11.44,192.168.11.43,TCP,66,0.000104,,,36816  >  6000 [ACK] Seq=1 Ack=1 Win=64256 Len=0 TSval=887710626 TSecr=1294160694
208,124.925058,192.168.11.44,192.168.11.43,TCP,93,0.000298,,,"36816  >  6000 [PSH, ACK] Seq=1 Ack=1 Win=64256 Len=27 TSval=887710627 TSecr=1294160694 [TCP segment of a reassembled PDU]"
209,124.925158,192.168.11.44,192.168.11.43,TCP,66,0.0001,,,"36816  >  6000 [FIN, ACK] Seq=28 Ack=1 Win=64256 Len=0 TSval=887710627 TSecr=1294160694"
210,124.932224,192.168.11.43,192.168.11.44,TCP,66,0.007066,,,6000  >  36816 [ACK] Seq=1 Ack=28 Win=65152 Len=0 TSval=1294160703 TSecr=887710627
211,124.934324,192.168.11.43,192.168.11.44,TCP,66,0.0021,,,"6000  >  36816 [FIN, ACK] Seq=1 Ack=29 Win=65152 Len=0 TSval=1294160705 TSecr=887710627"
212,124.934376,192.168.11.44,192.168.11.43,TCP,66,0.000052,,,36816  >  6000 [ACK] Seq=29 Ack=2 Win=64256 Len=0 TSval=887710636 TSecr=1294160705
213,124.961672,192.168.11.44,255.255.255.255,UDP,209,0.027296,Ÿ,7b2273656d616e74696373223a207b22656e74697479223a2022504944222c202262617365656e74697479223a2022616e79222c2022726f6c65223a2022303034222c20227370617469616c223a2022616e79222c202274656d706f72616c223a2022616e79227d2c20226461746170726f7065727479223a207b22666f726d6174223a2022696e616f6b615f70726f6772616d5f73616d706c655f73656d616e746963227d7d,51113  >  7000 Len=167
214,124.969875,192.168.11.45,192.168.11.44,TCP,74,0.008203,œ,,39734  >  6000 [SYN] Seq=0 Win=64240 Len=0 MSS=1460 SACK_PERM TSval=2649265336 TSecr=0 WS=128
215,124.970003,192.168.11.44,192.168.11.45,TCP,74,0.000128,,,"6000  >  39734 [SYN, ACK] Seq=0 Ack=1 Win=65160 Len=0 MSS=1460 SACK_PERM TSval=1499351292 TSecr=2649265336 WS=128"
216,124.976643,192.168.11.45,192.168.11.44,TCP,66,0.00664,,,39734  >  6000 [ACK] Seq=1 Ack=1 Win=64256 Len=0 TSval=2649265343 TSecr=1499351292
217,124.977214,192.168.11.45,192.168.11.44,TCP,93,0.000571,,,"39734  >  6000 [PSH, ACK] Seq=1 Ack=1 Win=64256 Len=27 TSval=2649265343 TSecr=1499351292 [TCP segment of a reassembled PDU]"
218,124.977316,192.168.11.44,192.168.11.45,TCP,66,0.000102,,,6000  >  39734 [ACK] Seq=1 Ack=28 Win=65152 Len=0 TSval=1499351299 TSecr=2649265343
219,124.977392,192.168.11.45,192.168.11.44,TCP,66,0.000076,,,"39734  >  6000 [FIN, ACK] Seq=28 Ack=1 Win=64256 Len=0 TSval=2649265343 TSecr=1499351292"
220,124.978517,192.168.11.44,192.168.11.45,TCP,66,0.001125,,,"6000  >  39734 [FIN, ACK] Seq=1 Ack=29 Win=65152 Len=0 TSval=1499351300 TSecr=2649265343"
221,124.984464,192.168.11.45,192.168.11.44,TCP,66,0.005947,,,39734  >  6000 [ACK] Seq=29 Ack=2 Win=64256 Len=0 TSval=2649265351 TSecr=1499351300
222,132.076438,192.168.11.44,192.168.11.43,TCP,74,7.091974,,,39752  >  6000 [SYN] Seq=0 Win=64240 Len=0 MSS=1460 SACK_PERM TSval=887717778 TSecr=0 WS=128
223,132.082935,192.168.11.43,192.168.11.44,TCP,74,0.006497,,,"6000  >  39752 [SYN, ACK] Seq=0 Ack=1 Win=65160 Len=0 MSS=1460 SACK_PERM TSval=1294167853 TSecr=887717778 WS=128"
224,132.083034,192.168.11.44,192.168.11.43,TCP,66,0.000099,,,39752  >  6000 [ACK] Seq=1 Ack=1 Win=64256 Len=0 TSval=887717785 TSecr=1294167853
225,132.083223,192.168.11.44,192.168.11.43,TCP,93,0.000189,,,"39752  >  6000 [PSH, ACK] Seq=1 Ack=1 Win=64256 Len=27 TSval=887717785 TSecr=1294167853 [TCP segment of a reassembled PDU]"
226,132.083311,192.168.11.44,192.168.11.43,TCP,66,0.000088,,,"39752  >  6000 [FIN, ACK] Seq=28 Ack=1 Win=64256 Len=0 TSval=887717785 TSecr=1294167853"
227,132.090671,192.168.11.43,192.168.11.44,TCP,66,0.00736,,,6000  >  39752 [ACK] Seq=1 Ack=28 Win=65152 Len=0 TSval=1294167861 TSecr=887717785
228,132.090916,192.168.11.43,192.168.11.44,TCP,66,0.000245,,,"6000  >  39752 [FIN, ACK] Seq=1 Ack=29 Win=65152 Len=0 TSval=1294167863 TSecr=887717785"
229,132.090967,192.168.11.44,192.168.11.43,TCP,66,0.000051,,,39752  >  6000 [ACK] Seq=29 Ack=2 Win=64256 Len=0 TSval=887717792 TSecr=1294167863
230,132.119751,192.168.11.44,255.255.255.255,UDP,209,0.028784,Ÿ,7b2273656d616e74696373223a207b22656e74697479223a2022504944222c202262617365656e74697479223a2022616e79222c2022726f6c65223a2022303034222c20227370617469616c223a2022616e79222c202274656d706f72616c223a2022616e79227d2c20226461746170726f7065727479223a207b22666f726d6174223a2022696e616f6b615f70726f6772616d5f73616d706c655f73656d616e746963227d7d,41151  >  7000 Len=167
231,132.129129,192.168.11.45,192.168.11.44,TCP,74,0.009378,œ,,39750  >  6000 [SYN] Seq=0 Win=64240 Len=0 MSS=1460 SACK_PERM TSval=2649272494 TSecr=0 WS=128
