No.,Time,Source,Destination,Protocol,Length,Time delta from previous captured frame,XXX,Data,Info
1,0,192.168.11.45,192.168.11.44,TCP,74,0,,,59692  >  6000 [SYN] Seq=0 Win=64240 Len=0 MSS=1460 SACK_PERM TSval=2649140422 TSecr=0 WS=128
2,0.006705,192.168.11.44,192.168.11.45,TCP,74,0.006705,,,"6000  >  59692 [SYN, ACK] Seq=0 Ack=1 Win=65160 Len=0 MSS=1460 SACK_PERM TSval=1499226379 TSecr=2649140422 WS=128"
3,0.006818,192.168.11.45,192.168.11.44,TCP,66,0.000113,,,59692  >  6000 [ACK] Seq=1 Ack=1 Win=64256 Len=0 TSval=2649140432 TSecr=1499226379
4,0.007036,192.168.11.45,192.168.11.44,TCP,93,0.000218,,,"59692  >  6000 [PSH, ACK] Seq=1 Ack=1 Win=64256 Len=27 TSval=2649140432 TSecr=1499226379 [TCP segment of a reassembled PDU]"
5,0.007163,192.168.11.45,192.168.11.44,TCP,66,0.000127,,,"59692  >  6000 [FIN, ACK] Seq=28 Ack=1 Win=64256 Len=0 TSval=2649140433 TSecr=1499226379"
6,0.013921,192.168.11.44,192.168.11.45,TCP,66,0.006758,,,6000  >  59692 [ACK] Seq=1 Ack=28 Win=65152 Len=0 TSval=1499226386 TSecr=2649140432
7,0.014184,192.168.11.44,192.168.11.45,TCP,66,0.000263,,,"6000  >  59692 [FIN, ACK] Seq=1 Ack=29 Win=65152 Len=0 TSval=1499226387 TSecr=2649140433"
8,0.014231,192.168.11.45,192.168.11.44,TCP,66,0.000047,,,59692  >  6000 [ACK] Seq=29 Ack=2 Win=64256 Len=0 TSval=2649140440 TSecr=1499226387
9,0.045242,192.168.11.45,255.255.255.255,UDP,209,0.031011,Ÿ,7b2273656d616e74696373223a207b22656e74697479223a2022504944222c202262617365656e74697479223a2022616e79222c2022726f6c65223a2022303035222c20227370617469616c223a2022616e79222c202274656d706f72616c223a2022616e79227d2c20226461746170726f7065727479223a207b22666f726d6174223a2022696e616f6b615f70726f6772616d5f73616d706c655f73656d616e746963227d7d,47522  >  7000 Len=167
10,0.057876,192.168.11.46,192.168.11.45,TCP,74,0.012634,œ,,45982  >  6000 [SYN] Seq=0 Win=64240 Len=0 MSS=1460 SACK_PERM TSval=2271987617 TSecr=0 WS=128
11,0.05804,192.168.11.45,192.168.11.46,TCP,74,0.000164,,,"6000  >  45982 [SYN, ACK] Seq=0 Ack=1 Win=65160 Len=0 MSS=1460 SACK_PERM TSval=1381555502 TSecr=2271987617 WS=128"
12,0.066106,192.168.11.46,192.168.11.45,TCP,66,0.008066,,,45982  >  6000 [ACK] Seq=1 Ack=1 Win=64256 Len=0 TSval=2271987631 TSecr=1381555502
13,0.066741,192.168.11.46,192.168.11.45,TCP,93,0.000635,,,"45982  >  6000 [PSH, ACK] Seq=1 Ack=1 Win=64256 Len=27 TSval=2271987631 TSecr=1381555502 [TCP segment of a reassembled PDU]"
14,0.066833,192.168.11.45,192.168.11.46,TCP,66,0.000092,,,6000  >  45982 [ACK] Seq=1 Ack=28 Win=65152 Len=0 TSval=1381555511 TSecr=2271987631
15,0.06691,192.168.11.46,192.168.11.45,TCP,66,0.000077,,,"45982  >  6000 [FIN, ACK] Seq=28 Ack=1 Win=64256 Len=0 TSval=2271987631 TSecr=1381555502"
16,0.06816,192.168.11.45,192.168.11.46,TCP,66,0.00125,,,"6000  >  45982 [FIN, ACK] Seq=1 Ack=29 Win=65152 Len=0 TSval=1381555513 TSecr=2271987631"
17,0.077283,192.168.11.46,192.168.11.45,TCP,66,0.009123,,,45982  >  6000 [ACK] Seq=29 Ack=2 Win=64256 Len=0 TSval=2271987639 TSecr=1381555513
18,7.270732,192.168.11.45,192.168.11.44,TCP,74,7.193449,,,59394  >  6000 [SYN] Seq=0 Win=64240 Len=0 MSS=1460 SACK_PERM TSval=2649147696 TSecr=0 WS=128
19,7.280486,192.168.11.44,192.168.11.45,TCP,74,0.009754,,,"6000  >  59394 [SYN, ACK] Seq=0 Ack=1 Win=65160 Len=0 MSS=1460 SACK_PERM TSval=1499233653 TSecr=2649147696 WS=128"
20,7.280595,192.168.11.45,192.168.11.44,TCP,66,0.000109,,,59394  >  6000 [ACK] Seq=1 Ack=1 Win=64256 Len=0 TSval=2649147706 TSecr=1499233653
21,7.280766,192.168.11.45,192.168.11.44,TCP,93,0.000171,,,"59394  >  6000 [PSH, ACK] Seq=1 Ack=1 Win=64256 Len=27 TSval=2649147706 TSecr=1499233653 [TCP segment of a reassembled PDU]"
22,7.280894,192.168.11.45,192.168.11.44,TCP,66,0.000128,,,"59394  >  6000 [FIN, ACK] Seq=28 Ack=1 Win=64256 Len=0 TSval=2649147706 TSecr=1499233653"
23,7.2882,192.168.11.44,192.168.11.45,TCP,66,0.007306,,,6000  >  59394 [ACK] Seq=1 Ack=28 Win=65152 Len=0 TSval=1499233660 TSecr=2649147706
24,7.288436,192.168.11.44,192.168.11.45,TCP,66,0.000236,,,"6000  >  59394 [FIN, ACK] Seq=1 Ack=29 Win=65152 Len=0 TSval=1499233662 TSecr=2649147706"
25,7.28848,192.168.11.45,192.168.11.44,TCP,66,0.000044,,,59394  >  6000 [ACK] Seq=29 Ack=2 Win=64256 Len=0 TSval=2649147714 TSecr=1499233662
26,7.319426,192.168.11.45,255.255.255.255,UDP,209,0.030946,Ÿ,7b2273656d616e74696373223a207b22656e74697479223a2022504944222c202262617365656e74697479223a2022616e79222c2022726f6c65223a2022303035222c20227370617469616c223a2022616e79222c202274656d706f72616c223a2022616e79227d2c20226461746170726f7065727479223a207b22666f726d6174223a2022696e616f6b615f70726f6772616d5f73616d706c655f73656d616e746963227d7d,42195  >  7000 Len=167
27,7.326537,192.168.11.46,192.168.11.45,TCP,74,0.007111,œ,,44760  >  6000 [SYN] Seq=0 Win=64240 Len=0 MSS=1460 SACK_PERM TSval=2271994891 TSecr=0 WS=128
28,7.326701,192.168.11.45,192.168.11.46,TCP,74,0.000164,,,"6000  >  44760 [SYN, ACK] Seq=0 Ack=1 Win=65160 Len=0 MSS=1460 SACK_PERM TSval=1381562771 TSecr=2271994891 WS=128"
29,7.335892,192.168.11.46,192.168.11.45,TCP,66,0.009191,,,44760  >  6000 [ACK] Seq=1 Ack=1 Win=64256 Len=0 TSval=2271994901 TSecr=1381562771
30,7.33652,192.168.11.46,192.168.11.45,TCP,93,0.000628,,,"44760  >  6000 [PSH, ACK] Seq=1 Ack=1 Win=64256 Len=27 TSval=2271994901 TSecr=1381562771 [TCP segment of a reassembled PDU]"
31,7.33662,192.168.11.45,192.168.11.46,TCP,66,0.0001,,,6000  >  44760 [ACK] Seq=1 Ack=28 Win=65152 Len=0 TSval=1381562781 TSecr=2271994901
32,7.336691,192.168.11.46,192.168.11.45,TCP,66,0.000071,,,"44760  >  6000 [FIN, ACK] Seq=28 Ack=1 Win=64256 Len=0 TSval=2271994901 TSecr=1381562771"
33,7.338756,192.168.11.45,192.168.11.46,TCP,66,0.002065,,,"6000  >  44760 [FIN, ACK] Seq=1 Ack=29 Win=65152 Len=0 TSval=1381562783 TSecr=2271994901"
34,7.34781,192.168.11.46,192.168.11.45,TCP,66,0.009054,,,44760  >  6000 [ACK] Seq=29 Ack=2 Win=64256 Len=0 TSval=2271994912 TSecr=1381562783
35,14.56504,192.168.11.45,192.168.11.44,TCP,74,7.21723,,,36636  >  6000 [SYN] Seq=0 Win=64240 Len=0 MSS=1460 SACK_PERM TSval=2649154990 TSecr=0 WS=128
36,14.572283,192.168.11.44,192.168.11.45,TCP,74,0.007243,,,"6000  >  36636 [SYN, ACK] Seq=0 Ack=1 Win=65160 Len=0 MSS=1460 SACK_PERM TSval=1499240944 TSecr=2649154990 WS=128"
37,14.572387,192.168.11.45,192.168.11.44,TCP,66,0.000104,,,36636  >  6000 [ACK] Seq=1 Ack=1 Win=64256 Len=0 TSval=2649154998 TSecr=1499240944
38,14.57253,192.168.11.45,192.168.11.44,TCP,93,0.000143,,,"36636  >  6000 [PSH, ACK] Seq=1 Ack=1 Win=64256 Len=27 TSval=2649154998 TSecr=1499240944 [TCP segment of a reassembled PDU]"
39,14.572651,192.168.11.45,192.168.11.44,TCP,66,0.000121,,,"36636  >  6000 [FIN, ACK] Seq=28 Ack=1 Win=64256 Len=0 TSval=2649154998 TSecr=1499240944"
40,14.579934,192.168.11.44,192.168.11.45,TCP,66,0.007283,,,6000  >  36636 [ACK] Seq=1 Ack=28 Win=65152 Len=0 TSval=1499240952 TSecr=2649154998
41,14.580326,192.168.11.44,192.168.11.45,TCP,66,0.000392,,,"6000  >  36636 [FIN, ACK] Seq=1 Ack=29 Win=65152 Len=0 TSval=1499240953 TSecr=2649154998"
42,14.580383,192.168.11.45,192.168.11.44,TCP,66,0.000057,,,36636  >  6000 [ACK] Seq=29 Ack=2 Win=64256 Len=0 TSval=2649155006 TSecr=1499240953
43,14.610403,192.168.11.45,255.255.255.255,UDP,209,0.03002,Ÿ,7b2273656d616e74696373223a207b22656e74697479223a2022504944222c202262617365656e74697479223a2022616e79222c2022726f6c65223a2022303035222c20227370617469616c223a2022616e79222c202274656d706f72616c223a2022616e79227d2c20226461746170726f7065727479223a207b22666f726d6174223a2022696e616f6b615f70726f6772616d5f73616d706c655f73656d616e746963227d7d,55882  >  7000 Len=167
44,14.618912,192.168.11.46,192.168.11.45,TCP,74,0.008509,œ,,38438  >  6000 [SYN] Seq=0 Win=64240 Len=0 MSS=1460 SACK_PERM TSval=2272002183 TSecr=0 WS=128
45,14.619051,192.168.11.45,192.168.11.46,TCP,74,0.000139,,,"6000  >  38438 [SYN, ACK] Seq=0 Ack=1 Win=65160 Len=0 MSS=1460 SACK_PERM TSval=1381570063 TSecr=2272002183 WS=128"
46,14.628475,192.168.11.46,192.168.11.45,TCP,66,0.009424,,,38438  >  6000 [ACK] Seq=1 Ack=1 Win=64256 Len=0 TSval=2272002193 TSecr=1381570063
47,14.629151,192.168.11.46,192.168.11.45,TCP,93,0.000676,,,"38438  >  6000 [PSH, ACK] Seq=1 Ack=1 Win=64256 Len=27 TSval=2272002193 TSecr=1381570063 [TCP segment of a reassembled PDU]"
48,14.629269,192.168.11.45,192.168.11.46,TCP,66,0.000118,,,6000  >  38438 [ACK] Seq=1 Ack=28 Win=65152 Len=0 TSval=1381570074 TSecr=2272002193
49,14.629353,192.168.11.46,192.168.11.45,TCP,66,0.000084,,,"38438  >  6000 [FIN, ACK] Seq=28 Ack=1 Win=64256 Len=0 TSval=2272002194 TSecr=1381570063"
50,14.630785,192.168.11.45,192.168.11.46,TCP,66,0.001432,,,"6000  >  38438 [FIN, ACK] Seq=1 Ack=29 Win=65152 Len=0 TSval=1381570075 TSecr=2272002194"
51,14.640358,192.168.11.46,192.168.11.45,TCP,66,0.009573,,,38438  >  6000 [ACK] Seq=29 Ack=2 Win=64256 Len=0 TSval=2272002204 TSecr=1381570075
52,21.775553,192.168.11.45,192.168.11.44,TCP,74,7.135195,,,36642  >  6000 [SYN] Seq=0 Win=64240 Len=0 MSS=1460 SACK_PERM TSval=2649162201 TSecr=0 WS=128
53,21.782097,192.168.11.44,192.168.11.45,TCP,74,0.006544,,,"6000  >  36642 [SYN, ACK] Seq=0 Ack=1 Win=65160 Len=0 MSS=1460 SACK_PERM TSval=1499248154 TSecr=2649162201 WS=128"
54,21.782215,192.168.11.45,192.168.11.44,TCP,66,0.000118,,,36642  >  6000 [ACK] Seq=1 Ack=1 Win=64256 Len=0 TSval=2649162208 TSecr=1499248154
55,21.782353,192.168.11.45,192.168.11.44,TCP,93,0.000138,,,"36642  >  6000 [PSH, ACK] Seq=1 Ack=1 Win=64256 Len=27 TSval=2649162208 TSecr=1499248154 [TCP segment of a reassembled PDU]"
56,21.782448,192.168.11.45,192.168.11.44,TCP,66,0.000095,,,"36642  >  6000 [FIN, ACK] Seq=28 Ack=1 Win=64256 Len=0 TSval=2649162208 TSecr=1499248154"
57,21.790962,192.168.11.44,192.168.11.45,TCP,66,0.008514,,,6000  >  36642 [ACK] Seq=1 Ack=28 Win=65152 Len=0 TSval=1499248163 TSecr=2649162208
58,21.791402,192.168.11.44,192.168.11.45,TCP,66,0.00044,,,"6000  >  36642 [FIN, ACK] Seq=1 Ack=29 Win=65152 Len=0 TSval=1499248164 TSecr=2649162208"
59,21.791447,192.168.11.45,192.168.11.44,TCP,66,0.000045,,,36642  >  6000 [ACK] Seq=29 Ack=2 Win=64256 Len=0 TSval=2649162217 TSecr=1499248164
60,21.821605,192.168.11.45,255.255.255.255,UDP,209,0.030158,Ÿ,7b2273656d616e74696373223a207b22656e74697479223a2022504944222c202262617365656e74697479223a2022616e79222c2022726f6c65223a2022303035222c20227370617469616c223a2022616e79222c202274656d706f72616c223a2022616e79227d2c20226461746170726f7065727479223a207b22666f726d6174223a2022696e616f6b615f70726f6772616d5f73616d706c655f73656d616e746963227d7d,57339  >  7000 Len=167
61,21.865426,192.168.11.46,192.168.11.45,TCP,74,0.043821,œ,,38444  >  6000 [SYN] Seq=0 Win=64240 Len=0 MSS=1460 SACK_PERM TSval=2272009430 TSecr=0 WS=128
62,21.865566,192.168.11.45,192.168.11.46,TCP,74,0.00014,,,"6000  >  38444 [SYN, ACK] Seq=0 Ack=1 Win=65160 Len=0 MSS=1460 SACK_PERM TSval=1381577310 TSecr=2272009430 WS=128"
63,21.874285,192.168.11.46,192.168.11.45,TCP,66,0.008719,,,38444  >  6000 [ACK] Seq=1 Ack=1 Win=64256 Len=0 TSval=2272009439 TSecr=1381577310
64,21.87473,192.168.11.46,192.168.11.45,TCP,93,0.000445,,,"38444  >  6000 [PSH, ACK] Seq=1 Ack=1 Win=64256 Len=27 TSval=2272009440 TSecr=1381577310 [TCP segment of a reassembled PDU]"
65,21.874788,192.168.11.45,192.168.11.46,TCP,66,0.000058,,,6000  >  38444 [ACK] Seq=1 Ack=28 Win=65152 Len=0 TSval=1381577319 TSecr=2272009440
66,21.874846,192.168.11.46,192.168.11.45,TCP,66,0.000058,,,"38444  >  6000 [FIN, ACK] Seq=28 Ack=1 Win=64256 Len=0 TSval=2272009440 TSecr=1381577310"
67,21.875873,192.168.11.45,192.168.11.46,TCP,66,0.001027,,,"6000  >  38444 [FIN, ACK] Seq=1 Ack=29 Win=65152 Len=0 TSval=1381577320 TSecr=2272009440"
68,21.883631,192.168.11.46,192.168.11.45,TCP,66,0.007758,,,38444  >  6000 [ACK] Seq=29 Ack=2 Win=64256 Len=0 TSval=2272009448 TSecr=1381577320
69,28.958511,192.168.11.45,192.168.11.44,TCP,74,7.07488,,,49254  >  6000 [SYN] Seq=0 Win=64240 Len=0 MSS=1460 SACK_PERM TSval=2649169384 TSecr=0 WS=128
70,28.965197,192.168.11.44,192.168.11.45,TCP,74,0.006686,,,"6000  >  49254 [SYN, ACK] Seq=0 Ack=1 Win=65160 Len=0 MSS=1460 SACK_PERM TSval=1499255338 TSecr=2649169384 WS=128"
71,28.96531,192.168.11.45,192.168.11.44,TCP,66,0.000113,,,49254  >  6000 [ACK] Seq=1 Ack=1 Win=64256 Len=0 TSval=2649169391 TSecr=1499255338
72,28.965567,192.168.11.45,192.168.11.44,TCP,93,0.000257,,,"49254  >  6000 [PSH, ACK] Seq=1 Ack=1 Win=64256 Len=27 TSval=2649169391 TSecr=1499255338 [TCP segment of a reassembled PDU]"
73,28.965685,192.168.11.45,192.168.11.44,TCP,66,0.000118,,,"49254  >  6000 [FIN, ACK] Seq=28 Ack=1 Win=64256 Len=0 TSval=2649169391 TSecr=1499255338"
74,28.972955,192.168.11.44,192.168.11.45,TCP,66,0.00727,,,6000  >  49254 [ACK] Seq=1 Ack=28 Win=65152 Len=0 TSval=1499255345 TSecr=2649169391
75,28.973308,192.168.11.44,192.168.11.45,TCP,66,0.000353,,,"6000  >  49254 [FIN, ACK] Seq=1 Ack=29 Win=65152 Len=0 TSval=1499255346 TSecr=2649169391"
76,28.973355,192.168.11.45,192.168.11.44,TCP,66,0.000047,,,49254  >  6000 [ACK] Seq=29 Ack=2 Win=64256 Len=0 TSval=2649169399 TSecr=1499255346
77,29.001405,192.168.11.45,255.255.255.255,UDP,209,0.02805,Ÿ,7b2273656d616e74696373223a207b22656e74697479223a2022504944222c202262617365656e74697479223a2022616e79222c2022726f6c65223a2022303035222c20227370617469616c223a2022616e79222c202274656d706f72616c223a2022616e79227d2c20226461746170726f7065727479223a207b22666f726d6174223a2022696e616f6b615f70726f6772616d5f73616d706c655f73656d616e746963227d7d,46320  >  7000 Len=167
78,29.008459,192.168.11.46,192.168.11.45,TCP,74,0.007054,œ,,44800  >  6000 [SYN] Seq=0 Win=64240 Len=0 MSS=1460 SACK_PERM TSval=2272016574 TSecr=0 WS=128
79,29.008603,192.168.11.45,192.168.11.46,TCP,74,0.000144,,,"6000  >  44800 [SYN, ACK] Seq=0 Ack=1 Win=65160 Len=0 MSS=1460 SACK_PERM TSval=1381584453 TSecr=2272016574 WS=128"
80,29.01791,192.168.11.46,192.168.11.45,TCP,93,0.009307,,,"44800  >  6000 [PSH, ACK] Seq=1 Ack=1 Win=64256 Len=27 TSval=2272016583 TSecr=1381584453 [TCP segment of a reassembled PDU]"
81,29.018153,192.168.11.45,192.168.11.46,TCP,66,0.000243,,,6000  >  44800 [ACK] Seq=1 Ack=28 Win=65152 Len=0 TSval=1381584462 TSecr=2272016583
82,29.018537,192.168.11.46,192.168.11.45,TCP,66,0.000384,,,44800  >  6000 [ACK] Seq=1 Ack=1 Win=64256 Len=0 TSval=2272016583 TSecr=1381584453
83,29.018627,192.168.11.45,192.168.11.46,TCP,66,0.00009,,,[TCP Dup ACK 81#1] 6000  >  44800 [ACK] Seq=1 Ack=28 Win=65152 Len=0 TSval=1381584463 TSecr=2272016583
84,29.018915,192.168.11.46,192.168.11.45,TCP,66,0.000288,,,"44800  >  6000 [FIN, ACK] Seq=28 Ack=1 Win=64256 Len=0 TSval=2272016583 TSecr=1381584453"
85,29.020043,192.168.11.45,192.168.11.46,TCP,66,0.001128,,,"6000  >  44800 [FIN, ACK] Seq=1 Ack=29 Win=65152 Len=0 TSval=1381584464 TSecr=2272016583"
86,29.027493,192.168.11.46,192.168.11.45,TCP,66,0.00745,,,44800  >  6000 [ACK] Seq=29 Ack=2 Win=64256 Len=0 TSval=2272016592 TSecr=1381584464
87,36.126651,192.168.11.45,192.168.11.44,TCP,74,7.099158,,,33424  >  6000 [SYN] Seq=0 Win=64240 Len=0 MSS=1460 SACK_PERM TSval=2649176552 TSecr=0 WS=128
88,36.133495,192.168.11.44,192.168.11.45,TCP,74,0.006844,,,"6000  >  33424 [SYN, ACK] Seq=0 Ack=1 Win=65160 Len=0 MSS=1460 SACK_PERM TSval=1499262506 TSecr=2649176552 WS=128"
89,36.133596,192.168.11.45,192.168.11.44,TCP,66,0.000101,,,33424  >  6000 [ACK] Seq=1 Ack=1 Win=64256 Len=0 TSval=2649176559 TSecr=1499262506
90,36.133779,192.168.11.45,192.168.11.44,TCP,93,0.000183,,,"33424  >  6000 [PSH, ACK] Seq=1 Ack=1 Win=64256 Len=27 TSval=2649176559 TSecr=1499262506 [TCP segment of a reassembled PDU]"
91,36.133874,192.168.11.45,192.168.11.44,TCP,66,0.000095,,,"33424  >  6000 [FIN, ACK] Seq=28 Ack=1 Win=64256 Len=0 TSval=2649176559 TSecr=1499262506"
92,36.141793,192.168.11.44,192.168.11.45,TCP,66,0.007919,,,6000  >  33424 [ACK] Seq=1 Ack=28 Win=65152 Len=0 TSval=1499262514 TSecr=2649176559
93,36.142269,192.168.11.44,192.168.11.45,TCP,66,0.000476,,,"6000  >  33424 [FIN, ACK] Seq=1 Ack=29 Win=65152 Len=0 TSval=1499262516 TSecr=2649176559"
94,36.142315,192.168.11.45,192.168.11.44,TCP,66,0.000046,,,33424  >  6000 [ACK] Seq=29 Ack=2 Win=64256 Len=0 TSval=2649176568 TSecr=1499262516
95,36.171815,192.168.11.45,255.255.255.255,UDP,209,0.0295,Ÿ,7b2273656d616e74696373223a207b22656e74697479223a2022504944222c202262617365656e74697479223a2022616e79222c2022726f6c65223a2022303035222c20227370617469616c223a2022616e79222c202274656d706f72616c223a2022616e79227d2c20226461746170726f7065727479223a207b22666f726d6174223a2022696e616f6b615f70726f6772616d5f73616d706c655f73656d616e746963227d7d,53812  >  7000 Len=167
96,36.20212,192.168.11.46,192.168.11.45,TCP,74,0.030305,œ,,51326  >  6000 [SYN] Seq=0 Win=64240 Len=0 MSS=1460 SACK_PERM TSval=2272023766 TSecr=0 WS=128
97,36.202263,192.168.11.45,192.168.11.46,TCP,74,0.000143,,,"6000  >  51326 [SYN, ACK] Seq=0 Ack=1 Win=65160 Len=0 MSS=1460 SACK_PERM TSval=1381591647 TSecr=2272023766 WS=128"
98,36.211211,192.168.11.46,192.168.11.45,TCP,66,0.008948,,,51326  >  6000 [ACK] Seq=1 Ack=1 Win=64256 Len=0 TSval=2272023777 TSecr=1381591647
99,36.211573,192.168.11.46,192.168.11.45,TCP,93,0.000362,,,"51326  >  6000 [PSH, ACK] Seq=1 Ack=1 Win=64256 Len=27 TSval=2272023777 TSecr=1381591647 [TCP segment of a reassembled PDU]"
100,36.21163,192.168.11.45,192.168.11.46,TCP,66,0.000057,,,6000  >  51326 [ACK] Seq=1 Ack=28 Win=65152 Len=0 TSval=1381591656 TSecr=2272023777
101,36.211677,192.168.11.46,192.168.11.45,TCP,66,0.000047,,,"51326  >  6000 [FIN, ACK] Seq=28 Ack=1 Win=64256 Len=0 TSval=2272023777 TSecr=1381591647"
102,36.212552,192.168.11.45,192.168.11.46,TCP,66,0.000875,,,"6000  >  51326 [FIN, ACK] Seq=1 Ack=29 Win=65152 Len=0 TSval=1381591657 TSecr=2272023777"
103,36.22077,192.168.11.46,192.168.11.45,TCP,66,0.008218,,,51326  >  6000 [ACK] Seq=29 Ack=2 Win=64256 Len=0 TSval=2272023785 TSecr=1381591657
104,43.368824,192.168.11.45,192.168.11.44,TCP,74,7.148054,,,57940  >  6000 [SYN] Seq=0 Win=64240 Len=0 MSS=1460 SACK_PERM TSval=2649183794 TSecr=0 WS=128
105,43.376264,192.168.11.44,192.168.11.45,TCP,74,0.00744,,,"6000  >  57940 [SYN, ACK] Seq=0 Ack=1 Win=65160 Len=0 MSS=1460 SACK_PERM TSval=1499269749 TSecr=2649183794 WS=128"
106,43.376368,192.168.11.45,192.168.11.44,TCP,66,0.000104,,,57940  >  6000 [ACK] Seq=1 Ack=1 Win=64256 Len=0 TSval=2649183802 TSecr=1499269749
107,43.376536,192.168.11.45,192.168.11.44,TCP,93,0.000168,,,"57940  >  6000 [PSH, ACK] Seq=1 Ack=1 Win=64256 Len=27 TSval=2649183802 TSecr=1499269749 [TCP segment of a reassembled PDU]"
108,43.376663,192.168.11.45,192.168.11.44,TCP,66,0.000127,,,"57940  >  6000 [FIN, ACK] Seq=28 Ack=1 Win=64256 Len=0 TSval=2649183802 TSecr=1499269749"
109,43.383802,192.168.11.44,192.168.11.45,TCP,66,0.007139,,,6000  >  57940 [ACK] Seq=1 Ack=28 Win=65152 Len=0 TSval=1499269756 TSecr=2649183802
110,43.384182,192.168.11.44,192.168.11.45,TCP,66,0.00038,,,"6000  >  57940 [FIN, ACK] Seq=1 Ack=29 Win=65152 Len=0 TSval=1499269758 TSecr=2649183802"
111,43.384233,192.168.11.45,192.168.11.44,TCP,66,0.000051,,,57940  >  6000 [ACK] Seq=29 Ack=2 Win=64256 Len=0 TSval=2649183810 TSecr=1499269758
112,43.414777,192.168.11.45,255.255.255.255,UDP,209,0.030544,Ÿ,7b2273656d616e74696373223a207b22656e74697479223a2022504944222c202262617365656e74697479223a2022616e79222c2022726f6c65223a2022303035222c20227370617469616c223a2022616e79222c202274656d706f72616c223a2022616e79227d2c20226461746170726f7065727479223a207b22666f726d6174223a2022696e616f6b615f70726f6772616d5f73616d706c655f73656d616e746963227d7d,53486  >  7000 Len=167
113,43.423006,192.168.11.46,192.168.11.45,TCP,74,0.008229,œ,,51112  >  6000 [SYN] Seq=0 Win=64240 Len=0 MSS=1460 SACK_PERM TSval=2272030987 TSecr=0 WS=128
114,43.423151,192.168.11.45,192.168.11.46,TCP,74,0.000145,,,"6000  >  51112 [SYN, ACK] Seq=0 Ack=1 Win=65160 Len=0 MSS=1460 SACK_PERM TSval=1381598868 TSecr=2272030987 WS=128"
115,43.436113,192.168.11.46,192.168.11.45,TCP,66,0.012962,,,51112  >  6000 [ACK] Seq=1 Ack=1 Win=64256 Len=0 TSval=2272031000 TSecr=1381598868
116,43.437022,192.168.11.46,192.168.11.45,TCP,93,0.000909,,,"51112  >  6000 [PSH, ACK] Seq=1 Ack=1 Win=64256 Len=27 TSval=2272031000 TSecr=1381598868 [TCP segment of a reassembled PDU]"
117,43.437223,192.168.11.45,192.168.11.46,TCP,66,0.000201,,,6000  >  51112 [ACK] Seq=1 Ack=28 Win=65152 Len=0 TSval=1381598882 TSecr=2272031000
118,43.437374,192.168.11.46,192.168.11.45,TCP,66,0.000151,,,"51112  >  6000 [FIN, ACK] Seq=28 Ack=1 Win=64256 Len=0 TSval=2272031001 TSecr=1381598868"
119,43.439067,192.168.11.45,192.168.11.46,TCP,66,0.001693,,,"6000  >  51112 [FIN, ACK] Seq=1 Ack=29 Win=65152 Len=0 TSval=1381598883 TSecr=2272031001"
120,43.445362,192.168.11.46,192.168.11.45,TCP,66,0.006295,,,51112  >  6000 [ACK] Seq=29 Ack=2 Win=64256 Len=0 TSval=2272031011 TSecr=1381598883
121,50.532936,192.168.11.45,192.168.11.44,TCP,74,7.087574,,,57944  >  6000 [SYN] Seq=0 Win=64240 Len=0 MSS=1460 SACK_PERM TSval=2649190958 TSecr=0 WS=128
122,50.539524,192.168.11.44,192.168.11.45,TCP,74,0.006588,,,"6000  >  57944 [SYN, ACK] Seq=0 Ack=1 Win=65160 Len=0 MSS=1460 SACK_PERM TSval=1499276912 TSecr=2649190958 WS=128"
123,50.539623,192.168.11.45,192.168.11.44,TCP,66,0.000099,,,57944  >  6000 [ACK] Seq=1 Ack=1 Win=64256 Len=0 TSval=2649190965 TSecr=1499276912
124,50.539803,192.168.11.45,192.168.11.44,TCP,93,0.00018,,,"57944  >  6000 [PSH, ACK] Seq=1 Ack=1 Win=64256 Len=27 TSval=2649190965 TSecr=1499276912 [TCP segment of a reassembled PDU]"
125,50.53993,192.168.11.45,192.168.11.44,TCP,66,0.000127,,,"57944  >  6000 [FIN, ACK] Seq=28 Ack=1 Win=64256 Len=0 TSval=2649190965 TSecr=1499276912"
126,50.547267,192.168.11.44,192.168.11.45,TCP,66,0.007337,,,6000  >  57944 [ACK] Seq=1 Ack=28 Win=65152 Len=0 TSval=1499276920 TSecr=2649190965
127,50.547513,192.168.11.44,192.168.11.45,TCP,66,0.000246,,,"6000  >  57944 [FIN, ACK] Seq=1 Ack=29 Win=65152 Len=0 TSval=1499276922 TSecr=2649190965"
128,50.54756,192.168.11.45,192.168.11.44,TCP,66,0.000047,,,57944  >  6000 [ACK] Seq=29 Ack=2 Win=64256 Len=0 TSval=2649190973 TSecr=1499276922
129,50.578017,192.168.11.45,255.255.255.255,UDP,209,0.030457,Ÿ,7b2273656d616e74696373223a207b22656e74697479223a2022504944222c202262617365656e74697479223a2022616e79222c2022726f6c65223a2022303035222c20227370617469616c223a2022616e79222c202274656d706f72616c223a2022616e79227d2c20226461746170726f7065727479223a207b22666f726d6174223a2022696e616f6b615f70726f6772616d5f73616d706c655f73656d616e746963227d7d,57059  >  7000 Len=167
130,50.586748,192.168.11.46,192.168.11.45,TCP,74,0.008731,œ,,51118  >  6000 [SYN] Seq=0 Win=64240 Len=0 MSS=1460 SACK_PERM TSval=2272038151 TSecr=0 WS=128
131,50.586898,192.168.11.45,192.168.11.46,TCP,74,0.00015,,,"6000  >  51118 [SYN, ACK] Seq=0 Ack=1 Win=65160 Len=0 MSS=1460 SACK_PERM TSval=1381606031 TSecr=2272038151 WS=128"
132,50.600304,192.168.11.46,192.168.11.45,TCP,66,0.013406,,,51118  >  6000 [ACK] Seq=1 Ack=1 Win=64256 Len=0 TSval=2272038162 TSecr=1381606031
133,50.601004,192.168.11.46,192.168.11.45,TCP,93,0.0007,,,"51118  >  6000 [PSH, ACK] Seq=1 Ack=1 Win=64256 Len=27 TSval=2272038162 TSecr=1381606031 [TCP segment of a reassembled PDU]"
134,50.601132,192.168.11.45,192.168.11.46,TCP,66,0.000128,,,6000  >  51118 [ACK] Seq=1 Ack=28 Win=65152 Len=0 TSval=1381606045 TSecr=2272038162
135,50.601225,192.168.11.46,192.168.11.45,TCP,66,0.000093,,,"51118  >  6000 [FIN, ACK] Seq=28 Ack=1 Win=64256 Len=0 TSval=2272038163 TSecr=1381606031"
136,50.602728,192.168.11.45,192.168.11.46,TCP,66,0.001503,,,"6000  >  51118 [FIN, ACK] Seq=1 Ack=29 Win=65152 Len=0 TSval=1381606047 TSecr=2272038163"
137,50.61053,192.168.11.46,192.168.11.45,TCP,66,0.007802,,,51118  >  6000 [ACK] Seq=29 Ack=2 Win=64256 Len=0 TSval=2272038175 TSecr=1381606047
138,57.675649,192.168.11.45,192.168.11.44,TCP,74,7.065119,,,55752  >  6000 [SYN] Seq=0 Win=64240 Len=0 MSS=1460 SACK_PERM TSval=2649198101 TSecr=0 WS=128
139,57.682508,192.168.11.44,192.168.11.45,TCP,74,0.006859,,,"6000  >  55752 [SYN, ACK] Seq=0 Ack=1 Win=65160 Len=0 MSS=1460 SACK_PERM TSval=1499284055 TSecr=2649198101 WS=128"
140,57.682613,192.168.11.45,192.168.11.44,TCP,66,0.000105,,,55752  >  6000 [ACK] Seq=1 Ack=1 Win=64256 Len=0 TSval=2649198108 TSecr=1499284055
141,57.682788,192.168.11.45,192.168.11.44,TCP,93,0.000175,,,"55752  >  6000 [PSH, ACK] Seq=1 Ack=1 Win=64256 Len=27 TSval=2649198108 TSecr=1499284055 [TCP segment of a reassembled PDU]"
142,57.682886,192.168.11.45,192.168.11.44,TCP,66,0.000098,,,"55752  >  6000 [FIN, ACK] Seq=28 Ack=1 Win=64256 Len=0 TSval=2649198108 TSecr=1499284055"
143,57.690204,192.168.11.44,192.168.11.45,TCP,66,0.007318,,,6000  >  55752 [ACK] Seq=1 Ack=28 Win=65152 Len=0 TSval=1499284063 TSecr=2649198108
144,57.690585,192.168.11.44,192.168.11.45,TCP,66,0.000381,,,"6000  >  55752 [FIN, ACK] Seq=1 Ack=29 Win=65152 Len=0 TSval=1499284064 TSecr=2649198108"
145,57.690629,192.168.11.45,192.168.11.44,TCP,66,0.000044,,,55752  >  6000 [ACK] Seq=29 Ack=2 Win=64256 Len=0 TSval=2649198116 TSecr=1499284064
146,57.721048,192.168.11.45,255.255.255.255,UDP,209,0.030419,Ÿ,7b2273656d616e74696373223a207b22656e74697479223a2022504944222c202262617365656e74697479223a2022616e79222c2022726f6c65223a2022303035222c20227370617469616c223a2022616e79222c202274656d706f72616c223a2022616e79227d2c20226461746170726f7065727479223a207b22666f726d6174223a2022696e616f6b615f70726f6772616d5f73616d706c655f73656d616e746963227d7d,60945  >  7000 Len=167
147,57.730507,192.168.11.46,192.168.11.45,TCP,74,0.009459,œ,,54760  >  6000 [SYN] Seq=0 Win=64240 Len=0 MSS=1460 SACK_PERM TSval=2272045295 TSecr=0 WS=128
148,57.730656,192.168.11.45,192.168.11.46,TCP,74,0.000149,,,"6000  >  54760 [SYN, ACK] Seq=0 Ack=1 Win=65160 Len=0 MSS=1460 SACK_PERM TSval=1381613175 TSecr=2272045295 WS=128"
149,57.740993,192.168.11.46,192.168.11.45,TCP,66,0.010337,,,54760  >  6000 [ACK] Seq=1 Ack=1 Win=64256 Len=0 TSval=2272045306 TSecr=1381613175
150,57.741586,192.168.11.46,192.168.11.45,TCP,93,0.000593,,,"54760  >  6000 [PSH, ACK] Seq=1 Ack=1 Win=64256 Len=27 TSval=2272045306 TSecr=1381613175 [TCP segment of a reassembled PDU]"
151,57.741715,192.168.11.45,192.168.11.46,TCP,66,0.000129,,,6000  >  54760 [ACK] Seq=1 Ack=28 Win=65152 Len=0 TSval=1381613186 TSecr=2272045306
152,57.741789,192.168.11.46,192.168.11.45,TCP,66,0.000074,,,"54760  >  6000 [FIN, ACK] Seq=28 Ack=1 Win=64256 Len=0 TSval=2272045306 TSecr=1381613175"
153,57.743238,192.168.11.45,192.168.11.46,TCP,66,0.001449,,,"6000  >  54760 [FIN, ACK] Seq=1 Ack=29 Win=65152 Len=0 TSval=1381613188 TSecr=2272045306"
154,57.751437,192.168.11.46,192.168.11.45,TCP,66,0.008199,,,54760  >  6000 [ACK] Seq=29 Ack=2 Win=64256 Len=0 TSval=2272045316 TSecr=1381613188
155,64.822021,192.168.11.45,192.168.11.44,TCP,74,7.070584,,,37690  >  6000 [SYN] Seq=0 Win=64240 Len=0 MSS=1460 SACK_PERM TSval=2649205247 TSecr=0 WS=128
156,64.829014,192.168.11.44,192.168.11.45,TCP,74,0.006993,,,"6000  >  37690 [SYN, ACK] Seq=0 Ack=1 Win=65160 Len=0 MSS=1460 SACK_PERM TSval=1499291202 TSecr=2649205247 WS=128"
157,64.829136,192.168.11.45,192.168.11.44,TCP,66,0.000122,,,37690  >  6000 [ACK] Seq=1 Ack=1 Win=64256 Len=0 TSval=2649205255 TSecr=1499291202
158,64.829332,192.168.11.45,192.168.11.44,TCP,93,0.000196,,,"37690  >  6000 [PSH, ACK] Seq=1 Ack=1 Win=64256 Len=27 TSval=2649205255 TSecr=1499291202 [TCP segment of a reassembled PDU]"
159,64.82945,192.168.11.45,192.168.11.44,TCP,66,0.000118,,,"37690  >  6000 [FIN, ACK] Seq=28 Ack=1 Win=64256 Len=0 TSval=2649205255 TSecr=1499291202"
160,64.838579,192.168.11.44,192.168.11.45,TCP,66,0.009129,,,6000  >  37690 [ACK] Seq=1 Ack=28 Win=65152 Len=0 TSval=1499291212 TSecr=2649205255
161,64.838829,192.168.11.44,192.168.11.45,TCP,66,0.00025,,,"6000  >  37690 [FIN, ACK] Seq=1 Ack=29 Win=65152 Len=0 TSval=1499291213 TSecr=2649205255"
162,64.838884,192.168.11.45,192.168.11.44,TCP,66,0.000055,,,37690  >  6000 [ACK] Seq=29 Ack=2 Win=64256 Len=0 TSval=2649205264 TSecr=1499291213
163,64.86948,192.168.11.45,255.255.255.255,UDP,209,0.030596,Ÿ,7b2273656d616e74696373223a207b22656e74697479223a2022504944222c202262617365656e74697479223a2022616e79222c2022726f6c65223a2022303035222c20227370617469616c223a2022616e79222c202274656d706f72616c223a2022616e79227d2c20226461746170726f7065727479223a207b22666f726d6174223a2022696e616f6b615f70726f6772616d5f73616d706c655f73656d616e746963227d7d,59342  >  7000 Len=167
164,64.877584,192.168.11.46,192.168.11.45,TCP,74,0.008104,œ,,40096  >  6000 [SYN] Seq=0 Win=64240 Len=0 MSS=1460 SACK_PERM TSval=2272052442 TSecr=0 WS=128
165,64.877747,192.168.11.45,192.168.11.46,TCP,74,0.000163,,,"6000  >  40096 [SYN, ACK] Seq=0 Ack=1 Win=65160 Len=0 MSS=1460 SACK_PERM TSval=1381620322 TSecr=2272052442 WS=128"
166,64.889737,192.168.11.46,192.168.11.45,TCP,66,0.01199,,,40096  >  6000 [ACK] Seq=1 Ack=1 Win=64256 Len=0 TSval=2272052453 TSecr=1381620322
167,64.89088,192.168.11.46,192.168.11.45,TCP,93,0.001143,,,"40096  >  6000 [PSH, ACK] Seq=1 Ack=1 Win=64256 Len=27 TSval=2272052453 TSecr=1381620322 [TCP segment of a reassembled PDU]"
168,64.891065,192.168.11.45,192.168.11.46,TCP,66,0.000185,,,6000  >  40096 [ACK] Seq=1 Ack=28 Win=65152 Len=0 TSval=1381620335 TSecr=2272052453
169,64.891392,192.168.11.46,192.168.11.45,TCP,66,0.000327,,,"40096  >  6000 [FIN, ACK] Seq=28 Ack=1 Win=64256 Len=0 TSval=2272052453 TSecr=1381620322"
170,64.892559,192.168.11.45,192.168.11.46,TCP,66,0.001167,,,"6000  >  40096 [FIN, ACK] Seq=1 Ack=29 Win=65152 Len=0 TSval=1381620337 TSecr=2272052453"
171,64.898608,192.168.11.46,192.168.11.45,TCP,66,0.006049,,,40096  >  6000 [ACK] Seq=29 Ack=2 Win=64256 Len=0 TSval=2272052465 TSecr=1381620337
172,110.498537,192.168.11.45,192.168.11.44,TCP,74,45.599929,,,57298  >  6000 [SYN] Seq=0 Win=64240 Len=0 MSS=1460 SACK_PERM TSval=2649250924 TSecr=0 WS=128
173,110.505356,192.168.11.44,192.168.11.45,TCP,74,0.006819,,,"6000  >  57298 [SYN, ACK] Seq=0 Ack=1 Win=65160 Len=0 MSS=1460 SACK_PERM TSval=1499336879 TSecr=2649250924 WS=128"
174,110.505464,192.168.11.45,192.168.11.44,TCP,66,0.000108,,,57298  >  6000 [ACK] Seq=1 Ack=1 Win=64256 Len=0 TSval=2649250931 TSecr=1499336879
175,110.505632,192.168.11.45,192.168.11.44,TCP,93,0.000168,,,"57298  >  6000 [PSH, ACK] Seq=1 Ack=1 Win=64256 Len=27 TSval=2649250931 TSecr=1499336879 [TCP segment of a reassembled PDU]"
176,110.50574,192.168.11.45,192.168.11.44,TCP,66,0.000108,,,"57298  >  6000 [FIN, ACK] Seq=28 Ack=1 Win=64256 Len=0 TSval=2649250931 TSecr=1499336879"
177,110.519618,192.168.11.44,192.168.11.45,TCP,66,0.013878,,,6000  >  57298 [ACK] Seq=1 Ack=28 Win=65152 Len=0 TSval=1499336894 TSecr=2649250931
178,110.519985,192.168.11.44,192.168.11.45,TCP,66,0.000367,,,"6000  >  57298 [FIN, ACK] Seq=1 Ack=29 Win=65152 Len=0 TSval=1499336895 TSecr=2649250931"
179,110.520034,192.168.11.45,192.168.11.44,TCP,66,0.000049,,,57298  >  6000 [ACK] Seq=29 Ack=2 Win=64256 Len=0 TSval=2649250945 TSecr=1499336895
180,110.549253,192.168.11.45,255.255.255.255,UDP,209,0.029219,Ÿ,7b2273656d616e74696373223a207b22656e74697479223a2022504944222c202262617365656e74697479223a2022616e79222c2022726f6c65223a2022303035222c20227370617469616c223a2022616e79222c202274656d706f72616c223a2022616e79227d2c20226461746170726f7065727479223a207b22666f726d6174223a2022696e616f6b615f70726f6772616d5f73616d706c655f73656d616e746963227d7d,43774  >  7000 Len=167
181,110.558114,192.168.11.46,192.168.11.45,TCP,74,0.008861,œ,,58946  >  6000 [SYN] Seq=0 Win=64240 Len=0 MSS=1460 SACK_PERM TSval=2272098123 TSecr=0 WS=128
182,110.558271,192.168.11.45,192.168.11.46,TCP,74,0.000157,,,"6000  >  58946 [SYN, ACK] Seq=0 Ack=1 Win=65160 Len=0 MSS=1460 SACK_PERM TSval=1381666003 TSecr=2272098123 WS=128"
183,110.569031,192.168.11.46,192.168.11.45,TCP,66,0.01076,,,58946  >  6000 [ACK] Seq=1 Ack=1 Win=64256 Len=0 TSval=2272098134 TSecr=1381666003
184,110.569714,192.168.11.46,192.168.11.45,TCP,93,0.000683,,,"58946  >  6000 [PSH, ACK] Seq=1 Ack=1 Win=64256 Len=27 TSval=2272098134 TSecr=1381666003 [TCP segment of a reassembled PDU]"
185,110.569863,192.168.11.45,192.168.11.46,TCP,66,0.000149,,,6000  >  58946 [ACK] Seq=1 Ack=28 Win=65152 Len=0 TSval=1381666014 TSecr=2272098134
186,110.569956,192.168.11.46,192.168.11.45,TCP,66,0.000093,,,"58946  >  6000 [FIN, ACK] Seq=28 Ack=1 Win=64256 Len=0 TSval=2272098134 TSecr=1381666003"
187,110.571316,192.168.11.45,192.168.11.46,TCP,66,0.00136,,,"6000  >  58946 [FIN, ACK] Seq=1 Ack=29 Win=65152 Len=0 TSval=1381666016 TSecr=2272098134"
188,110.579048,192.168.11.46,192.168.11.45,TCP,66,0.007732,,,58946  >  6000 [ACK] Seq=29 Ack=2 Win=64256 Len=0 TSval=2272098145 TSecr=1381666016
189,117.680534,192.168.11.45,192.168.11.44,TCP,74,7.101486,,,40650  >  6000 [SYN] Seq=0 Win=64240 Len=0 MSS=1460 SACK_PERM TSval=2649258106 TSecr=0 WS=128
190,117.687186,192.168.11.44,192.168.11.45,TCP,74,0.006652,,,"6000  >  40650 [SYN, ACK] Seq=0 Ack=1 Win=65160 Len=0 MSS=1460 SACK_PERM TSval=1499344061 TSecr=2649258106 WS=128"
191,117.687296,192.168.11.45,192.168.11.44,TCP,66,0.00011,,,40650  >  6000 [ACK] Seq=1 Ack=1 Win=64256 Len=0 TSval=2649258113 TSecr=1499344061
192,117.6875,192.168.11.45,192.168.11.44,TCP,93,0.000204,,,"40650  >  6000 [PSH, ACK] Seq=1 Ack=1 Win=64256 Len=27 TSval=2649258113 TSecr=1499344061 [TCP segment of a reassembled PDU]"
193,117.687605,192.168.11.45,192.168.11.44,TCP,66,0.000105,,,"40650  >  6000 [FIN, ACK] Seq=28 Ack=1 Win=64256 Len=0 TSval=2649258113 TSecr=1499344061"
194,117.694969,192.168.11.44,192.168.11.45,TCP,66,0.007364,,,6000  >  40650 [ACK] Seq=1 Ack=28 Win=65152 Len=0 TSval=1499344069 TSecr=2649258113
195,117.695333,192.168.11.44,192.168.11.45,TCP,66,0.000364,,,"6000  >  40650 [FIN, ACK] Seq=1 Ack=29 Win=65152 Len=0 TSval=1499344070 TSecr=2649258113"
196,117.695378,192.168.11.45,192.168.11.44,TCP,66,0.000045,,,40650  >  6000 [ACK] Seq=29 Ack=2 Win=64256 Len=0 TSval=2649258121 TSecr=1499344070
197,117.724788,192.168.11.45,255.255.255.255,UDP,209,0.02941,Ÿ,7b2273656d616e74696373223a207b22656e74697479223a2022504944222c202262617365656e74697479223a2022616e79222c2022726f6c65223a2022303035222c20227370617469616c223a2022616e79222c202274656d706f72616c223a2022616e79227d2c20226461746170726f7065727479223a207b22666f726d6174223a2022696e616f6b615f70726f6772616d5f73616d706c655f73656d616e746963227d7d,49895  >  7000 Len=167
198,117.733524,192.168.11.46,192.168.11.45,TCP,74,0.008736,œ,,49066  >  6000 [SYN] Seq=0 Win=64240 Len=0 MSS=1460 SACK_PERM TSval=2272105299 TSecr=0 WS=128
199,117.733665,192.168.11.45,192.168.11.46,TCP,74,0.000141,,,"6000  >  49066 [SYN, ACK] Seq=0 Ack=1 Win=65160 Len=0 MSS=1460 SACK_PERM TSval=1381673178 TSecr=2272105299 WS=128"
200,117.745425,192.168.11.46,192.168.11.45,TCP,66,0.01176,,,49066  >  6000 [ACK] Seq=1 Ack=1 Win=64256 Len=0 TSval=2272105312 TSecr=1381673178
201,117.746303,192.168.11.46,192.168.11.45,TCP,93,0.000878,,,"49066  >  6000 [PSH, ACK] Seq=1 Ack=1 Win=64256 Len=27 TSval=2272105312 TSecr=1381673178 [TCP segment of a reassembled PDU]"
202,117.746467,192.168.11.45,192.168.11.46,TCP,66,0.000164,,,6000  >  49066 [ACK] Seq=1 Ack=28 Win=65152 Len=0 TSval=1381673191 TSecr=2272105312
203,117.746565,192.168.11.46,192.168.11.45,TCP,66,0.000098,,,"49066  >  6000 [FIN, ACK] Seq=28 Ack=1 Win=64256 Len=0 TSval=2272105312 TSecr=1381673178"
204,117.748049,192.168.11.45,192.168.11.46,TCP,66,0.001484,,,"6000  >  49066 [FIN, ACK] Seq=1 Ack=29 Win=65152 Len=0 TSval=1381673192 TSecr=2272105312"
205,117.764463,192.168.11.46,192.168.11.45,TCP,66,0.016414,,,49066  >  6000 [ACK] Seq=29 Ack=2 Win=64256 Len=0 TSval=2272105330 TSecr=1381673192
206,124.910449,192.168.11.45,192.168.11.44,TCP,74,7.145986,,,39734  >  6000 [SYN] Seq=0 Win=64240 Len=0 MSS=1460 SACK_PERM TSval=2649265336 TSecr=0 WS=128
207,124.917262,192.168.11.44,192.168.11.45,TCP,74,0.006813,,,"6000  >  39734 [SYN, ACK] Seq=0 Ack=1 Win=65160 Len=0 MSS=1460 SACK_PERM TSval=1499351292 TSecr=2649265336 WS=128"
208,124.917374,192.168.11.45,192.168.11.44,TCP,66,0.000112,,,39734  >  6000 [ACK] Seq=1 Ack=1 Win=64256 Len=0 TSval=2649265343 TSecr=1499351292
209,124.917558,192.168.11.45,192.168.11.44,TCP,93,0.000184,,,"39734  >  6000 [PSH, ACK] Seq=1 Ack=1 Win=64256 Len=27 TSval=2649265343 TSecr=1499351292 [TCP segment of a reassembled PDU]"
210,124.917673,192.168.11.45,192.168.11.44,TCP,66,0.000115,,,"39734  >  6000 [FIN, ACK] Seq=28 Ack=1 Win=64256 Len=0 TSval=2649265343 TSecr=1499351292"
211,124.924693,192.168.11.44,192.168.11.45,TCP,66,0.00702,,,6000  >  39734 [ACK] Seq=1 Ack=28 Win=65152 Len=0 TSval=1499351299 TSecr=2649265343
212,124.925082,192.168.11.44,192.168.11.45,TCP,66,0.000389,,,"6000  >  39734 [FIN, ACK] Seq=1 Ack=29 Win=65152 Len=0 TSval=1499351300 TSecr=2649265343"
213,124.925127,192.168.11.45,192.168.11.44,TCP,66,0.000045,,,39734  >  6000 [ACK] Seq=29 Ack=2 Win=64256 Len=0 TSval=2649265351 TSecr=1499351300
214,124.953622,192.168.11.45,255.255.255.255,UDP,209,0.028495,Ÿ,7b2273656d616e74696373223a207b22656e74697479223a2022504944222c202262617365656e74697479223a2022616e79222c2022726f6c65223a2022303035222c20227370617469616c223a2022616e79222c202274656d706f72616c223a2022616e79227d2c20226461746170726f7065727479223a207b22666f726d6174223a2022696e616f6b615f70726f6772616d5f73616d706c655f73656d616e746963227d7d,48679  >  7000 Len=167
215,124.960402,192.168.11.46,192.168.11.45,TCP,74,0.00678,œ,,48352  >  6000 [SYN] Seq=0 Win=64240 Len=0 MSS=1460 SACK_PERM TSval=2272112527 TSecr=0 WS=128
216,124.960539,192.168.11.45,192.168.11.46,TCP,74,0.000137,,,"6000  >  48352 [SYN, ACK] Seq=0 Ack=1 Win=65160 Len=0 MSS=1460 SACK_PERM TSval=1381680405 TSecr=2272112527 WS=128"
217,124.968737,192.168.11.46,192.168.11.45,TCP,66,0.008198,,,48352  >  6000 [ACK] Seq=1 Ack=1 Win=64256 Len=0 TSval=2272112535 TSecr=1381680405
218,124.969306,192.168.11.46,192.168.11.45,TCP,93,0.000569,,,"48352  >  6000 [PSH, ACK] Seq=1 Ack=1 Win=64256 Len=27 TSval=2272112535 TSecr=1381680405 [TCP segment of a reassembled PDU]"
219,124.969386,192.168.11.45,192.168.11.46,TCP,66,0.00008,,,6000  >  48352 [ACK] Seq=1 Ack=28 Win=65152 Len=0 TSval=1381680414 TSecr=2272112535
220,124.969459,192.168.11.46,192.168.11.45,TCP,66,0.000073,,,"48352  >  6000 [FIN, ACK] Seq=28 Ack=1 Win=64256 Len=0 TSval=2272112536 TSecr=1381680405"
221,124.970749,192.168.11.45,192.168.11.46,TCP,66,0.00129,,,"6000  >  48352 [FIN, ACK] Seq=1 Ack=29 Win=65152 Len=0 TSval=1381680415 TSecr=2272112536"
222,124.98273,192.168.11.46,192.168.11.45,TCP,66,0.011981,,,48352  >  6000 [ACK] Seq=29 Ack=2 Win=64256 Len=0 TSval=2272112545 TSecr=1381680415
223,132.068608,192.168.11.45,192.168.11.44,TCP,74,7.085878,,,39750  >  6000 [SYN] Seq=0 Win=64240 Len=0 MSS=1460 SACK_PERM TSval=2649272494 TSecr=0 WS=128
224,132.076432,192.168.11.44,192.168.11.45,TCP,74,0.007824,,,"6000  >  39750 [SYN, ACK] Seq=0 Ack=1 Win=65160 Len=0 MSS=1460 SACK_PERM TSval=1499358451 TSecr=2649272494 WS=128"
225,132.07654,192.168.11.45,192.168.11.44,TCP,66,0.000108,,,39750  >  6000 [ACK] Seq=1 Ack=1 Win=64256 Len=0 TSval=2649272502 TSecr=1499358451
226,132.076708,192.168.11.45,192.168.11.44,TCP,93,0.000168,,,"39750  >  6000 [PSH, ACK] Seq=1 Ack=1 Win=64256 Len=27 TSval=2649272502 TSecr=1499358451 [TCP segment of a reassembled PDU]"
227,132.076802,192.168.11.45,192.168.11.44,TCP,66,0.000094,,,"39750  >  6000 [FIN, ACK] Seq=28 Ack=1 Win=64256 Len=0 TSval=2649272502 TSecr=1499358451"
228,132.08436,192.168.11.44,192.168.11.45,TCP,66,0.007558,,,6000  >  39750 [ACK] Seq=1 Ack=28 Win=65152 Len=0 TSval=1499358458 TSecr=2649272502
229,132.084746,192.168.11.44,192.168.11.45,TCP,66,0.000386,,,"6000  >  39750 [FIN, ACK] Seq=1 Ack=29 Win=65152 Len=0 TSval=1499358460 TSecr=2649272502"
230,132.084803,192.168.11.45,192.168.11.44,TCP,66,0.000057,,,39750  >  6000 [ACK] Seq=29 Ack=2 Win=64256 Len=0 TSval=2649272510 TSecr=1499358460
231,132.114635,192.168.11.45,255.255.255.255,UDP,209,0.029832,Ÿ,7b2273656d616e74696373223a207b22656e74697479223a2022504944222c202262617365656e74697479223a2022616e79222c2022726f6c65223a2022303035222c20227370617469616c223a2022616e79222c202274656d706f72616c223a2022616e79227d2c20226461746170726f7065727479223a207b22666f726d6174223a2022696e616f6b615f70726f6772616d5f73616d706c655f73656d616e746963227d7d,56742  >  7000 Len=167
