No.,Time,Source,Destination,Protocol,Length,Time delta from previous captured frame,XXX,Data,Info
1,0,192.168.11.6,192.168.11.34,TCP,74,0,,,34022  >  6000 [SYN] Seq=0 Win=64240 Len=0 MSS=1460 SACK_PERM TSval=1346009635 TSecr=0 WS=128
2,0.007507,192.168.11.34,192.168.11.6,TCP,74,0.007507,,,"6000  >  34022 [SYN, ACK] Seq=0 Ack=1 Win=65160 Len=0 MSS=1460 SACK_PERM TSval=3961091929 TSecr=1346009635 WS=128"
3,0.007618,192.168.11.6,192.168.11.34,TCP,66,0.000111,,,34022  >  6000 [ACK] Seq=1 Ack=1 Win=64256 Len=0 TSval=1346009648 TSecr=3961091929
4,0.007801,192.168.11.6,192.168.11.34,TCP,93,0.000183,,,"34022  >  6000 [PSH, ACK] Seq=1 Ack=1 Win=64256 Len=27 TSval=1346009648 TSecr=3961091929 [TCP segment of a reassembled PDU]"
5,0.007933,192.168.11.6,192.168.11.34,TCP,66,0.000132,,,"34022  >  6000 [FIN, ACK] Seq=28 Ack=1 Win=64256 Len=0 TSval=1346009648 TSecr=3961091929"
6,0.015704,192.168.11.34,192.168.11.6,TCP,66,0.007771,,,6000  >  34022 [ACK] Seq=1 Ack=28 Win=65152 Len=0 TSval=3961091938 TSecr=1346009648
7,0.015925,192.168.11.34,192.168.11.6,TCP,66,0.000221,,,"6000  >  34022 [FIN, ACK] Seq=1 Ack=29 Win=65152 Len=0 TSval=3961091940 TSecr=1346009648"
8,0.015983,192.168.11.6,192.168.11.34,TCP,66,0.000058,,,34022  >  6000 [ACK] Seq=29 Ack=2 Win=64256 Len=0 TSval=1346009656 TSecr=3961091940
9,0.04743,192.168.11.6,255.255.255.255,UDP,209,0.031447,Ÿ,7b2273656d616e74696373223a207b22656e74697479223a2022504944222c202262617365656e74697479223a2022616e79222c2022726f6c65223a2022323232222c20227370617469616c223a2022616e79222c202274656d706f72616c223a2022616e79227d2c20226461746170726f7065727479223a207b22666f726d6174223a2022696e616f6b615f70726f6772616d5f73616d706c655f73656d616e746963227d7d,57021  >  7000 Len=167
10,0.059893,192.168.11.29,192.168.11.6,TCP,74,0.012463,œ,,41800  >  6000 [SYN] Seq=0 Win=64240 Len=0 MSS=1460 SACK_PERM TSval=1086719742 TSecr=0 WS=128
11,0.060041,192.168.11.6,192.168.11.29,TCP,74,0.000148,,,"6000  >  41800 [SYN, ACK] Seq=0 Ack=1 Win=65160 Len=0 MSS=1460 SACK_PERM TSval=945654030 TSecr=1086719742 WS=128"
12,0.06764,192.168.11.29,192.168.11.6,TCP,66,0.007599,,,41800  >  6000 [ACK] Seq=1 Ack=1 Win=64256 Len=0 TSval=1086719754 TSecr=945654030
13,0.068254,192.168.11.29,192.168.11.6,TCP,93,0.000614,,,"41800  >  6000 [PSH, ACK] Seq=1 Ack=1 Win=64256 Len=27 TSval=1086719754 TSecr=945654030 [TCP segment of a reassembled PDU]"
14,0.068375,192.168.11.6,192.168.11.29,TCP,66,0.000121,,,6000  >  41800 [ACK] Seq=1 Ack=28 Win=65152 Len=0 TSval=945654038 TSecr=1086719754
15,0.068481,192.168.11.29,192.168.11.6,TCP,66,0.000106,,,"41800  >  6000 [FIN, ACK] Seq=28 Ack=1 Win=64256 Len=0 TSval=1086719755 TSecr=945654030"
16,0.069986,192.168.11.6,192.168.11.29,TCP,66,0.001505,,,"6000  >  41800 [FIN, ACK] Seq=1 Ack=29 Win=65152 Len=0 TSval=945654040 TSecr=1086719755"
17,0.076227,192.168.11.29,192.168.11.6,TCP,66,0.006241,,,41800  >  6000 [ACK] Seq=29 Ack=2 Win=64256 Len=0 TSval=1086719763 TSecr=945654040
18,7.278486,192.168.11.6,192.168.11.34,TCP,74,7.202259,,,34036  >  6000 [SYN] Seq=0 Win=64240 Len=0 MSS=1460 SACK_PERM TSval=1346016918 TSecr=0 WS=128
19,7.285264,192.168.11.34,192.168.11.6,TCP,74,0.006778,,,"6000  >  34036 [SYN, ACK] Seq=0 Ack=1 Win=65160 Len=0 MSS=1460 SACK_PERM TSval=3961099208 TSecr=1346016918 WS=128"
20,7.285377,192.168.11.6,192.168.11.34,TCP,66,0.000113,,,34036  >  6000 [ACK] Seq=1 Ack=1 Win=64256 Len=0 TSval=1346016925 TSecr=3961099208
21,7.285528,192.168.11.6,192.168.11.34,TCP,93,0.000151,,,"34036  >  6000 [PSH, ACK] Seq=1 Ack=1 Win=64256 Len=27 TSval=1346016925 TSecr=3961099208 [TCP segment of a reassembled PDU]"
22,7.285721,192.168.11.6,192.168.11.34,TCP,66,0.000193,,,"34036  >  6000 [FIN, ACK] Seq=28 Ack=1 Win=64256 Len=0 TSval=1346016926 TSecr=3961099208"
23,7.301269,192.168.11.34,192.168.11.6,TCP,66,0.015548,,,6000  >  34036 [ACK] Seq=1 Ack=28 Win=65152 Len=0 TSval=3961099224 TSecr=1346016925
24,7.301657,192.168.11.34,192.168.11.6,TCP,66,0.000388,,,"6000  >  34036 [FIN, ACK] Seq=1 Ack=29 Win=65152 Len=0 TSval=3961099225 TSecr=1346016926"
25,7.301704,192.168.11.6,192.168.11.34,TCP,66,0.000047,,,34036  >  6000 [ACK] Seq=29 Ack=2 Win=64256 Len=0 TSval=1346016942 TSecr=3961099225
26,7.331255,192.168.11.6,255.255.255.255,UDP,209,0.029551,Ÿ,7b2273656d616e74696373223a207b22656e74697479223a2022504944222c202262617365656e74697479223a2022616e79222c2022726f6c65223a2022323232222c20227370617469616c223a2022616e79222c202274656d706f72616c223a2022616e79227d2c20226461746170726f7065727479223a207b22666f726d6174223a2022696e616f6b615f70726f6772616d5f73616d706c655f73656d616e746963227d7d,35433  >  7000 Len=167
27,7.33979,192.168.11.29,192.168.11.6,TCP,74,0.008535,œ,,41810  >  6000 [SYN] Seq=0 Win=64240 Len=0 MSS=1460 SACK_PERM TSval=1086727025 TSecr=0 WS=128
28,7.339924,192.168.11.6,192.168.11.29,TCP,74,0.000134,,,"6000  >  41810 [SYN, ACK] Seq=0 Ack=1 Win=65160 Len=0 MSS=1460 SACK_PERM TSval=945661310 TSecr=1086727025 WS=128"
29,7.346517,192.168.11.29,192.168.11.6,TCP,66,0.006593,,,41810  >  6000 [ACK] Seq=1 Ack=1 Win=64256 Len=0 TSval=1086727032 TSecr=945661310
30,7.347074,192.168.11.29,192.168.11.6,TCP,93,0.000557,,,"41810  >  6000 [PSH, ACK] Seq=1 Ack=1 Win=64256 Len=27 TSval=1086727032 TSecr=945661310 [TCP segment of a reassembled PDU]"
31,7.34714,192.168.11.6,192.168.11.29,TCP,66,0.000066,,,6000  >  41810 [ACK] Seq=1 Ack=28 Win=65152 Len=0 TSval=945661317 TSecr=1086727032
32,7.347219,192.168.11.29,192.168.11.6,TCP,66,0.000079,,,"41810  >  6000 [FIN, ACK] Seq=28 Ack=1 Win=64256 Len=0 TSval=1086727033 TSecr=945661310"
33,7.348765,192.168.11.6,192.168.11.29,TCP,66,0.001546,,,"6000  >  41810 [FIN, ACK] Seq=1 Ack=29 Win=65152 Len=0 TSval=945661319 TSecr=1086727033"
34,7.354165,192.168.11.29,192.168.11.6,TCP,66,0.0054,,,41810  >  6000 [ACK] Seq=29 Ack=2 Win=64256 Len=0 TSval=1086727040 TSecr=945661319
35,14.61989,192.168.11.6,192.168.11.34,TCP,74,7.265725,,,52440  >  6000 [SYN] Seq=0 Win=64240 Len=0 MSS=1460 SACK_PERM TSval=1346024260 TSecr=0 WS=128
36,14.628147,192.168.11.34,192.168.11.6,TCP,74,0.008257,,,"6000  >  52440 [SYN, ACK] Seq=0 Ack=1 Win=65160 Len=0 MSS=1460 SACK_PERM TSval=3961106550 TSecr=1346024260 WS=128"
37,14.628251,192.168.11.6,192.168.11.34,TCP,66,0.000104,,,52440  >  6000 [ACK] Seq=1 Ack=1 Win=64256 Len=0 TSval=1346024268 TSecr=3961106550
38,14.628441,192.168.11.6,192.168.11.34,TCP,93,0.00019,,,"52440  >  6000 [PSH, ACK] Seq=1 Ack=1 Win=64256 Len=27 TSval=1346024268 TSecr=3961106550 [TCP segment of a reassembled PDU]"
39,14.628563,192.168.11.6,192.168.11.34,TCP,66,0.000122,,,"52440  >  6000 [FIN, ACK] Seq=28 Ack=1 Win=64256 Len=0 TSval=1346024268 TSecr=3961106550"
40,14.636004,192.168.11.34,192.168.11.6,TCP,66,0.007441,,,6000  >  52440 [ACK] Seq=1 Ack=28 Win=65152 Len=0 TSval=3961106559 TSecr=1346024268
41,14.636229,192.168.11.34,192.168.11.6,TCP,66,0.000225,,,"6000  >  52440 [FIN, ACK] Seq=1 Ack=29 Win=65152 Len=0 TSval=3961106561 TSecr=1346024268"
42,14.636277,192.168.11.6,192.168.11.34,TCP,66,0.000048,,,52440  >  6000 [ACK] Seq=29 Ack=2 Win=64256 Len=0 TSval=1346024276 TSecr=3961106561
43,14.66706,192.168.11.6,255.255.255.255,UDP,209,0.030783,Ÿ,7b2273656d616e74696373223a207b22656e74697479223a2022504944222c202262617365656e74697479223a2022616e79222c2022726f6c65223a2022323232222c20227370617469616c223a2022616e79222c202274656d706f72616c223a2022616e79227d2c20226461746170726f7065727479223a207b22666f726d6174223a2022696e616f6b615f70726f6772616d5f73616d706c655f73656d616e746963227d7d,60239  >  7000 Len=167
44,14.676187,192.168.11.29,192.168.11.6,TCP,74,0.009127,œ,,40130  >  6000 [SYN] Seq=0 Win=64240 Len=0 MSS=1460 SACK_PERM TSval=1086734360 TSecr=0 WS=128
45,14.676337,192.168.11.6,192.168.11.29,TCP,74,0.00015,,,"6000  >  40130 [SYN, ACK] Seq=0 Ack=1 Win=65160 Len=0 MSS=1460 SACK_PERM TSval=945668646 TSecr=1086734360 WS=128"
46,14.683239,192.168.11.29,192.168.11.6,TCP,66,0.006902,,,40130  >  6000 [ACK] Seq=1 Ack=1 Win=64256 Len=0 TSval=1086734367 TSecr=945668646
47,14.684073,192.168.11.29,192.168.11.6,TCP,93,0.000834,,,"40130  >  6000 [PSH, ACK] Seq=1 Ack=1 Win=64256 Len=27 TSval=1086734368 TSecr=945668646 [TCP segment of a reassembled PDU]"
48,14.684225,192.168.11.6,192.168.11.29,TCP,66,0.000152,,,6000  >  40130 [ACK] Seq=1 Ack=28 Win=65152 Len=0 TSval=945668654 TSecr=1086734368
49,14.684348,192.168.11.29,192.168.11.6,TCP,66,0.000123,,,"40130  >  6000 [FIN, ACK] Seq=28 Ack=1 Win=64256 Len=0 TSval=1086734368 TSecr=945668646"
50,14.686745,192.168.11.6,192.168.11.29,TCP,66,0.002397,,,"6000  >  40130 [FIN, ACK] Seq=1 Ack=29 Win=65152 Len=0 TSval=945668657 TSecr=1086734368"
51,14.692183,192.168.11.29,192.168.11.6,TCP,66,0.005438,,,40130  >  6000 [ACK] Seq=29 Ack=2 Win=64256 Len=0 TSval=1086734376 TSecr=945668657
52,21.822542,192.168.11.6,192.168.11.34,TCP,74,7.130359,,,51912  >  6000 [SYN] Seq=0 Win=64240 Len=0 MSS=1460 SACK_PERM TSval=1346031462 TSecr=0 WS=128
53,21.829426,192.168.11.34,192.168.11.6,TCP,74,0.006884,,,"6000  >  51912 [SYN, ACK] Seq=0 Ack=1 Win=65160 Len=0 MSS=1460 SACK_PERM TSval=3961113753 TSecr=1346031462 WS=128"
54,21.829534,192.168.11.6,192.168.11.34,TCP,66,0.000108,,,51912  >  6000 [ACK] Seq=1 Ack=1 Win=64256 Len=0 TSval=1346031469 TSecr=3961113753
55,21.829753,192.168.11.6,192.168.11.34,TCP,93,0.000219,,,"51912  >  6000 [PSH, ACK] Seq=1 Ack=1 Win=64256 Len=27 TSval=1346031470 TSecr=3961113753 [TCP segment of a reassembled PDU]"
56,21.829864,192.168.11.6,192.168.11.34,TCP,66,0.000111,,,"51912  >  6000 [FIN, ACK] Seq=28 Ack=1 Win=64256 Len=0 TSval=1346031470 TSecr=3961113753"
57,21.840127,192.168.11.34,192.168.11.6,TCP,66,0.010263,,,6000  >  51912 [ACK] Seq=1 Ack=28 Win=65152 Len=0 TSval=3961113761 TSecr=1346031470
58,21.840537,192.168.11.34,192.168.11.6,TCP,66,0.00041,,,"6000  >  51912 [FIN, ACK] Seq=1 Ack=29 Win=65152 Len=0 TSval=3961113762 TSecr=1346031470"
59,21.840586,192.168.11.6,192.168.11.34,TCP,66,0.000049,,,51912  >  6000 [ACK] Seq=29 Ack=2 Win=64256 Len=0 TSval=1346031481 TSecr=3961113762
60,21.871746,192.168.11.6,255.255.255.255,UDP,209,0.03116,Ÿ,7b2273656d616e74696373223a207b22656e74697479223a2022504944222c202262617365656e74697479223a2022616e79222c2022726f6c65223a2022323232222c20227370617469616c223a2022616e79222c202274656d706f72616c223a2022616e79227d2c20226461746170726f7065727479223a207b22666f726d6174223a2022696e616f6b615f70726f6772616d5f73616d706c655f73656d616e746963227d7d,34827  >  7000 Len=167
61,21.879769,192.168.11.29,192.168.11.6,TCP,74,0.008023,œ,,48310  >  6000 [SYN] Seq=0 Win=64240 Len=0 MSS=1460 SACK_PERM TSval=1086741563 TSecr=0 WS=128
62,21.879903,192.168.11.6,192.168.11.29,TCP,74,0.000134,,,"6000  >  48310 [SYN, ACK] Seq=0 Ack=1 Win=65160 Len=0 MSS=1460 SACK_PERM TSval=945675850 TSecr=1086741563 WS=128"
63,21.886693,192.168.11.29,192.168.11.6,TCP,66,0.00679,,,48310  >  6000 [ACK] Seq=1 Ack=1 Win=64256 Len=0 TSval=1086741570 TSecr=945675850
64,21.887286,192.168.11.29,192.168.11.6,TCP,93,0.000593,,,"48310  >  6000 [PSH, ACK] Seq=1 Ack=1 Win=64256 Len=27 TSval=1086741570 TSecr=945675850 [TCP segment of a reassembled PDU]"
65,21.887414,192.168.11.6,192.168.11.29,TCP,66,0.000128,,,6000  >  48310 [ACK] Seq=1 Ack=28 Win=65152 Len=0 TSval=945675857 TSecr=1086741570
66,21.887493,192.168.11.29,192.168.11.6,TCP,66,0.000079,,,"48310  >  6000 [FIN, ACK] Seq=28 Ack=1 Win=64256 Len=0 TSval=1086741570 TSecr=945675850"
67,21.88872,192.168.11.6,192.168.11.29,TCP,66,0.001227,,,"6000  >  48310 [FIN, ACK] Seq=1 Ack=29 Win=65152 Len=0 TSval=945675859 TSecr=1086741570"
68,21.89467,192.168.11.29,192.168.11.6,TCP,66,0.00595,,,48310  >  6000 [ACK] Seq=29 Ack=2 Win=64256 Len=0 TSval=1086741578 TSecr=945675859
69,29.02248,192.168.11.6,192.168.11.34,TCP,74,7.12781,,,43660  >  6000 [SYN] Seq=0 Win=64240 Len=0 MSS=1460 SACK_PERM TSval=1346038662 TSecr=0 WS=128
70,29.029017,192.168.11.34,192.168.11.6,TCP,74,0.006537,,,"6000  >  43660 [SYN, ACK] Seq=0 Ack=1 Win=65160 Len=0 MSS=1460 SACK_PERM TSval=3961120953 TSecr=1346038662 WS=128"
71,29.029123,192.168.11.6,192.168.11.34,TCP,66,0.000106,,,43660  >  6000 [ACK] Seq=1 Ack=1 Win=64256 Len=0 TSval=1346038669 TSecr=3961120953
72,29.029298,192.168.11.6,192.168.11.34,TCP,93,0.000175,,,"43660  >  6000 [PSH, ACK] Seq=1 Ack=1 Win=64256 Len=27 TSval=1346038669 TSecr=3961120953 [TCP segment of a reassembled PDU]"
73,29.029424,192.168.11.6,192.168.11.34,TCP,66,0.000126,,,"43660  >  6000 [FIN, ACK] Seq=28 Ack=1 Win=64256 Len=0 TSval=1346038669 TSecr=3961120953"
74,29.036615,192.168.11.34,192.168.11.6,TCP,66,0.007191,,,6000  >  43660 [ACK] Seq=1 Ack=28 Win=65152 Len=0 TSval=3961120961 TSecr=1346038669
75,29.036847,192.168.11.34,192.168.11.6,TCP,66,0.000232,,,"6000  >  43660 [FIN, ACK] Seq=1 Ack=29 Win=65152 Len=0 TSval=3961120962 TSecr=1346038669"
76,29.036902,192.168.11.6,192.168.11.34,TCP,66,0.000055,,,43660  >  6000 [ACK] Seq=29 Ack=2 Win=64256 Len=0 TSval=1346038677 TSecr=3961120962
77,29.071062,192.168.11.6,255.255.255.255,UDP,209,0.03416,Ÿ,7b2273656d616e74696373223a207b22656e74697479223a2022504944222c202262617365656e74697479223a2022616e79222c2022726f6c65223a2022323232222c20227370617469616c223a2022616e79222c202274656d706f72616c223a2022616e79227d2c20226461746170726f7065727479223a207b22666f726d6174223a2022696e616f6b615f70726f6772616d5f73616d706c655f73656d616e746963227d7d,53603  >  7000 Len=167
78,29.079261,192.168.11.29,192.168.11.6,TCP,74,0.008199,œ,,36984  >  6000 [SYN] Seq=0 Win=64240 Len=0 MSS=1460 SACK_PERM TSval=1086748761 TSecr=0 WS=128
79,29.079418,192.168.11.6,192.168.11.29,TCP,74,0.000157,,,"6000  >  36984 [SYN, ACK] Seq=0 Ack=1 Win=65160 Len=0 MSS=1460 SACK_PERM TSval=945683049 TSecr=1086748761 WS=128"
80,29.086564,192.168.11.29,192.168.11.6,TCP,66,0.007146,,,36984  >  6000 [ACK] Seq=1 Ack=1 Win=64256 Len=0 TSval=1086748768 TSecr=945683049
81,29.087201,192.168.11.29,192.168.11.6,TCP,93,0.000637,,,"36984  >  6000 [PSH, ACK] Seq=1 Ack=1 Win=64256 Len=27 TSval=1086748768 TSecr=945683049 [TCP segment of a reassembled PDU]"
82,29.087321,192.168.11.6,192.168.11.29,TCP,66,0.00012,,,6000  >  36984 [ACK] Seq=1 Ack=28 Win=65152 Len=0 TSval=945683057 TSecr=1086748768
83,29.087406,192.168.11.29,192.168.11.6,TCP,66,0.000085,,,"36984  >  6000 [FIN, ACK] Seq=28 Ack=1 Win=64256 Len=0 TSval=1086748769 TSecr=945683049"
84,29.089377,192.168.11.6,192.168.11.29,TCP,66,0.001971,,,"6000  >  36984 [FIN, ACK] Seq=1 Ack=29 Win=65152 Len=0 TSval=945683059 TSecr=1086748769"
85,29.094539,192.168.11.29,192.168.11.6,TCP,66,0.005162,,,36984  >  6000 [ACK] Seq=29 Ack=2 Win=64256 Len=0 TSval=1086748776 TSecr=945683059
86,36.193321,192.168.11.6,192.168.11.34,TCP,74,7.098782,,,43670  >  6000 [SYN] Seq=0 Win=64240 Len=0 MSS=1460 SACK_PERM TSval=1346045833 TSecr=0 WS=128
87,36.200409,192.168.11.34,192.168.11.6,TCP,74,0.007088,,,"6000  >  43670 [SYN, ACK] Seq=0 Ack=1 Win=65160 Len=0 MSS=1460 SACK_PERM TSval=3961128125 TSecr=1346045833 WS=128"
88,36.200516,192.168.11.6,192.168.11.34,TCP,66,0.000107,,,43670  >  6000 [ACK] Seq=1 Ack=1 Win=64256 Len=0 TSval=1346045840 TSecr=3961128125
89,36.20069,192.168.11.6,192.168.11.34,TCP,93,0.000174,,,"43670  >  6000 [PSH, ACK] Seq=1 Ack=1 Win=64256 Len=27 TSval=1346045841 TSecr=3961128125 [TCP segment of a reassembled PDU]"
90,36.200799,192.168.11.6,192.168.11.34,TCP,66,0.000109,,,"43670  >  6000 [FIN, ACK] Seq=28 Ack=1 Win=64256 Len=0 TSval=1346045841 TSecr=3961128125"
91,36.208415,192.168.11.34,192.168.11.6,TCP,66,0.007616,,,6000  >  43670 [ACK] Seq=1 Ack=28 Win=65152 Len=0 TSval=3961128132 TSecr=1346045841
92,36.208786,192.168.11.34,192.168.11.6,TCP,66,0.000371,,,"6000  >  43670 [FIN, ACK] Seq=1 Ack=29 Win=65152 Len=0 TSval=3961128134 TSecr=1346045841"
93,36.208832,192.168.11.6,192.168.11.34,TCP,66,0.000046,,,43670  >  6000 [ACK] Seq=29 Ack=2 Win=64256 Len=0 TSval=1346045849 TSecr=3961128134
94,36.238691,192.168.11.6,255.255.255.255,UDP,209,0.029859,Ÿ,7b2273656d616e74696373223a207b22656e74697479223a2022504944222c202262617365656e74697479223a2022616e79222c2022726f6c65223a2022323232222c20227370617469616c223a2022616e79222c202274656d706f72616c223a2022616e79227d2c20226461746170726f7065727479223a207b22666f726d6174223a2022696e616f6b615f70726f6772616d5f73616d706c655f73656d616e746963227d7d,38783  >  7000 Len=167
95,36.246509,192.168.11.29,192.168.11.6,TCP,74,0.007818,œ,,36998  >  6000 [SYN] Seq=0 Win=64240 Len=0 MSS=1460 SACK_PERM TSval=1086755927 TSecr=0 WS=128
96,36.24667,192.168.11.6,192.168.11.29,TCP,74,0.000161,,,"6000  >  36998 [SYN, ACK] Seq=0 Ack=1 Win=65160 Len=0 MSS=1460 SACK_PERM TSval=945690217 TSecr=1086755927 WS=128"
97,36.262346,192.168.11.29,192.168.11.6,TCP,66,0.015676,,,36998  >  6000 [ACK] Seq=1 Ack=1 Win=64256 Len=0 TSval=1086755934 TSecr=945690217
98,36.263073,192.168.11.29,192.168.11.6,TCP,93,0.000727,,,"36998  >  6000 [PSH, ACK] Seq=1 Ack=1 Win=64256 Len=27 TSval=1086755934 TSecr=945690217 [TCP segment of a reassembled PDU]"
99,36.263233,192.168.11.6,192.168.11.29,TCP,66,0.00016,,,6000  >  36998 [ACK] Seq=1 Ack=28 Win=65152 Len=0 TSval=945690233 TSecr=1086755934
100,36.26332,192.168.11.29,192.168.11.6,TCP,66,0.000087,,,"36998  >  6000 [FIN, ACK] Seq=28 Ack=1 Win=64256 Len=0 TSval=1086755934 TSecr=945690217"
101,36.264537,192.168.11.6,192.168.11.29,TCP,66,0.001217,,,"6000  >  36998 [FIN, ACK] Seq=1 Ack=29 Win=65152 Len=0 TSval=945690234 TSecr=1086755934"
102,36.270557,192.168.11.29,192.168.11.6,TCP,66,0.00602,,,36998  >  6000 [ACK] Seq=29 Ack=2 Win=64256 Len=0 TSval=1086755951 TSecr=945690234
103,43.394196,192.168.11.6,192.168.11.34,TCP,74,7.123639,,,43856  >  6000 [SYN] Seq=0 Win=64240 Len=0 MSS=1460 SACK_PERM TSval=1346053034 TSecr=0 WS=128
104,43.400966,192.168.11.34,192.168.11.6,TCP,74,0.00677,,,"6000  >  43856 [SYN, ACK] Seq=0 Ack=1 Win=65160 Len=0 MSS=1460 SACK_PERM TSval=3961135326 TSecr=1346053034 WS=128"
105,43.401073,192.168.11.6,192.168.11.34,TCP,66,0.000107,,,43856  >  6000 [ACK] Seq=1 Ack=1 Win=64256 Len=0 TSval=1346053041 TSecr=3961135326
106,43.401251,192.168.11.6,192.168.11.34,TCP,93,0.000178,,,"43856  >  6000 [PSH, ACK] Seq=1 Ack=1 Win=64256 Len=27 TSval=1346053041 TSecr=3961135326 [TCP segment of a reassembled PDU]"
107,43.401346,192.168.11.6,192.168.11.34,TCP,66,0.000095,,,"43856  >  6000 [FIN, ACK] Seq=28 Ack=1 Win=64256 Len=0 TSval=1346053041 TSecr=3961135326"
108,43.416076,192.168.11.34,192.168.11.6,TCP,66,0.01473,,,6000  >  43856 [ACK] Seq=1 Ack=28 Win=65152 Len=0 TSval=3961135341 TSecr=1346053041
109,43.416459,192.168.11.34,192.168.11.6,TCP,66,0.000383,,,"6000  >  43856 [FIN, ACK] Seq=1 Ack=29 Win=65152 Len=0 TSval=3961135342 TSecr=1346053041"
110,43.416513,192.168.11.6,192.168.11.34,TCP,66,0.000054,,,43856  >  6000 [ACK] Seq=29 Ack=2 Win=64256 Len=0 TSval=1346053056 TSecr=3961135342
111,43.44651,192.168.11.6,255.255.255.255,UDP,209,0.029997,Ÿ,7b2273656d616e74696373223a207b22656e74697479223a2022504944222c202262617365656e74697479223a2022616e79222c2022726f6c65223a2022323232222c20227370617469616c223a2022616e79222c202274656d706f72616c223a2022616e79227d2c20226461746170726f7065727479223a207b22666f726d6174223a2022696e616f6b615f70726f6772616d5f73616d706c655f73656d616e746963227d7d,48278  >  7000 Len=167
112,43.454545,192.168.11.29,192.168.11.6,TCP,74,0.008035,œ,,53222  >  6000 [SYN] Seq=0 Win=64240 Len=0 MSS=1460 SACK_PERM TSval=1086763134 TSecr=0 WS=128
113,43.454686,192.168.11.6,192.168.11.29,TCP,74,0.000141,,,"6000  >  53222 [SYN, ACK] Seq=0 Ack=1 Win=65160 Len=0 MSS=1460 SACK_PERM TSval=945697425 TSecr=1086763134 WS=128"
114,43.462163,192.168.11.29,192.168.11.6,TCP,66,0.007477,,,53222  >  6000 [ACK] Seq=1 Ack=1 Win=64256 Len=0 TSval=1086763142 TSecr=945697425
115,43.462717,192.168.11.29,192.168.11.6,TCP,93,0.000554,,,"53222  >  6000 [PSH, ACK] Seq=1 Ack=1 Win=64256 Len=27 TSval=1086763142 TSecr=945697425 [TCP segment of a reassembled PDU]"
116,43.462808,192.168.11.6,192.168.11.29,TCP,66,0.000091,,,6000  >  53222 [ACK] Seq=1 Ack=28 Win=65152 Len=0 TSval=945697433 TSecr=1086763142
117,43.462871,192.168.11.29,192.168.11.6,TCP,66,0.000063,,,"53222  >  6000 [FIN, ACK] Seq=28 Ack=1 Win=64256 Len=0 TSval=1086763142 TSecr=945697425"
118,43.463873,192.168.11.6,192.168.11.29,TCP,66,0.001002,,,"6000  >  53222 [FIN, ACK] Seq=1 Ack=29 Win=65152 Len=0 TSval=945697434 TSecr=1086763142"
119,43.469192,192.168.11.29,192.168.11.6,TCP,66,0.005319,,,53222  >  6000 [ACK] Seq=29 Ack=2 Win=64256 Len=0 TSval=1086763149 TSecr=945697434
120,50.594235,192.168.11.6,192.168.11.34,TCP,74,7.125043,,,44348  >  6000 [SYN] Seq=0 Win=64240 Len=0 MSS=1460 SACK_PERM TSval=1346060234 TSecr=0 WS=128
121,50.601053,192.168.11.34,192.168.11.6,TCP,74,0.006818,,,"6000  >  44348 [SYN, ACK] Seq=0 Ack=1 Win=65160 Len=0 MSS=1460 SACK_PERM TSval=3961142526 TSecr=1346060234 WS=128"
122,50.601165,192.168.11.6,192.168.11.34,TCP,66,0.000112,,,44348  >  6000 [ACK] Seq=1 Ack=1 Win=64256 Len=0 TSval=1346060241 TSecr=3961142526
123,50.601333,192.168.11.6,192.168.11.34,TCP,93,0.000168,,,"44348  >  6000 [PSH, ACK] Seq=1 Ack=1 Win=64256 Len=27 TSval=1346060241 TSecr=3961142526 [TCP segment of a reassembled PDU]"
124,50.601429,192.168.11.6,192.168.11.34,TCP,66,0.000096,,,"44348  >  6000 [FIN, ACK] Seq=28 Ack=1 Win=64256 Len=0 TSval=1346060241 TSecr=3961142526"
125,50.611311,192.168.11.34,192.168.11.6,TCP,66,0.009882,,,6000  >  44348 [ACK] Seq=1 Ack=28 Win=65152 Len=0 TSval=3961142534 TSecr=1346060241
126,50.611817,192.168.11.34,192.168.11.6,TCP,66,0.000506,,,"6000  >  44348 [FIN, ACK] Seq=1 Ack=29 Win=65152 Len=0 TSval=3961142535 TSecr=1346060241"
127,50.611867,192.168.11.6,192.168.11.34,TCP,66,0.00005,,,44348  >  6000 [ACK] Seq=29 Ack=2 Win=64256 Len=0 TSval=1346060252 TSecr=3961142535
128,50.642143,192.168.11.6,255.255.255.255,UDP,209,0.030276,Ÿ,7b2273656d616e74696373223a207b22656e74697479223a2022504944222c202262617365656e74697479223a2022616e79222c2022726f6c65223a2022323232222c20227370617469616c223a2022616e79222c202274656d706f72616c223a2022616e79227d2c20226461746170726f7065727479223a207b22666f726d6174223a2022696e616f6b615f70726f6772616d5f73616d706c655f73656d616e746963227d7d,55711  >  7000 Len=167
129,50.650242,192.168.11.29,192.168.11.6,TCP,74,0.008099,œ,,34584  >  6000 [SYN] Seq=0 Win=64240 Len=0 MSS=1460 SACK_PERM TSval=1086770328 TSecr=0 WS=128
130,50.650391,192.168.11.6,192.168.11.29,TCP,74,0.000149,,,"6000  >  34584 [SYN, ACK] Seq=0 Ack=1 Win=65160 Len=0 MSS=1460 SACK_PERM TSval=945704620 TSecr=1086770328 WS=128"
131,50.657184,192.168.11.29,192.168.11.6,TCP,66,0.006793,,,34584  >  6000 [ACK] Seq=1 Ack=1 Win=64256 Len=0 TSval=1086770335 TSecr=945704620
132,50.657783,192.168.11.29,192.168.11.6,TCP,93,0.000599,,,"34584  >  6000 [PSH, ACK] Seq=1 Ack=1 Win=64256 Len=27 TSval=1086770336 TSecr=945704620 [TCP segment of a reassembled PDU]"
133,50.6579,192.168.11.6,192.168.11.29,TCP,66,0.000117,,,6000  >  34584 [ACK] Seq=1 Ack=28 Win=65152 Len=0 TSval=945704628 TSecr=1086770336
134,50.657965,192.168.11.29,192.168.11.6,TCP,66,0.000065,,,"34584  >  6000 [FIN, ACK] Seq=28 Ack=1 Win=64256 Len=0 TSval=1086770336 TSecr=945704620"
135,50.659271,192.168.11.6,192.168.11.29,TCP,66,0.001306,,,"6000  >  34584 [FIN, ACK] Seq=1 Ack=29 Win=65152 Len=0 TSval=945704629 TSecr=1086770336"
136,50.665093,192.168.11.29,192.168.11.6,TCP,66,0.005822,,,34584  >  6000 [ACK] Seq=29 Ack=2 Win=64256 Len=0 TSval=1086770343 TSecr=945704629
137,57.745888,192.168.11.6,192.168.11.34,TCP,74,7.080795,,,44358  >  6000 [SYN] Seq=0 Win=64240 Len=0 MSS=1460 SACK_PERM TSval=1346067386 TSecr=0 WS=128
138,57.753023,192.168.11.34,192.168.11.6,TCP,74,0.007135,,,"6000  >  44358 [SYN, ACK] Seq=0 Ack=1 Win=65160 Len=0 MSS=1460 SACK_PERM TSval=3961149678 TSecr=1346067386 WS=128"
139,57.753133,192.168.11.6,192.168.11.34,TCP,66,0.00011,,,44358  >  6000 [ACK] Seq=1 Ack=1 Win=64256 Len=0 TSval=1346067393 TSecr=3961149678
140,57.753269,192.168.11.6,192.168.11.34,TCP,93,0.000136,,,"44358  >  6000 [PSH, ACK] Seq=1 Ack=1 Win=64256 Len=27 TSval=1346067393 TSecr=3961149678 [TCP segment of a reassembled PDU]"
141,57.753377,192.168.11.6,192.168.11.34,TCP,66,0.000108,,,"44358  >  6000 [FIN, ACK] Seq=28 Ack=1 Win=64256 Len=0 TSval=1346067393 TSecr=3961149678"
142,57.760784,192.168.11.34,192.168.11.6,TCP,66,0.007407,,,6000  >  44358 [ACK] Seq=1 Ack=28 Win=65152 Len=0 TSval=3961149686 TSecr=1346067393
143,57.761,192.168.11.34,192.168.11.6,TCP,66,0.000216,,,"6000  >  44358 [FIN, ACK] Seq=1 Ack=29 Win=65152 Len=0 TSval=3961149687 TSecr=1346067393"
144,57.761047,192.168.11.6,192.168.11.34,TCP,66,0.000047,,,44358  >  6000 [ACK] Seq=29 Ack=2 Win=64256 Len=0 TSval=1346067401 TSecr=3961149687
145,57.791634,192.168.11.6,255.255.255.255,UDP,209,0.030587,Ÿ,7b2273656d616e74696373223a207b22656e74697479223a2022504944222c202262617365656e74697479223a2022616e79222c2022726f6c65223a2022323232222c20227370617469616c223a2022616e79222c202274656d706f72616c223a2022616e79227d2c20226461746170726f7065727479223a207b22666f726d6174223a2022696e616f6b615f70726f6772616d5f73616d706c655f73656d616e746963227d7d,37966  >  7000 Len=167
146,57.800137,192.168.11.29,192.168.11.6,TCP,74,0.008503,œ,,44652  >  6000 [SYN] Seq=0 Win=64240 Len=0 MSS=1460 SACK_PERM TSval=1086777477 TSecr=0 WS=128
147,57.800301,192.168.11.6,192.168.11.29,TCP,74,0.000164,,,"6000  >  44652 [SYN, ACK] Seq=0 Ack=1 Win=65160 Len=0 MSS=1460 SACK_PERM TSval=945711770 TSecr=1086777477 WS=128"
148,57.807213,192.168.11.29,192.168.11.6,TCP,66,0.006912,,,44652  >  6000 [ACK] Seq=1 Ack=1 Win=64256 Len=0 TSval=1086777484 TSecr=945711770
149,57.807916,192.168.11.29,192.168.11.6,TCP,93,0.000703,,,"44652  >  6000 [PSH, ACK] Seq=1 Ack=1 Win=64256 Len=27 TSval=1086777484 TSecr=945711770 [TCP segment of a reassembled PDU]"
150,57.808027,192.168.11.6,192.168.11.29,TCP,66,0.000111,,,6000  >  44652 [ACK] Seq=1 Ack=28 Win=65152 Len=0 TSval=945711778 TSecr=1086777484
151,57.808102,192.168.11.29,192.168.11.6,TCP,66,0.000075,,,"44652  >  6000 [FIN, ACK] Seq=28 Ack=1 Win=64256 Len=0 TSval=1086777484 TSecr=945711770"
152,57.809373,192.168.11.6,192.168.11.29,TCP,66,0.001271,,,"6000  >  44652 [FIN, ACK] Seq=1 Ack=29 Win=65152 Len=0 TSval=945711779 TSecr=1086777484"
153,57.815151,192.168.11.29,192.168.11.6,TCP,66,0.005778,,,44652  >  6000 [ACK] Seq=29 Ack=2 Win=64256 Len=0 TSval=1086777492 TSecr=945711779
154,64.887836,192.168.11.6,192.168.11.34,TCP,74,7.072685,,,47220  >  6000 [SYN] Seq=0 Win=64240 Len=0 MSS=1460 SACK_PERM TSval=1346074528 TSecr=0 WS=128
155,64.894394,192.168.11.34,192.168.11.6,TCP,74,0.006558,,,"6000  >  47220 [SYN, ACK] Seq=0 Ack=1 Win=65160 Len=0 MSS=1460 SACK_PERM TSval=3961156820 TSecr=1346074528 WS=128"
156,64.894506,192.168.11.6,192.168.11.34,TCP,66,0.000112,,,47220  >  6000 [ACK] Seq=1 Ack=1 Win=64256 Len=0 TSval=1346074534 TSecr=3961156820
157,64.894648,192.168.11.6,192.168.11.34,TCP,93,0.000142,,,"47220  >  6000 [PSH, ACK] Seq=1 Ack=1 Win=64256 Len=27 TSval=1346074535 TSecr=3961156820 [TCP segment of a reassembled PDU]"
158,64.894761,192.168.11.6,192.168.11.34,TCP,66,0.000113,,,"47220  >  6000 [FIN, ACK] Seq=28 Ack=1 Win=64256 Len=0 TSval=1346074535 TSecr=3961156820"
159,64.902015,192.168.11.34,192.168.11.6,TCP,66,0.007254,,,6000  >  47220 [ACK] Seq=1 Ack=28 Win=65152 Len=0 TSval=3961156827 TSecr=1346074535
160,64.902393,192.168.11.34,192.168.11.6,TCP,66,0.000378,,,"6000  >  47220 [FIN, ACK] Seq=1 Ack=29 Win=65152 Len=0 TSval=3961156829 TSecr=1346074535"
161,64.902447,192.168.11.6,192.168.11.34,TCP,66,0.000054,,,47220  >  6000 [ACK] Seq=29 Ack=2 Win=64256 Len=0 TSval=1346074542 TSecr=3961156829
162,64.931597,192.168.11.6,255.255.255.255,UDP,209,0.02915,Ÿ,7b2273656d616e74696373223a207b22656e74697479223a2022504944222c202262617365656e74697479223a2022616e79222c2022726f6c65223a2022323232222c20227370617469616c223a2022616e79222c202274656d706f72616c223a2022616e79227d2c20226461746170726f7065727479223a207b22666f726d6174223a2022696e616f6b615f70726f6772616d5f73616d706c655f73656d616e746963227d7d,44037  >  7000 Len=167
163,64.940314,192.168.11.29,192.168.11.6,TCP,74,0.008717,œ,,44658  >  6000 [SYN] Seq=0 Win=64240 Len=0 MSS=1460 SACK_PERM TSval=1086784616 TSecr=0 WS=128
164,64.940472,192.168.11.6,192.168.11.29,TCP,74,0.000158,,,"6000  >  44658 [SYN, ACK] Seq=0 Ack=1 Win=65160 Len=0 MSS=1460 SACK_PERM TSval=945718910 TSecr=1086784616 WS=128"
165,64.947431,192.168.11.29,192.168.11.6,TCP,66,0.006959,,,44658  >  6000 [ACK] Seq=1 Ack=1 Win=64256 Len=0 TSval=1086784623 TSecr=945718910
166,64.950632,192.168.11.29,192.168.11.6,TCP,93,0.003201,,,"44658  >  6000 [PSH, ACK] Seq=1 Ack=1 Win=64256 Len=27 TSval=1086784623 TSecr=945718910 [TCP segment of a reassembled PDU]"
167,64.950828,192.168.11.6,192.168.11.29,TCP,66,0.000196,,,6000  >  44658 [ACK] Seq=1 Ack=28 Win=65152 Len=0 TSval=945718921 TSecr=1086784623
168,64.951198,192.168.11.29,192.168.11.6,TCP,66,0.00037,,,"44658  >  6000 [FIN, ACK] Seq=28 Ack=1 Win=64256 Len=0 TSval=1086784623 TSecr=945718910"
169,64.9524,192.168.11.6,192.168.11.29,TCP,66,0.001202,,,"6000  >  44658 [FIN, ACK] Seq=1 Ack=29 Win=65152 Len=0 TSval=945718922 TSecr=1086784623"
170,64.958775,192.168.11.29,192.168.11.6,TCP,66,0.006375,,,44658  >  6000 [ACK] Seq=29 Ack=2 Win=64256 Len=0 TSval=1086784634 TSecr=945718922
171,110.555722,192.168.11.6,192.168.11.34,TCP,74,45.596947,,,42322  >  6000 [SYN] Seq=0 Win=64240 Len=0 MSS=1460 SACK_PERM TSval=1346120196 TSecr=0 WS=128
172,110.562379,192.168.11.34,192.168.11.6,TCP,74,0.006657,,,"6000  >  42322 [SYN, ACK] Seq=0 Ack=1 Win=65160 Len=0 MSS=1460 SACK_PERM TSval=3961202490 TSecr=1346120196 WS=128"
173,110.562502,192.168.11.6,192.168.11.34,TCP,66,0.000123,,,42322  >  6000 [ACK] Seq=1 Ack=1 Win=64256 Len=0 TSval=1346120202 TSecr=3961202490
174,110.562645,192.168.11.6,192.168.11.34,TCP,93,0.000143,,,"42322  >  6000 [PSH, ACK] Seq=1 Ack=1 Win=64256 Len=27 TSval=1346120203 TSecr=3961202490 [TCP segment of a reassembled PDU]"
175,110.562754,192.168.11.6,192.168.11.34,TCP,66,0.000109,,,"42322  >  6000 [FIN, ACK] Seq=28 Ack=1 Win=64256 Len=0 TSval=1346120203 TSecr=3961202490"
176,110.577038,192.168.11.34,192.168.11.6,TCP,66,0.014284,,,6000  >  42322 [ACK] Seq=1 Ack=28 Win=65152 Len=0 TSval=3961202504 TSecr=1346120203
177,110.577423,192.168.11.34,192.168.11.6,TCP,66,0.000385,,,"6000  >  42322 [FIN, ACK] Seq=1 Ack=29 Win=65152 Len=0 TSval=3961202505 TSecr=1346120203"
178,110.577489,192.168.11.6,192.168.11.34,TCP,66,0.000066,,,42322  >  6000 [ACK] Seq=29 Ack=2 Win=64256 Len=0 TSval=1346120217 TSecr=3961202505
179,110.606645,192.168.11.6,255.255.255.255,UDP,209,0.029156,Ÿ,7b2273656d616e74696373223a207b22656e74697479223a2022504944222c202262617365656e74697479223a2022616e79222c2022726f6c65223a2022323232222c20227370617469616c223a2022616e79222c202274656d706f72616c223a2022616e79227d2c20226461746170726f7065727479223a207b22666f726d6174223a2022696e616f6b615f70726f6772616d5f73616d706c655f73656d616e746963227d7d,32876  >  7000 Len=167
180,110.614882,192.168.11.29,192.168.11.6,TCP,74,0.008237,œ,,58046  >  6000 [SYN] Seq=0 Win=64240 Len=0 MSS=1460 SACK_PERM TSval=1086830284 TSecr=0 WS=128
181,110.615056,192.168.11.6,192.168.11.29,TCP,74,0.000174,,,"6000  >  58046 [SYN, ACK] Seq=0 Ack=1 Win=65160 Len=0 MSS=1460 SACK_PERM TSval=945764585 TSecr=1086830284 WS=128"
182,110.623807,192.168.11.29,192.168.11.6,TCP,66,0.008751,,,58046  >  6000 [ACK] Seq=1 Ack=1 Win=64256 Len=0 TSval=1086830292 TSecr=945764585
183,110.625873,192.168.11.29,192.168.11.6,TCP,93,0.002066,,,"58046  >  6000 [PSH, ACK] Seq=1 Ack=1 Win=64256 Len=27 TSval=1086830292 TSecr=945764585 [TCP segment of a reassembled PDU]"
184,110.626089,192.168.11.6,192.168.11.29,TCP,66,0.000216,,,6000  >  58046 [ACK] Seq=1 Ack=28 Win=65152 Len=0 TSval=945764596 TSecr=1086830292
185,110.626223,192.168.11.29,192.168.11.6,TCP,66,0.000134,,,"58046  >  6000 [FIN, ACK] Seq=28 Ack=1 Win=64256 Len=0 TSval=1086830293 TSecr=945764585"
186,110.62795,192.168.11.6,192.168.11.29,TCP,66,0.001727,,,"6000  >  58046 [FIN, ACK] Seq=1 Ack=29 Win=65152 Len=0 TSval=945764598 TSecr=1086830293"
187,110.6331,192.168.11.29,192.168.11.6,TCP,66,0.00515,,,58046  >  6000 [ACK] Seq=29 Ack=2 Win=64256 Len=0 TSval=1086830302 TSecr=945764598
188,117.724876,192.168.11.6,192.168.11.34,TCP,74,7.091776,,,42324  >  6000 [SYN] Seq=0 Win=64240 Len=0 MSS=1460 SACK_PERM TSval=1346127365 TSecr=0 WS=128
189,117.732023,192.168.11.34,192.168.11.6,TCP,74,0.007147,,,"6000  >  42324 [SYN, ACK] Seq=0 Ack=1 Win=65160 Len=0 MSS=1460 SACK_PERM TSval=3961209660 TSecr=1346127365 WS=128"
190,117.732138,192.168.11.6,192.168.11.34,TCP,66,0.000115,,,42324  >  6000 [ACK] Seq=1 Ack=1 Win=64256 Len=0 TSval=1346127372 TSecr=3961209660
191,117.732337,192.168.11.6,192.168.11.34,TCP,93,0.000199,,,"42324  >  6000 [PSH, ACK] Seq=1 Ack=1 Win=64256 Len=27 TSval=1346127372 TSecr=3961209660 [TCP segment of a reassembled PDU]"
192,117.732449,192.168.11.6,192.168.11.34,TCP,66,0.000112,,,"42324  >  6000 [FIN, ACK] Seq=28 Ack=1 Win=64256 Len=0 TSval=1346127372 TSecr=3961209660"
193,117.73996,192.168.11.34,192.168.11.6,TCP,66,0.007511,,,6000  >  42324 [ACK] Seq=1 Ack=28 Win=65152 Len=0 TSval=3961209668 TSecr=1346127372
194,117.740206,192.168.11.34,192.168.11.6,TCP,66,0.000246,,,"6000  >  42324 [FIN, ACK] Seq=1 Ack=29 Win=65152 Len=0 TSval=3961209669 TSecr=1346127372"
195,117.740251,192.168.11.6,192.168.11.34,TCP,66,0.000045,,,42324  >  6000 [ACK] Seq=29 Ack=2 Win=64256 Len=0 TSval=1346127380 TSecr=3961209669
196,117.77071,192.168.11.6,255.255.255.255,UDP,209,0.030459,Ÿ,7b2273656d616e74696373223a207b22656e74697479223a2022504944222c202262617365656e74697479223a2022616e79222c2022726f6c65223a2022323232222c20227370617469616c223a2022616e79222c202274656d706f72616c223a2022616e79227d2c20226461746170726f7065727479223a207b22666f726d6174223a2022696e616f6b615f70726f6772616d5f73616d706c655f73656d616e746963227d7d,48401  >  7000 Len=167
197,117.778931,192.168.11.29,192.168.11.6,TCP,74,0.008221,œ,,51600  >  6000 [SYN] Seq=0 Win=64240 Len=0 MSS=1460 SACK_PERM TSval=1086837447 TSecr=0 WS=128
198,117.779079,192.168.11.6,192.168.11.29,TCP,74,0.000148,,,"6000  >  51600 [SYN, ACK] Seq=0 Ack=1 Win=65160 Len=0 MSS=1460 SACK_PERM TSval=945771749 TSecr=1086837447 WS=128"
199,117.788899,192.168.11.29,192.168.11.6,TCP,66,0.00982,,,51600  >  6000 [ACK] Seq=1 Ack=1 Win=64256 Len=0 TSval=1086837453 TSecr=945771749
200,117.789932,192.168.11.29,192.168.11.6,TCP,93,0.001033,,,"51600  >  6000 [PSH, ACK] Seq=1 Ack=1 Win=64256 Len=27 TSval=1086837453 TSecr=945771749 [TCP segment of a reassembled PDU]"
201,117.790057,192.168.11.6,192.168.11.29,TCP,66,0.000125,,,6000  >  51600 [ACK] Seq=1 Ack=28 Win=65152 Len=0 TSval=945771760 TSecr=1086837453
202,117.790137,192.168.11.29,192.168.11.6,TCP,66,0.00008,,,"51600  >  6000 [FIN, ACK] Seq=28 Ack=1 Win=64256 Len=0 TSval=1086837454 TSecr=945771749"
203,117.791732,192.168.11.6,192.168.11.29,TCP,66,0.001595,,,"6000  >  51600 [FIN, ACK] Seq=1 Ack=29 Win=65152 Len=0 TSval=945771762 TSecr=1086837454"
204,117.796352,192.168.11.29,192.168.11.6,TCP,66,0.00462,,,51600  >  6000 [ACK] Seq=29 Ack=2 Win=64256 Len=0 TSval=1086837465 TSecr=945771762
205,124.968113,192.168.11.6,192.168.11.34,TCP,74,7.171761,,,50108  >  6000 [SYN] Seq=0 Win=64240 Len=0 MSS=1460 SACK_PERM TSval=1346134608 TSecr=0 WS=128
206,124.974849,192.168.11.34,192.168.11.6,TCP,74,0.006736,,,"6000  >  50108 [SYN, ACK] Seq=0 Ack=1 Win=65160 Len=0 MSS=1460 SACK_PERM TSval=3961216903 TSecr=1346134608 WS=128"
207,124.974965,192.168.11.6,192.168.11.34,TCP,66,0.000116,,,50108  >  6000 [ACK] Seq=1 Ack=1 Win=64256 Len=0 TSval=1346134615 TSecr=3961216903
208,124.975146,192.168.11.6,192.168.11.34,TCP,93,0.000181,,,"50108  >  6000 [PSH, ACK] Seq=1 Ack=1 Win=64256 Len=27 TSval=1346134615 TSecr=3961216903 [TCP segment of a reassembled PDU]"
209,124.975252,192.168.11.6,192.168.11.34,TCP,66,0.000106,,,"50108  >  6000 [FIN, ACK] Seq=28 Ack=1 Win=64256 Len=0 TSval=1346134615 TSecr=3961216903"
210,124.982387,192.168.11.34,192.168.11.6,TCP,66,0.007135,,,6000  >  50108 [ACK] Seq=1 Ack=28 Win=65152 Len=0 TSval=3961216911 TSecr=1346134615
211,124.982603,192.168.11.34,192.168.11.6,TCP,66,0.000216,,,"6000  >  50108 [FIN, ACK] Seq=1 Ack=29 Win=65152 Len=0 TSval=3961216912 TSecr=1346134615"
212,124.98265,192.168.11.6,192.168.11.34,TCP,66,0.000047,,,50108  >  6000 [ACK] Seq=29 Ack=2 Win=64256 Len=0 TSval=1346134623 TSecr=3961216912
213,125.012908,192.168.11.6,255.255.255.255,UDP,209,0.030258,Ÿ,7b2273656d616e74696373223a207b22656e74697479223a2022504944222c202262617365656e74697479223a2022616e79222c2022726f6c65223a2022323232222c20227370617469616c223a2022616e79222c202274656d706f72616c223a2022616e79227d2c20226461746170726f7065727479223a207b22666f726d6174223a2022696e616f6b615f70726f6772616d5f73616d706c655f73656d616e746963227d7d,49229  >  7000 Len=167
214,125.02096,192.168.11.29,192.168.11.6,TCP,74,0.008052,œ,,51614  >  6000 [SYN] Seq=0 Win=64240 Len=0 MSS=1460 SACK_PERM TSval=1086844687 TSecr=0 WS=128
215,125.021114,192.168.11.6,192.168.11.29,TCP,74,0.000154,,,"6000  >  51614 [SYN, ACK] Seq=0 Ack=1 Win=65160 Len=0 MSS=1460 SACK_PERM TSval=945778991 TSecr=1086844687 WS=128"
216,125.032276,192.168.11.29,192.168.11.6,TCP,66,0.011162,,,51614  >  6000 [ACK] Seq=1 Ack=1 Win=64256 Len=0 TSval=1086844694 TSecr=945778991
217,125.033288,192.168.11.29,192.168.11.6,TCP,93,0.001012,,,"51614  >  6000 [PSH, ACK] Seq=1 Ack=1 Win=64256 Len=27 TSval=1086844694 TSecr=945778991 [TCP segment of a reassembled PDU]"
218,125.033441,192.168.11.6,192.168.11.29,TCP,66,0.000153,,,6000  >  51614 [ACK] Seq=1 Ack=28 Win=65152 Len=0 TSval=945779003 TSecr=1086844694
219,125.03354,192.168.11.29,192.168.11.6,TCP,66,0.000099,,,"51614  >  6000 [FIN, ACK] Seq=28 Ack=1 Win=64256 Len=0 TSval=1086844695 TSecr=945778991"
220,125.035134,192.168.11.6,192.168.11.29,TCP,66,0.001594,,,"6000  >  51614 [FIN, ACK] Seq=1 Ack=29 Win=65152 Len=0 TSval=945779005 TSecr=1086844695"
221,125.039718,192.168.11.29,192.168.11.6,TCP,66,0.004584,,,51614  >  6000 [ACK] Seq=29 Ack=2 Win=64256 Len=0 TSval=1086844707 TSecr=945779005
222,132.139224,192.168.11.6,192.168.11.34,TCP,74,7.099506,,,37698  >  6000 [SYN] Seq=0 Win=64240 Len=0 MSS=1460 SACK_PERM TSval=1346141779 TSecr=0 WS=128
223,132.146366,192.168.11.34,192.168.11.6,TCP,74,0.007142,,,"6000  >  37698 [SYN, ACK] Seq=0 Ack=1 Win=65160 Len=0 MSS=1460 SACK_PERM TSval=3961224075 TSecr=1346141779 WS=128"
224,132.146497,192.168.11.6,192.168.11.34,TCP,66,0.000131,,,37698  >  6000 [ACK] Seq=1 Ack=1 Win=64256 Len=0 TSval=1346141786 TSecr=3961224075
225,132.146666,192.168.11.6,192.168.11.34,TCP,93,0.000169,,,"37698  >  6000 [PSH, ACK] Seq=1 Ack=1 Win=64256 Len=27 TSval=1346141787 TSecr=3961224075 [TCP segment of a reassembled PDU]"
226,132.146762,192.168.11.6,192.168.11.34,TCP,66,0.000096,,,"37698  >  6000 [FIN, ACK] Seq=28 Ack=1 Win=64256 Len=0 TSval=1346141787 TSecr=3961224075"
227,132.160164,192.168.11.34,192.168.11.6,TCP,66,0.013402,,,6000  >  37698 [ACK] Seq=1 Ack=28 Win=65152 Len=0 TSval=3961224089 TSecr=1346141787
228,132.160554,192.168.11.34,192.168.11.6,TCP,66,0.00039,,,"6000  >  37698 [FIN, ACK] Seq=1 Ack=29 Win=65152 Len=0 TSval=3961224090 TSecr=1346141787"
229,132.160606,192.168.11.6,192.168.11.34,TCP,66,0.000052,,,37698  >  6000 [ACK] Seq=29 Ack=2 Win=64256 Len=0 TSval=1346141801 TSecr=3961224090
230,132.189618,192.168.11.6,255.255.255.255,UDP,209,0.029012,Ÿ,7b2273656d616e74696373223a207b22656e74697479223a2022504944222c202262617365656e74697479223a2022616e79222c2022726f6c65223a2022323232222c20227370617469616c223a2022616e79222c202274656d706f72616c223a2022616e79227d2c20226461746170726f7065727479223a207b22666f726d6174223a2022696e616f6b615f70726f6772616d5f73616d706c655f73656d616e746963227d7d,47700  >  7000 Len=167
231,132.197962,192.168.11.29,192.168.11.6,TCP,74,0.008344,œ,,59550  >  6000 [SYN] Seq=0 Win=64240 Len=0 MSS=1460 SACK_PERM TSval=1086851863 TSecr=0 WS=128
232,132.198093,192.168.11.6,192.168.11.29,TCP,74,0.000131,,,"6000  >  59550 [SYN, ACK] Seq=0 Ack=1 Win=65160 Len=0 MSS=1460 SACK_PERM TSval=945786168 TSecr=1086851863 WS=128"
233,132.204737,192.168.11.29,192.168.11.6,TCP,66,0.006644,,,59550  >  6000 [ACK] Seq=1 Ack=1 Win=64256 Len=0 TSval=1086851870 TSecr=945786168
