No.,Time,Source,Destination,Protocol,Length,Time delta from previous captured frame,XXX,Data,Info
1,0,192.168.11.29,192.168.11.6,TCP,74,0,,,41800  >  6000 [SYN] Seq=0 Win=64240 Len=0 MSS=1460 SACK_PERM TSval=1086719742 TSecr=0 WS=128
2,0.008263,192.168.11.6,192.168.11.29,TCP,74,0.008263,,,"6000  >  41800 [SYN, ACK] Seq=0 Ack=1 Win=65160 Len=0 MSS=1460 SACK_PERM TSval=945654030 TSecr=1086719742 WS=128"
3,0.008368,192.168.11.29,192.168.11.6,TCP,66,0.000105,,,41800  >  6000 [ACK] Seq=1 Ack=1 Win=64256 Len=0 TSval=1086719754 TSecr=945654030
4,0.008606,192.168.11.29,192.168.11.6,TCP,93,0.000238,,,"41800  >  6000 [PSH, ACK] Seq=1 Ack=1 Win=64256 Len=27 TSval=1086719754 TSecr=945654030 [TCP segment of a reassembled PDU]"
5,0.008756,192.168.11.29,192.168.11.6,TCP,66,0.00015,,,"41800  >  6000 [FIN, ACK] Seq=28 Ack=1 Win=64256 Len=0 TSval=1086719755 TSecr=945654030"
6,0.017062,192.168.11.6,192.168.11.29,TCP,66,0.008306,,,6000  >  41800 [ACK] Seq=1 Ack=28 Win=65152 Len=0 TSval=945654038 TSecr=1086719754
7,0.017395,192.168.11.6,192.168.11.29,TCP,66,0.000333,,,"6000  >  41800 [FIN, ACK] Seq=1 Ack=29 Win=65152 Len=0 TSval=945654040 TSecr=1086719755"
8,0.017459,192.168.11.29,192.168.11.6,TCP,66,0.000064,,,41800  >  6000 [ACK] Seq=29 Ack=2 Win=64256 Len=0 TSval=1086719763 TSecr=945654040
9,0.043766,192.168.11.29,255.255.255.255,UDP,209,0.026307,Ÿ,7b2273656d616e74696373223a207b22656e74697479223a2022504944222c202262617365656e74697479223a2022616e79222c2022726f6c65223a2022333333222c20227370617469616c223a2022616e79222c202274656d706f72616c223a2022616e79227d2c20226461746170726f7065727479223a207b22666f726d6174223a2022696e616f6b615f70726f6772616d5f73616d706c655f73656d616e746963227d7d,53485  >  7000 Len=167
10,0.054515,192.168.11.31,192.168.11.29,TCP,74,0.010749,œ,,58468  >  6000 [SYN] Seq=0 Win=64240 Len=0 MSS=1460 SACK_PERM TSval=2641581813 TSecr=0 WS=128
11,0.054653,192.168.11.29,192.168.11.31,TCP,74,0.000138,,,"6000  >  58468 [SYN, ACK] Seq=0 Ack=1 Win=65160 Len=0 MSS=1460 SACK_PERM TSval=4003233344 TSecr=2641581813 WS=128"
12,0.06732,192.168.11.31,192.168.11.29,TCP,66,0.012667,,,58468  >  6000 [ACK] Seq=1 Ack=1 Win=64256 Len=0 TSval=2641581823 TSecr=4003233344
13,0.067865,192.168.11.31,192.168.11.29,TCP,93,0.000545,,,"58468  >  6000 [PSH, ACK] Seq=1 Ack=1 Win=64256 Len=27 TSval=2641581823 TSecr=4003233344 [TCP segment of a reassembled PDU]"
14,0.067967,192.168.11.29,192.168.11.31,TCP,66,0.000102,,,6000  >  58468 [ACK] Seq=1 Ack=28 Win=65152 Len=0 TSval=4003233358 TSecr=2641581823
15,0.068037,192.168.11.31,192.168.11.29,TCP,66,0.00007,,,"58468  >  6000 [FIN, ACK] Seq=28 Ack=1 Win=64256 Len=0 TSval=2641581824 TSecr=4003233344"
16,0.070114,192.168.11.29,192.168.11.31,TCP,66,0.002077,,,"6000  >  58468 [FIN, ACK] Seq=1 Ack=29 Win=65152 Len=0 TSval=4003233360 TSecr=2641581824"
17,0.078516,192.168.11.31,192.168.11.29,TCP,66,0.008402,,,58468  >  6000 [ACK] Seq=29 Ack=2 Win=64256 Len=0 TSval=2641581840 TSecr=4003233360
18,7.279769,192.168.11.29,192.168.11.6,TCP,74,7.201253,,,41810  >  6000 [SYN] Seq=0 Win=64240 Len=0 MSS=1460 SACK_PERM TSval=1086727025 TSecr=0 WS=128
19,7.286342,192.168.11.6,192.168.11.29,TCP,74,0.006573,,,"6000  >  41810 [SYN, ACK] Seq=0 Ack=1 Win=65160 Len=0 MSS=1460 SACK_PERM TSval=945661310 TSecr=1086727025 WS=128"
20,7.286451,192.168.11.29,192.168.11.6,TCP,66,0.000109,,,41810  >  6000 [ACK] Seq=1 Ack=1 Win=64256 Len=0 TSval=1086727032 TSecr=945661310
21,7.286636,192.168.11.29,192.168.11.6,TCP,93,0.000185,,,"41810  >  6000 [PSH, ACK] Seq=1 Ack=1 Win=64256 Len=27 TSval=1086727032 TSecr=945661310 [TCP segment of a reassembled PDU]"
22,7.286831,192.168.11.29,192.168.11.6,TCP,66,0.000195,,,"41810  >  6000 [FIN, ACK] Seq=28 Ack=1 Win=64256 Len=0 TSval=1086727033 TSecr=945661310"
23,7.293803,192.168.11.6,192.168.11.29,TCP,66,0.006972,,,6000  >  41810 [ACK] Seq=1 Ack=28 Win=65152 Len=0 TSval=945661317 TSecr=1086727032
24,7.294036,192.168.11.6,192.168.11.29,TCP,66,0.000233,,,"6000  >  41810 [FIN, ACK] Seq=1 Ack=29 Win=65152 Len=0 TSval=945661319 TSecr=1086727033"
25,7.294091,192.168.11.29,192.168.11.6,TCP,66,0.000055,,,41810  >  6000 [ACK] Seq=29 Ack=2 Win=64256 Len=0 TSval=1086727040 TSecr=945661319
26,7.324141,192.168.11.29,255.255.255.255,UDP,209,0.03005,Ÿ,7b2273656d616e74696373223a207b22656e74697479223a2022504944222c202262617365656e74697479223a2022616e79222c2022726f6c65223a2022333333222c20227370617469616c223a2022616e79222c202274656d706f72616c223a2022616e79227d2c20226461746170726f7065727479223a207b22666f726d6174223a2022696e616f6b615f70726f6772616d5f73616d706c655f73656d616e746963227d7d,37914  >  7000 Len=167
27,7.331687,192.168.11.31,192.168.11.29,TCP,74,0.007546,œ,,52070  >  6000 [SYN] Seq=0 Win=64240 Len=0 MSS=1460 SACK_PERM TSval=2641589095 TSecr=0 WS=128
28,7.331824,192.168.11.29,192.168.11.31,TCP,74,0.000137,,,"6000  >  52070 [SYN, ACK] Seq=0 Ack=1 Win=65160 Len=0 MSS=1460 SACK_PERM TSval=4003240622 TSecr=2641589095 WS=128"
29,7.34742,192.168.11.31,192.168.11.29,TCP,66,0.015596,,,52070  >  6000 [ACK] Seq=1 Ack=1 Win=64256 Len=0 TSval=2641589102 TSecr=4003240622
30,7.3479,192.168.11.31,192.168.11.29,TCP,93,0.00048,,,"52070  >  6000 [PSH, ACK] Seq=1 Ack=1 Win=64256 Len=27 TSval=2641589102 TSecr=4003240622 [TCP segment of a reassembled PDU]"
31,7.347977,192.168.11.29,192.168.11.31,TCP,66,0.000077,,,6000  >  52070 [ACK] Seq=1 Ack=28 Win=65152 Len=0 TSval=4003240638 TSecr=2641589102
32,7.348041,192.168.11.31,192.168.11.29,TCP,66,0.000064,,,"52070  >  6000 [FIN, ACK] Seq=28 Ack=1 Win=64256 Len=0 TSval=2641589102 TSecr=4003240622"
33,7.349029,192.168.11.29,192.168.11.31,TCP,66,0.000988,,,"6000  >  52070 [FIN, ACK] Seq=1 Ack=29 Win=65152 Len=0 TSval=4003240639 TSecr=2641589102"
34,7.355188,192.168.11.31,192.168.11.29,TCP,66,0.006159,,,52070  >  6000 [ACK] Seq=29 Ack=2 Win=64256 Len=0 TSval=2641589118 TSecr=4003240639
35,14.614656,192.168.11.29,192.168.11.6,TCP,74,7.259468,,,40130  >  6000 [SYN] Seq=0 Win=64240 Len=0 MSS=1460 SACK_PERM TSval=1086734360 TSecr=0 WS=128
36,14.621518,192.168.11.6,192.168.11.29,TCP,74,0.006862,,,"6000  >  40130 [SYN, ACK] Seq=0 Ack=1 Win=65160 Len=0 MSS=1460 SACK_PERM TSval=945668646 TSecr=1086734360 WS=128"
37,14.621625,192.168.11.29,192.168.11.6,TCP,66,0.000107,,,40130  >  6000 [ACK] Seq=1 Ack=1 Win=64256 Len=0 TSval=1086734367 TSecr=945668646
38,14.621807,192.168.11.29,192.168.11.6,TCP,93,0.000182,,,"40130  >  6000 [PSH, ACK] Seq=1 Ack=1 Win=64256 Len=27 TSval=1086734368 TSecr=945668646 [TCP segment of a reassembled PDU]"
39,14.62191,192.168.11.29,192.168.11.6,TCP,66,0.000103,,,"40130  >  6000 [FIN, ACK] Seq=28 Ack=1 Win=64256 Len=0 TSval=1086734368 TSecr=945668646"
40,14.629872,192.168.11.6,192.168.11.29,TCP,66,0.007962,,,6000  >  40130 [ACK] Seq=1 Ack=28 Win=65152 Len=0 TSval=945668654 TSecr=1086734368
41,14.63008,192.168.11.6,192.168.11.29,TCP,66,0.000208,,,"6000  >  40130 [FIN, ACK] Seq=1 Ack=29 Win=65152 Len=0 TSval=945668657 TSecr=1086734368"
42,14.630127,192.168.11.29,192.168.11.6,TCP,66,0.000047,,,40130  >  6000 [ACK] Seq=29 Ack=2 Win=64256 Len=0 TSval=1086734376 TSecr=945668657
43,14.660542,192.168.11.29,255.255.255.255,UDP,209,0.030415,Ÿ,7b2273656d616e74696373223a207b22656e74697479223a2022504944222c202262617365656e74697479223a2022616e79222c2022726f6c65223a2022333333222c20227370617469616c223a2022616e79222c202274656d706f72616c223a2022616e79227d2c20226461746170726f7065727479223a207b22666f726d6174223a2022696e616f6b615f70726f6772616d5f73616d706c655f73656d616e746963227d7d,39147  >  7000 Len=167
44,14.668069,192.168.11.31,192.168.11.29,TCP,74,0.007527,œ,,52086  >  6000 [SYN] Seq=0 Win=64240 Len=0 MSS=1460 SACK_PERM TSval=2641596433 TSecr=0 WS=128
45,14.668206,192.168.11.29,192.168.11.31,TCP,74,0.000137,,,"6000  >  52086 [SYN, ACK] Seq=0 Ack=1 Win=65160 Len=0 MSS=1460 SACK_PERM TSval=4003247958 TSecr=2641596433 WS=128"
46,14.675845,192.168.11.31,192.168.11.29,TCP,66,0.007639,,,52086  >  6000 [ACK] Seq=1 Ack=1 Win=64256 Len=0 TSval=2641596440 TSecr=4003247958
47,14.676455,192.168.11.31,192.168.11.29,TCP,93,0.00061,,,"52086  >  6000 [PSH, ACK] Seq=1 Ack=1 Win=64256 Len=27 TSval=2641596440 TSecr=4003247958 [TCP segment of a reassembled PDU]"
48,14.676555,192.168.11.29,192.168.11.31,TCP,66,0.0001,,,6000  >  52086 [ACK] Seq=1 Ack=28 Win=65152 Len=0 TSval=4003247966 TSecr=2641596440
49,14.676626,192.168.11.31,192.168.11.29,TCP,66,0.000071,,,"52086  >  6000 [FIN, ACK] Seq=28 Ack=1 Win=64256 Len=0 TSval=2641596441 TSecr=4003247958"
50,14.67858,192.168.11.29,192.168.11.31,TCP,66,0.001954,,,"6000  >  52086 [FIN, ACK] Seq=1 Ack=29 Win=65152 Len=0 TSval=4003247968 TSecr=2641596441"
51,14.683404,192.168.11.31,192.168.11.29,TCP,66,0.004824,,,52086  >  6000 [ACK] Seq=29 Ack=2 Win=64256 Len=0 TSval=2641596448 TSecr=4003247968
52,21.817147,192.168.11.29,192.168.11.6,TCP,74,7.133743,,,48310  >  6000 [SYN] Seq=0 Win=64240 Len=0 MSS=1460 SACK_PERM TSval=1086741563 TSecr=0 WS=128
53,21.823894,192.168.11.6,192.168.11.29,TCP,74,0.006747,,,"6000  >  48310 [SYN, ACK] Seq=0 Ack=1 Win=65160 Len=0 MSS=1460 SACK_PERM TSval=945675850 TSecr=1086741563 WS=128"
54,21.824009,192.168.11.29,192.168.11.6,TCP,66,0.000115,,,48310  >  6000 [ACK] Seq=1 Ack=1 Win=64256 Len=0 TSval=1086741570 TSecr=945675850
55,21.82419,192.168.11.29,192.168.11.6,TCP,93,0.000181,,,"48310  >  6000 [PSH, ACK] Seq=1 Ack=1 Win=64256 Len=27 TSval=1086741570 TSecr=945675850 [TCP segment of a reassembled PDU]"
56,21.824294,192.168.11.29,192.168.11.6,TCP,66,0.000104,,,"48310  >  6000 [FIN, ACK] Seq=28 Ack=1 Win=64256 Len=0 TSval=1086741570 TSecr=945675850"
57,21.831453,192.168.11.6,192.168.11.29,TCP,66,0.007159,,,6000  >  48310 [ACK] Seq=1 Ack=28 Win=65152 Len=0 TSval=945675857 TSecr=1086741570
58,21.831834,192.168.11.6,192.168.11.29,TCP,66,0.000381,,,"6000  >  48310 [FIN, ACK] Seq=1 Ack=29 Win=65152 Len=0 TSval=945675859 TSecr=1086741570"
59,21.831882,192.168.11.29,192.168.11.6,TCP,66,0.000048,,,48310  >  6000 [ACK] Seq=29 Ack=2 Win=64256 Len=0 TSval=1086741578 TSecr=945675859
60,21.86127,192.168.11.29,255.255.255.255,UDP,209,0.029388,Ÿ,7b2273656d616e74696373223a207b22656e74697479223a2022504944222c202262617365656e74697479223a2022616e79222c2022726f6c65223a2022333333222c20227370617469616c223a2022616e79222c202274656d706f72616c223a2022616e79227d2c20226461746170726f7065727479223a207b22666f726d6174223a2022696e616f6b615f70726f6772616d5f73616d706c655f73656d616e746963227d7d,43506  >  7000 Len=167
61,21.869442,192.168.11.31,192.168.11.29,TCP,74,0.008172,œ,,34516  >  6000 [SYN] Seq=0 Win=64240 Len=0 MSS=1460 SACK_PERM TSval=2641603635 TSecr=0 WS=128
62,21.869583,192.168.11.29,192.168.11.31,TCP,74,0.000141,,,"6000  >  34516 [SYN, ACK] Seq=0 Ack=1 Win=65160 Len=0 MSS=1460 SACK_PERM TSval=4003255159 TSecr=2641603635 WS=128"
63,21.876316,192.168.11.31,192.168.11.29,TCP,66,0.006733,,,34516  >  6000 [ACK] Seq=1 Ack=1 Win=64256 Len=0 TSval=2641603642 TSecr=4003255159
64,21.876982,192.168.11.31,192.168.11.29,TCP,93,0.000666,,,"34516  >  6000 [PSH, ACK] Seq=1 Ack=1 Win=64256 Len=27 TSval=2641603642 TSecr=4003255159 [TCP segment of a reassembled PDU]"
65,21.877073,192.168.11.29,192.168.11.31,TCP,66,0.000091,,,6000  >  34516 [ACK] Seq=1 Ack=28 Win=65152 Len=0 TSval=4003255167 TSecr=2641603642
66,21.877161,192.168.11.31,192.168.11.29,TCP,66,0.000088,,,"34516  >  6000 [FIN, ACK] Seq=28 Ack=1 Win=64256 Len=0 TSval=2641603642 TSecr=4003255159"
67,21.879232,192.168.11.29,192.168.11.31,TCP,66,0.002071,,,"6000  >  34516 [FIN, ACK] Seq=1 Ack=29 Win=65152 Len=0 TSval=4003255169 TSecr=2641603642"
68,21.886234,192.168.11.31,192.168.11.29,TCP,66,0.007002,,,34516  >  6000 [ACK] Seq=29 Ack=2 Win=64256 Len=0 TSval=2641603652 TSecr=4003255169
69,29.015282,192.168.11.29,192.168.11.6,TCP,74,7.129048,,,36984  >  6000 [SYN] Seq=0 Win=64240 Len=0 MSS=1460 SACK_PERM TSval=1086748761 TSecr=0 WS=128
70,29.022399,192.168.11.6,192.168.11.29,TCP,74,0.007117,,,"6000  >  36984 [SYN, ACK] Seq=0 Ack=1 Win=65160 Len=0 MSS=1460 SACK_PERM TSval=945683049 TSecr=1086748761 WS=128"
71,29.022509,192.168.11.29,192.168.11.6,TCP,66,0.00011,,,36984  >  6000 [ACK] Seq=1 Ack=1 Win=64256 Len=0 TSval=1086748768 TSecr=945683049
72,29.022676,192.168.11.29,192.168.11.6,TCP,93,0.000167,,,"36984  >  6000 [PSH, ACK] Seq=1 Ack=1 Win=64256 Len=27 TSval=1086748768 TSecr=945683049 [TCP segment of a reassembled PDU]"
73,29.022824,192.168.11.29,192.168.11.6,TCP,66,0.000148,,,"36984  >  6000 [FIN, ACK] Seq=28 Ack=1 Win=64256 Len=0 TSval=1086748769 TSecr=945683049"
74,29.030242,192.168.11.6,192.168.11.29,TCP,66,0.007418,,,6000  >  36984 [ACK] Seq=1 Ack=28 Win=65152 Len=0 TSval=945683057 TSecr=1086748768
75,29.030476,192.168.11.6,192.168.11.29,TCP,66,0.000234,,,"6000  >  36984 [FIN, ACK] Seq=1 Ack=29 Win=65152 Len=0 TSval=945683059 TSecr=1086748769"
76,29.030524,192.168.11.29,192.168.11.6,TCP,66,0.000048,,,36984  >  6000 [ACK] Seq=29 Ack=2 Win=64256 Len=0 TSval=1086748776 TSecr=945683059
77,29.062175,192.168.11.29,255.255.255.255,UDP,209,0.031651,Ÿ,7b2273656d616e74696373223a207b22656e74697479223a2022504944222c202262617365656e74697479223a2022616e79222c2022726f6c65223a2022333333222c20227370617469616c223a2022616e79222c202274656d706f72616c223a2022616e79227d2c20226461746170726f7065727479223a207b22666f726d6174223a2022696e616f6b615f70726f6772616d5f73616d706c655f73656d616e746963227d7d,52230  >  7000 Len=167
78,29.06999,192.168.11.31,192.168.11.29,TCP,74,0.007815,œ,,55430  >  6000 [SYN] Seq=0 Win=64240 Len=0 MSS=1460 SACK_PERM TSval=2641610837 TSecr=0 WS=128
79,29.070136,192.168.11.29,192.168.11.31,TCP,74,0.000146,,,"6000  >  55430 [SYN, ACK] Seq=0 Ack=1 Win=65160 Len=0 MSS=1460 SACK_PERM TSval=4003262360 TSecr=2641610837 WS=128"
80,29.076915,192.168.11.31,192.168.11.29,TCP,66,0.006779,,,55430  >  6000 [ACK] Seq=1 Ack=1 Win=64256 Len=0 TSval=2641610844 TSecr=4003262360
81,29.077539,192.168.11.31,192.168.11.29,TCP,93,0.000624,,,"55430  >  6000 [PSH, ACK] Seq=1 Ack=1 Win=64256 Len=27 TSval=2641610844 TSecr=4003262360 [TCP segment of a reassembled PDU]"
82,29.077657,192.168.11.29,192.168.11.31,TCP,66,0.000118,,,6000  >  55430 [ACK] Seq=1 Ack=28 Win=65152 Len=0 TSval=4003262367 TSecr=2641610844
83,29.077731,192.168.11.31,192.168.11.29,TCP,66,0.000074,,,"55430  >  6000 [FIN, ACK] Seq=28 Ack=1 Win=64256 Len=0 TSval=2641610844 TSecr=4003262360"
84,29.079755,192.168.11.29,192.168.11.31,TCP,66,0.002024,,,"6000  >  55430 [FIN, ACK] Seq=1 Ack=29 Win=65152 Len=0 TSval=4003262369 TSecr=2641610844"
85,29.088626,192.168.11.31,192.168.11.29,TCP,66,0.008871,,,55430  >  6000 [ACK] Seq=29 Ack=2 Win=64256 Len=0 TSval=2641610856 TSecr=4003262369
86,36.181316,192.168.11.29,192.168.11.6,TCP,74,7.09269,,,36998  >  6000 [SYN] Seq=0 Win=64240 Len=0 MSS=1460 SACK_PERM TSval=1086755927 TSecr=0 WS=128
87,36.18834,192.168.11.6,192.168.11.29,TCP,74,0.007024,,,"6000  >  36998 [SYN, ACK] Seq=0 Ack=1 Win=65160 Len=0 MSS=1460 SACK_PERM TSval=945690217 TSecr=1086755927 WS=128"
88,36.188451,192.168.11.29,192.168.11.6,TCP,66,0.000111,,,36998  >  6000 [ACK] Seq=1 Ack=1 Win=64256 Len=0 TSval=1086755934 TSecr=945690217
89,36.188634,192.168.11.29,192.168.11.6,TCP,93,0.000183,,,"36998  >  6000 [PSH, ACK] Seq=1 Ack=1 Win=64256 Len=27 TSval=1086755934 TSecr=945690217 [TCP segment of a reassembled PDU]"
90,36.188731,192.168.11.29,192.168.11.6,TCP,66,0.000097,,,"36998  >  6000 [FIN, ACK] Seq=28 Ack=1 Win=64256 Len=0 TSval=1086755934 TSecr=945690217"
91,36.204828,192.168.11.6,192.168.11.29,TCP,66,0.016097,,,6000  >  36998 [ACK] Seq=1 Ack=28 Win=65152 Len=0 TSval=945690233 TSecr=1086755934
92,36.205209,192.168.11.6,192.168.11.29,TCP,66,0.000381,,,"6000  >  36998 [FIN, ACK] Seq=1 Ack=29 Win=65152 Len=0 TSval=945690234 TSecr=1086755934"
93,36.205256,192.168.11.29,192.168.11.6,TCP,66,0.000047,,,36998  >  6000 [ACK] Seq=29 Ack=2 Win=64256 Len=0 TSval=1086755951 TSecr=945690234
94,36.235118,192.168.11.29,255.255.255.255,UDP,209,0.029862,Ÿ,7b2273656d616e74696373223a207b22656e74697479223a2022504944222c202262617365656e74697479223a2022616e79222c2022726f6c65223a2022333333222c20227370617469616c223a2022616e79222c202274656d706f72616c223a2022616e79227d2c20226461746170726f7065727479223a207b22666f726d6174223a2022696e616f6b615f70726f6772616d5f73616d706c655f73656d616e746963227d7d,43102  >  7000 Len=167
95,36.243338,192.168.11.31,192.168.11.29,TCP,74,0.00822,œ,,53184  >  6000 [SYN] Seq=0 Win=64240 Len=0 MSS=1460 SACK_PERM TSval=2641618012 TSecr=0 WS=128
96,36.2435,192.168.11.29,192.168.11.31,TCP,74,0.000162,,,"6000  >  53184 [SYN, ACK] Seq=0 Ack=1 Win=65160 Len=0 MSS=1460 SACK_PERM TSval=4003269533 TSecr=2641618012 WS=128"
97,36.250249,192.168.11.31,192.168.11.29,TCP,66,0.006749,,,53184  >  6000 [ACK] Seq=1 Ack=1 Win=64256 Len=0 TSval=2641618019 TSecr=4003269533
98,36.251029,192.168.11.31,192.168.11.29,TCP,93,0.00078,,,"53184  >  6000 [PSH, ACK] Seq=1 Ack=1 Win=64256 Len=27 TSval=2641618019 TSecr=4003269533 [TCP segment of a reassembled PDU]"
99,36.251139,192.168.11.29,192.168.11.31,TCP,66,0.00011,,,6000  >  53184 [ACK] Seq=1 Ack=28 Win=65152 Len=0 TSval=4003269541 TSecr=2641618019
100,36.251215,192.168.11.31,192.168.11.29,TCP,66,0.000076,,,"53184  >  6000 [FIN, ACK] Seq=28 Ack=1 Win=64256 Len=0 TSval=2641618019 TSecr=4003269533"
101,36.253078,192.168.11.29,192.168.11.31,TCP,66,0.001863,,,"6000  >  53184 [FIN, ACK] Seq=1 Ack=29 Win=65152 Len=0 TSval=4003269543 TSecr=2641618019"
102,36.257948,192.168.11.31,192.168.11.29,TCP,66,0.00487,,,53184  >  6000 [ACK] Seq=29 Ack=2 Win=64256 Len=0 TSval=2641618026 TSecr=4003269543
103,43.387964,192.168.11.29,192.168.11.6,TCP,74,7.130016,,,53222  >  6000 [SYN] Seq=0 Win=64240 Len=0 MSS=1460 SACK_PERM TSval=1086763134 TSecr=0 WS=128
104,43.395658,192.168.11.6,192.168.11.29,TCP,74,0.007694,,,"6000  >  53222 [SYN, ACK] Seq=0 Ack=1 Win=65160 Len=0 MSS=1460 SACK_PERM TSval=945697425 TSecr=1086763134 WS=128"
105,43.395774,192.168.11.29,192.168.11.6,TCP,66,0.000116,,,53222  >  6000 [ACK] Seq=1 Ack=1 Win=64256 Len=0 TSval=1086763142 TSecr=945697425
106,43.395982,192.168.11.29,192.168.11.6,TCP,93,0.000208,,,"53222  >  6000 [PSH, ACK] Seq=1 Ack=1 Win=64256 Len=27 TSval=1086763142 TSecr=945697425 [TCP segment of a reassembled PDU]"
107,43.396089,192.168.11.29,192.168.11.6,TCP,66,0.000107,,,"53222  >  6000 [FIN, ACK] Seq=28 Ack=1 Win=64256 Len=0 TSval=1086763142 TSecr=945697425"
108,43.403152,192.168.11.6,192.168.11.29,TCP,66,0.007063,,,6000  >  53222 [ACK] Seq=1 Ack=28 Win=65152 Len=0 TSval=945697433 TSecr=1086763142
109,43.403399,192.168.11.6,192.168.11.29,TCP,66,0.000247,,,"6000  >  53222 [FIN, ACK] Seq=1 Ack=29 Win=65152 Len=0 TSval=945697434 TSecr=1086763142"
110,43.403446,192.168.11.29,192.168.11.6,TCP,66,0.000047,,,53222  >  6000 [ACK] Seq=29 Ack=2 Win=64256 Len=0 TSval=1086763149 TSecr=945697434
111,43.439342,192.168.11.29,255.255.255.255,UDP,209,0.035896,Ÿ,7b2273656d616e74696373223a207b22656e74697479223a2022504944222c202262617365656e74697479223a2022616e79222c2022726f6c65223a2022333333222c20227370617469616c223a2022616e79222c202274656d706f72616c223a2022616e79227d2c20226461746170726f7065727479223a207b22666f726d6174223a2022696e616f6b615f70726f6772616d5f73616d706c655f73656d616e746963227d7d,47196  >  7000 Len=167
112,43.448562,192.168.11.31,192.168.11.29,TCP,74,0.00922,œ,,53186  >  6000 [SYN] Seq=0 Win=64240 Len=0 MSS=1460 SACK_PERM TSval=2641625218 TSecr=0 WS=128
113,43.448709,192.168.11.29,192.168.11.31,TCP,74,0.000147,,,"6000  >  53186 [SYN, ACK] Seq=0 Ack=1 Win=65160 Len=0 MSS=1460 SACK_PERM TSval=4003276738 TSecr=2641625218 WS=128"
114,43.45564,192.168.11.31,192.168.11.29,TCP,66,0.006931,,,53186  >  6000 [ACK] Seq=1 Ack=1 Win=64256 Len=0 TSval=2641625225 TSecr=4003276738
115,43.456064,192.168.11.31,192.168.11.29,TCP,93,0.000424,,,"53186  >  6000 [PSH, ACK] Seq=1 Ack=1 Win=64256 Len=27 TSval=2641625225 TSecr=4003276738 [TCP segment of a reassembled PDU]"
116,43.45616,192.168.11.29,192.168.11.31,TCP,66,0.000096,,,6000  >  53186 [ACK] Seq=1 Ack=28 Win=65152 Len=0 TSval=4003276746 TSecr=2641625225
117,43.456481,192.168.11.31,192.168.11.29,TCP,66,0.000321,,,"53186  >  6000 [FIN, ACK] Seq=28 Ack=1 Win=64256 Len=0 TSval=2641625225 TSecr=4003276738"
118,43.458628,192.168.11.29,192.168.11.31,TCP,66,0.002147,,,"6000  >  53186 [FIN, ACK] Seq=1 Ack=29 Win=65152 Len=0 TSval=4003276748 TSecr=2641625225"
119,43.46355,192.168.11.31,192.168.11.29,TCP,66,0.004922,,,53186  >  6000 [ACK] Seq=29 Ack=2 Win=64256 Len=0 TSval=2641625233 TSecr=4003276748
120,50.582666,192.168.11.29,192.168.11.6,TCP,74,7.119116,,,34584  >  6000 [SYN] Seq=0 Win=64240 Len=0 MSS=1460 SACK_PERM TSval=1086770328 TSecr=0 WS=128
121,50.589598,192.168.11.6,192.168.11.29,TCP,74,0.006932,,,"6000  >  34584 [SYN, ACK] Seq=0 Ack=1 Win=65160 Len=0 MSS=1460 SACK_PERM TSval=945704620 TSecr=1086770328 WS=128"
122,50.589703,192.168.11.29,192.168.11.6,TCP,66,0.000105,,,34584  >  6000 [ACK] Seq=1 Ack=1 Win=64256 Len=0 TSval=1086770335 TSecr=945704620
123,50.589874,192.168.11.29,192.168.11.6,TCP,93,0.000171,,,"34584  >  6000 [PSH, ACK] Seq=1 Ack=1 Win=64256 Len=27 TSval=1086770336 TSecr=945704620 [TCP segment of a reassembled PDU]"
124,50.590004,192.168.11.29,192.168.11.6,TCP,66,0.00013,,,"34584  >  6000 [FIN, ACK] Seq=28 Ack=1 Win=64256 Len=0 TSval=1086770336 TSecr=945704620"
125,50.597061,192.168.11.6,192.168.11.29,TCP,66,0.007057,,,6000  >  34584 [ACK] Seq=1 Ack=28 Win=65152 Len=0 TSval=945704628 TSecr=1086770336
126,50.597421,192.168.11.6,192.168.11.29,TCP,66,0.00036,,,"6000  >  34584 [FIN, ACK] Seq=1 Ack=29 Win=65152 Len=0 TSval=945704629 TSecr=1086770336"
127,50.59747,192.168.11.29,192.168.11.6,TCP,66,0.000049,,,34584  >  6000 [ACK] Seq=29 Ack=2 Win=64256 Len=0 TSval=1086770343 TSecr=945704629
128,50.62589,192.168.11.29,255.255.255.255,UDP,209,0.02842,Ÿ,7b2273656d616e74696373223a207b22656e74697479223a2022504944222c202262617365656e74697479223a2022616e79222c2022726f6c65223a2022333333222c20227370617469616c223a2022616e79222c202274656d706f72616c223a2022616e79227d2c20226461746170726f7065727479223a207b22666f726d6174223a2022696e616f6b615f70726f6772616d5f73616d706c655f73656d616e746963227d7d,48711  >  7000 Len=167
129,50.633498,192.168.11.31,192.168.11.29,TCP,74,0.007608,œ,,46386  >  6000 [SYN] Seq=0 Win=64240 Len=0 MSS=1460 SACK_PERM TSval=2641632404 TSecr=0 WS=128
130,50.633645,192.168.11.29,192.168.11.31,TCP,74,0.000147,,,"6000  >  46386 [SYN, ACK] Seq=0 Ack=1 Win=65160 Len=0 MSS=1460 SACK_PERM TSval=4003283923 TSecr=2641632404 WS=128"
131,50.640469,192.168.11.31,192.168.11.29,TCP,66,0.006824,,,46386  >  6000 [ACK] Seq=1 Ack=1 Win=64256 Len=0 TSval=2641632411 TSecr=4003283923
132,50.641148,192.168.11.31,192.168.11.29,TCP,93,0.000679,,,"46386  >  6000 [PSH, ACK] Seq=1 Ack=1 Win=64256 Len=27 TSval=2641632411 TSecr=4003283923 [TCP segment of a reassembled PDU]"
133,50.641266,192.168.11.29,192.168.11.31,TCP,66,0.000118,,,6000  >  46386 [ACK] Seq=1 Ack=28 Win=65152 Len=0 TSval=4003283931 TSecr=2641632411
134,50.641347,192.168.11.31,192.168.11.29,TCP,66,0.000081,,,"46386  >  6000 [FIN, ACK] Seq=28 Ack=1 Win=64256 Len=0 TSval=2641632412 TSecr=4003283923"
135,50.643598,192.168.11.29,192.168.11.31,TCP,66,0.002251,,,"6000  >  46386 [FIN, ACK] Seq=1 Ack=29 Win=65152 Len=0 TSval=4003283933 TSecr=2641632412"
136,50.650078,192.168.11.31,192.168.11.29,TCP,66,0.00648,,,46386  >  6000 [ACK] Seq=29 Ack=2 Win=64256 Len=0 TSval=2641632419 TSecr=4003283933
137,57.731388,192.168.11.29,192.168.11.6,TCP,74,7.08131,,,44652  >  6000 [SYN] Seq=0 Win=64240 Len=0 MSS=1460 SACK_PERM TSval=1086777477 TSecr=0 WS=128
138,57.738284,192.168.11.6,192.168.11.29,TCP,74,0.006896,,,"6000  >  44652 [SYN, ACK] Seq=0 Ack=1 Win=65160 Len=0 MSS=1460 SACK_PERM TSval=945711770 TSecr=1086777477 WS=128"
139,57.738391,192.168.11.29,192.168.11.6,TCP,66,0.000107,,,44652  >  6000 [ACK] Seq=1 Ack=1 Win=64256 Len=0 TSval=1086777484 TSecr=945711770
140,57.738561,192.168.11.29,192.168.11.6,TCP,93,0.00017,,,"44652  >  6000 [PSH, ACK] Seq=1 Ack=1 Win=64256 Len=27 TSval=1086777484 TSecr=945711770 [TCP segment of a reassembled PDU]"
141,57.738687,192.168.11.29,192.168.11.6,TCP,66,0.000126,,,"44652  >  6000 [FIN, ACK] Seq=28 Ack=1 Win=64256 Len=0 TSval=1086777484 TSecr=945711770"
142,57.746134,192.168.11.6,192.168.11.29,TCP,66,0.007447,,,6000  >  44652 [ACK] Seq=1 Ack=28 Win=65152 Len=0 TSval=945711778 TSecr=1086777484
143,57.746365,192.168.11.6,192.168.11.29,TCP,66,0.000231,,,"6000  >  44652 [FIN, ACK] Seq=1 Ack=29 Win=65152 Len=0 TSval=945711779 TSecr=1086777484"
144,57.746411,192.168.11.29,192.168.11.6,TCP,66,0.000046,,,44652  >  6000 [ACK] Seq=29 Ack=2 Win=64256 Len=0 TSval=1086777492 TSecr=945711779
145,57.775724,192.168.11.29,255.255.255.255,UDP,209,0.029313,Ÿ,7b2273656d616e74696373223a207b22656e74697479223a2022504944222c202262617365656e74697479223a2022616e79222c2022726f6c65223a2022333333222c20227370617469616c223a2022616e79222c202274656d706f72616c223a2022616e79227d2c20226461746170726f7065727479223a207b22666f726d6174223a2022696e616f6b615f70726f6772616d5f73616d706c655f73656d616e746963227d7d,43022  >  7000 Len=167
146,57.784445,192.168.11.31,192.168.11.29,TCP,74,0.008721,œ,,47814  >  6000 [SYN] Seq=0 Win=64240 Len=0 MSS=1460 SACK_PERM TSval=2641639556 TSecr=0 WS=128
147,57.784599,192.168.11.29,192.168.11.31,TCP,74,0.000154,,,"6000  >  47814 [SYN, ACK] Seq=0 Ack=1 Win=65160 Len=0 MSS=1460 SACK_PERM TSval=4003291074 TSecr=2641639556 WS=128"
148,57.791735,192.168.11.31,192.168.11.29,TCP,66,0.007136,,,47814  >  6000 [ACK] Seq=1 Ack=1 Win=64256 Len=0 TSval=2641639564 TSecr=4003291074
149,57.792381,192.168.11.31,192.168.11.29,TCP,93,0.000646,,,"47814  >  6000 [PSH, ACK] Seq=1 Ack=1 Win=64256 Len=27 TSval=2641639564 TSecr=4003291074 [TCP segment of a reassembled PDU]"
150,57.792479,192.168.11.29,192.168.11.31,TCP,66,0.000098,,,6000  >  47814 [ACK] Seq=1 Ack=28 Win=65152 Len=0 TSval=4003291082 TSecr=2641639564
151,57.792559,192.168.11.31,192.168.11.29,TCP,66,0.00008,,,"47814  >  6000 [FIN, ACK] Seq=28 Ack=1 Win=64256 Len=0 TSval=2641639564 TSecr=4003291074"
152,57.794571,192.168.11.29,192.168.11.31,TCP,66,0.002012,,,"6000  >  47814 [FIN, ACK] Seq=1 Ack=29 Win=65152 Len=0 TSval=4003291084 TSecr=2641639564"
153,57.80178,192.168.11.31,192.168.11.29,TCP,66,0.007209,,,47814  >  6000 [ACK] Seq=29 Ack=2 Win=64256 Len=0 TSval=2641639574 TSecr=4003291084
154,64.869992,192.168.11.29,192.168.11.6,TCP,74,7.068212,,,44658  >  6000 [SYN] Seq=0 Win=64240 Len=0 MSS=1460 SACK_PERM TSval=1086784616 TSecr=0 WS=128
155,64.877164,192.168.11.6,192.168.11.29,TCP,74,0.007172,,,"6000  >  44658 [SYN, ACK] Seq=0 Ack=1 Win=65160 Len=0 MSS=1460 SACK_PERM TSval=945718910 TSecr=1086784616 WS=128"
156,64.877282,192.168.11.29,192.168.11.6,TCP,66,0.000118,,,44658  >  6000 [ACK] Seq=1 Ack=1 Win=64256 Len=0 TSval=1086784623 TSecr=945718910
157,64.877486,192.168.11.29,192.168.11.6,TCP,93,0.000204,,,"44658  >  6000 [PSH, ACK] Seq=1 Ack=1 Win=64256 Len=27 TSval=1086784623 TSecr=945718910 [TCP segment of a reassembled PDU]"
158,64.877607,192.168.11.29,192.168.11.6,TCP,66,0.000121,,,"44658  >  6000 [FIN, ACK] Seq=28 Ack=1 Win=64256 Len=0 TSval=1086784623 TSecr=945718910"
159,64.888218,192.168.11.6,192.168.11.29,TCP,66,0.010611,,,6000  >  44658 [ACK] Seq=1 Ack=28 Win=65152 Len=0 TSval=945718921 TSecr=1086784623
160,64.888593,192.168.11.6,192.168.11.29,TCP,66,0.000375,,,"6000  >  44658 [FIN, ACK] Seq=1 Ack=29 Win=65152 Len=0 TSval=945718922 TSecr=1086784623"
161,64.88864,192.168.11.29,192.168.11.6,TCP,66,0.000047,,,44658  >  6000 [ACK] Seq=29 Ack=2 Win=64256 Len=0 TSval=1086784634 TSecr=945718922
162,64.917481,192.168.11.29,255.255.255.255,UDP,209,0.028841,Ÿ,7b2273656d616e74696373223a207b22656e74697479223a2022504944222c202262617365656e74697479223a2022616e79222c2022726f6c65223a2022333333222c20227370617469616c223a2022616e79222c202274656d706f72616c223a2022616e79227d2c20226461746170726f7065727479223a207b22666f726d6174223a2022696e616f6b615f70726f6772616d5f73616d706c655f73656d616e746963227d7d,34666  >  7000 Len=167
163,64.925211,192.168.11.31,192.168.11.29,TCP,74,0.00773,œ,,47822  >  6000 [SYN] Seq=0 Win=64240 Len=0 MSS=1460 SACK_PERM TSval=2641646699 TSecr=0 WS=128
164,64.925346,192.168.11.29,192.168.11.31,TCP,74,0.000135,,,"6000  >  47822 [SYN, ACK] Seq=0 Ack=1 Win=65160 Len=0 MSS=1460 SACK_PERM TSval=4003298215 TSecr=2641646699 WS=128"
165,64.932049,192.168.11.31,192.168.11.29,TCP,66,0.006703,,,47822  >  6000 [ACK] Seq=1 Ack=1 Win=64256 Len=0 TSval=2641646705 TSecr=4003298215
166,64.932701,192.168.11.31,192.168.11.29,TCP,93,0.000652,,,"47822  >  6000 [PSH, ACK] Seq=1 Ack=1 Win=64256 Len=27 TSval=2641646706 TSecr=4003298215 [TCP segment of a reassembled PDU]"
167,64.932801,192.168.11.29,192.168.11.31,TCP,66,0.0001,,,6000  >  47822 [ACK] Seq=1 Ack=28 Win=65152 Len=0 TSval=4003298222 TSecr=2641646706
168,64.932879,192.168.11.31,192.168.11.29,TCP,66,0.000078,,,"47822  >  6000 [FIN, ACK] Seq=28 Ack=1 Win=64256 Len=0 TSval=2641646706 TSecr=4003298215"
169,64.935055,192.168.11.29,192.168.11.31,TCP,66,0.002176,,,"6000  >  47822 [FIN, ACK] Seq=1 Ack=29 Win=65152 Len=0 TSval=4003298225 TSecr=2641646706"
170,64.94143,192.168.11.31,192.168.11.29,TCP,66,0.006375,,,47822  >  6000 [ACK] Seq=29 Ack=2 Win=64256 Len=0 TSval=2641646715 TSecr=4003298225
171,110.537807,192.168.11.29,192.168.11.6,TCP,74,45.596377,,,58046  >  6000 [SYN] Seq=0 Win=64240 Len=0 MSS=1460 SACK_PERM TSval=1086830284 TSecr=0 WS=128
172,110.54644,192.168.11.6,192.168.11.29,TCP,74,0.008633,,,"6000  >  58046 [SYN, ACK] Seq=0 Ack=1 Win=65160 Len=0 MSS=1460 SACK_PERM TSval=945764585 TSecr=1086830284 WS=128"
173,110.546558,192.168.11.29,192.168.11.6,TCP,66,0.000118,,,58046  >  6000 [ACK] Seq=1 Ack=1 Win=64256 Len=0 TSval=1086830292 TSecr=945764585
174,110.546773,192.168.11.29,192.168.11.6,TCP,93,0.000215,,,"58046  >  6000 [PSH, ACK] Seq=1 Ack=1 Win=64256 Len=27 TSval=1086830292 TSecr=945764585 [TCP segment of a reassembled PDU]"
175,110.546921,192.168.11.29,192.168.11.6,TCP,66,0.000148,,,"58046  >  6000 [FIN, ACK] Seq=28 Ack=1 Win=64256 Len=0 TSval=1086830293 TSecr=945764585"
176,110.556085,192.168.11.6,192.168.11.29,TCP,66,0.009164,,,6000  >  58046 [ACK] Seq=1 Ack=28 Win=65152 Len=0 TSval=945764596 TSecr=1086830292
177,110.556332,192.168.11.6,192.168.11.29,TCP,66,0.000247,,,"6000  >  58046 [FIN, ACK] Seq=1 Ack=29 Win=65152 Len=0 TSval=945764598 TSecr=1086830293"
178,110.556378,192.168.11.29,192.168.11.6,TCP,66,0.000046,,,58046  >  6000 [ACK] Seq=29 Ack=2 Win=64256 Len=0 TSval=1086830302 TSecr=945764598
179,110.587123,192.168.11.29,255.255.255.255,UDP,209,0.030745,Ÿ,7b2273656d616e74696373223a207b22656e74697479223a2022504944222c202262617365656e74697479223a2022616e79222c2022726f6c65223a2022333333222c20227370617469616c223a2022616e79222c202274656d706f72616c223a2022616e79227d2c20226461746170726f7065727479223a207b22666f726d6174223a2022696e616f6b615f70726f6772616d5f73616d706c655f73656d616e746963227d7d,39939  >  7000 Len=167
180,110.59507,192.168.11.31,192.168.11.29,TCP,74,0.007947,œ,,36982  >  6000 [SYN] Seq=0 Win=64240 Len=0 MSS=1460 SACK_PERM TSval=2641692376 TSecr=0 WS=128
181,110.595224,192.168.11.29,192.168.11.31,TCP,74,0.000154,,,"6000  >  36982 [SYN, ACK] Seq=0 Ack=1 Win=65160 Len=0 MSS=1460 SACK_PERM TSval=4003343885 TSecr=2641692376 WS=128"
182,110.601928,192.168.11.31,192.168.11.29,TCP,66,0.006704,,,36982  >  6000 [ACK] Seq=1 Ack=1 Win=64256 Len=0 TSval=2641692383 TSecr=4003343885
183,110.60254,192.168.11.31,192.168.11.29,TCP,93,0.000612,,,"36982  >  6000 [PSH, ACK] Seq=1 Ack=1 Win=64256 Len=27 TSval=2641692383 TSecr=4003343885 [TCP segment of a reassembled PDU]"
184,110.60262,192.168.11.29,192.168.11.31,TCP,66,0.00008,,,6000  >  36982 [ACK] Seq=1 Ack=28 Win=65152 Len=0 TSval=4003343892 TSecr=2641692383
185,110.602693,192.168.11.31,192.168.11.29,TCP,66,0.000073,,,"36982  >  6000 [FIN, ACK] Seq=28 Ack=1 Win=64256 Len=0 TSval=2641692383 TSecr=4003343885"
186,110.604481,192.168.11.29,192.168.11.31,TCP,66,0.001788,,,"6000  >  36982 [FIN, ACK] Seq=1 Ack=29 Win=65152 Len=0 TSval=4003343894 TSecr=2641692383"
187,110.610359,192.168.11.31,192.168.11.29,TCP,66,0.005878,,,36982  >  6000 [ACK] Seq=29 Ack=2 Win=64256 Len=0 TSval=2641692391 TSecr=4003343894
188,117.700802,192.168.11.29,192.168.11.6,TCP,74,7.090443,,,51600  >  6000 [SYN] Seq=0 Win=64240 Len=0 MSS=1460 SACK_PERM TSval=1086837447 TSecr=0 WS=128
189,117.707474,192.168.11.6,192.168.11.29,TCP,74,0.006672,,,"6000  >  51600 [SYN, ACK] Seq=0 Ack=1 Win=65160 Len=0 MSS=1460 SACK_PERM TSval=945771749 TSecr=1086837447 WS=128"
190,117.707595,192.168.11.29,192.168.11.6,TCP,66,0.000121,,,51600  >  6000 [ACK] Seq=1 Ack=1 Win=64256 Len=0 TSval=1086837453 TSecr=945771749
191,117.707748,192.168.11.29,192.168.11.6,TCP,93,0.000153,,,"51600  >  6000 [PSH, ACK] Seq=1 Ack=1 Win=64256 Len=27 TSval=1086837453 TSecr=945771749 [TCP segment of a reassembled PDU]"
192,117.70785,192.168.11.29,192.168.11.6,TCP,66,0.000102,,,"51600  >  6000 [FIN, ACK] Seq=28 Ack=1 Win=64256 Len=0 TSval=1086837454 TSecr=945771749"
193,117.718533,192.168.11.6,192.168.11.29,TCP,66,0.010683,,,6000  >  51600 [ACK] Seq=1 Ack=28 Win=65152 Len=0 TSval=945771760 TSecr=1086837453
194,117.718821,192.168.11.6,192.168.11.29,TCP,66,0.000288,,,"6000  >  51600 [FIN, ACK] Seq=1 Ack=29 Win=65152 Len=0 TSval=945771762 TSecr=1086837454"
195,117.718869,192.168.11.29,192.168.11.6,TCP,66,0.000048,,,51600  >  6000 [ACK] Seq=29 Ack=2 Win=64256 Len=0 TSval=1086837465 TSecr=945771762
196,117.75225,192.168.11.29,255.255.255.255,UDP,209,0.033381,Ÿ,7b2273656d616e74696373223a207b22656e74697479223a2022504944222c202262617365656e74697479223a2022616e79222c2022726f6c65223a2022333333222c20227370617469616c223a2022616e79222c202274656d706f72616c223a2022616e79227d2c20226461746170726f7065727479223a207b22666f726d6174223a2022696e616f6b615f70726f6772616d5f73616d706c655f73656d616e746963227d7d,43691  >  7000 Len=167
197,117.760615,192.168.11.31,192.168.11.29,TCP,74,0.008365,œ,,42758  >  6000 [SYN] Seq=0 Win=64240 Len=0 MSS=1460 SACK_PERM TSval=2641699542 TSecr=0 WS=128
198,117.76077,192.168.11.29,192.168.11.31,TCP,74,0.000155,,,"6000  >  42758 [SYN, ACK] Seq=0 Ack=1 Win=65160 Len=0 MSS=1460 SACK_PERM TSval=4003351051 TSecr=2641699542 WS=128"
199,117.767344,192.168.11.31,192.168.11.29,TCP,66,0.006574,,,42758  >  6000 [ACK] Seq=1 Ack=1 Win=64256 Len=0 TSval=2641699549 TSecr=4003351051
200,117.767973,192.168.11.31,192.168.11.29,TCP,93,0.000629,,,"42758  >  6000 [PSH, ACK] Seq=1 Ack=1 Win=64256 Len=27 TSval=2641699550 TSecr=4003351051 [TCP segment of a reassembled PDU]"
201,117.768107,192.168.11.29,192.168.11.31,TCP,66,0.000134,,,6000  >  42758 [ACK] Seq=1 Ack=28 Win=65152 Len=0 TSval=4003351058 TSecr=2641699550
202,117.768191,192.168.11.31,192.168.11.29,TCP,66,0.000084,,,"42758  >  6000 [FIN, ACK] Seq=28 Ack=1 Win=64256 Len=0 TSval=2641699550 TSecr=4003351051"
203,117.769475,192.168.11.29,192.168.11.31,TCP,66,0.001284,,,"6000  >  42758 [FIN, ACK] Seq=1 Ack=29 Win=65152 Len=0 TSval=4003351059 TSecr=2641699550"
204,117.77497,192.168.11.31,192.168.11.29,TCP,66,0.005495,,,42758  >  6000 [ACK] Seq=29 Ack=2 Win=64256 Len=0 TSval=2641699557 TSecr=4003351059
205,124.941704,192.168.11.29,192.168.11.6,TCP,74,7.166734,,,51614  >  6000 [SYN] Seq=0 Win=64240 Len=0 MSS=1460 SACK_PERM TSval=1086844687 TSecr=0 WS=128
206,124.948398,192.168.11.6,192.168.11.29,TCP,74,0.006694,,,"6000  >  51614 [SYN, ACK] Seq=0 Ack=1 Win=65160 Len=0 MSS=1460 SACK_PERM TSval=945778991 TSecr=1086844687 WS=128"
207,124.948509,192.168.11.29,192.168.11.6,TCP,66,0.000111,,,51614  >  6000 [ACK] Seq=1 Ack=1 Win=64256 Len=0 TSval=1086844694 TSecr=945778991
208,124.948638,192.168.11.29,192.168.11.6,TCP,93,0.000129,,,"51614  >  6000 [PSH, ACK] Seq=1 Ack=1 Win=64256 Len=27 TSval=1086844694 TSecr=945778991 [TCP segment of a reassembled PDU]"
209,124.948757,192.168.11.29,192.168.11.6,TCP,66,0.000119,,,"51614  >  6000 [FIN, ACK] Seq=28 Ack=1 Win=64256 Len=0 TSval=1086844695 TSecr=945778991"
210,124.960916,192.168.11.6,192.168.11.29,TCP,66,0.012159,,,6000  >  51614 [ACK] Seq=1 Ack=28 Win=65152 Len=0 TSval=945779003 TSecr=1086844694
211,124.961159,192.168.11.6,192.168.11.29,TCP,66,0.000243,,,"6000  >  51614 [FIN, ACK] Seq=1 Ack=29 Win=65152 Len=0 TSval=945779005 TSecr=1086844695"
212,124.961221,192.168.11.29,192.168.11.6,TCP,66,0.000062,,,51614  >  6000 [ACK] Seq=29 Ack=2 Win=64256 Len=0 TSval=1086844707 TSecr=945779005
213,124.991056,192.168.11.29,255.255.255.255,UDP,209,0.029835,Ÿ,7b2273656d616e74696373223a207b22656e74697479223a2022504944222c202262617365656e74697479223a2022616e79222c2022726f6c65223a2022333333222c20227370617469616c223a2022616e79222c202274656d706f72616c223a2022616e79227d2c20226461746170726f7065727479223a207b22666f726d6174223a2022696e616f6b615f70726f6772616d5f73616d706c655f73656d616e746963227d7d,39866  >  7000 Len=167
214,124.999173,192.168.11.31,192.168.11.29,TCP,74,0.008117,œ,,42766  >  6000 [SYN] Seq=0 Win=64240 Len=0 MSS=1460 SACK_PERM TSval=2641706782 TSecr=0 WS=128
215,124.999313,192.168.11.29,192.168.11.31,TCP,74,0.00014,,,"6000  >  42766 [SYN, ACK] Seq=0 Ack=1 Win=65160 Len=0 MSS=1460 SACK_PERM TSval=4003358289 TSecr=2641706782 WS=128"
216,125.005923,192.168.11.31,192.168.11.29,TCP,66,0.00661,,,42766  >  6000 [ACK] Seq=1 Ack=1 Win=64256 Len=0 TSval=2641706789 TSecr=4003358289
217,125.006516,192.168.11.31,192.168.11.29,TCP,93,0.000593,,,"42766  >  6000 [PSH, ACK] Seq=1 Ack=1 Win=64256 Len=27 TSval=2641706789 TSecr=4003358289 [TCP segment of a reassembled PDU]"
218,125.006602,192.168.11.29,192.168.11.31,TCP,66,0.000086,,,6000  >  42766 [ACK] Seq=1 Ack=28 Win=65152 Len=0 TSval=4003358296 TSecr=2641706789
219,125.006664,192.168.11.31,192.168.11.29,TCP,66,0.000062,,,"42766  >  6000 [FIN, ACK] Seq=28 Ack=1 Win=64256 Len=0 TSval=2641706789 TSecr=4003358289"
220,125.008039,192.168.11.29,192.168.11.31,TCP,66,0.001375,,,"6000  >  42766 [FIN, ACK] Seq=1 Ack=29 Win=65152 Len=0 TSval=4003358298 TSecr=2641706789"
221,125.012921,192.168.11.31,192.168.11.29,TCP,66,0.004882,,,42766  >  6000 [ACK] Seq=29 Ack=2 Win=64256 Len=0 TSval=2641706797 TSecr=4003358298
222,132.117332,192.168.11.29,192.168.11.6,TCP,74,7.104411,,,59550  >  6000 [SYN] Seq=0 Win=64240 Len=0 MSS=1460 SACK_PERM TSval=1086851863 TSecr=0 WS=128
223,132.124503,192.168.11.6,192.168.11.29,TCP,74,0.007171,,,"6000  >  59550 [SYN, ACK] Seq=0 Ack=1 Win=65160 Len=0 MSS=1460 SACK_PERM TSval=945786168 TSecr=1086851863 WS=128"
224,132.124608,192.168.11.29,192.168.11.6,TCP,66,0.000105,,,59550  >  6000 [ACK] Seq=1 Ack=1 Win=64256 Len=0 TSval=1086851870 TSecr=945786168
225,132.124776,192.168.11.29,192.168.11.6,TCP,93,0.000168,,,"59550  >  6000 [PSH, ACK] Seq=1 Ack=1 Win=64256 Len=27 TSval=1086851871 TSecr=945786168 [TCP segment of a reassembled PDU]"
226,132.124872,192.168.11.29,192.168.11.6,TCP,66,0.000096,,,"59550  >  6000 [FIN, ACK] Seq=28 Ack=1 Win=64256 Len=0 TSval=1086851871 TSecr=945786168"
227,132.131971,192.168.11.6,192.168.11.29,TCP,66,0.007099,,,6000  >  59550 [ACK] Seq=1 Ack=28 Win=65152 Len=0 TSval=945786175 TSecr=1086851871
228,132.132181,192.168.11.6,192.168.11.29,TCP,66,0.00021,,,"6000  >  59550 [FIN, ACK] Seq=1 Ack=29 Win=65152 Len=0 TSval=945786177 TSecr=1086851871"
229,132.132227,192.168.11.29,192.168.11.6,TCP,66,0.000046,,,59550  >  6000 [ACK] Seq=29 Ack=2 Win=64256 Len=0 TSval=1086851878 TSecr=945786177
230,132.163274,192.168.11.29,255.255.255.255,UDP,209,0.031047,Ÿ,7b2273656d616e74696373223a207b22656e74697479223a2022504944222c202262617365656e74697479223a2022616e79222c2022726f6c65223a2022333333222c20227370617469616c223a2022616e79222c202274656d706f72616c223a2022616e79227d2c20226461746170726f7065727479223a207b22666f726d6174223a2022696e616f6b615f70726f6772616d5f73616d706c655f73656d616e746963227d7d,37795  >  7000 Len=167
231,132.171825,192.168.11.31,192.168.11.29,TCP,74,0.008551,œ,,49992  >  6000 [SYN] Seq=0 Win=64240 Len=0 MSS=1460 SACK_PERM TSval=2641713956 TSecr=0 WS=128
232,132.171971,192.168.11.29,192.168.11.31,TCP,74,0.000146,,,"6000  >  49992 [SYN, ACK] Seq=0 Ack=1 Win=65160 Len=0 MSS=1460 SACK_PERM TSval=4003365462 TSecr=2641713956 WS=128"
