No.,Time,Source,Destination,Protocol,Length,Time delta from previous captured frame,XXX,Data,Info
1,0,192.168.11.15,192.168.11.31,TCP,74,0,,,36450  >  6000 [SYN] Seq=0 Win=64240 Len=0 MSS=1460 SACK_PERM TSval=3103944031 TSecr=0 WS=128
2,0.006825,192.168.11.31,192.168.11.15,TCP,74,0.006825,,,"6000  >  36450 [SYN, ACK] Seq=0 Ack=1 Win=65160 Len=0 MSS=1460 SACK_PERM TSval=978109037 TSecr=3103944031 WS=128"
3,0.006939,192.168.11.15,192.168.11.31,TCP,66,0.000114,,,36450  >  6000 [ACK] Seq=1 Ack=1 Win=64256 Len=0 TSval=3103944042 TSecr=978109037
4,0.007144,192.168.11.15,192.168.11.31,TCP,93,0.000205,,,"36450  >  6000 [PSH, ACK] Seq=1 Ack=1 Win=64256 Len=27 TSval=3103944042 TSecr=978109037 [TCP segment of a reassembled PDU]"
5,0.007283,192.168.11.15,192.168.11.31,TCP,66,0.000139,,,"36450  >  6000 [FIN, ACK] Seq=28 Ack=1 Win=64256 Len=0 TSval=3103944042 TSecr=978109037"
6,0.014176,192.168.11.31,192.168.11.15,TCP,66,0.006893,,,6000  >  36450 [ACK] Seq=1 Ack=28 Win=65152 Len=0 TSval=978109045 TSecr=3103944042
7,0.014551,192.168.11.31,192.168.11.15,TCP,66,0.000375,,,"6000  >  36450 [FIN, ACK] Seq=1 Ack=29 Win=65152 Len=0 TSval=978109046 TSecr=3103944042"
8,0.014596,192.168.11.15,192.168.11.31,TCP,66,0.000045,,,36450  >  6000 [ACK] Seq=29 Ack=2 Win=64256 Len=0 TSval=3103944049 TSecr=978109046
9,0.046705,192.168.11.15,255.255.255.255,UDP,209,0.032109,Ÿ,7b2273656d616e74696373223a207b22656e74697479223a2022504944222c202262617365656e74697479223a2022616e79222c2022726f6c65223a2022353535222c20227370617469616c223a2022616e79222c202274656d706f72616c223a2022616e79227d2c20226461746170726f7065727479223a207b22666f726d6174223a2022696e616f6b615f70726f6772616d5f73616d706c655f73656d616e746963227d7d,54069  >  7000 Len=167
10,0.059893,192.168.11.37,192.168.11.15,TCP,74,0.013188,œ,,54882  >  6000 [SYN] Seq=0 Win=64240 Len=0 MSS=1460 SACK_PERM TSval=3655982055 TSecr=0 WS=128
11,0.060058,192.168.11.15,192.168.11.37,TCP,74,0.000165,,,"6000  >  54882 [SYN, ACK] Seq=0 Ack=1 Win=65160 Len=0 MSS=1460 SACK_PERM TSval=3138270560 TSecr=3655982055 WS=128"
12,0.066571,192.168.11.37,192.168.11.15,TCP,66,0.006513,,,54882  >  6000 [ACK] Seq=1 Ack=1 Win=64256 Len=0 TSval=3655982068 TSecr=3138270560
13,0.067003,192.168.11.37,192.168.11.15,TCP,93,0.000432,,,"54882  >  6000 [PSH, ACK] Seq=1 Ack=1 Win=64256 Len=27 TSval=3655982068 TSecr=3138270560 [TCP segment of a reassembled PDU]"
14,0.067076,192.168.11.15,192.168.11.37,TCP,66,0.000073,,,6000  >  54882 [ACK] Seq=1 Ack=28 Win=65152 Len=0 TSval=3138270567 TSecr=3655982068
15,0.06713,192.168.11.37,192.168.11.15,TCP,66,0.000054,,,"54882  >  6000 [FIN, ACK] Seq=28 Ack=1 Win=64256 Len=0 TSval=3655982068 TSecr=3138270560"
16,0.068736,192.168.11.15,192.168.11.37,TCP,66,0.001606,,,"6000  >  54882 [FIN, ACK] Seq=1 Ack=29 Win=65152 Len=0 TSval=3138270568 TSecr=3655982068"
17,0.073457,192.168.11.37,192.168.11.15,TCP,66,0.004721,,,54882  >  6000 [ACK] Seq=29 Ack=2 Win=64256 Len=0 TSval=3655982075 TSecr=3138270568
18,7.270517,192.168.11.15,192.168.11.31,TCP,74,7.19706,,,40644  >  6000 [SYN] Seq=0 Win=64240 Len=0 MSS=1460 SACK_PERM TSval=3103951305 TSecr=0 WS=128
19,7.278395,192.168.11.31,192.168.11.15,TCP,74,0.007878,,,"6000  >  40644 [SYN, ACK] Seq=0 Ack=1 Win=65160 Len=0 MSS=1460 SACK_PERM TSval=978116309 TSecr=3103951305 WS=128"
20,7.278501,192.168.11.15,192.168.11.31,TCP,66,0.000106,,,40644  >  6000 [ACK] Seq=1 Ack=1 Win=64256 Len=0 TSval=3103951313 TSecr=978116309
21,7.27867,192.168.11.15,192.168.11.31,TCP,93,0.000169,,,"40644  >  6000 [PSH, ACK] Seq=1 Ack=1 Win=64256 Len=27 TSval=3103951313 TSecr=978116309 [TCP segment of a reassembled PDU]"
22,7.278799,192.168.11.15,192.168.11.31,TCP,66,0.000129,,,"40644  >  6000 [FIN, ACK] Seq=28 Ack=1 Win=64256 Len=0 TSval=3103951314 TSecr=978116309"
23,7.287458,192.168.11.31,192.168.11.15,TCP,66,0.008659,,,6000  >  40644 [ACK] Seq=1 Ack=28 Win=65152 Len=0 TSval=978116316 TSecr=3103951313
24,7.287846,192.168.11.31,192.168.11.15,TCP,66,0.000388,,,"6000  >  40644 [FIN, ACK] Seq=1 Ack=29 Win=65152 Len=0 TSval=978116318 TSecr=3103951314"
25,7.287891,192.168.11.15,192.168.11.31,TCP,66,0.000045,,,40644  >  6000 [ACK] Seq=29 Ack=2 Win=64256 Len=0 TSval=3103951323 TSecr=978116318
26,7.316485,192.168.11.15,255.255.255.255,UDP,209,0.028594,Ÿ,7b2273656d616e74696373223a207b22656e74697479223a2022504944222c202262617365656e74697479223a2022616e79222c2022726f6c65223a2022353535222c20227370617469616c223a2022616e79222c202274656d706f72616c223a2022616e79227d2c20226461746170726f7065727479223a207b22666f726d6174223a2022696e616f6b615f70726f6772616d5f73616d706c655f73656d616e746963227d7d,36906  >  7000 Len=167
27,7.324828,192.168.11.37,192.168.11.15,TCP,74,0.008343,œ,,34972  >  6000 [SYN] Seq=0 Win=64240 Len=0 MSS=1460 SACK_PERM TSval=3655989325 TSecr=0 WS=128
28,7.324986,192.168.11.15,192.168.11.37,TCP,74,0.000158,,,"6000  >  34972 [SYN, ACK] Seq=0 Ack=1 Win=65160 Len=0 MSS=1460 SACK_PERM TSval=3138277825 TSecr=3655989325 WS=128"
29,7.335074,192.168.11.37,192.168.11.15,TCP,66,0.010088,,,34972  >  6000 [ACK] Seq=1 Ack=1 Win=64256 Len=0 TSval=3655989335 TSecr=3138277825
30,7.335637,192.168.11.37,192.168.11.15,TCP,93,0.000563,,,"34972  >  6000 [PSH, ACK] Seq=1 Ack=1 Win=64256 Len=27 TSval=3655989336 TSecr=3138277825 [TCP segment of a reassembled PDU]"
31,7.335727,192.168.11.15,192.168.11.37,TCP,66,0.00009,,,6000  >  34972 [ACK] Seq=1 Ack=28 Win=65152 Len=0 TSval=3138277835 TSecr=3655989336
32,7.335791,192.168.11.37,192.168.11.15,TCP,66,0.000064,,,"34972  >  6000 [FIN, ACK] Seq=28 Ack=1 Win=64256 Len=0 TSval=3655989336 TSecr=3138277825"
33,7.337095,192.168.11.15,192.168.11.37,TCP,66,0.001304,,,"6000  >  34972 [FIN, ACK] Seq=1 Ack=29 Win=65152 Len=0 TSval=3138277837 TSecr=3655989336"
34,7.342505,192.168.11.37,192.168.11.15,TCP,66,0.00541,,,34972  >  6000 [ACK] Seq=29 Ack=2 Win=64256 Len=0 TSval=3655989343 TSecr=3138277837
35,14.602896,192.168.11.15,192.168.11.31,TCP,74,7.260391,,,40654  >  6000 [SYN] Seq=0 Win=64240 Len=0 MSS=1460 SACK_PERM TSval=3103958638 TSecr=0 WS=128
36,14.609557,192.168.11.31,192.168.11.15,TCP,74,0.006661,,,"6000  >  40654 [SYN, ACK] Seq=0 Ack=1 Win=65160 Len=0 MSS=1460 SACK_PERM TSval=978123640 TSecr=3103958638 WS=128"
37,14.60966,192.168.11.15,192.168.11.31,TCP,66,0.000103,,,40654  >  6000 [ACK] Seq=1 Ack=1 Win=64256 Len=0 TSval=3103958644 TSecr=978123640
38,14.609859,192.168.11.15,192.168.11.31,TCP,93,0.000199,,,"40654  >  6000 [PSH, ACK] Seq=1 Ack=1 Win=64256 Len=27 TSval=3103958645 TSecr=978123640 [TCP segment of a reassembled PDU]"
39,14.609956,192.168.11.15,192.168.11.31,TCP,66,0.000097,,,"40654  >  6000 [FIN, ACK] Seq=28 Ack=1 Win=64256 Len=0 TSval=3103958645 TSecr=978123640"
40,14.617321,192.168.11.31,192.168.11.15,TCP,66,0.007365,,,6000  >  40654 [ACK] Seq=1 Ack=28 Win=65152 Len=0 TSval=978123648 TSecr=3103958645
41,14.617683,192.168.11.31,192.168.11.15,TCP,66,0.000362,,,"6000  >  40654 [FIN, ACK] Seq=1 Ack=29 Win=65152 Len=0 TSval=978123649 TSecr=3103958645"
42,14.617753,192.168.11.15,192.168.11.31,TCP,66,0.00007,,,40654  >  6000 [ACK] Seq=29 Ack=2 Win=64256 Len=0 TSval=3103958652 TSecr=978123649
43,14.647745,192.168.11.15,255.255.255.255,UDP,209,0.029992,Ÿ,7b2273656d616e74696373223a207b22656e74697479223a2022504944222c202262617365656e74697479223a2022616e79222c2022726f6c65223a2022353535222c20227370617469616c223a2022616e79222c202274656d706f72616c223a2022616e79227d2c20226461746170726f7065727479223a207b22666f726d6174223a2022696e616f6b615f70726f6772616d5f73616d706c655f73656d616e746963227d7d,51004  >  7000 Len=167
44,14.655292,192.168.11.37,192.168.11.15,TCP,74,0.007547,œ,,34976  >  6000 [SYN] Seq=0 Win=64240 Len=0 MSS=1460 SACK_PERM TSval=3655996656 TSecr=0 WS=128
45,14.655448,192.168.11.15,192.168.11.37,TCP,74,0.000156,,,"6000  >  34976 [SYN, ACK] Seq=0 Ack=1 Win=65160 Len=0 MSS=1460 SACK_PERM TSval=3138285155 TSecr=3655996656 WS=128"
46,14.663111,192.168.11.37,192.168.11.15,TCP,66,0.007663,,,34976  >  6000 [ACK] Seq=1 Ack=1 Win=64256 Len=0 TSval=3655996663 TSecr=3138285155
47,14.663764,192.168.11.37,192.168.11.15,TCP,93,0.000653,,,"34976  >  6000 [PSH, ACK] Seq=1 Ack=1 Win=64256 Len=27 TSval=3655996664 TSecr=3138285155 [TCP segment of a reassembled PDU]"
48,14.663897,192.168.11.15,192.168.11.37,TCP,66,0.000133,,,6000  >  34976 [ACK] Seq=1 Ack=28 Win=65152 Len=0 TSval=3138285164 TSecr=3655996664
49,14.663985,192.168.11.37,192.168.11.15,TCP,66,0.000088,,,"34976  >  6000 [FIN, ACK] Seq=28 Ack=1 Win=64256 Len=0 TSval=3655996664 TSecr=3138285155"
50,14.665311,192.168.11.15,192.168.11.37,TCP,66,0.001326,,,"6000  >  34976 [FIN, ACK] Seq=1 Ack=29 Win=65152 Len=0 TSval=3138285165 TSecr=3655996664"
51,14.671645,192.168.11.37,192.168.11.15,TCP,66,0.006334,,,34976  >  6000 [ACK] Seq=29 Ack=2 Win=64256 Len=0 TSval=3655996671 TSecr=3138285165
52,21.802515,192.168.11.15,192.168.11.31,TCP,74,7.13087,,,37266  >  6000 [SYN] Seq=0 Win=64240 Len=0 MSS=1460 SACK_PERM TSval=3103965837 TSecr=0 WS=128
53,21.809152,192.168.11.31,192.168.11.15,TCP,74,0.006637,,,"6000  >  37266 [SYN, ACK] Seq=0 Ack=1 Win=65160 Len=0 MSS=1460 SACK_PERM TSval=978130840 TSecr=3103965837 WS=128"
54,21.809263,192.168.11.15,192.168.11.31,TCP,66,0.000111,,,37266  >  6000 [ACK] Seq=1 Ack=1 Win=64256 Len=0 TSval=3103965844 TSecr=978130840
55,21.809425,192.168.11.15,192.168.11.31,TCP,93,0.000162,,,"37266  >  6000 [PSH, ACK] Seq=1 Ack=1 Win=64256 Len=27 TSval=3103965844 TSecr=978130840 [TCP segment of a reassembled PDU]"
56,21.809525,192.168.11.15,192.168.11.31,TCP,66,0.0001,,,"37266  >  6000 [FIN, ACK] Seq=28 Ack=1 Win=64256 Len=0 TSval=3103965844 TSecr=978130840"
57,21.815812,192.168.11.31,192.168.11.15,TCP,66,0.006287,,,6000  >  37266 [ACK] Seq=1 Ack=28 Win=65152 Len=0 TSval=978130846 TSecr=3103965844
58,21.816186,192.168.11.31,192.168.11.15,TCP,66,0.000374,,,"6000  >  37266 [FIN, ACK] Seq=1 Ack=29 Win=65152 Len=0 TSval=978130848 TSecr=3103965844"
59,21.816232,192.168.11.15,192.168.11.31,TCP,66,0.000046,,,37266  >  6000 [ACK] Seq=29 Ack=2 Win=64256 Len=0 TSval=3103965851 TSecr=978130848
60,21.846873,192.168.11.15,255.255.255.255,UDP,209,0.030641,Ÿ,7b2273656d616e74696373223a207b22656e74697479223a2022504944222c202262617365656e74697479223a2022616e79222c2022726f6c65223a2022353535222c20227370617469616c223a2022616e79222c202274656d706f72616c223a2022616e79227d2c20226461746170726f7065727479223a207b22666f726d6174223a2022696e616f6b615f70726f6772616d5f73616d706c655f73656d616e746963227d7d,40101  >  7000 Len=167
61,21.854473,192.168.11.37,192.168.11.15,TCP,74,0.0076,œ,,53002  >  6000 [SYN] Seq=0 Win=64240 Len=0 MSS=1460 SACK_PERM TSval=3656003854 TSecr=0 WS=128
62,21.854653,192.168.11.15,192.168.11.37,TCP,74,0.00018,,,"6000  >  53002 [SYN, ACK] Seq=0 Ack=1 Win=65160 Len=0 MSS=1460 SACK_PERM TSval=3138292354 TSecr=3656003854 WS=128"
63,21.861494,192.168.11.37,192.168.11.15,TCP,66,0.006841,,,53002  >  6000 [ACK] Seq=1 Ack=1 Win=64256 Len=0 TSval=3656003861 TSecr=3138292354
64,21.862242,192.168.11.37,192.168.11.15,TCP,93,0.000748,,,"53002  >  6000 [PSH, ACK] Seq=1 Ack=1 Win=64256 Len=27 TSval=3656003862 TSecr=3138292354 [TCP segment of a reassembled PDU]"
65,21.86238,192.168.11.15,192.168.11.37,TCP,66,0.000138,,,6000  >  53002 [ACK] Seq=1 Ack=28 Win=65152 Len=0 TSval=3138292362 TSecr=3656003862
66,21.862464,192.168.11.37,192.168.11.15,TCP,66,0.000084,,,"53002  >  6000 [FIN, ACK] Seq=28 Ack=1 Win=64256 Len=0 TSval=3656003862 TSecr=3138292354"
67,21.863855,192.168.11.15,192.168.11.37,TCP,66,0.001391,,,"6000  >  53002 [FIN, ACK] Seq=1 Ack=29 Win=65152 Len=0 TSval=3138292364 TSecr=3656003862"
68,21.87198,192.168.11.37,192.168.11.15,TCP,66,0.008125,,,53002  >  6000 [ACK] Seq=29 Ack=2 Win=64256 Len=0 TSval=3656003870 TSecr=3138292364
69,29.006303,192.168.11.15,192.168.11.31,TCP,74,7.134323,,,48102  >  6000 [SYN] Seq=0 Win=64240 Len=0 MSS=1460 SACK_PERM TSval=3103973041 TSecr=0 WS=128
70,29.013015,192.168.11.31,192.168.11.15,TCP,74,0.006712,,,"6000  >  48102 [SYN, ACK] Seq=0 Ack=1 Win=65160 Len=0 MSS=1460 SACK_PERM TSval=978138044 TSecr=3103973041 WS=128"
71,29.013142,192.168.11.15,192.168.11.31,TCP,66,0.000127,,,48102  >  6000 [ACK] Seq=1 Ack=1 Win=64256 Len=0 TSval=3103973048 TSecr=978138044
72,29.013283,192.168.11.15,192.168.11.31,TCP,93,0.000141,,,"48102  >  6000 [PSH, ACK] Seq=1 Ack=1 Win=64256 Len=27 TSval=3103973048 TSecr=978138044 [TCP segment of a reassembled PDU]"
73,29.01339,192.168.11.15,192.168.11.31,TCP,66,0.000107,,,"48102  >  6000 [FIN, ACK] Seq=28 Ack=1 Win=64256 Len=0 TSval=3103973048 TSecr=978138044"
74,29.020776,192.168.11.31,192.168.11.15,TCP,66,0.007386,,,6000  >  48102 [ACK] Seq=1 Ack=28 Win=65152 Len=0 TSval=978138051 TSecr=3103973048
75,29.021013,192.168.11.31,192.168.11.15,TCP,66,0.000237,,,"6000  >  48102 [FIN, ACK] Seq=1 Ack=29 Win=65152 Len=0 TSval=978138053 TSecr=3103973048"
76,29.021076,192.168.11.15,192.168.11.31,TCP,66,0.000063,,,48102  >  6000 [ACK] Seq=29 Ack=2 Win=64256 Len=0 TSval=3103973056 TSecr=978138053
77,29.052728,192.168.11.15,255.255.255.255,UDP,209,0.031652,Ÿ,7b2273656d616e74696373223a207b22656e74697479223a2022504944222c202262617365656e74697479223a2022616e79222c2022726f6c65223a2022353535222c20227370617469616c223a2022616e79222c202274656d706f72616c223a2022616e79227d2c20226461746170726f7065727479223a207b22666f726d6174223a2022696e616f6b615f70726f6772616d5f73616d706c655f73656d616e746963227d7d,36501  >  7000 Len=167
78,29.060253,192.168.11.37,192.168.11.15,TCP,74,0.007525,œ,,44444  >  6000 [SYN] Seq=0 Win=64240 Len=0 MSS=1460 SACK_PERM TSval=3656011060 TSecr=0 WS=128
79,29.060454,192.168.11.15,192.168.11.37,TCP,74,0.000201,,,"6000  >  44444 [SYN, ACK] Seq=0 Ack=1 Win=65160 Len=0 MSS=1460 SACK_PERM TSval=3138299560 TSecr=3656011060 WS=128"
80,29.067584,192.168.11.37,192.168.11.15,TCP,66,0.00713,,,44444  >  6000 [ACK] Seq=1 Ack=1 Win=64256 Len=0 TSval=3656011067 TSecr=3138299560
81,29.068086,192.168.11.37,192.168.11.15,TCP,93,0.000502,,,"44444  >  6000 [PSH, ACK] Seq=1 Ack=1 Win=64256 Len=27 TSval=3656011067 TSecr=3138299560 [TCP segment of a reassembled PDU]"
82,29.06821,192.168.11.15,192.168.11.37,TCP,66,0.000124,,,6000  >  44444 [ACK] Seq=1 Ack=28 Win=65152 Len=0 TSval=3138299568 TSecr=3656011067
83,29.068503,192.168.11.37,192.168.11.15,TCP,66,0.000293,,,"44444  >  6000 [FIN, ACK] Seq=28 Ack=1 Win=64256 Len=0 TSval=3656011068 TSecr=3138299560"
84,29.070121,192.168.11.15,192.168.11.37,TCP,66,0.001618,,,"6000  >  44444 [FIN, ACK] Seq=1 Ack=29 Win=65152 Len=0 TSval=3138299570 TSecr=3656011068"
85,29.076679,192.168.11.37,192.168.11.15,TCP,66,0.006558,,,44444  >  6000 [ACK] Seq=29 Ack=2 Win=64256 Len=0 TSval=3656011076 TSecr=3138299570
86,36.17795,192.168.11.15,192.168.11.31,TCP,74,7.101271,,,34736  >  6000 [SYN] Seq=0 Win=64240 Len=0 MSS=1460 SACK_PERM TSval=3103980213 TSecr=0 WS=128
87,36.184744,192.168.11.31,192.168.11.15,TCP,74,0.006794,,,"6000  >  34736 [SYN, ACK] Seq=0 Ack=1 Win=65160 Len=0 MSS=1460 SACK_PERM TSval=978145216 TSecr=3103980213 WS=128"
88,36.184875,192.168.11.15,192.168.11.31,TCP,66,0.000131,,,34736  >  6000 [ACK] Seq=1 Ack=1 Win=64256 Len=0 TSval=3103980220 TSecr=978145216
89,36.185045,192.168.11.15,192.168.11.31,TCP,93,0.00017,,,"34736  >  6000 [PSH, ACK] Seq=1 Ack=1 Win=64256 Len=27 TSval=3103980220 TSecr=978145216 [TCP segment of a reassembled PDU]"
90,36.185155,192.168.11.15,192.168.11.31,TCP,66,0.00011,,,"34736  >  6000 [FIN, ACK] Seq=28 Ack=1 Win=64256 Len=0 TSval=3103980220 TSecr=978145216"
91,36.192852,192.168.11.31,192.168.11.15,TCP,66,0.007697,,,6000  >  34736 [ACK] Seq=1 Ack=28 Win=65152 Len=0 TSval=978145223 TSecr=3103980220
92,36.193226,192.168.11.31,192.168.11.15,TCP,66,0.000374,,,"6000  >  34736 [FIN, ACK] Seq=1 Ack=29 Win=65152 Len=0 TSval=978145225 TSecr=3103980220"
93,36.193271,192.168.11.15,192.168.11.31,TCP,66,0.000045,,,34736  >  6000 [ACK] Seq=29 Ack=2 Win=64256 Len=0 TSval=3103980228 TSecr=978145225
94,36.22272,192.168.11.15,255.255.255.255,UDP,209,0.029449,Ÿ,7b2273656d616e74696373223a207b22656e74697479223a2022504944222c202262617365656e74697479223a2022616e79222c2022726f6c65223a2022353535222c20227370617469616c223a2022616e79222c202274656d706f72616c223a2022616e79227d2c20226461746170726f7065727479223a207b22666f726d6174223a2022696e616f6b615f70726f6772616d5f73616d706c655f73656d616e746963227d7d,34308  >  7000 Len=167
95,36.230532,192.168.11.37,192.168.11.15,TCP,74,0.007812,œ,,38610  >  6000 [SYN] Seq=0 Win=64240 Len=0 MSS=1460 SACK_PERM TSval=3656018230 TSecr=0 WS=128
96,36.230703,192.168.11.15,192.168.11.37,TCP,74,0.000171,,,"6000  >  38610 [SYN, ACK] Seq=0 Ack=1 Win=65160 Len=0 MSS=1460 SACK_PERM TSval=3138306730 TSecr=3656018230 WS=128"
97,36.237599,192.168.11.37,192.168.11.15,TCP,66,0.006896,,,38610  >  6000 [ACK] Seq=1 Ack=1 Win=64256 Len=0 TSval=3656018237 TSecr=3138306730
98,36.238423,192.168.11.37,192.168.11.15,TCP,93,0.000824,,,"38610  >  6000 [PSH, ACK] Seq=1 Ack=1 Win=64256 Len=27 TSval=3656018237 TSecr=3138306730 [TCP segment of a reassembled PDU]"
99,36.238527,192.168.11.15,192.168.11.37,TCP,66,0.000104,,,6000  >  38610 [ACK] Seq=1 Ack=28 Win=65152 Len=0 TSval=3138306738 TSecr=3656018237
100,36.238618,192.168.11.37,192.168.11.15,TCP,66,0.000091,,,"38610  >  6000 [FIN, ACK] Seq=28 Ack=1 Win=64256 Len=0 TSval=3656018237 TSecr=3138306730"
101,36.240022,192.168.11.15,192.168.11.37,TCP,66,0.001404,,,"6000  >  38610 [FIN, ACK] Seq=1 Ack=29 Win=65152 Len=0 TSval=3138306740 TSecr=3656018237"
102,36.246233,192.168.11.37,192.168.11.15,TCP,66,0.006211,,,38610  >  6000 [ACK] Seq=29 Ack=2 Win=64256 Len=0 TSval=3656018245 TSecr=3138306740
103,43.385408,192.168.11.15,192.168.11.31,TCP,74,7.139175,,,34738  >  6000 [SYN] Seq=0 Win=64240 Len=0 MSS=1460 SACK_PERM TSval=3103987420 TSecr=0 WS=128
104,43.392146,192.168.11.31,192.168.11.15,TCP,74,0.006738,,,"6000  >  34738 [SYN, ACK] Seq=0 Ack=1 Win=65160 Len=0 MSS=1460 SACK_PERM TSval=978152423 TSecr=3103987420 WS=128"
105,43.392254,192.168.11.15,192.168.11.31,TCP,66,0.000108,,,34738  >  6000 [ACK] Seq=1 Ack=1 Win=64256 Len=0 TSval=3103987427 TSecr=978152423
106,43.392419,192.168.11.15,192.168.11.31,TCP,93,0.000165,,,"34738  >  6000 [PSH, ACK] Seq=1 Ack=1 Win=64256 Len=27 TSval=3103987427 TSecr=978152423 [TCP segment of a reassembled PDU]"
107,43.392529,192.168.11.15,192.168.11.31,TCP,66,0.00011,,,"34738  >  6000 [FIN, ACK] Seq=28 Ack=1 Win=64256 Len=0 TSval=3103987427 TSecr=978152423"
108,43.400107,192.168.11.31,192.168.11.15,TCP,66,0.007578,,,6000  >  34738 [ACK] Seq=1 Ack=28 Win=65152 Len=0 TSval=978152431 TSecr=3103987427
109,43.400491,192.168.11.31,192.168.11.15,TCP,66,0.000384,,,"6000  >  34738 [FIN, ACK] Seq=1 Ack=29 Win=65152 Len=0 TSval=978152432 TSecr=3103987427"
110,43.400534,192.168.11.15,192.168.11.31,TCP,66,0.000043,,,34738  >  6000 [ACK] Seq=29 Ack=2 Win=64256 Len=0 TSval=3103987435 TSecr=978152432
111,43.431321,192.168.11.15,255.255.255.255,UDP,209,0.030787,Ÿ,7b2273656d616e74696373223a207b22656e74697479223a2022504944222c202262617365656e74697479223a2022616e79222c2022726f6c65223a2022353535222c20227370617469616c223a2022616e79222c202274656d706f72616c223a2022616e79227d2c20226461746170726f7065727479223a207b22666f726d6174223a2022696e616f6b615f70726f6772616d5f73616d706c655f73656d616e746963227d7d,35328  >  7000 Len=167
112,43.443324,192.168.11.37,192.168.11.15,TCP,74,0.012003,œ,,38618  >  6000 [SYN] Seq=0 Win=64240 Len=0 MSS=1460 SACK_PERM TSval=3656025443 TSecr=0 WS=128
113,43.443521,192.168.11.15,192.168.11.37,TCP,74,0.000197,,,"6000  >  38618 [SYN, ACK] Seq=0 Ack=1 Win=65160 Len=0 MSS=1460 SACK_PERM TSval=3138313943 TSecr=3656025443 WS=128"
114,43.450325,192.168.11.37,192.168.11.15,TCP,66,0.006804,,,38618  >  6000 [ACK] Seq=1 Ack=1 Win=64256 Len=0 TSval=3656025450 TSecr=3138313943
115,43.451153,192.168.11.37,192.168.11.15,TCP,93,0.000828,,,"38618  >  6000 [PSH, ACK] Seq=1 Ack=1 Win=64256 Len=27 TSval=3656025450 TSecr=3138313943 [TCP segment of a reassembled PDU]"
116,43.451406,192.168.11.15,192.168.11.37,TCP,66,0.000253,,,6000  >  38618 [ACK] Seq=1 Ack=28 Win=65152 Len=0 TSval=3138313951 TSecr=3656025450
117,43.45155,192.168.11.37,192.168.11.15,TCP,66,0.000144,,,"38618  >  6000 [FIN, ACK] Seq=28 Ack=1 Win=64256 Len=0 TSval=3656025450 TSecr=3138313943"
118,43.453292,192.168.11.15,192.168.11.37,TCP,66,0.001742,,,"6000  >  38618 [FIN, ACK] Seq=1 Ack=29 Win=65152 Len=0 TSval=3138313953 TSecr=3656025450"
119,43.458345,192.168.11.37,192.168.11.15,TCP,66,0.005053,,,38618  >  6000 [ACK] Seq=29 Ack=2 Win=64256 Len=0 TSval=3656025458 TSecr=3138313953
120,50.572746,192.168.11.15,192.168.11.31,TCP,74,7.114401,,,51860  >  6000 [SYN] Seq=0 Win=64240 Len=0 MSS=1460 SACK_PERM TSval=3103994607 TSecr=0 WS=128
121,50.579629,192.168.11.31,192.168.11.15,TCP,74,0.006883,,,"6000  >  51860 [SYN, ACK] Seq=0 Ack=1 Win=65160 Len=0 MSS=1460 SACK_PERM TSval=978159610 TSecr=3103994607 WS=128"
122,50.579734,192.168.11.15,192.168.11.31,TCP,66,0.000105,,,51860  >  6000 [ACK] Seq=1 Ack=1 Win=64256 Len=0 TSval=3103994614 TSecr=978159610
123,50.579905,192.168.11.15,192.168.11.31,TCP,93,0.000171,,,"51860  >  6000 [PSH, ACK] Seq=1 Ack=1 Win=64256 Len=27 TSval=3103994615 TSecr=978159610 [TCP segment of a reassembled PDU]"
124,50.580004,192.168.11.15,192.168.11.31,TCP,66,0.000099,,,"51860  >  6000 [FIN, ACK] Seq=28 Ack=1 Win=64256 Len=0 TSval=3103994615 TSecr=978159610"
125,50.58939,192.168.11.31,192.168.11.15,TCP,66,0.009386,,,6000  >  51860 [ACK] Seq=1 Ack=28 Win=65152 Len=0 TSval=978159620 TSecr=3103994615
126,50.589618,192.168.11.31,192.168.11.15,TCP,66,0.000228,,,"6000  >  51860 [FIN, ACK] Seq=1 Ack=29 Win=65152 Len=0 TSval=978159622 TSecr=3103994615"
127,50.589662,192.168.11.15,192.168.11.31,TCP,66,0.000044,,,51860  >  6000 [ACK] Seq=29 Ack=2 Win=64256 Len=0 TSval=3103994624 TSecr=978159622
128,50.620523,192.168.11.15,255.255.255.255,UDP,209,0.030861,Ÿ,7b2273656d616e74696373223a207b22656e74697479223a2022504944222c202262617365656e74697479223a2022616e79222c2022726f6c65223a2022353535222c20227370617469616c223a2022616e79222c202274656d706f72616c223a2022616e79227d2c20226461746170726f7065727479223a207b22666f726d6174223a2022696e616f6b615f70726f6772616d5f73616d706c655f73656d616e746963227d7d,59918  >  7000 Len=167
129,50.6286,192.168.11.37,192.168.11.15,TCP,74,0.008077,œ,,38134  >  6000 [SYN] Seq=0 Win=64240 Len=0 MSS=1460 SACK_PERM TSval=3656032628 TSecr=0 WS=128
130,50.628762,192.168.11.15,192.168.11.37,TCP,74,0.000162,,,"6000  >  38134 [SYN, ACK] Seq=0 Ack=1 Win=65160 Len=0 MSS=1460 SACK_PERM TSval=3138321129 TSecr=3656032628 WS=128"
131,50.635692,192.168.11.37,192.168.11.15,TCP,66,0.00693,,,38134  >  6000 [ACK] Seq=1 Ack=1 Win=64256 Len=0 TSval=3656032635 TSecr=3138321129
132,50.636342,192.168.11.37,192.168.11.15,TCP,93,0.00065,,,"38134  >  6000 [PSH, ACK] Seq=1 Ack=1 Win=64256 Len=27 TSval=3656032635 TSecr=3138321129 [TCP segment of a reassembled PDU]"
133,50.636455,192.168.11.15,192.168.11.37,TCP,66,0.000113,,,6000  >  38134 [ACK] Seq=1 Ack=28 Win=65152 Len=0 TSval=3138321136 TSecr=3656032635
134,50.63654,192.168.11.37,192.168.11.15,TCP,66,0.000085,,,"38134  >  6000 [FIN, ACK] Seq=28 Ack=1 Win=64256 Len=0 TSval=3656032635 TSecr=3138321129"
135,50.638073,192.168.11.15,192.168.11.37,TCP,66,0.001533,,,"6000  >  38134 [FIN, ACK] Seq=1 Ack=29 Win=65152 Len=0 TSval=3138321138 TSecr=3656032635"
136,50.645764,192.168.11.37,192.168.11.15,TCP,66,0.007691,,,38134  >  6000 [ACK] Seq=29 Ack=2 Win=64256 Len=0 TSval=3656032643 TSecr=3138321138
137,57.723174,192.168.11.15,192.168.11.31,TCP,74,7.07741,,,51966  >  6000 [SYN] Seq=0 Win=64240 Len=0 MSS=1460 SACK_PERM TSval=3104001758 TSecr=0 WS=128
138,57.729966,192.168.11.31,192.168.11.15,TCP,74,0.006792,,,"6000  >  51966 [SYN, ACK] Seq=0 Ack=1 Win=65160 Len=0 MSS=1460 SACK_PERM TSval=978166761 TSecr=3104001758 WS=128"
139,57.73008,192.168.11.15,192.168.11.31,TCP,66,0.000114,,,51966  >  6000 [ACK] Seq=1 Ack=1 Win=64256 Len=0 TSval=3104001765 TSecr=978166761
140,57.730217,192.168.11.15,192.168.11.31,TCP,93,0.000137,,,"51966  >  6000 [PSH, ACK] Seq=1 Ack=1 Win=64256 Len=27 TSval=3104001765 TSecr=978166761 [TCP segment of a reassembled PDU]"
141,57.730338,192.168.11.15,192.168.11.31,TCP,66,0.000121,,,"51966  >  6000 [FIN, ACK] Seq=28 Ack=1 Win=64256 Len=0 TSval=3104001765 TSecr=978166761"
142,57.738436,192.168.11.31,192.168.11.15,TCP,66,0.008098,,,6000  >  51966 [ACK] Seq=1 Ack=28 Win=65152 Len=0 TSval=978166769 TSecr=3104001765
143,57.738663,192.168.11.31,192.168.11.15,TCP,66,0.000227,,,"6000  >  51966 [FIN, ACK] Seq=1 Ack=29 Win=65152 Len=0 TSval=978166771 TSecr=3104001765"
144,57.738709,192.168.11.15,192.168.11.31,TCP,66,0.000046,,,51966  >  6000 [ACK] Seq=29 Ack=2 Win=64256 Len=0 TSval=3104001773 TSecr=978166771
145,57.767484,192.168.11.15,255.255.255.255,UDP,209,0.028775,Ÿ,7b2273656d616e74696373223a207b22656e74697479223a2022504944222c202262617365656e74697479223a2022616e79222c2022726f6c65223a2022353535222c20227370617469616c223a2022616e79222c202274656d706f72616c223a2022616e79227d2c20226461746170726f7065727479223a207b22666f726d6174223a2022696e616f6b615f70726f6772616d5f73616d706c655f73656d616e746963227d7d,35900  >  7000 Len=167
146,57.775626,192.168.11.37,192.168.11.15,TCP,74,0.008142,œ,,58186  >  6000 [SYN] Seq=0 Win=64240 Len=0 MSS=1460 SACK_PERM TSval=3656039774 TSecr=0 WS=128
147,57.775798,192.168.11.15,192.168.11.37,TCP,74,0.000172,,,"6000  >  58186 [SYN, ACK] Seq=0 Ack=1 Win=65160 Len=0 MSS=1460 SACK_PERM TSval=3138328276 TSecr=3656039774 WS=128"
148,57.782929,192.168.11.37,192.168.11.15,TCP,66,0.007131,,,58186  >  6000 [ACK] Seq=1 Ack=1 Win=64256 Len=0 TSval=3656039781 TSecr=3138328276
149,57.783554,192.168.11.37,192.168.11.15,TCP,93,0.000625,,,"58186  >  6000 [PSH, ACK] Seq=1 Ack=1 Win=64256 Len=27 TSval=3656039782 TSecr=3138328276 [TCP segment of a reassembled PDU]"
150,57.783683,192.168.11.15,192.168.11.37,TCP,66,0.000129,,,6000  >  58186 [ACK] Seq=1 Ack=28 Win=65152 Len=0 TSval=3138328283 TSecr=3656039782
151,57.783768,192.168.11.37,192.168.11.15,TCP,66,0.000085,,,"58186  >  6000 [FIN, ACK] Seq=28 Ack=1 Win=64256 Len=0 TSval=3656039782 TSecr=3138328276"
152,57.785123,192.168.11.15,192.168.11.37,TCP,66,0.001355,,,"6000  >  58186 [FIN, ACK] Seq=1 Ack=29 Win=65152 Len=0 TSval=3138328285 TSecr=3656039782"
153,57.790489,192.168.11.37,192.168.11.15,TCP,66,0.005366,,,58186  >  6000 [ACK] Seq=29 Ack=2 Win=64256 Len=0 TSval=3656039790 TSecr=3138328285
154,64.864304,192.168.11.15,192.168.11.31,TCP,74,7.073815,,,53604  >  6000 [SYN] Seq=0 Win=64240 Len=0 MSS=1460 SACK_PERM TSval=3104008899 TSecr=0 WS=128
155,64.870999,192.168.11.31,192.168.11.15,TCP,74,0.006695,,,"6000  >  53604 [SYN, ACK] Seq=0 Ack=1 Win=65160 Len=0 MSS=1460 SACK_PERM TSval=978173902 TSecr=3104008899 WS=128"
156,64.871105,192.168.11.15,192.168.11.31,TCP,66,0.000106,,,53604  >  6000 [ACK] Seq=1 Ack=1 Win=64256 Len=0 TSval=3104008906 TSecr=978173902
157,64.87125,192.168.11.15,192.168.11.31,TCP,93,0.000145,,,"53604  >  6000 [PSH, ACK] Seq=1 Ack=1 Win=64256 Len=27 TSval=3104008906 TSecr=978173902 [TCP segment of a reassembled PDU]"
158,64.871348,192.168.11.15,192.168.11.31,TCP,66,0.000098,,,"53604  >  6000 [FIN, ACK] Seq=28 Ack=1 Win=64256 Len=0 TSval=3104008906 TSecr=978173902"
159,64.881053,192.168.11.31,192.168.11.15,TCP,66,0.009705,,,6000  >  53604 [ACK] Seq=1 Ack=28 Win=65152 Len=0 TSval=978173912 TSecr=3104008906
160,64.881285,192.168.11.31,192.168.11.15,TCP,66,0.000232,,,"6000  >  53604 [FIN, ACK] Seq=1 Ack=29 Win=65152 Len=0 TSval=978173913 TSecr=3104008906"
161,64.881328,192.168.11.15,192.168.11.31,TCP,66,0.000043,,,53604  >  6000 [ACK] Seq=29 Ack=2 Win=64256 Len=0 TSval=3104008916 TSecr=978173913
162,64.912514,192.168.11.15,255.255.255.255,UDP,209,0.031186,Ÿ,7b2273656d616e74696373223a207b22656e74697479223a2022504944222c202262617365656e74697479223a2022616e79222c2022726f6c65223a2022353535222c20227370617469616c223a2022616e79222c202274656d706f72616c223a2022616e79227d2c20226461746170726f7065727479223a207b22666f726d6174223a2022696e616f6b615f70726f6772616d5f73616d706c655f73656d616e746963227d7d,42737  >  7000 Len=167
163,64.920457,192.168.11.37,192.168.11.15,TCP,74,0.007943,œ,,58192  >  6000 [SYN] Seq=0 Win=64240 Len=0 MSS=1460 SACK_PERM TSval=3656046919 TSecr=0 WS=128
164,64.920585,192.168.11.15,192.168.11.37,TCP,74,0.000128,,,"6000  >  58192 [SYN, ACK] Seq=0 Ack=1 Win=65160 Len=0 MSS=1460 SACK_PERM TSval=3138335420 TSecr=3656046919 WS=128"
165,64.927285,192.168.11.37,192.168.11.15,TCP,66,0.0067,,,58192  >  6000 [ACK] Seq=1 Ack=1 Win=64256 Len=0 TSval=3656046926 TSecr=3138335420
166,64.927851,192.168.11.37,192.168.11.15,TCP,93,0.000566,,,"58192  >  6000 [PSH, ACK] Seq=1 Ack=1 Win=64256 Len=27 TSval=3656046926 TSecr=3138335420 [TCP segment of a reassembled PDU]"
167,64.927961,192.168.11.15,192.168.11.37,TCP,66,0.00011,,,6000  >  58192 [ACK] Seq=1 Ack=28 Win=65152 Len=0 TSval=3138335428 TSecr=3656046926
168,64.928024,192.168.11.37,192.168.11.15,TCP,66,0.000063,,,"58192  >  6000 [FIN, ACK] Seq=28 Ack=1 Win=64256 Len=0 TSval=3656046926 TSecr=3138335420"
169,64.929087,192.168.11.15,192.168.11.37,TCP,66,0.001063,,,"6000  >  58192 [FIN, ACK] Seq=1 Ack=29 Win=65152 Len=0 TSval=3138335429 TSecr=3656046926"
170,64.935053,192.168.11.37,192.168.11.15,TCP,66,0.005966,,,58192  >  6000 [ACK] Seq=29 Ack=2 Win=64256 Len=0 TSval=3656046933 TSecr=3138335429
171,110.543541,192.168.11.15,192.168.11.31,TCP,74,45.608488,,,59986  >  6000 [SYN] Seq=0 Win=64240 Len=0 MSS=1460 SACK_PERM TSval=3104054578 TSecr=0 WS=128
172,110.550759,192.168.11.31,192.168.11.15,TCP,74,0.007218,,,"6000  >  59986 [SYN, ACK] Seq=0 Ack=1 Win=65160 Len=0 MSS=1460 SACK_PERM TSval=978219582 TSecr=3104054578 WS=128"
173,110.55088,192.168.11.15,192.168.11.31,TCP,66,0.000121,,,59986  >  6000 [ACK] Seq=1 Ack=1 Win=64256 Len=0 TSval=3104054586 TSecr=978219582
174,110.551135,192.168.11.15,192.168.11.31,TCP,93,0.000255,,,"59986  >  6000 [PSH, ACK] Seq=1 Ack=1 Win=64256 Len=27 TSval=3104054586 TSecr=978219582 [TCP segment of a reassembled PDU]"
175,110.551252,192.168.11.15,192.168.11.31,TCP,66,0.000117,,,"59986  >  6000 [FIN, ACK] Seq=28 Ack=1 Win=64256 Len=0 TSval=3104054586 TSecr=978219582"
176,110.558613,192.168.11.31,192.168.11.15,TCP,66,0.007361,,,6000  >  59986 [ACK] Seq=1 Ack=28 Win=65152 Len=0 TSval=978219590 TSecr=3104054586
177,110.558837,192.168.11.31,192.168.11.15,TCP,66,0.000224,,,"6000  >  59986 [FIN, ACK] Seq=1 Ack=29 Win=65152 Len=0 TSval=978219591 TSecr=3104054586"
178,110.55888,192.168.11.15,192.168.11.31,TCP,66,0.000043,,,59986  >  6000 [ACK] Seq=29 Ack=2 Win=64256 Len=0 TSval=3104054594 TSecr=978219591
179,110.588843,192.168.11.15,255.255.255.255,UDP,209,0.029963,Ÿ,7b2273656d616e74696373223a207b22656e74697479223a2022504944222c202262617365656e74697479223a2022616e79222c2022726f6c65223a2022353535222c20227370617469616c223a2022616e79222c202274656d706f72616c223a2022616e79227d2c20226461746170726f7065727479223a207b22666f726d6174223a2022696e616f6b615f70726f6772616d5f73616d706c655f73656d616e746963227d7d,46693  >  7000 Len=167
180,110.596978,192.168.11.37,192.168.11.15,TCP,74,0.008135,œ,,39002  >  6000 [SYN] Seq=0 Win=64240 Len=0 MSS=1460 SACK_PERM TSval=3656092594 TSecr=0 WS=128
181,110.597146,192.168.11.15,192.168.11.37,TCP,74,0.000168,,,"6000  >  39002 [SYN, ACK] Seq=0 Ack=1 Win=65160 Len=0 MSS=1460 SACK_PERM TSval=3138381097 TSecr=3656092594 WS=128"
182,110.603876,192.168.11.37,192.168.11.15,TCP,66,0.00673,,,39002  >  6000 [ACK] Seq=1 Ack=1 Win=64256 Len=0 TSval=3656092601 TSecr=3138381097
183,110.604462,192.168.11.37,192.168.11.15,TCP,93,0.000586,,,"39002  >  6000 [PSH, ACK] Seq=1 Ack=1 Win=64256 Len=27 TSval=3656092601 TSecr=3138381097 [TCP segment of a reassembled PDU]"
184,110.604564,192.168.11.15,192.168.11.37,TCP,66,0.000102,,,6000  >  39002 [ACK] Seq=1 Ack=28 Win=65152 Len=0 TSval=3138381104 TSecr=3656092601
185,110.604636,192.168.11.37,192.168.11.15,TCP,66,0.000072,,,"39002  >  6000 [FIN, ACK] Seq=28 Ack=1 Win=64256 Len=0 TSval=3656092601 TSecr=3138381097"
186,110.606579,192.168.11.15,192.168.11.37,TCP,66,0.001943,,,"6000  >  39002 [FIN, ACK] Seq=1 Ack=29 Win=65152 Len=0 TSval=3138381106 TSecr=3656092601"
187,110.611257,192.168.11.37,192.168.11.15,TCP,66,0.004678,,,39002  >  6000 [ACK] Seq=29 Ack=2 Win=64256 Len=0 TSval=3656092608 TSecr=3138381106
188,117.709436,192.168.11.15,192.168.11.31,TCP,74,7.098179,,,46468  >  6000 [SYN] Seq=0 Win=64240 Len=0 MSS=1460 SACK_PERM TSval=3104061744 TSecr=0 WS=128
189,117.718466,192.168.11.31,192.168.11.15,TCP,74,0.00903,,,"6000  >  46468 [SYN, ACK] Seq=0 Ack=1 Win=65160 Len=0 MSS=1460 SACK_PERM TSval=978226750 TSecr=3104061744 WS=128"
190,117.718576,192.168.11.15,192.168.11.31,TCP,66,0.00011,,,46468  >  6000 [ACK] Seq=1 Ack=1 Win=64256 Len=0 TSval=3104061753 TSecr=978226750
191,117.718858,192.168.11.15,192.168.11.31,TCP,93,0.000282,,,"46468  >  6000 [PSH, ACK] Seq=1 Ack=1 Win=64256 Len=27 TSval=3104061754 TSecr=978226750 [TCP segment of a reassembled PDU]"
192,117.718971,192.168.11.15,192.168.11.31,TCP,66,0.000113,,,"46468  >  6000 [FIN, ACK] Seq=28 Ack=1 Win=64256 Len=0 TSval=3104061754 TSecr=978226750"
193,117.726262,192.168.11.31,192.168.11.15,TCP,66,0.007291,,,6000  >  46468 [ACK] Seq=1 Ack=28 Win=65152 Len=0 TSval=978226757 TSecr=3104061754
194,117.726502,192.168.11.31,192.168.11.15,TCP,66,0.00024,,,"6000  >  46468 [FIN, ACK] Seq=1 Ack=29 Win=65152 Len=0 TSval=978226759 TSecr=3104061754"
195,117.726547,192.168.11.15,192.168.11.31,TCP,66,0.000045,,,46468  >  6000 [ACK] Seq=29 Ack=2 Win=64256 Len=0 TSval=3104061761 TSecr=978226759
196,117.756545,192.168.11.15,255.255.255.255,UDP,209,0.029998,Ÿ,7b2273656d616e74696373223a207b22656e74697479223a2022504944222c202262617365656e74697479223a2022616e79222c2022726f6c65223a2022353535222c20227370617469616c223a2022616e79222c202274656d706f72616c223a2022616e79227d2c20226461746170726f7065727479223a207b22666f726d6174223a2022696e616f6b615f70726f6772616d5f73616d706c655f73656d616e746963227d7d,50394  >  7000 Len=167
197,117.764869,192.168.11.37,192.168.11.15,TCP,74,0.008324,œ,,53566  >  6000 [SYN] Seq=0 Win=64240 Len=0 MSS=1460 SACK_PERM TSval=3656099762 TSecr=0 WS=128
198,117.765023,192.168.11.15,192.168.11.37,TCP,74,0.000154,,,"6000  >  53566 [SYN, ACK] Seq=0 Ack=1 Win=65160 Len=0 MSS=1460 SACK_PERM TSval=3138388265 TSecr=3656099762 WS=128"
199,117.778438,192.168.11.37,192.168.11.15,TCP,66,0.013415,,,53566  >  6000 [ACK] Seq=1 Ack=1 Win=64256 Len=0 TSval=3656099768 TSecr=3138388265
200,117.779201,192.168.11.37,192.168.11.15,TCP,93,0.000763,,,"53566  >  6000 [PSH, ACK] Seq=1 Ack=1 Win=64256 Len=27 TSval=3656099769 TSecr=3138388265 [TCP segment of a reassembled PDU]"
201,117.779355,192.168.11.15,192.168.11.37,TCP,66,0.000154,,,6000  >  53566 [ACK] Seq=1 Ack=28 Win=65152 Len=0 TSval=3138388279 TSecr=3656099769
202,117.779452,192.168.11.37,192.168.11.15,TCP,66,0.000097,,,"53566  >  6000 [FIN, ACK] Seq=28 Ack=1 Win=64256 Len=0 TSval=3656099769 TSecr=3138388265"
203,117.781013,192.168.11.15,192.168.11.37,TCP,66,0.001561,,,"6000  >  53566 [FIN, ACK] Seq=1 Ack=29 Win=65152 Len=0 TSval=3138388281 TSecr=3656099769"
204,117.786229,192.168.11.37,192.168.11.15,TCP,66,0.005216,,,53566  >  6000 [ACK] Seq=29 Ack=2 Win=64256 Len=0 TSval=3656099783 TSecr=3138388281
205,124.950451,192.168.11.15,192.168.11.31,TCP,74,7.164222,,,39934  >  6000 [SYN] Seq=0 Win=64240 Len=0 MSS=1460 SACK_PERM TSval=3104068985 TSecr=0 WS=128
206,124.957165,192.168.11.31,192.168.11.15,TCP,74,0.006714,,,"6000  >  39934 [SYN, ACK] Seq=0 Ack=1 Win=65160 Len=0 MSS=1460 SACK_PERM TSval=978233989 TSecr=3104068985 WS=128"
207,124.957286,192.168.11.15,192.168.11.31,TCP,66,0.000121,,,39934  >  6000 [ACK] Seq=1 Ack=1 Win=64256 Len=0 TSval=3104068992 TSecr=978233989
208,124.957472,192.168.11.15,192.168.11.31,TCP,93,0.000186,,,"39934  >  6000 [PSH, ACK] Seq=1 Ack=1 Win=64256 Len=27 TSval=3104068992 TSecr=978233989 [TCP segment of a reassembled PDU]"
209,124.957567,192.168.11.15,192.168.11.31,TCP,66,0.000095,,,"39934  >  6000 [FIN, ACK] Seq=28 Ack=1 Win=64256 Len=0 TSval=3104068992 TSecr=978233989"
210,124.964822,192.168.11.31,192.168.11.15,TCP,66,0.007255,,,6000  >  39934 [ACK] Seq=1 Ack=28 Win=65152 Len=0 TSval=978233996 TSecr=3104068992
211,124.965193,192.168.11.31,192.168.11.15,TCP,66,0.000371,,,"6000  >  39934 [FIN, ACK] Seq=1 Ack=29 Win=65152 Len=0 TSval=978233997 TSecr=3104068992"
212,124.965253,192.168.11.15,192.168.11.31,TCP,66,0.00006,,,39934  >  6000 [ACK] Seq=29 Ack=2 Win=64256 Len=0 TSval=3104069000 TSecr=978233997
213,124.993643,192.168.11.15,255.255.255.255,UDP,209,0.02839,Ÿ,7b2273656d616e74696373223a207b22656e74697479223a2022504944222c202262617365656e74697479223a2022616e79222c2022726f6c65223a2022353535222c20227370617469616c223a2022616e79222c202274656d706f72616c223a2022616e79227d2c20226461746170726f7065727479223a207b22666f726d6174223a2022696e616f6b615f70726f6772616d5f73616d706c655f73656d616e746963227d7d,39021  >  7000 Len=167
214,125.001618,192.168.11.37,192.168.11.15,TCP,74,0.007975,œ,,53576  >  6000 [SYN] Seq=0 Win=64240 Len=0 MSS=1460 SACK_PERM TSval=3656106998 TSecr=0 WS=128
215,125.001828,192.168.11.15,192.168.11.37,TCP,74,0.00021,,,"6000  >  53576 [SYN, ACK] Seq=0 Ack=1 Win=65160 Len=0 MSS=1460 SACK_PERM TSval=3138395502 TSecr=3656106998 WS=128"
216,125.008567,192.168.11.37,192.168.11.15,TCP,66,0.006739,,,53576  >  6000 [ACK] Seq=1 Ack=1 Win=64256 Len=0 TSval=3656107005 TSecr=3138395502
217,125.009313,192.168.11.37,192.168.11.15,TCP,93,0.000746,,,"53576  >  6000 [PSH, ACK] Seq=1 Ack=1 Win=64256 Len=27 TSval=3656107005 TSecr=3138395502 [TCP segment of a reassembled PDU]"
218,125.009432,192.168.11.15,192.168.11.37,TCP,66,0.000119,,,6000  >  53576 [ACK] Seq=1 Ack=28 Win=65152 Len=0 TSval=3138395509 TSecr=3656107005
219,125.009535,192.168.11.37,192.168.11.15,TCP,66,0.000103,,,"53576  >  6000 [FIN, ACK] Seq=28 Ack=1 Win=64256 Len=0 TSval=3656107005 TSecr=3138395502"
220,125.011695,192.168.11.15,192.168.11.37,TCP,66,0.00216,,,"6000  >  53576 [FIN, ACK] Seq=1 Ack=29 Win=65152 Len=0 TSval=3138395511 TSecr=3656107005"
221,125.018653,192.168.11.37,192.168.11.15,TCP,66,0.006958,,,53576  >  6000 [ACK] Seq=29 Ack=2 Win=64256 Len=0 TSval=3656107015 TSecr=3138395511
222,132.12201,192.168.11.15,192.168.11.31,TCP,74,7.103357,,,39938  >  6000 [SYN] Seq=0 Win=64240 Len=0 MSS=1460 SACK_PERM TSval=3104076157 TSecr=0 WS=128
223,132.129012,192.168.11.31,192.168.11.15,TCP,74,0.007002,,,"6000  >  39938 [SYN, ACK] Seq=0 Ack=1 Win=65160 Len=0 MSS=1460 SACK_PERM TSval=978241160 TSecr=3104076157 WS=128"
224,132.129135,192.168.11.15,192.168.11.31,TCP,66,0.000123,,,39938  >  6000 [ACK] Seq=1 Ack=1 Win=64256 Len=0 TSval=3104076164 TSecr=978241160
225,132.129324,192.168.11.15,192.168.11.31,TCP,93,0.000189,,,"39938  >  6000 [PSH, ACK] Seq=1 Ack=1 Win=64256 Len=27 TSval=3104076164 TSecr=978241160 [TCP segment of a reassembled PDU]"
226,132.129439,192.168.11.15,192.168.11.31,TCP,66,0.000115,,,"39938  >  6000 [FIN, ACK] Seq=28 Ack=1 Win=64256 Len=0 TSval=3104076164 TSecr=978241160"
227,132.136632,192.168.11.31,192.168.11.15,TCP,66,0.007193,,,6000  >  39938 [ACK] Seq=1 Ack=28 Win=65152 Len=0 TSval=978241168 TSecr=3104076164
228,132.137021,192.168.11.31,192.168.11.15,TCP,66,0.000389,,,"6000  >  39938 [FIN, ACK] Seq=1 Ack=29 Win=65152 Len=0 TSval=978241169 TSecr=3104076164"
229,132.13708,192.168.11.15,192.168.11.31,TCP,66,0.000059,,,39938  >  6000 [ACK] Seq=29 Ack=2 Win=64256 Len=0 TSval=3104076172 TSecr=978241169
230,132.165314,192.168.11.15,255.255.255.255,UDP,209,0.028234,Ÿ,7b2273656d616e74696373223a207b22656e74697479223a2022504944222c202262617365656e74697479223a2022616e79222c2022726f6c65223a2022353535222c20227370617469616c223a2022616e79222c202274656d706f72616c223a2022616e79227d2c20226461746170726f7065727479223a207b22666f726d6174223a2022696e616f6b615f70726f6772616d5f73616d706c655f73656d616e746963227d7d,50920  >  7000 Len=167
231,132.173485,192.168.11.37,192.168.11.15,TCP,74,0.008171,œ,,59096  >  6000 [SYN] Seq=0 Win=64240 Len=0 MSS=1460 SACK_PERM TSval=3656114170 TSecr=0 WS=128
