No.,Time,Source,Destination,Protocol,Length,Time delta from previous captured frame,XXX,Data,Info
1,0,192.168.11.37,192.168.11.15,TCP,74,0,,,54882  >  6000 [SYN] Seq=0 Win=64240 Len=0 MSS=1460 SACK_PERM TSval=3655982055 TSecr=0 WS=128
2,0.008725,192.168.11.15,192.168.11.37,TCP,74,0.008725,,,"6000  >  54882 [SYN, ACK] Seq=0 Ack=1 Win=65160 Len=0 MSS=1460 SACK_PERM TSval=3138270560 TSecr=3655982055 WS=128"
3,0.008838,192.168.11.37,192.168.11.15,TCP,66,0.000113,,,54882  >  6000 [ACK] Seq=1 Ack=1 Win=64256 Len=0 TSval=3655982068 TSecr=3138270560
4,0.009067,192.168.11.37,192.168.11.15,TCP,93,0.000229,,,"54882  >  6000 [PSH, ACK] Seq=1 Ack=1 Win=64256 Len=27 TSval=3655982068 TSecr=3138270560 [TCP segment of a reassembled PDU]"
5,0.009206,192.168.11.37,192.168.11.15,TCP,66,0.000139,,,"54882  >  6000 [FIN, ACK] Seq=28 Ack=1 Win=64256 Len=0 TSval=3655982068 TSecr=3138270560"
6,0.015759,192.168.11.15,192.168.11.37,TCP,66,0.006553,,,6000  >  54882 [ACK] Seq=1 Ack=28 Win=65152 Len=0 TSval=3138270567 TSecr=3655982068
7,0.015979,192.168.11.15,192.168.11.37,TCP,66,0.00022,,,"6000  >  54882 [FIN, ACK] Seq=1 Ack=29 Win=65152 Len=0 TSval=3138270568 TSecr=3655982068"
8,0.016025,192.168.11.37,192.168.11.15,TCP,66,0.000046,,,54882  >  6000 [ACK] Seq=29 Ack=2 Win=64256 Len=0 TSval=3655982075 TSecr=3138270568
9,0.047734,192.168.11.37,255.255.255.255,UDP,209,0.031709,Ÿ,7b2273656d616e74696373223a207b22656e74697479223a2022504944222c202262617365656e74697479223a2022616e79222c2022726f6c65223a2022363636222c20227370617469616c223a2022616e79222c202274656d706f72616c223a2022616e79227d2c20226461746170726f7065727479223a207b22666f726d6174223a2022696e616f6b615f70726f6772616d5f73616d706c655f73656d616e746963227d7d,42082  >  7000 Len=167
10,0.060188,192.168.11.38,192.168.11.37,TCP,74,0.012454,œ,,40504  >  6000 [SYN] Seq=0 Win=64240 Len=0 MSS=1460 SACK_PERM TSval=2258807477 TSecr=0 WS=128
11,0.060349,192.168.11.37,192.168.11.38,TCP,74,0.000161,,,"6000  >  40504 [SYN, ACK] Seq=0 Ack=1 Win=65160 Len=0 MSS=1460 SACK_PERM TSval=2347655826 TSecr=2258807477 WS=128"
12,0.074914,192.168.11.38,192.168.11.37,TCP,66,0.014565,,,40504  >  6000 [ACK] Seq=1 Ack=1 Win=64256 Len=0 TSval=2258807489 TSecr=2347655826
13,0.075481,192.168.11.38,192.168.11.37,TCP,93,0.000567,,,"40504  >  6000 [PSH, ACK] Seq=1 Ack=1 Win=64256 Len=27 TSval=2258807489 TSecr=2347655826 [TCP segment of a reassembled PDU]"
14,0.075561,192.168.11.37,192.168.11.38,TCP,66,0.00008,,,6000  >  40504 [ACK] Seq=1 Ack=28 Win=65152 Len=0 TSval=2347655841 TSecr=2258807489
15,0.075627,192.168.11.38,192.168.11.37,TCP,66,0.000066,,,"40504  >  6000 [FIN, ACK] Seq=28 Ack=1 Win=64256 Len=0 TSval=2258807489 TSecr=2347655826"
16,0.076804,192.168.11.37,192.168.11.38,TCP,66,0.001177,,,"6000  >  40504 [FIN, ACK] Seq=1 Ack=29 Win=65152 Len=0 TSval=2347655843 TSecr=2258807489"
17,0.082632,192.168.11.38,192.168.11.37,TCP,66,0.005828,,,40504  >  6000 [ACK] Seq=29 Ack=2 Win=64256 Len=0 TSval=2258807504 TSecr=2347655843
18,7.265989,192.168.11.37,192.168.11.15,TCP,74,7.183357,,,34972  >  6000 [SYN] Seq=0 Win=64240 Len=0 MSS=1460 SACK_PERM TSval=3655989325 TSecr=0 WS=128
19,7.276507,192.168.11.15,192.168.11.37,TCP,74,0.010518,,,"6000  >  34972 [SYN, ACK] Seq=0 Ack=1 Win=65160 Len=0 MSS=1460 SACK_PERM TSval=3138277825 TSecr=3655989325 WS=128"
20,7.276631,192.168.11.37,192.168.11.15,TCP,66,0.000124,,,34972  >  6000 [ACK] Seq=1 Ack=1 Win=64256 Len=0 TSval=3655989335 TSecr=3138277825
21,7.276913,192.168.11.37,192.168.11.15,TCP,93,0.000282,,,"34972  >  6000 [PSH, ACK] Seq=1 Ack=1 Win=64256 Len=27 TSval=3655989336 TSecr=3138277825 [TCP segment of a reassembled PDU]"
22,7.277038,192.168.11.37,192.168.11.15,TCP,66,0.000125,,,"34972  >  6000 [FIN, ACK] Seq=28 Ack=1 Win=64256 Len=0 TSval=3655989336 TSecr=3138277825"
23,7.28422,192.168.11.15,192.168.11.37,TCP,66,0.007182,,,6000  >  34972 [ACK] Seq=1 Ack=28 Win=65152 Len=0 TSval=3138277835 TSecr=3655989336
24,7.284468,192.168.11.15,192.168.11.37,TCP,66,0.000248,,,"6000  >  34972 [FIN, ACK] Seq=1 Ack=29 Win=65152 Len=0 TSval=3138277837 TSecr=3655989336"
25,7.284511,192.168.11.37,192.168.11.15,TCP,66,0.000043,,,34972  >  6000 [ACK] Seq=29 Ack=2 Win=64256 Len=0 TSval=3655989343 TSecr=3138277837
26,7.315914,192.168.11.37,255.255.255.255,UDP,209,0.031403,Ÿ,7b2273656d616e74696373223a207b22656e74697479223a2022504944222c202262617365656e74697479223a2022616e79222c2022726f6c65223a2022363636222c20227370617469616c223a2022616e79222c202274656d706f72616c223a2022616e79227d2c20226461746170726f7065727479223a207b22666f726d6174223a2022696e616f6b615f70726f6772616d5f73616d706c655f73656d616e746963227d7d,49770  >  7000 Len=167
27,7.324172,192.168.11.38,192.168.11.37,TCP,74,0.008258,œ,,49310  >  6000 [SYN] Seq=0 Win=64240 Len=0 MSS=1460 SACK_PERM TSval=2258814746 TSecr=0 WS=128
28,7.324308,192.168.11.37,192.168.11.38,TCP,74,0.000136,,,"6000  >  49310 [SYN, ACK] Seq=0 Ack=1 Win=65160 Len=0 MSS=1460 SACK_PERM TSval=2347663090 TSecr=2258814746 WS=128"
29,7.333284,192.168.11.38,192.168.11.37,TCP,66,0.008976,,,49310  >  6000 [ACK] Seq=1 Ack=1 Win=64256 Len=0 TSval=2258814755 TSecr=2347663090
30,7.333746,192.168.11.38,192.168.11.37,TCP,93,0.000462,,,"49310  >  6000 [PSH, ACK] Seq=1 Ack=1 Win=64256 Len=27 TSval=2258814755 TSecr=2347663090 [TCP segment of a reassembled PDU]"
31,7.333833,192.168.11.37,192.168.11.38,TCP,66,0.000087,,,6000  >  49310 [ACK] Seq=1 Ack=28 Win=65152 Len=0 TSval=2347663100 TSecr=2258814755
32,7.333895,192.168.11.38,192.168.11.37,TCP,66,0.000062,,,"49310  >  6000 [FIN, ACK] Seq=28 Ack=1 Win=64256 Len=0 TSval=2258814755 TSecr=2347663090"
33,7.335928,192.168.11.37,192.168.11.38,TCP,66,0.002033,,,"6000  >  49310 [FIN, ACK] Seq=1 Ack=29 Win=65152 Len=0 TSval=2347663102 TSecr=2258814755"
34,7.340727,192.168.11.38,192.168.11.37,TCP,66,0.004799,,,49310  >  6000 [ACK] Seq=29 Ack=2 Win=64256 Len=0 TSval=2258814763 TSecr=2347663102
35,14.596866,192.168.11.37,192.168.11.15,TCP,74,7.256139,,,34976  >  6000 [SYN] Seq=0 Win=64240 Len=0 MSS=1460 SACK_PERM TSval=3655996656 TSecr=0 WS=128
36,14.604567,192.168.11.15,192.168.11.37,TCP,74,0.007701,,,"6000  >  34976 [SYN, ACK] Seq=0 Ack=1 Win=65160 Len=0 MSS=1460 SACK_PERM TSval=3138285155 TSecr=3655996656 WS=128"
37,14.604681,192.168.11.37,192.168.11.15,TCP,66,0.000114,,,34976  >  6000 [ACK] Seq=1 Ack=1 Win=64256 Len=0 TSval=3655996663 TSecr=3138285155
38,14.604883,192.168.11.37,192.168.11.15,TCP,93,0.000202,,,"34976  >  6000 [PSH, ACK] Seq=1 Ack=1 Win=64256 Len=27 TSval=3655996664 TSecr=3138285155 [TCP segment of a reassembled PDU]"
39,14.604986,192.168.11.37,192.168.11.15,TCP,66,0.000103,,,"34976  >  6000 [FIN, ACK] Seq=28 Ack=1 Win=64256 Len=0 TSval=3655996664 TSecr=3138285155"
40,14.612396,192.168.11.15,192.168.11.37,TCP,66,0.00741,,,6000  >  34976 [ACK] Seq=1 Ack=28 Win=65152 Len=0 TSval=3138285164 TSecr=3655996664
41,14.612608,192.168.11.15,192.168.11.37,TCP,66,0.000212,,,"6000  >  34976 [FIN, ACK] Seq=1 Ack=29 Win=65152 Len=0 TSval=3138285165 TSecr=3655996664"
42,14.61265,192.168.11.37,192.168.11.15,TCP,66,0.000042,,,34976  >  6000 [ACK] Seq=29 Ack=2 Win=64256 Len=0 TSval=3655996671 TSecr=3138285165
43,14.642255,192.168.11.37,255.255.255.255,UDP,209,0.029605,Ÿ,7b2273656d616e74696373223a207b22656e74697479223a2022504944222c202262617365656e74697479223a2022616e79222c2022726f6c65223a2022363636222c20227370617469616c223a2022616e79222c202274656d706f72616c223a2022616e79227d2c20226461746170726f7065727479223a207b22666f726d6174223a2022696e616f6b615f70726f6772616d5f73616d706c655f73656d616e746963227d7d,60024  >  7000 Len=167
44,14.652039,192.168.11.38,192.168.11.37,TCP,74,0.009784,œ,,49320  >  6000 [SYN] Seq=0 Win=64240 Len=0 MSS=1460 SACK_PERM TSval=2258822074 TSecr=0 WS=128
45,14.652193,192.168.11.37,192.168.11.38,TCP,74,0.000154,,,"6000  >  49320 [SYN, ACK] Seq=0 Ack=1 Win=65160 Len=0 MSS=1460 SACK_PERM TSval=2347670418 TSecr=2258822074 WS=128"
46,14.658952,192.168.11.38,192.168.11.37,TCP,66,0.006759,,,49320  >  6000 [ACK] Seq=1 Ack=1 Win=64256 Len=0 TSval=2258822081 TSecr=2347670418
47,14.659559,192.168.11.38,192.168.11.37,TCP,93,0.000607,,,"49320  >  6000 [PSH, ACK] Seq=1 Ack=1 Win=64256 Len=27 TSval=2258822081 TSecr=2347670418 [TCP segment of a reassembled PDU]"
48,14.659679,192.168.11.37,192.168.11.38,TCP,66,0.00012,,,6000  >  49320 [ACK] Seq=1 Ack=28 Win=65152 Len=0 TSval=2347670425 TSecr=2258822081
49,14.659756,192.168.11.38,192.168.11.37,TCP,66,0.000077,,,"49320  >  6000 [FIN, ACK] Seq=28 Ack=1 Win=64256 Len=0 TSval=2258822081 TSecr=2347670418"
50,14.660863,192.168.11.37,192.168.11.38,TCP,66,0.001107,,,"6000  >  49320 [FIN, ACK] Seq=1 Ack=29 Win=65152 Len=0 TSval=2347670427 TSecr=2258822081"
51,14.667404,192.168.11.38,192.168.11.37,TCP,66,0.006541,,,49320  >  6000 [ACK] Seq=29 Ack=2 Win=64256 Len=0 TSval=2258822089 TSecr=2347670427
52,21.795722,192.168.11.37,192.168.11.15,TCP,74,7.128318,,,53002  >  6000 [SYN] Seq=0 Win=64240 Len=0 MSS=1460 SACK_PERM TSval=3656003854 TSecr=0 WS=128
53,21.802589,192.168.11.15,192.168.11.37,TCP,74,0.006867,,,"6000  >  53002 [SYN, ACK] Seq=0 Ack=1 Win=65160 Len=0 MSS=1460 SACK_PERM TSval=3138292354 TSecr=3656003854 WS=128"
54,21.802727,192.168.11.37,192.168.11.15,TCP,66,0.000138,,,53002  >  6000 [ACK] Seq=1 Ack=1 Win=64256 Len=0 TSval=3656003861 TSecr=3138292354
55,21.802896,192.168.11.37,192.168.11.15,TCP,93,0.000169,,,"53002  >  6000 [PSH, ACK] Seq=1 Ack=1 Win=64256 Len=27 TSval=3656003862 TSecr=3138292354 [TCP segment of a reassembled PDU]"
56,21.803006,192.168.11.37,192.168.11.15,TCP,66,0.00011,,,"53002  >  6000 [FIN, ACK] Seq=28 Ack=1 Win=64256 Len=0 TSval=3656003862 TSecr=3138292354"
57,21.81047,192.168.11.15,192.168.11.37,TCP,66,0.007464,,,6000  >  53002 [ACK] Seq=1 Ack=28 Win=65152 Len=0 TSval=3138292362 TSecr=3656003862
58,21.810941,192.168.11.15,192.168.11.37,TCP,66,0.000471,,,"6000  >  53002 [FIN, ACK] Seq=1 Ack=29 Win=65152 Len=0 TSval=3138292364 TSecr=3656003862"
59,21.810988,192.168.11.37,192.168.11.15,TCP,66,0.000047,,,53002  >  6000 [ACK] Seq=29 Ack=2 Win=64256 Len=0 TSval=3656003870 TSecr=3138292364
60,21.84202,192.168.11.37,255.255.255.255,UDP,209,0.031032,Ÿ,7b2273656d616e74696373223a207b22656e74697479223a2022504944222c202262617365656e74697479223a2022616e79222c2022726f6c65223a2022363636222c20227370617469616c223a2022616e79222c202274656d706f72616c223a2022616e79227d2c20226461746170726f7065727479223a207b22666f726d6174223a2022696e616f6b615f70726f6772616d5f73616d706c655f73656d616e746963227d7d,34951  >  7000 Len=167
61,21.853728,192.168.11.38,192.168.11.37,TCP,74,0.011708,œ,,42114  >  6000 [SYN] Seq=0 Win=64240 Len=0 MSS=1460 SACK_PERM TSval=2258829272 TSecr=0 WS=128
62,21.853913,192.168.11.37,192.168.11.38,TCP,74,0.000185,,,"6000  >  42114 [SYN, ACK] Seq=0 Ack=1 Win=65160 Len=0 MSS=1460 SACK_PERM TSval=2347677620 TSecr=2258829272 WS=128"
63,21.860534,192.168.11.38,192.168.11.37,TCP,66,0.006621,,,42114  >  6000 [ACK] Seq=1 Ack=1 Win=64256 Len=0 TSval=2258829283 TSecr=2347677620
64,21.861031,192.168.11.38,192.168.11.37,TCP,93,0.000497,,,"42114  >  6000 [PSH, ACK] Seq=1 Ack=1 Win=64256 Len=27 TSval=2258829283 TSecr=2347677620 [TCP segment of a reassembled PDU]"
65,21.861109,192.168.11.37,192.168.11.38,TCP,66,0.000078,,,6000  >  42114 [ACK] Seq=1 Ack=28 Win=65152 Len=0 TSval=2347677627 TSecr=2258829283
66,21.861171,192.168.11.38,192.168.11.37,TCP,66,0.000062,,,"42114  >  6000 [FIN, ACK] Seq=28 Ack=1 Win=64256 Len=0 TSval=2258829283 TSecr=2347677620"
67,21.862335,192.168.11.37,192.168.11.38,TCP,66,0.001164,,,"6000  >  42114 [FIN, ACK] Seq=1 Ack=29 Win=65152 Len=0 TSval=2347677628 TSecr=2258829283"
68,21.867955,192.168.11.38,192.168.11.37,TCP,66,0.00562,,,42114  >  6000 [ACK] Seq=29 Ack=2 Win=64256 Len=0 TSval=2258829290 TSecr=2347677628
69,29.001349,192.168.11.37,192.168.11.15,TCP,74,7.133394,,,44444  >  6000 [SYN] Seq=0 Win=64240 Len=0 MSS=1460 SACK_PERM TSval=3656011060 TSecr=0 WS=128
70,29.008415,192.168.11.15,192.168.11.37,TCP,74,0.007066,,,"6000  >  44444 [SYN, ACK] Seq=0 Ack=1 Win=65160 Len=0 MSS=1460 SACK_PERM TSval=3138299560 TSecr=3656011060 WS=128"
71,29.008531,192.168.11.37,192.168.11.15,TCP,66,0.000116,,,44444  >  6000 [ACK] Seq=1 Ack=1 Win=64256 Len=0 TSval=3656011067 TSecr=3138299560
72,29.008668,192.168.11.37,192.168.11.15,TCP,93,0.000137,,,"44444  >  6000 [PSH, ACK] Seq=1 Ack=1 Win=64256 Len=27 TSval=3656011067 TSecr=3138299560 [TCP segment of a reassembled PDU]"
73,29.008769,192.168.11.37,192.168.11.15,TCP,66,0.000101,,,"44444  >  6000 [FIN, ACK] Seq=28 Ack=1 Win=64256 Len=0 TSval=3656011068 TSecr=3138299560"
74,29.016636,192.168.11.15,192.168.11.37,TCP,66,0.007867,,,6000  >  44444 [ACK] Seq=1 Ack=28 Win=65152 Len=0 TSval=3138299568 TSecr=3656011067
75,29.016881,192.168.11.15,192.168.11.37,TCP,66,0.000245,,,"6000  >  44444 [FIN, ACK] Seq=1 Ack=29 Win=65152 Len=0 TSval=3138299570 TSecr=3656011068"
76,29.016926,192.168.11.37,192.168.11.15,TCP,66,0.000045,,,44444  >  6000 [ACK] Seq=29 Ack=2 Win=64256 Len=0 TSval=3656011076 TSecr=3138299570
77,29.04625,192.168.11.37,255.255.255.255,UDP,209,0.029324,Ÿ,7b2273656d616e74696373223a207b22656e74697479223a2022504944222c202262617365656e74697479223a2022616e79222c2022726f6c65223a2022363636222c20227370617469616c223a2022616e79222c202274656d706f72616c223a2022616e79227d2c20226461746170726f7065727479223a207b22666f726d6174223a2022696e616f6b615f70726f6772616d5f73616d706c655f73656d616e746963227d7d,36002  >  7000 Len=167
78,29.053624,192.168.11.38,192.168.11.37,TCP,74,0.007374,œ,,58246  >  6000 [SYN] Seq=0 Win=64240 Len=0 MSS=1460 SACK_PERM TSval=2258836476 TSecr=0 WS=128
79,29.053776,192.168.11.37,192.168.11.38,TCP,74,0.000152,,,"6000  >  58246 [SYN, ACK] Seq=0 Ack=1 Win=65160 Len=0 MSS=1460 SACK_PERM TSval=2347684820 TSecr=2258836476 WS=128"
80,29.062042,192.168.11.38,192.168.11.37,TCP,66,0.008266,,,58246  >  6000 [ACK] Seq=1 Ack=1 Win=64256 Len=0 TSval=2258836483 TSecr=2347684820
81,29.062589,192.168.11.38,192.168.11.37,TCP,93,0.000547,,,"58246  >  6000 [PSH, ACK] Seq=1 Ack=1 Win=64256 Len=27 TSval=2258836483 TSecr=2347684820 [TCP segment of a reassembled PDU]"
82,29.062639,192.168.11.38,192.168.11.37,TCP,66,0.00005,,,"58246  >  6000 [FIN, ACK] Seq=28 Ack=1 Win=64256 Len=0 TSval=2258836483 TSecr=2347684820"
83,29.062673,192.168.11.37,192.168.11.38,TCP,66,0.000034,,,6000  >  58246 [ACK] Seq=1 Ack=28 Win=65152 Len=0 TSval=2347684828 TSecr=2258836483
84,29.064162,192.168.11.37,192.168.11.38,TCP,66,0.001489,,,"6000  >  58246 [FIN, ACK] Seq=1 Ack=29 Win=65152 Len=0 TSval=2347684830 TSecr=2258836483"
85,29.070306,192.168.11.38,192.168.11.37,TCP,66,0.006144,,,58246  >  6000 [ACK] Seq=29 Ack=2 Win=64256 Len=0 TSval=2258836492 TSecr=2347684830
86,36.171184,192.168.11.37,192.168.11.15,TCP,74,7.100878,,,38610  >  6000 [SYN] Seq=0 Win=64240 Len=0 MSS=1460 SACK_PERM TSval=3656018230 TSecr=0 WS=128
87,36.178126,192.168.11.15,192.168.11.37,TCP,74,0.006942,,,"6000  >  38610 [SYN, ACK] Seq=0 Ack=1 Win=65160 Len=0 MSS=1460 SACK_PERM TSval=3138306730 TSecr=3656018230 WS=128"
88,36.178246,192.168.11.37,192.168.11.15,TCP,66,0.00012,,,38610  >  6000 [ACK] Seq=1 Ack=1 Win=64256 Len=0 TSval=3656018237 TSecr=3138306730
89,36.178382,192.168.11.37,192.168.11.15,TCP,93,0.000136,,,"38610  >  6000 [PSH, ACK] Seq=1 Ack=1 Win=64256 Len=27 TSval=3656018237 TSecr=3138306730 [TCP segment of a reassembled PDU]"
90,36.178491,192.168.11.37,192.168.11.15,TCP,66,0.000109,,,"38610  >  6000 [FIN, ACK] Seq=28 Ack=1 Win=64256 Len=0 TSval=3656018237 TSecr=3138306730"
91,36.186099,192.168.11.15,192.168.11.37,TCP,66,0.007608,,,6000  >  38610 [ACK] Seq=1 Ack=28 Win=65152 Len=0 TSval=3138306738 TSecr=3656018237
92,36.186316,192.168.11.15,192.168.11.37,TCP,66,0.000217,,,"6000  >  38610 [FIN, ACK] Seq=1 Ack=29 Win=65152 Len=0 TSval=3138306740 TSecr=3656018237"
93,36.186363,192.168.11.37,192.168.11.15,TCP,66,0.000047,,,38610  >  6000 [ACK] Seq=29 Ack=2 Win=64256 Len=0 TSval=3656018245 TSecr=3138306740
94,36.215573,192.168.11.37,255.255.255.255,UDP,209,0.02921,Ÿ,7b2273656d616e74696373223a207b22656e74697479223a2022504944222c202262617365656e74697479223a2022616e79222c2022726f6c65223a2022363636222c20227370617469616c223a2022616e79222c202274656d706f72616c223a2022616e79227d2c20226461746170726f7065727479223a207b22666f726d6174223a2022696e616f6b615f70726f6772616d5f73616d706c655f73656d616e746963227d7d,40644  >  7000 Len=167
95,36.223745,192.168.11.38,192.168.11.37,TCP,74,0.008172,œ,,52932  >  6000 [SYN] Seq=0 Win=64240 Len=0 MSS=1460 SACK_PERM TSval=2258843646 TSecr=0 WS=128
96,36.223883,192.168.11.37,192.168.11.38,TCP,74,0.000138,,,"6000  >  52932 [SYN, ACK] Seq=0 Ack=1 Win=65160 Len=0 MSS=1460 SACK_PERM TSval=2347691990 TSecr=2258843646 WS=128"
97,36.231216,192.168.11.38,192.168.11.37,TCP,66,0.007333,,,52932  >  6000 [ACK] Seq=1 Ack=1 Win=64256 Len=0 TSval=2258843653 TSecr=2347691990
98,36.231853,192.168.11.38,192.168.11.37,TCP,93,0.000637,,,"52932  >  6000 [PSH, ACK] Seq=1 Ack=1 Win=64256 Len=27 TSval=2258843654 TSecr=2347691990 [TCP segment of a reassembled PDU]"
99,36.231973,192.168.11.37,192.168.11.38,TCP,66,0.00012,,,6000  >  52932 [ACK] Seq=1 Ack=28 Win=65152 Len=0 TSval=2347691998 TSecr=2258843654
100,36.232039,192.168.11.38,192.168.11.37,TCP,66,0.000066,,,"52932  >  6000 [FIN, ACK] Seq=28 Ack=1 Win=64256 Len=0 TSval=2258843654 TSecr=2347691990"
101,36.23328,192.168.11.37,192.168.11.38,TCP,66,0.001241,,,"6000  >  52932 [FIN, ACK] Seq=1 Ack=29 Win=65152 Len=0 TSval=2347691999 TSecr=2258843654"
102,36.23939,192.168.11.38,192.168.11.37,TCP,66,0.00611,,,52932  >  6000 [ACK] Seq=29 Ack=2 Win=64256 Len=0 TSval=2258843662 TSecr=2347691999
103,43.383819,192.168.11.37,192.168.11.15,TCP,74,7.144429,,,38618  >  6000 [SYN] Seq=0 Win=64240 Len=0 MSS=1460 SACK_PERM TSval=3656025443 TSecr=0 WS=128
104,43.390813,192.168.11.15,192.168.11.37,TCP,74,0.006994,,,"6000  >  38618 [SYN, ACK] Seq=0 Ack=1 Win=65160 Len=0 MSS=1460 SACK_PERM TSval=3138313943 TSecr=3656025443 WS=128"
105,43.390941,192.168.11.37,192.168.11.15,TCP,66,0.000128,,,38618  >  6000 [ACK] Seq=1 Ack=1 Win=64256 Len=0 TSval=3656025450 TSecr=3138313943
106,43.391081,192.168.11.37,192.168.11.15,TCP,93,0.00014,,,"38618  >  6000 [PSH, ACK] Seq=1 Ack=1 Win=64256 Len=27 TSval=3656025450 TSecr=3138313943 [TCP segment of a reassembled PDU]"
107,43.391184,192.168.11.37,192.168.11.15,TCP,66,0.000103,,,"38618  >  6000 [FIN, ACK] Seq=28 Ack=1 Win=64256 Len=0 TSval=3656025450 TSecr=3138313943"
108,43.399073,192.168.11.15,192.168.11.37,TCP,66,0.007889,,,6000  >  38618 [ACK] Seq=1 Ack=28 Win=65152 Len=0 TSval=3138313951 TSecr=3656025450
109,43.399319,192.168.11.15,192.168.11.37,TCP,66,0.000246,,,"6000  >  38618 [FIN, ACK] Seq=1 Ack=29 Win=65152 Len=0 TSval=3138313953 TSecr=3656025450"
110,43.399382,192.168.11.37,192.168.11.15,TCP,66,0.000063,,,38618  >  6000 [ACK] Seq=29 Ack=2 Win=64256 Len=0 TSval=3656025458 TSecr=3138313953
111,43.431286,192.168.11.37,255.255.255.255,UDP,209,0.031904,Ÿ,7b2273656d616e74696373223a207b22656e74697479223a2022504944222c202262617365656e74697479223a2022616e79222c2022726f6c65223a2022363636222c20227370617469616c223a2022616e79222c202274656d706f72616c223a2022616e79227d2c20226461746170726f7065727479223a207b22666f726d6174223a2022696e616f6b615f70726f6772616d5f73616d706c655f73656d616e746963227d7d,38497  >  7000 Len=167
112,43.43891,192.168.11.38,192.168.11.37,TCP,74,0.007624,œ,,52942  >  6000 [SYN] Seq=0 Win=64240 Len=0 MSS=1460 SACK_PERM TSval=2258850862 TSecr=0 WS=128
113,43.439064,192.168.11.37,192.168.11.38,TCP,74,0.000154,,,"6000  >  52942 [SYN, ACK] Seq=0 Ack=1 Win=65160 Len=0 MSS=1460 SACK_PERM TSval=2347699205 TSecr=2258850862 WS=128"
114,43.455543,192.168.11.38,192.168.11.37,TCP,66,0.016479,,,52942  >  6000 [ACK] Seq=1 Ack=1 Win=64256 Len=0 TSval=2258850869 TSecr=2347699205
115,43.456277,192.168.11.38,192.168.11.37,TCP,93,0.000734,,,"52942  >  6000 [PSH, ACK] Seq=1 Ack=1 Win=64256 Len=27 TSval=2258850869 TSecr=2347699205 [TCP segment of a reassembled PDU]"
116,43.456449,192.168.11.37,192.168.11.38,TCP,66,0.000172,,,6000  >  52942 [ACK] Seq=1 Ack=28 Win=65152 Len=0 TSval=2347699222 TSecr=2258850869
117,43.45655,192.168.11.38,192.168.11.37,TCP,66,0.000101,,,"52942  >  6000 [FIN, ACK] Seq=28 Ack=1 Win=64256 Len=0 TSval=2258850869 TSecr=2347699205"
118,43.457692,192.168.11.37,192.168.11.38,TCP,66,0.001142,,,"6000  >  52942 [FIN, ACK] Seq=1 Ack=29 Win=65152 Len=0 TSval=2347699223 TSecr=2258850869"
119,43.46356,192.168.11.38,192.168.11.37,TCP,66,0.005868,,,52942  >  6000 [ACK] Seq=29 Ack=2 Win=64256 Len=0 TSval=2258850887 TSecr=2347699223
120,50.568876,192.168.11.37,192.168.11.15,TCP,74,7.105316,,,38134  >  6000 [SYN] Seq=0 Win=64240 Len=0 MSS=1460 SACK_PERM TSval=3656032628 TSecr=0 WS=128
121,50.575869,192.168.11.15,192.168.11.37,TCP,74,0.006993,,,"6000  >  38134 [SYN, ACK] Seq=0 Ack=1 Win=65160 Len=0 MSS=1460 SACK_PERM TSval=3138321129 TSecr=3656032628 WS=128"
122,50.575983,192.168.11.37,192.168.11.15,TCP,66,0.000114,,,38134  >  6000 [ACK] Seq=1 Ack=1 Win=64256 Len=0 TSval=3656032635 TSecr=3138321129
123,50.576131,192.168.11.37,192.168.11.15,TCP,93,0.000148,,,"38134  >  6000 [PSH, ACK] Seq=1 Ack=1 Win=64256 Len=27 TSval=3656032635 TSecr=3138321129 [TCP segment of a reassembled PDU]"
124,50.576255,192.168.11.37,192.168.11.15,TCP,66,0.000124,,,"38134  >  6000 [FIN, ACK] Seq=28 Ack=1 Win=64256 Len=0 TSval=3656032635 TSecr=3138321129"
125,50.58374,192.168.11.15,192.168.11.37,TCP,66,0.007485,,,6000  >  38134 [ACK] Seq=1 Ack=28 Win=65152 Len=0 TSval=3138321136 TSecr=3656032635
126,50.584134,192.168.11.15,192.168.11.37,TCP,66,0.000394,,,"6000  >  38134 [FIN, ACK] Seq=1 Ack=29 Win=65152 Len=0 TSval=3138321138 TSecr=3656032635"
127,50.584189,192.168.11.37,192.168.11.15,TCP,66,0.000055,,,38134  >  6000 [ACK] Seq=29 Ack=2 Win=64256 Len=0 TSval=3656032643 TSecr=3138321138
128,50.614157,192.168.11.37,255.255.255.255,UDP,209,0.029968,Ÿ,7b2273656d616e74696373223a207b22656e74697479223a2022504944222c202262617365656e74697479223a2022616e79222c2022726f6c65223a2022363636222c20227370617469616c223a2022616e79222c202274656d706f72616c223a2022616e79227d2c20226461746170726f7065727479223a207b22666f726d6174223a2022696e616f6b615f70726f6772616d5f73616d706c655f73656d616e746963227d7d,56167  >  7000 Len=167
129,50.62226,192.168.11.38,192.168.11.37,TCP,74,0.008103,œ,,50548  >  6000 [SYN] Seq=0 Win=64240 Len=0 MSS=1460 SACK_PERM TSval=2258858046 TSecr=0 WS=128
130,50.622436,192.168.11.37,192.168.11.38,TCP,74,0.000176,,,"6000  >  50548 [SYN, ACK] Seq=0 Ack=1 Win=65160 Len=0 MSS=1460 SACK_PERM TSval=2347706388 TSecr=2258858046 WS=128"
131,50.629033,192.168.11.38,192.168.11.37,TCP,66,0.006597,,,50548  >  6000 [ACK] Seq=1 Ack=1 Win=64256 Len=0 TSval=2258858052 TSecr=2347706388
132,50.62965,192.168.11.38,192.168.11.37,TCP,93,0.000617,,,"50548  >  6000 [PSH, ACK] Seq=1 Ack=1 Win=64256 Len=27 TSval=2258858052 TSecr=2347706388 [TCP segment of a reassembled PDU]"
133,50.629779,192.168.11.37,192.168.11.38,TCP,66,0.000129,,,6000  >  50548 [ACK] Seq=1 Ack=28 Win=65152 Len=0 TSval=2347706395 TSecr=2258858052
134,50.629857,192.168.11.38,192.168.11.37,TCP,66,0.000078,,,"50548  >  6000 [FIN, ACK] Seq=28 Ack=1 Win=64256 Len=0 TSval=2258858053 TSecr=2347706388"
135,50.631141,192.168.11.37,192.168.11.38,TCP,66,0.001284,,,"6000  >  50548 [FIN, ACK] Seq=1 Ack=29 Win=65152 Len=0 TSval=2347706397 TSecr=2258858053"
136,50.63647,192.168.11.38,192.168.11.37,TCP,66,0.005329,,,50548  >  6000 [ACK] Seq=29 Ack=2 Win=64256 Len=0 TSval=2258858060 TSecr=2347706397
137,57.715651,192.168.11.37,192.168.11.15,TCP,74,7.079181,,,58186  >  6000 [SYN] Seq=0 Win=64240 Len=0 MSS=1460 SACK_PERM TSval=3656039774 TSecr=0 WS=128
138,57.722452,192.168.11.15,192.168.11.37,TCP,74,0.006801,,,"6000  >  58186 [SYN, ACK] Seq=0 Ack=1 Win=65160 Len=0 MSS=1460 SACK_PERM TSval=3138328276 TSecr=3656039774 WS=128"
139,57.722578,192.168.11.37,192.168.11.15,TCP,66,0.000126,,,58186  >  6000 [ACK] Seq=1 Ack=1 Win=64256 Len=0 TSval=3656039781 TSecr=3138328276
140,57.722909,192.168.11.37,192.168.11.15,TCP,93,0.000331,,,"58186  >  6000 [PSH, ACK] Seq=1 Ack=1 Win=64256 Len=27 TSval=3656039782 TSecr=3138328276 [TCP segment of a reassembled PDU]"
141,57.723023,192.168.11.37,192.168.11.15,TCP,66,0.000114,,,"58186  >  6000 [FIN, ACK] Seq=28 Ack=1 Win=64256 Len=0 TSval=3656039782 TSecr=3138328276"
142,57.730695,192.168.11.15,192.168.11.37,TCP,66,0.007672,,,6000  >  58186 [ACK] Seq=1 Ack=28 Win=65152 Len=0 TSval=3138328283 TSecr=3656039782
143,57.731003,192.168.11.15,192.168.11.37,TCP,66,0.000308,,,"6000  >  58186 [FIN, ACK] Seq=1 Ack=29 Win=65152 Len=0 TSval=3138328285 TSecr=3656039782"
144,57.731051,192.168.11.37,192.168.11.15,TCP,66,0.000048,,,58186  >  6000 [ACK] Seq=29 Ack=2 Win=64256 Len=0 TSval=3656039790 TSecr=3138328285
145,57.763026,192.168.11.37,255.255.255.255,UDP,209,0.031975,Ÿ,7b2273656d616e74696373223a207b22656e74697479223a2022504944222c202262617365656e74697479223a2022616e79222c2022726f6c65223a2022363636222c20227370617469616c223a2022616e79222c202274656d706f72616c223a2022616e79227d2c20226461746170726f7065727479223a207b22666f726d6174223a2022696e616f6b615f70726f6772616d5f73616d706c655f73656d616e746963227d7d,57800  >  7000 Len=167
146,57.771092,192.168.11.38,192.168.11.37,TCP,74,0.008066,œ,,59734  >  6000 [SYN] Seq=0 Win=64240 Len=0 MSS=1460 SACK_PERM TSval=2258865194 TSecr=0 WS=128
147,57.771259,192.168.11.37,192.168.11.38,TCP,74,0.000167,,,"6000  >  59734 [SYN, ACK] Seq=0 Ack=1 Win=65160 Len=0 MSS=1460 SACK_PERM TSval=2347713537 TSecr=2258865194 WS=128"
148,57.778034,192.168.11.38,192.168.11.37,TCP,66,0.006775,,,59734  >  6000 [ACK] Seq=1 Ack=1 Win=64256 Len=0 TSval=2258865201 TSecr=2347713537
149,57.779295,192.168.11.38,192.168.11.37,TCP,93,0.001261,,,"59734  >  6000 [PSH, ACK] Seq=1 Ack=1 Win=64256 Len=27 TSval=2258865202 TSecr=2347713537 [TCP segment of a reassembled PDU]"
150,57.77943,192.168.11.37,192.168.11.38,TCP,66,0.000135,,,6000  >  59734 [ACK] Seq=1 Ack=28 Win=65152 Len=0 TSval=2347713545 TSecr=2258865202
151,57.779515,192.168.11.38,192.168.11.37,TCP,66,0.000085,,,"59734  >  6000 [FIN, ACK] Seq=28 Ack=1 Win=64256 Len=0 TSval=2258865202 TSecr=2347713537"
152,57.780558,192.168.11.37,192.168.11.38,TCP,66,0.001043,,,"6000  >  59734 [FIN, ACK] Seq=1 Ack=29 Win=65152 Len=0 TSval=2347713546 TSecr=2258865202"
153,57.786663,192.168.11.38,192.168.11.37,TCP,66,0.006105,,,59734  >  6000 [ACK] Seq=29 Ack=2 Win=64256 Len=0 TSval=2258865210 TSecr=2347713546
154,64.860397,192.168.11.37,192.168.11.15,TCP,74,7.073734,,,58192  >  6000 [SYN] Seq=0 Win=64240 Len=0 MSS=1460 SACK_PERM TSval=3656046919 TSecr=0 WS=128
155,64.866938,192.168.11.15,192.168.11.37,TCP,74,0.006541,,,"6000  >  58192 [SYN, ACK] Seq=0 Ack=1 Win=65160 Len=0 MSS=1460 SACK_PERM TSval=3138335420 TSecr=3656046919 WS=128"
156,64.867058,192.168.11.37,192.168.11.15,TCP,66,0.00012,,,58192  >  6000 [ACK] Seq=1 Ack=1 Win=64256 Len=0 TSval=3656046926 TSecr=3138335420
157,64.867222,192.168.11.37,192.168.11.15,TCP,93,0.000164,,,"58192  >  6000 [PSH, ACK] Seq=1 Ack=1 Win=64256 Len=27 TSval=3656046926 TSecr=3138335420 [TCP segment of a reassembled PDU]"
158,64.867316,192.168.11.37,192.168.11.15,TCP,66,0.000094,,,"58192  >  6000 [FIN, ACK] Seq=28 Ack=1 Win=64256 Len=0 TSval=3656046926 TSecr=3138335420"
159,64.874327,192.168.11.15,192.168.11.37,TCP,66,0.007011,,,6000  >  58192 [ACK] Seq=1 Ack=28 Win=65152 Len=0 TSval=3138335428 TSecr=3656046926
160,64.87469,192.168.11.15,192.168.11.37,TCP,66,0.000363,,,"6000  >  58192 [FIN, ACK] Seq=1 Ack=29 Win=65152 Len=0 TSval=3138335429 TSecr=3656046926"
161,64.874769,192.168.11.37,192.168.11.15,TCP,66,0.000079,,,58192  >  6000 [ACK] Seq=29 Ack=2 Win=64256 Len=0 TSval=3656046933 TSecr=3138335429
162,64.903223,192.168.11.37,255.255.255.255,UDP,209,0.028454,Ÿ,7b2273656d616e74696373223a207b22656e74697479223a2022504944222c202262617365656e74697479223a2022616e79222c2022726f6c65223a2022363636222c20227370617469616c223a2022616e79222c202274656d706f72616c223a2022616e79227d2c20226461746170726f7065727479223a207b22666f726d6174223a2022696e616f6b615f70726f6772616d5f73616d706c655f73656d616e746963227d7d,42957  >  7000 Len=167
163,64.910605,192.168.11.38,192.168.11.37,TCP,74,0.007382,œ,,59744  >  6000 [SYN] Seq=0 Win=64240 Len=0 MSS=1460 SACK_PERM TSval=2258872334 TSecr=0 WS=128
164,64.910793,192.168.11.37,192.168.11.38,TCP,74,0.000188,,,"6000  >  59744 [SYN, ACK] Seq=0 Ack=1 Win=65160 Len=0 MSS=1460 SACK_PERM TSval=2347720677 TSecr=2258872334 WS=128"
165,64.917553,192.168.11.38,192.168.11.37,TCP,66,0.00676,,,59744  >  6000 [ACK] Seq=1 Ack=1 Win=64256 Len=0 TSval=2258872341 TSecr=2347720677
166,64.918165,192.168.11.38,192.168.11.37,TCP,93,0.000612,,,"59744  >  6000 [PSH, ACK] Seq=1 Ack=1 Win=64256 Len=27 TSval=2258872341 TSecr=2347720677 [TCP segment of a reassembled PDU]"
167,64.918279,192.168.11.37,192.168.11.38,TCP,66,0.000114,,,6000  >  59744 [ACK] Seq=1 Ack=28 Win=65152 Len=0 TSval=2347720684 TSecr=2258872341
168,64.918351,192.168.11.38,192.168.11.37,TCP,66,0.000072,,,"59744  >  6000 [FIN, ACK] Seq=28 Ack=1 Win=64256 Len=0 TSval=2258872341 TSecr=2347720677"
169,64.919789,192.168.11.37,192.168.11.38,TCP,66,0.001438,,,"6000  >  59744 [FIN, ACK] Seq=1 Ack=29 Win=65152 Len=0 TSval=2347720686 TSecr=2258872341"
170,64.929347,192.168.11.38,192.168.11.37,TCP,66,0.009558,,,59744  >  6000 [ACK] Seq=29 Ack=2 Win=64256 Len=0 TSval=2258872353 TSecr=2347720686
171,110.535023,192.168.11.37,192.168.11.15,TCP,74,45.605676,,,39002  >  6000 [SYN] Seq=0 Win=64240 Len=0 MSS=1460 SACK_PERM TSval=3656092594 TSecr=0 WS=128
172,110.541875,192.168.11.15,192.168.11.37,TCP,74,0.006852,,,"6000  >  39002 [SYN, ACK] Seq=0 Ack=1 Win=65160 Len=0 MSS=1460 SACK_PERM TSval=3138381097 TSecr=3656092594 WS=128"
173,110.541992,192.168.11.37,192.168.11.15,TCP,66,0.000117,,,39002  >  6000 [ACK] Seq=1 Ack=1 Win=64256 Len=0 TSval=3656092601 TSecr=3138381097
174,110.54226,192.168.11.37,192.168.11.15,TCP,93,0.000268,,,"39002  >  6000 [PSH, ACK] Seq=1 Ack=1 Win=64256 Len=27 TSval=3656092601 TSecr=3138381097 [TCP segment of a reassembled PDU]"
175,110.542391,192.168.11.37,192.168.11.15,TCP,66,0.000131,,,"39002  >  6000 [FIN, ACK] Seq=28 Ack=1 Win=64256 Len=0 TSval=3656092601 TSecr=3138381097"
176,110.549372,192.168.11.15,192.168.11.37,TCP,66,0.006981,,,6000  >  39002 [ACK] Seq=1 Ack=28 Win=65152 Len=0 TSval=3138381104 TSecr=3656092601
177,110.549596,192.168.11.15,192.168.11.37,TCP,66,0.000224,,,"6000  >  39002 [FIN, ACK] Seq=1 Ack=29 Win=65152 Len=0 TSval=3138381106 TSecr=3656092601"
178,110.549641,192.168.11.37,192.168.11.15,TCP,66,0.000045,,,39002  >  6000 [ACK] Seq=29 Ack=2 Win=64256 Len=0 TSval=3656092608 TSecr=3138381106
179,110.579674,192.168.11.37,255.255.255.255,UDP,209,0.030033,Ÿ,7b2273656d616e74696373223a207b22656e74697479223a2022504944222c202262617365656e74697479223a2022616e79222c2022726f6c65223a2022363636222c20227370617469616c223a2022616e79222c202274656d706f72616c223a2022616e79227d2c20226461746170726f7065727479223a207b22666f726d6174223a2022696e616f6b615f70726f6772616d5f73616d706c655f73656d616e746963227d7d,53480  >  7000 Len=167
180,110.587689,192.168.11.38,192.168.11.37,TCP,74,0.008015,œ,,38682  >  6000 [SYN] Seq=0 Win=64240 Len=0 MSS=1460 SACK_PERM TSval=2258918013 TSecr=0 WS=128
181,110.58786,192.168.11.37,192.168.11.38,TCP,74,0.000171,,,"6000  >  38682 [SYN, ACK] Seq=0 Ack=1 Win=65160 Len=0 MSS=1460 SACK_PERM TSval=2347766354 TSecr=2258918013 WS=128"
182,110.597131,192.168.11.38,192.168.11.37,TCP,66,0.009271,,,38682  >  6000 [ACK] Seq=1 Ack=1 Win=64256 Len=0 TSval=2258918022 TSecr=2347766354
183,110.597732,192.168.11.38,192.168.11.37,TCP,93,0.000601,,,"38682  >  6000 [PSH, ACK] Seq=1 Ack=1 Win=64256 Len=27 TSval=2258918022 TSecr=2347766354 [TCP segment of a reassembled PDU]"
184,110.597815,192.168.11.37,192.168.11.38,TCP,66,0.000083,,,6000  >  38682 [ACK] Seq=1 Ack=28 Win=65152 Len=0 TSval=2347766364 TSecr=2258918022
185,110.597884,192.168.11.38,192.168.11.37,TCP,66,0.000069,,,"38682  >  6000 [FIN, ACK] Seq=28 Ack=1 Win=64256 Len=0 TSval=2258918022 TSecr=2347766354"
186,110.600324,192.168.11.37,192.168.11.38,TCP,66,0.00244,,,"6000  >  38682 [FIN, ACK] Seq=1 Ack=29 Win=65152 Len=0 TSval=2347766366 TSecr=2258918022"
187,110.607426,192.168.11.38,192.168.11.37,TCP,66,0.007102,,,38682  >  6000 [ACK] Seq=29 Ack=2 Win=64256 Len=0 TSval=2258918032 TSecr=2347766366
188,117.702851,192.168.11.37,192.168.11.15,TCP,74,7.095425,,,53566  >  6000 [SYN] Seq=0 Win=64240 Len=0 MSS=1460 SACK_PERM TSval=3656099762 TSecr=0 WS=128
189,117.709592,192.168.11.15,192.168.11.37,TCP,74,0.006741,,,"6000  >  53566 [SYN, ACK] Seq=0 Ack=1 Win=65160 Len=0 MSS=1460 SACK_PERM TSval=3138388265 TSecr=3656099762 WS=128"
190,117.709699,192.168.11.37,192.168.11.15,TCP,66,0.000107,,,53566  >  6000 [ACK] Seq=1 Ack=1 Win=64256 Len=0 TSval=3656099768 TSecr=3138388265
191,117.709901,192.168.11.37,192.168.11.15,TCP,93,0.000202,,,"53566  >  6000 [PSH, ACK] Seq=1 Ack=1 Win=64256 Len=27 TSval=3656099769 TSecr=3138388265 [TCP segment of a reassembled PDU]"
192,117.710003,192.168.11.37,192.168.11.15,TCP,66,0.000102,,,"53566  >  6000 [FIN, ACK] Seq=28 Ack=1 Win=64256 Len=0 TSval=3656099769 TSecr=3138388265"
193,117.724244,192.168.11.15,192.168.11.37,TCP,66,0.014241,,,6000  >  53566 [ACK] Seq=1 Ack=28 Win=65152 Len=0 TSval=3138388279 TSecr=3656099769
194,117.724492,192.168.11.15,192.168.11.37,TCP,66,0.000248,,,"6000  >  53566 [FIN, ACK] Seq=1 Ack=29 Win=65152 Len=0 TSval=3138388281 TSecr=3656099769"
195,117.724534,192.168.11.37,192.168.11.15,TCP,66,0.000042,,,53566  >  6000 [ACK] Seq=29 Ack=2 Win=64256 Len=0 TSval=3656099783 TSecr=3138388281
196,117.753742,192.168.11.37,255.255.255.255,UDP,209,0.029208,Ÿ,7b2273656d616e74696373223a207b22656e74697479223a2022504944222c202262617365656e74697479223a2022616e79222c2022726f6c65223a2022363636222c20227370617469616c223a2022616e79222c202274656d706f72616c223a2022616e79227d2c20226461746170726f7065727479223a207b22666f726d6174223a2022696e616f6b615f70726f6772616d5f73616d706c655f73656d616e746963227d7d,47877  >  7000 Len=167
197,117.765295,192.168.11.38,192.168.11.37,TCP,74,0.011553,œ,,47006  >  6000 [SYN] Seq=0 Win=64240 Len=0 MSS=1460 SACK_PERM TSval=2258925190 TSecr=0 WS=128
198,117.765511,192.168.11.37,192.168.11.38,TCP,74,0.000216,,,"6000  >  47006 [SYN, ACK] Seq=0 Ack=1 Win=65160 Len=0 MSS=1460 SACK_PERM TSval=2347773531 TSecr=2258925190 WS=128"
199,117.772305,192.168.11.38,192.168.11.37,TCP,66,0.006794,,,47006  >  6000 [ACK] Seq=1 Ack=1 Win=64256 Len=0 TSval=2258925198 TSecr=2347773531
200,117.773308,192.168.11.38,192.168.11.37,TCP,93,0.001003,,,"47006  >  6000 [PSH, ACK] Seq=1 Ack=1 Win=64256 Len=27 TSval=2258925198 TSecr=2347773531 [TCP segment of a reassembled PDU]"
201,117.773521,192.168.11.37,192.168.11.38,TCP,66,0.000213,,,6000  >  47006 [ACK] Seq=1 Ack=28 Win=65152 Len=0 TSval=2347773539 TSecr=2258925198
202,117.773688,192.168.11.38,192.168.11.37,TCP,66,0.000167,,,"47006  >  6000 [FIN, ACK] Seq=28 Ack=1 Win=64256 Len=0 TSval=2258925198 TSecr=2347773531"
203,117.776257,192.168.11.37,192.168.11.38,TCP,66,0.002569,,,"6000  >  47006 [FIN, ACK] Seq=1 Ack=29 Win=65152 Len=0 TSval=2347773542 TSecr=2258925198"
204,117.783315,192.168.11.38,192.168.11.37,TCP,66,0.007058,,,47006  >  6000 [ACK] Seq=29 Ack=2 Win=64256 Len=0 TSval=2258925209 TSecr=2347773542
205,124.939038,192.168.11.37,192.168.11.15,TCP,74,7.155723,,,53576  >  6000 [SYN] Seq=0 Win=64240 Len=0 MSS=1460 SACK_PERM TSval=3656106998 TSecr=0 WS=128
206,124.94614,192.168.11.15,192.168.11.37,TCP,74,0.007102,,,"6000  >  53576 [SYN, ACK] Seq=0 Ack=1 Win=65160 Len=0 MSS=1460 SACK_PERM TSval=3138395502 TSecr=3656106998 WS=128"
207,124.946246,192.168.11.37,192.168.11.15,TCP,66,0.000106,,,53576  >  6000 [ACK] Seq=1 Ack=1 Win=64256 Len=0 TSval=3656107005 TSecr=3138395502
208,124.946444,192.168.11.37,192.168.11.15,TCP,93,0.000198,,,"53576  >  6000 [PSH, ACK] Seq=1 Ack=1 Win=64256 Len=27 TSval=3656107005 TSecr=3138395502 [TCP segment of a reassembled PDU]"
209,124.946553,192.168.11.37,192.168.11.15,TCP,66,0.000109,,,"53576  >  6000 [FIN, ACK] Seq=28 Ack=1 Win=64256 Len=0 TSval=3656107005 TSecr=3138395502"
210,124.953947,192.168.11.15,192.168.11.37,TCP,66,0.007394,,,6000  >  53576 [ACK] Seq=1 Ack=28 Win=65152 Len=0 TSval=3138395509 TSecr=3656107005
211,124.955992,192.168.11.15,192.168.11.37,TCP,66,0.002045,,,"6000  >  53576 [FIN, ACK] Seq=1 Ack=29 Win=65152 Len=0 TSval=3138395511 TSecr=3656107005"
212,124.95604,192.168.11.37,192.168.11.15,TCP,66,0.000048,,,53576  >  6000 [ACK] Seq=29 Ack=2 Win=64256 Len=0 TSval=3656107015 TSecr=3138395511
213,124.985237,192.168.11.37,255.255.255.255,UDP,209,0.029197,Ÿ,7b2273656d616e74696373223a207b22656e74697479223a2022504944222c202262617365656e74697479223a2022616e79222c2022726f6c65223a2022363636222c20227370617469616c223a2022616e79222c202274656d706f72616c223a2022616e79227d2c20226461746170726f7065727479223a207b22666f726d6174223a2022696e616f6b615f70726f6772616d5f73616d706c655f73656d616e746963227d7d,52879  >  7000 Len=167
214,124.993248,192.168.11.38,192.168.11.37,TCP,74,0.008011,œ,,47014  >  6000 [SYN] Seq=0 Win=64240 Len=0 MSS=1460 SACK_PERM TSval=2258932419 TSecr=0 WS=128
215,124.993425,192.168.11.37,192.168.11.38,TCP,74,0.000177,,,"6000  >  47014 [SYN, ACK] Seq=0 Ack=1 Win=65160 Len=0 MSS=1460 SACK_PERM TSval=2347780759 TSecr=2258932419 WS=128"
216,125.002955,192.168.11.38,192.168.11.37,TCP,66,0.00953,,,47014  >  6000 [ACK] Seq=1 Ack=1 Win=64256 Len=0 TSval=2258932428 TSecr=2347780759
217,125.003918,192.168.11.38,192.168.11.37,TCP,93,0.000963,,,"47014  >  6000 [PSH, ACK] Seq=1 Ack=1 Win=64256 Len=27 TSval=2258932428 TSecr=2347780759 [TCP segment of a reassembled PDU]"
218,125.004136,192.168.11.37,192.168.11.38,TCP,66,0.000218,,,6000  >  47014 [ACK] Seq=1 Ack=28 Win=65152 Len=0 TSval=2347780770 TSecr=2258932428
219,125.004292,192.168.11.38,192.168.11.37,TCP,66,0.000156,,,"47014  >  6000 [FIN, ACK] Seq=28 Ack=1 Win=64256 Len=0 TSval=2258932429 TSecr=2347780759"
220,125.0069,192.168.11.37,192.168.11.38,TCP,66,0.002608,,,"6000  >  47014 [FIN, ACK] Seq=1 Ack=29 Win=65152 Len=0 TSval=2347780772 TSecr=2258932429"
221,125.013827,192.168.11.38,192.168.11.37,TCP,66,0.006927,,,47014  >  6000 [ACK] Seq=29 Ack=2 Win=64256 Len=0 TSval=2258932439 TSecr=2347780772
222,132.110927,192.168.11.37,192.168.11.15,TCP,74,7.0971,,,59096  >  6000 [SYN] Seq=0 Win=64240 Len=0 MSS=1460 SACK_PERM TSval=3656114170 TSecr=0 WS=128
223,132.117778,192.168.11.15,192.168.11.37,TCP,74,0.006851,,,"6000  >  59096 [SYN, ACK] Seq=0 Ack=1 Win=65160 Len=0 MSS=1460 SACK_PERM TSval=3138402673 TSecr=3656114170 WS=128"
224,132.117892,192.168.11.37,192.168.11.15,TCP,66,0.000114,,,59096  >  6000 [ACK] Seq=1 Ack=1 Win=64256 Len=0 TSval=3656114177 TSecr=3138402673
225,132.118096,192.168.11.37,192.168.11.15,TCP,93,0.000204,,,"59096  >  6000 [PSH, ACK] Seq=1 Ack=1 Win=64256 Len=27 TSval=3656114177 TSecr=3138402673 [TCP segment of a reassembled PDU]"
226,132.118203,192.168.11.37,192.168.11.15,TCP,66,0.000107,,,"59096  >  6000 [FIN, ACK] Seq=28 Ack=1 Win=64256 Len=0 TSval=3656114177 TSecr=3138402673"
227,132.125484,192.168.11.15,192.168.11.37,TCP,66,0.007281,,,6000  >  59096 [ACK] Seq=1 Ack=28 Win=65152 Len=0 TSval=3138402681 TSecr=3656114177
228,132.127535,192.168.11.15,192.168.11.37,TCP,66,0.002051,,,"6000  >  59096 [FIN, ACK] Seq=1 Ack=29 Win=65152 Len=0 TSval=3138402683 TSecr=3656114177"
229,132.12759,192.168.11.37,192.168.11.15,TCP,66,0.000055,,,59096  >  6000 [ACK] Seq=29 Ack=2 Win=64256 Len=0 TSval=3656114186 TSecr=3138402683
230,132.156858,192.168.11.37,255.255.255.255,UDP,209,0.029268,Ÿ,7b2273656d616e74696373223a207b22656e74697479223a2022504944222c202262617365656e74697479223a2022616e79222c2022726f6c65223a2022363636222c20227370617469616c223a2022616e79222c202274656d706f72616c223a2022616e79227d2c20226461746170726f7065727479223a207b22666f726d6174223a2022696e616f6b615f70726f6772616d5f73616d706c655f73656d616e746963227d7d,55415  >  7000 Len=167
231,132.166278,192.168.11.38,192.168.11.37,TCP,74,0.00942,œ,,59726  >  6000 [SYN] Seq=0 Win=64240 Len=0 MSS=1460 SACK_PERM TSval=2258939590 TSecr=0 WS=128
