No.,Time,Source,Destination,Protocol,Length,Time delta from previous captured frame,XXX,Data,Info
1,0,192.168.11.38,192.168.11.37,TCP,74,0,,,40504  >  6000 [SYN] Seq=0 Win=64240 Len=0 MSS=1460 SACK_PERM TSval=2258807477 TSecr=0 WS=128
2,0.007269,192.168.11.37,192.168.11.38,TCP,74,0.007269,,,"6000  >  40504 [SYN, ACK] Seq=0 Ack=1 Win=65160 Len=0 MSS=1460 SACK_PERM TSval=2347655826 TSecr=2258807477 WS=128"
3,0.007376,192.168.11.38,192.168.11.37,TCP,66,0.000107,,,40504  >  6000 [ACK] Seq=1 Ack=1 Win=64256 Len=0 TSval=2258807489 TSecr=2347655826
4,0.007649,192.168.11.38,192.168.11.37,TCP,93,0.000273,,,"40504  >  6000 [PSH, ACK] Seq=1 Ack=1 Win=64256 Len=27 TSval=2258807489 TSecr=2347655826 [TCP segment of a reassembled PDU]"
5,0.00779,192.168.11.38,192.168.11.37,TCP,66,0.000141,,,"40504  >  6000 [FIN, ACK] Seq=28 Ack=1 Win=64256 Len=0 TSval=2258807489 TSecr=2347655826"
6,0.021986,192.168.11.37,192.168.11.38,TCP,66,0.014196,,,6000  >  40504 [ACK] Seq=1 Ack=28 Win=65152 Len=0 TSval=2347655841 TSecr=2258807489
7,0.022362,192.168.11.37,192.168.11.38,TCP,66,0.000376,,,"6000  >  40504 [FIN, ACK] Seq=1 Ack=29 Win=65152 Len=0 TSval=2347655843 TSecr=2258807489"
8,0.022411,192.168.11.38,192.168.11.37,TCP,66,0.000049,,,40504  >  6000 [ACK] Seq=29 Ack=2 Win=64256 Len=0 TSval=2258807504 TSecr=2347655843
9,0.050187,192.168.11.38,255.255.255.255,UDP,209,0.027776,Ÿ,7b2273656d616e74696373223a207b22656e74697479223a2022504944222c202262617365656e74697479223a2022616e79222c2022726f6c65223a2022373737222c20227370617469616c223a2022616e79222c202274656d706f72616c223a2022616e79227d2c20226461746170726f7065727479223a207b22666f726d6174223a2022696e616f6b615f70726f6772616d5f73616d706c655f73656d616e746963227d7d,38163  >  7000 Len=167
10,0.061227,192.168.11.39,192.168.11.38,TCP,74,0.01104,œ,,49796  >  6000 [SYN] Seq=0 Win=64240 Len=0 MSS=1460 SACK_PERM TSval=1381497371 TSecr=0 WS=128
11,0.061357,192.168.11.38,192.168.11.39,TCP,74,0.00013,,,"6000  >  49796 [SYN, ACK] Seq=0 Ack=1 Win=65160 Len=0 MSS=1460 SACK_PERM TSval=3840474220 TSecr=1381497371 WS=128"
12,0.068142,192.168.11.39,192.168.11.38,TCP,66,0.006785,,,49796  >  6000 [ACK] Seq=1 Ack=1 Win=64256 Len=0 TSval=1381497381 TSecr=3840474220
13,0.068577,192.168.11.39,192.168.11.38,TCP,93,0.000435,,,"49796  >  6000 [PSH, ACK] Seq=1 Ack=1 Win=64256 Len=27 TSval=1381497381 TSecr=3840474220 [TCP segment of a reassembled PDU]"
14,0.068633,192.168.11.38,192.168.11.39,TCP,66,0.000056,,,6000  >  49796 [ACK] Seq=1 Ack=28 Win=65152 Len=0 TSval=3840474227 TSecr=1381497381
15,0.068688,192.168.11.39,192.168.11.38,TCP,66,0.000055,,,"49796  >  6000 [FIN, ACK] Seq=28 Ack=1 Win=64256 Len=0 TSval=1381497381 TSecr=3840474220"
16,0.070262,192.168.11.38,192.168.11.39,TCP,66,0.001574,,,"6000  >  49796 [FIN, ACK] Seq=1 Ack=29 Win=65152 Len=0 TSval=3840474229 TSecr=1381497381"
17,0.076057,192.168.11.39,192.168.11.38,TCP,66,0.005795,,,49796  >  6000 [ACK] Seq=29 Ack=2 Win=64256 Len=0 TSval=1381497389 TSecr=3840474229
18,7.264349,192.168.11.38,192.168.11.37,TCP,74,7.188292,,,49310  >  6000 [SYN] Seq=0 Win=64240 Len=0 MSS=1460 SACK_PERM TSval=2258814746 TSecr=0 WS=128
19,7.272844,192.168.11.37,192.168.11.38,TCP,74,0.008495,,,"6000  >  49310 [SYN, ACK] Seq=0 Ack=1 Win=65160 Len=0 MSS=1460 SACK_PERM TSval=2347663090 TSecr=2258814746 WS=128"
20,7.272941,192.168.11.38,192.168.11.37,TCP,66,0.000097,,,49310  >  6000 [ACK] Seq=1 Ack=1 Win=64256 Len=0 TSval=2258814755 TSecr=2347663090
21,7.273102,192.168.11.38,192.168.11.37,TCP,93,0.000161,,,"49310  >  6000 [PSH, ACK] Seq=1 Ack=1 Win=64256 Len=27 TSval=2258814755 TSecr=2347663090 [TCP segment of a reassembled PDU]"
22,7.273217,192.168.11.38,192.168.11.37,TCP,66,0.000115,,,"49310  >  6000 [FIN, ACK] Seq=28 Ack=1 Win=64256 Len=0 TSval=2258814755 TSecr=2347663090"
23,7.281267,192.168.11.37,192.168.11.38,TCP,66,0.00805,,,6000  >  49310 [ACK] Seq=1 Ack=28 Win=65152 Len=0 TSval=2347663100 TSecr=2258814755
24,7.281493,192.168.11.37,192.168.11.38,TCP,66,0.000226,,,"6000  >  49310 [FIN, ACK] Seq=1 Ack=29 Win=65152 Len=0 TSval=2347663102 TSecr=2258814755"
25,7.281536,192.168.11.38,192.168.11.37,TCP,66,0.000043,,,49310  >  6000 [ACK] Seq=29 Ack=2 Win=64256 Len=0 TSval=2258814763 TSecr=2347663102
26,7.311903,192.168.11.38,255.255.255.255,UDP,209,0.030367,Ÿ,7b2273656d616e74696373223a207b22656e74697479223a2022504944222c202262617365656e74697479223a2022616e79222c2022726f6c65223a2022373737222c20227370617469616c223a2022616e79222c202274656d706f72616c223a2022616e79227d2c20226461746170726f7065727479223a207b22666f726d6174223a2022696e616f6b615f70726f6772616d5f73616d706c655f73656d616e746963227d7d,34893  >  7000 Len=167
27,7.334363,192.168.11.39,192.168.11.38,TCP,74,0.02246,œ,,41988  >  6000 [SYN] Seq=0 Win=64240 Len=0 MSS=1460 SACK_PERM TSval=1381504638 TSecr=0 WS=128
28,7.334488,192.168.11.38,192.168.11.39,TCP,74,0.000125,,,"6000  >  41988 [SYN, ACK] Seq=0 Ack=1 Win=65160 Len=0 MSS=1460 SACK_PERM TSval=3840481493 TSecr=1381504638 WS=128"
29,7.341155,192.168.11.39,192.168.11.38,TCP,66,0.006667,,,41988  >  6000 [ACK] Seq=1 Ack=1 Win=64256 Len=0 TSval=1381504654 TSecr=3840481493
30,7.341597,192.168.11.39,192.168.11.38,TCP,93,0.000442,,,"41988  >  6000 [PSH, ACK] Seq=1 Ack=1 Win=64256 Len=27 TSval=1381504655 TSecr=3840481493 [TCP segment of a reassembled PDU]"
31,7.341644,192.168.11.38,192.168.11.39,TCP,66,0.000047,,,6000  >  41988 [ACK] Seq=1 Ack=28 Win=65152 Len=0 TSval=3840481500 TSecr=1381504655
32,7.341702,192.168.11.39,192.168.11.38,TCP,66,0.000058,,,"41988  >  6000 [FIN, ACK] Seq=28 Ack=1 Win=64256 Len=0 TSval=1381504655 TSecr=3840481493"
33,7.342639,192.168.11.38,192.168.11.39,TCP,66,0.000937,,,"6000  >  41988 [FIN, ACK] Seq=1 Ack=29 Win=65152 Len=0 TSval=3840481501 TSecr=1381504655"
34,7.348743,192.168.11.39,192.168.11.38,TCP,66,0.006104,,,41988  >  6000 [ACK] Seq=29 Ack=2 Win=64256 Len=0 TSval=1381504662 TSecr=3840481501
35,14.592427,192.168.11.38,192.168.11.37,TCP,74,7.243684,,,49320  >  6000 [SYN] Seq=0 Win=64240 Len=0 MSS=1460 SACK_PERM TSval=2258822074 TSecr=0 WS=128
36,14.599055,192.168.11.37,192.168.11.38,TCP,74,0.006628,,,"6000  >  49320 [SYN, ACK] Seq=0 Ack=1 Win=65160 Len=0 MSS=1460 SACK_PERM TSval=2347670418 TSecr=2258822074 WS=128"
37,14.599151,192.168.11.38,192.168.11.37,TCP,66,0.000096,,,49320  >  6000 [ACK] Seq=1 Ack=1 Win=64256 Len=0 TSval=2258822081 TSecr=2347670418
38,14.599278,192.168.11.38,192.168.11.37,TCP,93,0.000127,,,"49320  >  6000 [PSH, ACK] Seq=1 Ack=1 Win=64256 Len=27 TSval=2258822081 TSecr=2347670418 [TCP segment of a reassembled PDU]"
39,14.599388,192.168.11.38,192.168.11.37,TCP,66,0.00011,,,"49320  >  6000 [FIN, ACK] Seq=28 Ack=1 Win=64256 Len=0 TSval=2258822081 TSecr=2347670418"
40,14.606924,192.168.11.37,192.168.11.38,TCP,66,0.007536,,,6000  >  49320 [ACK] Seq=1 Ack=28 Win=65152 Len=0 TSval=2347670425 TSecr=2258822081
41,14.607307,192.168.11.37,192.168.11.38,TCP,66,0.000383,,,"6000  >  49320 [FIN, ACK] Seq=1 Ack=29 Win=65152 Len=0 TSval=2347670427 TSecr=2258822081"
42,14.607351,192.168.11.38,192.168.11.37,TCP,66,0.000044,,,49320  >  6000 [ACK] Seq=29 Ack=2 Win=64256 Len=0 TSval=2258822089 TSecr=2347670427
43,14.636491,192.168.11.38,255.255.255.255,UDP,209,0.02914,Ÿ,7b2273656d616e74696373223a207b22656e74697479223a2022504944222c202262617365656e74697479223a2022616e79222c2022726f6c65223a2022373737222c20227370617469616c223a2022616e79222c202274656d706f72616c223a2022616e79227d2c20226461746170726f7065727479223a207b22666f726d6174223a2022696e616f6b615f70726f6772616d5f73616d706c655f73656d616e746963227d7d,40550  >  7000 Len=167
44,14.644851,192.168.11.39,192.168.11.38,TCP,74,0.00836,œ,,41998  >  6000 [SYN] Seq=0 Win=64240 Len=0 MSS=1460 SACK_PERM TSval=1381511958 TSecr=0 WS=128
45,14.644973,192.168.11.38,192.168.11.39,TCP,74,0.000122,,,"6000  >  41998 [SYN, ACK] Seq=0 Ack=1 Win=65160 Len=0 MSS=1460 SACK_PERM TSval=3840488804 TSecr=1381511958 WS=128"
46,14.654147,192.168.11.39,192.168.11.38,TCP,66,0.009174,,,41998  >  6000 [ACK] Seq=1 Ack=1 Win=64256 Len=0 TSval=1381511965 TSecr=3840488804
47,14.654776,192.168.11.39,192.168.11.38,TCP,93,0.000629,,,"41998  >  6000 [PSH, ACK] Seq=1 Ack=1 Win=64256 Len=27 TSval=1381511965 TSecr=3840488804 [TCP segment of a reassembled PDU]"
48,14.654981,192.168.11.38,192.168.11.39,TCP,66,0.000205,,,6000  >  41998 [ACK] Seq=1 Ack=28 Win=65152 Len=0 TSval=3840488813 TSecr=1381511965
49,14.655198,192.168.11.39,192.168.11.38,TCP,66,0.000217,,,"41998  >  6000 [FIN, ACK] Seq=28 Ack=1 Win=64256 Len=0 TSval=1381511965 TSecr=3840488804"
50,14.657303,192.168.11.38,192.168.11.39,TCP,66,0.002105,,,"6000  >  41998 [FIN, ACK] Seq=1 Ack=29 Win=65152 Len=0 TSval=3840488816 TSecr=1381511965"
51,14.661826,192.168.11.39,192.168.11.38,TCP,66,0.004523,,,41998  >  6000 [ACK] Seq=29 Ack=2 Win=64256 Len=0 TSval=1381511975 TSecr=3840488816
52,21.790687,192.168.11.38,192.168.11.37,TCP,74,7.128861,,,42114  >  6000 [SYN] Seq=0 Win=64240 Len=0 MSS=1460 SACK_PERM TSval=2258829272 TSecr=0 WS=128
53,21.80108,192.168.11.37,192.168.11.38,TCP,74,0.010393,,,"6000  >  42114 [SYN, ACK] Seq=0 Ack=1 Win=65160 Len=0 MSS=1460 SACK_PERM TSval=2347677620 TSecr=2258829272 WS=128"
54,21.801181,192.168.11.38,192.168.11.37,TCP,66,0.000101,,,42114  >  6000 [ACK] Seq=1 Ack=1 Win=64256 Len=0 TSval=2258829283 TSecr=2347677620
55,21.801345,192.168.11.38,192.168.11.37,TCP,93,0.000164,,,"42114  >  6000 [PSH, ACK] Seq=1 Ack=1 Win=64256 Len=27 TSval=2258829283 TSecr=2347677620 [TCP segment of a reassembled PDU]"
56,21.801436,192.168.11.38,192.168.11.37,TCP,66,0.000091,,,"42114  >  6000 [FIN, ACK] Seq=28 Ack=1 Win=64256 Len=0 TSval=2258829283 TSecr=2347677620"
57,21.808262,192.168.11.37,192.168.11.38,TCP,66,0.006826,,,6000  >  42114 [ACK] Seq=1 Ack=28 Win=65152 Len=0 TSval=2347677627 TSecr=2258829283
58,21.808505,192.168.11.37,192.168.11.38,TCP,66,0.000243,,,"6000  >  42114 [FIN, ACK] Seq=1 Ack=29 Win=65152 Len=0 TSval=2347677628 TSecr=2258829283"
59,21.808555,192.168.11.38,192.168.11.37,TCP,66,0.00005,,,42114  >  6000 [ACK] Seq=29 Ack=2 Win=64256 Len=0 TSval=2258829290 TSecr=2347677628
60,21.838648,192.168.11.38,255.255.255.255,UDP,209,0.030093,Ÿ,7b2273656d616e74696373223a207b22656e74697479223a2022504944222c202262617365656e74697479223a2022616e79222c2022726f6c65223a2022373737222c20227370617469616c223a2022616e79222c202274656d706f72616c223a2022616e79227d2c20226461746170726f7065727479223a207b22666f726d6174223a2022696e616f6b615f70726f6772616d5f73616d706c655f73656d616e746963227d7d,45375  >  7000 Len=167
61,21.846661,192.168.11.39,192.168.11.38,TCP,74,0.008013,œ,,49826  >  6000 [SYN] Seq=0 Win=64240 Len=0 MSS=1460 SACK_PERM TSval=1381519160 TSecr=0 WS=128
62,21.846798,192.168.11.38,192.168.11.39,TCP,74,0.000137,,,"6000  >  49826 [SYN, ACK] Seq=0 Ack=1 Win=65160 Len=0 MSS=1460 SACK_PERM TSval=3840496005 TSecr=1381519160 WS=128"
63,21.853428,192.168.11.39,192.168.11.38,TCP,66,0.00663,,,49826  >  6000 [ACK] Seq=1 Ack=1 Win=64256 Len=0 TSval=1381519167 TSecr=3840496005
64,21.853971,192.168.11.39,192.168.11.38,TCP,93,0.000543,,,"49826  >  6000 [PSH, ACK] Seq=1 Ack=1 Win=64256 Len=27 TSval=1381519167 TSecr=3840496005 [TCP segment of a reassembled PDU]"
65,21.85406,192.168.11.38,192.168.11.39,TCP,66,0.000089,,,6000  >  49826 [ACK] Seq=1 Ack=28 Win=65152 Len=0 TSval=3840496013 TSecr=1381519167
66,21.854124,192.168.11.39,192.168.11.38,TCP,66,0.000064,,,"49826  >  6000 [FIN, ACK] Seq=28 Ack=1 Win=64256 Len=0 TSval=1381519167 TSecr=3840496005"
67,21.855404,192.168.11.38,192.168.11.39,TCP,66,0.00128,,,"6000  >  49826 [FIN, ACK] Seq=1 Ack=29 Win=65152 Len=0 TSval=3840496014 TSecr=1381519167"
68,21.86345,192.168.11.39,192.168.11.38,TCP,66,0.008046,,,49826  >  6000 [ACK] Seq=29 Ack=2 Win=64256 Len=0 TSval=1381519176 TSecr=3840496014
69,28.994488,192.168.11.38,192.168.11.37,TCP,74,7.131038,,,58246  >  6000 [SYN] Seq=0 Win=64240 Len=0 MSS=1460 SACK_PERM TSval=2258836476 TSecr=0 WS=128
70,29.001125,192.168.11.37,192.168.11.38,TCP,74,0.006637,,,"6000  >  58246 [SYN, ACK] Seq=0 Ack=1 Win=65160 Len=0 MSS=1460 SACK_PERM TSval=2347684820 TSecr=2258836476 WS=128"
71,29.001223,192.168.11.38,192.168.11.37,TCP,66,0.000098,,,58246  >  6000 [ACK] Seq=1 Ack=1 Win=64256 Len=0 TSval=2258836483 TSecr=2347684820
72,29.00138,192.168.11.38,192.168.11.37,TCP,93,0.000157,,,"58246  >  6000 [PSH, ACK] Seq=1 Ack=1 Win=64256 Len=27 TSval=2258836483 TSecr=2347684820 [TCP segment of a reassembled PDU]"
73,29.001469,192.168.11.38,192.168.11.37,TCP,66,0.000089,,,"58246  >  6000 [FIN, ACK] Seq=28 Ack=1 Win=64256 Len=0 TSval=2258836483 TSecr=2347684820"
74,29.010174,192.168.11.37,192.168.11.38,TCP,66,0.008705,,,6000  >  58246 [ACK] Seq=1 Ack=28 Win=65152 Len=0 TSval=2347684828 TSecr=2258836483
75,29.010599,192.168.11.37,192.168.11.38,TCP,66,0.000425,,,"6000  >  58246 [FIN, ACK] Seq=1 Ack=29 Win=65152 Len=0 TSval=2347684830 TSecr=2258836483"
76,29.010652,192.168.11.38,192.168.11.37,TCP,66,0.000053,,,58246  >  6000 [ACK] Seq=29 Ack=2 Win=64256 Len=0 TSval=2258836492 TSecr=2347684830
77,29.038487,192.168.11.38,255.255.255.255,UDP,209,0.027835,Ÿ,7b2273656d616e74696373223a207b22656e74697479223a2022504944222c202262617365656e74697479223a2022616e79222c2022726f6c65223a2022373737222c20227370617469616c223a2022616e79222c202274656d706f72616c223a2022616e79227d2c20226461746170726f7065727479223a207b22666f726d6174223a2022696e616f6b615f70726f6772616d5f73616d706c655f73656d616e746963227d7d,53937  >  7000 Len=167
78,29.046661,192.168.11.39,192.168.11.38,TCP,74,0.008174,œ,,37436  >  6000 [SYN] Seq=0 Win=64240 Len=0 MSS=1460 SACK_PERM TSval=1381526360 TSecr=0 WS=128
79,29.046797,192.168.11.38,192.168.11.39,TCP,74,0.000136,,,"6000  >  37436 [SYN, ACK] Seq=0 Ack=1 Win=65160 Len=0 MSS=1460 SACK_PERM TSval=3840503205 TSecr=1381526360 WS=128"
80,29.053507,192.168.11.39,192.168.11.38,TCP,66,0.00671,,,37436  >  6000 [ACK] Seq=1 Ack=1 Win=64256 Len=0 TSval=1381526367 TSecr=3840503205
81,29.05406,192.168.11.39,192.168.11.38,TCP,93,0.000553,,,"37436  >  6000 [PSH, ACK] Seq=1 Ack=1 Win=64256 Len=27 TSval=1381526367 TSecr=3840503205 [TCP segment of a reassembled PDU]"
82,29.054156,192.168.11.38,192.168.11.39,TCP,66,0.000096,,,6000  >  37436 [ACK] Seq=1 Ack=28 Win=65152 Len=0 TSval=3840503213 TSecr=1381526367
83,29.054223,192.168.11.39,192.168.11.38,TCP,66,0.000067,,,"37436  >  6000 [FIN, ACK] Seq=28 Ack=1 Win=64256 Len=0 TSval=1381526367 TSecr=3840503205"
84,29.055348,192.168.11.38,192.168.11.39,TCP,66,0.001125,,,"6000  >  37436 [FIN, ACK] Seq=1 Ack=29 Win=65152 Len=0 TSval=3840503214 TSecr=1381526367"
85,29.061444,192.168.11.39,192.168.11.38,TCP,66,0.006096,,,37436  >  6000 [ACK] Seq=29 Ack=2 Win=64256 Len=0 TSval=1381526374 TSecr=3840503214
86,36.164323,192.168.11.38,192.168.11.37,TCP,74,7.102879,,,52932  >  6000 [SYN] Seq=0 Win=64240 Len=0 MSS=1460 SACK_PERM TSval=2258843646 TSecr=0 WS=128
87,36.171731,192.168.11.37,192.168.11.38,TCP,74,0.007408,,,"6000  >  52932 [SYN, ACK] Seq=0 Ack=1 Win=65160 Len=0 MSS=1460 SACK_PERM TSval=2347691990 TSecr=2258843646 WS=128"
88,36.171838,192.168.11.38,192.168.11.37,TCP,66,0.000107,,,52932  >  6000 [ACK] Seq=1 Ack=1 Win=64256 Len=0 TSval=2258843653 TSecr=2347691990
89,36.171962,192.168.11.38,192.168.11.37,TCP,93,0.000124,,,"52932  >  6000 [PSH, ACK] Seq=1 Ack=1 Win=64256 Len=27 TSval=2258843654 TSecr=2347691990 [TCP segment of a reassembled PDU]"
90,36.17207,192.168.11.38,192.168.11.37,TCP,66,0.000108,,,"52932  >  6000 [FIN, ACK] Seq=28 Ack=1 Win=64256 Len=0 TSval=2258843654 TSecr=2347691990"
91,36.179683,192.168.11.37,192.168.11.38,TCP,66,0.007613,,,6000  >  52932 [ACK] Seq=1 Ack=28 Win=65152 Len=0 TSval=2347691998 TSecr=2258843654
92,36.180039,192.168.11.37,192.168.11.38,TCP,66,0.000356,,,"6000  >  52932 [FIN, ACK] Seq=1 Ack=29 Win=65152 Len=0 TSval=2347691999 TSecr=2258843654"
93,36.180083,192.168.11.38,192.168.11.37,TCP,66,0.000044,,,52932  >  6000 [ACK] Seq=29 Ack=2 Win=64256 Len=0 TSval=2258843662 TSecr=2347691999
94,36.207545,192.168.11.38,255.255.255.255,UDP,209,0.027462,Ÿ,7b2273656d616e74696373223a207b22656e74697479223a2022504944222c202262617365656e74697479223a2022616e79222c2022726f6c65223a2022373737222c20227370617469616c223a2022616e79222c202274656d706f72616c223a2022616e79227d2c20226461746170726f7065727479223a207b22666f726d6174223a2022696e616f6b615f70726f6772616d5f73616d706c655f73656d616e746963227d7d,53055  >  7000 Len=167
95,36.215822,192.168.11.39,192.168.11.38,TCP,74,0.008277,œ,,57680  >  6000 [SYN] Seq=0 Win=64240 Len=0 MSS=1460 SACK_PERM TSval=1381533529 TSecr=0 WS=128
96,36.215933,192.168.11.38,192.168.11.39,TCP,74,0.000111,,,"6000  >  57680 [SYN, ACK] Seq=0 Ack=1 Win=65160 Len=0 MSS=1460 SACK_PERM TSval=3840510375 TSecr=1381533529 WS=128"
97,36.222754,192.168.11.39,192.168.11.38,TCP,66,0.006821,,,57680  >  6000 [ACK] Seq=1 Ack=1 Win=64256 Len=0 TSval=1381533536 TSecr=3840510375
98,36.223355,192.168.11.39,192.168.11.38,TCP,93,0.000601,,,"57680  >  6000 [PSH, ACK] Seq=1 Ack=1 Win=64256 Len=27 TSval=1381533536 TSecr=3840510375 [TCP segment of a reassembled PDU]"
99,36.223442,192.168.11.38,192.168.11.39,TCP,66,0.000087,,,6000  >  57680 [ACK] Seq=1 Ack=28 Win=65152 Len=0 TSval=3840510382 TSecr=1381533536
100,36.223503,192.168.11.39,192.168.11.38,TCP,66,0.000061,,,"57680  >  6000 [FIN, ACK] Seq=28 Ack=1 Win=64256 Len=0 TSval=1381533536 TSecr=3840510375"
101,36.224557,192.168.11.38,192.168.11.39,TCP,66,0.001054,,,"6000  >  57680 [FIN, ACK] Seq=1 Ack=29 Win=65152 Len=0 TSval=3840510383 TSecr=1381533536"
102,36.230824,192.168.11.39,192.168.11.38,TCP,66,0.006267,,,57680  >  6000 [ACK] Seq=29 Ack=2 Win=64256 Len=0 TSval=1381533544 TSecr=3840510383
103,43.380162,192.168.11.38,192.168.11.37,TCP,74,7.149338,,,52942  >  6000 [SYN] Seq=0 Win=64240 Len=0 MSS=1460 SACK_PERM TSval=2258850862 TSecr=0 WS=128
104,43.387203,192.168.11.37,192.168.11.38,TCP,74,0.007041,,,"6000  >  52942 [SYN, ACK] Seq=0 Ack=1 Win=65160 Len=0 MSS=1460 SACK_PERM TSval=2347699205 TSecr=2258850862 WS=128"
105,43.3873,192.168.11.38,192.168.11.37,TCP,66,0.000097,,,52942  >  6000 [ACK] Seq=1 Ack=1 Win=64256 Len=0 TSval=2258850869 TSecr=2347699205
106,43.387456,192.168.11.38,192.168.11.37,TCP,93,0.000156,,,"52942  >  6000 [PSH, ACK] Seq=1 Ack=1 Win=64256 Len=27 TSval=2258850869 TSecr=2347699205 [TCP segment of a reassembled PDU]"
107,43.387544,192.168.11.38,192.168.11.37,TCP,66,0.000088,,,"52942  >  6000 [FIN, ACK] Seq=28 Ack=1 Win=64256 Len=0 TSval=2258850869 TSecr=2347699205"
108,43.404504,192.168.11.37,192.168.11.38,TCP,66,0.01696,,,6000  >  52942 [ACK] Seq=1 Ack=28 Win=65152 Len=0 TSval=2347699222 TSecr=2258850869
109,43.404874,192.168.11.37,192.168.11.38,TCP,66,0.00037,,,"6000  >  52942 [FIN, ACK] Seq=1 Ack=29 Win=65152 Len=0 TSval=2347699223 TSecr=2258850869"
110,43.404918,192.168.11.38,192.168.11.37,TCP,66,0.000044,,,52942  >  6000 [ACK] Seq=29 Ack=2 Win=64256 Len=0 TSval=2258850887 TSecr=2347699223
111,43.431769,192.168.11.38,255.255.255.255,UDP,209,0.026851,Ÿ,7b2273656d616e74696373223a207b22656e74697479223a2022504944222c202262617365656e74697479223a2022616e79222c2022726f6c65223a2022373737222c20227370617469616c223a2022616e79222c202274656d706f72616c223a2022616e79227d2c20226461746170726f7065727479223a207b22666f726d6174223a2022696e616f6b615f70726f6772616d5f73616d706c655f73656d616e746963227d7d,35281  >  7000 Len=167
112,43.439736,192.168.11.39,192.168.11.38,TCP,74,0.007967,œ,,57686  >  6000 [SYN] Seq=0 Win=64240 Len=0 MSS=1460 SACK_PERM TSval=1381540753 TSecr=0 WS=128
113,43.439868,192.168.11.38,192.168.11.39,TCP,74,0.000132,,,"6000  >  57686 [SYN, ACK] Seq=0 Ack=1 Win=65160 Len=0 MSS=1460 SACK_PERM TSval=3840517599 TSecr=1381540753 WS=128"
114,43.455549,192.168.11.39,192.168.11.38,TCP,66,0.015681,,,57686  >  6000 [ACK] Seq=1 Ack=1 Win=64256 Len=0 TSval=1381540760 TSecr=3840517599
115,43.456018,192.168.11.39,192.168.11.38,TCP,93,0.000469,,,"57686  >  6000 [PSH, ACK] Seq=1 Ack=1 Win=64256 Len=27 TSval=1381540760 TSecr=3840517599 [TCP segment of a reassembled PDU]"
116,43.456081,192.168.11.38,192.168.11.39,TCP,66,0.000063,,,6000  >  57686 [ACK] Seq=1 Ack=28 Win=65152 Len=0 TSval=3840517615 TSecr=1381540760
117,43.456147,192.168.11.39,192.168.11.38,TCP,66,0.000066,,,"57686  >  6000 [FIN, ACK] Seq=28 Ack=1 Win=64256 Len=0 TSval=1381540760 TSecr=3840517599"
118,43.457032,192.168.11.38,192.168.11.39,TCP,66,0.000885,,,"6000  >  57686 [FIN, ACK] Seq=1 Ack=29 Win=65152 Len=0 TSval=3840517616 TSecr=1381540760"
119,43.46338,192.168.11.39,192.168.11.38,TCP,66,0.006348,,,57686  >  6000 [ACK] Seq=29 Ack=2 Win=64256 Len=0 TSval=1381540776 TSecr=3840517616
120,50.563901,192.168.11.38,192.168.11.37,TCP,74,7.100521,,,50548  >  6000 [SYN] Seq=0 Win=64240 Len=0 MSS=1460 SACK_PERM TSval=2258858046 TSecr=0 WS=128
121,50.570542,192.168.11.37,192.168.11.38,TCP,74,0.006641,,,"6000  >  50548 [SYN, ACK] Seq=0 Ack=1 Win=65160 Len=0 MSS=1460 SACK_PERM TSval=2347706388 TSecr=2258858046 WS=128"
122,50.570644,192.168.11.38,192.168.11.37,TCP,66,0.000102,,,50548  >  6000 [ACK] Seq=1 Ack=1 Win=64256 Len=0 TSval=2258858052 TSecr=2347706388
123,50.570778,192.168.11.38,192.168.11.37,TCP,93,0.000134,,,"50548  >  6000 [PSH, ACK] Seq=1 Ack=1 Win=64256 Len=27 TSval=2258858052 TSecr=2347706388 [TCP segment of a reassembled PDU]"
124,50.570913,192.168.11.38,192.168.11.37,TCP,66,0.000135,,,"50548  >  6000 [FIN, ACK] Seq=28 Ack=1 Win=64256 Len=0 TSval=2258858053 TSecr=2347706388"
125,50.578219,192.168.11.37,192.168.11.38,TCP,66,0.007306,,,6000  >  50548 [ACK] Seq=1 Ack=28 Win=65152 Len=0 TSval=2347706395 TSecr=2258858052
126,50.578424,192.168.11.37,192.168.11.38,TCP,66,0.000205,,,"6000  >  50548 [FIN, ACK] Seq=1 Ack=29 Win=65152 Len=0 TSval=2347706397 TSecr=2258858053"
127,50.578465,192.168.11.38,192.168.11.37,TCP,66,0.000041,,,50548  >  6000 [ACK] Seq=29 Ack=2 Win=64256 Len=0 TSval=2258858060 TSecr=2347706397
128,50.607949,192.168.11.38,255.255.255.255,UDP,209,0.029484,Ÿ,7b2273656d616e74696373223a207b22656e74697479223a2022504944222c202262617365656e74697479223a2022616e79222c2022726f6c65223a2022373737222c20227370617469616c223a2022616e79222c202274656d706f72616c223a2022616e79227d2c20226461746170726f7065727479223a207b22666f726d6174223a2022696e616f6b615f70726f6772616d5f73616d706c655f73656d616e746963227d7d,48076  >  7000 Len=167
129,50.61587,192.168.11.39,192.168.11.38,TCP,74,0.007921,œ,,41894  >  6000 [SYN] Seq=0 Win=64240 Len=0 MSS=1460 SACK_PERM TSval=1381547929 TSecr=0 WS=128
130,50.61599,192.168.11.38,192.168.11.39,TCP,74,0.00012,,,"6000  >  41894 [SYN, ACK] Seq=0 Ack=1 Win=65160 Len=0 MSS=1460 SACK_PERM TSval=3840524775 TSecr=1381547929 WS=128"
131,50.622612,192.168.11.39,192.168.11.38,TCP,66,0.006622,,,41894  >  6000 [ACK] Seq=1 Ack=1 Win=64256 Len=0 TSval=1381547936 TSecr=3840524775
132,50.623151,192.168.11.39,192.168.11.38,TCP,93,0.000539,,,"41894  >  6000 [PSH, ACK] Seq=1 Ack=1 Win=64256 Len=27 TSval=1381547936 TSecr=3840524775 [TCP segment of a reassembled PDU]"
133,50.623228,192.168.11.38,192.168.11.39,TCP,66,0.000077,,,6000  >  41894 [ACK] Seq=1 Ack=28 Win=65152 Len=0 TSval=3840524782 TSecr=1381547936
134,50.623297,192.168.11.39,192.168.11.38,TCP,66,0.000069,,,"41894  >  6000 [FIN, ACK] Seq=28 Ack=1 Win=64256 Len=0 TSval=1381547936 TSecr=3840524775"
135,50.624342,192.168.11.38,192.168.11.39,TCP,66,0.001045,,,"6000  >  41894 [FIN, ACK] Seq=1 Ack=29 Win=65152 Len=0 TSval=3840524783 TSecr=1381547936"
136,50.630911,192.168.11.39,192.168.11.38,TCP,66,0.006569,,,41894  >  6000 [ACK] Seq=29 Ack=2 Win=64256 Len=0 TSval=1381547943 TSecr=3840524783
137,57.712817,192.168.11.38,192.168.11.37,TCP,74,7.081906,,,59734  >  6000 [SYN] Seq=0 Win=64240 Len=0 MSS=1460 SACK_PERM TSval=2258865194 TSecr=0 WS=128
138,57.719608,192.168.11.37,192.168.11.38,TCP,74,0.006791,,,"6000  >  59734 [SYN, ACK] Seq=0 Ack=1 Win=65160 Len=0 MSS=1460 SACK_PERM TSval=2347713537 TSecr=2258865194 WS=128"
139,57.719725,192.168.11.38,192.168.11.37,TCP,66,0.000117,,,59734  >  6000 [ACK] Seq=1 Ack=1 Win=64256 Len=0 TSval=2258865201 TSecr=2347713537
140,57.719885,192.168.11.38,192.168.11.37,TCP,93,0.00016,,,"59734  >  6000 [PSH, ACK] Seq=1 Ack=1 Win=64256 Len=27 TSval=2258865202 TSecr=2347713537 [TCP segment of a reassembled PDU]"
141,57.719973,192.168.11.38,192.168.11.37,TCP,66,0.000088,,,"59734  >  6000 [FIN, ACK] Seq=28 Ack=1 Win=64256 Len=0 TSval=2258865202 TSecr=2347713537"
142,57.727867,192.168.11.37,192.168.11.38,TCP,66,0.007894,,,6000  >  59734 [ACK] Seq=1 Ack=28 Win=65152 Len=0 TSval=2347713545 TSecr=2258865202
143,57.728244,192.168.11.37,192.168.11.38,TCP,66,0.000377,,,"6000  >  59734 [FIN, ACK] Seq=1 Ack=29 Win=65152 Len=0 TSval=2347713546 TSecr=2258865202"
144,57.728311,192.168.11.38,192.168.11.37,TCP,66,0.000067,,,59734  >  6000 [ACK] Seq=29 Ack=2 Win=64256 Len=0 TSval=2258865210 TSecr=2347713546
145,57.754817,192.168.11.38,255.255.255.255,UDP,209,0.026506,Ÿ,7b2273656d616e74696373223a207b22656e74697479223a2022504944222c202262617365656e74697479223a2022616e79222c2022726f6c65223a2022373737222c20227370617469616c223a2022616e79222c202274656d706f72616c223a2022616e79227d2c20226461746170726f7065727479223a207b22666f726d6174223a2022696e616f6b615f70726f6772616d5f73616d706c655f73656d616e746963227d7d,50948  >  7000 Len=167
146,57.76403,192.168.11.39,192.168.11.38,TCP,74,0.009213,œ,,53448  >  6000 [SYN] Seq=0 Win=64240 Len=0 MSS=1460 SACK_PERM TSval=1381555076 TSecr=0 WS=128
147,57.764175,192.168.11.38,192.168.11.39,TCP,74,0.000145,,,"6000  >  53448 [SYN, ACK] Seq=0 Ack=1 Win=65160 Len=0 MSS=1460 SACK_PERM TSval=3840531923 TSecr=1381555076 WS=128"
148,57.771014,192.168.11.39,192.168.11.38,TCP,66,0.006839,,,53448  >  6000 [ACK] Seq=1 Ack=1 Win=64256 Len=0 TSval=1381555084 TSecr=3840531923
149,57.771562,192.168.11.39,192.168.11.38,TCP,93,0.000548,,,"53448  >  6000 [PSH, ACK] Seq=1 Ack=1 Win=64256 Len=27 TSval=1381555084 TSecr=3840531923 [TCP segment of a reassembled PDU]"
150,57.771608,192.168.11.39,192.168.11.38,TCP,66,0.000046,,,"53448  >  6000 [FIN, ACK] Seq=28 Ack=1 Win=64256 Len=0 TSval=1381555084 TSecr=3840531923"
151,57.771636,192.168.11.38,192.168.11.39,TCP,66,0.000028,,,6000  >  53448 [ACK] Seq=1 Ack=28 Win=65152 Len=0 TSval=3840531930 TSecr=1381555084
152,57.772804,192.168.11.38,192.168.11.39,TCP,66,0.001168,,,"6000  >  53448 [FIN, ACK] Seq=1 Ack=29 Win=65152 Len=0 TSval=3840531931 TSecr=1381555084"
153,57.778721,192.168.11.39,192.168.11.38,TCP,66,0.005917,,,53448  >  6000 [ACK] Seq=29 Ack=2 Win=64256 Len=0 TSval=1381555092 TSecr=3840531931
154,64.852689,192.168.11.38,192.168.11.37,TCP,74,7.073968,,,59744  >  6000 [SYN] Seq=0 Win=64240 Len=0 MSS=1460 SACK_PERM TSval=2258872334 TSecr=0 WS=128
155,64.859453,192.168.11.37,192.168.11.38,TCP,74,0.006764,,,"6000  >  59744 [SYN, ACK] Seq=0 Ack=1 Win=65160 Len=0 MSS=1460 SACK_PERM TSval=2347720677 TSecr=2258872334 WS=128"
156,64.859558,192.168.11.38,192.168.11.37,TCP,66,0.000105,,,59744  >  6000 [ACK] Seq=1 Ack=1 Win=64256 Len=0 TSval=2258872341 TSecr=2347720677
157,64.859682,192.168.11.38,192.168.11.37,TCP,93,0.000124,,,"59744  >  6000 [PSH, ACK] Seq=1 Ack=1 Win=64256 Len=27 TSval=2258872341 TSecr=2347720677 [TCP segment of a reassembled PDU]"
158,64.859783,192.168.11.38,192.168.11.37,TCP,66,0.000101,,,"59744  >  6000 [FIN, ACK] Seq=28 Ack=1 Win=64256 Len=0 TSval=2258872341 TSecr=2347720677"
159,64.867535,192.168.11.37,192.168.11.38,TCP,66,0.007752,,,6000  >  59744 [ACK] Seq=1 Ack=28 Win=65152 Len=0 TSval=2347720684 TSecr=2258872341
160,64.871072,192.168.11.37,192.168.11.38,TCP,66,0.003537,,,"6000  >  59744 [FIN, ACK] Seq=1 Ack=29 Win=65152 Len=0 TSval=2347720686 TSecr=2258872341"
161,64.871115,192.168.11.38,192.168.11.37,TCP,66,0.000043,,,59744  >  6000 [ACK] Seq=29 Ack=2 Win=64256 Len=0 TSval=2258872353 TSecr=2347720686
162,64.897397,192.168.11.38,255.255.255.255,UDP,209,0.026282,Ÿ,7b2273656d616e74696373223a207b22656e74697479223a2022504944222c202262617365656e74697479223a2022616e79222c2022726f6c65223a2022373737222c20227370617469616c223a2022616e79222c202274656d706f72616c223a2022616e79227d2c20226461746170726f7065727479223a207b22666f726d6174223a2022696e616f6b615f70726f6772616d5f73616d706c655f73656d616e746963227d7d,58826  >  7000 Len=167
163,64.905358,192.168.11.39,192.168.11.38,TCP,74,0.007961,œ,,53464  >  6000 [SYN] Seq=0 Win=64240 Len=0 MSS=1460 SACK_PERM TSval=1381562219 TSecr=0 WS=128
164,64.905479,192.168.11.38,192.168.11.39,TCP,74,0.000121,,,"6000  >  53464 [SYN, ACK] Seq=0 Ack=1 Win=65160 Len=0 MSS=1460 SACK_PERM TSval=3840539064 TSecr=1381562219 WS=128"
165,64.912,192.168.11.39,192.168.11.38,TCP,66,0.006521,,,53464  >  6000 [ACK] Seq=1 Ack=1 Win=64256 Len=0 TSval=1381562225 TSecr=3840539064
166,64.912442,192.168.11.39,192.168.11.38,TCP,93,0.000442,,,"53464  >  6000 [PSH, ACK] Seq=1 Ack=1 Win=64256 Len=27 TSval=1381562225 TSecr=3840539064 [TCP segment of a reassembled PDU]"
167,64.912507,192.168.11.38,192.168.11.39,TCP,66,0.000065,,,6000  >  53464 [ACK] Seq=1 Ack=28 Win=65152 Len=0 TSval=3840539071 TSecr=1381562225
168,64.912563,192.168.11.39,192.168.11.38,TCP,66,0.000056,,,"53464  >  6000 [FIN, ACK] Seq=28 Ack=1 Win=64256 Len=0 TSval=1381562226 TSecr=3840539064"
169,64.913491,192.168.11.38,192.168.11.39,TCP,66,0.000928,,,"6000  >  53464 [FIN, ACK] Seq=1 Ack=29 Win=65152 Len=0 TSval=3840539072 TSecr=1381562226"
170,64.919687,192.168.11.39,192.168.11.38,TCP,66,0.006196,,,53464  >  6000 [ACK] Seq=29 Ack=2 Win=64256 Len=0 TSval=1381562233 TSecr=3840539072
171,110.531325,192.168.11.38,192.168.11.37,TCP,74,45.611638,,,38682  >  6000 [SYN] Seq=0 Win=64240 Len=0 MSS=1460 SACK_PERM TSval=2258918013 TSecr=0 WS=128
172,110.54026,192.168.11.37,192.168.11.38,TCP,74,0.008935,,,"6000  >  38682 [SYN, ACK] Seq=0 Ack=1 Win=65160 Len=0 MSS=1460 SACK_PERM TSval=2347766354 TSecr=2258918013 WS=128"
173,110.540356,192.168.11.38,192.168.11.37,TCP,66,0.000096,,,38682  >  6000 [ACK] Seq=1 Ack=1 Win=64256 Len=0 TSval=2258918022 TSecr=2347766354
174,110.540517,192.168.11.38,192.168.11.37,TCP,93,0.000161,,,"38682  >  6000 [PSH, ACK] Seq=1 Ack=1 Win=64256 Len=27 TSval=2258918022 TSecr=2347766354 [TCP segment of a reassembled PDU]"
175,110.540641,192.168.11.38,192.168.11.37,TCP,66,0.000124,,,"38682  >  6000 [FIN, ACK] Seq=28 Ack=1 Win=64256 Len=0 TSval=2258918022 TSecr=2347766354"
176,110.548048,192.168.11.37,192.168.11.38,TCP,66,0.007407,,,6000  >  38682 [ACK] Seq=1 Ack=28 Win=65152 Len=0 TSval=2347766364 TSecr=2258918022
177,110.550684,192.168.11.37,192.168.11.38,TCP,66,0.002636,,,"6000  >  38682 [FIN, ACK] Seq=1 Ack=29 Win=65152 Len=0 TSval=2347766366 TSecr=2258918022"
178,110.550728,192.168.11.38,192.168.11.37,TCP,66,0.000044,,,38682  >  6000 [ACK] Seq=29 Ack=2 Win=64256 Len=0 TSval=2258918032 TSecr=2347766366
179,110.578059,192.168.11.38,255.255.255.255,UDP,209,0.027331,Ÿ,7b2273656d616e74696373223a207b22656e74697479223a2022504944222c202262617365656e74697479223a2022616e79222c2022726f6c65223a2022373737222c20227370617469616c223a2022616e79222c202274656d706f72616c223a2022616e79227d2c20226461746170726f7065727479223a207b22666f726d6174223a2022696e616f6b615f70726f6772616d5f73616d706c655f73656d616e746963227d7d,51342  >  7000 Len=167
180,110.585571,192.168.11.39,192.168.11.38,TCP,74,0.007512,œ,,59268  >  6000 [SYN] Seq=0 Win=64240 Len=0 MSS=1460 SACK_PERM TSval=1381607899 TSecr=0 WS=128
181,110.585708,192.168.11.38,192.168.11.39,TCP,74,0.000137,,,"6000  >  59268 [SYN, ACK] Seq=0 Ack=1 Win=65160 Len=0 MSS=1460 SACK_PERM TSval=3840584744 TSecr=1381607899 WS=128"
182,110.592396,192.168.11.39,192.168.11.38,TCP,66,0.006688,,,59268  >  6000 [ACK] Seq=1 Ack=1 Win=64256 Len=0 TSval=1381607906 TSecr=3840584744
183,110.592952,192.168.11.39,192.168.11.38,TCP,93,0.000556,,,"59268  >  6000 [PSH, ACK] Seq=1 Ack=1 Win=64256 Len=27 TSval=1381607906 TSecr=3840584744 [TCP segment of a reassembled PDU]"
184,110.593036,192.168.11.38,192.168.11.39,TCP,66,0.000084,,,6000  >  59268 [ACK] Seq=1 Ack=28 Win=65152 Len=0 TSval=3840584752 TSecr=1381607906
185,110.593102,192.168.11.39,192.168.11.38,TCP,66,0.000066,,,"59268  >  6000 [FIN, ACK] Seq=28 Ack=1 Win=64256 Len=0 TSval=1381607906 TSecr=3840584744"
186,110.594208,192.168.11.38,192.168.11.39,TCP,66,0.001106,,,"6000  >  59268 [FIN, ACK] Seq=1 Ack=29 Win=65152 Len=0 TSval=3840584753 TSecr=1381607906"
187,110.600088,192.168.11.39,192.168.11.38,TCP,66,0.00588,,,59268  >  6000 [ACK] Seq=29 Ack=2 Win=64256 Len=0 TSval=1381607913 TSecr=3840584753
188,117.708796,192.168.11.38,192.168.11.37,TCP,74,7.108708,,,47006  >  6000 [SYN] Seq=0 Win=64240 Len=0 MSS=1460 SACK_PERM TSval=2258925190 TSecr=0 WS=128
189,117.715902,192.168.11.37,192.168.11.38,TCP,74,0.007106,,,"6000  >  47006 [SYN, ACK] Seq=0 Ack=1 Win=65160 Len=0 MSS=1460 SACK_PERM TSval=2347773531 TSecr=2258925190 WS=128"
190,117.716003,192.168.11.38,192.168.11.37,TCP,66,0.000101,,,47006  >  6000 [ACK] Seq=1 Ack=1 Win=64256 Len=0 TSval=2258925198 TSecr=2347773531
191,117.716177,192.168.11.38,192.168.11.37,TCP,93,0.000174,,,"47006  >  6000 [PSH, ACK] Seq=1 Ack=1 Win=64256 Len=27 TSval=2258925198 TSecr=2347773531 [TCP segment of a reassembled PDU]"
192,117.716265,192.168.11.38,192.168.11.37,TCP,66,0.000088,,,"47006  >  6000 [FIN, ACK] Seq=28 Ack=1 Win=64256 Len=0 TSval=2258925198 TSecr=2347773531"
193,117.724462,192.168.11.37,192.168.11.38,TCP,66,0.008197,,,6000  >  47006 [ACK] Seq=1 Ack=28 Win=65152 Len=0 TSval=2347773539 TSecr=2258925198
194,117.72704,192.168.11.37,192.168.11.38,TCP,66,0.002578,,,"6000  >  47006 [FIN, ACK] Seq=1 Ack=29 Win=65152 Len=0 TSval=2347773542 TSecr=2258925198"
195,117.727084,192.168.11.38,192.168.11.37,TCP,66,0.000044,,,47006  >  6000 [ACK] Seq=29 Ack=2 Win=64256 Len=0 TSval=2258925209 TSecr=2347773542
196,117.755037,192.168.11.38,255.255.255.255,UDP,209,0.027953,Ÿ,7b2273656d616e74696373223a207b22656e74697479223a2022504944222c202262617365656e74697479223a2022616e79222c2022726f6c65223a2022373737222c20227370617469616c223a2022616e79222c202274656d706f72616c223a2022616e79227d2c20226461746170726f7065727479223a207b22666f726d6174223a2022696e616f6b615f70726f6772616d5f73616d706c655f73656d616e746963227d7d,50842  >  7000 Len=167
197,117.762822,192.168.11.39,192.168.11.38,TCP,74,0.007785,œ,,47898  >  6000 [SYN] Seq=0 Win=64240 Len=0 MSS=1460 SACK_PERM TSval=1381615076 TSecr=0 WS=128
198,117.762964,192.168.11.38,192.168.11.39,TCP,74,0.000142,,,"6000  >  47898 [SYN, ACK] Seq=0 Ack=1 Win=65160 Len=0 MSS=1460 SACK_PERM TSval=3840591922 TSecr=1381615076 WS=128"
199,117.76961,192.168.11.39,192.168.11.38,TCP,66,0.006646,,,47898  >  6000 [ACK] Seq=1 Ack=1 Win=64256 Len=0 TSval=1381615083 TSecr=3840591922
200,117.770092,192.168.11.39,192.168.11.38,TCP,93,0.000482,,,"47898  >  6000 [PSH, ACK] Seq=1 Ack=1 Win=64256 Len=27 TSval=1381615083 TSecr=3840591922 [TCP segment of a reassembled PDU]"
201,117.77017,192.168.11.38,192.168.11.39,TCP,66,0.000078,,,6000  >  47898 [ACK] Seq=1 Ack=28 Win=65152 Len=0 TSval=3840591929 TSecr=1381615083
202,117.770231,192.168.11.39,192.168.11.38,TCP,66,0.000061,,,"47898  >  6000 [FIN, ACK] Seq=28 Ack=1 Win=64256 Len=0 TSval=1381615083 TSecr=3840591922"
203,117.77194,192.168.11.38,192.168.11.39,TCP,66,0.001709,,,"6000  >  47898 [FIN, ACK] Seq=1 Ack=29 Win=65152 Len=0 TSval=3840591931 TSecr=1381615083"
204,117.77625,192.168.11.39,192.168.11.38,TCP,66,0.00431,,,47898  >  6000 [ACK] Seq=29 Ack=2 Win=64256 Len=0 TSval=1381615090 TSecr=3840591931
205,124.937314,192.168.11.38,192.168.11.37,TCP,74,7.161064,,,47014  >  6000 [SYN] Seq=0 Win=64240 Len=0 MSS=1460 SACK_PERM TSval=2258932419 TSecr=0 WS=128
206,124.946514,192.168.11.37,192.168.11.38,TCP,74,0.0092,,,"6000  >  47014 [SYN, ACK] Seq=0 Ack=1 Win=65160 Len=0 MSS=1460 SACK_PERM TSval=2347780759 TSecr=2258932419 WS=128"
207,124.946623,192.168.11.38,192.168.11.37,TCP,66,0.000109,,,47014  >  6000 [ACK] Seq=1 Ack=1 Win=64256 Len=0 TSval=2258932428 TSecr=2347780759
208,124.946923,192.168.11.38,192.168.11.37,TCP,93,0.0003,,,"47014  >  6000 [PSH, ACK] Seq=1 Ack=1 Win=64256 Len=27 TSval=2258932428 TSecr=2347780759 [TCP segment of a reassembled PDU]"
209,124.947021,192.168.11.38,192.168.11.37,TCP,66,0.000098,,,"47014  >  6000 [FIN, ACK] Seq=28 Ack=1 Win=64256 Len=0 TSval=2258932429 TSecr=2347780759"
210,124.955149,192.168.11.37,192.168.11.38,TCP,66,0.008128,,,6000  >  47014 [ACK] Seq=1 Ack=28 Win=65152 Len=0 TSval=2347780770 TSecr=2258932428
211,124.957643,192.168.11.37,192.168.11.38,TCP,66,0.002494,,,"6000  >  47014 [FIN, ACK] Seq=1 Ack=29 Win=65152 Len=0 TSval=2347780772 TSecr=2258932429"
212,124.957686,192.168.11.38,192.168.11.37,TCP,66,0.000043,,,47014  >  6000 [ACK] Seq=29 Ack=2 Win=64256 Len=0 TSval=2258932439 TSecr=2347780772
213,124.984764,192.168.11.38,255.255.255.255,UDP,209,0.027078,Ÿ,7b2273656d616e74696373223a207b22656e74697479223a2022504944222c202262617365656e74697479223a2022616e79222c2022726f6c65223a2022373737222c20227370617469616c223a2022616e79222c202274656d706f72616c223a2022616e79227d2c20226461746170726f7065727479223a207b22666f726d6174223a2022696e616f6b615f70726f6772616d5f73616d706c655f73656d616e746963227d7d,45528  >  7000 Len=167
214,124.992183,192.168.11.39,192.168.11.38,TCP,74,0.007419,œ,,47910  >  6000 [SYN] Seq=0 Win=64240 Len=0 MSS=1460 SACK_PERM TSval=1381622306 TSecr=0 WS=128
215,124.992289,192.168.11.38,192.168.11.39,TCP,74,0.000106,,,"6000  >  47910 [SYN, ACK] Seq=0 Ack=1 Win=65160 Len=0 MSS=1460 SACK_PERM TSval=3840599151 TSecr=1381622306 WS=128"
216,125.006611,192.168.11.39,192.168.11.38,TCP,66,0.014322,,,47910  >  6000 [ACK] Seq=1 Ack=1 Win=64256 Len=0 TSval=1381622312 TSecr=3840599151
217,125.007104,192.168.11.39,192.168.11.38,TCP,93,0.000493,,,"47910  >  6000 [PSH, ACK] Seq=1 Ack=1 Win=64256 Len=27 TSval=1381622312 TSecr=3840599151 [TCP segment of a reassembled PDU]"
218,125.007166,192.168.11.38,192.168.11.39,TCP,66,0.000062,,,6000  >  47910 [ACK] Seq=1 Ack=28 Win=65152 Len=0 TSval=3840599166 TSecr=1381622312
219,125.007231,192.168.11.39,192.168.11.38,TCP,66,0.000065,,,"47910  >  6000 [FIN, ACK] Seq=28 Ack=1 Win=64256 Len=0 TSval=1381622312 TSecr=3840599151"
220,125.008092,192.168.11.38,192.168.11.39,TCP,66,0.000861,,,"6000  >  47910 [FIN, ACK] Seq=1 Ack=29 Win=65152 Len=0 TSval=3840599167 TSecr=1381622312"
221,125.014494,192.168.11.39,192.168.11.38,TCP,66,0.006402,,,47910  >  6000 [ACK] Seq=29 Ack=2 Win=64256 Len=0 TSval=1381622327 TSecr=3840599167
222,132.108835,192.168.11.38,192.168.11.37,TCP,74,7.094341,,,59726  >  6000 [SYN] Seq=0 Win=64240 Len=0 MSS=1460 SACK_PERM TSval=2258939590 TSecr=0 WS=128
223,132.117263,192.168.11.37,192.168.11.38,TCP,74,0.008428,,,"6000  >  59726 [SYN, ACK] Seq=0 Ack=1 Win=65160 Len=0 MSS=1460 SACK_PERM TSval=2347787932 TSecr=2258939590 WS=128"
224,132.117359,192.168.11.38,192.168.11.37,TCP,66,0.000096,,,59726  >  6000 [ACK] Seq=1 Ack=1 Win=64256 Len=0 TSval=2258939599 TSecr=2347787932
225,132.117528,192.168.11.38,192.168.11.37,TCP,93,0.000169,,,"59726  >  6000 [PSH, ACK] Seq=1 Ack=1 Win=64256 Len=27 TSval=2258939599 TSecr=2347787932 [TCP segment of a reassembled PDU]"
226,132.117648,192.168.11.38,192.168.11.37,TCP,66,0.00012,,,"59726  >  6000 [FIN, ACK] Seq=28 Ack=1 Win=64256 Len=0 TSval=2258939599 TSecr=2347787932"
227,132.125075,192.168.11.37,192.168.11.38,TCP,66,0.007427,,,6000  >  59726 [ACK] Seq=1 Ack=28 Win=65152 Len=0 TSval=2347787940 TSecr=2258939599
228,132.127071,192.168.11.37,192.168.11.38,TCP,66,0.001996,,,"6000  >  59726 [FIN, ACK] Seq=1 Ack=29 Win=65152 Len=0 TSval=2347787942 TSecr=2258939599"
229,132.127114,192.168.11.38,192.168.11.37,TCP,66,0.000043,,,59726  >  6000 [ACK] Seq=29 Ack=2 Win=64256 Len=0 TSval=2258939609 TSecr=2347787942
230,132.155196,192.168.11.38,255.255.255.255,UDP,209,0.028082,Ÿ,7b2273656d616e74696373223a207b22656e74697479223a2022504944222c202262617365656e74697479223a2022616e79222c2022726f6c65223a2022373737222c20227370617469616c223a2022616e79222c202274656d706f72616c223a2022616e79227d2c20226461746170726f7065727479223a207b22666f726d6174223a2022696e616f6b615f70726f6772616d5f73616d706c655f73656d616e746963227d7d,41888  >  7000 Len=167
231,132.163343,192.168.11.39,192.168.11.38,TCP,74,0.008147,œ,,40822  >  6000 [SYN] Seq=0 Win=64240 Len=0 MSS=1460 SACK_PERM TSval=1381629476 TSecr=0 WS=128
