No.,Time,Source,Destination,Protocol,Length,Time delta from previous captured frame,XXX,Data,Info
1,0,192.168.11.41,192.168.11.40,TCP,74,0,,,40908  >  6000 [SYN] Seq=0 Win=64240 Len=0 MSS=1460 SACK_PERM TSval=47489423 TSecr=0 WS=128
2,0.006542,192.168.11.40,192.168.11.41,TCP,74,0.006542,,,"6000  >  40908 [SYN, ACK] Seq=0 Ack=1 Win=65160 Len=0 MSS=1460 SACK_PERM TSval=2498580965 TSecr=47489423 WS=128"
3,0.006668,192.168.11.41,192.168.11.40,TCP,66,0.000126,,,40908  >  6000 [ACK] Seq=1 Ack=1 Win=64256 Len=0 TSval=47489433 TSecr=2498580965
4,0.006988,192.168.11.41,192.168.11.40,TCP,93,0.00032,,,"40908  >  6000 [PSH, ACK] Seq=1 Ack=1 Win=64256 Len=27 TSval=47489433 TSecr=2498580965 [TCP segment of a reassembled PDU]"
5,0.007116,192.168.11.41,192.168.11.40,TCP,66,0.000128,,,"40908  >  6000 [FIN, ACK] Seq=28 Ack=1 Win=64256 Len=0 TSval=47489433 TSecr=2498580965"
6,0.013604,192.168.11.40,192.168.11.41,TCP,66,0.006488,,,6000  >  40908 [ACK] Seq=1 Ack=28 Win=65152 Len=0 TSval=2498580972 TSecr=47489433
7,0.013826,192.168.11.40,192.168.11.41,TCP,66,0.000222,,,"6000  >  40908 [FIN, ACK] Seq=1 Ack=29 Win=65152 Len=0 TSval=2498580974 TSecr=47489433"
8,0.013874,192.168.11.41,192.168.11.40,TCP,66,0.000048,,,40908  >  6000 [ACK] Seq=29 Ack=2 Win=64256 Len=0 TSval=47489440 TSecr=2498580974
9,0.047191,192.168.11.41,255.255.255.255,UDP,209,0.033317,Ÿ,7b2273656d616e74696373223a207b22656e74697479223a2022504944222c202262617365656e74697479223a2022616e79222c2022726f6c65223a2022303031222c20227370617469616c223a2022616e79222c202274656d706f72616c223a2022616e79227d2c20226461746170726f7065727479223a207b22666f726d6174223a2022696e616f6b615f70726f6772616d5f73616d706c655f73656d616e746963227d7d,55234  >  7000 Len=167
10,0.058535,192.168.11.24,192.168.11.41,TCP,74,0.011344,œ,,45990  >  6000 [SYN] Seq=0 Win=64240 Len=0 MSS=1460 SACK_PERM TSval=28970220 TSecr=0 WS=128
11,0.058713,192.168.11.41,192.168.11.24,TCP,74,0.000178,,,"6000  >  45990 [SYN, ACK] Seq=0 Ack=1 Win=65160 Len=0 MSS=1460 SACK_PERM TSval=267472042 TSecr=28970220 WS=128"
12,0.065396,192.168.11.24,192.168.11.41,TCP,66,0.006683,,,45990  >  6000 [ACK] Seq=1 Ack=1 Win=64256 Len=0 TSval=28970230 TSecr=267472042
13,0.065964,192.168.11.24,192.168.11.41,TCP,93,0.000568,,,"45990  >  6000 [PSH, ACK] Seq=1 Ack=1 Win=64256 Len=27 TSval=28970230 TSecr=267472042 [TCP segment of a reassembled PDU]"
14,0.066038,192.168.11.41,192.168.11.24,TCP,66,0.000074,,,6000  >  45990 [ACK] Seq=1 Ack=28 Win=65152 Len=0 TSval=267472049 TSecr=28970230
15,0.066106,192.168.11.24,192.168.11.41,TCP,66,0.000068,,,"45990  >  6000 [FIN, ACK] Seq=28 Ack=1 Win=64256 Len=0 TSval=28970230 TSecr=267472042"
16,0.067683,192.168.11.41,192.168.11.24,TCP,66,0.001577,,,"6000  >  45990 [FIN, ACK] Seq=1 Ack=29 Win=65152 Len=0 TSval=267472051 TSecr=28970230"
17,0.072471,192.168.11.24,192.168.11.41,TCP,66,0.004788,,,45990  >  6000 [ACK] Seq=29 Ack=2 Win=64256 Len=0 TSval=28970238 TSecr=267472051
18,7.266648,192.168.11.41,192.168.11.40,TCP,74,7.194177,,,38764  >  6000 [SYN] Seq=0 Win=64240 Len=0 MSS=1460 SACK_PERM TSval=47496693 TSecr=0 WS=128
19,7.273406,192.168.11.40,192.168.11.41,TCP,74,0.006758,,,"6000  >  38764 [SYN, ACK] Seq=0 Ack=1 Win=65160 Len=0 MSS=1460 SACK_PERM TSval=2498588232 TSecr=47496693 WS=128"
20,7.27352,192.168.11.41,192.168.11.40,TCP,66,0.000114,,,38764  >  6000 [ACK] Seq=1 Ack=1 Win=64256 Len=0 TSval=47496700 TSecr=2498588232
21,7.273704,192.168.11.41,192.168.11.40,TCP,93,0.000184,,,"38764  >  6000 [PSH, ACK] Seq=1 Ack=1 Win=64256 Len=27 TSval=47496700 TSecr=2498588232 [TCP segment of a reassembled PDU]"
22,7.273852,192.168.11.41,192.168.11.40,TCP,66,0.000148,,,"38764  >  6000 [FIN, ACK] Seq=28 Ack=1 Win=64256 Len=0 TSval=47496700 TSecr=2498588232"
23,7.28089,192.168.11.40,192.168.11.41,TCP,66,0.007038,,,6000  >  38764 [ACK] Seq=1 Ack=28 Win=65152 Len=0 TSval=2498588239 TSecr=47496700
24,7.281273,192.168.11.40,192.168.11.41,TCP,66,0.000383,,,"6000  >  38764 [FIN, ACK] Seq=1 Ack=29 Win=65152 Len=0 TSval=2498588240 TSecr=47496700"
25,7.281321,192.168.11.41,192.168.11.40,TCP,66,0.000048,,,38764  >  6000 [ACK] Seq=29 Ack=2 Win=64256 Len=0 TSval=47496708 TSecr=2498588240
26,7.319594,192.168.11.41,255.255.255.255,UDP,209,0.038273,Ÿ,7b2273656d616e74696373223a207b22656e74697479223a2022504944222c202262617365656e74697479223a2022616e79222c2022726f6c65223a2022303031222c20227370617469616c223a2022616e79222c202274656d706f72616c223a2022616e79227d2c20226461746170726f7065727479223a207b22666f726d6174223a2022696e616f6b615f70726f6772616d5f73616d706c655f73656d616e746963227d7d,48112  >  7000 Len=167
27,7.327319,192.168.11.24,192.168.11.41,TCP,74,0.007725,œ,,45992  >  6000 [SYN] Seq=0 Win=64240 Len=0 MSS=1460 SACK_PERM TSval=28977492 TSecr=0 WS=128
28,7.327485,192.168.11.41,192.168.11.24,TCP,74,0.000166,,,"6000  >  45992 [SYN, ACK] Seq=0 Ack=1 Win=65160 Len=0 MSS=1460 SACK_PERM TSval=267479311 TSecr=28977492 WS=128"
29,7.334568,192.168.11.24,192.168.11.41,TCP,66,0.007083,,,45992  >  6000 [ACK] Seq=1 Ack=1 Win=64256 Len=0 TSval=28977499 TSecr=267479311
30,7.335039,192.168.11.24,192.168.11.41,TCP,93,0.000471,,,"45992  >  6000 [PSH, ACK] Seq=1 Ack=1 Win=64256 Len=27 TSval=28977499 TSecr=267479311 [TCP segment of a reassembled PDU]"
31,7.335103,192.168.11.41,192.168.11.24,TCP,66,0.000064,,,6000  >  45992 [ACK] Seq=1 Ack=28 Win=65152 Len=0 TSval=267479318 TSecr=28977499
32,7.335167,192.168.11.24,192.168.11.41,TCP,66,0.000064,,,"45992  >  6000 [FIN, ACK] Seq=28 Ack=1 Win=64256 Len=0 TSval=28977499 TSecr=267479311"
33,7.336369,192.168.11.41,192.168.11.24,TCP,66,0.001202,,,"6000  >  45992 [FIN, ACK] Seq=1 Ack=29 Win=65152 Len=0 TSval=267479320 TSecr=28977499"
34,7.342451,192.168.11.24,192.168.11.41,TCP,66,0.006082,,,45992  >  6000 [ACK] Seq=29 Ack=2 Win=64256 Len=0 TSval=28977507 TSecr=267479320
35,14.579374,192.168.11.41,192.168.11.40,TCP,74,7.236923,,,45986  >  6000 [SYN] Seq=0 Win=64240 Len=0 MSS=1460 SACK_PERM TSval=47504006 TSecr=0 WS=128
36,14.586008,192.168.11.40,192.168.11.41,TCP,74,0.006634,,,"6000  >  45986 [SYN, ACK] Seq=0 Ack=1 Win=65160 Len=0 MSS=1460 SACK_PERM TSval=2498595545 TSecr=47504006 WS=128"
37,14.586117,192.168.11.41,192.168.11.40,TCP,66,0.000109,,,45986  >  6000 [ACK] Seq=1 Ack=1 Win=64256 Len=0 TSval=47504012 TSecr=2498595545
38,14.586303,192.168.11.41,192.168.11.40,TCP,93,0.000186,,,"45986  >  6000 [PSH, ACK] Seq=1 Ack=1 Win=64256 Len=27 TSval=47504013 TSecr=2498595545 [TCP segment of a reassembled PDU]"
39,14.586428,192.168.11.41,192.168.11.40,TCP,66,0.000125,,,"45986  >  6000 [FIN, ACK] Seq=28 Ack=1 Win=64256 Len=0 TSval=47504013 TSecr=2498595545"
40,14.593773,192.168.11.40,192.168.11.41,TCP,66,0.007345,,,6000  >  45986 [ACK] Seq=1 Ack=28 Win=65152 Len=0 TSval=2498595552 TSecr=47504013
41,14.594153,192.168.11.40,192.168.11.41,TCP,66,0.00038,,,"6000  >  45986 [FIN, ACK] Seq=1 Ack=29 Win=65152 Len=0 TSval=2498595553 TSecr=47504013"
42,14.5942,192.168.11.41,192.168.11.40,TCP,66,0.000047,,,45986  >  6000 [ACK] Seq=29 Ack=2 Win=64256 Len=0 TSval=47504020 TSecr=2498595553
43,14.625784,192.168.11.41,255.255.255.255,UDP,209,0.031584,Ÿ,7b2273656d616e74696373223a207b22656e74697479223a2022504944222c202262617365656e74697479223a2022616e79222c2022726f6c65223a2022303031222c20227370617469616c223a2022616e79222c202274656d706f72616c223a2022616e79227d2c20226461746170726f7065727479223a207b22666f726d6174223a2022696e616f6b615f70726f6772616d5f73616d706c655f73656d616e746963227d7d,37915  >  7000 Len=167
44,14.637653,192.168.11.24,192.168.11.41,TCP,74,0.011869,œ,,47404  >  6000 [SYN] Seq=0 Win=64240 Len=0 MSS=1460 SACK_PERM TSval=28984800 TSecr=0 WS=128
45,14.637799,192.168.11.41,192.168.11.24,TCP,74,0.000146,,,"6000  >  47404 [SYN, ACK] Seq=0 Ack=1 Win=65160 Len=0 MSS=1460 SACK_PERM TSval=267486621 TSecr=28984800 WS=128"
46,14.644389,192.168.11.24,192.168.11.41,TCP,66,0.00659,,,47404  >  6000 [ACK] Seq=1 Ack=1 Win=64256 Len=0 TSval=28984809 TSecr=267486621
47,14.64493,192.168.11.24,192.168.11.41,TCP,93,0.000541,,,"47404  >  6000 [PSH, ACK] Seq=1 Ack=1 Win=64256 Len=27 TSval=28984809 TSecr=267486621 [TCP segment of a reassembled PDU]"
48,14.645039,192.168.11.41,192.168.11.24,TCP,66,0.000109,,,6000  >  47404 [ACK] Seq=1 Ack=28 Win=65152 Len=0 TSval=267486628 TSecr=28984809
49,14.645129,192.168.11.24,192.168.11.41,TCP,66,0.00009,,,"47404  >  6000 [FIN, ACK] Seq=28 Ack=1 Win=64256 Len=0 TSval=28984809 TSecr=267486621"
50,14.646818,192.168.11.41,192.168.11.24,TCP,66,0.001689,,,"6000  >  47404 [FIN, ACK] Seq=1 Ack=29 Win=65152 Len=0 TSval=267486630 TSecr=28984809"
51,14.652635,192.168.11.24,192.168.11.41,TCP,66,0.005817,,,47404  >  6000 [ACK] Seq=29 Ack=2 Win=64256 Len=0 TSval=28984817 TSecr=267486630
52,21.778536,192.168.11.41,192.168.11.40,TCP,74,7.125901,,,46000  >  6000 [SYN] Seq=0 Win=64240 Len=0 MSS=1460 SACK_PERM TSval=47511205 TSecr=0 WS=128
53,21.785188,192.168.11.40,192.168.11.41,TCP,74,0.006652,,,"6000  >  46000 [SYN, ACK] Seq=0 Ack=1 Win=65160 Len=0 MSS=1460 SACK_PERM TSval=2498602744 TSecr=47511205 WS=128"
54,21.785308,192.168.11.41,192.168.11.40,TCP,66,0.00012,,,46000  >  6000 [ACK] Seq=1 Ack=1 Win=64256 Len=0 TSval=47511212 TSecr=2498602744
55,21.785511,192.168.11.41,192.168.11.40,TCP,93,0.000203,,,"46000  >  6000 [PSH, ACK] Seq=1 Ack=1 Win=64256 Len=27 TSval=47511212 TSecr=2498602744 [TCP segment of a reassembled PDU]"
56,21.78563,192.168.11.41,192.168.11.40,TCP,66,0.000119,,,"46000  >  6000 [FIN, ACK] Seq=28 Ack=1 Win=64256 Len=0 TSval=47511212 TSecr=2498602744"
57,21.796828,192.168.11.40,192.168.11.41,TCP,66,0.011198,,,6000  >  46000 [ACK] Seq=1 Ack=28 Win=65152 Len=0 TSval=2498602751 TSecr=47511212
58,21.797217,192.168.11.40,192.168.11.41,TCP,66,0.000389,,,"6000  >  46000 [FIN, ACK] Seq=1 Ack=29 Win=65152 Len=0 TSval=2498602752 TSecr=47511212"
59,21.797267,192.168.11.41,192.168.11.40,TCP,66,0.00005,,,46000  >  6000 [ACK] Seq=29 Ack=2 Win=64256 Len=0 TSval=47511224 TSecr=2498602752
60,21.830468,192.168.11.41,255.255.255.255,UDP,209,0.033201,Ÿ,7b2273656d616e74696373223a207b22656e74697479223a2022504944222c202262617365656e74697479223a2022616e79222c2022726f6c65223a2022303031222c20227370617469616c223a2022616e79222c202274656d706f72616c223a2022616e79227d2c20226461746170726f7065727479223a207b22666f726d6174223a2022696e616f6b615f70726f6772616d5f73616d706c655f73656d616e746963227d7d,55188  >  7000 Len=167
61,21.838564,192.168.11.24,192.168.11.41,TCP,74,0.008096,œ,,44774  >  6000 [SYN] Seq=0 Win=64240 Len=0 MSS=1460 SACK_PERM TSval=28992002 TSecr=0 WS=128
62,21.838706,192.168.11.41,192.168.11.24,TCP,74,0.000142,,,"6000  >  44774 [SYN, ACK] Seq=0 Ack=1 Win=65160 Len=0 MSS=1460 SACK_PERM TSval=267493822 TSecr=28992002 WS=128"
63,21.847423,192.168.11.24,192.168.11.41,TCP,66,0.008717,,,44774  >  6000 [ACK] Seq=1 Ack=1 Win=64256 Len=0 TSval=28992011 TSecr=267493822
64,21.847929,192.168.11.24,192.168.11.41,TCP,93,0.000506,,,"44774  >  6000 [PSH, ACK] Seq=1 Ack=1 Win=64256 Len=27 TSval=28992011 TSecr=267493822 [TCP segment of a reassembled PDU]"
65,21.848026,192.168.11.41,192.168.11.24,TCP,66,0.000097,,,6000  >  44774 [ACK] Seq=1 Ack=28 Win=65152 Len=0 TSval=267493831 TSecr=28992011
66,21.848088,192.168.11.24,192.168.11.41,TCP,66,0.000062,,,"44774  >  6000 [FIN, ACK] Seq=28 Ack=1 Win=64256 Len=0 TSval=28992011 TSecr=267493822"
67,21.849115,192.168.11.41,192.168.11.24,TCP,66,0.001027,,,"6000  >  44774 [FIN, ACK] Seq=1 Ack=29 Win=65152 Len=0 TSval=267493832 TSecr=28992011"
68,21.855634,192.168.11.24,192.168.11.41,TCP,66,0.006519,,,44774  >  6000 [ACK] Seq=29 Ack=2 Win=64256 Len=0 TSval=28992019 TSecr=267493832
69,28.976921,192.168.11.41,192.168.11.40,TCP,74,7.121287,,,48670  >  6000 [SYN] Seq=0 Win=64240 Len=0 MSS=1460 SACK_PERM TSval=47518403 TSecr=0 WS=128
70,28.983876,192.168.11.40,192.168.11.41,TCP,74,0.006955,,,"6000  >  48670 [SYN, ACK] Seq=0 Ack=1 Win=65160 Len=0 MSS=1460 SACK_PERM TSval=2498609942 TSecr=47518403 WS=128"
71,28.984004,192.168.11.41,192.168.11.40,TCP,66,0.000128,,,48670  >  6000 [ACK] Seq=1 Ack=1 Win=64256 Len=0 TSval=47518410 TSecr=2498609942
72,28.984191,192.168.11.41,192.168.11.40,TCP,93,0.000187,,,"48670  >  6000 [PSH, ACK] Seq=1 Ack=1 Win=64256 Len=27 TSval=47518410 TSecr=2498609942 [TCP segment of a reassembled PDU]"
73,28.984295,192.168.11.41,192.168.11.40,TCP,66,0.000104,,,"48670  >  6000 [FIN, ACK] Seq=28 Ack=1 Win=64256 Len=0 TSval=47518411 TSecr=2498609942"
74,28.991162,192.168.11.40,192.168.11.41,TCP,66,0.006867,,,6000  >  48670 [ACK] Seq=1 Ack=28 Win=65152 Len=0 TSval=2498609950 TSecr=47518410
75,28.991605,192.168.11.40,192.168.11.41,TCP,66,0.000443,,,"6000  >  48670 [FIN, ACK] Seq=1 Ack=29 Win=65152 Len=0 TSval=2498609950 TSecr=47518411"
76,28.991672,192.168.11.41,192.168.11.40,TCP,66,0.000067,,,48670  >  6000 [ACK] Seq=29 Ack=2 Win=64256 Len=0 TSval=47518418 TSecr=2498609950
77,29.023679,192.168.11.41,255.255.255.255,UDP,209,0.032007,Ÿ,7b2273656d616e74696373223a207b22656e74697479223a2022504944222c202262617365656e74697479223a2022616e79222c2022726f6c65223a2022303031222c20227370617469616c223a2022616e79222c202274656d706f72616c223a2022616e79227d2c20226461746170726f7065727479223a207b22666f726d6174223a2022696e616f6b615f70726f6772616d5f73616d706c655f73656d616e746963227d7d,46911  >  7000 Len=167
78,29.031442,192.168.11.24,192.168.11.41,TCP,74,0.007763,œ,,41416  >  6000 [SYN] Seq=0 Win=64240 Len=0 MSS=1460 SACK_PERM TSval=28999195 TSecr=0 WS=128
79,29.031613,192.168.11.41,192.168.11.24,TCP,74,0.000171,,,"6000  >  41416 [SYN, ACK] Seq=0 Ack=1 Win=65160 Len=0 MSS=1460 SACK_PERM TSval=267501015 TSecr=28999195 WS=128"
80,29.038205,192.168.11.24,192.168.11.41,TCP,66,0.006592,,,41416  >  6000 [ACK] Seq=1 Ack=1 Win=64256 Len=0 TSval=28999202 TSecr=267501015
81,29.038736,192.168.11.24,192.168.11.41,TCP,93,0.000531,,,"41416  >  6000 [PSH, ACK] Seq=1 Ack=1 Win=64256 Len=27 TSval=28999202 TSecr=267501015 [TCP segment of a reassembled PDU]"
82,29.038839,192.168.11.41,192.168.11.24,TCP,66,0.000103,,,6000  >  41416 [ACK] Seq=1 Ack=28 Win=65152 Len=0 TSval=267501022 TSecr=28999202
83,29.038914,192.168.11.24,192.168.11.41,TCP,66,0.000075,,,"41416  >  6000 [FIN, ACK] Seq=28 Ack=1 Win=64256 Len=0 TSval=28999202 TSecr=267501015"
84,29.040195,192.168.11.41,192.168.11.24,TCP,66,0.001281,,,"6000  >  41416 [FIN, ACK] Seq=1 Ack=29 Win=65152 Len=0 TSval=267501023 TSecr=28999202"
85,29.046089,192.168.11.24,192.168.11.41,TCP,66,0.005894,,,41416  >  6000 [ACK] Seq=29 Ack=2 Win=64256 Len=0 TSval=28999210 TSecr=267501023
86,36.145713,192.168.11.41,192.168.11.40,TCP,74,7.099624,,,40190  >  6000 [SYN] Seq=0 Win=64240 Len=0 MSS=1460 SACK_PERM TSval=47525572 TSecr=0 WS=128
87,36.152285,192.168.11.40,192.168.11.41,TCP,74,0.006572,,,"6000  >  40190 [SYN, ACK] Seq=0 Ack=1 Win=65160 Len=0 MSS=1460 SACK_PERM TSval=2498617111 TSecr=47525572 WS=128"
88,36.152399,192.168.11.41,192.168.11.40,TCP,66,0.000114,,,40190  >  6000 [ACK] Seq=1 Ack=1 Win=64256 Len=0 TSval=47525579 TSecr=2498617111
89,36.152627,192.168.11.41,192.168.11.40,TCP,93,0.000228,,,"40190  >  6000 [PSH, ACK] Seq=1 Ack=1 Win=64256 Len=27 TSval=47525579 TSecr=2498617111 [TCP segment of a reassembled PDU]"
90,36.152752,192.168.11.41,192.168.11.40,TCP,66,0.000125,,,"40190  >  6000 [FIN, ACK] Seq=28 Ack=1 Win=64256 Len=0 TSval=47525579 TSecr=2498617111"
91,36.159738,192.168.11.40,192.168.11.41,TCP,66,0.006986,,,6000  >  40190 [ACK] Seq=1 Ack=28 Win=65152 Len=0 TSval=2498617118 TSecr=47525579
92,36.160105,192.168.11.40,192.168.11.41,TCP,66,0.000367,,,"6000  >  40190 [FIN, ACK] Seq=1 Ack=29 Win=65152 Len=0 TSval=2498617119 TSecr=47525579"
93,36.160159,192.168.11.41,192.168.11.40,TCP,66,0.000054,,,40190  >  6000 [ACK] Seq=29 Ack=2 Win=64256 Len=0 TSval=47525586 TSecr=2498617119
94,36.190553,192.168.11.41,255.255.255.255,UDP,209,0.030394,Ÿ,7b2273656d616e74696373223a207b22656e74697479223a2022504944222c202262617365656e74697479223a2022616e79222c2022726f6c65223a2022303031222c20227370617469616c223a2022616e79222c202274656d706f72616c223a2022616e79227d2c20226461746170726f7065727479223a207b22666f726d6174223a2022696e616f6b615f70726f6772616d5f73616d706c655f73656d616e746963227d7d,39990  >  7000 Len=167
95,36.198614,192.168.11.24,192.168.11.41,TCP,74,0.008061,œ,,41422  >  6000 [SYN] Seq=0 Win=64240 Len=0 MSS=1460 SACK_PERM TSval=29006362 TSecr=0 WS=128
96,36.198754,192.168.11.41,192.168.11.24,TCP,74,0.00014,,,"6000  >  41422 [SYN, ACK] Seq=0 Ack=1 Win=65160 Len=0 MSS=1460 SACK_PERM TSval=267508182 TSecr=29006362 WS=128"
97,36.205456,192.168.11.24,192.168.11.41,TCP,66,0.006702,,,41422  >  6000 [ACK] Seq=1 Ack=1 Win=64256 Len=0 TSval=29006369 TSecr=267508182
98,36.206023,192.168.11.24,192.168.11.41,TCP,93,0.000567,,,"41422  >  6000 [PSH, ACK] Seq=1 Ack=1 Win=64256 Len=27 TSval=29006369 TSecr=267508182 [TCP segment of a reassembled PDU]"
99,36.206107,192.168.11.41,192.168.11.24,TCP,66,0.000084,,,6000  >  41422 [ACK] Seq=1 Ack=28 Win=65152 Len=0 TSval=267508189 TSecr=29006369
100,36.206179,192.168.11.24,192.168.11.41,TCP,66,0.000072,,,"41422  >  6000 [FIN, ACK] Seq=28 Ack=1 Win=64256 Len=0 TSval=29006369 TSecr=267508182"
101,36.20742,192.168.11.41,192.168.11.24,TCP,66,0.001241,,,"6000  >  41422 [FIN, ACK] Seq=1 Ack=29 Win=65152 Len=0 TSval=267508191 TSecr=29006369"
102,36.213313,192.168.11.24,192.168.11.41,TCP,66,0.005893,,,41422  >  6000 [ACK] Seq=29 Ack=2 Win=64256 Len=0 TSval=29006377 TSecr=267508191
103,43.378709,192.168.11.41,192.168.11.40,TCP,74,7.165396,,,36286  >  6000 [SYN] Seq=0 Win=64240 Len=0 MSS=1460 SACK_PERM TSval=47532805 TSecr=0 WS=128
104,43.385379,192.168.11.40,192.168.11.41,TCP,74,0.00667,,,"6000  >  36286 [SYN, ACK] Seq=0 Ack=1 Win=65160 Len=0 MSS=1460 SACK_PERM TSval=2498624344 TSecr=47532805 WS=128"
105,43.385502,192.168.11.41,192.168.11.40,TCP,66,0.000123,,,36286  >  6000 [ACK] Seq=1 Ack=1 Win=64256 Len=0 TSval=47532812 TSecr=2498624344
106,43.385683,192.168.11.41,192.168.11.40,TCP,93,0.000181,,,"36286  >  6000 [PSH, ACK] Seq=1 Ack=1 Win=64256 Len=27 TSval=47532812 TSecr=2498624344 [TCP segment of a reassembled PDU]"
107,43.385806,192.168.11.41,192.168.11.40,TCP,66,0.000123,,,"36286  >  6000 [FIN, ACK] Seq=28 Ack=1 Win=64256 Len=0 TSval=47532812 TSecr=2498624344"
108,43.392934,192.168.11.40,192.168.11.41,TCP,66,0.007128,,,6000  >  36286 [ACK] Seq=1 Ack=28 Win=65152 Len=0 TSval=2498624351 TSecr=47532812
109,43.393312,192.168.11.40,192.168.11.41,TCP,66,0.000378,,,"6000  >  36286 [FIN, ACK] Seq=1 Ack=29 Win=65152 Len=0 TSval=2498624352 TSecr=47532812"
110,43.393368,192.168.11.41,192.168.11.40,TCP,66,0.000056,,,36286  >  6000 [ACK] Seq=29 Ack=2 Win=64256 Len=0 TSval=47532820 TSecr=2498624352
111,43.427761,192.168.11.41,255.255.255.255,UDP,209,0.034393,Ÿ,7b2273656d616e74696373223a207b22656e74697479223a2022504944222c202262617365656e74697479223a2022616e79222c2022726f6c65223a2022303031222c20227370617469616c223a2022616e79222c202274656d706f72616c223a2022616e79227d2c20226461746170726f7065727479223a207b22666f726d6174223a2022696e616f6b615f70726f6772616d5f73616d706c655f73656d616e746963227d7d,60566  >  7000 Len=167
112,43.436026,192.168.11.24,192.168.11.41,TCP,74,0.008265,œ,,44648  >  6000 [SYN] Seq=0 Win=64240 Len=0 MSS=1460 SACK_PERM TSval=29013599 TSecr=0 WS=128
113,43.436157,192.168.11.41,192.168.11.24,TCP,74,0.000131,,,"6000  >  44648 [SYN, ACK] Seq=0 Ack=1 Win=65160 Len=0 MSS=1460 SACK_PERM TSval=267515419 TSecr=29013599 WS=128"
114,43.447614,192.168.11.24,192.168.11.41,TCP,66,0.011457,,,44648  >  6000 [ACK] Seq=1 Ack=1 Win=64256 Len=0 TSval=29013608 TSecr=267515419
115,43.448147,192.168.11.24,192.168.11.41,TCP,93,0.000533,,,"44648  >  6000 [PSH, ACK] Seq=1 Ack=1 Win=64256 Len=27 TSval=29013608 TSecr=267515419 [TCP segment of a reassembled PDU]"
116,43.448239,192.168.11.41,192.168.11.24,TCP,66,0.000092,,,6000  >  44648 [ACK] Seq=1 Ack=28 Win=65152 Len=0 TSval=267515431 TSecr=29013608
117,43.448299,192.168.11.24,192.168.11.41,TCP,66,0.00006,,,"44648  >  6000 [FIN, ACK] Seq=28 Ack=1 Win=64256 Len=0 TSval=29013608 TSecr=267515419"
118,43.449578,192.168.11.41,192.168.11.24,TCP,66,0.001279,,,"6000  >  44648 [FIN, ACK] Seq=1 Ack=29 Win=65152 Len=0 TSval=267515433 TSecr=29013608"
119,43.455236,192.168.11.24,192.168.11.41,TCP,66,0.005658,,,44648  >  6000 [ACK] Seq=29 Ack=2 Win=64256 Len=0 TSval=29013618 TSecr=267515433
120,50.553156,192.168.11.41,192.168.11.40,TCP,74,7.09792,,,36294  >  6000 [SYN] Seq=0 Win=64240 Len=0 MSS=1460 SACK_PERM TSval=47539979 TSecr=0 WS=128
121,50.559867,192.168.11.40,192.168.11.41,TCP,74,0.006711,,,"6000  >  36294 [SYN, ACK] Seq=0 Ack=1 Win=65160 Len=0 MSS=1460 SACK_PERM TSval=2498631518 TSecr=47539979 WS=128"
122,50.559986,192.168.11.41,192.168.11.40,TCP,66,0.000119,,,36294  >  6000 [ACK] Seq=1 Ack=1 Win=64256 Len=0 TSval=47539986 TSecr=2498631518
123,50.560192,192.168.11.41,192.168.11.40,TCP,93,0.000206,,,"36294  >  6000 [PSH, ACK] Seq=1 Ack=1 Win=64256 Len=27 TSval=47539986 TSecr=2498631518 [TCP segment of a reassembled PDU]"
124,50.560299,192.168.11.41,192.168.11.40,TCP,66,0.000107,,,"36294  >  6000 [FIN, ACK] Seq=28 Ack=1 Win=64256 Len=0 TSval=47539987 TSecr=2498631518"
125,50.567123,192.168.11.40,192.168.11.41,TCP,66,0.006824,,,6000  >  36294 [ACK] Seq=1 Ack=28 Win=65152 Len=0 TSval=2498631525 TSecr=47539986
126,50.567513,192.168.11.40,192.168.11.41,TCP,66,0.00039,,,"6000  >  36294 [FIN, ACK] Seq=1 Ack=29 Win=65152 Len=0 TSval=2498631526 TSecr=47539987"
127,50.56756,192.168.11.41,192.168.11.40,TCP,66,0.000047,,,36294  >  6000 [ACK] Seq=29 Ack=2 Win=64256 Len=0 TSval=47539994 TSecr=2498631526
128,50.598905,192.168.11.41,255.255.255.255,UDP,209,0.031345,Ÿ,7b2273656d616e74696373223a207b22656e74697479223a2022504944222c202262617365656e74697479223a2022616e79222c2022726f6c65223a2022303031222c20227370617469616c223a2022616e79222c202274656d706f72616c223a2022616e79227d2c20226461746170726f7065727479223a207b22666f726d6174223a2022696e616f6b615f70726f6772616d5f73616d706c655f73656d616e746963227d7d,38623  >  7000 Len=167
129,50.607497,192.168.11.24,192.168.11.41,TCP,74,0.008592,œ,,44866  >  6000 [SYN] Seq=0 Win=64240 Len=0 MSS=1460 SACK_PERM TSval=29020770 TSecr=0 WS=128
130,50.607629,192.168.11.41,192.168.11.24,TCP,74,0.000132,,,"6000  >  44866 [SYN, ACK] Seq=0 Ack=1 Win=65160 Len=0 MSS=1460 SACK_PERM TSval=267522591 TSecr=29020770 WS=128"
131,50.614425,192.168.11.24,192.168.11.41,TCP,66,0.006796,,,44866  >  6000 [ACK] Seq=1 Ack=1 Win=64256 Len=0 TSval=29020777 TSecr=267522591
132,50.615113,192.168.11.24,192.168.11.41,TCP,93,0.000688,,,"44866  >  6000 [PSH, ACK] Seq=1 Ack=1 Win=64256 Len=27 TSval=29020777 TSecr=267522591 [TCP segment of a reassembled PDU]"
133,50.615266,192.168.11.41,192.168.11.24,TCP,66,0.000153,,,6000  >  44866 [ACK] Seq=1 Ack=28 Win=65152 Len=0 TSval=267522598 TSecr=29020777
134,50.615413,192.168.11.24,192.168.11.41,TCP,66,0.000147,,,"44866  >  6000 [FIN, ACK] Seq=28 Ack=1 Win=64256 Len=0 TSval=29020777 TSecr=267522591"
135,50.61635,192.168.11.41,192.168.11.24,TCP,66,0.000937,,,"6000  >  44866 [FIN, ACK] Seq=1 Ack=29 Win=65152 Len=0 TSval=267522600 TSecr=29020777"
136,50.62247,192.168.11.24,192.168.11.41,TCP,66,0.00612,,,44866  >  6000 [ACK] Seq=29 Ack=2 Win=64256 Len=0 TSval=29020785 TSecr=267522600
137,57.692224,192.168.11.41,192.168.11.40,TCP,74,7.069754,,,36122  >  6000 [SYN] Seq=0 Win=64240 Len=0 MSS=1460 SACK_PERM TSval=47547118 TSecr=0 WS=128
138,57.698876,192.168.11.40,192.168.11.41,TCP,74,0.006652,,,"6000  >  36122 [SYN, ACK] Seq=0 Ack=1 Win=65160 Len=0 MSS=1460 SACK_PERM TSval=2498638657 TSecr=47547118 WS=128"
139,57.698989,192.168.11.41,192.168.11.40,TCP,66,0.000113,,,36122  >  6000 [ACK] Seq=1 Ack=1 Win=64256 Len=0 TSval=47547125 TSecr=2498638657
140,57.699177,192.168.11.41,192.168.11.40,TCP,93,0.000188,,,"36122  >  6000 [PSH, ACK] Seq=1 Ack=1 Win=64256 Len=27 TSval=47547125 TSecr=2498638657 [TCP segment of a reassembled PDU]"
141,57.699322,192.168.11.41,192.168.11.40,TCP,66,0.000145,,,"36122  >  6000 [FIN, ACK] Seq=28 Ack=1 Win=64256 Len=0 TSval=47547126 TSecr=2498638657"
142,57.705994,192.168.11.40,192.168.11.41,TCP,66,0.006672,,,6000  >  36122 [ACK] Seq=1 Ack=28 Win=65152 Len=0 TSval=2498638664 TSecr=47547125
143,57.70621,192.168.11.40,192.168.11.41,TCP,66,0.000216,,,"6000  >  36122 [FIN, ACK] Seq=1 Ack=29 Win=65152 Len=0 TSval=2498638665 TSecr=47547126"
144,57.706257,192.168.11.41,192.168.11.40,TCP,66,0.000047,,,36122  >  6000 [ACK] Seq=29 Ack=2 Win=64256 Len=0 TSval=47547133 TSecr=2498638665
145,57.73659,192.168.11.41,255.255.255.255,UDP,209,0.030333,Ÿ,7b2273656d616e74696373223a207b22656e74697479223a2022504944222c202262617365656e74697479223a2022616e79222c2022726f6c65223a2022303031222c20227370617469616c223a2022616e79222c202274656d706f72616c223a2022616e79227d2c20226461746170726f7065727479223a207b22666f726d6174223a2022696e616f6b615f70726f6772616d5f73616d706c655f73656d616e746963227d7d,46587  >  7000 Len=167
146,57.746941,192.168.11.24,192.168.11.41,TCP,74,0.010351,œ,,42932  >  6000 [SYN] Seq=0 Win=64240 Len=0 MSS=1460 SACK_PERM TSval=29027909 TSecr=0 WS=128
147,57.747102,192.168.11.41,192.168.11.24,TCP,74,0.000161,,,"6000  >  42932 [SYN, ACK] Seq=0 Ack=1 Win=65160 Len=0 MSS=1460 SACK_PERM TSval=267529730 TSecr=29027909 WS=128"
148,57.754011,192.168.11.24,192.168.11.41,TCP,66,0.006909,,,42932  >  6000 [ACK] Seq=1 Ack=1 Win=64256 Len=0 TSval=29027916 TSecr=267529730
149,57.754589,192.168.11.24,192.168.11.41,TCP,93,0.000578,,,"42932  >  6000 [PSH, ACK] Seq=1 Ack=1 Win=64256 Len=27 TSval=29027916 TSecr=267529730 [TCP segment of a reassembled PDU]"
150,57.754693,192.168.11.41,192.168.11.24,TCP,66,0.000104,,,6000  >  42932 [ACK] Seq=1 Ack=28 Win=65152 Len=0 TSval=267529738 TSecr=29027916
151,57.75477,192.168.11.24,192.168.11.41,TCP,66,0.000077,,,"42932  >  6000 [FIN, ACK] Seq=28 Ack=1 Win=64256 Len=0 TSval=29027917 TSecr=267529730"
152,57.756543,192.168.11.41,192.168.11.24,TCP,66,0.001773,,,"6000  >  42932 [FIN, ACK] Seq=1 Ack=29 Win=65152 Len=0 TSval=267529740 TSecr=29027917"
153,57.761638,192.168.11.24,192.168.11.41,TCP,66,0.005095,,,42932  >  6000 [ACK] Seq=29 Ack=2 Win=64256 Len=0 TSval=29027924 TSecr=267529740
154,64.834592,192.168.11.41,192.168.11.40,TCP,74,7.072954,,,40848  >  6000 [SYN] Seq=0 Win=64240 Len=0 MSS=1460 SACK_PERM TSval=47554261 TSecr=0 WS=128
155,64.841461,192.168.11.40,192.168.11.41,TCP,74,0.006869,,,"6000  >  40848 [SYN, ACK] Seq=0 Ack=1 Win=65160 Len=0 MSS=1460 SACK_PERM TSval=2498645799 TSecr=47554261 WS=128"
156,64.841578,192.168.11.41,192.168.11.40,TCP,66,0.000117,,,40848  >  6000 [ACK] Seq=1 Ack=1 Win=64256 Len=0 TSval=47554268 TSecr=2498645799
157,64.841756,192.168.11.41,192.168.11.40,TCP,93,0.000178,,,"40848  >  6000 [PSH, ACK] Seq=1 Ack=1 Win=64256 Len=27 TSval=47554268 TSecr=2498645799 [TCP segment of a reassembled PDU]"
158,64.841881,192.168.11.41,192.168.11.40,TCP,66,0.000125,,,"40848  >  6000 [FIN, ACK] Seq=28 Ack=1 Win=64256 Len=0 TSval=47554268 TSecr=2498645799"
159,64.848957,192.168.11.40,192.168.11.41,TCP,66,0.007076,,,6000  >  40848 [ACK] Seq=1 Ack=28 Win=65152 Len=0 TSval=2498645807 TSecr=47554268
160,64.849191,192.168.11.40,192.168.11.41,TCP,66,0.000234,,,"6000  >  40848 [FIN, ACK] Seq=1 Ack=29 Win=65152 Len=0 TSval=2498645809 TSecr=47554268"
161,64.849235,192.168.11.41,192.168.11.40,TCP,66,0.000044,,,40848  >  6000 [ACK] Seq=29 Ack=2 Win=64256 Len=0 TSval=47554275 TSecr=2498645809
162,64.886541,192.168.11.41,255.255.255.255,UDP,209,0.037306,Ÿ,7b2273656d616e74696373223a207b22656e74697479223a2022504944222c202262617365656e74697479223a2022616e79222c2022726f6c65223a2022303031222c20227370617469616c223a2022616e79222c202274656d706f72616c223a2022616e79227d2c20226461746170726f7065727479223a207b22666f726d6174223a2022696e616f6b615f70726f6772616d5f73616d706c655f73656d616e746963227d7d,47067  >  7000 Len=167
163,64.893948,192.168.11.24,192.168.11.41,TCP,74,0.007407,œ,,42946  >  6000 [SYN] Seq=0 Win=64240 Len=0 MSS=1460 SACK_PERM TSval=29035056 TSecr=0 WS=128
164,64.894096,192.168.11.41,192.168.11.24,TCP,74,0.000148,,,"6000  >  42946 [SYN, ACK] Seq=0 Ack=1 Win=65160 Len=0 MSS=1460 SACK_PERM TSval=267536877 TSecr=29035056 WS=128"
165,64.900724,192.168.11.24,192.168.11.41,TCP,66,0.006628,,,42946  >  6000 [ACK] Seq=1 Ack=1 Win=64256 Len=0 TSval=29035063 TSecr=267536877
166,64.901306,192.168.11.24,192.168.11.41,TCP,93,0.000582,,,"42946  >  6000 [PSH, ACK] Seq=1 Ack=1 Win=64256 Len=27 TSval=29035063 TSecr=267536877 [TCP segment of a reassembled PDU]"
167,64.901413,192.168.11.41,192.168.11.24,TCP,66,0.000107,,,6000  >  42946 [ACK] Seq=1 Ack=28 Win=65152 Len=0 TSval=267536885 TSecr=29035063
168,64.901487,192.168.11.24,192.168.11.41,TCP,66,0.000074,,,"42946  >  6000 [FIN, ACK] Seq=28 Ack=1 Win=64256 Len=0 TSval=29035063 TSecr=267536877"
169,64.903204,192.168.11.41,192.168.11.24,TCP,66,0.001717,,,"6000  >  42946 [FIN, ACK] Seq=1 Ack=29 Win=65152 Len=0 TSval=267536886 TSecr=29035063"
170,64.910575,192.168.11.24,192.168.11.41,TCP,66,0.007371,,,42946  >  6000 [ACK] Seq=29 Ack=2 Win=64256 Len=0 TSval=29035071 TSecr=267536886
171,110.516082,192.168.11.41,192.168.11.40,TCP,74,45.605507,,,54768  >  6000 [SYN] Seq=0 Win=64240 Len=0 MSS=1460 SACK_PERM TSval=47599942 TSecr=0 WS=128
172,110.522689,192.168.11.40,192.168.11.41,TCP,74,0.006607,,,"6000  >  54768 [SYN, ACK] Seq=0 Ack=1 Win=65160 Len=0 MSS=1460 SACK_PERM TSval=2498691480 TSecr=47599942 WS=128"
173,110.522799,192.168.11.41,192.168.11.40,TCP,66,0.00011,,,54768  >  6000 [ACK] Seq=1 Ack=1 Win=64256 Len=0 TSval=47599949 TSecr=2498691480
174,110.52296,192.168.11.41,192.168.11.40,TCP,93,0.000161,,,"54768  >  6000 [PSH, ACK] Seq=1 Ack=1 Win=64256 Len=27 TSval=47599949 TSecr=2498691480 [TCP segment of a reassembled PDU]"
175,110.523049,192.168.11.41,192.168.11.40,TCP,66,0.000089,,,"54768  >  6000 [FIN, ACK] Seq=28 Ack=1 Win=64256 Len=0 TSval=47599949 TSecr=2498691480"
176,110.529905,192.168.11.40,192.168.11.41,TCP,66,0.006856,,,6000  >  54768 [ACK] Seq=1 Ack=28 Win=65152 Len=0 TSval=2498691488 TSecr=47599949
177,110.530273,192.168.11.40,192.168.11.41,TCP,66,0.000368,,,"6000  >  54768 [FIN, ACK] Seq=1 Ack=29 Win=65152 Len=0 TSval=2498691489 TSecr=47599949"
178,110.530318,192.168.11.41,192.168.11.40,TCP,66,0.000045,,,54768  >  6000 [ACK] Seq=29 Ack=2 Win=64256 Len=0 TSval=47599957 TSecr=2498691489
179,110.559405,192.168.11.41,255.255.255.255,UDP,209,0.029087,Ÿ,7b2273656d616e74696373223a207b22656e74697479223a2022504944222c202262617365656e74697479223a2022616e79222c2022726f6c65223a2022303031222c20227370617469616c223a2022616e79222c202274656d706f72616c223a2022616e79227d2c20226461746170726f7065727479223a207b22666f726d6174223a2022696e616f6b615f70726f6772616d5f73616d706c655f73656d616e746963227d7d,32852  >  7000 Len=167
180,110.567061,192.168.11.24,192.168.11.41,TCP,74,0.007656,œ,,60986  >  6000 [SYN] Seq=0 Win=64240 Len=0 MSS=1460 SACK_PERM TSval=29080727 TSecr=0 WS=128
181,110.567199,192.168.11.41,192.168.11.24,TCP,74,0.000138,,,"6000  >  60986 [SYN, ACK] Seq=0 Ack=1 Win=65160 Len=0 MSS=1460 SACK_PERM TSval=267582550 TSecr=29080727 WS=128"
182,110.5741,192.168.11.24,192.168.11.41,TCP,66,0.006901,,,60986  >  6000 [ACK] Seq=1 Ack=1 Win=64256 Len=0 TSval=29080734 TSecr=267582550
183,110.574598,192.168.11.24,192.168.11.41,TCP,93,0.000498,,,"60986  >  6000 [PSH, ACK] Seq=1 Ack=1 Win=64256 Len=27 TSval=29080734 TSecr=267582550 [TCP segment of a reassembled PDU]"
184,110.574665,192.168.11.41,192.168.11.24,TCP,66,0.000067,,,6000  >  60986 [ACK] Seq=1 Ack=28 Win=65152 Len=0 TSval=267582558 TSecr=29080734
185,110.574734,192.168.11.24,192.168.11.41,TCP,66,0.000069,,,"60986  >  6000 [FIN, ACK] Seq=28 Ack=1 Win=64256 Len=0 TSval=29080734 TSecr=267582550"
186,110.575662,192.168.11.41,192.168.11.24,TCP,66,0.000928,,,"6000  >  60986 [FIN, ACK] Seq=1 Ack=29 Win=65152 Len=0 TSval=267582559 TSecr=29080734"
187,110.585554,192.168.11.24,192.168.11.41,TCP,66,0.009892,,,60986  >  6000 [ACK] Seq=29 Ack=2 Win=64256 Len=0 TSval=29080745 TSecr=267582559
188,117.699488,192.168.11.41,192.168.11.40,TCP,74,7.113934,,,44926  >  6000 [SYN] Seq=0 Win=64240 Len=0 MSS=1460 SACK_PERM TSval=47607126 TSecr=0 WS=128
189,117.70649,192.168.11.40,192.168.11.41,TCP,74,0.007002,,,"6000  >  44926 [SYN, ACK] Seq=0 Ack=1 Win=65160 Len=0 MSS=1460 SACK_PERM TSval=2498698664 TSecr=47607126 WS=128"
190,117.706589,192.168.11.41,192.168.11.40,TCP,66,0.000099,,,44926  >  6000 [ACK] Seq=1 Ack=1 Win=64256 Len=0 TSval=47607133 TSecr=2498698664
191,117.706721,192.168.11.41,192.168.11.40,TCP,93,0.000132,,,"44926  >  6000 [PSH, ACK] Seq=1 Ack=1 Win=64256 Len=27 TSval=47607133 TSecr=2498698664 [TCP segment of a reassembled PDU]"
192,117.706839,192.168.11.41,192.168.11.40,TCP,66,0.000118,,,"44926  >  6000 [FIN, ACK] Seq=28 Ack=1 Win=64256 Len=0 TSval=47607133 TSecr=2498698664"
193,117.714196,192.168.11.40,192.168.11.41,TCP,66,0.007357,,,6000  >  44926 [ACK] Seq=1 Ack=28 Win=65152 Len=0 TSval=2498698672 TSecr=47607133
194,117.714554,192.168.11.40,192.168.11.41,TCP,66,0.000358,,,"6000  >  44926 [FIN, ACK] Seq=1 Ack=29 Win=65152 Len=0 TSval=2498698673 TSecr=47607133"
195,117.714598,192.168.11.41,192.168.11.40,TCP,66,0.000044,,,44926  >  6000 [ACK] Seq=29 Ack=2 Win=64256 Len=0 TSval=47607141 TSecr=2498698673
196,117.744044,192.168.11.41,255.255.255.255,UDP,209,0.029446,Ÿ,7b2273656d616e74696373223a207b22656e74697479223a2022504944222c202262617365656e74697479223a2022616e79222c2022726f6c65223a2022303031222c20227370617469616c223a2022616e79222c202274656d706f72616c223a2022616e79227d2c20226461746170726f7065727479223a207b22666f726d6174223a2022696e616f6b615f70726f6772616d5f73616d706c655f73656d616e746963227d7d,32900  >  7000 Len=167
197,117.753294,192.168.11.24,192.168.11.41,TCP,74,0.00925,œ,,37362  >  6000 [SYN] Seq=0 Win=64240 Len=0 MSS=1460 SACK_PERM TSval=29087913 TSecr=0 WS=128
198,117.753414,192.168.11.41,192.168.11.24,TCP,74,0.00012,,,"6000  >  37362 [SYN, ACK] Seq=0 Ack=1 Win=65160 Len=0 MSS=1460 SACK_PERM TSval=267589737 TSecr=29087913 WS=128"
199,117.759956,192.168.11.24,192.168.11.41,TCP,66,0.006542,,,37362  >  6000 [ACK] Seq=1 Ack=1 Win=64256 Len=0 TSval=29087920 TSecr=267589737
200,117.760509,192.168.11.24,192.168.11.41,TCP,93,0.000553,,,"37362  >  6000 [PSH, ACK] Seq=1 Ack=1 Win=64256 Len=27 TSval=29087920 TSecr=267589737 [TCP segment of a reassembled PDU]"
201,117.760592,192.168.11.41,192.168.11.24,TCP,66,0.000083,,,6000  >  37362 [ACK] Seq=1 Ack=28 Win=65152 Len=0 TSval=267589744 TSecr=29087920
202,117.76068,192.168.11.24,192.168.11.41,TCP,66,0.000088,,,"37362  >  6000 [FIN, ACK] Seq=28 Ack=1 Win=64256 Len=0 TSval=29087920 TSecr=267589737"
203,117.761745,192.168.11.41,192.168.11.24,TCP,66,0.001065,,,"6000  >  37362 [FIN, ACK] Seq=1 Ack=29 Win=65152 Len=0 TSval=267589745 TSecr=29087920"
204,117.767982,192.168.11.24,192.168.11.41,TCP,66,0.006237,,,37362  >  6000 [ACK] Seq=29 Ack=2 Win=64256 Len=0 TSval=29087928 TSecr=267589745
205,124.929911,192.168.11.41,192.168.11.40,TCP,74,7.161929,,,41196  >  6000 [SYN] Seq=0 Win=64240 Len=0 MSS=1460 SACK_PERM TSval=47614356 TSecr=0 WS=128
206,124.936763,192.168.11.40,192.168.11.41,TCP,74,0.006852,,,"6000  >  41196 [SYN, ACK] Seq=0 Ack=1 Win=65160 Len=0 MSS=1460 SACK_PERM TSval=2498705894 TSecr=47614356 WS=128"
207,124.936864,192.168.11.41,192.168.11.40,TCP,66,0.000101,,,41196  >  6000 [ACK] Seq=1 Ack=1 Win=64256 Len=0 TSval=47614363 TSecr=2498705894
208,124.937118,192.168.11.41,192.168.11.40,TCP,93,0.000254,,,"41196  >  6000 [PSH, ACK] Seq=1 Ack=1 Win=64256 Len=27 TSval=47614363 TSecr=2498705894 [TCP segment of a reassembled PDU]"
209,124.937244,192.168.11.41,192.168.11.40,TCP,66,0.000126,,,"41196  >  6000 [FIN, ACK] Seq=28 Ack=1 Win=64256 Len=0 TSval=47614364 TSecr=2498705894"
210,124.945373,192.168.11.40,192.168.11.41,TCP,66,0.008129,,,6000  >  41196 [ACK] Seq=1 Ack=28 Win=65152 Len=0 TSval=2498705902 TSecr=47614363
211,124.945617,192.168.11.40,192.168.11.41,TCP,66,0.000244,,,"6000  >  41196 [FIN, ACK] Seq=1 Ack=29 Win=65152 Len=0 TSval=2498705904 TSecr=47614364"
212,124.94566,192.168.11.41,192.168.11.40,TCP,66,0.000043,,,41196  >  6000 [ACK] Seq=29 Ack=2 Win=64256 Len=0 TSval=47614372 TSecr=2498705904
213,124.974746,192.168.11.41,255.255.255.255,UDP,209,0.029086,Ÿ,7b2273656d616e74696373223a207b22656e74697479223a2022504944222c202262617365656e74697479223a2022616e79222c2022726f6c65223a2022303031222c20227370617469616c223a2022616e79222c202274656d706f72616c223a2022616e79227d2c20226461746170726f7065727479223a207b22666f726d6174223a2022696e616f6b615f70726f6772616d5f73616d706c655f73656d616e746963227d7d,46239  >  7000 Len=167
214,124.98307,192.168.11.24,192.168.11.41,TCP,74,0.008324,œ,,37368  >  6000 [SYN] Seq=0 Win=64240 Len=0 MSS=1460 SACK_PERM TSval=29095143 TSecr=0 WS=128
215,124.983205,192.168.11.41,192.168.11.24,TCP,74,0.000135,,,"6000  >  37368 [SYN, ACK] Seq=0 Ack=1 Win=65160 Len=0 MSS=1460 SACK_PERM TSval=267596966 TSecr=29095143 WS=128"
216,124.989732,192.168.11.24,192.168.11.41,TCP,66,0.006527,,,37368  >  6000 [ACK] Seq=1 Ack=1 Win=64256 Len=0 TSval=29095150 TSecr=267596966
217,124.990185,192.168.11.24,192.168.11.41,TCP,93,0.000453,,,"37368  >  6000 [PSH, ACK] Seq=1 Ack=1 Win=64256 Len=27 TSval=29095150 TSecr=267596966 [TCP segment of a reassembled PDU]"
218,124.990242,192.168.11.41,192.168.11.24,TCP,66,0.000057,,,6000  >  37368 [ACK] Seq=1 Ack=28 Win=65152 Len=0 TSval=267596973 TSecr=29095150
219,124.990301,192.168.11.24,192.168.11.41,TCP,66,0.000059,,,"37368  >  6000 [FIN, ACK] Seq=28 Ack=1 Win=64256 Len=0 TSval=29095150 TSecr=267596966"
220,124.991181,192.168.11.41,192.168.11.24,TCP,66,0.00088,,,"6000  >  37368 [FIN, ACK] Seq=1 Ack=29 Win=65152 Len=0 TSval=267596974 TSecr=29095150"
221,124.999948,192.168.11.24,192.168.11.41,TCP,66,0.008767,,,37368  >  6000 [ACK] Seq=29 Ack=2 Win=64256 Len=0 TSval=29095157 TSecr=267596974
222,132.091448,192.168.11.41,192.168.11.40,TCP,74,7.0915,,,45898  >  6000 [SYN] Seq=0 Win=64240 Len=0 MSS=1460 SACK_PERM TSval=47621518 TSecr=0 WS=128
223,132.097936,192.168.11.40,192.168.11.41,TCP,74,0.006488,,,"6000  >  45898 [SYN, ACK] Seq=0 Ack=1 Win=65160 Len=0 MSS=1460 SACK_PERM TSval=2498713056 TSecr=47621518 WS=128"
224,132.098026,192.168.11.41,192.168.11.40,TCP,66,0.00009,,,45898  >  6000 [ACK] Seq=1 Ack=1 Win=64256 Len=0 TSval=47621524 TSecr=2498713056
225,132.09819,192.168.11.41,192.168.11.40,TCP,93,0.000164,,,"45898  >  6000 [PSH, ACK] Seq=1 Ack=1 Win=64256 Len=27 TSval=47621524 TSecr=2498713056 [TCP segment of a reassembled PDU]"
226,132.09828,192.168.11.41,192.168.11.40,TCP,66,0.00009,,,"45898  >  6000 [FIN, ACK] Seq=28 Ack=1 Win=64256 Len=0 TSval=47621525 TSecr=2498713056"
227,132.10543,192.168.11.40,192.168.11.41,TCP,66,0.00715,,,6000  >  45898 [ACK] Seq=1 Ack=28 Win=65152 Len=0 TSval=2498713063 TSecr=47621524
228,132.105787,192.168.11.40,192.168.11.41,TCP,66,0.000357,,,"6000  >  45898 [FIN, ACK] Seq=1 Ack=29 Win=65152 Len=0 TSval=2498713064 TSecr=47621525"
229,132.105836,192.168.11.41,192.168.11.40,TCP,66,0.000049,,,45898  >  6000 [ACK] Seq=29 Ack=2 Win=64256 Len=0 TSval=47621532 TSecr=2498713064
230,132.134258,192.168.11.41,255.255.255.255,UDP,209,0.028422,Ÿ,7b2273656d616e74696373223a207b22656e74697479223a2022504944222c202262617365656e74697479223a2022616e79222c2022726f6c65223a2022303031222c20227370617469616c223a2022616e79222c202274656d706f72616c223a2022616e79227d2c20226461746170726f7065727479223a207b22666f726d6174223a2022696e616f6b615f70726f6772616d5f73616d706c655f73656d616e746963227d7d,40395  >  7000 Len=167
231,132.142136,192.168.11.24,192.168.11.41,TCP,74,0.007878,œ,,35710  >  6000 [SYN] Seq=0 Win=64240 Len=0 MSS=1460 SACK_PERM TSval=29102302 TSecr=0 WS=128
232,132.142273,192.168.11.41,192.168.11.24,TCP,74,0.000137,,,"6000  >  35710 [SYN, ACK] Seq=0 Ack=1 Win=65160 Len=0 MSS=1460 SACK_PERM TSval=267604126 TSecr=29102302 WS=128"
233,132.14972,192.168.11.24,192.168.11.41,TCP,66,0.007447,,,35710  >  6000 [ACK] Seq=1 Ack=1 Win=64256 Len=0 TSval=29102309 TSecr=267604126
234,132.150679,192.168.11.24,192.168.11.41,TCP,93,0.000959,,,"35710  >  6000 [PSH, ACK] Seq=1 Ack=1 Win=64256 Len=27 TSval=29102309 TSecr=267604126 [TCP segment of a reassembled PDU]"
