No.,Time,Source,Destination,Protocol,Length,Time delta from previous captured frame,XXX,Arrival Time,Data,Info
1,0,192.168.11.42,255.255.255.255,UDP,212,0,Ÿ,"Jan 11, 2024 16:04:49.545478000 JST",7b2273656d616e74696373223a207b22656e74697479223a2022504944303031222c202262617365656e74697479223a2022616e79222c2022726f6c65223a2022616161222c20227370617469616c223a2022616e79222c202274656d706f72616c223a2022616e79227d2c20226461746170726f7065727479223a207b22666f726d6174223a2022696e616f6b615f70726f6772616d5f73616d706c655f73656d616e746963227d7d,35725  >  7000 Len=170
2,0.013982,192.168.11.27,192.168.11.42,TCP,74,0.013982,œ,"Jan 11, 2024 16:04:49.559460000 JST",,33232  >  6000 [SYN] Seq=0 Win=64240 Len=0 MSS=1460 SACK_PERM TSval=806400957 TSecr=0 WS=128
3,0.014137,192.168.11.42,192.168.11.27,TCP,74,0.000155,,"Jan 11, 2024 16:04:49.559615000 JST",,"6000  >  33232 [SYN, ACK] Seq=0 Ack=1 Win=65160 Len=0 MSS=1460 SACK_PERM TSval=418427997 TSecr=806400957 WS=128"
4,0.023286,192.168.11.27,192.168.11.42,TCP,66,0.009149,,"Jan 11, 2024 16:04:49.568764000 JST",,33232  >  6000 [ACK] Seq=1 Ack=1 Win=64256 Len=0 TSval=806400972 TSecr=418427997
5,0.023619,192.168.11.27,192.168.11.42,TCP,93,0.000333,,"Jan 11, 2024 16:04:49.569097000 JST",,"33232  >  6000 [PSH, ACK] Seq=1 Ack=1 Win=64256 Len=27 TSval=806400972 TSecr=418427997 [TCP segment of a reassembled PDU]"
6,0.023682,192.168.11.42,192.168.11.27,TCP,66,0.000063,,"Jan 11, 2024 16:04:49.569160000 JST",,6000  >  33232 [ACK] Seq=1 Ack=28 Win=65152 Len=0 TSval=418428007 TSecr=806400972
7,0.023721,192.168.11.27,192.168.11.42,TCP,66,0.000039,,"Jan 11, 2024 16:04:49.569199000 JST",,"33232  >  6000 [FIN, ACK] Seq=28 Ack=1 Win=64256 Len=0 TSval=806400973 TSecr=418427997"
8,0.064362,192.168.11.42,192.168.11.27,TCP,66,0.040641,,"Jan 11, 2024 16:04:49.609840000 JST",,6000  >  33232 [ACK] Seq=1 Ack=29 Win=65152 Len=0 TSval=418428048 TSecr=806400973
9,7.361189,192.168.11.42,255.255.255.255,UDP,212,7.296827,Ÿ,"Jan 11, 2024 16:04:56.906667000 JST",7b2273656d616e74696373223a207b22656e74697479223a2022504944303031222c202262617365656e74697479223a2022616e79222c2022726f6c65223a2022616161222c20227370617469616c223a2022616e79222c202274656d706f72616c223a2022616e79227d2c20226461746170726f7065727479223a207b22666f726d6174223a2022696e616f6b615f70726f6772616d5f73616d706c655f73656d616e746963227d7d,53571  >  7000 Len=170
10,7.369556,192.168.11.27,192.168.11.42,TCP,74,0.008367,œ,"Jan 11, 2024 16:04:56.915034000 JST",,50440  >  6000 [SYN] Seq=0 Win=64240 Len=0 MSS=1460 SACK_PERM TSval=806408318 TSecr=0 WS=128
11,7.369689,192.168.11.42,192.168.11.27,TCP,74,0.000133,,"Jan 11, 2024 16:04:56.915167000 JST",,"6000  >  50440 [SYN, ACK] Seq=0 Ack=1 Win=65160 Len=0 MSS=1460 SACK_PERM TSval=418435353 TSecr=806408318 WS=128"
12,7.379323,192.168.11.27,192.168.11.42,TCP,66,0.009634,,"Jan 11, 2024 16:04:56.924801000 JST",,50440  >  6000 [ACK] Seq=1 Ack=1 Win=64256 Len=0 TSval=806408329 TSecr=418435353
13,7.379896,192.168.11.27,192.168.11.42,TCP,93,0.000573,,"Jan 11, 2024 16:04:56.925374000 JST",,"50440  >  6000 [PSH, ACK] Seq=1 Ack=1 Win=64256 Len=27 TSval=806408329 TSecr=418435353 [TCP segment of a reassembled PDU]"
14,7.379991,192.168.11.42,192.168.11.27,TCP,66,0.000095,,"Jan 11, 2024 16:04:56.925469000 JST",,6000  >  50440 [ACK] Seq=1 Ack=28 Win=65152 Len=0 TSval=418435363 TSecr=806408329
15,7.38007,192.168.11.27,192.168.11.42,TCP,66,0.000079,,"Jan 11, 2024 16:04:56.925548000 JST",,"50440  >  6000 [FIN, ACK] Seq=28 Ack=1 Win=64256 Len=0 TSval=806408329 TSecr=418435353"
16,7.381012,192.168.11.42,192.168.11.27,TCP,66,0.000942,,"Jan 11, 2024 16:04:56.926490000 JST",,"6000  >  33232 [FIN, ACK] Seq=1 Ack=29 Win=65152 Len=0 TSval=418435364 TSecr=806400973"
17,7.387312,192.168.11.27,192.168.11.42,TCP,66,0.0063,,"Jan 11, 2024 16:04:56.932790000 JST",,33232  >  6000 [ACK] Seq=29 Ack=2 Win=64256 Len=0 TSval=806408337 TSecr=418435364
18,7.420412,192.168.11.42,192.168.11.27,TCP,66,0.0331,,"Jan 11, 2024 16:04:56.965890000 JST",,6000  >  50440 [ACK] Seq=1 Ack=29 Win=65152 Len=0 TSval=418435404 TSecr=806408329
19,14.7205,192.168.11.42,255.255.255.255,UDP,212,7.300088,Ÿ,"Jan 11, 2024 16:05:04.265978000 JST",7b2273656d616e74696373223a207b22656e74697479223a2022504944303031222c202262617365656e74697479223a2022616e79222c2022726f6c65223a2022616161222c20227370617469616c223a2022616e79222c202274656d706f72616c223a2022616e79227d2c20226461746170726f7065727479223a207b22666f726d6174223a2022696e616f6b615f70726f6772616d5f73616d706c655f73656d616e746963227d7d,55399  >  7000 Len=170
20,14.728749,192.168.11.27,192.168.11.42,TCP,74,0.008249,œ,"Jan 11, 2024 16:05:04.274227000 JST",,37074  >  6000 [SYN] Seq=0 Win=64240 Len=0 MSS=1460 SACK_PERM TSval=806415677 TSecr=0 WS=128
21,14.728893,192.168.11.42,192.168.11.27,TCP,74,0.000144,,"Jan 11, 2024 16:05:04.274371000 JST",,"6000  >  37074 [SYN, ACK] Seq=0 Ack=1 Win=65160 Len=0 MSS=1460 SACK_PERM TSval=418442712 TSecr=806415677 WS=128"
22,14.738234,192.168.11.27,192.168.11.42,TCP,66,0.009341,,"Jan 11, 2024 16:05:04.283712000 JST",,37074  >  6000 [ACK] Seq=1 Ack=1 Win=64256 Len=0 TSval=806415687 TSecr=418442712
23,14.738853,192.168.11.27,192.168.11.42,TCP,93,0.000619,,"Jan 11, 2024 16:05:04.284331000 JST",,"37074  >  6000 [PSH, ACK] Seq=1 Ack=1 Win=64256 Len=27 TSval=806415688 TSecr=418442712 [TCP segment of a reassembled PDU]"
24,14.73891,192.168.11.27,192.168.11.42,TCP,66,0.000057,,"Jan 11, 2024 16:05:04.284388000 JST",,"37074  >  6000 [FIN, ACK] Seq=28 Ack=1 Win=64256 Len=0 TSval=806415688 TSecr=418442712"
25,14.738957,192.168.11.42,192.168.11.27,TCP,66,0.000047,,"Jan 11, 2024 16:05:04.284435000 JST",,6000  >  37074 [ACK] Seq=1 Ack=28 Win=65152 Len=0 TSval=418442722 TSecr=806415688
26,14.739688,192.168.11.42,192.168.11.27,TCP,66,0.000731,,"Jan 11, 2024 16:05:04.285166000 JST",,"6000  >  50440 [FIN, ACK] Seq=1 Ack=29 Win=65152 Len=0 TSval=418442723 TSecr=806408329"
27,14.747676,192.168.11.27,192.168.11.42,TCP,66,0.007988,,"Jan 11, 2024 16:05:04.293154000 JST",,50440  >  6000 [ACK] Seq=29 Ack=2 Win=64256 Len=0 TSval=806415696 TSecr=418442723
28,14.784399,192.168.11.42,192.168.11.27,TCP,66,0.036723,,"Jan 11, 2024 16:05:04.329877000 JST",,6000  >  37074 [ACK] Seq=1 Ack=29 Win=65152 Len=0 TSval=418442768 TSecr=806415688
29,21.925644,192.168.11.42,255.255.255.255,UDP,212,7.141245,Ÿ,"Jan 11, 2024 16:05:11.471122000 JST",7b2273656d616e74696373223a207b22656e74697479223a2022504944303031222c202262617365656e74697479223a2022616e79222c2022726f6c65223a2022616161222c20227370617469616c223a2022616e79222c202274656d706f72616c223a2022616e79227d2c20226461746170726f7065727479223a207b22666f726d6174223a2022696e616f6b615f70726f6772616d5f73616d706c655f73656d616e746963227d7d,59169  >  7000 Len=170
30,21.934044,192.168.11.27,192.168.11.42,TCP,74,0.0084,œ,"Jan 11, 2024 16:05:11.479522000 JST",,44636  >  6000 [SYN] Seq=0 Win=64240 Len=0 MSS=1460 SACK_PERM TSval=806422882 TSecr=0 WS=128
31,21.934192,192.168.11.42,192.168.11.27,TCP,74,0.000148,,"Jan 11, 2024 16:05:11.479670000 JST",,"6000  >  44636 [SYN, ACK] Seq=0 Ack=1 Win=65160 Len=0 MSS=1460 SACK_PERM TSval=418449917 TSecr=806422882 WS=128"
32,21.943674,192.168.11.27,192.168.11.42,TCP,66,0.009482,,"Jan 11, 2024 16:05:11.489152000 JST",,44636  >  6000 [ACK] Seq=1 Ack=1 Win=64256 Len=0 TSval=806422893 TSecr=418449917
33,21.944293,192.168.11.27,192.168.11.42,TCP,66,0.000619,,"Jan 11, 2024 16:05:11.489771000 JST",,"[TCP Previous segment not captured] 44636  >  6000 [FIN, ACK] Seq=28 Ack=1 Win=64256 Len=0 TSval=806422893 TSecr=418449917"
34,21.944457,192.168.11.42,192.168.11.27,TCP,78,0.000164,,"Jan 11, 2024 16:05:11.489935000 JST",,[TCP Window Update] 6000  >  44636 [ACK] Seq=1 Ack=1 Win=65280 Len=0 TSval=418449928 TSecr=806422893 SLE=28 SRE=29
35,21.944618,192.168.11.27,192.168.11.42,TCP,93,0.000161,,"Jan 11, 2024 16:05:11.490096000 JST",,"[TCP Out-Of-Order] 44636  >  6000 [PSH, ACK] Seq=1 Ack=1 Win=64256 Len=27 TSval=806422893 TSecr=418449917"
36,21.944683,192.168.11.42,192.168.11.27,TCP,66,0.000065,,"Jan 11, 2024 16:05:11.490161000 JST",,6000  >  44636 [ACK] Seq=1 Ack=29 Win=65280 Len=0 TSval=418449928 TSecr=806422893
37,21.945068,192.168.11.42,192.168.11.27,TCP,66,0.000385,,"Jan 11, 2024 16:05:11.490546000 JST",,"6000  >  37074 [FIN, ACK] Seq=1 Ack=29 Win=65152 Len=0 TSval=418449928 TSecr=806415688"
38,21.952946,192.168.11.27,192.168.11.42,TCP,66,0.007878,,"Jan 11, 2024 16:05:11.498424000 JST",,37074  >  6000 [ACK] Seq=29 Ack=2 Win=64256 Len=0 TSval=806422902 TSecr=418449928
39,29.164945,192.168.11.42,255.255.255.255,UDP,212,7.211999,Ÿ,"Jan 11, 2024 16:05:18.710423000 JST",7b2273656d616e74696373223a207b22656e74697479223a2022504944303031222c202262617365656e74697479223a2022616e79222c2022726f6c65223a2022616161222c20227370617469616c223a2022616e79222c202274656d706f72616c223a2022616e79227d2c20226461746170726f7065727479223a207b22666f726d6174223a2022696e616f6b615f70726f6772616d5f73616d706c655f73656d616e746963227d7d,46785  >  7000 Len=170
40,29.175398,192.168.11.27,192.168.11.42,TCP,74,0.010453,œ,"Jan 11, 2024 16:05:18.720876000 JST",,44642  >  6000 [SYN] Seq=0 Win=64240 Len=0 MSS=1460 SACK_PERM TSval=806430123 TSecr=0 WS=128
41,29.17556,192.168.11.42,192.168.11.27,TCP,74,0.000162,,"Jan 11, 2024 16:05:18.721038000 JST",,"6000  >  44642 [SYN, ACK] Seq=0 Ack=1 Win=65160 Len=0 MSS=1460 SACK_PERM TSval=418457159 TSecr=806430123 WS=128"
42,29.184787,192.168.11.27,192.168.11.42,TCP,66,0.009227,,"Jan 11, 2024 16:05:18.730265000 JST",,44642  >  6000 [ACK] Seq=1 Ack=1 Win=64256 Len=0 TSval=806430134 TSecr=418457159
43,29.185369,192.168.11.27,192.168.11.42,TCP,93,0.000582,,"Jan 11, 2024 16:05:18.730847000 JST",,"44642  >  6000 [PSH, ACK] Seq=1 Ack=1 Win=64256 Len=27 TSval=806430134 TSecr=418457159 [TCP segment of a reassembled PDU]"
44,29.185482,192.168.11.42,192.168.11.27,TCP,66,0.000113,,"Jan 11, 2024 16:05:18.730960000 JST",,6000  >  44642 [ACK] Seq=1 Ack=28 Win=65152 Len=0 TSval=418457169 TSecr=806430134
45,29.185557,192.168.11.27,192.168.11.42,TCP,66,0.000075,,"Jan 11, 2024 16:05:18.731035000 JST",,"44642  >  6000 [FIN, ACK] Seq=28 Ack=1 Win=64256 Len=0 TSval=806430134 TSecr=418457159"
46,29.185923,192.168.11.42,192.168.11.27,TCP,66,0.000366,,"Jan 11, 2024 16:05:18.731401000 JST",,"6000  >  44636 [FIN, ACK] Seq=1 Ack=29 Win=65280 Len=0 TSval=418457169 TSecr=806422893"
47,29.194228,192.168.11.27,192.168.11.42,TCP,66,0.008305,,"Jan 11, 2024 16:05:18.739706000 JST",,44636  >  6000 [ACK] Seq=29 Ack=2 Win=64256 Len=0 TSval=806430142 TSecr=418457169
48,29.228408,192.168.11.42,192.168.11.27,TCP,66,0.03418,,"Jan 11, 2024 16:05:18.773886000 JST",,6000  >  44642 [ACK] Seq=1 Ack=29 Win=65152 Len=0 TSval=418457212 TSecr=806430134
49,36.317908,192.168.11.42,255.255.255.255,UDP,212,7.0895,Ÿ,"Jan 11, 2024 16:05:25.863386000 JST",7b2273656d616e74696373223a207b22656e74697479223a2022504944303031222c202262617365656e74697479223a2022616e79222c2022726f6c65223a2022616161222c20227370617469616c223a2022616e79222c202274656d706f72616c223a2022616e79227d2c20226461746170726f7065727479223a207b22666f726d6174223a2022696e616f6b615f70726f6772616d5f73616d706c655f73656d616e746963227d7d,52813  >  7000 Len=170
50,36.32581,192.168.11.27,192.168.11.42,TCP,74,0.007902,œ,"Jan 11, 2024 16:05:25.871288000 JST",,43780  >  6000 [SYN] Seq=0 Win=64240 Len=0 MSS=1460 SACK_PERM TSval=806437274 TSecr=0 WS=128
51,36.325941,192.168.11.42,192.168.11.27,TCP,74,0.000131,,"Jan 11, 2024 16:05:25.871419000 JST",,"6000  >  43780 [SYN, ACK] Seq=0 Ack=1 Win=65160 Len=0 MSS=1460 SACK_PERM TSval=418464309 TSecr=806437274 WS=128"
52,36.335334,192.168.11.27,192.168.11.42,TCP,66,0.009393,,"Jan 11, 2024 16:05:25.880812000 JST",,43780  >  6000 [ACK] Seq=1 Ack=1 Win=64256 Len=0 TSval=806437284 TSecr=418464309
53,36.335938,192.168.11.27,192.168.11.42,TCP,93,0.000604,,"Jan 11, 2024 16:05:25.881416000 JST",,"43780  >  6000 [PSH, ACK] Seq=1 Ack=1 Win=64256 Len=27 TSval=806437284 TSecr=418464309 [TCP segment of a reassembled PDU]"
54,36.336031,192.168.11.42,192.168.11.27,TCP,66,0.000093,,"Jan 11, 2024 16:05:25.881509000 JST",,6000  >  43780 [ACK] Seq=1 Ack=28 Win=65152 Len=0 TSval=418464319 TSecr=806437284
55,36.336107,192.168.11.27,192.168.11.42,TCP,66,0.000076,,"Jan 11, 2024 16:05:25.881585000 JST",,"43780  >  6000 [FIN, ACK] Seq=28 Ack=1 Win=64256 Len=0 TSval=806437284 TSecr=418464309"
56,36.33693,192.168.11.42,192.168.11.27,TCP,66,0.000823,,"Jan 11, 2024 16:05:25.882408000 JST",,"6000  >  44642 [FIN, ACK] Seq=1 Ack=29 Win=65152 Len=0 TSval=418464320 TSecr=806430134"
57,36.345253,192.168.11.27,192.168.11.42,TCP,66,0.008323,,"Jan 11, 2024 16:05:25.890731000 JST",,44642  >  6000 [ACK] Seq=29 Ack=2 Win=64256 Len=0 TSval=806437293 TSecr=418464320
58,36.380407,192.168.11.42,192.168.11.27,TCP,66,0.035154,,"Jan 11, 2024 16:05:25.925885000 JST",,6000  >  43780 [ACK] Seq=1 Ack=29 Win=65152 Len=0 TSval=418464364 TSecr=806437284
59,43.512124,192.168.11.42,255.255.255.255,UDP,212,7.131717,Ÿ,"Jan 11, 2024 16:05:33.057602000 JST",7b2273656d616e74696373223a207b22656e74697479223a2022504944303031222c202262617365656e74697479223a2022616e79222c2022726f6c65223a2022616161222c20227370617469616c223a2022616e79222c202274656d706f72616c223a2022616e79227d2c20226461746170726f7065727479223a207b22666f726d6174223a2022696e616f6b615f70726f6772616d5f73616d706c655f73656d616e746963227d7d,41993  >  7000 Len=170
60,43.520498,192.168.11.27,192.168.11.42,TCP,74,0.008374,œ,"Jan 11, 2024 16:05:33.065976000 JST",,45162  >  6000 [SYN] Seq=0 Win=64240 Len=0 MSS=1460 SACK_PERM TSval=806444469 TSecr=0 WS=128
61,43.520638,192.168.11.42,192.168.11.27,TCP,74,0.00014,,"Jan 11, 2024 16:05:33.066116000 JST",,"6000  >  45162 [SYN, ACK] Seq=0 Ack=1 Win=65160 Len=0 MSS=1460 SACK_PERM TSval=418471504 TSecr=806444469 WS=128"
62,43.529985,192.168.11.27,192.168.11.42,TCP,66,0.009347,,"Jan 11, 2024 16:05:33.075463000 JST",,45162  >  6000 [ACK] Seq=1 Ack=1 Win=64256 Len=0 TSval=806444479 TSecr=418471504
63,43.5306,192.168.11.27,192.168.11.42,TCP,93,0.000615,,"Jan 11, 2024 16:05:33.076078000 JST",,"45162  >  6000 [PSH, ACK] Seq=1 Ack=1 Win=64256 Len=27 TSval=806444479 TSecr=418471504 [TCP segment of a reassembled PDU]"
64,43.530699,192.168.11.42,192.168.11.27,TCP,66,0.000099,,"Jan 11, 2024 16:05:33.076177000 JST",,6000  >  45162 [ACK] Seq=1 Ack=28 Win=65152 Len=0 TSval=418471514 TSecr=806444479
65,43.530779,192.168.11.27,192.168.11.42,TCP,66,0.00008,,"Jan 11, 2024 16:05:33.076257000 JST",,"45162  >  6000 [FIN, ACK] Seq=28 Ack=1 Win=64256 Len=0 TSval=806444479 TSecr=418471504"
66,43.532085,192.168.11.42,192.168.11.27,TCP,66,0.001306,,"Jan 11, 2024 16:05:33.077563000 JST",,"6000  >  43780 [FIN, ACK] Seq=1 Ack=29 Win=65152 Len=0 TSval=418471515 TSecr=806437284"
67,43.541264,192.168.11.27,192.168.11.42,TCP,66,0.009179,,"Jan 11, 2024 16:05:33.086742000 JST",,43780  >  6000 [ACK] Seq=29 Ack=2 Win=64256 Len=0 TSval=806444490 TSecr=418471515
68,43.572386,192.168.11.42,192.168.11.27,TCP,66,0.031122,,"Jan 11, 2024 16:05:33.117864000 JST",,6000  >  45162 [ACK] Seq=1 Ack=29 Win=65152 Len=0 TSval=418471556 TSecr=806444479
69,50.73482,192.168.11.42,255.255.255.255,UDP,212,7.162434,Ÿ,"Jan 11, 2024 16:05:40.280298000 JST",7b2273656d616e74696373223a207b22656e74697479223a2022504944303031222c202262617365656e74697479223a2022616e79222c2022726f6c65223a2022616161222c20227370617469616c223a2022616e79222c202274656d706f72616c223a2022616e79227d2c20226461746170726f7065727479223a207b22666f726d6174223a2022696e616f6b615f70726f6772616d5f73616d706c655f73656d616e746963227d7d,39514  >  7000 Len=170
70,50.743764,192.168.11.27,192.168.11.42,TCP,74,0.008944,œ,"Jan 11, 2024 16:05:40.289242000 JST",,45178  >  6000 [SYN] Seq=0 Win=64240 Len=0 MSS=1460 SACK_PERM TSval=806451692 TSecr=0 WS=128
71,50.743903,192.168.11.42,192.168.11.27,TCP,74,0.000139,,"Jan 11, 2024 16:05:40.289381000 JST",,"6000  >  45178 [SYN, ACK] Seq=0 Ack=1 Win=65160 Len=0 MSS=1460 SACK_PERM TSval=418478727 TSecr=806451692 WS=128"
72,50.753282,192.168.11.27,192.168.11.42,TCP,66,0.009379,,"Jan 11, 2024 16:05:40.298760000 JST",,45178  >  6000 [ACK] Seq=1 Ack=1 Win=64256 Len=0 TSval=806451702 TSecr=418478727
73,50.753968,192.168.11.27,192.168.11.42,TCP,93,0.000686,,"Jan 11, 2024 16:05:40.299446000 JST",,"45178  >  6000 [PSH, ACK] Seq=1 Ack=1 Win=64256 Len=27 TSval=806451702 TSecr=418478727 [TCP segment of a reassembled PDU]"
74,50.754081,192.168.11.42,192.168.11.27,TCP,66,0.000113,,"Jan 11, 2024 16:05:40.299559000 JST",,6000  >  45178 [ACK] Seq=1 Ack=28 Win=65152 Len=0 TSval=418478737 TSecr=806451702
75,50.754156,192.168.11.27,192.168.11.42,TCP,66,0.000075,,"Jan 11, 2024 16:05:40.299634000 JST",,"45178  >  6000 [FIN, ACK] Seq=28 Ack=1 Win=64256 Len=0 TSval=806451702 TSecr=418478727"
76,50.754679,192.168.11.42,192.168.11.27,TCP,66,0.000523,,"Jan 11, 2024 16:05:40.300157000 JST",,"6000  >  45162 [FIN, ACK] Seq=1 Ack=29 Win=65152 Len=0 TSval=418478738 TSecr=806444479"
77,50.762675,192.168.11.27,192.168.11.42,TCP,66,0.007996,,"Jan 11, 2024 16:05:40.308153000 JST",,45162  >  6000 [ACK] Seq=29 Ack=2 Win=64256 Len=0 TSval=806451710 TSecr=418478738
78,50.7964,192.168.11.42,192.168.11.27,TCP,66,0.033725,,"Jan 11, 2024 16:05:40.341878000 JST",,6000  >  45178 [ACK] Seq=1 Ack=29 Win=65152 Len=0 TSval=418478780 TSecr=806451702
79,57.901093,192.168.11.42,255.255.255.255,UDP,212,7.104693,Ÿ,"Jan 11, 2024 16:05:47.446571000 JST",7b2273656d616e74696373223a207b22656e74697479223a2022504944303031222c202262617365656e74697479223a2022616e79222c2022726f6c65223a2022616161222c20227370617469616c223a2022616e79222c202274656d706f72616c223a2022616e79227d2c20226461746170726f7065727479223a207b22666f726d6174223a2022696e616f6b615f70726f6772616d5f73616d706c655f73656d616e746963227d7d,37022  >  7000 Len=170
80,57.908589,192.168.11.27,192.168.11.42,TCP,74,0.007496,œ,"Jan 11, 2024 16:05:47.454067000 JST",,55846  >  6000 [SYN] Seq=0 Win=64240 Len=0 MSS=1460 SACK_PERM TSval=806458856 TSecr=0 WS=128
81,57.908723,192.168.11.42,192.168.11.27,TCP,74,0.000134,,"Jan 11, 2024 16:05:47.454201000 JST",,"6000  >  55846 [SYN, ACK] Seq=0 Ack=1 Win=65160 Len=0 MSS=1460 SACK_PERM TSval=418485892 TSecr=806458856 WS=128"
82,57.918037,192.168.11.27,192.168.11.42,TCP,66,0.009314,,"Jan 11, 2024 16:05:47.463515000 JST",,55846  >  6000 [ACK] Seq=1 Ack=1 Win=64256 Len=0 TSval=806458866 TSecr=418485892
83,57.918501,192.168.11.27,192.168.11.42,TCP,93,0.000464,,"Jan 11, 2024 16:05:47.463979000 JST",,"55846  >  6000 [PSH, ACK] Seq=1 Ack=1 Win=64256 Len=27 TSval=806458867 TSecr=418485892 [TCP segment of a reassembled PDU]"
84,57.918576,192.168.11.42,192.168.11.27,TCP,66,0.000075,,"Jan 11, 2024 16:05:47.464054000 JST",,6000  >  55846 [ACK] Seq=1 Ack=28 Win=65152 Len=0 TSval=418485902 TSecr=806458867
85,57.918642,192.168.11.27,192.168.11.42,TCP,66,0.000066,,"Jan 11, 2024 16:05:47.464120000 JST",,"55846  >  6000 [FIN, ACK] Seq=28 Ack=1 Win=64256 Len=0 TSval=806458867 TSecr=418485892"
86,57.919045,192.168.11.42,192.168.11.27,TCP,66,0.000403,,"Jan 11, 2024 16:05:47.464523000 JST",,"6000  >  45178 [FIN, ACK] Seq=1 Ack=29 Win=65152 Len=0 TSval=418485902 TSecr=806451702"
87,57.928621,192.168.11.27,192.168.11.42,TCP,66,0.009576,,"Jan 11, 2024 16:05:47.474099000 JST",,45178  >  6000 [ACK] Seq=29 Ack=2 Win=64256 Len=0 TSval=806458876 TSecr=418485902
88,57.960397,192.168.11.42,192.168.11.27,TCP,66,0.031776,,"Jan 11, 2024 16:05:47.505875000 JST",,6000  >  55846 [ACK] Seq=1 Ack=29 Win=65152 Len=0 TSval=418485944 TSecr=806458867
89,65.033949,192.168.11.42,255.255.255.255,UDP,212,7.073552,Ÿ,"Jan 11, 2024 16:05:54.579427000 JST",7b2273656d616e74696373223a207b22656e74697479223a2022504944303031222c202262617365656e74697479223a2022616e79222c2022726f6c65223a2022616161222c20227370617469616c223a2022616e79222c202274656d706f72616c223a2022616e79227d2c20226461746170726f7065727479223a207b22666f726d6174223a2022696e616f6b615f70726f6772616d5f73616d706c655f73656d616e746963227d7d,50489  >  7000 Len=170
90,65.044925,192.168.11.27,192.168.11.42,TCP,74,0.010976,œ,"Jan 11, 2024 16:05:54.590403000 JST",,56724  >  6000 [SYN] Seq=0 Win=64240 Len=0 MSS=1460 SACK_PERM TSval=806465992 TSecr=0 WS=128
91,65.045075,192.168.11.42,192.168.11.27,TCP,74,0.00015,,"Jan 11, 2024 16:05:54.590553000 JST",,"6000  >  56724 [SYN, ACK] Seq=0 Ack=1 Win=65160 Len=0 MSS=1460 SACK_PERM TSval=418493028 TSecr=806465992 WS=128"
92,65.054415,192.168.11.27,192.168.11.42,TCP,66,0.00934,,"Jan 11, 2024 16:05:54.599893000 JST",,56724  >  6000 [ACK] Seq=1 Ack=1 Win=64256 Len=0 TSval=806466002 TSecr=418493028
93,65.054955,192.168.11.27,192.168.11.42,TCP,93,0.00054,,"Jan 11, 2024 16:05:54.600433000 JST",,"56724  >  6000 [PSH, ACK] Seq=1 Ack=1 Win=64256 Len=27 TSval=806466003 TSecr=418493028 [TCP segment of a reassembled PDU]"
94,65.05504,192.168.11.42,192.168.11.27,TCP,66,0.000085,,"Jan 11, 2024 16:05:54.600518000 JST",,6000  >  56724 [ACK] Seq=1 Ack=28 Win=65152 Len=0 TSval=418493038 TSecr=806466003
95,65.05511,192.168.11.27,192.168.11.42,TCP,66,0.00007,,"Jan 11, 2024 16:05:54.600588000 JST",,"56724  >  6000 [FIN, ACK] Seq=28 Ack=1 Win=64256 Len=0 TSval=806466003 TSecr=418493028"
96,65.055441,192.168.11.42,192.168.11.27,TCP,66,0.000331,,"Jan 11, 2024 16:05:54.600919000 JST",,"6000  >  55846 [FIN, ACK] Seq=1 Ack=29 Win=65152 Len=0 TSval=418493039 TSecr=806458867"
97,65.063948,192.168.11.27,192.168.11.42,TCP,66,0.008507,,"Jan 11, 2024 16:05:54.609426000 JST",,55846  >  6000 [ACK] Seq=29 Ack=2 Win=64256 Len=0 TSval=806466011 TSecr=418493039
98,65.096371,192.168.11.42,192.168.11.27,TCP,66,0.032423,,"Jan 11, 2024 16:05:54.641849000 JST",,6000  >  56724 [ACK] Seq=1 Ack=29 Win=65152 Len=0 TSval=418493080 TSecr=806466003
99,72.251843,192.168.11.42,192.168.11.27,TCP,66,7.155472,,"Jan 11, 2024 16:06:01.797321000 JST",,"6000  >  56724 [FIN, ACK] Seq=1 Ack=29 Win=65152 Len=0 TSval=418500235 TSecr=806466003"
100,72.262066,192.168.11.27,192.168.11.42,TCP,66,0.010223,,"Jan 11, 2024 16:06:01.807544000 JST",,56724  >  6000 [ACK] Seq=29 Ack=2 Win=64256 Len=0 TSval=806473209 TSecr=418500235
101,110.711352,192.168.11.42,255.255.255.255,UDP,212,38.449286,Ÿ,"Jan 11, 2024 16:06:40.256830000 JST",7b2273656d616e74696373223a207b22656e74697479223a2022504944303031222c202262617365656e74697479223a2022616e79222c2022726f6c65223a2022616161222c20227370617469616c223a2022616e79222c202274656d706f72616c223a2022616e79227d2c20226461746170726f7065727479223a207b22666f726d6174223a2022696e616f6b615f70726f6772616d5f73616d706c655f73656d616e746963227d7d,56293  >  7000 Len=170
102,110.720989,192.168.11.27,192.168.11.42,TCP,74,0.009637,œ,"Jan 11, 2024 16:06:40.266467000 JST",,46716  >  6000 [SYN] Seq=0 Win=64240 Len=0 MSS=1460 SACK_PERM TSval=806511668 TSecr=0 WS=128
103,110.721088,192.168.11.42,192.168.11.27,TCP,74,0.000099,,"Jan 11, 2024 16:06:40.266566000 JST",,"6000  >  46716 [SYN, ACK] Seq=0 Ack=1 Win=65160 Len=0 MSS=1460 SACK_PERM TSval=418538704 TSecr=806511668 WS=128"
104,110.729257,192.168.11.27,192.168.11.42,TCP,66,0.008169,,"Jan 11, 2024 16:06:40.274735000 JST",,46716  >  6000 [ACK] Seq=1 Ack=1 Win=64256 Len=0 TSval=806511677 TSecr=418538704
105,110.729596,192.168.11.27,192.168.11.42,TCP,93,0.000339,,"Jan 11, 2024 16:06:40.275074000 JST",,"46716  >  6000 [PSH, ACK] Seq=1 Ack=1 Win=64256 Len=27 TSval=806511677 TSecr=418538704 [TCP segment of a reassembled PDU]"
106,110.729649,192.168.11.42,192.168.11.27,TCP,66,0.000053,,"Jan 11, 2024 16:06:40.275127000 JST",,6000  >  46716 [ACK] Seq=1 Ack=28 Win=65152 Len=0 TSval=418538713 TSecr=806511677
107,110.729692,192.168.11.27,192.168.11.42,TCP,66,0.000043,,"Jan 11, 2024 16:06:40.275170000 JST",,"46716  >  6000 [FIN, ACK] Seq=28 Ack=1 Win=64256 Len=0 TSval=806511677 TSecr=418538704"
108,110.77236,192.168.11.42,192.168.11.27,TCP,66,0.042668,,"Jan 11, 2024 16:06:40.317838000 JST",,6000  >  46716 [ACK] Seq=1 Ack=29 Win=65152 Len=0 TSval=418538756 TSecr=806511677
109,117.861063,192.168.11.42,255.255.255.255,UDP,212,7.088703,Ÿ,"Jan 11, 2024 16:06:47.406541000 JST",7b2273656d616e74696373223a207b22656e74697479223a2022504944303031222c202262617365656e74697479223a2022616e79222c2022726f6c65223a2022616161222c20227370617469616c223a2022616e79222c202274656d706f72616c223a2022616e79227d2c20226461746170726f7065727479223a207b22666f726d6174223a2022696e616f6b615f70726f6772616d5f73616d706c655f73656d616e746963227d7d,48378  >  7000 Len=170
110,117.870609,192.168.11.27,192.168.11.42,TCP,74,0.009546,œ,"Jan 11, 2024 16:06:47.416087000 JST",,37436  >  6000 [SYN] Seq=0 Win=64240 Len=0 MSS=1460 SACK_PERM TSval=806518817 TSecr=0 WS=128
111,117.870738,192.168.11.42,192.168.11.27,TCP,74,0.000129,,"Jan 11, 2024 16:06:47.416216000 JST",,"6000  >  37436 [SYN, ACK] Seq=0 Ack=1 Win=65160 Len=0 MSS=1460 SACK_PERM TSval=418545854 TSecr=806518817 WS=128"
112,117.880075,192.168.11.27,192.168.11.42,TCP,66,0.009337,,"Jan 11, 2024 16:06:47.425553000 JST",,37436  >  6000 [ACK] Seq=1 Ack=1 Win=64256 Len=0 TSval=806518827 TSecr=418545854
113,117.880702,192.168.11.27,192.168.11.42,TCP,93,0.000627,,"Jan 11, 2024 16:06:47.426180000 JST",,"37436  >  6000 [PSH, ACK] Seq=1 Ack=1 Win=64256 Len=27 TSval=806518827 TSecr=418545854 [TCP segment of a reassembled PDU]"
114,117.880797,192.168.11.42,192.168.11.27,TCP,66,0.000095,,"Jan 11, 2024 16:06:47.426275000 JST",,6000  >  37436 [ACK] Seq=1 Ack=28 Win=65152 Len=0 TSval=418545864 TSecr=806518827
115,117.880874,192.168.11.27,192.168.11.42,TCP,66,0.000077,,"Jan 11, 2024 16:06:47.426352000 JST",,"37436  >  6000 [FIN, ACK] Seq=28 Ack=1 Win=64256 Len=0 TSval=806518827 TSecr=418545854"
116,117.881623,192.168.11.42,192.168.11.27,TCP,66,0.000749,,"Jan 11, 2024 16:06:47.427101000 JST",,"6000  >  46716 [FIN, ACK] Seq=1 Ack=29 Win=65152 Len=0 TSval=418545865 TSecr=806511677"
117,117.889531,192.168.11.27,192.168.11.42,TCP,66,0.007908,,"Jan 11, 2024 16:06:47.435009000 JST",,46716  >  6000 [ACK] Seq=29 Ack=2 Win=64256 Len=0 TSval=806518836 TSecr=418545865
118,117.924408,192.168.11.42,192.168.11.27,TCP,66,0.034877,,"Jan 11, 2024 16:06:47.469886000 JST",,6000  >  37436 [ACK] Seq=1 Ack=29 Win=65152 Len=0 TSval=418545908 TSecr=806518827
119,125.058597,192.168.11.42,255.255.255.255,UDP,212,7.134189,Ÿ,"Jan 11, 2024 16:06:54.604075000 JST",7b2273656d616e74696373223a207b22656e74697479223a2022504944303031222c202262617365656e74697479223a2022616e79222c2022726f6c65223a2022616161222c20227370617469616c223a2022616e79222c202274656d706f72616c223a2022616e79227d2c20226461746170726f7065727479223a207b22666f726d6174223a2022696e616f6b615f70726f6772616d5f73616d706c655f73656d616e746963227d7d,45622  >  7000 Len=170
120,125.070728,192.168.11.27,192.168.11.42,TCP,74,0.012131,œ,"Jan 11, 2024 16:06:54.616206000 JST",,37040  >  6000 [SYN] Seq=0 Win=64240 Len=0 MSS=1460 SACK_PERM TSval=806526014 TSecr=0 WS=128
121,125.070896,192.168.11.42,192.168.11.27,TCP,74,0.000168,,"Jan 11, 2024 16:06:54.616374000 JST",,"6000  >  37040 [SYN, ACK] Seq=0 Ack=1 Win=65160 Len=0 MSS=1460 SACK_PERM TSval=418553054 TSecr=806526014 WS=128"
122,125.079545,192.168.11.27,192.168.11.42,TCP,66,0.008649,,"Jan 11, 2024 16:06:54.625023000 JST",,37040  >  6000 [ACK] Seq=1 Ack=1 Win=64256 Len=0 TSval=806526026 TSecr=418553054
123,125.080086,192.168.11.27,192.168.11.42,TCP,93,0.000541,,"Jan 11, 2024 16:06:54.625564000 JST",,"37040  >  6000 [PSH, ACK] Seq=1 Ack=1 Win=64256 Len=27 TSval=806526026 TSecr=418553054 [TCP segment of a reassembled PDU]"
124,125.080176,192.168.11.42,192.168.11.27,TCP,66,0.00009,,"Jan 11, 2024 16:06:54.625654000 JST",,6000  >  37040 [ACK] Seq=1 Ack=28 Win=65152 Len=0 TSval=418553063 TSecr=806526026
125,125.080246,192.168.11.27,192.168.11.42,TCP,66,0.00007,,"Jan 11, 2024 16:06:54.625724000 JST",,"37040  >  6000 [FIN, ACK] Seq=28 Ack=1 Win=64256 Len=0 TSval=806526027 TSecr=418553054"
126,125.080954,192.168.11.42,192.168.11.27,TCP,66,0.000708,,"Jan 11, 2024 16:06:54.626432000 JST",,"6000  >  37436 [FIN, ACK] Seq=1 Ack=29 Win=65152 Len=0 TSval=418553064 TSecr=806518827"
127,125.088928,192.168.11.27,192.168.11.42,TCP,66,0.007974,,"Jan 11, 2024 16:06:54.634406000 JST",,37436  >  6000 [ACK] Seq=29 Ack=2 Win=64256 Len=0 TSval=806526035 TSecr=418553064
128,125.124376,192.168.11.42,192.168.11.27,TCP,66,0.035448,,"Jan 11, 2024 16:06:54.669854000 JST",,6000  >  37040 [ACK] Seq=1 Ack=29 Win=65152 Len=0 TSval=418553108 TSecr=806526027
129,132.265023,192.168.11.42,255.255.255.255,UDP,212,7.140647,Ÿ,"Jan 11, 2024 16:07:01.810501000 JST",7b2273656d616e74696373223a207b22656e74697479223a2022504944303031222c202262617365656e74697479223a2022616e79222c2022726f6c65223a2022616161222c20227370617469616c223a2022616e79222c202274656d706f72616c223a2022616e79227d2c20226461746170726f7065727479223a207b22666f726d6174223a2022696e616f6b615f70726f6772616d5f73616d706c655f73656d616e746963227d7d,37857  >  7000 Len=170
130,132.273086,192.168.11.27,192.168.11.42,TCP,74,0.008063,œ,"Jan 11, 2024 16:07:01.818564000 JST",,33322  >  6000 [SYN] Seq=0 Win=64240 Len=0 MSS=1460 SACK_PERM TSval=806533219 TSecr=0 WS=128
131,132.27322,192.168.11.42,192.168.11.27,TCP,74,0.000134,,"Jan 11, 2024 16:07:01.818698000 JST",,"6000  >  33322 [SYN, ACK] Seq=0 Ack=1 Win=65160 Len=0 MSS=1460 SACK_PERM TSval=418560256 TSecr=806533219 WS=128"
132,132.289671,192.168.11.27,192.168.11.42,TCP,66,0.016451,,"Jan 11, 2024 16:07:01.835149000 JST",,33322  >  6000 [ACK] Seq=1 Ack=1 Win=64256 Len=0 TSval=806533236 TSecr=418560256
133,132.290211,192.168.11.27,192.168.11.42,TCP,93,0.00054,,"Jan 11, 2024 16:07:01.835689000 JST",,"33322  >  6000 [PSH, ACK] Seq=1 Ack=1 Win=64256 Len=27 TSval=806533236 TSecr=418560256 [TCP segment of a reassembled PDU]"
134,132.290307,192.168.11.42,192.168.11.27,TCP,66,0.000096,,"Jan 11, 2024 16:07:01.835785000 JST",,6000  >  33322 [ACK] Seq=1 Ack=28 Win=65152 Len=0 TSval=418560273 TSecr=806533236
135,132.290375,192.168.11.27,192.168.11.42,TCP,66,0.000068,,"Jan 11, 2024 16:07:01.835853000 JST",,"33322  >  6000 [FIN, ACK] Seq=28 Ack=1 Win=64256 Len=0 TSval=806533237 TSecr=418560256"
136,132.290918,192.168.11.42,192.168.11.27,TCP,66,0.000543,,"Jan 11, 2024 16:07:01.836396000 JST",,"6000  >  37040 [FIN, ACK] Seq=1 Ack=29 Win=65152 Len=0 TSval=418560274 TSecr=806526027"
137,132.299228,192.168.11.27,192.168.11.42,TCP,66,0.00831,,"Jan 11, 2024 16:07:01.844706000 JST",,37040  >  6000 [ACK] Seq=29 Ack=2 Win=64256 Len=0 TSval=806533245 TSecr=418560274
138,132.332399,192.168.11.42,192.168.11.27,TCP,66,0.033171,,"Jan 11, 2024 16:07:01.877877000 JST",,6000  >  33322 [ACK] Seq=1 Ack=29 Win=65152 Len=0 TSval=418560316 TSecr=806533237
139,139.426176,192.168.11.42,255.255.255.255,UDP,212,7.093777,Ÿ,"Jan 11, 2024 16:07:08.971654000 JST",7b2273656d616e74696373223a207b22656e74697479223a2022504944303031222c202262617365656e74697479223a2022616e79222c2022726f6c65223a2022616161222c20227370617469616c223a2022616e79222c202274656d706f72616c223a2022616e79227d2c20226461746170726f7065727479223a207b22666f726d6174223a2022696e616f6b615f70726f6772616d5f73616d706c655f73656d616e746963227d7d,45923  >  7000 Len=170
140,139.435546,192.168.11.27,192.168.11.42,TCP,74,0.00937,œ,"Jan 11, 2024 16:07:08.981024000 JST",,33338  >  6000 [SYN] Seq=0 Win=64240 Len=0 MSS=1460 SACK_PERM TSval=806540381 TSecr=0 WS=128
141,139.435676,192.168.11.42,192.168.11.27,TCP,74,0.00013,,"Jan 11, 2024 16:07:08.981154000 JST",,"6000  >  33338 [SYN, ACK] Seq=0 Ack=1 Win=65160 Len=0 MSS=1460 SACK_PERM TSval=418567419 TSecr=806540381 WS=128"
142,139.445733,192.168.11.27,192.168.11.42,TCP,66,0.010057,,"Jan 11, 2024 16:07:08.991211000 JST",,33338  >  6000 [ACK] Seq=1 Ack=1 Win=64256 Len=0 TSval=806540391 TSecr=418567419
143,139.446285,192.168.11.27,192.168.11.42,TCP,93,0.000552,,"Jan 11, 2024 16:07:08.991763000 JST",,"33338  >  6000 [PSH, ACK] Seq=1 Ack=1 Win=64256 Len=27 TSval=806540392 TSecr=418567419 [TCP segment of a reassembled PDU]"
144,139.44637,192.168.11.42,192.168.11.27,TCP,66,0.000085,,"Jan 11, 2024 16:07:08.991848000 JST",,6000  >  33338 [ACK] Seq=1 Ack=28 Win=65152 Len=0 TSval=418567429 TSecr=806540392
145,139.446443,192.168.11.27,192.168.11.42,TCP,66,0.000073,,"Jan 11, 2024 16:07:08.991921000 JST",,"33338  >  6000 [FIN, ACK] Seq=28 Ack=1 Win=64256 Len=0 TSval=806540392 TSecr=418567419"
146,139.446965,192.168.11.42,192.168.11.27,TCP,66,0.000522,,"Jan 11, 2024 16:07:08.992443000 JST",,"6000  >  33322 [FIN, ACK] Seq=1 Ack=29 Win=65152 Len=0 TSval=418567430 TSecr=806533237"
147,139.455676,192.168.11.27,192.168.11.42,TCP,66,0.008711,,"Jan 11, 2024 16:07:09.001154000 JST",,33322  >  6000 [ACK] Seq=29 Ack=2 Win=64256 Len=0 TSval=806540401 TSecr=418567430
148,139.488402,192.168.11.42,192.168.11.27,TCP,66,0.032726,,"Jan 11, 2024 16:07:09.033880000 JST",,6000  >  33338 [ACK] Seq=1 Ack=29 Win=65152 Len=0 TSval=418567472 TSecr=806540392
149,149.732493,192.168.11.42,255.255.255.255,UDP,212,10.244091,Ÿ,"Jan 11, 2024 16:07:19.277971000 JST",7b2273656d616e74696373223a207b22656e74697479223a2022504944303031222c202262617365656e74697479223a2022616e79222c2022726f6c65223a2022616161222c20227370617469616c223a2022616e79222c202274656d706f72616c223a2022616e79227d2c20226461746170726f7065727479223a207b22666f726d6174223a2022696e616f6b615f70726f6772616d5f73616d706c655f73656d616e746963227d7d,52975  >  7000 Len=170
150,149.741311,192.168.11.27,192.168.11.42,TCP,74,0.008818,œ,"Jan 11, 2024 16:07:19.286789000 JST",,46706  >  6000 [SYN] Seq=0 Win=64240 Len=0 MSS=1460 SACK_PERM TSval=806550687 TSecr=0 WS=128
151,149.741434,192.168.11.42,192.168.11.27,TCP,74,0.000123,,"Jan 11, 2024 16:07:19.286912000 JST",,"6000  >  46706 [SYN, ACK] Seq=0 Ack=1 Win=65160 Len=0 MSS=1460 SACK_PERM TSval=418577725 TSecr=806550687 WS=128"
152,149.750768,192.168.11.27,192.168.11.42,TCP,66,0.009334,,"Jan 11, 2024 16:07:19.296246000 JST",,46706  >  6000 [ACK] Seq=1 Ack=1 Win=64256 Len=0 TSval=806550697 TSecr=418577725
153,149.75123,192.168.11.27,192.168.11.42,TCP,93,0.000462,,"Jan 11, 2024 16:07:19.296708000 JST",,"46706  >  6000 [PSH, ACK] Seq=1 Ack=1 Win=64256 Len=27 TSval=806550697 TSecr=418577725 [TCP segment of a reassembled PDU]"
154,149.751314,192.168.11.42,192.168.11.27,TCP,66,0.000084,,"Jan 11, 2024 16:07:19.296792000 JST",,6000  >  46706 [ACK] Seq=1 Ack=28 Win=65152 Len=0 TSval=418577734 TSecr=806550697
155,149.751375,192.168.11.27,192.168.11.42,TCP,66,0.000061,,"Jan 11, 2024 16:07:19.296853000 JST",,"46706  >  6000 [FIN, ACK] Seq=28 Ack=1 Win=64256 Len=0 TSval=806550697 TSecr=418577725"
156,149.7519,192.168.11.42,192.168.11.27,TCP,66,0.000525,,"Jan 11, 2024 16:07:19.297378000 JST",,"6000  >  33338 [FIN, ACK] Seq=1 Ack=29 Win=65152 Len=0 TSval=418577735 TSecr=806540392"
157,149.760264,192.168.11.27,192.168.11.42,TCP,66,0.008364,,"Jan 11, 2024 16:07:19.305742000 JST",,33338  >  6000 [ACK] Seq=29 Ack=2 Win=64256 Len=0 TSval=806550706 TSecr=418577735
158,149.792388,192.168.11.42,192.168.11.27,TCP,66,0.032124,,"Jan 11, 2024 16:07:19.337866000 JST",,6000  >  46706 [ACK] Seq=1 Ack=29 Win=65152 Len=0 TSval=418577776 TSecr=806550697
159,156.891055,192.168.11.42,255.255.255.255,UDP,212,7.098667,Ÿ,"Jan 11, 2024 16:07:26.436533000 JST",7b2273656d616e74696373223a207b22656e74697479223a2022504944303031222c202262617365656e74697479223a2022616e79222c2022726f6c65223a2022616161222c20227370617469616c223a2022616e79222c202274656d706f72616c223a2022616e79227d2c20226461746170726f7065727479223a207b22666f726d6174223a2022696e616f6b615f70726f6772616d5f73616d706c655f73656d616e746963227d7d,49007  >  7000 Len=170
160,156.899118,192.168.11.27,192.168.11.42,TCP,74,0.008063,œ,"Jan 11, 2024 16:07:26.444596000 JST",,59126  >  6000 [SYN] Seq=0 Win=64240 Len=0 MSS=1460 SACK_PERM TSval=806557845 TSecr=0 WS=128
161,156.899248,192.168.11.42,192.168.11.27,TCP,74,0.00013,,"Jan 11, 2024 16:07:26.444726000 JST",,"6000  >  59126 [SYN, ACK] Seq=0 Ack=1 Win=65160 Len=0 MSS=1460 SACK_PERM TSval=418584882 TSecr=806557845 WS=128"
162,156.908792,192.168.11.27,192.168.11.42,TCP,93,0.009544,,"Jan 11, 2024 16:07:26.454270000 JST",,"59126  >  6000 [PSH, ACK] Seq=1 Ack=1 Win=64256 Len=27 TSval=806557855 TSecr=418584882 [TCP segment of a reassembled PDU]"
163,156.909009,192.168.11.42,192.168.11.27,TCP,66,0.000217,,"Jan 11, 2024 16:07:26.454487000 JST",,6000  >  59126 [ACK] Seq=1 Ack=28 Win=65152 Len=0 TSval=418584892 TSecr=806557855
164,156.909459,192.168.11.27,192.168.11.42,TCP,66,0.00045,,"Jan 11, 2024 16:07:26.454937000 JST",,59126  >  6000 [ACK] Seq=1 Ack=1 Win=64256 Len=0 TSval=806557855 TSecr=418584882
165,156.909521,192.168.11.42,192.168.11.27,TCP,66,0.000062,,"Jan 11, 2024 16:07:26.454999000 JST",,[TCP Dup ACK 163#1] 6000  >  59126 [ACK] Seq=1 Ack=28 Win=65152 Len=0 TSval=418584893 TSecr=806557855
166,156.909573,192.168.11.27,192.168.11.42,TCP,66,0.000052,,"Jan 11, 2024 16:07:26.455051000 JST",,"59126  >  6000 [FIN, ACK] Seq=28 Ack=1 Win=64256 Len=0 TSval=806557855 TSecr=418584882"
167,156.910042,192.168.11.42,192.168.11.27,TCP,66,0.000469,,"Jan 11, 2024 16:07:26.455520000 JST",,"6000  >  46706 [FIN, ACK] Seq=1 Ack=29 Win=65152 Len=0 TSval=418584893 TSecr=806550697"
168,156.917973,192.168.11.27,192.168.11.42,TCP,66,0.007931,,"Jan 11, 2024 16:07:26.463451000 JST",,46706  >  6000 [ACK] Seq=29 Ack=2 Win=64256 Len=0 TSval=806557863 TSecr=418584893
169,156.952389,192.168.11.42,192.168.11.27,TCP,66,0.034416,,"Jan 11, 2024 16:07:26.497867000 JST",,6000  >  59126 [ACK] Seq=1 Ack=29 Win=65152 Len=0 TSval=418584936 TSecr=806557855
170,164.161946,192.168.11.42,255.255.255.255,UDP,212,7.209557,Ÿ,"Jan 11, 2024 16:07:33.707424000 JST",7b2273656d616e74696373223a207b22656e74697479223a2022504944303031222c202262617365656e74697479223a2022616e79222c2022726f6c65223a2022616161222c20227370617469616c223a2022616e79222c202274656d706f72616c223a2022616e79227d2c20226461746170726f7065727479223a207b22666f726d6174223a2022696e616f6b615f70726f6772616d5f73616d706c655f73656d616e746963227d7d,51842  >  7000 Len=170
171,164.171274,192.168.11.27,192.168.11.42,TCP,74,0.009328,œ,"Jan 11, 2024 16:07:33.716752000 JST",,54000  >  6000 [SYN] Seq=0 Win=64240 Len=0 MSS=1460 SACK_PERM TSval=806565117 TSecr=0 WS=128
172,164.171425,192.168.11.42,192.168.11.27,TCP,74,0.000151,,"Jan 11, 2024 16:07:33.716903000 JST",,"6000  >  54000 [SYN, ACK] Seq=0 Ack=1 Win=65160 Len=0 MSS=1460 SACK_PERM TSval=418592155 TSecr=806565117 WS=128"
173,164.180767,192.168.11.27,192.168.11.42,TCP,66,0.009342,,"Jan 11, 2024 16:07:33.726245000 JST",,54000  >  6000 [ACK] Seq=1 Ack=1 Win=64256 Len=0 TSval=806565127 TSecr=418592155
174,164.181303,192.168.11.27,192.168.11.42,TCP,93,0.000536,,"Jan 11, 2024 16:07:33.726781000 JST",,"54000  >  6000 [PSH, ACK] Seq=1 Ack=1 Win=64256 Len=27 TSval=806565127 TSecr=418592155 [TCP segment of a reassembled PDU]"
175,164.18138,192.168.11.42,192.168.11.27,TCP,66,0.000077,,"Jan 11, 2024 16:07:33.726858000 JST",,6000  >  54000 [ACK] Seq=1 Ack=28 Win=65152 Len=0 TSval=418592165 TSecr=806565127
176,164.181452,192.168.11.27,192.168.11.42,TCP,66,0.000072,,"Jan 11, 2024 16:07:33.726930000 JST",,"54000  >  6000 [FIN, ACK] Seq=28 Ack=1 Win=64256 Len=0 TSval=806565127 TSecr=418592155"
177,164.182003,192.168.11.42,192.168.11.27,TCP,66,0.000551,,"Jan 11, 2024 16:07:33.727481000 JST",,"6000  >  59126 [FIN, ACK] Seq=1 Ack=29 Win=65152 Len=0 TSval=418592165 TSecr=806557855"
178,164.190042,192.168.11.27,192.168.11.42,TCP,66,0.008039,,"Jan 11, 2024 16:07:33.735520000 JST",,59126  >  6000 [ACK] Seq=29 Ack=2 Win=64256 Len=0 TSval=806565135 TSecr=418592165
179,164.224382,192.168.11.42,192.168.11.27,TCP,66,0.03434,,"Jan 11, 2024 16:07:33.769860000 JST",,6000  >  54000 [ACK] Seq=1 Ack=29 Win=65152 Len=0 TSval=418592208 TSecr=806565127
180,171.348611,192.168.11.42,255.255.255.255,UDP,212,7.124229,Ÿ,"Jan 11, 2024 16:07:40.894089000 JST",7b2273656d616e74696373223a207b22656e74697479223a2022504944303031222c202262617365656e74697479223a2022616e79222c2022726f6c65223a2022616161222c20227370617469616c223a2022616e79222c202274656d706f72616c223a2022616e79227d2c20226461746170726f7065727479223a207b22666f726d6174223a2022696e616f6b615f70726f6772616d5f73616d706c655f73656d616e746963227d7d,43474  >  7000 Len=170
