No.,Time,Source,Destination,Protocol,Length,Time delta from previous captured frame,XXX,Data,Info
1,0,192.168.11.23,192.168.11.8,TCP,74,0,,,59358  >  6000 [SYN] Seq=0 Win=64240 Len=0 MSS=1460 SACK_PERM TSval=2801384558 TSecr=0 WS=128
2,0.006565,192.168.11.8,192.168.11.23,TCP,74,0.006565,,,"6000  >  59358 [SYN, ACK] Seq=0 Ack=1 Win=65160 Len=0 MSS=1460 SACK_PERM TSval=3797638933 TSecr=2801384558 WS=128"
3,0.006663,192.168.11.23,192.168.11.8,TCP,66,0.000098,,,59358  >  6000 [ACK] Seq=1 Ack=1 Win=64256 Len=0 TSval=2801384567 TSecr=3797638933
4,0.006821,192.168.11.23,192.168.11.8,TCP,93,0.000158,,,"59358  >  6000 [PSH, ACK] Seq=1 Ack=1 Win=64256 Len=27 TSval=2801384567 TSecr=3797638933 [TCP segment of a reassembled PDU]"
5,0.006943,192.168.11.23,192.168.11.8,TCP,66,0.000122,,,"59358  >  6000 [FIN, ACK] Seq=28 Ack=1 Win=64256 Len=0 TSval=2801384567 TSecr=3797638933"
6,0.014013,192.168.11.8,192.168.11.23,TCP,66,0.00707,,,6000  >  59358 [ACK] Seq=1 Ack=28 Win=65152 Len=0 TSval=3797638940 TSecr=2801384567
7,0.01426,192.168.11.8,192.168.11.23,TCP,66,0.000247,,,"6000  >  59358 [FIN, ACK] Seq=1 Ack=29 Win=65152 Len=0 TSval=3797638942 TSecr=2801384567"
8,0.014303,192.168.11.23,192.168.11.8,TCP,66,0.000043,,,59358  >  6000 [ACK] Seq=29 Ack=2 Win=64256 Len=0 TSval=2801384575 TSecr=3797638942
9,0.048117,192.168.11.23,255.255.255.255,UDP,209,0.033814,Ÿ,7b2273656d616e74696373223a207b22656e74697479223a2022504944222c202262617365656e74697479223a2022616e79222c2022726f6c65223a2022656565222c20227370617469616c223a2022616e79222c202274656d706f72616c223a2022616e79227d2c20226461746170726f7065727479223a207b22666f726d6174223a2022696e616f6b615f70726f6772616d5f73616d706c655f73656d616e746963227d7d,37456  >  7000 Len=167
10,0.05748,192.168.11.9,192.168.11.23,TCP,74,0.009363,œ,,34392  >  6000 [SYN] Seq=0 Win=64240 Len=0 MSS=1460 SACK_PERM TSval=2825036088 TSecr=0 WS=128
11,0.057618,192.168.11.23,192.168.11.9,TCP,74,0.000138,,,"6000  >  34392 [SYN, ACK] Seq=0 Ack=1 Win=65160 Len=0 MSS=1460 SACK_PERM TSval=267464935 TSecr=2825036088 WS=128"
12,0.064193,192.168.11.9,192.168.11.23,TCP,66,0.006575,,,34392  >  6000 [ACK] Seq=1 Ack=1 Win=64256 Len=0 TSval=2825036098 TSecr=267464935
13,0.064657,192.168.11.9,192.168.11.23,TCP,93,0.000464,,,"34392  >  6000 [PSH, ACK] Seq=1 Ack=1 Win=64256 Len=27 TSval=2825036098 TSecr=267464935 [TCP segment of a reassembled PDU]"
14,0.064731,192.168.11.23,192.168.11.9,TCP,66,0.000074,,,6000  >  34392 [ACK] Seq=1 Ack=28 Win=65152 Len=0 TSval=267464942 TSecr=2825036098
15,0.064787,192.168.11.9,192.168.11.23,TCP,66,0.000056,,,"34392  >  6000 [FIN, ACK] Seq=28 Ack=1 Win=64256 Len=0 TSval=2825036098 TSecr=267464935"
16,0.065639,192.168.11.23,192.168.11.9,TCP,66,0.000852,,,"6000  >  34392 [FIN, ACK] Seq=1 Ack=29 Win=65152 Len=0 TSval=267464943 TSecr=2825036098"
17,0.071706,192.168.11.9,192.168.11.23,TCP,66,0.006067,,,34392  >  6000 [ACK] Seq=29 Ack=2 Win=64256 Len=0 TSval=2825036105 TSecr=267464943
18,7.352491,192.168.11.23,192.168.11.8,TCP,74,7.280785,,,59366  >  6000 [SYN] Seq=0 Win=64240 Len=0 MSS=1460 SACK_PERM TSval=2801391913 TSecr=0 WS=128
19,7.359102,192.168.11.8,192.168.11.23,TCP,74,0.006611,,,"6000  >  59366 [SYN, ACK] Seq=0 Ack=1 Win=65160 Len=0 MSS=1460 SACK_PERM TSval=3797646285 TSecr=2801391913 WS=128"
20,7.359235,192.168.11.23,192.168.11.8,TCP,66,0.000133,,,59366  >  6000 [ACK] Seq=1 Ack=1 Win=64256 Len=0 TSval=2801391920 TSecr=3797646285
21,7.359403,192.168.11.23,192.168.11.8,TCP,93,0.000168,,,"59366  >  6000 [PSH, ACK] Seq=1 Ack=1 Win=64256 Len=27 TSval=2801391920 TSecr=3797646285 [TCP segment of a reassembled PDU]"
22,7.359506,192.168.11.23,192.168.11.8,TCP,66,0.000103,,,"59366  >  6000 [FIN, ACK] Seq=28 Ack=1 Win=64256 Len=0 TSval=2801391920 TSecr=3797646285"
23,7.366513,192.168.11.8,192.168.11.23,TCP,66,0.007007,,,6000  >  59366 [ACK] Seq=1 Ack=28 Win=65152 Len=0 TSval=3797646292 TSecr=2801391920
24,7.372004,192.168.11.8,192.168.11.23,TCP,66,0.005491,,,"6000  >  59366 [FIN, ACK] Seq=1 Ack=29 Win=65152 Len=0 TSval=3797646297 TSecr=2801391920"
25,7.372065,192.168.11.23,192.168.11.8,TCP,66,0.000061,,,59366  >  6000 [ACK] Seq=29 Ack=2 Win=64256 Len=0 TSval=2801391932 TSecr=3797646297
26,7.399571,192.168.11.23,255.255.255.255,UDP,209,0.027506,Ÿ,7b2273656d616e74696373223a207b22656e74697479223a2022504944222c202262617365656e74697479223a2022616e79222c2022726f6c65223a2022656565222c20227370617469616c223a2022616e79222c202274656d706f72616c223a2022616e79227d2c20226461746170726f7065727479223a207b22666f726d6174223a2022696e616f6b615f70726f6772616d5f73616d706c655f73656d616e746963227d7d,42161  >  7000 Len=167
27,7.405186,192.168.11.9,192.168.11.23,TCP,74,0.005615,œ,,43592  >  6000 [SYN] Seq=0 Win=64240 Len=0 MSS=1460 SACK_PERM TSval=2825043439 TSecr=0 WS=128
28,7.405314,192.168.11.23,192.168.11.9,TCP,74,0.000128,,,"6000  >  43592 [SYN, ACK] Seq=0 Ack=1 Win=65160 Len=0 MSS=1460 SACK_PERM TSval=267472283 TSecr=2825043439 WS=128"
29,7.411935,192.168.11.9,192.168.11.23,TCP,66,0.006621,,,43592  >  6000 [ACK] Seq=1 Ack=1 Win=64256 Len=0 TSval=2825043446 TSecr=267472283
30,7.412445,192.168.11.9,192.168.11.23,TCP,93,0.00051,,,"43592  >  6000 [PSH, ACK] Seq=1 Ack=1 Win=64256 Len=27 TSval=2825043446 TSecr=267472283 [TCP segment of a reassembled PDU]"
31,7.412521,192.168.11.23,192.168.11.9,TCP,66,0.000076,,,6000  >  43592 [ACK] Seq=1 Ack=28 Win=65152 Len=0 TSval=267472290 TSecr=2825043446
32,7.412592,192.168.11.9,192.168.11.23,TCP,66,0.000071,,,"43592  >  6000 [FIN, ACK] Seq=28 Ack=1 Win=64256 Len=0 TSval=2825043446 TSecr=267472283"
33,7.413522,192.168.11.23,192.168.11.9,TCP,66,0.00093,,,"6000  >  43592 [FIN, ACK] Seq=1 Ack=29 Win=65152 Len=0 TSval=267472291 TSecr=2825043446"
34,7.419807,192.168.11.9,192.168.11.23,TCP,66,0.006285,,,43592  >  6000 [ACK] Seq=29 Ack=2 Win=64256 Len=0 TSval=2825043453 TSecr=267472291
35,14.700283,192.168.11.23,192.168.11.8,TCP,74,7.280476,,,36232  >  6000 [SYN] Seq=0 Win=64240 Len=0 MSS=1460 SACK_PERM TSval=2801399261 TSecr=0 WS=128
36,14.715113,192.168.11.8,192.168.11.23,TCP,74,0.01483,,,"6000  >  36232 [SYN, ACK] Seq=0 Ack=1 Win=65160 Len=0 MSS=1460 SACK_PERM TSval=3797653641 TSecr=2801399261 WS=128"
37,14.715234,192.168.11.23,192.168.11.8,TCP,66,0.000121,,,36232  >  6000 [ACK] Seq=1 Ack=1 Win=64256 Len=0 TSval=2801399276 TSecr=3797653641
38,14.715407,192.168.11.23,192.168.11.8,TCP,93,0.000173,,,"36232  >  6000 [PSH, ACK] Seq=1 Ack=1 Win=64256 Len=27 TSval=2801399276 TSecr=3797653641 [TCP segment of a reassembled PDU]"
39,14.715498,192.168.11.23,192.168.11.8,TCP,66,0.000091,,,"36232  >  6000 [FIN, ACK] Seq=28 Ack=1 Win=64256 Len=0 TSval=2801399276 TSecr=3797653641"
40,14.72312,192.168.11.8,192.168.11.23,TCP,66,0.007622,,,6000  >  36232 [ACK] Seq=1 Ack=28 Win=65152 Len=0 TSval=3797653649 TSecr=2801399276
41,14.723519,192.168.11.8,192.168.11.23,TCP,66,0.000399,,,"6000  >  36232 [FIN, ACK] Seq=1 Ack=29 Win=65152 Len=0 TSval=3797653650 TSecr=2801399276"
42,14.723563,192.168.11.23,192.168.11.8,TCP,66,0.000044,,,36232  >  6000 [ACK] Seq=29 Ack=2 Win=64256 Len=0 TSval=2801399284 TSecr=3797653650
43,14.751672,192.168.11.23,255.255.255.255,UDP,209,0.028109,Ÿ,7b2273656d616e74696373223a207b22656e74697479223a2022504944222c202262617365656e74697479223a2022616e79222c2022726f6c65223a2022656565222c20227370617469616c223a2022616e79222c202274656d706f72616c223a2022616e79227d2c20226461746170726f7065727479223a207b22666f726d6174223a2022696e616f6b615f70726f6772616d5f73616d706c655f73656d616e746963227d7d,57809  >  7000 Len=167
44,14.757158,192.168.11.9,192.168.11.23,TCP,74,0.005486,œ,,43596  >  6000 [SYN] Seq=0 Win=64240 Len=0 MSS=1460 SACK_PERM TSval=2825050791 TSecr=0 WS=128
45,14.757263,192.168.11.23,192.168.11.9,TCP,74,0.000105,,,"6000  >  43596 [SYN, ACK] Seq=0 Ack=1 Win=65160 Len=0 MSS=1460 SACK_PERM TSval=267479635 TSecr=2825050791 WS=128"
46,14.763908,192.168.11.9,192.168.11.23,TCP,66,0.006645,,,43596  >  6000 [ACK] Seq=1 Ack=1 Win=64256 Len=0 TSval=2825050798 TSecr=267479635
47,14.764395,192.168.11.9,192.168.11.23,TCP,93,0.000487,,,"43596  >  6000 [PSH, ACK] Seq=1 Ack=1 Win=64256 Len=27 TSval=2825050798 TSecr=267479635 [TCP segment of a reassembled PDU]"
48,14.764462,192.168.11.23,192.168.11.9,TCP,66,0.000067,,,6000  >  43596 [ACK] Seq=1 Ack=28 Win=65152 Len=0 TSval=267479642 TSecr=2825050798
49,14.764526,192.168.11.9,192.168.11.23,TCP,66,0.000064,,,"43596  >  6000 [FIN, ACK] Seq=28 Ack=1 Win=64256 Len=0 TSval=2825050798 TSecr=267479635"
50,14.765417,192.168.11.23,192.168.11.9,TCP,66,0.000891,,,"6000  >  43596 [FIN, ACK] Seq=1 Ack=29 Win=65152 Len=0 TSval=267479643 TSecr=2825050798"
51,14.771813,192.168.11.9,192.168.11.23,TCP,66,0.006396,,,43596  >  6000 [ACK] Seq=29 Ack=2 Win=64256 Len=0 TSval=2825050805 TSecr=267479643
52,21.906624,192.168.11.23,192.168.11.8,TCP,74,7.134811,,,38216  >  6000 [SYN] Seq=0 Win=64240 Len=0 MSS=1460 SACK_PERM TSval=2801406467 TSecr=0 WS=128
53,21.913674,192.168.11.8,192.168.11.23,TCP,74,0.00705,,,"6000  >  38216 [SYN, ACK] Seq=0 Ack=1 Win=65160 Len=0 MSS=1460 SACK_PERM TSval=3797660839 TSecr=2801406467 WS=128"
54,21.913785,192.168.11.23,192.168.11.8,TCP,66,0.000111,,,38216  >  6000 [ACK] Seq=1 Ack=1 Win=64256 Len=0 TSval=2801406474 TSecr=3797660839
55,21.913949,192.168.11.23,192.168.11.8,TCP,93,0.000164,,,"38216  >  6000 [PSH, ACK] Seq=1 Ack=1 Win=64256 Len=27 TSval=2801406474 TSecr=3797660839 [TCP segment of a reassembled PDU]"
56,21.914043,192.168.11.23,192.168.11.8,TCP,66,0.000094,,,"38216  >  6000 [FIN, ACK] Seq=28 Ack=1 Win=64256 Len=0 TSval=2801406474 TSecr=3797660839"
57,21.922146,192.168.11.8,192.168.11.23,TCP,66,0.008103,,,6000  >  38216 [ACK] Seq=1 Ack=28 Win=65152 Len=0 TSval=3797660846 TSecr=2801406474
58,21.922516,192.168.11.8,192.168.11.23,TCP,66,0.00037,,,"6000  >  38216 [FIN, ACK] Seq=1 Ack=29 Win=65152 Len=0 TSval=3797660847 TSecr=2801406474"
59,21.922576,192.168.11.23,192.168.11.8,TCP,66,0.00006,,,38216  >  6000 [ACK] Seq=29 Ack=2 Win=64256 Len=0 TSval=2801406483 TSecr=3797660847
60,21.950866,192.168.11.23,255.255.255.255,UDP,209,0.02829,Ÿ,7b2273656d616e74696373223a207b22656e74697479223a2022504944222c202262617365656e74697479223a2022616e79222c2022726f6c65223a2022656565222c20227370617469616c223a2022616e79222c202274656d706f72616c223a2022616e79227d2c20226461746170726f7065727479223a207b22666f726d6174223a2022696e616f6b615f70726f6772616d5f73616d706c655f73656d616e746963227d7d,36808  >  7000 Len=167
61,21.956463,192.168.11.9,192.168.11.23,TCP,74,0.005597,œ,,41180  >  6000 [SYN] Seq=0 Win=64240 Len=0 MSS=1460 SACK_PERM TSval=2825057990 TSecr=0 WS=128
62,21.95659,192.168.11.23,192.168.11.9,TCP,74,0.000127,,,"6000  >  41180 [SYN, ACK] Seq=0 Ack=1 Win=65160 Len=0 MSS=1460 SACK_PERM TSval=267486834 TSecr=2825057990 WS=128"
63,21.963753,192.168.11.9,192.168.11.23,TCP,66,0.007163,,,41180  >  6000 [ACK] Seq=1 Ack=1 Win=64256 Len=0 TSval=2825057998 TSecr=267486834
64,21.964275,192.168.11.9,192.168.11.23,TCP,93,0.000522,,,"41180  >  6000 [PSH, ACK] Seq=1 Ack=1 Win=64256 Len=27 TSval=2825057998 TSecr=267486834 [TCP segment of a reassembled PDU]"
65,21.96436,192.168.11.23,192.168.11.9,TCP,66,0.000085,,,6000  >  41180 [ACK] Seq=1 Ack=28 Win=65152 Len=0 TSval=267486842 TSecr=2825057998
66,21.964428,192.168.11.9,192.168.11.23,TCP,66,0.000068,,,"41180  >  6000 [FIN, ACK] Seq=28 Ack=1 Win=64256 Len=0 TSval=2825057998 TSecr=267486834"
67,21.96541,192.168.11.23,192.168.11.9,TCP,66,0.000982,,,"6000  >  41180 [FIN, ACK] Seq=1 Ack=29 Win=65152 Len=0 TSval=267486843 TSecr=2825057998"
68,21.971497,192.168.11.9,192.168.11.23,TCP,66,0.006087,,,41180  >  6000 [ACK] Seq=29 Ack=2 Win=64256 Len=0 TSval=2825058005 TSecr=267486843
69,29.144767,192.168.11.23,192.168.11.8,TCP,74,7.17327,,,56666  >  6000 [SYN] Seq=0 Win=64240 Len=0 MSS=1460 SACK_PERM TSval=2801413705 TSecr=0 WS=128
70,29.152417,192.168.11.8,192.168.11.23,TCP,74,0.00765,,,"6000  >  56666 [SYN, ACK] Seq=0 Ack=1 Win=65160 Len=0 MSS=1460 SACK_PERM TSval=3797668077 TSecr=2801413705 WS=128"
71,29.152511,192.168.11.23,192.168.11.8,TCP,66,0.000094,,,56666  >  6000 [ACK] Seq=1 Ack=1 Win=64256 Len=0 TSval=2801413713 TSecr=3797668077
72,29.152691,192.168.11.23,192.168.11.8,TCP,93,0.00018,,,"56666  >  6000 [PSH, ACK] Seq=1 Ack=1 Win=64256 Len=27 TSval=2801413713 TSecr=3797668077 [TCP segment of a reassembled PDU]"
73,29.152812,192.168.11.23,192.168.11.8,TCP,66,0.000121,,,"56666  >  6000 [FIN, ACK] Seq=28 Ack=1 Win=64256 Len=0 TSval=2801413713 TSecr=3797668077"
74,29.159796,192.168.11.8,192.168.11.23,TCP,66,0.006984,,,6000  >  56666 [ACK] Seq=1 Ack=28 Win=65152 Len=0 TSval=3797668084 TSecr=2801413713
75,29.160177,192.168.11.8,192.168.11.23,TCP,66,0.000381,,,"6000  >  56666 [FIN, ACK] Seq=1 Ack=29 Win=65152 Len=0 TSval=3797668085 TSecr=2801413713"
76,29.160224,192.168.11.23,192.168.11.8,TCP,66,0.000047,,,56666  >  6000 [ACK] Seq=29 Ack=2 Win=64256 Len=0 TSval=2801413721 TSecr=3797668085
77,29.188362,192.168.11.23,255.255.255.255,UDP,209,0.028138,Ÿ,7b2273656d616e74696373223a207b22656e74697479223a2022504944222c202262617365656e74697479223a2022616e79222c2022726f6c65223a2022656565222c20227370617469616c223a2022616e79222c202274656d706f72616c223a2022616e79227d2c20226461746170726f7065727479223a207b22666f726d6174223a2022696e616f6b615f70726f6772616d5f73616d706c655f73656d616e746963227d7d,42663  >  7000 Len=167
78,29.193816,192.168.11.9,192.168.11.23,TCP,74,0.005454,œ,,58318  >  6000 [SYN] Seq=0 Win=64240 Len=0 MSS=1460 SACK_PERM TSval=2825065228 TSecr=0 WS=128
79,29.193916,192.168.11.23,192.168.11.9,TCP,74,0.0001,,,"6000  >  58318 [SYN, ACK] Seq=0 Ack=1 Win=65160 Len=0 MSS=1460 SACK_PERM TSval=267494071 TSecr=2825065228 WS=128"
80,29.20054,192.168.11.9,192.168.11.23,TCP,66,0.006624,,,58318  >  6000 [ACK] Seq=1 Ack=1 Win=64256 Len=0 TSval=2825065235 TSecr=267494071
81,29.201031,192.168.11.9,192.168.11.23,TCP,93,0.000491,,,"58318  >  6000 [PSH, ACK] Seq=1 Ack=1 Win=64256 Len=27 TSval=2825065235 TSecr=267494071 [TCP segment of a reassembled PDU]"
82,29.201094,192.168.11.23,192.168.11.9,TCP,66,0.000063,,,6000  >  58318 [ACK] Seq=1 Ack=28 Win=65152 Len=0 TSval=267494078 TSecr=2825065235
83,29.201166,192.168.11.9,192.168.11.23,TCP,66,0.000072,,,"58318  >  6000 [FIN, ACK] Seq=28 Ack=1 Win=64256 Len=0 TSval=2825065235 TSecr=267494071"
84,29.20216,192.168.11.23,192.168.11.9,TCP,66,0.000994,,,"6000  >  58318 [FIN, ACK] Seq=1 Ack=29 Win=65152 Len=0 TSval=267494079 TSecr=2825065235"
85,29.208568,192.168.11.9,192.168.11.23,TCP,66,0.006408,,,58318  >  6000 [ACK] Seq=29 Ack=2 Win=64256 Len=0 TSval=2825065242 TSecr=267494079
86,36.301557,192.168.11.23,192.168.11.8,TCP,74,7.092989,,,56678  >  6000 [SYN] Seq=0 Win=64240 Len=0 MSS=1460 SACK_PERM TSval=2801420862 TSecr=0 WS=128
87,36.308462,192.168.11.8,192.168.11.23,TCP,74,0.006905,,,"6000  >  56678 [SYN, ACK] Seq=0 Ack=1 Win=65160 Len=0 MSS=1460 SACK_PERM TSval=3797675233 TSecr=2801420862 WS=128"
88,36.308557,192.168.11.23,192.168.11.8,TCP,66,0.000095,,,56678  >  6000 [ACK] Seq=1 Ack=1 Win=64256 Len=0 TSval=2801420869 TSecr=3797675233
89,36.308749,192.168.11.23,192.168.11.8,TCP,93,0.000192,,,"56678  >  6000 [PSH, ACK] Seq=1 Ack=1 Win=64256 Len=27 TSval=2801420869 TSecr=3797675233 [TCP segment of a reassembled PDU]"
90,36.308835,192.168.11.23,192.168.11.8,TCP,66,0.000086,,,"56678  >  6000 [FIN, ACK] Seq=28 Ack=1 Win=64256 Len=0 TSval=2801420869 TSecr=3797675233"
91,36.315991,192.168.11.8,192.168.11.23,TCP,66,0.007156,,,6000  >  56678 [ACK] Seq=1 Ack=28 Win=65152 Len=0 TSval=3797675240 TSecr=2801420869
92,36.316352,192.168.11.8,192.168.11.23,TCP,66,0.000361,,,"6000  >  56678 [FIN, ACK] Seq=1 Ack=29 Win=65152 Len=0 TSval=3797675241 TSecr=2801420869"
93,36.3164,192.168.11.23,192.168.11.8,TCP,66,0.000048,,,56678  >  6000 [ACK] Seq=29 Ack=2 Win=64256 Len=0 TSval=2801420877 TSecr=3797675241
94,36.347047,192.168.11.23,255.255.255.255,UDP,209,0.030647,Ÿ,7b2273656d616e74696373223a207b22656e74697479223a2022504944222c202262617365656e74697479223a2022616e79222c2022726f6c65223a2022656565222c20227370617469616c223a2022616e79222c202274656d706f72616c223a2022616e79227d2c20226461746170726f7065727479223a207b22666f726d6174223a2022696e616f6b615f70726f6772616d5f73616d706c655f73656d616e746963227d7d,59738  >  7000 Len=167
95,36.352547,192.168.11.9,192.168.11.23,TCP,74,0.0055,œ,,54062  >  6000 [SYN] Seq=0 Win=64240 Len=0 MSS=1460 SACK_PERM TSval=2825072387 TSecr=0 WS=128
96,36.352648,192.168.11.23,192.168.11.9,TCP,74,0.000101,,,"6000  >  54062 [SYN, ACK] Seq=0 Ack=1 Win=65160 Len=0 MSS=1460 SACK_PERM TSval=267501230 TSecr=2825072387 WS=128"
97,36.359437,192.168.11.9,192.168.11.23,TCP,66,0.006789,,,54062  >  6000 [ACK] Seq=1 Ack=1 Win=64256 Len=0 TSval=2825072393 TSecr=267501230
98,36.359971,192.168.11.9,192.168.11.23,TCP,93,0.000534,,,"54062  >  6000 [PSH, ACK] Seq=1 Ack=1 Win=64256 Len=27 TSval=2825072394 TSecr=267501230 [TCP segment of a reassembled PDU]"
99,36.360037,192.168.11.23,192.168.11.9,TCP,66,0.000066,,,6000  >  54062 [ACK] Seq=1 Ack=28 Win=65152 Len=0 TSval=267501237 TSecr=2825072394
100,36.36012,192.168.11.9,192.168.11.23,TCP,66,0.000083,,,"54062  >  6000 [FIN, ACK] Seq=28 Ack=1 Win=64256 Len=0 TSval=2825072394 TSecr=267501230"
101,36.361244,192.168.11.23,192.168.11.9,TCP,66,0.001124,,,"6000  >  54062 [FIN, ACK] Seq=1 Ack=29 Win=65152 Len=0 TSval=267501239 TSecr=2825072394"
102,36.367472,192.168.11.9,192.168.11.23,TCP,66,0.006228,,,54062  >  6000 [ACK] Seq=29 Ack=2 Win=64256 Len=0 TSval=2825072401 TSecr=267501239
103,43.498861,192.168.11.23,192.168.11.8,TCP,74,7.131389,,,53038  >  6000 [SYN] Seq=0 Win=64240 Len=0 MSS=1460 SACK_PERM TSval=2801428059 TSecr=0 WS=128
104,43.513622,192.168.11.8,192.168.11.23,TCP,74,0.014761,,,"6000  >  53038 [SYN, ACK] Seq=0 Ack=1 Win=65160 Len=0 MSS=1460 SACK_PERM TSval=3797682438 TSecr=2801428059 WS=128"
105,43.513723,192.168.11.23,192.168.11.8,TCP,66,0.000101,,,53038  >  6000 [ACK] Seq=1 Ack=1 Win=64256 Len=0 TSval=2801428074 TSecr=3797682438
106,43.513885,192.168.11.23,192.168.11.8,TCP,93,0.000162,,,"53038  >  6000 [PSH, ACK] Seq=1 Ack=1 Win=64256 Len=27 TSval=2801428074 TSecr=3797682438 [TCP segment of a reassembled PDU]"
107,43.514002,192.168.11.23,192.168.11.8,TCP,66,0.000117,,,"53038  >  6000 [FIN, ACK] Seq=28 Ack=1 Win=64256 Len=0 TSval=2801428074 TSecr=3797682438"
108,43.521175,192.168.11.8,192.168.11.23,TCP,66,0.007173,,,6000  >  53038 [ACK] Seq=1 Ack=28 Win=65152 Len=0 TSval=3797682445 TSecr=2801428074
109,43.521391,192.168.11.8,192.168.11.23,TCP,66,0.000216,,,"6000  >  53038 [FIN, ACK] Seq=1 Ack=29 Win=65152 Len=0 TSval=3797682446 TSecr=2801428074"
110,43.521434,192.168.11.23,192.168.11.8,TCP,66,0.000043,,,53038  >  6000 [ACK] Seq=29 Ack=2 Win=64256 Len=0 TSval=2801428082 TSecr=3797682446
111,43.550716,192.168.11.23,255.255.255.255,UDP,209,0.029282,Ÿ,7b2273656d616e74696373223a207b22656e74697479223a2022504944222c202262617365656e74697479223a2022616e79222c2022726f6c65223a2022656565222c20227370617469616c223a2022616e79222c202274656d706f72616c223a2022616e79227d2c20226461746170726f7065727479223a207b22666f726d6174223a2022696e616f6b615f70726f6772616d5f73616d706c655f73656d616e746963227d7d,42520  >  7000 Len=167
112,43.556246,192.168.11.9,192.168.11.23,TCP,74,0.00553,œ,,54066  >  6000 [SYN] Seq=0 Win=64240 Len=0 MSS=1460 SACK_PERM TSval=2825079591 TSecr=0 WS=128
113,43.556347,192.168.11.23,192.168.11.9,TCP,74,0.000101,,,"6000  >  54066 [SYN, ACK] Seq=0 Ack=1 Win=65160 Len=0 MSS=1460 SACK_PERM TSval=267508434 TSecr=2825079591 WS=128"
114,43.562849,192.168.11.9,192.168.11.23,TCP,66,0.006502,,,54066  >  6000 [ACK] Seq=1 Ack=1 Win=64256 Len=0 TSval=2825079597 TSecr=267508434
115,43.563392,192.168.11.9,192.168.11.23,TCP,93,0.000543,,,"54066  >  6000 [PSH, ACK] Seq=1 Ack=1 Win=64256 Len=27 TSval=2825079597 TSecr=267508434 [TCP segment of a reassembled PDU]"
116,43.563465,192.168.11.23,192.168.11.9,TCP,66,0.000073,,,6000  >  54066 [ACK] Seq=1 Ack=28 Win=65152 Len=0 TSval=267508441 TSecr=2825079597
117,43.563523,192.168.11.9,192.168.11.23,TCP,66,0.000058,,,"54066  >  6000 [FIN, ACK] Seq=28 Ack=1 Win=64256 Len=0 TSval=2825079597 TSecr=267508434"
118,43.564473,192.168.11.23,192.168.11.9,TCP,66,0.00095,,,"6000  >  54066 [FIN, ACK] Seq=1 Ack=29 Win=65152 Len=0 TSval=267508442 TSecr=2825079597"
119,43.570612,192.168.11.9,192.168.11.23,TCP,66,0.006139,,,54066  >  6000 [ACK] Seq=29 Ack=2 Win=64256 Len=0 TSval=2825079605 TSecr=267508442
120,50.713921,192.168.11.23,192.168.11.8,TCP,74,7.143309,,,58316  >  6000 [SYN] Seq=0 Win=64240 Len=0 MSS=1460 SACK_PERM TSval=2801435274 TSecr=0 WS=128
121,50.720943,192.168.11.8,192.168.11.23,TCP,74,0.007022,,,"6000  >  58316 [SYN, ACK] Seq=0 Ack=1 Win=65160 Len=0 MSS=1460 SACK_PERM TSval=3797689645 TSecr=2801435274 WS=128"
122,50.72105,192.168.11.23,192.168.11.8,TCP,66,0.000107,,,58316  >  6000 [ACK] Seq=1 Ack=1 Win=64256 Len=0 TSval=2801435281 TSecr=3797689645
123,50.721238,192.168.11.23,192.168.11.8,TCP,93,0.000188,,,"58316  >  6000 [PSH, ACK] Seq=1 Ack=1 Win=64256 Len=27 TSval=2801435282 TSecr=3797689645 [TCP segment of a reassembled PDU]"
124,50.72134,192.168.11.23,192.168.11.8,TCP,66,0.000102,,,"58316  >  6000 [FIN, ACK] Seq=28 Ack=1 Win=64256 Len=0 TSval=2801435282 TSecr=3797689645"
125,50.72933,192.168.11.8,192.168.11.23,TCP,66,0.00799,,,6000  >  58316 [ACK] Seq=1 Ack=28 Win=65152 Len=0 TSval=3797689653 TSecr=2801435282
126,50.7297,192.168.11.8,192.168.11.23,TCP,66,0.00037,,,"6000  >  58316 [FIN, ACK] Seq=1 Ack=29 Win=65152 Len=0 TSval=3797689654 TSecr=2801435282"
127,50.729743,192.168.11.23,192.168.11.8,TCP,66,0.000043,,,58316  >  6000 [ACK] Seq=29 Ack=2 Win=64256 Len=0 TSval=2801435290 TSecr=3797689654
128,50.75745,192.168.11.23,255.255.255.255,UDP,209,0.027707,Ÿ,7b2273656d616e74696373223a207b22656e74697479223a2022504944222c202262617365656e74697479223a2022616e79222c2022726f6c65223a2022656565222c20227370617469616c223a2022616e79222c202274656d706f72616c223a2022616e79227d2c20226461746170726f7065727479223a207b22666f726d6174223a2022696e616f6b615f70726f6772616d5f73616d706c655f73656d616e746963227d7d,53186  >  7000 Len=167
129,50.762996,192.168.11.9,192.168.11.23,TCP,74,0.005546,œ,,56646  >  6000 [SYN] Seq=0 Win=64240 Len=0 MSS=1460 SACK_PERM TSval=2825086797 TSecr=0 WS=128
130,50.763102,192.168.11.23,192.168.11.9,TCP,74,0.000106,,,"6000  >  56646 [SYN, ACK] Seq=0 Ack=1 Win=65160 Len=0 MSS=1460 SACK_PERM TSval=267515640 TSecr=2825086797 WS=128"
131,50.769688,192.168.11.9,192.168.11.23,TCP,66,0.006586,,,56646  >  6000 [ACK] Seq=1 Ack=1 Win=64256 Len=0 TSval=2825086804 TSecr=267515640
132,50.770136,192.168.11.9,192.168.11.23,TCP,93,0.000448,,,"56646  >  6000 [PSH, ACK] Seq=1 Ack=1 Win=64256 Len=27 TSval=2825086804 TSecr=267515640 [TCP segment of a reassembled PDU]"
133,50.770195,192.168.11.23,192.168.11.9,TCP,66,0.000059,,,6000  >  56646 [ACK] Seq=1 Ack=28 Win=65152 Len=0 TSval=267515648 TSecr=2825086804
134,50.770255,192.168.11.9,192.168.11.23,TCP,66,0.00006,,,"56646  >  6000 [FIN, ACK] Seq=28 Ack=1 Win=64256 Len=0 TSval=2825086804 TSecr=267515640"
135,50.771177,192.168.11.23,192.168.11.9,TCP,66,0.000922,,,"6000  >  56646 [FIN, ACK] Seq=1 Ack=29 Win=65152 Len=0 TSval=267515648 TSecr=2825086804"
136,50.777499,192.168.11.9,192.168.11.23,TCP,66,0.006322,,,56646  >  6000 [ACK] Seq=29 Ack=2 Win=64256 Len=0 TSval=2825086812 TSecr=267515648
137,57.88437,192.168.11.23,192.168.11.8,TCP,74,7.106871,,,58328  >  6000 [SYN] Seq=0 Win=64240 Len=0 MSS=1460 SACK_PERM TSval=2801442445 TSecr=0 WS=128
138,57.8911,192.168.11.8,192.168.11.23,TCP,74,0.00673,,,"6000  >  58328 [SYN, ACK] Seq=0 Ack=1 Win=65160 Len=0 MSS=1460 SACK_PERM TSval=3797696814 TSecr=2801442445 WS=128"
139,57.891226,192.168.11.23,192.168.11.8,TCP,66,0.000126,,,58328  >  6000 [ACK] Seq=1 Ack=1 Win=64256 Len=0 TSval=2801442452 TSecr=3797696814
140,57.891396,192.168.11.23,192.168.11.8,TCP,93,0.00017,,,"58328  >  6000 [PSH, ACK] Seq=1 Ack=1 Win=64256 Len=27 TSval=2801442452 TSecr=3797696814 [TCP segment of a reassembled PDU]"
141,57.891486,192.168.11.23,192.168.11.8,TCP,66,0.00009,,,"58328  >  6000 [FIN, ACK] Seq=28 Ack=1 Win=64256 Len=0 TSval=2801442452 TSecr=3797696814"
142,57.898353,192.168.11.8,192.168.11.23,TCP,66,0.006867,,,6000  >  58328 [ACK] Seq=1 Ack=28 Win=65152 Len=0 TSval=3797696822 TSecr=2801442452
143,57.898725,192.168.11.8,192.168.11.23,TCP,66,0.000372,,,"6000  >  58328 [FIN, ACK] Seq=1 Ack=29 Win=65152 Len=0 TSval=3797696823 TSecr=2801442452"
144,57.898768,192.168.11.23,192.168.11.8,TCP,66,0.000043,,,58328  >  6000 [ACK] Seq=29 Ack=2 Win=64256 Len=0 TSval=2801442459 TSecr=3797696823
145,57.925841,192.168.11.23,255.255.255.255,UDP,209,0.027073,Ÿ,7b2273656d616e74696373223a207b22656e74697479223a2022504944222c202262617365656e74697479223a2022616e79222c2022726f6c65223a2022656565222c20227370617469616c223a2022616e79222c202274656d706f72616c223a2022616e79227d2c20226461746170726f7065727479223a207b22666f726d6174223a2022696e616f6b615f70726f6772616d5f73616d706c655f73656d616e746963227d7d,40141  >  7000 Len=167
146,57.931497,192.168.11.9,192.168.11.23,TCP,74,0.005656,œ,,42404  >  6000 [SYN] Seq=0 Win=64240 Len=0 MSS=1460 SACK_PERM TSval=2825093966 TSecr=0 WS=128
147,57.931608,192.168.11.23,192.168.11.9,TCP,74,0.000111,,,"6000  >  42404 [SYN, ACK] Seq=0 Ack=1 Win=65160 Len=0 MSS=1460 SACK_PERM TSval=267522809 TSecr=2825093966 WS=128"
148,57.93815,192.168.11.9,192.168.11.23,TCP,66,0.006542,,,42404  >  6000 [ACK] Seq=1 Ack=1 Win=64256 Len=0 TSval=2825093973 TSecr=267522809
149,57.938658,192.168.11.9,192.168.11.23,TCP,93,0.000508,,,"42404  >  6000 [PSH, ACK] Seq=1 Ack=1 Win=64256 Len=27 TSval=2825093973 TSecr=267522809 [TCP segment of a reassembled PDU]"
150,57.938729,192.168.11.23,192.168.11.9,TCP,66,0.000071,,,6000  >  42404 [ACK] Seq=1 Ack=28 Win=65152 Len=0 TSval=267522816 TSecr=2825093973
151,57.938797,192.168.11.9,192.168.11.23,TCP,66,0.000068,,,"42404  >  6000 [FIN, ACK] Seq=28 Ack=1 Win=64256 Len=0 TSval=2825093973 TSecr=267522809"
152,57.939728,192.168.11.23,192.168.11.9,TCP,66,0.000931,,,"6000  >  42404 [FIN, ACK] Seq=1 Ack=29 Win=65152 Len=0 TSval=267522817 TSecr=2825093973"
153,57.945849,192.168.11.9,192.168.11.23,TCP,66,0.006121,,,42404  >  6000 [ACK] Seq=29 Ack=2 Win=64256 Len=0 TSval=2825093980 TSecr=267522817
154,65.018803,192.168.11.23,192.168.11.8,TCP,74,7.072954,,,35370  >  6000 [SYN] Seq=0 Win=64240 Len=0 MSS=1460 SACK_PERM TSval=2801449579 TSecr=0 WS=128
155,65.025393,192.168.11.8,192.168.11.23,TCP,74,0.00659,,,"6000  >  35370 [SYN, ACK] Seq=0 Ack=1 Win=65160 Len=0 MSS=1460 SACK_PERM TSval=3797703948 TSecr=2801449579 WS=128"
156,65.025492,192.168.11.23,192.168.11.8,TCP,66,0.000099,,,35370  >  6000 [ACK] Seq=1 Ack=1 Win=64256 Len=0 TSval=2801449586 TSecr=3797703948
157,65.025663,192.168.11.23,192.168.11.8,TCP,93,0.000171,,,"35370  >  6000 [PSH, ACK] Seq=1 Ack=1 Win=64256 Len=27 TSval=2801449586 TSecr=3797703948 [TCP segment of a reassembled PDU]"
158,65.025753,192.168.11.23,192.168.11.8,TCP,66,0.00009,,,"35370  >  6000 [FIN, ACK] Seq=28 Ack=1 Win=64256 Len=0 TSval=2801449586 TSecr=3797703948"
159,65.032955,192.168.11.8,192.168.11.23,TCP,66,0.007202,,,6000  >  35370 [ACK] Seq=1 Ack=28 Win=65152 Len=0 TSval=3797703955 TSecr=2801449586
160,65.033333,192.168.11.8,192.168.11.23,TCP,66,0.000378,,,"6000  >  35370 [FIN, ACK] Seq=1 Ack=29 Win=65152 Len=0 TSval=3797703957 TSecr=2801449586"
161,65.033378,192.168.11.23,192.168.11.8,TCP,66,0.000045,,,35370  >  6000 [ACK] Seq=29 Ack=2 Win=64256 Len=0 TSval=2801449594 TSecr=3797703957
162,65.061029,192.168.11.23,255.255.255.255,UDP,209,0.027651,Ÿ,7b2273656d616e74696373223a207b22656e74697479223a2022504944222c202262617365656e74697479223a2022616e79222c2022726f6c65223a2022656565222c20227370617469616c223a2022616e79222c202274656d706f72616c223a2022616e79227d2c20226461746170726f7065727479223a207b22666f726d6174223a2022696e616f6b615f70726f6772616d5f73616d706c655f73656d616e746963227d7d,41979  >  7000 Len=167
163,65.066497,192.168.11.9,192.168.11.23,TCP,74,0.005468,œ,,42418  >  6000 [SYN] Seq=0 Win=64240 Len=0 MSS=1460 SACK_PERM TSval=2825101101 TSecr=0 WS=128
164,65.066621,192.168.11.23,192.168.11.9,TCP,74,0.000124,,,"6000  >  42418 [SYN, ACK] Seq=0 Ack=1 Win=65160 Len=0 MSS=1460 SACK_PERM TSval=267529944 TSecr=2825101101 WS=128"
165,65.074336,192.168.11.9,192.168.11.23,TCP,66,0.007715,,,42418  >  6000 [ACK] Seq=1 Ack=1 Win=64256 Len=0 TSval=2825101108 TSecr=267529944
166,65.074855,192.168.11.9,192.168.11.23,TCP,93,0.000519,,,"42418  >  6000 [PSH, ACK] Seq=1 Ack=1 Win=64256 Len=27 TSval=2825101108 TSecr=267529944 [TCP segment of a reassembled PDU]"
167,65.074933,192.168.11.23,192.168.11.9,TCP,66,0.000078,,,6000  >  42418 [ACK] Seq=1 Ack=28 Win=65152 Len=0 TSval=267529952 TSecr=2825101108
168,65.075,192.168.11.9,192.168.11.23,TCP,66,0.000067,,,"42418  >  6000 [FIN, ACK] Seq=28 Ack=1 Win=64256 Len=0 TSval=2825101108 TSecr=267529944"
169,65.075945,192.168.11.23,192.168.11.9,TCP,66,0.000945,,,"6000  >  42418 [FIN, ACK] Seq=1 Ack=29 Win=65152 Len=0 TSval=267529953 TSecr=2825101108"
170,65.082273,192.168.11.9,192.168.11.23,TCP,66,0.006328,,,42418  >  6000 [ACK] Seq=29 Ack=2 Win=64256 Len=0 TSval=2825101117 TSecr=267529953
171,110.689493,192.168.11.23,192.168.11.8,TCP,74,45.60722,,,36776  >  6000 [SYN] Seq=0 Win=64240 Len=0 MSS=1460 SACK_PERM TSval=2801495250 TSecr=0 WS=128
172,110.696049,192.168.11.8,192.168.11.23,TCP,74,0.006556,,,"6000  >  36776 [SYN, ACK] Seq=0 Ack=1 Win=65160 Len=0 MSS=1460 SACK_PERM TSval=3797749617 TSecr=2801495250 WS=128"
173,110.696163,192.168.11.23,192.168.11.8,TCP,66,0.000114,,,36776  >  6000 [ACK] Seq=1 Ack=1 Win=64256 Len=0 TSval=2801495256 TSecr=3797749617
174,110.696397,192.168.11.23,192.168.11.8,TCP,93,0.000234,,,"36776  >  6000 [PSH, ACK] Seq=1 Ack=1 Win=64256 Len=27 TSval=2801495257 TSecr=3797749617 [TCP segment of a reassembled PDU]"
175,110.69651,192.168.11.23,192.168.11.8,TCP,66,0.000113,,,"36776  >  6000 [FIN, ACK] Seq=28 Ack=1 Win=64256 Len=0 TSval=2801495257 TSecr=3797749617"
176,110.703681,192.168.11.8,192.168.11.23,TCP,66,0.007171,,,6000  >  36776 [ACK] Seq=1 Ack=28 Win=65152 Len=0 TSval=3797749624 TSecr=2801495257
177,110.704041,192.168.11.8,192.168.11.23,TCP,66,0.00036,,,"6000  >  36776 [FIN, ACK] Seq=1 Ack=29 Win=65152 Len=0 TSval=3797749625 TSecr=2801495257"
178,110.704085,192.168.11.23,192.168.11.8,TCP,66,0.000044,,,36776  >  6000 [ACK] Seq=29 Ack=2 Win=64256 Len=0 TSval=2801495264 TSecr=3797749625
179,110.732575,192.168.11.23,255.255.255.255,UDP,209,0.02849,Ÿ,7b2273656d616e74696373223a207b22656e74697479223a2022504944222c202262617365656e74697479223a2022616e79222c2022726f6c65223a2022656565222c20227370617469616c223a2022616e79222c202274656d706f72616c223a2022616e79227d2c20226461746170726f7065727479223a207b22666f726d6174223a2022696e616f6b615f70726f6772616d5f73616d706c655f73656d616e746963227d7d,37079  >  7000 Len=167
180,110.739285,192.168.11.9,192.168.11.23,TCP,74,0.00671,œ,,60266  >  6000 [SYN] Seq=0 Win=64240 Len=0 MSS=1460 SACK_PERM TSval=2825146774 TSecr=0 WS=128
181,110.739407,192.168.11.23,192.168.11.9,TCP,74,0.000122,,,"6000  >  60266 [SYN, ACK] Seq=0 Ack=1 Win=65160 Len=0 MSS=1460 SACK_PERM TSval=267575617 TSecr=2825146774 WS=128"
182,110.746451,192.168.11.9,192.168.11.23,TCP,66,0.007044,,,60266  >  6000 [ACK] Seq=1 Ack=1 Win=64256 Len=0 TSval=2825146781 TSecr=267575617
183,110.747056,192.168.11.9,192.168.11.23,TCP,93,0.000605,,,"60266  >  6000 [PSH, ACK] Seq=1 Ack=1 Win=64256 Len=27 TSval=2825146782 TSecr=267575617 [TCP segment of a reassembled PDU]"
184,110.747202,192.168.11.23,192.168.11.9,TCP,66,0.000146,,,6000  >  60266 [ACK] Seq=1 Ack=28 Win=65152 Len=0 TSval=267575624 TSecr=2825146782
185,110.747375,192.168.11.9,192.168.11.23,TCP,66,0.000173,,,"60266  >  6000 [FIN, ACK] Seq=28 Ack=1 Win=64256 Len=0 TSval=2825146782 TSecr=267575617"
186,110.748417,192.168.11.23,192.168.11.9,TCP,66,0.001042,,,"6000  >  60266 [FIN, ACK] Seq=1 Ack=29 Win=65152 Len=0 TSval=267575626 TSecr=2825146782"
187,110.754478,192.168.11.9,192.168.11.23,TCP,66,0.006061,,,60266  >  6000 [ACK] Seq=29 Ack=2 Win=64256 Len=0 TSval=2825146790 TSecr=267575626
188,117.829717,192.168.11.23,192.168.11.8,TCP,74,7.075239,,,36786  >  6000 [SYN] Seq=0 Win=64240 Len=0 MSS=1460 SACK_PERM TSval=2801502390 TSecr=0 WS=128
189,117.836398,192.168.11.8,192.168.11.23,TCP,74,0.006681,,,"6000  >  36786 [SYN, ACK] Seq=0 Ack=1 Win=65160 Len=0 MSS=1460 SACK_PERM TSval=3797756756 TSecr=2801502390 WS=128"
190,117.836505,192.168.11.23,192.168.11.8,TCP,66,0.000107,,,36786  >  6000 [ACK] Seq=1 Ack=1 Win=64256 Len=0 TSval=2801502397 TSecr=3797756756
191,117.836678,192.168.11.23,192.168.11.8,TCP,93,0.000173,,,"36786  >  6000 [PSH, ACK] Seq=1 Ack=1 Win=64256 Len=27 TSval=2801502397 TSecr=3797756756 [TCP segment of a reassembled PDU]"
192,117.836766,192.168.11.23,192.168.11.8,TCP,66,0.000088,,,"36786  >  6000 [FIN, ACK] Seq=28 Ack=1 Win=64256 Len=0 TSval=2801502397 TSecr=3797756756"
193,117.84289,192.168.11.8,192.168.11.23,TCP,66,0.006124,,,6000  >  36786 [ACK] Seq=1 Ack=28 Win=65152 Len=0 TSval=3797756763 TSecr=2801502397
194,117.843324,192.168.11.8,192.168.11.23,TCP,66,0.000434,,,"6000  >  36786 [FIN, ACK] Seq=1 Ack=29 Win=65152 Len=0 TSval=3797756764 TSecr=2801502397"
195,117.843377,192.168.11.23,192.168.11.8,TCP,66,0.000053,,,36786  >  6000 [ACK] Seq=29 Ack=2 Win=64256 Len=0 TSval=2801502404 TSecr=3797756764
196,117.870382,192.168.11.23,255.255.255.255,UDP,209,0.027005,Ÿ,7b2273656d616e74696373223a207b22656e74697479223a2022504944222c202262617365656e74697479223a2022616e79222c2022726f6c65223a2022656565222c20227370617469616c223a2022616e79222c202274656d706f72616c223a2022616e79227d2c20226461746170726f7065727479223a207b22666f726d6174223a2022696e616f6b615f70726f6772616d5f73616d706c655f73656d616e746963227d7d,47004  >  7000 Len=167
197,117.876885,192.168.11.9,192.168.11.23,TCP,74,0.006503,œ,,35570  >  6000 [SYN] Seq=0 Win=64240 Len=0 MSS=1460 SACK_PERM TSval=2825153911 TSecr=0 WS=128
198,117.877,192.168.11.23,192.168.11.9,TCP,74,0.000115,,,"6000  >  35570 [SYN, ACK] Seq=0 Ack=1 Win=65160 Len=0 MSS=1460 SACK_PERM TSval=267582754 TSecr=2825153911 WS=128"
199,117.88392,192.168.11.9,192.168.11.23,TCP,66,0.00692,,,35570  >  6000 [ACK] Seq=1 Ack=1 Win=64256 Len=0 TSval=2825153919 TSecr=267582754
200,117.884529,192.168.11.9,192.168.11.23,TCP,93,0.000609,,,"35570  >  6000 [PSH, ACK] Seq=1 Ack=1 Win=64256 Len=27 TSval=2825153919 TSecr=267582754 [TCP segment of a reassembled PDU]"
201,117.884629,192.168.11.23,192.168.11.9,TCP,66,0.0001,,,6000  >  35570 [ACK] Seq=1 Ack=28 Win=65152 Len=0 TSval=267582762 TSecr=2825153919
202,117.884708,192.168.11.9,192.168.11.23,TCP,66,0.000079,,,"35570  >  6000 [FIN, ACK] Seq=28 Ack=1 Win=64256 Len=0 TSval=2825153919 TSecr=267582754"
203,117.885932,192.168.11.23,192.168.11.9,TCP,66,0.001224,,,"6000  >  35570 [FIN, ACK] Seq=1 Ack=29 Win=65152 Len=0 TSval=267582763 TSecr=2825153919"
204,117.891722,192.168.11.9,192.168.11.23,TCP,66,0.00579,,,35570  >  6000 [ACK] Seq=29 Ack=2 Win=64256 Len=0 TSval=2825153927 TSecr=267582763
205,125.039924,192.168.11.23,192.168.11.8,TCP,74,7.148202,,,43716  >  6000 [SYN] Seq=0 Win=64240 Len=0 MSS=1460 SACK_PERM TSval=2801509600 TSecr=0 WS=128
206,125.046807,192.168.11.8,192.168.11.23,TCP,74,0.006883,,,"6000  >  43716 [SYN, ACK] Seq=0 Ack=1 Win=65160 Len=0 MSS=1460 SACK_PERM TSval=3797763967 TSecr=2801509600 WS=128"
207,125.046913,192.168.11.23,192.168.11.8,TCP,66,0.000106,,,43716  >  6000 [ACK] Seq=1 Ack=1 Win=64256 Len=0 TSval=2801509607 TSecr=3797763967
208,125.047073,192.168.11.23,192.168.11.8,TCP,93,0.00016,,,"43716  >  6000 [PSH, ACK] Seq=1 Ack=1 Win=64256 Len=27 TSval=2801509607 TSecr=3797763967 [TCP segment of a reassembled PDU]"
209,125.047224,192.168.11.23,192.168.11.8,TCP,66,0.000151,,,"43716  >  6000 [FIN, ACK] Seq=28 Ack=1 Win=64256 Len=0 TSval=2801509608 TSecr=3797763967"
210,125.063324,192.168.11.8,192.168.11.23,TCP,66,0.0161,,,6000  >  43716 [ACK] Seq=1 Ack=28 Win=65152 Len=0 TSval=3797763983 TSecr=2801509607
211,125.063698,192.168.11.8,192.168.11.23,TCP,66,0.000374,,,"6000  >  43716 [FIN, ACK] Seq=1 Ack=29 Win=65152 Len=0 TSval=3797763984 TSecr=2801509608"
212,125.063767,192.168.11.23,192.168.11.8,TCP,66,0.000069,,,43716  >  6000 [ACK] Seq=29 Ack=2 Win=64256 Len=0 TSval=2801509624 TSecr=3797763984
213,125.090506,192.168.11.23,255.255.255.255,UDP,209,0.026739,Ÿ,7b2273656d616e74696373223a207b22656e74697479223a2022504944222c202262617365656e74697479223a2022616e79222c2022726f6c65223a2022656565222c20227370617469616c223a2022616e79222c202274656d706f72616c223a2022616e79227d2c20226461746170726f7065727479223a207b22666f726d6174223a2022696e616f6b615f70726f6772616d5f73616d706c655f73656d616e746963227d7d,33135  >  7000 Len=167
214,125.097002,192.168.11.9,192.168.11.23,TCP,74,0.006496,œ,,35580  >  6000 [SYN] Seq=0 Win=64240 Len=0 MSS=1460 SACK_PERM TSval=2825161132 TSecr=0 WS=128
215,125.097116,192.168.11.23,192.168.11.9,TCP,74,0.000114,,,"6000  >  35580 [SYN, ACK] Seq=0 Ack=1 Win=65160 Len=0 MSS=1460 SACK_PERM TSval=267589974 TSecr=2825161132 WS=128"
216,125.106662,192.168.11.9,192.168.11.23,TCP,66,0.009546,,,35580  >  6000 [ACK] Seq=1 Ack=1 Win=64256 Len=0 TSval=2825161142 TSecr=267589974
217,125.107332,192.168.11.9,192.168.11.23,TCP,93,0.00067,,,"35580  >  6000 [PSH, ACK] Seq=1 Ack=1 Win=64256 Len=27 TSval=2825161142 TSecr=267589974 [TCP segment of a reassembled PDU]"
218,125.107454,192.168.11.23,192.168.11.9,TCP,66,0.000122,,,6000  >  35580 [ACK] Seq=1 Ack=28 Win=65152 Len=0 TSval=267589985 TSecr=2825161142
219,125.107531,192.168.11.9,192.168.11.23,TCP,66,0.000077,,,"35580  >  6000 [FIN, ACK] Seq=28 Ack=1 Win=64256 Len=0 TSval=2825161142 TSecr=267589974"
220,125.108593,192.168.11.23,192.168.11.9,TCP,66,0.001062,,,"6000  >  35580 [FIN, ACK] Seq=1 Ack=29 Win=65152 Len=0 TSval=267589986 TSecr=2825161142"
221,125.114265,192.168.11.9,192.168.11.23,TCP,66,0.005672,,,35580  >  6000 [ACK] Seq=29 Ack=2 Win=64256 Len=0 TSval=2825161150 TSecr=267589986
222,132.242956,192.168.11.23,192.168.11.8,TCP,74,7.128691,,,52620  >  6000 [SYN] Seq=0 Win=64240 Len=0 MSS=1460 SACK_PERM TSval=2801516803 TSecr=0 WS=128
223,132.249188,192.168.11.8,192.168.11.23,TCP,74,0.006232,,,"6000  >  52620 [SYN, ACK] Seq=0 Ack=1 Win=65160 Len=0 MSS=1460 SACK_PERM TSval=3797771169 TSecr=2801516803 WS=128"
224,132.249317,192.168.11.23,192.168.11.8,TCP,66,0.000129,,,52620  >  6000 [ACK] Seq=1 Ack=1 Win=64256 Len=0 TSval=2801516810 TSecr=3797771169
225,132.24946,192.168.11.23,192.168.11.8,TCP,93,0.000143,,,"52620  >  6000 [PSH, ACK] Seq=1 Ack=1 Win=64256 Len=27 TSval=2801516810 TSecr=3797771169 [TCP segment of a reassembled PDU]"
226,132.249551,192.168.11.23,192.168.11.8,TCP,66,0.000091,,,"52620  >  6000 [FIN, ACK] Seq=28 Ack=1 Win=64256 Len=0 TSval=2801516810 TSecr=3797771169"
227,132.255969,192.168.11.8,192.168.11.23,TCP,66,0.006418,,,6000  >  52620 [ACK] Seq=1 Ack=28 Win=65152 Len=0 TSval=3797771175 TSecr=2801516810
228,132.256365,192.168.11.8,192.168.11.23,TCP,66,0.000396,,,"6000  >  52620 [FIN, ACK] Seq=1 Ack=29 Win=65152 Len=0 TSval=3797771176 TSecr=2801516810"
229,132.256417,192.168.11.23,192.168.11.8,TCP,66,0.000052,,,52620  >  6000 [ACK] Seq=29 Ack=2 Win=64256 Len=0 TSval=2801516817 TSecr=3797771176
230,132.284059,192.168.11.23,255.255.255.255,UDP,209,0.027642,Ÿ,7b2273656d616e74696373223a207b22656e74697479223a2022504944222c202262617365656e74697479223a2022616e79222c2022726f6c65223a2022656565222c20227370617469616c223a2022616e79222c202274656d706f72616c223a2022616e79227d2c20226461746170726f7065727479223a207b22666f726d6174223a2022696e616f6b615f70726f6772616d5f73616d706c655f73656d616e746963227d7d,50843  >  7000 Len=167
231,132.289724,192.168.11.9,192.168.11.23,TCP,74,0.005665,œ,,45476  >  6000 [SYN] Seq=0 Win=64240 Len=0 MSS=1460 SACK_PERM TSval=2825168325 TSecr=0 WS=128
232,132.289831,192.168.11.23,192.168.11.9,TCP,74,0.000107,,,"6000  >  45476 [SYN, ACK] Seq=0 Ack=1 Win=65160 Len=0 MSS=1460 SACK_PERM TSval=267597167 TSecr=2825168325 WS=128"
233,132.296924,192.168.11.9,192.168.11.23,TCP,66,0.007093,,,45476  >  6000 [ACK] Seq=1 Ack=1 Win=64256 Len=0 TSval=2825168333 TSecr=267597167
