No.,Time,Source,Destination,Protocol,Length,Time delta from previous captured frame,XXX,Data,Info
1,0,192.168.11.30,192.168.11.10,TCP,74,0,,,45054  >  6000 [SYN] Seq=0 Win=64240 Len=0 MSS=1460 SACK_PERM TSval=3849843874 TSecr=0 WS=128
2,0.007265,192.168.11.10,192.168.11.30,TCP,74,0.007265,,,"6000  >  45054 [SYN, ACK] Seq=0 Ack=1 Win=65160 Len=0 MSS=1460 SACK_PERM TSval=2557187062 TSecr=3849843874 WS=128"
3,0.007377,192.168.11.30,192.168.11.10,TCP,66,0.000112,,,45054  >  6000 [ACK] Seq=1 Ack=1 Win=64256 Len=0 TSval=3849843885 TSecr=2557187062
4,0.007628,192.168.11.30,192.168.11.10,TCP,93,0.000251,,,"45054  >  6000 [PSH, ACK] Seq=1 Ack=1 Win=64256 Len=27 TSval=3849843885 TSecr=2557187062 [TCP segment of a reassembled PDU]"
5,0.007768,192.168.11.30,192.168.11.10,TCP,66,0.00014,,,"45054  >  6000 [FIN, ACK] Seq=28 Ack=1 Win=64256 Len=0 TSval=3849843885 TSecr=2557187062"
6,0.021512,192.168.11.10,192.168.11.30,TCP,66,0.013744,,,6000  >  45054 [ACK] Seq=1 Ack=28 Win=65152 Len=0 TSval=2557187077 TSecr=3849843885
7,0.021767,192.168.11.10,192.168.11.30,TCP,66,0.000255,,,"6000  >  45054 [FIN, ACK] Seq=1 Ack=29 Win=65152 Len=0 TSval=2557187078 TSecr=3849843885"
8,0.021813,192.168.11.30,192.168.11.10,TCP,66,0.000046,,,45054  >  6000 [ACK] Seq=29 Ack=2 Win=64256 Len=0 TSval=3849843899 TSecr=2557187078
9,0.05194,192.168.11.30,255.255.255.255,UDP,209,0.030127,Ÿ,7b2273656d616e74696373223a207b22656e74697479223a2022504944222c202262617365656e74697479223a2022616e79222c2022726f6c65223a2022686868222c20227370617469616c223a2022616e79222c202274656d706f72616c223a2022616e79227d2c20226461746170726f7065727479223a207b22666f726d6174223a2022696e616f6b615f70726f6772616d5f73616d706c655f73656d616e746963227d7d,55410  >  7000 Len=167
10,0.060064,192.168.11.21,192.168.11.30,TCP,74,0.008124,œ,,57786  >  6000 [SYN] Seq=0 Win=64240 Len=0 MSS=1460 SACK_PERM TSval=2644816841 TSecr=0 WS=128
11,0.060209,192.168.11.30,192.168.11.21,TCP,74,0.000145,,,"6000  >  57786 [SYN, ACK] Seq=0 Ack=1 Win=65160 Len=0 MSS=1460 SACK_PERM TSval=1804928951 TSecr=2644816841 WS=128"
12,0.067443,192.168.11.21,192.168.11.30,TCP,66,0.007234,,,57786  >  6000 [ACK] Seq=1 Ack=1 Win=64256 Len=0 TSval=2644816850 TSecr=1804928951
13,0.068612,192.168.11.21,192.168.11.30,TCP,93,0.001169,,,"57786  >  6000 [PSH, ACK] Seq=1 Ack=1 Win=64256 Len=27 TSval=2644816851 TSecr=1804928951 [TCP segment of a reassembled PDU]"
14,0.068725,192.168.11.30,192.168.11.21,TCP,66,0.000113,,,6000  >  57786 [ACK] Seq=1 Ack=28 Win=65152 Len=0 TSval=1804928960 TSecr=2644816851
15,0.068793,192.168.11.21,192.168.11.30,TCP,66,0.000068,,,"57786  >  6000 [FIN, ACK] Seq=28 Ack=1 Win=64256 Len=0 TSval=2644816851 TSecr=1804928951"
16,0.070278,192.168.11.30,192.168.11.21,TCP,66,0.001485,,,"6000  >  57786 [FIN, ACK] Seq=1 Ack=29 Win=65152 Len=0 TSval=1804928962 TSecr=2644816851"
17,0.076187,192.168.11.21,192.168.11.30,TCP,66,0.005909,,,57786  >  6000 [ACK] Seq=29 Ack=2 Win=64256 Len=0 TSval=2644816859 TSecr=1804928962
18,7.343494,192.168.11.30,192.168.11.10,TCP,74,7.267307,,,43750  >  6000 [SYN] Seq=0 Win=64240 Len=0 MSS=1460 SACK_PERM TSval=3849851221 TSecr=0 WS=128
19,7.350988,192.168.11.10,192.168.11.30,TCP,74,0.007494,,,"6000  >  43750 [SYN, ACK] Seq=0 Ack=1 Win=65160 Len=0 MSS=1460 SACK_PERM TSval=2557194406 TSecr=3849851221 WS=128"
20,7.35108,192.168.11.30,192.168.11.10,TCP,66,0.000092,,,43750  >  6000 [ACK] Seq=1 Ack=1 Win=64256 Len=0 TSval=3849851228 TSecr=2557194406
21,7.351254,192.168.11.30,192.168.11.10,TCP,93,0.000174,,,"43750  >  6000 [PSH, ACK] Seq=1 Ack=1 Win=64256 Len=27 TSval=3849851229 TSecr=2557194406 [TCP segment of a reassembled PDU]"
22,7.351387,192.168.11.30,192.168.11.10,TCP,66,0.000133,,,"43750  >  6000 [FIN, ACK] Seq=28 Ack=1 Win=64256 Len=0 TSval=3849851229 TSecr=2557194406"
23,7.358299,192.168.11.10,192.168.11.30,TCP,66,0.006912,,,6000  >  43750 [ACK] Seq=1 Ack=28 Win=65152 Len=0 TSval=2557194414 TSecr=3849851229
24,7.358674,192.168.11.10,192.168.11.30,TCP,66,0.000375,,,"6000  >  43750 [FIN, ACK] Seq=1 Ack=29 Win=65152 Len=0 TSval=2557194415 TSecr=3849851229"
25,7.358723,192.168.11.30,192.168.11.10,TCP,66,0.000049,,,43750  >  6000 [ACK] Seq=29 Ack=2 Win=64256 Len=0 TSval=3849851236 TSecr=2557194415
26,7.388898,192.168.11.30,255.255.255.255,UDP,209,0.030175,Ÿ,7b2273656d616e74696373223a207b22656e74697479223a2022504944222c202262617365656e74697479223a2022616e79222c2022726f6c65223a2022686868222c20227370617469616c223a2022616e79222c202274656d706f72616c223a2022616e79227d2c20226461746170726f7065727479223a207b22666f726d6174223a2022696e616f6b615f70726f6772616d5f73616d706c655f73656d616e746963227d7d,45720  >  7000 Len=167
27,7.394492,192.168.11.21,192.168.11.30,TCP,74,0.005594,œ,,50502  >  6000 [SYN] Seq=0 Win=64240 Len=0 MSS=1460 SACK_PERM TSval=2644824178 TSecr=0 WS=128
28,7.394621,192.168.11.30,192.168.11.21,TCP,74,0.000129,,,"6000  >  50502 [SYN, ACK] Seq=0 Ack=1 Win=65160 Len=0 MSS=1460 SACK_PERM TSval=1804936286 TSecr=2644824178 WS=128"
29,7.401368,192.168.11.21,192.168.11.30,TCP,66,0.006747,,,50502  >  6000 [ACK] Seq=1 Ack=1 Win=64256 Len=0 TSval=2644824184 TSecr=1804936286
30,7.402608,192.168.11.21,192.168.11.30,TCP,93,0.00124,,,"50502  >  6000 [PSH, ACK] Seq=1 Ack=1 Win=64256 Len=27 TSval=2644824185 TSecr=1804936286 [TCP segment of a reassembled PDU]"
31,7.402724,192.168.11.30,192.168.11.21,TCP,66,0.000116,,,6000  >  50502 [ACK] Seq=1 Ack=28 Win=65152 Len=0 TSval=1804936294 TSecr=2644824185
32,7.4028,192.168.11.21,192.168.11.30,TCP,66,0.000076,,,"50502  >  6000 [FIN, ACK] Seq=28 Ack=1 Win=64256 Len=0 TSval=2644824185 TSecr=1804936286"
33,7.404273,192.168.11.30,192.168.11.21,TCP,66,0.001473,,,"6000  >  50502 [FIN, ACK] Seq=1 Ack=29 Win=65152 Len=0 TSval=1804936296 TSecr=2644824185"
34,7.409434,192.168.11.21,192.168.11.30,TCP,66,0.005161,,,50502  >  6000 [ACK] Seq=29 Ack=2 Win=64256 Len=0 TSval=2644824193 TSecr=1804936296
35,14.706531,192.168.11.30,192.168.11.10,TCP,74,7.297097,,,44858  >  6000 [SYN] Seq=0 Win=64240 Len=0 MSS=1460 SACK_PERM TSval=3849858584 TSecr=0 WS=128
36,14.713173,192.168.11.10,192.168.11.30,TCP,74,0.006642,,,"6000  >  44858 [SYN, ACK] Seq=0 Ack=1 Win=65160 Len=0 MSS=1460 SACK_PERM TSval=2557201769 TSecr=3849858584 WS=128"
37,14.713293,192.168.11.30,192.168.11.10,TCP,66,0.00012,,,44858  >  6000 [ACK] Seq=1 Ack=1 Win=64256 Len=0 TSval=3849858591 TSecr=2557201769
38,14.713464,192.168.11.30,192.168.11.10,TCP,93,0.000171,,,"44858  >  6000 [PSH, ACK] Seq=1 Ack=1 Win=64256 Len=27 TSval=3849858591 TSecr=2557201769 [TCP segment of a reassembled PDU]"
39,14.713587,192.168.11.30,192.168.11.10,TCP,66,0.000123,,,"44858  >  6000 [FIN, ACK] Seq=28 Ack=1 Win=64256 Len=0 TSval=3849858591 TSecr=2557201769"
40,14.720955,192.168.11.10,192.168.11.30,TCP,66,0.007368,,,6000  >  44858 [ACK] Seq=1 Ack=28 Win=65152 Len=0 TSval=2557201776 TSecr=3849858591
41,14.721337,192.168.11.10,192.168.11.30,TCP,66,0.000382,,,"6000  >  44858 [FIN, ACK] Seq=1 Ack=29 Win=65152 Len=0 TSval=2557201777 TSecr=3849858591"
42,14.721384,192.168.11.30,192.168.11.10,TCP,66,0.000047,,,44858  >  6000 [ACK] Seq=29 Ack=2 Win=64256 Len=0 TSval=3849858599 TSecr=2557201777
43,14.749975,192.168.11.30,255.255.255.255,UDP,209,0.028591,Ÿ,7b2273656d616e74696373223a207b22656e74697479223a2022504944222c202262617365656e74697479223a2022616e79222c2022726f6c65223a2022686868222c20227370617469616c223a2022616e79222c202274656d706f72616c223a2022616e79227d2c20226461746170726f7065727479223a207b22666f726d6174223a2022696e616f6b615f70726f6772616d5f73616d706c655f73656d616e746963227d7d,59945  >  7000 Len=167
44,14.756878,192.168.11.21,192.168.11.30,TCP,74,0.006903,œ,,50510  >  6000 [SYN] Seq=0 Win=64240 Len=0 MSS=1460 SACK_PERM TSval=2644831539 TSecr=0 WS=128
45,14.757007,192.168.11.30,192.168.11.21,TCP,74,0.000129,,,"6000  >  50510 [SYN, ACK] Seq=0 Ack=1 Win=65160 Len=0 MSS=1460 SACK_PERM TSval=1804943648 TSecr=2644831539 WS=128"
46,14.763697,192.168.11.21,192.168.11.30,TCP,66,0.00669,,,50510  >  6000 [ACK] Seq=1 Ack=1 Win=64256 Len=0 TSval=2644831547 TSecr=1804943648
47,14.764248,192.168.11.21,192.168.11.30,TCP,93,0.000551,,,"50510  >  6000 [PSH, ACK] Seq=1 Ack=1 Win=64256 Len=27 TSval=2644831547 TSecr=1804943648 [TCP segment of a reassembled PDU]"
48,14.764325,192.168.11.30,192.168.11.21,TCP,66,0.000077,,,6000  >  50510 [ACK] Seq=1 Ack=28 Win=65152 Len=0 TSval=1804943656 TSecr=2644831547
49,14.764385,192.168.11.21,192.168.11.30,TCP,66,0.00006,,,"50510  >  6000 [FIN, ACK] Seq=28 Ack=1 Win=64256 Len=0 TSval=2644831547 TSecr=1804943648"
50,14.766204,192.168.11.30,192.168.11.21,TCP,66,0.001819,,,"6000  >  50510 [FIN, ACK] Seq=1 Ack=29 Win=65152 Len=0 TSval=1804943657 TSecr=2644831547"
51,14.770875,192.168.11.21,192.168.11.30,TCP,66,0.004671,,,50510  >  6000 [ACK] Seq=29 Ack=2 Win=64256 Len=0 TSval=2644831554 TSecr=1804943657
52,21.895394,192.168.11.30,192.168.11.10,TCP,74,7.124519,,,44870  >  6000 [SYN] Seq=0 Win=64240 Len=0 MSS=1460 SACK_PERM TSval=3849865773 TSecr=0 WS=128
53,21.903629,192.168.11.10,192.168.11.30,TCP,74,0.008235,,,"6000  >  44870 [SYN, ACK] Seq=0 Ack=1 Win=65160 Len=0 MSS=1460 SACK_PERM TSval=2557208958 TSecr=3849865773 WS=128"
54,21.903723,192.168.11.30,192.168.11.10,TCP,66,0.000094,,,44870  >  6000 [ACK] Seq=1 Ack=1 Win=64256 Len=0 TSval=3849865781 TSecr=2557208958
55,21.903891,192.168.11.30,192.168.11.10,TCP,93,0.000168,,,"44870  >  6000 [PSH, ACK] Seq=1 Ack=1 Win=64256 Len=27 TSval=3849865781 TSecr=2557208958 [TCP segment of a reassembled PDU]"
56,21.90398,192.168.11.30,192.168.11.10,TCP,66,0.000089,,,"44870  >  6000 [FIN, ACK] Seq=28 Ack=1 Win=64256 Len=0 TSval=3849865781 TSecr=2557208958"
57,21.911129,192.168.11.10,192.168.11.30,TCP,66,0.007149,,,6000  >  44870 [ACK] Seq=1 Ack=28 Win=65152 Len=0 TSval=2557208966 TSecr=3849865781
58,21.911505,192.168.11.10,192.168.11.30,TCP,66,0.000376,,,"6000  >  44870 [FIN, ACK] Seq=1 Ack=29 Win=65152 Len=0 TSval=2557208967 TSecr=3849865781"
59,21.911559,192.168.11.30,192.168.11.10,TCP,66,0.000054,,,44870  >  6000 [ACK] Seq=29 Ack=2 Win=64256 Len=0 TSval=3849865789 TSecr=2557208967
60,21.939513,192.168.11.30,255.255.255.255,UDP,209,0.027954,Ÿ,7b2273656d616e74696373223a207b22656e74697479223a2022504944222c202262617365656e74697479223a2022616e79222c2022726f6c65223a2022686868222c20227370617469616c223a2022616e79222c202274656d706f72616c223a2022616e79227d2c20226461746170726f7065727479223a207b22666f726d6174223a2022696e616f6b615f70726f6772616d5f73616d706c655f73656d616e746963227d7d,46601  >  7000 Len=167
61,21.945674,192.168.11.21,192.168.11.30,TCP,74,0.006161,œ,,45652  >  6000 [SYN] Seq=0 Win=64240 Len=0 MSS=1460 SACK_PERM TSval=2644838728 TSecr=0 WS=128
62,21.945792,192.168.11.30,192.168.11.21,TCP,74,0.000118,,,"6000  >  45652 [SYN, ACK] Seq=0 Ack=1 Win=65160 Len=0 MSS=1460 SACK_PERM TSval=1804950837 TSecr=2644838728 WS=128"
63,21.952309,192.168.11.21,192.168.11.30,TCP,66,0.006517,,,45652  >  6000 [ACK] Seq=1 Ack=1 Win=64256 Len=0 TSval=2644838736 TSecr=1804950837
64,21.952848,192.168.11.21,192.168.11.30,TCP,93,0.000539,,,"45652  >  6000 [PSH, ACK] Seq=1 Ack=1 Win=64256 Len=27 TSval=2644838736 TSecr=1804950837 [TCP segment of a reassembled PDU]"
65,21.95293,192.168.11.30,192.168.11.21,TCP,66,0.000082,,,6000  >  45652 [ACK] Seq=1 Ack=28 Win=65152 Len=0 TSval=1804950844 TSecr=2644838736
66,21.953005,192.168.11.21,192.168.11.30,TCP,66,0.000075,,,"45652  >  6000 [FIN, ACK] Seq=28 Ack=1 Win=64256 Len=0 TSval=2644838736 TSecr=1804950837"
67,21.958349,192.168.11.30,192.168.11.21,TCP,66,0.005344,,,"6000  >  45652 [FIN, ACK] Seq=1 Ack=29 Win=65152 Len=0 TSval=1804950850 TSecr=2644838736"
68,21.965348,192.168.11.21,192.168.11.30,TCP,66,0.006999,,,45652  >  6000 [ACK] Seq=29 Ack=2 Win=64256 Len=0 TSval=2644838748 TSecr=1804950850
69,29.13488,192.168.11.30,192.168.11.10,TCP,74,7.169532,,,49686  >  6000 [SYN] Seq=0 Win=64240 Len=0 MSS=1460 SACK_PERM TSval=3849873012 TSecr=0 WS=128
70,29.141486,192.168.11.10,192.168.11.30,TCP,74,0.006606,,,"6000  >  49686 [SYN, ACK] Seq=0 Ack=1 Win=65160 Len=0 MSS=1460 SACK_PERM TSval=2557216196 TSecr=3849873012 WS=128"
71,29.141586,192.168.11.30,192.168.11.10,TCP,66,0.0001,,,49686  >  6000 [ACK] Seq=1 Ack=1 Win=64256 Len=0 TSval=3849873019 TSecr=2557216196
72,29.141713,192.168.11.30,192.168.11.10,TCP,93,0.000127,,,"49686  >  6000 [PSH, ACK] Seq=1 Ack=1 Win=64256 Len=27 TSval=3849873019 TSecr=2557216196 [TCP segment of a reassembled PDU]"
73,29.14184,192.168.11.30,192.168.11.10,TCP,66,0.000127,,,"49686  >  6000 [FIN, ACK] Seq=28 Ack=1 Win=64256 Len=0 TSval=3849873019 TSecr=2557216196"
74,29.148951,192.168.11.10,192.168.11.30,TCP,66,0.007111,,,6000  >  49686 [ACK] Seq=1 Ack=28 Win=65152 Len=0 TSval=2557216204 TSecr=3849873019
75,29.149379,192.168.11.10,192.168.11.30,TCP,66,0.000428,,,"6000  >  49686 [FIN, ACK] Seq=1 Ack=29 Win=65152 Len=0 TSval=2557216205 TSecr=3849873019"
76,29.149425,192.168.11.30,192.168.11.10,TCP,66,0.000046,,,49686  >  6000 [ACK] Seq=29 Ack=2 Win=64256 Len=0 TSval=3849873027 TSecr=2557216205
77,29.177757,192.168.11.30,255.255.255.255,UDP,209,0.028332,Ÿ,7b2273656d616e74696373223a207b22656e74697479223a2022504944222c202262617365656e74697479223a2022616e79222c2022726f6c65223a2022686868222c20227370617469616c223a2022616e79222c202274656d706f72616c223a2022616e79227d2c20226461746170726f7065727479223a207b22666f726d6174223a2022696e616f6b615f70726f6772616d5f73616d706c655f73656d616e746963227d7d,48511  >  7000 Len=167
78,29.183379,192.168.11.21,192.168.11.30,TCP,74,0.005622,œ,,45318  >  6000 [SYN] Seq=0 Win=64240 Len=0 MSS=1460 SACK_PERM TSval=2644845967 TSecr=0 WS=128
79,29.183488,192.168.11.30,192.168.11.21,TCP,74,0.000109,,,"6000  >  45318 [SYN, ACK] Seq=0 Ack=1 Win=65160 Len=0 MSS=1460 SACK_PERM TSval=1804958075 TSecr=2644845967 WS=128"
80,29.190114,192.168.11.21,192.168.11.30,TCP,66,0.006626,,,45318  >  6000 [ACK] Seq=1 Ack=1 Win=64256 Len=0 TSval=2644845973 TSecr=1804958075
81,29.190607,192.168.11.21,192.168.11.30,TCP,93,0.000493,,,"45318  >  6000 [PSH, ACK] Seq=1 Ack=1 Win=64256 Len=27 TSval=2644845974 TSecr=1804958075 [TCP segment of a reassembled PDU]"
82,29.190691,192.168.11.30,192.168.11.21,TCP,66,0.000084,,,6000  >  45318 [ACK] Seq=1 Ack=28 Win=65152 Len=0 TSval=1804958082 TSecr=2644845974
83,29.190759,192.168.11.21,192.168.11.30,TCP,66,0.000068,,,"45318  >  6000 [FIN, ACK] Seq=28 Ack=1 Win=64256 Len=0 TSval=2644845974 TSecr=1804958075"
84,29.19196,192.168.11.30,192.168.11.21,TCP,66,0.001201,,,"6000  >  45318 [FIN, ACK] Seq=1 Ack=29 Win=65152 Len=0 TSval=1804958083 TSecr=2644845974"
85,29.197806,192.168.11.21,192.168.11.30,TCP,66,0.005846,,,45318  >  6000 [ACK] Seq=29 Ack=2 Win=64256 Len=0 TSval=2644845981 TSecr=1804958083
86,36.293065,192.168.11.30,192.168.11.10,TCP,74,7.095259,,,46040  >  6000 [SYN] Seq=0 Win=64240 Len=0 MSS=1460 SACK_PERM TSval=3849880170 TSecr=0 WS=128
87,36.299767,192.168.11.10,192.168.11.30,TCP,74,0.006702,,,"6000  >  46040 [SYN, ACK] Seq=0 Ack=1 Win=65160 Len=0 MSS=1460 SACK_PERM TSval=2557223355 TSecr=3849880170 WS=128"
88,36.299911,192.168.11.30,192.168.11.10,TCP,66,0.000144,,,46040  >  6000 [ACK] Seq=1 Ack=1 Win=64256 Len=0 TSval=3849880177 TSecr=2557223355
89,36.300207,192.168.11.30,192.168.11.10,TCP,93,0.000296,,,"46040  >  6000 [PSH, ACK] Seq=1 Ack=1 Win=64256 Len=27 TSval=3849880177 TSecr=2557223355 [TCP segment of a reassembled PDU]"
90,36.300392,192.168.11.30,192.168.11.10,TCP,66,0.000185,,,"46040  >  6000 [FIN, ACK] Seq=28 Ack=1 Win=64256 Len=0 TSval=3849880178 TSecr=2557223355"
91,36.307318,192.168.11.10,192.168.11.30,TCP,66,0.006926,,,6000  >  46040 [ACK] Seq=1 Ack=28 Win=65152 Len=0 TSval=2557223362 TSecr=3849880177
92,36.307568,192.168.11.10,192.168.11.30,TCP,66,0.00025,,,"6000  >  46040 [FIN, ACK] Seq=1 Ack=29 Win=65152 Len=0 TSval=2557223364 TSecr=3849880178"
93,36.307637,192.168.11.30,192.168.11.10,TCP,66,0.000069,,,46040  >  6000 [ACK] Seq=29 Ack=2 Win=64256 Len=0 TSval=3849880185 TSecr=2557223364
94,36.337025,192.168.11.30,255.255.255.255,UDP,209,0.029388,Ÿ,7b2273656d616e74696373223a207b22656e74697479223a2022504944222c202262617365656e74697479223a2022616e79222c2022726f6c65223a2022686868222c20227370617469616c223a2022616e79222c202274656d706f72616c223a2022616e79227d2c20226461746170726f7065727479223a207b22666f726d6174223a2022696e616f6b615f70726f6772616d5f73616d706c655f73656d616e746963227d7d,40786  >  7000 Len=167
95,36.343488,192.168.11.21,192.168.11.30,TCP,74,0.006463,œ,,50446  >  6000 [SYN] Seq=0 Win=64240 Len=0 MSS=1460 SACK_PERM TSval=2644853126 TSecr=0 WS=128
96,36.343597,192.168.11.30,192.168.11.21,TCP,74,0.000109,,,"6000  >  50446 [SYN, ACK] Seq=0 Ack=1 Win=65160 Len=0 MSS=1460 SACK_PERM TSval=1804965235 TSecr=2644853126 WS=128"
97,36.350493,192.168.11.21,192.168.11.30,TCP,66,0.006896,,,50446  >  6000 [ACK] Seq=1 Ack=1 Win=64256 Len=0 TSval=2644853134 TSecr=1804965235
98,36.350975,192.168.11.21,192.168.11.30,TCP,93,0.000482,,,"50446  >  6000 [PSH, ACK] Seq=1 Ack=1 Win=64256 Len=27 TSval=2644853134 TSecr=1804965235 [TCP segment of a reassembled PDU]"
99,36.351072,192.168.11.30,192.168.11.21,TCP,66,0.000097,,,6000  >  50446 [ACK] Seq=1 Ack=28 Win=65152 Len=0 TSval=1804965242 TSecr=2644853134
100,36.351136,192.168.11.21,192.168.11.30,TCP,66,0.000064,,,"50446  >  6000 [FIN, ACK] Seq=28 Ack=1 Win=64256 Len=0 TSval=2644853134 TSecr=1804965235"
101,36.352793,192.168.11.30,192.168.11.21,TCP,66,0.001657,,,"6000  >  50446 [FIN, ACK] Seq=1 Ack=29 Win=65152 Len=0 TSval=1804965244 TSecr=2644853134"
102,36.357353,192.168.11.21,192.168.11.30,TCP,66,0.00456,,,50446  >  6000 [ACK] Seq=29 Ack=2 Win=64256 Len=0 TSval=2644853141 TSecr=1804965244
103,43.504364,192.168.11.30,192.168.11.10,TCP,74,7.147011,,,54944  >  6000 [SYN] Seq=0 Win=64240 Len=0 MSS=1460 SACK_PERM TSval=3849887382 TSecr=0 WS=128
104,43.511928,192.168.11.10,192.168.11.30,TCP,74,0.007564,,,"6000  >  54944 [SYN, ACK] Seq=0 Ack=1 Win=65160 Len=0 MSS=1460 SACK_PERM TSval=2557230566 TSecr=3849887382 WS=128"
105,43.512024,192.168.11.30,192.168.11.10,TCP,66,0.000096,,,54944  >  6000 [ACK] Seq=1 Ack=1 Win=64256 Len=0 TSval=3849887389 TSecr=2557230566
106,43.512191,192.168.11.30,192.168.11.10,TCP,93,0.000167,,,"54944  >  6000 [PSH, ACK] Seq=1 Ack=1 Win=64256 Len=27 TSval=3849887389 TSecr=2557230566 [TCP segment of a reassembled PDU]"
107,43.512311,192.168.11.30,192.168.11.10,TCP,66,0.00012,,,"54944  >  6000 [FIN, ACK] Seq=28 Ack=1 Win=64256 Len=0 TSval=3849887390 TSecr=2557230566"
108,43.529243,192.168.11.10,192.168.11.30,TCP,66,0.016932,,,6000  >  54944 [ACK] Seq=1 Ack=28 Win=65152 Len=0 TSval=2557230584 TSecr=3849887389
109,43.529639,192.168.11.10,192.168.11.30,TCP,66,0.000396,,,"6000  >  54944 [FIN, ACK] Seq=1 Ack=29 Win=65152 Len=0 TSval=2557230585 TSecr=3849887390"
110,43.529695,192.168.11.30,192.168.11.10,TCP,66,0.000056,,,54944  >  6000 [ACK] Seq=29 Ack=2 Win=64256 Len=0 TSval=3849887407 TSecr=2557230585
111,43.559131,192.168.11.30,255.255.255.255,UDP,209,0.029436,Ÿ,7b2273656d616e74696373223a207b22656e74697479223a2022504944222c202262617365656e74697479223a2022616e79222c2022726f6c65223a2022686868222c20227370617469616c223a2022616e79222c202274656d706f72616c223a2022616e79227d2c20226461746170726f7065727479223a207b22666f726d6174223a2022696e616f6b615f70726f6772616d5f73616d706c655f73656d616e746963227d7d,48431  >  7000 Len=167
112,43.565793,192.168.11.21,192.168.11.30,TCP,74,0.006662,œ,,50456  >  6000 [SYN] Seq=0 Win=64240 Len=0 MSS=1460 SACK_PERM TSval=2644860348 TSecr=0 WS=128
113,43.565917,192.168.11.30,192.168.11.21,TCP,74,0.000124,,,"6000  >  50456 [SYN, ACK] Seq=0 Ack=1 Win=65160 Len=0 MSS=1460 SACK_PERM TSval=1804972457 TSecr=2644860348 WS=128"
114,43.581255,192.168.11.21,192.168.11.30,TCP,66,0.015338,,,50456  >  6000 [ACK] Seq=1 Ack=1 Win=64256 Len=0 TSval=2644860356 TSecr=1804972457
115,43.581779,192.168.11.21,192.168.11.30,TCP,93,0.000524,,,"50456  >  6000 [PSH, ACK] Seq=1 Ack=1 Win=64256 Len=27 TSval=2644860356 TSecr=1804972457 [TCP segment of a reassembled PDU]"
116,43.581843,192.168.11.30,192.168.11.21,TCP,66,0.000064,,,6000  >  50456 [ACK] Seq=1 Ack=28 Win=65152 Len=0 TSval=1804972473 TSecr=2644860356
117,43.581909,192.168.11.21,192.168.11.30,TCP,66,0.000066,,,"50456  >  6000 [FIN, ACK] Seq=28 Ack=1 Win=64256 Len=0 TSval=2644860356 TSecr=1804972457"
118,43.582762,192.168.11.30,192.168.11.21,TCP,66,0.000853,,,"6000  >  50456 [FIN, ACK] Seq=1 Ack=29 Win=65152 Len=0 TSval=1804972474 TSecr=2644860356"
119,43.588886,192.168.11.21,192.168.11.30,TCP,66,0.006124,,,50456  >  6000 [ACK] Seq=29 Ack=2 Win=64256 Len=0 TSval=2644860372 TSecr=1804972474
120,50.703168,192.168.11.30,192.168.11.10,TCP,74,7.114282,,,54956  >  6000 [SYN] Seq=0 Win=64240 Len=0 MSS=1460 SACK_PERM TSval=3849894580 TSecr=0 WS=128
121,50.709768,192.168.11.10,192.168.11.30,TCP,74,0.0066,,,"6000  >  54956 [SYN, ACK] Seq=0 Ack=1 Win=65160 Len=0 MSS=1460 SACK_PERM TSval=2557237764 TSecr=3849894580 WS=128"
122,50.709867,192.168.11.30,192.168.11.10,TCP,66,0.000099,,,54956  >  6000 [ACK] Seq=1 Ack=1 Win=64256 Len=0 TSval=3849894587 TSecr=2557237764
123,50.710031,192.168.11.30,192.168.11.10,TCP,93,0.000164,,,"54956  >  6000 [PSH, ACK] Seq=1 Ack=1 Win=64256 Len=27 TSval=3849894587 TSecr=2557237764 [TCP segment of a reassembled PDU]"
124,50.710152,192.168.11.30,192.168.11.10,TCP,66,0.000121,,,"54956  >  6000 [FIN, ACK] Seq=28 Ack=1 Win=64256 Len=0 TSval=3849894587 TSecr=2557237764"
125,50.717174,192.168.11.10,192.168.11.30,TCP,66,0.007022,,,6000  >  54956 [ACK] Seq=1 Ack=28 Win=65152 Len=0 TSval=2557237772 TSecr=3849894587
126,50.721769,192.168.11.10,192.168.11.30,TCP,66,0.004595,,,"6000  >  54956 [FIN, ACK] Seq=1 Ack=29 Win=65152 Len=0 TSval=2557237776 TSecr=3849894587"
127,50.721815,192.168.11.30,192.168.11.10,TCP,66,0.000046,,,54956  >  6000 [ACK] Seq=29 Ack=2 Win=64256 Len=0 TSval=3849894599 TSecr=2557237776
128,50.749635,192.168.11.30,255.255.255.255,UDP,209,0.02782,Ÿ,7b2273656d616e74696373223a207b22656e74697479223a2022504944222c202262617365656e74697479223a2022616e79222c2022726f6c65223a2022686868222c20227370617469616c223a2022616e79222c202274656d706f72616c223a2022616e79227d2c20226461746170726f7065727479223a207b22666f726d6174223a2022696e616f6b615f70726f6772616d5f73616d706c655f73656d616e746963227d7d,41871  >  7000 Len=167
129,50.755419,192.168.11.21,192.168.11.30,TCP,74,0.005784,œ,,40942  >  6000 [SYN] Seq=0 Win=64240 Len=0 MSS=1460 SACK_PERM TSval=2644867539 TSecr=0 WS=128
130,50.755521,192.168.11.30,192.168.11.21,TCP,74,0.000102,,,"6000  >  40942 [SYN, ACK] Seq=0 Ack=1 Win=65160 Len=0 MSS=1460 SACK_PERM TSval=1804979647 TSecr=2644867539 WS=128"
131,50.762224,192.168.11.21,192.168.11.30,TCP,66,0.006703,,,40942  >  6000 [ACK] Seq=1 Ack=1 Win=64256 Len=0 TSval=2644867546 TSecr=1804979647
132,50.762783,192.168.11.21,192.168.11.30,TCP,93,0.000559,,,"40942  >  6000 [PSH, ACK] Seq=1 Ack=1 Win=64256 Len=27 TSval=2644867546 TSecr=1804979647 [TCP segment of a reassembled PDU]"
133,50.762886,192.168.11.30,192.168.11.21,TCP,66,0.000103,,,6000  >  40942 [ACK] Seq=1 Ack=28 Win=65152 Len=0 TSval=1804979654 TSecr=2644867546
134,50.762957,192.168.11.21,192.168.11.30,TCP,66,0.000071,,,"40942  >  6000 [FIN, ACK] Seq=28 Ack=1 Win=64256 Len=0 TSval=2644867546 TSecr=1804979647"
135,50.764565,192.168.11.30,192.168.11.21,TCP,66,0.001608,,,"6000  >  40942 [FIN, ACK] Seq=1 Ack=29 Win=65152 Len=0 TSval=1804979656 TSecr=2644867546"
136,50.772423,192.168.11.21,192.168.11.30,TCP,66,0.007858,,,40942  >  6000 [ACK] Seq=29 Ack=2 Win=64256 Len=0 TSval=2644867555 TSecr=1804979656
137,57.872439,192.168.11.30,192.168.11.10,TCP,74,7.100016,,,47566  >  6000 [SYN] Seq=0 Win=64240 Len=0 MSS=1460 SACK_PERM TSval=3849901750 TSecr=0 WS=128
138,57.878989,192.168.11.10,192.168.11.30,TCP,74,0.00655,,,"6000  >  47566 [SYN, ACK] Seq=0 Ack=1 Win=65160 Len=0 MSS=1460 SACK_PERM TSval=2557244934 TSecr=3849901750 WS=128"
139,57.879086,192.168.11.30,192.168.11.10,TCP,66,0.000097,,,47566  >  6000 [ACK] Seq=1 Ack=1 Win=64256 Len=0 TSval=3849901756 TSecr=2557244934
140,57.879276,192.168.11.30,192.168.11.10,TCP,93,0.00019,,,"47566  >  6000 [PSH, ACK] Seq=1 Ack=1 Win=64256 Len=27 TSval=3849901757 TSecr=2557244934 [TCP segment of a reassembled PDU]"
141,57.879375,192.168.11.30,192.168.11.10,TCP,66,0.000099,,,"47566  >  6000 [FIN, ACK] Seq=28 Ack=1 Win=64256 Len=0 TSval=3849901757 TSecr=2557244934"
142,57.886538,192.168.11.10,192.168.11.30,TCP,66,0.007163,,,6000  >  47566 [ACK] Seq=1 Ack=28 Win=65152 Len=0 TSval=2557244941 TSecr=3849901757
143,57.886745,192.168.11.10,192.168.11.30,TCP,66,0.000207,,,"6000  >  47566 [FIN, ACK] Seq=1 Ack=29 Win=65152 Len=0 TSval=2557244942 TSecr=3849901757"
144,57.886788,192.168.11.30,192.168.11.10,TCP,66,0.000043,,,47566  >  6000 [ACK] Seq=29 Ack=2 Win=64256 Len=0 TSval=3849901764 TSecr=2557244942
145,57.915425,192.168.11.30,255.255.255.255,UDP,209,0.028637,Ÿ,7b2273656d616e74696373223a207b22656e74697479223a2022504944222c202262617365656e74697479223a2022616e79222c2022726f6c65223a2022686868222c20227370617469616c223a2022616e79222c202274656d706f72616c223a2022616e79227d2c20226461746170726f7065727479223a207b22666f726d6174223a2022696e616f6b615f70726f6772616d5f73616d706c655f73656d616e746963227d7d,35926  >  7000 Len=167
146,57.921884,192.168.11.21,192.168.11.30,TCP,74,0.006459,œ,,53252  >  6000 [SYN] Seq=0 Win=64240 Len=0 MSS=1460 SACK_PERM TSval=2644874705 TSecr=0 WS=128
147,57.921988,192.168.11.30,192.168.11.21,TCP,74,0.000104,,,"6000  >  53252 [SYN, ACK] Seq=0 Ack=1 Win=65160 Len=0 MSS=1460 SACK_PERM TSval=1804986813 TSecr=2644874705 WS=128"
148,57.928703,192.168.11.21,192.168.11.30,TCP,66,0.006715,,,53252  >  6000 [ACK] Seq=1 Ack=1 Win=64256 Len=0 TSval=2644874712 TSecr=1804986813
149,57.929328,192.168.11.21,192.168.11.30,TCP,93,0.000625,,,"53252  >  6000 [PSH, ACK] Seq=1 Ack=1 Win=64256 Len=27 TSval=2644874712 TSecr=1804986813 [TCP segment of a reassembled PDU]"
150,57.929429,192.168.11.30,192.168.11.21,TCP,66,0.000101,,,6000  >  53252 [ACK] Seq=1 Ack=28 Win=65152 Len=0 TSval=1804986821 TSecr=2644874712
151,57.929506,192.168.11.21,192.168.11.30,TCP,66,0.000077,,,"53252  >  6000 [FIN, ACK] Seq=28 Ack=1 Win=64256 Len=0 TSval=2644874712 TSecr=1804986813"
152,57.930807,192.168.11.30,192.168.11.21,TCP,66,0.001301,,,"6000  >  53252 [FIN, ACK] Seq=1 Ack=29 Win=65152 Len=0 TSval=1804986822 TSecr=2644874712"
153,57.936659,192.168.11.21,192.168.11.30,TCP,66,0.005852,,,53252  >  6000 [ACK] Seq=29 Ack=2 Win=64256 Len=0 TSval=2644874720 TSecr=1804986822
154,65.005238,192.168.11.30,192.168.11.10,TCP,74,7.068579,,,35952  >  6000 [SYN] Seq=0 Win=64240 Len=0 MSS=1460 SACK_PERM TSval=3849908882 TSecr=0 WS=128
155,65.012458,192.168.11.10,192.168.11.30,TCP,74,0.00722,,,"6000  >  35952 [SYN, ACK] Seq=0 Ack=1 Win=65160 Len=0 MSS=1460 SACK_PERM TSval=2557252066 TSecr=3849908882 WS=128"
156,65.012567,192.168.11.30,192.168.11.10,TCP,66,0.000109,,,35952  >  6000 [ACK] Seq=1 Ack=1 Win=64256 Len=0 TSval=3849908890 TSecr=2557252066
157,65.012819,192.168.11.30,192.168.11.10,TCP,93,0.000252,,,"35952  >  6000 [PSH, ACK] Seq=1 Ack=1 Win=64256 Len=27 TSval=3849908890 TSecr=2557252066 [TCP segment of a reassembled PDU]"
158,65.012926,192.168.11.30,192.168.11.10,TCP,66,0.000107,,,"35952  >  6000 [FIN, ACK] Seq=28 Ack=1 Win=64256 Len=0 TSval=3849908890 TSecr=2557252066"
159,65.019984,192.168.11.10,192.168.11.30,TCP,66,0.007058,,,6000  >  35952 [ACK] Seq=1 Ack=28 Win=65152 Len=0 TSval=2557252074 TSecr=3849908890
160,65.02036,192.168.11.10,192.168.11.30,TCP,66,0.000376,,,"6000  >  35952 [FIN, ACK] Seq=1 Ack=29 Win=65152 Len=0 TSval=2557252075 TSecr=3849908890"
161,65.020414,192.168.11.30,192.168.11.10,TCP,66,0.000054,,,35952  >  6000 [ACK] Seq=29 Ack=2 Win=64256 Len=0 TSval=3849908898 TSecr=2557252075
162,65.048632,192.168.11.30,255.255.255.255,UDP,209,0.028218,Ÿ,7b2273656d616e74696373223a207b22656e74697479223a2022504944222c202262617365656e74697479223a2022616e79222c2022726f6c65223a2022686868222c20227370617469616c223a2022616e79222c202274656d706f72616c223a2022616e79227d2c20226461746170726f7065727479223a207b22666f726d6174223a2022696e616f6b615f70726f6772616d5f73616d706c655f73656d616e746963227d7d,49855  >  7000 Len=167
163,65.05413,192.168.11.21,192.168.11.30,TCP,74,0.005498,œ,,53254  >  6000 [SYN] Seq=0 Win=64240 Len=0 MSS=1460 SACK_PERM TSval=2644881838 TSecr=0 WS=128
164,65.054235,192.168.11.30,192.168.11.21,TCP,74,0.000105,,,"6000  >  53254 [SYN, ACK] Seq=0 Ack=1 Win=65160 Len=0 MSS=1460 SACK_PERM TSval=1804993946 TSecr=2644881838 WS=128"
165,65.060726,192.168.11.21,192.168.11.30,TCP,66,0.006491,,,53254  >  6000 [ACK] Seq=1 Ack=1 Win=64256 Len=0 TSval=2644881844 TSecr=1804993946
166,65.061304,192.168.11.21,192.168.11.30,TCP,93,0.000578,,,"53254  >  6000 [PSH, ACK] Seq=1 Ack=1 Win=64256 Len=27 TSval=2644881845 TSecr=1804993946 [TCP segment of a reassembled PDU]"
167,65.061379,192.168.11.30,192.168.11.21,TCP,66,0.000075,,,6000  >  53254 [ACK] Seq=1 Ack=28 Win=65152 Len=0 TSval=1804993953 TSecr=2644881845
168,65.061446,192.168.11.21,192.168.11.30,TCP,66,0.000067,,,"53254  >  6000 [FIN, ACK] Seq=28 Ack=1 Win=64256 Len=0 TSval=2644881845 TSecr=1804993946"
169,65.062431,192.168.11.30,192.168.11.21,TCP,66,0.000985,,,"6000  >  53254 [FIN, ACK] Seq=1 Ack=29 Win=65152 Len=0 TSval=1804993954 TSecr=2644881845"
170,65.06839,192.168.11.21,192.168.11.30,TCP,66,0.005959,,,53254  >  6000 [ACK] Seq=29 Ack=2 Win=64256 Len=0 TSval=2644881852 TSecr=1804993954
171,110.680635,192.168.11.30,192.168.11.10,TCP,74,45.612245,,,48384  >  6000 [SYN] Seq=0 Win=64240 Len=0 MSS=1460 SACK_PERM TSval=3849954558 TSecr=0 WS=128
172,110.693059,192.168.11.10,192.168.11.30,TCP,74,0.012424,,,"6000  >  48384 [SYN, ACK] Seq=0 Ack=1 Win=65160 Len=0 MSS=1460 SACK_PERM TSval=2557297746 TSecr=3849954558 WS=128"
173,110.693157,192.168.11.30,192.168.11.10,TCP,66,0.000098,,,48384  >  6000 [ACK] Seq=1 Ack=1 Win=64256 Len=0 TSval=3849954570 TSecr=2557297746
174,110.693371,192.168.11.30,192.168.11.10,TCP,93,0.000214,,,"48384  >  6000 [PSH, ACK] Seq=1 Ack=1 Win=64256 Len=27 TSval=3849954571 TSecr=2557297746 [TCP segment of a reassembled PDU]"
175,110.693492,192.168.11.30,192.168.11.10,TCP,66,0.000121,,,"48384  >  6000 [FIN, ACK] Seq=28 Ack=1 Win=64256 Len=0 TSval=3849954571 TSecr=2557297746"
176,110.701132,192.168.11.10,192.168.11.30,TCP,66,0.00764,,,6000  >  48384 [ACK] Seq=1 Ack=28 Win=65152 Len=0 TSval=2557297754 TSecr=3849954571
177,110.703128,192.168.11.10,192.168.11.30,TCP,66,0.001996,,,"6000  >  48384 [FIN, ACK] Seq=1 Ack=29 Win=65152 Len=0 TSval=2557297757 TSecr=3849954571"
178,110.70318,192.168.11.30,192.168.11.10,TCP,66,0.000052,,,48384  >  6000 [ACK] Seq=29 Ack=2 Win=64256 Len=0 TSval=3849954580 TSecr=2557297757
179,110.730507,192.168.11.30,255.255.255.255,UDP,209,0.027327,Ÿ,7b2273656d616e74696373223a207b22656e74697479223a2022504944222c202262617365656e74697479223a2022616e79222c2022726f6c65223a2022686868222c20227370617469616c223a2022616e79222c202274656d706f72616c223a2022616e79227d2c20226461746170726f7065727479223a207b22666f726d6174223a2022696e616f6b615f70726f6772616d5f73616d706c655f73656d616e746963227d7d,53770  >  7000 Len=167
180,110.73596,192.168.11.21,192.168.11.30,TCP,74,0.005453,œ,,39240  >  6000 [SYN] Seq=0 Win=64240 Len=0 MSS=1460 SACK_PERM TSval=2644927520 TSecr=0 WS=128
181,110.736079,192.168.11.30,192.168.11.21,TCP,74,0.000119,,,"6000  >  39240 [SYN, ACK] Seq=0 Ack=1 Win=65160 Len=0 MSS=1460 SACK_PERM TSval=1805039627 TSecr=2644927520 WS=128"
182,110.743805,192.168.11.21,192.168.11.30,TCP,66,0.007726,,,39240  >  6000 [ACK] Seq=1 Ack=1 Win=64256 Len=0 TSval=2644927528 TSecr=1805039627
183,110.744418,192.168.11.21,192.168.11.30,TCP,93,0.000613,,,"39240  >  6000 [PSH, ACK] Seq=1 Ack=1 Win=64256 Len=27 TSval=2644927528 TSecr=1805039627 [TCP segment of a reassembled PDU]"
184,110.744533,192.168.11.30,192.168.11.21,TCP,66,0.000115,,,6000  >  39240 [ACK] Seq=1 Ack=28 Win=65152 Len=0 TSval=1805039636 TSecr=2644927528
185,110.744616,192.168.11.21,192.168.11.30,TCP,66,0.000083,,,"39240  >  6000 [FIN, ACK] Seq=28 Ack=1 Win=64256 Len=0 TSval=2644927528 TSecr=1805039627"
186,110.746171,192.168.11.30,192.168.11.21,TCP,66,0.001555,,,"6000  >  39240 [FIN, ACK] Seq=1 Ack=29 Win=65152 Len=0 TSval=1805039637 TSecr=2644927528"
187,110.751401,192.168.11.21,192.168.11.30,TCP,66,0.00523,,,39240  >  6000 [ACK] Seq=29 Ack=2 Win=64256 Len=0 TSval=2644927536 TSecr=1805039637
188,117.822047,192.168.11.30,192.168.11.10,TCP,74,7.070646,,,33176  >  6000 [SYN] Seq=0 Win=64240 Len=0 MSS=1460 SACK_PERM TSval=3849961699 TSecr=0 WS=128
189,117.829676,192.168.11.10,192.168.11.30,TCP,74,0.007629,,,"6000  >  33176 [SYN, ACK] Seq=0 Ack=1 Win=65160 Len=0 MSS=1460 SACK_PERM TSval=2557304883 TSecr=3849961699 WS=128"
190,117.829786,192.168.11.30,192.168.11.10,TCP,66,0.00011,,,33176  >  6000 [ACK] Seq=1 Ack=1 Win=64256 Len=0 TSval=3849961707 TSecr=2557304883
191,117.829983,192.168.11.30,192.168.11.10,TCP,93,0.000197,,,"33176  >  6000 [PSH, ACK] Seq=1 Ack=1 Win=64256 Len=27 TSval=3849961707 TSecr=2557304883 [TCP segment of a reassembled PDU]"
192,117.830082,192.168.11.30,192.168.11.10,TCP,66,0.000099,,,"33176  >  6000 [FIN, ACK] Seq=28 Ack=1 Win=64256 Len=0 TSval=3849961707 TSecr=2557304883"
193,117.837231,192.168.11.10,192.168.11.30,TCP,66,0.007149,,,6000  >  33176 [ACK] Seq=1 Ack=28 Win=65152 Len=0 TSval=2557304890 TSecr=3849961707
194,117.837466,192.168.11.10,192.168.11.30,TCP,66,0.000235,,,"6000  >  33176 [FIN, ACK] Seq=1 Ack=29 Win=65152 Len=0 TSval=2557304892 TSecr=3849961707"
195,117.837509,192.168.11.30,192.168.11.10,TCP,66,0.000043,,,33176  >  6000 [ACK] Seq=29 Ack=2 Win=64256 Len=0 TSval=3849961715 TSecr=2557304892
196,117.865878,192.168.11.30,255.255.255.255,UDP,209,0.028369,Ÿ,7b2273656d616e74696373223a207b22656e74697479223a2022504944222c202262617365656e74697479223a2022616e79222c2022726f6c65223a2022686868222c20227370617469616c223a2022616e79222c202274656d706f72616c223a2022616e79227d2c20226461746170726f7065727479223a207b22666f726d6174223a2022696e616f6b615f70726f6772616d5f73616d706c655f73656d616e746963227d7d,51391  >  7000 Len=167
197,117.87144,192.168.11.21,192.168.11.30,TCP,74,0.005562,œ,,35310  >  6000 [SYN] Seq=0 Win=64240 Len=0 MSS=1460 SACK_PERM TSval=2644934656 TSecr=0 WS=128
198,117.871553,192.168.11.30,192.168.11.21,TCP,74,0.000113,,,"6000  >  35310 [SYN, ACK] Seq=0 Ack=1 Win=65160 Len=0 MSS=1460 SACK_PERM TSval=1805046763 TSecr=2644934656 WS=128"
199,117.878113,192.168.11.21,192.168.11.30,TCP,66,0.00656,,,35310  >  6000 [ACK] Seq=1 Ack=1 Win=64256 Len=0 TSval=2644934662 TSecr=1805046763
200,117.878661,192.168.11.21,192.168.11.30,TCP,93,0.000548,,,"35310  >  6000 [PSH, ACK] Seq=1 Ack=1 Win=64256 Len=27 TSval=2644934662 TSecr=1805046763 [TCP segment of a reassembled PDU]"
201,117.878734,192.168.11.30,192.168.11.21,TCP,66,0.000073,,,6000  >  35310 [ACK] Seq=1 Ack=28 Win=65152 Len=0 TSval=1805046770 TSecr=2644934662
202,117.878804,192.168.11.21,192.168.11.30,TCP,66,0.00007,,,"35310  >  6000 [FIN, ACK] Seq=28 Ack=1 Win=64256 Len=0 TSval=2644934663 TSecr=1805046763"
203,117.880428,192.168.11.30,192.168.11.21,TCP,66,0.001624,,,"6000  >  35310 [FIN, ACK] Seq=1 Ack=29 Win=65152 Len=0 TSval=1805046772 TSecr=2644934663"
204,117.884997,192.168.11.21,192.168.11.30,TCP,66,0.004569,,,35310  >  6000 [ACK] Seq=29 Ack=2 Win=64256 Len=0 TSval=2644934670 TSecr=1805046772
205,125.053763,192.168.11.30,192.168.11.10,TCP,74,7.168766,,,45156  >  6000 [SYN] Seq=0 Win=64240 Len=0 MSS=1460 SACK_PERM TSval=3849968931 TSecr=0 WS=128
206,125.061587,192.168.11.10,192.168.11.30,TCP,74,0.007824,,,"6000  >  45156 [SYN, ACK] Seq=0 Ack=1 Win=65160 Len=0 MSS=1460 SACK_PERM TSval=2557312115 TSecr=3849968931 WS=128"
207,125.061713,192.168.11.30,192.168.11.10,TCP,66,0.000126,,,45156  >  6000 [ACK] Seq=1 Ack=1 Win=64256 Len=0 TSval=3849968939 TSecr=2557312115
208,125.061911,192.168.11.30,192.168.11.10,TCP,93,0.000198,,,"45156  >  6000 [PSH, ACK] Seq=1 Ack=1 Win=64256 Len=27 TSval=3849968939 TSecr=2557312115 [TCP segment of a reassembled PDU]"
209,125.061999,192.168.11.30,192.168.11.10,TCP,66,0.000088,,,"45156  >  6000 [FIN, ACK] Seq=28 Ack=1 Win=64256 Len=0 TSval=3849968939 TSecr=2557312115"
210,125.069636,192.168.11.10,192.168.11.30,TCP,66,0.007637,,,6000  >  45156 [ACK] Seq=1 Ack=28 Win=65152 Len=0 TSval=2557312122 TSecr=3849968939
211,125.069881,192.168.11.10,192.168.11.30,TCP,66,0.000245,,,"6000  >  45156 [FIN, ACK] Seq=1 Ack=29 Win=65152 Len=0 TSval=2557312124 TSecr=3849968939"
212,125.069943,192.168.11.30,192.168.11.10,TCP,66,0.000062,,,45156  >  6000 [ACK] Seq=29 Ack=2 Win=64256 Len=0 TSval=3849968947 TSecr=2557312124
213,125.100802,192.168.11.30,255.255.255.255,UDP,209,0.030859,Ÿ,7b2273656d616e74696373223a207b22656e74697479223a2022504944222c202262617365656e74697479223a2022616e79222c2022726f6c65223a2022686868222c20227370617469616c223a2022616e79222c202274656d706f72616c223a2022616e79227d2c20226461746170726f7065727479223a207b22666f726d6174223a2022696e616f6b615f70726f6772616d5f73616d706c655f73656d616e746963227d7d,48839  >  7000 Len=167
214,125.106424,192.168.11.21,192.168.11.30,TCP,74,0.005622,œ,,35312  >  6000 [SYN] Seq=0 Win=64240 Len=0 MSS=1460 SACK_PERM TSval=2644941891 TSecr=0 WS=128
215,125.106552,192.168.11.30,192.168.11.21,TCP,74,0.000128,,,"6000  >  35312 [SYN, ACK] Seq=0 Ack=1 Win=65160 Len=0 MSS=1460 SACK_PERM TSval=1805053998 TSecr=2644941891 WS=128"
216,125.11335,192.168.11.21,192.168.11.30,TCP,66,0.006798,,,35312  >  6000 [ACK] Seq=1 Ack=1 Win=64256 Len=0 TSval=2644941898 TSecr=1805053998
217,125.113988,192.168.11.21,192.168.11.30,TCP,93,0.000638,,,"35312  >  6000 [PSH, ACK] Seq=1 Ack=1 Win=64256 Len=27 TSval=2644941898 TSecr=1805053998 [TCP segment of a reassembled PDU]"
218,125.114125,192.168.11.30,192.168.11.21,TCP,66,0.000137,,,6000  >  35312 [ACK] Seq=1 Ack=28 Win=65152 Len=0 TSval=1805054005 TSecr=2644941898
219,125.114206,192.168.11.21,192.168.11.30,TCP,66,0.000081,,,"35312  >  6000 [FIN, ACK] Seq=28 Ack=1 Win=64256 Len=0 TSval=2644941898 TSecr=1805053998"
220,125.115498,192.168.11.30,192.168.11.21,TCP,66,0.001292,,,"6000  >  35312 [FIN, ACK] Seq=1 Ack=29 Win=65152 Len=0 TSval=1805054007 TSecr=2644941898"
221,125.121445,192.168.11.21,192.168.11.30,TCP,66,0.005947,,,35312  >  6000 [ACK] Seq=29 Ack=2 Win=64256 Len=0 TSval=2644941905 TSecr=1805054007
222,132.233717,192.168.11.30,192.168.11.10,TCP,74,7.112272,,,46806  >  6000 [SYN] Seq=0 Win=64240 Len=0 MSS=1460 SACK_PERM TSval=3849976111 TSecr=0 WS=128
223,132.240293,192.168.11.10,192.168.11.30,TCP,74,0.006576,,,"6000  >  46806 [SYN, ACK] Seq=0 Ack=1 Win=65160 Len=0 MSS=1460 SACK_PERM TSval=2557319293 TSecr=3849976111 WS=128"
224,132.240413,192.168.11.30,192.168.11.10,TCP,66,0.00012,,,46806  >  6000 [ACK] Seq=1 Ack=1 Win=64256 Len=0 TSval=3849976118 TSecr=2557319293
225,132.240572,192.168.11.30,192.168.11.10,TCP,93,0.000159,,,"46806  >  6000 [PSH, ACK] Seq=1 Ack=1 Win=64256 Len=27 TSval=3849976118 TSecr=2557319293 [TCP segment of a reassembled PDU]"
226,132.240674,192.168.11.30,192.168.11.10,TCP,66,0.000102,,,"46806  >  6000 [FIN, ACK] Seq=28 Ack=1 Win=64256 Len=0 TSval=3849976118 TSecr=2557319293"
227,132.248163,192.168.11.10,192.168.11.30,TCP,66,0.007489,,,6000  >  46806 [ACK] Seq=1 Ack=28 Win=65152 Len=0 TSval=2557319301 TSecr=3849976118
228,132.248375,192.168.11.10,192.168.11.30,TCP,66,0.000212,,,"6000  >  46806 [FIN, ACK] Seq=1 Ack=29 Win=65152 Len=0 TSval=2557319303 TSecr=3849976118"
229,132.248438,192.168.11.30,192.168.11.10,TCP,66,0.000063,,,46806  >  6000 [ACK] Seq=29 Ack=2 Win=64256 Len=0 TSval=3849976126 TSecr=2557319303
230,132.277969,192.168.11.30,255.255.255.255,UDP,209,0.029531,Ÿ,7b2273656d616e74696373223a207b22656e74697479223a2022504944222c202262617365656e74697479223a2022616e79222c2022726f6c65223a2022686868222c20227370617469616c223a2022616e79222c202274656d706f72616c223a2022616e79227d2c20226461746170726f7065727479223a207b22666f726d6174223a2022696e616f6b615f70726f6772616d5f73616d706c655f73656d616e746963227d7d,40113  >  7000 Len=167
231,132.284412,192.168.11.21,192.168.11.30,TCP,74,0.006443,œ,,44580  >  6000 [SYN] Seq=0 Win=64240 Len=0 MSS=1460 SACK_PERM TSval=2644949068 TSecr=0 WS=128
