No.,Time,Source,Destination,Protocol,Length,Time delta from previous captured frame,XXX,Data,Info
1,0,192.168.11.26,192.168.11.7,TCP,74,0,,,60626  >  6000 [SYN] Seq=0 Win=64240 Len=0 MSS=1460 SACK_PERM TSval=409317080 TSecr=0 WS=128
2,0.01062,192.168.11.7,192.168.11.26,TCP,74,0.01062,,,"6000  >  60626 [SYN, ACK] Seq=0 Ack=1 Win=65160 Len=0 MSS=1460 SACK_PERM TSval=1255756042 TSecr=409317080 WS=128"
3,0.010744,192.168.11.26,192.168.11.7,TCP,66,0.000124,,,60626  >  6000 [ACK] Seq=1 Ack=1 Win=64256 Len=0 TSval=409317097 TSecr=1255756042
4,0.011011,192.168.11.26,192.168.11.7,TCP,93,0.000267,,,"60626  >  6000 [PSH, ACK] Seq=1 Ack=1 Win=64256 Len=27 TSval=409317097 TSecr=1255756042 [TCP segment of a reassembled PDU]"
5,0.011142,192.168.11.26,192.168.11.7,TCP,66,0.000131,,,"60626  >  6000 [FIN, ACK] Seq=28 Ack=1 Win=64256 Len=0 TSval=409317097 TSecr=1255756042"
6,0.01988,192.168.11.7,192.168.11.26,TCP,66,0.008738,,,6000  >  60626 [ACK] Seq=1 Ack=28 Win=65152 Len=0 TSval=1255756052 TSecr=409317097
7,0.0201,192.168.11.7,192.168.11.26,TCP,66,0.00022,,,"6000  >  60626 [FIN, ACK] Seq=1 Ack=29 Win=65152 Len=0 TSval=1255756053 TSecr=409317097"
8,0.020169,192.168.11.26,192.168.11.7,TCP,66,0.000069,,,60626  >  6000 [ACK] Seq=29 Ack=2 Win=64256 Len=0 TSval=409317106 TSecr=1255756053
9,0.053032,192.168.11.26,255.255.255.255,UDP,209,0.032863,Ÿ,7b2273656d616e74696373223a207b22656e74697479223a2022504944222c202262617365656e74697479223a2022616e79222c2022726f6c65223a20226c6c6c222c20227370617469616c223a2022616e79222c202274656d706f72616c223a2022616e79227d2c20226461746170726f7065727479223a207b22666f726d6174223a2022696e616f6b615f70726f6772616d5f73616d706c655f73656d616e746963227d7d,33484  >  7000 Len=167
10,0.06794,192.168.11.25,192.168.11.26,TCP,74,0.014908,œ,,46750  >  6000 [SYN] Seq=0 Win=64240 Len=0 MSS=1460 SACK_PERM TSval=740743762 TSecr=0 WS=128
11,0.0681,192.168.11.26,192.168.11.25,TCP,74,0.00016,,,"6000  >  46750 [SYN, ACK] Seq=0 Ack=1 Win=65160 Len=0 MSS=1460 SACK_PERM TSval=935810242 TSecr=740743762 WS=128"
12,0.076445,192.168.11.25,192.168.11.26,TCP,66,0.008345,,,46750  >  6000 [ACK] Seq=1 Ack=1 Win=64256 Len=0 TSval=740743776 TSecr=935810242
13,0.07695,192.168.11.25,192.168.11.26,TCP,93,0.000505,,,"46750  >  6000 [PSH, ACK] Seq=1 Ack=1 Win=64256 Len=27 TSval=740743776 TSecr=935810242 [TCP segment of a reassembled PDU]"
14,0.077035,192.168.11.26,192.168.11.25,TCP,66,0.000085,,,6000  >  46750 [ACK] Seq=1 Ack=28 Win=65152 Len=0 TSval=935810251 TSecr=740743776
15,0.077106,192.168.11.25,192.168.11.26,TCP,66,0.000071,,,"46750  >  6000 [FIN, ACK] Seq=28 Ack=1 Win=64256 Len=0 TSval=740743777 TSecr=935810242"
16,0.078854,192.168.11.26,192.168.11.25,TCP,66,0.001748,,,"6000  >  46750 [FIN, ACK] Seq=1 Ack=29 Win=65152 Len=0 TSval=935810253 TSecr=740743777"
17,0.087963,192.168.11.25,192.168.11.26,TCP,66,0.009109,,,46750  >  6000 [ACK] Seq=29 Ack=2 Win=64256 Len=0 TSval=740743787 TSecr=935810253
18,7.327518,192.168.11.26,192.168.11.7,TCP,74,7.239555,,,60634  >  6000 [SYN] Seq=0 Win=64240 Len=0 MSS=1460 SACK_PERM TSval=409324414 TSecr=0 WS=128
19,7.337402,192.168.11.7,192.168.11.26,TCP,74,0.009884,,,"6000  >  60634 [SYN, ACK] Seq=0 Ack=1 Win=65160 Len=0 MSS=1460 SACK_PERM TSval=1255763368 TSecr=409324414 WS=128"
20,7.337517,192.168.11.26,192.168.11.7,TCP,66,0.000115,,,60634  >  6000 [ACK] Seq=1 Ack=1 Win=64256 Len=0 TSval=409324424 TSecr=1255763368
21,7.337712,192.168.11.26,192.168.11.7,TCP,93,0.000195,,,"60634  >  6000 [PSH, ACK] Seq=1 Ack=1 Win=64256 Len=27 TSval=409324424 TSecr=1255763368 [TCP segment of a reassembled PDU]"
22,7.337859,192.168.11.26,192.168.11.7,TCP,66,0.000147,,,"60634  >  6000 [FIN, ACK] Seq=28 Ack=1 Win=64256 Len=0 TSval=409324424 TSecr=1255763368"
23,7.345708,192.168.11.7,192.168.11.26,TCP,66,0.007849,,,6000  >  60634 [ACK] Seq=1 Ack=28 Win=65152 Len=0 TSval=1255763378 TSecr=409324424
24,7.348085,192.168.11.7,192.168.11.26,TCP,66,0.002377,,,"6000  >  60634 [FIN, ACK] Seq=1 Ack=29 Win=65152 Len=0 TSval=1255763379 TSecr=409324424"
25,7.348134,192.168.11.26,192.168.11.7,TCP,66,0.000049,,,60634  >  6000 [ACK] Seq=29 Ack=2 Win=64256 Len=0 TSval=409324434 TSecr=1255763379
26,7.379039,192.168.11.26,255.255.255.255,UDP,209,0.030905,Ÿ,7b2273656d616e74696373223a207b22656e74697479223a2022504944222c202262617365656e74697479223a2022616e79222c2022726f6c65223a20226c6c6c222c20227370617469616c223a2022616e79222c202274656d706f72616c223a2022616e79227d2c20226461746170726f7065727479223a207b22666f726d6174223a2022696e616f6b615f70726f6772616d5f73616d706c655f73656d616e746963227d7d,46975  >  7000 Len=167
27,7.388016,192.168.11.25,192.168.11.26,TCP,74,0.008977,œ,,36046  >  6000 [SYN] Seq=0 Win=64240 Len=0 MSS=1460 SACK_PERM TSval=740751087 TSecr=0 WS=128
28,7.388223,192.168.11.26,192.168.11.25,TCP,74,0.000207,,,"6000  >  36046 [SYN, ACK] Seq=0 Ack=1 Win=65160 Len=0 MSS=1460 SACK_PERM TSval=935817562 TSecr=740751087 WS=128"
29,7.404323,192.168.11.25,192.168.11.26,TCP,66,0.0161,,,36046  >  6000 [ACK] Seq=1 Ack=1 Win=64256 Len=0 TSval=740751096 TSecr=935817562
30,7.404888,192.168.11.25,192.168.11.26,TCP,93,0.000565,,,"36046  >  6000 [PSH, ACK] Seq=1 Ack=1 Win=64256 Len=27 TSval=740751096 TSecr=935817562 [TCP segment of a reassembled PDU]"
31,7.40496,192.168.11.26,192.168.11.25,TCP,66,0.000072,,,6000  >  36046 [ACK] Seq=1 Ack=28 Win=65152 Len=0 TSval=935817579 TSecr=740751096
32,7.405027,192.168.11.25,192.168.11.26,TCP,66,0.000067,,,"36046  >  6000 [FIN, ACK] Seq=28 Ack=1 Win=64256 Len=0 TSval=740751096 TSecr=935817562"
33,7.406077,192.168.11.26,192.168.11.25,TCP,66,0.00105,,,"6000  >  36046 [FIN, ACK] Seq=1 Ack=29 Win=65152 Len=0 TSval=935817580 TSecr=740751096"
34,7.413708,192.168.11.25,192.168.11.26,TCP,66,0.007631,,,36046  >  6000 [ACK] Seq=29 Ack=2 Win=64256 Len=0 TSval=740751113 TSecr=935817580
35,14.685443,192.168.11.26,192.168.11.7,TCP,74,7.271735,,,58782  >  6000 [SYN] Seq=0 Win=64240 Len=0 MSS=1460 SACK_PERM TSval=409331772 TSecr=0 WS=128
36,14.694073,192.168.11.7,192.168.11.26,TCP,74,0.00863,,,"6000  >  58782 [SYN, ACK] Seq=0 Ack=1 Win=65160 Len=0 MSS=1460 SACK_PERM TSval=1255770725 TSecr=409331772 WS=128"
37,14.694192,192.168.11.26,192.168.11.7,TCP,66,0.000119,,,58782  >  6000 [ACK] Seq=1 Ack=1 Win=64256 Len=0 TSval=409331781 TSecr=1255770725
38,14.69435,192.168.11.26,192.168.11.7,TCP,93,0.000158,,,"58782  >  6000 [PSH, ACK] Seq=1 Ack=1 Win=64256 Len=27 TSval=409331781 TSecr=1255770725 [TCP segment of a reassembled PDU]"
39,14.694453,192.168.11.26,192.168.11.7,TCP,66,0.000103,,,"58782  >  6000 [FIN, ACK] Seq=28 Ack=1 Win=64256 Len=0 TSval=409331781 TSecr=1255770725"
40,14.703511,192.168.11.7,192.168.11.26,TCP,66,0.009058,,,6000  >  58782 [ACK] Seq=1 Ack=28 Win=65152 Len=0 TSval=1255770735 TSecr=409331781
41,14.703758,192.168.11.7,192.168.11.26,TCP,66,0.000247,,,"6000  >  58782 [FIN, ACK] Seq=1 Ack=29 Win=65152 Len=0 TSval=1255770736 TSecr=409331781"
42,14.703816,192.168.11.26,192.168.11.7,TCP,66,0.000058,,,58782  >  6000 [ACK] Seq=29 Ack=2 Win=64256 Len=0 TSval=409331790 TSecr=1255770736
43,14.737012,192.168.11.26,255.255.255.255,UDP,209,0.033196,Ÿ,7b2273656d616e74696373223a207b22656e74697479223a2022504944222c202262617365656e74697479223a2022616e79222c2022726f6c65223a20226c6c6c222c20227370617469616c223a2022616e79222c202274656d706f72616c223a2022616e79227d2c20226461746170726f7065727479223a207b22666f726d6174223a2022696e616f6b615f70726f6772616d5f73616d706c655f73656d616e746963227d7d,38427  >  7000 Len=167
44,14.744629,192.168.11.25,192.168.11.26,TCP,74,0.007617,œ,,51746  >  6000 [SYN] Seq=0 Win=64240 Len=0 MSS=1460 SACK_PERM TSval=740758443 TSecr=0 WS=128
45,14.744774,192.168.11.26,192.168.11.25,TCP,74,0.000145,,,"6000  >  51746 [SYN, ACK] Seq=0 Ack=1 Win=65160 Len=0 MSS=1460 SACK_PERM TSval=935824919 TSecr=740758443 WS=128"
46,14.75509,192.168.11.25,192.168.11.26,TCP,66,0.010316,,,51746  >  6000 [ACK] Seq=1 Ack=1 Win=64256 Len=0 TSval=740758454 TSecr=935824919
47,14.756508,192.168.11.25,192.168.11.26,TCP,93,0.001418,,,"51746  >  6000 [PSH, ACK] Seq=1 Ack=1 Win=64256 Len=27 TSval=740758454 TSecr=935824919 [TCP segment of a reassembled PDU]"
48,14.756657,192.168.11.26,192.168.11.25,TCP,66,0.000149,,,6000  >  51746 [ACK] Seq=1 Ack=28 Win=65152 Len=0 TSval=935824931 TSecr=740758454
49,14.756738,192.168.11.25,192.168.11.26,TCP,66,0.000081,,,"51746  >  6000 [FIN, ACK] Seq=28 Ack=1 Win=64256 Len=0 TSval=740758454 TSecr=935824919"
50,14.758156,192.168.11.26,192.168.11.25,TCP,66,0.001418,,,"6000  >  51746 [FIN, ACK] Seq=1 Ack=29 Win=65152 Len=0 TSval=935824932 TSecr=740758454"
51,14.764871,192.168.11.25,192.168.11.26,TCP,66,0.006715,,,51746  >  6000 [ACK] Seq=29 Ack=2 Win=64256 Len=0 TSval=740758465 TSecr=935824932
52,21.877592,192.168.11.26,192.168.11.7,TCP,74,7.112721,,,50406  >  6000 [SYN] Seq=0 Win=64240 Len=0 MSS=1460 SACK_PERM TSval=409338964 TSecr=0 WS=128
53,21.887523,192.168.11.7,192.168.11.26,TCP,74,0.009931,,,"6000  >  50406 [SYN, ACK] Seq=0 Ack=1 Win=65160 Len=0 MSS=1460 SACK_PERM TSval=1255777919 TSecr=409338964 WS=128"
54,21.88764,192.168.11.26,192.168.11.7,TCP,66,0.000117,,,50406  >  6000 [ACK] Seq=1 Ack=1 Win=64256 Len=0 TSval=409338974 TSecr=1255777919
55,21.887827,192.168.11.26,192.168.11.7,TCP,93,0.000187,,,"50406  >  6000 [PSH, ACK] Seq=1 Ack=1 Win=64256 Len=27 TSval=409338974 TSecr=1255777919 [TCP segment of a reassembled PDU]"
56,21.887927,192.168.11.26,192.168.11.7,TCP,66,0.0001,,,"50406  >  6000 [FIN, ACK] Seq=28 Ack=1 Win=64256 Len=0 TSval=409338974 TSecr=1255777919"
57,21.895816,192.168.11.7,192.168.11.26,TCP,66,0.007889,,,6000  >  50406 [ACK] Seq=1 Ack=28 Win=65152 Len=0 TSval=1255777928 TSecr=409338974
58,21.898475,192.168.11.7,192.168.11.26,TCP,66,0.002659,,,"6000  >  50406 [FIN, ACK] Seq=1 Ack=29 Win=65152 Len=0 TSval=1255777929 TSecr=409338974"
59,21.898526,192.168.11.26,192.168.11.7,TCP,66,0.000051,,,50406  >  6000 [ACK] Seq=29 Ack=2 Win=64256 Len=0 TSval=409338985 TSecr=1255777929
60,21.931766,192.168.11.26,255.255.255.255,UDP,209,0.03324,Ÿ,7b2273656d616e74696373223a207b22656e74697479223a2022504944222c202262617365656e74697479223a2022616e79222c2022726f6c65223a20226c6c6c222c20227370617469616c223a2022616e79222c202274656d706f72616c223a2022616e79227d2c20226461746170726f7065727479223a207b22666f726d6174223a2022696e616f6b615f70726f6772616d5f73616d706c655f73656d616e746963227d7d,48902  >  7000 Len=167
61,21.940143,192.168.11.25,192.168.11.26,TCP,74,0.008377,œ,,53332  >  6000 [SYN] Seq=0 Win=64240 Len=0 MSS=1460 SACK_PERM TSval=740765639 TSecr=0 WS=128
62,21.940338,192.168.11.26,192.168.11.25,TCP,74,0.000195,,,"6000  >  53332 [SYN, ACK] Seq=0 Ack=1 Win=65160 Len=0 MSS=1460 SACK_PERM TSval=935832115 TSecr=740765639 WS=128"
63,21.949698,192.168.11.25,192.168.11.26,TCP,66,0.00936,,,53332  >  6000 [ACK] Seq=1 Ack=1 Win=64256 Len=0 TSval=740765649 TSecr=935832115
64,21.950466,192.168.11.25,192.168.11.26,TCP,93,0.000768,,,"53332  >  6000 [PSH, ACK] Seq=1 Ack=1 Win=64256 Len=27 TSval=740765649 TSecr=935832115 [TCP segment of a reassembled PDU]"
65,21.950589,192.168.11.26,192.168.11.25,TCP,66,0.000123,,,6000  >  53332 [ACK] Seq=1 Ack=28 Win=65152 Len=0 TSval=935832125 TSecr=740765649
66,21.950669,192.168.11.25,192.168.11.26,TCP,66,0.00008,,,"53332  >  6000 [FIN, ACK] Seq=28 Ack=1 Win=64256 Len=0 TSval=740765649 TSecr=935832115"
67,21.95277,192.168.11.26,192.168.11.25,TCP,66,0.002101,,,"6000  >  53332 [FIN, ACK] Seq=1 Ack=29 Win=65152 Len=0 TSval=935832127 TSecr=740765649"
68,21.961436,192.168.11.25,192.168.11.26,TCP,66,0.008666,,,53332  >  6000 [ACK] Seq=29 Ack=2 Win=64256 Len=0 TSval=740765660 TSecr=935832127
69,29.106815,192.168.11.26,192.168.11.7,TCP,74,7.145379,,,50418  >  6000 [SYN] Seq=0 Win=64240 Len=0 MSS=1460 SACK_PERM TSval=409346193 TSecr=0 WS=128
70,29.116675,192.168.11.7,192.168.11.26,TCP,74,0.00986,,,"6000  >  50418 [SYN, ACK] Seq=0 Ack=1 Win=65160 Len=0 MSS=1460 SACK_PERM TSval=1255785148 TSecr=409346193 WS=128"
71,29.116787,192.168.11.26,192.168.11.7,TCP,66,0.000112,,,50418  >  6000 [ACK] Seq=1 Ack=1 Win=64256 Len=0 TSval=409346203 TSecr=1255785148
72,29.116974,192.168.11.26,192.168.11.7,TCP,93,0.000187,,,"50418  >  6000 [PSH, ACK] Seq=1 Ack=1 Win=64256 Len=27 TSval=409346203 TSecr=1255785148 [TCP segment of a reassembled PDU]"
73,29.117072,192.168.11.26,192.168.11.7,TCP,66,0.000098,,,"50418  >  6000 [FIN, ACK] Seq=28 Ack=1 Win=64256 Len=0 TSval=409346203 TSecr=1255785148"
74,29.127317,192.168.11.7,192.168.11.26,TCP,66,0.010245,,,6000  >  50418 [ACK] Seq=1 Ack=28 Win=65152 Len=0 TSval=1255785159 TSecr=409346203
75,29.127559,192.168.11.7,192.168.11.26,TCP,66,0.000242,,,"6000  >  50418 [FIN, ACK] Seq=1 Ack=29 Win=65152 Len=0 TSval=1255785160 TSecr=409346203"
76,29.127604,192.168.11.26,192.168.11.7,TCP,66,0.000045,,,50418  >  6000 [ACK] Seq=29 Ack=2 Win=64256 Len=0 TSval=409346214 TSecr=1255785160
77,29.15742,192.168.11.26,255.255.255.255,UDP,209,0.029816,Ÿ,7b2273656d616e74696373223a207b22656e74697479223a2022504944222c202262617365656e74697479223a2022616e79222c2022726f6c65223a20226c6c6c222c20227370617469616c223a2022616e79222c202274656d706f72616c223a2022616e79227d2c20226461746170726f7065727479223a207b22666f726d6174223a2022696e616f6b615f70726f6772616d5f73616d706c655f73656d616e746963227d7d,48228  >  7000 Len=167
78,29.164624,192.168.11.25,192.168.11.26,TCP,74,0.007204,œ,,53338  >  6000 [SYN] Seq=0 Win=64240 Len=0 MSS=1460 SACK_PERM TSval=740772865 TSecr=0 WS=128
79,29.164753,192.168.11.26,192.168.11.25,TCP,74,0.000129,,,"6000  >  53338 [SYN, ACK] Seq=0 Ack=1 Win=65160 Len=0 MSS=1460 SACK_PERM TSval=935839339 TSecr=740772865 WS=128"
80,29.172915,192.168.11.25,192.168.11.26,TCP,66,0.008162,,,53338  >  6000 [ACK] Seq=1 Ack=1 Win=64256 Len=0 TSval=740772873 TSecr=935839339
81,29.17357,192.168.11.25,192.168.11.26,TCP,93,0.000655,,,"53338  >  6000 [PSH, ACK] Seq=1 Ack=1 Win=64256 Len=27 TSval=740772873 TSecr=935839339 [TCP segment of a reassembled PDU]"
82,29.173672,192.168.11.26,192.168.11.25,TCP,66,0.000102,,,6000  >  53338 [ACK] Seq=1 Ack=28 Win=65152 Len=0 TSval=935839348 TSecr=740772873
83,29.173756,192.168.11.25,192.168.11.26,TCP,66,0.000084,,,"53338  >  6000 [FIN, ACK] Seq=28 Ack=1 Win=64256 Len=0 TSval=740772873 TSecr=935839339"
84,29.175652,192.168.11.26,192.168.11.25,TCP,66,0.001896,,,"6000  >  53338 [FIN, ACK] Seq=1 Ack=29 Win=65152 Len=0 TSval=935839350 TSecr=740772873"
85,29.184714,192.168.11.25,192.168.11.26,TCP,66,0.009062,,,53338  >  6000 [ACK] Seq=29 Ack=2 Win=64256 Len=0 TSval=740772884 TSecr=935839350
86,36.266877,192.168.11.26,192.168.11.7,TCP,74,7.082163,,,40666  >  6000 [SYN] Seq=0 Win=64240 Len=0 MSS=1460 SACK_PERM TSval=409353353 TSecr=0 WS=128
87,36.280385,192.168.11.7,192.168.11.26,TCP,74,0.013508,,,"6000  >  40666 [SYN, ACK] Seq=0 Ack=1 Win=65160 Len=0 MSS=1460 SACK_PERM TSval=1255792312 TSecr=409353353 WS=128"
88,36.280496,192.168.11.26,192.168.11.7,TCP,66,0.000111,,,40666  >  6000 [ACK] Seq=1 Ack=1 Win=64256 Len=0 TSval=409353367 TSecr=1255792312
89,36.280685,192.168.11.26,192.168.11.7,TCP,93,0.000189,,,"40666  >  6000 [PSH, ACK] Seq=1 Ack=1 Win=64256 Len=27 TSval=409353367 TSecr=1255792312 [TCP segment of a reassembled PDU]"
90,36.280782,192.168.11.26,192.168.11.7,TCP,66,0.000097,,,"40666  >  6000 [FIN, ACK] Seq=28 Ack=1 Win=64256 Len=0 TSval=409353367 TSecr=1255792312"
91,36.289822,192.168.11.7,192.168.11.26,TCP,66,0.00904,,,6000  >  40666 [ACK] Seq=1 Ack=28 Win=65152 Len=0 TSval=1255792321 TSecr=409353367
92,36.29007,192.168.11.7,192.168.11.26,TCP,66,0.000248,,,"6000  >  40666 [FIN, ACK] Seq=1 Ack=29 Win=65152 Len=0 TSval=1255792323 TSecr=409353367"
93,36.290117,192.168.11.26,192.168.11.7,TCP,66,0.000047,,,40666  >  6000 [ACK] Seq=29 Ack=2 Win=64256 Len=0 TSval=409353376 TSecr=1255792323
94,36.321614,192.168.11.26,255.255.255.255,UDP,209,0.031497,Ÿ,7b2273656d616e74696373223a207b22656e74697479223a2022504944222c202262617365656e74697479223a2022616e79222c2022726f6c65223a20226c6c6c222c20227370617469616c223a2022616e79222c202274656d706f72616c223a2022616e79227d2c20226461746170726f7065727479223a207b22666f726d6174223a2022696e616f6b615f70726f6772616d5f73616d706c655f73656d616e746963227d7d,54495  >  7000 Len=167
95,36.3306,192.168.11.25,192.168.11.26,TCP,74,0.008986,œ,,43648  >  6000 [SYN] Seq=0 Win=64240 Len=0 MSS=1460 SACK_PERM TSval=740780030 TSecr=0 WS=128
96,36.330763,192.168.11.26,192.168.11.25,TCP,74,0.000163,,,"6000  >  43648 [SYN, ACK] Seq=0 Ack=1 Win=65160 Len=0 MSS=1460 SACK_PERM TSval=935846505 TSecr=740780030 WS=128"
97,36.339929,192.168.11.25,192.168.11.26,TCP,66,0.009166,,,43648  >  6000 [ACK] Seq=1 Ack=1 Win=64256 Len=0 TSval=740780040 TSecr=935846505
98,36.340574,192.168.11.25,192.168.11.26,TCP,93,0.000645,,,"43648  >  6000 [PSH, ACK] Seq=1 Ack=1 Win=64256 Len=27 TSval=740780040 TSecr=935846505 [TCP segment of a reassembled PDU]"
99,36.340691,192.168.11.26,192.168.11.25,TCP,66,0.000117,,,6000  >  43648 [ACK] Seq=1 Ack=28 Win=65152 Len=0 TSval=935846515 TSecr=740780040
100,36.340767,192.168.11.25,192.168.11.26,TCP,66,0.000076,,,"43648  >  6000 [FIN, ACK] Seq=28 Ack=1 Win=64256 Len=0 TSval=740780040 TSecr=935846505"
101,36.341939,192.168.11.26,192.168.11.25,TCP,66,0.001172,,,"6000  >  43648 [FIN, ACK] Seq=1 Ack=29 Win=65152 Len=0 TSval=935846516 TSecr=740780040"
102,36.348707,192.168.11.25,192.168.11.26,TCP,66,0.006768,,,43648  >  6000 [ACK] Seq=29 Ack=2 Win=64256 Len=0 TSval=740780049 TSecr=935846516
103,43.495958,192.168.11.26,192.168.11.7,TCP,74,7.147251,,,58284  >  6000 [SYN] Seq=0 Win=64240 Len=0 MSS=1460 SACK_PERM TSval=409360582 TSecr=0 WS=128
104,43.504645,192.168.11.7,192.168.11.26,TCP,74,0.008687,,,"6000  >  58284 [SYN, ACK] Seq=0 Ack=1 Win=65160 Len=0 MSS=1460 SACK_PERM TSval=1255799536 TSecr=409360582 WS=128"
105,43.504754,192.168.11.26,192.168.11.7,TCP,66,0.000109,,,58284  >  6000 [ACK] Seq=1 Ack=1 Win=64256 Len=0 TSval=409360591 TSecr=1255799536
106,43.504911,192.168.11.26,192.168.11.7,TCP,93,0.000157,,,"58284  >  6000 [PSH, ACK] Seq=1 Ack=1 Win=64256 Len=27 TSval=409360591 TSecr=1255799536 [TCP segment of a reassembled PDU]"
107,43.504995,192.168.11.26,192.168.11.7,TCP,66,0.000084,,,"58284  >  6000 [FIN, ACK] Seq=28 Ack=1 Win=64256 Len=0 TSval=409360591 TSecr=1255799536"
108,43.512862,192.168.11.7,192.168.11.26,TCP,66,0.007867,,,6000  >  58284 [ACK] Seq=1 Ack=28 Win=65152 Len=0 TSval=1255799544 TSecr=409360591
109,43.513184,192.168.11.7,192.168.11.26,TCP,66,0.000322,,,[TCP Dup ACK 108#1] 6000  >  58284 [ACK] Seq=1 Ack=28 Win=65152 Len=0 TSval=1255799545 TSecr=409360591
110,43.51323,192.168.11.7,192.168.11.26,TCP,66,0.000046,,,"6000  >  58284 [FIN, ACK] Seq=1 Ack=29 Win=65152 Len=0 TSval=1255799546 TSecr=409360591"
111,43.51327,192.168.11.26,192.168.11.7,TCP,66,0.00004,,,58284  >  6000 [ACK] Seq=29 Ack=2 Win=64256 Len=0 TSval=409360600 TSecr=1255799546
112,43.546196,192.168.11.26,255.255.255.255,UDP,209,0.032926,Ÿ,7b2273656d616e74696373223a207b22656e74697479223a2022504944222c202262617365656e74697479223a2022616e79222c2022726f6c65223a20226c6c6c222c20227370617469616c223a2022616e79222c202274656d706f72616c223a2022616e79227d2c20226461746170726f7065727479223a207b22666f726d6174223a2022696e616f6b615f70726f6772616d5f73616d706c655f73656d616e746963227d7d,58146  >  7000 Len=167
113,43.55383,192.168.11.25,192.168.11.26,TCP,74,0.007634,œ,,46150  >  6000 [SYN] Seq=0 Win=64240 Len=0 MSS=1460 SACK_PERM TSval=740787254 TSecr=0 WS=128
114,43.55398,192.168.11.26,192.168.11.25,TCP,74,0.00015,,,"6000  >  46150 [SYN, ACK] Seq=0 Ack=1 Win=65160 Len=0 MSS=1460 SACK_PERM TSval=935853728 TSecr=740787254 WS=128"
115,43.563158,192.168.11.25,192.168.11.26,TCP,66,0.009178,,,46150  >  6000 [ACK] Seq=1 Ack=1 Win=64256 Len=0 TSval=740787263 TSecr=935853728
116,43.563674,192.168.11.25,192.168.11.26,TCP,93,0.000516,,,"46150  >  6000 [PSH, ACK] Seq=1 Ack=1 Win=64256 Len=27 TSval=740787263 TSecr=935853728 [TCP segment of a reassembled PDU]"
117,43.563759,192.168.11.26,192.168.11.25,TCP,66,0.000085,,,6000  >  46150 [ACK] Seq=1 Ack=28 Win=65152 Len=0 TSval=935853738 TSecr=740787263
118,43.563821,192.168.11.25,192.168.11.26,TCP,66,0.000062,,,"46150  >  6000 [FIN, ACK] Seq=28 Ack=1 Win=64256 Len=0 TSval=740787264 TSecr=935853728"
119,43.564912,192.168.11.26,192.168.11.25,TCP,66,0.001091,,,"6000  >  46150 [FIN, ACK] Seq=1 Ack=29 Win=65152 Len=0 TSval=935853739 TSecr=740787264"
120,43.571421,192.168.11.25,192.168.11.26,TCP,66,0.006509,,,46150  >  6000 [ACK] Seq=29 Ack=2 Win=64256 Len=0 TSval=740787272 TSecr=935853739
121,50.677477,192.168.11.26,192.168.11.7,TCP,74,7.106056,,,46776  >  6000 [SYN] Seq=0 Win=64240 Len=0 MSS=1460 SACK_PERM TSval=409367764 TSecr=0 WS=128
122,50.68738,192.168.11.7,192.168.11.26,TCP,74,0.009903,,,"6000  >  46776 [SYN, ACK] Seq=0 Ack=1 Win=65160 Len=0 MSS=1460 SACK_PERM TSval=1255806719 TSecr=409367764 WS=128"
123,50.687493,192.168.11.26,192.168.11.7,TCP,66,0.000113,,,46776  >  6000 [ACK] Seq=1 Ack=1 Win=64256 Len=0 TSval=409367774 TSecr=1255806719
124,50.68766,192.168.11.26,192.168.11.7,TCP,93,0.000167,,,"46776  >  6000 [PSH, ACK] Seq=1 Ack=1 Win=64256 Len=27 TSval=409367774 TSecr=1255806719 [TCP segment of a reassembled PDU]"
125,50.687766,192.168.11.26,192.168.11.7,TCP,66,0.000106,,,"46776  >  6000 [FIN, ACK] Seq=28 Ack=1 Win=64256 Len=0 TSval=409367774 TSecr=1255806719"
126,50.695979,192.168.11.7,192.168.11.26,TCP,66,0.008213,,,6000  >  46776 [ACK] Seq=1 Ack=28 Win=65152 Len=0 TSval=1255806728 TSecr=409367774
127,50.696246,192.168.11.7,192.168.11.26,TCP,66,0.000267,,,"6000  >  46776 [FIN, ACK] Seq=1 Ack=29 Win=65152 Len=0 TSval=1255806729 TSecr=409367774"
128,50.696295,192.168.11.26,192.168.11.7,TCP,66,0.000049,,,46776  >  6000 [ACK] Seq=29 Ack=2 Win=64256 Len=0 TSval=409367783 TSecr=1255806729
129,50.729154,192.168.11.26,255.255.255.255,UDP,209,0.032859,Ÿ,7b2273656d616e74696373223a207b22656e74697479223a2022504944222c202262617365656e74697479223a2022616e79222c2022726f6c65223a20226c6c6c222c20227370617469616c223a2022616e79222c202274656d706f72616c223a2022616e79227d2c20226461746170726f7065727479223a207b22666f726d6174223a2022696e616f6b615f70726f6772616d5f73616d706c655f73656d616e746963227d7d,52548  >  7000 Len=167
130,50.736458,192.168.11.25,192.168.11.26,TCP,74,0.007304,œ,,46160  >  6000 [SYN] Seq=0 Win=64240 Len=0 MSS=1460 SACK_PERM TSval=740794437 TSecr=0 WS=128
131,50.736601,192.168.11.26,192.168.11.25,TCP,74,0.000143,,,"6000  >  46160 [SYN, ACK] Seq=0 Ack=1 Win=65160 Len=0 MSS=1460 SACK_PERM TSval=935860911 TSecr=740794437 WS=128"
132,50.745241,192.168.11.25,192.168.11.26,TCP,66,0.00864,,,46160  >  6000 [ACK] Seq=1 Ack=1 Win=64256 Len=0 TSval=740794445 TSecr=935860911
133,50.745928,192.168.11.25,192.168.11.26,TCP,93,0.000687,,,"46160  >  6000 [PSH, ACK] Seq=1 Ack=1 Win=64256 Len=27 TSval=740794445 TSecr=935860911 [TCP segment of a reassembled PDU]"
134,50.746059,192.168.11.26,192.168.11.25,TCP,66,0.000131,,,6000  >  46160 [ACK] Seq=1 Ack=28 Win=65152 Len=0 TSval=935860920 TSecr=740794445
135,50.746144,192.168.11.25,192.168.11.26,TCP,66,0.000085,,,"46160  >  6000 [FIN, ACK] Seq=28 Ack=1 Win=64256 Len=0 TSval=740794445 TSecr=935860911"
136,50.747497,192.168.11.26,192.168.11.25,TCP,66,0.001353,,,"6000  >  46160 [FIN, ACK] Seq=1 Ack=29 Win=65152 Len=0 TSval=935860922 TSecr=740794445"
137,50.755625,192.168.11.25,192.168.11.26,TCP,66,0.008128,,,46160  >  6000 [ACK] Seq=29 Ack=2 Win=64256 Len=0 TSval=740794455 TSecr=935860922
138,57.842414,192.168.11.26,192.168.11.7,TCP,74,7.086789,,,46790  >  6000 [SYN] Seq=0 Win=64240 Len=0 MSS=1460 SACK_PERM TSval=409374929 TSecr=0 WS=128
139,57.852629,192.168.11.7,192.168.11.26,TCP,74,0.010215,,,"6000  >  46790 [SYN, ACK] Seq=0 Ack=1 Win=65160 Len=0 MSS=1460 SACK_PERM TSval=1255813882 TSecr=409374929 WS=128"
140,57.852736,192.168.11.26,192.168.11.7,TCP,66,0.000107,,,46790  >  6000 [ACK] Seq=1 Ack=1 Win=64256 Len=0 TSval=409374939 TSecr=1255813882
141,57.852875,192.168.11.26,192.168.11.7,TCP,93,0.000139,,,"46790  >  6000 [PSH, ACK] Seq=1 Ack=1 Win=64256 Len=27 TSval=409374939 TSecr=1255813882 [TCP segment of a reassembled PDU]"
142,57.853004,192.168.11.26,192.168.11.7,TCP,66,0.000129,,,"46790  >  6000 [FIN, ACK] Seq=28 Ack=1 Win=64256 Len=0 TSval=409374939 TSecr=1255813882"
143,57.861698,192.168.11.7,192.168.11.26,TCP,66,0.008694,,,6000  >  46790 [ACK] Seq=1 Ack=28 Win=65152 Len=0 TSval=1255813894 TSecr=409374939
144,57.864208,192.168.11.7,192.168.11.26,TCP,66,0.00251,,,"6000  >  46790 [FIN, ACK] Seq=1 Ack=29 Win=65152 Len=0 TSval=1255813896 TSecr=409374939"
145,57.864257,192.168.11.26,192.168.11.7,TCP,66,0.000049,,,46790  >  6000 [ACK] Seq=29 Ack=2 Win=64256 Len=0 TSval=409374951 TSecr=1255813896
146,57.89507,192.168.11.26,255.255.255.255,UDP,209,0.030813,Ÿ,7b2273656d616e74696373223a207b22656e74697479223a2022504944222c202262617365656e74697479223a2022616e79222c2022726f6c65223a20226c6c6c222c20227370617469616c223a2022616e79222c202274656d706f72616c223a2022616e79227d2c20226461746170726f7065727479223a207b22666f726d6174223a2022696e616f6b615f70726f6772616d5f73616d706c655f73656d616e746963227d7d,59483  >  7000 Len=167
147,57.902476,192.168.11.25,192.168.11.26,TCP,74,0.007406,œ,,40810  >  6000 [SYN] Seq=0 Win=64240 Len=0 MSS=1460 SACK_PERM TSval=740801603 TSecr=0 WS=128
148,57.902636,192.168.11.26,192.168.11.25,TCP,74,0.00016,,,"6000  >  40810 [SYN, ACK] Seq=0 Ack=1 Win=65160 Len=0 MSS=1460 SACK_PERM TSval=935868077 TSecr=740801603 WS=128"
149,57.912052,192.168.11.25,192.168.11.26,TCP,66,0.009416,,,40810  >  6000 [ACK] Seq=1 Ack=1 Win=64256 Len=0 TSval=740801612 TSecr=935868077
150,57.912842,192.168.11.25,192.168.11.26,TCP,93,0.00079,,,"40810  >  6000 [PSH, ACK] Seq=1 Ack=1 Win=64256 Len=27 TSval=740801612 TSecr=935868077 [TCP segment of a reassembled PDU]"
151,57.91303,192.168.11.26,192.168.11.25,TCP,66,0.000188,,,6000  >  40810 [ACK] Seq=1 Ack=28 Win=65152 Len=0 TSval=935868087 TSecr=740801612
152,57.913092,192.168.11.25,192.168.11.26,TCP,66,0.000062,,,"40810  >  6000 [FIN, ACK] Seq=28 Ack=1 Win=64256 Len=0 TSval=740801612 TSecr=935868077"
153,57.914199,192.168.11.26,192.168.11.25,TCP,66,0.001107,,,"6000  >  40810 [FIN, ACK] Seq=1 Ack=29 Win=65152 Len=0 TSval=935868088 TSecr=740801612"
154,57.922565,192.168.11.25,192.168.11.26,TCP,66,0.008366,,,40810  >  6000 [ACK] Seq=29 Ack=2 Win=64256 Len=0 TSval=740801622 TSecr=935868088
155,64.978622,192.168.11.26,192.168.11.7,TCP,74,7.056057,,,34842  >  6000 [SYN] Seq=0 Win=64240 Len=0 MSS=1460 SACK_PERM TSval=409382065 TSecr=0 WS=128
156,64.98727,192.168.11.7,192.168.11.26,TCP,74,0.008648,,,"6000  >  34842 [SYN, ACK] Seq=0 Ack=1 Win=65160 Len=0 MSS=1460 SACK_PERM TSval=1255821019 TSecr=409382065 WS=128"
157,64.987407,192.168.11.26,192.168.11.7,TCP,66,0.000137,,,34842  >  6000 [ACK] Seq=1 Ack=1 Win=64256 Len=0 TSval=409382074 TSecr=1255821019
158,64.987549,192.168.11.26,192.168.11.7,TCP,93,0.000142,,,"34842  >  6000 [PSH, ACK] Seq=1 Ack=1 Win=64256 Len=27 TSval=409382074 TSecr=1255821019 [TCP segment of a reassembled PDU]"
159,64.987673,192.168.11.26,192.168.11.7,TCP,66,0.000124,,,"34842  >  6000 [FIN, ACK] Seq=28 Ack=1 Win=64256 Len=0 TSval=409382074 TSecr=1255821019"
160,64.995973,192.168.11.7,192.168.11.26,TCP,66,0.0083,,,6000  >  34842 [ACK] Seq=1 Ack=28 Win=65152 Len=0 TSval=1255821027 TSecr=409382074
161,64.996236,192.168.11.7,192.168.11.26,TCP,66,0.000263,,,"6000  >  34842 [FIN, ACK] Seq=1 Ack=29 Win=65152 Len=0 TSval=1255821029 TSecr=409382074"
162,64.996301,192.168.11.26,192.168.11.7,TCP,66,0.000065,,,34842  >  6000 [ACK] Seq=29 Ack=2 Win=64256 Len=0 TSval=409382083 TSecr=1255821029
163,65.027083,192.168.11.26,255.255.255.255,UDP,209,0.030782,Ÿ,7b2273656d616e74696373223a207b22656e74697479223a2022504944222c202262617365656e74697479223a2022616e79222c2022726f6c65223a20226c6c6c222c20227370617469616c223a2022616e79222c202274656d706f72616c223a2022616e79227d2c20226461746170726f7065727479223a207b22666f726d6174223a2022696e616f6b615f70726f6772616d5f73616d706c655f73656d616e746963227d7d,40784  >  7000 Len=167
164,65.035157,192.168.11.25,192.168.11.26,TCP,74,0.008074,œ,,46112  >  6000 [SYN] Seq=0 Win=64240 Len=0 MSS=1460 SACK_PERM TSval=740808734 TSecr=0 WS=128
165,65.035326,192.168.11.26,192.168.11.25,TCP,74,0.000169,,,"6000  >  46112 [SYN, ACK] Seq=0 Ack=1 Win=65160 Len=0 MSS=1460 SACK_PERM TSval=935875210 TSecr=740808734 WS=128"
166,65.044899,192.168.11.25,192.168.11.26,TCP,93,0.009573,,,"46112  >  6000 [PSH, ACK] Seq=1 Ack=1 Win=64256 Len=27 TSval=740808745 TSecr=935875210 [TCP segment of a reassembled PDU]"
167,65.045266,192.168.11.26,192.168.11.25,TCP,66,0.000367,,,6000  >  46112 [ACK] Seq=1 Ack=28 Win=65152 Len=0 TSval=935875219 TSecr=740808745
168,65.045775,192.168.11.25,192.168.11.26,TCP,66,0.000509,,,46112  >  6000 [ACK] Seq=1 Ack=1 Win=64256 Len=0 TSval=740808745 TSecr=935875210
169,65.045873,192.168.11.26,192.168.11.25,TCP,66,0.000098,,,[TCP Dup ACK 167#1] 6000  >  46112 [ACK] Seq=1 Ack=28 Win=65152 Len=0 TSval=935875220 TSecr=740808745
170,65.045921,192.168.11.25,192.168.11.26,TCP,66,0.000048,,,"46112  >  6000 [FIN, ACK] Seq=28 Ack=1 Win=64256 Len=0 TSval=740808745 TSecr=935875210"
171,65.047225,192.168.11.26,192.168.11.25,TCP,66,0.001304,,,"6000  >  46112 [FIN, ACK] Seq=1 Ack=29 Win=65152 Len=0 TSval=935875222 TSecr=740808745"
172,65.055127,192.168.11.25,192.168.11.26,TCP,66,0.007902,,,46112  >  6000 [ACK] Seq=29 Ack=2 Win=64256 Len=0 TSval=740808755 TSecr=935875222
173,110.666564,192.168.11.26,192.168.11.7,TCP,74,45.611437,,,52194  >  6000 [SYN] Seq=0 Win=64240 Len=0 MSS=1460 SACK_PERM TSval=409427753 TSecr=0 WS=128
174,110.675116,192.168.11.7,192.168.11.26,TCP,74,0.008552,,,"6000  >  52194 [SYN, ACK] Seq=0 Ack=1 Win=65160 Len=0 MSS=1460 SACK_PERM TSval=1255866707 TSecr=409427753 WS=128"
175,110.675227,192.168.11.26,192.168.11.7,TCP,66,0.000111,,,52194  >  6000 [ACK] Seq=1 Ack=1 Win=64256 Len=0 TSval=409427762 TSecr=1255866707
176,110.675483,192.168.11.26,192.168.11.7,TCP,93,0.000256,,,"52194  >  6000 [PSH, ACK] Seq=1 Ack=1 Win=64256 Len=27 TSval=409427762 TSecr=1255866707 [TCP segment of a reassembled PDU]"
177,110.675617,192.168.11.26,192.168.11.7,TCP,66,0.000134,,,"52194  >  6000 [FIN, ACK] Seq=28 Ack=1 Win=64256 Len=0 TSval=409427762 TSecr=1255866707"
178,110.68464,192.168.11.7,192.168.11.26,TCP,66,0.009023,,,6000  >  52194 [ACK] Seq=1 Ack=28 Win=65152 Len=0 TSval=1255866717 TSecr=409427762
179,110.687088,192.168.11.7,192.168.11.26,TCP,66,0.002448,,,"6000  >  52194 [FIN, ACK] Seq=1 Ack=29 Win=65152 Len=0 TSval=1255866718 TSecr=409427762"
180,110.687136,192.168.11.26,192.168.11.7,TCP,66,0.000048,,,52194  >  6000 [ACK] Seq=29 Ack=2 Win=64256 Len=0 TSval=409427773 TSecr=1255866718
181,110.720499,192.168.11.26,255.255.255.255,UDP,209,0.033363,Ÿ,7b2273656d616e74696373223a207b22656e74697479223a2022504944222c202262617365656e74697479223a2022616e79222c2022726f6c65223a20226c6c6c222c20227370617469616c223a2022616e79222c202274656d706f72616c223a2022616e79227d2c20226461746170726f7065727479223a207b22666f726d6174223a2022696e616f6b615f70726f6772616d5f73616d706c655f73656d616e746963227d7d,33256  >  7000 Len=167
182,110.728874,192.168.11.25,192.168.11.26,TCP,74,0.008375,œ,,36476  >  6000 [SYN] Seq=0 Win=64240 Len=0 MSS=1460 SACK_PERM TSval=740854428 TSecr=0 WS=128
183,110.729021,192.168.11.26,192.168.11.25,TCP,74,0.000147,,,"6000  >  36476 [SYN, ACK] Seq=0 Ack=1 Win=65160 Len=0 MSS=1460 SACK_PERM TSval=935920903 TSecr=740854428 WS=128"
184,110.738646,192.168.11.25,192.168.11.26,TCP,93,0.009625,,,"36476  >  6000 [PSH, ACK] Seq=1 Ack=1 Win=64256 Len=27 TSval=740854438 TSecr=935920903 [TCP segment of a reassembled PDU]"
185,110.739009,192.168.11.26,192.168.11.25,TCP,66,0.000363,,,6000  >  36476 [ACK] Seq=1 Ack=28 Win=65152 Len=0 TSval=935920913 TSecr=740854438
186,110.739334,192.168.11.25,192.168.11.26,TCP,66,0.000325,,,36476  >  6000 [ACK] Seq=1 Ack=1 Win=64256 Len=0 TSval=740854438 TSecr=935920903
187,110.739392,192.168.11.26,192.168.11.25,TCP,66,0.000058,,,[TCP Dup ACK 185#1] 6000  >  36476 [ACK] Seq=1 Ack=28 Win=65152 Len=0 TSval=935920914 TSecr=740854438
188,110.739577,192.168.11.25,192.168.11.26,TCP,66,0.000185,,,"36476  >  6000 [FIN, ACK] Seq=28 Ack=1 Win=64256 Len=0 TSval=740854438 TSecr=935920903"
189,110.741357,192.168.11.26,192.168.11.25,TCP,66,0.00178,,,"6000  >  36476 [FIN, ACK] Seq=1 Ack=29 Win=65152 Len=0 TSval=935920916 TSecr=740854438"
190,110.74918,192.168.11.25,192.168.11.26,TCP,66,0.007823,,,36476  >  6000 [ACK] Seq=29 Ack=2 Win=64256 Len=0 TSval=740854449 TSecr=935920916
191,117.799185,192.168.11.26,192.168.11.7,TCP,74,7.050005,,,52206  >  6000 [SYN] Seq=0 Win=64240 Len=0 MSS=1460 SACK_PERM TSval=409434885 TSecr=0 WS=128
192,117.809005,192.168.11.7,192.168.11.26,TCP,74,0.00982,,,"6000  >  52206 [SYN, ACK] Seq=0 Ack=1 Win=65160 Len=0 MSS=1460 SACK_PERM TSval=1255873841 TSecr=409434885 WS=128"
193,117.809108,192.168.11.26,192.168.11.7,TCP,66,0.000103,,,52206  >  6000 [ACK] Seq=1 Ack=1 Win=64256 Len=0 TSval=409434895 TSecr=1255873841
194,117.80929,192.168.11.26,192.168.11.7,TCP,93,0.000182,,,"52206  >  6000 [PSH, ACK] Seq=1 Ack=1 Win=64256 Len=27 TSval=409434896 TSecr=1255873841 [TCP segment of a reassembled PDU]"
195,117.809402,192.168.11.26,192.168.11.7,TCP,66,0.000112,,,"52206  >  6000 [FIN, ACK] Seq=28 Ack=1 Win=64256 Len=0 TSval=409434896 TSecr=1255873841"
196,117.819517,192.168.11.7,192.168.11.26,TCP,66,0.010115,,,6000  >  52206 [ACK] Seq=1 Ack=28 Win=65152 Len=0 TSval=1255873850 TSecr=409434896
197,117.819727,192.168.11.7,192.168.11.26,TCP,66,0.00021,,,"6000  >  52206 [FIN, ACK] Seq=1 Ack=29 Win=65152 Len=0 TSval=1255873852 TSecr=409434896"
198,117.819775,192.168.11.26,192.168.11.7,TCP,66,0.000048,,,52206  >  6000 [ACK] Seq=29 Ack=2 Win=64256 Len=0 TSval=409434906 TSecr=1255873852
199,117.849524,192.168.11.26,255.255.255.255,UDP,209,0.029749,Ÿ,7b2273656d616e74696373223a207b22656e74697479223a2022504944222c202262617365656e74697479223a2022616e79222c2022726f6c65223a20226c6c6c222c20227370617469616c223a2022616e79222c202274656d706f72616c223a2022616e79227d2c20226461746170726f7065727479223a207b22666f726d6174223a2022696e616f6b615f70726f6772616d5f73616d706c655f73656d616e746963227d7d,48803  >  7000 Len=167
200,117.858935,192.168.11.25,192.168.11.26,TCP,74,0.009411,œ,,51852  >  6000 [SYN] Seq=0 Win=64240 Len=0 MSS=1460 SACK_PERM TSval=740861557 TSecr=0 WS=128
201,117.859085,192.168.11.26,192.168.11.25,TCP,74,0.00015,,,"6000  >  51852 [SYN, ACK] Seq=0 Ack=1 Win=65160 Len=0 MSS=1460 SACK_PERM TSval=935928033 TSecr=740861557 WS=128"
202,117.866351,192.168.11.25,192.168.11.26,TCP,93,0.007266,,,"51852  >  6000 [PSH, ACK] Seq=1 Ack=1 Win=64256 Len=27 TSval=740861567 TSecr=935928033 [TCP segment of a reassembled PDU]"
203,117.866599,192.168.11.26,192.168.11.25,TCP,66,0.000248,,,6000  >  51852 [ACK] Seq=1 Ack=28 Win=65152 Len=0 TSval=935928041 TSecr=740861567
204,117.866867,192.168.11.25,192.168.11.26,TCP,66,0.000268,,,51852  >  6000 [ACK] Seq=1 Ack=1 Win=64256 Len=0 TSval=740861567 TSecr=935928033
205,117.866909,192.168.11.26,192.168.11.25,TCP,66,0.000042,,,[TCP Dup ACK 203#1] 6000  >  51852 [ACK] Seq=1 Ack=28 Win=65152 Len=0 TSval=935928041 TSecr=740861567
206,117.867165,192.168.11.25,192.168.11.26,TCP,66,0.000256,,,"51852  >  6000 [FIN, ACK] Seq=28 Ack=1 Win=64256 Len=0 TSval=740861567 TSecr=935928033"
207,117.87023,192.168.11.26,192.168.11.25,TCP,66,0.003065,,,"6000  >  51852 [FIN, ACK] Seq=1 Ack=29 Win=65152 Len=0 TSval=935928044 TSecr=740861567"
208,117.879251,192.168.11.25,192.168.11.26,TCP,66,0.009021,,,51852  >  6000 [ACK] Seq=29 Ack=2 Win=64256 Len=0 TSval=740861579 TSecr=935928044
209,125.029745,192.168.11.26,192.168.11.7,TCP,74,7.150494,,,47074  >  6000 [SYN] Seq=0 Win=64240 Len=0 MSS=1460 SACK_PERM TSval=409442116 TSecr=0 WS=128
210,125.039352,192.168.11.7,192.168.11.26,TCP,74,0.009607,,,"6000  >  47074 [SYN, ACK] Seq=0 Ack=1 Win=65160 Len=0 MSS=1460 SACK_PERM TSval=1255881071 TSecr=409442116 WS=128"
211,125.039485,192.168.11.26,192.168.11.7,TCP,66,0.000133,,,47074  >  6000 [ACK] Seq=1 Ack=1 Win=64256 Len=0 TSval=409442126 TSecr=1255881071
212,125.039661,192.168.11.26,192.168.11.7,TCP,93,0.000176,,,"47074  >  6000 [PSH, ACK] Seq=1 Ack=1 Win=64256 Len=27 TSval=409442126 TSecr=1255881071 [TCP segment of a reassembled PDU]"
213,125.039788,192.168.11.26,192.168.11.7,TCP,66,0.000127,,,"47074  >  6000 [FIN, ACK] Seq=28 Ack=1 Win=64256 Len=0 TSval=409442126 TSecr=1255881071"
214,125.048838,192.168.11.7,192.168.11.26,TCP,66,0.00905,,,6000  >  47074 [ACK] Seq=1 Ack=28 Win=65152 Len=0 TSval=1255881080 TSecr=409442126
215,125.049294,192.168.11.7,192.168.11.26,TCP,66,0.000456,,,"6000  >  47074 [FIN, ACK] Seq=1 Ack=29 Win=65152 Len=0 TSval=1255881081 TSecr=409442126"
216,125.049351,192.168.11.26,192.168.11.7,TCP,66,0.000057,,,47074  >  6000 [ACK] Seq=29 Ack=2 Win=64256 Len=0 TSval=409442136 TSecr=1255881081
217,125.086523,192.168.11.26,255.255.255.255,UDP,209,0.037172,Ÿ,7b2273656d616e74696373223a207b22656e74697479223a2022504944222c202262617365656e74697479223a2022616e79222c2022726f6c65223a20226c6c6c222c20227370617469616c223a2022616e79222c202274656d706f72616c223a2022616e79227d2c20226461746170726f7065727479223a207b22666f726d6174223a2022696e616f6b615f70726f6772616d5f73616d706c655f73656d616e746963227d7d,48490  >  7000 Len=167
218,125.09454,192.168.11.25,192.168.11.26,TCP,74,0.008017,œ,,46686  >  6000 [SYN] Seq=0 Win=64240 Len=0 MSS=1460 SACK_PERM TSval=740868794 TSecr=0 WS=128
219,125.094726,192.168.11.26,192.168.11.25,TCP,74,0.000186,,,"6000  >  46686 [SYN, ACK] Seq=0 Ack=1 Win=65160 Len=0 MSS=1460 SACK_PERM TSval=935935269 TSecr=740868794 WS=128"
220,125.104038,192.168.11.25,192.168.11.26,TCP,93,0.009312,,,"46686  >  6000 [PSH, ACK] Seq=1 Ack=1 Win=64256 Len=27 TSval=740868803 TSecr=935935269 [TCP segment of a reassembled PDU]"
221,125.104413,192.168.11.26,192.168.11.25,TCP,66,0.000375,,,6000  >  46686 [ACK] Seq=1 Ack=28 Win=65152 Len=0 TSval=935935279 TSecr=740868803
222,125.104975,192.168.11.25,192.168.11.26,TCP,66,0.000562,,,46686  >  6000 [ACK] Seq=1 Ack=1 Win=64256 Len=0 TSval=740868803 TSecr=935935269
223,125.10508,192.168.11.26,192.168.11.25,TCP,66,0.000105,,,[TCP Dup ACK 221#1] 6000  >  46686 [ACK] Seq=1 Ack=28 Win=65152 Len=0 TSval=935935279 TSecr=740868803
224,125.105162,192.168.11.25,192.168.11.26,TCP,66,0.000082,,,"46686  >  6000 [FIN, ACK] Seq=28 Ack=1 Win=64256 Len=0 TSval=740868803 TSecr=935935269"
225,125.10677,192.168.11.26,192.168.11.25,TCP,66,0.001608,,,"6000  >  46686 [FIN, ACK] Seq=1 Ack=29 Win=65152 Len=0 TSval=935935281 TSecr=740868803"
226,125.114556,192.168.11.25,192.168.11.26,TCP,66,0.007786,,,46686  >  6000 [ACK] Seq=29 Ack=2 Win=64256 Len=0 TSval=740868814 TSecr=935935281
227,132.218187,192.168.11.26,192.168.11.7,TCP,74,7.103631,,,43926  >  6000 [SYN] Seq=0 Win=64240 Len=0 MSS=1460 SACK_PERM TSval=409449304 TSecr=0 WS=128
228,132.226833,192.168.11.7,192.168.11.26,TCP,74,0.008646,,,"6000  >  43926 [SYN, ACK] Seq=0 Ack=1 Win=65160 Len=0 MSS=1460 SACK_PERM TSval=1255888259 TSecr=409449304 WS=128"
229,132.226958,192.168.11.26,192.168.11.7,TCP,66,0.000125,,,43926  >  6000 [ACK] Seq=1 Ack=1 Win=64256 Len=0 TSval=409449313 TSecr=1255888259
230,132.227145,192.168.11.26,192.168.11.7,TCP,93,0.000187,,,"43926  >  6000 [PSH, ACK] Seq=1 Ack=1 Win=64256 Len=27 TSval=409449313 TSecr=1255888259 [TCP segment of a reassembled PDU]"
231,132.227245,192.168.11.26,192.168.11.7,TCP,66,0.0001,,,"43926  >  6000 [FIN, ACK] Seq=28 Ack=1 Win=64256 Len=0 TSval=409449314 TSecr=1255888259"
232,132.240577,192.168.11.7,192.168.11.26,TCP,66,0.013332,,,6000  >  43926 [ACK] Seq=1 Ack=28 Win=65152 Len=0 TSval=1255888267 TSecr=409449313
233,132.241002,192.168.11.7,192.168.11.26,TCP,66,0.000425,,,"6000  >  43926 [FIN, ACK] Seq=1 Ack=29 Win=65152 Len=0 TSval=1255888269 TSecr=409449314"
234,132.24107,192.168.11.26,192.168.11.7,TCP,66,0.000068,,,43926  >  6000 [ACK] Seq=29 Ack=2 Win=64256 Len=0 TSval=409449327 TSecr=1255888269
