No.,Time,Source,Destination,Protocol,Length,Time delta from previous captured frame,XXX,Data,Info
1,0,192.168.11.25,192.168.11.26,TCP,74,0,,,46750  >  6000 [SYN] Seq=0 Win=64240 Len=0 MSS=1460 SACK_PERM TSval=740743762 TSecr=0 WS=128
2,0.009243,192.168.11.26,192.168.11.25,TCP,74,0.009243,,,"6000  >  46750 [SYN, ACK] Seq=0 Ack=1 Win=65160 Len=0 MSS=1460 SACK_PERM TSval=935810242 TSecr=740743762 WS=128"
3,0.009357,192.168.11.25,192.168.11.26,TCP,66,0.000114,,,46750  >  6000 [ACK] Seq=1 Ack=1 Win=64256 Len=0 TSval=740743776 TSecr=935810242
4,0.009579,192.168.11.25,192.168.11.26,TCP,93,0.000222,,,"46750  >  6000 [PSH, ACK] Seq=1 Ack=1 Win=64256 Len=27 TSval=740743776 TSecr=935810242 [TCP segment of a reassembled PDU]"
5,0.00973,192.168.11.25,192.168.11.26,TCP,66,0.000151,,,"46750  >  6000 [FIN, ACK] Seq=28 Ack=1 Win=64256 Len=0 TSval=740743777 TSecr=935810242"
6,0.01763,192.168.11.26,192.168.11.25,TCP,66,0.0079,,,6000  >  46750 [ACK] Seq=1 Ack=28 Win=65152 Len=0 TSval=935810251 TSecr=740743776
7,0.020216,192.168.11.26,192.168.11.25,TCP,66,0.002586,,,"6000  >  46750 [FIN, ACK] Seq=1 Ack=29 Win=65152 Len=0 TSval=935810253 TSecr=740743777"
8,0.020264,192.168.11.25,192.168.11.26,TCP,66,0.000048,,,46750  >  6000 [ACK] Seq=29 Ack=2 Win=64256 Len=0 TSval=740743787 TSecr=935810253
9,0.052716,192.168.11.25,255.255.255.255,UDP,209,0.032452,Ÿ,7b2273656d616e74696373223a207b22656e74697479223a2022504944222c202262617365656e74697479223a2022616e79222c2022726f6c65223a20226d6d6d222c20227370617469616c223a2022616e79222c202274656d706f72616c223a2022616e79227d2c20226461746170726f7065727479223a207b22666f726d6174223a2022696e616f6b615f70726f6772616d5f73616d706c655f73656d616e746963227d7d,57494  >  7000 Len=167
10,0.061309,192.168.11.4,192.168.11.25,TCP,74,0.008593,œ,,52794  >  6000 [SYN] Seq=0 Win=64240 Len=0 MSS=1460 SACK_PERM TSval=3164212649 TSecr=0 WS=128
11,0.061447,192.168.11.25,192.168.11.4,TCP,74,0.000138,,,"6000  >  52794 [SYN, ACK] Seq=0 Ack=1 Win=65160 Len=0 MSS=1460 SACK_PERM TSval=3047249879 TSecr=3164212649 WS=128"
12,0.079424,192.168.11.4,192.168.11.25,TCP,66,0.017977,,,52794  >  6000 [ACK] Seq=1 Ack=1 Win=64256 Len=0 TSval=3164212658 TSecr=3047249879
13,0.080161,192.168.11.4,192.168.11.25,TCP,93,0.000737,,,"52794  >  6000 [PSH, ACK] Seq=1 Ack=1 Win=64256 Len=27 TSval=3164212659 TSecr=3047249879 [TCP segment of a reassembled PDU]"
14,0.080295,192.168.11.25,192.168.11.4,TCP,66,0.000134,,,6000  >  52794 [ACK] Seq=1 Ack=28 Win=65152 Len=0 TSval=3047249898 TSecr=3164212659
15,0.080389,192.168.11.4,192.168.11.25,TCP,66,0.000094,,,"52794  >  6000 [FIN, ACK] Seq=28 Ack=1 Win=64256 Len=0 TSval=3164212659 TSecr=3047249879"
16,0.081875,192.168.11.25,192.168.11.4,TCP,66,0.001486,,,"6000  >  52794 [FIN, ACK] Seq=1 Ack=29 Win=65152 Len=0 TSval=3047249900 TSecr=3164212659"
17,0.087662,192.168.11.4,192.168.11.25,TCP,66,0.005787,,,52794  >  6000 [ACK] Seq=29 Ack=2 Win=64256 Len=0 TSval=3164212678 TSecr=3047249900
18,7.319766,192.168.11.25,192.168.11.26,TCP,74,7.232104,,,36046  >  6000 [SYN] Seq=0 Win=64240 Len=0 MSS=1460 SACK_PERM TSval=740751087 TSecr=0 WS=128
19,7.329061,192.168.11.26,192.168.11.25,TCP,74,0.009295,,,"6000  >  36046 [SYN, ACK] Seq=0 Ack=1 Win=65160 Len=0 MSS=1460 SACK_PERM TSval=935817562 TSecr=740751087 WS=128"
20,7.329165,192.168.11.25,192.168.11.26,TCP,66,0.000104,,,36046  >  6000 [ACK] Seq=1 Ack=1 Win=64256 Len=0 TSval=740751096 TSecr=935817562
21,7.329377,192.168.11.25,192.168.11.26,TCP,93,0.000212,,,"36046  >  6000 [PSH, ACK] Seq=1 Ack=1 Win=64256 Len=27 TSval=740751096 TSecr=935817562 [TCP segment of a reassembled PDU]"
22,7.329498,192.168.11.25,192.168.11.26,TCP,66,0.000121,,,"36046  >  6000 [FIN, ACK] Seq=28 Ack=1 Win=64256 Len=0 TSval=740751096 TSecr=935817562"
23,7.345621,192.168.11.26,192.168.11.25,TCP,66,0.016123,,,6000  >  36046 [ACK] Seq=1 Ack=28 Win=65152 Len=0 TSval=935817579 TSecr=740751096
24,7.34598,192.168.11.26,192.168.11.25,TCP,66,0.000359,,,"6000  >  36046 [FIN, ACK] Seq=1 Ack=29 Win=65152 Len=0 TSval=935817580 TSecr=740751096"
25,7.346026,192.168.11.25,192.168.11.26,TCP,66,0.000046,,,36046  >  6000 [ACK] Seq=29 Ack=2 Win=64256 Len=0 TSval=740751113 TSecr=935817580
26,7.379776,192.168.11.25,255.255.255.255,UDP,209,0.03375,Ÿ,7b2273656d616e74696373223a207b22656e74697479223a2022504944222c202262617365656e74697479223a2022616e79222c2022726f6c65223a20226d6d6d222c20227370617469616c223a2022616e79222c202274656d706f72616c223a2022616e79227d2c20226461746170726f7065727479223a207b22666f726d6174223a2022696e616f6b615f70726f6772616d5f73616d706c655f73656d616e746963227d7d,43335  >  7000 Len=167
27,7.38632,192.168.11.4,192.168.11.25,TCP,74,0.006544,œ,,33888  >  6000 [SYN] Seq=0 Win=64240 Len=0 MSS=1460 SACK_PERM TSval=3164219976 TSecr=0 WS=128
28,7.386481,192.168.11.25,192.168.11.4,TCP,74,0.000161,,,"6000  >  33888 [SYN, ACK] Seq=0 Ack=1 Win=65160 Len=0 MSS=1460 SACK_PERM TSval=3047257204 TSecr=3164219976 WS=128"
29,7.393383,192.168.11.4,192.168.11.25,TCP,66,0.006902,,,33888  >  6000 [ACK] Seq=1 Ack=1 Win=64256 Len=0 TSval=3164219984 TSecr=3047257204
30,7.394039,192.168.11.4,192.168.11.25,TCP,93,0.000656,,,"33888  >  6000 [PSH, ACK] Seq=1 Ack=1 Win=64256 Len=27 TSval=3164219984 TSecr=3047257204 [TCP segment of a reassembled PDU]"
31,7.39416,192.168.11.25,192.168.11.4,TCP,66,0.000121,,,6000  >  33888 [ACK] Seq=1 Ack=28 Win=65152 Len=0 TSval=3047257212 TSecr=3164219984
32,7.394272,192.168.11.4,192.168.11.25,TCP,66,0.000112,,,"33888  >  6000 [FIN, ACK] Seq=28 Ack=1 Win=64256 Len=0 TSval=3164219984 TSecr=3047257204"
33,7.395739,192.168.11.25,192.168.11.4,TCP,66,0.001467,,,"6000  >  33888 [FIN, ACK] Seq=1 Ack=29 Win=65152 Len=0 TSval=3047257214 TSecr=3164219984"
34,7.401799,192.168.11.4,192.168.11.25,TCP,66,0.00606,,,33888  >  6000 [ACK] Seq=29 Ack=2 Win=64256 Len=0 TSval=3164219992 TSecr=3047257214
35,14.676563,192.168.11.25,192.168.11.26,TCP,74,7.274764,,,51746  >  6000 [SYN] Seq=0 Win=64240 Len=0 MSS=1460 SACK_PERM TSval=740758443 TSecr=0 WS=128
36,14.687148,192.168.11.26,192.168.11.25,TCP,74,0.010585,,,"6000  >  51746 [SYN, ACK] Seq=0 Ack=1 Win=65160 Len=0 MSS=1460 SACK_PERM TSval=935824919 TSecr=740758443 WS=128"
37,14.687245,192.168.11.25,192.168.11.26,TCP,66,0.000097,,,51746  >  6000 [ACK] Seq=1 Ack=1 Win=64256 Len=0 TSval=740758454 TSecr=935824919
38,14.687441,192.168.11.25,192.168.11.26,TCP,93,0.000196,,,"51746  >  6000 [PSH, ACK] Seq=1 Ack=1 Win=64256 Len=27 TSval=740758454 TSecr=935824919 [TCP segment of a reassembled PDU]"
39,14.687538,192.168.11.25,192.168.11.26,TCP,66,0.000097,,,"51746  >  6000 [FIN, ACK] Seq=28 Ack=1 Win=64256 Len=0 TSval=740758454 TSecr=935824919"
40,14.697562,192.168.11.26,192.168.11.25,TCP,66,0.010024,,,6000  >  51746 [ACK] Seq=1 Ack=28 Win=65152 Len=0 TSval=935824931 TSecr=740758454
41,14.697766,192.168.11.26,192.168.11.25,TCP,66,0.000204,,,"6000  >  51746 [FIN, ACK] Seq=1 Ack=29 Win=65152 Len=0 TSval=935824932 TSecr=740758454"
42,14.697809,192.168.11.25,192.168.11.26,TCP,66,0.000043,,,51746  >  6000 [ACK] Seq=29 Ack=2 Win=64256 Len=0 TSval=740758465 TSecr=935824932
43,14.731498,192.168.11.25,255.255.255.255,UDP,209,0.033689,Ÿ,7b2273656d616e74696373223a207b22656e74697479223a2022504944222c202262617365656e74697479223a2022616e79222c2022726f6c65223a20226d6d6d222c20227370617469616c223a2022616e79222c202274656d706f72616c223a2022616e79227d2c20226461746170726f7065727479223a207b22666f726d6174223a2022696e616f6b615f70726f6772616d5f73616d706c655f73656d616e746963227d7d,39626  >  7000 Len=167
44,14.737351,192.168.11.4,192.168.11.25,TCP,74,0.005853,œ,,43356  >  6000 [SYN] Seq=0 Win=64240 Len=0 MSS=1460 SACK_PERM TSval=3164227327 TSecr=0 WS=128
45,14.737455,192.168.11.25,192.168.11.4,TCP,74,0.000104,,,"6000  >  43356 [SYN, ACK] Seq=0 Ack=1 Win=65160 Len=0 MSS=1460 SACK_PERM TSval=3047264555 TSecr=3164227327 WS=128"
46,14.744066,192.168.11.4,192.168.11.25,TCP,66,0.006611,,,43356  >  6000 [ACK] Seq=1 Ack=1 Win=64256 Len=0 TSval=3164227334 TSecr=3047264555
47,14.744604,192.168.11.4,192.168.11.25,TCP,93,0.000538,,,"43356  >  6000 [PSH, ACK] Seq=1 Ack=1 Win=64256 Len=27 TSval=3164227334 TSecr=3047264555 [TCP segment of a reassembled PDU]"
48,14.744687,192.168.11.25,192.168.11.4,TCP,66,0.000083,,,6000  >  43356 [ACK] Seq=1 Ack=28 Win=65152 Len=0 TSval=3047264563 TSecr=3164227334
49,14.744754,192.168.11.4,192.168.11.25,TCP,66,0.000067,,,"43356  >  6000 [FIN, ACK] Seq=28 Ack=1 Win=64256 Len=0 TSval=3164227335 TSecr=3047264555"
50,14.745924,192.168.11.25,192.168.11.4,TCP,66,0.00117,,,"6000  >  43356 [FIN, ACK] Seq=1 Ack=29 Win=65152 Len=0 TSval=3047264564 TSecr=3164227335"
51,14.752093,192.168.11.4,192.168.11.25,TCP,66,0.006169,,,43356  >  6000 [ACK] Seq=29 Ack=2 Win=64256 Len=0 TSval=3164227342 TSecr=3047264564
52,21.872269,192.168.11.25,192.168.11.26,TCP,74,7.120176,,,53332  >  6000 [SYN] Seq=0 Win=64240 Len=0 MSS=1460 SACK_PERM TSval=740765639 TSecr=0 WS=128
53,21.881597,192.168.11.26,192.168.11.25,TCP,74,0.009328,,,"6000  >  53332 [SYN, ACK] Seq=0 Ack=1 Win=65160 Len=0 MSS=1460 SACK_PERM TSval=935832115 TSecr=740765639 WS=128"
54,21.881695,192.168.11.25,192.168.11.26,TCP,66,0.000098,,,53332  >  6000 [ACK] Seq=1 Ack=1 Win=64256 Len=0 TSval=740765649 TSecr=935832115
55,21.881854,192.168.11.25,192.168.11.26,TCP,93,0.000159,,,"53332  >  6000 [PSH, ACK] Seq=1 Ack=1 Win=64256 Len=27 TSval=740765649 TSecr=935832115 [TCP segment of a reassembled PDU]"
56,21.881954,192.168.11.25,192.168.11.26,TCP,66,0.0001,,,"53332  >  6000 [FIN, ACK] Seq=28 Ack=1 Win=64256 Len=0 TSval=740765649 TSecr=935832115"
57,21.891088,192.168.11.26,192.168.11.25,TCP,66,0.009134,,,6000  >  53332 [ACK] Seq=1 Ack=28 Win=65152 Len=0 TSval=935832125 TSecr=740765649
58,21.893535,192.168.11.26,192.168.11.25,TCP,66,0.002447,,,"6000  >  53332 [FIN, ACK] Seq=1 Ack=29 Win=65152 Len=0 TSval=935832127 TSecr=740765649"
59,21.893579,192.168.11.25,192.168.11.26,TCP,66,0.000044,,,53332  >  6000 [ACK] Seq=29 Ack=2 Win=64256 Len=0 TSval=740765660 TSecr=935832127
60,21.925202,192.168.11.25,255.255.255.255,UDP,209,0.031623,Ÿ,7b2273656d616e74696373223a207b22656e74697479223a2022504944222c202262617365656e74697479223a2022616e79222c2022726f6c65223a20226d6d6d222c20227370617469616c223a2022616e79222c202274656d706f72616c223a2022616e79227d2c20226461746170726f7065727479223a207b22666f726d6174223a2022696e616f6b615f70726f6772616d5f73616d706c655f73656d616e746963227d7d,40159  >  7000 Len=167
61,21.930774,192.168.11.4,192.168.11.25,TCP,74,0.005572,œ,,43370  >  6000 [SYN] Seq=0 Win=64240 Len=0 MSS=1460 SACK_PERM TSval=3164234521 TSecr=0 WS=128
62,21.930869,192.168.11.25,192.168.11.4,TCP,74,0.000095,,,"6000  >  43370 [SYN, ACK] Seq=0 Ack=1 Win=65160 Len=0 MSS=1460 SACK_PERM TSval=3047271749 TSecr=3164234521 WS=128"
63,21.937877,192.168.11.4,192.168.11.25,TCP,66,0.007008,,,43370  >  6000 [ACK] Seq=1 Ack=1 Win=64256 Len=0 TSval=3164234528 TSecr=3047271749
64,21.938417,192.168.11.4,192.168.11.25,TCP,93,0.00054,,,"43370  >  6000 [PSH, ACK] Seq=1 Ack=1 Win=64256 Len=27 TSval=3164234528 TSecr=3047271749 [TCP segment of a reassembled PDU]"
65,21.938505,192.168.11.25,192.168.11.4,TCP,66,0.000088,,,6000  >  43370 [ACK] Seq=1 Ack=28 Win=65152 Len=0 TSval=3047271756 TSecr=3164234528
66,21.938603,192.168.11.4,192.168.11.25,TCP,66,0.000098,,,"43370  >  6000 [FIN, ACK] Seq=28 Ack=1 Win=64256 Len=0 TSval=3164234528 TSecr=3047271749"
67,21.939807,192.168.11.25,192.168.11.4,TCP,66,0.001204,,,"6000  >  43370 [FIN, ACK] Seq=1 Ack=29 Win=65152 Len=0 TSval=3047271758 TSecr=3164234528"
68,21.945931,192.168.11.4,192.168.11.25,TCP,66,0.006124,,,43370  >  6000 [ACK] Seq=29 Ack=2 Win=64256 Len=0 TSval=3164234536 TSecr=3047271758
69,29.097841,192.168.11.25,192.168.11.26,TCP,74,7.15191,,,53338  >  6000 [SYN] Seq=0 Win=64240 Len=0 MSS=1460 SACK_PERM TSval=740772865 TSecr=0 WS=128
70,29.106045,192.168.11.26,192.168.11.25,TCP,74,0.008204,,,"6000  >  53338 [SYN, ACK] Seq=0 Ack=1 Win=65160 Len=0 MSS=1460 SACK_PERM TSval=935839339 TSecr=740772865 WS=128"
71,29.106151,192.168.11.25,192.168.11.26,TCP,66,0.000106,,,53338  >  6000 [ACK] Seq=1 Ack=1 Win=64256 Len=0 TSval=740772873 TSecr=935839339
72,29.106321,192.168.11.25,192.168.11.26,TCP,93,0.00017,,,"53338  >  6000 [PSH, ACK] Seq=1 Ack=1 Win=64256 Len=27 TSval=740772873 TSecr=935839339 [TCP segment of a reassembled PDU]"
73,29.106409,192.168.11.25,192.168.11.26,TCP,66,0.000088,,,"53338  >  6000 [FIN, ACK] Seq=28 Ack=1 Win=64256 Len=0 TSval=740772873 TSecr=935839339"
74,29.114332,192.168.11.26,192.168.11.25,TCP,66,0.007923,,,6000  >  53338 [ACK] Seq=1 Ack=28 Win=65152 Len=0 TSval=935839348 TSecr=740772873
75,29.116956,192.168.11.26,192.168.11.25,TCP,66,0.002624,,,"6000  >  53338 [FIN, ACK] Seq=1 Ack=29 Win=65152 Len=0 TSval=935839350 TSecr=740772873"
76,29.116999,192.168.11.25,192.168.11.26,TCP,66,0.000043,,,53338  >  6000 [ACK] Seq=29 Ack=2 Win=64256 Len=0 TSval=740772884 TSecr=935839350
77,29.148054,192.168.11.25,255.255.255.255,UDP,209,0.031055,Ÿ,7b2273656d616e74696373223a207b22656e74697479223a2022504944222c202262617365656e74697479223a2022616e79222c2022726f6c65223a20226d6d6d222c20227370617469616c223a2022616e79222c202274656d706f72616c223a2022616e79227d2c20226461746170726f7065727479223a207b22666f726d6174223a2022696e616f6b615f70726f6772616d5f73616d706c655f73656d616e746963227d7d,38853  >  7000 Len=167
78,29.153638,192.168.11.4,192.168.11.25,TCP,74,0.005584,œ,,47088  >  6000 [SYN] Seq=0 Win=64240 Len=0 MSS=1460 SACK_PERM TSval=3164241744 TSecr=0 WS=128
79,29.153737,192.168.11.25,192.168.11.4,TCP,74,0.000099,,,"6000  >  47088 [SYN, ACK] Seq=0 Ack=1 Win=65160 Len=0 MSS=1460 SACK_PERM TSval=3047278972 TSecr=3164241744 WS=128"
80,29.160391,192.168.11.4,192.168.11.25,TCP,66,0.006654,,,47088  >  6000 [ACK] Seq=1 Ack=1 Win=64256 Len=0 TSval=3164241751 TSecr=3047278972
81,29.160849,192.168.11.4,192.168.11.25,TCP,93,0.000458,,,"47088  >  6000 [PSH, ACK] Seq=1 Ack=1 Win=64256 Len=27 TSval=3164241751 TSecr=3047278972 [TCP segment of a reassembled PDU]"
82,29.160913,192.168.11.25,192.168.11.4,TCP,66,0.000064,,,6000  >  47088 [ACK] Seq=1 Ack=28 Win=65152 Len=0 TSval=3047278979 TSecr=3164241751
83,29.160971,192.168.11.4,192.168.11.25,TCP,66,0.000058,,,"47088  >  6000 [FIN, ACK] Seq=28 Ack=1 Win=64256 Len=0 TSval=3164241751 TSecr=3047278972"
84,29.161902,192.168.11.25,192.168.11.4,TCP,66,0.000931,,,"6000  >  47088 [FIN, ACK] Seq=1 Ack=29 Win=65152 Len=0 TSval=3047278980 TSecr=3164241751"
85,29.168026,192.168.11.4,192.168.11.25,TCP,66,0.006124,,,47088  >  6000 [ACK] Seq=29 Ack=2 Win=64256 Len=0 TSval=3164241758 TSecr=3047278980
86,36.262827,192.168.11.25,192.168.11.26,TCP,74,7.094801,,,43648  >  6000 [SYN] Seq=0 Win=64240 Len=0 MSS=1460 SACK_PERM TSval=740780030 TSecr=0 WS=128
87,36.273074,192.168.11.26,192.168.11.25,TCP,74,0.010247,,,"6000  >  43648 [SYN, ACK] Seq=0 Ack=1 Win=65160 Len=0 MSS=1460 SACK_PERM TSval=935846505 TSecr=740780030 WS=128"
88,36.273169,192.168.11.25,192.168.11.26,TCP,66,0.000095,,,43648  >  6000 [ACK] Seq=1 Ack=1 Win=64256 Len=0 TSval=740780040 TSecr=935846505
89,36.273327,192.168.11.25,192.168.11.26,TCP,93,0.000158,,,"43648  >  6000 [PSH, ACK] Seq=1 Ack=1 Win=64256 Len=27 TSval=740780040 TSecr=935846505 [TCP segment of a reassembled PDU]"
90,36.273446,192.168.11.25,192.168.11.26,TCP,66,0.000119,,,"43648  >  6000 [FIN, ACK] Seq=28 Ack=1 Win=64256 Len=0 TSval=740780040 TSecr=935846505"
91,36.281484,192.168.11.26,192.168.11.25,TCP,66,0.008038,,,6000  >  43648 [ACK] Seq=1 Ack=28 Win=65152 Len=0 TSval=935846515 TSecr=740780040
92,36.281696,192.168.11.26,192.168.11.25,TCP,66,0.000212,,,"6000  >  43648 [FIN, ACK] Seq=1 Ack=29 Win=65152 Len=0 TSval=935846516 TSecr=740780040"
93,36.281738,192.168.11.25,192.168.11.26,TCP,66,0.000042,,,43648  >  6000 [ACK] Seq=29 Ack=2 Win=64256 Len=0 TSval=740780049 TSecr=935846516
94,36.312334,192.168.11.25,255.255.255.255,UDP,209,0.030596,Ÿ,7b2273656d616e74696373223a207b22656e74697479223a2022504944222c202262617365656e74697479223a2022616e79222c2022726f6c65223a20226d6d6d222c20227370617469616c223a2022616e79222c202274656d706f72616c223a2022616e79227d2c20226461746170726f7065727479223a207b22666f726d6174223a2022696e616f6b615f70726f6772616d5f73616d706c655f73656d616e746963227d7d,44958  >  7000 Len=167
95,36.31813,192.168.11.4,192.168.11.25,TCP,74,0.005796,œ,,60012  >  6000 [SYN] Seq=0 Win=64240 Len=0 MSS=1460 SACK_PERM TSval=3164248908 TSecr=0 WS=128
96,36.318239,192.168.11.25,192.168.11.4,TCP,74,0.000109,,,"6000  >  60012 [SYN, ACK] Seq=0 Ack=1 Win=65160 Len=0 MSS=1460 SACK_PERM TSval=3047286136 TSecr=3164248908 WS=128"
97,36.324909,192.168.11.4,192.168.11.25,TCP,66,0.00667,,,60012  >  6000 [ACK] Seq=1 Ack=1 Win=64256 Len=0 TSval=3164248915 TSecr=3047286136
98,36.325401,192.168.11.4,192.168.11.25,TCP,93,0.000492,,,"60012  >  6000 [PSH, ACK] Seq=1 Ack=1 Win=64256 Len=27 TSval=3164248915 TSecr=3047286136 [TCP segment of a reassembled PDU]"
99,36.325447,192.168.11.4,192.168.11.25,TCP,66,0.000046,,,"60012  >  6000 [FIN, ACK] Seq=28 Ack=1 Win=64256 Len=0 TSval=3164248915 TSecr=3047286136"
100,36.325474,192.168.11.25,192.168.11.4,TCP,66,0.000027,,,6000  >  60012 [ACK] Seq=1 Ack=28 Win=65152 Len=0 TSval=3047286143 TSecr=3164248915
101,36.326643,192.168.11.25,192.168.11.4,TCP,66,0.001169,,,"6000  >  60012 [FIN, ACK] Seq=1 Ack=29 Win=65152 Len=0 TSval=3047286144 TSecr=3164248915"
102,36.332778,192.168.11.4,192.168.11.25,TCP,66,0.006135,,,60012  >  6000 [ACK] Seq=29 Ack=2 Win=64256 Len=0 TSval=3164248923 TSecr=3047286144
103,43.487062,192.168.11.25,192.168.11.26,TCP,74,7.154284,,,46150  >  6000 [SYN] Seq=0 Win=64240 Len=0 MSS=1460 SACK_PERM TSval=740787254 TSecr=0 WS=128
104,43.496279,192.168.11.26,192.168.11.25,TCP,74,0.009217,,,"6000  >  46150 [SYN, ACK] Seq=0 Ack=1 Win=65160 Len=0 MSS=1460 SACK_PERM TSval=935853728 TSecr=740787254 WS=128"
105,43.496379,192.168.11.25,192.168.11.26,TCP,66,0.0001,,,46150  >  6000 [ACK] Seq=1 Ack=1 Win=64256 Len=0 TSval=740787263 TSecr=935853728
106,43.496529,192.168.11.25,192.168.11.26,TCP,93,0.00015,,,"46150  >  6000 [PSH, ACK] Seq=1 Ack=1 Win=64256 Len=27 TSval=740787263 TSecr=935853728 [TCP segment of a reassembled PDU]"
107,43.496633,192.168.11.25,192.168.11.26,TCP,66,0.000104,,,"46150  >  6000 [FIN, ACK] Seq=28 Ack=1 Win=64256 Len=0 TSval=740787264 TSecr=935853728"
108,43.504682,192.168.11.26,192.168.11.25,TCP,66,0.008049,,,6000  >  46150 [ACK] Seq=1 Ack=28 Win=65152 Len=0 TSval=935853738 TSecr=740787263
109,43.504868,192.168.11.26,192.168.11.25,TCP,66,0.000186,,,"6000  >  46150 [FIN, ACK] Seq=1 Ack=29 Win=65152 Len=0 TSval=935853739 TSecr=740787264"
110,43.504912,192.168.11.25,192.168.11.26,TCP,66,0.000044,,,46150  >  6000 [ACK] Seq=29 Ack=2 Win=64256 Len=0 TSval=740787272 TSecr=935853739
111,43.532049,192.168.11.25,255.255.255.255,UDP,209,0.027137,Ÿ,7b2273656d616e74696373223a207b22656e74697479223a2022504944222c202262617365656e74697479223a2022616e79222c2022726f6c65223a20226d6d6d222c20227370617469616c223a2022616e79222c202274656d706f72616c223a2022616e79227d2c20226461746170726f7065727479223a207b22666f726d6174223a2022696e616f6b615f70726f6772616d5f73616d706c655f73656d616e746963227d7d,44102  >  7000 Len=167
112,43.537608,192.168.11.4,192.168.11.25,TCP,74,0.005559,œ,,49510  >  6000 [SYN] Seq=0 Win=64240 Len=0 MSS=1460 SACK_PERM TSval=3164256128 TSecr=0 WS=128
113,43.537717,192.168.11.25,192.168.11.4,TCP,74,0.000109,,,"6000  >  49510 [SYN, ACK] Seq=0 Ack=1 Win=65160 Len=0 MSS=1460 SACK_PERM TSval=3047293356 TSecr=3164256128 WS=128"
114,43.544331,192.168.11.4,192.168.11.25,TCP,66,0.006614,,,49510  >  6000 [ACK] Seq=1 Ack=1 Win=64256 Len=0 TSval=3164256135 TSecr=3047293356
115,43.544785,192.168.11.4,192.168.11.25,TCP,93,0.000454,,,"49510  >  6000 [PSH, ACK] Seq=1 Ack=1 Win=64256 Len=27 TSval=3164256135 TSecr=3047293356 [TCP segment of a reassembled PDU]"
116,43.544868,192.168.11.25,192.168.11.4,TCP,66,0.000083,,,6000  >  49510 [ACK] Seq=1 Ack=28 Win=65152 Len=0 TSval=3047293363 TSecr=3164256135
117,43.544928,192.168.11.4,192.168.11.25,TCP,66,0.00006,,,"49510  >  6000 [FIN, ACK] Seq=28 Ack=1 Win=64256 Len=0 TSval=3164256135 TSecr=3047293356"
118,43.545858,192.168.11.25,192.168.11.4,TCP,66,0.00093,,,"6000  >  49510 [FIN, ACK] Seq=1 Ack=29 Win=65152 Len=0 TSval=3047293364 TSecr=3164256135"
119,43.55215,192.168.11.4,192.168.11.25,TCP,66,0.006292,,,49510  >  6000 [ACK] Seq=29 Ack=2 Win=64256 Len=0 TSval=3164256142 TSecr=3047293364
120,50.669774,192.168.11.25,192.168.11.26,TCP,74,7.117624,,,46160  >  6000 [SYN] Seq=0 Win=64240 Len=0 MSS=1460 SACK_PERM TSval=740794437 TSecr=0 WS=128
121,50.678061,192.168.11.26,192.168.11.25,TCP,74,0.008287,,,"6000  >  46160 [SYN, ACK] Seq=0 Ack=1 Win=65160 Len=0 MSS=1460 SACK_PERM TSval=935860911 TSecr=740794437 WS=128"
122,50.678159,192.168.11.25,192.168.11.26,TCP,66,0.000098,,,46160  >  6000 [ACK] Seq=1 Ack=1 Win=64256 Len=0 TSval=740794445 TSecr=935860911
123,50.678321,192.168.11.25,192.168.11.26,TCP,93,0.000162,,,"46160  >  6000 [PSH, ACK] Seq=1 Ack=1 Win=64256 Len=27 TSval=740794445 TSecr=935860911 [TCP segment of a reassembled PDU]"
124,50.678442,192.168.11.25,192.168.11.26,TCP,66,0.000121,,,"46160  >  6000 [FIN, ACK] Seq=28 Ack=1 Win=64256 Len=0 TSval=740794445 TSecr=935860911"
125,50.687609,192.168.11.26,192.168.11.25,TCP,66,0.009167,,,6000  >  46160 [ACK] Seq=1 Ack=28 Win=65152 Len=0 TSval=935860920 TSecr=740794445
126,50.68784,192.168.11.26,192.168.11.25,TCP,66,0.000231,,,"6000  >  46160 [FIN, ACK] Seq=1 Ack=29 Win=65152 Len=0 TSval=935860922 TSecr=740794445"
127,50.687893,192.168.11.25,192.168.11.26,TCP,66,0.000053,,,46160  >  6000 [ACK] Seq=29 Ack=2 Win=64256 Len=0 TSval=740794455 TSecr=935860922
128,50.717157,192.168.11.25,255.255.255.255,UDP,209,0.029264,Ÿ,7b2273656d616e74696373223a207b22656e74697479223a2022504944222c202262617365656e74697479223a2022616e79222c2022726f6c65223a20226d6d6d222c20227370617469616c223a2022616e79222c202274656d706f72616c223a2022616e79227d2c20226461746170726f7065727479223a207b22666f726d6174223a2022696e616f6b615f70726f6772616d5f73616d706c655f73656d616e746963227d7d,42322  >  7000 Len=167
129,50.723819,192.168.11.4,192.168.11.25,TCP,74,0.006662,œ,,49512  >  6000 [SYN] Seq=0 Win=64240 Len=0 MSS=1460 SACK_PERM TSval=3164263313 TSecr=0 WS=128
130,50.72393,192.168.11.25,192.168.11.4,TCP,74,0.000111,,,"6000  >  49512 [SYN, ACK] Seq=0 Ack=1 Win=65160 Len=0 MSS=1460 SACK_PERM TSval=3047300542 TSecr=3164263313 WS=128"
131,50.730539,192.168.11.4,192.168.11.25,TCP,66,0.006609,,,49512  >  6000 [ACK] Seq=1 Ack=1 Win=64256 Len=0 TSval=3164263321 TSecr=3047300542
132,50.731079,192.168.11.4,192.168.11.25,TCP,93,0.00054,,,"49512  >  6000 [PSH, ACK] Seq=1 Ack=1 Win=64256 Len=27 TSval=3164263321 TSecr=3047300542 [TCP segment of a reassembled PDU]"
133,50.731162,192.168.11.25,192.168.11.4,TCP,66,0.000083,,,6000  >  49512 [ACK] Seq=1 Ack=28 Win=65152 Len=0 TSval=3047300549 TSecr=3164263321
134,50.731245,192.168.11.4,192.168.11.25,TCP,66,0.000083,,,"49512  >  6000 [FIN, ACK] Seq=28 Ack=1 Win=64256 Len=0 TSval=3164263321 TSecr=3047300542"
135,50.732372,192.168.11.25,192.168.11.4,TCP,66,0.001127,,,"6000  >  49512 [FIN, ACK] Seq=1 Ack=29 Win=65152 Len=0 TSval=3047300550 TSecr=3164263321"
136,50.738497,192.168.11.4,192.168.11.25,TCP,66,0.006125,,,49512  >  6000 [ACK] Seq=29 Ack=2 Win=64256 Len=0 TSval=3164263328 TSecr=3047300550
137,57.835935,192.168.11.25,192.168.11.26,TCP,74,7.097438,,,40810  >  6000 [SYN] Seq=0 Win=64240 Len=0 MSS=1460 SACK_PERM TSval=740801603 TSecr=0 WS=128
138,57.84512,192.168.11.26,192.168.11.25,TCP,74,0.009185,,,"6000  >  40810 [SYN, ACK] Seq=0 Ack=1 Win=65160 Len=0 MSS=1460 SACK_PERM TSval=935868077 TSecr=740801603 WS=128"
139,57.845222,192.168.11.25,192.168.11.26,TCP,66,0.000102,,,40810  >  6000 [ACK] Seq=1 Ack=1 Win=64256 Len=0 TSval=740801612 TSecr=935868077
140,57.845396,192.168.11.25,192.168.11.26,TCP,93,0.000174,,,"40810  >  6000 [PSH, ACK] Seq=1 Ack=1 Win=64256 Len=27 TSval=740801612 TSecr=935868077 [TCP segment of a reassembled PDU]"
141,57.845487,192.168.11.25,192.168.11.26,TCP,66,0.000091,,,"40810  >  6000 [FIN, ACK] Seq=28 Ack=1 Win=64256 Len=0 TSval=740801612 TSecr=935868077"
142,57.854693,192.168.11.26,192.168.11.25,TCP,66,0.009206,,,6000  >  40810 [ACK] Seq=1 Ack=28 Win=65152 Len=0 TSval=935868087 TSecr=740801612
143,57.85507,192.168.11.26,192.168.11.25,TCP,66,0.000377,,,"6000  >  40810 [FIN, ACK] Seq=1 Ack=29 Win=65152 Len=0 TSval=935868088 TSecr=740801612"
144,57.855125,192.168.11.25,192.168.11.26,TCP,66,0.000055,,,40810  >  6000 [ACK] Seq=29 Ack=2 Win=64256 Len=0 TSval=740801622 TSecr=935868088
145,57.883871,192.168.11.25,255.255.255.255,UDP,209,0.028746,Ÿ,7b2273656d616e74696373223a207b22656e74697479223a2022504944222c202262617365656e74697479223a2022616e79222c2022726f6c65223a20226d6d6d222c20227370617469616c223a2022616e79222c202274656d706f72616c223a2022616e79227d2c20226461746170726f7065727479223a207b22666f726d6174223a2022696e616f6b615f70726f6772616d5f73616d706c655f73656d616e746963227d7d,59082  >  7000 Len=167
146,57.889514,192.168.11.4,192.168.11.25,TCP,74,0.005643,œ,,36562  >  6000 [SYN] Seq=0 Win=64240 Len=0 MSS=1460 SACK_PERM TSval=3164270480 TSecr=0 WS=128
147,57.889622,192.168.11.25,192.168.11.4,TCP,74,0.000108,,,"6000  >  36562 [SYN, ACK] Seq=0 Ack=1 Win=65160 Len=0 MSS=1460 SACK_PERM TSval=3047307708 TSecr=3164270480 WS=128"
148,57.896184,192.168.11.4,192.168.11.25,TCP,66,0.006562,,,36562  >  6000 [ACK] Seq=1 Ack=1 Win=64256 Len=0 TSval=3164270486 TSecr=3047307708
149,57.896738,192.168.11.4,192.168.11.25,TCP,93,0.000554,,,"36562  >  6000 [PSH, ACK] Seq=1 Ack=1 Win=64256 Len=27 TSval=3164270487 TSecr=3047307708 [TCP segment of a reassembled PDU]"
150,57.896807,192.168.11.25,192.168.11.4,TCP,66,0.000069,,,6000  >  36562 [ACK] Seq=1 Ack=28 Win=65152 Len=0 TSval=3047307715 TSecr=3164270487
151,57.896876,192.168.11.4,192.168.11.25,TCP,66,0.000069,,,"36562  >  6000 [FIN, ACK] Seq=28 Ack=1 Win=64256 Len=0 TSval=3164270487 TSecr=3047307708"
152,57.898689,192.168.11.25,192.168.11.4,TCP,66,0.001813,,,"6000  >  36562 [FIN, ACK] Seq=1 Ack=29 Win=65152 Len=0 TSval=3047307716 TSecr=3164270487"
153,57.903223,192.168.11.4,192.168.11.25,TCP,66,0.004534,,,36562  >  6000 [ACK] Seq=29 Ack=2 Win=64256 Len=0 TSval=3164270494 TSecr=3047307716
154,64.967495,192.168.11.25,192.168.11.26,TCP,74,7.064272,,,46112  >  6000 [SYN] Seq=0 Win=64240 Len=0 MSS=1460 SACK_PERM TSval=740808734 TSecr=0 WS=128
155,64.977781,192.168.11.26,192.168.11.25,TCP,74,0.010286,,,"6000  >  46112 [SYN, ACK] Seq=0 Ack=1 Win=65160 Len=0 MSS=1460 SACK_PERM TSval=935875210 TSecr=740808734 WS=128"
156,64.977871,192.168.11.25,192.168.11.26,TCP,66,0.00009,,,46112  >  6000 [ACK] Seq=1 Ack=1 Win=64256 Len=0 TSval=740808745 TSecr=935875210
157,64.978033,192.168.11.25,192.168.11.26,TCP,93,0.000162,,,"46112  >  6000 [PSH, ACK] Seq=1 Ack=1 Win=64256 Len=27 TSval=740808745 TSecr=935875210 [TCP segment of a reassembled PDU]"
158,64.978135,192.168.11.25,192.168.11.26,TCP,66,0.000102,,,"46112  >  6000 [FIN, ACK] Seq=28 Ack=1 Win=64256 Len=0 TSval=740808745 TSecr=935875210"
159,64.987363,192.168.11.26,192.168.11.25,TCP,66,0.009228,,,6000  >  46112 [ACK] Seq=1 Ack=28 Win=65152 Len=0 TSval=935875219 TSecr=740808745
160,64.987753,192.168.11.26,192.168.11.25,TCP,66,0.00039,,,[TCP Dup ACK 159#1] 6000  >  46112 [ACK] Seq=1 Ack=28 Win=65152 Len=0 TSval=935875220 TSecr=740808745
161,64.987801,192.168.11.26,192.168.11.25,TCP,66,0.000048,,,"6000  >  46112 [FIN, ACK] Seq=1 Ack=29 Win=65152 Len=0 TSval=935875222 TSecr=740808745"
162,64.987852,192.168.11.25,192.168.11.26,TCP,66,0.000051,,,46112  >  6000 [ACK] Seq=29 Ack=2 Win=64256 Len=0 TSval=740808755 TSecr=935875222
163,65.015787,192.168.11.25,255.255.255.255,UDP,209,0.027935,Ÿ,7b2273656d616e74696373223a207b22656e74697479223a2022504944222c202262617365656e74697479223a2022616e79222c2022726f6c65223a20226d6d6d222c20227370617469616c223a2022616e79222c202274656d706f72616c223a2022616e79227d2c20226461746170726f7065727479223a207b22666f726d6174223a2022696e616f6b615f70726f6772616d5f73616d706c655f73656d616e746963227d7d,42748  >  7000 Len=167
164,65.021396,192.168.11.4,192.168.11.25,TCP,74,0.005609,œ,,53586  >  6000 [SYN] Seq=0 Win=64240 Len=0 MSS=1460 SACK_PERM TSval=3164277612 TSecr=0 WS=128
165,65.021497,192.168.11.25,192.168.11.4,TCP,74,0.000101,,,"6000  >  53586 [SYN, ACK] Seq=0 Ack=1 Win=65160 Len=0 MSS=1460 SACK_PERM TSval=3047314839 TSecr=3164277612 WS=128"
166,65.028069,192.168.11.4,192.168.11.25,TCP,66,0.006572,,,53586  >  6000 [ACK] Seq=1 Ack=1 Win=64256 Len=0 TSval=3164277618 TSecr=3047314839
167,65.029045,192.168.11.4,192.168.11.25,TCP,93,0.000976,,,"53586  >  6000 [PSH, ACK] Seq=1 Ack=1 Win=64256 Len=27 TSval=3164277618 TSecr=3047314839 [TCP segment of a reassembled PDU]"
168,65.029157,192.168.11.25,192.168.11.4,TCP,66,0.000112,,,6000  >  53586 [ACK] Seq=1 Ack=28 Win=65152 Len=0 TSval=3047314847 TSecr=3164277618
169,65.029236,192.168.11.4,192.168.11.25,TCP,66,0.000079,,,"53586  >  6000 [FIN, ACK] Seq=28 Ack=1 Win=64256 Len=0 TSval=3164277618 TSecr=3047314839"
170,65.030804,192.168.11.25,192.168.11.4,TCP,66,0.001568,,,"6000  >  53586 [FIN, ACK] Seq=1 Ack=29 Win=65152 Len=0 TSval=3047314849 TSecr=3164277618"
171,65.035422,192.168.11.4,192.168.11.25,TCP,66,0.004618,,,53586  >  6000 [ACK] Seq=29 Ack=2 Win=64256 Len=0 TSval=3164277626 TSecr=3047314849
172,110.661477,192.168.11.25,192.168.11.26,TCP,74,45.626055,,,36476  >  6000 [SYN] Seq=0 Win=64240 Len=0 MSS=1460 SACK_PERM TSval=740854428 TSecr=0 WS=128
173,110.671068,192.168.11.26,192.168.11.25,TCP,74,0.009591,,,"6000  >  36476 [SYN, ACK] Seq=0 Ack=1 Win=65160 Len=0 MSS=1460 SACK_PERM TSval=935920903 TSecr=740854428 WS=128"
174,110.671166,192.168.11.25,192.168.11.26,TCP,66,0.000098,,,36476  >  6000 [ACK] Seq=1 Ack=1 Win=64256 Len=0 TSval=740854438 TSecr=935920903
175,110.671396,192.168.11.25,192.168.11.26,TCP,93,0.00023,,,"36476  >  6000 [PSH, ACK] Seq=1 Ack=1 Win=64256 Len=27 TSval=740854438 TSecr=935920903 [TCP segment of a reassembled PDU]"
176,110.671508,192.168.11.25,192.168.11.26,TCP,66,0.000112,,,"36476  >  6000 [FIN, ACK] Seq=28 Ack=1 Win=64256 Len=0 TSval=740854438 TSecr=935920903"
177,110.681353,192.168.11.26,192.168.11.25,TCP,66,0.009845,,,6000  >  36476 [ACK] Seq=1 Ack=28 Win=65152 Len=0 TSval=935920913 TSecr=740854438
178,110.681736,192.168.11.26,192.168.11.25,TCP,66,0.000383,,,[TCP Dup ACK 177#1] 6000  >  36476 [ACK] Seq=1 Ack=28 Win=65152 Len=0 TSval=935920914 TSecr=740854438
179,110.681786,192.168.11.26,192.168.11.25,TCP,66,0.00005,,,"6000  >  36476 [FIN, ACK] Seq=1 Ack=29 Win=65152 Len=0 TSval=935920916 TSecr=740854438"
180,110.681833,192.168.11.25,192.168.11.26,TCP,66,0.000047,,,36476  >  6000 [ACK] Seq=29 Ack=2 Win=64256 Len=0 TSval=740854449 TSecr=935920916
181,110.711661,192.168.11.25,255.255.255.255,UDP,209,0.029828,Ÿ,7b2273656d616e74696373223a207b22656e74697479223a2022504944222c202262617365656e74697479223a2022616e79222c2022726f6c65223a20226d6d6d222c20227370617469616c223a2022616e79222c202274656d706f72616c223a2022616e79227d2c20226461746170726f7065727479223a207b22666f726d6174223a2022696e616f6b615f70726f6772616d5f73616d706c655f73656d616e746963227d7d,38523  >  7000 Len=167
182,110.71815,192.168.11.4,192.168.11.25,TCP,74,0.006489,œ,,51720  >  6000 [SYN] Seq=0 Win=64240 Len=0 MSS=1460 SACK_PERM TSval=3164323307 TSecr=0 WS=128
183,110.718265,192.168.11.25,192.168.11.4,TCP,74,0.000115,,,"6000  >  51720 [SYN, ACK] Seq=0 Ack=1 Win=65160 Len=0 MSS=1460 SACK_PERM TSval=3047360536 TSecr=3164323307 WS=128"
184,110.724893,192.168.11.4,192.168.11.25,TCP,66,0.006628,,,51720  >  6000 [ACK] Seq=1 Ack=1 Win=64256 Len=0 TSval=3164323315 TSecr=3047360536
185,110.72545,192.168.11.4,192.168.11.25,TCP,93,0.000557,,,"51720  >  6000 [PSH, ACK] Seq=1 Ack=1 Win=64256 Len=27 TSval=3164323315 TSecr=3047360536 [TCP segment of a reassembled PDU]"
186,110.725557,192.168.11.25,192.168.11.4,TCP,66,0.000107,,,6000  >  51720 [ACK] Seq=1 Ack=28 Win=65152 Len=0 TSval=3047360543 TSecr=3164323315
187,110.725633,192.168.11.4,192.168.11.25,TCP,66,0.000076,,,"51720  >  6000 [FIN, ACK] Seq=28 Ack=1 Win=64256 Len=0 TSval=3164323315 TSecr=3047360536"
188,110.726882,192.168.11.25,192.168.11.4,TCP,66,0.001249,,,"6000  >  51720 [FIN, ACK] Seq=1 Ack=29 Win=65152 Len=0 TSval=3047360545 TSecr=3164323315"
189,110.73272,192.168.11.4,192.168.11.25,TCP,66,0.005838,,,51720  >  6000 [ACK] Seq=29 Ack=2 Win=64256 Len=0 TSval=3164323323 TSecr=3047360545
190,117.790509,192.168.11.25,192.168.11.26,TCP,74,7.057789,,,51852  >  6000 [SYN] Seq=0 Win=64240 Len=0 MSS=1460 SACK_PERM TSval=740861557 TSecr=0 WS=128
191,117.79987,192.168.11.26,192.168.11.25,TCP,74,0.009361,,,"6000  >  51852 [SYN, ACK] Seq=0 Ack=1 Win=65160 Len=0 MSS=1460 SACK_PERM TSval=935928033 TSecr=740861557 WS=128"
192,117.799966,192.168.11.25,192.168.11.26,TCP,66,0.000096,,,51852  >  6000 [ACK] Seq=1 Ack=1 Win=64256 Len=0 TSval=740861567 TSecr=935928033
193,117.800161,192.168.11.25,192.168.11.26,TCP,93,0.000195,,,"51852  >  6000 [PSH, ACK] Seq=1 Ack=1 Win=64256 Len=27 TSval=740861567 TSecr=935928033 [TCP segment of a reassembled PDU]"
194,117.800262,192.168.11.25,192.168.11.26,TCP,66,0.000101,,,"51852  >  6000 [FIN, ACK] Seq=28 Ack=1 Win=64256 Len=0 TSval=740861567 TSecr=935928033"
195,117.80818,192.168.11.26,192.168.11.25,TCP,66,0.007918,,,6000  >  51852 [ACK] Seq=1 Ack=28 Win=65152 Len=0 TSval=935928041 TSecr=740861567
196,117.808405,192.168.11.26,192.168.11.25,TCP,66,0.000225,,,[TCP Dup ACK 195#1] 6000  >  51852 [ACK] Seq=1 Ack=28 Win=65152 Len=0 TSval=935928041 TSecr=740861567
197,117.811794,192.168.11.26,192.168.11.25,TCP,66,0.003389,,,"6000  >  51852 [FIN, ACK] Seq=1 Ack=29 Win=65152 Len=0 TSval=935928044 TSecr=740861567"
198,117.811839,192.168.11.25,192.168.11.26,TCP,66,0.000045,,,51852  >  6000 [ACK] Seq=29 Ack=2 Win=64256 Len=0 TSval=740861579 TSecr=935928044
199,117.840733,192.168.11.25,255.255.255.255,UDP,209,0.028894,Ÿ,7b2273656d616e74696373223a207b22656e74697479223a2022504944222c202262617365656e74697479223a2022616e79222c2022726f6c65223a20226d6d6d222c20227370617469616c223a2022616e79222c202274656d706f72616c223a2022616e79227d2c20226461746170726f7065727479223a207b22666f726d6174223a2022696e616f6b615f70726f6772616d5f73616d706c655f73656d616e746963227d7d,34645  >  7000 Len=167
200,117.847349,192.168.11.4,192.168.11.25,TCP,74,0.006616,œ,,56742  >  6000 [SYN] Seq=0 Win=64240 Len=0 MSS=1460 SACK_PERM TSval=3164330436 TSecr=0 WS=128
201,117.847471,192.168.11.25,192.168.11.4,TCP,74,0.000122,,,"6000  >  56742 [SYN, ACK] Seq=0 Ack=1 Win=65160 Len=0 MSS=1460 SACK_PERM TSval=3047367665 TSecr=3164330436 WS=128"
202,117.85421,192.168.11.4,192.168.11.25,TCP,66,0.006739,,,56742  >  6000 [ACK] Seq=1 Ack=1 Win=64256 Len=0 TSval=3164330444 TSecr=3047367665
203,117.854866,192.168.11.4,192.168.11.25,TCP,93,0.000656,,,"56742  >  6000 [PSH, ACK] Seq=1 Ack=1 Win=64256 Len=27 TSval=3164330444 TSecr=3047367665 [TCP segment of a reassembled PDU]"
204,117.854946,192.168.11.25,192.168.11.4,TCP,66,0.00008,,,6000  >  56742 [ACK] Seq=1 Ack=28 Win=65152 Len=0 TSval=3047367673 TSecr=3164330444
205,117.855027,192.168.11.4,192.168.11.25,TCP,66,0.000081,,,"56742  >  6000 [FIN, ACK] Seq=28 Ack=1 Win=64256 Len=0 TSval=3164330444 TSecr=3047367665"
206,117.856151,192.168.11.25,192.168.11.4,TCP,66,0.001124,,,"6000  >  56742 [FIN, ACK] Seq=1 Ack=29 Win=65152 Len=0 TSval=3047367674 TSecr=3164330444"
207,117.862362,192.168.11.4,192.168.11.25,TCP,66,0.006211,,,56742  >  6000 [ACK] Seq=29 Ack=2 Win=64256 Len=0 TSval=3164330452 TSecr=3047367674
208,125.026946,192.168.11.25,192.168.11.26,TCP,74,7.164584,,,46686  >  6000 [SYN] Seq=0 Win=64240 Len=0 MSS=1460 SACK_PERM TSval=740868794 TSecr=0 WS=128
209,125.036196,192.168.11.26,192.168.11.25,TCP,74,0.00925,,,"6000  >  46686 [SYN, ACK] Seq=0 Ack=1 Win=65160 Len=0 MSS=1460 SACK_PERM TSval=935935269 TSecr=740868794 WS=128"
210,125.036303,192.168.11.25,192.168.11.26,TCP,66,0.000107,,,46686  >  6000 [ACK] Seq=1 Ack=1 Win=64256 Len=0 TSval=740868803 TSecr=935935269
211,125.036435,192.168.11.25,192.168.11.26,TCP,93,0.000132,,,"46686  >  6000 [PSH, ACK] Seq=1 Ack=1 Win=64256 Len=27 TSval=740868803 TSecr=935935269 [TCP segment of a reassembled PDU]"
212,125.036539,192.168.11.25,192.168.11.26,TCP,66,0.000104,,,"46686  >  6000 [FIN, ACK] Seq=28 Ack=1 Win=64256 Len=0 TSval=740868803 TSecr=935935269"
213,125.046866,192.168.11.26,192.168.11.25,TCP,66,0.010327,,,6000  >  46686 [ACK] Seq=1 Ack=28 Win=65152 Len=0 TSval=935935279 TSecr=740868803
214,125.047252,192.168.11.26,192.168.11.25,TCP,66,0.000386,,,[TCP Dup ACK 213#1] 6000  >  46686 [ACK] Seq=1 Ack=28 Win=65152 Len=0 TSval=935935279 TSecr=740868803
215,125.0473,192.168.11.26,192.168.11.25,TCP,66,0.000048,,,"6000  >  46686 [FIN, ACK] Seq=1 Ack=29 Win=65152 Len=0 TSval=935935281 TSecr=740868803"
216,125.047356,192.168.11.25,192.168.11.26,TCP,66,0.000056,,,46686  >  6000 [ACK] Seq=29 Ack=2 Win=64256 Len=0 TSval=740868814 TSecr=935935281
217,125.07919,192.168.11.25,255.255.255.255,UDP,209,0.031834,Ÿ,7b2273656d616e74696373223a207b22656e74697479223a2022504944222c202262617365656e74697479223a2022616e79222c2022726f6c65223a20226d6d6d222c20227370617469616c223a2022616e79222c202274656d706f72616c223a2022616e79227d2c20226461746170726f7065727479223a207b22666f726d6174223a2022696e616f6b615f70726f6772616d5f73616d706c655f73656d616e746963227d7d,35422  >  7000 Len=167
218,125.085678,192.168.11.4,192.168.11.25,TCP,74,0.006488,œ,,39492  >  6000 [SYN] Seq=0 Win=64240 Len=0 MSS=1460 SACK_PERM TSval=3164337675 TSecr=0 WS=128
219,125.085798,192.168.11.25,192.168.11.4,TCP,74,0.00012,,,"6000  >  39492 [SYN, ACK] Seq=0 Ack=1 Win=65160 Len=0 MSS=1460 SACK_PERM TSval=3047374904 TSecr=3164337675 WS=128"
220,125.099087,192.168.11.4,192.168.11.25,TCP,66,0.013289,,,39492  >  6000 [ACK] Seq=1 Ack=1 Win=64256 Len=0 TSval=3164337682 TSecr=3047374904
221,125.099532,192.168.11.4,192.168.11.25,TCP,93,0.000445,,,"39492  >  6000 [PSH, ACK] Seq=1 Ack=1 Win=64256 Len=27 TSval=3164337683 TSecr=3047374904 [TCP segment of a reassembled PDU]"
222,125.099606,192.168.11.25,192.168.11.4,TCP,66,0.000074,,,6000  >  39492 [ACK] Seq=1 Ack=28 Win=65152 Len=0 TSval=3047374917 TSecr=3164337683
223,125.099664,192.168.11.4,192.168.11.25,TCP,66,0.000058,,,"39492  >  6000 [FIN, ACK] Seq=28 Ack=1 Win=64256 Len=0 TSval=3164337683 TSecr=3047374904"
224,125.100435,192.168.11.25,192.168.11.4,TCP,66,0.000771,,,"6000  >  39492 [FIN, ACK] Seq=1 Ack=29 Win=65152 Len=0 TSval=3047374918 TSecr=3164337683"
225,125.106685,192.168.11.4,192.168.11.25,TCP,66,0.00625,,,39492  >  6000 [ACK] Seq=29 Ack=2 Win=64256 Len=0 TSval=3164337697 TSecr=3047374918
226,132.21198,192.168.11.25,192.168.11.26,TCP,74,7.105295,,,49728  >  6000 [SYN] Seq=0 Win=64240 Len=0 MSS=1460 SACK_PERM TSval=740875979 TSecr=0 WS=128
227,132.222348,192.168.11.26,192.168.11.25,TCP,74,0.010368,,,"6000  >  49728 [SYN, ACK] Seq=0 Ack=1 Win=65160 Len=0 MSS=1460 SACK_PERM TSval=935942454 TSecr=740875979 WS=128"
228,132.222466,192.168.11.25,192.168.11.26,TCP,66,0.000118,,,49728  >  6000 [ACK] Seq=1 Ack=1 Win=64256 Len=0 TSval=740875989 TSecr=935942454
229,132.222647,192.168.11.25,192.168.11.26,TCP,93,0.000181,,,"49728  >  6000 [PSH, ACK] Seq=1 Ack=1 Win=64256 Len=27 TSval=740875990 TSecr=935942454 [TCP segment of a reassembled PDU]"
230,132.222756,192.168.11.25,192.168.11.26,TCP,66,0.000109,,,"49728  >  6000 [FIN, ACK] Seq=28 Ack=1 Win=64256 Len=0 TSval=740875990 TSecr=935942454"
231,132.23082,192.168.11.26,192.168.11.25,TCP,66,0.008064,,,6000  >  49728 [ACK] Seq=1 Ack=28 Win=65152 Len=0 TSval=935942464 TSecr=740875990
232,132.231062,192.168.11.26,192.168.11.25,TCP,66,0.000242,,,"6000  >  49728 [FIN, ACK] Seq=1 Ack=29 Win=65152 Len=0 TSval=935942465 TSecr=740875990"
233,132.231112,192.168.11.25,192.168.11.26,TCP,66,0.00005,,,49728  >  6000 [ACK] Seq=29 Ack=2 Win=64256 Len=0 TSval=740875998 TSecr=935942465
