No.,Time,Source,Destination,Protocol,Length,Time delta from previous captured frame,XXX,Data,Info
1,0,192.168.11.17,192.168.11.16,TCP,74,0,,,50096  >  6000 [SYN] Seq=0 Win=64240 Len=0 MSS=1460 SACK_PERM TSval=473585676 TSecr=0 WS=128
2,0.006832,192.168.11.16,192.168.11.17,TCP,74,0.006832,,,"6000  >  50096 [SYN, ACK] Seq=0 Ack=1 Win=65160 Len=0 MSS=1460 SACK_PERM TSval=1369564374 TSecr=473585676 WS=128"
3,0.006947,192.168.11.17,192.168.11.16,TCP,66,0.000115,,,50096  >  6000 [ACK] Seq=1 Ack=1 Win=64256 Len=0 TSval=473585685 TSecr=1369564374
4,0.007114,192.168.11.17,192.168.11.16,TCP,93,0.000167,,,"50096  >  6000 [PSH, ACK] Seq=1 Ack=1 Win=64256 Len=27 TSval=473585686 TSecr=1369564374 [TCP segment of a reassembled PDU]"
5,0.007251,192.168.11.17,192.168.11.16,TCP,66,0.000137,,,"50096  >  6000 [FIN, ACK] Seq=28 Ack=1 Win=64256 Len=0 TSval=473585686 TSecr=1369564374"
6,0.014568,192.168.11.16,192.168.11.17,TCP,66,0.007317,,,6000  >  50096 [ACK] Seq=1 Ack=28 Win=65152 Len=0 TSval=1369564382 TSecr=473585686
7,0.01479,192.168.11.16,192.168.11.17,TCP,66,0.000222,,,"6000  >  50096 [FIN, ACK] Seq=1 Ack=29 Win=65152 Len=0 TSval=1369564384 TSecr=473585686"
8,0.014834,192.168.11.17,192.168.11.16,TCP,66,0.000044,,,50096  >  6000 [ACK] Seq=29 Ack=2 Win=64256 Len=0 TSval=473585693 TSecr=1369564384
9,0.046687,192.168.11.17,255.255.255.255,UDP,209,0.031853,Ÿ,7b2273656d616e74696373223a207b22656e74697479223a2022504944222c202262617365656e74697479223a2022616e79222c2022726f6c65223a2022727272222c20227370617469616c223a2022616e79222c202274656d706f72616c223a2022616e79227d2c20226461746170726f7065727479223a207b22666f726d6174223a2022696e616f6b615f70726f6772616d5f73616d706c655f73656d616e746963227d7d,46149  >  7000 Len=167
10,0.057893,192.168.11.19,192.168.11.17,TCP,74,0.011206,œ,,59248  >  6000 [SYN] Seq=0 Win=64240 Len=0 MSS=1460 SACK_PERM TSval=3095568872 TSecr=0 WS=128
11,0.05805,192.168.11.17,192.168.11.19,TCP,74,0.000157,,,"6000  >  59248 [SYN, ACK] Seq=0 Ack=1 Win=65160 Len=0 MSS=1460 SACK_PERM TSval=2630027857 TSecr=3095568872 WS=128"
12,0.073927,192.168.11.19,192.168.11.17,TCP,66,0.015877,,,59248  >  6000 [ACK] Seq=1 Ack=1 Win=64256 Len=0 TSval=3095568884 TSecr=2630027857
13,0.074667,192.168.11.19,192.168.11.17,TCP,93,0.00074,,,"59248  >  6000 [PSH, ACK] Seq=1 Ack=1 Win=64256 Len=27 TSval=3095568884 TSecr=2630027857 [TCP segment of a reassembled PDU]"
14,0.074831,192.168.11.17,192.168.11.19,TCP,66,0.000164,,,6000  >  59248 [ACK] Seq=1 Ack=28 Win=65152 Len=0 TSval=2630027874 TSecr=3095568884
15,0.07493,192.168.11.19,192.168.11.17,TCP,66,0.000099,,,"59248  >  6000 [FIN, ACK] Seq=28 Ack=1 Win=64256 Len=0 TSval=3095568884 TSecr=2630027857"
16,0.076372,192.168.11.17,192.168.11.19,TCP,66,0.001442,,,"6000  >  59248 [FIN, ACK] Seq=1 Ack=29 Win=65152 Len=0 TSval=2630027876 TSecr=3095568884"
17,0.082053,192.168.11.19,192.168.11.17,TCP,66,0.005681,,,59248  >  6000 [ACK] Seq=29 Ack=2 Win=64256 Len=0 TSval=3095568901 TSecr=2630027876
18,7.312803,192.168.11.17,192.168.11.16,TCP,74,7.23075,,,50106  >  6000 [SYN] Seq=0 Win=64240 Len=0 MSS=1460 SACK_PERM TSval=473592991 TSecr=0 WS=128
19,7.32017,192.168.11.16,192.168.11.17,TCP,74,0.007367,,,"6000  >  50106 [SYN, ACK] Seq=0 Ack=1 Win=65160 Len=0 MSS=1460 SACK_PERM TSval=1369571687 TSecr=473592991 WS=128"
20,7.320277,192.168.11.17,192.168.11.16,TCP,66,0.000107,,,50106  >  6000 [ACK] Seq=1 Ack=1 Win=64256 Len=0 TSval=473592999 TSecr=1369571687
21,7.320416,192.168.11.17,192.168.11.16,TCP,93,0.000139,,,"50106  >  6000 [PSH, ACK] Seq=1 Ack=1 Win=64256 Len=27 TSval=473592999 TSecr=1369571687 [TCP segment of a reassembled PDU]"
22,7.320543,192.168.11.17,192.168.11.16,TCP,66,0.000127,,,"50106  >  6000 [FIN, ACK] Seq=28 Ack=1 Win=64256 Len=0 TSval=473592999 TSecr=1369571687"
23,7.327734,192.168.11.16,192.168.11.17,TCP,66,0.007191,,,6000  >  50106 [ACK] Seq=1 Ack=28 Win=65152 Len=0 TSval=1369571695 TSecr=473592999
24,7.327947,192.168.11.16,192.168.11.17,TCP,66,0.000213,,,"6000  >  50106 [FIN, ACK] Seq=1 Ack=29 Win=65152 Len=0 TSval=1369571696 TSecr=473592999"
25,7.327991,192.168.11.17,192.168.11.16,TCP,66,0.000044,,,50106  >  6000 [ACK] Seq=29 Ack=2 Win=64256 Len=0 TSval=473593006 TSecr=1369571696
26,7.357021,192.168.11.17,255.255.255.255,UDP,209,0.02903,Ÿ,7b2273656d616e74696373223a207b22656e74697479223a2022504944222c202262617365656e74697479223a2022616e79222c2022726f6c65223a2022727272222c20227370617469616c223a2022616e79222c202274656d706f72616c223a2022616e79227d2c20226461746170726f7065727479223a207b22666f726d6174223a2022696e616f6b615f70726f6772616d5f73616d706c655f73656d616e746963227d7d,52134  >  7000 Len=167
27,7.362986,192.168.11.19,192.168.11.17,TCP,74,0.005965,œ,,49036  >  6000 [SYN] Seq=0 Win=64240 Len=0 MSS=1460 SACK_PERM TSval=3095576182 TSecr=0 WS=128
28,7.36313,192.168.11.17,192.168.11.19,TCP,74,0.000144,,,"6000  >  49036 [SYN, ACK] Seq=0 Ack=1 Win=65160 Len=0 MSS=1460 SACK_PERM TSval=2630035163 TSecr=3095576182 WS=128"
29,7.369835,192.168.11.19,192.168.11.17,TCP,66,0.006705,,,49036  >  6000 [ACK] Seq=1 Ack=1 Win=64256 Len=0 TSval=3095576189 TSecr=2630035163
30,7.370417,192.168.11.19,192.168.11.17,TCP,93,0.000582,,,"49036  >  6000 [PSH, ACK] Seq=1 Ack=1 Win=64256 Len=27 TSval=3095576189 TSecr=2630035163 [TCP segment of a reassembled PDU]"
31,7.370497,192.168.11.17,192.168.11.19,TCP,66,0.00008,,,6000  >  49036 [ACK] Seq=1 Ack=28 Win=65152 Len=0 TSval=2630035170 TSecr=3095576189
32,7.370576,192.168.11.19,192.168.11.17,TCP,66,0.000079,,,"49036  >  6000 [FIN, ACK] Seq=28 Ack=1 Win=64256 Len=0 TSval=3095576189 TSecr=2630035163"
33,7.371633,192.168.11.17,192.168.11.19,TCP,66,0.001057,,,"6000  >  49036 [FIN, ACK] Seq=1 Ack=29 Win=65152 Len=0 TSval=2630035171 TSecr=3095576189"
34,7.377911,192.168.11.19,192.168.11.17,TCP,66,0.006278,,,49036  >  6000 [ACK] Seq=29 Ack=2 Win=64256 Len=0 TSval=3095576197 TSecr=2630035171
35,14.653897,192.168.11.17,192.168.11.16,TCP,74,7.275986,,,38218  >  6000 [SYN] Seq=0 Win=64240 Len=0 MSS=1460 SACK_PERM TSval=473600332 TSecr=0 WS=128
36,14.663739,192.168.11.16,192.168.11.17,TCP,74,0.009842,,,"6000  >  38218 [SYN, ACK] Seq=0 Ack=1 Win=65160 Len=0 MSS=1460 SACK_PERM TSval=1369579028 TSecr=473600332 WS=128"
37,14.663843,192.168.11.17,192.168.11.16,TCP,66,0.000104,,,38218  >  6000 [ACK] Seq=1 Ack=1 Win=64256 Len=0 TSval=473600342 TSecr=1369579028
38,14.663977,192.168.11.17,192.168.11.16,TCP,93,0.000134,,,"38218  >  6000 [PSH, ACK] Seq=1 Ack=1 Win=64256 Len=27 TSval=473600342 TSecr=1369579028 [TCP segment of a reassembled PDU]"
39,14.664092,192.168.11.17,192.168.11.16,TCP,66,0.000115,,,"38218  >  6000 [FIN, ACK] Seq=28 Ack=1 Win=64256 Len=0 TSval=473600342 TSecr=1369579028"
40,14.671126,192.168.11.16,192.168.11.17,TCP,66,0.007034,,,6000  >  38218 [ACK] Seq=1 Ack=28 Win=65152 Len=0 TSval=1369579038 TSecr=473600342
41,14.671384,192.168.11.16,192.168.11.17,TCP,66,0.000258,,,"6000  >  38218 [FIN, ACK] Seq=1 Ack=29 Win=65152 Len=0 TSval=1369579039 TSecr=473600342"
42,14.67143,192.168.11.17,192.168.11.16,TCP,66,0.000046,,,38218  >  6000 [ACK] Seq=29 Ack=2 Win=64256 Len=0 TSval=473600350 TSecr=1369579039
43,14.703187,192.168.11.17,255.255.255.255,UDP,209,0.031757,Ÿ,7b2273656d616e74696373223a207b22656e74697479223a2022504944222c202262617365656e74697479223a2022616e79222c2022726f6c65223a2022727272222c20227370617469616c223a2022616e79222c202274656d706f72616c223a2022616e79227d2c20226461746170726f7065727479223a207b22666f726d6174223a2022696e616f6b615f70726f6772616d5f73616d706c655f73656d616e746963227d7d,58560  >  7000 Len=167
44,14.71007,192.168.11.19,192.168.11.17,TCP,74,0.006883,œ,,39316  >  6000 [SYN] Seq=0 Win=64240 Len=0 MSS=1460 SACK_PERM TSval=3095583528 TSecr=0 WS=128
45,14.710233,192.168.11.17,192.168.11.19,TCP,74,0.000163,,,"6000  >  39316 [SYN, ACK] Seq=0 Ack=1 Win=65160 Len=0 MSS=1460 SACK_PERM TSval=2630042510 TSecr=3095583528 WS=128"
46,14.725864,192.168.11.19,192.168.11.17,TCP,66,0.015631,,,39316  >  6000 [ACK] Seq=1 Ack=1 Win=64256 Len=0 TSval=3095583536 TSecr=2630042510
47,14.726298,192.168.11.19,192.168.11.17,TCP,93,0.000434,,,"39316  >  6000 [PSH, ACK] Seq=1 Ack=1 Win=64256 Len=27 TSval=3095583536 TSecr=2630042510 [TCP segment of a reassembled PDU]"
48,14.72642,192.168.11.17,192.168.11.19,TCP,66,0.000122,,,6000  >  39316 [ACK] Seq=1 Ack=28 Win=65152 Len=0 TSval=2630042526 TSecr=3095583536
49,14.726684,192.168.11.19,192.168.11.17,TCP,66,0.000264,,,"39316  >  6000 [FIN, ACK] Seq=28 Ack=1 Win=64256 Len=0 TSval=3095583536 TSecr=2630042510"
50,14.728167,192.168.11.17,192.168.11.19,TCP,66,0.001483,,,"6000  >  39316 [FIN, ACK] Seq=1 Ack=29 Win=65152 Len=0 TSval=2630042528 TSecr=3095583536"
51,14.733779,192.168.11.19,192.168.11.17,TCP,66,0.005612,,,39316  >  6000 [ACK] Seq=29 Ack=2 Win=64256 Len=0 TSval=3095583553 TSecr=2630042528
52,21.850382,192.168.11.17,192.168.11.16,TCP,74,7.116603,,,43158  >  6000 [SYN] Seq=0 Win=64240 Len=0 MSS=1460 SACK_PERM TSval=473607529 TSecr=0 WS=128
53,21.858909,192.168.11.16,192.168.11.17,TCP,74,0.008527,,,"6000  >  43158 [SYN, ACK] Seq=0 Ack=1 Win=65160 Len=0 MSS=1460 SACK_PERM TSval=1369586225 TSecr=473607529 WS=128"
54,21.859011,192.168.11.17,192.168.11.16,TCP,66,0.000102,,,43158  >  6000 [ACK] Seq=1 Ack=1 Win=64256 Len=0 TSval=473607537 TSecr=1369586225
55,21.859144,192.168.11.17,192.168.11.16,TCP,93,0.000133,,,"43158  >  6000 [PSH, ACK] Seq=1 Ack=1 Win=64256 Len=27 TSval=473607538 TSecr=1369586225 [TCP segment of a reassembled PDU]"
56,21.859252,192.168.11.17,192.168.11.16,TCP,66,0.000108,,,"43158  >  6000 [FIN, ACK] Seq=28 Ack=1 Win=64256 Len=0 TSval=473607538 TSecr=1369586225"
57,21.867215,192.168.11.16,192.168.11.17,TCP,66,0.007963,,,6000  >  43158 [ACK] Seq=1 Ack=28 Win=65152 Len=0 TSval=1369586234 TSecr=473607538
58,21.867586,192.168.11.16,192.168.11.17,TCP,66,0.000371,,,"6000  >  43158 [FIN, ACK] Seq=1 Ack=29 Win=65152 Len=0 TSval=1369586236 TSecr=473607538"
59,21.867644,192.168.11.17,192.168.11.16,TCP,66,0.000058,,,43158  >  6000 [ACK] Seq=29 Ack=2 Win=64256 Len=0 TSval=473607546 TSecr=1369586236
60,21.903278,192.168.11.17,255.255.255.255,UDP,209,0.035634,Ÿ,7b2273656d616e74696373223a207b22656e74697479223a2022504944222c202262617365656e74697479223a2022616e79222c2022726f6c65223a2022727272222c20227370617469616c223a2022616e79222c202274656d706f72616c223a2022616e79227d2c20226461746170726f7065727479223a207b22666f726d6174223a2022696e616f6b615f70726f6772616d5f73616d706c655f73656d616e746963227d7d,53529  >  7000 Len=167
61,21.909117,192.168.11.19,192.168.11.17,TCP,74,0.005839,œ,,39322  >  6000 [SYN] Seq=0 Win=64240 Len=0 MSS=1460 SACK_PERM TSval=3095590728 TSecr=0 WS=128
62,21.909266,192.168.11.17,192.168.11.19,TCP,74,0.000149,,,"6000  >  39322 [SYN, ACK] Seq=0 Ack=1 Win=65160 Len=0 MSS=1460 SACK_PERM TSval=2630049709 TSecr=3095590728 WS=128"
63,21.916576,192.168.11.19,192.168.11.17,TCP,66,0.00731,,,39322  >  6000 [ACK] Seq=1 Ack=1 Win=64256 Len=0 TSval=3095590735 TSecr=2630049709
64,21.917254,192.168.11.19,192.168.11.17,TCP,93,0.000678,,,"39322  >  6000 [PSH, ACK] Seq=1 Ack=1 Win=64256 Len=27 TSval=3095590736 TSecr=2630049709 [TCP segment of a reassembled PDU]"
65,21.917378,192.168.11.17,192.168.11.19,TCP,66,0.000124,,,6000  >  39322 [ACK] Seq=1 Ack=28 Win=65152 Len=0 TSval=2630049717 TSecr=3095590736
66,21.917468,192.168.11.19,192.168.11.17,TCP,66,0.00009,,,"39322  >  6000 [FIN, ACK] Seq=28 Ack=1 Win=64256 Len=0 TSval=3095590736 TSecr=2630049709"
67,21.91885,192.168.11.17,192.168.11.19,TCP,66,0.001382,,,"6000  >  39322 [FIN, ACK] Seq=1 Ack=29 Win=65152 Len=0 TSval=2630049718 TSecr=3095590736"
68,21.924756,192.168.11.19,192.168.11.17,TCP,66,0.005906,,,39322  >  6000 [ACK] Seq=29 Ack=2 Win=64256 Len=0 TSval=3095590744 TSecr=2630049718
69,29.064742,192.168.11.17,192.168.11.16,TCP,74,7.139986,,,43828  >  6000 [SYN] Seq=0 Win=64240 Len=0 MSS=1460 SACK_PERM TSval=473614743 TSecr=0 WS=128
70,29.072375,192.168.11.16,192.168.11.17,TCP,74,0.007633,,,"6000  >  43828 [SYN, ACK] Seq=0 Ack=1 Win=65160 Len=0 MSS=1460 SACK_PERM TSval=1369593440 TSecr=473614743 WS=128"
71,29.072489,192.168.11.17,192.168.11.16,TCP,66,0.000114,,,43828  >  6000 [ACK] Seq=1 Ack=1 Win=64256 Len=0 TSval=473614751 TSecr=1369593440
72,29.072621,192.168.11.17,192.168.11.16,TCP,93,0.000132,,,"43828  >  6000 [PSH, ACK] Seq=1 Ack=1 Win=64256 Len=27 TSval=473614751 TSecr=1369593440 [TCP segment of a reassembled PDU]"
73,29.072731,192.168.11.17,192.168.11.16,TCP,66,0.00011,,,"43828  >  6000 [FIN, ACK] Seq=28 Ack=1 Win=64256 Len=0 TSval=473614751 TSecr=1369593440"
74,29.080037,192.168.11.16,192.168.11.17,TCP,66,0.007306,,,6000  >  43828 [ACK] Seq=1 Ack=28 Win=65152 Len=0 TSval=1369593447 TSecr=473614751
75,29.084387,192.168.11.16,192.168.11.17,TCP,66,0.00435,,,"6000  >  43828 [FIN, ACK] Seq=1 Ack=29 Win=65152 Len=0 TSval=1369593452 TSecr=473614751"
76,29.084438,192.168.11.17,192.168.11.16,TCP,66,0.000051,,,43828  >  6000 [ACK] Seq=29 Ack=2 Win=64256 Len=0 TSval=473614763 TSecr=1369593452
77,29.113349,192.168.11.17,255.255.255.255,UDP,209,0.028911,Ÿ,7b2273656d616e74696373223a207b22656e74697479223a2022504944222c202262617365656e74697479223a2022616e79222c2022726f6c65223a2022727272222c20227370617469616c223a2022616e79222c202274656d706f72616c223a2022616e79227d2c20226461746170726f7065727479223a207b22666f726d6174223a2022696e616f6b615f70726f6772616d5f73616d706c655f73656d616e746963227d7d,36539  >  7000 Len=167
78,29.118968,192.168.11.19,192.168.11.17,TCP,74,0.005619,œ,,45128  >  6000 [SYN] Seq=0 Win=64240 Len=0 MSS=1460 SACK_PERM TSval=3095597938 TSecr=0 WS=128
79,29.119087,192.168.11.17,192.168.11.19,TCP,74,0.000119,,,"6000  >  45128 [SYN, ACK] Seq=0 Ack=1 Win=65160 Len=0 MSS=1460 SACK_PERM TSval=2630056918 TSecr=3095597938 WS=128"
80,29.125893,192.168.11.19,192.168.11.17,TCP,66,0.006806,,,45128  >  6000 [ACK] Seq=1 Ack=1 Win=64256 Len=0 TSval=3095597945 TSecr=2630056918
81,29.126459,192.168.11.19,192.168.11.17,TCP,93,0.000566,,,"45128  >  6000 [PSH, ACK] Seq=1 Ack=1 Win=64256 Len=27 TSval=3095597945 TSecr=2630056918 [TCP segment of a reassembled PDU]"
82,29.126535,192.168.11.17,192.168.11.19,TCP,66,0.000076,,,6000  >  45128 [ACK] Seq=1 Ack=28 Win=65152 Len=0 TSval=2630056926 TSecr=3095597945
83,29.1266,192.168.11.19,192.168.11.17,TCP,66,0.000065,,,"45128  >  6000 [FIN, ACK] Seq=28 Ack=1 Win=64256 Len=0 TSval=3095597945 TSecr=2630056918"
84,29.127668,192.168.11.17,192.168.11.19,TCP,66,0.001068,,,"6000  >  45128 [FIN, ACK] Seq=1 Ack=29 Win=65152 Len=0 TSval=2630056927 TSecr=3095597945"
85,29.133712,192.168.11.19,192.168.11.17,TCP,66,0.006044,,,45128  >  6000 [ACK] Seq=29 Ack=2 Win=64256 Len=0 TSval=3095597953 TSecr=2630056927
86,36.231841,192.168.11.17,192.168.11.16,TCP,74,7.098129,,,43832  >  6000 [SYN] Seq=0 Win=64240 Len=0 MSS=1460 SACK_PERM TSval=473621910 TSecr=0 WS=128
87,36.238883,192.168.11.16,192.168.11.17,TCP,74,0.007042,,,"6000  >  43832 [SYN, ACK] Seq=0 Ack=1 Win=65160 Len=0 MSS=1460 SACK_PERM TSval=1369600606 TSecr=473621910 WS=128"
88,36.238992,192.168.11.17,192.168.11.16,TCP,66,0.000109,,,43832  >  6000 [ACK] Seq=1 Ack=1 Win=64256 Len=0 TSval=473621917 TSecr=1369600606
89,36.23913,192.168.11.17,192.168.11.16,TCP,93,0.000138,,,"43832  >  6000 [PSH, ACK] Seq=1 Ack=1 Win=64256 Len=27 TSval=473621918 TSecr=1369600606 [TCP segment of a reassembled PDU]"
90,36.239238,192.168.11.17,192.168.11.16,TCP,66,0.000108,,,"43832  >  6000 [FIN, ACK] Seq=28 Ack=1 Win=64256 Len=0 TSval=473621918 TSecr=1369600606"
91,36.246203,192.168.11.16,192.168.11.17,TCP,66,0.006965,,,6000  >  43832 [ACK] Seq=1 Ack=28 Win=65152 Len=0 TSval=1369600613 TSecr=473621918
92,36.246626,192.168.11.16,192.168.11.17,TCP,66,0.000423,,,"6000  >  43832 [FIN, ACK] Seq=1 Ack=29 Win=65152 Len=0 TSval=1369600614 TSecr=473621918"
93,36.246673,192.168.11.17,192.168.11.16,TCP,66,0.000047,,,43832  >  6000 [ACK] Seq=29 Ack=2 Win=64256 Len=0 TSval=473621925 TSecr=1369600614
94,36.275912,192.168.11.17,255.255.255.255,UDP,209,0.029239,Ÿ,7b2273656d616e74696373223a207b22656e74697479223a2022504944222c202262617365656e74697479223a2022616e79222c2022726f6c65223a2022727272222c20227370617469616c223a2022616e79222c202274656d706f72616c223a2022616e79227d2c20226461746170726f7065727479223a207b22666f726d6174223a2022696e616f6b615f70726f6772616d5f73616d706c655f73656d616e746963227d7d,56642  >  7000 Len=167
95,36.281876,192.168.11.19,192.168.11.17,TCP,74,0.005964,œ,,59510  >  6000 [SYN] Seq=0 Win=64240 Len=0 MSS=1460 SACK_PERM TSval=3095605101 TSecr=0 WS=128
96,36.282027,192.168.11.17,192.168.11.19,TCP,74,0.000151,,,"6000  >  59510 [SYN, ACK] Seq=0 Ack=1 Win=65160 Len=0 MSS=1460 SACK_PERM TSval=2630064081 TSecr=3095605101 WS=128"
97,36.297798,192.168.11.19,192.168.11.17,TCP,66,0.015771,,,59510  >  6000 [ACK] Seq=1 Ack=1 Win=64256 Len=0 TSval=3095605109 TSecr=2630064081
98,36.298682,192.168.11.19,192.168.11.17,TCP,93,0.000884,,,"59510  >  6000 [PSH, ACK] Seq=1 Ack=1 Win=64256 Len=27 TSval=3095605109 TSecr=2630064081 [TCP segment of a reassembled PDU]"
99,36.298901,192.168.11.17,192.168.11.19,TCP,66,0.000219,,,6000  >  59510 [ACK] Seq=1 Ack=28 Win=65152 Len=0 TSval=2630064098 TSecr=3095605109
100,36.299048,192.168.11.19,192.168.11.17,TCP,66,0.000147,,,"59510  >  6000 [FIN, ACK] Seq=28 Ack=1 Win=64256 Len=0 TSval=3095605109 TSecr=2630064081"
101,36.300783,192.168.11.17,192.168.11.19,TCP,66,0.001735,,,"6000  >  59510 [FIN, ACK] Seq=1 Ack=29 Win=65152 Len=0 TSval=2630064100 TSecr=3095605109"
102,36.30572,192.168.11.19,192.168.11.17,TCP,66,0.004937,,,59510  >  6000 [ACK] Seq=29 Ack=2 Win=64256 Len=0 TSval=3095605125 TSecr=2630064100
103,43.452541,192.168.11.17,192.168.11.16,TCP,74,7.146821,,,45892  >  6000 [SYN] Seq=0 Win=64240 Len=0 MSS=1460 SACK_PERM TSval=473629131 TSecr=0 WS=128
104,43.460242,192.168.11.16,192.168.11.17,TCP,74,0.007701,,,"6000  >  45892 [SYN, ACK] Seq=0 Ack=1 Win=65160 Len=0 MSS=1460 SACK_PERM TSval=1369607827 TSecr=473629131 WS=128"
105,43.460355,192.168.11.17,192.168.11.16,TCP,66,0.000113,,,45892  >  6000 [ACK] Seq=1 Ack=1 Win=64256 Len=0 TSval=473629139 TSecr=1369607827
106,43.460534,192.168.11.17,192.168.11.16,TCP,93,0.000179,,,"45892  >  6000 [PSH, ACK] Seq=1 Ack=1 Win=64256 Len=27 TSval=473629139 TSecr=1369607827 [TCP segment of a reassembled PDU]"
107,43.460659,192.168.11.17,192.168.11.16,TCP,66,0.000125,,,"45892  >  6000 [FIN, ACK] Seq=28 Ack=1 Win=64256 Len=0 TSval=473629139 TSecr=1369607827"
108,43.468364,192.168.11.16,192.168.11.17,TCP,66,0.007705,,,6000  >  45892 [ACK] Seq=1 Ack=28 Win=65152 Len=0 TSval=1369607836 TSecr=473629139
109,43.468754,192.168.11.16,192.168.11.17,TCP,66,0.00039,,,"6000  >  45892 [FIN, ACK] Seq=1 Ack=29 Win=65152 Len=0 TSval=1369607837 TSecr=473629139"
110,43.468808,192.168.11.17,192.168.11.16,TCP,66,0.000054,,,45892  >  6000 [ACK] Seq=29 Ack=2 Win=64256 Len=0 TSval=473629147 TSecr=1369607837
111,43.498534,192.168.11.17,255.255.255.255,UDP,209,0.029726,Ÿ,7b2273656d616e74696373223a207b22656e74697479223a2022504944222c202262617365656e74697479223a2022616e79222c2022726f6c65223a2022727272222c20227370617469616c223a2022616e79222c202274656d706f72616c223a2022616e79227d2c20226461746170726f7065727479223a207b22666f726d6174223a2022696e616f6b615f70726f6772616d5f73616d706c655f73656d616e746963227d7d,48180  >  7000 Len=167
112,43.504058,192.168.11.19,192.168.11.17,TCP,74,0.005524,œ,,59522  >  6000 [SYN] Seq=0 Win=64240 Len=0 MSS=1460 SACK_PERM TSval=3095612323 TSecr=0 WS=128
113,43.504203,192.168.11.17,192.168.11.19,TCP,74,0.000145,,,"6000  >  59522 [SYN, ACK] Seq=0 Ack=1 Win=65160 Len=0 MSS=1460 SACK_PERM TSval=2630071304 TSecr=3095612323 WS=128"
114,43.512853,192.168.11.19,192.168.11.17,TCP,66,0.00865,,,59522  >  6000 [ACK] Seq=1 Ack=1 Win=64256 Len=0 TSval=3095612331 TSecr=2630071304
115,43.513614,192.168.11.19,192.168.11.17,TCP,93,0.000761,,,"59522  >  6000 [PSH, ACK] Seq=1 Ack=1 Win=64256 Len=27 TSval=3095612331 TSecr=2630071304 [TCP segment of a reassembled PDU]"
116,43.513727,192.168.11.17,192.168.11.19,TCP,66,0.000113,,,6000  >  59522 [ACK] Seq=1 Ack=28 Win=65152 Len=0 TSval=2630071313 TSecr=3095612331
117,43.513821,192.168.11.19,192.168.11.17,TCP,66,0.000094,,,"59522  >  6000 [FIN, ACK] Seq=28 Ack=1 Win=64256 Len=0 TSval=3095612331 TSecr=2630071304"
118,43.515178,192.168.11.17,192.168.11.19,TCP,66,0.001357,,,"6000  >  59522 [FIN, ACK] Seq=1 Ack=29 Win=65152 Len=0 TSval=2630071315 TSecr=3095612331"
119,43.521418,192.168.11.19,192.168.11.17,TCP,66,0.00624,,,59522  >  6000 [ACK] Seq=29 Ack=2 Win=64256 Len=0 TSval=3095612340 TSecr=2630071315
120,50.636565,192.168.11.17,192.168.11.16,TCP,74,7.115147,,,56628  >  6000 [SYN] Seq=0 Win=64240 Len=0 MSS=1460 SACK_PERM TSval=473636315 TSecr=0 WS=128
121,50.653007,192.168.11.16,192.168.11.17,TCP,74,0.016442,,,"6000  >  56628 [SYN, ACK] Seq=0 Ack=1 Win=65160 Len=0 MSS=1460 SACK_PERM TSval=1369615019 TSecr=473636315 WS=128"
122,50.653136,192.168.11.17,192.168.11.16,TCP,66,0.000129,,,56628  >  6000 [ACK] Seq=1 Ack=1 Win=64256 Len=0 TSval=473636331 TSecr=1369615019
123,50.653314,192.168.11.17,192.168.11.16,TCP,93,0.000178,,,"56628  >  6000 [PSH, ACK] Seq=1 Ack=1 Win=64256 Len=27 TSval=473636332 TSecr=1369615019 [TCP segment of a reassembled PDU]"
124,50.653447,192.168.11.17,192.168.11.16,TCP,66,0.000133,,,"56628  >  6000 [FIN, ACK] Seq=28 Ack=1 Win=64256 Len=0 TSval=473636332 TSecr=1369615019"
125,50.661114,192.168.11.16,192.168.11.17,TCP,66,0.007667,,,6000  >  56628 [ACK] Seq=1 Ack=28 Win=65152 Len=0 TSval=1369615028 TSecr=473636332
126,50.661502,192.168.11.16,192.168.11.17,TCP,66,0.000388,,,"6000  >  56628 [FIN, ACK] Seq=1 Ack=29 Win=65152 Len=0 TSval=1369615030 TSecr=473636332"
127,50.661551,192.168.11.17,192.168.11.16,TCP,66,0.000049,,,56628  >  6000 [ACK] Seq=29 Ack=2 Win=64256 Len=0 TSval=473636340 TSecr=1369615030
128,50.691468,192.168.11.17,255.255.255.255,UDP,209,0.029917,Ÿ,7b2273656d616e74696373223a207b22656e74697479223a2022504944222c202262617365656e74697479223a2022616e79222c2022726f6c65223a2022727272222c20227370617469616c223a2022616e79222c202274656d706f72616c223a2022616e79227d2c20226461746170726f7065727479223a207b22666f726d6174223a2022696e616f6b615f70726f6772616d5f73616d706c655f73656d616e746963227d7d,42220  >  7000 Len=167
129,50.697233,192.168.11.19,192.168.11.17,TCP,74,0.005765,œ,,45744  >  6000 [SYN] Seq=0 Win=64240 Len=0 MSS=1460 SACK_PERM TSval=3095619516 TSecr=0 WS=128
130,50.697375,192.168.11.17,192.168.11.19,TCP,74,0.000142,,,"6000  >  45744 [SYN, ACK] Seq=0 Ack=1 Win=65160 Len=0 MSS=1460 SACK_PERM TSval=2630078497 TSecr=3095619516 WS=128"
131,50.704179,192.168.11.19,192.168.11.17,TCP,66,0.006804,,,45744  >  6000 [ACK] Seq=1 Ack=1 Win=64256 Len=0 TSval=3095619523 TSecr=2630078497
132,50.704833,192.168.11.19,192.168.11.17,TCP,93,0.000654,,,"45744  >  6000 [PSH, ACK] Seq=1 Ack=1 Win=64256 Len=27 TSval=3095619523 TSecr=2630078497 [TCP segment of a reassembled PDU]"
133,50.704944,192.168.11.17,192.168.11.19,TCP,66,0.000111,,,6000  >  45744 [ACK] Seq=1 Ack=28 Win=65152 Len=0 TSval=2630078504 TSecr=3095619523
134,50.705046,192.168.11.19,192.168.11.17,TCP,66,0.000102,,,"45744  >  6000 [FIN, ACK] Seq=28 Ack=1 Win=64256 Len=0 TSval=3095619523 TSecr=2630078497"
135,50.706527,192.168.11.17,192.168.11.19,TCP,66,0.001481,,,"6000  >  45744 [FIN, ACK] Seq=1 Ack=29 Win=65152 Len=0 TSval=2630078506 TSecr=3095619523"
136,50.712924,192.168.11.19,192.168.11.17,TCP,66,0.006397,,,45744  >  6000 [ACK] Seq=29 Ack=2 Win=64256 Len=0 TSval=3095619531 TSecr=2630078506
137,57.805914,192.168.11.17,192.168.11.16,TCP,74,7.09299,,,56640  >  6000 [SYN] Seq=0 Win=64240 Len=0 MSS=1460 SACK_PERM TSval=473643484 TSecr=0 WS=128
138,57.814853,192.168.11.16,192.168.11.17,TCP,74,0.008939,,,"6000  >  56640 [SYN, ACK] Seq=0 Ack=1 Win=65160 Len=0 MSS=1460 SACK_PERM TSval=1369622181 TSecr=473643484 WS=128"
139,57.814953,192.168.11.17,192.168.11.16,TCP,66,0.0001,,,56640  >  6000 [ACK] Seq=1 Ack=1 Win=64256 Len=0 TSval=473643493 TSecr=1369622181
140,57.81511,192.168.11.17,192.168.11.16,TCP,93,0.000157,,,"56640  >  6000 [PSH, ACK] Seq=1 Ack=1 Win=64256 Len=27 TSval=473643494 TSecr=1369622181 [TCP segment of a reassembled PDU]"
141,57.815238,192.168.11.17,192.168.11.16,TCP,66,0.000128,,,"56640  >  6000 [FIN, ACK] Seq=28 Ack=1 Win=64256 Len=0 TSval=473643494 TSecr=1369622181"
142,57.822107,192.168.11.16,192.168.11.17,TCP,66,0.006869,,,6000  >  56640 [ACK] Seq=1 Ack=28 Win=65152 Len=0 TSval=1369622190 TSecr=473643494
143,57.822472,192.168.11.16,192.168.11.17,TCP,66,0.000365,,,"6000  >  56640 [FIN, ACK] Seq=1 Ack=29 Win=65152 Len=0 TSval=1369622191 TSecr=473643494"
144,57.82253,192.168.11.17,192.168.11.16,TCP,66,0.000058,,,56640  >  6000 [ACK] Seq=29 Ack=2 Win=64256 Len=0 TSval=473643501 TSecr=1369622191
145,57.85245,192.168.11.17,255.255.255.255,UDP,209,0.02992,Ÿ,7b2273656d616e74696373223a207b22656e74697479223a2022504944222c202262617365656e74697479223a2022616e79222c2022726f6c65223a2022727272222c20227370617469616c223a2022616e79222c202274656d706f72616c223a2022616e79227d2c20226461746170726f7065727479223a207b22666f726d6174223a2022696e616f6b615f70726f6772616d5f73616d706c655f73656d616e746963227d7d,38122  >  7000 Len=167
146,57.858959,192.168.11.19,192.168.11.17,TCP,74,0.006509,œ,,46860  >  6000 [SYN] Seq=0 Win=64240 Len=0 MSS=1460 SACK_PERM TSval=3095626677 TSecr=0 WS=128
147,57.859107,192.168.11.17,192.168.11.19,TCP,74,0.000148,,,"6000  >  46860 [SYN, ACK] Seq=0 Ack=1 Win=65160 Len=0 MSS=1460 SACK_PERM TSval=2630085658 TSecr=3095626677 WS=128"
148,57.86593,192.168.11.19,192.168.11.17,TCP,66,0.006823,,,46860  >  6000 [ACK] Seq=1 Ack=1 Win=64256 Len=0 TSval=3095626685 TSecr=2630085658
149,57.866567,192.168.11.19,192.168.11.17,TCP,93,0.000637,,,"46860  >  6000 [PSH, ACK] Seq=1 Ack=1 Win=64256 Len=27 TSval=3095626685 TSecr=2630085658 [TCP segment of a reassembled PDU]"
150,57.866679,192.168.11.17,192.168.11.19,TCP,66,0.000112,,,6000  >  46860 [ACK] Seq=1 Ack=28 Win=65152 Len=0 TSval=2630085666 TSecr=3095626685
151,57.866759,192.168.11.19,192.168.11.17,TCP,66,0.00008,,,"46860  >  6000 [FIN, ACK] Seq=28 Ack=1 Win=64256 Len=0 TSval=3095626685 TSecr=2630085658"
152,57.868833,192.168.11.17,192.168.11.19,TCP,66,0.002074,,,"6000  >  46860 [FIN, ACK] Seq=1 Ack=29 Win=65152 Len=0 TSval=2630085668 TSecr=3095626685"
153,57.875983,192.168.11.19,192.168.11.17,TCP,66,0.00715,,,46860  >  6000 [ACK] Seq=29 Ack=2 Win=64256 Len=0 TSval=3095626695 TSecr=2630085668
154,64.944986,192.168.11.17,192.168.11.16,TCP,74,7.069003,,,47722  >  6000 [SYN] Seq=0 Win=64240 Len=0 MSS=1460 SACK_PERM TSval=473650623 TSecr=0 WS=128
155,64.954788,192.168.11.16,192.168.11.17,TCP,74,0.009802,,,"6000  >  47722 [SYN, ACK] Seq=0 Ack=1 Win=65160 Len=0 MSS=1460 SACK_PERM TSval=1369629319 TSecr=473650623 WS=128"
156,64.954909,192.168.11.17,192.168.11.16,TCP,66,0.000121,,,47722  >  6000 [ACK] Seq=1 Ack=1 Win=64256 Len=0 TSval=473650633 TSecr=1369629319
157,64.955165,192.168.11.17,192.168.11.16,TCP,93,0.000256,,,"47722  >  6000 [PSH, ACK] Seq=1 Ack=1 Win=64256 Len=27 TSval=473650634 TSecr=1369629319 [TCP segment of a reassembled PDU]"
158,64.955303,192.168.11.17,192.168.11.16,TCP,66,0.000138,,,"47722  >  6000 [FIN, ACK] Seq=28 Ack=1 Win=64256 Len=0 TSval=473650634 TSecr=1369629319"
159,64.964239,192.168.11.16,192.168.11.17,TCP,66,0.008936,,,6000  >  47722 [ACK] Seq=1 Ack=28 Win=65152 Len=0 TSval=1369629332 TSecr=473650634
160,64.964489,192.168.11.16,192.168.11.17,TCP,66,0.00025,,,"6000  >  47722 [FIN, ACK] Seq=1 Ack=29 Win=65152 Len=0 TSval=1369629333 TSecr=473650634"
161,64.964541,192.168.11.17,192.168.11.16,TCP,66,0.000052,,,47722  >  6000 [ACK] Seq=29 Ack=2 Win=64256 Len=0 TSval=473650643 TSecr=1369629333
162,64.994098,192.168.11.17,255.255.255.255,UDP,209,0.029557,Ÿ,7b2273656d616e74696373223a207b22656e74697479223a2022504944222c202262617365656e74697479223a2022616e79222c2022726f6c65223a2022727272222c20227370617469616c223a2022616e79222c202274656d706f72616c223a2022616e79227d2c20226461746170726f7065727479223a207b22666f726d6174223a2022696e616f6b615f70726f6772616d5f73616d706c655f73656d616e746963227d7d,60112  >  7000 Len=167
163,65.000667,192.168.11.19,192.168.11.17,TCP,74,0.006569,œ,,35826  >  6000 [SYN] Seq=0 Win=64240 Len=0 MSS=1460 SACK_PERM TSval=3095633819 TSecr=0 WS=128
164,65.000812,192.168.11.17,192.168.11.19,TCP,74,0.000145,,,"6000  >  35826 [SYN, ACK] Seq=0 Ack=1 Win=65160 Len=0 MSS=1460 SACK_PERM TSval=2630092800 TSecr=3095633819 WS=128"
165,65.007415,192.168.11.19,192.168.11.17,TCP,66,0.006603,,,35826  >  6000 [ACK] Seq=1 Ack=1 Win=64256 Len=0 TSval=3095633827 TSecr=2630092800
166,65.00804,192.168.11.19,192.168.11.17,TCP,93,0.000625,,,"35826  >  6000 [PSH, ACK] Seq=1 Ack=1 Win=64256 Len=27 TSval=3095633827 TSecr=2630092800 [TCP segment of a reassembled PDU]"
167,65.008139,192.168.11.17,192.168.11.19,TCP,66,0.000099,,,6000  >  35826 [ACK] Seq=1 Ack=28 Win=65152 Len=0 TSval=2630092807 TSecr=3095633827
168,65.008233,192.168.11.19,192.168.11.17,TCP,66,0.000094,,,"35826  >  6000 [FIN, ACK] Seq=28 Ack=1 Win=64256 Len=0 TSval=3095633827 TSecr=2630092800"
169,65.010453,192.168.11.17,192.168.11.19,TCP,66,0.00222,,,"6000  >  35826 [FIN, ACK] Seq=1 Ack=29 Win=65152 Len=0 TSval=2630092810 TSecr=3095633827"
170,65.017771,192.168.11.19,192.168.11.17,TCP,66,0.007318,,,35826  >  6000 [ACK] Seq=29 Ack=2 Win=64256 Len=0 TSval=3095633836 TSecr=2630092810
171,110.616327,192.168.11.17,192.168.11.16,TCP,74,45.598556,,,40864  >  6000 [SYN] Seq=0 Win=64240 Len=0 MSS=1460 SACK_PERM TSval=473696295 TSecr=0 WS=128
172,110.622643,192.168.11.16,192.168.11.17,TCP,74,0.006316,,,"6000  >  40864 [SYN, ACK] Seq=0 Ack=1 Win=65160 Len=0 MSS=1460 SACK_PERM TSval=1369674990 TSecr=473696295 WS=128"
173,110.622773,192.168.11.17,192.168.11.16,TCP,66,0.00013,,,40864  >  6000 [ACK] Seq=1 Ack=1 Win=64256 Len=0 TSval=473696301 TSecr=1369674990
174,110.622978,192.168.11.17,192.168.11.16,TCP,93,0.000205,,,"40864  >  6000 [PSH, ACK] Seq=1 Ack=1 Win=64256 Len=27 TSval=473696301 TSecr=1369674990 [TCP segment of a reassembled PDU]"
175,110.623088,192.168.11.17,192.168.11.16,TCP,66,0.00011,,,"40864  >  6000 [FIN, ACK] Seq=28 Ack=1 Win=64256 Len=0 TSval=473696301 TSecr=1369674990"
176,110.629322,192.168.11.16,192.168.11.17,TCP,66,0.006234,,,6000  >  40864 [ACK] Seq=1 Ack=28 Win=65152 Len=0 TSval=1369674997 TSecr=473696301
177,110.629678,192.168.11.16,192.168.11.17,TCP,66,0.000356,,,"6000  >  40864 [FIN, ACK] Seq=1 Ack=29 Win=65152 Len=0 TSval=1369674998 TSecr=473696301"
178,110.629725,192.168.11.17,192.168.11.16,TCP,66,0.000047,,,40864  >  6000 [ACK] Seq=29 Ack=2 Win=64256 Len=0 TSval=473696308 TSecr=1369674998
179,110.657597,192.168.11.17,255.255.255.255,UDP,209,0.027872,Ÿ,7b2273656d616e74696373223a207b22656e74697479223a2022504944222c202262617365656e74697479223a2022616e79222c2022726f6c65223a2022727272222c20227370617469616c223a2022616e79222c202274656d706f72616c223a2022616e79227d2c20226461746170726f7065727479223a207b22666f726d6174223a2022696e616f6b615f70726f6772616d5f73616d706c655f73656d616e746963227d7d,52836  >  7000 Len=167
180,110.664195,192.168.11.19,192.168.11.17,TCP,74,0.006598,œ,,43516  >  6000 [SYN] Seq=0 Win=64240 Len=0 MSS=1460 SACK_PERM TSval=3095679482 TSecr=0 WS=128
181,110.664346,192.168.11.17,192.168.11.19,TCP,74,0.000151,,,"6000  >  43516 [SYN, ACK] Seq=0 Ack=1 Win=65160 Len=0 MSS=1460 SACK_PERM TSval=2630138464 TSecr=3095679482 WS=128"
182,110.671488,192.168.11.19,192.168.11.17,TCP,66,0.007142,,,43516  >  6000 [ACK] Seq=1 Ack=1 Win=64256 Len=0 TSval=3095679490 TSecr=2630138464
183,110.67212,192.168.11.19,192.168.11.17,TCP,93,0.000632,,,"43516  >  6000 [PSH, ACK] Seq=1 Ack=1 Win=64256 Len=27 TSval=3095679490 TSecr=2630138464 [TCP segment of a reassembled PDU]"
184,110.672252,192.168.11.17,192.168.11.19,TCP,66,0.000132,,,6000  >  43516 [ACK] Seq=1 Ack=28 Win=65152 Len=0 TSval=2630138472 TSecr=3095679490
185,110.672338,192.168.11.19,192.168.11.17,TCP,66,0.000086,,,"43516  >  6000 [FIN, ACK] Seq=28 Ack=1 Win=64256 Len=0 TSval=3095679490 TSecr=2630138464"
186,110.673893,192.168.11.17,192.168.11.19,TCP,66,0.001555,,,"6000  >  43516 [FIN, ACK] Seq=1 Ack=29 Win=65152 Len=0 TSval=2630138473 TSecr=3095679490"
187,110.679399,192.168.11.19,192.168.11.17,TCP,66,0.005506,,,43516  >  6000 [ACK] Seq=29 Ack=2 Win=64256 Len=0 TSval=3095679499 TSecr=2630138473
188,117.774871,192.168.11.17,192.168.11.16,TCP,74,7.095472,,,40876  >  6000 [SYN] Seq=0 Win=64240 Len=0 MSS=1460 SACK_PERM TSval=473703453 TSecr=0 WS=128
189,117.782632,192.168.11.16,192.168.11.17,TCP,74,0.007761,,,"6000  >  40876 [SYN, ACK] Seq=0 Ack=1 Win=65160 Len=0 MSS=1460 SACK_PERM TSval=1369682150 TSecr=473703453 WS=128"
190,117.78274,192.168.11.17,192.168.11.16,TCP,66,0.000108,,,40876  >  6000 [ACK] Seq=1 Ack=1 Win=64256 Len=0 TSval=473703461 TSecr=1369682150
191,117.7829,192.168.11.17,192.168.11.16,TCP,93,0.00016,,,"40876  >  6000 [PSH, ACK] Seq=1 Ack=1 Win=64256 Len=27 TSval=473703461 TSecr=1369682150 [TCP segment of a reassembled PDU]"
192,117.782998,192.168.11.17,192.168.11.16,TCP,66,0.000098,,,"40876  >  6000 [FIN, ACK] Seq=28 Ack=1 Win=64256 Len=0 TSval=473703461 TSecr=1369682150"
193,117.790059,192.168.11.16,192.168.11.17,TCP,66,0.007061,,,6000  >  40876 [ACK] Seq=1 Ack=28 Win=65152 Len=0 TSval=1369682158 TSecr=473703461
194,117.790288,192.168.11.16,192.168.11.17,TCP,66,0.000229,,,"6000  >  40876 [FIN, ACK] Seq=1 Ack=29 Win=65152 Len=0 TSval=1369682160 TSecr=473703461"
195,117.790344,192.168.11.17,192.168.11.16,TCP,66,0.000056,,,40876  >  6000 [ACK] Seq=29 Ack=2 Win=64256 Len=0 TSval=473703469 TSecr=1369682160
196,117.819853,192.168.11.17,255.255.255.255,UDP,209,0.029509,Ÿ,7b2273656d616e74696373223a207b22656e74697479223a2022504944222c202262617365656e74697479223a2022616e79222c2022726f6c65223a2022727272222c20227370617469616c223a2022616e79222c202274656d706f72616c223a2022616e79227d2c20226461746170726f7065727479223a207b22666f726d6174223a2022696e616f6b615f70726f6772616d5f73616d706c655f73656d616e746963227d7d,36841  >  7000 Len=167
197,117.825366,192.168.11.19,192.168.11.17,TCP,74,0.005513,œ,,43656  >  6000 [SYN] Seq=0 Win=64240 Len=0 MSS=1460 SACK_PERM TSval=3095686645 TSecr=0 WS=128
198,117.825484,192.168.11.17,192.168.11.19,TCP,74,0.000118,,,"6000  >  43656 [SYN, ACK] Seq=0 Ack=1 Win=65160 Len=0 MSS=1460 SACK_PERM TSval=2630145625 TSecr=3095686645 WS=128"
199,117.831944,192.168.11.19,192.168.11.17,TCP,66,0.00646,,,43656  >  6000 [ACK] Seq=1 Ack=1 Win=64256 Len=0 TSval=3095686651 TSecr=2630145625
200,117.832539,192.168.11.19,192.168.11.17,TCP,93,0.000595,,,"43656  >  6000 [PSH, ACK] Seq=1 Ack=1 Win=64256 Len=27 TSval=3095686651 TSecr=2630145625 [TCP segment of a reassembled PDU]"
201,117.83265,192.168.11.17,192.168.11.19,TCP,66,0.000111,,,6000  >  43656 [ACK] Seq=1 Ack=28 Win=65152 Len=0 TSval=2630145632 TSecr=3095686651
202,117.832736,192.168.11.19,192.168.11.17,TCP,66,0.000086,,,"43656  >  6000 [FIN, ACK] Seq=28 Ack=1 Win=64256 Len=0 TSval=3095686651 TSecr=2630145625"
203,117.833956,192.168.11.17,192.168.11.19,TCP,66,0.00122,,,"6000  >  43656 [FIN, ACK] Seq=1 Ack=29 Win=65152 Len=0 TSval=2630145633 TSecr=3095686651"
204,117.840077,192.168.11.19,192.168.11.17,TCP,66,0.006121,,,43656  >  6000 [ACK] Seq=29 Ack=2 Win=64256 Len=0 TSval=3095686659 TSecr=2630145633
205,125.017636,192.168.11.17,192.168.11.16,TCP,74,7.177559,,,53236  >  6000 [SYN] Seq=0 Win=64240 Len=0 MSS=1460 SACK_PERM TSval=473710696 TSecr=0 WS=128
206,125.027429,192.168.11.16,192.168.11.17,TCP,74,0.009793,,,"6000  >  53236 [SYN, ACK] Seq=0 Ack=1 Win=65160 Len=0 MSS=1460 SACK_PERM TSval=1369689392 TSecr=473710696 WS=128"
207,125.027548,192.168.11.17,192.168.11.16,TCP,66,0.000119,,,53236  >  6000 [ACK] Seq=1 Ack=1 Win=64256 Len=0 TSval=473710706 TSecr=1369689392
208,125.027741,192.168.11.17,192.168.11.16,TCP,93,0.000193,,,"53236  >  6000 [PSH, ACK] Seq=1 Ack=1 Win=64256 Len=27 TSval=473710706 TSecr=1369689392 [TCP segment of a reassembled PDU]"
209,125.027839,192.168.11.17,192.168.11.16,TCP,66,0.000098,,,"53236  >  6000 [FIN, ACK] Seq=28 Ack=1 Win=64256 Len=0 TSval=473710706 TSecr=1369689392"
210,125.0356,192.168.11.16,192.168.11.17,TCP,66,0.007761,,,6000  >  53236 [ACK] Seq=1 Ack=28 Win=65152 Len=0 TSval=1369689403 TSecr=473710706
211,125.035824,192.168.11.16,192.168.11.17,TCP,66,0.000224,,,"6000  >  53236 [FIN, ACK] Seq=1 Ack=29 Win=65152 Len=0 TSval=1369689405 TSecr=473710706"
212,125.035886,192.168.11.17,192.168.11.16,TCP,66,0.000062,,,53236  >  6000 [ACK] Seq=29 Ack=2 Win=64256 Len=0 TSval=473710714 TSecr=1369689405
213,125.069307,192.168.11.17,255.255.255.255,UDP,209,0.033421,Ÿ,7b2273656d616e74696373223a207b22656e74697479223a2022504944222c202262617365656e74697479223a2022616e79222c2022726f6c65223a2022727272222c20227370617469616c223a2022616e79222c202274656d706f72616c223a2022616e79227d2c20226461746170726f7065727479223a207b22666f726d6174223a2022696e616f6b615f70726f6772616d5f73616d706c655f73656d616e746963227d7d,47185  >  7000 Len=167
214,125.074762,192.168.11.19,192.168.11.17,TCP,74,0.005455,œ,,51616  >  6000 [SYN] Seq=0 Win=64240 Len=0 MSS=1460 SACK_PERM TSval=3095693894 TSecr=0 WS=128
215,125.074896,192.168.11.17,192.168.11.19,TCP,74,0.000134,,,"6000  >  51616 [SYN, ACK] Seq=0 Ack=1 Win=65160 Len=0 MSS=1460 SACK_PERM TSval=2630152874 TSecr=3095693894 WS=128"
216,125.081674,192.168.11.19,192.168.11.17,TCP,66,0.006778,,,51616  >  6000 [ACK] Seq=1 Ack=1 Win=64256 Len=0 TSval=3095693901 TSecr=2630152874
217,125.082053,192.168.11.19,192.168.11.17,TCP,93,0.000379,,,"51616  >  6000 [PSH, ACK] Seq=1 Ack=1 Win=64256 Len=27 TSval=3095693901 TSecr=2630152874 [TCP segment of a reassembled PDU]"
218,125.082143,192.168.11.17,192.168.11.19,TCP,66,0.00009,,,6000  >  51616 [ACK] Seq=1 Ack=28 Win=65152 Len=0 TSval=2630152881 TSecr=3095693901
219,125.082375,192.168.11.19,192.168.11.17,TCP,66,0.000232,,,"51616  >  6000 [FIN, ACK] Seq=28 Ack=1 Win=64256 Len=0 TSval=3095693901 TSecr=2630152874"
220,125.083235,192.168.11.17,192.168.11.19,TCP,66,0.00086,,,"6000  >  51616 [FIN, ACK] Seq=1 Ack=29 Win=65152 Len=0 TSval=2630152883 TSecr=3095693901"
221,125.089074,192.168.11.19,192.168.11.17,TCP,66,0.005839,,,51616  >  6000 [ACK] Seq=29 Ack=2 Win=64256 Len=0 TSval=3095693908 TSecr=2630152883
222,132.185219,192.168.11.17,192.168.11.16,TCP,74,7.096145,,,58444  >  6000 [SYN] Seq=0 Win=64240 Len=0 MSS=1460 SACK_PERM TSval=473717864 TSecr=0 WS=128
223,132.192198,192.168.11.16,192.168.11.17,TCP,74,0.006979,,,"6000  >  58444 [SYN, ACK] Seq=0 Ack=1 Win=65160 Len=0 MSS=1460 SACK_PERM TSval=1369696560 TSecr=473717864 WS=128"
224,132.19229,192.168.11.17,192.168.11.16,TCP,66,0.000092,,,58444  >  6000 [ACK] Seq=1 Ack=1 Win=64256 Len=0 TSval=473717871 TSecr=1369696560
225,132.192445,192.168.11.17,192.168.11.16,TCP,93,0.000155,,,"58444  >  6000 [PSH, ACK] Seq=1 Ack=1 Win=64256 Len=27 TSval=473717871 TSecr=1369696560 [TCP segment of a reassembled PDU]"
226,132.192562,192.168.11.17,192.168.11.16,TCP,66,0.000117,,,"58444  >  6000 [FIN, ACK] Seq=28 Ack=1 Win=64256 Len=0 TSval=473717871 TSecr=1369696560"
227,132.199557,192.168.11.16,192.168.11.17,TCP,66,0.006995,,,6000  >  58444 [ACK] Seq=1 Ack=28 Win=65152 Len=0 TSval=1369696567 TSecr=473717871
228,132.199762,192.168.11.16,192.168.11.17,TCP,66,0.000205,,,"6000  >  58444 [FIN, ACK] Seq=1 Ack=29 Win=65152 Len=0 TSval=1369696568 TSecr=473717871"
229,132.199805,192.168.11.17,192.168.11.16,TCP,66,0.000043,,,58444  >  6000 [ACK] Seq=29 Ack=2 Win=64256 Len=0 TSval=473717878 TSecr=1369696568
230,132.230458,192.168.11.17,255.255.255.255,UDP,209,0.030653,Ÿ,7b2273656d616e74696373223a207b22656e74697479223a2022504944222c202262617365656e74697479223a2022616e79222c2022726f6c65223a2022727272222c20227370617469616c223a2022616e79222c202274656d706f72616c223a2022616e79227d2c20226461746170726f7065727479223a207b22666f726d6174223a2022696e616f6b615f70726f6772616d5f73616d706c655f73656d616e746963227d7d,39794  >  7000 Len=167
231,132.237274,192.168.11.19,192.168.11.17,TCP,74,0.006816,œ,,51630  >  6000 [SYN] Seq=0 Win=64240 Len=0 MSS=1460 SACK_PERM TSval=3095701055 TSecr=0 WS=128
