No.,Time,Source,Destination,Protocol,Length,Time delta from previous captured frame,XXX,Data,Info
1,0,192.168.11.19,192.168.11.17,TCP,74,0,,,59248  >  6000 [SYN] Seq=0 Win=64240 Len=0 MSS=1460 SACK_PERM TSval=3095568872 TSecr=0 WS=128
2,0.009508,192.168.11.17,192.168.11.19,TCP,74,0.009508,,,"6000  >  59248 [SYN, ACK] Seq=0 Ack=1 Win=65160 Len=0 MSS=1460 SACK_PERM TSval=2630027857 TSecr=3095568872 WS=128"
3,0.009627,192.168.11.19,192.168.11.17,TCP,66,0.000119,,,59248  >  6000 [ACK] Seq=1 Ack=1 Win=64256 Len=0 TSval=3095568884 TSecr=2630027857
4,0.009849,192.168.11.19,192.168.11.17,TCP,93,0.000222,,,"59248  >  6000 [PSH, ACK] Seq=1 Ack=1 Win=64256 Len=27 TSval=3095568884 TSecr=2630027857 [TCP segment of a reassembled PDU]"
5,0.010002,192.168.11.19,192.168.11.17,TCP,66,0.000153,,,"59248  >  6000 [FIN, ACK] Seq=28 Ack=1 Win=64256 Len=0 TSval=3095568884 TSecr=2630027857"
6,0.026319,192.168.11.17,192.168.11.19,TCP,66,0.016317,,,6000  >  59248 [ACK] Seq=1 Ack=28 Win=65152 Len=0 TSval=2630027874 TSecr=3095568884
7,0.026712,192.168.11.17,192.168.11.19,TCP,66,0.000393,,,"6000  >  59248 [FIN, ACK] Seq=1 Ack=29 Win=65152 Len=0 TSval=2630027876 TSecr=3095568884"
8,0.026762,192.168.11.19,192.168.11.17,TCP,66,0.00005,,,59248  >  6000 [ACK] Seq=29 Ack=2 Win=64256 Len=0 TSval=3095568901 TSecr=2630027876
9,0.058003,192.168.11.19,255.255.255.255,UDP,209,0.031241,Ÿ,7b2273656d616e74696373223a207b22656e74697479223a2022504944222c202262617365656e74697479223a2022616e79222c2022726f6c65223a2022737373222c20227370617469616c223a2022616e79222c202274656d706f72616c223a2022616e79227d2c20226461746170726f7065727479223a207b22666f726d6174223a2022696e616f6b615f70726f6772616d5f73616d706c655f73656d616e746963227d7d,60806  >  7000 Len=167
10,0.066489,192.168.11.20,192.168.11.19,TCP,74,0.008486,œ,,59060  >  6000 [SYN] Seq=0 Win=64240 Len=0 MSS=1460 SACK_PERM TSval=4104277225 TSecr=0 WS=128
11,0.06664,192.168.11.19,192.168.11.20,TCP,74,0.000151,,,"6000  >  59060 [SYN, ACK] Seq=0 Ack=1 Win=65160 Len=0 MSS=1460 SACK_PERM TSval=2756382078 TSecr=4104277225 WS=128"
12,0.073378,192.168.11.20,192.168.11.19,TCP,66,0.006738,,,59060  >  6000 [ACK] Seq=1 Ack=1 Win=64256 Len=0 TSval=4104277235 TSecr=2756382078
13,0.073941,192.168.11.20,192.168.11.19,TCP,93,0.000563,,,"59060  >  6000 [PSH, ACK] Seq=1 Ack=1 Win=64256 Len=27 TSval=4104277235 TSecr=2756382078 [TCP segment of a reassembled PDU]"
14,0.074061,192.168.11.19,192.168.11.20,TCP,66,0.00012,,,6000  >  59060 [ACK] Seq=1 Ack=28 Win=65152 Len=0 TSval=2756382085 TSecr=4104277235
15,0.074146,192.168.11.20,192.168.11.19,TCP,66,0.000085,,,"59060  >  6000 [FIN, ACK] Seq=28 Ack=1 Win=64256 Len=0 TSval=4104277235 TSecr=2756382078"
16,0.075456,192.168.11.19,192.168.11.20,TCP,66,0.00131,,,"6000  >  59060 [FIN, ACK] Seq=1 Ack=29 Win=65152 Len=0 TSval=2756382087 TSecr=4104277235"
17,0.081414,192.168.11.20,192.168.11.19,TCP,66,0.005958,,,59060  >  6000 [ACK] Seq=29 Ack=2 Win=64256 Len=0 TSval=4104277243 TSecr=2756382087
18,7.307856,192.168.11.19,192.168.11.17,TCP,74,7.226442,,,49036  >  6000 [SYN] Seq=0 Win=64240 Len=0 MSS=1460 SACK_PERM TSval=3095576182 TSecr=0 WS=128
19,7.314573,192.168.11.17,192.168.11.19,TCP,74,0.006717,,,"6000  >  49036 [SYN, ACK] Seq=0 Ack=1 Win=65160 Len=0 MSS=1460 SACK_PERM TSval=2630035163 TSecr=3095576182 WS=128"
20,7.31467,192.168.11.19,192.168.11.17,TCP,66,0.000097,,,49036  >  6000 [ACK] Seq=1 Ack=1 Win=64256 Len=0 TSval=3095576189 TSecr=2630035163
21,7.314836,192.168.11.19,192.168.11.17,TCP,93,0.000166,,,"49036  >  6000 [PSH, ACK] Seq=1 Ack=1 Win=64256 Len=27 TSval=3095576189 TSecr=2630035163 [TCP segment of a reassembled PDU]"
22,7.314953,192.168.11.19,192.168.11.17,TCP,66,0.000117,,,"49036  >  6000 [FIN, ACK] Seq=28 Ack=1 Win=64256 Len=0 TSval=3095576189 TSecr=2630035163"
23,7.322079,192.168.11.17,192.168.11.19,TCP,66,0.007126,,,6000  >  49036 [ACK] Seq=1 Ack=28 Win=65152 Len=0 TSval=2630035170 TSecr=3095576189
24,7.322469,192.168.11.17,192.168.11.19,TCP,66,0.00039,,,"6000  >  49036 [FIN, ACK] Seq=1 Ack=29 Win=65152 Len=0 TSval=2630035171 TSecr=3095576189"
25,7.322517,192.168.11.19,192.168.11.17,TCP,66,0.000048,,,49036  >  6000 [ACK] Seq=29 Ack=2 Win=64256 Len=0 TSval=3095576197 TSecr=2630035171
26,7.352667,192.168.11.19,255.255.255.255,UDP,209,0.03015,Ÿ,7b2273656d616e74696373223a207b22656e74697479223a2022504944222c202262617365656e74697479223a2022616e79222c2022726f6c65223a2022737373222c20227370617469616c223a2022616e79222c202274656d706f72616c223a2022616e79227d2c20226461746170726f7065727479223a207b22666f726d6174223a2022696e616f6b615f70726f6772616d5f73616d706c655f73656d616e746963227d7d,53246  >  7000 Len=167
27,7.369805,192.168.11.20,192.168.11.19,TCP,74,0.017138,œ,,43556  >  6000 [SYN] Seq=0 Win=64240 Len=0 MSS=1460 SACK_PERM TSval=4104284531 TSecr=0 WS=128
28,7.370002,192.168.11.19,192.168.11.20,TCP,74,0.000197,,,"6000  >  43556 [SYN, ACK] Seq=0 Ack=1 Win=65160 Len=0 MSS=1460 SACK_PERM TSval=2756389381 TSecr=4104284531 WS=128"
29,7.37664,192.168.11.20,192.168.11.19,TCP,66,0.006638,,,43556  >  6000 [ACK] Seq=1 Ack=1 Win=64256 Len=0 TSval=4104284538 TSecr=2756389381
30,7.377083,192.168.11.20,192.168.11.19,TCP,93,0.000443,,,"43556  >  6000 [PSH, ACK] Seq=1 Ack=1 Win=64256 Len=27 TSval=4104284538 TSecr=2756389381 [TCP segment of a reassembled PDU]"
31,7.377143,192.168.11.19,192.168.11.20,TCP,66,0.00006,,,6000  >  43556 [ACK] Seq=1 Ack=28 Win=65152 Len=0 TSval=2756389388 TSecr=4104284538
32,7.377194,192.168.11.20,192.168.11.19,TCP,66,0.000051,,,"43556  >  6000 [FIN, ACK] Seq=28 Ack=1 Win=64256 Len=0 TSval=4104284539 TSecr=2756389381"
33,7.378135,192.168.11.19,192.168.11.20,TCP,66,0.000941,,,"6000  >  43556 [FIN, ACK] Seq=1 Ack=29 Win=65152 Len=0 TSval=2756389389 TSecr=4104284539"
34,7.384678,192.168.11.20,192.168.11.19,TCP,66,0.006543,,,43556  >  6000 [ACK] Seq=29 Ack=2 Win=64256 Len=0 TSval=4104284546 TSecr=2756389389
35,14.653631,192.168.11.19,192.168.11.17,TCP,74,7.268953,,,39316  >  6000 [SYN] Seq=0 Win=64240 Len=0 MSS=1460 SACK_PERM TSval=3095583528 TSecr=0 WS=128
36,14.661755,192.168.11.17,192.168.11.19,TCP,74,0.008124,,,"6000  >  39316 [SYN, ACK] Seq=0 Ack=1 Win=65160 Len=0 MSS=1460 SACK_PERM TSval=2630042510 TSecr=3095583528 WS=128"
37,14.661858,192.168.11.19,192.168.11.17,TCP,66,0.000103,,,39316  >  6000 [ACK] Seq=1 Ack=1 Win=64256 Len=0 TSval=3095583536 TSecr=2630042510
38,14.66201,192.168.11.19,192.168.11.17,TCP,93,0.000152,,,"39316  >  6000 [PSH, ACK] Seq=1 Ack=1 Win=64256 Len=27 TSval=3095583536 TSecr=2630042510 [TCP segment of a reassembled PDU]"
39,14.662138,192.168.11.19,192.168.11.17,TCP,66,0.000128,,,"39316  >  6000 [FIN, ACK] Seq=28 Ack=1 Win=64256 Len=0 TSval=3095583536 TSecr=2630042510"
40,14.67812,192.168.11.17,192.168.11.19,TCP,66,0.015982,,,6000  >  39316 [ACK] Seq=1 Ack=28 Win=65152 Len=0 TSval=2630042526 TSecr=3095583536
41,14.678484,192.168.11.17,192.168.11.19,TCP,66,0.000364,,,"6000  >  39316 [FIN, ACK] Seq=1 Ack=29 Win=65152 Len=0 TSval=2630042528 TSecr=3095583536"
42,14.678533,192.168.11.19,192.168.11.17,TCP,66,0.000049,,,39316  >  6000 [ACK] Seq=29 Ack=2 Win=64256 Len=0 TSval=3095583553 TSecr=2630042528
43,14.707662,192.168.11.19,255.255.255.255,UDP,209,0.029129,Ÿ,7b2273656d616e74696373223a207b22656e74697479223a2022504944222c202262617365656e74697479223a2022616e79222c2022726f6c65223a2022737373222c20227370617469616c223a2022616e79222c202274656d706f72616c223a2022616e79227d2c20226461746170726f7065727479223a207b22666f726d6174223a2022696e616f6b615f70726f6772616d5f73616d706c655f73656d616e746963227d7d,47081  >  7000 Len=167
44,14.713373,192.168.11.20,192.168.11.19,TCP,74,0.005711,œ,,46852  >  6000 [SYN] Seq=0 Win=64240 Len=0 MSS=1460 SACK_PERM TSval=4104291875 TSecr=0 WS=128
45,14.713521,192.168.11.19,192.168.11.20,TCP,74,0.000148,,,"6000  >  46852 [SYN, ACK] Seq=0 Ack=1 Win=65160 Len=0 MSS=1460 SACK_PERM TSval=2756396725 TSecr=4104291875 WS=128"
46,14.730021,192.168.11.20,192.168.11.19,TCP,66,0.0165,,,46852  >  6000 [ACK] Seq=1 Ack=1 Win=64256 Len=0 TSval=4104291882 TSecr=2756396725
47,14.730622,192.168.11.20,192.168.11.19,TCP,93,0.000601,,,"46852  >  6000 [PSH, ACK] Seq=1 Ack=1 Win=64256 Len=27 TSval=4104291882 TSecr=2756396725 [TCP segment of a reassembled PDU]"
48,14.730742,192.168.11.19,192.168.11.20,TCP,66,0.00012,,,6000  >  46852 [ACK] Seq=1 Ack=28 Win=65152 Len=0 TSval=2756396742 TSecr=4104291882
49,14.730824,192.168.11.20,192.168.11.19,TCP,66,0.000082,,,"46852  >  6000 [FIN, ACK] Seq=28 Ack=1 Win=64256 Len=0 TSval=4104291882 TSecr=2756396725"
50,14.731735,192.168.11.19,192.168.11.20,TCP,66,0.000911,,,"6000  >  46852 [FIN, ACK] Seq=1 Ack=29 Win=65152 Len=0 TSval=2756396743 TSecr=4104291882"
51,14.737955,192.168.11.20,192.168.11.19,TCP,66,0.00622,,,46852  >  6000 [ACK] Seq=29 Ack=2 Win=64256 Len=0 TSval=4104291900 TSecr=2756396743
52,21.853927,192.168.11.19,192.168.11.17,TCP,74,7.115972,,,39322  >  6000 [SYN] Seq=0 Win=64240 Len=0 MSS=1460 SACK_PERM TSval=3095590728 TSecr=0 WS=128
53,21.861165,192.168.11.17,192.168.11.19,TCP,74,0.007238,,,"6000  >  39322 [SYN, ACK] Seq=0 Ack=1 Win=65160 Len=0 MSS=1460 SACK_PERM TSval=2630049709 TSecr=3095590728 WS=128"
54,21.861304,192.168.11.19,192.168.11.17,TCP,66,0.000139,,,39322  >  6000 [ACK] Seq=1 Ack=1 Win=64256 Len=0 TSval=3095590735 TSecr=2630049709
55,21.861449,192.168.11.19,192.168.11.17,TCP,93,0.000145,,,"39322  >  6000 [PSH, ACK] Seq=1 Ack=1 Win=64256 Len=27 TSval=3095590736 TSecr=2630049709 [TCP segment of a reassembled PDU]"
56,21.861571,192.168.11.19,192.168.11.17,TCP,66,0.000122,,,"39322  >  6000 [FIN, ACK] Seq=28 Ack=1 Win=64256 Len=0 TSval=3095590736 TSecr=2630049709"
57,21.86896,192.168.11.17,192.168.11.19,TCP,66,0.007389,,,6000  >  39322 [ACK] Seq=1 Ack=28 Win=65152 Len=0 TSval=2630049717 TSecr=3095590736
58,21.869377,192.168.11.17,192.168.11.19,TCP,66,0.000417,,,"6000  >  39322 [FIN, ACK] Seq=1 Ack=29 Win=65152 Len=0 TSval=2630049718 TSecr=3095590736"
59,21.869424,192.168.11.19,192.168.11.17,TCP,66,0.000047,,,39322  >  6000 [ACK] Seq=29 Ack=2 Win=64256 Len=0 TSval=3095590744 TSecr=2630049718
60,21.898395,192.168.11.19,255.255.255.255,UDP,209,0.028971,Ÿ,7b2273656d616e74696373223a207b22656e74697479223a2022504944222c202262617365656e74697479223a2022616e79222c2022726f6c65223a2022737373222c20227370617469616c223a2022616e79222c202274656d706f72616c223a2022616e79227d2c20226461746170726f7065727479223a207b22666f726d6174223a2022696e616f6b615f70726f6772616d5f73616d706c655f73656d616e746963227d7d,58121  >  7000 Len=167
61,21.905105,192.168.11.20,192.168.11.19,TCP,74,0.00671,œ,,51960  >  6000 [SYN] Seq=0 Win=64240 Len=0 MSS=1460 SACK_PERM TSval=4104299066 TSecr=0 WS=128
62,21.905235,192.168.11.19,192.168.11.20,TCP,74,0.00013,,,"6000  >  51960 [SYN, ACK] Seq=0 Ack=1 Win=65160 Len=0 MSS=1460 SACK_PERM TSval=2756403916 TSecr=4104299066 WS=128"
63,21.912561,192.168.11.20,192.168.11.19,TCP,66,0.007326,,,51960  >  6000 [ACK] Seq=1 Ack=1 Win=64256 Len=0 TSval=4104299074 TSecr=2756403916
64,21.913216,192.168.11.20,192.168.11.19,TCP,93,0.000655,,,"51960  >  6000 [PSH, ACK] Seq=1 Ack=1 Win=64256 Len=27 TSval=4104299074 TSecr=2756403916 [TCP segment of a reassembled PDU]"
65,21.913397,192.168.11.19,192.168.11.20,TCP,66,0.000181,,,6000  >  51960 [ACK] Seq=1 Ack=28 Win=65152 Len=0 TSval=2756403924 TSecr=4104299074
66,21.913597,192.168.11.20,192.168.11.19,TCP,66,0.0002,,,"51960  >  6000 [FIN, ACK] Seq=28 Ack=1 Win=64256 Len=0 TSval=4104299074 TSecr=2756403916"
67,21.914798,192.168.11.19,192.168.11.20,TCP,66,0.001201,,,"6000  >  51960 [FIN, ACK] Seq=1 Ack=29 Win=65152 Len=0 TSval=2756403926 TSecr=4104299074"
68,21.921164,192.168.11.20,192.168.11.19,TCP,66,0.006366,,,51960  >  6000 [ACK] Seq=29 Ack=2 Win=64256 Len=0 TSval=4104299082 TSecr=2756403926
69,29.063913,192.168.11.19,192.168.11.17,TCP,74,7.142749,,,45128  >  6000 [SYN] Seq=0 Win=64240 Len=0 MSS=1460 SACK_PERM TSval=3095597938 TSecr=0 WS=128
70,29.070576,192.168.11.17,192.168.11.19,TCP,74,0.006663,,,"6000  >  45128 [SYN, ACK] Seq=0 Ack=1 Win=65160 Len=0 MSS=1460 SACK_PERM TSval=2630056918 TSecr=3095597938 WS=128"
71,29.070687,192.168.11.19,192.168.11.17,TCP,66,0.000111,,,45128  >  6000 [ACK] Seq=1 Ack=1 Win=64256 Len=0 TSval=3095597945 TSecr=2630056918
72,29.070833,192.168.11.19,192.168.11.17,TCP,93,0.000146,,,"45128  >  6000 [PSH, ACK] Seq=1 Ack=1 Win=64256 Len=27 TSval=3095597945 TSecr=2630056918 [TCP segment of a reassembled PDU]"
73,29.070948,192.168.11.19,192.168.11.17,TCP,66,0.000115,,,"45128  >  6000 [FIN, ACK] Seq=28 Ack=1 Win=64256 Len=0 TSval=3095597945 TSecr=2630056918"
74,29.078015,192.168.11.17,192.168.11.19,TCP,66,0.007067,,,6000  >  45128 [ACK] Seq=1 Ack=28 Win=65152 Len=0 TSval=2630056926 TSecr=3095597945
75,29.078251,192.168.11.17,192.168.11.19,TCP,66,0.000236,,,"6000  >  45128 [FIN, ACK] Seq=1 Ack=29 Win=65152 Len=0 TSval=2630056927 TSecr=3095597945"
76,29.078296,192.168.11.19,192.168.11.17,TCP,66,0.000045,,,45128  >  6000 [ACK] Seq=29 Ack=2 Win=64256 Len=0 TSval=3095597953 TSecr=2630056927
77,29.109388,192.168.11.19,255.255.255.255,UDP,209,0.031092,Ÿ,7b2273656d616e74696373223a207b22656e74697479223a2022504944222c202262617365656e74697479223a2022616e79222c2022726f6c65223a2022737373222c20227370617469616c223a2022616e79222c202274656d706f72616c223a2022616e79227d2c20226461746170726f7065727479223a207b22666f726d6174223a2022696e616f6b615f70726f6772616d5f73616d706c655f73656d616e746963227d7d,45072  >  7000 Len=167
78,29.116073,192.168.11.20,192.168.11.19,TCP,74,0.006685,œ,,51974  >  6000 [SYN] Seq=0 Win=64240 Len=0 MSS=1460 SACK_PERM TSval=4104306277 TSecr=0 WS=128
79,29.116207,192.168.11.19,192.168.11.20,TCP,74,0.000134,,,"6000  >  51974 [SYN, ACK] Seq=0 Ack=1 Win=65160 Len=0 MSS=1460 SACK_PERM TSval=2756411127 TSecr=4104306277 WS=128"
80,29.122907,192.168.11.20,192.168.11.19,TCP,66,0.0067,,,51974  >  6000 [ACK] Seq=1 Ack=1 Win=64256 Len=0 TSval=4104306285 TSecr=2756411127
81,29.123505,192.168.11.20,192.168.11.19,TCP,93,0.000598,,,"51974  >  6000 [PSH, ACK] Seq=1 Ack=1 Win=64256 Len=27 TSval=4104306285 TSecr=2756411127 [TCP segment of a reassembled PDU]"
82,29.123624,192.168.11.19,192.168.11.20,TCP,66,0.000119,,,6000  >  51974 [ACK] Seq=1 Ack=28 Win=65152 Len=0 TSval=2756411135 TSecr=4104306285
83,29.123707,192.168.11.20,192.168.11.19,TCP,66,0.000083,,,"51974  >  6000 [FIN, ACK] Seq=28 Ack=1 Win=64256 Len=0 TSval=4104306285 TSecr=2756411127"
84,29.125098,192.168.11.19,192.168.11.20,TCP,66,0.001391,,,"6000  >  51974 [FIN, ACK] Seq=1 Ack=29 Win=65152 Len=0 TSval=2756411136 TSecr=4104306285"
85,29.131549,192.168.11.20,192.168.11.19,TCP,66,0.006451,,,51974  >  6000 [ACK] Seq=29 Ack=2 Win=64256 Len=0 TSval=4104306293 TSecr=2756411136
86,36.226521,192.168.11.19,192.168.11.17,TCP,74,7.094972,,,59510  >  6000 [SYN] Seq=0 Win=64240 Len=0 MSS=1460 SACK_PERM TSval=3095605101 TSecr=0 WS=128
87,36.234458,192.168.11.17,192.168.11.19,TCP,74,0.007937,,,"6000  >  59510 [SYN, ACK] Seq=0 Ack=1 Win=65160 Len=0 MSS=1460 SACK_PERM TSval=2630064081 TSecr=3095605101 WS=128"
88,36.234576,192.168.11.19,192.168.11.17,TCP,66,0.000118,,,59510  >  6000 [ACK] Seq=1 Ack=1 Win=64256 Len=0 TSval=3095605109 TSecr=2630064081
89,36.234716,192.168.11.19,192.168.11.17,TCP,93,0.00014,,,"59510  >  6000 [PSH, ACK] Seq=1 Ack=1 Win=64256 Len=27 TSval=3095605109 TSecr=2630064081 [TCP segment of a reassembled PDU]"
90,36.234839,192.168.11.19,192.168.11.17,TCP,66,0.000123,,,"59510  >  6000 [FIN, ACK] Seq=28 Ack=1 Win=64256 Len=0 TSval=3095605109 TSecr=2630064081"
91,36.250761,192.168.11.17,192.168.11.19,TCP,66,0.015922,,,6000  >  59510 [ACK] Seq=1 Ack=28 Win=65152 Len=0 TSval=2630064098 TSecr=3095605109
92,36.250972,192.168.11.17,192.168.11.19,TCP,66,0.000211,,,"6000  >  59510 [FIN, ACK] Seq=1 Ack=29 Win=65152 Len=0 TSval=2630064100 TSecr=3095605109"
93,36.251028,192.168.11.19,192.168.11.17,TCP,66,0.000056,,,59510  >  6000 [ACK] Seq=29 Ack=2 Win=64256 Len=0 TSval=3095605125 TSecr=2630064100
94,36.28421,192.168.11.19,255.255.255.255,UDP,209,0.033182,Ÿ,7b2273656d616e74696373223a207b22656e74697479223a2022504944222c202262617365656e74697479223a2022616e79222c2022726f6c65223a2022737373222c20227370617469616c223a2022616e79222c202274656d706f72616c223a2022616e79227d2c20226461746170726f7065727479223a207b22666f726d6174223a2022696e616f6b615f70726f6772616d5f73616d706c655f73656d616e746963227d7d,41729  >  7000 Len=167
95,36.289886,192.168.11.20,192.168.11.19,TCP,74,0.005676,œ,,52892  >  6000 [SYN] Seq=0 Win=64240 Len=0 MSS=1460 SACK_PERM TSval=4104313452 TSecr=0 WS=128
96,36.290049,192.168.11.19,192.168.11.20,TCP,74,0.000163,,,"6000  >  52892 [SYN, ACK] Seq=0 Ack=1 Win=65160 Len=0 MSS=1460 SACK_PERM TSval=2756418301 TSecr=4104313452 WS=128"
97,36.298027,192.168.11.20,192.168.11.19,TCP,66,0.007978,,,52892  >  6000 [ACK] Seq=1 Ack=1 Win=64256 Len=0 TSval=4104313460 TSecr=2756418301
98,36.298517,192.168.11.20,192.168.11.19,TCP,93,0.00049,,,"52892  >  6000 [PSH, ACK] Seq=1 Ack=1 Win=64256 Len=27 TSval=4104313460 TSecr=2756418301 [TCP segment of a reassembled PDU]"
99,36.298644,192.168.11.19,192.168.11.20,TCP,66,0.000127,,,6000  >  52892 [ACK] Seq=1 Ack=28 Win=65152 Len=0 TSval=2756418310 TSecr=4104313460
100,36.298944,192.168.11.20,192.168.11.19,TCP,66,0.0003,,,"52892  >  6000 [FIN, ACK] Seq=28 Ack=1 Win=64256 Len=0 TSval=4104313460 TSecr=2756418301"
101,36.300247,192.168.11.19,192.168.11.20,TCP,66,0.001303,,,"6000  >  52892 [FIN, ACK] Seq=1 Ack=29 Win=65152 Len=0 TSval=2756418311 TSecr=4104313460"
102,36.30642,192.168.11.20,192.168.11.19,TCP,66,0.006173,,,52892  >  6000 [ACK] Seq=29 Ack=2 Win=64256 Len=0 TSval=4104313468 TSecr=2756418311
103,43.448975,192.168.11.19,192.168.11.17,TCP,74,7.142555,,,59522  >  6000 [SYN] Seq=0 Win=64240 Len=0 MSS=1460 SACK_PERM TSval=3095612323 TSecr=0 WS=128
104,43.456586,192.168.11.17,192.168.11.19,TCP,74,0.007611,,,"6000  >  59522 [SYN, ACK] Seq=0 Ack=1 Win=65160 Len=0 MSS=1460 SACK_PERM TSval=2630071304 TSecr=3095612323 WS=128"
105,43.456696,192.168.11.19,192.168.11.17,TCP,66,0.00011,,,59522  >  6000 [ACK] Seq=1 Ack=1 Win=64256 Len=0 TSval=3095612331 TSecr=2630071304
106,43.456816,192.168.11.19,192.168.11.17,TCP,93,0.00012,,,"59522  >  6000 [PSH, ACK] Seq=1 Ack=1 Win=64256 Len=27 TSval=3095612331 TSecr=2630071304 [TCP segment of a reassembled PDU]"
107,43.456916,192.168.11.19,192.168.11.17,TCP,66,0.0001,,,"59522  >  6000 [FIN, ACK] Seq=28 Ack=1 Win=64256 Len=0 TSval=3095612331 TSecr=2630071304"
108,43.465219,192.168.11.17,192.168.11.19,TCP,66,0.008303,,,6000  >  59522 [ACK] Seq=1 Ack=28 Win=65152 Len=0 TSval=2630071313 TSecr=3095612331
109,43.46563,192.168.11.17,192.168.11.19,TCP,66,0.000411,,,"6000  >  59522 [FIN, ACK] Seq=1 Ack=29 Win=65152 Len=0 TSval=2630071315 TSecr=3095612331"
110,43.465682,192.168.11.19,192.168.11.17,TCP,66,0.000052,,,59522  >  6000 [ACK] Seq=29 Ack=2 Win=64256 Len=0 TSval=3095612340 TSecr=2630071315
111,43.493005,192.168.11.19,255.255.255.255,UDP,209,0.027323,Ÿ,7b2273656d616e74696373223a207b22656e74697479223a2022504944222c202262617365656e74697479223a2022616e79222c2022726f6c65223a2022737373222c20227370617469616c223a2022616e79222c202274656d706f72616c223a2022616e79227d2c20226461746170726f7065727479223a207b22666f726d6174223a2022696e616f6b615f70726f6772616d5f73616d706c655f73656d616e746963227d7d,56258  >  7000 Len=167
112,43.49858,192.168.11.20,192.168.11.19,TCP,74,0.005575,œ,,40804  >  6000 [SYN] Seq=0 Win=64240 Len=0 MSS=1460 SACK_PERM TSval=4104320661 TSecr=0 WS=128
113,43.498694,192.168.11.19,192.168.11.20,TCP,74,0.000114,,,"6000  >  40804 [SYN, ACK] Seq=0 Ack=1 Win=65160 Len=0 MSS=1460 SACK_PERM TSval=2756425510 TSecr=4104320661 WS=128"
114,43.505348,192.168.11.20,192.168.11.19,TCP,66,0.006654,,,40804  >  6000 [ACK] Seq=1 Ack=1 Win=64256 Len=0 TSval=4104320668 TSecr=2756425510
115,43.505862,192.168.11.20,192.168.11.19,TCP,93,0.000514,,,"40804  >  6000 [PSH, ACK] Seq=1 Ack=1 Win=64256 Len=27 TSval=4104320668 TSecr=2756425510 [TCP segment of a reassembled PDU]"
116,43.505934,192.168.11.19,192.168.11.20,TCP,66,0.000072,,,6000  >  40804 [ACK] Seq=1 Ack=28 Win=65152 Len=0 TSval=2756425517 TSecr=4104320668
117,43.506,192.168.11.20,192.168.11.19,TCP,66,0.000066,,,"40804  >  6000 [FIN, ACK] Seq=28 Ack=1 Win=64256 Len=0 TSval=4104320668 TSecr=2756425510"
118,43.506915,192.168.11.19,192.168.11.20,TCP,66,0.000915,,,"6000  >  40804 [FIN, ACK] Seq=1 Ack=29 Win=65152 Len=0 TSval=2756425518 TSecr=4104320668"
119,43.513052,192.168.11.20,192.168.11.19,TCP,66,0.006137,,,40804  >  6000 [ACK] Seq=29 Ack=2 Win=64256 Len=0 TSval=4104320675 TSecr=2756425518
120,50.642049,192.168.11.19,192.168.11.17,TCP,74,7.128997,,,45744  >  6000 [SYN] Seq=0 Win=64240 Len=0 MSS=1460 SACK_PERM TSval=3095619516 TSecr=0 WS=128
121,50.648803,192.168.11.17,192.168.11.19,TCP,74,0.006754,,,"6000  >  45744 [SYN, ACK] Seq=0 Ack=1 Win=65160 Len=0 MSS=1460 SACK_PERM TSval=2630078497 TSecr=3095619516 WS=128"
122,50.648908,192.168.11.19,192.168.11.17,TCP,66,0.000105,,,45744  >  6000 [ACK] Seq=1 Ack=1 Win=64256 Len=0 TSval=3095619523 TSecr=2630078497
123,50.649073,192.168.11.19,192.168.11.17,TCP,93,0.000165,,,"45744  >  6000 [PSH, ACK] Seq=1 Ack=1 Win=64256 Len=27 TSval=3095619523 TSecr=2630078497 [TCP segment of a reassembled PDU]"
124,50.649182,192.168.11.19,192.168.11.17,TCP,66,0.000109,,,"45744  >  6000 [FIN, ACK] Seq=28 Ack=1 Win=64256 Len=0 TSval=3095619523 TSecr=2630078497"
125,50.656593,192.168.11.17,192.168.11.19,TCP,66,0.007411,,,6000  >  45744 [ACK] Seq=1 Ack=28 Win=65152 Len=0 TSval=2630078504 TSecr=3095619523
126,50.65698,192.168.11.17,192.168.11.19,TCP,66,0.000387,,,"6000  >  45744 [FIN, ACK] Seq=1 Ack=29 Win=65152 Len=0 TSval=2630078506 TSecr=3095619523"
127,50.657026,192.168.11.19,192.168.11.17,TCP,66,0.000046,,,45744  >  6000 [ACK] Seq=29 Ack=2 Win=64256 Len=0 TSval=3095619531 TSecr=2630078506
128,50.687107,192.168.11.19,255.255.255.255,UDP,209,0.030081,Ÿ,7b2273656d616e74696373223a207b22656e74697479223a2022504944222c202262617365656e74697479223a2022616e79222c2022726f6c65223a2022737373222c20227370617469616c223a2022616e79222c202274656d706f72616c223a2022616e79227d2c20226461746170726f7065727479223a207b22666f726d6174223a2022696e616f6b615f70726f6772616d5f73616d706c655f73656d616e746963227d7d,58097  >  7000 Len=167
129,50.693836,192.168.11.20,192.168.11.19,TCP,74,0.006729,œ,,40820  >  6000 [SYN] Seq=0 Win=64240 Len=0 MSS=1460 SACK_PERM TSval=4104327855 TSecr=0 WS=128
130,50.693974,192.168.11.19,192.168.11.20,TCP,74,0.000138,,,"6000  >  40820 [SYN, ACK] Seq=0 Ack=1 Win=65160 Len=0 MSS=1460 SACK_PERM TSval=2756432705 TSecr=4104327855 WS=128"
131,50.703639,192.168.11.20,192.168.11.19,TCP,66,0.009665,,,40820  >  6000 [ACK] Seq=1 Ack=1 Win=64256 Len=0 TSval=4104327866 TSecr=2756432705
132,50.704271,192.168.11.20,192.168.11.19,TCP,93,0.000632,,,"40820  >  6000 [PSH, ACK] Seq=1 Ack=1 Win=64256 Len=27 TSval=4104327866 TSecr=2756432705 [TCP segment of a reassembled PDU]"
133,50.704388,192.168.11.19,192.168.11.20,TCP,66,0.000117,,,6000  >  40820 [ACK] Seq=1 Ack=28 Win=65152 Len=0 TSval=2756432716 TSecr=4104327866
134,50.70447,192.168.11.20,192.168.11.19,TCP,66,0.000082,,,"40820  >  6000 [FIN, ACK] Seq=28 Ack=1 Win=64256 Len=0 TSval=4104327866 TSecr=2756432705"
135,50.70593,192.168.11.19,192.168.11.20,TCP,66,0.00146,,,"6000  >  40820 [FIN, ACK] Seq=1 Ack=29 Win=65152 Len=0 TSval=2756432717 TSecr=4104327866"
136,50.711761,192.168.11.20,192.168.11.19,TCP,66,0.005831,,,40820  >  6000 [ACK] Seq=29 Ack=2 Win=64256 Len=0 TSval=4104327874 TSecr=2756432717
137,57.802877,192.168.11.19,192.168.11.17,TCP,74,7.091116,,,46860  >  6000 [SYN] Seq=0 Win=64240 Len=0 MSS=1460 SACK_PERM TSval=3095626677 TSecr=0 WS=128
138,57.810543,192.168.11.17,192.168.11.19,TCP,74,0.007666,,,"6000  >  46860 [SYN, ACK] Seq=0 Ack=1 Win=65160 Len=0 MSS=1460 SACK_PERM TSval=2630085658 TSecr=3095626677 WS=128"
139,57.810645,192.168.11.19,192.168.11.17,TCP,66,0.000102,,,46860  >  6000 [ACK] Seq=1 Ack=1 Win=64256 Len=0 TSval=3095626685 TSecr=2630085658
140,57.810771,192.168.11.19,192.168.11.17,TCP,93,0.000126,,,"46860  >  6000 [PSH, ACK] Seq=1 Ack=1 Win=64256 Len=27 TSval=3095626685 TSecr=2630085658 [TCP segment of a reassembled PDU]"
141,57.810883,192.168.11.19,192.168.11.17,TCP,66,0.000112,,,"46860  >  6000 [FIN, ACK] Seq=28 Ack=1 Win=64256 Len=0 TSval=3095626685 TSecr=2630085658"
142,57.818337,192.168.11.17,192.168.11.19,TCP,66,0.007454,,,6000  >  46860 [ACK] Seq=1 Ack=28 Win=65152 Len=0 TSval=2630085666 TSecr=3095626685
143,57.820342,192.168.11.17,192.168.11.19,TCP,66,0.002005,,,"6000  >  46860 [FIN, ACK] Seq=1 Ack=29 Win=65152 Len=0 TSval=2630085668 TSecr=3095626685"
144,57.820386,192.168.11.19,192.168.11.17,TCP,66,0.000044,,,46860  >  6000 [ACK] Seq=29 Ack=2 Win=64256 Len=0 TSval=3095626695 TSecr=2630085668
145,57.848531,192.168.11.19,255.255.255.255,UDP,209,0.028145,Ÿ,7b2273656d616e74696373223a207b22656e74697479223a2022504944222c202262617365656e74697479223a2022616e79222c2022726f6c65223a2022737373222c20227370617469616c223a2022616e79222c202274656d706f72616c223a2022616e79227d2c20226461746170726f7065727479223a207b22666f726d6174223a2022696e616f6b615f70726f6772616d5f73616d706c655f73656d616e746963227d7d,51102  >  7000 Len=167
146,57.854084,192.168.11.20,192.168.11.19,TCP,74,0.005553,œ,,53766  >  6000 [SYN] Seq=0 Win=64240 Len=0 MSS=1460 SACK_PERM TSval=4104335017 TSecr=0 WS=128
147,57.854186,192.168.11.19,192.168.11.20,TCP,74,0.000102,,,"6000  >  53766 [SYN, ACK] Seq=0 Ack=1 Win=65160 Len=0 MSS=1460 SACK_PERM TSval=2756439865 TSecr=4104335017 WS=128"
148,57.861174,192.168.11.20,192.168.11.19,TCP,66,0.006988,,,53766  >  6000 [ACK] Seq=1 Ack=1 Win=64256 Len=0 TSval=4104335024 TSecr=2756439865
149,57.861811,192.168.11.20,192.168.11.19,TCP,93,0.000637,,,"53766  >  6000 [PSH, ACK] Seq=1 Ack=1 Win=64256 Len=27 TSval=4104335024 TSecr=2756439865 [TCP segment of a reassembled PDU]"
150,57.861922,192.168.11.19,192.168.11.20,TCP,66,0.000111,,,6000  >  53766 [ACK] Seq=1 Ack=28 Win=65152 Len=0 TSval=2756439873 TSecr=4104335024
151,57.862002,192.168.11.20,192.168.11.19,TCP,66,0.00008,,,"53766  >  6000 [FIN, ACK] Seq=28 Ack=1 Win=64256 Len=0 TSval=4104335024 TSecr=2756439865"
152,57.863085,192.168.11.19,192.168.11.20,TCP,66,0.001083,,,"6000  >  53766 [FIN, ACK] Seq=1 Ack=29 Win=65152 Len=0 TSval=2756439874 TSecr=4104335024"
153,57.869597,192.168.11.20,192.168.11.19,TCP,66,0.006512,,,53766  >  6000 [ACK] Seq=29 Ack=2 Win=64256 Len=0 TSval=4104335032 TSecr=2756439874
154,64.944558,192.168.11.19,192.168.11.17,TCP,74,7.074961,,,35826  >  6000 [SYN] Seq=0 Win=64240 Len=0 MSS=1460 SACK_PERM TSval=3095633819 TSecr=0 WS=128
155,64.95219,192.168.11.17,192.168.11.19,TCP,74,0.007632,,,"6000  >  35826 [SYN, ACK] Seq=0 Ack=1 Win=65160 Len=0 MSS=1460 SACK_PERM TSval=2630092800 TSecr=3095633819 WS=128"
156,64.952291,192.168.11.19,192.168.11.17,TCP,66,0.000101,,,35826  >  6000 [ACK] Seq=1 Ack=1 Win=64256 Len=0 TSval=3095633827 TSecr=2630092800
157,64.952416,192.168.11.19,192.168.11.17,TCP,93,0.000125,,,"35826  >  6000 [PSH, ACK] Seq=1 Ack=1 Win=64256 Len=27 TSval=3095633827 TSecr=2630092800 [TCP segment of a reassembled PDU]"
158,64.952519,192.168.11.19,192.168.11.17,TCP,66,0.000103,,,"35826  >  6000 [FIN, ACK] Seq=28 Ack=1 Win=64256 Len=0 TSval=3095633827 TSecr=2630092800"
159,64.959955,192.168.11.17,192.168.11.19,TCP,66,0.007436,,,6000  >  35826 [ACK] Seq=1 Ack=28 Win=65152 Len=0 TSval=2630092807 TSecr=3095633827
160,64.961912,192.168.11.17,192.168.11.19,TCP,66,0.001957,,,"6000  >  35826 [FIN, ACK] Seq=1 Ack=29 Win=65152 Len=0 TSval=2630092810 TSecr=3095633827"
161,64.961957,192.168.11.19,192.168.11.17,TCP,66,0.000045,,,35826  >  6000 [ACK] Seq=29 Ack=2 Win=64256 Len=0 TSval=3095633836 TSecr=2630092810
162,64.990616,192.168.11.19,255.255.255.255,UDP,209,0.028659,Ÿ,7b2273656d616e74696373223a207b22656e74697479223a2022504944222c202262617365656e74697479223a2022616e79222c2022726f6c65223a2022737373222c20227370617469616c223a2022616e79222c202274656d706f72616c223a2022616e79227d2c20226461746170726f7065727479223a207b22666f726d6174223a2022696e616f6b615f70726f6772616d5f73616d706c655f73656d616e746963227d7d,49065  >  7000 Len=167
163,64.996055,192.168.11.20,192.168.11.19,TCP,74,0.005439,œ,,34518  >  6000 [SYN] Seq=0 Win=64240 Len=0 MSS=1460 SACK_PERM TSval=4104342159 TSecr=0 WS=128
164,64.996169,192.168.11.19,192.168.11.20,TCP,74,0.000114,,,"6000  >  34518 [SYN, ACK] Seq=0 Ack=1 Win=65160 Len=0 MSS=1460 SACK_PERM TSval=2756447007 TSecr=4104342159 WS=128"
165,65.002891,192.168.11.20,192.168.11.19,TCP,66,0.006722,,,34518  >  6000 [ACK] Seq=1 Ack=1 Win=64256 Len=0 TSval=4104342166 TSecr=2756447007
166,65.003473,192.168.11.20,192.168.11.19,TCP,93,0.000582,,,"34518  >  6000 [PSH, ACK] Seq=1 Ack=1 Win=64256 Len=27 TSval=4104342166 TSecr=2756447007 [TCP segment of a reassembled PDU]"
167,65.003574,192.168.11.19,192.168.11.20,TCP,66,0.000101,,,6000  >  34518 [ACK] Seq=1 Ack=28 Win=65152 Len=0 TSval=2756447015 TSecr=4104342166
168,65.003654,192.168.11.20,192.168.11.19,TCP,66,0.00008,,,"34518  >  6000 [FIN, ACK] Seq=28 Ack=1 Win=64256 Len=0 TSval=4104342166 TSecr=2756447007"
169,65.004769,192.168.11.19,192.168.11.20,TCP,66,0.001115,,,"6000  >  34518 [FIN, ACK] Seq=1 Ack=29 Win=65152 Len=0 TSval=2756447016 TSecr=4104342166"
170,65.010971,192.168.11.20,192.168.11.19,TCP,66,0.006202,,,34518  >  6000 [ACK] Seq=29 Ack=2 Win=64256 Len=0 TSval=4104342173 TSecr=2756447016
171,110.608136,192.168.11.19,192.168.11.17,TCP,74,45.597165,,,43516  >  6000 [SYN] Seq=0 Win=64240 Len=0 MSS=1460 SACK_PERM TSval=3095679482 TSecr=0 WS=128
172,110.615809,192.168.11.17,192.168.11.19,TCP,74,0.007673,,,"6000  >  43516 [SYN, ACK] Seq=0 Ack=1 Win=65160 Len=0 MSS=1460 SACK_PERM TSval=2630138464 TSecr=3095679482 WS=128"
173,110.615906,192.168.11.19,192.168.11.17,TCP,66,0.000097,,,43516  >  6000 [ACK] Seq=1 Ack=1 Win=64256 Len=0 TSval=3095679490 TSecr=2630138464
174,110.616042,192.168.11.19,192.168.11.17,TCP,93,0.000136,,,"43516  >  6000 [PSH, ACK] Seq=1 Ack=1 Win=64256 Len=27 TSval=3095679490 TSecr=2630138464 [TCP segment of a reassembled PDU]"
175,110.616138,192.168.11.19,192.168.11.17,TCP,66,0.000096,,,"43516  >  6000 [FIN, ACK] Seq=28 Ack=1 Win=64256 Len=0 TSval=3095679490 TSecr=2630138464"
176,110.624046,192.168.11.17,192.168.11.19,TCP,66,0.007908,,,6000  >  43516 [ACK] Seq=1 Ack=28 Win=65152 Len=0 TSval=2630138472 TSecr=3095679490
177,110.624264,192.168.11.17,192.168.11.19,TCP,66,0.000218,,,"6000  >  43516 [FIN, ACK] Seq=1 Ack=29 Win=65152 Len=0 TSval=2630138473 TSecr=3095679490"
178,110.624307,192.168.11.19,192.168.11.17,TCP,66,0.000043,,,43516  >  6000 [ACK] Seq=29 Ack=2 Win=64256 Len=0 TSval=3095679499 TSecr=2630138473
179,110.65309,192.168.11.19,255.255.255.255,UDP,209,0.028783,Ÿ,7b2273656d616e74696373223a207b22656e74697479223a2022504944222c202262617365656e74697479223a2022616e79222c2022726f6c65223a2022737373222c20227370617469616c223a2022616e79222c202274656d706f72616c223a2022616e79227d2c20226461746170726f7065727479223a207b22666f726d6174223a2022696e616f6b615f70726f6772616d5f73616d706c655f73656d616e746963227d7d,33667  >  7000 Len=167
180,110.658798,192.168.11.20,192.168.11.19,TCP,74,0.005708,œ,,41534  >  6000 [SYN] Seq=0 Win=64240 Len=0 MSS=1460 SACK_PERM TSval=4104387823 TSecr=0 WS=128
181,110.658923,192.168.11.19,192.168.11.20,TCP,74,0.000125,,,"6000  >  41534 [SYN, ACK] Seq=0 Ack=1 Win=65160 Len=0 MSS=1460 SACK_PERM TSval=2756492670 TSecr=4104387823 WS=128"
182,110.665768,192.168.11.20,192.168.11.19,TCP,66,0.006845,,,41534  >  6000 [ACK] Seq=1 Ack=1 Win=64256 Len=0 TSval=4104387829 TSecr=2756492670
183,110.666392,192.168.11.20,192.168.11.19,TCP,93,0.000624,,,"41534  >  6000 [PSH, ACK] Seq=1 Ack=1 Win=64256 Len=27 TSval=4104387829 TSecr=2756492670 [TCP segment of a reassembled PDU]"
184,110.666485,192.168.11.19,192.168.11.20,TCP,66,0.000093,,,6000  >  41534 [ACK] Seq=1 Ack=28 Win=65152 Len=0 TSval=2756492678 TSecr=4104387829
185,110.666564,192.168.11.20,192.168.11.19,TCP,66,0.000079,,,"41534  >  6000 [FIN, ACK] Seq=28 Ack=1 Win=64256 Len=0 TSval=4104387830 TSecr=2756492670"
186,110.667565,192.168.11.19,192.168.11.20,TCP,66,0.001001,,,"6000  >  41534 [FIN, ACK] Seq=1 Ack=29 Win=65152 Len=0 TSval=2756492679 TSecr=4104387830"
187,110.673992,192.168.11.20,192.168.11.19,TCP,66,0.006427,,,41534  >  6000 [ACK] Seq=29 Ack=2 Win=64256 Len=0 TSval=4104387837 TSecr=2756492679
188,117.770313,192.168.11.19,192.168.11.17,TCP,74,7.096321,,,43656  >  6000 [SYN] Seq=0 Win=64240 Len=0 MSS=1460 SACK_PERM TSval=3095686645 TSecr=0 WS=128
189,117.776875,192.168.11.17,192.168.11.19,TCP,74,0.006562,,,"6000  >  43656 [SYN, ACK] Seq=0 Ack=1 Win=65160 Len=0 MSS=1460 SACK_PERM TSval=2630145625 TSecr=3095686645 WS=128"
190,117.776968,192.168.11.19,192.168.11.17,TCP,66,0.000093,,,43656  >  6000 [ACK] Seq=1 Ack=1 Win=64256 Len=0 TSval=3095686651 TSecr=2630145625
191,117.777093,192.168.11.19,192.168.11.17,TCP,93,0.000125,,,"43656  >  6000 [PSH, ACK] Seq=1 Ack=1 Win=64256 Len=27 TSval=3095686651 TSecr=2630145625 [TCP segment of a reassembled PDU]"
192,117.777216,192.168.11.19,192.168.11.17,TCP,66,0.000123,,,"43656  >  6000 [FIN, ACK] Seq=28 Ack=1 Win=64256 Len=0 TSval=3095686651 TSecr=2630145625"
193,117.784165,192.168.11.17,192.168.11.19,TCP,66,0.006949,,,6000  >  43656 [ACK] Seq=1 Ack=28 Win=65152 Len=0 TSval=2630145632 TSecr=3095686651
194,117.784524,192.168.11.17,192.168.11.19,TCP,66,0.000359,,,"6000  >  43656 [FIN, ACK] Seq=1 Ack=29 Win=65152 Len=0 TSval=2630145633 TSecr=3095686651"
195,117.784574,192.168.11.19,192.168.11.17,TCP,66,0.00005,,,43656  >  6000 [ACK] Seq=29 Ack=2 Win=64256 Len=0 TSval=3095686659 TSecr=2630145633
196,117.812413,192.168.11.19,255.255.255.255,UDP,209,0.027839,Ÿ,7b2273656d616e74696373223a207b22656e74697479223a2022504944222c202262617365656e74697479223a2022616e79222c2022726f6c65223a2022737373222c20227370617469616c223a2022616e79222c202274656d706f72616c223a2022616e79227d2c20226461746170726f7065727479223a207b22666f726d6174223a2022696e616f6b615f70726f6772616d5f73616d706c655f73656d616e746963227d7d,60823  >  7000 Len=167
197,117.819083,192.168.11.20,192.168.11.19,TCP,74,0.00667,œ,,36568  >  6000 [SYN] Seq=0 Win=64240 Len=0 MSS=1460 SACK_PERM TSval=4104394982 TSecr=0 WS=128
198,117.819188,192.168.11.19,192.168.11.20,TCP,74,0.000105,,,"6000  >  36568 [SYN, ACK] Seq=0 Ack=1 Win=65160 Len=0 MSS=1460 SACK_PERM TSval=2756499830 TSecr=4104394982 WS=128"
199,117.825952,192.168.11.20,192.168.11.19,TCP,66,0.006764,,,36568  >  6000 [ACK] Seq=1 Ack=1 Win=64256 Len=0 TSval=4104394990 TSecr=2756499830
200,117.826576,192.168.11.20,192.168.11.19,TCP,93,0.000624,,,"36568  >  6000 [PSH, ACK] Seq=1 Ack=1 Win=64256 Len=27 TSval=4104394990 TSecr=2756499830 [TCP segment of a reassembled PDU]"
201,117.826679,192.168.11.19,192.168.11.20,TCP,66,0.000103,,,6000  >  36568 [ACK] Seq=1 Ack=28 Win=65152 Len=0 TSval=2756499838 TSecr=4104394990
202,117.826758,192.168.11.20,192.168.11.19,TCP,66,0.000079,,,"36568  >  6000 [FIN, ACK] Seq=28 Ack=1 Win=64256 Len=0 TSval=4104394990 TSecr=2756499830"
203,117.827876,192.168.11.19,192.168.11.20,TCP,66,0.001118,,,"6000  >  36568 [FIN, ACK] Seq=1 Ack=29 Win=65152 Len=0 TSval=2756499839 TSecr=4104394990"
204,117.834005,192.168.11.20,192.168.11.19,TCP,66,0.006129,,,36568  >  6000 [ACK] Seq=29 Ack=2 Win=64256 Len=0 TSval=4104394998 TSecr=2756499839
205,125.019732,192.168.11.19,192.168.11.17,TCP,74,7.185727,,,51616  >  6000 [SYN] Seq=0 Win=64240 Len=0 MSS=1460 SACK_PERM TSval=3095693894 TSecr=0 WS=128
206,125.026289,192.168.11.17,192.168.11.19,TCP,74,0.006557,,,"6000  >  51616 [SYN, ACK] Seq=0 Ack=1 Win=65160 Len=0 MSS=1460 SACK_PERM TSval=2630152874 TSecr=3095693894 WS=128"
207,125.026392,192.168.11.19,192.168.11.17,TCP,66,0.000103,,,51616  >  6000 [ACK] Seq=1 Ack=1 Win=64256 Len=0 TSval=3095693901 TSecr=2630152874
208,125.026562,192.168.11.19,192.168.11.17,TCP,93,0.00017,,,"51616  >  6000 [PSH, ACK] Seq=1 Ack=1 Win=64256 Len=27 TSval=3095693901 TSecr=2630152874 [TCP segment of a reassembled PDU]"
209,125.026659,192.168.11.19,192.168.11.17,TCP,66,0.000097,,,"51616  >  6000 [FIN, ACK] Seq=28 Ack=1 Win=64256 Len=0 TSval=3095693901 TSecr=2630152874"
210,125.033789,192.168.11.17,192.168.11.19,TCP,66,0.00713,,,6000  >  51616 [ACK] Seq=1 Ack=28 Win=65152 Len=0 TSval=2630152881 TSecr=3095693901
211,125.033999,192.168.11.17,192.168.11.19,TCP,66,0.00021,,,"6000  >  51616 [FIN, ACK] Seq=1 Ack=29 Win=65152 Len=0 TSval=2630152883 TSecr=3095693901"
212,125.034042,192.168.11.19,192.168.11.17,TCP,66,0.000043,,,51616  >  6000 [ACK] Seq=29 Ack=2 Win=64256 Len=0 TSval=3095693908 TSecr=2630152883
213,125.063668,192.168.11.19,255.255.255.255,UDP,209,0.029626,Ÿ,7b2273656d616e74696373223a207b22656e74697479223a2022504944222c202262617365656e74697479223a2022616e79222c2022726f6c65223a2022737373222c20227370617469616c223a2022616e79222c202274656d706f72616c223a2022616e79227d2c20226461746170726f7065727479223a207b22666f726d6174223a2022696e616f6b615f70726f6772616d5f73616d706c655f73656d616e746963227d7d,47369  >  7000 Len=167
214,125.069458,192.168.11.20,192.168.11.19,TCP,74,0.00579,œ,,55428  >  6000 [SYN] Seq=0 Win=64240 Len=0 MSS=1460 SACK_PERM TSval=4104402233 TSecr=0 WS=128
215,125.069582,192.168.11.19,192.168.11.20,TCP,74,0.000124,,,"6000  >  55428 [SYN, ACK] Seq=0 Ack=1 Win=65160 Len=0 MSS=1460 SACK_PERM TSval=2756507081 TSecr=4104402233 WS=128"
216,125.076293,192.168.11.20,192.168.11.19,TCP,66,0.006711,,,55428  >  6000 [ACK] Seq=1 Ack=1 Win=64256 Len=0 TSval=4104402240 TSecr=2756507081
217,125.076903,192.168.11.20,192.168.11.19,TCP,93,0.00061,,,"55428  >  6000 [PSH, ACK] Seq=1 Ack=1 Win=64256 Len=27 TSval=4104402240 TSecr=2756507081 [TCP segment of a reassembled PDU]"
218,125.07695,192.168.11.20,192.168.11.19,TCP,66,0.000047,,,"55428  >  6000 [FIN, ACK] Seq=28 Ack=1 Win=64256 Len=0 TSval=4104402241 TSecr=2756507081"
219,125.07702,192.168.11.19,192.168.11.20,TCP,66,0.00007,,,6000  >  55428 [ACK] Seq=1 Ack=28 Win=65152 Len=0 TSval=2756507088 TSecr=4104402240
220,125.078428,192.168.11.19,192.168.11.20,TCP,66,0.001408,,,"6000  >  55428 [FIN, ACK] Seq=1 Ack=29 Win=65152 Len=0 TSval=2756507090 TSecr=4104402241"
221,125.084681,192.168.11.20,192.168.11.19,TCP,66,0.006253,,,55428  >  6000 [ACK] Seq=29 Ack=2 Win=64256 Len=0 TSval=4104402248 TSecr=2756507090
222,132.180923,192.168.11.19,192.168.11.17,TCP,74,7.096242,,,51630  >  6000 [SYN] Seq=0 Win=64240 Len=0 MSS=1460 SACK_PERM TSval=3095701055 TSecr=0 WS=128
223,132.189253,192.168.11.17,192.168.11.19,TCP,74,0.00833,,,"6000  >  51630 [SYN, ACK] Seq=0 Ack=1 Win=65160 Len=0 MSS=1460 SACK_PERM TSval=2630160037 TSecr=3095701055 WS=128"
224,132.189371,192.168.11.19,192.168.11.17,TCP,66,0.000118,,,51630  >  6000 [ACK] Seq=1 Ack=1 Win=64256 Len=0 TSval=3095701064 TSecr=2630160037
225,132.189568,192.168.11.19,192.168.11.17,TCP,93,0.000197,,,"51630  >  6000 [PSH, ACK] Seq=1 Ack=1 Win=64256 Len=27 TSval=3095701064 TSecr=2630160037 [TCP segment of a reassembled PDU]"
226,132.189659,192.168.11.19,192.168.11.17,TCP,66,0.000091,,,"51630  >  6000 [FIN, ACK] Seq=28 Ack=1 Win=64256 Len=0 TSval=3095701064 TSecr=2630160037"
227,132.196986,192.168.11.17,192.168.11.19,TCP,66,0.007327,,,6000  >  51630 [ACK] Seq=1 Ack=28 Win=65152 Len=0 TSval=2630160045 TSecr=3095701064
228,132.197388,192.168.11.17,192.168.11.19,TCP,66,0.000402,,,"6000  >  51630 [FIN, ACK] Seq=1 Ack=29 Win=65152 Len=0 TSval=2630160046 TSecr=3095701064"
229,132.197439,192.168.11.19,192.168.11.17,TCP,66,0.000051,,,51630  >  6000 [ACK] Seq=29 Ack=2 Win=64256 Len=0 TSval=3095701072 TSecr=2630160046
230,132.226745,192.168.11.19,255.255.255.255,UDP,209,0.029306,Ÿ,7b2273656d616e74696373223a207b22656e74697479223a2022504944222c202262617365656e74697479223a2022616e79222c2022726f6c65223a2022737373222c20227370617469616c223a2022616e79222c202274656d706f72616c223a2022616e79227d2c20226461746170726f7065727479223a207b22666f726d6174223a2022696e616f6b615f70726f6772616d5f73616d706c655f73656d616e746963227d7d,47392  >  7000 Len=167
231,132.232288,192.168.11.20,192.168.11.19,TCP,74,0.005543,œ,,43990  >  6000 [SYN] Seq=0 Win=64240 Len=0 MSS=1460 SACK_PERM TSval=4104409396 TSecr=0 WS=128
