No.,Time,Source,Destination,Protocol,Length,Time delta from previous captured frame,XXX,Data,Info
1,0,192.168.11.20,192.168.11.19,TCP,74,0,,,59060  >  6000 [SYN] Seq=0 Win=64240 Len=0 MSS=1460 SACK_PERM TSval=4104277225 TSecr=0 WS=128
2,0.006745,192.168.11.19,192.168.11.20,TCP,74,0.006745,,,"6000  >  59060 [SYN, ACK] Seq=0 Ack=1 Win=65160 Len=0 MSS=1460 SACK_PERM TSval=2756382078 TSecr=4104277225 WS=128"
3,0.006866,192.168.11.20,192.168.11.19,TCP,66,0.000121,,,59060  >  6000 [ACK] Seq=1 Ack=1 Win=64256 Len=0 TSval=4104277235 TSecr=2756382078
4,0.007093,192.168.11.20,192.168.11.19,TCP,93,0.000227,,,"59060  >  6000 [PSH, ACK] Seq=1 Ack=1 Win=64256 Len=27 TSval=4104277235 TSecr=2756382078 [TCP segment of a reassembled PDU]"
5,0.007227,192.168.11.20,192.168.11.19,TCP,66,0.000134,,,"59060  >  6000 [FIN, ACK] Seq=28 Ack=1 Win=64256 Len=0 TSval=4104277235 TSecr=2756382078"
6,0.014293,192.168.11.19,192.168.11.20,TCP,66,0.007066,,,6000  >  59060 [ACK] Seq=1 Ack=28 Win=65152 Len=0 TSval=2756382085 TSecr=4104277235
7,0.014698,192.168.11.19,192.168.11.20,TCP,66,0.000405,,,"6000  >  59060 [FIN, ACK] Seq=1 Ack=29 Win=65152 Len=0 TSval=2756382087 TSecr=4104277235"
8,0.014745,192.168.11.20,192.168.11.19,TCP,66,0.000047,,,59060  >  6000 [ACK] Seq=29 Ack=2 Win=64256 Len=0 TSval=4104277243 TSecr=2756382087
9,0.045548,192.168.11.20,255.255.255.255,UDP,209,0.030803,Ÿ,7b2273656d616e74696373223a207b22656e74697479223a2022504944222c202262617365656e74697479223a2022616e79222c2022726f6c65223a2022747474222c20227370617469616c223a2022616e79222c202274656d706f72616c223a2022616e79227d2c20226461746170726f7065727479223a207b22666f726d6174223a2022696e616f6b615f70726f6772616d5f73616d706c655f73656d616e746963227d7d,55006  >  7000 Len=167
10,0.055281,192.168.11.12,192.168.11.20,TCP,74,0.009733,œ,,50492  >  6000 [SYN] Seq=0 Win=64240 Len=0 MSS=1460 SACK_PERM TSval=2817687186 TSecr=0 WS=128
11,0.055453,192.168.11.20,192.168.11.12,TCP,74,0.000172,,,"6000  >  50492 [SYN, ACK] Seq=0 Ack=1 Win=65160 Len=0 MSS=1460 SACK_PERM TSval=1200307212 TSecr=2817687186 WS=128"
12,0.06238,192.168.11.12,192.168.11.20,TCP,66,0.006927,,,50492  >  6000 [ACK] Seq=1 Ack=1 Win=64256 Len=0 TSval=2817687196 TSecr=1200307212
13,0.063044,192.168.11.12,192.168.11.20,TCP,93,0.000664,,,"50492  >  6000 [PSH, ACK] Seq=1 Ack=1 Win=64256 Len=27 TSval=2817687197 TSecr=1200307212 [TCP segment of a reassembled PDU]"
14,0.06313,192.168.11.20,192.168.11.12,TCP,66,0.000086,,,6000  >  50492 [ACK] Seq=1 Ack=28 Win=65152 Len=0 TSval=1200307220 TSecr=2817687197
15,0.063215,192.168.11.12,192.168.11.20,TCP,66,0.000085,,,"50492  >  6000 [FIN, ACK] Seq=28 Ack=1 Win=64256 Len=0 TSval=2817687197 TSecr=1200307212"
16,0.064708,192.168.11.20,192.168.11.12,TCP,66,0.001493,,,"6000  >  50492 [FIN, ACK] Seq=1 Ack=29 Win=65152 Len=0 TSval=1200307222 TSecr=2817687197"
17,0.070735,192.168.11.12,192.168.11.20,TCP,66,0.006027,,,50492  >  6000 [ACK] Seq=29 Ack=2 Win=64256 Len=0 TSval=2817687205 TSecr=1200307222
18,7.303325,192.168.11.20,192.168.11.19,TCP,74,7.23259,,,43556  >  6000 [SYN] Seq=0 Win=64240 Len=0 MSS=1460 SACK_PERM TSval=4104284531 TSecr=0 WS=128
19,7.310252,192.168.11.19,192.168.11.20,TCP,74,0.006927,,,"6000  >  43556 [SYN, ACK] Seq=0 Ack=1 Win=65160 Len=0 MSS=1460 SACK_PERM TSval=2756389381 TSecr=4104284531 WS=128"
20,7.310357,192.168.11.20,192.168.11.19,TCP,66,0.000105,,,43556  >  6000 [ACK] Seq=1 Ack=1 Win=64256 Len=0 TSval=4104284538 TSecr=2756389381
21,7.310504,192.168.11.20,192.168.11.19,TCP,93,0.000147,,,"43556  >  6000 [PSH, ACK] Seq=1 Ack=1 Win=64256 Len=27 TSval=4104284538 TSecr=2756389381 [TCP segment of a reassembled PDU]"
22,7.31064,192.168.11.20,192.168.11.19,TCP,66,0.000136,,,"43556  >  6000 [FIN, ACK] Seq=28 Ack=1 Win=64256 Len=0 TSval=4104284539 TSecr=2756389381"
23,7.317743,192.168.11.19,192.168.11.20,TCP,66,0.007103,,,6000  >  43556 [ACK] Seq=1 Ack=28 Win=65152 Len=0 TSval=2756389388 TSecr=4104284538
24,7.318106,192.168.11.19,192.168.11.20,TCP,66,0.000363,,,"6000  >  43556 [FIN, ACK] Seq=1 Ack=29 Win=65152 Len=0 TSval=2756389389 TSecr=4104284539"
25,7.318154,192.168.11.20,192.168.11.19,TCP,66,0.000048,,,43556  >  6000 [ACK] Seq=29 Ack=2 Win=64256 Len=0 TSval=4104284546 TSecr=2756389389
26,7.346337,192.168.11.20,255.255.255.255,UDP,209,0.028183,Ÿ,7b2273656d616e74696373223a207b22656e74697479223a2022504944222c202262617365656e74697479223a2022616e79222c2022726f6c65223a2022747474222c20227370617469616c223a2022616e79222c202274656d706f72616c223a2022616e79227d2c20226461746170726f7065727479223a207b22666f726d6174223a2022696e616f6b615f70726f6772616d5f73616d706c655f73656d616e746963227d7d,56482  >  7000 Len=167
27,7.352036,192.168.11.12,192.168.11.20,TCP,74,0.005699,œ,,37066  >  6000 [SYN] Seq=0 Win=64240 Len=0 MSS=1460 SACK_PERM TSval=2817694486 TSecr=0 WS=128
28,7.352159,192.168.11.20,192.168.11.12,TCP,74,0.000123,,,"6000  >  37066 [SYN, ACK] Seq=0 Ack=1 Win=65160 Len=0 MSS=1460 SACK_PERM TSval=1200314509 TSecr=2817694486 WS=128"
29,7.35918,192.168.11.12,192.168.11.20,TCP,66,0.007021,,,37066  >  6000 [ACK] Seq=1 Ack=1 Win=64256 Len=0 TSval=2817694493 TSecr=1200314509
30,7.359833,192.168.11.12,192.168.11.20,TCP,93,0.000653,,,"37066  >  6000 [PSH, ACK] Seq=1 Ack=1 Win=64256 Len=27 TSval=2817694493 TSecr=1200314509 [TCP segment of a reassembled PDU]"
31,7.359955,192.168.11.20,192.168.11.12,TCP,66,0.000122,,,6000  >  37066 [ACK] Seq=1 Ack=28 Win=65152 Len=0 TSval=1200314517 TSecr=2817694493
32,7.360031,192.168.11.12,192.168.11.20,TCP,66,0.000076,,,"37066  >  6000 [FIN, ACK] Seq=28 Ack=1 Win=64256 Len=0 TSval=2817694493 TSecr=1200314509"
33,7.361402,192.168.11.20,192.168.11.12,TCP,66,0.001371,,,"6000  >  37066 [FIN, ACK] Seq=1 Ack=29 Win=65152 Len=0 TSval=1200314518 TSecr=2817694493"
34,7.368765,192.168.11.12,192.168.11.20,TCP,66,0.007363,,,37066  >  6000 [ACK] Seq=29 Ack=2 Win=64256 Len=0 TSval=2817694501 TSecr=1200314518
35,14.64716,192.168.11.20,192.168.11.19,TCP,74,7.278395,,,46852  >  6000 [SYN] Seq=0 Win=64240 Len=0 MSS=1460 SACK_PERM TSval=4104291875 TSecr=0 WS=128
36,14.653959,192.168.11.19,192.168.11.20,TCP,74,0.006799,,,"6000  >  46852 [SYN, ACK] Seq=0 Ack=1 Win=65160 Len=0 MSS=1460 SACK_PERM TSval=2756396725 TSecr=4104291875 WS=128"
37,14.654084,192.168.11.20,192.168.11.19,TCP,66,0.000125,,,46852  >  6000 [ACK] Seq=1 Ack=1 Win=64256 Len=0 TSval=4104291882 TSecr=2756396725
38,14.654251,192.168.11.20,192.168.11.19,TCP,93,0.000167,,,"46852  >  6000 [PSH, ACK] Seq=1 Ack=1 Win=64256 Len=27 TSval=4104291882 TSecr=2756396725 [TCP segment of a reassembled PDU]"
39,14.654357,192.168.11.20,192.168.11.19,TCP,66,0.000106,,,"46852  >  6000 [FIN, ACK] Seq=28 Ack=1 Win=64256 Len=0 TSval=4104291882 TSecr=2756396725"
40,14.671255,192.168.11.19,192.168.11.20,TCP,66,0.016898,,,6000  >  46852 [ACK] Seq=1 Ack=28 Win=65152 Len=0 TSval=2756396742 TSecr=4104291882
41,14.671644,192.168.11.19,192.168.11.20,TCP,66,0.000389,,,"6000  >  46852 [FIN, ACK] Seq=1 Ack=29 Win=65152 Len=0 TSval=2756396743 TSecr=4104291882"
42,14.671693,192.168.11.20,192.168.11.19,TCP,66,0.000049,,,46852  >  6000 [ACK] Seq=29 Ack=2 Win=64256 Len=0 TSval=4104291900 TSecr=2756396743
43,14.700473,192.168.11.20,255.255.255.255,UDP,209,0.02878,Ÿ,7b2273656d616e74696373223a207b22656e74697479223a2022504944222c202262617365656e74697479223a2022616e79222c2022726f6c65223a2022747474222c20227370617469616c223a2022616e79222c202274656d706f72616c223a2022616e79227d2c20226461746170726f7065727479223a207b22666f726d6174223a2022696e616f6b615f70726f6772616d5f73616d706c655f73656d616e746963227d7d,49137  >  7000 Len=167
44,14.707192,192.168.11.12,192.168.11.20,TCP,74,0.006719,œ,,37070  >  6000 [SYN] Seq=0 Win=64240 Len=0 MSS=1460 SACK_PERM TSval=2817701840 TSecr=0 WS=128
45,14.707325,192.168.11.20,192.168.11.12,TCP,74,0.000133,,,"6000  >  37070 [SYN, ACK] Seq=0 Ack=1 Win=65160 Len=0 MSS=1460 SACK_PERM TSval=1200321864 TSecr=2817701840 WS=128"
46,14.714262,192.168.11.12,192.168.11.20,TCP,66,0.006937,,,37070  >  6000 [ACK] Seq=1 Ack=1 Win=64256 Len=0 TSval=2817701848 TSecr=1200321864
47,14.714891,192.168.11.12,192.168.11.20,TCP,93,0.000629,,,"37070  >  6000 [PSH, ACK] Seq=1 Ack=1 Win=64256 Len=27 TSval=2817701848 TSecr=1200321864 [TCP segment of a reassembled PDU]"
48,14.714988,192.168.11.20,192.168.11.12,TCP,66,0.000097,,,6000  >  37070 [ACK] Seq=1 Ack=28 Win=65152 Len=0 TSval=1200321872 TSecr=2817701848
49,14.715062,192.168.11.12,192.168.11.20,TCP,66,0.000074,,,"37070  >  6000 [FIN, ACK] Seq=28 Ack=1 Win=64256 Len=0 TSval=2817701848 TSecr=1200321864"
50,14.71629,192.168.11.20,192.168.11.12,TCP,66,0.001228,,,"6000  >  37070 [FIN, ACK] Seq=1 Ack=29 Win=65152 Len=0 TSval=1200321873 TSecr=2817701848"
51,14.722431,192.168.11.12,192.168.11.20,TCP,66,0.006141,,,37070  >  6000 [ACK] Seq=29 Ack=2 Win=64256 Len=0 TSval=2817701856 TSecr=1200321873
52,21.838128,192.168.11.20,192.168.11.19,TCP,74,7.115697,,,51960  >  6000 [SYN] Seq=0 Win=64240 Len=0 MSS=1460 SACK_PERM TSval=4104299066 TSecr=0 WS=128
53,21.845909,192.168.11.19,192.168.11.20,TCP,74,0.007781,,,"6000  >  51960 [SYN, ACK] Seq=0 Ack=1 Win=65160 Len=0 MSS=1460 SACK_PERM TSval=2756403916 TSecr=4104299066 WS=128"
54,21.846017,192.168.11.20,192.168.11.19,TCP,66,0.000108,,,51960  >  6000 [ACK] Seq=1 Ack=1 Win=64256 Len=0 TSval=4104299074 TSecr=2756403916
55,21.846207,192.168.11.20,192.168.11.19,TCP,93,0.00019,,,"51960  >  6000 [PSH, ACK] Seq=1 Ack=1 Win=64256 Len=27 TSval=4104299074 TSecr=2756403916 [TCP segment of a reassembled PDU]"
56,21.846315,192.168.11.20,192.168.11.19,TCP,66,0.000108,,,"51960  >  6000 [FIN, ACK] Seq=28 Ack=1 Win=64256 Len=0 TSval=4104299074 TSecr=2756403916"
57,21.854133,192.168.11.19,192.168.11.20,TCP,66,0.007818,,,6000  >  51960 [ACK] Seq=1 Ack=28 Win=65152 Len=0 TSval=2756403924 TSecr=4104299074
58,21.854512,192.168.11.19,192.168.11.20,TCP,66,0.000379,,,"6000  >  51960 [FIN, ACK] Seq=1 Ack=29 Win=65152 Len=0 TSval=2756403926 TSecr=4104299074"
59,21.854563,192.168.11.20,192.168.11.19,TCP,66,0.000051,,,51960  >  6000 [ACK] Seq=29 Ack=2 Win=64256 Len=0 TSval=4104299082 TSecr=2756403926
60,21.884004,192.168.11.20,255.255.255.255,UDP,209,0.029441,Ÿ,7b2273656d616e74696373223a207b22656e74697479223a2022504944222c202262617365656e74697479223a2022616e79222c2022726f6c65223a2022747474222c20227370617469616c223a2022616e79222c202274656d706f72616c223a2022616e79227d2c20226461746170726f7065727479223a207b22666f726d6174223a2022696e616f6b615f70726f6772616d5f73616d706c655f73656d616e746963227d7d,34931  >  7000 Len=167
61,21.889551,192.168.11.12,192.168.11.20,TCP,74,0.005547,œ,,33292  >  6000 [SYN] Seq=0 Win=64240 Len=0 MSS=1460 SACK_PERM TSval=2817709023 TSecr=0 WS=128
62,21.889708,192.168.11.20,192.168.11.12,TCP,74,0.000157,,,"6000  >  33292 [SYN, ACK] Seq=0 Ack=1 Win=65160 Len=0 MSS=1460 SACK_PERM TSval=1200329047 TSecr=2817709023 WS=128"
63,21.896472,192.168.11.12,192.168.11.20,TCP,66,0.006764,,,33292  >  6000 [ACK] Seq=1 Ack=1 Win=64256 Len=0 TSval=2817709030 TSecr=1200329047
64,21.896931,192.168.11.12,192.168.11.20,TCP,93,0.000459,,,"33292  >  6000 [PSH, ACK] Seq=1 Ack=1 Win=64256 Len=27 TSval=2817709030 TSecr=1200329047 [TCP segment of a reassembled PDU]"
65,21.897007,192.168.11.20,192.168.11.12,TCP,66,0.000076,,,6000  >  33292 [ACK] Seq=1 Ack=28 Win=65152 Len=0 TSval=1200329054 TSecr=2817709030
66,21.897075,192.168.11.12,192.168.11.20,TCP,66,0.000068,,,"33292  >  6000 [FIN, ACK] Seq=28 Ack=1 Win=64256 Len=0 TSval=2817709031 TSecr=1200329047"
67,21.899112,192.168.11.20,192.168.11.12,TCP,66,0.002037,,,"6000  >  33292 [FIN, ACK] Seq=1 Ack=29 Win=65152 Len=0 TSval=1200329056 TSecr=2817709031"
68,21.903695,192.168.11.12,192.168.11.20,TCP,66,0.004583,,,33292  >  6000 [ACK] Seq=29 Ack=2 Win=64256 Len=0 TSval=2817709038 TSecr=1200329056
69,29.049269,192.168.11.20,192.168.11.19,TCP,74,7.145574,,,51974  >  6000 [SYN] Seq=0 Win=64240 Len=0 MSS=1460 SACK_PERM TSval=4104306277 TSecr=0 WS=128
70,29.056918,192.168.11.19,192.168.11.20,TCP,74,0.007649,,,"6000  >  51974 [SYN, ACK] Seq=0 Ack=1 Win=65160 Len=0 MSS=1460 SACK_PERM TSval=2756411127 TSecr=4104306277 WS=128"
71,29.057027,192.168.11.20,192.168.11.19,TCP,66,0.000109,,,51974  >  6000 [ACK] Seq=1 Ack=1 Win=64256 Len=0 TSval=4104306285 TSecr=2756411127
72,29.057206,192.168.11.20,192.168.11.19,TCP,93,0.000179,,,"51974  >  6000 [PSH, ACK] Seq=1 Ack=1 Win=64256 Len=27 TSval=4104306285 TSecr=2756411127 [TCP segment of a reassembled PDU]"
73,29.057333,192.168.11.20,192.168.11.19,TCP,66,0.000127,,,"51974  >  6000 [FIN, ACK] Seq=28 Ack=1 Win=64256 Len=0 TSval=4104306285 TSecr=2756411127"
74,29.064882,192.168.11.19,192.168.11.20,TCP,66,0.007549,,,6000  >  51974 [ACK] Seq=1 Ack=28 Win=65152 Len=0 TSval=2756411135 TSecr=4104306285
75,29.065276,192.168.11.19,192.168.11.20,TCP,66,0.000394,,,"6000  >  51974 [FIN, ACK] Seq=1 Ack=29 Win=65152 Len=0 TSval=2756411136 TSecr=4104306285"
76,29.065334,192.168.11.20,192.168.11.19,TCP,66,0.000058,,,51974  >  6000 [ACK] Seq=29 Ack=2 Win=64256 Len=0 TSval=4104306293 TSecr=2756411136
77,29.094886,192.168.11.20,255.255.255.255,UDP,209,0.029552,Ÿ,7b2273656d616e74696373223a207b22656e74697479223a2022504944222c202262617365656e74697479223a2022616e79222c2022726f6c65223a2022747474222c20227370617469616c223a2022616e79222c202274656d706f72616c223a2022616e79227d2c20226461746170726f7065727479223a207b22666f726d6174223a2022696e616f6b615f70726f6772616d5f73616d706c655f73656d616e746963227d7d,50523  >  7000 Len=167
78,29.100591,192.168.11.12,192.168.11.20,TCP,74,0.005705,œ,,47278  >  6000 [SYN] Seq=0 Win=64240 Len=0 MSS=1460 SACK_PERM TSval=2817716234 TSecr=0 WS=128
79,29.100707,192.168.11.20,192.168.11.12,TCP,74,0.000116,,,"6000  >  47278 [SYN, ACK] Seq=0 Ack=1 Win=65160 Len=0 MSS=1460 SACK_PERM TSval=1200336258 TSecr=2817716234 WS=128"
80,29.11838,192.168.11.12,192.168.11.20,TCP,66,0.017673,,,47278  >  6000 [ACK] Seq=1 Ack=1 Win=64256 Len=0 TSval=2817716241 TSecr=1200336258
81,29.118958,192.168.11.12,192.168.11.20,TCP,93,0.000578,,,"47278  >  6000 [PSH, ACK] Seq=1 Ack=1 Win=64256 Len=27 TSval=2817716242 TSecr=1200336258 [TCP segment of a reassembled PDU]"
82,29.11903,192.168.11.20,192.168.11.12,TCP,66,0.000072,,,6000  >  47278 [ACK] Seq=1 Ack=28 Win=65152 Len=0 TSval=1200336276 TSecr=2817716242
83,29.1191,192.168.11.12,192.168.11.20,TCP,66,0.00007,,,"47278  >  6000 [FIN, ACK] Seq=28 Ack=1 Win=64256 Len=0 TSval=2817716242 TSecr=1200336258"
84,29.120278,192.168.11.20,192.168.11.12,TCP,66,0.001178,,,"6000  >  47278 [FIN, ACK] Seq=1 Ack=29 Win=65152 Len=0 TSval=1200336277 TSecr=2817716242"
85,29.126415,192.168.11.12,192.168.11.20,TCP,66,0.006137,,,47278  >  6000 [ACK] Seq=29 Ack=2 Win=64256 Len=0 TSval=2817716260 TSecr=1200336277
86,36.224151,192.168.11.20,192.168.11.19,TCP,74,7.097736,,,52892  >  6000 [SYN] Seq=0 Win=64240 Len=0 MSS=1460 SACK_PERM TSval=4104313452 TSecr=0 WS=128
87,36.232136,192.168.11.19,192.168.11.20,TCP,74,0.007985,,,"6000  >  52892 [SYN, ACK] Seq=0 Ack=1 Win=65160 Len=0 MSS=1460 SACK_PERM TSval=2756418301 TSecr=4104313452 WS=128"
88,36.232242,192.168.11.20,192.168.11.19,TCP,66,0.000106,,,52892  >  6000 [ACK] Seq=1 Ack=1 Win=64256 Len=0 TSval=4104313460 TSecr=2756418301
89,36.232412,192.168.11.20,192.168.11.19,TCP,93,0.00017,,,"52892  >  6000 [PSH, ACK] Seq=1 Ack=1 Win=64256 Len=27 TSval=4104313460 TSecr=2756418301 [TCP segment of a reassembled PDU]"
90,36.23252,192.168.11.20,192.168.11.19,TCP,66,0.000108,,,"52892  >  6000 [FIN, ACK] Seq=28 Ack=1 Win=64256 Len=0 TSval=4104313460 TSecr=2756418301"
91,36.239883,192.168.11.19,192.168.11.20,TCP,66,0.007363,,,6000  >  52892 [ACK] Seq=1 Ack=28 Win=65152 Len=0 TSval=2756418310 TSecr=4104313460
92,36.240248,192.168.11.19,192.168.11.20,TCP,66,0.000365,,,"6000  >  52892 [FIN, ACK] Seq=1 Ack=29 Win=65152 Len=0 TSval=2756418311 TSecr=4104313460"
93,36.240295,192.168.11.20,192.168.11.19,TCP,66,0.000047,,,52892  >  6000 [ACK] Seq=29 Ack=2 Win=64256 Len=0 TSval=4104313468 TSecr=2756418311
94,36.269469,192.168.11.20,255.255.255.255,UDP,209,0.029174,Ÿ,7b2273656d616e74696373223a207b22656e74697479223a2022504944222c202262617365656e74697479223a2022616e79222c2022726f6c65223a2022747474222c20227370617469616c223a2022616e79222c202274656d706f72616c223a2022616e79227d2c20226461746170726f7065727479223a207b22666f726d6174223a2022696e616f6b615f70726f6772616d5f73616d706c655f73656d616e746963227d7d,60450  >  7000 Len=167
95,36.276158,192.168.11.12,192.168.11.20,TCP,74,0.006689,œ,,60228  >  6000 [SYN] Seq=0 Win=64240 Len=0 MSS=1460 SACK_PERM TSval=2817723409 TSecr=0 WS=128
96,36.276302,192.168.11.20,192.168.11.12,TCP,74,0.000144,,,"6000  >  60228 [SYN, ACK] Seq=0 Ack=1 Win=65160 Len=0 MSS=1460 SACK_PERM TSval=1200343433 TSecr=2817723409 WS=128"
97,36.283065,192.168.11.12,192.168.11.20,TCP,66,0.006763,,,60228  >  6000 [ACK] Seq=1 Ack=1 Win=64256 Len=0 TSval=2817723416 TSecr=1200343433
98,36.283702,192.168.11.12,192.168.11.20,TCP,93,0.000637,,,"60228  >  6000 [PSH, ACK] Seq=1 Ack=1 Win=64256 Len=27 TSval=2817723417 TSecr=1200343433 [TCP segment of a reassembled PDU]"
99,36.283798,192.168.11.20,192.168.11.12,TCP,66,0.000096,,,6000  >  60228 [ACK] Seq=1 Ack=28 Win=65152 Len=0 TSval=1200343441 TSecr=2817723417
100,36.283873,192.168.11.12,192.168.11.20,TCP,66,0.000075,,,"60228  >  6000 [FIN, ACK] Seq=28 Ack=1 Win=64256 Len=0 TSval=2817723417 TSecr=1200343433"
101,36.286051,192.168.11.20,192.168.11.12,TCP,66,0.002178,,,"6000  >  60228 [FIN, ACK] Seq=1 Ack=29 Win=65152 Len=0 TSval=1200343443 TSecr=2817723417"
102,36.293914,192.168.11.12,192.168.11.20,TCP,66,0.007863,,,60228  >  6000 [ACK] Seq=29 Ack=2 Win=64256 Len=0 TSval=2817723427 TSecr=1200343443
103,43.433128,192.168.11.20,192.168.11.19,TCP,74,7.139214,,,40804  >  6000 [SYN] Seq=0 Win=64240 Len=0 MSS=1460 SACK_PERM TSval=4104320661 TSecr=0 WS=128
104,43.439648,192.168.11.19,192.168.11.20,TCP,74,0.00652,,,"6000  >  40804 [SYN, ACK] Seq=0 Ack=1 Win=65160 Len=0 MSS=1460 SACK_PERM TSval=2756425510 TSecr=4104320661 WS=128"
105,43.439763,192.168.11.20,192.168.11.19,TCP,66,0.000115,,,40804  >  6000 [ACK] Seq=1 Ack=1 Win=64256 Len=0 TSval=4104320668 TSecr=2756425510
106,43.439935,192.168.11.20,192.168.11.19,TCP,93,0.000172,,,"40804  >  6000 [PSH, ACK] Seq=1 Ack=1 Win=64256 Len=27 TSval=4104320668 TSecr=2756425510 [TCP segment of a reassembled PDU]"
107,43.440029,192.168.11.20,192.168.11.19,TCP,66,0.000094,,,"40804  >  6000 [FIN, ACK] Seq=28 Ack=1 Win=64256 Len=0 TSval=4104320668 TSecr=2756425510"
108,43.446977,192.168.11.19,192.168.11.20,TCP,66,0.006948,,,6000  >  40804 [ACK] Seq=1 Ack=28 Win=65152 Len=0 TSval=2756425517 TSecr=4104320668
109,43.447342,192.168.11.19,192.168.11.20,TCP,66,0.000365,,,"6000  >  40804 [FIN, ACK] Seq=1 Ack=29 Win=65152 Len=0 TSval=2756425518 TSecr=4104320668"
110,43.447388,192.168.11.20,192.168.11.19,TCP,66,0.000046,,,40804  >  6000 [ACK] Seq=29 Ack=2 Win=64256 Len=0 TSval=4104320675 TSecr=2756425518
111,43.475696,192.168.11.20,255.255.255.255,UDP,209,0.028308,Ÿ,7b2273656d616e74696373223a207b22656e74697479223a2022504944222c202262617365656e74697479223a2022616e79222c2022726f6c65223a2022747474222c20227370617469616c223a2022616e79222c202274656d706f72616c223a2022616e79227d2c20226461746170726f7065727479223a207b22666f726d6174223a2022696e616f6b615f70726f6772616d5f73616d706c655f73656d616e746963227d7d,56308  >  7000 Len=167
112,43.481622,192.168.11.12,192.168.11.20,TCP,74,0.005926,œ,,60240  >  6000 [SYN] Seq=0 Win=64240 Len=0 MSS=1460 SACK_PERM TSval=2817730615 TSecr=0 WS=128
113,43.481763,192.168.11.20,192.168.11.12,TCP,74,0.000141,,,"6000  >  60240 [SYN, ACK] Seq=0 Ack=1 Win=65160 Len=0 MSS=1460 SACK_PERM TSval=1200350639 TSecr=2817730615 WS=128"
114,43.488651,192.168.11.12,192.168.11.20,TCP,66,0.006888,,,60240  >  6000 [ACK] Seq=1 Ack=1 Win=64256 Len=0 TSval=2817730622 TSecr=1200350639
115,43.489355,192.168.11.12,192.168.11.20,TCP,93,0.000704,,,"60240  >  6000 [PSH, ACK] Seq=1 Ack=1 Win=64256 Len=27 TSval=2817730622 TSecr=1200350639 [TCP segment of a reassembled PDU]"
116,43.489465,192.168.11.20,192.168.11.12,TCP,66,0.00011,,,6000  >  60240 [ACK] Seq=1 Ack=28 Win=65152 Len=0 TSval=1200350646 TSecr=2817730622
117,43.489537,192.168.11.12,192.168.11.20,TCP,66,0.000072,,,"60240  >  6000 [FIN, ACK] Seq=28 Ack=1 Win=64256 Len=0 TSval=2817730622 TSecr=1200350639"
118,43.491777,192.168.11.20,192.168.11.12,TCP,66,0.00224,,,"6000  >  60240 [FIN, ACK] Seq=1 Ack=29 Win=65152 Len=0 TSval=1200350649 TSecr=2817730622"
119,43.498152,192.168.11.12,192.168.11.20,TCP,66,0.006375,,,60240  >  6000 [ACK] Seq=29 Ack=2 Win=64256 Len=0 TSval=2817730630 TSecr=1200350649
120,50.627389,192.168.11.20,192.168.11.19,TCP,74,7.129237,,,40820  >  6000 [SYN] Seq=0 Win=64240 Len=0 MSS=1460 SACK_PERM TSval=4104327855 TSecr=0 WS=128
121,50.638104,192.168.11.19,192.168.11.20,TCP,74,0.010715,,,"6000  >  40820 [SYN, ACK] Seq=0 Ack=1 Win=65160 Len=0 MSS=1460 SACK_PERM TSval=2756432705 TSecr=4104327855 WS=128"
122,50.638212,192.168.11.20,192.168.11.19,TCP,66,0.000108,,,40820  >  6000 [ACK] Seq=1 Ack=1 Win=64256 Len=0 TSval=4104327866 TSecr=2756432705
123,50.638417,192.168.11.20,192.168.11.19,TCP,93,0.000205,,,"40820  >  6000 [PSH, ACK] Seq=1 Ack=1 Win=64256 Len=27 TSval=4104327866 TSecr=2756432705 [TCP segment of a reassembled PDU]"
124,50.638528,192.168.11.20,192.168.11.19,TCP,66,0.000111,,,"40820  >  6000 [FIN, ACK] Seq=28 Ack=1 Win=64256 Len=0 TSval=4104327866 TSecr=2756432705"
125,50.645692,192.168.11.19,192.168.11.20,TCP,66,0.007164,,,6000  >  40820 [ACK] Seq=1 Ack=28 Win=65152 Len=0 TSval=2756432716 TSecr=4104327866
126,50.645914,192.168.11.19,192.168.11.20,TCP,66,0.000222,,,"6000  >  40820 [FIN, ACK] Seq=1 Ack=29 Win=65152 Len=0 TSval=2756432717 TSecr=4104327866"
127,50.645961,192.168.11.20,192.168.11.19,TCP,66,0.000047,,,40820  >  6000 [ACK] Seq=29 Ack=2 Win=64256 Len=0 TSval=4104327874 TSecr=2756432717
128,50.675156,192.168.11.20,255.255.255.255,UDP,209,0.029195,Ÿ,7b2273656d616e74696373223a207b22656e74697479223a2022504944222c202262617365656e74697479223a2022616e79222c2022726f6c65223a2022747474222c20227370617469616c223a2022616e79222c202274656d706f72616c223a2022616e79227d2c20226461746170726f7065727479223a207b22666f726d6174223a2022696e616f6b615f70726f6772616d5f73616d706c655f73656d616e746963227d7d,46324  >  7000 Len=167
129,50.68099,192.168.11.12,192.168.11.20,TCP,74,0.005834,œ,,48704  >  6000 [SYN] Seq=0 Win=64240 Len=0 MSS=1460 SACK_PERM TSval=2817737814 TSecr=0 WS=128
130,50.681123,192.168.11.20,192.168.11.12,TCP,74,0.000133,,,"6000  >  48704 [SYN, ACK] Seq=0 Ack=1 Win=65160 Len=0 MSS=1460 SACK_PERM TSval=1200357838 TSecr=2817737814 WS=128"
131,50.687919,192.168.11.12,192.168.11.20,TCP,66,0.006796,,,48704  >  6000 [ACK] Seq=1 Ack=1 Win=64256 Len=0 TSval=2817737821 TSecr=1200357838
132,50.688577,192.168.11.12,192.168.11.20,TCP,93,0.000658,,,"48704  >  6000 [PSH, ACK] Seq=1 Ack=1 Win=64256 Len=27 TSval=2817737821 TSecr=1200357838 [TCP segment of a reassembled PDU]"
133,50.688715,192.168.11.20,192.168.11.12,TCP,66,0.000138,,,6000  >  48704 [ACK] Seq=1 Ack=28 Win=65152 Len=0 TSval=1200357846 TSecr=2817737821
134,50.688808,192.168.11.12,192.168.11.20,TCP,66,0.000093,,,"48704  >  6000 [FIN, ACK] Seq=28 Ack=1 Win=64256 Len=0 TSval=2817737821 TSecr=1200357838"
135,50.6902,192.168.11.20,192.168.11.12,TCP,66,0.001392,,,"6000  >  48704 [FIN, ACK] Seq=1 Ack=29 Win=65152 Len=0 TSval=1200357847 TSecr=2817737821"
136,50.699226,192.168.11.12,192.168.11.20,TCP,66,0.009026,,,48704  >  6000 [ACK] Seq=29 Ack=2 Win=64256 Len=0 TSval=2817737829 TSecr=1200357847
137,57.788905,192.168.11.20,192.168.11.19,TCP,74,7.089679,,,53766  >  6000 [SYN] Seq=0 Win=64240 Len=0 MSS=1460 SACK_PERM TSval=4104335017 TSecr=0 WS=128
138,57.79583,192.168.11.19,192.168.11.20,TCP,74,0.006925,,,"6000  >  53766 [SYN, ACK] Seq=0 Ack=1 Win=65160 Len=0 MSS=1460 SACK_PERM TSval=2756439865 TSecr=4104335017 WS=128"
139,57.795951,192.168.11.20,192.168.11.19,TCP,66,0.000121,,,53766  >  6000 [ACK] Seq=1 Ack=1 Win=64256 Len=0 TSval=4104335024 TSecr=2756439865
140,57.796125,192.168.11.20,192.168.11.19,TCP,93,0.000174,,,"53766  >  6000 [PSH, ACK] Seq=1 Ack=1 Win=64256 Len=27 TSval=4104335024 TSecr=2756439865 [TCP segment of a reassembled PDU]"
141,57.796233,192.168.11.20,192.168.11.19,TCP,66,0.000108,,,"53766  >  6000 [FIN, ACK] Seq=28 Ack=1 Win=64256 Len=0 TSval=4104335024 TSecr=2756439865"
142,57.80338,192.168.11.19,192.168.11.20,TCP,66,0.007147,,,6000  >  53766 [ACK] Seq=1 Ack=28 Win=65152 Len=0 TSval=2756439873 TSecr=4104335024
143,57.803768,192.168.11.19,192.168.11.20,TCP,66,0.000388,,,"6000  >  53766 [FIN, ACK] Seq=1 Ack=29 Win=65152 Len=0 TSval=2756439874 TSecr=4104335024"
144,57.803839,192.168.11.20,192.168.11.19,TCP,66,0.000071,,,53766  >  6000 [ACK] Seq=29 Ack=2 Win=64256 Len=0 TSval=4104335032 TSecr=2756439874
145,57.831834,192.168.11.20,255.255.255.255,UDP,209,0.027995,Ÿ,7b2273656d616e74696373223a207b22656e74697479223a2022504944222c202262617365656e74697479223a2022616e79222c2022726f6c65223a2022747474222c20227370617469616c223a2022616e79222c202274656d706f72616c223a2022616e79227d2c20226461746170726f7065727479223a207b22666f726d6174223a2022696e616f6b615f70726f6772616d5f73616d706c655f73656d616e746963227d7d,54244  >  7000 Len=167
146,57.837526,192.168.11.12,192.168.11.20,TCP,74,0.005692,œ,,54948  >  6000 [SYN] Seq=0 Win=64240 Len=0 MSS=1460 SACK_PERM TSval=2817744970 TSecr=0 WS=128
147,57.837678,192.168.11.20,192.168.11.12,TCP,74,0.000152,,,"6000  >  54948 [SYN, ACK] Seq=0 Ack=1 Win=65160 Len=0 MSS=1460 SACK_PERM TSval=1200364995 TSecr=2817744970 WS=128"
148,57.845349,192.168.11.12,192.168.11.20,TCP,66,0.007671,,,54948  >  6000 [ACK] Seq=1 Ack=1 Win=64256 Len=0 TSval=2817744977 TSecr=1200364995
149,57.84597,192.168.11.12,192.168.11.20,TCP,93,0.000621,,,"54948  >  6000 [PSH, ACK] Seq=1 Ack=1 Win=64256 Len=27 TSval=2817744977 TSecr=1200364995 [TCP segment of a reassembled PDU]"
150,57.84605,192.168.11.20,192.168.11.12,TCP,66,0.00008,,,6000  >  54948 [ACK] Seq=1 Ack=28 Win=65152 Len=0 TSval=1200365003 TSecr=2817744977
151,57.84612,192.168.11.12,192.168.11.20,TCP,66,0.00007,,,"54948  >  6000 [FIN, ACK] Seq=28 Ack=1 Win=64256 Len=0 TSval=2817744977 TSecr=1200364995"
152,57.847399,192.168.11.20,192.168.11.12,TCP,66,0.001279,,,"6000  >  54948 [FIN, ACK] Seq=1 Ack=29 Win=65152 Len=0 TSval=1200365004 TSecr=2817744977"
153,57.853285,192.168.11.12,192.168.11.20,TCP,66,0.005886,,,54948  >  6000 [ACK] Seq=29 Ack=2 Win=64256 Len=0 TSval=2817744986 TSecr=1200365004
154,64.931075,192.168.11.20,192.168.11.19,TCP,74,7.07779,,,34518  >  6000 [SYN] Seq=0 Win=64240 Len=0 MSS=1460 SACK_PERM TSval=4104342159 TSecr=0 WS=128
155,64.937582,192.168.11.19,192.168.11.20,TCP,74,0.006507,,,"6000  >  34518 [SYN, ACK] Seq=0 Ack=1 Win=65160 Len=0 MSS=1460 SACK_PERM TSval=2756447007 TSecr=4104342159 WS=128"
156,64.937731,192.168.11.20,192.168.11.19,TCP,66,0.000149,,,34518  >  6000 [ACK] Seq=1 Ack=1 Win=64256 Len=0 TSval=4104342166 TSecr=2756447007
157,64.93791,192.168.11.20,192.168.11.19,TCP,93,0.000179,,,"34518  >  6000 [PSH, ACK] Seq=1 Ack=1 Win=64256 Len=27 TSval=4104342166 TSecr=2756447007 [TCP segment of a reassembled PDU]"
158,64.938037,192.168.11.20,192.168.11.19,TCP,66,0.000127,,,"34518  >  6000 [FIN, ACK] Seq=28 Ack=1 Win=64256 Len=0 TSval=4104342166 TSecr=2756447007"
159,64.945088,192.168.11.19,192.168.11.20,TCP,66,0.007051,,,6000  >  34518 [ACK] Seq=1 Ack=28 Win=65152 Len=0 TSval=2756447015 TSecr=4104342166
160,64.945451,192.168.11.19,192.168.11.20,TCP,66,0.000363,,,"6000  >  34518 [FIN, ACK] Seq=1 Ack=29 Win=65152 Len=0 TSval=2756447016 TSecr=4104342166"
161,64.945498,192.168.11.20,192.168.11.19,TCP,66,0.000047,,,34518  >  6000 [ACK] Seq=29 Ack=2 Win=64256 Len=0 TSval=4104342173 TSecr=2756447016
162,64.973088,192.168.11.20,255.255.255.255,UDP,209,0.02759,Ÿ,7b2273656d616e74696373223a207b22656e74697479223a2022504944222c202262617365656e74697479223a2022616e79222c2022726f6c65223a2022747474222c20227370617469616c223a2022616e79222c202274656d706f72616c223a2022616e79227d2c20226461746170726f7065727479223a207b22666f726d6174223a2022696e616f6b615f70726f6772616d5f73616d706c655f73656d616e746963227d7d,42337  >  7000 Len=167
163,64.979605,192.168.11.12,192.168.11.20,TCP,74,0.006517,œ,,54960  >  6000 [SYN] Seq=0 Win=64240 Len=0 MSS=1460 SACK_PERM TSval=2817752111 TSecr=0 WS=128
164,64.979722,192.168.11.20,192.168.11.12,TCP,74,0.000117,,,"6000  >  54960 [SYN, ACK] Seq=0 Ack=1 Win=65160 Len=0 MSS=1460 SACK_PERM TSval=1200372137 TSecr=2817752111 WS=128"
165,64.986298,192.168.11.12,192.168.11.20,TCP,66,0.006576,,,54960  >  6000 [ACK] Seq=1 Ack=1 Win=64256 Len=0 TSval=2817752119 TSecr=1200372137
166,64.986778,192.168.11.12,192.168.11.20,TCP,93,0.00048,,,"54960  >  6000 [PSH, ACK] Seq=1 Ack=1 Win=64256 Len=27 TSval=2817752119 TSecr=1200372137 [TCP segment of a reassembled PDU]"
167,64.986851,192.168.11.20,192.168.11.12,TCP,66,0.000073,,,6000  >  54960 [ACK] Seq=1 Ack=28 Win=65152 Len=0 TSval=1200372144 TSecr=2817752119
168,64.986914,192.168.11.12,192.168.11.20,TCP,66,0.000063,,,"54960  >  6000 [FIN, ACK] Seq=28 Ack=1 Win=64256 Len=0 TSval=2817752119 TSecr=1200372137"
169,64.988083,192.168.11.20,192.168.11.12,TCP,66,0.001169,,,"6000  >  54960 [FIN, ACK] Seq=1 Ack=29 Win=65152 Len=0 TSval=1200372145 TSecr=2817752119"
170,64.994232,192.168.11.12,192.168.11.20,TCP,66,0.006149,,,54960  >  6000 [ACK] Seq=29 Ack=2 Win=64256 Len=0 TSval=2817752127 TSecr=1200372145
171,110.594696,192.168.11.20,192.168.11.19,TCP,74,45.600464,,,41534  >  6000 [SYN] Seq=0 Win=64240 Len=0 MSS=1460 SACK_PERM TSval=4104387823 TSecr=0 WS=128
172,110.601273,192.168.11.19,192.168.11.20,TCP,74,0.006577,,,"6000  >  41534 [SYN, ACK] Seq=0 Ack=1 Win=65160 Len=0 MSS=1460 SACK_PERM TSval=2756492670 TSecr=4104387823 WS=128"
173,110.601384,192.168.11.20,192.168.11.19,TCP,66,0.000111,,,41534  >  6000 [ACK] Seq=1 Ack=1 Win=64256 Len=0 TSval=4104387829 TSecr=2756492670
174,110.601522,192.168.11.20,192.168.11.19,TCP,93,0.000138,,,"41534  >  6000 [PSH, ACK] Seq=1 Ack=1 Win=64256 Len=27 TSval=4104387829 TSecr=2756492670 [TCP segment of a reassembled PDU]"
175,110.601677,192.168.11.20,192.168.11.19,TCP,66,0.000155,,,"41534  >  6000 [FIN, ACK] Seq=28 Ack=1 Win=64256 Len=0 TSval=4104387830 TSecr=2756492670"
176,110.608983,192.168.11.19,192.168.11.20,TCP,66,0.007306,,,6000  >  41534 [ACK] Seq=1 Ack=28 Win=65152 Len=0 TSval=2756492678 TSecr=4104387829
177,110.609337,192.168.11.19,192.168.11.20,TCP,66,0.000354,,,"6000  >  41534 [FIN, ACK] Seq=1 Ack=29 Win=65152 Len=0 TSval=2756492679 TSecr=4104387830"
178,110.609381,192.168.11.20,192.168.11.19,TCP,66,0.000044,,,41534  >  6000 [ACK] Seq=29 Ack=2 Win=64256 Len=0 TSval=4104387837 TSecr=2756492679
179,110.639358,192.168.11.20,255.255.255.255,UDP,209,0.029977,Ÿ,7b2273656d616e74696373223a207b22656e74697479223a2022504944222c202262617365656e74697479223a2022616e79222c2022726f6c65223a2022747474222c20227370617469616c223a2022616e79222c202274656d706f72616c223a2022616e79227d2c20226461746170726f7065727479223a207b22666f726d6174223a2022696e616f6b615f70726f6772616d5f73616d706c655f73656d616e746963227d7d,44102  >  7000 Len=167
180,110.646138,192.168.11.12,192.168.11.20,TCP,74,0.00678,œ,,40400  >  6000 [SYN] Seq=0 Win=64240 Len=0 MSS=1460 SACK_PERM TSval=2817797777 TSecr=0 WS=128
181,110.646301,192.168.11.20,192.168.11.12,TCP,74,0.000163,,,"6000  >  40400 [SYN, ACK] Seq=0 Ack=1 Win=65160 Len=0 MSS=1460 SACK_PERM TSval=1200417803 TSecr=2817797777 WS=128"
182,110.653428,192.168.11.12,192.168.11.20,TCP,66,0.007127,,,40400  >  6000 [ACK] Seq=1 Ack=1 Win=64256 Len=0 TSval=2817797785 TSecr=1200417803
183,110.654168,192.168.11.12,192.168.11.20,TCP,93,0.00074,,,"40400  >  6000 [PSH, ACK] Seq=1 Ack=1 Win=64256 Len=27 TSval=2817797785 TSecr=1200417803 [TCP segment of a reassembled PDU]"
184,110.65423,192.168.11.12,192.168.11.20,TCP,66,0.000062,,,"40400  >  6000 [FIN, ACK] Seq=28 Ack=1 Win=64256 Len=0 TSval=2817797785 TSecr=1200417803"
185,110.65431,192.168.11.20,192.168.11.12,TCP,66,0.00008,,,6000  >  40400 [ACK] Seq=1 Ack=28 Win=65152 Len=0 TSval=1200417811 TSecr=2817797785
186,110.655722,192.168.11.20,192.168.11.12,TCP,66,0.001412,,,"6000  >  40400 [FIN, ACK] Seq=1 Ack=29 Win=65152 Len=0 TSval=1200417813 TSecr=2817797785"
187,110.661516,192.168.11.12,192.168.11.20,TCP,66,0.005794,,,40400  >  6000 [ACK] Seq=29 Ack=2 Win=64256 Len=0 TSval=2817797793 TSecr=1200417813
188,117.754117,192.168.11.20,192.168.11.19,TCP,74,7.092601,,,36568  >  6000 [SYN] Seq=0 Win=64240 Len=0 MSS=1460 SACK_PERM TSval=4104394982 TSecr=0 WS=128
189,117.761767,192.168.11.19,192.168.11.20,TCP,74,0.00765,,,"6000  >  36568 [SYN, ACK] Seq=0 Ack=1 Win=65160 Len=0 MSS=1460 SACK_PERM TSval=2756499830 TSecr=4104394982 WS=128"
190,117.761873,192.168.11.20,192.168.11.19,TCP,66,0.000106,,,36568  >  6000 [ACK] Seq=1 Ack=1 Win=64256 Len=0 TSval=4104394990 TSecr=2756499830
191,117.762009,192.168.11.20,192.168.11.19,TCP,93,0.000136,,,"36568  >  6000 [PSH, ACK] Seq=1 Ack=1 Win=64256 Len=27 TSval=4104394990 TSecr=2756499830 [TCP segment of a reassembled PDU]"
192,117.762121,192.168.11.20,192.168.11.19,TCP,66,0.000112,,,"36568  >  6000 [FIN, ACK] Seq=28 Ack=1 Win=64256 Len=0 TSval=4104394990 TSecr=2756499830"
193,117.769321,192.168.11.19,192.168.11.20,TCP,66,0.0072,,,6000  >  36568 [ACK] Seq=1 Ack=28 Win=65152 Len=0 TSval=2756499838 TSecr=4104394990
194,117.769717,192.168.11.19,192.168.11.20,TCP,66,0.000396,,,"6000  >  36568 [FIN, ACK] Seq=1 Ack=29 Win=65152 Len=0 TSval=2756499839 TSecr=4104394990"
195,117.769762,192.168.11.20,192.168.11.19,TCP,66,0.000045,,,36568  >  6000 [ACK] Seq=29 Ack=2 Win=64256 Len=0 TSval=4104394998 TSecr=2756499839
196,117.797792,192.168.11.20,255.255.255.255,UDP,209,0.02803,Ÿ,7b2273656d616e74696373223a207b22656e74697479223a2022504944222c202262617365656e74697479223a2022616e79222c2022726f6c65223a2022747474222c20227370617469616c223a2022616e79222c202274656d706f72616c223a2022616e79227d2c20226461746170726f7065727479223a207b22666f726d6174223a2022696e616f6b615f70726f6772616d5f73616d706c655f73656d616e746963227d7d,52086  >  7000 Len=167
197,117.803312,192.168.11.12,192.168.11.20,TCP,74,0.00552,œ,,39728  >  6000 [SYN] Seq=0 Win=64240 Len=0 MSS=1460 SACK_PERM TSval=2817804935 TSecr=0 WS=128
198,117.80343,192.168.11.20,192.168.11.12,TCP,74,0.000118,,,"6000  >  39728 [SYN, ACK] Seq=0 Ack=1 Win=65160 Len=0 MSS=1460 SACK_PERM TSval=1200424960 TSecr=2817804935 WS=128"
199,117.810737,192.168.11.12,192.168.11.20,TCP,66,0.007307,,,39728  >  6000 [ACK] Seq=1 Ack=1 Win=64256 Len=0 TSval=2817804942 TSecr=1200424960
200,117.811431,192.168.11.12,192.168.11.20,TCP,93,0.000694,,,"39728  >  6000 [PSH, ACK] Seq=1 Ack=1 Win=64256 Len=27 TSval=2817804942 TSecr=1200424960 [TCP segment of a reassembled PDU]"
201,117.811532,192.168.11.20,192.168.11.12,TCP,66,0.000101,,,6000  >  39728 [ACK] Seq=1 Ack=28 Win=65152 Len=0 TSval=1200424968 TSecr=2817804942
202,117.811616,192.168.11.12,192.168.11.20,TCP,66,0.000084,,,"39728  >  6000 [FIN, ACK] Seq=28 Ack=1 Win=64256 Len=0 TSval=2817804942 TSecr=1200424960"
203,117.812861,192.168.11.20,192.168.11.12,TCP,66,0.001245,,,"6000  >  39728 [FIN, ACK] Seq=1 Ack=29 Win=65152 Len=0 TSval=1200424970 TSecr=2817804942"
204,117.819155,192.168.11.12,192.168.11.20,TCP,66,0.006294,,,39728  >  6000 [ACK] Seq=29 Ack=2 Win=64256 Len=0 TSval=2817804950 TSecr=1200424970
205,125.005518,192.168.11.20,192.168.11.19,TCP,74,7.186363,,,55428  >  6000 [SYN] Seq=0 Win=64240 Len=0 MSS=1460 SACK_PERM TSval=4104402233 TSecr=0 WS=128
206,125.012295,192.168.11.19,192.168.11.20,TCP,74,0.006777,,,"6000  >  55428 [SYN, ACK] Seq=0 Ack=1 Win=65160 Len=0 MSS=1460 SACK_PERM TSval=2756507081 TSecr=4104402233 WS=128"
207,125.012408,192.168.11.20,192.168.11.19,TCP,66,0.000113,,,55428  >  6000 [ACK] Seq=1 Ack=1 Win=64256 Len=0 TSval=4104402240 TSecr=2756507081
208,125.012548,192.168.11.20,192.168.11.19,TCP,93,0.00014,,,"55428  >  6000 [PSH, ACK] Seq=1 Ack=1 Win=64256 Len=27 TSval=4104402240 TSecr=2756507081 [TCP segment of a reassembled PDU]"
209,125.012653,192.168.11.20,192.168.11.19,TCP,66,0.000105,,,"55428  >  6000 [FIN, ACK] Seq=28 Ack=1 Win=64256 Len=0 TSval=4104402241 TSecr=2756507081"
210,125.02008,192.168.11.19,192.168.11.20,TCP,66,0.007427,,,6000  >  55428 [ACK] Seq=1 Ack=28 Win=65152 Len=0 TSval=2756507088 TSecr=4104402240
211,125.020449,192.168.11.19,192.168.11.20,TCP,66,0.000369,,,"6000  >  55428 [FIN, ACK] Seq=1 Ack=29 Win=65152 Len=0 TSval=2756507090 TSecr=4104402241"
212,125.020496,192.168.11.20,192.168.11.19,TCP,66,0.000047,,,55428  >  6000 [ACK] Seq=29 Ack=2 Win=64256 Len=0 TSval=4104402248 TSecr=2756507090
213,125.049795,192.168.11.20,255.255.255.255,UDP,209,0.029299,Ÿ,7b2273656d616e74696373223a207b22656e74697479223a2022504944222c202262617365656e74697479223a2022616e79222c2022726f6c65223a2022747474222c20227370617469616c223a2022616e79222c202274656d706f72616c223a2022616e79227d2c20226461746170726f7065727479223a207b22666f726d6174223a2022696e616f6b615f70726f6772616d5f73616d706c655f73656d616e746963227d7d,59666  >  7000 Len=167
214,125.055481,192.168.11.12,192.168.11.20,TCP,74,0.005686,œ,,39740  >  6000 [SYN] Seq=0 Win=64240 Len=0 MSS=1460 SACK_PERM TSval=2817812187 TSecr=0 WS=128
215,125.05563,192.168.11.20,192.168.11.12,TCP,74,0.000149,,,"6000  >  39740 [SYN, ACK] Seq=0 Ack=1 Win=65160 Len=0 MSS=1460 SACK_PERM TSval=1200432213 TSecr=2817812187 WS=128"
216,125.062261,192.168.11.12,192.168.11.20,TCP,66,0.006631,,,39740  >  6000 [ACK] Seq=1 Ack=1 Win=64256 Len=0 TSval=2817812194 TSecr=1200432213
217,125.062911,192.168.11.12,192.168.11.20,TCP,93,0.00065,,,"39740  >  6000 [PSH, ACK] Seq=1 Ack=1 Win=64256 Len=27 TSval=2817812194 TSecr=1200432213 [TCP segment of a reassembled PDU]"
218,125.063013,192.168.11.20,192.168.11.12,TCP,66,0.000102,,,6000  >  39740 [ACK] Seq=1 Ack=28 Win=65152 Len=0 TSval=1200432220 TSecr=2817812194
219,125.06309,192.168.11.12,192.168.11.20,TCP,66,0.000077,,,"39740  >  6000 [FIN, ACK] Seq=28 Ack=1 Win=64256 Len=0 TSval=2817812194 TSecr=1200432213"
220,125.064276,192.168.11.20,192.168.11.12,TCP,66,0.001186,,,"6000  >  39740 [FIN, ACK] Seq=1 Ack=29 Win=65152 Len=0 TSval=1200432221 TSecr=2817812194"
221,125.070207,192.168.11.12,192.168.11.20,TCP,66,0.005931,,,39740  >  6000 [ACK] Seq=29 Ack=2 Win=64256 Len=0 TSval=2817812201 TSecr=1200432221
222,132.168634,192.168.11.20,192.168.11.19,TCP,74,7.098427,,,43990  >  6000 [SYN] Seq=0 Win=64240 Len=0 MSS=1460 SACK_PERM TSval=4104409396 TSecr=0 WS=128
223,132.175168,192.168.11.19,192.168.11.20,TCP,74,0.006534,,,"6000  >  43990 [SYN, ACK] Seq=0 Ack=1 Win=65160 Len=0 MSS=1460 SACK_PERM TSval=2756514244 TSecr=4104409396 WS=128"
224,132.175281,192.168.11.20,192.168.11.19,TCP,66,0.000113,,,43990  >  6000 [ACK] Seq=1 Ack=1 Win=64256 Len=0 TSval=4104409403 TSecr=2756514244
225,132.175413,192.168.11.20,192.168.11.19,TCP,93,0.000132,,,"43990  >  6000 [PSH, ACK] Seq=1 Ack=1 Win=64256 Len=27 TSval=4104409403 TSecr=2756514244 [TCP segment of a reassembled PDU]"
226,132.175527,192.168.11.20,192.168.11.19,TCP,66,0.000114,,,"43990  >  6000 [FIN, ACK] Seq=28 Ack=1 Win=64256 Len=0 TSval=4104409403 TSecr=2756514244"
227,132.182676,192.168.11.19,192.168.11.20,TCP,66,0.007149,,,6000  >  43990 [ACK] Seq=1 Ack=28 Win=65152 Len=0 TSval=2756514251 TSecr=4104409403
228,132.182879,192.168.11.19,192.168.11.20,TCP,66,0.000203,,,"6000  >  43990 [FIN, ACK] Seq=1 Ack=29 Win=65152 Len=0 TSval=2756514252 TSecr=4104409403"
229,132.182926,192.168.11.20,192.168.11.19,TCP,66,0.000047,,,43990  >  6000 [ACK] Seq=29 Ack=2 Win=64256 Len=0 TSval=4104409411 TSecr=2756514252
230,132.21478,192.168.11.20,255.255.255.255,UDP,209,0.031854,Ÿ,7b2273656d616e74696373223a207b22656e74697479223a2022504944222c202262617365656e74697479223a2022616e79222c2022726f6c65223a2022747474222c20227370617469616c223a2022616e79222c202274656d706f72616c223a2022616e79227d2c20226461746170726f7065727479223a207b22666f726d6174223a2022696e616f6b615f70726f6772616d5f73616d706c655f73656d616e746963227d7d,34183  >  7000 Len=167
231,132.22098,192.168.11.12,192.168.11.20,TCP,74,0.0062,œ,,48216  >  6000 [SYN] Seq=0 Win=64240 Len=0 MSS=1460 SACK_PERM TSval=2817819351 TSecr=0 WS=128
