No.,Time,Source,Destination,Protocol,Length,Time delta from previous captured frame,XXX,Data,Info
1,0,192.168.11.32,192.168.11.12,TCP,74,0,,,51660  >  6000 [SYN] Seq=0 Win=64240 Len=0 MSS=1460 SACK_PERM TSval=1627809475 TSecr=0 WS=128
2,0.009266,192.168.11.12,192.168.11.32,TCP,74,0.009266,,,"6000  >  51660 [SYN, ACK] Seq=0 Ack=1 Win=65160 Len=0 MSS=1460 SACK_PERM TSval=3043412867 TSecr=1627809475 WS=128"
3,0.009374,192.168.11.32,192.168.11.12,TCP,66,0.000108,,,51660  >  6000 [ACK] Seq=1 Ack=1 Win=64256 Len=0 TSval=1627809489 TSecr=3043412867
4,0.009556,192.168.11.32,192.168.11.12,TCP,93,0.000182,,,"51660  >  6000 [PSH, ACK] Seq=1 Ack=1 Win=64256 Len=27 TSval=1627809489 TSecr=3043412867 [TCP segment of a reassembled PDU]"
5,0.009703,192.168.11.32,192.168.11.12,TCP,66,0.000147,,,"51660  >  6000 [FIN, ACK] Seq=28 Ack=1 Win=64256 Len=0 TSval=1627809489 TSecr=3043412867"
6,0.017513,192.168.11.12,192.168.11.32,TCP,66,0.00781,,,6000  >  51660 [ACK] Seq=1 Ack=28 Win=65152 Len=0 TSval=3043412876 TSecr=1627809489
7,0.017751,192.168.11.12,192.168.11.32,TCP,66,0.000238,,,"6000  >  51660 [FIN, ACK] Seq=1 Ack=29 Win=65152 Len=0 TSval=3043412877 TSecr=1627809489"
8,0.017794,192.168.11.32,192.168.11.12,TCP,66,0.000043,,,51660  >  6000 [ACK] Seq=29 Ack=2 Win=64256 Len=0 TSval=1627809497 TSecr=3043412877
9,0.051304,192.168.11.32,255.255.255.255,UDP,209,0.03351,Ÿ,7b2273656d616e74696373223a207b22656e74697479223a2022504944222c202262617365656e74697479223a2022616e79222c2022726f6c65223a2022767676222c20227370617469616c223a2022616e79222c202274656d706f72616c223a2022616e79227d2c20226461746170726f7065727479223a207b22666f726d6174223a2022696e616f6b615f70726f6772616d5f73616d706c655f73656d616e746963227d7d,47625  >  7000 Len=167
10,0.066767,192.168.11.18,192.168.11.32,TCP,74,0.015463,œ,,34090  >  6000 [SYN] Seq=0 Win=64240 Len=0 MSS=1460 SACK_PERM TSval=3408770361 TSecr=0 WS=128
11,0.066898,192.168.11.32,192.168.11.18,TCP,74,0.000131,,,"6000  >  34090 [SYN, ACK] Seq=0 Ack=1 Win=65160 Len=0 MSS=1460 SACK_PERM TSval=3634269828 TSecr=3408770361 WS=128"
12,0.073749,192.168.11.18,192.168.11.32,TCP,66,0.006851,,,34090  >  6000 [ACK] Seq=1 Ack=1 Win=64256 Len=0 TSval=3408770371 TSecr=3634269828
13,0.074218,192.168.11.18,192.168.11.32,TCP,93,0.000469,,,"34090  >  6000 [PSH, ACK] Seq=1 Ack=1 Win=64256 Len=27 TSval=3408770371 TSecr=3634269828 [TCP segment of a reassembled PDU]"
14,0.074282,192.168.11.32,192.168.11.18,TCP,66,0.000064,,,6000  >  34090 [ACK] Seq=1 Ack=28 Win=65152 Len=0 TSval=3634269836 TSecr=3408770371
15,0.074341,192.168.11.18,192.168.11.32,TCP,66,0.000059,,,"34090  >  6000 [FIN, ACK] Seq=28 Ack=1 Win=64256 Len=0 TSval=3408770372 TSecr=3634269828"
16,0.075718,192.168.11.32,192.168.11.18,TCP,66,0.001377,,,"6000  >  34090 [FIN, ACK] Seq=1 Ack=29 Win=65152 Len=0 TSval=3634269837 TSecr=3408770372"
17,0.081606,192.168.11.18,192.168.11.32,TCP,66,0.005888,,,34090  >  6000 [ACK] Seq=29 Ack=2 Win=64256 Len=0 TSval=3408770379 TSecr=3634269837
18,7.294458,192.168.11.32,192.168.11.12,TCP,74,7.212852,,,50594  >  6000 [SYN] Seq=0 Win=64240 Len=0 MSS=1460 SACK_PERM TSval=1627816774 TSecr=0 WS=128
19,7.306628,192.168.11.12,192.168.11.32,TCP,74,0.01217,,,"6000  >  50594 [SYN, ACK] Seq=0 Ack=1 Win=65160 Len=0 MSS=1460 SACK_PERM TSval=3043420165 TSecr=1627816774 WS=128"
20,7.306722,192.168.11.32,192.168.11.12,TCP,66,0.000094,,,50594  >  6000 [ACK] Seq=1 Ack=1 Win=64256 Len=0 TSval=1627816786 TSecr=3043420165
21,7.306879,192.168.11.32,192.168.11.12,TCP,93,0.000157,,,"50594  >  6000 [PSH, ACK] Seq=1 Ack=1 Win=64256 Len=27 TSval=1627816786 TSecr=3043420165 [TCP segment of a reassembled PDU]"
22,7.306986,192.168.11.32,192.168.11.12,TCP,66,0.000107,,,"50594  >  6000 [FIN, ACK] Seq=28 Ack=1 Win=64256 Len=0 TSval=1627816786 TSecr=3043420165"
23,7.315839,192.168.11.12,192.168.11.32,TCP,66,0.008853,,,6000  >  50594 [ACK] Seq=1 Ack=28 Win=65152 Len=0 TSval=3043420174 TSecr=1627816786
24,7.31607,192.168.11.12,192.168.11.32,TCP,66,0.000231,,,[TCP Dup ACK 23#1] 6000  >  50594 [ACK] Seq=1 Ack=28 Win=65152 Len=0 TSval=3043420175 TSecr=1627816786
25,7.31831,192.168.11.12,192.168.11.32,TCP,66,0.00224,,,"6000  >  50594 [FIN, ACK] Seq=1 Ack=29 Win=65152 Len=0 TSval=3043420176 TSecr=1627816786"
26,7.318354,192.168.11.32,192.168.11.12,TCP,66,0.000044,,,50594  >  6000 [ACK] Seq=29 Ack=2 Win=64256 Len=0 TSval=1627816798 TSecr=3043420176
27,7.347299,192.168.11.32,255.255.255.255,UDP,209,0.028945,Ÿ,7b2273656d616e74696373223a207b22656e74697479223a2022504944222c202262617365656e74697479223a2022616e79222c2022726f6c65223a2022767676222c20227370617469616c223a2022616e79222c202274656d706f72616c223a2022616e79227d2c20226461746170726f7065727479223a207b22666f726d6174223a2022696e616f6b615f70726f6772616d5f73616d706c655f73656d616e746963227d7d,47745  >  7000 Len=167
28,7.355487,192.168.11.18,192.168.11.32,TCP,74,0.008188,œ,,34094  >  6000 [SYN] Seq=0 Win=64240 Len=0 MSS=1460 SACK_PERM TSval=3408777653 TSecr=0 WS=128
29,7.355611,192.168.11.32,192.168.11.18,TCP,74,0.000124,,,"6000  >  34094 [SYN, ACK] Seq=0 Ack=1 Win=65160 Len=0 MSS=1460 SACK_PERM TSval=3634277117 TSecr=3408777653 WS=128"
30,7.371803,192.168.11.18,192.168.11.32,TCP,66,0.016192,,,34094  >  6000 [ACK] Seq=1 Ack=1 Win=64256 Len=0 TSval=3408777660 TSecr=3634277117
31,7.372503,192.168.11.18,192.168.11.32,TCP,93,0.0007,,,"34094  >  6000 [PSH, ACK] Seq=1 Ack=1 Win=64256 Len=27 TSval=3408777660 TSecr=3634277117 [TCP segment of a reassembled PDU]"
32,7.372588,192.168.11.32,192.168.11.18,TCP,66,0.000085,,,6000  >  34094 [ACK] Seq=1 Ack=28 Win=65152 Len=0 TSval=3634277134 TSecr=3408777660
33,7.372662,192.168.11.18,192.168.11.32,TCP,66,0.000074,,,"34094  >  6000 [FIN, ACK] Seq=28 Ack=1 Win=64256 Len=0 TSval=3408777660 TSecr=3634277117"
34,7.373558,192.168.11.32,192.168.11.18,TCP,66,0.000896,,,"6000  >  34094 [FIN, ACK] Seq=1 Ack=29 Win=65152 Len=0 TSval=3634277135 TSecr=3408777660"
35,7.379877,192.168.11.18,192.168.11.32,TCP,66,0.006319,,,"[TCP Retransmission] 34094  >  6000 [FIN, ACK] Seq=28 Ack=1 Win=64256 Len=0 TSval=3408777677 TSecr=3634277117"
36,7.37993,192.168.11.32,192.168.11.18,TCP,78,0.000053,,,[TCP Dup ACK 34#1] 6000  >  34094 [ACK] Seq=2 Ack=29 Win=65152 Len=0 TSval=3634277141 TSecr=3408777677 SLE=28 SRE=29
37,7.380302,192.168.11.18,192.168.11.32,TCP,66,0.000372,,,34094  >  6000 [ACK] Seq=29 Ack=2 Win=64256 Len=0 TSval=3408777677 TSecr=3634277135
38,14.648411,192.168.11.32,192.168.11.12,TCP,74,7.268109,,,33476  >  6000 [SYN] Seq=0 Win=64240 Len=0 MSS=1460 SACK_PERM TSval=1627824128 TSecr=0 WS=128
39,14.65714,192.168.11.12,192.168.11.32,TCP,74,0.008729,,,"6000  >  33476 [SYN, ACK] Seq=0 Ack=1 Win=65160 Len=0 MSS=1460 SACK_PERM TSval=3043427515 TSecr=1627824128 WS=128"
40,14.657237,192.168.11.32,192.168.11.12,TCP,66,0.000097,,,33476  >  6000 [ACK] Seq=1 Ack=1 Win=64256 Len=0 TSval=1627824137 TSecr=3043427515
41,14.657365,192.168.11.32,192.168.11.12,TCP,93,0.000128,,,"33476  >  6000 [PSH, ACK] Seq=1 Ack=1 Win=64256 Len=27 TSval=1627824137 TSecr=3043427515 [TCP segment of a reassembled PDU]"
42,14.657489,192.168.11.32,192.168.11.12,TCP,66,0.000124,,,"33476  >  6000 [FIN, ACK] Seq=28 Ack=1 Win=64256 Len=0 TSval=1627824137 TSecr=3043427515"
43,14.668135,192.168.11.12,192.168.11.32,TCP,66,0.010646,,,6000  >  33476 [ACK] Seq=1 Ack=28 Win=65152 Len=0 TSval=3043427526 TSecr=1627824137
44,14.670186,192.168.11.12,192.168.11.32,TCP,66,0.002051,,,"6000  >  33476 [FIN, ACK] Seq=1 Ack=29 Win=65152 Len=0 TSval=3043427528 TSecr=1627824137"
45,14.67023,192.168.11.32,192.168.11.12,TCP,66,0.000044,,,33476  >  6000 [ACK] Seq=29 Ack=2 Win=64256 Len=0 TSval=1627824150 TSecr=3043427528
46,14.699411,192.168.11.32,255.255.255.255,UDP,209,0.029181,Ÿ,7b2273656d616e74696373223a207b22656e74697479223a2022504944222c202262617365656e74697479223a2022616e79222c2022726f6c65223a2022767676222c20227370617469616c223a2022616e79222c202274656d706f72616c223a2022616e79227d2c20226461746170726f7065727479223a207b22666f726d6174223a2022696e616f6b615f70726f6772616d5f73616d706c655f73656d616e746963227d7d,53177  >  7000 Len=167
47,14.707569,192.168.11.18,192.168.11.32,TCP,74,0.008158,œ,,38222  >  6000 [SYN] Seq=0 Win=64240 Len=0 MSS=1460 SACK_PERM TSval=3408785005 TSecr=0 WS=128
48,14.707681,192.168.11.32,192.168.11.18,TCP,74,0.000112,,,"6000  >  38222 [SYN, ACK] Seq=0 Ack=1 Win=65160 Len=0 MSS=1460 SACK_PERM TSval=3634284469 TSecr=3408785005 WS=128"
49,14.714436,192.168.11.18,192.168.11.32,TCP,66,0.006755,,,38222  >  6000 [ACK] Seq=1 Ack=1 Win=64256 Len=0 TSval=3408785012 TSecr=3634284469
50,14.715119,192.168.11.18,192.168.11.32,TCP,93,0.000683,,,"38222  >  6000 [PSH, ACK] Seq=1 Ack=1 Win=64256 Len=27 TSval=3408785012 TSecr=3634284469 [TCP segment of a reassembled PDU]"
51,14.715215,192.168.11.32,192.168.11.18,TCP,66,0.000096,,,6000  >  38222 [ACK] Seq=1 Ack=28 Win=65152 Len=0 TSval=3634284477 TSecr=3408785012
52,14.715302,192.168.11.18,192.168.11.32,TCP,66,0.000087,,,"38222  >  6000 [FIN, ACK] Seq=28 Ack=1 Win=64256 Len=0 TSval=3408785012 TSecr=3634284469"
53,14.716345,192.168.11.32,192.168.11.18,TCP,66,0.001043,,,"6000  >  38222 [FIN, ACK] Seq=1 Ack=29 Win=65152 Len=0 TSval=3634284478 TSecr=3408785012"
54,14.722627,192.168.11.18,192.168.11.32,TCP,66,0.006282,,,38222  >  6000 [ACK] Seq=29 Ack=2 Win=64256 Len=0 TSval=3408785020 TSecr=3634284478
55,21.832341,192.168.11.32,192.168.11.12,TCP,74,7.109714,,,33484  >  6000 [SYN] Seq=0 Win=64240 Len=0 MSS=1460 SACK_PERM TSval=1627831312 TSecr=0 WS=128
56,21.842777,192.168.11.12,192.168.11.32,TCP,74,0.010436,,,"6000  >  33484 [SYN, ACK] Seq=0 Ack=1 Win=65160 Len=0 MSS=1460 SACK_PERM TSval=3043434700 TSecr=1627831312 WS=128"
57,21.842872,192.168.11.32,192.168.11.12,TCP,66,0.000095,,,33484  >  6000 [ACK] Seq=1 Ack=1 Win=64256 Len=0 TSval=1627831322 TSecr=3043434700
58,21.842995,192.168.11.32,192.168.11.12,TCP,93,0.000123,,,"33484  >  6000 [PSH, ACK] Seq=1 Ack=1 Win=64256 Len=27 TSval=1627831322 TSecr=3043434700 [TCP segment of a reassembled PDU]"
59,21.843158,192.168.11.32,192.168.11.12,TCP,66,0.000163,,,"33484  >  6000 [FIN, ACK] Seq=28 Ack=1 Win=64256 Len=0 TSval=1627831323 TSecr=3043434700"
60,21.852806,192.168.11.12,192.168.11.32,TCP,66,0.009648,,,6000  >  33484 [ACK] Seq=1 Ack=28 Win=65152 Len=0 TSval=3043434710 TSecr=1627831322
61,21.855545,192.168.11.12,192.168.11.32,TCP,66,0.002739,,,"6000  >  33484 [FIN, ACK] Seq=1 Ack=29 Win=65152 Len=0 TSval=3043434713 TSecr=1627831323"
62,21.855588,192.168.11.32,192.168.11.12,TCP,66,0.000043,,,33484  >  6000 [ACK] Seq=29 Ack=2 Win=64256 Len=0 TSval=1627831335 TSecr=3043434713
63,21.884663,192.168.11.32,255.255.255.255,UDP,209,0.029075,Ÿ,7b2273656d616e74696373223a207b22656e74697479223a2022504944222c202262617365656e74697479223a2022616e79222c2022726f6c65223a2022767676222c20227370617469616c223a2022616e79222c202274656d706f72616c223a2022616e79227d2c20226461746170726f7065727479223a207b22666f726d6174223a2022696e616f6b615f70726f6772616d5f73616d706c655f73656d616e746963227d7d,42609  >  7000 Len=167
64,21.894629,192.168.11.18,192.168.11.32,TCP,74,0.009966,œ,,44680  >  6000 [SYN] Seq=0 Win=64240 Len=0 MSS=1460 SACK_PERM TSval=3408792190 TSecr=0 WS=128
65,21.894749,192.168.11.32,192.168.11.18,TCP,74,0.00012,,,"6000  >  44680 [SYN, ACK] Seq=0 Ack=1 Win=65160 Len=0 MSS=1460 SACK_PERM TSval=3634291656 TSecr=3408792190 WS=128"
66,21.909518,192.168.11.18,192.168.11.32,TCP,66,0.014769,,,44680  >  6000 [ACK] Seq=1 Ack=1 Win=64256 Len=0 TSval=3408792199 TSecr=3634291656
67,21.909981,192.168.11.18,192.168.11.32,TCP,93,0.000463,,,"44680  >  6000 [PSH, ACK] Seq=1 Ack=1 Win=64256 Len=27 TSval=3408792199 TSecr=3634291656 [TCP segment of a reassembled PDU]"
68,21.910046,192.168.11.32,192.168.11.18,TCP,66,0.000065,,,6000  >  44680 [ACK] Seq=1 Ack=28 Win=65152 Len=0 TSval=3634291671 TSecr=3408792199
69,21.910109,192.168.11.18,192.168.11.32,TCP,66,0.000063,,,"44680  >  6000 [FIN, ACK] Seq=28 Ack=1 Win=64256 Len=0 TSval=3408792199 TSecr=3634291656"
70,21.911064,192.168.11.32,192.168.11.18,TCP,66,0.000955,,,"6000  >  44680 [FIN, ACK] Seq=1 Ack=29 Win=65152 Len=0 TSval=3634291672 TSecr=3408792199"
71,21.917465,192.168.11.18,192.168.11.32,TCP,66,0.006401,,,44680  >  6000 [ACK] Seq=29 Ack=2 Win=64256 Len=0 TSval=3408792215 TSecr=3634291672
72,29.052062,192.168.11.32,192.168.11.12,TCP,74,7.134597,,,50298  >  6000 [SYN] Seq=0 Win=64240 Len=0 MSS=1460 SACK_PERM TSval=1627838531 TSecr=0 WS=128
73,29.061902,192.168.11.12,192.168.11.32,TCP,74,0.00984,,,"6000  >  50298 [SYN, ACK] Seq=0 Ack=1 Win=65160 Len=0 MSS=1460 SACK_PERM TSval=3043441920 TSecr=1627838531 WS=128"
74,29.061999,192.168.11.32,192.168.11.12,TCP,66,0.000097,,,50298  >  6000 [ACK] Seq=1 Ack=1 Win=64256 Len=0 TSval=1627838541 TSecr=3043441920
75,29.062159,192.168.11.32,192.168.11.12,TCP,93,0.00016,,,"50298  >  6000 [PSH, ACK] Seq=1 Ack=1 Win=64256 Len=27 TSval=1627838542 TSecr=3043441920 [TCP segment of a reassembled PDU]"
76,29.06225,192.168.11.32,192.168.11.12,TCP,66,0.000091,,,"50298  >  6000 [FIN, ACK] Seq=28 Ack=1 Win=64256 Len=0 TSval=1627838542 TSecr=3043441920"
77,29.07033,192.168.11.12,192.168.11.32,TCP,66,0.00808,,,6000  >  50298 [ACK] Seq=1 Ack=28 Win=65152 Len=0 TSval=3043441929 TSecr=1627838542
78,29.072911,192.168.11.12,192.168.11.32,TCP,66,0.002581,,,"6000  >  50298 [FIN, ACK] Seq=1 Ack=29 Win=65152 Len=0 TSval=3043441931 TSecr=1627838542"
79,29.072956,192.168.11.32,192.168.11.12,TCP,66,0.000045,,,50298  >  6000 [ACK] Seq=29 Ack=2 Win=64256 Len=0 TSval=1627838552 TSecr=3043441931
80,29.101715,192.168.11.32,255.255.255.255,UDP,209,0.028759,Ÿ,7b2273656d616e74696373223a207b22656e74697479223a2022504944222c202262617365656e74697479223a2022616e79222c2022726f6c65223a2022767676222c20227370617469616c223a2022616e79222c202274656d706f72616c223a2022616e79227d2c20226461746170726f7065727479223a207b22666f726d6174223a2022696e616f6b615f70726f6772616d5f73616d706c655f73656d616e746963227d7d,56561  >  7000 Len=167
81,29.112607,192.168.11.18,192.168.11.32,TCP,74,0.010892,œ,,44686  >  6000 [SYN] Seq=0 Win=64240 Len=0 MSS=1460 SACK_PERM TSval=3408799407 TSecr=0 WS=128
82,29.112733,192.168.11.32,192.168.11.18,TCP,74,0.000126,,,"6000  >  44686 [SYN, ACK] Seq=0 Ack=1 Win=65160 Len=0 MSS=1460 SACK_PERM TSval=3634298874 TSecr=3408799407 WS=128"
83,29.119472,192.168.11.18,192.168.11.32,TCP,66,0.006739,,,44686  >  6000 [ACK] Seq=1 Ack=1 Win=64256 Len=0 TSval=3408799417 TSecr=3634298874
84,29.120073,192.168.11.18,192.168.11.32,TCP,93,0.000601,,,"44686  >  6000 [PSH, ACK] Seq=1 Ack=1 Win=64256 Len=27 TSval=3408799417 TSecr=3634298874 [TCP segment of a reassembled PDU]"
85,29.120168,192.168.11.32,192.168.11.18,TCP,66,0.000095,,,6000  >  44686 [ACK] Seq=1 Ack=28 Win=65152 Len=0 TSval=3634298882 TSecr=3408799417
86,29.120249,192.168.11.18,192.168.11.32,TCP,66,0.000081,,,"44686  >  6000 [FIN, ACK] Seq=28 Ack=1 Win=64256 Len=0 TSval=3408799417 TSecr=3634298874"
87,29.121399,192.168.11.32,192.168.11.18,TCP,66,0.00115,,,"6000  >  44686 [FIN, ACK] Seq=1 Ack=29 Win=65152 Len=0 TSval=3634298883 TSecr=3408799417"
88,29.127536,192.168.11.18,192.168.11.32,TCP,66,0.006137,,,44686  >  6000 [ACK] Seq=29 Ack=2 Win=64256 Len=0 TSval=3408799425 TSecr=3634298883
89,36.220519,192.168.11.32,192.168.11.12,TCP,74,7.092983,,,52432  >  6000 [SYN] Seq=0 Win=64240 Len=0 MSS=1460 SACK_PERM TSval=1627845700 TSecr=0 WS=128
90,36.232233,192.168.11.12,192.168.11.32,TCP,74,0.011714,,,"6000  >  52432 [SYN, ACK] Seq=0 Ack=1 Win=65160 Len=0 MSS=1460 SACK_PERM TSval=3043449087 TSecr=1627845700 WS=128"
91,36.232339,192.168.11.32,192.168.11.12,TCP,66,0.000106,,,52432  >  6000 [ACK] Seq=1 Ack=1 Win=64256 Len=0 TSval=1627845712 TSecr=3043449087
92,36.232475,192.168.11.32,192.168.11.12,TCP,93,0.000136,,,"52432  >  6000 [PSH, ACK] Seq=1 Ack=1 Win=64256 Len=27 TSval=1627845712 TSecr=3043449087 [TCP segment of a reassembled PDU]"
93,36.232566,192.168.11.32,192.168.11.12,TCP,66,0.000091,,,"52432  >  6000 [FIN, ACK] Seq=28 Ack=1 Win=64256 Len=0 TSval=1627845712 TSecr=3043449087"
94,36.242147,192.168.11.12,192.168.11.32,TCP,66,0.009581,,,6000  >  52432 [ACK] Seq=1 Ack=28 Win=65152 Len=0 TSval=3043449100 TSecr=1627845712
95,36.242536,192.168.11.12,192.168.11.32,TCP,66,0.000389,,,"6000  >  52432 [FIN, ACK] Seq=1 Ack=29 Win=65152 Len=0 TSval=3043449102 TSecr=1627845712"
96,36.242601,192.168.11.32,192.168.11.12,TCP,66,0.000065,,,52432  >  6000 [ACK] Seq=29 Ack=2 Win=64256 Len=0 TSval=1627845722 TSecr=3043449102
97,36.271355,192.168.11.32,255.255.255.255,UDP,209,0.028754,Ÿ,7b2273656d616e74696373223a207b22656e74697479223a2022504944222c202262617365656e74697479223a2022616e79222c2022726f6c65223a2022767676222c20227370617469616c223a2022616e79222c202274656d706f72616c223a2022616e79227d2c20226461746170726f7065727479223a207b22666f726d6174223a2022696e616f6b615f70726f6772616d5f73616d706c655f73656d616e746963227d7d,60263  >  7000 Len=167
98,36.278841,192.168.11.18,192.168.11.32,TCP,74,0.007486,œ,,39312  >  6000 [SYN] Seq=0 Win=64240 Len=0 MSS=1460 SACK_PERM TSval=3408806576 TSecr=0 WS=128
99,36.278952,192.168.11.32,192.168.11.18,TCP,74,0.000111,,,"6000  >  39312 [SYN, ACK] Seq=0 Ack=1 Win=65160 Len=0 MSS=1460 SACK_PERM TSval=3634306040 TSecr=3408806576 WS=128"
100,36.285707,192.168.11.18,192.168.11.32,TCP,66,0.006755,,,39312  >  6000 [ACK] Seq=1 Ack=1 Win=64256 Len=0 TSval=3408806583 TSecr=3634306040
101,36.286306,192.168.11.18,192.168.11.32,TCP,93,0.000599,,,"39312  >  6000 [PSH, ACK] Seq=1 Ack=1 Win=64256 Len=27 TSval=3408806583 TSecr=3634306040 [TCP segment of a reassembled PDU]"
102,36.286426,192.168.11.32,192.168.11.18,TCP,66,0.00012,,,6000  >  39312 [ACK] Seq=1 Ack=28 Win=65152 Len=0 TSval=3634306048 TSecr=3408806583
103,36.286505,192.168.11.18,192.168.11.32,TCP,66,0.000079,,,"39312  >  6000 [FIN, ACK] Seq=28 Ack=1 Win=64256 Len=0 TSval=3408806584 TSecr=3634306040"
104,36.287724,192.168.11.32,192.168.11.18,TCP,66,0.001219,,,"6000  >  39312 [FIN, ACK] Seq=1 Ack=29 Win=65152 Len=0 TSval=3634306049 TSecr=3408806584"
105,36.29374,192.168.11.18,192.168.11.32,TCP,66,0.006016,,,39312  >  6000 [ACK] Seq=29 Ack=2 Win=64256 Len=0 TSval=3408806591 TSecr=3634306049
106,43.426994,192.168.11.32,192.168.11.12,TCP,74,7.133254,,,52436  >  6000 [SYN] Seq=0 Win=64240 Len=0 MSS=1460 SACK_PERM TSval=1627852906 TSecr=0 WS=128
107,43.435808,192.168.11.12,192.168.11.32,TCP,74,0.008814,,,"6000  >  52436 [SYN, ACK] Seq=0 Ack=1 Win=65160 Len=0 MSS=1460 SACK_PERM TSval=3043456294 TSecr=1627852906 WS=128"
108,43.435922,192.168.11.32,192.168.11.12,TCP,66,0.000114,,,52436  >  6000 [ACK] Seq=1 Ack=1 Win=64256 Len=0 TSval=1627852915 TSecr=3043456294
109,43.436062,192.168.11.32,192.168.11.12,TCP,93,0.00014,,,"52436  >  6000 [PSH, ACK] Seq=1 Ack=1 Win=64256 Len=27 TSval=1627852916 TSecr=3043456294 [TCP segment of a reassembled PDU]"
110,43.436156,192.168.11.32,192.168.11.12,TCP,66,0.000094,,,"52436  >  6000 [FIN, ACK] Seq=28 Ack=1 Win=64256 Len=0 TSval=1627852916 TSecr=3043456294"
111,43.445507,192.168.11.12,192.168.11.32,TCP,66,0.009351,,,6000  >  52436 [ACK] Seq=1 Ack=28 Win=65152 Len=0 TSval=3043456304 TSecr=1627852916
112,43.447597,192.168.11.12,192.168.11.32,TCP,66,0.00209,,,"6000  >  52436 [FIN, ACK] Seq=1 Ack=29 Win=65152 Len=0 TSval=3043456306 TSecr=1627852916"
113,43.447659,192.168.11.32,192.168.11.12,TCP,66,0.000062,,,52436  >  6000 [ACK] Seq=29 Ack=2 Win=64256 Len=0 TSval=1627852927 TSecr=3043456306
114,43.47705,192.168.11.32,255.255.255.255,UDP,209,0.029391,Ÿ,7b2273656d616e74696373223a207b22656e74697479223a2022504944222c202262617365656e74697479223a2022616e79222c2022726f6c65223a2022767676222c20227370617469616c223a2022616e79222c202274656d706f72616c223a2022616e79227d2c20226461746170726f7065727479223a207b22666f726d6174223a2022696e616f6b615f70726f6772616d5f73616d706c655f73656d616e746963227d7d,37327  >  7000 Len=167
115,43.484631,192.168.11.18,192.168.11.32,TCP,74,0.007581,œ,,46846  >  6000 [SYN] Seq=0 Win=64240 Len=0 MSS=1460 SACK_PERM TSval=3408813782 TSecr=0 WS=128
116,43.484766,192.168.11.32,192.168.11.18,TCP,74,0.000135,,,"6000  >  46846 [SYN, ACK] Seq=0 Ack=1 Win=65160 Len=0 MSS=1460 SACK_PERM TSval=3634313246 TSecr=3408813782 WS=128"
117,43.49215,192.168.11.18,192.168.11.32,TCP,66,0.007384,,,46846  >  6000 [ACK] Seq=1 Ack=1 Win=64256 Len=0 TSval=3408813789 TSecr=3634313246
118,43.492718,192.168.11.18,192.168.11.32,TCP,93,0.000568,,,"46846  >  6000 [PSH, ACK] Seq=1 Ack=1 Win=64256 Len=27 TSval=3408813789 TSecr=3634313246 [TCP segment of a reassembled PDU]"
119,43.492831,192.168.11.32,192.168.11.18,TCP,66,0.000113,,,6000  >  46846 [ACK] Seq=1 Ack=28 Win=65152 Len=0 TSval=3634313254 TSecr=3408813789
120,43.492896,192.168.11.18,192.168.11.32,TCP,66,0.000065,,,"46846  >  6000 [FIN, ACK] Seq=28 Ack=1 Win=64256 Len=0 TSval=3408813789 TSecr=3634313246"
121,43.493978,192.168.11.32,192.168.11.18,TCP,66,0.001082,,,"6000  >  46846 [FIN, ACK] Seq=1 Ack=29 Win=65152 Len=0 TSval=3634313255 TSecr=3408813789"
122,43.500268,192.168.11.18,192.168.11.32,TCP,66,0.00629,,,46846  >  6000 [ACK] Seq=29 Ack=2 Win=64256 Len=0 TSval=3408813798 TSecr=3634313255
123,50.626433,192.168.11.32,192.168.11.12,TCP,74,7.126165,,,32942  >  6000 [SYN] Seq=0 Win=64240 Len=0 MSS=1460 SACK_PERM TSval=1627860106 TSecr=0 WS=128
124,50.636315,192.168.11.12,192.168.11.32,TCP,74,0.009882,,,"6000  >  32942 [SYN, ACK] Seq=0 Ack=1 Win=65160 Len=0 MSS=1460 SACK_PERM TSval=3043463494 TSecr=1627860106 WS=128"
125,50.636432,192.168.11.32,192.168.11.12,TCP,66,0.000117,,,32942  >  6000 [ACK] Seq=1 Ack=1 Win=64256 Len=0 TSval=1627860116 TSecr=3043463494
126,50.636592,192.168.11.32,192.168.11.12,TCP,93,0.00016,,,"32942  >  6000 [PSH, ACK] Seq=1 Ack=1 Win=64256 Len=27 TSval=1627860116 TSecr=3043463494 [TCP segment of a reassembled PDU]"
127,50.636682,192.168.11.32,192.168.11.12,TCP,66,0.00009,,,"32942  >  6000 [FIN, ACK] Seq=28 Ack=1 Win=64256 Len=0 TSval=1627860116 TSecr=3043463494"
128,50.644615,192.168.11.12,192.168.11.32,TCP,66,0.007933,,,6000  >  32942 [ACK] Seq=1 Ack=28 Win=65152 Len=0 TSval=3043463503 TSecr=1627860116
129,50.647101,192.168.11.12,192.168.11.32,TCP,66,0.002486,,,"6000  >  32942 [FIN, ACK] Seq=1 Ack=29 Win=65152 Len=0 TSval=3043463505 TSecr=1627860116"
130,50.647164,192.168.11.32,192.168.11.12,TCP,66,0.000063,,,32942  >  6000 [ACK] Seq=29 Ack=2 Win=64256 Len=0 TSval=1627860127 TSecr=3043463505
131,50.676054,192.168.11.32,255.255.255.255,UDP,209,0.02889,Ÿ,7b2273656d616e74696373223a207b22656e74697479223a2022504944222c202262617365656e74697479223a2022616e79222c2022726f6c65223a2022767676222c20227370617469616c223a2022616e79222c202274656d706f72616c223a2022616e79227d2c20226461746170726f7065727479223a207b22666f726d6174223a2022696e616f6b615f70726f6772616d5f73616d706c655f73656d616e746963227d7d,45403  >  7000 Len=167
132,50.683875,192.168.11.18,192.168.11.32,TCP,74,0.007821,œ,,51922  >  6000 [SYN] Seq=0 Win=64240 Len=0 MSS=1460 SACK_PERM TSval=3408820981 TSecr=0 WS=128
133,50.684025,192.168.11.32,192.168.11.18,TCP,74,0.00015,,,"6000  >  51922 [SYN, ACK] Seq=0 Ack=1 Win=65160 Len=0 MSS=1460 SACK_PERM TSval=3634320445 TSecr=3408820981 WS=128"
134,50.690776,192.168.11.18,192.168.11.32,TCP,66,0.006751,,,51922  >  6000 [ACK] Seq=1 Ack=1 Win=64256 Len=0 TSval=3408820988 TSecr=3634320445
135,50.691487,192.168.11.18,192.168.11.32,TCP,93,0.000711,,,"51922  >  6000 [PSH, ACK] Seq=1 Ack=1 Win=64256 Len=27 TSval=3408820988 TSecr=3634320445 [TCP segment of a reassembled PDU]"
136,50.69161,192.168.11.32,192.168.11.18,TCP,66,0.000123,,,6000  >  51922 [ACK] Seq=1 Ack=28 Win=65152 Len=0 TSval=3634320453 TSecr=3408820988
137,50.691691,192.168.11.18,192.168.11.32,TCP,66,0.000081,,,"51922  >  6000 [FIN, ACK] Seq=28 Ack=1 Win=64256 Len=0 TSval=3408820989 TSecr=3634320445"
138,50.692774,192.168.11.32,192.168.11.18,TCP,66,0.001083,,,"6000  >  51922 [FIN, ACK] Seq=1 Ack=29 Win=65152 Len=0 TSval=3634320454 TSecr=3408820989"
139,50.699213,192.168.11.18,192.168.11.32,TCP,66,0.006439,,,51922  >  6000 [ACK] Seq=29 Ack=2 Win=64256 Len=0 TSval=3408820996 TSecr=3634320454
140,57.778121,192.168.11.32,192.168.11.12,TCP,74,7.078908,,,49022  >  6000 [SYN] Seq=0 Win=64240 Len=0 MSS=1460 SACK_PERM TSval=1627867258 TSecr=0 WS=128
141,57.786863,192.168.11.12,192.168.11.32,TCP,74,0.008742,,,"6000  >  49022 [SYN, ACK] Seq=0 Ack=1 Win=65160 Len=0 MSS=1460 SACK_PERM TSval=3043470645 TSecr=1627867258 WS=128"
142,57.786968,192.168.11.32,192.168.11.12,TCP,66,0.000105,,,49022  >  6000 [ACK] Seq=1 Ack=1 Win=64256 Len=0 TSval=1627867266 TSecr=3043470645
143,57.787141,192.168.11.32,192.168.11.12,TCP,93,0.000173,,,"49022  >  6000 [PSH, ACK] Seq=1 Ack=1 Win=64256 Len=27 TSval=1627867267 TSecr=3043470645 [TCP segment of a reassembled PDU]"
144,57.787266,192.168.11.32,192.168.11.12,TCP,66,0.000125,,,"49022  >  6000 [FIN, ACK] Seq=28 Ack=1 Win=64256 Len=0 TSval=1627867267 TSecr=3043470645"
145,57.795156,192.168.11.12,192.168.11.32,TCP,66,0.00789,,,6000  >  49022 [ACK] Seq=1 Ack=28 Win=65152 Len=0 TSval=3043470654 TSecr=1627867267
146,57.795377,192.168.11.12,192.168.11.32,TCP,66,0.000221,,,"6000  >  49022 [FIN, ACK] Seq=1 Ack=29 Win=65152 Len=0 TSval=3043470655 TSecr=1627867267"
147,57.795429,192.168.11.32,192.168.11.12,TCP,66,0.000052,,,49022  >  6000 [ACK] Seq=29 Ack=2 Win=64256 Len=0 TSval=1627867275 TSecr=3043470655
148,57.823817,192.168.11.32,255.255.255.255,UDP,209,0.028388,Ÿ,7b2273656d616e74696373223a207b22656e74697479223a2022504944222c202262617365656e74697479223a2022616e79222c2022726f6c65223a2022767676222c20227370617469616c223a2022616e79222c202274656d706f72616c223a2022616e79227d2c20226461746170726f7065727479223a207b22666f726d6174223a2022696e616f6b615f70726f6772616d5f73616d706c655f73656d616e746963227d7d,37657  >  7000 Len=167
149,57.831501,192.168.11.18,192.168.11.32,TCP,74,0.007684,œ,,51932  >  6000 [SYN] Seq=0 Win=64240 Len=0 MSS=1460 SACK_PERM TSval=3408828129 TSecr=0 WS=128
150,57.831617,192.168.11.32,192.168.11.18,TCP,74,0.000116,,,"6000  >  51932 [SYN, ACK] Seq=0 Ack=1 Win=65160 Len=0 MSS=1460 SACK_PERM TSval=3634327593 TSecr=3408828129 WS=128"
151,57.83828,192.168.11.18,192.168.11.32,TCP,66,0.006663,,,51932  >  6000 [ACK] Seq=1 Ack=1 Win=64256 Len=0 TSval=3408828136 TSecr=3634327593
152,57.838855,192.168.11.18,192.168.11.32,TCP,93,0.000575,,,"51932  >  6000 [PSH, ACK] Seq=1 Ack=1 Win=64256 Len=27 TSval=3408828136 TSecr=3634327593 [TCP segment of a reassembled PDU]"
153,57.838971,192.168.11.32,192.168.11.18,TCP,66,0.000116,,,6000  >  51932 [ACK] Seq=1 Ack=28 Win=65152 Len=0 TSval=3634327600 TSecr=3408828136
154,57.839084,192.168.11.18,192.168.11.32,TCP,66,0.000113,,,"51932  >  6000 [FIN, ACK] Seq=28 Ack=1 Win=64256 Len=0 TSval=3408828136 TSecr=3634327593"
155,57.840279,192.168.11.32,192.168.11.18,TCP,66,0.001195,,,"6000  >  51932 [FIN, ACK] Seq=1 Ack=29 Win=65152 Len=0 TSval=3634327602 TSecr=3408828136"
156,57.846397,192.168.11.18,192.168.11.32,TCP,66,0.006118,,,51932  >  6000 [ACK] Seq=29 Ack=2 Win=64256 Len=0 TSval=3408828144 TSecr=3634327602
157,64.91797,192.168.11.32,192.168.11.12,TCP,74,7.071573,,,34584  >  6000 [SYN] Seq=0 Win=64240 Len=0 MSS=1460 SACK_PERM TSval=1627874397 TSecr=0 WS=128
158,64.927285,192.168.11.12,192.168.11.32,TCP,74,0.009315,,,"6000  >  34584 [SYN, ACK] Seq=0 Ack=1 Win=65160 Len=0 MSS=1460 SACK_PERM TSval=3043477785 TSecr=1627874397 WS=128"
159,64.927401,192.168.11.32,192.168.11.12,TCP,66,0.000116,,,34584  >  6000 [ACK] Seq=1 Ack=1 Win=64256 Len=0 TSval=1627874407 TSecr=3043477785
160,64.927532,192.168.11.32,192.168.11.12,TCP,93,0.000131,,,"34584  >  6000 [PSH, ACK] Seq=1 Ack=1 Win=64256 Len=27 TSval=1627874407 TSecr=3043477785 [TCP segment of a reassembled PDU]"
161,64.927636,192.168.11.32,192.168.11.12,TCP,66,0.000104,,,"34584  >  6000 [FIN, ACK] Seq=28 Ack=1 Win=64256 Len=0 TSval=1627874407 TSecr=3043477785"
162,64.936098,192.168.11.12,192.168.11.32,TCP,66,0.008462,,,6000  >  34584 [ACK] Seq=1 Ack=28 Win=65152 Len=0 TSval=3043477794 TSecr=1627874407
163,64.93633,192.168.11.12,192.168.11.32,TCP,66,0.000232,,,[TCP Dup ACK 162#1] 6000  >  34584 [ACK] Seq=1 Ack=28 Win=65152 Len=0 TSval=3043477795 TSecr=1627874407
164,64.93861,192.168.11.12,192.168.11.32,TCP,66,0.00228,,,"6000  >  34584 [FIN, ACK] Seq=1 Ack=29 Win=65152 Len=0 TSval=3043477797 TSecr=1627874407"
165,64.938662,192.168.11.32,192.168.11.12,TCP,66,0.000052,,,34584  >  6000 [ACK] Seq=29 Ack=2 Win=64256 Len=0 TSval=1627874418 TSecr=3043477797
166,64.967574,192.168.11.32,255.255.255.255,UDP,209,0.028912,Ÿ,7b2273656d616e74696373223a207b22656e74697479223a2022504944222c202262617365656e74697479223a2022616e79222c2022726f6c65223a2022767676222c20227370617469616c223a2022616e79222c202274656d706f72616c223a2022616e79227d2c20226461746170726f7065727479223a207b22666f726d6174223a2022696e616f6b615f70726f6772616d5f73616d706c655f73656d616e746963227d7d,40157  >  7000 Len=167
167,64.979094,192.168.11.18,192.168.11.32,TCP,74,0.01152,œ,,59810  >  6000 [SYN] Seq=0 Win=64240 Len=0 MSS=1460 SACK_PERM TSval=3408835273 TSecr=0 WS=128
168,64.979242,192.168.11.32,192.168.11.18,TCP,74,0.000148,,,"6000  >  59810 [SYN, ACK] Seq=0 Ack=1 Win=65160 Len=0 MSS=1460 SACK_PERM TSval=3634334741 TSecr=3408835273 WS=128"
169,64.985873,192.168.11.18,192.168.11.32,TCP,66,0.006631,,,59810  >  6000 [ACK] Seq=1 Ack=1 Win=64256 Len=0 TSval=3408835283 TSecr=3634334741
170,64.986454,192.168.11.18,192.168.11.32,TCP,93,0.000581,,,"59810  >  6000 [PSH, ACK] Seq=1 Ack=1 Win=64256 Len=27 TSval=3408835284 TSecr=3634334741 [TCP segment of a reassembled PDU]"
171,64.986548,192.168.11.32,192.168.11.18,TCP,66,0.000094,,,6000  >  59810 [ACK] Seq=1 Ack=28 Win=65152 Len=0 TSval=3634334748 TSecr=3408835284
172,64.986661,192.168.11.18,192.168.11.32,TCP,66,0.000113,,,"59810  >  6000 [FIN, ACK] Seq=28 Ack=1 Win=64256 Len=0 TSval=3408835284 TSecr=3634334741"
173,64.987691,192.168.11.32,192.168.11.18,TCP,66,0.00103,,,"6000  >  59810 [FIN, ACK] Seq=1 Ack=29 Win=65152 Len=0 TSval=3634334749 TSecr=3408835284"
174,64.993828,192.168.11.18,192.168.11.32,TCP,66,0.006137,,,59810  >  6000 [ACK] Seq=29 Ack=2 Win=64256 Len=0 TSval=3408835291 TSecr=3634334749
175,110.58882,192.168.11.32,192.168.11.12,TCP,74,45.594992,,,54896  >  6000 [SYN] Seq=0 Win=64240 Len=0 MSS=1460 SACK_PERM TSval=1627920068 TSecr=0 WS=128
176,110.606402,192.168.11.12,192.168.11.32,TCP,74,0.017582,,,"6000  >  54896 [SYN, ACK] Seq=0 Ack=1 Win=65160 Len=0 MSS=1460 SACK_PERM TSval=3043523465 TSecr=1627920068 WS=128"
177,110.606497,192.168.11.32,192.168.11.12,TCP,66,0.000095,,,54896  >  6000 [ACK] Seq=1 Ack=1 Win=64256 Len=0 TSval=1627920086 TSecr=3043523465
178,110.606635,192.168.11.32,192.168.11.12,TCP,93,0.000138,,,"54896  >  6000 [PSH, ACK] Seq=1 Ack=1 Win=64256 Len=27 TSval=1627920086 TSecr=3043523465 [TCP segment of a reassembled PDU]"
179,110.60674,192.168.11.32,192.168.11.12,TCP,66,0.000105,,,"54896  >  6000 [FIN, ACK] Seq=28 Ack=1 Win=64256 Len=0 TSval=1627920086 TSecr=3043523465"
180,110.614726,192.168.11.12,192.168.11.32,TCP,66,0.007986,,,6000  >  54896 [ACK] Seq=1 Ack=28 Win=65152 Len=0 TSval=3043523472 TSecr=1627920086
181,110.615104,192.168.11.12,192.168.11.32,TCP,66,0.000378,,,"6000  >  54896 [FIN, ACK] Seq=1 Ack=29 Win=65152 Len=0 TSval=3043523473 TSecr=1627920086"
182,110.615152,192.168.11.32,192.168.11.12,TCP,66,0.000048,,,54896  >  6000 [ACK] Seq=29 Ack=2 Win=64256 Len=0 TSval=1627920095 TSecr=3043523473
183,110.642868,192.168.11.32,255.255.255.255,UDP,209,0.027716,Ÿ,7b2273656d616e74696373223a207b22656e74697479223a2022504944222c202262617365656e74697479223a2022616e79222c2022726f6c65223a2022767676222c20227370617469616c223a2022616e79222c202274656d706f72616c223a2022616e79227d2c20226461746170726f7065727479223a207b22666f726d6174223a2022696e616f6b615f70726f6772616d5f73616d706c655f73656d616e746963227d7d,39747  >  7000 Len=167
184,110.65149,192.168.11.18,192.168.11.32,TCP,74,0.008622,œ,,46310  >  6000 [SYN] Seq=0 Win=64240 Len=0 MSS=1460 SACK_PERM TSval=3408880948 TSecr=0 WS=128
185,110.651596,192.168.11.32,192.168.11.18,TCP,74,0.000106,,,"6000  >  46310 [SYN, ACK] Seq=0 Ack=1 Win=65160 Len=0 MSS=1460 SACK_PERM TSval=3634380413 TSecr=3408880948 WS=128"
186,110.658194,192.168.11.18,192.168.11.32,TCP,66,0.006598,,,46310  >  6000 [ACK] Seq=1 Ack=1 Win=64256 Len=0 TSval=3408880956 TSecr=3634380413
187,110.658748,192.168.11.18,192.168.11.32,TCP,93,0.000554,,,"46310  >  6000 [PSH, ACK] Seq=1 Ack=1 Win=64256 Len=27 TSval=3408880956 TSecr=3634380413 [TCP segment of a reassembled PDU]"
188,110.658831,192.168.11.32,192.168.11.18,TCP,66,0.000083,,,6000  >  46310 [ACK] Seq=1 Ack=28 Win=65152 Len=0 TSval=3634380420 TSecr=3408880956
189,110.658893,192.168.11.18,192.168.11.32,TCP,66,0.000062,,,"46310  >  6000 [FIN, ACK] Seq=28 Ack=1 Win=64256 Len=0 TSval=3408880956 TSecr=3634380413"
190,110.659984,192.168.11.32,192.168.11.18,TCP,66,0.001091,,,"6000  >  46310 [FIN, ACK] Seq=1 Ack=29 Win=65152 Len=0 TSval=3634380421 TSecr=3408880956"
191,110.665949,192.168.11.18,192.168.11.32,TCP,66,0.005965,,,46310  >  6000 [ACK] Seq=29 Ack=2 Win=64256 Len=0 TSval=3408880963 TSecr=3634380421
192,117.74354,192.168.11.32,192.168.11.12,TCP,74,7.077591,,,35576  >  6000 [SYN] Seq=0 Win=64240 Len=0 MSS=1460 SACK_PERM TSval=1627927223 TSecr=0 WS=128
193,117.756332,192.168.11.12,192.168.11.32,TCP,74,0.012792,,,"6000  >  35576 [SYN, ACK] Seq=0 Ack=1 Win=65160 Len=0 MSS=1460 SACK_PERM TSval=3043530611 TSecr=1627927223 WS=128"
194,117.756429,192.168.11.32,192.168.11.12,TCP,66,0.000097,,,35576  >  6000 [ACK] Seq=1 Ack=1 Win=64256 Len=0 TSval=1627927236 TSecr=3043530611
195,117.756598,192.168.11.32,192.168.11.12,TCP,93,0.000169,,,"35576  >  6000 [PSH, ACK] Seq=1 Ack=1 Win=64256 Len=27 TSval=1627927236 TSecr=3043530611 [TCP segment of a reassembled PDU]"
196,117.75669,192.168.11.32,192.168.11.12,TCP,66,0.000092,,,"35576  >  6000 [FIN, ACK] Seq=28 Ack=1 Win=64256 Len=0 TSval=1627927236 TSecr=3043530611"
197,117.765147,192.168.11.12,192.168.11.32,TCP,66,0.008457,,,6000  >  35576 [ACK] Seq=1 Ack=28 Win=65152 Len=0 TSval=3043530623 TSecr=1627927236
198,117.76536,192.168.11.12,192.168.11.32,TCP,66,0.000213,,,"6000  >  35576 [FIN, ACK] Seq=1 Ack=29 Win=65152 Len=0 TSval=3043530625 TSecr=1627927236"
199,117.765402,192.168.11.32,192.168.11.12,TCP,66,0.000042,,,35576  >  6000 [ACK] Seq=29 Ack=2 Win=64256 Len=0 TSval=1627927245 TSecr=3043530625
200,117.802232,192.168.11.32,255.255.255.255,UDP,209,0.03683,Ÿ,7b2273656d616e74696373223a207b22656e74697479223a2022504944222c202262617365656e74697479223a2022616e79222c2022726f6c65223a2022767676222c20227370617469616c223a2022616e79222c202274656d706f72616c223a2022616e79227d2c20226461746170726f7065727479223a207b22666f726d6174223a2022696e616f6b615f70726f6772616d5f73616d706c655f73656d616e746963227d7d,49259  >  7000 Len=167
201,117.810378,192.168.11.18,192.168.11.32,TCP,74,0.008146,œ,,46322  >  6000 [SYN] Seq=0 Win=64240 Len=0 MSS=1460 SACK_PERM TSval=3408888108 TSecr=0 WS=128
202,117.810494,192.168.11.32,192.168.11.18,TCP,74,0.000116,,,"6000  >  46322 [SYN, ACK] Seq=0 Ack=1 Win=65160 Len=0 MSS=1460 SACK_PERM TSval=3634387572 TSecr=3408888108 WS=128"
203,117.825182,192.168.11.18,192.168.11.32,TCP,66,0.014688,,,46322  >  6000 [ACK] Seq=1 Ack=1 Win=64256 Len=0 TSval=3408888123 TSecr=3634387572
204,117.825713,192.168.11.18,192.168.11.32,TCP,93,0.000531,,,"46322  >  6000 [PSH, ACK] Seq=1 Ack=1 Win=64256 Len=27 TSval=3408888123 TSecr=3634387572 [TCP segment of a reassembled PDU]"
205,117.825776,192.168.11.32,192.168.11.18,TCP,66,0.000063,,,6000  >  46322 [ACK] Seq=1 Ack=28 Win=65152 Len=0 TSval=3634387587 TSecr=3408888123
206,117.825842,192.168.11.18,192.168.11.32,TCP,66,0.000066,,,"46322  >  6000 [FIN, ACK] Seq=28 Ack=1 Win=64256 Len=0 TSval=3408888123 TSecr=3634387572"
207,117.826711,192.168.11.32,192.168.11.18,TCP,66,0.000869,,,"6000  >  46322 [FIN, ACK] Seq=1 Ack=29 Win=65152 Len=0 TSval=3634387588 TSecr=3408888123"
208,117.832836,192.168.11.18,192.168.11.32,TCP,66,0.006125,,,46322  >  6000 [ACK] Seq=29 Ack=2 Win=64256 Len=0 TSval=3408888130 TSecr=3634387588
209,124.991813,192.168.11.32,192.168.11.12,TCP,74,7.158977,,,42212  >  6000 [SYN] Seq=0 Win=64240 Len=0 MSS=1460 SACK_PERM TSval=1627934471 TSecr=0 WS=128
210,125.002809,192.168.11.12,192.168.11.32,TCP,74,0.010996,,,"6000  >  42212 [SYN, ACK] Seq=0 Ack=1 Win=65160 Len=0 MSS=1460 SACK_PERM TSval=3043537861 TSecr=1627934471 WS=128"
211,125.002905,192.168.11.32,192.168.11.12,TCP,66,0.000096,,,42212  >  6000 [ACK] Seq=1 Ack=1 Win=64256 Len=0 TSval=1627934482 TSecr=3043537861
212,125.003149,192.168.11.32,192.168.11.12,TCP,93,0.000244,,,"42212  >  6000 [PSH, ACK] Seq=1 Ack=1 Win=64256 Len=27 TSval=1627934483 TSecr=3043537861 [TCP segment of a reassembled PDU]"
213,125.003261,192.168.11.32,192.168.11.12,TCP,66,0.000112,,,"42212  >  6000 [FIN, ACK] Seq=28 Ack=1 Win=64256 Len=0 TSval=1627934483 TSecr=3043537861"
214,125.011216,192.168.11.12,192.168.11.32,TCP,66,0.007955,,,6000  >  42212 [ACK] Seq=1 Ack=28 Win=65152 Len=0 TSval=3043537869 TSecr=1627934483
215,125.011587,192.168.11.12,192.168.11.32,TCP,66,0.000371,,,"6000  >  42212 [FIN, ACK] Seq=1 Ack=29 Win=65152 Len=0 TSval=3043537870 TSecr=1627934483"
216,125.011638,192.168.11.32,192.168.11.12,TCP,66,0.000051,,,42212  >  6000 [ACK] Seq=29 Ack=2 Win=64256 Len=0 TSval=1627934491 TSecr=3043537870
217,125.045631,192.168.11.32,255.255.255.255,UDP,209,0.033993,Ÿ,7b2273656d616e74696373223a207b22656e74697479223a2022504944222c202262617365656e74697479223a2022616e79222c2022726f6c65223a2022767676222c20227370617469616c223a2022616e79222c202274656d706f72616c223a2022616e79227d2c20226461746170726f7065727479223a207b22666f726d6174223a2022696e616f6b615f70726f6772616d5f73616d706c655f73656d616e746963227d7d,52780  >  7000 Len=167
218,125.054743,192.168.11.18,192.168.11.32,TCP,74,0.009112,œ,,35098  >  6000 [SYN] Seq=0 Win=64240 Len=0 MSS=1460 SACK_PERM TSval=3408895352 TSecr=0 WS=128
219,125.054873,192.168.11.32,192.168.11.18,TCP,74,0.00013,,,"6000  >  35098 [SYN, ACK] Seq=0 Ack=1 Win=65160 Len=0 MSS=1460 SACK_PERM TSval=3634394816 TSecr=3408895352 WS=128"
220,125.061647,192.168.11.18,192.168.11.32,TCP,66,0.006774,,,35098  >  6000 [ACK] Seq=1 Ack=1 Win=64256 Len=0 TSval=3408895359 TSecr=3634394816
221,125.062102,192.168.11.18,192.168.11.32,TCP,93,0.000455,,,"35098  >  6000 [PSH, ACK] Seq=1 Ack=1 Win=64256 Len=27 TSval=3408895359 TSecr=3634394816 [TCP segment of a reassembled PDU]"
222,125.062165,192.168.11.32,192.168.11.18,TCP,66,0.000063,,,6000  >  35098 [ACK] Seq=1 Ack=28 Win=65152 Len=0 TSval=3634394824 TSecr=3408895359
223,125.062223,192.168.11.18,192.168.11.32,TCP,66,0.000058,,,"35098  >  6000 [FIN, ACK] Seq=28 Ack=1 Win=64256 Len=0 TSval=3408895359 TSecr=3634394816"
224,125.063246,192.168.11.32,192.168.11.18,TCP,66,0.001023,,,"6000  >  35098 [FIN, ACK] Seq=1 Ack=29 Win=65152 Len=0 TSval=3634394825 TSecr=3408895359"
225,125.069186,192.168.11.18,192.168.11.32,TCP,66,0.00594,,,35098  >  6000 [ACK] Seq=29 Ack=2 Win=64256 Len=0 TSval=3408895367 TSecr=3634394825
226,132.1625,192.168.11.32,192.168.11.12,TCP,74,7.093314,,,42218  >  6000 [SYN] Seq=0 Win=64240 Len=0 MSS=1460 SACK_PERM TSval=1627941642 TSecr=0 WS=128
227,132.171246,192.168.11.12,192.168.11.32,TCP,74,0.008746,,,"6000  >  42218 [SYN, ACK] Seq=0 Ack=1 Win=65160 Len=0 MSS=1460 SACK_PERM TSval=3043545029 TSecr=1627941642 WS=128"
228,132.171343,192.168.11.32,192.168.11.12,TCP,66,0.000097,,,42218  >  6000 [ACK] Seq=1 Ack=1 Win=64256 Len=0 TSval=1627941651 TSecr=3043545029
229,132.171501,192.168.11.32,192.168.11.12,TCP,93,0.000158,,,"42218  >  6000 [PSH, ACK] Seq=1 Ack=1 Win=64256 Len=27 TSval=1627941651 TSecr=3043545029 [TCP segment of a reassembled PDU]"
230,132.171621,192.168.11.32,192.168.11.12,TCP,66,0.00012,,,"42218  >  6000 [FIN, ACK] Seq=28 Ack=1 Win=64256 Len=0 TSval=1627941651 TSecr=3043545029"
231,132.179578,192.168.11.12,192.168.11.32,TCP,66,0.007957,,,6000  >  42218 [ACK] Seq=1 Ack=28 Win=65152 Len=0 TSval=3043545038 TSecr=1627941651
232,132.179819,192.168.11.12,192.168.11.32,TCP,66,0.000241,,,"6000  >  42218 [FIN, ACK] Seq=1 Ack=29 Win=65152 Len=0 TSval=3043545039 TSecr=1627941651"
