No.,Time,Source,Destination,Protocol,Length,Time delta from previous captured frame,XXX,Data,Info
1,0,192.168.11.18,192.168.11.32,TCP,74,0,,,34090  >  6000 [SYN] Seq=0 Win=64240 Len=0 MSS=1460 SACK_PERM TSval=3408770361 TSecr=0 WS=128
2,0.006711,192.168.11.32,192.168.11.18,TCP,74,0.006711,,,"6000  >  34090 [SYN, ACK] Seq=0 Ack=1 Win=65160 Len=0 MSS=1460 SACK_PERM TSval=3634269828 TSecr=3408770361 WS=128"
3,0.006832,192.168.11.18,192.168.11.32,TCP,66,0.000121,,,34090  >  6000 [ACK] Seq=1 Ack=1 Win=64256 Len=0 TSval=3408770371 TSecr=3634269828
4,0.007076,192.168.11.18,192.168.11.32,TCP,93,0.000244,,,"34090  >  6000 [PSH, ACK] Seq=1 Ack=1 Win=64256 Len=27 TSval=3408770371 TSecr=3634269828 [TCP segment of a reassembled PDU]"
5,0.007225,192.168.11.18,192.168.11.32,TCP,66,0.000149,,,"34090  >  6000 [FIN, ACK] Seq=28 Ack=1 Win=64256 Len=0 TSval=3408770372 TSecr=3634269828"
6,0.014144,192.168.11.32,192.168.11.18,TCP,66,0.006919,,,6000  >  34090 [ACK] Seq=1 Ack=28 Win=65152 Len=0 TSval=3634269836 TSecr=3408770371
7,0.014617,192.168.11.32,192.168.11.18,TCP,66,0.000473,,,"6000  >  34090 [FIN, ACK] Seq=1 Ack=29 Win=65152 Len=0 TSval=3634269837 TSecr=3408770372"
8,0.014667,192.168.11.18,192.168.11.32,TCP,66,0.00005,,,34090  >  6000 [ACK] Seq=29 Ack=2 Win=64256 Len=0 TSval=3408770379 TSecr=3634269837
9,0.043095,192.168.11.18,255.255.255.255,UDP,209,0.028428,Ÿ,7b2273656d616e74696373223a207b22656e74697479223a2022504944222c202262617365656e74697479223a2022616e79222c2022726f6c65223a2022777777222c20227370617469616c223a2022616e79222c202274656d706f72616c223a2022616e79227d2c20226461746170726f7065727479223a207b22666f726d6174223a2022696e616f6b615f70726f6772616d5f73616d706c655f73656d616e746963227d7d,60461  >  7000 Len=167
10,0.057513,192.168.11.33,192.168.11.18,TCP,74,0.014418,œ,,40644  >  6000 [SYN] Seq=0 Win=64240 Len=0 MSS=1460 SACK_PERM TSval=4175703792 TSecr=0 WS=128
11,0.057679,192.168.11.18,192.168.11.33,TCP,74,0.000166,,,"6000  >  40644 [SYN, ACK] Seq=0 Ack=1 Win=65160 Len=0 MSS=1460 SACK_PERM TSval=2869608979 TSecr=4175703792 WS=128"
12,0.064509,192.168.11.33,192.168.11.18,TCP,66,0.00683,,,40644  >  6000 [ACK] Seq=1 Ack=1 Win=64256 Len=0 TSval=4175703804 TSecr=2869608979
13,0.065169,192.168.11.33,192.168.11.18,TCP,93,0.00066,,,"40644  >  6000 [PSH, ACK] Seq=1 Ack=1 Win=64256 Len=27 TSval=4175703804 TSecr=2869608979 [TCP segment of a reassembled PDU]"
14,0.06526,192.168.11.18,192.168.11.33,TCP,66,0.000091,,,6000  >  40644 [ACK] Seq=1 Ack=28 Win=65152 Len=0 TSval=2869608987 TSecr=4175703804
15,0.065345,192.168.11.33,192.168.11.18,TCP,66,0.000085,,,"40644  >  6000 [FIN, ACK] Seq=28 Ack=1 Win=64256 Len=0 TSval=4175703804 TSecr=2869608979"
16,0.067283,192.168.11.18,192.168.11.33,TCP,66,0.001938,,,"6000  >  40644 [FIN, ACK] Seq=1 Ack=29 Win=65152 Len=0 TSval=2869608989 TSecr=4175703804"
17,0.072308,192.168.11.33,192.168.11.18,TCP,66,0.005025,,,40644  >  6000 [ACK] Seq=29 Ack=2 Win=64256 Len=0 TSval=4175703811 TSecr=2869608989
18,7.288718,192.168.11.18,192.168.11.32,TCP,74,7.21641,,,34094  >  6000 [SYN] Seq=0 Win=64240 Len=0 MSS=1460 SACK_PERM TSval=3408777653 TSecr=0 WS=128
19,7.295416,192.168.11.32,192.168.11.18,TCP,74,0.006698,,,"6000  >  34094 [SYN, ACK] Seq=0 Ack=1 Win=65160 Len=0 MSS=1460 SACK_PERM TSval=3634277117 TSecr=3408777653 WS=128"
20,7.295527,192.168.11.18,192.168.11.32,TCP,66,0.000111,,,34094  >  6000 [ACK] Seq=1 Ack=1 Win=64256 Len=0 TSval=3408777660 TSecr=3634277117
21,7.295709,192.168.11.18,192.168.11.32,TCP,93,0.000182,,,"34094  >  6000 [PSH, ACK] Seq=1 Ack=1 Win=64256 Len=27 TSval=3408777660 TSecr=3634277117 [TCP segment of a reassembled PDU]"
22,7.295851,192.168.11.18,192.168.11.32,TCP,66,0.000142,,,"34094  >  6000 [FIN, ACK] Seq=28 Ack=1 Win=64256 Len=0 TSval=3408777660 TSecr=3634277117"
23,7.312118,192.168.11.18,192.168.11.32,TCP,66,0.016267,,,"[TCP Retransmission] 34094  >  6000 [FIN, ACK] Seq=28 Ack=1 Win=64256 Len=0 TSval=3408777677 TSecr=3634277117"
24,7.312547,192.168.11.32,192.168.11.18,TCP,66,0.000429,,,6000  >  34094 [ACK] Seq=1 Ack=28 Win=65152 Len=0 TSval=3634277134 TSecr=3408777660
25,7.312933,192.168.11.32,192.168.11.18,TCP,66,0.000386,,,"6000  >  34094 [FIN, ACK] Seq=1 Ack=29 Win=65152 Len=0 TSval=3634277135 TSecr=3408777660"
26,7.312977,192.168.11.18,192.168.11.32,TCP,66,0.000044,,,34094  >  6000 [ACK] Seq=29 Ack=2 Win=64256 Len=0 TSval=3408777677 TSecr=3634277135
27,7.320228,192.168.11.32,192.168.11.18,TCP,78,0.007251,,,[TCP Dup ACK 25#1] 6000  >  34094 [ACK] Seq=2 Ack=29 Win=65152 Len=0 TSval=3634277141 TSecr=3408777677 SLE=28 SRE=29
28,7.3412,192.168.11.18,255.255.255.255,UDP,209,0.020972,Ÿ,7b2273656d616e74696373223a207b22656e74697479223a2022504944222c202262617365656e74697479223a2022616e79222c2022726f6c65223a2022777777222c20227370617469616c223a2022616e79222c202274656d706f72616c223a2022616e79227d2c20226461746170726f7065727479223a207b22666f726d6174223a2022696e616f6b615f70726f6772616d5f73616d706c655f73656d616e746963227d7d,38402  >  7000 Len=167
29,7.348844,192.168.11.33,192.168.11.18,TCP,74,0.007644,œ,,43320  >  6000 [SYN] Seq=0 Win=64240 Len=0 MSS=1460 SACK_PERM TSval=4175711088 TSecr=0 WS=128
30,7.349004,192.168.11.18,192.168.11.33,TCP,74,0.00016,,,"6000  >  43320 [SYN, ACK] Seq=0 Ack=1 Win=65160 Len=0 MSS=1460 SACK_PERM TSval=2869616270 TSecr=4175711088 WS=128"
31,7.356117,192.168.11.33,192.168.11.18,TCP,66,0.007113,,,43320  >  6000 [ACK] Seq=1 Ack=1 Win=64256 Len=0 TSval=4175711095 TSecr=2869616270
32,7.35672,192.168.11.33,192.168.11.18,TCP,93,0.000603,,,"43320  >  6000 [PSH, ACK] Seq=1 Ack=1 Win=64256 Len=27 TSval=4175711095 TSecr=2869616270 [TCP segment of a reassembled PDU]"
33,7.356816,192.168.11.18,192.168.11.33,TCP,66,0.000096,,,6000  >  43320 [ACK] Seq=1 Ack=28 Win=65152 Len=0 TSval=2869616278 TSecr=4175711095
34,7.357141,192.168.11.33,192.168.11.18,TCP,66,0.000325,,,"43320  >  6000 [FIN, ACK] Seq=28 Ack=1 Win=64256 Len=0 TSval=4175711096 TSecr=2869616270"
35,7.359745,192.168.11.18,192.168.11.33,TCP,66,0.002604,,,"6000  >  43320 [FIN, ACK] Seq=1 Ack=29 Win=65152 Len=0 TSval=2869616281 TSecr=4175711096"
36,7.366785,192.168.11.33,192.168.11.18,TCP,66,0.00704,,,43320  >  6000 [ACK] Seq=29 Ack=2 Win=64256 Len=0 TSval=4175711104 TSecr=2869616281
37,14.640848,192.168.11.18,192.168.11.32,TCP,74,7.274063,,,38222  >  6000 [SYN] Seq=0 Win=64240 Len=0 MSS=1460 SACK_PERM TSval=3408785005 TSecr=0 WS=128
38,14.647415,192.168.11.32,192.168.11.18,TCP,74,0.006567,,,"6000  >  38222 [SYN, ACK] Seq=0 Ack=1 Win=65160 Len=0 MSS=1460 SACK_PERM TSval=3634284469 TSecr=3408785005 WS=128"
39,14.647526,192.168.11.18,192.168.11.32,TCP,66,0.000111,,,38222  >  6000 [ACK] Seq=1 Ack=1 Win=64256 Len=0 TSval=3408785012 TSecr=3634284469
40,14.647699,192.168.11.18,192.168.11.32,TCP,93,0.000173,,,"38222  >  6000 [PSH, ACK] Seq=1 Ack=1 Win=64256 Len=27 TSval=3408785012 TSecr=3634284469 [TCP segment of a reassembled PDU]"
41,14.647822,192.168.11.18,192.168.11.32,TCP,66,0.000123,,,"38222  >  6000 [FIN, ACK] Seq=28 Ack=1 Win=64256 Len=0 TSval=3408785012 TSecr=3634284469"
42,14.655121,192.168.11.32,192.168.11.18,TCP,66,0.007299,,,6000  >  38222 [ACK] Seq=1 Ack=28 Win=65152 Len=0 TSval=3634284477 TSecr=3408785012
43,14.655492,192.168.11.32,192.168.11.18,TCP,66,0.000371,,,"6000  >  38222 [FIN, ACK] Seq=1 Ack=29 Win=65152 Len=0 TSval=3634284478 TSecr=3408785012"
44,14.655548,192.168.11.18,192.168.11.32,TCP,66,0.000056,,,38222  >  6000 [ACK] Seq=29 Ack=2 Win=64256 Len=0 TSval=3408785020 TSecr=3634284478
45,14.685065,192.168.11.18,255.255.255.255,UDP,209,0.029517,Ÿ,7b2273656d616e74696373223a207b22656e74697479223a2022504944222c202262617365656e74697479223a2022616e79222c2022726f6c65223a2022777777222c20227370617469616c223a2022616e79222c202274656d706f72616c223a2022616e79227d2c20226461746170726f7065727479223a207b22666f726d6174223a2022696e616f6b615f70726f6772616d5f73616d706c655f73656d616e746963227d7d,47822  >  7000 Len=167
46,14.693269,192.168.11.33,192.168.11.18,TCP,74,0.008204,œ,,43336  >  6000 [SYN] Seq=0 Win=64240 Len=0 MSS=1460 SACK_PERM TSval=4175718433 TSecr=0 WS=128
47,14.693429,192.168.11.18,192.168.11.33,TCP,74,0.00016,,,"6000  >  43336 [SYN, ACK] Seq=0 Ack=1 Win=65160 Len=0 MSS=1460 SACK_PERM TSval=2869623615 TSecr=4175718433 WS=128"
48,14.70476,192.168.11.33,192.168.11.18,TCP,66,0.011331,,,43336  >  6000 [ACK] Seq=1 Ack=1 Win=64256 Len=0 TSval=4175718439 TSecr=2869623615
49,14.705389,192.168.11.33,192.168.11.18,TCP,93,0.000629,,,"43336  >  6000 [PSH, ACK] Seq=1 Ack=1 Win=64256 Len=27 TSval=4175718440 TSecr=2869623615 [TCP segment of a reassembled PDU]"
50,14.705474,192.168.11.18,192.168.11.33,TCP,66,0.000085,,,6000  >  43336 [ACK] Seq=1 Ack=28 Win=65152 Len=0 TSval=2869623627 TSecr=4175718440
51,14.705552,192.168.11.33,192.168.11.18,TCP,66,0.000078,,,"43336  >  6000 [FIN, ACK] Seq=28 Ack=1 Win=64256 Len=0 TSval=4175718440 TSecr=2869623615"
52,14.707454,192.168.11.18,192.168.11.33,TCP,66,0.001902,,,"6000  >  43336 [FIN, ACK] Seq=1 Ack=29 Win=65152 Len=0 TSval=2869623629 TSecr=4175718440"
53,14.712684,192.168.11.33,192.168.11.18,TCP,66,0.00523,,,43336  >  6000 [ACK] Seq=29 Ack=2 Win=64256 Len=0 TSval=4175718452 TSecr=2869623629
54,21.825393,192.168.11.18,192.168.11.32,TCP,74,7.112709,,,44680  >  6000 [SYN] Seq=0 Win=64240 Len=0 MSS=1460 SACK_PERM TSval=3408792190 TSecr=0 WS=128
55,21.834512,192.168.11.32,192.168.11.18,TCP,74,0.009119,,,"6000  >  44680 [SYN, ACK] Seq=0 Ack=1 Win=65160 Len=0 MSS=1460 SACK_PERM TSval=3634291656 TSecr=3408792190 WS=128"
56,21.834636,192.168.11.18,192.168.11.32,TCP,66,0.000124,,,44680  >  6000 [ACK] Seq=1 Ack=1 Win=64256 Len=0 TSval=3408792199 TSecr=3634291656
57,21.834771,192.168.11.18,192.168.11.32,TCP,93,0.000135,,,"44680  >  6000 [PSH, ACK] Seq=1 Ack=1 Win=64256 Len=27 TSval=3408792199 TSecr=3634291656 [TCP segment of a reassembled PDU]"
58,21.834879,192.168.11.18,192.168.11.32,TCP,66,0.000108,,,"44680  >  6000 [FIN, ACK] Seq=28 Ack=1 Win=64256 Len=0 TSval=3408792199 TSecr=3634291656"
59,21.850023,192.168.11.32,192.168.11.18,TCP,66,0.015144,,,6000  >  44680 [ACK] Seq=1 Ack=28 Win=65152 Len=0 TSval=3634291671 TSecr=3408792199
60,21.850407,192.168.11.32,192.168.11.18,TCP,66,0.000384,,,"6000  >  44680 [FIN, ACK] Seq=1 Ack=29 Win=65152 Len=0 TSval=3634291672 TSecr=3408792199"
61,21.850474,192.168.11.18,192.168.11.32,TCP,66,0.000067,,,44680  >  6000 [ACK] Seq=29 Ack=2 Win=64256 Len=0 TSval=3408792215 TSecr=3634291672
62,21.881847,192.168.11.18,255.255.255.255,UDP,209,0.031373,Ÿ,7b2273656d616e74696373223a207b22656e74697479223a2022504944222c202262617365656e74697479223a2022616e79222c2022726f6c65223a2022777777222c20227370617469616c223a2022616e79222c202274656d706f72616c223a2022616e79227d2c20226461746170726f7065727479223a207b22666f726d6174223a2022696e616f6b615f70726f6772616d5f73616d706c655f73656d616e746963227d7d,33252  >  7000 Len=167
63,21.889846,192.168.11.33,192.168.11.18,TCP,74,0.007999,œ,,58236  >  6000 [SYN] Seq=0 Win=64240 Len=0 MSS=1460 SACK_PERM TSval=4175725629 TSecr=0 WS=128
64,21.889993,192.168.11.18,192.168.11.33,TCP,74,0.000147,,,"6000  >  58236 [SYN, ACK] Seq=0 Ack=1 Win=65160 Len=0 MSS=1460 SACK_PERM TSval=2869630811 TSecr=4175725629 WS=128"
65,21.896918,192.168.11.33,192.168.11.18,TCP,66,0.006925,,,58236  >  6000 [ACK] Seq=1 Ack=1 Win=64256 Len=0 TSval=4175725636 TSecr=2869630811
66,21.897546,192.168.11.33,192.168.11.18,TCP,93,0.000628,,,"58236  >  6000 [PSH, ACK] Seq=1 Ack=1 Win=64256 Len=27 TSval=4175725636 TSecr=2869630811 [TCP segment of a reassembled PDU]"
67,21.897632,192.168.11.18,192.168.11.33,TCP,66,0.000086,,,6000  >  58236 [ACK] Seq=1 Ack=28 Win=65152 Len=0 TSval=2869630819 TSecr=4175725636
68,21.897719,192.168.11.33,192.168.11.18,TCP,66,0.000087,,,"58236  >  6000 [FIN, ACK] Seq=28 Ack=1 Win=64256 Len=0 TSval=4175725636 TSecr=2869630811"
69,21.899717,192.168.11.18,192.168.11.33,TCP,66,0.001998,,,"6000  >  58236 [FIN, ACK] Seq=1 Ack=29 Win=65152 Len=0 TSval=2869630821 TSecr=4175725636"
70,21.904691,192.168.11.33,192.168.11.18,TCP,66,0.004974,,,58236  >  6000 [ACK] Seq=29 Ack=2 Win=64256 Len=0 TSval=4175725644 TSecr=2869630821
71,29.042963,192.168.11.18,192.168.11.32,TCP,74,7.138272,,,44686  >  6000 [SYN] Seq=0 Win=64240 Len=0 MSS=1460 SACK_PERM TSval=3408799407 TSecr=0 WS=128
72,29.052486,192.168.11.32,192.168.11.18,TCP,74,0.009523,,,"6000  >  44686 [SYN, ACK] Seq=0 Ack=1 Win=65160 Len=0 MSS=1460 SACK_PERM TSval=3634298874 TSecr=3408799407 WS=128"
73,29.052601,192.168.11.18,192.168.11.32,TCP,66,0.000115,,,44686  >  6000 [ACK] Seq=1 Ack=1 Win=64256 Len=0 TSval=3408799417 TSecr=3634298874
74,29.052817,192.168.11.18,192.168.11.32,TCP,93,0.000216,,,"44686  >  6000 [PSH, ACK] Seq=1 Ack=1 Win=64256 Len=27 TSval=3408799417 TSecr=3634298874 [TCP segment of a reassembled PDU]"
75,29.052926,192.168.11.18,192.168.11.32,TCP,66,0.000109,,,"44686  >  6000 [FIN, ACK] Seq=28 Ack=1 Win=64256 Len=0 TSval=3408799417 TSecr=3634298874"
76,29.060053,192.168.11.32,192.168.11.18,TCP,66,0.007127,,,6000  >  44686 [ACK] Seq=1 Ack=28 Win=65152 Len=0 TSval=3634298882 TSecr=3408799417
77,29.06052,192.168.11.32,192.168.11.18,TCP,66,0.000467,,,"6000  >  44686 [FIN, ACK] Seq=1 Ack=29 Win=65152 Len=0 TSval=3634298883 TSecr=3408799417"
78,29.060574,192.168.11.18,192.168.11.32,TCP,66,0.000054,,,44686  >  6000 [ACK] Seq=29 Ack=2 Win=64256 Len=0 TSval=3408799425 TSecr=3634298883
79,29.088808,192.168.11.18,255.255.255.255,UDP,209,0.028234,Ÿ,7b2273656d616e74696373223a207b22656e74697479223a2022504944222c202262617365656e74697479223a2022616e79222c2022726f6c65223a2022777777222c20227370617469616c223a2022616e79222c202274656d706f72616c223a2022616e79227d2c20226461746170726f7065727479223a207b22666f726d6174223a2022696e616f6b615f70726f6772616d5f73616d706c655f73656d616e746963227d7d,37502  >  7000 Len=167
80,29.096369,192.168.11.33,192.168.11.18,TCP,74,0.007561,œ,,51968  >  6000 [SYN] Seq=0 Win=64240 Len=0 MSS=1460 SACK_PERM TSval=4175732836 TSecr=0 WS=128
81,29.096515,192.168.11.18,192.168.11.33,TCP,74,0.000146,,,"6000  >  51968 [SYN, ACK] Seq=0 Ack=1 Win=65160 Len=0 MSS=1460 SACK_PERM TSval=2869638018 TSecr=4175732836 WS=128"
82,29.103398,192.168.11.33,192.168.11.18,TCP,66,0.006883,,,51968  >  6000 [ACK] Seq=1 Ack=1 Win=64256 Len=0 TSval=4175732842 TSecr=2869638018
83,29.103997,192.168.11.33,192.168.11.18,TCP,93,0.000599,,,"51968  >  6000 [PSH, ACK] Seq=1 Ack=1 Win=64256 Len=27 TSval=4175732843 TSecr=2869638018 [TCP segment of a reassembled PDU]"
84,29.104136,192.168.11.18,192.168.11.33,TCP,66,0.000139,,,6000  >  51968 [ACK] Seq=1 Ack=28 Win=65152 Len=0 TSval=2869638025 TSecr=4175732843
85,29.104273,192.168.11.33,192.168.11.18,TCP,66,0.000137,,,"51968  >  6000 [FIN, ACK] Seq=28 Ack=1 Win=64256 Len=0 TSval=4175732843 TSecr=2869638018"
86,29.105571,192.168.11.18,192.168.11.33,TCP,66,0.001298,,,"6000  >  51968 [FIN, ACK] Seq=1 Ack=29 Win=65152 Len=0 TSval=2869638027 TSecr=4175732843"
87,29.110879,192.168.11.33,192.168.11.18,TCP,66,0.005308,,,51968  >  6000 [ACK] Seq=29 Ack=2 Win=64256 Len=0 TSval=4175732850 TSecr=2869638027
88,36.212063,192.168.11.18,192.168.11.32,TCP,74,7.101184,,,39312  >  6000 [SYN] Seq=0 Win=64240 Len=0 MSS=1460 SACK_PERM TSval=3408806576 TSecr=0 WS=128
89,36.218732,192.168.11.32,192.168.11.18,TCP,74,0.006669,,,"6000  >  39312 [SYN, ACK] Seq=0 Ack=1 Win=65160 Len=0 MSS=1460 SACK_PERM TSval=3634306040 TSecr=3408806576 WS=128"
90,36.218847,192.168.11.18,192.168.11.32,TCP,66,0.000115,,,39312  >  6000 [ACK] Seq=1 Ack=1 Win=64256 Len=0 TSval=3408806583 TSecr=3634306040
91,36.218999,192.168.11.18,192.168.11.32,TCP,93,0.000152,,,"39312  >  6000 [PSH, ACK] Seq=1 Ack=1 Win=64256 Len=27 TSval=3408806583 TSecr=3634306040 [TCP segment of a reassembled PDU]"
92,36.219107,192.168.11.18,192.168.11.32,TCP,66,0.000108,,,"39312  >  6000 [FIN, ACK] Seq=28 Ack=1 Win=64256 Len=0 TSval=3408806584 TSecr=3634306040"
93,36.226247,192.168.11.32,192.168.11.18,TCP,66,0.00714,,,6000  >  39312 [ACK] Seq=1 Ack=28 Win=65152 Len=0 TSval=3634306048 TSecr=3408806583
94,36.226613,192.168.11.32,192.168.11.18,TCP,66,0.000366,,,"6000  >  39312 [FIN, ACK] Seq=1 Ack=29 Win=65152 Len=0 TSval=3634306049 TSecr=3408806584"
95,36.226667,192.168.11.18,192.168.11.32,TCP,66,0.000054,,,39312  >  6000 [ACK] Seq=29 Ack=2 Win=64256 Len=0 TSval=3408806591 TSecr=3634306049
96,36.258528,192.168.11.18,255.255.255.255,UDP,209,0.031861,Ÿ,7b2273656d616e74696373223a207b22656e74697479223a2022504944222c202262617365656e74697479223a2022616e79222c2022726f6c65223a2022777777222c20227370617469616c223a2022616e79222c202274656d706f72616c223a2022616e79227d2c20226461746170726f7065727479223a207b22666f726d6174223a2022696e616f6b615f70726f6772616d5f73616d706c655f73656d616e746963227d7d,51896  >  7000 Len=167
97,36.266118,192.168.11.33,192.168.11.18,TCP,74,0.00759,œ,,52052  >  6000 [SYN] Seq=0 Win=64240 Len=0 MSS=1460 SACK_PERM TSval=4175740005 TSecr=0 WS=128
98,36.266264,192.168.11.18,192.168.11.33,TCP,74,0.000146,,,"6000  >  52052 [SYN, ACK] Seq=0 Ack=1 Win=65160 Len=0 MSS=1460 SACK_PERM TSval=2869645188 TSecr=4175740005 WS=128"
99,36.273001,192.168.11.33,192.168.11.18,TCP,66,0.006737,,,52052  >  6000 [ACK] Seq=1 Ack=1 Win=64256 Len=0 TSval=4175740012 TSecr=2869645188
100,36.273519,192.168.11.33,192.168.11.18,TCP,93,0.000518,,,"52052  >  6000 [PSH, ACK] Seq=1 Ack=1 Win=64256 Len=27 TSval=4175740013 TSecr=2869645188 [TCP segment of a reassembled PDU]"
101,36.273597,192.168.11.18,192.168.11.33,TCP,66,0.000078,,,6000  >  52052 [ACK] Seq=1 Ack=28 Win=65152 Len=0 TSval=2869645195 TSecr=4175740013
102,36.27369,192.168.11.33,192.168.11.18,TCP,66,0.000093,,,"52052  >  6000 [FIN, ACK] Seq=28 Ack=1 Win=64256 Len=0 TSval=4175740013 TSecr=2869645188"
103,36.274752,192.168.11.18,192.168.11.33,TCP,66,0.001062,,,"6000  >  52052 [FIN, ACK] Seq=1 Ack=29 Win=65152 Len=0 TSval=2869645196 TSecr=4175740013"
104,36.280953,192.168.11.33,192.168.11.18,TCP,66,0.006201,,,52052  >  6000 [ACK] Seq=29 Ack=2 Win=64256 Len=0 TSval=4175740020 TSecr=2869645196
105,43.417701,192.168.11.18,192.168.11.32,TCP,74,7.136748,,,46846  >  6000 [SYN] Seq=0 Win=64240 Len=0 MSS=1460 SACK_PERM TSval=3408813782 TSecr=0 WS=128
106,43.424482,192.168.11.32,192.168.11.18,TCP,74,0.006781,,,"6000  >  46846 [SYN, ACK] Seq=0 Ack=1 Win=65160 Len=0 MSS=1460 SACK_PERM TSval=3634313246 TSecr=3408813782 WS=128"
107,43.424609,192.168.11.18,192.168.11.32,TCP,66,0.000127,,,46846  >  6000 [ACK] Seq=1 Ack=1 Win=64256 Len=0 TSval=3408813789 TSecr=3634313246
108,43.424797,192.168.11.18,192.168.11.32,TCP,93,0.000188,,,"46846  >  6000 [PSH, ACK] Seq=1 Ack=1 Win=64256 Len=27 TSval=3408813789 TSecr=3634313246 [TCP segment of a reassembled PDU]"
109,43.424892,192.168.11.18,192.168.11.32,TCP,66,0.000095,,,"46846  >  6000 [FIN, ACK] Seq=28 Ack=1 Win=64256 Len=0 TSval=3408813789 TSecr=3634313246"
110,43.432878,192.168.11.32,192.168.11.18,TCP,66,0.007986,,,6000  >  46846 [ACK] Seq=1 Ack=28 Win=65152 Len=0 TSval=3634313254 TSecr=3408813789
111,43.433253,192.168.11.32,192.168.11.18,TCP,66,0.000375,,,"6000  >  46846 [FIN, ACK] Seq=1 Ack=29 Win=65152 Len=0 TSval=3634313255 TSecr=3408813789"
112,43.433321,192.168.11.18,192.168.11.32,TCP,66,0.000068,,,46846  >  6000 [ACK] Seq=29 Ack=2 Win=64256 Len=0 TSval=3408813798 TSecr=3634313255
113,43.465958,192.168.11.18,255.255.255.255,UDP,209,0.032637,Ÿ,7b2273656d616e74696373223a207b22656e74697479223a2022504944222c202262617365656e74697479223a2022616e79222c2022726f6c65223a2022777777222c20227370617469616c223a2022616e79222c202274656d706f72616c223a2022616e79227d2c20226461746170726f7065727479223a207b22666f726d6174223a2022696e616f6b615f70726f6772616d5f73616d706c655f73656d616e746963227d7d,47822  >  7000 Len=167
114,43.474326,192.168.11.33,192.168.11.18,TCP,74,0.008368,œ,,52062  >  6000 [SYN] Seq=0 Win=64240 Len=0 MSS=1460 SACK_PERM TSval=4175747213 TSecr=0 WS=128
115,43.474486,192.168.11.18,192.168.11.33,TCP,74,0.00016,,,"6000  >  52062 [SYN, ACK] Seq=0 Ack=1 Win=65160 Len=0 MSS=1460 SACK_PERM TSval=2869652396 TSecr=4175747213 WS=128"
116,43.481172,192.168.11.33,192.168.11.18,TCP,66,0.006686,,,52062  >  6000 [ACK] Seq=1 Ack=1 Win=64256 Len=0 TSval=4175747221 TSecr=2869652396
117,43.481641,192.168.11.33,192.168.11.18,TCP,93,0.000469,,,"52062  >  6000 [PSH, ACK] Seq=1 Ack=1 Win=64256 Len=27 TSval=4175747221 TSecr=2869652396 [TCP segment of a reassembled PDU]"
118,43.481729,192.168.11.18,192.168.11.33,TCP,66,0.000088,,,6000  >  52062 [ACK] Seq=1 Ack=28 Win=65152 Len=0 TSval=2869652403 TSecr=4175747221
119,43.481814,192.168.11.33,192.168.11.18,TCP,66,0.000085,,,"52062  >  6000 [FIN, ACK] Seq=28 Ack=1 Win=64256 Len=0 TSval=4175747221 TSecr=2869652396"
120,43.482723,192.168.11.18,192.168.11.33,TCP,66,0.000909,,,"6000  >  52062 [FIN, ACK] Seq=1 Ack=29 Win=65152 Len=0 TSval=2869652404 TSecr=4175747221"
121,43.489149,192.168.11.33,192.168.11.18,TCP,66,0.006426,,,52062  >  6000 [ACK] Seq=29 Ack=2 Win=64256 Len=0 TSval=4175747228 TSecr=2869652404
122,50.617096,192.168.11.18,192.168.11.32,TCP,74,7.127947,,,51922  >  6000 [SYN] Seq=0 Win=64240 Len=0 MSS=1460 SACK_PERM TSval=3408820981 TSecr=0 WS=128
123,50.623753,192.168.11.32,192.168.11.18,TCP,74,0.006657,,,"6000  >  51922 [SYN, ACK] Seq=0 Ack=1 Win=65160 Len=0 MSS=1460 SACK_PERM TSval=3634320445 TSecr=3408820981 WS=128"
124,50.623862,192.168.11.18,192.168.11.32,TCP,66,0.000109,,,51922  >  6000 [ACK] Seq=1 Ack=1 Win=64256 Len=0 TSval=3408820988 TSecr=3634320445
125,50.624003,192.168.11.18,192.168.11.32,TCP,93,0.000141,,,"51922  >  6000 [PSH, ACK] Seq=1 Ack=1 Win=64256 Len=27 TSval=3408820988 TSecr=3634320445 [TCP segment of a reassembled PDU]"
126,50.624171,192.168.11.18,192.168.11.32,TCP,66,0.000168,,,"51922  >  6000 [FIN, ACK] Seq=28 Ack=1 Win=64256 Len=0 TSval=3408820989 TSecr=3634320445"
127,50.631448,192.168.11.32,192.168.11.18,TCP,66,0.007277,,,6000  >  51922 [ACK] Seq=1 Ack=28 Win=65152 Len=0 TSval=3634320453 TSecr=3408820988
128,50.631822,192.168.11.32,192.168.11.18,TCP,66,0.000374,,,"6000  >  51922 [FIN, ACK] Seq=1 Ack=29 Win=65152 Len=0 TSval=3634320454 TSecr=3408820989"
129,50.631869,192.168.11.18,192.168.11.32,TCP,66,0.000047,,,51922  >  6000 [ACK] Seq=29 Ack=2 Win=64256 Len=0 TSval=3408820996 TSecr=3634320454
130,50.662163,192.168.11.18,255.255.255.255,UDP,209,0.030294,Ÿ,7b2273656d616e74696373223a207b22656e74697479223a2022504944222c202262617365656e74697479223a2022616e79222c2022726f6c65223a2022777777222c20227370617469616c223a2022616e79222c202274656d706f72616c223a2022616e79227d2c20226461746170726f7065727479223a207b22666f726d6174223a2022696e616f6b615f70726f6772616d5f73616d706c655f73656d616e746963227d7d,33289  >  7000 Len=167
131,50.670262,192.168.11.33,192.168.11.18,TCP,74,0.008099,œ,,39578  >  6000 [SYN] Seq=0 Win=64240 Len=0 MSS=1460 SACK_PERM TSval=4175754410 TSecr=0 WS=128
132,50.670417,192.168.11.18,192.168.11.33,TCP,74,0.000155,,,"6000  >  39578 [SYN, ACK] Seq=0 Ack=1 Win=65160 Len=0 MSS=1460 SACK_PERM TSval=2869659592 TSecr=4175754410 WS=128"
133,50.677029,192.168.11.33,192.168.11.18,TCP,66,0.006612,,,39578  >  6000 [ACK] Seq=1 Ack=1 Win=64256 Len=0 TSval=4175754416 TSecr=2869659592
134,50.677599,192.168.11.33,192.168.11.18,TCP,93,0.00057,,,"39578  >  6000 [PSH, ACK] Seq=1 Ack=1 Win=64256 Len=27 TSval=4175754417 TSecr=2869659592 [TCP segment of a reassembled PDU]"
135,50.677682,192.168.11.18,192.168.11.33,TCP,66,0.000083,,,6000  >  39578 [ACK] Seq=1 Ack=28 Win=65152 Len=0 TSval=2869659599 TSecr=4175754417
136,50.677761,192.168.11.33,192.168.11.18,TCP,66,0.000079,,,"39578  >  6000 [FIN, ACK] Seq=28 Ack=1 Win=64256 Len=0 TSval=4175754417 TSecr=2869659592"
137,50.678807,192.168.11.18,192.168.11.33,TCP,66,0.001046,,,"6000  >  39578 [FIN, ACK] Seq=1 Ack=29 Win=65152 Len=0 TSval=2869659600 TSecr=4175754417"
138,50.689169,192.168.11.33,192.168.11.18,TCP,66,0.010362,,,39578  >  6000 [ACK] Seq=29 Ack=2 Win=64256 Len=0 TSval=4175754427 TSecr=2869659600
139,57.764598,192.168.11.18,192.168.11.32,TCP,74,7.075429,,,51932  >  6000 [SYN] Seq=0 Win=64240 Len=0 MSS=1460 SACK_PERM TSval=3408828129 TSecr=0 WS=128
140,57.771274,192.168.11.32,192.168.11.18,TCP,74,0.006676,,,"6000  >  51932 [SYN, ACK] Seq=0 Ack=1 Win=65160 Len=0 MSS=1460 SACK_PERM TSval=3634327593 TSecr=3408828129 WS=128"
141,57.771383,192.168.11.18,192.168.11.32,TCP,66,0.000109,,,51932  >  6000 [ACK] Seq=1 Ack=1 Win=64256 Len=0 TSval=3408828136 TSecr=3634327593
142,57.771554,192.168.11.18,192.168.11.32,TCP,93,0.000171,,,"51932  >  6000 [PSH, ACK] Seq=1 Ack=1 Win=64256 Len=27 TSval=3408828136 TSecr=3634327593 [TCP segment of a reassembled PDU]"
143,57.771662,192.168.11.18,192.168.11.32,TCP,66,0.000108,,,"51932  >  6000 [FIN, ACK] Seq=28 Ack=1 Win=64256 Len=0 TSval=3408828136 TSecr=3634327593"
144,57.778777,192.168.11.32,192.168.11.18,TCP,66,0.007115,,,6000  >  51932 [ACK] Seq=1 Ack=28 Win=65152 Len=0 TSval=3634327600 TSecr=3408828136
145,57.779145,192.168.11.32,192.168.11.18,TCP,66,0.000368,,,"6000  >  51932 [FIN, ACK] Seq=1 Ack=29 Win=65152 Len=0 TSval=3634327602 TSecr=3408828136"
146,57.779193,192.168.11.18,192.168.11.32,TCP,66,0.000048,,,51932  >  6000 [ACK] Seq=29 Ack=2 Win=64256 Len=0 TSval=3408828144 TSecr=3634327602
147,57.811462,192.168.11.18,255.255.255.255,UDP,209,0.032269,Ÿ,7b2273656d616e74696373223a207b22656e74697479223a2022504944222c202262617365656e74697479223a2022616e79222c2022726f6c65223a2022777777222c20227370617469616c223a2022616e79222c202274656d706f72616c223a2022616e79227d2c20226461746170726f7065727479223a207b22666f726d6174223a2022696e616f6b615f70726f6772616d5f73616d706c655f73656d616e746963227d7d,34102  >  7000 Len=167
148,57.820365,192.168.11.33,192.168.11.18,TCP,74,0.008903,œ,,34918  >  6000 [SYN] Seq=0 Win=64240 Len=0 MSS=1460 SACK_PERM TSval=4175761560 TSecr=0 WS=128
149,57.820536,192.168.11.18,192.168.11.33,TCP,74,0.000171,,,"6000  >  34918 [SYN, ACK] Seq=0 Ack=1 Win=65160 Len=0 MSS=1460 SACK_PERM TSval=2869666742 TSecr=4175761560 WS=128"
150,57.830478,192.168.11.33,192.168.11.18,TCP,66,0.009942,,,34918  >  6000 [ACK] Seq=1 Ack=1 Win=64256 Len=0 TSval=4175761570 TSecr=2869666742
151,57.831024,192.168.11.33,192.168.11.18,TCP,93,0.000546,,,"34918  >  6000 [PSH, ACK] Seq=1 Ack=1 Win=64256 Len=27 TSval=4175761570 TSecr=2869666742 [TCP segment of a reassembled PDU]"
152,57.831101,192.168.11.18,192.168.11.33,TCP,66,0.000077,,,6000  >  34918 [ACK] Seq=1 Ack=28 Win=65152 Len=0 TSval=2869666752 TSecr=4175761570
153,57.831169,192.168.11.33,192.168.11.18,TCP,66,0.000068,,,"34918  >  6000 [FIN, ACK] Seq=28 Ack=1 Win=64256 Len=0 TSval=4175761570 TSecr=2869666742"
154,57.832627,192.168.11.18,192.168.11.33,TCP,66,0.001458,,,"6000  >  34918 [FIN, ACK] Seq=1 Ack=29 Win=65152 Len=0 TSval=2869666754 TSecr=4175761570"
155,57.837604,192.168.11.33,192.168.11.18,TCP,66,0.004977,,,34918  >  6000 [ACK] Seq=29 Ack=2 Win=64256 Len=0 TSval=4175761577 TSecr=2869666754
156,64.90896,192.168.11.18,192.168.11.32,TCP,74,7.071356,,,59810  >  6000 [SYN] Seq=0 Win=64240 Len=0 MSS=1460 SACK_PERM TSval=3408835273 TSecr=0 WS=128
157,64.918931,192.168.11.32,192.168.11.18,TCP,74,0.009971,,,"6000  >  59810 [SYN, ACK] Seq=0 Ack=1 Win=65160 Len=0 MSS=1460 SACK_PERM TSval=3634334741 TSecr=3408835273 WS=128"
158,64.919035,192.168.11.18,192.168.11.32,TCP,66,0.000104,,,59810  >  6000 [ACK] Seq=1 Ack=1 Win=64256 Len=0 TSval=3408835283 TSecr=3634334741
159,64.919236,192.168.11.18,192.168.11.32,TCP,93,0.000201,,,"59810  >  6000 [PSH, ACK] Seq=1 Ack=1 Win=64256 Len=27 TSval=3408835284 TSecr=3634334741 [TCP segment of a reassembled PDU]"
160,64.919344,192.168.11.18,192.168.11.32,TCP,66,0.000108,,,"59810  >  6000 [FIN, ACK] Seq=28 Ack=1 Win=64256 Len=0 TSval=3408835284 TSecr=3634334741"
161,64.926382,192.168.11.32,192.168.11.18,TCP,66,0.007038,,,6000  >  59810 [ACK] Seq=1 Ack=28 Win=65152 Len=0 TSval=3634334748 TSecr=3408835284
162,64.926752,192.168.11.32,192.168.11.18,TCP,66,0.00037,,,"6000  >  59810 [FIN, ACK] Seq=1 Ack=29 Win=65152 Len=0 TSval=3634334749 TSecr=3408835284"
163,64.926796,192.168.11.18,192.168.11.32,TCP,66,0.000044,,,59810  >  6000 [ACK] Seq=29 Ack=2 Win=64256 Len=0 TSval=3408835291 TSecr=3634334749
164,64.953654,192.168.11.18,255.255.255.255,UDP,209,0.026858,Ÿ,7b2273656d616e74696373223a207b22656e74697479223a2022504944222c202262617365656e74697479223a2022616e79222c2022726f6c65223a2022777777222c20227370617469616c223a2022616e79222c202274656d706f72616c223a2022616e79227d2c20226461746170726f7065727479223a207b22666f726d6174223a2022696e616f6b615f70726f6772616d5f73616d706c655f73656d616e746963227d7d,49923  >  7000 Len=167
165,64.961115,192.168.11.33,192.168.11.18,TCP,74,0.007461,œ,,34924  >  6000 [SYN] Seq=0 Win=64240 Len=0 MSS=1460 SACK_PERM TSval=4175768701 TSecr=0 WS=128
166,64.961261,192.168.11.18,192.168.11.33,TCP,74,0.000146,,,"6000  >  34924 [SYN, ACK] Seq=0 Ack=1 Win=65160 Len=0 MSS=1460 SACK_PERM TSval=2869673883 TSecr=4175768701 WS=128"
167,64.967865,192.168.11.33,192.168.11.18,TCP,66,0.006604,,,34924  >  6000 [ACK] Seq=1 Ack=1 Win=64256 Len=0 TSval=4175768707 TSecr=2869673883
168,64.968413,192.168.11.33,192.168.11.18,TCP,93,0.000548,,,"34924  >  6000 [PSH, ACK] Seq=1 Ack=1 Win=64256 Len=27 TSval=4175768707 TSecr=2869673883 [TCP segment of a reassembled PDU]"
169,64.968485,192.168.11.18,192.168.11.33,TCP,66,0.000072,,,6000  >  34924 [ACK] Seq=1 Ack=28 Win=65152 Len=0 TSval=2869673890 TSecr=4175768707
170,64.96855,192.168.11.33,192.168.11.18,TCP,66,0.000065,,,"34924  >  6000 [FIN, ACK] Seq=28 Ack=1 Win=64256 Len=0 TSval=4175768708 TSecr=2869673883"
171,64.969665,192.168.11.18,192.168.11.33,TCP,66,0.001115,,,"6000  >  34924 [FIN, ACK] Seq=1 Ack=29 Win=65152 Len=0 TSval=2869673891 TSecr=4175768708"
172,64.975901,192.168.11.33,192.168.11.18,TCP,66,0.006236,,,34924  >  6000 [ACK] Seq=29 Ack=2 Win=64256 Len=0 TSval=4175768715 TSecr=2869673891
173,110.583316,192.168.11.18,192.168.11.32,TCP,74,45.607415,,,46310  >  6000 [SYN] Seq=0 Win=64240 Len=0 MSS=1460 SACK_PERM TSval=3408880948 TSecr=0 WS=128
174,110.591097,192.168.11.32,192.168.11.18,TCP,74,0.007781,,,"6000  >  46310 [SYN, ACK] Seq=0 Ack=1 Win=65160 Len=0 MSS=1460 SACK_PERM TSval=3634380413 TSecr=3408880948 WS=128"
175,110.591198,192.168.11.18,192.168.11.32,TCP,66,0.000101,,,46310  >  6000 [ACK] Seq=1 Ack=1 Win=64256 Len=0 TSval=3408880956 TSecr=3634380413
176,110.591359,192.168.11.18,192.168.11.32,TCP,93,0.000161,,,"46310  >  6000 [PSH, ACK] Seq=1 Ack=1 Win=64256 Len=27 TSval=3408880956 TSecr=3634380413 [TCP segment of a reassembled PDU]"
177,110.591463,192.168.11.18,192.168.11.32,TCP,66,0.000104,,,"46310  >  6000 [FIN, ACK] Seq=28 Ack=1 Win=64256 Len=0 TSval=3408880956 TSecr=3634380413"
178,110.59852,192.168.11.32,192.168.11.18,TCP,66,0.007057,,,6000  >  46310 [ACK] Seq=1 Ack=28 Win=65152 Len=0 TSval=3634380420 TSecr=3408880956
179,110.598886,192.168.11.32,192.168.11.18,TCP,66,0.000366,,,"6000  >  46310 [FIN, ACK] Seq=1 Ack=29 Win=65152 Len=0 TSval=3634380421 TSecr=3408880956"
180,110.598943,192.168.11.18,192.168.11.32,TCP,66,0.000057,,,46310  >  6000 [ACK] Seq=29 Ack=2 Win=64256 Len=0 TSval=3408880963 TSecr=3634380421
181,110.625929,192.168.11.18,255.255.255.255,UDP,209,0.026986,Ÿ,7b2273656d616e74696373223a207b22656e74697479223a2022504944222c202262617365656e74697479223a2022616e79222c2022726f6c65223a2022777777222c20227370617469616c223a2022616e79222c202274656d706f72616c223a2022616e79227d2c20226461746170726f7065727479223a207b22666f726d6174223a2022696e616f6b615f70726f6772616d5f73616d706c655f73656d616e746963227d7d,40714  >  7000 Len=167
182,110.633931,192.168.11.33,192.168.11.18,TCP,74,0.008002,œ,,35432  >  6000 [SYN] Seq=0 Win=64240 Len=0 MSS=1460 SACK_PERM TSval=4175814373 TSecr=0 WS=128
183,110.634078,192.168.11.18,192.168.11.33,TCP,74,0.000147,,,"6000  >  35432 [SYN, ACK] Seq=0 Ack=1 Win=65160 Len=0 MSS=1460 SACK_PERM TSval=2869719555 TSecr=4175814373 WS=128"
184,110.640814,192.168.11.33,192.168.11.18,TCP,66,0.006736,,,35432  >  6000 [ACK] Seq=1 Ack=1 Win=64256 Len=0 TSval=4175814380 TSecr=2869719555
185,110.641381,192.168.11.33,192.168.11.18,TCP,93,0.000567,,,"35432  >  6000 [PSH, ACK] Seq=1 Ack=1 Win=64256 Len=27 TSval=4175814380 TSecr=2869719555 [TCP segment of a reassembled PDU]"
186,110.641475,192.168.11.18,192.168.11.33,TCP,66,0.000094,,,6000  >  35432 [ACK] Seq=1 Ack=28 Win=65152 Len=0 TSval=2869719563 TSecr=4175814380
187,110.641557,192.168.11.33,192.168.11.18,TCP,66,0.000082,,,"35432  >  6000 [FIN, ACK] Seq=28 Ack=1 Win=64256 Len=0 TSval=4175814381 TSecr=2869719555"
188,110.642627,192.168.11.18,192.168.11.33,TCP,66,0.00107,,,"6000  >  35432 [FIN, ACK] Seq=1 Ack=29 Win=65152 Len=0 TSval=2869719564 TSecr=4175814381"
189,110.648616,192.168.11.33,192.168.11.18,TCP,66,0.005989,,,35432  >  6000 [ACK] Seq=29 Ack=2 Win=64256 Len=0 TSval=4175814388 TSecr=2869719564
190,117.743132,192.168.11.18,192.168.11.32,TCP,74,7.094516,,,46322  >  6000 [SYN] Seq=0 Win=64240 Len=0 MSS=1460 SACK_PERM TSval=3408888108 TSecr=0 WS=128
191,117.758132,192.168.11.32,192.168.11.18,TCP,74,0.015,,,"6000  >  46322 [SYN, ACK] Seq=0 Ack=1 Win=65160 Len=0 MSS=1460 SACK_PERM TSval=3634387572 TSecr=3408888108 WS=128"
192,117.75823,192.168.11.18,192.168.11.32,TCP,66,0.000098,,,46322  >  6000 [ACK] Seq=1 Ack=1 Win=64256 Len=0 TSval=3408888123 TSecr=3634387572
193,117.758433,192.168.11.18,192.168.11.32,TCP,93,0.000203,,,"46322  >  6000 [PSH, ACK] Seq=1 Ack=1 Win=64256 Len=27 TSval=3408888123 TSecr=3634387572 [TCP segment of a reassembled PDU]"
194,117.758525,192.168.11.18,192.168.11.32,TCP,66,0.000092,,,"46322  >  6000 [FIN, ACK] Seq=28 Ack=1 Win=64256 Len=0 TSval=3408888123 TSecr=3634387572"
195,117.765385,192.168.11.32,192.168.11.18,TCP,66,0.00686,,,6000  >  46322 [ACK] Seq=1 Ack=28 Win=65152 Len=0 TSval=3634387587 TSecr=3408888123
196,117.765739,192.168.11.32,192.168.11.18,TCP,66,0.000354,,,"6000  >  46322 [FIN, ACK] Seq=1 Ack=29 Win=65152 Len=0 TSval=3634387588 TSecr=3408888123"
197,117.765794,192.168.11.18,192.168.11.32,TCP,66,0.000055,,,46322  >  6000 [ACK] Seq=29 Ack=2 Win=64256 Len=0 TSval=3408888130 TSecr=3634387588
198,117.792611,192.168.11.18,255.255.255.255,UDP,209,0.026817,Ÿ,7b2273656d616e74696373223a207b22656e74697479223a2022504944222c202262617365656e74697479223a2022616e79222c2022726f6c65223a2022777777222c20227370617469616c223a2022616e79222c202274656d706f72616c223a2022616e79227d2c20226461746170726f7065727479223a207b22666f726d6174223a2022696e616f6b615f70726f6772616d5f73616d706c655f73656d616e746963227d7d,57933  >  7000 Len=167
199,117.800106,192.168.11.33,192.168.11.18,TCP,74,0.007495,œ,,33584  >  6000 [SYN] Seq=0 Win=64240 Len=0 MSS=1460 SACK_PERM TSval=4175821540 TSecr=0 WS=128
200,117.800239,192.168.11.18,192.168.11.33,TCP,74,0.000133,,,"6000  >  33584 [SYN, ACK] Seq=0 Ack=1 Win=65160 Len=0 MSS=1460 SACK_PERM TSval=2869726722 TSecr=4175821540 WS=128"
201,117.806977,192.168.11.33,192.168.11.18,TCP,66,0.006738,,,33584  >  6000 [ACK] Seq=1 Ack=1 Win=64256 Len=0 TSval=4175821546 TSecr=2869726722
202,117.807614,192.168.11.33,192.168.11.18,TCP,93,0.000637,,,"33584  >  6000 [PSH, ACK] Seq=1 Ack=1 Win=64256 Len=27 TSval=4175821547 TSecr=2869726722 [TCP segment of a reassembled PDU]"
203,117.807723,192.168.11.18,192.168.11.33,TCP,66,0.000109,,,6000  >  33584 [ACK] Seq=1 Ack=28 Win=65152 Len=0 TSval=2869726729 TSecr=4175821547
204,117.807809,192.168.11.33,192.168.11.18,TCP,66,0.000086,,,"33584  >  6000 [FIN, ACK] Seq=28 Ack=1 Win=64256 Len=0 TSval=4175821547 TSecr=2869726722"
205,117.808981,192.168.11.18,192.168.11.33,TCP,66,0.001172,,,"6000  >  33584 [FIN, ACK] Seq=1 Ack=29 Win=65152 Len=0 TSval=2869726730 TSecr=4175821547"
206,117.8151,192.168.11.33,192.168.11.18,TCP,66,0.006119,,,33584  >  6000 [ACK] Seq=29 Ack=2 Win=64256 Len=0 TSval=4175821554 TSecr=2869726730
207,124.987818,192.168.11.18,192.168.11.32,TCP,74,7.172718,,,35098  >  6000 [SYN] Seq=0 Win=64240 Len=0 MSS=1460 SACK_PERM TSval=3408895352 TSecr=0 WS=128
208,124.994621,192.168.11.32,192.168.11.18,TCP,74,0.006803,,,"6000  >  35098 [SYN, ACK] Seq=0 Ack=1 Win=65160 Len=0 MSS=1460 SACK_PERM TSval=3634394816 TSecr=3408895352 WS=128"
209,124.994717,192.168.11.18,192.168.11.32,TCP,66,0.000096,,,35098  >  6000 [ACK] Seq=1 Ack=1 Win=64256 Len=0 TSval=3408895359 TSecr=3634394816
210,124.994884,192.168.11.18,192.168.11.32,TCP,93,0.000167,,,"35098  >  6000 [PSH, ACK] Seq=1 Ack=1 Win=64256 Len=27 TSval=3408895359 TSecr=3634394816 [TCP segment of a reassembled PDU]"
211,124.994971,192.168.11.18,192.168.11.32,TCP,66,0.000087,,,"35098  >  6000 [FIN, ACK] Seq=28 Ack=1 Win=64256 Len=0 TSval=3408895359 TSecr=3634394816"
212,125.001737,192.168.11.32,192.168.11.18,TCP,66,0.006766,,,6000  >  35098 [ACK] Seq=1 Ack=28 Win=65152 Len=0 TSval=3634394824 TSecr=3408895359
213,125.002107,192.168.11.32,192.168.11.18,TCP,66,0.00037,,,"6000  >  35098 [FIN, ACK] Seq=1 Ack=29 Win=65152 Len=0 TSval=3634394825 TSecr=3408895359"
214,125.002151,192.168.11.18,192.168.11.32,TCP,66,0.000044,,,35098  >  6000 [ACK] Seq=29 Ack=2 Win=64256 Len=0 TSval=3408895367 TSecr=3634394825
215,125.031245,192.168.11.18,255.255.255.255,UDP,209,0.029094,Ÿ,7b2273656d616e74696373223a207b22656e74697479223a2022504944222c202262617365656e74697479223a2022616e79222c2022726f6c65223a2022777777222c20227370617469616c223a2022616e79222c202274656d706f72616c223a2022616e79227d2c20226461746170726f7065727479223a207b22666f726d6174223a2022696e616f6b615f70726f6772616d5f73616d706c655f73656d616e746963227d7d,59768  >  7000 Len=167
216,125.039622,192.168.11.33,192.168.11.18,TCP,74,0.008377,œ,,33590  >  6000 [SYN] Seq=0 Win=64240 Len=0 MSS=1460 SACK_PERM TSval=4175828779 TSecr=0 WS=128
217,125.039771,192.168.11.18,192.168.11.33,TCP,74,0.000149,,,"6000  >  33590 [SYN, ACK] Seq=0 Ack=1 Win=65160 Len=0 MSS=1460 SACK_PERM TSval=2869733961 TSecr=4175828779 WS=128"
218,125.05372,192.168.11.33,192.168.11.18,TCP,66,0.013949,,,33590  >  6000 [ACK] Seq=1 Ack=1 Win=64256 Len=0 TSval=4175828786 TSecr=2869733961
219,125.05416,192.168.11.33,192.168.11.18,TCP,93,0.00044,,,"33590  >  6000 [PSH, ACK] Seq=1 Ack=1 Win=64256 Len=27 TSval=4175828786 TSecr=2869733961 [TCP segment of a reassembled PDU]"
220,125.054222,192.168.11.18,192.168.11.33,TCP,66,0.000062,,,6000  >  33590 [ACK] Seq=1 Ack=28 Win=65152 Len=0 TSval=2869733976 TSecr=4175828786
221,125.05428,192.168.11.33,192.168.11.18,TCP,66,0.000058,,,"33590  >  6000 [FIN, ACK] Seq=28 Ack=1 Win=64256 Len=0 TSval=4175828786 TSecr=2869733961"
222,125.055138,192.168.11.18,192.168.11.33,TCP,66,0.000858,,,"6000  >  33590 [FIN, ACK] Seq=1 Ack=29 Win=65152 Len=0 TSval=2869733977 TSecr=4175828786"
223,125.061331,192.168.11.33,192.168.11.18,TCP,66,0.006193,,,33590  >  6000 [ACK] Seq=29 Ack=2 Win=64256 Len=0 TSval=4175828801 TSecr=2869733977
224,132.151662,192.168.11.18,192.168.11.32,TCP,74,7.090331,,,40842  >  6000 [SYN] Seq=0 Win=64240 Len=0 MSS=1460 SACK_PERM TSval=3408902516 TSecr=0 WS=128
225,132.158773,192.168.11.32,192.168.11.18,TCP,74,0.007111,,,"6000  >  40842 [SYN, ACK] Seq=0 Ack=1 Win=65160 Len=0 MSS=1460 SACK_PERM TSval=3634401981 TSecr=3408902516 WS=128"
226,132.15887,192.168.11.18,192.168.11.32,TCP,66,0.000097,,,40842  >  6000 [ACK] Seq=1 Ack=1 Win=64256 Len=0 TSval=3408902523 TSecr=3634401981
227,132.159034,192.168.11.18,192.168.11.32,TCP,93,0.000164,,,"40842  >  6000 [PSH, ACK] Seq=1 Ack=1 Win=64256 Len=27 TSval=3408902523 TSecr=3634401981 [TCP segment of a reassembled PDU]"
228,132.159152,192.168.11.18,192.168.11.32,TCP,66,0.000118,,,"40842  >  6000 [FIN, ACK] Seq=28 Ack=1 Win=64256 Len=0 TSval=3408902524 TSecr=3634401981"
229,132.17268,192.168.11.32,192.168.11.18,TCP,66,0.013528,,,6000  >  40842 [ACK] Seq=1 Ack=28 Win=65152 Len=0 TSval=3634401990 TSecr=3408902523
230,132.172751,192.168.11.32,192.168.11.18,TCP,66,0.000071,,,"6000  >  40842 [FIN, ACK] Seq=1 Ack=29 Win=65152 Len=0 TSval=3634401992 TSecr=3408902524"
231,132.172805,192.168.11.18,192.168.11.32,TCP,66,0.000054,,,40842  >  6000 [ACK] Seq=29 Ack=2 Win=64256 Len=0 TSval=3408902537 TSecr=3634401992
