No.,Time,Source,Destination,Protocol,Length,Time delta from previous captured frame,XXX,Data,Info
1,0,192.168.11.34,192.168.11.35,TCP,74,0,,,47762  >  6000 [SYN] Seq=0 Win=64240 Len=0 MSS=1460 SACK_PERM TSval=578048460 TSecr=0 WS=128
2,0.006372,192.168.11.35,192.168.11.34,TCP,74,0.006372,,,"6000  >  47762 [SYN, ACK] Seq=0 Ack=1 Win=65160 Len=0 MSS=1460 SACK_PERM TSval=967592294 TSecr=578048460 WS=128"
3,0.006479,192.168.11.34,192.168.11.35,TCP,66,0.000107,,,47762  >  6000 [ACK] Seq=1 Ack=1 Win=64256 Len=0 TSval=578048470 TSecr=967592294
4,0.006664,192.168.11.34,192.168.11.35,TCP,93,0.000185,,,"47762  >  6000 [PSH, ACK] Seq=1 Ack=1 Win=64256 Len=27 TSval=578048470 TSecr=967592294 [TCP segment of a reassembled PDU]"
5,0.0068,192.168.11.34,192.168.11.35,TCP,66,0.000136,,,"47762  >  6000 [FIN, ACK] Seq=28 Ack=1 Win=64256 Len=0 TSval=578048470 TSecr=967592294"
6,0.015323,192.168.11.35,192.168.11.34,TCP,66,0.008523,,,6000  >  47762 [ACK] Seq=1 Ack=28 Win=65152 Len=0 TSval=967592302 TSecr=578048470
7,0.01567,192.168.11.35,192.168.11.34,TCP,66,0.000347,,,"6000  >  47762 [FIN, ACK] Seq=1 Ack=29 Win=65152 Len=0 TSval=967592304 TSecr=578048470"
8,0.015734,192.168.11.34,192.168.11.35,TCP,66,0.000064,,,47762  >  6000 [ACK] Seq=29 Ack=2 Win=64256 Len=0 TSval=578048479 TSecr=967592304
9,0.046103,192.168.11.34,255.255.255.255,UDP,209,0.030369,Ÿ,7b2273656d616e74696373223a207b22656e74697479223a2022504944222c202262617365656e74697479223a2022616e79222c2022726f6c65223a2022313131222c20227370617469616c223a2022616e79222c202274656d706f72616c223a2022616e79227d2c20226461746170726f7065727479223a207b22666f726d6174223a2022696e616f6b615f70726f6772616d5f73616d706c655f73656d616e746963227d7d,47785  >  7000 Len=167
10,0.05896,192.168.11.6,192.168.11.34,TCP,74,0.012857,œ,,34022  >  6000 [SYN] Seq=0 Win=64240 Len=0 MSS=1460 SACK_PERM TSval=1346009635 TSecr=0 WS=128
11,0.059167,192.168.11.34,192.168.11.6,TCP,74,0.000207,,,"6000  >  34022 [SYN, ACK] Seq=0 Ack=1 Win=65160 Len=0 MSS=1460 SACK_PERM TSval=3961091929 TSecr=1346009635 WS=128"
12,0.066545,192.168.11.6,192.168.11.34,TCP,66,0.007378,,,34022  >  6000 [ACK] Seq=1 Ack=1 Win=64256 Len=0 TSval=1346009648 TSecr=3961091929
13,0.067514,192.168.11.6,192.168.11.34,TCP,93,0.000969,,,"34022  >  6000 [PSH, ACK] Seq=1 Ack=1 Win=64256 Len=27 TSval=1346009648 TSecr=3961091929 [TCP segment of a reassembled PDU]"
14,0.067754,192.168.11.34,192.168.11.6,TCP,66,0.00024,,,6000  >  34022 [ACK] Seq=1 Ack=28 Win=65152 Len=0 TSval=3961091938 TSecr=1346009648
15,0.06784,192.168.11.6,192.168.11.34,TCP,66,0.000086,,,"34022  >  6000 [FIN, ACK] Seq=28 Ack=1 Win=64256 Len=0 TSval=1346009648 TSecr=3961091929"
16,0.069903,192.168.11.34,192.168.11.6,TCP,66,0.002063,,,"6000  >  34022 [FIN, ACK] Seq=1 Ack=29 Win=65152 Len=0 TSval=3961091940 TSecr=1346009648"
17,0.077312,192.168.11.6,192.168.11.34,TCP,66,0.007409,,,34022  >  6000 [ACK] Seq=29 Ack=2 Win=64256 Len=0 TSval=1346009656 TSecr=3961091940
18,7.285856,192.168.11.34,192.168.11.35,TCP,74,7.208544,,,57474  >  6000 [SYN] Seq=0 Win=64240 Len=0 MSS=1460 SACK_PERM TSval=578055749 TSecr=0 WS=128
19,7.292572,192.168.11.35,192.168.11.34,TCP,74,0.006716,,,"6000  >  57474 [SYN, ACK] Seq=0 Ack=1 Win=65160 Len=0 MSS=1460 SACK_PERM TSval=967599580 TSecr=578055749 WS=128"
20,7.292674,192.168.11.34,192.168.11.35,TCP,66,0.000102,,,57474  >  6000 [ACK] Seq=1 Ack=1 Win=64256 Len=0 TSval=578055756 TSecr=967599580
21,7.292813,192.168.11.34,192.168.11.35,TCP,93,0.000139,,,"57474  >  6000 [PSH, ACK] Seq=1 Ack=1 Win=64256 Len=27 TSval=578055756 TSecr=967599580 [TCP segment of a reassembled PDU]"
22,7.292954,192.168.11.34,192.168.11.35,TCP,66,0.000141,,,"57474  >  6000 [FIN, ACK] Seq=28 Ack=1 Win=64256 Len=0 TSval=578055756 TSecr=967599580"
23,7.30003,192.168.11.35,192.168.11.34,TCP,66,0.007076,,,6000  >  57474 [ACK] Seq=1 Ack=28 Win=65152 Len=0 TSval=967599587 TSecr=578055756
24,7.300423,192.168.11.35,192.168.11.34,TCP,66,0.000393,,,"6000  >  57474 [FIN, ACK] Seq=1 Ack=29 Win=65152 Len=0 TSval=967599588 TSecr=578055756"
25,7.300468,192.168.11.34,192.168.11.35,TCP,66,0.000045,,,57474  >  6000 [ACK] Seq=29 Ack=2 Win=64256 Len=0 TSval=578055764 TSecr=967599588
26,7.329499,192.168.11.34,255.255.255.255,UDP,209,0.029031,Ÿ,7b2273656d616e74696373223a207b22656e74697479223a2022504944222c202262617365656e74697479223a2022616e79222c2022726f6c65223a2022313131222c20227370617469616c223a2022616e79222c202274656d706f72616c223a2022616e79227d2c20226461746170726f7065727479223a207b22666f726d6174223a2022696e616f6b615f70726f6772616d5f73616d706c655f73656d616e746963227d7d,54141  >  7000 Len=167
27,7.337815,192.168.11.6,192.168.11.34,TCP,74,0.008316,œ,,34036  >  6000 [SYN] Seq=0 Win=64240 Len=0 MSS=1460 SACK_PERM TSval=1346016918 TSecr=0 WS=128
28,7.337958,192.168.11.34,192.168.11.6,TCP,74,0.000143,,,"6000  >  34036 [SYN, ACK] Seq=0 Ack=1 Win=65160 Len=0 MSS=1460 SACK_PERM TSval=3961099208 TSecr=1346016918 WS=128"
29,7.353255,192.168.11.6,192.168.11.34,TCP,66,0.015297,,,34036  >  6000 [ACK] Seq=1 Ack=1 Win=64256 Len=0 TSval=1346016925 TSecr=3961099208
30,7.353807,192.168.11.6,192.168.11.34,TCP,93,0.000552,,,"34036  >  6000 [PSH, ACK] Seq=1 Ack=1 Win=64256 Len=27 TSval=1346016925 TSecr=3961099208 [TCP segment of a reassembled PDU]"
31,7.353877,192.168.11.34,192.168.11.6,TCP,66,0.00007,,,6000  >  34036 [ACK] Seq=1 Ack=28 Win=65152 Len=0 TSval=3961099224 TSecr=1346016925
32,7.353944,192.168.11.6,192.168.11.34,TCP,66,0.000067,,,"34036  >  6000 [FIN, ACK] Seq=28 Ack=1 Win=64256 Len=0 TSval=1346016926 TSecr=3961099208"
33,7.354938,192.168.11.34,192.168.11.6,TCP,66,0.000994,,,"6000  >  34036 [FIN, ACK] Seq=1 Ack=29 Win=65152 Len=0 TSval=3961099225 TSecr=1346016926"
34,7.361076,192.168.11.6,192.168.11.34,TCP,66,0.006138,,,34036  >  6000 [ACK] Seq=29 Ack=2 Win=64256 Len=0 TSval=1346016942 TSecr=3961099225
35,14.628097,192.168.11.34,192.168.11.35,TCP,74,7.267021,,,57476  >  6000 [SYN] Seq=0 Win=64240 Len=0 MSS=1460 SACK_PERM TSval=578063091 TSecr=0 WS=128
36,14.634922,192.168.11.35,192.168.11.34,TCP,74,0.006825,,,"6000  >  57476 [SYN, ACK] Seq=0 Ack=1 Win=65160 Len=0 MSS=1460 SACK_PERM TSval=967606922 TSecr=578063091 WS=128"
37,14.635023,192.168.11.34,192.168.11.35,TCP,66,0.000101,,,57476  >  6000 [ACK] Seq=1 Ack=1 Win=64256 Len=0 TSval=578063098 TSecr=967606922
38,14.63519,192.168.11.34,192.168.11.35,TCP,93,0.000167,,,"57476  >  6000 [PSH, ACK] Seq=1 Ack=1 Win=64256 Len=27 TSval=578063098 TSecr=967606922 [TCP segment of a reassembled PDU]"
39,14.635297,192.168.11.34,192.168.11.35,TCP,66,0.000107,,,"57476  >  6000 [FIN, ACK] Seq=28 Ack=1 Win=64256 Len=0 TSval=578063099 TSecr=967606922"
40,14.642476,192.168.11.35,192.168.11.34,TCP,66,0.007179,,,6000  >  57476 [ACK] Seq=1 Ack=28 Win=65152 Len=0 TSval=967606929 TSecr=578063098
41,14.642852,192.168.11.35,192.168.11.34,TCP,66,0.000376,,,"6000  >  57476 [FIN, ACK] Seq=1 Ack=29 Win=65152 Len=0 TSval=967606930 TSecr=578063099"
42,14.6429,192.168.11.34,192.168.11.35,TCP,66,0.000048,,,57476  >  6000 [ACK] Seq=29 Ack=2 Win=64256 Len=0 TSval=578063106 TSecr=967606930
43,14.671616,192.168.11.34,255.255.255.255,UDP,209,0.028716,Ÿ,7b2273656d616e74696373223a207b22656e74697479223a2022504944222c202262617365656e74697479223a2022616e79222c2022726f6c65223a2022313131222c20227370617469616c223a2022616e79222c202274656d706f72616c223a2022616e79227d2c20226461746170726f7065727479223a207b22666f726d6174223a2022696e616f6b615f70726f6772616d5f73616d706c655f73656d616e746963227d7d,57768  >  7000 Len=167
44,14.679534,192.168.11.6,192.168.11.34,TCP,74,0.007918,œ,,52440  >  6000 [SYN] Seq=0 Win=64240 Len=0 MSS=1460 SACK_PERM TSval=1346024260 TSecr=0 WS=128
45,14.679691,192.168.11.34,192.168.11.6,TCP,74,0.000157,,,"6000  >  52440 [SYN, ACK] Seq=0 Ack=1 Win=65160 Len=0 MSS=1460 SACK_PERM TSval=3961106550 TSecr=1346024260 WS=128"
46,14.688002,192.168.11.6,192.168.11.34,TCP,66,0.008311,,,52440  >  6000 [ACK] Seq=1 Ack=1 Win=64256 Len=0 TSval=1346024268 TSecr=3961106550
47,14.688652,192.168.11.6,192.168.11.34,TCP,93,0.00065,,,"52440  >  6000 [PSH, ACK] Seq=1 Ack=1 Win=64256 Len=27 TSval=1346024268 TSecr=3961106550 [TCP segment of a reassembled PDU]"
48,14.688759,192.168.11.34,192.168.11.6,TCP,66,0.000107,,,6000  >  52440 [ACK] Seq=1 Ack=28 Win=65152 Len=0 TSval=3961106559 TSecr=1346024268
49,14.688844,192.168.11.6,192.168.11.34,TCP,66,0.000085,,,"52440  >  6000 [FIN, ACK] Seq=28 Ack=1 Win=64256 Len=0 TSval=1346024268 TSecr=3961106550"
50,14.690414,192.168.11.34,192.168.11.6,TCP,66,0.00157,,,"6000  >  52440 [FIN, ACK] Seq=1 Ack=29 Win=65152 Len=0 TSval=3961106561 TSecr=1346024268"
51,14.69645,192.168.11.6,192.168.11.34,TCP,66,0.006036,,,52440  >  6000 [ACK] Seq=29 Ack=2 Win=64256 Len=0 TSval=1346024276 TSecr=3961106561
52,21.824,192.168.11.34,192.168.11.35,TCP,74,7.12755,,,49874  >  6000 [SYN] Seq=0 Win=64240 Len=0 MSS=1460 SACK_PERM TSval=578070287 TSecr=0 WS=128
53,21.832326,192.168.11.35,192.168.11.34,TCP,74,0.008326,,,"6000  >  49874 [SYN, ACK] Seq=0 Ack=1 Win=65160 Len=0 MSS=1460 SACK_PERM TSval=967614117 TSecr=578070287 WS=128"
54,21.832443,192.168.11.34,192.168.11.35,TCP,66,0.000117,,,49874  >  6000 [ACK] Seq=1 Ack=1 Win=64256 Len=0 TSval=578070296 TSecr=967614117
55,21.832618,192.168.11.34,192.168.11.35,TCP,93,0.000175,,,"49874  >  6000 [PSH, ACK] Seq=1 Ack=1 Win=64256 Len=27 TSval=578070296 TSecr=967614117 [TCP segment of a reassembled PDU]"
56,21.832742,192.168.11.34,192.168.11.35,TCP,66,0.000124,,,"49874  >  6000 [FIN, ACK] Seq=28 Ack=1 Win=64256 Len=0 TSval=578070296 TSecr=967614117"
57,21.844515,192.168.11.35,192.168.11.34,TCP,66,0.011773,,,6000  >  49874 [ACK] Seq=1 Ack=28 Win=65152 Len=0 TSval=967614131 TSecr=578070296
58,21.844905,192.168.11.35,192.168.11.34,TCP,66,0.00039,,,"6000  >  49874 [FIN, ACK] Seq=1 Ack=29 Win=65152 Len=0 TSval=967614132 TSecr=578070296"
59,21.844953,192.168.11.34,192.168.11.35,TCP,66,0.000048,,,49874  >  6000 [ACK] Seq=29 Ack=2 Win=64256 Len=0 TSval=578070308 TSecr=967614132
60,21.87488,192.168.11.34,255.255.255.255,UDP,209,0.029927,Ÿ,7b2273656d616e74696373223a207b22656e74697479223a2022504944222c202262617365656e74697479223a2022616e79222c2022726f6c65223a2022313131222c20227370617469616c223a2022616e79222c202274656d706f72616c223a2022616e79227d2c20226461746170726f7065727479223a207b22666f726d6174223a2022696e616f6b615f70726f6772616d5f73616d706c655f73656d616e746963227d7d,54114  >  7000 Len=167
61,21.882536,192.168.11.6,192.168.11.34,TCP,74,0.007656,œ,,51912  >  6000 [SYN] Seq=0 Win=64240 Len=0 MSS=1460 SACK_PERM TSval=1346031462 TSecr=0 WS=128
62,21.882677,192.168.11.34,192.168.11.6,TCP,74,0.000141,,,"6000  >  51912 [SYN, ACK] Seq=0 Ack=1 Win=65160 Len=0 MSS=1460 SACK_PERM TSval=3961113753 TSecr=1346031462 WS=128"
63,21.889858,192.168.11.6,192.168.11.34,TCP,66,0.007181,,,51912  >  6000 [ACK] Seq=1 Ack=1 Win=64256 Len=0 TSval=1346031469 TSecr=3961113753
64,21.890327,192.168.11.6,192.168.11.34,TCP,93,0.000469,,,"51912  >  6000 [PSH, ACK] Seq=1 Ack=1 Win=64256 Len=27 TSval=1346031470 TSecr=3961113753 [TCP segment of a reassembled PDU]"
65,21.890438,192.168.11.34,192.168.11.6,TCP,66,0.000111,,,6000  >  51912 [ACK] Seq=1 Ack=28 Win=65152 Len=0 TSval=3961113761 TSecr=1346031470
66,21.890759,192.168.11.6,192.168.11.34,TCP,66,0.000321,,,"51912  >  6000 [FIN, ACK] Seq=28 Ack=1 Win=64256 Len=0 TSval=1346031470 TSecr=3961113753"
67,21.892115,192.168.11.34,192.168.11.6,TCP,66,0.001356,,,"6000  >  51912 [FIN, ACK] Seq=1 Ack=29 Win=65152 Len=0 TSval=3961113762 TSecr=1346031470"
68,21.900762,192.168.11.6,192.168.11.34,TCP,66,0.008647,,,51912  >  6000 [ACK] Seq=29 Ack=2 Win=64256 Len=0 TSval=1346031481 TSecr=3961113762
69,29.029258,192.168.11.34,192.168.11.35,TCP,74,7.128496,,,58634  >  6000 [SYN] Seq=0 Win=64240 Len=0 MSS=1460 SACK_PERM TSval=578077492 TSecr=0 WS=128
70,29.037396,192.168.11.35,192.168.11.34,TCP,74,0.008138,,,"6000  >  58634 [SYN, ACK] Seq=0 Ack=1 Win=65160 Len=0 MSS=1460 SACK_PERM TSval=967621322 TSecr=578077492 WS=128"
71,29.037506,192.168.11.34,192.168.11.35,TCP,66,0.00011,,,58634  >  6000 [ACK] Seq=1 Ack=1 Win=64256 Len=0 TSval=578077501 TSecr=967621322
72,29.037902,192.168.11.34,192.168.11.35,TCP,93,0.000396,,,"58634  >  6000 [PSH, ACK] Seq=1 Ack=1 Win=64256 Len=27 TSval=578077501 TSecr=967621322 [TCP segment of a reassembled PDU]"
73,29.038169,192.168.11.34,192.168.11.35,TCP,66,0.000267,,,"58634  >  6000 [FIN, ACK] Seq=28 Ack=1 Win=64256 Len=0 TSval=578077501 TSecr=967621322"
74,29.046318,192.168.11.35,192.168.11.34,TCP,66,0.008149,,,6000  >  58634 [ACK] Seq=1 Ack=28 Win=65152 Len=0 TSval=967621331 TSecr=578077501
75,29.046547,192.168.11.35,192.168.11.34,TCP,66,0.000229,,,"6000  >  58634 [FIN, ACK] Seq=1 Ack=29 Win=65152 Len=0 TSval=967621333 TSecr=578077501"
76,29.046591,192.168.11.34,192.168.11.35,TCP,66,0.000044,,,58634  >  6000 [ACK] Seq=29 Ack=2 Win=64256 Len=0 TSval=578077510 TSecr=967621333
77,29.075279,192.168.11.34,255.255.255.255,UDP,209,0.028688,Ÿ,7b2273656d616e74696373223a207b22656e74697479223a2022504944222c202262617365656e74697479223a2022616e79222c2022726f6c65223a2022313131222c20227370617469616c223a2022616e79222c202274656d706f72616c223a2022616e79227d2c20226461746170726f7065727479223a207b22666f726d6174223a2022696e616f6b615f70726f6772616d5f73616d706c655f73656d616e746963227d7d,35579  >  7000 Len=167
78,29.082647,192.168.11.6,192.168.11.34,TCP,74,0.007368,œ,,43660  >  6000 [SYN] Seq=0 Win=64240 Len=0 MSS=1460 SACK_PERM TSval=1346038662 TSecr=0 WS=128
79,29.082764,192.168.11.34,192.168.11.6,TCP,74,0.000117,,,"6000  >  43660 [SYN, ACK] Seq=0 Ack=1 Win=65160 Len=0 MSS=1460 SACK_PERM TSval=3961120953 TSecr=1346038662 WS=128"
80,29.089546,192.168.11.6,192.168.11.34,TCP,66,0.006782,,,43660  >  6000 [ACK] Seq=1 Ack=1 Win=64256 Len=0 TSval=1346038669 TSecr=3961120953
81,29.090173,192.168.11.6,192.168.11.34,TCP,93,0.000627,,,"43660  >  6000 [PSH, ACK] Seq=1 Ack=1 Win=64256 Len=27 TSval=1346038669 TSecr=3961120953 [TCP segment of a reassembled PDU]"
82,29.090275,192.168.11.34,192.168.11.6,TCP,66,0.000102,,,6000  >  43660 [ACK] Seq=1 Ack=28 Win=65152 Len=0 TSval=3961120961 TSecr=1346038669
83,29.090346,192.168.11.6,192.168.11.34,TCP,66,0.000071,,,"43660  >  6000 [FIN, ACK] Seq=28 Ack=1 Win=64256 Len=0 TSval=1346038669 TSecr=3961120953"
84,29.092216,192.168.11.34,192.168.11.6,TCP,66,0.00187,,,"6000  >  43660 [FIN, ACK] Seq=1 Ack=29 Win=65152 Len=0 TSval=3961120962 TSecr=1346038669"
85,29.097066,192.168.11.6,192.168.11.34,TCP,66,0.00485,,,43660  >  6000 [ACK] Seq=29 Ack=2 Win=64256 Len=0 TSval=1346038677 TSecr=3961120962
86,36.200294,192.168.11.34,192.168.11.35,TCP,74,7.103228,,,58640  >  6000 [SYN] Seq=0 Win=64240 Len=0 MSS=1460 SACK_PERM TSval=578084664 TSecr=0 WS=128
87,36.208541,192.168.11.35,192.168.11.34,TCP,74,0.008247,,,"6000  >  58640 [SYN, ACK] Seq=0 Ack=1 Win=65160 Len=0 MSS=1460 SACK_PERM TSval=967628493 TSecr=578084664 WS=128"
88,36.208653,192.168.11.34,192.168.11.35,TCP,66,0.000112,,,58640  >  6000 [ACK] Seq=1 Ack=1 Win=64256 Len=0 TSval=578084672 TSecr=967628493
89,36.20881,192.168.11.34,192.168.11.35,TCP,93,0.000157,,,"58640  >  6000 [PSH, ACK] Seq=1 Ack=1 Win=64256 Len=27 TSval=578084672 TSecr=967628493 [TCP segment of a reassembled PDU]"
90,36.208902,192.168.11.34,192.168.11.35,TCP,66,0.000092,,,"58640  >  6000 [FIN, ACK] Seq=28 Ack=1 Win=64256 Len=0 TSval=578084672 TSecr=967628493"
91,36.216076,192.168.11.35,192.168.11.34,TCP,66,0.007174,,,6000  >  58640 [ACK] Seq=1 Ack=28 Win=65152 Len=0 TSval=967628502 TSecr=578084672
92,36.216448,192.168.11.35,192.168.11.34,TCP,66,0.000372,,,"6000  >  58640 [FIN, ACK] Seq=1 Ack=29 Win=65152 Len=0 TSval=967628503 TSecr=578084672"
93,36.216494,192.168.11.34,192.168.11.35,TCP,66,0.000046,,,58640  >  6000 [ACK] Seq=29 Ack=2 Win=64256 Len=0 TSval=578084680 TSecr=967628503
94,36.246436,192.168.11.34,255.255.255.255,UDP,209,0.029942,Ÿ,7b2273656d616e74696373223a207b22656e74697479223a2022504944222c202262617365656e74697479223a2022616e79222c2022726f6c65223a2022313131222c20227370617469616c223a2022616e79222c202274656d706f72616c223a2022616e79227d2c20226461746170726f7065727479223a207b22666f726d6174223a2022696e616f6b615f70726f6772616d5f73616d706c655f73656d616e746963227d7d,60045  >  7000 Len=167
95,36.254208,192.168.11.6,192.168.11.34,TCP,74,0.007772,œ,,43670  >  6000 [SYN] Seq=0 Win=64240 Len=0 MSS=1460 SACK_PERM TSval=1346045833 TSecr=0 WS=128
96,36.254357,192.168.11.34,192.168.11.6,TCP,74,0.000149,,,"6000  >  43670 [SYN, ACK] Seq=0 Ack=1 Win=65160 Len=0 MSS=1460 SACK_PERM TSval=3961128125 TSecr=1346045833 WS=128"
97,36.261454,192.168.11.6,192.168.11.34,TCP,66,0.007097,,,43670  >  6000 [ACK] Seq=1 Ack=1 Win=64256 Len=0 TSval=1346045840 TSecr=3961128125
98,36.262074,192.168.11.6,192.168.11.34,TCP,93,0.00062,,,"43670  >  6000 [PSH, ACK] Seq=1 Ack=1 Win=64256 Len=27 TSval=1346045841 TSecr=3961128125 [TCP segment of a reassembled PDU]"
99,36.262187,192.168.11.34,192.168.11.6,TCP,66,0.000113,,,6000  >  43670 [ACK] Seq=1 Ack=28 Win=65152 Len=0 TSval=3961128132 TSecr=1346045841
100,36.262345,192.168.11.6,192.168.11.34,TCP,66,0.000158,,,"43670  >  6000 [FIN, ACK] Seq=28 Ack=1 Win=64256 Len=0 TSval=1346045841 TSecr=3961128125"
101,36.26366,192.168.11.34,192.168.11.6,TCP,66,0.001315,,,"6000  >  43670 [FIN, ACK] Seq=1 Ack=29 Win=65152 Len=0 TSval=3961128134 TSecr=1346045841"
102,36.269842,192.168.11.6,192.168.11.34,TCP,66,0.006182,,,43670  >  6000 [ACK] Seq=29 Ack=2 Win=64256 Len=0 TSval=1346045849 TSecr=3961128134
103,43.401919,192.168.11.34,192.168.11.35,TCP,74,7.132077,,,60390  >  6000 [SYN] Seq=0 Win=64240 Len=0 MSS=1460 SACK_PERM TSval=578091865 TSecr=0 WS=128
104,43.409479,192.168.11.35,192.168.11.34,TCP,74,0.00756,,,"6000  >  60390 [SYN, ACK] Seq=0 Ack=1 Win=65160 Len=0 MSS=1460 SACK_PERM TSval=967635695 TSecr=578091865 WS=128"
105,43.409587,192.168.11.34,192.168.11.35,TCP,66,0.000108,,,60390  >  6000 [ACK] Seq=1 Ack=1 Win=64256 Len=0 TSval=578091873 TSecr=967635695
106,43.409726,192.168.11.34,192.168.11.35,TCP,93,0.000139,,,"60390  >  6000 [PSH, ACK] Seq=1 Ack=1 Win=64256 Len=27 TSval=578091873 TSecr=967635695 [TCP segment of a reassembled PDU]"
107,43.409839,192.168.11.34,192.168.11.35,TCP,66,0.000113,,,"60390  >  6000 [FIN, ACK] Seq=28 Ack=1 Win=64256 Len=0 TSval=578091873 TSecr=967635695"
108,43.417519,192.168.11.35,192.168.11.34,TCP,66,0.00768,,,6000  >  60390 [ACK] Seq=1 Ack=28 Win=65152 Len=0 TSval=967635703 TSecr=578091873
109,43.417737,192.168.11.35,192.168.11.34,TCP,66,0.000218,,,"6000  >  60390 [FIN, ACK] Seq=1 Ack=29 Win=65152 Len=0 TSval=967635704 TSecr=578091873"
110,43.417789,192.168.11.34,192.168.11.35,TCP,66,0.000052,,,60390  >  6000 [ACK] Seq=29 Ack=2 Win=64256 Len=0 TSval=578091881 TSecr=967635704
111,43.447582,192.168.11.34,255.255.255.255,UDP,209,0.029793,Ÿ,7b2273656d616e74696373223a207b22656e74697479223a2022504944222c202262617365656e74697479223a2022616e79222c2022726f6c65223a2022313131222c20227370617469616c223a2022616e79222c202274656d706f72616c223a2022616e79227d2c20226461746170726f7065727479223a207b22666f726d6174223a2022696e616f6b615f70726f6772616d5f73616d706c655f73656d616e746963227d7d,34900  >  7000 Len=167
112,43.455236,192.168.11.6,192.168.11.34,TCP,74,0.007654,œ,,43856  >  6000 [SYN] Seq=0 Win=64240 Len=0 MSS=1460 SACK_PERM TSval=1346053034 TSecr=0 WS=128
113,43.455385,192.168.11.34,192.168.11.6,TCP,74,0.000149,,,"6000  >  43856 [SYN, ACK] Seq=0 Ack=1 Win=65160 Len=0 MSS=1460 SACK_PERM TSval=3961135326 TSecr=1346053034 WS=128"
114,43.46987,192.168.11.6,192.168.11.34,TCP,66,0.014485,,,43856  >  6000 [ACK] Seq=1 Ack=1 Win=64256 Len=0 TSval=1346053041 TSecr=3961135326
115,43.470449,192.168.11.6,192.168.11.34,TCP,93,0.000579,,,"43856  >  6000 [PSH, ACK] Seq=1 Ack=1 Win=64256 Len=27 TSval=1346053041 TSecr=3961135326 [TCP segment of a reassembled PDU]"
116,43.470518,192.168.11.34,192.168.11.6,TCP,66,0.000069,,,6000  >  43856 [ACK] Seq=1 Ack=28 Win=65152 Len=0 TSval=3961135341 TSecr=1346053041
117,43.470576,192.168.11.6,192.168.11.34,TCP,66,0.000058,,,"43856  >  6000 [FIN, ACK] Seq=28 Ack=1 Win=64256 Len=0 TSval=1346053041 TSecr=3961135326"
118,43.471938,192.168.11.34,192.168.11.6,TCP,66,0.001362,,,"6000  >  43856 [FIN, ACK] Seq=1 Ack=29 Win=65152 Len=0 TSval=3961135342 TSecr=1346053041"
119,43.477626,192.168.11.6,192.168.11.34,TCP,66,0.005688,,,43856  >  6000 [ACK] Seq=29 Ack=2 Win=64256 Len=0 TSval=1346053056 TSecr=3961135342
120,50.60407,192.168.11.34,192.168.11.35,TCP,74,7.126444,,,50992  >  6000 [SYN] Seq=0 Win=64240 Len=0 MSS=1460 SACK_PERM TSval=578099067 TSecr=0 WS=128
121,50.610694,192.168.11.35,192.168.11.34,TCP,74,0.006624,,,"6000  >  50992 [SYN, ACK] Seq=0 Ack=1 Win=65160 Len=0 MSS=1460 SACK_PERM TSval=967642896 TSecr=578099067 WS=128"
122,50.610801,192.168.11.34,192.168.11.35,TCP,66,0.000107,,,50992  >  6000 [ACK] Seq=1 Ack=1 Win=64256 Len=0 TSval=578099074 TSecr=967642896
123,50.610996,192.168.11.34,192.168.11.35,TCP,93,0.000195,,,"50992  >  6000 [PSH, ACK] Seq=1 Ack=1 Win=64256 Len=27 TSval=578099074 TSecr=967642896 [TCP segment of a reassembled PDU]"
124,50.611091,192.168.11.34,192.168.11.35,TCP,66,0.000095,,,"50992  >  6000 [FIN, ACK] Seq=28 Ack=1 Win=64256 Len=0 TSval=578099074 TSecr=967642896"
125,50.618553,192.168.11.35,192.168.11.34,TCP,66,0.007462,,,6000  >  50992 [ACK] Seq=1 Ack=28 Win=65152 Len=0 TSval=967642903 TSecr=578099074
126,50.618993,192.168.11.35,192.168.11.34,TCP,66,0.00044,,,"6000  >  50992 [FIN, ACK] Seq=1 Ack=29 Win=65152 Len=0 TSval=967642905 TSecr=578099074"
127,50.619042,192.168.11.34,192.168.11.35,TCP,66,0.000049,,,50992  >  6000 [ACK] Seq=29 Ack=2 Win=64256 Len=0 TSval=578099082 TSecr=967642905
128,50.64768,192.168.11.34,255.255.255.255,UDP,209,0.028638,Ÿ,7b2273656d616e74696373223a207b22656e74697479223a2022504944222c202262617365656e74697479223a2022616e79222c2022726f6c65223a2022313131222c20227370617469616c223a2022616e79222c202274656d706f72616c223a2022616e79227d2c20226461746170726f7065727479223a207b22666f726d6174223a2022696e616f6b615f70726f6772616d5f73616d706c655f73656d616e746963227d7d,39122  >  7000 Len=167
129,50.655593,192.168.11.6,192.168.11.34,TCP,74,0.007913,œ,,44348  >  6000 [SYN] Seq=0 Win=64240 Len=0 MSS=1460 SACK_PERM TSval=1346060234 TSecr=0 WS=128
130,50.655739,192.168.11.34,192.168.11.6,TCP,74,0.000146,,,"6000  >  44348 [SYN, ACK] Seq=0 Ack=1 Win=65160 Len=0 MSS=1460 SACK_PERM TSval=3961142526 TSecr=1346060234 WS=128"
131,50.662652,192.168.11.6,192.168.11.34,TCP,66,0.006913,,,44348  >  6000 [ACK] Seq=1 Ack=1 Win=64256 Len=0 TSval=1346060241 TSecr=3961142526
132,50.663302,192.168.11.6,192.168.11.34,TCP,93,0.00065,,,"44348  >  6000 [PSH, ACK] Seq=1 Ack=1 Win=64256 Len=27 TSval=1346060241 TSecr=3961142526 [TCP segment of a reassembled PDU]"
133,50.663429,192.168.11.34,192.168.11.6,TCP,66,0.000127,,,6000  >  44348 [ACK] Seq=1 Ack=28 Win=65152 Len=0 TSval=3961142534 TSecr=1346060241
134,50.663514,192.168.11.6,192.168.11.34,TCP,66,0.000085,,,"44348  >  6000 [FIN, ACK] Seq=28 Ack=1 Win=64256 Len=0 TSval=1346060241 TSecr=3961142526"
135,50.66494,192.168.11.34,192.168.11.6,TCP,66,0.001426,,,"6000  >  44348 [FIN, ACK] Seq=1 Ack=29 Win=65152 Len=0 TSval=3961142535 TSecr=1346060241"
136,50.673951,192.168.11.6,192.168.11.34,TCP,66,0.009011,,,44348  >  6000 [ACK] Seq=29 Ack=2 Win=64256 Len=0 TSval=1346060252 TSecr=3961142535
137,57.751663,192.168.11.34,192.168.11.35,TCP,74,7.077712,,,46862  >  6000 [SYN] Seq=0 Win=64240 Len=0 MSS=1460 SACK_PERM TSval=578106215 TSecr=0 WS=128
138,57.758387,192.168.11.35,192.168.11.34,TCP,74,0.006724,,,"6000  >  46862 [SYN, ACK] Seq=0 Ack=1 Win=65160 Len=0 MSS=1460 SACK_PERM TSval=967650043 TSecr=578106215 WS=128"
139,57.758497,192.168.11.34,192.168.11.35,TCP,66,0.00011,,,46862  >  6000 [ACK] Seq=1 Ack=1 Win=64256 Len=0 TSval=578106222 TSecr=967650043
140,57.758668,192.168.11.34,192.168.11.35,TCP,93,0.000171,,,"46862  >  6000 [PSH, ACK] Seq=1 Ack=1 Win=64256 Len=27 TSval=578106222 TSecr=967650043 [TCP segment of a reassembled PDU]"
141,57.75879,192.168.11.34,192.168.11.35,TCP,66,0.000122,,,"46862  >  6000 [FIN, ACK] Seq=28 Ack=1 Win=64256 Len=0 TSval=578106222 TSecr=967650043"
142,57.766135,192.168.11.35,192.168.11.34,TCP,66,0.007345,,,6000  >  46862 [ACK] Seq=1 Ack=28 Win=65152 Len=0 TSval=967650051 TSecr=578106222
143,57.766341,192.168.11.35,192.168.11.34,TCP,66,0.000206,,,"6000  >  46862 [FIN, ACK] Seq=1 Ack=29 Win=65152 Len=0 TSval=967650052 TSecr=578106222"
144,57.766387,192.168.11.34,192.168.11.35,TCP,66,0.000046,,,46862  >  6000 [ACK] Seq=29 Ack=2 Win=64256 Len=0 TSval=578106230 TSecr=967650052
145,57.79975,192.168.11.34,255.255.255.255,UDP,209,0.033363,Ÿ,7b2273656d616e74696373223a207b22656e74697479223a2022504944222c202262617365656e74697479223a2022616e79222c2022726f6c65223a2022313131222c20227370617469616c223a2022616e79222c202274656d706f72616c223a2022616e79227d2c20226461746170726f7065727479223a207b22666f726d6174223a2022696e616f6b615f70726f6772616d5f73616d706c655f73656d616e746963227d7d,44657  >  7000 Len=167
146,57.807753,192.168.11.6,192.168.11.34,TCP,74,0.008003,œ,,44358  >  6000 [SYN] Seq=0 Win=64240 Len=0 MSS=1460 SACK_PERM TSval=1346067386 TSecr=0 WS=128
147,57.807913,192.168.11.34,192.168.11.6,TCP,74,0.00016,,,"6000  >  44358 [SYN, ACK] Seq=0 Ack=1 Win=65160 Len=0 MSS=1460 SACK_PERM TSval=3961149678 TSecr=1346067386 WS=128"
148,57.81483,192.168.11.6,192.168.11.34,TCP,66,0.006917,,,44358  >  6000 [ACK] Seq=1 Ack=1 Win=64256 Len=0 TSval=1346067393 TSecr=3961149678
149,57.81553,192.168.11.6,192.168.11.34,TCP,93,0.0007,,,"44358  >  6000 [PSH, ACK] Seq=1 Ack=1 Win=64256 Len=27 TSval=1346067393 TSecr=3961149678 [TCP segment of a reassembled PDU]"
150,57.815621,192.168.11.34,192.168.11.6,TCP,66,0.000091,,,6000  >  44358 [ACK] Seq=1 Ack=28 Win=65152 Len=0 TSval=3961149686 TSecr=1346067393
151,57.8157,192.168.11.6,192.168.11.34,TCP,66,0.000079,,,"44358  >  6000 [FIN, ACK] Seq=28 Ack=1 Win=64256 Len=0 TSval=1346067393 TSecr=3961149678"
152,57.817061,192.168.11.34,192.168.11.6,TCP,66,0.001361,,,"6000  >  44358 [FIN, ACK] Seq=1 Ack=29 Win=65152 Len=0 TSval=3961149687 TSecr=1346067393"
153,57.822403,192.168.11.6,192.168.11.34,TCP,66,0.005342,,,44358  >  6000 [ACK] Seq=29 Ack=2 Win=64256 Len=0 TSval=1346067401 TSecr=3961149687
154,64.887148,192.168.11.34,192.168.11.35,TCP,74,7.064745,,,46872  >  6000 [SYN] Seq=0 Win=64240 Len=0 MSS=1460 SACK_PERM TSval=578113350 TSecr=0 WS=128
155,64.894037,192.168.11.35,192.168.11.34,TCP,74,0.006889,,,"6000  >  46872 [SYN, ACK] Seq=0 Ack=1 Win=65160 Len=0 MSS=1460 SACK_PERM TSval=967657178 TSecr=578113350 WS=128"
156,64.894144,192.168.11.34,192.168.11.35,TCP,66,0.000107,,,46872  >  6000 [ACK] Seq=1 Ack=1 Win=64256 Len=0 TSval=578113357 TSecr=967657178
157,64.89432,192.168.11.34,192.168.11.35,TCP,93,0.000176,,,"46872  >  6000 [PSH, ACK] Seq=1 Ack=1 Win=64256 Len=27 TSval=578113358 TSecr=967657178 [TCP segment of a reassembled PDU]"
158,64.894444,192.168.11.34,192.168.11.35,TCP,66,0.000124,,,"46872  >  6000 [FIN, ACK] Seq=28 Ack=1 Win=64256 Len=0 TSval=578113358 TSecr=967657178"
159,64.911196,192.168.11.35,192.168.11.34,TCP,66,0.016752,,,6000  >  46872 [ACK] Seq=1 Ack=28 Win=65152 Len=0 TSval=967657196 TSecr=578113358
160,64.913769,192.168.11.35,192.168.11.34,TCP,66,0.002573,,,"6000  >  46872 [FIN, ACK] Seq=1 Ack=29 Win=65152 Len=0 TSval=967657198 TSecr=578113358"
161,64.913816,192.168.11.34,192.168.11.35,TCP,66,0.000047,,,46872  >  6000 [ACK] Seq=29 Ack=2 Win=64256 Len=0 TSval=578113377 TSecr=967657198
162,64.942305,192.168.11.34,255.255.255.255,UDP,209,0.028489,Ÿ,7b2273656d616e74696373223a207b22656e74697479223a2022504944222c202262617365656e74697479223a2022616e79222c2022726f6c65223a2022313131222c20227370617469616c223a2022616e79222c202274656d706f72616c223a2022616e79227d2c20226461746170726f7065727479223a207b22666f726d6174223a2022696e616f6b615f70726f6772616d5f73616d706c655f73656d616e746963227d7d,58336  >  7000 Len=167
163,64.949756,192.168.11.6,192.168.11.34,TCP,74,0.007451,œ,,47220  >  6000 [SYN] Seq=0 Win=64240 Len=0 MSS=1460 SACK_PERM TSval=1346074528 TSecr=0 WS=128
164,64.949885,192.168.11.34,192.168.11.6,TCP,74,0.000129,,,"6000  >  47220 [SYN, ACK] Seq=0 Ack=1 Win=65160 Len=0 MSS=1460 SACK_PERM TSval=3961156820 TSecr=1346074528 WS=128"
165,64.95652,192.168.11.6,192.168.11.34,TCP,66,0.006635,,,47220  >  6000 [ACK] Seq=1 Ack=1 Win=64256 Len=0 TSval=1346074534 TSecr=3961156820
166,64.9571,192.168.11.6,192.168.11.34,TCP,93,0.00058,,,"47220  >  6000 [PSH, ACK] Seq=1 Ack=1 Win=64256 Len=27 TSval=1346074535 TSecr=3961156820 [TCP segment of a reassembled PDU]"
167,64.957236,192.168.11.34,192.168.11.6,TCP,66,0.000136,,,6000  >  47220 [ACK] Seq=1 Ack=28 Win=65152 Len=0 TSval=3961156827 TSecr=1346074535
168,64.957434,192.168.11.6,192.168.11.34,TCP,66,0.000198,,,"47220  >  6000 [FIN, ACK] Seq=28 Ack=1 Win=64256 Len=0 TSval=1346074535 TSecr=3961156820"
169,64.958657,192.168.11.34,192.168.11.6,TCP,66,0.001223,,,"6000  >  47220 [FIN, ACK] Seq=1 Ack=29 Win=65152 Len=0 TSval=3961156829 TSecr=1346074535"
170,64.96467,192.168.11.6,192.168.11.34,TCP,66,0.006013,,,47220  >  6000 [ACK] Seq=29 Ack=2 Win=64256 Len=0 TSval=1346074542 TSecr=3961156829
171,110.568938,192.168.11.34,192.168.11.35,TCP,74,45.604268,,,41944  >  6000 [SYN] Seq=0 Win=64240 Len=0 MSS=1460 SACK_PERM TSval=578159032 TSecr=0 WS=128
172,110.576088,192.168.11.35,192.168.11.34,TCP,74,0.00715,,,"6000  >  41944 [SYN, ACK] Seq=0 Ack=1 Win=65160 Len=0 MSS=1460 SACK_PERM TSval=967702858 TSecr=578159032 WS=128"
173,110.576202,192.168.11.34,192.168.11.35,TCP,66,0.000114,,,41944  >  6000 [ACK] Seq=1 Ack=1 Win=64256 Len=0 TSval=578159039 TSecr=967702858
174,110.576352,192.168.11.34,192.168.11.35,TCP,93,0.00015,,,"41944  >  6000 [PSH, ACK] Seq=1 Ack=1 Win=64256 Len=27 TSval=578159040 TSecr=967702858 [TCP segment of a reassembled PDU]"
175,110.576462,192.168.11.34,192.168.11.35,TCP,66,0.00011,,,"41944  >  6000 [FIN, ACK] Seq=28 Ack=1 Win=64256 Len=0 TSval=578159040 TSecr=967702858"
176,110.583588,192.168.11.35,192.168.11.34,TCP,66,0.007126,,,6000  >  41944 [ACK] Seq=1 Ack=28 Win=65152 Len=0 TSval=967702866 TSecr=578159040
177,110.583945,192.168.11.35,192.168.11.34,TCP,66,0.000357,,,"6000  >  41944 [FIN, ACK] Seq=1 Ack=29 Win=65152 Len=0 TSval=967702867 TSecr=578159040"
178,110.583994,192.168.11.34,192.168.11.35,TCP,66,0.000049,,,41944  >  6000 [ACK] Seq=29 Ack=2 Win=64256 Len=0 TSval=578159047 TSecr=967702867
179,110.612013,192.168.11.34,255.255.255.255,UDP,209,0.028019,Ÿ,7b2273656d616e74696373223a207b22656e74697479223a2022504944222c202262617365656e74697479223a2022616e79222c2022726f6c65223a2022313131222c20227370617469616c223a2022616e79222c202274656d706f72616c223a2022616e79227d2c20226461746170726f7065727479223a207b22666f726d6174223a2022696e616f6b615f70726f6772616d5f73616d706c655f73656d616e746963227d7d,49996  >  7000 Len=167
180,110.619734,192.168.11.6,192.168.11.34,TCP,74,0.007721,œ,,42322  >  6000 [SYN] Seq=0 Win=64240 Len=0 MSS=1460 SACK_PERM TSval=1346120196 TSecr=0 WS=128
181,110.619907,192.168.11.34,192.168.11.6,TCP,74,0.000173,,,"6000  >  42322 [SYN, ACK] Seq=0 Ack=1 Win=65160 Len=0 MSS=1460 SACK_PERM TSval=3961202490 TSecr=1346120196 WS=128"
182,110.633663,192.168.11.6,192.168.11.34,TCP,66,0.013756,,,42322  >  6000 [ACK] Seq=1 Ack=1 Win=64256 Len=0 TSval=1346120202 TSecr=3961202490
183,110.634148,192.168.11.6,192.168.11.34,TCP,93,0.000485,,,"42322  >  6000 [PSH, ACK] Seq=1 Ack=1 Win=64256 Len=27 TSval=1346120203 TSecr=3961202490 [TCP segment of a reassembled PDU]"
184,110.634213,192.168.11.34,192.168.11.6,TCP,66,0.000065,,,6000  >  42322 [ACK] Seq=1 Ack=28 Win=65152 Len=0 TSval=3961202504 TSecr=1346120203
185,110.634299,192.168.11.6,192.168.11.34,TCP,66,0.000086,,,"42322  >  6000 [FIN, ACK] Seq=28 Ack=1 Win=64256 Len=0 TSval=1346120203 TSecr=3961202490"
186,110.635055,192.168.11.34,192.168.11.6,TCP,66,0.000756,,,"6000  >  42322 [FIN, ACK] Seq=1 Ack=29 Win=65152 Len=0 TSval=3961202505 TSecr=1346120203"
187,110.641735,192.168.11.6,192.168.11.34,TCP,66,0.00668,,,42322  >  6000 [ACK] Seq=29 Ack=2 Win=64256 Len=0 TSval=1346120217 TSecr=3961202505
188,117.735132,192.168.11.34,192.168.11.35,TCP,74,7.093397,,,37996  >  6000 [SYN] Seq=0 Win=64240 Len=0 MSS=1460 SACK_PERM TSval=578166198 TSecr=0 WS=128
189,117.7444,192.168.11.35,192.168.11.34,TCP,74,0.009268,,,"6000  >  37996 [SYN, ACK] Seq=0 Ack=1 Win=65160 Len=0 MSS=1460 SACK_PERM TSval=967710024 TSecr=578166198 WS=128"
190,117.744505,192.168.11.34,192.168.11.35,TCP,66,0.000105,,,37996  >  6000 [ACK] Seq=1 Ack=1 Win=64256 Len=0 TSval=578166208 TSecr=967710024
191,117.744692,192.168.11.34,192.168.11.35,TCP,93,0.000187,,,"37996  >  6000 [PSH, ACK] Seq=1 Ack=1 Win=64256 Len=27 TSval=578166208 TSecr=967710024 [TCP segment of a reassembled PDU]"
192,117.744785,192.168.11.34,192.168.11.35,TCP,66,0.000093,,,"37996  >  6000 [FIN, ACK] Seq=28 Ack=1 Win=64256 Len=0 TSval=578166208 TSecr=967710024"
193,117.752126,192.168.11.35,192.168.11.34,TCP,66,0.007341,,,6000  >  37996 [ACK] Seq=1 Ack=28 Win=65152 Len=0 TSval=967710034 TSecr=578166208
194,117.752373,192.168.11.35,192.168.11.34,TCP,66,0.000247,,,"6000  >  37996 [FIN, ACK] Seq=1 Ack=29 Win=65152 Len=0 TSval=967710035 TSecr=578166208"
195,117.752427,192.168.11.34,192.168.11.35,TCP,66,0.000054,,,37996  >  6000 [ACK] Seq=29 Ack=2 Win=64256 Len=0 TSval=578166216 TSecr=967710035
196,117.781156,192.168.11.34,255.255.255.255,UDP,209,0.028729,Ÿ,7b2273656d616e74696373223a207b22656e74697479223a2022504944222c202262617365656e74697479223a2022616e79222c2022726f6c65223a2022313131222c20227370617469616c223a2022616e79222c202274656d706f72616c223a2022616e79227d2c20226461746170726f7065727479223a207b22666f726d6174223a2022696e616f6b615f70726f6772616d5f73616d706c655f73656d616e746963227d7d,58065  >  7000 Len=167
197,117.789225,192.168.11.6,192.168.11.34,TCP,74,0.008069,œ,,42324  >  6000 [SYN] Seq=0 Win=64240 Len=0 MSS=1460 SACK_PERM TSval=1346127365 TSecr=0 WS=128
198,117.789364,192.168.11.34,192.168.11.6,TCP,74,0.000139,,,"6000  >  42324 [SYN, ACK] Seq=0 Ack=1 Win=65160 Len=0 MSS=1460 SACK_PERM TSval=3961209660 TSecr=1346127365 WS=128"
199,117.796561,192.168.11.6,192.168.11.34,TCP,66,0.007197,,,42324  >  6000 [ACK] Seq=1 Ack=1 Win=64256 Len=0 TSval=1346127372 TSecr=3961209660
200,117.797224,192.168.11.6,192.168.11.34,TCP,93,0.000663,,,"42324  >  6000 [PSH, ACK] Seq=1 Ack=1 Win=64256 Len=27 TSval=1346127372 TSecr=3961209660 [TCP segment of a reassembled PDU]"
201,117.797312,192.168.11.34,192.168.11.6,TCP,66,0.000088,,,6000  >  42324 [ACK] Seq=1 Ack=28 Win=65152 Len=0 TSval=3961209668 TSecr=1346127372
202,117.797496,192.168.11.6,192.168.11.34,TCP,66,0.000184,,,"42324  >  6000 [FIN, ACK] Seq=28 Ack=1 Win=64256 Len=0 TSval=1346127372 TSecr=3961209660"
203,117.798953,192.168.11.34,192.168.11.6,TCP,66,0.001457,,,"6000  >  42324 [FIN, ACK] Seq=1 Ack=29 Win=65152 Len=0 TSval=3961209669 TSecr=1346127372"
204,117.804597,192.168.11.6,192.168.11.34,TCP,66,0.005644,,,42324  >  6000 [ACK] Seq=29 Ack=2 Win=64256 Len=0 TSval=1346127380 TSecr=3961209669
205,124.979562,192.168.11.34,192.168.11.35,TCP,74,7.174965,,,37998  >  6000 [SYN] Seq=0 Win=64240 Len=0 MSS=1460 SACK_PERM TSval=578173443 TSecr=0 WS=128
206,124.986572,192.168.11.35,192.168.11.34,TCP,74,0.00701,,,"6000  >  37998 [SYN, ACK] Seq=0 Ack=1 Win=65160 Len=0 MSS=1460 SACK_PERM TSval=967717268 TSecr=578173443 WS=128"
207,124.986682,192.168.11.34,192.168.11.35,TCP,66,0.00011,,,37998  >  6000 [ACK] Seq=1 Ack=1 Win=64256 Len=0 TSval=578173450 TSecr=967717268
208,124.986855,192.168.11.34,192.168.11.35,TCP,93,0.000173,,,"37998  >  6000 [PSH, ACK] Seq=1 Ack=1 Win=64256 Len=27 TSval=578173450 TSecr=967717268 [TCP segment of a reassembled PDU]"
209,124.986974,192.168.11.34,192.168.11.35,TCP,66,0.000119,,,"37998  >  6000 [FIN, ACK] Seq=28 Ack=1 Win=64256 Len=0 TSval=578173450 TSecr=967717268"
210,124.994277,192.168.11.35,192.168.11.34,TCP,66,0.007303,,,6000  >  37998 [ACK] Seq=1 Ack=28 Win=65152 Len=0 TSval=967717276 TSecr=578173450
211,124.994487,192.168.11.35,192.168.11.34,TCP,66,0.00021,,,"6000  >  37998 [FIN, ACK] Seq=1 Ack=29 Win=65152 Len=0 TSval=967717277 TSecr=578173450"
212,124.994531,192.168.11.34,192.168.11.35,TCP,66,0.000044,,,37998  >  6000 [ACK] Seq=29 Ack=2 Win=64256 Len=0 TSval=578173458 TSecr=967717277
213,125.024724,192.168.11.34,255.255.255.255,UDP,209,0.030193,Ÿ,7b2273656d616e74696373223a207b22656e74697479223a2022504944222c202262617365656e74697479223a2022616e79222c2022726f6c65223a2022313131222c20227370617469616c223a2022616e79222c202274656d706f72616c223a2022616e79227d2c20226461746170726f7065727479223a207b22666f726d6174223a2022696e616f6b615f70726f6772616d5f73616d706c655f73656d616e746963227d7d,44624  >  7000 Len=167
214,125.032799,192.168.11.6,192.168.11.34,TCP,74,0.008075,œ,,50108  >  6000 [SYN] Seq=0 Win=64240 Len=0 MSS=1460 SACK_PERM TSval=1346134608 TSecr=0 WS=128
215,125.03296,192.168.11.34,192.168.11.6,TCP,74,0.000161,,,"6000  >  50108 [SYN, ACK] Seq=0 Ack=1 Win=65160 Len=0 MSS=1460 SACK_PERM TSval=3961216903 TSecr=1346134608 WS=128"
216,125.039679,192.168.11.6,192.168.11.34,TCP,66,0.006719,,,50108  >  6000 [ACK] Seq=1 Ack=1 Win=64256 Len=0 TSval=1346134615 TSecr=3961216903
217,125.040331,192.168.11.6,192.168.11.34,TCP,93,0.000652,,,"50108  >  6000 [PSH, ACK] Seq=1 Ack=1 Win=64256 Len=27 TSval=1346134615 TSecr=3961216903 [TCP segment of a reassembled PDU]"
218,125.04044,192.168.11.34,192.168.11.6,TCP,66,0.000109,,,6000  >  50108 [ACK] Seq=1 Ack=28 Win=65152 Len=0 TSval=3961216911 TSecr=1346134615
219,125.040525,192.168.11.6,192.168.11.34,TCP,66,0.000085,,,"50108  >  6000 [FIN, ACK] Seq=28 Ack=1 Win=64256 Len=0 TSval=1346134615 TSecr=3961216903"
220,125.042011,192.168.11.34,192.168.11.6,TCP,66,0.001486,,,"6000  >  50108 [FIN, ACK] Seq=1 Ack=29 Win=65152 Len=0 TSval=3961216912 TSecr=1346134615"
221,125.047108,192.168.11.6,192.168.11.34,TCP,66,0.005097,,,50108  >  6000 [ACK] Seq=29 Ack=2 Win=64256 Len=0 TSval=1346134623 TSecr=3961216912
222,132.15089,192.168.11.34,192.168.11.35,TCP,74,7.103782,,,49790  >  6000 [SYN] Seq=0 Win=64240 Len=0 MSS=1460 SACK_PERM TSval=578180614 TSecr=0 WS=128
223,132.157911,192.168.11.35,192.168.11.34,TCP,74,0.007021,,,"6000  >  49790 [SYN, ACK] Seq=0 Ack=1 Win=65160 Len=0 MSS=1460 SACK_PERM TSval=967724439 TSecr=578180614 WS=128"
224,132.158029,192.168.11.34,192.168.11.35,TCP,66,0.000118,,,49790  >  6000 [ACK] Seq=1 Ack=1 Win=64256 Len=0 TSval=578180621 TSecr=967724439
225,132.158201,192.168.11.34,192.168.11.35,TCP,93,0.000172,,,"49790  >  6000 [PSH, ACK] Seq=1 Ack=1 Win=64256 Len=27 TSval=578180621 TSecr=967724439 [TCP segment of a reassembled PDU]"
226,132.158292,192.168.11.34,192.168.11.35,TCP,66,0.000091,,,"49790  >  6000 [FIN, ACK] Seq=28 Ack=1 Win=64256 Len=0 TSval=578180622 TSecr=967724439"
227,132.16561,192.168.11.35,192.168.11.34,TCP,66,0.007318,,,6000  >  49790 [ACK] Seq=1 Ack=28 Win=65152 Len=0 TSval=967724447 TSecr=578180621
228,132.165844,192.168.11.35,192.168.11.34,TCP,66,0.000234,,,"6000  >  49790 [FIN, ACK] Seq=1 Ack=29 Win=65152 Len=0 TSval=967724448 TSecr=578180622"
229,132.165905,192.168.11.34,192.168.11.35,TCP,66,0.000061,,,49790  >  6000 [ACK] Seq=29 Ack=2 Win=64256 Len=0 TSval=578180629 TSecr=967724448
230,132.196039,192.168.11.34,255.255.255.255,UDP,209,0.030134,Ÿ,7b2273656d616e74696373223a207b22656e74697479223a2022504944222c202262617365656e74697479223a2022616e79222c2022726f6c65223a2022313131222c20227370617469616c223a2022616e79222c202274656d706f72616c223a2022616e79227d2c20226461746170726f7065727479223a207b22666f726d6174223a2022696e616f6b615f70726f6772616d5f73616d706c655f73656d616e746963227d7d,37657  >  7000 Len=167
231,132.204451,192.168.11.6,192.168.11.34,TCP,74,0.008412,œ,,37698  >  6000 [SYN] Seq=0 Win=64240 Len=0 MSS=1460 SACK_PERM TSval=1346141779 TSecr=0 WS=128
232,132.204605,192.168.11.34,192.168.11.6,TCP,74,0.000154,,,"6000  >  37698 [SYN, ACK] Seq=0 Ack=1 Win=65160 Len=0 MSS=1460 SACK_PERM TSval=3961224075 TSecr=1346141779 WS=128"
233,132.217936,192.168.11.6,192.168.11.34,TCP,66,0.013331,,,37698  >  6000 [ACK] Seq=1 Ack=1 Win=64256 Len=0 TSval=1346141786 TSecr=3961224075
